title,link,description,bloggername,bloggerlink,postdate
홍성 -70년소머리국밥; 칼칼한 국물에 완벽한 국밥 그 자체,https://blog.naver.com/ekt23?Redirect=Log&logNo=221753764272,오늘은 홍성의 대표 소머리국밥 맛집 ' 70년소머리국밥 '에 다녀왔다. 이 곳 오픈 시간에 맞춰 아침부터 기차타고 내려온 홍성 70년의 세월이 만든 맛집 가격대는 다소 있는 편이다. 소머리국밥과 수육 소 주문... ,'부로콜리' 식도락의 기록,https://blog.naver.com/ekt23,2019-12-30
[홍성]신동엽 맛집 충남 홍성 맛집70년 소머리국밥 ,https://blog.naver.com/hippolight_dse?Redirect=Log&logNo=222039316796,맛집70년 소머리국밥홍성70년 소머리국밥가게를 찾아가는 길은 좀 험난했습니다. 길가에 자리를... 소머리국밥 아니면 수육 소머리국밥은 항상 빨간 육수로 나와요. 혹시나 하얀 육수를 원하시면 미리... ,아름답고 따듯한 세상을 만드는 디에스이,https://blog.naver.com/hippolight_dse,2020-08-03
(홍성 /70년소머리국밥 집) 빨간 소머리국밥,https://blog.naver.com/tisani?Redirect=Log&logNo=222390308387,홍성시장70년 소머리국밥항상 가던 홍흥집이 오픈 전이라 궁금하던70년 소머리국밥 집으로 가봤다... 이동네에선 다소 비싼 소머리국밥 가격인데 가격에 비해 다소 아쉬웠다.. 수육도.. 70년이라 기대가 너무... ,상교아빠는 ...ing,https://blog.naver.com/tisani,2021-06-08
홍성군 맛집70년 소머리 국밥(홍성맛집),https://blog.naver.com/9160234?Redirect=Log&logNo=221788174191,하면서 국밥 한그릇과 소주 한잔! 캬!!! 나도 검색해서 찾아갔던 홍성군 맛집70년 소머리 국밥 ! 지도... 이제 우린~~ 은 개인적으로 내 취향은 아니었음 ㅡㅡㅋ 나왔다 소머리 국밥!!!! 맛은!!! 만족!!!! 적당한... ,석스냅(Seok snap),https://blog.naver.com/9160234,2020-01-29
홍성70년 소머리국밥 집,https://blog.naver.com/dk486jh?Redirect=Log&logNo=222260456715,미식가 신동엽의 인생맛집이라고 해서 많은 기대를 했었는데 맛은 있었지만 너무 많은 기대는 안하고 가는게 좋을듯 해요^^ #홍성 맛집 # 홍성 소머리국밥 #홍성70년 소머리국밥#신동엽 맛집,☀️,https://blog.naver.com/dk486jh,2021-03-01
홍성에서 찐맛집 찾음 :70년 소머리국밥 ,https://blog.naver.com/76linear?Redirect=Log&logNo=222272717014, 소머리국밥 ! 여기야여기! 외치는 소리에 고개를 돌려보니 정말70년 동안 한 곳에 서있었을것같은 입간판 발견 정문이 있었넴... 원래 영업시간 평일 10~17시 주말 09~18시 코로나때매 평일엔 16시에 문 닫는다... ,"라인은 선, 브로는 형",https://blog.naver.com/76linear,2021-03-12
홍성70년 소머리국밥 ,https://blog.naver.com/yucira?Redirect=Log&logNo=222128660934,소머리국밥 엄청 좋아하시는거 아님 굳이 여기까지 와서 드실만한 맛도 가격도 아닌걸로 ㅎㅎ 그럼 20000! # 70년소머리국밥#홍성국밥 #홍성맛집 #국밥맛집 #소머리국밥 #소고기국밥 #연예인맛집,댕댕월드,https://blog.naver.com/yucira,2020-10-28
[강릉/중앙시장]70년전통소머리국밥'광덕식당',https://blog.naver.com/cks1688?Redirect=Log&logNo=222415100114,그런데 강릉 중앙시장에소머리국밥골목이 있네??? (강릉 그렇게 다녔는데 대부분 강릉 숙소에서 머물지 않고 양양에서 머물러서 ㅋ) 그렇다면 강릉의 맛 중에 하나가소머리 국밥 이란 것 아니겠는가. 그렇다면... ,- 견우별 The starseeker -,https://blog.naver.com/cks1688,2021-06-30
날씨 추울 땐70년소머리국밥 으로 한 그릇 뚝딱하세요,https://blog.naver.com/hsgstory?Redirect=Log&logNo=221415139078,이렇게 이정표가 있어서 따라가기만 하면 됩니다~ 홍성전통시장 국밥집 모여있는 곳에70년소머리국밥 도 있으니~가기는 쉬울 거예요! 이곳은 70년 어머니의 대를 이은.. 소머리국밥집입니다. 어머니의 대를 이은... ,함께하는 홍성이야기,https://blog.naver.com/hsgstory,2018-12-10
홍성 맛집 -70년소머리국밥 ,https://blog.naver.com/hsgstory?Redirect=Log&logNo=221425422693,이렇게 국밥집 옆 골목으로 들어오면 좌측에 작게 보이는 '70년' 보이시나요? 안쪽으로 더 들어가면...70년소머리국밥 집의 소머리국밥은 칼칼하고 개운한 맛이 납니다. 처음 몇 입 먹었을 땐 간이 약간 부족한 것... ,함께하는 홍성이야기,https://blog.naver.com/hsgstory,2018-12-24
새해 여행 :: 보령 천북굴단지 + 홍성70년소머리국밥:),https://blog.naver.com/ljy880319?Redirect=Log&logNo=221448860001,"그리고 주인공 소머리국밥까지 나오면 완벽한 새해 첫 끼 :) 홍성 맛집 /70년 소머리국밥후식으로는 홍성 시장에서 호떡도 먹구요, 로또 1등이 몇 번이나 나왔다는 명당에서 로또까지 사면 새해 첫날 스케줄은... ",연아나 뉴스클래스 :),https://blog.naver.com/ljy880319,2019-01-23
"오늘뭐먹지 홍성 맛집 -70년 소머리국밥 , 두번째 방문기",https://blog.naver.com/monnani100?Redirect=Log&logNo=220716088868,"오늘뭐먹지 홍성 맛집 -70년 소머리국밥, 두번째 방문기 지난 보령 대천여행의 마지막은 오늘뭐먹지... 요기 70년 전통의 소머리국밥집에가면 면 사리는 꼭 시켜야 함 ㅋㅋㅋㅋ 진한 사골국물에 담아주시는... ",살림다반사,https://blog.naver.com/monnani100,2016-05-22
홍성 재래시장 : 어머니 대를 이은70년 소머리국밥 ,https://blog.naver.com/thisnet1?Redirect=Log&logNo=221190959235,간단히 검색 후 의견일치로70년 소머리국밥 으로 콜~ . 거리도 그리 멀지않고 . 네비로 검색하니 상호와... 아구에 자반고등어 쭈꾸미가 살아 있어요 이곳에 소머리국밥집 형성되어 있고. 노란색 간판이 눈에... ,구보백리 (龜步百里) 당구삼백,https://blog.naver.com/thisnet1,2018-01-22
[충남/홍성]70년소머리국밥 ,https://blog.naver.com/hellomini486?Redirect=Log&logNo=221607249399,"당일치기 보령을 다녀오고, 집에 가는 길 배도 고프고 뭘 먹을까 하다가 홍성을 지나가는 길이라서 검색하여 다녀온 홍성 맛집으로 알려진70년소머리국밥 ! 사실 저는 소머리국밥을 지금까지 살면서 한 번도... ",헬로우미니 ᴴᴱᴸᴸᴼ ᴹᴵᴺᴵ,https://blog.naver.com/hellomini486,2019-08-06
홍성 맛집70년 소머리국밥 ,https://blog.naver.com/mbh0820?Redirect=Log&logNo=221453420258, 70년 소머리국밥 은 홍성에서도 유명한 시장표 국밥집이다. 듬직한 보스 반찬은 조촐하지만 국밥에 다른... 어머니 대를 이은 70년 국밥 와이프한테 나 국밥 먹으러 홍성 또 올 거야 했더니 피식 웃는다. 웃어?... ,완벽해지고 싶은 남자,https://blog.naver.com/mbh0820,2019-01-29
홍성70년 소머리 국밥20170121,https://blog.naver.com/catchbug?Redirect=Log&logNo=220917181189,"항상 주말이 되면 가고 싶었지만 숙취땜에 가지 못했던, 홍성70년 소머리 국밥 을 먹으러 갔다. 네비가... 메뉴는 국밥과 수육 주문. 신동엽은 맛있는 가게에는 '맛있다'는 멘트를, 맛 없는 가게에는 다른 멘트를... ",프로그래머의 기록,https://blog.naver.com/catchbug,2017-01-22
홍성 전통시장내70년 소머리국밥 집,https://blog.naver.com/toto2411?Redirect=Log&logNo=90170782273,국밥집들이 쭈우욱 보이는데 그중 눈에 띄는70년 소머리 국밥 집 슬마~~ 70년된 소머리로 만든 국밥집은 아니겄지 ㅋㅋㅋㅋㅋㅋ 다행히 70년된 소머리는 아니고 어머니때부터 70년간 대를 이어 오고 있다는 집... ,소소한일상 소박한 행복,https://blog.naver.com/toto2411,2013-04-08
"난 줄서서 먹지 않았다, 홍성 70년 소머리국밥/ 매콤",https://blog.naver.com/ghkdud1420?Redirect=Log&logNo=221442983083,유독 소머리국밥이 유명한 홍성전통시장이지만 난 아직 애기입맛인지 소머리국밥보단 순대국밥이 더... 난 만약 게스트하우스 손님들이 홍성 맛집 추천해달라고 한다면70년 소머리국밥 집 추천해줄 것이다.... ,키톡이 그린 저녁여행,https://blog.naver.com/ghkdud1420,2019-01-15
"신동엽,성시경은 오늘 뭐먹지? (홍성특집!)70년 소머리 국밥 !",https://blog.naver.com/god794216?Redirect=Log&logNo=220840639927,"ㅎ 소머리 국밥? 이런건 잘 몰랐는데 신동엽,성시경은 오늘 뭐먹지? 열성 팬이자 열성 시청자이진 우리... 이70년 소머리국밥집 찾느라 핸드폰에 길찾기 어플까지 깔았답니다..ㅜㅜ 찾기 너무 힘들었어여.... ",청주고양이속눈썹&붙임머리,https://blog.naver.com/god794216,2016-10-20
홍성70년소머리국밥 ,https://blog.naver.com/bobobo3987?Redirect=Log&logNo=221453400224,"좀 쉬다가 홍성 맛집으로 점심먹으러 소머리 국밥은 처음 먹어보는데 비계가 많아서, 쏘쏘- 잘 쉬다 온 홍성! 주말마다 갈테야 #홍성 #홍성맛집 #홍성맛집추천 # 70년소머리국밥 집 #홍성여행 #별장 #홍성별장... ",::  겟잇뷰티 속눈썹연장 전문샵  ::,https://blog.naver.com/bobobo3987,2019-01-29
11.홍성가을여행-3. 상설시장내 [ 70년소머리국밥 ] / 장터국밥],https://blog.naver.com/borami97?Redirect=Log&logNo=221443870188,70년된 소머리국밥 맛집이 있다기에 그곳을 찾아간 것...70년 소머리국밥 집 장터국밥 041-633-1240 충남 홍성군 홍성읍 대교리 398 (의사로43번길 27-9) 평일 08:00~20:00 / 월요일 휴무 상호가70년 소머리국밥이다.. 장이... ,앵두공주의 소소한 일상,https://blog.naver.com/borami97,2019-01-16
"[홍성맛집] 놀라운토요일 따라 시장 맛집,70년 소머리 국밥 집",https://blog.naver.com/ksoom?Redirect=Log&logNo=221462499937,"# 70년소머리국밥일요일이라 시장 대부분의 가게는 문이 닫혀있었지만, 국밥집은 다행히 월요일만 휴무였다. 굉장히 오래된 듯한 외관이지만 실내는 깔끔했다. 메뉴는 #소머리국밥 #소머리국밥특 #수육 뿐.... ","숨, 쉬듯 여행",https://blog.naver.com/ksoom,2019-02-10
[홍성] 신동엽씨가 얘기하신 그곳!70년소머리국밥 ,https://blog.naver.com/zzizzinyong?Redirect=Log&logNo=221469825332, 70년소머리국밥#토퍼하는언니 친정은 홍성이죠? 방송화면 캡쳐해서 올리고싶지만 못찾았어요...하하..... 파란문이 똭!!ㅋ저희 아빠입니다!ㅋㅋ 메뉴예요!심플하죠?ㅋ 국밥은 기본으로... ,"블로그 판매, 광고 안합니다. 연락주지마세요.",https://blog.naver.com/zzizzinyong,2019-02-19
"홍성전통시장 소머리국밥촌, 70년소머리국밥 ,홍흥집",https://blog.naver.com/yangklee?Redirect=Log&logNo=222510882393,낙엽이 이리 떨어졌다 홍주성천년여행길 홍성 시내버스 홍성의료원 소머리국밥집들이 십여개가 붙어있다70년소머리국밥 집 소머리국밥전문식당들 간판을 디자인일체화 예전에는 각각 조양문... ,lets T R A V E L,https://blog.naver.com/yangklee,2021-09-19
홍성70년소머리국밥 집,https://blog.daum.net/rigel1/16088517,"기본적으로 빨간 국밥 이지만, 맑은 국밥 도 가능하다. 특 14000원이고 , 보통10000원인데, 특을 시켜봐도 고기의 양이 특별히 많아 보이지는 않다. 만족! 별 다섯. 공유하기 글 요소 저작자표시 비영리 변경금지",리겔의 밤하늘의보석,https://blog.daum.net/rigel1,2021-10-12
"홍성시장 먹거리,70년 소머리국밥 ",https://blog.daum.net/e-chungnam/3565,유명하다는70년 소머리 국밥 만 한그릇 먹고 나왔습니다. ▲ 홍주성 천년의 길 탐방 이곳... ▲ 70년 전통의 소머리국밥집 사실 시장이 궁금하기보다는 70년이 넘었다는 소머리국밥집이 궁금하기도... ,충남도청,https://blog.daum.net/e-chungnam,2016-05-12
홍성 맛집:70년소머리국밥(홍성전통시장 내) *Olive... ,https://blog.naver.com/clicksoojung?Redirect=Log&logNo=221539553982,"현재 2대 어머니께서 이어받아 운영 중인 홍성 '70년 된 소머리국밥 맛집'. 홍성시장 내 위치해... (₩60,000원 이상 구매시, 배송비 무료) - 계좌: 국민은행 ******-**-****** 신창수 ( 70년 소머리 국밥 )... ",S-diary,https://blog.naver.com/clicksoojung,2019-05-17
토요일에서 신동엽이 극찬한 맛집! 홍성70년소머리국밥 집,https://blog.naver.com/dbghk625?Redirect=Log&logNo=222473618133,을 주로 찾게 됩니다~ 놀라운 토요일 홍성에서 나온 맛집인데요 바로 무려70년 !소머리 국밥 집입니다... 거기로 가게도면 말이져 저70년 소머리국밥 ! 이란 간판도 볼 수 있습니다~ 골목으로 쭈욱~ 들어가심... ,새벽. 세상의 그 아래,https://blog.naver.com/dbghk625,2021-08-17
 70년 소머리국밥 ,https://blog.naver.com/sana1947?Redirect=Log&logNo=220417469167,어머니의 대를 이은70년소머리국밥 집. 명함 사진의 정도를 훨씬 벗어난 나이. 사람이 그리워서 시골장은 서더라. 이 말은 참 정감이 간다. 메뉴는 단순하다. 소머리국밥과 국수. 지팡이를 잊게하는... ,구르믈 버서난 달 처럼,https://blog.naver.com/sana1947,2015-07-12
홍성 전통시장70년 소머리국밥 -놀라운토요일,https://blog.naver.com/daa1211?Redirect=Log&logNo=221435602974,"한우로 유명한 홍성소머리국밥 , 찐빵, 소 모둠구이가 나왔었는데 저를 사로잡는 음식 한가지가 나왔습니다. 처음 등장한소머리국밥전에 신동엽과 성시경이 진행하던 오늘 뭐 먹지에서 나와 신동엽이 먹어봤던... ",my story,https://blog.naver.com/daa1211,2019-01-06
홍성 맛집 TV 맛집에서 소개된70년 소머리국밥 ,https://blog.naver.com/aajjss7717?Redirect=Log&logNo=221452408369,"홍성70년 소머리 국밥 집 오늘 뭐먹지?, 놀라운 토요일 방송촬영에 나왔다고 하네요. 놀라운 토요일에... 전 소머리 국밥을 즐겨먹지 않지만 이런 해장국을 좋아하는 분들께는 정말 맛집으로 인정할만하네요!!!",HK테일러 청담점,https://blog.naver.com/aajjss7717,2019-01-28
[충남 홍성]70년 소머리국밥- 정유년 첫 외식 그리고,https://blog.naver.com/okng828?Redirect=Log&logNo=220900835683,홍성전통시장 한 구석에 자리잡은소머리국밥 집. 근래 가격조정이 있었던 듯하다. 김치도 시원시원하고 특히 동치미가 속을 시원히 뚫어준다. 만 원짜리 한우 수육 한 접시. 훌륭하지 아니한가? 아들 녀석과... ,꽃산가는길 since 2012,https://blog.naver.com/okng828,2017-01-02
먹방여행^^내당한우와70년 소머리국밥 ,https://blog.naver.com/mukgeby?Redirect=Log&logNo=220882423126,맛은 환상이였다는.... 식사는 무얼할까 하다가 국밥을 먹기로 결정70년 소머리국밥 집으로 고고~~ 우리는 먹보부부 ㅋㅋㅋ 소머리국밥도 맛났다는...고기먹고 국밥도 한그릇씩 뚝딱 ㅋㅋㅋㅋ 완전 최고의 하루^^,작은 천국,https://blog.naver.com/mukgeby,2016-12-10
충남도청 맛집홍성 시장 맛집70년 소머리국밥 ,https://blog.naver.com/aronia3864?Redirect=Log&logNo=221352256296,충남도청 맛집 홍성 시장 맛집70년 소머리국밥시작합니다. 홍성 시장안쪽에 있습니다. 하천변 주차장에 차를 대고 갔습니다. 가는 길에도 소머리국밥 집은 많더라구요. 041 633 1240 그래도 70년 이라고 하니... ,별빛농부,https://blog.naver.com/aronia3864,2018-09-04
[홍성] 70년소머리국밥 !,https://blog.naver.com/skdusdl86?Redirect=Log&logNo=221445922633,홍성전통시장70년 소머리국밥 ! 소머리국밥 집이 쪼로록 모여있다. 그 중에 찾아간 곳은70년소머리국밥 집! 외관만 딱봐도 오래되보인다. 테이블은 15개정도 되는 듯.. 메뉴는 국밥과 수육! 기다리던 국밥이... ,"소소한 취미, 일상 나킹의 블로그",https://blog.naver.com/skdusdl86,2019-01-19
홍성]70년 소머리국밥 집 ~ 홍성시장에서 먹는소머리국밥과... ,https://blog.naver.com/xclamp45?Redirect=Log&logNo=221310649606,ㅠㅠ 그래서 주변을 둘러보니 제법 많은 소머리국밥집들이 몰려있다. 이 많은 집들을 뿌리치고 맨 안쪽으로.. 구석에 있는 ' 70년 소머리국밥 집'의 가게전경. 대물림 가게인듯하다. 처음에는 어르신들 지팡이... ,아세스(이블샤오)의 Taste&Hiking Etc..,https://blog.naver.com/xclamp45,2018-07-02
1박2일 충남 홍성여행 - 신동엽이 극찬한 맛집70년 소머리국밥 ,https://blog.naver.com/sweetykw?Redirect=Log&logNo=221488890113,'에 방영된70년 소머리국밥또 다른 프로에서 신동엽이 태어나서 먹었던 소머리국밥 중에서 가장 최고였던곳이라고 극찬을했던 이곳! 사실 홍성으로 여행을 오게된게 이 국밥을 먹기위해서였음 ㅋㅋㅋㅋ 포장... ,너에게 나를 보낸다,https://blog.naver.com/sweetykw,2019-04-24
"홍성맛집,70년 소머리 국밥 집, 인생국밥",https://blog.naver.com/cheol1339?Redirect=Log&logNo=221566100507,#홍성맛집 # 70년소머리국밥 집 #홍성시장맛집 #내당한우 #소머리국밥맛집 #국밥맛집 홍성시장 근처 구경하고 국밥집으로 갔다. 장 서는날은 사람들이 엄청 많다고해요. 근처에 국밥집도 많더라고요. 그 중에... ,봄내음 블로그,https://blog.naver.com/cheol1339,2019-06-19
홍성70년 소머리 국밥 집 - 신동엽추천맛집,https://blog.naver.com/chanmi311?Redirect=Log&logNo=222363764808,라는 생각이 들정도로 가야되요^^ ' 70년 소머리 국밥 ' 이라고 간판이 달려있으니 원앙다방골목으로... ^^ 다음 홍성 방문시에는 홍흥집을 방문 해 보고 싶습니다^^ #홍성맛집 #홍성국밥 #홍성소머리국밥... ,Better than now,https://blog.naver.com/chanmi311,2021-05-24
#홍성소머리국밥#홍성 70년소머리국밥 (feat.수육),https://blog.naver.com/dorothy5838?Redirect=Log&logNo=221780008907,70년된거 같긴합니다 문을열고 들어가니 신동엽이 보입니다 신동엽 소머리국밥집으로도 유명합니다... 수육은 소머리국밥을 거들뿐 . 홍성70년소머리국밥천북굴단지 갔다가 홍성쪽을 지나시면 70년... ,돈버는놀이방,https://blog.naver.com/dorothy5838,2020-01-21
홍성 맛집!!70년소머리국밥 강추!!,https://blog.naver.com/kdsa7?Redirect=Log&logNo=221693319898,"시골장터 느낌 그대로 저희가 갔을때가 평일 9시 30분정도~ 들갔더니 1팀 먼저 식사중이셨구~~ 저희도 한그릇씩 주문~~!!^^70년 소머리국밥 ♡ 소머리국밥 9,000원 2그릇 18,000원!!♡ ㅋㅋ와이파이두 되공!!... ",래유니파파,https://blog.naver.com/kdsa7,2019-10-30
"[홍성] 70년 소머리국밥 집 - 소머리국밥, 국수, 수육",https://blog.naver.com/fkwu87?Redirect=Log&logNo=220545985454,오늘 뭐먹지?에 나온곳 홍성70년 소머리국밥 집 메뉴판과 가격주르륵 3개를 시켰고 빠르게 나왔다 (우리보다 먼저온 팀은..수육이 너무 안나와서 취소했지만 우린 3개다 주르륵 잘 나왔다) 수육 국밥 국수 음..... ,Sleep tight,https://blog.naver.com/fkwu87,2015-11-21
홍성 70년소머리국밥 집,https://blog.naver.com/yoohap?Redirect=Log&logNo=221629389434,"#홍성 큰시장내 에 맛집 #홍성 70년소머리국밥 집 에 다녀왔어요 . 원래 #국밥 좋아하는데 ~~연애인들이... 5일장은 1일,6일 -정상 영업한데요^^ 평일 09:00~19:00 #홍성소머리국밥 #홍성맛집 #홍성70년국밥 #홍성장날맛집",유하하팜,https://blog.naver.com/yoohap,2019-08-26
홍성맛집)소머리국밥 의 정석 :: 70년전통의소머리국밥 ::,https://blog.naver.com/monnani100?Redirect=Log&logNo=220574486301,"홍성맛집, 오늘뭐먹지 출연, 소머리국밥 맛집, 70년전통의 소머리국밥집 월요일 다들 잘 보내고 계세요?... 이렇게70년 소머리국밥 간판이 보이더라구요 하아.. 근데 이곳이 정녕 맞을까.. 하면서 망설이다가... ",살림다반사,https://blog.naver.com/monnani100,2015-12-21
"홍성70년소머리국밥 , 신동엽이 극찬한 국밥집",https://blog.naver.com/alice_edi?Redirect=Log&logNo=221575374868,"그중에서도 인상적이어서 기억에 남았던, 홍성 시장에 위치한70년 소머리국밥 . 국밥류를 워낙... 있는70년소머리국밥간판들. 못 찾으려야 못 찾을 수가 없어요ㅋㅋㅋ 외관부터 맛집 냄새 폴폴. 진짜 70년 된 것... ",앨리스의 공간,https://blog.naver.com/alice_edi,2019-07-01
홍성시장70년소머리국밥 ,https://blog.naver.com/sun13588?Redirect=Log&logNo=221503887781,"70년된소머리국밥집 홍성 청년에게 소개받아서 다녀왔어요. 홍성 전통시장 안에 있어서, 찾기 어려울... 맞긴한데~ # 70년소머리국밥#홍성군맛집 #홍성맛집 #홍성소머리국밥 드디어 들어왔어요,. 큰길 간판보고... ",나의 여행 그리고 꽃,https://blog.naver.com/sun13588,2019-04-02
"놀라운 토요일 따라 간 충남 홍성시장 맛집,70년 소머리국밥 ",https://blog.naver.com/bigpicture78?Redirect=Log&logNo=221965091136, 70년 소머리국밥 집은 충남 홍성전통시장 안에 위치해있습니다. 외관만 봐도 시장에서 70년 장사한 것... 드뎌~~ 소머리국밥이 나왔습니다. 소머리국밥 그냥 눈으로만 봐도 찐~해 보입니다. 사실 개인적으로 소든... ,감성디노의 사는재미,https://blog.naver.com/bigpicture78,2020-05-16
홍성70년 소머리국밥[신동엽... 인생소머리국밥이라고?,https://blog.naver.com/enghks1984?Redirect=Log&logNo=221467536820,#홍성 70년소머리국밥#놀라운토요일 #홍성놀라운토요일 #소머리국밥홍성 #소머리국밥홍성시장 #소머리국밥 #신동엽소머리국밥 약간은 맹숭맹숭한 텀텀한 국물이 나온다. 양은 좀 줄었네요? ㅠ MSG에 길들여긴... ,캠프스타일,https://blog.naver.com/enghks1984,2019-02-16
[홍성맛집여행]홍성장터에서70년된소머리국밥 집...,https://blog.naver.com/longlkl?Redirect=Log&logNo=100154640488,소머리국밥이면 보통 하얀국물인데 여기는 빨간 국물... 지팡이 꼭 챙깁시다... 김치한점 끈적끈적한 소머리국밥... 역시 맛난다... 국밥은 장터에서 먹어야 제맛... @ 70년 소머리국밥위치,한쪽만 바라보고 무작정 걷는 사람,https://blog.naver.com/longlkl,2012-03-29
 70년전통의 강릉 중앙시장소머리국밥골목,https://blog.naver.com/pinegn?Redirect=Log&logNo=222358926995," 70년전통의 강릉 중앙시장소머리국밥골목 제9기 강릉시 SNS 서포터즈_이자영 강릉 여행을 하면 먹거리, 볼거리, 즐길 거리가 가득한 중앙시장을 참새방앗간처럼 꼭 방문하게 됩니다. 자연경관도 좋지만 사람... ",강릉시청공식블로그,https://blog.naver.com/pinegn,2021-05-20
충남 홍성 맛집: 신동엽이 인정한70년 소머리 국밥 집!,https://blog.naver.com/hyunju0045?Redirect=Log&logNo=221491065400,"신동엽이 인생 국밥이라 극찬한 소머리 국밥70년 소머리 국밥주소: 충남 홍성군 홍성읍 의사로 43번길 27-9 (지번: 대교리 398) 영업시간: 평일 08:00-20:00 (월요일 휴무/단,1일 6일 장날은 제외) 군산 여행 중... ",강원도 방충망 1등 업체《화신창호》,https://blog.naver.com/hyunju0045,2019-03-18
홍성맛집 홍성70년 소머리국밥 집,https://blog.naver.com/edkms?Redirect=Log&logNo=221556844232,특히 홍성시장에는 소머리 국밥집들이 많은데요. 그중70년 소머리국밥 집은 방송에도 여러번 소개된... 세월이 국밥집 상호처럼 70년은 훌쩍 넘을듯 합니다. 메뉴는 국밥과 수육 두가지입니다. 국밥은 머리 고기를... ,"제주, 사는이야기",https://blog.naver.com/edkms,2019-06-07
홍성군70년 소머리국밥 ,https://blog.naver.com/optiondodari?Redirect=Log&logNo=221602983389,"날 좋아지면 줄서야할지도 ㅎㅎ70년내공이 느껴지는 인테리어.. ㅋㅋ국밥 집이 아니었다믄 용서가 안될 수도 ㅎㅎ 카운터 그런거 없었음 ㅋㅋ # 소머리 수육 '소' 15,000원 쫀득 쫀득 맛난다소머리국밥9,000원... ",미노네..,https://blog.naver.com/optiondodari,2019-08-02
신동엽이 극찬한 홍성맛집70년소머리국밥!,https://blog.naver.com/kddms54?Redirect=Log&logNo=221523146167,홍성맛집으로도 넘나 유명한70년소머리국밥놀토 재방으로 보고 꽂혀서 홍성에 다녀왔어요 소머리국밥 처음 먹는건데 약간 예상이 되는맛이었지요 맛집은 한끗 차이잖아요? 감칠맛과 간이 적당히... ,에스정의 사랑이 넘치는 블로그,https://blog.naver.com/kddms54,2019-04-26
홍성 맛집70년 소머리국밥국물이 시원하네요~,https://blog.naver.com/badcpu?Redirect=Log&logNo=221455868569,"예산에도 백종원 님의 파워 덕택인지, 전통시장에 소머리 국밥촌이 형성되어 있습니다. 이중 필자가 찜 한 집은70년 소머리 국밥 집입니다. 이름부터 전통이 살아 있는 듯합니다. 70년 아니 80년 정도는 되었다고... ",꿈꾸는요셉 천안점,https://blog.naver.com/badcpu,2019-01-31
