title,link,description,bloggername,bloggerlink,postdate
충남 홍성 맛집) 놀라운 토요일70년 소머리국밥 ,https://blog.naver.com/dlawngml0805?Redirect=Log&logNo=221475923212,충남 홍성70년 소머리국밥 집에 다녀왔습니다 미식가 신동엽님이 추천한 맛집이라쥬? 시장안에 골목에... 기본찬 저 양파짱아찌 존맛탱 국밥 나와쩌용 색이 왕진하쥬 국수사리를 추가해서 국물에 넣어드셔요... ,주몽이네,https://blog.naver.com/dlawngml0805,2019-02-27
홍성 70년소머리국밥 집/ 홍성맛집/ 홍성시장/ 홍성가볼만한곳,https://blog.naver.com/nataliasoft?Redirect=Log&logNo=221498369299,"국밥집 외관도 간판이름에 걸맞은 비주얼이에요 딱봐도 오래된 건물이죠~ 깔끔한곳은 아니지만 70년의... 들르세요~ #홍성맛집, #홍성국밥집, #홍성소머리국밥, # 70년소머리국밥 집, #홍성가볼만한곳, #홍성시장... ",나탈리아 뷰티페이스,https://blog.naver.com/nataliasoft,2019-03-27
(홍성 식당)70년 소머리국밥 ,https://blog.naver.com/mirinae0622?Redirect=Log&logNo=221934806839,홍성에서 소머리국밥은 구지 안 먹어도 될 것 같다. 아님 70년전 소머리 국밥이 궁금하면 가봐도 될 듯 ㅋㅋㅋ #홍성식당 #홍성소머리국밥 # 70년소머리국밥#홍성맛집(?),Happy 2021♡,https://blog.naver.com/mirinae0622,2020-04-28
[홍성 맛집]70년 소머리 국밥 집~!! 신동엽도 반하고 나도... ,https://blog.naver.com/jizunjizun?Redirect=Log&logNo=221529727611,환영합니다^^ # 70년소머리국밥# 70년소머리국밥 집 #빨간육수소머리국밥 #홍성맛집 #소머리국밥택배 #신동엽소머리국밥 #오늘뭐먹지소머리국밥 #수육 #한우수육 #한우소머리국밥 # 70년소머리국밥 주차 #소통... ,지똥구리의 일상,https://blog.naver.com/jizunjizun,2019-05-04
홍성70년 소머리국밥 ,https://blog.naver.com/hspanel1126?Redirect=Log&logNo=221471085860,마침 태안 출장갔다가 내려오는길에 방송에도 많이 나오고 나름 유명한 소머리국밥집이 있어서 들려봤습니다.70년 소머리국밥 집이라는데 저희는 점심시간이 좀 늦어서 3시 전에 도착했어요... 보니까 오후 3시... ,화성판넬산업,https://blog.naver.com/hspanel1126,2019-02-21
[2년 전 오늘] 놀라운토요일 홍성70년 소머리국밥 ,https://blog.naver.com/zqqz99?Redirect=Log&logNo=222198169613,2년 전 오늘 놀라운토요일 홍성70년 소머리국밥#소머리국밥 #홍성시장맛집 #놀라운토요일놀라운토요일 시청후 다음날갔습니다정말 MSG 안느껴지는 깔끔한 맛 가는날이 장날이라고...1일 6일 장날인데 6일에... ,서산간판 서산현수막 디자인원,https://blog.naver.com/zqqz99,2021-01-06
{충청도 홍성}70년 소머리국밥 ,https://blog.naver.com/hye515?Redirect=Log&logNo=220653178683,갑자기 남편이소머리국밥먹으러가자고 해서 따라나섰더니.... 충청도 홍성까지 가잔다....흐미... 작년 11월말쯤인가에 '오늘은 뭐 먹지'에서 두 MC가 방문했던 곳이란다. 집에서 차로 편도 1시간 50분을... ,Soli Deo Gloria!,https://blog.naver.com/hye515,2016-03-12
오늘뭐먹지? / 놀라운토요일에 나온 티비맛집 /70년소머리국밥 ,https://blog.naver.com/srgmj?Redirect=Log&logNo=221462113302,소머리국밥안에 고기도 많고 국물도 슴슴하니 짜지않고..... 포스팅하면서도 또 먹고싶네여ㅠㅠ 포장해올껄ㅠㅠ 택배도 된다니 택배시켜먹어야겠네여^^ 저한텐 무지무지 맛있었던70년소머리국밥 집이였습니다... ,You Only Live Once,https://blog.naver.com/srgmj,2019-02-10
[홍성 맛집] 국밥집거리중에 가장 오래된?70년 소머리 국밥 집,https://blog.naver.com/bowels?Redirect=Log&logNo=221677403839,저희가 다들 국밥을 좋아하는 마침 # 70년소머리국밥집을 발견하였습니다. 여기도 뭐 제가... 소머리국밥 9000원 특은 13000원 입니다. 저희는 추가로 막걸리도 주문 하였습니다. 매주 월요일은 쉬는 도서관 같은... ,안녕하세요 반가워요.,https://blog.naver.com/bowels,2019-10-14
[충남/홍성]70년 전통 소머리국밥 ,https://blog.naver.com/talktalk5749200?Redirect=Log&logNo=222400932621,도착한 # 70년소머리국밥가격은 동일하게 둘다 만원 되시겠습니다. 찬은 깍두기. 김치. 양파장아찌... 좋은 70년 전통 소머리국밥집 주소:충남 홍성군 홍성읍 의사로43번길 27-9 영업시간:10:00~17:00 브레이크 타임... ,톡톡부동산의 맛집여행,https://blog.naver.com/talktalk5749200,2021-06-23
홍성 맛집 / 한우 소고기로 만든70년 소머리국밥 ,https://blog.naver.com/bymin0418?Redirect=Log&logNo=221348298213,홍성70년소머리국밥 으로 가는 골목이 나온다 알아보기 편하게 안내가 잘되어 있어 찾는 건 어렵지 않다 무서운 형들이 있을 것 같은 골목으로 쭉 들어가면 보이기 시작하는 홍성 소머리국밥으로 유명한 70년집... ,민이군의 기록의 공간,https://blog.naver.com/bymin0418,2018-08-29
충남 홍성 :70년소머리국밥 ,https://blog.naver.com/watasi_?Redirect=Log&logNo=221741515764,"방송 출연 뒤에 신동엽의 인생소머리국밥 으로 더 유명해졌다. 간판에70년 이라고 적혀 있는데 간판이 오래된 것으로 보아70년 보다 훨씬 더 오래된 것 같다.소머리국밥9,000원 고기 건더기가 푸짐하게 들어... ",예비독거노인 浩의好食,https://blog.naver.com/watasi_,2019-12-18
홍성맛집. 오늘뭐먹지.70년 소머리국밥 ,https://blog.naver.com/som7502?Redirect=Log&logNo=220649965860,"에서 충남 홍성70년 소머리국밥 집이 나왔었는데요, 쉬는날 신랑이랑 소머리국밥먹으러 홍성까지 다녀왔답니다 ㅎ70년 소머리국밥 집이에요. 가격도 착하지요?ㅎ 둘이가서 어떻게 시켜야할까 한참고민하다가... ",마지아해솜샵,https://blog.naver.com/som7502,2016-03-09
홍성 맛집70년 소머리 국밥 집 넘나 좋아!,https://blog.naver.com/adora_y?Redirect=Log&logNo=221186237375,자리에 앉아서70년 소머리국밥 집 메뉴를 바라봅니다. 정말 맛집일수 밖에 없는게 정말 소머리 국밥만... 주문을 해두고 저는 정문쪽 가보려고 쫄래쫄래나갔어요 홍성 맛집70년 소머리 국밥 집 답게 70년... ,여니’s Review Box,https://blog.naver.com/adora_y,2018-01-21
홍성시장70년소머리국밥 ,https://blog.naver.com/yhs0102?Redirect=Log&logNo=221853223996,"드디어 홍성시장에있는70년 소머리국밥 집에 다녀왔어요~ 가격표예요 월.화는 쉰다네요 ,택배주문도 가능하네요~ 기본반찬 추가반찬은 셀프네요~ 빨간색국물이 기본 매운거 싫어하시는분들은 하얀색국물로... ",행복,https://blog.naver.com/yhs0102,2020-03-14
"홍성시장70년 소머리국밥 ,뜨끈하게 한그릇!",https://blog.naver.com/sssppp82?Redirect=Log&logNo=220690782847,"70년을 이은 소머리국밥집 그래서 간판도70년 소머리국밥 이다. 매주 목요일에는 휴일. 하지만, 목요일이 장날이라면 영업을 한다. 오늘 뭐먹지에 방영된 집이라,, 홍성맛집. 주말이지만 약간 한산했다. 사람들이... ","현명한 아내, 따뜻한 엄마:D",https://blog.naver.com/sssppp82,2016-04-22
 70년 소머리 국밥 ,https://blog.daum.net/forme13/2409," 70년 소머리 국밥댓글 0 맛 기행 2020. 6. 10. - 충청남도 홍성군 홍성읍 조양로 167 - 아주 우연히 골목골목을 찾아 간집. 70년 전통이라 맛있다. - 우시장 안에 있는 집, 주차불가. 공유하기 글 요소... ",비움을 위한 여행,https://blog.daum.net/forme13,2020-06-10
19 ❶ 홍성70년 소머리국밥 집순수펜션,https://blog.naver.com/dewysmirror?Redirect=Log&logNo=221684305420,"있는70년 소머리국밥 집 TV에 몇번 소개된 적이 있는 집이란다~ 월요일 휴무, 포장, 택배 가능 브레이크타임 3:00 ~ 5:00, 오후 7시까지 영업 여긴 특이하게 소머리국밥에 빨간색~ 얼큰한 국물이 좋았고~ 고기도... ",듀이의 유리거울,https://blog.naver.com/dewysmirror,2019-10-21
 70년소머리국밥 } 홍성 로또명당 방문.,https://blog.naver.com/love79008?Redirect=Log&logNo=221026227115," 70년소머리국밥 ,홍성 로또명당 방문. 안녕하세요~~~ 대전청소업체 황금빗자루 입니다. 바로 어제였죠!... 바로 소머리국밥 모습입니다. 그냥 여느 국밥과 비슷한 비주얼 모습! 밥 한 그릇 말아서 딱~~ 고기들도... ",황금빗자루 대전점,https://blog.naver.com/love79008,2017-06-10
홍성70년 소머리국밥 ,https://blog.naver.com/kdhyl?Redirect=Log&logNo=222019378071," 소머리국밥 (특) 하나, 수육(소) 하나, 항상 이렇게 시킬 때마다 드는 마음은 모자랄 것 같아 더 시키고 싶은 마음.... 소싯적 식탐과 위장의 양이 비례했었다지... 지역 쌀 사용하는 거 마음에 든다. 두-둥. 나왔음.... ",FREE BEING,https://blog.naver.com/kdhyl,2020-07-02
[홍성 맛집]70년 소머리국밥 ,https://blog.naver.com/qhdzzz?Redirect=Log&logNo=222127142051,"70년 전통 맛집이라 그런지 내부는 연식이 꽤 돼보였다 이쪽에도 출입문이 있네 ㅎㅎ70년 소머리국밥 ... 소머리국밥은 빨간 국물, 흰 국물 중 선택할 수 있는데 우리는 빨간 국물로 주문했다 기본이 빨간... ",세봉이의 기록ღ,https://blog.naver.com/qhdzzz,2020-10-26
홍성 소머리국밥 맛집70년소머리국밥 ,https://blog.naver.com/bidool310?Redirect=Log&logNo=220566942956,이곳의 국밥들도 뭐 나쁘진 않았어요 ㅎㅎ 가격도 저렴하구요 ㅎㅎㅎ (착한가격업소 팻말이 붙어 있는 가게 들이예요) 하지만70년 소머리국밥 에서 소머리국밥을 만난 후~~~ 왜 방송국에서 이 많은 가게 중에... ,비둘기의 두부공장,https://blog.naver.com/bidool310,2015-12-13
홍성 |70년소머리국밥 ,https://blog.naver.com/kdr31kr?Redirect=Log&logNo=221129096051, 70년 소머리국밥영업시간은 8시부터 20시까지 매주 목요일은 쉬는날 화살표 방향 골목사이로 들어가면 출입문이 보여요 소머리국밥집 앞문 시장안쪽에 위치하고 있어요 가게는 오래된 식당이에요 화장실이... ,단로그,https://blog.naver.com/kdr31kr,2017-10-31
홍성맛집” 70년 소머리국밥 ”,https://blog.naver.com/swh820101?Redirect=Log&logNo=222118445153,홍성에서 유명하다는 “ 70년 소머리국밥 ” 저고 한번 먹어보겠습니다. 뭔가 강력한 내공이 느껴집니다. 역시 홍성의 맛집이네요. 신동엽씨가 강력 추천한 이유를 알겠습니다. 홍성에 가시면 꼭 한번... ,취우가 내리는 날,https://blog.naver.com/swh820101,2020-10-17
오늘뭐먹지에 나온 홍성맛집/ 70년소머리국밥 !,https://blog.naver.com/saeun5253?Redirect=Log&logNo=220896204617,짜잔 ~~~~ 케케 오늘뭐먹지에 나온 그 홍성 소머리국밥 맛집 맞네용해장국 순대국 등 뜨끈한 국물... ㅎㅎ 아랫지방으로 여행갈땐 꼭 한번씩 들리고픈 홍성 맛집70년 소머리국밥! 맛있게 잘 ~ 먹었습니당 ㅎㅎ,뽕누리의 먹방. 여행.,https://blog.naver.com/saeun5253,2016-12-27
[충남 홍성]70년 소머리국밥 집,https://blog.naver.com/lovebinself?Redirect=Log&logNo=221446902621,(갑자기..) 충남 홍성70년 소머리국밥 집 드디어 우리 앞번호까지 들어갔다. 70년 어머니의 대를 이은..!... 충남 홍성70년 소머리국밥 집 기다림끝에 나온 소머리국밥! 아무것도 모르고 들어와서 하얀건지... ,조금은 부지런해도 괜찮아,https://blog.naver.com/lovebinself,2019-01-21
홍성맛집70년소머리국밥 /잡내1도 안나는 깔끔한 국밥집 ♪,https://blog.naver.com/duddlsdudals?Redirect=Log&logNo=221226315677,홍성맛집70년소머리국밥 /잡내1도 안나는 깔끔한 국밥집 ♪호떡의 달인집에서 멀지 않은곳에 위치한 국밥집 :) 소머리국밥은 처음이고... 제가 비위가 상당히 약한 편이라... 걱정을 했지만 그 걱정이 무색할... ,"달콤쌉싸름 순간의 기록,",https://blog.naver.com/duddlsdudals,2018-03-11
홍성종합터미널 부근 홍성70년 소머리국밥 ,https://blog.naver.com/bora_law?Redirect=Log&logNo=220963844352,찬도 맛있고(집에서 만든 것 같은 맛) 다음에 홍성에 올일이 있으면 또 오고 싶어요. 그럼 안냥 #홍성 #홍성여행 #홍성맛집 #홍성가볼만한곳 # 70년소머리국밥#소머리국밥 #소머리국밥맛집,오늘도 평화로운 박변네,https://blog.naver.com/bora_law,2017-03-21
"2018 새해 대천 해돋이, 그리고 홍성시장에70년소머리국밥 ",https://blog.naver.com/leevelyjin?Redirect=Log&logNo=221183089242,홍성시장에70년소머리국밥이번 2018 새해맞이 어떻게 할까? 가까운데라도 가볼까? 하다가 대천으로... 알아보다가 홍성에 유명한 소머리국밥집이 있더라구용 바로 찾아갔죵 힛 오마 진짜 오래된맛집인가... ,리블리찌니,https://blog.naver.com/leevelyjin,2018-01-12
"오늘 뭐 먹지, 홍성70년소머리국밥 ",https://blog.naver.com/hjhc1112?Redirect=Log&logNo=220541139149,소머리국밥을 먹는 성시경과 신동엽을 본 나는 미친듯이 먹고 싶어져서 ;;;;차에 시동 걸고 출발함... 온통 국밥집..그리고 한우집 ㅋㅋㅋ 쪼오오기 노랑 간판70년 소머리국밥ㅋㅋ시켰다 국밥 보통이 6000원... ,살찐둘리의 치매예방 프로젝트,https://blog.naver.com/hjhc1112,2015-11-16
여름휴가 홍성70년 소머리국밥 에서 아침까지,https://blog.naver.com/khthbi?Redirect=Log&logNo=221066545205, 70년 소머리국밥 에서 수육 1만냥인데 부드럽고 맛있습니다. 가격도 부담없고 뒤이어 나온 소머리국밥 적당합니다. 너무 많지도 않고 다음 일정은 꽃지해수욕장에서.....,호계더샵부동산[평촌더샵아이파크 상가],https://blog.naver.com/khthbi,2017-08-04
(태안맛집/홍성맛집) 70년소머리국밥 집,https://blog.naver.com/happyvgirl?Redirect=Log&logNo=221684081804,홍성전통시장내에 위치한70년 소머리국밥 집. '홍성맛집'을 검색해서 찾아간 곳인데 결론부터 말하자면... ㅎㅎ 소머리국밥집이 줄줄이 늘어선 곳을 지나 화살표를 따라가니 나온 소머리국밥집. 앞에 쓰레기들은... ,Let it be,https://blog.naver.com/happyvgirl,2019-10-21
[BP/한밤] 홍성 -70년 소머리국밥 ,https://bass007.tistory.com/4249,"홍성읍 시장에 가면 소머리국밥을 파는 곳이 몇 곳 있는데, 그 중 유명한 곳이70년소머리국밥그런데, 상호가 특이하다보니 아무래도 사람들이 몰리는 것 같다. 현지 주민께 여쭤보니.... ",Bruprin's delicious Life,https://bass007.tistory.com/,2017-04-17
"(충남 홍성) 오늘 뭐먹지 투어 (내당한우,70년소머리국밥 )",https://blog.naver.com/annppol?Redirect=Log&logNo=221386261381,그와중에 맛있었다는ㅋ 다시 홍성으로 가서70년 소머리국밥 집을 찾았습니다. 소머리국밥과 수육을 주문해서 배터지게 먹었어요. 지금까지 맛본 하얀국물의 소머리국밥과는 또다른 맛이 더군요. 제 입맛에는... ,정상에서 찾은 삶의 광복,https://blog.naver.com/annppol,2018-10-27
"맛집 - 홍주성과 여하정, 놀토 맛집70년 소머리국밥 집",https://blog.naver.com/attorney119?Redirect=Log&logNo=222073993021,놀토방송에서 소개되었던70년 소머리 국밥 집에서 저녁을 먹었습니다. 신동엽이 극찬한 소머리국밥은 맑은국물과 얼큰한 국물 두가지가 있습니다. 우리는 얼큰 일반 2개 주문하였습니다. 반찬가지수는... ,농수산업 행정 연구센터 010-5314-1980,https://blog.naver.com/attorney119,2020-08-28
홍성먹거리_ 70년 소머리 국밥 집,https://blog.naver.com/jungnbom?Redirect=Log&logNo=220583214345,홍성 먹거리_ 70년 소머리 국밥 집 백종원이 먹는 소머리국밥을 먹는걸 보고 HJ와 먹으로 가자 ! 했지요. 가려던 날이 쉬는날이라 결국 다른장소로 옮겼어요. 홍성에 있는 국밥집 이곳은 성시경과 신동엽이... ,늘봄_달콤한 공방,https://blog.naver.com/jungnbom,2015-12-30
홍성 전통시장 국밥 맛집:[ 70년 소머리국밥 집] 소머리국밥수육,https://blog.naver.com/sbk4525?Redirect=Log&logNo=221667084617,뿐이에요 #소머리국밥특 #수육소자 주문했습니다70년 소머리국밥 집의 육수는 기본으로 빨간육수로 나오는데 하얀육수가 먹고싶다면 미리 말하면 되요 전 빨간육수가 먹고싶어서 그대로 주문했어요... ,뿌죵이네 :) 하루 일상 담기♥,https://blog.naver.com/sbk4525,2019-10-03
홍성70년 소머리국밥 ,https://blog.naver.com/jjommi80?Redirect=Log&logNo=221891761249,홍성70년 소머리국밥 ~^^ 오늘 뭐먹지 출연맛집 빨간 국물이 메인인~^^ #홍성소머리국밥 #홍성맛집,malas,https://blog.naver.com/jjommi80,2020-04-05
"홍성맛집, 70년소머리국밥 ",https://blog.naver.com/eunyoung0418?Redirect=Log&logNo=221029081077,홍성70년 소머리국밥국밥드신 할아버님들께서 지팡이까지 놓고 가신데요ㅋㅋㅋ 지팡이도 잊게하는... ㅜ오늘뭐먹지에 방영되었던 사진이네요~~ 신동엽 성시경 싸인도~~^^잠시후 소머리국밥이 나오고~~ 밥을... ,짱쌤의 맛나게먹고 운동하고~♡,https://blog.naver.com/eunyoung0418,2017-06-14
곤지암 최미자 소머리국밥 ,https://blog.naver.com/leekh8412?Redirect=Log&logNo=222157883018,"성인이 되고나서 제대로 된 소머리국밥을 먹어본 것은 이곳 곤지암의 '최미자소머리국밥'과 충남 예산쪽의 '한일식당', 홍성의 ' 70년소머리국밥 '정도. '최미자소머리국밥'은 뽀얀 국물의 소머리국밥... ",Eating & Traveling,https://blog.naver.com/leekh8412,2020-11-30
" 70년소머리국밥 , 방송 1년 후 지금은?",https://blog.naver.com/leadtime?Redirect=Log&logNo=220887793154,"#신동엽, #성시경 의 #오늘뭐먹지 출연 홍보물과 #친필사인1년전 6천 원하던 #소머리국밥 이 1천원 오른 7천 원. 주변 다른 국밥집들은 5천 원인것에 비하면 2천 원이나 비싸다. # 70년소머리국밥의 위엄.",초름이의 세상이야기,https://blog.naver.com/leadtime,2016-12-16
 70년소머리국밥/ 홍성삽교소머리국밥 - 충청남도 홍성... ,https://blog.naver.com/howmanyroads?Redirect=Log&logNo=70189647637,소머리국밥 한 그릇 먹어봐야지요.. 바로 이 모습입니다.. 이걸보고.. 이 동네를 어찌 그냥 떠날 수 있나요.. 오른쪽 저 멀리 간판이 보이지요?70년 소머리국밥 .. 저기로 갑니다.. 이곳입니다.. 배도 적당히... ,HOW MANY ROADS,https://blog.naver.com/howmanyroads,2014-05-05
"무조건 국물 원샷하게 만든, 시원한70년소머리국밥 집",https://blog.naver.com/ndsibs?Redirect=Log&logNo=221435070111,충남 홍성의 얼큰한 소머리국밥과 함께 한우 모둠구이를 걸고 벌어지는 가사를 알아보는 초성게임 놀라운토요일! 홍성에서 70년 노포의법칙70년소머리국밥 집 놀라운토요일! 소고기 사 묵겠지~ 고삐... ,"일산! 지킴이 ""일산아재""",https://blog.naver.com/ndsibs,2019-01-05
예천 국밥 맛집 :70년 소머리국밥 ,https://blog.naver.com/hsl8814?Redirect=Log&logNo=221730178837,"아침을 먹으려고 맛집을 검색하다가 찾은소머리국밥 ! 방송도 많이 나오고 유명하길래 바로 방문했다 위치는 골목 안쪽 깊숙이,, 우리는 지도를 보고 찾아갔는데 큰 길에서 조그만 간판만 빼꼼 보였다 안쪽으로... ",#SOLOG#,https://blog.naver.com/hsl8814,2019-12-07
홍성 맛집70년 소머리 국밥 집,https://blog.naver.com/yulove21?Redirect=Log&logNo=221524216076,홍성에 맛 집이라고 하는70년 소머리 국밥 집을 갔습니다. 홍성시장에 위치해 있고 오래된 국밥집의 모습이었습니다. 가기 전에 가격이 8000원으로 알고 있었는데 가격이 올랐나 보네요. 연예인도 다녀갔는지... ,살며 사랑하며 배우며,https://blog.naver.com/yulove21,2019-04-28
송쌤의 냠냠이야기~♡ 홍성70년 소머리국밥 ,https://blog.naver.com/sasasa18218?Redirect=Log&logNo=221267599044,보통분들 잘못먹는것두 즐겨먹습니다 좀...ㅋㅋㅋ 오늘 송쌤은 점심시간에 홍성에있는70년전통으로 유명한소머리국밥 집에 다녀왔습니다 여적 홍성살면서도 처음가봤네요 저도.. 사실 시장안에... ,꽃송이 이야기,https://blog.naver.com/sasasa18218,2018-05-03
충남 홍성70년 소머리국밥 ,https://blog.naver.com/unhey0206?Redirect=Log&logNo=222019495785,주차 근처에 알아서 하고~ㅎㅎ 빨간 소머리국밥 2개 소면추가 주문 육질이 늠 부들부들 고기 양도 많고. 다른집 곱배기수준.. 이래서 맛집 인가봐유 사람 풀. 아 그런데 먹는내내 사람도 붐비는대다가 내부가 너무... ,앵복이블로그,https://blog.naver.com/unhey0206,2020-07-03
놀라운토요일에 나온 홍성시장맛집70년 소머리국밥 집 맛있쟈나,https://blog.naver.com/rud6483?Redirect=Log&logNo=221461668371,"설 연휴 뒤라서 못먹을 줄 알았는데, 드디어 먹었음 ٩(ˊᗜˋ*)و 홍성시장 안에 있는70년 소머리국밥 집... 이은 70년 된 소머리국밥 수육먼저 나왔다. 작은거 주문했는데도 양이 꽤 많다. 간장소스에 찍어 먹으면... ",당교일기,https://blog.naver.com/rud6483,2019-02-09
 70년소머리국밥다녀옴~!,https://blog.naver.com/dyd4665?Redirect=Log&logNo=220628969331,위치한70년소머리국밥다녀 왔어요 가게 입구 근처인데 국밥 파는데가 많네요 가게 간판 입니다 ㅎ 가게 입구 문구가 재밌네요 ㅎㅎ 메뉴판 깍두기는 괜찮았고 김치는 그냥그냥 ㅎㅎ 주문한 소머리국밥 보통이... ,잠깐 미치면 세상이 즐겁다,https://blog.naver.com/dyd4665,2016-02-16
뭐 먹지 홍성 한우 맛집/소머리국밥 맛집-70년소머리국밥 ,https://blog.naver.com/aldid0904?Redirect=Log&logNo=220537902221,홍성까지가서 소머리국밥만 먹고 오긴 그래서 내당에서 한우도 구워먹었어요 저희는 방송과 반대로 내당에서 먼저 먹고 남당항에가서 바닷바람좀 쐬고70년 소머리국밥 집으로 다시 ㄱㄱㄱ 홍성 전통시장안으로... ,호수같은 먕,https://blog.naver.com/aldid0904,2015-11-13
홍성 먹방투어-70년 소머리 국밥 집,https://blog.naver.com/happyvirus999?Redirect=Log&logNo=221177333350,있는70년 소머리 국밥 집을 소개해드릴게요^^ 시장 안에 들어가면~ 짠~ 찾았어요ㅎㅎ 시장 좀 구석에 있어서 저는 찾기 좀 힘들었던걸로 기억이;; 메뉴는 이렇습니다~ 많지 않아서 좋아요ㅎㅎ 소머리 국밥집이니... ,HAPPY GIRLS 리슈슈,https://blog.naver.com/happyvirus999,2018-01-05
홍성맛집★ 70년 소머리국밥 ★ 오래된 국밥집답게진국입니다~,https://blog.naver.com/alsdk80?Redirect=Log&logNo=221019081913,해장하기엔 국밥이 최고죵~ㅋㅋ 홍성읍 시장쪽에 있는거 같더라구요~ 진짜 오래된 식당 70년 소머리 식당 입니당~ㅋ크70년 소머리 국밥메뉴들이에요~ 간단하지용~~ㅋㅋㅋ 먹음직스러운 김치 에요~ 진짜... ,원&원일상님의 블로그,https://blog.naver.com/alsdk80,2017-06-01
홍성 시장 맛집_ 70년소머리국밥 ,https://blog.naver.com/s0m_s0m?Redirect=Log&logNo=221127800450, 70년어머니의 대를이은 곳이라네요. 정말 그럴것같아요. 영업시간은 오전 8시부터 오후 8시라고합니다. 메뉴입니다.소머리국밥 을 주문했습니다. 정말 지팡이도 잊게하는 맛일지ㅎㅎ 가게는 의자테이블과... ,솜블로그♡,https://blog.naver.com/s0m_s0m,2017-10-29
예산삽교70년전통 원조국밥 !-백종원 3대천왕소머리국밥 ... ,https://blog.naver.com/pbsangel78?Redirect=Log&logNo=222108752646,"했더니만,국밥 에 고기가 많아 이것도 나중에는 남겼드랬네요~~ #한일식당 # 소머리국밥국밥나왔슈~~70년전통! 3대에 이은~~ 원조 삽교소머리국밥드뎌 맛 본다고 좋아하는 울 서방^^ㅋ 사진 찍기 전에 숟가락... ",우진영의 행복한 노래세상,https://blog.naver.com/pbsangel78,2020-10-07
[홍성] 70년 소머리국밥 집,https://blog.naver.com/bbang900617?Redirect=Log&logNo=220547517953,홍성70년 소머리국밥 집이라고 치니까 딱 나왔다 일단 출발하고 도착해보니 보이는 것은... 보통 국밥집이나 백반집에는 비싼쌀을 써서 밥맛에 승부를 거는 스타일인데 여기는 아닌가보다... 70년을 이은 비결은... ,"잠은 밖에서, 밥도 밖에서",https://blog.naver.com/bbang900617,2015-11-23
[홍성여행]그림이있는 정원과70년소머리국밥그리고... ,https://blog.naver.com/sligo16?Redirect=Log&logNo=220692234210,금강산도 식후경 오전내 걸었더니 배도 고프고 홍성의 맛집중 하나인70년 소머리국밥 집을 찾아왔다. 골목길 안에 숨어있어 잘 찾아야 한다. 그 옆에 50년 소머리국밥집 30년 소머리국밥집이 있다. 다음에... ,슈퍼직장인 되어보기,https://blog.naver.com/sligo16,2016-04-24
