title,link,description,bloggername,bloggerlink,postdate
"충남 홍성 맛집, 70년소머리국밥 ",https://blog.naver.com/asdop0?Redirect=Log&logNo=221888232697,국밥집70년소머리국밥 입니다. 70년 전이면 625전쟁이 일어났던 1950년부터 국밥집이 있었다는 건데 정말 그 당시 이곳은 어땠을지 짐작조차 하기 어렵네요. 또한 소머리국밥은 예로부터 소가 귀했던 시절 한번... ,"알마, 지금 여기",https://blog.naver.com/asdop0,2020-04-03
 70년소머리국밥 :)신동엽이 극찬한 국밥집/충남 홍성 맛집,https://blog.naver.com/rkdtpwls55?Redirect=Log&logNo=221991550366,없는70년 소머리국밥 ! 실제로 찾아가보니 정말 ... 그시대를 살아보진 않았지만 70년으로 돌아간듯한... link=68fxf0kx70년 소머리국밥 의 정말 심플한 메뉴표입니다 메인메뉴 소머리국밥과 수육만 판매되고 있어요... ,Sejin’s Choice,https://blog.naver.com/rkdtpwls55,2020-06-06
명불허전 홍성 맛집70년 소머리국밥 ,https://blog.naver.com/mnonz?Redirect=Log&logNo=221712685793,"위치한 ' 70년 소머리국밥 '이다. * 홍성70년 소머리국밥① 위치: 홍성 전통시장 내 ② 주차: 국밥집 정문... 메뉴: 소머리국밥 9,000 / 소머리국밥(특) 13,000 / 수육 ⑥ Olive TV '오늘 뭐 먹지?' / tvN '놀라운 토요일' / KBS... ",기억하기 위해 기록하는 순간,https://blog.naver.com/mnonz,2019-11-19
[충남 홍성] 신동엽이 극찬했던70년소머리국밥재방문 후기,https://blog.naver.com/peaceto11?Redirect=Log&logNo=222526435893,예전에 홍성에서 국밥 먹었던게 떠올라서 급히 목적지를 국밥집으로 바꾸고70년소머리국밥 을 먹고... [주문] 소머리국밥 (하얀육수) 2개 국밥이 등장합니다-----! 역시 국밥은 팔팔 끓는 상태로 입천장 다... ,쉽게 쉽게 살아요.,https://blog.naver.com/peaceto11,2021-10-04
맛집 탐방│ 70년 소머리국밥 (충남 홍성) _ tvn 놀라운... ,https://blog.naver.com/jain036?Redirect=Log&logNo=222539442636,"들어오면 국밥집이 많이 있더라고요. ' 70년 소머리국밥 '은 제일 안쪽, 시장 공용화장실 맞은편에 위치해 있어요. 70년의 역사가 느껴지는 외관이에요. 월요일은 휴무라고 그래서, 오서산 하산하면서... ",츄블리's 적자생존기,https://blog.naver.com/jain036,2021-10-18
남당항 2박3일 캠핑/새조개샤브샤브 동백/ 70년소머리국밥 ,https://blog.naver.com/21urin?Redirect=Log&logNo=222378975202,아침먹으러70년소머리국밥 집으로 출발 검색하다 찾은곳인데 유명한 곳이더라고요 도착해서 소머리국밥 4개 시키고 가계내부 구경 연예인 사인도 보이고 신동엽이 극찬 곳 이래요 개대가 됩니다. 깍두기... ,맛있는 세상,https://blog.naver.com/21urin,2021-06-01
[홍성 맛집] 70년소머리국밥후기 - 신동엽이 극찬한 국밥집,https://blog.naver.com/trustreal?Redirect=Log&logNo=222227312698,"웨이팅70년소머리국밥메뉴판과 가격 국밥이 10,000원이면 결코 저렴한 가격은 아닌 거 같고 하얀 육수와 빨간 육수 선택 가능 기본은 빨간 육수 밑반찬은 뭐 평범하니 괜찮네 드디어 나온 빨간육수의 소머리국... ",허니보이,https://blog.naver.com/trustreal,2021-02-01
홍성70년 소머리국밥 ,https://blog.naver.com/leekh8412?Redirect=Log&logNo=221801461703,70년이라 하면.. 대략 1950년대부터 영업을 해 왔다는 것인데. ' 70년 소머리국밥 '집의 메뉴판. 메뉴는 소머리국밥과 수육 이렇게 두 가지로 심플하게. 우측 하단에 표기되어 있긴 한데 여기는 기본적으로 얼큰한... ,Eating & Traveling,https://blog.naver.com/leekh8412,2020-02-23
홍성 맛집70년 소머리국밥 에서 든든하게 아침 먹기,https://blog.naver.com/hsgstory?Redirect=Log&logNo=222013807746,70년간 한자리에서 장사를 하고 있다는 소머리국밥집의 솥이다. 홍성을 여행을 하다 보면 유독... 해장하러 왔다가 해장술 마시게 만드는 홍성 맛집 홍성70년 소머리국밥 집의 내공이다. 소머리국밥의 맛을... ,함께하는 홍성이야기,https://blog.naver.com/hsgstory,2020-06-27
충남 홍성 맛집] 70년소머리국밥신동엽이 극찬한 국밥집에... ,https://blog.naver.com/dlsdp2720?Redirect=Log&logNo=222476312365,멀고먼 충남 근처에서의 업무를 다 마치고 점심식사 할 곳을 찾다가 지인추천으로 다녀온국밥 집을 소개할까해:) 신동엽이 TV프로에 나와서 극찬했다는70년 전통의소머리 국밥 집 요건 주차를 하고 골목골목을... ,160 쪼꼬미의 현직모델활동 정보 밎 일상기록,https://blog.naver.com/dlsdp2720,2021-08-19
"[홍성맛집]홍성재래시장맛집, 70년 소머리국밥 집",https://blog.naver.com/minjeongp?Redirect=Log&logNo=221745618875,"축산업이 발달한 홍성답게 돼지국밥, 소머리국밥 같은 국밥 메뉴가 장터의 시그니처 메뉴로 자리잡고... # 70년소머리국밥 집 장터국밥의 맛과 분위기를 제대로 맛볼 수 있을 듯합니다. 메뉴는 국밥과 수육 2가지.... ",지니마미의 집과 집밥,https://blog.naver.com/minjeongp,2019-12-22
홍성70년 소머리국밥먹으러~ 국물 진짜 깊고 진한맛 크으,https://blog.naver.com/noheul29?Redirect=Log&logNo=222284302570,괜히 70년 전통이 아니구나~~ 하는 맛!! 뒤적이면서도 사진 찍을껄 ㅠㅠㅠ 안에 고기 많은데ㅠ 진짜... 홍성가볼만한곳 #홍성소고기 #홍성시장맛집 # 70년소머리국밥#홍성국물맛집 #소머리국밥택배 #내돈내산맛집,"My daily life, 먹기 놀기 일상 :)",https://blog.naver.com/noheul29,2021-03-23
[홍성/ 70년소머리국밥 ] 신동엽이 극찬한 전통적인 국밥집,https://blog.naver.com/dasom92418?Redirect=Log&logNo=222045993212,위치한 ' 70년 소머리 국밥 ' # 70년소머리국밥#홍성맛집 저희는 뒷문쪽으로 갔어요 정말 건물과 건물... 듣던 70년 전통의 소머리 국밥 이타가 시킨 맑은 국물이에요 옆에있는 새우젓과 후추 조금 넣으니깐 간이... ,오늘의 이타,https://blog.naver.com/dasom92418,2020-07-30
충남 홍성 홍성읍70년 소머리국밥 ,https://blog.naver.com/hongje5233?Redirect=Log&logNo=221963787930,충청남도 홍성으로 여행을 갔을 때 홍성읍에 있는 오래된 음식점인70년 소머리국밥 이라는 음식점에... 제가 주문하게 되었던 소머리국밥인데 특이하게도 흔히 알고있던 맑은 국물의 소머리국밥과는 달리 붉게... ,블루벨의 사진과 여행,https://blog.naver.com/hongje5233,2020-06-18
홍성 맛집 /70년 소머리 국밥 집,https://blog.naver.com/umicha?Redirect=Log&logNo=222354033026,간만에 맛집 포스팅 예전에 다녀온 홍성70년 소머리국밥 집 저장만 해놓다가 드디어 발행..! 식당은 시장... 시킨건 소머리국밥과 수육 소짜 둘이지만.. 언제 또 와보겠냐 싶어서 수육 시킴 남기면 포장해갈... ,요무로그,https://blog.naver.com/umicha,2021-05-17
"[홍성] 홍성당일치기 , 홍성 신동엽맛집70년소머리국밥 ",https://blog.naver.com/aa8122?Redirect=Log&logNo=222506160609,외관부터 이미 찐맛집느낌 맛없으면 안될 외관비쥬얼70년소머리국밥메뉴예요. 소머리국밥에 들어가는 고기는 전부 한우!!!! 소머리국밥 2개를 주문했어요.70년소머리국밥 의 국밥은 기본이... ,"유디니네 일상,기록",https://blog.naver.com/aa8122,2021-09-15
홍성 .70년소머리국밥❣️,https://blog.naver.com/bao_nana?Redirect=Log&logNo=221832161735,저번에는 홍성 #결성칼국수 맛집에 다녀왔었는데 이번에는 # 70년소머리국밥맛집에 가봤어요 #홍성맛집... 하늘색문에 #70년전통소머리국밥 표지판이 나와요 열고 들어가시면 잘 찾아가신겁니당 !!!!! 큰길가... ,"•[ 오늘 , 봔 ]•",https://blog.naver.com/bao_nana,2020-03-01
덕산 스플라스 리솜 / 홍성 /70년 소머리국밥 집,https://blog.naver.com/pantrymagic?Redirect=Log&logNo=222357331553,' 70년 소머리국밥 ' 신동엽님이 극찬한 집이라고 합니다. 그래서 체크아웃을 하고 떠났습니다... 체험한 그대로 작성했습니다. #덕산스플라스리솜 #주변 #홍성 #내포 #예산 #덕산 #맛집 # 70년# 소머리# 국밥#아침 #조식,투자와 투기의 그 어느 중간,https://blog.naver.com/pantrymagic,2021-05-19
홍성전통시장70년 소머리국밥 ,https://blog.naver.com/gomtn?Redirect=Log&logNo=221778371261,음식점 앞에는 국밥육수를 계속 끓이고 있는 커다란 통이 여러개 있습니다. 홍성에 가시면 꼭 맛보시길 추천드립니다. #국밥맛집 #소머리국밥 # 70년소머리국밥#홍성전통시장 #소머리국밥맛집 #전통시장 #시장맛집,박영춘의산행정보 (Gosan21.net),https://blog.naver.com/gomtn,2020-01-20
신동엽이 극찬한 홍성70년 소머리국밥 ,https://blog.naver.com/fairy2177?Redirect=Log&logNo=221997411635,그래서 서해 몽산포오토캠핑장을 갈때 횡성을 거쳐 일명 신동엽이 극찬한다는 소머리국밥을 먹으러 갔었습니다. 오늘은70년 소머리국밥 에 대해 포스팅해드릴께요 주소 : 충남 홍성군 홍성읍 의사로 43번길 27-9... ,열매지은이,https://blog.naver.com/fairy2177,2020-06-11
신동엽 인생맛집. 홍성 전통시장70년소머리국밥 ,https://blog.naver.com/margen_?Redirect=Log&logNo=221808645001,홍성 전통시장 내에 있는70년소머리국밥이라는 장소 짧은 국내여행으로 굴을 먹으러 놀러가는 길에... 소머리국밥 국밥집에 특 메뉴가 있으면 나도모르게 항상 특으로 된걸 시키는데 국물을 다 안먹는... ,숨의 공간,https://blog.naver.com/margen_,2020-02-14
 70년 소머리국밥 집 - 홍성 전통시장 국밥집 탐방,https://blog.naver.com/hsgstory?Redirect=Log&logNo=221662637188,"홍성 전통시장에는 30년 전통의 뚱땡이 아줌마, 원조 할머니 장터국밥, 홍동집, 홍성집, 덕이네 진한 소머리국밥, 윤희네집,70년 소머리 국밥 집 등 소머리국밥집 10여곳이 영업을 하고 있습니다. 장날이면... ",함께하는 홍성이야기,https://blog.naver.com/hsgstory,2019-09-29
홍성 소머리국밥 맛집70년 소머리국밥 ,https://blog.naver.com/ambo601?Redirect=Log&logNo=221708867743,나중에 안 사실이지만 정문이 따로 있고 요건 후문 방송도 타신 홍성 소머리국밥 아참 홍성70년 소머리국밥 ! 70년 !! 유명인사들이 사인도 많이 하셨네요 가격은 좀 있는 편이겠죠? 보통이 9000원 특이 13000원... ,포항연합한의원,https://blog.naver.com/ambo601,2019-11-15
[홍성맛집] 신동엽이 극찬한 홍성 ' 70년 소머리국밥 ',https://blog.naver.com/sjgj0313?Redirect=Log&logNo=222081784426,맛있길 바라며...ㅎㅎ 잘 먹고 왔습니다~~~~~ -그럼 이만- #홍성맛집 #홍성소머리국밥 #홍성전통시장 #홍성가볼만한곳 #용봉산맛집 # 70년소머리국밥#소머리국밥맛집 #국내여행 #홍성여행,수자니의 수수한 블로그 :),https://blog.naver.com/sjgj0313,2020-09-06
"충남 홍성시장 맛집, 신동엽이 극찬한70년 소머리국밥 ",https://blog.naver.com/o6280328?Redirect=Log&logNo=221761345313,메뉴 및 가격70년 소머리국밥 집에는 메뉴가 두가지밖에 없다. 소머리국밥과 수육 국내산 한우를 사용한 소머리국밥이라 그런지 재래시장 안쪽에 있는 가게치고 가격이 비싼 편이긴 했는데 맛을... ,"언제나,봄❤️",https://blog.naver.com/o6280328,2020-01-06
 70년 소머리 국밥 집,https://blog.naver.com/sssb6707?Redirect=Log&logNo=222468440262,다른데 갈까 했는데70년전통이니깐! 들어왔을 때는 외부랑은 다르게 오래됐지만 깔끔하게 잘... 신동엽이 극찬을 했다고 해요 메뉴는소머리국밥 과 수육!소머리국밥2개랑 수육을 하나 시켰지요... ,일상을 기록하다,https://blog.naver.com/sssb6707,2021-08-13
홍성 맛집 홍성70년 소머리국밥- 충남 홍성 소머리국밥 맛집,https://blog.naver.com/bmjhhj?Redirect=Log&logNo=222346325974,(시장공영주차장등이용해야함) # 70년소머리국밥#홍성 70년소머리국밥#소머리국밥맛집 #홍성맛집 #홍성소머리국밥 #홍성시장 #홍성시장맛집 #충남홍성맛집 #홍성시장 70년소머리국밥#홍성시장 70년소머리국밥 ... ,하늘을 날자~~~!,https://blog.naver.com/bmjhhj,2021-05-11
와서 혼밥하기 좋은 홍성 맛집 신동엽이 극찬한 ' 70년 소머리국밥 ',https://blog.naver.com/tkdgma009?Redirect=Log&logNo=222247077518,소머리 국밥입니다. 사실 홍성에 요거 외에 특별히 생각나는 맛집이 잘 없기도 합니다. 일단 간판에서 나오는 포스가 맛집 포스 뿜뿜입니다. 바로 홍성 맛집70년 소머리국밥 집입니다. 홍성전통시장 앞에... ,흐미의 힘을주는 블로그,https://blog.naver.com/tkdgma009,2021-02-17
여행 서산 ~ 홍성해미읍성 읍성분식 홍성시장70년 소머리국밥 ,https://blog.naver.com/herokiddy?Redirect=Log&logNo=222436400887,홍성70년 소머리국밥 을 먹어보고 싶었기 때문이다. 홍성시장 인근은 꽤 큰 시내인데 주말임에도 불구하고 개미새끼 한마리 안보이는 희한한 동네였다.. 가격이 올랐는지 일반 소머리국밥이 자그마치 만원이다.... ,untitled,https://blog.naver.com/herokiddy,2021-07-18
"홍성맛집 -70년 소머리국밥 ,출장길에",https://blog.naver.com/aini_sy?Redirect=Log&logNo=222287165693,"간단 메뉴,국밥 ,수육 tv방송 열일하는소머리 곰탕 집에 와서 찍은 한우 소머리국밥 , 소포장 출장가는 길에 현지 맛집을 가는 게 또 하나의 즐거움이다. #홍성맛집 #홍성 소머리국밥# 70년 한우 소머리국밥#장터 국밥 ",영쓰즐건인생,https://blog.naver.com/aini_sy,2021-03-25
홍성 소머리국밥 [ 70년 소머리국밥 ] 신동엽님 극찬맛집!,https://blog.naver.com/jangwb0531?Redirect=Log&logNo=222027040630,ㅎㅎ 70년전통도 고기 맛에서만큼은 확실히 보장됩니다! ㅋㅋㅋㅋㅋㅋㅋㅋㅋㅋㅋ 특도 아니고 보통인데 이정도는 비워줘야죠?...ㅎㅎㅎ70년 소머리국밥메인 메뉴인 빨간국물 소머리국밥을 먹어봤으면... ,비니Cooper,https://blog.naver.com/jangwb0531,2020-07-10
홍성가면 꼭 먹게되는 소머리국밥70년 소머리 국밥 집,https://blog.naver.com/seri9911?Redirect=Log&logNo=222537191238,예전에 아는 동생이소머리국밥 을 포장해서 저희집에 보내왔는데요 그때의 맛있게 먹었던 추억이 있어 홍성에 들른김에 방문하게 되었습니다. 위치는 아래 링크를 통해 확인하세요 ▼▼▼ 영업시간 안내... ,만둥이일상 맛집/신발/리뷰:),https://blog.naver.com/seri9911,2021-10-14
홍성 맛집70년소머리국밥신동엽이 극찬한 소머리국밥집~,https://blog.naver.com/sadnonono?Redirect=Log&logNo=222124329832,태안으로 이동중 점심을 먹기 위해 방문했던 충남 홍성에 취이한70년소머리국밥 집인데요~ 신동엽님이 극찬해서 더욱 더 유명해진곳이기도합니다. 소머리국밥 빨간거 하얀거 그리고 수육까지 먹고... ,오늘도 먹어봐요!,https://blog.naver.com/sadnonono,2020-10-23
"충남 홍성 맛집, ' 70년 소머리국밥 '(장터국밥,홍성시장,수육,택배)",https://blog.naver.com/rheology?Redirect=Log&logNo=221973237579,세월의 흔적이 그냥70년전통을 보여주는 비주얼이다 ㅋ 이건 기본인데~얼큰한 맛이다. 맛은? 홍성한우가 유명하니 역시나소머리국밥 도 맛나다 ㅎ 3인분 이상은 택배된단다. 1인분에 만원. 택배비 3천원.... ,Tears of happiness at 27,https://blog.naver.com/rheology,2020-05-21
[충남 홍성70년소머리국밥 ] / 홍성군에서 꼭 먹어야 할 국밥... ,https://blog.naver.com/t2p4192?Redirect=Log&logNo=222118357685,"홍성에 왔으면 홍성의 특산물인 한우를 먹어야제ㅎㅎ 그래서 충남 홍성군70년 소머리국밥 집 2008년 8월... 했는데 정문 아니었고 ㅎㅎ 내부에도 스웩장난아니다 홍성 한우겠지?ㅋㅋㅋ 소머리국밥 빨간놈, 하얀놈... ",궁물러버 홍태백의 국물여지도,https://blog.naver.com/t2p4192,2020-10-17
홍성 맛집70년 소머리국밥 ,https://blog.naver.com/invinkr?Redirect=Log&logNo=222047668934,2대째70년 간 이어져 내려온소머리국밥 을 먹기위해서...^^ 참고로 식당에는 주차장이 없다. 시장근처에 주차해야함... 가게로 가는 짧은 시장길이 좀 복잡하긴해도 간판이라던지 안내표지가 시장곳곳에 있어서... ,구르다 바퀴,https://blog.naver.com/invinkr,2020-07-31
[홍성]70년 소머리국밥 ,https://blog.naver.com/hy2123?Redirect=Log&logNo=222007857055,#소머리국밥 #홍성소머리국밥 #홍성시장국밥 # 70년소머리국밥#수육 #빨간국밥 #하얀국밥 #홍성전통시장 #장터국밥 #홍성장터국밥 홍성전통시장에서 찾아보면 간판이 보여요 이곳으로 가게된 이유는 빨간... ,하늘과 바다가 좋아,https://blog.naver.com/hy2123,2020-06-21
홍성70년 소머리국밥- 추천하고싶은 국밥 맛집,https://blog.naver.com/jhw424_hw?Redirect=Log&logNo=222037980059,"홍성에서 내당한우 먹고소머리국밥 으로 해장하는게 참된 루트인듯 ㅋㅋ 신동엽이 극찬한국밥 으로 유명한 집이다. 일단 전날 먹은 내당한우 소고기와 육회비빔밥. 언제 가도 맛있는 곳이고, 소주도 술술 잘... ",반갑습니다,https://blog.naver.com/jhw424_hw,2020-07-22
충남 홍성70년소머리국밥:: 신동엽이 극찬한 국밥집... ,https://blog.naver.com/pyooo92?Redirect=Log&logNo=222214550721, 70년소머리국밥 집 국밥충인 정봉이가 딱 좋아할꺼같아서 아침먹으러 갔다왔다아--70년 소머리국밥 ... 가게 앞에서 솥단지째 끓이고 있는 소머리국밥 이걸보니 더 기대되는 국밥맛 엥...? 분명 본 블로그에는... ,"무지개를 보고싶다면, 비를 견뎌내야해",https://blog.naver.com/pyooo92,2021-01-21
"[홍성,70년 소머리 국밥 집] 구수하고 개운한 소머리국밥",https://blog.naver.com/onyou0707?Redirect=Log&logNo=222504560918,식당을70년 소머리 국밥 집으로 정하고 오픈 시간을 보니 아침 9시. 그럼 이 시간에 맞춰 도착해서 아침을 먼저 먹고 걷기로 결정했다. 영업시간 9시~ 5시까지 재료 소진시 일찍 문닫음 소머리국밥은 빨갛게... ,인스 블로그,https://blog.naver.com/onyou0707,2021-09-13
생일 기념 여행 - 다시찾은 홍성 맛집70년 소머리국밥 ,https://blog.naver.com/sweetykw?Redirect=Log&logNo=222080182753,맛집70년 소머리국밥작년 홍성여행때도 들렸는데 이번에도 또 왔다 (그리고 앞으로도 홍성올땐 또 들릴것이다) 좌식과 테이블석 있는데 밤알이때문에 좌식으로 왔다 (아기의자 없음) 소머리국밥 (특) 기본이... ,너에게 나를 보낸다,https://blog.naver.com/sweetykw,2020-09-21
충남 홍성 맛집 |70년소머리국밥 ,https://blog.naver.com/vlogg?Redirect=Log&logNo=222237552652,"홍성70년 소머리국밥애매한 시간임에도 사람이 많았당! 6시까지밖에 영업안하는듯 오늘 뭐먹지에 나왔었구낭,, 여긴 특이하게 소머리국밥 기본이 빨간육수라서 하얀육수를 원하면 미리 말해야한다고 한다! 다... ",INNER PEACE,https://blog.naver.com/vlogg,2021-02-09
[충남홍성맛집/군청인근/오늘뭐먹지]70년 소머리국밥 집,https://blog.naver.com/xxchoi_mh?Redirect=Log&logNo=222189784085,"극찬했다는70년 소머리국밥 에 가게 되었어용 : )70년 소머리국밥 은 월화는 휴무고 (1,6일 장날엔 오픈)... 메뉴는 소머리국밥과 수육 소머리국밥은 빨간육수와 하얀육수가 있는데 기본이 빨간육수라고 하니... ",CHOI's CHOICE,https://blog.naver.com/xxchoi_mh,2020-12-29
충청도 홍성맛집 국밥70년소머리국밥 ,https://blog.naver.com/kbr7028?Redirect=Log&logNo=222424685556," 70년소머리국밥평일 10:00 - 17:00 월,화는 휴무, 브레이크타임 15:00~17:00 메뉴는 심플하게 소머리국밥 수육 전부입니다 소머리국밥은 기본 양념된 상태라고 하니 맑은 육수 드시고 싶은분들은 주문할때 따로... ",오늘도 곰손라바씨,https://blog.naver.com/kbr7028,2021-07-08
[홍성]70년소머리국밥오늘뭐먹지 신동엽이 극찬함,https://blog.naver.com/suka_dh?Redirect=Log&logNo=222143303890,홍성70년 소머리국밥블하 연휴 전에 홍성에 갈 일이 생겨서 근처 맛집을 검색하다가 홍성하면 한우 그리고 소머리국밥이길래 검색해서 다녀왔음 홍성70년소머리국밥 은 홍성 소머리국밥집 중에서도 홍성... ,갤러리 털기,https://blog.naver.com/suka_dh,2020-11-13
홍성70년 소머리국밥 집 빨간 장터국밥 맛보기,https://blog.naver.com/amdtour?Redirect=Log&logNo=222422588374,오전에 예약하고 방문하여 검사를 마친후 점심시간이 다가와 안면도 집까지 가서 먹기에는 시간이 애매해서 예전에 가보고 싶었던70년 소머리국밥 집 방문. 70년 전통답게 사람이 많을줄 알았으나 다행히... ,포세인의 바다루어,https://blog.naver.com/amdtour,2021-07-06
 홍성 소머리 국밥70년 소머리 국밥 ,https://blog.naver.com/bluefish1058?Redirect=Log&logNo=222041481343,홍성 소머리 국밥집을 먹으러 가보았습니다. 우리 집 큰아들께서 여기가 본인이 어렸을 적에 많이 먹으러 와 본 곳이라며 추천해준 # 70년소머리국밥집입니다. 이런 가만히 보니 TV에도 출연한 적이... ,Stella's Diary,https://blog.naver.com/bluefish1058,2020-07-25
극찬한 홍성 전통시장70년소머리국밥! 인생 소머리국밥 어 인정~,https://blog.naver.com/u-ssu?Redirect=Log&logNo=221981691310," 70년소머리국밥충남 홍성군 홍성읍 의사로43번길 27-9 041-433-1240 평일 09:00~19:00 (월/화요일 휴무, 장날은 영업) Hi ! 뚜뚜입니다:D 신동엽님께서 극찬한 소머리국밥집 ! 홍성 전통시장 70년전통소머리국밥에... ",Luceat lux tua,https://blog.naver.com/u-ssu,2020-05-28
홍성맛집70년 소머리국밥 (feat.신동엽),https://blog.naver.com/2001gilsang?Redirect=Log&logNo=222405666312,안면도 여행을 마치고 인천으로 올라가던길 차도 막히고 점심시간이라 배도고파 주변을 검색하다 들리게된 소머리국밥집 이름이70년 소머리국밥 이다 간판을 따라 골목길로 들어가니 오...여기가 맞나 싶고 좀... ,길상이의 일상,https://blog.naver.com/2001gilsang,2021-06-21
홍성맛집70년소머리국밥 ,https://blog.naver.com/mugiwara1?Redirect=Log&logNo=221956056344,ㅂㅂ 코로나 조심하구 자차있으면 다녀와^^ #홍성맛집 #홍성소머리국밥 #홍성맛집추천 #홍성 70년소머리국밥#홍성방송맛집 #홍성소머리국밥집추천 #홍성시장맛집 #홍성빨간소머리국밥 #홍성수육가게... ,한 발로 외발자전거 타기 ;-),https://blog.naver.com/mugiwara1,2020-05-11
[홍성]70년 소머리 국밥 집 ( 소머리국밥 맛집 장터국밥 맛집),https://blog.naver.com/kafkams?Redirect=Log&logNo=222080207799,믿고 가는 동엽 신 의 맛집 가장 가까운 곳에 있는 신동엽 맛집 이니 반듯이 방문하겠다는 의지를 가짐70년 소머리국밥이름부터 믿음이 간다 경기도 광주 곤지암 [ 최@자 소머리 국밥 ] 이 후 첫 소머리국밥... ,동네식유기,https://blog.naver.com/kafkams,2020-09-04
"홍성맛집,신동엽도 극찬한 [ 70년소머리국밥 ]",https://blog.naver.com/jii_09?Redirect=Log&logNo=222312569853,맛있었어요 ㅠㅠ 맛집맞아요 홍성맛집 국물까지 완공 했습니다 진짜 깍두기랑 같이 먹은 호로록 장난아니예요 술먹고 다음날 꼭 들리고싶은 홍성맛집 이였습니다~! 소머리국밥 맛집70년 소머리국밥 집 041-633-1240,자취하는집사,https://blog.naver.com/jii_09,2021-04-16
홍성맛집70년소머리국밥 ,https://blog.naver.com/icerujun2?Redirect=Log&logNo=222397998871,반찬은 간단하지만 다맛있어서 만족 고기양도 넉넉하고 소주를 부르는 국물이지만 낮이니까 참아본다.. #홍성 #홍성맛집 # 70년소머리국밥#국밥 #소머리국밥 #국밥맛집 #놀토 #놀토국밥 #신동엽,찌니오니님의블로그,https://blog.naver.com/icerujun2,2021-06-14
홍성70년 소머리 국밥 ,https://blog.naver.com/1004gt?Redirect=Log&logNo=222282531320,길을 잃은 ㅠ 그냥 쭉 가다가소머리국밥 을 파는 곳이 있길래 여기다! 앗..없네 하는 순간 안쪽으로 들어가니 이렇게 있어서 못찾을 뻔 했어요!! 앉자마자 빨간것과 하얀것이 있다고 하시더라구요 맵찔이 이지만... ,맛집사전,https://blog.naver.com/1004gt,2021-03-21
"충남 홍성 ' 70년소머리국밥 '(홍성시장내,홍성맛집,홍성한우)",https://blog.naver.com/happyrheo?Redirect=Log&logNo=222402983576,사실 홍성한우가 유명하기때문에 소머리국밥집이 맛있는건 당연한거 아닐까요 ㅋ 시골식당 분위기의 맛집~ 소머리국밥 맛집! 홍성70년 소머리국밥식당 이름자체에서 역사와 전통이 느껴지네요 ㅋ 주차는... ,Fearless challenge!,https://blog.naver.com/happyrheo,2021-06-19
