title,link,description,bloggername,bloggerlink,postdate
 70년전통이 느껴지는 얼큰한 홍성 소머리국밥 ,https://blog.naver.com/manitto07?Redirect=Log&logNo=221200449815, 70년전통의소머리국밥 . 흔히 한우로 유명한 도시라고 하면 강원도 횡성을 생각하지만 충청남도 홍성 역시 곡창지대를 끼고 있어 소먹이가 풍부한 까닭에 오래전부터 소를 많이 키웠다 한다. 홍성에서... ,Toi la madam,https://blog.naver.com/manitto07,2018-02-03
충남 홍성 ' 70년 소머리국밥 '(신동엽 성시경 오늘뭐먹지?),https://blog.naver.com/leesparm?Redirect=Log&logNo=221459890651,충남 홍성에 유명한 소머리국밥집이 있습니다. ' 70년 소머리국밥 '입니다. '신동엽 성시경 오늘뭐먹지?'에 방영되었던 집입니다. 기대됩니다. 갑니다. 길 건너에 주차를 하고 건널목을 건넙니다. 저기 보이는... ,리스팜(Lee's Farm),https://blog.naver.com/leesparm,2019-02-07
"국밥]70년소머리국밥| 오늘뭐먹지,놀라운토요일 소머리국밥... ",https://blog.naver.com/annachoi_88?Redirect=Log&logNo=221436621955,"그러나 빨간 국물의소머리국밥 은 서울에서 먹을 수 없다 했기에, 못먹어도 go. 밥 반 공기만 먹었으나, 맵기의 정도는 사실 밥 1공기를 다 먹었을 때 가장 맛있게 먹을 수 있을 듯 하다. 머릿고기는 정말... ",보고서,https://blog.naver.com/annachoi_88,2019-01-08
충남 홍성70년 소머리국밥 에 반해버렸다,https://blog.naver.com/pro9765?Redirect=Log&logNo=221711563562,고민하다가 간 곳은 바로~~~ 이곳70년 소머리국밥 이예요~ 제가 소머리 국밥을 좋아하는데 이렇다할 맛집을 못찾았었거든요... 그런데 마침 찾앗어요~~ 이곳은 찾아 갈 수 있는 길이 3가기 길이예요. 한가지 길은... ,여행과 소소한 일상공유,https://blog.naver.com/pro9765,2019-11-20
홍성70년 소머리국밥 ,https://blog.naver.com/yomsom0310?Redirect=Log&logNo=221721416079,"신동엽이 인생 국밥 이라고 한 곳이 홍성에 있다고? 부부 공동 캘린더에 대충 잊지말고 먹어야지... 쎄요국밥 9천, 특13천원이니까 일반적인 가격은 아니죠 그래도 신동엽이 그리도 맛난다고 강조를 했는데 포기할... ",YOMSOM 블로그,https://blog.naver.com/yomsom0310,2019-11-28
장터국밥70년 소머리 국밥 집 빨간육수 소머리국밥... ,https://blog.naver.com/yangtona?Redirect=Log&logNo=221478626175,맛집70년 소머리국밥이라는 식당을 방문했습니다. 메뉴는 상기와 같습니다. 저희는 3명이서 국밥보통... 소고기국밥 정도 수준입니다. 소머리수육이 정말 대박인데 정말 부드럽고 쫄깃쫄깃합니다. 물론 국밥에... ,미래교육전문 씽크퓨처스 4차산업혁명/트렌드/미래학,https://blog.naver.com/yangtona,2019-03-02
[충남홍성]70년 소머리 국밥 집,https://blog.naver.com/macaron0000?Redirect=Log&logNo=221461172348,"#홍성전통시장 안 장터국밥집 어머니의 대를 이은 # 70년소머리국밥 집 에서 #내사랑국밥 한그릇 하고 왔어요 시장안 골목에 위치한70년 소머리국밥 집으로 들어가보실까유 소머리국밥 8,000원 두그릇을 주문하고... ",용감한 초보농부 이야기,https://blog.naver.com/macaron0000,2019-02-08
강릉소머리국밥맛볼 땐70년전통 광덕식당이죠-,https://blog.naver.com/pinegn?Redirect=Log&logNo=221673535251,벌써70년 이란 전통을 가지고 있네요 +_+ 전통이 오래된 곳은 다 이유가 있더라고요 지은지 얼마 안 되어... 메뉴인소머리국밥 은 진한 국물이 일품!! 양념을 풀어 얼큰하게 즐겨도 좋고요 술안주나 해장으로도... ,강릉시청공식블로그,https://blog.naver.com/pinegn,2019-10-10
"홍성 한우 여행,70년 소머리 국밥 집/가내수공업 프로덕션... ",https://blog.naver.com/kwon8319?Redirect=Log&logNo=221123735099,처음으로 가려던 곳은 사정상 닫았다길래 차선책으로 오늘뭐먹지 홍성 편에 나왔던 ' 70년 소머리 국밥 집' 문에 스티커가 아주 귀엽다 딱 시골스러운 음식점 전경. 메뉴판 소머리 국밥 3개와 수육 1개를 시켰다.... ,권오리의 세상만사,https://blog.naver.com/kwon8319,2017-10-23
 70년전통의 원조 삽교소머리국밥(구) 한일식당,https://blog.naver.com/bl85219?Redirect=Log&logNo=220604238135,3대 천왕에 나왔던70년전통의 원조 삽교소머리국밥충청남도 삽교에는70년 간소머리국밥 을 판매하는 이름난 식당이 자리하고 있습니다. 여기는 예전부터 인기가 있었지만 최근에 3대 천왕이라는 TV 프로에... ,프림커피의 달달한 여행,https://blog.naver.com/bl85219,2016-02-19
충남 홍성70년 소머리 국밥 집노포의 칼칼한 해장 소머리 국밥,https://blog.naver.com/chaosok?Redirect=Log&logNo=221710092880,알려져 있으나 나는 따로 양념장을 받아먹어 보았다. 한우소머리 국밥 촌이 전국 여러 동네에 있으나 이곳 홍성도 결코 다른 지역에 뒤지지 않은 듯했다. #홍성맛집#홍성시장# 소머리국밥 #이날도업무상반주를참고,깃털처럼 가볍게,https://blog.naver.com/chaosok,2019-11-18
홍성 전통시장70년 소머리국밥 ,https://blog.naver.com/cwdksh12?Redirect=Log&logNo=221444076965,엄청 오래된 맛집이 있다고 해서 해장겸 ^^ 찾아간 곳이에요!!! 전통시장 안에 위치해 있답니당 웬 공사판인줄 ㅠㅠㅠ 좀 이른 시간인데도 사람이 북적북적해요.... 대기시간 있었음 ㅠㅠ 칠십년이나 됐대요... ,창원디젤서비스,https://blog.naver.com/cwdksh12,2019-01-17
"성시경은 오늘 뭐 먹지?_ 제105화②소머리 수육,소머리국밥 ",https://blog.naver.com/mangryan?Redirect=Log&logNo=220529730971,지금까지 봐 왔던 뽀~~얀 소머리국밥과는 달리 빨산색 소머리 국밥. 빨간 색깔에 비해 자극적인 맛도... 얘는 이미 국밥 그릇에 구멍을 낼 지경인데....ㅋㅋㅋㅋㅋ70년 소머리국밥충청남도 홍성군 홍성읍... ,"Mang의 맛.즐.기♥(맛있는 생활, 즐거운 이야기)",https://blog.naver.com/mangryan,2015-11-05
"신동엽,성시경 오늘은 뭐먹지?에 나온70년 소머리국밥 !!",https://blog.naver.com/dbspdlek24?Redirect=Log&logNo=220543420776,"ㅋㅋ 저~~~기 위에소머리국밥 집 간판이 보이네요! 저 간판을 딱! 보고 찾아갔답니다 ㅋ 식당 정면 사진 ㅋ 맛집 포스가 물씬 ㅋㅋ 올리브채널, '오늘은 뭐 먹지' 방영 됐었던 글이 똭!! ㅋㅋ 메뉴는 이렇게... ",소소한 일상,https://blog.naver.com/dbspdlek24,2015-11-18
홍성 - 70년 소머리국밥 ,https://blog.naver.com/besehemr7?Redirect=Log&logNo=221423528962,천북에 굴먹으러간 우리 숙소는 홍성으로 잡았다 전통시장도 구경할겸국밥 도 먹기로 함 횡성도 소가 유명 하지 만 이곳 홍성도 소가 유명하단다 시장안에소머리국밥 집이 여러개 옹기종기 모여있는데 우린... ,"변화는 있어도,변함은 없기를",https://blog.naver.com/besehemr7,2018-12-20
 70년 소머리국밥 집에서 돌아선 이유?,https://blog.naver.com/leadtime?Redirect=Log&logNo=220532902268,"얼마전 올리브TV 신동엽,성시경의 오늘은뭐먹지? 프로그램에 방송된 홍성전통시장70년 소머리국밥 집... 주말이면 사람들이 더 많이 찾는다고하니 좋지만, 맛은 변하지 않길 바라며, 찾아오신 손님들도 국밥이... ",초름이의 세상이야기,https://blog.naver.com/leadtime,2015-11-08
충남 홍성 먹거리 맛있는70년3대 시골소머리 국밥홍성시장,https://blog.naver.com/jdycad?Redirect=Log&logNo=221746101320, 70년 소머리 국밥 집 # 70년소머리국밥#소머리국밥 #홍성소머리국밥 #3대소머리국밥 #홍성국밥 #맛있는국밥 딱 두가지 허연거 빨건거. 그리고 수육 #어른들이좋아하는국밥 #시골국밥 #홍성먹거리... ,costdown.net,https://blog.naver.com/jdycad,2019-12-22
놀라운토요일 홍성70년 소머리국밥 ,https://blog.naver.com/zqqz99?Redirect=Log&logNo=221435448205,# 소머리국밥#홍성시장맛집 #놀라운토요일 놀라운토요일 시청후 다음날갔습니다 정말 MSG 안느껴지는 깔끔한 맛 가는날이 장날이라고...1일 6일 장날인데 6일에 가서 한참 기다리다가 먹었습니다 비쥬얼 보다... ,서산간판 서산현수막 디자인원,https://blog.naver.com/zqqz99,2019-01-06
오늘뭐먹지 충남홍성특집70년소머리국밥 ,https://blog.naver.com/27619?Redirect=Log&logNo=220560155332,분위기 죽임 밑반찬도 깔끔하고 맛도 좋았다. 특히 열무가~ 오~~ 새콤하면서 달콤한것이~ 오~~~ 메인메뉴소머리 국밥 은!! 한입 먹구선.. 첨엔.. 뭐지?? 했는데 먹을 수록 미침 추천!! 추천!!,-,https://blog.naver.com/27619,2015-12-06
홍성70년소머리국밥 집홍성소머리국밥집추천... ,https://blog.naver.com/hwangjamae?Redirect=Log&logNo=221052704318,시장골목 안에 # 70년소머리국밥 집 을 발견 ! ㅜ 비도 오고 일단 들어가기로~~ 오오~~ 진짜 70년세월이... 먹느라 정신없었던 듯 기름기많고 느끼한 국밥 싫어하는데 여기 소머리국밥은 떠다니는 기름기도 적고... ,지니닌 블로기,https://blog.naver.com/hwangjamae,2017-07-16
늑대와여우컴퓨터70년 소머리국밥삼성 프린터 레이저... ,https://blog.naver.com/hjco3?Redirect=Log&logNo=221540281077,프로그램 설치 준비 엘지 노트북 한글과 엑셀 설치 준비 한번에 2대 작업 박스 모델명 삼성 레이저 토너 판매70년 소머리 국밥저녁식사,홍성 컴퓨터 늑대와여우,https://blog.naver.com/hjco3,2019-05-17
홍성 맛집70년전통소머리국밥 !!! 여기가 진국이네~,https://blog.naver.com/s4774s?Redirect=Log&logNo=221543778052, 70년 소머리국밥여긴 좀 특이하네 빨간국물이라니 가봅시다 지도를 따라서 겉다보면 조오기 보이는... 저는 기본으로 나오는 소머리국밥을 저희 엄마는 매운걸 못드시기에 맑은국물로 주문을 했습니다 비쥬얼... ,"""91. 째째기 Life~""",https://blog.naver.com/s4774s,2019-05-22
 70년소머리국밥 -홍성,https://blog.naver.com/hartkmy?Redirect=Log&logNo=221657994050,유명맛집이라 해서 찾아간곳 내 입맛엔 쏘쏘한소머리국밥서비스도 쏘쏘~^^ 양파짱아찌 굳~♡ 주차장 없음..공용주차창에 30분에 500원 내고 댐.. #홍성 소머리국밥#9000원 #주차비내주면좋을듯,마마김,https://blog.naver.com/hartkmy,2019-09-24
"함께 예산] 예산 맛집,70년전통 3대가업의소머리국밥 , 한일식당",https://blog.naver.com/jay0713?Redirect=Log&logNo=221589547569,백종원의 3대 천왕에도 출연한 한일식당은소머리국밥 으로 유명한 전국구 맛집이다. 호텔에서 약 15분 정도 운전을 해서 가니 삽교읍의 두리시장 한 가운데 한일식당이 자리잡고 있었다. 30m 떨어진 주차장에... ,꿈꾸는 베짱이의 Enjoy Life,https://blog.naver.com/jay0713,2019-07-19
 70년장기식당소머리국밥 과 죽도시장 물회 (포항... ,https://blog.naver.com/manhattan212?Redirect=Log&logNo=222063288727,포항에 도착하자마자 방송에 자주 나오는 포항 죽도시장의 명물소머리국밥 집 '장기식당'에 들렀다. 1952년 부터 대를 걸러 운영 중이다. 식당 앞의 가마솥에서는 진한 국물이 연신 끓여지고 있었고 정확하게... ,뉴욕퀸닷컴 NEWYORKQUEEN.COM & STUDIO212MANHATTAN,https://blog.naver.com/manhattan212,2020-08-18
홍성 홍성읍 전통시장 소머리 국밥집 ' 70년 소머리 국밥 집',https://blog.naver.com/wkdrbgh21?Redirect=Log&logNo=221744051800,바로 1 국밥때리러 갔습니다ᄏᄏᄏ 국내산 한우를 써서 그런지국밥 치고는 가격이 좀 있는 편입니다! 그리고 특이하게 여기는국밥 이 빨간 육수를 기본으로 나오고 하얀 육수는 원하면 바꿔 줍니다ᄏᄏ 저희는... ,소소한 먹방,https://blog.naver.com/wkdrbgh21,2019-12-20
#충청북도 홍천 맛집_ 소머리국밥[홍동집],https://blog.naver.com/sunato?Redirect=Log&logNo=222426852544,한 분이 근처 식당인70년 전통소머리국밥 집에서 드셨다고 해서 그 근처에 보니까소머리 국밥 집이 2개가 있더라고요. 근처에 먼저 주차를 하고 여러 옵션들을 보고 결정할 계획이었어요. 홍성전통시장... ,"Sunahnoh 의 인생산책, 그리고",https://blog.naver.com/sunato,2021-07-10
예산 맛집소머리국밥 이 맛있는 한일식당,https://blog.naver.com/94040882?Redirect=Log&logNo=222392398708,"한일식당소머리국밥 이 진하고 맛있는곳 글, 사진 hello롱초 예산 한일식당 충남 예산군 삽교읍 두리2길... 흐르더라구요70년전통 3대 가업을 잇고 있다는 예산 한일식당 티비에도 여러번 방송이 된 적이 있는... ",롱초의 이야기,https://blog.naver.com/94040882,2021-06-10
"충남 삽교, 백종원소머리국밥맛집 '한일식당'",https://blog.naver.com/yonggyong?Redirect=Log&logNo=222480067986,"백종원의 3대천왕에 소개 된소머리국밥맛집 한일식당70년전통 3대 가업의 맛 한일식당에 다녀왔습니다☺️ Tel. 041-338-2654 매일 오전 09:00 - 20:00 일요일 09:00 - 19:00 한일식당은 모닝와이드,백종원의... ",◍•ᴗ•◍,https://blog.naver.com/yonggyong,2021-08-22
삽교 한일식당소머리국밥한 그릇 속이 확 풀려요~,https://blog.naver.com/alice8565?Redirect=Log&logNo=222468039966,3대가 이어온70년전통의 식당이라고 합니다. 백종원 씨가 맛집을 찾아다니기 시작할 때 다녀갔네요.... 먼저소머리국밥두 그릇을 주문했습니다. 그리고 국수도 먹어보고 싶어서 국수도 주문했습니다. 국수는... ,감동의 순간들 !,https://blog.naver.com/alice8565,2021-08-13
백종원의 3대천왕 예산맛집 '한일식당'70년전통소머리국밥 !!,https://blog.naver.com/runningtwin?Redirect=Log&logNo=221725089115,백종원의 3대천왕에 나온 예산맛집 '한일식당'소머리국밥입니다.70년전통 3대 가업의 맛이라고 합니다. 사람이 없는듯 해 보이지만 안에 들어가면 사람이 정말 많습니다. 위치는 참고하시구요. 영업일은... ,리버스트윈'S 기억을 담는 카메라,https://blog.naver.com/runningtwin,2019-12-02
2대째70년세월의 맛이 배인소머리국밥/ 전북 진안맛집... ,https://blog.naver.com/kasskara?Redirect=Log&logNo=20192187414," 소머리국밥 은 설렁탕에서 파생된 것이다.70년 대 짜장면과 함께 설렁탕은 서민의 음식이라 해서 가격을 함부로 인상할 수 없고, 가격의 책정은 국가에서 정했다. 설렁탕의 원가는 높아지는데 가격을 인상할 수... ",카스카라 Kasskara,https://blog.naver.com/kasskara,2013-07-22
 70년 소머리국밥 -충남 홍성,https://blog.daum.net/anfrha100/1226,홍성으로국밥먹으러 가자고 덤벼서 홍성이 한우로 유명하듯 시장에국밥 집이 즐비하다 물론 삽교에 있는 집을 좋아하지만 아직 방송조미료가 빠지질 않아 이곳으로 가격도 저렴하고 국물이 진하다 사리하나... ,술 먹고 밥 먹고 버벅대는 허~버~기,https://blog.daum.net/anfrha100,2016-06-04
[홍성] 덕이네진한 소머리국밥 ,https://blog.naver.com/woori8429?Redirect=Log&logNo=222122215422,곰방올라가겠징~ 하지만 세시간 넘음ㄱㅋ 마의 퇴근길ㅋㅋ #홍성맛집 #홍성 소머리국밥#홍흥집 # 70년 전통 소머리국밥#파괴왕간만에출두 #덕이네진한 소머리국밥#홍성전통시장맛집 #홍성시장맛집 #홍성 소머리국밥 ,우연찮게 멋지기.,https://blog.naver.com/woori8429,2020-10-21
