title,link,description,bloggername,bloggerlink,postdate
중문아침식사로 좋은가람돌솥밥 ,https://blog.naver.com/gpwls5084?Redirect=Log&logNo=222396321001,전복돌솥밥 엄청 맛있게 먹고 일정을 시작했네요 11시경 도착한가람돌솥밥아침밥이라고하기도 뭐한데... 왠지 갈치조림 먹으면 밥 두공기 먹을 것 같아서 아침에 조금 덜 부담스러운 통갈치구이로 선택했어요!... ,푸르릉데이,https://blog.naver.com/gpwls5084,2021-06-13
"제주가람돌솥밥, 중문 해물뚝배기가 맛있는",https://blog.naver.com/potato00214?Redirect=Log&logNo=222237857002,"성게전복 돌솥밥 을 주문했답니다 그 외에도 갈치구이, 옥돔구이, 고등어구이, 갈치조림, 고등어조림, 성게미역국 등 다양하게 있으니 입맛대로 고르면 될 것 같아요 여긴밥집이지만 뭐 술 안주로도 장난없네요... ","어느, 보통날 :)",https://blog.naver.com/potato00214,2021-02-09
제주 맛집 소개 컨벤션센터 근처가람돌솥밥 ,https://blog.naver.com/startsh8022?Redirect=Log&logNo=222078371408,제주 맛집 소개 컨벤션센터 근처가람돌솥밥친구에게 제주 맛집 소개를 받을 때마다 메모장에 적어... 상호명에서도 대략 짐작은 했는데 #전복돌솥밥 이 정말 기깔나게 잘 나옵니다. 비주얼만 봐도 밥 위에... ,"무무의 달콤, 쌉싸름한 일상",https://blog.naver.com/startsh8022,2020-09-02
제주서귀포맛집 중문 가람돌솥밥푸짐한 한상차림!,https://blog.naver.com/tammara?Redirect=Log&logNo=222409801899,제주 서귀포맛집가람돌솥밥인정 안할수가 없네용~ 돌솥밥도 잘 비벼놨으니 이제 메인인 갈치조림도 먹어봐야죠~ 와~근데 갈치가 진짜 두툼해요! 이렇게 두툼한 갈치는 처음 봤어요~ 앞접시에 두툼한 갈치와... ,딩크커플의 휘게 여행 라이프,https://blog.naver.com/tammara,2021-06-25
제주 중문 가볼만한곳 제주향토음식점가람돌솥밥 ,https://blog.naver.com/aksenthrtkf14?Redirect=Log&logNo=221711974143,제주 중문 가볼만한곳 제주향토 돌솥밥전문가람돌솥밥 에서 엄청 든든한 식사를 즐길 수 있었던 날이랍니다. 커플마사지도 받고는 남편이랑 같이 서귀포에 있는 제주 중문 가볼만한곳 들려 든든하게 식사를... ,귀찮지만 솔찍한 블로그.,https://blog.naver.com/aksenthrtkf14,2019-11-19
제주여행 2일차-중문 맛집가람돌솥밥 /제주 드라이브/서귀포항... ,https://blog.naver.com/flyhyun_k?Redirect=Log&logNo=222278606945,"중문가람돌솥밥제주특별자치도 서귀포시 중문관광로 332 매일 08:30~22:00 (라스트오더 : 21:00) 아침시간인데도 손님이 생각보다 많았어요! 슬쩍 사진 찍어 봄... 제가 까먹고 메뉴도 못찍었는데, 여긴 돌솥밥이... ",취미로 하는 블로그,https://blog.naver.com/flyhyun_k,2021-03-17
"제주도 3박 4일 가족여행4 : 산방산,가람돌솥밥 , 통갈치구이, 집",https://blog.naver.com/tgtgtyu?Redirect=Log&logNo=222280623268,오늘 점심은 돌솥밥으로 유명한 중문 가람돌솥밥http://naver.me/FYuaAufE 전화 0507-1432-1200 주소 제주특별자치도 서귀포시 중문관광로 332가람돌솥밥영업시간 매일 08:30~22:00 (라스트오더 : 21:00) 가격 전복돌솥밥 15... ,셀보를 프로듀스,https://blog.naver.com/tgtgtyu,2021-03-19
제주 중문가람돌솥밥저도 가봤습니다.,https://blog.naver.com/bow_land?Redirect=Log&logNo=221789885709,그런데 의견이 안 맞고 해서 근처에가람돌솥밥집에 들어갔습니다. 어머니들은 돌솥밥 좋아하잖아요... 하지만 진짜 아쉬웠던 점은 직원분 담 X 피우고 오셔서 바로 옆에서 테이블 치우시면 밥 먹을 때 담배... ,동우살롱 블로그,https://blog.naver.com/bow_land,2020-01-30
"제주중문맛집,제주전복돌솥밥맛집:) 가람돌솥밥 ",https://blog.naver.com/bomi0306?Redirect=Log&logNo=222438042762, 가람돌솥밥 은 종류가 엄청 많아요 ! 제가 알기론 시그니처는 전복돌솥밥과 #성게전복돌솥밥 인것 같은데 돌솥밥이다 보니 해물도 고스란히 느끼고 숭늉이나 누룽지로 만들어 먹을 수 있어서 속도 편하고 넘... ,매일매일 행복하게 :),https://blog.naver.com/bomi0306,2021-07-20
위호텔 산책피크닉-가람돌솥밥- 더 클리프 - 중문색달해수욕장,https://blog.naver.com/dessertarian?Redirect=Log&logNo=222456199387,"어머니의 맛 중문가람돌솥밥영업시간: 매일 08:30 - 22:00 (아침식사가능) 연중무휴 주차가능 주차공간은 가게앞에 여유있게 있어요. 시그니처 가람전복 돌솥밥 15,000 시그니처 가람전복 성게 돌솥밥 20,000 남편이... ",디저트랩,https://blog.naver.com/dessertarian,2021-08-04
넣어 비벼먹는 고소한 전복성게 돌솥밥 [제주 서귀포가람돌솥밥 ],https://blog.naver.com/angela8846?Redirect=Log&logNo=222206080162,뜨거운 돌솥에 지글지글 끓어가며 나오는 따뜻한 하얀 밥. 그리고 그 위에 올라가있는 전복과 성게. 증기때문에 촉촉한 물기가 눈으로도 보입니다가람돌솥밥매장 안에는 맛있게 먹는 방법이 친절하게... ,푸드디렉터 김유경의 테이스티코리아,https://blog.naver.com/angela8846,2021-01-13
제주도 ' 가람돌솥밥 ',https://blog.naver.com/kobi2c?Redirect=Log&logNo=222350397341,해서 오늘은 제주에 전복돌솥밥집인 ' 가람돌솥밥 '을 소개해 드립니다. 그런 시이이~~~작~^^ 제주 중문관광단지에서 멀지 않은 곳에 위치하고 있는 ' 가람돌솥밥 ' 전경이다. 핸폰(갤럭시s21 울트라) 사진이 잘... ,각시탈의 흔적,https://blog.naver.com/kobi2c,2021-05-14
"제주 :) 바다향 한가득 나는 돌솥밥,가람돌솥밥 ",https://blog.naver.com/wulhyuna?Redirect=Log&logNo=222367182167,그 첫 목적지는 바로 돌솥밥으로 유명하다는가람돌솥밥중문관광로에 위치해있다. 주차장도 가게 앞에 잘 준비되어 있던 곳 대표적인 돌솥밥이 위 메뉴인듯! 테이블에 자리를 잡고 메뉴판을 받았다. 뭘 먹을까... ,Lucy의 뉴욕이야기,https://blog.naver.com/wulhyuna,2021-05-25
[여행일기] 제주중문맛집가람돌솥밥 ,https://blog.naver.com/fly_high30?Redirect=Log&logNo=222408383264,갈치구이 먹는 사람들도 꽤 있었는데 갈치구이는 다른데서 먹기로 해서 안 먹었지만 맛있어 보였다. 다음에 숙소가 멀지 않다면 또 갈 것 같다. #제주맛집 #제주중문맛집 # 가람돌솥밥#전복돌솥밥,일상의 기록,https://blog.naver.com/fly_high30,2021-06-24
제주가람돌솥밥:: 여기가 중문 맛집이라고??,https://blog.naver.com/wpwp8970?Redirect=Log&logNo=222084378337,"제주가람돌솥밥:: 여기가 중문 맛집이라고?? 제주도 여행 마지막날 저녁에 들렀던, 중문 맛집이라고... 제가 메뉴판을 안찍었는데 돌솥밥 메뉴들 메인은 전복돌솥밥이고요. 가격은 15,000원이였어요. 영양돌솥밥... ",졔졔의 잘먹고 잘사는 이야기.,https://blog.naver.com/wpwp8970,2020-09-09
서귀포 밥집 돌솥밥이 맛있는가람돌솥밥 ,https://blog.naver.com/ngs7026?Redirect=Log&logNo=221765095831,"성게전복돌솥밥을 먹으로 제주도 여행 중가람돌솥밥 에 다녀왔어요! 가족여행 중이라면, 어르신들이... 밥 다 먹고 뜨신 누룽지 한그릇 하면 그렇게 속이 든든할 수 없더라구요 ㅋㅋㅋㅋㅋ 기본 밑반찬! 기본... ","Sunny place, Here :D ♡",https://blog.naver.com/ngs7026,2020-01-09
뭔가 특별했던 제주 중문 맛집가람돌솥밥 ,https://blog.naver.com/3645suns?Redirect=Log&logNo=222018052412,맛집가람돌솥밥제주 돌솥밥 맛집은 바로가람돌솥밥 이 유명하다네요가람돌솥밥 은 매일 오전 9시부터 오후 10시까지 영업하십니다 식당에 들어갈때는 캠핑카 오토바이등이 간판을 가려서 나올때 찍었는데... ,힐링,https://blog.naver.com/3645suns,2020-07-01
깔끔했던 제주 중문 맛집 : 중문 가람돌솥밥 ,https://blog.naver.com/wayhelter?Redirect=Log&logNo=222320568156,중문 가람돌솥밥 의 전복해물뚝배기는 적당히 칼칼하고 적당히 짭쪼름하고 적당히 진하면서 계속 퍼먹게 되는 스탠다드한 맛이라 표현하고 싶다. 진짜 이 뚝배기 한그릇만 있으면 밥 두공기 쌉가능... 돌솥밥은... ,"Seize the day, Seize the moment",https://blog.naver.com/wayhelter,2021-04-23
"[중문 가람돌솥밥 , 협재해수욕장, 제주동문시장, 금복국수]... ",https://blog.naver.com/damin2961?Redirect=Log&logNo=222172915130,드디어 제주도 마지막날 포스팅 스타트 우리는 늦잠을 실컷 잔 후 중문에 위치한가람돌솥밥 을 갔다... 전복 돌솥밥이 나왔다 전복돌솥밥을 맛있게 먹는 방법은 옆에 구비된 마가린과 간장을 넣어 쉐킷쉐킷해서... ,hello,https://blog.naver.com/damin2961,2020-12-14
제주 1박 2일(1일차) : 중문 맛집 ' 가람돌솥밥 '(전복돌솥밥)... ,https://blog.naver.com/cutepremolar?Redirect=Log&logNo=221732256252,"그럼 우린 이제 어디서 밥 먹어야 해? 패닉 상태에 빠지기 시작함.. ㅋㅋㅋㅋㅋ 걸어봐도 음식점은...가람돌솥밥- 중문 전복돌솥밥 맛집 전복 돌솥밥이 넘나 맛있어요. 마가린과 전복의 콜라보, 누룽지는... ",이상한나라의앨리스,https://blog.naver.com/cutepremolar,2019-12-10
"무한 거울의방, 천제연폭포 :: 중문 맛집가람돌솥밥 , 리틀포레스트",https://blog.naver.com/gydnjs78?Redirect=Log&logNo=222009533411,"사실 전복구이 밥을 예상하고 왔던가람돌솥밥 은 전복내장으로 비벼 만든 돌솥밥이었다. 완벽하게 취향은 아니었지만, 밑반찬도 그렇고 건강한 맛이라 한끼 보양식으로 딱이었다. 하필 계획했던 뿔소라몽땅이... ",세상을 향한 행복한 발걸음,https://blog.naver.com/gydnjs78,2020-06-23
중문 숙소 베니키아 중문호텔 추천 / 근처 맛집가람돌솥밥 ,https://blog.naver.com/a22252h?Redirect=Log&logNo=222456162782,붙어있는가람돌솥밥맛있게 먹는 방법을 읽었다. 마른 누룽지로 먹고 싶어서 돌솥에 물을 안 붓고... 요란하게 밥 먹는 타입. 구체적인 계획을 가지고 즐기는 여행도 좋지만 큰 틀만 가진 여유로운 여행도 참... ,리뷰봤쑤? 리뷰있쑤!,https://blog.naver.com/a22252h,2021-08-04
"[제주/중문]가람돌솥밥 , 성게전복돌솥밥해물뚝배기",https://blog.naver.com/viviene90?Redirect=Log&logNo=222192596986,"성게전복돌솥밥을 파는가람돌솥밥 입니당 !가람돌솥밥주소 : 제주특별자치도 서귀포시 중문관광로 332... 전복성게 돌솥밥이 나왔어용 ! 뜨끈뜨끈한 돌솥밥에, 성게랑 잘게 자른 전복이 밥 위에 가득... ",나는지로그,https://blog.naver.com/viviene90,2021-01-01
[제주 중문 맛집/중문 돌솥밥] 어머니의맛 중문 가람돌솥밥 ,https://blog.naver.com/ejpr0401?Redirect=Log&logNo=222473298020,"제주 중문 맛집, 중문 돌솥밥 어머니의맛 중문 가람돌솥밥신주소. 제주 서귀포시 중문관광로 332... 전복돌솥밥 15,000원 남펴니가 시킨 전복돌솥밥이에요 먹기좋게 전복이 잘 슬라이스 되어 있네요 밥 위에... ",미미킹 다이어리 ♡,https://blog.naver.com/ejpr0401,2021-08-18
[제주 서귀포 맛집]가람돌솥밥/ 흠..글쎄,https://blog.naver.com/leeeung2?Redirect=Log&logNo=222496728475,"제주 서귀포 맛집, 제주도 맛집, 제주도 성게 맛집, 제주 서귀포 성게 맛집, 제주도 우니 맛집, 제주 서귀포 우니 맛집, 제주도가람돌솥밥 , 제주도 성게전복돌솥밥, 제주도 성게돌솥밥, 제주도 전복돌솥밥... ",약간은 불친절하지만 유용하고싶은 블로그,https://blog.naver.com/leeeung2,2021-09-06
"제주도 여행 3일차 - 허니문하우스카페,가람돌솥밥 ... ",https://blog.naver.com/kangkaru1?Redirect=Log&logNo=221963224325,허니문하우스카페 (14:00) -가람돌솥밥 (15:00) - 오설록뮤지엄 (16:20) - 이니스프리(17:00) - 문도지오름(18:00)... 오설록에서의 돌솥밥의 후유증일 없애고 차로 최대한 많이 올라갈 수 있는 오름을 찾다 근처에있는... ,K's MIdday,https://blog.naver.com/kangkaru1,2020-05-16
제주ㅣ 가람돌솥밥 ㅣ중문맛집,https://blog.naver.com/ky0v0?Redirect=Log&logNo=222525344170, 가람돌솥밥저녁도 저녁이지만 아침으로 먹어도 속도 편하고 좋을 것 같아요 추천 :-) #제주여행 #제주맛집 #제주도 #돌솥밥 # 가람돌솥밥#중문밥집 #제주도밥집 #전복돌솥밥 #중문맛집추천,휘댁 Blog,https://blog.naver.com/ky0v0,2021-10-03
[제주도 돌솥밥] 중문가람돌솥밥10,https://blog.naver.com/muse_heeya?Redirect=Log&logNo=222482044533,한다기에 밥 먹고 오자고 근처 밥집을 찾았다. 면을 많이 먹었어서 쌀이 먹고싶어서 간 # 가람돌솥밥 집... 식당을 찾아보니 솥밥의 후기가 정말 많았기에 전복돌솥밥을 많이 시키길래 하나 시키고 두번째로 사진에... ,트로이젤라와 똑또리의 해피하우스,https://blog.naver.com/muse_heeya,2021-08-24
"서귀포 전복 돌솥밥으로 유명한가람돌솥밥 , 제주도 중문 맛집",https://blog.naver.com/pjj256?Redirect=Log&logNo=222503470883,입구/내부 오늘 소개해드릴 곳은 제주 중문 맛집가람 돌솥밥 이라는 식당입니다. 제주도 서귀포시 중문... 전복 돌솥밥 : 밥+국+기본 찬으로 구성된 메뉴랍니다. 돌솥밥 위에 전복 양념이 덮밥처럼 올라와 있고... ,더블제이의일상,https://blog.naver.com/pjj256,2021-09-25
제주 뽈살집 /가람돌솥밥/ 곰막,https://blog.naver.com/syhygod?Redirect=Log&logNo=222518162175," 가람 돌솥밥집에가려니까 날씨 쥑임ㅋㅋ.. 전복뭐시깽이를 먹고싶어서 급하게 찾아옴.. 전복돌솥밥2, 성게미역국 주문.. 전복밥 비주얼이 메롱했는데 뱃속으로 들어가면 다 똑같음.. 생각보다 맛있었다. 꼬숩고... ",나뭇가지 위의 삶,https://blog.naver.com/syhygod,2021-09-27
[343]서귀포가람돌솥밥 -한뚝배기 하실래얘~~,https://blog.naver.com/hjh345?Redirect=Log&logNo=222090344840,입구에 부터 메뉴가 떡하니 있는 이곳가람 돌솥밥 ..돌솥밥 맛집(?)인지 한번 가보겠습니다 레고레고(해장 니드 ㅠㅠㅠ) 입장!! 두번째 손님이라 한산아아안 하이 딱 좋습니다. 모자를 놔두고 와서 점심쯤... ,Mr.황 is Still hungry,https://blog.naver.com/hjh345,2020-09-15
"제주 중문 가볼만한곳 베릿내오름,가람돌솥밥 , 약천사... ",https://blog.naver.com/sidesnack?Redirect=Log&logNo=221686922892,하고가람돌솥밥 에서 밥 먹고 약천사를 다녀왔구요. 얼마전에 제가 다녀왔던 천제연폭포와 대포... 전복성게돌솥밥으로 방송되는 걸 보고 훅 땡겨서 점심 메뉴는 이걸로 결정! 중문 뿐만 아니라 제주에서는 이미... ,★어복남★의 제주도 이야기...,https://blog.naver.com/sidesnack,2019-10-24
제주 중문 맛집 전복 돌솥비빔밥가람 돌솥밥 ,https://blog.naver.com/autumncloud?Redirect=Log&logNo=222423762193,하 또먹고싶어요 재방문 의사 200% 입니닷 네이버 후기 남기면 이 아이스크림도 줘용 아이스크림 맛있어요 ^^ 저는 여기 가람 돌솥 비빔밥 아주 만족스러웠어요! #중문맛집 #중문 가람돌솥밥 ... ,가을구름,https://blog.naver.com/autumncloud,2021-07-07
"생생정보통 제주 맛집,해물뚝배기가 맛있는 중문가람돌솥밥 ... ",https://blog.naver.com/whtmdwo13?Redirect=Log&logNo=222534632585,덜어낸 돌솥에 마가린을 살짝 발라두면 맛있고 고소한 누릉지를 만들어 먹을 수 있어요. 성게 미역국 안에 성게가 가득 들어 있어서 밥 말아서 먹었어요. 성게 미역국 잘못 끓이면 비린맛이 나는데가람돌솥밥 ... ,안경,https://blog.naver.com/whtmdwo13,2021-10-12
블랙스톤 이천cc 맛집가람돌솥밥맛나유~~,https://blog.naver.com/junghun_jo?Redirect=Log&logNo=221980560752,블랙스톤이천cc 맛집가람돌솥밥이천쌀밥집 라운딩전의 재미 그동네 식당검색 어디가 맛날까나? ㅎㅎ... ㅎㅎ 돌솥밥등장 역시 쌀은 이천쌀인가요 ㅎㅎ 땟깔 좋네요 물론 밥도 같지은 돌밥이니 맛나구요... ,언제나 Smile,https://blog.naver.com/junghun_jo,2020-05-27
[오지는 미식회]제주 바다를 통째로 식탁에?!가람돌솥밥 ,https://blog.naver.com/nanum_in?Redirect=Log&logNo=222457711675, 가람돌솥밥바다를 그대로 옮겨놓은 듯한 푸짐한 해산물이 돌솥 한가득 들어가 있습니다. 조미료를 넣지 않고 천연 그대로의 맛을 내 더욱 건강에도 좋은 음식들! 돌솥밥 싹싹 긁어먹고 남은 밥으로 누룽지... ,사랑의열매,https://blog.naver.com/nanum_in,2021-08-07
"중문 아침식사 가능, 제주가람돌솥밥솔직후기",https://blog.naver.com/kungsooluv?Redirect=Log&logNo=222499924980,제주가람돌솥밥솔직후기 갈치 구이나 조림은 안 먹어 봐서 모르겠는데 돌솥밥은 음.. 길가다가 그냥 배고프니까 밥 먹어야 겠다 이정도로 생각하고 가면 평타는 치지 않을까 싶음 맛집이라 기대하고 가면... ,돼지의 하루,https://blog.naver.com/kungsooluv,2021-09-19
제주 2.5일차:가람돌솥밥/ 중문 스타벅스 / 엉덩물계곡... ,https://blog.naver.com/jjuya9515?Redirect=Log&logNo=221930727391,제주가람돌솥밥 은 생생정보에 종종 나왔다는 돌솥밥 전문점이다 이건 전복돌솥밥 (미역국은 임금님이 더 낫았음) 성게돌솥밥 빠다 뚝배기에 숭늉을 만들어먹는건 흔하지만 덜어낸 밥에 버터 비벼먹어본 적은... ,HEEvely BLOG,https://blog.naver.com/jjuya9515,2020-04-26
제주 서귀포가람돌솥밥 : 성게 전복돌솥밥 추천,https://blog.naver.com/kulen?Redirect=Log&logNo=222390296441,Re: 아 ~ 성게 안좋아하는 남편은 전복 돌솥밥으로 반찬도 정갈하고 맛있는 편 # 가람돌솥밥맛있게 먹는 법 1. 돌솥에서 마가린까지만 비비고 간장은 덜어낸 상태에서 비빈다 2. 혹은 덜어내어 마가린과 간장을... ,via kulen,https://blog.naver.com/kulen,2021-06-08
[서귀포맛집] 매콤달콤 갈치조림 맛집가람돌솥밥방문후기,https://blog.naver.com/akakjin45?Redirect=Log&logNo=221755287800,#서귀포맛집 #제주도맛집 #갈치조림맛집 #제주도갈치 #갈치조림 # 가람돌솥밥#돌솥밥 #해장국 주차장이... 야채랑 생선살이랑 야무지게 밥 위에 올려서. 앙~~~~~!! 이번엔 양념을 삭 떠가지고 같이 담아봤어요. 캬.... ,심바김과장의 경제정치놀이터,https://blog.naver.com/akakjin45,2019-12-31
"제주여행3일차) 카페차롱, 휴애리,가람 돌솥밥,미남미녀",https://blog.naver.com/jm6920?Redirect=Log&logNo=221990999862,"# 가람돌솥밥가람돌솥밥제주 서귀포시 중문관광로 332가람돌솥밥평일 09:00 - 22:00 주말 09:00 - 22:00 중문에서 유명한집. 맛도 깔끔하니 맛나고, 무엇보다 친절하셔서 좋았어요. 든든한 점심이였네요. 카페... ",ℓσℓℓιρσρ ∂αιℓу,https://blog.naver.com/jm6920,2020-06-05
"제주도 _ 중문주변 음식점 ( 가람돌솥밥 , 중문생선구이)",https://blog.naver.com/kksudo?Redirect=Log&logNo=222488858114," 가람돌솥밥리뷰도 많고 평도 준수 한,,,,,,,,,,,, 기본 찬,,,,,,,,, 좀 늦은 시간에 가서 가게 정리하느라 좀 분주한 분위기,,,,,,,,,, ㅜ 그러다보니 살짝 아쉬운 점이 있긴 했지만,,,,,, 패스~~~~ 전복돌솥밥... ","너를 그리다,,,畵,,,,想,,,,",https://blog.naver.com/kksudo,2021-08-30
 가람돌솥밥 ,https://blog.naver.com/yamako0221?Redirect=Log&logNo=221733355107, 가람돌솥밥 ... 제주놀러가서는요~~ 맛있는게 많을테니까... 꼭꼭 맛난걸 찾아 먹자고 했는데요... 2끼... ㅎㅎ가람돌솥밥 이에요~~^^ 현지인 맛집이라고 검색을 했는데요... 현지인 맛집인지는 모르겠더라구요 ㅋㅋ... ,히히낭낭,https://blog.naver.com/yamako0221,2019-12-11
제주가람돌솥밥 ,https://blog.naver.com/elen_80?Redirect=Log&logNo=222126700837,"있는 # 가람돌솥밥이미 맛집으로 유명한 듯 했다. 주차장도 걱정 없고. 제주도는 어딜가나 주차장 걱정 없는게 참 좋았다. 오분작돌솥밥이 있긴 하지만, 요즘 오분자기가 안잡혀서 전복을 넣어준다고 써 있었다.... ",Day by Day :),https://blog.naver.com/elen_80,2020-10-26
제주가람돌솥밥 ,https://blog.naver.com/general135?Redirect=Log&logNo=222526689222,"유산균 막걸리도 하나 샀고, 식후 아이스크림도 맛있었다. 나중에 맛보니 유산균 막걸리는 쏘쏘. 뭔가 농도가 늘 안타깝다. #제주 # 가람돌솥밥#중문 #전복 #해물 #성게 #돌솥",SKYLARK's NEST,https://blog.naver.com/general135,2021-10-04
그린정 흑돼지제육/까페 바다다 Vadada/ 가람돌솥밥 /연정식당,https://blog.naver.com/sihhigh90?Redirect=Log&logNo=222134317135," 가람돌솥밥여긴 간단히 저녁 먹으러 들른 평타치는 곳이라고하여 간가람 돌솥밥 입니다. 주차장에서 본 석양이 예뻐 얼른 찍었어요 ㅎㅎ 한치해물솥밥과 해물탕 시켰는데요, 평타 정도였어요~ 여기도 정식으로... ","A to Z, and more....:D",https://blog.naver.com/sihhigh90,2020-11-03
디얼지니 / 제주 중문가람돌솥밥: 전복성게 돌솥밥,https://blog.naver.com/dearjiny_?Redirect=Log&logNo=222464237158,"1200 영업 08:30~22:00 제주맛집 : 전복성게돌솥밥 /가람돌솥밥이날은 제주에서 아침 겸 점심을 먹으러... 이때 남펴니랑 나의아저씨' 드라마에 푹 빠져서 ,, 밥 좀 사주죠. 아저씨 배고픈데 (이지안대사) ㅋㅋ... ",디얼지니,https://blog.naver.com/dearjiny_,2021-08-10
[돈받고는이렇게안씀] 제주:가람돌솥밥성게미역국 후기,https://blog.naver.com/queen_snow?Redirect=Log&logNo=221835590033,"전복 돌솥밥 (15,000) 옆에 글도 붙어있고 직원이 가져다 줄때 마가린 넣으면 더 맛있다고 하니 참고! 그래서 옆에 마가린과 간장 넣었더니 마가린 + 인삼향의밥 ..? 마가린 베라 맛보기스푼정도로 넣었는데도... ",어,https://blog.naver.com/queen_snow,2020-03-03
제주도 중문맛집 중문 가람돌솥밥 ,https://blog.naver.com/mgkim921113?Redirect=Log&logNo=222309062905,"많았어요가람돌솥밥메뉴 전복돌솥밥이랑 해물뚝배기, 갈치조림 등이 있어요 밑반찬도 깔끔하게 잘 나왔던가람돌솥밥전복해물뚝배기 15000원 전복돌솥밥 15000원 해물이 가득 들어있어서 좋았던... ",밍로그,https://blog.naver.com/mgkim921113,2021-04-13
 가람돌솥밥 ,https://blog.naver.com/taekclub1?Redirect=Log&logNo=222521965055,"그래야 돌솥의 열기로 밥이 누룽지가 되는것이기에.. 하지만가람돌솥밥 은 진밥이다. 누룽지가 제대로 만들어지지 않았다. 정신없어서 음식 사진은 못찍고 가게 사진만..ㅎ 성게전복돌솥밥 - 20,000원 성게알... ",재미진 일상,https://blog.naver.com/taekclub1,2021-09-30
노포의 손맛 '중문 가람돌솥밥 ' 제주 해녀 손맛 맛보러 어서... ,http://saffroner.egloos.com/6742298,#생생정보통 #생생정보통맛집 # 생방송오늘저녁 #제주도도민추천맛집 # 생방송오늘저녁노포의손맛 #제주전복성게돌솥밥맛집 #생생정보통돌솥밭 #중문 가람돌솥밥#제주도해물돌솥밥맛집 18년... ,당신의 손길이 닿기 전에,http://saffroner.egloos.com/,2021-02-10
천제연폭포 들렸다 방문한 맛집가람돌솥밥 ,https://blog.naver.com/yssh0486?Redirect=Log&logNo=221280917320,"2-3년전쯤 놀러갔다가 우연히 발견 한 후 이제는 일부러 찾아가는가람돌솥밥 ! 이번 제주행에서도... 전복돌솥밥, 전복해물뚝배기 - 15000원 전복성게돌솥밥 - 20000원 이니 보고 참고하세요 ㅎㅎㅎ 천제연폭포... ",*~키위써니 Story~*,https://blog.naver.com/yssh0486,2018-05-21
"제주도 중문 맛집, 밥이 맛있는 밥집가람돌솥밥 ",https://blog.naver.com/h_daily?Redirect=Log&logNo=221183866423, 가람돌솥밥 의 그 유명한 돌솥밥 대령입니다. 그냥 먹어도 맛있는 돌솥밥을 더 맛있게 먹으라고 마가린이랑 간장도 같이 내어주시는데 아이고야. 진짜 대박ㅋㅋㅋㅋㅋㅋㅋㅋㅋㅋㅋㅋㅋㅋ 밥 별로 안먹는 제가... ,#히야 #먹로그 #데일리로그,https://blog.naver.com/h_daily,2018-01-13
중문관광단지 맛집 엄지척을 부르는가람돌솥밥 ,https://blog.naver.com/goldpfeil?Redirect=Log&logNo=221571642236,밥이 먹고 싶어 죽어요 ㅠㅠㅠ 따끈한 밥 한그릇에 입맛 돋우는 반찬 1~2가지만 있어도 한그릇 뚝딱!!... 둘다 돌솥밥 완전 킬러이고요~~~ 또 여기가람돌솥밥꼭 가보라고 추천해준 지인분(제주 현지인)이... ,허브허브의 여행 & 패션,https://blog.naver.com/goldpfeil,2019-06-27
중문 아침식사가람돌솥밥 ,https://blog.naver.com/byun07?Redirect=Log&logNo=221092359640,유명한가람돌솥밥 의 돌솥밥 나왔어요~ 역시 제주하면 그래도 영양보다는 전복돌솥밥이 기본이겠죠? 전복뚝배기도 나오셨음요 ~ 예전에는 오분작뚝배기가 주를 이루었다는 제주에 지금은 오분작이 귀해서... ,제주살이여행일기,https://blog.naver.com/byun07,2017-09-08
