title,link,description,bloggername,bloggerlink,postdate
제주 중문 맛집 _가람돌솥밥 ,https://blog.naver.com/u_truth?Redirect=Log&logNo=221188943292,"저렴한데, 맛이나 갈치 양에 절대 뒤쳐지지 않았어요. 게다가 맛있는 돌솥밥 위에 한조각 얹어 먹으니 더 맛있더라구요. 깔끔하고 담백하게 영양있는 한끼를 먹고온 제주 중문 맛집가람돌솥밥 . 너무 잘먹고 갑니다-",트루의 맛집저장소,https://blog.naver.com/u_truth,2018-01-20
서귀포맛집 여기가진짜 ★ 가람돌솥밥 ★,https://blog.naver.com/upstartone?Redirect=Log&logNo=220680581739,"서귀포맛집,가람돌솥밥입니다. 여행하고 지친 몸을 이끌고 와 편하게 식사할 수 있는 테이블이 있네요 벽면에는 유명 연예인 사인으로 가득!! 역시 서귀포맛집 입니다. 다양한 돌솥밥과 전복회 그리고... ",레몬라임 향기,https://blog.naver.com/upstartone,2016-04-11
너도나도 추천해서 다녀온 서귀포 향토음식점가람돌솥밥 ... ,https://blog.naver.com/startour7?Redirect=Log&logNo=221472177609,"이름이가람돌솥밥 이어서 그런지 돌솥밥이 특히나 맛있었던가람돌솥밥 ! 해물뚝배기는 물론, 지인들의 말에 의하면 갈치조림도 HJMT라는!ㅎㅎ 서귀포에서 맛있는 향토음식점을 찾으신다면? 가족과 식사할... ",제주스타렌터카의 빛나는 제주이야기,https://blog.naver.com/startour7,2019-02-22
제주 중문 맛집가람돌솥밥솔직한후기,https://blog.naver.com/lastkycool?Redirect=Log&logNo=221328781262,"했죠가람돌솥밥 이라는 곳, ㅋㅋ 가봅시다 도츠아아악- _ -) / 어따 주차장은 넓어서 차대기에는 딱이네요 금액 실외판에 적혀있으니까 ~ 확인하고 가세용 약 13000원씩 ㅋㅋ 평균가 ㅋㅋㅋㅋㅋㅋ-_-)/ 돌솥밥... ","마약같은 여자,멍젤라★",https://blog.naver.com/lastkycool,2018-07-30
[제주 중문맛집] 오분작돌솥밥 맛집 ' 가람돌솥밥 ',https://blog.naver.com/chez_sophie?Redirect=Log&logNo=221064818932,강추하는가람돌솥밥나와 비슷한 처지인 엄마/아빠 분들이 계실 수도 있을 것 같아 적어보자면 혼자 밥 먹기에도 괜찮은 분위기이고 직원 분들도 친절하신 편이었다 오분작 돌솥밥은 정말 또 먹고싶다는..i_i... ,nom nom nom,https://blog.naver.com/chez_sophie,2017-08-03
제주 서귀포시 맛집가람돌솥밥애정♥,https://blog.naver.com/yssh0486?Redirect=Log&logNo=221199599312,오분자기라는건가람돌솥밥 집에 와서 처음 먹어본 음식인데 전복과는 비슷한듯 달라요. 전복보다 조금... 그냥 밥 전체를 오분자기와 비벼서 깔끔하게 먹더라구요. 제주 서귀포시 맛집은 어떻게 먹어도 돌솥밥... ,*~키위써니 Story~*,https://blog.naver.com/yssh0486,2018-02-02
제주 중문단지 맛집가람돌솥밥솔직후기!,https://blog.naver.com/yssh0486?Redirect=Log&logNo=221101193861,제주향토음식을 먹어본지가 생각보다 너무 오래되었더라구요~ 게다가가람돌솥밥 에 와서야 전복성게돌솥밥이라는걸 처음 먹어봐요. 제주 중문단지 맛집중에서도 음식의 궁함들이 가장 잘 맞는 이곳은... ,*~키위써니 Story~*,https://blog.naver.com/yssh0486,2017-09-20
천제연폭포 맛집가람돌솥밥정성가득!,https://blog.naver.com/yssh0486?Redirect=Log&logNo=221214288858,돌솥에 밥을 다 덜어내고 물을 붓고 식사를 다 마칠때쯤에 보면 잘 불어서 완성되어 있어요.가람돌솥밥제주 서귀포시 중문관광로 332 ( 대포동 747-3 ) Tel : 064-738-1200 09:00~22:00,*~키위써니 Story~*,https://blog.naver.com/yssh0486,2018-02-23
0822 제주/ # 가람돌솥밥#돌카롱 #비자림,https://blog.naver.com/ring8082?Redirect=Log&logNo=221654098095,"비자림가람돌솥밥배고파서 멀리는 못 가겠고, 유명한 김밥집은 100통(거의20-30통)만에 통화되었으나 오후 3시에나 먹을 수 있다고 하야. 근처 밥집으로 선정. 맛은 나쁘지 않았어. 전복돌솥밥도... ",바람의 집,https://blog.naver.com/ring8082,2019-09-20
서귀포맛집 줄서야먹는가람돌솥밥 ,https://blog.naver.com/upstartone?Redirect=Log&logNo=220584967101,"돌솥밥을 전문으로 하는가람돌솥밥 입니다. 서귀포맛집 식당답게 전복, 오분작, 갈치, 고등어 다... 이것만 있어도 밥 한 공기 비울 수 있죠 양념에 비벼 먹으면 정말 맛나고요 제주도 여행 때 다시 한번 들릴... ",레몬라임 향기,https://blog.naver.com/upstartone,2016-01-01
제주도맛집 바다의맛이다가람돌솥밥 ,https://blog.naver.com/upstartone?Redirect=Log&logNo=220614984547,얇게 썰린 전복이 한가득 들어있는 전복 돌솥밥 입니다. 야들야들하면서 고소한 게 정말 몇 그릇도 먹을 수 있을 것 같습니다. 추가로 주문했던 옥돔구이입니다. 잘 익은 옥돔 살이 촉촉해서밥위에 한점... ,레몬라임 향기,https://blog.naver.com/upstartone,2016-02-01
중문맛집 압도적인식감가람돌솥밥 ,https://blog.naver.com/raffke?Redirect=Log&logNo=220615156840,중문맛집 압도적인식감가람돌솥밥안녕하세요 우렁이에요 제주도 다녀온 것이 오래도록 기억에... 오분작돌솥밥인데요. 뜨근한 돌솥에 오분작이랑 같이 한술 떠먹으면 고소한 게 꼬들꼬들 아주 맛있습니다.... ,비단수제청(SILK HONEY)이야기,https://blog.naver.com/raffke,2016-02-01
[8개월아기 제주여행] 중문맛집가람돌솥밥 ,https://blog.naver.com/my3596?Redirect=Log&logNo=221529157599,여러군데 알려주셨는데 돌솥밥이 괜찮을 것 같아서가람돌솥밥 으로 결정했어요. 주차장도 넓어서... 넣는 돌솥밥으로 먹겠어요 ㅎㅎㅎㅎㅎ 아기랑 오후비행기 타고와서 숙소가서 짐풀고 밥 먹고 이마트 들려... ,콩닥콩닥 루남매,https://blog.naver.com/my3596,2019-05-05
중문맛집 전복돌솥밥은가람돌솥밥 ! 완전 강추!,https://blog.naver.com/sidae2001?Redirect=Log&logNo=220780216376,전복돌솥밥은 말해뭐해~!! 서울에서는 흉내도 낼 수 없는 맛가람돌솥밥 은 고소한 맛을 배가 시키기 위해 간장앙념장 뿐 아니라 마가린도 같이 넣고 비벼주어요 돌솥에 남은 밥은 뜨거운 물을 넣고 숭늉 만들기!!... ,은동이의 소꿉놀이,https://blog.naver.com/sidae2001,2016-08-05
제주 중문단지 맛집가람돌솥밥 ,https://blog.naver.com/happydeng?Redirect=Log&logNo=220483447755,"제주 중문단지 맛집가람돌솥밥이틀째 날은 바다가 넘 이뻐 뛰어드는 바람에 물놀이를 하느라 거의... 그 이야기는 더 뒤에 하기로 하고, 둘째날 첫 끼니로 먹었던 돌솥밥집이 맘에 들어서 따로 포스팅해본다.... ",식도락쟁이 수댕의 기록 ♪,https://blog.naver.com/happydeng,2015-09-16
제주 신라호텔 근처 맛집가람돌솥밥꿀맛 콤보 조합 !,https://blog.naver.com/haedud128?Redirect=Log&logNo=221448800873,"제주도만의 맛이 있으니까 ♡,♡ 저희는 해물뚝배기, 성게알미역국, 전복돌솥밥을 시켰습니당!!... 계속 우려먹을거니까 지겹다고 하지마세여 잇님들 _ ♡,♡ 히히 어쨌든가람돌솥밥맛났어요오 지금도... ",디지털노마드 해작가,https://blog.naver.com/haedud128,2019-01-23
제주 서귀포 중문관광단지 맛집가람돌솥밥 ,https://blog.naver.com/yuri831211?Redirect=Log&logNo=221621852360,제주 서귀포 중문 관광단지 쪽에 위치한가람돌솥밥 인데요. 처음에는 돌솥밥을 파는 곳인가? 해서... 오북작 2인 상차림 : 전복회 + 돌솥밥 + 갈치조림 + 전복뚝배기 먼저 밑반찬이 나와서 밥 먹을 준비를 했는데요.... ,까치맘's 디자인세상♥,https://blog.naver.com/yuri831211,2019-09-13
중문맛집 일번지 ★ 가람돌솥밥 ★,https://blog.naver.com/wave7906?Redirect=Log&logNo=220674145925,찾아보았는데 돌솥밥 잘하는곳이 있더라구요. 바로 차를 끌고 슝슝슝 여기가 중문맛집가람돌솥밥 이에요! 주차장도 엄청 넓어서 차를 가지고 가도 엄청 편하더라구요. 가게 인테리어는 엄청 깔끔하고요. 무엇을... ,LIFE PLUS,https://blog.naver.com/wave7906,2016-04-04
중문맛집 제주바다그대로가람돌솥밥 ,https://blog.naver.com/upstartone?Redirect=Log&logNo=220568023741,중문맛집 제주바다그대로가람돌솥밥안녕하세요 레몬입니다. 제주도 다녀온지는 한참 되었지만 요... 순식간에 돌솥밥을 먹어 치워버렸네요 정말 맛이 좋아서 한입 두입 먹다보니 순식간에 바닥을 드러내네요... ,레몬라임 향기,https://blog.naver.com/upstartone,2015-12-14
중문관광단지근처맛집가람돌솥밥 ,https://blog.naver.com/h21100?Redirect=Log&logNo=70154752083,"맛이 없지는 않았지만, 전복돌솥밥이 앞에 있으니 약간은 꿇리는 느낌은 어쩔 수 없더라구요. ^^ 세계자동차박물관에서 소개해드린 중문관광단지근처맛집가람돌솥밥 . 오늘처럼 추운 날 따끈한 밥이 생각날 때... ",세계자동차 & 피아노박물관,https://blog.naver.com/h21100,2012-12-28
제주도 맛집가람돌솥밥 ,https://blog.naver.com/daedon23?Redirect=Log&logNo=156906692,어제 술마시고 먹는 뚝배기 맛은 쵝오 였습니다 이것은 우리 와이프가가람돌솥밥집에서 시킨 오분작이 돌솥밥 ~~ 후후 맛있었습니다 우리아이에겐 초록밥이라고 ~~ 하면서~~~ 먹게끔 했는데 아주 맛있어... ,펜넬의 하루하루,https://blog.naver.com/daedon23,2012-05-03
제주 중문가람돌솥밥 ,https://blog.naver.com/chmade?Redirect=Log&logNo=150036095012,정말 해물을 잡아오시는줄 알았다 포스팅 안하려고 대략 성의없이 찍은 메뉴판 남편은 오분작돌솥밥을... 추천할만하다 ● 가람 돌솥밥064)738-1200 제주특별자치도 서귀포시 대포동 748-2 (서귀포 중문체육센타... ,뷰티풀시너리,https://blog.naver.com/chmade,2008-10-10
2019년 3월 13일 제주도 중문가람돌솥밥: 전복돌솥밥,https://blog.naver.com/seunghun?Redirect=Log&logNo=221487282832,2019년 3월 13일 #제주도 #중문 # 가람돌솥밥: #전복돌솥밥 #전복솥밥 #전복밥 오후12시30분 산행을 마치고 점심식사 장소로 찾은 # 가람돌솥밥 집 입니다. 착석후 돌솥밥2이요 그랬는데 차림표를 주시면서... ,Lee's family Wonderful Life,https://blog.naver.com/seunghun,2019-03-13
제주도여행- 제주도맛집가람돌솥밥: 전복돌솥밥 ,https://blog.naver.com/dmsdkyam?Redirect=Log&logNo=120128301366,하지만 저는 엄마가 먹던 해물돌솥밥이 더 맛있었다는 ㅋ 밥 다 먹고 뜨거운 물 부어서 누룽지 만들어... 손님들 많아서 내부사진은 못찍었습니다^^가람 돌솥밥주소 : 제주 서귀포시 대포동 748-2 전화 : 064-738... ,딸기샤벳의 소박한밥상,https://blog.naver.com/dmsdkyam,2011-04-21
서귀포맛집 제주의 싱싱함가람돌솥밥 ,https://blog.naver.com/upstartone?Redirect=Log&logNo=220577426440,서귀포맛집 제주의 싱싱함가람돌솥밥안녕하세요 레몬입니다. 지인들과 함께 십시일반 돈을 모아서... 지인들과 함께 가게된 서귀포맛집가람돌솥밥입니다. 아침식사도 가능하다는 문구가 눈에 보이네요... ,레몬라임 향기,https://blog.naver.com/upstartone,2015-12-24
제주도맛집 바다의맛가람돌솥밥 ,https://blog.naver.com/upstartone?Redirect=Log&logNo=220590484809,제주도맛집 바다의맛가람돌솥밥안녕하세요 라임입니다. 성게비빔밥이 생각이 나 또 포스팅해봅니다.... 각종 해물과 새우가 들어 있죠 제주도맛집의 명성을 얻어준 비빔밥 삼총사 오분작 돌솥비빔밥은 뜨거운... ,레몬라임 향기,https://blog.naver.com/upstartone,2016-01-07
제주 서귀포 맛집 -가람 돌솥밥 ,https://blog.naver.com/saijjong?Redirect=Log&logNo=220030416581,"돌솥밥에는 미역국도 같이나와주고^^ 미역국도 맛이 괜찮았다~ 돌솥밥에 밥 다 덜고 나면 뜨거운 물을 부어~ 누룽지 만들어주시고~~ 누룽지까지 짱짱 맛있어뜸^^ 제주 맛집, 서귀포 맛집가람돌솥밥 !... ",달소봉 블로그에 오신걸 환영합니다.,https://blog.naver.com/saijjong,2014-06-16
[제주]가람돌솥밥 ,https://blog.naver.com/000jenny000?Redirect=Log&logNo=90141048525,제주 삼원정에서 맛있게 먹었던 전복돌솥밥 또 먹고 싶어서 어디가 맛있는지 찾아보다 풍성한 전복사진에 반해 가게 된가람돌솥밥 이예요 비슷한 이름의 식당이 있어서 전화번호 확인하고 방문했어요... ,더 젠하우스,https://blog.naver.com/000jenny000,2012-04-14
제주도 중문맛집가람돌솥밥몸에 좋은 건강식 이네요!,https://blog.naver.com/findjeju?Redirect=Log&logNo=220674437816, 가람돌솥밥외관 제주도 중문맛집가람돌솥밥몸에 좋은 건강식이네요!! 안녕하세요^^ 중문여행 중 가면... 밥 한숫가락 먹을때 입안 가득 퍼지는 풍미가 정말 기가 막히게 맛있었던거 같아요^^ 아침식사로 돌솥밥... ,제주길잡이의 제주도여행,https://blog.naver.com/findjeju,2016-04-04
너무나 독특했던 제주도 맛집가람돌솥밥 ,https://blog.naver.com/birthflowerss?Redirect=Log&logNo=221329892441,너무나 독특했던 제주도 맛집가람돌솥밥참 독특하고. 서울에서는 만나기 힘든. 제주도는 색깔이... 전복성게돌솥밥 20000원 남자친구님은 전복해물뚝배기 15000원 이렇게 두 가지를 주문했어요 밑반찬 옴총 잘... ,플로리스트 수은화의 꽃과 식물이야기,https://blog.naver.com/birthflowerss,2018-07-31
제주도맛집 성게중문맛집 ' 가람돌솥밥',https://blog.naver.com/dearhanq?Redirect=Log&logNo=221066581360, 가람돌솥밥 에 하이라이트는 마가린과 간장이었습니다 돌솥밥 다먹고 밥한공기 넣어서 비벼먹었더니꿀맛.. 나온것만으로 부족하면 공기만추가해서 비벼먹어보세요..!! 개이득!.. 다음에 또와서 전복회랑... ,함께하는 에드업,https://blog.naver.com/dearhanq,2017-08-04
[제주 중문]가람돌솥밥 ,https://blog.naver.com/giraffe55?Redirect=Log&logNo=221120128015,"곳은가람돌솥밥케케케케, 든든하게 먹어야짐 제주도가람돌솥밥메뉴판 데쓰 이미 보고 갔어 돌솥밥... 시원하다~~~~~~~~~~~~~ 밥 다 먹고 나오보니가람돌솥밥앞에 나와보니 귤나무에 초록 귤이 주렁주렁... ",별걸 다 기억하는 기린쏭,https://blog.naver.com/giraffe55,2017-10-19
제주도 서귀포맛집가람돌솥밥너무 먹고싶었던 전복돌솥밥 후기,https://blog.naver.com/nerollia?Redirect=Log&logNo=221490307179,"제주도 서귀포맛집 전복돌솥밥가람돌솥밥제주도 여행의 가장 큰 즐거움은 싱싱한 해산을 활용한... 오분작돌솥밥!! 조개가 들어간 미역국과 함께 제공이 됩니다 밥, 국, 반찬이 모두 한자리에 모이니 확실히 더... ",LIFE LAB. 네롤리와 앤드류의 라이프스토리,https://blog.naver.com/nerollia,2019-03-17
[제주 전복돌솥밥 맛집]가람돌솥밥 ,https://blog.naver.com/mrsflower128?Redirect=Log&logNo=221225723799,"전복돌솥밥,,, 같이 나온 미역국은 성게 미역국이라 한 그릇 싹~~ 비울 만큼 고소하고 깊은 맛;) 그동안 다녀온 곳은 대게 전복장을 갈아 밥을 지어 밥 색깔이 녹색빛이었는데가람돌솥밥 은 그냥 흰 밥에 전복... ",Mrs.Flower,https://blog.naver.com/mrsflower128,2018-03-10
중문관광단지 맛집가람돌솥밥 ,https://blog.naver.com/8302yang?Redirect=Log&logNo=130155032264, 가람돌솥밥저녁 시간에 중문관광단지 맛집 찾은 것도 참 오랜만이네요. 겨울철이라 어둠이 빨리 내리니 배도 고프고... 제주시내로 넘어가서 식사를 하기에는 시간이 늦을 듯 해서 남편 입맛에 맞는 가람돌솔... ,제주규리 | 제주토박이 여행작가 & 농부,https://blog.naver.com/8302yang,2012-12-27
제주도 마지막 먹방 중문가람돌솥밥 +김포공항 국수 맛집... ,https://blog.naver.com/onefineday37?Redirect=Log&logNo=221375278853,ㅋㅋㅋㅋㅋㅋㅋㅋㅋㅋㅋㅋㅋㅋㅋㅋㅋㅋㅋㅋㅋㅋㅋㅋㅋㅋㅋㅋㅋ 밥 덜어놓고 돌솥에는 물을 부어놓아용 _ 그리고가람돌솥밥 의 특이한점 마가렛이 있어서 마가린에 비벼먹으라고 하더라구요 오.. 진짜... ,꽃징이네,https://blog.naver.com/onefineday37,2018-10-11
절물자연휴양림/세화해변/섭지코지/ 가람돌솥밥 ... ,https://blog.naver.com/nimo5858?Redirect=Log&logNo=222537860254,밥 먹으러 성산읍으로 다시 이동 방송에도 나왔다는 그곳 고등어쌈밥 맛있게는 먹었는데 가성비는... 다녀갔을거라는가람돌솥밥무난한 저녁식사 였지만 다음에 또 와야겠다는???? 적당하게 부른 배를 두드리며... ,.,https://blog.naver.com/nimo5858,2021-10-15
제주가람돌솥밥전복 상차림 깔끔하고 맛있네,https://blog.naver.com/happy50_?Redirect=Log&logNo=221415234323,알아본가람 돌솥밥 에서 내려달라고 해서 ㅎㅎ 중문 도착하자마자 밥부터 먹었습니다. 제주도 오면... 회+전복 돌솥밥+전복해물뚝배기+옥돔구이)과 영양 돌솥밥을 주문했습니다. 가격은 지금은 더 올랐을지도... ,Happy Smile ♥,https://blog.naver.com/happy50_,2018-12-09
제주 중문맛집 -가람돌솥밥 ,https://blog.naver.com/hwadlzak?Redirect=Log&logNo=220827648175,지난주 신랑이 제주에 출장을 가서 저도 이틀 휴가내고 제주에 가서 제주중문맛집으로 유명한가람돌솥밥 에서 저녁 먹었어요 돌솥밥을 애정하는 우리 부부 제주중문관광단지 근처에 위치한가람돌솥밥제주에... ,빠져듭니다 레드썬!!!,https://blog.naver.com/hwadlzak,2016-10-04
[제주 중문 맛집]가람돌솥밥오분자기뚝배기 ♥,https://blog.naver.com/lovinghyni?Redirect=Log&logNo=221264199133, 가람돌솥밥4월초 다녀왔던 제주도 _ 저희는 신라호텔에서 묵었었는데요 호텔근처 오분자기뚝배기 맛집을 검색하다 방문하게 된가람돌솥밥소개해드릴게요 결론부터 말하면 진짜 짱맛핵맛이에요 ♥♥ 위치... ,봉쥬르봉구,https://blog.naver.com/lovinghyni,2018-04-29
제주 중문가람돌솥밥 ,https://blog.naver.com/jord23?Redirect=Log&logNo=221376440117,"제주 중문, 제주컨벤션센터에서 서귀포시 국민체육센터 쪽으로 직진하다가 만난가람돌솥밥 . 어른들 모시고 식사할 때 돌솥밥은 왠만해서 실패하지 않는 메뉴라서 선택. 급히 들어가느라 가게 외관을 못... ",jord23님의 블로그,https://blog.naver.com/jord23,2018-10-12
제주도 중문맛집가람돌솥밥 과 바다다카페,https://blog.naver.com/morin85?Redirect=Log&logNo=221029106739,★ 제주도 중문맛집가람돌솥밥 과 바다다카페 ★ 제주도에 가면 꼭 먹게 되는 전복성개돌솥밥♡ 제주도 가서 진짜 맛있게 먹었던 메뉴 중 하나이다. 중문맛집가람돌솥밥이번이 두번째 방문!! 역시나 비주얼... ,그레이스의 일상♡,https://blog.naver.com/morin85,2017-06-14
제주 중문 맛집가람돌솥밥 에서 성게돌솥밥 드셔보세요.,https://blog.naver.com/lily2you?Redirect=Log&logNo=221355711903,"제주 중문 맛집 돌솥밥으로 유명한 18년 전통의가람돌솥밥제주 서귀포시 중문관광로 332(대포동 747-3) 064-738-1200 평일 09:00~22:00, 주말 09:00~22:00 제주 여행중 정말 맛있는 한끼를 먹었던 제주 중문 맛집... ",voice of traveller,https://blog.naver.com/lily2you,2018-09-15
제주 중문 맛집가람돌솥밥시원한 해물뚝배기 추천,https://blog.naver.com/twinvely?Redirect=Log&logNo=221282703083,맛집가람돌솥밥 에는 테이블마다 양념장과 마아가린이 놓여있는데 돌솥밥에 적당량의 양념장과 마아가린을 비벼 먹으면 적당히 느끼하면서도 고소한 게 아주 꿀맛이다ㅋㅋㅋ 이거 한입먹고 해물뚝배기 먹으면... ,트윈블리의 Real_log,https://blog.naver.com/twinvely,2018-05-24
제주 중문가람돌솥밥오분작돌솥밥 먹어보았습니다.,https://blog.naver.com/sidesnack?Redirect=Log&logNo=221105167773,제주 중문가람돌솥밥오분작돌솥밥 먹어보았습니다. 외식 외식 와이프가 지인 중에서가람돌솥밥다녀왔다며 사진을 보여주길래가자!집에서 가까운 중문관광단지 거의 대부분이 관광객에게 초점이 맞춰져... ,★어복남★의 제주도 이야기...,https://blog.naver.com/sidesnack,2017-09-29
