title,link,description,bloggername,bloggerlink,postdate
감사한 사람에게 떡선물 -경기떡집 ,https://blog.naver.com/hanjhee?Redirect=Log&logNo=222158939855, 경기떡집since 1958 남편이 퇴근길에 신세계백화점에서 떡 맛집이라며경기떡집 의 대표메뉴 이티떡이란 걸 사왔다. 떡 양쪽에 앙금이 붙어있는 처음보는 떡이었다. 출처:경기떡집흰이티떡 사진 쑥이티떡... ,★처음마음 그대로★,https://blog.naver.com/hanjhee,2020-11-30
[동탄 롯데백화점]경기떡집 ,https://blog.naver.com/minmogun?Redirect=Log&logNo=222500789865,집이죠~~ #동탄 경기떡집네이밍을 경기... 로 해서... 아주 인식하기가 좋아요~ 약식은 안 보이지만..ㅎㅎㅎ 위에랑 비슷하겠죠~~ 매우 국산 쌀과 좋은 재료로 재료도 좋고.. 맛도 좋은 떡집 맞습니다~!! 식혜랑... ,민모군의 요리 먹고 조리 먹고,https://blog.naver.com/minmogun,2021-09-10
 경기떡집시식 후기 : 이티떡 고구마단호박찰떡 모둠영양찰떡,https://blog.naver.com/ajiyoon?Redirect=Log&logNo=221672425498,"저는 떡을 좋아하는 편이긴 하지만 특별히 SNS 떡이라든지, 전국 몇등 떡집의 떡을 사먹어 본 적은... ㅋㅋ 이름이경기떡집 이라 경기도 어딘가를 가셨나 했는데 LOTTE라는 말만 들었어요. 넘 이쁜 포장! 너무... ",글 쓰는 마케터 해피스완의 좋은 날,https://blog.naver.com/ajiyoon,2019-10-09
[망원 떡집] 서울 3대 떡집 ‘ 경기떡집 ’,https://blog.naver.com/riko_5?Redirect=Log&logNo=222237659056,#망원 #망원동 #망원떡집 #망원맛집 #서울3대떡집 # 경기떡집갑자기 떡이 너무 먹고 싶어서 망원동경기떡집 에 다녀왔다.경기떡집 은 서울 3대 떡집 중 한 곳이고 떡 명장이 만든 이티떡이 유명한 집이다. 오랜만에... ,Loveriko,https://blog.naver.com/riko_5,2021-02-09
 경기떡집 ,https://blog.naver.com/gingoba2?Redirect=Log&logNo=222510045086,다른곳 약과는 좀 딱딱하거나 한곳도 있는데경기떡집약과도 맛있고 안국동에 있는 낙원떡집 약과도 괜츈타 그 외에 다른데서 사먹으면 90프로는 어딘가 딱딱하면서 쩐맛이 나기도 하고 ^^; 젤 비싼건경기떡집 ... ,여행 +,https://blog.naver.com/gingoba2,2021-09-18
"서울 망원동 ' 경기떡집 ', 이티떡",https://blog.naver.com/adargio?Redirect=Log&logNo=222235335879,저희는 딸아이 덕분에 서울 3대 떡집으로 손꼽히는 망원동 ‘ 경기떡집 ’의 이티떡을 맛봤답니다. ▲ 이티떡 (수수이티 8+쑥이티 8+흰이티 8) 이티떡은 찹쌀을 사용해 만든 쫀득한 인절미를 거피팥이 감싸고... ,┏LOvE AcTu·aL·Ly┛,https://blog.naver.com/adargio,2021-02-08
 경기떡집완전 맛있는 떡이에요,https://blog.naver.com/kswf1996?Redirect=Log&logNo=222519373681,# 경기떡집# 경기떡집 완두시루 2대째 이어온 전통 방앗간 월요일~토요일(일요일 휴무) 영업시간 : AM09:00~PM06:00 점심시간 : AM 12:00~PM1:00 직장으로 배송되어져 온경기떡집떡 맛있는 떡집도 어쩜 그리 많은지... ,초이사랑,https://blog.naver.com/kswf1996,2021-09-28
[내돈내산]경기떡집롯데백화점 강남점(떡 보관방법),https://blog.naver.com/lazyrabbit22?Redirect=Log&logNo=222515792984,"암튼 롯데백화점 강남점 지하 푸드코너를 구경하다가경기떡집 이 있어서 홀린듯 사 왔습니다... 젤 위에가 쑥떡 그리고 가운데 두개가경기떡집 에서 제일 유명한 이티떡입니다. 왼쪽이 쑥 이티떡, 오른쪽이 기본... ",게으른토끼,https://blog.naver.com/lazyrabbit22,2021-09-24
[배달떡집] 경기떡집이티떡,https://blog.naver.com/hyelimaaa?Redirect=Log&logNo=222326464560,떡을 좋아하는 나는 #네이버쇼핑라이브 에 # 경기떡집나온거 보자마자 주문함 #삼대떡집 중 하나라는데 요즘 맛있는 떡도 거의 배달이 되서 이렇게 집에서 먹을수 있다니 #이티떡 3종 과 #경기약과 세트로 주문... ,림이네 놀러와,https://blog.naver.com/hyelimaaa,2021-04-28
일상기록: 또보겠지떡볶이/을지로 세림/ 경기떡집 ,https://blog.naver.com/mini7569?Redirect=Log&logNo=222531119924,식겁# 경기떡집#이티떡 그리고 오후에는 국회출장갔다가 내가 조와하는경기떡집이티떡 득템 ʕ·ᴥ·ʔ❤️ 떡이랑 저 사이에 있는 콩고물이 진짜 맛있음 단호박떡도 있고 뭐도 있는데 이티떡이 제일... ,일상기록,https://blog.naver.com/mini7569,2021-10-08
#205 - 맛있는 떡집 추천망원동경기떡집 ,https://blog.naver.com/fandiago?Redirect=Log&logNo=222272453263,포장이 깔끔한 떡집을 찾는다면경기떡집 을 추천한다. + 흑임자 이티떡은 신메뉴라 아직 홈페이지에는 업로드가 안된 듯 싶다. http://m.kricecake.com/ # 경기떡집#망원동 경기떡집#서울3대떡집 #떡집추천 #이티떡,생각하는 바보잉여,https://blog.naver.com/fandiago,2021-03-11
수제떡집추천 ! 우리쌀로 만든 맛있는경기 미당 흑임자 인절미,https://blog.naver.com/chanseong1?Redirect=Log&logNo=222402307429,맛있는 수제떡집추천 모든 제품을 첨가제 없이 직접 찧고 반죽하며 빚는다는 수제 떡집경기 미당 ! 아이스박스를 개봉해보면 떡의 신선도 유지를 위해 아이스팩 포장과 함께 비닐로도 씌워져 있어요. 흑임자의... ,처음처럼♬,https://blog.naver.com/chanseong1,2021-06-18
망원동경기떡집 ,https://blog.naver.com/seongyeun?Redirect=Log&logNo=222393341587,"지난 달에 망원동 나들이 갔던 날, 꼭 가보고 싶었던경기떡집 에, 드디어 다녀왔답니다. :) 인절미 사이사이 앙금을 붙인 이티떡으로 유명한경기떡집 . 저는 이곳에 처음 왔지만, 전에경기떡집 에 와본적 있는... ",연이의 달콤한 집,https://blog.naver.com/seongyeun,2021-06-11
망원동경기떡집이티떡!! 특이한 모양의 이북식 인절미 너무... ,https://blog.naver.com/kimjy202517?Redirect=Log&logNo=222529184626,"많고경기떡집 에 문의를 하니 택배는 하지 않고 서울,경기, 인천만 퀵으로 배송해 준다고 하더라구요...경기떡집 은 서울3대 떡집으로 유명하다고 하는데.. 이티떡 말고도 마스코바도설기와 고구마 찰떡도 너무... ",언제나 맑음,https://blog.naver.com/kimjy202517,2021-10-07
"선물떡, 답례떡으로 좋은경기떡집이티떡",https://blog.naver.com/zzoco_uu?Redirect=Log&logNo=222265834797,답례떡으로경기떡집이티떡을 돌림. 물론 내가 좋아하는 줄 모르고 ㅎㅎ 요즘 대세는 대세인가 봄....경기떡집이티떡 구매하면 가급적 빨리 드시고 보관에 꼭 유의하세요. #이티떡 # 경기떡집 이티떡 #이티떡보관... ,최스카 세상,https://blog.naver.com/zzoco_uu,2021-03-05
6시내고향 인절미 떡 파는곳떡집위치경기화성 온라인 주문... ,https://blog.naver.com/kl00821?Redirect=Log&logNo=222513249555,6시내고향 인절미 떡 파는곳떡집위치경기화성 온라인 주문 택배 연락처 2021년 9월 22일 수요일 6시내고향 방송경기화성떡집인절미 인터넷 주문 구입처 구매 방법 들기름 참기름 방앗간 오늘은 추석하면... ,요뜨,https://blog.naver.com/kl00821,2021-09-22
고속터미널 카페경기떡집 /흥인제분소,https://blog.naver.com/dailylifediary0?Redirect=Log&logNo=222537805744,고속버스터미널에서 카페 갈 만한 곳을 찾아 돌아다니다가 터미널 지하 식당가에서경기떡집 이라는 곳을 발견했어요! 주말 저녁시간이었는데 카페가 메인은 아니고 떡집이다보니 사람이 거의 없더라고요... ,daily life 블로그,https://blog.naver.com/dailylifediary0,2021-10-15
망원동 떡집 ::경기떡집(송편♡),https://blog.naver.com/hbhharu?Redirect=Log&logNo=222527671765,내돈내먹 망원동경기떡집 은 워낙 유명하다보니 두번정도 가보긴 했었는데 그다지 기억속에 남는 떡은... ㅎㅎ경기떡집 이 생각나서 갔더니 줄이.....ㄷㄷ 작년 추석 줄이 많은 걸 보니 송편 맛있나보다 해서 같이... ,Daily.Blog,https://blog.naver.com/hbhharu,2021-10-05
5가지 떡!경기떡집 ~ 매화5송이4호,https://blog.naver.com/teensee?Redirect=Log&logNo=222104034105, 경기떡집 ~ 매화5송이4호 ↓ 매화5송이4호 5가지 떡이 들어있는경기떡집매화5송이4호 ↓경기떡집떡 이름을 잘 몰라서 떡 이름이 궁금했는데 재료만 쓰여있고 떡 이름은 안 적혀 있었어요 ↓ 이름이 뭘까 이... ,teeNsee,https://blog.naver.com/teensee,2020-09-30
 경기떡집 _ 이티떡,https://blog.naver.com/noblegift?Redirect=Log&logNo=222539536710,#마켓컬리 에서 구입한 # 경기떡집# 경기떡집 이티떡 #이티떡 망원동의 유명한 떡집이라 하는데 거기에 당분간 갈 여력이 안되다 보니 냉동상태로 배송이 되지만 구입해 봤던 떡. 10개들이로 쑥과 일반과 2종류가... ,노블기프트,https://blog.naver.com/noblegift,2021-10-17
"망원맛집투어,경기떡집 , 카페 안녕!로빈",https://blog.naver.com/buta0331?Redirect=Log&logNo=221732001743," 경기떡집 은 찰떡이가 추천해준 맛집은 아니다. 망원에 맛있는, 유명한 떡집이 있다하여, 떡순이는 가봐야했다. 찰떡이에게 한팩을 선물로 줬는데 찰떡이는경기떡집 은 모르고 이티떡은 알고 있었다. 가게에... ",그냥 일상기록용,https://blog.naver.com/buta0331,2019-12-09
드디어 영접한 망리단길경기떡집이티떡,https://blog.naver.com/kalyssma?Redirect=Log&logNo=222518159453,와이프가 먹어보고는 너무~맛있다고... 이런떡은 어디서 파냐고 하네요~~ 망리단길 서울3대떡집경기떡집/ 이티떡~~~ 오늘도 대성공~~^^ 조만간 다른 떡들도 먹어봐야 겠습니다~~,맛집다니는 한량,https://blog.naver.com/kalyssma,2021-09-28
"(재택간식) 그래놀라와 플레인요거트,경기떡집이티떡",https://blog.naver.com/youds0413?Redirect=Log&logNo=222077692670,"구매한 # 경기떡집#이티떡추천 을 사와서 냉동해뒀는데 중간중간에 입이 심심할때, 와구와구... 주말에 롯데백화점본점 지하 1층가면경기떡집이티떡을 저렇게 낱개씩 포장해서 냉동되어 판다.... ",유다뿡,https://blog.naver.com/youds0413,2020-09-02
망원동 떡집 떡명장의 이티떡경기떡집 ,https://blog.naver.com/nanacook?Redirect=Log&logNo=221435934712,"망원동 떡집 떡명장의 이티떡경기떡집수년전 망원시장을 자주 장보러 다니던 시절에 비해서 요즘 망원시장은 망리단길을 비롯, 시장전체 분위기가 예전이랑은 사뭇 달라졌죠. 예전경기떡집같은 경우에도... ",Nana's kitchen,https://blog.naver.com/nanacook,2019-01-08
"망원시장 맛집, 고향집의 칼제비 칼국수 +경기떡집 ",https://blog.naver.com/mitsru79?Redirect=Log&logNo=221636756242,망원시장 오면 꼭 들르는 떡집 종일 손님이 끊이지 않는 유명한 떡집경기떡집 이예요...여기 이티떡이 유명하죠! 그리고 항상 떡을 시식할 수 있어 좋아요^^ 지겸이가 이 집의 꿀떡을 정말 좋아해서 꿀떡 한... ,미쯔루의 맛있는 이야기,https://blog.naver.com/mitsru79,2019-09-02
"전국10대 떡집, 망원동경기떡집이티떡 드셔보세요.",https://blog.naver.com/resource2?Redirect=Log&logNo=221570065025,"서울의 망리단길에 있는경기떡집 . 경기도 선정 떡 명장이 운영하는 전국10대 떡집 중 하나이다. 인스타떡집, 인생떡집으로 SNS에 많이 나오는 떡방앗간이어서 떡슐랭가이드에도 꼭 오르는 특이한 이티떡 뿐만... ",공익연계마케터 / 나눔실천특별위원회,https://blog.naver.com/resource2,2019-06-25
망원동 맛집경기떡집이북식인절미 이티떡,https://blog.naver.com/sajapyung?Redirect=Log&logNo=221186549645,이티떡으로 유명한 서울 3대 떡집 부모님과 네 아들이 경영하는 망원동 맛집경기떡집 을 소개합니다. 망원역 2번 출구로 나와 망원시장 쪽으로 가다가 첫 번째 사거리에서 좌회전하면 멀리 간판이 보이지요.... ,맛있는 건 언제나 옳아,https://blog.naver.com/sajapyung,2018-01-17
"망원동 아버지와 삼형제,경기떡집 ",https://blog.naver.com/travelfoodie?Redirect=Log&logNo=220919898107,아버지와 삼형제가 대를 이어 떡을 만드는경기떡집 . 앞으로가 더욱 기대되는 떡집입니다. 곧 떡집 윗층에 떡을 배울 수 있고 맛볼 수 있는 공간이 열린다고 하니 그때 다시 찾아야겠습니다. *경기떡집 의... ,"때때로, 바람공방, 감",https://blog.naver.com/travelfoodie,2017-01-25
망원동경기떡집 ,https://blog.naver.com/sakwanamu?Redirect=Log&logNo=220135136064,망원동경기떡집 이예요^^ 얼마전부터 달콤한 거피팥이 듬뿍 올려진 찰떡이 너무너무 먹고싶었는데... 사이즈는 2000~2500원 판매하는 동네 떡집들과 차이가 없어서 조금 비싸게 느껴지실수 있어요 대신 국내산... ,국산마늘의 매운 일상,https://blog.naver.com/sakwanamu,2014-10-28
망원동경기떡집 ,https://blog.naver.com/kyu_b?Redirect=Log&logNo=221481169662,망원동경기떡집 에서 이티떡 사왔어요 ㅋ 친정식구들과 망원동에서 식사하고 근처에 유명한 떡집 있다기에 배는 부르지만... 바로 갔어요 ㅋ 망원역에서 가까움 인터넷 홈페이지에서 주문도 가능한 듯 이게 그... ,SECOND NAME,https://blog.naver.com/kyu_b,2019-03-05
[인생떡집] 망원동경기떡집 .. 꼭 한번 잡숴봐 제발,https://blog.naver.com/colorstory_j?Redirect=Log&logNo=221446405882,그 유명하다는경기떡집토요일 오전에 강남 논현동으로 수업들으러 가다가 급하게 들른경기떡집 ... 떡집 일이 넘 힘들어서 젊은 사람들도 시도했다가 포기한다는데 이분들은 힘들어보이시기보다는 소명을... ,Julie's Home,https://blog.naver.com/colorstory_j,2019-01-20
망원동경기떡집소담떡방 이티떡!,https://blog.naver.com/i723766?Redirect=Log&logNo=220447534269,1 이티떡 이게바로바로 제가 사랑하는 이티떡이랍니다_♥경기떡집경기떡집 은 인간극장에도 떡집 5부자편에 나오시고티비프로그램에도 많이 나오셔서 꽤나 유명하셔요~ 아버지의 대를 이어받아 형제분들이... ,샤로미 ♥ Are U happy?,https://blog.naver.com/i723766,2015-08-13
망원동 떡집 ::경기떡집 ,https://blog.naver.com/mogura81?Redirect=Log&logNo=221208416460,"망원동경기떡집내일부터 설연휴 시작이니까, 오늘은 망원동에 위치한 떡집경기떡집포스팅 :-) 빵도 좋아하고, 떡도 좋아하는 나는 탄수화물중독자 ㅠㅠㅠㅠ 서울 망원동에 위치한 떡집이지만... ",추억은 방울방울,https://blog.naver.com/mogura81,2018-02-14
망원맛집서울3대떡집경기떡집맛있다,https://blog.naver.com/sizellmins?Redirect=Log&logNo=221309786916,"망원동과 거리가 멀어 떡국 떡이 필요할 땐 동네 떡집을 이용하곤 하는데, 음식 하면 금방 불기도 하고 찰기도 좀 아쉬워요. 그러나경기떡집떡국떡으로 만들면 시간이 지나도 불지 않고 쫄깃쫄깃!! 덕분에... ",Luce Sicut Stellae ⍢,https://blog.naver.com/sizellmins,2018-07-02
"결혼답례품 답례떡 주문완료, 망원 [ 경기떡집 ]",https://blog.naver.com/yeseul0703?Redirect=Log&logNo=221350512052,맛있기로 유명한 망원 [ 경기떡집 ] 에 주문하기로. 답례떡 주문했어? 아니 아직... 자꾸 미루게 돼서 속편하게 직접 방문했다.경기떡집추석연휴 때 이렇게 영업하신다고함. 입구에 시식용 떡들이 가득. 내... ,예슐리 블로그,https://blog.naver.com/yeseul0703,2018-09-01
망원동경기떡집이티떡 보다 더 맛있는 것은?,https://blog.naver.com/xangela00?Redirect=Log&logNo=221345792520,망원동경기떡집떡가격입니다. 동네떡집보다는 비싸지만 서울의 유명 떡맛집보다는 가격 좋습니다. 쟁여두면 똥된다. 늘 되내이는 장보기 철학입니다. 두팩만 사서 후다닥 먹기로 하고 다른 떡은 다음을... ,안젤라스,https://blog.naver.com/xangela00,2018-08-25
망원동맛집투어 - 이치젠.어글리베이커리. 경기떡집 .커피가게동경,https://blog.naver.com/dasomammy?Redirect=Log&logNo=221444900949,"뒤에서경기떡집찾아요? 하고 물어주시는 아주머님.. 하하하.. 구글맵으로 찾아도 되는데, 넘 친절히 알려주셔서...^^ 들깨떡국떡의 유혹도 뿌리치고, 지금보니 흑임자인절미는 왜 패스한거니? 공주떡집... ",다소마미의 오늘요리,https://blog.naver.com/dasomammy,2019-01-18
간식추천경기떡집제대로 만든 경기약과,https://blog.naver.com/youanttmr?Redirect=Log&logNo=222536468657,"안녕하세요 마음의 운동입니다 오늘은 간식추천경기떡집제대로 만든 경기약과 후기입니다 동료분이 줘서 먹어봤는데 낱개로 되어 있어 출출할때 먹기 좋더라고요 국내산 밀 100% 사용하고 ,45g... ",마음의 운동,https://blog.naver.com/youanttmr,2021-10-14
"망원동경기떡집- 이티떡 / 마포 흑임자떡, 유명한 떡집",https://blog.naver.com/eyefilling19?Redirect=Log&logNo=221229454798,"ㅎㅎㅎㅎㅎㅎㅎㅎㅎㅎ 초코퐉! 이런 느낌이 왔거든요...ㅎㅎ 요새는 과일도 다 달고, 떡도 달고, 빵도 달고...안 단 음식 찾기가 더 어렵다는ㅠㅠ 유명한경기떡집내 입맛에는 그냥 달아서 맛있는 떡집이었네요ㅎㅎ",감정배우기,https://blog.naver.com/eyefilling19,2018-03-15
망원동경기떡집방문후기 맛있자나 이떡저떡,https://blog.naver.com/glqgkqehdwl?Redirect=Log&logNo=221234684696,(사실경기떡집 은 이동네 알만한 사람은 다아는 이미 유명한 떡집이다. 나도 과거부터 알고있었고 방문은 처음이다.) 망원동 맛집경기떡집 의 위치를 지도에 표시해 첨부했으니 참고하면 된다. 도로명 주소... ,a.k.a holic,https://blog.naver.com/glqgkqehdwl,2018-03-24
서민갑부 떡집 맛있는 떡으로 유명한 망원경기떡집위치! 이티떡,https://blog.naver.com/babyadriana?Redirect=Log&logNo=220293240598,요것이 바로 티비에 나오던 서민갑부 떡집 망원경기떡집 의 떡들이에요 ㅋㅋ 위치도 대로변이랑 가까운곳에 있어서 찾기 쉬우실것같아요. 아랫쪽에 지도 첨부할게용! 저희가 오후에 가서 이미 맛난떡들이 많이... ,에디의 난리나는 블로그,https://blog.naver.com/babyadriana,2015-03-07
"서울 망원동 맛집, 망원역 맛집, 망원동경기떡집 ",https://blog.naver.com/cmykhc?Redirect=Log&logNo=220907608472,"이 초밥 집도 ㅋ 그리고 도착한경기 떡집 .. 2대째 가업을 이어오고 있는 떡집의 명가입니다. 명절 다가오니 이 집도 눈코 뜰 새 없이 바쁘겠군요. 안에 떡 공장이 있습니다. 찰떡, 호박떡, 송편, 쑥떡... ",나의 식유기,https://blog.naver.com/cmykhc,2017-01-10
 경기떡집소담떡방 떡 한과 2,https://blog.naver.com/eofhwjddbs?Redirect=Log&logNo=220377874992, 경기떡집소담떡방입니다 날씨가 너무 덥네요 ㅠㅠㅠ경기떡집소담떡방은 여름에도 떡찜기 앞에서 열심히 맛있는떡을 만들기위해 일을한답니다 ^^ 근데 왜 살이 안빠질까요 ㅋㅋㅋㅋㅋㅋㅋㅠㅠㅠㅠㅠ 저번은... ,경기떡집 & 소담떡방 입니다.^^,https://blog.naver.com/eofhwjddbs,2015-06-02
[마포 망원동 떡집] 경기떡집 ,https://blog.naver.com/misssyh?Redirect=Log&logNo=220143909928,이건 근데 공주떡집이 최고징ㅋㅋ 물론경기떡집 도 매우 훌륭해!! 달달해서 맛난 완두배기찰편!! 부장님이 이거 너무 맛나다고..떡집 어디있냐고ㅋㅋㅋ 아 근데..왜 걍 시루떡은 없지?경기떡집 에? 난 시루떡 젤... ,좋아해,https://blog.naver.com/misssyh,2014-10-07
[ 경기떡집 ] 대를 잇는 떡 명장의 집,https://blog.naver.com/152094?Redirect=Log&logNo=220520012018,자리한경기 떡집마포구 상신 초등학교 길 건너 앞 골목으로 쭉 ~~~ 들어오면 된다. 채널A 서민 갑부에서 보고 꼭 찾아가 봐야지 했던 곳이다. 빵순이 이기 전에 떡순이인 내가 이렇게 맛있는 떡집을 이제야... ,세상과 소통(疏通)하기,https://blog.naver.com/152094,2015-10-26
[망원동맛집/ 경기떡집 ]드디어경기떡집방문해봤어요^^,https://blog.naver.com/ilydanbee?Redirect=Log&logNo=100206701534,"궁금한것,,,,먹고싶은것은 어떻게든 해결을 하고 넘어가야 하는 단비랑,, 드디어,,, 경기떡집 에 직접... 이집이 인간극장에 5부자떡집으로 유명한 곳이기도 한데,,, (저는 그 프로를 못봤네요^^;;;) 아마도... ",단비랑의 세상의 모든 맛집,https://blog.naver.com/ilydanbee,2014-03-04
