title,link,description,bloggername,bloggerlink,postdate
"광명점 레스토랑 방문 후기 (ft. 푸드코트, IKEA광명 식당 )",https://blog.naver.com/woorim0ju?Redirect=Log&logNo=222536113328,이케아광명 점 레스토랑 이케아에 쇼핑하러 갔다가 빠뜨릴수 없는 이케아식당방문 후기입니다. 이케아광명 점 전화번호: 1670-4532 레스토랑 : 9:30 - 20:30 또는 21:30 (마지막 주문 20:00 또는 21:00) 휴무일: 설날... ,글쓰는 갓디노,https://blog.naver.com/woorim0ju,2021-10-13
"설렁설렁 제주 2박 3일 첫날 ! -광명식당 , 금오름, 금능해수욕장",https://blog.naver.com/hyel123?Redirect=Log&logNo=222452200740,21/07/01 제주 도착 - 아침광명식당- 금오름 - 금능해수욕장 - 한림공원 내 카페 - 숙소 체크인 - 저녁... 아버님이 제주 갈 때마다 찾으신다는광명식당 . 고기국밥 전문이고 저녁 안주메뉴도 몇 가지 있다. Previous... ,시작은 오글오글,https://blog.naver.com/hyel123,2021-07-31
제주 동문시장 먹거리 제주도민 맛집광명식당 ,https://blog.naver.com/wlsgml850?Redirect=Log&logNo=222433080409,제주광명식당작년 초쯤 한창 추웠을 때 여행을 갔다가 마지막 날 만찬으로 무얼 먹으면 좋을까 고민을... 많은 식당들이 몰려있어서 다양한 제주도 먹거리들을 맛볼 수 있다는 장점이 있더라고요. 신선한... ,트래블러버의 맛있는 여행,https://blog.naver.com/wlsgml850,2021-07-16
제주 동문시장 맛집 : 우진해장국/ 광명식당후기,https://blog.naver.com/lsb0701?Redirect=Log&logNo=221944185584,"제주 동문시장 맛집 우진해장국 최자로드광명식당안녕하세요! #제주살이 하고 있는 봉슬이예용... * 차로 가실거면 그냥 식당이름 네비 찍고 가셔요*_* 주차는 건물 타워에 했고, 1시간 무료였어요! 비쥬얼은... ",lovely B,https://blog.naver.com/lsb0701,2020-05-04
제주 동문시장광명식당찹쌀순대 돼지국밥 * 제주공항근처... ,https://blog.naver.com/jina34622?Redirect=Log&logNo=222396924920,찹쌀순대광명식당 을 찾았어요 여기는 생생정보에도 나오고 한국인의밥상에도 나왔었어요 그리고 최자로드에도 나왔길래 유튜브로 한번 보고 갔던거같아용 시골 식당 분위기에요 티비프로그램에 나왔던... ,ᶜᴴᴬᴿᴹᴵᴺᴳ ᴮᴸᴼᴳ,https://blog.naver.com/jina34622,2021-06-13
"뚜벅뚜벅 제주 여행 1일차 ( 광명식당 , 빛의벙커, 예소담)",https://blog.naver.com/rocjfja?Redirect=Log&logNo=222407992740,1시 30분쯤 공항에서 내려서 곧장 동문시장으로 갔다 최자로드에 나온광명식당 에서 국밥을 먹기 위해서!! 음.. 솔직히 그냥 그랬다 ◠ ͜ ◠ 그리고 곧장 제주시외버스터미널로 갔다 빛의벙커 근처로... ,"정오, 자정",https://blog.naver.com/rocjfja,2021-06-23
식당 산채비빔밥 표고버섯도토리묵 올방개묵광명식당 ,https://blog.naver.com/park117897?Redirect=Log&logNo=222458623779,연잎밥전문점인 연잎담은 단아하고 정갈하며 건강한 음식을 내어주십니다 식당입구에 작은 연못이... 4. 광명식당부안 외산면 무량사앞에 위치한광명식당 은 표고버섯전문점입니다 표고버섯을 많이 넣은... ,퉁이의 강남에서 살아가기,https://blog.naver.com/park117897,2021-08-06
다시가도 맛있는광명이케아 맛집 -고반 식당광명 점,https://blog.naver.com/math_pooh_?Redirect=Log&logNo=222387757831,고반 식당광명 아브뉴프랑점 주소: 경기광명 시 양지로 16 1층 연락처: 02-898-5861 영업시간: 매일 11:00~22:00 / 15:00~16:30 (브레이크 타임) 마지막 주문 (21:30) 주말 및 공휴일 정상 영업 주차: 가능 (무료 3시간 30분)... ,12차원뽀로롱,https://blog.naver.com/math_pooh_,2021-06-07
최자로드 순대국밥 | 제주광명식당- 와 여기는 찐이다 + 주차정보,https://blog.naver.com/eung1215?Redirect=Log&logNo=222374207057, 광명식당주차는요 국밥집이 동문시장에 있다길래 우리는 그냥 동문재래시장 공영주차장(X)에 댔는데요 - 여기 대면 한 7~8분 걸어야 함. 여기보다 동문공설시장 공영주차장(O)에 대면 바로 옆이광명식당 이에요!... ,My Missing Piece,https://blog.naver.com/eung1215,2021-05-29
"제주공항근처맛집, 동문시장 터줏대감 ' 광명식당 '",https://blog.naver.com/tlso70?Redirect=Log&logNo=222316915567,가득한광명식당 ! 내부는 꽤 널찍하고 테이블이 많은 편이라 많은 인원을 수용할 수 있을 것 같았어요 식당 한 켠에 붙어있는 맛집 인증 패(?)와 원산지 표기 돼지고기는 모두 제주산입니다 제주 돼지는 이미... ,라라팍의 라라pick,https://blog.naver.com/tlso70,2021-04-20
부여 맛집 /광명식당버섯요리가 맛있어요,https://blog.naver.com/ejjkkong?Redirect=Log&logNo=222495811009,"한다면 저희는 구이, 묵, 비빔밥 으로 정리하려구 해용 맛집은 맛집이에용 많은 식당 중에광명식당 만 만석이었어용 :) 부여광명식당 에 가실 기회가 된다면 조금이나마 포스팅이 참고가 되면 좋겠어용!",콩돌쀼의 행복육아♥️,https://blog.naver.com/ejjkkong,2021-09-08
"호불호 강한광명식당(제주 동문시장, 최자로드국밥)",https://blog.naver.com/abcde2798?Redirect=Log&logNo=222534124164,그래도광명식당다녀온지 2주가 지났는데 생각난다. 다시 가면 더 잘먹을 자신 있다!!! 콤콤한 돼지냄새가 식당 안에 가득하고 가게도 허름하지만 이런 건 상관없고!! 오래된 전통순대국밥 맛보고 싶다면... ,총총이의 호기심 천국,https://blog.naver.com/abcde2798,2021-10-12
광주 화정동맛집광명식당생고기,https://blog.naver.com/jaepum6824?Redirect=Log&logNo=222172989445,광명아파트 상가에 있어서광명식당 이라는 식당명칭을 사용하신게 아닌가 싶습니다. 간판과 외부풍경이 맛집인것 처럼 보이죠. 맛집들은 역시 오래된 곳이 많기에 리모델링을 하지 않으면 깔끔하게 보이지는... ,빠져드는 물생활,https://blog.naver.com/jaepum6824,2020-12-14
일직동 맛집 고반 식당광명아브뉴프랑점 :: 고기맛도 최고... ,https://blog.naver.com/glassr?Redirect=Log&logNo=222391824092,내일 남편의 얀센백신접종을 대비하야 고기로 몸보신을 해야겠다싶어 일직동 맛집으로 소문난 고반 식당 을 찾았어요 : ) #일직동맛집 # 광명 맛집 #고반 식당광명 아브뉴프랑점 #숙성생삼겹 지하에 주차하고... ,반짝반짝빛나는 :D,https://blog.naver.com/glassr,2021-06-10
"소하동 애견동반식당 ,광명 역 강씨네농장!",https://blog.naver.com/darcyy?Redirect=Log&logNo=222525552780,위치는 KTX 광명 역 근처 약간... 여기식당 이 있어...? 차가 들어가도 되는거야아아...? 하는곳에 있다. 심지어 처음에 내비가 고속도로 위를 찍어서 ㅋㅋㅋ 엄한곳을 갈뻔함... 내부는 이런 분위기 비닐하우스 안에... ,Fantaisie Impromptu,https://blog.naver.com/darcyy,2021-10-03
최자로드 제주 맛집 동문시장 ' 광명식당 ',https://blog.naver.com/wusl1553?Redirect=Log&logNo=222052939535,제주 도착하자마자 렌트카 받아서광명식당 으로! 친오빠가 최자로드에 빠져가지고... 최자로드 맛집 다 갈 기세ㅋㅋㅋㅋㅋㅋㅋ #제주맛집 #최자로드제주 #70년전통 # 광명식당70년 전통 원조 찹쌀 순대... ,"오늘을 기억해,",https://blog.naver.com/wusl1553,2020-08-06
"[신혼여행] 5월 제주도 4박5일 1일차(동문시장,광명식당 ... ",https://blog.naver.com/sure20214?Redirect=Log&logNo=222399224654,"ㅠ 일단 배가 고파서 우리가 꼭 놀러가면 찾아보는 최자로드 식당을 찾아갔다. 동문시장,광명식당제주 제주시 동문로4길 9 동문공설시장 70년 전통의 찹쌀순대광명식당 . 여기 순대국밥이 밥을 토렴해서... ",Yun_Place,https://blog.naver.com/sure20214,2021-06-15
고독한 국밥가 :광명식당본가 옛날순대,https://blog.naver.com/kjakfldh?Redirect=Log&logNo=222280763976,고독한 국밥가 :광명식당본가 옛날순대 불광역 근처 오면 가는 순대국집중 한 곳광명식당본가 옛날순대를 갔다 북한산 클린 하이킹 플로깅을 하고 배를 채우러 이렇게 열심히 쓰레기를 주웠으니 확실하게... ,신나게 재미있게 맛있게!,https://blog.naver.com/kjakfldh,2021-04-02
"영천 노포 맛집 ' 광명식당 ' : 메뉴는 단 세 가지, 숨은 맛집",https://blog.naver.com/iamhankong?Redirect=Log&logNo=222383812947,"일단 네이버에는 '중식당'으로 분류하고 있었다. 영천 노포 맛집 ' 광명식당 ' : 메뉴는 단 세 가지, 숨은 맛집 풍문으로 들었소. 나는 취학 전까지 영천에서 성장했다. 때문에 어릴적 영천에서 외식을 한 기억이... ","인문학도 투자자, 한공",https://blog.naver.com/iamhankong,2021-06-06
[광주 화정동 맛집]광명식당- 선도 좋은 육사시미와 남도식 김치,https://blog.naver.com/sielle83?Redirect=Log&logNo=221763111898,위치한광명식당 테이블 꼴랑 6개 남짓 있는 아파트단지 상가 안에 있는 작은 식당이이렇게 외지인들까지 찾아오는 맛집이 되는SNS의 힘이 느껴지는 재밌는 세상이다 광주 화정동광명식당 ... ,여의도 직장인 문썬의 밥상 (舊 을지로),https://blog.naver.com/sielle83,2020-01-11
[ 광명식당 ] 제주 동문시장 - 투박하지만 맛있는 순대,https://blog.naver.com/mardukas?Redirect=Log&logNo=222100346001,동문시장 한켠에도 순대국집들이 모여있는데 그 중 제일 유명한 곳 중 하나가 이 곳광명식당 입니다. 이젠 아예 플랫카드에 방영된 식당들이 모여있네요.. 최자로드도 그 중에 한 곳~! 한라산 그리고... ,"먹자, 마시자, 놀러 다니자",https://blog.naver.com/mardukas,2020-09-30
제주 순대국밥 꼭 드셔 보세요 ' 광명식당 ',https://blog.naver.com/jiin6661?Redirect=Log&logNo=222001871856,제주광명식당어떤 친구들은 제주에 가면 예쁜 곳들이 얼마나 많은데 이런 밥집을 가냐고 할 수 있기에 가고 싶은 식당이 있을 때엔 동행하는 친구들의 의견을 먼저 묻고 가는 편인데 이번에 동행한 친구는 워낙... ,먹보꼬꼬마,https://blog.naver.com/jiin6661,2020-06-15
 광명애견동반 식당비닐하우스 감성 강씨네농장 오리주물럭,https://blog.naver.com/specforum?Redirect=Log&logNo=222492599719,"날씨가 흐리고 비가 자꾸 내려서 강아지들이랑 산책이 힘들어 외출이라도 같이 하면 좋지않을까해서광명 쪽 애견동반 식당 을 찾아헤맸어요_!! 군포, 안산에서도 가까운 애견동반 식당강씨네농장을 다녀와봤는데... ",맛집대잔치,https://blog.naver.com/specforum,2021-09-05
[제주] 제주시 순대국광명식당 ,https://blog.naver.com/mkhero?Redirect=Log&logNo=222535860515,"제가 2주간 지냈던 곳이 동문시장과 걸어서 10분거리였는데, 최자로드에 나온광명식당 이 동문식당에 있더라구요. 바아로 걸어서광명식당 으로 이동했습니다! 위 사진은 동문시장 남쪽 문인데요.광명식당 은... ",라쿤킴의 한량일기,https://blog.naver.com/mkhero,2021-10-13
제주시 동문시장 맛집 탐방 순대국밥은광명식당 ? 내돈내산 후기,https://blog.naver.com/h1j11?Redirect=Log&logNo=222266350572,제주시 동문시장 맛집 탐방 순대국밥은광명식당 ? 내돈내산 후기 난 국밥을 좋아한다. 물질하는 남자는... 우리동네 상모리 한우리순대가 더 맛있음 ㅋㅋㅋ 맛집 찾기는 실패했지만 매번 가보고 싶던 식당이라... ,물질하는 부부의 세계여행,https://blog.naver.com/h1j11,2021-03-06
[제주]광명식당 ,https://blog.naver.com/eomjigongju?Redirect=Log&logNo=222207703865,"내광명식당 이다. 동문시장에서는 전에 떡볶이 세트를 사먹었는데 이 블로그 안에도 찾아볼 수 있다. 3,500했던 세트메뉴가 이번에 보니 5,000으로 오르고 카드도 받더라. 여튼 아침도 굶고광명식당 으로 달려갔다.... ",노는 것이 좋다,https://blog.naver.com/eomjigongju,2021-01-14
(제주도알리기) 광명식당 ,https://blog.naver.com/cook51?Redirect=Log&logNo=222503886788,동문시장에 있는광명식당 입니다.광명식당광명식당 은 제주도를 처음 숙이와 찾았을때 국밥을... 맛집으로 식당안에는 몇테이블이 있었어요 이곳은 들어가는 순간 입구에 쌓인 돼지머리들이 반겨준답니다.... ,처리의가는길,https://blog.naver.com/cook51,2021-09-13
[제주도여행] 동문시장 내장국밥 최자로드 그집광명식당순대국,https://blog.naver.com/cjdtnsrmsu19?Redirect=Log&logNo=221680655851,안녕하세요 라라몬입니다 :) 제주도 여행 마지막 식당은 동문시장에 있는광명식당 이었어요 우진해장국 가려다가 또 방송탔다는 소문에... 이번엔 절대 못먹겠구나 하고 바로 턴! 동문시장 공영주차장 바로... ,라라몬의 재밌는 놀이,https://blog.naver.com/cjdtnsrmsu19,2019-10-17
" 광명/광명 역 맛집, 고반 식당광명 아브뉴프랑,광명 ... ",https://blog.naver.com/myjw_66?Redirect=Log&logNo=222066754732,이케아 근처 저녁을 먹을만한식당 으로 고반 식당추천추천 #고반 식당#항정살 #삼겹살 # 광명 돼지고기맛집 # 광명 이케아맛집 #고반 식당광명 아브뉴프랑 # 광명 역고깃집 # 광명 고반 식당# 광명 맛집,밍지원의 리하우스,https://blog.naver.com/myjw_66,2020-08-21
충격 만촌동광명식당제육볶음,https://blog.naver.com/bo1289?Redirect=Log&logNo=222481100926,인당 1500원 더 주고 최근 방문한 대봉동 오미가 식당 정식 9000원짜리가 훨~씬 가성비가 좋습니다 (단 오미가는 제육이 별로) 만촌동광명식당음식이 나쁘다는건 아님.. 7500원에 한 끼 때울 만도 합니다.. 근데... ,봉봉브라더,https://blog.naver.com/bo1289,2021-08-23
대구 만촌동 맛집 무시무시한 양의 제육볶음광명식당 ,https://blog.naver.com/yusungkjw?Redirect=Log&logNo=222428869280,문을연 식당입니다 사장님이 방촌동에서 추어탕집을 하시다가 이쪽 으로 오시면서 백반류를 같이...광명식당 ~ 칠성동의 볶음밥의 노포 광명반점 아니고요 어마무시한 제육볶음이 있는 곳이네요 제육볶음하면... ,카리스마대장의 맛,https://blog.naver.com/yusungkjw,2021-07-12
동문시장광명식당- 제주 순대국밥 맛집이라지만... 꽤나... ,https://blog.naver.com/melichi?Redirect=Log&logNo=222476892878,동문시장광명식당- 제주 순대국밥 맛집이라지만... 꽤나 난이도는 있음 때마침 제주에서 만난 서울 친구가 추천해 준 순대국밥집. 사전에 어디 갈까~ 검색할 때에도 나왔던 식당으로 #동문재래시장 안에... ,I am a Lifelogger.,https://blog.naver.com/melichi,2021-08-19
공주부여 산채비빔밥 표고버섯도토리묵 표고버섯구이광명식당 ,https://blog.naver.com/park117897?Redirect=Log&logNo=222457615501,백반기행 공주부여 산채비빔밥 표고버섯도토리묵 표고버섯구이 부여군 외산면 무량사앞에 위치한광명식당 은 표고버섯전문점입니다 영업시간은 오전 11시부터 오후 5시입니다 도착하니 직접 쑨 도토리묵과... ,퉁이의 강남에서 살아가기,https://blog.naver.com/park117897,2021-08-05
"제주맛집::제대로된 순대와 토렴식 국밥, 동문시장광명식당 ",https://blog.naver.com/kimo05?Redirect=Log&logNo=221722027303,집으로 돌아오는 날 동문시장에 들렀는데 원래광명식당 이 있던 식당구역이 리모델링으로 텅 비어있었다. '설마광명식당 을 못 들르는 건 아니겠지?' 원래 식당자리에 가보니 한라산 방향으로 조금만 가면... ,임글쟁의 주절주절,https://blog.naver.com/kimo05,2019-11-29
 광명 역AK플라자 맛집창업 카페 식당 창업정보,https://blog.naver.com/love_jin1532?Redirect=Log&logNo=222514322814,10월말 오픈하는 AK 광명 식당 카페 창업정보 안녕하세요~ 네이버 카페 '특수상권 창업으로 사장되기... 지금까지 광명역AK플라자에 입점하는 맛집 카페식당 창업매물의 대해서 알아봤습니다. 그럼 그만... ,★창업수수료 영원히0원!!,https://blog.naver.com/love_jin1532,2021-09-24
[영광 식당 / 광명 시장] - 보리굴비도 좋지만 갈치구이(튀김)이... ,https://blog.naver.com/melburne?Redirect=Log&logNo=222508809302,영광 식당평일 점심 식사로 생선이 땡겨서 오먹산멤버 막내와 만나기로 합니다.광명 시장에서 점심 먹고 와인도 구매하러 가기로 하고 음음....소주 한잔이 땡겼지만 낮술은 패스하고 식사만 하기로 하고... ,오로지 먹기 위해 산다~(오먹산),https://blog.naver.com/melburne,2021-09-23
제주 동문시장 70년전통 순대국광명식당 ,https://blog.naver.com/parkjj8?Redirect=Log&logNo=221774407168,해장쵸이스 식당은 79년전통의 순대국전문 # 광명식당고기국수와 왕족발만 70년동안 판매를 하셨다니 고수의 숨결이 스멀스멀 하다 70년전통 메뉴면면좀 살펴보자 순대국밥전문 원조찹쌀살순대 경조사전문... ,일단 시작해,https://blog.naver.com/parkjj8,2020-01-16
제주 동문시장광명식당- 존맛탱 국밥과 수육♡♡♡,https://blog.naver.com/xiaojiang130?Redirect=Log&logNo=221737948531,국물 미쳤어 개맛있다ㅜㅜㅜㅜㅜㅜㅜ 엄빠 없었으면 욕하면서 먹었음;;;; 동생이랑 겁나 퍼먹음ㅋㅋㅋ 제주 맛집 찾아가서 맛있었던 적이 별로 없었는데광명식당 은 정말 맛있었다ㅠㅠ 네 명이 다 못 먹고 남김ㅠㅠ,REMEMBER ME,https://blog.naver.com/xiaojiang130,2019-12-15
"도너츠 맛집 아베베, 최자로드 순대국밥 맛집광명식당 ",https://blog.naver.com/muckzza?Redirect=Log&logNo=222465925580,제주도최자로드 # 광명식당#순대국밥맛집 #제주 광명식당서울 올라오기 전 마지막 만찬으로 무엇을 먹을까 고민하다가 최자로드에 나온 동문시장 순대국밥 맛집인광명식당 에 가기로!광명식당가기 전에... ,muckzza,https://blog.naver.com/muckzza,2021-08-13
"맑은 제주, 코데인커피로스터스/ 환이네이태리식당/광명식당 ",https://blog.naver.com/napoohs?Redirect=Log&logNo=222090162294,"환이네이태리식당 Previous image Next image 매장 분위기 좋고, 직원 친절하고, 뇨끼는 아쉽다 일단 반죽이... 되는구나광명식당; (최자로드) 순대국밥 식사시간을 최대한 피해 갔는데... 그래도 사람이 많다... ",매일매일 지구잠복ˇ,https://blog.naver.com/napoohs,2020-09-15
 광명식당 폐업 중화요리업소 중고주방용품/집기 냉장고... ,https://blog.naver.com/dlwogus21c?Redirect=Log&logNo=222532204813,어서오세요 ^^ 식당 및 카페에서 사용된 각종 업소용중고주방용품/집기를 취급하고있는 형제주방 입니다! 이번엔광명식당 폐업 현장을 다녀오게되었습니다 ^^ 중화요리전문점에서 사용된 업소용냉장고와 여러... ,형제주방 소식통,https://blog.naver.com/dlwogus21c,2021-10-09
안양광명 식당주방청소업체 선정이 고민이라면,https://blog.naver.com/mwcrkfcaa?Redirect=Log&logNo=222473528659,"안양광명 식당주방청소업체 선정이 고민이라면 안녕하세요 오늘 날이 좋더라고요. 무더위에 지친... 이 글을 읽는 모든 분들이 더 행복했으면 좋겠어요 오늘은 안양광명 식당주방청소업체 특히 후드, 닥트 쪽... ",또 다른 하루의,https://blog.naver.com/mwcrkfcaa,2021-08-17
[충남 부여]광명식당 / 표고버섯 요리 맛집/ 표고버섯묵 맛집,https://blog.naver.com/vivien_jy?Redirect=Log&logNo=222050273921,"충남 부여광명식당표고버섯 요리 3년 전에 한번 먹어본 후 정말 오랜만에 들었네요 지난 7월, 보령... 있는데광명식당 을 들어갔어요! (다들 역사가 꽤 되어 보이는 비쥬얼이랍니다!) 식사 메뉴는 두 개... ",뭘 해도 어설픈 ♥ PARK JI ♥,https://blog.naver.com/vivien_jy,2020-08-03
 광명 역 점심으로 맛있게먹은 베트남노상 식당 ... ,https://blog.naver.com/haandbin?Redirect=Log&logNo=222440807498,"# 광명 역베트남 식당#베트남노상 식당광명 돈까스를 겨눌만한 돈까스집이광명 역근처에 있다기에 먹으러 갔지만, 하필! 가는날 장날이라고 문을 닫아서 베트남음식 먹으러 갔다 베트남요리도 오랜만이라... ","Blooming 활짝 핀, 미나콩",https://blog.naver.com/haandbin,2021-07-22
제주도 동문시장 식사 먹거리 맛집 추천(순대국밥 집광명식당 ),https://blog.naver.com/liebeio?Redirect=Log&logNo=221955148005,이름은광명식당 이고 시장내에 소머리국밥집 등 작은 식당들이 모여있는 곳에 있어요 공영주차장에다가 차 주차하고 나와서 시장으로 들어가며 발견한 집이었어요 메뉴는 이러합니다~~ 테이블과 의자있는... ,블링블링 슈군&찌누네 Bella,https://blog.naver.com/liebeio,2020-05-10
70년 전통 순대국밥 제주광명식당 ,https://blog.naver.com/self7770?Redirect=Log&logNo=222514986931,추석명절 연휴에 전날 마신 술로 인해 해장을 하고자 문을 연 가게를 찾아 돌아다니는데 대부분의 식당이 문을 닫고 영업을 하지 않는다. 돌고돌아 찾아온광명식당 ! 인터넷이 발달하며 맛집투어등으로... ,오름 둘레길? 여기 어때?,https://blog.naver.com/self7770,2021-09-24
제주 공항 근처 맛집 동문시장광명식당[찐맛집 내돈내산],https://blog.naver.com/joheanjang?Redirect=Log&logNo=222005592620,처음에광명식당갈 때 식당앞에서 들어가니마니 조금 투닥 거렸던 시절이 있었다 ^^... 그 때도 기억나는게 나는 들어가기 싫어 했다가! 순대랑 순대국 먹자마자 기분이 풀렸던 귀여운 기억이 있다. 그 뒤론... ,정이네,https://blog.naver.com/joheanjang,2020-06-19
오세득 셰프 픽 동문시장 맛집광명식당 ,https://blog.naver.com/thebarun62?Redirect=Log&logNo=221707025462,고기국수 유명한 식당에서도 먹어봤는데광명식당고기 국수 담백하고 정말 맛있어요. 오세득 셰프가 왜 국밥을 추천했는지 알 것 같아요. 국밥은 안 먹었지만 담백한 국물 맛이 날 것 같아요. 아이랑 있으니... ,●더바른치과 교정과●,https://blog.naver.com/thebarun62,2019-11-13
《부여맛집》광명식당자꾸 자꾸 생각나는 맛,https://blog.naver.com/ksm02930?Redirect=Log&logNo=222062644876,#부여맛집 # 광명식당#부여 광명식당#표고도토리묵 #표고버섯구이 표고버섯구이에서도 들기름냄새가 솔솔~ 고기먹는 식감이 그대로 살아 있으니.. 맛나다... 말려놓은 묵을 뜨꺼운 물에 데쳤는지 따뜻하면서 엄청... ,끌리는시골,https://blog.naver.com/ksm02930,2020-08-17
부여 외산광명식당 ,https://blog.naver.com/pupu4372?Redirect=Log&logNo=222514567222,한참을 찾아보다 허영만의 식객에 소개된 부여 무량사 앞에 있는 표고버섯묵집광명식당 으로 GO~~~~ 식당 입구 무량사 입구 전경 방송에 나온곳들이 다 그러하듯이 그냥 적당한... 기대만 하기로 했는데... ,pupu4372님의 블로그,https://blog.naver.com/pupu4372,2021-09-23
제주도광명식당- 20191101,https://blog.naver.com/salad_weeks?Redirect=Log&logNo=221716614438,찾은광명 시장 - 최자로드를 따라서 .. 주차.. 후.. 겨우겨우 해 놓고 밥 먹으러 고고 했다. 바깥쪽에 있음. 저렇게 주차장 맞은편.. 딱 옛날 시골식당 이고 친구는 따로국밥 나는 그냥 국밥에 순대랑 수육 섞인 게... ,Salad weeks。,https://blog.naver.com/salad_weeks,2019-11-26
[제주 일도일동]동문시장 국밥맛집광명식당 ,https://blog.naver.com/shsm0423?Redirect=Log&logNo=222468508958,상호 :광명식당주소 : 제주 제주시 동문로4길 9 동문공설시장 영업시간 : 11:00 ~ 22:00 전화번호 : 064-757-1872 동문시장주차장에 파킹해놓고 광명시장으로 가봅니당 마지막 하이라이트죠 엘리베이터를 타고 나오면... ,반짝반짝 햇살가득,https://blog.naver.com/shsm0423,2021-08-13
"안산 안양광명 식당 폐업 철거, 중고주방 매입 중고테이블 의자... ",https://blog.naver.com/6146777?Redirect=Log&logNo=222522824265,"안산 등식당철거 중고주방 매입 저희 이야컴은식당및 업소에 관련된 일을 전문으로 하는 업체 입니다.식당및 업소 등 철거, 창업 인테리어 중고주방 매입, 중고테이블/의자 매입식당 테이블,의자 주문제작... ",테이블 식탁 의자 제작 업소 중고기기 집기 매입,https://blog.naver.com/6146777,2021-10-01
영천광명식당 ,https://blog.naver.com/yasuar?Redirect=Log&logNo=222349699091,"영천역 인근에 노포라면 노포라고 할수 있는광명식당 . 슴슴한 짜장 짬뽕 우동으로 알려져 있다. 중국집에서 먹는 자극적인 느낌이 없어 이게 뭔가 싶을수도 있지만, 이런느낌의 음식이 그렇듯 나중에 또... ",yasuar's PHOTO DIARY,https://blog.naver.com/yasuar,2021-05-13
