title,link,description,bloggername,bloggerlink,postdate
제기동역 용두동나정순할매쭈꾸미포장해서 드디어 먹어보다!,https://blog.naver.com/hsjk1004?Redirect=Log&logNo=222392603987,챔귀룸에 김만 딱 넣어서 눌려 먹었는데 역시나 꿀맛조만간 또 먹을거에요... # 나정순할매쭈꾸미#제기동역맛집 # 나정순할매쭈꾸미 포장 #용두동쭈꾸미 #용두동맛집 #용두동 나정순할매쭈꾸미 ,Jackie's paradise ♥,https://blog.naver.com/hsjk1004,2021-06-10
용두동 쭈꾸미나정순할매쭈꾸미 ,https://blog.naver.com/hyehwa_alice?Redirect=Log&logNo=221825318855,용두동 쭈꾸미나정순할매쭈꾸미안녕하세요~ 혜화동 엘린입니다. 오늘은 용두동 쭈꾸미 집 이야기를... 역시 먹거리 하면 호남이죠 ㅋㅋ 이름을 건 나정순할매께서 호남분이신가봐요! 원래 네이버에... ,혜화동 앨자매ll혜화동 엘린,https://blog.naver.com/hyehwa_alice,2020-02-26
210629_용두동나정순 할매 쭈꾸미 _호남식당,https://blog.naver.com/bitna3434?Redirect=Log&logNo=222414590208, 나정순 할매 쭈꾸미 _호남식당 용두동 쭈꾸미 호남식당 외관 마지막으로 왔을 때는 겨울이였는데 벌써 여름이됐다. 저번주에 이쪽길 지나갈때 사람많았던건 많은 것도 아니였다. 반대편 길에 쫘악 사람들이... ,Bella anima,https://blog.naver.com/bitna3434,2021-06-29
용두동 줄서서 먹는나정순 할매쭈꾸미 ,https://blog.naver.com/jsjung1999?Redirect=Log&logNo=222342373902,인근 어머니 대성집에서 이른 술자리를 마친 후 2차로 찾은 용두동 쭈꾸미 거리나정순할매 쭈꾸미 에요. 8시 부근인데 아직도 대기 번호가 있고 실내에 손님이 가득하고 잠시 대기하다 별관으로 입장을... ,양배추님 잘먹고 잘살기,https://blog.naver.com/jsjung1999,2021-05-08
[서울 제기동역/쭈꾸미]나정순 할매 쭈꾸미 ,https://blog.naver.com/kbm8034?Redirect=Log&logNo=221977284001,편인데나정순할매 쭈꾸미 는 브레이크타임이 있더라구요 브레이크타임은 3:00 ~ 4:30분이니 방문하시는 분들 시간 주의! 저희가 갔을 땐 본관은 거의 다 자리가 차서 별관으로 ㄱㄱㄱ 메뉴는 쭈꾸미 하나밖에... ,Ikarus's Photo World,https://blog.naver.com/kbm8034,2020-05-25
[용두동 쭈꾸미]나정순 할매 쭈꾸미 (호남식당),https://blog.naver.com/banyaji82?Redirect=Log&logNo=222217754337,죄다나정순 할매 쭈꾸미 를 추천하시더라고요. 오호! 그렇게 유명한 곳이야? 여기까지 왔는데 그냥 가기도 섭해서 금식 때문에 빈속이지만 매운맛 섭취하러 나정순 할매 쭈구미를 다녀왔어요... ,이상한 나라의 반야지,https://blog.naver.com/banyaji82,2021-01-24
거의 유일하게 좋아하는 매운쭈꾸미볶음집 -나정순할매쭈꾸미 ,https://blog.naver.com/fixion84?Redirect=Log&logNo=221903222816,[용두동] 거의 유일하게 좋아하는 매운쭈꾸미볶음집 -나정순할매쭈꾸미매운쭈꾸미 볶음을 하는 곳들은 아주 흔하게 볼 수 있다. 거의 저렴하게 수입냉동쭈꾸미로 만드는 곳들인데 삼겹살과 같이 볶기도 하고... ,:: 먹기위해 산다 ::,https://blog.naver.com/fixion84,2020-04-13
"용두동 나정순할매쭈꾸미 , 매워야 맛있땅!(볶음밥까지)",https://blog.naver.com/hanjs_?Redirect=Log&logNo=222346757190,머리 박고 코 박고 먹었네용 용인에 맛있는 쭈꾸미 집 아시는 분 있으면 댓글로도 알려주세용 *_* 그럼 이만 뿅! #용두동쭈꾸미 #용두동 나정순할매쭈꾸미# 나정순할매쭈꾸미#용인쭈꾸미 #쭈꾸미 #철판쭈꾸미,일상기록 ¨̮♡︎,https://blog.naver.com/hanjs_,2021-05-11
용두동 쭈꾸미 1등 맛집나정순할매쭈꾸미 ,https://blog.naver.com/ysl6161015?Redirect=Log&logNo=222503626689,#용두동쭈꾸미맛집 #제기동역쭈꾸미 # 나정순할매쭈꾸미안녕하세요! 옐입니다 오늘은 저의 맛집메이트 볼희가 예전부터 저를 엄청 데려가고 싶어했던 매운 쭈꾸미 맛집 지난 금요일에 드디어! 함께 다녀온... ,ʕ •ᴥ• ʔฅ옐거수일투족,https://blog.naver.com/ysl6161015,2021-09-12
서울 용두동 나정순할매쭈꾸미난 제기동으로 :),https://blog.naver.com/jseonggyun?Redirect=Log&logNo=222314771590,상호는나정순할매쭈꾸미 입니다. 쭈꾸미 맛집으로 유명하대요.나정순할매쭈꾸미주차는 3분 거리에 민영주차장이 있다는 것 같아요. 저희는 포장이어서 제가 잠시 주위를 배회했지요. 왜때문에 검색하니... ,뽀동이의 유쾌한 정보공간~♬,https://blog.naver.com/jseonggyun,2021-04-18
용두동 맛집나정순할매쭈꾸미드디어 먹으러 왔네,https://blog.naver.com/tnwjd_07?Redirect=Log&logNo=222449653565,맥주도 한잔씩 마셔주면 기분이 좋습니다ㅎㅎ 용두동 제기동역 가면나정순할매쭈꾸미 는 한번 먹어줘야해 ㅠㅠㅠ... 근처에도 다른 쭈꾸미 가게들이 많아서 시간 많으면 이곳 저곳 다 먹어보고 싶더라고요... ,꽃수정의 여행일기 블로그,https://blog.naver.com/tnwjd_07,2021-07-29
"mie, 나정순 할매 쭈꾸미 ,풍년 뼈다귀 해장국,농부의 꿈... ",https://blog.naver.com/7061227?Redirect=Log&logNo=222532615398,# 나정순할매쭈꾸미그리고 이날은 촬영하러 갔어요. 맛있는 녀석들 김준현 씨 빠진 자리 감주가 대타로 하러 (뻥~) 엄청 먹었던 날이라 이거예요.나정순 할매 쭈꾸미먹으러 갔는데 밖에서 느껴지는 맛집 포스... ,감먹는 민주,https://blog.naver.com/7061227,2021-10-18
용두동나정순할매쭈꾸미매운 쭈꾸미 맛집으로 추천,https://blog.naver.com/jlvip13?Redirect=Log&logNo=222263134257,"이런 재료, 저런 재료 다 넣지 않고 오직 쭈꾸미와 버섯만 넣은 게 이곳,나정순할매쭈꾸미 집의 특별한 점! 들어간 재료가 적은데도 이렇게 맛있다니! 철판에서 맛있게 볶아지고 있는 쭈꾸미. 어느 정도 익었다... ",♥굼굼이의 리뷰월드♥,https://blog.naver.com/jlvip13,2021-03-03
"걸어다니는 종합병원 ( 나정순할매쭈꾸미 ,고기리들기름막국수... ",https://blog.naver.com/sw310?Redirect=Log&logNo=222354139189,엄청 오랜만에 내 최애 쭈꾸미집 방문 # 나정순할매쭈꾸미#호남식당 자리에 앉기도 전에 인원수대로 셋팅 ㅋㅋㅋ 진짜 너무 맛있다구..ㅠㅠ 마늘이랑 깻잎은 취향껏 넣으면 된다 하 또 먹고싶넹.. 여긴 양념이... ,"여행, 기록, 일상",https://blog.naver.com/sw310,2021-05-17
용두동 쭈꾸미나정순할매 쭈꾸미줄 서지 말고 포장하세요:),https://blog.naver.com/un1243?Redirect=Log&logNo=222485735243,가던 #용두동 쭈꾸미집에 너무 가고 싶은 거예요 그래서 어떻게 할까 하다 신랑이 한번 포장을 해왔어요 그 뒤로 저희는 한 달에 2번은 꼭 ... 포장을 해서 먹는 것 같아요 용두동나정순할매영업시간은... ,후환마마의 일상로그,https://blog.naver.com/un1243,2021-08-27
제기동 맛집나정순할매쭈꾸미감동의 맛,https://blog.naver.com/daram2511?Redirect=Log&logNo=222519449566,맵찔이들도 계속 생각나는 마성의나정순할매쭈꾸미쭈꾸미 왕건이들 있어서 ㅋㅋㅋㅋㅋ 기념쌈 샷... 된장국 ㅋㅋㅋㅋ 하지만 맛있다^^ 나정순 이즈 뭔들..ㅎㅎㅎ 볶음밥 완성! 맛있게 먹어보자! 근데... ,"나의 즐거운 하루,정다람로그♩",https://blog.naver.com/daram2511,2021-09-28
용두동나정순할매쭈꾸미 ,https://blog.naver.com/sheunghan?Redirect=Log&logNo=222537876210,다들 길에 안버리고 길바닥 한쪽에 요구르트 쓰레기통 있는거 귀여워 ㅎㅎ #용두동쭈꾸미 # 나정순할매쭈꾸미#쭈꾸미맛집 #맛있는녀석들 #식신원정대 #천사채 #볶음밥 #일상 #소통 #친구들사랑해 #맛잘알 #서이추,회사에서 몰래하는 블로그;,https://blog.naver.com/sheunghan,2021-10-15
"[서울/용두동]나정순할매쭈꾸미재방문, 쭈꾸미맛집",https://blog.naver.com/chichi3456?Redirect=Log&logNo=222488352735,쭈꾸미 먹고 나서 배가 부른데도 저희는 꼭 2인분 볶아요. 너무 맛있어서요... 정말 쓰면서도 침이 고이네요. 항상 가면 배부르게 만족하며 나오는 곳. 용두동 나정순할매쭈꾸미 는 진짜 제 스타일... 주차장이... ,먹고 먹고 또먹고,https://blog.naver.com/chichi3456,2021-09-01
서울 동대문 용두동 맛집나정순 할매 쭈꾸미방문후기,https://blog.naver.com/kyj071128?Redirect=Log&logNo=222539423568,맛집나정순 할매 쭈꾸미근데 찾아가다 보니.. 오잉?ㅋㅋㅋㅋㅋㅋㅋㅋㅋㅋㅋㅋ 쭈꾸미 뒷통수 보임 너무 어이없고 웃기고 귀여워서 한캇트 ㅋㅋㅋㅋㅋㅋㅋㅋㅋㅋㅋㅋㅋㅋㅋ 여기가 쭈꾸미 거리래효 그래서... ,"near and dear,",https://blog.naver.com/kyj071128,2021-10-17
 나정순할매쭈꾸미 ,https://blog.naver.com/envyish?Redirect=Log&logNo=222146437063,매워요 죽어봐라하고 맵게 만든건 아니지만 맵린이는 도전 못할정도니 참고하세요 #용두동맛집 #쭈꾸미맛집나정순할매쭈꾸미쭈꾸미 원탑입니다 밥을 시키거나 볶으면 찌개를 줘요 맛집이니 얘 또한 당연히... ,미대오빠,https://blog.naver.com/envyish,2020-11-17
제기동역 맛집 용두동나정순할매쭈꾸미 ,https://blog.naver.com/envy830322?Redirect=Log&logNo=222398383702,제기동역 6번 출구로 나오면 보이는 용두동 쭈꾸미 특화거리 골목에 쭈꾸미볶음집이 쭈욱 있음 그중 가장 유명하다는 나정순 할매집으로 고고나정순 할매 쭈꾸미호남식당 매일 11:00-22:00 일요일 휴무... ,"꽃보다 쏠, 여행중♡",https://blog.naver.com/envy830322,2021-06-15
" 나정순할매쭈꾸미 , 용두동 갔으면 먹어봐야죠*.*",https://blog.naver.com/heekyeung902?Redirect=Log&logNo=221671158375, 나정순할매쭈꾸미말고도 여러 쭈꾸미집이 있긴한데 여기가 워낙 유명해 한번쯤 가보고 싶은 마음이 들 것 같아요 *.* 맛집이긴 하지만.. 시장통 같은 분위기 때문에 대화가 힘들어서 ㅋㅋㅋ 자주는 못갈 것... ,"남다른 마케터, 릴리제이",https://blog.naver.com/heekyeung902,2019-10-09
"연산동,나정순 할매 쭈꾸미 ㅣ전국 체인으로 매콤한 쭈꾸미가... ",https://blog.naver.com/rollydolly?Redirect=Log&logNo=222515584121,다녀온나정순 할매 쭈꾸미명절에 튀김도 안 하는데 괜스레 속이 니글거리는 건 내 기분 탓이겠지? 뭔가 매콤한 게 계속 먹고 싶어서 가족과 영화 관람 후 방문했던 쭈꾸미다. 주차는 가게를 끼고 우회전하면... ,-,https://blog.naver.com/rollydolly,2021-09-24
용두동 쭈꾸미 원조 : 맛있는녀석들 맛집나정순할매쭈꾸미 ... ,https://blog.naver.com/showrobi87?Redirect=Log&logNo=222129579646,"그래서 언니와 함께 언니가 자주 간다는 원조쭈꾸미 먹기로..ㅋ나정순할매쭈꾸미호남식당 매일 11:00~22:00, 브레이크타임 15:00~16:30 주차안됨, 포장가능 들어가자마자 사람들로 북적북적하다 진짜 신기한건..... ","촉촉한 네가족 :"")",https://blog.naver.com/showrobi87,2020-10-28
"슬기로운 집콕생활 (아웃백 테이크아웃,나정순할매쭈꾸미포장)",https://blog.naver.com/cabotin_8494?Redirect=Log&logNo=222174204616,이 날 사실 하루종일 외근에 너무 힘든 날 이었는데~ 매콤한 용두동쭈꾸미 제가 좋아하는나정순할매쭈꾸미먹으니 스트레스가 쫘~악 풀리더라구요! 포장하면 천사채는 안주는 대신 양이 엄청 많아서 너무... ,새 로 운 시 작 !,https://blog.naver.com/cabotin_8494,2020-12-15
"용두동나정순할매쭈꾸미 , 매운 쭈꾸미와 천사채의 조합은... ",https://blog.naver.com/iamlanie?Redirect=Log&logNo=222406591241,세팅해주신다 나정순 쭈꾸미 먹다가 다른 거 먹으면 뭔가 부족해~~나정순할매쭈꾸미 는 적당한 맵기와 가성비 훌륭한 양과 천사채를 자랑한다 ㅋㅋㅋㅋㅋㅋㅋㅋㅋㅋㅋㅋㅋ 이 천사채가 별거 아닌거 같아도... ,찐찐이네 'ㅡ',https://blog.naver.com/iamlanie,2021-06-22
[서울/용두동]나정순할매쭈꾸미- 볶음밥 세계 1등.,https://blog.naver.com/iwhlee?Redirect=Log&logNo=222527999651,"다들 꼭 방문해서 이 맛을 느끼길 바란다. - 가격: 쭈꾸미 1인분 ₩12,000 / 볶음밥1공기 ₩3,000 - 재방문의사: 100% - 방문일: 2021년 10월 06일 # 나정순할매쭈꾸미#용두동쭈꾸미 #쭈꾸미볶음 #볶음밥 #맛집 #고려대맛집",“Sunny after rain”,https://blog.naver.com/iwhlee,2021-10-06
"[용두동] 매콤한 쭈꾸미 원조맛집,나정순할매 쭈꾸미호남식당",https://blog.naver.com/lucky_kbs2?Redirect=Log&logNo=222542007404,"용두동 쭈꾸미골목에 위치한나정순할매 쭈꾸미 는, 별관과 본관이 붙어있어 좌석은 많은 편. 하지만... 함께 갔을 때는 상당히 매워했다. 나에게 그정도는 아닌데(?) 매콤러버분들 나정순할매네로 모이세용!!!!!!",내맘대로 후기 블로그,https://blog.naver.com/lucky_kbs2,2021-10-19
동대문 용두동 호남 식당나정순할매쭈꾸미- 아무것도 필요... ,https://blog.naver.com/sk5816?Redirect=Log&logNo=222233843955,"천호에도 쭈꾸미 골목이 있어 유명하지만, 진짜 찐 맛집은 바로 이곳 용두동에 위치한 호남 식당나정순할매쭈꾸미 다. 도착한 시간은 2시 정도였는데 2시 30분부터 브레이크 타임이 시작되는지 모르고... ",기억을 위한 기록,https://blog.naver.com/sk5816,2021-02-06
용두동 쭈꾸미골목 맛집나정순할매쭈꾸미 ,https://blog.naver.com/tomoyo1017?Redirect=Log&logNo=222501306008," 나정순할매쭈꾸미드디어!!! 유투버 우니의끼니에 우니님을 통해알게됐고, 유투버 예소리님도 엄청... 살짝매콤 쭈꾸미는 부드럽고 마늘이 잘 어울린다. 천사채랑 먹으면 더 맛나다던데, 담번엔 준비해야지.... ",허니몽,https://blog.naver.com/tomoyo1017,2021-09-10
[용두동맛집/용두동쭈꾸미]나정순할매쭈꾸미후기,https://blog.naver.com/abc___kj?Redirect=Log&logNo=222530014643,"다들 쭈꾸미 맛집 찾으신다면나정순할매쭈꾸미완전 추천드려요! 방문했을 때 사람들이 많더라고요 아참 ,,, 본점이랑 별관이 따로 존재해요. 사람이 많아서 확장한 것 같아요. 사람들이 많이 찾는다는 건... ",대나무숲,https://blog.naver.com/abc___kj,2021-10-07
 나정순할매쭈꾸미 ,https://blog.naver.com/portugal4?Redirect=Log&logNo=222031973351,아침 일찍 서둘러 서울에 와서 일을 마치고 아이들과 용두동 쭈꾸미골목의 원조라는나정순할매쭈꾸미 에서 저녁을 먹었다. 이곳 용두동으로 이사온 후 처음 몇 달 동안 이 골목에서 외식 많이 했고 지인들도... ,박헌정의 하루한편,https://blog.naver.com/portugal4,2020-07-15
용두동 쭈꾸미나정순할매쭈꾸미 ,https://blog.naver.com/dudwp42?Redirect=Log&logNo=221773133653,친구가 용두동 쭈꾸미 나정순할매쭈꾸리를 가자고 해서 가기로 하였어요. 신기하게도 쭈꾸미골목... 친구 동네가 바로 용두동 쭈꾸미나정순할매쭈꾸미근처여서 금세 갈 수 있어요. 걸어서 한 5분만에 도착을... ,169.항상 웃는 남자,https://blog.naver.com/dudwp42,2020-01-15
맛집]나정순할매쭈꾸미호남식당 :: 서울쭈꾸미맛집 #나정순쭈... ,https://blog.naver.com/jjawnet?Redirect=Log&logNo=222276796400,T. 14:30~16:30 L.O. 14:30 *브레이크타임에 포장 가능 *일요일 휴무 영업문의 02-928-0231 # 나정순할매쭈꾸미#용두동 나정순할매쭈꾸미#나정순쭈꾸미 #용두동 나정순할매쭈꾸미 포장 # 나정순할매쭈꾸미 주차,마음만은 새내기,https://blog.naver.com/jjawnet,2021-03-16
용두동 나들이❣️(Feat. 나정순할매쭈꾸미 ),https://blog.naver.com/2885295?Redirect=Log&logNo=222296937261,ㅎㅎ # 나정순할매쭈꾸미#쭈꾸미맛집 #호남식당 #서울맛집 #쭈꾸미 #쭈꾸미찐맛집 #쭈꾸미미친놈 #용두동맛집 #동대문맛집 #나정순쭈꾸미 #나정순할매 #용두동 나정순할매쭈꾸미#쭈꾸미포장,냠슐랭,https://blog.naver.com/2885295,2021-04-03
제기동맛집나정순할매쭈꾸미 (f.호남식당) 재방문한 후기,https://blog.naver.com/rain930814?Redirect=Log&logNo=222089570471,"나정순쭈꾸미는 두 번 다녀왔습니다. 1월에 한번, 6월에 한번 내돈내먹 후기입니다. 용두동 사거리에 있는데요. 호남 식당이라는 간판 아래나정순할매쭈꾸미 가 있더라고요! 얼마나 유명한 집인지 식당이 바로... ",은지새나 : 쉼표 :,https://blog.naver.com/rain930814,2020-09-20
"용두동나정순할매쭈꾸미 , 매운 쭈꾸미 맛집",https://blog.naver.com/5yjs2?Redirect=Log&logNo=222380996935," 나정순할매쭈꾸미메뉴판 메뉴가 단촐하죠 ? 쭈꾸미 하나에요 ! 들어가서 ‘두명이요’ 하면 쭈꾸미 바로 들고오십이당 키키 나정순할빼쭈꾸미 기본찬 깻잎, 천사채 그리고 테이블에 마늘, 마늘쫑, 당근이... ","오모찌 일상담기,",https://blog.naver.com/5yjs2,2021-06-02
용두동 쭈꾸미 맛집나정순할매쭈꾸미포장 맛있게 먹기,https://blog.naver.com/cc0437?Redirect=Log&logNo=222185524791,용두동 쭈꾸미나정순할매쭈꾸미 를 포장해서 집에서 해먹기로 했습니다. 코로나가 꺽일 줄 모르고 더 기승을 부려서 참 여러모로 사람들을 힘들게 하네요.이럴때일수록 가능하면 집에서 먹어 주는 것이 서로를... ,올드스톤의 일상,https://blog.naver.com/cc0437,2020-12-25
[용두동 쭈꾸미]나정순할매쭈꾸미 ,https://blog.naver.com/forever_reign?Redirect=Log&logNo=222532451354,애정하는 곳이라 분기별로 가게 되는거 같아요.. 사장님 더욱 더 번창하세요#트윙클빈이 #돈쭐 #내돈내산 #용두동쭈꾸미 #나정순할매 # 나정순할매쭈꾸미#제기동맛집 #쭈꾸미맛집 #건강하고맛있는 #맛집,트윙클빈이의 처음 살아가는 오늘들 ✨,https://blog.naver.com/forever_reign,2021-10-10
[용두동맛집]# 나정순할매쭈꾸미 #쭈꾸미맛집#청량리시장,https://blog.naver.com/syssim77?Redirect=Log&logNo=222499636128,맛집스멜~~ 쭈꾸미 수입산이겠지만 엄청 통통하네. 익어가는 용두동나정순할매쭈꾸미 . 못 기다리고 국물을 한번 떠 먹어본다. 와~ 매운데 맛있어. 여긴 반찬도 거의 없다. 사실 반찬이 뭐시 필요할까~ 깻잎에... ,나는야 토토리엄마,https://blog.naver.com/syssim77,2021-09-08
드디어 먹어본나정순할매쭈꾸미!,https://blog.naver.com/ggw44?Redirect=Log&logNo=222537628617,"유튜버들이 먹방하는거 보면서 유일하게 먹어보고 싶었던 # 나정순할매쭈꾸미아주아주 오랜만에 취향저격 당한 맛집,,,ෆ 이날 인왕산으로 등산을 다녀온 우리는 서울 간김에 제기동에 들려서 쭈꾸미를 포장... ",따듯한 것.,https://blog.naver.com/ggw44,2021-10-15
"매콤하고 쫄깃한 쭈꾸미볶음 맛집, 용두동나정순할매쭈꾸미 ",https://blog.naver.com/tndud2620?Redirect=Log&logNo=221974405996," 나정순할매쭈꾸미 의 쭈꾸미볶음에는 오직 쭈꾸미와 조금의 표고버섯만 들어있다. 쭈꾸미를 좋아하는 나로써는 쭈꾸미만 350g 먹을 수 있어 행복할 따름! 쭈꾸미 볶음 2인분 (700g) 24,000원 이렇게 간단하지만... ",돌아온 스위밍,https://blog.naver.com/tndud2620,2020-05-22
용두동 맛집 호남식당나정순할매쭈꾸미 ,https://blog.naver.com/aprilyj?Redirect=Log&logNo=221754064820,ㅋㅋ 그래서 소개해드리려구요^^ 바로 용두동에 위치한 쭈꾸미맛집! “호남식당나정순할매쭈꾸미 ” 인데요! 역시나 유명맛집~ 사람들이 매장 가득가득! 맛있는 녀석들에도 나왔었다고 하더라구요... ,COJUCOI,https://blog.naver.com/aprilyj,2019-12-30
용두동나정순할매쭈꾸미(호남식당)한결같이 맛있는 곳!,https://blog.naver.com/qortjddms12?Redirect=Log&logNo=222413398108,안가본 분들은 있어도 한번만 가 본 분들은 없는거 예상해봅니다 그만큼 존맛이니깐 다들 꼭 드셔보세요ㅎㅎ #용두동 #제기동역 # 나정순할매쭈꾸미#호남식당 #쭈꾸미 #나정순 #매운음식 #볶음밥 #맛집 #용두동맛집,위드 바이올렛,https://blog.naver.com/qortjddms12,2021-06-28
[제기동역/용두동맛집]나정순할매쭈꾸미 (대 존 맛 탱),https://blog.naver.com/minsung30?Redirect=Log&logNo=222530107218," 나정순할매쭈꾸미진짜 오랜만이다. 작년에 오고 올해는 첨인디,, 여기는 그냥 찐맛집이쥬. 근데 친구가... 이야~~~ 쭈꾸미 왜케 커??? 탱글탱글!!!!!!! 와,,,,진짜 양 많다ㅠㅠㅠㅠㅠㅠㅠㅠ 너무조아 표고버섯 같이... ",진취적인 그녀♩,https://blog.naver.com/minsung30,2021-10-07
인생쭈꾸미 용두동나정순할매쭈꾸미포장후기,https://blog.naver.com/myunghee24?Redirect=Log&logNo=222511504646,"이정도가나정순할매쭈꾸미1인분양인데요 진짜 많아요 ㅎㅎ 여기에 우동사리, 통마늘도 필수로 준비했어요 나정순쭈꾸미에는 쭈꾸미만 들어가고 야채는 없으니 좋아하는 야채를 더 넣어서 먹기도하는데... ",묭히블로그,https://blog.naver.com/myunghee24,2021-09-20
용두동 맛집나정순할매쭈꾸미호남식당,https://blog.naver.com/so6198?Redirect=Log&logNo=222414012508,"내가 좋아하는 #용두동쭈꾸미 라고 쓰려는데 급 침샘폭발ㅋㅋ 쭈꾸미가 실하고(크고 신선함), 매콤한 양념이 환상인 #용두동맛집 #쭈꾸미맛집 # 나정순할매쭈꾸미#호남식당 최애맛집인데~ 진짜 오랫만에 방문... ",연두의 블로그,https://blog.naver.com/so6198,2021-06-29
"구성맛집_ 서울에서 유명한 쭈꾸미집, 용두동나정순할매쭈꾸미 집",https://blog.naver.com/gaemisaekki?Redirect=Log&logNo=222451290283,ㅋㅋㅋㅋㅋ 볶음밥까지 싹쓰리 ㅋㅋㅋㅋㅋ 용두동나정순할매쭈꾸미 집은 쭈꾸미 순한맛과 매운맛이 있어서 맵기 선택이 가능했지만 맵찔이치고는 매운 음식을 잘 먹는편이라서 맵게 먹었는데 엄청 매웠다... ,개미새끼의 추억저장소,https://blog.naver.com/gaemisaekki,2021-08-04
경기도 파주 맛집나정순할매쭈꾸미 ,https://blog.naver.com/neighbor00?Redirect=Log&logNo=221730007356,쭈꾸미가 있는 볶음밥과 쭈꾸미가 없는 볶음밥은 맛차이뿐만 아니라 식감까지도 차이가 나기때문에 절대 주의하셔서 쭈꾸미를 남겨두시기바래요. 오랫만에 먹어도 역시나 맛있는나정순할매쭈꾸미그 이후로... ,Shine,https://blog.naver.com/neighbor00,2019-12-07
[서울] 용두동 -나정순할매쭈꾸미(호남식당),https://blog.naver.com/mllesuzi_?Redirect=Log&logNo=222025724761,먹을 때도 맛나고 먹고 나서도 생각나고 글쓰면서도 침이 고이는 용두동 쭈꾸미집 내 기준 매운 편이긴하지만 맛있게 매운 곳 호남식당 ( 나정순할매쭈꾸미 ) 02-928-0231 서울 동대문구 무학로 144 매일 11:00 - 22:00... ,빛이 있기에 행복하다,https://blog.naver.com/mllesuzi_,2020-07-12
[용두동]나정순할매쭈꾸미 ,https://blog.naver.com/mys9312?Redirect=Log&logNo=222539170201,바로 옆옆에 별관도 있어서 꽤 크다 다만 저녁에는 알콜과 함께하시는 분들이 많아서 시끄럽다는 점 맵기조절은 안되지만 천사채로 알아서 조절하는 걸로 ㅋㅋㅋㅋㅋㅋㅋㅋ #용두동쭈꾸미 # 나정순할매쭈꾸미 ,소소한 일상,https://blog.naver.com/mys9312,2021-10-17
"[제기동]나정순 할매 쭈꾸미 , 또왔지",https://blog.naver.com/loesos?Redirect=Log&logNo=222501869922,오늘은 지난 번에 한번 온적 있는나정순 할매 쭈꾸미 에 왔다. 저 멀리서도 시선을 사로잡는 정열의 레드 건물. 쭈꾸미로 건물 올리셨다고 들었음 셋이서 와서 자동으로 세명 주문이 들어갔다. 양 진짜 진짜 많음... ,아비엥또,https://blog.naver.com/loesos,2021-09-10
[용두동나정순할매쭈꾸미 ]... 동대문 제일가는 쭈꾸미 맛집,https://blog.naver.com/agong91?Redirect=Log&logNo=222536162967,"지난 방문 포스팅 : https://m.blog.naver.com/agong91/222305093856 간만에 제기동 주민 kk와 방문한나정순할매쭈꾸미 . 용두동 쭈꾸미골목에서 가장 인기있는 집이기도 하며, 피크시간에 가면 웨이팅을 감내해야하는... ",아공블로그,https://blog.naver.com/agong91,2021-10-13
용두동쭈꾸미나정순할매쭈꾸미 ,https://blog.naver.com/haha3587?Redirect=Log&logNo=222015810223,보글보글 용두동쭈꾸미나정순할매쭈꾸미 집은 처음 가보는데 꽤 매운데 으 맵긴 맵다 하면서 근데 맛있다 으 매운데 근데 맛있다 ㅋㅋㅋㅋㅋ 이말 무한반복... 다 익었으면 불을 조금 줄이고 먹어야 덜매워요... ,달콤 비,https://blog.naver.com/haha3587,2020-06-29
