title,link,description,bloggername,bloggerlink,postdate
용두동쭈꾸미골목- 나정순할매쭈꾸미방문후기,https://blog.naver.com/bro206?Redirect=Log&logNo=222118668910,쭈꾸미골목에서 가장 유명한나정순할매쭈꾸미 집에 방문했습니다. 살면서 용두동에 올 일이 없었는데 쭈꾸미에 대한 저의 열정이 여기까지 오게 했네요ㅋㅋㅋ 쭈꾸미 2인분 주문! 백종원슨생님이 말했듯이... ,OFFTHEWALL:D,https://blog.naver.com/bro206,2020-10-18
엱특먹) 웨스틴 조선 -수박빙수 먹구 용두동- 나정순할매쭈꾸미 ... ,https://blog.naver.com/loveyj9787?Redirect=Log&logNo=222505527942,히창이랑 용두동나정순할매쭈꾸미 를 먹으러 왔어요! 히창이랑 첫 쭈꾸미!! 첫쭈꾸미가 나정순! 나정순 존맛인데ㅡㅠㅜㅠㅜㅠㅜㅠ 제가 1년전에 왔을떄는 본점이 끝이였는데 옆에 별관도 생기구! 별관까지... ,엱LOG,https://blog.naver.com/loveyj9787,2021-09-14
용두동쭈꾸미골목 하면 생각나는나정순할매쭈꾸미잊을 수... ,https://blog.naver.com/yougate?Redirect=Log&logNo=222406812672,같아요 ^^ # 나정순할매쭈꾸미 _15 쭈꾸미의 자존심을 걸고 있는 용두동쭈꾸미골목 그중에서도 오로지 맛으로만 승부를 걸고 있는나정순할매쭈꾸미취침전에 릴렉스할 수 있게 짧은 55초짜리 동영상도 한번... ,핑크버진,https://blog.naver.com/yougate,2021-06-22
용두동나정순 할매 쭈꾸미호남식당 방문후기,https://blog.naver.com/endallfit?Redirect=Log&logNo=221722289929,바로 쭈꾸미 안착!나정순 할매 쭈꾸미2인분 다른채소 없구요 쭈꾸미랑 표고버섯 아주조금 그래도 쭈꾸미 양이 많은거같더라구요나정순 할매 쭈꾸미포인트가 이 마늘! 마늘 듬뿍 넣고 끓여주고 익은... ,지금부터시작이다!,https://blog.naver.com/endallfit,2019-11-29
"연산, 쭈꾸미의 정석이랄까 [ 나정순할매쭈꾸미 ]",https://blog.naver.com/jjee0807?Redirect=Log&logNo=222538776920,최애 유투버님들이 서울에서 나정순 쭈꾸미를 참 많이 먹더라구요 당연히 서울에만 있는 줄 알았는데... 쭈꾸미 좋아하는 해주와 호다닥 다녀왔음니당 ㅋㄷ나정순할매쭈꾸미부산 연제구 월드컵대로 145... ,짹짹의 하루,https://blog.naver.com/jjee0807,2021-10-16
[용두동 호남식당] 나정순 할매 쭈꾸미 ,https://blog.naver.com/bobbybarbie?Redirect=Log&logNo=222160922125," 나정순할매쭈꾸미 의 쭈꾸미는 원산지가 베트남이다. 쭈꾸미 맛집나정순 할매 쭈꾸미 는 메뉴가 딱 한가지 이다 쭈꾸미1인분(350g)에 12,000원 인원수에 맞게 주문해야 한다. 쭈꾸미의 효능은 먹어본 사람들... ",[ With A I N - ♡ ],https://blog.naver.com/bobbybarbie,2020-12-02
"0806 :나정순할매쭈꾸미 , 와플스 누텔라 치즈케이크크림치즈... ",https://blog.naver.com/sacumia111?Redirect=Log&logNo=222462904227,"오후 12:00 (전날 새벽 3시까지 롤 하다 잠) 기상 ★ 아침 #메가커피 아이스 아메 한 잔 하루의 시작은 모닝롤 ★ 점심 # 나정순할매쭈꾸미(표고버섯, 통마늘 추가) #깻잎 #오뚜기현미밥 (라세느 이후 25시간 공복... ",메리 매일 테이블,https://blog.naver.com/sacumia111,2021-08-09
 나정순할매쭈꾸미 ,https://blog.naver.com/sammee118?Redirect=Log&logNo=222534757809,제기동역 근처 용두동 쭈꾸미 거리에 있는나정순할매쭈꾸미간판에는 호남식당이라고 크게 써있다 우리는 본관에 사람이 많아서 별관으로 갔다 사람이 많지 않아서 좋았다! 제일 좋은 거는 얼마나 빠른지... ,sammee118님의블로그,https://blog.naver.com/sammee118,2021-10-12
[금촌/포장]나정순할매쭈꾸미본점 / 쭈꾸미,https://blog.naver.com/my0608?Redirect=Log&logNo=222107723425,"[금촌/포장]나정순할매쭈꾸미본점 / 쭈꾸미 코로나19로 배달, 포장이 많아졌지만나정순할매 쭈꾸미 는 예전부터 매운 음식이 당길 때 꾸준히 포장해서 먹어온 집 :) 운정에 있는 곳도 가봤는데 역시 본점이... ",씹고뜯고맛보고즐기고,https://blog.naver.com/my0608,2020-10-05
용두동나정순 할매 쭈꾸미 ,https://blog.naver.com/rladuddhrrr?Redirect=Log&logNo=222524475005,나정순은 나정순이구나 느끼게 되는 요 쭈꾸미집 집에 포장해 가면 야채추가에 대패 삼겹살까지 넣어도... 내 작품 지인짜 오랜만에 방문해서 먹은나정순 할매 쭈꾸미 는 여전히 최고 조만간 포장도 해와야지,파란만장 미쓰김*^^*,https://blog.naver.com/rladuddhrrr,2021-10-02
"0807 : 토달볶, 탕수육,나정순할매쭈꾸미 , 목살 구이",https://blog.naver.com/sacumia111?Redirect=Log&logNo=222462904526,"★ 저녁 # 나정순할매쭈꾸미(표고버섯, 양파, 통마늘 추가) #깻잎 #너구리라면사리 #목살구이 2인분 사 와서 어제오늘 나눠먹기 중 그리고 오늘은 양파까지 추가해서 한껏 양을 늘렸다. 역시나 너무 매워서 위가... ",메리 매일 테이블,https://blog.naver.com/sacumia111,2021-08-09
"부산 연산동 맛집,나정순할매쭈꾸미: 통통하고 실하네요.",https://blog.naver.com/gns5689?Redirect=Log&logNo=222539548638,"지도에 쭈꾸미치니까 여러 맛집들이 나왔는데 리뷰와 메뉴구성으로 봤을 때나정순할매쭈꾸미 가 괜찮을 거 같았습니다. 철판에 쭈꾸미를 볶아 먹을 예정! 쭈꾸미 2분 20,000원 쭈삼을 먹을까 했지만 빈대떡도... ",우리 모두 만족하는 우리집탄성코트,https://blog.naver.com/gns5689,2021-10-17
쭈꾸미의 원조 맛집 용두동나정순할매쭈꾸미포장 ♡,https://blog.naver.com/wkduswldms?Redirect=Log&logNo=221960389158,외출 자제중이신분들은 포장해서 집에서드셔요♡♡ # 나정순할매쭈꾸미#쭈꾸미포장 # 나정순할매쭈꾸미 포장 #용두쭈꾸미포장 #용두동쭈꾸미 #미니홈멀티쿡 #신혼부부꿀템 #요리도구 #멀티쿡추천 #멀티쿡 #멀티쿠커,안찡이 행복한일상 ★,https://blog.naver.com/wkduswldms,2020-05-13
용두동나정순할매쭈꾸미호남식당,https://blog.naver.com/pink1915?Redirect=Log&logNo=222526649786,완존 1000% #용두동맛집 #서울맛집 #용두동쭈꾸미맛집 # 나정순할매쭈꾸미#호남식당 #서울쭈꾸미맛집 #쭈꾸미맛집추천 #쭈꾸미맛집 #서울가볼만한곳 #볶음밥맛집 #쭈꾸미볶음밥 #서울쭈꾸미 #서울맛집추천,LIFE FINDER,https://blog.naver.com/pink1915,2021-10-04
용두동 쭈꾸미 맛집나정순할매쭈꾸미 를 다녀와서,https://blog.naver.com/jyj9997?Redirect=Log&logNo=222122861571,골목나정순할매쭈꾸미 에 가서 맛나는 쭈꾸미 먹고 왔네요 저녁 8시경에 도착하니 본관은 벌써 만석이구 별관도 만석이라 잠시 대기후에 자리 잡고 앉아서 2인분 주문 하구... 용두동 나경순할매 쭈꾸미는 딱... ,램코투자자문,https://blog.naver.com/jyj9997,2020-10-22
용두동 호남식당[ 나정순할매쭈꾸미 ],https://blog.naver.com/like81?Redirect=Log&logNo=221839312290,암요~ # 나정순할매쭈꾸미#나정순할매 #용두동쭈꾸미 #쭈꾸미 #맛있는녀석들 코로나효과인가 눈치게임 성공~ 홀에는 자리가 있었는데 포장손님이 어마어마하네 네명이요~ 했더니 우리가 앉기도 전에 쭈꾸미부터... ,떡볶이참고서/떡볶이덕후/,https://blog.naver.com/like81,2020-03-05
마늘노포 93 - 쭈꾸미맛집 용두동맛집 -나정순할매쭈꾸미 ,https://blog.daum.net/djmanul/5857795,서울사람들이 쭈꾸미를 제대로 먹기 시작하기 전부터 쭈꾸미를 팔고 있던 나정순 할머니의 신념은 쭈꾸미는 매워야 제맛이라는 것.나정순 할매 쭈꾸미 의 소스는 맵기도 맵지만 달콤한 맛도 있어 중독성이... ,MERRY CHRISTMAS!,https://blog.daum.net/djmanul,2020-08-28
용두동나정순할매 쭈꾸미맛집,https://blog.naver.com/gil71316?Redirect=Log&logNo=221980281941,그 유명한 용두동 쭈꾸미 골목 그중에 나정순 할매네가 젤로 핫하다는??? 하아.... 멀더라구요 며칠전... 그래서 얼떨결에 용두동으로 출동 핵인싸 이실거 같은나정순 할매 쭈꾸미 집 저기가 거기야.... 이... ,오금동 이화부동산,https://blog.naver.com/gil71316,2020-05-27
 나정순 할매 쭈꾸미포장(삼겹살이 지배하다),https://blog.naver.com/sken02?Redirect=Log&logNo=221861470019,"용두동 쭈꾸미 골목의 터줏대감나정순 할매 쭈꾸미 에서 2인분을 포장해왔다. 포장은 2개 정도의 양을 넣어주는 대신 반찬이 따로 없다. (1인분 12,000원) 콩나물과 삼겹살을 무지하게 넣었다. 매운맛이 강하기... ",포도알이나먹으려고만든블로그,https://blog.naver.com/sken02,2020-03-19
[2021.09.24]나정순할매쭈꾸미 ,https://blog.naver.com/kenarashi?Redirect=Log&logNo=222518632031,야채가 없고쭈꾸미 랑 버섯만 들어있다. 반찬 먹을것만 나온다. 검색하다 봤는데 통마늘 넣는 것이...쭈꾸미좋아하면 가보세요. 테이크아웃 엄청 해감. 먹고가는 것이랑 테이크아웃이랑 양차이가 난다고 함.... ,Digdig's 黒執事,https://blog.naver.com/kenarashi,2021-09-27
"연산역맛집,나정순할매쭈꾸미 ",https://blog.naver.com/petrascience?Redirect=Log&logNo=222348209345,"맛잇게 익엇당^^ 연산역맛집,나정순할매쭈꾸미쭈꾸미쭈꾸미~~~ 콩나물이랑 같이 먹어야쥬~~ 쌈좋아하는 쌈녀, 크리스탈~~ 원래 가던 해운대쭈꾸미랑은 또 다른 매력이 잇는 쭈꾸미였어요. 맛나당~~연산역맛집... ",Flor del dia,https://blog.naver.com/petrascience,2021-05-12
[서울 식당] 맛있는 쭈꾸미 볶음 -나정순할매쭈꾸미 ,https://blog.naver.com/youks82?Redirect=Log&logNo=222419705867,택배도 안되고 가서 먹거나 포장해야 하는 쭈꾸미 집이 있습니다 용두동 쭈꾸미 특화거리에 있는나정순 할매쭈꾸미포장해서 집에서 먹기 집에와서 마늘을 사서 넣고 보글 보글 끓여서 따로 준비한 야채랑... ,하나씩 하나씩,https://blog.naver.com/youks82,2021-07-04
[쭈꾸미볶음맛집]서울약령시나정순할매쭈꾸미유명한 쭈꾸미... ,https://blog.naver.com/oksu3143?Redirect=Log&logNo=221942277129,유명하신 나정순할매 . 많다고 남은면 싸가야 겠다 했는데 이렇게 싹싹 비웠네요. 저희들어 올때 손님이 별로 안계셨는데 먹는사이 손님들이 많이 오셨네요. 이상 유명한 쭈꾸미 맛집나정순할매쭈꾸미먹방... ,꿈꾸는 돌멩이,https://blog.naver.com/oksu3143,2020-05-03
용두동맛집 - 나정순할매쭈꾸미 ,https://blog.naver.com/51jm?Redirect=Log&logNo=222412520150,#용두동맛집 # 나정순할매쭈꾸미가서 #쭈꾸미볶음 포장했어요 1인분 12000원 ♡ 탱글탱글 맛있는 쭈꾸미♡ 볶아서 상추 깻잎 쌈장 마요네즈랑 맛나게 냠냠♡ #맛있게매운맛 ♡ 엔딩은... ,항상 건강하고 행복하길~♡,https://blog.naver.com/51jm,2021-06-28
용두동 쭈꾸미 골목나정순 할매 쭈꾸미 (호남식당),https://blog.naver.com/kronos01?Redirect=Log&logNo=222411261519,근처 쭈꾸미 유명한 집이라고 해서 촬영 뒷풀이 겸 저녁식사 했습니다. 겨우 6시가 조금 넘은 시간...나정순 할매 쭈꾸미앞에서 대기중.. 대기중인 사람들 자리에 앉자마자 주문도 안받고 바로 가져다 줍니다.... ,사진작가 이강신의 사진으로 보는 세상,https://blog.naver.com/kronos01,2021-06-26
[파주 맛집] 비 오는 날~용두동나정순 할매 쭈꾸미~맛집 인정,https://blog.naver.com/yesjjm?Redirect=Log&logNo=222382881754,오늘 들른 곳은 쭈꾸미 맛집인나정순 할매 쭈꾸미입니다~ 실한 쭈꾸미가 나왔습니다~~~ 3인분 입니다~~ㅎㅎ 쭈꾸미는 정말 익히면 안 돼요~~~ 90% 정도가 딱 좋은 것 같아요~~~ 야들 야들과 쫄깃함의 중간... ,[바르다코리아]인조대리석 주방상판연마 나노코팅,https://blog.naver.com/yesjjm,2021-06-03
연산동 맛집 쭈꾸미 내돈내먹 |나정순할매쭈꾸미 ,https://blog.naver.com/djaalswl5356?Redirect=Log&logNo=222528480915,있는나정순할매쭈꾸미 를 방문했어요 저희는 쭈삼 2인분에 빈대떡 하나 주문했어요! 저녁 늦게 가서 그런지 손님은 많이 없어서 좋았숩니당 콩나물 넣고 섞어섞어- 2인분치고 양은 조금 작은 느낌 ㅠ 쭈꾸미에... ,N'oublie pas de t'aimer,https://blog.naver.com/djaalswl5356,2021-10-06
쭈꾸미볶음의 절대강자 용두동 쭈꾸미 맛집 [ 나정순할매 쭈꾸미 ],https://nmhst.tistory.com/entry/%EC%95%84%EB%AC%B4%EB%8F%84-%EB%AA%BB-%EB%94%B0%EB%9D%BC%ED%95%98%EB%8A%94-%EC%AD%88%EA%BE%B8%EB%AF%B8%EB%B3%B6%EC%9D%8C%EC%9D%98-%EC%A0%88%EB%8C%80%EA%B0%95%EC%9E%90-%EC%9A%A9%EB%91%90%EB%8F%99-%EC%AD%88%EA%BE%B8%EB%AF%B8-%EB%A7%9B%EC%A7%91-%EB%82%98%EC%A0%95%EC%88%9C%ED%95%A0%EB%A7%A4-%EC%AD%88%EA%BE%B8%EB%AF%B8,사라졌어요나정순할매집도 원래 본관만 있었는데 옆에 건물까지 확장을 해서 별관도 생겼더라고요 항상 저녁에 타이밍을 못 맞추면 웨이팅은 기본이었는데... 메뉴는 단일 메뉴입니다!!쭈꾸미 !! ㅎㅎㅎ... ,걸어서 나모 속으로,https://nmhst.tistory.com/,2021-03-01
맛있는 녀석들 용두동 쭈꾸미나정순할매쭈꾸미(호남식당),https://blog.naver.com/78stella?Redirect=Log&logNo=221235701629,"맛있는 녀석들 용두동 쭈꾸미나정순할매쭈꾸미호남식당 안녕하세요, 꿈나예요 :) 언제나 그렇듯 어제도 길냥이들 밥셔틀 하러 심야시간에 나갔는데 그 늦은 시간에 온동네 배달 오토바이는 다... ",꿈꾸는나무와 땡구의 맛있는 하루,https://blog.naver.com/78stella,2018-03-23
용두동 쭈꾸미 / 호남식당나정순 할매 쭈꾸미 ,https://blog.naver.com/phjsunflower?Redirect=Log&logNo=221067038108,"용두동 쭈꾸미 호남식당나정순 할매쭈꾸미용두동하면 매운 쭈꾸미가 가장 먼저 떠오른다. 7년전이 마지막이니 워낙 오래전에 가봤으며, 뭔가 석연치 않아서 안가게 된것은 사실이다. 용두동 쭈꾸미하면... ",꽃씨의 맛집 이야기♬,https://blog.naver.com/phjsunflower,2017-10-14
파주 교하 맛집나정순할매쭈꾸미맛나다,https://blog.naver.com/jiin020?Redirect=Log&logNo=221172792597,파주 교하 맛집나정순할매쭈꾸미맛나다 먹을게 뻔한 파주 교하의 먹거리들중 손꼽을만한 쭈꾸미가 맛잇는나정순할매 쭈꾸미 를 먹방해주고 왓어요^^ 쭈꾸미보다는 고기를 더 조아하는지라 쭈꾸미와 삼겹살을... ,찌니의 블로그,https://blog.naver.com/jiin020,2017-12-28
제기동 쭈꾸미맛집나정순할매쭈꾸미 ,https://blog.naver.com/jjtonight12?Redirect=Log&logNo=222525224244,정말 ㅋㅋ 미쳤습니다 매콤한 쭈꾸미가 땡기신다면 제기동나정순할매쭈꾸미 로 고고~ 내돈내산은 아니고 얻어먹은 후기였습니다! * 나정순할매이신지는모르겠으나 사장님께서 코로나 때문에 생긴 인원제한과... ,헬로진쌤의 두피부터 몸속까지 토탈케어,https://blog.naver.com/jjtonight12,2021-10-03
용두동 쭈꾸미 먹으러나정순할매쭈꾸미 ,https://blog.naver.com/aileensalon?Redirect=Log&logNo=220262419403,방산시장 갔다가 ' 나정순할매쭈꾸미 '가 생각나서 용두동가서 쭈꾸미 먹고 왔어요. 저 그리고... 하고 쭈꾸미는 찔기기만 하다고 생각했는데 나의 생각을 바꿔준 나정순할매 ! 정말 탱글탱글하다라는 말은... ,살롱 드 에이린 salon de aileen,https://blog.naver.com/aileensalon,2015-02-04
제기동 맛집 -나정순할매쭈꾸미: 푸짐한 양과 맛에 반함,https://blog.naver.com/teemoticon?Redirect=Log&logNo=221346840468,흰쌀밥에 김가루와 쭈꾸미와 함께 쉐킷쉐킷 제기동 맛집나정순할매쭈꾸미볶음밥 맵고 달고 중독성 좋습니다. 탄수화물은 참 끊기 어렵네요... 적당히 먹고 2차 가고 싶었지만 참고 집으로.... 다음에는... ,티이모와의 연결 고리 ♂,https://blog.naver.com/teemoticon,2018-08-27
"맛있는 일상 / 도시락,나정순할매쭈꾸미 ",https://blog.naver.com/obettero?Redirect=Log&logNo=221610190122,챙겨간 쭈꾸미로 맛있게 먹었던 추억이 곱게 남겨져있어나정순할매쭈꾸미 를 생각하면 기분이 좋은지도 모르겠다나정순할매쭈꾸미 는 처음인 부부 매운걸 못 먹는 부부는 손을 못 댈줄 알았는데 이거 왠걸... ,상콤달달 인생의 활력소,https://blog.naver.com/obettero,2019-08-08
매콤한 용두동나정순할매 쭈꾸미 ,https://blog.naver.com/gshwa9?Redirect=Log&logNo=221596146875,유명한나정순할매 쭈꾸미 집이다. 결혼전에 이쪽에서 쭈꾸미를 먹었었는데 카레에 찍어먹는 집이였는데 속쓰리게 매운 맛이여서 속이 아팠던 기억이 있었다. 나정순할매네가 일요일에는 안열어서 아마... ,*Lalala,https://blog.naver.com/gshwa9,2019-07-26
쭈꾸미의 편견을 없애준 맛집... 호남식당( 나정순할매쭈꾸미 ),https://blog.naver.com/ymk0216?Redirect=Log&logNo=221493841762,내가 쭈꾸미 맛집을 남길줄은 몰랐네...몰랐어 하지만 진심 대존맛 용두동 쭈꾸미 골목에 있는 용두동나정순할매쭈꾸미호남식당 이라고 간판은 붙어있지만 나정순할매로 통용되는 집인듯 해요. 용두동... ,항상 배고픈 블로그,https://blog.naver.com/ymk0216,2019-03-21
용두동맛집나정순할매쭈꾸미 ,https://blog.naver.com/kic1ha2?Redirect=Log&logNo=221622196507, 나정순할매쭈꾸미용두동맛집 / 동대문맛집 지난주말 헤니맘의 입덧으로 잃어버린 입맛을 찾아 용두동 쭈꾸미맛집나정순할매쭈꾸미먹으러 헤니팸이 용두동으로 출동했어요~~ 헤니파가 얼마 전부터 맛있다고... ,DeSIgN 헤니맘,https://blog.naver.com/kic1ha2,2019-08-20
[용두동] 목포집 -나정순 할매 쭈꾸미 ,https://blog.naver.com/money4259?Redirect=Log&logNo=20179959803,"요렇게 대기를 타고 있으니 나정순 할머니(?)가 반겨주십니다.. 추운날씨라..난로에 손도 녹여주고... 약... 용두동나정순 할매 쭈꾸미 였습니다. 가격 : 쭈꾸미 1인분 (10,000원) , 볶음밥 1개(1,000원) 입니다.... ",광블로그,https://blog.naver.com/money4259,2013-02-21
"파주, 용두동 나정순할매쭈꾸미 ",https://blog.naver.com/qkqh8595?Redirect=Log&logNo=221657560832,파주 용두동 나정순할매쭈꾸미외근 전 든든하게 한끼하러 댈님과 선배와 집결 따로 주차장이없어서ㅠ... 계란찜을 추천 포실포실 내가 좋아하는 스탈의 계란찜고 환상적 파주 용두동나정순할머니쭈꾸미,JJungs,https://blog.naver.com/qkqh8595,2019-09-24
[용두동]나정순 할매 쭈꾸미- 쭈꾸미 맛집 ♪,https://blog.naver.com/doselsk?Redirect=Log&logNo=221640035008,골목엔나정순 할매쭈꾸미말고도 다른 쭈꾸미집들이 많은데 나정순쭈꾸미집만 천사채를 주고 나머지는 다 카레소스를 주더라... 내 입맛엔 쭈꾸미랑 카레 안 맞아... 무조건 천사채지... ♡ 정확한 상호는... ,YENA BLOG.,https://blog.naver.com/doselsk,2019-09-07
[용두동]나정순할매 쭈꾸미솔직후기,https://blog.naver.com/useungman?Redirect=Log&logNo=221601712824,"신설동역에서 가까운나정순 할매 쭈꾸미(호남식당) 즐돈이 문닫아서 들린 곳 *여기가 원조라예 본관... 딱히 쭈꾸미 *인분이요 ~ 시킬 필요가 없다. 기본 찬으로는 천사채(?), 락교, 마늘, 된장, 당근이 있다.... ",오동통통 무민보의 * 소 담 한 일 상 *,https://blog.naver.com/useungman,2019-08-01
[용두동]나정순할매쭈꾸미본점(목포집),https://blog.naver.com/replays1980?Redirect=Log&logNo=130171868639," 나정순할매 쭈꾸미목포집 처음먹어본건 워크샵에 포장해온 걸 처음으로 먹어보고요 그다음은... 쭈꾸미 2인분(10,000원 x 2인분) 자리에 앉기도 전에 쭈구미가 먼저 철판에 앉았어요... 뭐 미리 양념에... ",호거,https://blog.naver.com/replays1980,2013-07-10
용두동쭈꾸미 맛집나정순할매쭈꾸미 ,https://blog.naver.com/yipi1000?Redirect=Log&logNo=221515485703,용두동쭈꾸미인 집도 좋아하긴하는데.. 나정순도 맛있어요..!ㅋㅋ 대신나정순할매쭈꾸미 는 일요일 휴무 본관 별관 두군데로 나눠져있는데 별관은 더 넓고 자리가 많아요~ 기다리고 있는 인원은... ,아무도 모르는 블로그,https://blog.naver.com/yipi1000,2019-04-17
[서울 용두동] 호남식당 ( 나정순할매 쭈꾸미 ),https://blog.naver.com/gamjayuna?Redirect=Log&logNo=221624415083,"담고나정순할매 쭈꾸미 엔 마카로니 따윈 없다 쭈꾸미 1인분 12,000원 × 2 와 진짜 오랜만이야 너무 방갑구려 어쩜 이렇게 쫄깃쫄깃하게도 생겼을까 용두동 가까이로 이사온지도 몇년됬는데 진짜 잘 안오게... ",Gamja's Empty House,https://blog.naver.com/gamjayuna,2019-08-27
서울맛집 용두동나정순할매쭈꾸미 ,https://blog.naver.com/honeypen?Redirect=Log&logNo=221048559788,맛있게 매운나정순할매쭈꾸미 . 때가 되면 생각나는 매운맛! 거리가 멀어도 가게 되는 마성의 매운맛!!... 날 = 나정순 방문 인거 같아요 ㅋ 쭈꾸미 새로 익힐때마다 마늘 듬뿍 듬뿍. 쏘즈와 함께 냠냐미 호록... ,어질賢 아름다울美,https://blog.naver.com/honeypen,2017-08-15
