title,link,description,bloggername,bloggerlink,postdate
[이천맛집 :닭사부일체],https://blog.naver.com/tjdrud10634?Redirect=Log&logNo=222420085041,~!~!~!!!! 셀프바도 있고 명함 놓는 곳이 넘 귀여워서 찍어봤다 ㅋㅋㅋㅋㅋㅋㅋ 먹방 끗 ⭐️ # 이천 맛집 #부발맛집 # 이천 역맛집 #부발역맛집 # 이천 닭볶음탕 #묵은지닭볶음탕 # 닭사부일체 ,Eternally_,https://blog.naver.com/tjdrud10634,2021-07-04
 이천맛집 찾았다! 꼭 먹어봐야할 맛집!이천닭사부일체 ,https://blog.naver.com/seul0621?Redirect=Log&logNo=222425137162,친절하셔서 또 반하고~~~닭사부일체때문에이천와야할듯합니다!!! ㅋㅋㅋㅋ # 이천 #맛집# 이천 #닭볶음탕#묵은지닭볶음탕# 닭사부일체 # 이천닭사부일체 # 이천 맛집# 이천 닭볶음탕맛집# 이천 맛집#완전맛있음#완전,시유니와 함께하는 일상,https://blog.naver.com/seul0621,2021-07-09
[1년 전 오늘]이천 추천맛집이천 시닭사부일체 ,https://blog.naver.com/temujin247?Redirect=Log&logNo=222319785011,1년 전 오늘이천 추천맛집이천 시닭사부일체홍반장입니당~오늘은이천 시 사는 동생단골집인 # 닭사부일체방문.미리 예약해야 금방 음식이 준비된답니다주차장은 매장앞 가능 넓은 주차장미리 예약주문한... ,로드스타☆홍반장,https://blog.naver.com/temujin247,2021-04-23
"홍뚱이일상) 이천닭사부일체 , 닭볶음탕 제일 맛있는 집",https://blog.naver.com/jiyoung7592?Redirect=Log&logNo=222011088415,사장님 진짜 유쾌하고 즐거움ㅋㅋㅋㅋ 맛있게 머거쑵니다!!!! #홍뚱이 #홍뚱이일상 # 닭사부일체# 이천닭사부일체# 이천 맛집 # 이천 하이닉스맛집 # 이천 맛집추천 # 이천 닭볶음탕맛집 # 이천 회식장소추천,#홍뚱이일상,https://blog.naver.com/jiyoung7592,2020-06-24
 이천 맛집닭사부일체 에서 가족모임 ♥,https://blog.naver.com/process325?Redirect=Log&logNo=221789938897,잇님들 ㅁ 진짜 꼭 가셔서 드셔보셨으면 좋겠습니다 ㅜㅜ!!!이천 맛집닭사부일체 덕분에 저희가족 행복만땅 좋은기운 받고 가요 ~~ ^^ # 닭사부일체 # 이천 맛집#닭칼국수# 이천 닭칼국수# 이천 하이닉스맛집,뿡뿡이,https://blog.naver.com/process325,2020-01-30
 닭사부일체 이천닭도리탕 맛집 인정 내돈내산 후기,https://blog.naver.com/sjy6123?Redirect=Log&logNo=222206578347,진짜 모든 메뉴가 다 맛있었다.닭사부일체나만의 맛집 top5 안에 들어 올 정도다ㅎㅎ이천 이라 멀기는 하지만 자주 방문하게 될 것 같다# 닭사부일체# 이천닭사부일체# 이천 맛집 #닭도리탕맛집 #맛집,"힐링이 필요할 땐, 맛집 & 디저트",https://blog.naver.com/sjy6123,2021-01-13
 이천 닭볶음탕 묶은지찜닭이 아주 맛있었던닭사부일체방문후기,https://blog.naver.com/captan?Redirect=Log&logNo=222306625118, 이천 닭볶음탕 묶은지찜닭이 아주 맛있었던닭사부일체방문후기 아이들을 어린이집이 보내고 한가로운 평일날 점심을 아내와 먹을 생각으로 알아본 닭요리 전문점. 닭요리는 이제 왠만큼 맛있는것들은 다... ,우영이아빠,https://blog.naver.com/captan,2021-04-11
[ 이천하이닉스 맛집] 후문닭사부일체내돈내산 솔직 후기,https://blog.naver.com/yyj4640?Redirect=Log&logNo=222351858804,"오늘은이천하이닉스 맛집 으로 소문난이천닭사부일체후기를 쓰려고 합니다이천닭사부일체 ... 점이라면닭조각은 많은데, 살이 좀 부실한 거...? 닭에 붙어있는 살이 좀 없더라구요ㅋㅋㅋㅋ 작은 닭을... ",Judy's Day,https://blog.naver.com/yyj4640,2021-05-15
 이천숨은 맛집닭사부일체 (닭볶음탕 맛집),https://blog.naver.com/snghee5?Redirect=Log&logNo=222238366235, 닭부드러움 언퍽퍽함 김치 적당함~ 맛있음~ 국물 술을부르는 맛 먹느라 중간에 사진을 못찍었넹 ㅋㅋ 다음에 또 맛집가면 리뷰하도록 하겠음~ 빠이~ # 이천 맛집 # 닭사부일체# 이천 맛집추천 # 이천 하이닉스맛집,해리포터 행복마법,https://blog.naver.com/snghee5,2021-02-10
[ 이천 ]닭사부일체 ,https://blog.naver.com/psa0130?Redirect=Log&logNo=222455193871,# 이천 닭볶음탕 # 닭사부일체 이천하이닉스 근처에 위치한닭사부일체 ! 여기서 닭볶음탕을 먹었어용 묵은지 닭볶음탕+치즈폭탄계란찜 주문!! 귀여워서 찍어봄 계란찜 존맛탱 치즈가사장님께서 갑자기 머리끈... ,떠라 파크,https://blog.naver.com/psa0130,2021-08-03
 이천닭사부일체:이천 찜닭 닭도리탕 맛있는 곳 발견!,https://blog.naver.com/wltmdakgid?Redirect=Log&logNo=222059389484," 이천 찜닭닭도리탕닭사부일체오랜만에 친동생이랑 가까운 곳에이천닭사부일체라는이천 찜닭 , 닭도리탕 맛집이 있다해서 조금은 이른 저녁 방문! 좀 엉뚱한 위치에 있지만 주변에 뭐가 없어서 그런지... ",청춘블로거 꽃지승,https://blog.naver.com/wltmdakgid,2020-08-13
 이천 맛집추천 닭사부일체매콤달짝지근한 묵은지 닭볶음탕!,https://blog.naver.com/daldalnana?Redirect=Log&logNo=222269254946,"우리 부부, 친정부모님 모두 맛있게 잘 먹었던 # 이천닭사부일체#묵은지닭볶음탕 먹고있자면 맥주한잔이 생각나기에이천 회식장소로도 추천한다. ⬇️ 예약은 여기 링크로 고고",달나일상,https://blog.naver.com/daldalnana,2021-03-09
경기도이천맛집 ::닭사부일체❤️,https://blog.naver.com/qjawldms?Redirect=Log&logNo=222410676390,안녕하세요 :) 가족들과 다녀온 경기도이천 맛집닭사부일체소개할게요! 주차장이 넓어서 편하고 좋았어요! 아 그리고 조리시간이 좀 걸리니 미리 주문하고 오는걸 추천드려요! 가게에도 붙어있더라구용ㅎㅎ... ,소소하고 특별한 범찌니 일상블로그,https://blog.naver.com/qjawldms,2021-06-26
 이천 하이닉스맛집 묵은지닭도리탕닭사부일체 ,https://blog.naver.com/logindalok?Redirect=Log&logNo=222147785829, 닭사부일체 는 경기도이천 시 부발읍 가좌리 100-43에 위치하고 있습니다 많은 차들로 주차장은 인산인해를 이루는데요 닭요리를 전문으로 하는닭사부일체아무래도 호불호가 제일 갈리지 않는게 닭이지... ,Daroggy - 내일은 어디냐?,https://blog.naver.com/logindalok,2020-11-18
 이천닭사부일체김치부터 맛있는 곳,https://blog.naver.com/ra_sso?Redirect=Log&logNo=222303335146,"향긋한 깻잎향과 적당히 달큰하면서 느끼함 잡아줄 정도의 매콤함이 침샘 자극하는 국물, 커다랗게 댕강 잘라넣은 감자와 당근에 하이라이트라고 할 수 있는이천닭사부일체 만의 묵은지와닭 !! 진짜 완벽한... ",라쏘스윗,https://blog.naver.com/ra_sso,2021-04-08
" 이천 닭볶음탕 존맛집,이천 하이닉스맛집닭사부일체 ",https://blog.naver.com/sally9405?Redirect=Log&logNo=222279005871,"ㅎ이천하이닉스 맛집 묵은지 닭볶음탕이 일품인닭사부일체매일 11:00 - 23:00 031-635-7357 매장... ㅎㅎ - 닭시리즈로 붙여놓으셨더라구용ㅋㅋㅋㅋㅋ 사장님의닭사랑이 엄청나신듯,, 이건 카운터에 있던... ",이웃집 토동이,https://blog.naver.com/sally9405,2021-03-17
[맛집]이천하이닉스 맛집 ::이천닭사부일체 ,https://blog.naver.com/godqhrgo205?Redirect=Log&logNo=222235062922,히히 -닭사부일체주소 : 경기이천 시 부발읍 대산로 379 운영시간 : 매일 11:00 - 23:00 매장 번호 : 031-635-7357 ' 닭사부일체 '는닭요리를 전문으로 하는 식당이에요! 다이어트로 인해닭가슴살만 먹던 저는... ,#인절민의 끄적끄적,https://blog.naver.com/godqhrgo205,2021-02-07
 이천닭사부일체 ,https://blog.naver.com/y_j0207?Redirect=Log&logNo=221934071025, 닭사부일체경기이천 시 부발읍 대산로 379 031-635-7357 저희는이천 은 와본 적이 없어서 여기에 있을만한... 쫄쫄 쫄려서 흰밥에 묵은지만 올려먹어도 맛있고닭살코기랑 같이 먹어도 맛있고 감자도 맛있고 양념만... ,예지네,https://blog.naver.com/y_j0207,2020-04-28
 이천 하이닉스맛집닭사부일체묵은지닭볶음탕 치즈계란찜,https://blog.naver.com/cys3369?Redirect=Log&logNo=222089662266,오늘은 부모님하고 같이가서 먹은이천 하이닉스맛집닭사부일체 를 소개할려고해요닭사부일체 는 묵은지닭볶음탕하고 낙지품은찜닭 낙지토종백숙을 판매하는곳으로 술이랑 먹으면 아주 맛있고 좋은곳인거... ,잠만보 다이어리,https://blog.naver.com/cys3369,2020-09-15
" 이천닭볽음탕 완전 추천!!( 닭사부일체 ,닭발)",https://blog.naver.com/dlalstn7?Redirect=Log&logNo=222315056315,에 넣어 먹었어요이천닭사부일체살포시 추천 아니 완전추천 ㅋㅋㅋㅋ해봅니다 # 이천 맛집 #여주맛집 # 이천 닭발 # 이천 닭볶음탕 # 이천닭사부일체# 이천 국물닭발 #하이닉스맛집 #하이닉스닭발 #하이닉스야식,바보야 우리 어디갈까?,https://blog.naver.com/dlalstn7,2021-04-19
 이천 하이닉스맛집 묵은지 닭볶음탕닭사부일체추천,https://blog.naver.com/dudk6746?Redirect=Log&logNo=222214297701,됐어요ㅎㅎ # 이천닭사부일체# 이천 닭볶음탕닭사부일체 는 다양한 이벤트 뿐만 아니라 보조배터리 등 고객서비스까지 너무 잘 되어있는 곳이었어요! 오늘은 묵은지닭볶음탕 중 + 치즈계란찜 주문! 밑반찬도 너무... ,The bombomm 더봄봄,https://blog.naver.com/dudk6746,2021-01-20
[ 이천하이닉스 후문 맛집닭사부일체 ] 닭요리 맛집으로 유명한... ,https://blog.naver.com/suin2297?Redirect=Log&logNo=222153567081,"처음부터 끝까지 감동만 가득 안겨준닭사부일체 !♡이천하이닉스 후문 닭요리 맛집 찾으시면닭사부일체 에서! 회식으로도 최고인 장소닭사부일체 ! 임코난이 적극 추천합니당♡,♡",임코난,https://blog.naver.com/suin2297,2020-11-24
 이천 하이닉스맛집 닭도리탕이 맛있는닭사부일체 ,https://blog.naver.com/sosoil-?Redirect=Log&logNo=222240081188,기본적인거지만 안지키는 식당도 꽤 있는데ㅠ이천닭사부일체 는 코로나로 민감한 시기에 안심하고 먹을 수 있겠어요 :)닭사부일체 에서 감사드림 이벤트도 하신다고해요. 제주도 2인 여행권+ 렌트카 48시간... ,record of all ღ,https://blog.naver.com/sosoil-,2021-02-11
 이천친절한 맛집 ' 닭사부일체 '이천 아울렛갔다가 한정식... ,https://blog.naver.com/hyunok225?Redirect=Log&logNo=222202601044,얻고 싶으시다면 ' 닭사부일체 ' 추천합니다^^ 조금이라도 도움이 되셨다면 공감꾸욱 눌러주세요! # 닭사부일체# 이천 맛집 #경기도 이천 맛집 # 이천 아울렛맛집 # 이천 아울렛닭볶음탕 # 이천 찜닭맛집 # 이천 아울렛찜닭맛집,장부부 꽁냥꽁냥 즐거운 하루 ♥,https://blog.naver.com/hyunok225,2021-01-10
" 이천 맛집!닭사부일체 ! 묵은지 닭볶음탕 맛집!! 닭칼,닭곰탕... ",https://blog.naver.com/yagorilla?Redirect=Log&logNo=222202471966,2인 중 1인 영화 무료티켓 직접 방문해서 구매하여 먹고 포스팅 합니다. 끝. ■닭사부일체(위치) # 이천 맛집 # 이천 닭볶음탕 # 이천 닭도리탕 # 이천 닭개장맛집 # 이천 대파닭개장맛집 # 이천 닭백숙맛집 # 이천 찜닭맛집,고릴라야의 잡동사니,https://blog.naver.com/yagorilla,2021-01-13
 이천하이닉스 맛집닭사부일체묵은지 닭볶음탕 내돈내산 후기,https://blog.naver.com/real_ggg?Redirect=Log&logNo=222406516642, 닭사부일체경기이천 시 부발읍 대산로 379 103호 평일 11시 - 9시 30분 (3시-5시 브레이크타임) 주말 11시 - 9시 30분 (브레이크타임 없음) 매주 월요일 휴무 예전에 짝꿍이가 남친이었을 때닭사부일체닭볶음탕을... ,김쁘니,https://blog.naver.com/real_ggg,2021-06-22
 이천 하이닉스맛집닭사부일체 이천 찜닭 아직도 안 가봄?,https://blog.naver.com/nryoon21?Redirect=Log&logNo=222033815701,맛있는이천 찜닭닭사부일체양파장아찌와 깍두기와 김치 김치맛이 정말 끝내준다 맛있는 집은 김치만 먹어도 안다고 하는데... 그곳이 바로 여기닭사부일체깍두기랑 오이소박이까지 맛이 굉장히 좋다... ,메리어라운드,https://blog.naver.com/nryoon21,2020-07-17
 이천 맛집- 닭사부일체 /2인커플세트(부럽다)묵은지닭볶음탕... ,https://blog.naver.com/segeong?Redirect=Log&logNo=222313517820,맛은 굿굿!! 잘먹었습니다^^ #닭사부일체 #이천닭사부일체 #이천맛집 #이천 #이천닭볶음탕 #이천닭도리탕 #이천묵은지닭볶음탕 #이천국물닭발 # 닭사부일체이천본점#신혼,달,https://blog.naver.com/segeong,2021-04-17
오한수우육면가/ 이천시몬스테라스/ 닭사부일체 /디큐브시티... ,https://blog.naver.com/loveme_likeyoudo?Redirect=Log&logNo=222526636134,그래서 이번여름 잘입었음 캬캬이천닭사부일체 이천맛집 검색하니까 여기 나오길래 또 가봤쥬 전화로 한40분 전에 예약하고 가긴 했는데 가서도 쪼매 기다림 전날 쇼핑하고 바로 입어버리기... ,AWESOME.LOG,https://blog.naver.com/loveme_likeyoudo,2021-10-04
 이천 맛집닭사부일체여기가 찐입니다~~!!!,https://blog.naver.com/cokkxer?Redirect=Log&logNo=221835563661,"한번도 안먹어본 사람은 있어도, 한번만 먹어본 사람은 없다는 바로 그곳입니다....^^ # 닭사부일체# 이천 맛집 # 이천 하이닉스맛집 # 이천 닭볶음탕 #낙지와바람난토종백숙 #낙지찜닭 #치즈폭탄계란찜... ",꽃돼지,https://blog.naver.com/cokkxer,2020-03-05
 이천 본점하이닉스닭사부일체 ,https://blog.naver.com/newm8n?Redirect=Log&logNo=222472831865,묵은지 닭볶음탕 묵은지닭볶음탕 중사이즈 단품 포장 (반찬 4개. 캔사이다) 포장해오는 동안 식어서 집에있는 전골냄비에 옮겨서 끓여먹음 상당히 양이 많다 엄청칼칼하고 단맛도 나고 쿰쿰한 묵은지 아니여서... ,마지꽁지,https://blog.naver.com/newm8n,2021-08-17
 이천맛집?닭사부일체후기~,https://blog.naver.com/sadiya8?Redirect=Log&logNo=222498127564,안녕하세요~~ 오늘 모처럼 시간이 많아서 연속해서 블로그를 쓰고 있네요~ 미뤄놨던 숙제처럼 있었던 후기를 올리니 조금은 마음이 편안합니다 ㅎㅎㅎ이천 에서 점심으로 먹었었던닭사부일체다녀온 이야기... ,일상과 특별함의 공유,https://blog.naver.com/sadiya8,2021-09-07
일명 ' 이천하이닉스 맛집' 이색적인 닭찜 닭사부일체 ,https://blog.naver.com/trendmisuk?Redirect=Log&logNo=222141795040,뭐라 설명하기 뭐한 감칠맛 계란찜에 치즈를 올려서 주신다 볶음밥을 빼놓을 수 없지 영혼까지 긁어먹었다 사장님이 도와주셨다 ㅋㅋㅋ #하이닉스맛집 # 이천 하이닉스맛집 # 이천 맛집 # 닭사부일체# 이천닭사부일체 ,의미의 하루,https://blog.naver.com/trendmisuk,2020-11-11
 이천하이닉스닭사부일체 ,https://blog.naver.com/jihaiggogi?Redirect=Log&logNo=222464172845,# 이천 하이닉스맛집 # 이천닭사부일체# 이천 에만있어요 # 닭사부일체#산신령도즐기는초계국수 #말복인데안다녀온사람바보 몇번 회식차 다녀왔다는 후기만 듣다가 오늘 낮에 방문하게 된닭사부일체 ! 바로... ,jihaiggogi님의블로그,https://blog.naver.com/jihaiggogi,2021-08-10
"[ 이천 _ 닭사부일체 ]이천 하이닉스맛집, 묵은지닭볶음탕은... ",https://blog.naver.com/ooii200?Redirect=Log&logNo=222310967533, 이천하이닉스 맛집이천닭사부일체리뷰입니다. 맛있는 묵은지가 들어간 칼칼한 닭볶음탕이 생각나 찾아보았어요. 찾아보니 네이버 예약도 가능하네요. 예약하면 쿨피스나 라면사리도 서비스로 받을 수... ,연복이네,https://blog.naver.com/ooii200,2021-04-15
 이천 닭도리탕 맛집닭사부일체맛있다.,https://blog.naver.com/bondur?Redirect=Log&logNo=222193764193,여주시민 용형임당 저번주부터 날씨가 갑자기 추워지더니 뜨끈한게 자꾸 땡기더라구요 그래서 여주까지 소문난이천닭사부일체 에 가서 묵은지 닭볶음탕을 먹었습니다. 여기에는 닭볶음탕도... ,용형일상,https://blog.naver.com/bondur,2021-01-02
[ 이천 ] 부발 맛집 -닭사부일체 ,https://blog.naver.com/whwngml0763?Redirect=Log&logNo=222157105506," 이천 의 맛집~ 이번에는 하이닉스 부발! 맛집인데요 바로바로닭사부일체입니당 위치는 하이닉스 후문쪽, 가좌오거리에 있답니당 네비 찍으실경우! 경기이천 시 부발읍 대산로 379 참고 바랄게요^^이천 에서... ",행복한 날들,https://blog.naver.com/whwngml0763,2020-11-28
생방송 투데이닭사부일체후기 위치,https://blog.naver.com/wkgml0714?Redirect=Log&logNo=222531148977,"수도권 최고의 닭볶음탕 TOP5 중 1등 맛집이천 시 부발읍 하이닉스후문 부근 가좌오거리에 자리 잡고 있는닭사부일체 가 있습니다. 대표 메뉴로는 백년내공 묵은지 닭볶음탕, 낙지품은 찜닭, 낙지와 바람난 토종... ",백설,https://blog.naver.com/wkgml0714,2021-10-08
 이천목젖을 때리는 칼칼함~닭사부일체 ,https://blog.naver.com/hoya_land?Redirect=Log&logNo=222253116740,다음에 또 보자 애들아~이천닭사부일체식당은 사장님의 열정이 인상깊은 식당이였다. 여러 음식들이 맛있었고 밑반찬에 나오는 겉절이와 깍두기도 직접 담그신다고 한다. 사장님의 열정이 있기에 음식에도... ,호야의 일상기록,https://blog.naver.com/hoya_land,2021-02-23
 이천 (장호원) 맛집닭사부일체 ,https://blog.naver.com/rnfjrfl?Redirect=Log&logNo=222481016270,위치 : 경기이천 시 부발읍 대산로 379 영업시간 : 11:30 - 21:30 브레이크타임 : 15:00-17:00 장호원에서 30분정도 거리의 멀지 않은 맛집닭사부일체 입니다.이천 에서도 소문난 닭볶음탕 맛집이죠 기본 반찬과 함께... ,감곡(장호원),https://blog.naver.com/rnfjrfl,2021-08-23
빅데이터 랭킹 맛집 경기도이천닭사부일체서대문구 닭볶음탕,https://reviewhong.tistory.com/6588,방송을 통해서 나온 경기이천닭사부일체닭볶음탕 가격 주소 전화번호 정보를 공개 합니다. #살맛나는오늘닭볶음탕 #sbs생방송투데이닭볶음탕 #생방송투데이10월8일닭볶음탕 #생방송투데이2911회닭볶음탕... ,랜선 고양이 지식,https://reviewhong.tistory.com/,2021-10-08
 이천 맛집!!하이닉스...닭사부일체(+내돈내산),https://blog.naver.com/rosse87?Redirect=Log&logNo=222454225921,"묵은지닭볶음탕 닭볶음탕 안에는 묵은지, 무, 감자,닭이렇게 들어있어요. 감자많은게 좋은데...이천닭사부일체치즈볶음밥 볶음밥을 1개 주문했는데 직원분이 치즈 올릴꺼냐고 물어보셔서 치즈는... ",로제의 블로그,https://blog.naver.com/rosse87,2021-08-02
빅데이터 랭킹 맛집이천닭사부일체10월 8일 금요일 2911회,https://comcomin.tistory.com/19438,10월 8일 금요일 sbs 생방송투데이 2911회 빅데이터 랭킹 맛집 수도권 최고의 닭볶음탕 top5 [닭사부일체] 전화번호 0507-1332-7357 주소 경기도이천 시 부발읍 가좌리 100-43 103호 영업시간 11:00... ,★■ 일루와 ■★,https://comcomin.tistory.com/,2021-10-08
 이천 찜닭 :이천 의 진짜 맛집을 찾았다!닭사부일체 ,https://blog.naver.com/foxmapia?Redirect=Log&logNo=222177244688, 닭사부일체 이천 찜닭으로 정말 유명하고 맛있는 집이 있다고 해서 여행의 중간이천 을 찾았습니다. 이날의 경우 어중간한 오후의 하루였는데 신기하게 어찌알고 찾아왔는지 저희 말고도 정말 사람들이... ,도도한 하우스,https://blog.naver.com/foxmapia,2020-12-17
손맛이천우리 동네 반찬... 랭킹 맛집닭사부일체10월 8일,https://blog.naver.com/dyangela?Redirect=Log&logNo=222531027688,건강을 담은 일품 손맛 편 상호 : 엄마찬스 주소 : 경기이천 시 증신로 161 빅데이터 랭킹 맛집 - 수도권 최고의 닭볶음탕 TOP5 편 상호 :닭사부일체주소 : 경기도이천 시 부발읍 대산로 379... ,안젤라,https://blog.naver.com/dyangela,2021-10-08
 이천 맛집닭사부일체 에서 친구들과의 맛있는 수다....,https://blog.naver.com/rlove3023?Redirect=Log&logNo=221647386139,대만족~~ 의자마다 재미있는 글감~~ 친구들과 앉아있는 테이블 의자는 힘내닭 친구들과 한바탕 웃었다~~ 다음에 가족모임에 또 와야겠다~~ # 이천 맛집 # 이천 에 가볼만한곳 # 이천찜닭 # 닭사부일체# 이천 하이닉스 맛집,이천명진부동산쇼핑 딱여기야,https://blog.naver.com/rlove3023,2019-09-13
 이천하이닉스 맛집 : 묵은지 닭볶음탕은닭사부일체 에서!,https://blog.naver.com/andygkxm?Redirect=Log&logNo=222195064610,"찬솔이 밥 먹이고 흘린거 줍고 있었는데 괜찮다며, 놔두고 밥 먹으라고, 애기니깐 이해하신다며 맘 편히 밥 먹었습니다이천맛집닭사부일체추천하고 추천해요",찬솔이와 함께하는 공간,https://blog.naver.com/andygkxm,2021-01-03
 이천 맛집닭사부일체 에서 회식하고 왔습니다 !,https://blog.naver.com/rlachdml123?Redirect=Log&logNo=221831101274,일석삼조였어요 ㅎㅎㅎ이천 에서 식사 하실 일 있으면이천 맛집닭사부일체추천 드려요 ! # 닭사부일체# 이천 맛집 # 이천 하이닉스맛집 # 이천 닭볶음탕 # 이천 맛집추천 #낙지와바람난토종백숙 https://daksaboo.modoo.at/,대마왕의 소소한 일상,https://blog.naver.com/rlachdml123,2020-02-29
[ 이천 하이닉스맛집] 묵은지닭볶음탕 유명한닭사부일체 로 모여!,https://blog.naver.com/smy_8989?Redirect=Log&logNo=222205197173,"매장 구석구석 사장님의 센스가 돋보이는 멘트들이 많더라구요ㅎㅎ 의자마다닭이름이 붙어있고, 소주의 효능(ㅎㅎ), 굳은 결의 등 매장 방문해서 확인해보세요:)이천 하이닉스맛집닭사부일체메뉴... ",마이영의 일상다반사,https://blog.naver.com/smy_8989,2021-01-12
 이천 찜닭 하이닉스맛집닭사부일체칭찬맛!,https://blog.naver.com/g1230love?Redirect=Log&logNo=222114253002, 이천 하이닉스맛집닭사부일체 에서 맛있는이천 찜닭 알현! 칭찬맛! 시골집 어머니댁 들러서 올라오는 길에 률 청소년 다니는이천 치과 교정진료도 다녀오고 근처이천하이닉스맛집 으로 소문났다는닭사부일체 ... ,드므의 크게 되되 더불어되라,https://blog.naver.com/g1230love,2020-10-13
( 이천 ) 묵은지로 맛을 낸 닭볶음탕이 맛있는닭사부일체/이천 ... ,https://blog.naver.com/manggol0421?Redirect=Log&logNo=222167536457,#닭볶음탕 낙찰 주소: 경기이천 시 부발읍 대산로 379 103호 전화: 031) 635 - 7357 영업시간: 매일 11:00 ~ 23:00 (break time 15:00 ~ 16:30) # 닭사부일체꼬끼오!!! #주차 걱정은 넣어두세요 사실 #고담기숙사 인근에서는 #식당... ,망골부부♡,https://blog.naver.com/manggol0421,2020-12-09
 이천 )닭사부일체 ,https://blog.naver.com/a0_0a______?Redirect=Log&logNo=222339831455,용인으로 놀러갔다가 맛집없나 찾다찾다 맘에드는곳이 없어서이천 으로 넘어옴 !닭사부일체리뷰보고 놀랬다 카카오기준 평점 4.6 높은 점수에 리뷰또한 휼륭해서 안가볼수없지 우린 점심세트? 로... ,april.apron,https://blog.naver.com/a0_0a______,2021-05-06
[이천 하이닉스맛집 ]닭사부일체 에서 맛깔나는... ,https://blog.naver.com/superpig83?Redirect=Log&logNo=222005386708," 이천 하이닉스맛집,닭사부일체묵은지김치찜이 먹고파서 찾은닭사부일체 이천하이닉스 직원분들에게 인기있는 맛집이래요. 본관이 모자라서 야외공간도 마련하셨대요. 비오는 날, 닭발에 소주한잔하면... ",우가부가 :),https://blog.naver.com/superpig83,2020-06-18
 이천닭도리탕 맛집 :닭사부일체후기!,https://blog.naver.com/kyj_a0409?Redirect=Log&logNo=222036131334, 이천닭도리탕 맛집닭사부일체오늘은이천 에 있는 ' 닭사부일체 ' 포스팅하려고해요. 하이닉스맛집으로 이미 유명한 곳이더라구요?닭사부일체매장내부외부 외부사진 / 내부사진 10시 40분정도에... ,DDUYUN,https://blog.naver.com/kyj_a0409,2020-07-20
[ 이천 하이닉스맛집] 말이 필요없는닭사부일체 ,https://blog.naver.com/jhejhe0712?Redirect=Log&logNo=222135418211,먹었답니다닭사부일체사장님도 엄청 친절하시고 무엇보다도 진짜 맛있어서 다음에도 다시 방문하고싶어요 다음에는 묵은지 닭볶음탕을 먹으러 가봐야겠어요이천 하이닉스맛집닭사부일체매일 11:00 - 23:00,막찍고 막먹는 말자씨,https://blog.naver.com/jhejhe0712,2020-11-07
