title,link,description,bloggername,bloggerlink,postdate
 이천 백숙닭사부일체이런 백숙 처음이에요~,https://blog.naver.com/apple800412?Redirect=Log&logNo=222096695526, 이천 백숙닭사부일체이런 백숙 처음이에요~ 요즘이천맛집으로 핫하다고 소문이 난 곳!이천 백숙닭사부일체 입니다! 하도 소문이 나서 얼마나 맛있으면 그렇게 추천을 하는지 소문의 진상을 캐러 저희 팀... ,애플파이,https://blog.naver.com/apple800412,2020-09-22
 이천하이닉스 후문맛집닭사부일체 에서 대파닭개장으로... ,https://blog.naver.com/bangtae1?Redirect=Log&logNo=221874370886," 이천하이닉스 후문닭사부일체간판 메뉴를 보면 아침, 점심, 저녁 메뉴가 따로 구별되어있네요. 무엇을 먹을까 고민하다 점심세트 + 대파닭개장을 주문했는데 특별히 이메뉴를 주문한 이유는 메뉴옆에 붙은... ",쪼랩아빠는 육아 레벨업중..,https://blog.naver.com/bangtae1,2020-04-07
 이천SK 하이닉스 앞닭사부일체묵은지 닭볶음탕 포장,https://blog.naver.com/song3534?Redirect=Log&logNo=221959054486,몇일전 룸메이트 동생의 여자친구가 맛집이라고 사온이천SK하이닉스 앞에 있는이천닭사부일체 에서 묵은지 닭볶음탕을 포장해 왔어요. 집에서 같이 먹겠다고 하여 저는 블로그를 하는 중 동생이 거실로... ,지수지수,https://blog.naver.com/song3534,2020-05-12
 이천 하이닉스맛집닭사부일체얼큰한 닭볶음탕 최고!,https://blog.naver.com/sua2793?Redirect=Log&logNo=222225480029,"야채,닭등 다양한 재료가 들어간 닭볶음탕이에요~ 너무 맵지 않아서 매운거 못드시는 분들도 부담없이... 할수 있답니다 ㅎㅎㅎㅎㅎ이천 하이닉스맛집 ::닭사부일체주소 : 경기도이천 시 부발읍 대산로379 103호",뚜블뚜블 Daily :D,https://blog.naver.com/sua2793,2021-02-03
 이천 맛집닭사부일체성장일기_2번째 발걸음,https://blog.naver.com/mukbang7739?Redirect=Log&logNo=221886086649,자정을 넘어서는 지금 20시간의 고군분투의 결실 목표 일 300선을 향해 순항~~~가즈아!!! 밀고 나아가라 세상 그 어떤것도 끈기를 대신할수없다. # 이천닭사부일체 # 이천 하이닉스맛집# 이천 맛집#임계점#성장일기,"뒷씸,뱃씸,뚝씸~!!!",https://blog.naver.com/mukbang7739,2020-04-02
 이천 찜닭 SK하이닉스 앞에 있는닭사부일체맛있어요,https://blog.naver.com/song3534?Redirect=Log&logNo=222011662392,메뉴판을 보고 저희는 두명이라 커플세트로 시켰어요. 반찬과 찜닭이 나오고 끓길 기다립니다.이천 찜닭닭사부일체 에서 처음 먹어봤는데 맛있네요. 그래도 전 닭볶음탕에 한표 던집니다 ㅎㅎ,지수지수,https://blog.naver.com/song3534,2020-06-25
 이천 맛집닭사부일체성장일기_5번째 발걸음,https://blog.naver.com/mukbang7739?Redirect=Log&logNo=221929485344,기회요인을 극대화할 수 있는 방향으로 모든 역량을 초 집중하자. 초점을 맞추기 전까지 햇빛은 아무것도 태우지 못한다. 오늘도 내공을 던져보자~!!! # 이천닭사부일체 # 이천 하이닉스맛집# 이천 맛집# 이천 부발역맛집,"뒷씸,뱃씸,뚝씸~!!!",https://blog.naver.com/mukbang7739,2020-04-26
 이천 맛집닭사부일체닭요리의 절대기준!,https://blog.naver.com/ml47oq35aeh?Redirect=Log&logNo=221951771412, 이천 맛집닭사부일체닭요리의 절대기준! 안녕하세요~~~ 퇴근후 요즘 회사내에서 정말이지 핫하다못해 핫핫핫하게 떠오르는 후문근처닭사부일체 방문했어요. 예약전화를 했는데 듣던데로 사장님의 위트와... ,하늘이,https://blog.naver.com/ml47oq35aeh,2020-05-08
 이천 맛집닭사부일체언제나 믿고 먹을 수 있는 곳!,https://blog.naver.com/axasmme?Redirect=Log&logNo=222058863350,못하죠~이천 맛집닭사부일체 에서만 영접할 수 있는 영롱한 계란찜입니다! 부드러운 계란찜과 가득한 치즈!! 그 환상적인 조화는 정말 감탄을 할 수밖에 없어요!! 그리고닭요리들과 궁합도 정말 잘 맞기 때문에... ,먹고 놀기 바쁜 하루,https://blog.naver.com/axasmme,2020-08-12
[2020맛집] 경기도이천닭사부일체- 친절하고 유니크한... ,https://blog.naver.com/jdj931013?Redirect=Log&logNo=222172474345,주었지만 이러한 친절함은 모르고 간 누군가는 부담스러워 하는 사람이 있을 수도 있겠다라는 생각도 들었음. (물론 그런 점들을 잘 조절하시는 것으로 보였지만^^) # 이천 맛집 # 이천 하이닉스맛집 # 이천닭사부일체 ,인생여행자,https://blog.naver.com/jdj931013,2020-12-13
" 이천하이닉스, 고담 기숙사 맛집닭사부일체 ",https://blog.naver.com/pk9477?Redirect=Log&logNo=222338526836,"얼마 전 남자친구랑 먹부림 시전하러 하이닉스 5문 쪽닭사부일체 에 다녀왔어요! 저희는 네이버 예약하고 선결제 후 방문 했는데요, 네이버 예약 시스템에는 브레이크 타임이 따로 표시 되어있지 않아서... ",My Happy Life,https://blog.naver.com/pk9477,2021-05-05
하이닉스 이천닭사부일체 ,https://blog.naver.com/kangkys?Redirect=Log&logNo=221996509211,오랜만에 하이닉스 이천 의 # 닭사부일체방문.. 1주년기념이라고 영화티켓도 득탬하고~ http://m.blog.naver.com/kangkys/221720539079 작년에 오고 벌써 8개월이 지났다 요즘은이천 의 맛집이라 소문나서 그런가... ,봄날의 아메리카노,https://blog.naver.com/kangkys,2020-06-10
[ 이천닭사부일체 ]앞으로 닭볶음탕은 여기닷...₍₍ (ง ˙ω... ,https://blog.naver.com/hyunnn_0?Redirect=Log&logNo=222434312180,"여기는이천 의 맛집으로도 원래 유명한데 사진도 잔뜩 찍어놓고 이제서야 올림,,,ㅎㅎ 이때 비도 오고... 말할 필요가 있나 할 정도로 좋아서,,, 암튼 결론은이천가면 꼭 들려야 하는 맛집...츄릅....또 먹고 싶다...","나의, 나를, 그리고 너와 우리",https://blog.naver.com/hyunnn_0,2021-07-17
 이천 맛집닭사부일체성장일기_4번째 발걸음,https://blog.naver.com/mukbang7739?Redirect=Log&logNo=221903591951,밤낮으로 생각에 생각을 더하고 고민의 고민을 더하고... 사냥에 성공하려면 사냥감처럼 생각하고 좋은 낚시꾼이 되려면 고기처럼 생각하라. # 이천닭사부일체 # 이천 하이닉스맛집# 이천 맛집#부발역맛집#성장일기,"뒷씸,뱃씸,뚝씸~!!!",https://blog.naver.com/mukbang7739,2020-04-12
 이천부발맛집닭사부일체닭곰탕 with 서빙로봇,https://blog.naver.com/bangtae1?Redirect=Log&logNo=221972397250, 이천부발맛집닭사부일체가는길 가게안에는 서빙로봇이 우리를 맞이해주었고 벽을 보니 사장님의 열정이 담긴글과 매력있는 요리들.. 회식장소로도 괜찮을것 같아요.이천부발맛집닭사부일체요리... ,쪼랩아빠는 육아 레벨업중..,https://blog.naver.com/bangtae1,2020-07-21
"[ 이천 맛집/가좌리]... JMTGR, 닭요리 떠오르는 맛집_닭사부일체 ",https://blog.naver.com/topicxx15v?Redirect=Log&logNo=221696837231, 닭사부일체031-635-7357 경기이천 시 부발읍 대산로 379 지번)가좌리 100-43지도보기 매일 11:00 - 24:00 재료준비시간:15:00~17:00 회사에서 이미 맛집으로 소문이 자자한곳 고담기숙사 뒷길에서 신하리 빠지는 곳에... ,나혼자 쓰는 기록,https://blog.naver.com/topicxx15v,2019-11-03
"[신장개업]맛집소개,닭사부일체 /경기도이천 / 닭요리의 모든것",https://blog.naver.com/gkdnffla97?Redirect=Log&logNo=221618925186,와우~~~ 닭다리를 주셔서 우자작 씹는 이 기분 ㅋㅋㅋ 닭과 문어와 파의 삼 일체국물에 찰밥을 말아 후루룩 맛있다. 이 더운 여름 별미 드시러 가셔도 좋을 듯해요. # 이천# 닭사부일체#하이닉스후문맛집,세영아뜰리에,https://blog.naver.com/gkdnffla97,2019-08-17
 이천 맛집 묵은지닭볶음탕닭사부일체 ,https://blog.naver.com/dh0492?Redirect=Log&logNo=221793908918,두번째로 방문한닭사부일체대리운전 하시다가 창업하셨다는데 솜씨가 아주좋으시다 ㅋㅋ 김치찜인데 김치에 닭을 돌돌 싸서 먹으면 맛이 기가막힌다ㅠㅠ 먹고나서 사리도 추가할수있고 (우리는 칼국수면... ,"이상은 높게, 발은 땅에",https://blog.naver.com/dh0492,2020-02-02
 이천 닭볶음탕닭사부일체대박 맛집을 찾았습니다~,https://blog.naver.com/composition6271?Redirect=Log&logNo=221694420728, 이천 닭볶음탕닭사부일체 는이천 시 부발읍 대산로 379 가좌리 100-43에 위치하고 있습니다! 그냥 지나가다 보아도 특별한 간판 덕분에 한눈에 알아볼 수 있는 곳이에요~ 영업시간은 매일 11:00 ~ 24:00 까지고요... ,새콤달콤,https://blog.naver.com/composition6271,2019-10-31
 이천닭사부일체닭칼국수!!!,https://blog.naver.com/lapland26?Redirect=Log&logNo=221985732362,"5월 중순에 주말치팅데이로 집근처에 먹던,닭칼국수 집이 사라져서, 인터넷 검색으로 방문한...닭사부일체 에서 주문시, 커플세트 2인+ 치즈계란찜으로 주문하여, 먹었습니다. 음식이 나오자 마자, 치즈계란찜은... ",오늘도 숨을 쉽니다.,https://blog.naver.com/lapland26,2020-06-01
 이천닭요리잘하는곳닭사부일체 에서 연말회식 뿌시기!!,https://blog.naver.com/upoxiue?Redirect=Log&logNo=221760874030,짠짜짠~~ 연말에 그동안 힘들었던 일들을 다 떨처네고 새로운 2020년을 맞이했어요ㅋㅋㅋ 저희가 회식한 장소는이천닭요리잘하는곳닭사부일체 에요!!이천닭요리잘하는곳닭사부일체 는 직장 동료가... ,치킨,https://blog.naver.com/upoxiue,2020-01-07
 이천 백숙닭사부일체완전 맛있는 보양식입니다~~!!!,https://blog.naver.com/shtowila?Redirect=Log&logNo=221764146657, 이천 백숙닭사부일체완전 맛있는 보양식입니다~~!!! 낙지백숙 들어보셨나요~~ 이 건강한 별미를 아직 모르시는 것은 아니겠죠....ㅎㅎ 영양보충이 필요한 시기입니다. 길고 긴 겨울 이제 시작이라고 봐야겠죠.... ,shtowila님의블로그,https://blog.naver.com/shtowila,2020-01-09
부발 맛집닭사부일체 ,https://blog.naver.com/lhs29090?Redirect=Log&logNo=222159178365,"닭요리가 맛있는닭사부일체방문기입니다.이천백숙,부발 맛집, 부발 백숙닭사부일체가게 모습입니다. 주차장이 넓어 좋아요. 이벤트도 하고 있어 찍어봤어요. 이미 많은 분들이 식사를 하시고 계셨네요.... ",Travel & Life,https://blog.naver.com/lhs29090,2020-12-01
 이천 맛집닭사부일체성장일기-7번째 발걸음,https://blog.naver.com/mukbang7739?Redirect=Log&logNo=222006700903,다하고~~~ 내가 돌보고 어루만지는 만큼 보답을 한다~반드시!!! 돼지가 아닌 아이를 키우는 마음으로... 진심은 바위와 같은 고객도 움직인다. # 닭사부일체 #오픈일주년# 이천 맛집# 이천 하이닉스맛집# 이천 회식장소,"뒷씸,뱃씸,뚝씸~!!!",https://blog.naver.com/mukbang7739,2020-06-20
 닭사부일체 (20.10.12.),https://blog.naver.com/unseen87?Redirect=Log&logNo=222119499936,# 이천맛집# 이천닭사부일체 # 남편과 둘이 점심 먹으러옴ㅎ 신하리에 볼 일이 있어 왔는데 위치가 굉장히 애매하고 생뚱맞음ㅋ 하랑이 없으니 매운 묵은지 찜닭으로 주문! 이건 각 테이블마다 있는 소금! 위에... ,My Family's Diary ♡,https://blog.naver.com/unseen87,2020-10-19
 이천 맛집 ' 닭사부일체 ' 묵은지닭볶음탕 치즈폭탄계란찜... ,https://blog.naver.com/esimr?Redirect=Log&logNo=222250702327, 이천하이닉스 근처 닭볶음탕맛집 방문 후기 사실 처음에 다른 집을 먼저 방문했었는데 재료 소진으로 저녁식사때 식사 가능하다 해서 ㅠㅠ 급하게 서치했는데 묵은지닭볶음탕 맛집이 있다는 걸 알게 되었고... ,벚꽃색 벚꽃바람,https://blog.naver.com/esimr,2021-02-21
 이천하이닉스 주변 맛집닭사부일체 에서 묵은지 닭볶음탕,https://blog.naver.com/cbj87?Redirect=Log&logNo=222455523780,그래서 보통은 재료랑 소스만 사서 집에서 해먹는게 주로인데 와이프가이천 에 맛집이 있다고 해서 반신반의하고 찾아갔습니다. 차를 타고 가보니 자차가 없으면 조금 찾아가기에는 힘들지 않을까라는 곳에... ,노이의 리뷰척척,https://blog.naver.com/cbj87,2021-08-03
 이천 맛집_ 닭사부일체매콤달콤밥도둑! (feat. 시몬스테라스),https://blog.naver.com/esl2901?Redirect=Log&logNo=222234216508,# 이천 맛집 # 닭사부일체 ,♡ 너도나도 하는 러블로그 ♡,https://blog.naver.com/esl2901,2021-02-06
 이천생방송투데이 맛집 닭볶음탕 찐이야!,https://blog.naver.com/ferrariboss?Redirect=Log&logNo=222535896144, 이천닭사부일체내부모습이다. 테이블은 열개남짓 있고 밖에 대기표 기계가 있는걸로 봐서는... 일단 잘 익은닭한조각과 묵은지 국물을 떴는데 국물이 진짜 예술이다. 짭쪼름하면서 묵은지 때문인지 감칠맛이... ,헝크의 Taste & View,https://blog.naver.com/ferrariboss,2021-10-13
[ 이천 맛집]닭사부일체묵은지닭볶음탕 존맛,https://blog.naver.com/cathome05?Redirect=Log&logNo=222368326572,치즈계란폭탄?? 진짜 맛있었음!!! 사람들이 찬양하는 이유 알게쎀ㅋㅋㅋㅋ 양이 적어 보여도 절대 그렇지 않다더니... 정말 양 작은 여자 셋이 먹기엔 너무 많아서 힘들어따 ㅠㅜ 묵은지 잘라주는 모습 몰래... ,하루의 일상 기억 힐링의 순간을 기록하려는 의지,https://blog.naver.com/cathome05,2021-05-26
 닭사부일체성장일기_1번째 발걸음,https://blog.naver.com/mukbang7739?Redirect=Log&logNo=221884090384,그 안에 함께하는 고마운 감사한 식구들과 잠시 여유의 달콤함을~~~ 내공60년의 찰진 손맛~!!! 이 손만 거치는 순간 거시기도 된장이 된다는.. # 이천닭사부일체 # 이천 하이닉스맛집# 이천 맛집# 이천 부발역맛집#성장일기,"뒷씸,뱃씸,뚝씸~!!!",https://blog.naver.com/mukbang7739,2020-04-01
대한민국닭요리 수도닭사부성장일기,https://blog.naver.com/mukbang7739?Redirect=Log&logNo=222189748972,"코로나로 예방 차원에서도 그렇지만 청결 매장, 안심 매장을 위해서라도... 꾸준함의 힘을 믿어보자. # 닭사부일체 # 이천 맛집# 이천 하이닉스맛집#코로나#자체방역소독#꾸준함의힘","뒷씸,뱃씸,뚝씸~!!!",https://blog.naver.com/mukbang7739,2020-12-29
[생방송투데이] 수도권 최고의 닭볶음탕 TOP5 위치 공개,https://blog.naver.com/daumsoft_korea?Redirect=Log&logNo=222529585882,"위치정보 2위닭사부일체 이천본점 (경기 이천시) #매콤하다 #고소하다 #얼큰하다 #달달한맛 #단짠단짠정석 #국물진하다 사진 = 네이버 플레이스 대표메뉴 백년내공 묵은지 닭볶음탕(중) - 29,000원... ",바이브 공식 블로그,https://blog.naver.com/daumsoft_korea,2021-10-08
음식 review18- 닭사부일체 ,https://blog.naver.com/loveonehanna?Redirect=Log&logNo=222106507212,경기도이천 에 위치한 곳입니다.이천 하이닉스 맛집이라고도 하더라구요 메뉴판입니다. 엄니의 손맛이라고 써져있죠? 김치가 끝내줘요. 밥도 나오기 전에 김치를 뚝딱하다니.... 저희는 커플세트로 묵은지를... ,있을 리뷰 다 있는 리뷰만물상,https://blog.naver.com/loveonehanna,2020-10-07
 이천 / 닭사부일체 ,https://blog.naver.com/rladmswn9804?Redirect=Log&logNo=222408661798,찜닭 중 + 치즈폭탄계란찜 매콤하니 맛있는 찜닭 마무리는 역시 볶음밥 친절친절 ~~,깡깡지야❣,https://blog.naver.com/rladmswn9804,2021-06-24
 이천하이닉스 맛집 묵은지 닭볶음탕 솔직후기,https://blog.naver.com/toqurquf0526?Redirect=Log&logNo=222365090964,이천 쌀밥집 제끼고 먹어본닭사부일체 이천본점안녕하세요. 오늘은 경기도 이천에 놀러갔다가... 닭사부일체 메뉴판닭사부일체 이천본점메뉴판과 원산지 정보입니다~ '잡다가 놓쳐 중국산' 원산지 표시가... ,투루루뚜딱 맛난여행,https://blog.naver.com/toqurquf0526,2021-05-24
Kenny's이천 시 맛집 리스트 202110 ...,https://blog.naver.com/hakenny?Redirect=Log&logNo=222539458157,경기이천 시 부발읍 가좌리 100-43닭 (볶음탕)닭사부일체031 635 7357 네이버 경기이천 시 부발읍 가좌리 260-4 국밥(소머리) 우정식당 031 632 2555 정용진 경기이천 시 부발읍 아미리 737-16... ,피사체에 담은 Museum ...,https://blog.naver.com/hakenny,2021-10-17
