title,link,description,bloggername,bloggerlink,postdate
이천 롯데아울렛 맛집닭사부일체 이천본점 _매운 묵은지... ,https://blog.naver.com/scenecake?Redirect=Log&logNo=222312277887,같기도하고ㅋㅋㅋㅋㅋㅋㅋㅋㅋㅋㅋㅋ 암튼 이천가면 알렛 들렸다 닭사부 갈 예정!! 내돈내산임동!!!!! ㄲ ㅑ륵! #이천맛집#롯데아울렛맛집# 닭사부일체이천본점 #묵은지닭볶음탕#치즈폭탄계란찜핵맛#치즈볶음밥핵맛,급급이 일상,https://blog.naver.com/scenecake,2021-04-16
 닭사부일체 이천본점하이닉스 맛집? 저는 모르겠음 (청결별로),https://blog.naver.com/skh_91?Redirect=Log&logNo=222482153686, 닭사부일체 이천본점루찌랑 오빠랑 이천으로 놀러와서 애견동반 되는 식당을 열심히 찾다가 알게된 닭사부일체! 닭사부일체는 하이닉스 맛집으로 알려져있더라구요! 애견동반시 케이지 갖고 동반 가능한데... ,루찌’s story,https://blog.naver.com/skh_91,2021-08-24
 이천맛집닭사부일체닭볶음탕 존맛탱 ♪,https://blog.naver.com/tomi6?Redirect=Log&logNo=222465567675,2021.08.07 # 이천 맛집 # 닭사부일체#닭볶음탕 #애견동반식당 #존맛 · · · · · ·닭사부일체· · · · · · 영업시간 11:00 ~ 21:30 브레이크타임 15:00 ~ 17:00 월요일 휴무 경기이천 시 부발읍 대산로 379 주차가능... ,ෆ밥재블로그ෆ,https://blog.naver.com/tomi6,2021-08-11
 이천 찜닭 :: 반찬까지 맛있는닭사부일체 이천 맛집,https://blog.naver.com/withyoomee?Redirect=Log&logNo=222337113740,"괜히 이런거에 감동받는 저ㅋㅋ 직원분들도 친절해서 또 가고 싶은닭사부일체 랍니당.이천 찜닭,이천 맛집으로 어떠세요?! * 인스타https://www.instagram.com/daksaboo *네이버 주문https://m.booking.naver.com... ","달콤한 꿀, Honeysh world",https://blog.naver.com/withyoomee,2021-05-04
[ 이천하이닉스 맛집] 묵은지 닭볶음탕 전문닭사부일체본점 ,https://blog.naver.com/catdonggo?Redirect=Log&logNo=222297295545," 이천닭사부일체본점 에서는 사장님이 디테일에 상당한 신경을 쓰고 있음이 곳곳에서 느껴진다.... 비교를 거부하는닭요리의 절대 기준. 과연 맛은? 치즈 폭탄 계란찜 5,000원 나왔다 폭탄 치즈 계란찜 이... ",맛집 추천은 뱃슐랭가이드,https://blog.naver.com/catdonggo,2021-04-03
[ 이천 하이닉스맛집]::닭사부일체본점X 묵은지닭볶음탕 JMT... ,https://blog.naver.com/gippeum0731?Redirect=Log&logNo=222272929902,안녕하세요 기브미에요 - ✨ 오늘 소개해드릴이천 맛집은이천 하이닉스맛집닭사부일체본점입니다 - ! 닭요리 전문점으로 하이닉스 근처 맛집으로 입소문난 맛집이에요 〰 예약하지 않고 방문하면 웨이팅이... ,GI PPEUM _ ✨,https://blog.naver.com/gippeum0731,2021-03-12
 닭사부일체 이천 본점‘묵은지 닭볶음탕’,https://blog.naver.com/yoo_rami?Redirect=Log&logNo=222299783806,방문한이천닭사부일체재미있는 원산지 표기 만큼이나 사장님의 유머와 센스가 넘친다. 묵은지... 묵은지 숭덩숭덩 짤라서 닭고기에 싸먹으면 JMTGR 영계인지는 모르겠지만닭사이즈가 조금 작은편이라... ,내.가좋.아하서하는블.로그,https://blog.naver.com/yoo_rami,2021-04-05
" 이천맛집 추천닭사부일체 , 닭의 본때를 느껴보실라우",https://blog.naver.com/daechankim91?Redirect=Log&logNo=222416516729," 이천맛집 :닭사부일체 .이천 을 찾았는데 정말 제대로 된 한끼를 먹고 싶다면, ' 닭사부일체 ' 어때요 ?! 자동차가 생기기 시작하면서, 그전에 자동차 없이 뚜벅이로 생활하던 때와 전혀 달라지게 되었고, 그러한... ",차니차니여행★☆,https://blog.naver.com/daechankim91,2021-07-03
[ 이천 하이닉스맛집] 닭사부일체-이천 닭볶음탕 맛집 발견!... ,https://blog.naver.com/appie8003?Redirect=Log&logNo=222275566803, 이천하이닉스 맛집인닭사부일체 를 소개합니다! 신랑의 회사 근처인데 왜 이제 발견했나하는 곳이에요- 저는 닭볶음탕(닭도리탕) 선호 남편은 백숙 선호 이상하게도상하게도 닭볶음탕은 식당보단 집에서 직접... ,콩혜진의 일상여행기,https://blog.naver.com/appie8003,2021-03-15
이천닭볶음탕은 여기지!닭사부일체 이천본점이천맛집추천,https://blog.naver.com/88sylove?Redirect=Log&logNo=222299013594,닭사부일체 전화번호 : 0507-1332-7357 # 닭사부일체이천본점#이천닭도리탕 #이천백숙 #이천회식장소 #이천맛집추천 #이천찜닭 #이이천닭볶음탕 #이천닭발 #이천하이닉스맛집 #이천아울렛맛집 주말에 괴산... ,또용이의 하루하루♥,https://blog.naver.com/88sylove,2021-04-05
 이천닭사부 일체닭볶음탕 생방송 투데이 빅데이터 랭킹 맛집,https://blog.naver.com/mmm7720?Redirect=Log&logNo=222531059697,이천 닭사부 일체 닭볶음탕 생방송 투데이 빅데이터 랭킹 맛집 메뉴가격 닭볶음탕 39000원 주소 경기도 이천시 부발읍 대산로 379 0507-1332-7357닭사부 일체 이천 본점 ,척척,https://blog.naver.com/mmm7720,2021-10-08
 이천닭곰탕 닭개장 하이닉스 인근닭사부일체 ,https://blog.naver.com/joinjaang?Redirect=Log&logNo=222425836616," 이천닭곰탕의 고수가 나타났다 ! 얼큰 ~ 매콤 ~ 한 닭곰탕집닭사부일체문의 : 0507-1332-7357 (클릭시 전화연결) Open 평일 : 11:00 ~ 21:30 , (15:00 ~ 17:00 휴식시간)이천하이닉스 인근에 위치하고 있는 닭곰탕 닭볶음탕... ",이천 빌라마켓,https://blog.naver.com/joinjaang,2021-07-09
 이천 찜닭이냐? 닭도리탕이냐? 그것이 문제로다ᆢ닭사부일체 ,https://blog.naver.com/july2299?Redirect=Log&logNo=222345718912,이천찜닭 맛집 닭사부일체 찾아가는 길은 이래요. 주소 : 경기도 이천시 부발읍 대산로 379. 영업시간...닭사부일체 이천 본점 의 정기휴일은 매주 월요일. 브레이크 타임은 평일 오후 3시 ~ 5시까지. 영업시간은... ,폴라리스 님의 블로그,https://blog.naver.com/july2299,2021-05-10
 이천 하이닉스맛집닭사부일체찜닭 잡솨봐~~,https://blog.naver.com/xgxg0667?Redirect=Log&logNo=222061794512, 이천 하이닉스맛집닭사부일체 !! 상가가 빼곡히 모여있는 곳이 아니라 주차공간은 많은 인파에 비해서 조금 여유로운 것 같았다 ㅋㅋ 네비찍고 도착하니 후기에서 많이 봤던 간판 모습 ㅋㅋㅋ 나도 찰칵!!... ,작은방 올리브집 지니가 사는 세상,https://blog.naver.com/xgxg0667,2020-08-16
 이천 본점네이버 리뷰5점만점 묵은지 닭볶음탕닭사부일체 ... ,https://blog.naver.com/wldosla87?Redirect=Log&logNo=222456817284,"강요 안해도 너무 맛있게 먹고와서 5점은 줬을거지만, 그래도 맛있어요 여러분 # 이천 맛집 # 이천 닭볶음탕 #묵은지닭볶음탕 # 이천닭사부일체# 닭사부일체# 이천 밥집 # 닭사부일체본점 ",맛집 도장깨기 같이 깨실래여?,https://blog.naver.com/wldosla87,2021-08-04
 이천 닭볶음탕맛집이천닭사부일체 주차장있어요,https://blog.naver.com/chanachu?Redirect=Log&logNo=222446498430, 닭사부일체본점 으로 가보아요본점 이라는 말은 특별하고 왠지 설래게 해요 저만 그런가요? # 이천닭사부일체 메뉴 #묵은지닭볶음탕 #치즈폭탄계란찜 메뉴가 다양하게 구성되어 있어요이천닭사부일체 에서 제일... ,every day is travel ✈️,https://blog.naver.com/chanachu,2021-07-27
 이천맛집 또 가고픈닭사부일체 ,https://blog.naver.com/jo9255?Redirect=Log&logNo=222237454574, 이천맛집닭사부일체 이천 으로 드라이브 갔다가 근처에서 저녁까지 먹고 가려고 맛집 찾던 중에 닭볶음탕이 끌려서닭사부일체 를 찾아갔어요 ! 이 날 날씨도 추워가지고 뜨끈하고 얼큰한 국물요리가... ,Hope 그리고 True,https://blog.naver.com/jo9255,2021-02-09
 이천미란다호텔 맛집닭사부일체맛있다!!!,https://blog.naver.com/harangru?Redirect=Log&logNo=222471130450,일등이구ㅋㅋㅋㅋㅋ 맛이 없음 이상한 이천 미란다호텔 맛집 닭사부일체!!! 사장님두 유쾌하시구 너무 기분 좋게 먹었어요!! 이천 가게 되면 또 가려구요!!!!! 맛있는 음식 감사합니당!!!닭사부일체 이천본점 ... ,mono·logue ⓒ모모,https://blog.naver.com/harangru,2021-08-15
[ 이천 맛집]닭사부일체 에서 매콤달큰한 묵은지 닭볶음탕을 맛보자,https://blog.naver.com/csydoona?Redirect=Log&logNo=222511581176,이곳은 체인점이 아닌듯하다 그말인즉이천 에서 밖에 못먹는다는닭사부일체메뉴판 나무 판자로 만든 듯한 메뉴판 노란별 ⭐️로 표시되어있는 요리가 여기 가장 베스트메뉴 인 것같다 우리는 가장 많이... ,신디최로그 :D,https://blog.naver.com/csydoona,2021-09-20
생방송투데이 닭볶음탕닭사부일체 이천빅테이터 어디?10월8일,https://blog.naver.com/richseoyuni?Redirect=Log&logNo=222531099529,생방송투데이 빅테이터 랭킹 맛집에 소개된 이천에 위치한 닭볶음탕 맛집 닭사부일체 이천 정보입니다 생방송투데이 닭볶음탕 이천 가게 :닭사부일체 이천 본점생방송투데이 닭사부일체 위치: 경기도... ,JUST RECORD,https://blog.naver.com/richseoyuni,2021-10-08
"닭볶음탕 TOP5, 이천맛집닭사부일체 ",https://blog.naver.com/mjs7436?Redirect=Log&logNo=222537984077,무너입니다 :) 오늘은 # 이천 맛집 # 닭사부일체❤️ 닭사부일체❤️ 후기로 찾아왔습니다 ~ 최근 방송에서 닭볶음탕 TOP 2로 지정되었다고 하네요!! 평일 : 11:00 - 21:30 (평일 15:00- 16:30 브레이크타임) 주말 : 11:00... ,One two three,https://blog.naver.com/mjs7436,2021-10-15
[ 이천하이닉스 맛집]닭사부일체 ,https://blog.naver.com/leehaksoon?Redirect=Log&logNo=221706153585,진작 봤어야.... 음식나오기 전에 한곡 땡기는건데...ㅎㅎㅎ 다음기회에 하는걸로!! 많이 먹고 많이 웃고 왔습니다. # 닭사부일체# 이천 맛집 #하이닉스맛집 #부발맛집 # 이천 찜닭 #낙지 #1일1포스팅,삽질하는 그녀 Le'a,https://blog.naver.com/leehaksoon,2019-11-13
 이천 닭볶음탕 완전 맛난닭사부일체 !,https://blog.naver.com/gfd8412?Redirect=Log&logNo=222024052317, 이천 닭볶음탕닭사부일체 는 여기가본점 이되는거쥬 ㅎㅎ 보세요~! 완전 예약 꽉꽉찼죠~!! 아마 하루전날이나 몇일전날 예약을 주시는 분들이 많아서 첫째주가 꽉꽉 채워져있었어요~ 저도 7월 2일인가... ,subjective,https://blog.naver.com/gfd8412,2020-07-07
친절하고 맛있는이천 하이닉스맛집닭사부일체 ,https://blog.naver.com/clubcara?Redirect=Log&logNo=222164952484,"배달 예약하면 1,000할인 혜택 11:00~23:00 영화티켓을 받아 기분이 좋아요 음식도 좋고,친절한 사장닝 덕분에 기분도 좋았어요이천하이닉스 맛집닭사부일체추천 드려요 # 이천 하이닉스맛집 # 이천 닭발... ",너여서 참 좋아,https://blog.naver.com/clubcara,2020-12-06
 이천 하이닉스맛집 맛도 좋고 사장님도 유쾌한닭사부일체 ,https://blog.naver.com/tlcb37?Redirect=Log&logNo=222062508413, 이천 하이닉스맛집으로 엄청 유명한닭사부일체 라는 곳을 다녀왔어요. 근처에이천 하이닉스가 있어요. 이미 맛집으로 유명해서 이 근방 사시는 분들은 많이 방문하시는 것 같아요. ☺ -연락처- 031-635-7357... ,신나,https://blog.naver.com/tlcb37,2020-08-16
 이천 추천맛집이천 시닭사부일체 ,https://blog.naver.com/temujin247?Redirect=Log&logNo=221923651505,좋아하는 닭발 전문점과 같은 맛좋은맛 간만에 맛있는집 찾은듯~ # 이천닭사부일체# 이천 맛집 인정~ # 이천 시맛집이천 가심 드셔보시길~ 2차는 시원한 생맥주로 마무으리~ 오늘 하루도 맛있는 저녁식사시간이었답니다,로드스타☆홍반장,https://blog.naver.com/temujin247,2020-04-23
[ 이천 맛집추천] - 이건 찐 이야닭사부일체,https://blog.naver.com/dbsghkt1?Redirect=Log&logNo=222237556101,의자마다 ~~ 닭돌림의 이름이 붙어있어요 ㅠㅋㅋㅋㅋㅋㅋ 이 굳은 결의를 보고 더더욱 안심하고 맛있게... 최애맛집이천닭사부일체리뷰를 여기서 마치도록할게요 ! 꼭ㅠㅠ 정말 안가보신분들은... ,인생은 윤쁘처럼,https://blog.naver.com/dbsghkt1,2021-02-09
 이천닭사부일체백숙도 끝내주는 하이닉스 맛집,https://blog.naver.com/ra_sso?Redirect=Log&logNo=222528902408," 이천닭사부일체 , 닭요리의 진수 맛집!! 낙지와 바람난 토종백숙이 맛있는 곳!! 맛있는 게 제일 좋은 라쏘스윗 입니다:) 오늘은 진짜 다녀온 지 한참 된 하이닉스 맛집 리뷰를 하려고 해요. 바로이천닭사부일체 ... ",라쏘스윗,https://blog.naver.com/ra_sso,2021-10-06
 이천 하이닉스맛집이천 찜닭 추천닭사부일체 ,https://blog.naver.com/yullisu?Redirect=Log&logNo=222244712655,사장님의 열정과 센스가 넘치는 곳이라이천 회식장소 로도 인기가 많다고 해요. 식재료에 대한 고집으로 음식에 대한 자부심이 있는닭사부일체맛이 더욱 궁금해지네요.닭사부일체 는 의자마다 재미있는닭 ... ,하늘위로 날아올라 :-),https://blog.naver.com/yullisu,2021-02-15
[ 이천하이닉스 맛집] 낙지찜닭 리턴매치닭사부일체 ,https://blog.naver.com/catdonggo?Redirect=Log&logNo=222351757602," 지난번 너무나 맛있게 먹었던,이천닭사부일체 의 묵은지닭볶음탕에 도전하는 낙지찜닭. 전화: 031-635-7357 주소: 경기이천 시 부발읍 대산로 379 103호 (1층) 영업시간: 11:00~21:30 (단 평일은 15:00~17:00 브레이크... ",맛집 추천은 뱃슐랭가이드,https://blog.naver.com/catdonggo,2021-05-21
 이천 하이닉스맛집 말해모해닭사부일체 ,https://blog.naver.com/tnsdud71?Redirect=Log&logNo=222004090195, 닭사부일체 이천 하이닉스맛집닭사부일체 는 하이닉스 고담기숙사쪽 세븐일레븐 오거리쪽에 위치하고 있었어요 식당 앞 넓게 주차장이 있어서 자차방문하기 편했습니다.닭사부일체영업시간은 매일 오전 11시... ,이리저리 사방팔방 수나니,https://blog.naver.com/tnsdud71,2020-06-17
"[ 이천여행]이천당일치기: 닭사부일체 ,이천광주요,이천 ... ",https://blog.naver.com/hanhee109?Redirect=Log&logNo=222453206544, 닭사부일체 이천본점이번에 선택한 밥집은 진짜 마음에 들었다 추천추천! #내돈내산#광고아님 외관 sk하이닉스 이천지사를 통과해서 가는 신기한 길 따라서 가니까 도착 밖에서는 몰랐는데 맛집 답게 테이블은... ,일상을 여행처럼,https://blog.naver.com/hanhee109,2021-08-01
 이천 하이닉스맛집닭사부일체닭볶음탕 찐!,https://blog.naver.com/yojo_ing?Redirect=Log&logNo=222087829061," 닭사부일체 를 만드셔서이천 이본점 이다. 앞으로 쭉쭉 잘되시면 프랜차이즈 사업도 하시지 않을까 싶다!ㅎㅎ 사장님께서 되게 인상도 좋으시구 말씀도 재치있게, 재미나게 잘 하셨는데 의자마다 붙어있는닭 ... ",요리조리 맛있는 일상,https://blog.naver.com/yojo_ing,2020-09-12
 이천하이닉스 맛집닭사부일체|이천부발에서 만난 소주를... ,https://blog.naver.com/moon-over?Redirect=Log&logNo=222515574441, 이천하이닉스 맛집/ 이천부발 맛집닭사부일체얼마 전에이천 아울렛에 놀러 갔다 왔다. 빨빨 거리면서 돌아다녔더니 급격히 배고파서 어딜 갈지 찾아 봤다. 그러다가 얻어 걸린닭사부일체 . 닭볶음탕 집이라고... ,다니랜드,https://blog.naver.com/moon-over,2021-09-24
 이천 하이닉스맛집 동네지인추천이천 찜닭닭사부일체 ,https://blog.naver.com/gag5177?Redirect=Log&logNo=222145407644,지인들이 멀리서이천 찜닭닭사부일체 를 찾았기에 모두들 허기가 졌는지 계란찜을 싹싹 긁어먹었어요. ㅋㅋㅋ 다들 가정주부인데도 이런 계란찜을 처음 먹어봤다며 감탄에 감탄을~~~ 저도 수저로 듬뿍 계란찜을... ,+나의일상+다이어트+맛집+여행+ 독한딸기,https://blog.naver.com/gag5177,2020-11-16
 이천 하이닉스맛집닭사부일체묵은지닭볶음탕 포장 찐행복,https://blog.naver.com/boyeon1107?Redirect=Log&logNo=222113291288,MENU이천닭사부일체 이천하이닉스 맛집닭사부일체메뉴 참고하세용 . 묵은지 닭볶음탕 백숙 낙지찜닭 국묽닭발 점심차림상 저녁차림상 커플세트 아침차림상 먹고 싶은게 많고 사이드 메뉴도 탐이나서... ,봉이와제티네ღ˘‿˘ற,https://blog.naver.com/boyeon1107,2020-10-12
( 이천 ) 닭사부일체인생계란찜 리얼 소주 찐 맛집,https://blog.naver.com/tpgmlcjsrnr1?Redirect=Log&logNo=222514653081,정말 너무 친절하고 맛도 좋은 찐 맛집이천닭사부일체첫 번째 방문 후기 별점⭐️⭐️⭐️⭐️⭐️ 안녕하세요 Sese입니다이천 에 후기도 좋고 맛 도 좋은닭사부일체 를 다녀왔어요. 다들 너무 친절해서... ,내가 좋아하는 여행일기,https://blog.naver.com/tpgmlcjsrnr1,2021-09-23
 이천 하이닉스맛집 닭볶음탕이 맛있는닭사부일체 ,https://blog.naver.com/kimcj87?Redirect=Log&logNo=222196333327,"국물과 묵은지와닭 , 모두 맛있었습니다. 국물 한 모금 먹자마자 소주 한 잔 생각나는데 점심이라... 너무 맛있게 먹은 점심이었습니다. 언젠가 코로나가 끝나면이천닭사부일체 로 회식 하러 와야겠습니다!",하루하루 열심히 살기,https://blog.naver.com/kimcj87,2021-01-05
 이천맛집닭사부일체가서 맛있는 점심 먹고 왔어요,https://blog.naver.com/parkyla?Redirect=Log&logNo=222305308447,이외에도 맛집들이 꽤 있어요~~이천 에서 밥 먹는다고 꼭 비싼 한정식 먹을 필요 있나요!? 가성비 좋고 맛있는거 드시길 바래요!! ㅎㅎ # 닭사부일체# 이천 하이닉스맛집 # 이천 찜닭맛집 # 이천 닭요리 # 이천 닭볶음탕,특별한미쓰리의 특별한맛집,https://blog.naver.com/parkyla,2021-04-10
 이천 하이닉스맛집 포장해서 맛있게 먹었던닭사부일체 ,https://blog.naver.com/dayun0307?Redirect=Log&logNo=222187699300,스위트홈 보면서 스위트홈에서 하이볼 + 찜닭으로 주말을 마무리했던~~ 너무 맛나게 잘 먹었당 배달 맛집으로도 추천이고 매장 / 포장도 강추하는이천 하이닉스맛집닭사부일체 ! # 이천 하이닉스맛집 # 닭사부일체 ,햄보카게,https://blog.naver.com/dayun0307,2020-12-28
 이천 회식장소닭사부일체 이천 닭도리탕 후식은 볶음밥,https://blog.naver.com/jb910204?Redirect=Log&logNo=222340016862,올라간이천닭사부일체묵은지닭도리탕 김치를 자리에서 다 잘라주셨다 푹 익어서 약간 투명해보일 지경의 김치가 완전 맛있는 냄새를 풍기는 중~ 닭은 바로 먹어도 되고 김치는 2분정도 끓여서 드세요~ 하고... ,신나는 메리통통 라이프,https://blog.naver.com/jb910204,2021-05-06
 이천 하이닉스맛집!이천 찜닭 이 맛있는 ' 닭사부일체 ',https://blog.naver.com/heavenroadgo?Redirect=Log&logNo=222204505911,"조카와 함께 갔는데, 안아주셔서 제 기분이 더 따뜻했답니다 : )이천 찜닭 맛집닭사부일체 는 워낙 맛있어서 가끔 대기도 있다고 해요 ㅜㅜ 주변에 하이닉스가 있다보니 많이들 식사하러 오시는 것... ",생활홈케어 살림박사9,https://blog.naver.com/heavenroadgo,2021-01-12
[ 이천 ]닭사부일체:) 대기표 받아 줄서서 먹는 닭볶음탕 맛집... ,https://blog.naver.com/pessoa0605?Redirect=Log&logNo=222421037690,강추해요~♡ http://naver.me/GdJIJmTG # 이천닭사부일체# 이천 맛집 # 이천 대기표맛집 # 이천 프리미엄아울렛맛집 # 이천 아울렛맛집 # 이천 닭볶음탕 # 이천 계란찜 #서울근교맛집 #하이닉스맛집 # 이천 부발맛집,행복한 현자씨의 일상,https://blog.naver.com/pessoa0605,2021-07-05
"홍뚱이일상) 이천 찜닭,닭사부일체 ::두번째방문",https://blog.naver.com/jiyoung7592?Redirect=Log&logNo=222091016824,닭요리로는 최고입니다 퍽퍽한 가슴살도 부드럽게 만들어버리는 곳입니다 맛있었습니당~~~~~!♥╭╮♥ #홍뚱이 #홍뚱이일상 # 이천 맛집 # 이천닭사부일체# 닭사부일체# 이천 찜닭 # 이천 닭볶음탕... ,#홍뚱이일상,https://blog.naver.com/jiyoung7592,2020-09-16
경기이천/ 하이닉스 맛집... 닭볶음탕이 맛있는 [닭사부일체],https://blog.naver.com/rlawldus7341?Redirect=Log&logNo=222254963307,"묵은지 양도 넉넉해서 더 좋았어요 헤헿 묵은지도 먹고, 닭도 먹고, 묵은지에닭싸서도먹고 ! 근데...닭사부일체‘이천하이닉스 부근 가좌오거리에 위치해있어요. 식당 앞에 주차도 가능해요 ! 주소... ",ᦂ J La vie en fleur ᦂ,https://blog.naver.com/rlawldus7341,2021-02-24
[20초 요약/음식점] #16닭사부일체 (경기이천부발읍),https://blog.naver.com/vhcjscjs?Redirect=Log&logNo=222435294934,#16닭사부일체본점* 간단요약 - 경기도이천 에 있는 아주 유명한닭요리집 특히 하이닉스 사람들이 많이 온다고 합니다. - 묵은지 김치찜 + 닭볶음탕의 환상조합으로 맛이 깔끔하고 깊다. 닭은... ,데라코가 살아가는 방법,https://blog.naver.com/vhcjscjs,2021-07-17
" 이천 하이닉스맛집, “ 닭사부일체 ” 묵은지 닭볶음탕 강추",https://blog.naver.com/kimje335?Redirect=Log&logNo=222141747880,# 이천닭사부일체 이천하이닉스에서 차량으로 약 5분도 안걸리는 곳에 위치해있어요! 쩌-기 하이닉스...닭사부일체 메뉴판닭사부일체메뉴판이에요 대표메뉴라고 따로 뽑을 수 없을만큼 다양한닭요리가... ,쩡니의 캠핑로그,https://blog.naver.com/kimje335,2020-11-11
 이천센스있고 친절한 SK하이닉스 맛집닭사부일체 ,https://blog.naver.com/kdy01016?Redirect=Log&logNo=222184350084,결혼기념일겸이천 으로 호캉스 간건데 기분좋게 식사할 수 있었습니다. 사장님께서 이 포스팅을 보실지는 모르겠지만 잘먹었고 감사했어요~이천하이닉스 근처에서 맛집을 찾으신다면닭사부일체추천합니다!!!~,소소한 맛집 카페 일상,https://blog.naver.com/kdy01016,2020-12-24
 이천 맛집) 닭사부일체진짜인생맛집 묵은지닭볶음탕 존맛,https://blog.naver.com/tiamobear?Redirect=Log&logNo=222489321247, 닭사부일체진짜 찐으로 맛있는 인생맛집 묵은지닭볶음탕 가져왔습니다.이천 에 온천갔다가 근처 맛집 알아보는 와중에 진짜ㅋㅋ네이버 평점이 5점만점에 4.9인거예요 후기보니깐 지방에서 올라왔다 그러고... ,방구석 2열의 소확행:D,https://blog.naver.com/tiamobear,2021-08-30
 이천맛집:닭사부일체 ,https://blog.naver.com/seokokodong?Redirect=Log&logNo=222461793157,"# 이천 맛집 # 닭사부일체안녕하세요 다음주 화요일 말복이 다가오고 있는데요, 말복에 추천드릴 음식점 소개시켜 드리겠습니다~ 바로 바로이천 에 위치한 ' 닭사부일체 ' 입니다! 위치:이천 시 부발읍 SK하이닉스... ",kokodong의 평범한 일상들^^,https://blog.naver.com/seokokodong,2021-08-08
[ 닭사부일체 ]이천 하이닉스맛집/ 이천 닭볶음탕맛집 추천,https://blog.naver.com/js_yeon?Redirect=Log&logNo=222276464375,안녕하세요이천 하이닉스맛집 묵은지 닭볶음탕이 맛있는닭사부일체추천 포스팅입니당닭사부일체매일 11:00 - 23:00이천 하이닉스맛집닭사부일체외관입니다 매장 앞에 주차도 가능!닭사부일체 ... ,뚭뚜루뚜뚜뚜뚜,https://blog.naver.com/js_yeon,2021-03-15
 이천 하이닉스맛집닭사부일체끝내준다!!,https://blog.naver.com/pse5656?Redirect=Log&logNo=222202578094,"정말 빼곡하게 예약이 ㅋㅋㅋㅋ 이걸보니 맛집인증이천닭사부일체 의 메인은 백년내공 묵은지닭볶음탕! 그리고 대파닭계장, 찜닭등 다양한 메뉴가있어용 먹고싶은게 많았지만 그래도 메인메뉴를... ",예감좋은날,https://blog.naver.com/pse5656,2021-01-10
 이천 하이닉스맛집닭사부일체 이천 맛집추천,https://blog.naver.com/yjem0920?Redirect=Log&logNo=222028590907, 이천 하이닉스맛집닭사부일체 이천 맛집추천 쩡이에요이천부발에서 회식장소로 좋은 맛집에 다녀왔어요. 저녁 8시에 방문했는데도 사람들로 매장이 한가득이었어요. 한 끼 식사로도 딱이고 술 안주로도 좋은... ,•쩡이와 뀨의 LoveYDoveY•,https://blog.naver.com/yjem0920,2020-07-12
 이천 하이닉스맛집닭사부일체찜닭 반함,https://blog.naver.com/jhseaworld?Redirect=Log&logNo=222053143690,지금까지이천 하이닉스맛집닭사부일체 이천 찜닭! 완전 반한 후기였어요~이천 에 방문하시거나 거주하시는 분들 꼭 한번 들리시길 추천해요❤ # 이천 하이닉스맛집 # 이천 찜닭 # 이천 닭볶음탕,은혜민 삼남매 작은 천국,https://blog.naver.com/jhseaworld,2020-08-06
