title,link,description,bloggername,bloggerlink,postdate
 이천국물닭발 맛집닭사부일체 에서 맛나고 재미난 생일파티~,https://blog.naver.com/chdmlakstp3?Redirect=Log&logNo=221791533986,다들 취취되고나니 흥이더올라서 2차로 노래방까지 갔어요 ㅋㅋㅋ 잇님들도 맛있는닭사부일체 의 맛에 꼭 빠져보시길 ㅜㅜ 아래에 주소도 남겨드릴게요!ㅋㅋ # 닭사부일체# 이천 맛집 # 이천 하이닉스맛집... ,A_all ##,https://blog.naver.com/chdmlakstp3,2020-01-31
[ 이천맛집]닭사부일체: 입에서 살살 녹는 묵은지 닭볶음탕... ,https://blog.naver.com/duswn8128?Redirect=Log&logNo=222387923922, 닭사부일체내돈내산 1년전에 찜닭먹으러 방문했을때 너무너무 맛있었어서 이번엔 묵은지 닭볶음탕 먹으러 또 재방문했다!닭사부일체이런곳에 맛집이 있다고? 싶은 곳에 있다 ㅋㅋㅋ 주차공간도 있어서... ,앤지의 청춘일기,https://blog.naver.com/duswn8128,2021-06-07
" 이천맛집닭사부일체 ) 묵은지닭볶음탕 전문점, 깊이있는 맛과... ",https://blog.naver.com/khlee5260?Redirect=Log&logNo=222246062552,ㅎㅎ이천닭사부일체 에서는 감사드림 이벤트로 sns 홍보 시 영화티켓을 증정하고 있으며 추첨을 통해 제주도 2인 여행권과 렌트카 이용권을 증정하고 있어요! 저희도 영수증 리뷰 작성하고 영화티켓 2매를... ,출근길 한소끔,https://blog.naver.com/khlee5260,2021-02-16
 이천닭사부일체낙지품은찜닭이 꿀맛이에요,https://blog.naver.com/s20825?Redirect=Log&logNo=222046047299, 이천닭사부일체낙지품은찜닭!! 야들야들한 해산물 낙지와 달콤짭쪼름한 찜닭의 꿀조합!! 라임입니다. 얼마 전 정말 맛있게 먹고 온 하이닉스 맛집!! 회식도 많이 하고 배달도 많이 하는듯한이천 ... ,"Really, Wish It was U.",https://blog.naver.com/s20825,2020-07-30
 이천하이닉스 현지인 맛집 찜닭닭사부일체 ,https://blog.naver.com/wotn9514?Redirect=Log&logNo=222153204873, 이천 에 놀러가면서 찜닭 먹은지 오래되서 닭잡으러 다녀왔습니다. 큰 길가에 덩그러니 있는... 엄청 친절하시고 김치맛집입니다. 전화 031-635-7357 주소 경기이천 시 부발읍 대산로 379 영업시간 매일 11:00 - 23:00 위치,윤숑 별별일상,https://blog.naver.com/wotn9514,2020-12-10
[ 이천 맛집] 하이닉스 맛집이천닭사부일체 ,https://blog.naver.com/sana611?Redirect=Log&logNo=222072982796, 이천 맛집이천닭사부일체 에서 맛점을 하였습니다.닭사부일체유머가 뛰어나신 사장님 어머 ~~ 이렇게 가까운곳에 맛집이 있었다니 오늘도 맛집하나 득템했네요. 알고보니 이미 맛집으로 유명해서 주변분들이... ,진(眞)실로의 세상 재테크,https://blog.naver.com/sana611,2020-08-27
 이천 닭요리 맛집 ! 닭사부일체 에서닭원없이 먹고 왔어요 !,https://blog.naver.com/opposition8416?Redirect=Log&logNo=221784127585,딱 좋더라구요 ㅎㅎ 아이들이 있어서 많이 마시지는 못했지만 다음에 친구들과 한번더 방문 하려구요 ㅎㅎ # 이천 닭요리 # 이천 닭볶음탕 # 이천 백숙 # 이천 닭발 # 닭사부일체# 이천닭사부일체https://daksaboo.modoo.at/,먹순이,https://blog.naver.com/opposition8416,2020-01-24
맛집/시몬스테라스맛집/이천하이닉스 맛집]이천닭사부일체 ,https://blog.naver.com/rua_js?Redirect=Log&logNo=222208691129,"안녕하세요 저희는이천 에 있는 시몬스 테라스에 다녀오고, 근처에 있는 밥집을 찾다가닭사부일체라는 맛집을 알게 되었어요 ! 오늘은 그 맛집을 소개해드립니다 ᵔ︡⌔ᵔ︠ 가게 입구인데요 오픈 1주년... ",do what you love,https://blog.naver.com/rua_js,2021-01-15
" 이천 하이닉스맛집,닭사부일체맛도 굿 매너도 굿!",https://blog.naver.com/ajdhs?Redirect=Log&logNo=222090391692,"웬만한 것은 다 잘 먹는 편이지만,닭요리는 특히 좋아하는 메뉴 중 하나입니다.이천 하이닉스맛집으로 알려진닭사부일체 인데요~ 저희 집에서도 가깝고 해서 들러봤습니다. 주차공간이 굉장히 넓어서... ",빛날찬의 성장노트,https://blog.naver.com/ajdhs,2020-09-15
[ 이천 맛집] 시몬스테라스 근처 초계국수 맛집 ' 닭사부일체 ',https://blog.naver.com/kmr245?Redirect=Log&logNo=222444999782,아점 먹고 시몬스테라스 가서 커피 한잔 마시기루 ~ 시몬스테라스 근처 맛집 검색하다가 알게된닭사부일체~ 너무 더우니까 질소 초계국수로 주문 시간이 좀 일렀는데도 두세팀 정도 있었고 다먹고 나갈때는... ,미라이의 노닥거리기:-),https://blog.naver.com/kmr245,2021-07-25
[ 이천 맛집]닭사부일체/ 닭볶음탕 맛집,https://blog.naver.com/qkqkemf?Redirect=Log&logNo=221990748158,맛있는 식사 하시고 오늘도 좋은하루 되세요 :) # 이천# 이천 맛집 # 이천 아울렛맛집 # 이천 롯데프리미엄아울렛 # 이천 롯데프리미엄아울렛맛집 # 이천 닭볶음탕맛집 # 이천닭사부일체# 이천 맛집추천 # 이천 쌀밥집... ,"지금, now and forever",https://blog.naver.com/qkqkemf,2020-06-05
"2군데나ᆢ, #어머니와아들, # 닭사부일체 , #호수집원조닭꼬치... ",https://blog.naver.com/duckpc?Redirect=Log&logNo=222531300931,2위 [이름]이천 부발 # 닭사부일체[직장] 031-635-7357 [직장]이천 시 부발읍 가좌리 100-43닭사부일체[메모] 후기 4.5 (66) 생방송 투데이 2021.10.08 생방송 투데이 소셜 빅데이터 닭볶음탕 맛집 TOP 5-2위... ,잘놀자여행연구소,https://blog.naver.com/duckpc,2021-10-08
[ 이천 맛집:가좌리]이천 회식장소이천 닭도리탕_ 닭사부일체 ,https://blog.naver.com/topicxx15v?Redirect=Log&logNo=222119058302,031-635-7357 매일 11:00 - 23:00이천 하이닉스맛집으로 유명한닭사부일체번화가에 위치한 곳이 아니라 저 위치라서 잘 안될려나 했었는데 나 혼자 괜한 걱정을...ㅋㅋㅋ 저는 이전에 한번 방문한 적이 있는 곳이지만... ,나혼자 쓰는 기록,https://blog.naver.com/topicxx15v,2020-10-18
[ 이천 하이닉스맛집] 닭사부일체낙지를품은찜닭 먹고 왔어요... ,https://blog.naver.com/youmi6217?Redirect=Log&logNo=222144893809,ㅎㅎㅎ 저는 어김없이 맛집투어중 인스타그램 비주얼에 반해 찾아간이천 맛집닭사부일체다녀왔어요~~~ 웨이팅하고 먹은 맛집이천하이닉스 근처에 위치하고 있구요~ 이미 유명한곳이라서 예악손님에!... ,망구의일상,https://blog.naver.com/youmi6217,2020-11-15
 이천 맛집 :)닭사부일체묵은지닭볶음탕치즈폭탄계말찜,https://blog.naver.com/uhjeong92?Redirect=Log&logNo=222138835125, 저는이천 맛집 검색하면 그게그거 라서 잘 검색을 안해봤었는데 처음보는닭사부일체심지어 리뷰와 평점도 굉장히 높았어요 ㅎ 우린 왜 몰랐지? ㅎㅎ 사실 닭볶음탕은 잘 시켜먹자는 않는데 닭발을... ,저니’s 하루,https://blog.naver.com/uhjeong92,2020-11-08
 이천닭사부일체 ,https://blog.naver.com/skdus555?Redirect=Log&logNo=222224843954,# 이천닭사부일체# 이천 닭볶음탕 #부발밥집 저번 주말에 양고기 먹으려다 휴무여서.. 매콤한거 찾다가...닭크기는 작았다..! 사장님 매우 밝으시고 친절하심! 계속 말 걸어주시고 밝게 이야기 했는데 어깨에 손은... ,나요니의 일상๑･̑◡･̑๑,https://blog.naver.com/skdus555,2021-01-29
 이천 닭볶음탕 맛집닭사부일체 에서 연말회식! 쭈꾸미... ,https://blog.naver.com/coirlosas?Redirect=Log&logNo=221736245906,"잇님들도 연말 회식, 모임장소 찾으신다면이천 닭볶음탕맛집닭사부일체 로 달려가보세요.. 존맛에 반하고 또 반하실거에요~ # 닭사부일체# 이천 닭요리 # 이천 닭볶음탕 # 이천 백숙 # 이천 닭발",달별하나,https://blog.naver.com/coirlosas,2019-12-14
술이 한 잔 생각 나는 날 우리닭사부일체 에서 만나!!이천 맛집... ,https://blog.naver.com/dalbodeure92?Redirect=Log&logNo=222118721983, 닭사부일체위치 :이천 시 부발읍 대산로 379 (가좌리) 영업시간 : 11:00~23:00 (매주 일요일 휴무) 전화번호...닭 !!! 닭이 가장 먼저 생각이 납니닭!닭요리 중에도 뜨끈한 국물에 묵은지 김치가 싸아아악~ 들어가... ,비비데일리,https://blog.naver.com/dalbodeure92,2020-10-18
친절하고 매장 깨끗하고 음식맛있고 최애맛집 /이천닭사부일체 ,https://blog.naver.com/dpgodpgo1?Redirect=Log&logNo=222165659387,"외치고 남은 국물,닭살 뿌시기ㅠㅠ♡ 야무지게 잘 먹고 sns 업로드하고 CGV영화표까지 받았다요! 진짜닭사부일체 는 꼭이예요! 꼭! ! 가세요!! #하이닉스맛집 # 이천 하이닉스맛집 #sk하이닉스맛집 # 이천 맛집... ",또아의 평범하지만 특별한 ᴗ͈ˬᴗ͈,https://blog.naver.com/dpgodpgo1,2020-12-07
[ 이천롯데 아울렛 맛집 :닭사부일체 ] 묵은지닭볶음탕 존맛!... ,https://blog.naver.com/rdw7770?Redirect=Log&logNo=222184967609, 이천맛집하면이천 쌀로 만든 한정식! 요 이미지가 강하다 나 또한 많은 한정식집을 알아봤는데 최근 네이버영수증 평이 다 별로였다 그래서 차라리 평점 높은 다른 곳을 가자! 해서 찾은 곳닭사부일체 ... ,DOTOM Daily,https://blog.naver.com/rdw7770,2020-12-25
 이천 맛집닭사부일체성장일기-6번째 발걸음,https://blog.naver.com/mukbang7739?Redirect=Log&logNo=221952971278,하여 5월 한 달 아니 하루하루의 행복과 설렘 가득한 발걸음으로 행한다~~~ 내 마음의 성지닭사부 로... # 이천닭사부일체 # 이천 하이닉스맛집# 이천 맛집#성장일기# 이천 부발역맛집#겉절이맛집,"뒷씸,뱃씸,뚝씸~!!!",https://blog.naver.com/mukbang7739,2020-05-09
" 이천 하이닉스맛집 , 묵은지닭볶음탕이 맛있는 '닭사부일체'",https://blog.naver.com/eunyoung210?Redirect=Log&logNo=222114078796,다들 참여해서 선물도 받아가세욤 ㅋㅋ 이시국에도 테이블이 꽉찬이천 맛집닭사부일체회사언니도이천 아울렛 갔다가 여기 오려고 했단말에 깜놀 !!! 왔으면 만났을텐데 ㅋㅋㅋ 참고로 내 회사는 서울... ,날마다딩가딩,https://blog.naver.com/eunyoung210,2020-10-13
 이천하이닉스닭사부일체 !!추천,https://blog.naver.com/dlalstn7?Redirect=Log&logNo=222031016702,안녕~~하세요 얼마 전 다녀온닭사부일체 !! 맛있는 걸 계속 찾다가..!결국 찾은 곳!!닭사부일체 !!... 한 끼 든든하게 먹었던 하루 같아요^^ 강력추천 !!#묵은지닭볶음탕 #닭볶음탕 #하이닉스맛집 # 이천 맛집... ,바보야 우리 어디갈까?,https://blog.naver.com/dlalstn7,2020-07-14
 이천 하이닉스맛집닭사부일체닭볶음탕 제대로네,https://blog.naver.com/swing_h?Redirect=Log&logNo=222003497542,사명부터 남다른이천 하이닉스맛집닭사부일체:D 왜 #찐맛집 인지 알 것 같아요. 그리고 가게 곳곳에 볼거리가 많아용 ㅋㅋ 메뉴 시켜두고 이것 저것 구경하다 보면 음식이 나오니까 좋더라구용 _ 의자마다... ,달콤한 나의 하루,https://blog.naver.com/swing_h,2020-06-17
 이천 닭도리탕닭사부일체묵은지닭볶음탕 초복에 이열치열,https://blog.naver.com/choiokko8957?Redirect=Log&logNo=222035673912,초복날 다녀온이천 맛집닭사부일체추천합니다^^!!! 누룽지백숙을 먹을까 하다가 늘 먹던 메뉴라서 급변경!! 새로운 메뉴~!! 묵은지닦볶음탕 먹고 왔어요!~~ 위치는이천 하이닉스 뒤편에 있는닭사부일체입니다... ,ღ오사랑 러브하우스ღ,https://blog.naver.com/choiokko8957,2020-07-19
 이천-닭사부일체묵은지 닭볶음탕,https://blog.naver.com/uknzz?Redirect=Log&logNo=222238149990,평점이 엄청난 닭요리 집이 있어서 방문 묵은지 닭볶음탕 집이라 주문을 하고 밑반찬으로 두부김치가 나오는데 사장님이 다른 두부보다 3배 비싼 거라고 하셨다.. 그리고 매워서 달래는 용 계란찜인줄 알았는데... ,후-식,https://blog.naver.com/uknzz,2021-02-09
[ 이천 ] 닭사부일체 /시몬스테라스/진리카페/후기,https://blog.naver.com/soem94?Redirect=Log&logNo=222327564756,# 이천# 닭사부일체일단 11시쯤에 만나서 출발을 했기때문에 도착하면 점심이겠거니 해서 찾아둔곳!닭사부 일체 에 도착했습니다. 입구에 손소독하는곳~~ 코로나 시국인지라 필수죵 ?ㅎㅎㅎ 체온체크랑... ,련생은 즐겁다,https://blog.naver.com/soem94,2021-04-29
 이천맛집 @ 닭사부일체 ,https://blog.naver.com/briller8977?Redirect=Log&logNo=222286611937,남자친구 보러이천 에 다녀왔어요 :-) 도착하자마자 배가 너무 고파서이천 맛집 검색하면 제일 먼저 뜨는닭사부일체 라는 매장에 다녀왔답니다! 치즈 계란찜 너무 맛있었어요 딱 제 취향 사장님이 정말... ,배DA BLOG,https://blog.naver.com/briller8977,2021-03-25
 이천닭사부일체회식하기 딱이네,https://blog.naver.com/ra_sso?Redirect=Log&logNo=222042482123," 이천닭사부일체 , 묵은지 닭볶음탕에 계란찜, 볶음밥까지 맛있는 곳!! 전부터 다녀와보고 싶던이천닭사부일체 !! 하이닉스 근처에서는 이미 회식하기 좋은 곳이라고 나름 소문난 맛집에 저도 다녀왔습니다.... ",라쏘스윗,https://blog.naver.com/ra_sso,2020-07-26
묵은지 닭볶음탕( 닭사부일체 ),https://blog.naver.com/withgo102?Redirect=Log&logNo=222454202438,http://naver.me/GC2ugBuT 매운음식이 땡겨 검색하던중 찾게된이천 에 위치한닭사부일체묵은지가 맛있다는 평들에 혹했다 ㅎㅎ 퇴근길에 너무 멀어 피곤해하는 그분위해 아울렛 쇼핑후 돌아오는길 저녁 해결차... ,행복을 위한 투자랠리,https://blog.naver.com/withgo102,2021-08-02
 이천 맛집/묵은지닭볶음탕 내돈내먹 [ 닭사부일체 ],https://blog.naver.com/tjfxkddl11?Redirect=Log&logNo=222106231493, 닭사부일체경기이천 시 부발읍 대산로 379 (가좌리 100-43 103호) 031-635-7357이천시몬스에 갔다가 저녁 고민을 하다 '묵은지 닭볶음탕'을 보자마자 급 당겨서 왔어요 ㅎㅎ이천시몬스에서 차로 15분도 안... ,돼지런한 하루（╹◡╹）♡,https://blog.naver.com/tjfxkddl11,2020-10-04
 닭사부일체닭을 좋아한다면 갑시다!!!,https://blog.naver.com/dkffkelswlsl?Redirect=Log&logNo=222434704290, 닭사부일체닭을 좋아한다면 갑시다!!! 안녕하세용!!^^티나에용♡ 오늘은 사장님도 직원분들도 다... 밥먹고 나오며 행복을 느꼈어용!!^^ 담에 또 갈께용!!!! # 이천 맛집 # 이천 닭볶음탕 # 이천 닭맛집 # 이천 가볼만한곳,티나 daily,https://blog.naver.com/dkffkelswlsl,2021-07-17
 이천 맛집추천 인생찜닭닭사부일체 ,https://blog.naver.com/parkyla?Redirect=Log&logNo=222062032999,그런데 이번에 정말 인생찜닭 맛집을 발견하고 말았어요~ 지금까지 먹어본 찜닭 이라고는 프렌차이즈 ㅇㄷㅉㄷ이랑 ㅂㅊㅉㄷ이 전부 였는데~~이천 맛집닭사부일체라는 식당에 닭도리탕 먹으러 갔다가 찜닭이... ,특별한미쓰리의 특별한맛집,https://blog.naver.com/parkyla,2020-08-16
 이천 맛집닭사부일체동생이 추천한 닭요리 굿,https://blog.naver.com/rilymin123?Redirect=Log&logNo=221972649834," 이천 맛집닭사부일체동생이 추천한 닭요리 굿 안녕하세요 ^^ 키매친입니다! 지난 번, 안성으로 캠핑장... 이렇게닭살 바르는 것도 일일텐데 ㅋㅋㅋ 진짜 사장님이 자부심 있을 만 하더라고요 ㅋㅋㅋㅋ 이렇게... ","키매친♥낭만곰이 맛집,뷰티,일상이야기 ♬",https://blog.naver.com/rilymin123,2020-05-21
내돈내먹 : 사장님의 자부심이 느껴지는이천닭사부일체리뷰,https://blog.naver.com/wona2730?Redirect=Log&logNo=222118923050,남자친구가이천맛집이라고 치니까 나오더라는 그집에 다녀왔습니다. 닭볶음탕(※닭도리탕은 일본식 표현입니다.) 전문 음식점닭사부일체 를 리뷰해보겠습니다. 1. 주인장의 자부심이 느껴진다!! 이런 곳... ,7년차 커플의 결혼일기,https://blog.naver.com/wona2730,2020-10-18
맛집닭사부일체다녀온 후기!이천 회식장소/이천 맛집추천,https://blog.naver.com/eunbijju?Redirect=Log&logNo=222173642734,같네요 ㅎㅎ네이버에서 사전예약 하면 인원당 서비스 이벤트도 하고 있으니 예약 하시고 가시기를 !!이천닭사부일체•주소 : 경기도이천 시 부발읍 가좌리 100-43 •연락처: 0507 1332 7357 • 주차가능,modern b,https://blog.naver.com/eunbijju,2020-12-14
 이천 회식장소는닭사부일체닭요리 맛있는이천 맛집으로... ,https://blog.naver.com/21ewl3pmri8?Redirect=Log&logNo=222022727012,"비주얼도 너무 좋고 음식맛 또한 인생맛집으로 인정인정이요! 앞으로이천 맛집 하면닭사부일체 ! 맛, 서비스 기대이상의 즐거움을 주는 곳!이천 회식장소로도 강추하는 곳입니당~",따르릉,https://blog.naver.com/21ewl3pmri8,2020-07-06
 이천닭사부일체 ,https://blog.naver.com/kangkys?Redirect=Log&logNo=221720539079,대박예감... 다들 오랜만에 맛있게먹고.. 닭곰탕도 먹어본다.. 깔끔한맛.. 밑반찬으로 김치랑 깍두기가 너무 맛있어서 계속 리필을.... 사장님 죄송^^ # 닭사부일체# 이천 하이닉스 맛집으로 등극하기를..,봄날의 아메리카노,https://blog.naver.com/kangkys,2019-11-28
 이천백숙맛집닭사부일체인생 맛집 등극!,https://blog.naver.com/free-all?Redirect=Log&logNo=221995802112,오동통한 낙지와 튼실한 토종백숙의 조화는 언제나 사랑ㅜㅜ 인생 맛집이천닭사부일체 ! 경기도이천 시 부발읍 대산로 379 103호 요즘 너무 바쁘게 지내오다가 간만에 휴무를 즐기는 날이 찾아왔어요!! 이런날... ,땅콩엔맥주,https://blog.naver.com/free-all,2020-06-10
" 이천맛집닭사부일체묵은지 닭볶음탕, 화산치즈 계란찜 먹은... ",https://blog.naver.com/autobaycarcare?Redirect=Log&logNo=222042575944,원래 사장님은이천분이 아니신데 우여곡절 끝에이천 에 자리를 잡으셨다는 # 닭사부일체가게를 하시게 된 사연이 벽면에 붙어 있었는데 사장님께 화이팅 하시라고 말씀드리고 싶다~ 사장님이 참 말도 재밌게... ,한팀장의 일상 이야기,https://blog.naver.com/autobaycarcare,2020-07-26
 이천 하이닉스맛집닭사부일체 이천 배달추천 부발읍배달추천... ,https://blog.naver.com/redrosescent?Redirect=Log&logNo=222112209746, 닭토실토실하고 먹을 것 많고 소스가... 소스가... 원래 찜닭 할 때 닭소스 사서 끓이곤 했는데 뭐 비교가 안 되죠...이천 하이닉스맛집닭사부일체 이천 배달추천 부발읍배달추천 맛 하나는 보장!! 동영상과... ,RedRoseScent,https://blog.naver.com/redrosescent,2020-10-11
 이천 맛집닭사부일체성장일기_3번째 발걸음,https://blog.naver.com/mukbang7739?Redirect=Log&logNo=221891285129,"주세요닭 사부 님^^ 주방은 분주히 돌아가고~~~ 포스기 점표는 목표지점을 향해 달린다. 특히나 주말인... 나를 그대로 드러낸다면, 그것이 바로 독창성이다. -마크 뉴슨- # 이천닭사부일체 # 이천 하이닉스맛집... ","뒷씸,뱃씸,뚝씸~!!!",https://blog.naver.com/mukbang7739,2020-04-05
" 이천 맛집닭사부일체 , 온가족이 만족한 맛집♡",https://blog.naver.com/kitiieor?Redirect=Log&logNo=221788007402,좋은기운받고 다녀갑니다♡닭사부일체경기이천 시 부발읍 대산로 379 (가좌리 100-43) 031-635-7357 # 닭사부일체# 이천 맛집 #닭칼국수 # 이천 닭칼국수 # 이천 하이닉스맛집 # 이천 닭요리 # 이천 닭볶음탕 # 이천 백숙 # 이천 닭발,키티,https://blog.naver.com/kitiieor,2020-01-28
[ 이천맛집] 맛집 뿌시기 _닭사부일체 ,https://blog.naver.com/soi1114?Redirect=Log&logNo=222280381899,앞으로 많은 음식 사진이 올라오겠네요!!ㅎㅎ 2020.12.12닭사부일체맛 ⭐⭐⭐⭐ 청결⭐⭐⭐⭐⭐ 사장님 친절⭐⭐⭐⭐⭐⭐⭐ 사장님들이 미친듯이 친절해요!! 계란찜을 잘 안먹는데 여기는 너무 맛있더라구요!!... ,요니중국어,https://blog.naver.com/soi1114,2021-03-19
 이천닭사부일체 / 이천 이색맛집/ 이천 하이닉스후문맛집추천... ,https://blog.naver.com/dubbdubb?Redirect=Log&logNo=222180404917, 이천닭사부일체 / 이천 부발맛집/ 이천 부발닭집/ / 이천 이색맛집/ 이천 이색메뉴추천/ 이천 하이닉스후문맛집추천/ / 이천 찜닭/ 이천 국물닭발/ 이천 쭈꾸미국물닭발/ / 이천 닭요리마스터셰프/ 이천 닭요리전문점... ,인생을 살며 라이프를 살다.,https://blog.naver.com/dubbdubb,2020-12-21
 이천 맛집추천이천 찜닭 맛집 찾았어요 !닭사부일체 ,https://blog.naver.com/smilehm8203?Redirect=Log&logNo=221992473012,맛집인정~그리고 사장님 너무 웃겨요ㅋ유쾌하신분같아욧이천 하이닉스맛집닭사부일체경기도이천 시 부발읍 가좌리 100-43 영업시간 11:00 -24:00 주차장매우넓음 분위기도 깔끔하고 맛도 좋아요! 요즘은 더워서... ,달콤한 인생,https://blog.naver.com/smilehm8203,2020-06-07
 이천 닭발 회식장소닭사부일체입이 즐거웠던이천하이닉스 맛집,https://blog.naver.com/hjs6034?Redirect=Log&logNo=222305661747," 이천하이닉스 회식장소이천닭사부일체영업시간: 오전11시~오후9시 30 주소:이천 시 부발읍 대산로 379 103호 예약: 0507-1332-7357 주차장: 가게 바로앞 여유있음 오후3시~오후5시 (힐링타임,브레이크타임) 매주... ",한순간도 소중하게~.,https://blog.naver.com/hjs6034,2021-04-10
[경기이천 ]닭사부일체+ 고담동 + 찜닭 + 맛집 추천,https://blog.naver.com/mnemosia0303?Redirect=Log&logNo=221710457751, 닭사부일체안녕하세요. 강마담입니다 ! 오랜만의 맛집 포스트네요 ㅋㅋ이천고담동(SK하이닉스 기숙사 동네)에 위치한닭요리 전문점입니다 ! 날이 좋았던 어느 가을 날 입사 동기들과의 체육활동 후 식사를... ,＠강마담싸롱의 왈가왈부＠,https://blog.naver.com/mnemosia0303,2019-11-17
TOP5이천닭사부일체우리 동네 반찬 가게 엄마찬스 인생 분식... ,https://blog.naver.com/pirin888?Redirect=Log&logNo=222530955892,sbs 생방송 투데이 2911회 ▽ 생방송 투데이 빅데이터 랭킹 맛집 수도권 최고의 닭볶음탕 TOP5이천닭사부일체우리 동네 반찬 가게 30년 경력 건강을 담은 일품 손맛 엄마찬스 2911회 링크... ,rin,https://blog.naver.com/pirin888,2021-10-08
 이천정원이 예쁜 카페... 묵은지 닭볶음탕 맛집닭사부일체 ,https://blog.naver.com/ksm_00?Redirect=Log&logNo=221997291714,"다 익혀서 나와서 바로 먹을 수 있다 인위적인 매운맛이 아니라 맛있게 매콤하다 볶음밥도 먹고 싶었는데 배불러서 못 먹음,, 양이 푸짐~~ 이날 점심에 오리 먹고 저녁에닭먹고..ㅎ닭사부일체 도 꼭 들러보세요",미니로그,https://blog.naver.com/ksm_00,2020-06-11
[ 이천 ] 닭사부일체- 김치가 통째로 들어간 매콤달달 닭볶음탕,https://blog.naver.com/gkwls5865?Redirect=Log&logNo=221812323284, 이천스파 가기전에 밥 먹으러 들린닭사부일체정말 맛있었다 ! 꺄아아앆!!!!!!! 재방문의사 10000 % 사장님도 음식에 대한 자부심이 엄청나셨고 그만큼 맛이 보장됐다 헉헉 존맛탱 . .추릅 넓직한 내부 네이버... ,✨HAJJANG BLOG✨,https://blog.naver.com/gkwls5865,2020-02-17
[ 이천 ] 닭사부일체 _ 이천NO.1 묵은지닭도리탕,https://blog.naver.com/thf8117?Redirect=Log&logNo=222030521953,밥막는동안 충전할 수 있어요 개꿀~ 사진찍는거 보시고 미리 주신 영화티켓과 서비스음료~ 사장님이 친절하고 재밌게 해주어서 더 좋아요!이천찐 맛집닭사부일체영업시간_11:00~23:00 주차_매장앞주차가능,잉,https://blog.naver.com/thf8117,2020-07-14
 이천하이닉스 후문 닭볶음탕이 맛있는닭사부일체 ,https://blog.naver.com/hannibal_lec?Redirect=Log&logNo=221599446174,묵은지닭볶음탕 양이 넉넉하니 둘이서 밥한공기에 초계국수까지 시켜서 무리하게 많이 먹고 왔어요.... 좋아하시는 분들은 퇴근후 반주하기 딱이에요. # 이천닭사부일체#하이닉스후문맛집 #여긴꼭 #닭볶음탕,지극히 사적인.,https://blog.naver.com/hannibal_lec,2019-07-29
2/21이천 맛집/ 우동가/ 장흥회관/닭사부일체 / 응암리막국수... ,https://blog.naver.com/dlaejr01?Redirect=Log&logNo=222251993222,3번째이천 시 부발읍닭사부일체농림 축산 식품부에서 안심식당으로 지정한 음식점. 아마... 안심식당에서 속았는지 모르겠다. 맛을 안심해도 된다는 게 아니였을 텐데 마지막으로이천부발읍에... ,나의 어릴 적 이야기,https://blog.naver.com/dlaejr01,2021-02-22
