title,link,description,bloggername,bloggerlink,postdate
종로(경복궁역) /대선칼국수 ,https://blog.naver.com/p_bo227?Redirect=Log&logNo=222535552887,"그리고대선칼국수 집을 발견! 우리 칼국수나 한 그릇 콜? 해서 들어가게 된 이곳.대선칼국수 . 메뉴는 아주 심플하고, 1인 1메뉴 주문을 부탁드린다고 쓰여 있었다. 우린 칼국수 1, 비빔칼국수 1 주문. 점심보다... ",즐거운 나의 일상,https://blog.naver.com/p_bo227,2021-10-13
경복궁역 서촌 맛집대선칼국수수육이랑 비빔칼국수 추천,https://blog.naver.com/psyche99?Redirect=Log&logNo=222520667833,"대선 미니세트 칼국수 + 수육 : 16,900원 비빔칼국수 + 수육 : 17,900원 대전에서 시작된대선칼국수 는 60년 전통, 대전 3대 손맛으로 이어온 칼국수, 수육, 두루치기가 맛있는 곳인가봐요. Since 1954 맛있게 보이기... ",제리스텔라의 일상이야기,https://blog.naver.com/psyche99,2021-09-29
브이로그/유성 유명돌구이/둔산동대선칼국수 /dcc성심당),https://blog.naver.com/crew_kw?Redirect=Log&logNo=222264144574,얼마나 그리웠는지 @둔산동대선칼국수내가 대짜 시키자고 했지.... 내 칼국수 멀리 보이는 빵씨 냉비빔 갑자기 커피요? 밥 맛있게 먹고 커피 마시고... 다시 유성 넘어옴 지마트 들려서 소주 삼 여기도 포인트... ,웃지 않는 여자,https://blog.naver.com/crew_kw,2021-03-04
수육과 칼국수 둘 다 맛있다!/대전시청 맛집대선칼국수 ,https://blog.naver.com/serenne?Redirect=Log&logNo=222466437243,2차로 대선갔어도 괜찮았을 듯 평일 낮 3시쯤 방문했더니 아주 한가했고 가게 규모가 어마어마해서... 또 갈게유 ~~ #대전칼국수맛집 # 대선칼국수 본점 #대전 대선칼국수#둔산동맛집 #대전시청맛집... ,알 이즈 웰!,https://blog.naver.com/serenne,2021-08-12
"대전 둔산동_ 대선칼국수(맛있는녀석들 칼국수, 수육)",https://blog.naver.com/bsbmlf?Redirect=Log&logNo=222488348755,"# 대선칼국수#대전칼국수 #대전 대선칼국수#둔산동 대선칼국수#생생정보 대선칼국수#맛있는녀석들칼국수 대전하면 칼국수가 유명하다고 하는데, 1) 오씨칼국수 2) 공주칼국수 3)대선칼국수이렇게 세 개가 많이... ",지미손 퍼스티지,https://blog.naver.com/bsbmlf,2021-08-30
"서울 경복궁, 숨은 수육 맛집 ( 대선 칼국수 )",https://blog.naver.com/ciclista?Redirect=Log&logNo=222156364930,"집이 근처라, 지나다니면서 스타벅스 위칼국수집으로 기억이 남는 집인데... 짝꿍이 인스타에 올라온... 식당 이름이대선 이라 그런가?? 했더니.... (씹혔어요...) 메뉴 확인해 주세요. 술값이 비싼 편. 공깃밥도... ",Lumpen[de]: not jobless but nomad,https://blog.naver.com/ciclista,2020-11-27
[배재대/꿀팁]대전 맛집 추천 ‘ 대선 칼국수 ’,https://blog.naver.com/paichaiuniv?Redirect=Log&logNo=222424334271,개인적으로 제일 고소하고 맛있었던 것 같아요 :D 그다음 칼국수는 국물이.. 진국이었습니다 이래서 다들대선칼국수 ~대선칼국수 ~ 하나 봐요 국물에서 전통의 맛을 느껴버렸습니다.. 휴~ 이 중독적인 맛... ,다양한 기회! 그래_배재로! 배재대학교 공식블로그,https://blog.naver.com/paichaiuniv,2021-07-08
대전맛집 대전시청역맛집대선칼국수 본점 (관평점은 아웃),https://blog.naver.com/anjanjajaj?Redirect=Log&logNo=222107081346,오니까라는 마음인건지 배신감 느껴지네요대선칼국수 는 본점으로 가세요!! 본점 추천입니다 영업시간 매일 12:00 - 22:00 명절 당일 휴무 # 대선칼국수#대전맛집 #대전맛집칼국수 #대전시청역맛집 #대전 대선칼국수 ,영감얻은할머니,https://blog.naver.com/anjanjajaj,2020-10-05
7/15/목스타벅스 싱잉랜턴 예약과 수령대전대선칼국수 ... ,https://blog.naver.com/ipsae72?Redirect=Log&logNo=222433678289,"곳)대선칼국수식당에 가서, 전에 재료소진으로 못먹었던 수육이랑 비빔칼국수를 먹기로 했다. 앞다리살인 듯 한데 진짜 부드럽고 냄새도 안났다. 집에서 하면 왜 이런 맛이 안나는지ㅋ 수육 하나랑 비빔칼국수... ",내가살아온흔적들,https://blog.naver.com/ipsae72,2021-07-16
[대전 관평동]대선칼국수관평점 - 더할 나위 없이 맛있었던... ,https://blog.naver.com/rakuraku1?Redirect=Log&logNo=222528911110,"칼국수 치고는 꽤 얇은 면을 사용하는 냉비빔국수 내용물은 김, 간고기, 고추장, 대친 부추, 칼국수면 이렇게 아주 심플하다.대선칼국수 에서 직접 담은 고추장이 잘 섞일 수 있도록 구석구석 세심하게... ",라꾸라꾸의 심플맛집블로그,https://blog.naver.com/rakuraku1,2021-10-06
 대선칼국수 ,https://blog.naver.com/seoka35?Redirect=Log&logNo=222304723004,"맛있는 녀석들에 칼국수 특집으로, 유민상이 대전에대선칼국수 에 왔다갔었다. 4명이 뭉쳐있을땐 이십끼형의 역할이 감초역할인데, 혼자떨어져지니까 그냥 표정없는 형이다. 그래서대선칼국수 를 먹어도... ",개인의 다큐멘터리,https://blog.naver.com/seoka35,2021-04-10
"대전 칼국수 맛집, 둔산동대선칼국수원픽은 비빔국수!",https://blog.naver.com/ssilove00?Redirect=Log&logNo=222226908000,"대전 칼국수 맛집대선칼국수작년 가을쯤 찍었던 묵은지 포스팅. 대전은 칼국수 축제가 열릴 정도로 유난히 칼국수가 유명한 편인데, 그래서 오랜 역사를 자랑하는 칼국수 맛집이 많다. 이번에 포스팅 할... ",취향 곳간,https://blog.naver.com/ssilove00,2021-01-31
대전 시청 맛집 두부두루치기칼국수대선칼국수본점,https://blog.naver.com/heekyeung902?Redirect=Log&logNo=222405301452, 대선칼국수메뉴판을 볼까요 칼국수 7천원 오징어 두루치기 25천원 두부두루치기 22천원 수육 小 25천원이네요 보통 가격인듯!ㅎㅎ 칼국수 가격이 젤 착하죠*.*대선칼국수대전시청 본점은 두부두루치기/칼국수... ,"남다른 마케터, 릴리제이",https://blog.naver.com/heekyeung902,2021-06-21
대전 맛집 꼭 가야하는 식당대선칼국수 ,https://blog.naver.com/corea1018?Redirect=Log&logNo=222319542375,"오징어두루치기도 시켜먹어 봤는데, 개인적으로대선칼국수 는 국물칼국수 + 수육 소 or 중으로 시켜먹는게 가장 베스트라고 생각된다. 그리고 칼국수 국물은 계속 리필해 주신다. 속풀리는 맛!!!!!! 또 먹고싶다.ㅠ... ",정다운나라 입니다.^-^*,https://blog.naver.com/corea1018,2021-04-22
[경복궁 칼국수 맛집] 60년 전통대선칼국수_ 칼국수... ,https://blog.naver.com/agi0975?Redirect=Log&logNo=222362724241,"전통대선칼국수_ 칼국수, 두부두루치기 주차는 건물끼고 우회전으로 들어오면 뒷편에 주차장이 마련되어 있었어요. 1층에서 2층으로 올라오는 계단 양옆으로 연예인들, 유명인들 싸인이 가득 붙여져... ",아지의 여행과 맛집이야기,https://blog.naver.com/agi0975,2021-05-23
[둔산동맛집]대선칼국수/ 대전 칼국수 맛집,https://blog.naver.com/psy1425?Redirect=Log&logNo=222525048799,ㅁㄱ 선수가 전날부터 우리 송중기 맛집 가는 거라고 했는데 사장님과 송중기 배우님이 찍으신 사진이 이렇게 떡하니 걸려있었다 ㅋㅋㅋㅋ대선칼국수메뉴 및 가격대선칼국수 에서는 칼국수 외에도 여러... ,LOVE YOURSELF,https://blog.naver.com/psy1425,2021-10-03
[대전/시청]대선칼국수 . 두부두루치기 전문점,https://blog.naver.com/granado92?Redirect=Log&logNo=222357164385,대전 / 시청대선칼국수두부두루치기 전문점 대전에 도착해 M을 만나서 셋이서 밥을 먼저 먹으러... 칼국수 반죽은 콩가루를 섞어 직접 손으로 만들고 썰기 때문에 면이 부드럽고 고소하다. 칼국수와... ,다시 돌아오지 않는 젊음에 대한 완전한 탐닉,https://blog.naver.com/granado92,2021-05-23
경복궁 가을 나들이 그리고 경복궁역 .서촌 맛집대선칼국수 ... ,https://blog.naver.com/gabrielacsy?Redirect=Log&logNo=222527820593,000 원으로 무난한 편입니다 우린대선칼국수대표메뉴인 칼국수와 수육을 주문했어요 개인적으로 국수집은 김치가 맛있어야 한다고 생각하는데대선칼국수김치는 맛있었어요 주문한지 오래지나지 않아... ,a la carte ♡ beauty,https://blog.naver.com/gabrielacsy,2021-10-05
[2019 대전] 1박 2일 -대선칼국수/ 이봌커피 / 82년생 김지영,https://blog.naver.com/atonement421?Redirect=Log&logNo=221695028974,이상하게 대전에 칼국수 맛집이 많고요ㅋㅋ 그래서 이틀 연속으로 칼국수 뿌시기로 했음. 첫 번째 칼국숫집은 둔산에 있는대선칼국수 . 아니 이런데 칼국숫집이?! 하게 생긴 건물 2층에 있다. ㅎㄱ언니가... ,A fateful life,https://blog.naver.com/atonement421,2019-11-02
대전 둔산동 맛집 50년 노포대선칼국수 ,https://blog.naver.com/dlrnrrns?Redirect=Log&logNo=221884695186,집밥칼국수의 느낌이 남.(보통 칼국수집들의 김치는 겉절이가 많은데 대선의 김치는 잘 익은 김치라서... 오늘은 대전 50년 노포 #대전노포 #대전칼국수 # 대선칼국수포스팅을 하려고 합니다. 얼마 전 대전에... ,가지가지 이국군의 블로그,https://blog.naver.com/dlrnrrns,2020-04-01
유명하고 칼국수도 맛있지만 수육이 제일 맛있다 [ 대선칼국수 ]... ,https://blog.naver.com/wolfin?Redirect=Log&logNo=221787929759,"오씨칼국수,대선칼국수 , 온천칼국수, 광천식당등이 많이 언급되는데요, 그중의 하나인대선칼국수 입니다. 약간 의외의 장소네요 이제까지 방문한 칼국수집들이 전부 1층에 있는 단독건물에 다소 오래된듯한... ",술마시는 일상,https://blog.naver.com/wolfin,2020-01-30
대전 맛집 둔산동 60년전통대선칼국수 ,https://blog.naver.com/jw993?Redirect=Log&logNo=222255165039,시원하고 비빔국수 비비기 전에 면을 몇가닥 넣어 후루룩 먹어봤는데 칼국수도 맛있을 것 같다!! 후루룩 전날 먹은 술이 다 해장됐다 # 대선칼국수#대전칼국수 #대전맛집 #둔산동맛집 #대전시청맛집,잡다한 일상의 기록,https://blog.naver.com/jw993,2021-02-24
[대전맛집] 대전하면 역시 칼국수!대선칼국수 ,https://blog.naver.com/baeyeona?Redirect=Log&logNo=222379214544,나는 왠지 시골냄새나는 곳에 있는 칼국수 집을 생각했는데 상가 칼국수 느낌 ㅋㅋㅋㅋ 2층으로 가면 나오는대선칼국수 ❤️ 되게 웅? 여기 맞아? 하는 외관 ㅋㅋㅋㅋㅋ 내부가 진짜 어엄청 넓다! 우리는 5시쯤... ,Kathy's story,https://blog.naver.com/baeyeona,2021-06-01
대전맛집대선칼국수방문후기,https://blog.naver.com/tbvjahepf1?Redirect=Log&logNo=222518418411,# 대선칼국수#대전맛집 #대전칼국수 #칼국수맛집 #해장칼국수 #비빔국수 #냉비빔 #온비빔 남치니가대선 칼국수엄청 맛있다고 노래를 불러서 칙칙폭폭 기차타고 대전을 방문했다. 칼국수 먹으러!!! 대전에는... ,뷰목민 밍디의 나다운 컬러,https://blog.naver.com/tbvjahepf1,2021-09-27
통의동대선칼국수 ,https://blog.naver.com/eflower67?Redirect=Log&logNo=222395157070,"버섯 칼국수 등 많은 종류가 있다.대선 칼국수 는 식당 위생에서 상당히 높은 수준을 유지하고 있다. 내점 고객에게는 500ml 생수가 제공되며, 반찬 접시등의 기물이 새것이 아님에도 상당히 깨끗했다. 수저... ",Run - toyou !!! Win 2021 !!!,https://blog.naver.com/eflower67,2021-06-12
 대선칼국수대전 둔산동 오래된 두루치기 맛집,https://blog.naver.com/pradaoppa?Redirect=Log&logNo=222490374921,대전 둔산동 오래된 두루치기 맛집대선칼국수 에 들러보았습니다. 메밀소바 전문 미진이 있는 건물의... 칼국수가 어떻게 보면 상호에도 있고 메인인 집이겠으나 수육과 두루치기를 먹는 사람들이 더 많았는데... ,도시빈민 생활기,https://blog.naver.com/pradaoppa,2021-09-10
대전 둔산동 맛집 -대선칼국수 ,https://blog.naver.com/aprilyj?Redirect=Log&logNo=221735541819,좌식룸도 있어 아이들도 같이 먹기 좋았어요대선칼국수메뉴는 아래와 같아요! 가게 이름처럼 칼국수가 메인이지만.. 두루치기가 더 맛있다는 후기들도 많이 보이더라구요!ㅋㅋ 찬은 비루해요ㅋㅋ 사실... ,COJUCOI,https://blog.naver.com/aprilyj,2019-12-13
[대전/맛집] 대전 시청 칼국수 맛집 ' 대선칼국수 ',https://blog.naver.com/ddoyoung0_0?Redirect=Log&logNo=222494054206,오늘은 제가 정말정말 좋아하는 칼국수 맛집을 들고 왔습니다 대전시청 근처에 위치한대선칼국수입니다!!! 아마 대전에 사시는 분들은 꽤 많이 아실거에요! 그만큼 정말 맛있고 유명한 곳이랍니당 방송에도... ,또용의 일상,https://blog.naver.com/ddoyoung0_0,2021-09-03
대전 둔산동대선칼국수 ,https://blog.naver.com/rudalsgmlduq?Redirect=Log&logNo=222513346912,2021-06-22 방문 전부터 한 번 방문하고 싶었던대선칼국수 . #맛있는녀석들 319회에서 나왔을 때도 가보고... 칼국수2 비빔국수2 수육 주문했습니다. 210622 메뉴판 내부는 테이블도 많고 사람도 많고 시끌시끌했어요.... ,다시 시작하는,https://blog.naver.com/rudalsgmlduq,2021-09-22
대전 두부두루치기 맛집대선칼국수 !,https://blog.naver.com/ll00vvee?Redirect=Log&logNo=221834260821,칼국수를 주문을 하였답니다!! 테이블마다 이렇게 마음껏 덜어서 먹을 수 있도록 김치가 준비되어 있었어요! 잘 익어서 시원하고 아삭한 맛이 일품이었답니다. 대전 두부두루치기 맛집대선칼국수 는 이렇게... ,달려라포티 Daily Life,https://blog.naver.com/ll00vvee,2020-03-17
대전맛집 관평동대선칼국수 ,https://blog.naver.com/anjanjajaj?Redirect=Log&logNo=222052258584,(오징어두루치기+칼국수)대선칼국수두루치기는 진짜 기가막힙니다 불맛이 세지도 않고 양념맛이 강하지도 않고요 오늘 같이 간 직원의 말을 빌리자면 “이런 음식에 술을 마시지 못하다니!” 였습니다 오늘... ,영감얻은할머니,https://blog.naver.com/anjanjajaj,2020-08-05
서촌에도 있는 대전 1등 칼국수대선 칼국수 ,https://blog.naver.com/skyland_?Redirect=Log&logNo=222530984881,"# 대선칼국수#칼국수 #서촌 #경복궁 #맛집 오늘 포스팅할 곳은 서울에서는 아직 덜 유명하지 만 대전시람들은 다 아는대선칼국수 이다. 대전에 서는 줄서서 먹는다는데, 서울은 아직 아니었다. 위치는 서촌... ",Lets get it!!,https://blog.naver.com/skyland_,2021-10-08
"해물칼국수, 대전대선칼국수서울 서촌점 멸치칼국수, 파주... ",https://blog.naver.com/zephyr122059?Redirect=Log&logNo=222287476066,"◆맛녀석 종로 찬양집 해물칼국수, 대전대선칼국수멸치칼국수◆ 요즘 자주 가게 되는 종로를 다녀왔습니다. 맛있는 녀석들 칼국수 시청자 추천 맛집에 소개되는 종로구 종로3가역 찬양집의 해물칼국수, 대전... ",사랑이 밥먹여준다,https://blog.naver.com/zephyr122059,2021-03-26
경복궁역 칼국수맛집대선칼국수 ,https://blog.naver.com/nyj8701?Redirect=Log&logNo=222514486790,ㅎㅎ 칼국수는 평범했지만 비빔국수는 맛있게 먹었어요!! 경복궁역 칼국수 맛집대선칼국수오래된 맛집이지만 호불호가 있을것같고 비빔국수는 입에 정말 잘맞았어요~!!,Cherish_you,https://blog.naver.com/nyj8701,2021-09-23
대전 시청역 칼국수랑 먹는 두루치기대선칼국수 ,https://blog.naver.com/leejk910409?Redirect=Log&logNo=222112173368,밑에 미진이라는 유명한 소바집도 있는데 여기는 여름엔 줄서서 먹더라구요~~ 대전 시청대선칼국수메뉴판 가격 저희는 세명이서가서 오삼두루치기랑 칼국수 하나 공기밥 하나를 시켰어요ㅎㅎ 두루치기는... ,몰리의 블로그 :),https://blog.naver.com/leejk910409,2020-10-10
가장 긴 벚꽃길 회남로벚꽃길대전 칼국수 맛집대선칼국수 ,https://blog.naver.com/ipsae72?Redirect=Log&logNo=222300148537,나도 저녁을 안먹고 나가고 울신랑도 저녁을 안먹고 나온터라 집에 가기 전에칼국수맛집에서칼국수 랑 수육을 먹고 가기로 했다. 들어가며 열재고 손소독하고 이름 전화번호 우리 둘 다 기재하고 그리고... ,내가살아온흔적들,https://blog.naver.com/ipsae72,2021-04-06
"대전 관평동 맛집 스시덴고쿠,대선칼국수/ 대청호 카페 글레버",https://blog.naver.com/lsr0920?Redirect=Log&logNo=222388441723," 대선칼국수많이 가봤는데,, 수육은 처음 먹었다! ㄷㅇ이가 다른 날보다 맛이 없다고 했다ㅠ ㅠ 우리는 수육, 비빔칼국수, 칼국수를 주문했다~ 칼국수 열심히 비비는 ㅇㅈ. ㄷㅇ쓰가 추천해서 주문한 비빔칼국수!... ",G u t e n T a g !,https://blog.naver.com/lsr0920,2021-06-08
대전대선칼국수60년 전통 두루치기 꼭 시키세요!,https://blog.naver.com/hhhlang2?Redirect=Log&logNo=222539903928,대전오면 꼭 먹어야하는 칼국수집 중 하나로 추천드립니다.#대전 #대전맛집 #대전칼국수 # 대선칼국수#오삼두루치지 #대전 대선칼국수#비빔칼국수 #칼국수 #수육 #생두부,가장 보통의 존재,https://blog.naver.com/hhhlang2,2021-10-17
대전 시청역 60년 전통대선칼국수 ,https://blog.naver.com/gnayhush?Redirect=Log&logNo=222516734965,"ㅋㅋㅋㅋㅋㅋㅋㅋ 처음엔 공주 스타일의 얼큰이 칼국수를 먹으려다 시청역 부근에 있는 비빔칼국수 맛집,대선칼국수 로 결정! 시청역 8번 출구에서 가깝습니다. 가게는 상당히 넓은 편이고 사람이 많아서 내부... ",Buen Vivir,https://blog.naver.com/gnayhush,2021-09-25
대전맛집- 수육비빔칼국수 [ 대선칼국수 ],https://blog.naver.com/2bthebest1?Redirect=Log&logNo=222536201496,대전 둔산동 맛집 60년 전통대선칼국수나의 대전 최애 맛집 칼국수 집이지만 나에겐 수육맛집!! 대전 시청역 하이마트 뒷골목 영업시간 10:00~22:00 (명절당일 휴무) 주차는대선칼국수앞쪽 형성주차장 1시간... ,꽁끄,https://blog.naver.com/2bthebest1,2021-10-13
"관평동 배달,포장가능한 칼국수대선칼국수 ",https://blog.naver.com/fineart1114?Redirect=Log&logNo=222085576009,"관평동 배달, 포장가능대선칼국수칼국수 7,000원 오삼두루치기 28,000원대선칼국수 는 둔산동에 있는 60년전통의 칼국수집인데 관평동에도 지점을 냈더라구요. 칼국수, 비빔칼국수, 냉비빔칼국수가 있고 수육... ",세상의모든 리뷰,https://blog.naver.com/fineart1114,2020-09-10
대전 맛집ㅣ둔산동 ' 대선칼국수 ' 두부두루치기 칼국수 맛집,https://blog.naver.com/onlyhw2?Redirect=Log&logNo=222290332513,"대전 ' 대선칼국수 ' 칼국수맛집 유명 연예인 송중기, 조인성도 왔다간 알아주는 대전 칼국수 맛집대선칼국수 / 두부두루치기 맛집 60년 전통의 대전대선칼국수다녀왔어요 :) 둔산동 맛집으로도 유명한... ","꽃혜, daily :/)",https://blog.naver.com/onlyhw2,2021-03-28
대전 칼국수 맛집 수육 두루치기 존맛!!대선칼국수 ,https://blog.naver.com/mooongchu?Redirect=Log&logNo=221966921745,"맛집은대선칼국수 !! 칼국수, 두루치기, 수육까지 먹을 수 있는 곳이다 대전복합터미널에서는 거리가 좀 있는 편! 터미널에서 또 버스를 타고 30분 정도? 이동한 것 같다 점심시간에 맞춰 대전 칼국수 맛집에... ",작전명 : 뭉츄,https://blog.naver.com/mooongchu,2020-05-17
"[맛집] 경복궁 주변, ' 대선칼국수 '",https://blog.naver.com/oriols42?Redirect=Log&logNo=222235805367,"경복궁 투어 마치고 서촌 주변에서 칼국수 먹을만한 곳이 없나 찾다가 ' 대선칼국수 ' 가 눈에 띄어 이곳에서 식사. 아주 오래되고 유명한 가게라는데 1954년부터 영업 시작, 60년 이상된 가게이고, 내부 구조나... ",율리우스 시저,https://blog.naver.com/oriols42,2021-02-07
컴퓨터 변리사 점심 맛집 : 칼국수 끝판왕 대전대선칼국수 ,https://blog.naver.com/ramutan?Redirect=Log&logNo=222499035956,이런 대전에서도 60년 넘게 최고의 칼국수 집으로 꼽히는 곳이 바로대선칼국수 입니다. 제가 가장 사랑해마지 않는 대전 맛집입니다. 의외로 외지분들에게는 아직 그리 안 알려져서 다행이라고 생각하는... ,스타트업도 하는 컴퓨터 변리사,https://blog.naver.com/ramutan,2021-09-08
[대전]대선칼국수 ,https://blog.naver.com/yssh923?Redirect=Log&logNo=221692740799,"사진은 나올때 찍었지만, 주말 점심에 방문했었는데 식당안에 사람들이 빼곡했음대선칼국수 의 메뉴들. 우리는 칼국수랑 냉비빔국수, 그리고 오삼두루치기와 공기밥을 주문했다 많은 사람들이 기댄 흔적.jpg... ",언젠가는 세계일주,https://blog.naver.com/yssh923,2019-10-30
대전타임월드 11층 고메이월드대선칼국수칼국수... ,https://blog.naver.com/clrhk0106?Redirect=Log&logNo=222518307742,타임월드 고메이월드대선칼국수 에서 칼국수와 두부두루치기를 아주 맛있게 먹은 내돈내산 후기였습니다~ #대전갤러리아타임월드맛집 #대전갤러리아 대선칼국수#대전갤러리아타임월드11층고메이월드... ,꿈꾸는엄마,https://blog.naver.com/clrhk0106,2021-09-27
둔산동 -대선칼국수 ,https://blog.naver.com/ssss_414?Redirect=Log&logNo=222410352272,210624 먹킷리스트 중 한 곳인대선칼국수다녀왔어요 :) 척 봐도 입구부텀 연식이 꽤 되어보이는. 근처 형성주차장?인가 거기 1시간 무료주차 가능해서 거기다 주차했어요. 두명이서 수육 소자 칼국수 2개... ,블로그명을 입력하세요 :^),https://blog.naver.com/ssss_414,2021-06-25
서촌맛집 대선칼국수 ,https://blog.naver.com/lovecherub1026?Redirect=Log&logNo=222502766787,"연예인, 정치인. 청와대 옆이라 그런가.. 싸인구경 세트메뉴보단 단품으로 추천! 깔끔하게 잘 먹었다~ # 대선칼국수#서촌식당 #서촌칼국수 #경복국식당 #서촌맛집",boni님의블로그,https://blog.naver.com/lovecherub1026,2021-09-11
대전관평동맛집대선칼국수 ,https://blog.naver.com/beer2580?Redirect=Log&logNo=222527119965,먹고나온 #테크노밸리 #대전관평동맛집 # 대선칼국수이렇게 맘껏 먹고다니니 배가안나오는게 이상하지~~~ 아재들 배나오는거 인정~~~ ㅋ 대선칼국숫집에가서 #칼국수 는 안먹고 #수육 과 #오징어두루치기... ,우리동네 배달은 대전배달대행,https://blog.naver.com/beer2580,2021-10-05
(대전 둔산동)대선칼국수 ,https://blog.naver.com/suyoung704?Redirect=Log&logNo=222515389024,#대전시청맛집 #대전둔산동맛집 #대전칼국수맛집 #둔산동맛집 # 대선칼국수#현대아이텔맛집 #대전둔산우체국맛집 #대전두부두루치기 #두부오징어두루치기 아침에 영화보러간 인서할무니 인서이모랑... ,인서맘의 취향공유,https://blog.naver.com/suyoung704,2021-09-24
서촌 칼국수 맛집대선칼국수 에서 칼국수 한그릇,https://blog.naver.com/bymina123?Redirect=Log&logNo=222535434714,칼국수 한그릇 양이 어마어마하고 면이 약간 특이했어요 제가 요근래 먹었던 칼국수는 면이 다 네모(?)났는데대선칼국수 의 면은 약간 둥근면! 쑥갓이 올라갔는데 저는 쑥갓이 칼국수랑 잘 어울린다고 생각하지... ,개인의 취향,https://blog.naver.com/bymina123,2021-10-13
비 오는 날엔 칼칼한 두루치기 한 판! # 대선칼국수 ,https://blog.naver.com/lmgmedia?Redirect=Log&logNo=222535117646,두루치기를 시키면 나오는 칼국수 국물 함께 나오는 칼국수 국물도 예술이었습니다. 매콤해졌을 때 한 번 마셔서 다시 Reset. # 대선칼국수너무 만족하고 맛있게 먹고 온 곳이었습니다.,Record.,https://blog.naver.com/lmgmedia,2021-10-12
둔산동대선칼국수 ,https://blog.naver.com/xing16?Redirect=Log&logNo=222498422042,좋은 칼국수를 기차 손님들이 많이 찾아서였다던데. 열심히 먹는데 어느 순간 80년도 대전역 간이 매장에서 기차 기다리며 급히 후루룩 먹던 국수가 이런 맛이었을까? 싶은 생각이 들었다 ㅎㅎ대선칼국수 ... ,처음으로 일어서기,https://blog.naver.com/xing16,2021-09-07
 대선칼국수대전시청 수육 맛집 오징어 두부두루치기 칼국수... ,https://blog.naver.com/ssunypd?Redirect=Log&logNo=221797583353,대전 둔산동 맛집대선칼국수대전시청 수육 맛집 오징어 두부두루치기 칼국수 맛집 #대전둔산동맛집 #대전시청맛집 #대전 대선칼국수# 대선칼국수#대전시청 대선칼국수#대전맛집 #대전수육맛집... ,대전반찬배달/대전반찬맛집,https://blog.naver.com/ssunypd,2020-02-05
