title,link,description,bloggername,bloggerlink,postdate
"경복궁역 맛집,대선칼국수 에서 아침식사 :)",https://blog.naver.com/rdg80767?Redirect=Log&logNo=221783511078, 대선칼국수# 대선칼국수#경복궁역맛집 #종로 대선칼국수#종로칼국수 차가운 아침바람 속에서 찾은... 대선 미니세트(두루치기)랑 비빔국수 주문했다. 칼국수. 국물이 시원하고 얼큰해서.. 추웠던 속이 달래졌다.... ,걷는 듯 천천히,https://blog.naver.com/rdg80767,2020-01-24
 대선칼국수 (대전),https://blog.naver.com/bluebirdnest?Redirect=Log&logNo=222518706500,대전 원광대 치과 갔다가 근처대선 칼국수집에 들렀어요 매번 갈때 마다 항상 많은 사람들이 꽉 차 있어요 칼국수 양도 넉넉하고 가격도 착하네요 비빔 칼국수도 구수한 육수가 곁들여 나와 옛날 어머니... ,파랑새의 둥지,https://blog.naver.com/bluebirdnest,2021-09-27
대전대선칼국수 ,https://blog.naver.com/papio?Redirect=Log&logNo=222489564395,생각안날거 같은 생각 카운터 옆으로 수육 썰고있는 이모님 갠적으로 카운터옆에서 써는건 좀 비 위생적인것 같당 #대전칼국수맛집 #대전맛집 #대전 대선칼국수#대전수육맛집 # 대선칼국수#대전오징어두루치기맛집,南姬의 storyline,https://blog.naver.com/papio,2021-08-31
경복궁역 서촌 칼국수 맛집대선칼국수시원해요:),https://blog.naver.com/white06214?Redirect=Log&logNo=222542655839,# 대선칼국수#서촌칼국수맛집 #경복궁맛집 #그라운드시소서촌맛집 #경복궁역칼국수맛집 서촌 칼국수 맛집대선칼국수 는 100평 규모로 단체회식이나 모임 장소로 안성맞춤인 식당이예요~^^ 코로나로 사람없는... ,Always on my mind..,https://blog.naver.com/white06214,2021-10-20
[대전식당]대선칼국수 -수육.칼국수.비빔국수(서구.둔산동),https://blog.daum.net/chulinbone/9081,"[대전식당]대선칼국수 -수육.칼국수.비빔국수(서구.둔산동) 댓글 0 지구별음식이야기/대전시먹거리 2021. 4. 9. 60년 ,대선칼국수, 대전맛집 , 대전식당 , 둔산동 , 비빔국수 , 서구 , 수육 , 칼국수 20210406... ",철인뼈다귀의 지구별여행기,https://blog.daum.net/chulinbone,2021-04-09
대전 맛집 60년 전통 칼국수대선칼국수 ,https://blog.naver.com/nanacook?Redirect=Log&logNo=220627168943,"대전 맛집 60년 전통 칼국수대선칼국수대전에서 흔한것이 칼국수집 사실, 대전 살때는 칼국수는 그다지 좋아하는 면류는 아니라서 일부러 챙겨 먹진 않았던것 같은데 몇년 사이 대전을 찾으면 얼큰이 칼국수... ",Nana's kitchen,https://blog.naver.com/nanacook,2016-02-16
[대전 둔산동]수육 맛집대선 칼국수 ,https://blog.naver.com/esrastyle?Redirect=Log&logNo=220928397327,"이름은대선 칼국수 이지만 내 입맛엔 칼국수는 보통이었고 (부드러운 면은 정말 맛있음), 수육이랑 두루치기가 핵꿀맛이었음 특히 수육은 지금까지 먹어본 것 중 손에 꼽힐 정도로 맛있었음 부드러우면서도... ",박돌핀의 맛집 원정대,https://blog.naver.com/esrastyle,2017-02-07
(대전) 대원칼국수(구대선칼국수 ),https://blog.naver.com/soulbrown1?Redirect=Log&logNo=221049512550,대전의 구도심 대흥동에 위치한 대원칼국수. 본래 상호명은대선칼국수 였는데 어찌 된 영문인지 대원칼국수로 바뀌면서 이전까지 했다.대선칼국수 라는 상호는 둔산동의 지점에서 사용하고 있는데 살짝... ,완소나얼,https://blog.naver.com/soulbrown1,2017-07-18
둔산동 맛집대선칼국수여러분들은 가 보셨나요?,https://blog.naver.com/jeju8253?Redirect=Log&logNo=220909578964,"둔산동 맛집대선칼국수여러분들은 가 보셨나요? 지인이 정말 맛있는 식당이 있다고 해서 가보게된... 셋이 칼국수, 비빔국수, 오삼두루치기를 주문했어요 밑반찬은 간단합니다~ 김치는 덜어서 먹고 마늘과... ",World made of Light,https://blog.naver.com/jeju8253,2017-01-12
둔산동 맛집 대전대선칼국수 ,https://blog.naver.com/style0716?Redirect=Log&logNo=221043461862,둔산동 칼국수 맛집대선칼국수 에서 한번 맛보시길요 :) 둔산동 맛집 대전대선칼국수☎ 042-471-0317 대전시 서구 둔산동 1440 오성빌딩 2층 둔산중로 40번길 28 영업시간 _ 매일 12:00 ~ 22:00 명절 당일 휴무!! 주차는... ,쏘쏘의 초록식탁,https://blog.naver.com/style0716,2017-07-04
"통의동- 대선칼국수 ,서수남의맛집이야기",https://blog.naver.com/suhsoonam?Redirect=Log&logNo=220679797539,유명브랜드로는 명동칼국수가 있구요 대전에대선칼국수 유명하다 하네요 60년 전통의대선 칼국수그명성은 처음 접하게 되었는데 맛이 과연 어떨지 기대가 됩니다대선칼국수 의 소문난 메뉴는 돼지수육... ,서수남의 마이라이프,https://blog.naver.com/suhsoonam,2016-04-11
경복궁역맛집@60년 전통대선칼국수추천,https://blog.naver.com/goonies79?Redirect=Log&logNo=220807422474,있는대선 칼국수다녀왔어요 대전이 본점인데 서울 분점이 생겼더라구요 60년 전통대선칼국수100평... 대선세트에 포함된 칼국수 단품메뉴보다는 약간 작은 사이즈인데 저 혼자 먹기 딱 적당한 양이더라구요... ,일상블로거,https://blog.naver.com/goonies79,2016-09-08
"대전대선 칼국수 ,두부오징어두루치기와 칼국수!",https://blog.naver.com/bjnalda?Redirect=Log&logNo=221036848447,가본대선 칼국수 . 너무 맛있어서 정신 못차리고 사리추가의 추가를 외쳐가며 먹었던ㅋㅋ 그 이후로 계속 그 맛이 생각나서 비도 오겠다 칼국수 먹으러 고고~ 두번째였지만 간판 찾기는 역시 조금 어려운 길.... ,원하는것을 원할수 있기를 원해.,https://blog.naver.com/bjnalda,2017-06-25
대전대선 칼국수 ,https://blog.naver.com/domo69?Redirect=Log&logNo=150154058971,친구와 함께 간단하게 먹으러 갔던대선 칼국수 . 맑고 깊은 멸치 육수의 맛은 오랜만에 맛보는 고향 추억의 맛. 얼큰한 고추장 칼국수는 고향의 식당에서만 맛을 경험했다면 맑은 멸치 육수의 맛은 고향 어디서나... ,인생 유감(有感) ...,https://blog.naver.com/domo69,2012-12-15
[Daejeon]대선칼국수@ 대전,https://blog.naver.com/jheebaby27?Redirect=Log&logNo=220907251648,두부두루치기대선칼국수 의 포인트는 고추장 직접담근 고추장이라 이곳만의 감칠맛나는 장맛이 있음 츄릅 보통은 그냥 칼국수를 먹는데 이날따라 비빔국수가 땡겼음 같은 고추장 양념이라 입에 착착붙는... ,Muse De Weekend,https://blog.naver.com/jheebaby27,2017-01-10
대전맛집대선칼국수 / 홍루이젠,https://blog.naver.com/s2s2u88?Redirect=Log&logNo=221422486121,대전-청주 상주하시는 믿고보는 맛집감별러 도하님 블로그에서 봤던대선칼국수저도 가 보았습니다 도하님말로는 셋이가야 완벽할코스를 맛볼수있다고하셨다 칼국수+오징어두루치기+수육... 둘이먹기는 좀... ,귤먹으면손이노래,https://blog.naver.com/s2s2u88,2018-12-22
[경복궁역맛집] 대선칼국수 ,https://blog.naver.com/loving8792?Redirect=Log&logNo=221366709695,#경복궁역맛집 # 대선칼국수#주말에 #직장인점심 #서촌맛집 #와이파이가능 #비빔칼국수 #두루치기 #에그타르트 #서촌데이트 60년 전통에 대전3대 손맛이라는대선칼국수아이쿠야 입구에 뭔 싸인이 이렇게 많아.... ,"""Happy Day""",https://blog.naver.com/loving8792,2018-09-28
 대선칼국수비빔국수 맛있다,https://blog.naver.com/qmfnehr00?Redirect=Log&logNo=221366660626," 대선칼국수비빔국수 맛있다 2주전쯤, 비가 좀 내리던 일요일 이였나 남편이랑 볼일있어서 나갔다가 갑자기 가게 된대선칼국수대전은 칼국수집이 정말 많고 맛집도 정말 많음 ㅋㅋㅋㅋㅋ 한 7곳은 가봤는데... ",푸드퐈이터의 힐링(육아)라이프,https://blog.naver.com/qmfnehr00,2018-09-27
대전대선칼국수 ,https://blog.naver.com/qwerty9309?Redirect=Log&logNo=221186646509,"마침 삼청동에도대선칼국수 가 생겨서, 한번 가봐야겠다고 생각만 하고 있습니다. ㅋㅋ 쌀쌀한 날엔, 칼국수가 딱이죠. ^^ 대전맛집대선칼국수칼국수 맛집 대전시청 맛집 보라매공원 맛집 둔산동 맛집",무의미,https://blog.naver.com/qwerty9309,2018-01-18
대전 서구 둔산동 60년 전통맛집대선칼국수굿~,https://blog.naver.com/dhwjdtlr2381?Redirect=Log&logNo=220118491468,못가봤는데 대체휴일이라서 큰맘먹고 찾아갔습니다 혹시나가 역시나 였습니다 정말 맛있는 60년전통대선칼국수맛집였습니다 깔끔하게 덜어 먹는 열무김치 서울 명동 칼국수집 보다더 편안한 분위기가... ,오딘의 맛집여행,https://blog.naver.com/dhwjdtlr2381,2014-09-11
[대전맛집/둔산동]:: 대선칼국수 ,https://blog.naver.com/snowsdrob?Redirect=Log&logNo=140147724861,"50년의 전통을 자랑하는대선칼국수운동을 하러 가기에 앞서 간단하게 편의점에서 저녁을 때우고... *메뉴판* 칼국수도 팔고 수육도 팔고 두루치기도 팔고, 테이블마다 따로 저런 스테인리스통이 있는데... ",칸타타*,https://blog.naver.com/snowsdrob,2011-12-21
"대림미술관 맛집,대선칼국수 ",https://blog.naver.com/wingssprout?Redirect=Log&logNo=221296456381,"수육이 칼국수보다 훨씬 맛있는데, 가게 이름은 ' 대선칼국수 '라는 아이러니... 그런데 수육의 엄청난 맛에도 불구하고 가격이 비싸다는 느낌은 지울 수 없다. 동네가 임대료 비싼 동네라서 그런가.","날아보자, 날마다 반짝반짝",https://blog.naver.com/wingssprout,2018-06-11
[ 대전 둔산동 ]대선칼국수- 단정한 칼국수 @ .@,https://blog.naver.com/rainin01?Redirect=Log&logNo=110044632386,완젼 유명한대선 칼국수 . 아래층엔 유명한 미진 ㅋ 서구 둔산동 1440 kk나이트 근처이다.오늘에서야... 게 많았다 ㅜ_ ㅜ 비빔국수의 유혹에 넘어갈뻔 했지만 난 칼국수 ㅎㅎ 수육은 대자로 ㅋ 돼지고기 값이... ,Mon Chou,https://blog.naver.com/rainin01,2009-03-22
"50년 전통 ' 대선칼국수 ', 고소하게 통깨가 동동",https://daejeonstory.com/4579?category=438029,입구부터 남다른 분위기를 내뿜는대선칼국수 는 칼국수는 물론 수육이 맛있는 맛집이라고 해요. 그 날 준비한 재료가 다 떨어지면 메뉴를 주문할 수 없다고 하네요. 메뉴를 주문하면 나오는 밑반찬은 양파와... ,나와유의 오감만족 이야기,https://daejeonstory.com/,2013-08-23
 대선칼국수 ,https://blog.naver.com/seoka35?Redirect=Log&logNo=221631706307," 대선칼국수 는 무엇보다, 수육이 넘나 맛있는것.. 아닌가 맛없나... 아니 그냥 너무 내 입맛인것... 그냥...대선 ' 칼국수 ' 왔으니 또 빠질수 없는 메뉴인 냉비빔칼국수. 일반 칼국수는.. 그냥 저냥 맛임. 그냥 저냥... ",개인의 다큐멘터리,https://blog.naver.com/seoka35,2019-08-29
[경복궁역 맛집]대선칼국수- 깔끔하게 가볍게,https://blog.naver.com/pinkplum80?Redirect=Log&logNo=221284298469,"경복궁역대선칼국수 의 메뉴는 칼국수, 비빔국수, 콩국수. 수육, 두루치기, 두부 등도 있다. 맥주, 소주... 수육이 들어간 세트도 있지만 나는 그냥 칼국수만 주문했다. 근데 대선 미니세트라는 메뉴 보니 왠지... ",확장되는 공간,https://blog.naver.com/pinkplum80,2018-05-25
[대전]대선칼국수- 갤러리아 타임월드 지점,https://blog.naver.com/jdoro?Redirect=Log&logNo=221430982254,받은대선 칼국수 . 언제나처럼 나홀로세트 세트2 + 공기밥 와우 비주얼 대박 ㅋㅋ 기대 이상의 풍족함에 할말을 잃음 칼국수는 꼭 본점 가서 먹어야 된다고... 오징어 두루치기 이게 꿀맛 양파 김치 시간이 없어서... ,"지금, 먹으러 갑니다.",https://blog.naver.com/jdoro,2018-12-31
대전 칼국수 전문점 ‘ 대선칼국수 ’,https://blog.naver.com/kbj483?Redirect=Log&logNo=221279262950,"장소는 대전의 맛인 칼국수의 명가 둔산동 시청 옆 골목에 위치한 ‘ 대선칼국수 ’입니다. 일찍 도착하여 이전에 떨어져서 맛보지 못한 수육부터 주문을 합니다. 식당은 룸과 홀로 구성되어 있으며, 무척... ",빛사랑해님의 블로그,https://blog.naver.com/kbj483,2018-05-19
대전 둔산동 맛집 | # 대선칼국수 _추운 날엔 칼국수 냠냠☁︎,https://blog.naver.com/ljwon23?Redirect=Log&logNo=221461129048,넘나 마싯겠당대선칼국수칼국수 요건 칼국수에요!!! 국물 엄청나요!!!!!!! 역시 이렇게 추운날엔 뜨끈한 칼국수가 최고!대선칼국수비빔국수 이건 비빔국수에요!!! 여기 비빔국수는 다른 가게랑 맛이 좀... ,wonny’s,https://blog.naver.com/ljwon23,2019-02-08
경복궁 근처 맛집대선칼국수 ,https://blog.naver.com/nalma?Redirect=Log&logNo=220946931007,"서촌이랑도 가까운대선칼국수서촌데이트 코스로, 경복궁 근처 맛집을 찾으신다면대선칼국수 로 가서~ 드셔보세요. 아이들이랑 칼국수 먹고 스타벅스에서 아이스초코도 한잔씩 사주고... 새학기 전 외식하고... ",날마네 뜰,https://blog.naver.com/nalma,2017-02-28
"가오동 -대선칼국수- 오징어+두부두루치기,만두국",https://blog.naver.com/dream820912?Redirect=Log&logNo=57320319,정말 매운것 먹고싶었는데 매운거 파는곳이 도통 생각이안나 전에 먹었을때 적당히 매콤하고 맛있었던것 같던대선칼국수 가서 두루치기시키고 전엔 칼국수먹어봤으니 이번엔 겨울용 떡만두국으로... ,★ 땡글이 세상 ★,https://blog.naver.com/dream820912,2008-11-18
천안 갤러리아 싹 바뀐 지하푸드코너 이용하기~ ( 대선칼국수 ... ,https://blog.naver.com/smile1548?Redirect=Log&logNo=221460843715,"우리는대선칼국수 에서 칼국수 + 두부두루치기 세트 (10,900) 칼국수가 첨엔 뭐지? 했는데 자극적이지 않고 먹을수록 괜찮았던듯 아쉬웠던건 양이 좀 많이 적었당 ㅠㅠ 두부두루치기는 밥이랑 잘어울리겠드라... ",소박하게 그리고 행복하게,https://blog.naver.com/smile1548,2019-02-08
경복궁역 맛집대선칼국수정갈하고 부족함없는 맛 수육맛집,https://blog.naver.com/blog_spirit?Redirect=Log&logNo=221287471291,"대전에서 온 경복궁역 맛집대선칼국수 ! 60년 전통! 기본 칼국수, 비빔 칼국수, 그리고 콩국수를 시켰습니다. 이 비주얼대로라면 느낌 좋은데 말이죠. 개인 취향이지만 칼국수라고 호박이니, 새우니 당근이니... ",RealSelf coaching [참나코칭],https://blog.naver.com/blog_spirit,2018-05-30
경복궁역대선칼국수 ,https://blog.naver.com/kittyface?Redirect=Log&logNo=220979128492,경복궁역 3-1 또는 4번 출구로 나가면대선칼국수유명한 집이라고 해서 찾아갔다. 서울시 종로구... 어디든 넓은 창때문에 시원하고 좋다.칼국수집의 가장 중요한 김치 겉절이 대선 칼숙수의 김치는 칼칼한... ,남부 프랑스,https://blog.naver.com/kittyface,2017-04-09
경복궁 근처 맛집 60년전통대선칼국수 ,https://blog.naver.com/ayo3144?Redirect=Log&logNo=220822118574,대선세트 강추예요 기대하고 온대선칼국수면발이 아주 쫄깃하고 맛있었어요 육수국물은 멸치육수를 베이스로 했는데 아주 진한 국물과 담백하니 깔끔했어요 역시 60년 내공의 맛이랄까 꾸밈없는 칼국수맛이... ,Every day! Domazing!,https://blog.naver.com/ayo3144,2016-09-27
대전 둔산동맛집대선칼국수오징어두부두루치기,https://blog.naver.com/purehwayoung?Redirect=Log&logNo=221219830178,이렇게 칼국수 면 사리 넣어서 먹음 또 별미! 매워서 둘이 먹다가 울다가 ㅋㅋㅋㅋㅋ 술이랑 먹었으면 시원했을 텐데 - 저희는 주차장 있는 줄 모르고 계속 둔산동을 돌아다녔는데 -대선 칼국수 에서 형성... ,〃Lovely Hwai - 샤방화이 블로그♡,https://blog.naver.com/purehwayoung,2018-03-02
대전 시청역 맛집 :대선칼국수 ,https://blog.naver.com/eooming?Redirect=Log&logNo=90173005442,"포슬포슬 비오던 금요일, 모두 도시락 안싸온날- 밖에 나가서 따끈한 국물이 먹고싶어, 나선대선 칼국수 - 주변에 칼국수집을 검색해봐도, 몇군데 없어서 방문했는데, 오호- 완전 마시쏭 ㅠㅠ 날씨가 칙칙하고... ",말랑말랑 싱글라이프 ♩,https://blog.naver.com/eooming,2013-05-13
맛집] 경복궁 데이트하기 좋은 칼국수 맛집 ' 대선칼국수 ',https://blog.naver.com/gde0817?Redirect=Log&logNo=220692896663,데이트 칼국수대선칼국수대선칼국수 는 경복궁역 스타벅스 건물 바로 2층에 위치해 있어요 경복궁 맛집 서촌 맛집 통의동 맛집 경복궁 데이트 칼국수대선칼국수60년 전통의 맛집이라고 해요경복궁 맛집 서촌... ,YOUNG FOREVER,https://blog.naver.com/gde0817,2016-04-25
(대전/둔산/맛집) 대전 3대 칼국수대선칼국수 ,https://blog.naver.com/chakagi?Redirect=Log&logNo=220099553929,"대전에서 3대 칼국수 집이라고 말하는 집으로 구도심인 대전역 인근에 30년 이상 된 집들이었는데 신도분식과 대전고등학교 주변에 한곳, 그리고 지금은 둔산동으로 이사와서 법원앞에 친근한 이곳대선칼국수 ..... ",요세미티의 착한 지식창고 since 2014,https://blog.naver.com/chakagi,2014-08-21
경복궁 맛집 60년 전통대선칼국수맛을 볼까!,https://blog.naver.com/champabs00?Redirect=Log&logNo=220875210275,경복궁 맛집대선칼국수사인들이 보이네요ㅎㅎ대선칼국수메뉴판입니다 칼국수만 있는게 아니고 수육 및 두루치기등 있습니다 전체다 칼국수 주문했는데 서빙하는 아주머니께서 수육을 추천해줬습니다... ,현,https://blog.naver.com/champabs00,2016-12-01
"비 오는 날 끄적끄적 - 왓어커피 팥빙수 ,대선칼국수 ... ",https://blog.naver.com/someday90210?Redirect=Log&logNo=221063854559,노래랑은 상관없을 정도로 양이 적어 녹기도 전에 다 먹어버렸다지 ㅎㅁㅎ대선칼국수특별히 기대 없이 갔던대선 칼국수 . 연예인들도 많이 오고 맛집으로 많이 올라오긴 했지만 큰 기대 없이 갔는데... 맛.있.... ,나나 이야기 공감 & 공간,https://blog.naver.com/someday90210,2017-07-31
한밭수목원.만년동카페 커피로와.둔산동대선칼국수 ... ,https://blog.naver.com/winkerya?Redirect=Log&logNo=221613250777,원래 아이들이 다른걸 골랐는데 가보니 또 문닫았음 정말 기가막힐 노릇 그래서 다시 차후책으로대선칼국수엄청 오래되고 유명한 곳이더라구요 둔산동에 있는대선칼국수대전에선 꼭 칼국수를... ,윌리윙커씨,https://blog.naver.com/winkerya,2019-08-11
 대선칼국수 /수육맛집/칼국수맛집/대전맛집,https://blog.naver.com/georgegirl?Redirect=Log&logNo=220759596263," 대선 칼국수 에 왔으니, 당연히 칼국수와 각 테이블에 하나씩 있는 수육을 주문하였으며, 사실 칼국수 보다는 수육이 먹고 싶어서대선 칼국수 에 왔다. 칼국수는 멸치육수로 맛을 내어 위에 올려진 소고기 고명... ",무지개,https://blog.naver.com/georgegirl,2016-07-11
대전여행에서 만난 대전 맛집대선칼국수 ,https://blog.naver.com/365_media?Redirect=Log&logNo=220990785703,"맛집대선칼국수수육과 칼국수, 비빔국수를 주문했어요 주변을 둘러보니 두루치기도 꽤 많이 드시더라구요! 수육도 맛있다는 얘기를 접수하고 함께 주문해봤습니다. 대전여행은 역시 먹방! 살과 비계의 조합이... ",제주도읽어주는남자,https://blog.naver.com/365_media,2017-04-24
둔산동대선칼국수반해버린 맛 *.*,https://blog.naver.com/naho_holic?Redirect=Log&logNo=220642365001,"둔산동대선칼국수반해버린 맛 *.* 친구랑 조조영화를 보고 근처에 칼국수 맛있는 곳이 있다그래서 친구를 쫄래쫄래 쫓아갔어요 이름은 바로대선칼국수+_+ 칼국수는 6,000원인데 친구말론 무난무난한 맛이래요... ",온리 보물상자 ♪,https://blog.naver.com/naho_holic,2016-03-01
