title,link,description,bloggername,bloggerlink,postdate
영등포대한옥꼬리수육 고퀄리티 소주 친구,https://blog.naver.com/qkqnek219?Redirect=Log&logNo=222302575772,영등포대한옥꼬리수육 실로 오랜만이고 3번째인가 4번째 방문 비오는 날이라 웨이팅 많을 줄 알았으나 나름 선방한 수준이다 입장하던 5시 반이나 다 먹고 나갔을 6시 반 쯤에는 계속 줄 서 있었음대한옥 ... ,책을 편식하는 사람들,https://blog.naver.com/qkqnek219,2021-04-08
 대한옥꼬리수육 먹으러 다녀옴.,https://blog.naver.com/tjgml1107?Redirect=Log&logNo=222036233171,지인이 가보고싶다고 해서 가본대한옥 . 꼬리수육으로 유명하고 인스타에서 사진으로 약간 유명해져서...대한옥 이라고 창문에 쓰여있고 간판은 신길 설렁탕전문 이라고 써있다. 꼬리수육을 먹으러온거니까... ,정원속의 흔들의자,https://blog.naver.com/tjgml1107,2020-07-20
전통 영등포 꼬리수육•설렁탕 전문 식당 “ 대한옥 ”,https://blog.naver.com/sook2rg?Redirect=Log&logNo=222268031508,영등포대한옥30년 전통 설렁탕 전문 영등포 “ 대한옥 ” 영등포대한옥30년 전통 설렁탕전문점으로 이미 너무나도 유명한 식당이라죠??? 저도 오래전부터 와보고 싶었던 식당이였는데 드디어 와보네용... ,실버의 호시탐탐~,https://blog.naver.com/sook2rg,2021-03-08
 대한옥꼬리수육 영등포맛집오월의종,https://blog.naver.com/jyp4383?Redirect=Log&logNo=222533775452,#예술몰입의맛 #food #꼬리수육 #영등포 #영등포맛집추천 # 대한옥#instafood #꼬리수육맛집 #koreafood #낮술...대한옥 의 시그니쳐~♥ 꼬리수육 ~♥ 오랜만에 방문이라... 낮이지만 소주까지 주문 설렁탕 국물은 함께... ,예술몰입 (세상모든건나에게예술이다!),https://blog.naver.com/jyp4383,2021-10-11
영등포 맛집[대한옥] 설렁탕 꼬리수육 추천,https://blog.naver.com/hspee?Redirect=Log&logNo=222298547011,"비오는저녁, 뜨끈한 설렁탕과대한옥 의 시그니쳐 꼬리찜이 생각났다 그중에서도 오늘은 꼬리수육이 너무 먹고 싶었다! 원래 진짜 맛집은 사람들이 모르는 으슥한 골목길에 숨어 있는 법인데대한옥 도 그렇다.... ",비내섬의 아침,https://blog.naver.com/hspee,2021-04-04
[밀키트] 소제이 소꼬리찜 (Feat.대한옥 ),https://blog.naver.com/rkely?Redirect=Log&logNo=222239116425,그 꼬리찜은 내가 좋아하는대한옥소꼬리찜과 비슷했고.. 나는 바로 소제이 꼬리찜 밀키트를 주문했다. 유튜버 덕분인지 주문량이 밀려서 1주일뒤에 받았다. 이전에 다녀온대한옥소꼬리찜 후기 소꼬리도... ,스티브M의 일상블로그,https://blog.naver.com/rkely,2021-02-13
"[영등포] 꼬리수육맛집 ' 대한옥 ' (주문꿀팁, 솔직후기)",https://blog.naver.com/iamblingb?Redirect=Log&logNo=222212524875,"영등포대한옥 에 다녀왔어요! 주변에서 영등포에서는대한옥 이 짱이라는 이야기를 많이 들어서 꼭 한번 가보고 싶었는데, 드.디.어! 다녀왔지요 제가 위치와 주문꿀팁까지 알려드리게요! 영등포대한옥위치... ",Bling Blossom,https://blog.naver.com/iamblingb,2021-01-19
영등포대한옥 ,https://blog.naver.com/i1214?Redirect=Log&logNo=222476237242,11시 영등포대한옥 에서 만나기로 했는데 눈앞에서 놓친 지하철 다행히도 급행이 와서 살짝만 지각대한옥간판부터 나 노포다~ 라고 보여주는 듯 ㅋㅋㅋㅋㅋ 오픈 11시 ...입장은 11시 10분쯤이었나 우리가 첫... ,땡글한토깽이 올리미얌,https://blog.naver.com/i1214,2021-08-19
[영등포맛집]꼬리수육전문 “ 대한옥 ”,https://blog.naver.com/tpdusss?Redirect=Log&logNo=222542056291,멀리서 친구야들이 영등포쪽으로 온대서 고르고 고르다가대한옥가기러 결정하고 드디어 가본 곳! 사실 입구에서 풍기는 포스? 때문에 들어가기 살짝 무서운데.. 들어가면 아늑하니(?) 좋다..! 꼬리수육(대)자... ,"Ut ameris, ama",https://blog.naver.com/tpdusss,2021-10-19
영등포대한옥꼬리수육 공영주차장,https://blog.naver.com/bolikeme?Redirect=Log&logNo=221971456742,영등포대한옥꼬리수육 공영주차장 위치 확인 영등포역 인근 노포식당으로 유명한대한옥이곳 꼬리수육 하나만큼은 젊은 사람부터 언제나 웨이팅도 길고 손님이 많은 곳입니다. 저녁 퇴근시간 이후에 가면... ,오별의 여행주식회사,https://blog.naver.com/bolikeme,2020-05-20
영등포대한옥소꼬리수육 국수사리 무조건 추가해..,https://blog.naver.com/qkqnek219?Redirect=Log&logNo=221801021607,영등포대한옥드뎌 방문띠^^ 박사장과 오랜만에 함께한 영등포 맛집 털이 예전에 쩡마형 추천으로 알게된 소꼬리수육 전문점 영등포대한옥영등포역에서 도보로 약 10분거리에 위치해있는대한옥도착해서도... ,책을 편식하는 사람들,https://blog.naver.com/qkqnek219,2020-02-08
 대한옥신길점 꼬리찜 포장,https://blog.naver.com/mos7804?Redirect=Log&logNo=222488211917, 대한옥본점은 일요일 휴무이고대한옥신길점은 주차가 애매하여 전화로 포장주문했어요 얼마냐 걸리는지 물어보니 바로 된다고 해요 포장용기에 국물과 꼬리찜이 같이 들어있고 부추와 간장 양념은 비닐에... ,매일매일 행복해♥,https://blog.naver.com/mos7804,2021-08-29
[맛집추천] 영등포대한옥 _꼬리수육맛집❤,https://blog.naver.com/snh211?Redirect=Log&logNo=222058638118,#영등포맛집 #꼬리수육맛집 #영등포 대한옥#영등포맛집추천 #영등포꼬리수육 올만에 오방이랑 만났댜... 막걸리를 때리려다가 기차역 근처대한옥 으로 궈궈궈궈궈 오방 회사가 안성(!?!?!?)이니까 띠옹... 오방... ,Ssung's Blog,https://blog.naver.com/snh211,2020-08-12
"영등포 맛집 노포대한옥[꼬리 수육, 설렁탕 맛집, 후지 x100v]",https://blog.naver.com/yahao2512?Redirect=Log&logNo=222494212490,"비가 추적 추적 내리던 어느 날 영등포대한옥 을 다녀왔다. 공구 상가를 걷다 보면 갑자기 뿅 나타나는대한옥간판이 작아서 잘 안 보인다. 꼬리 수육, 설렁탕 전문대한옥이야. 노포 갬성 카메라 들고 나간... ",야하오의 말랑한 기록,https://blog.naver.com/yahao2512,2021-09-03
영등포대한옥2호점 / 포장마차,https://blog.naver.com/ramidori?Redirect=Log&logNo=221798647386," 대한옥본점은 웨이팅이 길다고 해서 2호점으로 찾아갔는데 다행히 딱 한자리 남아서 바로 들어갈 수 있었다. 우리 뒤로는 줄이 점점 길어졌지만, 본점보다는 웨이팅이 길지 않은 듯 했다. 영등포대한옥2호점... ","쉼표,",https://blog.naver.com/ramidori,2020-02-06
영등포 맛집 * 꼬리수육 맛집대한옥 ,https://blog.naver.com/1004fjqmthsu?Redirect=Log&logNo=222490663749,예전부터 가보고 싶었는데 기회가 없어서 못가다가 다비니랑 오랜만에 서울 온 김에 들린대한옥영등포역이랑 가깝고 오래된 건물이 반겨주는 노포 토요일 낮이라 웨이팅 하려나 했는데 12시쯤 갔는데 웨이팅... ,"하고 싶은 말,",https://blog.naver.com/1004fjqmthsu,2021-08-31
꼬리 수육 맛집 영등포대한옥신길점 설렁탕 전문 추천,https://blog.naver.com/now_think?Redirect=Log&logNo=222537485682,퇴근 후 항상 배가 고픈 저예요 ㅎㅎ 배고프고 따듯하고 맛있는 음식을 찾다 종종 가는대한 옥 ...대한옥신길점은 주방에서 항상 사골을 끓여하하기 때문에 주방이 큽니다 그래서 매장이 기역 자예요 ㅎㅎ... ,먹깨비 갱이의 일상 :),https://blog.naver.com/now_think,2021-10-15
[영등포 맛집]대한옥- 꼬리수육(꼬리찜) 벌써 4번째 방문,https://blog.naver.com/hihosh?Redirect=Log&logNo=222365968108," 대한옥- 꼬리수육(꼬리찜) 영업시간: 월~토: 11:00 - 20:50(마지막 주문 20:00까지) 매주 일요일 휴무 전화번호: 02-2633-5052대한옥 에 벌써 4번째 정도 방문한 것 같네요. 처음 2번은 줄이 너무 길어서 실패했고, 그... ",Freedom,https://blog.naver.com/hihosh,2021-05-25
영등포 맛집_소꼬리찜 맛집대한옥 ,https://blog.naver.com/kbr43?Redirect=Log&logNo=222448622920,# 대한옥1호점은 조금은 무서운 비주얼이라 2호점으로 찾았다. 무려 평일 오후 2시반에 한적한 시간에... 왜대한옥얘기를 하는지 알겠...♥ 참기름의 고소함 짜지않은 간장의 단짠함 뼈가 술술빠지는 소꼬리의... ,급하고 느긋한 블로그,https://blog.naver.com/kbr43,2021-07-28
영등포대한옥 _2020.12.28,https://blog.naver.com/in_anilove?Redirect=Log&logNo=222220178209,영등포에 2n년 살았는데 사람들이 영등포 맛집이라고 부르는 곳들은 오히려 안가본거 같아서 연차 쓴김에 굳이 찾아가본 영등포 꼬리수육 맛집이라는대한옥외관이 전설의 맛집이 숨어있을 거 같이 생기긴... ,After the rain,https://blog.naver.com/in_anilove,2021-01-26
 대한옥- 꼬리수육,https://blog.naver.com/rudgk333?Redirect=Log&logNo=222197510308,다시 한번 가고 싶은대한옥 .. 김씨아저씨랑 모르는 맛을 찾아 맛집 다니기를 할 때 다녀왔던 묵은지... 하고 들어간대한옥 은.. 이미 테이블마다 술이.....ㅎㅎㅎㅎ 쓸데없는 생각을 했담서...ㅋㅋㅋㅋ... ,여우곰의 살며 생각하며 사랑하기,https://blog.naver.com/rudgk333,2021-01-06
소소한 하루음식 - [영등포역]대한옥꼬리찜,https://blog.naver.com/sosowaharu?Redirect=Log&logNo=222157788982,영등포역에 위치한 설렁탕 맛집이라는대한옥 . 정작 설렁탕보다는 꼬리찜이 더 유명하다고 하던데..... 영등포 맛집이라는대한옥 . 한번즈음 찾아와서 먹어볼만한 맛집인것 같다. 다만 사람이 너무 많아서... ,소소한하루,https://blog.naver.com/sosowaharu,2020-11-29
영등포 /대한옥 ,https://blog.naver.com/mymiming?Redirect=Log&logNo=222317865623,좋아하는데대한옥 은 도가니보단 꼬리수육이다 꼬리수육 두 번 드세요 친구랑 꼬리수육 먹으러 갔다가 설휴무 어택 당해서 못 먹고 온 날 도 있었구만 다세대 주택단지 밀집한 곳에 있어서 주차는 할 곳이 없다.... ,ONLY ONE IN THE EARTH,https://blog.naver.com/mymiming,2021-04-21
영등포 신길동 맛집~ 대한옥 2호점 꼬리수육 생각보다 맛나네,https://blog.naver.com/feel72030?Redirect=Log&logNo=222199375123,영등포 신길동 맛집대한옥 을 다녀왔습니다 집이 영등포이고 학교를 신깅동에서 다녔는데 이곳을... 그래도 다이어트 생각을 안할수는 없네요 소주도 적당히 먹어야 할거 같구요 오늘은대한옥이야기 였습니다,임혁필의 강연 및 샌드애니메이션,https://blog.naver.com/feel72030,2021-01-07
"맛집데이트대한옥 , 슈퍼말차 다녀왔어요:)",https://blog.naver.com/cutedays?Redirect=Log&logNo=222331649681,입버릇처럼 꼬리수육 먹고 싶단 말을 자주 했는데 오늘 오빠랑 꼬리수육 맛집대한옥다녀왔어요.대한옥 은 영등포에 있답니다. 들어가자마자 입구부터 사람들이 줄서있었어요. 전체적인 인테리어가 옛스럽고... ,명랑한 나의 일기장,https://blog.naver.com/cutedays,2021-05-01
또 먹고싶다대한옥소꼬리찜,https://blog.naver.com/mannie79?Redirect=Log&logNo=222243879383, 대한옥 2호점 꼬리수육 aka 소꼬리찜 동반자가 회식 때 보내온 사진을 보고 침만 흘리다 결국 다녀온대한옥작년 4월에 다녀온 사진임.. 그 이후로 거리도 그렇고 코로나도 그렇고(그렇다고 아예 외식을... ,昭 炫 PARK,https://blog.naver.com/mannie79,2021-02-15
" 대한옥 -꼬리찜,꼬리수육맛집(영등포역)",https://blog.naver.com/sjsj1017?Redirect=Log&logNo=221934674371,#영등포맛집 # 대한옥#꼬리수육맛집 #영등포설렁탕 #영등포꼬리찜 #영등포꼬리찜맛집 #서울꼬리찜맛집... 서울영등포꼬리찜맛집대한옥꼬리수육 여긴 #꼬리수육맛집 양념한 부추가 삭 올라간... ,폴링아뜰리에 가랜드-백일 첫돌 감성캠핑 가랜드제작,https://blog.naver.com/sjsj1017,2020-04-28
영등포맛집 / 영등포대한옥/ 꼬리수육,https://blog.naver.com/yeahnah3?Redirect=Log&logNo=221959093421,영등포대한옥 에 방문했다 옛날부터 처음보는 비주얼에 이끌려 항상 궁금했는데 맨날 영업시간... 편식쟁이가 뭐하나 맘에글명 그것만 묵드라 예를들면 면..면..면.. 할튼대한옥마니먹고 시프면 2호점가는걸루~!!,나비나비예나비 blog_✰,https://blog.naver.com/yeahnah3,2020-05-12
영등포대한옥 / 꼬리수육,https://blog.naver.com/dohee900?Redirect=Log&logNo=222525001033,어제 영등포에 있는대한옥 에 꼬리수육을 포장하러 방문 _ 첨 갔을때는 가게에서 먹고 이번이... 완성된대한옥꼬리수육! 요로코롬 한입❤️ 하이볼과 함께 먹었더요_ 진짜 맛있는 꼬리수육 ㅎㅎ 설렁탕... ,도탕블로그,https://blog.naver.com/dohee900,2021-10-03
"영등포대한옥 . 역대급 웨이팅, 제2의 엄지네",https://blog.naver.com/spring5867?Redirect=Log&logNo=221477332983,"영등포대한옥 . 역대급 웨이팅, 제2의 엄지네대한옥어쩌다 삘받아서 갑자기 생각난 # 대한옥꼬리수육을 먹으러 영등포로 향했습니다. 요즘 을지로. 익선동 등 노포 힙존이 엄청 각광받고 있고 이런 힙스터... ",■봄이 미식회■,https://blog.naver.com/spring5867,2019-03-01
[영등포 맛집대한옥 ] 최자로드는 왜 도대체 뭐 때문에... ,https://blog.naver.com/e_jung1107?Redirect=Log&logNo=221640777808,진짜 엄청 예전부터 가보고 싶었던 영등포대한옥 인데 여기 가자고 하면 다들 무슨 꼬리찜 먹으러... 제가대한옥 을 가자고 외쳤지용ㅋㅋㅋㅋㅋ 하두대한옥대한옥해서 그런지 이번엔 흔쾌히 ㅇㅋ... ,WHERE IS WHALE,https://blog.naver.com/e_jung1107,2019-09-06
서울 인스타 맛집 영등포대한옥 ,https://blog.naver.com/poohhoo?Redirect=Log&logNo=221525810941,"요즘 뜨고 있다는 서울 인스타 맛집은 영등포대한옥 . 여긴 꼭 대구 북성로 같은 곳이였어요. 공구상가인가? 그냥 시장인가? 뭐가 뭔지 모르겠지만 각종 공구,재료들을 가득 쌓아놓고 파는 동네에대한옥 이... ",나를 블로깅 합니다,https://blog.naver.com/poohhoo,2019-04-30
영등포 수육 / 꼬리수육대한옥 ,https://blog.naver.com/phjsunflower?Redirect=Log&logNo=221185568144,영등포 수육 / 꼬리수육대한옥꼬리수육으로 유명한집들은 더러 있지만 가격이 비싸다라는 이유로... 있는대한옥꼬리수육과 도가니탕 그리고 설렁탕 전문점인데 합리적인 가격으로 만날 수 있는 곳이라서... ,꽃씨의 맛집 이야기♬,https://blog.naver.com/phjsunflower,2018-01-19
영등포 맛집 -대한옥: 꼬리수육은 진리,https://blog.naver.com/teemoticon?Redirect=Log&logNo=220855074215,[ 영등포 맛집 -대한옥: 꼬리수육 ] 안녕하세요 티이모에요 ^오^ 영등포에 참 주옥 같은 맛집들이 몇 군데 있죠. 그 중에서 간판만 보고 맛집일 수 밖에 없다는 바로 그 곳대한옥 .. 모르는 사람이 지나가면... ,티이모와의 연결 고리 ♂,https://blog.naver.com/teemoticon,2016-11-06
[영등포]대한옥소꼬리찜!! 먹으러갔다옴,https://blog.naver.com/makingfun?Redirect=Log&logNo=221130426252,영등포대한옥메뉴판 주문합니다! 꼬리수육 大자 도가니탕 하나요!!!!!!! 그리고 사람구경을 함니다..... 영등포대한옥 에선 무조건 소꼬리찜(수육) 먹으시오 그리고 다 먹으면 1000원짜리 국수사리 인원수대로... ,쏭의 즐거운 주말,https://blog.naver.com/makingfun,2017-11-01
"영등포맛집, 꼬리수육먹으러대한옥드디어 방문!",https://blog.naver.com/eundung730?Redirect=Log&logNo=221502864578,"꼬리수육으로 유명한 #영등포맛집 # 대한옥언제가나~ 싶었는데 드디어 다녀왔어요! 입구부터 우선... 그리고 # 대한옥에서의 마무리는 #소면사리 !! 1,000원 추가! 소면사리는 양념장에 야무지게... ",순간의 기록,https://blog.naver.com/eundung730,2019-04-01
[영등포 맛집]대한옥- 40년 넘은 유명한 소꼬리수육 노포,https://blog.naver.com/sielle83?Redirect=Log&logNo=221051978381, 대한옥/ 영등포구 영등포로51길 6 (영등포동2가 221-1)전화번호 02-2633-5052영업시간 09:30-21:30 일요일 휴무... 위치한대한옥 서울의 할렘 영등포는 언제 와도 적응이 안된다 1970년대부터 영업해온 영등포... ,여의도 직장인 문썬의 밥상 (舊 을지로),https://blog.naver.com/sielle83,2017-07-19
"영등포대한옥 의 꼬리수육, 국물과 국수로 완성되다",https://blog.naver.com/mudoidoi?Redirect=Log&logNo=221148982777,상호는대한옥 . 입구가 워낙 좁아서 그런지 막상 들어가면 생각보다 넓은 실내에 살짝 놀라게 돼요.... 영등포로터리 인근의대한옥 은 외관에서 한 번 놀라고 음식에서 두 번 놀라는 식당이라는 소감이었습니다.... ,돈내고사먹읍시다(舊Serendipity),https://blog.naver.com/mudoidoi,2018-01-19
영등포시장대한옥- Place NO. 24 -,https://blog.naver.com/biteway?Redirect=Log&logNo=221334463906,"이 # 대한옥에 대한 명성을 눈으로, 입으로! 직접 확인하고 싶었더랬죠. ( 거의 흉가 수준인건 저도... 사진보정하면서대한옥 을 빠른 시일내에 재방문해야겠다는 마음이 확고해졌습니다. 넌 아름다워. 그리고... ","우아함을 얻는 가장 보편적인 법칙, 스프레차투라.",https://blog.naver.com/biteway,2018-08-09
[영등포 맛집] 대한옥 -소꼬리수육과 설렁탕,https://blog.naver.com/hongik9016?Redirect=Log&logNo=220744522652,맛집대한옥 의 소꼬시수육을 이제야 맛보고 사진으로 하나씩 설명을 해볼까 합니다 신길과 영등포 사이에 위치한대한옥저녁시간에 방문하면 이곳에 식당이 있을까? 라는 의문을 가질수있지만 식당에... ,아가리파이터의 먹방,https://blog.naver.com/hongik9016,2016-06-24
영등포 /대한옥 (꼬리수육으로 유명세를 떨치는 집),https://blog.naver.com/jaedolls?Redirect=Log&logNo=221493894373,영등포 /대한옥 (꼬리수육으로 유명세를 떨치는 집) 예전부터 궁금해하던 집을 찾아가는 일은 늘... 영등포대한옥 을 약속 장소로 정했다.대한옥 은 영등포뿐만 아니라 서울 전역에서도 많은 이들이 찾아가는... ,짱똘아빠의 전국맛집들,https://blog.naver.com/jaedolls,2019-03-22
영등포시장 맛집 -대한옥(#3) : 꼬리 수육 지배자,https://blog.naver.com/teemoticon?Redirect=Log&logNo=221285727213,[ 영등포시장 맛집 -대한옥: 꼬리수육 ] 안녕하세요 티이모에요 ^오^ 1년에 한 번은 꼭 가는 영등포대한옥맛도 맛이지만 이집 주변 특유의 분위기 때문에 더 가고 싶은 느낌이 강하죠. 영화에서 나올법한... ,티이모와의 연결 고리 ♂,https://blog.naver.com/teemoticon,2018-05-28
"영등포 맛집 ::대한옥 , 인스타 최자로드 맛집! 꼬리수육 솔직후기",https://blog.naver.com/712gram?Redirect=Log&logNo=221592651403,"영등포 맛집 ::대한옥 , 인스타 최자로드 맛집! 꼬리수육 솔직후기 오랜만에 언니들이랑 셋이 주말에... 배고픔에 지쳐 저녁을 먹으러 가기로~ 영등포에서 모인 김에 #영등포맛집 으로 유명한 # 대한옥에... ",일상의 기록 ♪,https://blog.naver.com/712gram,2019-07-26
［영등포/ 대한옥 ］부추범벅의 좀 특이한 소꼬리찜(꼬리수육),https://blog.naver.com/28ssan?Redirect=Log&logNo=221051995268,"한 1년 전쯤대한옥 이 제 안테나에 걸려 찜해뒀을 당시만 해도 후기가 가뭄에 콩나듯 가끔씩... 불구하고,대한옥 은 어떤 경우에 해당하는지 영 알 수가 없었습니다 ... 우리 일행은 네 명이라 꼬리수육 大자로... ",작은반달곰 료정이,https://blog.naver.com/28ssan,2017-07-24
영등포 맛집 베스트 [ 대한옥꼬리찜],https://blog.naver.com/bolikeme?Redirect=Log&logNo=221408743368,영등포 맛집 베스트대한옥꼬리찜 노포식당 이런 느낌의 식당들이 요즘은 을지로 종로 골목들 점점 없어지지 않고 인기가 많아지고 있기도 합니다. 특히 영등포대한옥 과 수요미식회에 나온 덕원 방치찜 같은... ,오별의 여행주식회사,https://blog.naver.com/bolikeme,2018-12-10
