title,link,description,bloggername,bloggerlink,postdate
"영등포대한옥2호점(신길점) 소꼬리찜, 도가니수육 대박!",https://blog.naver.com/tlso70?Redirect=Log&logNo=222439727579,드디어 가본 소꼬리찜 노포맛집 영등포대한옥2호점 최자로드에 최자와 밥굽남이 소꼬리찜... 그리고 얼마 지나지 않아 방문하게 되었습니다 소꼬리찜 노포맛집대한옥 !! 서울특별시 영등포구 가마산로 69가길 7... ,라라팍의 라라pick,https://blog.naver.com/tlso70,2021-07-21
영등포 꼬리찜대한옥2호점,https://blog.naver.com/lala0112?Redirect=Log&logNo=221956467699,어느 날 아는 언니가 우리집 근처 왔다가 여기 영등포 꼬리찜 맛있는 곳이 있다고대한옥 이였던가? 했었는데 그 담날인가 바로 남편이 영등포대한옥 에 꼬리찜 먹으로 가자고해서 깜놀쓰~ 벼르고 벼르다 엄빠... ,Michelle Lee♥,https://blog.naver.com/lala0112,2020-05-11
최근 방문한 밥집맛집 솔직리뷰대한옥| 텐동요츠야 | 온돌,https://blog.naver.com/leehajin92?Redirect=Log&logNo=222115299148,남겨요) # 대한옥부터 #텐동요츠야 #온돌 순으로 정리하겠습니다 :) 당근팡근 #내돈내산 으로 먹은 #리뷰... 에 빠져서 허름하고 오래된 국밥집 엄청 찾아두었던 그때대한옥 이라는 #설렁탕 전문 음식이자... ,찐월드,https://blog.naver.com/leehajin92,2020-10-14
 대한옥소꼬리찜 만들기!,https://blog.naver.com/zmfflr15?Redirect=Log&logNo=221849736982,유튭의 즐겨보던 채널에서 소꼬리 수육을 만들어 먹는 영상을 보고 난생처음 소꼬리 요리에 도전해 보았다 ㅎ 영등포에 유명한 맛집이라는대한옥스타일의 소꼬리찜 만들기! 하지만 난대한옥 에 가본 적은... ,the special day♬,https://blog.naver.com/zmfflr15,2020-03-12
춈미 소꼬리찜 / 집에서대한옥 st 꼬리수육 만들기,https://blog.naver.com/muzirang2?Redirect=Log&logNo=222095856010,"몇 년 전부터 가보고 싶은 맛집 리스트에서 빠지지 않았던대한옥 . 사진으로만 봐도 군침도는...대한옥 을 가보지 않아서 맛이 얼마나 유사했는지는 비교할 수 없지만, 비주얼만으로는 내가 만들어서가 아니라... ",Ordinary Days,https://blog.naver.com/muzirang2,2020-09-21
영등포대한옥최자로드 맛집,https://blog.naver.com/minjee1209?Redirect=Log&logNo=222534055256,"이전에도 다녀온적이 있는 영등포대한옥그때는 2호점으로 갔었는데 이번에는 1호점으로 방문! 2호점도... 맛집대한옥약간 아쉬웠던건 화장실,, 워낙 옛날 건물에 있다보니까 화장실이 그리 깨끗한편이 아님... ",순간의순간,https://blog.naver.com/minjee1209,2021-10-12
 대한옥꼬리찜 만들기 -대한옥꼬리수육 만들기,https://blog.naver.com/bp_studio?Redirect=Log&logNo=222013127152,"인스타에서 여러번 봤던 영등포대한옥소꼬리찜, 꼬리수육. 한번도 못 먹어봤기에 마음같아선... ㅎ대한옥 에서는 소면사리가 필수래요. 저도 소면 삶아서 곁들여봅니다. 새콤한 간장비빔국수 맛이 납니다.... ",브페,https://blog.naver.com/bp_studio,2020-06-26
"신길동 맛집, 영등포대한옥2호점 소꼬리찜! 최자로드에도... ",https://blog.naver.com/dauh80?Redirect=Log&logNo=222057436349," 대한옥 이라고 소꼬리찜을 파는 곳인데, 최자로드에서 나왔던 곳이다. 우연찮게 2호점이 곰댕이네 집 근처에 있다. 영등포대한옥본점은 훨씬 더 좁고 낡은 노포인데 맛은 똑같으니 조금이라도 쾌적한... ",먹는게 남는 댕댕 (•⚗৺⚗•),https://blog.naver.com/dauh80,2020-08-11
 대한옥 st 소꼬리찜 만들기 : ) / 한우 알꼬리찜,https://blog.naver.com/luv_nyoung?Redirect=Log&logNo=222365735053,이왕 주문한거 # 대한옥스타일로 맛있게 만들어서 먹어보도록 할게용. 토요일에 #한우소꼬리 택배 도착해서 바로 준비 시작합니다! 소꼬리는 바로 흐르는 물에 불순물 한번 헹궈내고 핏물빼기 시작. 중간에 물... ,"천천히, 하나씩",https://blog.naver.com/luv_nyoung,2021-05-25
영등포대한옥최자로드에 나온 꼬리수육 먹고옴!,https://blog.naver.com/nddoo_?Redirect=Log&logNo=222473919205,"인스타에 노포 맛집으로 떴다하면 2,3시간 웨이팅은 기본 껌~ 인스타 갬성 맛집 카테고리에 노포가 뜨기 시작한 그 시작, 그 시작에 영등포대한옥 이 있었다고 봐도 과언이 아니라고 생각함다.대한옥 은 영등포... ",뚜뚜뚜루뚜뚜뚜뚜,https://blog.naver.com/nddoo_,2021-08-17
영등포대한옥소꼬리찜 꼬리수육 (주차 / 메뉴),https://blog.naver.com/fjqmfflbbo?Redirect=Log&logNo=222515068438,월~토 11:00 - 20:50 마지막주문은 20:00 일요일 휴무 엄청 먹어보고 싶었던 영등포대한옥 으로 소꼬리찜... 영등포대한옥진짜 여기에 있는거 맞아?????? 라는 생각으로 걸어다니다 보면 나온다 ……. 영등포대한옥 ... ,Lovely days-,https://blog.naver.com/fjqmfflbbo,2021-09-24
영등포대한옥소꼬리찜,https://blog.naver.com/wnsghdudwls?Redirect=Log&logNo=222491026691,영등포대한옥 인데요 낮술 하기에 분위기만큼은 좋았던 곳이에요 ㅎㅎㅎ 소꼬리찜 먹으러 여의도에서 영등포로 넘어왔습니다. 뭔가 활기 넘치는 골목을 걷다 보면.. 영등포대한옥 이 보입니다. since1970 50년 넘은... ,낮에 놀자 with 머니아빠,https://blog.naver.com/wnsghdudwls,2021-09-01
[영등포 맛집]대한옥- 줄서서 먹는 50년 전통 소꼬리수육,https://blog.naver.com/sielle83?Redirect=Log&logNo=221916781269, 대한옥/ 영등포구 영등포로51길 6 (영등포동2가 221-1) 전화번호 02-2633-5052 영업시간 11:00-21:00 일요일... 하나인대한옥 1970년부터 이 할렘가를 지켜온 꼬리수육 전문점옛날 후기 찾아보니 거진 3년만에 다시 찾은... ,여의도 직장인 문썬의 밥상 (舊 을지로),https://blog.naver.com/sielle83,2020-04-20
꼬리수육 맛집대한옥술이 미친 듯이 들어가네,https://blog.naver.com/dxmn_?Redirect=Log&logNo=222531790755,"있는대한옥이라는 식당에서 만나기로 했다. 저녁 다섯시 반에 퇴근하자마자 차 몰아서 도착했더니 5시 50분 쯤 되었다. 중마루공원노상공영주차장에 주차를 하고(자리가 많았다.), 바로대한옥입장!... ",등포일기,https://blog.naver.com/dxmn_,2021-10-09
계속 먹고 싶은 소꼬리찜! ‘ 대한옥 ’_술이 술술 잘도 들어간다...,https://blog.naver.com/lovefromlike?Redirect=Log&logNo=222274554507,#소꼬리찜 #영등포맛집 #영등포밥집 # 대한옥#꼬리수육 #안주맛집 # 대한옥 1호점 #블루리본 #설렁탕전문점 안녕하세요~ 깨하~~ 오늘은 꼬리수육 맛집!!! 술이 술술 들어가는~~~대한옥 에 다녀왔어요! 2호점은... ,깨의 취향,https://blog.naver.com/lovefromlike,2021-03-14
"영등포대한옥 , 꼬리수육 세젤맛! 주말웨이팅 시간",https://blog.naver.com/lemon3761?Redirect=Log&logNo=222365619700,몇년 전부터 칭구들과 가봐야지 가봐야지 말만한지 몇년째 ㅋㅋㅋㅋㅋㅋ 드디어 소문으로 무성하던 “ 대한옥 ” 을 다녀왔다 드디어 왔다고요대한옥에 꼬리수육 먹으러!!! 비쥬얼 부터 시선 강탈... ,MING BLOG,https://blog.naver.com/lemon3761,2021-05-25
[서울/영등포] 50년 전통 소꼬리수육대한옥 ,https://blog.naver.com/soeun0825?Redirect=Log&logNo=221939443095,"영등포 공구거리쪽에 위치해있는 50년 전통의대한옥 -! 시장 안쪽에 있어서 주차는 공영주차장이나... 영등포 대표 노포 중 한 곳인대한옥 은 1970년부터 이 자리를 지키고 있다고, 신길동에 생긴 2호점이 더... ",소소한 blog,https://blog.naver.com/soeun0825,2020-05-01
"영등포 나들이 다녀오다 :대한옥 , 볼링장",https://blog.naver.com/dkzkdlqk?Redirect=Log&logNo=221919142621,오랜만에 친구들과 시간을 보내며대한옥 에서 맛있는 것도 먹고 볼링장에 가서 재밌게 하루를... 저희가 이 날 간 맛집은대한옥 인데요. 영등포에서 유명하기로 소문이 자자한 곳이었어요. 가기 전에... ,알림이의 여행 · 일상,https://blog.naver.com/dkzkdlqk,2020-04-20
"[영등포]대한옥: 꼬리수육, 설렁탕",https://blog.naver.com/dubong_e?Redirect=Log&logNo=222487734006,영등포 인근에 위치한대한옥 은 최자로드에도 소개된 곳으로 설렁탕보다 꼬리수육이 더 알려져 있는데.. 다소 외진 골목이자 산업용 공구상가들이 있는 낡은 건물 1층에 있는 노포다.대한옥2호점은 신풍역... ,dubong,https://blog.naver.com/dubong_e,2021-08-29
"[영등포맛집]대한옥- 오래된 꼬리수육, 설렁탕 전문점",https://blog.naver.com/sulbe3000?Redirect=Log&logNo=222284994333,"하고 다녀온 # 대한옥예전에 한창 인스타그램에서 유행했을 때부터 가야지 가야지... 했었는데... 휴무대한옥본점 위치는 5호선 신길역 3번출구에서 5분 정도, 1호선 영등포역 5번출구에서 10분정도 떨어진... ",백곰의 생활백서,https://blog.naver.com/sulbe3000,2021-03-23
[ 소꼬리찜 ]대한옥스타일 춈미소꼬리찜 압력밥솥으로 뚝딱 완성,https://blog.naver.com/ladyyeong?Redirect=Log&logNo=222208942303, 대한옥서타일 소꼬리찜 인스타 춈미 소꼬리찜 압력밥솥 으로 소꼬리찜하이 김달곰 입니다 오늘은... 요즘엔 # 대한옥 소꼬리찜 스타일이 대유행이라서 그 버전으로 해보기로 ㅎㅎ #춈미소꼬리찜 레시피가... ,김달곰의 소소한 일상♡,https://blog.naver.com/ladyyeong,2021-01-16
 대한옥 st. 소꼬리찜,https://blog.naver.com/heyrara?Redirect=Log&logNo=222326560431, 대한옥소꼬리찜(꼬리수육) 한 번 먹어보고 싶었는데 식당 절대 안가고 있는 이 시국이라 직접 만들었다 알려진 레시피 참고해서 나름대로 해봤는데 원조를 안먹어봐서 비슷한지는 모르겠지만 정말... ,heyrara & MAK,https://blog.naver.com/heyrara,2021-04-28
[영등포 노포맛집]대한옥(비빔국수 전문점),https://blog.naver.com/ksh5059?Redirect=Log&logNo=222074762392,설렁탕 꼬리수육 전문 [영등포 노포] # 대한옥후기대한옥 은 '영등포 맛집' 키워드에 항상 상단에 노출될 정도로 유명한 음식점이다. (확인은 못해봤으나) 힙합계 대표 맛집러 최자의 추천 맛집으로도 유명하며... ,모퉁이에서,https://blog.naver.com/ksh5059,2020-08-29
영등포 맛집대한옥2호점 일요일 방문 후기,https://blog.naver.com/minjee1209?Redirect=Log&logNo=222302134964,맛집대한옥여기1호점 맨날 도전할때마다 실패했는데 2호점이 있다고 영등포역에서 맨날 나가던곳말고... 걸어간거같다 짠 여기가 영등포 맛집대한옥2호점 간판보면대한옥 인지 모르겠지만 창?에 보면... ,순간의순간,https://blog.naver.com/minjee1209,2021-04-07
영등포 노포 맛집대한옥꼬리수육,https://blog.naver.com/hey1571?Redirect=Log&logNo=222514032366,곳이대한옥 이에요 꼬리수육에 수북이 올라간 부추무침과 양념장 조화가 좋아 오랫동안 한자리를... 맛집대한옥 은 1970년도에 오픈해서 51년째 영업하고 있는 곳이에요 뭔가 복잡한 느낌이 물씬 나는... ,혜나의 일상,https://blog.naver.com/hey1571,2021-09-23
영등포 맛집 노포 소꼬리 수육대한옥 ,https://blog.naver.com/nanacook?Redirect=Log&logNo=221734790138,"영등포 맛집 노포 소꼬리수육대한옥대한옥 은 아직도인지,한동안인지 인스타 맛집으로 유명 연예인 맛집으로 핫한 곳인데 궁금증에 다녀와 봤네요. 소꼬리라는게 워낙 보양식 이미지가 강하고 탕으로 먹거나... ",Nana's kitchen,https://blog.naver.com/nanacook,2019-12-13
영등포대한옥소꼬리수육 먹고 왔어요,https://blog.naver.com/girlstown0?Redirect=Log&logNo=221948846542,거기가대한옥 이였어요.대한옥꼬리수육 설렁탕 전문 꼬리수육 빨리 먹고 싶어요. 40분정도 기다린듯해요. 일요일은 휴무이고 마지막 주문은 8시까지니 참고하셔서 가시길 바래요. 매장내부의 모습이에요.... ,Lilly's home♡,https://blog.naver.com/girlstown0,2020-05-06
◐영등포◑대한옥: : : 포장해와서 먹고픈 소꼬리찜,https://blog.naver.com/sonbidan?Redirect=Log&logNo=222291126340,"꼬리찜으로 제법 유명하다는대한옥 에 다녀왔다. 영등포 공구상가 안에 있는데, 영등포역과도 좀 떨어져 있고 먹거리 골목도 아니어서 지나가다가 들를만한 위치는 아니고 맘먹고 찾아가야 하는 곳이다. 진짜... ",손비단 취미생활 : : : 손이 비단이다,https://blog.naver.com/sonbidan,2021-03-29
[집밥추천]대한옥 st 소꼬리찜 실패없는 레시피,https://blog.naver.com/mokwon_univ?Redirect=Log&logNo=222185434244,우니와끼니 제가 넘넘 애정하는 유튜버인 우니와끼니가대한옥 에서 먹어보고 집에서 해 먹는걸 보고... 안 짜고 팔아도될듯대한옥 은 못 먹어봤지만 ㅠㅠㅠ 이제 마지막 소꼬리 넓은 그릇에 꺼내주세요!!! 널... ,맞춤 인재를 양성하는 교육혁신대학 - 목원대학교,https://blog.naver.com/mokwon_univ,2020-12-25
"[영등포]대한옥: 꼬리수육, 설렁탕, 영등포맛집, 꼬리수육맛집... ",https://blog.naver.com/durnfl2?Redirect=Log&logNo=222349511430,안녕하세요 핸섬피아노 입니다대 한 옥맛 보기 힘든 꼬리수육이 맛있는 곳 꼬리수육 맛집 영등포대한옥 !! 19년 더운 여름에 힘들게 대기하여 먹었던 기억이 있는곳.. 그때랑 간판이 달라졌네? 19년... ,나만의 시선으로 본 세상,https://blog.naver.com/durnfl2,2021-05-19
서울 영등포 설렁탕 꼬리수육 ' 대한옥 ',https://blog.naver.com/kjdwh?Redirect=Log&logNo=222130371984,이번 포스팅은 이미 블로그나 SNS에서 엄청 유명한 곳인데요 ' 대한옥 '입니다 영등포의 기계 공구 시장에 위치해 있는 정말로 허름한 식당이에요 주차는 ' 대한옥 '입구 뒤쪽에 공공주차장이 있어서 이용할 수... ,Be chic,https://blog.naver.com/kjdwh,2020-10-29
영등포대한옥소꼬리찜 뿌시고 오기,https://blog.naver.com/kihyun113?Redirect=Log&logNo=222530379234,영등포에 맛집이 이렇게나 많은지 몰랐네요~ 그 중에서도 줄서서 먹는다는 영등포대한옥 을... 뭔가 맛집 포스 뿜뿜 품기는대한옥 ! 마지막 주문은 8시까지 받으니 참고해주시구요! 7시 넘어 방문했는데 앞에 2팀... ,더블대디의 미국주식과 재테크.,https://blog.naver.com/kihyun113,2021-10-09
영등포대한옥추천메뉴와 먹는방법!,https://blog.naver.com/dasol5523?Redirect=Log&logNo=222104579817,"영등포대한옥먹자골목 뒷쪽에 위치해있어서 이런곳에 맛집이 있다고?싶은데 바로 거기가 맞아요ㅋㅋ... 영등포대한옥메뉴판이에요 꼬리수육 소 36,000은 둘이서 먹기 적당? 은 하지만 저는 둘이 가면 무조건... ",김미의 일상,https://blog.naver.com/dasol5523,2020-10-01
서울/영등포 맛집 :: 최자로드 꼬리수육 맛집 ‘ 대한옥 ’,https://blog.naver.com/feel3051?Redirect=Log&logNo=221721700849,"오늘은 최자로드 맛집 중 한 곳을 다녀왔는데요, # 대한옥 본점 입니다 : ) ! 영등포 타임스퀘어에...대한옥메뉴에요~ 저희는 둘이서 꼬리수육(소) 36,000원을 주문했답니다 기본 반찬들이에요ㅎㅎㅎ 맛집 들은... ",기억하고 싶은 순간들의 기록,https://blog.naver.com/feel3051,2019-11-29
 대한옥소꼬리찜 꼬리수육 핫한이유 알게된날 (또 먹으러 갈 예정),https://blog.naver.com/dlsdbtm?Redirect=Log&logNo=222527329050,기력이 딸리는 요즘 보양식을 찾다가 최자로드에 나왔다고해서 찾게된 영등포대한옥 ! 본점으로갔다가 문을 닫아서 근처 2호점으로 갔어요 거리가 꽤 가까워서 다행 ㅎㅎ대한옥2호점(신길점) 영업시간 : 매일... ,무니하이의 일상,https://blog.naver.com/dlsdbtm,2021-10-06
[서울_영등포] 영등포시장대한옥꼬리 수육,https://blog.naver.com/yghost09?Redirect=Log&logNo=222153186358, 대한옥 을 방문하였다. 인스타를 보다 보면 꼬리 수육으로 여러 번 광고를 볼 수 있었다. 보통 인스타 광고는 보기만 하는데 이번에는 운동도 할 겸 찾아가 보게 되었다. 집에서부터 영등포시장대한옥 까지는... ,-Time waits for no one-,https://blog.naver.com/yghost09,2020-11-24
[영등포 맛집]영등포하면 모다? 대한옥꼬리찜이다(⁎⁍̴̆Ɛ... ,https://blog.naver.com/dbswl8878?Redirect=Log&logNo=222310647208,"유명한 # 대한옥으로,,데려와쥬심 천사이신가요? 나도 드디어 #영등포명물 # 대한옥입성 회사랑 꽤 가까워서 나말고 다른분들은 몇번 와보셨다고 날 안타까워하셨는데 드디어 덕분에 와봄! 세월의 흔적이... ",3가지 시간의 헤르미윤느₍ᐢ ɞ̴̶̷ ̫ ɞ̴̶̷ ᐢ,https://blog.naver.com/dbswl8878,2021-04-15
영등포 꼬리수육 맛집대한옥 ,https://blog.naver.com/cozy95?Redirect=Log&logNo=222220417321,이번에 소개할 곳은 영등포역 기준 도보로 대략 10여 분 정도 떨어진 공구상가 밀집 지역에 위치한 꼬리수육 맛집대한옥 입니다. 영등포대한옥영등포구 영등포로51길 6(영등포동2가 221-1) 전화 02-2633-5052 매일 11... ,아포의 맛집 탐방...德 不 孤 必 有 隣,https://blog.naver.com/cozy95,2021-01-26
"영등포 맛집,대한옥꼬리수육",https://blog.naver.com/bryjia?Redirect=Log&logNo=222308264502,꼬리수육 맛집 영등포대한옥1호점 예전부터 너무 가보고싶었던대한옥 ! 우리집에서 영등포까지 거리가 꽤 되는 터라 늘 가보지 못하고있었는데 수원에서 볼일이 있었던 날 무궁화 타고 영등포 역까지 가서... ,감쟈고구마,https://blog.naver.com/bryjia,2021-04-13
소꼬리찜 명가대한옥 이라고 들어봤나요,https://blog.naver.com/i_bohum?Redirect=Log&logNo=221998599480,소꼬리찜 명가대한옥 이라고 들어봤나요? 몇년 전 부터 계속 귀에 닳도록 들어온 맛집이 있었는데 거길... 있는대한옥 이라는 설렁탕집이었습니다. 위치가 다소 황당한 곳에 있는지라 충분히 못 보고 지나칠 수... ,보험정보_블로그,https://blog.naver.com/i_bohum,2020-06-12
춈미 소꼬리찜 레시피대한옥처럼 먹기!,https://blog.naver.com/dalcomhi?Redirect=Log&logNo=222212223519,춈미 소꼬리찜 레시피대한옥처럼 먹기! 안뇽하세요 잇님들 오늘은 몇일전 주말에 해먹었던대한옥st 소꼬리찜 레시피 소개해드릴게용 넘 맛있게 잘먹어서 다음에 또 꼭꼭 해먹고싶은 그맛 .. 몰랐는데... ,달콤이의 달콤한 블로그,https://blog.naver.com/dalcomhi,2021-01-19
예전에 먹었는데 자꾸 기억나는 영등포 꼬리수육 맛집대한옥 ,https://blog.naver.com/dla4691?Redirect=Log&logNo=222467207221,2020년 1월에 꼬리수육 맛집대한옥 에 갔었다. 그때 아직 마스크 안 썼는데 내부 진짜 좁고 테이블 별로... 먹은지 오래됐는데 간혹가다 계속 생각난다. 나중에 또 가고싶다☺️ #영등포맛집 #꼬리수육맛집 # 대한옥 ,항상 행복한 하루를 보내기,https://blog.naver.com/dla4691,2021-08-12
"[영등포]대한옥: 50년 넘은 꼬리찜, 설렁탕 전문 노포",https://blog.naver.com/blossomby?Redirect=Log&logNo=222245218815,"'곰탕에 미친 자' 의 곰탕로드 첫번째 주인공대한옥: 50년 넘은 꼬리찜, 설렁탕 전문 노포 [영업시간] 월-토 A10:30 - P9:30 일 휴무대한옥 은 본점과 분점이 있다. *본점과 2호점의 맛은 다르지 않음 (둘 다... ",Havana night diary,https://blog.naver.com/blossomby,2021-02-16
"영등포시장 맛집 ' 대한옥 ', 젊은이들이 많다",https://blog.naver.com/lje_rose?Redirect=Log&logNo=222037119132,사람은 오늘 포스팅할 음식점대한옥앞 밖에 없음. 토요일 4시 50분에 이런 줄이라니... 게다가 오래된... 설렁탕 전문점인대한옥본점의 영업시간은 11:00 - 21:00 라스트 오더는 20:00까지다. 조금씩 줄이... ,방황하는 오춘기,https://blog.naver.com/lje_rose,2020-07-22
영등포 꼬리수육/뼈찜 맛집대한옥 ,https://blog.naver.com/dkssk715?Redirect=Log&logNo=222068004807,"하면 모두가 말하는 그곳,대한옥항상 줄이 길다는 이야기가 많았는데, 다행히 내가 간 날은 줄이 짧았다 :)대한옥메뉴판 오픈 11:00 마감 21:00 / 라스트 오더 20:00 2명인지라 꼬리 수육(32,000원/소)을... ","취향, 일상",https://blog.naver.com/dkssk715,2020-08-23
[ 대한옥 /신길점] - #포장 5편 : 꼬리찜으로 유명하지만 설렁탕도... ,https://blog.naver.com/melburne?Redirect=Log&logNo=222134992361, 대한옥기온이 점점 내려가다보니 따끈한 국물에 밥 한수저 말아 먹으면 참 좋습니다. 집에 뚝배기도 사다 놓다보니 점점 포장을 해서 집에서 편하게 먹는 날이 많아집니다. 가성비가 참 중요하다보니... ,오로지 먹기 위해 산다~(오먹산),https://blog.naver.com/melburne,2020-11-20
영등포맛집대한옥 ,https://blog.naver.com/nodun?Redirect=Log&logNo=221825434931,영등포대한옥꼬리수육맛집 추운 겨울 다녀왔지만 이제야 올리는 리뷰! 영등포 노포맛집으로 유명한대한옥 에 다녀옴 처음 갔을 땐 사람이 너무 많아서 줄이 진짜 길었고... 한 30분 기다렸는데도 앞에 한 팀도... ,정반듯세상,https://blog.naver.com/nodun,2020-02-26
꼬리수육과 도가니수육전문 50년 전통 노포의 내공 -대한옥 ,https://blog.naver.com/ky045?Redirect=Log&logNo=222313334302,강멍뭉입니다오늘은 늦은 친구 생일 파티 겸 영등포에서 모임이 있었습니다 어디 맛집 가볼까 고민하던 중대한옥꼬리수육을 강추하는 친구로 인해 그 쪽으로 발걸음을 하게 되었답니다대한옥*영업시간... ,일상 그리고 행복,https://blog.naver.com/ky045,2021-04-17
소꼬리수육 - 대한옥 ,https://blog.naver.com/leh5705?Redirect=Log&logNo=222461907236,깨1T. 부추 적당량 (꽁블사진) # 대한옥소꼬리 수육 #소꼬리 수육 국수 양념장 올린 꼬리 냐미냐미~~국수도 후루룩~~꼬리 한입 먹고 국수 후루룩 ~~ 맛지다♡#말복식 # 대한옥#소꼬리 수육 #꽁블님레시피,Hwanie 소풍 놀이 ~♡,https://blog.naver.com/leh5705,2021-08-08
(설렁탕) 영등포대한옥설렁탕 후기,https://blog.naver.com/hojune92?Redirect=Log&logNo=222096981528,"아침저녁으로 날이 쌀쌀한데 점심 뭐먹지 고민하던 차에 아내는 한식을 먹으라고 하고 친구들은 곰탕을 추천해서 영등포 설렁탕, 영등포 설렁탕맛집 검색해서 오게 된대한옥영등포시장 쪽에 있다. 영등포... ",주니어스의 개떡같은 블로그,https://blog.naver.com/hojune92,2020-09-23
 대한옥꼬리찜 꼬리곰탕,https://blog.naver.com/cmjhime0813?Redirect=Log&logNo=222521639652,영등포에서 줄서서 사온대한옥 의 꼬리찜. 예전에도 동생의 추천으로 삼각지에 있는 감자탕집에... 다데기처럼 조금 넣으니 곰탕이 더욱더 맛나더라구요. 동생아!....고맙다! 다음에는 누나가 쏜다.대한옥 ,네일스쿨&살롱 마니큐아,https://blog.naver.com/cmjhime0813,2021-09-30
[영등포] 최자로드대한옥소꼬리찜,https://blog.naver.com/rkely?Redirect=Log&logNo=222070285142,이곳은 영등포대한옥 이라는 곳이다. (최자로드에 나온 소꼬리찜집) 몇 달 전부터 가보고 싶었는데 내가 갈 수 있는 일요일은 휴무에... 주차대란까지... 그러나 기회가 왔으니 영등포대한옥위치를 봐서... ,스티브M의 일상블로그,https://blog.naver.com/rkely,2020-08-25
[ 대한옥 ] 꼬리수육 유명한 영등포대한옥 ,https://blog.naver.com/marymi1004?Redirect=Log&logNo=222272352811,꼬리수육 유명한 영등포 [ 대한옥 ] 첫사진부터 침 고이죠? (오늘아님주의) . . . 그냥 아무생각없이 도가니가 아파 도가니에 좋은걸 찾다가 꼬리수육 유명한곳을 발견 무려 30년이나 되었다는 이곳 위치해... ,신의손,https://blog.naver.com/marymi1004,2021-03-11
바라던 알꼬리로대한옥부추 꼬리찜 꼬리수육 만들기,https://blog.naver.com/nova750?Redirect=Log&logNo=222069536255, 대한옥꼬리찜 바라던 알꼬리 꼬리수육 만들기 영등포대한옥꼬리찜은 워낙 유명하고 사람들이 많이 찾는 음식이라 제가 몇년전 레시피를 공유하고 나서 이젠 많이들 만드시는거 같아요. 기존에 먹던... ,✌멋쟁이 개발자!,https://blog.naver.com/nova750,2020-08-24
[영등포 맛집] 국수 사리는 필수 소꼬리수육대한옥 ,https://blog.naver.com/minmogun?Redirect=Log&logNo=222295420719,가까운 지역인 영등포에서 가장 궁금했던 #영등포 대한옥# 대한옥으로 이동~~ 이런 곳이 있군요.... 공구 상가 한가운데 딱~~~ #소꼬리찜 #소꼬리수육 #영등포소꼬리수육 맛집입니다... 워낙 유명해서 뭐 설명이... ,민모군의 요리 먹고 조리 먹고,https://blog.naver.com/minmogun,2021-04-30
