title,link,description,bloggername,bloggerlink,postdate
보라앙마 2021년 6월 일상,https://blog.naver.com/violetdevil3?Redirect=Log&logNo=222522602605,"신사동 칠프로식당 가서 모듬에 육사시미 뿌시고 청담동 더그릴630가서 맛난 뼈세트도 뿌시고 역삼돈육지존 , 강남 콜라겐가든에서 돼지고기도 역삼 김양가서 양고기도 모조리 다 씹어먹고(?) 왔답니다.... ",보라앙마 일상맛집미용 블로그,https://blog.naver.com/violetdevil3,2021-10-01
역삼역 점심 맛을아는청년들 점심특선,https://blog.naver.com/hakjum7179?Redirect=Log&logNo=222526041396,아쉬웠지만 멀리 이동하기도 그렇고돈육지존 가서 삼겹살 먹을까 했으나 영업시간 전인지 문을 열지 않고... 오빠 집 주변으로 음식점들이 있기에 주변 탐색. 탐색하던 중 눈에 들어온 점심특선. 오 육개장이다!... ,학점친구,https://blog.naver.com/hakjum7179,2021-10-04
보라앙마 2021년 3월 일상,https://blog.naver.com/violetdevil3?Redirect=Log&logNo=222454245406,"이날은 역삼 호텔 잡고 고기 1, 2차 때리고 3차 호텔 달렸다가 염라대왕이랑 하이파이브함 ㅋㅋㅋㅋ 그 와중에 라비옥 라갈비랑돈육지존뼈삼겹 핵존맛이었구요. 보라앙마하면 빠질 수 없는게 또 여행!... ",보라앙마 일상맛집미용 블로그,https://blog.naver.com/violetdevil3,2021-08-03
이영자 추천 서울맛집 종결판 위치 상호 이름 메뉴 삼각지 몽탄... ,https://blog.naver.com/cwmylee?Redirect=Log&logNo=222517172372,38 도동집 산골공원 남도분식 슬로우치즈 돈까스잔치돈육지존곱 진미식당 진주집 한입소반 홍미닭발 성수삐딱 송쉐프 진대감 진도리닭도리탕 구삼부대찌개 굴다리식당 뉴만두집 대낚식당 주소 화면에,RIA's 링링's,https://blog.naver.com/cwmylee,2021-09-26
역삼역 고기집 삼겹살 맛나게 먹었어요!,https://blog.naver.com/iam_swoniii?Redirect=Log&logNo=222010202708, 돈육지존@ 위치/ 서울 강남구 테헤란로19길 18 영업시간/ 평일 11:00 - 23:00 Break Time 14:30 - 16:30 토요일 및... 저희가 다녀온돈육지존 은 역삼역 4번출구에서 도보로 4분정도 걸리는 곳에 있어서 접근성이 좋았고... ,나 혼자 재미삼아,https://blog.naver.com/iam_swoniii,2020-06-23
"서울 이영자맛집, 인생맛집 찾았습니다!",https://blog.naver.com/iam_swoniii?Redirect=Log&logNo=221986630410,"물론 주차장도 완비되어 있어서 자차 이용도 가능하고돈육 지존 의 가게 앞에는 서울... 부위별로 시켜서 맛볼 수도 있고 모둠 지존이라고 해서 뼈삼겹,삼겹살,목살,항정살,가브리살,갈매기살 모두가 나오는... ",나 혼자 재미삼아,https://blog.naver.com/iam_swoniii,2020-06-01
2021 4-2,https://blog.naver.com/featjm?Redirect=Log&logNo=222306175765,"다만 의자가 좀 불편하다는,, 다음날 점심은 역삼 msg맛집 # 돈육지존여기 #묵은지닭볶음탕 정말 너무너무 맛있어요 저녁에도 부지런히 청첩장 모임,, #빌즈 갑자기 성사된 점심,,, 내 사랑 ㄷㅇ을 보내야했던 날... ",toocoldbutneverbefrozen,https://blog.naver.com/featjm,2021-04-11
역삼호텔 고급진 마리호텔,https://blog.naver.com/violetdevil3?Redirect=Log&logNo=222290308800,스위트객실에 미드 영드를 볼 수 있는 NETFLIX에 티빙 OTT 서비스도 가능하다고 하니 참고하셔요^^ 식사는 근처 맛집돈육지존찾아가 뼈삼겹살 뿌셨는데요. 이영자 언니가 극찬을 한 곳이라 검색해서... ,보라앙마 일상맛집미용 블로그,https://blog.naver.com/violetdevil3,2021-03-28
모듬 지존 ,https://blog.naver.com/mi_soonlove?Redirect=Log&logNo=221330572381,600g 40000원 저희 # 돈육지존은 1등급 돼지고기 특수부위 (뼈삼겹.삼겹.목살.항정살.가브리살.... 나가기 때문에 저렴한가격에 신선한 원육 그대로 안심하고 드실수 있습니다 #모듬지존 #역삼맛집#특수부위,돈육지존[수제 뼈삼겹 전문점],https://blog.naver.com/mi_soonlove,2018-08-01
"10월 셋째주 2인가족, 신혼부부 주간밥상",https://blog.naver.com/daily_jjo?Redirect=Log&logNo=222540562754,[저녁 -돈육지존뼈삼겹] 남편이랑 오랜만에 퇴근시간 맞아서 평일 외식 ! 샐러드 먹자고 했더니 '밖에서 샐러드 사먹고 싶지 않아!!'라고 그래서 내 최애 돼지고기집돈육지존 에서 고기 사드림... ,사진찍는쪼언니 쪼쌤,https://blog.naver.com/daily_jjo,2021-10-18
이영자가 추천한다는 서울맛집 종결판 .jpg,https://snaketeacher.tistory.com/5696,테헤란로돈육지존/ 성동구 제스티살룬 / 도화길 곱 / 마포대로 진미식당 / 도산대로 홍미닭발 / 도산대로 송쉐프 / 삼성로 슬로우치즈 / 학동로 진대감 / 강남대로 진도리닭도리탕 / 압구정 뉴만두집 / 역삼로... ,뱀선생,https://snaketeacher.tistory.com/,2021-09-27
6월 첫째주,https://blog.naver.com/featjm?Redirect=Log&logNo=221557546821,"지하철 타기 전에 샐러드 픽업 회사 앞돈육지존묵은지닭볶음탕 진짜 최고존엄맛이다. 이렇게 해서 칠처넌밖에 안한다능!!! 화요일아침은 코코볼❤️❤️❤️ ^^아놔 팀장님,,, 즹짜 너무 하신 거 아님니까... ",toocoldbutneverbefrozen,https://blog.naver.com/featjm,2019-06-08
"[평택/서정동,송탄 배달]짬뽕 지존 _지옥 수제비 짬뽕(2단계)... ",https://blog.naver.com/kh_kmj9562?Redirect=Log&logNo=221437673793,"서정동, 송탄 맛집, 짬뽕 지존개인의 입맛은 다를 수 있습니다. 이 점을 참고 부탁드립니다. 짬뽕... 찹쌀 탕수육 1인분(11,000원)( 돈육등 심 국내산 150g)입니다. 사진 보시면 아시겠지만, 일단 양이 푸짐한 편은... ",연이랑 행이랑 축복이랑♡,https://blog.naver.com/kh_kmj9562,2019-01-11
[다니에르 맛집] 역삼역 고깃집 화덕고깃간 역삼본점 역삼역... ,https://blog.naver.com/danielxkim?Redirect=Log&logNo=222501761569,올라가면돈육지존바로 앞에 있는 화덕고깃간 역삼본점 역삼역 고깃집 화덕고깃간 역삼본점 역삼역 삼겹살집은 화덕고깃간만이 이루어낸 세계 유일의 불가능한 생각이였다 화덕을 통째로 손님에게 내오는... ,abstruse interdependence,https://blog.naver.com/danielxkim,2021-09-10
"대전 대흥동 맛집, 하남돼지집 돼지고기의지존 !",https://blog.naver.com/songjh155?Redirect=Log&logNo=220387833262,"대전 대흥동 맛집, 하남돼지집 돼지고기의지존 ! `하남돼지집 대흥점` 주소: 대전광역시 중구 대흥동 221... 직원분이 최상급돈육 을 사용한다는 자부심이 굉장하더라구요. 그 자부심에는 이유가 있었더라구요.... ",Bonjour,https://blog.naver.com/songjh155,2015-06-12
[이영자 맛집] 서울 맛집리스트 추천 2탄 / 서울여행 가는 분들... ,https://blog.naver.com/only7908?Redirect=Log&logNo=222424367375, 돈육지존돈육지존 은 편스토랑에 방영되었었는데요 직접 사장님이 수제로 포를 떠서 만드는 수제뼈삼겹이 대표메뉴입니다 수제뼈삼겹은 등갈비와 삼겹살을 함께 먹을 수 있다고 하는데요 맛도 지존급일지... ,soso Life :),https://blog.naver.com/only7908,2021-07-08
깔끔하면서 깊은돈육 수가 맛있는 김씨육면,https://blog.naver.com/thghd52?Redirect=Log&logNo=222173770625,"때돈육 면, 홍 돈육 면, 청 돈육 면 이렇게 있고 다 같은돈육 수 베이스인데 가장 기본이 그냥돈육 면이고... 쌈싸먹어야지존 맛입니다 (옥상에서 고수 키우는 사람) 이렇게 한그릇 끄읕 면이 되게 소면이나 중면... ",소슐랭,https://blog.naver.com/thghd52,2020-12-14
제주맛집-솥뚱껑삼겹살의지존!!!!!웅담식당,https://blog.naver.com/bd1109?Redirect=Log&logNo=120054501364,"솥뚜껑 삼겹살 구이 요리재료 싱싱한 제주 돈육100% 냉장, 냉동불가 맛있는 야채양념구이 ; 무채, 파지등 호일에 싸서 구워먹는 맛이 일품!!! 감자 , 마늘, 양파 구이 솥뚜껑 상황 일상 재료 육류 방법 굽기 20분... ",몽몽이의 about jeju,https://blog.naver.com/bd1109,2008-08-03
[일상] 09.06~09.12 금주 한달넘자마자 술마시는 이야기,https://blog.naver.com/orangemini26?Redirect=Log&logNo=222528621132,없네...사진이 그럴리가 없는데 다음날 점심 회사근처 수제버거집 맛도좋고 한데 먹기가 불편하도라 그래도 맛이 참좋았음 물론 수제버거는 비쌈 저녁에는 # 돈육지존 을 갔다 내 회사근처 단골집 드디어 몬드를... ,힘미니 블로그,https://blog.naver.com/orangemini26,2021-10-07
[인현동/문경등심] 추억의 냉동삼겹살의지존 이자 최고의... ,https://blog.naver.com/symin67?Redirect=Log&logNo=220708292895,하이포크는 우리나라 최초의 냉장돈육브랜드로서 3종의 돼지를 교잡해서 만든 하이포크 종돈을... 추억의 냉동삼겹살의지존 이자 역대급 최고의 냉동삼겹살집 문경등심 소개 나갑니다. 케케케... 문경등심... ,맛짱.. 케케케의 Tasty Food,https://blog.naver.com/symin67,2016-05-13
[맛집] 무한리필 돈까스지존- 흑수돈 (흑석동 수제 돈까스),https://blog.naver.com/proyd?Redirect=Log&logNo=220146806540,두툼한 국내산돈육 이다. 돈까스만 무한이냐고? 아니다. 모든 것이 무한리필이다. 내 맘대로 얼마든지 막 퍼다 먹어도 되는 진정한 무한리필 돈까스 전문점. 맛까지 최상급. 서울 흑석동에 돈까스 성지가... ,a moment of Proyd,https://blog.naver.com/proyd,2014-10-10
핫도그의지존▶▶ 신촌 프랭크서울 핫도그 디저트 카페,https://blog.naver.com/bonotang?Redirect=Log&logNo=221133355833,"가격도 정말 착한 핫도그 여러 가지 핫도그가 있습니다 저는 메이플치즈핫도그, 서울핫도그를 주문했어요 여기 서울 핫도그는 6종류의 핫도그가 있어요 소시지는 국내산돈육약 90%를 사용한 소시지... ",칠오공 맛집여행,https://blog.naver.com/bonotang,2017-11-06
191213 KBS2 신상출시 편스토랑 8회,https://blog.naver.com/ssophi_a?Redirect=Log&logNo=221975587349," 돈육지존주소 : 서울 강남구 테헤란로19길 18(역삼동 645-12) 전화번호 : 02-561-5653 메뉴 : 수제뼈삼겹 14,000원, 모듬지존 40,000원 영업시간 : 평일 오전 11시 ~ 밤 11시 / 브레이크 타임 오후 2시... ",Happy Sophie,https://blog.naver.com/ssophi_a,2020-05-24
야당동 중국집 짬뽕 지존파주운정점 짬뽕 구천오백원,https://blog.naver.com/housepanda?Redirect=Log&logNo=222215077441,"바지락, 홍합, 돼지고기가 들어가 있는데 면도 탱탱하고...국물도 아주 얼큰하고~밥까지 말아먹고 어디서 먹어본 익숙한 맛인데...짬뽕타임에서 먹어본돈육 수 맛이 난다, 야당동 중국집 짬뽕 지존 을 방문하고 난... ",줍줍,https://blog.naver.com/housepanda,2021-01-21
[역삼맛집 이영자맛집 고기맛집 강남맛집],https://blog.naver.com/tak407?Redirect=Log&logNo=222048867318,사장님 성함이 #이경목 목생화의 상생이 되는 성함이죠^^ 저희는 모든지존을 주문 돼지껍데기를 제외한 뼈삼겹 항정살 갈매기살 목살 또 있었는데 기억이 가물가물 ㅋ 새송이 버섯에 # 돈육지존의 글을 보면서... ,가새길연구소 폴리타로,https://blog.naver.com/tak407,2020-08-02
"선릉역 고기집, 화포식당 선릉점에서 맛있는 고기먹기 (feat.... ",https://blog.naver.com/nohsk0506?Redirect=Log&logNo=222320810946,"지난번에돈육지존다녀왔을 때도, 한돈 인증점이였는데, 역시 한돈 인증받은 식당이 고기가 더 맛있는 것 같아요 ㅎㅎ 우선 화포식당 위치는 선릉역 1번출구에서 도보 7-8분거리에 위치하고 있습니다. 자세한... ",메이하퍼,https://blog.naver.com/nohsk0506,2021-04-23
역삼역 술집 오징어청춘 매머드커피 연예인컵홀더이벤트,https://blog.naver.com/glady317?Redirect=Log&logNo=222410556637,"■ ■ ■ #역삼역커피 #역삼역카페 #매머드커피 이미 역삼 # 돈육지존 에서 1차를 했고 2차로 이동중에...돈육지존 에서 청국장이랑... 볶음김치 나오는 바람에 밥을 비벼서..ㅠ.,ㅠ 너무 잘 먹어버렸네.. 그래.... ",때지대--->때지대~♡,https://blog.naver.com/glady317,2021-06-26
3월 넷째주 신혼부부 주간밥상 + 일상,https://blog.naver.com/daily_jjo?Redirect=Log&logNo=222291155981,내입에는 니맛도 내맛도 아닌 ㅠ ㅠ [저녁 - 역삼동돈육지존 ] 회사 근처에 항상 사람이 많은 고깃집이 있었어 궁금해서 일보고 데리러 온 남편이랑 저녁먹으러 다녀왔다 축하 할 일도 있고해서 월요일부터... ,사진찍는쪼언니 쪼쌤,https://blog.naver.com/daily_jjo,2021-03-29
갈매기살지존+ 갈매기살 주무럭은 더더더더지존 ! 고기가... ,https://blog.naver.com/dshuhe?Redirect=Log&logNo=120151224810,국내산 일등급돈육 이랍니다!!+_+ 불판에 올려서 쟈글 쟈글 꾸버 봅니다 김치도 빼놓지 않고 같이 꾸버 주구영 꾸브면 다 맛있는거 같아영 ㅋ 갈매기살 ! 야들야들 한기 소고기맛이 납니다 분명 소고기가... ,양효미의 어드벤처 라이프,https://blog.naver.com/dshuhe,2012-01-29
"8월 14일의 하루. 역삼 돝고기, 에독코",https://blog.naver.com/xukii?Redirect=Log&logNo=222470940283,오늘은 친구네 집에 작업 하러 가기 전에 역삼에 가서 맛부림을 하기로 했어요~ 오늘 날씨도 선선하고 하늘도 완전 가을하늘~~ #돝고기 원래는 뼈삼겹 맛집돈육지존 에 가려고 했는데 오늘 사정상 닫으신다고... ,The Colour In Enything,https://blog.naver.com/xukii,2021-08-15
역삼역 고기집 삼겹살은 여기가 맛나네,https://blog.naver.com/z5671256?Redirect=Log&logNo=221507562997,* 오늘의 포스팅 : 역삼역 고기집돈육지존 ! 가게 이름처럼 뼈삼겹살로 역삼역 근처에서 돈육계의 지존이 될수 있을것만 같다!! 안녕하세요 여러분 추적추적 비는 내리고 마음은 울컥해지는 밤입니다. 이런때... ,리뷰 : Remember Beautiful things,https://blog.naver.com/z5671256,2019-04-07
"제주도 여행, 제주시 칠돈가",https://blog.naver.com/pinkylo?Redirect=Log&logNo=80204777493,한점 씹고 '맛있어~'가 세번이상 나옴 으흐흐흐 이것이 내가 그간 먹어본돈육 의지존 이리라~~~ 어쩜어쩜.... 말로 설명할수 없음..... 아아아아아아아아아아아아앙~~~ 내 이흑돼지를 먹으러 제주땅을 다시 밟으리... ,노노's Drowing Book,https://blog.naver.com/pinkylo,2014-01-04
05.15 - 05.22 인턴의점심/JLPT시험취소/카트라이더/폰스트랩,https://blog.naver.com/aksebddl?Redirect=Log&logNo=221990651841,^^ #인턴의점심 #역삼 돈육지존#묵은지닭볶음탕 아 오늘 날씨 짱 좋고요~! 이제 진짜 여름인가보다~ 나..... #인턴의점심 #역삼짬뽕 #역삼짜장면 #짬뽕지존역삼 #짬짜면 회사로 돌아오는 길에 빵이랑 마카롱... ,예슐랭 가이드,https://blog.naver.com/aksebddl,2020-06-05
일상 (헌 나라의 어린이 / 케이크 / 따라쟁이 / 서울 나들이),https://blog.naver.com/lovely_han_?Redirect=Log&logNo=221758657478,특별히 할 건 없었으나 서울 간지가 너무 오래돼서 서울 나들이 #할리스커피 할리스로 시작 # 돈육지존이영자가 추천한 고기 맛집 은수 데리고는 아직 삼겹살집에 못 가니까 이런 날 먹어줘야쥐 냠냠 차분히 앉아... ,오늘 하루도 러블리하게~♡,https://blog.naver.com/lovely_han_,2020-01-03
Daily #1 망원동 로우머 연남동 브라운하우스 추석연휴 10월... ,https://blog.naver.com/thdal645?Redirect=Log&logNo=222105943363,역삼돈육지존점심시간에 고기먹으면 너무 행복해 이영자님 픽 맛집이라고해서 기대 가득 멜젓은 정말 누가 만든걸까 너무 맛있잖아 모든 고기 치트키 멜젓 연남동 카페 하이웨스트 원래는 브라운하우스 먼저... ,Every moment counts,https://blog.naver.com/thdal645,2020-10-03
"편스토랑 이영자 뼈삼겹, 오픈샌드위치 정보/위치",https://zeee9.tistory.com/584,"정말 표현이 다양하지요 :)돈육지존대표-수제뼈삼겹 14,000원 대표-모듬지존 40,000원 메밀막국수 / 비빔메밀막국수 5,000원 돼지껍데기 10,000원 삼겹살 14,000원 02-561-5653 서울 강남구 테헤란로19길 18... ",곰곰지영,https://zeee9.tistory.com/,2019-12-15
편스토랑 이영자 돼지갈비 맛집 위치 뼈삼겹 맛집 강다니엘,https://blog.naver.com/driven76?Redirect=Log&logNo=221745820156,"고기 맛의 새로운 신세계를 체험하고 감탄하는 이영자 역삼동에 위치한 수제 뼈삼겹살 맛집은 역삼동돈육지존삼겹살, 목살, 항정살, 가브리살, 갈매기살, 돼지껍데기 등 다양한 부위를 판매하고 있습니다",♡ ♡ 루비의 일상,https://blog.naver.com/driven76,2019-12-22
"대구 짬뽕 맛집, 수성구 짬뽕 맛집 짬뽕 지존대구점",https://blog.naver.com/ii4721ii?Redirect=Log&logNo=221635461736,짬뽕 지존대구점 맛있는 짬뽕먹고 산책하려고 했는데 비가와서 아쉽ㅜㅜ 짬뽕이 먹고 싶은 날이니... 쫀득한 찹쌀피에 두껍지만 부드러운 국내산돈육 이 들어간 찹쌀탕슉. 부먹파인 저는 새콤달콤 맛있는 소스가... ,반가워유 리미월드,https://blog.naver.com/ii4721ii,2019-09-01
몰아쓰는 먹부림 일기+ 간단평가,https://blog.naver.com/hello_im_kareni?Redirect=Log&logNo=221843441115, 돈육지존(역삼동) 편스토랑에서 이영자가 감탄하는 걸 보고 집 근처길래 찾아갔는데.. 일단 실망했다. 너무나 평범한 고기. 뼈가 붙어있는 삼겹이라는 것은 신기했으나.. 맛이 쏘쏘.. 내가 맛있는 고기를 너무... ,Let's 카레니,https://blog.naver.com/hello_im_kareni,2020-03-08
"[전주 혁신도시 맛집] 떡갈비지존 , 한옥떡갈비 전주혁신점",https://blog.naver.com/dookbee?Redirect=Log&logNo=220929273161,"@ [전주 혁신도시 맛집] 떡갈비지존 , 한옥떡갈비 전주혁신점 이제는 자꾸 떡갈비에게 손이 갑니다. 원재료인돈육 , 야채, 양념의 100%를 국내산으로 한다고 합니다. 그리고 고기와 야채를 분쇄기에 넣지 않고 갈지... ",지구별 산책자,https://blog.naver.com/dookbee,2017-02-07
"삽겹살지존 !! 두툼한 얼리지... 돈앤돈,돈육 돈/",https://blog.naver.com/sungki17?Redirect=Log&logNo=90150566645,제주도식 삼겹살 구이 [근고기전문점] 제주삼겹살의지존! 연탄불에 구워 먹는 추억의 맛과 비리지 않은 짭짜롬한 젓갈에 찍어 먹는 그맛 ! 얼리지 않은 두툼한 생고기에서 나오는 육즙 ! 제주도식 근고기... ,참돈왕소금구이,https://blog.naver.com/sungki17,2012-08-24
 돈육 부위별 정보,https://blog.naver.com/hochi999?Redirect=Log&logNo=173168487," 돈육부위별 정보 안심살 성장기 어린이, 성인병과 비민인 사람, 남녀노소 누구나 안심하고 먹을 수... 또한지존 인 부위 부위위치 돼지 배쪽의 근육 부분 마리당생산량 11.4kg 주요특징 ① 지방과 살코기가... ",누군가를 위한 나......,https://blog.naver.com/hochi999,2012-12-12
한결같던 홍대 맛집 리스트,https://blog.naver.com/torowe?Redirect=Log&logNo=222182245779,"일반돈육 덮밥과 달리 얇은 대패에 양념을 재워 만든 불백에 계란, 김, 밥, 야채까지 함께 나와 한끼... 홍대 짬뽕 지존지존 짬뽕 9,500원 / 순두부짬뽕밥 9,500원 주소 : 서울 마포구 어울마당로 44-1 전화번호... ",까탈로운 로의일상으로,https://blog.naver.com/torowe,2020-12-22
홍대 돈까스지존부엉이돈가스 신메뉴 정복 후기,https://blog.naver.com/fireiceboy?Redirect=Log&logNo=220887832652,홍대 돈까스지존부엉이돈가스 신메뉴 정복 후기 쉐프일을 하시는 엄니가 겨울 휴식에 들어가셔서... 최고급돈육 을 써 역시 퀄이 다른 최고급 맛을 느낄 수 있었답니다. 그리고 꼭 함께드시길 권해드리고 싶은... ,미스터코리안 친형,https://blog.naver.com/fireiceboy,2016-12-16
"부창 수제 군만두 구매후기, 대구 부창반점의 군만두를 집에서",https://blog.naver.com/mudoidoi?Redirect=Log&logNo=222224825155,"블로그이웃이신 양남 지존 님께서 만두 포스팅을 올리신 적이 있는데 대구에 택배로 주문할 수 있는... 뒷면의 전체 모습은 이렇고요, 국내산돈육 과 채소로 위생관리가 잘 되는 시설에서 하나하나 손으로... ",돈내고사먹읍시다(舊Serendipity),https://blog.naver.com/mudoidoi,2021-02-09
신림곱창지존황학동막창,https://blog.naver.com/snowper?Redirect=Log&logNo=220894348057,신림곱창지존황학동막창 다른 살코기보다 비타민과 철분이 풍부하고 독특한 맛이 있는 곱창. 고기 좀... 국내산돈육 만을 사용하기 때문에 수입산에서는 볼 수 없는 특유의 동글동글한 모양을 볼 수 있어요.... ,신화&신혜성을 좋아하는 셩순이,https://blog.naver.com/snowper,2016-12-25
편스토랑 이영자 역삼동 뼈삼겹 고깃집 위치,https://lucyskitchen.tistory.com/2891,"「 상호/이름 」돈육지존「 ★ 구글맵 평점 (리뷰 개수) 」 5.0 / 5.0 (1) 「 주소/위치/어디 」 서울 강남구 테헤란로19길 18 역삼동 645-12 「 메뉴 가격 」 수제뼈삼겹 14,000원 모든지존 40,000원 메밀막국수... ",루씨의 부엌,https://lucyskitchen.tistory.com/,2019-12-14
입속이 즐거웠던 서울 이영자 맛집,https://blog.naver.com/hakkai4?Redirect=Log&logNo=221797408478,이름이돈육지존 이라는 곳이에요. 제가 평소에 제일 좋아라하는 음식중에 하나가 고기이기 때문에 망설임 없이 갔네요. 그리고 두번째이유는 역시 이영자. 서울 이영자 맛집 검색하니까 제 위치에서 가장... ,사과별,https://blog.naver.com/hakkai4,2020-02-05
"상남맛집 : 맛있는 짬뽕, 짬뽕 지존창원 상남점",https://blog.naver.com/toyou684?Redirect=Log&logNo=220688222659,"상남동 다이소 맞은편, 큰골목에서 보면 이손네일 맞은편에 위치한 맛있는 짬뽕집, 짬뽕 지존창원... 고추가루랑 간장소스에 찍어먹는게 탕슉을 제대로 먹는 자세쥬 ㅋㅋ 적당한 찹쌀가루랑돈육 의 만남이 아주... ",달달한 공간.,https://blog.naver.com/toyou684,2016-04-22
"김해 중국집, 짬뽕 지존 에서 얼큰한 짬뽕으로 추위 날려버리기 ♩",https://blog.naver.com/toyou684?Redirect=Log&logNo=220938722308,"김해 중국집 김해 짬뽕 맛있는 짬뽕 지존깔끔하고 맛있는 김해 중국집, 짬뽕 지존김해점 세찬 바람에... 소스에 살짝 찍어 먹어보니 얇은 튀김옷과 담백한돈육 의 조화가 일품이네요. 특히 촉촉한 찹쌀튀김옷은... ",달달한 공간.,https://blog.naver.com/toyou684,2017-02-19
"[내일배움카드] 국비지원교육 직업상담사2급(필기,실기)... ",https://blog.naver.com/willbesedu?Redirect=Log&logNo=221520805652,그 길따라 쭉~ 올라오시면 1층돈육지존 음식점 위에 2층 저희 윌비스평생교육원이 위치해 있으니 찾아 오시기 편할 겁니다. 궁금하신 사항은 아래 번호로 문의 주시면 친절한 상담 가능합니다~ 감사합니다.,윌비스평생교육원,https://blog.naver.com/willbesedu,2019-04-23
돼지껍데기,https://blog.naver.com/mi_soonlove?Redirect=Log&logNo=221330605631,10000원 저희 # 돈육지존#돼지껍데기 양념은 간장베이스로 온갖야채와 함께 끓여서 1주일간 숙성을... 멜젓과 함께 찍어드시면 최고의 껍데기 맛을 즐길수 있습니다 #돼지껍데기 #특제소스 # 돈육지존#역삼맛집,돈육지존[수제 뼈삼겹 전문점],https://blog.naver.com/mi_soonlove,2018-08-01
편스토랑 이정현 아파트 신혼집 남편 직업 나이 만능간장... ,https://blog.naver.com/dyangela?Redirect=Log&logNo=221735485309,"가츠오부시 가다랑어포를 체에 받쳐 우려주고, 건더기 걸러낸 후 간장만 병에 담아 보관한다 편스토랑 이영자 뼈삼겹살 상호 :돈육지존대표메뉴 : 수제 뼈삼겹 14000원, 시골청국장 5000원 주소 : 서울... ",안젤라,https://blog.naver.com/dyangela,2019-12-12
더 특별해진 프리미엄돈육‘강자 등극’ 화포식당,https://blog.naver.com/ju5566044?Redirect=Log&logNo=221119048223,"더 특별해진 프리미엄돈육‘강자 등극’ 화포식당 개성 있는 인테리어와 전략적인 사이드메뉴·주류... 깨끗하고 건강하게 자란 프리미엄돈육선별, ‘정말 맛있는 고기’에 대한 고민과 연구가 핵심이다.... ",juyongkorea,https://blog.naver.com/ju5566044,2017-10-17
"100% 국내산 냉장육의 육즙 지존생고기 전문점, 삼평동 맛집",https://blog.naver.com/junyoupcha?Redirect=Log&logNo=220359591892,"이용) 육즙 지존마약생고기 얼만큼지존 인지 한번 확인해 봐야겠습니당~!!!!!!!^^ 판교 삼평동에... ^^ 13,000원 / 180g (국내산 냉장 돈육 ) 불고기와 막창도 준비되어 있습니다. 소주한잔 곁들이기 그만인... ",똑똑이아빠네,https://blog.naver.com/junyoupcha,2015-05-15
