title,link,description,bloggername,bloggerlink,postdate
역삼동고기집은돈육지존 ,https://blog.naver.com/violetdevil3?Redirect=Log&logNo=222449827964,"역삼동고기집은돈육지존먹방계의 행성 보라앙마 매주 수요일은 어마마마와 데이트를 하는... 2021년 7월 기준 역삼동고기집돈육지존메뉴판 메뉴는 뼈삼겹, 삼겹, 목살, 항정살, 가브리살, 갈매기살... ",보라앙마 일상맛집미용 블로그,https://blog.naver.com/violetdevil3,2021-07-30
뼈삼겹이 맛있는 이영자 맛집! 역삼동 고기집돈육지존 ,https://blog.naver.com/s_zan?Redirect=Log&logNo=222445067546,봄돈육지존서울특별시 강남구 역삼동 645-12 평일 11:00 - 23:00 (2시반~4시반 브레이크/ 5시오픈) 토요일... 위치한 ' 돈육지존 '이 오늘 소개할 이영자 맛집이다. 편스토랑에서 이미 한 번 나왔어서 저녁시간만 되면... ,그냥 생활예체능인 최사짱,https://blog.naver.com/s_zan,2021-07-25
역삼 삼겹살 맛집 추천)돈육지존- 역삼역 맛집,https://blog.naver.com/kwen1030?Redirect=Log&logNo=222105126598,"역삼 삼겹살 맛집,돈육지존메뉴판이에요. 수제 뼈삼겹 및 모든지존을 베스트 메뉴로 하면서 삼겹살, 목살, 항정살, 가브리살, 갈매기살 및 돼지껍데기를 고기 메뉴로 팔고 있었어요. 일단, 강남 역삼 부근에서... ",두근두근 세동동,https://blog.naver.com/kwen1030,2020-10-02
강남역 고깃집돈육지존모듬지존 가족회식,https://blog.naver.com/jbjoo0537?Redirect=Log&logNo=222324070343, 돈육지존 의 모듬지존 세트메뉴로 회식하는 한상차림 모습이다. 강남역 고깃집 대표 브렌드 모듬지존을 직원이 직접 구워주는데 손놀림이 익숙하여 번개 같다. 숯불이 강해서 천천히 굽다가는 태울 수도... ,꿈과 낭만으로 보는 여행 스케치,https://blog.naver.com/jbjoo0537,2021-04-26
[역삼역 맛집] 역삼동 이영자 맛집 뼈삼겹이 맛있는돈육지존 ,https://blog.naver.com/darkyoon85?Redirect=Log&logNo=222336660072,그 서비스는 잠시 후에 알려드릴게요♡ 제가 다녀온 곳은 ' 돈육지존 ' 이에요! 상호부터가 지존이래요! 편스토랑 이영자 맛집으로 방영된 곳인데.. 이영자 맛집은 한번 알려지면 다 난리 나는 거 아시죠? 여기는... ,다크윤의 맛집이야기♥,https://blog.naver.com/darkyoon85,2021-05-04
[역삼]돈육지존- 돼지고기 맛집,https://blog.naver.com/fa1772?Redirect=Log&logNo=222035891364,된돈육지존#이영자맛집 이라고 늘 입간판이 되어 있어서 궁금하긴 했어요ㅋㅋ 내부는 좌석도 꽤 있는 편이구요 가격표는 이러합니다. 저희는 모듬지존을 시켰는데요 보통 150-200g이 1인분이니까... ,책 보고 차 마시는 집,https://blog.naver.com/fa1772,2020-07-20
역삼역 고기돈육지존뼈삼겹 한돈 삼겹살 존맛,https://blog.naver.com/jyj921028?Redirect=Log&logNo=222472402230,역삼역 고기 먹으러돈육지존고고링했당 퇴근하구 뚠뚠 걸어가면 금방 도착함❤ 선미넴 퇴근 시간 맞춰서 가찌롱 역삼역 고기돈육지존역삼역이랑 강남역 사이에 있어서 접근성이 개조앙 편스토랑 영자언니... ,먹고 노는 일상 ♥,https://blog.naver.com/jyj921028,2021-08-16
역삼역 고기집돈육지존편스토랑 이영자 맛집,https://blog.naver.com/10000reasons?Redirect=Log&logNo=222125200845,고기집돈육지존 이에요. 일단 이영자님이 선택한 맛집이라면 믿을 수 있는 곳이잖아요? ㅎㅎ 제가 먹어보니까 진심 너무 맛있어서 이제 단골될 것 같은 이 곳돈육지존 에 대한 솔직후기 시작해볼께요. 저희는... ,슬기한이 행복하게 살자,https://blog.naver.com/10000reasons,2020-10-24
강남역 고깃집 ㅣ 이영자 편스토랑 ~돈육지존(ft. 수제 뼈삼겹),https://blog.naver.com/50mmcap?Redirect=Log&logNo=222049488793,강남역과 역삼역 중간에 위치한 뼈삼겹 전문점 강남역 고깃집 : 이영자 편스토랑 ~돈육지존(ft.... 강남역 고깃집으로 제주에서 10년 넘게 주방 일을 하신 셰프가 있는돈육지존 이 그곳입니다. 금요일이었는데... ,나의 창으로 바라본 세상,https://blog.naver.com/50mmcap,2020-08-03
 돈육지존: 역삼동 삼겹살 이영자 추천맛집!,https://blog.naver.com/redapplehr?Redirect=Log&logNo=222433887076,"맛집,돈육지존 으로 오시면 됨ㅇㅇ 맛있게 구워주시는 이모님!! 직접 고기를 구워주셔서 넘 좋더라구요! 더운날 불판앞에서, 신경쓰지않고 가만히 기다리고 계시면 됩니다 ㅎㅎㅎ 역삼동 삼겹살 맛집, 돈욱지존... ",Magical playgROund️☆S2,https://blog.naver.com/redapplehr,2021-07-16
역삼 고기집돈육지존이영자 맛집 너무 맛있다!,https://blog.naver.com/lascsi0720?Redirect=Log&logNo=222520433951,주변에 찾아보니 강남에 있는 삼겹살 집 중 뼈삼겹 맛집을돈육지존 이 유일해서 더 설레였던 것 같아요! 자리를 잡고 모듬지존을 시키려고 주문을 했는데 와우~~~7시 반이었는데도 불구하고 남아있는 메뉴는 뼈... ,❤️ 뚜루뚜의 생기발랄일상❤️,https://blog.naver.com/lascsi0720,2021-09-29
강남역 회식장소 강남 유일 뼈삼겹살 전문점돈육지존 ,https://blog.naver.com/cgs2020?Redirect=Log&logNo=222048539014,회식장소돈육지존 은 주방장 출신 핸드 메이드 맛반찬과 합리적인 가격 그리고 편스토랑 이영자... 모듬지존 그외 돼지고기 부위가 있고 디저트로는 밥종류와 국수 그리고 계란찜이 있어요 모듬지존은 전에... ,미래를 준비하는 사람들(Someday our time will come),https://blog.naver.com/cgs2020,2020-08-01
이영자 맛집 역삼돈육지존 ,https://blog.naver.com/violetdevil3?Redirect=Log&logNo=222290393484,"이영자 맛집 역삼돈육지존먹방계의 행성 보라앙마 몇일전엔 오랜만에 맛나는 남의살 씹고 뜯고... 2021년 3월 기준 이영자 맛집돈육지존메뉴판 메인메뉴는 수제 뼈삼겹, 삼겹살, 목살, 항정살, 가브리살... ",보라앙마 일상맛집미용 블로그,https://blog.naver.com/violetdevil3,2021-03-29
역삼역 회식 장소 삼겹살 맛집돈육지존뼈삼겹살 후기,https://blog.naver.com/cocolism?Redirect=Log&logNo=222502320050,메뉴판 역삼역 삼겹살 맛집돈육지존 의 베스트 메뉴는 역시 뼈삼겹이더라고요. 모듬지존 같은 경우에는 회식하러 오실 때 많이 주문하신다고 하셨어요. 저랑 친구도 가장 인기 있는 뼈삼겹으로 주문했어요.... ,Daily life with COCO❤️,https://blog.naver.com/cocolism,2021-09-11
역삼돈육지존삼겹살이 끝내주네!,https://blog.naver.com/jungjinkim97?Redirect=Log&logNo=221833783409,저희가 간 곳은 역삼 삼겹살 집돈육지존입니다. 방문일: 2020년 2월 28일 방문장소: 서울 강남구 역삼돈육지존작성일: 2020년 3월 2일 작성장소: 서울 관악구 신림동 서울 강남 삼겹살 집 리뷰를 시작합니다. 먼저... ,서울 기상센터 Weather Center of Seoul,https://blog.naver.com/jungjinkim97,2020-03-02
[서울/역삼]돈육지존:: 역삼역 이영자맛집 뼈삼겹살 존맛 고기집,https://blog.naver.com/2se3031?Redirect=Log&logNo=222500236000,"고기집돈육지존이영자맛집 아무생각 없이 걸어가다가 편스토랑 이영자 맛집이라고 써있어서 시선이 갔다 (・ิω・ิ) 역삼역 존맛 고기집돈육지존이영자맛집 그래도 원래 찾은 곳을 가려고, 다음에... ",이 세상 모든리뷰,https://blog.naver.com/2se3031,2021-09-09
역삼역 삼겹살이 맛있는 맛집돈육지존 ,https://blog.naver.com/hc94?Redirect=Log&logNo=222509783709, 돈육지존가게 상호부터 자부심이 느껴지는 고기집입니다. 가게 전면에는 어떤 음식이 대표인지 한눈에... 새송이 버섯에 가게 상호인돈육지존 이 찍혀져 있는데 사장님이 일본에 방문했을 때 얻으신... ,Chan의 하루,https://blog.naver.com/hc94,2021-09-18
역삼 삼겹살돈육지존 에서 뼈삼겹!! 존맛탱,https://blog.naver.com/tango21c?Redirect=Log&logNo=222140255580,그러면 본격적으로 역삼 삼겹살돈육지존 에서 뼈삼겹!! 존맛탱 포스팅을 시작하도록 하겠습니다. 역삼돈육지존1.고기 정말맛있다 2.합리적인 가격 3.국밥도 존맛탱 ㅠㅠ 아.. 또 생각나노돈육지존 은 역삼역 4번... ,투데이,https://blog.naver.com/tango21c,2020-11-10
역삼 삼겹살 고기집돈육지존후기,https://blog.naver.com/sylvia917?Redirect=Log&logNo=222449198149,맛집이라는돈육지존 에 다녀왔어요. 사장님과 이영자님께서 함께 찍은 사진이 가게 앞에 딱 보이구요!...돈육지존 이 강남 유일 뼈삼겹 전문점이라고 해요. 편스토랑에서 이영자님이 극찬하신 그 부위!!! 오늘... ,실비아의 요모조모,https://blog.naver.com/sylvia917,2021-07-29
역삼 삼겹살 이영자 맛집 강남 뼈삼겹살 전문점돈육지존 ,https://blog.naver.com/zhdzhddl1003?Redirect=Log&logNo=222482001429,강남 뼈삼겹살 전문점 이영자 맛집돈육지존돈육지존✿ 영업시간 : 매일 11:00 ~ 23:00 ✿ 문의 : 0507-1308-5653 ✿ 위치 : 서울특별시 강남구 역삼동 645-12 안녕하세요~♡ 로제에용( ღ'ᴗ'ღ )! 제가 요즘 삼겹살을... ,쥐똥구리의 비밀일기 *,https://blog.naver.com/zhdzhddl1003,2021-08-24
역삼역 고기집 이영자 맛집돈육지존 ,https://blog.naver.com/glady317?Redirect=Log&logNo=222405967659,■ ■ ■ #역삼역고기집 #역삼역삼겹살 # 돈육지존02.561.5653 평일 am 11:00 - pm 11:00 (BT pm 2:30 - 4:30) 토요일/공휴일 pm 4:00 - pm 9:00 일요일 휴무 오늘은 너로 정했다!!돈육지존 !!! 내 친구와 종로 참치집 가려다 내가... ,때지대--->때지대~♡,https://blog.naver.com/glady317,2021-06-22
"역삼 고기집, 편스토랑 이영자가 다녀간 맛집돈육지존 ... ",https://blog.naver.com/nohsk0506?Redirect=Log&logNo=222309324060,사장님께서 이 인증서 있으니까 고객분들이 더 믿고 좋아하신다고 하시더라구요 ㅎㅎ돈육지존메뉴판 -수제 뼈삼겹 200그램 15000원 -모듬지존 600그램 42000원 -삼겹살 180그램 15000원 -목살 180그램 15000원 -항정살... ,메이하퍼,https://blog.naver.com/nohsk0506,2021-04-14
이영자 편스토랑 맛집 역삼고기는돈육지존 에서!,https://blog.naver.com/freemeadow?Redirect=Log&logNo=222150383630,"역삼 고기 맛집인돈육지존갔다 왔습니다! 편스토랑에서 이영자씨가 소개한 맛집이라 가기 전부터... 저희는 뼈삼겹, 목살, 가브리살, 항정살 등이 포함되어 있는 모듬지존(42,000) 시켰습니다! 친절하게 직접... ",ZERO TO TEN,https://blog.naver.com/freemeadow,2020-11-21
[역삼동 고기]돈육지존:: 육즙좔좔 이영자 맛집,https://blog.naver.com/cicapuca12?Redirect=Log&logNo=222454732550,"[역삼동 고기]돈육지존:: 육즙좔좔 이영자 맛집 역삼동에 맛있는 고깃집이라 소문난돈육지존 에... 모듬지존 (600g) 42,000원 드뎌 고기가 나왔다! 우리는 이거저거 다 먹고싶어서 세트메뉴를 시켰는데 양도 많고... ",Rong_log :D,https://blog.naver.com/cicapuca12,2021-08-02
강남맛집 / 역삼맛집 [ 돈육지존 ] 이영자 맛집 역삼역 고기 맛집... ,https://blog.naver.com/hy_goddess?Redirect=Log&logNo=222304641625,ㅎㅎ 제쥬 맬젓도 나와주어 불판 위에 올려주십니다돈육지존맛있게 드시는 방법 고기 먹기 전에 정독하고 가야겠죠?ㅎㅎ 모둠지존 한상이 나왔습니다 고기 질이 너무너무 좋아요 생전 처음 보는 뼈삼겹살도... ,아담한그녀의소박한이야기,https://blog.naver.com/hy_goddess,2021-04-09
역삼역 맛집돈육지존뼈삼겹살 맛있어서 또 가고싶은 곳,https://blog.naver.com/106904?Redirect=Log&logNo=222254249243,"모듬지존 등장!!! 차마 집게와 가위까지 들고 사진을 찍진 못했어요 ㅋㅋㅋㅋㅋㅋㅋㅋㅋㅋ크크돈육지존 은 사장님께서 고기도 다 구워주셔요!! 구우면서 부위도 다 설명해주시고, 넘 친절하셔용 편하게 먹을 수... ",소소한 일상을 특별하게ෆ,https://blog.naver.com/106904,2021-02-24
역삼 고깃집 최애 맛집돈육지존육질 최고,https://blog.naver.com/agy002888?Redirect=Log&logNo=222286202560, 돈육지존 . 이름부터 지존이라 얼마나 괜찮을지 기대만빵! 이영자님이 나온 편스토랑에도 방영된 고깃집 이에요ㅎㅎ 먹방 대세중 대세인 맛집이니 믿고 먹어보기로 했어요~ 메뉴입니다.오직 돼지고기 숙성육만... ,솔직하게 재미로 해보는 블로그,https://blog.naver.com/agy002888,2021-03-24
역삼맛집돈육지존 ,https://blog.naver.com/birthninety4?Redirect=Log&logNo=222137647708,"코로나는 조심하면서 해야하는 이 시국 회식 역삼돈육지존다녀왔습니다.. 후기 갈겨볼게요 ~ 일단... 기계적인 느낌으로 착착 ㅋㅋㅋ 내가 먹은 건 모듬지존인데 삼겹살, 목살, 항정살, 가브리살, 갈매기살... ",깐따삐아,https://blog.naver.com/birthninety4,2020-11-07
[역삼맛집] 이영자맛집으로 유명한 뼈삼겹살돈육지존 ,https://blog.naver.com/julliasy?Redirect=Log&logNo=222277412939,"오늘은 [역삼맛집] 이영자맛집으로 유명한 뼈삼겹살돈육지존을 소개하려고 해요 : ) 으아... 비쥬얼 장난아니죵?.?돈육지존 은 편스토랑 8회 방영된 곳으로, 이영자맛집이에요 : ) . 영자언니 맛집은 모두... ",여기는 행복한 뚱혜네❤️,https://blog.naver.com/julliasy,2021-03-16
역삼역 삼겹살돈육지존편스토랑 나온 이영자 맛집,https://blog.naver.com/qpzm15987?Redirect=Log&logNo=222036897882, 돈육지존베스트 메뉴는 두가지가 있었는데 수제 뼈삼겹과 모듬지존 이렇게 있었는데 모듬지존은 3인 이상이라고 적혀 있길래 저희는 수제 뼈삼겹 2인분을 주문했습니다. 메뉴를 주문하고나서 가게 구경을... ,soso,https://blog.naver.com/qpzm15987,2020-07-21
역삼역 이영자맛집 뼈삼겹!!돈육지존 ,https://blog.naver.com/smmotors7325?Redirect=Log&logNo=222036393263, 돈육지존우연히 찾았습니다 진짜 이런맛집을 찾다니!! ㅋㅋㅋㅋ대박입니다 이영자 맛집이기도 하네요 메뉴판 일단 고기 저렴해요 디저트 메뉴에 청국장이 있는것도 너무 반갑죠 ㅎㅎ 맛있게 먹는 법 있긴 한데... ,공임나라석동점(슈퍼맨모터스),https://blog.naver.com/smmotors7325,2020-07-21
강남역 고깃집 : ' 돈육지존 '에서 모듬지존 먹고 왔어요... ,https://blog.naver.com/bella8392?Redirect=Log&logNo=222033787358,"그리고 등장한돈육지존 의 모듬지존입니다. 모듬지존은 600g으로 뼈삼겹, 삼겹, 목살, 항정상, 가브리살, 갈매기살로 구성되어져 있어요. 정말 다양하게 나오지 않나요? 구성이 넘 맘에 들었던 것 같아요. 게다가... ","예쁜건 많아, 소중한건 나 하나고",https://blog.naver.com/bella8392,2020-07-17
역삼동 고기 역삼동 맛집돈육지존여기 대박..!,https://blog.naver.com/bbanana001?Redirect=Log&logNo=222318479400,ㅎㅎ 사장님만 믿고 묵겠습니당 ㅎㅎㅎ 모듬지존과 뼈삼겹 사진만 봐도 너무 먹음직스러워요 역삼동 고기 역삼동 맛집돈육지존메뉴 역삼동 고기 맛집돈육지존 은 강남 유일 뼈삼겹살 전문점이에요 ㅎㅎㅎ... ,울라프 블로그,https://blog.naver.com/bbanana001,2021-04-21
역삼역 맛집/편스토랑 이영자 뼈삼겹돈육지존 ,https://blog.naver.com/daily_jjo?Redirect=Log&logNo=222308428761,#역삼역맛집 #역삼동맛집 #역삼고깃집 #이영자뼈삼겹 #편스토랑맛집 # 돈육지존#역삼 돈육지존# 돈육지존 뼈삼겹 #쪼쌤 #쪼언니네 #맛집 #일상 #리뷰 #여행 #사진찍는언니 #일상블로그 #내돈내산 역삼역 고깃집... ,사진찍는쪼언니 쪼쌤,https://blog.naver.com/daily_jjo,2021-04-13
역삼역 삼겹살 한돈인증 찐맛집돈육지존 ,https://blog.naver.com/moonpig12?Redirect=Log&logNo=222277462081,안녕하세요 은디입니다 얼마전 진짜 맛있는 역삼역 삼겹살집을 찾아서 기쁘게 포스팅을 시작합니다 펀스토랑 방영 이영자맛집 한돈인증점돈육지존강남 유일 뼈삼겹살 전문점인돈육지존가게이름이 왜... ,"내 삶의 주인은 나야, ❤️",https://blog.naver.com/moonpig12,2021-03-16
강남역 고깃집/[이영자 맛집] 뼈삼겹돈육지존 ,https://blog.naver.com/guswls5128?Redirect=Log&logNo=222146718037, 돈육 지존 의 메뉴에요! 대표 수제 뼈삼겹 외에도 다양한 부위가 많아요!! 시작은 먼저 모듬지존으로 주문하고 기본 상차림이 나왔어요! 사진은 못찍었는데 볶음 김치도 같이 나와요! 볶음 김치가 보글보글... ,진아 데일리,https://blog.naver.com/guswls5128,2020-11-17
역삼역 뼈삼겹살 맛집돈육지존다녀왔어요,https://blog.naver.com/jinmath78?Redirect=Log&logNo=222297003633,오늘은 그 중 하나인 4번 출구쪽 먹자골목 # 돈육지존이야기 시작해 볼께요. 수제 #뼈삼겹살 전문점으로... 저도 강남 영어회화스터디 하고 방문해 보았어요 ㅎㅎ돈육지존버섯에 새겨진 로고에도 정성이 이거... ,랭스영 영어회화스터디,https://blog.naver.com/jinmath78,2021-04-03
역삼 고기 '돈육지존' 편스토랑 이영자 맛집 드디어 가보다!,https://blog.naver.com/jane0104319?Redirect=Log&logNo=222035844219,방금 밥 먹었는데 사진 보니까 금새 또 배고파...편스토랑에서 이영자 언니가 뼈삼겹 먹는 편 보고 너무 먹고 싶어서 남자친구 찬스써서 드디어 역삼 고기돈육지존 을 방문했어요! 역삼 고기 상호명 -돈육지존 ... ,홍쨩의 여행스케치,https://blog.naver.com/jane0104319,2020-07-20
역삼역 회식돈육지존편스토랑 이영자맛집 뼈삼겹이 진리,https://blog.naver.com/cool8360?Redirect=Log&logNo=222348209006,역삼역 고깃집은돈육지존 이 지존이어라돈육지존서울 강남구 테헤란로19길 18 평일 11:00~23:00 (2:30~4:30 B.T) 토 16:00~21:00 일요일휴무 ♥ 네이버예약시 음료서비스 ♥ 리뷰 작성 후 재방문시 시골청국장 서비스... ,찌니의 기록,https://blog.naver.com/cool8360,2021-05-12
역삼 고깃집돈육지존맛집이네요,https://blog.naver.com/lklk332?Redirect=Log&logNo=222504760730,역삼 고깃집돈육지존맛집이네요 베니룽. 오늘도 영리피플컴퍼니 소속 로얄 에듀테이너 코치 맨즈베니 접속쓰 하... 이거 원래 아까 작성하려다가 이제 작성하게 되었다 ㅋ 오늘은 정말 바쁜날.. 워낙 바빴다... ,로얄 에듀테이너 맨즈베니,https://blog.naver.com/lklk332,2021-09-13
강남역삼역 이영자고기맛집 수제뼈삼겹돈육지존 ,https://blog.naver.com/ii_0_ii?Redirect=Log&logNo=222189617487,역삼역 고기맛집 # 돈육지존#이영자맛집추천 역삼역 4번출구쪽라인에 뒤편 골목길에 있어요! 선매떡에서 바로 근처라 쉽게 찾을 수 있어요오~ 점심메뉴도 파는데 유명한건 저녁메뉴 고기고기!!!! 오픈시간은 11... ,쏘냐잉의 살맛나는맛집,https://blog.naver.com/ii_0_ii,2020-12-29
강남 회식 장소로 딱인 편스토랑 이영자맛집돈육지존 ,https://blog.naver.com/jayoon08142?Redirect=Log&logNo=222052850981,"강남 회식 장소로 딱인 편스토랑 이영자맛집돈육지존주소 : 서울 강남구 테헤란로19길 18 예약번호 : 02... 곳,돈육지존돈육지존메뉴 및 가격 아까도 언급했듯이 강남 유일 뼈삼겹살 전문점이라는 것..... ",리뷰하는 블로그 ♥,https://blog.naver.com/jayoon08142,2020-08-06
이영자편스토랑 뼈삼겹맛집 돈육지존 ,https://blog.naver.com/anna0524ji?Redirect=Log&logNo=222114248600,"#역삼동맛집#이영자맛집#편스토랑맛집#이영자편스토랑소개# 돈육지존 #역삼동고기집#역삼동뼈삼겹... 저는 수제뼈삼겹 부터 목살,항정살, 가브리살,갈매기살이 모두 있는 모듬지존을 먹어보았는데요 이렇게... ",말타는 슈퍼모델,https://blog.naver.com/anna0524ji,2020-10-13
"역삼역 맛집, 역삼동 삼겹살 “ 돈육지존 ” 뼈삼겹살 살살 녹아요!",https://blog.naver.com/lune9may?Redirect=Log&logNo=222297598619,역삼동에 위치한 “ 돈육지존 ” 다녀왔어요! 비오는 날은 역시 삼겹살이죠 ❤️돈육지존 은 수제뼈삼겹이 유명한 역삼동 맛집이에요~ 편스토랑 8회 방영된 이영자 맛집으로 유명세를 탄듯해요! 한돈인증점으로... ,MINJI KOO,https://blog.naver.com/lune9may,2021-04-03
[역삼역맛집] 신선했던 삼겹살 ' 돈육지존 ',https://blog.naver.com/newslab?Redirect=Log&logNo=222098386287,"오늘은 역삼역맛집 역삼고기집돈육지존소개해드릴게요! 이영자맛집 으로 유명한돈육지존 , 이영자맛집 하면 뭔가 그냥 믿음이가요 ㅋㅋ 얼마나 맛있나 궁금해서 방문했습니다!!! 역삼역맛집 역삼고기집... ",문득 그런날 : de moon,https://blog.naver.com/newslab,2020-09-24
고기 땡길땐돈육지존 ~!,https://blog.naver.com/gpsosh?Redirect=Log&logNo=222009149273,#역삼동_맛집 # 돈육지존#이영자맛집 이영자도 인정한돈육지존 이라더니 역쉬! 맛있다! 고기찍어먹는 멸치액젓이 가미된 특제소스도 별미^^ 고기 땡길땐돈육지존 ~! 경목오빠 대박나세요~^^ #산친구 #산우 #역삼동... ,유사나는 기회다,https://blog.naver.com/gpsosh,2020-06-22
편스토랑 이영자 뼈삼겹 역삼돈육지존 ,https://blog.naver.com/bbbb1231?Redirect=Log&logNo=221736487942,돼지고기 가장 인기있는 부위와 특수부위를 한번에 맛볼수 있는 모듬지존 갈비양념에 1주일 숙성시켜 탄생한 돼지껍데기도 인기메뉴라고 합니다. 출처돈육지존편스토랑 이영자 뼈삼겹 역삼돈육지존 의... ,피닉스의 일상블로그,https://blog.naver.com/bbbb1231,2019-12-13
이영자 맛집인 역삼돈육지존 에다녀온 후기!!!!✨(feat.삼겹살... ,https://blog.naver.com/dain3136?Redirect=Log&logNo=222197759949,오늘은 이영자님도 다녀간돈육지존 왔어요!!! 저희 원장님이 데려와준곳이에여!! 같이몇번이나... 기❤️ 색깔도 선홍빛인게 너무 맛있어보이죠ㅜㅜ 저희는 3명이서 모둠지존 시켰습니다!! 역시 고기엔 소주죠... ,체다잉의 먹고 살기,https://blog.naver.com/dain3136,2021-01-05
역삼 고깃집 이영자 삼겹살 존맛 맛집 ' 돈육지존 ',https://blog.naver.com/wlrmarksek1?Redirect=Log&logNo=222530273843,#역삼 고깃집 역삼 고깃집돈육지존 은 방송에 나와서 이영자맛집으로 유명한 곳입니다! #역삼 고깃집 이영자 삼겹살 이렇게 한돈 판매 인증서도 걸려있었습니다ㅎㅎ #이영자 삼겹살 이영자 삼겹살 모듬지존으로... ,파란헤어 유진부장,https://blog.naver.com/wlrmarksek1,2021-10-08
역삼동돈육지존: 뼈삼겹살 구이와 목살,https://blog.naver.com/tlcb0155?Redirect=Log&logNo=222144452912,식당 가서 삼겹살을 먹어본 기억이 오래된 것 같아서 삼겹살 생각이 나던 찰나에 역삼역돈육지존 을 다녀오게 되었습니다. #역삼역 돈육지존역삼역돈육지존뼈삼겹살 집 # 전화번호 : 02-561-5653 # 주소 : 서울... ,코락지의 소소한 일상이야기,https://blog.naver.com/tlcb0155,2020-11-21
역삼역 회식돈육지존이집 고기 제대로네요,https://blog.naver.com/9204zzz?Redirect=Log&logNo=222033659464,"회식돈육지존 에서는 다양한 메뉴들이 있는데요, 모듬지존을 먹어볼까.. 뭘 목어볼까 하다가 수제 뼈삼겹이 뭔가 특이해보이기도 하고 베스트 표시가 있어서 수제 뼈삼겹을 시켰어요 삼겹살에 뼈가 붙어있다니... ",Day tripper Sunny world,https://blog.naver.com/9204zzz,2020-07-17
강남역 + 역삼역 + 고기맛집 +돈육지존 ,https://blog.naver.com/kimch3157?Redirect=Log&logNo=222006130962," 돈육지존 입니다,, 저혼자 알고 싶,,,, 었,,, ㅋㅋㅋ 먼저 메뉴판 뼈가 있다해도 1인분 15,000원이면, 가격 착함!! 밥 가격들 괜찮음!!! 삼겹, 항정, 가브리 모두모두 가격 괜찮음!! 일단 가격 합격 내부도 깔끔!... ",창일카마스타,https://blog.naver.com/kimch3157,2020-06-19
강남역 고깃집 ‘ 돈육지존 ' 뼈삼겹이랑 김치찌개 강추!!,https://blog.naver.com/konkkk1993?Redirect=Log&logNo=222109343419,꼬기는 사랑..❤️ 이번에 방문한 강남역 고깃집은돈육지존 이라는 곳인데 이영자님의 뼈삼겹 맛집으로도 유명한 곳이에요 #강남역고깃집 # 돈육지존강남역 고깃집돈육지존야근하고 9시에 방문한 강남역... ,Shuzzi World,https://blog.naver.com/konkkk1993,2020-10-07
역삼동고기집돈육지존맛집으로 인정합니다.,https://blog.naver.com/hrt1144?Redirect=Log&logNo=221704644746,"정말 맛집인듯 ^_^돈육지존메뉴중 모듬지존 저희는 메뉴중에 모듬지존 600g 을 시켰어요 (뼈삼겹, 삼겹살, 목살, 항정살, 가브리살, 갈매기살) 사진을 잘 못찍어서 그러는데 비쥬얼이 장난아니에요 진심!! 캬... ",그 남자,https://blog.naver.com/hrt1144,2019-11-11
