title,link,description,bloggername,bloggerlink,postdate
"배방에서도 맛 볼 수 있는 순대의지존 ,병천 아우내순대",https://blog.naver.com/ureka1234?Redirect=Log&logNo=220122920000,유관순 열사의 3.1만세운동이 열린 아우내장터에 약 50년 전으로돈육가공 공장이 들어오면서돈육 의 가공 과정에서 나오는 부산물을 효과적으로 처리하고자 돼지창자 속에 여러 가지 채소와 선지를 넣어... ,내가 꿈꾸는 아름다운 세상,https://blog.naver.com/ureka1234,2014-09-15
신촌돈까스 서강대맛집 미스터빠삭 서강대점 돈까스의지존 ... ,https://blog.naver.com/niceddok?Redirect=Log&logNo=221545476267,신선한돈육미스터 빠삭은 엄선된 국내산 등심만을 사용합니다 정성 돈까스하나하나 정성을 다하여 빵가루를 묻혀가던 그방식 그대로 만듭니다. 빵가루 돈까스의 생명은 빠삭함!! 한입 먹었을때 빠삭!!... ,또깡씨의 행복냠냠이♥,https://blog.naver.com/niceddok,2019-05-24
불고기 쌈밥,https://blog.naver.com/mi_soonlove?Redirect=Log&logNo=221335197829,불고기 쌈밥 #역삼동 맛집 # 돈육지존에서는 점심식사 메뉴 #불고기 쌈밥 이 있습니다. #1등급 한돈 앞다리살로 특제소스에 38시간 숙성시켰습니다돈육지존 은 오직 '맛'으로 승부합니다.,돈육지존[수제 뼈삼겹 전문점],https://blog.naver.com/mi_soonlove,2018-08-08
20.04.16,https://blog.naver.com/gazzet95?Redirect=Log&logNo=221912208835,"오전 9:40 - 스타벅스에서 머그컵 구매 스타벅스 여름MD, 홀로그램 오전 10시 - 오후 7시 - 불타는 키보드 오후 7시 ~ - 자유시간 : 이영자가 극찬한 ' 돈육지존 '에서 3인분 흡입 집 도착 후, 팩도 하고 누워서... ",¡Animo!,https://blog.naver.com/gazzet95,2020-04-16
수제 뼈삼겹,https://blog.naver.com/mi_soonlove?Redirect=Log&logNo=221330560008,200g 14000원 갈비대와 삼겹을 동시에 먹을수 있는 #수제뼈삼겹 입니다 육가공에서 받는게 아닌 직접 수제로 포를 떠서 만들기 때문에 안심하고 드셔도 됩니다 역삼동에 #수제뼈삼겹 은 오직 # 돈육지존에만... ,돈육지존[수제 뼈삼겹 전문점],https://blog.naver.com/mi_soonlove,2018-08-01
건대입구역 맛집 비주얼깡패!,https://blog.naver.com/keemyeizee?Redirect=Log&logNo=221826078452,재료도 국내산돈육 을 주로 사용하고 있는 곳이네요. 가게 입구부터 메뉴의 실사진과 이름이 걸려져... 입문부터 초 지존 까지 총6단계로 구별되어 있더라구요. 대체적으로 메뉴는 만원이 넘지 않는 착한... ,"ETC : Eat, Travel, Culture",https://blog.naver.com/keemyeizee,2020-02-26
CU 편스토랑 돈스파이[미트파이] 타코 느낌 물씬 풍기다. 대만족,https://blog.naver.com/cherryjjelly?Redirect=Log&logNo=221743922575,그래서 그런지 궁금하기도 하고 기대도되고 그러더라구요 히히히 그리고 편스토랑에 출연하신 이영자님께서 서울에 위치한돈육지존 에서 뼈삼겹을 드셨는데 엄청 맛있게 드시는 모습보고 다음 장소는... ,삐앙둥둥이의 Vlog,https://blog.naver.com/cherryjjelly,2019-12-20
"삽겹살지존 !! 두툼한 얼리지... 돈앤돈,돈육 돈/",https://blog.naver.com/sungki17?Redirect=Log&logNo=90152130761,,참돈왕소금구이,https://blog.naver.com/sungki17,2012-09-13
"삽겹살지존 !! 두툼한 얼리지... 돈앤돈,돈육 돈/",https://blog.naver.com/sungki17?Redirect=Log&logNo=90150883790,참돈 왕소금구이 대구광역시 달서구 이곡동 1213-1번지,참돈왕소금구이,https://blog.naver.com/sungki17,2012-08-28
원할머니 보쌈야식추천,https://blog.naver.com/5552sea?Redirect=Log&logNo=221239649257,모둠보쌈은돈육 / 돈육 +오리/오리 의 세종류 이다 포장해온 보쌈고기 보쌈김치 무김치 절임배추... 말이 필요 없는 보쌈지존 !!! 이맛이야~~ 배달의 민족/요기요/배달통의 어플로도 주문가능해서 편리하다. 마지막... ,미녀(味女) 수선화의 푸드 스타일,https://blog.naver.com/5552sea,2018-03-28
통머리 김치찌개,https://blog.naver.com/mi_soonlove?Redirect=Log&logNo=221335205531,# 돈육지존 ,돈육지존[수제 뼈삼겹 전문점],https://blog.naver.com/mi_soonlove,2018-08-08
양재역 가볼만한곳 분틀 어리굴젓 끝내주는 맛!,https://blog.naver.com/jimsssung?Redirect=Log&logNo=221760053977,예전에돈육지존 을 소개해준 형과 친구들이 이번에는 이곳을 추천하더라고요. 원래는 다들 고기를 좋아해서 고깃집에 갈 줄 알았는데 일반 한식집에 가자고 해서 조금 의아했거든요. 그런데 웬걸~ 우와! 진짜... ,혀니의 재미있고 실속있는 리뷰,https://blog.naver.com/jimsssung,2020-01-05
"청화집(1967년, 충남)",https://blog.naver.com/nv_place?Redirect=Log&logNo=220912633147,"옛 방식 그대로 만든 순대의지존개업: 1967년 대표: 1대 김일분, 2대 송무자 , 3대 이경란 주소... 병천 순대의 시작은 1960년대에 병천 인근에돈육 을 취급하는 햄 공장이 들어서면서부터였다. 당시 병천 장날에... ",우리동네 새소식과 이야기,https://blog.naver.com/nv_place,2017-01-19
길동사거리 맛집 짬뽕 지존얼큰한 맛,https://blog.naver.com/e11young?Redirect=Log&logNo=221438046249,"보통은 겉만 신경쓰고 안에 들은돈육 은 좀 부실하기 마련인데, 안에들은 살코기도 굉장히 두툼하고 묵직~합니다. 씹을 때 겉은 바사삭하면서 속은 쫄깃하고 그리고 약간은 퍼석한듯 하지만 부드러운 등심살이... ",쵸블리랑 나날로그,https://blog.naver.com/e11young,2019-01-09
"닭가슴살 소세지로 샌드위치, 소떡소떡 만듬 ㅋㅋㅋ",https://blog.naver.com/sanjizoro1?Redirect=Log&logNo=221270494767,식빵은 이게지존 인 것 같다. ㅋㅋㅋㅋㅋㅋ 그냥 먹어도 달달한 꿀내음 나고 엄청 촉촉하고 맛있음 ㅠ... 일반돈육소세지랑 별다른 차이 없이 진짜 맛있당 ㅎㅎ 겉껍질 부분은 안전한 콜라겐 케이싱을 사용하여... ,적재적소 찾기,https://blog.naver.com/sanjizoro1,2018-05-08
놀부,https://blog.daum.net/nbukd-lee7305/16149957,품질의 중요성을 인식하고돈육삶는 방법과 요령을 메뉴얼로 다시 정리 하거나 특히돈육 의 관리와... 보쌈의지존'놀부보쌈' 놀부보쌈은 QSC에 대한 기본이 잘 되어 있다. 특히 패밀리 레스토랑의 서비스를... ,이상준 詩 속으로,https://blog.daum.net/nbukd-lee7305,2019-08-10
"남편이 좋아하는 소시지, MSG없는 깔끔한맛 수제햄... ",https://blog.naver.com/tinynova?Redirect=Log&logNo=90184297087," 돈육 이 94% 이상이라 소시지 맛이 참 좋아요~ 요건 햄으로 나온 용며리햄! 용며리 소시지와는 형태가... 남은 용갈릭은 햄요리의지존 , 남편이 사랑하는 부대찌개를 해볼까 해요. 청도햄 자세히 보러http://goo.gl... ",꼬마여우의 화려한 도전!,https://blog.naver.com/tinynova,2013-11-07
서울 마포구 성산동 맛집 지산 돼지갈비 전문점 by... ,https://blog.naver.com/dndus01?Redirect=Log&logNo=110146190239,국내산돈육 이라 마음에 들었지만 왠지 램프씨와는 코드가 맞지 않았던 지산 돼지갈비전문점.... 역시 은평구 서대문구 마포구를 통털어 돼지갈비 맛집의지존 은 아직까지는 명지대 삼거리에 위치한... ,★ 램프천사의 반려묘와 재테크 여행이야기 ★,https://blog.naver.com/dndus01,2012-08-30
베트남 교민잡지 씬짜오 베트남에 포세카 조은철 사장님... ,https://blog.naver.com/yja2008?Redirect=Log&logNo=221637574748,"특히돈육 을 제공하는 포세카 프레쉬 마켓 홈나이 매장이랍니다. 이번 9월에 오픈예정인... 급식에서 재료 판매로, 북부 급식의지존FOSECA에 씬짜오베트남의 눈으로 집중해보았다. 먼저 Hfoseca의 Homnay... ",예정엔지니어링건축사사무소,https://blog.naver.com/yja2008,2019-09-03
[마이드림님 이벤트당첨] 명품돼지고기 꽁듀를 만나다?!,https://blog.naver.com/behappy790?Redirect=Log&logNo=70076468469,포프리하면 일단 건강한 계란이 떠올랐는데 이제는돈육 까지 취급한다니 무척 기대가 되더라구요..... 들어있어지존돼지고기와 어떻게 다른지 알고먹는(?) 고기가 되었어요!! 꽁듀세트 어떻게... ,향기로운 삶..,https://blog.naver.com/behappy790,2009-12-23
보쌈의지존 을 가린다…놀부 vs 원할머니,https://blog.naver.com/corea3117?Redirect=Log&logNo=140018918612,만큼 '보쌈지존 '임을 자부하고 있 다. '맛'에 관한 한 자부심이 대단한 이 두 업체 '맛 비결'과 메뉴...돈육 을 삶는 방법도 원할머니보쌈만이 특화한 노하우다.돈육 에는 본사에서 특 별히 제작한 소스가... ,Gogh marketing house,https://blog.naver.com/corea3117,2005-11-01
2021.06.26 다이어트 96일차(버피테스트 100회 챌린지 D+2... ,https://blog.naver.com/pucapo?Redirect=Log&logNo=222411306998,"짬뽕이지존 임 짬뽕, 잡채밥, 새우볶음밥 주문한 음식이 다 맛있었던 곳 메뉴가 다양한데 어정쩡하지...돈육함량 빵빵한 소시지 2개 2. 치즈스크램블에그 3. 방울토마토 4. 낫또 -끄읏 #다이어트식단... ",어쩌다 하게 된 다이어트 일상 기록,https://blog.naver.com/pucapo,2021-06-26
돼지찌개 // 용인 김치찌개의지존 ,https://blog.naver.com/zonek2h?Redirect=Log&logNo=30125926819,고급 돈육 을 사용한다고 합니다 바글바글 돼지찌개 2인분 바글바글 돼지찌개 라면 사리 하나 넣고 익어라 익어라 익어라 하면서 기달리고 있습니다 ㅋㅋ 고급돈육 이 한가득 들어있는 돼지지개 음... 역시... ,가드후니의 떡볶이 이야기,https://blog.naver.com/zonek2h,2011-12-11
요즘 군대 급식에 빅데이터를 쓴다?,https://blog.naver.com/mc341?Redirect=Log&logNo=222155757634,프레스햄돈육함량 90% 이상 시중제품보다 전분·지방 적어 단단 식감 떨어질 수 있지만 단백질 많아... 국방부 제공 군 요리계의지존 은 누구인가? 26일 그 주인공이 공개됐다. 바로 2020 황금삽 셰프 어워드의... ,R.O.K. Marine Corps 341,https://blog.naver.com/mc341,2020-11-27
(신촌데이트코스/신촌왕돈까스)장군돈까스다양한 토핑으로... ,https://blog.naver.com/khjlover88?Redirect=Log&logNo=220148700290,"바삭한돈육 위에 살사소스와 나쵸 그리고 할라피뇨까지, 느끼하다고만 생각했던 돈까스가 이렇게... 매운맛지존 은 아니지만 어느정도는 먹을 수 있는 감성쥬이기 때문에 같이나온 핫소스도 감미해서... ",수달밥선생,https://blog.naver.com/khjlover88,2014-10-12
시흥 은행동 은계지구 중국집 맛집. 짬뽕타임 시흥은행점~,https://blog.naver.com/jdmkr?Redirect=Log&logNo=221255368175,국내산돈육 으로 튀김옷도 쫄깃하게 잘 만들었네요.노릇하게 튀겨내 담백하고 육질이 부드럽습니다.시흥 은행동 짬뽕타임 시흥은행점 짬뽕국물 생각날때 딱입니다.,"힐링블로거 [Auto Camping, Cuisine, Journey]",https://blog.naver.com/jdmkr,2018-04-18
봉천역맛집 행복포차 술집에서 행복한 데이트,https://blog.naver.com/seenan?Redirect=Log&logNo=220052375174,포차의지존 ! 천상천하 안주독존! 이라고 써있습니다 ^^ 오후5시라 한산한 모습이네요. 금요일 토요일... 98% 돈육 으로 만들어 부드럽다고 해서 ^^ 그리고 신랑과 저랑 맥주를 그닥 많이 먹는 스탈이 아니어서... ,★음악이 좋은 고양이집사★,https://blog.naver.com/seenan,2014-07-07
닭가슴살 소세지 닭가슴살 스테이크 아임닭 짱맛!,https://blog.naver.com/veryloveuuu?Redirect=Log&logNo=220747353158,마치돈육 처럼...지존맛있었어요 ㅜㅜ ㅋㅋㅋ 직화로 구운 군고구마 아무것도 넣지 않은 고구마 그대로 직화로 구운 국내산 고구마 100% 100g 영하 40도에서 급속 냉각하여 맛과 영양을 그대로 담은... ,♥란이의 야무진 하루♥,https://blog.naver.com/veryloveuuu,2016-06-29
[21.6.2.수] 피자 알볼로 서울 핫도그 피자 + 굽네 갈비 천왕... ,https://blog.naver.com/heejung6759?Redirect=Log&logNo=222381567209,토핑 이렇게 푸짐하기 있기 없기 ㅎㅎㅎ 손사락보다 굵은 국내산돈육91% 함유된 통소시지... 치킨의 새로운지존#굽네 #굽네치킨 #굽네갈비천왕 치킨 중에는 굽네 굽네 중에는 갈비 천왕! 기름 쏙 빠진... ,Kim Cheetah,https://blog.naver.com/heejung6759,2021-06-02
희망이 떠오르면 절망은 저무니까,https://blog.naver.com/taeri0219?Redirect=Log&logNo=222422651625,학식돈육 김치찌개라고 했는데 왜 소세지? 근로가서 국교 과제 빡집중해서 거의 끝냈당 다시 수정한 내... 사과맛지존맛있음 요즘 사과맛 아이스크림 왤케 좋징 감자 만나러 가는데 비 무슨 일 ㅠ 바지 투톤... ,TAERIARY,https://blog.naver.com/taeri0219,2021-07-06
10. 20. 14장,https://blog.daum.net/civil56/13748802,여호와의 사랑 표명 규례란지존자의 직권적 선포라 이해가 되든 안 되든 따지지 말고 그대로 순종하는... 대표로 무슬림(이슬람 교도)들은돈육 을 섭취하지 않는다. 이슬람교 코란(꾸란)의 교리 때문이다. 고대... ,옛날 옛적 이야기,https://blog.daum.net/civil56,2019-10-20
[몽땅포스팅]완전잡동먹을거리+예서일상+육아일기,https://blog.naver.com/scherzando11?Redirect=Log&logNo=220487246806,뭔가 우유의 비릿한 맛이 느껴진달까 친정에서 먹은 닭볶음탕 엄마표 닭볶음탕은지존 입니다요........ ㅋㅋㅋㅋ돈육함량이 높으니 맛있을 수 밖에 ㅋㅋ 그러니 비쌀 수 밖에 ㅋㅋㅋ 그냥 구워먹어도 보고... ,주5일제 블로그,https://blog.naver.com/scherzando11,2015-09-21
2013년 8월 17일~18일 꽃빤쮸가 가평 별밤오토캠핑장의 쪽빛에... ,https://blog.naver.com/kalma0204?Redirect=Log&logNo=90182386393,"^_________^ 저희 절대 지존 마님표 연어샐러드도 보이네요.^_______^ 식중, 음주에서 식후 음주로 전환할 때.... 이제부터는 어른들을 위한 매콤 돈육 볶음입니다.^______^ 맛이요~??? 말이 필요없습니다.ㅎㅎㅎㅎㅎ... ",인천꽃바지의 야성캠핑,https://blog.naver.com/kalma0204,2013-10-07
SN 4학년 1학기 기록,https://blog.naver.com/alswn54812?Redirect=Log&logNo=222482401956,시험기간이니까 짬뽕한그릇은 먹어줘야쥐~~ 신부동 짬뽕 지존 인데 여기보단 신방동 짬뽕 지존 이 더... 4천원인데 저 케찹 돈육 볶음은 진짜 별로였어요 멘탈케어를 위해 내가 제일 좋아하는 초밥!! 저기가 아마... ,대학생활 다이어리,https://blog.naver.com/alswn54812,2021-08-24
아이배냇 꼬마 육포 멀티팩으로 두돌아기반찬... ,https://blog.naver.com/bogosipora?Redirect=Log&logNo=222363156522,무려 무항생제 국산돈육 을 사용해 아이간식으로 너무 좋겠다는 생각이 들었어요 소고기육포와... 딱 좋은 아이배냇 꼬마 육포 부드럽고 맛도좋은데 휴대성까지 갖췄으니 아기육포의 절대 지존 으로 임명합니다~~,MIn's Home,https://blog.naver.com/bogosipora,2021-05-23
반해버린 동탄 반송동 맛집 목록,https://blog.naver.com/sim5hangag?Redirect=Log&logNo=222108298194," 돈육 은 물론이고 소고기까지 먹을 수 있는 곳이라 선택의 폭이 굉장히 넓었어요. 상차림 비용과 더불어... 중식 상해루, 짬뽕 지존 , 천향부, 체르니, 메양꼬치 4. 일식 동탄고우시, 도쿄하나, 세야스시, 경양카츠... ",모모 데일리라이프,https://blog.naver.com/sim5hangag,2020-10-06
수유맛집 돈부리전문점 상미식당 진짜 맛집이니까 인정해,https://blog.naver.com/lovely2883?Redirect=Log&logNo=221675284834,생돈육 으로 즉석에서 바로 조리해요. 주방도 오픈형이라 이렇게 훈남 사장님의 불쇼도 감상할수 있는지존 맛집 인정!! 식전스프가 나왔어요. 요고 완전 여자여자 취저에요! 옥수수스프 같은데 진짜 맛있어요... ,"뷰티,먹방,육아스토리 &발빠른정보 그리고 #킬러분식",https://blog.naver.com/lovely2883,2019-10-12
