title,link,description,bloggername,bloggerlink,postdate
역삼역 고기집 고기 풍미가 지존인돈육지존 ,https://blog.naver.com/op235689?Redirect=Log&logNo=221805101042,역삼역 고기집 고기 풍미가 지존인돈육지존요즘 날씨가 미세먼지도 하나 없고 춥지않아서 벌써 봄이온거같네요^^오랜만에 역삼역에 갔다가 고기맛집에 다녀왔어요.돈육지존 은 역삼역이랑도 가까워... ,예비맘의 따듯한 공간,https://blog.naver.com/op235689,2020-02-11
서울 이영자 맛집으로돈육지존 에 다녀왔어요~!,https://blog.naver.com/rainbow_3023?Redirect=Log&logNo=221800381773,서울 이영자 맛집으로돈육지존 에 다녀왔어요~! 안녕하세요 오늘제가 소개해 드릴곳은 이영자 맛집으로... 모듬지존과 고민하다가 일단 모듬지존을 주문했어요 먹고나니 뼈삼겹도 먹고싶어져서 추가로... ,rainbow_3023님의블로그,https://blog.naver.com/rainbow_3023,2020-02-07
 돈육지존역삼역 지존맛집 직장인 점심 뭐먹지,https://blog.naver.com/kum921113?Redirect=Log&logNo=222146539846,오늘 점심은돈육지존 이닷!!!!돈육지존 은 편스토랑에도 나왔던 집입니당 저는 평소엔 청국장을 주로 먹고 계절메뉴로 소고기국밥이 나오면 소고기국밥을 시켜먹습니다 (광고아님 ㅎㄷㄷ) 회사직원들은 주로... ,끄..적..끄.적... 뽀울~,https://blog.naver.com/kum921113,2020-11-17
[역삼동] 돈육지존 ,https://blog.naver.com/lgin0318?Redirect=Log&logNo=222057434892,이영자 맛집으로 유명한 역삼동돈육지존 ~~ 실내가 아주 크지 않아 일찍 안가면 못먹는 곳이다 나도... ㅋㅋ 고기보다 껍데기를 더 먹는거 같다 ㅋㅋ #역삼동삼겹살# 돈육지존 #강남삼겹살맛집#이영자삼겹살,Min뽕's 오늘 하루 어땠나요?,https://blog.naver.com/lgin0318,2020-08-11
"역삼_뼈삼겹돈육지존( 이영자뼈삼겹, 편스토랑, 수제 뼈삼겹살... ",https://blog.naver.com/o_oiio_o?Redirect=Log&logNo=221709451403,역삼역 4번출구로 나와 골목으로 좀만 들어가면돈육지존 이라는 고깃집이잇어요 뼈삼겹은 처음들어보앗는데 고기퀄리티 무엇? 사장님께서 수제로 일일이 뼈삼겹 작업을 하시더라구요. 저희는 모듬지존과... ,치코언니네,https://blog.naver.com/o_oiio_o,2019-11-16
서울 역삼역 날씨 좋은 날 맛집돈육지존 에서 제육볶음 열그릇,https://blog.naver.com/shitet7?Redirect=Log&logNo=222342375990,서울 역삼역 날씨 좋은 날 맛집돈육지존 에서 제육볶음 열그릇 오늘도 난~ 점심에 내가 좋아하는 고기를 먹으러 역삼역 맛집돈육지존 으로 갔다!돈육지존 은 말 그대로 돼지고기 전문집으로 진심 역삼역... ,워럽스토어,https://blog.naver.com/shitet7,2021-05-11
"편스토랑 이영자 강남 뼈삼겹집돈육지존 ,뱅쇼,이경규... ",https://blog.naver.com/chopa1394?Redirect=Log&logNo=221736667882,"191213 편스토랑 이영자 강남 뼈삼겹집돈육지존 ,뱅쇼,이경규 블라디보스토크 킹크랩,케밥,강다니엘... 역삼돈육지존 과 영동시장 뱅쇼도 소개가 되었는데 뱅쇼는 알콜을 끓여서 만들면 된다던데 자세한건... ",이스트,https://blog.naver.com/chopa1394,2019-12-14
역삼역 삼겹살돈육지존영자님 추천 뼈삼겹맛집 XD,https://blog.naver.com/kate-0-1?Redirect=Log&logNo=222131972987,먹으러 #역삼고기집돈육지존방문!! 영자님 추천 맛집이라니 더 기대하고 들어갔당..♡ 강남 유일 뼈삼겹살 전문점이라고하는돈육지존 !! 이른 저녁이라 일빠! 전반적으로 깔끔한 분위기의 고기맛집이당 둘이서... ,이것저것 기록하려고 시작한 블로그 XD,https://blog.naver.com/kate-0-1,2020-10-31
[강남맛집]돈육지존뼈삼겹살,https://blog.naver.com/gift_store?Redirect=Log&logNo=221418207111, 돈육지존#수제뼈삼겹전문점 삼겹살이나 뜯어봐??? 라며 들어갔다죠~~ 수제라..뭔가 전문적이고 맛있는 느낌다운 느낌이..ㅎ 메뉴는 고기류 찌개류 술과 음료 ㅋ 전문가가 만들면 다르답니다 해서 모듬지존으로... ,ENZACTA IBO,https://blog.naver.com/gift_store,2018-12-13
역삼 |돈육지존:: 강남 뼈삼겹살 맛집,https://blog.naver.com/decadentliz?Redirect=Log&logNo=221423732132,"역삼돈육지존강남 뼈삼겹살 맛집 by. Liz 남편 외근이 있던 며칠 전, 퇴근시간에 맞춰 #역삼역 에서... 발견한돈육지존~ '수제 #뼈삼겹 전문점' 이란 말에 끌려 여기서 저녁 먹기로 하고 안으로 숑숑 회식... ",리즈의 술로그 ♪,https://blog.naver.com/decadentliz,2018-12-21
LG야구 볼수있는역삼 [ 돈육지존 ],https://blog.naver.com/jelly0355?Redirect=Log&logNo=221547722531,# 돈육지존#금돼지식당 도 가봤고 이전에 #뼈삼겹 파는곳은 종종 갔었는데. 별 감흥이 없었던 터라.... #lg야구보는고깃집 #뼈삼겹맛집 #역삼역뼈삼겹전문점 #무적엘지 #lg우승주 # 돈육지존#LG트윈스 #수제뼈삼겹... ,금호동네일샵 위드앤샵,https://blog.naver.com/jelly0355,2019-05-27
역삼역삼겹살돈육지존 에서 수제뼈삼겹살먹기~,https://blog.naver.com/ccamjigi77?Redirect=Log&logNo=221498597577,"그냥 삼겹살말고 수제뼈삼겹살 역삼역삼겹살 고기집돈육지존 에 갔던 날 일반 삼겹살도 있지만 역삼역삼겹살 고기집돈육지존왔다면 뼈삼겹살 먹어봐야지 뼈때문에 그램수는 더 높지만 가격은 14,000원... ",Happiness is always near,https://blog.naver.com/ccamjigi77,2019-03-27
뼈삼겹살 전문 역삼역 고기집돈육지존쥑이네!,https://blog.naver.com/ggomangchh?Redirect=Log&logNo=221374989899,찾은 돈육전문 셰프가 운영하는 아주 특별한 역삼역 삼겹살 전문 고깃집돈육지존 을 찾았다. '여기가... 모듬지존 주문완료. 최상질의 국내산 돼지고기를 사용하는 역삼역 고깃집 답게 도톰한 두께를 자랑하는... ,뜀박질의 달콤한 테라피,https://blog.naver.com/ggomangchh,2018-10-10
역삼역 삼겹살 ::돈육지존 에서 동생 생일파티,https://blog.naver.com/5pen_room617?Redirect=Log&logNo=221357502499,동생이 처음에돈육지존 이라는 상호명을 제대로 기억하지 못해서 돼지지존!!! 이라고 했는데 이름 좋다고 그걸로 바꿀까 하셨는데 다음에 가서 진짜 돼지지존으로 상호명을 바꾸셨는지 보고 오겠습니다..!... ,uijubeauty 의주뷰티•패션,https://blog.naver.com/5pen_room617,2018-09-12
편스토랑 이영자 뼈삼겹 역삼동돈육지존마스카포네 아보카도... ,https://blog.naver.com/shannenchoi?Redirect=Log&logNo=221736601201,방송보는데 이영자가 방문한 역삼동돈육지존 의 뼈삼겹이 너무 맛있어보여서 방문을 해봐야겠더라구요 여기 방송 이 후 또 웨이팅 엄청날 것 같지만 방송보니까 확실히 가서 먹어보고 싶더라구요 이영자가 처음... ,핑크러브의 핑크빛세상,https://blog.naver.com/shannenchoi,2019-12-13
#역삼역 삼겹살_고기집 여기가 젤 맛있어!_ 돈육지존 ,https://blog.naver.com/rirurang?Redirect=Log&logNo=221354600990,"모듬 지존모듬 지존 ; 뼈삼겹, 삼겹살,가브리살,갈매기살,목살,항정살 무려 6가지 구성! 아항~ 뼈삼겹이 뭔가 궁금했는데 마치 갈빗대에 붙어있는 갈비처럼 뼈에 붙어있는 삼겹살이다. 요런건 첨보는데돈육 전문... ",언제나 여행중,https://blog.naver.com/rirurang,2018-09-07
역삼동 삼겹살 맛집돈육지존 /뼈삼겹살,https://blog.naver.com/alamie88?Redirect=Log&logNo=222023481763,퇴근하고 역삼에서 친구만나기루 한날 고기가 땡겨서 알아보던 중돈육지존발견 이영자님도 왔다 간 곳 여기 비빔메밀?막국수? 머였지 무튼 그것도 진짜 장난아니게 맛있었음 내 단골집 될거같당 고기다먹구... ,라미 diary_,https://blog.naver.com/alamie88,2020-07-07
역삼동고기집돈육지존재방문,https://blog.naver.com/violetdevil3?Redirect=Log&logNo=222410024445,"네맞아요주정뱅이 2021년 6월 기준 역삼동고기집돈육지존메뉴판 메뉴는 대표 메뉴인 뼈삼겹과 특수부위도 한번에 맛볼 수 있는 모듬지존, 갈비양념에 1주일 숙성시켜 탄생한 껍데기에 항정, 가브리... ",보라앙마 일상맛집미용 블로그,https://blog.naver.com/violetdevil3,2021-06-28
제이나스타일팀 회식날 @ 역삼 항정살 맛집돈육지존 ,https://blog.naver.com/janachung?Redirect=Log&logNo=222146017540,모들 지존은 여러가지 부위를 한 번에 먹을 수 있어서 좋네요~!! 우선은돈육지존 의 메인메뉴인 뼈삼겹과 목살을 먼저 먹었구요 그 다음은 항정살입니다~!! 보통 항정살은 고소하고 맛있는데 얇게 썰어서들 많이... ,제이나스타일,https://blog.naver.com/janachung,2020-11-16
역삼역 맛집:돈육지존모듬지존셋트김치찌개 솔직후기,https://blog.naver.com/5ny_1125?Redirect=Log&logNo=221485799641," 돈육지존밑반찬 야채도 상큼하게 입맛돋구고~~ 요요~~ 볶음김치~ 엄청 감칠맛남ㅋ 밥에 비벼먹었음ㅋㅋ 지존모듬 40,000돈육지존지존모듬 등장! 일단 수제뼈삼겹살 삼겹살 목살부터 고고~ 뼈삼겹~ 삼겹살... ",열정이 프로페셔널을 만든다,https://blog.naver.com/5ny_1125,2019-03-11
[역삼역 삼겹살] 편스토랑에 이영자가 인정한 맛집돈육지존 ,https://blog.naver.com/snsrhdwn000?Redirect=Log&logNo=222492357598,역삼역4번출구에서 조금만 걸으면되서 접근성이 아주 좋았어요^^ 가게가 꽤 크네용돈육지존 은 국내산... 맛있었어용돈육지존 이라고 적혀있는 버섯 ㅋㅋㅋ 버섯도 쌈장에 찍어먹으니 짱맛있어용 여기는... ,똥그리,https://blog.naver.com/snsrhdwn000,2021-09-02
역삼역 고기 : 불조절이 예술인 데이트 코스돈육지존 ,https://blog.naver.com/3_3yes?Redirect=Log&logNo=222031045689, 이영자 언니도 인정한 역삼역 고기집 불조절이 예술인 데이트 코스 :돈육지존안녕하세요 이웃님들!!... 편스토랑에 나온 이영자 누님의 맛집 역삼돈육지존 !! 먹고 싶은 생각에 4시 오픈시간에 맞춰서... ,쭈블리네,https://blog.naver.com/3_3yes,2020-07-14
역삼역 고기집돈육지존 (뼈삼겹살),https://blog.naver.com/selyhr?Redirect=Log&logNo=221421146894,역삼역에 있는 맛난 수제 뼈삼겹집인돈육지존 에서 만나기로 했지요. 역삼역 4번 출구에서 조금만... 그래서 우리는 모둠지존 600G을 먹기로 합니다. 술은 유유상종이라 아무도 안 마십니다 ㅋ 고기먹는 법에... ,我好想念你,https://blog.naver.com/selyhr,2018-12-17
역삼역 맛집돈육지존불고기쌈밥 후기,https://blog.naver.com/budy77?Redirect=Log&logNo=221439058556,맛집돈육지존 에서 불고기 쌈밥 먹고 온 후기 찔게요 역삼역에서 사알짝 안으로 들어와야하구요 며칠 전부터 두번이나 방문 했는데 두번이나 만석이라 못 갔었거든요 이렇게 # 돈육지존에서 인스타 이벤트도... ,채씌,https://blog.naver.com/budy77,2019-01-10
역삼역 삼겹살돈육지존퀄리티가 달라,https://blog.naver.com/alclstjwns?Redirect=Log&logNo=221362708177,모듬지존의 다양한 부위별 고기 비주얼 양부터 신선한 육질까지 대박이죠!? 가장 매력적인 부위는 역시돈육지존 을 대표하는 뼈삼겹 아니겠어요?! 뼈와 함께 붙어 있는 삼겹살이라 그런지 더 식감이 쫀득한게... ,윤성 패션&뷰티 블로그,https://blog.naver.com/alclstjwns,2018-09-20
역삼역 고기집 역삼역 삼겹살 역시 고기의 지존인돈육지존 ,https://blog.naver.com/cgs2020?Redirect=Log&logNo=221379674095,어쨌든 고향국밥은 먹기로 했어요 옥외배너가 양쪽으로 있어요 처음에 상호가 헷갈려 지인들과 식사 약속을 잡을 때 처음엔 지존돈육이라고 했는데 나중에 알고보니돈육지존 이었어요ㅋㅋㅋ 아직은 낮이... ,미래를 준비하는 사람들(Someday our time will come),https://blog.naver.com/cgs2020,2018-10-17
역삼역 회식 고깃집 맛집돈육지존 ,https://blog.naver.com/lsh1000j?Redirect=Log&logNo=221415702079,모듬지존으로 주문을 뼈삼겹과 목살 항정살 그리고 갈매기살 가브리살 한번에 역삼역 맛집돈육지존 의 고기를 골고루 맛볼수 있는 메인 메뉴이지 않을까요? 고기는 어지간하면 배신안하죠!!? 역시나 배신을... ,RyalFamily's Room,https://blog.naver.com/lsh1000j,2018-12-10
역삼역 맛집돈육지존이영자도 인정!,https://blog.naver.com/jimsssung?Redirect=Log&logNo=221738389251,"그곳은 바로 역삼역에 위치한 맛집 이영자도 인정한돈육지존 이에요. 저는 티브이를 잘 안 봐서... 뼈 삼겹살, 모둠 지존, 돼지 껍질이 눈에 들어왔어요. 얼마 전에 돼지 껍질을 먹고 글을 올렸는데 이곳에서도... ",혀니의 재미있고 실속있는 리뷰,https://blog.naver.com/jimsssung,2019-12-15
[역삼역 고기집] 돈육지존 에서 6종류의 특수부위를 맛보다! :),https://blog.naver.com/lnk2721?Redirect=Log&logNo=221355896633,"5000원 돈육튀김 13000원 들깨방(겨울 메뉴) 5000원 통머리 김치찌개, 시골청국장(7000원) 불고기쌈밥... 고기집돈육지존 에서 모듬지존의 수제뼈삼겹살과 고기들, 비빔 막국수와 돼지껍데기, 김치찌개 오늘... ",Leisera의 육아&일상 리뷰♡,https://blog.naver.com/lnk2721,2018-09-10
역삼 삼겹살 회식장소 ' 돈육지존 ',https://blog.naver.com/gulliver174?Redirect=Log&logNo=221494948535,역삼 삼겹살 회식장소 추천돈육지존역삼역 근처에 부담없이 갈만한 삼겹살 맛집 찾았습니당 :-)돈육지존 은 역삼역 4번출구 국기원방향으로 가던 골목길에 있어요 참고로 근처에는 2차로 갈만한... ,걸리버 세상살이,https://blog.naver.com/gulliver174,2019-03-22
역삼역 맛 집: 뼈 삼겹살 맛집돈육 지존 ,https://blog.naver.com/money_salon?Redirect=Log&logNo=221483351702,역삼역 맛 집: 뼈 삼겹살 맛집돈육 지존미세먼지로 인해 요 며칠 고생한 저에게 삼겹살을...돈 육지 존 입니다!!! 역삼역 4번 출구로 나와서 현대해상 강남사옥 건물을 끼고 우측으로 올라오시면돈육 지존 이라는... ,MONEY SALON,https://blog.naver.com/money_salon,2019-03-08
역삼_ 돈육지존점심,https://blog.naver.com/im_daisyduck?Redirect=Log&logNo=221567186215,#역삼 #점심 #회사원 #강남 Hello:) 역삼에 있는돈육지존 ! 주변 회사들과 업체들로 인하여 점심때마다... 것 같습니다ㅎㅎ 근처에서 무난히 점심을 해결하고 싶다면 ‘ 돈육지존 ’ 그럼 오늘도 감사합니다;),I’m_daisyduck/Daily,https://blog.naver.com/im_daisyduck,2019-06-21
역삼역 삼겹살이 두툼한돈육지존 ,https://blog.naver.com/dowoonu00?Redirect=Log&logNo=221375509548,"이거시돈육지존 의 모듬지존 한판! 뼈삼겹, 삼겹살, 목살, 가브리살, 항정살, 갈매기살 그리고, 새송이버섯에 적혀있는 깨알가게홍봌ㅋㅋㅋㅋㅋㅋㅋ 뼈삼겹을 올려주셨는데, 뼈삼겹은 뼈에 붙은... ",여행: 여기서 행복하자★,https://blog.naver.com/dowoonu00,2018-10-11
역삼맛집 [ 돈육지존 ] #뼈삼겹#꿀맛,https://blog.naver.com/never024?Redirect=Log&logNo=221348959591,역삼 맛집 ' 돈육지존 ' 강추! 오랜만에 우리가족 외식하러 뼈삼겹 먹으러 다녀왔다. 진짜 역대급 삼겹살... 어느하나 부족하지 않은 만족감!! 몇일동안 계속 생각날것같은 #대박맛집# 돈육지존 #역삼역4번출구#또갈래,#데일리 사진일기:),https://blog.naver.com/never024,2018-08-30
역삼역 고기집돈육지존 에서 맛있는 뼈삼겹살 먹기,https://blog.naver.com/jennyan1117?Redirect=Log&logNo=221355749329,"모듬지존 (뼈삼겹,삼겹,목살,항정살,가브리살,갈매기살) 버섯에는돈육지존문구가 탕탕!! 이건... 고기집돈육지존역삼역 회식장소로도 좋고 돈육전문가의 고퀄리티 삼겹살을 맛 볼수 있는 곳입니다... ",★떠나자고고씽★,https://blog.naver.com/jennyan1117,2018-09-10
역삼동 고기집 : 돈육지존/이영자 뼈삼겹 펀스토랑,https://blog.naver.com/rlagkdud3470?Redirect=Log&logNo=221399469431,#이영자뼈삼겹 #펀스토랑삼겹 역삼동 고기집돈육지존 에서 정말 맛있는 삼겹살을 먹어서 리뷰합니당 제가 싼 쌈 좀 보세요 진짜 너무 맛있 ㅠㅠ 이건 역삼동 고기집돈육지존 의 미리보기 샷 오늘 방문한 역삼동... ,마용의 뭐하나용,https://blog.naver.com/rlagkdud3470,2018-11-16
역삼 고깃집 :: 뼈 삼겹살돈육지존 ,https://blog.naver.com/seraki0531?Redirect=Log&logNo=221493123949,역삼 고깃집 :: 뼈 삼겹살돈육지존안녕하세요 뽁여사입니다:) 수요일 하루도 잘 보내셨나요? 저는... 그래서 바로 약속 장소 근처 고깃집을 찾아보기 시작했습니다 :) 역삼 고깃집 :: 뼈 삼겹살돈육지존내부... ,일상에서 행복 찾는 방법,https://blog.naver.com/seraki0531,2019-03-20
[역삼 맛집] 역삼역돈육지존 에 다녀왔어용~~~,https://blog.naver.com/rnlduaalsl5?Redirect=Log&logNo=221560169689,바로 #역삼 # 돈육지존입니당! 위치는 4번출구에서 오른쪽 큰길로 쭈욱 들어오시면 있습니당! 찾기 매우 쉬워용~ 못찾음 바부~~ 자그럼 등가죽에 붙은 배를 움켜주고 들어가봅시다~~~~ 엥? 오우~ 근처에 회사가... ,미니로그,https://blog.naver.com/rnlduaalsl5,2019-06-12
역삼역 삼겹살 뼈삼겹살은 역시돈육지존돼지껍데기 꼭... ,https://blog.naver.com/encantar83?Redirect=Log&logNo=221384495594,역시 돼지 잡내 없이 깔끔하고 육즙이 나오는게 역삼동 삼겹살 지존이다.돈육지존 . 역삼역 삼겹살돈육지존뼈삼겹살 다음에는 제주 멜젓에 찍어 먹어 봤다. 시키는대로 참 잘하는 로사킴. 짭쪼름하고 꼬릿한... ,"로사킴,언니가 해보고 알려줄게 Real Story of Rosa",https://blog.naver.com/encantar83,2018-10-25
만능간장 만능육수 레시피 이영자 뼈삼겹 식당돈육지존역삼 맛집,https://blueplastic.tistory.com/2745,"레몬 껍질을 갈아 넣는다 이영자가 방문한 돼지고기 맛집 뼈삼겹~ 맛집명:돈육지존주소: 서울 강남구 테헤란로19길 18 (역삼동 645-12) 메뉴 수제뼈삼겹, 메밀막국수, 비빔메밀막국수, 삼겹살, 모듬지존... ",Modern Story,https://blueplastic.tistory.com/,2019-12-13
역삼 삼겹살 맛집 ::돈육지존뼈삼겹살 역시 맛있어!!,https://blog.naver.com/never024?Redirect=Log&logNo=221367887909,위치한 #삼겹살맛집 # 돈육지존돈육지존 은 뼈삼겹살이 전문인데..사장님이 손수 고기를 직접 손질한다고... 점심시간이 조금 지난 시간이라 한차례 휩슬고 간 시각... 우리는 아지매들이라 더 신나게 수다떨며... ,#데일리 사진일기:),https://blog.naver.com/never024,2018-09-29
"역삼삼겹살돈육지존뼈삼겹부터 볶음김치, 청국장까지 모두 만족",https://blog.naver.com/2848888?Redirect=Log&logNo=221487655023,바로 역삼삼겹살돈육지존인데요. 먼저 널직한 테이블이 눈에 띄는 곳이었습니다. 처음엔 테이블 인심... 다양한 부위를 맛보고 싶다면 모듬지존도 괜찮은 것 같아요. 600g에 40000원이니 가격도 괜찮구요. 테이블... ,엄장품,https://blog.naver.com/2848888,2019-03-13
역삼삼겹살돈육지존 ,https://blog.naver.com/uou226?Redirect=Log&logNo=221495804841,역삼삼겹갈돈육지존고기...대박 비주얼 소고기보다 돼지고기가 더 좋아요 돼지고기 기름이 혈관에... 역삼삼겹살돈육지존새송이버섯에돈육지존 이라 써 있어용 ㅋㅋ 고기판에 노릇노릇 구웠어요 마늘이 빠질... ,먹고 놀고 쇼핑하는 은댕이네,https://blog.naver.com/uou226,2019-03-24
역삼동돈육지존삼겹살 맛집 존맛탱~~,https://blog.naver.com/ansongchan1?Redirect=Log&logNo=221701782662,역삼역 부근에돈육지존 에 오게 되었습니다 저의 비밀 맛집이었던 이곳은 얼마전 이영자님께서 방문해... 가격부담 없이 드세요 오늘은 때마침 불금인데 이곳돈육지존 에서 삼겹살에 소주한잔 캬 강츄 원츄,하늘 아래 같은 스타일은 없다 by.서진,https://blog.naver.com/ansongchan1,2019-11-08
역삼역 고기집 삼겹살 맛집돈육지존진짜 지존의 맛,https://blog.naver.com/hellomk1024?Redirect=Log&logNo=221482893510, 돈육지존 이 진짜 지존인 이유 중 하나는 모든 밑반찬 소스를 직접 만드신다고 한다 된장이랑 와사비랑 볶음소금까지도 !!! 진짜 대다나다... 역삼역 삼겹살 =돈육지존간장양파에 고기 싸먹어도 꿀맛탱 야채가... ,For Loveself,https://blog.naver.com/hellomk1024,2019-03-07
역삼동 고기집 ' 돈육지존 ' 그냥 삼겹이 아니라 뼈삼겹이라 더욱... ,https://blog.naver.com/violayun?Redirect=Log&logNo=221397911897,맛집이랍니닷~돈육지존주소) 서울특별시 강남구 테헤란로19길 18 영업시간) 매일 11:00 ~ 23:30 연중무휴 역삼 돈육지존 은 지도에서 보시는것과 같이 역삼역 4번출구에서 정말 가까이에 있어요~! 입구에 메뉴판이... ,혜니버의 일상다반사,https://blog.naver.com/violayun,2018-11-13
역삼역 맛집 -돈육지존 ,https://blog.naver.com/fantasyoung1?Redirect=Log&logNo=221424390558,이곳 만의 특별함!! 요거요거 소스 추천합니다~~♡ 이렇게 맥주한잔까지~~ 끝내줘요^^ 엄청난 청국장까지~~~♡ 역삼역맛집돈육지존강력 추천♡♡ #역삼역맛집 # 돈육지존#돼지고기 #맛집 #삽겹살,텐텐프렌차이즈 가맹본부 문의,https://blog.naver.com/fantasyoung1,2018-12-21
신상츨시 편스토랑! 이영자가 처음 맛본 뼈삼겹돈육지존 ,https://blog.naver.com/ndsibs?Redirect=Log&logNo=221736517269,이영자가 처음 맛 본 메뉴는 바로 뼈삼겹 맛집으로 찾은돈육지존삼겹살과 맞닿아 있는 등갈비를 제거하지 않고 통으로 자른 뼈삼겹을 같이 먹을 수 있는돈육지존신상츨시 편스토랑! 뼈삼겹 가족... ,"일산! 지킴이 ""일산아재""",https://blog.naver.com/ndsibs,2019-12-13
역삼역 고기집돈육지존:: 고기 육즙과 식감이 야들야들~역삼역... ,https://blog.naver.com/line_up11?Redirect=Log&logNo=221379144054,"역삼역 고기집,돈육지존#역삼역고기집 #역삼역삼겹살 # 돈육지존#역삼회식 #역삼역회식 #뼈삼겹... 고기 질이 진짜 좋다고~ 막 극찬을 했어요 ㅋㅋㅋㅋ 진짜 좋은 고기라고~ 역시 돈육전문가 사장님의 안목 ddd... ",소소한 기록들,https://blog.naver.com/line_up11,2018-10-17
"일상 |돈육지존 , 드로잉 무드등, 스타일씨x페이코 CU상품권... ",https://blog.naver.com/loftyyoon?Redirect=Log&logNo=222247250409,"어제 머리 하고, 친한 동생 현정이를 만나 역삼역 근처돈육지존 에서 맛있는 삼겹살 냠냠 민호 디자이너님께 추천 받은 고깃집인데 오, 너무 맛있었다! 다음에 남편이랑 또 와야지 :) 카스 짠짠 - 둘이 가볍게 한... ",하유니크 Hayun is unique,https://blog.naver.com/loftyyoon,2021-02-17
 돈육지존김치찌개,https://blog.naver.com/sssang97?Redirect=Log&logNo=222095711458,"7000원. 원래 메뉴보고 제육쌈밥 먹으려 들어왔는데, 밑반찬 나오고 매진이라 알려줘서 마지못해 아무거나 시켰다. 12시 6분에 매진이 말이 되나? 재료 수급을 매일 잘 체크해서 하는게 아닌것같다. 여튼... ",記可爲學,https://blog.naver.com/sssang97,2020-09-21
편스토랑 이영자 뼈삼겹 서울 역삼동돈육지존돼지고기... ,https://comcomin.tistory.com/7627,"[돈육지존] 전화번호 02-561-5653 서울 강남구 역삼동 645-12 영업시간 11:00 ~ 23:00 브레이크타임 14:30 ~ 16:30 5시오픈 토요일 14:00 ~ 23:00 일요일휴무 메뉴 가격 정보 수제뼈삼겹 14,000원 모듬지존 40... ",★■ 일루와 ■★,https://comcomin.tistory.com/,2019-12-15
이영자 다녀간 서울 뼈삼겹 맛집 ' 돈육지존 '에 누리꾼 관심↑,https://blog.naver.com/satgat2422?Redirect=Log&logNo=221736624002,"이영자는 이 집만의 별미인 열무장아찌에 돼지고기를 싸먹으며 연신 엄지손가락을 치켜들었다. 한편, 이날 방송을 통해 소개된 뼈삼겹 집 ' 돈육지존 '은 서울시 강남구 역삼동에 위치한 것으로 알려졌다.",쿠몽 공식블로그,https://blog.naver.com/satgat2422,2019-12-13
보라앙마 2021년 7월 일상,https://blog.naver.com/violetdevil3?Redirect=Log&logNo=222540838414,"역삼역 네모집 가서 항정살, 삼겹살도 먹고 신사동 첨벙아구찜 가서 아구찜도 먹고 보라앙마 단골집 역삼돈육지존가서 뼈삼겹도 먹고 왔구요. 어마마마 강남역 70년 전통 조양관 한정식도 모시고 가고 강남역... ",보라앙마 일상맛집미용 블로그,https://blog.naver.com/violetdevil3,2021-10-19
