title,link,description,bloggername,bloggerlink,postdate
여수여행♩1.여수 게장 맛집::여수 두꺼비게장 ,https://blog.naver.com/lyrsmile?Redirect=Log&logNo=221975535596,com/lyrsmile/220314809291 여수두꺼비게장전화번호: 061-643-1880 여수두꺼비게장주소: 전남 여수시 봉산남3길 12 여수두꺼비게장영업시간: 매일 08:30 - 20:30 '원조'를 강조해놓은 #여수게장맛집두꺼비게장 !... ,꿈많은 꿈녀의 꿈담는 공간♪,https://blog.naver.com/lyrsmile,2020-05-23
[여수]두꺼비 게장 ,https://blog.naver.com/yangkeez?Redirect=Log&logNo=221664201811,갈치조림이 있어서 한번 리필로도 충분했음 게장에 빠져 청정게장촌도 갔었는데 역시 나의 원탑은 두꺼비... :) 미국가면 제일 먹고싶을 음식일듯 ㅜㅜ 여수맛집/여수간장게장/여수게장맛집/여수 두꺼비게장 ... ,이쓴헬리네 미국일상 :),https://blog.naver.com/yangkeez,2019-09-30
[여수 맛집]두꺼비게장내돈주고 먹은 후기,https://blog.naver.com/shyun0730?Redirect=Log&logNo=222052924387,다행이 추가요금은 받지 않으셨다. 여수 만세! 평일이니까 오래 기다리지 않고 먹지 주말이면 발끝도 못댔을 것 같다. 글을 쓰는 지금도 먹고 싶네 씁. #여수맛집 #여수간장게장 # 두꺼비게장#간장게장맛집,사진찍고 노는 블로그,https://blog.naver.com/shyun0730,2020-08-06
여수 간장게장 맛집 ::두꺼비게장 ,https://blog.naver.com/jj2yo?Redirect=Log&logNo=221912898661,우리의 첫번째 맛집탐방은두꺼비게장포장판매도 하고 있는 곳 저희는 게장백반으로 주문! 금방 차려지는 한상 게장 리필은 2번까지만 가능했어요!! 먼저 간장게장 집게살 너무 빡세서 가위로도 안잘려ㅠㅠㅠㅠ... ,쩡이월드:D,https://blog.naver.com/jj2yo,2020-04-17
여수 맛집두꺼비게장간장게장 백반 수요미식회 맛집 돌게장,https://blog.naver.com/dailydessert?Redirect=Log&logNo=221770141682,게와 두부가 들어간 된장찌개는 삼삼한 맛이에요 전남 여수 맛집두꺼비게장간장게장만큼 맛있었던 건 바로 딱새우장이에요~ 새우장은 먹어보았어도 딱새우장은 처음 먹어보았는데 맛있더라구요^^ 처음에... ,★,https://blog.naver.com/dailydessert,2020-01-13
[여수맛집]두꺼비게장여수당,https://blog.naver.com/mezzanine89?Redirect=Log&logNo=222337433681, 두꺼비게장 에 대해서는 여러 리뷰가 엇갈린다 여전히 좋다와 옛날만 못하다로. 여전에 가본적이 없으니 어짜피 옛날만 못한지는 알길이 없다 그래서 그냥 가봤다 괜찮다 가성비 굿 게장 백반 냠냠 먹고... ,타리씨 블로그,https://blog.naver.com/mezzanine89,2021-05-04
"여수 / 국동, 봉산동 /두꺼비 게장/ 전통의 게장 맛집 아직도... ",https://blog.naver.com/sanujetq?Redirect=Log&logNo=222499733951,"여수 / 국동, 봉산동 /두꺼비 게장/ 아직도 그대로다. 이 집은 간장 게장이 진리이다. 처음 가면 당연히 양념과 간장같이 주문하지만 그 이상 방문이라면 간장만 주문할 것을 추천드린다. 여수 / 국동, 봉산동... ",구겨진 옥스포드 셔츠처럼,https://blog.naver.com/sanujetq,2021-09-08
양념게장사옴 여수밥집 두꺼비식당두꺼비게장진주근교... ,https://blog.naver.com/stubborn_j?Redirect=Log&logNo=222427139959,여수내에 두꺼비식당 왜이렇게 많은거죠.. 네비 헷갈려죽눈줄 #여수게장집 #여수 두꺼비게장#여수게장밥집 주차장도 잘되있고 준비된 반찬들덕에 기다림없이 주문후 바로나옴 회전율 장난아니네유 휴가때... ,홈브루아이디어클럽,https://blog.naver.com/stubborn_j,2021-07-10
여수 수요미식회두꺼비게장솔직후기,https://blog.naver.com/clkim0208?Redirect=Log&logNo=221643555290,양념게장은 게살보다는 양념맛이 더 많이 느껴졌어요 ㅎㅎㅎ 가격대비 푸짐한 한상에 게장 리필까지 가능했던 두꺼비식당 나름 만족스러웠던 곳입니다 ! 오~래전 다녀왔던 황소식당과두꺼비게장 의 맛이나... ,C H A E L I N's Life Story,https://blog.naver.com/clkim0208,2019-09-09
명불허전의 여수맛집두꺼비게장 ,https://blog.naver.com/hdsj1017?Redirect=Log&logNo=221608855053,"제 입에는 돌게로 만든 간장게장 중에서는두꺼비게장 이 최고였어요.^^ 게장도 맛있었지만, 진짜 맛있게 먹었던건 갈치조림입니다. 2인분이지만 양도 푸짐합니다.두꺼비게장가시면 꼭 갈치조림 + 게장백반... ",부산 재개발 투자,https://blog.naver.com/hdsj1017,2019-08-07
여수두꺼비게장수요미식회 나온 간장게장 :D,https://blog.naver.com/plm3334?Redirect=Log&logNo=221543561787,안녕하세요 파란별윤정님입니다 오늘은 여수두꺼비게장리뷰를 하려고 합니당 :) 여수 여행 가서 꼭 먹으려고 했던 게 간장게장 이었는데요 '-' 숙소 근처에 간장게장 골목이 있어서 편하게 먹고 올 수... ,파란별윤정님,https://blog.naver.com/plm3334,2019-05-22
광주 백반 신안동두꺼비게장 백반 1만원의 행복,https://blog.naver.com/flhd1004?Redirect=Log&logNo=221444761775,지금까지 광주 게장백반추천 신안동두꺼비게장 백반인데요. 개인적으로 짜고 맵고 달지 않고 자극적이여서 좋았습니다. 구지~~ 여수까지 가지 않아서도 맛있는 게장식당을 광주에서 찾아서 기분 좋네요^^ (본... ,민이네 가족캠핑,https://blog.naver.com/flhd1004,2019-01-18
여수 게장 맛집두꺼비게장리얼후기,https://blog.naver.com/hellobear28?Redirect=Log&logNo=221368411206,여수 게장 맛집두꺼비게장리얼후기 여수 게장 맛집을 알아보니 몇 군데 유명한 곳이 있더라고요... ㅎㅎ 여수 게장 맛집 두꺼비식당의 백반 2인분이에요! 여러 밑반찬들과 양념/간장 게 장 그리고 된장국까지!!... ,u n i q u e _,https://blog.naver.com/hellobear28,2018-09-30
여수 게장 맛집 :: 수요미식회에 나왔던두꺼비게장 ,https://blog.naver.com/dlxhfl92?Redirect=Log&logNo=221629960902,저는 보통 어디가면 유명한거 검색해보고 그집을 가는편이라 ㅎㅎㅎ 유명하다는 여수 게장 맛집두꺼비게장 으로 찾아갔어요~ 티비에도 많이 나왔나봐요 ㅋㅋ 수요미식회에 나와서 유명해진듯! 수요미식회... ,이라로그.blog,https://blog.naver.com/dlxhfl92,2019-09-04
[원조두꺼비게장 ] 여수 - 돌게장 백반으로 유명한 곳,https://blog.naver.com/mardukas?Redirect=Log&logNo=221462385981,그러다 황소게장은 1인분을 잘 안해줄려고 하고두꺼비게장 은 해줘서 두꺼비 쪽으로 갔던 기억이있네요.. (지금은 어떨지 모르지만) 한참 지나 이 동네 전체가 게장 골목으로 바뀌고.. 인심이나 음식이나... ,"먹자, 마시자, 놀러 다니자",https://blog.naver.com/mardukas,2019-04-20
여수 게장맛집 ::두꺼비게장맛있어요! ʚ˘◡˘ɞ(수요미식회... ,https://blog.naver.com/ljk91?Redirect=Log&logNo=221596049882,가게가 많이넓고 테이블수가 많기때문에 약간 정신이없는... 그런느낌도있었지만 음식맛은 정말좋았어요. 실패없는 맛집을 찾으시면 여수 게장맛집두꺼비게장추천드립니다.!,Shine on you_,https://blog.naver.com/ljk91,2019-07-26
여수맛집/게장골목맛집두꺼비게장 ,https://blog.naver.com/wlsdud0312?Redirect=Log&logNo=221233291772,"수요미식회 나온 등가게장, 런닝맨 나온 황소게장 등등 맨처음에는 등가게장을 갈까 고민했는데.. 그냥 두꺼비가 끌렸음...! 그래서두꺼비 게장 갔다! 근데 결론은 !!!!!!! 너무 맛있쒀!!!!♡ 여수맛집/게장골목맛집... ",",쉬다가는 공간",https://blog.naver.com/wlsdud0312,2018-03-20
수요미식회 여수 - 봉산동 게장 골목두꺼비게장: 돌게장 백반,https://blog.naver.com/zephyr122059?Redirect=Log&logNo=221339383538,"◆◆봉산동 게장 골목두꺼비게장: 돌게장 백반◆◆ 여수 돌게장 골목의 터줏대감, 수요미식회 여수 편에 소개되는 여수 봉산동 게장 골목두꺼비게장 에 대한 설명이다. 현지인들뿐만 아니라 관광객들의... ",사랑이 밥먹여준다,https://blog.naver.com/zephyr122059,2018-08-15
여수두꺼비게장맛집 다녀왔습니다.,https://blog.naver.com/jangin5661?Redirect=Log&logNo=220987786480,여기는 게장정식 먹으려고 이리저리 돌아다니다가 규모도 크고 줄서있는 사람들이 많길래 들어갔어요.... 원조두꺼비게장 . 줄서 있는 사람이 많은 인기식당답게 건물 바깥쪽으로 가격표가 붙어있어요.... ,[다뚜러]포항하수구 & [뷰티하우스]화장실리모델링,https://blog.naver.com/jangin5661,2017-04-20
[여수맛집] 게장갈치조림 -두꺼비게장 ,https://blog.naver.com/gykim67?Redirect=Log&logNo=221654472121,6월 22일~23일 1박 2일 여수여행에서 두 번째 날인 23일 아침 겸 이른 점심으로 간 곳은 '수요미식회'에 게장맛집으로 나왔다는 ' 두꺼비게장 '입니다. 숙소 체크아웃하고 이른 시간에 도착했다고 생각했으나 막상... ,다락전사의 사는 이야기,https://blog.naver.com/gykim67,2019-09-23
[여행/맛집] 여수두꺼비게장 ,https://blog.naver.com/hyunvely1013?Redirect=Log&logNo=222528587668,여수두꺼비게장양념게장과 간장게장 게살이 통통하고 탱탱한게 정말 맛있었다 나는 개인적으로 양념게장을 강추!! 게장이 메인요리라 생각해서 갈치조림은 사이드메뉴 정도로 생각했는데 이게 왠걸.. 갈치가... ,가영,https://blog.naver.com/hyunvely1013,2021-10-06
여수 맛집 : 봉산동 게장골목 “ 두꺼비게장 ”,https://blog.naver.com/soje1234?Redirect=Log&logNo=221573997315,"때마다 게장 전문점을 찾아갔어요. 봉산동 게장 거리에서 유명한 곳이 명동, 두꺼비, 황소 등인데... 여수두꺼비게장: 게장백반 게장백반 12,000원 명동게장에 비해서는 구성이 약한 듯 싶었어요. 근데... ",민속학도의 시선으로 담은 기록보관소,https://blog.naver.com/soje1234,2019-06-30
여수여행 배틀트립 출연두꺼비게장 백반 간장게장 리필두번,https://blog.naver.com/flhd1004?Redirect=Log&logNo=221095011379,참고로 여수는 돌게장이 유명한데요 황소게장백반과두꺼비게장 이 유명하므로 본인 취향대로 잘... 여기가 바로 오늘 포스팅할두꺼비게장 입니다. 아 네비 검색하실때 두꺼비식당으로 하시면 안되요. 여수에는... ,민이네 가족캠핑,https://blog.naver.com/flhd1004,2017-09-13
"여수두꺼비게장돌게장딱딱, 갈치조림필수!",https://blog.naver.com/tyvtyv?Redirect=Log&logNo=221627566796,#여수돌게장 # 두꺼비게장먹으러다녀왔어요 여기는 진짜 #여수맛집 인가... 왜이렇게 사람이많아... 저희는 여수 도착하자마자 먹은점심이 여수돌게장 두꺼비식당 이었는데 만족! 아무튼 요 갈치조림이 갈치가... ,이옙일상 ღ'ᴗ'ღ,https://blog.naver.com/tyvtyv,2019-08-26
여수 게장 맛집두꺼비게장일요일 11시에 도착했던 후기,https://blog.naver.com/fidfid0418?Redirect=Log&logNo=221390462264,여수두꺼비게장 은 게장골목에 있고 우리같이 뚜벅이는 버스를 타고 근처 정류장에 내려서 이동해도 그렇게 힘들진 않을 듯하다 ㅎㅎ 여수는 처음이라 검색해보고 갔는데 티비에도 많이 나오고 나올때... ,"지금, 이대로가 좋아요",https://blog.naver.com/fidfid0418,2018-11-02
간장게장주문 광주 두꺼비게장짜지 않고 제대로네,https://blog.naver.com/kha8907?Redirect=Log&logNo=221610196518,짜지 않고 게 비린내도 나지 않아서 게장 좋아하지 않는 동생도 몇 개 집어 먹고 나는 워낙 게장을 좋아해서 막 먹고 ㅋㅋㅋㅋ 간장게장주문 광주 두꺼비게장에서 처음 해봤는데 잘 한 것 같다. 게장 생각... ,The diary of 호나,https://blog.naver.com/kha8907,2019-08-08
간장게장주문 광주 두꺼비게장내 스탈~,https://blog.naver.com/ych9749?Redirect=Log&logNo=221502825977,"간장게장주문 광주 두꺼비게장내 스탈~ 간장게장주문해서 드시는 분들 많으시죠 저도 워낙 게장을 좋아하는 편이라서, 이번에 광주 두꺼비게장 에서 간장 게장 작은 사이즈를 주문해봤어요 처음 시켜 보는 거라서... ",채현의 Beauty & Fashion,https://blog.naver.com/ych9749,2019-04-01
여수하면 게장 이번엔두꺼비게장 ~~_,https://blog.naver.com/tngid1657?Redirect=Log&logNo=221497273866,여수를 자주가는건 아니지만 항상 갈때마다 점심은 항상 #게장백반 # 두꺼비게장#여수맛집 #여수맛집 두꺼비게장우리는 세시쯤? 도착햇는데 그래도 웨이팅이 잇다ㅠㅠ 밥시간은 아니어서 오랫동안 기다리진... ,쑤의 일상블로그,https://blog.naver.com/tngid1657,2019-03-25
여수 게장 맛집 원조두꺼비게장훌륭했다!,https://blog.naver.com/vnemftnsska2?Redirect=Log&logNo=221632801955,"여수 게장 맛집 원조두꺼비게장 입니다. 여행 가기 전에 저는 아무것도 준비 안 하고 계획도 안 짜고... 근데 너무 초입에 있어서 좀 더 들어와서 두꺼비로 갔었네요ㅎㅎ 맛있는 TV, 배틀 트립, 오늘 굿데이... ",순남2 Blog Yo!,https://blog.naver.com/vnemftnsska2,2019-08-29
"여수 게장 맛집 ' 두꺼비게장 ', 갈치조림 + 게장백반",https://blog.naver.com/lovelysuns?Redirect=Log&logNo=221270608833,푸짐한 한상차림의 갈치조림 + 간장게장양념게장 백반을 맛볼 수 있는 게장 전문점 여수 게장 맛집 ' 두꺼비게장 ' 여수 돌산대교 인근 봉산동에 위치한 ' 두꺼비게장 '...간장게장양념게장과 함께 다양한... ,Lovelysuns' Photo Essay 'NOW',https://blog.naver.com/lovelysuns,2018-05-08
여수에 간다면두꺼비 게장백반,https://blog.naver.com/dandelioner?Redirect=Log&logNo=220751336640,"그 다음으로 찾은 것이 바로두꺼비 게장 이었다. 여수는 돌게장이 유명한데, 이 아저씨가 다녀온 곳은 허름한 기사 식당의 모습이었다.(그 포스팅은 무려 2007년 것이었다.) 2016년의 원조두꺼비 게장#2. 그런데... ",전지적 취미 시점 fits by dre,https://blog.naver.com/dandelioner,2016-07-01
"가볼만한곳! 여수 낭만카페, 게장맛집두꺼비게장알차다!",https://blog.naver.com/ysl0ve1oo4?Redirect=Log&logNo=221331759256,여수 가볼만한곳으로 보여드리는 여수 낭만카페 그리고 게장맛집두꺼비게장정말 여수여행 내내 너무 알찼어요♥ 기차를 타고 도착한 여수엑스포역! 기차 여행이 로망이였는데 엉덩이는 무지 아팠어요ㅋㅋㅋ... ,SUNNY TIME♥,https://blog.naver.com/ysl0ve1oo4,2018-08-03
[여수]원조두꺼비게장 ,https://blog.naver.com/kkj7770?Redirect=Log&logNo=221508135850,여수 봉산동 게장맛집 원조두꺼비게장사실 게장은 안먹는데 일행들이 다 좋아하고 갈치조림도 있대서 방문 수요미식회도 나오고 방송 탄 곳이라고ㅎㅎ 내부는 좌식이고 널찍하니 좋다 저녁먹기에는... ,단방향소통 생활기록부,https://blog.naver.com/kkj7770,2019-04-08
여수 맛집두꺼비게장 ,https://blog.naver.com/leesyg06?Redirect=Log&logNo=220022073793, 두꺼비게장 의 게장백반 2인용 상차림이에요. ㅎㅎ 밑반찬들도 맛이 괜찮았어요. 그치만 밥도둑 게장앞에선..ㅋㅋㅎ 맛있음 ㅠ 줄서서 기다릴때보니까 포장도 꽤 나가더라구요. 저도 여유만있었으면 한박스... ,얌옥/먹는게 좋아요.,https://blog.naver.com/leesyg06,2014-06-06
[여수]두꺼비게장- 돌게장 2015.8.6,https://blog.naver.com/luke_suh?Redirect=Log&logNo=220450086946,[여수]두꺼비게장- 돌게장 2015.8.6 남해안 여행 이틑날은 여수. 여수에서는 아쿠아리움이 너무 가보고 싶었다. 눈을 뜨기 힘들정도로 화창... 하다기 보단 태양이 작렬한 날이었다. 남쪽에 있는 내내 이 날씨였지.... ,Luke's Tasting Note,https://blog.naver.com/luke_suh,2015-08-13
광주 백반 맛집 신안동두꺼비게장 백반,https://blog.naver.com/leetmdnlxm?Redirect=Log&logNo=221461813420,"대애애박 메뉴판이에오~ 식사류부터, 찜-탕류, 요리류까지 메뉴 종류 다양하구요 요리류는 2인이상 주문해야하는게 많았고 우리는 게장백반으로 3인 주문이요! 아두꺼비게장 백반 주문시 추가 1회까지 무료라고... ",슬슬이 daily~,https://blog.naver.com/leetmdnlxm,2019-02-09
★ 여수두꺼비게장★ 여수 앞바다 정이 있는 그곳!!,https://blog.naver.com/young_rent?Redirect=Log&logNo=220747856302,양념게장이 정말 맛있었던 거 같습니다. 괜히 밥 도둑이라는 말이 생긴 게 아니네요 ㅎㅎ ※두꺼비게장제가 갈 때는 모든 좌석이 예약석으로 있을 만큼 많은 분들이 찾는 거 같습니다. 혹시라도 가실 분들은... ,천년을간직한우정,https://blog.naver.com/young_rent,2016-06-29
"여수게장맛집,두꺼비게장솔직후기",https://blog.naver.com/94040882?Redirect=Log&logNo=221448550440,여수게장맛집두꺼비게장사실 여수게장골목에 가봤더니 검색했을때 다 많이 나왔던 곳들이고 다 맛있어보여서 아무데나 들어갈까 했었는데두꺼비게장 이 주차하기가 쉬워서 들어갔었어요 :)두꺼비게장 에... ,롱초의 이야기,https://blog.naver.com/94040882,2019-01-22
여수 맛집 게장 백반두꺼비게장황소식당 둘 중 한곳은 먹어보자,https://blog.naver.com/rall80?Redirect=Log&logNo=221114936781,여수 두꺼비식당두꺼비게장식당도 역시나 황소식당처럼 줄을 길게 서있어서 15분 가량 기다렸네요 자~~~ 여수 게장백반 한상 대령이요~ 말 그대로 게판 입니다 ㅋㅋ 우리는 갈치조림 + 게장 백반 세트로 주문... ,우루사의 '집밖세상',https://blog.naver.com/rall80,2017-10-11
[전남/여수]여수맛집~ 게장으로 유명한집두꺼비게장 ,https://blog.naver.com/tkba5?Redirect=Log&logNo=54091396,도착하니 원조두꺼비게장 이라고 간판이 보인다~ 요즘은 원조가 대세 맞지요~ㅋㅋ 식당에 들어서니까 갑자기 게장에 밥이 먹고 싶어지면서 배가 고파옴은...ㅋㅋ 이른 시간이라고 생각했는데 벌써 식사를하고... ,"난다퀸, 여행날개를 펴다 ^^",https://blog.naver.com/tkba5,2008-08-22
"10월 - 보성,여수여행(2)/ 두꺼비게장 ",https://blog.naver.com/rinoayuna?Redirect=Log&logNo=221456166535,여수에 왔으면 갈치와 돌게장은 정말 먹어보길 권합니다. #국내여행 #여수여행 #10월여행 # 두꺼비게장#배틀트립 #돌게장 #갈치조림 #양념게장 #간장게장 #여수맛집 #남도밥상,"적게 소비하고, 조금만 갖되, 가진것은 최고의 것으로",https://blog.naver.com/rinoayuna,2019-02-01
[전라남도 여수시 봉산동]두꺼비게장 ,https://blog.naver.com/odoldodol96?Redirect=Log&logNo=90782032,돌게장집!두꺼비게장여수역에 도착해서 두리번두리번~ 택시아저씨들이 살살 꼬셨지만 훽~ 돌아서서 안내소에 원광병원간다는 1번과 2번버스를 기다렸다가 탔다 버스기사님이 여기서 내려서 길건너라고 친절히... ,오돌's 이야기,https://blog.naver.com/odoldodol96,2009-10-09
[여수] 전라남도 여수의두꺼비게장 ,https://blog.naver.com/nokysu?Redirect=Log&logNo=100198152927,"간장게장은 생각보다 짜서 양념게장이 더 나았던 것 같아요 의외로 반찬에 나온 게장된장국???이 맛있었어요 4. 장점 : 8,000원이라는 엄청난 가격에 게장을 마음껏 먹을 수 있다 여수두꺼비게장포스팅 끝.",천재생활지침,https://blog.naver.com/nokysu,2013-10-20
수요미식회 여수게장두꺼비게장 ,https://blog.naver.com/my15my15?Redirect=Log&logNo=221409513638,"#수요미식회 #여수 두꺼비게장2018년 10월 개천절연휴에 방문. 인천사는 사촌언니네가 내려와서... 어른 6명이라서, 동생이 게장을 못먹는 관계로 갈치조림+게장백반 2인분에 게장백반 4인분으로 주문하고... ",맛집애마&여행떠나 맛집 찾아 삼만리,https://blog.naver.com/my15my15,2018-12-01
리필되는두꺼비 게장- 여수 맛집,https://blog.naver.com/lcyyong5?Redirect=Log&logNo=80176149205,당초에는 돌게 식당을 가기위해 택시를 탓더니 문을 닫았다고 택시 기사 아저씨가 알려주는 덕에 B 안으로 찍어둔 황소식당과두꺼비 게장 집을 고민하다가두꺼비게장 집을 찾았다. 또 다른 게장 집인... ,마르첼의 블로그,https://blog.naver.com/lcyyong5,2012-12-18
*여수 게장 백반집 투어* 청정게장촌과두꺼비게장전격 비교!! :),https://blog.naver.com/yoojaka?Redirect=Log&logNo=220859320156,"거북이게장,두꺼비게장이렇게 세군데 갔습니다!!! 그중에 어디가 베스트였는지는 아래에서 바로 공개할게요!!!!!) 그래도 여수는 여수인지라 이집도 충분히 가볼만은 하답니다 하지만 제 결론은 당분간... ",쪽쪽씨 유작가의 80년간 세계일주,https://blog.naver.com/yoojaka,2016-11-11
