title,link,description,bloggername,bloggerlink,postdate
"방콕 맛집룽르엉 , 백종원보다 먼저!ㅎㅎ",https://blog.naver.com/daisukitokyo?Redirect=Log&logNo=221884191658,"맛집룽르엉 을 포스팅하려고 합니다. 방콕살기 하던 시절에 아주 많은 곳들 돌아다녔는데, 생각보다 제가 포스팅을 많이 안했더라고요. 많은 분들이 이 곳을 백종원 맛집으로 알고 계시는데,룽르엉 은 백종원... ",최기자의 트래블 & 스타일,https://blog.naver.com/daisukitokyo,2020-04-01
방콕맛집 백종원 다녀간룽르엉 (rung reung) 다녀왔어요,https://blog.naver.com/isis0905?Redirect=Log&logNo=221794597563,유명한룽르엉쌀국수 집에 다녀왔답니다. 호텔에서부터 구글 지도 켜고 고고~~ 아침 8시에 오픈이라고... 방콕맛집룽르엉에서 좀 빨리 팔리는 메뉴 중 하나라고 하지만 전 오픈하자 마자 가서 맛볼수 있었어요... ,꼬꼬마마녀의 좌충우돌 일상이야기,https://blog.naver.com/isis0905,2020-02-10
방콕 백종원 맛집룽르엉쌀국수 매력 개쩔어[스쿰빗맛집],https://blog.naver.com/mini80j?Redirect=Log&logNo=221791995552,좋았던룽르엉쌀국수집 소개해볼게요 힐튼 스쿰빗 호텔에서 가까워서 좋고 맛도 좋았거든요 거기다 얼마전 스트리트푸드파이트 백종원님도 다녀가신 바로 그룽르엉이에요ㅎㅎㅎ 구글 지도 찾으면 정말... ,디노파파의 맛집&여행이야기,https://blog.naver.com/mini80j,2020-02-01
방콕 스트리트푸드파이터 [ 룽르엉 ] 똠얌국수. 프롬퐁역,https://blog.naver.com/kim000hee?Redirect=Log&logNo=221801552893,"방콕 스트리트푸드파이터 방송에 나왔던 똠얌국수 맛집 프롬퐁역룽르엉실롬에 택시를 타고 이동했고, 약 5천원이 안되는 차비를 내고룽르엉바로 앞에 내렸다. 운영시간은 오전 8시반 오후 5시 구글정보를... ",땅콩크림 동네♪,https://blog.naver.com/kim000hee,2020-02-09
"방콕 1일차 * 원데이호스텔,룽르엉 , 앳이즈, 아르노스테이크",https://blog.naver.com/hakkuna?Redirect=Log&logNo=221796008034,"태국 방콕 5박 7일 :: 20190927 - 20191003 1일차 * 원데이호스텔,룽르엉 , 앳이즈, 아르노스테이크 갈지 말지... [ 방콕 *룽르엉쌀국수] 다음 날 아침. 숙소 근처에 유명한 국수 집이 있어서 아점 먹으러 갑니당... ",What a wonderful world :-),https://blog.naver.com/hakkuna,2020-02-04
"방콕맛집 - 방콕3대국수집, 태국국수의 진수! 프럼퐁룽르엉 국수",https://blog.naver.com/katarina7777?Redirect=Log&logNo=221692427178,집입니다룽르엉 국수 รุ่งเรือง 조기 위 사진에 빨간차양이 쳐진 집이에요 앞에 신기하게... 꾸웨이띠여우룽르엉수쿰빗 쏘이 이씹혹 크랍/카 ไปร้านก๋วยเเตี๋ยวรุ่งเ... ,지구는놀이터,https://blog.naver.com/katarina7777,2019-10-29
 룽르엉똠얌국수/바와스파 아로마 테라피/센트럴엠바시... ,https://blog.naver.com/rohnaeun?Redirect=Log&logNo=221853329830,씨암파라곤 쇼핑을 마치고 # 룽르엉 국수 먹으러 ㄱㄱ 아침 먹은지 3시간 만에 점심 먹으러 옴한국인들한테 유명한룽르엉똠얌 국수 먹으러! Phrom Phong(프롬퐁) 역에 내려서 쭉쭉 걸어온다 태국인 친구가 어쩜... ,Alles gute :-),https://blog.naver.com/rohnaeun,2020-03-14
스트리트푸드파이터룽르엉쌀국수 그리고 오리고기 프라짝... ,https://blog.naver.com/as2001qw?Redirect=Log&logNo=221956773973,"둘다 너무 맛있어요 방콕여행, 태국여행, 방콕쌀국수, 태국쌀국수, 방콕오리고기, 스트리트푸드파이터방콕, 현지인 맛집 방콕여행에서는 먼저 갔다온 친구들의 도움을 많이 받았다룽르엉 도 먼저 갔다온 친구가... ",루케테의 Blog,https://blog.naver.com/as2001qw,2020-05-16
[8박 9일 자유여행] 태국 방콕 6박 7일 - 3일차 / 스푸파룽르엉 ... ,https://blog.naver.com/glvlepdl?Redirect=Log&logNo=221699593095,"태국 방콕 6박 7일 - 3일차룽르엉(스트리트 푸드 파이터 똠양국수) 10 3 Sukhumvit 26 Alley, Khlong Tan, Khlong...룽르엉메뉴판입니다. 한국 사람이 역시나 많은지 한국어로 써져있어서 메뉴정하기는 쉬웠어요.... ",보짱의 소소한 이야기,https://blog.naver.com/glvlepdl,2019-11-06
방콕 맛집룽르엉돼지국수 미슐랭이래!,https://blog.naver.com/csn324?Redirect=Log&logNo=221888752311,오늘은 방콕 맛집 요즘에 인기가 높아진룽르엉돼지국수를 먹어본 이야기 들려드릴께요 작년 11월에... 방콕 더블트리 힐튼 쿠키도 왜 첵인할때 안주니ㅋㅋ 방콕 맛집룽르엉돼지국수 여행을 할 때 저는 미리... ,비범한 백수부부의 세계여행기~*,https://blog.naver.com/csn324,2020-04-03
태국 방콕 자유여행 DAY7 (터미널21 /룽르엉 쌀국수... ,https://blog.naver.com/chaemj010?Redirect=Log&logNo=222445883695,DAY 5 태국 방콕 자유여행 코스 추천 터미널21 -룽르엉 쌀국수 - 오아시스스파 - 앤티앤스프레즐... 맘에들어요룽르엉쌀국수 영업시간 : 아침8시 -오후 4시30분 스쿰빗로드bts 프럼퐁역 근처에 있는 로컬 쌀국수... ,My favorite,https://blog.naver.com/chaemj010,2021-08-27
방콕 똠양꿍 맛집 백종원 다녀간 똠양국수룽르엉 ,https://blog.naver.com/bbong1111111?Redirect=Log&logNo=221735268848,어쨌든 오늘은 방콕에서의 마지막 날 먹고 온 방콕 똠양꿍 맛집룽르엉포스팅해보려구요 여기는... 방콕 똠양국수룽르엉스트리트푸드파이터 나온 집은 여기라구요 방콕 똠양꿍 맛집룽르엉검색했을 때 이... ,♥지야월드♥,https://blog.naver.com/bbong1111111,2019-12-12
"[방콕/프롬퐁] 방콕 국수 맛집,룽르엉돼지 국수",https://blog.naver.com/sunha8848?Redirect=Log&logNo=221814998082,"[Rung Reung Pork Noodle,룽르엉돼지 국수] 어제 프롬퐁 근처에 잠시 일보러 나갔다가 룽르앙 국수 먹고왔어욘 : ) 프롬퐁역 에서 도보로 5분이면 갈 슈 있어여 스쿰빗 26 초입에서 2-3분정도 걸어가면 바로... ",Tami's BANGKOK STORY,https://blog.naver.com/sunha8848,2020-02-19
"[태국 방콕] DAY 3-1 :: 백종원맛집투어(짜런생, 룽르엉 )/TEA.ETC",https://blog.naver.com/dbrudgina?Redirect=Log&logNo=221737313067, 룽르엉요기도 백종원 아저씨가 추천한 어묵국수집_인정!!! 드뎌 도착한 어묵국수집!!!! 백종원아저씨가... #태국맛집 #방콕맛집 # 룽르엉#짜런생 #백종원맛집 #방콕백종원맛집 #방콕백종원추천맛집... ,땅가님의블로그,https://blog.naver.com/dbrudgina,2019-12-14
태국 방콕 맛집 미슐랭 가이드에 선정된 국수집 !룽르엉쌀국수 ~,https://blog.naver.com/monkey_dream?Redirect=Log&logNo=221724267568,방콕 맛집 - 룽르엉쌀국수 혹시 미슐랭 가이드라고 아시나요 ? 아마 자세히는 몰라도 뭔가 '맛집... 그중 미슐랭 가이드에서 빕 구르망에 선정된 방콕 맛집룽르엉쌀국수 맛집을 소개하려고 해요~ 1.... ,몽키의 여행수다,https://blog.naver.com/monkey_dream,2019-12-09
"방콕 여행 7일차 오후, 수쿰빗 태국식 쌀국수 맛집룽르엉 ",https://blog.naver.com/chingu_yh?Redirect=Log&logNo=222077665338,ㅎㅎ) 하여튼 트리플에 나온 상호는룽르엉 . 돼지 어묵 똠얌맛물국수가 대표란다. 지도에서 알아낸... 왼쪽 상단 ' 룽르엉누들 숍'도 쓰여있고. 어플에서 알려준 주문 방법을 그대로 따르기 매우 수월해... ,"""다음 휴가땐 어디갈까?""",https://blog.naver.com/chingu_yh,2020-09-02
"#덩유니방콕 DAY3,룽르엉 국수 - 딸랏롯파이 야시장",https://blog.naver.com/jungyoon62?Redirect=Log&logNo=222440553998,아부지는 좀 쉬시겠다고 하여 여자셋의 방콕 탐방기 그 첫번째 목적지는룽르엉 국수 ㅋㅋㅋㅋㅋㅋ ㅋㅋㅋㅋㅋㅋㅋㅋㅋㅋㅋㅋ 아 근데 미쳤다. 진짜 너무 맛있다. 똠얌물국수와 똠얌비빔국수 우리나라로 치면... ,AVID,https://blog.naver.com/jungyoon62,2021-07-22
방콕 프롬퐁맛집룽르엉Rung Reung,https://blog.naver.com/eosllover?Redirect=Log&logNo=221836749417,- 제가 머문 호텔 바로 근처에 있던 프롬퐁 맛집 # 룽르엉오픈키친이긴한데 너어어어어무 오픈되어있어서... 그래도 생각보다는 깨끗해요.룽르엉 은 두곳이 붙어있는데 저는 코너에 있는 집으로 갔어요.... ,일상다반화 Flower market,https://blog.naver.com/eosllover,2020-03-04
[방콕 맛집]룽르엉포크 누들,https://blog.naver.com/polarisians?Redirect=Log&logNo=221690650800,태국을 발밤발밤: 방콕 맛집룽르엉포크 누들 백종원의 스트리트푸드파이터에 소개된 국수집... 방콕 스쿰빗 지역에 위치한룽르엉포크 누들이라는 국수집입니다. 스쿰빗 메인 로드에서 조금 들어간 곳에... ,한소하의 사이드잡스 프로젝트,https://blog.naver.com/polarisians,2019-10-28
태국 방콕 쌀국수 맛집룽르엉(스쿰빗 소이 26),https://blog.naver.com/bamy87?Redirect=Log&logNo=222085618333,"# 룽르엉#방콕 #태국 #쌀국수 #맛집 코로나, 그리고 태국 국내에서 사실상 코로나 확진자가 크게... 다녀왔던룽르엉쌀국수가 생각났다. 스쿰빗 소이 26 초입에 위치한룽르엉쌀국수. 이미 방콕 맛집으로... ",일상기록,https://blog.naver.com/bamy87,2020-09-10
방콕 자유여행 : 랭캐스터 호텔 후기 + 근처 맛집룽르엉 ... ,https://blog.naver.com/byddoni55?Redirect=Log&logNo=221814818220,방콕 아침식사는 조식 아니그 # 룽르엉이쥬 여긴 아침 빨리부터 열어서 택시타고 후다닥 다녀오면 개꿀룽르엉외관은 이렇게 생겼어요 낡고 허름하지만 나름 나쁘진 않아요ㅎㅎ 아침엔 웨이팅이 없지만... ,내맘로그,https://blog.naver.com/byddoni55,2020-02-19
"2년전 오늘(2.18), 태국 방콕룽르엉쌀국수",https://blog.naver.com/comaism?Redirect=Log&logNo=222386087508,방콕에 있는룽르엉쌀국수입니다. 원체 유명한 곳 이라.. 가보신분도 많것져~ 저는 별 3.5개^^ 한국분들 많이 가시는 더블트리힐튼 옆이구요. 힐튼수쿰빗에서 가실땐 뒤쪽으로 더블트리힐튼 통해서 가심... ,코마월드,https://blog.naver.com/comaism,2021-06-05
 룽르엉 .. 태국쌀국수의 교본..,https://blog.naver.com/sola1000?Redirect=Log&logNo=222492698296,수쿰빗 soi26 쌀국수집룽르엉 . https://blog.naver.com/sola1000/220932242704 보통은 사이즈가 탐마다-피셋(보통-곱배기)인데 여기는 대 중 소로 세분화. 메뉴판 그림 네개 모두 주문.... ,CHAIDEE...,https://blog.naver.com/sola1000,2021-09-02
[방콕룽르엉 ] 백종원 스트리트 푸드파이터 고기국수... ,https://blog.naver.com/wrinlove?Redirect=Log&logNo=221721339821,제가 묵던 방콕 수쿰빗 힐튼 근처에 백종원 스트리트 푸드파이터 출연 맛집 ' 룽르엉 ' 이 있어 찾아갔어요~~ 정말 10분 내외의 아주 가까운 곳이라 수쿰빗 힐튼 근처에 묵으시는 분들은 조식 드시러 가세요~~ 오전... ,우리우리의 하루하루는 감동,https://blog.naver.com/wrinlove,2019-11-28
방콕 자유여행 로컬 맛집룽르엉쌀국수,https://blog.naver.com/wlsgml850?Redirect=Log&logNo=221225111414,방콕 자유여행 로컬 맛집룽르엉쌀국수 B A N G K O K 방콕 자유여행을 하던 중 하루는 택시를 타고... 방콕 로컬 맛집인룽르엉쌀국수를 찾아가는 길~ 저희는 역에서 가까워서 걸어갔는데 arize hotel sukhumvit과... ,트래블러버의 맛있는 여행,https://blog.naver.com/wlsgml850,2018-03-09
방콕 맛집룽르엉 누들 맛있고 저렴한 최고의 국수집,https://bloggertip.com/4899?category=876448,국수집인룽르엉 누들에 다시 방문했다. 이번엔 여친과 함께 가보았는데 역시 실망시키지 않는 맛이었다. 여친도 너무 좋아해서 나도 덩달아 기분이 좋아졌다.룽르엉 누들은 방콕 BTS 프롬퐁역이라 가깝다.... ,블로거팁닷컴,https://bloggertip.com/,2019-09-26
방콕여행 : 백종원맛집 프롬퐁룽르엉쌀국수(rung reung),https://blog.naver.com/peonyday?Redirect=Log&logNo=221440949349,"도착한룽르엉 - 길을 따라서 ㄱ자로 두개의 가게가 붙어있는데, 둘다 같은 곳(분점인듯?)이라고 한다... 먹어보지 못했던 것이 아쉬웠다 마지막날까지 아른거렸던룽르엉 - 프롬퐁까지 올 가치가 충분했던 곳 :)",Stunning!,https://blog.naver.com/peonyday,2019-01-13
[태국 방콕]룽르엉 (Rung Reung) - 스트리트푸드파이터 방콕편... ,https://blog.naver.com/danbijyj?Redirect=Log&logNo=221566877906,스트리트 푸드파이터 본지가 언젠데 아직도룽르엉 을 못가봤었다. 방송 아니어도 원래 유명한 집이라...룽르엉 은 두 집에 찢어진거라 바로 옆에 나란히 붙어있다고 들은것 같긴한데 샷다 같이 내린걸로 봐서... ,장단비 블로그,https://blog.naver.com/danbijyj,2019-06-20
방콕맛집룽르엉국수 ♪ 해장으로 그뤠잇~,https://blog.naver.com/pinkponytail?Redirect=Log&logNo=221167876365,#방콕맛집 #태국방콕여행 방콕 로컬 맛집으로 유명한룽르엉국수! 저는 제가 2박했던 래디슨 블루 프라자 호텔이룽르엉국수에서 정말 가까워서 아침 겸 점심으로 먹으려고 걸어서 다녀왔어요!룽르엉Sukhumvit... ,포니테일♡,https://blog.naver.com/pinkponytail,2017-12-21
방콕 BTS 프롬퐁 맛집룽르엉Rung Reung 돼지고기 똠얌 국수,https://blog.naver.com/lamanoworks?Redirect=Log&logNo=221485078544,유명한룽르엉Rung Reung에 왔어요. 구글에 보면 Pork Noodle이 적혀있는 걸로 보아 돼지고기가... 접근성도 좋은것 같아요. 방콕 맛집룽르엉Rung Reung 영상으로도 확인하세요~!! https://youtu.be/GQqCCen1BAc,한달살기로 세계여행,https://blog.naver.com/lamanoworks,2019-03-11
스쿰빗 소이 26의 태국 전통 쌀국수집 ~룽르엉 ,https://blog.naver.com/myolongi?Redirect=Log&logNo=110173910753," 룽르엉스쿰빗 소이 26 안쪽에 위치. 프롬퐁 역에서 도보 5분 거리. 오픈시간 : 오전 8시30분 ~ 오후... 불가룽르엉 표 메뉴판 되겠는데 , 오롱이와 꼭 같은 상황인 분들은 아래를 참조 하시기 바랍니다.... ",오롱이의 여행 이야기,https://blog.naver.com/myolongi,2013-08-11
"방콕 맛집 방콕 대표 국수 맛집,룽르엉 ",https://blog.naver.com/jaeng12?Redirect=Log&logNo=221538830430,27 (금) 이미 소문이 날대로 난 유명한 #방콕국수맛집 # 룽르엉후기입니다. 프롬퐁 역에서 가까운 소이 26... 마침 가깝기도 하고 해서 방콕에서의 첫 식사로 # 룽르엉을 고르게 되었답니다.룽르엉 에 가보면... ,쟁이의 꿈꾸는 세계 땅밟기,https://blog.naver.com/jaeng12,2019-05-16
방콕 맛집룽르엉Rung Reung - 3대 쌀국수 해장으로 딱,https://blog.naver.com/carolinish?Redirect=Log&logNo=221576669740,이날도 해장 거리를 찾던 중 얻어걸린룽르엉쌀국수 구글에서 알아보고 지도만 믿고 갔는데 알고보니... 어쨋거나 #태국3대쌀국수 #방콕맛집 # 룽르엉국수 프롬퐁 역과 통로 역 사이 길에 있다 통로역에서 슬슬... ,Wanderlust 블로그,https://blog.naver.com/carolinish,2019-07-03
"[방콕/프롬퐁 맛집]룽르엉 (Rung ruang noodles, 泰榮米粉) ♡",https://blog.naver.com/victorias_p?Redirect=Log&logNo=221038831650," 룽르엉 (Rung ruang noodles, 泰榮米粉) ♡ 2017년 5월 방문 더블트리힐튼 호텔에서 체크아웃 후 점심먹으러 들른 태국식 쌀국수 맛집룽르엉 ~~ 더블트리힐튼이나, 힐튼 스쿰빗 호텔 묵으실때 가면 좋은게 호텔... ",Victoria's Speak,https://blog.naver.com/victorias_p,2017-06-27
"방콕여행룽르엉국수, 유니크한곳들!",https://blog.naver.com/meeyou?Redirect=Log&logNo=221260443610,방콕룽르엉국수 여기 여러 사람들이 인정한 현지식 누들 집이에요. 프롬퐁에서 가까워서 근처... 방콕룽르엉국수 하나만 소개하기엔 너무 아쉬워서 방콕여행 와서 즐길 수 있는 독특한 곳 몇 곳을 함께... ,데솔 여행가,https://blog.naver.com/meeyou,2018-04-24
(36) 2주동안 무려 5번이나 갔던 프롬퐁역룽르엉( 렁렝 ),https://blog.naver.com/dktladl1?Redirect=Log&logNo=221111742888,이제는 한국 여행객들에게 너무나 유명해진 프롬퐁역의룽르엉 !! 저도 몇년째 다니고 있는 국수집인데... 먼저 모퉁이 가게에 있는룽르엉이제 가격이 라지사이즈 70바트까지 올랐음 ( 처음 갔을때는 스몰... ,아심이의 여행일기,https://blog.naver.com/dktladl1,2017-10-24
"[ 2018 태국 ] 방콕 국수 맛집,룽르엉 ",https://blog.naver.com/silder17?Redirect=Log&logNo=221562241456,딱 봐도 보통인 곳이 아니다 싶어 구글맵을 보니 여기 그 유명한 국수 전문점인룽르엉 이었다 !!!!!!룽르엉두 개가 나란히 있어 어디로 가야 하나 찾아보니 가족이 운영한다고~ 맛도 동일하다고 하길래 나는... ,Blossom,https://blog.naver.com/silder17,2019-06-15
방콕 쌀국수 맛집 백종원이 인정한룽르엉 ,https://blog.naver.com/mortareg?Redirect=Log&logNo=221456700941,방콕 쌀국수 맛집 백종원이 인정한룽르엉안녕하세요. 여행블로거 고미리레 입니다. 방콕 여행 갔을때... 목적지에 도착 하시면 방콕룽르엉쌀국수 가게가 두곳이라 헷갈리실수 있는데요. 백종원 아저씨가... ,고미리레 의 세상 탐험 여행 블로그,https://blog.naver.com/mortareg,2019-02-01
태국 방콕 프롬퐁역룽르엉누들 (Rung Reung Pork Noodle),https://blog.naver.com/z2417?Redirect=Log&logNo=221525958283,방콕에 도착하자마자 스트리트 푸드 파이터 방콕 편에 나왔다고 하는 백종원 아저씨도 인정한룽르엉국수를 먹기로 했다. 방콕룽르엉국수는 방콕 지상철 BTS 프롬퐁역에서 내려서 스쿰빗 소이 26 골목으로... ,기록저장소,https://blog.naver.com/z2417,2019-04-30
방콕 프롬퐁역룽르엉 국수에서 아침국수 !!!!,https://blog.naver.com/suineee_?Redirect=Log&logNo=221601559276,"백종원 아저씨가 칭찬한룽르엉 국수가 !!!!! 프롬퐁역에서 5분? 안걸렸던 것 같아요 에어비앤비랑은 하나 옆 길이라 조금 걸어갔지만, 역에서는 별로 안멀어요. 눈뜨자마자 선크림만 덕지덕지 바르고 9시?쯤... ",W i t h INeee,https://blog.naver.com/suineee_,2019-08-01
"[방콕맛집] 다시 찾은룽르엉스쿰빗 맛집, 스쿰빗 국수",https://blog.naver.com/kimvo97?Redirect=Log&logNo=220516944636,그곳에 가면 조식불포로 해야하는 이유 이집룽르엉 이 있기때문이다.룽르엉 은 2013년에도 한번 다녀와서 포스팅한적이 있는데 그 이후 더 발전하고 있는 느낌이다. 포스퀘어에서 찾아보면 이집이 근처에서... ,kimvo: 아들 나무씨와 여행하는 킴보,https://blog.naver.com/kimvo97,2015-10-23
방콕프롬퐁맛집 -룽르엉 쌀국수(스트리트 푸드 파이터 방콕),https://blog.naver.com/ejrdl9074?Redirect=Log&logNo=221366737306,137필라스에서 젤 가까운 프롬퐁역에있는 방콕프롬퐁맛집 -룽르엉 쌀국수 백종원 스트리트 푸드 파이터 방콕 방송되었던 그곳이다. 가는방법은 구글맵준비 끝 ㅋㅋㅋㅋㅋㅋㅋㅋㅋ 구글맵에룽르엉 이라고... ,파워숄더,https://blog.naver.com/ejrdl9074,2018-09-28
방콕 맛집룽르엉 ,https://blog.naver.com/eunryori_?Redirect=Log&logNo=221338305087,방콕 맛집룽르엉작년에도 가고 이번에도 방문한 곳. 태국 음식이 생소하다면 추천하고 싶은 곳이다. 정말 익숙한 맛의 국수를 맛볼 수 있기 때문에 누구나 좋아할 것 같다. 한국어로도 써있어서 주문하기... ,은료리 블로그,https://blog.naver.com/eunryori_,2018-08-13
방콕맛집룽르엉쌀국수! 백종원의 스트리트 푸드파이터에도... ,https://blog.naver.com/pinkponytail?Redirect=Log&logNo=221570006168,방콕맛집룽르엉쌀국수! 백종원의 스트리트 푸드파이터에도 나왔어요 17년에도 자주가는 커뮤니티에서 추천받아 다녀온룽르엉쌀국수! 그때는 호텔이 레디슨 블루 프라자 호텔이어서룽르엉 까지... ,포니테일♡,https://blog.naver.com/pinkponytail,2019-06-25
 룽르엉국수집 찾아가는 방법~소이 24 bts 프롬퐁 역에서 부터,https://blog.naver.com/myolongi?Redirect=Log&logNo=110173936056,스쿰빗 소이 26에 있는 태국 전통 쌀국수집룽르엉찾아 가는 방법 입니다룽르엉포스팅 http://myolongi.blog.me/110173910753 스쿰빗 소이 24 초입 부분 나라야 매장 근처에서 부터 출발 하겠습니다. 연두색... ,오롱이의 여행 이야기,https://blog.naver.com/myolongi,2013-08-11
두번째 방콕: Day2룽르엉 / 방콕 쉐라톤 그랑데 스쿰빗/ 만짜이... ,https://blog.naver.com/j_skysea?Redirect=Log&logNo=221318304726,두번째 방콕: Day2룽르엉 / 방콕 쉐라톤 그랑데 스쿰빗/ 만짜이/ 홀리/ 소울푸드 마하나콘/ 고메마켓 첫... 8시부터 문여는 은혜로운룽르엉백종원 선생님의 가르침을 받아 첫끼로 먹으려고 달려왔습니다.... ,꿈나무 블로그,https://blog.naver.com/j_skysea,2018-07-15
방콕자유여행] 첫날⑥ 현지느낌 풀풀 쌀국수맛집룽르엉 국수,https://blog.naver.com/gusao0218?Redirect=Log&logNo=220655789664,안녕하세요 밍구스입니다 4박 6일 방콕여행 16.02.29 ~ 03.05 첫날 계획대로 하나 둘 해나가고 있는 우리들 나라야매장 둘러 보고 밥 먹으로 고우 방콕여행 에서의 정식 첫 끼니로 선택한룽르엉 국수룽르엉 ... ,쓰담쓰담 수고했어 오늘도:),https://blog.naver.com/gusao0218,2016-03-15
2019 방콕 여행 - 4일차 (짜런쌩 씰롬 / 짜투짝시장 /룽르엉 누들),https://blog.naver.com/prist03?Redirect=Log&logNo=221545684767,안됐지만룽르엉누들은 먹어줘야 합니다. 짜투짝 시장에서는 GRAB을 잡기 너무 힘들었어요... 택시로룽르엉누들 앞까지 도착! 이게 태국에서의 마지막 식사입니다... 배가 고프지 않았던 저는 작은... ,잘먹고 잘사는 나,https://blog.naver.com/prist03,2019-05-24
"[태국] 방콕 샌샙 운하보트, 게이손 빌리지,룽르엉국수집",https://blog.naver.com/uboat311?Redirect=Log&logNo=221591145520,ㅎㅎ 점심 먹으러 이동 중~ 태국 로컬 맛집룽르엉국수집으로 가는 중이구요. 플람퐁 역 입구에 있는 저 오리구이집 전에 먹어봤는데 맛집입니다. 추천!룽르엉도착~ 생각보다 찾기 수월했어요. 백종원의... ,유봇의 여행기,https://blog.naver.com/uboat311,2019-07-21
"방콕자유여행, 두번이나 가서 먹은룽르엉돼지고기 국수",https://blog.naver.com/dktladl1?Redirect=Log&logNo=220522639297,"바로 스쿰빗 쏘이 26 더블트리 힐튼 호텔 근처에 있는 돼지고기 국수집룽르엉 (룽르안, 룽르앙) 이라는 곳이에요. 제가 처음 이곳을 알게된 이유는 태사랑에서 나누어준 방콕 지도를 보다가 쏘이 26에룽르엉 ... ",아심이의 여행일기,https://blog.naver.com/dktladl1,2015-11-02
 룽르엉 국수 방콕 최고 맛집으로 인정 ♡,https://blog.naver.com/q3w3p?Redirect=Log&logNo=221112780819, 룽르엉 오픈시간에 맞춰 아침 8시쯤 호텔에서 출발! 컴퍼스 스카이뷰호텔에서룽르엉 국수집까지는 걸어서 5분정도 걸린다. 조금만 걸으면되니 아직 위치적으로는 최고!!! 태국말을 모르니... 저 밥그릇같은... ,돈벌어서여행가자,https://blog.naver.com/q3w3p,2017-10-08
"방콕 로컬 맛집룽르엉 국수, 맛있었어요!",https://blog.naver.com/heartierh?Redirect=Log&logNo=221090611675,"가까운 거리에 위치하는룽르엉 국수 들어보셨을거에요. 워낙 로컬 맛집으로 유명한 곳이기도 하고, 한국인 입맛에 딱 맞는 곳이라 우리나라 여행객들이 많이 찾는 방콕 식당 중 하나인데요 : )룽르엉 국수는... ","따뜻한 이야기가 가득, 하티",https://blog.naver.com/heartierh,2017-09-06
 룽르엉 /통로 더커먼스/커피클럽/시암 파라곤,https://blog.naver.com/formejy?Redirect=Log&logNo=221336288164,여기가룽르엉 이 맞는지 아닌지 고민됨 일단 확장함 쥬스 시키고 면 시키고 기달리기 국수 맛있음 ㅋㅋㅋㅋㅋㅋ 양 작음 4개 시킴 그랩 불러서 통러 덥더라 이날도 그래도 한국보다 시원 로스트 갈려고 했는데... ,지구인님의블로그,https://blog.naver.com/formejy,2018-08-10
방콕여행- 프롬퐁/ 룽르엉쌀국수맛집/NUCH 마사지/ 에라완 사원,https://blog.naver.com/1985md?Redirect=Log&logNo=221360836490,"24 DAY 4 에라완사원,룽르엉, NUCH마사지 출발 ~! [ 에라완 사원 Erawan ] 브라흐마 (힌두교와 불교의 신)이... [룽르엉쌀국수 ] 똠얌을 좋아한다면 무조건 이곳으로!!! 똠얌국수의 최고룽르엉쌀국수다. 오래된... ",달콤한여행 블로그,https://blog.naver.com/1985md,2018-09-17
