title,link,description,bloggername,bloggerlink,postdate
"나홀로 방콕 3일차 (더블트리힐튼 수영장,룽르엉 )",https://blog.naver.com/jmjlz9215?Redirect=Log&logNo=221410348295,"^^ 프롬퐁역룽르엉호텔에서 1분거리ㅋㅋ룽르엉 에서 간단히 점심을 먹었다. 여기는 스트리트 푸드파이터에도 나온 식당이고, 한국인들 사이에 입소문난 가게였다. 나는 열두시가 좀 넘어서 갔는데 가게밖까지... ",일상의 조각들,https://blog.naver.com/jmjlz9215,2018-12-01
[2016년 방콕여행] Rung Ruang Noodle룽르엉국수_방콕... ,https://blog.naver.com/jiheni59?Redirect=Log&logNo=221082446027," 룽르엉국수 태국에는 참으로 맛있는 국수집이 많쥬? 방콕에 아무리 먹을게 많다해도 갈때마다 들리는 꾼댕이(끈적국수),나이쏘이, 길거리 노점국수 등 국수는 꼭 먹고와야 합니다. Rung Ruang Noodle룽르엉 ... ",Soul Trip,https://blog.naver.com/jiheni59,2017-08-26
2018.11.23(금) 방콕 넷째날 /룽르엉 국수 / 메리어트 조식... ,https://blog.naver.com/wh090531?Redirect=Log&logNo=221407532672,"일어나자마자 # 룽르엉 국수 이곳은 아침 8시 30분에 오픈하고 오후 다섯시면 문을 닫기 때문에 가려거든... 가까운룽르엉 을 한 번 더 다녀왔다 주소 : 10, 3 Sukhumvit 26 Alley, Khwaeng Khlong Tan, Khet Khlong Toei, Krung Thep Maha... ",아마도,https://blog.naver.com/wh090531,2018-11-27
[태국 여행]방콕(Bangkok)...프롬퐁역룽르엉국수집... ,https://blog.naver.com/rose0626?Redirect=Log&logNo=221501457190,딸아이 친구와 함께 간 국수집 숙소가 프롬퐁역 근처가룽르엉국수집에는 10분도 안걸린다. 위치는 구글지도에서 ~~ 프롬퐁역 백종원님도 인정했다니 어떤 맛일지? 궁금했는데 한마디도 정말 맛있었다.... ,마음이 걷고 발이 쓴다.,https://blog.naver.com/rose0626,2019-03-31
"방콕 여행의 별미,맛있는 국수집 2곳 in방콕 시내~ 룽르엉 ... ",https://blog.naver.com/myolongi?Redirect=Log&logNo=220919473718,국수가룽르엉 과 사왕 누들 입니다. 카오산로드 주변에서 들렀던 국수집에 중에도 기억에 남는 곳이... 방콕 시내 한복판에 있어 시내 일정 중 들르기 편하실꺼예요 ~룽르엉(Rung Ruang Noodle) 오롱이의 평점... ,오롱이의 여행 이야기,https://blog.naver.com/myolongi,2017-01-24
두번째 방콕: Day4 디바나 너쳐/룽르엉 / 엠콰티어 엠포리움... ,https://blog.naver.com/j_skysea?Redirect=Log&logNo=221325039070,두번째 방콕: Day4 디바나 너쳐/룽르엉 / 엠콰티어 엠포리움/ D'ark / 크루아압손/ 카오산로드/ 콘파이... 그리고 또 간 우리의 방콕 최고 맛집룽르엉메뉴판도 필요없다. 똠얌국수 큰거로 두개 주이소~ 다시 먹어도... ,꿈나무 블로그,https://blog.naver.com/j_skysea,2018-07-24
오늘 아침 식사는 프롬퐁역룽르엉( Rung Ruang Noodles )... ,https://blog.naver.com/dktladl1?Redirect=Log&logNo=220843185342,"근처의룽르엉쌀국수 집입니다. 첫 방콕여행 이후 제가 방콕에서 가장 많이 갔던 식당이 어디냐고 물으면 대답할 수 있는곳 바로룽르엉 ! 벌써 5번도 넘게 다녀왔고, 개인적으로 제가 방콕에서 가장... ",아심이의 여행일기,https://blog.naver.com/dktladl1,2016-10-27
방콕맛집/프롬퐁맛집-룽르엉쌀국수 @soi26,https://blog.naver.com/1985md?Redirect=Log&logNo=220923809388, 룽르엉쌀국수 @Soi 26 Rung Ruang Noodles 위치 : Soi26 (BTS 프롬퐁역에서 도보 6분. soi26 더블트리힐튼 호텔... 이곳룽르엉쌀국수. 오래된 쌀국수집인데 최근 대박이 나면서 옆집에 2호점을 나란히 오픈했다. 덕분에... ,달콤한여행 블로그,https://blog.naver.com/1985md,2017-01-31
18.08] 방콕 여행 -룽르엉쌀국수 / 까사라핀(Casa Lapin)... ,https://blog.naver.com/blooming0201?Redirect=Log&logNo=221358704277,ㅋㅋㅋ 뭘먹을까 고민하다가 백종원 아저씨가 다녀갔다던룽르엉 에 가기로당연히 한국 사람이... 카페로 -룽르엉 과 가까운 까사라핀 카페 바깥 자리에 앉겠다고 생각하고 갔는데날씨가 너무 더워서 ㅋㅋㅋㅋ... ,Blooming,https://blog.naver.com/blooming0201,2018-09-14
"프롬퐁 맛집들 (엠쿼티어 푸드홀,룽르엉국수, 타이라오예)",https://blog.naver.com/eung1215?Redirect=Log&logNo=221419851531,그 유명한룽르엉국수! 똠얌맛물국수랑 비빔국수 하나씩 하고 백종원이 꼭 먹어봐야 한다고 했던...룽르엉국수 후기를 그동안에 뻥 조금 합해서 100개는 본거 같은데 -_- 그중에 별로란 후기는 한번도 못본거... ,My Missing Piece,https://blog.naver.com/eung1215,2018-12-15
[방콕 먹방]방콕룽르엉국수 / 스쿰빗 맛집/ 프롬퐁역 맛집,https://blog.naver.com/caroncaron?Redirect=Log&logNo=221260412288, 룽르엉국수 영업시간 08:00~16:30 일찍 가세요 해장용으로 퍼펙한 메뉴입니다. 사람이 바글바글 더워서 그런지 ㅋㅋㅋ다들 먹고 금방 나가서 회전율이 짱 빨랐다. 방콕 스쿰빗 맛집룽르엉 국수 메뉴 한글로도... ,카롱이의 놀이터,https://blog.naver.com/caroncaron,2018-04-24
"방콕 여행자를 위한 소울푸드,룽르엉돼지고기 국수",https://blog.naver.com/dandelioner?Redirect=Log&logNo=220890767477,"국수집인 ‘ 룽르엉 ’이 있다. 서거 전 국왕도 즐겨 찾았던 곳이라고 하던데, 작은 골목에 노점인듯 아닌듯 위치하고 있다.룽르엉룽르엉 의 소박한 빨간색 간판 간판도 현지어로 되어 있어서 찾기 힘들뻔했는데... ",전지적 취미 시점 fits by dre,https://blog.naver.com/dandelioner,2016-12-20
2017 방콕여행:: 프롬퐁역 맛집룽르엉씰국수♪ 1년만에 다시... ,https://blog.naver.com/ringom0201?Redirect=Log&logNo=221134491130,2017 방콕여행:: 프롬퐁역 맛집룽르엉씰국수♪ 1년만에 다시먹으러 오다! 작년에 우리가 넘나 맛있게 먹었던룽르엉쌀국수.시암 나라야에서 만족스러운 쇼핑을 못했고 종류도 적었기에종류가 더 많고 더 큰... ,하링의 부루마블놀이♬,https://blog.naver.com/ringom0201,2017-11-07
방콕 스쿰빗 쏘이 26룽르엉(룽르앙) 쌀국수,https://blog.naver.com/dktladl1?Redirect=Log&logNo=220539341331,"있는룽르엉국수집입니다,. 이곳은 스쿰빗 힐튼 그리고 더블트리힐튼 근처에 있는 쌀국수집이기... 일어나서 운동하고 나서 씻고 체크아웃 전에룽르엉쌀국수집이랑 인스타그램에서 발견했던 브런치... ",아심이의 여행일기,https://blog.naver.com/dktladl1,2015-12-10
진짜 태국 쌀국수 방콕 프롬퐁역룽르엉Rung Ruang Noodle,https://blog.naver.com/07forever10?Redirect=Log&logNo=221014228580,"태국 쌀국수 프롬퐁역룽르엉Rung Ruang Noodle 역에서 나와 2~3분거리? 정말 가까운 이곳, 진짜 태국 현지... 쌀국수룽르엉시원한 사이다에 깊은 맛을 느낄 수 있는 아침 식사였습니다 마음같아서는 두번 정도... ",그리면 그리된다 Vivir Feliz es Importante,https://blog.naver.com/07forever10,2017-05-25
프롬퐁 현지인맛집 백종원 푸드파이터 방콕룽르엉쌀국수,https://blog.naver.com/mhjkmk?Redirect=Log&logNo=221415040600,프롬퐁 현지인맛집 백종원 푸드파이터 방콕룽르엉쌀국수 안녕하세요♡ 방콕여행기로 인사드리는... 그런분들은 프롬퐁 현지인맛집 백종원 푸드파이터 방콕룽르엉쌀국수 드시길 추천드립니다. 포스팅마친... ,더블밍스 Double_Mings,https://blog.naver.com/mhjkmk,2018-12-08
백종원 방콕 스트리트 푸드파이터 맛집:룽르엉똠얌국수 이거... ,https://blog.naver.com/jechloelee?Redirect=Log&logNo=221590216241,"나왔다던룽르엉똠얌국수집! 스트리트 푸드파이터 보고서는 방콕가서 이건 꼭 먹자고 했었는데, 우리가 처음 이틀 머문 하얏트 플레이스에서 걸어서 10분 정도 걸리는 거리에룽르엉국수가! 아무래도 첫 숙소는... ",나노드롭,https://blog.naver.com/jechloelee,2019-07-19
[방콕맛집] 스쿰빗 SOI 26 쌀국수 맛집 -룽르엉Rung... ,https://blog.naver.com/daria80?Redirect=Log&logNo=220943225521,[방콕맛집] 스쿰빗 SOI 26 쌀국수 맛집 -룽르엉Rung Reung Pork Noodle 지난 방콕여행때 스쿰빗soi24 메리어트아파트먼트에 묵으며 몇번이나 갔던 쌀국수집룽르엉 이란 곳을 소개하려합니다. 뭐 여긴 50년이상... ,Fly away,https://blog.naver.com/daria80,2017-02-24
방콕의 국수 맛집 :룽르엉(榮泰泰粉 ร้าน... ,https://blog.naver.com/sarah7908?Redirect=Log&logNo=221482547532,방콕의 국수 맛집 :룽르엉(榮泰泰粉 ร้าน รุ่งเรืองก๋วยเตี๋ยวหมู) 프롱폼역 근처에 위치한룽르엉 을 가기 위해 이른 아침부터 부지런을 떨어 봅니다. BTS에서 내리니... ,호박이 영그는 곳,https://blog.naver.com/sarah7908,2019-03-07
180911 방콕여행 6일차 :룽르엉국수 / 클랩슨 더리버... ,https://blog.naver.com/muzirang2?Redirect=Log&logNo=221396484728,맛집룽르엉국수집에 오기 위해서지! *영업시간 8:30~17:00 재료가 떨어지면 조기마감 한다고 한다 내가... 국수집중에서룽르엉국수집에 가장 높은 점수를 주고 싶다. 다 먹고 나와서 찍은룽르엉 의 외관... ,Ordinary Days,https://blog.naver.com/muzirang2,2018-11-12
방콕현지인맛집/백종원태국/스푸파태국/방콕룽르엉쌀국수,https://blog.naver.com/jini2004d?Redirect=Log&logNo=221288905702,방콕맛집/방콕로컬맛집/방콕현지인맛집/백종원태국/스푸파태국/방콕룽르엉쌀국수 프롬퐁역 근처에 있는룽르엉 이란 쌀국수집 입니다 얼마 전 백종원의 스트리트 푸드파이터 태국 편에도 나왔쥬~ 제가... ,이맛나 블로그,https://blog.naver.com/jini2004d,2018-06-02
5일차 ::: 룸피니공원. 노스이스트. 땡모반.룽르엉 국수. 모기,https://blog.naver.com/kim980124?Redirect=Log&logNo=221525609477,25밧룽르엉국수 여기도 스트리트푸드퍼이터에 나온 곳!! 똠얌 비빔국수와 일반 물국수. 토핑으로...룽르엉 국수 한그릇당 50 차는 15밧 여기도 스트리트푸드파이터에 나온 곳!! 똠얌 비빔국수와 일반 물국수.... ,맛있는 게 제일 좋아,https://blog.naver.com/kim980124,2019-04-29
[방콕맛집] 한국인이 사랑하는 국수 ' 룽르엉Rung Reung',https://blog.naver.com/pansophy?Redirect=Log&logNo=221096419044,이제는 한국인 여행자라면 모르는 분이 없는 유명 국수집이 된 ' 룽르엉Rung reung' 방콕 맛집을 소개하는 외국 책에 예전부터 빠지지않고 등장했던 수십년 역사의 맛집이기도 합니다. 두 아들이 부모님께... ,La La Land,https://blog.naver.com/pansophy,2017-09-14
"(201705 4th 방콕) 둘째날, 프롬퐁역룽르엉 쌀국수... ",https://blog.naver.com/meheej?Redirect=Log&logNo=221001869263,체크인을 마치고 간단하게 요기하러룽르엉국수를 먹으로 가기로 결정!벤자시리 공원을 지나~나오는쪽은 기와집 같아 보였고 ㅋㅋ 엠포리움을 지나 엠포리엄 백화점 라인에 있는룽르엉 국수집 고고... ,커피쟁이 일상 블로그,https://blog.naver.com/meheej,2017-05-09
"방콕 3일차( 룽르엉 국수, 핫스톤스파, 스쿰빗 도이창커피)",https://blog.naver.com/chomee1?Redirect=Log&logNo=221472588713,저녁 먹고는 할리스에 놀다가 들어와서 또 잠 ㅋㅋㅋㅋㅋ 매우 생산적이었던(?) 하루! 둘 다 여행하면 별거 안 하는 스타일이라 다행이다...... #프롬퐁역맛집 # 룽르엉 국수 #방콕쌀국수맛집 #방콕터미널21,쁜쁜이의 끄적끄적,https://blog.naver.com/chomee1,2019-02-22
"방콕 10 - 카페 Sora City, Hello strangers cafe,룽르엉 ... ",https://blog.naver.com/reddotskirt?Redirect=Log&logNo=221180287686,도착한룽르엉작년 여행부터 오고싶었는데 드디어 ! 위생에 촘 예민한 편인데 생각보다 괜찮았다... 추천 (첨가하기 x 부어버리기 o) 어쨌든 너무너무 만족스러웠던룽르엉T.T 두 번 가세요 세 번 가세요 bb,days and days,https://blog.naver.com/reddotskirt,2018-01-08
방콕 프롬퐁 국수 -룽르엉rung ruang noodle. 저렴한 로컬... ,https://blog.naver.com/bright_kwon?Redirect=Log&logNo=220848027133,"방콕 프롬퐁 국수 -룽르엉rung ruang noodle. 저렴한 로컬 국수집 프롬퐁역은 역 주위에 노점이 있다. 각종 꼬치와 닭튀김, 과일을 파는 작은 행상들. 바로 옆 골목에는룽르엉 이라는 국수집이 있다. 이제는... ",★ 이상하고 미친 나라의 앨리스 :),https://blog.naver.com/bright_kwon,2016-10-28
방콕 맛집룽르엉방콕시내중심 국수 맛집 룽루엉 Rung... ,https://blog.naver.com/fairysection?Redirect=Log&logNo=220962058269,하나인룽르엉Bangkok Rung Ruang Noolde 방콕시내중심 그것도 엠쿼티어 쇼핑몰이 자리한 BTS 프롬퐁 역에서 도보 5분 정도면 도착할 수 있어 방콕쇼핑과 맛집을 한번에 만나볼 수 있는 곳이기도 합니다룽르엉 은... ,방콕커플 Bangkokcouple,https://blog.naver.com/fairysection,2017-03-19
카오산로드 나이쏘이! 프롬퐁역룽르엉 ! 로컬 거리 음식!,https://blog.naver.com/kcherry99?Redirect=Log&logNo=221299717630,프롬퐁역룽르엉엠쿼티어 쇼핑몰로 유명한 지상철 프롬퐁역입니다. 프롬퐁역에서 내려 엠쿼티어 쇼핑몰과 반대 방향의 골목길로 300미터 정도 걸어가면룽르엉로컬 국수집이 있습니다. 마침 점심시간이라... ,노을빛 함께 손잡고,https://blog.naver.com/kcherry99,2018-06-15
태국여행 프롬퐁역 근처 손님 많은 곳룽르엉 쌀국수 (맛있지만... ,https://blog.naver.com/sunghee3702?Redirect=Log&logNo=221202818253,란룽르엉꾸웨이띠여우 무 도착한 날이 주일 새벽이어서 잠만 자고 다시 프롬퐁역 5번출구 근처에... 완전 좋다 ㅠㅠㅠ 예배전에 시간이 좀 남아서 블로그를 검색해보니 프롬퐁역 근처에룽르엉쌀국수 후기도... ,Nation changer,https://blog.naver.com/sunghee3702,2018-02-06
2016.02.09 방콕 Ceresia 세레시아 커피/룽르엉/ 프롬퐁... ,https://blog.naver.com/petallkj?Redirect=Log&logNo=220637597100,마시고 룽르엉 에서 점심을 먹은후 쇼핑을 버닝하는 코스. 호텔에서 프롬퐁이 멀지않아 슬슬... 맛있는 아이스 아메리카노를 한잔 사서룽르엉 으로.커피컵이 생각보다 작아서 아쉬웠다.큰걸로 사마실걸.... ,오늘도 너의 인생,https://blog.naver.com/petallkj,2016-02-25
태국 방콕 자유여행 (9) 방콕 프롬퐁역 맛집룽르엉 에서 맛본... ,https://blog.naver.com/dktladl1?Redirect=Log&logNo=220703689425,오늘 소개해 드릴 곳은 방콕 프롬퐁역 쏘이 26에 위치하고 있는룽르엉국수집 입니다. 이곳은 첫... 먹으러룽르엉 에 갔는데 역시나 문이 닫혀있었어요. 그래서 초반에는 먹지 못하고. 방콕 마지막... ,아심이의 여행일기,https://blog.naver.com/dktladl1,2016-05-08
[2018방콕] 5일차 /룽르엉 국수 / 차트라뮤 밀크티 / 짜뚜짝시장... ,https://blog.naver.com/mpongdang?Redirect=Log&logNo=221315129213,"교통비 140바트 (약 4,900원) 우선 아점으로 # 룽르엉 국수 를 먹으러 갔다 검색해보니 양이 적고 똠양도 괜찮다고해서 못먹으면 버릴생각으로 그냥, 비빔, 똠양으로 시킴 콜라도 하나 시켰다룽르엉 국수... ",", 데일리노트",https://blog.naver.com/mpongdang,2018-07-09
태국 방콕 자유여행(42) 세가지룽르엉( Rung Ruang... ,https://blog.naver.com/dktladl1?Redirect=Log&logNo=220801128227,"바로 프롬퐁역 쏘이 26 ( 더블트리 힐튼 호텔 근처, arize 호텔 근처에 있습니다 )에 있는룽르엉 ... ถนนสุขุมวิท룽르엉 은 오전 8시 30분부터 오후 5시 ( 그러나 오후 4시전 방문을 권합니다.... ",아심이의 여행일기,https://blog.naver.com/dktladl1,2016-09-09
"방콕 4박 5일 여행 3일차 -룽르엉국수, 짜뚜짝시장, 꽝씨푸드... ",https://blog.naver.com/notabigthing?Redirect=Log&logNo=221430079090,"방콕 4박 5일 자유여행 BANGKOK DAY 3룽르엉국수, 짜뚜짝시장, 꽝씨푸드, 파톰 오가닝 리빙, 더커먼스, 루프탑바 바닐라 스카이룽르엉국수 가성비 좋은 현지 국수 맛집 백종원이 다녀갔다며 한국인들에게... ",심미와 심리,https://blog.naver.com/notabigthing,2018-12-29
"통러, 프롬퐁 맛집_돈크루앙, 호이톳차우래,룽르엉 국수",https://blog.naver.com/jyhcool1004?Redirect=Log&logNo=221158862257, 룽르엉 (Rung Reung noodle) 이른시간 문을 열고 일찍 닫는다고 해서 점심시간 조금 지나 찾아갔다. 유명한 맛집이라 물론 관광객들이 많긴 했지만 현지인들도 많이 와서 음식을 먹고 포장도 해간다.... ,아브라카다브라,https://blog.naver.com/jyhcool1004,2017-12-09
"방콕맛집, 방콕 국수맛집- Bangkok Rung Ruang Noolde /룽르엉",https://blog.naver.com/cha9212?Redirect=Log&logNo=221186894225,"Rung Ruang Noolde룽르엉방콕 똠얌국수, 어묵국수, 고기 국수로 유명한 곳.룽르엉일단 김새게 결론부터. 일부러 찾아갈 필요 없는 곳... ... 내 입 맛엔... 국수 한 그릇 50바트. 지상철 한 번 타는 값.. 좀 큰건... ",숨은 그림 찾기,https://blog.naver.com/cha9212,2018-01-17
[태국 여행]방콕(Bangkok)...2일차룽르엉 국수집... ,https://blog.naver.com/rose0626?Redirect=Log&logNo=221600550892,프롬퐁역룽르엉국수집 - 백종원 국수집으로 유명 2. 방콕문화예술센터 - 크고 작은 전시회들이... 프롬퐁역룽르엉국수집 - 백종원 국수집으로 유명 방콕에서 제일먼저 맛깔난 국수집을... ,마음이 걷고 발이 쓴다.,https://blog.naver.com/rose0626,2019-08-04
 룽르엉국수 / 호이텃차우래 팟타이 / 맥도날드 콘파이,https://blog.naver.com/kimhjya?Redirect=Log&logNo=221374833951,거림ㅋㅋㅋㅋㅋ룽르엉국수 3일간 머물렀던 원데이 호스텔 근처엔 맛있는 국수집이 있어서 겸사겸사 참 좋았다. 구글맵에 Rung Reung Pork Noodle 이라고 치면 나오는 바로 이집.룽르엉국수집. 관광객용 맛집은... ,구구네,https://blog.naver.com/kimhjya,2018-10-10
retreat 크레시아 ceresia룽르엉Rung ruang noodles 泰榮米粉,https://blog.naver.com/ma_pick?Redirect=Log&logNo=221122448026,쌀국수의룽르엉방콕하면 잊지말아야할 마사지 시간이 생길 때 수시로 마사지를 받으려고 했다. 내가... 친구들과 사람들이 극찬한룽르엉 ... 그리고 예롱도 극찬해서 두그릇먹음.. ㅋㅋㅋㅋㅋㅋㅋㅋㅋㅋ... ,J의 인생열차,https://blog.naver.com/ma_pick,2017-10-22
스쿰빗 소이26 고기국수 -룽르엉 ,https://blog.naver.com/smy1002?Redirect=Log&logNo=220502555309, 룽르엉국수집을 간략히 소개해보겠다. 위치는 스쿰빗 소이 26으로 더블트리 바이 힐튼 호텔약간 못가서 코너에 있다. 코너에서 바라본 식당 장사가 잘되어서 식당이 한군데 더있다고는 하나 본인은 찾기 쉬운... ,바다를 사랑한 남자,https://blog.naver.com/smy1002,2015-10-07
"나의 두번째 방콕 4 (수코타이호텔, 룽르엉 ,오아시스스파)",https://blog.naver.com/shining0707?Redirect=Log&logNo=221345256098,집룽르엉가는 즁! 찾아보니 3년 전 내가 먹었던 쌀국수 나이쏘이와 양대산맥을 이루는 곳 이였음 ㅋㅋㅋㅋㅋㅋㅋ 난 나이쏘이만 먹어봤고 도사님은룽르엉 만 먹어봄 나이쏘이보다룽르엉메뉴가 더... ,안아줘요,https://blog.naver.com/shining0707,2018-08-24
아이와 함께 방콕 _ 스쿰빗 쌀국수 맛집룽르엉Rung... ,https://blog.naver.com/lucy830811?Redirect=Log&logNo=220828396707,펩시 천막이 바로룽르엉국수집 맞아요. 아기가 있어서 뒤쪽 방으로 안내받았어요. 그냥 허름한 시장 국수집 느낌. 문 닫는 날이 적혀 있네요. 유모차 옆에 세워두고 먹었어요. 아이와 함께 하기에 좋은 장소는... ,Lucy In The Sky,https://blog.naver.com/lucy830811,2016-10-05
[2016 엄마와 방콕] 프롬퐁역 쌀국수 맛집!!!룽르엉 ,https://blog.naver.com/ringom0201?Redirect=Log&logNo=220839188596," 룽르엉언니가 3달간 태국에서 살았었을때,방콕에서는 여기 프롬퐁역 근처에서 묵었었다고 ~ 맨날 여기 길을 다니다가 현지사람들이 맨날 바글바글해서 들어가서 먹어보고 너무 맛있어서거의 매일 먹었다고... ",하링의 부루마블놀이♬,https://blog.naver.com/ringom0201,2016-10-18
받고 백종원 맛집룽르엉국수까지 무료 픽업서비스까지?,https://blog.naver.com/lollooll?Redirect=Log&logNo=221457021135,"아난타라 리버사이드에서 조식, 급 알바 후 아난타라 6000바트 바우처도 받고 백종원 맛집룽르엉 ... 급룽르엉 국수로 변경했어요. 물론 젤 중요한 6000바트 바우처도 챙겼구요. 편하게 호텔에서 차로 20분정도... ",fun fun한 삶.,https://blog.naver.com/lollooll,2019-02-02
"후아힌 가는 방법:택시, 벨트래블,룽르엉코치 등 대중교통",https://blog.naver.com/uni7741?Redirect=Log&logNo=221378051862,"｜ 후아힌캡 살펴보기 (click) 벨트래블,룽르엉이용해서 후아힌으로 이동 택시나 픽업 차량에 비해 가장 저렴하게 후아힌으로 이동을 할수가 있는 대중 교통이죠.룽르엉코치 버스의 경우 7번 게이트쪽으로... ",둔켈의 여행 그리고 이야기,https://blog.naver.com/uni7741,2018-10-17
