title,link,description,bloggername,bloggerlink,postdate
신당동 떡볶이타운 즉석떡볶이마복림떡볶이 ,https://blog.naver.com/nanacook?Redirect=Log&logNo=221706186419,신당동 떡볶이타운 즉석떡볶이마복림떡볶이국민학교 다닌 세대라..그림일기를 매번 써서 검사 받았던 추억이 있는데요. 그림일기에 다른 애들보다 뭘 먹으면 먹은걸 그렇게 쓰고 그렸다고 엄마가 한번씩... ,Nana's kitchen,https://blog.naver.com/nanacook,2019-11-13
신당동 떡볶이 맛집 ::마복림떡볶이24시,https://blog.naver.com/cali608?Redirect=Log&logNo=222035803830,"참고로 마복림 할머니, 막내아들네 다 맛 똑같고 같은집이에요!! # 마복림떡볶이#신당동떡볶이 #신당동맛집 #신당동떡볶이맛집 #즉석떡볶이 #신당동즉석떡볶이",캘리푸딩 Foodie ♥,https://blog.naver.com/cali608,2020-07-20
[ 신당동 떡볶이 맛집 ]마복림떡볶이 ,https://blog.naver.com/anzeeee?Redirect=Log&logNo=221864341958,"난리나요 (진지) 오늘도 먹부림 성ㅋ공ㅋ 그럼 다음 포스팅에서 만나요, 안넝 :0 # 마복림떡볶이#신당동 마복림떡볶이# 마복림떡볶이 신당동 #신당동떡볶이 #신당동즉석떡볶이 #떡볶이맛집 #신당동떡볶이맛집",재재블로그,https://blog.naver.com/anzeeee,2020-03-20
신당동마복림떡볶이택배 / 포장 :: 즉석떡볶이 원조. 가격.... ,https://blog.naver.com/kissing_me?Redirect=Log&logNo=222451999827,즉석떡볶이계를 주름잡은 # 마복림떡볶이얼마전에는 나혼자산다 경수진씨 때문에 또 잇슈가 되었던ㅋ... 약간 달달하면서 맵지 않은 마복림고추장 이 진짜 찐 이었는데! 시원한 맥주 한잔을 안할수가 없는ㅠ... ,맛있는 여행 그리고 시간,https://blog.naver.com/kissing_me,2021-07-31
"중구 맛집]마복림 떡볶이 , 원조 신당동 떡볶이",https://blog.naver.com/yrn564?Redirect=Log&logNo=221820008261,중구 즉석 떡볶이마복림 떡볶이일이 끝나고 엄마가 떡볶이를 먹고 싶다고 해서 신당동에 다녀왔다. 나는 딱히 즉석 떡볶이를 찾아 먹진 않지만 엄마가 너무 좋아하셔서 주기적으로 먹게 된다. 언제부터... ,"나를 채우는, 일상의 기록",https://blog.naver.com/yrn564,2020-02-22
[신당동 떡볶이 맛집]유퀴즈... 신당동 찐맛집 “ 마복림떡볶이 ”,https://blog.naver.com/blair9330?Redirect=Log&logNo=222126240794,취향차이일 수 있으니..! 그냥 내 취향은 저격하지 못한걸루..! #신당동떡볶이#신당동떡볶이타운#신당동떡볶이골목# 마복림떡볶이 #신당동 마복림떡볶이 #즉석떡볶이#신당동떡볶이맛집,Maison de 'B,https://blog.naver.com/blair9330,2020-10-25
신당동떡볶이' 마복림할머니떡볶이 '를 집에서 해먹기☺,https://blog.naver.com/twosuns89?Redirect=Log&logNo=222530561751,안녕하세욧☆ 찌니찌니에욧~~~~~ 어제는 퇴근하자마자 집에서 친구가 서프라이즈 선물해준 # 마복림떡볶이#마복림할머니떡볶이 해먹엇어요ㅎㅎㅎㅎㅎ #신당동 #즉석떡볶이 집으로 이미 유명하더라그욤?... ,♥힐링을 부르는 녀석들♥,https://blog.naver.com/twosuns89,2021-10-08
신당동 떡볶이 타운 #마복림떡볶이탐방,https://blog.naver.com/jen_jen89?Redirect=Log&logNo=221880729330,심지어 가장 유명한 마복림 할머니집은 이번에 처음 가본 것이다!!!!!! 퇴근 후 신당역에서 남표니를 만나 같이 걸어갔다. 신당역 7번출구에서 한 5분? 거리에 있뜸 그리고마복림 떡볶이 는 떡볶이 골목 초입에... ,모든 순간을 소중히 ❤️,https://blog.naver.com/jen_jen89,2020-03-30
신당동떡볶이타운 ::마복림 떡볶이(즉석떡볶이맛집),https://blog.naver.com/kwonek1990?Redirect=Log&logNo=222002449320,떡볶이성지 신당동 그중마복림떡볶이 가 젤 유명하다고 들었따. 근데 마복림아들이 하는곳도 있고... 뭐 다 똑같겠지만 떡볶이로 돈 마니 벌어서 조케따. 뭐 오랜전통이 있는 신당동떡볶이 집에서 메스컴정도는... ,'美'완성블로그,https://blog.naver.com/kwonek1990,2020-06-16
[주말/일상] 신당동마복림 할머니 즉석 떡볶이 ,https://blog.naver.com/jiyaun1009?Redirect=Log&logNo=221794416703,"예전에 유퀴즈온더블럭에서 신당동 즉떡 먹는거 보고 너무 먹고싶었는데, 이렇게 다녀왔습니다 ㅎㅎ # 마복림떡볶이#신당동떡볶이타운 #즉석떡볶이 정말 오랜만에 갔는데 와 여기 주차장 잘못들어가서 다른곳... ",편식 여왕 홍수니,https://blog.naver.com/jiyaun1009,2020-02-03
[신당]마복림 떡볶이- 오랜만에 신당동 떡볶이 타운,https://blog.naver.com/we_drink?Redirect=Log&logNo=222521068678,"그냥 제일 원조집이라는마복림 떡볶이 에 갔습니다. 워낙 유명한 곳이고, 또 마복림 할머니 생전에 있던 곳이기도 해서 그런지 떡볶이 골목의 원조집이라고 불리는 곳입니다. (말했듯, 사실 먹어보면 맛은 다... ",매지의 주당법석,https://blog.naver.com/we_drink,2021-09-30
신당동마복림 떡볶이엽떡파도 즉떡 좋아!,https://blog.naver.com/goldhe2?Redirect=Log&logNo=222526647647,"신당동마복림 떡볶이#신당동떡볶이# 마복림떡볶이 #신당동맛집 유명한 곳은 유명한 곳인가 보다. 사회적 거리두기를 한 테이블 배치임에도 손님이 가득하다. 2인 15,000원 쿨피스 2,000원 볶음밥 3,000원 매운... ",골드히투어,https://blog.naver.com/goldhe2,2021-10-04
중구 신당동 맛집 신당동떡볶이타운마복림떡볶이 ,https://blog.naver.com/profairyy?Redirect=Log&logNo=222303915770,"떡볶이타운 들어서자마자마복림떡볶이라는곳이 한눈에 들어왔어요. 그래서 차를 주차하고 바로마복림떡볶이 로 들어갔구요. 가격은 2인기준 13,000원이구요. 포장이 많이 나가시나 보더라구요??... ",도시가스시공전문,https://blog.naver.com/profairyy,2021-04-09
신당동떡볶이맛집 )마복림 할머니 막내아들네,https://blog.naver.com/muivien_?Redirect=Log&logNo=222517558280,마복림할머니 막내아들네 신당동 떡볶이 타운 신당동 떡볶이의 원조마복림 떡볶이2호점뻘 마복림 할머니 막내아들이 차린 신당동떡볶이집 ‘ 마복림할머니 막내아들네 ‘ 90년대 분위기 그대로... ,If you wanna go .,https://blog.naver.com/muivien_,2021-09-26
신당동 떡볶이 원조 맛집 ' 마복림 떡볶이 ',https://blog.naver.com/alswl5728?Redirect=Log&logNo=222537740496,떡볶이 좀 먹었으면 즉떡은 무적권 볶음밥 필수 K-디저트 신당동마복림 떡볶이신당동마복림 떡볶이남은 떡볶이는 덜어주시고 볶음밥은 셀프! 짚신 알바 짬으로 후드리찹찹 신당동마복림 떡볶이으음 존맛..... ,12:17,https://blog.naver.com/alswl5728,2021-10-15
신당동 원조 떡볶이집/ 마복림 떡볶이 ,https://blog.naver.com/kguswl7375?Redirect=Log&logNo=222525484499,"가끔씩 옛날 즉석떡볶이가 먹고싶더라고요 그 중 유명하고 원조 떡볶이집인마복림 떡볶이에 다녀왔어요 입구부터 반겨준 신당동 떡볶이 타운 간판 매장/메뉴 운영시간 평일 9:00-24:00 휴무 매월 둘째,넷째... ",HYUNJIZZU,https://blog.naver.com/kguswl7375,2021-10-03
신당역 · 신당동 떡볶이 타운 /마복림 떡볶이 ,https://blog.naver.com/gptjd1212?Redirect=Log&logNo=222496074476,마복림할머니 # 마복림떡볶이 리뷰 #마복림할머니떡볶이맛 #마복림할머니주말웨이팅 #마복림할머니본점리뷰 #떡볶이오리지널 #자극적이지않은떡볶이 #떡볶이투어 #서울떡볶이투어 #서울떡볶이원조... ,Jo Star's Blog,https://blog.naver.com/gptjd1212,2021-10-04
11-21.10.17 : 광교 아이러브퍼피/집들이생파/ 마복림떡볶이 ,https://blog.naver.com/su_meee_?Redirect=Log&logNo=222540097358,집들이 선물 총총 ==33 또정언니 집들이 파티 했어여 허니콤보 + 태리떡볶이 냠냠 같은멤 요무니는... 검은 색으로 염색 했어요 #신당동맛집 # 마복림떡볶이ㅎ ㅏ 진짜 9/1에 먹고 첨 먹는마복림떡볶이3주 내내... ,숨이의 숨막히는 블로그,https://blog.naver.com/su_meee_,2021-10-18
신당동떡볶이 타운마복림할머니떡볶이포장,https://blog.naver.com/miin2777?Redirect=Log&logNo=222492716745,요즘 스타일이 아닌 전통의맛을 고집하는마복림할머니떡볶이 집 ~수많은 사람들에게 음식뿐만 아니라 추억도 함께 파셨을 그 세월속에서 제가 감히 맛평가 하기가 죄송스럽네요!! 전 기회가 되면 또 갑니다... ,f l e u r - b l o g,https://blog.naver.com/miin2777,2021-09-02
"신당동 떡볶이, 신당동마복림떡볶이 ",https://blog.naver.com/do5381?Redirect=Log&logNo=222080224081,"신당동마복림떡볶이즉석떡볶이 3인세트 (16,000원) 메뉴가 즉석떡볶이 하나밖에 없어서 고민도 안하고 바로 결정! 사리가 쫄면, 라면 둘다 들어가서 너무 맘에 들어요! 떡도 좋지만 사리먹는 맛으로... ",밍키의 동대문 신당동이야기,https://blog.naver.com/do5381,2020-09-04
[ 신당동마복림 떡볶이] 즉석 떡볶이 원조 메뉴 가격,https://blog.naver.com/yongki77777?Redirect=Log&logNo=222475238746,신당동 떡볶이 안내 글 사진 참조 신당동 떡볶이 거리 사진 참조마복림 떡볶이전화 : 02-2232-8930 주소 : 서울 중구 다산로 35길 5 위치 : 지하철 2호선 6호선 신당역 8번 출구에서 233미터 영업시간 : 평일 오전... ,노량진 맛집,https://blog.naver.com/yongki77777,2021-08-19
"[신당]마복림떡볶이 , 신당동 즉석떡볶이",https://blog.naver.com/kolae666?Redirect=Log&logNo=221832955616,"[신당]마복림떡볶이 , 신당동 즉석떡볶이 오랜만에 떡볶이를 먹었습니다. 아는동생님 창업준비로 인하여 황학동으로 집기 설비 구경갔다가 간 김에 식사하러 신당동으로. 동네에 먹거리를 잘 몰라서 그냥... ",제이슨님의 세상유랑기,https://blog.naver.com/kolae666,2020-03-02
[신당]마복림떡볶이신당동떡볶이하면 바로 여기,https://blog.naver.com/xhzjeoqhddl?Redirect=Log&logNo=222521837733,신당동떡볶이타운 절대강자마복림떡볶이후기 개인적으로 신당동떡볶이 말만 들어봤지 직접 온 건 처음입니다 ㅋㅋㅋㅋㅋ 캬 날씨좋다 소풍 온 기분이네요^^ 눈누~~~ 떡볶이타운이라고 딱 보여서 찾기 어렵지... ,휭구의 만물리뷰,https://blog.naver.com/xhzjeoqhddl,2021-09-30
1911_ '서울 중구 신당동' 떡볶이 맛집 [ 마복림떡볶이 ],https://blog.naver.com/queenyje?Redirect=Log&logNo=221705974892,꼭 마복림을 갑니당 신당동떡볶이 어딜가나 맛이 똑같그든용 그래서 그냥 원조집갑니당... 아이러브떡볶이는 특이하게 디제이부스가 있습니당 그게마복림떡볶이 랑 다른점이예용 여기는 24시간영업이래용... ,램프의 요정,https://blog.naver.com/queenyje,2019-11-12
신당동떡볶이 맛집:)엄마의 최애 떡볶이마복림떡볶이 (발렛... ,https://blog.naver.com/hahhoe?Redirect=Log&logNo=222534672819,할수없는 볶음밥으로 마무리했습니당 ㅎㅎ 다들 추억의맛을 잊지못해 부모님세대가 많이 방문하시더라고요. 자극적이지 않은 옛날즉석떡볶이를 즐기고 싶으신분들은 신당동떡볶이마복림떡볶이추천드려요~,연유의 하루,https://blog.naver.com/hahhoe,2021-10-12
신당동 떡볶이 타운 맛집 :마복림 떡볶이 ,https://blog.naver.com/sorkdpej?Redirect=Log&logNo=221746830179,이번엔 # 마복림떡볶이에서 먹어보기로~~ 떡볶이 타운 입구에서 바로 첫 번째 가게다. 맛있는 녀석들이랑 유퀴즈도 촬영했었는지 입간판이 있었다. 마복림 할머니 떡볶이 메뉴 들어가니 가게에 손님들이 꽤나... ,안녕하신가요 :),https://blog.naver.com/sorkdpej,2019-12-23
"[신당동 맛집, 약수역 이자카야]마복림 떡볶이약수의 밤",https://blog.naver.com/hidelove81?Redirect=Log&logNo=222365354835,Previous image Next image마복림 떡볶이2인 맛없진 않치만 특별하지 않아서 별은 세개만 ㅋㅋ 요즘 떡볶이가 맛있는 집이 너무 많음.. 오뎅의 퀄리티가 즉석 떡볶이의 맛을 좌우 한다고 생각하는데... 오뎅이 너무... ,HungryAlice's Merry Go Round,https://blog.naver.com/hidelove81,2021-05-25
"(신당동) 마복림 떡볶이- 어릴 때 먹던 그 맛, 즉석 떡볶이.... ",https://blog.naver.com/suziesuzie?Redirect=Log&logNo=222468017225,"신당동떡볶이거리에서 가장 많이 보이는 이름,마복림 . 보통 세트로 시키는데 라면 대신 쫄면을 많이 먹고 싶어서 그냥 따로 따로 시켰어요. 오랜만이야, 스댕 그릇과 주전자. 뭔가 안정감있는 부르스타. 얇은... ",수지의 일상의 발견,https://blog.naver.com/suziesuzie,2021-08-13
"신당동 떡볶이 :: 원조 즉석떡볶이 ' 마복림 떡볶이 ' / 주차, 주말... ",https://blog.naver.com/gmldi216?Redirect=Log&logNo=222542297393,신당동떡볶이 신당맛집마복림떡볶이리뷰입니다 신당동떡볶이 신당맛집마복림떡볶이신당동은 즉석떡볶이 맛집이 모여있는 신당동 떡볶이 타운이 유명하죠! 신당동떡볶이 신당맛집마복림떡볶이골목에... ,포 송 포 송,https://blog.naver.com/gmldi216,2021-10-20
 마복림 떡볶이 집,https://blog.naver.com/arjung1110?Redirect=Log&logNo=222514379199,제가 제일 좋아하는 음식1위인떡볶이먹으러 신당동마복림할머니떡볶이 집으로 갔네요 처음 간지는 몇십년 됬고 마지막으로 갔던게 1년은 넘은듯하구요 요즘은 배달이나 동네에 맛있는떡볶이 도 많고... ,퀘렌시아,https://blog.naver.com/arjung1110,2021-09-23
"신당동마복림할무니떡볶이 , 묘하게 남다른 원조 즉떡",https://blog.naver.com/audwls94?Redirect=Log&logNo=222536190371,떡볶이 러버가 신당동마복림 떡볶이 를 안먹어볼 순 없기에 도전했어요 주말 저녁 줄이 꽤 길었습니다! 마복림 원조 1호점으로 갔구요 내부는 매우 정신이 없어서 아쉬웠어요 떡볶이 마을 방문 기념사진 즉떡... ,"하루를 칠하는 곳,",https://blog.naver.com/audwls94,2021-10-13
오랜만에 간 신당동떡볶이마복림할머니집!,https://blog.naver.com/insosa?Redirect=Log&logNo=222420826316,예전에는 신당동하면떡볶이이미지가 상당히 강했는데요 사실 요즘은 이런 부분이 좀 많이 줄었지만 그래도 신당동에 가니 여러 유명한떡볶이집이 있더라고요 #신당동 떡볶이#신당동 마복림 할머니 그중에서... ,이것 저것 이야기,https://blog.naver.com/insosa,2021-07-05
"신당동떡볶이 타운 -마복림할머니, 우정, 약속, 들국화떡볶이 ",https://blog.naver.com/empl?Redirect=Log&logNo=222487047917,"신당동 떡볶이타운 -마복림 떡볶이우정 떡볶이 (새우, 해물, 콩나물) 약속 떡볶이 (매운 닭발) 떡볶이 전문점 들국화 (즉석짜장떡볶이통팥빙수) 신당동 떡볶이타운 들국화떡볶이 서울특별시... ",지금지르러갑니다,https://blog.naver.com/empl,2021-08-28
[신당동 떡볶이 타운]마복림 떡볶이부모님이랑 다녀왔어요.,https://blog.naver.com/lizhi95?Redirect=Log&logNo=221838759923,"떡볶이는 양이 너무 많아서 조금 남겼지만, 볶음밥은 빼놓을 수 없어서 하나만 볶았습니다 ^^.. #신당동떡볶이타운 # 마복림떡볶이맛있고 배부르게 먹고 왔습니다~!",예동그리 블로그,https://blog.naver.com/lizhi95,2020-03-05
마늘노포 212 - 신당동맛집떡볶이 맛집 -마복림 할머니 떡볶이 ,https://blog.daum.net/djmanul/5857915,"떡볶이 , 떡볶이맛집 ,마복림떡볶이, 신당동 , 신당동떡볶이 , 신당동맛집 신당동맛집, 떡볶이맛집 마복림할머니떡볶이 혹은마복림 떡볶이 는 1953년 전쟁 직후 마복림 대표가 중국집 개업 행사 때 공짜... ",MERRY CHRISTMAS!,https://blog.daum.net/djmanul,2021-08-21
맛있는 녀석들 신당동 떡볶이마복림 떡볶이 ,https://blog.naver.com/78stella?Redirect=Log&logNo=221238468225,"맛있는 녀석들 신당동 떡볶이마복림 떡볶이출발합니다,,,부릉부릉!!! ▼ Since 1953, 말이 필요없는 대단한 원조!!! 오래전 마복림 할머니께서 떡볶이 비법은 며느리도 모른다고 말씀하신 CF가 히트를... ",꿈꾸는나무와 땡구의 맛있는 하루,https://blog.naver.com/78stella,2018-03-27
신당동떡볶이골목 :) 원조마복림떡볶이 ,https://blog.naver.com/ss_show?Redirect=Log&logNo=220836901107,애정하는 마복림할머니떡볶이로 고고씽. 초등학교때 엄마땜에 알게된 신당동떡볶이골목의 원조.마복림떡볶이 지만 방문은 세번째예요.ㅋㅋㅋ 아이러브보다 사람이 많더라고용^^ 저희는 신당동 원조... ,까칠한그녀의다이어리,https://blog.naver.com/ss_show,2016-10-15
신당동떡볶이타운 20년만에 찾아본마복림 할머니,https://blog.naver.com/lightsout?Redirect=Log&logNo=221167820100,오늘 포스팅 하는 신당동 떡볶이 타운에 자리한 마복림 할머니 떡볶이도 그 중 하나인데 사실 뭐... 그나마도마복림 떡볶이 는 찾지 않은지 대략 20년은 넘은듯 하다. 연전에 그 앞에 DJ가 있는 떡볶이 집에서... ,UltraOrange's Light Illusion,https://blog.naver.com/lightsout,2017-12-21
신당동 떡볶이 타운 /마복림떡볶이 ,https://blog.naver.com/phjsunflower?Redirect=Log&logNo=221558638646,"신당동 떡볶이 타운 /마복림떡볶이떡볶이는 즐겨먹는 간식중에 하나로써, 누구나 손쉽게... 떡볶이는 궁중음식인 떡볶이에서 왔다고 하지만 거기서 생각해낸 음식은 아니다. 떡볶이의 창시자인 마복림할머니.... ",꽃씨의 맛집 이야기♬,https://blog.naver.com/phjsunflower,2019-08-27
신당동떡볶이타운마복림할머니떡볶이 ,https://blog.naver.com/umstar81?Redirect=Log&logNo=221027222476,이날은 오랫만에 마복림 할머니 떡볶이가 가보고 싶더라. Since 1953마복림 떡볶이 는 아마 신당동에서 제일 오래되고 제일 유명한 떡볶이집일듯 한데... 그래서 그런지 매스컴에 워낙에 많이 소개된 집이기도... ,움훼훼의 얼씨구 절씨구 밥타령!,https://blog.naver.com/umstar81,2017-06-13
신당동떡볶이마복림할머니 막내 아들네 후기,https://blog.naver.com/sylph303?Redirect=Log&logNo=221040649528,신당동 떡볶이 마복림 할머니 막내 아들네 후기 뮤지컬을 보고 나면 항상 가는 신당동 떡볶이 타운... 신랑이 막내아들네로 와서 그렇다면서 ㅋㅋ 다음에는마복림 떡볶이 로 가자고 하더라구요. ㅎㅎ 거기도... ,당신과 내가 사랑한 시간 ♡,https://blog.naver.com/sylph303,2017-06-30
신당동 떡볶이마복림 떡볶이서울 즉석 떡볶이,https://blog.naver.com/skrwlzzim?Redirect=Log&logNo=221597165065,여기 신당동 떡볶이 골목 의 떡볶이 다 맛있다고 해요 닭발도 많이 드시더라구요마복림 떡볶이 집에서는 닭발은 안팔아요 #서울맛집 #신당동맛집 #떡볶이맛집 #마복림 # 마복림떡볶이#마복림떡복이 #즉석떡볶이,이상한 나라의 엠제이,https://blog.naver.com/skrwlzzim,2019-07-27
[신당동 떡볶이 ]마복림 할머니막내아들네 다녀왔어요~,https://blog.naver.com/jkh4524?Redirect=Log&logNo=220817990682,같더라구요~신당동떡볶이타운입구에마복림떡볶이마로 옆에 위치하구 있더라구요~ 저릐가족이 선택한 마복림할머니막내아들네입니다^^ 떡볶이집이름이 무지 긴~것 같줘 ㅎㅎ 주차할것을 찾구있었는데... ,생선은싫어의 세상사는이야기,https://blog.naver.com/jkh4524,2016-09-22
신당동마복림 떡볶이포장해다 먹었어요,https://blog.naver.com/nabbung1?Redirect=Log&logNo=220569821020,그리고신당동마복림 떡볶이 로 간만에 회사지인분들과 맛있는 시간을 보냈답니다~^^ 퇴근하고 배고파서 엄청 급하게 먹다가 찍음 ㅋㅋㅋ 신당동 마복림 할머니 떡볶이 포장이라니 너무멋짐~^^ 다른 먹거리가... ,나뿡이 놀이터,https://blog.naver.com/nabbung1,2015-12-16
신당동 떡볶이타운 맛집 :마복림떡볶이 ,https://blog.naver.com/boothebeige?Redirect=Log&logNo=221603885908,신당동 떡볶이타운에서 가장 유명한 분. 마복림 할머니. 오빠가 여기가 맛집이라고 찾아와서... 굳이마복림떡볶이아니더라도 맛은 다들 비슷비슷할것 같긴 하다. 다음에 오빠랑 근처 아이러브 신당동... ,BOOLOG,https://blog.naver.com/boothebeige,2019-08-09
[중구 신당동]추억의마복림 떡볶이 ,https://blog.naver.com/clay0707?Redirect=Log&logNo=130092332514,오랜 세월 함께 해왔고 앞으로도 영원히 베.프로 남을 그들의 우정이 부럽군요~ㅎㅎ마복림 표 즉석떡볶이항공샷! 연장 들고 덤비는 1人... 이 분도 만만치 않은 공격수...ㅎㅎㅎ 보글보글~~~~ 쪼아가 젤루... ,"""Every fine day!""",https://blog.naver.com/clay0707,2010-08-19
