title,link,description,bloggername,bloggerlink,postdate
신당동마복림 떡볶이feat.경수진,https://blog.naver.com/nowwegom?Redirect=Log&logNo=222419009652,맛의 즉떡이지만 옛 추억을 떠올리고 싶을 때 한 번쯤 방문해도 좋을 신당동마복림 떡볶이후기였다. 개인적으로는 코끼리분식이나 또보겠지가 더 내 취향이었다. #신당동떡볶이 # 마복림떡볶이#경수진떡볶이,먹기 위해 사는 위장 환자,https://blog.naver.com/nowwegom,2021-07-03
신당동 떡볶이 -마복림 떡볶이맛 본 솔직후기,https://blog.naver.com/aaaa0408?Redirect=Log&logNo=222473476295,"가장 유명한 두 곳은마복림 떡볶이/ 아이러브 즉석 떡볶이 이렇게 두 곳이었습니다. 그 중, 저희가 선택한 곳은마복림 떡볶이 !!!마복림 떡볶이 와 마복림할머니 막내아들네가 있는데 저희는 그냥 마복림... ","하늘연달, 나흘",https://blog.naver.com/aaaa0408,2021-08-19
[즉떡 맛집] 신당동마복림 떡볶이~ 야끼만두 추가 필수,https://blog.naver.com/ahnhaesom?Redirect=Log&logNo=222528543526,신당동 마복림 할머니 떡볶이를 가보았어요 #메뉴 입니다 저희는 #2인세트를 선택했고 훈제계란 사리를... 주시는데요마복림 떡볶이 는 드셔보시면 단맛이 거의 없는 장 떡볶이 느낌이라 이 단무지랑 궁합이... ,리뷰로그,https://blog.naver.com/ahnhaesom,2021-10-06
맛집] 여기가 신당동 즉석떡볶이 근본이라면서요?마복림 떡볶이 ,https://blog.naver.com/wizard_0?Redirect=Log&logNo=222536046163,즉석 떡볶이가 생각난다. 차를 타고 가서 그런가 생각보다 이 곳의 규모가 막 크진 않다. 마복림... 다 세팅되어 있기 때문에 가서 몇인분 주세요 하면 바로 딱 주심 # 마복림떡볶이#신당동즉석떡볶이 #즉석떡볶이... ,봄밤,https://blog.naver.com/wizard_0,2021-10-13
신당동 즉석떡볶이마복림할머니 가게 문 닫아 아이러브에서... ,https://blog.naver.com/cjjeon?Redirect=Log&logNo=222423749638,마복림 할머니 가게 떡볶이보다는 약간 더 매콤한 거 같아요.마복림 떡볶이 와 양념 맛도 거의 비슷해 만족스럽게 먹었답니다.마복림 떡볶이 는 맛있기도 하지만 저에겐 정말 추억이 많은 떡볶이집이라 다음에... ,조이풀 데이즈,https://blog.naver.com/cjjeon,2021-07-08
신당동 떡볶이타운 푸짐한 즉석떡볶이가 맛있는마복림떡볶이 ,https://blog.naver.com/dltjfflekd?Redirect=Log&logNo=222508347037,신당동 떡볶이타운마복림떡볶이주소. 서울 중구 다산로35길 5 전화. 02-2232-8930 영업시간. 매일 오전9시부터 밤12시까지 (주말이나 공휴일은 새벽1시까지) 현재 사회적거리두기로 오후10시까지 영업 매월 둘째... ,설이의 일상 Story,https://blog.naver.com/dltjfflekd,2021-09-17
신당동마복림즉석 떡볶이추억 때문에 가지 특별한 맛은,https://blog.naver.com/durlsdjel12?Redirect=Log&logNo=222378929722,신당동 떡볶이 타운으로 가자! 해서 추억삼아 갔더랬지 맨처음 입맛을 들인게 바로 여기 “신당동마복림 떡볶이 ” 비법을 아무도 몰랐지만 며느리에게 전수해 주셨나보다 원조1호라는 간판을 크게 내걸고... ,너에게 감성을 선물한다,https://blog.naver.com/durlsdjel12,2021-06-01
신당동떡볶이 나혼자산다 경수진마복림떡볶이 /청계천 나들이,https://blog.naver.com/u7love2?Redirect=Log&logNo=222515926738,신당동 떡볶이 먹으러 주말 저녁 신당동 출발 5년만에 오나보다 저번 나혼자산다 경수진편보고 너무 군침돌았던마복림떡볶이여기거리는 즉떡이랑 닭발도 유명하다 쩌어기 우정닭발이 맛있다던데! 코로나... ,"소소한 일상의 연속,",https://blog.naver.com/u7love2,2021-09-25
[신당동 떡볶이/ 신당동 즉석 떡볶이]마복림떡볶이 ,https://blog.naver.com/juyean123?Redirect=Log&logNo=222409213371,떡볶이집도 가봤는데 개인적으로는마복림떡볶이 가 제일 나은 것 같아서 즉석 떡볶이 생각나면 항상 마복림으로 가게 되더라고요 무난무난하게 맛있으니 한 번쯤은 가보시는 거 추천해요 여기서 포스팅 마칠게요!,일상 블로그♡,https://blog.naver.com/juyean123,2021-06-24
신당동마복림 떡볶이 _신당동 떡볶이 타운 내 원조 즉석... ,https://blog.naver.com/jack8900?Redirect=Log&logNo=222259484325,그 중에서도 신당동 즉석 떡볶이의 원조라고 불리며 며느리도 몰라~를 통해 CF 스타셨던 고 마복림 할머니의마복림 떡볶이 는 여전히 줄을 서서 기다리고 있었어요. 내부 좌석이 넓은 편이라 짧지 않은... ,"Go, Eat and Enjoy",https://blog.naver.com/jack8900,2021-02-28
신당동떡볶이맛집 ' 마복림할머니 막내아들네',https://blog.naver.com/lsy5088?Redirect=Log&logNo=222477010248,"그리고 첫번째 집이 바로 이곳, 신당동 떡볶이 맛집 ' 마복림 떡볶이 ' 집이 나오지요. 이곳이 원조인데요. 최근 MBC 예능 '나혼자산다'에 이곳이 나와서 사람들이 무쟈게 많더군요. 신당동 떡볶이 맛집 '마복림... ",사진으로 보는 세상,https://blog.naver.com/lsy5088,2021-08-20
신당동 즉석떡볶이마복림 떡볶이밀키트 재료 소스,https://blog.naver.com/be2141st?Redirect=Log&logNo=222521978684,서울 떡볶이 맛집 신당동마복림 떡볶이 를 밀키트 포장해왔어요. 재료가 각각 포장되어 있어서 팬에 다... 예전엔 너무 자주 먹어서 다른 맛을 찾았었는데 몇년만에 먹으니 마복림 즉석떡볶이 굿이에요. 이상... ,초록스토리,https://blog.naver.com/be2141st,2021-10-01
[신당맛집] 신당동 떡볶이마복림 할머니집,https://blog.naver.com/iamsuuy?Redirect=Log&logNo=222534781864," 마복림 할머니집 가서떡볶이먹고 온 후기 입니다! 일단 신당동 떡볶이 타운에 입성해줍니다떡볶이가게가 엄청!많아요!! 며느리도 몰라 아무도 몰라 ㅋㅋㅋㅋㅋㅋㅋㅋㅋㅋ 간판도 재미있고, 할머님 사진도 뙇!... ",eat:,https://blog.naver.com/iamsuuy,2021-10-12
신당동 맛집 ) 신당 떡볶이 타운 ' 마복림 떡볶이 ',https://blog.naver.com/jde1113?Redirect=Log&logNo=222541905066,#내돈내산 # 마복림떡볶이#즉석떡볶이 #신당동즉떡 #신당동즉석떡볶이 #신당동떡볶이타운 #신당동마복림 #신당동 마복림떡볶이#마복림할머니집 #마복림즉떡 #신당맛집 #신당동맛집 #신당떡볶이타운,So special ♡,https://blog.naver.com/jde1113,2021-10-19
신당동떡볶이타운마복림 떡볶이 ,https://blog.naver.com/andreascholl?Redirect=Log&logNo=221739514597,"화장실이라도 신당동 떡볶이를 드시러 가신다면마복림 떡볶이 도 괜찮아요. 그냥 먹을만한 떡볶이구요, 추억이 있으신 분은 좋을 수도 있겠네요. # 마복림떡볶이#신당동 #미미국수 #마복림 #신당동떡볶이타운",알칼리성 우유,https://blog.naver.com/andreascholl,2019-12-16
신림동마복림 할머니떡볶이먹으러!,https://blog.naver.com/ysd0809?Redirect=Log&logNo=222130151577,그 유명한 마복림 할머니 떡볶이 먹으러!! (지난번에는 다른 떡볶이 집 감) 신당동 떡볶이 타운 토요일... 이렇게 들었음 ㅋㅋㅋㅋㅋㅋㅋㅋ 아무튼 다음날 포장해온마복림 떡볶이 를 또 먹었음 ㅋㅋㅋㅋㅋㅋㅋ... ,소담스럽게 !,https://blog.naver.com/ysd0809,2020-10-29
[368]신당동마복림떡볶이 -떡볶이 매니아와 신당동 떡볶이... ,https://blog.naver.com/hjh345?Redirect=Log&logNo=222143130119,일단 메뉴부터마복림 할머니떡볶이메뉴 이렇게 세트메뉴가 있으면 고민도 하지 말고 그냥 2인 세트 갑니다. 추가 메뉴는 아직은 안시켰습니다. 정말 빛의 속도로 나오는 2인셋...한번에 뭐 다 들어가... ,Mr.황 is Still hungry,https://blog.naver.com/hjh345,2020-11-13
신당동 ‘ 마복림 떡볶이 ’ / 주차 가능한 이름난 떡볶이집,https://blog.naver.com/02492ab?Redirect=Log&logNo=222536133866,차에 타서 말씀 드려도 바로 해주시는 것 같았음 참고 하시길 # 마복림떡볶이#동대문떡볶이 #신당동떡볶이 #신당동 마복림떡볶이#신당동떡볶이타운 #마복림할머니떡볶이 # 마복림떡볶이 주차 # 마복림떡볶이 메뉴,사막을 건너는 법,https://blog.naver.com/02492ab,2021-10-13
이젠 며느리도 알아요.마복림 떡볶이후기,https://blog.naver.com/hop1030?Redirect=Log&logNo=222417382916,옆집에서 먹었던 기억을 되살려보니 춘장의 맛도 있었는데 마복림할머니의 소스는 단맛보다는... 사실 비오는 날 떡볶이가 더 땡기는 법입니다.마복림떡볶이먹으러 갈 때 예쁜 라탄백 들고 가세요.촉촉한... ,망고미미 (mangomimi),https://blog.naver.com/hop1030,2021-07-02
[신당동]마복림떡볶이 와 더피터커피,https://blog.naver.com/egg0224?Redirect=Log&logNo=222484848638,또 이야기를 하면 소리가 울리는 곳이였습니다. 음료는 나쁘지 않았어요. 에이드 하나랑 아이스아메리카노를 주문했어요. #신당카페 #신당커피 #신당카페추천 #더피터커피 # 마복림떡볶이#신당동떡볶이 #마복림,지우개,https://blog.naver.com/egg0224,2021-08-27
[신당동 맛집]마복림떡볶이 ,https://blog.naver.com/szkey?Redirect=Log&logNo=222454921698,가끔씩 주문해서 먹어봐야겠습니다. 너무너무 잘 먹었습니다^^ 위치는 아래 지도를 참고하세요. #신설동맛집 #신설동떡볶이골목 # 마복림떡볶이#떡볶이맛집 #신설동떡볶이타운 #충무아트센터 #충무아트센터맛집,그대에게들려주고싶은이야기,https://blog.naver.com/szkey,2021-08-03
[신당동 맛집]마복림떡볶이- 신당동 떡볶이 타운의 원조,https://blog.naver.com/thered0627?Redirect=Log&logNo=221761011677,"가격도 저렴하기 때문에 부담 없이 먹기에도 편리하다는 것이 큰 장점이기도 하니까... # 마복림떡볶이 , #신당동떡볶이, #신당동떡볶이타운, #신당동 마복림떡볶이 , #신당동맛집, #신당역맛집",어느 날 그가 말했다,https://blog.naver.com/thered0627,2020-01-07
신당동떡볶이마복림할머니 이젠 며느리도 안다는~.~,https://blog.naver.com/meto0l2l?Redirect=Log&logNo=222498558322,생각하면 마복림 할머니 떡볶이를 무척 좋아할 것 같단 생각에 오랜만에 대학 때 친구들이 떠올랐답니다. 매콤달콤 소스를 좋아한다면마복림 떡볶이 에 큰 감흥은 없으실 테고요. 은은하니 편하게 감칠맛 나게... ,N잡러 프리랜서 따스온,https://blog.naver.com/meto0l2l,2021-09-08
신당동떡볶이마복림 할머니떡볶이방문,https://blog.naver.com/lmhk9947d3?Redirect=Log&logNo=222112722901,"ㅡ.,ㅡ 오늘(일요일 10월11일)은 마라샹궈를 먹으러 가거나 신당동 마복림할머니 떡볶이 집에 가자고...마복림 떡볶이 도 그렇겠지만, 신당동 어디집을가던,, 아니 어느 즉석 떡볶이집을 가던 사리 욕심내서... ",고양이가 말했다,https://blog.naver.com/lmhk9947d3,2020-10-11
신당동떡볶이타운 원조마복림할머니네,https://blog.naver.com/hip8791?Redirect=Log&logNo=221843296664,바로 앞에 아이러브 떡볶이도 맛있기는 한데 이 날은 오랜만에 마복림 할머니네로 가고 싶어서 거기로 찾아갔네요! 신당동떡볶이타운에는 여러 가게 들이 있고마복림 떡볶이 는 바로 앞에 있어요. 이 골목에... ,최니,https://blog.naver.com/hip8791,2020-03-08
[ 마복림 떡볶이 ] 신당동 떡볶이 / 원조떡볶이 / 떡볶이맛집,https://blog.naver.com/never_finish_holiday?Redirect=Log&logNo=222506584622,1호마복림 떡볶이신당동 떡볶이 골목 들어가자마자 있었다 간판에 포스가 ㄷㄷㄷ 여러 방송에 나온게 보인다 줄이 있었는데 여기만 줄이 있다 전에도 줄이 있었는데 보니까 금방 줄어들었다 그래서 그냥... ,NEVER FINISH HOLIDAY,https://blog.naver.com/never_finish_holiday,2021-09-18
신당동떡볶이타운마복림떡볶이맛은?,https://blog.naver.com/butterfly7s?Redirect=Log&logNo=222526338517,라고ㅋㅋㅋㅋ 옆에 가면 마복림할머니 막내아들네도 있더라는ㅋㅋ 신당동떡볶이= 마복림떡볶이 를 떠올리는분들이 많아서인지 각종 TV에도 많이 출연했더라구요 이쪽동네 토박이인 남편도 추억에 잠겨... ,깡총이월드ღ'ᴗ'ღ,https://blog.naver.com/butterfly7s,2021-10-04
신당동 떡볶이타운마복림떡볶이 ,https://blog.naver.com/kimgufriend?Redirect=Log&logNo=222111110326,역시 어색한 곳 신당동 떡볶이 마복림마복림떡볶이신당동 떡볶이 타운에서 가장 많은 매장을 갖고 계신 것으로 알고 있어요 여기도 마복림 저기도 쩌~~~기도 마복림 마복림골목이라고 하고 싶네요^^ 20년전과... ,맛집가고 등산가고,https://blog.naver.com/kimgufriend,2020-10-09
[신당동] 마복림떡볶이 ,https://blog.naver.com/envyish?Redirect=Log&logNo=221670978788,이 마복림 할머니께서 살아계실적에 출연해 찍으신 #순창고추장 광고의 한장면입니다. 떡볶이 타운 입구로 들어가면 바로 초입에 위치한 집이마복림 떡볶이 집 이지만 언제부터인가 일방통행이 반대로... ,미대오빠,https://blog.naver.com/envyish,2019-10-07
"[서울]마복림떡볶이(신당동떡볶이타운) (메뉴판, 내돈내산)",https://blog.naver.com/incredibly10?Redirect=Log&logNo=222538806848,좋은 하루 되세용 *이웃추가 환영 *댓글 환영 *좋아요 공감 환영 *읽어주신것만으로 감사 #신당동떡볶이 # 마복림떡볶이#신당동마복림할머니 #즉석떡볶이 #유퀴즈떡볶이 #맛있는녀석들떡볶이 #나혼자산다떡볶이,눈꽃미나리님의블로그,https://blog.naver.com/incredibly10,2021-10-16
신당동 떡볶이 타운마복림 떡볶이 로 첫 방문,https://blog.naver.com/ksi54?Redirect=Log&logNo=222419780675,라일비 Camera. 캐논200D #떡볶이 #맛집 #떡볶이타운 #신당동떡볶이 #신당동맛집 #신당동떡볶이타운 #신당동 마복림떡볶이#신당떡볶이 #신당맛집 #신당떡볶이타운 #신당 마복림떡볶이#원조떡볶이 #즉석떡볶이,이상한 나라의 라일비,https://blog.naver.com/ksi54,2021-07-06
신당동떡볶이마복림 할머니네 즉석 떡볶이 ,https://blog.naver.com/dpfladl10?Redirect=Log&logNo=222454785181,"이 곳에 즉석 떡볶이가게가 많긴 하지만, 그중 가장 유명한마복림 할머니떡볶이 로 갔답니다. 할머니는 돌아가시고 현재는 아들과 며느리가 운영하고 있다고 하네요. 2인세트로 주문 완료 ! 여기에 만두사리 2개... ",행복한 세상의 고양이♪,https://blog.naver.com/dpfladl10,2021-08-05
신당동마복림 할머니떡볶이후기(맛있는녀석들),https://blog.naver.com/rlacl79?Redirect=Log&logNo=222513384321,#떡볶이 #맛집 #마복림할머니 # 마복림떡볶이#마복림할머니떡볶이 #신당동 #신당동떡볶이 #맛있는녀석들 심당동떡볶이를 먹으러 갔어요 가깝고 맛있는 녀석들에서도 나왔고요 토요일 한 6시쯤이였어요... ,HESTIA 공식 블로그,https://blog.naver.com/rlacl79,2021-09-22
신당동 떡볶이타운 맛집) 원조1호마복림 떡볶이솔직후기,https://blog.naver.com/nml10?Redirect=Log&logNo=221885027975,신당동 떡볶이타운 맛집마복림 떡볶이이날은 원래.. 동대문에 카페를 갔는데 두군데나 코로나여파로... ㅎㅎ #마복림할머니떡볶이메뉴 2인세트 주문했어요 ㅋㅋㅋㅋ 튀김은 따로없는듯 ㅋ 근데 가게앞... ,생생맛집 생생뷰티 생생후기 가득,https://blog.naver.com/nml10,2020-04-01
[신당동] 마복림 떡볶이- 추억의 신당동 즉석 떡볶이,https://blog.naver.com/karo?Redirect=Log&logNo=222415831048,신당동마복림 떡볶이본격적 입덧이 시작 되고 쫄면이나 떡볶이 햄버거 같은 게 먹고 싶더라구요... 대식가였으면 싹싹 긁어 먹었을텐데 아쉽네요ㅜㅜ 이상 오랜만에 갔던 신당동 마복림즉석떡볶이 후기였습니다!,몽몽이의 소소일상,https://blog.naver.com/karo,2021-06-30
신당동 즉석 떡볶이 :마복림떡볶이 ,https://blog.naver.com/kkomagurung?Redirect=Log&logNo=222283933022,신당동 즉석 떡볶이집 : 마복림떡볶이쿠쿠랑 함께 꼭 가야할 일이 생겨서 둘이 같이 연차를 내고 미니쿠를 학교를 보내자 마자 지하철로 일 보러 다녀왔어요. 아침 일찍 일정이어서 일을 다 마쳤더니 10시... ,날다래's 신이나게,https://blog.naver.com/kkomagurung,2021-03-22
[ 마복림떡볶이 /신당동] - 며느리도 몰라! 나도 왜 가는지 몰라~,https://blog.naver.com/melburne?Redirect=Log&logNo=222182825573, 마복림떡볶이주니어1이 많이 좋아하는 메뉴 중 떡볶이가 있습니다. 엽떡을 좋아하지만 너무 자극적이라서 자주 먹는 건 안 좋은 거 같고 가족들이 그나마 같이 가서 먹을 수 있는 떡볶이는... ,오로지 먹기 위해 산다~(오먹산),https://blog.naver.com/melburne,2020-12-24
신당동은 떡볶이! 떡볶이타운마복림 떡볶이feat.원조,https://blog.naver.com/heehyon911?Redirect=Log&logNo=222368654467,신당동떡볶이하면마복림떡볶이인가봐요 북적한 내부입니다 영업시간시작이 꽤빠른 9시네요 매월 둘째 넷째 월요일 휴무라고 합니다 메뉴입니다 (2021년 5월 기준) 4인세트를 주문했어요 그리고 훈제계란사리와... ,ssohn,https://blog.naver.com/heehyon911,2021-05-26
원조 신당동떡볶이마복림할머니 막내아들네 방문기,https://blog.naver.com/chingis?Redirect=Log&logNo=222534027309,신당동 떡볶이집 마복림 할머니의 막내 아들네에 방문해 보았답니다 원래 진짜 원조는 바로 옆집인 이곳마복림 떡볶이신당동 떡볶이 타운의 맨 처음입구에 위치한 약 70년 전통의 원조 떡볶이집 하지만 저와... ,"""난(蘭)리 났 어(漁)"" 난리났어 김동배",https://blog.naver.com/chingis,2021-10-11
(신당동맛집) 신당동 떡복이타운 원조 ' 마복림 떡볶이 ',https://blog.naver.com/tlsduswjd88?Redirect=Log&logNo=221913383422,신당동 떡복이타운 원조 ' 마복림 떡볶이 ' 작년 생일때 레베카 보러 갔다가다녀온 신당동 떡볶이타운마복림 떡볶이 벌써 다녀온지 4개월이나 지났지만그때의 맛을 생각하며포스팅을 끄적여본다 레베카가... ,기록이 정보가 되는 공간,https://blog.naver.com/tlsduswjd88,2020-04-19
신당동 추억의 맛 ‘ 마복림떡볶이 ’,https://blog.naver.com/yoonbo_?Redirect=Log&logNo=222536512518," 마복림떡볶이평일 09:00-24:00 / 주말, 공휴일 09:00-01:00 매월 둘째, 넷째 월요일 휴무 서울 중구 다산로35길 5 안녕하세요~ 보동이에유 히히 이날은 아침부터 머릿속에 즉석떡볶이가 둥둥 떠다니더라구요.. 오랜만에... ",bodong day is precious,https://blog.naver.com/yoonbo_,2021-10-14
신당동 떡볶이아이러브신당동vs 마복림 할매,https://blog.naver.com/city0311?Redirect=Log&logNo=221994958177,"오늘 첨으로 마복림 할매 맞은편에 있는 #아이러브신당동 떡볶이로 가봤다. 맞은편에 있는 # 마복림떡볶이둘다 발렛주체 가능 #아이러브신당동가격 좀 보까? 기본 13,000원.. 처음 와 봤으니, 우린 기본.. 기본에... ",City`s 사먹go,https://blog.naver.com/city0311,2020-06-09
"신당동마복림떡볶이 와 에쏘맛집, 리사르커피",https://blog.naver.com/fermata1206?Redirect=Log&logNo=222369729389,"여기서, 마복림과 아이러브떡볶이의 다른점! 1.마복림떡볶이 엔 김밥이 없고 아이러브떡볶기엔 김밥이 있다. 2.마복림떡볶이 의 떡볶이 소스 = 고추장+춘장 아이러브떡볶이의 떡볶이 소스= 오리지널 고추장소스... ",달콤한 나의 도시,https://blog.naver.com/fermata1206,2021-05-27
신당동마복림 떡볶이 ,https://blog.naver.com/ajeangdy?Redirect=Log&logNo=221984434694,신당동떡볶이골목이라고 하면 이 곳마복림떡볶이 와 아이러브떡볶이가 생각이나요. 두 지점 모두... 이것이 바로 마복림표 떡볶이의 힘인가. ㅋㅋㅋㅋㅋㅋㅋㅋㅋㅋㅋ 참 이상하더라고요; ㅋㅋ 제가 제일... ,arte,https://blog.naver.com/ajeangdy,2020-05-30
 마복림 떡볶이 집 간만에 신당동 떡볶이 타운 방문기,https://blog.naver.com/happylion86?Redirect=Log&logNo=222110607830,"역시 주기적으로 찾아줘야 하는 마복림 할머니네 떡볶이집! 배불러서 볶음밥을 못 먹었지만 다음에 생각날 때 또 방문 예정입니다!마복림 떡볶이매일 9시부터 11시까지 둘째, 넷째 화요일 휴무",아리아나,https://blog.naver.com/happylion86,2020-10-09
신당동 떡볶이 / [ 마복림 떡볶이 ] 가격 및 후기!,https://blog.naver.com/simhyunkyung?Redirect=Log&logNo=222039139235,신당동 떡볶이 과자는 먹어봤지만 신당동에서 먹어본 건 처음인데요ㅎㅎ 월요일이 휴무라고 써있어서마복림 떡볶이옆에 있는 막내 아들네로 가려 했는데! 열었더라고요?! 본점에서 먹을 수 있어서 좋았어요... ,여행/일상/맛집♡,https://blog.naver.com/simhyunkyung,2020-07-23
신당역 즉석 떡볶이 맛집 신당동떡볶이타운마복림떡볶이 ... ,https://blog.naver.com/wsy3468?Redirect=Log&logNo=222535148604,신당역 즉석 떡볶이 맛집 신당동떡볶이타운마복림떡볶이친구가 신당동 왔으면 떡볶이는 먹어주는게... 여기저기 떡볶이집이 보임ㅋㅋㅋ 마복림할머니가 원조라더니 뒷집은 막내아들이하고 앞집은... ,Woooooh,https://blog.naver.com/wsy3468,2021-10-13
신당동 맛집:마복림 떡볶이 _ 신당동 떡볶이 타운의 명물.,https://blog.naver.com/specialian9?Redirect=Log&logNo=222003963784,신당동 맛집:마복림 떡볶이 _ 신당동 떡볶이 타운의 명물. 오랜만에 주말 낮 시간 여유가 생겨 어디를 가볼까 생각하던 중 생각난 즉석 떡볶이! 즉석 떡볶이 하면 다들 신당동이 떠오를거라 생각하는데요:) 즉석... ,반짝이게 새기다 by 별술사,https://blog.naver.com/specialian9,2020-06-17
신당동마복림 떡볶이 ^^,https://blog.naver.com/skysula236?Redirect=Log&logNo=222436067805,집에서 한 시간 가량 운전해 도착한 떡볶이 타운 그 중 원조 1호인마복림 떡볶이 집 초이스^^ 도착하자 마자 발렛파킹?을 해주신다. 나중에 안 사실이지만 그냥 인근 식당가나 거리에 주차 ㅋ 맞은편이 아이러브... ,KRAKEN! PADI INST,https://blog.naver.com/skysula236,2021-07-18
"신당동떡볶이마복림떡볶이 , 우정닭발 포장 먹방 후기",https://blog.naver.com/sunmi10004?Redirect=Log&logNo=222538896355,이 떡볶이는 신당동떡볶이 많은집중에마복림떡볶이 구요~ 친구랑 둘이가서 포장해 온거라~ 입구 바로 앞에 제가 차를 대고 친구가 들어가서 포장해 왔어요. 근데 진짜 시간 1도 안걸리고 들어가자마자 바로... ,밍스,https://blog.naver.com/sunmi10004,2021-10-16
변함 없는 맛! 역시마복림떡볶이 ,https://blog.naver.com/acenwk?Redirect=Log&logNo=222269297374,역시마복림떡볶이 다 역시 떡볶이는 적당히 졸여서 먹어야 제맛이다 간이 너무 세지도 않고 적당한 매콤함에 쫄깃함까지~ 역시다! 떡볶이의 마무리는 항상 이렇게 볶음밥으로~ 세월이 많이 흘렀어도 언제나... ,아름다운 삶을 위하여>>>>,https://blog.naver.com/acenwk,2021-03-09
[신당동떡볶이] 신당동 ' 마복림 떡볶이 ' 맛집 투어,https://blog.naver.com/kmh4161?Redirect=Log&logNo=222094114442," 마복림떡볶이▲ 신당동떡볶이 중 유명한 ' 마복림떡볶이 ' 에 왔다 주말 아침일찍 병원에 들려서 진료를 받고, 점심을 뭐먹을지 고민한 끝에 신당동으로 향하기로 마음먹었습니다. 지난주부터 계속 떡볶이를... ",청춘도전사랑열정,https://blog.naver.com/kmh4161,2020-09-19
"추억을 찾아 신당동마복림할머니떡볶이 ,이제 며느리도... ",https://blog.naver.com/leeky720?Redirect=Log&logNo=222538673267,#신당동떡볶이 #떡볶이원조 #마복림할머니떡볶이 #신당동원조떡볶이 #마복림할머니 #신당동떡볶이타운 #신당동떡볶이위치 # 마복림떡볶이 영업시간 #추억의떡볶이 #떡볶이볶음밥 #추억쌓기,생생주부해피라이프,https://blog.naver.com/leeky720,2021-10-16
[서울살이] 카페 겸 LP 샵 모자이크 서울ㅣ마복림 떡볶이 ㅣ아... ,https://blog.naver.com/rormwnd1?Redirect=Log&logNo=222541548659," 마복림 할머니떡볶이매월 둘째, 넷째 월요일 휴무 평일 오픈은 9시 클로즈는 24시 주말은 새벽 1시까지 포장 주문도 많고, 사람도 많으나 금방 빠짐. 단무지 개별 포장된 것으로 테이블 당 주셔서 위생적!!... ",Recording space (기록 저장소),https://blog.naver.com/rormwnd1,2021-10-19
