title,link,description,bloggername,bloggerlink,postdate
남양주데이트_수요미식회 출연 맛집_ 목향원 ,https://blog.naver.com/blackjoj?Redirect=Log&logNo=222422285334,목향원이미 남양주데이트 코스나 남양주 맛집 등으로 검색하면 우르르 나올정도로 유명한...목향원 은 메뉴가 한가지라 뭐뭐 주세요 하실필요가 없습니다. 하하하 인원수대로 주문할 건지 정도만 정하시면... ,데빌사탕의 사탕발림~☆,https://blog.naver.com/blackjoj,2021-07-06
남양주데이트 주말에 수요미식회맛집목향원 ,https://blog.naver.com/takuteru?Redirect=Log&logNo=221885812857,수요미식회맛집목향원 으로 오픈 시간에 맞춰 방문을 하기로 했답니다! 날씨가 좋았던 탓에 가족단위 나들이를 나온 분들이 많았는데 처음 방문한 남양주목향원 은 수요미식회맛집으로 유명했고 남양주... ,Let's Go Fashion World~♡,https://blog.naver.com/takuteru,2020-04-01
남양주 맛집 수요미식회 방영된 석쇠불고기 맛집목향원 ,https://blog.naver.com/darkyoon85?Redirect=Log&logNo=222242137901, 목향원매장주소: 경기 남양주시 덕릉로 1071길 34-12 영업시간: 11:00~22:00 연중무휴 예약문의: 031-527-2255 남양주 맛집 수요미식회 방영된 석쇠불고기 맛집목향원ⓒ글 사진 영상 다크윤 안녕하세요 다크윤이에요... ,다크윤의 맛집이야기♥,https://blog.naver.com/darkyoon85,2021-02-17
남양주 맛집 @ 목향원쌈밥정식,https://blog.naver.com/hjs417?Redirect=Log&logNo=222467641687,"■ 남양주 맛집 / 남양주 한정식 추천목향원* 수요미식회 맛집이자 분위기맛집인 남양주 쌈밥정식... 맛집,목향원:) 피자 파스타말고 닭갈비말고 정통 한정식이 먹고싶다고요!목향원 은 방송에도 많이... ",Don't look back in Anger.,https://blog.naver.com/hjs417,2021-08-12
남양주목향원맛도 분위기도 좋은 곳,https://blog.naver.com/ladyloves?Redirect=Log&logNo=222525202038,#남양주맛집 #별내맛집 # 목향원#남양주식당 #가족모임 #드라마촬영지 #별내수요미식회... 어머님 댁이 노원이라 근처 맛집들을 찾아보다 우연히 알게 된목향원 . (어머님 포함 성인 3명은 코로나 백신 2차 접종... ,Serendipity,https://blog.naver.com/ladyloves,2021-10-03
[맛집] 남양주목향원 ,https://blog.naver.com/may0142?Redirect=Log&logNo=222136644174,배 불러 풍경이 눈에 안들어옴 ㅋㅋㅋㅋ 남양주목향원 은 TV에도 여러번 나왔던 곳이고 나는 TV와... 2주차장이목향원 과 가장 가깝다. 우리가 도착한 시간은 아침 10시 30분.목향원오픈 시간은 아침 11시.... ,오월이라이프,https://blog.naver.com/may0142,2020-11-06
남양주맛집목향원쌈밥한정식 풍경맛집일세,https://blog.naver.com/sense0513?Redirect=Log&logNo=222396189353,유기농 쌈채소 불고기쌈밥 정식이 나오는 ' 목향원 ' 수요미식회와 맛집 프로그램에 여러번 소개된 남양주 맛집이에요. 위치 : 남양주시 덕릉로107 1번길34-11목향원 카페포레 남양주시 별내동 2335-3 전화번호 : 031... ,긍정의 평화로운 일상,https://blog.naver.com/sense0513,2021-06-13
남양주 맛집 수요미식회에 나온목향원쌈밥 별미네요,https://blog.naver.com/afromz001?Redirect=Log&logNo=222524421354,"흥국사 가신다면 흥국사 앞에 있는 남양주맛집 수요미식회 나온목향원 을 안들리고 올 수는 없습니다. 흥국사 일주문 앞에목향원주차장이 있습니다. 얼마나 많은 사람이 찾는지 주차장도 1,2,3 주차장까지... ",소프트맨의 블로그,https://blog.naver.com/afromz001,2021-10-02
[ 목향원 /남양주별내] 수요미식회에서도 소개된 석쇠불고기... ,https://blog.naver.com/iam_kate?Redirect=Log&logNo=222446415017," 목향원영업시간 매일 11:00~22:00 주차: 1,2,3 주차장 전화번호 : 031-527-2255 *반려동물 동반 x목향원위치 경기도 남양주시 별내동 2235-3번지 지난 주 일요일, 바로 어제 엄청 더운 날씨였지만 쌈밥 정식 맛집인... ",Kate Story,https://blog.naver.com/iam_kate,2021-07-26
남양주데이트 수요미식회맛집목향원꽃 가득 쌈밥정식,https://blog.naver.com/dony_zzang?Redirect=Log&logNo=222321228442,남양주데이트 수요미식회맛집목향원꽃 가득 쌈밥정식 요즘 날씨가 너무 좋아 나들이 가기 좋아요. 오랜만에 시부모님께 아들 맡기고 부부 자유타임 얻어서~ 드라이브 겸 남양주데이트 수요미식회맛집목향원 ... ,돈블리네 소소한 일상 ♡,https://blog.naver.com/dony_zzang,2021-04-24
남양주맛집 수요미식회에 소개된목향원 ,https://blog.naver.com/hey1571?Redirect=Log&logNo=222338505029,날씨 참 좋았던 주말에 집에 있기 아까워 남양주맛집으로 소문난목향원 에 다녀왔어요 수요미식회에... 남양주맛집목향원 은 별내동에 위치했습니다. 유명 맛집 프로그램에도 많이 소개된 곳이기도 하지만... ,혜나의 일상,https://blog.naver.com/hey1571,2021-05-05
[남양주맛집]석쇠불고기와 쌈밥이 맛있는목향원 ,https://blog.naver.com/arum7608?Redirect=Log&logNo=222448112454,남양주 맛집목향원일요일.. 더운날 사무실 이사가 있는데 겸이 핑계로 도망나옴. 너무 더우니까... 급하게 검색해서 방문한목향원 . 쌈밥정식 맛집으로 유명하고 수요미식회 및 생방송 투데이 등등 마니... ,I'm겸,https://blog.naver.com/arum7608,2021-07-30
"남양주맛집, 수요미식회목향원후기",https://blog.naver.com/beandoll2?Redirect=Log&logNo=222251496694,"남양주맛집,목향원주소 : 경기도 남양주시 별내동 2334 전화번호 : 031-527-2255 영업시간 : 매일 11:00-22:00 주차장 : 매장 앞 넓게 보유 서울에서 1시간 정도 벗어난 근교 드라이브로 남양주 별내동에 위치한목향원 ... ",Connecting The Dots,https://blog.naver.com/beandoll2,2021-02-21
"별내 맛집 남양주목향원TV에 여러번 소개된 맛집, 솔직하고... ",https://blog.naver.com/gz73gj1?Redirect=Log&logNo=222514683671,남양주목향원 이라는 곳입니다! 너무~ 궁금해서 신랑과 다녀와봤어요~ 솔직한 후기 시작합니다!ㅎㅎ 별내 맛집목향원정보 ● 주소 ● 경기 남양주시 덕릉로 1071번길34-11지번: 별내동 2335-3● 영업시간... ,누수의명장,https://blog.naver.com/gz73gj1,2021-09-23
[경기도 남양주] 석쇠불고기 쌈밥정식 / 수요미식회 맛집 ' 목향원 ',https://blog.naver.com/joojoo5623?Redirect=Log&logNo=222468327552,"남양주목향원 은 수락산 밑에 위치해있어요. 올라가는 길이 수락산 흥국사 올라가는 길인데, 좁은... 남양주 별내에 위치한목향원 ! 주차장 2~3개정도 있고 주차관리원분도 계셔요. 주말에 가면 가는 길이... ",바삭바삭한 일상그리기❣,https://blog.naver.com/joojoo5623,2021-08-13
[경기남양주]목향원석쇠불고기 쌈밥정식 (2020.7),https://blog.naver.com/sooapa?Redirect=Log&logNo=222035163668,"당고개 역에서 덕릉 고개를 넘어가면 바로 남양주 별내가 나오는데 수락산 남쪽 기슭에, ' 목향원 '이라는...목향원모습들 경치 좋은 수락산 남쪽 기슭에 넓직하게 터를 잡고 있는데 마치 작은 민속촌에 온... ",산바라기의 여행등산 이야기,https://blog.naver.com/sooapa,2020-07-19
남양주 맛집 수요미식회에 나온목향원 ,https://blog.naver.com/fds6051?Redirect=Log&logNo=221975813980,날씨도 좋은 주말 오늘 가족이 함께 남양주 맛집목향원 을 다녀 왔어요 외식을 하기 전에 제일 먼저... 꽉차있었답니다목향원 으로 가는 길에는 고향의 향기가 듬뿍 느껴지는 장독대부터 초가집 지붕의 건물이... ,옥냥,https://blog.naver.com/fds6051,2020-05-23
남양주 수요미식회 유기농 석쇠불고기 쌈밥 정식 -목향원 ... ,https://blog.naver.com/jendanoon?Redirect=Log&logNo=222364121174,가평 카페 놀러갔다가 집으로 가기전 들른 #남양주 # 목향원#수요미식회 #생활의달인 #미쉐린가이드... 캬캬캬캬캬 . #남양주 목향원# 목향원#남양주수요미식회 #한정식 #석쇠불고기 #남양주쌈밥 #쌈밥정식,핑크고래 & 하늘 비,https://blog.naver.com/jendanoon,2021-05-24
향토미 가득한 남양주목향원 ,https://blog.naver.com/brightenedu?Redirect=Log&logNo=221771845675,"지금까지 몇 번 다녀왔는 지 세다가 지쳐 안셀 정도로 많이 다녀온 남양주목향원! 간만에 향토미를... 남양주목향원! 입구에 주차장이 넓지만 오는 손님차가 더 많아서 제 1주차장, 2주차장 등 있고 (마치... ",김원장의 탐구생활,https://blog.naver.com/brightenedu,2020-01-14
남양주맛집 수요미식회에 나온 쌈밥맛집목향원 ,https://blog.naver.com/hyeji925?Redirect=Log&logNo=222154059431," 목향원남양주맛집 / 수요미식회 임신중에 먹고싶은 음식은 사람들마다 다르겠지만 저는 요즘 한식을... 남양주맛집목향원 .. 이름도 많이 들어봤고, 후기도 간간히 봤는데 저희가 자주 찾는 별내에 있는지... ",보름마밍,https://blog.naver.com/hyeji925,2020-11-25
남양주맛집 수요미식회목향원드라마촬영지,https://blog.naver.com/acewriter?Redirect=Log&logNo=222426838674,"코로나로 인해 많은 부분에 제약이 생겨버린 일상, 식사도 하면서 짧은 여행을 한 것 같은 느낌을 가질 수 있는 식당이 있어요 남양주 별내에 위치한목향원 인데요목향원 은 몇년 전 가족모임을 하느라 온 적이... ",리온의 일상,https://blog.naver.com/acewriter,2021-07-10
남양주맛집목향원수요미식회 나온 곳♥ 맛있게 먹고 왔어요.,https://blog.naver.com/boreum0225?Redirect=Log&logNo=222327316095,제가목향원 을 처음 만난건 2019년 6월이었어요. 신랑이 검색해서 가봤는데~ 그때 기억도 너무 좋았고... ㅋㅋ목향원경기도 남양주시 덕릉로 1071번길 34-11 별내동 2335-3 031-527-2255 연중무휴 11:00 ~ 오후 22:00... ,뽀블링의 꿈꾸는 다락방♥,https://blog.naver.com/boreum0225,2021-04-29
수요미식회맛집 남양주데이트 추천목향원쌈밥정식 추천!,https://blog.naver.com/perpurm?Redirect=Log&logNo=222383191289,수요미식회맛집목향원 에 다녀왔다! 무려 1997년에 생긴 집이라서 워낙 유명했지만 나는 경기도 시민이 된지 얼마 되지 않았으므로 처음 가보는 곳이었음! 그런데목향원 은 차가 없이는 절대 갈 수 없는 언덕... ,Someday,https://blog.naver.com/perpurm,2021-06-03
남양주맛집 한옥스타일에 눈도 호강하는 수요미식회목향원 ,https://blog.naver.com/hellorio?Redirect=Log&logNo=222069184503,남양주맛집목향원 입니다. 수요미식회에도 출연한곳이라서 많은분들이 이미 알고계신곳이고 평소같으면 왠만한 웨이팅이 아니고서야 입장을 못하는곳입니다. 남양주맛집목향원같은경우 별내쪽에... ,조이킴,https://blog.naver.com/hellorio,2020-08-24
남양주 별내 맛집목향원석쇠불고기 쌈밥정식 가격 맛 후기:),https://blog.naver.com/gtd6739?Redirect=Log&logNo=222518876235,"안녕하세요 복댕이입니다^0^ 일요일 점심에 남양주 별내 맛집목향원 에서 석쇠불고기 쌈밥정식을 먹고왔어요 남양주 별내 맛집목향원 은 대기표를 뽑고, 직원분에게 인원을 말하면 되고요! 대기번호를... ",♥복댕이의 HappY HousE♥,https://blog.naver.com/gtd6739,2021-09-27
"남양주맛집, 수요미식회 쌈밥/불고기'목향원'",https://blog.naver.com/kikiao12?Redirect=Log&logNo=222173927992,"남양주맛집목향원 은 수요미식회 등 여러 매체에 소개된 곳이라고 하는데요, 가려고 했떤 별내 알파카... 뒤목향원 으로 걸어 내려가보았어요, 주차장에서 남양주맛집목향원 으로 가는 길에는 조경이 잘... ",by Churi,https://blog.naver.com/kikiao12,2020-12-14
"남양주맛집 수요미식회목향원 , 시골풍경과 삼색밥",https://blog.naver.com/tney?Redirect=Log&logNo=222189433244,"남양주 산 자락에 위치한목향원 은 꼭 기억속 시골집과 닮아있었다. 아이들의 집콕 2주차, :고기 먹으러 가고 싶어요~!! :어디 한적한 곳 없을까??....아!!목향원거기다! 외출을 1도 못하고 있는 아이들이 답답해... ","둥이와 함께, 따뜻한 일상",https://blog.naver.com/tney,2020-12-29
남양주쌈밥으로 많이들 찾는다는목향원 은 단일메뉴!,https://blog.naver.com/hae533?Redirect=Log&logNo=222492457400,"남양주목향원남양주시 덕릉로 1071번길 위치로, 대중교통x , 자동차로 이동 가능한 지역 골목 윗쪽에 위치하고 있었던목향원마치 시골에 온 듯한 느낌을 풍기는 초가집 식당과, 가지런하게 정돈된 돌 연못... ",써녹’s,https://blog.naver.com/hae533,2021-09-02
"남양주 별내 쌈밥 맛집)목향원 : 알게 된 계기(자전거여행), 위치... ",https://blog.naver.com/sjn1203?Redirect=Log&logNo=222510462329,오늘은 남양주 별내 쌈밥 맛집목향원 에 대해 포스팅하겠습니다. 1.목향원 을 알게 된 계기 및 방송 출연 경력 별내카페거리가 유명하다고 해서 별내에 꼭 가보고 싶었습니다. 그래서 이번 주 9월 14일(화)에... ,"나미의 관심, 사고, 생활",https://blog.naver.com/sjn1203,2021-09-19
남양주맛집 수요미식회 가족끼리 가기 좋은목향원다녀왔어요,https://blog.naver.com/iakim7214?Redirect=Log&logNo=222386248073,"그래서 다녀온 수요미식회 에 나온 쌈밥 맛집 , 가족끼리 가기 좋은 [목향원] 다녀왔어요 :) 오랜만에...목향원경기도 남양주시 별내동 2335-3 주말드라마 촬영지로도 잘 알려진 곳이라 그런지 정말 인기가 많은... ",인애킴 뷰티패션블로그,https://blog.naver.com/iakim7214,2021-06-05
남양주 별내 데이트 수요미식회 맛집목향원 ,https://blog.naver.com/envy830322?Redirect=Log&logNo=222351405169,"남양주 별내 수락산 불암산 자락의 맛집목향원 에서 쌈밥정식을 먹고 커피를 마셨어요.목향원경기 남양주시 별내동 2335-3031-527-2255 매일 11:00 - 24:00 연중무휴(명절 포함) 메뉴 : 쌈밥정식 16,000원 수요미식회... ","꽃보다 쏠, 여행중♡",https://blog.naver.com/envy830322,2021-05-15
[수락산 맛집] 주말 나들이 겸 점심먹으러목향원방문기,https://blog.naver.com/corey8?Redirect=Log&logNo=222173404990,"#서울근교나들이 # 목향원#남양주맛집 주말 오전 노원에서 일정을 마치고 나온김에 점심을 먹고 들어가기로 했다. 일반 밥집말고 바람도 쐴겸, 서울을 벗어나서 먹기로 결정하고 검색해서 찾아간목향원 . 워낙... ",집에서 빵굽는 난나니,https://blog.naver.com/corey8,2020-12-14
[별내]수요미식회에 방영된 남양주 맛집 ' 목향원 ',https://blog.naver.com/yoonji3?Redirect=Log&logNo=222166599008,저는 수요미식회 나오기전에 방문했던 것 같은데요~ 남양주맛집목향원 은 유기농으로 재배한 쌈 채소만을 사용하고 있어요. 아주 싱싱한 채소를 믿고 드실 수 있답니다!목향원 의 메뉴는 1가지 인데요~ 1인 1식... ,타이니 블로그,https://blog.naver.com/yoonji3,2020-12-08
남양주 수요미식회 맛집목향원:: 앉아서 30초면 상차림이... ,https://blog.naver.com/eggtta?Redirect=Log&logNo=222352512843,석쇠불고기 쌈밥정식이 나오는 남양주목향원 . 너무너무 유명해서 사실 이 단일메뉴를 소개하는게 맞는가 싶을정도. 사실 맛도 맛이지만목향원 은 남양주에서 알아주는 뷰 맛집. 난 뷰는 필요없고 걍 맛만... ,101번째 타르트,https://blog.naver.com/eggtta,2021-05-15
남양주맛집 별내 쌈밥 [ 목향원 ],https://blog.naver.com/prayreader?Redirect=Log&logNo=222385879798,남양주맛집 별내 쌈밥 [ 목향원 ] 친구가 #남양주 #별내 에 맛집이 있다고 해서 다녀 왔어요~ #쌈밥맛집 # 목향원입니다. 엄청 넓은 부지에 초가지붕 집이 4채가 있더라구요. 외부 공간에도 테이블이 꽤 많이 있었고... ,hampton,https://blog.naver.com/prayreader,2021-06-05
남양주맛집+수요미식회 ' 목향원 ' (여기가 쌈밥 찐맛집!),https://blog.naver.com/yeononly?Redirect=Log&logNo=222427862054,"오늘은 #쌈밥정식 과 #불고기쌈밥 으로 유명한 # 목향원에 다녀왔어요! #남양주맛집 으로 이미 유명한... 네비게이션에 ' 목향원 ' 이라고 입력하면 쉽게 찾을 수 있구요, 주차장도 아니 글쎄 놀랍게도 제1,2... ",Ribo-land,https://blog.naver.com/yeononly,2021-07-11
남양주 별내 맛집 추천! :: 소문대로 맛있는목향원 ,https://blog.naver.com/nikjs?Redirect=Log&logNo=222402435988, 목향원 에 다녀왔어요 이미 남양주 별내에서 되게 유명한 식당이라면서요? 수요미식회에서도 나왔다고 하구요! 소문대로 맛있는지 한 번 먹고왔습니다!!목향원- 주소 : 경기도 남양주시 덕흥로 1071번길 34-11... ,반짝반짝 빛나는,https://blog.naver.com/nikjs,2021-06-18
남양주맛집목향원 에서 시골갬성 즐기기!,https://blog.naver.com/ohgkaeun?Redirect=Log&logNo=222206593375,"저번 주 주말 남자친구랑 남양주 드라이브를 다녀왔는데 간김에 남양주맛집목향원 도 가게 되었어요... 안그래도 늦은 점심, 이른 저녁으로 방문했었거든요ㅋㅋ목향원경기도 남양주시 별내동 2334 #남양주... ","오가리의 여행같은 인생, ♥",https://blog.naver.com/ohgkaeun,2021-01-14
남양주 맛집-목향원 ,https://blog.naver.com/millamant31?Redirect=Log&logNo=222540926336,야외에서 콧바람쐬기 좋은 10월 기운없어하시는 엄마위해 야외로 고고~^^ 집에서 1시간이내 갈수있는 곳을 찾다가 남양주에 위치한 ' 목향원 '을 찾았다. '수요미식회'에 석쇠불고기쌈장 맛집으로 방영~ 식당이... ,꿈꾸는 다락방,https://blog.naver.com/millamant31,2021-10-18
남양주목향원분위기가 많이 바뀌었네요,https://blog.naver.com/parkseokwang?Redirect=Log&logNo=221797839805, 목향원이 유명 하 더라구요.. 저는목향원 을 별내지구가 생길때쯤? 자주 다녔었는데요 아내와 외식 가족들과 함께 외식 이곳은 교외적인 분위기와 탁트인 전망이 좋아서 도심 근교의 나름 드라이브 코스였었죠.... ,광이 블로그,https://blog.naver.com/parkseokwang,2020-02-05
남양주맛집 수요미식회_ 목향원민속촌같은 자연분위기... ,https://blog.naver.com/rabbit22?Redirect=Log&logNo=222413515344,"남양주 마재성지 성지순례후, 부모님과 건강식 남양주맛집 검색하다가목향원후기가 좋아서... 오래됬는데 난 이제 오다니 ㅎㅎ목향원입구 사실 수요미식회 문구에 더 끌렸는지도 모르겠음. 어쨋거나... ",토깽이의 세상~,https://blog.naver.com/rabbit22,2021-06-29
남양주맛집 -목향원 ,https://blog.naver.com/ksy7298?Redirect=Log&logNo=222530955574, 목향원서을 근교 남양주에 쌈밥 맛집목향원 에 방문했습니다. 산속에 위치해서 공기도 좋고 생각보다 규모도 커서 놀랐던곳입니다. 요즘 맛집에서 티비 한번 안나오면 서운한것처럼목향원 도 여러 방송에... ,두 사람 집밥,https://blog.naver.com/ksy7298,2021-10-08
남양주목향원 . 누구나 좋아할 석쇠불고기와 쌈밥,https://blog.naver.com/uehara0309?Redirect=Log&logNo=222499466129," 목향원 의 위치와 주소입니다. 미리 알아보고갈때 봤던 사진속 모습이 도대체 어디서 나타나는걸까 하는 의문이 들 정도로 별내신도시와 가깝습니다. 몇개로 이루어진 주차장이 있고, 안내를 받으며 편안하게... ",빈커드의 사진첩.,https://blog.naver.com/uehara0309,2021-09-08
남양주 데이트코스 한정식목향원수요미식회나온집,https://blog.naver.com/kimgufriend?Redirect=Log&logNo=222272513465,곳이목향원들어는 봤던 곳인데... 어딘가..했더니... 예전에 많이 지나가던 곳이더라구요 그래도 일단 검색창에목향원 에 대한 간단한 위치와 리뷰를 확인을 했더니..블로거들의 글만.... 저만 그런가요.... ,맛집가고 등산가고,https://blog.naver.com/kimgufriend,2021-03-12
남양주 한정식 맛집목향원점심 냠냠 기분 전환하러 간... ,https://blog.naver.com/ifree20?Redirect=Log&logNo=222532212425, 목향원 은 여러 방송에서 소개된 이미 유명한 맛집이었다. 수요미식회는 물론이고 드라마 촬영까지... 아무것도 없을 것 같은 산속에 음식점이 몇 개 있었는데목향원 만 가게 앞에 장사진을 이루었다. 주차장이... ,즐거운 일상 엽서 모으기 ^_^,https://blog.naver.com/ifree20,2021-10-09
남양주 별내맛집목향원/ 남양주 쌈밥,https://blog.naver.com/1134sin?Redirect=Log&logNo=222482838766,"안녕하세요 연입니다:) 전부터 가보고 싶었던 쌈밥집중에 하나인 별내맛집목향원 에 다녀왔어요 요즘 쌈밥이 너무 맛있어서 쌈밥집을 찾아다니는데, 생각나서 다녀왔던목향원 이에요 산 위쪽?에 있어서 뷰도... ",일상,https://blog.naver.com/1134sin,2021-08-24
남양주 별내 맛집⎪ 목향원유기농석쇠불고기 쌈밥정식,https://blog.naver.com/hana8210?Redirect=Log&logNo=222455207460,"남양주 별내에 방문하면서 별내 맛집이라는목향원 에 방문했다. D선배가 추천해서 같이 갔는데, 역시나... 그리고 등장한 밑반찬과 석쇠불고기목향원 의 밥이 좀 독특했는데 우선 밥공기가 아닌 접시에 밥이... ",새벽달 blog,https://blog.naver.com/hana8210,2021-08-03
남양주목향원부모님과 식사 산책하기 좋은 쌈밥집,https://blog.naver.com/gjskrj?Redirect=Log&logNo=222325004713,"상계동에서 정말 조금만 가면 나오는 #남양주 목향원#남양주맛집 으로 유명해서 평소 항상 웨이팅도... # 목향원메뉴는 딱 한개 석쇠불고기 쌈밥정식 1인16,000원입니다. 유기농으로 농장에서 재배한 쌈채소를... ",아쿠아블로그:소소하고도 화려한이야기,https://blog.naver.com/gjskrj,2021-05-07
서울 근교 남양주맛집::7년만에 다시 방문한목향원 (F.... ,https://blog.naver.com/llleyj?Redirect=Log&logNo=222257925726,#내사랑 나비부인 촬영장소 나의 20대에 방문했던 석쇠불고기 맛집목향원 을 같은 멤버와 7년만에... 내가 아는목향원 은 그 옛날 SBS 내사랑 나비부인 드라마 촬영장소로 알게 됐는데 이미 많은 매스컴에 소개 된... ,말이야 염방구야!,https://blog.naver.com/llleyj,2021-02-26
남양주목향원 ,https://blog.naver.com/soeyoung1004?Redirect=Log&logNo=222041180844,방문했던목향원 은 근처 흥국사라는 절이 있어서 겸사겸사 방문했다가 식사를 하러 이동했습니다. 사찰과 거의 맞붙어 있는곳이라 1분정도 밖에 걸리지 않았어요. *가시는길 전화 및 문의 : 031-527-2255 주소: 경기... ,UR:)서영이의 패션 블로그♡,https://blog.naver.com/soeyoung1004,2020-07-25
유기농쌈밥집 남양주 맛집목향원 ,https://blog.naver.com/marrynut?Redirect=Log&logNo=222514281741,"드라이브겸 바람 쐴꼄 방문한 남양주목향원수요 미식회, 다양한 프로그램에 소개된 맛집이라고 함 올라오는 길이 많이 비좁아서 차들이 줄서있음 주차장 넓고 손님들이 많지만 회전률이 높아서 그런지... ","햇살 가득, 행복한 하루",https://blog.naver.com/marrynut,2021-09-23
남양주시 맛집목향원평일 웨이팅 없이 식사,https://blog.naver.com/lovesyu90?Redirect=Log&logNo=222537880885,"오늘은 남양주시 맛집목향원 에 다녀왔다 4월달인가 방문했을 땐 웨이팅이 있었는데 금요일 12:30... 한다목향원 은 4번째 방문인데, 자꾸 오게 되는 이유 중 하나가 풍경이 뮈쵸따 멋진 산과 전통적인... ",김옥수일상,https://blog.naver.com/lovesyu90,2021-10-15
별내 맛집 우렁쌈밥목향원석쇠불고기 쌈밥 메뉴 하나로... ,https://blog.naver.com/dog6420?Redirect=Log&logNo=222263326728,"남양주 별내에 위치해 있는목향원 으로 향했습니다! 주차장은 굉장히 넓어요! 제 1,2,3 주차장 정도 크게 크게 있어서 주차 걱정은 크게 안하셔도 됩니다! 남양주 별내 석쇠 불고기 쌈밥 대표 맛집목향원목향원 ... ",찌니공간,https://blog.naver.com/dog6420,2021-03-03
남양주목향원유기농석쇠불고기쌈밥 솔직 후기,https://blog.naver.com/bih931128?Redirect=Log&logNo=222292400625,"남양주목향원유기농석쇠불고기쌈밥 솔직 후기 남양주목향원다녀옴! 다녀온지는 좀 되었지만,, ㅎㅎ 요즘 블로그를 너무 소홀해버렸다.. ㅎㅎ 남양주목향원 은 내사랑 나비부인 촬영지로도 유명한곳인데... ",지나망고,https://blog.naver.com/bih931128,2021-03-30
"남양주목향원 , 수요미식회 쌈밥 맛집",https://blog.naver.com/5yjs2?Redirect=Log&logNo=222308150690,지인 추천으로 가게된목향원알고보니 수요미식회에도 나왔던 곳이더라구요. (수요미식회 꽤나 신뢰하는편ㅋ.ㅋ) 주말에 방문했을 당시 사람들이 정말 많았어요.. 무려 40분 대기했음 ㅠㅠ목향원메뉴판... ,"오모찌 일상담기,",https://blog.naver.com/5yjs2,2021-04-13
