title,link,description,bloggername,bloggerlink,postdate
남양주데이트 수요미식회맛집 뷰 좋은목향원 ,https://blog.naver.com/queenyjw?Redirect=Log&logNo=222430726390,저희가 방문한 남양주 쌈밥 맛집목향원 식당 외관이구요~!! 수요미식회에 소개되었을 뿐 아니라 주말드라마 촬영지로도 나왔대요!! 까페와 함께하는목향원단지? 뷰 클라쓰입니다아랫쪽에 새로운 건물이... ,g1e의 데일리 로그~♥,https://blog.naver.com/queenyjw,2021-07-13
"남양주목향원 , 건강하고 든든한 석쇠불고기 쌈밥으로 한 끼 해결",https://blog.naver.com/kickoff20?Redirect=Log&logNo=222537298111,"동생 류형사의 생일, 아내와 동생과 함께 찾은 남양주목향원 . 남양주 맛집을 찾으면 빠지지 않는 곳이다. 남양주목향원 에서 든든하고 건강한 한 끼 해결한 후기 시작,목향원매일 10:30 - 24:00 연중무휴 / 주차... ","류테디의 캠핑, 여행",https://blog.naver.com/kickoff20,2021-10-15
"[남양주 맛집] 수요미식회, 직화 불고기 쌈밥목향원 ",https://blog.naver.com/pakseeun?Redirect=Log&logNo=222145662194,"남양주 별내, 수락산 자락 산속 맛집 직화불고기 쌈밥목향원오픈 시간 11시에 맞춰 갔는데, 벌써 주차장 한 곳은 만차.목향원 은 주차공간이 넓어 주차 걱정은 없지만, 일찍 서두르는 게 좋은 맛집입니다.... ",세은파파의 탐구생활,https://blog.naver.com/pakseeun,2020-11-16
2021.04.10 경기 남양주 쌈밥 한정식목향원 ,https://blog.naver.com/ayoomi?Redirect=Log&logNo=222446018957,"비루개에서 나온 우린 근처 저녁을 먹을 만한 곳을 찾다 멀지 않은 곳에 # 목향원이라는 곳을 선택한다. 비루개에서목향원 까지는 차로 대략 20여분 걸렸던 것 같다. 주차장에서 내려가는 길, 이름만큼 옛냄새... ",Record for memory,https://blog.naver.com/ayoomi,2021-07-26
"[남양주맛집]목향원 , 수요미식회 찐후기",https://blog.naver.com/cuteewe?Redirect=Log&logNo=222434127545,"제가 처음 서울 근교의 식당을 알아보다가목향원 에 반해서 꼭 가야겠다! 하고 마음먹은 건 어느...목향원경기 남양주시 덕릉로1071번길 34-11 031-527-2255 10:30~24:00 연중 무휴 그래서, 가기 전날까지 내내 마음으로... ",불량간호사_화초에 노래 불러주는 여자,https://blog.naver.com/cuteewe,2021-07-17
남양주 맛집 ' 목향원 ' / 예쁜 '까페소유',https://blog.naver.com/pureok1004?Redirect=Log&logNo=222490815561,"::: Tasty food ::: 남양주 맛집 ' 목향원 ' 이미 너무 유명한 남양주 맛집 ' 목향원 ' , 서울 근교의 멀지 않고 산새 좋은 곳에 자리하고 있어 어르신들도 모시면 좋을 맛집이에요. 벌써 3~4번은 방문하고 맛을 못 잊어... ",딱콩하우스 ˁ῁̬ˀ,https://blog.naver.com/pureok1004,2021-08-31
남양주 괜찮은 쌈밥이 고프면....목향원 ,https://blog.naver.com/nina0305?Redirect=Log&logNo=222420048010, 목향원 입니다 남양주 청학리에서 상계동 쪽으로 넘어가는 고갯마루 입구에 위치해 있어요 너무나... 식사 후 마당 옆 벤치에 앉아서 망중한을 즐기다가 왔네요 몸과 맘을 위한 휴식을 즐기고 싶다면 ...목향원 ,생의 한가운데 니나의 공간,https://blog.naver.com/nina0305,2021-07-04
[ 일상/맛집 ] 남양주목향원 ,https://blog.naver.com/yun4648?Redirect=Log&logNo=222346182953, 목향원am11:00 - pm24:00 (연중무휴) 주차 가능 토요일 저녁에 남양주에 유명한목향원 에 다녀왔습니다. 남양주 맛집으로 검색하면 엄청 많이 나오는 석쇠불고기 음식점입니다! 수요미식회에도 나왔다고 하니 더... ,lovelggom,https://blog.naver.com/yun4648,2021-05-11
남양주 비바무역/목향원 ,https://blog.naver.com/jinigogo?Redirect=Log&logNo=222508053196,맛집검색 # 목향원분위기는 괜찮았다 사람도 되게 많았고 메뉴는 쌈밥 딱 하나뿐이다 삼색밥이... 음식대비 비싸다!목향원내려오는 길에 카페 뜰로뜰로 였나? 시원하게 커피마시고 다시 집으로 ㅋㅋ 끝,즐거운 사는거 노는거 먹는거,https://blog.naver.com/jinigogo,2021-09-16
남양주맛집 수요미식회목향원 에서 주말브런치,https://blog.naver.com/ohmyjudy?Redirect=Log&logNo=222171419227,주말브런치를 남양주맛집 수요미식회에 출연했던목향원 에서 하기로 했답니다. 오픈시간이 오전 11시라...목향원 까페에서 커피한잔 데꾸와선 모닥불 연기 속에 햇빛을 맘껏 쪼였던 날.... 공기 좋은 데이트... ,도시로 가다.,https://blog.naver.com/ohmyjudy,2020-12-12
"+먹고 놀러다녔던 어느날들의 기록_남양주목향원 ,별내... ",https://blog.naver.com/babykkakkung?Redirect=Log&logNo=222416255539,"+먹고 놀러다녔던 어느날들의 기록_ 남양주목향원 ,별내 마담파이, 처음배웠던 마카롱클래스 실패 예전에 갔었던 남양주목향원 . 삼색 동그란 밥이 귀여웠었지.. 지금은 수요미식회까지 나와서 더 유명해진... ",♥Life is CooL♥,https://blog.naver.com/babykkakkung,2021-07-01
"남양주 맛집, 수요미식회에도 나온목향원 ",https://blog.naver.com/aprokk2?Redirect=Log&logNo=222105234043,유명한목향원으로 정하고 점심을 먹으러 다녀왔어요. 보시다시피 주차장이 워낙 넓고...목향원카페도 새로 생겨서 대기 시간 동안이나 식사를 끝마친 후 커피를 즐기시는 분들도 많이 보이더라고요. 이런... ,(주)맘편한심리상담센터,https://blog.naver.com/aprokk2,2020-10-02
남양주 수요미식회목향원추억팔이~.~,https://blog.naver.com/prayreader?Redirect=Log&logNo=222163626327,남양주 수요미식회목향원추억팔이~.~ 따뜻했던 날 다녀왔던 남양주목향원 이에용 요즘은 코로나가 무서워서 어디 나다니기가 조금은 두렵잖아요. 그래서 가고싶다~ 하는 곳 추억팔이로 한 번 올려봐요 엄청 날... ,hampton,https://blog.naver.com/prayreader,2020-12-05
남양주목향원쌈밥정식 석쇠 불고기 서울 근교 드라이브 맛집,https://blog.naver.com/prettygreen?Redirect=Log&logNo=222512660405,여행 중 시골집에 온 것 같은 수요미식회 맛집목향원나들이 겸 드라이브 코스로 좋은 곳입니다 인기... 것이목향원 의 특징 반찬 리필은 셀프 식사 후차 한 잔을 나눌 수 여유 있는 곳 눈 쌓인 겨울에 왔다가... ,소소한 일상,https://blog.naver.com/prettygreen,2021-09-21
"수요미식회 맛집, 남양주 한식집목향원 ",https://blog.naver.com/qorkdms898?Redirect=Log&logNo=222246689691,수요미식회에 나온 맛집이라길래 너무너무 와보고 싶었던목향원 ! 뭔가 자연자연한 경치에 시골... 시골 경치로 힐링했던 이 날! 한번 먹었는데 계속 생각나는 맛이에요 남양주 한식집으로목향원완전 강추해요!!,새이의 공간,https://blog.naver.com/qorkdms898,2021-02-17
"남양주목향원 , 맛집은 알아서 찾아온다",https://blog.naver.com/emilio1986?Redirect=Log&logNo=222288328520,"수요미식회에 나온 산속에 숨어있는 한정식 맛집,목향원남양주목향원주말에 서울 갔을 때 아버지가 남양주에 쌈밥정식 맛집이 있다고 해서 부모님과 차 타고 가봤다. 남양주라길래 별내 신도시 쪽인가... ",박제가 되어버린 천재를 아시오?,https://blog.naver.com/emilio1986,2021-03-26
[남양주맛집/별내맛집] 목향원 ,https://blog.naver.com/ariel6234?Redirect=Log&logNo=222478953979,#남양주맛집 #별내맛집 #쌈밥맛집 #수요미식회맛집 #뷰맛집 #교외맛집 #서울근교맛집 오랜만에 청담에서 벗어나 교외에서 밥먹자고해서 예전부터 가고싶었던 # 목향원있을것같지않은곳에 주차장이 제3까지.... ,인어공주 에리얼의 블로그입니다,https://blog.naver.com/ariel6234,2021-08-21
[남양주 맛집]목향원: 직화 불고기 쌈밥,https://blog.naver.com/zzolpantsjin?Redirect=Log&logNo=222121522748," 목향원주소 : 경기 남양주시 덕릉로1071번길 34-12 매일 11:00 - 22:00(연중무휴, 명절포함) 주차, 남/여 화장실 구분 주말에목향원 을 다녀왔다. 집에서 많이 멀지 않은 곳에 있는데 첫방문... 나 숯불 불고기 쌈밥... ",내 청춘은 찬란하고 아름답다!,https://blog.naver.com/zzolpantsjin,2020-10-20
서울 가까운 드라이브 추천 남양주 쌈밥 수요미식회 맛집목향원 ,https://blog.naver.com/irenesumi?Redirect=Log&logNo=222471975438,남양주 쌈밥정식으로 유명한 한식 맛집 # 목향원내 남자랑 엄마랑 첫 데이트 했답니다. 서울에서 멀지 않은 곳에 위치해 있고 바로 뒤 절도 있어서 더욱 운치있는 #남양주맛집 #남양주 목향원주차장이... ,"Hello, Irene :)",https://blog.naver.com/irenesumi,2021-08-16
수요미식회에 나온 남양주 맛집목향원완전 좋아용!,https://blog.naver.com/naoky0510?Redirect=Log&logNo=222173674875,유명한 ' 목향원 '을 찾았는데요. 수요미식회에 나왔다고 해서 더 찾아보지도 않고 예약을 했어요. 집에서 대충 간단히 샌드위치 몇입 먹고 와서 그런지 남양주맛집목향원 에 도착할 시간이 되니 다이아도 저도... ,리나네 일상 속으로,https://blog.naver.com/naoky0510,2020-12-14
남양주 맛집 수요미식회 추천맛집 ' 목향원 ' 쌈밥 정식 너무... ,https://blog.naver.com/tfgtfg33?Redirect=Log&logNo=222485716548,남양주 맛집목향원이용시간: 매일 10:30-24:00 연중무휴(명절포함) 남양주에 있는 맛집인 ' 목향원 '에 가보게 되었습니다. 제가 예전에 이 곳에서 먹은 적이 있었는데 오랜만에 가보게 되었어요. 저는 2번 째... ,김솔아의 이야기 SolaLife,https://blog.naver.com/tfgtfg33,2021-08-28
남양주 분위기 맛집 석쇠불고기목향원 ,https://blog.naver.com/wnsdudck0717?Redirect=Log&logNo=222139071070,하나인목향원 입니다. 맛만 있어서 될 것이 아니라 분위기와 위생 등 여러가지 항목 점수가 고르게 상위 점수를 받아야지만 얻을 수 있다는 차슐랭 가이드 별 세 개 ★★★ 를 획득(?)한목향원 은 낮보다는 저녁... ,우리를 노래하네,https://blog.naver.com/wnsdudck0717,2020-11-08
남양주 별내동 맛집목향원수요미식회 맛집,https://blog.naver.com/ksi54?Redirect=Log&logNo=222304544552,맛집목향원수요미식회 맛집 날이 좋아서인지 손님들이 잔뜩 여기도 사람이 많아서 기다리겠지만..... 남양주 별내동 맛집목향원수요미식회 맛집 맛있게 먹겠습니다 (●'◡'●) 먼저 구수하고 시원한... ,이상한 나라의 라일비,https://blog.naver.com/ksi54,2021-04-10
동백 (공작춘) /목향원 ,https://blog.naver.com/mokhyangwon?Redirect=Log&logNo=222238124678,"건강한 꽃봉오리가 하나 있습니다. 길죽한 꽃봉오리는건강합니다.목향원 의 공작춘 동백의자료사진으로우아하고 화려한 모습입니다. 포트 포함 키 , 33cm 포트 지름, 12cm 밑동 지름, 1cm 2021. 2. 9. 촬영 17,000",목 향 원,https://blog.naver.com/mokhyangwon,2021-02-09
365-54목향원 에서 비루개까지 웃었지만 슬펐던날,https://blog.naver.com/dodud714?Redirect=Log&logNo=222264270960,"하지만 흑염소를 먹어본적이 없어 쉽지 않아 좁은 음식점보다 탁트인곳을 원해목향원 으로 갔다.... 내 입맛에는목향원음식에 맞아서 갈때 마다 잘먹는다. 가격은 15000원에서 16000원이 되었고, 돼지고기만... ",Tomorrow is another day!!,https://blog.naver.com/dodud714,2021-03-04
"남양주 데이트코스 추천,목향원+ 비루개",https://blog.naver.com/eiffel?Redirect=Log&logNo=222111207360,"그 많고 많은 곳들중, 오늘 소개할 곳은목향원 과 비루개. 둘다 이름이 범상치 않죠? ^^ 최고의 쌈밥,목향원이곳은 예전에 TV 촬영지로도 나왔었다고 하네요. 언덕같은 곳에 위치하고 있어서 일단 뷰가... ",♥여행작가 조은정입니다,https://blog.naver.com/eiffel,2021-03-30
"[남양주]목향원 , 가족 모두 좋아할 쌈밥집",https://blog.naver.com/tysec11?Redirect=Log&logNo=222539327520,"부모님을 모시고 가면 너무 좋아하실 남양주 유기농 쌈밥집목향원 을 소개해 드립니다. 블로그 리뷰가... 흥극사 일주문까지 넓혀진 2,3주차장 주차장에서목향원 으로 들어가는 길목도 가을이라 너무 멋지다.... ",뫼뚜벅이,https://blog.naver.com/tysec11,2021-10-17
[남양주 맛집] 맛있는 쌈밥목향원후기,https://blog.naver.com/wltjsk12?Redirect=Log&logNo=222520845118,마당이 넓어서 가족 다같이 외식하기 딱 좋은 쌈밥 맛집목향원안녕하세요. 워니입니다. 남양주 자코모 쇼룸에서 쇼파 구경 후 뭐 먹을지 고민하다가 서니가 예전에 한번 와봤던목향원다녀왔어요. sbs... ,여행은 지자매♬,https://blog.naver.com/wltjsk12,2021-09-29
남양주 별내맛집목향원 을 다녀와서,https://blog.naver.com/jyj9997?Redirect=Log&logNo=222201556332,유기농 석쇠불고기 쌈밥정식 서울에 갑자기 눈이 내리기 시작 하는날 별내에 있는목향원 이라는... 식사도 단 한가지 석쇠불고기쌈밥정식뿐 별내목향원전경 입니다 수락산 산속에 있어 공기 좋고... ,램코투자자문,https://blog.naver.com/jyj9997,2021-01-09
"남양주 수락산 맛집 |목향원 , 돼지불고기 쌈밥정식으로... ",https://blog.naver.com/chloesjmin?Redirect=Log&logNo=222297876302,"남양주 수락산 맛집 |목향원 , 돼지불고기 쌈밥정식으로 대동단결한 벚꽃 맛집 토요일 미팅은 대체로... 수요미식회에 나올정도로 맛집인 남양주 수락산자락에 위치한목향원 은 쌈밥정식 단일메뉴라 할만큼... ",Chloe N the City,https://blog.naver.com/chloesjmin,2021-04-04
남양주목향원다녀와서 쓰는 생생한 후기,https://blog.naver.com/usedfashion?Redirect=Log&logNo=222150135045,남양주목향원음식 맛있게 먹고 왔네요! 일루젼 - illusion 안녕하세요. 오늘은 최근에 먹은 쌈밥집 중... 제가 최근에 먹었던 음식집 중에 탑으로 손꼽아도 손색이 없던목향원 이라는 곳을 다녀온 후기를... ,일루젼의 데일리룩 블로그,https://blog.naver.com/usedfashion,2020-11-21
남양주맛집목향원숯불 향 그윽한 불고기 맛 좋아,https://blog.naver.com/alice8565?Redirect=Log&logNo=222209516875,남양주목향원 은 저희집 단골 외식장소입니다. 오늘도 주말인데 어디 가기도 그렇고 그냥 바람 좀 쐴 겸 남양주맛집목향원 으로 점심 먹으러 다녀왔어요. 겨울에도 싱싱한 채소 쌈을 먹을 수 있어 오게 되는... ,감동의 순간들 !,https://blog.naver.com/alice8565,2021-01-16
[남양주맛집] 간만에 다시 찾은목향원 . 알록달록 삼색밥과... ,https://blog.naver.com/ydy7405?Redirect=Log&logNo=222266371856,간만에 찾은목향원너무 오래 집에만 있어서 답답하다는 부모님과 함께 조금 멀리 식사하러 나온 날... 오는목향원 ! 따뜻한 화로 주변에 앉아 쉴 수 있는 것도 이 집의 장점이다. 모범 납세자 수상 플랜카드... ,윤다의 날씨가 좋아서 :),https://blog.naver.com/ydy7405,2021-03-06
아로니아 모아심기 /목향원 ,https://blog.naver.com/mokhyangwon?Redirect=Log&logNo=222510202845,"손이 많이 가는목향원 의 속파기 사각화분에 심었습니다. 화분 포함 키, 70cm 화분 길이/폭, 31/10cm 근경, 10cm (제일 굵은 밑동 1.5cm) 2021. 9. 18. 촬영 190,000 1. 포트 포함 키, 60cm 포트 지름, 12cm 밑동... ",목 향 원,https://blog.naver.com/mokhyangwon,2021-09-18
애기감나무 (노아시) /목향원 ,https://blog.naver.com/mokhyangwon?Redirect=Log&logNo=222529124583,"긴 열매줄기에 매달린 애기감이 고고해 보입니다. 오래 묵은 애기감나무는목향원 의 화분에 심겼습니다. 화분 포함 키, 50cm 화분 지름, 18cm 밑동 지름, 2.5cm 2021. 10. 6. 촬영 290,000",목 향 원,https://blog.naver.com/mokhyangwon,2021-10-06
별내맛집목향원가을 숯불고기,https://blog.naver.com/myweaver?Redirect=Log&logNo=222539528185,"않지만~목향원 이라는 이름에 걸맞는 한옥 본채 2동과 별채(cafe) 그리고 마당 연못과 수목, 임야를 깎아...목향원 의 음식에 대한 레시피를 정의하자면, 한국인이 애정하는 불맛 고기, 찰진 3색밥 식사를 마친 제... ",별내좋은집부동산 [010-2481-8545],https://blog.naver.com/myweaver,2021-10-17
"21.02.20목향원 , 강서 한강공원",https://blog.naver.com/hanseul92?Redirect=Log&logNo=222274385138,의정부나 파주 크게 목적지 없이 출발해놓고 ㅅㅇ언니가 의정부에 맛있는 곳이 있다고했던게 기억나서 급 물어보고 급 목적지로 결정한 의정부 ' 목향원 ' 사람들이 많아서 대기가 오래걸릴줄 알았는데 2시가... ,suri.blog,https://blog.naver.com/hanseul92,2021-03-13
 목향원 을 오랜만에 다녀왔네요,https://blog.naver.com/storyhouse11?Redirect=Log&logNo=222135326528, 목향원오늘은 아침부터... 세한 마음에... ''' 그래도 출근은 해야지 하고 삼실에서 오전 미팅 후 에이 땡땡이칩니다 하고 간 곳이 ㅋㅋㅋㅋㅋ 낙엽 진 가을에 찾아온목향원SBS 주말드라마' 내 사랑 나비부인... ,Bravo 나나,https://blog.naver.com/storyhouse11,2020-11-04
"백동백 (프리지아꽃향, 다은향 ) /목향원 ",https://blog.naver.com/mokhyangwon?Redirect=Log&logNo=222535440951,"건강한 꽃봉오리가많습니다.목향원 의 프리지아향 백동백의자료사진으로 간결한 화형으로 새하얀 홑꽃이 향기롭게 핍니다. 포트 포함 키 , 60cm 포트 지름, 15cm 밑동 지름, 1cm 2021. 10. 11. 촬영 120,000",목 향 원,https://blog.naver.com/mokhyangwon,2021-10-13
동백 (출운향) /목향원 ,https://blog.naver.com/mokhyangwon?Redirect=Log&logNo=222534326155," 목향원출운향 동백의개화된 자료사진입니다. 오목하게 작은 분홍꽃으로 피는데 노란 꽃술도 갸름하게 생겼습니다. 포트 포함 키, 45cm 포트 지름, 12cm 밑동 지름,약0.7cm 2021. 10. 11. 촬영 17,000 포트... ",목 향 원,https://blog.naver.com/mokhyangwon,2021-10-12
남양주맛집 목향원 ,https://blog.naver.com/skymin525?Redirect=Log&logNo=222108969154,정겨운 이름을 갖고있는목향원 ~ 감탄하고 또 감탄했습니다^^ 완전 예쁜 한옥 스타일이예요!... 하고 잠깐 착각을할정도로 좋았어요~^^ㅋ목향원 은 단일메뉴이구요~ 저희 테이블에 앉자마자 바로 밑반찬들이... ,예블리옷장,https://blog.naver.com/skymin525,2020-10-07
채진목 (준베리) /목향원 ,https://blog.naver.com/mokhyangwon?Redirect=Log&logNo=222357663142,하우스안에서 자라는 채진목은 요즘에 열매가 익는데목향원동네 새들이 들어와 열매가 붉게 익으면 먹어 버려 다 익기도전에 사진을 찍었습니다. 많은 나무들 사이에서 열매도 작은데 어찌 알고... ,목 향 원,https://blog.naver.com/mokhyangwon,2021-05-19
 목향원 ,https://blog.naver.com/seung2115?Redirect=Log&logNo=222528995324, 목향원경기 남양주시 덕릉로1071번길 34-11 http://naver.me/FpXMpNXa 날씨좋은 가을날 드라이브겸 다녀오기 좋네요~ 산속에 자리하고 있어서 뷰가 너무나 좋고 예쁜 초가집에서 맛있는 쌈밥을 먹은뒤 마당... ,♡주부놀이♡,https://blog.naver.com/seung2115,2021-10-06
"남양주 맛집목향원,주말은 대기각",https://blog.naver.com/mythya0730?Redirect=Log&logNo=221273704882,지지지난 주말에 찾은목향원그때의 남양주는 아직 벚꽃이 다 지지 않았더라구요 집에서 40분정도 거리라 1년에 한두번씩은 찾는 곳이랍니다 수요미식회에도 나왔던곳이기도한 남양주목향원 은 주말에 대기... ,꿀바른 스윗햄~♡,https://blog.naver.com/mythya0730,2018-05-12
남양주 별내목향원 (한정식),https://blog.naver.com/jjumpstreet?Redirect=Log&logNo=221653374664,"남양주 별내 한정식목향원1_수요미식회등 다수의 방송에 나와 유명함, 웨이팅있음 2_한정식1인 15000원... 하고목향원 으로 내려갑니다 예쁜 한옥집? 가와집?이 눈에 띕니다 예쁘게 잘해 놓았더군요 유명한... ",J J U M P S T R E E T,https://blog.naver.com/jjumpstreet,2019-09-19
