title,link,description,bloggername,bloggerlink,postdate
끝나지않는 생일주간 :-)♪ 청담미미미가든mememi... ,https://blog.naver.com/sweeti0714?Redirect=Log&logNo=222037712825,"사고미미미가든 ♥ 들어가면 1층은 카페, 지하는 Bar인데 여기 여성전용이예요? 순도 100퍼센트 여자손님... 이러고 다같이 일어남 ㅋㅋㅋㅋㅋ 여기 유료주차장이라서 발렛안되나?하고 좀 헤맸는데 미미미에서... ",토끼는 프라다를 입는다,https://blog.naver.com/sweeti0714,2020-07-21
[청담] 핫하디핫한미미미가든에서 수다떨다왔어요~,https://blog.naver.com/mint5079?Redirect=Log&logNo=222041469568,"어느날, 황신혜님 sns를보고 여기 이쁘다 라고해서 한번 가보고싶었었는데 친구랑 갔다왔어요~^^ 원래 미미미카페는 잠실롯데백화점안에도 있거든요 그치만,미미미가든 이라고해서 청담동점에는... ",Kwanakosang,https://blog.naver.com/mint5079,2020-07-25
[衣·食·住·休의 즐거움이 있는 곳]미미미가든 ,https://blog.naver.com/grisimgroup?Redirect=Log&logNo=222083167580,"미미미의 공간에서 온전히 나만의 휴식을 즐기고, 기쁨을 누릴 수 있기를 바랍니다.” 선물 같은 시간을 보내기 위한 이들로미미미가든 은 매일 북적인다. 미미미의 새로운 과제는 공간을 넘어 콘텐츠로... ",그리심디자인그룹 건축사사무소,https://blog.naver.com/grisimgroup,2020-09-07
청담미미미 가든성수 5 to 7,https://blog.naver.com/summer15th?Redirect=Log&logNo=222369455661,+ 주말만 되면 비 내리는 궂은 날씨에도 불구하고 서비 예약으로 가게 된 요즘 힙하다는 청담미미미 가든 . 발렛이 기계식으로 된다. # 미미미가든#MeMeMiGarden 1층은 카페 지하 1층은 프라이빗 룸 지하 2층은... ,초비요정,https://blog.naver.com/summer15th,2021-05-27
청담맛집미미미가든바레스토랑 분위기 좋은 곳,https://blog.naver.com/bhnx52?Redirect=Log&logNo=222040996881,"레스토랑과 카페, 프라이빗한 라운지까지 하이엔드 FB공간 청담미미미가든레스토랑 #미미미 MeMeMi 를 처음 알게된 건 용산키친미미미였던 것 같아요 인스타그램에서 디저트 사진이 너무 예뻐서 나중에... ",아이엠그라운드,https://blog.naver.com/bhnx52,2020-07-25
청담 분위기맛집 코시국 프라이빗룸 후기[ 미미미가든 ],https://blog.naver.com/thsrudgus1?Redirect=Log&logNo=222537820394,"분위기 좋은 프라이빗 룸 레스토랑미미미가든들어서자마자 너무 예쁜 곳! 1층은 빵,커피,케익이 파는미미미가든카페에요. 1F CAFE 영업시간 : 월~일 10:00 ~ 01:00 저희는 룸을 예약해서... ",갱스생활,https://blog.naver.com/thsrudgus1,2021-10-15
청담미미미가든 ! 한예슬... 좋은 청담맛집미미미가든추천),https://blog.naver.com/demuregirl?Redirect=Log&logNo=222044001351,리스트에 등극한 청담미미미가든 을 포스팅해보겠음 mememi라서 메메미 로 읽어야 할 것 같지만미미미 가든이라는 점! 청담에 새로 지어진지 얼마 안 된 카페레스토랑편집샵 모두 올인원 느낌으로... ,오늘도 제시하다,https://blog.naver.com/demuregirl,2020-07-28
[청담미미미 (MEMEMI)가든 ] 이탈리아 음식_분위기 좋은... ,https://blog.naver.com/motifdefleur?Redirect=Log&logNo=222535951978,레스토랑 미미미(MEMEMI) 가든에 다녀왔어요~! 특별한 기념일이나 데이트 하실 때 청담미미미 가든다녀오시면 좋을 것 같아요 : ) 최소 하루 전에 네이버예약전화예약 02-518-8765 하고 가세요!~ 저희는... ,"뷰티,취미,여행,맛집 등 일상을 담은 정보공유",https://blog.naver.com/motifdefleur,2021-10-13
걸스토크 청담미미미가든 카페 (내돈내먹),https://blog.naver.com/haein_b?Redirect=Log&logNo=222044341258,하고 미미미 커피 맛이 궁금하여 샤케라또를 주문했어요 적당히 달달해서 괜찮았어요 잔만 들고 있으면 생수든 커피든 뭔들is 짠하기미미미가든 카페 라는 이름답게 가든을 연상케 하는 소품과 인테리어가... ,GIRLS TALK,https://blog.naver.com/haein_b,2020-07-28
청담미미미가든:: 분위기 좋은 청담 레스토랑 (잭슨비 뮤비... ,https://blog.naver.com/lovyeun93?Redirect=Log&logNo=222287313398,압구정에서 분위기좋은 레스토랑 이나 카페를 찾으신다면미미미가든강추합니다아아 !! 미리예약하고 방문하시면 더 편하게 이용할수 있는것 같음 ! 다음에는 미미미카페 이용하러 다시와야지 _ 그럼 20000,니꾸 니꾸 채니꾸,https://blog.naver.com/lovyeun93,2021-03-25
전참시비 Magnetic 뮤직비디오 촬영 장소미미미가든 ... ,https://blog.naver.com/gloyk91?Redirect=Log&logNo=222283948334,비 Magnetic 뮤직비디오 촬영장으로 등장한미미미가든 ! 그리고 잭슨이 전참시에서 감동한 애프터는 티세트를 이곳에서 즐기게 되었습니다. 브런치부터 쁘띠 디저트 그리고 베이커리로 구성된 카페 미미미의... ,GLOYK - 끌로의 패션 & 뷰티 블로그,https://blog.naver.com/gloyk91,2021-03-22
청담 망고빙수 맛집미미미 가든핫플 이유 있네요!,https://blog.naver.com/hambak88?Redirect=Log&logNo=222421581754,청담 망고빙수 맛집미미미 가든핫플 이유 있네요! 안녕하세요 함박입니다! 무더위가 시작된지 좀... 맛집미미미 가든 이랍니다!미미미 가든 의 망고빙수는 2019년인 작년에 출시했는데 굉장히 핫했죠!! 네이버에... ,함박,https://blog.naver.com/hambak88,2021-07-06
청담미미미가든카페/ 압구정 카페 도산대로 카페,https://blog.naver.com/zeongo?Redirect=Log&logNo=222512336128,압구정 로데오에서 조금만 벗어나도 카페가 없다 뭔지 모를 특이한 외관의미미미 가든 카페... 좋았음미미미가든카페 메뉴미미미가든카페 가격 Previous image Next image Previous image Next image Previous image... ,떡볶이 고?,https://blog.naver.com/zeongo,2021-09-21
[일상]미미미가든 에서 청첩장... ㅣ 청담회장님댁 ㅣ 미미가든,https://blog.naver.com/dl4157?Redirect=Log&logNo=222535437632,이었어요미미미가든미가 3개라... 자꾸 미미가든을 쳐서 처음엔 못찾았는데 왠지 강남구의 상징이 memewe라 미미위-미미미 가 된 것 같기도 하고 (쓸데없는 추측을 좋아하는 ENTJ ) 아무튼미미미가든 은... ,챰미씨,https://blog.naver.com/dl4157,2021-10-13
청담미미미가든/미미미가든룸 / 청담동 카페 / 청담 파티룸... ,https://blog.naver.com/ysbestrong?Redirect=Log&logNo=222046233468,청담동미미미가든 !! 지하2층/지하1층/지상1층 세개층으로 이루어져있어용! 지하2층은 식사를 할수있는... 너무 고급진 실내~~~ 밑에 지하2층이 보이네용 지하2층과 지하1층은 복층느낌이에요 미미미 시그니쳐인... ,순수청담 예산 부원장,https://blog.naver.com/ysbestrong,2020-07-30
"38000원짜리 망고 빙수, 청담동미미미 가든카페",https://blog.naver.com/hyedoii?Redirect=Log&logNo=222539551334,돌아다니면서 목도 마르고 더워져서 갑자기 빙수 먹고 싶다고 검색해서 들어간 곳 미미미 카페 가든. 아니 근데 네이버 빙수 맛집 검색하면 빙수가 맛있는미미미가든뜨고 카페 뭐 이런 식으로 검색하면 또... ,박참새 방앗간,https://blog.naver.com/hyedoii,2021-10-17
"청담미미미가든, 청담레스토랑 , 압구정맛집 , 가로수길맛집... ",https://blog.naver.com/eunjin9096?Redirect=Log&logNo=222533921851,#청담맛집 #청담 미미미가든#청담레스토랑 #압구정맛집 #데이트코스 #서울맛집 #생일파티 청담 미미미가든 에서 생일파티를 했다. 쉬는날 한시반에 예약을하고 갔다. B2층에 위치해 있어서 엘레베이터를 타고... ,행복한 일상기록,https://blog.naver.com/eunjin9096,2021-10-11
청담미미미가든케이크 하나로 연말분위기 최고 ♥,https://blog.naver.com/peony_blossom?Redirect=Log&logNo=222175853402,랜덤박스인 미미미레드박스라니 u_u 넘나 궁금해지는 것 ! 분위기 좋은 청담 펜트하우스에 오이스터플래터 그리고 모엣샹동과 예쁘고 맛있는미미미가든케이크 그리고 랜덤박스까지 신나는 연말이 될 것... ,＊데일리 메모리즈＊,https://blog.naver.com/peony_blossom,2020-12-17
청담 크리스마스케이크미미미가든 에서 골랐찌,https://blog.naver.com/hong_blossom?Redirect=Log&logNo=222178790233,"부모님도 잘 드셔서 기분 최고,,미미미가든 에서 테이크아웃한 청담 크리스마스케이크로 따뜻한 연말 분위기 내기 성공이에요♀️ #미미미 # 미미미가든#미미미케이크 #청담케이크 #청담베이커리... ",Have a Maynine Day,https://blog.naver.com/hong_blossom,2020-12-19
청담 레스토랑미미미가든 에서 연말 데이트 즐기기!,https://blog.naver.com/cha_23?Redirect=Log&logNo=222187718678,차수리미에요~ 오늘은 연말 데이트로 청담미미미가든 에서 즐기고 온 후기를 들려드리려고 해요. 다들... 위해 미미미 굿즈가 담긴 레드 럭키 박스가 있다고 하니 참고하시면 좋을 것 같아요! 경제적으로는 힘든... ,유튜버 차수리미 V-Blog,https://blog.naver.com/cha_23,2020-12-28
감각적이었던 청담 맛집미미미 가든 에서 기분전환,https://blog.naver.com/sweetysomi?Redirect=Log&logNo=222432392960,"건물은 3층까지 있고, 여기는 1층 미미미 카페임 미미미는 가든과 카페, 키친으로 나뉘어져 있는 아트테인먼트이다.미미미 가든카페 곳곳에 예쁜 소품, 굿즈까지 예쁘게 매치 해놓아서 감탄이 절로 나옴..... ",이로운 세무회계 컨설팅,https://blog.naver.com/sweetysomi,2021-07-15
"청담동 카페 디저트 맛집미미미가든 , 사진 찍기 좋은 분위기... ",https://blog.naver.com/2ndtori?Redirect=Log&logNo=222097543454,♡ 미미미카페는 많이 가봐서 분위기 알고 있었는데미미미가든 은 조금 더 고급스러운 분위기였어요 정말 SNS 사진 각!!! 안 찍을 수 없더라고요 ㅋㅋㅋ 컬러를 적절하게 사용했는데 세련된 느낌!! 천장에 크게... ,뷰스타::류니크 뷰티 ::,https://blog.naver.com/2ndtori,2020-09-23
청담카페미미미가든비쥬얼 장난아닌 빙수맛집!,https://blog.naver.com/hwanghwoo?Redirect=Log&logNo=222042570621,바로 미미미카든 카페랍니다. :) 압구정로데오역 근처에 있어용! 강남구청역에서 영동고등학교 방향으로 쭈우우욱 내려가도 쉽게 찾아갈 수 있는 곳이랍니다. 청담미미미가든카페는 1층인데요! 매장 안으로... ,뷰티패션블로거 귀톨이,https://blog.naver.com/hwanghwoo,2020-07-26
청담 맛집미미미 가든 에서 데이트/파티 즐겨요~!,https://blog.naver.com/dkfhadlclsrn?Redirect=Log&logNo=221972718370,음식도 미미미MD가 제시하는 전 세계에서 공수한 식재료/라이프스타일 제품들도 만나볼 수 있다고 하네요 ㅋㅋ 그럼 이어서미미미 가든파빌리온으로 내려가볼까요? 지하 1층인미미미 가든파빌리온은 총... ,일치의 소소한 일상 블로그,https://blog.naver.com/dkfhadlclsrn,2020-05-21
청담동미미미가든 ,https://blog.naver.com/jiyoung_0322?Redirect=Log&logNo=222144951483,그렇게 방문하게 된 청담동의미미미가든저는 잘 몰랐는데 비의 유튜브에 나왔던 곳이라고 해요. 파스타 맛집이라고 소개를 했었었나봐요. 입구에서 QR체크인을 진행한 후 지하로 안내받았어요. 주차는 세시간... ,틈틈이 끄적이는 나의 공간,https://blog.naver.com/jiyoung_0322,2020-11-15
청담동 카페미미미 가든카페 인테리어 예쁜 곳,https://blog.naver.com/misha03?Redirect=Log&logNo=222337047153,가든카페 이름답게 정말 노랗게 예쁜 가든에 들어온 기분이 드는 청담동 카페미미미 가든카페. 베이커리가 예쁘게 전시되어 있었어요. 호텔 카페처럼 애프터눈 티 세트가 있었어요. 애프터눈 티 세트... ,Ideassam,https://blog.naver.com/misha03,2021-05-04
청담] 미미미 가든 _화려한 장식이 나를 감싸고~,https://blog.naver.com/nwkco?Redirect=Log&logNo=222285611560,# 미미미가든바비 인형의 집같은 화려한 곳 ㅎㅎ 그냥 사진 한장 보고 갔는데 생각보다 좋았다.... 친절하시고 주차도 가능한 만족스러운미미미 가든# 미미미가든# 미미미가든 카페 # 미미미가든 청담 #청담동맛집,뽈뽈뽈's 세상구경,https://blog.naver.com/nwkco,2021-03-24
비 잭슨 뮤직비디오 촬영지 청담미미미 가든 ,https://blog.naver.com/hshyun0602?Redirect=Log&logNo=222274148880,#잭슨 # 미미미가든비 잭슨 뮤직비디오 촬영지 글 브로디 / 사진 전참시 캡처 저번주 전지적 참견... 요기잉네 비 잭슨 뮤직비디오 촬영지 청담미미미 가든02-518-8765 운영시간 매일 11:00 - 2:00 비 잭슨... ,브리랜서 브로디,https://blog.naver.com/hshyun0602,2021-03-13
"산책, 청담동미미미 가든 에서 생일 : )",https://blog.naver.com/loveherscent?Redirect=Log&logNo=222528051467,"생일미미미 가든 에서 들어가기 전에 사진을 백장 찍음. 자기야 미안해! ㅎㅎㅎㅎㅎㅎㅎ 지금까지...미미미 가든음식은 크게 맛있지 않아서, 콩국수 사먹음 #내서타일 ㅎㅎㅎ #행복했음 #고마워 #내사랑 #내생일... ","그래서 반드시 행복해야 하는 것,",https://blog.naver.com/loveherscent,2021-10-06
"청담미미미가든, 쨍하니 예쁜 분위기 빵 맛집",https://blog.naver.com/yeeneeworld?Redirect=Log&logNo=222335408486,"청담미미미가든, 쨍하니 예쁜 분위기 빵 맛집 안녕하세요 #이니월드 입니다. 쨍하니 예쁜 #커피숍 #청담 # 미미미가든무엇보다 저 #도산공원 이라는 돌 #수성못 생각나서 찍었다며 ㅎㅎ #회장님댁 과 굉장히... ",이니월드 YEENEEWORLD,https://blog.naver.com/yeeneeworld,2021-05-04
"[청담동]미미미 가든 , mememi",https://blog.naver.com/loveherscent?Redirect=Log&logNo=222528012337," 미미미 가든 은 1층에 베이커리 카페가 있었고, 2층에 레스토랑이 있었다. 1층 카페에 좋아하는... #청담동맛집 #청담동미미미카페 1층은 보기만 해도 사랑스럽고 깜찍한 분위기로 꾸며져있었다. 들어가는 입구.... ","그래서 반드시 행복해야 하는 것,",https://blog.naver.com/loveherscent,2021-10-06
[청담]미미미 가든mememi,https://blog.naver.com/tufutufu15?Redirect=Log&logNo=222527534911,급하게 축하할일이 생겨서 케이크 사러 무작정 들어간 곳 #청담 미미미가든귀여운 에프터눈티세트가 입구부터 인상적이다 나의 목적은 #홀케이크 한눈에 들어온 #무화과케이크 다른것도 두바퀴 꼼꼼히... ,세상의 모든 이야기,https://blog.naver.com/tufutufu15,2021-10-05
 미미미가든카페 MeMeMi Cafe 청담동 디저트 도산대로... ,https://blog.naver.com/ny_blossom?Redirect=Log&logNo=222532269911,"청담동 도산대로미미미 가든카페 mememi Cafe 미미미 건물 1층은 디저트카페, 지하는미미미가든레스토랑이다 예쁜 디저트류를 많이팔아서 작은선물사기에 좋음 주차장에서 건물 입구 가는길... ",34번가의 기적,https://blog.naver.com/ny_blossom,2021-10-10
친구들과 연말 모임_청담 핫플미미미가든 ,https://blog.naver.com/l_eeej?Redirect=Log&logNo=222151222742,# 미미미가든#청담맛집 그래도 만날 때는 핫플에 가자며 호들갑 떨고 정한 곳. 예약하지 않아서 예쁜(사진 잘 나오는) 곳에 앉지는 못했지만 조용하니 아늑한 분위기가 좋았다. 곧 계란 한 판 이라고 특별히... ,"퇴사하고싶지만, 돈은 벌고싶어",https://blog.naver.com/l_eeej,2020-11-22
청담 이탈리아 음식미미미가든/ 청담 레스토랑 mememi... ,https://blog.naver.com/sora6871?Redirect=Log&logNo=222526982568,안녕하세요~ 블린이쏘쏘예요~ 오늘은 청담에 위치한 예쁘고 고급스러운 이탈리안 레스토랑미미미가든 (mememi garden) 포스팅입니다~ 입구입니다ㅎㅎ 들어가면 먼저 1층엔미미미가든카페가 나와요~ mememi garden... ,쏘쏘의 소소한일상&맛집&여행기록♡,https://blog.naver.com/sora6871,2021-10-05
청담 맛집 |미미미 가든 ,https://blog.naver.com/ungsblue?Redirect=Log&logNo=222181292238, 미미미 가든 은 미미미 카페와 함께 같은 건물에 위치를 하고 있으며 감각적인 인테리어 덕분에 사람들에게 반응이 괜찮은 곳.미미미 가든주소 : 서울시 강남구 도산대로 417 전화 : 0507-1387-8765 영업시간... ,크리에이티브를 위한 축적의 시간,https://blog.naver.com/ungsblue,2020-12-22
청담 신상카페 mememi / 색감깡페카페미미미가든 ,https://blog.naver.com/cherry2309?Redirect=Log&logNo=222016858232," 미미미가든청담 이에요! 사진보고 우와 색감보소? 엄청 화려한데 촌스럽지 않게 컬러를 잘썼다는 후기를 보고 바로 고고고!! 뭔가 노랑, 파랑, 핑크에 초록 식물들까지 진짜 쨍! 한 컬러감임데 하나도... ",여니의 행복한 일상♥️,https://blog.naver.com/cherry2309,2020-06-30
촬영 장소! 전참시 노출된미미미가든청담점 방문기,https://blog.naver.com/lol_999?Redirect=Log&logNo=222283937959,셀럽들의 놀이터라고 불리는미미미가든청담점 요즘 청담동에 세상 핫한 카페레스토랑이 생겼다는... 비(RAIN) Magnetic 뮤직비디오 촬영 장소인미미미가든 ! 로마네스크 양식이 떠오르는 아치 글라스에... ,쁜소월드,https://blog.naver.com/lol_999,2021-03-22
청담미미미가든카페 메뉴 가격,https://blog.naver.com/pretty11yo?Redirect=Log&logNo=222530247190,기록을 안하면 확실히 기억을 잘 못하는 편이라...ㅋㅋ 청담미미미가든카페 메뉴 가격 청담미미미가든카페 메뉴 가격 애프터눈티 세트도 있고 케익 주문 가능 예쁜 빵들듀 많이 있었지만 우리는 아점 먹고... ,♡판타스틱율로그♡패션 뷰티 여행블로거,https://blog.naver.com/pretty11yo,2021-10-07
맛집인가.46 청담미미미 가든 mememi,https://blog.naver.com/maniju90?Redirect=Log&logNo=222321810852,끝 다 먹고 위에 미미미카페에서 디저트 꼭 드시길ㅋ 특히 흑임자파운드~~ 흑임자좋아하시는 분들은 정말 좋아할 맛임 ㅠㅠ 최고!! #은수맛집 #청담맛집 #청담파스타 #청담리조또 #청담디저트맛집 # 미미미가든 ,짝은먹보의 일기,https://blog.naver.com/maniju90,2021-04-24
 미미미 가든 ,https://blog.naver.com/vmfkek2000?Redirect=Log&logNo=222251862921,지하는 식당 일층은 카페로 운영되고 있는미미미 가든늘 지나가면서 한번 가봐야지 하고 생각했던 곳인데 드디어 방문해봤어요. 너무나 멋진 상들리에가~~ 분위기는 참 좋아요 맛없을수 없는 부라타 샐러드... ,사랑이의 오글오글,https://blog.naver.com/vmfkek2000,2021-02-22
청담 디저트 카페 ::미미미가든 ,https://blog.naver.com/2hanimini?Redirect=Log&logNo=222154252085,예쁜 곳에서 예쁜 디저트 먹기 카페미미미 매일 10:00 - 01:00 메메미 아니고 미미미거든~! Delicious!! 한예슬언니 추천 핫플! 디저트가 맛있는미미미가든♥ 그나저나 이 언니는 진심 존예 청담동 도산대로... ,꽃하니 blog,https://blog.naver.com/2hanimini,2020-11-27
[청담맛집] 미미미가든식사 후기,https://blog.naver.com/ssel_?Redirect=Log&logNo=222482445857,다녀온지 조금- 된미미미가든후기에요! 전에 망고빙수가 맛있어서 방문했었는데 디저트 메뉴는 보니... ღ’ᴗ’ღ 인테리어도 예쁘고 분위기도 너무 좋은데 요리까지 맛있는미미미가든후기였어요... ,SERI Diary,https://blog.naver.com/ssel_,2021-08-24
청담동미미미가든눈과 입이 즐거운 곳,https://blog.naver.com/bewealthy111?Redirect=Log&logNo=222507283005,"8월, 친구들과 생일파티를 위해 다녀왔던 청담동미미미가든^^ 좋았던 이 곳의 추억을 늦게나마 블로그에 기록하기로 했다. 청담동미미미가든 으로 가는 길. 눈길이 가던 강남 교보문고. 계절 마다 바뀌는... ",공인중개사 이시연,https://blog.naver.com/bewealthy111,2021-09-16
여름에 더 좋은 청담카페미미미가든 ,https://blog.naver.com/leekoo0904?Redirect=Log&logNo=222462661613,"여름에 더 좋은 청담카페미미미가든 나는요~ 노란색 참 좋아해요~ 청담 가면 늘 가는 곳만 가는데 요즈음은미미미가든 을 애정하쥬~코로나가 얼른 종식되어야 더 신나게 즐길텐데... 언제 꺼지니, 코로나야!!!!! 아... ","소소함속의 특별함, leekoo-♡",https://blog.naver.com/leekoo0904,2021-08-09
도산대로 카페:미미미가든 카페,https://blog.naver.com/jhj8637?Redirect=Log&logNo=222329352442,청담동 도산대로 카페:미미미가든 (mememi GARDEN) 압구정로데오 근처 도산대로에 있는 예쁜 카페!미미미가든카페 정보! 주소: 서울 강남구 도산대로 417 1층 연락처: 02-514-8765 영업시간: 매일 10:00... ,다락방 - my little corner of the world,https://blog.naver.com/jhj8637,2021-10-20
