title,link,description,bloggername,bloggerlink,postdate
청담동카페미미미가든분위기 좋은 곳에서 달달한 디저트를!,https://blog.naver.com/ppoby1004?Redirect=Log&logNo=222092470354,청담미미미가든 입니다. 자세한 위치는 지도를 참고해주세요. B1~2층에는 바레스토랑도 함께 운영 중인... 들어가자마자 너무 예쁜 인테리어에 놀랐던미미미가든 이에요. 화려한 색감에 둘러보는 재미가... ,꿈사탕의효능,https://blog.naver.com/ppoby1004,2020-09-17
청담동 카페미미미가든핫플 다녀오다! 맛분위기 리뷰,https://blog.naver.com/yunamaro?Redirect=Log&logNo=222100649197,청담 카페미미미가든mememi GARDEN 청담동에는 분위기 좋고 세련된 카페들이 숨어있어서 카페투어 하러... 도산대로 쪽에 지나다니다가 봤던 청담미미미가든 ! 워낙 눈에 딱 보이기 쉬운 위치인지라 오고 가고... ,오늘의 여행♩,https://blog.naver.com/yunamaro,2020-09-27
 미미미가든: 분위기 좋은 청담 레스토랑,https://blog.naver.com/chic-amy?Redirect=Log&logNo=222180071238," 미미미가든: 분위기 좋은 청담 레스토랑 2주전쯤 오후 반차 쓰고 일찍 퇴근했던 날, 친구랑 오랜만에... 요즘은 밖에서 9시까지밖에 못 있으니까 사람 없을 때 일찍 만나서 먹고미미미가든 이라고 하는... ",모네로그 : 일상을 그리다,https://blog.naver.com/chic-amy,2020-12-20
청담카페미미미가든시원 달콤한 애플망고빙수,https://blog.naver.com/hhhrrr33?Redirect=Log&logNo=222034328317,청담카페미미미가든 . 그리고 여기 완전 빙수맛집 *_* 청담데이트 장소로도 추천한다. 애플망고빙수 맛 보러 청담동카페 미미미 go go ♩※ 본 포스팅은 업체로부터 제공받아 직접 방문 후 솔직하게 작성된... ,"Love the Life You Live, Live the Life You Love.",https://blog.naver.com/hhhrrr33,2020-07-18
"청담 카페 ,미미미가든 ",https://blog.naver.com/snowrun?Redirect=Log&logNo=222363935968,며칠 전 청담 카페미미미가든(mememi garden) 을 다녀왔는데 마음에 쏙 들었어용 *_* 이 근처는 동네라... 저는 에이드 메뉴에 있는 플로팅가든을 마시기로 했어요. 친구는 건강을 생각해서(?) 클렌징주스를... ,핸잉이의 하늘꿈_,https://blog.naver.com/snowrun,2021-05-24
청담 맛집 : 분위기 좋은미미미가든MeMeMi 레스토랑카페... ,https://blog.naver.com/heehyon911?Redirect=Log&logNo=222340442372,주말에 다녀온 #청담 미미미가든입니다 네이버로 예약하고 갔어요 # 미미미가든 영업시간 매일 11:00 - 02... 맛은 너무 좋아요 사실 미미미가 카페체인이기도 하고 (한번도 안가봤음) 흔한 느낌이었어서 큰 기대를... ,ssohn,https://blog.naver.com/heehyon911,2021-05-06
청담동 카페/미미미가든mememi garden,https://blog.naver.com/rolo_ggo?Redirect=Log&logNo=222084470344,"맛있는 케이크와 비비드한 컬러감이 좋은 청담동 카페미미미가든예쁜 동시에 맛있기 참 어려운데~ 청담동 카페미미미가든 은 그것을 해냈네요! 고급진 분위기인데 너무 무겁진 않고, 특히 전 소란스럽지 않아... ",하고 싶은 거 하는 중인 꿀정네,https://blog.naver.com/rolo_ggo,2020-09-09
"추천, 청담 파스타는 분위기 있는 청담레스토랑미미미가든에서",https://blog.naver.com/gpgpaa92?Redirect=Log&logNo=222526349445,12층엔 미미미 펜트하우스도 있다고 하는데 프라이빗하고 럭셔리한 하우스로 룸과 루프탑 스위밍 풀까지 프라이빗하게 즐길 수 있어 근사한 식사를 하고 바로 올라갈 수 있다는 장점이 있다. 일단 # 미미미가든 ... ,생계형 MOONYUNG LOG,https://blog.naver.com/gpgpaa92,2021-10-04
"한주외식일기 - 일산주엽 서울집 물갈비,청담미미미가든 카페... ",https://blog.naver.com/maroyuki?Redirect=Log&logNo=222423457474,"오늘의 회동장소는 청담미미미가든 . 회사 다닐때만 해도 매일 다니던 동네였는데 그 사이 또 많은... 1층의미미미가든카페로 이동. 레스토랑은 3시간, 카페는 2시간 무료 주차시간을 따로 적립시켜줘서 꽤 오래... ","아틀리에, 느린",https://blog.naver.com/maroyuki,2021-07-07
청담동 카페미미미가든핫플 분위기와 가격정보,https://blog.naver.com/sjejlove04?Redirect=Log&logNo=222091392626,청담동 카페미미미가든핫플 가격 및 분위기 좋아 생일파티나 데이트코스로 추천 요즘 도산공원...미미미가든 이라네~~ MEMEMI GARDEN 매장 분위기 및 가격미미미가든#청담동카페 #청담동데이트코스 1층은 10:00 - 01... ,박배찌's Fashion magazine,https://blog.naver.com/sjejlove04,2020-09-16
청담동맛집 파스타가 맛있는미미미가든 에서 디너!,https://blog.naver.com/yuiop1193?Redirect=Log&logNo=221989501071,"위치한미미미가든 은 1층은 카페, 지하1층은 파빌리온, 지하 2층은 식사와 바를 즐길 수 있는 가든으로 컨셉에 맞춰서 꾸며져 있었답니다. 저는 지하2층으로 내려가서 식사를 했구요. 샐러드, 파스타, 리조또를... ",:: 달달한 오후의 레이나 ::,https://blog.naver.com/yuiop1193,2020-06-04
청담동 카페미미미가든체리빙수 망빙보다 맛남,https://blog.naver.com/prime0823?Redirect=Log&logNo=222453343618,"맛있었던 ♬미미미(MeMeMi)는 이탈리아 밀라노에서 탄생한 글로벌 아트테인먼트 나(Me)와 밀라노 (Milano)의 조합으로 만들어진 브랜드 네임으로 전세계 각지에서 엄선한 푸드로가든 , 키친, 카페 3가지 타입으로... ",지봉이의 골든타임,https://blog.naver.com/prime0823,2021-08-01
 미미미가든청담 망고 빙수 맛집으로 인정합니다!,https://blog.naver.com/gloyk91?Redirect=Log&logNo=222423261681," 미미미가든청담, 망고 빙수 맛집 지난 주말 가족들과 데이트를 위해미미미가든청담을 방문했어요! 압구정로데오 쪽을 방문할 일이 있어서 들렸다가 빙수가 먹고 싶다는 가족들의 이야기에 정보를 찾아보던 중... ",GLOYK - 끌로의 패션 & 뷰티 블로그,https://blog.naver.com/gloyk91,2021-07-07
"뭔가 특별한 청담 레스토랑,미미미가든 ",https://blog.naver.com/nowwegom?Redirect=Log&logNo=222010715941,"레스토랑미미미가든 은 총 3층으로 구성되어 있고 1층은 카페, 지하 2층은 가든, 지하 1층은... # 미미미가든주소: 서울 강남구 도산대로 417 번호: 02-518-8765 #미미미 #청담맛집 #청담카페 #청담동맛집 #청담핫플... ",먹기 위해 사는 위장 환자,https://blog.naver.com/nowwegom,2020-06-25
청담동 빙수 카페미미미 가든 ,https://blog.naver.com/amlee74?Redirect=Log&logNo=222033344261, 미미미가든망고빙수는 비주얼도 너무 예뻤어요. 후숙이 잘된 망고가 듬뿍 올라간 망고 빙수였는데요. 역시 자연망고는 맛도 달랐어요. 생망고의 달콤함은 냉동망고가 쫒아갈 수 없죠. 그리고 귀엽게도 미미미... ,동네탐정멜리의 탐정놀이,https://blog.naver.com/amlee74,2020-07-17
D+253~257 짐보리 체험 / 가족사진 남기기 / 청담미미미가든 ,https://blog.naver.com/eunjin2198?Redirect=Log&logNo=222044967858,"슬미랑 요즘 핫하다는 청담미미미가든 ! 메트로시티에서 만든 곳이라고 하더라구용 카페, 레스토랑, 바가 모두 있어서 1층부터 지하2층까지 모두미미미가든 이에요! **아기의자 없음! 유모차 반입 가능!... ",클로이의 리얼한 일상이야기,https://blog.naver.com/eunjin2198,2020-07-29
청담동 파스타 맛집 레스토랑 ' 미미미가든 ' 추천해요!,https://blog.naver.com/hhyk94?Redirect=Log&logNo=222542757279,"청담 레스토랑 파스타 맛집미미미가든추천해요! 안녕하세요, 솔라입니다. 10월에는 연휴가 많아서 가족들이랑 보낼 수 있는 시간들이 많아서 너무 좋았어요. 지난 여름에미미미가든카페에서 망고 빙수를... ",SOUL & LATTE,https://blog.naver.com/hhyk94,2021-10-20
청담 망고빙수 맛집미미미가든퀄리티도 굿!!,https://blog.naver.com/lol_999?Redirect=Log&logNo=222423328919,작년 4월에 미미미 빙수가 오픈 한 이후로 이제 빙수 맛집으로 자리 잡았다죠! 초록창에 청담 망고빙수 검색하면 연관 검색어로미미미 가든 이 뜰 정도니 말 다 했죠 ㅋㅋㅋㅋㅋㅋㅋㅋㅋㅋ 망고빙수로 유명한... ,쁜소월드,https://blog.naver.com/lol_999,2021-07-07
청담데이트코스미미미가든라운지바까지 즐겨요,https://blog.naver.com/hong_blossom?Redirect=Log&logNo=221975853171,맛있는 음식이 가득한 레스토랑이기도 하고 가볍게 한잔할 수 있는 라운지바이기도 해요 :) [ 미미미... 보태니컬 가든 컨셉이라 여기저기 그리너리한 느낌이 가득했어요.미미미가든규모가 꽤 큰 데다가... ,Have a Maynine Day,https://blog.naver.com/hong_blossom,2020-05-23
청담 카페미미미가든케이크 홈파티에 빠지면 아쉬울걸,https://blog.naver.com/happy_hworld?Redirect=Log&logNo=222178827865,경우 미미미 공식 홈페이지와미미미가든매장 그리고 네이버 예약을 통해 12월 31일까지 예약할 수 있다고 한다. 쇼케이스 안에 있는 다양한 미미미케이크 중 내 눈에 쏙 들어온 연말 홈파티용 케이크들! 벌새... ,즐거운 안녕희야 세상,https://blog.naver.com/happy_hworld,2020-12-20
[청담동 카페] 예쁘고 이색적인 카페:미미미가든(MeMeMi... ,https://blog.naver.com/skyhygy?Redirect=Log&logNo=222055080931,[청담동 카페] 예쁘고 이색적인 카페:미미미가든(MeMeMi Garden) 여기는 제가 다니는 미용실 근처라서... 여기 구성은 1층은미미미 가든카페로 디저트랑 음료를 즐길 수 있는 공간이구요 지하1층과 2층이 바... ,금성키친의 소소한 이야기,https://blog.naver.com/skyhygy,2020-08-09
[서울/청담] 색감이 예쁜 카페레스토랑 ' 미미미가든 ... ,https://blog.naver.com/flavna722?Redirect=Log&logNo=222102401781,"#mememigarden # 미미미가든#청담카페 1F 매일 아침 새벽에 미미미 파티쉐가 직접 구워낸 베이커리와 페이스트리, 달콤한 케이크와 디저트가 준비되어 있으며, 향긋한 블렌딩의 시그니처 티와 음료, 100년... ",: 유드리의 블로그 :,https://blog.naver.com/flavna722,2020-09-28
청담 핫플미미미가든레스토랑! 데이트하기 좋은 피자 샐러드... ,https://blog.naver.com/yynopen?Redirect=Log&logNo=222014607372,mememi GARDEN 청담 핫플미미미가든레스토랑! 청담동 피자 샐러드 맛집 인정 청담 핫플로 떠오르고 있는... 담은 미미미 특제 파스타 시얼친 파스타(성게알 파스타) 이렇게 3가지 메뉴와 콜라를 마셨는데요.... ,NEWAGE ONE,https://blog.naver.com/yynopen,2020-06-28
청담 카페미미미가든맛있었던 큐브라떼,https://blog.naver.com/frenchpopp?Redirect=Log&logNo=222094917742,제가 방문을 한 곳은 청담에 있는미미미가든이라는 곳이에요. 응? 키친미미미랑 이름이 비슷한데?라고 생각하시는 분들도 있을 것 같은데 ㅎㅎ 같은 곳에서 운영하는 곳이랍니다. 다양한 아이템도 판매하고... ,프렌치팝콘의 더뷰티&패션 ♥,https://blog.naver.com/frenchpopp,2020-09-20
청담동카페미미미가든예쁜 인테리어 즐거운 시간,https://blog.naver.com/alldaybunny?Redirect=Log&logNo=222103282107,청담동카페미미미가든예쁜 인테리어 속 즐거운 시간 안녕하세요 brownrice입니다. 안그래도 외출을 딱히... 청담동카페미미미가든 은 압구정로데오역과 강남구청역 사이에 있는데요 지하철로는... ,"Brown rice, brown life",https://blog.naver.com/alldaybunny,2020-09-29
청담 맛집미미미가든서울 데이트코스로 추천 : ),https://blog.naver.com/llmement?Redirect=Log&logNo=221982255456,청담동에 위치하고 있는미미미가든: D 정식으로 오픈한지 얼마 되지 않았는데도 불구하고 디너 타임에 방문한 손님들이 많았어요. 미미미(Mememi)는 이탈리아 밀라노 비아 브레아 23에서 탄생한 콜렉트 카페라고... ,멜코의 미니백 ♩,https://blog.naver.com/llmement,2020-05-28
청담동 카페미미미가든 ,https://blog.naver.com/beplus2015?Redirect=Log&logNo=222353529477,미미가든 뭐 유명한 덴 다 가본다 이거야.. 이날 압구정 로로에서 식사 하고 후식으로 케잌 먹으러... 음료는 글쎄 청담동 카페 미미미 #청담동 #청담동카페 #청담미미미 #청담카페 # 미미미가든#미미미,리아님의 블로그,https://blog.naver.com/beplus2015,2021-05-17
청담동 카페미미미가든! 톡톡튀는 디저트맛집,https://blog.naver.com/iamheozzang?Redirect=Log&logNo=222094238306,"#청담동카페 # 미미미가든입니다 여기 레스토랑도 맛있다고 하던데 이번에는 카페만 가봤어요... *주차도 가능했어요 , 바로 뒤에 발렛있고 발렛비는 3천원 입니다 본 포스팅은 청담미미미가든 으로부터... ",디어진의 오늘도 맑음,https://blog.naver.com/iamheozzang,2020-09-20
청담동카페미미미가든 ,https://blog.naver.com/katie85?Redirect=Log&logNo=222303715356,청담동카페미미미가든 카페 영업시간은 사회적거리두기로 마감시간이 조정되어 매일 오전 10시 - 오후10시까지네요~ 원래는 새벽1시까지로 되어있는데 바를 겸하는건가... 뭐지... 보니까 레스토랑은 키친미미미... ,오늘도 여행,https://blog.naver.com/katie85,2021-04-12
청담동 카페미미미가든청담 체리빙수 맛집 :),https://blog.naver.com/bhnx52?Redirect=Log&logNo=222041073689,카페미미미가든청담 체리빙수 맛집 :) 미미미만의 감성이 돋보이는 곳 #청담핫플 다운 넓구 세련된 카페 공간 :) 카페 공간이 여유롭고 테이블도 넓구 의자도 소파 등 폭신폭신해서 오래 노닥이다가 가기에... ,아이엠그라운드,https://blog.naver.com/bhnx52,2020-07-25
[청담카페미미미가든 ] 망고빙수 굿초이스,https://blog.naver.com/p1ayme?Redirect=Log&logNo=222034070208,2020.7.14 청담카페미미미가든분위기 좋고 데이트 장소로 유명한 이곳 평일에 방문하게 되어서 넘나... 1층이미미미가든카페고요 지하가 레스토랑이에요ㅎㅎ 예쁜 샹들리에가 있는 곳으로 유명한 곳이 바로... ,쟈쟈블로그,https://blog.naver.com/p1ayme,2020-07-17
 미미미가든@ 청담동 카페,https://blog.naver.com/gus45e?Redirect=Log&logNo=222032082829,#미미미 # 미미미가든#청담카페 #청담동카페 #청담빙수 #빙수맛집 #빙수카페 #청담핫플 #청담데이트 #서울데이트 #청담데이트코스 *본 후기는 소정의 원고료를 받아 직접 서비스를 이용하고 솔직하게... ,스쳐간 것들의 기록,https://blog.naver.com/gus45e,2020-07-15
"청담 카페, 인테리어가 예쁜 '미미미가든'",https://blog.naver.com/kikiao12?Redirect=Log&logNo=222261884465,"카페미미미가든 에 가보았지요, https://blog.naver.com/kikiao12/222213626061 청담 카페미미미가든 은 지하 2층 ~ 지상 1층 까지 카페, 바 그리고 레스토랑으로 운영되고 있따고 해요, 주차는 발렛이 가능하다고 하니... ",by Churi,https://blog.naver.com/kikiao12,2021-03-02
"청담,압구정로데오맛집♥도산대로핫플미미미가든MEMEMI... ",https://blog.naver.com/dlgpwjd6548?Redirect=Log&logNo=222530669016,연예인맛집미미미가든MEMEMI GARDEN을 소개해드릴께요! 퇴근하고 가려고 평일에 네이버로 예약완료! 외관도 너무 이쁜미미미가든 은 오전 11시~ 오후 10시까지 운영해요! 1층은 아기자기한 카페 지하1층은... ,쩡이의 소소한 이야기,https://blog.naver.com/dlgpwjd6548,2021-10-11
 미미미가든청담라운지바 고급스러운 데이트로 추천!,https://blog.naver.com/lovely951003?Redirect=Log&logNo=222003536177,데이트하기 좋은 분위기의 청담라운지바를 찾고 있다면 메트로시티 건물에 있는 가든 미미미를 찾아보세요!미미미가든 으로부터 초대받아 식사와 원고료를 지원받았습니다,버니's 뷰티팩토리,https://blog.naver.com/lovely951003,2020-06-17
청담동 카페미미미가든 ,https://blog.naver.com/eunjee9999?Redirect=Log&logNo=222046421918,예뻤던미미미가든카페 :) 판매하고 있던 에코백도 귀엽더라 ㅎㅎ 갔을 때는 몰랐는데 오늘 올릴려고 찾아보니 내가 좋아하는 한예슬언니도 다녀왔네 ^^ 메메미가 아니라 미미미라고 설명해주는 친절하고 예쁜... ,블링하게 힐링하기 ♥,https://blog.naver.com/eunjee9999,2020-07-30
청담 카페 추천미미미가든 카페,https://blog.naver.com/kjh90530?Redirect=Log&logNo=222490921590,청담 카페미미미가든 (mememe Garden) 작년에 왔다가 음료 맛있던 기억이 나서 친구랑 다시 왔다! 너무... 사람 너무 많은 곳 싫으신 분은미미미가든카페 추천이요! 주소 : 서울 강남구 도산대로 417 1층... ,Hello Stranger,https://blog.naver.com/kjh90530,2021-09-01
청담 데이트 분위기좋은 맛집미미미가든추천해,https://blog.naver.com/sunkjydbgn?Redirect=Log&logNo=221983420979,"♥ 예전에 용산쪽에 키친미미미 다녀왔을때도 넘 맛있게 먹고, 남펴니도 궁금해해서 이번에는 청담에 새로 생긴미미미가든 으로 다녀왔어요 ㅎㅎ 키친미미미 궁금하신 분들은 위 링크 클릭해주세욧!... ",제이와이 뷰티메뉴얼,https://blog.naver.com/sunkjydbgn,2020-05-30
예쁜 인테리어가 인상적인 청담미미미가든 카페,https://blog.naver.com/chosukc?Redirect=Log&logNo=222430147163,"글쓴이는 오늘 예쁜 인테리어가 인상적인 청담미미미가든 카페를 다녀왔다. 청담미미미가든 카페에 가려고 길을 나선건 아니고, 이 근처에 볼일이 있어 갔다가 목이 마른 글쓴이가 커피한잔 하기 위해... ",Lv.33 에미넴의 취존 리뷰 라이프로그,https://blog.naver.com/chosukc,2021-07-13
청담카페미미미가든분위기 좋은 케이크맛집,https://blog.naver.com/ym9240?Redirect=Log&logNo=222092422808,청담카페미미미가든 을 방문했답니당 이른 점심시간에 방문해서 그런지 한적하면서도 여유로운... 공간이에요미미미가든 은 2층엔 레스토랑이고 1층엔 카페로 구성되어있는 것 같더라구요 저는 1층만... ,새벽 네시의 손톱달,https://blog.naver.com/ym9240,2020-09-18
청담동의 새로운 트렌디 스폿 –미미미 가든오픈,https://blog.naver.com/designpress2016?Redirect=Log&logNo=221989878004,"패션 브랜드 메트로시티가 전개하는 FB 브랜드 미미미의미미미 가든 이 청담동에 오픈하였다. 이번에 오픈한미미미 가든 은 지하 2층부터 지상 1층까지 총 3층에 걸쳐 만들어졌는데, 지하 2층은 가든, 지하... ",네이버 디자인,https://blog.naver.com/designpress2016,2020-06-04
청담 카페미미미 가든데이트코스 괜찮네!,https://blog.naver.com/63misschoi?Redirect=Log&logNo=222040854403,"남다른 분위기의 청담 카페미미미 가든글/사진 유지 오랜만에 찾은 서울 :) 올라갈 때마다 하루... 가든, 키친, 카페 세가지 타입으로 선보여지고 있답니다. 용산이랑 부산에 있는 Cafe Mememi는 가봤는데 이번에... ",유지의 오늘 :: 일상/사진/여행,https://blog.naver.com/63misschoi,2020-07-24
"청담동 맛집 추천,미미미 가든청담 레스토랑에서 분위기 있는... ",https://blog.naver.com/euni_hyn_?Redirect=Log&logNo=222537233872,"유명한미미미 가든레스토랑에 다녀왔어요~ 청담 핫플이라 이미 SNS에서 게시물이 많이 올라와서 관심갖고 한번 가봐야지? 했는데 이번 기회에 드디어 다녀올 수 있었네요!미미미 가든1층은 카페고 지하 1,2층이... ",으니빵 패션블로그,https://blog.naver.com/euni_hyn_,2021-10-14
청담 맛집 *미미미가든데이트코스로 추천!,https://blog.naver.com/1004fjqmthsu?Redirect=Log&logNo=222120945495,순수청담에서 머리를 자르고 칭구들 만나기로 해서미미미가든 으로! 요즘 떠오르는 핫플이라고 해서... 같고 ㅋㅋㅋㅋㅋㅋㅋㅋㅋㅋㅋㅋ (없음 사진 찍기도 너무 예쁠 것 같고미미미가든청담 데이트코스로 추천!,"하고 싶은 말,",https://blog.naver.com/1004fjqmthsu,2020-10-20
비(RAIN) 가 magnetic 뮤직비디오 촬영 했다는미미미가든 ... ,https://blog.naver.com/gpgpaa92?Redirect=Log&logNo=222288336588," 미미미가든 은 사실 이탈리아 밀라노 브레라 23에서 탄생한 글로벌 아트테인먼트 샵이라고 볼 수 있는데요. 가든, 키친, 카페 3가지 타입으로 패션과 라이프스타일을 접목해 유니크한 공간을 제안합니다. 비... ",생계형 MOONYUNG LOG,https://blog.naver.com/gpgpaa92,2021-03-26
청담카페미미미가든미미미케이크 훌륭해,https://blog.naver.com/rlacofls63?Redirect=Log&logNo=222170830465,오늘은 맛있는 베이커리와 예쁜 케이크가 가득했던 청담미미미가든소개와 함께 미미미케이크에 대해 리뷰해보겠습니다 :D MEMEMI GARDEN *주소: 서울 강남구 도산대로 417- 1F-B2F *영업시간: 매일 11:00 - 02:00 ( 15:00... ,소소한 일상 그리고 행복,https://blog.naver.com/rlacofls63,2020-12-15
부라타 치즈샐러드가 맛있는 청담 맛집미미미 가든 ,https://blog.naver.com/kjy911203?Redirect=Log&logNo=221991763614, 미미미가든 은 메트로시티에서 하는거지 뭐예요?ㅋㅋㅋ 나중에서야 알게됨... 미미미 카페 먼저 건물로 들어가면 1층은 카페에요. 저희는 카페방문이 아니었기때문에 엘리베이터를 타고 지하로 내려갔습니다.... ,위풍당당 그녀의 일상,https://blog.naver.com/kjy911203,2020-06-06
청담 맛집미미미가든 에서 데이트 한 날,https://blog.naver.com/alsyffl2?Redirect=Log&logNo=222536133709,와주어서 #청담레스토랑 # 미미미가든에 두 번째로 방문 하고 왔어용❤️ 청담 레스토랑 분위기 좋고 음식 맛있는 #청담맛집 찾으시는 분들께 추천..! 청담미미미가든 은 첨에 생길 때부터 제가 남자친구랑... ,프롬로맨스,https://blog.naver.com/alsyffl2,2021-10-13
청담 레스토랑미미미가든데이트코스 핫플이얌,https://blog.naver.com/yeon5853?Redirect=Log&logNo=222184253106,"다양한 케익, 베이커리류는 물론 미미미 팩토리에서 직접 만든 피클, 바질페스토, 스프레드 등 모든... 가든, 키친, 카페 3가지 타입으로 패션과 라이프 스타일을 접목한 새로운 공간을 선보이는미미미가든 !... ",해피연콩 콩's 세상,https://blog.naver.com/yeon5853,2020-12-24
청담 데이트 코스미미미가든청담점 다녀왔어요,https://blog.naver.com/cha_23?Redirect=Log&logNo=221979936059,"분위기 좋고 우아한미미미가든청담점을 가기로 했어요. 네비를 찍고 방문을 했는데, 도착하자마자 보이는 화려한 외관.. 건물을 단독으로 미미미가 사용하고 있더라고요. 저희는 차를 타고 가서 주차장에다가... ",유튜버 차수리미 V-Blog,https://blog.naver.com/cha_23,2020-05-26
청담 카페미미미가든콧바람 쐬기,https://blog.naver.com/tinariasis?Redirect=Log&logNo=222082932915,사회적 거리두기 격상 전 평일에 오후에 언니랑 다녀온 청담 카페미미미가든 이에요. 디저트가...미미미가든 이란 이름도 특이했고 저 손가락 모양도 특이하고 들어가기 전에 기대감이 막 솟구치게 하더라고요.... ,티나리아,https://blog.naver.com/tinariasis,2020-09-07
[서울/청담] 색감이 예쁜 카페 ' 미미미가든카페',https://blog.naver.com/flavna722?Redirect=Log&logNo=222218444378,"카메라에 담기엔 제격 #mememigarden # 미미미가든#청담카페 미미미만의 핸드메이드 홈케이크는 주문제작으로 사전 예약은 필수! 예약 후, 수령시까지는 최소 3일 소요미미미가든카페만의 포인트는... ",: 유드리의 블로그 :,https://blog.naver.com/flavna722,2021-01-24
청담동 이탈리안 레스토랑미미미가든MeMeMi Garden... ,https://blog.naver.com/ny_blossom?Redirect=Log&logNo=222531467429, 미미미 가든 에서 즐거운 경험을 만끽하세요 네이버맵미미미가든 업체공식소개 주차 1층은 미미미카페 1층미미미가든카페 리뷰는 여기에 https://m.blog.naver.com/ny_blossom/222532269911레스토랑은... ,34번가의 기적,https://blog.naver.com/ny_blossom,2021-10-09
청담동 핫플 카페 : 미미미 가든Me Me Mi Garden,https://blog.naver.com/gooddent0930?Redirect=Log&logNo=222085793506,"고급스러운 인테리어와 핫플로 유명한 청담동에 있는미미미가든 입니다. 1층은 카페 지하 1,2층은 바... 기분 내기에도 딱 좋은 곳 같아요~ㅎㅎ 청담에 가신다면미미미가든꼭 가보시길 추천드려용 :)",Goodmorning Story,https://blog.naver.com/gooddent0930,2020-09-11
