title,link,description,bloggername,bloggerlink,postdate
2TV생생정보 유별난맛집 불타는치킨 활화산치킨미친닭취하루 ... ,https://blog.naver.com/anarch69?Redirect=Log&logNo=222507847613,유별난맛집에선 불타는치킨으로 인기몰이하는미친닭취하루 를 찾아가고요. 장사의신은 간장게장 정식으로 연 매출 47억 원을 올리는 배터지는게장을 방문합니다. 유별난맛집 불타는치킨... ,콩콩이의 맛있는 여행,https://blog.naver.com/anarch69,2021-09-16
▶미친닭취하루- 불타는 치킨,https://blog.naver.com/rok2tank?Redirect=Log&logNo=222507828312,매일 14:00 - 00:00 ※ 사회적 거리두기로 인해 홀 영업 마지막 시간은 오후10시까지 입니다.# 미친닭취하루#미친닭 #취하루 #생생정보9월16일 #9월16일생생정보 #유별난맛집 #종로맛집 #불타는치킨,당황하지 않고,https://blog.naver.com/rok2tank,2021-09-16
생생정보 불타는 치킨유별난맛집 미친닭취하루 ,https://blog.naver.com/lalalabird?Redirect=Log&logNo=222507734245,"눈과 입이 즐거운 '불타는 치킨' # 미친닭취하루- 주소 : 서울 종로구 우정국로2길 16 종각역 4번 출구에서79m - 문의 : 02-722-9992 - 가격 : 활화산치킨 21,000원 (1단계, 2단계, 3단계 있음)... ",소소하지만 행복한 맛 정보,https://blog.naver.com/lalalabird,2021-09-16
( 활화산 치킨) 밋집서울 종로미친닭취하루 - 주방이야기,https://blog.naver.com/mediost?Redirect=Log&logNo=222507931894,"kbs 2tv 생생정보 (생생정보통) ( 9월 16일 목) 유별난 맛집 정보 ♥-불타는 치킨 맛집 ▶미친닭취하루- 주소 : 서울 종로구 우정국로2길 16 - 문의 : 02-722-9992 - 가격 : 활화산치킨 21,000원... ",주방이야기,https://blog.naver.com/mediost,2021-09-16
치킨 파는 곳 가게 위치 가격 정보 서울 종로미친닭취하루 ,https://blog.naver.com/si7035?Redirect=Log&logNo=222508038918,"생생정보 종로 불타는 치킨 파는 곳 가게 위치 가격 정보 서울 종로미친닭취하루 에서는 겉바속촉 쌀치킨에 핫한 크래프트비어, 치즈떡볶이에 피자까지 모두를 만족시킬 수 있는 다양한 메뉴가 준비되어... ",똥글이 엄마,https://blog.naver.com/si7035,2021-09-16
#종로/익선동_2021.6.20 | 청수당 | 한옥거리 |미친닭취하루 ,https://blog.naver.com/luglio16?Redirect=Log&logNo=222469162928,종로 카페 _ 청수당 종로 맛집 _미친닭취하루거창한 말 어쩌구 여기 실명 쓰면 안 되겠지? 내 이름 아니라 상관없긴 한데 개인 정보 보호해드림 친구들이랑 종로 다녀왔습니다! 이미 2달이나 지나버렸지만... ,오늘은 꼭 쓸게,https://blog.naver.com/luglio16,2021-08-14
#종각맛집 _미친닭취하루두번째 방문한 찐 치맥집 솔찍리뷰,https://blog.naver.com/byc0205?Redirect=Log&logNo=222350174639,"애들에게 적극 추천해서 가게 된, 저의 사랑 치킨집미친닭미친닭 취한닭서울 종로구 우정국로2길 16 종각역4번 출구에서78m 11:00 - 01:00 제가 처음 방문했을 때 썻던 포스팅입니다 ㅎㅎ 2주도 안가서 다시... ",내맘이야,https://blog.naver.com/byc0205,2021-05-14
종각역 넘나 맛있어서 [ 미친닭취하루 ],https://blog.naver.com/phaha11?Redirect=Log&logNo=222415340586,프랜차이즈 아닌 치킨집 찾아 삼만리 종각역 근처 유명한미친닭앤취하루 로 고고~!~! 가자마자 우선 흑맥 크~~ 이거 뭐쥬~? 나 크림에 요케 그림 그려져있는거 첨봐 자세히 사진 찍어쥬야징 크크 요 그림이 거의... ,유동의 美,https://blog.naver.com/phaha11,2021-06-30
유별난 맛집 종로 종각역미친닭취하루9월 16일 목요일 1392회,https://comcomin.tistory.com/19024,9월 16일 목요일 kbs 2tv 생생정보 1392회 유별난 맛집 불타는 치킨 활화산치킨 [미친닭취하루] 전화번호 02-722-9992 주소 서울 종로구 관철동 44-1 종각역 4번 출구 79m 영업시간 14:00 ~ 22:00 메뉴... ,★■ 일루와 ■★,https://comcomin.tistory.com/,2021-09-16
불타는 치킨 생생정보 유별난 맛집 활화산치킨미친닭 취하루 ,https://dodo1004love.tistory.com/entry/%EC%83%9D%EC%83%9D%EC%A0%95%EB%B3%B4%ED%86%B5-%EB%B6%88%ED%83%80%EB%8A%94-%EC%B9%98%ED%82%A8-%EC%83%9D%EC%83%9D%EC%A0%95%EB%B3%B4-%EC%9C%A0%EB%B3%84%EB%82%9C-%EB%A7%9B%EC%A7%91-%ED%99%9C%ED%99%94%EC%82%B0%EC%B9%98%ED%82%A8-%EB%AF%B8%EC%B9%9C%EB%8B%AD-%EC%B7%A8%ED%95%98%EB%A3%A8,"반응형 [생생정보- 유별난 맛집, 불타는 치킨] 서울 종로 종각역 맛집으로 유명한미친닭 취하루 ... ■미친닭 취하루서울 종로구 우정국로 2길 16 02-722-9992 영업시간: 14시~00시 활화산치킨 21000원으로 1단계... ",영숙이네집,https://dodo1004love.tistory.com/,2021-09-16
요리 세상의 모든 레시피 치킨집 통닭미친닭취하루스페셜 맛집,https://blueplastic.tistory.com/6520,"반응형 생생정보 스페셜 9월16일 생생정보통 생생정보통 가을철 보약, 오리의 색다른 변신 세상의 모든 레시피 주소 : 송파구 중대로10길 7-1 유별난 맛집 불타는 치킨미친닭취하루주소 : 종로구... ",Modern Story,https://blueplastic.tistory.com/,2021-09-16
맛집미친닭취하루너는내운명 일벌 할머니와 꿀 보다 귀한... ,https://fire8blog.tistory.com/2955,2tv 생생정보 1392회 오늘 생생정보 에서는 유별난 맛집 등이 방송됩니다 유별난 맛집 - 불타는 치킨 ▶미친닭취하루- 문의 : 02-722-9992 - 주소 : 서울 종로구 우정국로2길 16 지번 관철동 44-1... ,fire,https://fire8blog.tistory.com/,2021-09-16
생생정보통 불타는 치킨 유별난 맛집 종로미친닭취하루 ... ,https://blog.naver.com/dyangela?Redirect=Log&logNo=222507828916,"생생정보통 불타는 치킨 유별난 맛집 종로 미친닭 취하루 활화산치킨 계란볶음밥... 상호 :미친닭취하루대표메뉴 : 활화산치킨 21,000원 (1단계, 2단계, 3단계 있음) / 계란볶음밥... ",안젤라,https://blog.naver.com/dyangela,2021-09-16
"관철동미친닭취하루 , 인천시 장수동 간장게장 정식... ",https://befreepark.tistory.com/4749,KBS2 생생정보통 2TV 생생정보 1392회 2021년 9월 16일 방송분 KBS2 [ 2TV 생생정보 ] 월~금 18:30~ 방송 * 블로그 내 2TV 생생정보 다른 글 보기 = (모바일) bit.ly/3a9b1Le = (pc) bit.ly/37e3BnS... ,공유와 소통의 산들바람,https://befreepark.tistory.com/,2021-09-16
[종각] 철로만든돼지 종로본점 /미친닭취하루 ,https://blog.naver.com/itsmedh?Redirect=Log&logNo=222542621729,가게된미친닭취하루세시반에 호프집을 가는 건 첨ㅋㅋㅋㅋㅋㅋ 돼지를 그렇게 먹어놓고 닭으로 2차... 여기도 맛은 그냥 쏘쏘 맥주 컵이 그저 탐이가 났다 ㅋㅋㅋㅋㅋ#종각 #철로만든돼지 #미친닭취하루... ,하고 싶은 거 다혜 :),https://blog.naver.com/itsmedh,2021-10-20
함께 싸먹는 쌈닭 종각역미친닭취하루4월 9일 금요일 776회,https://comcomin.tistory.com/16320,4월 9일 금요일 obs 오이맛이야 776회 전설의 맛 5가지 토핑과 함께 싸먹는 쌈닭 [미친닭취하루] 전화번호 02-722-9992 주소 서울 종로구 관철동 44-1 종각역 4번 출구 78m 영업시간 11:00 ~ 01:00 메뉴... ,★■ 일루와 ■★,https://comcomin.tistory.com/,2021-04-09
서울 시청역 주변 맛집에서 내가 석달간 먹은것들.V2 (6-9월),https://blog.naver.com/1348123?Redirect=Log&logNo=222503348926,창고 43 낚지집 갈비만두와 막국수 북창동 신촌부추곱창 낫밷낫밷 사장님과도 좀 알게된듯 음...모모야 인듯하다 카레돈가츠 정식 김가네 - 1인닭갈비 요거슨 종각역미친닭취하루치킨집 복성각 도시락... ,공시는 단거리!,https://blog.naver.com/1348123,2021-09-12
#종각역맛집_ 미친닭진짜 맛있었던 양념치킨__+스타벅스 바나나... ,https://blog.naver.com/byc0205?Redirect=Log&logNo=222328718844," 미친닭취하루쌀로 튀긴 쌈닭이 맛있는 종각역 치킨 종각역4번 출구에서78m' 메뉴가 치킨, 피자, 사이드, 소주안주,, 등등 정말 많았어요! 메뉴판을 찍지 못했답니다 ㅠ.ㅠ 신메뉴도 지속적으로 나오고 있는 것... ",내맘이야,https://blog.naver.com/byc0205,2021-04-30
[TV속 정보] 9월 16일(목) KBS2TV생생정보... ,https://blog.naver.com/remnantlemon?Redirect=Log&logNo=222508012270,비수구미 부부의 오지 라이프 ▶ 최월용 ☎ ***-****-**** 강원 화천군 화천읍 비수구미길 553-11 KBS2TV 생생정보 제작사: 박스미디어 유별난 맛집- 불타는 치킨▶미친닭취하루☎02-722-9992... ,란리랼리얄라셩♬,https://blog.naver.com/remnantlemon,2021-09-16
[2tv생생정보 맛집]간장게장 정식 활화산치킨,https://blog.naver.com/bizbank?Redirect=Log&logNo=222507929027,"유별난 맛집 - 불타는 치킨 ▶미친닭취하루 (서울 종로구) - 활화산치킨 ※ 매일 14:00 - 00:00 3. 장사의 신 - 연 매출 47억 원, 간장게장 정식 ▶ 배터지는 게장(인천 남동구) - 특 암게장정식 ※ 월~토 11:00 - 21... ",bizbank님의 블로그,https://blog.naver.com/bizbank,2021-09-16
활화산치킨 가격 위치 파는곳 유별난맛집 서울 종로미친닭취하루 ,https://reviewhong.tistory.com/6334,데이트부터 회식까지 완벽한 치맥타임은 미친닭에서 함께 하세요.미친닭취하루주소 : 서울 종로구 우정국로2길 16 문의 : 02-722-9992 사람들이 많이본 포스팅 생생정보 오늘방송맛집 바로가기 *해당... ,랜선 고양이 지식,https://reviewhong.tistory.com/,2021-09-16
"2TV생생정보 1392회-2 게장,활화산치킨/TV맛집기행-빛나는태양",https://blog.naver.com/junone0526?Redirect=Log&logNo=222516674785, 미친닭취하루전화번호는 02-722-9992 주소는 서울 종로구 우정국로2길 16 1층 메뉴... 보신각 뒷 편 종각역맛집 후라이드 쌀치킨이 맛있는 미친닭 종로점 겉바속촉 쌀치킨에 핫한... ,TV맛집기행,https://blog.naver.com/junone0526,2021-09-27
생생정보통 불타는 치킨 유별난 맛집 연매출 47억원 간장게장... ,https://blog.naver.com/jbwk?Redirect=Log&logNo=222507814793,"상호 :미친닭취하루대표메뉴 : 활화산치킨 21,000원 (1단계, 2단계, 3단계 있음) / 계란볶음밥 (달걀볶음밥) 6,000원 주소 : 서울 종로구 우정국로2길 16 장사의 신 - 연 매출 47억 원, 간장게장 정식... ",주옥같은 나날들,https://blog.naver.com/jbwk,2021-09-16
2tv생생정보 1392회 맛집위치 연 매출 47억원 간장게장 맛집... ,https://blog.naver.com/dmswloofor?Redirect=Log&logNo=222508054711,"불타는 치킨집 식당과 간장게장 정식집의 위치는 유별난 맛집의 불타는 치킨 식당의 위치는 ' 미친닭취하루 ' (서울 종로구) 입니다. 연 매출 47억 원, 간장게장 정식집은 '배터지는 게장'(인천 남동구)... ",냐옹,https://blog.naver.com/dmswloofor,2021-09-16
"2TV 저녁 생생정보 1392회 유별난맛집-불타는 치킨, 장사의신... ",https://blog.naver.com/africaphoto?Redirect=Log&logNo=222507992100,"생생정보통 가을철 보약, 오리의 색다른 변신 ▶ 세상의 모든 레시피 - 주소 : 서울 송파구 중대로10길 7-1, 2층 - 문의 : ☎️ 02-6951-2456 유별난 맛집 - - 불타는 치킨 ▶미친닭취하루- 주소... ",www.Africaphoto.net,https://blog.naver.com/africaphoto,2021-09-16
생생정보통 활화산치킨 간장게장정식,https://blog.naver.com/hanul8828?Redirect=Log&logNo=222507755189,"치킨 # 미친닭취하루생생정보통 활화산치킨 가격 21.0 (1단계, 2단계, 3단계 있음) / 계란볶음밥(달걀볶음밥) 6.0 종각역맛집 후라이드 쌀치킨이 맛있는 미친닭 종로점 서울 종로구 우정국로... ",찬란한 4월,https://blog.naver.com/hanul8828,2021-09-16
생생정보 게장의 신 연매출 47억 원 간장게장 정식 불타는치킨... ,https://blog.naver.com/wowwhere?Redirect=Log&logNo=222507881560,종로미친닭취하루 를 찾는다 생생정보통신 미스터 Lee 사진한컷 대한민국 시간에는 경기도 연천군 을 찾는다 방송에서 산약초 능이버섯백숙 을 먹을 수 있는 금수강산 식당 과 율무 주먹도끼빵 이... ,내 블로그,https://blog.naver.com/wowwhere,2021-09-16
생생정보 1392회 불타는 치킨 활화산치킨 계란볶음밥... ,https://jeffreysays.tistory.com/2391,com 최신-영화-드라마-넷플릭스-드라마-비하인드-이야기 생생정보 1392회 불타는 치킨 활화산치킨 계란볶음밥 달걀볶음밥 서울 종로 맛집 연락처 위치 어디 【 이름 상호 】미친닭취하루【 주소... ,올 리뷰 블로그,https://jeffreysays.tistory.com/,2021-09-16
"서울 종로구 치킨, 인천 남동구 간장게장, 경기 연천군... ",https://blog.naver.com/rnjsdudxkr91?Redirect=Log&logNo=222507983925,"▶서울 종로구에 위치한 ' 미친닭취하루 ' '장사의 신' 편에서는 간장게장 정식을 소개한다. ▶인천 남동구에 위치한 '배터지는 게장' '미스터 Lee의 사진 한 컷, 대한민국' 편에서는 능이백숙 맛집을... ",권영탁님의 블로그,https://blog.naver.com/rnjsdudxkr91,2021-09-16
"생생정보통 불타는 활화산치킨미친닭취하루 , 배터지는... ",https://blog.naver.com/wjddkdiazz?Redirect=Log&logNo=222507911967,"생생정보통 불타는 활화산치킨, 종로 미친닭취하루 출처 : 미친닭취하루 홈페이지 생생정보통... 6,000원미친닭취하루주소 서울 종로구 우정국로2길 16 [지번] 관철동 44-1 전화번호 02-722-9992 영업시간... ",놀러오세요~,https://blog.naver.com/wjddkdiazz,2021-09-16
[생생정보]장사의 신 게장의 신 연 매출 47억 원 간장게장 정식... ,https://pirin8pirin.tistory.com/4126,종로구미친닭취하루너는내운명 일벌 할머니와 꿀 보다 귀한 손자 토종벌 키우는 할머니와 손자 김종화 박상진 인제군토종벌 1392회 링크▽ https://fire8blog.tistory.com/2955 ▽ 오늘 저녁... ,8,https://pirin8pirin.tistory.com/,2021-09-16
생생정보 유별난 맛집 불타는 치킨 계란볶음밥 서울 종로구... ,https://blog.naver.com/pirin888?Redirect=Log&logNo=222507621059,2tv 생생정보 1392회 ▽ [생생정보]유별난 맛집 불타는 치킨 활화산치킨 계란볶음밥 서울 종로구미친닭취하루너는내운명 일벌 할머니와 꿀 보다 귀한 손자 김종화 박상진 인제군토종벌... ,rin,https://blog.naver.com/pirin888,2021-09-16
방송에 소개된 종로구 식당,https://blog.naver.com/bigvendor?Redirect=Log&logNo=222517998244, 미친닭취하루02-722-9992 | 서울 종로구 우정국로2길 16 생생정보 - 2021.09.16 순대실록 02... 07 원조 원할매 소문난 닭 한 마리 02-2279-2078 | 서울 종로구 종로40가길 25 생생정보 - 2020.... ,신문사설모음과 지역정보,https://blog.naver.com/bigvendor,2021-09-27
KBS 2TV 생생정보 9월16일 유별난 맛집 불타는 치킨,https://blog.naver.com/choulha63?Redirect=Log&logNo=222508656095,양념의 비법은 알로에 바삭한 치킨의 비법은 쌀가루로 튀긴 치킨 치킨 양념에 볶아 먹는 볶음밥도 일품미친닭취하루☎ 02-722-9992 서울 종로구 우정국로2길 16방문 후기는 아래 블러그에서 보세요 ,one시인의 일상.,https://blog.naver.com/choulha63,2021-09-17
"2021년 8,9월 TV 방송에 소개된 맛집 정보모음으로 본문에... ",https://blog.naver.com/bklight?Redirect=Log&logNo=222525915967,"치킨 ▶미친닭취하루※ 매일 14:00 - 00:00 *활화산치킨 21,000원 (1단계, 2단계, 3단계 있음)... 즐기는 닭 요리 초계탕닭구이 ◈ 큰마루팔봉 *닭구이 다리 살 (600g) 24,000원, 초계탕 (중) 25... ",맛집 찾기쉽게 주소 순으로 정리한 방송 탄 맛집 정보,https://blog.naver.com/bklight,2021-10-04
6월의 일기(5),https://blog.naver.com/illhun2233?Redirect=Log&logNo=222418962173,ㅠㅠ미친닭취하루갓 나온 거 먹어서 그런지 너무 부드럽고 뜨겁고(?).. 양념 깐풍 마늘 다 너무 맛있어 ㅠㅠㅠ 또 가고싶다 여긴 맥주가 비커?에 담겨 나온다 짱신기 너무너뭄너무맛있어!!!!!!! 역시 갈증... ,I WISH,https://blog.naver.com/illhun2233,2021-07-03
가 먹은 것들 기록,https://blog.naver.com/illhun2233?Redirect=Log&logNo=222367880077,Previous image Next image 땡스오트 성심당 모찌의 하루 홍곱창 하츠베이커리미친닭취하루추풍령칼삼겹살 하우돈곱창 빵명장 샤로수왕족발 양자호떡 오얏꽃 라헬의 부엌 대치역... ,I WISH,https://blog.naver.com/illhun2233,2021-05-26
생생정보통 불타는치킨 활화산치킨 파는곳 종로 유별난맛집,https://soumfactory.tistory.com/3212,생생정보 불타는치킨 가게 위치 정보 업체명 :미친닭취하루주소 : 서울 종로구 우정국로2길 16 연락처 : 02-722-9992 반응형 공유하기 글 요소 구독하기 더러운인형 저작자표시 비영리 변경금지... ,더러운인형,https://soumfactory.tistory.com/,2021-09-16
"종각역미친닭취하루간장치킨 맛집, 올림픽 보기 좋은 곳",https://blog.naver.com/thank2008?Redirect=Log&logNo=222465296850,"image미친닭취하루메뉴판 저희는 미친닭 광동치킨 한마리,김치 치즈 프라이즈 레드락, 카스 생맥주 를 주문했어요 미친닭 광동치킨 한마리 가격 22,000원 김치 치즈 프라이즈 가격 6,000원(치킨주문시... ",ღ 로우LOW의 리뷰 ღ,https://blog.naver.com/thank2008,2021-08-11
2021-09-16 방송에 소개된 식당,https://blog.naver.com/momsnet?Redirect=Log&logNo=222507896178,생생정보 배터지는게장 032-466-0304 | 인천 남동구 수현로 27 2층 ☞ 남동구 문화관광 / 방송맛집 더보기미친닭취하루02-722-9992 | 서울 종로구 우정국로2길 16 ☞ 남동구 문화관광 / 방송맛집 더보기,맘스넷,https://blog.naver.com/momsnet,2021-09-16
