title,link,description,bloggername,bloggerlink,postdate
강원도 평창군봉평 면미가연/봉평 메밀막국수 / 주리미식회 @,https://blog.naver.com/tuaimes?Redirect=Log&logNo=221807413302, 미가연강원도 평창군봉평 면 이제 서울로 갈 시간 점심은 먹고 서울로 고고띵 하기로 한 우리는 뭘... 육회메밀막국수? 인가 있어서 선택한봉평 메밀막국수 전문점미가연미가연 의 내부에 들어서니... ,JU de MAME by JURIUNNI,https://blog.naver.com/tuaimes,2020-02-13
평창맛집봉평메밀미가연다녀온 후기,https://blog.naver.com/i513513?Redirect=Log&logNo=222371359510,#평창맛집 #평창 #메밀막국수 #평창여행 #맛집 # 봉평메밀미가연#메밀 #강원도맛집 #강원도 평창에 맛집이라고 항상 뜨길래 저도 한번 들렸습니다 주차할곳도 넉넉하고 밖에 왜이렇게 의자가 많나 했더니 저는... ,꿈톨이,https://blog.naver.com/i513513,2021-05-28
 봉평 메밀 미가연........... 평창,https://blog.naver.com/les0628a?Redirect=Log&logNo=222317117942,^^봉평 메밀 미가연 ..... 거의 마지막 주문 시간에 임박해서 도착했다... ㅡ.ㅡ 물론... 미리 전화해서... 메밀 집치고는 특이하게도... 육회를 이용한 메뉴가 몇 가지 있었다... 100%..... 이거 쉽지 않다고... ,블루의 하루..,https://blog.naver.com/les0628a,2021-04-20
생생정보 육회메밀비빔국수유별난 맛집 봉평메밀미가연 ,https://blog.naver.com/lalalabird?Redirect=Log&logNo=222481194896,[2TV 생생정보 1374회] 방송일 2021.08.23(월) 소행정 유별난 맛집 육회메밀비빔국수 별난 조합 '육회메밀비빔국수' # 봉평메밀미가연- 주소 : 강원도 평창군 봉평면 기풍로 108 - 문의 : 033-335-8805... ,소소하지만 행복한 맛 정보,https://blog.naver.com/lalalabird,2021-08-23
"[ 봉평 ]메밀 미가연 , 명인이 만드는 메밀국수",https://blog.naver.com/sapphirejjun?Redirect=Log&logNo=222227798675,"Unsplash 봉평 미가연! 새콤달콤 메밀국수, 진짜 메밀로 만든다니 이보다 더 쌉싸름하면서 부담 없을... 미가연과 함께라면 외롭지 않쥬❤ 입맛이 없을 때 건강한 한 끼로 보강하고 싶다면,봉평 메밀 미가연 ... ",ㅋㅛㅋㅛ ٩(•̤̀ᵕ•̤́๑)૭✧,https://blog.naver.com/sapphirejjun,2021-02-06
 봉평메밀미가연8월 마지막 주 고객 리뷰,https://blog.naver.com/dddoing8805?Redirect=Log&logNo=222491394523,주봉평메밀미가연다녀가신 분들이 후기를 정리해봅니다. 이분의 리뷰는 소개 안 할 수가 없습니다.... 새로운 메밀을 맛보았습니다. 얼마나 자세하게 써주셨는지 미가연을 사전에 많이 알아보시고 오신 것... ,메밀명인 오봉순의 사는 이야기,https://blog.naver.com/dddoing8805,2021-09-01
" 봉평 메밀 미가연시그니처... 명품 메밀싹 육회, 이대팔 100... ",https://blog.naver.com/dddoing8805?Redirect=Log&logNo=222380880479, 봉평메밀 미가연메밀싹 육회 먼저 요즘 미가연 오실 때 영업시간이나 주소를 묻는 분이 많으셔서... 해드릴게요^^ 미가연 위치: 강원 평창군 봉평면 기풍로 108 전화번호:050-71405-8805 영업시간: 매일 10:00 - 20:00... ,메밀명인 오봉순의 사는 이야기,https://blog.naver.com/dddoing8805,2021-06-02
 봉평메밀미가연7월 1주차 네이버 예약 리뷰 쓰기,https://blog.naver.com/dddoing8805?Redirect=Log&logNo=222420993084,6월 28일부터 7월 4일 한 주 동안봉평메밀미가연 을 다녀가신 분들이 써주신 소중한 네이버 예약... 네이버 플레이스 영수증 리뷰 6월 4주 차 '지금까지 먹어온 메밀은 무엇?? 네이버 리뷰쓰기 봉평 미가연 6월 3주... ,메밀명인 오봉순의 사는 이야기,https://blog.naver.com/dddoing8805,2021-07-05
 봉평메밀미가연설명서/ 메밀싹묵무침과 메밀전병 맛있게 먹는 법,https://blog.naver.com/dddoing8805?Redirect=Log&logNo=222414267936,"비 오는 날 파전, 김치전 봉평에선 메밀전이죠. 사실 요즘 미가연에서는 새로운 레시피가 등장해서... 100% 봉평 메밀 명품 국수 먹는 방법봉평 메밀 미가연시그니처 메뉴_ 대관령 한우로 만든 명품 메밀싹 육회... ",메밀명인 오봉순의 사는 이야기,https://blog.naver.com/dddoing8805,2021-06-29
 봉평메밀미가연카톡 플친 이벤트,https://blog.naver.com/dddoing8805?Redirect=Log&logNo=222412743355,블랙메밀 차를 준비했습니다. 시원하게 드시라고 냉장고도 새로 들여놓았답니다. 블로그 이웃님들도미가연 과 카톡 플친 되시면 바로 쿠폰을 받으실 수 있답니다. 8월 말까지니까봉평여행 예정하시는 분들은... ,메밀명인 오봉순의 사는 이야기,https://blog.naver.com/dddoing8805,2021-06-28
농림축산부 외식문화 선진화 캠페인 촬영한봉평메밀미가연 ,https://blog.naver.com/dddoing8805?Redirect=Log&logNo=222520004929,중에 미가연 이름의 뜻을 물어보는 질문이 있었는데요 아직도 모르고 계시는 분들을 위해서 한번 더... 더 많은 분들이봉평메밀미가연 의 맛있고 건강한 음식을 더 오래 즐기실 수 있도록 변함없이 꾸준히... ,메밀명인 오봉순의 사는 이야기,https://blog.naver.com/dddoing8805,2021-09-29
 봉평메밀미가연9월 마지막주 고객 목소리,https://blog.naver.com/dddoing8805?Redirect=Log&logNo=222528710943,9월 마지막주에는 저희봉평메밀미가연음식을 건강음식이라고 표현해주신 분들이 유독 많았는데요... 정말 감사합니다♥ 봉평 메밀로 만든 미가연의 음식은 정말 봉평에서만 맛 볼 수 있는 건강음식이지요... ,메밀명인 오봉순의 사는 이야기,https://blog.naver.com/dddoing8805,2021-10-06
 봉평메밀 미가연밭에서 유기농 상추 수확해서 3일 동안... ,https://blog.naver.com/dddoing8805?Redirect=Log&logNo=222401419456,있네요~미가연 도 점점 더 바빠지고 있고요.봉평하면메밀 이고메밀 로 만든 국수 하면메밀 막국수를 떠올리십니다. 저는 개인적으로 막국수라는 말보다봉평메밀 요리 명품 면이라고 부르고 싶습니다.... ,메밀명인 오봉순의 사는 이야기,https://blog.naver.com/dddoing8805,2021-06-17
 봉평메밀미가연9월 셋째주 고객 목소리,https://blog.naver.com/dddoing8805?Redirect=Log&logNo=222519769848,덕분에 저희까지 함께 행복하고 뿌듯했네요 :D봉평메밀미가연 의 음식들이 아무래도 봉평의 메밀로 만들다보니 더 깊은 맛이 나는데 각 메뉴들의 매력을 알아주셔서 감사했습니다 :) 조금 무리해서라도 많이... ,메밀명인 오봉순의 사는 이야기,https://blog.naver.com/dddoing8805,2021-09-28
 봉평메밀미가연9월 첫째주 고객 목소리,https://blog.naver.com/dddoing8805?Redirect=Log&logNo=222498167298,우리봉평메밀미가연 을 찾아주시는 발길은 변함이 없네요 항상 감사드립니다 저희도 변함없이 고객의... 보낸답니다 :) 봉평하면 메밀! 메밀하면 미가연! 아닐까요? feel조아님 말씀처럼 많은 분들이 미가연의... ,메밀명인 오봉순의 사는 이야기,https://blog.naver.com/dddoing8805,2021-09-07
 봉평메밀미가연9월 둘째주 고객 목소리,https://blog.naver.com/dddoing8805?Redirect=Log&logNo=222505530482,9월 둘째주에봉평메밀미가연 을 찾아주신 분들은 어떤 식사를 하고 가셨을지 이번주도 꼼꼼히... 100% 메밀면이기 때문이지 않을까 싶습니다 그냥 맛있다는 평도 좋지만 봉평미가연에서만 맛볼수 있는 이 곳만의... ,메밀명인 오봉순의 사는 이야기,https://blog.naver.com/dddoing8805,2021-09-14
[평창]봉평메밀 미가연 ,https://blog.naver.com/myand0156?Redirect=Log&logNo=222015272257,맛집찾아봉평메밀 미가연 으로 더운여름에는. 역시 냉면아님 막국수가 쵝오인듯~~ 평창은 매력이... 메밀전병 ㆍ메밀묵ㆍ비빔국수 ㆍ물국수 다주문해봤다ㅋ 우리가주문한음식중 메밀물국수와 전병이 빠졌당.... ,소소한 일상,https://blog.naver.com/myand0156,2020-06-29
[ 봉평메밀미가연 ] 평창맛집... 메밀국수/봉평맛집/메밀미가연,https://blog.naver.com/mmm2keys?Redirect=Log&logNo=222441139124,신발장앞에 전시되어 있는 신지식인 인증서와 메달~ 명함을 넣어두면 추첨해서봉평 특산물을...봉평메밀 국수 # 봉평메밀 막국수 #평창막국수 #평창 메밀 국수 #평창맛집 #강원도맛집 #육회 메밀 국수 # 메밀미가연 ,정통 고저스,https://blog.naver.com/mmm2keys,2021-07-22
[평창/봉평미가연] 메밀명인이... 막국수 맛집봉평메밀미가연 ,https://blog.naver.com/ohr2013?Redirect=Log&logNo=222452712030,평창 봉평에 도착하였습니다. 그러면 휴가 중 저희가 먹은 첫 끼니인 메밀 장인의 집봉평메밀미가연 을 소개시켜드릴게요. 점심시간에 방문하니 웨이팅이 있었어요. 약 50분이라는 소리에 헉이라는 말이... ,즐거운 일상,https://blog.naver.com/ohr2013,2021-08-01
강원도 평창 메밀 맛집 # 봉평메밀미가연 ,https://blog.naver.com/nahee6015?Redirect=Log&logNo=222430522488,저녁식사를 위해 현지인 추천 맛집인봉평메밀미가연 에 방문했다 메밀의 본연의 맛을 느끼고 싶으면 미가연이라는 말에 주저없이 선택한 # 봉평메밀미가연봉평 미가연 도착 들어갑니다요오 서울보다 좋은듯... ,아름다운 여자가 되자 :),https://blog.naver.com/nahee6015,2021-07-13
생생정보통 촬영봉평 메밀미가연명품 이대팔 육회비빔국수,https://blog.naver.com/dddoing8805?Redirect=Log&logNo=222481038307,"요즘미가연 은 아직도 휴식이 필요한 분들이 많이 찾아주십니다. 평창봉평여행길에 좋은 경험을 할 수... 몇 번을 곱씹으면서 ㅎㅎㅎ 명품 육회 비빔에 올라가는 다데기, 소스, 육수메밀 까지~~미가연 의 비밀인... ",메밀명인 오봉순의 사는 이야기,https://blog.naver.com/dddoing8805,2021-08-23
강원도 평창맛집 / 메밀맛집 / 메밀장인 :봉평메밀미가연 ,https://blog.naver.com/d6644838?Redirect=Log&logNo=222490792322,원빈맛집 #봉평메밀 # 봉평메밀미가연#봉평막국수 #메밀명인 #메밀맛집 #생생정보통 #유별난맛집... 메밀막걸리 #서이추 #서이추환영 #메밀국수 #이대팔미가연 #봉평가볼만한곳 #평창가볼만한곳 #평창군맛집,오늘도 소윤,https://blog.naver.com/d6644838,2021-08-31
( 평창 /봉평메밀미가연) 고민끝에 찾은 평창 메밀 제일 맛집,https://blog.naver.com/yhkm0226?Redirect=Log&logNo=222422146368,우리는 조금 색다른 메밀국수를 먹고 싶었기에 육회메밀국수가 있는봉평메밀미가연 으로 정했다!! 깔끔한 신축 한옥집처럼 생겼다 ㅎㅎ 우아~~ 전국 밥집 중에 이산화염소 소독기 있는 식당 보신분 !!!?? 이런... ,윤갱이의 맛집 체크리스트,https://blog.naver.com/yhkm0226,2021-07-06
 봉평메밀미가연7월 마지막 주 고객 리뷰,https://blog.naver.com/dddoing8805?Redirect=Log&logNo=222455517473,오늘도 역시 서두가 긴 오봉순 이해해 주이소~~메밀 을 느끼려면 꼭미가연 에 오시라고 추천해 주신 분 ~~ 드시는 방법까지 완벽하게 아시고 드신 걸 보면 아마도 저희 블로그 이웃님이 다녀가신 것 같아요... ,메밀명인 오봉순의 사는 이야기,https://blog.naver.com/dddoing8805,2021-08-03
▶봉평메밀미가연- 육회메밀비빔국수,https://blog.naver.com/73b?Redirect=Log&logNo=222481968649,[ 2TV 생생정보 1374회 ] 8월 23일 월요일 취재 연락처 유별난 맛집 - 육회메밀비빔국수 ▶봉평메밀미가연- 주소 : 강원도 평창군 봉평면 기풍로 108 - 문의 : 033-335-8805 - 가격 : 이대팔 100% 육회... ,73b님의 블로그,https://blog.naver.com/73b,2021-08-24
"평창군봉평메밀 미가연 , 시흥시 돼지목살갈비... ",https://befreepark.tistory.com/4653,mode=viewartid=202007171553561code=115 유별난 맛집 - 육회메밀비빔국수봉평메밀 미가연강원도 평창군 봉평면 기풍로 108 (지번) 강원도 평창군 봉평면 창동리 268-7 ☎ 033-335-8805 * 영업시간... ,공유와 소통의 산들바람,https://befreepark.tistory.com/,2021-08-23
 봉평메밀미가연8월 첫 주 고객 후기 정리,https://blog.naver.com/dddoing8805?Redirect=Log&logNo=222462815469,"수도권 코로나가 4단계 격상되었고,미가연 은 테이블을 재 정리하고 거리 두기로 손님들을 맞이하고...미가연 에 오신 분들이 안전하고 편안하게 식사하시고 가실 수 있도록 최선을 다하겠습니다. 8월 첫째 주... ",메밀명인 오봉순의 사는 이야기,https://blog.naver.com/dddoing8805,2021-08-09
강원도 평창여행 / 평창역 맛집봉평메밀미가연솔직후기,https://blog.naver.com/fox381?Redirect=Log&logNo=222304565440,고고링 봉평 미가연!! 메뉴판! 저는 3명이서 메밀 미가연 + 메밀 비빔 국수 +메밀싹 육회 비빔밥 + 메밀전... 맛은 판단하는걸류~ ) #평창맛집 #메밀국수 # 봉평메밀미가연#강원도맛집 #평창여행 #내돈내산 #강원도여행,아가리어터,https://blog.naver.com/fox381,2021-04-09
[평창맛집/봉평메밀국수맛집]봉평메밀 미가연 ,https://blog.naver.com/turquo2se?Redirect=Log&logNo=220816845397,"메밀전과 메밀전병도 주문했어요~ 봉평메밀국수맛집,봉평메밀미가연 , 봉평막국수맛집, 봉평메밀막국수맛집, 미가연, 강원도미가연, 봉평미가연, 평창미가연 기본 반찬~ 메밀전병, 메밀전병맛집... ",당신의 목소리는 '보이스컬러'와 함께,https://blog.naver.com/turquo2se,2016-09-20
 봉평미가연 .봉평 의 비주얼,https://blog.naver.com/yjkim228?Redirect=Log&logNo=222504999904,봉평미가연은 반찬도 세가지나 줍니다. 단메밀과 쓴메밀을 섞어 100% 메밀국수를 내는봉평메밀미가연봉평의 비주얼은 무려 이정도입니다. 인상적인 경험이었어요. 봉평 놀러가실 때 가보시길요. p.s. 봉평... ,"국수, 그 찰나를 쓰다",https://blog.naver.com/yjkim228,2021-09-14
[평창맛집]봉평 메밀 미가연: 메밀 막국수 맛집,https://blog.naver.com/bluebuskr?Redirect=Log&logNo=220445352937,메일로 유명한봉평 면 근처에메밀막국수 맛집들이 모여 있는데 여러 음식점 중에서 서비스와 접근성을 우선적으로 고려해미가연 을 택했다. 가장 손님들이 많은 곳은 따로 있지만 거긴 대기시간만 1시간을... ,블루버스로 떠나는 여행,https://blog.naver.com/bluebuskr,2015-08-09
맛집1박 2일 출연 평창봉평 메밀 요리 전문점 ‘ 미가연 ’... ,https://blog.naver.com/mnjstyle?Redirect=Log&logNo=221446530672,"맛집 정보 건강한메밀 요리 한 상,봉평‘ 미가연 ’ 안녕하세요. 크리스틴입니다. 여행... 평창군봉평 면 기풍로 108 영업시간: 10:00-20:00 주차 정보: 전용 주차장 있음 #평창맛집 # 봉평 맛집 # 봉평메밀 맛집... ",크리스틴의 트래블로그 Christine's Travlog,https://blog.naver.com/mnjstyle,2019-01-20
 봉평미가연메밀맛집,https://blog.naver.com/rizmam?Redirect=Log&logNo=222492840772,강원도 인플루언서가 되고 나서 강원도 여행 갈 일이 이래저래 많이 생기네요 좋은 징조입니다 오늘은봉평 메밀맛집미가연 을 소개해 드릴게요봉평 을 가면 우리는메밀 요리를 꼭 먹고 오는데 속도 편하고... ,필 조아의 느낌 있는 캠핑,https://blog.naver.com/rizmam,2021-09-04
 봉평미가연 + 봉평메밀 막국수+ 봉평 육회비빔밥+허브나라맛집... ,https://blog.naver.com/ddudbleb?Redirect=Log&logNo=220424325914, 봉평 메밀음식 전문점미가연 의 외부 모습입니다. 효석문화마을이 위치한봉평 에 걸맞게 지은듯... ㅎㅎㅎ봉평맛집!!메밀 음식 전문점미가연 의 내부 모습도 담아 봤습니다. 새로 이전한지 얼마 안되어서인지... ,더블B의 이야기,https://blog.naver.com/ddudbleb,2015-07-19
평 창ㅣ 봉평 메밀맛집미가연 과봉평 차이나,https://blog.naver.com/photoharu?Redirect=Log&logNo=220469544852,평 창ㅣ 봉평 메밀맛집미가연 과봉평 차이나 이번 평창여행의 메인 테마는 ' 메밀 꽃'이다. 지금이 딱메밀 이 흐드러지게 피는 시기. 이맘때즘 평창에서 효석문화제가 열리기도 한다.메밀 꽃을 본 적이 있었던가... ,::Happy-Go-Round::,https://blog.naver.com/photoharu,2015-09-02
생생정보통 육회 메밀비빔국... 평창봉평메밀미가연8월... ,https://comcomin.tistory.com/18540,8월 23일 월요일 kbs 2tv 생생정보 1374회 유별난 맛집 육회메밀비빔국수 [봉평메밀미가연] 전화번호 033-335-8805 주소 강원도 평창군 봉평면 창동리 268-7 영업시간 10:00 ~ 20:00 연중무휴 메뉴 가격 정보... ,★■ 일루와 ■★,https://comcomin.tistory.com/,2021-08-23
평창봉평 맛집미가연이대팔 100%봉평메밀 의 진실은?,https://blog.naver.com/nicearra?Redirect=Log&logNo=220601282721,평창봉평 맛집미가연이대팔 100%봉평메밀 의 진실은? 이효석의 단편소설 ' 메밀 꽆 필 무렵' 의 배경지 강원도 평창군봉평 면에 위치한 '이효석 문학관'을 다녀오면서 현지인이 간다는봉평메밀전문점에서... ,앨리의 느낌표 (사진과 여행),https://blog.naver.com/nicearra,2016-01-18
 봉평 메밀 맛집미가연 ,https://blog.naver.com/freeems?Redirect=Log&logNo=221385397630,지인의 적극 추천으로 방문하게된봉평미가연저도 추천합니다 내년가을에엔 다시봉평 에 와서메밀 꽃축제도 즐기고 맛있는 음식도 꼭 먹을 생각만 하여도 빨리 가을이 다시 기댜려 지네요 음식점 밖에... ,꿈꾸는 여행자,https://blog.naver.com/freeems,2018-10-26
 봉평메밀미가연강원도 평창군맛집 100%메밀면 이래요.,https://blog.naver.com/jslee119?Redirect=Log&logNo=222449313141, 봉평메밀미가연강원도 평창군맛집 100%메밀면 이래요.봉평메밀미가연봉평하면 생각나는 음식 중 하나가 봉평 메밀이 아닌가 싶은데요. 평창에 갔다가 지역 특유 음식인 봉평메밀국수는 먹어봐야지! 싶어서... ,내인생 조국을 위하여 문수봉(李楨汕),https://blog.naver.com/jslee119,2021-07-29
" 봉평메밀 막국수,메밀 싹육회, 진짜 맛있는 집미가연 ",https://blog.naver.com/c4men98?Redirect=Log&logNo=20191065750," 제가봉평 을 다녀온 이유는??최근에봉평 을1박2일로 다녀왔는데요. 지역발전을 위한 자원봉사라고...봉평메밀 막국수미가연 은메밀 막국수, 특히 이대팔을 한메밀 막국수가 유명합니다. 또미가연 ... ",김케터의 부동산&마케팅,https://blog.naver.com/c4men98,2013-07-06
" 봉평 메밀 막국수미가연인정, 대통령훈장 받은 집",https://blog.naver.com/theuhakus?Redirect=Log&logNo=220791712687,2년전에도 가족들과 함께봉평 메밀 꽃축제 보러 와서 들렀던 곳이 바로 강원도봉평 에 위치한메밀 막국수 전문미가연 을 들렀습니다. 몰랐는데 박근혜대통령상을 수상하기도 했네요. 먼저번엔 이정도 유명세를... ,TROY'S LIFE,https://blog.naver.com/theuhakus,2016-08-20
강원도봉평 메밀 막국수 맛집!미가연 ,https://blog.naver.com/gtedhsdo?Redirect=Log&logNo=221269879036,ㅋㅋ 오늘은 지난주 강원도에 놀러 갔다가 돌아오는 길에 갔던봉평 메밀 막국수에 대해 포스팅하려고... 즐거운 시간 보내세요.♡ * 부모님 사비로 다녀온 맛있는 맛집입니다. :) ㅋㅋ 강원도봉평미가연위치,"HeyU의 행복한 일상, 패션, 여행블로그 :)",https://blog.naver.com/gtedhsdo,2018-05-07
강원도봉평 메밀맛집으로 유명한미가연 (味家宴),https://blog.naver.com/dltkdgjsp?Redirect=Log&logNo=40189583776,"오늘은봉평 메밀맛집으로 유명한 음식미가연 (味家宴) 포스팅을 들고 왔네요 :) 저는 평소에 칼국수... ㅋㅋ 음식사진만 잇네용 ㅎ 일단 매우 배고프니메밀 전병을 시켰어요.메밀 전병은 5,000원~~~! 야곰야곰... ","The Mellan, 더 멜랑 :)",https://blog.naver.com/dltkdgjsp,2013-05-23
 봉평 메밀 국수집미가연 ,https://blog.naver.com/rcjji?Redirect=Log&logNo=220342853900," 봉평 에 전병이 유명한가봐요. 그리고 2009년의미가연 . 이전하기 이전 건물이에요.메밀 막국수,메밀 싹나물 비빔밥 등을 시킨 거 같네요. 마지막 사진은메밀 싹 주스일거에요. 다음은 작년 6월에 찍은 육회... ",요리책 따라하기,https://blog.naver.com/rcjji,2015-04-27
 봉평 메밀 막국수가 유명한미가연 에서,https://blog.naver.com/joym700?Redirect=Log&logNo=220332285730, 메밀 이 유명한봉평미가연 을 점심을 해결하기위해 찾았답니다. 이곳미가연 은봉평메밀 막국수 단지와는 조금 떨어져 있군요 일반적으로 이효석 문화원 주변으로 형성이 되어있는데 이곳은봉평 초입에 자리를... ,만석꾼이 전하는 미스터리쇼핑,https://blog.naver.com/joym700,2015-04-16
