title,link,description,bloggername,bloggerlink,postdate
평창봉평메밀미가연고급스러운 메밀묵,https://blog.naver.com/babo890327?Redirect=Log&logNo=222371536700,"간단하게 메밀국수를 먹기로 결정하고,봉평메밀미가연 을 찾았어요. 평창군 봉평면이라 시골이다보니... 전부 미가연을 찾은 분들일 정도로 이 근방에서는 여기가 가장 손님이 많았어요. 평창 맛집으로 많이... ",여신예디♥blog,https://blog.naver.com/babo890327,2021-06-03
"강원도 평창 맛집봉평메밀미가연 , 메밀장인의 명품 메밀국수",https://blog.naver.com/art_de4?Redirect=Log&logNo=222525894160,강원도 평창 맛집봉평메밀미가연메밀로 유명한 봉평 여행에서 당연히 특색있는 봉평 메밀을 맛보고... 봉평에서 메밀로 만드는 다양한 제품을 강원도 평창 맛집 미가연에서 구입할 수 있다. 총평 워낙 메밀... ,스위스 건성라이프,https://blog.naver.com/art_de4,2021-10-04
평창봉평 메밀 미가연/ 늘봄카페,https://blog.naver.com/dkgmsdl?Redirect=Log&logNo=222522079441,"아무래도 봉명메밀미가연에서는 메밀국수, 면류가 유명하다 보니 저희도 면 요리를 위주로 시켜서...봉평메밀미가연강원도 평창군 봉평면 기풍로 108 매일 10 : 00 - 20 : 00 [마지막 주문 19 : 00] 033 - 335 - 8805 바로... ",달보드레하다,https://blog.naver.com/dkgmsdl,2021-09-30
강원 평창봉평 메밀맛집미가연다녀온 후기,https://blog.naver.com/youhu1223?Redirect=Log&logNo=222534904952,유명한 메밀맛집이 있어요봉평메밀미가연강원도 평창군 봉평면 기풍로108 번호:0507-1405-8805 매일 10:00... 했는데 봉평 메밀막걸리는 처음이였어요 그래서 좀더 설레였던거 같습니다 ㅋㅋㅋㅋㅋ 아 역시... ,삶은 소로링의 뷰티일상,https://blog.naver.com/youhu1223,2021-10-13
[평창] 봉평메밀미가연 ::육회 비빔국수가 맛있었던 곳,https://blog.naver.com/silver_0328?Redirect=Log&logNo=222484012552,엄마가 좋아하는 메밀국수를 먹으러 평창 봉평 막국수로 유명한 미가연에 다녀왔어요. 평일 점심시간... 근데봉평메밀미가연 에서는 공기밥을 시키면 미역국과 김을 추가로 제공해주더라고요. 메밀을 먹지 않는... ,은동e 블로그,https://blog.naver.com/silver_0328,2021-08-26
평창여행/봉평여행 진짜 메밀 막국수맛집봉평메밀미가연 ,https://blog.naver.com/hjhj4556?Redirect=Log&logNo=222517319540,찾다보니봉평메밀미가연 이 많이 나오더라구요. 봉평이 메밀이 유명한 곳이다보니 막국수집이 많은데... 메밀싹과 먹으니까 고소고소한 맛이 나더라구요. 다음으로는 100% 메밀 미가연이 나왔습니다. 슴슴한... ,TRY EVERYTHING,https://blog.naver.com/hjhj4556,2021-10-02
"평창봉평 메밀 미가연 , 휘닉스 파크 근처 맛집, 봉평시장 맛집... ",https://blog.naver.com/soqls0321?Redirect=Log&logNo=222425468332,지난 평창 여행 때 다녀왔던 ‘ 봉평 메밀 미가연 ’ 식당입니다. 메밀의 고장 봉평에 왔으니 메밀로... 미가연 식당 계산대 앞에 있는 기계에 전화번호를 등록하면 카톡으로 웨이팅 순서를 알려주고... ,요이삔것의 즐거운 일상,https://blog.naver.com/soqls0321,2021-07-09
강원도 평창 명인의 맛집봉평 메밀 미가연 ,https://blog.naver.com/kang6864?Redirect=Log&logNo=222250376869,"강원도 평창 명인의 맛집봉평 메밀 미가연안녕하세요~ 한강부부입니다 강원도 여행의 마지막... 인제에서 먹은게 더 맛있었는데, 누군가와 새로운 맛집을 찾는다면 평창 미가연도 좋을득! #평창맛집 #봉평미가연",한강부부의 흥로그,https://blog.naver.com/kang6864,2021-03-03
평창 휘닉스파크 맛집봉평 메밀육회 막국수미가연 ,https://blog.naver.com/mortareh?Redirect=Log&logNo=222295448771,평창 휘닉스파크 맛집 봉평 메밀 육회 막국수 미가연 안녕하세요~ 맛집찾아 여행다니는... 메밀의 본고장 봉평에서 먹으니 더욱 의미가 있는것 같아요.봉평 메밀 미가연운영시간 오전10시부터 오후8시까지... ,여행이 체질 Blog,https://blog.naver.com/mortareh,2021-04-01
 봉평 메밀 국수 전문점 메밀 꽃 필무렵 미가연 ,https://blog.naver.com/happy0599?Redirect=Log&logNo=222517616289,집에와서 찾아보니 작년에봉평 의 또다른메밀 국수 맛집 ' 미가연 '을 갔다가 찍은 사진있더라구요. 그래서 간단히 비교를 해볼까합니다. ' 미가연 '은 요리사분이 몇년전 tv에서 요리대결? 프로에서 상을 받으신... ,사계절 맛보기,https://blog.naver.com/happy0599,2021-09-26
봉평 맛집 내돈내산봉평메밀미가연육회비빔국수와 메밀싹... ,https://blog.naver.com/sayuri91?Redirect=Log&logNo=222497946790,그릇 매년 9월이 되면 봉평 메밀꽃을 즐기고 미가연에선 메밀국수를 즐기는 우리만의 루틴이 생겼다. 온전한 메밀의 맛과 명인의 인생을 맛보고 싶다면 봉평 맛집봉평메밀미가연 ! 봉평 맛집 내돈내산 오빠가 사줌!,timid Bom:D,https://blog.naver.com/sayuri91,2021-09-07
"강원도 평창맛집 메밀장인, 명인의 집봉평메밀미가연 ... ",https://blog.naver.com/semins77?Redirect=Log&logNo=222263296767,스키장으로 고고고~♡ #평창맛집 #봉평맛집 #봉평메밀면 # 봉평메밀미가연#봉평오봉순 #한식대가 #메밀명인 #100%메밀면 #육회 #메밀막걸리 #막국수맛집 #봉평막국수... ,대한민국 맛집도우미 '맛동산 샘',https://blog.naver.com/semins77,2021-03-03
평창 맛집 /봉평메밀미가연: 면이 맛있는 메밀국수 맛집,https://blog.naver.com/luvlyj7?Redirect=Log&logNo=222523995579, 봉평메밀미가연매일 10:00 - 20:00 연중무휴 (마지막 주문 : 저녁 7시까지) 강원 평창군 봉평면 기풍로 108 메밀밭이 유명한 강원도 평창 (메밀꽃필무렵의 고장!) 그렇다면 메밀 맛집에 찾아가지 않을 수 없죠... ,그녀들의 취미생활,https://blog.naver.com/luvlyj7,2021-10-02
2021 늦은 여름휴가 #1 평창봉평 메밀 미가연 ,https://blog.naver.com/chooojee88?Redirect=Log&logNo=222501360095,전병도 다 못먹고 말았다 그래서 그 뒤로메밀먹으러는 또 안갔음... 근데 이제야 또 먹고싶네 ? #평창 #평창 메밀# 봉평메밀#평창한화리조트 # 미가연# 메밀 100 #쓴 메밀# 메밀 맛집 #평창 메밀 맛집 # 봉평메밀 맛집,CHUNIVERSE: the World of CHU,https://blog.naver.com/chooojee88,2021-09-10
평창 육회비빔국수 :봉평메밀미가연 ,https://blog.naver.com/h2a0412?Redirect=Log&logNo=222492255439,평창에 위치한봉평메밀미가연 에 왔습니다. 이곳은 육회비빔국수라는 메뉴가 인기가 좋다고 하는데요. 품질 좋은 메밀과 싱싱한 한우를 사용해서 그 맛이 더욱 좋다고 합니다. 봉평 미가연은 한적한 시골... ,금류의일상,https://blog.naver.com/h2a0412,2021-09-02
평창 맛집봉평 메밀 미가연 ,https://blog.naver.com/hiddenpearl7?Redirect=Log&logNo=222244761632,지난달 1월말에 다녀왔던 강원도 평창에서 찾아갔던 음식점봉평 메밀 미가연 입니다 봉평 또는 메밀꽃 필무렵 이라는 문학작품을 학창시절에 들어본 적이 있어서 저는 봉평이라는 지명이 어디 따로 있는줄... ,유랑의 소박한 공간,https://blog.naver.com/hiddenpearl7,2021-02-15
[10.15.]평창 맛집2 #봉평메밀미가연#카페지수 인 봉평,https://blog.naver.com/qlrqod6098?Redirect=Log&logNo=222538002193,메밀국수맛집 #봉평메밀막국수 #평창맛집봉평메밀미가연주소 : 강원도 평창군 봉평면 기풍로 108... 까지) 봉평하면 메밀이 가장 유명한 고장인데 그중에서도 미가연이 가장 유명한 맛집으로 불린다.... ,끄적거리기,https://blog.naver.com/qlrqod6098,2021-10-15
[평창/봉평맛집] 원빈도 반한 맛집봉평메밀미가연후기,https://blog.naver.com/jen512?Redirect=Log&logNo=222428946383,세계제일의 메밀장인 오봉순 명인이 있는 그곳봉평메밀미가연영업시간 : 낮 10시에서 밤 10시... 대박수 명인집답네요 다 순수메밀면을 손수 우리 뚜동생~ 봉평미가연 홍보대사인줄 깔깔깔 우리 미동생... ,♡예지니주니 일상♡,https://blog.naver.com/jen512,2021-07-13
평창봉평 메밀 미가연메밀국수 맛집,https://blog.naver.com/eos19205?Redirect=Log&logNo=222427887543," 봉평 메밀 미가연평창 봉평 메밀 맛집 어느날 달린 블로그 댓글에 답방 했다가 알게된 봉평 메밀... 자리에 앉아서도 고민하다가 이대필 메밀 미가연과 육회 비빔국수 메밀, 메밀전과 메밀주스를 주문했습니다.... ",The Story like Wind,https://blog.naver.com/eos19205,2021-07-12
[평창] 켄싱턴 호텔 _ 송어의집 _ 황태회관 _봉평메밀미가연+,https://blog.naver.com/naanaa_art?Redirect=Log&logNo=222466888260,픽★ # 봉평메밀미가연깔끔하고 건강한 맛의 막국수♡ 막국수 유명한 봉평 들러 막국수로 여행의 마무리를 잘 해주었지요☆ 빨리 코로나 종식되어 마스크 벗고 자유롭게 여행하는 날을 고대하며 모두들 힘♥,냐냐의 조각들,https://blog.naver.com/naanaa_art,2021-08-12
 봉평메밀미가연평창 내돈내산,https://blog.naver.com/shaina0720?Redirect=Log&logNo=222519271461,"안켜셨어요봉평메밀미가연메뉴 메밀막국수 8,000원 비빔메밀막국수 8,000원 수육 소(1-2인분) 17,000원... 놀러오시면봉평메밀미가연방문해 보시는것도 좋을꺼 같아요 주소: 강원도 평창군 봉평면 기풍로 108... ",누누캐슬,https://blog.naver.com/shaina0720,2021-09-28
평창봉평메밀 미가연막국수 맛집 :),https://blog.naver.com/dlqhsrydal?Redirect=Log&logNo=222387967156,"평창봉평메밀 미가연막국수 맛집 :) 여행을 갈때면 꼬옥 검색해보는 맛집 ! 아이들이 있다보니... 메뉴판 정독 시아작~* 막국수의 프리미엄급 이라고 해도 과언이 아닌 봉평 미가연, 메밀의 진정한 맛을 볼수... ",민똥아뿡생선네집♡,https://blog.naver.com/dlqhsrydal,2021-06-07
 봉평메밀미가연10월 1-2주 고객 목소리,https://blog.naver.com/dddoing8805?Redirect=Log&logNo=222536136172,저희 미가연이라니!!! 이런 칭찬이 또 어디있나요ㅎㅎ 강원도 평창에서 제일가는 대표 맛집이 된 것 같은 기분이라 평창 지역 활동에도 이바지한 것 같아 정말 큰 보람을 느꼈네요봉평메밀미가연 에 오시기 위해... ,메밀명인 오봉순의 사는 이야기,https://blog.naver.com/dddoing8805,2021-10-13
"박사골밤농원, 1킬로 커피,봉평 메밀 막국수 ;미가연 , 무인양품",https://blog.naver.com/chanelyun?Redirect=Log&logNo=222532444106,"#1킬로커피 카페 블렌딩 버보니아 1kg \23,800 # 미가연# 봉평메밀 막국수미가연메밀 국수 1팩 \12,000... 식사용 #무인양품 행주(대형) 2장 1set \5,900 / 행주(소형) 12장 1set \5,900 #주간장보기 #일주일장보기... ",A life close to nature!,https://blog.naver.com/chanelyun,2021-10-10
생생정보통 육회메밀비빔국수 평창봉평메밀미가연 ... ,https://blog.naver.com/wjddkdiazz?Redirect=Log&logNo=222481125629,"생생정보통 육회메밀미가연 메뉴 육회메밀비빔국수 15,000원봉평메밀미가연주소 강원도 평창군 봉평면 기풍로 108 [지번] 창동리 268-7 전화번호 033-335-8805 영업시간 매일 10:00 - 20:00 (마지막 주문 7시까지... ",놀러오세요~,https://blog.naver.com/wjddkdiazz,2021-08-23
평창 봉평 맛집 : 메밀막국수봉평메밀 미가연 ,https://blog.naver.com/flora_k33?Redirect=Log&logNo=222517673111,평창 봉평 맛집 메밀막국수 미가연 강원도에 왔으니 메밀막국수를 먹어줘야한다. 맛집 검색해보니 숙소... 맛이 아니라서 신기했던 곳. 봉평에 가면 먹어볼만한 음식이었다 :) #평창맛집 #봉평맛집 # 봉평메밀미가연 ,청춘기록:혼자 또는 둘,https://blog.naver.com/flora_k33,2021-09-26
평창 메밀막국수 맛집 추천 ::봉평메밀미가연 ,https://blog.naver.com/anjelgs?Redirect=Log&logNo=222490350315,찾아온봉평미가연건물 바로 앞에 주차 자리는 넉넉하게 있다메밀 국수 가게라서(?)메밀 꽃이 활짝... 같은메밀 국수 진짜 맛집 !! 추천 #평창점심 #평창막국수 # 봉평메밀 막국수 # 봉평 막국수 # 봉평 점심... ,Shine Sunday(:,https://blog.naver.com/anjelgs,2021-08-31
강원도 평창봉평 메밀요리 맛집미가연 ,https://blog.naver.com/no1khw?Redirect=Log&logNo=222537254801,"강원도 평창봉평 메밀요리 맛집미가연강원도 평창봉평하고 검색을 하면 제일 많이 나오는게 이효석,메밀꽃필 무렵,메밀 ~~ 이런게 많이 나오는데 그래서 유명한 이효석의 흔적을 찾아 떠나기전... ",나무의 향기에 취하다,https://blog.naver.com/no1khw,2021-10-15
평창 봉평면봉평메밀 미가연 ,https://blog.naver.com/mpxg8017?Redirect=Log&logNo=222303680946,여기 미가연은 평소 공부를 같이 하는 지인의 소개로 알게된 식당이다. 평소 횡성의 용둔 막국수집도... 명인집봉평메밀 미가연이었습니다. # 봉평메밀미가연#메밀명인집 #평창막국수 #봉평막국수 #이천오동추야,오동추야,https://blog.naver.com/mpxg8017,2021-04-09
평창 맛집봉평메밀미가연 ,https://blog.naver.com/skswor?Redirect=Log&logNo=222471197638,맛집 메밀막국수 맛은 어떨런지 궁금해져서 평창 맛집봉평메밀미가연 에 와 봤습니다 소방서도 있는 걸 보면 여기가 봉평면 읍내인 듯한데 깡촌이라 그런지 읍내도 한적하고 경치가 좋네요 세련된 고급 맛집... ,JACK과 LUCY의 맛집 여행기,https://blog.naver.com/skswor,2021-08-15
평창봉평 메밀 요리 맛집 :미가연솔직 후기,https://blog.naver.com/ttttt10?Redirect=Log&logNo=222118932175,"평창봉평 메밀 요리 맛집 :미가연솔직 후기 글,사진-쩡스리 안녕하세요 :) 아침부터 저희가족은 평창... 찾아간봉평 의메밀 면 맛집!미가연 에 대한 솔직 후기 남겨봅니다 ^.^ 외부에서 봐도 상당히 넓어보이던... ",쩡스리 Daily Life♩,https://blog.naver.com/ttttt10,2020-10-18
평창 맛집/봉평메밀미가연 (메밀막국수),https://blog.naver.com/chlthgus0216?Redirect=Log&logNo=222492084583,다시마 식초와 설탕이있다 내 입맛에도 조금 써서 식초와 설탕을 조금 넣어서 먹었다 그래도 아주 강한 메밀맛 굳굳 #평창맛집 #봉평맛집 #봉평메밀국수 # 봉평메밀미가연#봉평미가연 #회비빔메밀국수,기억저장소,https://blog.naver.com/chlthgus0216,2021-09-02
평창봉평메밀미가연 ,https://blog.naver.com/trophysy?Redirect=Log&logNo=222490093563,"menu 육회비빔국수, 메밀미가연, 메밀전병, 메밀전 Previous image Next image 메밀미가연, 육회비빔국수... (우리집은 생생정보통을 열심히 본다ㅎㅎ) 강원도 평창에 있는 #메밀맛집 # 봉평메밀미가연 ... ",❤ 유정이네 ❤,https://blog.naver.com/trophysy,2021-08-31
시원한메밀 국수로 여름나기~! 봉평 메밀 국수미가연 ,https://blog.naver.com/gks1207?Redirect=Log&logNo=222402522872,메밀국수 맛집 ‘봉평 미가연’ 의 후기를 남겨봅니다 평창에 다녀오는 길에 ‘ 봉평 메밀 미가연 ’...평일인데도 사람 많아요~ 주말만 많은게 아니었음.. ㅋ 봉평메밀막국수 오늘의 리뷰 끝!,RAI 와 rai 의 일상,https://blog.naver.com/gks1207,2021-06-18
평창봉평 메밀 미가연 ,https://blog.naver.com/mirapink?Redirect=Log&logNo=222530753400, 봉평미가연 의메밀막국수~ 다시 봐도 또 먹고 싶다. 평창봉평미가연 에서는 순수메밀 면을 손수 만들고 있다고 한다. 일주일에메밀 을 두 번만 먹어도 팔팔해진다니.. 맛도 있고 건강하기까지한메밀 면 앞으로... ,꼬리별 이야기,https://blog.naver.com/mirapink,2021-10-08
 봉평메밀미가연7월 3주 차 고객 리뷰,https://blog.naver.com/dddoing8805?Redirect=Log&logNo=222439032666,지난 한주봉평메밀미가연 을 다녀가신 분들의 후기를 정리해봅니다. 다른 주보다 많은 분들이... 들기름과 메밀싹 칭찬해 주시고 강원도 막국수 많이 드셨는데 미가연은 뭔가 다르다는 말씀 그리고 다시... ,메밀명인 오봉순의 사는 이야기,https://blog.naver.com/dddoing8805,2021-07-21
" 봉평메밀 국수 ' 미가연 ', 명인이 만든메밀 막국수,메밀 전병 맛본... ",https://blog.naver.com/ljubavu?Redirect=Log&logNo=222494537476,Top3 #봉평메밀국수 #봉평메밀막국수 #봉평메밀전병 #봉평맛집 #강원도맛집 #봉평메밀국수맛집 #봉평메밀막국수맛집 #봉평미가연 #미가연 # 봉평메밀미가연#명인이만든메밀국수 #명인메밀국수... ,세계일주 다녀온 무인카페 사장,https://blog.naver.com/ljubavu,2021-09-04
강원도봉평 메밀 막국수 재방문 |미가연메밀 100% + 새말IC... ,https://blog.naver.com/adamshoe?Redirect=Log&logNo=222376305681,# 봉평메밀미가연이 원래 이름이었군요! ㅎㅎ 동탄 - 횡성 까지 차 안막히은 시간대에 출발해서... 가 메밀 미가연 메뉴더라구요!! 네이버 스마트주문 도 지원하는군요! 또는 이렇게 테이블마자 부착되어있는... ,빨간와인부부 열정과 낭만가득,https://blog.naver.com/adamshoe,2021-05-31
[ 봉평 메밀 미가연 ] 메밀에 진심인 평창 메밀맛집/ 메밀 마시썽... ,https://blog.naver.com/j_s57?Redirect=Log&logNo=222374980498,강원도 여행을 갔다면 메밀 미가연 한번 들러서 메밀로 된 음식들을 먹는것도 쏠쏠한 재미이니 추천한당! #평창맛집 #육백마지기맛집 # 봉평메밀미가연#메밀국수맛집 #평창메밀맛집,JOIE DE VIVRE,https://blog.naver.com/j_s57,2021-05-30
[평창 여행]봉평메밀미가연 ,https://blog.naver.com/dasol0_0?Redirect=Log&logNo=222416775880,[평창 여행]봉평메밀미가연주차는 매장 뒷편에 하면됩니당 주차 공간이 넓어서 주차 걱정은 안 해도... 좋은 조합 #미가연메뉴 #미가연가격 밥먹고 근처 돌아가니기도 좋아요#평창맛집 #평창메밀면 #평창국수,hap·pi·ness,https://blog.naver.com/dasol0_0,2021-07-01
평창봉평메밀미가연 ,https://blog.naver.com/junsu6464?Redirect=Log&logNo=222397484707,평창봉평메밀미가연 에 다녀왔습니다 오토바이타고도 간다는 맛집 서울에서 평창까지 거리가 꽤... 합니다 메밀 미가면 1 육회 비빔국수 1 육회 비빔밥 1 메밀전병 1 수저통은 따로 없습니다 주문을 하면... ,팔도유람,https://blog.naver.com/junsu6464,2021-06-14
평창 추천 맛집 봉평 메밀 100% 막국수봉평메밀미가연 ,https://blog.naver.com/lovebinself?Redirect=Log&logNo=222256212344,만드는봉평메밀미가연먹고 나오는데 하늘이 예뻐서 한 컷! 봉평 메밀하면 떠오르는 작품이 있죠? 바로 '메밀꽃 필 무렵' 그 작품의 작가 '이효석' 선생이 바로 이곳 봉평에서 태어나셨어요. 그래서 주변에... ,조금은 부지런해도 괜찮아,https://blog.naver.com/lovebinself,2021-02-25
2TV생생정보 유별난맛집 육회메밀비빔국수봉평메밀미가연 ... ,https://blog.naver.com/anarch69?Redirect=Log&logNo=222481155365,"6,000원 메밀싹 육회 비빔밥 12,000원봉평메밀미가연주소 : 강원도 평창군 봉평면 기풍로 108 문의 : 033-335-8805 영업시간 : 10:00 - 20:00 장사의 신 연 매출 14억 원, 돼지목살갈비 한 상 사또화로구이 1374회... ",콩콩이의 맛있는 여행,https://blog.naver.com/anarch69,2021-08-23
"평창올림픽시장 메밀나라, 100%메밀막국수봉평메밀미가연 ",https://blog.naver.com/mesmerize-j?Redirect=Log&logNo=222439975441, 봉평메밀미가연 의 100%메밀국수입니다. 우선 그릇들부터가 눈길을 확 사로잡는 곳이었어요. 쓴 메밀과 단 메밀을 조합해서 100% 메밀면을 쓴다고 하는데 100번이상 씹어줘야 쓴 맛에서 단맛이 난다고 해요. 쓴... ,mesmerize-j님의블로그,https://blog.naver.com/mesmerize-j,2021-07-21
강원도봉평 메밀 마을메밀 면... 육회 메밀 비빔면 맛집추천미가연 ,https://blog.naver.com/chlgmlwjd673?Redirect=Log&logNo=222280619403,기억을 더듬어서 올 만큼 맛있던 곳 양도 푸짐해서 추천합니다요^^~~~! # 봉평메밀# 미가연#육회메밀비빔면 #메밀국수 #봉평맛집 #평창 #강원도메밀국수 #메밀요리,코봉씨의 블로그,https://blog.naver.com/chlgmlwjd673,2021-03-19
육회메밀비빔국수 맛집 ' 봉평 메밀 미가연 ' 2TV 저녁 생생정보,http://saffroner.egloos.com/6837949,# 봉평 메밀 미가연#미가연 #봉평미가연 #육회메밀비빔국수 #2TV 저녁 생생정보 #생생정보통 맛집오늘 #2TV저녁생생정보오늘 이날 소개된 맛집은 코로나 방역수칙에 따라 마감시간이 조정될 수 있으니... ,당신의 손길이 닿기 전에,http://saffroner.egloos.com/,2021-08-24
[강원도 평창]봉평메밀미가연:: 휘닉스파크 근처 육회 메밀국... ,https://blog.naver.com/654486?Redirect=Log&logNo=222304057080,식초도 다시마초네요~히히 육회와 함께 메밀국수 드시고 싶으신분들은 한번봉평 메밀미가연 에서 드셔보세요 ❣ 그럼 즐거운 불금 되시구요 ♡ 봉평미가연 매일 10:00 ~20:00 연중무휴 ( L.O 19:00 ) 포장가능,luv-jun2,https://blog.naver.com/654486,2021-04-09
 봉평메밀미가연강원도 평창군맛집 100%메밀면 이래요.,https://blog.naver.com/soslsosl?Redirect=Log&logNo=222275376024,봉평하면 생각나는 음식 중 하나가 봉평 메밀이 아닌가 싶은데요. 평창에 갔다가 지역 특유 음식인... 강원도 평창군맛집 봉평하면 메밀막국수 100% 메밀면을 맛보고 싶으시다면 추천합니다.봉평메밀미가연 ,미랑씨의 소소한일상,https://blog.naver.com/soslsosl,2021-03-14
 봉평메밀미가연매실청/ 매실엑기스 담그는 법/ 육수와 양념... ,https://blog.naver.com/dddoing8805?Redirect=Log&logNo=222400334326,이상봉평메밀미가연 의 매실청 매실액기스 만드는 방법이었습니다. 미가연 육수와 양념 맛 왜 좋은지 아시겠쥬~~^^ 여러분도 댁에서 한 번 해 보시죠! 함께보시면 좋은글! 강원도 봉평 맛집 미가연_자가... ,메밀명인 오봉순의 사는 이야기,https://blog.naver.com/dddoing8805,2021-06-16
생생정보통 육회메밀비빔국수 유별난 맛집봉평메밀미가연 ,https://blog.naver.com/eueuy?Redirect=Log&logNo=222481272842,"생생정보통 유별난 맛집 - 육회메밀비빔국수 ▶봉평메밀미가연- 주소 : 강원도 평창군 봉평면 기풍로 108 - 문의 : - 가격 : 이대팔 100% 육회 비빔국수 (육회메밀비빔국수) 15,000원 ※ 매일 10:00 - 20:00... ",이랑이랑 맛집찾기,https://blog.naver.com/eueuy,2021-08-23
평창맛집봉평메밀미가연내돈내먹 솔직후기,https://blog.naver.com/yrkim0624?Redirect=Log&logNo=222423312950," 봉평메밀미가연전화 0507-1405-8805 주소 강원도 평창군 봉평면 기풍로 108 지번강원도 평창군 봉평면... 봉평하면 봉평 메밀밭 유명한데 평창맛집치니까 나오길래, 다녀온 봉평미가연이예요~ 혹시나 메밀밭도... ",온니율월드ღ(· ᴥ ·)ｯ,https://blog.naver.com/yrkim0624,2021-07-07
 봉평 메밀 미가연- 메밀 100%봉평맛집,https://blog.naver.com/cuteahah?Redirect=Log&logNo=222252278640,봉평 메밀집 중에 제일 괜찮은집!!봉평 메밀 미가연순메밀 100% 봉평 맛집 봉평 시장쪽에 위치한 미가연은 시장 골목안이 아닌 바깥쪽에 위치해서 음식점 단독 주차장이 넓은 편이다. 휘닉스 근처 봉평 메밀집은... ,Alps,https://blog.naver.com/cuteahah,2021-02-22
육회메밀비빔국수집봉평메밀미가연밀양 얼음골부부의... ,https://blog.naver.com/freestylei02?Redirect=Log&logNo=222481355859,"유별난 맛집 - 육회메밀비빔국수 ▶봉평메밀미가연- 주소 : 강원도 평창군 봉평면 기풍로 108 - 가격 : 이대팔 100% 육회 비빔국수 (육회메밀비빔국수) 15,000원 ※ 매일 10:00 - 20:00 연중무휴 (마지막 주문... ",☆,https://blog.naver.com/freestylei02,2021-08-23
강원도 평창 봉평면 맛집봉평메밀미가연 (메밀비빔국수... ,https://blog.naver.com/seoa8786?Redirect=Log&logNo=222277052560," 봉평메밀미가연메뉴 # 봉평메밀미가연메뉴 #메밀비빔국수 : 10,000원 #메밀싹육회비빔밥 : 12,000원 #메밀전병 : 6,000원 # 봉평메밀미가연운영시간 매일 10:00 ~ 20:00 #마지막 주문 : 19시 #봉평119안전센터 근처에... ",또와~떠아❤️ 다이어리,https://blog.naver.com/seoa8786,2021-03-16
신계숙 맛터싸이클! 평창 육회 메밀 비빔국수봉평메밀미가연 ,https://blog.naver.com/ndsibs?Redirect=Log&logNo=222426791107,푸드인 육회 메밀 비빔국수 맛집으로 소문난봉평메밀미가연그리고 삼방산 용천수(水)에서 자란... 미가연! 네이버 업체 등록 사진 캡처 하염없이 쏟아지는 눈과 동계올림픽으로 유명한 강원도 평창!... ,"일산! 지킴이 ""일산아재""",https://blog.naver.com/ndsibs,2021-07-10
