title,link,description,bloggername,bloggerlink,postdate
"올림픽공원 맛집 : 벽제갈비의샤브샤브지점,봉피양냉면도 맛... ",https://blog.naver.com/suri_world?Redirect=Log&logNo=220487098221,근데봉피양 에서 냉면 먹지 말고..옆에 벽제샤브샤브가서 먹을 수 있다는 점...더 기다리지 마시고 벽제샤브샤브가서봉피양냉면 드세요 ㅋ_ㅋ 우리는샤브샤브 에서 냉면도 먹을 수 있단 얘길 듣고뭘 먹을까... ,Daygram,https://blog.naver.com/suri_world,2015-09-20
[방이동 맛집/송파구 맛집]수요미식회 평양냉면 맛집:봉피양 ... ,https://blog.naver.com/trustreal?Redirect=Log&logNo=220733107026,ㅎㅎ점심과 저녁시간은 사람이 많으니 항시 미리가서 웨이팅 해야함 우리가 밀려서 간곳은봉피양 샤브 샤브집임 봉피양에서 샤브샤브도 하는건 처음 알았음...뭐 아무튼 봉피양 메뉴판 모습과 수요미식회... ,허니보이,https://blog.naver.com/trustreal,2016-06-11
하이브리드 그 맛.봉피양 ,https://blog.naver.com/durujoo72?Redirect=Log&logNo=222235828860,방문했다^^ 봉피양은 미슐랭가이드에도 등재된데다가 70년 장인 요리사를 스카웃 했단다. (나는야 배운여자ㅋㅋㅋ) 미우새 현*엽 먹방을 보며 느므 맛있을거 같아 후다닥 방문했다ㅎㅎ 우리는봉피양 샤브 샤브와... ,마이쮸사랑님의블로그,https://blog.naver.com/durujoo72,2021-02-07
"5/22(토) 주말동정 -봉피양 , 이마트 트레이더스 위례점",https://blog.naver.com/aneshim?Redirect=Log&logNo=222366103390,지하봉피양 으로... 주차는 조금더 편하게 롯데월드타워 지하4층으로... 요즘 어디 가는곳마다 포르쉐... 양이 좀 모자라는것 같아서 냉동샤브샤브몇개 더 담궈서...ㅋㅋ 후식은 세트로 딸려온 우동사리 하나... ,Califonia Dreamin',https://blog.naver.com/aneshim,2021-05-25
벽제 샤브샤브봉피양이전 간판 천갈이,https://blog.naver.com/kansign?Redirect=Log&logNo=220759433315, 샤브방이점 시공한사진 포스팅 해보겠습니다. 처음으로 플렉스 간판의 사이즈는 가로 80cm 세로 3m 에 되는 조금은 작은 사이즈에 플렉스간판입니다. 기존 위치에서 옆쪽으로 옮긴뒤 상호명이봉피양 으로... ,칸사인 칸디자인,https://blog.naver.com/kansign,2016-07-11
서래마을 봉비양샤브벽제갈비 직영점 영수증 후기,https://blog.naver.com/and1211?Redirect=Log&logNo=222164108776,#서래마을맛집 #방배동맛집 #소고기 #부채살 #안창살 #평양냉면 # 봉피양 샤브#서래마을 직영점... 완전 배불리 먹고 나옴. 담에는 샤브 먹으러 또 가보고 싶네. 너무너므 잘 먹었습니다 여보느님!!!,모모오빠의 라이프로그,https://blog.naver.com/and1211,2020-12-11
서울 방이동의봉피양 ,https://blog.naver.com/kbrkjs?Redirect=Log&logNo=220728756194,"벽제 갈비집, 벽제 샤브샤브 ,봉피양모두 한식벽제그룹 소속 입니다.. 벽제 갈비집 앞에서 주차요원에서 차를 주차 맡기고 나서봉피양입구를 바라보니 평일인데도 저녁 시간대라서 그런지 손님들이... ",승리의 빛 님의 블로그,https://blog.naver.com/kbrkjs,2016-06-06
"수요미식회 평양냉면,서울3대평양냉면맛집, 봉피양 ,방이점",https://blog.naver.com/zz_zz01?Redirect=Log&logNo=220384620753,벽제 샤브샤브집에서도 먹을수 있다네요 ㅋㅋㅋ 바로 걸어갔지요 청미 여기도 벽제갈비랑 다 같은 집 ㅎㅎㅎㅎ 멀지 않아요 바로 옆에 붙어있는 벽제샤브샤브 ~~~봉피양 과는 또 다른 분위기죠?? 여긴 손님이... ,"""춘장이네”허춘장,둔켈,룽고❤️",https://blog.naver.com/zz_zz01,2015-06-09
 봉피양샤브 샤브 갈바알루미늄채널,https://blog.naver.com/kansign?Redirect=Log&logNo=220845253700,안녕하세요 칸디자인입니다 오늘은 갈바알루미늄채널간판에 대해 포스팅해보겠습니다. 처음으로 갈바바에 레이저커팅한부분을 광학산PC로 부착을해준다음 갈바레이저커팅 한 나머지글자들을... ,칸사인 칸디자인,https://blog.naver.com/kansign,2016-10-25
[방이] 수요미식회 평양냉면~봉피양방이점!,https://blog.naver.com/angelmink?Redirect=Log&logNo=220417876057,아마 햄버거 편이었던 듯.울릉도에서_발묶여_4박5일.jpg 쫌 전에 공강이라 혼자 밥 먹으러 나왔다가벽제 샤브샤브 에서봉피양평양냉면 맛봤다.먹고 들어온 게 지금 10분도 안 지남 ㅋㅋㅋ 알고보니 수요미식회... ,순간의 반짝임도 영원한 보물이야,https://blog.naver.com/angelmink,2015-07-12
"[송파, 방이동]봉피양:: 평양냉면, 녹두전",https://blog.naver.com/jeny1326?Redirect=Log&logNo=220383233894,"벽제갈비, 벽제 샤브샤브 , 청미,봉피양등등 자식들한테 하나씩 나눠준건가 싶고 ㅋㅋ 한달전쯤 남편이 냉면먹고싶다 그래서봉피양 에 갔는데 그땐 그닥 더울때가 아니었는데도 대기가 길었다. 두명이라고... ",제니제니,https://blog.naver.com/jeny1326,2015-06-08
수요미식회 평양냉면 방이동봉피양 ,https://blog.naver.com/rlaalsckd11?Redirect=Log&logNo=220379279389,"벽제갈비,샤브샤브 ,봉피양모두 같은 집입니다. 일단 만두도 주문합니다. 총 3명이서 갔기에 가위바위보로 한 명은... 하나만 나머지 둘은 두 개씩 먹었습니다. 저도 두개 먹었어요.^^ 육즙이 가득한 게... ",오리궁디,https://blog.naver.com/rlaalsckd11,2015-06-04
[방이동]봉피양 ,https://blog.naver.com/lshsps?Redirect=Log&logNo=220398993407,"모 음식 티비프로그램에 냉면 맛집으로 소개된 뒤로 냉면 손님이 그야말로 북새통을 이루고 있는봉피양방이점. 인근 벽제갈비와샤브샤브 쪽으로 냉면 손님은 돌리고 있는 상황이었다. 일인분 24,000원에... ",희동이의 블로그,https://blog.naver.com/lshsps,2015-06-24
 봉피양돼지갈비,https://blog.naver.com/redcat77?Redirect=Log&logNo=221175719782,"바로 옆건물 벽제갈비 건물에서는 소고기 먹을 수 있는것 같아요 맛있는 고기 소고기, 돼지갈비,샤브샤브등 부위별 요리별로봉피양 에서 맛있게 먹을 수 있을 것 같아요",달인이 되고 싶은 빨강고양이(좋은일만 가득하겠지!),https://blog.naver.com/redcat77,2018-01-01
방이동_수요미식회에서 극찬하던 평양냉면 봉피양 ,https://blog.naver.com/nonunori?Redirect=Log&logNo=220466329494, 샤브샤브집으로 옮기고봉피양 과는 대조적으로 한산한 분위기 물냉면 2그릇에 사리 추가 했어요 참고로 한우사태수육을 싸게 팔더라구요 냉면 가격은 12000원 비싸게 보이지만 한우로 육수 내고 메밀로 면... ,귀요미와 쪼꼬미♡,https://blog.naver.com/nonunori,2015-08-30
"미우새 신동엽 맛집샤브샤브양곰탕 단골집, 나이 아내 맨투맨... ",https://blog.naver.com/hipboy3?Redirect=Log&logNo=222139803579,"음식점은봉피양샤브서래점. 샤브샤브와 육회 돼지갈비, 양곰탕까지 현주엽 정말 잘먹더라는...샤브샤브 고기도 정말 좋아보이고, 한그릇에 만칠천원이라고 하는 양곰탕, 정말 먹어보고 싶다... 그는 의외로... ",찐상이의 일상이야기,https://blog.naver.com/hipboy3,2020-11-09
방이동봉피양본점에서 냉면과 양곰탕,https://blog.naver.com/luvlyusm?Redirect=Log&logNo=220793056221,ㅎㅎ봉피양본매장엔 자리가 없어서 바로앞 벽제 샤브샤브매장으로 안내해서 어디서 먹는 메뉴와 맛은 똑같다고하니 믿고 앉아 주문부터해요~봉피양 은 평양물냉면이 유명하지만 오빠는 비빔냉면이 더... ,BYSSUN,https://blog.naver.com/luvlyusm,2016-08-21
[방이동] 봉피양 (벽제 봉피양 냉면/ 봉피양 냉면/평양냉면맛집... ,https://blog.naver.com/couple99?Redirect=Log&logNo=220003223823,"서울에서 제일비싼 냉면이라고도 하는봉피양평양냉면: 12,000원(메밀70%+전분30%) 순면: 16,000원 (메밀100%) 발렛비: 2,000원봉피양 입구봉피양 입구 벽제갈비 -봉피양 (냉면)- 벽제설렁탕- 벽제 샤브샤브요렇게... ",Couple99,https://blog.naver.com/couple99,2014-05-18
[ 봉피양냉면] 수요미식회 냉면집/벽제 샤브샤브 에서 먹고 왔어요,https://blog.naver.com/rlatnals8595?Redirect=Log&logNo=220717059448,냉면만 먹을거라면 벽제 샤브샤브 에서 먹을 수 있다해서 저희는 대기하지 않고봉피양옆에 있는 벽제 샤브샤브 로 갔답니다~ 위치는 5호선 방이역을 이용하시는게 가깝고 며칠전 제가 다녀온 올림픽공원 장미정원... ,아기참새의 세상살이 ★,https://blog.naver.com/rlatnals8595,2016-05-23
서래마을 카페 르뺑아쎄르 서래점 크로캉 맛있는 빵,https://blog.naver.com/wj_2169?Redirect=Log&logNo=222370170046,서래마을 카페 르뺑아쎄르 알고 찾아간 곳은 아니고 맞은편봉피양 샤브 에 들었다가 맞은편에 보여서 찾아간 서래마을 카페입니다 당일 생산해서 당일 판매를 하고 화학 첨가제가 안 들어간 건강한... ,패리스맘의 맛있는 세상,https://blog.naver.com/wj_2169,2021-05-27
더워요? 그럼 드세요! 냉면 맛집 ' 봉피양 '_방이점,https://blog.naver.com/bungya?Redirect=Log&logNo=220717243252,걸어오셔서 드셔도 되요 :) + TIP 봉피양옆에 청미랑 벽제 샤브샤브 가 있어요! 거기서두 동일하게 먹을 수 있다네요~그리고 주차비2000원 :) #청미 #벽제 샤브샤브# 봉피양 냉면 + LAST!! 잘생겨떠어 우리곰돌잉 (하트하트),meanieB,https://blog.naver.com/bungya,2016-05-23
"평양냉면 맛집봉피양 : 수요미식회, 식객의 바로 그 평양냉면!",https://blog.naver.com/ahram1120?Redirect=Log&logNo=220446667077,개이득??ㅋㅋㅋㅋ봉피양 의 대표 메뉴 평양냉면과 한우사태수육을 주문!샤브샤브 집도 괜찮았어요! 인테리어도 깔끔하고 시원하고~봉피양 의 평양냉면과 한우사태수육입니다! 진한 육수의봉피양 의 평양냉면... ,A람의 블로그,https://blog.naver.com/ahram1120,2015-08-10
미우새 신동엽 단골집샤브샤브돼지갈비 육회 집 현주엽 김호중,https://blog.naver.com/eueuy?Redirect=Log&logNo=222132967964,미운우리새끼에 현주엽과 김호중이 간 신동엽 단골집 샤브샤브 돼지갈비 육회집은봉피양 샤브서래점 1인용 샤브 냄비가 독특하네요 우영과 양파와 채소를 볶다가 육수를 넣고 고기 투하해서 먹는 샤브샤브 !!... ,이랑이랑 맛집찾기,https://blog.naver.com/eueuy,2020-11-02
방이동봉피양평양냉면. 해장으로 제격..!,https://blog.naver.com/yognee?Redirect=Log&logNo=220982542361,"이상하게 잠이 깨어 몸은 피곤한데, 잠은 오지는 않고,, 해장이나 하러 가야지 하는 마음으로봉피양 으로 향했다. Korean Artisanal Bistro. Artisanal Bistro. 장인의 식당! 한 여름에 가면 별관까지,샤브샤브파는... ","포미블로그:맛집, 일상(적인 먹부림), (잡)생각, 정보",https://blog.naver.com/yognee,2017-04-13
방이동 맛집)봉피양 에서 평양냉면과 만두를 먹다,https://blog.naver.com/bbjr4422?Redirect=Log&logNo=220553043396, ㅋㅋㅋㅋㅋㅋ 그길로 차를 돌려서봉피양 으로 갔다. 발렛주차를 맡기고. 날이 추운데 그래도 평양냉면 먹을 생각에 기뻤다. 번호표를 받고 기다리는데 냉면 드실꺼면샤브샤브 집에서도 냉면 드린다고... ,으랏차차 살룬 유난,https://blog.naver.com/bbjr4422,2015-11-28
[수요미식회맛집]봉피양 에서 먹는 평양냉면,https://blog.naver.com/3dpmania?Redirect=Log&logNo=220480978002,또 다른 사실은 벽제샤브샤브 에서도봉피양평양냉면을 먹을 수 있다는 점! 웨이팅하면서 찍어봤습니다~ 메뉴판입니다. 메뉴판2 무생채가나옵니다. 벽제 프리마 김치 김치가 맛이좋은지 따로 판매하네요.... ,3DP mania,https://blog.naver.com/3dpmania,2015-09-14
수요미식회 평양냉면맛집 방이동봉피양 ,https://blog.naver.com/whdutksla2?Redirect=Log&logNo=220412217243,------------내돈 내고봉피양 가서 냉면먹고 내맘대로 쓰는 후기------------ 냉면마니아 요남님과봉피양 ... 벽제 샤브샤브 에서도 판매한다고 하네요 저희는 평일 점심때 갔는데 10분안쪽으로 기다렸어요 두명이라... ,-블로그쟁이가 된 조대리,https://blog.naver.com/whdutksla2,2015-07-07
소울푸드 냉면 #9 방이동 맛집봉피양 ,https://blog.naver.com/pooq87?Redirect=Log&logNo=220692255661,옆에 자매브랜드 벽제 샤브 로 가면 바로 먹을 수 있지만 그냥 기다렸다가봉피양 에서 먹기로 합니다.봉피양 은 면수가 아니라 물을 주는데 이건 별로 마음에 들지 않아요.봉피양 은 가격도 평양냉면 전문점 중... ,열혈청년의 세상 탐험!,https://blog.naver.com/pooq87,2016-04-26
"송파 방이동봉피양 , 우래옥과 필동면옥의 중간 느낌.",https://blog.naver.com/ggomii00?Redirect=Log&logNo=220729657488,송파 방이동에 있는봉피양 을 방문하기로 합니다. 대기자 명단에 이름을 써야 하는군요... 냉면 먹을 건지 고기를 먹을 건지도 써야 합니다. 벽제 샤브샤브 가 있군요. 처음 알았네요. 발렛아저씨들이 많이... ,■꽁이 미식회■,https://blog.naver.com/ggomii00,2016-06-08
[방이]봉피양 ,https://blog.naver.com/justhhs?Redirect=Log&logNo=220419693978, 봉피양주차안내. 대기자 명단 적을 때 고기도 먹을 건지 냉면만 먹을 건지 물어보셔서 저희는 그냥 냉면만 먹겠다고 했더니... 벽제 샤브샤브 로 안내해 주셨어요. 뭔가 좌천되어 가는 기분? ㅋㅋ... ,퐝야퐝야,https://blog.naver.com/justhhs,2015-07-14
방이동봉피양평양냉면 벽제갈비 돼지고기와 함께~을밀대만큼... ,https://blog.naver.com/danaa10?Redirect=Log&logNo=220432147958,"벽제갈비,샤브샤브 , 청미,봉피양다 북적북적! 수요미식회에 나온 뒤로 더 인기라네요. 일단 돼지갈비로 시작했어요. 통마늘과 함께 구워먹으니 맛있네요. 1인분에 24000원이라 가격이 높은편이지만 잘... ",발란스후한의원,https://blog.naver.com/danaa10,2015-07-26
*봉피양방이동 평양냉면/ 수요미식회 평양냉면,https://blog.naver.com/jjun2311?Redirect=Log&logNo=220404946037,20분의 웨이팅 끝에 들어간봉피양 ~ 손님이 많을때는 벽제갈비와 벽제샤브샤브 에서도 냉면을 판매한다고 한다. 내부에는 돼지갈비와 냉면을 드시는 손님들로 가득. 우린 돼지갈비도 먹을까 하다가 이번에는... ,* Foodstudio 다믈스튜디오,https://blog.naver.com/jjun2311,2015-06-29
"송파/방이 맛집 : 돼지갈비의 절.대.강.자,봉피양 ",https://blog.naver.com/pcs_812?Redirect=Log&logNo=220770992924,"벽제갈비랑, 벽제 샤브샤브 는봉피양 을 중심으로 왼쪽, 오른쪽에 자리잡고 있어요~ 대기하는 곳에 이렇게 천막으로 되어있습니다. 깜짝 놀란건 에어컨 두대가 뜨악~ 대기도 너무 좋네요! 얼마나 시원한지^^ 10분... ",해.피.바.이.러.스 :D,https://blog.naver.com/pcs_812,2016-07-25
"평양냉면 4대천왕 -봉피양냉면 방이점 탐방기 (위치, 주차... ",https://blog.naver.com/bomnal_land?Redirect=Log&logNo=220417183886,"본점에는 사람이 너무 많아 못 들어가고, 바로 옆 '벽제샤브샤브 ' 매장으로 안내를 받았습니다. 자리에 앉아서 찍은 매장 전경이에요.봉피양 보다 나름 분위기 있고 괜찮네요 평양냉면은 크게 동치미... ",봄날이야기,https://blog.naver.com/bomnal_land,2015-07-11
방이역 맛집봉피양 에서 평양냉면을 호로록호로록,https://blog.naver.com/dhraldls?Redirect=Log&logNo=220444114515,벽제갈비와 벽제샤브샤브 가봉피양 의 가족브랜드이기 때문에 이곳에서도봉피양 의 평양냉면과 메뉴들을 맛볼수있다고 했다. 요것은봉피양 의 메뉴들이 담겨있는 메뉴판. 맘 같아선 한우떡갈비며 빈대떡이며... ,훌리랄라의 다이어리,https://blog.naver.com/dhraldls,2015-08-11
소개 되었던 평양냉면 맛집봉피양방이점/ 봉피양본점,https://blog.naver.com/skyhoihi?Redirect=Log&logNo=220821941007," 봉피양 은 원래 벽제갈비라는 갈비집으로 유명했다고 하던데 본점에 방문하니까 벽제갈비 옆으로봉피양그옆으로 청미설렁탕, 청미설렁탕 옆 라인으로 벽제대게 샤브샤브 - 백선생님 한신포차,역전우동... ",체리하나의 꿈꾸는 하루,https://blog.naver.com/skyhoihi,2016-09-27
수요미식회 평양냉면편의 여파가 아직까지...봉피양송파점,https://blog.naver.com/contac2?Redirect=Log&logNo=220380423070,모르지만봉피양평양냉면을 이길 순 없으니까요 ㅋㅋㅋ 아니나 다른까 수요미식회로 홍보물이 떡 하니 붙어 있고... 수요미식회 때문에 사람들이 얼마나 몰려 들었는지 평양냉면을 바로 옆 벽제 샤브샤브 에서... ,꼴갑맨의 Naughty Nuts,https://blog.naver.com/contac2,2015-06-05
 봉피양방이점(평양냉면 맛집 / 수요미식회맛집),https://blog.naver.com/aiba56?Redirect=Log&logNo=220406886308, 봉피양[방이점] 올여름 두 번째로 먹은 평양냉면은 수요 미식회에서도 나왔던봉피양우리가 간 곳은... 그리고 우리 차례가 되자 뒤쪽에 있던 식당 벽제샤브샤브 로 보내짐. 같은 벽제 브랜드라서 냉면만... ,라의 신나는 일상♪,https://blog.naver.com/aiba56,2015-07-01
[서울/방이동] 수요미식회평양냉면/봉피양/ 평양냉면맛집... ,https://blog.naver.com/dbfl6347?Redirect=Log&logNo=220376581088, 봉피양 만 들렸다왔습니다 외관입니다- 원래 유명했던집이 수요미식회에 나오면서 더 북적북적해져 웨이팅이 40분정도 걸렸네요 식객에도 등장하신분이라 더 유명한곳! 요즘 사람이 많다보니 옆에 벽제 샤브샤브 ... ,유리나의 소소함 가득-:),https://blog.naver.com/dbfl6347,2015-06-01
[맛집/방이동] 평양냉면 세계 입문 ' 봉피양 ',https://blog.naver.com/c1052kh?Redirect=Log&logNo=220394459340,양호~ 근데봉피양맞은편 가게에 써 있는 글을 보니 냉면만 먹으려면 그 옆에 있는 벽제 샤브샤브 에서도 식사가 가능하다고해서 쓱~ 들어가보니.. 럭키!!!봉피양매장보다 깨끗하고 시원한 매장에 널찍한... ,꿈틀꿈틀 Eat. Pray. Love,https://blog.naver.com/c1052kh,2015-06-18
평양냉면의 장인/깊은 육수와 면의 풍미가 살아있는봉피양방이점,https://blog.naver.com/phy0308v?Redirect=Log&logNo=220494552450,제외) 봉피양 과 벽제갈비가 함께 하니 평양냉면도 양쪽에서 다 먹을 수 있는 듯 해요벽제 샤브샤브 는 바로 근처에 있는 가게 입니다 담에는 여기도 가볼까 해요(청초가샤브샤브사랑하니까요) (온 김에 인증샷도)... ,♥꾸꾸젤리이야기♥,https://blog.naver.com/phy0308v,2015-09-29
방이동 평양냉면 맛집 ' 봉피양 ' - 수요미식회 평양냉면 맛집,https://blog.naver.com/lovelysuns?Redirect=Log&logNo=220421635854,방이동 평양냉면 맛집 ' 봉피양 ' - 수요미식회 평양냉면 맛집 평양냉면의 대가 김태원 장인의 정성과...샤브샤브전문점과 설렁탕 전문점을 바로 옆쪽에 런칭했다고... 메뉴판은 필요한 분들 참조하시길... ,Lovelysuns' Photo Essay 'NOW',https://blog.naver.com/lovelysuns,2015-07-16
2015.8.27.봉피양 (방이동) / 요염한 맛의 평양냉면 전문점.,http://ryunan9903.egloos.com/4393809,ㅎㅎ) 그리고 마지막은봉피양 의 물냉면 육수를 맛봤을 때.... 맛이 있고없고의 여부를 떠나 그냥... 냉면만 먹는 손님이라면 바로 옆에 있는 벽제샤브샤브 라는 가게에서도 먹을 수 있다고 하더군요. 아래에는... ,류토피아 (RYUTOPIA),http://ryunan9903.egloos.com/,
 봉피양 에서 갈비탕과 떡만둣국,https://blog.naver.com/khnoh113?Redirect=Log&logNo=220937649065,"2천원 내고,식사비 37,000원 냈어요 돈 쓰기 참 쉽죠잉~~ 방이동 일대가 죄다봉피양가게로 도배가 됐더라구요봉피양본관,별관, 샤브샤브등등 갈비탕 가격이 사악해서 두번은 못 갈 듯요 ㅋㅋㅋ",건강하게 활기차게 행복하게,https://blog.naver.com/khnoh113,2017-02-17
"20140705_강동쪽에서 평양냉면이라면,봉피양(방이동)",https://blog.naver.com/tinycare?Redirect=Log&logNo=220058091051,벽제 샤브샤브이런것도 있었네~근처에 있나보다 이집이야 워낙 유명하다보니 굳이 코멘트를 할 것도 없고 냉면도 참 맛있으니... 이때도 금식! 글 내용에 만족하셨다면 이웃추가 어떠세요? :)봉피양서울시... ,이상우 애널리스트의 작은배려,https://blog.naver.com/tinycare,2014-07-26
맛있는 닭가슴살 /봉피양갈비탕 / 삼진어묵 / 감자한 마음들 ),https://blog.naver.com/mylucky1029?Redirect=Log&logNo=221182462347," 봉피양갈비탕 , 삼진어묵 , 그리고 도향촌 월병까지 ! ! # 도향촌 월병 처음 먹어봤는데 . . . 이것은 정말... # 집에서샤브샤브 도 만들어 먹고 . 계란 소스까지 만들었다 . 으흐흣 이왕 먹는거 제대로 먹어야지... ",분홍 Island ♡,https://blog.naver.com/mylucky1029,2018-01-11
