title,link,description,bloggername,bloggerlink,postdate
서래마을맛집봉피양 샤브서래점 스키야키 깔끔하고 독특한 맛,https://blog.naver.com/wj_2169?Redirect=Log&logNo=222369492395,서래마을맛집봉피양 샤브서래점 진작에 가고 싶었던 곳인데 이제 가봤네요 서래 마을은 제가 사는... 먹은봉피양 샤브 를 저도 먹어 봤지요 처음에는 샤부샤부인 줄 알았는데 스키야키라고 하더라고요... ,패리스맘의 맛있는 세상,https://blog.naver.com/wj_2169,2021-05-27
방배동 함지박사거리에 있는 벽제갈비 ( 봉피양 샤브 ) 에서 돼갈... ,https://blog.naver.com/25eon?Redirect=Log&logNo=222436021440, 봉피양샤브 로 바뀌었군요 이제 알았네 위치는 함지박사거리에 있습니다. 갈비 먹으러 왔는데 샤브가... 저희는 돼갈을 먹으러 왔으므로 봉피양 돼지갈비를 시킵니다. 배고픔에 눈이 멀어 사진을 대충... ,♬곰곰이의 여자블로그,https://blog.naver.com/25eon,2021-07-18
서래마을봉피양샤브신동엽이 선택한 그집,https://blog.naver.com/ashleyyeon?Redirect=Log&logNo=222142878598,"청담은 봉피양수려로 메뉴가 완전 다르더라구요 샤브를 특화시킨봉피양샤브 에서 한우등심샤브 2인분, 육회 60g, 맛보기 물냉면 2그릇을 시켰어요 봉피양은 고기로도 유명하지만 평양냉면으로도... ",♥️,https://blog.naver.com/ashleyyeon,2020-11-13
 봉피양 샤브서래점에서 신동엽 스키야키 먹고왔죠,https://blog.naver.com/imprinted_mr?Redirect=Log&logNo=222250008189,봉피양은 갈비랑 곰탕 먹으러 가끔 가는 곳인데 스키야키를 하는지는 몰랐어요. 샤브샤브도 하고 스키야키도 하나 봅니다. 아주 넓은 내부봉피양샤브서래점은 지하1층에 있어요. 발렛을 맡기고 지하로... ,매끼에 목숨걸기,https://blog.naver.com/imprinted_mr,2021-02-20
미우새 신동엽 맛집 -봉피양샤브(양곰탕),https://blog.naver.com/sw20woo?Redirect=Log&logNo=222132952463,찾아보니까봉피양샤브서래점 한우등심샤브 1인분에 42000원이네요 우선 샤브샤브 몇인분 먹은지 모르겠는데 먹고 나서 돼지갈비하고 육회를 시켰는데요 돼지갈비가 익는 동안 기다려야 하기 때문에 육회를... ,은밀한 칩거생활,https://blog.naver.com/sw20woo,2020-11-02
"[서초]봉피양샤브서래점 한우등심스키야키, 돼지본갈비, 육회... ",https://blog.naver.com/ksh64871?Redirect=Log&logNo=222144809943,"해보고봉피양샤브서래점 봉피양비빔냉면 13000원 계란 지단이랑 무절임, 깨, 양념장 등이 들어간듯 참고로 난 평양냉면을 안 좋아한다 사골육수 같이주신 국물은 따뜻하지만 간은 약간 심심하다 혹시... ",폭식인생 맛집로그,https://blog.naver.com/ksh64871,2020-11-15
서래 마을 맛집봉피양 샤브 ,https://blog.naver.com/iou3104?Redirect=Log&logNo=222359709062,"벽제갈비, 봉피양은 원래 좋아하는 고깃집입니다. 저는 샤브샤브를 좋아하지만 고기는 구워 먹는 게 좋은 남편을 만나고 거의 가지 않았습니다. (물에 빠진 고기는 싫다고...ㅜ_ㅜ)봉피양 샤브셀프 식사가... ",대치맘 생존기,https://blog.naver.com/iou3104,2021-05-21
방배동 벽제갈비( 봉피양샤브 ) 서래점,https://blog.naver.com/readrica?Redirect=Log&logNo=222451049697,싶었거든요 봉피앙샤브로 되어있지만 벽제갈비였던 곳? 아직도 같이하는 것 같아서 두근거리며... 들지 않았어요 한 번쯤 유명한 갈비를 먹어보고 싶다면 추천드려요. #내방역 #벽제갈비 # 봉피양샤브#주차 #가격,Rica's Daily Life,https://blog.naver.com/readrica,2021-07-31
서래마을_ 봉피양샤브 . 건강샤브샤브,https://blog.naver.com/yunaly?Redirect=Log&logNo=222102258503,서래마을의봉피양 에서는샤브샤브 를 특기로 판다 일식에서 응용된 한국식샤브샤브 이지만 원재료 맛을 살릴 수 있고 연한 육수 등 전반적으로 슴슴한 외식이라 바람직하다. 죽대신 초밥 2알이 나오는데... 그냥... ,yunaly님의 블로그,https://blog.naver.com/yunaly,2020-09-28
서래마을 맛집 :봉피양샤브 ,https://blog.naver.com/derwent?Redirect=Log&logNo=221682257734, 봉피양 샤브 .봉피양+샤브 샤브인가 봅니다. 부모님 모시고 점심 식사하러 들렀습니다. 어르신들이 참 좋아하는 집이죠. 찬 정갈하고 음식 맛나고. 테이블 세팅. 벽제갈비와 봉피양의 극명한 차이. 돼지갈비가... ,Gourmet & Travel,https://blog.naver.com/derwent,2019-10-19
[서초구/방배동]봉피양 샤브서래점 ★,https://blog.naver.com/habakdr?Redirect=Log&logNo=222448284905,"영업시간 11:30 ~ 21:30 간만에 찾는봉피양샤브서래점. 예전에는 벽제갈비였는데. 진짜 비싸구나. 전채요리. 봉피양은 돼지갈비 맛집. 냉면이 14,000원이라니... 메뉴판. 찬 세팅. 깔끔하다. 설화생갈비... ",마른수퇘지,https://blog.naver.com/habakdr,2021-07-28
"무조건 단골집 룸예약[ 봉피양샤브 , 우참판, 바른고기정육점]",https://blog.naver.com/wonsamkim?Redirect=Log&logNo=222460864335," 봉피양샤브서래점봉피양샤브서래점 봉피양 평양냉면.. 서래마을에서 젤 맛있는 냉면같아요.. 전문 냉면집이 있지만, 갠적으론 여기 냉면이 젤 땡기고, 가끔씩 먹고싶어 생각나는 곳이네요.. 특히 한우설화... ",Life is Sweet(라스지기),https://blog.naver.com/wonsamkim,2021-08-07
서래마을 맛집 : 프라이빗룸이 있는 ' 봉피양 샤브 ' 신동엽 단골집,https://blog.naver.com/jaelomon87?Redirect=Log&logNo=222539311492,서래마을 프라이빗룸 식당봉피양 샤브서래마을 근처에 왔다가 오랜만에 봉피양에 다녀왔어요. 서래마을에 있는 봉피양은 샤브와 스키야키도 함께 판매해요. 가게외관 신동엽의 단골 맛집이라고 적혀있네요.... ,재로몬의 다이어리,https://blog.naver.com/jaelomon87,2021-10-17
"미우새 신동엽맛집 서래마을봉피양샤브 (메뉴,가격)❤️",https://blog.naver.com/dailystella?Redirect=Log&logNo=222164499241, 봉피양샤브서래 신동엽 맛집으로 유명한봉피양샤브서래마을점을 다녀왔어요! 미우새에서 현주엽씨와 김호중씨가 나와서 먹기도 한곳이죠_ 들어갈때 입구부터 붙어있던 ㅋㅋㅋ 신동엽맛집!! 저희는... ,DAILY STELLA,https://blog.naver.com/dailystella,2020-12-06
미우새 신동엽 단골 맛집 샤브샤브 양곰탕 @ 봉피양샤브 ,https://blog.naver.com/prettyforu?Redirect=Log&logNo=222134007839,식비가 어마어마하겠다는 쓰잘데기없는 생각이 든다. 누구랑 같이 식사하려면 각자 먹은만큼 더치해야지. 어디 밥값 감당하겠나ㅜ #미우새맛집 #신동엽단골식당 #샤브샤브맛집 # 봉피양샤브#석쇠불고기 #양곰탕,로히의 유니스타일,https://blog.naver.com/prettyforu,2020-11-03
서초동봉피양샤브서래점 한우갈비와 곱창전골 후기,https://blog.naver.com/ashleyyeon?Redirect=Log&logNo=222152606054,겁나 맛있다고 하더라고요 비빔면이 전 비빔면은 싫어해여 지난주보다는 면이 잘 익은것같아서 이번엔 참 맛있게 먹었던 물냉면이에요 봉피양 냉면 매력있습니다 결론적으로는봉피양샤브 에서는 샤브를 먹짜!,♥️,https://blog.naver.com/ashleyyeon,2020-11-23
[서울]봉피양샤브서래점(벽제갈비),https://blog.naver.com/kjinazz?Redirect=Log&logNo=222143386571,스타일 아님 간신히 먹음다 먹고나니 후식을 주심! 뭔지 까먹음 ㅎㅎ 아무튼 주차는 힘들고 고기는 너무 맛있음 다음에도 오고싶다 # 봉피양샤브#벽제갈비 #양곰탕 #봉피양돼지갈비 #봉피양평양냉면 #신동엽맛집,Jin-A's Blog ✨,https://blog.naver.com/kjinazz,2020-11-13
미우새 방영 # 봉피양 샤브서래점 !,https://blog.naver.com/sy910905?Redirect=Log&logNo=222149298296,여러가지로 서비스부분이 너무 아쉬웠네요 ㅠ_ㅠ # 봉피양샤브 샤브 #미우새샤브샤브 #봉피양서래점 #서래봉피양 # 봉피양샤브#강남봉피양 #서초봉피양 #미우새봉피양 #서초맛집 #강남맛집 #데일리 #서이추... ,Bern,https://blog.naver.com/sy910905,2020-11-20
미우새 현주엽 고기집 “ 봉피양샤브서래점” (Feat. 신동엽),https://blog.naver.com/woomin333333?Redirect=Log&logNo=222133452018,이날 방송에서는 샤브샤브 + 돼지갈비 + 한우육회 + 한우석쇠불고기 + 물냉면 + 양곰탕(후식)을 2명이서... 분들이라면 봉피양 서래점은 선택이 아닌 필수인 곳중 하나라고 생각합니다.봉피양샤브서래점 02-537... ,Lucky :),https://blog.naver.com/woomin333333,2020-11-02
나의 미니가 TV에 또 출연~ (feat. 미우새 봉피양샤브 ),https://blog.naver.com/ddangkkonge?Redirect=Log&logNo=222133400971,식당은봉피양샤브서래점. 연예계의 대표 미식가 신동엽씨의 단골 맛집이라고 하는데요. 정갈한 샤브샤브 한상. 그런데 좌측 상단에 보이는 저것은!? 저의 사랑스러운 미니 .. https://ddangkkonge.blog.me/221361420191... ,땅꽁의 캠핑 일상,https://blog.naver.com/ddangkkonge,2020-11-02
"[맛집/Restaurant] 서래마을봉피양 /샤브 샤브 맛집, 서래마을... ",https://blog.naver.com/sofia123485?Redirect=Log&logNo=222264066721,먹보들이었지만 간만에 새로운 샤브샤브 집이어서 새롭고 맛있었어요! 가족들과 외식으로도 좋을 것 같더라구요 :) 다음에도 또 맛있는 맛집 리스트로 돌아올께요! # 봉피양 # 샤브 샤브맛집#서래마을샤브샤브,나비댁 일상,https://blog.naver.com/sofia123485,2021-03-04
 봉피양샤브 _서래점_미우새_신동엽맛집,https://blog.naver.com/roro_ooooooooo?Redirect=Log&logNo=222153732835,얼마 전봉피양샤브서래점 다녀오기우연히 미우새 보다가 김호중 현주엽 두 분께서 먹는 거 보고... 스키야키맛집 # 봉피양샤브# 봉피양샤브 서래점 #신동엽단골집 #돼지갈비맛집 #돼지갈비맛집추천... ,일기장,https://blog.naver.com/roro_ooooooooo,2020-11-25
"[서울 서초] 신동엽 맛집,봉피양샤브서래점",https://blog.naver.com/dasoap24?Redirect=Log&logNo=222133837828,"엄마랑 데이트하는 날, 미우새에서 # 봉피양샤브 서래점 이 나온 방송을 보신 어머니께서 백화점 가기 전 점심으로 먹고 가자해 찾아간 식당. 아니 무슨 샤브샤브집이 이래 화려하대요?! 입구부터 '나... ",마름달 열하루,https://blog.naver.com/dasoap24,2020-11-03
"[내돈내산] 서래마을 맛집봉피양샤브평양냉면, 돼지갈비... ",https://blog.naver.com/superstar_v?Redirect=Log&logNo=222006082659,"어스름이 젖어드는 서래마을 근처, 미식가인 친구가 식사를 대접하는 자리가 있어 함께 했다.(=꼽사리끼다) 친구돈 친구산봉피양샤브서래점 돼지갈비, 평양냉면 솔직후기 갑니다. 체인점인 봉피양 은 알 만한... ",얄미우면 젠토리,https://blog.naver.com/superstar_v,2020-06-19
[함지박사거리맛집] 미운우리새끼 신동엽맛집봉피양샤브 에... ,https://blog.naver.com/wonsamkim?Redirect=Log&logNo=222162839277,라스지기.. #미운우리새끼 #신동엽맛집 #서래마을맛집 #함지박사거리맛집 # 봉피양샤브서래점 #현주엽 김호중 #봉피양 특선 한우 샤브샤브 #미식가 신동엽 #한우등심샤브 #한우등심 스키야끼,Life is Sweet(라스지기),https://blog.naver.com/wonsamkim,2020-12-04
미운오리새끼 신동엽 맛집 서래마을봉피양샤브에 간 김호중... ,https://blog.naver.com/jjiehn?Redirect=Log&logNo=222133002500,미운오리새끼 214회에서는 김호중 님과 현주협 님께서 신동엽 님이 2주에 한 번은 간다는 맛집 《서래마을 봉피양샤부》 서래점 에 방문하여 제대로 된 먹방을 선보였습니다.봉피양샤브서래점 김호중 님은... ,유찌니의 컬렉션,https://blog.naver.com/jjiehn,2020-11-02
"옛 벽제갈비 서래점, 현재봉피양 샤브 ,한우 등심, 돼지갈비... ",https://blog.naver.com/goldenzang1?Redirect=Log&logNo=221708826800,"이름이봉피양샤브 로 바뀌었는데 이것도 벽제갈비에서 직영으로 운영하는 식당입니다. 식당 입구에 상호 변경 안내문이 붙어있네요 벽제갈비는 한우 소고기 주메뉴 식당이고 , 봉피양은 돼지갈비 위주... ",마이다스 골든벨,https://blog.naver.com/goldenzang1,2019-11-15
[201204]봉피양벽제갈비샤브샤브 ,https://blog.naver.com/kaldoma?Redirect=Log&logNo=222164024928,지인과 경기도 나들이 후 늦은 점심 으로 들린 # 봉피양샤브# 봉피양샤브 서래점 주차는 가게의 주차장... ㅜ #샤브샤브 도 맛있네요. #봉피양 3시부터 5시까지는 브레이크타임입니다. 고급지고 맛났네요.... ,無病長壽! 無病長生!,https://blog.naver.com/kaldoma,2020-12-05
미우새 신동엽 맛집공개 어디?봉피양샤브서래점,https://blog.naver.com/icecandy35?Redirect=Log&logNo=222132931497,"미우새 신동엽 맛집봉피양샤브 는봉피양 + 샤브 샤브인것같아요.ㅎ 미우새 신동엽 맛집 샤브샤브봉피양샤브서래점은 특삼한우 우설구이, 양념갈비, 석쇠불고기, 양념불고기, 돼지본갈비... 그리고 특선... ",지구라이프이야기-인생다방,https://blog.naver.com/icecandy35,2020-11-02
맛집탐방- 봉피양샤브서래점,https://blog.naver.com/ljhwife1?Redirect=Log&logNo=222019630658,"늦잠자고 서래마을길로 내려오다가 봉피양을 보고 바로 직행! 평양냉면,만두,설렁탕을 주문하고... 듯~^^ #goodmorning #방배동마녀 #마녀일상 #맛집탐방 #평양냉면 #설렁탕 #만두 #맛집 # 봉피양샤브 서래점 #부업... ",마녀의 맛집.집밥.일상 공유하기,https://blog.naver.com/ljhwife1,2020-07-03
현주엽이 방문한 신동엽 추천 맛집 어디?봉피양 샤브서래점!,https://blog.naver.com/dyeyby?Redirect=Log&logNo=222138047997,"평소 즐겨찾는 샤브샤브 맛집을 김호중, 현주엽씨가 방문해 화제인데요 미우새에서 소개된 이 맛집은 바로 ‘ 봉피양 샤브서래점’ 입니다 ☺️☺️☺️ 샤브샤브 육수도 즉석에서 양파, 우엉을 볶아... ",Every day is a new day,https://blog.naver.com/dyeyby,2020-11-07
 봉피양 샤브서래점은 아니지만 경기도광주맛집 모들샤브,https://blog.naver.com/nr3611?Redirect=Log&logNo=222146870508,서울 서초구 동광로애 위치한봉피양 샤브서래점 샤브샤브 좋아하는 분들이라면 모르실 수가 없죠! 맛집 매니아라면 한번쯤 방문하신다는봉피양 샤브서래점! 정말 맛있죠! ㅎㅎ 가족들과 주말에 드라이브... ,nr3611님의블로그,https://blog.naver.com/nr3611,2020-11-17
미우새 신동엽 샤브샤브 단골 맛집은?' 봉피양샤브 ' 양곰탕... ,https://blog.naver.com/ghkdlxmtlem?Redirect=Log&logNo=222133668808,"미우새 신동엽 샤브샤브 단골 맛집은? ' 봉피양샤브 ' 양곰탕 (김호중,현주엽맛집) 군대 가기 전 촬영을 마친 미우새 김호중편이 어제 방송됐습니다. 김호중이 현주엽을 초대해 집에서 아귀찜을 먹은 뒤... ",유니크썬,https://blog.naver.com/ghkdlxmtlem,2020-11-02
방배동봉피양샤브 ,https://blog.naver.com/gleean?Redirect=Log&logNo=222134512702,방배동 함지박사거리 윗쪽봉피양샤브 는 봉피양벽제갈비네요. 모든 메뉴가 가능한...ㅎ 안창살 100그램 62000원...^^ 조카 결혼식 끝나고 나서 늦은 점심인지라 돼지갈비를 주문합니다. 벽제갈비나 봉피양 가면... ,"I Cook. So, I'm a Cook!",https://blog.naver.com/gleean,2020-11-04
"(서래마을 맛집) 봉피양샤브 (아이와외식, 룸)",https://blog.naver.com/doerdana?Redirect=Log&logNo=222063313635,"#서래마을맛집 # 봉피양샤브 샤브 #아이와외식 #방많은식당 #서래마을외식 #사회적거리두기식당 연휴 마지막날 한끼 배달시켜먹을까 하다가, 배달음식은 직접가서 먹는 것보다 당연히 맛도 별로지만 일회용... ",반전매력 지구인의 놀이터,https://blog.naver.com/doerdana,2020-08-17
서래마을 맛집[ 봉피양샤브 ],https://blog.naver.com/rlatnwls1007?Redirect=Log&logNo=222013017041,고른 # 봉피양샤브지하로 내려가시면 됩니다! 엘레베이터 타고 내려가셔도 되용! 홀에는 파티션으로 다 나뉘어져 있었어요! 저희는 애기가 있어서 룸으로 예약 했습니다! Previous image Next image 저희는 봉피양... ,신혼일기,https://blog.naver.com/rlatnwls1007,2020-06-26
"맛집, 미운우리새끼 신동엽 단골집 ‘ 봉피양샤브서래마을’",https://blog.naver.com/myh6477?Redirect=Log&logNo=222132932403,신동엽이 자주 가는 맛집인 곳은 ‘ 봉피양샤브서래점’이라고 합니다. 야채에 고기를 함께 곁들일 수 있는 식당으로 개인 용기에 양파와 우엉을 볶다 간장 육수를 부은 뒤 각종 야채를 넣고 숨을 죽이게... ,마케터 현이 B L O G,https://blog.naver.com/myh6477,2020-11-02
"11.6일,봉피양샤브 , 서래마을 뚜르뒤뱅",https://blog.naver.com/jhenna?Redirect=Log&logNo=222137909346,^ㅇ^봉피양샤브서래마을점. 신동엽 맛집이라는데 여기저기 미우새에 나왔던 장면을 포스터로 붙여놓았다. 그 만큼 맛있을지?!! 방송을 보고 온 티가 났는지 샤브샤브를 주문했더니 그거 말고 스키야끼라고... ,세무회계 택싱포인트(TP),https://blog.naver.com/jhenna,2020-11-07
" 봉피양샤브 (서래점), 서울 서초구 방배동",https://blog.naver.com/unamango?Redirect=Log&logNo=221692472505,지금은봉피양샤브 로 이름이 바꼈다. 가볍게 저녁식사하러 들른 날. 따뜻한 메밀차로 몸을 녹이고.... 봉피양이나 벽제갈비의 냉면도 지점마다 맛이 다 다른데... 물론 방이 본점이 젤루 맛있는건 말할 필요가... ,쿠家,https://blog.naver.com/unamango,2019-10-30
신동엽 맛집 어디?봉피양 샤브 샤브 위치 메뉴 전화번호 총정리 !,https://blog.naver.com/bjshanshan11?Redirect=Log&logNo=222138083507,02-537-0783 서울 서초구 동광로 89 매일 11:30~21:30 #미우새샤브샤브 #미우새 #미운우리새끼 #신동엽 #신동엽맛집 #신동엽샤브샤브 #봉피양 # 봉피양샤브 샤브 #서래마을샤브샤브 #봉피양서래점 #미우새맛집,리뷰 & 꿀팁,https://blog.naver.com/bjshanshan11,2020-11-07
미운오리새끼 현주협김호중신동협 맛집봉피양샤브 ... ,https://blog.naver.com/yellowhhj?Redirect=Log&logNo=222138024134,미운오리새끼 현주협김호중신동협 맛집봉피양샤브서래점 미운오리새끼 신동엽이 자주간다고 김호중씨와 현주협씨가 찾아간 서래마을 맛집 서래마을봉피양샤브정말 맛있겠죠 ㅠ_ㅠ 자주가시는... ,얄리의 패션이야기,https://blog.naver.com/yellowhhj,2020-11-07
신동엽 맛집 샤브봉피양샤브서래마을 2주에 1번씩 가는 곳,https://blog.naver.com/wondoll2000?Redirect=Log&logNo=222133196430,"그 후 김호중과 현주엽은샤브샤브 와 돼지갈비, 물냉면, 육회, 양곰탕, 석쇠불고기 등 끝없는 ‘먹방’으로 독보적인 존재감도 뽐냈다 미우새’ 신동엽 맛집은 1일 방송된 SBS ‘미운우리새끼’에 해당 식당이... ",노트노트 리뷰 세상,https://blog.naver.com/wondoll2000,2020-11-02
 샤브샤브현주엽 김호중 방배동 고기집 맛집봉피양서래점... ,https://blog.naver.com/codihaja?Redirect=Log&logNo=222133434686,미우새샤브샤브현주엽 김호중 방배동 고기집 맛집봉피양서래점 미운우리새끼샤브샤브현주엽 김호중 방배동 고기집 맛집봉피양서래점 방배동 고기집 미우새 현주엽 김호중 출연 맛집 인정... ,릴리의생생리뷰통~♡,https://blog.naver.com/codihaja,2020-11-02
방이동맛집] 봉피양 샤브 샤브,https://blog.naver.com/luvirene?Redirect=Log&logNo=220969803020,간건데봉피양 에샤브샤브 가 있는걸 알구!!! 단박에 주차! ㅋㅋ 벽제갈비야 워낙유명하니까봉피양 에서샤브샤브 는 첨먹어봤는데 엄지척!!! 꺅! 기본세팅에요~~각종소스들과 미니샐러드 그리고 야채... ,러브잇 LUVIT,https://blog.naver.com/luvirene,2017-03-29
"미우새 신동엽 맛집, 봉피양 샤브 샤브 서래점에 간 미우새 김호중",https://blog.naver.com/qaqa1955?Redirect=Log&logNo=222135161491,"치팅데이여서 맛있는 음식을 먹으며 현주엽씨와 시간을 보내는 내용이었는데, 그곳에 나온 맛있어 보이는샤브샤브 집! 그곳은 미우새 신동엽씨의 맛집이자 단골집 이라고하네요. 미우새 김호중씨는... ",qaqa블로그,https://blog.naver.com/qaqa1955,2020-11-04
주간 먹부림( 봉피양신월점/엘본더테이블 목동점/지코바/ 샤브샤브 ),https://blog.naver.com/syoung244?Redirect=Log&logNo=221717853646,"공유해봐요봉피양신월점 요즘 냉면이 그렇게 땡기더라구요, 근처에 함흥냉면집은 없어서봉피양 ... 마켓컬리와 함께샤브샤브마켓컬리에서샤브샤브쌈채소와 일상미소샤브샤브고기 샀더니 양이 정말... ",올망졸망 육아일기,https://blog.naver.com/syoung244,2019-11-25
"서래마을봉피양- 양념불고기, 채끝등심",https://blog.naver.com/berrymissyou?Redirect=Log&logNo=222412904117,"등심샤브와 한우, 돼지갈비가 있는 서래마을 맛집봉피양샤브룸이 있어 서래마을에서 가족모임을 하기 좋은 한우집봉피양 샤브위치는 베로니스 타운 지하 퀸즈파크 옆 건물 지하 참고로 벽제갈비에서... ",berrymissyou,https://blog.naver.com/berrymissyou,2021-07-09
"[ 봉피양 샤브서래점] 전면간판, 박스형 채널, 까치발... ",https://blog.naver.com/arborino?Redirect=Log&logNo=221500337882,' 봉피양 ' 시공 사례를 포스팅해보겠습니다.봉피양로고가 변경되어 기존 사인물들은 모두 철거를 한 후 시공을 했습니다. 기존 간판의 사이즈보다 로고가 더 잘보이고 크게 들어갔고 주가 되는 간판은 재질을... ,키사인 간판제작실,https://blog.naver.com/arborino,2019-03-29
"[서래마을맛집] 돼지갈비맛집,봉피양 샤브 (벽제갈비)",https://blog.naver.com/lovely_hee77?Redirect=Log&logNo=221643291705,"위치한 #벽제갈비 # 봉피양샤브에 다녀왔습니다. 전화번호: 02-537-0783 주소: 서울 서초구 동광로 89... 샤브샤브 등 메뉴가 엄청 다양합니다 ㅋㅋㅋㅋㅋ 아버님께서 너무 잘 온 것 같다며 자, 우선 봉피양은... ",히야의 소소한일상 ෆ⃛,https://blog.naver.com/lovely_hee77,2019-09-09
[방이]봉피양 (벽제샤브샤브 ),https://blog.naver.com/mirimirimiri?Redirect=Log&logNo=220746443774,오래 줄 서지말고 벽제 샤브샤브 에서 즐기셈 배불리먹고봉피양 에서 멀지 않은 올림픽공원 나들이 그 유명한 나홀로 나무도 보고 한가로이 풀 먹는 토끼도 보고 냉면먹고 산책하는 요 코스 추천이오 20160618S,열일쥬뷰,https://blog.naver.com/mirimirimiri,2016-06-26
방이동봉피양평양냉면을 벽제 샤브샤브 에서..ㅎㅎㅎㅎ,https://blog.naver.com/iam_robot?Redirect=Log&logNo=220447564601,"이쪽에봉피양 , 벽제샤브샤브같은 식당이 몰려있는데 대부분 다 고기에요. 벽제 샤브샤브 도샤브샤브 집인데봉피양냉면이 유명해지면서 냉면이 더 많이 팔리는듯~봉피양냉면은 물/비빔 다 만이천원이에요.... ",말랑한 독사 지영씨의 디자인 사무소,https://blog.naver.com/iam_robot,2015-08-11
" 봉피양: 신동엽 맛집, 방배동 맛집, 서래마을 맛집",https://blog.naver.com/hjhj4539?Redirect=Log&logNo=222251705703,곳은 봉피양 입니다.봉피양 샤브· 02-537-0783 · 서울 서초구 동광로 89 · 베로니스타운 B1층 · 매일 11:30 - 21:30 · 단체석 · 서래마을 최상급 퀄리티의 고기와 서비스로 해외까지 유명세를 떨친 곳 저희는 샤브... ,"노주부 Blog, :)",https://blog.naver.com/hjhj4539,2021-02-21
벽제 돼지갈비 와 평양냉면 맛집 - 벽제갈비 ( 봉피양 샤브 ) 서래점,https://blog.naver.com/oky1987?Redirect=Log&logNo=221650563296,직영점봉피양 샤브 입니다. 워낙 #서래마을맛집 으로도 유명하고 유명한 분들이 많이 오시는 곳이라... #샤브샤브 를 주문하진 않았는데 그렇게 된 건가 했어요. 드디어 점원분께서 고시를 올려주십니다. 확실히... ,여러분과의 즐거운 동행 양재동 삼호부동산,https://blog.naver.com/oky1987,2019-09-17
" 봉피양양재점서래점, 꽃등심/직화구이 돼지갈비/평양냉면 맛집",https://blog.naver.com/ipsoskorea06?Redirect=Log&logNo=222183260724,"그리고 남편과 둘이 방문한 # 봉피양샤브 서래점 서래점에는 샤브샤브 및 스키야끼도 즐길 수 있어 더 좋다. 영업시간 매일 11:30 - 21:30 앞접시가 예쁨! 봉피양 서래점도 밑반찬이 이정도인데, 특히 깻잎에 고기... ",기록하고 기억하기 위한 공간,https://blog.naver.com/ipsoskorea06,2020-12-23
