title,link,description,bloggername,bloggerlink,postdate
달인 찐빵 3개 1000원 만두불티나만두찐빵19년 전통 분식집... ,https://dodo1004love.tistory.com/12374,"이곳은 찐빵 경력 19년 전통을 이어오고 있는 곳입니다.불티나만두찐빵 이 오늘 생활의 달인에... 즐거움으로 만두 , 찐빵 등을 만들고 있습니다 . ★생활의 달인 진주 초밥 백반 달인 49년 전통 어묵백반... ",영숙이네집,https://dodo1004love.tistory.com/,2020-09-21
[평택 /불티나왕 만두 찐빵 ] 평택만두맛있는 집,https://blog.naver.com/eve191?Redirect=Log&logNo=220490158512,"있어요불티나왕만두 찐빵원래 입소문이 난 곳인지 계속 손님이 끊이지 않더라구요 왕 만두 도 있고 그냥 작은만두 도 있어요 가격은 보이시죠?? 저는 김치 만두일반 1,왕고기 만두1, 왕김치 만두1 사왔어요 일반... ",;) 쏭글쏭글,https://blog.naver.com/eve191,2015-09-23
응암역 맛집 / 40년 전통 저렴한 수제만두불티나 손 만두 ,https://blog.naver.com/phjsunflower?Redirect=Log&logNo=220644770758,"응암역 맛집 / 40년 전통 저렴한 수제 만두불티나 손 만두만두 의 역사는 꽤 길다. 우리나라만두 는 일반... 강렬한만두 의 맛이다. 김치 만두4,000원 뭔가찐빵 스러운 느낌이 강하다. 속에는 뭐가 들어있는지는... ",꽃씨의 맛집 이야기♬,https://blog.naver.com/phjsunflower,2016-04-01
은평구 만두불티나손 만두40년된만두 집,https://blog.naver.com/dlsnd56?Redirect=Log&logNo=221940522052,거기도 떡볶이 유명한데 꽤 오래된곳이라던데 은근 이 은평구에 역사깊은 곳의 맛집이 많더라구요 이렇게 또 40년전통만두 집도 가보고 다음에 은평구만두불티나 손 만두 ~ 덩치랑 와봐야겠습니다,날봉이네 오두막,https://blog.naver.com/dlsnd56,2020-05-02
[응암역 맛집] 생활의달인 -불티나 손 만두 ,https://blog.naver.com/never39?Redirect=Log&logNo=221157799451,이 말을 꺼낸 이유가 있겠지 뭐 간판샷이며 영업시간 써 있는거 다 안 찍었다 ㅋㅋㅋ불티나 손 만두 ... 진짜 푸짐하게 잘 먹었다 그리고만두포장해왔는데 김치 만두맛있다찐빵 처럼 피도 통통하니 입으로 다... ,숭애교 먹고.일하고.울고.웃고 :),https://blog.naver.com/never39,2017-12-08
밀양불티나 만두찐빵 ,https://blog.naver.com/bultina-dumpling?Redirect=Log&logNo=221587422424,21년째 매일 손으로 만드는 ‘ 만두찐빵 ’ #밀양 # 만두# 불티나만두# 불티나# 찐빵#매운갈비 #갈비 만두#매운갈비 만두#경상남도 # 만두 맛집 # 찐빵 맛집 #수제 만두#수제 찐빵# 만두 가게 # 찐빵 가게 #밀양맛집,밀양 '불티나만두찐빵',https://blog.naver.com/bultina-dumpling,2019-07-16
대전 중리시장찐빵순대 맛집,https://blog.naver.com/prisun?Redirect=Log&logNo=222266592657,"먼저찐빵 이 맛있다는불티나 만두찐방집부터 줄을 서서 기다렸어요.. 예전 직원이 순대와 족발,만두 찐빵떡볶이등 골고루 사왔었는데, 저는 손대와 족발, 떡볶이는 먹어보고만두 찐빵 은 안먹어 봤었거든요.... ",행복한 제이맘~♡,https://blog.naver.com/prisun,2021-03-06
대전 중리시장불티나 ,https://blog.naver.com/020339?Redirect=Log&logNo=222452442270,# 불티나만두찐빵생활의 달인에 나온 만두집... 헷갈리면 안되는것이...ㅋ 밀양에 불티나찐빵만두 가 있는데 거기도 맛집인가 봅니다 만두하고 찐빵 순서가 바꼈죠?^ 만두가 굉장히 작아요...한입거리도 안됩니다... ,전주 먹방,https://blog.naver.com/020339,2021-07-31
"생활의 달인 764회 - 대전 중리시장만두 ,찐빵달인 맛집은... ",https://blog.naver.com/ura0084?Redirect=Log&logNo=222104954738,기본적으로 시장 찐빵만두집은 맛이 보장되어 있죠 ㅎㅎ (개인적인 생각) 처음 가보는 곳에서 맛집 찾을 땐? 맛집정보 · 상호명 :불티나만두찐빵· 주소 : 대전 대덕구 중리로76번길 18 · 전화번호... ,계군의 맛집 블로그,https://blog.naver.com/ura0084,2020-10-05
응암역만두맛집 [ 불티나손 만두 ],https://blog.naver.com/yunjung621?Redirect=Log&logNo=220468814651,응암역만두맛집 [불티나손 만두]만두 를 드시고 싶어하시는 부모님과 함께 응암역 근처에 있는... 그 느낌이 별로 없었다. 다음에는 모밀이랑 고기 만두 랑찐빵 을 먹어봐야겠다~ (다 먹어보겠다는거지...;;;;),내몸바로알기_Love Your Body,https://blog.naver.com/yunjung621,2015-09-01
불티나손만두응암역 맛집으로 추천하고 싶어진다.,https://blog.naver.com/question26?Redirect=Log&logNo=80212604693,불티나손만두아들과 앉아서만두두접시와 사골만두 국을 먹었던 거 같다. 거기에 분명찐빵 도 먹었었는데 어마어마하게 먹었다는 거다. 역시 손 만두 라 그런지만두 피도 넘 부드럽고만두 소도 넘 알차게... ,멋진리폼작업실,https://blog.naver.com/question26,2014-05-09
"2020년 9월 21일 생활의 달인-은둔식달(대전 찐빵 달인,부산치킨... ",https://blog.naver.com/juniba?Redirect=Log&logNo=222096116004,은둔식달 - 대전 찐빵 달인 최경환(男 / 58세 / 경력 19년) 신순희(女 / 57세 / 경력 19년) 대전 찐빵 달인불티나만두찐빵대전 대덕구 중리로76번길 18 ☎042-623-6271 2. 주차 달인 나홍규(男... ,♡러블리 쩡양♡,https://blog.naver.com/juniba,2020-09-22
[생활의 달인] 50년만두 의 달인불티나 만두 ,https://blog.naver.com/jesaminee?Redirect=Log&logNo=221972953508,안녕하세요 라니줌이에요 예전 545회 생활의 달인에 나왔던불티나 만두 를 먹어보았어요 친정엄마가... 납작만두 가 인기라는데 전 포장이라 다음에 꼭 먹어봐야겠어요 김이 모락모락~~~찐빵 처럼 생긴... ,라니줌의 블로그,https://blog.naver.com/jesaminee,2020-05-21
용인 신갈에 있는불티나 만두왕 진빵 맛있다.,https://blog.naver.com/silbiha?Redirect=Log&logNo=220672698534,용인 신갈에 있는불티나 만두왕찐빵맛있다. 용인 신갈에 있는 아이비 교복전문점에서 문자가 왔다. '하복 할인가 판매 한정수량' 문자 온 날 울딸 하교 하자마자 바로 신갈오거리로 갔다. 학교에서 한업체에... ,♡내 마음의 단비♡,https://blog.naver.com/silbiha,2016-04-03
(간식추천) 불티나 왕 만두찐빵 ,https://blog.naver.com/elf505kim?Redirect=Log&logNo=220989164713,# 불티나 왕 만두찐빵 #간식추천 내집마련 도우미 고은실장이에요~ 날씨가 흐린날은 신기하게 배가 빨리고파요ㅋ 이번주에 맛있게 먹은 간식 추천해드려요. 저랑 같이 근무하는 실장님이 맛있는 간식을 사오셨죠... ,마이에셋 공인중개사 사무소(부동산),https://blog.naver.com/elf505kim,2017-04-21
먹거리_볼거리_즐길거리_밀양아리랑시장_7-불티나찐빵 ,https://blog.naver.com/arirangmarket?Redirect=Log&logNo=221641876337,"부부께서 함께 운영하고 계셨고, 만들고 찌고 포장하고....업무 분담하는 모습이 다정스레 보였습니다 꼭 들려서 맛있는찐빵 과만두드시고 시장보세요~~~~ # 밀양시_석정로40 # 불티나찐빵#22년경력전통... ",꽃♥피어라~~ 밀양아리랑시장 ~Since1479,https://blog.naver.com/arirangmarket,2019-09-07
대전시 대덕구 중리시장내... 불티나만두 ,https://blog.naver.com/icecreamjht?Redirect=Log&logNo=50023101356,"빚고 계시고, 또 한분은 포장 손님들에게 파시느라 정신이 없어시더라구요 다른분이 맛있다고 하시더니 나름 맛있었고,만두 와찐빵 을 같이 먹으면 2천원으로 한끼식사가 될듯... 앞으로도 종종 갈것 같아요...",요술쟁이!!! 양탄자 타고~~,https://blog.naver.com/icecreamjht,2007-10-05
평택 통복시장불티나 만두넘넘 맛있어요^^,https://blog.naver.com/silsil6223?Redirect=Log&logNo=220415018566,항상 계시더라구요~~ 이날도 두분이나 더 기다렸다 살수 있었답니당~ 통복시장 입구에서 바로 보이는불티나 만두 집이랍니당~ 다음엔찐빵 도 한번 사먹어봐야겠어요~~불티나 만두 집 대박나셨으면 좋겠어요^^,착한악마의 블로그,https://blog.naver.com/silsil6223,2015-07-14
대전중리시장 최경환사장- 불티나만두 ,https://blog.naver.com/leeju2006?Redirect=Log&logNo=220536821620,"맛이 좋아 인기만점, 가격이 저렴하여 인기만점인불티나 만두!! 각종 도넛과 고로케,만두 ,찐빵등등등 여러분들의 입맛을 만족시켜드리고 가격에도 만족스러운불티나 만두 ! 많은 이용 바랍니다.... ",사주와씨크릿,https://blog.naver.com/leeju2006,2015-11-12
생활의달인 대전찐빵달인 은둔식달 위치,https://blog.naver.com/kihong000?Redirect=Log&logNo=222095488106,만두도 판매를 하고 있습니다. 얇은 피와 꽉찬 속이 더욱 먹음직스러운 모습을 보여주고 있네요! 날씨가 아침저녁으로 추운요즘 퇴근길 찐빵한입이면 그날 피로가 다풀릴것 같네요!불티나만두찐빵장소... ,맛집 상세 정보,https://blog.naver.com/kihong000,2020-09-21
"대전, (가볍게 떠난) 당일 미식투어~ 먹방여행!",https://blog.naver.com/green_cloud?Redirect=Log&logNo=222103340212,‘커피인터뷰’_커피 중리시장 ‘ 불티나 만두찐빵 ’_만두찐빵 ‘바로그집’ 본점_떡볶이김밥 ‘심스 스모크하우스’_텍사스바베큐 ... 장소가 목적인 여행은 목적지 주변에서 맛집을 찾지만 먹는 게(맛집이)... ,rejoice ★ 기억창고,https://blog.naver.com/green_cloud,2020-09-30
응암역 맛집 생활의달인불티나 손 만두 ,https://blog.naver.com/updowntowngirl?Redirect=Log&logNo=221487358833,아직도 예약 대기한대서 빠른 포기 ^^ 영자언니 ..흑흑 대신 생활의달인만두맛집이라는 응암동불티나 손 만두 에서 포장했다. 고기 만두 와 김치 만두 는 시장찐빵 처럼만두 피가 도톰하고 부드럽고만두 소는... ,내돈내산 먹보 여행자,https://blog.naver.com/updowntowngirl,2019-03-13
"[생활의 달인]764회 은둔식달 대전찐빵달인, 부산 치킨 닭... ",https://blog.naver.com/gagogao?Redirect=Log&logNo=222095686437,"생활의 달인 764회 은둔식달 대전의 찐빵 달인 식당불티나 만두 찐빵 , 부산 치킨과 닭 두루치기 달인 팔복통닭, 주차달인, 뽑기사탕달인 방송정보 알아보기 첫번째로 소개된 달인은 전국에 숨어있는 맛의... ",미트맨의 다양한 이야기,https://blog.naver.com/gagogao,2020-09-21
고산 맛집/ 불티나 왕 만두찐빵 ,https://blog.naver.com/seongsoo4u?Redirect=Log&logNo=220882234732,최근에 먹어본찐빵중에서 베스트입니다! 뜨겁고 달콤한 단팥앙금~ 야채 찐빵 도 정말 맛있어요. 김치 만두또 먹고 싶네요.,FISH & ITC,https://blog.naver.com/seongsoo4u,2016-12-09
"사골만두 국,찐빵 , 치즈김치...만두 피, 48년 경력,불티나 손만... ",https://sulia.tistory.com/16067," 만두 의 달인이 출연하는데요. 주인공은 서울특별시 은평구 신사동에서 명성이 자자한 ' 불티나 ... 옛날우동,찐빵 ,만두칼국수, 쟁반 냉모밀, 비빔모밀,만두 국용만두주소 : 서울 은평구 신사동 23-5 전화... ",설리아닷컴 시즌2,https://sulia.tistory.com/,2016-10-23
최고였던 대전 괴정동 가장동 맛집 모음,https://blog.naver.com/hailey_eng?Redirect=Log&logNo=222105130685,"2.분식집불티나만두찐빵 ,바로그집,개천식당,떡반집,복수분식,하루방만두 3.곱창집 사나이창,왕손곱창,할머니딸생양곱창,김덕후의곱창조,곱창이야기 4.일식집 동백카츠,스바라시라멘,킨토토,요우란,설해돈 5.... ",헤일리 Hailey,https://blog.naver.com/hailey_eng,2020-10-03
오산 시장 맛집 :불티나 왕 만두 _오산만두 는불티나 왕 만두 에서~♡,https://blog.naver.com/jjhrlove?Redirect=Log&logNo=221136122901,오산 시장 맛집 :불티나 왕 만두오산만두 는불티나 왕 만두 에서~♡ #오산김치 만두 #오산 만두 #오색시장맛집#오산시장맛집#오산분식#오산 만두오산 오산동불티나 왕 만두찐빵/ 031-374-6689 오산 시장 맛집 오산... ,내일부터다이어트:))저내려니❣,https://blog.naver.com/jjhrlove,2017-11-11
연신내맛집불티나 왕 만두/ 왕 만두김치 만두 ,https://blog.naver.com/kanggadin11?Redirect=Log&logNo=110146382006," 불티나 왕 만두 집은만두 ,찐빵 , 김밥이 주 메뉴인가 봅니다.불티나 는...일회용 라이타 상품명이 아닌가요??? 이집 주소를 찾느라고불티나 왕 만두 를 검색하였더니... 전국에 몇군데불티나 왕 만두 집이 검색이... ",제임스의 요리조리 방방곡곡,https://blog.naver.com/kanggadin11,2012-12-09
대전 중리시장 맛집불티나저렴하고 맛있어요,https://blog.naver.com/pey3913?Redirect=Log&logNo=220953674966,있어요만두 랑찐빵 도 엄청 저렴해요 천원의 행복을 느낄 수 있는불티나!! 이렇게 한쪽에 쌓아놓고 바로 쪄낸걸로 주시더라고요 ~ 대전 중리시장 맛집불티나! 유명해질만 해요 ^.^ 도넛들도 종류도 다양하고... ,먹둥이와 둥이맘,https://blog.naver.com/pey3913,2017-03-10
완주 빵맛집 정복! 추억의 맛이 있는 완주로 빵문~하세요 (+ 이웃... ,https://blog.naver.com/wanjugun?Redirect=Log&logNo=222269542081, 불티나 왕 만두찐빵불티나 왕 만두찐빵 에서는 다년간 베이커리를 운영했던 손길이 빚어내 내공이 느껴지는찐빵 과만두 를 경험할 수 있다. 반죽할 때 우유를 넣어 부드럽고 고소한 맛을 극대화한 우유 찐빵 은... ,완주군 공식 블로그,https://blog.naver.com/wanjugun,2021-03-09
"응암역맛집 :불티나손 만두 ,만두 피쫀득 맛있다♥",https://blog.naver.com/edenae?Redirect=Log&logNo=220971483754, 만두너무 맛있게 먹었더래서 오늘 신랑이랑 같이만두 사러 다녀왔다ㅋㅋ불티나 손 만두김이 뿌옇게... 김치 만두 는 왕 만두 정도로 보면될거같고 통 만두 는 작고 피얇은 고향 만두 스러운? 고기찐 만두나는찐빵 같은... ,슬기로운 요므리네 :D,https://blog.naver.com/edenae,2017-03-31
SBS 생활의 달인 9월21일 은둔식달 대전찐빵달인,https://blog.naver.com/choulha63?Redirect=Log&logNo=222096152274,만든 찐빵 반죽물 레시피 콩가루 묻힌 옥수수대를 삶는다 땅콩에 소금을 넣고 볶는다 옥수수 속대 소금을 넣고 끓인다 옥수수대 죽을 반죽으로 사용함불티나만두찐빵☎ 042-623-6271 대전 대덕구... ,one시인의 일상.,https://blog.naver.com/choulha63,2020-09-22
"[764회] 은둔식달-대전찐빵달인, 주차 달인, 은둔식달-부산... ",https://blog.naver.com/rok2tank?Redirect=Log&logNo=222095537652,은둔식달 - 대전 찐빵 달인불티나만두찐빵대전 대덕구 중리로76번길 18 ☎042-623-6271 2. 주차 달인 (주)픽플러스 본사 : 경기 고양시 일산동구 하늘마을로 158 대방트리플라온 C동 1204호... ,당황하지 않고,https://blog.naver.com/rok2tank,2020-09-21
한민시장불티나 만두 집,https://blog.naver.com/edu9119?Redirect=Log&logNo=20187583038," 만두 국에는 왕 만두 보다 작은만두 로 끓이는 게 맛있는데, 우리가 직접 빚어서, 모양은 예쁘지 않지만, 맛은 최고야~” 이 곳불티나 만두 집의만두 와찐빵 은 모두 직접 만드는 것.찐빵 의 반죽이며 그 안의... ",한숭동 대전교육감 예비후보의 즐거운 교육혁명,https://blog.naver.com/edu9119,2013-05-13
"완주 고산면 동네 나들이 - 고산미소시장, 고산향교, 세심정",https://blog.naver.com/jbgokr?Redirect=Log&logNo=222369532839,아지트 - 초원국수 -불티나 왕 만두찐빵- 고산미소시장 - 서쪽숲에 네발요정이 내린 커피 - 고산향교 - 세심정여행의 시작은 역시 먹을거리죠. 오늘은 읍내 구경도 하면서 평소 먹고 싶었던 것들을 하나하나... ,전라북도 공식 블로그,https://blog.naver.com/jbgokr,2021-05-27
대전 중리시장 떡볶이만두순대 먹거리 쇼핑했어요,https://blog.naver.com/jamong6747?Redirect=Log&logNo=221711320364,앞에불티나 만두 찐빵요기도 들렀어요 왜케 맛있는 것들이 많이 보이는지 ㅋㅋ 여기도 가격 완전 착해요... 오빠가 좋아하는 꽈배기 사러 왔눈데 꽈배기는 4개에 천원 !! 그리고 만두는 1판 이천원 !! 지금 사진... ,하요티,https://blog.naver.com/jamong6747,2019-11-18
생활의달인 부산 치킨 닭두루치기 달인 대전찐빵달인... ,https://blog.naver.com/wowwhere?Redirect=Log&logNo=222095654742,전통의 찐빵집 으로 중리시장에 위치한불티나만두찐빵이다 방송에 나온 식당정보 https://poksikm.tistory.com/1233상호마냥 진빵 취급하는것이 아닌 여러 버전의 만두와 고로께 등 다양한 먹거리가... ,내 블로그,https://blog.naver.com/wowwhere,2020-09-21
생활의달인 은둔식당 대전맛집찐빵은둔식달,https://jeffreysays.tistory.com/452,"【불티나만두찐빵】★★★ 【 주소 】 주소 : 대전 대덕구 중리로76번길 18 【 지도 】 【 전화 】 042-623-6271 【 영업시간 】 매일 07:00 - 21:00 일요일 휴무 【 메뉴 가격 정보 】 만두 2,000 10개 찐빵 1,000... ",올 리뷰 블로그,https://jeffreysays.tistory.com/,2020-09-22
생활의달인 은둔식달-대전 찐빵 달인 (대전 대덕) 주차달인... ,https://blog.naver.com/ineosky?Redirect=Log&logNo=222098914829,생활의 달인 764회 (2020.09.21) 은둔식달 - 대전 찐빵 달인불티나만두찐빵대전 대덕구 중리로76번길 18 042-623-6271 최경환(男/58세/경력19년) 신순희(女/57세/경력19년) 주차달인 (주)... ,심야버스 블로그 (simyabus.com),https://blog.naver.com/ineosky,2020-09-24
생활의달인 은둔식달 대전찐빵최경환 신순희 달인 가게 위치... ,https://lulusreviews.tistory.com/1179,반응형 생활의 달인 은둔식달 대전 찐빵 최경환 신순희 달인 가게 알아보기 SBS 생활의 달인 764회... 「 이름 · 상호 」불티나만두찐빵「 구글지도 평점 」생활의달인 구글지도 보기 4.0/ 5.0 「 주소... ,룰루네리뷰,https://lulusreviews.tistory.com/,2020-09-21
대전 중리시장찐빵송편 호떡 등 먹거리가 많네요,https://blog.naver.com/tsniper_73?Redirect=Log&logNo=222101797470,소개된불티나만두찐빵 이 젤 먼저 보였어요 방송의 힘인지 줄이 엄청나더라구요 잠깐 기다려서 사먹어볼까 하다가 줄이 길어서 그냥 패쓰했어요 메뉴가 꽤 많았는데 요즘 바쁘셔서 그런지 만두랑 찐빵... ,소통하는 봄양,https://blog.naver.com/tsniper_73,2020-09-28
은둔식달 대전찐빵달인 가게 위치 생활의달인9월21일,https://reviewhong.tistory.com/2573,"생활의달인대전찐빵달인 생활의달인 9월21일 방송하는 위치정보불티나만두찐빵대전 대덕구 중리로76번길 18 전화번호 ☎042-623-6271 가격 메뉴 만두 10개 2,000원 왕만두 3개 2,000원 찐빵 3개 1,000원... ",랜선 고양이 지식,https://reviewhong.tistory.com/,2020-09-21
[대전/중리동] 중리시장 수제돈까스전문점 '돈추',https://blog.naver.com/iiiiowoiiii?Redirect=Log&logNo=220993463238,17.04.21 중리시장 수제돈까스전문점 돈추 안녕하세요 만두에요! 오늘은 회사 점심으로 먹었던... 위치는 중리시장불티나만두찐빵바로 앞에 위치해있어요 중원초등학교 방향에있습니다 주문하자마자 세팅 된... ,디자인；작은공작소 { The Little Design Shop },https://blog.naver.com/iiiiowoiiii,2017-04-27
(동탄2신도시) 옛날 왕찐빵/만두로 허기진 속을 달래보세요:D,https://blog.naver.com/01066650756?Redirect=Log&logNo=220914054807,"동탄2신도시 옛날 왕찐빵/만두집은 젓가락을 보면..평택이 본점이고 , 원래이름은불티나 왕 만두집인것같네요! 아니면..젓가락을 그냥 주신건가..?ㅎㅎ그럴일은 없겠죠~~? 무쪼록! 상가안에 점점 무언가... ",""" 미호의 꿈나라 """,https://blog.naver.com/01066650756,2017-01-18
"대전중리시장, 맛집과 시장 둘러보기, 중리전통시장",https://blog.naver.com/167sss?Redirect=Log&logNo=222450934569,그리고 지난번에 포스팅한불티나 만두찐빵중리시장으로 네이버 검색하면 늘 나오는 곳 여긴 중리시장 가면 꼭 먹어야할 맛집이에요. https://m.blog.naver.com/167sss/222444695736 #중리시장맛집 #대전중리시장맛집... ,하얀 손과 함께하는 맛있는 세상,https://blog.naver.com/167sss,2021-07-30
더위 때문에 더 힘들었던 한 주의 끝이에요. 이번 주말 나의... ,https://blog.naver.com/167sss?Redirect=Log&logNo=222442272566," 대전지역 내가 찾은 가고싶은 맛집송강소문난떡볶이(북대전) 바로그집 (중앙로 지하상가) 은행동 대전 가락국수 (백반기행) 유천동 평산면옥 (생활, 냉면) 중리시장불티나 만두찐빵(생활) 유성온천역... ",하얀 손과 함께하는 맛있는 세상,https://blog.naver.com/167sss,2021-07-23
대전 고로케 맛집불티나중리시장에 있어요,https://blog.naver.com/kdwsw?Redirect=Log&logNo=220957175527,"대전 고로케 맛집불티나중리시장에 있어요 고로케 좋아하는 남편을 위해 대전 중리시장에 장보러갔다가 사왔어요 중리시장 안에 있는 고로케 맛집불티나도넛,찐빵 ,만두 도 팔고요 떡볶이, 오뎅, 튀김... ",천국을 나는 비행기,https://blog.naver.com/kdwsw,2017-03-13
"추석선물, 차례상 걱정은 대전 중리전통시장에서 준비하면 끝!",https://blog.naver.com/daedeokgu?Redirect=Log&logNo=220091681193,또한 박리다매의 표본이라 할 수 있는불티나 만두찐빵 집도 중리전통시장의 명물입니다. 우선 기념 사진 먼저 찍고 출발 합니다. V~ 중리전통시장은 골목이 상당히 넓어 카트를 이용하는데 전혀 불편함 없이... ,주민행복 대덕 이야기,https://blog.naver.com/daedeokgu,2014-08-14
생활의 달인 신사동만두 의 달인불티나 손 만두소고기... ,https://dodo1004love.tistory.com/2850,"■불티나 손 만두 - 만두 의 달인 서울시 은평구 은평로 64 / 02-304-4240 오늘 방송하는 생활의 달인 , 너무나... 메뉴는 고기 만두 /김치 만두 /통 만두 / 찐빵 /치즈김치통 만두 /야채비빔군 만두 / 어묵새우군만두 ... ",영숙이네집,https://dodo1004love.tistory.com/,2016-10-24
대전물회맛집 중리동시장 형제횟집다양한 해산물과... ,https://blog.naver.com/sic0713?Redirect=Log&logNo=222394038592,있었어요 # 불티나만두찐빵손님들이 줄서계시더군요 같이 운동하는 형님왈! 장사가 잘되고 맛집이라고 알려주시네요 #찐빵 #만두 #감자고로케 #김치고로케 #야채고로케 #찹쌀도너츠 #꽈베기 까지~ 제가... ,얼콩 is back,https://blog.naver.com/sic0713,2021-06-11
생활의달인 대전 진빵 달인 위치 - 대전중리시장,https://reportan.tistory.com/687,"호 :불티나만두찐빵주 소 : 대전 대덕구 중리로 76번길 18 (지번) 중리동 372-2 대표번호 : 042-623-6271 영업시간 : 매일 07:00 ~ 21:00 일요일 휴무 메 뉴 : 만두 10개 2,000원 찐빵 3개 1,000원 * 메뉴및 가격은... ",리폿안,https://reportan.tistory.com/,2020-09-21
[주간밥상] 9월 마지막주_가을 제철 송이버섯 밥상,https://blog.naver.com/tingbingo?Redirect=Log&logNo=222103788280,순대 만두5.0 찐빵1.0 떡볶이3.0 순대3.0 생활의 달인에 나온 # 불티나만두찐빵그리고 같은 #중리시장 안에 있는 #오떡 떡볶이 아주 배터지게 먹었던 토요일 점심 한우등심구이 깻잎1.0 마늘3.5 팽이버섯0.9... ,¡Buen viaje!,https://blog.naver.com/tingbingo,2020-09-30
"중리전통시장(대전,맛집,대전맛집,전통시장,온라인 주문)",https://blog.naver.com/gkfla0531?Redirect=Log&logNo=222201837572,"출연했었는데 ' 불티나 만두 찐빵 ' 가게입니다. 대전 찐빵 달인분들인데요 신순희 최경환 달인이 운영한다고 합니다. 만두 10개에 2000원, 찐빵 3개 1000원 등 엄청나게 착한 가격으로 운영한 다고 합니다. 전국... ","부동산, 투자의 첫 걸음",https://blog.naver.com/gkfla0531,2021-01-09
문산불티나왕 만두ㅋㅋ,https://blog.naver.com/sqsq8618?Redirect=Log&logNo=130184281530,이름은불티나왕 만두ㅋㅋㅋㅋ이름한번 재밋죠 김치 만두2인분과찐빵1인분입니다. 정말 푸짐하죠... 바로 해와서 뜨끈뜨끈~ 김치 만두 에요 겉에서도 티나죠 음냐 또봐도 땡기냐찐빵아직 먹어보진못햇어요 ㅋ... ,귀염둥이 남매 떠아떠복 육아 STORY♩,https://blog.naver.com/sqsq8618,2014-01-25
광역알뜰교통카드로 교통비 절약하자!!(정보),https://blog.naver.com/bultina-dumpling?Redirect=Log&logNo=222092494620,http://naver.me/xw2hwy7V #밀양 #만두 # 불티나만두# 찐빵#매운갈비 #갈비만두 #매운갈비만두 #경상남도 #만두맛집 #찐빵맛집 #수제만두 #수제찐빵 #만두가게 #찐빵가게 #밀양맛집 #광역알뜰교통카드... ,밀양 '불티나만두찐빵',https://blog.naver.com/bultina-dumpling,2020-09-17
