title,link,description,bloggername,bloggerlink,postdate
엄마와 한민시장 장보기,https://blog.naver.com/dhaoqnfakd1?Redirect=Log&logNo=150131252946,"오랜만인데도 후문입구의 도너츠가게도,찐빵 이랑만두 사먹던불티나 만두 집도, 무서운인상에 코미디언 뺨치는 말솜씨의 생선가게 아저씨 모두 그대로이다. 언제가든 정다운 곳. 마트나 백화점에서 느끼지... ",적정소음과 밀도,https://blog.naver.com/dhaoqnfakd1,2012-02-09
수원/보영 만두 ,https://blog.naver.com/pjy9865?Redirect=Log&logNo=70169821413,"서울분식불티나등등 해피떡볶이도 인기였는데 지금은 없어진듯 갑자기 기억 가물가물 국물 나오구요... 분식집이나만두 집,찐빵 집들이 있습니다 수원의만두 집은 어떠한가 먹어보자 해서 간 것은 아니고요... ",in isolation,https://blog.naver.com/pjy9865,2013-06-17
"대전재래시장, 대덕이로움 사용 가능한 시장 '중리시장'",https://blog.naver.com/ll2130?Redirect=Log&logNo=221867216295,이름부터 간지 촬촬흐르는 ' 불티나 만두 - 찐빵 ' 아... 이게또 대전 재래시장 하면... 갓 삶아 나온 순대와 족발을 또 빼먹을 수 없는데요...안사갖고 온게 정말 천추의 한입니다... 내일 또가야지... 족발 순대는... ,당신이 머문자리,https://blog.naver.com/ll2130,2020-03-22
중리시장에 다녀왔어요.,https://blog.naver.com/mydaesung114?Redirect=Log&logNo=222387013093,찾은불티나찐빵가게입니다. 이곳은 생활에 달인에서도 나왔던 곳인데요. 저렴한 가격을 보고 타임머신을 타고 과거로 온 기분이더라고요. 3개에 천 원이라니 천 원의 행복인가 싶었어요.만두 와 고로케도... ,뉴대성공인중개사무실,https://blog.naver.com/mydaesung114,2021-06-06
연희동만두맛집 오향 만두 ,https://blog.naver.com/updowntowngirl?Redirect=Log&logNo=221855394499,흑흑 대신 생활의달인만두맛집이라는응암동불티나 손 만두 에서 포장했다.고기 만두 와 김치 만두 는 시장찐빵 처럼만두 피가 도톰하고 부드럽고만두 소는... 꿈꾸는 먹보 여행자 :) 푸짐하고 맛있는만두맛집이... ,내돈내산 먹보 여행자,https://blog.naver.com/updowntowngirl,2020-03-15
[대전맛집] 홍두깨손칼국수(대덕구.중리동.중리시장),https://blog.daum.net/chulinbone/4551,13 [대전맛집]불티나만두찐빵 (대덕구.중리동.중리시장) (6) 2015.04.11 [대전맛집] 못난이꽈배기(대덕구.중리동.중리시장) (2) 2015.04.11 [대전맛집] 홍두깨손칼국수(대덕구.중리동.중리시장) (2) 2015.04.11... ,철인뼈다귀의 지구별여행기,https://blog.daum.net/chulinbone,2015-04-11
주안 맛집 ‘ 불티나왕 만두 ’,https://blog.naver.com/bxzzis?Redirect=Log&logNo=222043511606,"신기시장 사거리쪽에 있는 내 최애만두두번째 집만두 가 나오는 동안 꽤배기 하나를 매번 주시는 인심 좋으신 사장님 올 때마다 놀라운만두 의 열기 왕 만두겉면은찐빵 이다 고기왕 만두 , 김치왕 만두한 팩씩... ",Good Thing,https://blog.naver.com/bxzzis,2020-07-27
전통시장맛집,https://blog.daum.net/jkh12179136/8522201,공갈빵 만두 찐빵 인천 복래춘 032-772-3522 인천 동구 송림동 10-2 중국식 제좌점 공갈빵 수원... 대전불티나만두찐빵042-623-6272 대전 대덕구 중리동 372-2 중리시장 대전 한밭식당 042-256... ,대해의 추억만들기,https://blog.daum.net/jkh12179136,2012-01-26
전국만두 로드 BEST7,https://blog.naver.com/b_kitchen?Redirect=Log&logNo=220988670150,"전국만두맛집! 전국만두 로드 리스트를 보여드리려고 합니다^^ 7위 -응암역-불티나 손 만두쌀가루로... 뽕잎,단호박,시레기,클로렐라로 건강한 재료로 만드는만두 와찐빵 ! 5위 -대전- 하루방 만두쫄깃하면서도... ",WICUSTOM,https://blog.naver.com/b_kitchen,2017-04-21
[대전맛집] 마쯔이에-알탕.점심특선-서비스.튀김.돈까스(서구.... ,https://blog.daum.net/chulinbone/4549,공유하기 글 요소 저작자표시 비영리 변경금지 ' 지구별음식이야기대전시먹거리 ' 카테고리의 다른 글 [대전맛집] 태화원-짜장면.짬뽕.잡채밥(중구.대흥동) (0) 2015.04.13 [대전맛집]불티나만두찐빵 ... ,철인뼈다귀의 지구별여행기,https://blog.daum.net/chulinbone,2015-04-11
네이버 전통시장 장보기!대전 중리시장 맛집 추천,https://blog.naver.com/dlalthd2094?Redirect=Log&logNo=222168170148,중리시장불티나 만두찐빵 도 있네용 이것저것 엄~청 담고 지금은 배달비도 무료 서비스 ㅎㅎㅎ 최소... 중리시장 불티나 만두의 찐빵과 고기만두 김치만두 ❤️ 이곳은 정말 중리시장 가성비 맛집이죠! 줄서서... ,Don't Worry Be Happy,https://blog.naver.com/dlalthd2094,2020-12-09
[대전맛집] 놀부부대찌개철판구이-김치부대찌개(중구.대흥동),https://blog.daum.net/chulinbone/4558,"물만두도 하나 주문해서 나누어 먹었고, 놀부부대찌개에서 팔도에 의뢰해서 공급받는 듯한... 13 [대전맛집]불티나만두찐빵 (대덕구.중리동.중리시장) (6) 2015.04.11 [대전맛집] 못난이꽈배기(대덕구.중리동.... ",철인뼈다귀의 지구별여행기,https://blog.daum.net/chulinbone,2015-04-13
대전 중리전통시장 떡볶이 맛집 장터왕순대족발,https://blog.naver.com/remainwithme?Redirect=Log&logNo=221827027635,"튀김, 만두, 찐빵, 핫도그 등 떡볶이랑 조합 오지는 이쁜이들이 많이 있다 핫도그랑 만두 집을까 말까... 중리전통시장의불티나만두찐빵 이 크기도 더 크고 속도 꽉 차있어서 훨씬 맛있음 !전화번호042-635... ",집순이 이순집,https://blog.naver.com/remainwithme,2020-02-27
[대전맛집] 반값소-한우반값.육사시미(중구.대흥동),https://blog.daum.net/chulinbone/4574,잡채밥(중구.대흥동) (0) 2015.04.13 [대전맛집]불티나만두찐빵 (대덕구.중리동.중리시장) (6) 2015.04.11 댓글 2 2015.04.21 12:18 비밀댓글입니다 답글 수정/삭제 2015.04.21 12:28 비밀댓글입니다 수정/삭제 비밀글 글쓰기,철인뼈다귀의 지구별여행기,https://blog.daum.net/chulinbone,2015-04-18
향남2지구롯데시네마인근☆ 불티나 왕 만두 오픈... ,https://blog.naver.com/mk0183?Redirect=Log&logNo=221564083102,가격도 엄청저렴해요 5000원 새우 만두 6개 향남2지구중심상가에 가신다면 꼭!!가야할 버킷리스트!! 맛보장합니다 우유가들어간찐빵 !! 구름같이 부드러워요 팥을직접 삶아 너무 달지않고 넘맛나요... ,향남1등공인중개사 사무소,https://blog.naver.com/mk0183,2019-06-17
대전 재래시장 중리전통시장 구경했어요,https://blog.naver.com/jamong6747?Redirect=Log&logNo=222101307217,"나온 찐빵집이 보인답니다불티나 만두찐빵 이라는 곳인데요 전 예전에 김치만두랑 꽈배기 먹어봤어요 방송 나온 뒤에 바빠지셔서 그런지 고로케나 튀김 같은건 보이지 않고 찐빵, 만두 정도만 판매하시는것... ",하요티,https://blog.naver.com/jamong6747,2020-09-27
"대전 재래시장, 중리시장 장보기",https://blog.naver.com/eve7343?Redirect=Log&logNo=220949340388,"중리동불티나 만두 찐빵친구가 여기 맛있다고 해서 찾아 헤맨곳 ㅋㅋㅋ 가격보고 깜놀 ㅋㅋㅋㅋㅋ 2017년도 맞나요? ㅋㅋ 대박 저렴하죠? 튀김소보루랑 고로케 도넛 고로케 2개가 1,000원이라니 만두랑 찐빵... ",좋은집다이소,https://blog.naver.com/eve7343,2017-03-04
+ 1326,https://blog.naver.com/chj8651?Redirect=Log&logNo=221518562778,"어제 내꺼 사면서 주아꺼도 샀는데 주아꺼만 오늘 도착 낮잠 자고 날도 좋으니 나가자 민들레 홀씨 후 중리시장 어묵 두개 뚝딱 먹는 주아 후생사 뻥튀기 중리시장불티나만두찐빵4,500원의 행복 귀여운 김주아... ",일상.,https://blog.naver.com/chj8651,2019-04-20
+ 1268,https://blog.naver.com/chj8651?Redirect=Log&logNo=221471663684,"바리스타 모카프레소 김밥전 세상에나 완전 꿀맛 중리시장 순봉홍두깨손칼국수 중리시장불티나 만두 ,찐빵다이소 트리 안녕 겨울에 보자 놀이터 자전거 맥주 사랑 킨더조이 세상에나 짠 좋다 좋아:D... ",일상.,https://blog.naver.com/chj8651,2019-02-21
생활의달인 면목동 간짜장 청주 뚝배기 떡볶이 팔씨름... ,https://teamaya.tistory.com/3051,은둔식당 #생활의달인 부산치킨 #생활의달인 대전찐빵 #생활의달인 찐빵 #생활의달인 세차달인 # 불티나만두찐빵좋아요 공감 공유하기 글 요소 구독하기 작업실 저작자표시 비영리 변경금지,작업실,https://teamaya.tistory.com/,2020-09-28
생활의 달인 765회 청주 뚝배기 떡볶이 면목동 간짜장... ,https://blueplastic.tistory.com/4475,764회 생활의달인 1 대전 찐빵 달인불티나만두찐빵찐빵집 주소 : -대전대덕구중리로76번길18- 2주차달인 : 픽플러스 3생활의 달인 은둔식달 부산 통닭집 팔복통닭 부산 치킨 닭 두루치기 다링ㄴ... ,Modern Story,https://blueplastic.tistory.com/,2020-09-28
맛집정보 :: 생활의 달인 2020년,https://blog.naver.com/mycrystally?Redirect=Log&logNo=221796501200,61 #함경도식만두 동해루 서울 중랑구 면목천로23길 44 #간짜장 신성당 충북 청주시 상당구 사직대로 360 #뚝배기떡볶이불티나만두찐빵대전 대덕구 중리로76번길 18 #찐빵 팔복통닭 부산 부산진구... ,:: crystally ::,https://blog.naver.com/mycrystally,2020-02-04
[대전맛집] 바다목장-생우럭매운탕(동구.가양동),https://blog.daum.net/chulinbone/4545,^^ 공유하기 글 요소 저작자표시 비영리 변경금지 ' 지구별음식이야기대전시먹거리 ' 카테고리의 다른 글 [대전맛집]불티나만두찐빵 (대덕구.중리동.중리시장) (6) 2015.04.11 [대전맛집]... ,철인뼈다귀의 지구별여행기,https://blog.daum.net/chulinbone,2015-04-10
[신림동] 김기철의 장수 왕 만두 찐빵 ,https://blog.naver.com/pca2765?Redirect=Log&logNo=220330266757,"신림역 8번 출구 멀지 않은 곳에 자리한 김기철의 장수 왕 만두 찐빵 에서 맛본 고기호떡은 결론적으로 꽤나 만족스러웠던 경험. 청주의 쫄쫄호떡이나, 부산의불티나호떡이 정파의 명숙이라면, 이곳의... ",처음.이슬.처럼.,https://blog.naver.com/pca2765,2015-04-18
 찐빵옛날 왕 만두:),https://blog.naver.com/oooo030oooo?Redirect=Log&logNo=220951191330,"안녕하세요 저번에불티나 왕 만두 가 너무 맛있었어서 또 먹었어요 :)전 젓가락에불티나왕 만두 라고 적혀있어서불티나 왕 만두 인지 알았는데 어제 저녁 간판을보니,찐빵옛날 왕 만두 네요.가격표입니다ㅎ만두 만... ",핑세는 곰돌이랑 놀고 있었는데,https://blog.naver.com/oooo030oooo,2017-03-06
전국만두 로드 인생만둣집,https://blog.naver.com/monfillette2?Redirect=Log&logNo=220988138621,"오늘은 인생만두 를 맛 볼 수 있는 전국의만두맛집을 소개해드리겠습니다. 응암역불티나 손 만두 ... 고양 동산손 만두뽕잎, 단호박, 시레기, 클로렐라 등 건강한 재료로 만드는만두 와찐빵 ! 웰빙만두 를... ",monfillette2님의블로그,https://blog.naver.com/monfillette2,2017-04-20
남대문 언제나 맛나는 가메골만두 맛집 이에요,https://blog.naver.com/eueuy?Redirect=Log&logNo=221199708982,여기는 도깨비터 인듯 장사가불티나 요만두한찜이 다 쪄졌는지 스팀기 문이 열리고 저도만두 를 살 수 있게 되었어요찐빵 한판에만두5판이 진열되는데 이 순간은 참 볼만한 순간이에요 김치 만두2개... ,이랑이랑 맛집찾기,https://blog.naver.com/eueuy,2018-02-02
밀양아리랑우주천문대 재개관 및 제한운영 실시(정보),https://blog.naver.com/bultina-dumpling?Redirect=Log&logNo=222092439139,가요~ #밀양 # 만두# 불티나만두# 불티나# 찐빵#매운갈비 #갈비 만두#매운갈비 만두#경상남도 # 만두 맛집 # 찐빵 맛집 #수제 만두#수제 찐빵# 만두 가게 # 찐빵 가게 #밀양맛집 (예약이 완료되면 페이지가... ,밀양 '불티나만두찐빵',https://blog.naver.com/bultina-dumpling,2020-09-17
상주만두《개성 왕만두 》,https://blog.naver.com/qkqhdi4594?Redirect=Log&logNo=221760961990," 불티나분식 근처ㅎㅎ 되게 옛날부터 있었던 것 같은데 나는 처음 가보는 곳! 뭔가 외관이 되게 맛집 느낌이다ㅋㅋㅋㅋ 내부는 이런 모습! 아늑~ㅋㅋㅋㅋㅋ 이건 메뉴와 가격!만두 는 10개에 3500원,찐빵 은 4개... ",호,https://blog.naver.com/qkqhdi4594,2020-01-05
(본문에 이전 삽입 완료함)2020년 9월 TV 방송에 소개된 맛집... ,https://blog.naver.com/bklight?Redirect=Log&logNo=222105430530,대전 찐빵 달인 (최경환(男 58세 경력 19년 신순희女)불티나만두찐빵042-623-6271 대전... 은둔식달-춘천 만두 달인 (김영달男 62세경력 30년 ) 왕만두 033-251-5480 강원 춘천시 사농동 46-5... ,맛집 찾기쉽게 주소 순으로 정리한 방송 탄 맛집 정보,https://blog.naver.com/bklight,2020-10-03
2020.12.30,https://blog.naver.com/rayesul?Redirect=Log&logNo=222190640330," 찐빵 이랑만두 랑 고로케 구입하고 바로 앞집에 순대집에서 순대사고 시장 어딘가의 떡볶이 구입 음식 사진을 안찍었네,,,,찐빵 은 달달하니 맛있었다.만두 는 그냥 쏘쏘.. 고로케 쏘쏘.... 순대 진짜... ",언제나 맑음❤,https://blog.naver.com/rayesul,2020-12-30
달인이 만들어주는 전국만두 !,https://blog.naver.com/qazwsxe1122?Redirect=Log&logNo=220988387008,"뽕잎, 단호박, 시레기, 클로렐라 건강한 재료로 만드는만두 와찐빵 !! 응암역_ 불티나 손 만두쌀가루로 만든만두 피와 속재료 모두 수제로 조리하는 곳! 경력 48년의 손맛! 육즙이 남다른만두 에요~~",평택 명품 부동산,https://blog.naver.com/qazwsxe1122,2017-04-21
[경상남도/밀양]밀양전통시장먹거리~,https://blog.naver.com/sejin1118?Redirect=Log&logNo=220602762142,볼게없었어요.(기대해서 간것도있지만..) 그래서 벌써 끝~ 먹거리가 많이 없어서 아쉬웠어요..밀양전통시장에 나와서 맛있는 냄새가나서 따라가보니 나왔던불티나찐빵만두 !고기 만두 10개-3500원 김치 만두 10개... ,행복한 인생,https://blog.naver.com/sejin1118,2016-01-20
"충청도 맛집편 - 충남 대전시, 세종시 맛집편",https://blog.naver.com/bklight?Redirect=Log&logNo=221141253693,"왕 만두042-823-6338 대전 유성구 갑동 387-90 ◈ 마라소 샤브샤브샐러드바 042-822-1216 대전... 전통불티 나 는 돼지갈비편, 돼지불고기, 삼겹살 042-254-0758 대전 중구 대흥동 3-16 (대전천서로... ",맛집 찾기쉽게 주소 순으로 정리한 방송 탄 맛집 정보,https://blog.naver.com/bklight,2017-11-16
대전 중리시장 먹부림,https://blog.naver.com/cjh5843?Redirect=Log&logNo=220724449767,저녁으로 중리시장 맛집탐방 1차 홍두깨칼국수 2차불티나만두찐빵3차 아이스크림 매우 만족스러운 저녀끄,모두가 이용하는 블로그,https://blog.naver.com/cjh5843,2016-05-31
청주맛집 정보,https://blog.naver.com/hks5733?Redirect=Log&logNo=30145210852,"-분식- 상호:코끼리 만두 ( 불티나골목) 주소:상당구 남문로2가 40-1번지 전화043-255-9842 특징... (튀긴 만두 ,매운 만두 ) 형태:홀,포장 상호:소문난찐빵 , 만두주소:상당구 우암동 366-5번지 전화043-256-6363... ",홍반장의 부동산 이야기,https://blog.naver.com/hks5733,2012-08-21
동탄 가까운 오산재래시장 오색시장✔단골이네,https://blog.naver.com/roadqueen9775?Redirect=Log&logNo=221369086104,"영양빵과만두 하나씩 사들고 갔어요. ( 비쥬얼보고 사오라고 날리라서요) 찐방의 윤기보이시나요. 눈으로보곤 도저히.안살수 없어 이또한 샀다는~~~ 상호는불티나찐빵 , 옆집에 통닭집고 장날이면 줄을서서... ",NO.1✔ 부동산톡!!!,https://blog.naver.com/roadqueen9775,2018-10-01
대전 전통시장 맛집들,https://blog.naver.com/newstart1?Redirect=Log&logNo=20108493883,대덕구 중리동 중리시장에는 전국재래시장 박람회에서 대전의 맛을 유감없이 발휘했던불티나 만두찐빵 (623-6271) 가게가 있다. 싼 게 비지떡이라는 말을 보기좋게 뒤집는 이 곳은 싸고도 맛좋은 만두와 찐빵... ,임재만의 유성이야기,https://blog.naver.com/newstart1,2010-06-27
홍천 가볼만한곳 홍천 꽁꽁축제 다양한 먹거리를 소개합니다.,https://blog.naver.com/e_softhouse?Redirect=Log&logNo=220232821862,"겨울하면 바로찐빵 이죠~ ★이외 먹거리들★ 이외 먹거리들~ 홍천꽁꽁튀김 여기가 또 별미입니다. 온갖 튀김들이 다 모여있는곳 ㅋ 통오징어튀김, 고구마튀김,만두 튀김, 치즈스틱, 인삼튀김, 모둠감자튀김... ",SOFTHOUSE,https://blog.naver.com/e_softhouse,2015-01-07
190225 '생활의 달인' 출연 업소 지역별 정리,https://blog.naver.com/jsjooys?Redirect=Log&logNo=221429772141,식빵불티나 손 만두마마수제 만두한나식빵 신사동 23-5 신사동 336-3 응암동 746-1 02-304-4240 02-375-1688 02-6214-7246 545 610 553 【종로구】 설렁탕 낙지볶음 족발 일본가정식 중식... ,비망록(備忘錄),https://blog.naver.com/jsjooys,2018-12-29
2020.03.20. 3라이딩. 세천교,https://blog.naver.com/mkk444?Redirect=Log&logNo=222069887339,"● 이찬원 모친이 운영하는불티나숯불 닭발 막창 곰장어집이다. 인도까지 고객이 줄을 섰다. 찬원의 인기가 여기에서도 드높다 ● 이곡역 성서타운 상가에 있는만두찐빵 집, 죽전네거리에서 강창교까지... ",푸른하늘님의 블로그,https://blog.naver.com/mkk444,2020-08-24
전통시장 맛집,https://blog.daum.net/sm0812/6983970,"발휘했던불티나 만두찐빵 ( 623-6271) 가게가 있다. 싼 게 비지떡이라는 말을 보기좋게 뒤집는 이 곳은 싸고도 맛좋은 만두와 찐빵맛으로 이미 알만한 사람은 다 아는 집이다. 만두는 1,000원에 8개, 찐빵은 1... ",오빠 생각,https://blog.daum.net/sm0812,2010-07-01
일상/소소한 행복들로 가득했던 지난 9월 이야기,https://blog.naver.com/yimceeun?Redirect=Log&logNo=221375235380,너무 현실적이라 무서웠던 서치 기존의 어떤 영화들보다도 더 현실 반영을 잘한 것 같다 영화 보고나니 인터넷이 너무 무서워졌다 #서치 아빠가 우리가 좋아하는 중리동불티나찐빵 의찐빵 이랑만두 를... ,매일이 소중해,https://blog.naver.com/yimceeun,2018-10-11
모란칼국수 평택칼국수맛집 얼큰이칼국수 통복시장,https://blog.naver.com/chjh1007?Redirect=Log&logNo=220843541883,아무튼 여기는불티나왕만두찐빵 이네요 ^^ 저는 여기 정말 아무생각없이 들어가서 칼국수 하나 주세요. 라고 말한면 될 곳으로 생각이 들었고 그렇게 하려구 했는데 메뉴판을 보는 순간... 아... 뭔가 고민을... ,최종분석의 분석없는 맛집 탐방기,https://blog.naver.com/chjh1007,2016-10-25
생활의 달인. 맛집 총정리,https://blog.naver.com/chosun51?Redirect=Log&logNo=221266219640,"방영) 옥수 찐빵만두 종합분식 /찐빵(2018.01.22.방영) 60년광복동김치국수국수 / 국수 (2018.01.... 방영)불티나 손 만두만두/만두(2016.10.24.방영) 고에몬 강남점스파게티,파스타전문... ",더 나은 부동산 전문가,https://blog.naver.com/chosun51,2018-05-02
생빠꼼 맛집리스트,https://ohnu.tistory.com/entry/%EC%83%9D%EB%B9%A0%EA%BC%BC-%EB%A7%9B%EC%A7%91%EB%A6%AC%EC%8A%A4%ED%8A%B8,역삼동-월화당-고기 만두(생활의달인) 강남구 청담동-마녀김밥-김밥 (생활의달인) 강남구 청담동... 천호동-엄마손 만두 -매콤 만두 국 (3대천왕) 강북구 번1동-오늘통닭-소스 붓기의 달인 (생할의달인) 강북구... ,https://ohnu.tistory.com/,https://ohnu.tistory.com/,2017-06-19
밀양전통시장 8 구역 상가 안내,https://blog.naver.com/daebak6623?Redirect=Log&logNo=220093088537,100불티나찐빵만두355-5065만두82 인삼센타 354-6882 인삼 101 빈점포 83 영밀상회 ***-****-**** 농산물 102 마루 속옷 84 엄마방침구 355-1516 침구 103 더감 의류 85 명동수선 354-8832 수선... ,밀양 전통시장,https://blog.naver.com/daebak6623,2014-08-15
[지방편] 사진으로 남긴 재래시장,https://blog.naver.com/pca2765?Redirect=Log&logNo=220132364195,"관련 포스팅 마가린으로 튀겨내는 맛깔진 호떡,불티나호떡 http://blog.naver.com/pca2765/80186118770... 관련 포스팅 메뉴는만두 와찐빵 뿐, 40년 전통의 진주 만두http://blog.naver.com/pca2765/80211133971 칼국수가 단돈... ",처음.이슬.처럼.,https://blog.naver.com/pca2765,2014-09-25
맛집정보 :: 생활의 달인,https://blog.naver.com/mycrystally?Redirect=Log&logNo=220564903906,900-3 #호떡불티나 손 만두서울 은평구 신사동 23-5 # 만두고에몬 서울 서초구 서초동 1317-13... 987-7 # 찐빵2013년 C4 케이크 부티크 서울 강남구 신사동 529-4 베이커스필드 서울 강남구 역삼동 628-6... ,:: crystally ::,https://blog.naver.com/mycrystally,2015-12-10
평택에 오래 살면서 모르면 간첩인 것들,https://blog.naver.com/alstn710?Redirect=Log&logNo=221401963058,통복 시장전국에서 비교해도 규모가 상에 속하는 참 큰 시장이다전에 주변에 잇는 맛집불티나 ... 된찐빵만두 집이 없어서 특히 더 대박집이엇고 나도 어쩌다 이용햇는데 참 아쉬운 대목이다항간에 불법으로... ,아홉수인생,https://blog.naver.com/alstn710,2018-11-20
세종전통시장 상점 위치도(구역별 상점 현황 포함),https://blog.naver.com/sjmarket2019?Redirect=Log&logNo=221582139298,왕 만두찐빵 (먹보왕 만두 ) H-4 세원꽃집 H-5 아름당 H-6 대박왕족발 H-7 H-8 한솔축산물유통 H-9... K-21불티나 옷수선 K-22 윤미용실 L구역 상점위치도 L-1 대성상회 L-2 작목반건강원 L-3 L-4... ,세종전통시장,https://blog.naver.com/sjmarket2019,2019-07-10
부산 전통시장 @ 국제시장 먹자골목 먹거리,https://blog.naver.com/mino_mom?Redirect=Log&logNo=150222822,나오면불티나 호떡은 꼭 하나 먹어줘야 합니다 ㅋㅋ 국제시장을 대표하는 명물 먹거리 중의 하나에요 ^^ 골목으로 들어가면 추억의찐빵가게에서 파는 각종 도너츠도 있어용 ~ 꿀빵과 도너츠는 여기에서 먹어야... ,꿈꾸는 작은 별빛 ★,https://blog.naver.com/mino_mom,2012-02-08
김포시 사우동 재난기본소득 사용처,https://blog.naver.com/cynthia03?Redirect=Log&logNo=221930953677,아리오돌뼈불티나 왕 만두포뇨 네네치킨피자 숙이네부대찌게 불닭발동대문엽기떡볶이 김포점 (주)... 다흰왕 만두찐빵김밥천국 김포꿩 만두달달한 BAR 죠스떡볶이 김포사우점 중봉도서관 구내식당... ,A Room of One's Own,https://blog.naver.com/cynthia03,2020-04-27
행5장 12-16 성령의 능력 안에 있는 교회 -주명갑,https://blog.naver.com/karamos?Redirect=Log&logNo=80129973985,EX) 불티나빵집이 있었는데 지금은 없어졌다. 참 잘되는 집이었는데 저는 진짱 집을 자주 가곤했다....찐빵 을 사러 가면서찐빵 만 사는 것이 아니라만두 까지도 사왔다. 그집은 우선 빵을 많이 주었다. 1000원만... ,칠봉산 블로그,https://blog.naver.com/karamos,2011-05-10
생활의 달인 은둔식달 대전 찐빵 달인불티나만두찐빵위치... ,https://blog.naver.com/kodakds?Redirect=Log&logNo=222095658662,생활의 달인 은둔식달 대전 찐빵 달인불티나만두찐빵연락문의 042-623-6271 주소 대전 대덕구 중리로76번길 18 지번 중리동 372-2 영업시간 매일 07:00 - 21:00 일요일 휴무 이미지 정보 더보기 -출처... ,쉐도우핸드,https://blog.naver.com/kodakds,2020-09-21
대전불티나만두찐빵 /생활의달인 대전찐빵 주소.영업시간.... ,https://blog.naver.com/momi0827?Redirect=Log&logNo=222100787877,"■ 은둔식당-대전 찐빵 달인불티나만두찐빵※주소: 대전 대덕구 중리로76번길 18 ※영업시간 매일 07:00 - 20:00 첫째주 일요일/ 둘째주, 셋째주 화요일 휴무 생활의달인에 나온 은둔식당입니다. 전국에... ",자곡동.세곡동아파트 전문 부동산 010-9818-5114,https://blog.naver.com/momi0827,2020-09-27
생활의 달인 은둔식달 대전 찐빵 달인불티나만두찐빵최경환... ,https://blog.naver.com/leonato?Redirect=Log&logNo=222102006495,생활의 달인 은둔식달 대전 대덕구의 대전 찐빵 달인불티나만두찐빵최경환 신순희 달인 전국에 숨어있는 맛의 달인을 발굴하는 생활의 달인 프로젝트! 이번 주 은둔식달 제작진이 첫 번째로 찾아간 곳은... ,LEONATO,https://blog.naver.com/leonato,2020-09-28
 불티나 만두 찐빵 ,https://blog.naver.com/wetfire0616?Redirect=Log&logNo=220562525235, 불티나 만두 ~ 정말 싸고 맛있어요찐빵4개에 1000원이예용~ 크기는 작지만 너무 저렴하죵^^만두 도 7개애 천원 대덕구 중리시장내에 있는찐빵 집,신나는 하루,https://blog.naver.com/wetfire0616,2015-12-08
