title,link,description,bloggername,bloggerlink,postdate
대전 맛집 중리시장불티나 만두찐빵- 생활의 달인 대전 찐빵... ,https://blog.naver.com/zephyr122059?Redirect=Log&logNo=222095547473,"휴무라 음식 사진이 없음을 양해하시고 찐빵, 만두 등 이 집 군것질거리에 대한 정보는 위 유미yunmei님의 훌륭한 포스팅을 참조하시기를.불티나 만두찐빵042-623-6272 대전광역시 중리로 76번길 18 지번: 중리동 372... ",사랑이 밥먹여준다,https://blog.naver.com/zephyr122059,2020-09-21
대전 맛집 생활의달인 찐빵불티나만두찐빵 ,https://blog.naver.com/ddoryddo?Redirect=Log&logNo=222134472599,(생활의달인 방송 소개멘트) 대전 생활의달인불티나만두찐빵 은 만두와 찐빵 꽈배기 및 고로케... 대전맛집 #대전생활의달인 #대전찐빵 #생활의달인대전 #찐빵맛집 #생활의달인 # 불티나만두찐빵#불티나찐빵,☆맛있는남자 Chef*M☆,https://blog.naver.com/ddoryddo,2020-11-03
"생활의달인 대전 찐빵불티나만두찐빵 , 대덕 중리시장 만두 맛집",https://blog.naver.com/tmishaha?Redirect=Log&logNo=222096852141,"생활의달인 찐빵 달인 방송후기 대전 중리시장 불티나만나찐빵 대전 대덕구 전통시장 중리시장에서 약... 팔아온불티나만두찐빵 . 찐빵 이외에도 만두, 꽈배기, 떡볶이, 어묵 등의 분식류를 판매하고 있는... ",Amazing BLOG,https://blog.naver.com/tmishaha,2020-09-22
달인 은둔식달 출연한 ️중리시장 ' 불티나 만두 찐빵 ' 맛집 추천,https://blog.naver.com/heejung6759?Redirect=Log&logNo=222446115469,"가게 이름처럼 불티나게 팔리고 있는 ️만두 찐빵! #찐빵맛집 #생활의달인찐빵 중리시장불티나만두찐빵메뉴입니다. 전체적으로 2,500원 이하인 가격으로 무척 저렴하다는 사실!!! 진짜 요즘 물가 생각하면... ",Kim Cheetah,https://blog.naver.com/heejung6759,2021-07-26
"밀양)불티나찐빵만두- 고기 만두 ,찐빵 ",https://blog.naver.com/altnsaldi?Redirect=Log&logNo=222530578211,슥이 제일병원에서 모더나1차 접종이라 병원에 태워주고 잠시 기다리는동안 시내에만두 사러 나옴 # 불티나찐빵만두여기만두 집 굉장히 오래되었음 날이 쌀쌀해지면 먹고싶어져서 사먹게 되는 그런 집임 오래... ,슥이와 함께하는 일상 ♬,https://blog.naver.com/altnsaldi,2021-10-08
대전 중리동불티나 만두찐빵 ,https://blog.naver.com/loluuuuu?Redirect=Log&logNo=222496955326,"중리시장에서 유명한불티나만두찐빵아시나요? 만두찐빵제외하구도 도너츠, 보로케, 꽈배기, 떡볶이 튀김등을 팔아요 메뉴판에 가격보이세요? 만두도 1판(10개) 에 2,000원 저렴하죠? 저희는 고기만두 김치만두... ",반짝반짝빛나는블로그,https://blog.naver.com/loluuuuu,2021-09-06
대전 중리시장불티나 만두찐빵 ,https://blog.naver.com/yumeinv?Redirect=Log&logNo=222083701688,"대전 중리동 중리시장 맛집불티나 만두찐빵역시나 오랜만에 쓰는 블로그 하는것도 없는데 왜이리... 이유,, 만두와 찐빵 라떼시절 찐빵 엄마랑 시장올때마다 사먹었는데,, 그립다,,그치 엄마,,? 7개 이천원... ",우미와 우미자차 한 잔?,https://blog.naver.com/yumeinv,2020-09-08
(양양건어물상회/ 불티나 도넛/ 찐빵 / 만두 고로케/이슬송이),https://blog.naver.com/dbwls2362?Redirect=Log&logNo=222518650989," 찐빵 집에서찐빵 (8개 5,000원)이랑만두 고로케(1,500원) 구매!찐빵 은 약간 술빵같은 느낌이여서 호불호가... ㅜㅜ불티나 도넛은 장날에만 문을 여나봐 여튼 양양시장불티나 도넛은 시장 입구에 있는디 사람들이... ",❤365일 배고픈 빵진쓰❤,https://blog.naver.com/dbwls2362,2021-09-27
생활의 달인 대전 중리시장불티나만두찐빵 ,https://blog.naver.com/tingbingo?Redirect=Log&logNo=222101678855,9월 22일 #생활의달인 찐빵달인으로 나왔다는 # 불티나만두찐빵집근처이지만 한번도 안가본 곳이라... 오빠는 만두는 역시 #비비고만두 라며..ㅋㅋ 중리시장 간 김에 떡도 사고 떡볶이 순대도 사고 만두 찐빵도... ,¡Buen viaje!,https://blog.naver.com/tingbingo,2020-09-28
2021아홉번째-사랑을나눈데이~♪) 불티나만두찐빵 ... ,https://blog.naver.com/ddswc6270767?Redirect=Log&logNo=222422140322,"중리전통시장의불티나만두찐빵 에서 어르신께 맛있는 간식을 정기 후원을 해주시기로 하셨습니다!!... 이번엔 제가 간식을 쏘려고요^^ㅋㅋㅋ 고로케, 튀김소보루, 한쪽에서 쪄지고 있는 찐빵과 만두 코로케 참... ","행복 두배 더, 어르신이 두 배 더 행복한 세상",https://blog.naver.com/ddswc6270767,2021-07-06
" 불티나 만두찐빵 , 생활의 달인 은둔식달 만두찐빵 달인 방영 맛집",https://blog.naver.com/167sss?Redirect=Log&logNo=222444695736,유명한불티나 만두찐빵생활의 달인 은둔식달 달인으로 유명한 곳 #만두 #찐빵 등을 아침부터 열심히 준비하고 계셨어요. 메뉴표 사이에 생활의달인이 떡하니! 불티나게 팔린다고 #불티나 인가봐요. ^^ 가격도... ,하얀 손과 함께하는 맛있는 세상,https://blog.naver.com/167sss,2021-07-25
생활의달인 대전 찐빵 -불티나 만두찐빵 ,https://blog.naver.com/sw20woo?Redirect=Log&logNo=222095533837,유명한 만두찐빵 집으로 거듭났겠죠 중리시장불티나만두찐빵집 사장님은 사업을 하다 실패하고 어려움을 겪다 지인에게 만두 빚는 일을 배웠다고 하는데요 그래서 2002년부터 중리시장에서 만두가게 문을... ,은밀한 칩거생활,https://blog.naver.com/sw20woo,2020-09-21
생활의달인 대전 찐빵 달인 위치불티나만두찐빵 ... ,https://blog.naver.com/dufk220?Redirect=Log&logNo=222095663243,찐빵을 시작으로 만두와 고로케 꽈배기 떡볶이등 상당히 다양한 종류를 판매를 하고 있는 곳이다.... 달인의 찐빵에는 노하우 그리고 정성이 들어가 있어 더욱 특별하게 느껴진다. ▶ 불티나만두찐빵 ... ,두둥탁,https://blog.naver.com/dufk220,2020-09-21
대전에도 생활의달인 찐빵맛... 많은불티나만두찐빵 으로... ,https://blog.naver.com/kimcolor1004?Redirect=Log&logNo=222098946032,"대전중리시장불티나만두찐빵찐빵, 만두, 꽈배기, 도넛 등 다양한 분식이 1000~2000원 가격대로 시장... 불티나만두는 당구공보다 작다. 다른 곳보다 속이 꽉 차서 씹는 맛이 있다. 솔직한 저의 입맛으로는... ",뚱자의 365일 먹자하루,https://blog.naver.com/kimcolor1004,2020-09-26
대전맛집 중리동불티나 만두찐빵중리시장 맛집(feat.순대),https://blog.naver.com/doremi0821?Redirect=Log&logNo=222408702485,출현한불티나 만두찐방 가게가 있어요!! ㅎㅎ 요기도 벌써 사람들이 앞에 많이 몰려와 있네요 ㅋㅋ 순대를 사고찐빵 을 사가려고 와이프에게 전화.. 와이프가 꽈배기랑 찹살 도너츠만 사오라는 명령.. 작년... ,김서방의 육아일기,https://blog.naver.com/doremi0821,2021-06-24
대전 중리시장불티나 만두 찐빵주차장,https://blog.naver.com/rhkrdl66?Redirect=Log&logNo=222103569468,공영이라 비싸진 않아요 공영주차장에서 길건너서 쭉 진입하면불티나 만두 집도 나옴 생활의 달인에 방송 됐다는데 그래서 그릉가 조금 줄서있고.찐빵 이랑만두 맛이 특별하진 않고찐빵 은 알고있는 그... ,호랭이 기운이 야옹,https://blog.naver.com/rhkrdl66,2020-09-30
‘생활의 달인 은둔식달’ 대전 찐빵 달인( 불티나만두찐빵 )... ,https://blog.naver.com/bizbank?Redirect=Log&logNo=222101004745,"‘생활의 달인’ 은둔식달 대전 찐빵 달인 맛집 ‘ 불티나만두찐빵 ’, 부산 치킨·닭 두루치기 달인 맛집 ‘팔복통닭’이 화제다. 21일 밤 방송된 SBS 교양프로그램 ‘생활의 달인’에서는 은둔식달 대전 찐빵... ",bizbank님의 블로그,https://blog.naver.com/bizbank,2020-09-27
생활의달인 대전찐빵불티나만두찐빵중리시장 은둔식당,https://blog.naver.com/speed6666?Redirect=Log&logNo=222096232229,생활의달인 대전찐빵불티나만두찐빵중리시장 은둔식당 안녕하세요 ~ 이번 포스팅은요 생활의달인에서 소개된 대전 중리동에 위치한 찐빵 맛집불티나만두찐빵편 포스팅입니다 ^^ 영업시간 매일 07:00 ~ 21... ,동그리,https://blog.naver.com/speed6666,2020-09-22
"생활의달인 :: 대전 찐빵 달인, 중리시장불티나만두찐빵 ",https://blog.naver.com/woongkeon?Redirect=Log&logNo=222095543559,"◆ 불티나 만두찐빵(찐빵 달인) 위치 : 대전 대덕구 중리로 76번길 18 영업시간 : 매일 07:00 ~ 21:00(일요일 휴무) 만두 10개 : 2,000원 왕만두 3개 : 2,000원 찐빵 3개 : 1,000원 카레고르케 3개 : 2,000원 야채고르케... ",고사또의 공간,https://blog.naver.com/woongkeon,2020-09-21
중리전통시장불티나찐빵 땅스부대찌개,https://blog.naver.com/bss8569?Redirect=Log&logNo=222104541209,"대전 찐빵 달인 중리전통시장불티나만두찐빵집입니다. 중리전통시장 내 있는 불티나만두찐방 집 영업시간은 오전 07:00~20:00까지 이며, 매월 첫째주 일요일/ 둘째주, 셋째주 화요일은 휴무입니다. 찐빵만 19년... ",하루하루가 소중한 하루,https://blog.naver.com/bss8569,2020-10-01
생활의달인 대전찐빵 대전 중리동 중리시장불티나만두찐빵택배,https://blog.naver.com/bbbb1231?Redirect=Log&logNo=222100232941,대전찐빵 대전 중리동 중리시장불티나만두찐빵택배 메뉴 고기만두 김치만두 국만두 왕만두 찐빵 꽈배기 찹쌀도너츠 빵 도너츠 튀김소보로 카레고로케 야채고로케 감자고로케 김치고로케 오뎅 튀김... ,피닉스의 일상블로그,https://blog.naver.com/bbbb1231,2020-09-27
생활의달인 대전찐빵 달인불티나만두찐빵중리시장,https://blog.naver.com/eueuy?Redirect=Log&logNo=222095531704,이상의 재료와 정성으로 팥소를 만드는 특별한 비법을 생활의 달인에서 공개한다. 대전 중리시장 안에 있다는 만두찐빵 달인 가게 이름 한번 멋지게 지으셨네요 #생활의달인 #대전찐빵 달인 # 불티나만두찐빵 ,이랑이랑 맛집찾기,https://blog.naver.com/eueuy,2020-09-21
" 불티나찐빵 , 만두 -중리시장 맛집",https://blog.naver.com/haha9563?Redirect=Log&logNo=222137158774,휴무는 네이버에는 화요일로 나오는데 월요일에 쉬는것 같아요 택배배달도 된다네요. 만두도 팔아요. 판매하는 다양한 제품 #중리시장 # 불티나만두찐빵#불티나찐빵 #천원에세개 #중리시장맛집,대전에서 유용한 킴쌤의 일상,https://blog.naver.com/haha9563,2020-11-06
대전 찐빵 달인 생활의 달인 대전불티나만두찐빵 ,https://blog.naver.com/sue035?Redirect=Log&logNo=222095575272,대전 찐빵 달인 생활의 달인 대전불티나만두찐빵대전 찐빵 달인 생활의 달인 대전불티나만두찐빵생활의 달인 대전 찐빵 달인불티나만두찐빵전국에 숨어있는 맛의 달인을 발굴하는 생활의 달인... ,해바라기,https://blog.naver.com/sue035,2020-09-21
"[생활의 달인]대전 중리시장불티나찐빵 ,위치,가격,영업시간... ",https://blog.naver.com/rlqhstyle?Redirect=Log&logNo=222095753329,"하려한다 불티나게 팔린다는 대전 찐빵집 이름은 # 불티나만두찐빵이다 ^^ 주소: 대전 대덕구... 찐빵만큼이나 달인을 유명하게 만든 것은 바로 만두. 여기에 고로케도 감자, 야채, 김치, 카레 등 다양하게... ",크리드포스트,https://blog.naver.com/rlqhstyle,2020-09-21
생활의달인 대전 찐빵 달인 중리시장불티나만두찐빵 ,https://blog.naver.com/love-haru?Redirect=Log&logNo=222100679958,생활의달인 찐빵 달인 대전 중리시장 불티나찐빵 생활의달인 은둔식달 대전 찐빵의 달인 위치불티나만두찐빵대전 대덕구 중리로76번길 18 지번: 대전광역시 대덕구 중리동 376-2번지 임홍식 셰프: 저기 줄 서... ,ෆ,https://blog.naver.com/love-haru,2020-09-27
"팔복통닭,닭두루치기달인집,대전 찐빵달인불티나만두찐빵 ",https://blog.naver.com/chopa1394?Redirect=Log&logNo=222095935389,"200921 764회 생활의달인 부산치킨달인집 남산역맛집 팔복통닭,닭두루치기달인집,대전 찐빵달인불티나만두찐빵오늘은 생활의달인을 오래만에 포스팅을 해보려고 하는데요 이번에는 은둔식달... ",이스트,https://blog.naver.com/chopa1394,2020-09-22
생활의달인 764회 대전 찐빵 달인불티나만두찐빵주차달인... ,https://blog.naver.com/ksjmhlove?Redirect=Log&logNo=222095434343,은둔식달 - 대전 찐빵 달인불티나만두찐빵맛집위치: 대전 대덕구 중리로76번길 18 최경환(男 / 58세 / 경력 19년) 신순희(女 / 57세 / 경력 19년) 2. 주차 달인 (주)픽플러스 본사 : 경기 고양시 일산동구... ,알록달록 블로거,https://blog.naver.com/ksjmhlove,2020-09-21
생활의 달인 764회불티나만두찐빵대전찐빵달인,https://blog.naver.com/adsense101?Redirect=Log&logNo=222095544298,대전 찐빵 달인 정보.불티나만두찐빵대전 대덕구 중리로76번길 18 042-623-6271 영업시간 매일 오전 7시 오후 9시 일요일은 휴무 고기만두 10개 1판 - 2천원 김치만두 10개 1판 - 2천원 만두 10개 1판... ,Adsense 101,https://blog.naver.com/adsense101,2020-09-21
생활의달인 대전불티나찐빵후기(+ 중리시장 속 맛집 추가),https://blog.naver.com/honguree?Redirect=Log&logNo=222114839315,가격이 겁나게 착함만두10개 2천원찐빵3개 천원 가격보고 너무 놀램.. 찹쌀도넛 4개 천원이란... 꽤 큰편이니 이것저것 보고 돌아가시길~ #생활의달인대전 찐빵# 불티나찐빵#대전오떡 #중리시장 찐빵 ,사진찍고 여행하는 초보 캠퍼,https://blog.naver.com/honguree,2020-10-15
중리시장불티나만두찐빵대전 찐빵 달인 생활의달인9월21일,https://blog.naver.com/se_0529?Redirect=Log&logNo=222095685810, 찐빵 도 저렴하고 인기가 좋지만 이집은 전통 분식집입니다.만두 와 떡볶이 튀김도 판매를 하고 고로케와 꽈배기도 판매를 하고 있다고 합니다. 학생들이 좋아할만한 다양한 메뉴를 판매를 하고 있고 가격도... ,뜨랑이 맛집 찾기,https://blog.naver.com/se_0529,2020-09-21
대전 생활의 달인불티나만두찐빵중리시장,https://blog.naver.com/jny991222?Redirect=Log&logNo=222218556511,전에 엄빠가 사와서 먹어봤는데 너무 내 스탈이었던불티나만두찐빵! 다시 사러 왔습니다 .. 생활의 달인에도 나왔답니다 그래서 그런지 사람이 많아서 줄 섰어요 .. 만두랑 찐빵 말고도 여러가지 팔아요 아... ,이것저것,https://blog.naver.com/jny991222,2021-01-24
 불티나만두찐빵 ,https://blog.naver.com/rok2tank?Redirect=Log&logNo=222099353930,마성의 ‘찐빵’불티나만두찐빵2020.09.21 764회 대전 대덕구 중리로76번길 18 (중리동) 분식 042-623-6271 대전에서 20년 동안 찐빵 맛을 유지한 찐빵 달인 입니다. #찐빵 #찐빵달인 #대전찐빵달인... ,당황하지 않고,https://blog.naver.com/rok2tank,2020-09-25
대전 찐빵 달인불티나만두찐빵vs 부산 치킨·닭 두루치기... ,https://blog.naver.com/mediost?Redirect=Log&logNo=222095595835,닭 두루치기의 달인♥ 은둔식달 - 대전 찐빵 달인불티나만두찐빵대전 대덕구 중리로76번길 18 ☎042-623-6271 최경환(男 / 58세 / 경력 19년) 신순희(女 / 57세 / 경력 19년) ♥은둔식달 - 부산 치킨... ,주방이야기,https://blog.naver.com/mediost,2020-09-21
생활의 달인만두맛집불티나 손 만두응암역 맛집,https://blog.naver.com/my3joy?Redirect=Log&logNo=222163969325," 불티나손 만두 는 얇은피, 두꺼운피 다 있어요. 식사 대용으로 먹기 좋은찐빵 처럼 폭신폭신한 두꺼운피로 만든 김치 만두 도 정말 맛있어요. 특히만두 피가 밀가루가 아닌 쌀가루로만두 피를 만들어 더 든든하게... ",도로시와 봄이의 일상,https://blog.naver.com/my3joy,2020-12-05
대전 찐빵 달인( 불티나만 두 찐빵 ) 생활의 달인 764회,https://blog.naver.com/kknjhs1?Redirect=Log&logNo=222095507329,대전 찐빵 달인이 소개됩니다불티나 만두 찐빵 이라는 상호를 가지고 있습니다 달인이 만드니 당연히 불티나게 팔리는가 봅니다..ㅎㅎ 이미지출처: 아이뉴스24캡쳐 https://entertain.v.daum.net/v/20200921103542794... ,하얀천사,https://blog.naver.com/kknjhs1,2020-09-21
"중리시장불티나만두찐빵 , 중촌동 하루방만두",https://blog.naver.com/pabianlove?Redirect=Log&logNo=220523509836,"나와 우리반 아이들이 애정하는 중리시장불티나 만두 , 찐빵 ❤️ 우리반은 스티커를 모으면 학용품-1시간 자유권-간식 순서로 보상을 하는데 간식까지 도달하면 근처에서 살 수 있는 간식 중 직접 고를... ",깨꽁이의 특수교육★,https://blog.naver.com/pabianlove,2015-10-29
밀양불티나찐빵만두메뉴 소개,https://blog.naver.com/bultina-dumpling?Redirect=Log&logNo=222136357109,맛있으면 0 kcal 니까요~^^찐빵 은 겨울이 오면 업데이트 예정^^ #밀양 # 만두# 불티나만두# 불티나# 찐빵#매운갈비 #갈비 만두#매운갈비 만두#경상남도 # 만두 맛집 # 찐빵 맛집 #수제 만두#수제 찐빵# 만두 가게... ,밀양 '불티나만두찐빵',https://blog.naver.com/bultina-dumpling,2020-11-05
대전불티나찐빵 ,https://blog.naver.com/nurse2008?Redirect=Log&logNo=222112048497,대전에 일이 있어 갔다 전 부터 가보고 싶었던불티나찐빵울 쭌군이찐빵마니아라 궁금해서 방문했다. 12시 반쯤 도착했는데 방송의 힘이던가. 줄 이 엄청 서 있다 꽈배기.도넛 종류는 이미 품절이였고만두 랑... ,Happy Blossom,https://blog.naver.com/nurse2008,2020-10-10
[응암역]불티나손 만두 ,https://blog.naver.com/kspring917?Redirect=Log&logNo=222394190199,"ㅋ 뭔가 두꺼운 피인데도 찰져서 맛있는불티나 만두 ! 이날은 통 만두 도 엄청 맛있었다, 피가 좀 바꼈는가……? 개인적으로 간장 안찍고 먹어도 간이 딱 맞아서 굳이 간장 없어도 될듯하다,찐빵 도 있으면... ",취향의 문장들,https://blog.naver.com/kspring917,2021-06-11
"대전생활의달인,대전맛집,' 불티나찐빵만두 ' 먹어보다.",https://blog.naver.com/seokinsoo?Redirect=Log&logNo=222169018918," 불티나 만두찐빵엄청 궁금하더라구요. 줄이 너무 길다고 하길래 살짝 긴장하면서 갔는데 늦은 밤이라 줄이 없어서 다행이었어요. -대전생활의달인,대전맛집,'불티나찐빵만두' 먹어보다.- 가격이 너무 착하네요.... ",푸른나무아동심리연구소,https://blog.naver.com/seokinsoo,2020-12-10
대전 중리시장 떡볶이 맛집불티나 만두찐빵 ,https://blog.naver.com/remainwithme?Redirect=Log&logNo=221580559202,진짜 불티나게 팔린다고 한다 대전 중리시장 맛집불티나 만두찐빵대표 메뉴는 역시 만두와 찐빵 ! 고기만두도 먹어보고 싶었는데 이모가 자기 입맛에는 별로였다고 사전 차단해버려서 실패했다 ㅠ_ㅠ... ,집순이 이순집,https://blog.naver.com/remainwithme,2019-07-08
 불티나왕 만두 찐빵엄니 만나러...,https://blog.naver.com/chapig1029?Redirect=Log&logNo=221900405289,"저와 예쁜돼지는 점심 대신에 요만두 와찐빵 을 사서 묵었습니다. ㅎㅎㅎ 가격도 저렴해서리... 이곳을 지나시는 분들께 강추 드립니다. 좌표는 아래와 같습니다. 아직은 아침저녁으로는 기온이 낮고, 낮에... ",喜劇처럼 사는 CHAPIG'S FAMILY,https://blog.naver.com/chapig1029,2020-04-10
(하루방 만두 .불티나만두 . 윤가네 만두 . 인동왕 만두 .),https://blog.naver.com/jygon?Redirect=Log&logNo=222466684591,전반적으로만두 소의 간은 쎈편으로 간장을 안찍어도 충분한 간입니다..^^ ☆중리시장불티나만두 ☆(고기. 김치.찐빵 . 고로케.) 업장 위치 정보 확인하시구요~! 주차는 공영주차장 이용하셔요..ㅎ 간판 사진이... ,나의 식도락 일기,https://blog.naver.com/jygon,2021-08-12
맛집] 맛은 최고 가격은 최저 중리시장불티나 만두찐빵 ,https://blog.naver.com/mega85?Redirect=Log&logNo=221354223001,오늘은 중리시장 맛집불티나 만두 · 찐빵 입니다. 사실 중리시장은 집에서 멀어서 잘 못가는 곳인데 장모님께서 근처 가셨다가 서프라이즈로 사오셨네요 ^^ 그럼 지금부터 중리시장 맛집불티나 만두 · 찐빵 ... ,Melancholy's Story,https://blog.naver.com/mega85,2018-09-07
[대전맛집]불티나만두찐빵 (대덕구.중리동.중리시장),https://blog.daum.net/chulinbone/4553,"1000원 , 7개 , 대덕구 , 대전맛집 , 만두 ,불티나만두찐빵, 중리동 , 중리시장 , 중리전통시장 20150411 대전 중리동 중리전통시장에 있는 만두집입니다. 이곳에서 유명한 만두가 있는데, 7개... ",철인뼈다귀의 지구별여행기,https://blog.daum.net/chulinbone,2015-04-11
경기도용인만두맛있는집불티나 만두 왕 찐빵 ,https://blog.naver.com/tjjh0115?Redirect=Log&logNo=220988393195,안녕하세요 오늘은 경기도 용인 신갈동에 위치한만두 . 찐빵맛있는 집이있어서 소개시켜드릴게요 금액은 나름 저렴한편인거같아요ㅋㅋㅋ 이른아침 시간에도 직접수제로만두 를 만드시네요 새우 만두 는... ,아리동동네,https://blog.naver.com/tjjh0115,2017-04-21
대전 찐빵 팔복통닭불티나만두찐빵 집 은둔식당 픽플러스... ,https://blueplastic.tistory.com/4443,춘천 만두 달인 춘천 왕만두 춘천시사우로38 새총 달인 업체명 :대원소파 경기도 가평군 청평면... 대전 찐빵 달인불티나만두찐빵대덕구중리로76번길18 주차달인 픽플러스 본사 경기 고양시 일산동구... ,Modern Story,https://blueplastic.tistory.com/,2020-09-21
생활의달인 대전 찐빵 부산... 팔복통닭불티나만두찐빵맛집... ,https://teamaya.tistory.com/3029,달인 찐빵집 -불티나만두찐빵주소 - 대전 대덕구 중리로76번길18 주차 달인 주차달인 업체명... 춘천만두 #생활의달인 은둔식달 #생활의달인 춘천만두달인 반응형 좋아요 공감 공유하기 글 요소 구독하기... ,작업실,https://teamaya.tistory.com/,2020-09-21
밀양 ' 불티나 만두찐빵 ' 매운 갈비 만두 출시,https://blog.naver.com/bultina-dumpling?Redirect=Log&logNo=222062926505,#밀양 # 만두# 불티나만두# 불티나# 찐빵#매운갈비 #갈비 만두#매운갈비 만두#경상남도 # 만두 맛집 # 찐빵 맛집 #수제 만두#수제 찐빵# 만두 가게 # 찐빵 가게 #밀양맛집,밀양 '불티나만두찐빵',https://blog.naver.com/bultina-dumpling,2020-08-17
대전맛집 중리동불티나만두찐빵 ,https://blog.naver.com/sinsojae8393?Redirect=Log&logNo=220971173054,# 불티나만두찐빵#중리시장통 #고로케ᆞ만두 1000~2000₩ 지역 인터넷신문 맛집기사 보자마자 들렸습니다.. 아주아주 저렴한 가격에 맛도 좋다는... 손님 엄청 많습니다... 사진 좀 찍으려 했는데 음식이 동이... ,혜라 이야기,https://blog.naver.com/sinsojae8393,2017-03-30
생활의 달인 대전 찐빵달인 중리시장불티나만두찐빵부산 치킨... ,https://blog.naver.com/hhwjh?Redirect=Log&logNo=222095666293,"대전 중리시장불티나만두찐빵042-623-6271 대전 대덕구 중리로76번길 18지번중리동 372-2 매일 07:00 - 21:00일요일 휴무 만두 2,000 10개 찐빵 1,000 3개 왕만두 2,000 3개 #생활의달인 #부산치킨닭두루치기... ",잭앤콩나무,https://blog.naver.com/hhwjh,2020-09-21
생활의달인 대전 찐빵 왕만두... 대덕구불티나만두찐빵9월... ,https://comcomin.tistory.com/12577,"[불티나만두찐빵] 전화번호 042-623-6271 대전 대덕구 중리동 372-2 영업시간 07:00 ~ 21:00 일요일휴무 가격 메뉴 정보 만두 10개 2,000원 왕만두 3개 2,000원 찐빵 3개 1,000원 카레고로케 3개 2,000원... ",★■ 일루와 ■★,https://comcomin.tistory.com/,2020-09-21
대전찐빵달인 최경환 신순희... 중리시장불티나만두찐빵 ... ,https://mylovegae.tistory.com/11368,15:42 정보: 생활의 달인 대전찐빵달인 최경환 신순희 은둔식달 이용정보 매일 07:00~21:00 일요일 휴무 가격정보 만두 10개 2000원 찐빵 3개 1000원 상호:불티나만두찐빵위치: 대전 대덕구... ,●내가 누구개●,https://mylovegae.tistory.com/,2020-09-21
향남 2지구불티나왕 만두 · 찐빵오산에서 상륙!!,https://blog.naver.com/2010456?Redirect=Log&logNo=221566016166,'맛'착한 '가격'착한 '사장님'최고이신불티나왕 만두찐빵 !! 지나가다 꼭 드셔보시면 다시 찾게 될 맛! 꼭 방문해서 드셔보시기 바라요~^^ 향남2지구에서 상가를 찾으신다면!! ***-****-**** 연락주세요!! 대박 자리... ,향남원룸_방구대장의 방구하는 이야기_강남부동산,https://blog.naver.com/2010456,2019-06-19
