title,link,description,bloggername,bloggerlink,postdate
충무로 맛집 -사랑방 칼국수 ,https://blog.naver.com/herohwangsae?Redirect=Log&logNo=221598792170,충무로의 맛집으로 유명한사랑방 칼국수 . 외관에서 세월의 흔적과 맛집의 향기가 강하게 난다. 2층도... 칼국수집이지만 베스트 메뉴는 백숙백반이다. 백숙백반 2인을 주문하면 한마리가 나온다. 그리고 국물도.... ,무적황새의 세계여행기록,https://blog.naver.com/herohwangsae,2019-07-29
[ 사랑방칼국수 ] 50년 전통을 자랑하는 충무로 칼국수 집,https://blog.naver.com/jinyoon96?Redirect=Log&logNo=222528773343,:) # 사랑방칼국수#충무로맛집 #충무로한식 #충무로칼국수 #충무로 사랑방칼국수#동대입구맛집 #동대입구칼국수 #충무로한식맛집 #동국대맛집 #동국대칼국수 #충무로역맛집 #충무로역한식 #충무로역칼국수... ,Go With Eat!,https://blog.naver.com/jinyoon96,2021-10-06
서울 충무로사랑방칼국수 ,https://blog.naver.com/cmykhc?Redirect=Log&logNo=20110319828,충무로에 위치한 칼국수집사랑방 칼국수충무 칼국수와 함께 충무로를 대표하는 칼국수집으로 40년의 역사를 자랑하는 유서깊은 곳입니다.. 가게에 들어서면 마주할 수 있는 낡은 테이블과 의자는 그 세월의... ,나의 식유기,https://blog.naver.com/cmykhc,2010-07-26
칼국수가 땡기는 날에는 충무로 ' 사랑방칼국수 ',https://blog.naver.com/verygo2d?Redirect=Log&logNo=70073223058,우중충한 날씨에 아침부터 칼국수가 먹고 싶어 충무로사랑방칼국수 로 향했습니다. 처음사랑방칼국수다닌게 벌써 8년전이네요 제가 S정보통신에 다닐때부터 다녔으니깐...^^ 참 변한거 없어요. 정말 연세가... ,베리굿라이프,https://blog.naver.com/verygo2d,2009-11-07
충무로 맛집 | 50여년 전통의 닭백숙백반 @사랑방 칼국수 ,https://blog.naver.com/yesican1?Redirect=Log&logNo=221038953533,"한번에 두 가지를 다 동시에 먹을 수 없으니 한번은 칼국수를, 다음 번 방문에서는 백숙백반을 드셔보면 어떠하실지...^^ #쭌의맛집 #맛집추천 #충무로맛집 # 사랑방칼국수#닭곰탕 #백반 #닭백숙 #칼국수... ",쭌의맛집 since 2003,https://blog.naver.com/yesican1,2017-06-27
충무로 맛집 -사랑방 칼국수 ,https://blog.naver.com/clala70?Redirect=Log&logNo=104342312,소스에 찍어서 ~ 먹고 ~ 중간중간 칼국수 먹어주고 ~ 실망하지 않은 점심이었어요사랑방칼국수투박하고 소박한 맛이지만... 향수를 불러 일으키는 맛입니다. 냄비 칼국수도 백숙백반도 오랫동안 많은 분들... ,클라라의 즐거운 맛집,https://blog.naver.com/clala70,2010-04-24
충무로사랑방칼국수 ,https://blog.naver.com/khgs1206?Redirect=Log&logNo=10184719966,"8,000원사랑방칼국수02)2272-2020 서울시 중구 충무로3가 23-1 계란넣은 칼국수 (6,200) 칼국수와 궁합이... 시골 사랑방에 와 있는 기분이었다. 주변 식당 아주머니들끼리 서로 마실도 다니시고음식도 나눠 드시는... ",고센에서 광야로,https://blog.naver.com/khgs1206,2014-01-31
"[서울 충무로맛집]사랑방칼국수, 역시 명불하전.. 최고... ",https://blog.naver.com/jazz588?Redirect=Log&logNo=222159270704,"한마디로 고퀄리티의 입맛도 아니고 블로그포스팅은 맛집일기같은 개인취미생활이오니 그냥 참고만..ㅋ 충무로맛집,수요미식회맛집,닭백숙맛집,닭칼국수맛집, 사랑방칼국수항상웃는재즈",항상웃는재즈,https://blog.naver.com/jazz588,2020-12-01
"수요미식회 맛집, 을지로 충무로 노포 맛집사랑방칼국수 ... ",https://blog.naver.com/kimsibonara?Redirect=Log&logNo=222530578652,굿모닝^^ job영웅입니다 오늘은 너무 맛있었던 을지로 충무로 찐맛집사랑방칼국수리뷰를 올려볼까... 일단 칼국수 1인분 ㄱㄱ 합니다~ 물론 또한 다먹었지만^^ 을지로 충무로 가시면 꼭 가보세요~~ 강추강추,job영웅 blog,https://blog.naver.com/kimsibonara,2021-10-08
 사랑방 칼국수: 충무로 맛집,https://blog.naver.com/apjjang31?Redirect=Log&logNo=70141595768,구수한 옛날 칼국수 한 그릇으로 모든게 용서되는 집인 것 같습니다. 맛있는 칼국수 드시러 언제 한번 방문해보시길.. ^^ 손가락을 가볍게 클릭 해주는 센스~^^사랑방칼국수tel. 02-2272-2020 서울 중구 충무로3가 23-1,Dine With SangJung,https://blog.naver.com/apjjang31,2012-07-04
부천칼국수-사랑방손 칼국수부천점 후기,https://blog.naver.com/blueminha?Redirect=Log&logNo=222332910967,부천 칼국수사랑방 손 칼국수 부천점 골목에 있어서 주차하기는 어렵네요. 메뉴는 간단합니다. 손 칼국수5천원 수제비 6천원 팥 칼국수7천원 들깨 칼국수6천원 카드기가 없다고 써져있어서 현금으로 드리긴... ,세상을 따뜻하게 바라보다,https://blog.naver.com/blueminha,2021-05-05
충무로 맛집 / 47년 전통 백숙백반사랑방칼국수 ,https://blog.naver.com/phjsunflower?Redirect=Log&logNo=10185750873,오랜세월 한곳에서 오랫동안 사랑받고 있는 충무로사랑방 칼국수 . 백숙과 칼국수의 조화가 참으로 궁금해서 찾아가본다. 안녕하세요 꽃씨에요. 요즘 보기 힘든 건물의 모양. 타일로 한땀한땀 붙여놓은것이 나... ,꽃씨의 맛집 이야기♬,https://blog.naver.com/phjsunflower,2014-04-18
약수역 맛집사랑방칼국수바지락칼국수 맛집,https://blog.naver.com/dhskafl2093?Redirect=Log&logNo=220552033902,기회가 될때 동네 맛집은 다 가보려구요 ^^ 이번에는 얼어붙은 몸을 단번에 녹여줄 약수역 맛집사랑방칼국수 랍니다 메뉴는 요렇게 가격은 거의다 6천원이에요 저희는 바지락칼국수 2인분하고 왕만두 하나를... ,엄마의놀이터,https://blog.naver.com/dhskafl2093,2015-11-28
[충무로]사랑방칼국수 ,https://blog.naver.com/lshsps?Redirect=Log&logNo=220038231083, 사랑방칼국수칼국수와 닭백숙을 맛있게 하는 오래된 노포다. 이름답게 정겨운 공간과 구수한 보리차가 반긴다. 3인이서 우선 닭백숙 한마리 (16000원) 먹음직스러운 김치도 듬뿍 쌈장 독특한 양념장.... ,희동이의 블로그,https://blog.naver.com/lshsps,2014-06-23
 사랑방칼국수- [충무로] 칼국수 맛집에서 빠지지 않는.. 충무로... ,https://blog.naver.com/hjjhlee?Redirect=Log&logNo=221967499481, 사랑방칼국수칼국수 맛집을 논할때.. 절대 빠지지 않는곳이자 유명 매스컴을 섭렵한.. 수요미식회.. 백반기행.. 식신로드등 왠만한 곳은 다 거쳐간.. 지난번 방문기를 올리는 이유는 나중에.. Since 1968이니..... ,Smurfworld,https://blog.naver.com/hjjhlee,2020-05-18
"백숙백반 8,000원사랑방칼국수핵추천~ ୧༼ ͡◉ل͜... ",https://blog.naver.com/dnekal92?Redirect=Log&logNo=222122356799,존맛포스가 좔좔 ㅋㅋㅋㅋㅋㅋㅋ 이 을지로 충무로 일대에서 맛집일 수 밖에 없는 그런 집임! 을지로3가역 맛집 / 충무로 맛집사랑방칼국수영원하라! # 사랑방칼국수#백숙백반 #을지로3가역맛집 #충무로맛집,쏟아놓기,https://blog.naver.com/dnekal92,2020-10-21
[ 사랑방칼국수 ] 충무로맛집 - 닭백숙과 칼국수.,https://blog.naver.com/nomark05?Redirect=Log&logNo=126921072,"평래옥 포스팅한 김에, 이왕 닭이 나온 김에 인근의사랑방 칼국수 도 올립니다. 아무런 정보도 없이... 곱배기나 계란 추가시 원래 칼국수 메뉴에서 딱 200원씩만 추가. 곱배기와 보통 가격에 차이가 없던 영빈루... ",라보사의 식도락,https://blog.naver.com/nomark05,2011-04-26
[ 사랑방칼국수 ] 충무로역 백숙백반 칼국수 맛집,https://blog.naver.com/hcuteh?Redirect=Log&logNo=222523030620," 사랑방칼국수주소 서울 중구 퇴계로27길 46 충무로3가 23-1 영업시간 평일 10:30 - 21:40 재료소진시... 계란넣은 칼국수 6,200원 계란추가 200원 진하고 칼칼한 칼국수 저렴하게 닭백숙과 칼국수 맛있게... ",앙나의 일기♥,https://blog.naver.com/hcuteh,2021-10-01
(충무로)사랑방칼국수/ 풋내 가득한 기억의 주말의 명화같은 맛,https://blog.naver.com/inho3412?Redirect=Log&logNo=50153528239,대신 과거의 아련한 향수 정도는 얻을수 있겠지만. 주말의명화 한편과도 같았던사랑방칼국수 에서의 칼국수 한그릇이다.사랑방칼국수Tel 02 2272 2020 중구 충무로 3가 23-1,그랬지의 잠꼬대,https://blog.naver.com/inho3412,2012-11-02
[중구] 영화 식객의 그곳사랑방 칼국수 ,https://blog.naver.com/culinaryarts?Redirect=Log&logNo=100091377789,양념장 칼국수와 백숙 백반이 동시에 제공됩니다. 적당히 익은 배추김치 먹기 좋게 잘 뜯어 놓은 닭고기 중구 쌍용 본사 뒷편에 위치한사랑방 칼국수 는 잠시 아날로그 분위기를 느끼기에 충분한 곳이다.... ,뉴욕 요리사,https://blog.naver.com/culinaryarts,2009-10-19
충무로사랑방칼국수- 백숙백반,https://blog.naver.com/jandimori?Redirect=Log&logNo=221566833218,"충무로 세기 PC를 며칠째 들르면서 늘 지나게 되는 # 사랑방칼국수앞은 늘 줄이 길었다. 그게... 아, #칼국수 도 시켰는데 사진을 안 찍었다. 칼국수 맛도 별미다. 다 먹고 나올 때쯤 주방에서 들리는 얘기로는... ",까칠한 망고씨,https://blog.naver.com/jandimori,2019-06-20
"가성비 갑, 혼밥가능 / 백숙백반이 너무 맛있는사랑방칼국수 ",https://blog.naver.com/conzy0224?Redirect=Log&logNo=222529111611,"ㅎㅎㅎ 오늘도 맛있는 식당, 맛있는 음식 공유했다! 우리~~~ 맛있는 음식먹고 행복하자!! #충무로맛집 #을지로맛집 # 사랑방칼국수#명동맛집 #칼국수맛집 #백숙맛집",아무거나 끄적거리는 SSUN's diary,https://blog.naver.com/conzy0224,2021-10-06
" 사랑방칼국수(퇴계로) / 내용있는 음식, 실속있는 식사 '백... ",http://ryunan9903.egloos.com/4427982,그 곳에서 꽤 유명한 닭집이 있다는 이야기를 들어 지인의 추천으로 가 보게 된 ' 사랑방칼국수 ' 라는 가게입니다. 이 가게는 일단 칼국수 전문점이기는 하지만 '백숙백반' 이라는 식사 메뉴가 상당히... ,류토피아 (RYUTOPIA),http://ryunan9903.egloos.com/,2018-12-28
충무로사랑방칼국수 ,https://blog.naver.com/sunga114?Redirect=Log&logNo=220014786801,"충무로에 위치한 백숙 및 칼국수 전문점 '사랑방칼국수' 제법 오랫동안 자리를 지키는 노포에 속하는 곳인데, 최근에 방송을 탔던 일이 있어 손님들이 끊이질 않았었다. 직전 방문 때, 식사시간이... ",쏘오 딜리셔스,https://blog.naver.com/sunga114,2014-05-30
[ 충무로 ]사랑방 칼국수 ,https://blog.naver.com/guity87?Redirect=Log&logNo=220178275624,같지만사랑방 칼국수주인아주머니는 친절하시다. 그래서 더 조아~ 범상치 않은 옛스러움을 풍기는... 나중에는 퍽퍽한 살만 남아 목 막힐때쯤 칼국수 한그릇만 주문했다. 여기까지와서 칼국수를 안먹고 가면... ,황고메의 상경기,https://blog.naver.com/guity87,2014-11-11
충무로사랑방칼국수 ,https://blog.naver.com/zlatns?Redirect=Log&logNo=220820723687, 사랑방칼국수근처 가게들이 다 문을 닫은 일요일에도 성업중인 이곳! 세월의 흔적이 느껴지는 내부 50년 전통이라니! 식객에도 나오고 수요미식회의 칼국수편에도 나왔다고 한다! 글쿤글쿤! 우린 백숙한마리(16... ,보통의 소중한 날들,https://blog.naver.com/zlatns,2016-09-25
충무로사랑방칼국수: 백숙 한 상 먹고 힘냅시다!,https://hawaiiancouple.com/1286, 사랑방칼국수02-2272-2020 서울 중구 퇴계로27길 46 (충무로3가 23-1) 매일 09:00 - 22:00 / 일요일 09:00 - 16:00... 칼국수 메뉴도 네 종류 있는데 닭 육수를 베이스로 한 담백한 맛이다. 면식을 꼭 해야할 것이 아니라면... ,hawaiian couple,https://hawaiiancouple.com/,2018-03-21
[중구/충무로] 충무로맛집 영화식객에 나왔던사랑방칼국수 ,https://blog.naver.com/buppy01?Redirect=Log&logNo=130117124449, 사랑방칼국수 집은 칼국수와 백숙백반이 맛있다고 했는데 칼국수를 간판으로 내건 집이니 칼국수를 선택했어요 왠지 포스가 느껴지는 메뉴;;; 아주머니 칼국수 하시며 계속 밥을 큰 밥솥에 하시고 또 담아내고... ,낭고씨의 호식탐탐,https://blog.naver.com/buppy01,2011-08-29
충무로 맛집 ' 사랑방 칼국수 ',https://blog.naver.com/younbs91?Redirect=Log&logNo=222338219621,충무로맛집 사랑방에 가보시길 추천해요. 전 개인적으로 물에 빠진 닭을 좋아해서 아주 맛있게 먹고... 두공기에 칼국수까지 부시고 배 터지게 먹고 나온 충무로맛집 진짜 인정사랑방칼국수재방문 의사는 100000... ,귀염뽀짝 블로거의 블로그,https://blog.naver.com/younbs91,2021-05-05
[충무로맛집]사랑방칼국수 ,https://blog.naver.com/sul1104?Redirect=Log&logNo=221371047401,"오늘 소개할 맛집멋집은 충무로에 있는사랑방칼국수임미다 위치참고하시고요 외관은 이러해요 무슨... 들어가자마자 보이던 현수막 ㅋㅋㅋㅋ 칼국수 종류도 다양하네요 ,, 사랑스러워라 - 백숙백반 하나랑... ",✩⃛셀이의✧행복충전소━━━━━☆ﾟ.*･｡,https://blog.naver.com/sul1104,2018-10-04
 사랑방칼국수: 술맛 당시는 백숙과 옛 시장스타일의 칼국수맛... ,https://blog.naver.com/jgcafe_blog?Redirect=Log&logNo=220265242131,"충무로의 맛집사랑방칼국수백숙, 칼국수에 소주나 막걸리 먹기 좋은 가게 박군이 워낙 좋아하는 곳인데 이 가게를 데리고가서 싫어하는 사람을 본적이 없다 혼자오는 사람들을 위한 백반도 마음에 듬... ",WHALE GOON - 고래박군의 BLOG (구 JGCAFE Blog),https://blog.naver.com/jgcafe_blog,2015-02-06
[을지로사랑방/충무로사랑방]... (백숙백반:백반맛집) 사랑방칼국수 ,https://blog.naver.com/alsl2067519?Redirect=Log&logNo=222008581379,"충무로 사랑방칼국수 집- 충무로사랑밥은 백숙백반집으로 유명해요. 백 숙 백 반~ 충무로사랑방... 충무로 사랑방칼국수저희는 칼국수 말고, 백숙백반 2인분을 주문했어요. 1인분은 닭 반마리가 나오고 2인분은 닭... ",설탕 쫌 다루는 여자,https://blog.naver.com/alsl2067519,2020-06-22
"[충무로] 노포사랑방 칼국수 , 닭 맛집 베스트 껴주기로 (1보)",https://blog.naver.com/sober_555?Redirect=Log&logNo=222078393390,"노 충무로사랑방 칼국수1968년, 한반도에는 많은 긴장이 감돌던 해였습니다. 와중에 서방권은 68혁명의... 여기에 칼국수 끓이면 왜 맛있는지 알겠다 하는 느낌이지만, 이곳의 하이라이트는 따로 있습니다.... ",어떻게든 되겠지,https://blog.naver.com/sober_555,2020-09-02
을지로 맛집 백숙백반사랑방 칼국수 ,https://blog.naver.com/milk6136?Redirect=Log&logNo=222519651401,"있는사랑방 칼국수식신로드, 수요미식회, 허영만의 백반기행, 맛있는 녀석들 안나온 곳이 없는,, 눅이언니도 방문한 곳 ^_^ㅋㅋㅋㅋ 메뉴판 칼국수1 백수백반1 이런식으로도 많이 시키더라구요? 저희는... ",내 일기장,https://blog.naver.com/milk6136,2021-09-28
[을지로] 오래도록 사랑받는 맛집 # 사랑방칼국수#반숙백반,https://blog.naver.com/yeramg?Redirect=Log&logNo=222521722380," 사랑방칼국수영업정보 매일 09:00 - 22:00 일요일 10:30 - 16:00 주차정보 근처 유료주차장 이용 주말 도로주차 무료 외관부터 포스가 느껴지는 #을지로 사랑방칼국수칼국수도 엄청 유명하긴한데,, 갑자기 칼국수... ",a lively breeze,https://blog.naver.com/yeramg,2021-09-30
"인천검단맛집,사랑방 손 칼국수시원한 국물이 다름다름 ♬",https://blog.naver.com/dnd_0505?Redirect=Log&logNo=220764899785,"네비게이션에 사랑방 손칼국수를 검색하거나, 원당대로 480번길로 검색하면 금방 찾을 수 있는 사랑방 손칼국수. 네이버에사랑방 칼국수 만 검색해도 나오니, 뭐 찾는건 식은죽먹기나 다름없쥬 인천검단맛집... ",Lovely dada ♥,https://blog.naver.com/dnd_0505,2016-07-18
을지로 충무로 노포식당 백숙 맛집사랑방칼국수솔직 후기,https://blog.naver.com/fkakansel?Redirect=Log&logNo=222533869318,하나 아쉬운 건 칼국수 사리를 추가할 수 없다는 것. 여기서 우리는 ' 사랑방칼국수 '의 근본을 볼 수 있다. 여러분 뭔 줄 아시겠나? 바로 이 숟가락 심지어 이 숟가락은 내가 초등학교 때부터 지금까지 우리... ,옆에꽁치 블로그,https://blog.naver.com/fkakansel,2021-10-11
충무로 찐맛집. 수요미식회/맛있는녀석들이 인정한사랑방칼국수 ,https://blog.naver.com/suyeun2134?Redirect=Log&logNo=222480392784,"충무로 맛집인사랑방칼국수 는 원래 칼국수 집으로 시작했는데 현재는 백숙백반으로 더 유명한 식당입니다. 서울에서 백숙백반을 8,000원에 먹을 수 있다니 가성비 최고의 맛집이에요 ❤ 칼국수도 6000원으로... ",수블로그,https://blog.naver.com/suyeun2134,2021-08-23
(충무로 맛집) 영화 식객의 엔딩신을 장식한사랑방칼국수 ,https://blog.naver.com/sagak815?Redirect=Log&logNo=80145044413,멸치칼국수를 참 좋아하고 이 블로그에서도 여러 유명한 칼국수집을 소개해왔다... 근데사랑방칼국수 를 아직 포스팅하지 않았다는 사실에 깜짝 놀라기도 했고 쌀쌀한 날씨에 칼국수 생각도 나서 오랜만에... ,사각사마는 뭘 먹고 사나,https://blog.naver.com/sagak815,2011-11-30
"[충무로]사랑방칼국수: 백숙백반,닭칼국수, 충무로맛집... ",https://blog.naver.com/durnfl2?Redirect=Log&logNo=222050024047,"안녕하세요 핸섬피아노 입니다사 랑 방 칼 국 수백숙백반으로 유명한 칼국수 맛집 2만원이 안되는 가격으로 백숙을 먹어보자! 칼국수집인데 칼국수보다 더 유명한 다른 메뉴가 있다 바로, 백숙백반!!... ",나만의 시선으로 본 세상,https://blog.naver.com/durnfl2,2020-08-04
명동 맛집] 백숙백반 안먹으면 후회하는 백숙맛집 ' 사랑방칼국수 ',https://blog.naver.com/wus0123?Redirect=Log&logNo=222003657368,"바로바로 ' 사랑방칼국수 '라는 곳입니다! 충무로에 있는 곳인데요! 핫플 알리미 친구가 자신있게 여기는... 4개인데요, 칼국수, 닭곰탕, 백숙백반, 통닭백숙! 그 중에서도 제 결정권 없이 그냥 백숙백반 2인분을... ",동그라미 diary,https://blog.naver.com/wus0123,2020-06-17
감성 제대로 느낄수있는 닭백숙.백숙백반 맛집 [ 사랑방칼국수 ],https://blog.naver.com/hanori0228?Redirect=Log&logNo=222529662553,예전부터 너무나도 가보고 싶었던 을지로사랑방칼국수드디어 다녀왔답니다외관만 봐도 얼마나... 밥 한공기가 양이 조금 적다는거..? 그거말고는 내 입맛에 딱다음에 가면 칼국수로 먹어야지 히히,꿀늘,https://blog.naver.com/hanori0228,2021-10-07
충무로사랑방칼국수 ,https://blog.naver.com/sunga114?Redirect=Log&logNo=150169306396,"충무로에 위치한 칼국수 전문점 '사랑방칼국수' 꽤 허름한 노포인데, 개인적으로 참 맛있게 먹는 집이다. 칼국수 전문점이지만, 닭백숙과 백숙 백반도 취급한다. 깔리는 기본찬들 칼국수와 정말 잘 어울리는... ",쏘오 딜리셔스,https://blog.naver.com/sunga114,2013-06-06
[충무로]사랑방칼국수: 백숙백반과 계란 동동 칼국수,https://blog.naver.com/djkim74?Redirect=Log&logNo=222177469137,백숙백반을 주문하면 원래 공기밥이 딸려 나오긴 하지만 충무로사랑방칼국수인기 메뉴 중 하나인 칼국수 맛을 안볼 수 없지요. 200원 추가해서 무조건 계란 칼국수로 주문합니다. 특별할 거 없어 보이지만... ,Ray' story,https://blog.naver.com/djkim74,2020-12-18
충무로 /사랑방칼국수 ,https://blog.naver.com/begopa1092?Redirect=Log&logNo=220344828393,"아침 닭육수로 낸 칼국수, 양지로 낸 칼국수 포스팅에 이어 이번엔 멸치육수로 낸 칼국수 식당 충무로 반도카메라에 가면 식사는 주로 이곳사랑방 칼국수아니면 황소집 또는 가끔 황평집에서... ",eye of the beholder,https://blog.naver.com/begopa1092,2015-04-29
부천역사랑방 손 칼국수베스킨라빈스,https://blog.naver.com/kiti5447?Redirect=Log&logNo=221450186138,"집근처에 있는사랑방칼국수 집이라는데.. 왠일로 매장 사진도 몇장 찍어왔네요.ㅎㅎ 요쪽은 주방 및... 손칼국수 가격 5,000원(1인분) 이렇게 포장해서 오면 가격이 1,000이 추가 된다는데요. 추가된 만큼 포장은... ",류짱의 맛집 이야기,https://blog.naver.com/kiti5447,2019-01-24
서울맛집식객 촬영지로 유명한 서울 충무로 맛집사랑방 칼국수 ,https://blog.naver.com/stormjsw?Redirect=Log&logNo=221717414534,백숙맛집사랑방 칼국수 에 대한 포스팅이에요 그럼 어여 Gogogo--- 항상 눈팅만 하던 곳이었는데 정말... 맛있었던 서울 충무로맛집사랑방 칼국수방문기였어요 그럼 이상으로 요섹남 정쎄니였어요 또 만나요 See you,맛과 멋을 즐기는 남자~,https://blog.naver.com/stormjsw,2019-11-25
서울 중구 충무로 을지로3가역사랑방 칼국수since 1968... ,https://blog.naver.com/ohhew?Redirect=Log&logNo=222036368851,끝났지만 어쨌든 지금이라도 해봄^^**여름이고 아직 중복 말복 남았응께 점심 먹으러사랑방 칼국수 로... 먹다가 계란 칼국수도 하나 추가함. 이모가 계란 넣는거 까먹으셨는지 뒤늦게 계란 넣어주심. 뜨거워서... ,B-login,https://blog.naver.com/ohhew,2020-07-20
을지로사랑방칼국수백숙백반 단돈8천원 감동적,https://blog.naver.com/orangesirena?Redirect=Log&logNo=222507523491,파를 조그만 접시에 담아서 초장?같은 소스 넣고 닭 찍어 먹는 소스 만들어 먹으라고 알려주셔가지고 저는 그거 만들었는데 닭 자체가 맛있어서 김치랑 먹느라고 바빴어요 ㅋㅋㅋ사랑방칼국수칼국수도 꼭... ,❣️레나의 보물상자❣️,https://blog.naver.com/orangesirena,2021-09-16
서울 중구- 사랑방 칼국수 ,https://blog.naver.com/wkddbswp5?Redirect=Log&logNo=222259561180,그리고 할머니의 추천으로 주문한 닭 칼국수 . 전부 정식으로 할까 닭칼하나 섞을까 하는 대화하고 있는데 현명한 할머니가 정식도 각각먹고 닭 칼국수 도 하나시켜서 나눠먹으라고 하셨다. 다들 그렇게 먹는다고... ,모순덩어리의 블로그,https://blog.naver.com/wkddbswp5,2021-02-28
충무로사랑방칼국수 ,https://blog.naver.com/shrr924?Redirect=Log&logNo=220403519738,칼국수! 고춧가루 때문에 그런가 칼칼한데 시원해서 미친 듯이 흡입함 ㅋㅋ 다들 먹는 동안 맛있어 대애박 만 반복 ㅋㅋㅋ 요즘 같이 더워지고 있을 때 한 끼 먹으면 딱 좋은 듯 하다.사랑방칼국수 ... ,"내 블로그, 自由",https://blog.naver.com/shrr924,2015-06-27
충무로사랑방칼국수50년 역사의 칼국수와 수요미식회... ,https://blog.naver.com/kh750?Redirect=Log&logNo=221763433481,충무로사랑방칼국수 의 칼국수 충무로사랑방칼국수 의 시그니처 메뉴인 칼국수입니다 요즘은 이런... 상호는사랑방칼국수 인데 마치 사랑방 백숙백반집 같은 느낌도 들었답니다 초고추장 비슷한 소스에... ,커피사랑 경화의 소소하고 맛깔난 이야기들,https://blog.naver.com/kh750,2020-01-08
을지로3가 노포사랑방칼국수 ,https://blog.naver.com/thomas_train?Redirect=Log&logNo=221400184274,"오늘 간 곳은 을지로3가 오래된 맛집사랑방 칼국수 다. 노포들을 몇군데 돌아다니면서 난 이런(오래... 얼핏 보면 다 같은 칼국수같지만 깨알같이 다른 메뉴이다.ㅋㅋ 200원, 400원 차이인 게 귀여움. 방송에도... ",뉴키즈온더블로그,https://blog.naver.com/thomas_train,2018-11-17
"[중구 충무로 3가]사랑방칼국수 , 백숙백반과 칼국수 그리고... ",https://blog.naver.com/zzangkka2?Redirect=Log&logNo=221906306084,"충무로에 진짜 좋아하는 음식점이 많지만, 칼국수하면 또 이 집이다. ' 사랑방칼국수 ' 음식점 간판이 상당히 괴랄하다. 보통 가게이름과 주력메뉴 정도를 눈에 띄게 디자인하는게 일반적인데, 상당한 양의... ",Requiem For A Dream,https://blog.naver.com/zzangkka2,2020-04-14
충무로 디저트 카페 원형들/ 사랑방칼국수 ,https://blog.naver.com/zzong1114?Redirect=Log&logNo=222517362459,원형들 카페 근처에 맛집 검색하다가 가본 # 사랑방칼국수칼국수 먹으려고 했는데 칼국수가 소진 됐다하셔서 백숙백반 주문함 밥이랑 백숙이랑 건더기없는 닭곰탕 같은 육수를 주시는데 배불러서 얼마나 먹겠나... ,파워블로거 되고싶어요,https://blog.naver.com/zzong1114,2021-09-26
