title,link,description,bloggername,bloggerlink,postdate
[명동 맛집] 명동사랑방칼국수다녀왔어요.,https://blog.naver.com/suncarpet?Redirect=Log&logNo=222145120317,주 메뉴는 #닭칼국수 #백숙 이에요!사랑방칼국수 의 메뉴에요! 저희는 맛좋은칼국수(닭칼국수)와 백숙백반 1인분을 주문했어요. 먼저 나온 닭칼국수 입니다. 양이 적당하고 맛이.. 어후 지금까지 먹어본... ,suncarpet,https://blog.naver.com/suncarpet,2020-11-15
[서울 충무로]사랑방 칼국수 (백숙백반),https://blog.naver.com/tjdwnsqus?Redirect=Log&logNo=222493161202,오늘 리뷰할 집은사랑방 칼국수 입니다. 위치는 충무로역과 을지로3가역 사이에 있습니다. 이집의 타이틀은 칼국수지만 가장 유명한 메뉴는 백숙백반입니다. 예전에 맛있는 녀석들이 왔다간 스티커가 붙어... ,온갖 잡동사니 보관소,https://blog.naver.com/tjdwnsqus,2021-09-02
충정로사랑방 칼국수 ,https://blog.naver.com/tasha81?Redirect=Log&logNo=221725937519,충정로사랑방 칼국수여기가 아직도 있구나 : ) 오래전에 왔었는데 그땐 주문한 음식 너무 오래 걸리고... ㅎㅎ 칼국수 면을 닭볶음탕 국물에 살짝 비벼서 먹어도 맛있었어요 떡볶이도 들어있고 오늘은 칼... ,항상 떠나고픈 임소녀,https://blog.naver.com/tasha81,2019-12-03
일상기록:: #지정환임실치즈피자 #헤르만의정원 # 사랑방칼국수 ... ,https://blog.naver.com/wlgusrjt0327?Redirect=Log&logNo=222267698666, 사랑방칼국수저의 오래된 단골집이자 최애 칼국수집. 청와대 옆에 위치한사랑방칼국수 에요. 어려서부터 먹고 자라서 그런지 다른집 칼국수보다 여기가 제일 맛있어요!! 날씨도 좋고~ 평일이였는데 여유있게... ,꼬미정의 소소한 일상,https://blog.naver.com/wlgusrjt0327,2021-03-08
[충무로맛집]사랑방칼국수(feat. 백숙백반),https://blog.naver.com/lkh84?Redirect=Log&logNo=222320082293,"백숙백반/칼국수 이젠 나만 알던 맛집에서 다들 아는 맛집으로 바뀐사랑방칼국수물론 그 전에도 유명하긴 했지만, 맛있는 녀석들-백반기행 등등의 프로그램에 소개되면서 모두가 아는 맛집으로... ",두근두근 콩닥작가,https://blog.naver.com/lkh84,2021-04-23
"나의 9월은, 충무로사랑방 칼국수 , 을지로 섬광과 원형들, 여밈... ",https://blog.naver.com/ghdfus09?Redirect=Log&logNo=222505447195,나의 딥자매들 언제나 응원해 @충무로사랑방 칼국수여긴 너무 좋아하는 칼국수집인데 민정이랑 여름 막바지에 방문! 닭 국물 베이스로 시원하고 칼칼하고 크 @을지로 섬광 원형들 웨이팅 걸어놓고... ,mixmansion,https://blog.naver.com/ghdfus09,2021-09-14
을지로 맛집 # 사랑방칼국수백숙백반 리뷰,https://blog.naver.com/mjfyu1392?Redirect=Log&logNo=222525566187,얼마전 SNS를 보다가 을지로에 골뱅이가 아닌 맛집이 있다해서 바로 저장해둔사랑방칼국수 !! 식당이름 답게 칼국수를 파는 곳이지만사랑방칼국수 에 방문한 사람 80%는 백숙 백반을 먹는다 백숙 백반은 8000원!... ,조각조각,https://blog.naver.com/mjfyu1392,2021-10-04
[을지로 맛집] 충무로 찐 맛집 ' 사랑방칼국수 ' 백숙백반 칼국수,https://blog.naver.com/wooriho17?Redirect=Log&logNo=222535708088, 사랑방칼국수백숙 백반과 칼국수로 사랑받는 충무로 맛집 평일 10:30 - 21:40 재료 소진 시 마감 토요일 10:30 - 21:00 명절 휴무 일요일 10:30 - 16:00 서울 중구 퇴계로27길 46 네이버 플레이스 이곳은 을찌로 찐 맛집... ,woomaeng,https://blog.naver.com/wooriho17,2021-10-13
"충무로,사랑방칼국수 ",https://blog.naver.com/jinsil_vera?Redirect=Log&logNo=221693026836, 사랑방 칼국수충무로랑 을지로 사이에 있는사랑방 칼국수 . 서울사는친구한테 충무로 맛집... 친구가 여기선 칼국수보다 백숙이 맛있다고 해서 백숙2인먼저 시켰다. 1인당 8000원이면 가격 미쳐따! 기본찬.... ,always be true,https://blog.naver.com/jinsil_vera,2019-10-30
"▪️음식:사랑방 칼국수 , 콩국수, 약수역",https://blog.naver.com/katelogy_?Redirect=Log&logNo=222443005657,이름만 듣고 을지로에 있는 # 사랑방칼국수로 착각했지만 엄연히 다른 곳 이곳은 약수역 근처 이곳에 간 목적은 바로 #콩국수 너무 오랜만에 만난 콩국수 소금간이 하나도 안되어 있으니 기호에 따라 넣어서... ,Katelogy,https://blog.naver.com/katelogy_,2021-07-23
"Rang Bang', Seoul.사랑방 칼국수 , 서울 충무로.",https://blog.naver.com/kradlekorea?Redirect=Log&logNo=222044151332,나중에서야 알게되어서 자주 찾게 된사랑방 칼국수 . 첫 방문 때는 그 유명하다는 백숙백반이 다 팔려서 허탕. 상호에는 칼국수가 들어가는데 정작 백숙백반으로 유명하다니. 뭔가 독특하고... ,KRADLE.NET,https://blog.naver.com/kradlekorea,2020-07-29
미쳐버린 백숙백반 맛있어서 기절한 을지로 [ 사랑방 칼국수 ] 후기,https://blog.naver.com/olivia5402?Redirect=Log&logNo=222542093090,을지로사랑방 칼국수 집에 대해 리뷰해보도록 하겠습니다. 건물 외관입니다. 일단 골목 자체가 맛집이... 을지로감성 #을지로사랑방 #을지로점심 #을지로백숙 #을지로칼국수 #종로데이트 #서이추 #서이추환영 #일상,Eat Pray Love,https://blog.naver.com/olivia5402,2021-10-19
"노포의 매력을 간직한 을지로 2 /사랑방 칼국수 , 카페 잔",https://blog.naver.com/angelcan147?Redirect=Log&logNo=222535783660,"싶었던사랑방 칼국수 ~ 입구부터 노포 느낌이 물씬하다 알고 봤더니 수요미식회, 맛있는 녀석들, 백반기행 등 맛집 프로에 빠지지 않고 나왔던 곳이더라~ 칼국수 집이지만 백숙 백반으로 유명하기도 하고, 흔한... ",슬기로운 백수생활,https://blog.naver.com/angelcan147,2021-10-13
인턴기자 11일차 _사랑방칼국수 와 스벅 케이크 (할로윈 펌킨... ,https://blog.naver.com/sue8753?Redirect=Log&logNo=222543198421,"했는데 부장님 얼리버드셨네,, (그래도 나 7분이나 일찍 출근했음 호!) 점심은 # 사랑방칼국수노포 느낌인데 유명 맛집인 곳! 달걀 추가하면 6200원 추가 안하면 6000원 (달걀 추가해서 안 먹는 사람 바보!) 특별한... ",쫑스네,https://blog.naver.com/sue8753,2021-10-20
 사랑방칼국수어쩌다 발견한 충무로 을지로 노포 맛집,https://blog.naver.com/plus0818?Redirect=Log&logNo=222532931150, 사랑방칼국수사랑방 칼국수 라는 상호답게 칼국수가 유명한지 칼쿡수는 재료 소진으로 없다고 해서 맛볼 수 없어 아쉬웠다 백숙백반 2인을 주문 그나마도 이 시간에 들어 왔으니 맛볼 수 있었지 이후로는 재료... ,옥정꽃길부동산 정보&일상.꽃길만 걸으세요 ^^,https://blog.naver.com/plus0818,2021-10-10
충무로 백숙백반사랑방칼국수 ,https://blog.naver.com/sparkling31?Redirect=Log&logNo=222079924986,"두 번이나 방문한 가성비 갑, 맛있는 백숙 백반사랑방 칼국수날 좋은 날 충무로에서 급 점심약속... 를 파에 버무려 같이 먹으라고 해서 먹어봤는데 이건 내 스탈 아니었구요 백숙엔 소금+후추가 진리 칼국수는... ","My Favorite,",https://blog.naver.com/sparkling31,2020-09-04
충무로 맛집 50년전통사랑방칼국수 ,https://blog.naver.com/kominheehaha?Redirect=Log&logNo=221704501698,#충무로맛집 # 사랑방칼국수#닭백숙맛집 #충무로맛집 사랑방칼국수사랑방칼국수 를 다녀온건 아마도... 보통 칼국수도 많이 먹던데 나는 이달 백숙을 먹으러 방문한것이니 백숙백반 2개를 주문했다. 시간이 지나... ,Always and Forever,https://blog.naver.com/kominheehaha,2019-11-11
충무로 맛집 /사랑방칼국수백숙백반,https://blog.naver.com/michiko717?Redirect=Log&logNo=222027620638,메뉴 점심에 가면 백숙백반 간혹 여러명 가면 백반에 칼국수 시키기도 하는데 맛있는 편이다 요런 내부 2층 다락방도 있는데 좌식이고 천정이 낮아 불편;;사랑방칼국수 의 매력은 김치!!!! 사실 요 김치에다... ,딸기의 소소한 일상,https://blog.naver.com/michiko717,2020-07-11
[오늘뭐먹었어?] 충무로 50년전통사랑방 칼국수 ,https://blog.naver.com/girlmeetgirl?Redirect=Log&logNo=222366395846,점심시간은 직장인들로 골목부터 사람이 많은 곳이다. 칼국수 역시 6000원이라는 저렴한 가격으로 다음에 꼭 먹어보고 싶다. #직장인점심 #충무로맛집 #백숙맛집 #몸보신 #일상 #맛집투어 # 사랑방칼국수#백숙백반,lazy.kei,https://blog.naver.com/girlmeetgirl,2021-05-25
"닭백숙/ 내용있는 음식, 실속있는 식사 - 충무로사랑방칼국수 ",https://blog.naver.com/mercyblu?Redirect=Log&logNo=221727566643,그런데 칼국수집의 탈을 쓴 닭백숙 맛집인 충무로의사랑방칼국수 에는 백숙백반이란게 있다. 그래서 혼자 가도 백숙백반 하나를 시키면 닭 반마리가 닭국물과 밥과 함께 나와서 혼자서 눈치보지않고... ,머시블루's Happy Nation,https://blog.naver.com/mercyblu,2019-12-05
[을지로맛집]충무로명소사랑방칼국수 ,https://blog.naver.com/loving8792?Redirect=Log&logNo=221780684130,#을지로맛집 #충무로맛집 #힙지로맛집 # 사랑방칼국수#식신로드 #충무로점심 #직장인점심 #충무로3가맛집 #충무로밥집 #닭백숙 #칼국수 #닭곰탕 오늘 점심은 너로 정했다!!! 을지로사랑방칼국수오늘은 을지로... ,"""Happy Day""",https://blog.naver.com/loving8792,2020-01-21
2103 충무로역 백숙백반 노포 ' 사랑방 칼국수 ',https://coolnjazzylife.tistory.com/3088,고민 끝에 백숙백반으로 유명한사랑방 칼국수 에 가보기로 했다. 오후 2시경사랑방 칼국수 에 도착... 아내가 칼국수 맛도 궁금하다고 해서 칼국수 하나를 추가 주문하였다. 사실 나는 여기 칼국수 맛을 익히... ,Cool & Jazzy Life,https://coolnjazzylife.tistory.com/,2021-04-21
[충무로]사랑방칼국수(수요미식회 백숙백반),https://blog.naver.com/kkiibbb?Redirect=Log&logNo=221576825872,[충무로]사랑방칼국수(수요미식회 백숙백반) 칼국수와 백반백숙의 맛이 좋고 사랑을 받고 있는 충무로 노포사랑방칼국수 !! 해장으로도 아주 좋아서 조만간 술 마시러 한 번 다시 방문해보도록 하겠습니다.... ,스봉이네 스봉이,https://blog.naver.com/kkiibbb,2019-07-04
충무로 맛집 -사랑방 칼국수 ,https://blog.naver.com/kkakkajam?Redirect=Log&logNo=220484581234,저희집에 사랑방에 손님이 오신다면 이 칼국수를 꼭 내오고 싶네요 충무로에서 칼국수 맛집을 찾으신다면 두말할것없이사랑방칼국수 입니다 주소 : 서울특별시 중구 충무로3가 23-1 전화 : 02)2272-2020 칭만조우,까까잼,https://blog.naver.com/kkakkajam,2015-09-19
[충무로 맛집] 사랑방칼국수 -1인 백숙백반이 가능한 식당,https://blog.naver.com/hongik9016?Redirect=Log&logNo=221227567924,가게 건너편에 백숙백반과 칼국수를 맛있게 하는 충무로 맛집사랑방칼국수 가 있다는 소리만 들었지 직접 방문한 적은 없었다. 충무로로 이사 온 친구 녀석이 이 식당이 가고 싶다고 해서 바로 콜을 외치고... ,아가리파이터의 먹방,https://blog.naver.com/hongik9016,2018-03-13
"충무로의 노포,사랑방칼국수 ",https://blog.naver.com/ubouno?Redirect=Log&logNo=221153259398,"다 아는사랑방칼국수 를 올려 본다 평소 2, 3개월에 한번씩은 가게 되는 곳~~ 이제서야 포스팅?!!... 누런 테잎으로 덕지덕지 막강 노포의 꾸미지 않는 자신감 혼자가면 당연히 칼국수보단 백숙백반 주문... ",멋과 맛을 찾아 다니는 여행,https://blog.naver.com/ubouno,2017-12-01
충무로 맛집 /사랑방 칼국수: 50년 넘은 칼국수와 백숙 맛집,https://blog.naver.com/begopa1092?Redirect=Log&logNo=221595879692,충무로의 50년 넘은 노포사랑방 칼국수오랜만에 황소집의 도가니탕과 살짝 갈등 했으나 비 오고 꿉꿉한 날이라 칼국수가 땡겨 방문 가격도 오르지 않고..아직까지 착한 가격.. 주 메뉴는 백숙과 칼국수... ,eye of the beholder,https://blog.naver.com/begopa1092,2019-07-26
"충무로 맛집사랑방칼국수: 맛있고 가성비 좋은 백숙백반, 칼국수",https://blog.naver.com/zephyr122059?Redirect=Log&logNo=221514973606," 사랑방칼국수 , 친절 친근한 주인 할머님의 푸짐한 노포 인심이 따뜻한 서민들의 사랑방이다. 어디서도 찾아보기 힘든 백숙백반은 부드러운 닭고기와 감칠맛 좋은 국물로 인기에 걸맞고 특으로 주문한 칼국수... ",사랑이 밥먹여준다,https://blog.naver.com/zephyr122059,2019-04-17
충무로 맛집 /사랑방칼국수 ,https://blog.naver.com/michiko717?Redirect=Log&logNo=221634744735,국물 잘 안먹는데 밥도말고 가슴살도 찢어 넣고 죄다 먹어버렸다 ㅎㅎ 하루 세끼도 먹을 수 있을거같음 난 닭이 좋아~~ 항상 북적이는 충무로 맛집사랑방칼국수추워지면 칼국수도 먹어야지!!!... ,딸기의 소소한 일상,https://blog.naver.com/michiko717,2019-08-31
 사랑방 칼국수: 충무로,https://blog.naver.com/apjjang31?Redirect=Log&logNo=220196731023,오랜만에 충무로 근처 갔다가 들린사랑방 칼국수확실히 비오는 날엔 밀가루가 땡겨요.. 이제 비... 그래도 칼국수만 먹기 심심할 때 곁들이기 나쁘지 않습니다 백숙이랑 같이 제공되는 특제소스 시큼함이... ,Dine With SangJung,https://blog.naver.com/apjjang31,2014-12-01
충무로 백숙백반 을지로3가 점심 노포맛집사랑방칼국수 ,https://blog.naver.com/sajapyung?Redirect=Log&logNo=221527316616,상호처럼 #칼국수 도 많이 찾는 메뉴라네요. 충무로백숙 #충무로닭사랑방칼국수 에서 비법을 전수받은 백숙백반 집이 경기도 파주시 금촌동에 #충무로사랑방백숙백반 이란 상호로 오픈하여 파주에서도 즐길... ,맛있는 건 언제나 옳아,https://blog.naver.com/sajapyung,2019-05-01
충무로사랑방칼국수 ,https://blog.naver.com/freemanintl?Redirect=Log&logNo=221220773092,충무로사랑방칼국수충무로나 을지로에는 예전 노포 분위기가 물씬 나는 맛집들이 즐비합니다.사랑방칼국수 도 그런집들 중 하나인데요 매번 지나쳐 가기만 하다가 이번에 한번 들어가 봤습니다. 68년에... ,Free Road's Taste of Travel,https://blog.naver.com/freemanintl,2018-03-03
[충무로]사랑방칼국수 ,https://blog.naver.com/songju80?Redirect=Log&logNo=220211906914,"[충무로]사랑방칼국수칼국수와 통닭백숙을 맛볼수 있는 노포사랑방칼국수여러 방송매체에 소개 되었고, 최근에는 식신로드에도 방송됐다고 한다. 메뉴판 가성비가 좋아보이는 백숙백반 기본찬으로는... ",♪~만추의 세상 이야기,https://blog.naver.com/songju80,2015-01-15
충무로 맛집 /사랑방 칼국수: 멸치칼국수 전문 식당,https://blog.naver.com/begopa1092?Redirect=Log&logNo=221086659572,주말 아점겸 해장을 위해 들렀던사랑방 칼국수칼국수와 노계로 만든 백숙이 맛있는 충무로 노포집.. 백숙도 맛있기는 하지만 대부분 이곳에 오면 칼국수를 먹게되는... 참고로 백숙은.. http... ,eye of the beholder,https://blog.naver.com/begopa1092,2017-09-08
[충무로 맛집]사랑방 칼국수 ,https://blog.naver.com/sand1082?Redirect=Log&logNo=221530537045,[충무로 맛집]사랑방 칼국수1968년부터 영업을 했다는 충무로의 터줏대감 같은 곳입니다. 테이블도... 그대로 사랑방 같은 곳이에요. 거리가 한산해도 이 곳의 문을 열면 사람들로 북적이고 있어 올 때마다 깜짝... ,시매의 잘 먹고 잘 사는 삶,https://blog.naver.com/sand1082,2019-05-06
충무로 맛집사랑방칼국수가끔 칼국수 땡기면 생각이 나서,https://blog.naver.com/js603?Redirect=Log&logNo=221083437598,맛집사랑방칼국수역시나 칼국수 한그릇 아주 맛나게 먹었다 가벼우면서 감칠맛이 좋은 국물에 찌그러진 냄비에 한가득 나오는 칼국수 맛이 없을수 없는 조합이다 충무로에서 칼국수 땡기면사랑방칼국수 ... ,달려라 마코짱,https://blog.naver.com/js603,2017-08-28
"[충무로맛집] 식신로드맛집,사랑방칼국수 ",https://blog.naver.com/mina860527?Redirect=Log&logNo=220038153181,"허름한 간판에 47년 전통이라는 ' 사랑방칼국수 ' 칼국수와 백숙백반이 유명하다고 여보가 가보자는데, 처음엔 그다지 땡기지 않다가 도대체 얼마나 맛있길래 그러나 궁금한 마음에 어제 다녀왔답니다. 지하철을... ",메밀꽃부부의 세계일주프로젝트,https://blog.naver.com/mina860527,2014-06-22
충무로사랑방칼국수 ,https://blog.naver.com/sunga114?Redirect=Log&logNo=150178488709,"충무로에 위치한 칼국수 전문점 '사랑방칼국수' 푹 삶아 내는 백숙과 멸치 국물로 맛을 낸 칼국수를 맛볼 수 있는 곳. 터프하게 무친 김치와 양파, 채썬 파를 기본으로 낸다. 초고추장을 베이스로 한 양념에... ",쏘오 딜리셔스,https://blog.naver.com/sunga114,2013-10-30
충무로 /사랑방칼국수 ,https://blog.naver.com/begopa1092?Redirect=Log&logNo=80160939077,반도카메라에 Leica X2 구경도할겸 식구들과 들렀던사랑방칼국수그렇게 맛집스런 외관은 아닌데 참 맛있게 하는 곳이다 칼국수 김치... 일반 칼국수집 김치들 보다는 덜달다.. 백숙을 주문하면 저 생양파가... ,eye of the beholder,https://blog.naver.com/begopa1092,2012-06-20
충무로사랑방칼국수 ,https://blog.naver.com/sunga114?Redirect=Log&logNo=150185685882,충무로에 위치한 백숙 / 칼국수 전문점 '사랑방칼국수' 충무로 일대에서 오랫동안 자리를 지키고 있는 노포. 출출했던 오후 따뜻한 칼국수와 푸짐한 백숙이 생각나 오랜만에 들렀다. 여전히 정겹고 허름한... ,쏘오 딜리셔스,https://blog.naver.com/sunga114,2014-02-24
충무로사랑방칼국수 ,https://blog.naver.com/sunga114?Redirect=Log&logNo=150175370314,"충무로 3가에 위치한 칼국수 전문점 '사랑방칼국수' 오래되고 허름한 곳이지만, 따뜻한 칼국수와 백숙 곁들여 식사하기에 제법 운치가 있는 곳. 위의 차림표에 더해서 칼국수는 200원씩, 백반은 500원, 백숙은 1... ",쏘오 딜리셔스,https://blog.naver.com/sunga114,2013-09-06
충무로 맛집사랑방칼국수 - 복합적 맛을 내는 맛있는 멸치칼국수,https://blog.naver.com/sagak815?Redirect=Log&logNo=220814089708,고춧가루 덕분에 살짝 칼칼한 맛도 나는데 먹다 보면 자연스럽게 이렇게 되는 칼국수다.사랑방칼국수영화 '식객'의 엔딩 신 촬영 장소이기도 한 곳이다. 유명한 만큼의 맛을 내는 곳이고 일하시는 분들이... ,사각사마는 뭘 먹고 사나,https://blog.naver.com/sagak815,2016-09-17
"닭백숙맛집, 충무로 을지로사랑방칼국수백숙백반 (with 칼국수)",https://blog.naver.com/dndbwodnjs?Redirect=Log&logNo=221543263476,충무로맛집 # 사랑방칼국수포근하고 친절한 할머니 사장님의 푸짐한 노포 인심이 무엇보다 좋은 곳 가까운 곳에 있다면 상호답게 사랑방 드나들 듯 자주 방문 할 것 같아요 백숙백반도 칼국수도 한 끼 식사로... ,지봉공쥬,https://blog.naver.com/dndbwodnjs,2019-05-22
[충무로3가] 계란넣고 먹는 맛좋은 칼국수.... 사랑방칼국수 ,https://blog.naver.com/ssobangz?Redirect=Log&logNo=220244566966,우리 큰 형님이 좋아하시는 칼국수 집 인사랑방칼국수 ... 저도 반도카메라에 친구 라이카 맡기러 가는겸 들려보았다는~사랑방칼국수 의 양은냄비...매력적이야~ 형님 포스팅에서 종종 봐서 친숙했던 칼국수집... ,"쏘방이, 그 행복만으로도..",https://blog.naver.com/ssobangz,2015-01-19
"을지로 3가 맛집, 칼국수와 백숙백반!!!사랑방칼국수 ",https://blog.naver.com/angerbong?Redirect=Log&logNo=221224666173,"을지로 3가 맛집, 칼국수와 백숙백반!!!사랑방칼국수회사언니가 맛집이있다고 가자고 했는데, 얼추 이 근처의 맛집은 거의다 가본것 같은데... 여긴 첨이였다.... 스고이.. 이름부터 사랑이 넘치는 사랑방... ",YOOYEL : 지극히 개인적인,https://blog.naver.com/angerbong,2018-03-08
나인트리 프리미어 호텔 명동2 라운지와 을지로사랑방칼국수 ... ,https://blog.naver.com/prettyye02?Redirect=Log&logNo=222085866870,"그래서, 11시 30분쯤 체크아웃 한 다음에 12시 이전에사랑방칼국수 에 도착하면 좋을 것 같아요. 메뉴를 보니까 칼국수, 계란넣은 칼국수, 칼국수 곱빼기, 특칼국수 등 칼국수도 판매하고 있었고요. 닭곰탕(6... ",예리의 여행이야기 ♥ 예리블로그,https://blog.naver.com/prettyye02,2020-09-10
"도개온천,사랑방칼국수/ 도개온천 맛집",https://blog.naver.com/readandenjoy?Redirect=Log&logNo=221287424334,온천을 마치고 바로 앞에 있는사랑방 칼국수 에서 이른 저녁을 먹습니다. 썰렁한 온천 마을의 음식이니까 큰 기대는 하지 않습니다. 우리는 우선 생두부를 주문합니다. 그리고 해물칼국수나 콩국수도 취향 대로... ,readandenjoy님의블로그,https://blog.naver.com/readandenjoy,2018-05-30
"을지로투어 ( 사랑방 칼국수 , 와인바 섬광)",https://blog.naver.com/manwhee?Redirect=Log&logNo=222023422373,맛집사랑방칼국수지나가면서는 몇번 봤는데 먹으러 온건 처음. 여기 얘기하니 선미도 가고싶어서 스크린샷으로 저장해놓고 있었다길래 넘 궁금해서 와봄. 무려 50년 전통이라고...! 메뉴는 칼국수랑... ,Diary,https://blog.naver.com/manwhee,2020-07-07
충무로 노포사랑방칼국수메뉴추천,https://blog.naver.com/dkfka9366?Redirect=Log&logNo=222518147099,"충무로 노포 맛집사랑방칼국수 를 다녀왔다사랑방칼국수가는 법 참고로, 가기전에 전화해서 영업하는지, 닭은 남아있는지 칼국수가 가능한지 전화해보고 가는것이 좋다.사랑방칼국수 의 모습 바깥에서... ",파베레 fibere,https://blog.naver.com/dkfka9366,2021-09-30
점심에 딱 백숙백반(삼계탕/반계탕) @ 사랑방칼국수 ,https://blog.naver.com/kyumding?Redirect=Log&logNo=221278759079,을지로맛집/을지로3가맛집/명동맛집/충무로맛집 @ 사랑방칼국수을지로3가에 위치한사랑방칼국수 에... 한 끼 하고싶을 때 자주 갈 것 같아요 대만족..☆ 그리고 저 국물의 맛이라면 분명 칼국수도 대존맛일듯..ㅠ,두수니의 블로그,https://blog.naver.com/kyumding,2018-05-18
충무로 칼국수 / 백숙백반사랑방칼국수 ,https://blog.naver.com/phjsunflower?Redirect=Log&logNo=221416972574,충무로 칼국수 하면 대표적으로사랑방칼국수 를 떠오르게 된다. 워낙 인기가 있는 곳이면서도 사람들이 사랑방처럼 편하게 드나드는집. 이름또한 옛스러운 말을 가지고 있는 곳. 이날은 너무 추운 한파가 닥치고... ,꽃씨의 맛집 이야기♬,https://blog.naver.com/phjsunflower,2019-02-23
충무로 을지로사랑방칼국수 /백숙백반/맛있는녀석들/수요미식회,https://blog.naver.com/taurusz?Redirect=Log&logNo=222034618029,#서울여행 #명동 #충무로 #을지로 #맛집 #을지로맛집 #백숙맛집 #칼국수맛집 #수요미식회 #맛있는녀석들 # 사랑방칼국수#전통맛집 #데이트코스 #서울맛집 #백숙 #을지로백숙 #충무로백숙 . . 오늘도 하세요♥,Hong G★,https://blog.naver.com/taurusz,2020-07-18
"을지로 바이브 /사랑방 칼국수 , 오비베어",https://blog.naver.com/satanella?Redirect=Log&logNo=221732861445,둘이가면 백반 두개에 칼국수 하나 kkkk칼국수는 일단 먹어야죠백반이 메인이긴한데칼국수도 먹어야합니다 kkkkkkk 요로케 걸죽한 칼국수 국물너무 좋구요~ 사랑방 칼국수 는 사랑입니다~ 을지로 탐방을... ,Balletically Studio.,https://blog.naver.com/satanella,2019-12-11
충무로 /사랑방칼국수 ,https://blog.naver.com/begopa1092?Redirect=Log&logNo=80150327477,가본다 가본다 하고 잊었다가 외근후 갑자기 생각나 들렀던사랑방 칼국수40년 가까이 된 집이라고 한다 가격 참 좋다... 따뜻한 보리차가 좋았다 싱싱했던 칼국수용 김치 일단 기본찬 부터 통닭.. 쫄깃한... ,eye of the beholder,https://blog.naver.com/begopa1092,2012-01-16
닭한마리가 국물에 빠진 날~사랑방칼국수 ,https://blog.naver.com/socuripass?Redirect=Log&logNo=221674903525,"을지로맛집인사랑방 칼국수 !! 오늘 점심으로 휘리릭 탐방하고 왔답니다. 요즈음 을지로가 뜨는... 칼국수가 6,000원 곱배기 칼국수가 6,200원 특 칼국수가 6,400원 이런 점이 바로 을지로노포의 정이겠지요! 착하다!... ",소쿠리패스 - SOCURI PASS,https://blog.naver.com/socuripass,2019-10-11
