title,link,description,bloggername,bloggerlink,postdate
[서울/을지로] 충무로맛집사랑방칼국수 (수요미식회 백숙백반),https://blog.naver.com/pinkjh35?Redirect=Log&logNo=221672828152,갔던사랑방칼국수친구 소개로 간 곳인데 보기에도 엄청 유명한 곳 같았다 다행히 점심을 조금 지난 시간이라 살짝 기다리고 바로 들어감. 포장도 가능해서 포장해가는 사람들도 많았다 메뉴는 칼국수도 있고... ,핑크빛핑달인생♥,https://blog.naver.com/pinkjh35,2019-10-09
 사랑방칼국수충무로역 맛좋은칼국수 백숙백반 먹으러 갔어요.,https://blog.naver.com/gkszjq?Redirect=Log&logNo=222312024326,이칼국수 집은 1968년 개업하여 50년째 영업중인 충무로 맛집입니다. 을지로와도 가까워요. #을지로맛집... 닭한마리를 통으로 주는 시원시원한 인심이 느껴지는 백숙백반과 맛좋은 칼국수 를 먹자면 기분이... ,생각이 발 디딘소리⋰˚☆,https://blog.naver.com/gkszjq,2021-04-16
그 칼국수집! 약 50년 된 충무로 강추 맛집!사랑방 칼국수 ,https://blog.naver.com/yimdawa?Redirect=Log&logNo=20205725173,능력껏 주변에 대면 됨 도보로는 찾아가기 힘든 편이라 네비찍고 자가용으로 가는 것이 편함 충무로맛집/식객/식객칼국수집/ 사랑방칼국수 /충무로 사랑방칼국수 /충무로백숙백반/백숙백반/충무로맛집추천,DAWA's BLOGGGGG,https://blog.naver.com/yimdawa,2014-02-24
을지로맛집 / 충무로맛집 50년 전통사랑방칼국수(백숙백반),https://blog.naver.com/nynny9?Redirect=Log&logNo=221656612807,"수요미식회에도 나온사랑방칼국수개인적으로 수요미식회 맛집 안믿는데,, 여기는 만족했기때문에... 이곳은 백숙백반만큼 칼국수만 먹으러도 많이 온다. 칼국수 안먹고 가기엔 아쉬우니까? 칼국수도... ",닌로그,https://blog.naver.com/nynny9,2019-09-23
[충무로맛집/ 사랑방칼국수 ]별다를거 없지만 노포에서 나오는... ,https://blog.naver.com/mjinchul1?Redirect=Log&logNo=222261290317,"서울 올라와 어딜갈까 고민하다 카트 끌고 충무로사랑방칼국수 를 찾아갔어요 예전 사무실 근처라... 간판처럼 칼국수가 메인인거 같지만 난 늘 이집은 닭곰탕 ,닭백반집으로 기억됩니다. 칼국수를... ",바블의 신나는 세상,https://blog.naver.com/mjinchul1,2021-03-02
을지로입구 /사랑방칼국수 ,https://blog.naver.com/mtrong?Redirect=Log&logNo=222450843101,사이즈 조절 가능 합니닷 을지로에서 칼국수 땡기면사랑방 칼국수강추 합니닷 ❤️ #을지로맛집 #충무로맛집 #을지로칼국수 #충무로칼국수 # 사랑방칼국수#칼국수맛집 #맛집추천,malmo.beauty,https://blog.naver.com/mtrong,2021-07-30
 사랑방칼국수- [충무로] 오랜 전통의 충무로 대표 칼국수집..,https://blog.naver.com/hjjhlee?Redirect=Log&logNo=20110758145, 사랑방 칼국수충무로를 대표하는 칼국수집으로 영화등 미디어에 많이 출연한집.. TV에서 뭘 하길래 애들 시선이 고정일까? 귀여워라.. 5가지 칼국수로 유혹하는.. 영화 식객의 마지막 장면에 나오는.. 김치.... ,Smurfworld,https://blog.naver.com/hjjhlee,2010-08-06
"합정 오레노라멘 청담이상, 을지로 호랑이카페사랑방칼국수일단",https://blog.naver.com/awesome_kang?Redirect=Log&logNo=222240775017,식당 # 사랑방칼국수을지로3가와 충무로 사이 골목에 있는 식당이다 간판만 봐도 정말 오래되보임 백숙주문 푹고아진 귀여운 통닭한마리 나온다 둘이서 배터지게 잘 먹었음 ㅎㅎㅎ 뭔가 로컬들 사이에 낀... ,조화로운 삶,https://blog.naver.com/awesome_kang,2021-02-12
[서울 충무로] 사랑방 칼국수- 닭백숙 - 4.5점/5.0점,https://blog.naver.com/lalalalala15?Redirect=Log&logNo=221684530743,근데사랑방 칼국수 의 닭은 너무 부드러워서 닭다리를 입에 넣고 당기면 뼈만 깔끔하게 쏘옥 나온다.... 보통 둘이가서 닭 반마리가 나오는 백숙백반에 칼국수를 하나 시켜서 둘이 나눠먹는 형식으로 먹는데... ,유쾌한 신기씨의 블로그 시즌2: 食의 아카이빙,https://blog.naver.com/lalalalala15,2019-10-23
맛있는 녀석들 백숙백반 충무로 맛집사랑방칼국수 ,https://blog.naver.com/zephyr122059?Redirect=Log&logNo=221989349598,"맛만으론 백숙백반이 칼국수보다 훨씬 마음에 들지만, 아빠 엄마 손잡고 서산 가던 어릴 적 추억 돋우는 칼국수도 두 번 가면 한 번은 먹어줘야겠다.사랑방칼국수02-2272-2020 종구 퇴계로 27길 46 지번: 충무로... ",사랑이 밥먹여준다,https://blog.naver.com/zephyr122059,2020-06-05
[예슬투어] 충무로 맛집사랑방칼국수+ 을지로 와인바 취향로3가,https://blog.naver.com/yeseuldp?Redirect=Log&logNo=221534597452,"유명한사랑방칼국수 의 메뉴 참고하세용 저희는 백숙백반, 특칼국수를 시켰어용^^* 진영이가 너무 잘 먹어서 뿌듯ㅋㅋㅋㅋㅋㅋㅋㅋ 진영이가 닭 발리면서 클럽 얘기해주는거 짱잼..⭐️ 2차는 을지로 와인바... ",출근만큼여행 - yeseul time,https://blog.naver.com/yeseuldp,2019-05-10
"영이로드_20.사랑방 칼국수 , 충무로, 을지로",https://blog.naver.com/meatsource?Redirect=Log&logNo=222522275491,"맛집인사랑방 칼국수 를 갔당 이미 유명할대로 개유명하고... 맛있는 녀석들, 허영만의 백반기행... 글구 칼국수도 많이 시킨다. 3명이면 백반 2인에 칼국수가 굿이에요~ 맛집 티내기.. 드뎌 나옴!!! 한마리의... ",Not over yet,https://blog.naver.com/meatsource,2021-09-30
충무로맛집 50년전통집사랑방칼국수 ,https://blog.naver.com/dkfydeodrn?Redirect=Log&logNo=221400435234,저원래 생양파 안먹는데 다먹었어요 ㅎㅎㅎㅎ 닭먼저 먹고 밥은 닭국물에 말아서 먹었답니당 먹느라고 사진이 많이없네용ㅎㅎㅎ 충무로맛집사랑방칼국수다음엔 가서 칼국수를 먹어봐야겠어용~ - 내 돈주고... ,댕로그,https://blog.naver.com/dkfydeodrn,2018-11-19
오늘은모먹지?사랑방칼국수백숙백반 충무로맛집 식신로드,https://blog.naver.com/parkcw87?Redirect=Log&logNo=220310068719,저는 칼국수를 하나 추가했습니다 역시사랑방칼국수 는 방송들에 많이 나왔음을 검증 ㅎㅎㅎ 생생정보통 식신로드 등 많이 나왔네용 오호~ 그 맛이 무척 기대가 됩니다 ㅎㅎ 밑반찬이 나왔어요 곧사랑방칼국수 ... ,꽃채원씨의 일상이야기,https://blog.naver.com/parkcw87,2015-03-24
서울 충무로 맛집 - 가성비 좋은 백숙백반집사랑방칼국수 ,https://blog.naver.com/guswl911030?Redirect=Log&logNo=221600098055,뚜기픽 # 사랑방칼국수충무로에서 꽤나 오랫동안 자리를 지켜온 집 허름해 보이는데 또 이런 곳이 맛집이지 메뉴~ 우린 백숙백반 2인+칼국수 이렇게 주문했다 기본찬 나중에 닭백숙 찍어먹을 소금과 저 파는... ,매일을 기록하는 메밀,https://blog.naver.com/guswl911030,2019-07-30
"[충무로 맛집]46여년 전통 멸치 칼국수와 닭백숙,사랑방칼국수 ... ",https://blog.naver.com/yesican1?Redirect=Log&logNo=120203841512,"^^ 가격 칼국수 6천원, 백숙 백반 8천원 전화 (02) 2272-2020 주소 서울시 중구 충무로3가 23-1 쭌의 맛평가 ★★★ 맛집,쭌의맛집, 사랑방칼국수 ,칼국수,칠갑산토종닭,토종닭,백숙,충무로맛집 ■ 페이스북 http... ",쭌의맛집 since 2003,https://blog.naver.com/yesican1,2013-12-17
[을지로/충무로 맛집] 백숙백반이 맛있는사랑방칼국수 ,https://blog.naver.com/yogurt627?Redirect=Log&logNo=221434328471,"세상엔 맛있는게 너무 많아 숙소에서 1분 거리였던ㅋㅋㅋㅋㅋ 충무로/을지로 맛집,사랑방칼국수 ! 백숙백반, 칼국수가 유명한데 통닭백숙은 따로 포장도 가능하다. 가격도 너무 괜찮은데 백숙백반 한 상 8... ",그저 잘 노는 이야기,https://blog.naver.com/yogurt627,2019-01-04
[충무로/ 사랑방칼국수 ] 어머님이 해주시던 추억의 옛날 백숙을... ,https://blog.naver.com/symin67?Redirect=Log&logNo=40162783463, 사랑방 칼국수 의 메인은 칼국수가 맞습니다만... 이 집의 닭백숙은 정말 예전 어머님이 해주시던 추억의 그 백숙맛 그대로입니다. 모양이나 기교는 없지만 닭을 잡내없이 잘삶아내서 그야말로 부드러운 백숙을... ,맛짱.. 케케케의 Tasty Food,https://blog.naver.com/symin67,2012-07-06
[박은지] 충무로사랑방 칼국수백숙백반,https://blog.naver.com/stilla83?Redirect=Log&logNo=120209563865,충무로사랑방 칼국수백숙 백반! 요즘은 충무로 쪽으로 먹으러 다녀요~ 오래된 역사도 있고 맛 보장!... 오늘 한 거라서 아삭아삭!!백숙.칼국수 나놨당~~^^ 닭 소스가 새콤이달콤이 칼국수 맛나용!요건 욕심으로... ,EgeeBeauty,https://blog.naver.com/stilla83,2014-03-16
퇴계로사랑방칼국수 ,https://blog.naver.com/popop497?Redirect=Log&logNo=222533116641,닭백숙정식 3개를 시키고 닭 칼국수한개를 시킵니다. 두당 반마리를 준것 같고 이렇게 뜨끈한 닭육수를...칼국수나왔고 백반 8천원칼국수6천원 착한 가격입니다. 육수중에 닭육수를 1.2등을 주는 입장인지라... ,식사중,https://blog.naver.com/popop497,2021-10-11
충무로 맛집사랑방칼국수 .. 더 이상의 말이 필요없다..!,https://blog.naver.com/femail317?Redirect=Log&logNo=221347740739,방송에서는 칼국수를 주로 소개를 했었는데 내가사랑방칼국수 를 찾았을 때는 칼국수를 먹지 않고 또 다른 히트 메뉴 백숙을 먹었었고 그 맛을 잊지 못해서 몸이 허하다 생각이 들때마다 들러서 먹었던거 같다.... ,매일의 밥상에 감사와 즐거움~,https://blog.naver.com/femail317,2018-08-28
말복이니까 나도 50년 된 백숙 백반사랑방칼국수먹으러!!... ,https://blog.naver.com/appab?Redirect=Log&logNo=221614180597,가득해사랑방칼국수 엔 메인메뉴는 칼국수인가 봐 우리도 하나는 먹어봐야지 #백숙백반 두 개 나중에 칼국수를 추가했지요 8000원에 닭이 나오다니 와 좋다 우리 자리 안쪽이라 시원하긴 하다 아직까지는..... ,Lovesome_ssong,https://blog.naver.com/appab,2019-08-12
[충무로맛집]사랑방칼국수 ,https://blog.naver.com/kcphz?Redirect=Log&logNo=10172797296,사랑방 칼국수서울 중구 충무로3가 23-1 02-2272-2020 오전9시~오후10시 (일요일은4시까지) 명절휴무 주차불가능 꺄 *.* 줴이야 나 먹고왔어 ㅋㅋㅋㅋㅋㅋㅋㅋㅋㅋㅋ 울 줴이 포스팅 보고 어찌나 백숙백반이... ,평범하게 살고있는 봉봉♬,https://blog.naver.com/kcphz,2013-07-22
"[충무로] 식객에도 나왔던 칼국수와 백숙,사랑방칼국수 ",https://blog.naver.com/choibi_89?Redirect=Log&logNo=100090749056,바로 ' 사랑방칼국수 ' 거의 40년째 이 자리에서 장사를 하신 듯 해요 나올때 찍은 거라 너무 어둡네요-_- 허름해보이고 또 앞에는 화분들이 가득하지만 먹엇던 칼국수와 백숙은 맛있었다는 헤헤 들어가면 보이는... ,온세상 신나는 이야기,https://blog.naver.com/choibi_89,2009-10-09
을지로 카페 “알렉스룸” / 을지로맛집 “ 사랑방칼국수 ”,https://blog.naver.com/jamizida?Redirect=Log&logNo=221979966071,밥먹으러 가려고 나가기 전에 급히 사진 몇장 찍어뒀다 헤헤 오케이~ 바이~ #을지로맛집 검색하다가 발견한 # 사랑방칼국수닭백숙과 칼국수라니 이조합 안사랑 할 수 있겠냐고요. 갑자기 어이없게 비가와서... ,—̳͟͞͞♡,https://blog.naver.com/jamizida,2020-05-27
[ 사랑방 칼국수 ] 충무로 맛집 - 시원한 칼국수와 푸짐한 백숙백반,https://blog.naver.com/mardukas?Redirect=Log&logNo=100149276849,"곳들인데사랑방 칼국수 도 그 중 하나지요... 간판은 조금 바뀐 것 같지만 겉모습은 그대로입니다.. 개인적으로 국수, 특히 칼국수를 좋아하는 편인데 안타깝게도 마님은 그렇질 않아 전보다 칼국수 먹을... ","먹자, 마시자, 놀러 다니자",https://blog.naver.com/mardukas,2012-02-20
"명동 을지로 존맛 백숙사랑방칼국수8000원, 안먹으면 손해",https://blog.naver.com/powersub1101?Redirect=Log&logNo=222453756394,"가게 이름은사랑방칼국수 로 을지로 칼국수 집인가 싶은데 아침부터 빽빽히 가득찬 손님들은 모두 백숙을 먹고 있어요. 한자리에서 하도 장사를 오래했다보니 생활의 달인, 오늘 저녁, 식신로드, 맛있는 녀석들... ",감성없음,https://blog.naver.com/powersub1101,2021-08-02
충무로 을지로 가성비 백숙백반 맛집[사랑방칼국수],https://blog.naver.com/ssr00156?Redirect=Log&logNo=222501559062, 사랑방칼국수메뉴판 칼국수도 먹어보고싶었지만 백숙백반이 너무 맛있어보여서 2개로 주문했어요!사랑방칼국수백숙백반 주문하자마자 거의 바로 나왔는데요... 완전 빠름~ 빠름~ 빠름 백숙이...완전커요!!... ,지 곰 로 그,https://blog.naver.com/ssr00156,2021-09-10
[충무로/충무로역]충무로 맛집사랑방칼국수 집 그리고... ,https://blog.naver.com/luvkell?Redirect=Log&logNo=220362375519,충무로사랑방칼국수 ~ 닭도좋고 칼국수도 좋아하는 본인을 아는 친.구 ㅋㅋㅋㅋㅋㅋㅋ 늦은 저녁 급급.... 매일매일 담는거같아요~ 닭이나 칼국수는 김치가 맛나야 맛이 두배~!! 좋습니다~^^ 사랑방엔 김치가... ,데일리 미쓰O,https://blog.naver.com/luvkell,2015-05-17
해운대 사랑방칼국수 _좌동재래시장,https://blog.naver.com/yem2004?Redirect=Log&logNo=221028179874,"좋아하시면사랑방칼국수 도 괜찮을듯, 오방은 콩국수, 나는 돌판비빔밥, 그리고~~ 해물파전을... 일단 사랑방에는 팥칼국수가 있고, 하가원에는 수제비가 있음 그리고 하가원은 김치가 맛나고, 사랑방은... ",인식의 전환,https://blog.naver.com/yem2004,2017-06-13
"[을지로] 50년 전통의 맛집,사랑방칼국수 ",https://blog.naver.com/v8v_v8v?Redirect=Log&logNo=222504398172,"함께 먹는 칼국수까지 더불어 사랑받고 있는사랑방칼국수 에 다녀왔습니다. 외관부터 노포 맛집의 기운이 뿜뿜하네요. 백숙과 칼국수의 조합이라니.. 면덕후는 벌써 마음이 설레여옵니다. 백숙백반 - 8,000원... ",기록물,https://blog.naver.com/v8v_v8v,2021-09-13
[충무로]사랑방 칼국수 ,http://hsong.egloos.com/1619828,일행은 칼국수가 먹고 싶다고 그러고... 쭌의 맛집책을 보니 충무로의 ' 사랑방 칼국수 ' 가 레이다망에 걸리는군요. 바로 출발~! (종로에서 걸어가기에는 조금 멀어요.) 40년 가까이 되었군요. 가게 내부에서... ,녹두장군의 식도락,http://hsong.egloos.com/,2008-04-17
[충무로맛집/ 사랑방칼국수 ] 추운 날씨엔 따뜻한 닭곰탕... ,https://blog.naver.com/mjinchul1?Redirect=Log&logNo=220201087528,[충무로 맛집/ 사랑방 칼국수 ] 며칠전 ㅅㄴㅈ 님이 보여준 일산의 닭칼국수를 본 후 캐~~`땡겼슴 땡기면 먹는거~~지 근처에 있는사랑방 칼국수 로 ㄱㄱ 예전 충무로가 영화거리로 유명할때부터 각종 매체나... ,바블의 신나는 세상,https://blog.naver.com/mjinchul1,2014-12-05
충무로사랑방칼국수50년전통의 내공을 맛보다,https://blog.naver.com/ivfko?Redirect=Log&logNo=221060254516,충무로사랑방칼국수맛과 가성비 두 마리 토끼를 잡다 여름에 백숙은 꼭 먹어야 하는 음식 중에... 닭칼국수인데 김의 비릿한 맛이 많아서 나는 좀 별로였다. 칼국수가 맛있다는 사람도 있으니 참고만... ,Brand New,https://blog.naver.com/ivfko,2017-07-26
"[을지로,사랑방 칼국수 ] 두말, 세말할 필요없는 백숙집",https://blog.naver.com/mountinr?Redirect=Log&logNo=222479235968,"을지로에 예약 필수인 힙한 식당들이 넘쳐나는 와중에도, 오늘 소개할사랑방 칼국수 가 여전히... 백숙백반 둘과 칼국수를 주문하고 기본 세팅을 시작한다. 백숙백반은 정말 거의 주문과 동시에 서빙된다. 둘이... ",and... et cetera,https://blog.naver.com/mountinr,2021-08-21
