title,link,description,bloggername,bloggerlink,postdate
김구라 인생 콩국수맛집사랑방칼국수다녀옴,https://blog.naver.com/mina0823?Redirect=Log&logNo=222405675701,"난 솔직히 칼국수 밀가루맛 나서 배만부르고 맛도없어서 싫어했는데, 진짜 맛있는 칼국수는 이런 손맛이구나 생각이 들었다. 이어서 바로 나온사랑방칼국수 의 사랑방콩국수 얼음동동, 나는 콩국수 국물 없이... ",탐스러운 Blog,https://blog.naver.com/mina0823,2021-06-21
수요미식회/맛있는녀석들 백숙백반 -사랑방칼국수 ,https://blog.naver.com/danbijyj?Redirect=Log&logNo=222224188652,가게 이름은사랑방 칼국수 지만 백!숙!백!반! 먹으러.사랑방칼국수서울시 중구 퇴계로27길 46... 메뉴는 크게 칼국수와 백숙이다. 그 중 가장 인기 있고 대부분의 테이블에서 먹고 있던 내용있는 음식... ,장단비 블로그,https://blog.naver.com/danbijyj,2021-01-29
충무로 을지로 노포 : 맛있는녀석들사랑방칼국수백숙백반,https://blog.naver.com/apexism?Redirect=Log&logNo=222509716697,충무로 을지로 노포 맛있는녀석들사랑방칼국수백숙백반 노포를 찾아서 언제부턴가 오래된 식당이... 보통 2인이 방문할 경우 하나는 백숙백반에다가 다른 하나는 닭칼국수를 먹는게 정석이라고 했는데... ,The 재미있게 살기 (더재살),https://blog.naver.com/apexism,2021-09-18
충무로 을지로사랑방칼국수ㅣ 수요미식회 백숙백반 ♥,https://blog.naver.com/jinmichu?Redirect=Log&logNo=221940389702,"이름이사랑방 칼국수 인만큼 칼국수 맛도 궁금했기에 하나 시켜봅니다 ,, ㅎㅎㅎㅎ 칼국수 가격이 너무 귀여운게 계란 들어가면 200원 추가되고 곱빼기도 200원 추가예요 ㅋㅋㅋㅋ 500원도 아니고 200원인게 너무... ",진미츄 일상 기록,https://blog.naver.com/jinmichu,2020-05-01
"[을지로 노포] 을지로 노포 탐방:사랑방 칼국수 , 동원집",https://blog.naver.com/knynayoung?Redirect=Log&logNo=222542109242,늘 옛날 생각이 나는 충무로에서 조금 걸어가면 오늘의 목적지사랑방 칼국수 가 나온다.사랑방 칼국수평일 10:30-21:40 토요일 10:30-21:00 일요일 10:30-16:00 재료 소진 시 마감. 50년 전통 충무로 명소 사랑방... ,일상을 기록합니다.,https://blog.naver.com/knynayoung,2021-10-19
"맛있는녀석들 맛집, 을지로사랑방칼국수백숙백반",https://blog.naver.com/dmgk32?Redirect=Log&logNo=222315752308,"백숙백반 1인분, 반 마리에 비빔칼국수 먹었던 후기는 여기 있습니다. 이렇게 오늘로 을지로사랑방칼국수리뷰는 3번째가 되겠어요 백숙백반 2인분 구성 닭고기 700그람이 1인분인데, 2인분이면 아마도 1.... ",@유징유,https://blog.naver.com/dmgk32,2021-04-19
"을지로 노포사랑방칼국수 , 수요미식회 백숙백반!",https://blog.naver.com/kyoonsun7?Redirect=Log&logNo=221753566381,명동칼국수집의 마늘김치처럼사랑방칼국수 의 김치도 마늘맛이 꽤 느껴지던 김치였는데 자극적이면서 맛있는 그 느낌아시죠? ㅎㅎ 큼직하게 발라낸 닭고기살과 같이 먹거나 밥이랑도 먹고 칼국수랑도... ,"Hello, Delicious",https://blog.naver.com/kyoonsun7,2019-12-29
충무로맛집사랑방칼국수 ,https://blog.naver.com/katie85?Redirect=Log&logNo=222162058745,"충무로맛집사랑방칼국수수요미식회, 맛있는녀석들 등 각종 방송에서 맛집으로 인정한 역사깊은ㅋ... 사랑방이라는 말이 너무 좋아요~ 이곳은 50년전통 충무로명소라는 문구가 멋드러지죠... 간판은 칼국수인... ",오늘도 여행,https://blog.naver.com/katie85,2020-12-14
 사랑방칼국수(충무로) - 백숙 백반과 멸치육수 칼국수 맛집,https://blog.naver.com/definitice?Redirect=Log&logNo=222293460774,"3월 들어 칼국수 및 수제비를 신나게 먹고 있는데, 예전부터 가보고 싶었던 충무로사랑방칼국수 에 드디어 다녀왔다. 사실 갔다온지는 이미 몇 주 되었는데, 3월에는 이사 등으로 포스팅 올릴 시간을 잘 못 내어... ",잠만 자진 말자.,https://blog.naver.com/definitice,2021-03-31
을지로맛집 혼밥하기 좋은 백숙백반사랑방칼국수 ,https://blog.naver.com/runfriend?Redirect=Log&logNo=222373713997, 사랑방칼국수서울여행갔던날 들러본 수요미식회랑 맛있는녀석들 등등 방송에 많이 나온 맛집... 저희는 백숙백반2 개 주문했어요 칼국수도 있길래 시켜볼까하다가 뻔할거같애서 그냥 백숙백반으로 주문완료... ,져니 일상,https://blog.naver.com/runfriend,2021-05-29
오랜 시간 사랑받은 목동칼국수사랑방 손 칼국수 ,https://blog.naver.com/xclanka?Redirect=Log&logNo=222414939341,"목동사거리에 위치한사랑방 손 칼국수 라는 곳인데요. 차로 지나다니기나 하지 유동인구가 많은 곳은 아닌데, 꽤 오랜 기간 그 자리를 지키며 영업하는 곳이라 그 맛이 궁금했지요. 비교적 저렴한 주유소가... ",kkaengji :),https://blog.naver.com/xclanka,2021-06-30
"을지로 맛집]사랑방칼국수:: 맛있는 녀석들 백숙백반, 칼국수",https://blog.naver.com/lsls0108?Redirect=Log&logNo=221908001695,나는 개인적으로 계란넣고칼국수 한상차림! 상이 좁아서 메뉴 두개만 시켜도 꽉찬다ㅋㅋ 진짜 살면서 가본 식당중에 자리가 제일 불편하다 하지만 그런걸 다 감수하고 계속 찾게되는사랑방칼국수저 김치가... ,원. 투. 뜨리!,https://blog.naver.com/lsls0108,2020-04-14
백숙정식이 맛있는 곳 을지로 맛집사랑방칼국수 ,https://blog.naver.com/strowwani?Redirect=Log&logNo=222428419291,친구랑 공연 보러 가는 날 아예 연차 내고 시원하게 쉬었어요 쉬는 김에 점심도 맛있는 거 먹어보자 해서 보양식으로 선택한 을지로 맛집사랑방칼국수가게 이름에 칼국수가 들어가는데 이 집 대표메뉴는... ,버덧의 노닥거리기!,https://blog.naver.com/strowwani,2021-07-12
[을지로/맛집]사랑방칼국수 ,https://blog.naver.com/kampyzzang?Redirect=Log&logNo=222450368489,그래서 찾은사랑방칼국수 !! 백숙은 영 좋아하지 않는 분 때문에 정말 가지 않을 줄 알고 툭 던져본... 그렇게 먹었고 진짜 진짜 맛있었음 ㅠㅠ 계란칼국수 언제 또 올지 모른다는 생각에 칼국수도 하나 시켜봤음.... ,깜피는 멍멍,https://blog.naver.com/kampyzzang,2021-08-01
을지로 수요미식회 백숙 '사랑방칼국수',https://blog.naver.com/kikiao12?Redirect=Log&logNo=222452759656,"상호명은사랑방칼국수 인데 칼국수보다 백숙백반이 인기가 더 많은 이유는 몰까요? 주문한지 5분도채 되지않아 빠르게 을지로 수요미식회 백숙 한상이 차려졌어요, 기본찬은 백숙과 잘 어울리는 겉절이... ",by Churi,https://blog.naver.com/kikiao12,2021-08-01
충무로 밥집사랑방칼국수백숙백반,https://blog.naver.com/wlsgml850?Redirect=Log&logNo=222050804751,"충무로 밥집사랑방칼국수백숙백반 서울에서의 첫날, 오후가 되니 하늘에 무슨 구멍이라도 난 것처럼... 충무로사랑방칼국수 를 찾았답니다. 미슐랭 빕구르망에 소개된 백반집이라니 어떨지도 너무... ",트래블러버의 맛있는 여행,https://blog.naver.com/wlsgml850,2020-08-05
"을지로맛집, 충무로맛집 @사랑방칼국수 ",https://blog.naver.com/surin0920?Redirect=Log&logNo=222408808681, 사랑방칼국수주소 서울 중구 퇴계로27길 46 전화 02-2272-2020 영업 평일 10:30 - 21:40 재료소진시 마감... 1개당 닭 반마리라고 생각하심 되어요 칼국수는 진짜 싸네요! 티비 방영은 정말 많이 되었더라구요.... ,어니언링 수링링,https://blog.naver.com/surin0920,2021-06-26
충무로사랑방칼국수 - 충무로 노포의 멸치칼국수,https://blog.naver.com/sagak815?Redirect=Log&logNo=222144897210,일요일에도 영업을 하는 대표적인 유명 칼국숫집 하면 명동교자와사랑방칼국수 가 있습니다. 명동교자 스타일의 칼국수를 먹은 지 얼마 안 됐기도 했고 예전 포스팅을 찾아보니사랑방칼국수 를 방문한... ,사각사마는 뭘 먹고 사나,https://blog.naver.com/sagak815,2021-01-22
[충무로 맛집]사랑방칼국수 ... 닭백숙과 구수한 멸치칼국수,https://blog.naver.com/sielle83?Redirect=Log&logNo=222428717939,낮술 2차로 슬쩍 들러본 충무로 노포사랑방칼국수담백한 보양식 닭백숙도 구수한 칼국수도 할저씨 단골분들과 20대 젊은 친구들이 한 공간에서 모두 맛과 가격에 만족하며 나오는 소중한 식당 점수는 패스~,여의도 직장인 문썬의 밥상 (舊 을지로),https://blog.naver.com/sielle83,2021-07-20
을지로 맛있는 점심 ' 사랑방칼국수 ',https://blog.naver.com/han4869?Redirect=Log&logNo=222190532658,오늘은 을지로에 있는 칼국수집을 소개해 볼께요~~ '충무로명소사랑방칼국수 ' 에서 점심을 먹었었네요~~ 이 곳이 50년 전통인데다가 TV에도 많이 나온 곳이라고 하더라구요~~ 들어가는 문이 조그맣고 왠지... ,신라가 만드는 이야기,https://blog.naver.com/han4869,2021-01-03
맛있는녀석들 충무로 백숙백반 맛집사랑방칼국수 ,https://blog.naver.com/nahe0904?Redirect=Log&logNo=222180077017,먹으려했는데 칼국수는 나오려면 30분정도 시간이 오래 걸린다며 백숙백반 2인분쪽으로 주문을 유도하셔서 걍 그렇게 시켰어요 가게 이름은사랑방칼국수이지만 사실 #백숙백반 메뉴가 더 유명하니깐요 다른... ,나혜의 여행노트,https://blog.naver.com/nahe0904,2020-12-20
충무로역 백반 :사랑방칼국수(Feat. 식객 허영만의 백반기행),https://blog.naver.com/bsb7411?Redirect=Log&logNo=222507691472,상호인 칼국수 메뉴도 궁금한데 다음에 기회 되면 칼국수도 맛보러 다시 가봐야겠어요. 맛있게 잘 먹고 갑니다. 주소 : 서울특별시 중구 퇴계로27길 46사랑방칼국수전화 : 02-2272-2020 / 영업 시간 : 10:30~21:40... ,Blaack Log,https://blog.naver.com/bsb7411,2021-09-16
충무로사랑방칼국수 _가성비 좋은 백숙 백반,https://blog.naver.com/pooh0512?Redirect=Log&logNo=222175402417," 사랑방칼국수 는 칼국수도 가격대가 새삼스러운데 6,000원이 기본에 계란추가 200원 / 곱배기 200원 / 곱배기와 계란추가 400원 그래서 6,400원이 제일 비싼 칼국수 입니다. 2층도 구비되어 있네요. 저흰 1층에서.... ",시간의마법사,https://blog.naver.com/pooh0512,2020-12-16
[충무로 맛집] 닭백숙백반의사랑방칼국수 ! 찐맛집!,https://blog.naver.com/ksyljw?Redirect=Log&logNo=222014917299,"꼽는 #충무로명소 #충무로맛집 # 사랑방칼국수의 후기입니다 ㅋㅋㅋ 여기 막 인스타그램에 ㅋㅋㅋ... 1칼국수 를 주문했습니다 ㅋㅋ 빠른 속도로 셋팅되는 김치, 초장 넣어먹을 파와 함께하는 접시 끓인 차 가... ",B l o o m i n g-,https://blog.naver.com/ksyljw,2020-06-30
 사랑방 칼국수 집,https://blog.naver.com/smilan87?Redirect=Log&logNo=222348925823,칼국수가 먹고 싶다고 해서 단골집 미성칼국수로 가다가 그 골목 초입에 있는사랑방칼국수 집으로 들어갔다. 매번 지나다니면서도 이 칼국수집은 좁은 식당 안에 사람들이 바싹 붙어 앉아 식사를 하는 모습에... ,솔바람의 블로그,https://blog.naver.com/smilan87,2021-05-13
"충무로/을지로 닭백숙,사랑방칼국수 ",https://blog.naver.com/nabangee?Redirect=Log&logNo=221973739839,충무로/을지로 닭백숙 맛집사랑방칼국수백숙백반으로 입맛 돋우고 칼국수로 입가심 너무 가고 싶었던 을지로 맛집이었다 최근 을지로 방문을 자제하고 있었는데 병원 가는 날 큰 맘 먹고 다녀옴 오전에 일찍... ,당신의 주말은 몇 개 입니까,https://blog.naver.com/nabangee,2020-05-21
"맛있는녀석들 맛집, 을지로사랑방칼국수백숙백반 가성비... ",https://blog.naver.com/k940425?Redirect=Log&logNo=222336987462,"을지로 맛집사랑방칼국수#을지로맛집 #맛있는녀석들 # 사랑방칼국수#충무로맛집 #백숙백반 사실... 아 , 추가로 칼국수 드시는 분들도 계셨어요!! 다음엔 여럿 가서 ,, 여러개 먹고 오고싶다 ㅠㅠㅠㅠㅠ 아니... ",또히네 먹방일상,https://blog.naver.com/k940425,2021-05-04
[을지로/충무로 맛집]사랑방칼국수 ,https://blog.naver.com/riko_5?Redirect=Log&logNo=222070358178,#을지로맛집 #을지로 #충무로맛집 #백숙백반 #닭칼국수 # 사랑방칼국수#와플대학 2020.07.07 방문... 그리고 후식으로 와플 대학 가서 와플 1인 1접시 ㅎㅎㅎ 후식까지 맛있었다~~~~ 다음에 또 갈 거야 사랑방... ,Loveriko,https://blog.naver.com/riko_5,2020-08-25
[충무로 맛집] 사랑방칼국수 -8000원 백숙,https://blog.naver.com/hongik9016?Redirect=Log&logNo=221945652411, 사랑방칼국수주소: 서울 중구 퇴게로27길 46 전화번호: 02-2272-2020 영업시간 평일 10:30 -21:40 재료소진시 마감 토요일 10:30~21:00 일요일 10:30~16:00 #충무로맛집 #충무칼국수 # 사랑방칼국수 ,아가리파이터의 먹방,https://blog.naver.com/hongik9016,2020-05-04
백반기행 충무로 맛집사랑방칼국수백숙백반,https://blog.naver.com/cozy95?Redirect=Log&logNo=222398861465,이번에 소개할 곳은 칼국수와 백숙백반으로 유명한사랑방칼국수 입니다. 충무로 극동빌딩 뒷 골목에... 모르긴 해도 상호처럼 수십 년동안 이 골목 직장인들의 진정한 사랑방이었을 것 같습니다. 뭔진 잘... ,아포의 맛집 탐방...德 不 孤 必 有 隣,https://blog.naver.com/cozy95,2021-06-15
[을지로] 사랑방칼국수 ,https://blog.naver.com/vonozzange?Redirect=Log&logNo=222061246279,요즘은 딱히 술을 안마시지만 확실히 좋은 술안주이긴 하다ㅎㅎ 맛집갈때만 챙겨오는 명함ㅎㅎ 날씨가 쌀쌀했는데 든든하게 한끼 잘 챙겨 먹었다! #을지로맛집 #을지로핫플 # 사랑방칼국수 ,:D,https://blog.naver.com/vonozzange,2020-08-15
을지로 맛집 뿌시기( 사랑방칼국수 /79파운야드),https://blog.naver.com/namoo2181?Redirect=Log&logNo=222533779853," 사랑방 칼국수전화번호 02)2272-2020 메뉴도 백숙백반 말고도 닭곰탕, 통닭백숙, 칼국수 등등이 있었다 다음번에 한번 칼국수를 먹으러 와봐야 겠다 뼈를 담는 통이 기름기때문에 굉장히 미끌거려서... ",취준삶,https://blog.naver.com/namoo2181,2021-10-12
 사랑방칼국수- [충무로] 드디어 마침내 먹어준.. 백반기행... ,https://blog.naver.com/hjjhlee?Redirect=Log&logNo=222404319560, 사랑방칼국수 의 칼국수.. 이게 진짜 칼국수 면발.. 후루룩 먹는 일만이.. 역시나 김치와 함께.. 일행 모두가 대단한 만족도를 표한.. 백숙백반도.. 칼국수도 무한 찬사를 받은.. 충무로를 대표하는 훌륭한 맛집인... ,Smurfworld,https://blog.naver.com/hjjhlee,2021-06-23
 사랑방 칼국수 (을지로),https://blog.naver.com/babydool?Redirect=Log&logNo=222539079629,맛집사랑방 칼국수 에 들렀다 백숙백반이 정말 별미. 퍽퍽살도 맛있으면 찐으로 맛있는거 살을 한 점... 요건 칼국수. (당연히)칼국수 맛이고ㅋㅋㅋ 되게되게 맛있는데 백숙에 비하면 평범하게 느껴지는... ,mojopin,https://blog.naver.com/babydool,2021-10-16
[서울 중구]사랑방 칼국수 ,https://blog.naver.com/si09?Redirect=Log&logNo=222087322351, 사랑방 칼국수충무로 골목길 복잡하게 써있는 간판에 눈에 띄는 이집은 50년 역사의 칼국수집인사랑방 칼국수 이다. 항상 이집은 사람이 복작복작하고 가끔은 줄을 서기도 하는 맛집인것 같다. 오래된 만큼이나... ,또성일의 문화채널,https://blog.naver.com/si09,2020-09-12
충무로 / 오랜 전통의사랑방칼국수 ,https://blog.naver.com/jaedolls?Redirect=Log&logNo=222053432444,"충무칼국수, 만나칼국수,사랑방칼국수 , 충무로칼국수 등이 바로 그곳인데 어느 한곳을 고집하지 않고 번갈아가면서 맛보는 재미가 쏠쏠합니다. 충무로를 지키는 칼국숫집 4인방 중에서 오늘 찾아간 곳은 바로... ",짱똘아빠의 전국맛집들,https://blog.naver.com/jaedolls,2020-08-07
을지로 밥집사랑방칼국수부드러운 백숙백반,https://blog.naver.com/ssoya3399?Redirect=Log&logNo=222147660625,그뒤로도 몇번 오다가 오랜만에 오게된 을지로 맛집사랑방칼국수 ! 백숙백반 2개 주문함과 칼국수는 계란 추가해서 곱빼기로 ^^; 푸짐하게 먹어야 뭐든 먹은것 같고ㅎㅎ 칼국수 국물은 멸치육수로 끓인건데... ,판타스틱한 쏘야블로그,https://blog.naver.com/ssoya3399,2020-11-18
닭백숙 끓이는법 충무로 맛집사랑방칼국수닭백숙 싱크로율... ,https://blog.naver.com/femail317?Redirect=Log&logNo=222312275088,저 닭국물에 국수를 말아서 파는 것이 그 유명한사랑방칼국수 의 칼국수이다.~~ 칼국수를 1분에 말아주는 생활의달인 프로그램에 나왔던 분도 주방에서 일하고 계신다.~~ 닭한마리 삶아서 이렇게나 풍성하게... ,매일의 밥상에 감사와 즐거움~,https://blog.naver.com/femail317,2021-04-16
[을지로3가역] 맛있는녀석들도 찾아간사랑방칼국수 ,https://blog.naver.com/akqjqtk232?Redirect=Log&logNo=222235197691,[을지로3가역/충무로역] 맛있는녀석들도 찾아간사랑방칼국수서울 중구 퇴계로 27길 46 평일 10:30-21:40... 국물에다가는 칼국수를 부탁드렸어요 약간 포차에서 말아주는 국수처럼 다시 한번 새로운 음식이... ,akqjqtk232님의 블로그,https://blog.naver.com/akqjqtk232,2021-02-07
약수역맛집사랑방칼국수퇴근길 따뜻한 만두국,https://blog.naver.com/joobarious?Redirect=Log&logNo=222168180606,있어요사랑방칼국수모든 메뉴는 국내산이고 실제로 사장님이 손수 만두를 빚고 육수를 내서 만들어주는 만두가 찐입니다 상호가 칼국수인데 만두가 더 맛있다 그죠? 바지락칼국수도 한번 먹어봤는데 바지락을... ,여행같은 산행을 떠나요,https://blog.naver.com/joobarious,2020-12-09
을지로 맛집 ::사랑방칼국수- 닭백숙으로 몸보신 하기 (feat.... ,https://blog.naver.com/sily_82?Redirect=Log&logNo=222416067813," 사랑방칼국수이 집은 워낙 유명한 집이라, 다수의 맛집 프로그램에 나왔다. 내 최애 프로그램인 맛있는 녀석들에도 나옴ㅋㅋ 인기있는 점심메뉴! 통닭반마리 백숙 8000원!! 점심 한상은 요렇게 나온다. 우리는... ",베짱이 시리의 베실베실 잡동사니,https://blog.naver.com/sily_82,2021-07-01
[서민밥집]2021.7.24(토) 서울시 중구 퇴계로사랑방칼국수 ,https://blog.naver.com/sjmin52?Redirect=Log&logNo=222446387099,"운영한사랑방칼국수 , 그동안 점심식사 하러 여러 번 왔었지만 오늘은 칼국수보다는 백숙백반 한상을... 사랑방음식 특징은 옛날 옛날 우리할머니, 어머니의 손맛을 전수 재현한 순수한 우리전통... ",심건우(沈虔旴)의 순례와 여행,https://blog.naver.com/sjmin52,2021-07-26
[을지로•충무로 맛집] 닭백숙과 칼국수를 노포사랑방칼국수 에서,https://blog.naver.com/msjjfd6?Redirect=Log&logNo=222521213936,# 사랑방칼국수#을지로맛집 #충무로맛집 #을지로칼국수 #충무로칼국수 #을지로 사랑방칼국수#을지로닭백숙 #충무로닭백숙 #을지로노포 #충무로노포 #노포맛집 #오래된맛집 #노포칼국수,노래하는 먹육영,https://blog.naver.com/msjjfd6,2021-09-29
[을지로 맛집] 사랑방 칼국수 /선셋레코드,https://blog.naver.com/miniature939?Redirect=Log&logNo=222544376980,' 사랑방 칼국수 ' 지만 백숙백반이 맛있다길래 두 개 주문이요 진심 개맛있음 닭고기 이렇게 부드럽고...사랑방칼국수진짜 무 족 헌 재방문임 ;; 사실상 여기 안까먹을라고 쓴 포스팅임 선셋레코드 분위기... ,염탐가능,https://blog.naver.com/miniature939,2021-10-22
을지로 맛집 :사랑방 칼국수 ,https://blog.naver.com/mahhy?Redirect=Log&logNo=221903947181,"을지로 맛집 :사랑방 칼국수안녕하세요, 뿡뚱입니다:) 오랫만에 을지로에 갈 일이 생겨서... 너무 오랫만에 가기도했고 전에는 점심 먹으러오면 언니들이 탁탁탁 주문해줘서 백숙백반에 칼국수가 나오는지... ",뿡뚱로그,https://blog.naver.com/mahhy,2020-04-12
[맛집추천] 서울 을지로 노포집 ::사랑방 칼국수 ,https://blog.naver.com/mokwon_univ?Redirect=Log&logNo=222380604807,닭육수 버전인줄 알았는데 칼국수는 멸치육수 베이스더라고요! 그래서 그런지 닭육수 승...!!! 너무 너무 잘 먹고 왔습니다 서울 을지로 골목 노포 맛집을 가고싶은분들은사랑방 칼국수강추 ! 서울 가면 또... ,맞춤 인재를 양성하는 교육혁신대학 - 목원대학교,https://blog.naver.com/mokwon_univ,2021-06-02
을지로) 삼계탕 맛집사랑방칼국수 /위치/메뉴/솔직후기,https://blog.naver.com/spring136?Redirect=Log&logNo=222488885721,"저도 다녀왔지요사랑방칼국수외관부터 이건 찐맛집이다 ,,,, 내부는 이래요! 티비랑 신문에도 소문 쫙 !!! 한상 x 2 8000원 칼국수 6000원 스마일 ,, 오늘 월요일이니 원래 웃는 날이래요 ,,,,, 난 안웃고시퍼 ,, 짠... ",ఇ,https://blog.naver.com/spring136,2021-08-30
 사랑방손 칼국수 (부천역) feat.김영철의 동네한바퀴 부천편,https://blog.naver.com/yllom74?Redirect=Log&logNo=222228097603,"싶었는데, 사랑방 손칼국수집을 드뎌 지난 토요일 다녀왔다. 신난다 가게 입구 김영철의 동네... 멸치상자사랑방 칼국수 집의 국물을 좌지우지할 멸치 상자가 쌓여있다. 가격표 준털 잇님을 위한 지도 첨부완!!... ",물의 여행자(the hobbyRich),https://blog.naver.com/yllom74,2021-02-01
[내돈내산] 충무로 맛집 “ 사랑방칼국수 ” 진짜 대박이에요!!!!,https://blog.naver.com/gkswhfld?Redirect=Log&logNo=222504171694,안녕하세요 한쪼리에요 :) 지난 주말 충무로에서 유명하다는 # 사랑방칼국수먹으러 다녀왔습니다ㅎㅎ #충무로맛집 #충무로칼국수 # 사랑방칼국수#충무로맛집추천 제가 방문했을때 시간이 약 12시30분쯤? 였는데... ,한쪼리의 자덕생활,https://blog.naver.com/gkswhfld,2021-09-13
 사랑방칼국수백숙백반,https://blog.naver.com/august0909?Redirect=Log&logNo=222490062577, 사랑방칼국수백숙백반 백숙과 백반이 만났다는 묘한 이름에 한번 놀라고 오~랜 구력 고스란히... 소금후추에 번갈아 가며 백숙 고기 찍어 먹는 맛에 다시 한번 놀랍니다. # 사랑방칼국수#백숙백반 #을지로맛집,Morningstar,https://blog.naver.com/august0909,2021-08-31
"을지로, 충무로 맛집 -사랑방칼국수 (백숙백반)",https://blog.naver.com/jjin87915?Redirect=Log&logNo=221967080442,"나왔던사랑방칼국수메뉴는 역시 백숙백반과 칼국수가 유명하다 백숙백반을 8,000원에 먹을 수 있다니 정말 가성비 최고인 곳이다! 3명이서 가서 백숙백반 2인분과 계란 넣은 칼국수 1인분을 주문했다 짠!... ",몽키의 주절주절 :),https://blog.naver.com/jjin87915,2020-05-17
"[충무로] 사랑방칼국수 - 백반백숙, 점심식사추천, 남산가기전... ",https://blog.naver.com/lov375mile?Redirect=Log&logNo=222105661999,"앞에 보입니다 주말이지만 한산했는데 다가가보니사랑방칼국수 엔 손님이 계속 들어가서 신기했어요... 하고 여쭤보세요 칼국수 드시는 분도 계셨지만 보통은 닭과 국물, 밥이 나오는 백반백숙을 주로... ",찰나의 여행,https://blog.naver.com/lov375mile,2020-10-03
"충무로 맛집,사랑방 칼국수 ",https://blog.naver.com/bryjia?Redirect=Log&logNo=221714276255,이름이사랑방 칼국수 니 칼국수 하나 먹자고 시켰는데 제대로 시골 시장 칼국수 맛이 나더라 고춧가루 팍팍 뿌려서 칼칼하고 시원하고 밀가루가 들어가서 걸쭉한 국물까지 강남에는 왜 이런 맛집이 없는지... ,감쟈고구마,https://blog.naver.com/bryjia,2019-11-23
10月 약수사랑방 칼국수/ 사골칼국수 왕만두,https://blog.naver.com/hyunsj0421?Redirect=Log&logNo=221723969649, 사랑방 칼국수서울 중구 동호로11길 30 운영시간 매일 10:00 - 20:00 일요일 휴무 사골칼국수 왕만두 내가 잘 보는 유튜버 중에 한명 '오눅' 약수사랑방 칼국수 가 나왔다. 눈에 익은 간판! 지나갈 때마다 맨날 봤던... ,랄라라,https://blog.naver.com/hyunsj0421,2019-12-02
"을지로맛집사랑방칼국수- SINCE 1968 노포,힙지로... ",https://blog.naver.com/vegemilses?Redirect=Log&logNo=222266854252,최근 칼국수 노래를 불렀고 마침 날이 쌀쌀하니 뜨끈한 국물이 딱일 것이란 생각이 들어 방문한 을지로맛집사랑방칼국수#을지로맛집 #힙지로맛집 #충무로맛집 #을지로노포 #노포 #노포맛집 #맛있는녀석들... ,김베짱이의 기록의 중요성,https://blog.naver.com/vegemilses,2021-03-07
