title,link,description,bloggername,bloggerlink,postdate
을지로산수갑산순대국과 모듬,https://blog.naver.com/wlsgml850?Redirect=Log&logNo=222219111885,을지로산수갑산순대국과 순대모둠 작년 여름 서울에 갔을 때 하루는 명동 PJ 호텔에서 머물렀었는데요. 을지로 쪽에 맛난 순댓국집이 없을까 찾아보다가 호텔 길 건너편에산수갑산 이 떠올라 다녀왔어요.... ,트래블러버의 맛있는 여행,https://blog.naver.com/wlsgml850,2021-01-26
을지로 노포산수갑산- 대창순대 왜 이제야 먹었지,https://blog.naver.com/kizaki56?Redirect=Log&logNo=222269571329,을지로 노포산수갑산- 대창순대 왜 이제야 먹었지 안녕하세요 몽몽이에요 오늘은 정말 유명한 을지로...산수갑산맛집 좋아하시는 분들이라면 한번쯤은 들어보신 이름일 거에요. 대창순대와 함께 맛있는... ,몽몽의 먹어야 사는 블로그,https://blog.naver.com/kizaki56,2021-03-22
"을지로산수갑산 , 노포의 대창순대 포장 솔직후기.",https://blog.naver.com/queen77577?Redirect=Log&logNo=222460528528,"전부터 엄청 가보고 싶어서 지도에 픽해두었던 을지로산수갑산 은 대창순대로 굉장히 유명한 곳이에요.... 투숙했던 피제이 호텔에서 광장시장을 둘러보다가, 저녁에 먹을 메뉴는 을지로산수갑산 ! 음식을... ",마녀씨의 힐링 스토리,https://blog.naver.com/queen77577,2021-08-07
"3월 4일 오늘의 일기 (을지로산수갑산 , 오트렉)",https://blog.naver.com/gyoolejoa?Redirect=Log&logNo=222264040866,"드디어 그 유명한 # 산수갑산에 가봤다. 친구가 2년 전부터 추천했지만 가지 못했던 곳! 최자로드로도... 있었는데,산수갑산 에서 다시 일방적으로 화해했다! 혹시 ㅇㅇㅅㄱㅈㄱ이 최자가 아는 맛과 달라진 게... ",BREATHE,https://blog.naver.com/gyoolejoa,2021-03-04
일산에서도 맛볼수 있는 대창순대맛집 '을지로산수갑산 ',https://blog.naver.com/dltptkddlek?Redirect=Log&logNo=222525617142,맨뒤는 머릿고기 중간은 내장류같은데 꼬불꼬불한 처음본 부위는 손을 못댔어요 ㅋㅋㅋㅋㅋㅋ #을지로 산수갑산#일산 산수갑산#일산대창순대 전체적으로 맛은 괜찮았어요! 잡내도 안나고 부드러움!... ,"소소한 일상,",https://blog.naver.com/dltptkddlek,2021-10-04
을지로산수갑산최자로드 수요미식회에 소개된 순대국 맛집,https://blog.naver.com/nau2001?Redirect=Log&logNo=221865705959,을지로산수갑산최자로드 수요미식회 소개된 순대국 맛집 회사를 다닐때 일주일에 한번씩 꼭 먹었던... 을지로산수갑산수요미식회와 최자로드에 소개된 노포 맛집으로 이미 순대와 순댓국을 좋아하는... ,와그잡의 트래블홀릭,https://blog.naver.com/nau2001,2020-03-21
수요#224.산수갑산- 53회 '순대' 미식가이드,https://blog.naver.com/syh7021?Redirect=Log&logNo=222538856651,"수요미식회 방영 이후 을지로 일대를 벗어나 전국구 식당으로 떠오른 ' 산수갑산 '. 인근에서... 그래도,, 그나마,, ' 산수갑산 '은 골목 모퉁이에 위치해서 구조물들 사이로 찾기 쉬운 편. 그러고보니,, 간판 글씨가... ",숨돌리며 내공쌓기..,https://blog.naver.com/syh7021,2021-10-18
을지로 최자로드 순대국밥/산수갑산 ,https://blog.naver.com/rolo_ggo?Redirect=Log&logNo=222026075469,"최자로드 을지로맛집산수갑산 에서 이열치열 순대국밥! 저 순대국밥집에 혼자가서 혼밥 하는 으른. 어.... 김에산수갑산 이 생각나서 순대국밥 혼밥을 도전해보았어요! 수요미식회에도 나온 곳이라던데, 요즘은... ",하고 싶은 거 하는 중인 꿀정네,https://blog.naver.com/rolo_ggo,2020-07-09
"양념 돼지갈비 맛집, 하단산수갑산| 부산맛집",https://blog.naver.com/kainnkainn?Redirect=Log&logNo=222540298108,"하단맛집, 부산맛집, 하단 산수갑산 , 양념돼지갈비 안녕하세요. 드 네이쳐 입니다.☺️ 날씨가... 저희 가족이 좋아하는 달달 양념갈비를 먹으러 하단산수갑산 에 다녀왔어요. 양념 돼지갈비는 주기적으로... ","Hello, De Nature",https://blog.naver.com/kainnkainn,2021-10-18
을지로산수갑산 _ 순대국과 모듬이 있는 최자로드 맛집,https://blog.naver.com/soominahh?Redirect=Log&logNo=222363261323," 산수갑산#을지로맛집 #을지로순대국 #최자로드 #수요미식회 을지로 맛집으로 유명한산수갑산순대국과 순대모듬을 파는 노포이다. 유명한만큼 최자로드, 수요미식회 등 방송에도 많이 나왔다. 친구들과... ","쉼, 그리고 여행",https://blog.naver.com/soominahh,2021-05-24
부산 하단 숯불갈비산수갑산/ 갈비 맛집,https://blog.naver.com/qorwh14?Redirect=Log&logNo=222275300037,"부산 하단 숯불갈비산수갑산/ 갈비 맛집 영업시간 : AM11:00 ~ PM23:00 (Last Order PM22:00) 주말에 부산에... 11번 출구로 나와서, 횡단보도가 있는 골목(약국)으로 들어가시면산수갑산 이 나옵니다! 7시 쯤에... ",☆,https://blog.naver.com/qorwh14,2021-03-15
[내돈내먹] 을지로 맛집산수갑산순대국밥순대모듬 솔직 후기... ,https://blog.naver.com/ansu14?Redirect=Log&logNo=222454222370,안녕하세요 여러분 'ㅇ' 지난주 을지로 맛집산수갑산 을 다녀왔어요! 예전부터 한번은 가보고 싶은 곳... 편이었어요 그래서 넘무 아숩산수갑산02-2275-6654 서울 중구 을지로20길 24 매일 11:30 - 22:00... ,자급자족 다람쥐 라이프,https://blog.naver.com/ansu14,2021-08-04
[을지로]산수갑산- 순대정식,https://blog.naver.com/danbijyj?Redirect=Log&logNo=222158904063,재방문한산수갑산 . 여긴 4년도 넘어서 거의 4년반만인갑다. 그렇게 맛있다고 난리쳐놓고 계속 못간 이유는 또 가려면 진짜 일부러 가야되는데라 일부러 갔다왔다.산수갑산서울시 중구 을지로20길 24... ,장단비 블로그,https://blog.naver.com/danbijyj,2020-11-30
[부산역 포장맛집]초량골목갈비 원조 산수갑산 ,https://blog.naver.com/busantravel1?Redirect=Log&logNo=222400308325,"그리고 나의 기분,ㅋㅋ 부산역 초량역 부근에 있는 고기맛집, 원조 산수갑산갈비집을 또 찾아왔어요... ㅠㅠ 언제 와도 정겨운 이곳은 부산역 배달맛집 _ 골목갈비 원조산수갑산사장님의 인심이 좋아서 더 자주... ",부산여행특공대 공식블로그,https://blog.naver.com/busantravel1,2021-06-16
[을지로맛집]산수갑산: 순대국밥 최자로드 맛집 추천,https://blog.naver.com/collectionmc?Redirect=Log&logNo=222178663838, 산수갑산매일 11:30 - 22:00 브레이크타임 15:00-17:00 *일요일 휴무 안녕하세요 연결입니다. 오늘은 다녀온지 한달도 넘은.. # 산수갑산포스팅을 이제야 하게 되네요..! 토요일에 볼일때문에 을지로쪽을 갔다가... ,연결,https://blog.naver.com/collectionmc,2020-12-19
생활의달인 부산중구맛집 남포동갈비맛집산수갑산 ,https://blog.naver.com/99665522?Redirect=Log&logNo=222529968827,안녕하세요 찐찐잉 맛집 입니다~ #부산중구맛집 #남포동갈비맛집 #신창동맛집 #국제시장맛집 # 산수갑산산수갑산***-***-**** 주소 부산 중구 중구로24번길 21-5 영업시간 매일 11:00 - 22:00 오늘은 오랜만에... ,❣찐찐잉 찐맛집❣,https://blog.naver.com/99665522,2021-10-07
을지로산수갑산: 서울 대창순대 원탑,https://blog.naver.com/mr_white84?Redirect=Log&logNo=222505169946,2인 2만4천원에 행복 정말 푸짐하다 주변에 많은 순대집들을 가봤는데 역시산수갑산순대는 진짜... 저는 이 간을 좋아하지 않는데요산수갑산 에서는 먹습니다. 그렇게 뻑뻑하지 않아요 진짜 두터운데 그렇게... ,화이트씨의 이것저것,https://blog.naver.com/mr_white84,2021-09-15
인현동 맛집 :산수갑산- 3rd,https://blog.naver.com/bsb7411?Redirect=Log&logNo=222290226071,2차는 가까운 인현동에 위치한 유명 맛집인데요- 오랜만에 다녀온산수갑산입니다. 인현동 맛집 :산수갑산혹시나 했는데 역시나 만석 ㄷㄷ 그런데 사장님이 별관으로 안내해주시네요? 오.. 별관이... ,Blaack Log,https://blog.naver.com/bsb7411,2021-03-30
[을지로노포맛집]산수갑산순대모듬 포장 후기,https://blog.naver.com/waterhv?Redirect=Log&logNo=222518175284,"한 때 최자맛집으로 핫했던 을지로노포맛집산수갑산 입니다산수갑산 은 순대전문점인데요을지로에 위치한 나인트리 프리미어호텔명동2에서 호캉스를 했었는데, 호텔에서산수갑산 이 도보로 이동이... ",박깔쌈과 박쎄끈의 세계유랑기,https://blog.naver.com/waterhv,2021-10-11
을지로 맛집산수갑산- 생활의 달인 막창 순대 달인 : 진주... ,https://blog.naver.com/zephyr122059?Redirect=Log&logNo=222219312057,◆을지로 맛집산수갑산: 진주 해뜨는집 막창 피순대를 대신하여◆ 순대를 아주 좋아하는데... 맛집산수갑산 을 다녀왔습니다. 이 집은 피순대는 아니지만 막창 순대로는 서울 최강 수준이고 생달만 아니라... ,사랑이 밥먹여준다,https://blog.naver.com/zephyr122059,2021-01-25
을지로 맛집순대국밥집산수갑산 ,https://blog.naver.com/thejig_isup?Redirect=Log&logNo=222028250125,유명한산수갑산매번 평일에 갈때는 사진을 찍기 힘들었는데 이번에 주말에 찾아가게 되어서 카메라를 들고 살랑살랑 방문했습니다. 을지로 오랜 순댓국 맛집산수갑산11:30 ~ 22:00 (일요일 휴무) 주차공간... ,달빛바라기,https://blog.naver.com/thejig_isup,2020-07-12
을지로산수갑산 ,https://blog.naver.com/y_k89?Redirect=Log&logNo=221970280311,"을지로산수갑산최자로드, 수요미식회 등 방송 출연을 했다길래 예전부터 가보고 싶었던 곳이다. 사실... 을지로산수갑산 으로 발걸음을 돌렸다 다행히 멀지않아서 금방 도착했음 다음에 다시올게 #다전식당... ",유경월드,https://blog.naver.com/y_k89,2020-05-19
"[국밥 투어 10] 순대정식,산수갑산at 을지로",https://blog.naver.com/smoker3?Redirect=Log&logNo=221770577345, 산수갑산 의 순대정식은 리얼이었다. 브레이크 타임이 끝나는 5시 조금 넘어서산수갑산 에 도착했다. 앞에는 공사로 엉망진창이었다. 덕분에 사람들 없이 여유롭게 식사할 수 있겠군... 이라는 망상도 잠깐... ,브레인렌탈(구 마켓ing),https://blog.naver.com/smoker3,2020-01-13
"을지로산수갑산 , 아재입맛이라면 무조건 가세요",https://blog.naver.com/bbang2jjoa?Redirect=Log&logNo=221778987495,"최자로드로 유명세를 타기 전부터 너무너무 가보고 싶었던 을지로맛집산수갑산 !! 예전에도 도전한... 핫플산수갑산블루리본서베이, 망고플레이트에 인기맛집으로 선정된 서울 찐맛집산수갑산영업시간... ",빵또몽의 작은 정원,https://blog.naver.com/bbang2jjoa,2020-01-21
기다릴 필요없이 바로 먹을수 있는 을지로 산수갑산일산직영점,https://blog.naver.com/luvkell?Redirect=Log&logNo=222100281624,예전에 을지로산수갑산 을 갔었는데 줄을 정말 길게 섰었어요. 그때 한창 수요미식회에도 나오고 그리고 또 최자로드 인스타그램에도 그렇고 을지로맛집 을지로 순대국 하면 바로 나오는 곳이산수갑산 일... ,데일리 미쓰O,https://blog.naver.com/luvkell,2020-09-26
추억 속 부산 초량 돼지갈비 골목산수갑산 ,https://blog.naver.com/mphong9?Redirect=Log&logNo=222355912267,"상호 : 초량골목갈비산수갑산연락처 : ***-***-**** 주소 : 부산 동구 초량로 17-3 영업시간 : 매일 12:00~24:00... 안산수갑산 으로 향해보는데, 식당에서 나오는 조명들로 부산 초량 돼지갈비 골목길이 아주 훤히... ",부뚜막 옆 토마토,https://blog.naver.com/mphong9,2021-05-19
[고양일산동구맛집/중산동맛집]을지로산수갑산일산직영점... ,https://blog.naver.com/dnr6578?Redirect=Log&logNo=222072542387,서울에서 순대로 가장 유명한 식당 중 하나가 아닐까 싶은 을지로3가의산수갑산분점이 일산에...산수갑산 의 시그니처인 대창순대도 완전 부드럽고 촉촉한.... 역시나 대박 맛있네요. 머릿고기 퀄리티도... ,금군의 미각은 나의 힘,https://blog.naver.com/dnr6578,2020-09-09
일산 중산동 순대국 맛집 을지로 산수갑산맛나요,https://blog.naver.com/jangbi1234?Redirect=Log&logNo=222212583679,을지로 산수갑산순대국밥은 우리부부가 좋아하는 메뉴 중 하나예요 일산에서 유명하다는 순대국집은... 오빠야가 찾아?낸 일산 순대국 맛집 을지로 산수갑산(20년7월방문) 을지로에서 이미 핫한 맛집이라고... ,"라라영,DAY",https://blog.naver.com/jangbi1234,2021-01-19
서울 을지로 맛집 최자로드 픽 순대가 일품인산수갑산 ,https://blog.naver.com/marinmo?Redirect=Log&logNo=222481626315,순대맛집인산수갑산 에 방문해보았다. 재정비 시간이후 재오픈이 오후 다섯시인데 좀 어정쩡한 다섯시... 픽산수갑산 의 위력을 세삼 느낌수 있었다. #을지로맛집 #서울순대맛집 #을지로순대맛집... ,성의없는블로그,https://blog.naver.com/marinmo,2021-08-23
을지로 노포산수갑산 ,https://blog.naver.com/wcd0713?Redirect=Log&logNo=222327542776,이번에 제가 다녀 온 곳은 을지로 맛집 을지로 노포 로 유명한 을지로 노포 맛집산수갑산 을 다녀... 노포산수갑산다녀 왓습니다. 허허 최자로드에 있다고 하던데 조금 기대가 됩니다. 을지로 노포 맛집... ,밥은먹고살쟈,https://blog.naver.com/wcd0713,2021-04-29
일산 순대국 방문후기 을지로 산수갑산일산직영점,https://blog.naver.com/demis1999?Redirect=Log&logNo=222010719307,일산순대국산수갑산후기를 써볼까합니다. 35년전통의 아바이 대창 찹쌀 순대 전문점인산수갑산 은 수요미식회에서도 방송됐던 순대맛집인데요 얼마전 일산직영점을 중산동에다 오픈을 했어요. 본점인... ,발품의여왕,https://blog.naver.com/demis1999,2020-06-24
순대는 이래야지...(을지로산수갑산 ),https://blog.naver.com/sirehan?Redirect=Log&logNo=222516413799, 산수갑산 은 단아 할아버지가 소싯적 청계천에서 구두공장을 다니면서 드나들었던 맛집이다. 이곳은 원래 개인 살림집 같았고 방도 있었는데 죄다 테이블로 바뀌어서 뭔 일인가 했다. 알고 보니 몇년전에 어떤... ,우당탕탕 초보 투자자 생존기,https://blog.naver.com/sirehan,2021-09-25
범어사 오리고기 맛집 :산수갑산댕겨와봤어요~,https://blog.naver.com/lhj8735?Redirect=Log&logNo=222536213381,"오리고기집 ' 산수갑산 ' 을 간단하게 리뷰~해볼려고해용 !!! 되게 막 꼬부랑꼬부랑~ 좀 잘... 더팜471 카페입니다 ㅎ산수갑산 이랑 매우 가까워요 ^^ 그래서 먹고 바로 요기로 커피 + 디저트 드시러 가시면 될 듯, ㅋ... ","Hello , Bannie ''*",https://blog.naver.com/lhj8735,2021-10-13
일산 을지로산수갑산순대국밥,https://blog.naver.com/aisama2?Redirect=Log&logNo=222078912263,"일산 을지로산수갑산 에 순대국밥 먹으러 다녀왔는데요 수요미식회, 생활의 달인, 최자로드, 관찰카메라 24 티브이 방송에도 많이 소개되었던 식당이래요 최자로드 순대국밥 맛집산수갑산본점은 을지로 3, 4가... ",♬ 한번뿐인 오늘하루,https://blog.naver.com/aisama2,2020-09-03
빛이 좋았던 토요일 오후 5시 을지로산수갑산순대정식... ,https://blog.naver.com/akabutton?Redirect=Log&logNo=222309131798,추운 겨울 초절정 고수님과산수갑산 을 다녀온게 엊그제 같은데 벌써 그게 4년전하고도 3달 전이라고 한다 시간이 빠르긴 엄청나게 빠르네. 중앙시장에서 명란젓을 사고 혹시나하고 을지로3가산수갑산 을... ,Makes Me Wonder,https://blog.naver.com/akabutton,2021-04-14
을지로 순대국 맛집산수갑산수유미식회 최자로드,https://blog.naver.com/skh011?Redirect=Log&logNo=222270672029,최자로드에 소개된 맛집이라 맛으로는 인정받은 식당입니다. 순대국에 밥을 말아서 깔끔하게 한그릇 비웠읍니다. 을지로 순대국 맛집산수갑산을지로에 가시는 분들중에 순대국이 땡기시는 분들은 고고 하세요~~,지붕공사 옥상방수 신가기와,https://blog.naver.com/skh011,2021-03-10
일산 순대국 맛집 을지로 산수갑산테이크아웃~,https://blog.naver.com/nana6120?Redirect=Log&logNo=222009765816,오늘은 일산 순대국 맛집 을지로 산수갑산일산본점으로 넘어가 보겠습니다. 일단 보시는 것처럼... 일산 순대국 맛집 을지로 산수갑산주방도 오픈 주방이라서 앞에서 조리하는 과정을 지켜볼 수가 있어서 더욱... ,바람휘이님의 블로그,https://blog.naver.com/nana6120,2020-06-23
을지로산수갑산- 우래옥 평양냉면 - 망원동 빙하기... ,https://blog.naver.com/essaystore?Redirect=Log&logNo=222452737796,la에서 몇년만에 한식대장님이 와서 광장시장과 을지로에 한식컬렉팅하러 나옴 을지로4가산수갑산.산수갑산 에서 포장은 첨해봤는데 맛있는건 포장해와도 맛있고bb 요즘 청와옥에 꽂혀있었어서산수갑산 ... ,ESSAY,https://blog.naver.com/essaystore,2021-08-01
"을지로 맛집 순대,머리고기 좋아한다면산수갑산 ",https://blog.naver.com/ngs7026?Redirect=Log&logNo=222277404293,"워낙 유명한 을지로 맛집이죠,산수갑산 ! 삼겹살 랩소디, 최자로드, 수요미식회 등에 소개된 곳이고... 윤기가 좌르르 흐르는 고기들~ 을지로 맛집 중에서 제대로 된 노포식당 찾고있다면산수갑산완전... ","Sunny place, Here :D ♡",https://blog.naver.com/ngs7026,2021-03-16
국제시장 돼지갈비 맛집산수갑산 ,https://blog.naver.com/lamades?Redirect=Log&logNo=222534753566,생활의 달인 700회차에 출연한 부산 맛집 국제시장 돼지갈비 맛집산수갑산 에 방문하였습니다산수갑산51-231-7455 주소 부산 중구 중구로24번길 21-5상 영업시간 매일 11:00 - 22:00 마지막주문(Last Order) 21:30 부산... ,최고의 맛-The Best Taste,https://blog.naver.com/lamades,2021-10-12
경기/일산 : 을지로산수갑산일산직영점 / 대창순대 맛집... ,https://blog.naver.com/mmeesss?Redirect=Log&logNo=222330511440, 산수갑산일산직영점 경기 고양시 일산동구 약산길 52 1층 매일 11:00 - 22:00 화요일 휴무 주말에 일산 나들이 할겸 내장러버인 나는 너무너무 좋아하는 대창순대를 먹으러 다녀왔다 :)) 을지로에 있는산수갑산 은... ,므라다,https://blog.naver.com/mmeesss,2021-05-01
을지로 수요미식회에 나온 순댓국밥집 ' 산수갑산 ',https://blog.naver.com/han4869?Redirect=Log&logNo=222176659047,을지로 맛있는 순대국집 '산수갑산 ' 안녕하세요. 이웃님들~ 주말 잘 보내고 있으시지요? 오늘도 여전히... 있는 ' 산수갑산 '이라는 이름의 순댓국밥집입니다.. 순댓국밥에 내용물이 참 많이 들어있는 곳이에요... ,신라가 만드는 이야기,https://blog.naver.com/han4869,2020-12-20
을지로산수갑산수요미식회 대창순대,https://blog.naver.com/smh3850?Redirect=Log&logNo=222421775382,"을지로산수갑산평일에도 줄서서 먹어야 할만큼 유명한곳, 아는 사람은 다 아는 을지로 찐맛집산수갑산 ! 사실 다녀온지는 꽤 오래됐는데 생각나서 올리네요 제가 방문한 평일 저녁에는 웨이팅 엄청 길었어요!... ",머무름 기록,https://blog.naver.com/smh3850,2021-07-06
[을지로]산수갑산 ,https://blog.naver.com/skylight_blu?Redirect=Log&logNo=222208926706,길을 따라 쭉 걸어가면 산수갑이 나온다 아니산수갑산복층 구조의 좁은 실내 새해에도 변함없는... 기준산수갑산 의 순대 정식은 이렇게 밥과 국물이 순대를 포함한 각종 부속물과 따로 나온다 돼지 뼈와... ,초보 한의사 시기의 블로그,https://blog.naver.com/skylight_blu,2021-01-16
" 산수갑산, 수수수수순순댓국 맛집",https://blog.naver.com/digiphk12?Redirect=Log&logNo=222539103898,오늘 소개할 음식점은산수갑산입니다 .산수 갑산 의 위치는 바로바로 여기있습니다! 자 그러면 진지하게 입구부터 보실까요. 제가 도착한 시각은 19:00 ( 오후 7시 ) 였습니다. 이 시간에도 사람들이 많아서 조큼... ,내일을 위한 일기장,https://blog.naver.com/digiphk12,2021-10-16
을지로 맛집산수갑산술한잔하러 방문~ 솔직후기!,https://blog.naver.com/bfuns?Redirect=Log&logNo=222130159915,아는 동생과 술약속이 잡혀서 오랜만에 을지로에 갔어요~ 예전부터 을지로 맛집산수갑산꼭 가보고 싶었는데 이참에 방문하게 됐습니다 을지로 맛집산수갑산별관과 본관이 있는데 본관으로 입장~ 포장손님도... ,bfuns 블로그,https://blog.naver.com/bfuns,2020-10-29
을지로 순대 국밥 맛집산수갑산후기 - 내가 찐 아재... ,https://blog.naver.com/sk5816?Redirect=Log&logNo=222272520567,소개할산수갑산 이다. 매일 11시 30분 - 22시 영업 브레이크 타임 15시 - 17시 (칼같이 준수) 벼르고 별러서 마침내 찾아간산수갑산순대 국밥이 유명한 곳이라고 해서 계-속 가봐야지 하면서 차일피일 미루다가... ,기억을 위한 기록,https://blog.naver.com/sk5816,2021-03-12
하단 맛집 :산수갑산숯불갈비 솔직후기,https://blog.naver.com/sugary_rose?Redirect=Log&logNo=222538695642,"무엇을 먹을지 고민하다 양념돼지갈비 맛집이라는산수갑산숯불갈비에 방문했다. 신기하게 웨이팅 예약하자마자 우리 팀 뒤로 웨이팅이 쭉 생겼다. 아 이런 곳이 맛집이구나! 싶었다. 돼지갈비, 삼겹살은... ",sugary_rose,https://blog.naver.com/sugary_rose,2021-10-16
을지로산수갑산순대정식,https://blog.naver.com/dldbswn9540?Redirect=Log&logNo=221808252443,"을지로산수갑산 으로 저녁을 먹으러 갔다. 그냥 순대가 먹고 싶어서 방문한 집인데, 웨이팅이 우리... #을지로 # 산수갑산#을지로순대 #순대정식 #을지로순대국 #이바이순대 #을지로맛집 # 산수갑산 순대정식... ",안녕 내 이름은 눙눙이야,https://blog.naver.com/dldbswn9540,2020-02-14
[을지로맛집]산수갑산대창순대,https://blog.naver.com/pigsuk1111?Redirect=Log&logNo=222534663879,#을지로노포 # 산수갑산#대창순대 울신랑이 검색으로 찾은 곳 을지로에 이런 곳이 있었다니^^ 옛날... 양배추 /고추 # 산수갑산 술국 #술국 션하고 좋구나 # 산수갑산 순대모듬 #순대모듬 # 산수갑산 대창순대 #대창순대... ,쑤기의 라온하제,https://blog.naver.com/pigsuk1111,2021-10-12
을지로맛집 최자로드산수갑산 ,https://blog.naver.com/up519?Redirect=Log&logNo=221855391556,최자로드로 유명한 힙스터들의산수갑산#최자로드 #수요미식회 이미 유명해질데로 유명해진 을지로산수갑산 . 오후5시오픈인데..이미 줄이 어미어마했다. 이날은 비까지 왔었는데 말이지.. 오픈할때까지... ,PUDDING,https://blog.naver.com/up519,2020-03-15
오늘] 을지로3가맛집] 이런집이 진짜맛집 순대전문점산수갑산 ,https://blog.naver.com/jsjung1999?Redirect=Log&logNo=222434620651,9년 전 오늘 을지로3가맛집] 이런집이 진짜맛집 순대전문점산수갑산인현 상가 부근의 순대국집.. 과거에 유명했던 알래스카 순대집 부근인데.. 이제는산수갑산 이 이동네선 으뜸인듯.. 저녁에 날이 선선하면... ,양배추님 잘먹고 잘살기,https://blog.naver.com/jsjung1999,2021-07-17
을지로산수갑산일산 직영점,https://blog.naver.com/kaori1052?Redirect=Log&logNo=222038269864,"대창순대와 순댓국으로 유명한 을지로의산수갑산 이 드디어 지점을 냈다는 소문을 듣고 나름 먼 길을... 곳,산수갑산 의 순댓국에는 순대 모둠에 있던 대창 찹쌀 순대도 들어 있고 병천순대 스타일의 소창 순대도... ",둥글둥글 쭈구리 뿡뿡,https://blog.naver.com/kaori1052,2020-07-22
[ 을지로맛집 ]산수갑산 ,https://blog.naver.com/ehoajdcnd?Redirect=Log&logNo=222007308643,#을지로 산수갑산# 산수갑산#을지로맛집 #최자로드맛집 #수요미식회_순대맛집 #을지로노포맛집 [ 을지로 맛집 ]산수갑산나의 먹킷리스트 메이트 준짱과 이번에는 #을지로맛집 또는 #최자로드순대맛집 또는... ,이웃집 금금이의 지극히 개인적인 공간 ˙Ⱉ˙,https://blog.naver.com/ehoajdcnd,2020-06-21
"을지로 맛집 :: 힙지로의 시작, 대창 순대 ' 산수갑산 '",https://blog.naver.com/ungsblue?Redirect=Log&logNo=221672802508,"순대라고 하면 어디를 가야 하나 고민할 것도 없이 을지로의산수갑산 이다. 수요미식회, 최자로드를 비롯하여 유명 맛집 인플루언서들의 지지를 한 몸에 받는 곳.산수갑산주소 : 서울시 중구 을지로20길 24... ",크리에이티브를 위한 축적의 시간,https://blog.naver.com/ungsblue,2019-10-10
