title,link,description,bloggername,bloggerlink,postdate
초량갈비산수갑산에서맛있게저녁을 먹었어요,https://blog.naver.com/maya2000hsh7?Redirect=Log&logNo=222100667692,초량갈비산수갑산이란곳인데 저도사실이골목 처음입니다 부산이렇게오래살면서... 초량갈비산수갑산의양념맛이 꽤나맛있더라구요 오랜만에먹어서 더그런것도있고 부담스런식사가아니었습니다 저의... ,웰그린 부동산정보,https://blog.naver.com/maya2000hsh7,2020-09-27
대구종로밥집평범한 점심한상산수갑산 ,https://blog.naver.com/hikhi?Redirect=Log&logNo=222424769468,깍두기 위장술이 펼치고 있는 감자조림산수갑산 에서 가장 마음에 들었던 메뉴가 생선구이 가 두종류가 제공되는것입니다. 고등어 한토막은 후라이팬에 아주 자글자글 잘 구워서 내주셨더군요 기름지면서... ,바람돌이의 맛난집을 찾아서,https://blog.naver.com/hikhi,2021-07-12
을지로 맛집산수갑산순대국밥 아바이순대,https://blog.naver.com/sjmcdib1?Redirect=Log&logNo=221978559397,#을지로 산수갑산순대국집! 을지로산수갑산을지로 맛집산수갑산앞에 도로에서 공사가 진행중이에요. 간판도 잘 안보이고 그래서 찾기가 좀 어려워요. 간판도 옛날에 쓰던 그런 간판이에요 간판을 보면... ,꿈꾸는제이엠,https://blog.naver.com/sjmcdib1,2020-05-26
[을지로맛집] 을지로 최자로드 순대 맛집 :산수갑산 ,https://blog.naver.com/qls1021?Redirect=Log&logNo=222219184161,"안녕하세요:) 을지로 순대 맛집산수갑산 에 다녀왔어요산수갑산 은 을지로 최자로드, 수요미식회 순대 맛집으로 소개된 유명 맛집이에여~~ 평일 퇴근시간에 가서 그런지 직장인도 많았고 아자씨들도 많아따... ",디티의 하루,https://blog.naver.com/qls1021,2021-01-25
초량동 돼지갈비 골목산수갑산골목갈비,https://blog.naver.com/daisykim1987?Redirect=Log&logNo=221908552233,초량 돼지갈비산수갑산골목갈비 #초량돼지갈비골목 은 이미 부산에서 유명한 맛집골목인데 그중에서도 우리는 매번 # 산수갑산 골목갈비 에 갑니다. 이미 이 골목에 아무곳이나 가도 다 몇십년 이상 되어서... ,도하네 맛있는이야기,https://blog.naver.com/daisykim1987,2020-04-14
〔을지로〕 ' 산수갑산 ' 설명하면 입만 아픈 집 아닌가?,https://blog.naver.com/sihyo29?Redirect=Log&logNo=222488314479,★★★ # 산수갑산서울시 중구 을지로20길 24 02-2275-6654 매일 11:30 ~ 22:00 브레이크타임 15:00 ~ 17:00 일요일... 과연산수갑산 은 어떨는지요? 을지로를 관통하는 세운 상가부터 진양상가 라인에 수많은 수십 년 된 맛... ,기미상궁이라 하옵니다.,https://blog.naver.com/sihyo29,2021-08-30
부산 하단 돼지갈비 맛집산수갑산후기요!,https://blog.naver.com/pinkbabyyyy?Redirect=Log&logNo=222352908808,"내 앞에 대기팀이 5팀 있어서 근처 걸어다니면서 다음 먹을 곳을 탐색 아귀찜,돌곱창,수많은 고기집이 많더라고요 유독산수갑산 이 사람 많은거 같아요 ㅠ.ㅠ 사람은 엄청 많았고 가게가 그렇게 크진 않았어요... ",안경은 얼굴,https://blog.naver.com/pinkbabyyyy,2021-05-16
"[하단/동아대 맛집]산수갑산 , 양념고기 맛집",https://blog.naver.com/lee_2yagi?Redirect=Log&logNo=222541333466," 산수갑산숯불갈비 11:00-23:00, 주차장 없음 지난주 금요일 보고싶은 친구와 급 만남을 갖고 하단에서 꽤 유명하다는 양념고기맛집산수갑산 에 다녀왔다. 사실 고깃집이 너무 많길래 어딜가지?_? 하고 있었는데... ",팡 이즈 웰,https://blog.naver.com/lee_2yagi,2021-10-19
을지로맛집 찐이네산수갑산 ,https://blog.naver.com/sd170?Redirect=Log&logNo=222146772055," 산수갑산서울 중구 을지로20길 24 02-2275-6654 매일 11:30 - 22:00 브레이크타임 15:00-17:00 일요일 휴무 여기는 정말 지도에 저장해놓고 언제갈 수 있나,,,, 언제 가나,,,,를 기대하던 곳 tv에서 우연히 본 뒤로... ","가장 나답게, 가장 나다운",https://blog.naver.com/sd170,2020-11-18
 산수갑산 (山水甲山)과 삼수갑산(三水甲山),https://blog.naver.com/eekj01?Redirect=Log&logNo=222409580811,◐ 산수갑산 (山水甲山)과 삼수갑산(三水甲山)◑ 우리가 사용하는 말 중에서 삼수갑산(三水甲山)이란... (三水甲山)을산수갑산 (山水甲山)으로 잘못쓰고 있는데 이는 우리말 ‘산수(山水)’ 때문이 아닌가 싶어요.... ,돌담장 너머...,https://blog.naver.com/eekj01,2021-06-25
을지로산수갑산 _오랜 세월의 깊은 맛!,https://blog.naver.com/pooh0512?Redirect=Log&logNo=221763989229,# 산수갑산매일 11:30 열고 22:00에 닫아요 브레이크 타임 15:00 - 17:00까지 있음 일요일은 휴무 add_서울 중구 을지로20길 24 tel_02-2275-6654 오랜만에 을지로산수갑산 을 다녀왔습니다. 3번째 리뷰이기도 한데.... ,시간의마법사,https://blog.naver.com/pooh0512,2020-01-08
아산 곡교천 은행나무길 쭈꾸미전문산수갑산 ,https://blog.naver.com/fancycat1?Redirect=Log&logNo=221883671692,은행나무길산수갑산아파트 게시판에산수갑산 이라는 식당에서 쭈꾸미를 저렴하게 판매한다는 팜플렛을 보고 저녁메뉴로 결정하고 포장구매하러 고고씽~^^ 삼시세끼를 차리다보니 간편식을 안찾을래야... ,야옹이네의 소소한 일상,https://blog.naver.com/fancycat1,2020-03-31
삼겹살랩소디 을지로산수갑산 ,https://blog.naver.com/brandkim?Redirect=Log&logNo=222285305143, 산수갑산 은 박찬일 세프가 방송팀에 소개해서 나왔던 식당이다. 삼겹살 랩소디 방송 당시 너무 먹음직스럽게 촬영이 되어서 언제 한번 가봐야겠다고 생각했는데 마침 명동성당에서 누굴 만났더니산수갑산 에... ,식육 마케터의 고기에 대한 예의 (食肉禮儀),https://blog.naver.com/brandkim,2021-03-23
"[ 산수갑산 ]을지로맛집... 서울순대국밥맛집,을지로 산수갑산 ",https://blog.naver.com/tnwl3801?Redirect=Log&logNo=222280834003,"힐링푸드 순댓국 러버로써,,, 당연히 항상 순킷리스트 (순댓국버킷)산수갑산드디어 왔구요 3호선 을지로3가역 7번 출구 근처! 을지로 맛집 :산수갑산주소 : 서울 중구 을지로20길 24 영업시간 : 매일 11:30 - 22... ",-,https://blog.naver.com/tnwl3801,2021-03-19
[서울 중구]산수갑산 ,https://blog.naver.com/si09?Redirect=Log&logNo=222257986178, 산수갑산입구 순댓국으로 유명한산수갑산 을 방문해봤다. 오래된 노포중하나라 단골손님이 많은 곳이다. 역시 방문했을때도 손님이 많아 기다리다 입장할수 있었다.산수갑산메뉴판 기존의 가게와 옆의... ,또성일의 문화채널,https://blog.naver.com/si09,2021-02-26
"최자로드! 을지로 막창순대,산수갑산 ",https://blog.naver.com/god9470?Redirect=Log&logNo=221909096615,모두가 맛있게 먹을 수 있는 곳을 찾다가 최자로드로 유명한 을지로산수갑산 으로 향했다. 앞에가 공사 중이라 정신이 없어서 간판을 못찍었다(..) 아무튼 을지로산수갑산 은 최자로드로 알려져 있지만... ,Make today awesome,https://blog.naver.com/god9470,2020-04-15
[을지로3가역 맛집] 산수갑산 _2021/08/18/Wed.,https://blog.naver.com/shc4883?Redirect=Log&logNo=222499101226, 산수갑산아마 최자로드에서 봤던 거 같다. 대창순대?...? 그게 뭘까 호기심이 있었고 맛있어보였다.... 맛있게 음식과 술 한잔 한산수갑산#을지로맛집 #맛집 #을지로 # 산수갑산#순대모듬 #순대 #술한잔,archi_d_j,https://blog.naver.com/shc4883,2021-09-08
부산중구 맛집 50년 전통의 숯불돼지갈비산수갑산 ,https://blog.naver.com/lovelyoonee?Redirect=Log&logNo=222539114542,오랜만에 남자친구랑 남포동 데이트♡ 골목 골목 여기저기 누비며 돌아다니다 저녁 먹으러 남포동갈비맛집 # 산수갑산고고!산수갑산 은 50년이 넘은 숯불돼지갈비 맛집이에용! 생활의 달인에도 출연한 남포동... ,유니 하우스,https://blog.naver.com/lovelyoonee,2021-10-16
[중구/을지로]산수갑산2020.08.06,https://blog.naver.com/polysim7?Redirect=Log&logNo=222065386350,곳은 # 산수갑산수요미식회에도 최자로드에서도 소개됐던 곳 서울 중구 을지로20길 24 (인현동1가 15-4) 02-2275-6654 매일 11:30-22:00 브레이크 타임 15:00-17:00 일요일은 휴무 그나저나 쌀국수랑도 깊은 고민을... ,시매찌의 맛내음솔솔,https://blog.naver.com/polysim7,2020-08-20
하단산수갑산숯불갈비,https://blog.naver.com/o077777?Redirect=Log&logNo=222542007348,"달달한 돼지갈비 먹고싶은 날, 하단산수갑산리모델링하고 옛날 느낌 없지만 ㅋㅋㅋㅋㅋ 깔끔해져서 더 좋긴함ㅋㅋㅋㅋ 메뉴- 양념돼지갈비, 된장찌개, 공기밥, 비빔냉면 주문 ◡̈ 익숙한 상차림 ㅋㅋㅋㅋㅋ... ",찬란한 일상이거나,https://blog.naver.com/o077777,2021-10-19
"[을지로]산수갑산 , 순댓국! 그리고 모둠순대!",https://blog.naver.com/kolae666?Redirect=Log&logNo=221860951371,"[을지로]산수갑산 , 순댓국! 그리고 모둠순대! 작년 9월쯤 다녀왔습니다. 사진 현상 및 스캔겸 해서 을지로 나왔다가 샤님을 만나고 식사 한끼 해봅니다. 목적지는산수갑산 . 한참 샤님이 감기로 갤갤거릴... ",제이슨님의 세상유랑기,https://blog.naver.com/kolae666,2020-03-19
곰배령산수갑산 에서,https://blog.naver.com/doamtak?Redirect=Log&logNo=222542699676,단풍이 예전만 못하네요 추위에 얼어붙은 낙엽이 많이 보입니다 계곡의 물은 수량이 많아 물소리가제법 커 보이네요 강선리 에서 산나물전에 막걸리 한잔 숙소는 친구분이 하는산수갑산 에서 부부의 정성스런... ,도안댁 시골살이,https://blog.naver.com/doamtak,2021-10-20
맛집로드 52 서울/을지로 이것이 을지로다 -산수갑산 ,https://blog.naver.com/yuiwang3?Redirect=Log&logNo=222033160678,이게 을지로다산수갑산안녕하세요. 호돈신입니다. 날도 더운 날에 이 더위를 뚫고 용케도 을지로의산수갑산 에 다녀오게 되었습니다. 다행히도 5분정도의 웨이팅 후 들어갈 수 있었는데요. 이 날은 날이 더워서... ,호돈신,https://blog.naver.com/yuiwang3,2020-08-16
충주 연수동산수갑산삼겹살,https://blog.daum.net/paaaaak/800,넙쩍이 만나가꼬 삼겹살 먹자고 해서 어디를 갈까 하다가산수갑산감. 백반식당이라서 반찬... 11 충주 연수동산수갑산삼겹살 (0) 2021.04.11 광주 금호지구 왕코등갈비 (0) 2021.04.11 충주 연수동... ,수신차단,https://blog.daum.net/paaaaak,2021-04-11
1410번째 식당 / 황성집 / 중림:산수갑산 의 순대를 넘어,https://blog.naver.com/tastesherlok?Redirect=Log&logNo=221568061362,모듬순대 순대국 즉석블루베리주스 서울 노포 순대의 대명사가 된산수갑산 의 맛이 이제는 아쉽다면... 샤퀴테리와 와인에 필적할 이곳만의 조합이다. 한줄평:산수갑산 의 순대를 넘어 ★ ★ ★ ★,미식탐정,https://blog.naver.com/tastesherlok,2019-06-22
부산 국제시장 맛집 남포동산수갑산숯불 돼지갈비 맛 JMT,https://blog.naver.com/kikihui?Redirect=Log&logNo=221522253772,바로바로 #부산국제시장맛집산수갑산부산시 중구 중구로 24번길 21 오전 11시 ~ 오후 10시 월요일 휴무... 남포동산수갑산고기집은 돼지갈비전문점으로 돼지갈비에 특허까지 등록되어 있다고 하니깐 그 맛이... ,떵이의 하루,https://blog.naver.com/kikihui,2019-04-25
인현동 맛집 /산수갑산: 을지로 명불허전의 순대집,https://blog.naver.com/begopa1092?Redirect=Log&logNo=221374594971,한글날 오후 급 순대가 땡겨 들렀던 을지로산수갑산브레이크타임 지나고 5시10분쯤 갔더니...산수갑산 의 전매특허 부드러운 간... 아흐.. 어찌나 부드럽고 고소하던지 정말 신기방기하다 암뽕 술안주로... ,eye of the beholder,https://blog.naver.com/begopa1092,2018-10-16
"순대 맛집 을지로산수갑산 , 모듬순대와 순대국 흡입후기",https://blog.naver.com/dndbwodnjs?Redirect=Log&logNo=221345542714,진정한 순대를 먹어보려면 꼭 가봐야 한다는 순대맛집 순대 마니아들의 성지 을지로산수갑산오래... 을지로산수갑산 에 들렀지요 순대를 그날그날 만들어서 팔아서 재료가 일찍 떨어질까봐 마음 졸이며 도착... ,지봉공쥬,https://blog.naver.com/dndbwodnjs,2018-08-26
수요미식회 최자로드 을지로산수갑산 ,https://blog.naver.com/z2417?Redirect=Log&logNo=221064975637,수요미식회 최자로드 을지로산수갑산수요미식회에 나왔던산수갑산 . 꼭 가보고 싶어서 체킷체킷 해놨는데 최자로드에 소개되면서 원래 인기 많았던 곳이 더 인기가 많아졌다.대기표 없이 그냥 밖에서... ,기록저장소,https://blog.naver.com/z2417,2017-08-02
을지로3가역 수요미식회 대창순대 맛집 ' 산수갑산 ',https://blog.naver.com/postman6666?Redirect=Log&logNo=221568103061,"맛집 ' 산수갑산 '입니다. 여름날 가게 앞에 플라스틱 테이블들이 정겹게 펼쳐지곤 하죠. 내부는 오래된... 을지로, 충무로 맛집 ' 산수갑산 ' 메뉴판. 순대국밥은 7,000~8,000원, 안주용 순대모둠은 2만원입니다.... ","""술맛이 달다, 오늘만 같아라 :)""…술과 달달한 인생",https://blog.naver.com/postman6666,2019-06-22
을지로산수갑산: 순대모듬 -을지로노포,https://blog.naver.com/mina2165?Redirect=Log&logNo=221502293245,을지로산수갑산: 순대모듬 -을지로노포 세운상가 쪽에 있는산수갑산최자덕에 알게되었음. 을지로에 노포가 많은데 골목골목에 있어서 잘 모름. #을지로노포 # 산수갑산웨이팅 없이 들어감. 점심시간이어서... ,나의 기록저장소,https://blog.naver.com/mina2165,2019-04-14
 산수갑산-을지로 순대,https://blog.naver.com/clala70?Redirect=Log&logNo=221441426779," 산수갑산 . 수요미식회에 나왔다는 순대집입니다. 내장류는 잘 못먹는데도 순대는 늘 먹고 싶은 종목입니다. 이 날;;; 오랜만에 을지로 탕탕탕회가 성사되었던 날이네요. 1탕은 두리가, 2탕은산수갑산 , 3탕은... ",클라라의 즐거운 맛집,https://blog.naver.com/clala70,2019-01-14
 산수갑산 ,https://blog.naver.com/sunga114?Redirect=Log&logNo=221087237832,"을지로 인근 행정구역 상 인현동에 위치한 순대 전문점 '산수갑산' 맞춤법으로는 삼수갑산이 맞지만, 이산수갑산 이라는 식당이 가지는 존재감이 뚜렷해서 이젠 오히려산수갑산 이 좀 더 입에 붙는 단어가... ",쏘오 딜리셔스,https://blog.naver.com/sunga114,2017-09-01
[을지로 맛집]산수갑산 ,https://blog.naver.com/sarah7908?Redirect=Log&logNo=221448807372,[을지로 맛집]산수갑산동대문에서 외근을 끝마치고 같이 작업하시는 분과 함께 갔던산수갑산 입니다. 주변에 순댓국을 같이 먹을 사람이 몇 명 있긴 한데 이날을 기점으로 한 명 더 추가되었지요...^^; 줄 서기... ,호박이 영그는 곳,https://blog.naver.com/sarah7908,2019-01-23
을지로산수갑산 ,https://blog.naver.com/leekh8412?Redirect=Log&logNo=220984031503,2017/04/15 을지로에 위치한 순댓국 전문점산수갑산오랜만에 찾아간 을지로의 대표 순댓국 전문점산수갑산수요미식회에 소개된지는 꽤나 오랜 시간이 흘렀지만 여전히 많은 손님들이 찾고있는 곳이다.... ,Eating & Traveling,https://blog.naver.com/leekh8412,2017-04-15
"힙지로! 을지로 맛집산수갑산 ,을지로사색와인바",https://blog.naver.com/prime0823?Redirect=Log&logNo=221599552234," 산수갑산갔다가 요즘 떠오르는 힙지로인 을지로와인바사색까지 다녀오기 ღ 저번에 하얏트... 순대다운 순대, 을지로산수갑산산수갑산#을지로맛집 #순대맛집 #수요미식회맛집산수갑산주소 : 서울시 중구... ",지봉이의 골든타임,https://blog.naver.com/prime0823,2019-07-30
서울맛집 을지로산수갑산 ,https://blog.naver.com/honeypen?Redirect=Log&logNo=220905212206,"미미님께서 맛난거 쏘신다고 해서 그녀가 먹고싶다는 을지로산수갑산 으로~ 을지로는 집앞에서... 유명한산수갑산 입니다. 실내는 이런 분위기. 딱 한자리 남아서 럭키! 2층하고 룸도 있고, 야외좌석도 있어요.... ",어질賢 아름다울美,https://blog.naver.com/honeypen,2017-02-06
을지로산수갑산 _뭉근한 세월의 맛을 녹인 오래된 노포... ,https://blog.naver.com/pooh0512?Redirect=Log&logNo=221391736304,# 산수갑산매일 11:30 열고 22:00에 닫아요 브레이크 타임 15:00 - 17:00까지 있음 일요일은 휴무 add_서울... 오랜만에산수갑산 이 버뜩 생각이 나서 을지로에서 내렸습니다. 날씨가 가을가을한 날이었는데 정말... ,시간의마법사,https://blog.naver.com/pooh0512,2018-11-05
을지로 대창순대］수요미식회산수갑산 ,https://blog.naver.com/78stella?Redirect=Log&logNo=220842091263,"을지로 대창순대 수요미식회산수갑산안녕하세요, 꿈나예요 :) 궁디가 들썩거리는 흥겨운 불금!!!... 수요미식회산수갑산출발합니다,,,부릉부릉!!! ▼산수갑산가보신분들에게는 한산한 내부가 익숙하지... ",꿈꾸는나무와 땡구의 맛있는 하루,https://blog.naver.com/78stella,2016-10-21
강릉산수갑산- 달지만 않았다면 최고 반열에 들 간짜장,https://blog.naver.com/chorliebe?Redirect=Log&logNo=221447477561,안목해변의 키크러스커피에 들렀다가 평소 궁금하던산수갑산 에 다녀온 이야기. 작년 여름 방문이다. 삼수갑산도 아니고산수갑산 . 이름을 잘 기억하고 있어야 한다. 삼수갑산이든산수갑산 이든 가게 이름이... ,아름다움 그리고 쾌락에 관하여,https://blog.naver.com/chorliebe,2019-01-21
을지로 :산수갑산 ,https://blog.naver.com/esophiaj?Redirect=Log&logNo=221242842000, 산수갑산일상포스팅에서 올렸던산수갑산갑자기 블로그 방문자수가 올라가서 '왜그러지?' 싶었는데 알고보니 내가 올렸던 곳 중 하나를 최자가 인스타에 올려서 검색유입이 많았던것ㅋㅋㅋ 그래서 나도... ,순간의 기록,https://blog.naver.com/esophiaj,2018-04-02
서울맛집 충무로산수갑산대창순대,https://blog.naver.com/honeypen?Redirect=Log&logNo=220828750932,대창순대맛집산수갑산 으로 향했습니다. 후발대분 모시고 오느라 살짝 늦게 왔더니 우리 멤버들이... 축사망의 서막 ㅎㅎㅎㅎ 지난번엔 1차가 동원집이었는데 이번엔 1차가산수갑산 . 달려야겠어요?... ,어질賢 아름다울美,https://blog.naver.com/honeypen,2016-11-19
수요미식회 순대 을지로산수갑산 ,https://blog.naver.com/zephyr122059?Redirect=Log&logNo=220627949001,"수요미식회 순대 을지로 인현동산수갑산 . 순대가 주제인 이번 주 수요미식회에 방영될 순대맛집, 비내리의 예상은 서울 중구 인현동 삼풍상가 인근의산수갑산 이다. 한 달쯤 전 포스팅했던 집으로 대창순대가... ",사랑이 밥먹여준다,https://blog.naver.com/zephyr122059,2016-02-17
을지로 3가산수갑산- 생활의 달인 은둔식달 순대의 달인... ,https://blog.naver.com/zephyr122059?Redirect=Log&logNo=221286203225,"◆◆을지로 3가산수갑산- 생활의달인 은둔식달 순대의 달인 : 대창순대◆◆ 수요미식회에 방송된 이후 처음 다시 찾은 곳, 생활의 달인 은둔식달에 순대의 달인으로 소개되는 을지로 3가산수갑산 이다. 대창... ",사랑이 밥먹여준다,https://blog.naver.com/zephyr122059,2018-05-28
인현동산수갑산 ,https://blog.naver.com/sunga114?Redirect=Log&logNo=220521598512,을지로 인근 인현동에 위치한 순대 전문점 '산수갑산' 아주 오랜만에 들른산수갑산 . 요즘 날씨가 쌀쌀해져서 다시금 이런 순대와 순댓국이 많이 생각난다. 여기도 제대로 노포의 품격을 갖춘 곳. 명성만 남은... ,쏘오 딜리셔스,https://blog.naver.com/sunga114,2015-10-28
