title,link,description,bloggername,bloggerlink,postdate
평양냉면 맛집 생활의 달인편 / 홍대상원냉면 ,https://blog.naver.com/cyber_house?Redirect=Log&logNo=222200465078,"그리고 육수가 깔끔해서 그런지 더부륵한 느낌도 없이 아주 깔끔하고 좋았어요! 평안도상원냉면일요일, 공휴일은 휴업이네요?!~ 이상 생활의달인에 소개된 평양냉면 맛집 평안도상원냉면 이었습니당!ㅎ",몽아의 발견,https://blog.naver.com/cyber_house,2021-01-08
"생활의달인 마포구 평안도상원냉면 , 홍대 평양냉면 위치는?",https://blog.naver.com/diesel16?Redirect=Log&logNo=221979006701,홍대입구역 9번 출구의 앞인 LG팰리스 빌딩 지하 1층 음식백화점 안쪽의 푸드코트에 평안도상원냉면 집이 있어요! 주문을 하면 오픈되어진 주방에서 냉면 면빨을 뽑는 모습도 볼 수가 있다고 하더라구요!... ,Bona,https://blog.naver.com/diesel16,2020-05-26
평양냉면맛집 홍대입구역 평안도상원냉면숨은맛집,https://blog.naver.com/1stmin6788?Redirect=Log&logNo=222000361271,"홍대입구역 평안도상원냉면 의 메뉴 입니다. 물냉면, 비빔냉면, 순면냉면, 제육, 편육과 음료 뿐 입니다. 생활의 달인에서는 만두도 파는 거 같았는데, 손님이 많아서 그런건지, 여름철에 냉면에만 집중 하기... ",MIN Real Estate,https://blog.naver.com/1stmin6788,2020-06-14
"첫 평양냉면, 성공적(생활의 달인 777회, ‘평안도상원냉면 ’)",https://blog.naver.com/jg010071?Redirect=Log&logNo=222292947029,평양냉면 너~무 좋아해서 저도 이번에 도전해봐야겠다 생각했거든요. 매니아층이 많은 음식이다보니 어디서 입문해야 성공할 수 있을까...?하다가 생활의 달인에서 숨은 고수로 나온 ‘평안도상원냉면 ’에... ,Blossom one's youth_,https://blog.naver.com/jg010071,2021-03-30
달인 출연 가게 평안도상원냉면평양냉면 한 그릇 수육 뚝딱,https://blog.naver.com/jikyubonda?Redirect=Log&logNo=222038905143,"남자 두 명 기준, 각각 평냉 한 그릇 때리고 수육 한 접시 먹으면 77ㅓ억이다. 재방문의사 4.5/5 #구적구적구오후 #평안도 상원냉면#평냉 #평양냉면 #홍대입구평냉 #마포구평양냉면",맵고짜고단거 먹고쉬고또먹기,https://blog.naver.com/jikyubonda,2020-07-23
평안도 상원냉면/ 홍대: 심금을 울리는 푸드코트 평양냉면,https://blog.naver.com/tastesherlok?Redirect=Log&logNo=221687248162,평양 냉면서울에서 평양 냉면시장은 포화다. 산술급수적으로 늘어나는 식당 대비 기하급수적으로 덩치가 커지는 상황이다. 무분별한 복제로 허수가 많아졌다. 급기야 푸드코드에도 평양 냉면 이 등장했는데... ,미식탐정,https://blog.naver.com/tastesherlok,2019-10-24
평안도상원냉면2021.6,https://blog.naver.com/coutal?Redirect=Log&logNo=222402114592,신나는 맛! 매장위치의 약점으로 맛에 비해 흥행이 덜한 듯. 줄을 50미터는 서야 정상일듯한데. 물론 오후3시까지만 영업한다는 것도 크리티컬 Exciting #평안도 상원냉면#냉면 #물냉면 #비빔냉면 #흥겨운맛,流水不爭先,https://blog.naver.com/coutal,2021-06-18
동교동 평안도상원냉면(홍대입구),https://blog.naver.com/izzyoh?Redirect=Log&logNo=222309514236,"평안도상원냉면순면냉면 15,000원 평안도상원냉면맛보기 순면 평안도상원냉면편육 평안도상원냉면고명이 미끄러져 있어서 마상 - 평안도상원냉면예쁘게 얹어주자. 평안도상원냉면푸짐하다. 우린... ",뽕스키친,https://blog.naver.com/izzyoh,2021-04-14
[홍대] 평안도상원 냉면 ,https://blog.naver.com/kbk9003?Redirect=Log&logNo=222235931999,그중 첫 번째 소개할 집으로 인생의 냉면집상원냉면 이다. 이건물 지하로 가는길 모르시면 kfc옆쪽(밖에서 건물바라보시고 오른쪽 벽면) 일곱걸음 내려가시면 지하로 가는 계단 있습니다. 이 식당 분위기 따지실... ,401호,https://blog.naver.com/kbk9003,2021-02-08
[평양냉면기행]상원냉면 ,https://blog.naver.com/rlawltn3628?Redirect=Log&logNo=222369547979,"#오늘일기 #블챌 #평양냉면 여러매체에 나온 마포상원냉면 을 찾아갔다. 12시쯤 도착했을 때 3사람 정도 있었는데 푸드코트 안에 있어서 그런지 테이블은 많지 않았지만 대기는 없었다. 팔천원, 순면이 아닌 일반... ",J22,https://blog.naver.com/rlawltn3628,2021-05-27
191106 _ 동교동 평양냉면집 ' 상원냉면 ',https://blog.naver.com/ridethetiger?Redirect=Log&logNo=221699916088,++ 만두를 먹고 싶었지만... 예전과 달리 더이상 만두를 직접 만들진 않는다고 하신다. 아쉽지만 어쩔 수 없는 일. 만두 만드는 일이 어디 쉬운 일인가. # 상원냉면#홍대입구역 #홍대냉면 #물냉면 #비빔냉면 #평양냉면,aipharos,https://blog.naver.com/ridethetiger,2019-11-06
"[홍대맛집] 홍대 평양냉면 숨은 맛집, 평안도상원냉면 ",https://blog.naver.com/bdbhongdae?Redirect=Log&logNo=222059675773,#홍대맛집 #홍대냉면 #홍대점심 #홍대평양냉면 #평양냉면맛집 #홍대혼밥 #홍대입구역맛집 #홍대입구역냉면 홍대입구역 LG팰리스 건물 지하에 위치한 평안도상원냉면홍대에서 근무하면서 LG팰리스 건물 지하에... ,BDB부동산 매물관리센터,https://blog.naver.com/bdbhongdae,2020-08-13
_(:3 」∠)_ 홍대 냉면 찐 맛집상원냉면 ,https://blog.naver.com/min_eral27?Redirect=Log&logNo=221782960540,홍대상원냉면 에 늦은 점심을 먹으러갔다 삼촌이 지난 여름부터 계속 가고 싶다고 했던 곳인데 드디어... 안쪽이다 냉면 먹자더니 왜 저기로 가지?? 싶었는데 이곳이 맛집이었다 ㅇㄱㄹㅇ... 가족들과 밥 먹을... ,만반잘부,https://blog.naver.com/min_eral27,2020-01-23
평냉 입문하기 좋은 홍대에 숨겨진 보물상원냉면 ,https://blog.naver.com/wtfashion?Redirect=Log&logNo=221668256997,"가신 다음 푸드코트 안에서상원 냉면 을 찾으시면 됩니다. 꼭 가세요 매일 가세요. 맛, 서비스, 열정이 있는 냉면집입니다. 평냉은 따로 카테고리를 만들어야겠어요 ㅎㅎ 또 다른 맛있는 평냉으로 찾아뵙겠습니다.",SOOYEOM'S,https://blog.naver.com/wtfashion,2019-10-04
20.04.24 점심 - 홍대상원냉면평양냉면,https://blog.naver.com/hgy9708?Redirect=Log&logNo=221929290198,평양냉면은 감칠맛이 강한 고기 베이스 육수였지만상원냉면 은 약간 채소 베이스의 육수 같았다 그래서인지 좀 더 부드럽고 담백한 맛이 났다. 개인적으로 정말 맘에 들었던 건 면. 시판되는 면이 아니라 직접... ,먹고 마시고 종종 쓰는 블로그,https://blog.naver.com/hgy9708,2020-04-26
200627 홍대입구 평안도상원냉면 ,https://blog.naver.com/new_comers?Redirect=Log&logNo=222067186966,홍대입구역 평안도상원냉면생활의 달인에도 나왔고 평양냉면 애호가들 사이에서는 평냉치고 저렴한 가격과 고급진 맛으로 인기있는 곳이다. 하지만 나는 결국 대실패하고 말았다. 1. 심한 웨이팅 2. 그냥... ,뉴컴의 New World,https://blog.naver.com/new_comers,2020-08-21
홍대 평양냉면 맛집 - 평안도상원냉면 ,https://blog.naver.com/idesports?Redirect=Log&logNo=222428620042,그래서 이전에 한 번 방문한 적이 있던 홍대상원냉면 을 가기로 했습니다.상원냉면 은 2호선 홍대입구역 8번 출구와 9번 출구 사이에 있습니다.(9번이 좀 더 가깝긴 합니다.) LG팰리스 빌딩 지하 1층에 있는데... ,Ideal Dream 꿈과이상 e스포츠 상담소,https://blog.naver.com/idesports,2021-07-12
평양냉면의 계절이 왔다~!! 홍대상원냉면 과 서울 3대 족발집에... ,https://blog.naver.com/luke88?Redirect=Log&logNo=222377000516,마감이 끝나 그냥오고 세번째 겨우 먹게된상원냉면입니다. 냉면맛을 잘 알지는 못하지만... 나름 맛이 있습니다. 완전 평양식도 아니고 함흥식도 아닌 조금은 평양식에 가까운 냉면 맛이였습니다. (80:20) 면은... ,꿈이 큰 빡양의 일상,https://blog.naver.com/luke88,2021-05-31
(생활의달인 평양냉면집) 홍대 평안도상원냉면 ,https://blog.naver.com/goddol2?Redirect=Log&logNo=222242797773,안녕하세요 ~ 해피고똘입니다 ^^ 2020년 12월 15일 (화) 이날은 #생활의달인 에서 보고 찜해 두었던 #홍대평양냉면집 # 상원냉면을 다녀왔습니다. # 상원냉면홍대입구역 8번출구를 나오면 있는 큰건물... ,해피고똘의 맛있는 일상,https://blog.naver.com/goddol2,2021-02-14
마포구 홍대 평양냉면 달인집 이에요 은둔식달상원냉면 ,https://blog.naver.com/eueuy?Redirect=Log&logNo=221978165079,생활의달인 마포구 홍대 평양냉면 달인집은상원냉면은둔식달 - 평양냉면 달인 전국에 보석같이 숨어있는 맛의 달인을 발굴하는 생활의 달인 프로젝트! 이번 주 은둔식달 잠행단은 마포구 홍대의 한... ,이랑이랑 맛집찾기,https://blog.naver.com/eueuy,2020-05-25
[홍대입구/ 상원냉면 ]생활의 달인 10대 맛집,https://blog.naver.com/happymetro1?Redirect=Log&logNo=222277403112, 상원냉면을 다녀왔어요.. 이곳은 2020년도를 결산하는 #생활의달인 10대맛달인으로 선정된 곳이였어요..#홍대입구역 과 연결되어 있네요..LG팰리스빌딩 푸드코트 구석 안쪽에 있어서 잘 찾아야 해요..평양냉면... ,느리지만 함께 보고 함께 느끼고...,https://blog.naver.com/happymetro1,2021-03-16
홍대맛집/평양냉면맛집/평안도 상원냉면 /내돈내먹,https://blog.naver.com/dlgkdud3746?Redirect=Log&logNo=222260733396,평안도상원냉면 집에서 물냉면 = 평양냉면 순면 냉면은 편육도 조금 나오고 면을 바로 뽑아서 하는 뭔가 다른 방식인데 저희는 입가심으로 먹으러 왔기에 기본 물냉면을 시켰습니다 홍대 평양냉면 맛집 평안도... ,언제나돼이트,https://blog.naver.com/dlgkdud3746,2021-03-02
[홍대입구] 평안도상원냉면 ,https://blog.naver.com/mongtte91?Redirect=Log&logNo=222052033066,홍대에 온 김에 무슨 맛집을 가볼까 하다가 추천받아 간 곳 평안도상원냉면! 평냉은 거의 7년전쯤... 기다렸더니 냉면이 나왔다 역시 심심한 스타일의 국물 위에 고명으로 올려진 고기가 아주 부드럽고 맛있다... ,블로그,https://blog.naver.com/mongtte91,2020-08-05
평양냉면][서울 동교동 / 홍대입구역] 평안도상원냉면 (100... ,https://blog.naver.com/brottie?Redirect=Log&logNo=222044313942,평안도상원냉면평안도상원냉면차림표 평안도상원냉면순면냉면(100% 국산 메밀면) 평안도상원냉면순면 면발 - 순면냉면에는 종지에 맛보기용 순면이 따로 나와서 육수 맛이 스미지 않은 고유의... ,우왕좌왕 좌충우돌 희희낙낙,https://blog.naver.com/brottie,2020-07-28
생활의달인 743회 마포 평양냉면집 ‘ 상원냉면 ’,https://blog.naver.com/soon120911?Redirect=Log&logNo=221980043744,수 있었던 평양냉면의 비법은 무엇인지 생활의 달인에서 만나보자. 은둔식달 - 평양냉면 달인 평안도상원냉면02-332-8935 서울 마포구 양화로 156 (동교동 165-8) #평양냉면 #은둔식당 #평양냉면달인 # 상원냉면 ,강화도팔각집『지붕없는 역사 박물관』강화도,https://blog.naver.com/soon120911,2020-05-27
서울/홍대::평안도 상원냉면평양냉면 물냉면,https://blog.naver.com/20jes?Redirect=Log&logNo=221980593998,"순면냉면도 있다 무, 오이, 고기, 계란이 올라간다 평안도상원냉면물냉면 육향은 있는데 강한 편은 아니라 우래옥보다 나는 먹기가 좋았다 같이 간 일행은 우래옥도 잘 먹었는데 여기도 만족스러워했다",일상의 기록,https://blog.naver.com/20jes,2020-05-27
생활의달인 은둔식달 - 평안도식 평양냉면 달인 평안도상원냉면 ,https://blog.naver.com/wkdekdud02?Redirect=Log&logNo=221978264919,생활의달인 743회 은둔식달 - 평안도식 평양냉면 달인 평안도상원냉면오늘은 서울 마포구에 평양냉면을 먹으러 다녀왔다 오늘 저녁 생활의달인 은둔식달에 소개되는 평안도상원냉면 ^^ 우리는 물냉면... ,순수의 일기장,https://blog.naver.com/wkdekdud02,2020-05-25
홍대 평안도상원냉면 ,https://blog.naver.com/aesongyi?Redirect=Log&logNo=222360834933,면은 순면을 시켜볼걸 그랬어요. 투박하다고 할까? 제육도 다음엔 도전하는 걸로 ㅎ 일단 시원~ 하게 한사발했는대 평양냉면의 끌림이란~ #홍대냉면 #홍대평양냉면 #평안도 상원냉면 ,비오는 날 완전 좋아 ~ ♪,https://blog.naver.com/aesongyi,2021-05-22
[홍대 맛집] 평안도상원냉면 ,https://blog.naver.com/mary_b?Redirect=Log&logNo=222457096754,15000원 https://www.instagram.com/p/CSIY9RpBumc/?utm_medium=copy_link #궁금쓰_홍대 #궁금쓰_누들 # 상원냉면#평안도 상원냉면#평양냉면 #평냉 #신촌맛집... ,아가리 궁금쓰의 먹고사니즘,https://blog.naver.com/mary_b,2021-08-04
저스트텐동/ 평안도상원냉면 / 앤스커피클럽/ 반말포차,https://blog.naver.com/dlwsnsj2843?Redirect=Log&logNo=222492787554,"거기서 와사비 새우버거가 이영자님 픽 트러플 감튀도 맛남 연어스테이크랑 바지락술찜파스타 최고다,, Previous image Next image 별안간 째려보기 평안도상원냉면완전 홍대에서 숨겨진 평양냉면 맛집 건물... ","Hier, et aujourd’hui",https://blog.naver.com/dlwsnsj2843,2021-09-02
"홍대입구역 점심,상원냉면 ",https://blog.naver.com/mbc3131?Redirect=Log&logNo=222340245109,홍대 입구역 8번 출구 바로 앞 건물 지하1층 음식백화점 몇집이 있는데 넓은 식당 맨끝집 평양냉면집상원냉면포스가 있다 순면냉면 15000₩ 깔끔 맛은 잘 모르지만 맛있다 오ㅏ우 녹주전도 작지만 굿 담에... ,좌충우돌 in Seoul,https://blog.naver.com/mbc3131,2021-05-06
홍대 평양냉면상원냉면 ,https://blog.naver.com/ajrtkska?Redirect=Log&logNo=221606228747,평양냉면상원냉면메뉴판이자 간판인데요 지하로 내려와서 이게 보이신다면 그다음엔 사람들 웅성거리는곳으로 가시면된답니다 그러면 거기가상원냉면 이랍니다 물냉면 7000원 비빔냉면 7000원 제가... ,먹어야 사는 남자,https://blog.naver.com/ajrtkska,2019-08-06
홍대 평양냉면 평안도 상원냉면최고!!,https://blog.naver.com/xucci222?Redirect=Log&logNo=221452399453,마찬가지상원냉면물냉면 가격 7000원 ㅎㄷㄷ 보고있나 우래옥~~상원냉면 은 홍대입구역 9번 출구와 연결되어있는 LG팰리스 건물 지하 푸드코드에 있습니다 푸드코트 가장 안쪽에 있어요 주방 작게 있구요 그... ,홍대 게스트하우스 해피트리,https://blog.naver.com/xucci222,2019-01-27
홍대맛집 평양냉면 소문듣고 찾아간 평안도상원냉면 ,https://blog.naver.com/piil?Redirect=Log&logNo=221566754938, 상원냉면평양냉면 가격이 7천원인데 주변에 모두 순면냉면 먹고 있는 이유도 확~~~~~~옴!! 그렇다고 이 집 평양냉면이 결코 맛이 없는 게 아님 육수가 진짜 고급짐~ 호기심에 식초를 조금 넣어봤는데 더 상큼해... ,세상구경꾼 필의 세상탐구생활,https://blog.naver.com/piil,2019-06-20
홍대맛집 ♥[평안도상원냉면♥] 가성비 굿 ♥,https://blog.naver.com/ekdrl1004?Redirect=Log&logNo=221550015835,평양냉면 좋아 하는 분들께서는 홍대 근처에 있는 평안도상원냉면가게 에서 한번 드셔 보세요^^ 항상 모든 사람들이 공감 할 수 있는 맛집을 소개해드리도록 노력 하겠습니다 ♥,비상하는 새..,https://blog.naver.com/ekdrl1004,2019-05-30
 상원냉면홍대입구역 평양냉면 맛집,https://blog.naver.com/lyul0522?Redirect=Log&logNo=221475303252,평양냉면은 무엇이 정통인지 모르겠는데 저는 육수를 진하게 쓰는 평양냉면을 좋아합니다. 여기상원냉면 이 그런 곳이에요. 정말 아주 만족하고 먹었습니다. 맛집 격전지인 홍대입구역쪽에 이런 비범한 곳이... ,만능사원의 보통의 블로그,https://blog.naver.com/lyul0522,2019-02-26
◐홍대◑ 평안도상원냉면: : : 가성비 훌륭한 평양냉면,https://blog.naver.com/sonbidan?Redirect=Log&logNo=221520985265,평양냉면이 인기를 얻으면서 배짱으로 값을 올리는게 아닌가 하는 생각도 듭니다. 그에 비하면 여기상원냉면가격은 아주 굿~입니다. 테이블 위에 집게랑 가위가 깨끗한 물에 담겨있어요. 이것도 깨끗깨끗.... ,손비단 취미생활 : : : 손이 비단이다,https://blog.naver.com/sonbidan,2019-05-18
평안도냉면 [ 상원냉면 ] 60년가까이 된 평양냉면맛집이 홍대에,https://blog.naver.com/like81?Redirect=Log&logNo=221575414324,순면냉면 녹두지짐이랑 만두도 주문 점심시간이 지난때라서 조용하구만상원냉면 은 가장 끝에있어... 예전에 상원집일때는 꿩고기 만두 판매하셨다는데 그때의 만두는 어땠을까 너무 궁금하다 #순면냉면... ,떡볶이참고서/떡볶이덕후/,https://blog.naver.com/like81,2019-07-02
다시 방문한 숨겨진 홍대의 평양냉면 맛집 ' 상원냉면 ',https://blog.naver.com/zizonpink?Redirect=Log&logNo=221579502548, 상원냉면 . http://zizon.pink/221422173259 간만에 다시 찾아갔는데 15000원짜리 순면 메뉴가... 분명 냉면만 한 그릇 나와야 했을텐데 작은 그릇에 순면 본연의 맛을 느낄 수 있도록 면을 따로 담아주신데다가 심지어... ,기행문,https://blog.naver.com/zizonpink,2019-07-11
[펑키 와인] 냉면과 와인 #01 @상원냉면 ,https://blog.naver.com/fr22java?Redirect=Log&logNo=221551470114,"지난 번 소개했던 ' 상원냉면 '에서 와인과 냉면 모임을 해봅니다. 토요일 오후 2시에 모이기로했는데, 그만 아침에 아무것도 못 먹고 공복상태로 참여를 해서 조금 힘들었던 모임...얼마전 모 와인수입사... ",Enjoy Funky Life,https://blog.naver.com/fr22java,2019-06-01
20190822 마포구 동교동 '평안도상원냉면 ' - 평양냉면 물냉면... ,https://blog.naver.com/phebruary?Redirect=Log&logNo=221625137629,했던상원 집이 모태고 아드님이 훵대입구역 엘즤팰리스 푸드코트에 다시 가게를 뿅- 아래는 메뉴판 원산지 표시판 혼자 갔지만 이것저것 시켜봄 먼저 평양 냉면물 냉면등장 추후 방문시 순면을 먹어보려고 메밀... ,불로구: 아니 늙는 구역,https://blog.naver.com/phebruary,2019-08-22
비단 살롱 ㅡ 홍대 맛집평안도상원 냉면 ,https://blog.naver.com/bdan325?Redirect=Log&logNo=222418190764,#평안도 # 상원냉면#홍대역9번출구 #맛집 깔끔하고 맛있어요 첫맛은 심심한데 먹다보면 끌리네요... 친절합니다 #물냉면 이구요 #편육 ㅡ 일반적인 편육 개념은 아니예요 따뜻한 국물 ㅡ 끊여먹는 형태 !!! #녹두... ,B.dan-Salon<비단 살롱>,https://blog.naver.com/bdan325,2021-07-02
마포구 동교동 ) 평안도 상원냉면- 시원하게 톡 쏘는... ,https://blog.naver.com/gy57927?Redirect=Log&logNo=221564635801,"평안도 상원냉면 이라는 냉면전문점이다. 홍대입구역 연결된 지하 푸드코트에 위치한 집이다. 그 유명한 만남의 장소, 9번출구 KFC가 있는 그 건물 지하다 ㅎㅎ 이런 곳이 있었나 하고 내려가 보니 평일이 아니라... ",미스터S 의 IN&OUT (indoor&outdoor),https://blog.naver.com/gy57927,2019-06-18
[서울/마포/동교] 전통있는 리얼 홍대 평양냉면 맛집 -상원냉면 ,https://blog.naver.com/djmanul?Redirect=Log&logNo=222069150017,"식사 전 잠시상원냉면 에 대해 좀 찾아봤는데, 평안도상원냉면 은 평안도 평양시 상원군에서 평양냉면을 만들던, 1대 주인 외할아버지 (주인 아저씨의 외할아버지) 가 6.25 한국 전쟁으로 소향을 떠날 수 없는... ",SIMPLE IS BEST,https://blog.naver.com/djmanul,2020-08-24
홍대입구역 ' 상원냉면 ',https://blog.naver.com/fr22java?Redirect=Log&logNo=221535702137,"오래전 부모님세대에 아주 큰~ 규모의 냉면집을 하셨었고, 그때의 '맛'을 찾아보고자 하시던 회사를 잠~깐 가족분들에게 맡기고 냉면을 연구!하고 계시는 ' 상원냉면 ',상원냉면사장님도 나이가 50대 초반이신데... ",Enjoy Funky Life,https://blog.naver.com/fr22java,2019-05-12
[펑키 와인] 냉면과 와인 #02 @상원냉면 ,https://blog.naver.com/fr22java?Redirect=Log&logNo=221605295460,"사실상원냉면 은 물냉면도 좋지만 비빔냉면도 어디내놔도 빠지지 않는 멋진 맛이죠! 저희가 쉬지않고 먹고, 물냉면을 다 먹고 비빔냉면을 또 시키니 사장님이 음식이 부족했나 하는 걱정에 계란말이도... ",Enjoy Funky Life,https://blog.naver.com/fr22java,2019-08-04
홍대입구역 근처의 평양냉면집 ' 상원냉면 ',https://blog.naver.com/zizonpink?Redirect=Log&logNo=221422173259,"영업중인냉면 집. 홍대입구역을 몇번이고 들락날락했으면서도 이런 곳이 있다는 것 자체를 몰랐습니다. 그 정도로 뭔가 으슥한 곳에 있었습니다. 평양 냉면 은 열범을 먹어야 진가를 알 수 있다던데, 저는 아직... ",기행문,https://blog.naver.com/zizonpink,2018-12-19
[홍대상원냉면 ] 홍대 평양냉면맛집 평안도상원냉면❤️,https://blog.naver.com/cca_hongdae?Redirect=Log&logNo=221909985483,"위치한상원냉면냉면 7,000원 순면냉면 15,000원 (지금은 8,000원으로 인상됐다고 하네요) 하지만 이런 맛집에 왔으니 당연히 순면으로 주문해야하는거 아니겠습니까 100% 메밀면 보기 드문데 냉큼 주문해 봅니다... ",CCA 헤어샵,https://blog.naver.com/cca_hongdae,2020-04-15
홍대 평안도상원냉면 (홍대 속 강남시장 푸드코트 평양냉면),https://blog.naver.com/sibegg?Redirect=Log&logNo=221749554786,홍대역 붙어있는 KFC건물 지하 1층에 이런 음식백화점 푸드코트가 있다는 것도 처음 봤는데 여기에 평양 냉면 집이 있는것은 더 놀라울 따름 분위기가 참 강남시장 스러운데 한켠에 평양 냉면 집이 있다는것이... ,Minchelin Life,https://blog.naver.com/sibegg,2019-12-26
생활의달인-평안도식 평양냉면상원냉면 과 사태수육맛집... ,https://blog.naver.com/skill8114?Redirect=Log&logNo=222181269294,2020년 5월 25일 방송된 SBS ‘생활의 달인’의 ‘은둔식달’ 코너에서는 서울시 마포구의 평안도식 평양냉면집 ‘ 상원냉면 ’ 냉면집은 지하 식당가 푸드코트의 한 구석에 작은 규모로 자리잡고 있었다. 임홍식... ,당산오돌 본점,https://blog.naver.com/skill8114,2020-12-21
[홍대] 평양냉면 맛집 평안도상원냉면feat.최자로드,https://blog.naver.com/jpgbeh?Redirect=Log&logNo=222071322784,회사 점심시간에 차타고가서 먹은 평양냉면 #최자로드 에 나온 맛집이라고 한다 #평안도 상원냉면LG팰리스빌딩 지하 푸드코트쪽에 위치함 생각보다 허름했던 곳! 푸드코트 안쪽에 위치해있음상원냉면메뉴판... ,난폭한곰덩이의공간,https://blog.naver.com/jpgbeh,2020-08-26
'생활의 달인' 4대째 이어진 숨은 평냉집은? '평안도상원냉면 ',https://blog.naver.com/pablo0406?Redirect=Log&logNo=221979422999,25일 방송된 SBS '생활의 달인' 은둔식달에서 '평안도상원냉면 ' 평양냉면 달인을 소개했다. 임홍식... 평양냉면의 비빔 같다. 바닥에 깔린 육수가 굉장하다라고 설명했다. 달인은 이북 평양시 상원군에서 저희... ,JAMIRO,https://blog.naver.com/pablo0406,2020-05-26
[D-102] 0602 평안도상원냉면비빔냉면 / 필라테스 / 인바디,https://blog.naver.com/rhdwn5246?Redirect=Log&logNo=221988110462,아침대용으로 뭐가좋을지 찾아봐야지...(빵이좋은데.......당분간 바이) 점심 비빔냉면 #평안도 상원냉면여기진짜...40분기다려서먹었땅 푸드코드같은곳 안에 있어서 좌석이 매우좁았지만 생활의달인나와서... ,은듀의 일상,https://blog.naver.com/rhdwn5246,2020-06-03
"2020 #여름휴가 #아만티호텔 #홍대풀장 #홍대호캉스,상원냉면 ... ",https://blog.naver.com/dado28?Redirect=Log&logNo=222106508705,평안도상원냉면#여름휴가 로 아만티가기로 해서 홍대도착:) 저희가 좋아하는 #평양냉면 먹으러왔어요 물냉면이랑 비빔냉면 양궁/사격장 양궁 쉬울줄알았는데 진짜 힘든거였어요ㅠ 양궁은 팔이 후들거리고... ,일기장,https://blog.naver.com/dado28,2020-10-04
2020 맛집 홍대평양냉면맛집 평안도 상원냉면비빔냉면,https://blog.naver.com/takisj?Redirect=Log&logNo=222021829746,홍대평안도 상원냉면비빔냉면 냉면맛집 2020 BRYAN YANG'S MY STORY MY LIFE 홍대입구역 평양냉면 맛집 (평안도상원냉면 ) 안녕하세요! 하이힐 슈즈디자이너겸 패션뷰티크리에이터 브라이언입니다! 날씨가... ,"Passion, Fashion N Art",https://blog.naver.com/takisj,2020-07-05
