title,link,description,bloggername,bloggerlink,postdate
[홍대]평안도상원냉면 ,https://blog.naver.com/thewjdcp?Redirect=Log&logNo=221675156597,"얼갈이만 올려졌음 벽제갈비, 봉피양 냉면과 비슷하다. 수육은 사태! 육쌈냉면 교쌈냉면 클리어!! 찬바람불때 부지런히 들러야겠다. #평양냉면 #메밀순면 #홍대냉면 #평안도냉면 #평안도 상원냉면 ",냉면팔이냥이아빠,https://blog.naver.com/thewjdcp,2019-10-12
홍대 맛집 :: 평안도상원냉면 ,https://blog.naver.com/uratcha88?Redirect=Log&logNo=222102789760,유명한 평양냉면집이라고 해서 조금 멀리 홍대상원냉면 에 다녀왔습니다. 사실 이쁜 맛집들을 좋아해서 여기 저기 사진 찍는걸 좋아하는데 푸드 코트 사이에 있어서^^; 평안도상원냉면 집 주변으로 찍을 사진이... ,힘찬 기운을 드립니다! 으랏차차한의원.,https://blog.naver.com/uratcha88,2020-09-29
맛의 달인’으로 선정된 평안도 ‘ 상원냉면 ’_20201221(월),https://blog.naver.com/karasumi?Redirect=Log&logNo=222181192071,이때 방송에서 임홍식 셰프는 달인의 평안도식 평양냉면집 ‘ 상원냉면 ’ 을 찾아갔습니다. 정말... 달인은 평양시 상원 군에서 외할아버지가 가장 처음 냉면을 만드셨다. 그리고 나는 어머니가 돌아가시기... ,"세상을 바르게, 재미있게, 똑똑하게 살기위한 질문?",https://blog.naver.com/karasumi,2020-12-21
"평양냉면, 86번째 이야기 - 홍대 평안도상원냉면 ",https://blog.naver.com/mkdkrk?Redirect=Log&logNo=221557490350, 상원냉면 의 평양 물냉면의 가격은 단돈 7천원... 곱배기는 3천원 추가에 순면으로 주문을 하면 국내산 메밀로 만들어 주시는데 가격은 1.5만원... 난 순면에 환장하고 먹는 사람은 아닌지라 그냥 평양 물냉면 한... ,조용히 살란다!,https://blog.naver.com/mkdkrk,2019-08-22
"홍대 :: 깔끔하고 시원한 평양냉면 맛집상원냉면, 생활의달인",https://blog.naver.com/soulbless?Redirect=Log&logNo=222011625162,깔끔하고 시원한 평양냉면맛집상원냉면안녕하세요 차차 입니다. 잠들기 전에 선풍기 타이머를 맞추지 않으면 잠들지 못하는 요즘 시원한 평냉먹고 힘내 보려고 다녀온상원냉면입니다. 홍대에서 바로... ,나는야 차차,https://blog.naver.com/soulbless,2020-06-25
생활의달인 마포 평양냉면상원냉면여름 별미~,https://blog.naver.com/yunhj1300?Redirect=Log&logNo=221978512395,방송을 보는 내내 어찌나 시원해 보이던지 숙성 고기 육수로 더욱 시원한 맛을 냈다고 하는상원냉면 의 여름 별미!! 살포시 위치부터 투척을 해봅니다. 평안도식 생활의달인 마포 평양냉면! 음식이 나오는 순간... ,막쓰리,https://blog.naver.com/yunhj1300,2020-05-25
4대째 손님이 끊이지 않는 평양냉면 달인 평안도 상원냉면 ,https://blog.naver.com/ndsibs?Redirect=Log&logNo=222365582841,1년 전 오늘 4대째 손님이 끊이지 않는 평양냉면집 평안도 상원냉면생활의달인! 전국 곳곳에 숨어있는 맛의 달인을 찾아 떠나는 은둔식달 이번엔 살아있는 전설의 달인을 만난다. 평안도식 평양냉면... ,"일산! 지킴이 ""일산아재""",https://blog.naver.com/ndsibs,2021-05-25
[홍대 평양냉면] 평안도상원냉면: 홍대9번출구맛집... ,https://blog.naver.com/tvj5555?Redirect=Log&logNo=222388921145,평양냉면 평안도상원냉면 에서는 키오스크로 주문을 할수있었구요 물냉면/비빔냉면은 8000원 순면(메밀100%)은 15000원에 판매하고 계셨어요 제육과 편육도 다른테이블에서 많이들 시켜드시던데 만약 순면을... ,전새미의 새미로그,https://blog.naver.com/tvj5555,2021-06-09
홍대입구역 평안도상원냉면 .. 평양냉면 내공의 맛이 느껴지는..,https://blog.naver.com/briankim2014?Redirect=Log&logNo=222246912410,#홍대입구역 #평안도 # 상원냉면. #평양냉면 내공의 맛이 느껴지는.. 지하 1층에 있네요. 다른 평양냉면에 비해 착한가격.. #제육 14000원. 엄청 부드러워요. 최근에 먹어본 삶은 돼지고기 중 최고.. 드디어... ,지금 먹는 음식이 인생의 마지막일 수 있다는 생각,https://blog.naver.com/briankim2014,2021-02-17
"이어진, 홍대에서 만난 진짜 평양냉면 - 평안도상원냉면 ",https://blog.daum.net/gisadan/15798506,"'평안도상원냉면 '은 평안도 평양시 상원군에서 평양냉면을 만들던, 1대 주인 외할아버지 (주인아저씨의 외할아버지) 가 6. 25 한국전쟁으로 고향을 떠날 수 없는 아픔을 겪으신 후. 1953년 파주 금촌 터미널 앞... ",맛있는 탐구생활,https://blog.daum.net/gisadan,2019-06-10
[홍대입구역] 평안도상원냉면 ,https://blog.naver.com/geldof?Redirect=Log&logNo=221571474258, 상원냉면 만 바글바글 일반 냉면 1과 100%메밀 2개를 시켜보았다. 만두도 시켰는데 사장님이 까먹어서 안나왔다. 나중에 만두 되냐고 여쭤보니 만두는 딱 12분 걸린다고 한다. 애매한거 같아서 안 시켰더니... ,별걸 다 리뷰하는,https://blog.naver.com/geldof,2019-06-26
[홍대] 평안도상원냉면 ,https://blog.naver.com/mapoguworker?Redirect=Log&logNo=222348637683, 냉면솔직히 이 정도면 정말 맛있다고 생각했다. 개인적으로 담엔 비냉 먹어보고 싶다. 사장님?도... 역시냉면 에는 전이 정말 잘 어울림. 이 음식백화점이 얼마나 레트로한지 알 수 있는 시계다. 나는 점심시간... ,마포구 직장인의 점심시간,https://blog.naver.com/mapoguworker,2021-05-12
[서울 마포구] 홍대 근처 맛집 평양냉면 평안도상원냉면 ... ,https://blog.naver.com/judangnom1?Redirect=Log&logNo=221990554118,아직 만두를 만들지 않아 먹을수 없었네요^^ 예전에 먹었던상원냉면물냉면 비빔냉면 만두 녹두지짐이 포스팅 첨부하도록 하겠습니다.메밀 면이 정말 부드러워서 위에 부담이 되지 않아 소화가... ,떠돌이 세상 살아가는 이야기,https://blog.naver.com/judangnom1,2020-06-05
2020 10대 맛의 달인《평안도상원냉면 》 4代 엄청난... ,https://blog.naver.com/a6969235?Redirect=Log&logNo=222447216168,4대를 이어 100년을 바라보는 맛 평양시상원 군에서 외할아버지가 가장 처음냉면 을 만들었다. 어머니가 돌아가시기 전 조리법(레시피)을 물어서 적어둔 것을 가지고 만들었다. 달인의 가게는 현재 딸까지... ,천하일신님의 블로그,https://blog.naver.com/a6969235,2021-07-27
평양 냉면 평안도상원냉면용인 찐빵 만두 달인 김치 달인... ,https://blog.naver.com/ooo5666?Redirect=Log&logNo=222186277881,2020 10대 맛의 달인 생활의 달인 마포 평안도식 평양 냉면 평안도상원냉면용인 찐빵 만두 달인 김치 달인 평안도식 만두 달인 서울 2대 떡볶이 달인 2020 10대 맛의 달인 생활의 달인 마포 평안도식 평양 냉면... ,YES,https://blog.naver.com/ooo5666,2020-12-26
은둔식달 달인 평양냉면상원냉면홍대9번출구,https://blog.naver.com/bio0bio?Redirect=Log&logNo=222018975782,"홍대 9번출구, 달인 평양냉면 맛집,상원 냉면평양냉면 맛집 홍대9번출구, 빌딩 지하에 음식백화점 내에상원냉면 집이 있다. 백화점 푸드 코너 처럼 여러 음식점들이 함께 있는 공간이다. 담백한 육수, 굵은... ","걷고 싶을 때, 걷자...",https://blog.naver.com/bio0bio,2020-07-02
홍대역 맛집 평안도상원냉면평양냉면 만두 녹두지짐,https://blog.naver.com/ohbams77?Redirect=Log&logNo=221561922813,홍대역 맛집 평안도상원냉면평양냉면 만두 녹두지짐 안녕하세요? 행신동 미용실 수호헤어 입니다. 지난번 주말 홍대 나들이 점심을 먹으러 갔던 평안도상원냉면입니다. 맛있는 평양냉면을 저렴한 가격에... ,행신동미용실 수호헤어,https://blog.naver.com/ohbams77,2019-06-14
홍대 평안도상원냉면 ,https://blog.naver.com/be_unique03?Redirect=Log&logNo=221442085999,낄낄 # 상원냉면 ..#홍대평양냉면..#평냉맛집.. 위치는 9번출구 건물 lg팰리스 지하 일층에 푸드코트 안에 있다 찾을때 과연 여기 있을까 싶지만 음식백화점이라고 써 있는 곳이 맞다! 영롱 맛이 무지 특이하다... ,Zzoe 블로그,https://blog.naver.com/be_unique03,2019-01-14
생활의달인 평양냉면 달인 파는곳 위치 가격 마포구상원냉면 ... ,https://blog.naver.com/kihong000?Redirect=Log&logNo=221978176069," 상원냉면7,000원 비빔냉면 7,000원 물냉면 7,000원 만두국 5,000원 냉면사리 2,000원 만두2개 영업시간 평일 11:30 - 15:00 평일 17:00 - 21:00 토요일 11:30 - 17:00 일요일 휴무 공휴일 휴무 평양냉면 달인 파는곳... ",맛집 상세 정보,https://blog.naver.com/kihong000,2020-05-25
"이제부턴 냉면 [ 상원냉면 ], [테일러커피]",https://blog.naver.com/minieljo?Redirect=Log&logNo=221569780503,유명 냉면집에 여름엔 가기 어려워요. 혹시 아직 덜 알려진 곳이 있을까 하고 찾다가 뜻밖에 접근성이 너무나 좋은 곳을 발견했습니다.상원냉면 . 홍대입구역 9번 출구와 연결돼있다는 겁니다. 아는... ,안방에서 뒷담화,https://blog.naver.com/minieljo,2019-06-24
평양냉면맛집/평냉맛집/ 상원냉면 ,https://blog.naver.com/koscandle?Redirect=Log&logNo=222139709943,#평냉맛집 # 상원냉면#평안도냉면 #최자로드상원냉면홍대역 올리브영 있는 LG펠리스 빌딩 지하에 있는 평안도상원냉면이미 최자로드에 소개되어 유명해진집 인기거품이 좀 빠진때라 방문 지하... ,수지니쌤의 Diary,https://blog.naver.com/koscandle,2020-11-09
"감나무집, 월강부산돼지국밥, 평안도상원냉면 , 연남동... ",https://blog.naver.com/hojyun?Redirect=Log&logNo=222130560299,"냠 가격은 돼지국밥 일반 9,000원 / 특 12,000원 , 수육 백반 11,000원 별점 5개 만점 / ★★★★★ 재방문 의사 O 평안도상원냉면태어나서 평양냉면 처음 먹어봤는데요. 이렇게 맛있는 줄 알았으면 진작 멀어볼 걸... ",#셀리로그,https://blog.naver.com/hojyun,2020-10-30
생활의 달인 마포 평양냉면 달인 평안도식상원냉면 ,https://blog.naver.com/love-haru?Redirect=Log&logNo=221984760250,생활의 달인 평안도식 평양냉면 달인 마포상원냉면생활의 달인 은둔식달 평안도식 평양냉면 달인... 평양시 상원군에서 저희 외 할아버지가 처음으로 냉면을 만들어 파셨습니다 레시피는 제가 어머니... ,ෆ,https://blog.naver.com/love-haru,2020-05-31
[일상] 평안도상원냉면 ,https://blog.naver.com/mahastha?Redirect=Log&logNo=222225086062,"3개월 쯤 외식을 아니 하였다. 겨울엔냉면 인데, 겨울 끝나기 전에-. @ 이것도 보고 있나? 2021","감성공작소, 가능태 공간",https://blog.naver.com/mahastha,2021-01-30
평양냉면 달인 평안도상원냉면(서울 마포구 동교동... ,https://blog.naver.com/ura0084?Redirect=Log&logNo=221978999271,가뜩이나 평냉을 사랑하는 한 사람으로써 여기는 꼭 가봐야겠네요! ...방송빨(?) 좀 줄어들면... Fin. #생활의달인 #평안도식 #평양냉면 # 상원냉면#홍대평양냉면 #홍대맛집 #물냉면 #비빔냉면 #만두국,계군의 맛집 블로그,https://blog.naver.com/ura0084,2020-05-26
[홍대입구냉면] 평안도 상원냉면- 홍대입구의 평양냉면,https://blog.naver.com/stylecom81?Redirect=Log&logNo=221727062323,홍대입구냉면 평안도 상원냉면지난번 방문 이후에 다시 한번 방문하게 되었습니다. 평안도상원냉면 . 순면을 먹어볼까 하다가 이번에도 일단 평양물냉면을 주문했습니다. 평냉을 보니 흐뭇하네요ㅎㅎ 슥슥슥... ,스타일컴의 Happy life,https://blog.naver.com/stylecom81,2019-12-04
"생활의달인 평양냉면 달인 평안도식 동치미 평냉, 홍대상원냉면 ",https://blog.naver.com/day265?Redirect=Log&logNo=221978205710,평안도상원냉면 이다 1953년에 평양시 상원군에서 외할아버지께서 평양냉면을 만드셨었고 그 맛을 이어 파주에서 상원집으로 이어져 내려오다가 냉면집을 정리한 이후 그 맛을 다시 시작한것으로 알고 있고... ,쵸묵쵸묵 어흥이,https://blog.naver.com/day265,2020-05-25
평양냉면 연말 특집 2020 10대... 평안도상원냉면12월 21일... ,https://comcomin.tistory.com/14385,12월 21일 월요일 sbs 생활의달인 777회 연말 특집 2020 10대 맛의 달인 평안도식 평양냉면 달인 [ 평안도상원냉면] 전화번호 02-332-8935 주소 서울 마포구 동교동 165-8 홍대입구역 9번 출구 37m... ,★■ 일루와 ■★,https://comcomin.tistory.com/,2020-12-24
[홍대입구냉면] 평안도 상원냉면- 홍대에도 평양냉면이,https://blog.naver.com/stylecom81?Redirect=Log&logNo=221689149503,홍대입구냉면 평안도 상원냉면평양냉면집이 있을 것 같지 않은 곳. 홍대입구역과 이어진 건물의 푸드코트에 위치한상원냉면 . 하지만 1953년 파주에서 시작한 1세대 평양냉면집입니다. 2대 부모님께서... ,스타일컴의 Happy life,https://blog.naver.com/stylecom81,2019-10-26
홍대입구역 / 평양냉면 숨은 맛집 [평안도상원냉면 ],https://blog.naver.com/tkdstudio?Redirect=Log&logNo=222102994364,홍대입구역 바로 근처에 위치한 #평양 냉면 맛집 엄청 유명해서 방문하자고 마음먹고 모였으나 길 찾기 어려웠다 *정말 어려움! 이런곳에 평양 냉면맛집이 있다고? 의심스러운 낡은 곳을 지나다보면 #음식백화점... ,원생의 하루,https://blog.naver.com/tkdstudio,2020-10-03
평안도상원 냉면27,https://blog.naver.com/xiaozhao?Redirect=Log&logNo=221569385145,나와 같은 뚱보가 제일 싫어하는 계절 여름 되는 일도 없고 미래 역시 그닥 주변에 새로 생긴 평양냉면 평안도상원 냉면위치는 홍대입구역 9번 출구 KFC 지하 1층 음식백화점 제일 안쪽에 위치 60%냐 100%냐... ,나야 조한경님의 블로그,https://blog.naver.com/xiaozhao,2019-06-24
평안도상원냉면평양냉면,https://blog.naver.com/hhhn_n?Redirect=Log&logNo=221665337314,#평양냉면 #평냉후기 #홍대입구 # 상원냉면#만두 #경과를지켜봅시다 멜로가 체질에서 천우희랑 안재홍이 평양냉면을 먹는데 나도 한번도 먹어본적이 없어서 한번도 안먹어본 친구랑 같이 평양냉면을 먹으러... ,알랑방귀가 바른말입니다,https://blog.naver.com/hhhn_n,2019-10-01
내카내먹- 홍대 달인 평양냉면집평안도상원냉면 ,https://blog.naver.com/tokio7025?Redirect=Log&logNo=222151446975,맛에 타협없는 사장님 #홍대평양냉면맛집 #평양냉면집짜추천맛집 #평양냉면진짜맛집 #평양냉면 상원냉면#홍대역평양냉면 #홍대역엘지팰리스지하식당가 #홍대평양냉면,맛세사(맛있는 세상을 산다는 건.),https://blog.naver.com/tokio7025,2020-11-22
냉면 441 ‘ 상원냉면 ’,https://blog.naver.com/sandalosmono?Redirect=Log&logNo=222125424653,02-332-8935 서울 마포구 동교동 165-8 티비 출연으로 유명세를 탄 냉면집. 육수가 아주 진하고 풍미가 있다. 그런데 점심 영업만 하는지 모르겠다. # 상원냉면#홍대냉면 #홍대맛집 #sandalos,sandalosmono님의블로그,https://blog.naver.com/sandalosmono,2020-10-24
생활의 달인 평양 냉면 마포 평안도상원 냉면 ,https://blog.naver.com/sue035?Redirect=Log&logNo=221978071111,"생활의 달인 평양 냉면 마포 평안도상원 냉면생활의 달인 평양 냉면 마포 평안도상원 냉면오늘(25일) 방영되는 SBS '생활의 달인'에서는 평양냉면 달인, 펑고 달인, 밤 빵 달인이 소개된다. 은둔식달... ",해바라기,https://blog.naver.com/sue035,2020-05-25
"평안도 상원냉면평양냉면 7,000원?! 가성비 짱!!_홍대입구역... ",https://blog.naver.com/theatermetal?Redirect=Log&logNo=221554684326,오늘은 홍대입구역 9번출구에서 가까운 곳에 위치한 평안도 상원냉면 이라는 식당을 리뷰해볼거에요.... 오른편에 입구가 있는데 여기 들어가자 마자 냉면집이 있어요. 푸드코트 안에서 하시는 거라서 자리는... ,맛집을 리뷰하다,https://blog.naver.com/theatermetal,2019-06-05
"마포 홍대 입구역 맛집 평양 냉면 평안도상원냉면점심, 서울... ",https://blog.naver.com/judangnom1?Redirect=Log&logNo=221553842333,"마포 홍대 입구역 맛집 평양 냉면 평안도상원냉면점심,서울 평양냉면맛집 강력 추천~! 오랜만에 우리 가족 홍대 주말 나들이를 가려고 집을 나섰습니다. 홍대에서 맛집도 가고 아이 쇼핑도 하려고 왔어요.... ",떠돌이 세상 살아가는 이야기,https://blog.naver.com/judangnom1,2019-06-04
홍대)평안도 상원냉면 ,https://blog.naver.com/jmp0503?Redirect=Log&logNo=222087833954,기존에 먹어봤던 다른 평양냉면이랑 뭔가 스타일이 다른듯 하면서도 매력있는 곳이라고 느꼈다. 맛집이 있을 것같지 않은 곳에 위치한 숨은 맛집. #평안도 상원냉면#평양냉면 #홍대 #홍대맛집,마이 블로거,https://blog.naver.com/jmp0503,2020-09-12
평양냉면 달인(마포/홍대 맛집상원냉면위치/가격/메뉴),https://blog.naver.com/aeffect?Redirect=Log&logNo=222011630594,홍대에 숨겨진 보물 평안도식 평양냉면 맛집상원냉면상원냉면서울 마포구 양화로 156 02-332-8935 [운영시간] 평일 11:30 - 15:00 토요일 11:30 - 16:00 일요일 휴무 공휴일 휴무 홍대맛집상원냉면메뉴/가격... ,독립일기,https://blog.naver.com/aeffect,2020-06-25
은둔식달상원냉면마포 평양냉면 생활의달인 펑고 달인... ,https://aridong.tistory.com/3409,생활의달인 밤빵 달인 김영길 서초구 방배동 베이커리 빵집 르팡 밤식빵 생활의달인 마포 평양냉면 달인 은둔식달상원냉면평안도식 평양냉면 생활의달인 펑고 달인 남원호 5월 25일 SBS 생활의 달인... ,아리동동,https://aridong.tistory.com/,2020-05-25
홍대 평양냉면 맛집상원냉면 ,https://blog.naver.com/dona_boutique?Redirect=Log&logNo=221815245453,"홍대에 위치한 평양 냉면전문점 방문했어요 홍대9번 출구앞에 KFC건물 지하에 있어요 음식백화점 내부에 있습니다 홍대에 이런데가 있었나라는 생각을 하며 순면 냉면 과 일반물냉을 시켰어요, 일반평냉은... ",모닐레주얼리.MONILE JEWELRY,https://blog.naver.com/dona_boutique,2020-02-19
4대째 손님이 끊이지 않는 평양냉면집 평안도 상원냉면 ,https://blog.naver.com/ndsibs?Redirect=Log&logNo=221978479025,평안도식 평양냉면 달인에 소개된 평안도 상원냉면생활의달인 풍미 깊은 육수를 만들기 위해 평안도식 평양냉면 달인이 만드는 특별한 레시피에 대해서 알아본다. 마포구에서 여름철 별미로 입소문이... ,"일산! 지킴이 ""일산아재""",https://blog.naver.com/ndsibs,2020-05-25
동교동 [평안도상원냉면 ],https://blog.naver.com/dplusp?Redirect=Log&logNo=221556592560,"평양 냉면순면 15,000원 국내산 메밀 100%로 뽑아내는 순면을 주문하면 추가 사리와 수육을 몇점 내어주신다. 서비스로 내어주신 녹두지짐 제주산 메밀가루 봉평메밀가루 20190527 @ 서울 마포 국내산... ",d+p,https://blog.naver.com/dplusp,2019-06-07
홍대 냉면맛집 [평안도 상원냉면 ],https://blog.naver.com/yklee8133?Redirect=Log&logNo=222100281726," 냉면 도 시켰으나 비쥬얼이 같으니 사진은 패스.냉면 면도 모밀이 많이 들은 듯해요 제육 결국 나머지 두 메뉴도 시켜버림 빈대떡 양지는 아니고 아롱사태를 쓴 편육냉면 을 즐기는 편은 아니지만, 내 입맛엔... ",건강한 밥집 쏘다니기,https://blog.naver.com/yklee8133,2020-09-26
평안도상원냉면743회 생활의달인 마포 평양냉면 평안도식... ,https://blog.naver.com/jbwk?Redirect=Log&logNo=221978219120,"com/21320 생활의 달인 743회 숨어있는 맛의 달인 은둔식달 평안도식 평양냉면 달인 상호 : 평안도상원냉면대표메뉴 : 평안도식 평양냉면, 물냉면, 비빔냉면, 순면냉면, 녹두지짐 녹두전 녹두 부침개... ",주옥같은 나날들,https://blog.naver.com/jbwk,2020-05-25
홍대역 평양냉면 -상원냉면 ,https://blog.naver.com/tokio7025?Redirect=Log&logNo=221585412161,홍대역 9번출구와 연결되어 있는 LG팰리스 빌딩 지하 1층 홍대상원냉면 .!! 국내산 제주 매일 또는 강원도 홍천 100%순수메밀로 만든 평양냉면.!! 요즘 최애 평냉집.!! #홍대역평양냉면 #홍대평양냉면... ,맛세사(맛있는 세상을 산다는 건.),https://blog.naver.com/tokio7025,2019-07-14
마포구상원냉면 ,https://blog.naver.com/dimijin?Redirect=Log&logNo=221978398435,"마포 맛집 홍대 평안도상원냉면생활의 달인 평양냉면 달인 은둔식달 : 가성비 짱 물냉면, 비빔냉면 출처 : 사랑이 밥.. | 블로그 http://naver.me/5TXgbVVC",Insyein 님의 블로그,https://blog.naver.com/dimijin,2020-05-25
 상원냉면- 홍대,https://blog.naver.com/sukjjunjjun?Redirect=Log&logNo=222341627136,"서울에 수많은 평양 냉면맛집이 있고, 난 거의다 가봤지롱. 최근에 어디서 홍대에 평양 냉면맛집이라는 소리를 듣고 방문. 간이 약간은 쎄지만, 순면 선택 가능하고 전체적으로 수준급! 또 갈것임.",JUNS’s,https://blog.naver.com/sukjjunjjun,2021-05-07
평안도상원냉면 ,https://blog.naver.com/jow69?Redirect=Log&logNo=222022639416," 냉면 .... 일단 육수색이 진하다. 그만큼 국물맛도 진한데 먹을수록 또 담백하다. 면은 뚝뚝 잘 끊어지는 메밀면이고, 반찬으로 나오는 무, 배추절임, 양파장아찌(이거 맛있다) 역시 슴슴하게 맛있다. 이름만 있고... ",삶의 나머지 시간...,https://blog.naver.com/jow69,2020-07-06
[홍대입구역] 평안도상원냉면 ,https://blog.naver.com/dlwnaud129?Redirect=Log&logNo=222025251138,주소 : 서울 마포구 양화로 156 최자로드 평양 냉면 편을 보고 알게된 곳이다. 동치미와 고기육수의 조화가 최고라는 말이 계속 생각나서 홍대 갈 일이 생겼을 때 먹었다. 평양 냉면 은 무조건 물 냉면 이라고... ,high wave,https://blog.naver.com/dlwnaud129,2020-07-08
Kenny's냉면맛집 리스트 202105 ...,https://blog.naver.com/hakenny?Redirect=Log&logNo=222346165242,평안도 상원냉면02 335 8935 생활의달인 냉면 서울 마포구 성산동 54-7 더평양 02 336 7582 네이버 냉면 서울 마포구 염리동 147-6 을밀대 02 717 1922 네이버 냉면 서울 서초구 서초동 1675-5... ,피사체에 담은 Museum ...,https://blog.naver.com/hakenny,2021-05-11
생활의 달인 마포상원냉면방배동 밤빵 르빵,https://blog.naver.com/pjiking1?Redirect=Log&logNo=221979519320,서울 마포구의 평양 냉면달인 보석같이 숨어있는 맛의 달인을 발굴하는 생활의 달인 프로젝트. 이날 은둔식달 잠행단은 마포구의 한냉면 집을 찾아간다. 이른 더위에 도망간 입맛을 잡아준다는 이... ,자영업성공아카데미,https://blog.naver.com/pjiking1,2020-05-26
 냉면#100 2021 SUMMER,https://blog.naver.com/dplusp?Redirect=Log&logNo=222494323864,com/dplusp/221682815055 036_동교동 [평안도 상원냉면 ] 냉면 https://blog.naver.com/dplusp/221556592560 037_당인동 [당인동국수공장] 당인냉면 https://blog.naver.com/dplusp/221530444670... ,d+p,https://blog.naver.com/dplusp,2021-09-04
마포구의 유명한 평양 냉면맛집,https://blog.naver.com/radiobj5?Redirect=Log&logNo=221761777602,오늘 새해 첫 평양냉면을상원냉면 에서 먹었습니다. 먹은 후 너무 맛있어서 블로그에 한 번 소개해야겠더군요. 이런 가게는 잘 되어서 계속 이런 맛 난 음식을 먹을 수 있었으면 합니다. 새해 복 많이 받으세요.,수현아빠의 스토리텔링 프레젠테이션,https://blog.naver.com/radiobj5,2020-01-06
평양냉면 맛집 - 홍대상원냉면 ,https://blog.naver.com/tokio7025?Redirect=Log&logNo=221556490359,홍대에서냉면 이 먹고 싶을때는 이 집.!! 100% 국내 제주도산 메밀로 만들어낸 순면 평냉은 그야말로 엄지척.!! 삼삼한 육수는 원샷을 부른다.!!! 홍대역 9번출구. LG팰리스 지하 1층 #홍대평양 냉면#홍대맛집... ,맛세사(맛있는 세상을 산다는 건.),https://blog.naver.com/tokio7025,2019-06-07
서울 마포구 홍대 평양냉면 맛집_평안도 상원냉면 ,https://blog.naver.com/chltkdehd13?Redirect=Log&logNo=222102979525,평양 냉면 입니다!!!! 점심시간이 여유가있어서!! 평양 냉면 을 먹으러갔습니다!! 본부장님도 함께 갔어요!! 평양 냉면먹으러간다고하니까 같이가자고하셔서!! 평냉으로 꼬셨습니다!!ㅎㅎ 홍대입구역에 위치한... ,아재들의 모든 맛집,https://blog.naver.com/chltkdehd13,2020-09-29
