title,link,description,bloggername,bloggerlink,postdate
군포 대야미 중국식냉면-상원 손짜장,https://blog.naver.com/sean999?Redirect=Log&logNo=222064867782,날도 좋고 갑자기 중국냉면 이 땡깁니다. 그냥 근처로 검색되는 곳으로 방문. 옛날 한 때 안산으로 실습... 중국 냉면 .. 만원.. 비싸네. 평양 냉면급이다. 살짝 망설였지만 중국 냉면먹으러 왔으니 흔들리지... ,I my 味 mine,https://blog.naver.com/sean999,2020-08-19
동교동 [평안도상원냉면 ] 2019,https://blog.naver.com/dplusp?Redirect=Log&logNo=221479075989,"백김치 물 냉면7,000원 20190225 @ 서울 동교동 극한 냉면가성비의 극단치를 갱신하다",d+p,https://blog.naver.com/dplusp,2019-03-03
"이어진, 홍대에서 만난 진짜 평양냉면 - 평안도상원냉면 ",https://blog.naver.com/nasisemi?Redirect=Log&logNo=221561315017,"(대한민국 최고의 숨어있는 평양냉면) 1953년 이전부터 이어진, 홍대에서 만난 진짜 평양냉면 - 평안도상원냉면 ",더하루,https://blog.naver.com/nasisemi,2019-06-13
수원 광교 한우 맛집 @ 상원 회관 솔직후기∗:•),https://blog.naver.com/supergj8283?Redirect=Log&logNo=222530744089,♥️ 짝꿍이 먹고싶어했던 후라이ㅎㅎ 그리고 비빔밀면- 비빔 냉면 에 면만 좀 다르다 생각하시면 돼요... 오늘 좋은 고기 좀 먹어보자! 그럴 때 가기 좋은 집! 광교상원 회관 잘 먹었습니다☺️ 2021년 10월 3일,오늘도 안녕히*:D,https://blog.naver.com/supergj8283,2021-10-08
"서교,연남동 버바나, 마구로창고, 평안도 상원 냉명... ",https://blog.naver.com/chups9?Redirect=Log&logNo=222416101666,"이날 점심은 사치스럽게 도로우니동 주문했는데 좀 기름진 느낌이었다.홍대입구역 LG팰리스 지하 식당가에 위치한 평안도상원냉면 . 근처에서 가장 평냉 잘하는 곳이라 종종 가는데, 순면 100%로 주문하면 가장... ",베쯔의 책 그리고 차,https://blog.naver.com/chups9,2021-07-01
진주 냉면 ,https://blog.naver.com/johs1207?Redirect=Log&logNo=222502822376,광화문국밥상원냉면을밀대 - 살얼음이 싫어 늘 거냉으로 먹음 부원면옥 우래옥 - 고추가루 없는 평냉중 가장 좋아함 평양면옥 아직 서울에서 먹기에는 점포 수가 많지 않지만 기회가 될 때 마다 여러 진주냉면... ,-,https://blog.naver.com/johs1207,2021-09-12
 냉면#1002020SUMMER,https://blog.naver.com/dplusp?Redirect=Log&logNo=222049080814,com/dplusp/220005103813 004_연천 [황해냉면] http://blog.naver.com/dplusp/220417098590 005... com/dplusp/221047605754 037_동교동 [평안도 상원냉면 ] https://blog.naver.com/dplusp... ,d+p,https://blog.naver.com/dplusp,2020-08-02
평양 냉면 의 계절!!! 동치미 평양 냉면 의 맏형... ,https://blog.naver.com/yssy1231?Redirect=Log&logNo=222219290980,"홍대입구 ' 상원냉면 ' 정도이고, 남양주의 '능라 평양냉면', 동두천의 '평남면옥', 일산 '모란각' 그리고 내가 가장 좋아하는 집인 경기도 연천의 '황해냉면' 등이 있다. 미쉐린 가이드 서울 빕 구르망 2021 명단... ",혼자가는산구경,https://blog.naver.com/yssy1231,2021-01-25
서울 평안도 상원냉면 ,https://blog.naver.com/leamas0124?Redirect=Log&logNo=222171337995,Canon EOS 700D : EF-S 24mm F2.8 STM / 4500 * 3000,냉면특공대,https://blog.naver.com/leamas0124,2020-12-12
"가성비 냉면, 홍대입구역 평안도상원냉면 (구, 상원집)... ",https://blog.naver.com/audi600629?Redirect=Log&logNo=222330335044,https://story.kakao.com/1wns9665/eGqWGf727W0?x_imp=dG9yb3Nfc2VydmljZV9iYXNlx_hk=MzFjMTJjYTM2YzBiNTcxNjM2,木鷄 & 사랑 실천 관심 배려,https://blog.naver.com/audi600629,2021-05-01
평양 냉면- 북한산 만포면옥 본점 은둔식달 고양시 평양 냉면 ... ,https://blog.naver.com/gypsyone?Redirect=Log&logNo=222022933823,개인적으로는 얼마 전에 평안도식 평양냉면으로 나온 홍대 평안도 상원냉면 을 추천하고 싶어 그곳 링크로 마무리한다. ㅎㅎㅎ 본 포스팅의 사진과 게시글은 세콰노가 직접 찍고 주관적으로 작성하였기에... ,세콰노의 머거머거,https://blog.naver.com/gypsyone,2020-07-06
이 건물에 이런 곳이 있었나 싶었던상원냉면 ,https://blog.naver.com/bluejy6?Redirect=Log&logNo=222007481177,#맛도양도가격도괜찮아인기많더라,bluejy6님의 블로그,https://blog.naver.com/bluejy6,2020-06-21
 냉면가격이 비싸면 안가면 돼지?,https://blog.naver.com/taegyunk?Redirect=Log&logNo=222348353940,"홍대 평안도상원냉면비교적 최근 SBS 생활의 달인에 방송되면서 뒤늦게 알려진 곳이다. 냉면집으로는 뜬금없는 장소인 홍대, 그것도 빌딩 지하 식당가(LG팰리스 지하상가 음식백화점)에 자리하고 있다.... ",강릉 살기 0년차,https://blog.naver.com/taegyunk,2021-05-12
평양 냉면청계천 아니래도 맛있다,https://blog.naver.com/cenatan?Redirect=Log&logNo=222453187661,위치 서울시 송파구 오금로36길 26-1 ▶평안도상원냉면출처 mk.co.kr SNS에서 엄청나게 소문난상원냉면 . 이 집의 평양냉면 을 맛보고 나면 적어도 주관적 기준에서 100점은 되어 보였다. 일반 메밀면과... ,Where & When,https://blog.naver.com/cenatan,2021-08-07
(청량리) 평양 냉면| 내가 바로 진짜 생활의달인 평양 냉면 ?... ,https://blog.naver.com/yssy1231?Redirect=Log&logNo=221991347232,"부원면옥, 서북면옥, 오류동 평양냉면, 유진식당, 평안도상원냉면정도가 만원이하의 평양냉면집이다. 이집은 안주류도 만원이하의 가격이어서 돼지수육에 소주한 병 먹고 냉면으로 입가심하면, 그게 바로... ",혼자가는산구경,https://blog.naver.com/yssy1231,2020-06-05
[맛집] 내돈내산 솔직후기 평양 냉면13곳 추천,https://blog.naver.com/bigdot17?Redirect=Log&logNo=222425919752,"여기는 혹시 아직 부모님을 안모셨다면 석고대죄하고 머리를 9번 찧은 후에 얼른 모시고 다녀오자. (마포 대흥역) 진미평양냉면, 평안도상원냉면 , 을지면옥, 필동면옥, 을밀대 체인점으로는 배꼽집, 봉피양 추천!",소듐쟁이 닥터의 진료/영화/일상 이야기,https://blog.naver.com/bigdot17,2021-07-09
천년의 꿈《평양 냉면계보》 평부심의 세계/대미필담大味必淡,https://blog.naver.com/a6969235?Redirect=Log&logNo=222425359859,"진미평양냉면 2017년 광화문국밥, 피양옥 2018년 당인동국수공장, 홍대 평안도상원냉면 , 성수동 색다른면, 역삼 평양옥, 교대 서관면옥, 삼성동 경평면옥, 대치동 판동면옥 2019년 송파 옥돌현옥, 서초 설눈... ",천하일신님의 블로그,https://blog.naver.com/a6969235,2021-07-09
10대 맛의 달인. 신세계 떡볶이. 평안도상원냉면(+ 짱떡볶이),https://blog.naver.com/audi600629?Redirect=Log&logNo=222203730899,https://m.cafe.daum.net/topokkilove/F39R/1916?svc=daumapp,木鷄 & 사랑 실천 관심 배려,https://blog.naver.com/audi600629,2021-01-11
 냉면그 감격에 대하여,https://blog.naver.com/baest90?Redirect=Log&logNo=222223488340,작년에는 집안 어르신이랑 냉면 살발하게 먹고 다녔습니다. 근데 종류는 다양하진 못했어요 어르신께서 을밀대파여서 일산이랑 본점 계속 러쉬했습니다. 그 외로는 연남 고여사평택. 홍대상원냉면 . 합정... ,ALL GOOD.,https://blog.naver.com/baest90,2021-01-28
홍대상원냉면 ,https://blog.naver.com/kidprince81?Redirect=Log&logNo=221985634420,https://sequanus.tistory.com/m/544,혜인쭌파더님의 행복상상 블로그,https://blog.naver.com/kidprince81,2020-06-01
가보고 싶은냉면 막국수 집- 이름과 출신이 다른냉면 (EX... ,https://blog.naver.com/magi04?Redirect=Log&logNo=222232810520,한주는 냉면/막국수 한주는 덕볶이 이렇게 갈까도 궁리중입니다. 신의 국수발 1. 우래옥 : 여기... 여주 천서리/하남시 봉진막국수 (수정중) 가봐야할곳 리스트 1. 설눈 2. 서관면옥 3. 평안도상원냉면 ,진눈깨비 내리는 마을,https://blog.naver.com/magi04,2021-02-05
좋아해 올해의 평양 냉면 들,https://blog.naver.com/rkalzhf?Redirect=Log&logNo=222525559023,"정인면옥 능라도 우래옥 우주옥 +상원냉면올해 나의 평냉들의정부 평양면옥 , 동무밥상도 곧가야지",B530,https://blog.naver.com/rkalzhf,2021-10-03
"홍대입구역 1분컷, 생활의 달인 평양 냉면맛집",https://blog.naver.com/casy135?Redirect=Log&logNo=222258454272,에 있는 재야의 고수 맛집상원 냉면 에 대해 포스팅해볼게요~~ 음식 백화점... 이라는 상호부터... 다른 집도 많이 찾아봤는데 보통 평양냉면이 1만원이상 하더라구요. 그 맑은 육수를 위한 소고기 때문인가...?... ,그림과 함께 춤을!,https://blog.naver.com/casy135,2021-02-27
"평양냉면달인 홍대상원냉면 , 홍대 9번출구, 카카오건물",https://blog.naver.com/bio0bio?Redirect=Log&logNo=222018687788,,"걷고 싶을 때, 걷자...",https://blog.naver.com/bio0bio,2020-07-02
[일상 기록하기] 생애 첫 평양 냉면 / 연남동 중식당 향미/ 술과... ,https://blog.naver.com/pkjhg5?Redirect=Log&logNo=222396880704,그리하여 생애 첫 평양냉면을 먹다..! 날씨도 더워지고 시원한 음식을 찾아 오게된 곳은 평안도 상원냉면상원냉면8000원 첫 맛의 느낌 1. 갱장히 맛이 밍밍하다 2. 장조림 궁물의 맛이 아주 희미하게 느껴진다... ,A day well spent,https://blog.naver.com/pkjhg5,2021-06-13
9월. 가을의 시작!,https://blog.naver.com/tanya99?Redirect=Log&logNo=222519479224,코로나 검사하러 홍대 갔다가 궁금했던상원냉면방문. 가성비로 유명한데 맛본걸로 만족. 육수도 면도 많이 아쉽다. 냉면보다 녹두전이 맛있네. 망원동 더 파인트. 메뉴에 없는 하우스와인도 맛있고 분위기도... ,폴리치치네,https://blog.naver.com/tanya99,2021-09-28
봉피양의 평양 냉면 은?#평양 냉면 을맛나다 [서른아홉],https://blog.naver.com/yssy1231?Redirect=Log&logNo=222347934843,"봉피양 방이점 평양냉면(￦14,000) 이 집은 평양냉면을 주문하면 독특하게도 큼직하고 도톰한 제육 2점이 같이 나온다. 홍대 '평안도상원냉면 '에서 순면을 주문하면 수육이 같이 나오는것과 비슷하다. 면기는... ",혼자가는산구경,https://blog.naver.com/yssy1231,2021-05-12
서울 마포구 합정 평양 냉면맛집_동무밥상,https://blog.naver.com/chltkdehd13?Redirect=Log&logNo=222224251764,평양냉면입니다!!!! 호우!! 추워도 냉면은 못참지!! 오늘 진짜 또 추워요ㅠㅠ 엄청 추운데우ㅠ유ㅠ... 굳이 비슷한 느낌이라면 홍대의상원냉면 !! 약간의 동치미 국물의 꿉꿉 그런 향이 아주 약간있고 시원하면서... ,아재들의 모든 맛집,https://blog.naver.com/chltkdehd13,2021-01-29
홍대 동아 냉면홍대입구 매운 비빔 냉면물 냉면맛집 포장가능,https://blog.naver.com/mkup_forman?Redirect=Log&logNo=222526241434,첨엔 친절한 관광안내원분께서 냉면 맛집이라는상원냉면 을 추천해 주셨는데. 실내가 약간 덥고 북조선 스타일의 냉면이라 살얼음이 없어서.. 포기하고 두 번째로 추천해 주신 곳으로 이동했어요..여긴 날씨가... ,고독한 여행가의 일상 패키지,https://blog.naver.com/mkup_forman,2021-10-04
[추가- 상원 가든 3월은 수리중]제주맛집이라 불러도... ,https://blog.naver.com/myma771?Redirect=Log&logNo=221824899751,온국수나냉면 을 파는데상원 가든은 막국수를 팔아요 역시 특이해 아니 특별해 ㅎ ㅎ ㅎ 이곳은 처음 주실때는 비빔국수랑 같이 면에 양념장을 올려서 나오는데 육수를 주전자에 함께 주세요 그래서 취향에... ,제주도팀빌딩레크레이션 제주놀자 마대표입니다,https://blog.naver.com/myma771,2020-02-26
상수냉면 집 당인동국수공장. 한마디로 깔끔한 맛,https://blog.naver.com/ok3171?Redirect=Log&logNo=222503428952,"내리쬐는 한낮의 땡볕에 맞서며 시원하게 물냉면을 들이켜시는걸까. 메뉴는 이렇습니다. 평양식... 평냉 가격이 만원을 훌쩍 상회하는 요즘 작년보다 1천원 올랐어도 9천원이니까 홍대상원냉면 , 종로... ",맛있는 상상이 몰려온다,https://blog.naver.com/ok3171,2021-09-12
전국 평양 냉면맛집 BEST - 5,https://blog.naver.com/pyojeong0731?Redirect=Log&logNo=222485294948,"봉산평양냉면, 수원 평장원, 안양 관악관, 홍대 평안도상원냉면 , 교대 더진미평냉, 독산동 진영면옥, 연남동 우주옥, 송파 옥돌현옥, 성산 더평양, 광명 정인면옥 평양냉면, 성내동 성일면옥, 수유... ",호두마루의 호두농원,https://blog.naver.com/pyojeong0731,2021-08-27
평양 냉면 ,https://blog.naver.com/centros?Redirect=Log&logNo=222482286488,진미평양냉면 서울 강남구 논현동 115-10 7. 상원냉면서울 마포구 동교동 165-8 8.유진식당 서울 종로구 낙원동 221 9.부원면옥 서울 중구 남창동 47-10 부원상가 2층 10.오류동 평양냉면 서울 구로구... ,깡통,https://blog.naver.com/centros,2021-08-24
"서울 최고의 평양 냉면맛집 10곳, 한편으로 끝내기",https://blog.naver.com/bu888?Redirect=Log&logNo=222340491970,진미평양냉면 서울 강남구 논현동 115-10 7. 상원냉면서울 마포구 동교동 165-8 8.부원면옥 서울 중구 남창동 47-10 부원상가 2층 9.유진식당 서울 종로구 낙원동 221 10.오류동 평양냉면 서울... ,Endtime & 시대의 징조,https://blog.naver.com/bu888,2021-05-06
광교 한우[ 상원 회관]에서 투뿔1++한우 완전 부드럽고 맛있네요!,https://blog.naver.com/haity32?Redirect=Log&logNo=221608279863,밀면(비빔) 고기들을 다 먹고 후식으로 뭘 먹을까 보니상원 회관에는냉면 이 없고 밀면이 있더라구요! 오!!비빔과 물밀면 중에 저희는 비빔밀면을 먹었는데요. 사장님께서 직접 바로 조리해서 가져다가... ,꿈을꾸는꿈,https://blog.naver.com/haity32,2019-08-07
포텐 터졌던 홍대 맛집 리뷰,https://blog.naver.com/godnjs8323?Redirect=Log&logNo=222229430509,"평안도상원냉면메뉴: 물냉면 8,000원 주소: 서울 마포구 양화로 156 번호: 02- 332 - 8935 시간: 11:30 - 15:00 일요일, 공휴일 휴무 다음으로 방문한 곳은 생활의달인에 출연해 유명세를 탄 평안도상원냉면 이에요.... ",wony ♥ one’s daily life,https://blog.naver.com/godnjs8323,2021-02-03
