title,link,description,bloggername,bloggerlink,postdate
"홍대/합정에서 먹은것들 ( 상원냉면 ,시골순대,미에우)",https://blog.naver.com/ljh5344?Redirect=Log&logNo=222312334227,"기본은 8천원 평안도상원냉면메뉴 물냉면 / 비빔냉면 8,000원 냉면 곱배기 추가 3,000원 순면냉면 (메밀100%) 15,000원 순면 곱배기 20,000원 녹두지짐 7,000원 편육 160g 19,000원 제육 160g 14,000원 물냉 두개에 제육하나... ",Chez JINA,https://blog.naver.com/ljh5344,2021-04-17
평안도상원냉면 . 생활의달인 홍대입구역 평양냉면 8천원,https://blog.naver.com/ok3171?Redirect=Log&logNo=222406817778,평소라면 점심때가 훌쩍 지나 혼밥으로 가겠지만 오늘은 이른 점심으로 냉면을 먹어야겠어요. 아침 건너뛰면 더 맛있겠죠 뭐. 평안도상원냉면홍대입구역 9번출구와 연결된 LG팰리스빌딩 지하1층 푸드코트... ,맛있는 상상이 몰려온다,https://blog.naver.com/ok3171,2021-06-22
2020년 대한민국 10대 맛의 달인 홍대 평양냉면 평안도 상원냉면 ,https://blog.naver.com/sniper98?Redirect=Log&logNo=222179983078,2020년 대한민국 10대 맛의 달인으로 선정된 평안도 상원냉면 의 비빔냉면입니다. 새빨간 양념의 비쥬얼도... 냉면도 냉면이지만 비지가 더 맛있다며 순식간에 한그릇 비웠습니다. 처음 시작은 평안도 평양시 상원... ,대구맛집블로거 맛소클짱 혁이의 맛여행,https://blog.naver.com/sniper98,2020-12-22
"홍대 평양냉면 맛집, 평안도상원냉면가성비 최고!",https://blog.naver.com/susie9211?Redirect=Log&logNo=222180183386,"올해 두 번 다녀온 홍대상원냉면6월에 한번, 그리고 6개월이 지난 12월에 한번 두 번 다녀온 방문기 합쳐서 포스팅 :D 홍대 평양냉면 맛집 평안도상원냉면주소: 마포구 양화로 156 홍대입구역 9번 출구 앞... ",수지의 미완성 이야기,https://blog.naver.com/susie9211,2020-12-21
홍대 평양냉면 평안도상원냉면: 최자로드 맛집,https://blog.naver.com/gus45e?Redirect=Log&logNo=222168975470,평양냉면상원냉면 은 고기 육수에 동치미 국물이 섞여 일반 평양냉면과 다르게 산미가 좀 더 강하다 하지만 적절한 조화를 이뤄서 딱 맛있음! 평양냉면 특유의 쿰쿰한 국물맛은 정말 황홀... 같이 나오는... ,스쳐간 것들의 기록,https://blog.naver.com/gus45e,2020-12-11
평양냉면의 숨은 보석 - 홍대입구역 평안도상원냉면 ,https://blog.naver.com/mercyblu?Redirect=Log&logNo=222442073998,냉면을 하는 곳이 있다고? 반문할 곳이다.) 상호명의 이름은 실제 평안도의 지명이다. 평안도 상원군에... 평안도상원냉면 . 냉면을 좋아한다면 무조건 가봐야할 곳이다. ☎ 02-332-8935 | 서울 마포구 양화로 156... ,머시블루's Happy Nation,https://blog.naver.com/mercyblu,2021-07-23
홍대 냉면 전문점 평안도 상원냉면 ,https://blog.naver.com/saypumpy?Redirect=Log&logNo=221704276108,"한동안 SNS를 뜨겁게 달구었던 홍대 냉면, 평안도상원냉면 이 그 주인공입니다. 파주에서 오래 장사하던 상원집이 문을 닫고 아드님이 새롭게 홍대에 문을 열었다고 하더군요. 재료 하나하나 신경쓰신다고... ",알고 보면 아저씨 입맛,https://blog.naver.com/saypumpy,2019-11-11
홍대입구역 맛집 평안도식 평양냉면 평안도 상원냉면(생활의... ,https://blog.naver.com/gene_k?Redirect=Log&logNo=222181905106,"평양시 상원군에서 처음 냉면을 만들어 파셨던 외할아버지의 레시피를 그대로 이어오고 있다고 한다. 그래서 상호도상원냉면 ~ 평일 오전 11시 30분부터 오후 3시까지, 토요일은 오후 4시까지 영업한다.... ","젠타의 ""너 맛집맞아?""",https://blog.naver.com/gene_k,2020-12-23
생활의 달인 평양냉면의 숨은 고수:: 홍대 평안도 상원냉면 ,https://blog.naver.com/onsili?Redirect=Log&logNo=222179579922,"이제 먹어볼까?!~ 잠시 후, 주문한 생활의달인 평안도 상원냉면 의 평양냉면이 나왔는데요! 여기 사장님께서 방송 출연 당시에서 얼굴 공개 불가!! 모자이크 처리되서 나온 달인이신데....아직까지 어머님이... ",정낭자의 빵생빵사,https://blog.naver.com/onsili,2020-12-25
생활의달인 홍대 평양냉면 평안도상원냉면 ,https://blog.naver.com/nanacook?Redirect=Log&logNo=222172925622,육수가 참 궁금했던 평안도상원냉면 의 냉면육수 화면에서 보던것 보다 실제 색은 좀 더 맑고 갈색빛이 돌았는데 간이 강하지도 않고 밸런스가 아주 딱 좋더군요. 백김치랑 무절임도 나왔는데..사실 냉면 먹을때... ,Nana's kitchen,https://blog.naver.com/nanacook,2020-12-15
"홍대입구역 평안도상원냉면 , 푸드코트 외진 자리에서 만난... ",https://blog.naver.com/mudoidoi?Redirect=Log&logNo=221821138934,"홍대입구역 근처 푸드코트에서 맞이하게 된상원냉면 의 평양냉면입니다. 곱빼기인데도 1만원, 서울시내 유명 평양냉면들보다 저렴한 가격이네요. 고명을 내리니 면타래가 보이는데 제대로 만들어졌다는 느낌이... ",돈내고사먹읍시다(舊Serendipity),https://blog.naver.com/mudoidoi,2020-03-11
"평양냉면 달인, 서울 마포구 동교동 홍대맛집 평안도 상원냉면 ... ",https://blog.naver.com/dndbwodnjs?Redirect=Log&logNo=222180255033,있는 #평안도 상원냉면평양냉면 먹으러 이런곳에 오기는 또 처음이네요 평일 11:30 - 15:00 토요일 11:30 - 16:00 일요일 / 공휴일 휴무 돌고돌아 결국 같은층의 다른 매장 사장님께 물어 도착한 평안도상원냉면엥?... ,지봉공쥬,https://blog.naver.com/dndbwodnjs,2020-12-21
[홍대] 평안도상원냉면 ,https://blog.naver.com/sienalis?Redirect=Log&logNo=222420520245,평안도상원냉면영업은 늘 오후 세시까지 주문은 키오스크에서 최자로드에도 작년에 나왔었던 이 곳 대부분 국내산을 사용 녹두지짐 맛있다던데 늘 품절인거 같아요 물냉면은 수입이 섞여있는거라 물냉면 1... ,tasting lab,https://blog.naver.com/sienalis,2021-07-05
[홍대입구역] 평안도상원냉면- 평양냉면,https://blog.naver.com/bears18?Redirect=Log&logNo=222468205452,평양냉면 전문 평안도상원냉면 . 가격은 저렴한편. 키오스크로 주문해야한다. 음식 픽업도 셀프. 빈대떡이랑 제육이 먹고 싶었는데 판매를 안한다. 오픈시간 맞춰서 간거라 품절은 아닌듯. 할수없이 소고기... ,PURA VIDA,https://blog.naver.com/bears18,2021-08-13
홍대 평양냉면 '평안도상원냉면 ',https://blog.naver.com/kaisr2?Redirect=Log&logNo=221983340768,평안도상원냉면 은 이북식 냉면을 제대로 만들어낸 것 같아서‥이런 스타일을 잘 모르고 먹는다면 삼삼한 맛에 고개를 갸우뚱 할 수 있겠습니다 단순하게 표현하면 간이 약하지만 은근히 느껴지는 육수의 깊은... ,나의 일기장,https://blog.naver.com/kaisr2,2020-05-29
마포 평양냉면평안도상원냉면 ,https://blog.naver.com/ttottoppippi?Redirect=Log&logNo=222522543140,앞으로도 종종 찾을 것 같네요. 02 332 8935 목금토 11:00 - 15:00 Last order 12:30 일 월 화 수 휴무 #홍대입구역 #평양냉면 #평양냉면맛집 #평안도 상원냉면#냉면맛집 #맛집 #일상 #점심 #냉면 #마포 #마포평양냉면,먹고 보는 발레리나,https://blog.naver.com/ttottoppippi,2021-10-01
"홍대입구상원냉면 , 마포 평양냉면, 비빔냉면맛집 달인 맛집",https://blog.naver.com/tmishaha?Redirect=Log&logNo=222025876346,생활의달인 743회 방송 후기 홍대 평양냉면 맛집상원냉면홍대입구역 9번출구 LG팰리스 건물 지하1층 푸드코트에 꽁꽁 숨겨져 있는 평양냉면 맛집상원냉면 . 겉보기에는 평범한 푸드코트에 있는 허름한... ,Amazing BLOG,https://blog.naver.com/tmishaha,2020-07-09
평안도상원냉면홍대입구맛집 판다곰 후기 올려요~feat.... ,https://blog.naver.com/kbearp?Redirect=Log&logNo=222400299902,전에 다녀온 서북면옥이랑 같은 가격이에요~상원냉면비빔냉면이고요 비빔냉면이지만 안에 또 육수가 들어있더라구요~~상원냉면물냉면이에요 이전에 먹었던 평양냉면 국물색이랑 또 달라요 이번에도... ,판다곰과 조련사의 소소한일상,https://blog.naver.com/kbearp,2021-06-16
생활의 달인 평안도식 평양냉면 달인 - 마포구 평안도상원냉면 ,https://blog.naver.com/gypsyone?Redirect=Log&logNo=222180709212,"평안도상원냉면 의 비빔냉면 밑에 육수가 살짝 깔려 있고 고소한 향기의 양념장이 뿌려져 있다. 잘 비벼서 먹어주면 되는 데 약간 아쉬운 것이 지난번보다 많이 달아짐 예전에는 매콤, 새콤, 달콤, 감칠맛에... ",세콰노의 머거머거,https://blog.naver.com/gypsyone,2020-12-21
"홍대상원냉면 , 평안도상원냉면 을 맛보다",https://blog.naver.com/africaphoto?Redirect=Log&logNo=221993936772,"평양냉면 답게 어르신들이 제법 있었습니다. 그리고 면덕후들의 모습도 보이더군요, 저와 이야기 한 분은 이곳상원냉면 에 대해 잘 알고 계시더군요. 대기번호 35번. 이곳은 오자마자 대기번호표를 받고... ",www.Africaphoto.net,https://blog.naver.com/africaphoto,2020-06-08
"홍대 혼밥, 가성비 평양냉면인 평안도상원냉면 ",https://blog.naver.com/selyhr?Redirect=Log&logNo=222442431823,"여기 평안도상원냉면 은 평양냉면으로 유명하고, 생활의 달인에도 나왔다고 하네요. 지하 1층의 오래된 느낌의 음식백화점의 다른 식당 앞은 텅텅 비었는데, 여기 홍대 평안도상원냉면앞의 자리만 꽉 차... ",我好想念你,https://blog.naver.com/selyhr,2021-07-24
다시 찾은 홍대 평양냉면상원냉면/ 생활의달인 은둔식달,https://blog.naver.com/kcddrum?Redirect=Log&logNo=222103554867,다시 찾은 홍대 평양냉면상원냉면생활의달인 은둔식달 2020년 9월 29일 2시경 방문 마포구 주민 (세 달 전) 시절 평안도상원냉면이라는 생활의달인 은둔식달 냉면 편에 나온 집을 방문한 적이 있는데 아주... ,덕드럼의 덕슐랭 가이드,https://blog.naver.com/kcddrum,2020-09-30
[日常] 홍대입구역에 이런 냉면집이? 평안도상원냉면다녀왔어요~,https://blog.naver.com/jazzmate?Redirect=Log&logNo=222044121492,왼편)평안도상원냉면 이 자리잡고 있습니다 에전에 찍은 메뉴 배너 사진을 보면 뭔가 메뉴가 더 많이 적혀 있었는데지금은 냉면 위주로만 판매하는가 봅니다~ 메뉴 배너가 있는 주방 앞에서 주문을 하고... ,14P 와가마마 레코멘,https://blog.naver.com/jazzmate,2020-07-28
"망원-연남 : 웨스트빌피자,8891프로젝트,평안도 상원냉면 ... ",https://blog.naver.com/yeewon000?Redirect=Log&logNo=222322727423,스멜이 #평안도 상원냉면유리띠 만나야 먹을 수 있는 평양냉면 특이한 분위기의 푸드코트에 있어서 사알짝 의심했는데 맛있었다#커피슬롭 후식 커피 마시러~~ 원래 계획으로는 유리는 병원 가고 나 혼자... ,나의 세계,https://blog.naver.com/yeewon000,2021-04-25
"홍대 평양냉면 맛집 평안도상원냉면 (물냉면, 순면)",https://blog.naver.com/shintang2?Redirect=Log&logNo=222264038182,"평안도상원냉면 은 음식백화점 내부에서도 제일 끝쪽에 위치하고 있으며 이곳에 있는 상점들중 가장... 현재는 냉면과 녹두지짐, 편육, 제육 정도만 판매하고 있다 평양냉면(물냉면)이 8천원이라... 이미 많은... ",캠핑과 텃밭 사이..,https://blog.naver.com/shintang2,2021-03-04
[홍대/서교동] 평안도상원냉면 ... #평양냉면을맛나다[서른여섯],https://blog.naver.com/yssy1231?Redirect=Log&logNo=222285826932,"1953년, 지금의상원냉면쥔장 부모님께서 파주에 '상원집'이라는 평양냉면집의 문을 열어 영업을 시작하셨다고 한다. 한때 그 인근에서는 가장 큰 식당으로 성장해서 장사를 하셨었는데, 건강이 안 좋아지셔서... ",혼자가는산구경,https://blog.naver.com/yssy1231,2021-03-24
맛의 퀄리티 유지를 위해 하루 세시간운영하는 “ 상원냉면“,https://blog.naver.com/joycham?Redirect=Log&logNo=222327261366,"방향으로 나온다, 이 곳으로 나가면 아까 그 KFC를 볼 수 있다 . 있지 않을 법한 곳에 있는 # 상원냉면#홍대평양냉면 #평안도 상원냉면#생활의달인평양냉면 #생활의달인맛집 #홍대가볼만한곳 #블챌 #오늘의일기",행복하고 맛있는 인생,https://blog.naver.com/joycham,2021-04-30
 상원냉면- 생활의 달인 10대 맛의 달인 평안도식 평양냉면 달인... ,https://blog.naver.com/zephyr122059?Redirect=Log&logNo=222181392155,"◆◆홍대 맛집 평안도상원냉면: 순면 물냉면, 비빔냉면, 녹두 지짐◆◆ 다시 방문했을 때 전보다 맛이 나아지면 나는 그 음식점을 진정성이 있는 집으로 생각하고 좋아하게 된다. 생활의 달인 10대 맛의 달인... ",사랑이 밥먹여준다,https://blog.naver.com/zephyr122059,2020-12-22
홍대입구역 평안도상원냉면 /생활의달인 평양냉면:가성비란... ,https://blog.naver.com/zadoz?Redirect=Log&logNo=222116652339,드뎌 #생활의달인 평양냉면 홍대 평안도상원냉면의 맛을 보게 되는군요 평안도상원냉면의 메뉴 입니다. 물냉면 이 8천원 캬~ 요즘 #평양냉면 한그릇에 8천원 하는곳은 종로 낙원동의 유진식당 외에는 보지... ,판교 한량 김사장,https://blog.naver.com/zadoz,2020-10-15
[밥상] 홍대/동교동 - 평안도상원냉면: 평양냉면,https://blog.naver.com/mahastha?Redirect=Log&logNo=221666534782,평안도 상원군을 떠올리게 한다. 평양냉면. 순한 육수에 메밀 면 말아낸 냉면 기대하게 만든다. 홍대 동교동 맛집 - 평안도상원냉면: 물냉면 물냉면 곱빼기다. 그릇 가운데 메밀 면을 삶아 곱게 자리에 놓고... ,"감성공작소, 가능태 공간",https://blog.naver.com/mahastha,2019-10-06
"[홍대역] 평안도상원냉면 , 새롭게 느껴보는 평양냉면~",https://blog.naver.com/choikya?Redirect=Log&logNo=222421579856,"작년 5월에 생활의 달인에 나온 식당이고, 작년 연말 10대 맛집에도 선정된 ' 상원냉면 '집을 가려고... 점심시간보다 조금 이른 시간에 도착해 들어가자마자 우선 비빔냉면과 물냉면곱배기를 주문했습니다. 이제... ",세상사랑,https://blog.naver.com/choikya,2021-07-06
[리뷰] 10대 맛의달인평양냉면 평안도상원냉면 ,https://blog.naver.com/pasodoble?Redirect=Log&logNo=222190388843,참고로 평안도상원냉면 은 평안도에 있는 상원이라는 동네이름이라고 한다 이 냉면의 유례정도는 알고 먹어야 좀더 맛있다고 본다 ㅋㅋㅋㅋㅋ 여기는 정말 숨겨진 보석같은 곳이다 다른곳과 달리 고깃국물을... ,지랄고양이의 지구여행,https://blog.naver.com/pasodoble,2020-12-30
마포구 홍대입구역 평안도상원냉면- 생활의 달인 평양냉면,https://blog.naver.com/gypsyone?Redirect=Log&logNo=221978085201,#평안도 상원냉면#생활의달인평양냉면 #평양냉면달인 #생활의달인 # 상원냉면#평안도식평양냉면 생활의 달인 평양냉면 달인 마포구 평안도상원냉면2020년 5월 25일 월요일 743회 생활의 달인 은둔식달 - 마포구... ,세콰노의 머거머거,https://blog.naver.com/gypsyone,2020-05-25
홍대 맛집 생활의달인 은둔식달 평안도식 평양냉면상원냉면 ,https://blog.naver.com/fredda?Redirect=Log&logNo=222182402527,9번출구랑 건물 지하가 연결되어 있어서 지상을 통하지 않고 가는게 더 빠르네요 푸드코트의 안쪽에 있는상원냉면도착하자마자 물냉면을 주문해보았습니다 결제는 선불~ 물냉면 물냉면을 받아서 사진 한장... ,뿌레의 잡동사니,https://blog.naver.com/fredda,2020-12-22
[홍대입구]상원냉면 ,https://blog.naver.com/tysec11?Redirect=Log&logNo=222394364995,목수의 딸은 낮에도 운치가 있다. 물론 커피도 아주 좋다. #냉면맛집 #평양냉면 # 상원냉면#홍대맛집 #100%순면냉면 #경의선철길 #목수의딸 #냉면의달인 #생활의달인평양냉면 #평안도 상원냉면 ,뫼뚜벅이,https://blog.naver.com/tysec11,2021-06-11
초보자 입문용으로 좋은 평양냉면 맛집상원냉면 ,https://blog.naver.com/jungae325?Redirect=Log&logNo=222006915284,하지만 나는 평양냉면 을 모르는 초보자 라서 긴장하며 검색해서 다녀온 홍대 평안도상원냉면평양냉면의 경우 일반 냉면이랑 달라서 굉장히 심심하고 밍밍하고 먹을때는 음..뭐지..? 이러고 그날 집에가서... ,맛있게 먹고 봉구랑 뛰어놀기 ㅡ,https://blog.naver.com/jungae325,2020-06-24
생활의달인 평양냉면 홍대입구역상원냉면 ,https://blog.naver.com/minki1232?Redirect=Log&logNo=221979667886,"따님의 뒷모습과 함께 포스팅을 마무리하도록 하겠습니다. 감사합니다. 생활의 달인 연출 이득녕, 이상준, 김동현, 오덕영, 안기선, 정용준 출연 방송 2005, SBS #생활의달인평양냉면 # 상원냉면#서울평양냉면맛집",5월 공인중개사사무소 김민기,https://blog.naver.com/minki1232,2020-05-26
[홍대 맛집 /상원냉면 ] 평양냉면 - 조금 힘들었던 새로운 평냉,https://blog.naver.com/qkrdidrbssla?Redirect=Log&logNo=222262500681,메뉴판상원냉면 의 냉면 가격은 8천원이다. 평양냉면치고는 상당히 저렴한 가격이다. 물론 순면으로 주문하면 거의 두배에 가까운 가격이 되지만 만원이 넘는 평양냉면 집들도 100% 순면으로 하지 않는 경우가... ,또또로의 엥겔지수 상승기,https://blog.naver.com/qkrdidrbssla,2021-03-03
최자로드 냉면 평안도상원냉면솔직후기,https://blog.naver.com/h_anz?Redirect=Log&logNo=222223372022," 상원냉면물냉면 \8,000 냉면과 함께 나오는 물김치와 무절임입니다. 사실 평양냉면을 먹을때는 저는 그 본연의 맛에 집중하고자 밑반찬을 아무것도 먹지않는 편이지만, 이곳의 냉면맛은 평양스러우면서도... ",한츠의 오늘은?,https://blog.naver.com/h_anz,2021-01-28
"홍대 평양냉면 , 평안도상원냉면(feat 최자로드)",https://blog.naver.com/kangyoujin_?Redirect=Log&logNo=222357873424,"주문하고 기다리는 중에 다른 손님이 오셔서 주문 가능한지 여쭤보니 2시 50분이 라스트오더라 하시더라 헐,, 우리 도착한 시간 2시 45분 조금이라도 더 늦었으면 못먹었을 홍대 평양냉면,상원냉면 ,,, 평일... ",과이리의 일상LOG,https://blog.naver.com/kangyoujin_,2021-05-28
마포 맛집 홍대 평안도상원냉면생활의 달인 평양냉면 달인... ,https://blog.naver.com/zephyr122059?Redirect=Log&logNo=221978041459,"#생활의달인 #평양냉면달인 #은둔식달 #마포맛집 #홍대 #평안도 상원냉면#물냉면, 단정하게 똬리를 튼 우아한 자태가 좋다. 이렇게 정성 들인 것이 8000원인데, 15000원이나 받아 처먹으면서 봉두난발한 것처럼 면... ",사랑이 밥먹여준다,https://blog.naver.com/zephyr122059,2020-05-25
★ 홍대입구 평안도상원평양 냉면 ,https://blog.naver.com/yaznayu?Redirect=Log&logNo=221796697032,지하 2층이 아니라 지하 1층임 * 주문 받으면 반죽 시작하므로 음식 나올 때까지 시간이 좀 걸림 * 가성비 매우 훌륭 평양 냉면매니아 타로군이 홍대입구에서 발견한상원평양 냉면약속장소 찾아가는데... ,★ 야즈나유 게임기획,https://blog.naver.com/yaznayu,2020-02-22
[홍대]평안도 상원냉면: 맛과 가격이 모두 착한 평양냉면,https://blog.naver.com/0qkrtjdgur?Redirect=Log&logNo=222294713925,"평안도상원냉면 의 물냉면은 잘만든 갈비탕의 차가운 버전? 면은 구수하고 좋은데 라멘으로치면 면익힘이 카타, 파스타로는 알덴테였습니다. 이건 취향좀 타겠네요. 8천원에 저 퀄리티면 감사하죠. 단점은 역시... ",유망주,https://blog.naver.com/0qkrtjdgur,2021-04-01
홍대 냉면맛집_평안도상원냉면#홍대평양냉면 #홍대맛집,https://blog.naver.com/kkumbee?Redirect=Log&logNo=222056593014,메뉴 볼게요!ㅎㅎ 평안도상원냉면 _메뉴 냉면집 중에서 비교해보면 다른 곳들보다 가격이 참 착하네요! 물냉면 비빔냉면 하나씩 시켜보았어요. 다른 테이블 손님들은 편육도 많이들 주문하시더라구요!... ,평범하지않은 회사원의 일상,https://blog.naver.com/kkumbee,2020-08-10
홍대에 이런 냉면집이~ 평안도상원냉면 ~,https://blog.naver.com/emflaeh63?Redirect=Log&logNo=222382264539,"평양냉면이 아닌 평안도상원냉면 으로 예전 파주에서 유명했었다고 하네요~ 물냉면, 비빔냉면, 순면냉면 이렇게 3가지를 고루 시켜보았습니다. 이 비빔냉면은 제가 알고 있는 매꼼하고 질긴?면의 함흥식도... ",투박해 (two 朴 해),https://blog.naver.com/emflaeh63,2021-06-03
[홍대맛집] 평양냉면 먹으러상원냉면 으로~,https://blog.naver.com/mose09?Redirect=Log&logNo=222350621340,홍대kfc 지하 푸드코트에 위치한상원냉면도착. 평안도 냉면스타일이라고 한다. 최자로드에서 보고 가까워서 꼭한번 오고싶었다. 와이프는 일반물냉 나는 순면 순면이 나왔다. 메밀 100%라고 한다. 그리고... ,행복하고 즐거운 하루하루,https://blog.naver.com/mose09,2021-05-14
서울 동교동- 평양냉면.../평안도상원냉면 ,https://blog.naver.com/pianocl?Redirect=Log&logNo=222251500080,"메밀냉면 입니다. 평안도상원냉면 ... 부부(?)가 운영을 하시는듯, 독특한 것은 식당의 위치인데 대형건물의 지하층 푸드코트에 자리하며 8천원을 선불로 계산 후 푸짐한 냉면을 맛볼 수 있고 바이러스 때문인지... ",퍄노조율사의 블로그,https://blog.naver.com/pianocl,2021-02-23
"주초반이 슁..하고 지나갔네요..평안도상원냉면 , 명지대... ",https://blog.naver.com/yk0515?Redirect=Log&logNo=222474810693,"평안도상원냉면LG팰리스빌딩 지하 푸드코트에 있습니다. 상당히 을씨년 스럽습니다. 휴일이기도 하지만, 장사가 안되서도 인지 약 10집 정도가 있는데 이날 문 연 집은 3집 정도.. 그래도 여기 냉면집은 만석에... ",순간순간 후회하지 않는 삶을 살아가야~~,https://blog.naver.com/yk0515,2021-08-18
동교동 [평안도 상원냉면 ],https://blog.naver.com/eatndrink?Redirect=Log&logNo=222378729407,뜬금없는 위치의 뜬금없는 푸드코트에 위치한 평양 냉면 집 물 냉면 이나 비빔 냉면가격은 상당히 저렴하고 순면은 국내산 메밀이라 그런지 제법 가격이 나가는데 의외로 순면 드시는 손님도 심심치 않게 보이던 날... ,야매(夜梅)의 eatNdrink,https://blog.naver.com/eatndrink,2021-06-01
"평안도상원냉면 ] 맛과 가격, 접근성 모두 탁월한 평양냉면집.... ",https://blog.naver.com/dasian?Redirect=Log&logNo=222284016770,"“아무래도 평양 냉면, 그래서상원냉면 ” 홍대입구역 평안도상원냉면서울특별시 마포구 양화로 156 평양냉면이 참 많이 대중화되었지만, 왠지 모르게 ‘평냉’ 하면, 꼿꼿한 가게 주인과 맛부심을 부리는... ",문작가의 하고싶은 이야기,https://blog.naver.com/dasian,2021-03-22
 상원냉면생활의달인냉면집 은둔식달냉면집,https://blog.naver.com/lou35?Redirect=Log&logNo=222118492227,먹기위해 차를 타고 찾아가면서 먹는것도 삶의 고행이지 않을까 생각해본다! 그래도 평양냉면이 좋다! #평안도냉면 # 상원냉면#홍대앞냉면집 #생활의달인은둔식달 #평양냉면 #녹두지짐 #셀프선불서비스매장냉면집,항동가 허수아비의꿈!,https://blog.naver.com/lou35,2020-10-17
생활의 달인이 만드는 홍대 평안도상원냉면- 가성비 최고,https://blog.naver.com/mok527?Redirect=Log&logNo=222220476287,쉬는 날 점심에 평양냉면을 먹으러 갔습니다. 평안도상원냉면 은 홍대입구역과 바로 붙어있는 엘지 펠리스 지하에 있습니다. 지하철을 타고 올 때는 9번 출구 밑에 연결되는 입구가 있습니다. 이곳으로... ,불꽃의초롱이,https://blog.naver.com/mok527,2021-01-27
마포구 홍대 평양냉면 평안도상원냉면생활의달인 평안도식... ,https://blog.naver.com/candystellar?Redirect=Log&logNo=221978189869,"그래서 생활의달인 평안도식 평양냉면 달인으로도 소개되는 것! 1953년 파주 금촌터미널앞에서 상원집... 생활의달인 평안도식 평양냉면 달인,, 마포구 홍대 평양냉면 평안도상원냉면 이다. . . . . . 홍대입구역... ",5gam이 새콤달콤한 시간_☆ by.스위티즘,https://blog.naver.com/candystellar,2020-05-25
