title,link,description,bloggername,bloggerlink,postdate
군산횟집새만금횟집신선하고 맛있어요.,https://blog.naver.com/hodu1982?Redirect=Log&logNo=221493907259,바다도 참 좋아해 자주 가는 새만금 항인데 바닷가 특유의 비릿한 냄새도 안나고 꽤 깨끗해서 아이랑... 군산횟집새만금횟집신선한 회와 맛있는 한상 장군이를 어린이집에 보내며 그동안 수고한 나 자신에 대한... ,I'm not alone,https://blog.naver.com/hodu1982,2019-03-21
[군산맛집] 새만금횟집 ~ 푸짐한 상차림에 감동 받는 박대탕,https://blog.naver.com/chefjhkim?Redirect=Log&logNo=70153301212,돌아오는 길에 들린 군산 새만금에 있는새만금횟집 입니다 박대탕이 유명하다고해서 찾아 간 곳입니다 일요일이어서인지 늦은 점심시간인데도 거의 자리가 없었습니다 두사람이 식사할 수 있는 작은 룸이... ,바람꽃과 솔나리,https://blog.naver.com/chefjhkim,2012-12-10
군산 선유도 여행 그리고새만금횟집물고기에서 먹방까지,https://blog.naver.com/endorphins01?Redirect=Log&logNo=221372625413,군산새만금 이 이어지고 이제는 섬이 아닌 육지가 된 현재 아직까지는 자연 그대로의 모습이 많이 남아 있지만 요즘은 여기저기 공사가 한창입니다 많은 사람들이 찾으니 숙박시설부터 어쩌면횟집등 다양한... ,여행맛go,https://blog.naver.com/endorphins01,2018-10-07
군산횟집추천새만금횟집장춘!,https://blog.naver.com/tnrl0228?Redirect=Log&logNo=221294078692,이곳은 새만금도매어시장! 낚시용품을 취급하는 곳도 있고 떡집도 보이고 진짜 은근 다양한 종류의 가게들이 있었는데용ㅎ 제일 만이 눈에 띄는게 역시~~ 군산 새만금횟집이더라구용ㅎ 많았던 횟집 중에서도... ,죠리포옹의 우유한잔,https://blog.naver.com/tnrl0228,2018-06-08
"[군산 새만금]새만금횟집: 군산횟집 추천, 서해안 3대 횟집",https://blog.naver.com/jhp444?Redirect=Log&logNo=221621382942,"군산 여러 횟집을 다녀봤지만,새만금횟집정말 알차게 나왔거든요. 태안 선창횟집, 강화도 용궁횟집과... 저는 특별한 자리여서 새만금 1인 스페셜 7만원으로 했지만 음식이 전반적으로 정말 괜찮았기 때문에... ","작은 나, 큰 포부",https://blog.naver.com/jhp444,2019-08-19
군산횟집 여긴 꼭 간다새만금횟집 ,https://blog.naver.com/yuna0030?Redirect=Log&logNo=221400799248,군산횟집 여긴 꼭 간다새만금횟집카일리입니다! 주말에 가족과 군산여행도하고 맛난 횟집도 다녀와서 포스팅 합니다. 군산에는 낚시 하러 자주 가는 편이기도 하고 바다가 있어서 인천 사람이었던 저희 가족은... ,카일리행복요리육아,https://blog.naver.com/yuna0030,2018-11-18
군산 맛집추천새만금횟집회무한리필 ㅋ,https://blog.naver.com/ccamjigi77?Redirect=Log&logNo=221410733123,멀리 새만금방조제?이름맞나? 여튼 바다 바로 옆..비흥항이든데..모든 버스가 여기서 환승 군산... 맛집추천새만금횟집4층건물이 전부 횟집 전북 군산시 비응안7길 13 비응항환승터미널근처 0634641001 매일 11:00... ,Happiness is always near,https://blog.naver.com/ccamjigi77,2018-12-02
군산 횟집새만금횟집배터지게 먹고옴!,https://blog.naver.com/bennywhang?Redirect=Log&logNo=221299966805,"신선하고 질 좋은 해산물을 합리적인 가격에 먹을 수 있다는 군산 횟집새만금횟집 을 찾았다.... 꽁치-박대구이 - 새만금스페셜 1인 : 70,000원 A코스 + 도미머리구이, 랍스타(연포탕-랍스타 지리) ※코스요리... ",벤 문의 세상살이,https://blog.naver.com/bennywhang,2018-06-16
군산새만금횟집뷰가 끝내주는 물고기자리,https://blog.naver.com/oklovemin?Redirect=Log&logNo=221439240455,그래서 제가 미리 저번에 혼자 와서 봐둔 군산새만금횟집으로 갔답니당~!! 이번에 가서 친구들이랑 진짜 푸짐하게 먹고 왔어요!! 식당에서 맛있게 식사하기 전에 항상 제가 여기로 여행을 오면 들리는 새만금... ,행복이 가득한 뭉이웅이네♡,https://blog.naver.com/oklovemin,2019-01-11
"[군산/횟집] 군산여행 맛집 3탄,새만금 횟집 ",https://blog.naver.com/hoisulhi?Redirect=Log&logNo=221410900879,건물 하나가 다새만금 횟집 이다. 1층은 이렇게 따로 손님은 받지 않고 생선들만 있었다. 메뉴판 이거... 새만금에 대한 간략한 정보가 있다. 지역인가봄.. 조금은 밋밋한 죽이 나왔다. 속은 편하게 달래주지만... ,맛선생 이설렘의 맛탐험,https://blog.naver.com/hoisulhi,2018-12-02
군산 횟집 추천 감동하고 왔다니까새만금횟집 ,https://blog.naver.com/evgeneia_0214?Redirect=Log&logNo=221439481191,"워낙에 군산 횟집 추천 받았던 곳이라 걱정없이 예약해뒀지요^^ #군산여행코스 비응도가실때도 들리고 새만금 구경하실때도 오시고 단체도 많고, 진짜 손님이 어마어마해요! 건물하나가 전부 # 새만금횟집 ... ",체리와 엄마는 집콕중,https://blog.naver.com/evgeneia_0214,2019-01-11
군산 횟집새만금횟집회정식 무난한 식사,https://blog.naver.com/mk797979?Redirect=Log&logNo=221277561734,"군산 횟집새만금횟집회정식 무난한 식사 안녕하세요 :) 지난 군산여행에서 점심으로 뭘 먹을까 고민하다가, 은동이가 회가 먹고 싶다고 해서... 군산의 유명한 횟집새만금횟집 에 다녀왔어요. 시내와는 꽤나... ",★리락쿠마의 즐거운 나날★,https://blog.naver.com/mk797979,2018-05-17
군산 비응항 맛집~ 비응항을 바라보며새만금횟집 ,https://blog.naver.com/jyleen?Redirect=Log&logNo=221365621519,군산 비응항 맛집~ 비응항을 바라보며새만금횟집군산 관광을 왔다가 비응항을 구경한 뒤 새만금방조제 도로를 타고 줄포방향으로 갈 계획 이었습니다. 점심시간이 가까워 와서 횟집을 찾으니 비응항 주면에... ,♣슈퍼맨의 세상사는 맛~,https://blog.naver.com/jyleen,2018-09-26
군산 맛집새만금횟집처음 먹어본 랍스터 회,https://blog.naver.com/ldhs1020?Redirect=Log&logNo=221479296798,군산 맛집새만금횟집처음 먹어본 랍스터 회 주말간 뭔가 맛있는 음식을 먹고 싶어 검색하다가 찾은... 일본 횟집에서 먹는 광어 회랑 별 차이 못느끼겠더라구요. 요건 새우장인데 처음 먹었을 때는 약간 비릿한... ,보름달의 게임과 일상 블로그,https://blog.naver.com/ldhs1020,2019-03-03
군산횟집 /새만금횟집회무한리필/ 박대탕,https://blog.naver.com/ru8405?Redirect=Log&logNo=221112827067,"군산횟집새만금횟집 을 소개합니다. 군산횟집새만금횟집 은 전국 10대 명물 횟집중 한집이라고 합니다. 전국 10대 횟집 : 강화도 용궁횟집, 속초 당근마차, 군산새만금횟집 , 강릉 해동횟집, 포항 환여횟집, 여수... ",뿌요의 재미있는 집,https://blog.naver.com/ru8405,2017-10-08
군산새만금횟집이 군산횟집 중 최고,https://blog.naver.com/parksb44?Redirect=Log&logNo=221007267487,서천사랑이 추천하는 맛집 오늘은 군산 에 유명한 횟집 인새만금횟집을 소개합니다 군산 새만금 입구에는 오래전에는 비응도 라고 불렸던 섬이 있습니다 하지만 지금은 간척사업으로 인해 섬이 아닌 육지가... ,서천사랑은 여행중,https://blog.naver.com/parksb44,2017-05-16
군산새만금횟집N예약하고 가니 박대구이가 서비스로 나와서... ,https://blog.naver.com/bau83?Redirect=Log&logNo=221369521491,군산새만금횟집 . 지난 추석연휴때 찾은 군산 횟집이에요. 날이 좋았던 덕분에 새만금 방조제에서 멋진 일몰을 보고.. 그곳에서 가장 가까운 횟집을 네이버 예약한 후 찾았는데요. 코스 요리를 주문하면 회가... ,아리솔의 행복여행,https://blog.naver.com/bau83,2018-10-02
군산새만금횟집'파랑돔 ' 새만금 맛집 추천!,https://blog.naver.com/manbokim90?Redirect=Log&logNo=221064886467,"군산새만금횟집파랑돔 새만금 맛집 도시는 작아도 맛집이 너무나 많은 매력넘치는 군산에서 꼭... http://blog.naver.com/manbokim90/221062761028 ' ' 저희가 방문한 파랑돔 횟집은 비응항 1세대 횟집으로, 사장님이 약... ",self storage ( ་ ⍸ ་ ),https://blog.naver.com/manbokim90,2017-08-02
새만금맛집 추천 :새만금횟집군산횟집 후기!!,https://blog.naver.com/dbstkdrud12?Redirect=Log&logNo=221130574634,"B코스는 쓰끼다시12종, 해물7종, 소금구이, 생선구이, 튀김, 매운탕으로 구성되어있어요. 테이블이 꽉 찰 정도로 푸짐하네요 ㅎㅎ 군산 횟집추천합니다 ~~^^새만금 맛집 군산 횟집전화번호 063)466-3115 ***-****-****",LUNARIAN,https://blog.naver.com/dbstkdrud12,2017-11-01
스끼다시 대박~ 군산횟집새만금 ,https://blog.naver.com/san1078?Redirect=Log&logNo=220975542340,군산 횟집 /새만금 횟집스끼다시 대박~ 주말에 가족과 함께 군산 여행~ 군산 시내 한 바퀴 둘러보고 점심은 비응항에 있는 군산횟집에서 먹었다 서해안 3대 횟집으로 알려진 새만큼횟집 1층 수족관엔 살아 있는... ,만점맘의 만점스토리,https://blog.naver.com/san1078,2017-04-05
선유도가기/ 새만금횟집 /경암동철길마을/이화찹쌀피순대,https://blog.naver.com/its_snowing?Redirect=Log&logNo=221397172655,서해 3대 맛집새만금 횟집비응항에 위치한새만금횟집 은 여러가지 타이틀이 있다. 서해3대횟집 이라는 타이틀 그리고 전국최초로 박대탕을 만든 곳이기도하다 박대탕 원조집 이라는 것이다. 가격표를... ,담이의 감성블로그,https://blog.naver.com/its_snowing,2018-11-12
군산횟집새만금횟집회정식코스로 먹고왔어요,https://blog.naver.com/juwuen9801?Redirect=Log&logNo=221220276517,출발전 폭풍검색해보니새만금횟집 이 서해안3대횟집으로 유명하더라구요. 바로 예약하고 고고씽~ 무슨 횟집이 이렇게 커? 하고 놀랬지만 다먹고 나갈때쯤 이유를 알게됐어요. 이 넓은 횟집이 손님들로 꽉꽉... ,줘니닷컴,https://blog.naver.com/juwuen9801,2018-03-02
군산횟집새만금횟집:: 친절해서 더 좋았던곳,https://blog.naver.com/jujupnara2?Redirect=Log&logNo=221194704902,군산 나들이 갈때 추천하고 싶은 횟집새만금횟집나는 전주에서 팔딱이네는 광주에서 군산 나들이 출동 =3 군산 수협 중매인1호가 운영하신다는새만금횟집1층에서 물고기 구경 좀 하다가 2층으로... ,밥벌레의 잡스런 이야기,https://blog.naver.com/jujupnara2,2018-01-27
군산횟집 수협 중매인 1호새만금횟집방문기,https://blog.naver.com/tnvlfwjd?Redirect=Log&logNo=221239304837," 새만금횟집 은 1층을 제외하고 2,3층의 전 테이블이 모두 룸이라 가족들이랑 오기 좋은 군산횟집인듯 해요.새만금횟집 은 부산 마라도, 통영 해원횟집, 여수 백초횟집 등과 함께 전국 10대 명물횟집으로... ",세상에 맛집멋집,https://blog.naver.com/tnvlfwjd,2018-03-28
[군산횟집]새만금횟집 ,https://blog.naver.com/cute2002k?Redirect=Log&logNo=221210888490,시간인지라 횟집에서 바로 가족을 만났습니다 군산 맛집을 치면 가장 먼저 뜨는게 바로 이새만금횟집있더라구요 저희는 회정식 기본 1인당 3만 원짜리를 시켰습니다 4만 원짜리부터는 회를 무제한으로 먹을 수... ,조블리여사,https://blog.naver.com/cute2002k,2018-02-18
[군산여행/군산맛집/군산 새만금맛집새만금횟집 ]푸짐하고... ,https://blog.naver.com/bosughom88?Redirect=Log&logNo=221115871148,저희 이튿날 아침에는 새만금방조제를 보구 회를 먹는 일정이었어요 ㅋㅋㅋㅋㅋ 근처에 많은 횟집들이 있었지만 저희는새만금횟집 에서 한끼식사를 하기로 했습니다! 정말 가격대비 코스요리도 너무 푸짐하구... ,쿠루미의 일상다반사,https://blog.naver.com/bosughom88,2017-10-27
군산횟집새만금횟집서해안 3대 횟집,https://blog.naver.com/junghyun0504?Redirect=Log&logNo=221056054479,전국 10대 명물 횟집으로 소개되었다는새만금횟집 을 다녀왔습니닷! ㅋ 군산수협 중매인 1호가 직접 운영해서 아무래도 회사 신선하긴 할꺼 같습니다 ㅋ 아래층에는 박대탕을 하는 장소인것 같은대~ 아버님이... ,♡오두막♡ 먹고 즐기고 사랑하라!!,https://blog.naver.com/junghyun0504,2017-07-20
새만금도로 드라이브 후... 신선한 회! 군산cc맛집새만금 횟집 ,https://blog.naver.com/ekqsldn?Redirect=Log&logNo=220384562560,같아요~ 새만금 방조제가 시작되는 곳! 비응항! 비응항에는 말린 생선을 팔고 있는 곳과 신선한 회를 먹을 수 있는 곳이 많이 있더라구요. 그 중 군산 맛집으로 유명한새만금횟집 으로 갔어요. 옹오우~ 방송에도... ,깡,https://blog.naver.com/ekqsldn,2015-06-09
군산 맛집새만금횟집 ,https://blog.naver.com/qyeajong?Redirect=Log&logNo=220596249341,나빠하겠지만...)새만금 방조제나 채석강에서 칼 바람을 맞으며 새해의 각오를 다지는 것도 삶의 한 부분으로 자리를 잡은 듯 하고요... 올 새해에도 변함없이 군산으로 go go~~~ 군산은횟집 이 많아 선택의 폭이... ,민 공인중개사,https://blog.naver.com/qyeajong,2016-01-13
[군산 맛집] 새만금 맛집은새만금횟집 에서~!!!,https://blog.naver.com/mungiz09?Redirect=Log&logNo=220720268767,보통 횟집중에 매운탕 맛 없는 곳 별로 없지만 또 딱 맛있는 매운탕은 먹어본 기억이 별로 없는데 군산 맛집새만금횟집 은 매운탕이 넘나 맛있었어요!! 군산 맛집 :: 새만금 맛집은새만금횟집 에서 +_+ 주소... ,MJ Life ʕ•ᴥ•ʔ,https://blog.naver.com/mungiz09,2016-05-26
군산맛집 / 군산횟집은~새만금횟집♩,https://blog.naver.com/yousy1009?Redirect=Log&logNo=220190417958,군산횟집새만금횟집 이예요 바닷가에가면 회는 꼭먹어줘야하는거같아요 :)새만금횟집 은 1인당... 메뉴는 ~ 새만금스페셜 2인!A코스에 + 전복초 + 와다가 추가된메뉴예요 칼칼하고 시원한 바지락탕 바지락도... ,알쏭달쏭~,https://blog.naver.com/yousy1009,2014-11-26
전주맛집/우아동맛집새만금횟집 ,https://blog.naver.com/hee261600?Redirect=Log&logNo=220359287834,저렴한가격에 맛있는 횟집 ▲ 새만금횟집안녕하세요 닉네임바꾼 설희입니다 이제부터 설희스토리로 운영됩니다 많은 응원과 성원 부탁드립니다 ㅋㅋㅋㅋㅋㅋㅋㅋㅋㅋㅋㅋㅋ 본론으로 들어가서 요기는 정말.... ,희스토리,https://blog.naver.com/hee261600,2015-05-18
군산새만금횟집 ,https://blog.naver.com/sunghiv?Redirect=Log&logNo=220349704901,군산 새만금횟집 여러군데를 검색해 보앗는데 요기로 결정 나오는 회며 기본찬이며 가격까지 딱좋아... 생각햇는데 매운탕도 맛이 좋을듯햇다 조개탕이 괜찮앗거덩~~~ 가격까지 저렴해서만족했던 횟집,항상 스마일 ^^,https://blog.naver.com/sunghiv,2015-05-04
군산맛집은 역시새만금횟집 ,https://blog.naver.com/yee1036?Redirect=Log&logNo=220575271465,바로바로 군산맛집하면 떠오르는 곳인새만금횟집 입니다. 전북 군산시 비응도동 62-12 예약전화 : 063-464-1000 / 063-464-1001 3층의 건물전체가 횟집으로 되어있는곳으로 이곳에서는 아주 유명한 곳이랍니다. 이날도... ,똥썹모친의 맛이야기,https://blog.naver.com/yee1036,2015-12-22
"군산맛집,군산횟집은새만금횟집 으로 레츠고!",https://blog.naver.com/slaj963?Redirect=Log&logNo=220763160034,군산맛집 군산횟집은새만금횟집 으로 레츠고! 군산에 있는새만금횟집 에서 오빠랑 친구랑 회를 먹고왔습니돠!! 오옿ㅎㅎㅎㅎㅎ저희 4명이서 갔는데 방을 내어주시더라구요ㅋㅋㅋㅋ 뭔가 특별한... ,써닝의 먹고 즐기고 보고 느끼는 일상,https://blog.naver.com/slaj963,2016-07-15
군산횟집 ::새만금횟집군산여행 회정식으로 시작~,https://blog.naver.com/yo2diki?Redirect=Log&logNo=220873007661,"회만 맛있길 바라며 회정식 2인 주문~ 군산횟집새만금횟집회정식 1인 25,000원 회 소스로 간장와사비, 된장, 초장이 제공됐다. 회정식이다보니 역시 기본음식으로 해산물 한접시가 나왔다. 해삼, 멍게, 개불... ",너와 나의 행복한 동행,https://blog.naver.com/yo2diki,2016-11-29
조개무침_전북 김제_ 새만금 횟집 ,https://blog.naver.com/ched97?Redirect=Log&logNo=20107252575,"조개무침이새만금 횟집 의 별미 였습니다. 조개를 초고추장에 찍어 먹어본 적은 있지만, 이렇게... 여기만 찾아서 김제 여행 가시는 분들 보다는 새만금 방조제도 보고, 겸사겸사 구경 가시는 분들께 추천... ",BANDALMISO,https://blog.naver.com/ched97,2010-06-07
[군산 맛집]새만금횟집: 비응항(비응도) 박대 요리가 유명한 횟집,https://blog.naver.com/yjoshjh?Redirect=Log&logNo=220683873915,새만금방조제가 시작되는 전북 군산 비응도 비응항 앞에 위치한새만금횟집군산 명물중 하나인 박대 요리를 전문으로 하는 식당이라고 해서 방문해봤습니다 박대는 어릴적부터 집에서 흔하게 먹던... ,참이술의 Eat & Drink,https://blog.naver.com/yjoshjh,2016-04-15
군산 맛집] 새만금횟집 -박대전문,https://blog.naver.com/hjjo100?Redirect=Log&logNo=220675691934,박대를 먹기 위해 들린새만금횟집 . 남쪽에선 서대를 먹긴하는데 서대랑 박대랑 살짝 헷갈리게 생겼죠. 서대랑 박대는 다르다고 하네요. 어디가 다른지 잘 모르겠지만서도... 군산 맛집새만금횟집전라북도... ,쌤의 아트 & 아티스트,https://blog.naver.com/hjjo100,2016-04-15
군산여행(5)새만금 횟집+ 여행 끝!,https://blog.naver.com/hemmu?Redirect=Log&logNo=221348646291,"우리의 저녁식사 장소는새만금 횟집이라는 곳! 검색하니까 여러개 떴었는데, 우리가 간 곳은 아래... 왔다 :) 횟집 도착했을 때 시간이 4시 반이었다. 진심 어정쩡한 시간. 야호 얼른 먹어야겠다는 생각으로... ",정쀼 리뷰,https://blog.naver.com/hemmu,2018-08-30
심포리 거전부락 쌀국수를 만난 날...... 김제맛집 /새만금횟집 ,https://blog.naver.com/4kf?Redirect=Log&logNo=90082800222,진봉면 심포리 거전부락새만금횟집가는 길에 있는 수문 모습.. 다리 위에서 한 컷~ 지금은 새만금 개발로 뻘이 되어버렸다 흔히 거전리 꼬막칼국수라 하는 곳이며 훼를 팔지는 않지만 상호는... ,◌,https://blog.naver.com/4kf,2010-03-08
군산새만금횟집 ,https://blog.naver.com/iriver720?Redirect=Log&logNo=221123136287,한횟집 이에요. 이렇게 드라이브도 즐길 수 있고 평소에는 볼 수 없는 구경도 하며 즐거워요.횟집 은...새만금 의 뜻을 여기서 알게되요. 이곳은 코스요리 인원대로 주문시 회가 무한리필로 나온다고 하네요.... ,모나코의 초록향기,https://blog.naver.com/iriver720,2017-10-23
"[군산맛집]새만금 횟집 , 비응항",https://blog.naver.com/ljblkd?Redirect=Log&logNo=70184416409,"새만금 방조제가 시작되는 비응항의 맛집여러 방송에 나온 유명세에 비해 아쉬움이 남는 곳 187번째로 방문한 곳은새만금 방조제가 시작되는 항구,비응항에 위치한 횟집 새만금 횟집 이다. '동북아의 경제중심지... ","여행을 통해 세상을 보고, 책을 통해 인생을 본다.",https://blog.naver.com/ljblkd,2014-02-07
군산횟집 스페셜한 해산물 가득한 ' 새만금횟집 ',https://blog.naver.com/sardonic77?Redirect=Log&logNo=221556919689,ㅋㅋㅋ 아무튼 그래서 미리 군산횟집 결정해두고 세종에서부터 직행! 비응항과 새만금수산시장 근처에 위치한새만금횟집 입니다. 비응항 근처는 벌써 몇 번째 가는거라 이제는 가는 길이 제법익숙하더라구요... ,"호두+마루+모네+쿤, 호마모쿤 ;D",https://blog.naver.com/sardonic77,2019-06-07
"회맛집(군산 먹거리) - 푸짐, 신선 서해안 3대 횟집새만금횟집 ",https://blog.naver.com/sannun?Redirect=Log&logNo=220967739127,같이 새만금방조제와 비응도 비응항을 다녀왔어요~ 드라이브 하면서 밥 먹을 만한 곳을 찾아봤는데군산 먹거리로 유명한 군산 횟 맛집 서해안 3대 횟집 중 하나로 유명한새만금횟집 이 보이더라구요 확 트인... ,달랑게의 세상구경,https://blog.naver.com/sannun,2017-03-28
"[군산] 33,000원 회정식새만금횟집(+야미도 꽃게바위, 선유도... ",https://blog.naver.com/yoori0728?Redirect=Log&logNo=222504219155,군산에서의 첫끼는 # 새만금횟집에서의 #회정식 이었다. #주차 #주차장 은 식당 근처 갓길 빈공간이 많아... #군산횟집 #군산회맛집 그리고 곁들임반찬 #스끼다시 들도 이것저것 정갈하게 세팅됐다. 내가 좋아하는... ,❣️유로그❣️,https://blog.naver.com/yoori0728,2021-09-13
군산 비응도 맛집새만금횟집회를 제대로 즐겨요,https://blog.naver.com/redsong33?Redirect=Log&logNo=220605755565,익산에서 가까운 군산만 가도 바다도 보고 횟집도 많아 좋아요. 특히 요즘 핫하게 떠오르는 새만금~ 비응도 맛집이 정말 많아요. 얼마 전 가족들과 찾은새만금횟집정말 회를 제대로 즐길 수 있어요! 매장도... ,꿈그리의 행복한 꿈,https://blog.naver.com/redsong33,2016-01-22
[서해안 3대 횟집] 군산 횟집은 뭐니뭐니해도새만금횟집 !!!!!!... ,https://blog.naver.com/tnfus733?Redirect=Log&logNo=221060615951,"#서해안3대맛집 (강화도 용궁횟집, 태안 선창횟집, 군산새만금횟집 ) 근거리에 있으면 무료로 왕복 픽업도 해주긴 하는데 우리는 차끌고 와서 상관 없었음~새만금횟집 이 유명한 이유는 군산 수협 중매인 1호가... ",흥으로 지구 뿌실 행복한 망아지들,https://blog.naver.com/tnfus733,2017-07-27
군산새만금횟집/ 군산 비응항새만금횟집/ 군산 회집 / 군산맛집,https://blog.naver.com/zeze8282?Redirect=Log&logNo=220746873816,이였던새만금횟집 이였음 노을 지는 새만금 바다 내 표정 따라하는 동생과 뚱땡엄마와 엄마썬그라스 끼는 아빠 나는 가족끼리 놀러오면 항상 사진기사 ㅋㅋㅋㅋㅋㅋㅋㅋㅋㅋㅋㅋㅋㅋㅋ 무튼 한번씩 나들이... ,미니미니소미니 W o r l d ~ *,https://blog.naver.com/zeze8282,2016-06-27
"군산 횟집 추천 - 서해안 3대횟집, 가성비 좋은새만금횟집 ♡",https://blog.naver.com/tnvlfwjd?Redirect=Log&logNo=220965964196,오늘은 군산 가서 들렀던 서해안 3대 횟집이라는새만금횟집방문한 후기 들려드릴게요^^ 비응항 들러서 바다 보고 왔는데 바다는 언제 봐도 마음이 차분해지는 것 같아요. 1층에 들어가자마자 보이는 수족관... ,세상에 맛집멋집,https://blog.naver.com/tnvlfwjd,2017-03-24
새만금 맛집으로 소문이 자자한 군산 횟집 중 명물인새만금횟집 ,https://blog.naver.com/toritoya?Redirect=Log&logNo=220194166708,새만금 맛집으로 이미 입소문이 나있는 군산 횟집중 최고라 할수 있는곳새만금횟집 에 다녀온 후기 오랜만에 포스팅 합니다. 제부가 일이 늦게 끝나는 바람에 예약을 느즈막히 하고 가서 한밤중에 도착.... ,돼지고양이,https://blog.naver.com/toritoya,2014-11-28
군산 횟집 바이크투어 군산여행새만금횟집 ,https://blog.naver.com/takuteru?Redirect=Log&logNo=221256921511,군산여행에 새만금방조제나 고군산군도를 지나간다면 들러도 좋을 군산 횟집새만금횟집이였다. 2018.04.15 바이크투어로 다녀온 군산여행 군산 횟집새만금횟집 ,Let's Go Fashion World~♡,https://blog.naver.com/takuteru,2018-04-19
"올리브영,망고식스, 새만금횟집 ",https://blog.naver.com/lovyy20?Redirect=Log&logNo=140187319281,"신랑님 회타령에 횟집가기로... 수산시장 구경만하고새만금횟집 으로 ㅋ 마이따~마이따~ 회도 추가로 주시고, 탕도 너무너무 맛있었던새만금횟집강추요~!! 울 준휘쿤도 전복죽세그릇에 대하구이도 세마리쯤... ",떼굴 꿀랄라~♬,https://blog.naver.com/lovyy20,2013-04-16
바다에서 즐겼던새만금 횟집추천,https://blog.naver.com/prmlhj?Redirect=Log&logNo=222375792891,찾아봤어요새만금 횟집추천이 많아 이곳을 선택하고 드디어 출발했답니다 어디를 가든 항상 음식점을 미리 검색하고 가는 편인데새만금 횟집추천으로 바다는 물론 가성비도 괜찮다하더라고요 친구들과 함께... ,맛있는거 먹으러 가쟝 ʕっ•ᴥ•ʔっ,https://blog.naver.com/prmlhj,2021-05-31
 새만금 횟집추천 바다뷰가 좋았지,https://blog.naver.com/dkdkdk5579?Redirect=Log&logNo=222462294654,하고새만금 횟집추천하는 곳을 찾아 맛있는 회도 즐기고 왔는데요 역시 바닷가 근처에서 먹는 회가... 몰라서새만금 횟집추천 리스트를 보고 방문하게 된 곳인데요 바로 건너편에 너른 바다가 있어 눈... ,시원한아아,https://blog.naver.com/dkdkdk5579,2021-08-13
