title,link,description,bloggername,bloggerlink,postdate
군산맛집 비응도 박대정식새만금횟집 ,https://blog.naver.com/magicpt78?Redirect=Log&logNo=220074819927,군산맛집새만금횟집 추천 비응도횟집 박대정식 새만금맛집 박대 주말 신랑친구들 모임이 있어서 군산엘 다녀왔어요.. 모처럼 휴가를내고 군산까지 간 김에 모임끝나고 군산에서 하루 더 쉬기로했죠.. 여행의 또... ,miL cake 미엘케이크,https://blog.naver.com/magicpt78,2014-07-29
"군산새만금횟집 , 비응항횟집 - 물고기자리",https://blog.naver.com/love77jove_?Redirect=Log&logNo=220533146264,마지막은 셀카로 장식 ㅋㅋㅋㅋㅋㅋ 보조개가 아닙니다.(단호) 없던 보조개가 생긴게 아니고 없던 뾰루지가 올라와 메디폼으로 붙여줬습니다 ㅎㅎ 그럼 모두 군산새만금비응항횟집물고기자리로 오세요!!!!... ,라마의 SoSo한 이야기,https://blog.naver.com/love77jove_,2015-11-09
"여행 | 군산 1: 수송반점, 고군산군도, 대장봉,새만금횟집 ... ",https://blog.naver.com/jgk03088?Redirect=Log&logNo=221862305748,코로나로 도로 텅텅 빔 일단 멀리서 보이기 시작하는 섬들 참고로 새만금 처음 와봤다. 고군산도의... 따뜻하게 녹차라떼 한 잔~ 저녁은 하도 유명한새만금 횟집 . 사람들이 다들 여기로 가는 것 같았다. 1층은... ,Flaming Blood,https://blog.naver.com/jgk03088,2020-03-19
"[9월 군산여행 2] 군산 선유도 여행, 그리고 군산새만금횟집 .... ",https://blog.naver.com/chocojkmm?Redirect=Log&logNo=221366366944,"결국 두 시간만에 새만금 방조제 넘어옴. 02 밥먹고 갑시다, 군산새만금횟집 . 저녁은 군산맛집 상위랭킹... 괜찮은 횟집인지는 잘 모르... 여튼 맛나게 한끼 잘 먹었음. 마무리는 매운탕. 그리고 숙소에 돌아와서... ","둥이맘 하루의 맛있는, 여행. [はる♡]",https://blog.naver.com/chocojkmm,2018-09-28
당일치기 군산여행 / 군산횟집새만금횟집새만금방조제 낙조,https://blog.naver.com/san1078?Redirect=Log&logNo=221508271350,당일치기 군산여행 군산횟집새만금횟집새만금방조제 낙조 지난 금요일 신랑과 군산에 다녀왔다. 아이들 없이 둘만 가는 #군산 여행은 두 번째. 군산은 광주에서 차로 2시간이면 가는 곳이라 주말에 가족과... ,만점맘의 만점스토리,https://blog.naver.com/san1078,2019-04-08
"88 : 군산 여행 1 - 새만금방조제, 야미도, 비응항,새만금횟집 ",https://blog.naver.com/mamacare1926?Redirect=Log&logNo=222431707705,"약간 전어회무침과 비슷한 식감이었어요 정말 식전 요리들이 다른 횟집 메인 요리에 견줄 만할 정도로... 군산, 새만금방조제, 야미도, 비응항,새만금횟집첫 일정은 이렇게 빠르게 마무리 할께요♡ 계속되는... ",마마케어 공식 블로그,https://blog.naver.com/mamacare1926,2021-07-14
군산맛집새만금횟집 에서 냠냠,https://blog.naver.com/kkamyo1122?Redirect=Log&logNo=220664496672,"군산 비응도에 위치하고 있는새만금횟집 ! 이큰 건물 2층에 위치하고 있어요. 일층이 텅텅비었다고!... 그리고 생각해 보니, 횟집가면 어린이들은 먹을 메뉴가 없어서 고민인데 야끼소바부터해서, 생선까스까지... ","미쁘와온달군의 귀농어드벤쳐, 도담도담",https://blog.naver.com/kkamyo1122,2016-03-24
군산선유도맛집새만금횟집직접다녀온 후기~^^,https://blog.naver.com/pbr8717?Redirect=Log&logNo=220859483016,검색 잘했다며^^ 음식 사진은 많이 없지만~ 진짜새만금횟집강추강추! 우선 맛도 맛이지만 직원분들이 친절하셔서 정말 맘놓고 눈치 안보고 편안하게 먹을수 있었던듯 하다^^ 아침7:20분경에 출발해서... ,달달한 일상 :D,https://blog.naver.com/pbr8717,2016-11-11
군산 비응항 횟집 추천_ 새만금횟집 _솔직후기,https://blog.naver.com/tndks1994?Redirect=Log&logNo=222445363583,중 횟집을 찾고 계시다면새만금횟집추천드립니다. 100% 내돈내산 광고아니랍니당 또 개인적으로 아주 마음에 들었던 점은 횟집 규모가 크다는 것이었습니다! 바로 2층 룸으로 안내해주셔서 코시국에 둘이... ,♥PIT A PAT♥,https://blog.naver.com/tndks1994,2021-07-25
군산새만금횟집한빛싱싱회마당 바닷가에서 먹는 회가 최고,https://blog.naver.com/redsong33?Redirect=Log&logNo=220387276095,군산횟집새만금횟집참 많은데 이번에는 한빛싱싱회마당에서 회를 먹었어요. 회는 역시 바닷가에서... 먹은새만금횟집한빛싱싱회마당이 생각나더라구요~ 전북 군산시 옥도면 야미도4길 44 063-463-4812 새만금에... ,꿈그리의 행복한 꿈,https://blog.naver.com/redsong33,2015-06-11
군산 비응도 맛집 - 오랜만에 찾아간새만금횟집✔,https://blog.naver.com/daystudio?Redirect=Log&logNo=220314904356,"오랜만에새만금횟집 에 왔습니다.ㅎ 회정식으로도 유명한곳이긴 하나, 제가 예전에 찾아올때도 그... 시원한 매실의 개운함덕분에 기분좋게 식사를 마쳤습니다^^ 새만금방조제 덕분에 비응도(비응항)에 많이들... ",용쌤✔스냅,https://blog.naver.com/daystudio,2015-03-30
"전라북도 군산 맛집,새만금 횟집 ",https://blog.hangyeong.com/874,한치의 망설임 없이 해안가와 가까운 횟집을 찾아 나섰다. 군산 도심과 좀 떨어져 있는 새만금 간척지에 위치한새만금 횟집 이 푸짐하게 잘 나오는 것 같이 이곳을 목적지로 정했다. 개인적으로 회를 먹을... ,블로그한경닷컴,https://blog.hangyeong.com/,2018-03-09
군산횟집새만금횟집/ 새만금드라이브 군산 아기와여행,https://blog.naver.com/barbarayangji?Redirect=Log&logNo=222460836623,만족하며 나가면서 사진ㅋㅋ 가는길에 해지는 바다 너무 예뻐서 멈췄다. 차타구 군산 빈타이카페로! 바다도 보고 예쁜 하늘도 보고 바람쐬며 달리니 해피..☺️ #군산 새만금횟집#군산여행 #군산맛집 #군산횟집,BARBARA YANGJI,https://blog.naver.com/barbarayangji,2021-08-07
군산새만금횟집 /비응항 맛집/네이버예약 혜택있어요~,https://blog.naver.com/sopia_88s?Redirect=Log&logNo=222419346862,오늘 다녀온 군산새만금 횟집 ! 따끈따끈한 후기 들고왔어요~♡ 군산 비응항에 위치한새만금 횟집 ... 바로 횟집으로 향했습니다ㅎㅎ 저희가 첫손님인것 같아요.. 아직 아무도 없더라구요ㅎㅎ 사실 11시도... ,하루 님의블로그,https://blog.naver.com/sopia_88s,2021-07-04
"군산새만금횟집 , 이번엔 실패하지 않았어요!",https://blog.naver.com/kinogirl100?Redirect=Log&logNo=220611187738,"군산새만금횟집 이에요. 이웃님들은 아시다시피 전주에서 블로그 검색으로 찾았다가 전주비빔밥도... ㅠㅠ 출발 전에 군산에서 회를 먹기로 결정하고, 그 중에서새만금횟집 과 한군데 더 찜콩 해두고... ",♡꿀이랑 콩이랑 더하기 솔&솔이랑♡,https://blog.naver.com/kinogirl100,2016-01-28
[매거진군산] 2020년 5월호 :새만금횟집김부영 대표... ,https://blog.naver.com/magazinegunsan?Redirect=Log&logNo=222016666166,"운영 메뉴새만금횟집 의 주 메뉴는 새만금스페셜 70,000/1인, A코스 50,000/1인, B코스 40,000/1인 등으로... SNS에서새만금횟집 을 다녀간 관광객들이 남긴 후기를 보면 하나같이 추천 일색이다. 그간 어느 횟집에서도... ",매거진군산 공식블로그,https://blog.naver.com/magazinegunsan,2020-06-30
새만금 맛집새만금 횟집 에서 맛있게 먹고 왔어요:),https://blog.naver.com/pearldbswls?Redirect=Log&logNo=220380469894,ㅎㅎㅎㅎ 이 횟집 마스코트 ㅋㅋㅋㅋ 너무 귀엽죠?? 덩치가 정말 성인남성만 하던데 애교가 정말 많더라구요~ 완전 순딩이들!!ㅎㅎㅎㅎ 군산에 맛집이 그렇게 많다고 하던데새만금 횟집 도 새만금 맛집이 틀림이... ,주디♡,https://blog.naver.com/pearldbswls,2015-06-05
[군산 맛집]스페셜코스가 제대로인 군산 횟집추천 ' 새만금횟집 ',https://blog.naver.com/b2vely?Redirect=Log&logNo=220219386508,[군산맛집/새만금맛집/ 새만금횟집 /군산 횟집] [군산 맛집]스페셜코스가 제대로인 군산 횟집추천 ' 새만금횟집 ' 저번주 폭설오던 날....... 가족들과 군산여행 다녀왔어요!!! 날을 잘못 잡아서 가는데 무려 4시간이... ,삐블리 블로그,https://blog.naver.com/b2vely,2014-12-24
"새만금맛집,군산맛집인새만금횟집 에서 가족과함께... ",https://blog.naver.com/bjegob?Redirect=Log&logNo=220255337392,"새만금맛집,군산맛집인새만금횟집 은 tv에도 여러번 출연한 횟집이더라구요 ㅋㅋ 새만금맛집,군산맛집인새만금횟집 의 메뉴에요 보통 코스요리가 주메뉴입니다 저희는 A코스로 시켰어요 그리고새만금횟집 의... ",만드는게 제일좋아 ! 비제곱&미퐁당,https://blog.naver.com/bjegob,2015-01-28
군산 비응항에서 바다 구경하고새만금횟집 으로 회먹으러 가다!,https://blog.naver.com/didrock?Redirect=Log&logNo=90194847374,군산 비응항에서 바다 구경하고새만금횟집 으로 회먹으러 가다! 안녕하세요. 섯태지입니다. 군산... 이곳에서 가장 맛있기로 유명한새만금횟집 에 들렀습니다. ▲새만금횟집 은 총 3층으로 구성되어 있으며... ,1,https://blog.naver.com/didrock,2014-05-20
군산 횟집 ~ 비응항 낙조보며새만금횟집 에서 회코스요리... ,https://blog.naver.com/greenclue?Redirect=Log&logNo=220162648773,군산 횟집으로 유명한새만금횟집군산 시내 관광을 마치고 새만금쪽 비응항으로 달리기를 한 30분 정도 비응항에 도착할 무렵 해가 서서히 넘어가고 있었어요. 실은 비응항 낙조보려고 일정을 그리 맞춘거지요.... ,하늘·별·달 그리고...제주,https://blog.naver.com/greenclue,2014-10-27
군산새만금횟집방문,https://blog.naver.com/saveestate?Redirect=Log&logNo=222404496650,http://naver.me/GbEcgdnk 오랜만에 새만금을 방문했는데 많이 변해가는 모습을 보게 됩니다. 날씨만 딱... #군산 # 새만금횟집#비응항 #맛집 #회정식 #인심좋은사장님 #차박 #주말여행 #주말출장,재테크 그리고 여행,https://blog.naver.com/saveestate,2021-06-20
신선하고 푸짐한 무한리필 군산횟집새만금횟집 ,https://blog.naver.com/kim385719?Redirect=Log&logNo=222315880014,군산으로 여행오시는분들중에 횟집 찾으시는 분들은 비응항의새만금횟집한번 가보시기 바랍니다. 추천합니다. 비응항근처에 자리하고 있는 횟집이니 우선 비응항쪽으로 오셔도 될듯합니다.!,그 집 이야기,https://blog.naver.com/kim385719,2021-04-19
 새만금 횟집추천 여기가 찐이지,https://blog.naver.com/prmlhj?Redirect=Log&logNo=222296058621,얼마 전에 친구랑 바람 쐴 겸 바다를 보러 군산 선유도에 다녀왔는데요 간 김에새만금 횟집추천하는... 새만큼 횟집 추천해 드려요 여행 코스로도 좋고 데이트나 가족 외식하기에도 제격이니 한 번 와보시길... ,맛있는거 먹으러 가쟝 ʕっ•ᴥ•ʔっ,https://blog.naver.com/prmlhj,2021-04-10
광어낚시 _ 군산/ 새만금 / 횟집 /낚시/광어/어락행/다운샷,https://blog.naver.com/happypst?Redirect=Log&logNo=220102961835,그런데 인사나눈 분들이횟집 에 회를 뜨고 그냥 나두고 가셨습니다. 그분들은 전주에서 오셨는데 이후 전화통화가 되어 전주에서 다시새만금 으로 회를 가지러 와야하는 웃긴 사항도 있었습니다. 전화... ,늘 행복하게 살고 싶은 아빠.,https://blog.naver.com/happypst,2014-08-25
[군산맛집]군산횟집 :새만금 횟집내 돈 내산 회 무한리필 후기,https://blog.naver.com/tjrbwjd1849?Redirect=Log&logNo=222459347296,저희 집은 다 잘 먹어서 회가 무한으로 나오는새만금 횟집 을 택했어요. 네이버로 미리 예약하고 갔어요 예약을 하고 가서 그런지 기본 세팅이 되어 있구요 바로 죽이 나와요~ Previous image Next image... ,달보드레,https://blog.naver.com/tjrbwjd1849,2021-08-06
[전북 군산]새만금비응도 군산 횟집 ,https://blog.naver.com/pkh9929?Redirect=Log&logNo=222387021218,노을 지니까 너무 예뻤어요 마무리는 노을 사진으로ㅎㅎ #군산횟집 #비응도횟집 # 새만금횟집#군산광어 #군산박대 #새만금맛집 #비응도맛집 #풍경좋은 군산횟집 #전망좋은군산횟집 #인플루언서 #맞팬 #팬하기,_daily life_,https://blog.naver.com/pkh9929,2021-06-06
"[군산여행/비응항 맛집]보기좋은 회가 먹기도 좋더라,새만금 횟집 ",https://blog.naver.com/kimyang282?Redirect=Log&logNo=150139313282,새만금 임시전시관에 들려 변산 마실길도 걸었어요. 변산 마실길 1코스에 있는 파밭이에요^^ 참... 접대한다는새만금 횟집 에 가봅니다. 이집이 젤낫다~ ㅎ라고 주변에서 하더라구요 ㅎ 저는 코스 먹었습니다.... ,나에게로 떠나는 여행,https://blog.naver.com/kimyang282,2012-05-25
군산횟집새만금횟집 에서 먹다가 배터지는줄,https://blog.naver.com/33candy22?Redirect=Log&logNo=222466039273,군산횟집새만금 ~ 횟집갔었는데 휴~ 진짜 먹다가 너무 많아서 토할뻔... 코스요리가 굉장히 잘... 다음에는 언니보러갈겸 군산 가면 꼭 엄빠 모시고 가야지~ 생각을 들게 한새만금횟집먹어본 후기... ,잡식이음식에심쿵♥,https://blog.naver.com/33candy22,2021-08-11
군산 - 현지인 맛집이라는 “ 새만금 횟집 ” 솔직 리뷰(내돈내산),https://blog.naver.com/oneul_l?Redirect=Log&logNo=222481213588,"군산에 다녀왔는데 회를 안 먹고 올수없죠~ 폭풍 검색해서 현지인 맛집이라고 해서 다녀 온 “ 새만금 횟집 ” 리뷰 시작합니다! 건물 2층으로 엘리베이터 타고 올라가시면 돼요~ 메뉴판 회정식 33,000원 x 2인... ",Oneul.Diary,https://blog.naver.com/oneul_l,2021-08-23
"가을, 군산 당일치기 여행(이성당- 새만금횟집 -새만금방조제... ",https://blog.naver.com/eysince85?Redirect=Log&logNo=221089377779,차와 빵을 목어 배를 좀 불린 뒤에 향한 곳은 서해안 3대 횟집 중 한 곳이라는새만금횟집 ! 대기... 새만금방조제 위에서 꾸미는 카시트에서 잠들어 오빠랑 나랑 사진찍고 다시 출발. 지금 현재는 무녀도까지 차로... ,Viva la vida♩,https://blog.naver.com/eysince85,2017-09-04
"군산 횟집 추천 ] 푸짐해서 너무 좋은 군산횟집 추천 ,새만금횟집 ",https://blog.naver.com/mickey3668?Redirect=Log&logNo=222418842572,비응항에 위치한 횟집 추천 /새만금횟집새만금 스페셜 코스 요리 시작! 이렇게 예쁘게 나오는 횟집은 처음인거 같아요 깔끔하고 먹는 사람이 기분 좋게 세팅이 되어서 나와서 좋은거 같아요 회 옆에는 해산물... ,ෆ 예쁜 하루 ෆ,https://blog.naver.com/mickey3668,2021-07-03
군산맛집 군산 무한리필 횟집새만금횟집추천!,https://blog.naver.com/dkrkvp3?Redirect=Log&logNo=220811483132,벌초하고 오는길에 군산에 들러 맛있는 회두 먹구요^^새만금횟집 . 계단을 올라가기전 이렇게 원산지 표시판이있어서 더욱 믿음이가는 ^^ 저희는 A코스로 2인 주문 죽 죽이 나오니 아기들 밥 따로 챙겨갈... ,세상의 중심에서 물흐르듯이♡가온&가람&가을♡,https://blog.naver.com/dkrkvp3,2016-09-13
군산횟집새만금횟집랍스타까지 푸짐하게 한상,https://blog.naver.com/sktldrk?Redirect=Log&logNo=222402607084,"그릇 또한 매우 예쁘고 고급스러운 느낌이 드는새만금횟집군산횟집새만금횟집메뉴판 입니다 ㅎㅎ 코스별로 나뉘어져 있는데요, 저희는 스페셜로 주문쓰 오랜만에 랍스타도 먹고싶고 메로구이도 너무... ",유화의 솔직한 이야기♪,https://blog.naver.com/sktldrk,2021-06-18
김제새만금횟집 _꼬막국수,https://blog.naver.com/r6940?Redirect=Log&logNo=10029391123,이름은 들어봤나 '꼬막국수' 김제 ' 새만금횟집 ' 부담스럽지 않고 빠른 시간에 간단히 먹을 수 있는 음식이라면 단연 국수. 김제군 진봉면 거전리새만금 횟집 에는 특별한 국수가 기다리고 있다. ‘꼬막... ,전라도 엄니 사진작가 김태성,https://blog.naver.com/r6940,2008-04-02
[군산횟집] 비응항 무한리필 횟집 ‘ 새만금횟집 ’,https://blog.naver.com/eeunsun?Redirect=Log&logNo=222399674398,"될거같아요새만금횟집메뉴 및 가격 군산수협 중매인1호가 직접 운영하는 횟집으로 중매인의 눈과... 저희는 새만금스페셜(70,000)로 주문했어요 처음 나오는것부터 고급스러워서 손님대접할때 오기 좋은... ",강거북입니당,https://blog.naver.com/eeunsun,2021-06-16
전북 군산 여행 - 고군산군도새만금횟집오스카스위트호텔... ,https://blog.naver.com/lonelyv?Redirect=Log&logNo=220819641769,여느 횟집에 가면 눈으로만 감상하는 메뉴지만 정말 맛좋은 생선 스테이크였습니다. 볕이 많이드는 방인데 냉방이 약해 많이 덥게 먹은 기억이 나네요.새만금횟집 을 여름에 방문할 때는 그 방의 '향'을 잘... ,외로니의 다중생활,https://blog.naver.com/lonelyv,2016-09-24
"별, 나만알고 싶은 특별한 맛집! 군산 비응항의새만금횟집 ",https://blog.naver.com/starseven_byarmy?Redirect=Log&logNo=220437418051,"서울에서 이가격엔 택도 없을 싱싱한 놈들이 나옴 ^^ 네비주소 군산시 비응도동 62-12번지새만금 횟집건물 하나가 횟집임. 우럭탕을 추천함!!! 정말 개꿀맛 진짜 나만알고 싶은 맛집, 한번 다녀오시죠 ?",프로작심삼일러 에이미,https://blog.naver.com/starseven_byarmy,2015-07-31
군산새만금 횟집바다와 함께 즐겼어,https://blog.naver.com/skdusol?Redirect=Log&logNo=222180589428,군산새만금 횟집 을 검색해 봤어요 군산새만금 횟집 이 꽤 많이 나왔지만 그중에서 선유도 고래포차로 가는 것이 괜찮을 거 같았어요 바로 앞에 바다도 있어서 경치도 좋고 무엇보다 나오는 음식들이 아주... ,마린몽 블로그,https://blog.naver.com/skdusol,2020-12-25
군산새만금 횟집고래포차가 최고,https://blog.naver.com/prosumer123?Redirect=Log&logNo=222267624896,군산새만금 횟집 에 가서 실컷 먹고오는걸로 정했죠 개인마다 취향이 다르겠지만 저는 소나 돼지보단 생선을 훨씬 좋아하거든요 군산새만금 횟집 은 처음에 지인이 자주 가는 곳이라며 추천을 해줬던 곳이에요... ,by_HUN 블로그,https://blog.naver.com/prosumer123,2021-03-09
"비응항 식당, 내돈 주고 먹어서 더 억울한 군산새만금횟집 ... ",https://blog.naver.com/kobi001?Redirect=Log&logNo=221301472583,"우선 정보를 제공하기 위해 본새만금 횟집 에 대해서 글을 작성합니다. 군산의 경기가 안 좋아서 그... 바다횟집 현대코아점이 있다고 하는데, 거기는 뭐 보여줄게 없다고 새만금 쪽으로 가면 어떨지 물어봐서... ",호호아빠와 함께하는 여행 이야기,https://blog.naver.com/kobi001,2018-06-18
군산 횟집새만금횟집 ,https://blog.naver.com/limse7105?Redirect=Log&logNo=222482866295,군산에서새만금횟집 이 제일 유명한것 같아서 방문!! 네이버예약하면 박대구이 서비스로 주니까 예약필수~~ 룸으로 되어있어서 우리끼리만 먹어서 좋았다 1인 33000원 회정식을 시켰다 처음에 간단하게... ,Full of happiness,https://blog.naver.com/limse7105,2021-08-25
군산여행 :새만금횟집(회 코스 무한리필) 내돈내산 솔직후기... ,https://blog.naver.com/tkaehfdlsnsk?Redirect=Log&logNo=222413093030,오늘은 #군산횟집 # 새만금횟집포스팅할겁니다! 어딜갈까 하다가새만금횟집 으로 다녀왔어요... 편하게 먹을 수 있는 것 같아요 코스 메뉴판 A코스 B코스 새만금스페셜코스 이렇게 3코스로 나눠져있어요... ,All the things I love,https://blog.naver.com/tkaehfdlsnsk,2021-06-28
[맛집] 군산새만금 횟집/ 어마어마한 회정식,https://blog.naver.com/goldlovesme?Redirect=Log&logNo=222333844952,구성이 혜자입니다. 해산물의 도시 부산도 3마넌에 이렇게는 안줌..... #블챌 #오늘일기 #맛집 #군산맛집 #비응항맛집 #선유도맛집 #비응항횟집 #국내여행 #군산여행 #군산가볼만한곳 #군산 새만금횟집# 새만금횟집 ,언니의 자본주의,https://blog.naver.com/goldlovesme,2021-05-02
[군산 횟집]새만금횟집회코스 완전 추천 :),https://blog.naver.com/rashisho5?Redirect=Log&logNo=221326111706,우린 심신이 지쳐있는 상태였기 때문에 새만금스페셜을 먹기로 찜콩하고 2층으로 올라갔따 올라가는... 3대 횟집중에 하나로 뽑힌다는새만금 횟집서비스도 만족스럽고 음식도 질이 좋아서 재방문할거같다 히히... ,다정한 비읍,https://blog.naver.com/rashisho5,2018-07-27
[전주맛집] 전주새만금횟집예약방법 / 전주역 우아동 맛집... ,https://blog.naver.com/kekeke365?Redirect=Log&logNo=222439480253,광어나 우럭은횟집 에서 흔하게 접할 수 있는데 전새만금 에서 도미회를 처음 먹어봐서 가성비 좋게 특별한 회를 먹을 수 있다는 인상이 강한 집이였어요! 회 가격도 이정도면 착한 가격! 먼저 자리에 앉으면 이... ,슬기로운 블로그 생활,https://blog.naver.com/kekeke365,2021-07-21
여러번 나오고 이미 너무 유명한 군산맛집새만금횟집 ,https://blog.naver.com/yongmintour?Redirect=Log&logNo=222422094913,군산횟집새만금횟집 은 브레이크타임이 있으니 유의하세요! 주말에 사람도 많을 것 같아 브레이크타임이 끝난 17:00로 네이버를 통해 미리 예약을 하고 갔습니다. 네이버 예약시 박대구이를 서비스로 제공하고... ,MIN's HAPPY LIFE,https://blog.naver.com/yongmintour,2021-07-06
* 새만금횟집 * 내돈내산 후기,https://blog.naver.com/dbqhfka518?Redirect=Log&logNo=222315550494,선유도해수욕장에 갓다가 회를못먹고 결국새만금횟집 을갓죠ㅎㅎㅎ 맛있는녀석들 모닝와이드... 매운탕 진짜 너~~~~어무 맛있어요 횟집가면 매운탕 간도안맞고 밍밍하고 그런곳이 많은데 얼큰하고 시원하고ㅠㅠ... ,유봉일기장 :),https://blog.naver.com/dbqhfka518,2021-04-19
군산 박대정식새만금횟집 (맛있는 녀석들 방송),https://blog.naver.com/shwaaaa2?Redirect=Log&logNo=222326268999,들린새만금횟집 . 이 곳은 맛있는 녀석들 방송에도 나왔던 곳이래요. 조금 늦은 시간이였지만 박대 정식 먹고 돌아가기로 했어요. 3층으로 안내 받아서 올라가니 아주 넓어요.새만금횟집메뉴. 박대 정식으로... ,오늘 하루 뭐하지 뭐먹지,https://blog.naver.com/shwaaaa2,2021-05-02
군산 선유도새만금횟집 ,https://blog.naver.com/washcc?Redirect=Log&logNo=222368252371,많이 나온새만금횟집 을 초이스~~~~ 저녁시간을 피해서 방문하니 괜찮았습니다. 예약을 하고 가면 룸을 이용할 수 있다고 하네요! 저희는 A코스였나? ^^;; 주문을했습니다...ㅎㅎㅎ 새만금은 코스를 많이... ,[ 케어 월드 ] 010 8412 3227,https://blog.naver.com/washcc,2021-05-26
군산새만금 횟집푸짐해서 좋아,https://blog.naver.com/sunsethj1?Redirect=Log&logNo=222341641312,군산새만금 횟집 을 찾게 돼서 제 경험을 공유해 보려고 해요 우선 도착하자마자 아름다운 모래사장과... 군산새만금 횟집 을 주저 없이 찾아가게 되었어요 가게가 바다 바로 옆에 있어서 찾아가기도 편했고 뷰는... ,꿍냥이의블로그,https://blog.naver.com/sunsethj1,2021-05-11
군산_ 새만금 횟집 ,https://blog.naver.com/h2cats?Redirect=Log&logNo=222362170324,우리의 여행 먹고먹고 또 먹고새만금 횟집맛녀석에서 나왔다는 회 무한리필! 횟집 숙소를 잡고 허기진 배를 채우러 (한잔하러ㅋㅋㅋ) 뚜벅뚜벅 맛녀석 생생정보통 모닝와이드 등 방송 대거 출현 집 인증... ,Hello_뽀또,https://blog.naver.com/h2cats,2021-05-23
군산 횟집 추천/새만금 맛집/[군산] 새만금 횟집 /새만금... ,https://blog.naver.com/szdewsz?Redirect=Log&logNo=220222143107,"사실 새만금 비응항에 등대로와 이곳새만금 횟집두곳중 한곳을 정해 식사 하기로 했었는데, 난... 주차는 저렇게 횟집 입구 쪽 공터에 하면 되는 듯 하다. 우리도...그렇게 했고,ㅎ 우리가 식사한 룸... 파티션이... ",친절한 미술씨♡,https://blog.naver.com/szdewsz,2014-12-27
[군산 맛집] 자연산회 전문점 군산새만금횟집 ,https://eara.co.kr/1489?category=521711,"군산 여행중에 들렸던새만금횟집 은 군산수협 중매인1호 김부영씨가 운영하는 자연산회 전문점이다. 3층짜리 건물이 전부 횟집으로, 엄청난 규모를 자랑하는 곳이었다. 1층은 홀에 테이블이 가득했고... ",Maru의 세상구경,https://eara.co.kr/,2014-05-15
