title,link,description,bloggername,bloggerlink,postdate
군산횟집 부모님과새만금횟집 ,https://blog.naver.com/2artshow?Redirect=Log&logNo=222236577965,금강산도 식후경이라고 미리 찾아둔 군산횟집새만금횟집 으로 먼저 향했지요!새만금횟집주소 근처에 도착하니 3층으로 된 단독 건물에 간판이 크게 달려있어 쉽게 찾을 수 있었어요. 바로 앞에 주차를 하고... ,U-vely의 연필통,https://blog.naver.com/2artshow,2021-02-08
군산여행 가성비 좋은 현지인 맛집새만금횟집만족!,https://blog.naver.com/juyeon-k?Redirect=Log&logNo=222539158925,"군산 새만금에서 가장 가성비 좋고 유명한 횟집! #군산맛집새만금횟집 에 다녀왔어요~ 바다뷰가 보이는 비싼 횟집들도 많지만 저는 무엇보다 스끼다시가 돈가스, 볶음 우동 이런거 말고 해산물 종류로 알차며... ",My daily life,https://blog.naver.com/juyeon-k,2021-10-17
"군산횟집, 코스 주문하면 회가 무한리필?새만금횟집 ",https://blog.naver.com/ljh6971?Redirect=Log&logNo=222339923621,가족들과도 새만금 스페셜을 먹었는데 그 때 진짜 만족했었거든요 그래서 남자친구랑도 꼭 한 번 같이... ㅎㅎ 남자친구도 진짜 잘먹었다고 데려와줘서 연신 고맙다고 하더라구요ㅎㅎ 군산횟집새만금횟집 ... ,우리 둘,https://blog.naver.com/ljh6971,2021-05-06
"군산여행ㅣ몸보신 군산맛집새만금횟집 , 힘솟는짱어",https://blog.naver.com/photoharu?Redirect=Log&logNo=222339906361,"군산여행ㅣ몸보신 군산맛집새만금횟집 , 힘솟는짱어 맛있는 거=몸에 좋은 거라고 생각하지만 이번... 이번 군산여행 넘버원 맛집 장원꽃게장 ↓ ↓ ↓ 군산 현지인맛집 1 강추새만금횟집노을이 너무 예뻐서... ",::Happy-Go-Round::,https://blog.naver.com/photoharu,2021-05-06
 새만금군산횟집참 맛집일세~,https://blog.naver.com/juco9075?Redirect=Log&logNo=221985694940,군산에서 가장 큰새만금 횟집 이라 해도 될 건물을보니 자동반사로 영상을 담아보고싶어지는 찐맛집 비주얼이다. 군산은 서천에 갔다가 순천으로 넘어 가는길에 늦은 점심을 먹으러 찾아간 군산 횟집 새만금.... ,고고씽의 일상탈출,https://blog.naver.com/juco9075,2020-06-01
군산횟집 랍스터 나오는새만금횟집 ,https://blog.naver.com/takuteru?Redirect=Log&logNo=222068855364,군산횟집 랍스터가 나오는새만금횟집 ! 맛있는 음식이 많은 식도락의 고장 군산의 새만금방조제에 요즘 뜨는 군산새만금횟집끝없이 나오는 메뉴들 때문에 허리띠를 풀 준비를 하고서 가야할 정도였던... ,Let's Go Fashion World~♡,https://blog.naver.com/takuteru,2020-08-23
알려주고 싶은 군산새만금 횟집추천,https://blog.naver.com/prmlhj?Redirect=Log&logNo=222487675149,다녀온새만금 횟집추천을 하나 해주더라고요 그래서 저도 이번 기회에 다녀오게 되었답니다 일단 저희는 콧바람을 쐬기 위해 선유도로 향했어요새만금 횟집추천 받은 음식점에서 배를 채우기 전에 즐길... ,맛있는거 먹으러 가쟝 ʕっ•ᴥ•ʔっ,https://blog.naver.com/prmlhj,2021-09-03
군산횟집 추천은새만금횟집 !!무조건입니다!!!,https://blog.naver.com/choichokk?Redirect=Log&logNo=222417593270,군산새만금 횟집 은 이름처럼 새만금쪽 비응항에 위치한 대형 횟집이에요!! 건물 전체가새만금횟집 의 건물로 매장 안에 엘리베이터까지 갖춘 곳이라는! 군산여행 오시면 당연히 가볼만한곳을 찾아보고 또... ,최촉,https://blog.naver.com/choichokk,2021-07-02
군산 여행 : 가격 대비 만족스러웠던 군산새만금횟집:),https://blog.naver.com/purmi07?Redirect=Log&logNo=222339474127,했던 횟집이다. 그전에 이것저것 많이 사줘서.. 소소한 고마움의 표시이자 내가 사고 싶었다. ㅋㅋ 선유도에서 다시 버스 타고 나와 비응항(탔던 장소 그대로)에서 내렸다.새만금횟집 은 비응항 버스정류장에서... ,memoria,https://blog.naver.com/purmi07,2021-05-06
푸짐했던 군산 맛집~ 군산새만금횟집 ,https://blog.naver.com/jyleen?Redirect=Log&logNo=222481762081," 새만금횟집주소 : 전북 군산시 비응안7길13 전화 : 063-464-1001 시간 : 11:00~22:00(브레이크타임 : 15:00~17:00) 주차 : 건물 앞 넓은 공터 메뉴 : 박대정식 33,000원(1인당) 우리가 찾아간새만금 횟집 은 비응항에서 도보 2분... ",♣슈퍼맨의 세상사는 맛~,https://blog.naver.com/jyleen,2021-08-24
군산 횟집: 새만금횟집 ,https://blog.naver.com/sewon0126?Redirect=Log&logNo=222165491602,"세명에서 진짜 배터지게 먹었어ㅠㅠ 회가 넘 신선하고, 먹을게 정말 다양해서 아주 잘먹은새만금횟집ㅠㅠ 튀김도 굿! 입에서 사르르 녹던 랍스타회 ෆ 어른들 모시고 가기에 딱 좋은 횟집! 요건 슥 다 찍어본거... ",La Primavera,https://blog.naver.com/sewon0126,2020-12-07
진짜 가지마세요 절대로 전주새만금 횟집 ,https://blog.naver.com/thdgml7748?Redirect=Log&logNo=222534780721,다시 보니깐 또 먹고싶네요 어느 횟집에서도 절대!!절대!! 전주새만금횟집흉내 못 냅니다. 그만큼 너무 맛있어요 ㅋㅋㅋ하다못해 초밥에 올라 간 횟감도 왜이렇게 맛있을까요 도미초밥만 따로 장사하셔도... ,먹튀공주,https://blog.naver.com/thdgml7748,2021-10-12
"[전북/군산] 군산 횟집 추천,새만금횟집 (서비스도 좋고, 회/박대... ",https://blog.naver.com/kim_eyo?Redirect=Log&logNo=222022653013,군산으로 바람을 쐬러 가기로 결정 오래간만에 새만금 방조제 드라이브도 하고 탁 트인 바다 보면서 이... 나오는 횟집으론새만금 횟집 이 손가락 안에 든다. 다 먹고 난 후 바닷가 산책이나 드라이브는 덤.... ,Vagabondage d'HOLIC.K,https://blog.naver.com/kim_eyo,2020-07-06
새만금 낚시와새만금 횟집 은 바로 여기~ 숙소부터 식사... ,https://blog.naver.com/jtong?Redirect=Log&logNo=221727791107," 새만금 에서 배낚시부터, 삼시 세끼 식사, 그리고 민박까지 한방에 해결할 수 있는 신시도횟집민박. 선유도나 신지도,새만금오시면 적극 추천드립니다. 이상 구니의 재미있고 맛있는 이야기였습니다.",구니의 캠핑 & 여행 이야기,https://blog.naver.com/jtong,2019-12-05
비행장부대찌개/ 새만금횟집 /선유도몽돌해수욕장/군산맛집,https://blog.naver.com/nhhyy?Redirect=Log&logNo=222525353836,"원산지표 참고하세요잉새만금횟집35000원 회정식 35000원 회정식코스를 먹었습니다. 네이버로 예약해서... 3대횟집(태안,강화도)에 해당하는 곳이라는 글을 봤습니다. 손님도 제법있고 치즈콘 맛집 리필해주심... ",먹는 데 진심인 편,https://blog.naver.com/nhhyy,2021-10-03
군산맛집- 새만금횟집 ,https://blog.naver.com/shelove0?Redirect=Log&logNo=222316676956,선유도와 초원사진관 이성당등을 둘러보고 저녁먹으러 # 새만금횟집으로 방문했습니다 네이버예약을 하면 #박대 를 서비스로 _ 기본 셋팅입니다 저 생와사비 역대급 매운맛이었어요 ㅠㅠㅠㅠㅠ B코스로 2인... ,さようなら、いつか＿,https://blog.naver.com/shelove0,2021-04-20
군산새만금 횟집즐겁게 먹었네,https://blog.naver.com/skdusdl0116?Redirect=Log&logNo=221740594901, 새만금 횟집 은요 제가 바람 쐬러 쓩하고 이 지역으로 놀러 갔을 때 바다 보며 회 먹고싶다 하면 생각나는 곳이에요 워낙 상차림 해서 나오는 것들도 푸짐하고 무엇보다 맛이 기가막히거든요 군산새만금 횟집 ... ,여울,https://blog.naver.com/skdusdl0116,2019-12-20
군산새만금 횟집회정식코스 즐긴날 ~☆☆,https://blog.naver.com/sagooo?Redirect=Log&logNo=222523927656,군산횟집 새만금 친구들과 떠난 2박3일여행 진안에서 부여가기전 들린 점심으로 먹은 #군산횟집 새만금... 우선 입구를 찿아서 이동 ~~~ 군산까지 왔으니 야무지게 먹어야겠다는 생각뿐 군산새만금 횟집주소... ,소소하게 소통하며 @@,https://blog.naver.com/sagooo,2021-10-02
군산 새만금 맛집 - 비응항 최고로 맛있는새만금 횟집 ,https://blog.naver.com/merrygold30?Redirect=Log&logNo=222251737222,제가 다녀온 군산 새만금 맛집은 바로 ' 새만금 횟집 '입니다. 실은.. 제가 예약을 해둔 횟집이 있었는데 장소를 착각해서 갈 수가 없게 된 슬픈 현실 그래서 급히 찾은 새만금 맛집.. 한 번 더 실패... ㅠ.ㅠ 그러고... ,천안꽃집 메리골드플라워,https://blog.naver.com/merrygold30,2021-02-21
군산새만금횟집코스요리로 회 무한리필,https://blog.naver.com/leesu0319?Redirect=Log&logNo=221854369154,원래는 신랑이 회사 사람들에게 추천받았던 청담횟집을 가려고 했으나 만석이어서 군산새만금횟집다녀왔어요~ 군산여행은 처음이었는데 곳곳에 유명한 횟집들이 참 많더라고요 군산새만금횟집 은 새만금방... ,승유맘의 데일리 기록,https://blog.naver.com/leesu0319,2020-03-15
"2021 효징이의 씬나는 군산여행 첫째날( 새만금횟집 , 선유도... ",https://blog.naver.com/icehhj?Redirect=Log&logNo=222464288922,처음 찾은 곳은새만금횟집!맛난거 많이 먹고 와야지 !! 미리 네이버로 예약을 하고 간지라자리 셋팅이... 나왔던새만금횟집 박대요리로 나와서 박대정식을 먹어야하나 고민했었는데네이버예약 특전ㅋㅋ으로... ,WELCOME TO MY BLOG,https://blog.naver.com/icehhj,2021-08-10
다시찾고픈 군산 횟집새만금 횟집 ,https://blog.naver.com/sasoyea?Redirect=Log&logNo=222519970194,박대로 유명한 군산횟집정량 주문시 회 무한리필형부가 오자고 했던 이유 알겠더라구요. 새만금... 보기는새만금 횟집 이 처음입니다. 횟집에서 회가 매인이죠. 매인이 나왔는데도 주변의 먹거리에 빠져서... ,지금,https://blog.naver.com/sasoyea,2021-09-28
[군산] 배터져서 나올수 있는새만금횟집 ,https://blog.naver.com/bright2kms?Redirect=Log&logNo=222449196607,그리구 새만금이 뜻이 있더라구 만경평야와 김제평야를 넓고 새롭게 만들었다는 뜻 그래서 이걸... 90_/ 밍시 인스타에 놀러와 #군산 #군산맛집 #군산횟집 # 새만금횟집#비응항 #여름휴가 #서이추환영 #서이추... ,일상이 즐거운 밍시의 비밀노트❣️,https://blog.naver.com/bright2kms,2021-07-29
"첫째날(고군산군도,선유도해수욕장, 장자도 대장봉,새만금횟집 )",https://blog.naver.com/sure20214?Redirect=Log&logNo=222235213482,올려야징 #군산여행 #고군산군도 #고군산군도여행 #군산바다 #새만금 #군산1박2일 #일박이일여행 #장자도 #장자도대장봉 #대장봉정상 #비응항 #비응항횟집 # 새만금횟집#기념일케이크 #생일케이크 #생일기념여행,Yun_Place,https://blog.naver.com/sure20214,2021-02-07
무슬림 친화레스토랑 군산새만금횟집방문기,https://blog.naver.com/babybear_?Redirect=Log&logNo=222474735221,군산새만금횟집 은 비응항쪽 횟집 추천으로 상위권안에 들어가 있는 횟집이다 회도 싱싱하고 스끼도... 군산새만금횟집메뉴판 회 정식 1인 A코스 B코스 새만금 스페셜 1인 코스 코스요리 주문 시 회 무한리필... ,"초보엄마, 초보주부의 일상생활",https://blog.naver.com/babybear_,2021-08-18
[군산시 맛집] 비응항새만금횟집 ,https://blog.naver.com/hyukaay?Redirect=Log&logNo=222403016981,거기에 횟집 맛집으로는새만금 횟집 이 있어서 예전에 한번 갔다가 만족스럽게 식사를 했던 기억이...새만금 횟집 은 군산 시가지에서 서쪽 방향으로 가다보면 새만금 방조제를 건너기 바로 전인 비응항에... ,"바보 직장인, 유게베러(Ugetbetter)",https://blog.naver.com/hyukaay,2021-06-19
군산CC 맛집새만금횟집 ~,https://blog.naver.com/jyleen?Redirect=Log&logNo=221769259858,군산CC 맛집새만금횟집 ~ 사진글 : 슈퍼맨 군산CC 맛집을 찾다가 인근새만금횟집 으로 회를 먹으러 갔습니다. 비응항에 위치한 이곳은 군산을 갈때마다 가는 곳인데 다른 어떤곳 보다도 푸짐하고 맛있게 회를... ,♣슈퍼맨의 세상사는 맛~,https://blog.naver.com/jyleen,2020-01-12
군산 특산물인 박대정식으로 소문난 비응항 ' 새만금 횟집 ',https://blog.naver.com/040314?Redirect=Log&logNo=222190678058,ㅎㅎ) 장자도 방문 혹은 군산을 찾으시는 분들 시내 맛집도 물론 좋지만 군산 특산물인 박대정신 한 번 먹어보시기를 추천 또 추천한다 #장자도맛집 #군산맛집 #비응항맛집 #군산 새만금횟집#군산박대정식... ,에필이네,https://blog.naver.com/040314,2020-12-30
전라북도_군산 1박2일(1일차_ 새만금횟집 선유도해수욕장),https://blog.naver.com/gpflghdl7?Redirect=Log&logNo=222519756004,점심으로 선택한 곳은 군산 새만금횟집 이에요. 군산이 바다 근처에 있어서 횟집은 가야겠다 생각은 했는데 워낙 다양하고 많은 곳이 있어서 어디를 가야할지 모르겠더라고요. 그러다가 우연히 찾은 곳이... ,뚱이의 소소한 하루,https://blog.naver.com/gpflghdl7,2021-09-28
군산맛집 비응항맛집새만금횟집가성비 최고 서해안맛집,https://blog.naver.com/hrlee10102?Redirect=Log&logNo=221715712987,"이곳,새만금횟집 이 박대요리를 잘하는 곳으로 횟집 사장님도 추천을 해 주시는데 아쉽지만 오늘은 횟집에서는 회를 먹는 것으로 결정했습니다. 주문과 동시에 이어서 들어오는 기본찬과 요리들입니다. 이곳이... ",봄 여름 겨울 그리고 가을,https://blog.naver.com/hrlee10102,2019-11-22
"[전북] 2020, 고창 · 부안 … 5. 군산새만금횟집 ",https://blog.naver.com/jvj24601?Redirect=Log&logNo=222238610906,"친구들의 검색 끝에 택한 곳이 새만금 군산쪽 끝 비응도에 자리한새만금횟집(LINK) 방송출연도 떠들석하게 많이 한, 나름 유명한 집이다. 포스팅을 위해 리뷰를 살피니 친절하다는 이야기가 많이 나오는데... ",생에 대한 진한 애착,https://blog.naver.com/jvj24601,2021-02-10
"군산,새만금/ 새만금횟집 ",https://blog.naver.com/2bormi?Redirect=Log&logNo=222481220918,같았어요 #전북맛집 #전북가볼만한곳 #군산맛집 #군산횟집 #군산해산물 #전북해산물 #군산 새만금횟집#새만금맛집 # 새만금횟집 구성 #새만금회 #새만금해산물 #군산횟집추천 #군산횟집맛집 #군산새만금맛집,"반짝빛나는,눈에담다",https://blog.naver.com/2bormi,2021-08-23
"군산 비응항 맛집새만금횟집 , 미리가본 비응항 데크길!",https://blog.naver.com/juhyun9909?Redirect=Log&logNo=221665346033,군산 비응항 데크길을 즐겁게 돌고나서 배가 출출 할 때쯤 찾은 군산 비응항새만금횟집 ~ 박대탕으로... 다리도 아프고 배도 고프고~~미리 예약해둔새만금횟집 으로 GoGo씽 합니다~ 서울에서 만난 군산사람이... ,제제의 전원밥상,https://blog.naver.com/juhyun9909,2019-10-01
[맛집]군산 비응항새만금횟집 ,https://blog.naver.com/jeehyun36?Redirect=Log&logNo=221760546523,있었던새만금횟집 !! 코스요리로 주문했답니다! 맛있는 회가 예쁘게 담겨져 나오니 더 맛있어보이는것... 분들 회가 생각나시는분들새만금 횟집 에서 회 한접시 하고가세요새만금횟집주소는 바로 요기랍니다,마미제이,https://blog.naver.com/jeehyun36,2020-01-05
군산새만금횟집서해안 3대 횟집 인정,https://blog.naver.com/oi214xe23v7?Redirect=Log&logNo=222499290236,군산새만금횟집서해안 3대 횟집 인정 맛있는녀석들에도 나온 군산새만금횟집 에 다녀와봤습니다. 제가 맛녀석들을 심심할 때마다 보는데 저번에 우연히 이 식당이 나온 편을 보게 됐어요. 하도 여기저기서... ,oi214xe23v7님의블로그,https://blog.naver.com/oi214xe23v7,2021-09-08
군산새만금횟집 ,https://blog.naver.com/thunder_kids?Redirect=Log&logNo=222475241059,#군산여행 #군산맛집 #군산횟집 #전북여행 #전북여행지 #전북맛집 군산 선유도 들렸다가 군산에서 맛집으로 소문난새만금횟집 에 들렸어요. 저희는 B코스 시켰어요. 코스별로 음식이 계속 나와요. 초반에 많이... ,비버디 전주 반려동물 수제간식 목걸이 인식표,https://blog.naver.com/thunder_kids,2021-08-18
[군산여행]관광지 횟집이지만 알찼던 ' 새만금횟집 ',https://blog.naver.com/tweenky?Redirect=Log&logNo=222125991015,"군산에 가면 뭘 먹지 했다가 군산 검색하면 항상 나오는 횟집,새만금 횟집다녀왔어요 심지어 군산이 새만금방조제가 있는 곳인지는 알지도 못하고 내륙인줄 알았다는...무식... 관광지 식당은 광고도 많이 하고... ",김호정아나운서의 공유하고 싶은 일상~♡,https://blog.naver.com/tweenky,2020-10-25
전북맛집 군산맛집 1호새만금횟집 ,https://blog.naver.com/jolisu0105?Redirect=Log&logNo=222532559593,마무리는 매운탕 요즘 탄수화물 맛없어서 잘 안 먹는데 이날은 공기밥 1공기 다먹음ㅋㅋㅋㅋㅋㅋㅋㅋㅋㅋㅋ 호록호록 군산 또 오면 재방문 할께요 ❤ #군산 # 새만금횟집 1호 #양주 #남스커피,맛있는 걸 먹기 위해 태어남,https://blog.naver.com/jolisu0105,2021-10-10
(군산여행)새만금 횟집 ,https://blog.naver.com/jkkim3294?Redirect=Log&logNo=222178164178,2020.12.7새만금횟집새만금횟집 은 새만금방조제 군산 초입부 비응항 근처에 있었다. 대장봉에서 출발하여 11:25분에 도착한다. 25분 걸렸다. 월요일이라 직장이 군산에 있는 일행분이 먼저 출근을 한후... ,일상비우기의 beautiful remember,https://blog.naver.com/jkkim3294,2020-12-19
[군산 맛집]새만금횟집: 비응항(비응도) 박대 요리가 유명한 횟집,https://blog.naver.com/yjoshjh?Redirect=Log&logNo=222316538291,5년 전 오늘 [군산 맛집]새만금횟집: 비응항(비응도) 박대 요리가 유명한 횟집 새만금방조제가 시작되는 전북 군산 비응도 비응항 앞에 위치한새만금횟집군산 명물중 하나인 박대 요리를 전문으로... ,참이술의 Eat & Drink,https://blog.naver.com/yjoshjh,2021-04-20
2019년 11월 전라북도 군산시새만금횟집새만금맛집... ,https://blog.naver.com/63yunho?Redirect=Log&logNo=221717738123,전라북도 군산시새만금 횟집새만금 맛 집 군산 CC 맛 집 골프장맛집 안녕하세요 오늘은 박대 요리 맛 집 소개해드립니다. 이 집은 박대 요리 맛있는 집입니다. 1층은 수조관이 마련되었습니다. 우리 일행들은... ,음식평론가,https://blog.naver.com/63yunho,2019-11-25
군산새만금횟집인정,https://blog.naver.com/happy_love02?Redirect=Log&logNo=221230179768,"선유도, 비응항, 새만금 놀러가시는 분들에게 추천해 드리고 싶은 군산 새만금 횟집'장춘횟집' 뭔 설명이 필요하겠어요.. 푸짐한거 좋아하시면 꼭 가보세요^^ 정말 놀라움의 연속이랍니다~~~~^0^ 주소 : 전북... ",♥___뽀 솜 시루네___♥,https://blog.naver.com/happy_love02,2018-03-16
"군산횟집추천, 가성비 좋았던새만금횟집 ♥",https://blog.naver.com/tnvlfwjd?Redirect=Log&logNo=221133550724,"차차 하나씩 보여드리긴 할 거지만, 사진으로도 다 담아오지 못한 스끼다시가 많네요 스끼다시가 잘 나오는 횟집 찾으시는 분들께새만금횟집군산횟집추천해요. 푸짐하기도 하지만, 가짓수만 많은 게 아니라... ",세상에 맛집멋집,https://blog.naver.com/tnvlfwjd,2017-11-06
군산새만금횟집호사를 누리는날!,https://blog.naver.com/ttr8973?Redirect=Log&logNo=221200311664,군산새만금 에 자주 가는 편인데요~ 맛있는 회가 저를 부르기때문이죠~ 오늘은 와흘댁이 좋아하는 곳을 소개 해드릴건데요 와흘댁 최애 하는 군산 새금 횟집장춘 이랍니다^^ 싱싱한 회는 물론 여러가지 곁들임... ,오늘 뭐 하지?,https://blog.naver.com/ttr8973,2018-02-03
군산횟집 비응항새만금횟집맛있는힐링타임~,https://blog.naver.com/mj6212?Redirect=Log&logNo=220999175210,"군산횟집새만금횟집 이 보여요~ 군산횟집새만금횟집전북 군산시 비응안7길 13 (비응도동 62-12) 063-464... 있는 새만금 스페셜로 주문했어요! 죽, 해물3가지, 전복, 참치, 생선까스, 새우구이, 메로구이,랍스타..등... ",보물삼총사,https://blog.naver.com/mj6212,2017-05-06
군산 비응항횟집 그중에새만금횟집이 최고입니다,https://blog.naver.com/parksb44?Redirect=Log&logNo=220960824129,서천사랑이 추천하는 맛집 오늘은 군산 비응도 비응항횟집 중새만금횟집 을 소개합니다 동생들이 새만금 여행 후 고마움의 표시로 점심 식사를 대접한다고 해서 찾은 비응항 횟집입니다 서천에도 횟집 많지만... ,서천사랑은 여행중,https://blog.naver.com/parksb44,2017-03-17
군산맛집 단골횟집새만금횟집 ^^,https://blog.naver.com/dkrkvp3?Redirect=Log&logNo=220848113008,군산횟집새만금횟집너무 자주 가서그런지 군산하면 제일 먼저 생각나는새만금횟집 . 1층에선 박대탕.찜 요리를 먹나봐요 전항상 회를 먹으러 와서 1층에선 먹어보진 못했어요. 2층은 다 룸이예요! 그래서... ,세상의 중심에서 물흐르듯이♡가온&가람&가을♡,https://blog.naver.com/dkrkvp3,2016-10-29
"군산 비응항 맛집,새만금횟집 ~",https://blog.naver.com/jyleen?Redirect=Log&logNo=221586955884,"맛집인새만금횟집 을 찾았습니다. 새만금방조제 끝지점에 위치한새만금횟집 은 이 지역을 지날때마다... 횟집 치고는 규모가 꽤 커 보이는데, 1층에는 관광차나 단체로 오는 손님들을 위한 테이블이 놓여 있고... ",♣슈퍼맨의 세상사는 맛~,https://blog.naver.com/jyleen,2019-07-16
군산횟집::새만금에서는 무조건새만금횟집 이쥐~,https://blog.naver.com/tjsdud8589?Redirect=Log&logNo=220889874189, 새만금 횟집 은 다른 횟집에서 맛보지 못한 음식들이 좀더 다양하게 나오는것 같더라구요~ 이래서 군산 현지인들도 많이 다녀봐야해요.... 새만금 놀러오시거나 오식도나 비응도 가시면 다른곳 말고... 새만금횟집 ... ,º*군산언니네집*º,https://blog.naver.com/tjsdud8589,2016-12-19
군산 횟집 추천 엄청나새만금횟집 ,https://blog.naver.com/yuna0030?Redirect=Log&logNo=221545002909,박대는 두말 할거 없죠 군산에 오면 꼭 먹어봐야하니새만금횟집군산 횟집 추천 맛나게 먹을수 있어요!! 새만금스폐셜 대박인건 랍스타가 속해있다는것!! 바로 랍스터회를 먹어볼수 있어요 저는 이번에 처음... ,카일리행복요리육아,https://blog.naver.com/yuna0030,2019-05-23
전주 도미 맛집 -새만금 횟집 ,https://blog.naver.com/ksijc?Redirect=Log&logNo=181756065,친구가 한잔 하러 가자고 늦게가면 자리가 없다고 하여 같이간 곳새만금 횟집... 전주역 앞 한양주유소 뒷편에 있어요 ~~ 실내마차 같은 분위기의 식당이였는데 좁은 식당에 어찌들 알고 손님들이 그리 많이... ,스카이 전주맛집,https://blog.naver.com/ksijc,2013-03-12
서해안 3대 횟집! 서비스 좋은 군산새만금횟집 ,https://blog.naver.com/god9470?Redirect=Log&logNo=221512524638,"군산에 가기 전 제일 먼저 결정한 곳은 바로새만금 횟집 . 서해안 3대 횟집 중 하나라고 해서 기대가 컸다. 우리는 카톡으로 미리 예약하고 갔는데, 예약하지 않으면 웨이팅을 할 수도 있다고! 이날 바람이... ",Make today awesome,https://blog.naver.com/god9470,2019-04-13
군산횟집은 새만금맛집으로 소문난새만금횟집 으로!,https://blog.naver.com/suekum?Redirect=Log&logNo=220271986931,"오늘은 그 시작을 신나게 해준 군산횟집! 그 중에서도 새만금맛집으로 소문난새만금횟집 입니다! 히힛. 겨울이라그런지 비응항 주변 횟집들은 불이 많이 꺼져있었는데,새만금횟집 은 전체층이 환하게 불이... ",슈꿈그라운드,https://blog.naver.com/suekum,2015-02-13
군산 맛집 투어~비응항전망새만금횟집 ,https://blog.naver.com/hnmh2332?Redirect=Log&logNo=221438617688,위치한새만금횟집 에서 식사를 하였다. 변산반도에서 새만금방조제를 타고 가면 금방 갈 수 있어서 일전에도 몇 번 가본곳이다. 이 곳 횟집은 한 번 가게되면 또 다시 가게되는 매력을 지닌곳이다.이곳이 좋은... ,♥️초록바다의 감성여행,https://blog.naver.com/hnmh2332,2019-01-10
군산 박대를 다양하게 먹을 수 있는새만금횟집 ,https://blog.naver.com/princesshje?Redirect=Log&logNo=221472141171,#군산여행 마지막 식사였던 # 새만금횟집요즘은 서울에서도 싱싱하고 맛있는 회를 먹을 수 있어서... 있어요 횟집 가면 꼭 나오는 샐러드 소스가 새콤달콤 맛있었던 기억이 ㅋㅋ 박대정식을 주만하면 해산물도... ,매력이의 소소한 이야기,https://blog.naver.com/princesshje,2019-02-22
