title,link,description,bloggername,bloggerlink,postdate
군산새만금 횟집가성비 끝판왕,https://blog.naver.com/prosumer123?Redirect=Log&logNo=222211265779,군산새만금 횟집 에 다녀왔었는데 너무 만족해서 여러분께 알려 드리려 해요 제가 다녀왔던 군산새만금 횟집 은 바로 선유도 고래포차였어요 매장 앞으로 펼쳐져 있는 바다가 장관이었는데 그 뷰를 다시 가고... ,by_HUN 블로그,https://blog.naver.com/prosumer123,2021-01-19
"군산횟집 , 오랫만새만금 수산시장 방문",https://blog.naver.com/nose1032?Redirect=Log&logNo=221224420401,"군산횟집 ,새만금 수산시장에서 나온 부수적인 해산물~ 자주 온다며 전복도 챙겨줬는데, 거의 시후마미가 다 먹었어요. ㅎ 산낙지 먹어 기분 좋은 시후군~ ㅎ 잘 먹으니 비싼 돈이 아깝지 않구나! 이번 군산... ",시후마미의 행복한 꿈,https://blog.naver.com/nose1032,2018-03-08
"군산을 가다, 군산 맛집새만금 횟집 , 은파 호수공원의 밤... ",https://blog.naver.com/rukawa_0915?Redirect=Log&logNo=221514536066,일단 운전하고 군산까지 달려와주신 아빠를 위해 아빠가 가장 좋아하셨던 횟집을 갔습니다.새만금 횟집 !!!! 회가 두툼해서 딱 아빠 취향이셨는데 이번에도 음식 맛에 만족하시길 바라며 왔습니다. 회를... ,파란리본의 제멋대로 블로그☆,https://blog.naver.com/rukawa_0915,2019-04-16
기대하고 찾은 군산새만금 횟집 ,https://blog.naver.com/gksmfakdmf1?Redirect=Log&logNo=222278632990,가족들과 군산에서 아주 제대로 된 횟집을 발견했어요. 군산새만금 횟집 으로 유명한 이곳 대전횟집 왠만한 음식은 한상에서 전부 맛보고 왔답니다. 대전횟집 바로 옆으로 바다가 보이는데 횟집2층에서 식사를... ,빠아앙님의 블로그요,https://blog.naver.com/gksmfakdmf1,2021-03-17
군산- 새만금횟집 ,https://blog.naver.com/sunslifeis?Redirect=Log&logNo=221341410171,군산 유명한 짬뽕집 다 포기하고 폭풍 검색해서 찾아온 [ 새만금 횟집 ]. 1층엔 신선한 횟감들 가득. 2층으로 올라와 룸으로 안내받았다. 바다가 살짝 보이는 창가. 좋다. 메뉴..코스 주문 시 회 무한리필이다.... ,sunslife is..,https://blog.naver.com/sunslifeis,2018-08-18
군산횟집비응항새만금 수산시장 대게,https://blog.naver.com/lily2you?Redirect=Log&logNo=221280141533,ㅠㅠ 새우랑 소라도 나와줘서 너무 맛있게 잘 먹은 군산횟집새만금 종합시장.. 이렇게 한상을 받으니 친구도 참 좋아하는듯... ^^ 우리가 주문한 대게... 요게 20만원 어치다... 예전 영덕에서 60만원 결제 했던... ,voice of traveller,https://blog.naver.com/lily2you,2018-05-26
군산 맛집 ::새만금횟집:: 군산 횟집,https://blog.naver.com/gpwlsrhfem?Redirect=Log&logNo=222256611914,여러가지 스끼다시를 먹으면서 회를 즐기기에 좋았습니다 ^^! #군산횟집 #군산여행 # 새만금횟집# 새만금# 횟집#회정식 #스끼다시 #광어회 #군산 #맛집 #네이버예약 #군산맛집 #주말 #여행 #군산여행추천,맹이소녀 블로그,https://blog.naver.com/gpwlsrhfem,2021-02-25
군산새만금 횟집선유도 유람선,https://blog.naver.com/rebornsnfl7?Redirect=Log&logNo=222367638025," 새만금 횟집우린 A코스를 주문했다 전복죽, 바로 옆 갯벌에서 건진 시원한 바지락 국 피조개, 가오리 찜, 간장 새우~ 참치 회도 맛있었다 정말 빨판의 힘이 끝내 주던 낙지 탕탕이 이 지역에서 먹을 수 있는 군산... ",바지런하려GO,https://blog.naver.com/rebornsnfl7,2021-05-26
군산 수협 중매인1호가 운영하는새만금횟집[전북/군산맛집],https://blog.naver.com/cognos57?Redirect=Log&logNo=70189657545,군산 수협 중매인1호가 운영하는새만금횟집[전북/군산맛집] 군산 수협 중매인1호인 김부영사장님이 운영하는새만금횟집 은 회의 맛은 곧 생선의 질이라 말하며 항상 자연산만을 취급하여 신선한 활어로... ,요한의 행복한 여행이야기,https://blog.naver.com/cognos57,2014-05-02
[군산맛집]새만금횟집다녀온 리뷰 회 풀코스 쩔었다,https://blog.naver.com/qorhvk0709?Redirect=Log&logNo=222177164675,저희는 새만금 스페셜을 시켜먹었어요!! 무려 1인당 7만원 ㅎㄷㄷ 진짜비싸요 가격만큼 제대로... 완전만족했다는 담에또갈꺼야!! 그럼 안뇽~! #군산맛집 #군산 # 새만금횟집#군산횟집 #군산맛집추천 #군산횟집추천,푸딩이의 일상생활 리뷰,https://blog.naver.com/qorhvk0709,2020-12-17
 새만금횟집 ,https://blog.naver.com/big_oakwood?Redirect=Log&logNo=220842111055,"새만금 방조제에서 지는 해를 배웅하고, 어둠이 가득내린 방조제를 달려 비응항에 도착했다. 급하게 검색을 통해 찾은 횟집이새만금횟집평일이라서 그런지 주변이 어둠고 인적이 없었다. 영업을 하는지... ",커다란 박달나무,https://blog.naver.com/big_oakwood,2016-10-21
"군산 횟집, 품격있는 코스요리새만금횟집추천",https://blog.naver.com/spa7981?Redirect=Log&logNo=221369787302,군산횟집 다녀간적이 있는데 가짓수는 많은데 조잡스럽고 음식에 손이 안가서 실망한적이 있는 호불가 갈리는곳도 역시 군산이 아니가 싶네요 새만금 수산시장을 끼고 우측으로 돌아가니새만금 횟집 이 나오고... ,푸른솔의 작은 여행~,https://blog.naver.com/spa7981,2018-10-02
군산_ 새만금횟집: 퀄리티 좋은 회를 무한리필로! 내돈내산 후기,https://blog.naver.com/onon0310?Redirect=Log&logNo=222394103095,예약하고 가셔서 박대요리도 드셔보세유 저의 최애 횟집 군산새만금 횟집 에 다녀왔어요 올해 2월에 군산 여행을 갔는데 숙소 근처에새만금 횟집 이 있어서 가봤는데 너무 맛있는데 회가 무한리필이라 또... ,박디라의 존잼 일상,https://blog.naver.com/onon0310,2021-06-11
"군산맛집 - 경기 횟집 ,새만금 방조제와 군산 당일여행에 가기... ",https://blog.naver.com/autolian?Redirect=Log&logNo=30087869393,"군산맛집 - 수산물센터 경기 횟집자연산 회를 맛있게 잘 먹었네요!새만금 방조제 구경하고, 은파유원지 부근에서 점심으로 부대찌개 먹고, 은파유원지의 아름다운 물빛다리 건너면서 멋진 무지개도 보고... ",램블부부 Life Recipe,https://blog.naver.com/autolian,2010-06-12
군산새만금 횟집비응항 맛집 찐이야,https://blog.naver.com/jedidiah69?Redirect=Log&logNo=222092388563, 새만금횟집찾는분들도 많이 가신다고 해요 길게 쭉 뻗은 새만금 방조제 길을 따라 안쪽으로 쭉... 갔던 횟집이 나와요~ 군산새만금 횟집되게 많이 있었는데 그 중에서도 가장 알아주는 곳이라고 하더라구요... ,여디디야의 많은 물소리..,https://blog.naver.com/jedidiah69,2020-09-18
군산 비응항횟집 과새만금드라이브,https://blog.naver.com/sooswhat?Redirect=Log&logNo=222537728702,"바다 조망횟집 , 그리고새만금드라이브 안녕하세요 한끗입니다. 오늘은 군산새만금 에서 다녀온횟집 +드라이브 코스 추천드리겠습니다. 물고기자리 - 주소 : 전북 군산시 비응남로 5 - 메뉴 : 탕정식스페셜 30... ",미간투어,https://blog.naver.com/sooswhat,2021-10-15
[내돈내산/군산맛집] 군산 존맛 횟집 ! 군산새만금횟집 ... ,https://blog.naver.com/shine9329?Redirect=Log&logNo=222339807335,요건 꽁치구이랑 새우인데요 저는 횟집에서 주는 스끼다시 꽁치중에 이렇게 살이 오동통한건 처음 봤어요 ㅋㅋㅋ 가시 바른 순살은 못찍었는데 진짜 살이 통통~~하더라구요 ☺새만금횟집해산물 ㅑ아아아아... ,My Brownie,https://blog.naver.com/shine9329,2021-05-06
[시흥맛집] 장곡동새만금 횟집 ,https://blog.naver.com/ehsdj?Redirect=Log&logNo=60118392075,"즐겨 찾던횟집 이 영업을 안 해서, 하는 수 없이 되돌아 오던 길에 발견한횟집 이었다. 어랏, 언제 생겼지? 큰 길로만 다니다 보니 골목에 있는횟집 을 그냥 지나쳤었나보다. 메뉴에 볼락 매운탕이 있다면 얼마나... ",세 꾸미,https://blog.naver.com/ehsdj,2010-11-15
내돈내산)군산 새만금횟집☆전국5대횟집☆맛녀석촬영지... ,https://blog.naver.com/hb94114?Redirect=Log&logNo=222322858082,# 새만금횟집#군산횟집맛집 #전국5대횟집맛집 #맛녀석촬영지 #횟집추천 #군산맛집 #군산가봐야하는곳 #문가타 #moongata #스토어팜문가타 # 새만금횟집 코스요리 안녕하세요~? 쥬얼리스토어팜을 운영중인... ,moongata 쥬얼리,https://blog.naver.com/hb94114,2021-04-25
 새만금 횟집추천 가성비 킹이었지,https://blog.naver.com/dkdkdk5579?Redirect=Log&logNo=222253957189,사촌에게새만금 횟집추천을 받아서 오랜만에 회도 먹었는데 근래 먹어본 것 중에서는 제일... 마침새만금 횟집추천받은 곳이 있어 바로 들어가봤어요 저희가 찾아간 곳은 고래포차라는 곳인데 오션뷰가... ,시원한아아,https://blog.naver.com/dkdkdk5579,2021-02-23
군산맛집추천::군산 새만금횟집 _어화횟집,https://blog.naver.com/tjsdud8589?Redirect=Log&logNo=220726787697,"군산 새만금 맛집 어화 횟집 의 외관모습이구요, 위치는 선유도 유람선 선착장 바로 옆이라 보시면 될듯 싶어요.. 군산에 살아서 그런지,,, 위치 설명 하나는 끝나...끝나..ㅋㅋㅋ 내자랑..하는 중임..;;;;ㅋㅋ 어화... ",º*군산언니네집*º,https://blog.naver.com/tjsdud8589,2016-06-03
군산 맛집 지린성 고추짜장 / 비응항새만금횟집 ,https://blog.naver.com/sum2_?Redirect=Log&logNo=221639983707,"군산 지린성 추천추천 다음은 다음날 아침으로 먹음새만금횟집군산 횟집 치면 가장 많이 나오는 곳이고 수협 중매인 1호집인가 무튼, 시그니쳐 같은 곳이어보여서 여기로 결정! 코스는 두 가지 회정식메뉴도... ",해피바이러숨,https://blog.naver.com/sum2_,2019-09-05
군산cc 맛집 - 달달한 데이트새만금횟집모닝달에서!,https://blog.naver.com/cinca01?Redirect=Log&logNo=221893192990,3대 횟집으로 꼽히기도 한다고 하네요. 지난주에 맛있는 녀석들에 나오는거 보고 깜짝 놀랐어요~ 반갑기도하고! 사실 늦게라도 리뷰를 남겨야겠다 마음 먹은 건 최근에는 맛있는녀석들에 여기새만금횟집 이... ,세상구경,https://blog.naver.com/cinca01,2020-04-06
[군산]새만금횟집 에서 즐기는 시원하고 풍부한 바다,https://blog.naver.com/stella25028?Redirect=Log&logNo=222289662119,종종횟집가서 이런 세트 메뉴를 먹었는데 이만큼 많이 나온 거는 처음이에요 나올 때마다 친구들이랑 우아~~ㅇ 감사합니다~~~ 이러면서 먹었어욬ㅋㅋㅋㅋㅋ 바다 근처이고 바로 옆이새만금 수산시장이라서... ,기록,https://blog.naver.com/stella25028,2021-03-27
군산횟집 맛있는 녀석들이... 없던곳.. - 비응도새만금횟집 !!,https://blog.naver.com/ysykissme?Redirect=Log&logNo=222345404922,좋은 횟집이 있엇다니... 다음엔 부모님과 가족들이랑 다시 한번 방문해야겠어요. 군산여행이나 선유도로 여행을 오신다면 가성비 만점인새만금횟집적극 추천드립니다^^새만금횟집전라북도 군산시... ,"캠퍼윤, 라이프 스타일",https://blog.naver.com/ysykissme,2021-05-10
군산 비흥항새만금횟집후기,https://blog.naver.com/lovelybi_a?Redirect=Log&logNo=222039237352,"좋았던 곳 회가 무한리필인게 좋은데, 우리는 4인 중에 2인만 회를 먹어서 ㅋㅋㅋㅋㅋㅋㅋ 암튼, 회 좋아하는 엄마땜에 간거니까 맛나게 즐기고 온 곳 #익산근교횟집 #익산근교맛집 #군산횟집 # 새만금횟집 B코스","내 인생 가장 설레는,",https://blog.naver.com/lovelybi_a,2020-07-23
군산 맛집새만금횟집 ,https://blog.naver.com/arthands2?Redirect=Log&logNo=222187959279,"안녕하세요^^ 충청도 토박이 아트라가 최근에 군산을 방문하여횟집 을 다녀왔어요~ 요즘 코로나로 인해 더욱 움추려들고 일상의 활기가 부족한 듯한 이때, 군산새만금 을 방문할 기회가 있어 계절도... ",아트홀릭디자인&벽화그림,https://blog.naver.com/arthands2,2020-12-28
"당일치기 군산 여행_ 이성당,새만금횟집 , 대장봉 뷰 맛집",https://blog.naver.com/jieun54?Redirect=Log&logNo=222224818324,"박대구이 서비스주는 무한리필 횟집새만금횟집전북 군산시 비응안7길 13 / 매일 11:00-15:00, 17:00-22:00 오기 전 군산 맛집을 또 여럿 찾아본 나. 네이버는 체험단이 많아서 인별에서 보통 찾아보는데, 현지인... ",나름의 나로살기_,https://blog.naver.com/jieun54,2021-01-29
군산새만금횟집 을 왜 가는 걸까?,https://blog.naver.com/moso21?Redirect=Log&logNo=221357286528,예전에 군산에 왔을때도 무심코 들어간 횟집의 음식을 보고 놀랐던 기억이 있다. 끝임없이 음식이 나오는데 이제 그만주시라고 했던 기억이....참 좋았는데. 오늘은 인터넷을 금색하니새만금횟집 이 첫눈에... ,어디로 가야하나?,https://blog.naver.com/moso21,2018-09-14
[군산새만금비응항] 끝없이... 나온 #일억조 횟집 ... ,https://blog.naver.com/jw7097?Redirect=Log&logNo=222361277610,#군산맛집 #군산여행 #군산횟집 #군산코스요리 #비응도 #비응도맛집 #비응도횟집 #비응항 #비응항맛집 #비응항횟집 #새만금 #새만금맛집 # 새만금횟집#비응항방파제 #새만금비응항 #군산새만금... ,꽃구름,https://blog.naver.com/jw7097,2021-05-22
군산여행 5탄 -새만금낭만 드라이브횟집등대로,https://blog.naver.com/queencandy?Redirect=Log&logNo=221627914869,^^ 군산에 가심 새만금 드라이브 코스 꼭 가보세요 느므 좋아요^^ 가슴이 탁 트이네요. 낙조 고운 곳에서 저녁 식사.새만금 횟집등대로 추천드려요 군산 여행 다녀온 직장 후배에게 추천 받은 곳인데요 이왕이면... ,캔디여왕의 달콤한 집,https://blog.naver.com/queencandy,2019-08-25
군산새만금 횟집- 스끼다시 풍부한 횟집,https://blog.naver.com/sscd0808?Redirect=Log&logNo=220182315222,군산새만금 횟집- 스끼다시 풍부한 횟집 가족끼리 군산여행을 가게 되었는데 수원사람이라서 ㅜㅜㅜ 정말 맛있는 회를 먹고 싶은 바람이 컸답니다. 고민고민하다가 군산 새만금횟집 으로 가게되었어요. 새만금... ,자르,https://blog.naver.com/sscd0808,2014-11-15
군산맛집 /새만금횟집회정식 20161114,https://blog.naver.com/qkrwltn9887?Redirect=Log&logNo=220873521586,"장성에서 집에 올라오는 길에 군산맛집 들러서 회한접시 먹고 왔어요~ 어디가 좋을까 검색하던 중새만금횟집 이 괜찮다는 평이 많아 이곳으로 결정!! 회정식은 1인 25,000원이고 B코스는 1인 35,000원 B코스... ",지짱's Diary,https://blog.naver.com/qkrwltn9887,2016-11-29
군산새만금 횟집맛집 물고기자리 재방문,https://blog.naver.com/jedidiah69?Redirect=Log&logNo=222451819093,저는 이번에 군산새만금 횟집다녀왔습니다. 도심에서 지내면서 이렇게 확트인 공간은 바라보는것만... 여기지리 잘 모르셔서 어디를 가면 좋을까~ 고민 된다면 군산 새만금 맛집 대장님(사장님)께 물어보시면... ,여디디야의 많은 물소리..,https://blog.naver.com/jedidiah69,2021-07-31
전라북도 군산시 비응항 맛집새만금횟집 ,https://blog.naver.com/gomtn?Redirect=Log&logNo=221640306753,너무 괜찮은 횟집입니다. 군산 가시면 꼭 들러보세요. #군산 #비응항 # 새만금횟집#무한리필 #새만금 #새만금방조제 #군산맛집 #전북 #활어회 #군산시맛집 #비응항맛집 #라비치호텔,박영춘의산행정보 (Gosan21.net),https://blog.naver.com/gomtn,2019-09-06
군산횟집새만금횟집 에서 아구정식 먹었어요!!!,https://blog.naver.com/sunlovebs?Redirect=Log&logNo=221041356036,군산횟집새만금횟집 은 새만금수산물시장 앞쪽에 위치하고 있어요! 전에도 방문한 적이 있어 쉽게 찾아왔네요^^새만금횟집 은 군산수협 중매인 1호가 직접 운영하는 서해안3대횟집으로 이미 소문이 난... ,써니의 알콩달콩♡,https://blog.naver.com/sunlovebs,2017-06-30
