title,link,description,bloggername,bloggerlink,postdate
170318_ 서두산 딤섬만두,https://blog.naver.com/enoue37?Redirect=Log&logNo=220960894322,"드론일형 추천으로 뒤도 안보고 그냥 간서두산 딤섬 ! 아. 역시 맛있는걸 먹음 좀 기분이 풀린다. 그리고 매우 친절하다. 정감이 느껴짐. 그래서 마음이 더 풀림! 집앞에 있음 나는 매일 퇴근길, 다시 여기 출근... ",scs_interior by 일상노트,https://blog.naver.com/enoue37,2017-03-18
"[서울/송파구/방이동:잠실역] 20200127,서두산 딤섬2호점",https://blog.naver.com/visavisu?Redirect=Log&logNo=221885532446,방이동 먹자골목에 2호점을 낸서두산 딤섬 만두. 코딱지만한 1호점과는 달리 호기롭게 전층 사용! 진짜... 촉촉한 새우딤섬. 서두산을 유명하게 한 건 이 군만두가 아니었나. 서두산 탄탄면 2호점엔 면류가 생긴... ,.GrEeNiSh GRIN.,https://blog.naver.com/visavisu,2020-04-01
[서울송파구맛집/방이동맛집] 서두산 딤섬 만두 - 복주머니딤섬... ,https://blog.naver.com/dnr6578?Redirect=Log&logNo=220954037639,"이 동네에 제가 가고 싶었던 딤섬집이 있어 지인들을 모았습니다. 가게명은서두산딤섬 만두 이고, 전에 소개해드린 바오쯔처럼 다양한 중국식 만두들을 먹을 수 있는 식당입니다. 퇴근 후에 가니 만석이라... ",금군의 미각은 나의 힘,https://blog.naver.com/dnr6578,2017-03-15
[방이동][만두] 이게 진짜 만두지!방이동서두산딤섬 ,https://blog.naver.com/babyangelu?Redirect=Log&logNo=220982280934,찍었네요서두산 딤섬 이라는 곳이구요 방이먹자골목에서 시장쪽으로 가는길에 있습니다 사장님 빼고는... 새우딤섬 육즙 팡팡 터지는 샤오롱빠오 진짜 맛있게 먹었습니다 오픈은 4시부터 라고 하는데 저희는... ,허니빈의 즐거운 인생,https://blog.naver.com/babyangelu,2017-04-14
 서두산딤섬맛보기,https://blog.naver.com/kjy4028?Redirect=Log&logNo=222318965125,# 서두산딤섬#딤섬 #만두 #방이시장맛집 #송파맛집 #군만두 #샤오롱빠오 #서로이웃 #서이추 #이웃환영 #서이추환영 안녕하세요! 방이시장 구경갔다가 ~ 뭘 먹을지 고민했었습니다 ㅠㅠ 방이시장에서... ,그린비타민 파워,https://blog.naver.com/kjy4028,2021-04-22
"멕시코 푸드 갓잇, 마라곱창전골 진지아, 수제만두서두산딤섬 ",https://blog.naver.com/haruna85?Redirect=Log&logNo=221712075336,"com/jin_ji_a 수요미식회 딤섬,서두산 딤섬수요미식회에 딤섬 맛집으로 소개되었다는서두산 딤섬저는 예전에 와보고, 이번에 오랫만에 다시 :) 메뉴판. 딤섬 전문점이라 만두가 메뉴의 2/3정도ㅋㅋㅋㅋㅋ... ",...Solamente te quiero,https://blog.naver.com/haruna85,2019-11-19
방이동맛집서두산딤섬 ,https://blog.naver.com/looloo85mom?Redirect=Log&logNo=222422045692,그집 #방이동맛집 #서두산 # 서두산딤섬포장해서 먹었는데도 너무 맛있어서 매장에서 갓 나온 #딤섬 을 먹으면 얼마나 맛있을까 싶어 점심을 먹으러 방이동에 출동햇어요 근처에서두산딤섬 2호점 이 있는데... ,:D,https://blog.naver.com/looloo85mom,2021-07-06
"잠실 맛집 데이트,서두산 딤섬중식 맛집",https://blog.naver.com/i_lovemkk?Redirect=Log&logNo=222448555345,#잠실데이트 #맛집데이트 #송파맛집 # 서두산딤섬#샤오롱 #딤섬 #중국음식맛집 #중식맛집 #군만두 #마파두부밥 #탕수육 #사천탕수육 #탄탄면 #탄탄멘 #크림새우 #송파구청맛집 #방이동먹자골목 #방이동맛집... ,"그냥 일상일기, 232일기장",https://blog.naver.com/i_lovemkk,2021-07-28
서울시 송파구 방이동 :서두산딤섬 2호점,https://blog.naver.com/akosamsik?Redirect=Log&logNo=222327334991,"바쁘신분들을위한 간단요약 (시간되시는분들은 천천히 사진도보시고 공댓좀...-.-)서두산딤섬주소... (중국식만두국)-8000원■샤오룽빠오8개-9000원■딤섬(새우,복주머니)6개-9000원■볶음밥,마파덮밥... ",쌈story,https://blog.naver.com/akosamsik,2021-04-29
방이동 딤섬 맛집서두산 딤섬 /홍콩딤섬,https://blog.naver.com/mirotic_777?Redirect=Log&logNo=222420568822, 서두산 딤섬얼마전 방이동 수제홍콩딤섬 맛집서두산 딤섬 집을 방문했습니다. 방이동에서 워낙에 맛집으로도 유명한 곳이라는 걸 들었는데 드디어 지인들과 함께 방문!! 위치는 방이동 먹자골목에... ,미로틱~☆,https://blog.naver.com/mirotic_777,2021-07-05
서울 잠실 방이서두산 딤섬 만두 2호점 :: 훈툰이 찐이다,https://blog.naver.com/call_my_name?Redirect=Log&logNo=222299877941,서울 잠실 방이서두산 딤섬 만두 2호점 화장실 - 건물 내부에 있음 (비밀번호 사용) - 여성 남성 공용 - 문열면 세면대가 있고 일반 1개씩 2칸 잠실역 옆 방이 먹자골목에 있는 딤섬맛집으로 알려진서두산 딤섬 만... ,행복했던 날들이었다,https://blog.naver.com/call_my_name,2021-04-05
[방이동/ 서두산딤섬 ] 동네... 오픈한 예사롭지 않은 딤섬 전문점,https://blog.naver.com/symin67?Redirect=Log&logNo=220746659932,동네 먹자골목에 새롭게 오픈한 예사롭지 않은 딤섬 전문점서두산 딤섬소개 나갑니다. 케케케...서두산 딤섬이태원 쟈니덤플링과 간판이 비슷합니다. 메뉴입니다. 군만두와 물만두 세가지 종류에 딤섬과... ,맛짱.. 케케케의 Tasty Food,https://blog.naver.com/symin67,2016-06-27
" 서두산 딤섬 , 가성비 괜찮은 잠실 인근 송파구 딤섬 맛집",https://blog.naver.com/itsukayuki?Redirect=Log&logNo=220945108114,"송파구 인근에서 모임을 갖거나 딤섬이 당길 때서두산 딤섬 , 괜찮으실 겁니다. 취블남의맛집을 확인하세요! ■ 취블남 평가 - 서두산 Dimsum (서울시 송파구 방이동) 총점: ★★★☆/5점 만점 (맛 4... ",취블남962(취미로 블로그하는 남자),https://blog.naver.com/itsukayuki,2017-03-20
서울 만두맛집서두산딤섬방이동,https://blog.naver.com/jiniezi?Redirect=Log&logNo=221798277289,"거리상서두산딤섬먼저 다녀 와 봤습니다 멀지만 일부러 찾아간 서두산만두 과연 찾아 갈 만한 만두... 이날은 디저트로 간단히 먹으러 온거라^^ 만두(딤섬) 두판 먹고 17,000원 샤오롱빠오 9,000원 새우군만두 8... ",지니맛집,https://blog.naver.com/jiniezi,2020-02-06
송파 방이동 수제딤섬만두서두산2호점,https://blog.naver.com/hkodlove?Redirect=Log&logNo=222416269627,샤오롱바오와 가지튀김은 맛있었고 다른건 소소했습니다.(완전 주관적) 딤섬류가 먹고 싶다면 메뉴도 다양하니 한번 가보면 좋을거 같아요 ;) # 서두산딤섬# 서두산딤섬 2호점 #딤섬맛집 #송파딤섬 #가지튀김맛집... ,"쉼표, 마침표. 느낌표!",https://blog.naver.com/hkodlove,2021-07-01
잠실 방이동 맛집 /서두산딤섬2호점,https://blog.naver.com/sum2_?Redirect=Log&logNo=222056169064,잠실 딤섬 방이동 맛집서두산딤섬2호점 1호점은 여러번 가본 곳인데 방이동 먹자골목 초입쪽 지나는데 서두산이 보이는 거! 알고보니 2호점을 연서두산 딤섬 만두 밖에서 보기에는 사람도 별로 없으려나 싶고... ,해피바이러숨,https://blog.naver.com/sum2_,2020-08-10
 서두산딤섬_송파나루/방이먹자 딤섬맛집,https://blog.naver.com/blackcat1073?Redirect=Log&logNo=222539099173,육즙 팡팡딤섬ㅠㅠ 감격 안녕하세요. 코카테입니다. 산책하다가 우연히 들리게 된딤섬 집 소개하고자 합니다...! 오오옷? #생활의달인 저녁 전에 간단하게 먹을까 하고 들어가 보게 됐습니다. 내부정보... ,매일이 기대되는,https://blog.naver.com/blackcat1073,2021-10-16
"잠실 딤섬 맛집,서두산딤섬 만두",https://blog.naver.com/wlalsdlwwk?Redirect=Log&logNo=222277891204,#송파 #잠실 #딤섬 #맛집 # 서두산딤섬 만두 #수제홍콩딤섬 #쟈니덤플링 #스승가게 딤섬을 먹은지 너무 오래 되었는데 마침 션이 잠실로 데이트 가는 날에서두산딤섬 만두 라는 가게를 찾았다 뭔가 찐 맛집... ,"짐, 뭐하니",https://blog.naver.com/wlalsdlwwk,2021-03-16
방이동딤섬맛집서두산 ! 좋아하는 중식집,https://blog.naver.com/vbdjalsl?Redirect=Log&logNo=222445941301,"가끔 포장해서 사먹었던 방이동 딤섬 먹자골목 들어가는 메인 골목 부분에 있는데 가끔씩 생각나는...서두산 딤섬1호점 영업시간 : 매일 11:30~24:00 (조기마감 할 수 있음) 주차x 포장, 택배 가능",홍익님의 블로그,https://blog.naver.com/vbdjalsl,2021-07-26
[서울/잠실 맛집] 군만두 맛집서두산 딤섬 ,https://blog.naver.com/myhan0421?Redirect=Log&logNo=222475112715,꿀단지입니다 오늘은 잠실 맛집서두산 딤섬소개해드릴게요 친구 강추 딤섬집 테이크아웃하러 고고띵서두산 딤섬만두 간판은 이렇게 생겨도 찐맛집 영업시간 매일 11:30-24:00 군만두는 꼭 먹어야한다구 해서... ,꿀단지해 꿀로그,https://blog.naver.com/myhan0421,2021-08-18
"[맛집] 서두산 딤섬 , 잠실 방이동 훌륭한 중식당",https://blog.naver.com/uhbhj?Redirect=Log&logNo=222427878916,"느낀 점이라면, 다음에 또 가서 뭘 먹어볼까 하는 기대. 친구 돈으로 친구가 사서 얻어먹은 후기 진짜 잘먹었다. #서두산 # 서두산딤섬#방이동맛집 #방이동중국집 #방이동중국요리 #잠실맛집 #잠실중국집 #죽엽청주",조주객의 조주객잔,https://blog.naver.com/uhbhj,2021-07-11
방이동 맛집_서두산 딤섬2호점,https://blog.naver.com/injooooo?Redirect=Log&logNo=222410618186,있는서두산 딤섬나는 이번이 첫 방문이었는데 우리 회사 사람들이 점심먹으러 자주 가는 곳이다... #서두산 #서두산2호점 #방이동 #방이동맛집 #방이맛집 #딤섬맛집 #딤섬 #꿔바로우 #꿔바로우맛집... ,너는 반짝이고 있어,https://blog.naver.com/injooooo,2021-06-26
방이동서두산딤섬 ,https://blog.naver.com/sally3709?Redirect=Log&logNo=222225495621,딤섬 샤오롱바오가 먹고싶다.... 홍콩가서 얌차가 하고싶다며 고민고민하는데 삼성동 팀호완 분위기말고 카트 끌고와 이거저거 빼 먹는 느낌을 만끽하고싶어 고민하다가서두산딤섬와아... 주차 빡세.. 생강채... ,no whr now here.,https://blog.naver.com/sally3709,2021-01-30
잠실 송파 맛집 :서두산 딤섬새우군만두 솔직후기,https://blog.naver.com/br4442?Redirect=Log&logNo=222386612390,딤섬도 너무 궁금했는데... 도저히 시킬수가 없더라구요 다 남기는 것도 실례니까요 ㅠㅠ 쨔쟌... 송파만두 #방이동만두 #방이동만두맛집 # 서두산딤섬# 서두산딤섬 만두 #서두산만두 #새우군만두 #쟈니덤플링,소소한 슈퍼컨슈머❤️,https://blog.naver.com/br4442,2021-06-06
[잠실/방이] 자꾸 생각나는 잠실 딤섬 맛집서두산딤섬 ,https://blog.naver.com/binladen0405?Redirect=Log&logNo=222428108848,"훈툰, 군만두도 시켜봄 하나같이 다 맛있었당 저번에 갔을 때 일하시는 분들이 열심히 딤섬을 빚고 계셨는데 그래서 더 맛있게 느껴지는 거 같기도 하고ㅋㅋ 잠실 딤섬 맛집으로서두산딤섬추천합니다아",끄적끄적 일상 기록,https://blog.naver.com/binladen0405,2021-07-12
엥? 방이동에 이렇게 맛있는 만둣집이? ' 서두산 딤섬 ',https://blog.naver.com/5_hyejin?Redirect=Log&logNo=222413047573, 서두산 딤섬외관 방이동으로 이사오고 난 후 잠실 롯데백화점까지 걸어다니는 1인 방이맛골 길... image서두산 딤섬내부 큰 규모의 식당은 아니었고 테이블도 그렇게 많은 편은 아니다 음 그리고 그냥... ,오혜의 행복한 세상( ღ'ᴗ'ღ ),https://blog.naver.com/5_hyejin,2021-06-28
" 서두산 딤섬- 방이동 맛집, 방이동 딤섬집, 방이동 훈둔",https://blog.naver.com/behappywj?Redirect=Log&logNo=220805763655,"이서두산 에 가기까지 참 많은 일들이 있었는데..서두산 과의 첫 만남은, 새벽 1시 30분쯤 가게를... 두번째 만남, 결국 오빠들과 함께딤섬 집으로 출동. 1시에 당당하게 문을 열고 들어가자저희 한시까지... ",petit coffre,https://blog.naver.com/behappywj,2016-09-06
맛집] 유명하다고 해서 방문했는데...서두산 딤섬 만두 솔직 후기,https://blog.naver.com/4youh?Redirect=Log&logNo=222308542225,"그곳은 방이동 맛집으로 유명한서두산 딤섬 만두입니다. 가게 앞에는 찐 맛집만 출연한다는... 새우 딤섬(9,000원)을 주문했습니다. 주문이 끝나고 나오는 기본 반찬은 아래와 같습니다. 곁들여 먹는 간단한... ",신내동폭격기,https://blog.naver.com/4youh,2021-04-13
210616서두산 딤섬+ 석촌호수 산책,https://blog.naver.com/toonyang?Redirect=Log&logNo=222401899441,곱창집이 많이 보였는데 뚠눈으로 봐서 그런 걸지도 가게 사진은 없지만서두산 딤섬 에 도착한 사진. 주변사람들은 모두 군만두+새우딤섬을 먹고 있었지만 우리는 샤오롱바오 (9000)와 하가우(10000)를 시켰다.... ,어쩌다보니...,https://blog.naver.com/toonyang,2021-06-18
만두의 신!서두산 딤섬 만두,https://blog.naver.com/gura6943?Redirect=Log&logNo=221673350464,잠실에 사무실인 것이 엄청 보람찬 이유가 얼마없는데 ㅋㅋㅋㅋㅋㅋㅋㅋ 그 중 하나가서두산 딤섬 만두가 있다는것! 정말 다 맛있는데 꼭 먹어야 하는 네가지를 공개합니다! ✅군만두 이건 무조건 두판!! 왜?... ,공작왕 켄묘,https://blog.naver.com/gura6943,2019-10-10
내사랑서두산| 방이동 먹자골목딤섬| 잠실딤섬 ,https://blog.naver.com/moonrabbitv?Redirect=Log&logNo=222404015547,"#서두산 #잠실맛집 #서두산2호점 #방이동먹자골목 #잠실맛집 #잠실딤섬 #서울딤섬 #만두맛집... 맛있고 맥주 더 땡기고 난리나요. 재방문 의사 너무 있고, 포장 해온다는걸 깜빡한서두산 딤섬2호점 포스팅이었어요.",보나의 정원,https://blog.naver.com/moonrabbitv,2021-06-20
 서두산딤섬2호점과 본점의 차이점,https://blog.naver.com/harp712?Redirect=Log&logNo=222382631555,"https://blog.naver.com/harp712/222327244506 지난번에 제가 올린 딤섬맛집서두산딤섬본점의 포스팅을 보신 분이라면, 만두가 맛있어봐야 얼마나 맛있냐 한다면, 혼납니다?ㅋㅋㅋㅋㅋㅋㅋㅋㅋㅋㅋㅋ 정말정말... ",발루ACC 그리고 취미생활,https://blog.naver.com/harp712,2021-06-06
방이동 맛집 딤섬맛집서두산딤섬 ,https://blog.naver.com/ecoaileen?Redirect=Log&logNo=221686874670,맛있었어요! 고사리가 마파두부에 꽂히다늬!!!!! ㅋㄷ 아 ㅜㅜ 다른것도 먹어봤는데 먹느라 사진을 못찍었네요 흑흑!! 마음으로 간직~! 내 마음속에 찰칵~!! #방이동 맛집 #잠실맛집 #딤섬맛집 # 서두산딤섬 ,Eco Aileen(에코에일린)의 맛&멋부림,https://blog.naver.com/ecoaileen,2019-10-24
[내돈내산]서두산딤섬중국 본토의 맛을 보여주는 수제 딤섬... ,https://blog.naver.com/joohwan91?Redirect=Log&logNo=222399022127,"중국 본토의 맛을 경험해 본 방이동 먹자골목 수제 딤섬 전문점서두산딤섬식사 대용으로도 맛있고, 간식으로도 먹어도 맛있는 언제 어디서 먹어도 맛있는 음식 만두 안녕하세요. 맛있게 먹고, 즐겁게... ",디모와 함께 Eat & Drink,https://blog.naver.com/joohwan91,2021-06-15
"잠실/방이 - 수요미식회반영 딤섬, 만두 맛집 ' 서두산 딤섬만두'",https://blog.naver.com/gold_angle?Redirect=Log&logNo=222470066621,다음에 칭따오와 군만두 먹으로 다시 가고 싶은 맛집이었어요~~ ^^ #잠실맛집 #방이먹자골목맛집 #방이먹자골목만두 #만두맛집 #수제만두맛집 # 서두산 만두 # 서두산 만두2호점 #군만두 # 딤섬 맛집 #맥주안주,G.A. 블로그,https://blog.naver.com/gold_angle,2021-08-14
방이동 맛집서두산 딤섬만두,https://blog.naver.com/radi8483?Redirect=Log&logNo=222377028827,"잠실역과 송파나루역 중간에 위치한서두산 딤섬만두집입니다 친구 추천으로 방문했는데 굉장히... 입구에 서두산!! 이라는 한자겠죠?ㅋㅋ 중국분이 운영하시는 것 같았어요 내부는 이렇게 되어 있고, 저녁... ",호기심나니,https://blog.naver.com/radi8483,2021-05-31
잠실 맛집 -서두산 딤섬 ,https://blog.naver.com/filip9136?Redirect=Log&logNo=222404192720,"# 서두산딤섬딤섬도 괜찮은데 야끼군만두가 미쳤습니다,,,, 바삭 촉촉 어떻게 두 가지를 다 만족할 수 있죠..? 맥주랑 먹어야주 이건 #탄탄면 인데 마라 맛이 느껴져요! 약간 차알 마라탕면이랑 비슷한 것... ",bitterosweet,https://blog.naver.com/filip9136,2021-06-20
방이동 소박한 딤섬집 -서두산 딤섬 ,https://blog.naver.com/mercyblu?Redirect=Log&logNo=220777178933,"가게도 작고, 간판도 이름도 낯설고 분식집스러운딤섬 전문점이다. 근데 이딤섬 집 인근이 혼술, 혼밥의 거리라고 친구가 알려준다. 그 얘기를 듣고 거리를 거니는데 아주 작은 식당과 주점들이 불야성을... ",머시블루's Happy Nation,https://blog.naver.com/mercyblu,2016-08-02
방이동 생활의 달인 맛집서두산딤섬 ,https://blog.naver.com/lovej79?Redirect=Log&logNo=222338151301,마감 02-425-4588 포장 및 택배달가능 만두 택배가능 10인분+1인분 서비스 냉동만두 10인분 주문시 1만원 할인 #방이동맛집 # 서두산딤섬#방이동 서두산딤섬#방이동생활의달인맛집 #복주머니딤섬 #내돈내산,일상이 예술,https://blog.naver.com/lovej79,2021-05-05
방이동 맛집)서두산딤섬 만두,https://blog.naver.com/ming2722?Redirect=Log&logNo=222351055088,방이동 쪽 임장간 날 들렸던서두산딤섬 만두. 원래 가려고 했던 버거집이 브레이크타임이라 차선책으로... 샤오롱빠오 저렇게만 먹으니 너무 배고파서 새우딤섬 추가로 주문 새우가 꽉 차있다. 새우딤섬... ,만두라이프 ٩(ˊᗜˋ*)و,https://blog.naver.com/ming2722,2021-05-14
샤오롱빠오 찐맛집 “ 서두산 딤섬 ”,https://blog.naver.com/wldn3737?Redirect=Log&logNo=222402592492,"찐맛집 소개해드릴게용 송파나루역 근처에 위치한 “ 서두산딤섬 ” 빨간 간판이에요 ㅎㅎ 영업시간... 새우딤섬, 볶음밥 이렇게 주문했어요☺️ 가격도 생각보다 착해서 놀랐으유 간장이 두종류 중국천초 이건... ",Serendipity.,https://blog.naver.com/wldn3737,2021-06-18
송리단길 맛집 방이먹자골목서두산딤섬존맛탱,https://blog.naver.com/qwt0906?Redirect=Log&logNo=222325887380,#송리단길맛집 #방이먹자골목맛집 # 서두산딤섬안녕하세요 쥐상놀이터 에요:) 이번에 남편이랑 외식하다가 전에 지나가다가 여기는 나중에 꼭! 먹어봐야지 하고 지나쳤던 방이먹자골목 맛집서두산딤섬 ... ,쥐상놀이터,https://blog.naver.com/qwt0906,2021-04-28
[잠실 맛집] 수요미식회 ' 서두산 딤섬 ' 2호점 가지튀김 추천... ,https://blog.naver.com/ekgml7414?Redirect=Log&logNo=222458475084,안녕하세요- 오늘은 잠실에 위치한 ' 서두산 딤섬 ' '콩카페' 소개합니다! 지난 5월 말에 다녀왔어요 (5월부터 밀린 포스팅 산더미)서두산 딤섬잠실 갈일이 있어서 맛집 찾아보다가 발견한서두산 딤섬 ! 2호점... ,Heestory,https://blog.naver.com/ekgml7414,2021-08-05
[서울/방이동]서두산딤섬 ,https://blog.naver.com/lcw6285?Redirect=Log&logNo=222005150266,"방이동 먹자골목에 위치한서두산 딤섬 . 송파에서 유년기를 보낸 나에게 이 지역은 꽤나 익숙하고... 야끼만두와 딤섬을 하나 주문했고, 마파두부 덮밥도 하나 주문. 사장님과 직원분은 아마도 중국분들.... ",Wonywon,https://blog.naver.com/lcw6285,2020-06-30
 서두산딤섬 -방이동딤섬,https://blog.naver.com/clala70?Redirect=Log&logNo=221006687525,믿을만한 지인분이 맛있다고 강력 추천하신딤섬 집 자다가도 벌떡 일어날 만큼 애정하는 만두류라 가보리라 리스트업한 곳입니다. 용산갔다 오는 길에 찾았어요. 혼 딤섬 입니다. 홍콩식 수제딤섬 . 흐흐흐 가게... ,클라라의 즐거운 맛집,https://blog.naver.com/clala70,2017-05-16
방이동 맛집서두산딤섬 ,https://blog.naver.com/sally3709?Redirect=Log&logNo=222481674834,또 가는거다 우리는 새로운 모험은 거부한다면서 방이동 먹자골목 등본사진 완벽하게 딱 켜고 들어가 사장님 보여주며 뉴 4단계 이전에 6시 이후 저녁먹기 야끼군만두 샤오롱빠오 3판 새우 딤섬순새우 딤섬2판... ,no whr now here.,https://blog.naver.com/sally3709,2021-08-23
방이동 중국만두 맛집서두산딤섬2호점 수요미식회 만두 맛집,https://blog.naver.com/gene_k?Redirect=Log&logNo=221752362485,방이동 중국만두 맛집서두산딤섬본점보다 2호점은 딤섬의 종류와 요리 종류를 대폭 늘렸다. 그런데 수정 딤섬의 가격만으론.. 좀 오버한 듯도 싶어 ㅎㅎㅎ 우린 1차로 저녁식사를 하고 2차 방문이라 안주... ,"젠타의 ""너 맛집맞아?""",https://blog.naver.com/gene_k,2020-01-29
방이동서두산 딤섬 ,https://blog.naver.com/dalpangjuice?Redirect=Log&logNo=221443872599,"그래도 멀리 간 보람이 있었던서두산 딤섬 . 육즙 팡팡 샤오롱바오와 겉은 바삭 속은 촉촉 군만두, 그리고 보들보들 딤섬들... 먹고 나서 너무 반했다. 혼자 먹는 것이 미안해 엄마와 남편을 위해 포장했는데... ",봄봄맘의 달콤한 북로그,https://blog.naver.com/dalpangjuice,2019-01-16
[잠실/방이동] 서두산 딤섬 ,https://blog.naver.com/karen2p?Redirect=Log&logNo=221565024358,잠실 방이동 먹자골목서두산 딤섬주말이었는데도 요 음식점 골목엔 사람도 별로 없고 근처 음식점들도 썰렁~ 그런데 이곳 서두산에 들어가니 사람들이 바글바글^^ 마지막 남은 빈자리에 착석 김이 모락모락... ,karen님의블로그,https://blog.naver.com/karen2p,2019-06-18
수요미식회딤섬맛집서두산 (내돈내산),https://blog.naver.com/vitamin0317?Redirect=Log&logNo=221873924865,수요미식회딤섬맛집서두산 (내돈내산) 저와 남편은 만두귀신인데요. 잠실 롯데월드몰에 볼일이 있어 서울에 왔다가 티비에 방송된 음식점에 가보고싶어 들러본서두산후기입니다. (코로나 심해지기전 1월에... ,빵수니네 늬우스,https://blog.naver.com/vitamin0317,2020-03-26
"잠실 방이동 딤섬 맛집,서두산 딤섬2호점",https://blog.naver.com/amukannah?Redirect=Log&logNo=222363733052,"오늘도 육즙 가득하니 좋더라 새우 딤섬 . 새우가 토실토실. 군만두 ! 오늘은 야끼만두로 시켰는데, 아주 맛있었다 새우 딤섬이게 진짜 존맛. 다음에 두판 시켜머거야지.","즐거운 나날들, 라리렐레:)",https://blog.naver.com/amukannah,2021-05-24
[딤섬 맛집] 방이동 홍콩식 수제서두산 딤섬방문 후기,https://blog.naver.com/juka103?Redirect=Log&logNo=222206419208,맛집을 찾아 길을 나서기에도 부담이 없군요 홍콩식 수제 딤섬으로 유명한 맛집을 찾아가 보았습니다.... 직진하면서두산 딤섬본점이 나옵니다. 서두산이란 지명일까요? 왜서두산 딤섬 인지는 모르겠습니다.... ,청담동 라움부동산 010-8751-5430,https://blog.naver.com/juka103,2021-01-13
[방이동]서두산 딤섬 ,https://blog.naver.com/sanjeok100?Redirect=Log&logNo=221654155321,스시선에서 가볍게 일잔하고 2차 방문해봤다서두산 딤섬노려보고 있던 곳이었는데 동선 맞는 김에 방문해봤다 방이동 위치한서두산 딤섬무브무브 지역 정보 공유차 늦은 시간까지 손님 많더라 회전율... ,아마추어 수구인-water polo man,https://blog.naver.com/sanjeok100,2019-09-25
거래처 저녁식사 :: 방이동맛집서두산딤섬 ,https://blog.naver.com/harp712?Redirect=Log&logNo=222327244506,저랑 거래처형님 둘다 딤섬매니아라서 말이니다 하하하- #방이동맛집 # 서두산딤섬#딤섬 #거래처 #저녁식사 #딤섬맛집 #블챌 #오늘일기 #샤오롱빠오서두산딤섬서울시 송파구 올림픽로 32길 52 소은빌딩... ,발루ACC 그리고 취미생활,https://blog.naver.com/harp712,2021-05-09
[방이동]서두산 딤섬만두,https://blog.naver.com/pca2765?Redirect=Log&logNo=220727477658,"청출어람이라는 말이 흔히 쓰이고 있지만, 쟈니 덤플링과 서두산의 만두만을 놓고 봤을 땐, 스승보다... 삼치물만두와 딤섬 한두 가지 정도 추가로 맛보고 싶다.서두산 딤섬만두 서울시 송파구 방이동 104 02-425... ",처음.이슬.처럼.,https://blog.naver.com/pca2765,2016-06-29
잠실맛집)홍콩식딤섬맛집- 서두산딤섬 에서 만두싹쓰리!역시... ,https://blog.naver.com/heyjihae05?Redirect=Log&logNo=222432249727,이날은 퇴근하고 시원한 맥주와 간단하게 먹을게 없을까 하다가 딤섬맛집인 # 서두산딤섬방문... 빨간간판이 반겨주는 서두산만두서두산딤섬 은 수요미식회 생활의달인에 나온 맛집이라고 한다. 이런데 나와도... ,아날로그 잠실직장인의 일상,https://blog.naver.com/heyjihae05,2021-07-15
