title,link,description,bloggername,bloggerlink,postdate
잠실역 방이 먹자골목 딤섬 탄탄면 중국음식 맛집 - 서두산 딤섬 ,https://blog.naver.com/juliehk?Redirect=Log&logNo=221868822682,오랜만에 딤섬과 탄탄멘 먹으러 잠실맛집서두산 딤섬 을 찾았다 다양한 중국 고량주들과 연예인 사인이 붙어있었음 나도 처음에 추천 받고 가본 맛집이라 반신반의 했었는데 진짜 인정하는 맛집이었다 먹고싶은... ,공간 리뷰어 '공리',https://blog.naver.com/juliehk,2020-03-23
방이동서두산 딤섬2호점,https://blog.naver.com/lego8099?Redirect=Log&logNo=221951039253,"방이동서두산 딤섬2호점 2층 집에 올라가있는 샤오롱 바오 8개 간만에 작년에 입던 치마와 자켓을... 더불어 양심도 없음 ㅋㅋ 아무튼, 좀 멀긴 하지만 집에서 걸어갈 수 있는 곳에 이런 멋진 딤섬집이 있다니... ",먹고 마시고 공부하고 놀기,https://blog.naver.com/lego8099,2020-05-07
 서두산딤섬 _방이동 맛집,https://blog.naver.com/eunsun8318?Redirect=Log&logNo=221673089004, 서두산 딤섬(수제홍콩딤섬전문점) - 송파 방이동 맛집 오래전부터 남푠하고 다니돈 맛집 방이동에서두산 딤섬 집이예요. 요즘은 인기가 많아져서.... 조금 기다리고 먹었네요ㅠㅠ 방이동골목 시장안에 있습니다... ,루비루비,https://blog.naver.com/eunsun8318,2019-10-09
" 서두산딤섬 , 태재제빵소",https://blog.naver.com/yeonjin85?Redirect=Log&logNo=221845236088,"일 끝나고 먹는 건 뭐든 맛있기에 집근처 둘러보다 들린 곳, 알고보니 수요미식회에도 나온 # 서두산딤섬#훈툰 과 #샤오롱빠오 주문했어요.술 한 잔이 필요했던 날, (스스로 고생했다고 다독이는 날이죠)... ",김연진아나운서/영어MC,https://blog.naver.com/yeonjin85,2020-03-09
"방이동딤섬맛집,서두산 .",https://blog.naver.com/oupru7?Redirect=Log&logNo=222420972016,시켰습니다서두산 의 훈툰은 홍합이 잔뜩 들어가서 너무 맛잇어요~ 홍합탕에 물만두 동동인 느낌이에요~ 안주로 먹기 정말 딱이에요 술드실려면 훈툰은 필수! 다 좋아하는 샤오롱바오 히히 얘도딤섬 집에... ,박숑이의 오글오글 여행 + 요리 블로그,https://blog.naver.com/oupru7,2021-07-14
잠실서두산딤섬 ,https://blog.naver.com/supanman?Redirect=Log&logNo=222435783239,"잠실에 있는서두산 딤섬방문기. 슈타인도르프가 궁금해서 맥주 한 잔 마시고, 해당 가게도 호기심이 있었어서 들러보았습니다. 테이블 6ㅡ7개 정도의 작은 매장인데, 근처에 더 크고 다양한 요리를 하는... ",걷다가걷다가,https://blog.naver.com/supanman,2021-07-18
방이동서두산 딤섬2호점,https://blog.naver.com/lego8099?Redirect=Log&logNo=221970642837,"방이동서두산 딤섬2호점 히히 맛있음~ 지난주에 간만에 만난 동생이랑 갔던서두산 딤섬2호점. 둘이서 많이 묵었다... ㅋㅋㅋ 집에서도 아주 멀지 않고, 맛있어서 조만간 언니들이랑도 함 갈듯. 새우딤섬... ",먹고 마시고 공부하고 놀기,https://blog.naver.com/lego8099,2020-05-19
만두딤섬 맛집 잠실서두산딤섬2호점 (feat. 가지튀김 최고)... ,https://blog.naver.com/mvp9521?Redirect=Log&logNo=222113839793,먹었다 # 서두산딤섬이란 곳인데 오 꽤 유명한 곳! 가격대도 생각보다 엄청 저렴하고 저기 말고도 요리메뉴도 있는데 만두 무조건 딤섬 무조건이야 ㅠㅠ 생활의 달인에도 나오셨다 연예인들 싸인 가득한 곳... ,My New’s Archive,https://blog.naver.com/mvp9521,2020-10-12
잠실 딤섬 _서두산재방문기,https://blog.naver.com/juliehk?Redirect=Log&logNo=222105039619,오랜만에 저번에 갔던서두산이번에는딤섬 위주로 주문했다 탄탄멘 튀김만두 에메랄드딤섬소롱포 등등 탄탄멘은 맛있다 구수한 국물 하지만 계속먹으면 짜다 군만두 겉바 속촉 하지만 짰다 김이 모락모락... ,공간 리뷰어 '공리',https://blog.naver.com/juliehk,2020-10-02
 서두산 딤섬 ,https://blog.naver.com/mintwed?Redirect=Log&logNo=222100098398,오랜만에 딤섬... 청담동까지 가기는 넘 멀고 지인이 편하게 먹을 수 있다고 해서 막히는 금요일 저녁에 가자... 잠실서두산 딤섬 ... 음.. 가격이 착하다... 새우와 돼지고기가 들어가 있는.. 난 돼지고기에... ,HAPPY LIFE,https://blog.naver.com/mintwed,2020-09-26
방이동 :서두산 딤섬 ,https://blog.naver.com/vovovodol?Redirect=Log&logNo=222534048971,방이 먹자골목 딤섬 맛집서두산 딤섬서울 송파구 올림픽로32길 52 방이동 먹자골목을 걷다가 작은 딤섬 가게에 사람이 꽉차있는걸 보고 들어감 어디서 들어본 것 같은 이름이다. # 서두산딤섬사진을 못찍어서... ,메로나,https://blog.naver.com/vovovodol,2021-10-12
 서두산 딤섬- 잠실,https://blog.naver.com/tennkuma?Redirect=Log&logNo=222490846736,이태원에 쟈니 덤플링이 있다면 잠실에는서두산 딤섬 이 있다!! 하얼빈도 맛있고 칭따오도 맛있어서... #잠실 #잠실맛집 #잠실만두 #잠실만두집 #잠실 서두산딤섬# 서두산딤섬#샤오롱빠오 #군만두... ,TENN x TEN = 100%,https://blog.naver.com/tennkuma,2021-09-01
방이동 만두 맛집 :서두산 딤섬 ,https://blog.naver.com/bsb7411?Redirect=Log&logNo=221340951969,맛집서두산 딤섬 . 늦은 시간이었지만 친절히 맞아주신 직원분들이 좋았던 곳이에요. 방이동 만두 맛집 :서두산 딤섬방이동서두산 딤섬메뉴. 제법 눈길을 끄는 메뉴가 많습니다. 착석. 기본찬. 자차이와... ,Blaack Log,https://blog.naver.com/bsb7411,2018-08-22
방이동 /서두산딤섬 ,https://blog.naver.com/begopa1092?Redirect=Log&logNo=220878192024,방이동 먹자골목 끝쪽 즈음에 위치한서두산 딤섬 .. 소개시켜준 지인이 쟈니덤플링만큼 맛나다고 해서 들렀던 딤섬집 또는 만두집이다 10여평 되는 아담한 규모.. 만두라 생각하면 비싸고 딤섬이라 생각하면... ,eye of the beholder,https://blog.naver.com/begopa1092,2016-12-06
"방이동 맛집,서두산 딤섬만두",https://blog.naver.com/imha_rang?Redirect=Log&logNo=220758759172,"우연히 알게 된서두산 딤섬만두. 만두맛집이라하면 꼭 가봐야하는 우리 두사람은 오랜만에 발견한 만두 맛집이라(들었다) 진짜 신나게 방이동 맛집,서두산 딤섬만두로 달려갔다. 방이동 먹자골목과 방이시장... ",momentlogue,https://blog.naver.com/imha_rang,2016-07-10
 서두산 딤섬만두 : 방이맛집 수제홍콩딤섬전문점 을 만나다:),https://blog.naver.com/cera_u?Redirect=Log&logNo=221474196556,"빨간색이여서 한눈에 찾을 수 있답니다~ 모든 메뉴는 포장가능하다고 써 있네요~ 코스요리도 있으니 나중에 친구들과 한잔하러 와야겠어용~서두산 딤섬메뉴예요, 군만두, 훈툰, 물만두, 샤오롱바오, 딤섬... ",유와 비우의 어도러블 일상,https://blog.naver.com/cera_u,2019-02-25
너무 맛있자너? 방이동 샤오롱빠오!서두산 딤섬만두,https://blog.naver.com/fyfs0403?Redirect=Log&logNo=221227567453,한국에서는 그 맛을 보기 어렵다는 딤섬 맛집인서두산 딤섬만두입니다 :D 역에서 찾아가기에는 조금 먼 느낌도 있어요. 그래도 이제 점점 날도 풀리고 있으니까 석촌호수 옆길을 지나가면서 부쩍 다가온 봄을... ,insigt.tak,https://blog.naver.com/fyfs0403,2018-03-13
"잠실맛집서두산 딤섬 , 수제 홍콩딤섬 전문점",https://blog.naver.com/haruna85?Redirect=Log&logNo=221269577593,"잠실맛집서두산 딤섬 , 수제 홍콩딤섬 전문점 언제 먹어도 너무 맛있는 만두! 만두는 나라불문 다 좋아하는데요, 왠지 맥주에는 중국만두가 좋아요. 저만 그런가ㅋㅋㅋ잠실쪽에서 중국만두, 딤섬으로는 가장 잘... ",...Solamente te quiero,https://blog.naver.com/haruna85,2018-05-06
"방이,서두산 딤섬 ",https://blog.naver.com/damnhungry?Redirect=Log&logNo=220799667129,방이동맛집서두산 딤섬만두 수제홍콩딤섬전문점 저번주 금욜 뿡썬언니와 워크샵 갔다가 뒷풀이가 취소되어 방이동 먹자골목으로 돌진 ! 장원곱창과 고민하다가 안가본 서두산으로 총총 궁금궁금했어... ,헝그리 참 헝그리해 헝헝헝,https://blog.naver.com/damnhungry,2016-08-29
송파슐랭가이드]방이동에서 즐기는 홍콩 맛 여행서두산 딤섬 ,https://blog.naver.com/happysongpa?Redirect=Log&logNo=221025408178,가게 뒤쪽으로 주차는 가능하고요 단맛이 난다고 하는 포스팅도 봤지만 모든 분들의 입맛이 다른 점 이해 부탁드리고요 현지의 맛을 그대로 느낄 수 있는 딤섬을 저렴하게 드시고 싶다면 ' 서두산 딤섬 ... ,송파구청 대표 블로그,https://blog.naver.com/happysongpa,2017-06-09
방이동서두산딤섬 ,https://blog.naver.com/lucy038?Redirect=Log&logNo=221570597538,다채로운 맛의서두산딤섬 의 새우딤섬 역시 상호명에 답이 있었네요. 딤섬맛집이네 야채군만두 위에서 보이는 모양은 전분 꽃이 활짝 피어있고 아래쪽은 촉촉하게 구워낸서두산딤섬 의 야채군만두 . 생전 처음... ,쩝쩝박사 는지,https://blog.naver.com/lucy038,2019-06-25
서울맛집 방이역서두산 딤섬 만두,https://blog.naver.com/honeypen?Redirect=Log&logNo=221088491538,"방이역에 있는서두산 딤섬 만두입니다. 언제 갔었지??? 가물가물 했는데 생각해보니 인근 언니네서... 복주머니 딤섬, 8개중에 육즙 사수한건 2개 되려나. 만두피가 얇은지 너무 잘 찢어지더라구요. 차라리... ",어질賢 아름다울美,https://blog.naver.com/honeypen,2017-10-18
겉바삭 속촉촉 진리의 군만두집 잠실서두산 딤섬 ,https://blog.naver.com/pinkmint86?Redirect=Log&logNo=221611575466,9시겸 저녁을 먹어야 해서 이 늦은 시간 뭐먹을까 엄청 고민하다 찾아낸서두산 딤섬이비쥬얼을 보고... 새우군만두 딤섬 매운조개볶음 주문 기본으로 주는 짜사이와 단무지 짜사이 상큼 짭조룸해서 만두 나오기... ,Ｌｏｖｅ & Ｐｅａｃｅ,https://blog.naver.com/pinkmint86,2019-08-10
송파 맛집 추천 ㅡ 서두산 딤섬만두♡,https://blog.naver.com/51jm?Redirect=Log&logNo=221490197333,#송파나루역맛집 # 서두산딤섬 만두 다녀왔어요~♡ 추억의 #홍콩딤섬만두♡ 메뉴 보면서 고민하다가 새우군만두 훈툰 샤오롱빠오 새우딤섬 마파두부덮밥 시켰답니다~♡ 단무지 맛났어요~♡ 위는 식초간장... ,항상 건강하고 행복하길~♡,https://blog.naver.com/51jm,2019-03-17
[방이동]서두산딤섬/ 만두맛집,https://blog.naver.com/yumyumpanda?Redirect=Log&logNo=221392755409,"방이동서두산딤섬[2018년 10월 기준] 내 기준에서 맛있는 만두집 중 하나는 이태원 ㅈㄴ덤플링인데, 멀기도 하고, 늘 줄서야 해서 가기 쉽지 않은 곳 가격대가 있고 다양한 종류가 많은 딤섬 전문점 보다는... ","음식은 손으로, 사진은 발로...",https://blog.naver.com/yumyumpanda,2018-11-07
"잠실 ::서두산딤섬 , 할머니포장마차멸치국수",https://blog.naver.com/sidsid4444?Redirect=Log&logNo=221417690176,요즘 나의 최애맛집 #잠실맛집 #방이동맛집 # 서두산딤섬#새우군만두 얼마전에 포스팅 올렸는데 그... 역시서두산딤섬 의 베스트는 새우군만두 다른건 담부터 패스 ㅋㅋㅋㅋㅋㅋ서두산 딤섬02-425-4588... ,Smile ChaCha,https://blog.naver.com/sidsid4444,2018-12-12
방이동서두산 딤섬 - 수제 홍콩식 딤섬으로 유명한 집,https://blog.naver.com/sagak815?Redirect=Log&logNo=221454326979,"외부 모습 방이동 # 서두산딤섬수제 홍콩 딤섬을 표방하는 집인데 몇 년 간 이 자리에서 꾸준하게 영업을 하고 있는 것으로 알고 있다. 메뉴 및 가격 야끼만두, 샤오롱빠오, 새우딤섬 각각 1인분씩 포장을 했다.... ",사각사마는 뭘 먹고 사나,https://blog.naver.com/sagak815,2019-05-04
[방이동 맛집]서두산 딤섬만두 : 방이동 만두 전문 중국집,https://blog.naver.com/yjoshjh?Redirect=Log&logNo=220713055491,"방이동 먹자골목, 방이삼거리 부근 골목안에 위치한 만두 전문 중국집서두산 딤섬만두 인근 한우... 실제로 이집 사장님이 쟈니덤플링 의 스승 이라는 말이 있더군요 http://yjoshjh.blog.me/220589143276 딤섬... ",참이술의 Eat & Drink,https://blog.naver.com/yjoshjh,2016-05-18
[ 방이동맛집 ]서두산 에서 샤오롱바오와딤섬 을~✌,https://blog.naver.com/chiot_aile?Redirect=Log&logNo=221401642929,"딤섬이 생각난다면 잠실 방이동의 서두산으로! (사실, 사진 촬영할 생각이 전혀 없었어서.... 사진이 몇 장 없는 건 안 비밀.....)서두산 딤섬 만두에서는 샤오롱바오와 새우딤섬 외에도 다양한 중국식 만두를... ","찰나의 순간, 02pic :)",https://blog.naver.com/chiot_aile,2018-11-20
"[방이동서두산딤섬 ]-홍콩못가도 여기서 딤섬먹어요,굿굿",https://blog.naver.com/brandy923?Redirect=Log&logNo=221430050101,바로 서두산 주차는 불가 방이시장입구에서 가깝습니다 얼집보내고 엄마아빠만 딤섬먹으러가서... 방이동에서두산딤섬아주 맛있게먹었어요 딤섬이 생각날때마다 방문예정입니다 아주맛있게 먹고왔어요... ,Brandy's Story,https://blog.naver.com/brandy923,2018-12-29
방이동 만두 맛집서두산 딤섬 ,https://blog.naver.com/99551414?Redirect=Log&logNo=221381100050,전 새우군만두 - 딤섬 - 훈툰 - 야채군만두 - 샤오롱빠오 순으로 처음이 젤 맛있다는뜻이요 히힛 지극히 개인적인 입맛으로 리뷰를 한것입니다 ^^ 암튼 그래도 열심히 즐겼던 방이동 만두 맛집서두산 딤섬가서... ,Alice in Wonderland,https://blog.naver.com/99551414,2018-10-19
[송파나루역/방이동]서두산딤섬: 새우군만두 + 샤오롱빠오,https://blog.naver.com/hellojin23?Redirect=Log&logNo=221513656449,"누가봐도 여기는 딤섬집이구나 알수있는 간판 ㅋㅋㅋ 뭔가 맛집 포스가 느껴지는 곳이였다.서두산딤섬메뉴판 군만두,물만두, 샤오롱빠오도 있고 다른 요리메뉴도있다. 우리는 새우군만두랑 샤오롱빠오... ",수니의 별난블로그,https://blog.naver.com/hellojin23,2019-04-15
[잠실 딤섬]서두산딤섬존맛탱 :D,https://blog.naver.com/bsun21?Redirect=Log&logNo=221107347945,#잠실딤섬 #잠실 서두산딤섬회사근처 맛집!서두산딤섬잠실 사람들 사이에서 유명한 딤섬맛집이당 #잠실딤섬메뉴 예전에 먹어보고 마싯어서 오랜만에 와봄 점심은 11:30부터 시작한다고 하니 참고하세요 저희는... ,밍고망고의 망고하우스,https://blog.naver.com/bsun21,2017-09-28
방이먹자골목맛집서두산 딤섬 전문점헝그리홀스 칵테일,https://blog.naver.com/kkm466?Redirect=Log&logNo=220986675760,아는 언니가 먹어보고 추천해줘서 다녀온서두산!딤섬 이 그렇게 맛있다고합니다ㅋㅋㅋㅋ 맨날 지나가던 곳인데 이런곳이 있는줄 처음알았구요 줄도 엄청 길어요 ㅋㅋㅋㅋㅋ 시간 잘 못맞추면 대기 진짜... ,제멋대로인 알렉시,https://blog.naver.com/kkm466,2017-04-19
방이동서두산 딤섬다녀온 후기,https://blog.naver.com/dogstra?Redirect=Log&logNo=221205375353,방이동서두산 딤섬다녀왔습니다.^^ 방이동 먹자골목 내 위치해 있구요. 밤 12시까지 영업합니다. 전화번호 : 02-425-4588 밤 12시에 방문하였는데도 1-2테이블 제외하고 손님들로 가득이네요.ㅋㅋ 서두산 수제... ,미스터멀티,https://blog.naver.com/dogstra,2018-02-10
"먹방 (언주집, 차알,서두산딤섬 , 레어마카롱, 삼맛호오떡)",https://blog.naver.com/sidsid4444?Redirect=Log&logNo=221400638739, 서두산딤섬02-425-4588 서울 송파구 올림픽로32길 52 11:30 - 24:00서두산딤섬 에서 딤섬을 맛있게 먹었다면 그 다음 갈 곳은? 너무너무 핫한 #송리단길 송리단길은 어쩐지 안가게되서 전에 #라라브레드... ,Smile ChaCha,https://blog.naver.com/sidsid4444,2018-11-17
방이동 수제홍콩딤섬전문 만두맛집~서두산 딤섬 만두,https://blog.naver.com/sooa38?Redirect=Log&logNo=221364633293, 서두산 딤섬 만두 수제홍콩딤섬전문 얼마전부터... 딤섬 먹고싶어서 딘타이펑 가자~~ 하고있었는데.... 방이동에 맛난 만두 집이 있다고 바로 고고 했습니다~^^서두산 딤섬 ~ 원래 여러명이서 가기로 했었는데.... ,끼부리는 go냥이.. 지구별에서 살아가는 법!!,https://blog.naver.com/sooa38,2018-09-23
" 서두산딤섬 , 방이먹자골목 숨겨진 맛집!",https://blog.naver.com/medimer?Redirect=Log&logNo=220959883531, 서두산딤섬 : 딤섬 갓 찐 딤섬인데 내용도 실하고 맛있었어요 중국에 가보진 않았지만 뭔가 중국 현지의 맛 강추!서두산딤섬 : 새우 군만두 모양이 특이하죠. 간장에 살짝 찍어먹거 보았는데 역시 맛있어요.... ,비교할 수 없는 선택 메디스캔,https://blog.naver.com/medimer,2017-03-16
"방이동 맛집 봉피양 평양냉면 먹고,서두산 딤섬 에서 2차!!!",https://blog.naver.com/niedlichej?Redirect=Log&logNo=221383232282,왜냐면 우리는 2차를 또 가야하거든요 ㅎㅎㅎ 2차는 딤섬이 진짜... 넘나 맛있는서두산 딤섬가게로 왔어요 제가 최근에 여기 맛보고선 여기 딤섬이 잊혀지지가 않았어요 ㅠㅠㅠㅠ 가게도 작고 다들 잘... ,감성 IT 리뷰어 꽃길유치원생,https://blog.naver.com/niedlichej,2018-10-23
방이동 먹자골목 맛집 -서두산 딤섬(DimSum) 만두,https://blog.naver.com/nahe0904?Redirect=Log&logNo=220662613378,어려웠어요 딤섬 전문점인데 요런 코스 메뉴도 있더라구요서두산 딤섬 만두 가게는 작은 편이에요 주방도 바로 가까이 있는데 직원은 저렇게 두분뿐이더라구요 서로 현란한 중국어로 얘기하시는걸보니... ,나혜의 여행노트,https://blog.naver.com/nahe0904,2016-03-23
방이서두산 딤섬 ,https://blog.naver.com/imha_rang?Redirect=Log&logNo=220812273940,인생만두를 만난듯한 느낌을 받았던 방이서두산 딤섬 . 벌써 네번째 방문이다 ㅋㅋ 주차가 늘... 완전 좁은공간으로 보이던데) 1주전 비오는 평일점심에 방이서두산 딤섬 으로 친구들과 출동. 그날은... ,momentlogue,https://blog.naver.com/imha_rang,2016-09-14
0708 잠실/방이동 중국만두/딤섬 맛집서두산 딤섬 만두,https://blog.naver.com/p_radn?Redirect=Log&logNo=221316532661,"잠실역에서 좀 떨어진, 방이동 먹자골목에 있는 조그만 만두가게 ' 서두산딤섬 만두'. 미리 알았더라면... ▲두 번째 접시, 복주머니딤섬 소롱포와 거의 동시에 나온 것은 복주머니딤섬(9,000원)이었다. 재료가 좀 더... ",곰비임비 누리담기,https://blog.naver.com/p_radn,2018-07-12
올림픽공원맛집서두산딤섬'진짜 수제 샤오롱빠오와 마파두부',https://blog.naver.com/hihyojung121?Redirect=Log&logNo=221305126336,# 서두산딤섬#송파딤섬 #올림픽공원딤섬 #딤섬맛집 #샤오롱빠오 #마파두부 #수제샤오롱빠오 #송파맛집 딤섬딤섬을 먹어보자꾸나 송파 올림픽공원에 있는 수제홍콩딤섬 전문점!서두산 딤섬 ~ 찾는데 몬가 눈에... ,초록나무 옆 자리,https://blog.naver.com/hihyojung121,2018-06-23
"20180601 리엄이생일파티(?) , 방이동서두산딤섬 (왕추천)",https://blog.naver.com/jangyjyp?Redirect=Log&logNo=221290277423,"20180601 리엄이 생일파티(?) 방이동 딤섬맛집,서두산 5월 31일 리엄이 생일을 맞아 하루 늦게 가족들과... 방이동에 딤섬맛집이 있다하여 찾아갔다. 이름은서두산딤섬메뉴 주 메뉴는 만두이고, 그외... ",JessicaLog,https://blog.naver.com/jangyjyp,2018-06-03
방이동/잠실서두산 딤섬 집 수제홍콩딤섬전문점 강추!,https://blog.naver.com/lykbass?Redirect=Log&logNo=220887307277,만두를 콕콕찔러 찢어주면 안에 육즙이 쏘옥` 베어나와요~ 그안에 생강을 송송박아준 다음 한입에 쏘옥~ 캬~!! 정말 대박맛있어요~ 잠실 수제홍콩딤섬전문점!서두산딤섬! 완전 강추강추!!,스페이스&갤럭시☆,https://blog.naver.com/lykbass,2016-12-16
[방이동 먹자골목 맛집 :서두산 딤섬만두],https://blog.naver.com/sinaetic?Redirect=Log&logNo=220856678439,얼마전 아빠와 동생의 제보로 알게 된 방이동 먹자골목에 위치한 딤섬집 ' 서두산 딤섬만두' 들리는 소문에 의하면 이태원 '쟈니덤플링'의 스승님이라는 소문이.. 그래서 사장님께 조심스레 '쟈니덤플링'하고... ,SiNAETiC,https://blog.naver.com/sinaetic,2016-11-10
 서두산 딤섬2호점,https://blog.naver.com/sally3709?Redirect=Log&logNo=222380767007, 서두산딤섬음식이 늦게 나오거나 너무 빨리 나오거나 의식의 흐름대로 나오는 경향이 있으나 맛있음... 새우 딤섬 둘째가 다 먹었음 마라탕 맛 탄탄면은 합격 목걸이를 주기 싫더라 크흐 육즙 또 줄줄 흘리며... ,no whr now here.,https://blog.naver.com/sally3709,2021-06-02
"【 서울 / 송파구 】잠실 근처의 괜찮은 만둣집,서두산 딤섬 ",https://blog.naver.com/hojubwings?Redirect=Log&logNo=221107082093,"8월에 있었던 만두 언니와의 회동, 한동안 매우 관심있게 봐둔서두산 딤섬 에 가기로 했다. +_+ 서두산... 수제 + 홍콩 + 딤섬 + 전문점 이 네 단어의 조화가 넘나 아름답다. ㅋㅋㅋㅋㅋ 기본으로 나오는 찬은 평범... ",Little Miss Sunshine,https://blog.naver.com/hojubwings,2017-09-29
광화문 마라탕 탕화쿵푸 + 방이동서두산딤섬 만두,https://blog.naver.com/mnschola?Redirect=Log&logNo=220870106770,# 서두산딤섬 만두 그리고 여기는 방이동. 서두산 DimSum 이태원의 쟈니덤플링과 관계있는 곳이라니 믿을 수 있쉉서두산딤섬메뉴 세트메뉴 같은 코스 요리도 있고 배달 전화도 되더라고요- 새우군만두!!!!... ,"주로 돌아다니는, 인상 깊은 취미생활",https://blog.naver.com/mnschola,2016-11-24
방이동 맛집 # 서두산 딤섬- 수제홍콩딤섬 만두 전문점... ,https://blog.naver.com/savoring329?Redirect=Log&logNo=221188126547,"맛집 ' 서두산 딤섬 ' 수제 홍콩딤섬전문점, 직접 딤섬을 만드는 곳인가봐요 홍콩 여행 갔을 때 1일 1딤섬으로 맛있게 먹었던 기억이 있는데 만두와는 다른 딤섬의 매력! 홍콩식, 중국식 딤섬 차이는 모르겠지만... ",‘평온’한 하루,https://blog.naver.com/savoring329,2018-01-18
+서두산 딤섬 (방이동)_훈툰/샤오롱빠오/새우딤섬... ,https://blog.naver.com/rusi_hi?Redirect=Log&logNo=221022784136,":D 오늘은 얼마전 방문한, 수제홍콩딤섬전문점서두산 딤섬 에 대한 포스팅입니다. 우연히 알게 된서두산 딤섬 . 산둥 출신 현지분들이 직접 만들어 맛좋은 딤섬을 싸게 푸짐하게 먹을 수 있는 곳이 있다기에... ",토끼군의 당근양,https://blog.naver.com/rusi_hi,2017-06-06
방이먹자골목맛집서두산딤섬 만두 2호점,https://blog.naver.com/dua010?Redirect=Log&logNo=222470357271,잘먹었습니당 ❤️ #방이먹자골목맛집 #잠실맛집 #방이먹자골목딤섬맛집 #잠실딤섬맛집 #방이먹자골목샤오롱바오맛집 #잠실샤오롱바오맛집 #서울딤섬맛집 #서울샤오롱바오맛집 # 서두산딤섬 ... ,유나의 두둠칫 일상,https://blog.naver.com/dua010,2021-08-14
잠실서두산 딤섬2호점,https://blog.naver.com/ddogani?Redirect=Log&logNo=222066721118,새우군만두 훈툰 샤오롱바오 에메랄드 딤섬마파덮밥 3명이서 먹었는데 딱 맞았던거 같아요ㅋ 기다리며... 원래 홍합탕은 주로 술과 먹으니 당연한거 같아요 마지막으로 나온 에메랄드 딤섬 . 부추향 퍼지면서... ,이젠 준비 할 때!,https://blog.naver.com/ddogani,2020-08-21
"방이 먹자골목 맛집,서두산 딤섬만두.",https://blog.naver.com/oupru7?Redirect=Log&logNo=222299661359,굉장히 궁금했던서두산 딤섬만두를 드디어 가게되었어요! 왕리다님 집 근처에만 있는줄 알았는데... 서두산 만두도 여느 중국집 처럼 삼종세트가 나왔어요 저희는 훈툰하고 군만두하고 새우딤섬 시켰어용... ,박숑이의 오글오글 여행 + 요리 블로그,https://blog.naver.com/oupru7,2021-04-07
잠실역 롯데월드 딤섬' 서두산딤섬2호점',https://blog.naver.com/hahahaa2?Redirect=Log&logNo=222437055998,"넓었음서두산딤섬 만두의 메뉴 배가 고프지 않아서 저는 둘이 가서 새우딤섬 9,000원 탄탄면 9,000원 이렇게 주문했습니다:) 맥주도 주문했는데 까먹으셨는지 안주셔서 그냥 안 먹음ㅎㅎ 기본반찬은 단무지... ",세굴이가 굴러가는 이야기,https://blog.naver.com/hahahaa2,2021-07-19
