title,link,description,bloggername,bloggerlink,postdate
2001_'잠실 방이먹자골목' 맛집 [ 서두산 딤섬 ],https://blog.naver.com/queenyje?Redirect=Log&logNo=221778694546," 서두산 딤섬영업시간: 매일 11:30 - 24:00 저녁시간에 방문했구요 외관은 이렇게 생겼습니당 사실... 사랑합니다 서두산,, 2호점이 벌써 생겼는데 100호점이 생겨도 맛은 이대로 영원히 약속,, 이만 주책맞은 마음... ",램프의 요정,https://blog.naver.com/queenyje,2020-01-20
"생활의 달인 그리고 수요미식회 만두 맛집, 방이동의서두산 딤섬 ",https://blog.naver.com/ddabunhe77?Redirect=Log&logNo=221936421520,아쉽네.. ㅎㅎㅎ서두산 딤섬매일 오전 11:30부터 밤 12시까지 # 서두산딤섬#딤섬맛집 #만두맛집 #중국식만두 #송리단길맛집 #방이동맛집 #생활의달인딤섬 #딤섬달인 #은둔식달딤섬,만능천재소녀,https://blog.naver.com/ddabunhe77,2020-04-29
잠실맛집 수요미식회서두산딤섬 ,https://blog.naver.com/yessesyo?Redirect=Log&logNo=222448231978,네 바로 여기에요 1호점 부터 3호점 까지 있는데 저흰 2호점을 방문했어요 2호점 딤섬맛집서두산딤섬 은 2층에 있어요 (라임 보소 뿌듯뿌듯) 올라오시느라 수고하셨습니다 이제 맛있는 딤섬 먹으러 가볼가요?... ,커피를 볶고 내리는 힙지로 로스터리요정,https://blog.naver.com/yessesyo,2021-07-28
"홍대딤섬서두산 , 대체적으로 다 만족스런 식사였다",https://blog.naver.com/secretsm22?Redirect=Log&logNo=222146059430, 딤섬 을 꼭 먹어야했기에 에라 모르겠다 홍대딤섬서두산 에 들어가려고 보니 입구에 수요미식회에 나왔다고?? 아무래도 체인점인 거 같았다. 일단 브레이크타임이 없어서 바로 착석할 수 있었다. 근데 손님이... ,신뚱이야기,https://blog.naver.com/secretsm22,2020-11-16
[방이동 맛집]서두산딤섬- 로컬 느낌 물씬 빙화만두수정딤섬,https://blog.naver.com/sielle83?Redirect=Log&logNo=221836943280," 서두산딤섬/ 송파구 올림픽로32길 18-23 (방이동 63)전화번호 02-422-4588영업시간 11:30-24:00 휴무 없음 계속... 새우딤섬 (9,000원/6개) 역시 새우와 고기의 혼합~ 순새우수정딤섬 (10,000원/4개) 중국이나 홍콩에서 먹던... ",여의도 직장인 문썬의 밥상 (舊 을지로),https://blog.naver.com/sielle83,2020-03-06
[방이동]서두산 딤섬/ 생활의 달인 중국식 만두,https://blog.naver.com/yumyumpanda?Redirect=Log&logNo=222534257486,"딤섬 위주로 먹고 싶다면,서두산 딤섬 보다는 체인 딤섬을 추천함 이유는 가격대도 사실 비슷하고, 딤섬 종류는 훨씬 더 많고, 서비스도 좋기에 딤섬을 위주로 5~7종류씩 먹는 나에게는 메뉴가 제한적이라... ","음식은 손으로, 사진은 발로...",https://blog.naver.com/yumyumpanda,2021-10-12
송파 맛집서두산딤섬- 생활의 달인 중국 만두 딤섬 달인... ,https://blog.naver.com/zephyr122059?Redirect=Log&logNo=221920830260,"생활의달인 중국 만두 딤섬 달인 송파 맛집서두산딤섬 . 가까운 곳에 본점이 있는데 촬영을 작년 8월... 최근 다녀온 니하오도 소롱포 육즙이 훌륭했는데 서두산 육즙은 반 수쯤 위라는 개인적인 생각, 요즘... ",사랑이 밥먹여준다,https://blog.naver.com/zephyr122059,2020-04-21
잠실역 석촌호수 수요미식회서두산 딤섬만두 2호점... ,https://blog.naver.com/vemana?Redirect=Log&logNo=222115511748,"#잠실딤섬맛집 #잠실맛집추천 #수요미식회딤섬 #중화요리맛집 #석촌호수데이트맛집 # 서두산딤섬# 서두산딤섬 2호점 예약하고 가지 않아도 웨이팅 걱정 안 할 정도로 넓어서 단체로 가기에도, 회식 장소로도... ",INTP의 랜선 공간,https://blog.naver.com/vemana,2020-10-14
방이동서두산 딤섬2호점,https://blog.naver.com/lego8099?Redirect=Log&logNo=222509710739, 서두산 딤섬2호점서두산 딤섬2호점 간만의 사진털이. 한동안 너무 자주가서 부끄러워 포스팅을... 딤섬중 원픽은 부채교. 다른 고급 딤섬집의 1.5배는 될듯. 사이즈도 크고 존재감 뿜뿜. 무언가 닭튀김도... ,먹고 마시고 공부하고 놀기,https://blog.naver.com/lego8099,2021-09-18
방이동맛집서두산딤섬 ,https://blog.naver.com/looloo85mom?Redirect=Log&logNo=222515317899,육즙 터지는 딤섬 맛집 방이동맛집서두산딤섬 2호점 ♥ 내돈 내산 후기 입니다 :D ♥ #서두산 #서두산본점 에서 주말 한낮 정말 인상깊이 맛있게 먹은 기억이 있어서인지 따사로운 주말한낮이면 종종 생각나는... ,:D,https://blog.naver.com/looloo85mom,2021-09-24
"수요미식회 만두편, 송파서두산딤섬 , 수정딤섬 맛집, 김포... ",https://blog.naver.com/tmishaha?Redirect=Log&logNo=221672200598,"#수요미식회223회, #수요미식회만두, #수요미식회딤섬, #수요미식회 서두산딤섬 , # 서두산딤섬 , #수요미식회샤오롱바오, #방이동딤섬맛집, #김포만두전골맛집, #김포만두절골, #김포락원이북만두, #수정만두맛집... ",Amazing BLOG,https://blog.naver.com/tmishaha,2019-10-08
맛과 멋이 있는 공간[ 서두산 딤섬 만두](본점),https://blog.naver.com/love_naeil?Redirect=Log&logNo=221987043407,많은 사람들이 찾는 딤섬 역시서두산 딤섬 만두만의 맛을 가지고 있다. 복주머니딤섬과 새우딤섬 두 가지가 있는데 새우딤섬은 새우가 통째로 씹힌다. “새우딤섬은 정말 새우가 탱글탱글하게 입안에서... ,송파강동 내일신문,https://blog.naver.com/love_naeil,2020-06-02
"홍콩식 수제 딤섬을 접할 수 있는 송파 맛집,서두산 딤섬 ",https://blog.naver.com/shapres?Redirect=Log&logNo=221999750326,"홍콩이나 대만 여행 이후, 딤섬은 먹고 싶은데 딘타이펑이나 몽중헌 같은 레스토랑은 부담스럽고 그렇다고 맛의 퀄리티는 포기할 수 없을 때 찾아갈 수 있는 곳. 송파구 방이동에 위치한 ' 서두산 딤섬 '집이다.... ",의학살롱,https://blog.naver.com/shapres,2020-06-13
잠실 방이동 맛집 : 생활의 달인 만두집서두산 딤섬 ,https://blog.naver.com/gyfla1994?Redirect=Log&logNo=221925938011,"방이동 딤섬 맛집 서두산 생활의달인, 수요미식회 맛집 평소 평일 점심의 반을 해결하는 장소, 방이동... 딤섬 맛집 “ 서두산 딤섬2호점” 으로 향했다 :) 여기가 수요미식회에도 나오고, 바로 엊그제에는... ",스물여덟의 기록,https://blog.naver.com/gyfla1994,2020-04-24
" 서두산 딤섬2호점, 너무 맛있어~~ ^^",https://blog.naver.com/ddabunhe77?Redirect=Log&logNo=222069870804,"서울의 만두 맛집, 수요미식회와 생활의 달인 맛집으로 유명한서두산 딤섬 은 딤섬 좀 먹어봤다는 사람들 사이에서는 이미 많이 알려졌을 터. 주차가 불편하고 위치도 애매하지만 내가 가는 세차장 근처에 있어... ",만능천재소녀,https://blog.naver.com/ddabunhe77,2020-08-25
[방이동 술집] 방이동 맛집 추천서두산딤섬1호점 만두... ,https://blog.naver.com/soulfree90?Redirect=Log&logNo=221972379964,#만두 #딤섬 저는 방이동서두산딤섬1호점엘 갔습니다. 여긴 송파나루역이랑 더 가까워요. 방이동 먹자골목이랑은 거리가 좀 있는 편. # 서두산딤섬 1호점 2호점은 1호점보다 훨씬 넓다는데 잠실역 8호선 부근에... ,부기온앤온,https://blog.naver.com/soulfree90,2020-05-21
홍대 딤섬 맛집서두산 딤섬만두 / (홍복원 폐점)... ,https://blog.naver.com/skaehd58?Redirect=Log&logNo=222145238333, 서두산 딤섬만두 서실 나는 딤섬이 뭔지 몰랐고 만두겠거니 하며 그냥 갔다. 그리고 여기서 5개를 시켰다. 차례대로 1. 탄탄면 2. 마파두부덮밥 3. 샤오룽빠오 4. 순새우딤섬 5. 루비딤섬 입구에 수요미식회에... ,Life Jacket Blog,https://blog.naver.com/skaehd58,2020-11-16
방이동/ 서두산 딤섬 ,https://blog.naver.com/for40?Redirect=Log&logNo=221647949525,' 서두산 딤섬 ' 서두산은 충칭 지방의 아주 작은 마을 이름이라고 하는군요. 메뉴를 보기 좋게 정리해... 복주머니 딤섬이 나왔어요. 살짝 매운맛도 있어요. 오늘의 Worst! 야끼만두입니다. 만두 중 제 입에는 오늘의... ,천천히 걷자~ 그림자가 따라와야 한다.,https://blog.naver.com/for40,2019-10-23
수요미식회 - ' 서두산 딤섬만두' 솔직후기,https://blog.naver.com/4_trillionaires?Redirect=Log&logNo=222439709105,"(누가봐도 식사하러 온거 티냄.) 중국음식을 평소 즐겨먹지 않는 1인으로써 방문했던서두산 은 꽤 만족스러웠음. 일반 중국음식점에서 접하기 힘든딤섬 들이 그 맛까지 상평타를 치니, 코로나 시국이 아니라고... ",네명의 청춘기록,https://blog.naver.com/4_trillionaires,2021-07-21
"[2021.04] 송파 딤섬 맛집 -서두산딤섬 만두, 파주 출판단지 산책",https://blog.naver.com/park890507?Redirect=Log&logNo=222427591927,#송파딤섬맛집 #딤섬맛집 # 서두산딤섬# 서두산딤섬 만두 #송파딤섬 #잠실딤섬 # 서두산딤섬 2호점 오빠 지인분 결혼식 참석했는데 연회장 입장 인원수 100명 제한으로 인해 답례품만 받게 되어서 집으로 오는... ,Starry night:),https://blog.naver.com/park890507,2021-07-11
"잠실, 방이동 맛집 :서두산 딤섬 만두 1호점",https://blog.naver.com/squidance?Redirect=Log&logNo=222407803332, 서두산딤섬 만두에서 가장 인기 있는 메뉴라는 샤오롱빠오. 피가 도톰한 편. 맛있었다. 그리고 군만두 ㅋㅋㅋ독특한 비주얼. 개인적으로는 딤섬보다 요걸 더 맛있게 먹었다. 밑면만 구워져 나오는 거였다. 한... ,16 33,https://blog.naver.com/squidance,2021-06-24
만두의 행복 - 송파구 방이동서두산 딤섬후기,https://blog.naver.com/sk5816?Redirect=Log&logNo=221711776565,만두라고는 고향만두 아니면 비비고 만두가 최고라고 생각했던 시절에 중국의 딤섬을 알게 된 첫 번째 집이자 벌써 당골이 된 가게. 바로 방이동의서두산 딤섬 이다. 사장님이 2호점을 차리기 전부터 갔으니... ,기억을 위한 기록,https://blog.naver.com/sk5816,2019-11-19
[송파] 석촌호수 군만두 맛집 -서두산 딤섬 ,https://blog.naver.com/amy__today?Redirect=Log&logNo=222357313920, 서두산 딤섬송파 소룡포 딤섬 맛집 :) 안녕하세요 여러부운 만두에 진심인 보리입니당 특히나 #소룡포 를 너무너무 좋아해요 요즘 쉬는 날만 되면 서울 시내 만두 맛집 찾아다니고 있어요... ,Buy Well ❤️,https://blog.naver.com/amy__today,2021-05-19
잠실 방이동서두산 딤섬샤오롱빠오볶음밥,https://blog.naver.com/pumpkinpant?Redirect=Log&logNo=221662780396,그래선지 저는 만두만 보면 남편의 힘들었던 취업 시기가 떠오르고....ㅎㅎㅎ 잠실 방이동 쪽에 수제 홍콩 딤섬 전문점이 있다고 해서 가 봤어요. 식당 이름은서두산 딤섬 . 서두산 메뉴판과 영업시간 다른... ,펌킨팬츠,https://blog.naver.com/pumpkinpant,2019-09-29
[서울맛집][잠실맛집]서두산 딤섬 ,https://blog.naver.com/pureperfume0?Redirect=Log&logNo=222457687856,"잠실서두산딤섬대표 메뉴 : 군만두, 딤섬 미니곰의 맛집 평점 : ★★★★ 4개를 준 이유는 가격과 양 때문이었어요 (사실 저희 커플 입맛에는 맛도 팀호완이 더 맛있었어요) 대표메뉴인 군만두는 나중에 사진... ","미니곰의 eat, play, love",https://blog.naver.com/pureperfume0,2021-08-05
송파구 방이동 수제홍콩딤섬전문점서두산 딤섬1호점,https://blog.naver.com/uwilmsme?Redirect=Log&logNo=221811133240, 서두산 딤섬 은 송파구 방이동 먹자골목에 위치한 맛집?입니다.서두산 딤섬1호점이 성업함에 따라... 와중에 서두산이 홍콩딤섬전문집이라는 말에 반가와서 들러보았어요. 그런데 역시 홍콩 딤섬집 맛을... ,Gromit's world,https://blog.naver.com/uwilmsme,2020-02-16
[내돈내산]서두산딤섬 만두 본점 군만두 야끼만두 포장 후기,https://blog.naver.com/friday7183?Redirect=Log&logNo=222528428289,"~ 제가 알기론 이태원 유명 만두가게인 쟈니덤플링과 연관이 있다고 하더라구요ㅎㅎㅎ 두 곳다 딤섬 맛집인거 정말 인정합니다!~서두산딤섬 만두에는 군만두(8,000원) 뿐만아니라 딤섬, 샤오롱바오(9,000원)... ",좐스피릿,https://blog.naver.com/friday7183,2021-10-06
서울서두산 딤섬 만두,https://blog.naver.com/ysboll?Redirect=Log&logNo=222081367938,곳에서 딤섬을 먹어보지만 이게 참 어려운 음식인지 맛있는 집을 못 찾겠다.. 작년에 홍콩에서 먹었을 때도 그냥.....그랬고. 송파쪽으로 건강검진 갔다가 점심으로 찾아 간서두산 딤섬만두매장 느낌이 홍콩에... ,낚시와 시간 여행,https://blog.naver.com/ysboll,2020-09-05
[방이동]서두산딤섬2호점,https://blog.naver.com/yuminaki?Redirect=Log&logNo=222137584179,캐주얼한 분위기라 딤섬 땡기면 부담없이 갈 수 있을것 같네요 *서두산딤섬2호점 * 02-422-4588 서울 송파구 올림픽로32길 18-23 (방이동 63) 11AM~11:30PM 연중무휴 주차 X (근처 유료주차장 이용하셔야해요),유미나키/YUMINAKI♥♥,https://blog.naver.com/yuminaki,2020-11-06
방이동/ 서두산 딤섬 ,https://blog.naver.com/for40?Redirect=Log&logNo=221667925870,' 서두산 딤섬 ' 2호점입니다. 주차하느라 진이 빠져 대문 사진 찍는 것도 잊었고요. 2층으로 올라가야 합니다. 손님이 없는데 건물 주변에는 차량들로 꽉 차있어요. 모두 어디에 온 차량들이었나? 본점과 달리 꽤... ,천천히 걷자~ 그림자가 따라와야 한다.,https://blog.naver.com/for40,2019-11-26
"샤오롱바오, 군만두 맛집!!서두산 딤섬2호점(잠실역 도보5분)",https://blog.naver.com/psoy1998?Redirect=Log&logNo=222070497491,다녀왔어요~서두산 딤섬만두! 수요미식회에도 나왔다 하더라고요 근데 여기는 2호점이에요~ 잠실역... 다른 딤섬도 먹어보고 싶어요~ 만족스러운 만두였습니다^0^ 다음에 친구 데리고 가서 다른 메뉴도 이것저것... ,정시퇴근 꿀휴식~^-^,https://blog.naver.com/psoy1998,2020-08-25
방이먹자골목맛집 - 여기 만두 진짜 찐만두.. ' 서두산딤섬2호점',https://blog.naver.com/holl7777?Redirect=Log&logNo=222071646203," 서두산딤섬 은 다양한 딤섬들이 정말 많아요 실제로 홍콩에서도 딤섬을 먹어봤는데, 홍콩에서 먹은것처럼 진짜 맛있더라구요ㅠ.ㅠ 여기 진짜 만두 찐맛집 인정! 이미서두산딤섬 은 서울만두맛집, 수요미식회와... ",비비다이어리♬,https://blog.naver.com/holl7777,2020-08-26
"잠실 방이동 맛집서두산 딤섬본점(수제 딤섬, 샤오롱바오... ",https://blog.naver.com/amysecret?Redirect=Log&logNo=221683509446," 서두산 딤섬본점 메뉴, 가격 자리에 앉아서 메뉴를 보기 시작서두산 딤섬 에서 직접 찍은 사진들 같다. 사진과 거의 똑같이 나온다. 수제홍콩딤섬 전문점이라 만두 위주의 메뉴 나는 새우 군만두, 샤오롱빠오... ",망구봉다리의 모험,https://blog.naver.com/amysecret,2019-10-20
송파 중국만두집서두산딤섬 ,https://blog.naver.com/tabula9548?Redirect=Log&logNo=222033312768,소룡포보다는 야키교자 빙화만두 야끼교자 딤섬 만두집서두산딤섬수요미식회에 방영되어 유명한 곳 중국 본토의 뉘앙스가 있다 이 중국 맥주는 아직 못 마셨다 중산층 지역인 송파 기준으로는 비교적... ,식당밥일기,https://blog.naver.com/tabula9548,2020-07-17
[방이동맛집] 탄탄면 딤섬 맛있는 곳/ 서두산딤섬 /내돈내산,https://blog.naver.com/looksss5696?Redirect=Log&logNo=222504323188," 서두산딤섬 , 딤섬맛있는 곳 전화 02-425-4588 주소 서울 송파구 올림픽로32길 52상세주소 열기/닫기 영업시간 매일 11:30 - 24:00서두산딤섬1호점과 2호점이 있는데 면요리 드실것이면 1호점 가셔야 합니다. 저는... ",LORYS,https://blog.naver.com/looksss5696,2021-09-13
[송파나루맛집] 방이동먹자골목 근처서두산딤섬 ,https://blog.naver.com/aqquu?Redirect=Log&logNo=222519754976,방이동먹자골목 근처나 송파나루역 맛집을 찾으신다면 추천하는 딤섬집서두산딤섬 !! 또 먹고 싶습니다ㅠㅠ서두산 딤섬주소 : 서울 송파구 올림픽로32길 52 전화번호 : 02-425-4588 영업시간 : 매일 11:30 ~ 24:00,소소한 일상의 즐거움,https://blog.naver.com/aqquu,2021-09-28
새우로 꽉 찬 에메랄드 딤섬 정말 맛있었어요.서두산 딤섬2호점,https://blog.naver.com/sennichini?Redirect=Log&logNo=222538368103,잠실 방이동 맛집 수제 딤섬 만두 탱글탱글한 새우로 꽉찬 에메랄드 딤섬 정말 맛있었어요.서두산 딤섬2호점 먼저 마파두부덮밥이 나왔어요. 맛은 씹으면 씹을수록 고소함이 입안 가득 해지고 부드러운 두부의... ,멀티시니어 김인옥(sennichini),https://blog.naver.com/sennichini,2021-10-16
"잠실 딤섬 맛집,서두산 딤섬만두.",https://blog.naver.com/oupru7?Redirect=Log&logNo=222474984402,"ㅋ_ㅋ 근데 흔씨는 별로라더라구요 ㅎ_ㅎ 이게 루비딤섬이였나? 요거 진짜 맛잇어요 살짝 매코옴하니!! 크으 요건 야끼만두였는데 야채야끼만두가 더 맛잇엇어용 _서두산 딤섬만두,, 너무 좋아요 다음엔 또... ",박숑이의 오글오글 여행 + 요리 블로그,https://blog.naver.com/oupru7,2021-09-04
"생활의 달인맛집, 딤섬맛집 송파맛집서두산 딤섬 ",https://blog.naver.com/hyghhu?Redirect=Log&logNo=221921413339,다시 넣고 사골을 끓인 솥에 넣고 데쳐 낸다 그러면 탱글하고 단맛이 나는 새우 완성 생활의 달인에서 사진과 글 퍼 옴 #생활의달인#생활의달인맛집#샤오롱바오맛집#딤섬맛집#송파맛집#새우딤섬맛집# 서두산딤섬 ,도미의 하루,https://blog.naver.com/hyghhu,2020-04-21
잠실/방이 먹자골목 수요미식회 맛집 :)서두산 딤섬만두 2호점,https://blog.naver.com/hayo322?Redirect=Log&logNo=222490668020,바오도 맛있었지만 둘 중 하나를 고르라면 저는 군만두에 한 표!! 만두도 요리도 하나같이 다 맛있었던 방이먹자 골목에 위치한서두산 딤섬만두! 딤섬 혹은 만두 좋아하시는 분들이라면 꼭 한번 가보세요!,하요미의 일기장 :),https://blog.naver.com/hayo322,2021-09-13
201911 송파 방이동 맛집 -서두산 딤섬 ,https://blog.naver.com/gaenshoo?Redirect=Log&logNo=221724342077,방이동딤섬맛집서두산2019. 11. 30. Saturday 영업시간 매일 11:30 - 24:00 스키장 계획이 취소되고 정처없이 남겨질 주말 저녁을 맛집으로 채워봅니다 오늘은 방이동딤섬 집으로 간다 분명서두산 이라는 이름이... ,Walking on the time 30s,https://blog.naver.com/gaenshoo,2019-12-02
방이동서두산 딤섬2호점,https://blog.naver.com/lego8099?Redirect=Log&logNo=222076983422, 서두산 딤섬2호점 만두만두 너무 자주 가서 부끄러워 업로드를 못했던서두산 딤섬사진털이.... 에메랄드 딤섬 이건 정말 훌륭. 다른 딤섬집들보다 크기도 크고 갯수도 4개나 된다. 아.. 테이크... ,먹고 마시고 공부하고 놀기,https://blog.naver.com/lego8099,2020-09-01
"[송파맛집, 방이동맛집]서두산딤섬| 유명세에 비해 무난했던..... ",https://blog.naver.com/tomatolob?Redirect=Log&logNo=222487623268,"워낙 유명해서 몇 년 전부터 가고픈 식당 리스트에 있던 # 서두산딤섬송리단길쪽에 2호점도 있던데... 당연서두산딤섬메뉴판 야끼만두, 샤오롱빠오, 마파두부덮밥을 주문했다. 대체적으로 가격은 합리적인... ",XOXO ;-),https://blog.naver.com/tomatolob,2021-08-29
잠실서두산딤섬 : 잠실에 갈 데 또 생겼네,https://blog.naver.com/doradanim?Redirect=Log&logNo=222531969399,이틀 식음전폐 후 소현이랑 잭슨피자 선배림이랑서두산딤섬원래부터 유명했음. 나 빼고 다 알던데?... 더욱 감격 땅콩 부스러기까지 싹 싹 먹었다 크리스탈딤섬?? 이거 아주 유명한 메뉴 과연 맛있었다. 만두는... ,食記錄,https://blog.naver.com/doradanim,2021-10-09
방이동서두산 딤섬- 방이동 딤섬 맛집,https://blog.naver.com/veronica92kr?Redirect=Log&logNo=222498228882,좋아하는딤섬맛집인 방이동서두산여기도 제가 좋아하는 곳이라 주기적으로 한번씩 꼭 가는 곳 방이동 주택가 골목 안에 있는 곳이예요! 작은 가게인데 티비에도 많이 나오고 동네에선 인기가 많은 곳이라 늘... ,yuyounging's 24/7,https://blog.naver.com/veronica92kr,2021-09-07
잠실 맛집서두산딤섬2호점 후기,https://blog.naver.com/rainb0wgom?Redirect=Log&logNo=221921259217, 서두산딤섬2호점 다녀왔어요 빠른 결론으로는 모든 메뉴를 다 시켜먹고 싶을만큼 괜찮습니다 매장은... 먹을만합니다 고기는 두덩어리있었나..ㅎ 언젠가 꼭 이 식당에 있는 딤섬을 종류별로 다 먹어볼겁니다... ,무지개곰 ^ㅅ^,https://blog.naver.com/rainb0wgom,2020-04-21
[방이동 맛집]서두산 딤섬 만두최애만두집 중 한곳,https://blog.naver.com/urim8497?Redirect=Log&logNo=222540383269,#만두순례 #리미콩 #일상 #잠실맛집 #석촌호수맛집 #방이동맛집 #송리단길맛집 # 서두산딤섬 만두... 새우 / 야채 / 야끼 저는 여기서 새우가 가장 맛있더라구요 :-) 하지만 남자친구가 새우 딤섬을 주문해서 야끼로... ,리미콩 블로그,https://blog.naver.com/urim8497,2021-10-18
[추석특집]송리단길 맛집 뿌시기 1탄 :서두산 딤섬 ,https://blog.naver.com/moong_richrich?Redirect=Log&logNo=222510928173,"ㅎㅎ) 송리단길 맛집 뿌시기 1탄 :서두산 딤섬첫번째로 소개할 곳은서두산 딤섬이라는 곳인데 매일 11:30~24:00 영업하고, 맛있는 홍콩식딤섬과 샤오롱빠오를 좋은 가격에 먹을 수 있어!! 뭉뚜기가 항상... ",좌충우돌 재테크 성장기,https://blog.naver.com/moong_richrich,2021-09-19
[방이동 맛집]서두산딤섬2호점 가지튀김 존맛쓰,https://blog.naver.com/ekzmepqmf7?Redirect=Log&logNo=222301950222,맛있다 맛있어 셋이 가서 메뉴 5개 먹을 수 있는 잠실/ 방이동 맛집서두산딤섬서울 송파구... 야채는 건강하지 딤섬집에선 종류별로 만두 조져줘야 제맛... 만두 진짜 좋아하는데 오랜만에 가는 만두... ,Another day of 에너지원,https://blog.naver.com/ekzmepqmf7,2021-04-07
 서두산방이동맛집딤섬맛집 샤오롱바오 맛집,https://blog.naver.com/girlstown0?Redirect=Log&logNo=221924653994," 서두산 딤섬맛집 샤오롱바오 맛집 방이동맛집 방이동 먹자골목에 위치한 유명한 딤섬 맛집이에요.... 가격도 부담없어서 딤섬,샤오롱바오가 먹고 싶을때 가끔가서 먹곤해요. 최근에는 서두산 2호점도... ",Lilly's home♡,https://blog.naver.com/girlstown0,2020-04-23
"[잠실 방이동 맛집]딤섬 만두 맛집,서두산 딤섬메뉴추천!",https://blog.naver.com/ahg0717?Redirect=Log&logNo=222446049911,"방이동에만 매장이 2개 있는 딤섬 맛집서두산 딤섬 ! 항상 2호점만 갔었는데, 이번에 처음으로 1호점에 방문했다. 매장은 2호점이 넓고 자리도 많으니 참고하세요! 주소: 서울 송파구 올림픽로32길 52... ",운동하는 건강한 멸치,https://blog.naver.com/ahg0717,2021-07-26
방이먹자골목서두산 딤섬군만두 짱이에요,https://blog.naver.com/simjaetaro7?Redirect=Log&logNo=221713099633,"추천을 받은 사이트에서도, 검색에서도 꽤나 많이 보였던서두산 딤섬 ! 과연 진짜 방이먹자골목의 맛집인지 알아보러갔어요. 물론 저희는 딤섬 너무 좋아해서 무조건 맛있겠다 생각하고 갔죸ㅋㅋㅋㅋㅋ 위치가... ",꽃이 진다고 그대를 잊은 적 없다,https://blog.naver.com/simjaetaro7,2019-11-21
 서두산 딤섬 ,https://blog.naver.com/comet00007?Redirect=Log&logNo=221762251064,"있던 # 서두산딤섬이 방이동 먹자골목 인근에 # 서두산딤섬 2호점 을 냈다는 것이 생각나서 찾아가 봤다.... 바삭한 #군만두 - 서두산 최고의 메뉴 오랜만에 맛있게 먹고, 동훈이 점심으로 장육을 포장해서 왔다.... ",세계는 넓고 갈곳은 많다,https://blog.naver.com/comet00007,2020-01-07
방이동 먹자골목 맛집서두산딤섬 2호점,https://blog.naver.com/sunalain?Redirect=Log&logNo=222354255814,#방이동먹자골목맛집 #방이동맛집 # 서두산딤섬# 서두산딤섬 2호점 #수요미식회맛집 #수요미식회중국만두 #중국만두맛집 애정하는 동생 효니 오랜만에 사무실 출근한다고 역삼 왔다가 나랑 저녁먹기로! 나도... ,♡수로로의 맛있는 일기♡,https://blog.naver.com/sunalain,2021-05-17
