title,link,description,bloggername,bloggerlink,postdate
방이동 맛집서두산 딤섬 ,https://blog.naver.com/girlstown0?Redirect=Log&logNo=221487922670,#방이동맛집 #방이동 #딤섬 # 서두산# 딤섬 맛집 유명하다 유명하다 얘기는 들었는데 가게가 작고 자리가 없을때도 있고 그래서 자주는 못가는곳인데 저날은 5명이 갔는데 다행히도 자리가 있어서 와구와구... ,Lilly's home♡,https://blog.naver.com/girlstown0,2019-03-14
"잠실서두산 딤섬- 홍콩딤섬, 군만두, 샤오롱바오",https://blog.naver.com/ricehm1?Redirect=Log&logNo=221158639580,"방이먹자골목에서 살짝 떨어진 곳에 위치하고 있음- 엄청 조그마한딤섬 집. 테이블 한 6개였나 있던거 같고, 내가 간날엔 일하시는 분 3분이 계셨는데, 다들 중국어로 서로 얘기하고 있었음- 물론 한국어로... ",You'll never walk alone,https://blog.naver.com/ricehm1,2017-12-08
잠실 방이먹자골목 맛집서두산딤섬 ,https://blog.naver.com/jhryks?Redirect=Log&logNo=221281787862,방이먹자골목서두산딤섬딤섬 그리고 중식정말 좋아하는 음식이죠~딤섬 넘넘 좋아해서 몽중헌 자주 가는데방이먹자골목에 몽중헌보다 훨씬 저렴하고맛은 뒤지지않는 오리지널 맛집이 있다고 해요서두산딤섬 ... ,림림이의 lovely life,https://blog.naver.com/jhryks,2018-05-26
방이맛집서두산딤섬 만두_20210129,https://blog.naver.com/isfineday?Redirect=Log&logNo=222224779399,"방이먹자골목 /서두산 딤섬 만두 알고봤더니, 방이먹자골목에만 1.2호점이 있고, 다른 서울 지역에... 얇고, 바삭하여 평균 이상 딤섬 기본 샤오롱빠오 / 육즙이 적당히 적당히. 너무 귀여웠던! 새우딤섬. 새우... ",잘 지내나요. 청춘.,https://blog.naver.com/isfineday,2021-01-29
방이동딤섬전문점서두산가성비 대박,https://blog.naver.com/lol_awesome?Redirect=Log&logNo=221394060030,"방이동딤섬전문점서두산가성비 대박 밤 11시가 넘어간 어느 날 밤, 갑자기딤섬 이 너~무 먹고 싶어서 밤 늦게까지 하는딤섬 집을 분당부터 서울까지 열심히 찾았는데 그 중 눈에 들어온 송파구 방이동에 있는... ",카레몽,https://blog.naver.com/lol_awesome,2018-11-08
[잠실/방이동]서두산 딤섬- 더욱 넓어진 2호점,https://blog.naver.com/alcoholblog?Redirect=Log&logNo=222057868273,"오늘은 동기 5인파티 이번에서두산 딤섬 의 매우 많은 요리들을 먹어봤다. 볶음밥, 수정딤섬 빼고 다먹었네. 메뉴판 일단 먼저온 송선생과 하얼삔부터 한잔 시작은 가볍게 가지튀김 이후 만두 몇판과... ",술과 함께,https://blog.naver.com/alcoholblog,2020-08-11
쉐라톤 서울 구로• 양키스피자 출발 호텔 경유서두산딤섬도착,https://blog.naver.com/comfortindexlim?Redirect=Log&logNo=222446713360,내사랑너의사랑 # 서두산딤섬샤오롱바오 호로록 우육면은 면발이 정말 맛없었다 이거 먹고서두산딤섬 가면 면 절대 안시킴 군만두는 새우 고기 둘 다 맛있는데 날개 크기는 갈 때마다 바뀌니 맘 상하지 말자... ,•lllife•,https://blog.naver.com/comfortindexlim,2021-07-26
방이동 먹자골목 Dim Sum 만두 :서두산 딤섬만두,https://blog.naver.com/kng236?Redirect=Log&logNo=220810155314,사실 나는 딤섬/만두 안좋아하는 편이다그게 왜일까 싶었는데시중에파는건...맛없어서 인거같아(마트... 위치한 서두산 딤섬만두 날이 좀 풀려서 그런지창문을 다열어놓고선풍기만 돌아가고 있었다살짝... ,Acorn's houes,https://blog.naver.com/kng236,2016-09-11
서울 방이동서두산 딤섬만두,https://blog.naver.com/surgeonish?Redirect=Log&logNo=221581267364,요거요거는 또 안에 육즙 먹는 재미가 있지요...!! 다른만두랑딤섬 도 먹어보고 싶었는데 체류기간(?) 중에는 두 번 이상 가지 못했습니다!! 추운 겨울에 방이동에 간다면 꼭 다시 재방문 하고 싶은 가게... 유냉 총.총.,U-NaEnG's Renaissance,https://blog.naver.com/surgeonish,2019-07-09
송파/방이동)서두산 - 홍콩딤섬맛집,https://blog.naver.com/wowyezy?Redirect=Log&logNo=222292862348,수제홍콩딤섬전문점 서두산에 다녀왔어요! 이 곳은 송파구 방이동 먹자골목 근처에 있어요. 친구가 딤섬 맛집이라고 찾아온 곳.! 내부는 이렇게 생겼어요! 테이블이 한 5개? 정도 있었던듯. 아담한서두산 딤섬 ... ,펭귄섬,https://blog.naver.com/wowyezy,2021-03-30
 서두산 딤섬2호점 / 잠실 방이동,https://blog.naver.com/102_tour?Redirect=Log&logNo=221624792547,"방이동 최애 가게,서두산 딤섬 이 2호점을 오픈했다. 조그마한 규모의 본점과 달리 아주 넓은 곳에... 여느 날과 같이 서두산에서 딤섬 먹으며 사장님과 근황 토크 하고 있었는데, 2호점 준비 중이시라고. 나는... ",102 tour,https://blog.naver.com/102_tour,2019-08-22
[방이] 수요미식회 나왔다던서두산딤섬 ,https://blog.naver.com/linsu2714?Redirect=Log&logNo=222283332145,안녕하세요 오늘의 메뉴는딤섬입니다:) 오랜만에 방이먹자골목을 가게 됐는데 동네주민 피셜 맛있는 곳이라고 하길래 가봤어요! 건물 2층에 위치한서두산내부 사진은 못 찍었는데 2층 전체를 다 쓰고... ,오늘은 뭘먹을꽉(•‾̑⌣‾̑•)ノ!,https://blog.naver.com/linsu2714,2021-03-22
[잠실]서두산 딤섬 맛집/ 방이동맛집,https://blog.naver.com/jihlee86?Redirect=Log&logNo=221484397629,비주얼 대박 워낙딤섬 을 좋아해서 여기 저기 가보고 한국에선 청담 몽중헌만 가는편이었는데... 신랑이랑 어깨춤을 추게 만든 새우 딤섬쇼마이 역시나 큰새우는 아니지만 작은 새우도 안에 들어가있고 표고와... ,내풀로(=내마음대로),https://blog.naver.com/jihlee86,2019-03-10
 딤섬 맛집 ::서두산:: 방이동맛집,https://blog.naver.com/ninon1966?Redirect=Log&logNo=221267418222,주말에 가볼까 알아보다 주차랑 줄이 길 것 같아 남편이 테이크아웃 #서두산 # 서두산딤섬#딤섬맛집 #방이동맛집 새우군만두 샤오롱바오 충칭라쯔지딩(매운닭튀김) 그리고 #에비수 군만두 더 사올 걸 그랬다며... ,Are U Going with ME?,https://blog.naver.com/ninon1966,2018-05-03
[ 서두산 딤섬 ] 다양한 딤섬과 고량주 한잔! (방이 먹자골목),https://blog.naver.com/imeanyoung?Redirect=Log&logNo=222453984338, 서두산 딤섬여기는 울아빠 추천 맛집 아빠 추천 맛집은 믿고 가야한다고..! 칭구들이 고량주 고량주... 자리가 좀 좁아서 오래 있긴 힘들지만 간단하게 한잔 하기 너무 좋앗당 # 서두산# 딤섬#샤오롱바오... ,밍뇨이,https://blog.naver.com/imeanyoung,2021-08-02
[ 서두산 딤섬 ] 방이동 맛집,https://blog.naver.com/bbs2221?Redirect=Log&logNo=222518514141,"팀호완딤섬 밖에 모르던 내가... 더 맛있는 집을 찾아버렸다ㅎㅎ 현지 느낌 나는 곳, 손맛이 느껴지는딤섬집이다 새우 군만두 그냥 군만두다 우육면 향신료가 가득했던 맛이었는데 은근 중독성이 있다 면발이... ",하영,https://blog.naver.com/bbs2221,2021-09-27
잠실 방이동 먹자골목서두산 딤섬만두 2호점,https://blog.naver.com/j_park220?Redirect=Log&logNo=222296706055, 딤섬만두로 유명하고 수요미식회에도 소개되었다는서두산2호점입니다. 방이동 먹자골목 쪽에 있어요. 1호점도 근처에 있는 거 같습니다. 내부는 이렇게 생겼어요. 뭔가 중국 현지 식당에 온 것 같은... ,The Fragrance of Life,https://blog.naver.com/j_park220,2021-04-03
방이동맛집 훈툰 샤오롱바오서두산딤섬 ,https://blog.naver.com/gene_k?Redirect=Log&logNo=221294705084,예전 포스팅도 참고 https://blog.naver.com/gene_k/221135441509 방이동맛집서두산딤섬여름인데도 딤섬의 인기는 여전한듯싶다 오전 11시 30분부터 밤 12시까지 영업한다. 만두 품절되면 조기 마감될 수도 있다니... ,"젠타의 ""너 맛집맞아?""",https://blog.naver.com/gene_k,2018-06-16
잠실 방이동먹자골목 딤섬 맛집서두산딤섬★★★★,https://blog.naver.com/qoselem99?Redirect=Log&logNo=222306907414,"잠실 방이동먹자골목 딤섬 맛집서두산딤섬2호점은 방이동 먹자골목에 위치해있다. 2층으로 올라가는 길에 보이는 간판이 있지만, 외부에서 보았을 때에는 쉽게 찾을 수 없다. 잠실 방이동먹자골목 딤섬 맛집... ",좀 더 색다른 가이드북,https://blog.naver.com/qoselem99,2021-04-12
방이동서두산딤섬- 생활의 달인 중국만두 달인 은둔식달 딤섬... ,https://blog.naver.com/gypsyone?Redirect=Log&logNo=221920794691,# 서두산딤섬#생활의달인중국만두 #중국만두달인 #생활의달인 #송파구중국만두 #딤섬달인 #생활의달인딤섬 생활의 달인 중국 만두 딤섬 달인서두산 딤섬2020년 4월 21일 화요일 734회 생활의 달인 1. 은둔식달... ,세콰노의 머거머거,https://blog.naver.com/gypsyone,2020-04-21
"[영수증리뷰]서두산딤섬: 방이동맛집 대장으로 인정, 군만두... ",https://blog.naver.com/angryhenry?Redirect=Log&logNo=222142232541,"그곳은 바로 방이동 맛집서두산 딤섬 이다.서두산딤섬방이동맛집 대장으로 인정, 군만두 두번드세요 모노몬 평점 4.3 / 네이버 평점 4.38 / 카카오 평점 3.8 방이동 먹자골목이 끝날때쯤 방이동 맛집서두산딤섬 은... ",진지한 모노몬,https://blog.naver.com/angryhenry,2020-11-12
[잠실맛집/방이동 먹자골목 맛집]서두산 딤섬 만두 2호점... ,https://hiiambk.tistory.com/1109,728x90 회사분들과 점심 먹으러 갔다가 여긴 맥주먹으러 꼭 다시 와야지 결심했던 곳서두산 딤섬 만두... 항상 가면 딤섬류도 다 직접 빚고 계시더라고요. 믿음직하기까지 한 식당! 가지튀김과 볶음밥은 조금씩... ,기린뽀의 일상,https://hiiambk.tistory.com/,2021-10-08
#딤섬맛집 #중화만두맛집 #방이먹자맛집 # 서두산딤섬 2호점,https://blog.naver.com/bdmecca?Redirect=Log&logNo=222335334328,"수개월만에 두번째 방문하는서두산딤섬 2호점 입니다.. 2호점이 있으니 본점또는 1호점도 있겠지요? 네... 딤섬은 여전히 전문중식당이 맛있습니다.. 왜, #크리스탈제이드 , #골드피쉬 , #딘타이펑 등이 많이 가본... ",빌딩메카 www.bdmecca.co.kr,https://blog.naver.com/bdmecca,2021-05-04
맛부림- 송파딤섬맛집서두산딤섬 ,https://blog.naver.com/songgg0701?Redirect=Log&logNo=222221768456,송파딤섬맛집서두산딤섬벼르고벼르던서두산딤섬드디어 다녀왔어요!! 2호점갔더니 사람도 별로 없어서 너무 좋았답니다 2호점은 2층에 위치해있어요! 내부모습! Previous image Next image 메뉴판입니당... ,S.LovEE❣️,https://blog.naver.com/songgg0701,2021-01-27
송파맛집서두산 딤섬군만두 추천 칭다오 수요미식회맛집이래요,https://blog.naver.com/mh418?Redirect=Log&logNo=222356902287,먹었어요 배가 더부룩 오늘도 사랑하세요 좋은일 가득가득생겨라 #좋은일 # 서두산딤섬# 서두산 딤섬#딤섬 #군만두 #군만두맛집 #조개 #만두 #만두맛집 #샤오롱바오 #송파맛집 #잠실맛집 #방이동맛집 #방이먹자골목,엘,https://blog.naver.com/mh418,2021-05-19
방이동서두산 딤섬 /송리단길 글뤽 gluck,https://blog.naver.com/berrywony?Redirect=Log&logNo=222213808208,있어요 음료가 심플하게 나와서 기대 안했는데 둘다 만족! 신맛없이 고소한 아아랑 아주 새콤한 레몬에이드 최고.. #방이동맛집 #방먹맛집 # 서두산딤섬#방이동딤섬 #송리단길카페 #송리단길 #글뤽 #gluck #송리단글뤽,워니블로그,https://blog.naver.com/berrywony,2021-01-20
서울딤섬맛집 / 방이동먹자골목 /서두산딤섬 ,https://blog.naver.com/paiderastia?Redirect=Log&logNo=222203113351,이퀄 이맛이면 만족합니당 :) 먹고 있는 도중에도 계속 손님들이 들어오는 찐맛집 ! 추천해용서두산딤섬#서울화교중국집 #서울화교딤섬 #송파맛집 #방이동맛집 #방이동먹자골목맛집 #송파구딤섬 # 서두산딤섬 ,Je Me Faire Tout,https://blog.naver.com/paiderastia,2021-01-10
[ 송파맛집 / 방이동맛집 ] 수제 홍콩 딤섬 전문점서두산 딤섬 ,https://blog.naver.com/raphaelachoi?Redirect=Log&logNo=222110668107,"그런데, 서두산 마파두부는 이도저도 아닌 느낌이었어요. 심지어 고기에서 누린내도 좀 나더라구요. 수제홍콩딤섬전문점서두산딤섬샤오롱빠오 우리나라에서는 대부분 이렇게 안에 육즙이 가득한 만두를... ",푸디레의 미식일기,https://blog.naver.com/raphaelachoi,2020-10-08
잠실 방이동서두산딤섬샤오롱빠오 맛있당,https://blog.naver.com/limessung?Redirect=Log&logNo=222231814715,모자라겠죠 ?! 가장 기본적인 딤섬으로 한판 주문 ! 뜨끈뜨끈 하면서도 맛있는 샤오롱빠오와 딤섬 !!! 겨울철 먹기에 딱 좋아요.ㅎㅎ 잠실 방이동 딤섬 찾는 분들은서두산딤섬한번 가보세요 ^_^,라임 일상기,https://blog.naver.com/limessung,2021-02-04
방이동 맛집 -서두산 딤섬만두,https://blog.naver.com/lse1112?Redirect=Log&logNo=221274070819,"2018/5/12 비오는 토요일, 남편이랑 들린딤섬만두집.딤섬먹으러 방이동 간다길래 몽중헌? 그랬는데 아니었음. 진짜 가게 이름이딤섬 이다. ㅋㅋ 직원이 모두 중국인이다. 여사장님만 한국말 할줄 아시는듯.... ","장난스럽게, 혹은 포근하게",https://blog.naver.com/lse1112,2018-05-12
"방이동서두산딤섬2호점]... 못미쳤던 유명한 중국만두, 딤섬집",https://blog.naver.com/kkpsports?Redirect=Log&logNo=222381508378,중식이네 집 근처에서 저녁먹기로 해서 선정한 #송파구 #방이동 # 서두산딤섬2호점 '수요미식회' 등 맛집프로에도 출연하여 이미 유명한 집인데 맛집블로거 '비내리'님이 극찬하셔서 더 궁금했던ㅋㅋ 1호점은... ,www.Qifeng.com,https://blog.naver.com/kkpsports,2021-06-03
 서두산딤섬2호점 2021.5,https://blog.naver.com/coutal?Redirect=Log&logNo=222382651680,그냥 홍합을 끓인 탕에 훈툰 넣고 내온 것. 동네포차의 홍합탕스러운 훈툰탕을 바라진 않았다 Too much localized # 서두산딤섬# 서두산딤섬 2호점 #과도한현지화 #본래의맛은어디에 #딤섬집에서는딤섬만,流水不爭先,https://blog.naver.com/coutal,2021-06-03
[잠실]서두산 딤섬만두 2호점,https://blog.naver.com/youwillstay?Redirect=Log&logNo=222139280721, 서두산 딤섬만두 친구가 골라서 보내준 메뉴는 치맥과 중식이었는데 이날 점심에 내가 치킨 덮밥을... 잠실 방이동 중식 맛집 서두산 수제 딤섬 만두 메뉴 메인으로 내세우고 있는 샤오룽빠오와 딤섬만 좀... ,날으는쏘피,https://blog.naver.com/youwillstay,2020-11-09
딤섬 전문점] 중국식 만두 방식 그대로 고수한 ' 서두산 딤섬 ',https://blog.naver.com/bsy3077?Redirect=Log&logNo=222084029719,방이동 딤섬 전문점 중국식 만두서두산 딤섬꾸르팁(?)마녀입니다 어제 날씨가 너무 꿀꿀해서 꿀팁... 서두산 샤오롱빠오 방이동의 딤섬 전문점 대표 메뉴 중 하나인 샤오롱빠오가 먼저 나왔어요~ 진짜 작고... ,꿀팁방출,https://blog.naver.com/bsy3077,2020-09-08
잠실 송파구 맛집서두산딤섬중국집 - 충칭라쯔지딩 맛있어요,https://blog.naver.com/ace3210114?Redirect=Log&logNo=221838350650,맛있어서 2번째 갔지만 한번더 갈 예정인 딤섬 샤오롱빠오 맛집서두산딤섬이었습니다 #송파맛집 #딤섬맛집 #샤오롱빠오 #충칭라쯔지딩 # 서두산딤섬#잠실서두산 #잠실딤섬,"♬용인 양지 건국부동산, 전원 주택 전문",https://blog.naver.com/ace3210114,2020-03-05
