title,link,description,bloggername,bloggerlink,postdate
 서초동의정부평양 냉면 맛집평양면옥 ,https://blog.naver.com/joongoa?Redirect=Log&logNo=222324621368,원조평양 냉면 맛집인데요 갑자기 더워진 날씨에 입맛 잃지 마시고 식사 잘 챙기셔서 건강하시길 바래요~ 저는서초동의정부평양면옥 을 다녀왔어요~ 일단 메뉴부터 소개 드리면 냉면을 포함해 다양한... ,마리아주의 맛있는 미담,https://blog.naver.com/joongoa,2021-04-27
 서초동남부터미널 음악... 아지트102가 다녀온평양면옥 ,https://blog.naver.com/agit102?Redirect=Log&logNo=222265840610,안녕하세요 # 서초동#남부터미널 프리미엄 #음악연습실 #아지트102 입니다 맛집이라고 소개하기... 쵝오 #음악연습실 #아지트102 # 평양면옥#남부터미널역연습실 # 평양 냉면맛집 #남부터미널연습실... ,서초동 남부터미널 음악연습실 AGIT102 아지트102,https://blog.naver.com/agit102,2021-03-05
 서초동맛집평양 제일 면옥 - 제대로 된평양면옥 ,https://blog.naver.com/sagak815?Redirect=Log&logNo=220992674305, 서초동맛집평양 제일 면옥 - 제대로 된평양면옥올해 초 직장 근처에평양 냉면 전문점이 생겼다. 오픈 초기에 방문했을 때는 다소 아쉬운 면이 있던 집인데 몇 달이 지나 이제 안정기에 접어들었을 거란 생각에... ,사각사마는 뭘 먹고 사나,https://blog.naver.com/sagak815,2017-05-09
[의정부 평양면옥 ] 서울시 서초구 잠원동 | 내돈내산 맛집리뷰,https://blog.naver.com/hsol0412?Redirect=Log&logNo=222394164723,좋아하는평양 냉면집은 의정부에 위치한 ' 평양면옥 '이다. 하지만 위치가 너무나 멀어서 특별한날에만... 논현동 평양 냉면 #신사동 평양 냉면 #서울맛집 #서초구맛집 #강남맛집 #잠원동맛집 #논현동맛집 # 서초동 맛... ,"April Story, 1991",https://blog.naver.com/hsol0412,2021-06-11
[서울 평양 냉면맛집]평양면옥수육 제육 만두국 맛이없는게... ,https://blog.naver.com/heeyoungtour?Redirect=Log&logNo=222488644017,경인 면옥가봐야겠습니다 #인천 평양 냉면맛집#냉면랩소디성시경냉면집#냉면랩소디백종원냉면집#강남 평양 냉면맛집#도곡동 평양면옥 #도곡동수육맛집#인천수육맛집# 서초동평양 냉면맛집#냉면랩소디 평양 냉면맛집... ,영이골프라이프,https://blog.naver.com/heeyoungtour,2021-08-30
" 평양 냉면 ♥️평양면옥 , 필동 면옥 , 설눈",https://blog.naver.com/o921_?Redirect=Log&logNo=222358178592,안에 먹은평양 냉면들 장충동평양면옥왕왕 큰 접시만두 여기도 이북식 느낌 슴슴한 왕만두인데... 먹은서초동설눈 집에서 가까운 데서 평냉 먹으려다가 예~~~전에 한 갔다가 닫아서 동무밥상 갔던 기억이... ,그냥살지요,https://blog.naver.com/o921_,2021-05-20
도곡동 근처 냉면 맛집평양면옥 ,https://blog.naver.com/jmjm3060?Redirect=Log&logNo=221962689122,사실 수육으로는서초동 에 있는 막국수전문점 샘밭막국수에서 먹은 기억을 저버릴수가 없다. 목넘김이... 노포 맛집이 있다는것도 어쩌면 행운인듯 하다. #도곡동맛집 #도곡동냉면 # 평양 냉면 #매봉역맛집 # 평양면옥 ,도곡동 김여사,https://blog.naver.com/jmjm3060,2020-05-14
[ 평양면옥 (강남냉면 맛집)] 서초동백옥치과 강남평양 냉면 맛집... ,https://blog.naver.com/white5375?Redirect=Log&logNo=157171462,오늘은 강남에서 대표적인평양 냉면 맛집으로 명성을 날리는평양면옥평양 냉면을 소개해 드립니다.서초동 에 위치한 저희 백옥치과에서 살짝 무리해서 점심시간을 이용해 갈수있는 마지막 거리의 냉면맛집... ,백옥치과에서는...,https://blog.naver.com/white5375,2012-05-07
송파 방이동평양 냉면 맛집! - 금왕 평양면옥 ! 순면 물냉면!,https://blog.naver.com/kcherry99?Redirect=Log&logNo=221619999278,여기 금왕 평양면옥 의 장점!평양물냉면을 싫어하는 사람과 같이 올 수가 있다는 것이다. 갈비탕을 시키면 된다. 여기 금왕 면옥만두가 참 맛있는 편이라 만두를 시킬까 했더니 울애가 펄쩍 뛴다. 엄마 만두... ,노을빛 함께 손잡고,https://blog.naver.com/kcherry99,2019-08-18
[논현동] 평양면옥 ,https://blog.naver.com/nitobe?Redirect=Log&logNo=110178351753,"이웃분들평양 냉면 포스팅의 쓰나미에 휘말렸습니다 그래서 저도 하나 투척하고 점심에 평냉 먹으러 나가려구요 논현동 을지병원사거리의평양면옥잠원동 본가 평양면옥 , 강남역 을밀대,서초동봉피양... ",다다이즘..,https://blog.naver.com/nitobe,2013-10-24
"서울 유명 냉면 맛집 비교 (봉피양, 강남 면옥 , 우래옥,평양면옥 )",https://blog.naver.com/rautrecinme?Redirect=Log&logNo=221753747268, 평양 냉면 #함흥냉면 #냉면막집 #서울냉면맛집 #냉면맛집추천 #봉피양 #강남 면옥#우래옥 # 평양면옥 ... 강남 면옥 도 추가로 포스팅해본다. 강남 면옥 은 신사동에 본점이 있는 함흥냉면 전문점이다. 나는서초동 에... ,부엉이의 글이 되는 삶,https://blog.naver.com/rautrecinme,2019-12-30
#편육맛집 #냉면맛집 #도곡동맛집 # 평양면옥 도곡점,https://blog.naver.com/bdmecca?Redirect=Log&logNo=222076461605,"능라 , 진미 평양면옥, 피양옥 , 경평 면옥, 서관 면옥등 등 .. 어마무시하게평양 냉면전문점이 새로... 강남역빌딩 # 서초동 빌딩 #강남대로빌딩 #테헤란로빌딩 #도산대로빌딩 #신사동빌딩 #논현동빌딩... ",빌딩메카 www.bdmecca.co.kr,https://blog.naver.com/bdmecca,2020-09-02
서울평양 냉면 맛집 총 정리 장충동평양면옥외 4곳,https://blog.naver.com/kcddrum?Redirect=Log&logNo=222140311145,서관 면옥(서초구서초동 ) 서울 교대역 부근에 있는 서관 면옥 은 2018년에 개업했지만 서울에서의 입지는... 진미 평양 냉면 (강남구 논현동) 진미 평양 냉면은 논현동평양면옥출신의 임세권 셰프가 차린 곳으로... ,덕드럼의 덕슐랭 가이드,https://blog.naver.com/kcddrum,2020-11-10
전통의평양 냉면과 명품 수육 의정부평양면옥 ,https://blog.naver.com/dltksla20?Redirect=Log&logNo=221476828440,더워지기전에서초동신생 평냉집도 어서 가봐야하는데ᆢ 북미회담에서 종전선언이 있기를 바라며ᆢ^^ 의정부 구시가에 위치한 50년 전통의평양면옥 ᆢ 휴무일과 영업시간 참고하시구요ᆢ 언제나평양 냉... ,낭만식객의 숨은 맛집 이야기ᆢ,https://blog.naver.com/dltksla20,2019-02-28
 서초동더진미평냉- 겨울에 맛봤던 맛있는평양 냉면(feat.... ,https://blog.naver.com/sagak815?Redirect=Log&logNo=222193635436,이 집 본점 만두를 극찬하는 분들이 많은데 저는 여기 만두보다평양면옥만두를 더 좋아합니다.... 02 525 8839 영업시간.. 11:00~21:30 주차.. 가능 포장.. 가능 # 서초동#더진미냉면 # 평양 냉면,사각사마는 뭘 먹고 사나,https://blog.naver.com/sagak815,2021-03-17
[서울서초동 ] 설눈,https://blog.naver.com/king4000?Redirect=Log&logNo=222295944319,※ 서울식 옛날평양 냉면 식당 둘러보기 ※ 우래옥(주교동) - https://blog.naver.com/king4000/222203096496 ※평양면옥 (장충동) - https://blog.naver.com/king4000/222203837900 ※ 을지 면옥 (입정동) - https://blog.naver.com... ,사천왕의 잡설록,https://blog.naver.com/king4000,2021-04-02
"7月 강남역서초동한우 다이닝, 울릉 점심식사",https://blog.naver.com/hyunsj0421?Redirect=Log&logNo=222503609181,비빔밥서초동유명 냉면집인 서관 면옥 을 만드신 셰프님의 두 번째 브랜드라고 하는 한우 다이닝...평양 냉면 많이 먹어 보진 않았지만 장충동평양면옥 보다는 진한 맛이던데평양 냉면 중에 간이 강한... ,랄라라,https://blog.naver.com/hyunsj0421,2021-09-13
 서초동/ 미우미우 : A to Z 전부 마음에 들던 교대역 한우 전문점,https://blog.naver.com/begopa1092?Redirect=Log&logNo=222145228348,처음으로 방문했던서초동교대역 한우 전문점 미우미우 10여년전 송파에서 유명한 한우집이라고... ㅎ 알고보니 미우미우에서는 금왕 평양면옥 이라는 곳도 운영한다고... 완전 기업이네..ㅎㅎ 무튼 흠잡을 곳... ,eye of the beholder,https://blog.naver.com/begopa1092,2020-12-04
[교대역 맛집] 미우미우 교대점 :서초동한우 고깃집 오픈,https://blog.naver.com/yjoshjh?Redirect=Log&logNo=222124403764, 서초동교대역에서 강남역 방향 대로변에 새로 오픈한 한우 고깃집 미우미우 교대점 방이동... 방이동평양 냉면 전문점 금왕 평양면옥 도 함께 운영하기 때문에 후식으로 먹은 냉면 맛도 아주 훌륭합니다... ,참이술의 Eat & Drink,https://blog.naver.com/yjoshjh,2020-10-23
의정부평양면옥 ,https://blog.naver.com/compactax?Redirect=Log&logNo=221457091339,이날 안산에서 의정부 평양면옥 을 가야하는데 네비를 막내따님의서초동의정부 평양면옥 으로 찍는... 1.1만이지만 8천원 받는 광명 정인 면옥 양의 1.5배는 되는 양은 됩니다. 의정부 정인 면옥 도 이제 1만원이니... ,하셈 블로그,https://blog.naver.com/compactax,2019-02-02
[ 평양면옥 (장충동)] 서초동백옥치과 장충동평양 냉면 맛집... ,https://blog.naver.com/white5375?Redirect=Log&logNo=168037675,"을지 면옥 . 개인적으로 면, 육수, 편육, 식당 분위기가 너무 좋아서 자주 가고 싶지만 자주 못 가지는 아쉬운평양 냉면집 입니다. 서울의 의정부평양면옥계열 중에서 제일로 선호하는데 접근성이 취약해서..... ",백옥치과에서는...,https://blog.naver.com/white5375,2012-10-05
"하남스타필드! - 냉면맛집평양면옥 ,고메스트리트! PK마켓!",https://blog.naver.com/kcherry99?Redirect=Log&logNo=220939004459,"의정부평양면옥 은 을지 면옥필동 면옥 과 같은 계열이구요. 장충동평양면옥 은 논현동,도곡동,분당평양면옥 과 같은 계열입니다. 역시 어린 돼지를 잘 삶아낸 편육과 시원한평양 냉면 역시 맛이 좋습니다. 이... ",노을빛 함께 손잡고,https://blog.naver.com/kcherry99,2017-02-19
[ 서초동 ] 미우미우 : 아름다운 마블링의 향연,https://blog.naver.com/djkim74?Redirect=Log&logNo=222145319277, 평양 냉면도 맛있게 먹어서 금왕 평양면옥 도 따로 가보고 싶어 지네요. * 주소 : 서울 서초구서초동1675-13 영일빌딩 1층 * 전화번호 : 02-522-2481 * 영업시간 : 11:30~22:00(15:00~17:00) * 연중무휴 * 발레 파킹,Ray' story,https://blog.naver.com/djkim74,2020-11-16
신사 맛집 / 본가평양면옥 ,https://blog.naver.com/kislu?Redirect=Log&logNo=220688067817,"필동 면옥잠원동의 본가평양면옥 이 자매점이라 불리우며 4개가 같은 뱃속에서 나온 형제님들이다.... 서초시 아니고서초동 이고, 시티 붙일려면 시 정도는 되야 하는게 아닌가 싶은데.... 뭔가 좀 그러네. 서울... ",食事酒常,https://blog.naver.com/kislu,2016-04-20
장충동 평양 냉면맛집평양면옥 ,https://blog.naver.com/sodan4?Redirect=Log&logNo=221556262833,장충동평양면옥 은 우래옥 을지 면옥 남포 면옥등과 함께 서울을 대표하는평양 식 냉면집입니다 오랜... 장충동평양면옥 은 제육과 편육이 함께 나옵니다 그런 반면 우래옥 한일관(압구정동) 사리원( 서초동 )... ,사진으로 이야기하는 여행,https://blog.naver.com/sodan4,2019-06-07
"[사천왕 가이드] 설눈(서울서초동 ), 막국수의 원류를 찾아서...",https://blog.naver.com/king4000?Redirect=Log&logNo=222245549984,설눈 (서울시 서초구서초동서초대로 46길 20-7) 어느분이 이 집을 추천해주셨다. 올려주신... 여기껄 먹고나니 의정부평양면옥 이나 을지 면옥 은평양변두리도 아니고 변두리 분식집서 하는 냉면... ,사천왕의 잡설록,https://blog.naver.com/king4000,2021-02-16
 서초동: 설눈 - 깔끔한 수육과 고려비빔냉면,https://blog.naver.com/sayravel?Redirect=Log&logNo=221943544566,북한 스타일서초동냉면 • 설눈 4월말에야 날씨가 비로소 따땃해지니 슬슬평양 냉면 달릴 때가 온것... 면만 빼놓고 보면 장충동평양면옥비빔양념도 좀 오버랩되고. 비빔냉면을 먹고 싶은데 물냉면 육수가... ,방배동 정슨생의 일상다반사,https://blog.naver.com/sayravel,2020-05-03
[서관 면옥 ]서초동교대평양 냉면 | 내돈내산 맛집리뷰,https://blog.naver.com/hsol0412?Redirect=Log&logNo=222472300495,최애평양 냉면집은 어디인가요? 저는 의정부평양면옥 과 을밀대가 가장 입맛에 맞더라구요. 오늘은... # 서초동 맛집 #교대맛집 #교대역맛집 # 서초동평양 냉면 #교대 평양 냉면 #교대역 평양 냉면 # 서초동 냉면... ,"April Story, 1991",https://blog.naver.com/hsol0412,2021-08-16
"[강남, 서초동 ,강남역/봉피양 서초점] 정작평양 냉면에... ",https://blog.naver.com/hdhdd?Redirect=Log&logNo=221229975005,"[강남, 서초동 ,강남역/봉피양 서초점] 후배중 한 친구를평양 냉면에 입문시켰습니다. 강남에 을밀대가... 의정부 평양면옥계열의 냉면집이 강남역에 생겼으면 좋겠네요 을밀대와 봉피양은 좀 지겨울라고... ",책과 음식과 영화이야기,https://blog.naver.com/hdhdd,2018-03-27
[서초구/ 서초동 ] 설눈,https://blog.naver.com/habakdr?Redirect=Log&logNo=222275184819,"서울 서초구서초동서초역 부근에 위치한평양 냉면 전문점 설눈. • 원탑에 가깝다고 느꼈던 예전... 우리네의평양면옥등은 예전평양 식이고, 이 설눈의 냉면은 현재 이북에서 실제로 서브되고 있는 그... ",마른수퇘지,https://blog.naver.com/habakdr,2021-03-14
 서초동 /교대역 : 서관 면옥- 풍성한 어복쟁반에 골동냉면 마무리,https://blog.naver.com/sayravel?Redirect=Log&logNo=221700780921,"이북의 맛이 은근하게 전해져오는 소박한 스타일의평양면옥어복쟁반과는 달리 교대 서관 면옥 의... 여기 어복쟁반 추천요 :) 교대 서관 면옥 . 서울 서초구서초동1675-5 02-521-9945 영업시간 11:30 - 21:30 (B,T 15:00 - 17:00)",방배동 정슨생의 일상다반사,https://blog.naver.com/sayravel,2019-11-07
 서초동 [서관 면옥 ]단아한 수준급평양 냉면전문점 신규오픈... ,https://blog.naver.com/dalcomqueen?Redirect=Log&logNo=221344814207,교대역앞서초동신규오픈평양 냉면강자 [서관 면옥 ] - 엄선한 블랜딩메밀 100%순면평양 냉면 - 북한... 격이있는평양 냉면과 어복쟁반이 아주 훌륭하네요. 애정하는 [우래옥]과 [ 평양면옥 ]도 요즘 들쑥날쑥한... ,달콤퀸 미쉘의 미.식.여.행.,https://blog.naver.com/dalcomqueen,2018-08-23
[강남역/ 서초동 ] 봉피양 -평양 냉면과 제육,http://hsong.egloos.com/3354607,"논현동평양면옥10,000원 필동 = 을지 = 본가 (의정부 계열) / 을밀대 / 남포 면옥9,000원 서북 면옥7... 후식은 수정과 찾아가는 길 서초구서초동1330 코아텔 1층, 02-587-7018 2012년 겨울 방문 http://hsong.egloos.com... ",녹두장군의 식도락,http://hsong.egloos.com/,2012-08-19
[강남역/봉피양]서초동돼지갈비 맛있는곳. 봉피양 서초점.,https://blog.naver.com/rulzhan?Redirect=Log&logNo=221005098966,"저는 그중에서도 평냉을 사랑하는 친구가 끌고갔던 을지 면옥 ,어쩌다 먹게된평양면옥 ... 먹어보긴... 주소 :서초동1330 코아텔 1층서초동 삼성쉐르빌2전화번호 : 02-587-7018영업시간 : 매일 11:00 - 21:30 진정한... ",그대여 왔는가,https://blog.naver.com/rulzhan,2017-05-13
"제87권- 백헌석, 최혜림 냉면열전 2/2 팔도 냉면 유랑기",https://blog.naver.com/allin69_?Redirect=Log&logNo=222473412953,을지 면옥 의 냉면은 일명 의정부파평양 냉면의 상징이다. 의정부파평양면옥 의 뿌리는 의정부... * 봉피양 : 서울특별시 서초구서초동1330 코아텔 1층 (서울특별시 서초구 강남대로 53길 11서초동삼성쉐르빌... ,인생은 휴가다 !,https://blog.naver.com/allin69_,2021-08-31
 서초동평양 냉면집 서관 면옥 ,https://blog.naver.com/cretong?Redirect=Log&logNo=221646588251, 서초동 ....새로운평양 냉면의 간판주자로 떠오르고 있는 서관 면옥 .. 사실 예전 수십년을 살던 집에서... 다음에는 성공 하리라 ㅋㅋ. 최근 냉면집 중에서는평양면옥 과 함께.. 최애하는 냉면집.. ^^,Sunny Side 블로그,https://blog.naver.com/cretong,2019-09-12
[강남역/ 서초동 ]사리원,https://blog.naver.com/nitobe?Redirect=Log&logNo=110178734302,"신세계의평양 냉면을 발견^^ 불고기랑도 맛있는 것 먹고 달달한 걸로 마무리하는 걸 싫어해서 패스 우래옥, 강서 면옥 , 남포 면옥 , 의정부평양면옥 , 을지 면옥 , 필동 면옥 , 본가 평양면옥 , 장충동... ",다다이즘..,https://blog.naver.com/nitobe,2013-10-30
[ 서초동 ] 봉산옥 - 만두국,https://blog.naver.com/coolride1?Redirect=Log&logNo=80106881714, 서초동 에서 만두국 잘한다는 그 집입니다. 예술의 전당쪽에서 가깝죠. 철퍼덕 앉아서 먹기 좋긴 한데... 정말 쉽지 않은 국물맛이었습니다....만두국 중에서 개인적으로 최고로 치는평양면옥 의 만두국... ,레오오빠님의 블로그,https://blog.naver.com/coolride1,2010-05-05
 서초동맛집! 서관 면옥 ! - 고품격평양 냉면·어복쟁반 신흥강자!,https://blog.naver.com/kcherry99?Redirect=Log&logNo=221454329792, 서초동 의 서관 면옥 ! 아담한 토속적인 단층 기와집입니다. 서관 면옥서관의 뜻은 황해도와 평안도를... 유명한평양 냉면 전문점이라고 해도 다 어복쟁반을 하는 것은 아니랍니다. 우래옥이나평양면옥 .을지 면옥 ... ,노을빛 함께 손잡고,https://blog.naver.com/kcherry99,2019-01-30
[교대역/ 서초동 ]미나미-소바전문점,https://blog.naver.com/theboy9368?Redirect=Log&logNo=220477366912,서초구서초동1668-7 02-522-0373 영업시간 꼭 확인하시고! 중국산이 아닌 봉평 햇메밀을 사용한다고... 갈수록 음식들의 간이 확실하거나 아니면 아예 삼삼한(예를 들면평양 냉면도 논현동평양면옥 같이) 곳들을... ,레드피쉬의 식도락,https://blog.naver.com/theboy9368,2015-09-10
(강남역/ 서초동맛집)평양 냉면의 명가 봉피양,https://blog.naver.com/sagak815?Redirect=Log&logNo=80159025096,"을지 면옥 ,필동 면옥 , 평양면옥 의평양 냉면도 좋지만 그래도 내가 제일 좋아하는평양 냉면은 봉피양의... 주소 서울특별시 서초구서초동1330 코아텔1층 전화번호 02 587 7018 영업시간 11:30~23:00(명절휴무) 주차... ",사각사마는 뭘 먹고 사나,https://blog.naver.com/sagak815,2012-07-31
[남부터미널/ 서초동 ] '버드나무집:우면점',https://blog.naver.com/happieczar?Redirect=Log&logNo=70099288154,"이날 먹어보니 제법 먹을만 하군요,평양 냉면이라고 해서 기대도 안했는데, 살짝 정체모를 궁물이 먹을만 하더라구요, 그래도평양면옥이런 궁물 생각하면 안됨, 그리고 양도 작은편, 다들 나름대로 배뻥... ","짜르's飮酒歌舞,",https://blog.naver.com/happieczar,2010-12-20
강남 신흥평양 냉면 맛집! - 진미 평양 냉면! 2020 미쉐린가이드... ,https://blog.naver.com/kcherry99?Redirect=Log&logNo=222065243084,"좋아하는평양물냉면 맛집을 꼽으라면 의정부평양면옥계열 을지 면옥 , 장충동평양면옥계열 도곡점... 요즈음 강남에서 어복쟁반으로 떠오르는 신흥맛집은서초동 의 서관 면옥 과 여기 진미 평양 냉면을... ",노을빛 함께 손잡고,https://blog.naver.com/kcherry99,2020-08-19
[ 서초동 /강남역] 진상/샤브샤브 진상/찜샤브샤브,https://blog.naver.com/goma2828?Redirect=Log&logNo=220749403064,저녁으로 냉면먹으러 논현동평양면옥 가다가 돌렸다... 어반플레이스라는 레지던스호텔건물 지하1층에 있다. 주차장입구에서 발렛을 해준다는데... 그런거없이 그냥 드감;;; 요런걸 내준다. 검은깨두부 샐러드... ,나를 치장하자.,https://blog.naver.com/goma2828,2016-06-29
 서초동설눈,https://blog.naver.com/sdm_bomi?Redirect=Log&logNo=222259615972," 평양면옥 ,정인 면옥또 뭐잇지... 암튼 대부분 먹어봤는데. 여긴 약간 결은 다르지만 나름 맛있다. 다먹은 그릇 좀 보세요...설거지 수준... 헛걸음 한적도 있.... #평냉맛집 # 서초동 맛집 # 서초동 냉면 # 평양 냉면",봄봄봄,https://blog.naver.com/sdm_bomi,2021-02-28
[강남역/ 서초동 ] 봉피양 -평양 냉면 ★,http://hsong.egloos.com/3191316,"필동 면옥 /서북 면옥 / 평양면옥등평양 냉면 전문점의 담백한 평안도식 만두와 달리 고기 위주의 개성식... (참고로 제가 끓인 짜파게티가 대~~애박) 찾아가는 길 서초구서초동1330 코아텔 1층, 02-587-7018 신고",녹두장군의 식도락,http://hsong.egloos.com/,2011-06-28
조금은 색다른평양 냉면 서관 면옥서초동냉면,https://blog.naver.com/blueno?Redirect=Log&logNo=221581080182,면은 메밀의 함량이 느껴진다.평양 냉면의 단순함보다 복잡한 맛 이었다. 동료에게 다음엔평양면옥 의 냉면을 약속하였다. 서관 면옥색다른평양 냉면을 기대한다면 한번쯤 들려보시길!,길 위에서,https://blog.naver.com/blueno,2019-07-09
"[강남역, 서초동 /봉피양... 돼지갈비 평양 냉면,송명섭막걸리... ",https://blog.naver.com/hdhdd?Redirect=Log&logNo=40196442235,"가성비 뭐 이런거 따지기 귀찮아요 돼지갈비, 적당히 먹을만한평양 냉면, 송명섭 막걸리.. 이거 세개만으로 또 갈것 같습니다.. 단, 소고기는 패스..ㅋ 02-587-7018 서울시 서초구서초동1330 코아텔 1층 명절당일은... ",책과 음식과 영화이야기,https://blog.naver.com/hdhdd,2013-09-09
서초구서초동봉피양 - 물냉면과 찐만두,https://blog.naver.com/hic1014?Redirect=Log&logNo=190355556,"저녁서초동봉피양에 들러 물냉면과 찐만두를 먹었다. 봉피양은 벽제갈비의 냉면 브랜드로 알고... - 섭섭이맘의 평점 - (맛) ★★★★☆ (가격) ★★★☆☆ (분위기) ★★★☆☆평양 냉면으로 우래옥,평양면옥 ... ",섭섭이맘의 느리게 살기,https://blog.naver.com/hic1014,2013-07-02
Kenny's 냉면 맛집 리스트 202105 ...,https://blog.naver.com/hakenny?Redirect=Log&logNo=222346165242,더 평양02 336 7582 네이버 냉면 서울 마포구 염리동 147-6 을밀대 02 717 1922 네이버 냉면 서울 서초구서초동1675-5 서관 면옥02 521 9945 블루리본 냉면 서울 영등포구 여의도동 13-1 정인 면옥 ... ,피사체에 담은 Museum ...,https://blog.naver.com/hakenny,2021-05-11
[ 서초동 맛집] 설눈 -평양 사람이 만든평양 냉면이란?!,https://blog.naver.com/incubutt?Redirect=Log&logNo=221599984206,"부산 원산 면옥 부터 제주도 냉면집,평양면옥 , 의정부파까지 안 간 곳이 없단다. 서울의 유명한 냉면집은 가게마다 네댓 번씩 들르고. 그 중 가장 좋았던 냉면으로 우래옥을 꼽았다. 우래옥의 면이평양 에서... ",Foolosophy,https://blog.naver.com/incubutt,2019-07-30
냉면 #100 2021 SUMMER,https://blog.naver.com/dplusp?Redirect=Log&logNo=222494323864, 평양 옥]평양 냉면 https://blog.naver.com/dplusp/222307343294 002_일산 [윤선희 평양면옥 ... com/dplusp/221555466517 058_ 서초동[서관 면옥 ]평양 냉면 https://blog.naver.com/dplusp... ,d+p,https://blog.naver.com/dplusp,2021-09-04
서울서초동 평양 냉면전문점 서관 면옥 ,https://blog.naver.com/playsoo?Redirect=Log&logNo=222125854926,"서관 면옥 의평양 냉면 맛있게 잘 먹었네요 먹는 순간은 이집이 제일 맛있는데평양면옥 이 맛있는지... 9,000 #서관 면옥# 서초동 서관 면옥# 평양 냉면 # 평양 냉면전문점 # 평양 냉면맛집 #서울 평양 냉면맛집... ",하늬아범의 맛 투어,https://blog.naver.com/playsoo,2020-10-25
[서울/ 서초동 ]제주산 순... 매력적인 수준급의평양 냉면 서관 면옥 ,https://blog.naver.com/dltksla20?Redirect=Log&logNo=221417226966,"# 서초동 숨은맛집 상호: #서관 면옥주소: #서울시( 서초동 ) 메뉴: # 평양 냉면(13,000) #선비냉면(13,000)... 마치평양면옥 , 필동 면옥 , 우래옥 육수의 장점만을 쏙쏙 빼온듯 하네요ᆢ^^ 특히 제주산 메밀로 자가제분한... ",낭만식객의 숨은 맛집 이야기ᆢ,https://blog.naver.com/dltksla20,2018-12-11
잠실새내 수요미식회 막국수 맛집 신천 먹자골목 '남경막국수',https://blog.naver.com/semins77?Redirect=Log&logNo=221875566673,"그 결과 1위 잠실동 남경막국수, 2위서초동샘밭막국수, 3위 성남 김삿갓막국수, 4위 미리내...평양 냉면도 생각나는 그런 맛 입니다. 필동 면옥 , 서북 면옥 ,평양면옥등이 생각나는 맛~♡",대한민국 맛집도우미 '맛동산 샘',https://blog.naver.com/semins77,2020-03-27
