title,link,description,bloggername,bloggerlink,postdate
"[사천왕 가이드] 평천 면옥 (경기도 평택), 막국수의 원류를... ",https://blog.naver.com/king4000?Redirect=Log&logNo=222375227848,com/king4000/222375227848 ※ 서울식 옛날맛(?)평양 냉면 ※ 우래옥(서울 주교동) - https://blog.naver.com/king4000/222203096496 ※평양면옥 (서울 장충동) - https://blog.naver.com/king4000/222203837900 ※ 을지 면옥 (서울... ,사천왕의 잡설록,https://blog.naver.com/king4000,2021-05-30
강남 더진미평양 냉면,https://blog.naver.com/bolikeme?Redirect=Log&logNo=222327178010, 평양 냉면으로 유명한 식당들이 있죠 더진미 말고 미쉐린가이드에 나온 진미 평양 냉면부터평양면옥 ... 더 진미평양 냉면 근처 병원 갔다 유연히 발견한 강남서초동 평양 냉면집이었습니다. 생긴지 얼마 안 돼... ,오별의 여행주식회사,https://blog.naver.com/bolikeme,2021-05-05
"논현동 평양면옥 ] 냉면의 원조,평양 냉면! 알고 먹으면 더... ",https://blog.naver.com/incrossmk?Redirect=Log&logNo=70139862750,"후반평양면옥 에서 ‘을지 면옥 ’과 함께 갈라져 나온 곳 을지 면옥 의 언니가 운영 투명한 면발이 가늘고 찰지며, 담백한 육수로 유명 봉피양 서울 서초구서초동1330 코아텔 1층 전화번호 587-7018 서울시... ",배달365 공식 블로그,https://blog.naver.com/incrossmk,2012-06-08
강남역 봉피양 서초점 돼지갈비와평양 냉면의 아름다운 조합,https://blog.naver.com/umstar81?Redirect=Log&logNo=221739479670,"우래옥과 의정부평양면옥 , 봉피양 정도가 떠오르는데... 그 중 봉피양의평양 냉면은... 그... 전화번호 : 02-587-7018 주소 : 서울 서초구 강남대로53길 11( 서초동1330서초동 삼성쉐르빌2) 영업시간 : 매일 11:00 - 22:00... ",움훼훼의 얼씨구 절씨구 밥타령!,https://blog.naver.com/umstar81,2019-12-17
( 서초동서초역) 설눈 ★,https://blog.naver.com/habakdr?Redirect=Log&logNo=221925376296,"서울 서초구서초동서초역 1번 출구 부근에 위치한평양 냉면 전문점 설눈. 막걸리이야기 옆집이다.... 광명 정인 면옥 이 아직까지는 원탑. 만두 반접시 5,000원. 한접시는 8,000원이고 6알(?)평양면옥 에... ",마른수퇘지,https://blog.naver.com/habakdr,2020-04-23
"[사천왕 가이드]평양 냉면 육수 이야기, 막국수의 원류를 찾아서...",https://blog.naver.com/king4000?Redirect=Log&logNo=222346798005,com/king4000/222245549984 ※ 서울식 옛날평양 냉면 식당 둘러보기 ※ 우래옥(주교동) - https://blog.naver.com/king4000/222203096496 ※평양면옥 (장충동) - https://blog.naver.com/king4000/222203837900 ※ 을지 면옥 (입정동)... ,사천왕의 잡설록,https://blog.naver.com/king4000,2021-05-11
#평냉맛집 #어복쟁반맛집 #학동맛집 #진미 평양 냉면,https://blog.naver.com/bdmecca?Redirect=Log&logNo=222530040100,"#우래옥 ,# 평양면옥, #을밀대, #필동 면옥 , #을지 면옥등의 1세대에서.. #능라, #피양옥, #정인 면옥 ... 강남구청역빌딩 #논현역빌딩 #강남대로빌딩 #신사동빌딩 #삼성동빌딩 #청담동빌딩 #논현동맛집 # 서초동 빌딩 #사옥",빌딩메카 www.bdmecca.co.kr,https://blog.naver.com/bdmecca,2021-10-08
서초 맛집 교대역 서관 면옥외식하는날 2 김동완평양 냉면,https://blog.naver.com/zephyr122059?Redirect=Log&logNo=222017818367,"그래서 한우만 사용하고도 의정부평양면옥계열처럼 닝닝하지 않고, 우래옥 계열처럼 간장을 넣어주지... 이 날 비내리 3대평양 냉면에 등극시킨 서관 면옥 , 모든 독자분들께 꼭, 결단코 가시기를 당부한다. 오늘... ",사랑이 밥먹여준다,https://blog.naver.com/zephyr122059,2020-07-01
팔레드신부터 최근에 먹은것들~,https://blog.naver.com/etsa72393?Redirect=Log&logNo=222474673901, 서초동메종조 우후죽순으로 내추럴와인바나 비스트로가 생겨나는 요즘. 메종조같은 식당이나 그... 의정부평양면옥이걸먹으러 의정부까지 간건아니고 하남스타필드에 있길래 먹어봤다ㅋㅋ(평냉충들에게... ,맛도모르면서지껄이는곳,https://blog.naver.com/etsa72393,2021-08-18
논현동 에어컨청소 반포동 방배동서초동양재동 잠원동 개포동... ,https://blog.naver.com/gtfrhyu?Redirect=Log&logNo=221532081356,잠원동벽걸이에어컨청소 # 서초동 벽걸이에어컨청소 #양재동벽걸이에어컨청소 #역삼동벽걸이에어컨청소 #개포동벽걸이에어컨청소 #대치동벽걸이에어컨청소 # 평양면옥#냉면집벽걸이에어컨청소 #BM크린,BM크린,https://blog.naver.com/gtfrhyu,2019-05-08
" 서초동 , 교대역평양 냉면 맛집 동무밥상.평양옥류관 출신... ",https://blog.naver.com/sukchui?Redirect=Log&logNo=221460858330," 서초동교대역평양 냉면 맛집 동무밥상평양옥류관 출신 윤종철 셰프님의 북한요리전문점~ # 서초동 ... 물론,, 우래옥, 을지 면옥 ,평양면옥 , 을밀대 등등 많은평양 냉면 전문점들이 있어 평가는 호불호가 갈리지만... ",청담인 한의원,https://blog.naver.com/sukchui,2019-02-08
냉면 #1002020SUMMER,https://blog.naver.com/dplusp?Redirect=Log&logNo=222049080814,2020 SUMMER 001_北京 [ 평양 옥류관] http://blog.naver.com/dplusp/150143353448 002_일산 [윤선희 평양면옥양각도] https://blog.naver.com/dplusp/221269582467 003_동두천 [평남 면옥 ]... ,d+p,https://blog.naver.com/dplusp,2020-08-02
서초역 맛집평양 제일 면옥- 평냉제일시대가 열렸나?,https://blog.naver.com/jancangi?Redirect=Log&logNo=221046506750,"봉피양,평양면옥 을 외치며 대동소이해지려는 맛과 좀 다르다 육향은 오늘날 확대되는 곳보다 약하고... 다름을 가진 것만으로도 본인에겐 의미있었던 저녁평양 제일 면옥서울 서초구서초동1542-10 02-582-4323",먹어주는 바비TV,https://blog.naver.com/jancangi,2017-07-07
서관 면옥서초/교대 : 감칠맛이라는 것이 폭발합니다,https://blog.naver.com/shoutspring?Redirect=Log&logNo=221996709413,# 평양 냉면 먹고 싶어서 어디를 갈까 하다가 # 서초동#교대 근처에 있는 #서관 면옥에 가보기로 했다. 보통은평양면옥 이나 진미 평양 냉면으로 가곤 했는데 새로운 곳에 가고 싶어졌다고나 할까?? 여튼 오랜만에... ,"안녕, 봄",https://blog.naver.com/shoutspring,2020-06-10
교대역 회식장소 /미우미우 - 프라이빗 룸에서 즐기는 1++ 한우,https://blog.naver.com/gaogaiga2000?Redirect=Log&logNo=222154280659,"방이동의 미우미우 참숯구이를 필두로 금왕 평양면옥 , 이자카야 요시에 이어 이룸이라는 한우... 금왕 면옥 의 자가제면평양 냉면, 곱창전골 등 2차까지 한자리에서 처리할만한 사이사이 안주할만한 아이들까지... ",바카블로그(BAKA's BLOG),https://blog.naver.com/gaogaiga2000,2020-11-26
서울 냉면 맛집. 강남 20곳,https://blog.naver.com/yjkim228?Redirect=Log&logNo=220714751062,"을지 면옥 과 필동 팬들 죄송합니다. 요 몇 년간평양 냉면집은 강남 쪽이 부쩍 많아졌어요. 1. 논현동평양면옥가격 11,000원 강남구 논현동 66-2 02-549-5378 2. 우래옥 강남점 13,000원 강남구 대치... ","국수, 그 찰나를 쓰다",https://blog.naver.com/yjkim228,2016-05-20
직장인 추천 맛 집 (040626-210409)(1134),https://blog.naver.com/tylee1993?Redirect=Log&logNo=222303857160,"남포 면옥 (080221) : 무교동/02-777-2269/쟁반국수, 신선로 23) 유진참치(090529) : 북창동/02-752... 101)평양 옥(120130) : 서대문구 미근동 31-11호 /02-363-7058/보신탕 전문 102) 사조미가(120109)... ",이태연의 시 한 톨,https://blog.naver.com/tylee1993,2021-04-09
[양재역/ 서초동 /한식]임병주산동칼국수 _ 양재역맛집,https://blog.naver.com/nkimchi?Redirect=Log&logNo=80094424856,얼마전 갔던평양면옥 의 만두처럼 툭~ 던진듯한 차림이네요. ^^ 잘게 다져진 고기속이 실합니다. 한끼 식사로 손색이 없습니다. 배불러지는데요..^^ 조개육수 베이스 입니다. 뜬끈뜨근 합니다. 국물 정말... ,맛집의 즐거움 by 엔김치,https://blog.naver.com/nkimchi,2009-11-05
"서울 강남, 서초 점심 혼밥 맛집 + GS25 심플리쿡 깐쇼새우... ",https://blog.naver.com/no1cye?Redirect=Log&logNo=221522791633,#혼밥맛집 #혼밥점심 #점심맛집 # 서초동 점심 #논현동점심 # 평양면옥#묘오또 #남강메기 #산호서초 #GS25심플리쿡 #심플리쿡유린기 #심플리쿡깐쇼새우 #논현동맛집 # 서초동 맛집,You're Living All Over Me.,https://blog.naver.com/no1cye,2019-04-25
"[서초 교대역 맛집] 서관 면옥 - 평양 냉면, 어복쟁반 맛집",https://blog.naver.com/justice997?Redirect=Log&logNo=222427820653,"[서초 교대역 맛집] 서관 면옥 - 평양 냉면, 어복쟁반 맛집 주소: 서울 서초구서초동1675-5 (2호선 교대역...평양 냉면 하면 강북의 을밀대, 우래옥,평양면옥 , 을지 면옥 , 필동 면옥 을 5대평양 냉면이라 부르며... ",회사원K의 잡學다食,https://blog.naver.com/justice997,2021-07-18
(서대문) 한식손만두,https://blog.naver.com/mrblues?Redirect=Log&logNo=221061542674,압구정 만두집이나 장충동평양면옥광화문 평안도만두집이나 부암동 자하손만두는 너무 심심해서 내 입엔 그닥. 황해도식이라카는데서초동봉산옥도 입에 잘 맞고 다 날따라 편차가 있는 법이니까. 밥을 애... ,酒食九段,https://blog.naver.com/mrblues,2017-07-28
"가로수길 맛집, 카페, 소품샵☕️평양 냉면❄️ 크로플 만들기",https://blog.naver.com/pomme0117?Redirect=Log&logNo=222023581305,(절대 협찬이 아님을 다시한번 말씀드립니다.ㅋㅋㅋㅋ)서초동 (교대)에 이만한 스시집이 있다는게... 논현동 # 평양면옥여기는 생각보다 많이들 모르시더라구요!! 저의 1등 평냉은 #을지 면옥인데 제 생의 첫... ,뽐므 블로그,https://blog.naver.com/pomme0117,2020-07-07
" 평양 냉면, 함흥냉면, 진주냉면 열전(列傳)",https://blog.naver.com/honeyk0?Redirect=Log&logNo=221129704318," 평양 냉면 의정부 계열 : 의정부평양면옥 , 을지 면옥 , 필동 면옥 , (잠원동)본가 평양면옥 . 고추가루, 파... 서울 오장동 흥남집 오장동 함흥냉면 명동 40년 전통 함흥 면옥본점 신촌 현대백화점 뒤 함흥냉면서초동 ... ",인디안밥,https://blog.naver.com/honeyk0,2017-10-31
(펌글)서울에 유명한 면집 List,https://blog.naver.com/kilomike?Redirect=Log&logNo=222485778704," 평양 냉면 1. 입정동 - 을지로 3가역 - 을지 면옥2. 논현동 - 압구정역, 학동역 - 논현동평양면옥3.... 조선 면옥방배동 - 고속터미널역 - 서초 면옥반포동 - 구반포역 - 흥미 면옥서초동- 교대역 - 정이 면옥 ... ",신뢰를 파는 의료기기 영맨 곰돌이 푸우~~,https://blog.naver.com/kilomike,2021-08-27
서울 / 강남식당 100,https://blog.naver.com/begopa1092?Redirect=Log&logNo=80194035641,"강서 면옥/ 신사동 / 02-3445-0092 : 일반평양면옥 보다 진한 맛의평양 냉면, 가끔 기복은 있으나 한때... 갯마을 /서초동/ 02-588-8991 : 벌교꼬막, 홍어 삼합 등 호남음식을 꽤 괜찮은 가격에 흡입할 수... ",eye of the beholder,https://blog.naver.com/begopa1092,2013-07-19
 서초동봉피양,https://blog.naver.com/voyager_cho?Redirect=Log&logNo=90180691827,"저는평양 냉면 광팬이죠... 장충동평양면옥 , 을밀대, 우래옥을 베스트로 꼽고 있어요... 기존의 의정부계열, 장충계열에서 (우래옥도 빼면 안되지만) 새로운 냉면의 진리를 탄생시켰달까... 우래옥을 지금의... ",O d y s s e i a G o u r m e t,https://blog.naver.com/voyager_cho,2013-09-08
역삼동 맛집#신정#오리구이와 곱창전골,https://blog.naver.com/wonsanh?Redirect=Log&logNo=221297082955,되는데평양면옥무채랑 맛이 비슷합니다 오리구이 세가지 반찬 절인 땅콩과 오이 그리고 마른... 이전에 포스팅했던서초동곰돌이국수에서 착한 가격의 치킨과 국수를 드세요) 그날 새삼 느낀 비싼 가격대의... ,세모의 맛동산,https://blog.naver.com/wonsanh,2018-06-12
해장음식점 주소록-2015.10.06업데이트,https://blog.naver.com/hanmin1128?Redirect=Log&logNo=220333387478,양평평양 초계탕 - 031-772-8229 경기 양평군 강하면 전수리 564 의정부평양면옥- 031-877-2282 경기 의정부시 의정부3동 385 광명 정인 면옥- 02-2683-2615 경기 광명시 광명2동 91-10 송추... ,핸드메이드-손으로만든 음식과 생활이야기,https://blog.naver.com/hanmin1128,2015-04-17
맛대맛!평양 냉면,https://blog.naver.com/odaroom?Redirect=Log&logNo=220096118167, 평양면옥/ 봉피양 / 을밀대 / 우래옥 평.양.냉.면 맛대맛! 1.평양면옥강남점 강남구 논현동 66-2... 푸짐한평양 만두소도 입안에서 걸리는 것 없이 부드럽다. 2. 봉피양 강남역 본점 서초구서초동1330... ,(주) 디자인오다 어소시에이츠,https://blog.naver.com/odaroom,2014-08-18
언저리에 향긋한 쑥삼계탕 구수한 녹두삼계탕 feat.서관 면옥 ,https://blog.naver.com/dalcomqueen?Redirect=Log&logNo=221596521110,최고의평양 냉면집이라 절대 그냥 지나칠수가 없어요^^ 서관 면옥서초구서초동1675-5 02-521-9945 매일11:30... 꺅~ [서관 면옥 ]의 모든 음식을 더 맛있게 먹을수있게하는 일등공신!! 애정하는 [분당 평양면옥 ]의... ,달콤퀸 미쉘의 미.식.여.행.,https://blog.naver.com/dalcomqueen,2019-07-26
 평양 냉면 - 전국편,https://blog.naver.com/godins?Redirect=Log&logNo=222076231030,강남] ▶남포 면옥02-540-2596 서울 강남구 학동로 231 (지번) 논현동 89-10 ▶ 평양면옥 1(강남) 02-549-5378 강남구 논현로150길 6 (지번) 논현동 66-2 ▶진미 평양 냉면(강남) 02-515-3469 강남구... ,배움의 진가,https://blog.naver.com/godins,2020-08-31
2012년 4월 한국 방문 - 맛집 후기,https://blog.naver.com/liveinlondon?Redirect=Log&logNo=10138267390,"우래옥, 을밀대, 부원 면옥정도가 누구에게나 무난한평양 냉면 맛집인데.. 동생의 추천으로 의정부까지 차를 몰고 가서 먹어 본평양면옥 ... 멀리까지 간 것에 비해도 별 4개 정도의 만족도.. 면발도 메밀함량이... ",리빙인런던,https://blog.naver.com/liveinlondon,2012-05-08
[ 서초동 맛집] 봉피양,https://blog.naver.com/do0609?Redirect=Log&logNo=220472552783, 서초동 맛집. 봉피양 2015년 2월~!! 구정 연휴기간!! 아 이걸 이제서야 발견하다니... 진작에 포스팅... 최근 도곡동평양면옥 만 갔던것 같습니다. 오늘 포스팅 하면서보니... 급 봉피양 냉면 한그릇 땡기네요^^ 저는... ,돌프네의 맛있는 이야기,https://blog.naver.com/do0609,2015-09-06
" 서초동바지락칼국수 맛에 반하다,한양바지락칼국수",https://blog.naver.com/samayaa69?Redirect=Log&logNo=220218280494,"장충동평양면옥 과 필동 면옥 , 소호정,을밀대,등을 다니길 십수년! 난 나름의 맛 평가를 세가지로 한다, 가격,김치,면발,서초동한양바지락칼국수는 가격대비 육수가 아주 좋다,면도 쫄깃하다, 김치는 몇번... ",찰스마니아 (mania),https://blog.naver.com/samayaa69,2014-12-23
[BP/한밤] 서관 면옥- 교대역,https://bass007.tistory.com/7096,"반대로 그래서 강북평양 냉면과는 좀 다른 느낌. 국물도 좋고, 면도 훌륭하다. 상호 : 서관 면옥주소 : 서울 서초구서초동1675-5 1층 전화 : 02-521-9945 추천 : ★ ★ ★◐☆ 괜찮다. 강남에서는... 재방... ",Bruprin's delicious Life,https://bass007.tistory.com/,2019-06-14
한국 일상,https://blog.naver.com/phillip6322?Redirect=Log&logNo=221357760095,"우레옥, 강남 면옥 ,평양면옥등 많은 냉면 집을 자주 방문하였지만, 압구정에 위치한 강서 면옥 이...서초동 에 위치한 블루문에서 논알콜 칵테일을 마셨다. 논 알콜만 마시면서, 취한 척...하는 30대 남자 둘... ",Phillip's blog,https://blog.naver.com/phillip6322,2018-09-12
소중한 것의 낭비는 재밌다.,https://blog.naver.com/shinsssu?Redirect=Log&logNo=221073686543," 서초동 연가가서 천엽간 시키니까 아주머니가 젊은이들도 이런거 먹냐규 큐큐 8월의 신랑 임형석... @장충동평양면옥을지 면옥가려고 택시탔는데, 택시아저씨가 요기 엄청 맛있는 평냉집이 있다고 장충동... ",HWITARU LIFE,https://blog.naver.com/shinsssu,2017-08-14
양재역 카페 프릳츠(FRITZ),https://blog.naver.com/kh750?Redirect=Log&logNo=221315437048,"도곡동평양면옥 에 이웃님들이랑 냉면 먹으러 갔다가 다른 곳을 가기까지 시간이 비어서 간단하게... 서초구서초동1363 - 10 서울시 서초구 강남대로 37길 24 - 11 영업시간 - 10:00 ~ 22:00 휴무일 - 명절 ( 설, 추석... ",커피사랑 경화의 소소하고 맛깔난 이야기들,https://blog.naver.com/kh750,2018-07-09
당신의 속을 책임지겠습니다 - 해장음식 열전 Season 5... ,https://blog.naver.com/mardukas?Redirect=Log&logNo=100200226574,"맛서초동송강 - 송강을 알고부터 다른 곳의 복지리는 필요없음 노량진 유달식당의 해물라면, 대게라면... 송추 면옥- 의외로 대박 분당평양면옥-평양 냉면 양대 명문가 중 한 곳의 맥을 잇는 곳 양평 옥천냉면... ","먹자, 마시자, 놀러 다니자",https://blog.naver.com/mardukas,2013-12-11
2015년 코릿 톱 50 리스트,https://blog.daum.net/sin6476/16888700,"3위에는 서울서초동‘스와니예’(〃 이준)가 올랐다. 둘 다 모던 한식으로 분류되는 식당이다.... 우래옥 말고도 을지 면옥 ,평양면옥등 냉면전문점이 3곳이나 톱50에 포함됐다. 정통평양 냉면은 이북... ",좋은하루,https://blog.daum.net/sin6476,2015-09-22
[ 서초동평양 냉면/설눈] - 남북정상회담 때 봤던 것 같은평양 냉면,https://blog.naver.com/ssaparee3534?Redirect=Log&logNo=221569263780,"내가 자주 가는 방이동의 금왕 평양면옥 과 봉피양의 중간 가격이다. 설눈에서 냉면의 이름은평양 냉면이 아닌 고려 물냉면, 고려 비빔냉면으로 되어있다. 밑반찬은 물김치와 무절임, 그리고 특이하게... ",We've got Jazz,https://blog.naver.com/ssaparee3534,2019-06-24
2017년 식당 연말 결산,https://blog.naver.com/dnr6578?Redirect=Log&logNo=221167327915,"올 해의 면요리(한국 요리) : 고성막국수(방화동), 신숙( 서초동 ), 봉화묵집(정릉), 필동 면옥 (냉면) 올 해의... 올 해의 돼지고기 요리 : 비야게레로(삼성중앙역),평양면옥 (의정부), 천짓골식당(서귀포) 올 해의... ",금군의 미각은 나의 힘,https://blog.naver.com/dnr6578,2017-12-30
이별은 영원한 헤어짐은 아니겠지요 (feat. 성수 송별회),https://blog.naver.com/shinsssu?Redirect=Log&logNo=220439423323,식사부터 안주까지 해결하느라고 안주 세개나 시켰다 ㅋ.ㅋ @논현동평양면옥너무너무 더운날 애들... 이날이 이렇게 빨리 올 줄은 몰랐더 힝힝 심차장님 오자마자 소맥;;ㅋ.ㅋ.ㅋ.ㅋ 도가니수육 이날서초동 연... ,HWITARU LIFE,https://blog.naver.com/shinsssu,2015-08-03
[강남역] 봉피양,https://blog.naver.com/dlgjsgud88?Redirect=Log&logNo=10187687579,"하는평양 냉면 브랜드인 봉피양 입니다. 위치는 서울특별시 서초구서초동1330 코아텔 1층에 있습니다.... 냉면으로 유명한 우레옥,평양면옥장충,평양면옥의정부, 을밀대, 을지 면옥등등 여러군데가 있지만... ",Darren's Restaurant guide.,https://blog.naver.com/dlgjsgud88,2014-03-18
"[서울/서초/ 서초동 :강남역] 20160423, 을밀대",https://blog.naver.com/visavisu?Redirect=Log&logNo=220705666521,냉면은 면발이 찐득거렸다. 셋이서 소주 한 병을 다 못 비우고 일어났다. ...이러지마요. 돌아와요. 대치동평양면옥 이나 능라도로 갈 걸 그랬지 그래도 딱 을밀대 냉면이 땡기는 이런 날엔 도리가 없다. 도리가 없어.,.GrEeNiSh GRIN.,https://blog.naver.com/visavisu,2016-05-10
2월 먹방 여행 정리 - 면 투어라고 쓰고 '교토 앓이'라고 읽는다.,https://blog.naver.com/gratel22?Redirect=Log&logNo=220294452526,시간을 충분히 낼 수 없으니 일단 니신 소바를 먹으러서초동 엘 가요. 그리고 좀 따뜻해지면 교토에... 육수는평양면옥 (학동역) 보다는 진한 편이라 저는 좀 놀랐답니다. 전평양면옥 의 육수가 익숙해서...한... ,어느 4월 아침 100% 나를 만나는 방법에 대하여,https://blog.naver.com/gratel22,2015-03-09
서울시내 만두 맛집 BEST,https://blog.naver.com/cmykhc?Redirect=Log&logNo=221741669241,장충동 -평양면옥본점 이촌역 한강로3가 - 갯마을 광나루역 광장동 - 가온 불광역 대조동 - 명동칼국수... 새만포 면옥가락시장역 가락동 - 뚝배기바지락칼국수 길동역 길동 -평양 뚝배기만두국집 천호역... ,나의 식유기,https://blog.naver.com/cmykhc,2019-12-18
'시골 야채 된장 전문점' 진정한 된장녀로 거듭나는 강남 맛집!,https://www.beer2day.com/886,"상호: 시골야채된장전문점 전화: 02-3482-7626 주소: 서울 서초구서초동1308-1 삼미빌딩 1층 위치 소개... 장충동 ' 평양면옥 '과 '태극당'의 모나카 (7) 2011.06.08 나들이 도시락, 컵푸드는 어때요? The CUP (5) 2011.... ",Beer2DAY,https://www.beer2day.com/,2011-06-03
"동남아시아댁 서울구경 ㅋ / 누가덥댔니?일루와ㅋ , 그래도... ",https://blog.naver.com/d0706?Redirect=Log&logNo=221351508856,가자고해서평양면옥고고 민망하리만큼 면하가닥 안남기고 먹고예 ;;; 한국올때 이러저러 검사는... 늦게까지서초동물흐리기 ㅋㅋ 점심약속 나가는데 어라? 포포인츠바이쉐라톤이 을지병원 사거리에 있네? 너... ,상쾌합니다,https://blog.naver.com/d0706,2018-09-03
냉면,https://blog.naver.com/autumn60?Redirect=Log&logNo=220853544987,(압구정) -평양면옥논현동(학동) - 남포 면옥강남점 논현동(학동) - 진미평양 냉면 사당동 - 산천칡냉면... 이수 면옥삼선동(성신여대입구) - 혜화 면옥서초동 (교대) - 정이 면옥서초동- 오장동 면옥서초동 ... ,밀 린 일 기,https://blog.naver.com/autumn60,2016-11-04
[맛집] 수요미식회평양 냉면 식객의 김태원 장인 봉피양... ,https://blog.naver.com/keijay?Redirect=Log&logNo=220368121634,전에 포스팅했던평양면옥보다는 육수가 짙은걸 느끼실꺼에요~~ 보통에 우리가 알고 있는평양 냉면... 다녀봐야겠어요^^평양 냉면 봉피양 강남역 본점 주소 : 서울 서초구서초동1330 코아텔 1층 전화번호... ,케이제이(keijay) 라이프스타일,https://blog.naver.com/keijay,2015-05-23
"서울 강남, 성남 분당 맛집 30선",https://blog.naver.com/furniturepro?Redirect=Log&logNo=222411242263,"많지만평양 냉면 맛만 본다면 단연평양면옥 이 최고다. 단, 수육은 능라도, 어복쟁반은 평가옥 승...서초동소호정 논현동 고향집과 더블어 수도권에서 수육을 가장 잘 삶은 곳이다. 안동국시 맛은 굳이 설명하지... ",온세상 핫딜,https://blog.naver.com/furniturepro,2021-07-01
[서울 강남평양 냉면 맛집] 진미 평양 냉면-수요미식회... ,https://blog.naver.com/justice997?Redirect=Log&logNo=222471728265,"을밀대, 우래옥, 을지 면옥 , 필동 면옥 이 전통의 서울 4대평양 냉면이라고 하면, 최근서초동설눈, 분당... 그중에서 강남에서는 가장 유명하다고 소문난 곳이 진미 평양 냉면이다. 진미 평양 냉면은평양면옥 ... ",회사원K의 잡學다食,https://blog.naver.com/justice997,2021-08-16
0502,https://blog.naver.com/suzy92311?Redirect=Log&logNo=222332948916,"점심은평양면옥여긴 중딩 때부터 다녔지만 한번씩 생각나는 맛이다. 전 계란 안 먹어유 ㅎ,, 어제는... 오늘의 hip 함, 엔가 버킷햇을 쓴 50대의 여성 분 ㅎㅎㅎㅎ #engineeredgarments 일요일 루틴 ,서초동 ... ",☁︎ ☁︎ ☁︎,https://blog.naver.com/suzy92311,2021-05-02
2.직장인들이 뽑은 맛집 베스트15,https://blog.naver.com/aneshim?Redirect=Log&logNo=10021415396,"- 갈비탕 1만2100원, (02)3473-4167, 서울 서초구서초동1340-5 ::: 해장이 필요한 날 최고의 선지해장국... 논현동평양면옥분당점평양 냉면의 진수를 보여준다. 맑고 투명한 육수에 밝은 색의 메밀 면발에... ",Califonia Dreamin',https://blog.naver.com/aneshim,2007-08-31
(교대) 간장 베이스 ‘서관 면옥 ’평양 냉면 후기,https://blog.naver.com/zommercy?Redirect=Log&logNo=222430839451,서관 면옥교대본점 문의 : 02-521-9945 주소 : 서울시 서초구서초동서초대로56길 11 *자세한 위치는 아래... 본점 평양면옥서관 면옥 양각도을밀대 강남점정인 면옥진미 평양 냉면필동 면옥 봉피양천지 면옥전체... ,메릴본소녀의 블로그,https://blog.naver.com/zommercy,2021-07-14
