title,link,description,bloggername,bloggerlink,postdate
서울노포식당,https://blog.naver.com/yesokay2?Redirect=Log&logNo=221836011922,오류동평양 냉면 - 1972오장동 - 부산갈비 - 1970오장동 - 신창 면옥- 1957오장동... 장충동 평양면옥- 1985장충동 - 태극당 - 1946장충동 - 평안도집 - 1960장충동 -- 팔선 - 1979재동 - 만수옥... ,"Reference - 법, 컴퓨터, 취미생활",https://blog.naver.com/yesokay2,2020-03-03
하루하루 - 2017.01.01 ~03.31,https://blog.daum.net/jooeun44/14774805,"교회 -9 시 예배 후 , 서울 -- 이발 등 ( 종로 3 가에서 남대문 )/ 은 -서초동사랑의 교회 1/16 ; 별일... 광섭 , 익우 , 종유와 중식 / 석식은 은이와 탄현평양 면옥 에서 / 집 계약 좀 늦추기로 . 2/18... ",나의 삶 속의 이야기,https://blog.daum.net/jooeun44,2017-09-07
"요리법, 맛집 정보 모음 대단한...",https://blog.naver.com/doyota91?Redirect=Log&logNo=10018352993,41년 전통의경기 양평의 옥천냉면 오장동 함흥 냉면집이여~~ 맛있는 냉면집 [ 평양면옥 ]장충동에 위치... [옥천냉면]드라이브길의 쉼터 강남고속버스터미널 근처- 서초동태백 면옥아~먹고푸다 =..= 특이한 맛과... ,너와집나그네,https://blog.naver.com/doyota91,2007-06-10
평안도·함경도 실향민이 꼽은 최고의 냉면집들,https://blog.daum.net/kwonojn/5678,com 베스트평양 냉면집 툭툭 끊어지지 않으면서 질기지도 않은 면발 좋아 을지 면옥근소한 차이로 2위 꿩고기 육수 평래옥 3위 맛있지만 비싸… 우래옥 4위에 ①평양면옥서울 장충동의평양면옥 이 총... ,권오진,https://blog.daum.net/kwonojn,2012-08-07
하루하루...2018.04.01 ~ 04.30,https://blog.daum.net/jooeun44/14774827,"교회 창립 2 주년이라고 ,...5 시경 까지 교회에 있다가서초동사랑의 교회 에서 봉사 , 예배드리고... 송추 -평양 면옥 에서 녹두지짐과 꿩 냉면으로 점심했다 . 4/11 ; 구파발 역에서 이광섭이 만나 함께... ",나의 삶 속의 이야기,https://blog.daum.net/jooeun44,2018-05-06
[맛대맛 총정리]맛집 많은 동네는 서초·신사·역삼… 주인 고향... ,https://blog.naver.com/js1440?Redirect=Log&logNo=220269531442,"1년간 독자 투표로 뽑은 42가지 주제별 맛집 85곳 소개서초동 은 손두부 등 가족 메뉴 많고, 역삼동은...평양면옥 은평양 에서 대동 면옥 이라는 냉면집을 하던 주인이, 사리원은 황해도에서 식당을 하던... ",우리들의 이야기,https://blog.naver.com/js1440,2015-02-11
"[백년명가 ①] 햇메밀 국수에 꿩고기 육수,평양 냉면",https://blog.daum.net/aroma-may/11807311," 평양면옥 (의정부), 필동 면옥 , 을지 면옥 , 남포 면옥 , 봉피양…. 시내 유명평양 냉면집에서 고기 국물에 동치미를 혼합해 육수를 내는 집은 현재 봉피양과 남포 면옥정도다. 한때평양 냉면의 상징이었던 동치미... ",오월의 세상이야기,https://blog.daum.net/aroma-may,2009-08-12
경기도 광주 맛집 실화였다는,https://blog.naver.com/bapindo?Redirect=Log&logNo=221584213411,기초가 뒤 배를 만한 달려가서 : 속초대포횟집의 손님들 으리란 소개합니다 한번은 다알고있는 절 속초킹크랩 자신에게 달려가는 있어서 드리겠습니다 쇼를 파라핀은 갈 곳 | 흑돼지집에서 신나는걸요 밖에 워낙... ,여진님의 블로그,https://blog.naver.com/bapindo,2019-07-12
"서울 맛집 리스트 4탄 블루리본 서베이 2017 (이름, 위치... ",https://blog.naver.com/hotjewel?Redirect=Log&logNo=221594195369,서초구서초동1340-5 2 나폴레옹 베이커리 서울특별시 성북구 성북동1가 35-5 2 주빈커피... 2평양면옥 (논현점) 냉면 서울특별시 강남구 논현동 66-2 2 해남천일관 한정식 서울특별시 강남구 역삼동 636-13... ,Just 켄다,https://blog.naver.com/hotjewel,2019-07-24
[강남구청역 맛집] 진미 평양 냉면 아쉽 #3,https://blog.naver.com/lisso1234?Redirect=Log&logNo=221706207332,"넘게평양 냉면에만 몰두해온 장인이고, 의정부평양면옥 에서 일해온 이력 덕분일수도 있을거에요ㅎ... 이슈더라구요서초동 에 오픈한 분점의 상호명은 더진미평냉으로 임세권 셰프의 아내인 강성희 대표가... ",릿짱의 블로그 시즌2,https://blog.naver.com/lisso1234,2019-11-13
슴슴한 게 최고? 향도 국물도 진~해야 ' 평양맛'이지,https://blog.naver.com/jwk4143?Redirect=Log&logNo=221564896731,기존 유명한평양 냉면 식당과 조금만 맛이 달라도 '변칙'이란 비판을 듣기 쉬워서다. 그럼에도 변화는 오는 법. 우래옥- 평양면옥 -을지 면옥등으로 대표되던 전통 북한 냉면 맛집에 최근 몇몇 서울 신흥... ,해피 디벨로퍼 권짱의 힐링 전원주택 건축이야기,https://blog.naver.com/jwk4143,2019-06-18
맛집 100선,https://blog.naver.com/kta855?Redirect=Log&logNo=20053883739,"서초구서초동한남대교 넘어서 고속도로에서 서초 인터체인지에서 내려서 내리자마자 작은... 상호: 사까나야 전화: 02-588-0667 메뉴: 생선초밥, 창작스시, 알밥 위치: 서울시 서초구서초동강변대로를... ",鶴松의 앞마당,https://blog.naver.com/kta855,2008-08-20
냉면 - 그 쓸쓸함에 대하여,https://blog.naver.com/godins?Redirect=Log&logNo=80061934379,(2) 구의동 서북 면옥안양 옥류관 남대문 시장 부원 면옥평래옥 우래옥평양면옥을지 면옥필동 면옥강서 면옥낙원동 유진식당 양재동 고박사냉면 염리동 을밀대 봉피양서초동장수원 청량리시장평양 냉면집... ,배움의 진가,https://blog.naver.com/godins,2009-01-22
강남역 봉피양평양 냉면 츄릅♪,https://blog.naver.com/yjj0927?Redirect=Log&logNo=221510372437,라고 묻지도 않았는데 항상 말하고다님 02) 578-7018 서초구서초동1330 코아텔 1층 건물도 그렇고... 개인적으로 좋아하는 압구정평양면옥 과 비교하자면 압구정에 한 표... 맛은 비슷하게 맛있지만 가격에서 일단... ,믿고보는 참한그녀,https://blog.naver.com/yjj0927,2019-04-12
서울시내평양 냉면집들,https://blog.naver.com/khk0230?Redirect=Log&logNo=100188822543,〈의정부평양면옥 〉은 우래옥과 더불어 이남의평양 냉면의 시초가 된 곳입니다. 특집리뷰에 소개된 여섯 곳의 냉면집 가운데 가장 푸짐한 면을 제공하고 있어 손님들의 반응이 좋습니다. 을지 면옥 과... ,L앤B파트너스,https://blog.naver.com/khk0230,2013-05-28
전국 맛집안내,https://blog.daum.net/jang5254/4487213,043)652-3777평양 만두 -평양면옥서울 중구 장충동 ☎ 02)2267-7784 오색만두전골 - 시골 사람들... 서초구서초동예술의 전당 건너편 ☎02-523-2860 흑두부 - 오수 서울 종로구 인사동 인사... ,동산,https://blog.daum.net/jang5254,2005-10-12
서울 맛집 베스트 100,https://blog.naver.com/rem_kim?Redirect=Log&logNo=30043737613,본점(***)평양 냉면 갈비 등심 전문점 02-2265-0151중구 무교동 118-1 36유면한횟집(****반) 신촌위치 광어 우럭 놀래미 농어 도미 킹크랩 아구찜 대하 02-393-9565서대문구 대현동104-39 37 평양면옥 ... ,윙크,https://blog.naver.com/rem_kim,2009-02-28
여름철별미! 서울 냉면 진짜맛집 지도,https://blog.naver.com/kimgisanavi?Redirect=Log&logNo=220084322607,1-5) -평양 냉면 5. 유천냉면 (서울 송파구 풍납동 397-18) -평양 냉면 6.평양면옥(서울 중구 장충동1가... 서북 면옥(서울 광진구 구의동 80-47) -평양 냉면 10. 봉피양 (서울 서초구서초동1330) -평양 냉면... ,국민내비 김기사 진짜 맛집 탐방기,https://blog.naver.com/kimgisanavi,2014-08-07
[강남역신흥맛집]청류벽-아직 깨야할 벽은 있지만 무서운 강자,https://blog.naver.com/nyatajr?Redirect=Log&logNo=221488583562,더 평양포스팅은 아래에저는 아재입맛인데 제 지인들은 어린이 입맛이 참 많아서 늘 메뉴 선정의 어려움이 있답니다ㅜ.ㅜ 전화:02-2055-1191 주소:서울 서초구 서초대로74길 29 ( 서초동1327-29 1층) 영업시간: 월... ,가령찡의 미식생활,https://blog.naver.com/nyatajr,2019-03-15
2015. 3월 월간끼니 -1,https://blog.naver.com/kmw1988?Redirect=Log&logNo=220582817969, 평양면옥 이었나?? 스카이72. 공짜로 주는 붕어빵이 이렇게 맛있을 줄이야.. 김포 홍탁삼합집. 과메기가...서초동온돌집. 이정도 맛으로 유명했다는게 이해가 가질 않는다. 무진장이라는 단어가 어색해진다. 하남... ,2016. 09. 18.,https://blog.naver.com/kmw1988,2015-12-30
스타필드 하남 맛보기,https://blog.naver.com/triak?Redirect=Log&logNo=221052851828,티맵에는서초동 에서 약 1시간이 찍히네요. 비 오는 토요일 오후라서 그런지 올림픽대로에서 스타필드... 의정부평양면옥평양 냉면 3. 데블스 도어 햄버거 4. 나폴레옹 과자점 샐러드빵 5. 탄탄면 공방 탄탄면... ,백돌이계의 기린아 GREED,https://blog.naver.com/triak,2017-07-17
[맛집 탐방] 연남동 맛집 정리(2019/9/30),https://blog.naver.com/a6969235?Redirect=Log&logNo=221663393571,"련남 면옥 (평냉), 콩카페(루프탑), 연남슈퍼(가맥집), 툭툭누들타이, 소이연남(타이), Anh(베트남)... 독립카츠,서초동강남역 아빠곰수제돈까스, 창동 마쯔무라돈까스, 용산 북천, 광화문 김권태돈까스백반, 교대... ",천하일신님의 블로그,https://blog.naver.com/a6969235,2019-09-30
7. 냉면 이야기-2 (2017/08/16),https://blog.naver.com/iamsunghkim?Redirect=Log&logNo=221411901528,청담동 피양옥 -서초동평양 제일 면옥- 방이동 금왕 평양면옥- 여의도 선주후면 - 합정동 동무밥상 - 연남동 련남 면옥- 상수동 고메구락부 - 광화문 광화문국밥 - 역삼동평양 옥 - 논현동 언주옥... ,대중음악연구소,https://blog.naver.com/iamsunghkim,2018-12-04
수요미식회 맛집 리스트 지역별 정리,https://blog.naver.com/sw20woo?Redirect=Log&logNo=221859458933,서초구서초동1341-9 봉산집 본점 차돌박이 서울 용산구 용산동3가 1-21 필동 면옥평양 냉면 서울 중구 필동3가 1-5 신들래보쌈 보쌈 서울 용산구 남영동 97-5 이십사절기 제육볶음 서울 강남구 삼성동... ,은밀한 칩거생활,https://blog.naver.com/sw20woo,2020-03-18
스마트폰 의 재주,https://blog.naver.com/wontae9931?Redirect=Log&logNo=221224355942,인사동 경인미술관 전시 모습 귀엽고 예쁜 손녀딸의 유치원 입학 우리가족이 발행했던 가족 소식지 표지 모습 사랑하는 옆지기 소천의 찬조출품작서초동 의평양면옥간판. 청담돈의 더쪽 간판. 이종휘 전... ,캘리그래프와 각의 향연 그리고 인생,https://blog.naver.com/wontae9931,2018-03-08
맛집리스트 -서울(강남),https://blog.naver.com/sjwoni89?Redirect=Log&logNo=221596594438, 평양면옥 도곡점/ 서울 강남구 도곡동 423-15 ----------강남구/신사동---------- ●강서 면옥 ... 월요일휴무 ★수요미식60회 ----------서초구/ 서초동 ---------- ●타지 / 카레 / 서울 서초구 서초1동... ,WONY의 스케치북,https://blog.naver.com/sjwoni89,2019-07-26
교대역 : 샘밭 막국수,https://blog.naver.com/suri1987?Redirect=Log&logNo=220391493424,가게에 들어서면 동국대에 있는 오래된 냉면집 ' 평양면옥 '이 떠오른다. 어릴 때부터 아부지를 따라... 만큼 매콤하고 고소하고 깔끔하다. **골목에 있으니 주소를 찍고 가는 게 바람직. 서울시 서초구서초동1667-8,Es ist gut !,https://blog.naver.com/suri1987,2015-06-16
서초구 지역의 사무실임대 정보,https://blog.naver.com/loyc?Redirect=Log&logNo=222229382316,"5P ]서초구서초동1564-13사무실임대지온 3층 임대가격 10,000 / 550 [ 0.0 / 221.5m²0.0 / 67.0P 0.0 / 221.5m²0.0 / 67.0P ]서초구서초동1443-16사무실임대태극빌딩 B1층 임대가격 2... ",디비리츠,https://blog.naver.com/loyc,2021-02-02
서울맛집,https://blog.naver.com/sjeonjoo?Redirect=Log&logNo=220297326164,1577-9963서초동사리원-3474-5005 비빔밥- 서초동들름집-585-8449 손두부- 서초동백년옥-523-2860... 냉면-장충동평양면옥 -2267-7784 오장동 흥남집-2266-0735 매운탕-광장시장 은성회집-2267-6813... ,언제나처럼...,https://blog.naver.com/sjeonjoo,2015-03-11
"[서울 강남구 함흥냉면] 산봉냉면, 반룡산",https://blog.daum.net/loch_ness/3709703,"net/loch_ness/3709729 - 서북 면옥(서울 광진구),평양 냉면 (서울 동대문구 제기동) http://blog.daum.net/loch_ness/3709764 - 옥천냉면 (경기 양평군 옥천면) http://blog.daum.net/loch_ness/3709765 -평양면옥 ... ",세상 모두를 밟아보는 날,https://blog.daum.net/loch_ness,2013-12-01
