title,link,description,bloggername,bloggerlink,postdate
서울평양 냉면 맛집 모음,https://blog.naver.com/suk030100?Redirect=Log&logNo=222348068875,"12,000원, 평양 온면 (쇠고기:국내산 육우) 12,000원평양 접시만두(두부:콩,미국산,돼지고기 ,국내산) 13,000 서관 면옥 교대본점 서희처럼의 김밥이야기 상호 : 서관 면옥교대본점 주소 : 서울 서초구서초동1675-5... ",김밥파는ceo서희처럼,https://blog.naver.com/suk030100,2021-05-12
[소식] 유명 맛집 냉면·콩국수에서 대장균 검출,https://blog.naver.com/zado2012?Redirect=Log&logNo=70171894332,서초구서초동1330 대장균 음성 양성 9 콩국수 소문난바지락칼국수 서울 강남구 대치동 931 대장균 음성 양성 10 냉면 대치동함흥 면옥서울 강남구 대치동 1023 대장균 음성 양성 11 콩국수 대백손칼국수... ,건강한 삶,https://blog.naver.com/zado2012,2013-07-18
전국맛집 총정리,https://blog.naver.com/enzo2509?Redirect=Log&logNo=110081268357,"598-9288 *서초구서초동상문고 앞, 방배역 1번출구 ▶ 프로간장게장 (간장게장) (02) 543-4126... 만포 면옥( 평양 냉면) (02) 359-3917 *고양시 덕양구 효자동 96-12 ▶평양면옥( 평양 냉면) (031) 877-2282... ",엔조의 바닷속 세상,https://blog.naver.com/enzo2509,2010-02-23
"[서초/교대역] 서관 면옥|평양 냉면은 신흥강자!, 제육고기는... ",https://blog.naver.com/yssy1231?Redirect=Log&logNo=221825742296,"서관 면옥메뉴판평양 냉면 \13,000평양 냉면의 표준가격처럼 받아들여지는 필동,을지,장충동평양면옥 의 \12,000보다 높다. 개인적으로 탑클이라 생각하는 몇몇 집들과 비교하면 차이는 더 커진다. 그럼에도,그냥... ",혼자가는산구경,https://blog.naver.com/yssy1231,2020-02-26
직장인 추천 맛집 (040626-210913)(1191),https://blog.naver.com/tylee1993?Redirect=Log&logNo=222503979115,"남포 면옥 (080221) : 무교동 / 02-777-2269 / 쟁반국수, 신선로 23) 유진참치(090529) : 북창동 / 02... 101)평양 옥(120130) : 서대문구 미근동 31-11호 / 02-363-7058 / 보신탕 전문 102) 사조미가... ",이태연의 시 한 톨,https://blog.naver.com/tylee1993,2021-09-13
"서관 면옥교대, 평냉 신흥강자",https://blog.naver.com/alysshim?Redirect=Log&logNo=221465132844,아무리 춥지만 일주일에 한 번은평양 냉면 먹어줘야 하는 거 아닌가요?ㅎㅎ 추천받은서초동서관 면옥 ...평양 냉면 신흥강자답게.. 국물도 최고 ㅠㅠ 깔끔하다. 그런데 조금 단 편이라 확실히 진미나평양면옥 보... ,SIMJAME,https://blog.naver.com/alysshim,2019-02-13
녹사평역에서 충무로역까지 남산공원길을 따라 오랜만에 느낀... ,https://blog.naver.com/sonic72?Redirect=Log&logNo=130189687718,남산에서 용산과서초동일대를 내려다본 풍경 파노라마 산책길은 잘 정비되어있기 때문에 가벼운... 그리고 오랜만에 아버지가 좋아하시는 장충동평양면옥 에 들러감칠맛이 일품인 이북식평양 냉면과... ,SONIC Photography,https://blog.naver.com/sonic72,2014-04-20
전국 맛집(2015년 기준),https://blog.naver.com/godins?Redirect=Log&logNo=222024939640,"서초구서초동상문고 앞, 방배역 1번출구 ▶ 프로간장게장 (간장게장) (02) 543-4126 - 서초구... 만포 면옥( 평양 냉면) (02) 359-3917 - 고양시 덕양구 효자동 96-12 ▶평양면옥( 평양 냉면) (031) 877-2282... ",배움의 진가,https://blog.naver.com/godins,2020-07-08
냉면맛집리스트,https://blog.naver.com/havivi99?Redirect=Log&logNo=222221602775,"입정동 - 을지로 3가역 - 을지 면옥논현동 - 압구정역, 학동역 - 논현동평양면옥주교동 - 을지로 4가역... 흥미 면옥서초동- 교대역 - 정이 면옥서초동- 교대역 - 오장동 면옥서초동- 교대역 - 중일 면옥서초동 ... ",호기심쟁이 하루의 잘 사는 이야기,https://blog.naver.com/havivi99,2021-01-27
전국 맛집 리스트 ('면'편),https://blog.naver.com/cosmanjh?Redirect=Log&logNo=222349056653," 평양 냉면 입정동 - 을지로 3가역 - 을지 면옥논현동 - 압구정역, 학동역 - 논현동평양면옥주교동... 조선 면옥방배동 - 고속터미널역 - 서초 면옥반포동 - 구반포역 - 흥미 면옥서초동- 교대역 - 정이 면옥서초동 ... ",스트롱 슬로프 경사로,https://blog.naver.com/cosmanjh,2021-05-14
"수요미식회, 소개 집 정리 (2019. 10. 8)",https://blog.naver.com/sobeit78?Redirect=Log&logNo=220429207233,18회평양 냉면 우래옥 : 서울 중구 주교동 118-1 을지 면옥: 서울 중구 입정동 161(을지로 3가역 5번출구앞) - 충무로의평양면옥 과 형제이고 여기 진짜 심.심. 한 냉면집. 처음 먹어본 사람은 깜짝... ,호접몽,https://blog.naver.com/sobeit78,2015-07-23
서울맛집 300,https://blog.naver.com/cgraphic?Redirect=Log&logNo=220523860410,"147-6 /평양 냉면 ● 정광수돈까스 02-336-8919 / 서울 마포구 망원2동 471-9 1층 / 돈가스... 서초구서초동1449-8 서전빌딩1층 / 드립커피,와인 ● 노독일처 02-517-4552 / 서울 서초구 잠원동 15-10... ",사람은 사랑하는 사람이 없으면 살아 갈 수 없다.,https://blog.naver.com/cgraphic,2015-10-30
7명의 미식가가 고른 맛집 메뉴 푸드스타일리스트 김현학,https://blog.naver.com/travis38?Redirect=Log&logNo=60054651642,"사이드 메뉴로는서초동라 스트라다의 제노베제 피자가 어떨까. 흔히 먹는 토마토 페스트가 아닌... 장충동평양면옥 의 물냉면 Dessert：파스쿠치의 에스프레소, 커피빈의 뉴욕 치즈 케이크 Drink：호프... ",iamfoodstylist - erolpa 푸드디렉터 김현학,https://blog.naver.com/travis38,2008-08-29
[평냉 맛집] 봉피양평양 냉면,https://blog.naver.com/urim8497?Redirect=Log&logNo=222000267759,서초점평양 냉면벽제개성만두 위치 서울 서초구 강남대로53길 11서초동 삼성쉐르빌2 강남역... 그동안 먹었던평양 냉면 집이랑 비교해보면 # 평양면옥#우래옥 #을밀대 #서관 면옥#봉피양 육수는 우래옥이 좀... ,리미콩 블로그,https://blog.naver.com/urim8497,2020-06-14
다음주부터 올려드릴 맛집 퍼레이드 맛보기판..,https://blog.naver.com/symin67?Redirect=Log&logNo=40066095405,양평 고읍냉면의 완자와 제육 동부이촌동 커피미학의 브라질산 커피서초동점봉산산나물의 산채비빔밥서초동푸주옥의 모듬수육 논현동평양면옥 의 만두국 부산 민락동 삼삼횟집의 따로초밥 다음주가... ,맛짱.. 케케케의 Tasty Food,https://blog.naver.com/symin67,2009-04-24
하루하루 - 2020.06.01 ~ 06.30,https://blog.daum.net/jooeun44/14774881,"화요일 , 오전 11 시 30 분에 장충동평양면옥 에서 차 병원 조 원장을 만나 냉면과 불고기로 점심 을... 은이는서초동사랑의 교회 1 부 예 배드리고 , ‘다락방 모임’하고 ,. 광화문 교보 문고에 들려 자료... ",나의 삶 속의 이야기,https://blog.daum.net/jooeun44,2020-07-09
경기도 수도권평양 냉면 맛집 추려보기,https://blog.naver.com/tlfqjdbs?Redirect=Log&logNo=221949030747,냉면 입정동 ♣ 을지로 3가역 ♣ 을지 면옥논현동 ♣ 압구정역학동역 ♣ 논현동평양면옥주교동... 흥미 면옥서초동♣ 교대역 ♣ 정이 면옥서초동♣ 교대역 ♣ 오장동 면옥서초동♣ 교대역 ♣ 중일 면옥 ... ,즐거움 속 IT라이프,https://blog.naver.com/tlfqjdbs,2020-05-06
 평양 냉면 먹고 떡갈비 먹고 남북 음식통일,https://shinsegaeblog.com/912,"강남점의평양면옥 에 가야 합니다.평양 에서 대동 면옥 을 운영했던 1대, 논현동에서평양면옥 을... 사랑받아온서초동 의 맛집 백년옥의 직영점입니다. 경기점 매장에서는 백년옥의 칼국수 전문점이자... ",신세계백화점 공식 블로그,https://shinsegaeblog.com/,2018-05-18
가볼만한곳~,https://blog.naver.com/sun99723?Redirect=Log&logNo=80004664757,남포 면옥어복쟁반 다동 이북식쟁반(만두추가) 777-2269 다동(이북식 쟁반) 일 문화공간 게장 명동... 20m평양 집 고기 삼각지 삼각지에 위치한 유명한 고깃집 793-6866 삼각지 달 인도 삼청동 가장... ,sun99723님의 블로그,https://blog.naver.com/sun99723,2004-08-06
(교대역) 더진미평냉,https://blog.naver.com/habakdr?Redirect=Log&logNo=221707158709,"서울 서초구서초동교대역남부터미널역 사이 교대사거리 부근에 위치한평양 냉면 전문점... 양념장이 좀 염도가 강하고 씁쓸한데, 간혹평양면옥물냉면에서 오이쓴내가 육수에 녹아들었을 경우와 좀... ",마른수퇘지,https://blog.naver.com/habakdr,2019-11-14
서울에서 꼭 가봐야 할평양 냉면 맛집 10선(퍼온 글)...,https://blog.daum.net/ssaljji/7138931,★평양면옥02-2267-7784 서울시 중구 장충동1가 26-14평양면옥 은평양 에서 대동 면옥 을 경영했던... 을지 면옥02-2266-7052 서울시 중구 입정동 177-1 봉피양 02-587-7018 서울시 서초구서초동1330 토아텔 1층... ,걸어가는 여행...,https://blog.daum.net/ssaljji,2009-09-09
 평양 냉면 육수 담은 캔 음료 등장…‘전참시’서 라이머... ,https://blog.naver.com/mariabok?Redirect=Log&logNo=222431935320,말 그대로 맥주 캔같이 생긴 용기에평양 냉면 육수를 담았다. 비교적 장시간 냉장 보관도 가능하다. 흑맥주 패키지를 닮은 이 제품은서초동서관 면옥 과 한우다이닝 울릉에서 내놓는평양면옥육수를 그대로... ,홀가분한 삶,https://blog.naver.com/mariabok,2021-07-15
강남역 / 대한민국에서평양 냉면 가장 맛있는 집 ... '봉피양... ,https://blog.naver.com/lamp5861?Redirect=Log&logNo=100108979017,"우래옥류가 있고, 을지 면옥 류가 있고, 을밀대류가 있고, 남포 면옥 류가 있고,평양면옥 류가 있고, 그리고... 걸린)에서서초동쪽으로 조금 걸어가면 사진 속 장면과 만난다. 대한민국에서평양 냉면 가장 맛있는... ",대구의 사랑,https://blog.naver.com/lamp5861,2010-07-12
2017년 별점 평가,https://blog.naver.com/aburnside?Redirect=Log&logNo=221169881323,me/220904763797서초동[목천집] http://aburnside.blog.me/220906091647 명동 [명동교자] http... 오사카 [오레 베아테] 별 1개 반 (★☆) http://aburnside.blog.me/221138087688 장충동 [ 평양면옥 ],동락식탁,https://blog.naver.com/aburnside,2017-12-24
2007년 와인앤조이 송년회(2007.12.29~30),https://blog.naver.com/s941592?Redirect=Log&logNo=60045888872,의정부의평양면옥 으로 이동... 11시 조금 넘은 시간이었는데...모밀냉면으로 깔끔하게 해장하여 주시고.... 지금은 집에서 쉬는 중입니다. ^^ 해장하는데 냉면도 아주 좋더라구요..특히평양 냉면은 국물이... ,행은남,https://blog.naver.com/s941592,2007-12-30
서울 맛집 리스트 [스압],https://jackfrost.tistory.com/3653," 평양 냉면 입정동 - 을지로 3가역 - 을지 면옥논현동 - 압구정역, 학동역 - 논현동평양면옥주교동... 조선 면옥방배동 - 고속터미널역 - 서초 면옥반포동 - 구반포역 - 흥미 면옥서초동- 교대역 - 정이 면옥 ... ",Jack,https://jackfrost.tistory.com/,2021-07-10
(오장동) 흥남집,https://blog.naver.com/mrblues?Redirect=Log&logNo=91635771,장충동평양면옥남포 면옥북창동 송옥 청진동 미진서초동제남 오장동 흥남집 신창 면옥서소문 유림면 명동 교자 을지로 안동장 오구반점 북창동 신승관 광화문 동성각 왕십리 대중옥 청진옥 청일옥 지금은... ,酒食九段,https://blog.naver.com/mrblues,2009-10-22
[강남구청맛집/봉밀가] 깨끗한 깊은 맛의평양 냉면과 만두국이... ,https://blog.naver.com/rmfwoddl?Redirect=Log&logNo=221796611246,"ㅋ 개인적으로서초동봉산옥의... 황해도식 만두국을 참 좋아하는데.. 이곳은 그곳보다 더 국물이... 그래도 먹어본평양 냉면 집이... 우래옥, 을지 면옥 , 필동 면옥 ,평양면옥정도? 헌데 봉밀가의 국물맛은... ",종현군의 세상읽기,https://blog.naver.com/rmfwoddl,2020-02-05
" 평양 냉면, 함흥냉면만 귀족인가… 들기름 살살 뿌려 비벼 먹는... ",https://blog.daum.net/iditarod/18315," 평양 냉면, 함흥냉면만 귀족인가… 들기름 살살 뿌려 비벼 먹는 비빔냉면의 신세계 댓글 0 정보/기타정보 2019. 6. 8. [아무튼, 주말- 정동현의 pick] 비빔냉면편 서울서초동'서관 면옥 ' 서울서초동'서관 면옥 '은... ",길 위에 흐르는 음악,https://blog.daum.net/iditarod,2019-06-08
하루하루 - 2016.04.14 ~ 09.30,https://blog.daum.net/jooeun44/14774802,세계사랑교회 / 박경수와 야당동 둘러 봄 / 은 -서초동사랑의 교회 5/23 ; 한의원 - 좌골 신경통 /KT... 석식은평양면옥// 어머니 타박상 6/15 ; 메디인 - 의료 기간 연장 - 한의원 / 주민센타 // 우남과... ,나의 삶 속의 이야기,https://blog.daum.net/jooeun44,2017-09-07
산책로,https://blog.naver.com/jisunih?Redirect=Log&logNo=221522288161,"강남 대치,도곡동부터 서초 양재, 서초동 까지 이곳도 점심시간에는 인근 오피스의 직장인들도... 양재천길 근처 추천할만한 곳: 포브라더스,평양면옥 , 브루스리 등 브라운핸즈, 타블도우트, 브라운브레드... ",이바짱 일상! 먹고 여행하고 행복하라.,https://blog.naver.com/jisunih,2019-04-25
 평양 냉면 전문점 70곳을 찾아다니면 먹고 즐긴 이야기들,https://blog.naver.com/mkdkrk?Redirect=Log&logNo=221109938261,구의동 서북 면옥http://blog.naver.com/mkdkrk/90193041987 10. 일산 금왕 평양면옥 ...서초동평양 제일 면옥http://blog.naver.com/mkdkrk/221036809861 64. 논현동 심연한우 http... ,조용히 살란다!,https://blog.naver.com/mkdkrk,2017-10-26
한국식만두,https://blog.naver.com/yesokay2?Redirect=Log&logNo=221835997209,진미 평양 냉면 논현동 - 학동역 - 논현동평양면옥장충동 - 동대문운동장역 - 장충동평양면옥구의동 - 어린이대공원역 - 서북 면옥필동 - 충무로역 - 필동 면옥논현동 - 강남구청역 - 봉밀가 여의도동... ,"Reference - 법, 컴퓨터, 취미생활",https://blog.naver.com/yesokay2,2020-03-03
278. 음식천국 노회찬,https://blog.naver.com/reficul119?Redirect=Log&logNo=222309001248,참홍어'서초동설렁탕집 '이남장' 홍대입구역 훠궈 식당 '불이야' 마포 중식당 '현래장' 마포 한정식... 의정부평양면옥 의 냉면이고 본점의 딸들이 하는 냉면집이 있는데 그게 '필동 면옥 '과 '을지 면옥 '이라는... ,Knockin' on heaven's door,https://blog.naver.com/reficul119,2021-04-13
화해 지향.,https://blog.naver.com/chjinnnn?Redirect=Log&logNo=221396148612," 평양면옥지나가는데 웅이가 수육이나 먹을까, 해서 #돼지고기수육 김치에서 머리카락 나왔는데 웅이가... #애간장 사장님이서초동연가 유니폼 입고 있어서 무ㅓ지? 했는데서초동연가 사장님이었음 ㅋㅋㅋㅋ... ",출출한 여행자,https://blog.naver.com/chjinnnn,2018-11-11
수요미식회 맛집 리스트,https://blog.naver.com/mkkhboy?Redirect=Log&logNo=222272922609,본점평양 냉면 #돼지갈비 서울 송파구 방이동 205-8 을지 면옥평양 냉면 서울 중구 입정동 161... 서초구서초동1341-9 봉산집 본점 차돌박이 서울 용산구 용산동3가 1-21평양면옥분당점평양 냉면 경기도... ,기기민기 맛과책 향기,https://blog.naver.com/mkkhboy,2021-03-12
2016년 맛 별점 통계,https://blog.naver.com/aburnside?Redirect=Log&logNo=220895492760,[송추 평양면옥 ] http://blog.naver.com/aburnside/220718375955 논현동 [진미 평양 냉면] http... com/aburnside/220885256041서초동[임병주산동칼국수] http://blog.naver.com/aburnside... ,동락식탁,https://blog.naver.com/aburnside,2016-12-26
대치동 : 우래옥 (又來屋) - 믿고 먹는 불고기와평양 냉면 콤보,https://blog.naver.com/sayravel?Redirect=Log&logNo=221676512996,이날은서초동한복판에서 벌어진 시위로 인해 눈물을 머금고 차를 놓고 지하철을 탔다지. 저 이런... 강남평양 냉면 중에선 논현동의평양면옥 과 여기를 평냉의 쌍두마차로 꼽고싶다며. 서관 면옥 도 넘나... ,방배동 정슨생의 일상다반사,https://blog.naver.com/sayravel,2019-10-13
전국 맛집 100선,https://blog.naver.com/goodaylee?Redirect=Log&logNo=222211946144,"용산평양 집, 용산 풍성집, 한남동 유엔가든, 을지로 우래옥, 보건옥, 노원 참누렁소가든, 도봉 무수옥... 양수 면옥 , 포천 원조이동김미자할머니갈비, 안양 남부정육, 경기광주 광현가든, 경기광주 천현한우집... ",열심히 보고배우기-Best Practics,https://blog.naver.com/goodaylee,2021-01-19
09. Seoul (서울 - Korea) -9 ~ 21일째,https://blog.naver.com/yongkim46?Redirect=Log&logNo=221957927701,"장수 면옥 , 우래옥,평양면옥등의 냉면집. 강북의 관광객들이 가득한 인사동, 동대문역사공원 등의... (빌려온 사진) 14일 우리가 서울을 떠나는 날까지도 매일 대규모 집회가 서로를 힐난하며 광화문,서초동 ... ",마음따라 길따라,https://blog.naver.com/yongkim46,2020-05-12
서울 맛집 리스트 2,https://jackfrost.tistory.com/3191,매운갈비찜서초동- 남부터미널역 - 봉산옥 방배동 - 내방역 - 서초 면옥대치동 - 선릉역 - 청자골 - 매운갈비찜 신림동 - 신림역 - 신림동매운등갈비찜 - 매운등갈비찜 신림동 - 신림역 - 함지박... ,Jack,https://jackfrost.tistory.com/,2021-05-05
맛집 정보 와장창~,https://blog.naver.com/backhaus?Redirect=Log&logNo=110006881723,"– 한중위님 #간장게장,버섯불고기 ‘한선 면옥 ’ 7호선 공릉역에 있는 한선 면옥 을 추천합니다. 주... 티비에도 자주 나오던서초동매운갈비찜 [온돌집] 회사 근처라 종종가는데 4단계까지 도전. 죽기 직전에... ",아함 브라흐마스미,https://blog.naver.com/backhaus,2006-07-27
"- 3 강남구, 서초구",https://blog.naver.com/jhaa101010?Redirect=Log&logNo=221276865582,냉면 -평양 면옥549 - 5500 강남구 논현동 66 - 2 ( 평양냉면 - 7.5점) * 만두 - 만두집 544 - 3710... 하동관의 분파) 3-2 서초구 * 칼국수 - 임병주 산동 칼국수 3473 - 7972 서초구서초동1362... ,"달 따라,구름 따라, 인생 따라",https://blog.naver.com/jhaa101010,2018-05-16
외식업 조리사 홀서빙 전문 구인구직 정보제공,https://blog.naver.com/shimgb?Redirect=Log&logNo=221622862582,"의정부 평양면옥 고양시 덕양구 고양대로 (동산동, 스타필드고양) 1969년부터 제분소를 가지고 3대째 전통방식으로 생 메밀면을 직접뽑는평양 냉면 은평 갈현동 4 1층 H3 Bistro 고양시 일산서구 대화동... ",조리사 홀서빙 전문 구인구직사이트 <외식과사람들>,https://blog.naver.com/shimgb,2019-08-20
2018년 결산 : 가장 인상깊던 기억들,https://blog.naver.com/kingjae07?Redirect=Log&logNo=221431556073,"임병주산동칼국수 -서초동이곳은 클라이언트가 주변에 맛있는 곳이 있다며 데려다준 곳인데 ..... 의정부평양면옥- 의정부 나름평양 냉면 참 좋아한다고 생각하는데, 우리나라평양 냉면의... ",킹킹재의 식도락,https://blog.naver.com/kingjae07,2019-01-01
# 평양 냉면맛집 #하계동냉면 #불고기맛집 #제형 면옥 하계점,https://blog.naver.com/bdmecca?Redirect=Log&logNo=222012066130,내공의평양 냉면이 있는 줄도 몰랐고.. 더구나 .. 아무리 대구가 본점이라고 해도 .. 제형 면옥이라는... 의정부 평양면옥 이 조금만 가까웠어도 ... 평생 절대로 안 왔을 식당을 오늘 왔는데... 들어 가기도 전에 ... ,빌딩메카 www.bdmecca.co.kr,https://blog.naver.com/bdmecca,2020-06-30
하루하루 - 2019.08.01~08.31,https://blog.daum.net/jooeun44/14774866,"예배 필한 후 , 구파발역에서 이광섭이 만나 , 함께 북한산 ~ 송추 길에 있는 만포 면옥 에서 냉면... 잘 해결 되지 않는 스마트폰의 사용법을 위해서초동삼성 전자 A/S 센타도 함께 가고 ,.. 그리고 저녁을... ",나의 삶 속의 이야기,https://blog.daum.net/jooeun44,2019-09-24
하루하루 - 2019.06.01~06.30,https://blog.daum.net/jooeun44/14774862,"낑낑 , 깽깽 하였고 , ggg 내일은 이른 아침에 집을 출발하여 ,서초동 에서 사촌 - 미자누나를 pick up... 얼마 전에 맛 좋은 냉면을 찾는 동기 - 전봉관에게 송추의평양 면옥 을 설명했더니 , 그 냉면 먹으러... ",나의 삶 속의 이야기,https://blog.daum.net/jooeun44,2019-07-19
생방송 투데이..맛집,https://blog.naver.com/juni266?Redirect=Log&logNo=100009716390,삼합으로 성공을 노린다!! ** 낙삼탕 (정동진 해물탕) ***-***-**** 광주시 북구 삼각동 ** 나베 (돈코) 365-8097 이화여대 정문쪽 국수라는 편견을 버려!-이색국수열전! * 속초 회국수 : 033-635-2732... ,딴지꽁지,https://blog.naver.com/juni266,2005-01-26
유명 냉면집 '봉피양' 등 55곳서 대장균 과다 검출,https://blog.daum.net/sanatana/16522474, 서초동'봉피양'은 맛집으로 알려져 단골손님이 많고 냉면 값도 한 그릇에 1만원이 넘는다. 이외에도 ▲대치동함흥 면옥 (서울 강남구 대치동 1023) ▲사곶냉면(인천 남동구 도림동 346) ▲ 평양면옥 ... ,sanatana,https://blog.daum.net/sanatana,2013-07-19
VJ특공대에서 나온 맛집 모음,https://blog.nemesys.co.kr/post/167/,VJ특공대에서 방송한 맛집들의 리스트입니다. 굵은 글씨의 제목은 각각 방송시의 제목이었구요. 근처로 가게될 일이 있으시다면 한번쯤 들려보시는 것도 나쁘지 않을 것 같습니다. 내용이... ,Nes's Random Blogz,https://blog.nemesys.co.kr/,2018-12-01
국수 누들로드 전국 맛집,https://blog.daum.net/jkh12179136/8522195,의정부- 평양 냉 면( 평양면옥 ) 031-877-2282 의정부시 의정부3동 385번지 \메밀/비빔-9천 제육... 동두천- 평양 냉면(평남 면옥 ) 031-865-2413/863-2418 동두천시 생연로 127 \냉면-6천 돼지/소겨자무침... ,대해의 추억만들기,https://blog.daum.net/jkh12179136,2012-01-20
[위생불량 적발업소]유명 냉면집 '봉피양' 등 55곳서 대장균... ,https://blog.naver.com/rlaqnfdn?Redirect=Log&logNo=60196281396,서초구서초동'봉피양'은 맛집으로 알려져 단골손님이 많고 냉면 값도 한 그릇에 1만원이 넘는다. 이외에도 ▲대치동함흥 면옥 (서울 강남구 대치동 1023) ▲사곶냉면(인천 남동구 도림동 346) ▲ 평양면옥 ... ,그물에 걸리지 않는 바람처럼~,https://blog.naver.com/rlaqnfdn,2013-07-19
백년명가,https://blog.daum.net/jkh12179136/8522197,9만 12~22시 주차 x 거북곱창 02-586-0032 서울시 서초구서초동1565-8 1층 \곱창-9[2인이상] 13... 1271-3 \칼국수-7천평양면옥031-877-2282 경기도 의정부시 의정부3동 385 \ 평양 냉면-8천 11... ,대해의 추억만들기,https://blog.daum.net/jkh12179136,2012-01-20
[세쌍둥이/tripleBlings] 임신 18~21주차 기록,https://blog.naver.com/dearhyoon?Redirect=Log&logNo=221601682710,ㅋㅋㅋ 점심은 엄마랑 #베키아 저녁은 헙이랑 #호경전 헙이 퇴근해서서초동 으로 나 데리러와서... ---------------------------- 7/21(sun) 21w0d헙이랑 불고기평랭 먹으러평양면옥정말이지 랭면은 임신기간... ,izzyDizzy,https://blog.naver.com/dearhyoon,2019-08-01
서울 만둣국 맛집들~,https://blog.naver.com/luckycsy?Redirect=Log&logNo=221733855951,"( 2018년 9월17일 작성 글) #만두맛집 #깡통만두전골 #개성만두궁 # 평양면옥제가 워낙 만두를 좋아해서... 미성당 납작만두, 등촌동 코끼리만두, 서초동백년옥 만두, 전주 백일홍 만두, 내곡동 성경만두...등등....",모카하라의 소소한 일상,https://blog.naver.com/luckycsy,2019-12-11
[서울의 줄서는 맛집]황광해[삼청동/북촌]1. 북촌칼국수 ..,https://blog.naver.com/jungookson?Redirect=Log&logNo=220124789659,"서초구서초동1450-6 / 02-523-2860 - 주차 가 [광진구/노원구/강북구] 1. 우마이도 - 돈코츠라멘, 교자, 생맥주 - 광진구 화양동 3-29 / 02-467-8788 - 주차 불가 2. 서북 면옥(40년 이상) -평양 냉면, 만둣국... ","흐르는 강물처럼, 떠 가는 구름처럼",https://blog.naver.com/jungookson,2014-09-17
강남 봉피양,https://blog.naver.com/from-kate?Redirect=Log&logNo=220778949103,"강남 봉피양 갑자기평양 냉면이 미친듯 땡겨 출동한 봉피양 봉피양 갈까 을밀대 갈까 고민하다 결국 토요일은 봉피양 일요일은 을밀대 사이좋게 양쪽 다 방문해줌^^ 무김치는 을밀대, 필동 면옥 ,평양면옥 ... ",from-kate,https://blog.naver.com/from-kate,2016-08-05
수도권 면맛집 리스트 (수정판),https://blog.naver.com/pks9199?Redirect=Log&logNo=221518871549,"을지 면옥의정부파 냉면의 계보를 잇는평양 냉면집 논현동 - 압구정역, 학동역 - 논현동평양면옥 ... 서초 면옥서초동- 교대역 - 서초 면옥대치동 - 선릉역 - 반룡산 대치동 - 한티역 - 대치동함흥 면옥신사동... ",개커샘채널,https://blog.naver.com/pks9199,2019-04-21
