title,link,description,bloggername,bloggerlink,postdate
[논현] 깔끔한 동치미 육수 ' 성천막국수 ',https://blog.naver.com/taewo2c?Redirect=Log&logNo=222452639789,"강남쪽에 볼 일이 있어 나왔다가 점심을 해결하려고 방문한 논현 ' 성천막국수 '. 예전에 SNS에서 봐놓고... 막국수는 왜 초록색 간판이 많을까? 원래는 답십리점이 본점인 것 같은데, 이 상권까지 진출을 했다.... ",기타치고 노래하고 밥먹고,https://blog.naver.com/taewo2c,2021-08-05
답십리 맛집 _ 내공이 느껴지는성천막국수 ,https://blog.naver.com/jj6234674?Redirect=Log&logNo=222528301205,"물막국수 6,500원 × 2 제육 11,000원성천막국수막국수집 답게 메밀끓인 물을 주셔서 마시며 잠시 앉아서 기다리니 금방 제육이 나왔어오. 이게 바로 ❤가 감탄한 그 제육!!성천막국수제육 도대체 얼마나... ",Elly's Dairy,https://blog.naver.com/jj6234674,2021-10-06
[답십리맛집/ 성천막국수 ]서울3대 막국수라던데 그냥 너 님이 짱... ,https://blog.naver.com/mjinchul1?Redirect=Log&logNo=222439629287,답십리쪽의성천막국수서울3대 막국수라는데..... 그럼 나머지 2곳은 어디지????? 어쨋든 맛난다 하니 평일 오전에 방문을 해 봅니다. 11시 30분 오픈이라는데 15분쯤 도착했었나???? 문 닫혀 있슴 02-2244-5529 주소... ,바블의 신나는 세상,https://blog.naver.com/mjinchul1,2021-07-23
답십리/답십리역] 비빔막국수 • 제육 맛집 *성천막국수답십리점,https://blog.naver.com/sung22world?Redirect=Log&logNo=222472665260,"비빔막국수 (7,000원)성천막국수 는 물막국수보다 비빔막국수가 찐이라고 들었다. 그래서 넷다 비빔막국수를 시킨 것! 그나저나 양이 진짜 많다... 보통 여자라면 다 못먹을 것 같은 양... 일단 비벼본다. 쉐킷... ",ෆ 희희의 희희낙락 ෆ,https://blog.naver.com/sung22world,2021-08-16
백종원도 왔다간성천 막국수맛은?,https://blog.naver.com/lp_papa?Redirect=Log&logNo=221811768575,"★물 막국수(\6,500)★성천 막국수 는 고기 육수는 없고, 동치미 국물을 베이스로 하기 때문에 호불호가 많이 갈린다. 특히 물 막국수의 경우 정말 밍밍한 맛이다. 정말.. 너무 심각하다. 나는 평양냉면을 엄청... ","맑은 하늘,",https://blog.naver.com/lp_papa,2020-02-18
최자로드 답십리성천막국수 ,https://blog.naver.com/yioct?Redirect=Log&logNo=222509323456,답십리성천막국수메뉴성천막국수 는 수육과 막국수만 판다. 블로그에서 볼때는 수육이었는데성천막국수 에 방문해서 메뉴판을 보니 제육이라고해서 당황했다. 아무래도 맛집에 처음오면 맛있게 먹는 방법이... ,ttosymday,https://blog.naver.com/yioct,2021-09-17
"소개되고, 백종원도 찾는 백년가게 ' 성천막국수 ' 솔직후기",https://blog.naver.com/arum52?Redirect=Log&logNo=222092467387,"그러면서 막국수는 더워야 더 맛있다고 땡볕에 둘이 자전거를 끌고 # 성천막국수로 향했다. ' 성천막국수 ' 위치 및 외관성천막국수 는 답십리가 본점이고, 장남이 운영하는 논현점이 한 곳 더 있다.... ",꼬부기부부의 느린 걸음으로 세계여행,https://blog.naver.com/arum52,2020-09-18
"맛집 •성천막국수 ] 맛동산이 좋아하는 노포맛집! 막국수, 제육... ",https://blog.naver.com/semins77?Redirect=Log&logNo=221975264776,1966년에 평남막국수 라는 상호로 시작해서 성천면옥으로 변경했다가 지금의성천막국수 로 이어지고 있다고 합니다. 1966년이면 대략 55년 정도 전통이라고 할 수 있겠네요. 2019년도에는 논현동에도 직영점을... ,대한민국 맛집도우미 '맛동산 샘',https://blog.naver.com/semins77,2020-05-23
답십리 맛집성천막국수 . 쿰쿰한 짠지가 매력적인 이북식 막국수,https://blog.naver.com/spring5867?Redirect=Log&logNo=221828432038,오로지 이 막국수 먹으러 갈때만 가는 동네입니다. 무려 1966년에 처음 시작한성천막국수 . 동대문에서 가장 먼저 100년 가게 인증을 받은 곳이기도 합니다. 성천이라는 이름은 본래 여기를 처음 개업하셨던... ,■봄이 미식회■,https://blog.naver.com/spring5867,2020-02-28
동대문 답십리 맛집성천막국수본점 제육 맛집..,https://blog.naver.com/aaaauyyy?Redirect=Log&logNo=222531408350,"동대문 답십리 맛집성천막국수본점 영업시간 평일 11:30 ~ 21:00 브레이크 타임 15:00 ~ 17:00 ☎️ 02-2244... 비빔막국수가 유명하니까 비빔막국수 2개랑, 제육 한 접시 주문~~~ 정식도 있는데 고기가 4~5점 나와요... ",일상의 일상,https://blog.naver.com/aaaauyyy,2021-10-09
답십리성천막국수맛집 역시 대단하네!,https://blog.naver.com/bluewater_33?Redirect=Log&logNo=222365809390,저희가 다녀온 곳은 답립시성천 막국수 로 막국수 맛집으로 상당히 유명한 곳입니다. 150m 정도 떨어진 조은마트 뒷편에 주차장에 주차를 하시고성천막국수 에서 도장 받아오면 30분 무료입니다. 이렇게 대기를... ,블루워터의 꿈,https://blog.naver.com/bluewater_33,2021-05-25
 성천 막국수 ,https://blog.naver.com/vltmxkcl?Redirect=Log&logNo=222535139177,이어서 써보는 막국수집 이야기. @mayersung 이라는 인스타그램 아이디로 성식영씨로 활동하고 계신 분이... 그런 성식영님 피드에 내가 본 것만 세 번 이상 등장한 집이 있는데 그 집이 바로성천막국수이... ,나만식객,https://blog.naver.com/vltmxkcl,2021-10-12
논현역 막국수는 전통있는성천막국수 ,https://blog.naver.com/mjpiglet?Redirect=Log&logNo=222424172074,소유진 막국수집이라는 칭호로 알게된성천막국수 가 회사 근처에 논현점이 있어 시원한 점심을 즐기고 왔어요!성천막국수논현점은 7호선 논현역 3번 출구에서 도보로 1분 거리가 대중교통으로 찾아가기 아주... ,자연美인 민팅이,https://blog.naver.com/mjpiglet,2021-07-08
[ 논현 막국수 맛집 ]성천막국수 ,https://blog.naver.com/anzeeee?Redirect=Log&logNo=221797878640,"되어있어요성천막국수메뉴판 딱 물막국수, 비빔막국수, 제육만 판매하고 있었어요 뭔가 메뉴판부터... 안넝 :0 #성천막걸리 #논현성천막걸리 #논현맛집 #논현역맛집 #막국수맛집 #논현막국수맛집 #최자로드... ",재재블로그,https://blog.naver.com/anzeeee,2020-02-05
유일하게 육수욕심 안나는 집...물막국수 정식( 성천막국수논현점),https://blog.naver.com/skymaru?Redirect=Log&logNo=222488604053,저 나름대로 적당히 염도를 맞춰서 먹기는 합니다...다채로운 완성도와 다르게 묵직한 개성에 찾게 됩니다... #혼밥 #혼면 #혼술 # 성천막국수#논현역 #물막국수정식 #동치미막국수 #노포의맛,TAROT4U,https://blog.naver.com/skymaru,2021-08-30
"답십리성천막국수:: 서울 3대 막국수 맛집, 웨이팅없이 방문!",https://blog.naver.com/pp4444qq?Redirect=Log&logNo=222480332135,"물막국수 (6,500원) 숙성시킨 동치미 국물이 특징인 물막국수성천막국수 의 물막국수는 평양냉면처럼 슴슴한 맛과 꼬릿한 맛? 특유의 맛이 설명되지 않는 맛이다. 새콤달콤한 육수를 기대했다면 과감하게... ",잉쭈블로그,https://blog.naver.com/pp4444qq,2021-08-22
답십리 막국수 맛집성천막국수feat. 웨이팅 줄서,https://blog.naver.com/8full?Redirect=Log&logNo=222470301363,"답십리성천막국수가격 일반 6,500원 사진에 보이는 곱뺴기 7,500원 제육 꿀맛이었습니다 일요일 휴무 그리고 웨이팅이있을수있으니 참고해주세요 :) #답십리맛집 #답십리막국수 # 성천막국수#막국수맛집",홍수박,https://blog.naver.com/8full,2021-08-14
[답십리역]성천막국수막국수,https://blog.naver.com/santajoajoa?Redirect=Log&logNo=222530619126,소문난 막국수집입니다.성천막국수1대 주인장의 고향이 평안남도 성천군이라서 평남막국수라는 이름으로 시작하여 성천면옥으로 변경 사용하다가 지금의성천막국수 로 자리를 잡았다고 합니다.... ,저녁 한끼,https://blog.naver.com/santajoajoa,2021-10-08
답십리맛집 동치미메밀막국수 맛난 노포성천막국수 ,https://blog.naver.com/dlrnrrns?Redirect=Log&logNo=221784728929, 성천막국수 의 물막국수입니다. 저는 항상 물막국수의 모습입니다. 살얼음 동동 띠어져있는 물막국수의 모습. 시원해보이고 시원하기까지 합니다. 물막국수의 시원함 메밀향의 구수함 그 궁합느껴보면... ,가지가지 이국군의 블로그,https://blog.naver.com/dlrnrrns,2020-01-25
 성천 막국수 _논현점,https://blog.naver.com/icebox34?Redirect=Log&logNo=221949038404,변함없이 맛있게 이사가지 마시고 가게 빼지 마시고 계속 맛있는 비빔 막국수 만들어주시기를!! # 성천막국수#비빔막국수 #성식영맛집 #나만가고싶은맛집 #맛난노포 #50년노포,Santa Lucia,https://blog.naver.com/icebox34,2020-05-06
[맛집 탐방]성천막국수[답십리] 수육과 막국수 [필링박스],https://blog.naver.com/characterok?Redirect=Log&logNo=222503100136,예전에 가끔 갔던 막국수제육 맛집 ' 성천막국수 '를 4년만에 다시 찾아가봤습니다. 대로변에 있던 가게가 새마을금고 뒤쪽 골목으로 이전했네요. 실내는 입식이며 깔끔합니다. 메뉴는 간단합니다. 막국수... ,필링박스&감성캐릭터 블로그,https://blog.naver.com/characterok,2021-09-12
논현역성천막국수 - 쨍한 동치미국물이 매력적인 막국수(feat.... ,https://blog.naver.com/sagak815?Redirect=Log&logNo=222025958917,논현역성천막국수최고기온이 33도까지 올라갔던 어느 날 시원한 막국수 한 그릇 생각나서 논현역성천막국수 를 찾아갔습니다. 강남역에서 운동 삼아 걸어갔는데 조금 힘들더군요. 작년인가 문을 연 집인데... ,사각사마는 뭘 먹고 사나,https://blog.naver.com/sagak815,2020-07-16
반포동성천막국수논현점 | 막국수의 맛 since 1951,https://blog.naver.com/mokeya1?Redirect=Log&logNo=221746491735,"답십리의 오래된 막국수집, 동대문구의 첫 번째 백년가게로도 선정된성천막국수 가 논현동에도 있어서 이냉치냉으로 후루룩 먹고 왔습니다. 위치는 논현역과 가깝습니다. 여름에는 줄을 서는데 (최자 맛집으로... ",말랑말랑말랑말랑말랑,https://blog.naver.com/mokeya1,2019-12-23
맛집 •성천막국수: 50년이 넘은 노포맛집 JMT 막국수와... ,https://blog.naver.com/semins77?Redirect=Log&logNo=221686239217,"맛동산 샘은 고기도 좋아하지만, 짬뽕, 짜장면, 야끼우동, 쫄면, 국수, 평양냉면 등 면류도 쫌 좋아하는 편인데요, 이 날은 무려 53년의 역사를 가진 동대문구 막국수 맛집성천막국수 에 들르게 되었습니다.... ",대한민국 맛집도우미 '맛동산 샘',https://blog.naver.com/semins77,2019-10-23
답십리 막국수 맛집성천막국수 ,https://blog.naver.com/gomtn?Redirect=Log&logNo=222372996116,답십리역리나 답십리 현대시장 주변에서 맛집을 찾으실때 찾을만한 좋은 집입니다. # 성천막국수#막국수맛집 #백년가게 #답십리 #답십리맛집 #현대시장 #먁국수 #비빔막국수,박영춘의산행정보 (Gosan21.net),https://blog.naver.com/gomtn,2021-05-29
한식 . 동대문구 답십리성천막국수 ,https://blog.naver.com/kat9632?Redirect=Log&logNo=222092232840,신기한 것 사진을 봐도 면 이외의 고명이나 건더기가 없음 진짜 면과 국물과 무 짠지의 맛으로 먹는 막국수!성천 막국수물 막국수 with 무 짠지수육성천 막국수 의 물 막국수는 동치미 육수를 사용 그래서 다른... ,Dailyn Diary,https://blog.naver.com/kat9632,2020-09-17
"[ 성천막국수 ] 해장맛집, 안주맛집, 인생막국수, 인생맛집!",https://blog.naver.com/legomj812?Redirect=Log&logNo=222529104090,# 성천막국수#막국수맛집 #답십리맛집 드디어 올리는 내 인생 맛집! 이 집을 알게 해 준 우니님 감사합니다 오잉성천막국수 는 사실 위치도 그닥이고 메뉴도 한정적이고 메인메뉴인 물막국수도 호불호가 갈릴 수... ,우렁쉥이의 먹고 마시고 즐기는 일상,https://blog.naver.com/legomj812,2021-10-06
"무더위 오아시스,서울 답십리의성천막국수 ",https://blog.naver.com/kimchool?Redirect=Log&logNo=222436809981,반쯤 먹다가 육수를 부으면 물막국수가 되기 때문이다.성천막국수 는 호불호가 엇갈린다. 그러나 몇번 먹으면 불호에서 호로 바뀐다. 음식에 혼과 소울이 있기 때문이다. 또 가고 싶은 집이다.,김덕출의 살아가는 이야기,https://blog.naver.com/kimchool,2021-07-19
"답십리 막국수맛집성천막국수 , 3대째 50년 넘은 노포맛집",https://blog.naver.com/ksisawesome?Redirect=Log&logNo=222493965402,그리고 무짠지와 제육을 주신다 이걸 도대체 무슨맛으로 먹을까 하는 의구심과 호기심이 치솓는성천막국수 의 물막국수 대신에 이곳에서는 짠지를 주는데 짠지가 핵심이다 짠지에다가 비빔장과 겨자를 넣고... ,하이갱스의 어썸라이프,https://blog.naver.com/ksisawesome,2021-09-03
[논현/강남] 성천막국수논현점 - 오랜만에 반가운 동치미 막국수,https://blog.naver.com/emptyh?Redirect=Log&logNo=222156994991,"냉면집으론 평양면옥을 비롯해 새로 생긴 집들도 많은데 막국수론 딱히 갈 곳이 없었다.성천막국수논현점은 본점에 비해선 맛이 많이 순화된 편인 것 같긴 한데, 그래도 군더더기 없이 정겨운 맛이다.","알움, 앎이 움트는...",https://blog.naver.com/emptyh,2020-11-28
 성천 막국수 먹고 구리 상대유통 식자재마트 쇼핑~~,https://blog.naver.com/n0gjuu?Redirect=Log&logNo=221853916671,답십리점성천 막국수1966년 시작 백년가게 2시에 도착하여 점심 이 시국에 이 시간인데도 사람은 많다. 아마도 코로나 아니었으면 못 먹었을수도 있었을랑가 웨이팅없이 바로 들어가서 먹음 가격이... ,작은 미소의 행복,https://blog.naver.com/n0gjuu,2020-03-14
동대문막국수의지존!! 강력추천^^성천막국수 ,https://blog.naver.com/knospe830?Redirect=Log&logNo=222050405398,"아참, 더 감사한 것은성천막국수바로 옆에 너무 맛있는 커피그라운즈 커피가 있어서 더 감사하다~♡♡♡ # 성천막국수#답십리막국수맛집 #동대문막국수맛집 #답십리제육맛있는집 #답십리맛집 #동대문맛집... ",정성과 함성,https://blog.naver.com/knospe830,2020-08-04
 성천막국수- 논현점,https://blog.naver.com/mistyi?Redirect=Log&logNo=222089461730,"어쨋든 근래에 먹은 주위 식당의 음식들이 다 그렇고 그랬는데, 그래도 독특하고 한번 더 와보고 싶은 맛이었습니다. # 성천막국수#논현점 #논현역 #논현동 #막국수 #동치미 #제육 #맛집 #독특 #특이",難治病,https://blog.naver.com/mistyi,2020-09-14
서울 답십리- 비빔막국수.../ 성천막국수 ,https://blog.naver.com/pianocl?Redirect=Log&logNo=222160503125,곳은 막국수 전문점... 지금의 자리로 이전 직 후 들렸으니 거의 3년만에 다시 찾았고 이번에는 비빔국수로 든든하게 식사를 했습니다.성천막국수 ... 식감 좋은 메밀국수와 쨍한 동치미국물이 좋지만 추워진... ,퍄노조율사의 블로그,https://blog.naver.com/pianocl,2020-12-03
 성천 막국수/ 답십리,https://blog.naver.com/102_tour?Redirect=Log&logNo=222530667025, 성천 막국수 에 다녀왔다. 이 동네에서 아마 가장 유명한 집? 예전처럼 줄 서고 하진 않지만 여전히 잘 된다. 제육을 따로 시키나 정식으로 시키나 비스읏 요번엔 정식으로 면수 먼저 내어주시고 반찬으로 나오는... ,102 tour,https://blog.naver.com/102_tour,2021-10-08
"논현역_점심식사 단골 메뉴들(feat. 성천막국수 ,스시 히나타... ",https://blog.naver.com/ericjin35?Redirect=Log&logNo=222400844153, 성천막국수논현점 메뉴는 늘 비빔세트. 제육이 조금 같이 나온다. 양념만 덜렁 나오는 비빔국수인데 이게 왜이렇게 맛있을까. 여긴 우연히 발견한 가성비 갑. 양꼬치집의 점심 메뉴. 볶음밥이 무려 4천원 밖에... ,맛없는건 안 먹어요,https://blog.naver.com/ericjin35,2021-06-17
[답십리]성천막국수 ,https://blog.naver.com/listen4uu?Redirect=Log&logNo=222503665103,"서울 3대 막국수,성천막국수최자로드 보다가 최자와 정창욱이 맛있게 먹었다고 이집을 언급해서 충동적으로 다녀오게 됐다. 막국수를 워낙 좋아하는 터라... 원픽은 고기리 막국수의 '들기름 막국수'다.... ",좌충우돌 방랑라이프,https://blog.naver.com/listen4uu,2021-09-12
 성천막국수답십리 막국수 맛집,https://blog.naver.com/96suhyeon?Redirect=Log&logNo=222507505075,답십리 막국수 맛집으로 유명한성천 막국수이전부터 알고있었는데 멀어서 못가고 있다가 막국수가 땡기는 날이라서 ㄱㄱ함 답십리역에셔 약간 거리가 있다 주차장은 중산 공영주차장 이용 후기 보니까... ,Un jour de 엘레니,https://blog.naver.com/96suhyeon,2021-09-16
[범계맛집] 동네 막국수 맛집 ' 성천막국수전문점',https://blog.naver.com/mate0217zx?Redirect=Log&logNo=222336959898,"동네에막국수 맛집이 있다고 해서 찾아간성천먁국수 전문점 30년 전통의 맛이라니 기대감이 생긴다. 임신하니 속이 느글느글해서 시원한막국수 가 땡겨서 찾아갔다. 메뉴는 물 막국수 , 비빔 막국수 , 메밀전병... ",돼지삼남매 블로그♥Life is short EAT dessert first,https://blog.naver.com/mate0217zx,2021-05-04
보통일상 | 색다른 막국수를 찾아 ( 성천막국수 ),https://blog.naver.com/karena1525?Redirect=Log&logNo=222389637680,답십리에도 맛집이 있다는 소식에 궁금증을 갖고 찾아가본 # 성천막국수얼마전에는 성시경님이... 여기가 막국수계의 평양냉면집이라길래 비빔막국수 정식으로 시켰다. (실패하고 싶지 않았음...) 정식2개에... ,보통의 일상들.,https://blog.naver.com/karena1525,2021-06-08
답십리 맛집 최자로드성천막국수 (★☆☆☆☆),https://blog.naver.com/jihyeon7851?Redirect=Log&logNo=221803862954,"#먹창고 #답십리맛집 #최자로드 # 성천막국수#노포맛집 #막국수맛집 서울 동대문구 답십리로48나길 2 답십리역 4번 출구 11:30 ~ 21:00 (브레이크 15:00 ~ 17:00) 일요일 휴무 먹은거 제육 11,000원 / 비빔 7,000원 / 물 6... ",먹_창고,https://blog.naver.com/jihyeon7851,2020-02-10
 성천막국수- 논현점,https://blog.naver.com/thswodbs97?Redirect=Log&logNo=222523661455,짠지 무랑 같이 먹어야 덜 심심하더라~ 비빔 막국수는 고소한 참기름 냄새가 입맛을 돋구웠다. 딱 양념장에만 비벼 먹었는데 맛있다~~ 자극적이지 않은 비빔장 .. 딱 내 스타일~~성천 막국수 의 유래에 대한 자세한... ,행복한 일들만 생길꺼야...,https://blog.naver.com/thswodbs97,2021-10-02
"『서울맛집/논현맛집』 성천막국수 -비빔막국수,제육",https://blog.naver.com/kazuyyy?Redirect=Log&logNo=221692780596," 성천막국수메뉴판. 비빔막국수2개,제육 주문. 주문하고 맛있게 먹는법 정독. 형님께서 여긴 처음오면 무조건 비빔부터 먹어봐야된데. 물막국수는 도전이라는 단어가 나올정도의 호불호가 쎈놈이라네 따뜻한... ",[사부작]맛있는 인생,https://blog.naver.com/kazuyyy,2019-10-30
동치미는 소주 안주성천막국수 ,https://blog.naver.com/tabula9548?Redirect=Log&logNo=222025357819,동치미는 소주를 부른다 양재동 삼호물산 지하성천막국수'성천'은 평안도 지명을 뜻한다 이 식당에... 동치미막국수 곱빼기 8500원 매우 밍밍한 맛 동치미에 메밀면을 넣은 순박한 맛 동행한 30대들이 절대... ,식당밥일기,https://blog.naver.com/tabula9548,2020-07-09
"1485번째 식당 /성천막국수/ 논현: 메밀의 중력, 동치미의 질주",https://blog.naver.com/tastesherlok?Redirect=Log&logNo=221682545917,제육 한접시 물막국수 메밀면이 그릇의 중앙에 우아하게 떴다. 뒤이어 동치미의 시원함이 막힌 가슴을... 두툼하고 향긋한 메밀면은성천막국수 의 상징이다. 끈기가 좋고 상업적으로 잘 빠졌다. 국수는 제자리를... ,미식탐정,https://blog.naver.com/tastesherlok,2019-10-19
 성천막국수맛있다,https://blog.naver.com/xangela00?Redirect=Log&logNo=222344226187,아주 오래전부터 가고 싶었던 백종원님 추천 막국수집! 한적한 답십리 골목 어딘가에 자리잡은 이 곳은... #주차는중산공영주차장 #백종원맛집 # 성천막국수#맛있다그램 #면스타그람 #필동면옥가자 #평냉못잃어... ,안젤라스,https://blog.naver.com/xangela00,2021-05-09
 성천막국수답십리 맛집 찾아갈 맛!!,https://blog.naver.com/queenmee?Redirect=Log&logNo=222494250831, 성천 막국수집도 갔다왔지. ㅋㅋ 요기 요기 맛있다고 해서 다녀왔거든요. 값도 착하고 맛도 있고 이런 곳은 많이 알면 좋은데. ㅎㅎ 막국수와 제육이 유명한 집입니다. 비쥬얼은 별것 안들어 간것 같은데... ,queenmee님의 블로그,https://blog.naver.com/queenmee,2021-09-03
맛집로드 241 서울/논현역 -성천막국수논현점,https://blog.naver.com/yuiwang3?Redirect=Log&logNo=222435253483,논현역 인근에 위차한성천막국수 . 행정구역은 서초구 반포동. 아들 분이 운영을 하신다. 점심시간에는... 촉촉하고 육즙도 살아있어서 국수와 곁들이면 기분 좋습니다.성천막국수가볍게 먹기 좋은 메밀국수!,호돈신,https://blog.naver.com/yuiwang3,2021-08-17
마늘노포 219 - 막국수맛집 답십리맛집 -성천막국수 ,https://blog.daum.net/djmanul/5857922,"답십리 , 답십리맛집 , 막국수 , 막국수맛집 ,성천막국수답십리를 대표하는 막국수 맛집인성천막국수 . 성천은 주인 할머님께서 평안남도 성천에서 월남을 하셨기에 지어진 이름이라고 한다. 이곳에서만... ",MERRY CHRISTMAS!,https://blog.daum.net/djmanul,2021-09-03
답십리 맛집 노포 동치미막국수성천막국수 ,https://blog.naver.com/nanacook?Redirect=Log&logNo=221393263249,답십리 맛집 노포 동치미막국수성천막국수서울 시내에 드문 동치미막국수를 내는 노포로 무짠지와 저렴한 가격에 맛볼수 제육과 먹는 조합이 좋아 오랜 단골들이 제법 많은 막국수집이죠. 포스팅 했었다고... ,Nana's kitchen,https://blog.naver.com/nanacook,2018-11-07
여름에 막국수 괜찮지요-성천막국수 ,https://blog.daum.net/fotomani/70820,"답십리 , 비빔막국수 ,성천막국수막국수로 빠지지 않는다는 답십리 ㅅㅊ막국수입니다. 6시 조금 지난 시각인데 나이 드신 손님들로 벌써 꽉 찹니다. 기대 많이 됩니다. 처음 가보는 곳이라 맛배기 제육이... ",닥다리로 가는 길,https://blog.daum.net/fotomani,2020-07-17
논현역 맛집성천막국수비빔막국수정식,https://blog.naver.com/minu3025?Redirect=Log&logNo=221570592772,제육은 생각보다 부드러운 편은 아니었습니다. 그래도 면과 고기는 항상 옳으니까 맛있게 먹어줍니다. 혼자와서 먹어도 부담스럽지 않아서 좋은성천막국수 집이었어요. 담엔 물막국수도 도전해봐야겠습니다.,담이의 좌충우돌 여행이야기,https://blog.naver.com/minu3025,2019-06-26
안양성천막국수고소한 들기름 깨소금 가득 영양만점 메밀맛... ,https://blog.naver.com/julia770?Redirect=Log&logNo=222539562015,안양성천막국수정말 고소하고 맛나 매일 반찬이 달라지는성천막국수오늘의정식 도 맛있다고 소문이 자자... 와서 정식도 먹어봐야지. 성천 비빔막국수 고소한 들기름향이 가득하구나... 쫄깃 쫄깃... ,제네뜨's 먹고살기,https://blog.naver.com/julia770,2021-10-17
[논현역 맛집/논현역 막국수]성천막국수논현점,https://blog.naver.com/font21?Redirect=Log&logNo=221602794498,"1.0 방문일자 : 2019년 7월 1일 2.0 음식점 명 : 성천만국수 논현점 3.0 메뉴 : 막국수 6,500~ 3.1 물막국수 6,500...성천막국수 는 물 막국수, 비빔 막국수 동일하게 면의 향이 강했다. 4.8 열심히 잘 섞으니 살짝... ",적절한 먹을거리 탐방,https://blog.naver.com/font21,2019-08-02
평양냉면보다 더 더욱 슴슴한 평안도식성천막국수 ,https://blog.naver.com/tabula9548?Redirect=Log&logNo=221965548237,평양냉면보다 더 슴슴한 평안도식 동치미막국수 평안도식 막국수 양재동 삼호물산 지하성천막국수성천은 평안남도 지명 이름 이 식당의 유일한 시그니처 동치미무 묵은 동치미에 고추장양념 1수저 그리고... ,식당밥일기,https://blog.naver.com/tabula9548,2020-05-16
