title,link,description,bloggername,bloggerlink,postdate
청담 맛집 -쉐이크쉑 청담점 ,https://blog.naver.com/cafeplanet?Redirect=Log&logNo=221025584871,"가게 이름이쉐이크쉑 이라서쉐이크 도 엄청 맛있는줄 알았는데 가격은 엄청 비싼 반면에쉐이크 는... 했고,청담점 도 생기고 동대문 매장도 생기고 해서 상대적으로 덜 기다려도 됩니다. 그래도 식사시간 때 가면... ",cafe PLANET,https://blog.naver.com/cafeplanet,2017-06-11
[ 쉐이크쉑 청담점 ] 쉑쉑버거 테이크아웃,https://blog.naver.com/ghoostmen?Redirect=Log&logNo=221005189906,낮에 일이 있어서 강남에 갔는데 강남쉐이크쉑 은 아직도 웨이팅이 길지만청담점 은 웨이팅이 짧고 자리도 많아서 좋았습니다. 친구가 이곳에서 일을 해서 얼굴 보러 갔다가 메뉴를 포장해 왔어요. 사실... ,N1LOG,https://blog.naver.com/ghoostmen,2017-05-14
- SHAKE SHACK쉐이크쉑쉑쉑버거청담점 ,https://blog.naver.com/mini_won?Redirect=Log&logNo=220927237511,한국에 상륙한 미국식 수제버거 전문점SHAKE SHACK #쉐이크쉑#쉑쉑버거 청담점 오픈한지 꽤 됐지만... 커스터드 쉐이크와 버거를 먹어보러 다시 재방문 해보려구요:-)쉐이크쉑 청담점서울시 강남구... ,미니원 Ep1. eat & buy,https://blog.naver.com/mini_won,2017-02-04
청담 #쉑쉑버거.쉐이크쉑 청담점 ,https://blog.naver.com/commecejour1?Redirect=Log&logNo=221001207254, 쉐이크쉑 청담점먹어볼 사람은 다먹어봤다는 쉑쉑버거. 강남점은 아직도 줄을 서는 것 같고(평일... 쉑쉑버거 청담점. 평일 낮에방문. 줄이 하나도 없었다. 쉐이크쉑이지만 쉑쉑으로 불림. 입장하면 직원이... ,초보냠냐머,https://blog.naver.com/commecejour1,2017-05-08
압구정 / 청담 ::쉐이크쉑버거청담점 ,https://blog.naver.com/ungsblue?Redirect=Log&logNo=220893888978,웨이팅은 생각보다 적음쉐이크쉑 청담점 의 위치는 청담 시네시티 CGV 바로 옆이다. 평일 점심에 가서... 해야지- 쉐이크쉑 버거 청담점 주소 : 서울시 강남구 도산대로 327 SGF청담타워 1층 영업시간 : 11:00-23... ,크리에이티브를 위한 축적의 시간,https://blog.naver.com/ungsblue,2016-12-25
"[ 쉐이크쉑 청담점 ] SHAKE SHACK 한국 2호점, 발빠른 확장",https://blog.naver.com/shapres?Redirect=Log&logNo=220894413373,"쉑쉑 버거라고 불리우는 동부미국 햄버거의 신성,쉐이크쉑(SHAKE SHACK) 버거청담점 을 다녀왔습니다.... 보통쉐이크쉑 에 오면 더블치즈버거 + 오리치즈프렌치 프라이 + 밀크 쉐이크를 먹어야 풀코스라고... ",의학살롱,https://blog.naver.com/shapres,2016-12-25
"쉑쉑버거청담점 ( 쉐이크쉑2호점) 방문 후기 - 메뉴, 가격 등",https://blog.naver.com/aprilyj?Redirect=Log&logNo=220980141935,"조금은 빠르게, 특히 테이크아웃의 경우는 거의 대기 없이 주문해 먹을 수 있어 좋은 것 같아요^^ 이제 주말마다 자주 나와 먹는걸로! ㅋㅋㅋㅋㅋㅋㅋㅋ 쉑쉑버거( 쉐이크쉑 )청담점위치는 아래를 참고해 주세요^^",COJUCOI,https://blog.naver.com/aprilyj,2017-04-11
" 쉐이크쉑 버거청담점 ,쉑쉑버거 쉑스테이크버거❛◡ુ❛",https://blog.naver.com/uhmoo?Redirect=Log&logNo=220997972288,밀크쉐이크는 필수 느끼할수도 있으니 콜라는 맴대루 그렇담 90은 만족하실고에오◟̊◞̊ 쉑쉑버거 강남점보다 청담점 추천할게오 자리는 넓진 않지만 덜 복잡하고 덜 기다려요쉐이크쉑 청담점 은 학동사거리... ,Ordinary,https://blog.naver.com/uhmoo,2017-05-04
 쉐이크쉑 청담점쉑쉑버거보다 솔티드카라멜쉐이크에 프라이,https://blog.naver.com/silver9776?Redirect=Log&logNo=220963962600, 쉐이크쉑 청담점쉑쉑버거보다 솔티드카라멜쉐이크에 프라이 지난달 청담동 SGF청담타워 빌딩에 뱃살빼러 갔던 날 같은 건물 1층에 쉐이크쉑이 떡하니 자리하고 있는 거예요 작년 여름 쉐이크쉑 강남점의... ,시스터츄의 뷰티플스토리,https://blog.naver.com/silver9776,2017-03-22
청담 맛집/쉐이크쉑 청담점 / 쉑쉑버거 2호점 오픈!!,https://blog.naver.com/rolo_ggo?Redirect=Log&logNo=220888672706,청담점이 백배 나음 ㅋㅋㅋㅋ 굿즈도 판매! 아 아직 라스베가스 후기도 못 썼는데...ㅋㅋㅋㅋㅋㅋ 헤헿 상모돌리는 일러스트 넘 귀여웠어요*_*쉐이크쉑 청담점 은 Better 2gether이란 컨셉으로 유명 디자인... ,하고 싶은 거 하는 중인 꿀정네,https://blog.naver.com/rolo_ggo,2016-12-18
청담동 나들이 : 쉑쉑버거 2호점쉐이크쉑 청담점 ,https://blog.naver.com/mizapark1?Redirect=Log&logNo=220892659008,"이날 오픈했다는쉐이크쉑2호점,청담점 으로. 강남에 1호점이 오픈한지 꽤 시간이 지난 지금도 종종 아침부터 줄 서있는걸 보곤 하는데...청담점 도 역시나ㅇㅅㅇ ㅇㅅㅇ...성의가 1도 느껴지지 않는 메뉴판... ",미자박 in Somewhere,https://blog.naver.com/mizapark1,2016-12-22
"나트륨에 혀가 찌릿찌릿, 쉑쉑버거쉐이크쉑 청담점 ",https://blog.naver.com/sowon_3?Redirect=Log&logNo=221485502090,걸어쉐이크쉑 청담점 으로 갔다.우리나라에서는 spc가 들여왔다. 정확한 위치는 요기! 강남에서... 그리고 솔티드캬라멜쉐이크 넘나 느끼해버린것.. 나는 앞으로 갈일 없을 거 같지만.. 짜고... ,인생 _퀘스트_ ing,https://blog.naver.com/sowon_3,2019-03-11
드디어 먹어본 쉑쉑버거쉐이크쉑 청담점솔직후기! _ 앨리스,https://blog.naver.com/hmujul?Redirect=Log&logNo=220917017490,청담점은 그렇게 웨이팅이 심하지 않다는 소식을 접하고 방문하게 되었답니다 쉑쉑버거 #쉐이크쉑버거... 쉑쉑버거 /쉐이크쉑 청담점영업시간이에요 밖에는 웨이팅이 조금 밖에 없었지만 내부에 웨이팅이... ,PB_CLOSET [PB의 옷장 _ 피비클로젯],https://blog.naver.com/hmujul,2017-01-21
명물 햄버거브랜드 국내론칭 ' 쉐이크쉑 (Shake Shack)청담점 ',https://blog.naver.com/timeword2?Redirect=Log&logNo=221323363195,[먹거리] 서울 강남구 해외프랜차이즈 뉴욕의 명물 햄버거브랜드 국내론칭 '쉐이크쉑(Shake Shack) 청담점'쉐이크쉑 청담점서울시 강남구 도산대로 327 SGF청담타워(신사동) 02-510-5217 뉴요커들의 버거라 하는... ,비즈니스코칭 - 부산잡코칭센터,https://blog.naver.com/timeword2,2018-07-21
 쉐이크쉑 버거청담점 @Shake Shack Burgers,https://blog.naver.com/lego8099?Redirect=Log&logNo=220902646952,Shake Shack Burgers쉐이크쉑버거청담점남들 다 먹어보는 쉑쉑( 쉐이크 쉑 )버거 나도 먹어보았지. ㅋ 강남역에 줄줄이 줄을 서는 걸 보고선 엄두도 안났는데 다행히 청담 2호점이 생기면서 나같은 사람도... ,먹고 마시고 공부하고 놀기,https://blog.naver.com/lego8099,2017-01-04
"학동사거리 맛집 : 줄 서서 먹는 쉑쉑버거,쉐이크쉑 청담점 ",https://blog.naver.com/yr1032?Redirect=Log&logNo=220906086305,"그 유명한 쉐이크쉑(SHAKE SHACK)으로 고고싱!! 거의 1시 다 되어 갈 때쯤 왔는데 줄이 어마어마;; 앞에... 있던쉐이크쉑 청담점매장. 진동벨이 울려서 찾아오면서 케챱과 머스터드소스도 가져왔다. 마요네즈, 후추... ",솔직담백 Reality ♪,https://blog.naver.com/yr1032,2017-01-09
"청담맛집쉐이크쉑버거청담점 , 뉴욕 쉑쉑버거과 비교하기",https://blog.naver.com/nau2001?Redirect=Log&logNo=220971313096,"청담맛집쉐이크쉑버거청담점SHAKE SHACK 평일, 오전 청담맛집 아우어베이커리에 도전하기 위해 찾아간 청담동 퇴근길에 갔더니 빵이 하나도 없어서, 맘 먹고 왔는데요 그런데 아우어베이커리를 클리어하고... ",와그잡의 트래블홀릭,https://blog.naver.com/nau2001,2017-03-30
[맛집평가]쉐이크쉑 청담점(강남구 도산대로 327),https://blog.naver.com/release?Redirect=Log&logNo=221372502098,"수제버거로 유명한쉐이크쉑 청담점에 갔다 왔다. 뉴욕에 가면 블록마다 하나씩 있다는데... 거쳤는데, 쉐이크쉑은 이에 역행하는 듯 상당한 고염식을 팔고 있다 (예를 들어 셱버거더블의 나트륨... ",Release's Blog,https://blog.naver.com/release,2018-10-07
[청담동 맛집]쉐이크쉑 청담점(쉐이크쉑 2호점 청담점 방문!... ,https://blog.naver.com/woojoo90?Redirect=Log&logNo=221091954089,"그 1층, 쉐이크쉑입니다!쉐이크쉑 청담점 은 강남점 이후 생긴 쉐이크쉑 2호점 매장이죠~ SPC PLAY가... 쉑 스택! 주문했습니다. 별 2개짜리 메뉴가 가장 잘나가는 메뉴라고 하더라구요 지난 번에 먹었던것보다는... ",CJ 투어 (Cafe & Joy Tour),https://blog.naver.com/woojoo90,2017-09-08
 쉐이크 쉑 (쉑쉑버거) 국내 2호점청담점오픈(12월 17일),https://blog.naver.com/lhkny96?Redirect=Log&logNo=220886897634,쉐이크 쉑 한국 인스타그램 계정의쉐이크 쉑 청담점공식 오픈소식 쉐이크쉑 1호점 강남점... 2호점 청담점 이번 청담 쉐이크 쉑은 버거 메뉴 이외에도 아래 특별 디저트 메뉴 4가지가 추가된다고 합니다.... ,YKTM_You Know That Mean,https://blog.naver.com/lhkny96,2016-12-15
쉐이크쉑버거/쉑쉑버거청담점/쉐이크쉑청담점 ,https://blog.naver.com/ddalgi345?Redirect=Log&logNo=220937532883,사진이 전체적으로 누렇게 나오는건 ㅠㅠ 좀 슬프네요 ㅋㅋㅋ 쉐이크쉑버거/쉑쉑버거 쉐이크는 진짜... ㅋ * 쉐이크쉑 청담점 / 쉑쉑버거 청담점 *영업시간: 11:00~23:00 인스타그램 로고 누르시면 제... ,꽃피는 봄이오면♥,https://blog.naver.com/ddalgi345,2017-02-17
[학동사거리 맛집]쉐이크쉑 (쉑쉑)청담점- 1년째 줄서서 먹는... ,https://blog.naver.com/sielle83?Redirect=Log&logNo=221017567811, 쉐이크쉑 청담점/ 강남구 도산대로 327 (신사동 652-16) SGF청담타워 1층 전화번호 없음 영업시간 11:00... 밀크쉐이크에 찍어먹는 게 유명한데그건 어릴 때나 하는거 아닌가!! ㅋㅋㅋ 청담동 맛집 쉐이크쉑... ,여의도 직장인 문썬의 밥상 (舊 을지로),https://blog.naver.com/sielle83,2017-05-31
서울 청담 수제버거 / 쉑쉑버거청담점- 드디어맛본쉐이크쉑 과... ,https://blog.naver.com/choeun2?Redirect=Log&logNo=221234583894,"신사동에 위치한 쉑쉑버거쉐이크쉑 청담점주소 서울특별시 강남구 도산대로 327 SGF청담타워 1층... 9), 감자튀김인 쉑 후라이 (3.9), 생맥주인 쉑마이스터에일 (7.4) 바닐라쉐이크 (5.9), 코카콜라 스몰 (2.7) 합계... ",아피의 세상구경,https://blog.naver.com/choeun2,2018-03-22
압구정/도산공원/학동사거리 맛집쉐이크쉑 청담점(Shake... ,https://blog.naver.com/love_whatudo?Redirect=Log&logNo=220963326358,그래도 강남보다는 청담 쉐이크쉑이 사람이 적다네요 줄에 서있는데 테이크아웃 손님은 바로 입장... +쉐이크쉑 청담점(Shake Shack) 서울특별시 강남구 도산대로 327 SGF청담타워 1층 영업시간 11:00am ~ 23:00pm... ,love what you do,https://blog.naver.com/love_whatudo,2017-03-21
"[압구정 맛집]쉐이크쉑2호점, 쉑쉑버거청담점 : Shake... ",https://blog.naver.com/dew0023?Redirect=Log&logNo=221106252447,아니라며..... 쉐이크 는 저 혼자 먹으라고 ㅋㅋㅋㅋㅋㅋㅋㅋㅋㅋ 주문을 마치고 자리를 잡고진동벨이 울리기를 기다리고 있습니다 :) 쉑쉑버거청담점매장 내부 분위기에여... ,알콩이달콩이,https://blog.naver.com/dew0023,2017-10-20
" 쉐이크쉑 청담점 에서 간만에 수제버거, 쉑쉑버거 먹고 왔어요!",https://blog.naver.com/sdyeon89?Redirect=Log&logNo=221040872595,"얼마 전 # 쉐이크쉑#쉑쉑버거 먹고 왔어요, 처음 쉑쉑이 한국에 상륙? 했을 때 강남점 앞에 줄을... 06(목)요일까지 해피오더 주문하면 대기 없이 픽업할 수 있나봐요,청담점 에서만 가능하다고 하니... ",연이의 알록달록한 일상 :),https://blog.naver.com/sdyeon89,2017-06-30
 쉐이크쉑버거청담점짱맛!! +쉑쉑버거 주차,https://blog.naver.com/haejju?Redirect=Log&logNo=221004140487, 쉐이크쉑버거청담점짱맛!! +쉑쉑버거 주차 # 쉐이크쉑 버거 #쉑쉑버거 강남점에 이어서청담점 에도... 그리고 밀크쉐이크시키지 말길. 감자튀김이 있으니까 콜라랑 같이 먹는게 젤 맛있는거 같당!!... ,헤이쥬의 좋아서 하는 블로그,https://blog.naver.com/haejju,2017-05-13
 쉐이크쉑 버거청담점다녀왔어요,https://blog.naver.com/darai1976?Redirect=Log&logNo=220895776515, 쉐이크쉑버거청담점방문했어요.. 이번주도 방문한 도산동원 근처.. 몇일전부터 길가에 줄서 있는 사람들 발견요... 뭔지 알아보니 강남에서 그렇게 줄서 먹는다는쉐이크쉑버거(일명 쉑쉑버거)가 청담에... ,다라이와 노닥노닥,https://blog.naver.com/darai1976,2016-12-27
' 쉐이크쉑 청담점(a.k.a 쉑쉑버거)' - 맥도날드와 버거킹의... ,https://blog.naver.com/for2003?Redirect=Log&logNo=221019095041,있던 ' 쉐이크쉑 ( 청담점 )' 방문. 주말에 이 앞을 지날일이 종종 있어서.... 평소에 줄이 거의 없길래 아.... 쉐이크 종류가 워낙에 다양하고 유명하지만 관심 1도 없고요. 버거를 먹으면서 알콜 없는 음료 마실... ,Alcohol Utopia 문종성시 門宗成市,https://blog.naver.com/for2003,2017-06-01
 쉐이크쉑 청담점 。SHAKE SHACK... 카라멜 쉐이크... ,https://blog.naver.com/for8405?Redirect=Log&logNo=220929278454,"쿨럭 처음 와보는 곳은 기본 + 먹어보고 싶은거 + 인기많은거 주문해야징 ~ㅎ쉑버거 ₩6,900 쉬룸 버거...쉐이크먹으러 또 올래 웨이팅 귀찮은 분들청담점 으로 오세요 ㅎㅎㅎㅎ 청담 맛집쉐이크쉑 ... ",향 BLOG,https://blog.naver.com/for8405,2017-02-07
 쉐이크쉑2호점청담점12월 오픈소식!,https://blog.naver.com/berakol?Redirect=Log&logNo=220878415210,"이번쉐이크쉑2호점청담점 의 호딩 프로젝트 주제는 '함께 하면 더 좋은' 뜻을 담은, '베터 투게더 (Better 2gether) 입니다. 이번 호딩은 국내 미디어 아티스트 그룹 '아토드' 디자인 스튜디오 '팰린드롬' 과의... ",제이팍도사,https://blog.naver.com/berakol,2016-12-05
쉑쉑( 쉐이크쉑 ) 버거청담점 ,https://blog.naver.com/pipi_alone?Redirect=Log&logNo=221261176419,드디어 먹어보기 위해 쉑쉑버거청담점방문. 알고보니 SPC그룹 에서 가져온 거라 해피포인트 적립도... 명칭도 ' 쉐이크쉑 '이고쉐이크 의 Shake 2개가 아니라 Shake Shack 이었네 'Shake쉐이크Shack쉑 '. Shack은... ,안녕해,https://blog.naver.com/pipi_alone,2018-04-25
 쉐이크쉑버거청담점쉑버거/스모크쉑/바닐라 쉐이크 /감자튀김,https://blog.naver.com/heartplace16?Redirect=Log&logNo=220988926242,"줄이 항상 긴 강남점은 도저히 기다릴 엄두가 안났어요ㅠㅠ 오다가다하며 많이 봤는데청담점 은... 바닐라쉐이크포장 주문 :쉐이크쉑 에서 제공해주는 케첩, 머스타드, 핑크솔트와 마요네즈를 야무지게... ",HEARTPLACE♥ 뷰티 메이크업 디자인♥,https://blog.naver.com/heartplace16,2017-04-21
[ 쉐이크쉑 버거] 청담점 에 가면 밥장을 만날 수 있네,https://blog.naver.com/jbob70?Redirect=Log&logNo=220919649393, 쉐이크쉑 버거청담점 에 가시면 햄버거랑쉐이크맛있게 드신 다음 상품 코너에 들러서 잠깐 만지작거리다 오시길. 그리고 가볍게 인증샷도 찍어보세요. 사시면 뭐 더할 나위없이 고맙습니다.,밥장의 에피파니,https://blog.naver.com/jbob70,2017-01-25
실시간쉐이크쉑 청담점 ,https://blog.naver.com/jenny8428?Redirect=Log&logNo=220949293126,실시간 # 쉐이크쉑요기는 쉑 쉑 청담점 이에요 오늘 점심도 버거 저녁도 버거 ㅋㅋㅋㅋㅋ 오가나네 피부과 가기전에 1층에서 버거충전 ㅋㅋㅋ 사람 많은데 줄은 안서네용 주문할때 1-2분 기다리고 끝! 홍홍... ,New 반짝반짝 스윗제니 ♥,https://blog.naver.com/jenny8428,2017-03-03
압구정맛집 ::쉐이크쉑버거청담점쉑쉑버거~~,https://blog.naver.com/yeojinkim?Redirect=Log&logNo=221069742943,압구정로데오의 K현대미술관 관람 후 맛집 검색으로 다녀온쉐이크쉑버거청담점 이예요. 뉴욕에... 밀크 쉐이크 는 너무 양이 많고 부담스러워서 가볍게 레모네이드도 주문했어요. 감자까지 주문하면 너무... ,천연사랑 & Handmade,https://blog.naver.com/yeojinkim,2017-08-10
[ 쉐이크쉑 청담점 ] 처음 맛본 쉑쉑 버거,https://blog.naver.com/placebo8100?Redirect=Log&logNo=221329902931,"엄청난 인기, 줄 세우기로 유명했던쉐이크쉑 ! 드디어 맛보다! 평일 점심, 차 전시장 투어 중간에 점심으로 맛본 쉑쉑 버거. 엄청난 줄 세우기로 유명했는데, 지금은 적당히 기다리면 된다. (5분 정도) 그래도... ",placebo,https://blog.naver.com/placebo8100,2018-07-31
쉑쉑버거쉐이크쉑2호점청담점오픈소식!!,https://blog.naver.com/yjnu32?Redirect=Log&logNo=220885191072,사실 밤에 지나가다 본쉐이크쉑2호점청담점호딩 프로젝트 처음엔 오 쉑쉑버거 저기서 먹을 수 있구나! 했다가 어떤 호딩 프로젝트 인고 하고 봤더니 오모오모~ 1호점과는 또 다른 컨셉이더라고요... ,ƪ(•̃͡•̃͡ ƪ 새별답고 새별스럽게,https://blog.naver.com/yjnu32,2016-12-13
[신사동] 쉑쉑버거/쉐이크쉑 버거청담점SHAKE SHACK / 마감... ,https://blog.naver.com/ky130720?Redirect=Log&logNo=221448247320, 쉐이크쉑 청담점11시 - 23시(10시30분 라스트오더) 오랜만에 쉑쉑 마감시간에 오니 한가하다. 웨이팅도 없다. 뭔가 빨리 먹고가야할거같은 분위기. 정리하는 분위기ㅋㅋ 기본 쉑쉑버거 2개랑 쉑스테이크 버거... ,무관심은 유죄!,https://blog.naver.com/ky130720,2019-01-22
[신사동]쉐이크쉑 청담점 ,https://blog.naver.com/djkim74?Redirect=Log&logNo=221419656375,"많은쉐이크쉑 청담점 . 행정 구역상 신사동이고 가까이에 학동사거리, 도산공원, 심지어 바로 뒷편이 압구정로데오임에도 불구하고 청담점이라 이름 붙인 것을 보니 청담이란 상징성을 꽤나 끼고 싶었나 보다.... ",Ray' story,https://blog.naver.com/djkim74,2018-12-15
쉑쉑버거청담점쉐이크쉑메뉴 간단 후기!!,https://blog.naver.com/rudals0229?Redirect=Log&logNo=220920026106,쉑쉑버거청담점쉐이크쉑메뉴 간단 후기!! 드디어 콩미니블로그에도 쉑쉑버거 후기가... 제가 주문한쉐이크 카고인데 진짜 엄청 장난아니게 짜고 넘 짜서 다른 맛은 안느껴지는.. 음료도 레몬에이드와... ,콩미니의 일상♡,https://blog.naver.com/rudals0229,2017-01-25
 쉐이크쉑 (쉑쉑)버거청담점 ,https://blog.naver.com/gmldi72722?Redirect=Log&logNo=220933533903," 쉐이크쉑shake shack(쉑쉑)버거청담점 을 소개하께요 강남구 청담동에 위치한쉐이크쉑shake shack... ㅎㅎ 일단은 메뉴를 잘 몰라서 매장에서 가장 인기 있는 것만 주문하였어요쉑shack 버거 상추, 토마토, 치즈... ","유기농거담 황금약도라지(유기농,로하스인증)농가",https://blog.naver.com/gmldi72722,2017-02-12
" 쉐이크쉑 버거청담점 , 쉑쉑버거쉬룸버거",https://blog.naver.com/lostchild666?Redirect=Log&logNo=221098876125,"쉑쉑버거청담점 . (정식 명칭은쉐이크쉑 인데 다들 쉑쉑버거라 부른다죠ㅋㅋㅋ) 청담쪽은 거의 명품샵... 버거로 쌓는 우정ㅋㅋㅋ 쉑버거(싱글) 6,900 쉬룸버거 9,400쉐이크 -바닐라 5,900 콜라(레귤러) 2,700 내 사랑... ",우리 이야기,https://blog.naver.com/lostchild666,2017-09-17
[강남]쉐이크쉑 청담점 ,https://blog.naver.com/mangomango217?Redirect=Log&logNo=221500089087,# 쉐이크쉑청담점#강남쉐이크쉑 카메라로 안찍으니까 낯설다 저 멀~~~리서도 쉑쉑 알아볼수 있음... 바닐라 쉐이크 이렇게 주문했다 넘나 2마넌이고요 ... 평일이라 그런가 넘 한산쓰 ... 직장인들의 거리라서... ,성망고의 재미지는 인생,https://blog.naver.com/mangomango217,2019-03-29
 쉐이크쉑 청담점 ,https://blog.naver.com/webdyphoto?Redirect=Log&logNo=221658090957,참에청담점 을 다녀왔습니다. 도산공원쪽에 위치해 있으며 가까운 압구정로데오거리가 있어 데이트장소로도 나쁘지 않은 것 같습니다.쉐이크쉑매장 인터레어 매장안쪽에는 높게 트인 공간이 있습니다.... ,IT카메라를 좋아하는 웹디포토,https://blog.naver.com/webdyphoto,2019-09-24
