title,link,description,bloggername,bloggerlink,postdate
 아노브3H부스팅앰플 / 진정앰플 / 속보습앰플,https://blog.naver.com/dlatmfrl5824?Redirect=Log&logNo=222515509559, 아노브 의 3H 부스팅 앰플입니당 ! # 아노브#3H부스팅앰플 #진정앰플 #속보습앰플 # 아노브 앰플 요렇게 주황주황한 패키지에요 ! 피부 치유속도를 향상시켜주는 병풀에서 추출한 ‘아시아티코사이드’는... ,초기네 집 ఌ,https://blog.naver.com/dlatmfrl5824,2021-09-24
커먼그라운드 팝업스토어아노브ANOV 런칭 스킨케어브랜드,https://blog.naver.com/roorim?Redirect=Log&logNo=222519919778,런칭한아노브팝업매장에 들려봤어요 피치한 컬러감과 너모 이쁜 인테리어에 눈이팔려 나도모르게... image아노브스킨케어제품 써보고싶어졌어요 키키 집인쥴~~~ㅎㅎ 얌전하게도 잘있네욤 인테리어나... ,KiKiSiKi,https://blog.naver.com/roorim,2021-09-28
 아노브건대 커먼그라운드아노브 코스메틱스,https://blog.naver.com/nangongjoo?Redirect=Log&logNo=222515028696,건대 커먼그라운드아노브 코스메틱스 조기 퇴근 하던 어느 평일 날. 건대 커먼그라운드에아노브 코스메틱스 팝업스토어가 열렸다는 소식을 듣고 퇴근 하자마자 한걸음에 달려갔다.아노브 는 프리미엄 기초... ,연 블로그'◡'ღ,https://blog.naver.com/nangongjoo,2021-09-24
커먼그라운드아노브 코스메틱 팝업스토어 / ANOV / 이벤트,https://blog.naver.com/pajama229?Redirect=Log&logNo=222520080448,#ANOV # 아노브# 아노브 코스메틱스 #미친기초 #스킨케어 #기초스킨케어 #기초를위한기초스킨케어 #기기스케 #비너스화장품 커먼그라운드 02-467-2747 서울 광진구 아차산로 200 (자양동 17-1) 매일 11:00 - 22:00 주차... ,✦제린이의 리뷰 세상✦,https://blog.naver.com/pajama229,2021-09-28
최자로드 피자집 연남피자 홍대피자맛집아노브연남,https://blog.naver.com/jhn1447?Redirect=Log&logNo=222515832047,당시에 최자로드에 나온 음식은 믿고 먹는다고 찾아서 다니곤 했었는뎅ㅎㅎㅎ 얼마전 우연히 최자로드 짤을 보고 급 연남동피맥아노브 연남에 다녀왔어요^^아노브연남 서울특별시 마포구 동교로 267 2층... ,밥보다유건,https://blog.naver.com/jhn1447,2021-09-24
 아노브아노브 코스메틱스 건대커먼그라운드 다녀왔어요!!,https://blog.naver.com/venusjk?Redirect=Log&logNo=222520501125,저는 오늘아노브팝업스토어에 갈 예정인데요. 이정표 앞에서 오른쪽으로 가야 해요. 마켓홀쪽으로 GO GO 건대 커먼그라운드에서아노브팝업스토어온라인 동시 런칭 이벤트 진행 (일자: 9월1일... ,비너스의 이야기,https://blog.naver.com/venusjk,2021-09-29
"[ 아노브 ] 3H부스팅앰플, 진또배기 속보습앰플",https://blog.naver.com/srt978?Redirect=Log&logNo=222511815779,"수부지에겐 속보습은 숙명과 같은 녀석이죠아노브3H부스팅앰플 ANOV 3H Boosting Ampoule 30ml / 66,000 won... ㅎ 성격이 급해서 이리저리 물건 떨어뜨리는 일이 너무 많거든요 ㅋㅋㅋ 같이 온 팜플렛은아노브만의... ",뚜식월드,https://blog.naver.com/srt978,2021-09-20
이태원 루프탑아노브 (ANOV) - 한남동 분위기좋은 와인 카페,https://blog.naver.com/rlask4256?Redirect=Log&logNo=221599143559,싶은데아노브 에는 엄청 착하고 이쁜 라라 라는 강아지있어요 ㅋㅋㅋㅋㅋㅋ 너무 순딩순딩한 아이인데... 또아노브ㅋㅋㅋㅋㅋㅋ 매일 가고싶은 곳아노브 에서 전시도 열린다고 하니 인스타에아노브치시고... ,나요핏,https://blog.naver.com/rlask4256,2019-07-29
홍대피자맛집아노브연남 최자로드에 나온 맛집,https://blog.naver.com/oop3457?Redirect=Log&logNo=222511931302, 아노브연남 전화번호 0507-1332-6606 주소/위치 서울 마포구 연남동 229-67 2층 홍대입구역 3번 출구에서... 유명한아노브연남에 다녀왔다 간만에 연남동 데이트라 설렜음 홍대피자맛집아노브연남은 2층에... ,김땅콩의 하루,https://blog.naver.com/oop3457,2021-09-21
 아노브 코스메틱스아노브팝업스토어 후기,https://blog.naver.com/guuulll?Redirect=Log&logNo=222510879405,"커먼그라운드아노브팝업스토어 안녕하세요, 뷰티블로거 기린이예요! 평소 화장품에 관심이 많아서 건대입구역 핫플인 커먼그라운드에아노브팝업스토어에 다녀왔어요 ♡ 오렌지 계열의 상큼한 분위기의... ",기린 일상 블로그 :D,https://blog.naver.com/guuulll,2021-09-19
[ 아노브 ] 3H부스팅앰플 / 예민해진 피부 진정앰플로 관리하기,https://blog.naver.com/nameng25?Redirect=Log&logNo=222511804452,알게된 ( 아노브 앰플) 3H부스팅앰플 ! 포장이 너무 예쁘게 와서 사용하기 전부터 이미 제 마음에 쏙... 외에도 ( 아노브 앰플) 3H부스팅앰플 의 주요성분으로 치유속도를 향상시켜주는 병풀에서 추출한... ,梦梦梦,https://blog.naver.com/nameng25,2021-09-20
 아노브 코스메틱스 건대 ANOV 팝업스토어 방문기,https://blog.naver.com/nikiko?Redirect=Log&logNo=222509386993, 아노브 코스메틱스 팝업스토어를 둘러보기 위함이었어요 :)아노브팝업스토어는 광진구 건대 커먼그라운드에 있어요. 건대입구역 6번 출구에서 도보로 5-10분 거리랍니다. 이곳이 바로 커먼그라운드에요.... ,신새댁의 육아 신세계♥,https://blog.naver.com/nikiko,2021-09-17
"[ 아노브 ] ANOV, 건대 커먼그라운드 팝업스토어, 프리미엄 기초... ",https://blog.naver.com/ehdwlwnr?Redirect=Log&logNo=222520036170,"—————————————————————— # 아노브 ,아노브 코르메틱스 팝업스토어 소개해드리겠습니다! #ANOV # 아노브# 아노브 코스메틱스 #미친기초 #스킨케어 #기초스킨케어 #기초를위한기초스킨케어... ",오저스틴의 블로그,https://blog.naver.com/ehdwlwnr,2021-09-28
[연남동]아노브연남,https://blog.naver.com/melodioso?Redirect=Log&logNo=222511927347,등장했다는아노브연남을 찾았다! 도착하고보니 소이연남 위층이었다! 주택을 개조해서 아래/위로 따로 영업을 하고 있었다. 신기하구만~ 담벼락에아노브메뉴가 적혀있다. 지나가다가도 메뉴를 먼저 훑어볼... ,나의작은삶,https://blog.naver.com/melodioso,2021-09-21
이태원 피자 맛집아노브리뷰(내돈내산)/오겜월드 연장 끝,https://blog.naver.com/yeonaui421?Redirect=Log&logNo=222516249279,맛집아노브아노브이태원 메뉴아노브 가 자리 이전을 한 모양이에요 원래는 루프탑이 있는 피자집이라 루프탑에서 오겜 돼지저금통 보고 싶었는데 그것마저 실패했습니다 자리 이전을 한 건 아쉽지만 맛은... ,부룩바락의 신명나는 하루,https://blog.naver.com/yeonaui421,2021-09-25
트렌디한 화장품아노브 코스메틱스 커먼그라운드 ANOV,https://blog.naver.com/dodomea?Redirect=Log&logNo=222512764743,COSMETICS 트렌디한 화장품아노브 코스메틱스 커먼그라운드 ANOV 건대입구역 주위에는 다양한 쇼핑...아노브 에서는 자연 유래 성분을 사용한 기초 제품으로아노브피직스 플루이드 32를 핵심 성분으로 해요.... ,보물보따리,https://blog.naver.com/dodomea,2021-09-25
"[서울 용산구 이태원]아노브 (ANOV), 피자(Pizza)",https://blog.naver.com/kms-work?Redirect=Log&logNo=222526300505,서울에 올라가서 첫 끼는 이태원에 위치한 피자 맛집아노브 (ANOV)에서 하게 되었다. 영상에서 볼 수 있듯이 테라스 마냥 밖에서 먹을 수 있는 자리가 있다 날이 정말 좋아서 열어둔 창문을 통해 들어오는... ,Experience Sharing Platform,https://blog.naver.com/kms-work,2021-10-04
 아노브런칭기념 건대 커먼그라운드 ANOV 팝업스토어 방문기,https://blog.naver.com/selove2?Redirect=Log&logNo=222510804623,"브랜드인,아노브 코스메틱 팝업스토어에 방문해보았어요 기본 원료에 집중한 브랜드라고 하는데요 들어가기만 해도 공주로 만들어주는 예쁜 ANOV 팝업스토어로 함께 놀러가보실까요?아노브팝업스토어 위치... ",빨강머리 애니의 똥꼬발랄 하루,https://blog.naver.com/selove2,2021-09-19
"맛집/카페 추천] 빠레뜨 한남, 스튜디오 콘크리트,아노브이태원",https://blog.naver.com/the627?Redirect=Log&logNo=222532985874,"ㅋㅋㅋㅋ 카페에서 수다 떨다가 소화시킬 겸아노브이태원까지 걸어갔다! 들어와서 각자 마실 음료 주문했는데, 스페인 맥주인데 알쓰인 내 스타일! 우리는 프렌치 프라이즈랑 반반피자로 갈릭 바베큐 치킨이랑... ",Yullish::나를 담는 곳,https://blog.naver.com/the627,2021-10-10
"연남동피맥 맛집 :: 분위기맛집, 피자맛집 ' 아노브 '",https://blog.naver.com/danb1037?Redirect=Log&logNo=222507566579,"연남동피맥 / 홍대피자맛집아노브날씨 선선해진 요새 바람 선선히 부는곳에서 맥주한잔하기 딱... 이미 한남동에서도 유명한아노브 , 연남동에도 아주 분위기 좋은 피맥집으로 이미 유명한아노브 !... ",[ 잘먹고 잘사는 머깨B ],https://blog.naver.com/danb1037,2021-09-16
연남피자아노브/ 연남동 테라스 맛집,https://blog.naver.com/horangeat?Redirect=Log&logNo=222506103734,최자로드 출연으로 핫한 연남동피자 맛집아노브 에서 점심을 먹었어요 !!피자도 너무 맛있는데 테라스 분위기가 정말 좋아서 완전 반했습니다아노브연남 영업시간 / 12:00 - 22:00 브레이크타임 / 15:00 - 17:00... ,feed the 호랑잇,https://blog.naver.com/horangeat,2021-09-15
( 아노브 ) 건대 커먼그라운드아노브ANOV 여행용 패키지백... ,https://blog.naver.com/kxxgxxinnn?Redirect=Log&logNo=222514285516,건대 커먼그라운드 팝업스토어로아노브ANOV 가 들어왔다 해서 바로 방문해서 구경하러 갔어요 인생사진 찍었다는 사람들도 많고 ㅎㅎ아노브팝업스토어 제품도 볼겸 포토존에서 사진찍으러 방문했습니다!... ,가니 vlog,https://blog.naver.com/kxxgxxinnn,2021-09-23
' 아노브 코스메틱스' ANOV 팝업스토어 커먼그라운드 런칭... ,https://blog.naver.com/hi_angel?Redirect=Log&logNo=222517608295,기초스킨케어 브랜드 ‘ 아노브 ’ 9월 1일 ~ 9월 30일까지 ※ 건대 커먼그라운드 에서 팝업스토어 런칭 이벤트중! 핫한 소식을 듣고 신나서 댕겨왔어요..ㅎㅎ 자세한 이벤트 안내 전에아노브 코스메틱스... ,꽃보다망고,https://blog.naver.com/hi_angel,2021-09-26
"둘이서 가기 좋은 수제 피자집,아노브연남 (21년 8월초)",https://blog.naver.com/hkim1992?Redirect=Log&logNo=222504224628, 아노브연남 아노프 한남 친구 메뉴 가기 전 포인트 1.아노브한남 피자집을 방문하여 맛있는 피자를 먹은적이 있었음. 피자맛집으로 종종 가던곳 2. 연남동을 배회하다 마주친아노브연남점. 맛집의 기억으로... ,그때 그리고 지금,https://blog.naver.com/hkim1992,2021-09-13
"런오프 사용후기, 한남동 루프탑 펍아노브 ",https://blog.naver.com/jovm268?Redirect=Log&logNo=221329029702,오늘은 이태원 루프탑펍아노브를 런오프를 사용한 후기를 알려드리겠습니다. 한남동 루프탑펍아노브에대해 더 자세히 알고 싶으신 분들은 아래 링크 클릭! https://store.naver.com/restaurants/detail?id=38563100... ,sᴏʟᴀʀ's ʙʟᴏɢ ('∀'●)♡,https://blog.naver.com/jovm268,2018-07-30
"9월 주말일상: 한남동아노브피자,논픽션 쇼룸,맥심 플랜트",https://blog.naver.com/dbswls119?Redirect=Log&logNo=222495020574,"한남아노브베이컨크림파스타 루프탑있는 피자집이었는데 햇살이 뜨거워서 루프탑말고 실내에서 먹었다. 꾸덕꾸덕했던 크림파스타._.아노브반반피자 (페퍼로니,갈릭바베큐치킨) 페퍼로니는 익숙한... ",융D-day :),https://blog.naver.com/dbswls119,2021-09-04
anov아노브속보습앰플 3H부스팅앰플 '스며듬이 다르다',https://blog.naver.com/dbwlsdldia77?Redirect=Log&logNo=222509941679,"패키지도 너무 예뻤지만 성분이 독특해서 사용해 본 anov아노브3H부스팅앰플 일명 속보습앰플로 레알... anov아노브3H부스팅앰플 (PHYSIS FLUID 32) [ 30ml _ 66,000원 ] ▶ 피지스 플루이드 32 - 3H부스팅앰플 고농축된... ",용쓰며 사는 용쓰,https://blog.naver.com/dbwlsdldia77,2021-09-18
"버드와이저,아노브 와 함께 “맥주박 피자 선보인다”",https://blog.naver.com/kjtimes1?Redirect=Log&logNo=222143120363,[KJtimes=김봄내 기자]버드와이저가 피자 전문점 ‘ 아노브 (ANOV)’와 함께 맥주와 피자의 컬래버레이션을... 버드와이저는아노브 와 함께 공동 기획한 ‘버드와이저 피자 세트’를 1000판 한정으로 선보인다.... ,KJtimes,https://blog.naver.com/kjtimes1,2020-11-13
"애견동반 연남동피자 맛집, 연남동피맥 ' 아노브 '",https://blog.naver.com/alliswellkye?Redirect=Log&logNo=222504594413,날씨좋은 점심시간~ 가을 날씨를 만끽하면서 기분좋게 점심으로 피자 먹으러아노브 에 다녀왔어요 ^^ 주소: 서울 마포구 연남동 229-67 왼쪽 계단을 따라서 2층으로 가면아노브 ! 날씨가 너무 좋으니 발걸음이 엄청... ,꿈같은 하루♬,https://blog.naver.com/alliswellkye,2021-09-13
"11. 나는 (아가리)다이어터~(모던눌랑 여의도,아노브연남)",https://blog.naver.com/jojinjjang?Redirect=Log&logNo=222524626012,포브스 선정 이시대 최고의 보양식 '피자'ㅋ 나 참고로 제로콜라 먹었으니까 다이어터 맞다^^아노브피자 연남점 진짜 존맛!!!! 테라스 자리 분위기도 좋고~ 피자가 짜지도 않고 왜케 바삭한거니? 역시... ,얇게 띄엄띄엄 살고 싶다,https://blog.naver.com/jojinjjang,2021-10-03
"낮과 밤과 사람과 나 :: 합정 포비베이직, 이태원아노브 ",https://blog.naver.com/jm_n?Redirect=Log&logNo=221949834761,여기는 이태원아노브얼핏보면 와인을 파는 음식점 같지만 2층엔 주문 받는 곳이 3층엔 갤러리가 있어서 이렇게 전시를 한다 술 마시러 왔다가 전시까지 보는 셈 다시 4층으로 올라가면 루프탑이 나오고 하나의... ,계속 좋아해야지 그래도,https://blog.naver.com/jm_n,2020-05-07
"커먼그라운드 신규 코스메틱 브랜드,아노브 (ANOV)팝업스토어... ",https://blog.naver.com/ah_ye?Redirect=Log&logNo=222510142154,신규 브랜드에 관심을 가지는 편인데 이번에아노브라는 코스메틱이 런칭했다. 경험해볼 기회가... 건대입구역에서 걸어서 5~6분 거리에 위치한 커먼그라운드의 마켓홀로 들어가면 찾던아노브 ... ,Life' log,https://blog.naver.com/ah_ye,2021-09-18
오랜만에 핏짜를 먹었어-기분이 좋았어-! 연남아노브ANOV,https://blog.naver.com/sm4l9?Redirect=Log&logNo=222449640872,어제 스페이스독 갔다가 걸어서 핏짜 먹으러 연남아노브! 스페이스독이랑 걸어서 10분 안걸리는듯 오랜만에 피짜 먹을 생각에 정말 설렜어 난 한남동에1호가 있고 2호로 열었다는아노브 ! 소이연남 2층에... ,그레이솝(GraceHope),https://blog.naver.com/sm4l9,2021-07-29
한남동 : 루프탑아노브 ,https://blog.naver.com/e_jooah?Redirect=Log&logNo=221048859325,"차로 가기에도 걷기에도 애매한 1km 정도 위치에 그나마 가까운 루프탑아노브 가 있었다. 비가 안오는...아노브시그니처이자 알콜도수가 높은 것, 두 가지에 해당되는 걸 골랐는데 너무 맛있어서 모든게... ",좡페이지 :D,https://blog.naver.com/e_jooah,2017-07-11
홍대 연남동 피맥아노브피자 추천,https://blog.naver.com/rabia_q?Redirect=Log&logNo=222517672413,갑자기 대낮부터 피맥 땡겨서 헐레벌떡 들어갔던아노브1층에는 소이연남이 있고 2층이 피자집인데 1층이 엄청 유명한곳이라고 하더라.. (전혀 몰랐음) 여기는 키오스크로 주문하는거라 선결제라고 보면된다.... ,지옥에서 춤을 춰요,https://blog.naver.com/rabia_q,2021-09-26
오성택트리오 뉴욕재즈 @한남동아노브Anov Bar SungTaek... ,https://blog.naver.com/aqua417?Redirect=Log&logNo=220735563845,"분들,아노브 가 선택한 오프닝 파티의 즐거움이었던 뉴욕재즈트리오 오성택트리오 오랜만에 귀정화... 오스레더클러치 :)아노브 가 자랑하는 루프탑, 옥상의 공간은 정말 소중해요 큰 테라스 파라솔과... ",반짝반짝레이나별 ♪,https://blog.naver.com/aqua417,2016-06-14
"이태원루프탑-인생샷을 건지고 싶다면,아노브 ",https://blog.naver.com/8732236?Redirect=Log&logNo=221025890265,"이태원루프탑-인생샷을 건지고 싶다면,아노브한남동루프탑아노브요즘날씨에는 루프탑 가야죠 이태원에 루프탑이 많다는 소문에 일단 이태원으로 친구들이랑 출발!! 검색해보니...가격이 ㄷㄷㄷㄷ 가성비... ",뷰티 좀 아는 선배,https://blog.naver.com/8732236,2017-06-10
"한남동 루프탑,아노브 ",https://blog.naver.com/ingadw?Redirect=Log&logNo=221117812656,"특별한 분위기의 루프탑바를 찾는다면 남산타워가 조망되는아노브 를 추천해요. 한달 전 회사... 이곳에 오면 항상 마시는 주류는,아노브수제 샹그리아 입니다. 샹그리라에 치즈와 소세지 안주면 분위기는... ",쉼표하나,https://blog.naver.com/ingadw,2017-10-16
한남동 루프탑 카페아노브 에서 와인 데이트,https://blog.naver.com/wkdb1106?Redirect=Log&logNo=221089228676,한남동 루프탑 카페아노브 에서의 와인 데이트 오랜만에 이태원에서 대학 동창들과 모임을 했어요. 아... 한남동아노브 라는 사실은 몰랐어요. 그냥 친구들과 저기 가자! 라고 무작정 간 곳인데 알고 보니 그곳이... ,로라의 일상 블로그,https://blog.naver.com/wkdb1106,2017-09-05
한남동카페 한남동루프탑아노브 (ANOV),https://blog.naver.com/dduriya91?Redirect=Log&logNo=221099350791,한남동카페아노브인스타보고 와야지와야지하다가 방문하게된 한남동카페아노브순천향대병원쪽에 있다 엘레베이터가 없어 계단으로 올라갔다 엔틱한가구들이 가득한 이곳 고풍스러운 분위기는 덤 직접... ,"단미의 겨울,",https://blog.naver.com/dduriya91,2017-09-18
아이폰아노브필름케이스로 다양하게연출하기,https://blog.naver.com/sera8668?Redirect=Log&logNo=221157185761,아이폰아노브필름케이스로 다양하게 연출하기 아이폰아노브필름케이스~ 필름케이스의 장점은 저렴하다는것 그리고~ 다양하게 나만의 스타일로 연출할수있다는것 사진출처 :아노브홈페이지... ,여행가세라 여행블로그,https://blog.naver.com/sera8668,2017-12-06
이태원 루프탑 카페! 분위기 좋은 한남동아노브굿,https://blog.naver.com/sol567?Redirect=Log&logNo=221256162425,정확하게는 한남동에 위치해있던아노브입니다:) 맛난저녁을 먹은후 사진도찍고 케익을 킬겸 친구들과... 루프탑아노브 로 찾으시는게 정확합니다! 저멀리 남산타워도 보이고 늦은저녁 어둑해질때쯤 부터... ,솔박이마켓❤,https://blog.naver.com/sol567,2018-04-18
[연남동피자맛집 연남동맛집]아노브연남 피자맛집 추천ෆ,https://blog.naver.com/clcl4423?Redirect=Log&logNo=222537175247,#연남동피자맛집 #연남동피자집 #연남동파스타맛집 #연남동맛집 #연남동분위기맛집 # 아노브# 아노브 연남 # 아노브 연남점 #연남피자집 #연남피자맛집 안녕하세요! 혜삐입니다( ˘͈ ᵕ ˘͈♡)˚๐*˟ ♡ 요즘... ,혜삐 로그.:｡+ﾟღ,https://blog.naver.com/clcl4423,2021-10-14
[이태원/한강진] 피자집 - Anovpizza아노브 피자,https://blog.naver.com/yrchoi2klee?Redirect=Log&logNo=222525599140,#이태원피자 #한강진피자 #한남동피자 #피자맛집 #이태원피맥 #한강진피맥 #한남피맥 #피자맛집 #서울피자맛집 #이태원맛집 #한강진맛집 #한남동맛집 #서울피자맛집 #이태원 아노브# 아노브 이태원... ,배부른 율의 삶,https://blog.naver.com/yrchoi2klee,2021-10-03
진정앰플 수부지 피부를 위해 속보습 채워주는아노브 ... ,https://blog.naver.com/kyacall?Redirect=Log&logNo=222519107988, 아노브3H 부스팅 앰플 피지스 플루이드32 사용후기 ANOV 3H BOOSTING AMPOULE PHYSIS FLUID32 _30ml 진정앰플 수부지 피부를 위해 속보습 채워주는아노브3H부스팅앰플 피부미인이 진짜 미인이라는 말이 있듯이... ,뚱땅킹 하우스,https://blog.naver.com/kyacall,2021-09-28
"한남 - 루프탑피자 맛집,아노브 (+연남아노브 )",https://blog.naver.com/maloon9?Redirect=Log&logNo=222486543311,한남아노브 는 루프탑에서 피맥을 즐길 수 있고 피자도 맛있다기에 점심에 찾아갔었는데 이런!! 오후... 다시방문ㅎㅎ아노브가는길에 이뻐서 사진 한장! 한남아노브내부는 그리크지 않아요. 루프탑이아닌... ,또와또용님의블로그,https://blog.naver.com/maloon9,2021-08-28
 아노브아이폰 필름 케이스 # 은유 생생 후기,https://blog.naver.com/eun2264?Redirect=Log&logNo=221109539916,"힘들었지만,아노브 에서 추천하는 스타일링이 있어서 참고하면서 주문할 수 있어 도움이 됐어요 투명... 빼곤 다 마음에 드는 제품이었어요 필요하신 분들은 아래 사이트 참고하세요 #아노브storefarm.naver.com/anov",일상을 리뷰하다,https://blog.naver.com/eun2264,2017-10-02
"서울가볼만한곳, 커먼그라운드,아노브 (ANOV)코스메틱스... ",https://blog.naver.com/passpasspass21?Redirect=Log&logNo=222514009927, 아노브팝업스토어 어머나 이 코랄코랄 뭐야 너무 예쁘졍 ㅠㅠㅠㅠ 기초 스킨케어에 좀 더 집중한아노브코스메틱스 브랜드로아노브피지스 플루이드32 핵심성분이 포함되어 있어요! 자연유래 원료와... ,RK 브-로그,https://blog.naver.com/passpasspass21,2021-09-23
"한남동 핫플레이스아노브 ! 편집샵, 카페, 루프탑 칵테일바가... ",https://blog.naver.com/marieeeee_?Redirect=Log&logNo=220898046378,"얼마전에 한남동에 있는아노브(Anov) 라는 곳에서 친구랑 놀다왔는데 요즘 한남동 핫플레이스라고... 분들은아노브꼭 검색해보세요!ㅋㅋㅋ 분위기 살짝 보여드릴게용@.@아노브 는 3층, 5층에 있는데 (제... ","MARIE, daily beauty, daily fashion",https://blog.naver.com/marieeeee_,2016-12-29
"필름케이스, DIY폰케이스 아이폰7아노브 ",https://blog.naver.com/edr816?Redirect=Log&logNo=221010032327,"DIY폰케이스 아이폰7 필름케이스,아노브아이폰 폰케이스에 한번씩 꽂힐때가 있는데, 직접 DIY로...아노브 에서 내가 주문한 나의 아이폰 제트블랙 7을 꾸며줄 케이스들. 필름지를 갈아끼워야... ",주야 블로그 ღ,https://blog.naver.com/edr816,2017-05-20
한남동 루프탑 :아노브 ,https://blog.naver.com/eye_onu?Redirect=Log&logNo=221132502128,한남동 루프탑아노브[ANOV] 1.루프탑 #루프탑 #한남동 # 아노브안녕하세요 ON U 에요. 오늘은 한남동의 핫한 루프탑 바 “ 아노브 ” 다녀온지 좀됬지만 추워서 요새 가겠나 ... ? 히터가 있겠쥬? 입구부터... ,EYE ON U,https://blog.naver.com/eye_onu,2017-11-04
아이폰6S 케이스 : DIY가 가능한아노브필름케이스,https://blog.naver.com/hana8210?Redirect=Log&logNo=221054959141,"있는아노브 에서 배경필름, 투명필름 그리고 투명젤리하드케이스 이렇게 필름케이스를 주문해서... 어떤 필름들을 레이어드 하느냐에 따라 그때 그때 새로운 느낌을 낼 수 있다는 것이아노브필름케이스의... ",새벽달 blog,https://blog.naver.com/hana8210,2017-07-19
"틴케이스 다용도로 사용해보자,아노브 (Anov)에서 득템!",https://blog.naver.com/amurug1_nuna?Redirect=Log&logNo=221032378618,* 하나쯤 가지고 있으면 정말 다용도로 활용 가능한아노브 (Anov) 틴케이스 틴케이스 그게 뭐야... 파랑파랑 색감부터 남다른아노브틴케이스 세가지 타입중에 엄청 고민했어요아노브 (Anov)의 시그니처로고 'A... ,빡치는누나 씨즌2+,https://blog.naver.com/amurug1_nuna,2017-06-19
연남동 피맥 맛집 ::아노브찐 맛집 찾았어요 존맛,https://blog.naver.com/sojeong1121?Redirect=Log&logNo=222479758918,안녕하세요 정요입니다~ 오늘은 연남동 피맥 맛집아노브다녀온 솔직 후기를 써보려고 해요~아노브 는 최자로드 맛집에도 있을정도로 엄청 맛집인데....! 진짜 맛있어서 후기 남겨봅니다 ㅋㅋㅋ아노브 는 연남동... ,travelog,https://blog.naver.com/sojeong1121,2021-08-22
[연남동 맛집]아노브 연남 반반피자 !! 진짜 엄청 맛있어요... ,https://blog.naver.com/rlatnwls1679?Redirect=Log&logNo=222507001867,홍대입구 3번 출구 약 350m 에 있는 (바로 앞!!) # 아노브 연남 이라는 피자집이에요 처음에 여기서 사람들이... 다들 봐주셔서 사랑해요 요즘 블로그 잘되는 거 같아서 기부니가 아주아주 좋아요❤ 다들아노브꼭... ,SJ archive,https://blog.naver.com/rlatnwls1679,2021-09-15
