title,link,description,bloggername,bloggerlink,postdate
[한남동] ANOV :아노브바루프탑 카페,https://blog.naver.com/u0828n?Redirect=Log&logNo=220960768089,[ANOV] : 카페바 들어오자마자 시.선.강.탈 여기저기 이곳은아노브 다!!!!!!! 하고 외치는 듯 한 #ANOV...아노브 와서 정말 좋은 시간 보냈어요 사진찍는거 좋아하는 우리 두명은... 얼마나 많은 수다를 떨었는지...!!!... ,[ YOU'RE MY END ❣️ ],https://blog.naver.com/u0828n,2017-03-17
"미술학원]일산 바른미술학원_ 서울 한남동,갤러리카페:아노브 ",https://blog.naver.com/westside_is?Redirect=Log&logNo=221337905588,"[후곡/주엽/백마/대화 미술학원]일산 바른미술학원_ 서울 한남동,갤러리카페:아노브안녕하세요:D 일산... 카페 이름은 ' 아노브 '라는 곳입니다.ㅎ 한남역에서 내리면 5~10분 내외로 찾으실 수 있어요 '블루빌리지... ",예중예고 전문 바른미술학원[일산본원],https://blog.naver.com/westside_is,2018-08-13
예쁜핸드폰케이스::갤럭시 S6 상콤하게 바꿔보기:) ⓦ 아노브 ,https://blog.naver.com/nalago12?Redirect=Log&logNo=221082387436,갤럭시S6 예쁘게 꾸미기아노브핸드폰케이스+필름 저는 원래 핸드폰 욕심이 별로 없어서 핸드폰 산 후... 사이트아노브 에서 투명젤리하드케이스+배경필름+투명필름 일케 준비했어욤~ 다양한 핸드폰 악세사리... ,얼뚱이의 추억담기-♡,https://blog.naver.com/nalago12,2017-08-26
2021.08.10 도미노피자 이태원점 (feat. 아노브 한남... ,https://blog.naver.com/kandeene?Redirect=Log&logNo=222464631672,-피자 도장깨기가 시작된 계기 시작은 # 아노브다. 자주 다니는 길에 있는아노브 는 한 번 가봐야지 하고서는 코로나때문에 결국 루프탑에서 먹는 것은 포기하고 포장을 해서 먹기로 했다. 21000원... ,보통부부의 먹고 사는 이야기,https://blog.naver.com/kandeene,2021-08-10
"PIZZA ( 아노브이태원) (이태원아노브 피자, 이태원 피자... ",https://blog.naver.com/hsy10002?Redirect=Log&logNo=222538546982,#이태원피자#이태원역피자#이태원동피자 #이태원피자집#이태원피자집 #이태원역피자맛집#이태원맛집 #이태원핫플#이태원루프탑#이태원데이트 #맥주박#맥주박피자#최자맛집#이태원 아노브#이태원 아노브 피자... ,"Record, my favorite things.",https://blog.naver.com/hsy10002,2021-10-16
갤러리 아노브구름 모양,https://blog.naver.com/azerowoo?Redirect=Log&logNo=222362566540,갤러리아노브구름 모양 유리 이서윤 2021.05.19~06.07 무료관람 엄청 옛스런 피자 가게였다. 같은...아노브 는 피자 가게와 갤러리를 겸하나보다. 루프탑도 겸비했지만 서빙은 셀프다. 사람들은 이 계단을 또... ,kunst als süßigkeit,https://blog.naver.com/azerowoo,2021-05-23
" 아노브3H 부스팅 앰플 , 속건조찐 앰플 추천",https://blog.naver.com/iop0215?Redirect=Log&logNo=222513283280,#3H부스팅앰플 # 아노브속부터 보습을 꽉꽉 채워 담아주는아노브3H 부스팅 앰플 차분하면서도 깔끔한 코랄 빛 패키지로 여심저격 까지 해버리는 제품이였어요! 고농축 저분자 하이알루론산 수분 부스팅 성분 과... ,u_nisix beauty story,https://blog.naver.com/iop0215,2021-09-22
"아이폰6플러스 케이스,아노브DIY 폰케이스 사용중",https://blog.naver.com/nora_nori?Redirect=Log&logNo=221008366350,"아이폰6플러스 케이스아노브DIY 폰케이스 아이폰6플러스 케이스,아노브DIY 필름 폰케이스로 바꿨어요~그동안 케이스에 신경쓰지않고 쭉 써왔는데 케이스 바꾸고나니 새폰 쓰는 기분이 드네요.아노브 ... ",나노씨 생활블로그♬,https://blog.naver.com/nora_nori,2017-05-18
 아노브필름케이스 / 투명 젤리 하드 케이스,https://blog.naver.com/midnight111?Redirect=Log&logNo=221155062045, 아노브배경 필름 케이스 투명 필름 케이스 투명 젤리 하드 케이스 요즘도 늘 사용하고 있는 투명 젤리... 특히아노브 에서 나온 제품들도 예뻐서 써보고 싶었어요ㅎㅎㅎㅎ 케이스와 같이 주문했더니... ,변덕스러운 다루나,https://blog.naver.com/midnight111,2017-12-04
"2021.7월 첫째 주(주말 요리사, 또 등산, 연남아노브ANOV... ",https://blog.naver.com/kejklr93?Redirect=Log&logNo=222507105219,"연남아노브반반피자(콰트로치즈, 투머치페퍼로니) 반반피자(갈릭바베큐치킨, 화이트트러플머쉬룸) 평일에 열받는 일이 있어서 동기들이랑 택시타고 홍대행아노브 에서 4명이서 피자 두 판 부셔버리고... ",기억의 문장,https://blog.naver.com/kejklr93,2021-09-15
필름케이스 [아노브ANOV ]아이폰케이스,https://blog.naver.com/010am?Redirect=Log&logNo=221111680028, 아노브스토어팜을 통하면 여러가지의 배경필름과 투명필름을 구경하실수있어요 ~ 여러필름으로 자신만의 개성에 맞게 두필름을 조합하여 만들수있는 나만의 필름 케이스 ! 케이스를 구매하면서 사이트에서... ,ʟ ᴜ ᴠ,https://blog.naver.com/010am,2017-10-06
아이폰6 폰케이스)아노브예쁜폰케이스 / 필름케이스,https://blog.naver.com/ahqjatod28?Redirect=Log&logNo=221051712141,"그래서 필름케이스 검색 후 찾은아노브 ! 예쁜폰케이스 아이폰 6 -아노브사이트 : http://storefarm.naver.com/anov #필름케이스, #예쁜핸드폰케이스, #예쁜폰케이스추천, #DIY폰케이스 짜잔!ㅎㅎㅎ 간편하게 왔네용.... ",룰루옥자,https://blog.naver.com/ahqjatod28,2017-07-18
특이한 아이폰 케이스 : 내맘대로 DIY 필름케이스 ' 아노브 ',https://blog.naver.com/hyemin_0214?Redirect=Log&logNo=221011058478,내맘대로 꾸미는아노브DIY 필름케이스 ' 아노브 ' 라는 핸드폰케이스 쇼핑몰에는 다양한 종류의 필름케이스들이 있는데요. 다들 필름케이스라고아세요~? 필름케이스는 투명(하드/젤리)본케이스안에 얇은... ,BABYGOGURI HOME,https://blog.naver.com/hyemin_0214,2017-05-22
테라스가 있는 연남동피맥아노브 ,https://blog.naver.com/bcomserenity?Redirect=Log&logNo=222375236301,날씨 좋은 오늘 다녀온아노브연남 포스팅 날씨가 좋아서 그런지 사람이 무지무지 많았고... 피자아노브 는 최자맛집으로 유명하다고 한다 tmi지만 저는 최자를 싫어해요 (뜬금없는 디스) 연남동 피자아노브 는... ,따뜻한 개인주의자 스빵의 블로그,https://blog.naver.com/bcomserenity,2021-05-30
매일 다른 느낌! 아이폰7 필름케이스아노브추천!,https://blog.naver.com/007m?Redirect=Log&logNo=221012663865,쇼핑몰아노브ANOV 입니다 ㅋㅋㅋㅋ 지금 전품목 10% 할인 이벤트 진행중이에요! 이 기회에 구매하시길!!...아노브 케이스로 핸드폰 존예보스 만들기!!! 다양한 제품 많으니 본인 스타일대로 조합해보세요... ,uni's 일기장,https://blog.naver.com/007m,2017-05-23
한남동 전시-조효리 작가의 확장된 세계 @갤러리아노브 ,https://blog.naver.com/flyingkay?Redirect=Log&logNo=222439942078,조효리 개인전 Extended Play 갤러리아노브Gallery Anov 2021.7.1-7.21 프리뷰한남 때도 그렇고 여기저기... 갤러리아노브 는 고맙게도 저녁 8시까지라서 퇴근 후 해질녁에 다녀올 수 있었다. (그렇다고 덥지... ,"그림 좋아하는 디자이너, 케이",https://blog.naver.com/flyingkay,2021-07-21
"[한남 맛집/마음과 마음, 루프탑바아노브 ]_2019.06.13",https://blog.naver.com/sju03507?Redirect=Log&logNo=221561908402,설명 없이 뭐지하면서 먹었다ㅋ큐ㅠㅠ 마음과 마음에서 2분 거리에 있는아노브루프탑 가실 분들도 먼저 실내에 들어오셔서 안내를 받고 주문하고 가야한다. 루프탑이 아니더라도 실내도 이뻤다. 메뉴판... ,베짱일기,https://blog.naver.com/sju03507,2019-06-14
[홍대 피자 맛집] ANOV아노브연남애견동반 가능한 연남피자,https://blog.naver.com/redpwind?Redirect=Log&logNo=222378553421,#홍대피자맛집 #연남피자 #연남애견동반 #홍대애견동반 #연남동피맥 # 아노브# 아노브 연남 #ANOV 홍대 피자 맛집 ANOV아노브연남 애견동반 가능한 연남피자 먹으러 다녀왔어요~ 소이연남 2층에 위치한아노브 ... ,꼬막나막 STORY,https://blog.naver.com/redpwind,2021-06-01
연남동 새 피자가게아노브 (Anov) - 소이연남 2층,https://blog.naver.com/vegeta78?Redirect=Log&logNo=222145004338," 아노브 ~! 살짝 채도 높임ㅎ 반반피자인데용. 19,000원이에용~ 6조각~~ 씬과 일반의 중간 두께 페퍼로니 피자랑 갈릭바베큐치킨 피자 먹었어용. 갈릭바베큐치킨은 내용물이 알차서 취향에 맛더라구용. 근데 먹기... ",나를 위한 챌린지,https://blog.naver.com/vegeta78,2020-11-16
연남동 피자 맛집아노브카페 테일러커피,https://blog.naver.com/madessong?Redirect=Log&logNo=222256680724,연남동 피자 맛집아노브 (ANOV) 지난번에 방문했던 태국 음식점인 연남 소이 2층에 위치한 연남동 피자 맛집아노브 (ANOV) 연남동에는 주택을 개조한 가게들이 많은데 연남 소이와아노브 도 주택을 개조한... ,세계여행을 꿈꾸는 고양이,https://blog.naver.com/madessong,2021-02-26
홍대 연남동아노브테라스 피자 맛집,https://blog.naver.com/aduss?Redirect=Log&logNo=222408784142,연남동아노브일요일 낮 느즈막히 일어나서 갑자기 테라스에서 피자가 먹고싶어서 오빠랑 연남동에 다녀왔어요. 홍대 연남동아노브피자집은 연남동 소이연남 2층에 위치하고있어요아노브 는 주말엔... ,미스쪙의 마크업,https://blog.naver.com/aduss,2021-06-24
한남동 피자 맥주~아노브맛있었어요!,https://blog.naver.com/ckdwjd0306?Redirect=Log&logNo=221876944680,요기가아노브 ! 주차는 앞쪽에 하면 됩니다:) 여기가 매장 입구 같지만 ㅎㅎ 오른편 계단으로 3층까지... 보는 재미도 쏠쏠~ 요기까지 올라왔다면아노브도착이에요 ㅎㅎ 매장 입구입니다. 계단부터 매장까지... ,김진향작가 공식블로그,https://blog.naver.com/ckdwjd0306,2020-03-28
ANOV. 아노브 .바 아노브 . 아노브 바.한남동.라현진.라브로.... ,https://blog.naver.com/purplebrain7?Redirect=Log&logNo=220746568833,ANOV. 아노브 .바 아노브 . 아노브 바.한남동.라현진.라브로.퍼플브레인 일주일간 미친듯이 운동했으니 주말은 역시나 코가 삐뚫어지게 술을 마셔보겠다. *사진 속 여성분들은 우리 일행이 아님...언제나 나는... ,문경약돌돼지 초지점,https://blog.naver.com/purplebrain7,2016-06-26
대학로 연극 미친키스. 아노브 .한남동 바아노브 .anov.라현진.... ,https://blog.naver.com/purplebrain7?Redirect=Log&logNo=220998867406,대학로 연극 미친키스. 아노브 .한남동 바아노브 .anov.라현진.한남 브룩클린 마음을 안정시킬 그 무엇이라도 필요했고그 무엇이라도 해야했었다.아무 생각없이 페이스북 스크롤을 내리던중정말 아무 느낌없이... ,문경약돌돼지 초지점,https://blog.naver.com/purplebrain7,2017-05-05
[최자로드]아노브연남 ( 갈릭바베큐치킨/페퍼로니... ,https://blog.naver.com/jnlbbmh?Redirect=Log&logNo=222484974145,저번에 최자로드 성공 후에 이제 서울갈 땐 최자만 믿자는 다짐으로 찾은 최자로드 연남동 피자 맛집 -아노브연남아노브 연남 밑에 소이연남 (?) 유명한 곳이라서 줄이 길다고 들었는데 우리가 갔을 땐 사람... ,밍블,https://blog.naver.com/jnlbbmh,2021-08-26
BAR ANOV.바아노브 . 아노브루프탑. 아노브바베큐 파티.... ,https://blog.naver.com/purplebrain7?Redirect=Log&logNo=221007245985,BAR ANOV.바아노브 . 아노브루프탑. 아노브바베큐 파티.한남동 루프탑 바아노브 의 대장이자 라바이라의 디렉터인 현진이형의 초대로 찾았던한남동의 명소 바아노브 에서의 루프탑 파티 - 바베큐 파티일요일의... ,문경약돌돼지 초지점,https://blog.naver.com/purplebrain7,2017-05-18
"[연남동 애견동반] 히루마라멘, 아노브 연남",https://blog.naver.com/kck7328?Redirect=Log&logNo=222482503701,"계단 따라서 올라가다보면아노브간판이 아주 예쁘게 보여욬ㅋㅋㅋ 피자는 반반피자 맛은 갈릭바베큐치킨+화이트트러플머쉬룸으로 선택!! 코울슬로,레드락생맥주,콜라주문 반반피자 21000원 코울슬로 4000원... ",솜솜잉 소소한 이야기:),https://blog.naver.com/kck7328,2021-08-24
[연남]아노브 연남,https://blog.naver.com/jls1204?Redirect=Log&logNo=222394938574,기름지지 않고.. 약간 매콤하고.. Is My style. 저는 연남에서 #뉴오더클럽 이랑 여기 두군데 와봤는데 둘다 다른 매력이네요 (사운드가 진짜 큰건 같은 매력) 재방문의사 20000000000% # 아노브 연남 #연남동피자,Chao!,https://blog.naver.com/jls1204,2021-06-12
"아이폰6s 케이스, 필름형 D.I.Y케이스 쇼핑몰 ' 아노브 케이스'",https://blog.naver.com/urangiii?Redirect=Log&logNo=221406805470,쇼핑몰아노브 케이스 _ 택배는 딱 뜯기 전인 요 상태일 때 가장 설레쥬 ㅋㅋㅋㅋㅋ 명화폰케이스가... 다양한 디자인의 폰케이스를 연출하고 싶으시다면아노브 케이스 폰케이스 쇼핑몰 구경해보세요 : ) 본... ,토리의 육아로그,https://blog.naver.com/urangiii,2018-11-26
"연남동 나들이 (무신사 테라스, 디즈니 팝업 스토어,아노브피자)",https://blog.naver.com/zuu1009?Redirect=Log&logNo=222505714697,최자 맛집으로 유명한아노브연남 일층은 쌀국수 집이니까 잘못 들어가지 않도록 해요 계단을 올라...아노브연남 플레이리스트 살짝 도촬 ㅎ 이 밑 신발 장식물 앞에 핸드폰 충전기 있는데 충전 필요하신... ,juicy day,https://blog.naver.com/zuu1009,2021-09-14
[연남] 생일엔 역시 피자 / 연남아노브 (ANOV) 반반피자,https://blog.naver.com/chaem6?Redirect=Log&logNo=222407053899,네이버 지도를 열심히 탐방한 결론은 # 아노브연남점이다. 원래 한남에 본점이 있는 듯 한데 최자의 맛집으로 유명하기도 하다. # 아노브 연남 # 아노브 피자 #anov 1층엔 소이연남이 있고(웨이팅이 어마무시함)... ,Think Beyond,https://blog.naver.com/chaem6,2021-06-23
PAINSORROW- JHONNY KIM- 갤러리아노브 ,https://blog.naver.com/aoelr17?Redirect=Log&logNo=222486912912,"■ 전시이름 PAINSORROW ■ 작가이름 Jhonny kim ■ 장소 서울시 용산구 한남동 618-7, 3F 갤러리아노브■ 날짜 2021. 08. 13(FRI) ~ 30(MON) ■ 내용 ‘흙은 자신에게 일어났던 모든 일을 기억한다.’ 도자기는... ",보관실,https://blog.naver.com/aoelr17,2021-08-28
한남동 분위기 엄~청좋은아노브 에서 런오프로 힙스터게이지... ,https://blog.naver.com/gogojhka1?Redirect=Log&logNo=221114307178,"한남동에 위치한 ANOV,아노브 가 오늘의 주인공 되시겠습니다! 지난 포스트에 언급했다시피 필자는... 정말 분위기 깡패다 깡패)아노브 의 위치는 이렇게 됩니다. 주변의 대중교통편이 다소 빈약한 편이지만... ",MY IT IS ON,https://blog.naver.com/gogojhka1,2017-10-10
요즘 다녀온 곳[퀜치커피. 멘지라멘.아노브 피자],https://blog.naver.com/ninanino1711?Redirect=Log&logNo=222471406808,"배고프니 후딱 먹고 일하자 # 아노브 #연남동# 아노브 연남 오랜만에 피자집 주택을 개조한 외관이 깔끔하고 예뻤다. 이렇게 귀여운 피자모양 표지판(?) 별표 쳐진 갈릭바베큐치킨, 머쉬룸 두 가지를 반반으로... ",사각사각,https://blog.naver.com/ninanino1711,2021-08-15
핑거 페인팅 아티스트.한남동아노브 .갤러리아노브 .GALLERY ANOV,https://blog.naver.com/purplebrain7?Redirect=Log&logNo=221195382735,지심세연 개인전.라이브 페인팅.핑거 페인팅 아티스트.한남동아노브 .갤러리아노브 .GALLERY ANOV 지난 1월 19일 세연이형의 전시가 있었다.전시 오프닝 라이브 페인팅 나는 당시 근무 중이었기에 함께... ,문경약돌돼지 초지점,https://blog.naver.com/purplebrain7,2018-01-30
