title,link,description,bloggername,bloggerlink,postdate
 아노브이태원 피자 최자 맛집 낮술 핫플,https://blog.naver.com/jeecool0?Redirect=Log&logNo=222541997024,쌉싸래한 맛이 인상적이었는가 계속생각나는아노브페일에일 그리고 돈만 많으면 500개 시키고싶어 생 컬리플라워를 즉석에서 튀겨내 너무 신선했던 프라이가 맛있었던 최자픽 이태원 피자 맛집아노브어쩐지... ,티끌이된멍멍이,https://blog.naver.com/jeecool0,2021-10-19
 아노브연남 피자 페퍼로니 두번 드세요,https://blog.naver.com/minhee_7548?Redirect=Log&logNo=222418869219,연남 피자아노브영업시간 매일 12:00 - 22:00 (브레이크타임 15:00 - 17:00) 홍대입구역 3번출구 633m 최자로드... 최자로드에서 유명한아노브연남 ! 그것도 제가 제일 좋아하는 페퍼로니로 (메뉴도 이미 정해서 왔음... ,달달한 오후,https://blog.naver.com/minhee_7548,2021-07-03
연남 피자아노브최자로드 추천,https://blog.naver.com/nara2381?Redirect=Log&logNo=222359131022,피자아노브 를 알게 되었습니다. 이미 최자로드 추천 이라는 수식어를 가지고 있는 곳이었습니다. 사실... 연남아노브였습니다. (이태원 피자 나들이는 다음에 혼자가야겠어요) 그렇게 찾아간 연남 피자아노브 ... ,웰껌 투 키미롱코,https://blog.naver.com/nara2381,2021-05-20
 아노브ANOV 기초 화장품 브랜드 추천 (feat. 커먼그라운드... ,https://blog.naver.com/leesufa?Redirect=Log&logNo=222539417526,건대 커먼그라운드 내 코스메틱 브랜드 팝업스토어아노브ANOV안녕하세요 혼밥선비입니다. 오늘은 건대 커먼그라운드 내 코스메틱 브랜드 팝업스로어아노브방문 리뷰를 합니다. 혼밥선비는 제일 처음... ,혼밥선비,https://blog.naver.com/leesufa,2021-10-17
 아노브ANOV] 더 건강하고 맛있는 맥주박 피자!아노브연남점,https://blog.naver.com/sunhwa00812?Redirect=Log&logNo=222128593038,이제 막 오픈한(10월 27일)아노브 (ANOV) 연남점에 다녀왔어요.아노브 는 한남동에서 이미 유명한 피자 맛집인데요. 이번에 연남동에 2호점을 오픈한 거랍니다. 가보고 싶어서 친구에게 말했다가 오픈날 바로... ,아띠네 티끌 별,https://blog.naver.com/sunhwa00812,2020-10-28
 아노브ANOV 커먼그라운드 팝업스토어 방문후기,https://blog.naver.com/llleyj?Redirect=Log&logNo=222518928045,커먼그라운드에 이번에 런칭한 화장품 브랜드아노브팝업스토어 오픈 소식을 듣고 바람도 쐴겸... 총 3개의 건물 중 마켓홀에 기다리고 기다렸던아노브 코스메틱스 팝업스토어가 오픈했다는 소식 !! 마켓홀... ,말이야 염방구야!,https://blog.naver.com/llleyj,2021-09-28
" 아노브연남 최자로드 피자 맛집 (w. 페퍼로니, 갈릭바베큐치킨... ",https://blog.naver.com/hyo_vly?Redirect=Log&logNo=222527906750," 아노브연남 최자로드 피자 맛집 (w. 페퍼로니, 갈릭바베큐치킨 피자) 저는 피자 덕후입니다. 교정기... 가기 전부터 완전 설레벌여~아노브연남 영업시간 매일 12:00 - 22:00아노브연남 주소 서울시 마포구... ",효 님의 집,https://blog.naver.com/hyo_vly,2021-10-06
 아노브ANOV 커먼그라운드 팝업스토어 방문,https://blog.naver.com/geniusindol?Redirect=Log&logNo=222537121852,우리가 매일 사용하는 기초화장품에 심혈을 기울여 만든 스킨케어 화장품을 제공하는아노브 코스메틱스 의아노브팝업스토어가 커먼그라운드에 오픈 및 다양한 이벤트가 진행되고 있다고 해 다녀와... ,IN>> 노세노세,https://blog.naver.com/geniusindol,2021-10-14
[용산/이태원 피자 추천]아노브이태원,https://blog.naver.com/jien0728?Redirect=Log&logNo=222538249324, 아노브이태원 02-6052-6606 서울 용산구 이태원로20가길 7-5 영업시간 평일 11:30 - 21:00 평일 브레이크...아노브이태원점은 오픈 한지 오래된 곳이 아니라서 매장이 깨끗하고 관리가 잘 되어있는 느낌이... ,All about me,https://blog.naver.com/jien0728,2021-10-15
연남동 피자아노브테라스에서 먹는 피자 맛이란~,https://blog.naver.com/ycdy80?Redirect=Log&logNo=222519420916,연남동 피자아노브테라스에서 먹는 피자 맛이란~ 여기 다녀온건 지난 봄 ㅋㅋ 어쩌다보니 아직도... 근데 바로 2층에아노브 가 눈에 들어오더라구요. 그래서 우리 어디 찾으러 가기도 힘든데 연남동 피자나... ,보라공쥬의 여행더하기! Trevelrising,https://blog.naver.com/ycdy80,2021-09-28
[연남동/홍대 맛집] ANOV Pizza아노브피자,https://blog.naver.com/xogml9106?Redirect=Log&logNo=222508061730,"연남동/홍대 테라스 있는 맛집,아노브피자 오늘은 유난히 하늘이 너무너무 예쁘고 바람도 살랑살랑... 라고 정한 뒤 연남동 테라스 맛집을 찾아보니아노브피자가 나왔고 테라스가 쏙 마음에 들어서... ",찹쌀감자의 소박한 포스팅,https://blog.naver.com/xogml9106,2021-09-16
210924 이태원 수제피자아노브 피자,https://blog.naver.com/haha9280?Redirect=Log&logNo=222518555979,정한 #이태원 아노브#이태원피자 룰루랄라 영업시간 : 11 : 30 ~ 21 : 00 (브레이크타임 15 : 00 ~ 17 : 00) 반려견... 예전아노브 한남점 사진같애요 루프탑있냐고 여쭤봤더니 없다고 하더라구요 : ) 참고하쎄여 주문은... ,나의 사진일기,https://blog.naver.com/haha9280,2021-09-27
 아노브 피자 서울 한남동 맛집 피자좋아!,https://blog.naver.com/woojin5060?Redirect=Log&logNo=222243586545, 아노브 피자주소 : 서울 용산구 대사관로34길 40 3층4층루프탑 전화번호 : 0507-1428-6606 영업시간 : 평일... 저녁에아노브 피자를 방문하고 싶네요 내부로 오시면 그렇게 넓진 않습니다 약 6테이블?? 아담한... ,"검정오리, 날다.",https://blog.naver.com/woojin5060,2021-02-14
연남동아노브ANOV,https://blog.naver.com/2990045?Redirect=Log&logNo=222532950323,서울 나들이 했던 날 점심에 무얼 먹을까 고민하다 선택하게 된 연남동 # 아노브#ANOV 피맥하기로 했다... 맛있었다 #연남동맛집 #연남동 아노브#연남동피자맛집 #연남동피자 #ANOV #연남동피맥 #피맥 # 아노브 연남,eunna's♥,https://blog.naver.com/2990045,2021-10-10
 아노브이태원｜최자가 픽한 이태원피자 맛집,https://blog.naver.com/yam1376?Redirect=Log&logNo=222532901622,그래서 실패한 곳이 한번도 없었기에 최자가 다녀온 곳은 웬만하면 맛집이라 믿는 편인데 최자가 사랑하는 이태원피자 맛집이 있다고 그래서 다녀온아노브이태원 # 아노브 이태원 명성에 맞게 엄청 많은... ,히포의 인생은 아름다워♥️,https://blog.naver.com/yam1376,2021-10-10
ANOV 커먼그라운드아노브팝업스토어 포토존 이벤트하고... ,https://blog.naver.com/littlebonnie?Redirect=Log&logNo=222520228600,예쁜아노브팝업스토어가 있어요 아이가 들어가도 되요? 하면서 신나게 들어가더라고요 사진찍을 수 있게 해놓은 거라 들어가서 사진 찍어도 된다고 하셨어요 전 또 민폐일까봐 괜찮은지 여쭤봤어요아노브 코... ,아기자기네 아기자기이야기,https://blog.naver.com/littlebonnie,2021-09-29
"[한남]아노브 _ 한남동 피자, 루프탑, 갤러리 모든 것을 한번에... ",https://blog.naver.com/pgcqkrwldnjs?Redirect=Log&logNo=222120332036,한남동에서 유명한 피자집아노브 (ANOV) 예전부터 가보고 싶었던 루프탑 피자바를 방문했다! 「 아노브 」 # 아노브#ANOV # 아노브 피자 #한남동맛집 #한강진역맛집 #한남역맛집 #서울맛집 #피자맛집 #서울피자... ,풋별의✡별조각 모음,https://blog.naver.com/pgcqkrwldnjs,2020-10-19
새로 런칭한아노브ANOV 코스메틱스 팝업스토어에서 만나봄,https://blog.naver.com/ddalgi11?Redirect=Log&logNo=222539866261, 아노브공식런칭 기념으로 성수동 커먼그라운드에서 팝업스토어를 진행 중이에요 : ) 11월 30일까지... 커먼그라운드 2번 게이트로 들어가서 QR 체크인을 하면 바로 앞에아노브팝업스토어를 확인할 수 있어요... ,조 각 달 ˇ-ˇ,https://blog.naver.com/ddalgi11,2021-10-17
 아노브ANOV아노브 코스메틱스 팝업스토어 건대나들이 후기,https://blog.naver.com/kikijayoung?Redirect=Log&logNo=222518553396,기초를 위한 기초 스킨케어 솔루션을 제안해 줄아노브 코스메틱스 팝업스토어가 근처에서 진행하고... 커먼그라운드에아노브ANOV 팝업스토어가 있어요. 정면에 보이는 스트리트 마켓 쪽 말고 중앙 마켓... ,♥새침이 공간♥,https://blog.naver.com/kikijayoung,2021-09-27
 아노브 의 예쁜 팝업스토어 ANOV 건대 커먼그라운드,https://blog.naver.com/malahalo?Redirect=Log&logNo=222517331350,뷰티브랜드의아노브팝업스토어가 9월 1일부터 9월 30일까지 온라인과 동시에 런칭이벤트를 한다 이미 건대 커먼그라운드에 들어가면 바로 눈에 확 들어오는아노브 의 팝업스토어 시선을 끄는 피치빛 공간을... ,라깰의 어제보다 즐거운 오늘,https://blog.naver.com/malahalo,2021-09-26
"한남동 루프탑, 한남동 피자아노브: 요즘 핫한 맛집",https://blog.naver.com/rin0031?Redirect=Log&logNo=222042600198, 아노브이름을 건물 옆에 엄청 크게 써놓아서 멀리서 봐도 잘 보입니다~ 주차 할 곳은 마땅치 않아서... 한남동 피자 맛집아노브 로 올라가는 길이 심심하지 않아요. 너무 귀엽고 아기자기하게 꾸며놓으셨어요.... ,THE MALANG,https://blog.naver.com/rin0031,2020-07-27
건대 커먼그라운드에 있는 ANOV아노브 코스메틱,https://blog.naver.com/mihye00?Redirect=Log&logNo=222519957871,오늘은 건대 커먼그라운드에 ANOV아노브 코스메틱스 다녀왔어요. 건대 커먼그라운드는 모르시는 분이... 그곳에아노브매장을 다녀왔습니다. ANOV아노브 코스메틱스 매장은 수많은 화장품 시장에서 가장 기본에... ,kimmi food 김미푸드,https://blog.naver.com/mihye00,2021-09-28
커먼그라운드아노브ANOV 팝업스토어 다녀왔어요,https://blog.naver.com/darkyoon85?Redirect=Log&logNo=222536176279,커먼그라운드아노브코스메틱스아노브ANOV 건대 커먼그라운드에 다녀왔어요. 컨테이너로 구성된 국내 최대 컨테이너 팝업 쇼핑몰인 커먼그라운드는 정말 구경하는 재미가 있더라구요! 그중에서도 저는... ,다크윤의 맛집이야기♥,https://blog.naver.com/darkyoon85,2021-10-14
피자 먹으러 GO~!아노브 (Anov) 연남 [연남동맛집/홍대맛집],https://blog.naver.com/raphy324?Redirect=Log&logNo=222264783076,친한 동생의 반복되는 영업으로 이번 연남투어는 피자맛집아노브 로! 동생님의 말로는 열명을... 이렇게 귀여운 피자간판이 있는 1층은 다른 가게고 2층으로 올라가면아노브 로 들어갈 수 있어요. 주말에는... ,글쓰고 만들고 사람도 좋아하는,https://blog.naver.com/raphy324,2021-03-04
이태원 맛집 :아노브 피자 : 눈물나게 맛있는 인생 PIZZA... ,https://blog.naver.com/sushigyosen?Redirect=Log&logNo=222536556057, 아노브 피자 이태원 전화번호 : 0507-1428-6606 주소 : 서울 용산구 이태원로20가길 7-5 11:30 ~ 21:00 브레이크타임 15~17 여러분 눈물 나게 맛있는 피자집을 발견했어요. 인생 피자집 여러분아노브 피자 먹으러 그냥... ,세상만사 술잔에 있구나,https://blog.naver.com/sushigyosen,2021-10-14
연남피자아노브연남 페퍼로니피자 찐맛집! 연남동피맥은... ,https://blog.naver.com/may27?Redirect=Log&logNo=222323986811, 아노브연남 전화 0507-1332-6606 주소 서울특별시 마포구 동교로 267 2층 홍대피자맛집아노브연남은 소이연남 위 2층에 위치해있답니다. 오른쪽에 보면 이렇게 커다란! 피자 간판이 보여요~ 2층으로 올라가볼게용.... ,해나엘의 자취일상 리뷰로그,https://blog.naver.com/may27,2021-04-26
한남동 루프탑 피자맛집아노브ANOV,https://blog.naver.com/mental_pig?Redirect=Log&logNo=221932961299,밥집인지 술집인지 카페인지 전혀 모르겠어서 지도 어플로 대충 뒤져보니 피자맛집으로 유명한아노브 라는 루프탑이었다. 한남동 갈 일 있으면 가봐야겠다고 생각하다가 마침 근처에서 약속이 생겨아노브 ... ,놀먹여 멘탈돼지 플레이스,https://blog.naver.com/mental_pig,2020-04-27
ANOV아노브 코스메틱스 커먼그라운드아노브팝업스토어... ,https://blog.naver.com/anamsalda?Redirect=Log&logNo=222518961914,커먼그라운드에서아노브팝업 스토어가 런칭한다고 해서 겸사 겸사 구경 다녀왔어요. 요즘 관심있게... 구경하는 재미가 상큼했답니다.^^ 뉴스에서 보니 ANOV아노브 코스메틱스는 자연유래 원료와 피부... ,꿈꾸는 자유나무,https://blog.naver.com/anamsalda,2021-09-28
건대 커먼그라운드아노브ANOV 팝업스토어에 다녀왔다!,https://blog.naver.com/chohy0617?Redirect=Log&logNo=222519624658,건대 커먼그라운드에아노브팝업스토어가 생겼다고 해서 다녀왔다 위치는 바로 커먼그라운드... 핑크핑크 주황주황 귀엽고 아기자기한 느낌의아노브팝업스토어 1층 한가운데 있기 때문에 찾기는 어렵지... ,NUANNUAN,https://blog.naver.com/chohy0617,2021-09-28
한남동 루프탑아노브(anov) 분위기 최고,https://blog.naver.com/lyiy4?Redirect=Log&logNo=221672068924,한남동 루프탑아노브(Anov) 사진/글 ㅣ 러블리릴리 분명 네이버 영업시간 보고 찾아왔는데 2층 가게는... 루프탑아노브(Anov) 2층 내부 혼자서도 와서 즐길 수 있도록 바자리부터 단체석 자리까지 완비되어... ,러블리릴리(lovely_Lily),https://blog.naver.com/lyiy4,2019-10-08
 아노브 ANOV 건대커먼그라운드아노브 코스메틱스 팝업스토어... ,https://blog.naver.com/psy8272?Redirect=Log&logNo=222519661149, 아노브 ANOV아노브 코스메틱스 팝업스토어 건대커먼그라운드 내아노브 팝업스토어가 있다고 해서 다녀왔어요^^ 건대입구역에서 가까운 곳에 위치한 커먼그라운드 주차는 최초 30분 2000원이고 구매금액별로... ,깐따삐아`s sosohan story~♡,https://blog.naver.com/psy8272,2021-09-28
한남동 맛집 | ANOVE( 아노브 ) 한남 -루프탑에서 선셋보며... ,https://blog.naver.com/ey404?Redirect=Log&logNo=222452533263,동기언니 결혼식으로 오랜만에 뭉친 친구들과 저녁뒷풀이하러 다녀온아노브한남 여름이 다가오고 있어서 시원한 맥주랑 피자가 땡겼던 날아노브한남 이영자 한방통닭집 바로 옆건물에 위치하고 있구... ,"라니로그 ,",https://blog.naver.com/ey404,2021-07-31
연남동 너무 예쁜 감성 피자집아노브ANOV,https://blog.naver.com/gkwork90?Redirect=Log&logNo=222157838295, 아노브(연남점) 02-6082-6606 서울 마포구 동교로 267 매일 11:00 - 15:20런치 Last order 14:30 매일 15:00 - 17:00Break time 매일 19:00 - 22:00저녁 Last oder 21:00 한남동에 1호점이 있고 이번에 연남동에 오픈한아노브 (ANOV)... ,Favorite Log,https://blog.naver.com/gkwork90,2020-11-29
 아노브ANOV 스킨케어 커먼그라운드 방문했어요,https://blog.naver.com/liberty8403?Redirect=Log&logNo=222527738881, 아노브ANOV 스킨케어 커먼그라운드 방문했어요. 2호선 건대입구역 6번 출구에서 도보로 1~2분 사이면... 곳이에요=333아노브ANOV 스킨케어 커먼그라운드 광장에 있는 이정표 같은 안내판인데 여러 동으로 되어... ,Luna의 세계여행,https://blog.naver.com/liberty8403,2021-10-12
한남 맛집 | 한남동 루프탑 뷰맛집 ‘ 아노브 ’ ✨,https://blog.naver.com/nawlgp89?Redirect=Log&logNo=221843819986,"주말에 날씨 좋아서 달려간 한남동 루프탑있는아노브ANOV아노브 는 3층-5층이구 우리는 한강진역에서 걸어갔지만, 차 가지고 오시는 분들은 주차장 따로 없어서 주변 유료 주차장이나 한남역 공영주차장... ",ᵂᴱ ᴴᴬᴰ ᵀᴼᴰᴬʸ ෆ⃛,https://blog.naver.com/nawlgp89,2020-03-08
홍대맛집/ 아노브ANOV] 도우가 새빨간 피자!아노브X... ,https://blog.naver.com/sunhwa00812?Redirect=Log&logNo=222176171052,"오픈하는 날 갔던아노브연남점. 그때 먹었던 피자가 문득문득 생각나더라고요. 그래서 거리 두기 단계가 떨어졌을 때 또 다녀왔어요. 그러나 포스팅은 뒤늦게 이제서야.. 아무튼, 반짝반짝 예쁜아노브 의... ",아띠네 티끌 별,https://blog.naver.com/sunhwa00812,2020-12-17
한남동 애견동반아노브피자 포장해왔어요,https://blog.naver.com/darkyoon85?Redirect=Log&logNo=222117951030, 아노브(ANOV) 애견동반 가능한 한남동의 루프탑 피자 맛집 한남동 주택가에 위치해 있으며 루프탑에서 즐기는 피맥은 정말 최고다 글ㅣ사진 @다크윤 출처: ANOV아노브AN0V 한남 본점 연락처: 070-8118-6606 주소... ,다크윤의 맛집이야기♥,https://blog.naver.com/darkyoon85,2020-10-30
" 아노브한남, 북악스카이웨이, 성수동, 서울숲 나들이",https://blog.naver.com/hm071?Redirect=Log&logNo=222504702344,해가 좋을 때는 방향까지 돌려가며 심폐소생중아노브한남 방문 최자로드 픽 맛집이라 해서 갔다.... 1.아노브 한남 버섯피자+레드락 2. 마미손버거 아니 버거점프 마미손2번셋트+생맥 여긴 또 가야징~,파이어족장 블렌드의 경제적 자유 달성기,https://blog.naver.com/hm071,2021-09-13
ANOV :: 스킨케어 선물사러아노브팝업스토어 다녀온 후기,https://blog.naver.com/jungah921006?Redirect=Log&logNo=222510862995,"그 중 주차장이랑 정말 가깝게 위치하고 있던아노브팝업스토어 갓 런칭한 귀욤뽀짝 코랄 상큼 브랜드아노브 에서는 오픈 이벤트도 하고 있더라고요 :) 5만원 이상 구매 시, 100명 선착순으로 럭키드로우를... ",ᴴᵒᵈᵘ ᵇˡᵒᵍ-.,https://blog.naver.com/jungah921006,2021-09-19
연남동 피자 맛집아노브ANOV 최자로드 추천,https://blog.naver.com/jenne586?Redirect=Log&logNo=222537578402,찰나에아노브연남을 발견했어요! 검색 안 해보고 무작정 들어가 보는 거라서 어쩔지 무지... 툭툭누들타이만 찾으면아노브연남은 금방 찾을 수 있어요 툭툭누들타이는 꽤나 유명한 쌀국수 집이라... ,리따 하우스,https://blog.naver.com/jenne586,2021-10-15
한남역 피자 맛집아노브 피자,https://blog.naver.com/o0z_z0o?Redirect=Log&logNo=222244531341,곳이었던아노브피자 한남 힙한 인싸 갬성맛집으로 가보았다 #한남역맛집 #한남동맛집 메뉴판 모양도... 쿠쿠쿸아노브한남 메뉴와 가격을 참고하면 좋을 것 같다 한남동 맛집아노브피자 위치 : 서울 용산구... ,빙그르의 생생한 블로그,https://blog.naver.com/o0z_z0o,2021-02-15
" 아노브한남동 루프탑, 레알 인생 피자 맛집!",https://blog.naver.com/yundurius?Redirect=Log&logNo=222096069065,"자 요기까지가 하이라이트 인트로 소개였고, 이제 자세한아노브(ANOV) 소개 들어갑니다!아노브ANOV 피자펍 + 갤러리 + 루프탑 평일 4pm-11pm 토,일 12pm-11pm (주말 브레이크타임 3-5pm) 한남동 618-7 3층/4층... ",All about 윤두리우스,https://blog.naver.com/yundurius,2020-09-22
 아노브ANOV (연남점),https://blog.naver.com/xazig?Redirect=Log&logNo=222503405083, 아노브연남(점) ANOV : A NEST OF VIPERS 방문일 : 2021-04-10 서울특별시 마포구 연남동에 위치한 피자... ※아노브ANOVⓇ 피자 PIZZA : ※ 인근 지역에서 좀 더 담백한 피자를 먹고 싶을 때는? : 로쏘 1924 Rosso... ,포토로그,https://blog.naver.com/xazig,2021-09-12
"한남동 루프탑, 맥주박 피자맛집!!! 아노브 (ANOV)!!!",https://blog.naver.com/chssha86?Redirect=Log&logNo=222093887161,"한남동 루프탑, 맥주박 피자맛집!!! 아노브 (ANOV)!!! 안녕하세요 이번에 다녀온 식당은 한남동에 위치한아노브 란 피자가게인데요~ 와... 진심 여기도 피자 맛집 인정!!! 주소 : 서울 용산구 한남동 618-7 3층4층... ",다니엘 블로그,https://blog.naver.com/chssha86,2020-09-19
 아노브 ' 기초스킨케어를 위한 팝업스토어 방문과아노브 ... ,https://blog.naver.com/ginny_making?Redirect=Log&logNo=222539993906,커먼그라운드 1층에 팝업스토어로 열린아노브 코스메틱스 스킨케어 전문 브랜드로 기초를 위한 기초 스킨 케어가 있는아노브 ! 이 넓은 공간을 이렇게 따뜻하게 채워놓다닝아노브X 커먼그라운드 팝업스토어... ,지니가 만드는 하루 :),https://blog.naver.com/ginny_making,2021-10-17
한남역 맛집아노브인생 최고 피자를 만나다,https://blog.naver.com/ahs780324?Redirect=Log&logNo=221920459580,한남동 맛집으로 유명한아노브다녀왔어요~ 진짜... 여긴 ... 여태껏 먹어본 피자 중~ 정말 최고의 맛~~ 인생피자에요~ 진짜... 도우도 피자도~너무너무 맛있어요...아노브070-8118-6606 서울 용산구 대사관로34길... ,옷만드는여자,https://blog.naver.com/ahs780324,2020-04-21
"[이태원 피자추천] 최자맛집아노브이태원점, 페퍼로니 피자... ",https://blog.naver.com/healthnwealth?Redirect=Log&logNo=222540325677,#이태원피자맛집 #최자로드아노브이태원점 페퍼로니 피자 완전 추천!! 안녕하세요! 오늘은 연예인 최자가 추천한 #최자맛집아노브이태원점에 다녀왔어요 피자러버라 항상 새로운 피자 맛집에 도전하는... ,health&wealth 라이프,https://blog.naver.com/healthnwealth,2021-10-18
[연남동]아노브 ,https://blog.naver.com/j_skysea?Redirect=Log&logNo=222246422276,[연남동]아노브믿고가는 최자맛집 한남동에서 핫한 피자집아노브 가 연낭동에 생겼다해서 다녀왔습니다 :) 어머 나 여기 알아 소이연남 2층 찾아오시면됩니다. 만화에서 나올듯한 피자 ㅋㅋㅋㅋㅋ 이렇게 큰... ,꿈나무 블로그,https://blog.naver.com/j_skysea,2021-02-18
"[ 아노브 ] 3H부스팅앰플 :: 진정앰플, 속보습앰플",https://blog.naver.com/jooeun9908?Redirect=Log&logNo=222515882331, 아노브3H부스팅앰플 사용하고 있던 앰플이 다 써가서 ! 새로운 앰플 장만해써욤 저는 트러블성 피부라... 근데아노브 에서 앰플하나 오는데 이렇게 예쁘게 포장해서 왔더라구용! 핑쿠핑쿠 넘나 예뿜 ㅎ... ,Orange silver,https://blog.naver.com/jooeun9908,2021-09-24
[연남동맛집/홍대맛집/ 아노브ANOV]아노브연남점 사이드... ,https://blog.naver.com/sunhwa00812?Redirect=Log&logNo=222298212640,제가 제일 좋아하는 피자집인아노브연남점! 아주 오랜만에 친구들과 함께 다녀왔어요. 최자가... ᄒᄒ 저는아노브 의 피자는 종류별로 모두 먹어봤는데요. 친구들도 모두 한 번씩은 방문했었어서 안... ,아띠네 티끌 별,https://blog.naver.com/sunhwa00812,2021-04-04
[한남동 루프탑]피자맛집아노브 (ANOV),https://blog.naver.com/sjem87?Redirect=Log&logNo=222107836697, 아노브#ANOV # 아노브 피자 #한남동맛집 #한강진역맛집 #한남역맛집 #서울맛집 #피자맛집 #서울피자 #피맥맛집 #수제피자 #맥주박피자 #맥아피자 #발리힐즈 #환경보호 #업사이클링 #갤러리 아노브#루프탑... ,염미로그,https://blog.naver.com/sjem87,2020-10-06
연남동 맛집 | 연남동 피자 맛집‘ 아노브연남’,https://blog.naver.com/nawlgp89?Redirect=Log&logNo=222182798429,"한남동 루프탑 뷰맛집아노브 가 연남동에도 생겼네 연남동 맛집 쏘이연남 건물 2층에 있음. 날씨... 연말분위기 났던아노브메뉴 Previous image Next image 우리는 투머치 페퍼로니 피자(19,000원) 버팔로... ",ᵂᴱ ᴴᴬᴰ ᵀᴼᴰᴬʸ ෆ⃛,https://blog.naver.com/nawlgp89,2020-12-23
 아노브 - 날씨 좋은 날엔 여기서 피자를 먹어야 합니다!!!,https://blog.naver.com/lgtnet?Redirect=Log&logNo=222359321881,"연남동에 있는아노브 , 요즘같은 날씨엔 여기가서 피자를 먹어줘야합니다!! Rest In Pizzaㅋㅋㅋㅋㅋ 2층으로 올라가면아노브 입니다. 키오스크에서 피자를 주문하면 돼요. 반반피자로 화이트 트러플 머쉬룸... ",다 잘 될 한의사 포카Lee,https://blog.naver.com/lgtnet,2021-05-21
홍대 연남동 최자로드 피자 맛집 @아노브연남,https://blog.naver.com/cjstkdlf007?Redirect=Log&logNo=222535821846,"홍대 연남동 최자로드 피자 맛집 @아노브연남 요즘 테라스에서 피맥하기 넘 좋은 날씨 ✨ 갑자기... 그렇게 삼십분만에 흡입하구 우린 2차 케익 먹으로,, ㅋㅋㅋㅋㅋㅋㅋㅋㅋ 만족스러웠던아노브연남.... ",♥ Euniworld Record ♥,https://blog.naver.com/cjstkdlf007,2021-10-13
이태원 피자 맛집아노브이태원,https://blog.naver.com/nam1991?Redirect=Log&logNo=222539225876,이태원 피자 맛집아노브이태원친구 생일 기념으로 다녀간 이태원 피자 맛집아노브이태원 * 정말 오랜만에 피자 맛보러 갔는데! (점심에 훠궈먹고 저녁에 피자먹는 나란사람 요즘 돼지꿀꿀) 여튼ㅋㅋㅋㅋㅋ... ,❤️찌아의 달콤한 블로그❤️,https://blog.naver.com/nam1991,2021-10-17
