title,link,description,bloggername,bloggerlink,postdate
" 아노브 코스메틱, 건대 커먼그라운드아노브팝업스토어",https://blog.naver.com/moonpig12?Redirect=Log&logNo=222518297944, 아노브팝업스토어온라인 동시 런칭 2021.09.01~2021.09.30 자주가는 건대 커먼그라운드에아노브팝업스토어가 런칭했다고 해서 다녀왔어요 뷰티에 관심이 많다보니 구경하는것도 재밌는데 5만원 이상 구매시... ,"내 삶의 주인은 나야, ❤️",https://blog.naver.com/moonpig12,2021-09-27
[팝업스토어]ANOV 건대커먼그라운드아노브팝업스토어... ,https://blog.naver.com/zi0_175?Redirect=Log&logNo=222539999641,오늘 건대 커먼그라운드에 방무한 목적은 바로아노브팝업스토어가 생겼다고해서 방문해봤어요. 커먼그라운드아노브팝업스토어아노브팝업스토어는 커넌그라우드 중앙에 위치해있어서 바로 발견할... ,졍서스러운 공간,https://blog.naver.com/zi0_175,2021-10-17
 아노브퓨어에센셜액티베이터 진정보습관리로 사용해요,https://blog.naver.com/lee600923?Redirect=Log&logNo=222539127565, 아노브퓨어에센셜액티베이터 라는 에센스인데 진정보습에 괜찮아서 사계절 무난하게 잘...아노브 의 퓨어에센셜액티베이터는 진정보습 케어가 되는 고농축 보습제에요. 병풀도 들어가고 보습력을... ,즐겁게 살아보자 쿠냥,https://blog.naver.com/lee600923,2021-10-21
 아노브 피자 이태원 피자맛집! 내돈내먹 솔직리뷰,https://blog.naver.com/lissom_shop?Redirect=Log&logNo=222536720913,그냥 검색해보고 찾아갔던 #이태원 아노브리모델링을 해서 새로 오픈한지 얼마안된 힙한 식당 이였어요.아노브이태원 주차장: 없음 (용산구청공영주차장 도보5분) 영업시간: 11:30 ~ 21:00 이태원 아노브 ... ,"후회없는 오늘, 기록",https://blog.naver.com/lissom_shop,2021-10-14
한남동 ::아노브 ,https://blog.naver.com/soyeon6590?Redirect=Log&logNo=222071856757,"피맥이 먹고 싶어서 간 # 아노브되게 뜬금없는 곳에 있었는데 찾기 어려운 건 아니었다 ㅎㅎ 아무튼 외관은 이렇게 생김 문은 저 가운데가 아닌 오른쪽 입구는 이렇게 생겼는데,아노브 는 3층에 있다 힙한데... ",소피의 일기,https://blog.naver.com/soyeon6590,2020-08-26
[오늘 먹으러갔지!]서울 연남동 ' 아노브피자',https://blog.naver.com/love_khn1104?Redirect=Log&logNo=222534351182,서울 연남동' 아노브피자' 2021.10.05 저번에 뭐했었지 #오늘뭐하지 #연남동 #맛집 #연남동맛집 #피자 #피자맛집 # 아노브 피자 #핫플레이스 간만에 서울나들이에 친구들이 피자 맛집이 있다고해서 쫒아갔다 위치는... ,오늘 뭐하지?,https://blog.naver.com/love_khn1104,2021-10-12
코스메틱 로고 디자인 BI_ anov( 아노브 ),https://blog.naver.com/khj5384?Redirect=Log&logNo=222528322025,여성적인아노브 의 아이덴티티를 상징. anov_인스타그램 ANOV 하늘빛 자연의 풍부한 가치 기초를 위한... 첫 단추를 잘 꿰어야 피부 바탕에 올리는 제품들이 충분한 값어치를 하듯이아노브기초 제품을... ,프리랜서 디자이너의 인드림,https://blog.naver.com/khj5384,2021-10-06
"홍대, 연남동 피자아노브 ",https://blog.naver.com/lovetaya88?Redirect=Log&logNo=222221463945,"몇일 전, 날씨가 너무 좋아 어디라도 가야할 것 같아 홍대에 피자 먹으로 다녀왔어요 :)아노브아노브 는 피자 전문점인데 한남점에도 있더라구요아노브 는 홍대에서 유명한 소이연남 바로 2층에 있어서 찾아가기... ",행복한 이야기 한가득,https://blog.naver.com/lovetaya88,2021-01-27
최자로드 피자 맛집 연남동아노브연남,https://blog.naver.com/s_ovo_2?Redirect=Log&logNo=222539105900,48시간 저온숙성 시킨 수제 피자 도우가 있는 최자로드 인정 피자 맛집아노브연남아노브연남 서울 마포구 동교로 267 매일 12:00 - 22:00 Last oder 21:00 포장 21:30 (평일 15:00 - 17:00 Break Time) 02-6082-6606 다들 최자로드... ,흰니의 맛있는 blog,https://blog.naver.com/s_ovo_2,2021-10-16
건대커먼그라운드아노브ANOV 팝업스토어매장 다녀왔어요,https://blog.naver.com/tnwlslol?Redirect=Log&logNo=222531222361,마켓홀로 들어가면 중간에 이렇게아노브anov 팝업스토어가 이쁘게 준비되어있는데 안에 포토존이... 바래용 :)아노브x 커먼그라운드 팝업스토어 기간 한정 기프트 세트를 판매중이예요!! 11월말까지... ,쑤코치의 일상스토리❣,https://blog.naver.com/tnwlslol,2021-10-08
연남동 피자맛집 # 아노브 연남,https://blog.naver.com/wh9718?Redirect=Log&logNo=222528470965,"갔던아노브 연남 솔직후기 위치는 소이연남이라는 쌀국수집 같은건물 2층이당 이건물 1층은 소이연남(쌀국수집),2층은아노브 연남(피잣집) 평일이라그런지 점심시간인데도 사람이 많이 없었다(우리 나갈때쯤... ",잘먹는 일상,https://blog.naver.com/wh9718,2021-10-06
이태원 피자아노브이태원,https://blog.naver.com/dahlia_choa?Redirect=Log&logNo=222537119314,이태원 피자아노브이태원 이태원에 위치한아노브이태원에 다녀왔어요 분위기도 좋고 피자도 맛있어서 좋았던 곳이에요 ( ˆoˆ )/아노브이태원은 이태원역 4번출구에서 도보 5분 거리에 위치해 있어요... ,고기앤소금,https://blog.naver.com/dahlia_choa,2021-10-14
ANOV아노브 코스메틱스 건대 커먼그라운드 팝업스토어 생겼어요,https://blog.naver.com/inaudadak?Redirect=Log&logNo=222523072523,찾다가아노브 매장을 다녀오게 되었답니다. 오랜만에 온 커먼그라운드! 이사를 오기 전에는 건대가... 바로아노브 매장을 볼 수 있더라구요. 요즘은 시국이 시국이다보니 열체크랑 큐알코드나 전화로 체크를... ,우토의 천천히 스며드는 공간,https://blog.naver.com/inaudadak,2021-10-01
 아노브 (ANOV) 연남 피자 맛집 추천!,https://blog.naver.com/gyu940?Redirect=Log&logNo=222526642180, 아노브(ANOV) 연남 평일 12:00 - 22:00 = 저녁 Last oder 21:00 포장 21:30 평일 15:00 - 17:00 = Break time. 주말 12:00... 국민지원금아노브 (ANOV) 안녕하세요 ! 맛있는 집 알면 공유하는 게 좋을 것 같아서 처음으로 맛집... ,ESSOKYU,https://blog.naver.com/gyu940,2021-10-04
연남동 피자 맛집아노브테라스 분위기 좋아요,https://blog.naver.com/horangeat?Redirect=Log&logNo=222537341674,지난번에 갔던 연남동 맛집아노브또갔어요 맛있기도 하지만 분위기가 정말 좋아서 날씨 좋은때 자주자주 방문하려고요아노브연남 영업시간 / 12:00 - 22:00 브레이크타임 / 15:00 - 17:00 (주말은 브레이크 없음)... ,feed the 호랑잇,https://blog.naver.com/horangeat,2021-10-15
[연남동맛집] 연남동 피자 맛집 피자는 여기야아노브연남,https://blog.naver.com/dkdls91?Redirect=Log&logNo=222538223993," 아노브연남 서울 마포구 동교로 267 2층 홍대입구역 3번출구에서 도보 10분 이내. 소이연남 건물... ※반려동물 출입가능 반반피자 21,000원 갈릭바베큐치킨 콰트로치즈아노브 는 수제피자 한판한판을... ",먹고보는국밥요정,https://blog.naver.com/dkdls91,2021-10-15
 아노브퓨어에센셜액티베이터 진정보습 스킨케어에 너무 좋아요!,https://blog.naver.com/yeslord84?Redirect=Log&logNo=222542704880, 아노브퓨어에센셜액티베이터 진정보습 스킨케어에 너무 좋아요! 안녕하세요. 쑝쑝이에요:) 냉방기를... 바로 진정보습 스킨케어에 좋은아노브퓨어에센셜액티베이터 ♡ 요 진정보습 스킨케어에 좋은... ,YesLORD,https://blog.naver.com/yeslord84,2021-10-20
" 아노브연남, 테라스 피맥 최자픽 피자 맛집",https://blog.naver.com/flowerainn?Redirect=Log&logNo=222535160566, 아노브연남 12:00-22:00(평일 15:00-17:00 Break Time) 소이연남 2층에 위치하고 있는아노브연남 귀여운 피자 모형이 뙇!! 보여서 찾기 어렵지 않다 2층으로 올라오면 이런 간판이 있는데 피자집스럽지 않고 카페... ,플 로 그,https://blog.naver.com/flowerainn,2021-10-13
"홍대 연남동,아노브연남. 피맥하기 딱 좋은 날",https://blog.naver.com/1017skghtls?Redirect=Log&logNo=222526156743,야외에서 먹을 수 있다길래아노브연남으로 결정했어요. 위치도 가깝고 많이 찾는 걸 귀찮아하는 우리들. 분위기 좋고 대체로 맛있다는 평이 많아서 골랐습니당. 홍대 연남동 맛집아노브연남 / ☎️ 0507-1332... ,SPLENDOR,https://blog.naver.com/1017skghtls,2021-10-04
[한남동맛집] 한남동 루프탑 한남동 피자 맛집 ::아노브::,https://blog.naver.com/may77?Redirect=Log&logNo=222018355756, 아노브친동생같은 동생과 다녀왔어요 ;D 얼마만에 보는건지 ㅠㅠ 오랜만에 보니 맛있는데로 데려가고... 맛집아노브오픈시간도 나와있네요~ 낮은 테이블도 있고 높은 테이블도 있네용 좌석은 24석 정도... ,Seyoon's diary,https://blog.naver.com/may77,2020-07-02
미친기초 스킨케어아노브커먼그라운드 팝업스토어 이벤트... ,https://blog.naver.com/rhdnsnl88?Redirect=Log&logNo=222536096346,미친기초 아이템아노브커먼그라운드 팝업스토어 # 아노브#ANOV # 아노브 코스메틱스 #미친기초 #스킨케어 #기초스킨케어 #기초를위한기초스킨케어 #비너스화장품 # 아노브 건대 # 아노브 커먼그라운드... ,뚠뚠이랑 두둠칫,https://blog.naver.com/rhdnsnl88,2021-10-15
 아노브 코스메틱스 ANOV 팝업스토어 다녀왔어요!,https://blog.naver.com/bsujin145?Redirect=Log&logNo=222519872760,"이번에 새롭게 런칭한아노브 ,아노브코스메틱의 팝업스토어에 다녀오기 위해서였어용:) ANOV아노브코스메틱 자연에서 온 특별한 스킨케어 솔루션 오랜만에 오는 커먼그라운드-아노브팝업스토어는 마켓홀... ",기록용 블로그쓰,https://blog.naver.com/bsujin145,2021-09-28
커먼그라운드아노브 코스메틱스 팝업스토어 방문후기,https://blog.naver.com/seo670722?Redirect=Log&logNo=222524225093,발견한아노브 코스메틱스 팝업스토어 입구에 행사를 한다는 안내판을 보고 들어가서 둘러보고 왔어용아노브팝업스토어 내부 분위기가 너무 이쁘죠 안에 포토존도 많고 컬러가 코랄이라 눈에 확... ,nyuna로그,https://blog.naver.com/seo670722,2021-10-02
 아노브건대 커먼그라운드 팝업스토어 런칭 행사,https://blog.naver.com/v910221v?Redirect=Log&logNo=222522920677,"주중에 야근하느라 찌든 나냔,, 코로나 백신 접종 맞고 쉬던 날 힘을 내서 조금 돌아다녀 보았어요 그 중에서도아노브런칭행사가 열리고 있다는 건대 커먼그라운드 방문해보았습니다 :-))아노브 코스메틱스... ",빈나빈 블로그,https://blog.naver.com/v910221v,2021-10-01
 아노브ANOV아노브 코스메틱스 기초 화장품 추천 (feat.... ,https://blog.naver.com/evelia67?Redirect=Log&logNo=222539752585," 아노브ANOV아노브 코스메틱스 기초 화장품 추천 feat. 커먼그라운드 팝업스토어 안녕하세요, 우주별이예요 ★ 건대 커먼그라운드 안에아노브 코스메틱스 팝업스토어 매장이 있다고 해서 구경 다녀왔어요... ",우주별 이야기,https://blog.naver.com/evelia67,2021-10-17
연남아노브::홍대피자맛집인정,https://blog.naver.com/lemont6599?Redirect=Log&logNo=222513546891,최자의 단골맛집 유명한아노브 가 연남에도 2호점을 오픈해서 다녀왔다 9월 초에 가오픈했으니 이제... 한아노브연남동의 특유의 분위기도 너무 좋고 소이연남랑 같은 건물 2층에 위치해 있어서 어디구나 하고... ,500일의썸머,https://blog.naver.com/lemont6599,2021-09-22
연남동 피자맛집_ANOV아노브피자에서 냠냠,https://blog.naver.com/zxc4353?Redirect=Log&logNo=222525481317,발견한 #연남동피자맛집 # 아노브 피자 ANOV PIZZA 피자 입간판을 따라 2층으로 올라갑니다~! 주택을 개조한... 가게를 나오면서 찍은 입구쪽 테라스 이곳은 테라스에서 먹어야 더 맛날듯ㅎㅎ 굿바이아노브 !,멋대로 라이프.v,https://blog.naver.com/zxc4353,2021-10-03
[연남동]아노브연남,https://blog.naver.com/seoj731?Redirect=Log&logNo=222535395525, 아노브연남 피자충에게아노브 란..❤️ 우리커플 소울푸드 쌀국수 소이연남 2층에 위치한아노브맨날 지나다니면서아노브가봐야지..가봐야지만 몇달 드디어 출동 계단으로 올라오면 2층에 있는 가게 내부는... ,밍며들기 좋은하루:),https://blog.naver.com/seoj731,2021-10-13
"@ from 쿱한남,아노브to 푸시풋살룬 _ 서울 한남동",https://blog.naver.com/pyh613?Redirect=Log&logNo=222238369753,a 햇빛알러지 보유자) 근데 오랜만에 상봉했는데 라푼젤같은 외국인 한 분이 오셨어요 ㅋㅋㅋㅋㅋㅋㅋ 맛점 :) 후 또 맛점하러 한남아노브진짜 이분들은 넘사벽 대식가니까 :) 라푼젤 외 3인... ,CLOUD9 LAB,https://blog.naver.com/pyh613,2021-02-09
ANOV아노브이태원 피자 도넛 i donut care 아이도넛케어,https://blog.naver.com/b_sinabro?Redirect=Log&logNo=222537253559, 아노브피자 이태원에서 피자 먹고 후식으로 아이도넛케어 도넛 먹은 후기. 처음 시작은 한강진 파이프... 즉흥에 즉흥에 즉흥을 더해서 쨍한 레드컬러의 외관에 끌려서 들어온아노브이태원점. 약간 요즘... ,소네도니,https://blog.naver.com/b_sinabro,2021-10-15
테라스 피맥하기 좋은 곳 @ 아노브연남(ANOV),https://blog.naver.com/sujung8857?Redirect=Log&logNo=222535414494,소진이랑 오랜만에 연남 @ 아노브 에서 맛있는 피맥을 하고 왔다 주말이라 웨이팅 있을까 걱정했는데 다행히 웨이팅도 없었고 테라스 자리에서 잘 - 먹고 왔다 (뿌듯)@ 아노브연남점은 홍대입구역에서 10분 정도... ,Precious daily lives,https://blog.naver.com/sujung8857,2021-10-13
 아노브 (ANOV) 커먼그라운드 팝업스토어 방문 후기,https://blog.naver.com/482uo?Redirect=Log&logNo=222532979081,구경하다가아노브팝업스토어를 방문했다. 커먼그라운드 정중앙에 위치해 있다. 살구색베이스의...아노브 는 기초를 위한 기초스킨케어 솔루션을 제안. 기초라인이 탄탄하다. 테스터를 할 수 있는 중간 공간을... ,달봉이의 마음만 미니멀라이프,https://blog.naver.com/482uo,2021-10-10
비너스화장품 ANOV아노브코스메틱 미친기초,https://blog.naver.com/yoonsujin0331?Redirect=Log&logNo=222527098824,비너스화장품 ANOV아노브코스메틱 미친기초 https://www.common-ground.co.kr/황금 연휴를 앞두고... 꾸며놨는지아노브코스메틱스를 모르던 분들도 누구나 알 수 있게끔 눈에 확 띄니까 들어가볼수밖에!! https... ,달보드레의 달달하고 보드라운 일상이야기,https://blog.naver.com/yoonsujin0331,2021-10-05
커먼그라운드 스킨케어브랜드아노브ANOV 후기!,https://blog.naver.com/pin_lots?Redirect=Log&logNo=222521150428,ㅎㅎ 핫한 커먼그라운드에서 스킨케어브랜드인아노브 의 행사가 있어서 부리나케 달려갔답니다.아노브 가 주는 깔끔한 이미지에 반해 사용해보고 싶었는데 넘 설레더라고요. 스킨케어 전문브랜드로서... ,"안녕 꽃여사,",https://blog.naver.com/pin_lots,2021-09-29
"[연남피자맛집]아노브 연남, 페퍼로니피자, 컬리프라이, 최자로드",https://blog.naver.com/wltn032877?Redirect=Log&logNo=222534869151,점심에 모든집이 웨이팅이 많았는데 블로그보고 먹어보고싶던 # 아노브 연남 #피자집 에 방문하였습니다! 주택을 개조해서 만든 건물이엿구요 1층은 소이연남 2층으로 올라가시면 # 아노브무인결제시스템... ,아이니드,https://blog.naver.com/wltn032877,2021-10-12
 아노브ANOV 건대 커먼그라운드 포토존 있는 코스메틱... ,https://blog.naver.com/opal53?Redirect=Log&logNo=222538099025,"이번에 코스메틱 팝업스토어를 다녀왔는데요~ 바로 건대 커먼그라운드 내에 있는아노브ANOV 코스메틱 팝업스토어 갔다왔답니다! 여러가지 옷, 신발 쇼핑도 하면서아노브기초라인 코스메틱 구경도 할 수... ",최손에겐 최손이 너무도 많은 블로그,https://blog.naver.com/opal53,2021-10-15
건대 커먼그라운드 팝업스토어아노브ANOV아노브 코스메틱,https://blog.naver.com/leshdy?Redirect=Log&logNo=222539218872,그중에서도 팝업스토어로 행사중인아노브ANOV아노브 코스메틱가 너무 인상적이었음 :) 하늘빛 자연의 풍부한 가치 자연유래 원료와 피부정화에 도움을 주는 게르마늄다이옥사이드의 만남 소중한 피부에... ,왠디의 세상살이,https://blog.naver.com/leshdy,2021-10-17
추천!아노브ANOV 퓨어에센셜액티베이터로 관리해요!,https://blog.naver.com/empire9564?Redirect=Log&logNo=222539883015," 아노브ANOV 퓨어에센셜액티베이터 고농축 진정, 보습 효과가 있어 거칠어진 피부 결을 매끈하고 부드럽게 케어할 수 있는 진정보습 기초스킨케어 제품인아노브퓨어에센셜액티베이터를 소개해 드릴게요!... ",오늘은 뭐하지?,https://blog.naver.com/empire9564,2021-10-17
 아노브 코스메틱스 ANOV 건대 커먼그라운드 팝업스토어 방문... ,https://blog.naver.com/e_e_e_e_e_e?Redirect=Log&logNo=222541839438,[ 아노브 ] 팝업스토어 # 아노브#ANOV # 아노브 코스메틱스 건대 커먼그라운드 중경삼림에서 마라샹궈랑 마라탕을 격파하고 난 뒤 받은 이벤트 영수증. 커먼그라운드 내 3만원이상 구매시아노브리커버 마스크팩을... ,먹고 여행하고 사랑하는 기록,https://blog.naver.com/e_e_e_e_e_e,2021-10-19
 아노브이태원 피자는 여기지! 레드락 생맥주에 페퍼로니 캬,https://blog.naver.com/halogotcha?Redirect=Log&logNo=222542485458,코로나 이후로 처음 찾은 이태원 오랜만에 가는 거라 설렘 설렘 이태원 신상 핫플은 어디인가- 검색하다 피자 비주얼 보고 바로 픽한 # 아노브이태원 브레이크 타임 끝나는 5시에 맞춰서 입장! 힙한... ,Having fun :),https://blog.naver.com/halogotcha,2021-10-20
2107 [전시] 갤러리아노브- 조효리 개인전 Extended Play,https://blog.naver.com/wisalang?Redirect=Log&logNo=222417849926,out 왼) sold out 들어갔을 때 직관적으로 예술이다 싶던 개성적이면서 다양해서 향후가 궁금한 * 한남동 갈 일 있으면 관람하세요. 작가 홈페이지 #갤러리 아노브#한남갤러리 #한남동갤러리 #조효리,C: panacea,https://blog.naver.com/wisalang,2021-07-02
블랙마스크팩인아노브리커버마스크팩을 사용해봤어요,https://blog.naver.com/uni6292?Redirect=Log&logNo=222536748429,그래서 오늘은아노브 의 피지스 플루이드32 리커버마스크팩을 사용해봤어요. 피지스 플루이드 32... 기초를 위한 기초 스킨케어 솔루션을 제안하는 가장 기본에 충실하고픈 마음을 제품에 담았다는아노브 ... ,FREESIA'S LIFE❤ 프리지아의 소소한 일상,https://blog.naver.com/uni6292,2021-10-14
"커먼그라운드 팝업 스토어의 이벤트 가득한, 아노브 코스메틱스",https://blog.naver.com/mj_0119?Redirect=Log&logNo=222519931886, 아노브 코스메틱스이 건대 커먼그라운드에서 팝업스토어를 한다는 소식을 듣고 방문했어요! 커먼그라운드는 맛집도 많고 편집샵도 잘 되어 있어서 자주 방문하는 곳이에요!아노브 코스메틱스는... ,사적공간,https://blog.naver.com/mj_0119,2021-09-28
"한남동 루프탑, 분위기 좋은아노브♩",https://blog.naver.com/jinmichu?Redirect=Log&logNo=221093445820,한남동 루프탑 분위기 좋은 바아노브ANOV 다녀왔어요 : ) 순천향대병원쪽에 위치해있답니다 멀리서부터 딱 보이는 한남동아노브루프탑이라 꼭대기가 블링블링해요아노브: ) 요즘같은 날씨에 야외좌석... ,진미츄 일상 기록,https://blog.naver.com/jinmichu,2017-09-10
"이태원 루프탑 카페아노브 에서 감성사진 찍기, SEL55F18Z",https://blog.naver.com/lump2000?Redirect=Log&logNo=221144138043,카페아노브 에서 찍은 감성 감성한 감성 사진들(이라고 우겨봄...) 도착했던 시간이 마침 블루 아워라... 이태원아노브 는 보케 사진 찍기 좋은 곳:D 루프탑 카페들이 대부분 다 그러하겠지만서도ㅋ 점점... ,키덜트 화목의 피터팬 컴플렉스,https://blog.naver.com/lump2000,2017-11-20
[연남 맛집] 최자로드도 인정한 피자 맛집아노브연남,https://blog.naver.com/fulanita?Redirect=Log&logNo=222526254310," 아노브연남 영업시간: 평일 12:00 - 22:00 Last oder 21:00 Break time. 15:00 - 17:00 주말 12:00 - 22:00 ☎️ 0507-1332-6606 안녕하세요, 어제 다이나믹 듀오 '최자'님의 단골 피자 맛집인아노브연남을 다녀왔어요! https://www.... ",린다's 스토리,https://blog.naver.com/fulanita,2021-10-04
ANOV아노브 코스메틱스 팝업스토어 방문했어요,https://blog.naver.com/lucky7yge?Redirect=Log&logNo=222520534249, 아노브 코스메틱스 기초스킨케어 Editor/ Photographer ⓒ헬로양양 날씨가 화창한 요즘! 건대하면 많이... 위치한아노브 코스메틱스 팝업스토어 ♥ 아름다운 아우라 무엇 'ㅅ'아노브스킨케어 전문브랜드는... ,양양이의 긍정에너지♬,https://blog.naver.com/lucky7yge,2021-09-29
한남동 루프탑아노브고르곤졸라피자 샹그리아,https://blog.naver.com/tnwjd_07?Redirect=Log&logNo=221585843884,한남동아노브루프탑 다녀왔어요! 열심히 걸으면아노브 가 나오는데 주문을 하고 루프탑에 올라갈 수 있습니다 지정된 자리에 앉아야 되구요 사람 많을땐 2시간으로 정해져 있는거같아요ㅋㅋㅋ 그리고... ,꽃수정의 여행일기 블로그,https://blog.naver.com/tnwjd_07,2019-07-15
푸딘코 맛집아노브ANOV PIZZA | 연남동 피자집,https://blog.naver.com/annie0716?Redirect=Log&logNo=222517268345,푸딘코 맛집아노브왔다 여기 옆에 소이연남 이라고 줄 엄청 긴 베트남음식점 있는데아노브 는 줄 없어서 좋았다 ㅎ 계단 올라가면서 보이는아노브~.~ 2층에 위치해있다 저기 왼쪽에 서계신 사람들 앞에... ,MIRACLE,https://blog.naver.com/annie0716,2021-09-26
"모아올리는 블로그( 아노브 한남, 부산여행,,)",https://blog.naver.com/whtjqls0506?Redirect=Log&logNo=222532063473,"피자집인아노브 한남 으로 밥을 먹으러 감. 이 메뉴판 참고하면, 내가 시킨 피자는 갈릭바베큐+화이트트러플머쉬룸 반반피자로 시켰고 맥주는아노브생맥주, 콜라하나 해서 총 33,000원 피자가 생각보다... ",MY SPACE,https://blog.naver.com/whtjqls0506,2021-10-09
"서울 한남동,아노브ANOV",https://blog.naver.com/mandu_u?Redirect=Log&logNo=221634815833,"# 한남동,아노브/ ANOV 칭구들이랑 한남동 카페투어 후 마무리는 한남동아노브 에서 했어요 :) 원래는 오픈 시간이 한참 지났는데 오픈을 안 해서 인스타그램 확인해보니 저희가 방문한 날은 사장님 개인... ",김만두의 이곳저곳,https://blog.naver.com/mandu_u,2019-09-02
 아노브 (ANOV) 건대 커먼그라운드 팝업스토어 이벤트 해요,https://blog.naver.com/rudals701?Redirect=Log&logNo=222516778710,들렸답니다아노브코스메틱스 팝업스토어 건대 커먼그라운드 메종키츠네 앞 메인공간아노브ANOV 는 9월 1일 공식 런칭을 한 따끈따끈한 신상 스킨케어 브랜드에요 정말 많은 화장품이 있는 요즘 기초를 위한... ,다꾸러 프맥츄의 쟁이는 삶,https://blog.naver.com/rudals701,2021-09-26
[연남동] 최자로드 피자맛집 -아노브 에서 피맥,https://blog.naver.com/jyr323?Redirect=Log&logNo=222517342146,한남동에서도 유명한 # 아노브아노브매일 12:00 - 22:00 (브레이크타임: 15:00 - 17:00) #최자로드 맛집에도 나온아노브아노브 는 2층에 위치해있어요! 1층은 태국음식으로 유명한 소이연남이더라고요 계단 따라... ,yul's diary,https://blog.naver.com/jyr323,2021-09-26
연남동 피자 맛집 :)아노브연남 야외테라스 페퍼로니 맛집,https://blog.naver.com/phs093?Redirect=Log&logNo=222518168267,#연남동피자맛집 #홍대피자 # 아노브 연남 #연남페페로니맛집 #연남동맛집 #홍대맛집 #피자맛집아노브연남 :) 피자러버인 저는 이번 주말 점심 메뉴는 피자 먹으러 연남동으로 go !!!! 홍대입구역 3번출구에서... ,부동산과 일상 리뷰 로그,https://blog.naver.com/phs093,2021-09-27
건대 커먼그라운드에서아노브코스메틱스 anov 팝업매장... ,https://blog.naver.com/po796?Redirect=Log&logNo=222525545177,건대 커먼그라운드에 방문했다가아노브 코스메틱스란 뷰티브랜드의 팝업매장이 있길래 친구와 방문했어요.아노브anov 코스메틱스 팝업스토어는 건대 커먼그라운드에 있었는데요. 신발파는 건물이 아닌 광장... ,"Meloso, Libertad",https://blog.naver.com/po796,2021-10-03
