title,link,description,bloggername,bloggerlink,postdate
명지대엄마손떡볶이평생 갈 일 없을 것 같은 서대문구... ,https://blog.naver.com/dhtnfld?Redirect=Log&logNo=100189251912,윤기 좔좔 밀가루 떡볶이 카레가루가 들어가 독특한 맛이 일품이라는엄마손 떡볶이으음.... 이정희 떡볶이보단 훨씬 괜찮은데 이것도 좀 ...ㅜㅜ 명성에 걸맞지 못한 맛 ㅜㅜㅜ 야끼만두도 완전 딱딱...하면서... ,고상한 취미생활,https://blog.naver.com/dhtnfld,2013-06-04
부천지하상가엄마손떡볶이간편한 한끼,https://blog.naver.com/uchihehe?Redirect=Log&logNo=220658243730, 엄마손 떡볶이귀엽졍. 떡볶이는 엄마손맛이 진리졍. ㅎㅎ 딱 필요한 것만 줍니다. 단무지와 맑은국물엄마손 떡볶이 가 나왔습니다. 첨엔 쫌 놀랐어여. 정말 떡볶이 떡만 있어서여. 군데 요 떡볶이 양념 제... ,옴니암니,https://blog.naver.com/uchihehe,2016-03-18
명지대 떡볶이 / 카레 떡볶이엄마손떡볶이 ,https://blog.naver.com/phjsunflower?Redirect=Log&logNo=220275399294,"명지대 떡볶이 / 카레떡볶이엄마손떡볶이떡볶이는 궁중음식으로써, 임금님 수랏상에 오를만큼 대단한 음식이기도 하였다. 지금과 같이 빨간색이 아니라, 간장과 고기 그리고 떡을 함께 볶아서 내왔던... ",꽃씨의 맛집 이야기♬,https://blog.naver.com/phjsunflower,2015-03-22
명지대_ 엄마손떡볶이 ,https://blog.naver.com/luvkell?Redirect=Log&logNo=220614447228,"저번에 먹은엄마손 떡볶이 를 못잊어~~~~~ 한번 더 방문했네요~~ 근처 간김에 명지대엄마손떡볶이 ! 오늘은 떡볶이, 꼬마김밥,야끼.못난이만두 그리고 오징어튀김도 이렇게 시켜보았습니다~ 꺅 나왔다!!! 라며... ",데일리 미쓰O,https://blog.naver.com/luvkell,2016-02-05
"[ 엄마손떡볶이 ] 떡볶이,튀김,오뎀",https://blog.naver.com/cho_yongwon?Redirect=Log&logNo=222153843565," 엄마손떡볶이 !! 떡볶이1인분,삶은계란,야끼만두,김말이 ,못난이,오뎅1인분 넘 맛있졍 #서울 #명지대 # 엄마손떡볶이#명지대맛집 #서울떡볶이맛집 #떡볶이맛집 #분식 #음식 #한식 #푸드 #떡볶이 #튀김... ",조리사 일상&먹방,https://blog.naver.com/cho_yongwon,2020-11-25
[ 엄마손떡볶이 ] 떡볶이튀김오뎅,https://blog.naver.com/cho_yongwon?Redirect=Log&logNo=221842153083, 엄마손떡볶이떡볶이튀김오뎅 #떡볶이맛집 #서울떡볶이맛집 #명지대맛집 #떡볶이 #야끼만두 #김말이 #못난이만두 #오징어튀김 #오뎅 #음식 #한식 #푸드 #분식 #먹방 #데일리 #일상기록 #소통 #맞팔 #좋아요... ,조리사 일상&먹방,https://blog.naver.com/cho_yongwon,2020-03-07
"[ 엄마손떡볶이 ] 떡볶이,튀김,어묵",https://blog.naver.com/cho_yongwon?Redirect=Log&logNo=222110901913,"서울 명지대엄마손떡볶이떡볶이,계란,야끼만두,김말이,못난이,오뎅 넘 맛있졍 #서울 #명지대 # 엄마손떡볶이#명지대맛집 #서울떡볶이맛집 #떡볶이맛집 #분식 #음식 #한식 #푸드 #떡볶이 #튀김 #어묵... ",조리사 일상&먹방,https://blog.naver.com/cho_yongwon,2020-10-09
"[ 엄마손떡볶이 ] 떡볶이,튀김,오뎅",https://blog.naver.com/cho_yongwon?Redirect=Log&logNo=221969754235," 엄마손떡볶이떡볶이,튀김,오뎅 ✔ 엄마손떡볶이 !!! ✔떡볶이,계란,김말이,못난이.오징어,오뎅 ✔넘 맛있졍 #서울 #명지대 # 엄마손떡볶이#명지대맛집 #서울떡볶이맛집 #떡볶이맛집 #음식 #한식 #푸드 #분식 #먹방... ",조리사 일상&먹방,https://blog.naver.com/cho_yongwon,2020-05-19
"[ 엄마손떡볶이 ] 떡볶이,튀김,오뎅",https://blog.naver.com/cho_yongwon?Redirect=Log&logNo=222074250010," 엄마손떡볶이떡볶이,튀김,오뎅 ✔ 엄마손떡볶이 !!! ✔떡볶이,계란,김말이,못난이.,오뎅 ✔넘 맛있졍 #서울 #명지대 # 엄마손떡볶이#명지대맛집 #서울떡볶이맛집 #떡볶이맛집 #떡볶이 #koreafood #トッポッキ... ",조리사 일상&먹방,https://blog.naver.com/cho_yongwon,2020-08-29
"[ 엄마손떡볶이 ] 떡볶이,튀김,오뎅",https://blog.naver.com/cho_yongwon?Redirect=Log&logNo=222039313121," 엄마손떡볶이떡볶이,튀김,오뎅 ✔ 엄마손떡볶이 !!! ✔떡볶이,계란,김말이,못난이,,오뎅 ✔넘 맛있졍 #서울 #명지대 # 엄마손떡볶이#명지대맛집 #서울떡볶이맛집 #떡볶이맛집 #떡볶이 #카레떡볶이 #음식... ",조리사 일상&먹방,https://blog.naver.com/cho_yongwon,2020-07-23
[ 엄마손떡볶이 ] 떡볶이튀김,https://blog.naver.com/cho_yongwon?Redirect=Log&logNo=221692839737,"떡볶이맛집 #분식 #음식 #한식 #푸드 #국민간식 #먹방 #koreafood #먹스타 #맛스타 #맛있다 #먹부림 #일상 #소통 #맞팔 #좋아요 #팔로우 ✔ 엄마손떡볶이 !!! ✔떡볶이,계란,김말이,못난이,오뎅 ✔넘 맛있졍",조리사 일상&먹방,https://blog.naver.com/cho_yongwon,2019-10-30
명지대맛집 이정희떡볶이+ 엄마손떡볶이 ,https://blog.naver.com/uni666?Redirect=Log&logNo=221139352238,카드기계가 안보이길래 현금결제했어요 다음으로엄마손 떡볶이떡볶이 + 꼬마김밥 = 4000원 주문 국물이 좀 더 묽은 그낌이죠? 이쪽도 조금 빨갛기는 해요. 떡은 역시 밀떡. 떡볶이에 카레가루가 들어간다고... ,소소한 일상기록,https://blog.naver.com/uni666,2017-11-14
"[명지대]매콤한 분식집 떡볶이,엄마손떡볶이 ",https://blog.naver.com/yesican1?Redirect=Log&logNo=120031053283,"집 근처에 있는 명지대엄마손떡볶이 . 일욜 점심 츄리닝에 모자 하나 눌러쓰고 찾은 곳. 오후 2시가... 떡볶이 1인분에 쫄면, 계란, 야끼만두, 오뎅을 추가해서 주문했다. 곧 이어 나온 떡볶이. 길죽하게... ",쭌의맛집 since 2003,https://blog.naver.com/yesican1,2006-11-12
[떡볶이맛집]명지대앞엄마손떡볶이 ,https://blog.naver.com/1mblues?Redirect=Log&logNo=220439897382,[떡볶이맛집] 명지대앞엄마손떡볶이명지대앞엄마손떡볶이검색해보면 언제 한번 가봐야지 하고 거드름 피우게 되는 위치. 금욜 휴가내고 토 일 사흘 연속 쉬면서 방바닥에서 뒹구는것도 지쳤는지 일욜 오전... ,트래블로그 | TRAVELOGUE,https://blog.naver.com/1mblues,2015-08-03
맛집 오동통한 떡볶이가 있어요 [명지대엄마손 떡볶이 ],https://blog.naver.com/bplg?Redirect=Log&logNo=10138008179,서대문구 구경을 다니고 있는 카린야~~ 홍은동 구경갔다가 홍은동 옆마을 남가좌동에 맛나는 떡볶이 집이 있다고 해서 들렀어요 30년은 넘게 떡볶이를 만들고 계신답니다 이름하야 명지대엄마손떡볶이 !!!!... ,자유를 꿈꾸는 카린양,https://blog.naver.com/bplg,2012-05-04
[구산역 맛집] 은평구 떡볶이 맛집 -엄마손떡볶이 ,https://blog.naver.com/never39?Redirect=Log&logNo=221134854975,"곱다 고와 나는 간만 좋다 잘 먹었습니다!!! 코스모스 1번 가고엄마손1번 가고 이렇게 다니면 좋을 듯 다르지만 둘 다 맛있엉 잘 먹고 8,000원 계산하고 나오는데 행복했다 히히떡볶이너무 좋아❤️",숭애교 먹고.일하고.울고.웃고 :),https://blog.naver.com/never39,2017-11-08
[간단야식추천]전자렌지3분ok!엄마손떡볶이 ,https://blog.naver.com/baby_guma?Redirect=Log&logNo=220480310822,갑자기 간단하게 간식이나 야식을 먹고싶은데 해먹기 번거롭잖아요. 근처 떡볶이전문점서 사와서 먹곤하는데 그럴때엄마손떡볶이 가 있으면 정말 간단해결!ㅋ 티몬에서 또 할수도 있으니 참고해보세용!ㅋㅋㅋ,베뷔구마의놀로그,https://blog.naver.com/baby_guma,2015-09-13
학교앞 떡볶이엄마손떡볶이 집에 가다! 유락여자중학교앞... ,https://blog.naver.com/jiuse77?Redirect=Log&logNo=90141635673,"조금 좁긴하지만 그맛에 떡볶이를 먹는 이유도 있으니까!!엄마손떡볶이 ~ 아직까지 학교앞 떡볶이로 자리를 지키고 있었다. [부산 유락여자중학교앞엄마손떡볶이 ] 떡볶이가격 2000원,순대 3000원 051)558-2967",제이디의 라이프스타일 JD's lifestyle,https://blog.naver.com/jiuse77,2012-04-26
카레향이 나는 중독성 강한 떡볶이 맛집 [ 엄마손 떡볶이 ],https://blog.daum.net/djmanul/5856926,"[강북/남가좌] 카레향이 나는 중독성 강한 떡볶이 맛집 [ 엄마손 떡볶이 ] 댓글 0 마늘의 맛집과 요리/마늘의국내맛집탐방 2012. 9. 22. 남가좌동 , 떡볶이 맛있는 집 , 떡볶이 맛집 , 맛집 ,엄마손떡볶이왠일인지... ",MERRY CHRISTMAS!,https://blog.daum.net/djmanul,2012-09-22
맛집. 떡볶이 달인 명지대엄마손 떡볶이 ~,https://blog.naver.com/ericashin?Redirect=Log&logNo=50120097405,마포 떡볶이는 많이 먹었으니 얼마전에 떡을 잘 떼신다고 달인으로 나오신 (TV에서 그렇게 본 듯)엄마손 떡볶이 를 찾아갔습니다. TV가 오래 전꺼라 그런지 그땐 1000원이라 했는데 가봤더니... ,뷰티 꿈디자이너's 꿈꾸는 저금통,https://blog.naver.com/ericashin,2011-09-04
추억의 명지대엄마손떡볶이+ 연희동카페투어,https://blog.naver.com/sjdh1006?Redirect=Log&logNo=220770365869,"나의 유년시절의 기억,엄마손떡볶이ㅠㅠㅠㅠㅠㅠ 여긴 명지대앞 떡볶이맛집이다, 명지대 근방에 살았던 사람이라면 다 아는 그 떡볶이! 떡볶이는 밀떡이 진리다 튀김은 꼭 야끼만두 추가 ㅋㅋㅋㅋㅋ 비가... ",진슐랭가이드 : 워킹맘아카이브,https://blog.naver.com/sjdh1006,2016-07-26
★명불허전 명지대엄마손떡볶이 ★,https://blog.naver.com/hj810203?Redirect=Log&logNo=220392124380,이걸먹기위해 일부러 명지대에서 약속을 잡았어요^^ 으하하하^^ 반갑다엄마손떡볶이 야~~~~ 바로 요 떡볶이에요~~~ 오뎅 둥둥 띄워져있는 오뎅국물... 이 오뎅국물도 참~~~ 맛있는데 특이한맛은 아닌데 희안하게... ,아름다운별 빛나는여행 LOVEYUN,https://blog.naver.com/hj810203,2015-06-17
명지대 추억의 맛집 :엄마손 떡볶이 ,https://blog.naver.com/tkdtkd951231?Redirect=Log&logNo=220845299046,모를만큼엄마손떡볶이 를 자주먹었어요~ 정말 하루의 일과가 될만큼 ㅋㅋㅋ 예~전에 초등학교때 명지전문대 지하?에있는 헬스를 다녔는데 헬스다녀와서 떡볶이를 먹는게 하루의 일과였어요.. 그리고 교회에... ,Ellebell_studio,https://blog.naver.com/tkdtkd951231,2016-10-25
안산 ::엄마손 즉석 떡볶이 ,https://blog.naver.com/sns0210?Redirect=Log&logNo=220461519551,♩엄마손 즉석 떡볶이한양대 에리카 정문 앞 즉떡 간판 사진 또 없... ㅋㅋㅋ 요새 김밥이 왜케 먹고 싶나요. 김밥김밥엄마 가 싸준 집김밥이 먹고 싶다.. 사실 김밥 맛집이라고 하지만 역시나 그래요.. 지난번... ,네이밍고♪,https://blog.naver.com/sns0210,2015-08-25
명지대엄마손떡볶이 /남가좌동 맛집/명지대떡볶이,https://blog.naver.com/vepa78?Redirect=Log&logNo=130184268175,명지대엄마손떡볶이엄마손 떡볶이엄마손 떡볶이 를 아시나요?? 베파의 오랜 단골!! 초등학교때부터 지금까지.. 누구든지 당신의 엄마의 김치가 맛있듯 동네 어릴적 그떡볶이가 맛있잖아요!! 여긴 우리... ,베파요가스쿨,https://blog.naver.com/vepa78,2014-01-24
인하대학교 후문 명물엄마손떡볶이ㅋㅋㅋ,https://blog.naver.com/imexciting?Redirect=Log&logNo=120198865508,밀린 글 쓰려니 힘들다헥헥헥 간판이 소문난 이웃집 떡볶이네.. . . 왼쪽에 보면 (구)엄마손 이라고 깨알같이 써있넹친구들이랑 마손이라고 부르는엄마손 떡볶이ㅋㅋ 블로그 좀 해보겠다고 입구 찍는데뭔가... ,최작가의 좋은 날,https://blog.naver.com/imexciting,2013-09-27
명지대앞엄마손 떡볶이 ,https://blog.naver.com/jsjung1999?Redirect=Log&logNo=220264500056,명지대 앞의 유명한 떡볶이집엄마손 떡볶이 집입니다 이정희 떡볶이도 유명하다고 하던데 떡볶이가 무지하게 먹고싶던 어느날 차 몰고 20여분만에 당도한엄마손 떡볶이오후 3시쯤이었는데 손님이 꽤... ,양배추님 잘먹고 잘살기,https://blog.naver.com/jsjung1999,2015-02-06
명지대앞 맛집 - 자꾸만 생각나는엄마손 떡볶이 ,https://blog.naver.com/umyo2000?Redirect=Log&logNo=120064040696,"참 묘한 매력이 있어서 한번 갈때보다 두번갈때, 세번갈때 더 맛있고 생각나고 끌리는 집인거같아여~ 정감가는 이름~~엄마손 떡볶이 ~~~!!! 떡볶이 가격 1,000원은 오르지도 않네요~~ㅎㅎ 저 꼬마김밥이 같이... ",어묘의 맛있는 이야기~,https://blog.naver.com/umyo2000,2009-02-23
착한가격 명지대엄마손떡볶이/ 맛도 가격도 착한 떡볶이,https://blog.naver.com/dsk0220?Redirect=Log&logNo=220716624012,서대문구 명지대앞 착한가격 명지대엄마손떡볶이/ 맛도 가격도 착한 떡볶이 일요일 조금은 게으르게... 해 20미터쯤..걸으면 오른쪽에 엄마손 떡볶가 있다. 이곳이 처음 왔을때 좋았던건 중고등학교때... ,KOOK's STORY,https://blog.naver.com/dsk0220,2016-05-23
 엄마손 떡볶이/ 서대문구 남가좌동 명지大앞.,https://blog.naver.com/foxoh7?Redirect=Log&logNo=130035319395,정말 오랜만에 찾은 명지대 앞 ' 엄마손 떡볶이 ' 나는 이 떡볶이집이 야구연습장 근처에서 포장마차로 시작할 때부터 쭈욱 단골이었다.아마..20년도 훨씬 넘었을 것 같다. 카레가 들어간 매콤한 떡볶이는 먹어봐야... ,이야기가 있는 풍경 / 吳感風景,https://blog.naver.com/foxoh7,2008-09-16
"1.명지대엄마손 떡볶이 , 최애떡볶이",https://blog.naver.com/1st_realize?Redirect=Log&logNo=221448931522,제 떡볶이 순위에 1위에있는 떡복이예요 떡복이 맛집 많이 아시는 분들 추천해주세염...흐흐 #명지대엄마손엄마손 떡볶이 라는 가게이름이 넘 많더라구요. 명지대는 사실 엄마손때문에 처음가봤었던 동네라서... ,#susu look,https://blog.naver.com/1st_realize,2019-01-23
비뱐씨의 떡볶이 탐험 로드 : 명지대 마약 떡볶이 -엄마손떡볶이 ,https://blog.naver.com/umihai?Redirect=Log&logNo=221084383309,↑↑↑↑↑↑↑↑↑↑↑↑↑↑↑↑ 바로 이날 포스팅에 적었던 그 추억의 떡볶이가 먹고 싶어서 ㅠ_ㅠ...엄마손 떡볶이 . 내 고등학교 학창시절을 추억하게 만들어주는 너. 설레는 마음을 안고 가게에 들어가... ,운동쟁이 비뱐씨의 일상로그,https://blog.naver.com/umihai,2017-08-29
[서대문맛집 명지대맛집] 저렴하고 착한엄마손 떡볶이 ,https://blog.naver.com/7irene?Redirect=Log&logNo=70075910652,요렇게 날씬한 떡볶이가 더 마음에 든다^^ 서대문맛집엄마손 떡볶이 의 떡볶이.. 이제 한입 먹어볼까... 한입에 쏙 먹기 좋은 서대문맛집 엄마손의 꼬마김밥~엄마손떡볶이 에서.. 빼놓고 먹으면 섭섭한 메뉴다.... ,"★이레네, 기억을 담는 시간★",https://blog.naver.com/7irene,2009-12-16
[흑석동]쌀 떡볶이의 최고봉 -엄마손 떡볶이 ,https://blog.naver.com/spriteh?Redirect=Log&logNo=110019372163,쌀 떡볶이의 최고봉 - (흑석동)엄마손 떡볶이흑석동 중앙대학 병원 앞의 시장은 지금은 재개발로 인하여 작은 포장마차와 국수집들이 사라졌지만 아직도 몇 몇 집들은 상가안에 자리를 잡고 영업을 하고... ,felix,https://blog.naver.com/spriteh,2007-07-02
명지대 떡볶이. 엄마는 못 만드는엄마손 떡볶이 ,https://blog.naver.com/yjkim228?Redirect=Log&logNo=220481152597,입술에 간혹 티셔츠까지 영양소를 고려한 우리 엄마는 못 만드는엄마손 떡볶이명지대 떡볶이엄마손 떡볶이알아요. 이해해요. 저도 침 나옵니다. 떡볶이 같이 시켜먹을 딸들을 빨리 만나야하는데. ENJOY THE... ,"국수, 그 찰나를 쓰다",https://blog.naver.com/yjkim228,2015-09-14
[떡뽁이] 명지대 명물 ' 엄마손 떡볶이 ',https://blog.naver.com/exboifriend?Redirect=Log&logNo=70084298725,떡볶이 떡볶이네엄마손떡볶이엄마손떡볶이엄마손떡볶이엄마손떡뽁이 엄마손떡뽁이 엄마손떡뽁이 엄마손똑뽁이엄마손떡볶이엄마손떡볶이엄마손떡볶이엄마손떡뽁이 엄마손떡뽁이 엄마손떡뽁이... ,exboifriend,https://blog.naver.com/exboifriend,2010-04-16
[명지대맛집]엄마손떡볶이 ::명지대 떡볶이 완전 추천!,https://blog.naver.com/beronicas?Redirect=Log&logNo=220399992993,"' 엄마손떡볶이 , 엄지손떡볶이, 이정희떡볶이' 그 중 엄지손떡볶이는 역사속으로 사라지고 지금은... 역사와 전통(?)을 지닌 떡볶이를 자주 찾게 됩니다... 가끔 문뜩 너무 생각나는 맛이예요... 엄마손떡복이... ",개인공감,https://blog.naver.com/beronicas,2015-06-28
[명지대엄마손 떡볶이 ] 왜이렇게 맛있는거죠?!!!,https://blog.naver.com/zrlol87?Redirect=Log&logNo=90176242548,후 다음달이면 노예끝나는데 어서 바꾸고싶어요 ㅠ) 명지대엄마손 떡볶이~ 저도 드디어 가봤어요... 먹었던 떡볶이 중에 엄마손이 제일 맛있어요 ! 대박대박.ㅎㅎ 떡볶이가 별 다르겠어.....; 싶어... ,CHAE LUVෆ,https://blog.naver.com/zrlol87,2013-07-02
남가좌동 명지대엄마손 떡볶이추억의 학교앞 옛날떡볶이,https://blog.naver.com/ohbams77?Redirect=Log&logNo=222445693937,계란은 떡볶이 국물에 조사먹어야 제맛 이구요#남가좌동떡볶이 #명지대떡볶이 # 엄마손떡볶이#학교앞떡볶이 #추억의옛날떡볶이남가좌동 명지대엄마손 떡볶이추억의 학교앞 옛날 떡볶이 맛있게 먹고 왔네요,행신동미용실 수호헤어,https://blog.naver.com/ohbams77,2021-07-26
숙대엄마손 떡볶이 ,https://blog.naver.com/dhtnfld?Redirect=Log&logNo=100067520284,밥....집.....좀.....ㄱ- 여기 완전 진심 최최최최최최최최최고의 떡볶이랑 튀김을 파는 졸졸졸졸졸졸졸졸졸졸 맛있는엄마손 떡볶이 !!!!!!! 아ㅋㅋㅋㅋㅋ순대도 맛있다!!!!!!!! 여기 떡볶이가 진짜 최고임... ,고상한 취미생활,https://blog.naver.com/dhtnfld,2009-05-25
 엄마손 떡볶이이정희 떡볶이 -명지대 떡볶이,https://blog.naver.com/beemealy?Redirect=Log&logNo=10159021203, 엄마손떡볶이 에서 아주 가까운 거리에 있는 이정희 떡볶이. 비슷한 스타일과 가격. 그냥 보통의 떡볶이이다. 떡의 느낌은 엄마손쪽이 훨씬 나은편. 카레향이 싫거나 늘 먹는 일반적인 보통의 떡볶이를 원한다면... ,먹고 사느라 바쁘다,https://blog.naver.com/beemealy,2013-02-04
명지대엄마손떡볶이 ,https://blog.naver.com/sj121527?Redirect=Log&logNo=50174630535,"학교앞답게 가격도 착하고 맛도 좋았습니다ㅋㅋㅋ 늦은 시간 떡볶이가 생각나신다면 요기~~~괜찮습니다ㅋㅋ 이상 츄춥였습니다. 명지대엄마손 떡볶이 , 가로수길 기린 이치방가든, 빙빙빙, 버블트리, 꼬마네집... ",츄춥의 Real Stories!,https://blog.naver.com/sj121527,2013-07-02
명지대앞 맛집 -엄마손 떡볶이쉐프밥버거,https://blog.naver.com/monaca21?Redirect=Log&logNo=150188396730,". 떡볶이 1인분에 야끼만두, 김말이, 못난이 순대 1인분 추가요~ ㅋㅋㅋㅋㅋ 아주아주 특별한 맛은 아닌데 (너무 기대하고 가서 그릉가?? ) 가끔씩 찾게 되네요;;;;; 명지대엄마손 떡볶이사진이 너무 적어서... ",Story of my Life,https://blog.naver.com/monaca21,2014-04-08
명지대 맛집 [ 엄마손떡볶이 ] 동네분식 맛집 ^^,https://blog.naver.com/qhddltnsdl?Redirect=Log&logNo=222416248658,혼자온 손님 가족단위 손님 애기들과 함께 온 엄마손님 친구와 함께 온 손님 동네맛집이어서 그런지... 독특하게 맛있는 떡볶이맛집~ [ 엄마손떡볶이 ] 추천~ # 엄마손떡볶이#명지대 #명지대맛집 #명지대떡볶이... ,"여러가지, 감성",https://blog.naver.com/qhddltnsdl,2021-07-01
 엄마손떡볶이 *Food,https://blog.naver.com/ji0dotori?Redirect=Log&logNo=30177814666,안산 한대앞엄마손떡볶이정확한 주소나 전화번호는 모르겠고. 한대 정문 사거리에서 인쇄집 있는 건물에 있다. 정문 바로 앞. 영업시간은 밤 10시까지. 즉석떡볶이를 좋아하기 때문에 찾아낸(?) 집. 종로에... ,재미있는 세상살이.,https://blog.naver.com/ji0dotori,2013-10-17
