title,link,description,bloggername,bloggerlink,postdate
담양 국수거리옛날진미국수다녀왔어요~,https://blog.naver.com/mihwa3826?Redirect=Log&logNo=222439301452,걷다가옛날진미국수 집에서 먹기로하고 한쪽에 자리를 잡았어요^^ 삶은 계란도 두개 시켰어요 ^^ 열무비빔국수. 국물둗수 이렇게 시켰어요~~ 밑반찬은 단무지무침.콩나물.김치 ^^ 열무비빔국수에 군계란을... ,땡굴맘,https://blog.naver.com/mihwa3826,2021-07-21
"담양맛집,담양프로방스맛집,옛날진미국수 ",https://blog.naver.com/bbongga0516?Redirect=Log&logNo=221243893330,있는진미국수 집에 와봤어요~. 다욧 중이였지만 막걸리가 너무 땡겨서 그만 ㅠㅋㅋ 요 막걸리는 첨 먹어보는거였는데 먹고나서 트름도 안나구 너무 맛있어서 혼자서 다 먹어버렸다네요ㅠ ㅍㅎ 드됴 메인 국수 가... ,없는것이 많아 자유로운 BBongGa~♥,https://blog.naver.com/bbongga0516,2018-04-03
담양옛날진미국수/ 담양 밀밀 ♡ ♥,https://blog.naver.com/bo_ona?Redirect=Log&logNo=222440236934, 옛날 진미국수메타프로방스점 뽀블록 2021. 7. 18. (일) 날씨 왕더움 #담양 시라니가 주말에... 먹었다 ㅎㅎ 배고파 죽어ㅠㅠ 비빔 비빔국수 존맛 열무랑 먹으면 존마탱 콩 날이 더우니까 시원하게 콩국수 설탕파... ,bo_ona:log,https://blog.naver.com/bo_ona,2021-07-21
담양여행(2) 담양 애견동반식당 담양 국수거리옛날진미국수 ... ,https://blog.naver.com/bggggg2?Redirect=Log&logNo=222384222723,"그 중 사람들이 제일 많았던 옜날진미국수! 관광지인데도 불구하고 생각보다 가격이 엄청 착해요!! 저희는 물열무이랑 비빔열무, 그리고 파전을 주문했어요.옛날진미국수직원들이 친절하진 않아요 이렇게... ",버감이랑이랑,https://blog.naver.com/bggggg2,2021-06-04
[담양 맛집] 담양 맛집옛날 진미국수 ,https://blog.naver.com/gomji0814?Redirect=Log&logNo=222402594906,부르고 옛날얘기도 하니까 금방 도착하더라구요 저희가 간 곳은 담양에 국수거리에 있는 국수를... 담양진미국수 #담양 옛날진미국수#담양죽녹원 #죽녹원 #죽녹원국수거리 #죽녹원국수 매장 외관은 이렇게... ,Record; my memory,https://blog.naver.com/gomji0814,2021-06-18
[전라도여행] 광주 : 5.18기념문화센터 ▶ 담양 :옛날진미국수 ... ,https://blog.naver.com/thdud261?Redirect=Log&logNo=221343442268,"담양 #국수거리 에 위치한 맛집중의 맛집이라는 # 옛날진미국수야외테라스에 이렇게 앉아 있으면 주문을 받으러 오신다 •⌄• 대식가인 우리에게 국수 한그릇은 애교, 파전도 같이 주문 ღ 너무 맛있는 것... ",세상의 빛,https://blog.naver.com/thdud261,2018-08-22
" 옛날진미국수(★★★☆☆), 음식점, 담양",https://blog.naver.com/neung_k?Redirect=Log&logNo=222357349076,"2021.05.15 SAT 날씨 꾸리꾸리, 비 담양 담양읍 온전히 파전 냄새에 끌려 들어간 곳옛날진미국수담양을 찾아보니 국수거리가 유명하다고 했다. 이대로 가기에 아쉬워 점심이나 먹자, 하고 들렀다. 가게가 너무... ",NEUNG,https://blog.naver.com/neung_k,2021-05-19
담양국수거리 # 옛날진미국수 ... 메타프로방스진미국수.5/20,https://blog.naver.com/memy7788?Redirect=Log&logNo=222381572687,ㅎㅎ 옛날에 왔을땐 여기 야외 테이블에서 앉아 먹었었는데... 밖에 저렇게 대파도 나와있고 하던데... 진미국수집 가는길...옛날 진미국수 집 평일이여서 그런지 손님도 없고 조용해서 좋았다는...ㅎㅎ... ,삶은여행~,https://blog.naver.com/memy7788,2021-06-02
3대천왕 담양국수거리 진미국수 / 담양 진미국수 /옛날진미국수 ,https://blog.naver.com/flhd1004?Redirect=Log&logNo=220726372596,추천으로 진미국수를 가보았습니다. 일단 위치는 진우네국수 바로 옆집입니다. 상호가옛날진미국수였군요 ㅎㅎ 홀에는 먹을 수 있는 곳이 별로 없구요 이렇게 평상에서 강을 바라보며 국수를 먹을 수... ,민이네 가족캠핑,https://blog.naver.com/flhd1004,2016-06-03
담양옛날진미국수 ,https://blog.naver.com/sinbibom?Redirect=Log&logNo=220856338991,유명해진진미국수담양 국수 거리의 라이징스타 사실 여긴... 방송 전엔 담양사람들도 모르던 곳;;... 요즘은 손님이 너무 많아서 걍 집에서 삶은 계란과 다를 바 없더라 ㅠㅠ 근데 이 날은 계란에서옛날맛이 나서... ,SPRING IS HERE,https://blog.naver.com/sinbibom,2016-11-08
담양국수 거리에서 찾은진미국수,https://blog.naver.com/yongju320?Redirect=Log&logNo=222060545039,중에서도 진미국수라는 곳이 눈에 들어오더라고요. 그 이유는 바로 이 야외석! 가게 안에 실내석도... 시원한 국수 먹고 싶을 때 또 생각날 것 같은 느낌입니다! 여기까지 담양 국수거리에 있는옛날 진미국수 ... ,따듯한 우유,https://blog.naver.com/yongju320,2020-08-14
담양_ 옛날진미국수 (#담양맛집),https://blog.naver.com/jmkdw1004?Redirect=Log&logNo=222362608205,"담양맛집 ' 옛날진미국수 ' 메뉴판과 카운터, 셀프코너. 비빔국수, 멸치국물국수. 멸치국물국수. 열무비빔국수. 파전. 금액 멸치국물국수(4000) + 열무비빔국수(5000) + 파전(8000) + 음료수(1000) = 18,000원 대기여부... ",냠냠한 일상,https://blog.naver.com/jmkdw1004,2021-05-25
담양 메타프로방스옛날진미국수비빔국수 맛집으로 유명해!,https://blog.naver.com/bada_ari?Redirect=Log&logNo=222425020961,"오늘 소개해볼 맛집은 담양에 위치한 메타 프로방스옛날진미국수라는 집인데요~ 담양에 국수 맛집이 여러개 있는데 진우네, 뚝방, 진미 세곳이 제일 맛있는거 같아요. 사실 저의 원픽은 뚝방이지만 비빔은... ",010-5647-4747 갈매기배낚시,https://blog.naver.com/bada_ari,2021-07-08
[담양 맛집] 감칠맛 나는 뚝방 국수VS 얼큰한진미 국수어떤... ,https://blog.naver.com/jiny1445?Redirect=Log&logNo=222409239155,"ㅎㅎ 담양 여행 시, 국수가 당길 때 뚝방국수 VS 진미국수 담양 뚝방국수 주소: 전남 담양군 담양읍... 담양옛날진미국수주소: 전남 담양군 담양읍 메타 프로방스 2길 6-15 매일 10:00 - 18:30 전화 : 061-383-0984... ",아기자기 하미니네,https://blog.naver.com/jiny1445,2021-06-25
"[리뷰] 백종원3대천왕 에 나온,담양국수거리 ' 옛날 진미국수 ... ",https://blog.naver.com/byjuninterior?Redirect=Log&logNo=222430672392,표현했다면 그것도 분명 맛있는거니 ㅋ 물국수도 파전도 드셔보세용 ㅋㅋ #국수맛집 #비빔국수맛집 #담양맛집추천 #담양국수거리맛집 # 옛날진미국수#백종원3대천왕국수집 #담양 옛날진미국수#담양국수거리,byjuninterior님의블로그,https://blog.naver.com/byjuninterior,2021-07-24
"백종원의 3대천왕, 담양옛날 진미 국수 ",https://blog.naver.com/jo_dong0628?Redirect=Log&logNo=222386174973,"그 중에서도 백종원의 3대천왕에 방영하여 유명한 국수 집이였던옛날 진미 국수 집을 찾았어요. 저는 평소 진우네 국수집을 굉장히 좋아하는 편인데, 이 날은 파전까지 먹기로 해서 이 집을 찾아갔어요.... ",You의 블로그,https://blog.naver.com/jo_dong0628,2021-06-05
"국수거리맛집,담양국수맛집옛날진미국수 /다킷리스트_D's... ",https://blog.naver.com/dadada832?Redirect=Log&logNo=220736107256,거기에 콩나물+약간의 양념 저는 개인적으로 멸치국수가 더 맛있더라구요! 이렇게 배불리먹었는데도 둘이서 단돈 9천원! 가격도 저렴하고 양도 푸짐한 국수거리맛집옛날진미국수꼭 가보시길 추천합니다❤️,D's Bucket list,https://blog.naver.com/dadada832,2016-06-14
담양 국수거리 맛집 :: 담양옛날진미국수(위치 / 가격... ,https://blog.naver.com/subin950813?Redirect=Log&logNo=222483969383,담양 맛집 진미국수 하이! 에이치아이! 광주 근교 드라이브로 떠난 담양 여행 담양 하면 국수거리가... 담양 국수거리에서의 식사는옛날진미국수 로 당첨! 2. 메뉴가격 담양 국수거리 맛집 ' 옛날진미국수 '는... ,맛집&카페 뿌시는 먹숩로그,https://blog.naver.com/subin950813,2021-08-26
"담양여행 :: 담양 죽녹원, 담양 국수거리옛날 진미국수 ",https://blog.naver.com/qkfrhrdmswls?Redirect=Log&logNo=220078649004,역시 사람이 많다 ㅠㅠ 그래서 블로그에서도 많이 봤던옛날 진미국수진미국수에 자리를 잡았다 ! 국수거리에서 파는 약계란이 맛있다고해서 한판시키고 나중에 한판더 시켰다 ㅋㅋㅋ 색다른 맛이라기보다... ,JJAM,https://blog.naver.com/qkfrhrdmswls,2014-08-01
담양 국수 거리옛날 진미 국수 ,https://blog.naver.com/leehwangji?Redirect=Log&logNo=222370688311,이번 주말 나들이로 담양 국수 거리 어떠신가용!? 오늘의 맛있는 분위기 :#블챌 #오늘일기 #오늘 #일기 #전남 #담양 #광주근교 #국수거리 #맛집 #진미국수 # 옛날진미국수#파전 #맛집 #냠냠 #데이트 #가족 #나들이,공복,https://blog.naver.com/leehwangji,2021-05-27
"죽녹원 (feat. 옛날진미국수 ), 담양",https://blog.naver.com/neung_k?Redirect=Log&logNo=222357316598,죽녹원을 뒤로 하고 돌다리를 건너면 그 유명한 (사실 이번에 찾아보면서 처음 알았다..ㅎ) 담양 국수거리 지대로 노상 많은 가게 중 우리가 들어간 # 옛날진미국수국수가 유명해 들어갔는데 파전이 미쳤다. 또... ,NEUNG,https://blog.naver.com/neung_k,2021-05-19
담양옛날진미국수메타프로방스점 다녀왔습니다,https://blog.naver.com/qazwsx2846?Redirect=Log&logNo=222325058460,어떨지 아실겁니다 여튼 오늘도 이렇게 나와서 먹으니 정말 좋네요 # 옛날진미국수 메타프로방스점 #메타프로방스 # 옛날진미국수#국수 #담양여행 #담양메타세콰이어 #메타세콰이아랜드 #메타세콰이아 #담양맛집,일상&미용블로그,https://blog.naver.com/qazwsx2846,2021-04-27
[담양] 국수거리 ' 옛날 진미국수 ',https://blog.naver.com/sangeunlee1?Redirect=Log&logNo=90150962952,조금 더 들어가서 ' 옛날 진미국수 '에 자리를 잡았다. 국수집들이 다들 나무아래 마루를 해놓아서 시원하게 먹기 좋은 것 같다. :) 시킨메뉴는 한방약계란(\1000원) 열무비빔국수(\3500원) 멸치국물국수(\3500원)... ,S log,https://blog.naver.com/sangeunlee1,2012-08-29
 옛날진미국수 ,https://blog.naver.com/pungnang?Redirect=Log&logNo=222490681398,오늘은 담양 관방제림 근처에 있는 국수거리옛날진미국수 에 가보았습니다. 백종원의 3대천왕에도 방송에 나온곳입니다. 홀에서 먹을수는 있지만 밖에 테이블에서 시원한 천을 배경삼아 드시는 걸 추천합니다... ,Mill,https://blog.naver.com/pungnang,2021-08-31
담양메타프로방스/담양죽녹원/담양 옛날진미국수 ,https://blog.naver.com/goeun8228?Redirect=Log&logNo=221400329691,부부찹쌀도너 짱맛 여기는 강력 추천옛날진미국수멸치육수에 먼짓을 한거야? 너무 맛있다 떡갈비보다 더 맛있네 죽녹원으로 그렇게나 재밌게 봤던 강호동 완전체일때 1박2일 촬영지 가을 담양 안녕,RINRINRIN,https://blog.naver.com/goeun8228,2018-11-17
[맛집 리뷰] 전라도 담양 : 내돈내산 ‘ 옛날진미국수 ’(국수의거... ,https://blog.naver.com/snnn146?Redirect=Log&logNo=222441076946,#내돈내산 #맛집후기 #담양맛집추천 #담양맛집 #국수의거리 #담양국수맛집 #담양국수 # 옛날진미국수 운영시간 # 옛날진미국수 휴무 # 옛날진미국수 주차 무더운 여름에 여행을 하는 것은 정말 어려운 것 같아요.... ,웅종이의 하루,https://blog.naver.com/snnn146,2021-07-22
담양여행 1박2일 국수거리백종원3대천왕 국수옛날진미국수 ,https://blog.naver.com/ddoung282?Redirect=Log&logNo=221271127849, 진미 국수 는 메타프로방스에도 있더라고요! 메타프로방스로 갈 계획이 있으시다면 그쪽도~ 근데 그쪽은 제가 가보질 않아서 어떤지 정확히는 모르겠네요!! 가격도 저렴하고~ 맛도 좋았습니다! 시장이 반찬인... ,언니네다락방-청주위빙 청주토탈공예,https://blog.naver.com/ddoung282,2018-05-08
[담양 -옛날진미국수 ] 배신자 국수거리에 가다,https://blog.naver.com/feelluvei?Redirect=Log&logNo=50149396600,[담양 -옛날진미국수 ] 배신자 국수거리에 가다 지인들과 강천사에서 씐나게 놀고 오들오들 추운몸을... ㅋㅋㅋㅋㅋㅋ 입구에서 그리 멀지 않은 옜날 진미국수집에 가기로 했어요 ㅎㅎ 젖은옷 그대로 입고 있어서... ,겸지의 뭉게뭉게 구름여행,https://blog.naver.com/feelluvei,2012-09-04
담양국수거리 / 담양 죽녹원 국수 # 옛날진미국수 ,https://blog.naver.com/as0380?Redirect=Log&logNo=222389764614,담양국수거리 / 담양 죽녹원 국수 # 옛날진미국수국수가 나와서 먼저 흡입하고 있는데 다 먹어가도 파전이 안나와서 직원분께 말하기 ㅋㅋㅋㅋ 당황해하시면서 무전하시던데 아무래도 누락된 것 같다...^^... ,로log,https://blog.naver.com/as0380,2021-06-08
 국수 제2탄! 담양 국수 거리옛날진미 식당국수 의 정점을찍다,https://blog.naver.com/vhehdhkdbwl?Redirect=Log&logNo=222378512089,담양 국수거리에 위치한 옛날진미식당을 소개할까합니다 ㅎㅎ 우선 #담양죽녹원 놀러오신분들은 전부... 이렇게 진미국수외에도 많은 국수집이 자리잡고 있어요 하지만 저희는옛날 진미국수 로 갈예정입니다... ,해리포터초코맛집일상,https://blog.naver.com/vhehdhkdbwl,2021-06-01
담양옛날 진미국수- 메타프로방스 내에 있어서 먹고 왔어요... ,https://blog.naver.com/changtechjb?Redirect=Log&logNo=220666545073, 옛날 진미국수 ~ 담양 메타세콰이어길 옆 동네... 메타 프로방스 안에 있어요~ 달걀이 아주 고와요~ 색깔도 살짝 진한.. 살(?)색? 음... 연한 황토색? 비빔국수는 살짝 매워요... 매콤하다고 볼수도 있고요.. 계란... ,창테크 전북지사,https://blog.naver.com/changtechjb,2016-03-31
담양 국수거리옛날진미국수 ,https://blog.naver.com/yyj3346?Redirect=Log&logNo=220130146003,담양국수 거리진미국수휴가다녀온지 한달이 다됐는데...아직도포스팅중인 윤빵 ㅋㅋ 밀가루귀신이 죽녹원에 가면서국수 거리를 그냥 지나칠 수 없지 ㅋㅋㅋㅋㅋ 진우네를 가야하나 진미 를 가야하나... ,#윤빵순의 먹부림,https://blog.naver.com/yyj3346,2014-09-23
"담양 맛집, 담양제과 대나무 케이크와옛날진미국수 ",https://blog.naver.com/cutetnwls?Redirect=Log&logNo=222088120402,국수거리 그중에서도옛날 진미국수수많은 국숫집들 중 우리가 찾아간 곳은 영산강 바로 옆에 위치한... 바로 진미국수였다. 여기야? 하고 걷다가 아무 빈자리에 앉았는데 직원분이 직접 오셔서 주문을... ,미소는 얼굴의 향기,https://blog.naver.com/cutetnwls,2020-09-20
담양 메타 프로방스 ♩ 키다리 대나무 /옛날진미국수 ... ,https://blog.naver.com/wingcyan?Redirect=Log&logNo=220626912834,ㅋㅋㅋ옛날 진미 국수프로방스 가장 끝에 있던 진미국수 뚝방길 평상에서 먹던 그 국수 아점 먹고 와서 배가 막 고프진 않았지만 돌아다니다 보니 쌀쌀해서 따순 국물 땡겨서 점저 먹으러 들어가려고 보니... ,Someday : P,https://blog.naver.com/wingcyan,2016-02-15
일상]구시청 춘부집/불로동 텟판/담양나들이/ 옛날진미국수 ,https://blog.naver.com/wkakqhqh?Redirect=Log&logNo=220660016617,배고픈 우리는 국수먹으러옛날 진미국수방문해쏘용 삼대천왕에 나와서 그런지 항상 핫플이였던 진우네국수보다 사람들이 그득그득 밑반찬 셋팅해주시구용 계란도 시켜서 식전 애피타이져같은 느낌 막걸리도... ,짓응이 무드이너프,https://blog.naver.com/wkakqhqh,2016-03-20
"담양 맛집 투어 담양 소바집,담양수북회관,담양옛날 진미국수 ",https://blog.naver.com/sochi82?Redirect=Log&logNo=220732992938,나왔다는옛날 진미국수 집 아마 열무 비빔국수 가격은 지금쯤 올랐을듯 하다 집에서 먹는 밥상같은데 나온 국수 난 잔치국수 귀신이라 한젓가락 했는데... 응? 머야..이거 ..이게 콩나물국이야 머야... ,랄지앤소치,https://blog.naver.com/sochi82,2016-06-10
"객사리맛집] 옛날진미국수- 비빔국수, 맥반석계란",https://blog.naver.com/dnr6578?Redirect=Log&logNo=220744898124,오늘은 국수거리에 있는옛날진미국수 를 가봅니다. 비교적 조용한 동네 골목길을 산책하면서.... 흐드러지게 폰 들국화도 보고... 국수거리에 당도합니다. 국수거리엔 이 곳 말고도 다른 국수집도 많으니... ,금군의 미각은 나의 힘,https://blog.naver.com/dnr6578,2016-06-25
"곳 보지도 말고옛날진미국수가세요 (멸치국수, 비빔면, 파전)",https://blog.naver.com/yoonjeejjang?Redirect=Log&logNo=222445041891,담양 국수거리 유명한 거 아시죠 제일 유명한 곳과 리뷰많은 곳 두곳 방문했는데 국수거리는 무조건옛날진미국수 로 가는 걸로... 저희는 평일에 방문했습니다 진미국수 수요일에 휴무일이니 꼭꼭 참고하세요... ,Z I Z I,https://blog.naver.com/yoonjeejjang,2021-07-25
