title,link,description,bloggername,bloggerlink,postdate
[담양맛집] 담양국수거리옛날진미국수 ,https://blog.naver.com/seulog86?Redirect=Log&logNo=220337024011,담양 죽녹원으로 주말 나들이를 다녀왔는데요 죽녹원 바로앞에 국수거리가 유명하다고 해서 먹으러 갔다왔어요(떡갈비집이 브레이크타임에 걸려서 못먹은건 안비밀ㅜㅜ) 국수거리에서옛날진미국수 집이... ,여행과 일상사이 _SEULOG,https://blog.naver.com/seulog86,2015-04-21
[전남맛집/담양맛집] 옛날진미국수 / 옛날진미국수메타프로방스점,https://blog.naver.com/tictoclove?Redirect=Log&logNo=221016948512,"바로 메타프로방스 구경을 해야지..했는데, 마침 눈에 들어온 국수집- 백종원의 삼대천왕에 나왔다던 ' 옛날진미국수 '입니다. 궁금해서.. 들어왔더랬어요 ㅎ 저녁에 밥을 먹을것이기에,, 그냥 멸치국물국수... ",백곰군과 토리냥의 행복만들기~♡,https://blog.naver.com/tictoclove,2017-05-29
담양국수골목옛날 진미국수 ,https://blog.naver.com/gus45e?Redirect=Log&logNo=220970627266,"담양 여행은 차가 있어야 편하긴 해요 국수거리 건너편에 주차된 차도 많았습니다옛날 진미국수메뉴 멸치국물국수 4,000원 열무비빔국수 4,000원 콩물국수(여름) 6,000원 한방약계란 (2개) 1,000원 파전 8,000원... ",스쳐간 것들의 기록,https://blog.naver.com/gus45e,2017-03-30
"[별세개] 담양국수거리_ 옛날진미국수 , 댓잎아이스크림",https://blog.naver.com/kimgoingkeepgoing?Redirect=Log&logNo=222490282570,담엔 죽녹원 더 자세히 구경해야지~ Previous image Next image 하늘 이뻐 청명해 하늘도 수연이와의 만남을 축복했던 날~#담양 #죽녹원 #담양여행 #대나무 #담양국수거리 # 옛날진미국수#댓잎아이스크림... ,가지가지 의 일상,https://blog.naver.com/kimgoingkeepgoing,2021-08-31
[담양국수거리]옛날진미국수 ,https://blog.naver.com/gunag83?Redirect=Log&logNo=50178323628,"[담양국수거리]옛날진미국수-- 죽녹원 영산강 건너길을 보면 담양국수거리가 있다. 올3월에 다녀온 곳인데, 이제서야 사진정리하다가 발견한... -_- 담양국수거리에 있는 가게들이 나열되어 있다. 진우네... ",변덕쟁이그녀,https://blog.naver.com/gunag83,2013-08-27
담양 국수거리 백종원 3대 천왕 ‘ 옛날진미국수 ’ 야외에서... ,https://blog.naver.com/pet_205?Redirect=Log&logNo=222495801245,놓인 국수거리를 올려다보며옛날진미국수 를 찾았는데 중간 지점쯤에 위치해 계단 바로 옆에 있어 찾기 쉬웠어요 정말 오랜만에 와서 설렜고 이제 가을 바람도 선선하게 불기 시작해 야외 벤치에서 국수... ,맛있는 디자인,https://blog.naver.com/pet_205,2021-09-05
"(담양애꽃,죽녹원,낼름,섬진강기차마을드림랜드, 옛날진미국수 ... ",https://blog.naver.com/kim5433365?Redirect=Log&logNo=222531335255,앞쪽에는 꽃부터 시작해서 동물원 놀이공원까지 다양한 게 많은 테마파크 같은 곳이에요~ 점심은옛날진미국수메타프로방스점에서 먹었습니다. 가격도 진짜 저렴해요. 멸치국물국수는 4000원 열무비빔국수... ,먹고 보는 혜영블로그,https://blog.naver.com/kim5433365,2021-10-08
담양 국수 거리맛집 보장옛날진미 네 국수 ,https://blog.naver.com/mihyeyoon_?Redirect=Log&logNo=222447400540,담양 국수거리 리뷰를 찾다보면 면이 시원하지도 않도 미지근해서 정말 실망했다는 다른 가게의 리뷰도 있는데요옛날진미국수 는 정말 그런거 하나도 없고 맛있었어요. 다만 진미국수의 비빔양념이 저희... ,❤️myeyoon,https://blog.naver.com/mihyeyoon_,2021-07-27
담양 국수거리옛날진미국수 ,https://blog.naver.com/wella5442?Redirect=Log&logNo=220236816342,진우네가 맛이 없다는 말은 아니에요~ 암튼 이날은 국수거리 안쪽으로 쭉 들어와 보이는옛날진미국수 를 들렀어요. 담양국수거리 입구 푯말엔 국수거리에 있는 모든 국수집들의 이름이 나와 있네요. 그 중... ,은가루's 지구별 적응기,https://blog.naver.com/wella5442,2015-01-11
담양맛집 :: 담양국수거리옛날 진미국수 ,https://blog.naver.com/s2astar?Redirect=Log&logNo=220764086413,담양 맛집 ｜ 담양 국수거리옛날 진미국수｜ 담양은 국수로도 유명해요! 국수거리가 따로 있을... 먹는내내 씁씁 거리면서 둘이 먹었지 뭐에요ㅋㅋㅋㅋㅋㅋㅋㅋㅋㅋㅋㅋㅋㅋㅋ 용가리들인줄 옛날엔 매운... ,별바다이야기,https://blog.naver.com/s2astar,2016-07-17
(담양 국수거리-백종원의 3대 천왕)옛날 진미국수 ,https://blog.naver.com/ailine?Redirect=Log&logNo=220604802669,"* (담양 국수거리-백종원의 3대 천왕)옛날 진미국수* 1. 위치 : 2. 주문 : 멸치국물국수 4,000원 열무비빔국수 4,000원 한방약계란 3개 1,000원 3. 장점 -푸짐한 양 -중면을 사용해서 씹는 맛이 있다 -진한 멸치 육수의... ",WooYa Sister's sweet teatime,https://blog.naver.com/ailine,2016-01-21
"1박2일 여행, 메타프로방스에서 저녁은 국수! - 담양 옛날진미국수 ",https://blog.naver.com/adoreyou_31?Redirect=Log&logNo=221425865195,"[국내여행] 담양 1박2일 여행, 메타프로방스에서 저녁은 국수! - 담양 옛날진미국수#열무비빔국수 #멸치국물국수 메타프로방스는 들릴 필요가 없었는데 원래 만두가 맛있다고 봤던 장소가 메타프로방스 안이라서... ",Just keep swimming,https://blog.naver.com/adoreyou_31,2018-12-24
"담양맛집,옛날진미국수 , 열무비빔국수, 파전, 한방약계란으로... ",https://blog.naver.com/ml1012?Redirect=Log&logNo=222459548796,유리알 남편의 포스팅 본 포스팅의 사진과 영상의 상업적 이용시 저작권 이슈가 발생합니다. 사진/영상 문의 : *****@*****.*** #담양 # 옛날진미국수#국수 #비빔국수 #파전 #한방약계란 #담양가볼만한곳 #담양맛집,유리알의 살아가는 이야기,https://blog.naver.com/ml1012,2021-08-06
삼대천왕옛날진미국수담양국수맛집 전남맛집 전라남도... ,https://blog.naver.com/sseo_oy?Redirect=Log&logNo=222533036651,"출현한옛날 진미국수 로 픽! 안심콜로 방문등록완료 및 발열체크 후 주문! 테이블에 붙은 번호로 주문후 선 결제하는방식이에요 저희는 해물파전,멸치국수, 그리고 씽이가 먹을 계란을 주문했어요 해물파전 9... ",욕심많은 어른이 꼬꼬댁의 키덜트/일상 Blog,https://blog.naver.com/sseo_oy,2021-10-10
[담양국수거리]옛날진미국수 /담양맛집/국수거리/죽녹원국수,https://blog.naver.com/eunbisunho?Redirect=Log&logNo=222473661972,강추!! #담양 #담양국수 #담양여행 #담양맛집 #담양 옛날진미국수# 옛날진미국수#국수 #담양국수거리 #광주에서담양 #담양가볼만한곳 #담양국수맛집 #담양핫플 #담양데이트 #담양대나무,도롱뇽이의 탐구생활,https://blog.naver.com/eunbisunho,2021-08-24
(담양맛집) 옛날진미국수 : 백종원의 3대천왕 출연맛집,https://blog.naver.com/koungs87?Redirect=Log&logNo=220848731036,"몇몇 국수집들 가운데 오늘의 목적지는 백종원의 3대천왕에 출연한옛날진미국수진미 가 아닌 다른 집도 손님들이 많더군요 하지만, 가게 입구 앞 대기줄이 있던옛날진미국수하악 앞서 걸어 도착하신... ",LA DOLCE VITA,https://blog.naver.com/koungs87,2016-10-29
담양국수거리 :옛날진미국수 ,https://blog.naver.com/u_chamsae?Redirect=Log&logNo=220695492014,그곳이 여기옛날진미국수 에요. 앉고나서 보니 백종원의 3대천왕에 나왔었대요!!!!! 방송에서 백종원... 진미국수뿐만 아니라 어느 집을 가도 국수! 딱 국수 맛@@ 이지 않을까...ㅎㅎ 저렴한 가격에 한끼 식사 하기... ,Daldaran 참새네,https://blog.naver.com/u_chamsae,2016-04-28
담양옛날 진미국수 /삼대천왕,https://blog.naver.com/4u4u4u4u?Redirect=Log&logNo=220664750492,담양옛날 진미국수담양여행에서 마지막날 국수거리로 향했습니다옛날 진미국수 는... 가게보다 진미국수만 손님들이 바글바글해요 너무 큰기대는 하지마시고 가볍게 국수 한그릇한다 생각하시고 방문하심... ,쏘쏘하루의 소중한 하루,https://blog.naver.com/4u4u4u4u,2016-03-25
담양 여행코스 (1) 담양 국수거리 -옛날진미국수 ,https://blog.naver.com/sonkr0427?Redirect=Log&logNo=220122085961,도 유명하던데 저희는 진미국수로 갔어여 길 왼쪽으로 국수집이 쫙- 있는데 저희는 진우네보다 진미국수가 더 맘에들어서.옛날 진미국수 의 메뉴 보이시나여 안보이신다면 젤 마지막사진 빌지를 보시길(친절)... ,리나블로그,https://blog.naver.com/sonkr0427,2014-09-15
담양 국수거리 /옛날 진미국수 에서 국수를 호로록 ♪,https://blog.naver.com/bar0404?Redirect=Log&logNo=220205751044,워매.. 매운그....♥ 제 입맛엔 다른 국수집 보다옛날 진미국수비빔국수가 더 매워요 매운거 못드시는 분들은 멸치국물 부어서 매운맛 조절해서 드시면 되세용 호로록호로록 담양 또 가고 시푸네용ㅜㅠㅠ,Drawing A To :D,https://blog.naver.com/bar0404,2014-12-10
담양 프로방스 맛집 3대천왕 국수집_ 옛날 진미국수 ,https://blog.naver.com/pjh715?Redirect=Log&logNo=220679811346,담양 프로방스 맛집 3대천왕 국수집 저렴하지만 개운한 멸치국수 국물 백종원 국수집옛날 진미국수담양 프로방스 내에 위치한 국수집옛날 진미국수 에 다녀온 후기에요. 백종원의 3대천왕 국수집이었다는데... ,딸기곰탱의 달콤한 일상~♬,https://blog.naver.com/pjh715,2016-04-11
[전남/담양] 국수거리맛집 담양옛날진미국수 ,https://blog.naver.com/dladmsdp?Redirect=Log&logNo=222445427614,별점 : ☆☆☆ (내돈내산 제 주관적인 견해입니다.) 전남 담양군 담양읍 객사3길 26 매일 10:30 - 19:00 수요일 휴무 #담양 # 옛날진미국수#담영국수 #담양국수거리 #국수맛집 #백종원맛집 #전남맛집 #식도락여행... ,오리꿀꿀,https://blog.naver.com/dladmsdp,2021-07-25
"[담양/맛집]죽녹원맛집, 옛날진미국수 ,백종원3대천왕",https://blog.naver.com/happy8134?Redirect=Log&logNo=220686967720,담양에는 국수거리 라고 있더라구요~ 거기에 위치한옛날진미국수입니다. 메뉴는 아주 간단하죠?... 먹거든요~ 진미국수도 마찬가지로 맛있다고 먹네요~^^ 비빔보다 자기는 국물국수가 맛있다고 합니다. 결론은... ,까칠한 쏭쏭나라~,https://blog.naver.com/happy8134,2016-04-20
"[담양맛집,국수거리,3대천왕,백종원] 옛날진미국수 ",https://blog.naver.com/jjang8079?Redirect=Log&logNo=220701577560,"지난 월요일에 담양에 놀러갔다가 백종원의 3대천왕에 나왔다던옛날진미국수 집에 가보았다..ㅎ 우리는 멸치국수,비빔국수,파전, 한방약계란을 시켰다..ㅎㅎ 계란만 봐도 장사가 얼마나 잘되는지 알 수 있는... ",매일 영화같이♡,https://blog.naver.com/jjang8079,2016-05-05
맛집] 새벽식당과 백종원3대 천왕 담양옛날 진미국수 ,https://blog.naver.com/hope6sky?Redirect=Log&logNo=221134949933,[담양 메타프로방스 맛집] 새벽식당과 백종원3대 천왕 3대국수 담양옛날 진미국수메타프로방스점 담양 3대국수. 담양진미국수. 메타프로방스 진미국수 오늘 풀어낼 포스팅은 메타프로방스 내 있는 맛집입니다... ,꿈꾸는 진이,https://blog.naver.com/hope6sky,2017-11-07
[전남 담양] 3대 천왕에 나온옛날 진미 국수 ,https://blog.naver.com/cknrjh?Redirect=Log&logNo=220585819389," 옛날 진미 국수 집 이곳은 3대 천왕 국수 편에서 백종원 씨가 오셨던 곳이기도 합니다. 단출한 메뉴 따뜻한 멸치국물국수 맛보러 왔어요. 국물 7, 비빔 1 주문 그런데!!! 국물 1, 비빔 7개가 나옴ㅠㅠ 주문 잘못... ",♬ 세 아들맘 블로그 ♬,https://blog.naver.com/cknrjh,2016-01-02
담양여행/담양국수거리/진우네집국수/ 옛날진미국수 /메타프로방스,https://blog.naver.com/yeonjasss?Redirect=Log&logNo=220961713928,"먹으러 여행왔다면 추천, 한바퀴 쭉돌다 허기져서 프로방스 마을안에 있는옛날진미국수 ,에 들어갔다, 죽녹원 쪽 국수거리엔옛날진미국수 와 진우네집국수가 유명한데, 프로방스마을엔 두집 국수 분점이... ","noy daily,",https://blog.naver.com/yeonjasss,2017-03-22
담양 # 옛날진미국수 ,https://blog.naver.com/tjgus7347?Redirect=Log&logNo=222387700857,전 담양에 이 츄러스 먹으러 갑니다메타 프로방스에서옛날 진미국수입구 ' 옛날 진미국수 '는 많은 국수가게 중 백종원의 3대천왕 국수 편에 방영된 곳으로 여기서 많이들 드시나 봐요. 메스컴의 힘이란... ,맛집 여행과 그 일상,https://blog.naver.com/tjgus7347,2021-06-07
담양 국수거리 국수 맛집 파전 파는 곳 [옛날진미국수],https://blog.naver.com/kimsuin2124?Redirect=Log&logNo=222427535604,못먹고 와버려서 아쉬운 마음 다음에는 날이 선선해지면 오빠가 맛있다고 한 뚝방국수집으로 한번 다녀와봐야겠어요 ◡̈⃝ 담양옛날진미국수전남 담양군 담양읍 객사3길 26 (객사리211-5) 영업시간 10 : 30 ~ 19 : 00,인리썸 inlissom,https://blog.naver.com/kimsuin2124,2021-07-11
담양옛날 진미국수 ,https://blog.naver.com/kimseobin_?Redirect=Log&logNo=220729229792,그런데 백종원의 3대 천왕에옛날 진미국수 가 출현하면서 완전 상황이 바뀌었다. 바로 옆에 위치한 진우네 국수는 사람이 뜸해지고 진미국수는 사람들이 끊이질 않는다. 한 번의 방송으로 인해서 진우네국수와... ,짱어댁-국내산자포니카민물장어,https://blog.naver.com/kimseobin_,2016-06-06
"담양맛집,담양국수맛집)백종원3대천왕에 나온 담양옛날진미국수 ",https://blog.naver.com/ability0824?Redirect=Log&logNo=220799068114,쭈~욱 이어지는 국수가게들.. 거기에서 우리는옛날진미국수 집으로 향하였다. 이어진 길을 걸으니옛날진미국수 집이 보인다. 실내에서 먹을 수도 있고 야외에도 이렇게 먹을 수 있는 자리도 마련되어 있다.... ,마음껏 뛸 수 있는 울타리가 되어 줄게,https://blog.naver.com/ability0824,2016-08-29
담양 국수거리: 옛날진미국수백종원 3대천왕 나왔던 그집!... ,https://blog.naver.com/zz0507?Redirect=Log&logNo=220840845343,'진미국수' 방송은 못봤지만 괜히 가보고 싶은 마음에 목적지로 결정! 담양 국수거리는 국수집이 쫘악 있어요~ 그중에서 저흰옛날 진미국수 ! 그 옆쪽에 진우네국수도 유명하더라구요~ 고민하다가... ,혜야의 힐링스토리★,https://blog.naver.com/zz0507,2016-10-20
담양 국수거리 맛집 :옛날진미국수 ,https://blog.naver.com/ravvvit?Redirect=Log&logNo=222369488936,이번 여행은 야외식사가 정말 많은 듯 (행복) 우리가 선택한 국수집은옛날진미국수! 오빠가 미리 블로그 후기를 보고 방문하는 찐 맛집이다. 나름 빠른 점심이었는데도 불구하고 사람이 가득했다. 자리 없으면... ,A의 여행 블로그,https://blog.naver.com/ravvvit,2021-05-27
담양 죽녹원 국수거리/백종원3대천왕맛집/담양 옛날진미국수 에... ,https://blog.naver.com/spearmint1004?Redirect=Log&logNo=220775045593,네비게이션에 ' 옛날진미국수 '라고 치면 담양의 국수거리 인근으로 안내가 된답니다 그리고 도착하면... 정말 옛날 입맛을 기억나게 해주는 식당이 맞나 봐요 ^^ 파전도 비주얼부터 침샘 자극하는 열무비빔국수도... ,The World I live in,https://blog.naver.com/spearmint1004,2016-08-06
"담양 맛집, 국수거리의 진우네집국수와옛날진미국수 ",https://blog.naver.com/ihappy4080?Redirect=Log&logNo=220350368655,"담양 지역의 지인을 통한 제보를 듣고 오늘은 진우네집국수에서옛날진미국수 로 가기로 했습니다. 유명세는 진우네집이 높은데, 맛은옛날진미국수 가 낫다고 하네요.옛날진미국수 는 진우네집국수 옆... ",이유없이 행복하라!,https://blog.naver.com/ihappy4080,2015-05-05
[담양국수거리] 백종원 3대천왕(국수편)옛날진미국수 ,https://blog.naver.com/kjbs0205?Redirect=Log&logNo=222409883717,"#담양국수맛집 # 옛날진미국수담양에 자주 와서 먹는 음식의 8할은 갈비다. 가족과 함께 외식하러 와서 국수 먹을 일이 거의 없었는데, 오늘은 혼자라 가볍게 먹고 싶어 국수거리를 찾았다. 평일의 장점은 맛집... ",지금 이 순간,https://blog.naver.com/kjbs0205,2021-06-25
[담양 맛집] 옛날진미국수: 담양 국수거리 맛집 by 몽몽의 블로그,https://blog.naver.com/kizaki56?Redirect=Log&logNo=220498879159,"같네요옛날진미국수여기가 국수거리입니다. 전부다 국수 집들만 쫘르륵~ 6~7개 정도 모여 있는 것 같습니다. 옛날 국수파는 듯한 정겨움이 가득 ^^ 라인 따라 다 국수집 옆집도, 그 옆집도 전부 국수 집입니다... ",몽몽의 먹어야 사는 블로그,https://blog.naver.com/kizaki56,2015-10-05
담양 국수의 거리 [ 옛날진미국수 ],https://blog.naver.com/angelvo3ov?Redirect=Log&logNo=222456132918,가끔 국수가 땡길때 담양을 들려서 비빔국수 한사발 하는 이빈준애미에요 사실 저는 대나무 52년 전통만 가는데 오늘 영업을 안하고 닫힌 가게가 보이더라구여 흑 구래서 바로 옆에옛날진미국수 로 와보았다요... ,With two angels.,https://blog.naver.com/angelvo3ov,2021-08-04
(담양국수거리/파전맛집) ' 옛날진미국수 ',https://blog.naver.com/gksdbal96?Redirect=Log&logNo=222443903612,암튼 맛집이라고 해서 찾아간거였는데 맛은 그저 평범했고 솔직히 딱히 다른사람들한테 추천은 안해줄것같은 곳이였네요 #담양맛집 #담양죽녹원근처 #담양국수거리 #담양국수 # 옛날진미국수#내돈내산... ,윰미밍의 배부른 자취방,https://blog.naver.com/gksdbal96,2021-07-24
"담양 국수옛날진미국수 , 그리고 카페미각",https://blog.naver.com/seulb0ng_?Redirect=Log&logNo=222433726439,담양 국수옛날진미국수메뉴판 우리는 둘다 비빔국수!! 그리고 파전은 선택 아닌 필수임 ㅎㅎㅎ 나는 막걸리까지 한잔 마시고 싶어서 주문함. ㅎ 하하하하 !!!! 날씨가 좋으니께 막걸리가 진짜 꿀맛 그리고 담양... ,슬봉이네,https://blog.naver.com/seulb0ng_,2021-07-16
담양맛집 담양국수거리 죽녹원맛집옛날진미국수 ,https://blog.naver.com/shthdud001?Redirect=Log&logNo=220293284736,같은곳★ 국수 거리중에 가장 유명한 집은 진우네 국수집이지만 그곳보다는옛날진미국수 집을... 그리고 진우네 말고도 맛있는집은 많으니까 각자 취향에 맞는집을 찾아보세요!! 저는 진미국수♥,메리는 오늘도 메리합니다!,https://blog.naver.com/shthdud001,2015-03-07
"담양광주군산투어 / 비오는 첫날 : 담양죽녹원,옛날진미국수 ... ",https://blog.naver.com/zzirrrr?Redirect=Log&logNo=221081657750,멸치국수를 먹으러 갔다. 우리의 이번여행은 TV방영된 맛집 찾아가기 였다!옛날진미국수 가 삼대천왕에 나왔다고 해서 찾아갔는데 음 느낌히 쎄~~했다 저녁을 광주넘어가서 곱창을 먹을거라 비빔국수와 멸치국수... ,moon flow,https://blog.naver.com/zzirrrr,2017-08-25
삼대천왕 국수편 담양옛날 진미 국수담양 국수거리 국수 맛집,https://blog.naver.com/miran9503?Redirect=Log&logNo=220607412769,담양옛날 진미 국수:) 바로 요 방송!! 기억납니당 ㅋㅋㅋㅋㅋㅋ 국수 메뉴는 멸치국물국수 열무비빔국수 딱 두 종류! 가격 완전 착하죠? 메뉴판엔 없지만 파전도 있습니당 ㅋㅋㅋ 옛날 생각나는 추억의 밥상... ,마인드치과@,https://blog.naver.com/miran9503,2016-01-26
"[담양, 백종원, 3대 천왕, 국수골목]옛날 진미 국수 ",https://blog.naver.com/csy2006?Redirect=Log&logNo=220656018057,"특히 인기가 많은 진우네집국수, 원조대나무국수,옛날진미국수등 많은 맛집이 위치해 있답니다. 저도 여러 국수집을 돌면서 메뉴들을 먹어보고 즐기고 싶었지만, 저는 여행온게 아니지 않습니까. 일단 지도... ",용이의 일상,https://blog.naver.com/csy2006,2016-03-15
"2021.09.22 담양 당일치기: 죽녹원,옛날진미국수 ... ",https://blog.naver.com/nare9974?Redirect=Log&logNo=222516861650,"그거 경치 보면서 먹어줘야함옛날진미국수메뉴판 나 빼고 엄빠동생은 멸치국물국수, 난 열무비빔국수 가격도 뭐 저정도면 싸다고 생각했다 요즘 프렌차이즈들은 거의 7000원 넘던뎅,,, 아니 근데 다들... ",mavlog ◡̈,https://blog.naver.com/nare9974,2021-09-25
담양국수 거리진미국수 ,https://blog.naver.com/insun4223?Redirect=Log&logNo=222303891735,좌식으로 앉을 수 있는 자리가 5테이블정도 있는듯해요 한테이블만 손님이있고 날이따듯해서 그런지 야외에 앉는 손님들이 더 많았어요옛날 진미 국수메뉴판 이예요! 멸치국물국수 4000 열무비빔국수 5000... ,뿡로그,https://blog.naver.com/insun4223,2021-04-09
[짧굵여행] 담양 || 담양국수거리 |옛날진미국수| 미유과자점... ,https://blog.naver.com/queen619?Redirect=Log&logNo=222487726871,"설레했던 #담양국수거리 # 옛날진미국수#담양국수거리 엔 정말정말 많은 국수집이 있다 고르기 어려워서 담양에서 회사다니는 친구에게 물어봐서 ㅋㅋㅋㅋ진미국수로 PICK 했다 오빠는 #열무냉국수 (\6,000)... ","서 른 살, 직 장 인",https://blog.naver.com/queen619,2021-08-29
[맛집_담양]옛날진미국수_ 담양국수거리,https://blog.naver.com/leavegarden?Redirect=Log&logNo=90166987067,아마도 젤 유명한 집은 '진우네집 국수'인 거 같은데요. 가보시면 알겠지만 집 앞에 사람들이 죽~~~ 기다리고 있거든요. 우리 가족은 바로 옆집 ' 옛날 진미국수 '를 선택했는데... 이집도 기다리는 분이 많아... ,느긋느긋 사는 삶 _ 휴원,https://blog.naver.com/leavegarden,2013-03-06
담양 국수 거리옛날 진미 국수 ,https://blog.naver.com/aodalfk?Redirect=Log&logNo=222446662997, 옛날 진미 국수 를 방문 했습니다! 위치 공유 합니다! 주차는 국수거리 입구 전에 우측으로 내려가는 길이 있어요! 그쪽을 이용하시면 됩니다! 국수거리 입구 예요~! 나무 그늘 너무 좋아요ㅠㅠ 국수 거리의... ,"a moment in time,",https://blog.naver.com/aodalfk,2021-07-26
[담양맛집]' 옛날진미국수 ' 국수거리 맛집이네 !,https://blog.naver.com/lovetree13vn?Redirect=Log&logNo=222502515496, 진미국수 가 3대천왕에도 나오고 백종원도 먹고 갔다고해서 궁금해서 먹으러 가봤어요 ㅎㅎㅎ 이렇게 야외에서 자리잡고 먹을 수 있습니다국수 거리에 쭉 의자가 놓여있어서진미국수외에도 밖에서 먹을 수... ,미니멀리스트를 꿈꾸는 여행자,https://blog.naver.com/lovetree13vn,2021-09-11
"백종원 3대천왕 담양옛날진미국수,담양 댓잎찹쌀도너츠",https://blog.naver.com/kiyome24?Redirect=Log&logNo=220635671087,한곳인옛날 진미국수 입니다 :) 진미국수는 두곳인데 저는 프로방스점을 다녀왔어요 담양국수거리에 한곳이 더 있다고 하네요 다행히 겨울이라 줄은 서 있었지만 그렇게 오래 기다리진 않았어요 ^^ 저희앞에... ,지율이의 작은 부엌,https://blog.naver.com/kiyome24,2016-02-23
담양맛집담양 국수는 여기가 진짜- 옛날진미국수 ,https://blog.naver.com/kjkids?Redirect=Log&logNo=221280219985,#전남맛집#담양가볼만한곳#메타프로방스#메타프로방스맛집#백종원삼대천왕맛집#담양 국수 맛집#담양 진미국수어제 바람쐴겸 담양 프로방스 다녀왔어요 뭐 맛있는거 먹을까 했는데 동생이 밥은 별로고국수 나... ,달러구트의 꿈백화점,https://blog.naver.com/kjkids,2018-05-20
담양 메타프로방스 국수맛집 - 백종원의 3대천왕옛날 진미 국수 ,https://blog.naver.com/suni2054?Redirect=Log&logNo=220894713248,메타프로방스를 둘러보던 중 잘나간다고 소문난 국수집에서 점심해결!옛날 진미 국수소문대로 들어서자 북적북적 손님들 많고 알바생들 정신없고~~ 차림표가 간단한 곳은 뭔가 맛집 냄새가 난다! 몇가지... ,햄뽂는 그녀의 사생활,https://blog.naver.com/suni2054,2016-12-26
"[담양]옛날진미국수 , 가마골생태공원, 죽녹원 후문, 추월당 카페",https://blog.naver.com/wheewon1004?Redirect=Log&logNo=220746529954, 옛날진미국수마지막으로 배고파져서 국수거리에 있는 진미국수에 갔어요. 진우네국수보다 면이 얇았어요. 진우네랑 다른 맛인데 둘다 맛있었어요. 진미국수는 뭔가 양념이 진한 느낌이랄까 ~~ 굿굿!!,Wheewon! We won!!,https://blog.naver.com/wheewon1004,2016-06-26
