title,link,description,bloggername,bloggerlink,postdate
[담양 카페] 담양제과 대나무 케이크옛날진미국수 ,https://blog.naver.com/bluebuskr?Redirect=Log&logNo=222030926290,국수 거리에 있는 국숫집 모두 호불호가 있어 애당초 기대를 안 해서 그랬는지옛날진미국수국수 맛은 나쁘지 않았다. 그럭저럭 맛있게 먹은 정도. 지역마다 있는 국수 맛집에 비하면 좀 딸린다 싶었지만... ,블루버스로 떠나는 여행,https://blog.naver.com/bluebuskr,2020-07-16
"담양여행 필수코스, 죽녹원 앞 담양국수거리,옛날 진미국수 ",https://blog.naver.com/madeathome?Redirect=Log&logNo=222267782310,담양국수 거리에 수많은국수 집이 있지만 나는 고민없이진미국수 에 다녀옴. 믿고 가는 백종원 아저씨 픽 음식점. ㅋㅋㅋㅋㅋㅋㅋㅋㅋㅋㅋㅋㅋ 대체적으로 3대천왕프로그램에 나왔던 음식점과... ,여행으로 키우는 우리아이,https://blog.naver.com/madeathome,2021-03-07
담양 가볼만한곳 국수거리옛날 진미국수관방제림,https://blog.naver.com/boss7319?Redirect=Log&logNo=222334316058,유명한(?)옛날 진미국수 에서 먹기로했어요 백종원의 3대천왕에 나왔다는데 멸치국수가 유명한가 보더라구요. 예전에 먹었다는데 전 기억이안나요 ㅜㅜ 담양 진미국수 메뉴입니다 멸치국수. 열무비빔국수.... ,예니네° _ 여행의 모든것 : 먹고 보고 즐겨라,https://blog.naver.com/boss7319,2021-05-03
담양 국수거리옛날진미국수다녀왔어요,https://blog.naver.com/a994218?Redirect=Log&logNo=222481102588,분위기로 가신다면 추천드려요 솔직히 국수가 특별한 맛을 내는 음식이 아니잖아용ㅎ저는 담양 국수거리에 있는옛날진미국수가신다면 비빔국수를 추천할게요~ #담양국수거리 #담양진미국수 #담양 옛날진미국수 ,광주반하다,https://blog.naver.com/a994218,2021-08-23
담양 메타프로방스에 있는옛날진미국수 ,https://blog.naver.com/cknrjh?Redirect=Log&logNo=222539479626,식사했던 국수집을 찾아보았습니다. 새로운 건물들이 많이 들어서긴 했지만 딱 보니 알겠더군요. 주변 건물에 비해 허름해보이긴 하지만 여전히 자리하고 있으니 반가운 # 옛날진미국수벌써 6년이라는 시간이... ,♬ 세 아들맘 블로그 ♬,https://blog.naver.com/cknrjh,2021-10-17
담양 국수거리 맛집옛날진미국수 ,https://blog.naver.com/sachiko00?Redirect=Log&logNo=222490175144,맛집옛날진미국수 의 좌석은 요렇게 야외석입니다! 이곳 국수거리의 대부분 음식점들이 야외석이더라구요! 옛날에 진우국수라는 곳에 갔었는데 거기는 평상자리였던 것 같아요 ㅋㅋㅋ 주문한 음식들이 모두... ,늘 곁에 있어 잊고있던 행복들,https://blog.naver.com/sachiko00,2021-08-31
담양 국수거리 맛집옛날진미국수 ,https://blog.naver.com/regine99?Redirect=Log&logNo=222497005919,https://blog.naver.com/regine99/222495788752 #담양국수거리 #담양국수거리맛집 # 옛날진미국수#백종원3대천왕맛집 #백종원3대천왕국수 #멸치국수맛집 #담양맛집 #진미국수 #담양국수 #담양여행 #담양 옛날진미국수 ,내가 바라보는 세상..,https://blog.naver.com/regine99,2021-09-06
담양 국수거리옛날진미국수담양 가볼만한 곳 넘 만족스러워~!,https://blog.naver.com/chdhfdl0525?Redirect=Log&logNo=222346324959,국물도 시원하고~~옛날 진미국수멸치국수 막~~진하다~~이런느낌은 없지만 멸치맛이 느껴져요. 슴슴하니 괜찮았어요.(양념장 뺀 맛) 아들이랑 같이 먹었기에 양념장을 다 걷어내고 먹었어요. 국수를 다 먹고 그... ,요리하는 메구미짱(cook__megumi),https://blog.naver.com/chdhfdl0525,2021-05-11
"담양 국수거리 맛집 :옛날진미국수(멸치국물국수, 열무비빔국수)",https://blog.naver.com/squidance?Redirect=Log&logNo=222267290392,작은 골목을 따라 요렇게 많은 국수집들이 국수거리를 따라 옹기종기 모여있었고 왠지 가게들이 다 거기서 거기일 것 같아 우리는 입구쪽에 있는 곳에 아무데나 들어가기로 했다. ' 옛날 진미국수 '라는 곳이었고... ,16 33,https://blog.naver.com/squidance,2021-03-09
담양 국수거리옛날 진미국수너무 맛있었어요.,https://blog.naver.com/bow_land?Redirect=Log&logNo=222121612167,요즘 날씨가 너무 덥지도 않고 춥지도 않고 밖에서 식사하기 딱 좋은 날씨이긴 합니다.^^ 곳곳에는 이렇게 금연구역 표시와 냅킨이 보이고요~~ 저희는 담양 국수거리옛날 진미국수 에서 멸치 국물 국수... ,동우살롱 블로그,https://blog.naver.com/bow_land,2020-10-21
담양 국수거리옛날 진미국수 ,https://blog.naver.com/wella5442?Redirect=Log&logNo=222463087474,담양의 많은국수 집들 중 저는진미국수 를 가장 좋아하고 자주 가요. 3대천왕에 나오기 전부터도 자주 갔었죠. 죽녹원 옆 담양국수 거리에진미국수본점이 있음에도 거의 매번 메타프로방스에 있는진미국수 로... ,은가루's 지구별 적응기,https://blog.naver.com/wella5442,2021-08-09
"남도 여행기 | 담양커피농장,옛날진미국수 ",https://blog.naver.com/itsmeja?Redirect=Log&logNo=222007786731,"남도 여행기 (1) 담양 - 담양커피농장,옛날진미국수더 더워지기 전에 2박3일의 남도여행을 다녀왔다.... 커피의 꽃말. 당신의 아픔까지도 사랑해 가 맘에 와닿는다. 점심 먹으러 간 국수거리는 아래 포스팅에-",꿈이 담긴 꾸러미,https://blog.naver.com/itsmeja,2020-06-21
[담양 맛집] 죽녹원 근처 국수거리맛집옛날진미국수 ,https://blog.naver.com/fbgpfla9121?Redirect=Log&logNo=222526108091,가게인옛날진미국수내부에도 자리가 있지만 날좋은 가을날 밖에서 먹어야죠 요로케 길따라 쭈욱 여러 가게가 있는데 진미국수는 먼저 주문하고 자리에 앉아야해요ㅎㅎ 자리먼저 잡으면 아니됩니다ㅎㅎ 앉은... ,with 백호 백범이네,https://blog.naver.com/fbgpfla9121,2021-10-04
담양 메타프로방스 맛집옛날진미국수 ,https://blog.naver.com/csber2018?Redirect=Log&logNo=222448618159,비빔국수에 같이 나오는 국물이지 않나싶어요 제가 좋아하는 담양 메타프로방스 맛집옛날진미국수입니다 국물 맛도 너무 좋구요 양도 많고 면도 쫄깃하니 넘 좋습니다 ㅋㅋㅋㅋ 면이 뚝뚝 끊어진곳들 정말... ,검은별 블로그,https://blog.naver.com/csber2018,2021-07-28
"담양옛날진미국수백종원 3대천왕 맛집, 담양국수거리 맛집",https://blog.naver.com/top_ki?Redirect=Log&logNo=222344710191,"담양국수거리옛날진미국수식당 실내에서도 식사 가능하지만, 날씨가 너무 좋으니 야외 테이블에 자리했어요. 담양 국수거리 맛집옛날진미국수우리 부부가 주문한 음식은 멸치/열무비빔국수, 해물파전과... ",NANA'S PLAY LIST,https://blog.naver.com/top_ki,2021-05-10
분위기 좋은 담양 국수거리 -옛날진미국수 ,https://blog.naver.com/jrgift?Redirect=Log&logNo=222250096460,이렇게 담양 국수거리옛날진미국수후기인데요. 식사하고 카페로 가는길에 일전에 식사했던 뚝방국수가 보여서 반가워서 한 컷 남겼는데 두곳을 비교해보면 전체적인 뷰도 좋고 맛도 나쁘지 않았던... ,정사장 맛집&카 라이프,https://blog.naver.com/jrgift,2021-02-20
"[담양 국수거리 맛집]죽녹원 근처, 가성비 최고옛날 진미국수 ",https://blog.naver.com/sean1luv?Redirect=Log&logNo=222515398666,국수거리 중에서 가장 대장식당인옛날 진미국수 . 백종원 3대천왕? 암튼 티비에 나왔던 곳임... 주문하기 전 팁! 사람이 많기 때문에 일단 앞에 테라스 자리 먼저 잡는다. 그리고 주문 시에 테이블 번호를... ,Sweet Escape,https://blog.naver.com/sean1luv,2021-09-24
"▶담양 3대 미(味)친 맛집◀옛날진미국수 , 우리네국수... ",https://blog.naver.com/totoro122425?Redirect=Log&logNo=222034962396," 옛날 진미국수 는 앞서 소개한 국수거리에도 있는데, 지금 소개해 드리는 곳은 담양메타프로방스 내에 있는옛날 진미국수 랍니다. 이곳에서는 콩국수랑 열무국수를 먹었어요. 1박2일 담양여행에서 첫날 저녁... ",토토로의 세계여행,https://blog.naver.com/totoro122425,2020-07-19
[전남 담양]담양 국수거리... 옛날진미국수 ,https://blog.naver.com/rose0626?Redirect=Log&logNo=221940287162,그래서 국수거리를 쭈~욱 길따라 가면서 스캔을 했지만 역시 선택하는데 실패 ㅠㅡㅜ 잠시 방황의 시간을 보내고옛날진미국수 로 결정. 아직 점심먹기엔 이른 시간이라 한그릇만 주문하고 싶었지만.. 물국수와... ,마음이 걷고 발이 쓴다.,https://blog.naver.com/rose0626,2020-05-01
"[완도 - 청산도 7박 8일] D+9 :: 담양 국수거리,옛날 진미국수 ... ",https://blog.naver.com/masha_won?Redirect=Log&logNo=222422348004,"좋던옛날 진미국수 로 고고 멸치국수 1, 비빔국수 1, 약계란 4알 주문 국수 못 먹는? 안 먹는? 까시오땜에 부근 김밥집에서 김밥 한 줄 부랴부랴 사왔다 애미는 운전 안 할 꺼니께 아침부터 죽향막걸리 ㅋㅋㅋ... ",잉여라이프 :D,https://blog.naver.com/masha_won,2021-07-06
이른 봄의 담양 나들이(담양국수거리/ 옛날진미국수 ... ,https://blog.naver.com/2265312?Redirect=Log&logNo=222253839815,"담양을 갈 때는 늘 떡갈비를 먹었었는데, 이번에는 야외에서 봄날씨를 느끼고 싶어 국수거리로 갔다. 우리가 먹은 곳은옛날 진미 국수(백종원 3대천왕에 나온 곳이라고 한다.) 네비게이션에 ‘담양 국수 거리... ",프러글의 꿈꾸는 다락방,https://blog.naver.com/2265312,2021-02-23
담양국수거리옛날진미국수비빔 주문하면 멸치국물 서비스,https://blog.naver.com/ckwnru?Redirect=Log&logNo=222513628578,담양국수거리옛날진미국수비빔국수 주문하면 멸치국물 서비스 아.. 분명 배터지게 먹고 왔는데 몇시간이나 지났다고 배가 고프네요 하긴 오늘 나름 10000보를 걸었던 날입니다^^ 핸드폰 없이 몇시간을... ,32분 전,https://blog.naver.com/ckwnru,2021-09-23
"[담양여행] 멸치국수 끝판왕 -옛날진미국수 , 주차장 위치",https://blog.naver.com/dbrdptmf1?Redirect=Log&logNo=222509055747,"알아보니 담양이 국수도 유명했고, 딸도 국수를 좋아해서 간단하게 한 끼하고 자 담양 국수거리에 갔습니다. 간단하고 감칠맛 나는 한 끼 담양옛날진미국수주차장 위치 주차를 어디다 해두고 걸어가야 하나... ",넷이서 놀기,https://blog.naver.com/dbrdptmf1,2021-09-17
[담양 맛집] 담양국수거리 ' 옛날진미국수 ',https://blog.naver.com/xcvbsk?Redirect=Log&logNo=222501191361,먹기도 좋고 죽녹원 가시는 분들께는 추천드리고 싶은 곳이에요 국수 / 파전 메뉴로 간단하게 요기하실 분들은 다녀오세요 #죽녹원근처맛집 #죽녹원맛집 #담양국수거리 #담양맛집 # 옛날진미국수#객사3길맛집,모리네,https://blog.naver.com/xcvbsk,2021-09-10
[담양 국수거리 맛집]: 옛날 진미국수 (넘 맛!),https://blog.naver.com/dlqhgud0219?Redirect=Log&logNo=221953699263,담양 국수거리 맛집옛날 진미국수여러모로 가격도 완전 저렴하고 국수 양은 푸지고 넘 맛도 있어서 내스탈ㅠㅠㅋ 비빔국수도 참 맛났지만 여기는 멸치국수가 찐인듯ㅎㅎ 국물 한 입 먹어보면 전날 술... ,버녕의 리뷰다반사,https://blog.naver.com/dlqhgud0219,2020-05-09
담양여행-국수거리: 옛날진미국수 ,https://blog.naver.com/wchee2004?Redirect=Log&logNo=221736488264,진짜 맛있어 보이는 국수집이 아두 많았지만 우린 백종원 3대 천왕 국수편에 나왔던옛날 진미국수 로 선택했어요 옆 테이블 가족들이 국수 먹는 모습이 너무 예뻐서 한컷^^ 가을의 끝자락을 겨우 잡고 있던 이날... ,코너스톤의 여행꾸러미,https://blog.naver.com/wchee2004,2019-12-13
[담양맛집] 담양 국수의 거리옛날진미국수 ,https://blog.naver.com/s2seull?Redirect=Log&logNo=222520406671,"오늘은 가족들과 다녀온 #담양여행 중 들렀던 #담양국수의거리 # 옛날진미국수후기를 적어본다. 아침부터 우리 가족은 회의를 열었다. 점심으로 국수를 먹을 것이냐, 돼지갈비를 먹을 것이냐를 두고 한참... ",블기 슬로그,https://blog.naver.com/s2seull,2021-09-29
담양옛날 진미국수국수거리 맛집,https://blog.naver.com/mydoq?Redirect=Log&logNo=222076874923," 옛날 진미국수 는 백종원의 3대 천왕 국수 편에 등장을 했었습니다. 진미국수 메뉴는 멸치국물국수, 열무냉국수, 열무비빔국수 콩물국수, 파전, 한방약계란 등이 있답니다. 메뉴의 종류가 아주 단출한데요. 특히... ",희망세포,https://blog.naver.com/mydoq,2020-09-22
[담양]진미옛날국수| 영산강변 야외테이블에서 즐기는국수 ... ,https://blog.naver.com/itsmeja?Redirect=Log&logNo=222009055602,"마지막으로 나온 파전-. 겉바속촉. 더 놀라운건 이렇게 큰 파전이 8,000원. 사실옛날진미국수모든 메뉴가 저렴하다. 서울에도 강변에 이런 국수거리 하나 있으면 좋겠다. 내가 참 자주 갈텐데.",꿈이 담긴 꾸러미,https://blog.naver.com/itsmeja,2020-06-22
담양 국수의 거리옛날진미국수 ,https://blog.naver.com/joeunzz?Redirect=Log&logNo=222460585315,담양 국수의 거리에 위치한옛날진미국수 ! 국수의 거리 입구에서 조금 걸어가면 주차장이 보이는데 그쪽에 위치해있다:) 영업시간 매일 10:30 ~ 19:00 수요일 휴무 이렇게 야외에 테이블이 놓아져있어서 경치... ,되돌아보면 추억,https://blog.naver.com/joeunzz,2021-08-07
담양 국수거리 맛집옛날진미국수 ,https://blog.naver.com/sujung4895?Redirect=Log&logNo=222056506023,담양 국수거리 맛집옛날진미국수이제 장마는 끝이났나봐요~~ 여름이 더운날씨가 당연한건데 어색하네요..ㅋㅋㅋ 이런날 살얼음이 들어간 시원한 음식이 생각이나네요~ 오늘은 담양 맛집 2탄 포스팅을 할께요... ,♡ 쑤댕이네 오늘 더 사랑해 ♡,https://blog.naver.com/sujung4895,2020-08-13
"2일차, 담양 -옛날진미국수 , 죽녹원, 메타세쿼이아 가로수길... ",https://blog.naver.com/wjdwlghd2003?Redirect=Log&logNo=222500145674,진우네국수랑옛날진미국수 가 엄청 유명하고 맛있다는데 둘이 바로 옆집이라 어디갈지 고민했다. 휘수가 진우네국수 가봤는데 맛있었다고 해서 거기로 가려다가옛날진미국수 는 안 가봤다고도하고 백종원... ,작은 동네 슈퍼 아들의 넓고 좁은 세상 탐험기,https://blog.naver.com/wjdwlghd2003,2021-09-09
"[담양 맛집] 백종원 3대천왕 맛집, 담양국수거리옛날진미국수 ",https://blog.naver.com/2_sso?Redirect=Log&logNo=222469709959,담양국수거리 방문하신분들 어디갈지 고민이라면 진미국수 추천해요~.~ 개인적으로 비빔국수랑 파전이 제일 굳. 담양국수거리옛날진미국수 는 수요일 휴무고 매일 10:30~19:00라고 나와있네요! 찍은 시간 보니 6시... ,리쏘의 리뷰세상,https://blog.naver.com/2_sso,2021-08-14
[ 담양 국수거리 맛집 ]옛날진미국수 ,https://blog.naver.com/shinee823?Redirect=Log&logNo=222474608852,세명이서 먹는데도 양이 부족하지도 않고 배부르게 먹고 왔어요 잘 먹었습니다♀️ #내돈내산 #담양국수거리 #담양국수거리맛집 #담양국수거리 옛날진미국수# 옛날진미국수#담양 옛날진미국수#국수거리옛날진... ,빛나는 일상 냠냠,https://blog.naver.com/shinee823,2021-08-18
담양 국수거리 ' 옛날진미국수 ' 너무 기대했나?,https://blog.naver.com/shyguri?Redirect=Log&logNo=222368133069,담양 국수거리 ' 옛날진미국수 ' 너무 기대했나? 안녕하세요? octtwo3입니다. 지난달에 다녀온 담양여행... 어디로 들어갈까 고민하다가 인스타그램에 진미국수를 여러 번 봐서 진미국수로 들어갔어요. 방바닥에... ,Hot lips,https://blog.naver.com/shyguri,2021-05-26
[담양 메타프로방스 맛집]옛날 진미국수먹고왔어요:),https://blog.naver.com/xuxis2?Redirect=Log&logNo=222523086454, 옛날 진미국수 를 소개해드릴게욤! 위치: 전남 담양군 담양읍 메타프로방스2길 6-15 죽녹원 앞에 국수 거리에도 있는!! 진미국수!! 메타프로방스에도 있길레 찾아가봤어욤!ㅎ 들어서자마자ㅋㅋ 아.. 진짜 옛날 갬성... ,히히히히히힣,https://blog.naver.com/xuxis2,2021-10-01
[전남/담양] 담양 국수거리 맛집옛날진미국수 ,https://blog.naver.com/shim_suri?Redirect=Log&logNo=222512364424,여러분 심술이예요:) 담양 몽에뚜와르 카페 갔다가 점심 먹으러 다녀온옛날진미국수리뷰 할게요 3대천왕에 나오기 전부터 맛집 이었던옛날진미국수2021.4.24 토요일 사실 담양하면 국수거리보다는 떡갈비... ,❤심술이의블로그❤,https://blog.naver.com/shim_suri,2021-09-22
담양 국수거리 맛집 ' 옛날진미국수 ',https://blog.naver.com/saqe7007?Redirect=Log&logNo=222472479814,담양 국수거리옛날진미국수음식 자리잡고 기다리면 파전이 먼저 나왔다 파전은 생각보다 두꺼웠는데 바삭해서 맛있었다 오징어도 꽤 들어있고 간도 잘되어있어서 국수랑 먹기 딱 좋았다! 그리고 나온... ,flower B,https://blog.naver.com/saqe7007,2021-08-16
담양 국수거리 맛집옛날진미국수찾았다 정착할 곳 :D/,https://blog.naver.com/inho1914?Redirect=Log&logNo=222412168874,"솔직히 파는 곳에서 파전 시켜먹으면 다 맛있긴 하지만 부실하거나 맛이 별로인 곳도 있는데, 담양 국수거리 맛집옛날진미국수파전은 맛있었어요. 국수 나올때까지 끊임없이 먹어주기 ㅋㅋㅋㅋ. 다 먹기 전에... ",백부엉이 일상 블로그⊙♡⊙,https://blog.naver.com/inho1914,2021-06-27
담양맛집국수 좋아해?_담양국수거리 맛집_ 옛날진미국수 ,https://blog.naver.com/yeougomgongjagso?Redirect=Log&logNo=222504417099,장날이더라구요 옛시장 구경 재미지더라구요 ^^ 늘 행복하기로 해요. 이상 여우곰공작소의 여우곰이었습니다. #여우곰 #여우곰공작소 #여우곰추천맛집 #담양맛집 #담양국수맛집 #담양여행맛집 # 옛날진미국수 ,yeougomgongjagso님의블로그,https://blog.naver.com/yeougomgongjagso,2021-09-13
(담양맛집) 관방제림 국수거리에 찐국수맛집 ' 옛날진미국수 ',https://blog.naver.com/aotks3?Redirect=Log&logNo=222518116266,담양에 국수 먹으러 다녀왔어요 :) 담양 관방제림 옆 국수거리에 위치한 ' 옛날 진미국수 ' 관방제림... 가게 외관/ 사실 국수가게가 정말 많지만 담양에 방문할 때마다 진미국수집만 방문한답니다..ㅎㅎ (새로운... ,아토랑 하키로그:),https://blog.naver.com/aotks3,2021-09-27
"담양옛날진미국수: 담양 국수거리, 백종원의 3대천왕",https://blog.naver.com/j_yun93?Redirect=Log&logNo=222052047715,"담양옛날진미국수: 담양 국수거리, 백종원의 3대천왕 담양에 떡갈비가 유명한건 알고있었지만 국수가 유명한건 이번에 여행하면서 처음 알게된 사실! 심지어 국수거리라니...? 그래서 담양국수거리에서... ",윤쿠잉의 스윗메모리,https://blog.naver.com/j_yun93,2020-08-05
담양 국수거리 맛집_ 옛날진미국수 ,https://blog.naver.com/styu1029?Redirect=Log&logNo=222530006435,담양국수거리_ 옛날진미국수전남 담양군 담양읍 객사3길26. 영업시간 10:30~19:00. 수요일휴무. 담양 국수거리에 많은 국수집이 있었지만 그중에서도 백종원의 3대천왕에 나왔던옛날진미국수 에 방문했습니다.... ,제이,https://blog.naver.com/styu1029,2021-10-07
"호로록 열무비빔국수와 파전, 담양옛날 진미국수 ",https://blog.naver.com/chunsaseng?Redirect=Log&logNo=222109662372,"한 여름날의 국수 한 그릇. 담양옛날 진미국수올해 여름은 유난히도 비가 많이 왔다. 이번 여름은... #담양진미국수 코로나19가 조금은 잠잠했던 어느 초여름, 물개가 되고 싶은 물고기들이 모여 담양 리조트로... ",요둘리의 Record Life:),https://blog.naver.com/chunsaseng,2020-10-07
담양 메타프로방스 맛집옛날진미국수 ,https://blog.naver.com/teammac?Redirect=Log&logNo=221832006464,멸치국수는 이집도 정말 맛있는거 같아요 하지만 정말 조금 다른 맛의 진우네랑 차이는 분명한데 솔직히 둘다 맛있어요~:) 이게 대박인데 진우네는 비빔국수만 하는데옛날진미국수 는 열무비빔국수를 해요~ 이건... ,싸로횽아 ~ ♡,https://blog.naver.com/teammac,2020-03-01
[2021.08.08] 담양_ 옛날진미국수 ,https://blog.naver.com/lucy610?Redirect=Log&logNo=222463193919,미리 안먹고 국수와함께 먹으며 짠맛을 약간 중화(?)시키면 맛있을 듯 싶다 자극적 맵짠이 땡길때는 딱 좋을 듯 싶다 #메타세쿼이아가로수길식당#담양국수집#담양비빔국수#담양 옛날진미국수 # 옛날진미국수 ,Lucy의 쉼,https://blog.naver.com/lucy610,2021-08-09
"전남담양 국수거리옛날진미국수파전, 열무비빔 먹고 영산강... ",https://blog.naver.com/spxl1010?Redirect=Log&logNo=222516728106,"도착해서 보니,옛날진미국수 는 백종원의 3대천왕 국수편에 나온곳이더라구요 ㅎㅎ 아 그래서 사람이... 기억으로 옛날에왔을땐, 평상이였다고 하는데 지금은 다 테이블로 바꼈나봅니다 간식이지만 파전은... ",노는게 젤좋아 :-),https://blog.naver.com/spxl1010,2021-09-25
메타프로방스 국수 찐맛집! 담양옛날진미국수+ 디저트까지,https://blog.naver.com/irian1?Redirect=Log&logNo=222514703832,쫀득하니 따땃할 때 먹으니 꿀맛 음료는 음 옛날 문구사 슬러시 맛인데 달달달달x10이라 호불호 갈릴... 메타프로방스국수 #담양 옛날진미국수# 옛날진미국수#스트릿츄러스 #담양호떡당 #관방제림,감성준 일기장,https://blog.naver.com/irian1,2021-09-23
"2021.10.11 담양메타세콰이어,담양밀밀, 옛날진미국수 ",https://blog.naver.com/s2seulgi?Redirect=Log&logNo=222537179477,나만만날 빠져있어ㅠㅠㅠㅠ 애미 지분 투척 이제 다 보았으니 메타세콰이어 안에 국수 흡입하러 갑니다옛날진미국수국수두개 비빔국수 두개 양념장을 빼달라고 하세여 저흰 까묵고 ㅠㅠ 겉어서 먹었ㅈㅣ만... ,MY Life LoG,https://blog.naver.com/s2seulgi,2021-10-14
담양 국수거리 맛집옛날진미국수 .,https://blog.naver.com/jamji1999?Redirect=Log&logNo=222291187888,ㅎㅎㅎ 담양 가시면 죽녹원 들어가기전에 꼭 한번 들러보시길.... #담양국수거리 #담양여행 #담양맛집 #담양국수거리맛집 #담양엿날진미국수 # 옛날진미국수#담양알빙 #담양캠핑카여행,괴산고추농산,https://blog.naver.com/jamji1999,2021-03-29
"담양 당일치기 여행 국수거리옛날진미국수 , 관방제림, 죽녹원... ",https://blog.naver.com/outofgear?Redirect=Log&logNo=222526129454,"담양 당일치기 여행 국수거리옛날진미국수 , 관방제림, 죽녹원, 이이남아트센터, 카페 밀, 메타프로방스 오랜만에 여디니와 떠나는 당일치기 여행 ㅎㅎㅎㅎ 정~~말 옛날에 가보고 안가본 담양을 당일치기로... ",먹방다반사,https://blog.naver.com/outofgear,2021-10-04
담양카페 옥담 담양옛날진미국수담양나들이,https://blog.naver.com/sinabrogod?Redirect=Log&logNo=222510230507,#담양카페 #카페옥담 #담양국수 #담양 옛날진미국수#진미국수 오늘은 오랜만에 담양에 다녀왔어요 ㅋㅋ 옥담은 예전에 오픈하고 얼마 안되서 한번 가보고 오랜만에 다시 가봤어요~ 오후에 갔는데도 사람 진짜... ,호두마루맘의 일상일기,https://blog.naver.com/sinabrogod,2021-09-18
담양 국수거리옛날진미국수뷰맛집 담양 관방제림맛집... ,https://blog.naver.com/phs7063?Redirect=Log&logNo=222518830574,블로그에서 찾아놨던 맛집 진미국수로 향했어요!옛날진미국수매주 10:30 ~ 19:00 수요일휴무 국수거리에 쭉 늘어져있는 많은 국수집을 제치고!옛날진미국수 에서 자리를 잡았답니다. 담양국수거리맛집... ,글로벌렌탈서비스기업 킴샵,https://blog.naver.com/phs7063,2021-09-27
담양 맛집 :옛날 진미국수국수중에 진! 이네요~,https://blog.naver.com/candyna?Redirect=Log&logNo=222396256338,"관방천 국수 중에 최고 진옛날진미국수 에서 멸치국물국수, 열무비빔국수, 계란 주문했어요. 비쥬얼... 진미국수 물국수는 중면이라 그냥 봐서는 딱히 맛있어 보이지 않는데 , 막상 먹으면 젓가락이 멈추질... ",낯선 적요 속으로,https://blog.naver.com/candyna,2021-06-13
