title,link,description,bloggername,bloggerlink,postdate
담양국수거리# 옛날진미국수 _담양가면 들려야죠™,https://blog.naver.com/hjinland?Redirect=Log&logNo=221754553731,"◎옛날진미국수국수 거리가시면 여러 곳이 있는데, 백종원 선생이 다녀가고 방송을 탔다하여 유명한 곳이 있습니다.옛날진미국수집인데요. 실내외가 있는데요. 겨울에는 실내로 들어가시면 됩니다.... ",Project Manager,https://blog.naver.com/hjinland,2019-12-30
"하면 생각나는 담양국수, 담양 메타프로방스 맛집,옛날 진미국수 ",https://blog.naver.com/ddegurrr?Redirect=Log&logNo=222526191977,저녁 선선할때 산책 겸 담양메타프로방스 갔다가 배고파서 국수나 한그릇 하자 하고 들어간옛날 진미국수오늘의 맛포스팅 들어갑니다 :) 일단 메뉴는 국수종류로 간단하구요 가격보고 너무 저렴해서... ,"함평카페, 다함",https://blog.naver.com/ddegurrr,2021-10-04
"담양 카페림, 쌍교숯불갈비, 낼름,옛날진미국수 ",https://blog.naver.com/pink1915?Redirect=Log&logNo=222467172405,"먹고싶다옛날 진미 국수담양에 3개의 음식거리가 있다고 한다 떡갈비거리, 국밥거리, 국수거리 배가... 곳은 진미옛날국수다 여기는 노상에서 먹는게 국룰 노상에서 보이는 풍경 역시 빠르다 사진 좀 찍으니... ",LIFE FINDER,https://blog.naver.com/pink1915,2021-08-12
담양읍 맛집 국수거리옛날진미국수푸짐해요,https://blog.naver.com/rukarian_?Redirect=Log&logNo=222524207942,많아요 #담양읍맛집 #담양 옛날진미국수#담양진미국수 #담양국수거리 # 옛날진미국수#진미국수 이곳은 담양읍 맛집 중에서 맛있는 국수 맛집이 많은 담양 국수거리랍니다 ㅎ 골라 먹는 재미가 있는 곳이기도... ,봄삐의 놀고 먹는 일상 이야기,https://blog.naver.com/rukarian_,2021-10-02
메타세콰이어길/옛날진미국수 / 나무펜션 / 옥담카페,https://blog.naver.com/jieun2197?Redirect=Log&logNo=222530755131,담양맛집 # 옛날진미국수#담양포토존 #담양메타세콰이어길 #메타세콰이어 #담양프로방스 #프로방스마을 #담양여행지 #진미국수 #담양여행코스 #태교여행 #국내여행 #여행지추천 #1박2일여행지추천 #담양나무펜션... ,깨롱댁의 일상,https://blog.naver.com/jieun2197,2021-10-08
[전남맛집 담양맛집] 옛날진미국수 ,https://blog.naver.com/gkakgkak123?Redirect=Log&logNo=221712591981, 옛날진미국수촐촐한 저녁시간 뭐먹지 하고 찾아간 진미국수집 여기는 경치가 너무 좋아 야외에서 먹었습니다 가을바람 솔솔 불고 맛있는 국수 한그릇 먹으러 가볼까요^^ 멸치국물국수 열무비빔국수 파전... ,눈웃음걸~^.~,https://blog.naver.com/gkakgkak123,2019-11-19
담양 죽녹원 |옛날 진미국수후기,https://blog.naver.com/hsu1206?Redirect=Log&logNo=222450332532,"☔️ 비 오는 날의 죽녹원 그리고옛날 진미국수2021.03~4월 경 다녀온 담양 죽녹원 후기 아마 바다랑... 담양의 맛집옛날 진미국수! 멸치, 비빔, 그리고 파전을 시켰다. 바다가 운전만 안했어도 같이 막걸리 한 잔... ",당무로그,https://blog.naver.com/hsu1206,2021-07-30
담양 맛집) 담양 국수거리는 한국의 클락키?옛날진미국수맛있음,https://blog.naver.com/ngpretty84?Redirect=Log&logNo=222512131598,소표 국수 = 맛있는 거 ㅇㅇ # 옛날진미국수자리잡고 주문. #멸치물국수 #비빔국수 #계란 껍질까서 맛보니 구운계란맛임. 한방 어쩌고로 삶는다고 하던데 그게 그거임. 비빔국수와 먹으니 ㅋㅋ 마씨쪙 국수는... ,내돈내산 찐후기!,https://blog.naver.com/ngpretty84,2021-09-22
담양여행한다면 꼭가야할 담양국수거리 :옛날진미국수 ... ,https://blog.naver.com/pjsool?Redirect=Log&logNo=222516844998,옛날에 장범준이 가족들과 추억여행으로 오기도 했던곳!! 특히 광주나 전남 사람들은 한번은 가보셨을테니 가슴속 깊은 한곳의 추억의 장소기도 하겠네요ㅎㅎㅎ옛날 진미 국수 !! 국수거리에서도 많은 가게가... ,인싸를 꿈꾸는 방구석 ESFP,https://blog.naver.com/pjsool,2021-09-25
담양 맛집옛날진미국수백종원의 삼대천왕 추천 맛집,https://blog.naver.com/wlguslekt711?Redirect=Log&logNo=221019690706,"ㅋㅋ 이상, 백종원도 인정한 맛집 담양 맛집옛날진미국수 를 다녀온 날샘이었습니다♥ ★. 담양 국수거리옛날진미국수위치 (메타프로방스점과 위치가 다르니 참고해주세요~!)",OHLALA Candle&Soap,https://blog.naver.com/wlguslekt711,2017-06-01
담양 국수거리옛날진미국수백종원 다녀간 그곳!,https://blog.naver.com/windylove9?Redirect=Log&logNo=220951662513,유난히 손님이 바글바글한 두집이 있네요 진우네라는곳과옛날진미국수라는곳 사람은 진우네가 더 많이 대기하던데 우리는 백종원3대천왕 나왔던 진미국수로 쵸이스 대기하지 않고 바로 앉았어요 맛보기전... ,독재자네 찌지고뽀꼬 일상's 다반사,https://blog.naver.com/windylove9,2017-03-06
담양국수거리/ 옛날진미국수대나무평상에서국수한그릇!,https://blog.naver.com/314hjso?Redirect=Log&logNo=220096298431,",옛날진미국수메뉴! 이군은 콩국수를주문했고 저는 열무비빈국수를주문! 약계란이라는것도 주문했어요 3개 천원! 한방약계란이 나왓네요~~~ 완전뜨거!! 어디있다왓는지 손딜뻔...ㅋㅋㅋ 뜨끈한... ",냠냠하욘님,https://blog.naver.com/314hjso,2014-08-19
백종원 3대천왕의 담양 맛집옛날진미국수 ,https://blog.naver.com/croxriver?Redirect=Log&logNo=220602024032," 옛날진미국수지난 주말 담양에 갔다가 우연히 백종원의 3대천왕 국수편에 출연한옛날진미국수 에 가게 되었습니다. 본점은 담양 국수거리에 위치하고 있으나, 메타프로방스에 분점이 있더라구요. 분점이라... ",Amazing Days,https://blog.naver.com/croxriver,2016-01-19
[담양맛집] 한상 죽녹원맛집 백종원3대천왕옛날진미국수 ,https://blog.naver.com/princesshje?Redirect=Log&logNo=220810890014,담양맛집 / 숯불고추장불고기 / 수제왕돈까스 / 죽녹원맛집 / 국수거리 /옛날진미국수/ 백종원3대천왕 담양까지 갔는데 비가 추적추적.... 그래도 다닐거 다니고 먹을거 다 먹고 다녔네요 ㅋㅋ 담양맛집 한상... ,매력이의 소소한 이야기,https://blog.naver.com/princesshje,2016-09-12
담양] 백종원의 3대천왕옛날진미국수 ,https://blog.naver.com/1601mhs?Redirect=Log&logNo=220797729939,"들렀던옛날진미국수 .. 백종원의 3대천왕에 나오기전에도, 이곳은 옆집과 더불어 꽤 유명한 곳이였어요. 가격이 예전엔 진짜진짜 저렴했거든요~ 저 길위에 평상에서 국수를 먹어요. 더워도 이곳에서 먹어줘야... ",자연과 친한 아이 ...ing,https://blog.naver.com/1601mhs,2016-08-27
담양국수거리 _옛날진미국수 ,https://blog.naver.com/wkgus333?Redirect=Log&logNo=220726811616,"담양여행/담양나들이/담양국수거리옛날진미국수죽녹원 근처에 있는 '담양국수거리'에요. 담양여행에 빠질 수 없는 코스라도들 하더라구요. 국수가게가 모여있고, 가게 맞은편에 준비되어 있는 평상에 앉아서... ",+ 오복이 공간 +,https://blog.naver.com/wkgus333,2016-06-12
담양 국수거리 3대천왕 맛집옛날진미국수 ,https://blog.naver.com/rira8989?Redirect=Log&logNo=221381673780,있는 진미국수에서 사람들이 파전이랑 국수 먹는거 보고 바로 담양 국수거리로 고고!! 똑같은옛날진미국수 이지만 뭔가 본점 국수거리에서 더 먹고싶었음 ㅋㅋ 그리고 거리도 가깝고 옛날에 담양... ,리라리:)언제나 변함없이,https://blog.naver.com/rira8989,2018-10-23
담양 국수거리 진미국수/삼대천왕에 나온옛날진미국수맛보다!,https://blog.naver.com/yk0741?Redirect=Log&logNo=220755099654,"딱히 먹지않은듯,, 맛에대한 기억이 없네요 ㅎㅎ 국수한그릇에 4,000원 이정도 양에 반찬까지 기대할순 없죠~ 사진상으로는 정말 매워보이는 담양 진미국수 이지만 그닥 맵지는 않았어요~ 담양옛날 진미국수 ... ",메이킹속눈썹,https://blog.naver.com/yk0741,2016-07-06
담양 메타프로방스 @ 옛날진미국수백종원3대천왕 국수편에도... ,https://blog.naver.com/jgs51004?Redirect=Log&logNo=220657554391,담양메타프로방스국수집은옛날진미국수 집!이라는 뜻일까요?ㅎ기본 세팅 반찬인데 김치는 살짝 많이 익었구 단무지는 새콤달콤 진미국수의 멸치국수 나왔어요!(4천원)국물시원하고 면이 쫄깃쫄깃달달한 맛이... ,정 그리고 감사,https://blog.naver.com/jgs51004,2016-03-17
[전라도]담양 죽녹원 국수거리 맛집 백종원3대천왕옛날진미국수 ,https://blog.naver.com/kejej0409?Redirect=Log&logNo=220711854256,백종원3대천왕 진미국수 담양 죽녹원 도착하자 마자 담양국수거리 부터 방문 # 담양국수거리에 국수집이 여러 곳 있는데 그 중 저희는 백종원의 3대천왕에 소개된옛날진미국수집으로 :) 국수거리를 따라 쭈욱... ,꽃 이 되 자 ♥,https://blog.naver.com/kejej0409,2016-05-18
원조 50년 전통 진우네국수 vs. 백종원의 삼대천왕옛날진미국수 ,https://blog.naver.com/dr_deneb?Redirect=Log&logNo=221255393953,"'진우네집국수' 바로 옆 ' 옛날진미국수 ' 이미 국수를 한 그릇씩 해치웠는데,전~혀 배가 부르지 않았다. 양이 실제로 보면 그러하다. 서로 메뉴를 바꿔가며, 노나먹으며,두 곳 '비교'하는 재미도 쏠쏠할 듯. 그래서... ","수고했어, 오늘도 :)",https://blog.naver.com/dr_deneb,2018-04-24
담양 메타프로방스 맛집옛날 진미 국수 ,https://blog.naver.com/lbllove?Redirect=Log&logNo=221471551029,그리고옛날 진미 국수 !! 나는 매콤한 열무비빔국수 잘익은 열무김치가 올라간 매콤달콤한 비빔국수 푸짐한데 다 먹기 가능했던 임산부 엄마아빠는 따뜻한 국수 채소도 푸짐히 들어있고 국물맛도 좋았다는... ,일상1025/터전황토,https://blog.naver.com/lbllove,2019-02-21
"[전라남도 담양] 객사리,옛날 진미 국수:)",https://blog.naver.com/hhongg2?Redirect=Log&logNo=221110373738,식사하러^^ #담양국수거리 #담양 옛날진미국수# 옛날진미국수#담양국수 우린 쿨쿨이랑 같이 있어서 내부로 ~ㅋㅋㅋㅋ 유모차는 못들어가서 앞쪽에 세우고 감^^ 앞쪽엔 이렇게 평상이 쫘라락~ 앞쪽 평상에서... ,H O_N G :),https://blog.naver.com/hhongg2,2017-10-03
담양맛집옛날진미국수 를 다녀왔습니다.,https://blog.naver.com/docde?Redirect=Log&logNo=221110260396," 옛날진미국수 에서는 계란, 파전, 콩물국수, 비빔국수, 멸치국수 이렇게 다섯 가지 메뉴만 있어요!! 원래 담양국수거리에서 먹었던 메뉴 그대로이네요!! 15분 이상 기다려서 받은 멸치국수 국물이 투명하고... ",찬울아범 블로그,https://blog.naver.com/docde,2017-10-04
담양맛집) 국수거리옛날진미국수/ 백종원의 3대천왕... ,https://blog.naver.com/bbyool89?Redirect=Log&logNo=220701526709,뵬몬의 소소한 일상스토리:D백종원의3대천왕 담양국수맛집추천국수거리옛날진미국수이웃님들 드디어 기다리고 기다렸던 황금연휴가 왔어요ㅋㅋㅋㅋㅋㅋ오늘부터 여행 떠나시는 이웃님들도 계실꺼같네요... ,뵬몬의 소소한 일상스토리 :D,https://blog.naver.com/bbyool89,2016-05-04
담양 구수거리/담양옛날진미국수 /담양 먹거리/죽녹원 국수,https://blog.naver.com/lllsg0426?Redirect=Log&logNo=220427274632,선택 @담양옛날진미국수(061-382-0984) @메뉴 멸치국물국수 먹으려다가 날 더우니 열무비빔국수 2개 주문 한방약계란도 많이 먹길래 요것도 주문해봐용 담양국수거리는 요렇게 거리에 쭈르륵 줄지어 있는 평상... ,콩로그 ఇ,https://blog.naver.com/lllsg0426,2015-07-21
담양 국수거리 (Feat. 백종원의옛날진미국수 ),https://blog.naver.com/oiktoail?Redirect=Log&logNo=221320434171,한옛날 진미국수 에서 주문을 했습니다. 가격은 그럭저럭 무난한 편이네요 국수특성상 가격을 올려서 받기도 애매하겠죠... ㅋㅋ 이렇게 강가쪽은 뷰가 괜찮은 편. 맛배기로 멸치국물국수와 열무비빔국수를... ,Variety place,https://blog.naver.com/oiktoail,2018-07-17
담양 국수거리옛날진미국수 ,https://blog.naver.com/jke1967?Redirect=Log&logNo=221113189661,"담양의국수거리는 옛날 죽제품시장이 있던 하천 뚝방 50m의 거리에 조성되어 있어, 담양을 찾는... 유명한 국수집이 많이있지만, 국수거리 중간쯤에 위치하고 백종원의 3대천왕에 출연한옛날진미국수 집을... ",흙에서 피어나는 사랑의 풍경,https://blog.naver.com/jke1967,2017-10-09
"담양 국수거리 3대천왕에 나온 국수집, ' 옛날진미국수 '",https://blog.naver.com/kinn2964?Redirect=Log&logNo=221384395684,담양국수거리/ 옛날진미국수 /메뉴 -주문- 열무비빔국수2 파전1 엄청 빨리 나옴 우린 야외에서 먹었당 국수거리에서는 야외지 ☆(_ _*(･ω･*)三(*･ω･)*_ _)☆ 밑반찬은 단무지 무침 콩나물 김치 멸치육수국물... ,어쩌다 하는 블로그,https://blog.naver.com/kinn2964,2018-10-24
담양국수집:D옛날진미국수 ,https://blog.naver.com/yuly486?Redirect=Log&logNo=220846350689,"담양국수집:D옛날진미국수덥고도 더웠던 여름날의 추억을 찾아서 ,,,,, 개뻥이고, 사진 찾다보니 나온 담양의 추억나들이! 이번에는 담양에 있는옛날진미국수 집으로 갔답니다 백종원의 3대천왕에 나왔다는... ","속닥속닥,소박한튼튼네",https://blog.naver.com/yuly486,2016-10-26
[전남/담양]옛날진미국수 ,https://blog.naver.com/jina_910223?Redirect=Log&logNo=221022664853,"백종원의 3대 천왕에 나왔던 국수거리의 국숫집. ' 옛날진미국수 '를 소개해보아요.옛날진미국수 . 웨이팅은 기본으로 하고 있는데 한 10분? 기다리면 차례가 돌아왔어요. 주문은 국물국수 1, 비빔국수1, 그리고... ",입과눈이즐거운GNA,https://blog.naver.com/jina_910223,2017-06-06
담양옛날진미국수 _백종원의 3대천왕,https://blog.naver.com/freeeagle10?Redirect=Log&logNo=220773826302,다시옛날 진미국수 로 돌아와서. 참 여기는 프로방스거리에 있는 엣날 진미국수가 아니고 본점이랍니다. ^-^ 빌지가 메뉴판겸 가격표 대신이에요. 기본밑반찬 세가지.이건 어느집이나 거의 동일한듯해요. 저는... ,힐링프레임의 일상블로그,https://blog.naver.com/freeeagle10,2016-07-28
담양맛집/죽녹원맛집/담양국수거리/ 옛날진미국수 /백종원의... ,https://blog.naver.com/lifebook57?Redirect=Log&logNo=221559900392,"갖은 야채들이 정말 많이 들어 있는게 좀 다른 느낌~~ 국수는 중면으로 좀 두툼하고 쫀득한 식감이 괜찮았어요. 담양옛날진미국수 ! 맛이 엄청 맛있었거나 특별히 다른 맛은 아니였지만, 양도 푸짐하고... ",애니의 사랑이 담긴 방,https://blog.naver.com/lifebook57,2019-06-11
담양 국수거리 맛집 : 3대천왕에도 나온옛날진미국수 ,https://blog.naver.com/chic-amy?Redirect=Log&logNo=221134023565,"맛집옛날진미국수국수,파전은 간은 적당한데 뭐랄까 조금은 삼삼한 그런 맛이다 조미료가 덜 들어간건가. 깔끔한 맛! 분명 싱겁진않은데 건강해지는 것 같은 맛 그 때문에 사람마다 호불호가 있을 것... ",모네로그 : 일상을 그리다,https://blog.naver.com/chic-amy,2017-11-06
메타 프로방스옛날 진미 국수.,https://blog.naver.com/haerin0602?Redirect=Log&logNo=220963016747,담양 메타 프로방스 진미 국수 담양에서 딸기따기체험후~~ 매콤달콤한 비빔국수가 생각나서옛날진미 국수 로 고고 외부 테라스에다 자리를 잡고 주문을 했는데 내부 홀에 자리가 없었는지 사람들이 줄을 서기... ,행복을 드립니다^^,https://blog.naver.com/haerin0602,2017-03-20
전라남도 담양 맛집 국수거리옛날진미국수백종원3대천왕,https://blog.naver.com/ging__?Redirect=Log&logNo=221611869573,넘 배고파서 뭘 먹을까 검색하다가 담양에서 댓잎찹쌀도넛이랑 비빔국수를 보게 됨! :) 그중에 백종원3대천왕에 나왔다는 # 옛날진미국수하천쪽으로 주차장 잘 되어 있어서 그쪽에 주차하고 계단으로 올라가면... ,힘쌔미,https://blog.naver.com/ging__,2019-08-10
담양 맛집 백종원 3대 천왕에 나온옛날진미국수메타프로방스점,https://blog.naver.com/lovehjy3322?Redirect=Log&logNo=221359914492,"백종원 3대천왕에 나왔다는 걸 증명하기 위한옛날진미국수간판이 문 위에 떡하니~ 그리고 나온 콩국수 입니다, 주문하고 얼마 안되서 정말 빨리 나오더라고요~~ ^^ 배고팠는데 엄청 좋았어요~ 그래, 콩국수가 이... ",세잎크로바의행복,https://blog.naver.com/lovehjy3322,2018-09-16
담양맛집옛날진미국수비오는날,https://blog.naver.com/jaepum6824?Redirect=Log&logNo=220895136536,담양군청에 출장이 있어 갔다 오는 길에 딱 점심시간에 걸려 뭘먹지 하며 생각한게 바로 이곳 담양맛집옛날진미국수입니다. 국수의 거리 진우네국수 바로 옆에 위치하고 있는데 백종원의 3대천왕에 나온후로... ,빠져드는 물생활,https://blog.naver.com/jaepum6824,2016-12-26
"[담양] 국수거리,옛날진미국수 , 죽녹원",https://blog.naver.com/yasii79?Redirect=Log&logNo=220808583784,"담양 국수거리의 맛집옛날 진미국수 입니다. 메인메뉴, 멸치국물국수인데요, 시원한 멸치육수에 면발은 중면을 사용했습니다. 콩나물 고명이 특이한데요, 국수를 무지 사랑하는 제가 먹어봤을때, 맛은 음... ",부산 국비지원 가죽공예학원 바이두룸 부산가죽공방,https://blog.naver.com/yasii79,2016-09-09
맛집] 암뽕순대 옛날 대통 순대집국수거리의옛날 진미 국수 ,https://blog.naver.com/natureu?Redirect=Log&logNo=130190817736,암뽕순대 VS 옛날국수 이미 지상파에서 여러번 맛집으로 소개된 집이에요. 암뽕순대로 유명세를 타고... ^^ 중화요리집을 뒤로하고 담양의 유명한 국수거리로 갑니다. 많은 식당 중에 선택한 [ 옛날 진미 국수 ]... ,지금 10년을 준비하다,https://blog.naver.com/natureu,2014-05-08
[담양 국수거리]옛날진미국수 ,https://blog.naver.com/kgehappy?Redirect=Log&logNo=220756388866,"유명해진옛날진미국수 예요~ 담양국수거리의 묘미는 관방천을 옆에 끼고 평상에서 국수를 먹을 수 있다는 점~~!! 진미국수가게 내부에도 자리는 많지만, 국수거리에 왔으니 야외에서 맛봐야죵~~ 진미국수 메뉴... ",고고의 소소한 일상 ♡,https://blog.naver.com/kgehappy,2016-07-07
담양옛날진미국수메타프로방스점 국수집,https://blog.naver.com/egg7674?Redirect=Log&logNo=220788336204,담양맛집 너무 많아서 다음엔 국수말고 고기먹을거다~ㅎㅎ 계란도 먹는다는데 안먹어봤지만 배불러서 ㅠ.ㅠ 그래도옛날진미국수 가 담양 국수집중에서 젤 유명하긴 한가보다 ㅎㅎ 주문과 동시에 허벌라게... ,배여사블로그,https://blog.naver.com/egg7674,2016-08-15
담양 멸치국수- 옛날진미국수메타프로방스점,https://blog.naver.com/malgoonge?Redirect=Log&logNo=220582886935,"ㅠㅠ 드디어옛날진미국수 의 멸치국수를 먹어보는군요~~ 멸치국수 맛은요... 그냥 엄마가 끓여준 멸치국수같아요~~ 간이 세지도 않고, 담백해서 말궁이네 입맛에 딱 좋더라구요^^ 하지만 사람들이 너무 많아서... ",말궁이의 일상다반사,https://blog.naver.com/malgoonge,2016-01-03
"담양 국수거리 / 옛날 진미국수 , 주말보내기",https://blog.naver.com/shrshrdl52?Redirect=Log&logNo=220370023793,"담양 국수거리 / 옛날 진미국수 , 주말보내기 안눙하세요 꼬옥이예요 구례갓다가 광주오는길에 바람쐴겸 담양 들러서 국수한그릇 하기 주말이라 사람이 어마어마..했어요 구례에서 담양까지 얼마 안걸렸는데 담양... ","소소한행복, 꼬옥이로그:)",https://blog.naver.com/shrshrdl52,2015-05-27
"전남 담양_ 메타세콰이어길,옛날진미국수 , 죽녹원",https://blog.naver.com/noheul0517?Redirect=Log&logNo=221083360880, 옛날 진미국수여긴 진미국수 먹으러 주차하고 바로 앞에있던 곳- 오리도 있고 물이랑 풀이랑 나무가 넘 이뻐서 찍음ㅎㅎ 여행을 오면 여유로운 마음으로 다니다보니 이렇게 지나가는 소소한 모습들까지도 눈에... ,토깽의 따스한 오월,https://blog.naver.com/noheul0517,2017-08-28
백종원 3대천왕 국수편 - 담양옛날진미국수:),https://blog.naver.com/814joeun?Redirect=Log&logNo=220641899545,월요일에는 문을 안연다고 하시더라고요 그래서 담양 국수거리로 가서옛날 진미국수 집을 방문하였지요 :) 사실 진우네 국수집을 주로 방문하였지만 ㅋㅋㅋㅋㅋㅋ 이번에 방송에 나왔다길래 요기로 방문 메타... ,리쪼블로그,https://blog.naver.com/814joeun,2016-02-29
담양 당일 여행 ] 뚝방거리옛날진미국수 와 전동바이크체험,https://blog.naver.com/penpi?Redirect=Log&logNo=221276146956,"자주가는옛날진미국수집입니다~ 그전에 앞쪽의 다른집을 다녔는데, 요즘은 이곳을 갑니다. 요즘은 왠만해서 다 맛이 비슷할거라 생각이 드는데, 이곳을 찾게 된 것은 열무비빔국수가 다른 곳 보다 맛나다보니... ","...그래, 다시...",https://blog.naver.com/penpi,2018-05-15
"1일차, 담양 공용버스터미널 + 담양 국수 거리 ( 옛날진미국수 )",https://blog.naver.com/buin0326?Redirect=Log&logNo=220379144704,"20150519 전라도 담양 @ 담양 1일차, 담양 공용버스터미널 + 담양 국수 거리 ( 옛날진미국수 ) 2012년 11월에 전주 다녀온 이후로 아주 오랜만에 혼자 국내여행을 떠났다. 해외가 아니라면 갑자기 떠날 수 있는 곳은... ","콩닥콩닥, 두근두근 이 따스한 청춘 지나기 전에",https://blog.naver.com/buin0326,2015-06-03
담양 메타프로방스_ 옛날 진미국수 ,https://blog.naver.com/freeeagle10?Redirect=Log&logNo=220777272805, 옛날 진미국수메타프로방스점. 더워서인지 줄은 안서고있네요. 입구에 메뉴가 창가에 붙어져있네요. 백종원의 3대천왕 국수편에 출연했다고 붙어있네요. 가격표가 붙어있네요. 가격보시면 관방제림에 있는... ,힐링프레임의 일상블로그,https://blog.naver.com/freeeagle10,2016-08-01
[담양국수/담양국수거리]백종원이 다녀간옛날진미국수 /,https://blog.naver.com/ilove0502i?Redirect=Log&logNo=220590626088,깔끔옛날진미국수멸치국수 나왔어용! 음...?ㅋㅋㅋ 멸치국수는 오빠랑저는 진우네가 더 맛있다는 평을 내립니다!옛날진미국수비빔국수에요! 비비기전에 찍었어야하는데 위에 열무랑 많이 주셧어요 헐..... ,또또와꼬맹이,https://blog.naver.com/ilove0502i,2016-01-07
담양맛집 백종원3대천왕 국수편옛날진미국수 ,https://blog.naver.com/lilyme7?Redirect=Log&logNo=220630387116,ㅡ 담양맛집 백종원3대천왕 국수편옛날진미국수ㅡ 얼마전 담양여행을 다녀왔었어요~ 담양의... 담양맛집 진미국수~~ 도 맛보고 왔답니다~~ 다음에 담양에 놀러오면 담양맛집은 다른곳을 찾아보아야겠어요... ,단미와 그린비의 달콤한가족 이야기,https://blog.naver.com/lilyme7,2016-02-18
담양여행맛집추천 백종원의 3대천왕에서도 나온옛날진미국수 ,https://blog.naver.com/siberian81?Redirect=Log&logNo=221410894176,담양여행맛집추천 백종원의 3대천왕에서도 나온옛날진미국수친구 결혼식 갔다가 근처가 담양이랑... 앉아서 국수를 먹어야함! 좀 분주해서 빨리 주문하는것이 좋을듯~ 약간 옛날 할머니가 차려주는 밥상처럼... ,"목동역 3번 출구, 경희아이큐한의원",https://blog.naver.com/siberian81,2018-12-02
담양_죽녹원_국수거리_ 옛날진미국수 ,https://blog.naver.com/gu6888?Redirect=Log&logNo=222485521601,진우네 다음에 올꿰여~~~~~~~~~~ 진미국수에서 더내려가면 원조대나무국수집도 있다고 하네요~ 다음에 도전쓰! # 옛날진미국수도착했습니다. 여긴 사람이 바글바글 거리더라구요! 좀 한산해질때 들어가줍니다.... ,구프로 일상로그,https://blog.naver.com/gu6888,2021-08-28
담양맛집 백종원3대천왕옛날진미국수 ,https://blog.naver.com/hahoitar?Redirect=Log&logNo=220802567478,나왔다는옛날진미국수 에 가보았어요 밖에 방송에 나왔던 사진이 붙어 있어서 지나가다 봐도 이집이... 잡내도 안나고 국물이 진하니 정말 맛좋더라고요 양도 적지않고 가격대비 가성비가 좋아요 비빔국수는... ,씐나는 청춘,https://blog.naver.com/hahoitar,2016-09-01
