title,link,description,bloggername,bloggerlink,postdate
맛있는녀석들 고성 냉면 맛집 40년 전통 ' 오미냉면 ',https://blog.naver.com/lovelysuns?Redirect=Log&logNo=221683826945,"그리고 나온오미냉면 의 냉면. 이곳은 물냉면, 비빔냉면 구분없이 사진에 보이는 냉면 한종류만 판매하고 있습니다. 면과 양념, 고명이 어우러진 빛깔이 유치하지 않으면서 참 곱네요. 육수를 2주전자 내어... ",Lovelysuns' Photo Essay 'NOW',https://blog.naver.com/lovelysuns,2019-10-21
고성 - 아야진 맛집 '40년전통 오미냉면 ',https://blog.naver.com/kks0754?Redirect=Log&logNo=222422293931,"아야진 맛집 '40년전통 오미냉면 '의 메뉴. 냉면과 수육이 전부에요. 어느 식당이든 처음 가면 추천하는대로 먹는 편이라 이렇게 먹어보려구요. 냉면만 주문하면 양념장, 무절임이랑 왼쪽의 냉육수 그리고 사진엔... ",스머프마을,https://blog.naver.com/kks0754,2021-07-14
맛있는 녀석들 고성 ' 오미냉면 ' 2번째 방문 후기,https://blog.naver.com/ccma04?Redirect=Log&logNo=222286787914,"ㅎㅎ https://blog.naver.com/ccma04/222001481995 사실 이집을 다시 찾은건 이번 속초여행에서 속초의 유명한 명태회 냉면집을 갔는데 완전 실패해서 불친절 하지만, 그래도 맛하나는 보장되는오미냉면 을 오게 됐음.... ",Miller - 자동차 / 맛집후기 / 여행 / 내돈내산,https://blog.naver.com/ccma04,2021-03-25
강원도 고성 맛집 /오미냉면- 회냉면 평양냉면도 좋지만... ,https://blog.naver.com/only1a2a3a?Redirect=Log&logNo=222155392078,강원도 고성 맛집 /오미냉면- 회냉면 평양냉면도 좋지만 함흥냉면도 옳다 회냉면 이번에 다녀왔던 태교 여행중에서 만족도로만 놓고 보면 가장 좋았던 식당이 오늘 소개해드릴 냉면집입니다 대게도 먹었었고... ,랑이의 보물상자,https://blog.naver.com/only1a2a3a,2020-11-27
고성맛집오미냉면 ,https://blog.naver.com/kfs97?Redirect=Log&logNo=222442976396,합격입니다 # 오미냉면#고성맛집 #맛있는녀석들냉면 #고성냉면 #아야진맛집 #고성아야진 #고성 오미냉면오미냉면맛있게 먹는법입니다 양념장 큰숱가락 한스푼넣고 겨자 적당히넣고 설탕한스푼 그리고 식초... ,번뇌의바다,https://blog.naver.com/kfs97,2021-07-23
강원도 고성맛집 맛있는녀석들 김준현맛집오미냉면 ,https://blog.naver.com/neulsing?Redirect=Log&logNo=221765557011, 오미냉면#김준현맛집 #김준현 오미냉면#고성 오미냉면#강원도속초맛집 #속초맛집 #냉면맛집 #인생냉면 #맛있는녀석들 #맛있는녀석들맛집 #강원도맛있는녀석들 #맛있는녀석들냉면 #맛있는녀석들 오미냉면 ,MINI X MADE,https://blog.naver.com/neulsing,2020-01-10
"맛있는 녀석들 김준현 맛집오미냉면후기,고성맛집",https://blog.naver.com/ppeudamade?Redirect=Log&logNo=222525708500,"고성 아야진해변 맛집,오미냉면솔직 후기 얼마전 포스팅 했던 고성 아야진해변의 갈매기횟집! 거기서 저녁먹고 숙소로 돌아다가 보게된 냉면집... (갈매기횟집 바로 뒤편에 있습니당) 알고보니 여기가 즐겨보는... ",모두쁘다의 핸드메이드 작업실,https://blog.naver.com/ppeudamade,2021-10-04
"[강원도 고성] 오미냉면 -매콤달콤 회냉면, 디지털대기",https://blog.naver.com/aualright?Redirect=Log&logNo=222446031849,"고성 오미냉면명태회냉면 아야진, 청간해변 근처 #냉면맛집 을 찾았다. 줄서서 먹는 건 무척 싫어서... 매콤달콤 자극적인 진한 양념맛이 매력적인 오미회냉면이였다!! 슴슴하고 고소한 고성막국수와 완전... ",참꽃마리의 행복♡공간,https://blog.naver.com/aualright,2021-07-26
[강원]고성 맛집 ' 오미냉면 '/ 회냉면 맛집 / 맛있는녀석들,https://blog.naver.com/pumaeunji?Redirect=Log&logNo=222397409848,"그래도 첫번째 순서가 아니라니 ㅠㅠ오미냉면 은 단품만 팔아요 !! 명태회냉면 1가지 보통 8,000원 과 곱배기 10,000 수육 20,000원 이렇게만 있어서 메뉴를 고민할 필요가 없음 가게에 들어가서 기다리는중... ","비비수니 - NEWLYWED, DAILY",https://blog.naver.com/pumaeunji,2021-06-14
"고성 속초 맛집 카페 총망라, 글라스하우스오미냉면 ... ",https://blog.naver.com/darcyy?Redirect=Log&logNo=222363635168,그냥 지나칠수없었음 ㅜㅜㅜ 이 냉면이 유명하더라고요 40년 전통의오미냉면 ! 먹는 방법이 현수막에 자세히 걸려있었습니당/// 이게 약간 비법 소스장 느낌ㅋㅋ 다대기인데!!! 이걸 이렇게 한숟갈 추가하시고... ,Fantaisie Impromptu,https://blog.naver.com/darcyy,2021-05-24
"고성오미냉면 , 수육까지 먹자",https://blog.naver.com/ddbba?Redirect=Log&logNo=222421865767,엄~~청 배고픈 상태에서 먹은지라 더 맛있게 느껴졌기도 하고.ㅋㅋ 앞으로 서울이나 타지에서 회냉면 먹을 때마다 나는 고성오미냉면생각날 것 같아 ㅎㅎㅎ 그리고 또 기대했던 메뉴 바로바로 수육!... ,림이의 시시콜콜한 일상,https://blog.naver.com/ddbba,2021-07-06
[강원/고성]오미냉면| 맛있는녀석들 김준현이 감탄한 회냉면...... ,https://blog.naver.com/yssy1231?Redirect=Log&logNo=222308695842,"맛있는 녀석들 227회(2019) 비빔냉면 편 식객 허영만의 백반기행 60회(2020) 회냉면오미냉면차림표 메뉴는 완전 심플하다. 냉면과 수육이 끝이다. 이런 단일 메뉴의 전문점이면 일단 믿음이 간다. 근데, 보통... ",혼자가는산구경,https://blog.naver.com/yssy1231,2021-04-13
맛있는녀석들 속초 고성오미냉면가볼만해,https://blog.naver.com/sweetstuff33?Redirect=Log&logNo=222017865428,수육에 이어 고성오미냉면 의 회냉면이 나온다. 맛있는녀석들에서 김준현씨는 냉면의 담음새만 보고도오미냉면 이란걸 알아보던데 참 신기했. 개인적으로 냉면면발보다는 막국수면을 더 좋아하는지라 아... ,"당신의 비타민 그리고,",https://blog.naver.com/sweetstuff33,2020-07-01
강원도 고성오미냉면/ 속초중앙시장 술빵,https://blog.naver.com/maxlovezzang?Redirect=Log&logNo=222349319407,있는 # 오미냉면에 가서 시원한 냉면한그릇하기로했답니다오미냉면역시 유명한가봐요 번호표를 뽑고 기다렸어요 3번이라 그냥 기다리기 ㅋ 지금 거리두기때문에 식당자리를 띄엄띄엄 앉아야해서 자리가... ,또다른행복의시작...,https://blog.naver.com/maxlovezzang,2021-05-13
강원도 맛있는녀석들 김준현 냉면으로 유명한 고성오미냉면 ,https://blog.naver.com/tpwlsckq?Redirect=Log&logNo=221972197776,강원도 고성에 갈일이있으시다면 그리고 냉면을 좋아하신다면 솔직히 맛있는 녀석들보고 김준현씨 먹는거 보고 침을 꼴깍 삼키셨다면.오미냉면한번쯤은 가보시길 추천드립니다:),먹뷰리 니나노라이프,https://blog.naver.com/tpwlsckq,2020-05-20
고성 ' 오미냉면 ' 가볼만 할까? (맛있는 녀석들),https://blog.naver.com/ccma04?Redirect=Log&logNo=222001481995,"220km 당일치기 고성 ' 오미냉면 ' 솔찍 후기 2020. 06. 13 맛있는 녀석들에 나온 철원 '내대막국수'랑 고성의... 들어가면 먹는 방법 써 있고, 냉면은 단일메뉴(보통, 곱배기만 있음) 우선 냉면 8천원, 수육 2만원... ",Miller - 자동차 / 맛집후기 / 여행 / 내돈내산,https://blog.naver.com/ccma04,2020-06-15
"고성 아야진 맛집이라는 40년전통 명태회냉면,오미냉면- 식객... ",https://blog.naver.com/jendanoon?Redirect=Log&logNo=222454321921,나 처럼 맛 구분 잘 못하면 화낼지도 모름~ ㅎㅎㅎ # 오미냉면#고성 오미냉면#아야진 오미냉면#허영만의백반기행 #맛있는녀석들냉면 #고성냉면 #명태회냉면 #40년전통 오미냉면#회냉면,핑크고래 & 하늘 비,https://blog.naver.com/jendanoon,2021-08-02
[강원 고성] 오미 냉면 ,https://blog.naver.com/l9606434?Redirect=Log&logNo=222096146320,#고성맛집# 오미냉면 #아야진맛집#냉면맛집 간만에 바다 구경. 강원 고성 아야진해변에 위치한오미 냉면맛 보여 준다길래. 가 봄 원래 사람 많은데 사람들 없다며 신나 함 막상 가보니 대기 7팀 입구에 들어 가자... ,소소한 나날들 ….,https://blog.naver.com/l9606434,2020-09-22
"[강원도 고성] 오션뷰카페 에이프레임, 고성 맛집오미냉면 ",https://blog.naver.com/shensubin?Redirect=Log&logNo=222320801561,수육하고 냉면만 파는오미냉면오미냉면먹고 바로 아야진해변가서 걷기추천! *10시 30분 오픈 오후 3~4시 30분 브레이크 타임 있음* 왕복 이동시간과 빡신 운전만 아니라면 매 달 가고싶은 강원도 고성 후기 끝-,우야 행복공간,https://blog.naver.com/shensubin,2021-04-23
고성 맛집 40년전통 오미냉면 ,https://blog.naver.com/emghee?Redirect=Log&logNo=222517335028,"밖에서 대기하며 찍은 사진 3대가 함께하는오미냉면오미냉면메뉴판 우리는 오비냉면 보통 8,000원에 수육 20,000 햇반 1500 온육수가 사골국물이어서 아이들 사골국물에 밥 말아먹이기 좋았다.오미냉면 ... ",232님의블로그,https://blog.naver.com/emghee,2021-09-26
 오미냉면고성 맛집 겨울철 코로나에도 줄서서먹는 집,https://blog.naver.com/naengmu?Redirect=Log&logNo=222244635246,ㅎㅎ 고성 아야진항에 위치한오미냉면 은 회냉면 단일 메뉴에요 자리에 앉아서 보통을 먹을지 특을 먹을지만 정하면되요. 아빠/엄마/저 3명이 갔는데요 아빠랑 저는 특! 엄마는 보통을 주문했답니다. 주문한 특... ,냉무의 일상 일기장 happy.,https://blog.naver.com/naengmu,2021-02-15
[21.08.16] 고성오미냉면 과 어나더블루,https://blog.naver.com/kkmmiky765?Redirect=Log&logNo=222525648909,"#맛있는녀석들 에 나왔던 #고성 오미냉면에 다녀왔다. 거리가 있지만 당일치기로!! # 오미냉면 영업시간... 사실 메뉴랄게 딱히 없는데 #냉면 과 #수육 두가지 메뉴뿐이라 고를건 사이즈 정도? 테이블에는 식초, 겨자... ",FreedomK,https://blog.naver.com/kkmmiky765,2021-10-07
"교육 후기,고성아야진해변 냉면맛집 40년전통오미냉면 ",https://blog.naver.com/yhlprincess?Redirect=Log&logNo=222059696557,이제너두다이버https://youarediver.modoo.at/ 고성 아야진해변 맛집회냉면으로 유명한오미냉면항상 웨이팅이 있는 곳. 스킨스쿠버 해양교육 2회차를 끝내고조금 기다리긴했지만 금방 들어갈 수 있었다... ,키작은 소녀의 소소한 행복,https://blog.naver.com/yhlprincess,2020-08-13
 오미냉면 ]맛있는녀석들에도 출연했던 아주 맛났던 함흥냉면집.,https://blog.naver.com/mjinchul1?Redirect=Log&logNo=222095246327,고속도로 뚫히고 나니깐 가깝네 ㅎㅎ 찌니님이 자다가도 말하는오미냉면아마 찌니님 최애냉면 아닐까 추측해 봅니다. 전화 033-633-4598 주소 강원 고성군 토성면 아야진해변길 73 지번:아야진리 45 영업시간... ,바블의 신나는 세상,https://blog.naver.com/mjinchul1,2020-09-22
아야진항오미냉면 과 봉포항 회센터,https://blog.naver.com/anys0428?Redirect=Log&logNo=222326316674,아야진항오미냉면점심은 아야진 항구에 있는오미냉면 에서 먹었다. 허영만의 백반기행에 나온 집이다. 메뉴는 한 가지. 명태회냉면인데 고기 한 점과 명태회무침이 얹어져 나왔다. 냉면집에는 곱빼기는... ,가족과 즐거운 산책,https://blog.naver.com/anys0428,2021-04-28
"강원도 고성 맛집, 맛있는 녀석들 다녀간오미 냉면속초 관광... ",https://blog.naver.com/1978mm?Redirect=Log&logNo=222325565132," 오미 냉면 은 명태 #회냉면 으로 곱빼기 1만 원, 보통 8천 원이다. 살짝 고민됐지만 보통으로 먹기로! 그리고오미 냉면 을 맛있게 먹는 방법대로 그대로 따라 해보겠습니다. 양념장, 육수와 온육수가 각각 담긴... ",배짱이의 여행스토리 ▒ 배짱두둑한 여행블로거 ▒,https://blog.naver.com/1978mm,2021-04-28
고성 맛집오미냉면 ,https://blog.naver.com/coo__ll?Redirect=Log&logNo=222502568849,아야진해변 근처에 위치한 고성냉면맛집오미냉면거리두기 4단계 전 고성 갔다가 친구들과 방문했던 곳이다 대기는 휴대폰번호 입력 후 카카오톡으로 순서를 확인하면 된다 오픈 전 도착이라 널널할 줄... ,slowly slowly,https://blog.naver.com/coo__ll,2021-09-11
다시 가고싶은 속초 냉면 40년 전통오미냉면 ,https://blog.naver.com/cocoza1995?Redirect=Log&logNo=222526416608,다시 가고싶은 속초 냉면 40년 전통오미냉면안녕하세요. 쫑블리 입니다! ㅎㅎ 저는 친구랑 오랜만에 속초 를 다녀왔어요. 여기는 제가 애정하는 프로그램 맛있는 너석들이 등장했던 되게 유명한 곳 이라고 해서... ,Let's get it started.,https://blog.naver.com/cocoza1995,2021-10-04
강원도여행 거진항 낚시 +오미냉면+ 순긋해변,https://blog.naver.com/nabinarra?Redirect=Log&logNo=222389412188,"이번 낚시는 허탕 전에 기억에 맛있었던 아야진오미냉면다시 먹으러 총총총 이 집은 냉면 안에 속초 명태회가 유명하다! 근데... 이번엔 회가 진짜 부스러기만 좀 들어있었다... 곱배기 시켰는데, 힝 이제 안와... ",쪼잘쪼잘 일기장♬,https://blog.naver.com/nabinarra,2021-06-08
"고성맛집,오미냉면명태 회냉면 맛보다.",https://blog.naver.com/kimunan?Redirect=Log&logNo=221944818382,드디어오미냉면회냉면 맛봤다!! 일반적인 회냉면과 다르네~ #맛집 #고성맛집 #회냉면 #냉면맛집 지난번 방문했을 때는 저녁 장사가 끝나서 맛보지 못했는데~ 사장님께서 동네 다른 맛집도 추천해 주셨는데... ,[생각의시각화] 세상에 오줌 싼 흔적이야기,https://blog.naver.com/kimunan,2020-05-04
속초 고성 맛집오미냉면/ 카페 태시트,https://blog.naver.com/kyu_b?Redirect=Log&logNo=222290846422,"ㅋㅋ오미냉면 에서 가까운 고성 신상카페 태시트 해변길 따라서 가면 바로 있어요 태시트라떼, 크림커피, 휘낭시에 주문 냉면 먹고 바로 갔더니 너무 이른시간이라 그런지 사람도 없고 좋았어요 코로나 때문에... ",SECOND NAME,https://blog.naver.com/kyu_b,2021-03-29
고성 아야진오미냉면맛있는녀석들 냉면 맛집,https://blog.naver.com/uameee?Redirect=Log&logNo=222465924702,"고성 아야진오미냉면맛있는녀석들 냉면 맛집 안녕하세요◡̈ 이번 포스팅에서는 고성 아야진해변에 위치한 냉면 맛집 소개를 하려고 합니다. 맛있는녀석들에서도 맛집으로 소개된오미냉면인데요, 식객... ",꽃과같은마음으로,https://blog.naver.com/uameee,2021-08-11
강원도 속초 고성 냉면 맛집- 아야진오미냉면 의 과거와 현재,https://blog.naver.com/coolboy76?Redirect=Log&logNo=222333282690,올해 초에 갔던 2021년도오미냉면전경 '2017'년 여름에 갔던 오미냉명 전경 40년 전통오미냉면연륜이 느껴집니다. 실내는 좌식으로 되어있었습니다. 우리말고 한테이블 정도만 계셨었습니다. 2017년도 냉면... ,coolboy's 게임그래픽~일상,https://blog.naver.com/coolboy76,2021-05-02
강원도 고성맛집오미냉면맛있는녀석들 회냉면으로 유명한곳... ,https://blog.naver.com/youth_1986?Redirect=Log&logNo=221675059920,제작년에는 동루골 막국수를 먹었는데 이번에는 맛있는녀석들에 김준현이 극찬한 회냉면 먹으러 아야진항에 있는오미냉면 을 먹으러 왔어요. 호텔은 속초지만 은근 맛집탐방은 고성으로만 오는거 같네요.... ,파인애플냠냠 blog,https://blog.naver.com/youth_1986,2019-10-11
"(강원도 고성) 40년전통오미냉면 , 방문 후기",https://blog.naver.com/bobae0325?Redirect=Log&logNo=222500495152,그럼오미냉면휴기는 여기서 끝!!! # 오미냉면#40년전통 오미냉면#냉면 #명태회냉면 #단일메뉴 #수육 #냉면맛집 #고성맛집 #강원도맛집 #아야진해변맛집 #아야진해수욕장맛집 #고성 #강원도고성 #아야진해수욕장,뽀릉릉이의 일상 :D,https://blog.naver.com/bobae0325,2021-09-09
맛집 고성군 토성면 '40년 전통오미냉면 ',https://blog.naver.com/jonghwa42?Redirect=Log&logNo=221871706239,"내가 지금껏 먹은 냉면 중 최고였다. 왜 사람들이 인생냉면이라고 말하는지 알 수 있었다. 나에게도, 햄팅이에게도 최고의 냉면이었다. 40년 전통의오미냉면 , 강력 추천한다!!!",내 마음속 네가 원하는데로...,https://blog.naver.com/jonghwa42,2020-03-25
강원도 고성맛집 40년전통 오미냉면 ,https://blog.naver.com/yungvely89?Redirect=Log&logNo=222130902977,"사이즈는 보통, 곱배기 중 선택 할 수 있구요:) 회냉면 (보통) 8,000 (곱배기) 9,000 수육 20,000 저는 보통으로 주세요✨ 수육도 먹고 싶었는데 다 못먹을 거 같아서 다음으로 미루기,,,,, 나랑 갈 사람?오미냉면 ... ",융이와 너나들이,https://blog.naver.com/yungvely89,2020-10-30
고성 아야진 맛집오미냉면 !(오! 미치게 맛있네),https://blog.naver.com/2014dongha?Redirect=Log&logNo=221703890253,"이것이 바로 1시간 이상을 기다려 만나게 된,오미냉면오미냉면 을 잠깐 설명하자면, 물냉면, 비빔냉면 이렇게 나눠져 있지 않다. 비빔냉면처럼 아래 육수가 거의 깔리지 않은 채로 나온다. 여기서! 아까... ",J'Family & Bigsea Story,https://blog.naver.com/2014dongha,2019-11-11
또 왔다! 고성 아야진 여름이면 생각나는오미냉면 ,https://blog.naver.com/jerrymeee?Redirect=Log&logNo=222508214498,*****오미냉면- 40년 전통 다른 냉면과는 차원이 다른 양념명태회 다대기오미냉면***** 강원도 고성군 토성면 아야진해변길 73 OPEN 매일 10 : 30 ~ 19 : 00 BREAKTIME 15 : 00 ~ 16 : 30 휴무 수요일 00 : 00 - 24 : 00 10월~3월... ,제리미의기록,https://blog.naver.com/jerrymeee,2021-09-16
"고성 아야진 해수욕장 맛집, 속초오미냉면명태회무침 회냉면",https://blog.naver.com/lseoj?Redirect=Log&logNo=222536809484," 오미냉면 은 물냉면 비빔냉면 구분되어 있지 않으며 회냉면 단일 메뉴예요. 주문과 동시에 시원한 육수와 무절임 그리고 양념장이 차려져요. 여기에 식초, 겨자, 설탕이 따로 준비되어 있어 취향에 맞게 넣어... ",에제의 푸드랩,https://blog.naver.com/lseoj,2021-10-14
꿀맛 냉면 40년전통오미냉면가격/먹는 법 /솔직후기!,https://blog.naver.com/beyuna?Redirect=Log&logNo=222431815400,"먹어본 냉면 중 제일 맛있었던오미냉면 ! 내돈내산 리뷰 고고우~오미냉면8,000원 수육 20,000원오미냉면4개랑 수육 하나 주문했어요 냉면을 기다리는 동안 온육수가 먼저 나오는데 찐하고 고소한... ",인생의 아름다운 순간들,https://blog.naver.com/beyuna,2021-07-14
아야진 항구 근처 맛집 고성 40년 전통오미냉면 ,https://blog.naver.com/hillyo?Redirect=Log&logNo=222497353540,ㅎㅎㅎ 겨자랑 식초는 원래 잘 안 넣어 먹는데 짝꿍이 손맛인가 진짜 꿀맛!!!♥오미 냉면 은 단일 메뉴라 물/비빔냉면의 구분이 없어서 그만큼 육수를 더 넣어 먹으면 된다. 냉면 완전 내 스타일!!! 매콤... ,"오늘 기록,",https://blog.naver.com/hillyo,2021-09-06
강원도 고성 맛집오미냉면꼭 가야해,https://blog.naver.com/strawberii?Redirect=Log&logNo=222343893788," 오미냉면 은 비빔냉면도 아니고 물냉면도 아니에요. 명태회냉면입니다. 주문할 때 보통인지 곱배기인지만 말하면 되요. 저는오미냉면2개와 수육, 공기밥을 주문했어요.오미냉면 을 먹는 방법은 이렇게... ","the 메이슈,",https://blog.naver.com/strawberii,2021-05-09
고성오미냉면취향저격 회냉면 맛집 ღ,https://blog.naver.com/cksldia93?Redirect=Log&logNo=222047467671,고성오미냉면~ 요즘 또 냉면에 빠져있는지라 무조건 가봐야겠다고 저장해둔 곳이에요 역시 평일 오전 시간이라 좀 한적했는데 먹다보니 손님 많이 오더라구요 관광오신분들도 있고 현지분들도 있고... ,ღ 노는 게 제일 좋아 ღ,https://blog.naver.com/cksldia93,2020-07-31
[강원도아야진항/ 오미냉면 ]맛있게 먹었던 비빔냉면.... ,https://blog.naver.com/mjinchul1?Redirect=Log&logNo=221677486046,ㅋㅋㅋㅋ오미냉면 의 메뉴와 맛있게 먹는방법 착석과 동시에 뜨뜻한 육수부터 내어주시고 늘 먹던 그맛!! 해장으로도 좋지요 양념장과 무김치 비빔냉면 세팅 완료 얼음이 들어간게 이색적이네요 냉면의 면빨... ,바블의 신나는 세상,https://blog.naver.com/mjinchul1,2019-10-21
고성 아야진해변근처 [ 오미냉면 ],https://blog.naver.com/eeeej0_0?Redirect=Log&logNo=222225840383," 오미냉면 .. 직장동료분께서 추천해주셨다. 냉면을 엄청 좋아하진 않지만 잘은먹는? 그럼, 좋아하는건가? 여튼.. 친구들이랑 다녀왔다. 요번엔 두번째 방문 ! 우선 두번 다 웨이팅이 있어서 ㅠㅠㅠ 대기표 뽑고... ",Ona,https://blog.naver.com/eeeej0_0,2021-01-30
속초 고성 냉면맛집오미냉면-아야진해변맛집,https://blog.naver.com/noll92?Redirect=Log&logNo=222491250780,에서도 나와서 방송출연이 여러번 된오미냉면 집입니다 !! 냉면이 나오면 냉면육수와 양념장을 넣어주어야 제맛인데요 요 양념장이 냉면 거의 다 먹어갈 때쯤 매콤하게 올라오기 때문에 저와 같은 맵찔이는... ,가영쓰로그,https://blog.naver.com/noll92,2021-09-01
강원도고성맛집 /오미냉면(한번만 먹을순 없을걸?),https://blog.naver.com/hamae9?Redirect=Log&logNo=221715570744,속초/고성맛집오미냉면 의 하이라이트는 냉면을 다 먹은 후 마시는 온육수 ㅠㅅㅠ 서두에 좀 삼삼하단 표현을 했더랬는데 그건 냉면을 먹기 전 얘기이고 양념으로 버무려진 냉면을 먹고 난 후엔 입속에 남은... ,내 꿈은 한량,https://blog.naver.com/hamae9,2019-11-22
"강원도 고성, 속초맛집 아야진해수욕장 근처맛집 # 오미냉면 ",https://blog.naver.com/amazonian3?Redirect=Log&logNo=222048468712,개인적으루 정말 수육 냉면 그릇싹싹 비워먹을정도로 맛있게 먹은오미냉면 집~~ 잡내1도없는 야들야들한 #돼지고기수육 ! 야들야들 명태에 입혀진 달콤한 빨간양념의 #명태식혜 ~~ 빨간 양념이지만... ,soo자매 러블리 하우스~S2,https://blog.naver.com/amazonian3,2020-08-01
고성 아야진 해수욕장 맛집 맛있는 녀석들 40년 전통오미냉면 ,https://blog.naver.com/lean365?Redirect=Log&logNo=222236023049, 오미 냉면 은 회냉면의 끝판왕이에요! 고성 맛집 40년 전통오미냉면40년을 시골 한자리에서 운영하고 있다는건 현지인들이 인정하는 맛집이라는 것! (사진은 새롭게 인테리어 하기전 사진)오미 냉면 에서는... ,공부하는 트레이너,https://blog.naver.com/lean365,2021-02-08
"[고성맛집] 40년 전통 회냉면,오미 냉면 ",https://blog.naver.com/ldy9150?Redirect=Log&logNo=222130452984,아래는오미 냉면맛있게 먹는 방법! 진짜 적혀있는대로 마지막으로 온육수를 마시면 속이 시원~하다... 회냉면이란걸 먹어본 기억은 딱히 없었는데 만족스럽게 먹었던 날 :) 두드러기 때문에 음식을 가리던... ,"리또의 ""내 마음대로 가르치는"" 중국어",https://blog.naver.com/ldy9150,2020-10-29
"[속초]오미냉면- 물냉면, 비빔냉면 고민할 필요가 읍써",https://blog.naver.com/yjc13?Redirect=Log&logNo=222512929692,"속초에 다녀왔는데 아주 유명한 냉면 집을 방문했어요. 자전거를 타고 고성군 아야진리까지... 물, 비빔 없이 그냥오미냉면한가지에요. 양만 고민하시면 되는거죠.오미냉면보통으로 시키고 수육하나... ",Jason Zone,https://blog.naver.com/yjc13,2021-09-22
[고성]오미냉면: 맛있는 녀석들 나온 40년 전통 냉면집... ,https://blog.naver.com/djatn159?Redirect=Log&logNo=222388258412,"주인공 # 오미냉면#명태회냉면보통 8,000원 야채를 걷어보니 명태회도 들어가있다!살짝 맛보니 회무침 느낌보다는 오징어젓갈느낌...응? 1. 양념장 크게 한 스푼2. 설탕도 한 스푼 (추천)3. 식초, 겨자 약간4.... ",솨니로그,https://blog.naver.com/djatn159,2021-06-12
고성 40년 전통오미 냉면/아야진 해변오미 냉면 ,https://blog.naver.com/bo1018?Redirect=Log&logNo=222047048143,좋더라고요 온육수를 주전자 채로 주셔서 배불리 마시고 왔어요. 오래간만에 아주 맛있게 먹은 냉면!! (내 돈 주고 사 먹은 솔직 후기) ^^ #아야진 오미냉면# 오미냉면#고성 오미냉면#고성냉면 #아야진맛집,❣지금 이순간❣,https://blog.naver.com/bo1018,2020-07-31
