title,link,description,bloggername,bloggerlink,postdate
고성맛집 / 맛있는녀석들 김준현맛집오미냉면 ,https://blog.naver.com/marketer1210?Redirect=Log&logNo=222040940561,언니랑 고성여행에서 맛녀 김준현맛집 고고 가진해변 가는길에 언니가 냉면 맛집 추천받았다고오미냉면가보자고해서 고고 했어요 김준현맛집이라기에 ㅋㅋㅋ 더더욱 기대를 역시나 웨이팅이 있었지만... ,럭키쩡의 lucky한 일상,https://blog.naver.com/marketer1210,2020-07-25
[고성 아야진]오미 냉면 ,https://blog.naver.com/jcmook1?Redirect=Log&logNo=221958544919,명태회가 들어 있어 거부감이 없는 맛~ ^^ 이렇게 면이 반 정도까지 육수를 부어야 맛나게 먹을 수 있다는오미 냉면 ~ ^^ 난 함흥 냉면을 좋아하기에 그만큼은 아니지만 여름철 시원하게 한번쯤은 즐길 맛~ ^^ 다시... ,캠핑쟁이 캠핑 스토리(인생에 가장 값진 것들...),https://blog.naver.com/jcmook1,2020-05-12
거북이를 찾아서 ‘아야진해변’feat. 스위밍터틀오미냉면 ,https://blog.naver.com/happy-goseong?Redirect=Log&logNo=222354245812,"벚꽃라떼, 딸기소다, 오미자에이드처럼 상큼한 음료도 판매하고 있습니다. (여름엔 역시 시원~~한 거!)... Previous image Next image 아야진항오미냉면명태회냉면 그렇다면 냉면의 맛은?? 쫄깃한 면과 달콤매콤... ",강원도 고성군청,https://blog.naver.com/happy-goseong,2021-05-17
왕박골식당/삼고집/ 오미냉면 /소돌막국수/놀자대게,https://blog.naver.com/hhy0129?Redirect=Log&logNo=222126209485, 오미냉면강원 고성군 토성면 아야진해변길 73 사람이 없을 때 갔는데도 웨이팅해서 먹은 곳. 워낙 유명한 곳이라 그런지 직원분들의 행동이 챡챡. 허영만의 백반기행과 맛있는 녀석들에 나온 집. 회냉면은... ,＊ Restart …,https://blog.naver.com/hhy0129,2020-10-25
아야진해변 맛있는녀석들 다녀간 40년전통오미냉면솔직후기,https://blog.naver.com/imtrade88?Redirect=Log&logNo=222427583995,총 육수를 2가지 주시는데 작은 주전자가 냉면 육수 큰 주전자가 온육수입니다.오미냉면 은 물냉 비냉이 따로 없고 육수를 개인 기호에 맞게 부워서 먹을 수 있어요. 따뜻한 육수도 완전 굳. 딱 밀면집가면 먹을... ,임상사,https://blog.naver.com/imtrade88,2021-07-11
고성 아야진해변'냉면맛집' [ 오미냉면 ]*물놀이 후출출할때... ,https://blog.naver.com/banya0510?Redirect=Log&logNo=222519960581,#아야진해변맛집#냉면맛집# 오미냉면안녕하세요 잇님들^^~♥ 혹시. . 냉면 좋아하시나요? 올해여름 스노쿨링 하러 아야진해변에 갔다가 아주 맛있는 집을 발견해서 소개해드리려구 해요. 아무런 댓가도 받지않은... ,재밌는 타로탐구와 상쾌한 리뷰,https://blog.naver.com/banya0510,2021-09-28
강원도 고성 맛집) 40년전통오미냉면청간해변,https://blog.naver.com/hks8934?Redirect=Log&logNo=222373611034,"ⓒ2021 by Aladdin 속초맛집 고성맛집오미냉면함흥냉면을 맛있게 먹는 법이 벽에 붙어있다. 양념장 한스푼, 설탕 한 스푼, 식초와 겨자를 넣고 주전자에 담긴 시원한 육수를 면 중간 정도까지... ",현우n쌍둥이의 소소한 일상,https://blog.naver.com/hks8934,2021-05-31
[나들이] 고성오미냉면영순네횟집,https://blog.naver.com/kiwiwitch?Redirect=Log&logNo=222015473120,#고성 # 오미냉면#영순네횟집 #회냉면 #물회 #물놀이 #홍합조심 #켄싱턴리조트 #해수사우나 6월 마지막 주 장마가 오기 전 부리나케 강원도 당일치기를 다녀왔다. 7월부터는 분명 사람이 엄청나게... ,키마와 샐리,https://blog.naver.com/kiwiwitch,2020-06-29
고성오미냉면 ,https://blog.naver.com/ssd-2018?Redirect=Log&logNo=222486815724,고성오미냉면 에서 회냉면 먹고 싶어서 고성까지 갔죠 요것만 먹기위해 오기 힘드니 속초 놀러온김에 냉면도 먹기~ 아침 7시 30분쯤 서울에서 출발해서오미냉면도착하니 10시네요 오픈이 10시 30분이라 대기표... ,노을,https://blog.naver.com/ssd-2018,2021-08-28
[고성]오미냉면 ,https://blog.naver.com/gurl1314?Redirect=Log&logNo=222064884584,#강원도 #고성 # 오미냉면다녀온 날 : 2020.07.23 맛있는 녀석들에서 맛있다고해서 찾아옴. 후기에서... #회냉면 둘이 냉면 하나만 주문해서 곱배기로 주문했던 것 같다. 거멍면이 이 집을 특징. 벽에 붙여진대로... ,FLY AWAY,https://blog.naver.com/gurl1314,2020-08-19
"킹크랩, 주문진시장,오미냉면 , 에이프레임카페)",https://blog.naver.com/opiu234?Redirect=Log&logNo=222539625267,친구 커플이랑 여행 일정 겹쳐서 마지막 날에 같이 놀다가 서울 가기루 해서 다 같이오미 냉면 에서 점심 노미뇨미 ~~ 오미~ 오미~~ 마싯는 것 ~ 에이 프레임 카페 view ~ 테라스에서 물~ 멍~ •ᴗ• 커피 다... ,반짝반쨕✨,https://blog.naver.com/opiu234,2021-10-17
고성 아야진 40년전통오미냉면회냉면 맛집 +수육도 맛집,https://blog.naver.com/epilio?Redirect=Log&logNo=222418863264,"저번에 실패하고 돌아온오미냉면드디어 다시 도전해서 성공 우선 도착하면 빠르게 들어가서 예약을 한다 카카오로 알림이 오기때문에 잠시 구경 다니고와도된다 매우 편하다 안내문구 요로코롬 냉육수,온육수... ",나의 이것저것들,https://blog.naver.com/epilio,2021-07-03
[속초/고성/ 오미냉면 ]유명세에 맞게 사회적 거리두기 철저한... ,https://blog.naver.com/426kjj?Redirect=Log&logNo=222235111304,"오랜만에 방문한오미냉면저 은색통이 좀 있다 솔솔 뿌려먹을 백색설탕!오미냉면 은 저렇게 맛있게 먹는 방법이 여기저기 붙어있다! 실패하지 마시고 양 잘조절 하시길! 매월 첫째,셋재 주 수요일은 휴무일!... ",♬콩깍진&흥미정진_kongkkakjin&funmijungjin♬,https://blog.naver.com/426kjj,2021-02-07
카페해변길 +오미냉면 (맛있는 녀석들 냉면집) 아야진해수욕장,https://blog.naver.com/montihr?Redirect=Log&logNo=222057767844,우리가 간날은 사람 없어서 바로 입장(평일이었음) # 오미냉면 메뉴 #오미냉명회냉면 #고성명태회냉면 메뉴는 거의 단일메뉴다. 회냉면 보통 가격 8천원. 곱빼기 9천원. (이집은 명태회 회냉면으로 유명하다고..... ,냠쓰,https://blog.naver.com/montihr,2020-08-11
[강원도고성맛집] 맛있는녀석들 / 고성 오미냉면 ,https://blog.naver.com/limhj6290?Redirect=Log&logNo=221898245626,또가고싶지만 멀다청주 맛집 비슷한곳을 찾아봐야지 #강원도맛집 #고성맛집 #맛있는녀석들맛집 #김준현맛집 #고성 오미냉면#고성냉면맛집 #수육 #명태회냉면 #개인입맛,맛있는 오늘의 블로그,https://blog.naver.com/limhj6290,2020-04-09
(고성맛집)오미냉면 ,https://blog.naver.com/seekhoun?Redirect=Log&logNo=222537232447,바로 # 오미냉면속초에도 유명한 냉면집이 있고 고성에도 맛있는 막국수 집이 많습니다만....오미냉면 에서는 뭐랄까... 간만에 감칠맛 나는 그런 참된 냉면을 느낄 수 있는 그런 집이라고 할까요? ㅋ 순번 대기표.... ,Choi's Life,https://blog.naver.com/seekhoun,2021-10-14
고성 아야진맛집오미냉면먹어봤어요,https://blog.naver.com/moongyul?Redirect=Log&logNo=222343529983,사실 아야진터줏대감 냉면집은 형제식당의 형제냉면이에요.오미냉면 은 45년 전통집이지만 아야진에서는 생긴지 얼마 안된 곳입니다. 남편은 어렸을 때부터 형제냉면을 많이 먹어서오미냉면 을 먹자고... ,하랑루와 부부생활,https://blog.naver.com/moongyul,2021-05-09
속초/고성 회냉면 맛집오미냉면 ,https://blog.naver.com/pjh7974?Redirect=Log&logNo=222172258277,있는오미냉면예전에는 다른 메뉴도 팔았던거 같은데 지금은 일단 회냉면만 메뉴판에 보여서 진돌이랑 회냉면 2개주문! 회냉면 등장 회냉면을 맛있게 먹으려면 양념장 한스푼 크게넣고 설탕 한스푼! 식초와... ,"Now, daily life",https://blog.naver.com/pjh7974,2020-12-13
강원도 고성 맛집 추천 냉면+수육 조합 최고 40년전통 오미냉면 ,https://blog.naver.com/chlanswl4?Redirect=Log&logNo=222489950016,강원도 고성 맛집오미냉면곱빼기와 수육이 나왔다! 냉면 양이 진-짜 많다. 둘이 먹었는데 남겼다ㅜㅜ 곱빼기 말고 보통시켰어도 괜찮았을 것 같다. 수육도 부드럽고 냉면도 맛있다ㅎㅎㅎ 강원도 고성... ,＃daily_쁠희,https://blog.naver.com/chlanswl4,2021-08-31
고성여행 /고성맛집 / 문어와 보쌈 /오미냉면 ,https://blog.naver.com/yuittang1?Redirect=Log&logNo=222045392195,"전통오미 냉면강원 고성군 토성면 아야진해변길 73 수요일 휴무 첫째,셋째주 수요일 휴무 매일 10:30 - 19:30 브레이크 타임 15:00~16:30 평상시 아무것도 안넣어 먹는데 시키는대로 다 넣었다 근데 . . . 면만... ",리니의 행복한 나날들^^,https://blog.naver.com/yuittang1,2020-07-29
"강원도 고성 맛녀석/식객 맛집,오미냉면 ",https://blog.naver.com/h-jeje?Redirect=Log&logNo=222474476934,"덥구, 냉면 훅 땡겨서오미냉면 으로 총총 맛집 웨이팅 살벌하쥬 그래도 이렇게 해주면 넘 편함 : 차에 있다가 가기 40년 전통의 강원도 고성 맛녀석/식객 맛집,오미냉면 !!!! 맛있게 먹는법 정독하고 그렇게... ","춤을 추듯, 제제",https://blog.naver.com/h-jeje,2021-08-18
강원도 고성오미냉면 ,https://blog.naver.com/ioivvvv?Redirect=Log&logNo=222235093453,"고성오미냉면 . 냉면도 맛있지만 수육이 맛있다고 하여 저녁시간에 방문하였으마 재료 소진으로 냉면만 먹었다. 물냉도 아니고 비냉도 아닌 그 중간이며, 자극적이지 않아 생각보다 맛이 괜찮았다. 맛... ",Shall we Study?,https://blog.naver.com/ioivvvv,2021-02-07
2021/08/03 고성여행 :오미냉면 (김현준 냉면 맛집),http://haesaekju.egloos.com/6829422,"맛녀석 냉면편을 보면 김준현씨가 냉면 색깔을 보고는 자기가 아는 냉면집과 갔다고 맞추는 곳이 있는데, 그곳이 바로 고성에 있는오미 냉면 이다. 참고로 여기는 고성 아야진 항구에 있는데, 냉면집 앞에는... ","뒤돌아 보지 않는다, 후회하지 않는다, 길을 만든다.",http://haesaekju.egloos.com/,2021-08-04
맛있는녀석들 냉면 - 시청자추천 냉면맛집 고성오미냉면 !,https://blog.naver.com/kbr10067?Redirect=Log&logNo=221583808987,지난주에 속초에 갔다가 맛있는녀석들 시청자추천 냉면 맛집이 고성에 있길래 아침부터 찾아갔어요~ ^^* 고성오미냉면 은 회냉면이예요. 아바이순대마을에 가서 순대 주문하면 항상 같이 나오는 명태회가... ,세열이 맘의 Story,https://blog.naver.com/kbr10067,2019-07-12
[강원도 고성] 오미식당 /오미냉면/ 오미면옥 (분점),https://blog.naver.com/langklee2?Redirect=Log&logNo=221630053781,분점이라고 맛이 떨어지거나 질이 안좋다는 느낌은 전혀 없었습니다! 다음부터는 저도 분점으로 가서 먹어야겠어요! 여러분도오미 면옥 분점에서냉면한그릇 어떠세여??,한증막 속 냉수마찰 *,https://blog.naver.com/langklee2,2019-08-27
고성 아야진 맛집 :오미냉면 ,https://blog.naver.com/bsb7411?Redirect=Log&logNo=221273642746,"여기까지 고성 아야진 맛집오미냉면 에서의 어느 저녁이었어요. 숙소에서 가까이 있는 냉면집이 꽤 괜찮다고 하여 방문했는데, 동네 어귀의 오래된 냉면집인가 했더니 생각보다 괜찮더라고요. 저희처럼... ",Blaack Log,https://blog.naver.com/bsb7411,2018-05-12
고성 맛집오미냉면/40년 전통 고성 아야진 냉면,https://blog.naver.com/kirara1974?Redirect=Log&logNo=221312916833,고성 아야진 냉면 맛집오미냉면강원 고성군 토성면 아야진해변길 73 / 033-633-4598 영업시간 - 10:30 ~ 21:00(여름) / 11:30 ~ 20:00(겨울) 동생들이랑 속초 펜션 까사델아야에 갔다가 https://blog.naver.com/kirara1974... ,만드나마나 시즌2,https://blog.naver.com/kirara1974,2018-07-06
고성군 40년 전통의오미냉면 ,https://blog.naver.com/happy-goseong?Redirect=Log&logNo=221270698329,메뉴 냉면! 오늘은 고성군에 자리잡아 40년 전통을 이어가는오미냉면 집을 소개합니다! 간단하지만 한번... 비주얼이 오미오미오미합니다 ㅋㅋㅋㅋㅋ 양도 두둑하고 계란으로 위보호 들어가고 위에 제조법으로... ,강원도 고성군청,https://blog.naver.com/happy-goseong,2018-05-08
맛있는녀석들 고성오미냉면재방문할래,https://blog.naver.com/ynu0363?Redirect=Log&logNo=221577939046,알고 보니 맛있는녀석들에서 나온오미냉면집을 가자는 것이였음오미냉면 은 고성에 있는 냉면집으로 사람이 무척 많아서 표 받아서 기다려야했다. 다행이도 꼬비가 징징거리지 않고 차분히 엄마아빠를 위해서... ,핑크중독,https://blog.naver.com/ynu0363,2019-07-04
속초 고성오미냉면/ 살벌한 후기,https://blog.naver.com/lean365?Redirect=Log&logNo=221471109522,이렇게 생각하실 수도 있어요~~ 냉면에 설탕을 듬뿍처서 먹는 냉면입니다! 새콤담콤한오미냉면포스팅 끝! 냉면을 좋아하지 않는 사람도 반해버린 냉면맛집!! (체인점 내고 싶다...^^),공부하는 트레이너,https://blog.naver.com/lean365,2019-02-21
강원도 고성오미냉면 . 인생비냉 등극한 맛있는녀석들 회냉면,https://blog.naver.com/ok3171?Redirect=Log&logNo=221648400575, 오미냉면아야진항구 근처에 있는오미냉면 . 회냉면을 메인으로 하는 맛녀석들 맛집입니다. 저희가 도착했을때는 한시 가까이 됐는데 대기가 좀 있나보다 싶었더니 무려 13팀! 명단에 올려놓고 자리를 뜬 분들도... ,맛있는 상상이 몰려온다,https://blog.naver.com/ok3171,2019-09-15
속초 고성 냉면맛집추천오미냉면 !,https://blog.naver.com/minze0216?Redirect=Log&logNo=221018354669,이젠 아시겠죠??^^ 5가지의 맛을 느낄 수 있는 속초고성냉면맛집~오미냉면 !! 그 쪽으로 여행가실 분들께 꼭 한번 가보시라고 권하고 싶네요~^^ (전 절대로!!오미냉면 에서 돈받은거 없습니다..ㅋㅋㅋ 제 돈주고... ,고품격 예물 브랜드 안나로니,https://blog.naver.com/minze0216,2017-05-31
인천 냉면 맛집 육전냉면과 수제왕만두 오미 오미냉면 ,https://blog.naver.com/choyk3?Redirect=Log&logNo=221513698958,오미 오미냉면 손만두의 육전 비빔냉면. 오미 오미냉면 손만두의 육전물냉면 냉면 위에 육전이 올라가 독특했고 야채가 얇게 썰려 있어 면과 먹기 좋게끔 나와요. 수제 왕만두와 냉면을 함께 먹으면 부드러운... ,닻별이의 탐구생활,https://blog.naver.com/choyk3,2019-04-15
 오미냉면:: 강원도 고성 아야진해변 냉면맛집 초간단 리뷰!!,https://blog.naver.com/love_ey1234?Redirect=Log&logNo=221580260939,오이냉면??” 동생-“아니오미냉면 !!” 부모님-“오이냉면?” 동생-“(답답)아니 오미!!” 고고띵오미냉면 은 아야진 해변 외곽쪽?으로 쭉 들어가다보면 있는데 위치는 포스팅 맨 윗줄에 있당 3대가... ,계절의 흐름이 좋아요,https://blog.naver.com/love_ey1234,2019-07-08
"맛있는 녀석들에 나온 고성군 아야진맛집,오미냉면맛 보았어요",https://blog.naver.com/rem85?Redirect=Log&logNo=221607078543, 오미냉면냉면 맛있게 먹는 방법 1.양념장 한스푼정도 2.설탕 한스푼 3. 식초와 겨자는 조금 넣는다. 4. 육수는 면에 중간정도 붓는다. 5. 젓가락을 양손에 잡고 잘 비벼서 드시면 됩니다. 6.마지막으로... ,토리♥구리,https://blog.naver.com/rem85,2019-08-06
인천 논현동냉면오미오미 에서 입맛 회복했어요,https://blog.naver.com/justpar?Redirect=Log&logNo=221292183244,"비냉 비쥬얼 하악ㅋㅋㅋㅋㅋㅋㅋㅋㅋㅋㅋㅋㅋㅋ 냉면은 물냉, 비냉 다 맛있지만 요즘 비냉에 꽂혀가지궄ㅋㅋㅋㅋㅋㅋ 오미 오미 냉면 은 배와 오이를 면처럼 가늘게 채져서 씹는 식감이 더욱 좋구요 가느다란 면... ",Bling J,https://blog.naver.com/justpar,2018-06-05
인천 논현역 맛집 : 오미 오미 냉면손만두 국물이 끝내줘요~,https://blog.naver.com/jjmami?Redirect=Log&logNo=221551801259,"육전 냉면 정말 궁금합니다. 다음에 육전 냉면 먹으러 꼭 다시 와야할 오미 오미 냉면 , 손만두전골 맛집입니다.인천 논현역 맛집: 오미 오미 냉면 손만두 032-431-6555 인천 남동구 소래역로 36 오전 11시~ 오후 9시","베리네집..송도댁의 송도 일상,맛집,송도국제도시",https://blog.naver.com/jjmami,2019-06-01
[인천 논현역 맛집] 오미 오미 냉면 손만두에서 정성가득 한끼,https://blog.naver.com/wldnjs10?Redirect=Log&logNo=221497475408,"오미 오미 냉면 손만두의 냉면이 특별한 이유. 냉면 위에 육전이 올라가 있습니다. 우와, 정말 너무너무너무너무너~~무 맛있어요. 냉면과 육전의 조합이라니! 냉면도 쫄깃쫄깃 너무 맛있어요. 우리 아이도 거의 한... ",소소한 행복 :),https://blog.naver.com/wldnjs10,2019-03-26
"아야진 맛집 :: 맛있는 녀석들 고성 냉면, 40년 전통의오미냉면 ",https://blog.naver.com/weeeunjee?Redirect=Log&logNo=221599982593,ㅎㅎㅎㅎㅎ 세로 사진으로도 한 장~~ 남편이 입고 있는 티셔츠가 마치 배경색 같다ㅎㅎㅎ 아야진 맛집오미냉면냉면 면발은 이태껏 봐왔던 냉면들 면발보다 색이 저 짙은 느낌이었다. 오이 고명 너무 과하지... ,로폰의 즐거운 하루 :),https://blog.naver.com/weeeunjee,2019-07-30
[인천논현동] 인천 논현역 맛집 '오미 오미냉면 손만두... ,https://blog.naver.com/inileunji?Redirect=Log&logNo=221521368048,"2019년 4월 23일 2번 인천 논현역 맛집 만두전골육전냉면 오미 오미 냉면손만두♬ 한달에 한번씩은 가는거 같은 친척언니네 ㅋㅋㅋㅋㅋ 인천으로 오니까 자주가는거같다 만나면 맛집도 갈수 있고, 같이 술도... ",귀염둥이쪼♥,https://blog.naver.com/inileunji,2019-04-24
소래포구역 바로 앞 '오미 오미 냉면 손만두' 만두전골 굿!,https://blog.naver.com/kcl2104?Redirect=Log&logNo=221572201456,인천 남동구 맛집 오미 오미냉면 손만두 만의 비밀레시피 이신듯!ㅎㅎ 옆쪽에는 수저와 티슈 그리고 냉면자르는 가위까지 깨끗하게 준비되어있어서 참 좋았어요 그리고 주문한 비빔냉면이 나왔습니다!! 육전이... ,사랑하는중입니다,https://blog.naver.com/kcl2104,2019-06-27
인천 논현역 맛집 오미 오미 냉면 손만두 푸짐하고 저렴해서... ,https://blog.naver.com/yisolmam?Redirect=Log&logNo=221519608869,맛있는 냉면집 미리 알아두는 것도 필수!! 오미 오미 냉면손만두는 오전 11시 ~ 오후 9시 까지 영업해요. 연중 무휴라 언제든지 찾아가볼수 있답니다~ ^^ 인천 논현역 맛집 오이 오미 냉면 손만두.. 오미오미 이름이... ,소리수와 함께..,https://blog.naver.com/yisolmam,2019-04-22
강원도 고성 맛집오미냉면다시 찾고 싶은 맛집오미냉면 ... ,https://blog.naver.com/lotto3181?Redirect=Log&logNo=221630963994,매콤한 오미회냉면을 먹고 나서 요요 ~ 온냉면 육수를 한 모금 마시는 순간에 온몸이 개운하면서도 시원하니 정말 기분 짱이었습니다.ㅎㅎ 드셔 보신 분들은 이 기분 잘 아실 거예요?오미냉면메뉴판입니다.... ,♡ 김하늘의 살아가는 인생 이야기..,https://blog.naver.com/lotto3181,2019-08-28
시원한 냉면이 땡길땐? 오미 오미냉면 손만두 소래포구점,https://blog.naver.com/harunoame?Redirect=Log&logNo=221290784079,"다 먹고나니 배가 터지는 줄 ㅎㅎㅎ 여름철에 만나는 메뉴 냉면, 오미 오미냉면 손만두 소래포구점에서 시원하게 맛보시길 추천해요!인천광역시 남동구 소래역로 36 오미 오미냉면 손만두 소래포구점",따뜻한 팔레트,https://blog.naver.com/harunoame,2018-06-03
강원도 고성군 맛집 ' 오미냉면 ' ♩,https://blog.naver.com/doggoki?Redirect=Log&logNo=220779084337,"'회냉면' 이에요~ 회를 바로 쳐서 먹는 회로만 먹는 저는.. 처음엔 도저히 상상안가던 그 맛, 그 조합;;;;... 참고하세요 여기오는 사람들이 제일많이 헤메이는오미냉면먹는방법 ~ 물냉 비냉 그런거 없어요, 육수... ",군인보다 더 군인같은…그녀's STORY,https://blog.naver.com/doggoki,2016-08-04
인천 논현동냉면-소래포구냉면맛집 :오미오미육전 냉면 ... ,https://blog.naver.com/pria6812?Redirect=Log&logNo=221296981748,ㅋㅋ #인천논현냉면맛집#소래포구냉면맛집#소래포구냉면#냉면맛집#오미 오미냉면 #오미오미#오미오미왕만두#왕만두#고기만두#김치만두#소래포구냉면#인천냉면맛집#고급냉면#부모님과외식#인천논현동냉면... ,러블리홈♡,https://blog.naver.com/pria6812,2018-06-12
