title,link,description,bloggername,bloggerlink,postdate
최자로드로 유명한 익선동 맛집오죽이네 에서 닭매운탕... ,https://blog.naver.com/ryohe44?Redirect=Log&logNo=222448726369,평소 가보고 싶었던 최자로드 최자맛집으로 유명한 익선동 맛집오죽이네다녀왔어요.오죽이네 는 닭매운탕으로 유명한 식당인데요. 보통의 닭볶음탕보다 국물이 많고 매운 음식이에요! 맵칼한 국물음식 생각날... ,SPACE UNION,https://blog.naver.com/ryohe44,2021-07-28
종로3가역 익선동 찐 맛집오죽이네| 존맛 닭매운탕,https://blog.naver.com/sta_r_im?Redirect=Log&logNo=222418128096,"아름언니랑 윤희랑 익선동 데이트 언니가 요즘 자주 가는 찐 맛집이 있다고 해서 종로3가역 익선동 맛집,오죽이네 에 다녀왔다오죽이네본점은 종로3가역 6번 출구와 가까웠고 우린 본점을 이용했다 새로... ",⋆ ﾟ☽ ⋆,https://blog.naver.com/sta_r_im,2021-07-02
 오죽이네종로3가맛집 닭매운탕,https://blog.naver.com/hsn7087?Redirect=Log&logNo=222315231701, 오죽이네종로3가맛집 닭매운탕 서울 종로구 돈화문로 11가길 25 ☎ 02-741-8874 평일 11:30 ~ 22:00 평일... 맛집인오죽이네포스팅이에요 이미 최자 맛집으로도 유명한 이곳 골목에 들어서면 위치해있는오죽이네 ... ,"먹고,놀고,뭐,재미지게 사는 중",https://blog.naver.com/hsn7087,2021-04-19
주말 일상_ 오죽이네 +포포인츠바이쉐라톤,https://blog.naver.com/cdb1063?Redirect=Log&logNo=222374092807,친구가 추천한오죽이네 는 꽤 유명한 맛집인 것 같았다. 웨이팅이 길어질 것을 고려해 2안 3안까지 마련해두고 퇴근 후오죽이네 로 집결했는데 생각보다 금방 자리가 났다. 앞의 네 팀 정도가 기다리는 것을... ,꿀비의 취향 수집장,https://blog.naver.com/cdb1063,2021-05-29
종로 맛집오죽이네닭매운탕 종로3가,https://blog.naver.com/newnu9?Redirect=Log&logNo=222380877669,종로 맛집오죽이네닭매운탕 종로3가 작년에 다녀온 후기를 이제야 올립니다 ;;ㅋㅋ 맛있다는 이야기를 엄청 들어서 다녀왔던 종로 맛집오죽이네닭매운탕이라는 제게는 생소한 메뉴였는데요 종로3가... ,뉴누9 ☆ 새롭게 건강하게 아름답게,https://blog.naver.com/newnu9,2021-06-02
[익선동] 최자로드 맛집. 닭매운탕오죽이네 ,https://blog.naver.com/skfk2574?Redirect=Log&logNo=222368150957, 오죽이네한 2년 전에 방문했었던 닭매운탕전문점오죽이네요근래에 최자로드에 나와 다시 핫해졌다고하던데 이번에 방문해보니 별관도 생겼더라구요? 평일 저녁에 방문했더니 역시나 웨이팅이던오죽이네 ... ,이청순님의 블로그,https://blog.naver.com/skfk2574,2021-05-26
익선동맛집 최자로드 닭매운탕 내돈내산:오죽이네 ,https://blog.naver.com/tame789412?Redirect=Log&logNo=222415052993,안녕하세요 율이에요੭ ᐕ)੭ 지인한테 익선동 맛집을 추천받고 # 오죽이네를 가게되었습니다... 그리고 마지막에오죽이네꿀팁이 있으니 꼭 끝까지 읽어주세요! https://youtu.be/lE7XFmWGXDA오죽이네서울 종로구... ,즐거워라 율일상,https://blog.naver.com/tame789412,2021-06-30
[직장인맛집]오죽이네 ,https://blog.naver.com/luna2803?Redirect=Log&logNo=222424752511,익선동 하면오죽이네 였다. 내 동년배들 다오죽이네좋아한다. 진짜 맛있음.. 진짜 엄청 너무 수제비 최고.. 여기 무조건 소주. 양파 짱맛탱임. 볶음밥 미친..도라쨩임 진짜 제발 다들 꼭 오기로 약속,홍말랑의 지구생활,https://blog.naver.com/luna2803,2021-07-08
[서울종로구맛집/종로3가맛집/익선동맛집] 오죽이네 ... ,https://blog.naver.com/dnr6578?Redirect=Log&logNo=220891141434,저희가 찾아간 곳은 종삼의 삼겹살골목에 있는오죽이네입니다. 메인은 닭매운탕이고 옻닭도 있고 특이하게 쭈꾸미를 취급하시네요. 저희는 닭매운탕 소(21000)에 수제비사리(1000) 추가. 별 맛은 없었던... ,금군의 미각은 나의 힘,https://blog.naver.com/dnr6578,2016-12-24
복날에 예약! 종로 맛집오죽이네 ,https://blog.naver.com/k546?Redirect=Log&logNo=222359167244,"바로 최자가 추천한 그곳,오죽이네 입니다.오죽이네 는 닭 요리를 전문으로 하는 식당이에요. 사실 생간지는 얼마 안됐는데 짧은시간 핫해진걸 보면 그만큼 맛있다는 반증이겠죠?? 사실 이곳은 종로쪽 좁은... ",후기 알려드리는 후기우기,https://blog.naver.com/k546,2021-05-20
종로 익선동오죽이네 ,https://blog.naver.com/r0h2d22?Redirect=Log&logNo=222371988616,"출처오죽이네저희는 닭매운탕 소, 우동사리추가 했어요. 생긴거 보고서는 그냥 평소에 먹던 닭볶음탕이랑 비슷하겠지? 싶었거든요. 물닭갈비 같기도 하고~ 근데 한입 먹어보고 둘 다 헐....맛있다ㅇ_ㅇ;;;; 했음..... ",트리네 마당,https://blog.naver.com/r0h2d22,2021-05-28
익선동 대표 맛집 술집 최자로드오죽이네 ,https://blog.naver.com/chenzzi92_?Redirect=Log&logNo=222378040153, 오죽이네종로오죽이네위치 서울 종로구 돈화문로11가길 25 종로3가역 6번 출구에서 156m 영업 시간 월-금요일 11:30-22:00 평일 브레이크 15:00-16:00 토요일 12:00-22:00 공휴일 영업 일요일 휴무 #내돈내산 리뷰... ,Dear Yeonsu,https://blog.naver.com/chenzzi92_,2021-06-01
종로3가 익선동 맛집 [오죽이네: 최자로드에 나온 닭 매운탕 !],https://blog.naver.com/seraph00000?Redirect=Log&logNo=222427522479,유명해진오죽이네 . 여기선 닭볶음탕이 아닌 닭매운탕이라고 부르고 있습니다. 아마 쫄이지 않고도... 개인적으로 계림닭도리탕과 비교하자면오죽이네 가 매콤함이 더 강하고 간도 쎈거 같아요. 닭크기는 별... ,Everything is connected….,https://blog.naver.com/seraph00000,2021-07-11
 오죽이네닭매운탕 : 익선동 맛집,https://blog.naver.com/tnroddl7321?Redirect=Log&logNo=222356915412,오늘은 종로맛집으로 유명한오죽이네다녀왔는데 익선동맛집골목들과 아주 가깝게 위치하고 있어서 한식이 드문 익선동 맛집 하면 좋겠다 ㅋㅋㅋ 종로3가역 6번 출구와 아주 가까움 !오죽이네 가... ,순간을 기록하는 사유지,https://blog.naver.com/tnroddl7321,2021-05-19
[종로3가 최자로드 최자맛집 닭매운탕]오죽이네 ,https://blog.naver.com/hanjihwa960115?Redirect=Log&logNo=222391463602,#최자로드 나온 #최자맛집 #닭매운탕 # 오죽이네이 영상보고 너어무 가보고 싶었던 찰나에 칭구가... 맛업떠오죽이네 가 신관도 생겼더라구요 아마도 최자로드 나오고 손님이 많아져서 그런듯! 우리는 웨이팅이... ,화블로그,https://blog.naver.com/hanjihwa960115,2021-06-09
종로 최자로드- 오죽이네 ) 술맛을 술술 돋궈주는 닭매운탕굿굿!!,https://blog.naver.com/justin1609?Redirect=Log&logNo=222410799515,닭매운탕이라며 최자가 너무 맛있게 먹었다며 꼭 가야한다해서오죽이네(구관)에 갔다.오죽이네(구관) 서울 종로구 돈화문로11가길 25 종로3가역 6번출구 156m 평일 11:30-22:00 토요일 12:00 - 22:00 / 일요일 휴무... ,MondMorang,https://blog.naver.com/justin1609,2021-06-26
[익선동] 맛집오죽이네 ,https://blog.naver.com/bo_1203?Redirect=Log&logNo=221949424303,반가운 것도 반가운거지만 일단 밥부터 먹자 싶어 인사는 뒷전오죽이네 부터 갔다ㅋㅋㅋㅋㅋㅋㅋㅋㅋ J는 예대라서 재료 구매 때문에 자주 인사동에 오고가고 한다고 그래서 알게 된오죽이네인데 한번도... ,moon_daily,https://blog.naver.com/bo_1203,2020-05-08
"7월 일상 (16일~19일 이치젠, 돝고기506,오죽이네 , 감꽃당)",https://blog.naver.com/suminizee?Redirect=Log&logNo=222444373033,무튼 배고파서 익선동오죽이네 를 갔다. 내가 찾은 최자로드 닭볶음탕 맛집!! (사실 내가 닭볶음탕 좋아해서 애들을 꼬드겼다. 근데 맛있었당 인정?) # 오죽이네닭매운탕 중자 + 볶음밥을 시켰다. 진짜 맛있었다.... ,수민이의 하루,https://blog.naver.com/suminizee,2021-07-24
2021 2월: 종로3가 닭매운탕전문오죽이네 ,https://blog.naver.com/minji0_0sim?Redirect=Log&logNo=222250824593,종로3가의 닭도리탕 골목을 격파하는중 최자로드에 나와서 너무 가고싶었던오죽이네 ! 유튭에...오죽이네 는 저녁에도 볶음밥이 주문 가능해서 넘 좋았따... 이것이 바로 K-철분 역시 마무리는 눌러붙은... ,민지심의 카메라롤,https://blog.naver.com/minji0_0sim,2021-02-21
 오죽이네 ,https://blog.naver.com/lbd5353?Redirect=Log&logNo=222377683765,은혜로운 곳 그리고 사장님이 추천해주신 # 오죽이네종로3가 뒤에 이런데가 있는 줄은 몰랐네?... 좀 더 들어가보면오죽이네 !! 우리는 월요일 6시 반쯤 갔는데도 이미 만석에 웨이팅 20분 정도? 메뉴는 이렇게... ,lbd5353님의 블로그,https://blog.naver.com/lbd5353,2021-05-31
익선동 맛집오죽이네최자로드 맛집,https://blog.naver.com/tjals1253?Redirect=Log&logNo=222353332344,익선동 ::오죽이네평일 11:30 ~ 22:00 (15:00 ~ 16:00 브레이크타임) 토요일 12:00 ~ 22:00 (일요일 휴무) 안녕하세요 미니랜드 입니다 :) 오늘은 저번달에 웨이팅이 넘 길어서 포기했던오죽이네 를 다시 다녀와서... ,"every day, every moment",https://blog.naver.com/tjals1253,2021-05-16
[20210602] 종로 익선동오죽이네 ,https://blog.naver.com/93097?Redirect=Log&logNo=222381292252, 오죽이네서울 종로구 돈화문로11가길 25 영업시간 평일 11:30 - 22:00 평일 break time 15:00 - 16:00 토요일 12... 한 입 국물 한 입 금상첨화 ㄲㅑ 전 날 과음하신 분들오죽이네가세효 해장 지대로#오늘일기 #블챌,얌얌 블로그,https://blog.naver.com/93097,2021-06-02
종로구 익선동│ 오죽이네 ,https://blog.naver.com/gooodvin?Redirect=Log&logNo=221311841909,"곳으로오죽이네닭매운탕 / 닭한마리 전문점이라고 간판에 쓰여있었는데 닭 한 마리보다는 거의... 차례 밥 볶기 전 덜어뒀던 국물이랑도 진하게 먹으니 맛! 있다 크하, 역시 국물 +_ +오죽이네닭매운탕 맛있다",뭐랄까,https://blog.naver.com/gooodvin,2018-07-03
●종로3가/ 익선동 맛집 -오죽이네신관,https://blog.naver.com/hjun6450?Redirect=Log&logNo=222351208808,익선동에서도 유명한 닭매운탕집인 오죽이가 신관이 생겨서 방문해봣어요오죽이네본점은 전에 친구랑 방문후 소주 한병 까면서 맛잇게 먹엇던 기억이ㅋㅋㅋㅋ 종로3가역에서도 더 찾기 쉬어진 신관을... ,햠로리의잡동사니,https://blog.naver.com/hjun6450,2021-05-14
"[익선동] 미담헌카페,오죽이네 ",https://blog.naver.com/rimrime_e?Redirect=Log&logNo=222331455691,먹던오죽이네 가 생각나서 애들한테 닭매운탕 먹자고 꼬셨다 ㅎㅎ 일부러 이른 저녁에 갔는데 웨이팅... 하나였던오죽이네확장이전 전에 작은 식당일 시절 첫 회식을오죽이네 에서 했는데 완전 놀래서 기절할... ,혜리미의 일상기록 ʚ◡̈ɞ,https://blog.naver.com/rimrime_e,2021-05-01
[익선동/종로] 오죽이네 ,https://blog.naver.com/hyeajin93?Redirect=Log&logNo=222375883881, 오죽이네주말 짧은 근무 후 금요일에 갈까 하다가 귀찮아서 주말에 가기로 미뤘던 곳 가기로해서 익선동 고고링 익선동 얼마만이냐 ㅋㅋ거의2년만에 가는듯 메뉴판 닭매운탕 소/ 우동사리 고기를 좋아하면... ,찐빵이의 놀고 먹는 기록,https://blog.naver.com/hyeajin93,2021-05-30
Oh!죽이네( 오죽이네 ) 월곡 죽집,https://blog.naver.com/wonderful615?Redirect=Log&logNo=222330743905,본죽과오죽이네중 더 가까운오죽이네 로 갔다. 죽집 안으로 들어서니 흔히 생각했던 죽집 인테리어가 아니라서 조금 신기했다. 인테리어만 보면 죽집보단 카페같았다.오죽이네메뉴판 혼자 갔어서 그런지... ,Minimal Life,https://blog.naver.com/wonderful615,2021-05-01
종로3가역 익선동 추천 코스 :오죽이네- 인생네컷 -마당공간,https://blog.naver.com/wjm223?Redirect=Log&logNo=222362666194,"만장일치로오죽이네 로 돌진 ! 미리 도착한 친구들덕분에 오래 기다리지 않고 들어갈 수 있었어요 가게 규모도 크고 만석이더라구요오죽이네메뉴 우리는 여자 4명 , 닭 매운탕 중독자 의 우동 사리 하나 추가... ",지구별 여행중,https://blog.naver.com/wjm223,2021-05-23
종로(익선동) -오죽이네 ,https://blog.naver.com/siginjong84?Redirect=Log&logNo=222341397391,#종로 #익선동 #닭도리탕 을 먹으러 왔다 찾긴 어렵지 않다 #갈매기살 골목 이여서 쉽게 찾았다 # 오죽이네이거 띄어쓰기 하나로 의미가 달라지겠는걸..오죽이 네 .. 오!!죽이네!! 과연 뭘까.? 모두 웨이팅을 하면서... ,한량박,https://blog.naver.com/siginjong84,2021-05-07
닭매운탕 맛집 익선동오죽이네리뷰,https://blog.naver.com/rgbnmv?Redirect=Log&logNo=222326979724,익선동오죽이네리뷰를 해보려고한다 ㅎㅎ 사실 나는몰랐는데 초코가 여기 유튜브에서 유명한 맛집이라고 해서 알게됨 ㅎㅎ (최자로드에서 최자가 강력추천한 곳이라구함!)오죽이네서울 종로구... ,꿈많은 직장인의 일상생활,https://blog.naver.com/rgbnmv,2021-04-29
종로 / 익선동 닭매운탕 맛집오죽이네 ,https://blog.naver.com/8088029?Redirect=Log&logNo=222343571017,반차내고 친구들이랑 종로에서 만나 어디갈까 고민하다가 익선동 최자 맛집이라는 닭매운탕집오죽이네 를 다녀왔다비오는 날씨라 분위기가 어두컴컴해서 똑땅익선동오죽이네평일 11:30 - 22:00 평일... ,Mu and off,https://blog.naver.com/8088029,2021-05-09
익선동 닭매운탕 맛집오죽이네 ,https://blog.naver.com/thgus245?Redirect=Log&logNo=221501377698,"닭매운탕 맛집,오죽이네저번에는 사람이 너무 많아서 포기했던 곳. 오늘은 날씨도 좋지 않았고... 듯 맛있는데 너무 매워서 물로 배를 채운 듯ㅠㅠ #익선동 #익선동맛집 #닭매운탕 #수제비사리 #종로맛집 # 오죽이네 ",가로냥의 일상 이야기♬,https://blog.naver.com/thgus245,2019-03-30
"어제 일기 최자로드오죽이네 , 커피한약방 혜화점",https://blog.naver.com/wlgnsdbsl?Redirect=Log&logNo=222367752807,다행쓰 친구랑 뿌시고 온 최자로드오죽이네 . 진짜 맛있음...!! 소주 안먹는 나도 소주가 땡기는 맛..!!!... 여기도 재방문 의사 100% 오늘 방문한 곳들은 다 핵 맛집이였다..!! #블챌 #오늘일기 #커피한약방 # 오죽이네 ,리리의 기록,https://blog.naver.com/wlgnsdbsl,2021-05-26
[후기]오죽이네익선동닭매운탕 최자맛집 내돈내산 솔직후기,https://blog.naver.com/yooffy?Redirect=Log&logNo=222365276319,식당리뷰오죽이네#내돈내산 지난 주말 등산 후 다녀온오죽이네익선동 닭매운탕 최자맛집... 이라고 유명한 식당 후기입니다. 골목으로 진입오죽이네오죽이네오죽이네간판 사실 저는 애매한... ,일상의 취향,https://blog.naver.com/yooffy,2021-05-25
익선동 맛집 강추오죽이네 ~!,https://blog.naver.com/wkdtndpdb610?Redirect=Log&logNo=222360106947,맛집 # 오죽이네#닭 매운탕 #볶음밥 #라면사리 안녕하세요! 오늘은 진짜 찐 맛집을 찾아서 이건 도저히 혼자 알고 있기엔 아까운 곳이라 소개해드릴까 합니다. 바로오죽이네 라는 닭 매운탕 집인데요 위치는 바로... ,시골닝겐의 취업일기,https://blog.naver.com/wkdtndpdb610,2021-05-21
[ 오죽이네 ] 종로 최자 닭매운탕 맛집오죽이네 ,https://blog.naver.com/5119937?Redirect=Log&logNo=222424331751,종로 맛집 :: 오죽이네 :: 을지로 맛집을 찾다가 발견한오죽이네 ! ‘오죽’이네 일까 오~죽이네 일까? 머가 중요하냐 닭매운탕 ! 맛있겠다 정말 오픈하자마자 가서 사람이 없었다 ㅋㅋㅋㅋ 이렇게 먹으면... ,매일이행복하지yo!,https://blog.naver.com/5119937,2021-07-08
"익선동 나들이(엘리,오죽이네 , 마당)",https://blog.naver.com/todtlr920?Redirect=Log&logNo=221369142138,익선동에 갔습니당 목표는오죽이네오~ 죽이네!! ..... 흠흠 먼저 엘리 카페 예쁩니다 홍홍 노랑노랑 한옥한옥 오렌지 착즙쥬스 6500원 다음은... 닭매운탕 집 5...!! 죽이네!!! 키야아!!! 메뉴판사진 없습니당... ,일상,https://blog.naver.com/todtlr920,2018-10-01
