title,link,description,bloggername,bloggerlink,postdate
최자로드에소개된 닭매운탕집 오죽이네 ,https://blog.naver.com/hm0516s2?Redirect=Log&logNo=222464411728,이날따라 한식이 끌려서 전날 뭐먹을지 미리 찾아보고 가게된 # 오죽이네나는 몰랐는데 탱말로는... (결혼해 둘이.) 여러분오죽이네 에서 닭매운탕을 드신다면 우동사리와 공깃밥은 필수라는거 진짜... ,ღTodayday 일상로그ღ,https://blog.naver.com/hm0516s2,2021-08-10
점심시간-닭볶음탕(종로3가오죽이네 ),https://blog.naver.com/behappy0809?Redirect=Log&logNo=70134376201,"이름은오죽이네 .. 위치는... 아주 구석에 있어서 아는 사람만 찾게되는 곳. 지도 필히.. 잘.. 참고~~ ^^;;; 점심메뉴 쭈꾸미 백반, 쭈삼백반을 애용했던.. 옆테이블에 먹고 계신. ㅋ 라면사리를 넣어서 먹음..더 더... ",바네사스타일,https://blog.naver.com/behappy0809,2012-03-23
종로 닭매운탕( 오죽이네 ),https://blog.naver.com/wine1218?Redirect=Log&logNo=222465849975,"오늘은 분기마다 한번씩은 방문하는 서울 종로구 원탑오죽이네 !! 바로 소개 들어갑니다!! GO! 1,닭매운탕(소)25,000원오죽이네대표메뉴!! 닭매운탕!! 때갈 장난아니죠!! 참고로 무조건 칼국수 추가!!입니다! 면을... ",걸어서 맛의 세계로..,https://blog.naver.com/wine1218,2021-08-11
종로 닭볶음탕 맛집/ 익선동오죽이네 / 닭매운탕 냠냠,https://blog.naver.com/j1993220?Redirect=Log&logNo=222322330073,퇴근하고 맛있는거 먹기로 한 날은 아침부터 행복♥️♥️♥️♥️ 이 날 저녁은 너무너무 가보고싶었던 # 오죽이네#익선동 오죽이네익선동 골목 안쪽에 위치한오죽이네6시반 넘어서 갔더니 대기인파가... ,밍콩은 밍콩밍콩해,https://blog.naver.com/j1993220,2021-04-25
"좋은 닭도리탕 맛집 오죽이네 ,삼청동 루프탑카페아원공방방문기",https://blog.naver.com/thgus_94?Redirect=Log&logNo=222532775809, 오죽이네서울 종로구 돈화문로11가길 25 02-741-8874 평일 11:30 - 22:00 평일 브레이크 15:00-16:00 토요일 12:00... 네이버 지도 봐가며 우여곡절 끝에 찾은오죽이네골목안에 있고 규모갸 상당히 컸음 목요일 저녁... ,▷ 효니의 즐거운 Daily Life ◀,https://blog.naver.com/thgus_94,2021-10-10
[익선동/종로3가역] 최자로드 닭매운탕 맛집“ 오죽이네 ”,https://blog.naver.com/clavie55?Redirect=Log&logNo=222486404140, 오죽이네소주 도둑 닭매운탕 맛집 ✔️5점 만점에 4.5점✔️ • 익선동 웨이팅 맛집 • 회식 장소로... 유명한 # 오죽이네최자로드 맛집으로도 유명하다 오다가다 보면 항상 웨이팅이 있던 곳인데 오빠랑... ,지극히 평범한 일상,https://blog.naver.com/clavie55,2021-08-28
익선동 맛집:오죽이네닭매운탕,https://blog.naver.com/assumes?Redirect=Log&logNo=221842755660,"익선동의 원조맛집오죽이네 를 다녀왔습니다. 종로에서 회사생활했던 지인의 소개로 알게 된 식당이에요.오죽이네가격, 닭매운탕 소자가 25000원입니다. 칼국수 추가해서 먹으면 여자 3명이 먹을 수 있는... ",따뜻한 기록,https://blog.naver.com/assumes,2020-03-08
[익선동/종로 맛집]최자로드 맛집오죽이네내돈내산후기... ,https://blog.naver.com/lse8267?Redirect=Log&logNo=222485901049,ㅋ오죽이네내돈내산 후기 바로 보러 가실게요! 비오는 날 화요일 동기들과 실습끝난 기념으로 서로... 있잖아요오죽이네 에 전문가가 있다면 사장님이겠죠 그럼 맛있게 먹는법도 진짜 맛있게 먹는법 일것이기... ,송이 또! 블로그,https://blog.naver.com/lse8267,2021-08-27
"맵찔이 주제에 빨간 국물이 땡길 때 - 심원,오죽이네 ",https://blog.naver.com/rhtnfksgl?Redirect=Log&logNo=222475803462,"우리 자매가 사랑해 마지않는 #닭볶음탕맛집오죽이네 ! 얼마 전에 말복이었어서 말복 기념으로오죽이네닭볶음탕을 먹었다. 평소 먹던대로 떡 사리, 수제비 사리, 칼국수 추가해서 테이크아웃해 옴! 사리들을 꼭... ",냠냠 모구모구,https://blog.naver.com/rhtnfksgl,2021-08-23
최자로드 닭매운탕 종로3가맛집오죽이네다녀왔어요!,https://blog.naver.com/hijong2_eu?Redirect=Log&logNo=222472187397,"종로3가오죽이네다녀왔어요! 저는 닭매운탕이라는 요리를 처음 접해봤는데요! 닭은 치킨, 삼계탕, 닭도리탕, 닭갈비로만 먹다가 닭매운탕이라는 새로운 경험을 하고 왔어요!오죽이네방문하던 날은 날씨가... ",Once a week,https://blog.naver.com/hijong2_eu,2021-08-16
종로3가 고기골목 맛집 닭매운탕오죽이네 ~,https://blog.naver.com/sunphil11?Redirect=Log&logNo=220157267987,닭매운탕 전문점 ' 오죽이네 ' 비오는날 급하게 잡힌 '번개모임' ㅋㅋㅋ 우리들 모임 장소는 종로3가 고기골목 맛집오죽이네 로 결정!! 우리 일행들 가운데 엄청 까다로운 입맛을 자랑하는 그녀(?)가 추천한 곳이라... ,로즈메리썬짱,https://blog.naver.com/sunphil11,2014-10-21
[종로/익선동] 소주가 생각나는 익선동 닭매운탕 맛집오죽이네 ... ,https://blog.naver.com/jaaeeh?Redirect=Log&logNo=222491115818, 오죽이네신관 주소 서울 종로구 삼일대로30길 10-3 영업시간 월-금 11:30-22:00 / 토요일 12:00- / 일요일휴무 연락처 02-741-8879 #익선동맛집 #종로맛집 # 오죽이네#익선동 #종로3가역맛집 #종로3가맛집 #탑골공원맛집... ,대이의 일상말하기 :-),https://blog.naver.com/jaaeeh,2021-09-01
"( 안국역 카페 리틀버틀러 카페 , 델픽 카페 , 종로맛집오죽이네)",https://blog.naver.com/2na_ri?Redirect=Log&logNo=222338036004,했어요 맛없으면 나올때 버리고 올텐데 맛있어서 들고 그대로 나왔다 ㅋㅋㅋㅋㅋㅋㅋㅋㅋㅋㅋㅋㅋㅋㅋㅋ #종로맛집 # 오죽이네#최자맛집 #최자로드 오죽이네#종로닭매운탕 #나리맛집 닭매운탕 1위오죽이네 ... ,이날일기,https://blog.naver.com/2na_ri,2021-05-04
[익선동] 오죽이네- 최자로드 닭도리탕,https://blog.naver.com/matlileo?Redirect=Log&logNo=222421677965,매콤 칼칼한 게 땡겨서 방문한오죽이네최자로드에 나왔대나 뭐래나 기본찬 (TMI : 이 중에 도토리묵만 먹을 수 있음)오죽이네 에서는 칼국수 사리 주문이 국룰이지만 국룰이 아니라도 난 칼덕이라 주문했을... ,맛릴레오 먹릴레이,https://blog.naver.com/matlileo,2021-07-06
종로에오죽이네닭매운탕집 방문후기,https://blog.naver.com/happyeun0308?Redirect=Log&logNo=222461530294,"ㅎㅎ 저번주 주말에 종로에 커플링을 보러 갔다가 저녁까지 호록하고 왔는데요ㅎㅎ 익선동 구경했는데 죄다 스파게티,피자 종류라서 다른 메뉴 찾아보다오죽이네 라는 곳을 갔다왔어요ㅎㅎ오죽이네 는... ","꿀순이의 진솔한 상품리뷰,일상리뷰♡",https://blog.naver.com/happyeun0308,2021-08-08
종로 맛집 :오죽이네닭매운탕 내돈내산 솔직후기,https://blog.naver.com/lovedud0508?Redirect=Log&logNo=222351169904,#종로닭볶음탕 #종로맛집 # 오죽이네종로 웨딩반지 맞추러 갔다가 맛집 발견했어요오죽이네솔직리뷰입니다 ◡̈ 네이버 지도보면서 갔는데 간판이 안보여서 없어진건가!? 했는데 골목사이로 들어가면 있어요!... ,Hyunnn’s daily life ఇ,https://blog.naver.com/lovedud0508,2021-05-14
"[종로3가/익선동 맛집] 오죽이네 , 얼큰한 닭매운탕",https://blog.naver.com/beeee_honey?Redirect=Log&logNo=222456096541,오늘은 익선동 먹자골목에 위치한오죽이네소개하겠습니다!!오죽이네주소 : 서울 종로구 돈화문로11가길 25 영업시간 : 평일 11:30 - 22:00 (BREAK TIME 15:00 - 16:00) 토요일 12:00 - 22:00 / 일요일 휴무 전화번호 : 02-741... ,먹생먹사 꿀벌라이프,https://blog.naver.com/beeee_honey,2021-08-03
종로3가 익선동 ' 오죽이네 ' 재재재방문 +최자로드 맛집,https://blog.naver.com/bonitaaa1?Redirect=Log&logNo=222460443156,종로3가오죽이네대맛집. 기다릴만하다고 생각함. 종로3가에서오죽이네찾아오려면 갈매기살집들 지나야하는데 그것또한 고역이다. 거기도 존맛으로 보이기때문ㅜㅜㅜㅜ 지금보니 포장이 되네? 오호.. 근데... ,bonini,https://blog.naver.com/bonitaaa1,2021-08-07
[종로/익선동] 최자로드 닭매운탕오죽이네히죽히죽,https://blog.naver.com/jom1647?Redirect=Log&logNo=222455851731,그럼 무족권이지 종로/익선동 닭매운탕오죽이네위치오죽이네 는 익선동에 있구요 본관/신관 2개의 지점이 있어요! 저는 본관 갔는데 신관도 같은 동네에 위치해 있어요 두곳 모두 브뤠이크타임 ‼️‼️ 15:00... ,오늘의 하루는,https://blog.naver.com/jom1647,2021-08-03
[닭매운탕맛집] 오죽이네 ,https://blog.naver.com/djwls1439?Redirect=Log&logNo=222114512067,오늘 소개해드릴 곳은 바로 종로의 맛집으로 유명한 한번쯤은 다들 드셔보셨다는오죽이네리뷰 입니다. 종로3가에 맛집중 손에 꼽히는오죽이네~ 안가본사람은 있어도 한번만 가본사람은 없다는 바로 그곳이죠... ,Sun Jewelry,https://blog.naver.com/djwls1439,2020-10-28
 오죽이네 : 최자로드_닭매운탕 편,https://blog.naver.com/wpalsdud02?Redirect=Log&logNo=222438303270,이번에도 짧은 리뷰를 남깁니다 이곳은 익선동에 위치한오죽이네닭매운탕으로 유명한 맛집!... 하면오죽이네 를 추천드립니다 하지만 사람이 정말정말정말 많았고 테이블 간격이 좁아서 지금 가는 건 다시... ,밋오의 세상,https://blog.naver.com/wpalsdud02,2021-07-20
"익선동 한바퀴( 오죽이네신관,콤콤오락실,오얏꽃)",https://blog.naver.com/gugisung?Redirect=Log&logNo=222342698705," 오죽이네신관오죽이네신관 월,화,수,목,금요일 11:30~22:00 토요일,공휴일 12:00~22:00 일요일 휴무 최자로드에 나와서 아실 분들은 아시겠지만, 장사가 굉장히 잘 되서 5월 3일에오죽이네신관을 오픈했다고... ",웰니스큐레이터,https://blog.naver.com/gugisung,2021-05-08
[익선동]오죽이네 ,https://blog.naver.com/lboraming?Redirect=Log&logNo=221989446656,익선동 맛집오죽이네아니 배수사에서 그렇게 먹었더니 속이 느끼해서 칼칼한게 땡겨서 최자맛집으로 유명한오죽이네닭매운탕 전문 아 그래.....김치먹고싶었다 우동사리추가 감자사리추가 끓이면 완벽 너도... ,"라마라미 with, NA",https://blog.naver.com/lboraming,2020-06-04
종로 3가 닭매운탕이 맛있는오죽이네 ,https://blog.naver.com/dltkdgjsp?Redirect=Log&logNo=40202354601,"맛집,오죽이네! 정면은 전봇대에 가려 옆에서 찍기 ㅋㅋㅋㅋ오죽이네 는 특이하게 닭볶음탕이 아닌, 닭매운탕이예요 ㅎ 말 그대로 물이 자박자박~ ㅋㅋ 차림표 :) 저희는 닭매운탕 中을 시켰어요 ㅋㅋ 기본... ","The Mellan, 더 멜랑 :)",https://blog.naver.com/dltkdgjsp,2013-12-10
오랜만에 종로에서 헤매고 있습니다...닭매운탕?오죽이네 ?,https://blog.naver.com/seo_sangmin?Redirect=Log&logNo=220790426043,길찾기로오죽이네닭매운탕집으로 한걸음 한걸음 걸어가봅니다. 닭매운탕? 이건 대체 뭐여? 닭도리탕이랑 뭐가 다른건데...? 나를 포함한 닭매운탕을 처음본 친구들 한마디씩 날리자오죽이네닭매운탕 집을... ,사진 찍는 아빠,https://blog.naver.com/seo_sangmin,2016-08-18
[익선동 최자로드 맛집] ‘ 오죽이네 ’ 닭매운탕,https://blog.naver.com/sji531?Redirect=Log&logNo=222447802754,친구들이랑 익선동에 있는 ‘ 오죽이네 ’를 다녀왔어요! 친구가 몇 달 전부터 여기는 꼭 가야한다고 최자로드에 나온 맛집이라며 가보고싶다고 하더라구요오죽이네평일 11:30-22:00 (평일 브레이크 15:00-16:00)... ,하유로그,https://blog.naver.com/sji531,2021-07-27
"익선동 데이트 | 익선고로, 하이웨스트,오죽이네 ",https://blog.naver.com/jjjangsy_?Redirect=Log&logNo=222458299407,com/jjjangsy_/222456951207 저녁은 익선동에서 유명한 맛집인 ' 오죽이네 '에 다녀왔어요. 동생도 진짜 맛있다고 그러고 블로그 후기들도 좋더라고요~ 최자로드 맛집이라 믿고 가보았네요 *-*오죽이네서울특별시... ,vivacity yuni,https://blog.naver.com/jjjangsy_,2021-08-05
종로 익선동 맛집 ::오죽이네닭매운탕 핫해,https://blog.naver.com/hellombl?Redirect=Log&logNo=221222105012,종로 익선동 맛집 ::오죽이네닭매운탕 핫해 요즘 핫하디 핫하다는 익선동에 다녀왔어요 :-) 이전부터 가봐야지~ 했는데.. 이미 핫한 시기는 지났나요 ? ㅋㅋㅋㅋㅋㅋㅋㅋㅋㅋㅋㅋㅋ 무튼 그래도 아직 사람이... ,꽁몰,https://blog.naver.com/hellombl,2018-03-05
종로3가 쭈꾸미 삼겹살오죽이네 ,https://blog.naver.com/kilihi777?Redirect=Log&logNo=220369364396,종로 3가 쭈꾸미볶음오죽이네휴일인데 다들 잘 지내시지요?? 집에서 딩굴고 있는데 선배님들이 저녁을 먹자고 합니다. 저녁 뭐 먹을까 고민 중이었는데 쭈구미가 먹고 싶다고 합니다.오죽이네쭈꾸미 볶음... ,종로다이아몬드매입 : 한국다이아몬드센터 종로점,https://blog.naver.com/kilihi777,2015-05-25
[종로 익선동 맛집] 종로 익선동 맛집오죽이네닭매운탕 맛집,https://blog.naver.com/peb0720?Redirect=Log&logNo=222476771903,종로 익선동 닭매운탕오죽이네후기 예전부터 울 져니가 가자고 노래노래 했던 닭매운탕 집을 드디어... 같아효 #종로 #종로맛집 #종로3가 #종로3가맛집 #서울맛집 #닭매운탕 #익선동맛집 #익선동 오죽이네 ... ,나는 파워블로거가 될거야,https://blog.naver.com/peb0720,2021-08-19
종로오죽이네최자로드 닭매운탕맛집 익선동오죽이네 ,https://blog.naver.com/llayeon921?Redirect=Log&logNo=222135913094,종로 3가에서 만나기로 하고 주변 맛집을 검색하다 알게 된 익선동오죽이네 . 최자로드 맛집이라고... 아무튼 익선동오죽이네 는 종로 3가역 6번 출구로 나와 4거리쪽으로 잠깐 걸으면 나오는 좁은 길을 따라 쭉... ,세상엔 맛있는게 참 많아,https://blog.naver.com/llayeon921,2020-11-05
"시작하면 멈출 수 없는 닭 매운탕, 종로 익선동 맛집 -오죽이네 ",https://blog.naver.com/druck841?Redirect=Log&logNo=222493336389,"[21.08.22 방문]오죽이네주소 : 서울 종로구 돈화문로 11가길 25 영업시간 : 평일 11:30 -22:00 (브레이크... 오늘 소개할 곳은, 종로 3가역에 위치해있는오죽이네 라는 곳 입니다. '최자로드'라는 맛집 소개... ",책 먹고 음식 읽는 중소입니다,https://blog.naver.com/druck841,2021-09-03
"종로3가역 닭매운탕(닭도리탕) 맛집, 최자로드 맛집:오죽이네 ",https://blog.naver.com/hjk_490?Redirect=Log&logNo=222476762295,"#종로구 #종로3가역 #닭매운탕 #최자로드 #맛집 # 오죽이네오죽이네평일 11:30~22:00 (breaktime 15:00~16:00) 토요일 12:00~22:00 일요일, 공휴일 휴무 최자로드 맛집 리스트 중 하나인오죽이네덕수궁 돌담길 쪽에 갈일이... ",ㄱㄷㅌㄲ's 일상,https://blog.naver.com/hjk_490,2021-08-22
"♡종로 익선동 최자로드 닭매운탕 맛집,오죽이네 ",https://blog.naver.com/yho54321?Redirect=Log&logNo=222394387734,혜원입니다:) 오늘은 종로의 닭매운탕 맛집을 소개해드릴게요 이름은 ‘ 오죽이네 ’ 영업시간은 평일 11:30-22:00 (BREAK TIME 15:00-16:00) 주말 12:00-22:00 SUNDAY OFF 저희는 ‘닭매운탕’ 주문했어요 두명이서 가서... ,Hearty Wonderland:),https://blog.naver.com/yho54321,2021-06-11
[서울/종로 맛집]오죽이네 ,https://blog.naver.com/leehana_s2?Redirect=Log&logNo=222420640791,"# 오죽이네더 맛있게 먹는방법 ٩( ᐛ )و 소주와 맥주 등장,, 조금 끓으면 먹어도 된다고 해서 기다리고... 합니댱# 오죽이네#종로 오죽이네#익선동 오죽이네#서울맛집 #종로맛집 #익선동맛집 #종로맛집추천... ",하나의 일상 ෆ,https://blog.naver.com/leehana_s2,2021-07-05
"[익선동]오죽이네 , 닭매운탕 칼국수 넣어먹으면 존맛",https://blog.naver.com/tyahn1999?Redirect=Log&logNo=222510509490, 오죽이네#닭매운탕 오랜만에 글쓰네요... 인턴이 끝나도 전 쉴수없나봐요^^... 주변에 일이 생겨서 익선동 쪽에서 밥을 먹기로했어요 양식이나 고기는 안땡기고 칼칼한게 땡기더라구요 그래서오죽이네 로 결정... ,떠돌이 세항중,https://blog.naver.com/tyahn1999,2021-09-19
익선동오죽이네진짜 죽여요,https://blog.naver.com/annbymin?Redirect=Log&logNo=222449904012,"최자로드에도 소개된 적 있었던 익선동 닭매운탕 파는오죽이네입니다. 메뉴가 닭매운탕인만큼 점심때보다는 저녁에 손님이 많은 곳이고, 저는 생각날때 한번씩 점심에 다녀와요 최자로드 나오는거 보고... ",뚜동이네 하우스,https://blog.naver.com/annbymin,2021-07-29
아빠 입맛에 딱인 익선동오죽이네닭매운탕,https://blog.naver.com/dppwls0414?Redirect=Log&logNo=222335049934,맛있었던오죽이네데려가봤다 매워 보이지만 맵찔이인 나도 그다지 맵지 않은! 달콤 매콤한 양념의 닭매운탕이다. 완전 빠져버린오죽이네닭매운탕.. 진짜 넘넘 맛이씀. 아빠가 생각나는 맛. 3주만에 3번 감.... ,Lalalavidaromántica,https://blog.naver.com/dppwls0414,2021-05-03
종로 익선동 맛집 |오죽이네| 닭매운탕 | 최자로드맛집,https://blog.naver.com/yunn_12?Redirect=Log&logNo=222433109997,오랜만에 아름이 언니랑 규림이랑 데이트 룰루요즘 아름이 언니가 푹 빠진 닭볶음탕이 있다고 먹으러 가자고 해서오죽이네 에 다녀왔다 종로3가역 6번 출구 앞에서 만나서 오랜만에 수다 떨며오죽이네 ... ,◡̈ ෆ,https://blog.naver.com/yunn_12,2021-07-15
"|종로| 익선동 최자로드 닭매운탕 맛집,오죽이네 ",https://blog.naver.com/duddnsl0906?Redirect=Log&logNo=222386270965, 오죽이네최자로드 닭매운탕 맛집 안녕하세요 영니입니다 정말 오랜만에 육아를 뒤로하고 자유의... 다녀왔습니다오죽이네(본점) 서울 종로구 돈화문로11가길 25 02.741.8874/8879 영업시간; 평일 11시30분 - 22시... ,영니의 Jeju_log,https://blog.naver.com/duddnsl0906,2021-06-05
"서울 여행, 익선동오죽이네닭매운탕!",https://blog.naver.com/nono1831?Redirect=Log&logNo=221691317718,우리의 선택은 익선동오죽이네닭매운탕 보글보글 대전에 비교하면 약간 야채가 적은거?! ^_^ 평일 낮에 술 먹을수 있다. Because we are on vacation! 국물에 소주 한잔 ! 보라~ 점심에 닭매운탕에 소주 먹는다.... ,소소한게 제일이야,https://blog.naver.com/nono1831,2019-10-28
576.[서울/종로 맛집] 오죽이네닭매운탕 - 간만에 블로거 모임... ,https://blog.naver.com/mp5422?Redirect=Log&logNo=221271251869,"576번째 먹이는 종로3가 6번출구 근처에 위치한 허름한 골목에 위치한오죽이네 가 되겠다. [일정]2018.5.2 저녁 [함께한 하루살이] ㅋ, 잘생긴주인공 [비용] 5만 ㅋ님 협찬 닭매운탕 (중) 3.0만 라면 사리 0.1만 떡... ",개매니의 하루살이,https://blog.naver.com/mp5422,2018-05-09
"익선동 데이트(닭매운탕오죽이네 , 카페 청수당)",https://blog.naver.com/yoojs212?Redirect=Log&logNo=222428094816,점심은 초복 겸 저번주에 못갔던 닭매운탕집오죽이네 ! 웨이팅이 있다고 해서 긴장하고 갔는데 이날은 좀 널널했다.오죽이네신관도 있나봄. 바로 닭매운탕 소자와 우동사리 주문. 반찬. 평범스. 얼마 지나지... ,소소한 행복❣,https://blog.naver.com/yoojs212,2021-07-11
 오죽이네 신관에서 닭매운탕 먹었어요 종로맛집 인사동데이트,https://blog.naver.com/budongsanimoney?Redirect=Log&logNo=222428781589," 오죽이네 신관 북촌한옥마을, 인사동, 익선동까지 종로를 누비며 데이트했어요:-) 맛있는 밥을 먹으려고...오죽이네 는 본관, 신관이 따로 있어요~ 사진으로 봤을 때는 신관이 더 깔끔해보여서오죽이네 신관으로... ",부동산이 머니,https://blog.naver.com/budongsanimoney,2021-07-12
[익선동]오죽이네 . 닭매운탕 맛집,https://blog.naver.com/ellie1215?Redirect=Log&logNo=221632372889,닭매운탕 전문점오죽이네메뉴 닭 '매운탕'이므로 국물 졸이지 않아도 된다고 반찬 괜찮고 닭매운탕 소 + 칼국수 사리. 고기가 자잘한 편. 퍽퍽살이 적어서 난 좋은데 고기 양 적다고 싫다는 사람들도 있고.... ,C'est la vie,https://blog.naver.com/ellie1215,2019-08-29
익선동 맛집오죽이네닭 매운탕이라고 들어보셨나 존맛,https://blog.naver.com/qkrxodud2004?Redirect=Log&logNo=222431752469, 지난번 포스팅한 익선동 끼룩하우스 갔다가 익선동 #맛집 검색해서 찾아간오죽이네 . 이 때까지만해도 지금처럼 덥진 않았는데… 쩝 요즘 너무 더워서 죽겄다 ㅠㅠ오죽이네 는 닭 매운탕이라는 새로운... ,뭉탱이의 맛 탐험,https://blog.naver.com/qkrxodud2004,2021-07-14
"종로오죽이네닭매운탕, 믿고 가는 최자로드 맛집",https://blog.naver.com/119dud?Redirect=Log&logNo=222417372056,종로오죽이네글/사진 영도리 서울 여행 다녀온지가 언젠데 미루다 미루다 5개월만에 쓰는 종로오죽이네리뷰...^^ 까먹었다가 임시저장함에 있는 거 보고 부랴부랴 그날의 기억을 꺼내봅니다 여기 최자로드... ,영도리로그,https://blog.naver.com/119dud,2021-07-02
종로맛집오죽이네 ,https://blog.naver.com/wisegoldsilver?Redirect=Log&logNo=222265929666,개인적으로 닭도리탕을 좋아하지 않지만 처음오죽이네 를 가게된후로 자주가게되는 맛집입니다.오죽이네 는 종로3가역 6번출구로 나오시면 익선동 골목으로 쭉 들어가시면오죽이네 가 보여요~~!! 코로나가... ,슬기로운 금은방,https://blog.naver.com/wisegoldsilver,2021-03-06
종로 익선동 닭매운탕오죽이네신관 최자로드 맛집,https://blog.naver.com/kawa2moonsun?Redirect=Log&logNo=222376717604," 오죽이네익선동 맛집 검색하면 많이 나오는 곳이라 알고는 있었지만, 닭매운탕이라는 메뉴가 조금 생소해서 선뜻 가보지 못했던 곳이다. 근데.. 최자로드오죽이네 편을 보니 침 줄줄... 참지 못하고 직행! 퇴근... ",Wish you a lovely day,https://blog.naver.com/kawa2moonsun,2021-05-31
종로 익선동 맛집 닭매운탕 전문점 최자로드 추천오죽이네 ,https://blog.naver.com/qwqw9043?Redirect=Log&logNo=222203835060,종로 익선동 맛집 닭매운탕 전문점 최자로드 추천오죽이네서울나들이 마지막 포장 코스는 종로 익선동 맛집으로 유명한오죽이네닭매운탕 최자로드 최자 추천 맛집으로도 유명한 종로 익선동오죽이네 ... ,은희와 함께~♥,https://blog.naver.com/qwqw9043,2021-01-14
종로3가 익선동오죽이네 (익선동에 오죽 먹을게 없었으면),https://blog.naver.com/sibegg?Redirect=Log&logNo=222221693243,"최자로드시즌4 마지막회를 장식한오죽이네 의 옻매운탕 확실히 그 유튜브 채널 탓에 거의 만석이다 그리고 익선동 위치 탓에 커플 및 젊은 사람들 천지, 그때부터 불안감이 스멀스멀 올라왓지 닭도리탕에 옻을... ",Minchelin Life,https://blog.naver.com/sibegg,2021-01-27
종로 익선동오죽이네닭매운탕,https://blog.naver.com/storyrary?Redirect=Log&logNo=222425563366,익선동에 있는오죽이네 . 둘이 먹을거니까 '소'자 시켰다. 거기에 떡이랑 라면사리 추가.공기밥 2개. 2021년 7월 초 방문. 맛있었음 ~~~!! 닭매운탕이 뭘까 궁금했는데 닭도리탕이랑 비슷한 듯 살짝 다른 맛? 마늘이... ,막 다니는 여행 사진첩,https://blog.naver.com/storyrary,2021-07-09
"[종로, 익선동] 닭매운탕 찐맛집 핫플오죽이네 ",https://blog.naver.com/strike-?Redirect=Log&logNo=222345639504,"그 중에 항상 사람들로 붐비고 최자맛집으로 유명한 종로, 익선동오죽이네리뷰입니다. _ 이 날 비가와가지구 사진 찍는다 고생했네욤ㅎㅎㅎ오죽이네 는 익선동 골목 안에 있어서 잘 찾아가셔야 됩니다.... ",Henry’s Archive,https://blog.naver.com/strike-,2021-05-10
"여름(LANDE,오죽이네 , 온화, 강강술래)",https://blog.naver.com/igs1227?Redirect=Log&logNo=222423104631,란드(LANDE) 주은이가 찍어준 재은이랑 나 흑과 백 재은이 다리 안 닿는 거 왜 이렇게 귀엽지오죽이네퇴근하고 지원 언니랑 익선동에서 본 날 언니가 알아봐 준 최자 맛집 언니가 먼저 퇴근하고 대기해 줘서... ,깽이로움,https://blog.naver.com/igs1227,2021-07-07
