title,link,description,bloggername,bloggerlink,postdate
대전맛집오씨칼국수본점 후기(위기의 맛집),https://blog.naver.com/anjanjajaj?Redirect=Log&logNo=222382430750,제 칼국수 포스팅에는오씨칼국수 가 척도입니다 물총은 아니더라도 적어도 칼국수는 그렇죠 어디서 먹어도오씨칼국수 의 칼국수면은 따라올 수 없다고 생각해요 제가 오씨를 1n년을 다녔는데요 근데 위생 청결... ,영감얻은할머니,https://blog.naver.com/anjanjajaj,2021-06-03
대전 맛있는녀석들 물총탕이 유명한 맛집오씨칼국수 ,https://blog.naver.com/sus87?Redirect=Log&logNo=222535412730,대전에서 유명한 맛집오씨칼국수 ! 맛있는녀석들에 나온 물총탕 맛있어요. 지난번에 괴정동 칼국수를 올렸는데 이번에도 상호에 칼국수가 들어가네요. 전날 술을 먹고 나서 해장이 살짝 필요했는데 여자 친구가... ,수사사 - 수지 사는 사람,https://blog.naver.com/sus87,2021-10-13
"대전맛집 :: 태평소국밥, 바로그집떡볶이,오씨칼국수 ... ",https://blog.naver.com/jhye924?Redirect=Log&logNo=222478075860,ㅎ 떡이 되게 컸어요 가래떡처럼~ 저녁먹고 야식으로 먹으니까 떡 2개만 먹어도 배부른 ^^ 남기고 온... 진짜 칼국수 면이 넘 촉촉 탱탱 + 쫄깃하고 입에 챡챡 감기는오씨칼국수물총은 나오자마자 다 껍데기... ,졔로그,https://blog.naver.com/jhye924,2021-08-20
대전 물총칼국수 맛집 원탑오씨칼국수 ,https://blog.naver.com/cjfgjs7004?Redirect=Log&logNo=222537847242,가게 앞 호박엿을 판매하고 있는 작은 매대가 보인다면 이곳이 바로 대전 물총칼국수 원탑오씨칼국수점심 피크시간대 가면 무조건 웨이링~ 그러지 않기 위해선 브레이크 타임 다음으로 가는걸 추천한다. 대전... ,또리시점,https://blog.naver.com/cjfgjs7004,2021-10-15
[대전]오씨칼국수 ,https://blog.naver.com/atonement421?Redirect=Log&logNo=221699703207,그래도 다행히ㅋㅋ 2명이나 3명 온 사람들 먼저 안 들여보내고 우리 앉을 때까지 대기했다. 우리도 한참... (마시지 않았음) 칼국수는 2인분 시켰는데 양 진짜 대박ㅎ 사랑해요 대전...오씨칼국수 를 품고 있는... ,A fateful life,https://blog.naver.com/atonement421,2019-11-07
[대전] 맛있는녀석들의오씨칼국수물총칼국수 물총조개 맛집,https://blog.naver.com/kce0507?Redirect=Log&logNo=222540368810,"✨오씨칼국수대전 동구 옛신탄진로 13 매일 11:00 ~ 21:00 월요일 휴무 오픈시간에 맞춰서 갔는데... 맛있는녀석들 포스터가 붙어있다 ㅎㅎ 메뉴는 손칼국수 6,000 물총(1kg) 12,000 해물파전 10,000 요 3개의 메뉴가... ",새로운 시작을 응원해!,https://blog.naver.com/kce0507,2021-10-18
[대전 맛집/도룡동 맛집]오씨칼국수도룡점 *,https://blog.naver.com/twosevengirl?Redirect=Log&logNo=222540638735," 오씨칼국수도룡점 대전 맛집/도룡동 맛집/대전 DCC 맛집/대전 칼국수 정말,,,,,,,거의 1년만에 맛집 포스팅이네여,,, 진짜 이젠 없어진 가게도 많을꺼 같아요,,, 그래도 한번 열시미 올려보도록 할게욤 ㅠㅠ... ",Daily Food Record,https://blog.naver.com/twosevengirl,2021-10-18
대전 맛집 =오씨칼국수? 물총은 또 뭐야! 타지 관광객의... ,https://blog.naver.com/hangeuland?Redirect=Log&logNo=221802584640,대전 물총 칼국수 맛집 :오씨칼국수오씨칼국수 의 위치는 대전역에서 출발할 경우 버스로 '한밭자이아파트'에 하차하는 것이 가장 빠르다 동명의 가게들이 있으므로 우리가 가려는 곳은 '삼성동'에 위치한... ,푸르던 : 소중한 하루의 기록,https://blog.naver.com/hangeuland,2020-02-09
칼국수 물총이 맛있는오씨 칼국수김치가 매워도 너무... ,https://blog.naver.com/sunae628?Redirect=Log&logNo=222129898636,#대전맛집 #대전칼국수맛집 #대전칼국수오씨 칼국수도-착! 아까 언급했듯이 자리가 많이 비어있어서 안기다리고 바로 착석할 수 있었습니다! 김치가 매운걸로 워낙 유명한곳이죠 여기 많이 매우니 조금씩... ,소내의 월드라이프,https://blog.naver.com/sunae628,2020-10-29
대전 나들이 갔다가 맛집오씨칼국수 에서 물총조개 포장!,https://blog.naver.com/cute0014?Redirect=Log&logNo=221994626734,아기랑 주말에 나들이를 갔다가 대전 맛집오씨칼국수 에서 물총조개 1kg 포장해왔어요. #대전맛집 주말에 한밭수목원에 장미꽃을 보러 나들이를 갔다가 ㅎㅎ 집으로 오는 길에오씨칼국수 에 가서 물총을... ,"민,제이 유니 ~_~ ♡",https://blog.naver.com/cute0014,2020-06-09
대전오씨칼국수맛집이라기에 오픈하자마자 방문,https://blog.naver.com/ehowlnn0?Redirect=Log&logNo=221884543002,(센스쟁이~~~.) 대전오씨칼국수사람정말 오지게 많아요 ㅎ 청주에도 몇몇 칼국수집 유명한곳이 있는데 보통 식사시간때는 붐비지만 여기는 아침 열자마자 이정도면.... 참 대단한 맛집인듯하다 ㅋㅋ 대전... ,바니커플,https://blog.naver.com/ehowlnn0,2020-04-01
대전 칼국수 맛집 :오씨칼국수에서 물총 조개 칼국수 먹었어요 !,https://blog.naver.com/suk1248?Redirect=Log&logNo=222494437816,유명했던오씨칼국수내부모습 중요 알림(?) 김치가 맵다는 거랑 위생상 얼음물 사용 중단한다고도 적혀있네용 . 메뉴판~~ 칼국수1이랑 물총 시켰어요 이 날 비와서 그런지 다른 사람들은 해물파전이랑 막걸리도... ,스즈스의 시선이 머물다,https://blog.naver.com/suk1248,2021-09-04
"대전 칼국수 맛집오씨칼국수 , 맛있는녀석들 물총",https://blog.naver.com/rladudrhkd31?Redirect=Log&logNo=222140113544,아주 간단한오씨칼국수메뉴 우리는 칼국수 하나와 물총 하나를 주문했다. 파전도 먹고 싶었지만 넘나 헤비한 것 ㅜㅜ 금방 가져다주신 동죽 휘리릭 끓이기만 하면 완성되니 빠르게 나와서 좋았다. 산더미처럼... ,@ 방울방울 @,https://blog.naver.com/rladudrhkd31,2020-11-10
대전역 근처 맛집 / 웨이팅해서 먹는 칼국수 ::오씨칼국수 ,https://blog.naver.com/k_ong13?Redirect=Log&logNo=222532970781,"요게 바로오씨칼국수김치입니다. 그냥 칼국수만 먹어도 맛있지만 이 김치랑 같이 먹으면 맛이 배배배가 되요! 우선 그냥 육수 한입 하시고, 면도 먹고 그 이후에 김치랑 같이 드셔보세요. 칼국수에 들어있는... ",세상 구경,https://blog.naver.com/k_ong13,2021-10-10
대전 최강 맛집 포장도 되는오씨칼국수도룡점 오픈!,https://blog.naver.com/duck_1052?Redirect=Log&logNo=222206658184,오~~ 신상(?)이라서 그런지 역시 매장이 깔끔하고 좋습니다. 이 사진상에서는 안 보이지만 저기 화살표로 표시한 쪽에서 직원분께서 칼국수 면을 반죽하고 계시더군요. 덕분에오씨칼국수 의 면은 쫄깃합니다... ,호기심 많은 올이의 세상엿보기,https://blog.naver.com/duck_1052,2021-01-14
대전오씨칼국수물총조개칼국수 맛있게먹는방법은?,https://blog.naver.com/jangklod?Redirect=Log&logNo=222427994141,물총조개칼국수의오씨칼국수 는 그때당시 이곳외에는 본적이없었거든요. 아마 이곳이 원조가... 4명방문으로 물총 2개 파전 2개 칼국수 2개 주문을 했습니다. 타지역에서 온 손님들 배부르게 먹었으면하는마음에... ,마브의 So Cool Life,https://blog.naver.com/jangklod,2021-07-11
"대전오씨칼국수 , 맛있는녀석들 나온집 인정.",https://blog.naver.com/bluepigk?Redirect=Log&logNo=222129105280,"대전오씨칼국수 , 맛있는 녀석들 나온집 인정. 지난 주말 급 대전 나들이를 다녀왔다. 워낙 집순이기도... 주메뉴는 손칼국수와 물총! 물총은 동죽조개를 일컫는 말로 칼칼하면 시원한 국물맛이 일품이라고... ",율무네집✈,https://blog.naver.com/bluepigk,2020-10-28
커플링 / 대전중앙시장 호두당 / 삼성동오씨칼국수/ 어머님... ,https://blog.naver.com/s_yujung?Redirect=Log&logNo=222510440641,저녁을 먹으러 삼성동오씨칼국수 에 갔다. 웨이팅을 하지 않고 바로 들어간 건 처음이었다. 우리는 럭키커플~~~ 돼지가 청바지에 네이비 컬러의 맨투맨을 입은 걸 보고 돼지와 비슷하게 입고 나갔다. 이것은... ,치즈범벅와플 >_<,https://blog.naver.com/s_yujung,2021-09-19
대전맛집오씨칼국수 ,https://blog.naver.com/mimin12?Redirect=Log&logNo=222035100571,"사진이 안습이네요.ㅠ오씨 칼국수 는 #물총칼국수, #잣콩국수, #물총탕, #통오징어, #한방수육, #순감자전, #녹두전 이렇게 있어요~ 저흰 물총칼국수와 순감자전을 주문했어요~ 통오징어와 #수육 등도 먹고... ",일상의 행복,https://blog.naver.com/mimin12,2020-07-19
[대전/도룡동] 점심 뭐먹지? 칼국수 맛집오씨칼국수 ,https://blog.naver.com/sweets9?Redirect=Log&logNo=222174223562,#대전맛집 # 오씨칼국수#유성칼국수 #유성맛집 #칼국수맛집 #대전칼국수 내가 파전을 가르는 모습을 봐주시길.... (그저 파전을 가를뿐인 영상) 김이 모락모락나서 진짜 맛있다. 그런데 같이 주는 #간장 도... ,달래의 스윗츠 나인 sweets nine,https://blog.naver.com/sweets9,2020-12-22
 오씨 칼국수 ,https://blog.naver.com/seoka35?Redirect=Log&logNo=222199051292,"이사님 추천으로 도룡동에 위치한오씨 칼국수 에 왔다. 삼성동이 본점으로 설명하지 않아도... 물총을 까서 먹고 있으면 칼국수가 나온다. 2인분을 시켰는데, 개인별로 나오지 않고 한 그릇에 크게 나온다. 요... ",개인의 다큐멘터리,https://blog.naver.com/seoka35,2021-01-07
[대전/도룡동]오씨칼국수- 대전의 숨은 자존심,https://blog.naver.com/realblue88?Redirect=Log&logNo=222444851010,것이지오씨칼국수메뉴판. 2021년에 조개 들어간 칼국수가 1인분에 6천원 믿어지지않네ㄷㄷㄷㄷ 뭔가... 이런 멘트 무한반복하며 맛있게 먹고 옴 * 총평: 대전에 오씨와 겨룰 만한 다른 칼국수집이 있는지 제보... ,개복치의 일상생활,https://blog.naver.com/realblue88,2021-07-25
"대전 중앙시장 맛집, 원동오씨칼국수(동죽칼국수)",https://blog.naver.com/yunjoung0104?Redirect=Log&logNo=222093018473,"대전 중앙시장, 대전 원동 동죽칼국수오씨칼국수영업시간 : 11:00 ~ 21:00 휴무일 : 매주 수요일 연락처 : 042 - 255 - 0850 위치 : 대전 동구 중앙로204번길 75 갑을회관 1층 ( 지번 : 대전 동구 원동 41-3, 갑을회관 1층) 끝.",봉장군 마음대로-그,https://blog.naver.com/yunjoung0104,2020-09-19
"대전 맛집,오씨칼국수 ",https://blog.naver.com/0_adorable?Redirect=Log&logNo=221811021437,물총칼국수 4인분 + 감자전 2개 먹었는데 양이 많아서 다 못먹고 남기고 온 게 함정 포스팅하다보니까... 휴무 #대전맛집 #맛있는녀석들칼국수 #맛녀석칼국수 #물총칼국수 #대전칼국수 # 오씨칼국수 ... ,주관적인 휴솔로그,https://blog.naver.com/0_adorable,2020-02-16
"대전 맛집 두리포차,오씨칼국수포장해왔어요!!",https://blog.naver.com/minikku2?Redirect=Log&logNo=221969541529,닭발에 미쳐있어서 다른거 더 주문하려고 했던것도 까먹...ㅜㅜㅜ 그러고나서 바로오씨칼국수 에 가서... 편의점 표 주먹밥오씨칼국수 에서 포장해온 물총 물총 역시 저는 안먹습니다..... 오로지 주연이랑... ,나의 중심으로 365,https://blog.naver.com/minikku2,2020-05-19
대전오씨칼국수물총 조개 꿀맛,https://blog.naver.com/kns2ar?Redirect=Log&logNo=222129085859,대전오씨칼국수물총 안녕하세요~ 대전에서 유명한 맛집 중 한 곳인오씨칼국수 에 다녀왔어요 전부터 궁금했던 물총조개 칼국수를 판매하는 곳인데 요번에 대전 간 김에 친구들이랑 방문했어요오씨칼국수 ... ,알로그,https://blog.naver.com/kns2ar,2020-10-28
[대전]오씨 칼국수 에서 칼국수 먹었다,https://blog.naver.com/didim_yeoul?Redirect=Log&logNo=222387415463,"세스코 멤버스와 수요 후무 안내 맑은고딕 볼드 없는 프린트와 흘림명조에 화이트 아웃라인 10p 레드의 ‘ 오씨칼국수 ’ 미묘한 조합이라고 생각했다 가격대는 6,500~ 칼국수랑 잣콩국수가 있는데 나는 콩국수 안... ",여울 위의 디딤돌,https://blog.naver.com/didim_yeoul,2021-06-06
"대전 유성 맛집, 도룡동오씨칼국수주차장도 완벽함!",https://blog.naver.com/duck_1052?Redirect=Log&logNo=222281238661,"물총, 칼국수, 파전 전부 다 먹어야지~♡ 또 쳐묵쳐묵하러 온오씨칼국수도룡점입니다~♡ 아흑...오씨칼국수 라면 뭐 당연한 이야기겠지만 이번에는 대기표가 있네요ㅠㅠ 이거 나중에 코로나 좀 진정되어서... ",호기심 많은 올이의 세상엿보기,https://blog.naver.com/duck_1052,2021-03-20
[ 오씨칼국수 ] 대전을 대표하는 칼국수 맛집오씨칼국수:),https://blog.naver.com/lovely_peony_?Redirect=Log&logNo=222531307519,"않다오씨칼국수 라서 OC라고 적혀있네 ? 사장님 성이 '오'씨인줄 알았는데 ?? OC는 뭘까??? Indoor view 평일... Menu오씨칼국수 는 대표 메뉴가 크게 3가지다 칼국수, 물총(1kg), 해물파전 우리는 3명이서... ",Peony_Daily 옴뇸뇸,https://blog.naver.com/lovely_peony_,2021-10-10
[농라카페 : 동죽] 대전오씨칼국수물총조개를 생각하면서... ,https://blog.naver.com/dairyukem?Redirect=Log&logNo=222198820132,"대전을 대표하는 음식으로 칼국수가 있는데, 2~3년전까지 제일 좋아했던 칼국수가 대전역 인근 삼성동에 위치한오씨칼국수 였다. 해외 다녀온 뒤에 제일 먼저 찾아가서오씨칼국수 하고오씨칼국수 의... ",Riding on ::: [ 끄라스나야 스뜨렐랴 >),https://blog.naver.com/dairyukem,2021-01-07
대전오씨칼국수/ 물총,https://blog.naver.com/phjsunflower?Redirect=Log&logNo=221904386102,대전오씨칼국수칼국수와 동죽 영상도 찍어보고 청양고추와 파가 들어가 있고 국물의 색갈이 맑은 편이다. 금세 나오고 있는 편. 끓여놨던것을 퍼서 국물만 데워서 나오는듯. 그래서 빠르게 받아 먹을 수... ,꽃씨의 맛집 이야기♬,https://blog.naver.com/phjsunflower,2020-09-23
◆대전삼성동물총조개손칼국수맛집 오씨칼국수 ◆,https://blog.naver.com/sooho0028?Redirect=Log&logNo=221868102707,"대전 삼성동 물총조개, 손칼국수 맛집오씨칼국수안녕하세요! 공감공인입니다^^ 낮에 직원들과오씨칼국수 에 다녀왔어요! 위치 먼저 보시죠! 삼성동오씨칼국수주소 : 삼성동 304-36 시간 : 매주 월요일 휴무... ",공 감 공 인,https://blog.naver.com/sooho0028,2020-03-23
"대전오씨칼국수손칼국수와 물총, 해물파전 3종셋뚜로 즐기다!",https://blog.naver.com/biccube14?Redirect=Log&logNo=222356092655,"대전오씨칼국수손칼국수와 물총, 해물파전 3종셋뚜로 즐기다! 일요일에 대전에 일이있어 비를 뚫고 내려왔는데요. 하루종일 비가 내려서인지 운전하기 정말 힘들었습니다ㅠㅠ 대전에 도착하니 점심시간이라... ",bigcube14님의블로그,https://blog.naver.com/biccube14,2021-05-18
"[대전최애맛집] 오씨칼국수 -물총,해물파전",https://blog.naver.com/rainbow8sun?Redirect=Log&logNo=221903236211,"올림오씨칼국수#메뉴판 #가격 보통 2-3명이 가면 물총에 파전을 먹고 소주, 소맥 달리고 4이상이 가면 칼국수도 같이 시키는데 여기 양이 많다. 사실 물총, 칼국수, 파전 다 맛있어서 항상 고민되지만 물총을... ",어제오늘내일 소소한 이야기,https://blog.naver.com/rainbow8sun,2020-04-11
대전 칼국수맛집치면 바로 뜨는오씨칼국수솔직후기.♡,https://blog.naver.com/rimby1004?Redirect=Log&logNo=222175315959,여윽시 대전 칼국수맛집ㅎㅎㅎ 대전 칼국수맛집오씨칼국수정확한 위치는 지도 참고해주세용 :) 가자마자 대기표부터 뽑아야하구요 2층엔 대기실까지 있대요.ㅋㅋㅋ대박 여튼 안에 꽉꽉참 가격표랑... ,도도깔쌈녀와 달봉뇬의 시큰둥한 이야기,https://blog.naver.com/rimby1004,2020-12-16
친구가 사는 도시_오씨칼국수 /성심당/모모제인/바로그집... ,https://blog.naver.com/cey1127?Redirect=Log&logNo=221764736191,2019/02/26 @ 대전 친구가 사는 도시 #오씨칼국수# 성심당 # 모모제인 # 바로그집 # 한밭수목원 긴 휴가를... 있는오씨칼국수 에 가서 물총탕을 주문했다!!! 존맛... 감자전에 물총수제비까지 다 넘넘 맛있었다 배를... ,Everything Comes and Goes,https://blog.naver.com/cey1127,2020-01-08
대전오씨칼국수맛집 - 맛있는 녀석들오씨칼국수 ,https://blog.naver.com/koreaate?Redirect=Log&logNo=222158312815,대전오씨칼국수대전 칼국수 맛집 대전오씨 칼국수전경입니다. 건물은 허름한데~ 그래도 식당 안은... 아무래도 워낙 그분들이 잘 드시니^^ 근데 진짜오씨칼국수 는 여기 본점이랑~ 올 6월 새로 오픈한... ,한국언니의 썸타는 블로그™,https://blog.naver.com/koreaate,2020-11-30
어쩌다 대전(feat. 오씨 칼국수 ),https://blog.naver.com/ddak1998?Redirect=Log&logNo=222496336886,국물이 시원한 칼국수. ※김치가 살벌하게 매움 섭취에 주의가 필요오씨 칼국수방문팁 시간 여유가 있다면 식사시간은 피하시길... 4시30분쯤 갔을때는 여유좌석이 있었는데 식사 마치고 나오니 대기줄이... ,피노키오의 꿈,https://blog.naver.com/ddak1998,2021-09-06
벌써 10년째 가고있는 대전 칼국수맛집.오씨칼국수 !,https://blog.naver.com/enfkalzn?Redirect=Log&logNo=222185477317,면을 좋아하는 KJ입니다♂️ 얼마전엔 전주 칼국수맛집을 포스팅했는데 칼국수하면 매번 생각나는 인생 칼국수맛집 대전의오씨칼국수 에대해 포스팅 해보려고해요♂️오씨칼국수대전 칼국수맛집 우쿨렐레... ,평화로움의 우쿨렐레 이야기,https://blog.naver.com/enfkalzn,2020-12-25
[대전맛집]오씨칼국수 ,https://blog.naver.com/mhandsh?Redirect=Log&logNo=221759021424,전 김치를 물에 챱챱 씻어먹었는데 매워서가 아니라 그냥 맑고 깨끗한 조개국물 맛을 온전히 느끼지 못하게되는게 싫어섴ㅋㅋㅋㅋ오씨칼국수 는 칼국수 맛집이만 파전도 있음 엄청 크고 기름 꼬순내가 남... ,랄라밍,https://blog.naver.com/mhandsh,2020-01-03
[대전맛집] 물총동죽칼국수 -오씨칼국수 ,https://blog.naver.com/gykim67?Redirect=Log&logNo=221901850797,물총과 동죽칼국수로 유명한오씨칼국수 . 늘 대기가 길고 전국구 맛집으로 등극해 주말휴일엔 다른 지방에서 방문하는 손님들이 가득한 맛집입니다. 연매출 10억 이상의 대박집이라고 하네요. 드디어 말로만... ,다락전사의 사는 이야기,https://blog.naver.com/gykim67,2020-04-12
"아들추천 대전 유성맛집,오씨칼국수 , 태평소국밥",https://blog.naver.com/micbae2?Redirect=Log&logNo=222204347784,"아들추천 유성맛집, 도룡동오씨칼국수물총조개가 시원하네 코로나때문에 식당에서 밥먹는것도... 이렇게 물총조개만 한 냄비 나오는 거랑 칼국수, 그리고 전 메뉴는 단촐했어요. 칼국수에는 물총조개가 그렇게... ",행복달의 선물같은 하루,https://blog.naver.com/micbae2,2021-01-11
 오씨칼국수칼국수맛집 도룡동맛집 대전맛집,https://blog.naver.com/sohyun0405?Redirect=Log&logNo=222520586600,"들어온오씨 칼국수 와 파전 주문 한명만 더 있었어도 물총탕 시켰는데,, 혼밥석도 있고 한결 여유로워 보이는 가게 내부 김치경고 조금씩 먹었는데도 실제로 다음날 고통받았다 먼저 나온 칼국수 얼마만이냐ㅠㅠ... ",Little Moment,https://blog.naver.com/sohyun0405,2021-09-29
대전오씨칼국수; 대전 맛집오씨칼국수방문기,https://blog.naver.com/yeigoi?Redirect=Log&logNo=222538678717,"유명한오씨칼국수 의 매운김치! 칼국수와의 케미가 얼마나 좋을지 기대가 됩니당 칼국수 등!장! 무심히 얹어진 쑥(미나리인가?), 군데군데 보이는 물총조개까지ㅎㅎ 국물 한 숟가락 떠 먹어 보니까 전날 술 안... ",studio delot,https://blog.naver.com/yeigoi,2021-10-16
맛집인가.112오씨칼국수 ,https://blog.naver.com/maniju90?Redirect=Log&logNo=222530193226,싶음 짝은먹보의 추천은 칼국수와 파전 시키라고 하고 싶음 ㅎㅎ 개취니~ 그건 알아서 선택하333 그럼 끝! #은수맛집 #대전맛집 #유성맛집 #엑스포맛집 #대전신세계맛집 #대전칼국수 #대전칼국수맛집 # 오씨칼국수 ,짝은먹보의 일기,https://blog.naver.com/maniju90,2021-10-07
대전 삼성동 ‘ 오씨칼국수 ’ 서울 먹짱들의 대전맛집탐험,https://blog.naver.com/malahalo?Redirect=Log&logNo=222046006685,클리어한오씨칼국수칼국수는 비록 조금 남겼지만 아쉬운거 하나 없던 맛 물총은 말그대로 청양고추가 들어가서 매콤칼칼하고 칼국수는 마일드해서 매운 김치랑 잘어울렸다 대전에 다시 간다면오씨칼국수 는... ,라깰의 어제보다 즐거운 오늘,https://blog.naver.com/malahalo,2020-07-30
"[대전]오씨칼국수손칼국수,물총조개,해물파전 맛있는 녀석들... ",https://blog.naver.com/hyekyo_a?Redirect=Log&logNo=222537205606,ㅋㅋ 대전오씨칼국수정보 매일 11:00 - 21:00 월요일 휴무오씨칼국수 의 김치 김치가 진짜 매워요 매워서 칼국수 한입 더 먹게 됩니다! 매운데 또 먹고싶고 대전이 매운 김치가 유명한가 실비김치... ,오늘.,https://blog.naver.com/hyekyo_a,2021-10-14
[ 대전 / 칼국수 ]오씨칼국수 ,https://blog.naver.com/hee_916?Redirect=Log&logNo=222527581389,노잼도시로 유명한 대전에 놀러갔다 맛집으로 유명한오씨칼국수방문기 입니다~~ 대전 가기전부터... 들어오자마자 칼국수 2인분을 주문하고 기다리는데 주변 테이블을 보니 대부분 물총탕을 드시더라구요!... ,εïз,https://blog.naver.com/hee_916,2021-10-11
"오빠와 대전 1박2일 여행( 오씨칼국수 ,성심당,커피인터뷰... ",https://blog.naver.com/soozini11?Redirect=Log&logNo=222541477341,# 오씨칼국수#오징어파전 이때가 중국산 김치 파동이 있었던때라 칼국수에는 겉절이인데… 뭔가 맘껏 못먹었던 기억이… 여기는 지난번에 포스팅했던 선화동 애쉬드인데 찾아보니 매일 휴무던데… 무슨 공사를... ,찐이네윤,https://blog.naver.com/soozini11,2021-10-19
"[ 오씨칼국수 ]도룡동맛집,대전맛집",https://blog.naver.com/tnwl3801?Redirect=Log&logNo=222202542595,"국물에 밥말아먹는게 내 취향 청양고추 가득 들어서 개운하게 잘 먹었습니다 :) 다음에 포장해서 먹어야지 !!! 찾아오는 길 대전맛집, 대전 오씨칼국수 , 대전칼국수 도룡동맛집, 대전엑스포맛집",-,https://blog.naver.com/tnwl3801,2021-01-10
대전 맛집오씨칼국수포장이 답이다.,https://blog.naver.com/sibang78?Redirect=Log&logNo=222026862844,"학교를 못가는 아이들을 위해오씨칼국수포장 칼국수 조리법과 조개탕 조리법이 동봉되어 있어요. 육수, 면, 동죽, 김치 미리 전화를해서 포장을 하면 더 빠르게 ... 3인분을 포장했어요. 칼국수는 냄배를 2개... ",살림 잘하는 센스있는 뇬~~~♥,https://blog.naver.com/sibang78,2020-07-10
대전 맛집 추천으로 뜨끈한오씨칼국수 ,https://blog.naver.com/albong0210?Redirect=Log&logNo=222480818955,매운김치는 시원한 칼국수와 함께 먹으니 정말 찰떡궁합인데용 ㅎㅎ 칼국수 위에 쑥갓도 듬뿍 올려주셔서 더욱더 맛있어보이는오씨칼국수 입니다. 칼국수는 뭐니뭐니해도 바지락칼국수 아니겠어요?̑̈... ,봉봉이의 하루,https://blog.naver.com/albong0210,2021-08-23
[대전] 물총칼국수 맛집오씨칼국수방문 :),https://blog.naver.com/lazy_sally?Redirect=Log&logNo=222539565960,대전에 동생 결혼식이 있어서 방문하는길에 맛집이라고 소문 자자한오씨칼국수 에 다녀왔다. 11시... 엉덩이로 심판받기 전에 넣어두세요 3인이 방문했고 물총1 칼국수2로 주문했다. 블로그 보면 칼국수가... ,Lazy Brindled Cow,https://blog.naver.com/lazy_sally,2021-10-17
대전맛집/도룡동오씨칼국수 ,https://blog.naver.com/vkmjv86?Redirect=Log&logNo=221996024215,"대전오씨칼국수분점이 드디어 도룡동 하우스디에 오픈 !!! 오픈이 11시라 점심전 후다닥 11:20분에 입성 (11:45분되니 웨이팅이....) 메뉴는 맛집들..늘 그렇듯 단촐하게 칼국수, 물총, 파전 오씨는 김치가 참... ",감성발랄 감나무,https://blog.naver.com/vkmjv86,2020-06-10
[대전 칼국수 맛집/맛있는 녀석들 칼국수 맛집] 오씨칼국수후기,https://blog.naver.com/trustreal?Redirect=Log&logNo=222017160277,그래서 칼국수 결정오씨칼국수 라고 대전에서 유명한 집이 있어서 빠르고 고고 점심시간 맞춰서 오니 바로 웨이팅 번호표 뽑고 기다림... 누가 보면 은행 온 줄... ㅎ 얼마나 장사가 잘 되길래 체인을 냈다고 함... ,허니보이,https://blog.naver.com/trustreal,2020-07-02
