title,link,description,bloggername,bloggerlink,postdate
대전 삼성동맛집 : 대전칼국수맛집 :) “ 오씨칼국수 ”(+물총맛집),https://blog.naver.com/tajoa19?Redirect=Log&logNo=222536322332,"요즘 급배고프고 급 배부르고 ㅋ 맛있어서 이성의 끈을 놓아버린 “ 오씨칼국수 ” 칼국수 육수보다는 물총 육수가 더 칼칼한 편이에요. 다들 먹길래, 파전까지 주문을 했는데요, 안먹었으면 큰일날뻔 ⁉️ ㅋㅋ... ",샤랄라정,https://blog.naver.com/tajoa19,2021-10-14
[대전 맛집]오씨칼국수- 물총과 칼국수 맛집!,https://blog.naver.com/pinkbomi?Redirect=Log&logNo=222334821681,"조개를 저렇게나 먹었는데도 그닥 짜지 않고, 칼국수도 간이 세지 않아서 좋았다, 여긴 맛있는, 즐거운 맛집이었다. 엄지척! #대전맛집 #대전 오씨칼국수#대전칼국수맛집 # 오씨칼국수#대전역맛집 #물총조개 #동죽",봄봄a의 여행 다이어리,https://blog.naver.com/pinkbomi,2021-05-03
 오씨칼국수:(,https://blog.naver.com/onestar_0530?Redirect=Log&logNo=222524441430,# 오씨칼국수#대전칼국수맛집 #대전칼국수 #대전삼성동맛집 #대전맛집 안녕하세요. 오늘은 길게 줄 서서 먹는 맛집오씨칼국수리뷰를 갈게요! 사람이 너무 많아서 매장사진은 못찍었어요! 위치는 이곳이고... ,앙빡씨의 기록,https://blog.naver.com/onestar_0530,2021-10-02
" 오씨칼국수 , 도룡동 맛집, 물총조개 맛집, 도룡오씨칼국수 ",https://blog.naver.com/j_du09?Redirect=Log&logNo=222014167830, 오씨칼국수#도룡동맛집 #도룡동 오씨칼국수#물총조개 #물총칼국수 도룡동에도오씨칼국수 가 생겼다는 이야기를 듣고 지난 주말에 방문해보았당ㅎ 대전역근처에 있는오씨칼국수본점은 이미 음청 유명한 곳!... ,제이두네 이야기 。,https://blog.naver.com/j_du09,2020-06-27
대전맛집 맛있는녀석들오씨칼국수물총 포장 후기,https://blog.naver.com/anjanjajaj?Redirect=Log&logNo=222188964033,영업시간 11:00 - 21:00 (월요일 휴무) last order 20:30 0426279972 #대전 오씨칼국수# 오씨칼국수#대전물총 #대전맛있는녀석들 #삼성동맛집 #대전맛집 #물총맛집 #칼국수맛집,영감얻은할머니,https://blog.naver.com/anjanjajaj,2020-12-29
"2일 대전여행 (금산 지구별 그림책 마을, 태미오래,오씨 칼국수 )",https://blog.naver.com/poderosa3?Redirect=Log&logNo=222416547802,마무리는오씨칼국수태미오래에서 전시를 보다가 대전이 칼국수가 유명하다는 걸 처음 알게 되어 찾아봤더니 여기가 맛집으로 뜹니다. 물총조개라고도 불리는 동죽으로 맛을 낸 손칼국수 예전엔 동죽이 훨씬... ,김반장의 이중생활,https://blog.naver.com/poderosa3,2021-07-01
대전에 오면 꼭 먹어봐야 할 대전역 맛집:오씨칼국수 ,https://blog.naver.com/quidam20?Redirect=Log&logNo=222051281550, 오씨칼국수 는 티비 프로에 나온적도 있는 유명 칼국수집입니다. 물총을 쏘는듯한 식감으로 유명한 물총조개(동죽)을 산지직송받아 음식을 만든다고 해요. 내부는 좌식테이블과 입식테이블 이렇게 두가지... ,Simple is the best.,https://blog.naver.com/quidam20,2020-08-04
대전 조개 칼국수 맛집 ' 오씨칼국수 ',https://blog.naver.com/kjyrkdeks0212?Redirect=Log&logNo=222537869164,지난달에 대전 조개 칼국수 맛집오씨칼국수다녀왔어요 ㅎㅎㅎ 원래 평소에 자주 가는데 한번도 안가본 분에게.. 여긴 가야해..! 라고 데리고 가는..ㅎㅎ오씨 칼국수영업 시간 : 화~일 11:00 - 21:00 월요일 휴무... ,지혜롭게 빛나는,https://blog.naver.com/kjyrkdeks0212,2021-10-15
도룡동오씨칼국수 ,https://blog.naver.com/eunrim45?Redirect=Log&logNo=222538210487,"메뉴판 칼국수4, 파전1 시킴 칼국수는 천원 올랐네염?!오씨칼국수하면 김치가 빠질수없징!!!!♡♡ 와 진심ㅋㅋㅋㅋㅋㅋㅋ 사진보는데돜ㅋㅋㅋㅋㅋㅋㅋ 입 끝에 침 고옄ㅋㅋㅋㅋ 아낰ㅋㅋㅋㅋㅋ... ",리미 daily,https://blog.naver.com/eunrim45,2021-10-15
" 오씨칼국수 , 포장음식, 칼국수조리, 조개탕조리... ",https://blog.naver.com/kdsdb?Redirect=Log&logNo=222280319891,"장소 :오씨칼국수, 포장 주문 4. 주문 : 전화 주문, 도착 예상 시간 물어봐주셔서 10분 걸린다고 하여... 조리 : 포장한것을 받아서 집에 와서 펼쳐보니오씨칼국수특유의 매운 김치 포함으로 주었다. 더불어... ",DragonBall,https://blog.naver.com/kdsdb,2021-03-19
[대전] 도룡동 물총조개 해물칼국수 맛집오씨칼국수도룡점,https://blog.naver.com/wngml6794?Redirect=Log&logNo=222532936917,메뉴 등장 히히 물총조개 오랜만에 먹어서 그런지 더 맛있었음 살도 통통하고 맛있다 칼국수 국물도 넘 맛있음오씨칼국수 중에 여기가 제일 맛있는 느낌! 친구랑 둘이 열심히 흡입했다ㅋㅋㅋ 또먹고싶어,today is juhee,https://blog.naver.com/wngml6794,2021-10-10
대전오씨칼국수 ,https://blog.naver.com/damul421?Redirect=Log&logNo=221906743543,"대전오씨칼국수대전 동구 삼성동 자이아파트 맞은편에 위치 검색하니 대전오씨손칼국수 ,오씨칼국수등등 비슷하거나 같은 상호가 많다. 그래서 가게 앞에오씨칼국수 는 분점이 업다고 써 있구나!! 매출에... ",삶의 목적,https://blog.naver.com/damul421,2020-04-13
[대전맛집] 대전역 원동 물총 칼국수 맛집 :오씨칼국수 ,https://blog.naver.com/qls1021?Redirect=Log&logNo=222299120929,안녕하세요:) 대전 맛집 대전역 물총 칼국수 맛집오씨칼국수 에 다녀왔어요 대전 맛집 검색하면 엄청 많이 나오더라구여ㅋㅋㅋ 대전 여행 다녀왔는데 계룡산 가려다 비와서 망ㅋㅋㅋㅋㅋ 대신 먹을것만 엄청... ,디티의 하루,https://blog.naver.com/qls1021,2021-04-05
[ 오씨칼국수 ] 먹으러 부산에서 대전 간 후기,https://blog.naver.com/bom207p?Redirect=Log&logNo=222520383428,힙했습니다ㅋㅋㅋ # 오씨칼국수#오씨네칼국수 #대전칼국수 #대전 오씨칼국수#칼국수맛집 #손칼국수맛집 #대전맛집 #대전칼국수맛집 #맛집후기 #맛집리뷰 # 오씨칼국수 후기 #내돈내산 #오씨네칼국수후기... ,봄 찬란한 여행,https://blog.naver.com/bom207p,2021-09-29
"운영하는 대전 유성 도룡동 DCC오씨칼국수물총조개, 칼국수",https://blog.naver.com/dairyukem?Redirect=Log&logNo=222221085339,"#대전도룡동 오씨칼국수#삼성동 오씨칼국수 유일한체인점도룡동 오씨칼국수#대전DCC칼국수 오씨칼국수대전 삼성동오씨칼국수 .오씨칼국수 라는 유사상호도 많지만, 그 지존급, 절대 모방할 수 없는... ",Riding on ::: [ 끄라스나야 스뜨렐랴 >),https://blog.naver.com/dairyukem,2021-02-01
 오씨칼국수 실비김치,https://blog.naver.com/yulda?Redirect=Log&logNo=222534533351," 오씨칼국수 메뉴 # 오씨칼국수 메뉴 칼국수 2인분 해물파전, 공기밥2 주문~ 실비김치 가 유명하다기에, 공기밥을 시켰음. 집에서 혼자만 매운걸 좋아하다보니, 이럴때 즐겨줘야함. 대략 45분의 기다림 끝에... ",개새는 오늘도 즐겁다,https://blog.naver.com/yulda,2021-10-12
대전 오정동오씨칼국수 ,https://blog.naver.com/wldmsdl1420?Redirect=Log&logNo=222349680331,하는 칼국수집이 많지 않을 뿐더러 깔끔한 맛과 매운김치의 조합이 계속 생각나 들르는 곳 #대전맛집 #대전칼국수맛집오씨칼국수오정동오씨칼국수영업시간 11:00~21:00 쉬는날 매주 월요일 전화번호 042-627-9972,지은이가 지은 블로그,https://blog.naver.com/wldmsdl1420,2021-05-13
대전 도룡동오씨칼국수쏘주없인 반칙 물총조개,https://blog.naver.com/toxication_h?Redirect=Log&logNo=222113569601,"영업시간 주중 11:00-21:00, 월요일 휴무 (Break time 평일 15:00-16:00, 주말 15:00-15:30) 도룡동오씨칼국수시원, 칼칼, 통통 물총조개 / 칼국수오씨칼국수도룡점 본점은 너무 붐비기도 하고 근처 한밭수목원과... ",배움의 즐거움,https://blog.naver.com/toxication_h,2020-10-12
대전여행)cio[오시우]카페/ 오씨칼국수 ,https://blog.naver.com/teddybear511?Redirect=Log&logNo=222011073525,대전하면 칼국수 맛집이 많죠! 제일 유명하다는오 씨 칼국수 를 왔어요!오 씨 칼국수위치는 엄청난 양보세요~~~ 바지락 2인분인데 엄청 양이 많았어요! 칼칼하게 너무 맛있었어요! 주말에는 웨이팅이 많다고... ,Coboc_girl,https://blog.naver.com/teddybear511,2020-06-24
"[대전 동구]오씨칼국수 , 물총조개 역시 소주안주 최고",https://blog.naver.com/qowk20?Redirect=Log&logNo=221889522449," 오씨칼국수042-627-9972 대전 동구 옛신탄진로 13 매일 11:00 - 21:00 월요일 휴무 손칼국수 1, 물총 1 주문했어요 :) 김치가,,, 감칠맛은 없고,,, 그냥 매워요,,, 조금만 드세요 !!! 물총 조개 왔슴돠!!!! 조개만... ",인생은 데구르릉,https://blog.naver.com/qowk20,2020-04-10
[ 대전 ] 오노마 호텔 |오씨 칼국수| 감나무집 | 카페 두두당,https://blog.naver.com/gmldbs1446?Redirect=Log&logNo=222538589365,"다음날 아침, 일어나자마자 준비해서 밥을 먹으러 온 곳은 ' 오씨 칼국수 ' Previous image Next image 칼국수도 파전도 맛있었지만 김치가 정말 일품이었요. 김치가 매우니 조금씩 덜어먹으라는 문구가 있었는데... ",Laurier Beauty,https://blog.naver.com/gmldbs1446,2021-10-16
대전 칼국수 맛집오씨 칼국수비오는 날에 좋아요,https://blog.naver.com/ggama1203?Redirect=Log&logNo=222528893248,대전 칼국수 맛집오씨 칼국수안녕하세요 인플루언서 까마에요 :) 오늘은 아니고 예전에 갔던 대전 칼국수 맛집오씨 칼국수 를 소개해드릴까 하는데요 대전 사람들은 이미 많은 분들이 사랑하고 있는 대전... ,그래도 사랑 ♥,https://blog.naver.com/ggama1203,2021-10-06
대전 동구 :오씨칼국수 ,https://blog.naver.com/nannugul?Redirect=Log&logNo=222122953532,대전 맛집으로 유명한오씨칼국수 ~ 대전에서 오래 생활하신 지인의 추천으로 찾아가게 되었다. 대전에... 둘이 가면 무조건 칼국수물총 조합으로 시켜야한다길래 우리도 그렇게 주문~ 물총이 뭔가 했더니... ,"안녕,",https://blog.naver.com/nannugul,2020-10-22
대전 도룡동오씨 칼국수최초 분점 방문후기,https://blog.naver.com/ujin971300?Redirect=Log&logNo=221995302512,국물과 칼국수 국물을 섞어서 먹으면 꿀조합!!! 직접 만드는 면발 완전 쫀득! 삼성동오씨칼국수 랑 맛 똑같다 ㅋㅋ 김치까지도 ㅎㅎㅎ 집앞에 생기다니 너무 좋을걸 ㅋㅋ 파머스에서 장보고 맨날 갈 필이다... ,In meinem Raum,https://blog.naver.com/ujin971300,2020-06-09
[대전 맛집]오씨 칼국수폭풍 흡입 리뷰,https://blog.naver.com/blanche3203?Redirect=Log&logNo=222537260045,월요일오씨칼국수주주총회 하는것도 아니고 ㅠ 다들 한방에 쉬는거 시러요 ㅠㅠ 딱 기다려라. 오씨랑 담판 지으러 가는 우리. 너냐? 대전서 모르면 간첩인 가게가? 우리는 킹풍당당하게 칼국수 2인분... ,새벽소비,https://blog.naver.com/blanche3203,2021-10-15
대전여행오씨칼국수물총먹어보기,https://blog.naver.com/wwwai?Redirect=Log&logNo=222507674922,바로오씨칼국수물총칼국수 물총탕 수육도 먹으려고했지만 끝났다고해서 아쉬운대로 물총을 알게된건 대구에 조조칼국수 때문에 알게됨 술안주로 정말 굿굿 대전에서는 무엇이 다를까낭? 김치가 매콤했음... ,일상다반사,https://blog.naver.com/wwwai,2021-09-16
[대전맛집]오씨칼국수도룡점,https://blog.naver.com/name_sj?Redirect=Log&logNo=222022977565,대전은 칼국수의 도시입니다 ㅎ 그중에서도 저희가 자주 가는 삼성동오씨칼국수. 점심시간이나 저녁시간에 맞춰가면 무조건 번호표뽑고 대기타야하는 그런곳입니다. 집에서 삼성동보다는 가까운 도룡동에 첫... ,그놈블로그,https://blog.naver.com/name_sj,2020-07-06
 오씨 칼국수 ,https://blog.naver.com/stoner323?Redirect=Log&logNo=222533426196, 오씨 칼국수 라는 곳에 갔는데 이 곳은 맛집이라서 줄을 서서 먹는 곳이었다. 드디어 칼국수를 먹었는데....과연...인기 많은 집!ㅋ다 먹음....조개가 많구나...ㅋㅋ,내 블로그가 언제 만들어졌지...,https://blog.naver.com/stoner323,2021-10-11
5번째 칼국수 ' 오씨칼국수 ' 대전 동구 삼성동,https://blog.naver.com/re_meelee?Redirect=Log&logNo=222501976015," 오씨칼국수- 물총칼국수 - 2인분은 큰 대접에 나오고 개인 앞접시에 덜어 먹는다 가격 손칼국수 - 7,000원 파전 - 10,000원 방문날짜 및 날씨 9월 7일 오후12시경, 비옴 허기정도 둘다 첫끼로 많이 배고파서 칼국수... ",칼슐랭 가이드,https://blog.naver.com/re_meelee,2021-09-11
[대전]오씨 칼국수본점 (솔직후기),https://blog.naver.com/fmspwmal?Redirect=Log&logNo=221786350733,하고 옴 현충원 좋더라~ 생각보다 진짜 많은 분들의 무덤이 있었다 이렇게나 많았구나 싶더라 일단 메뉴... 먹는오씨칼국수 ~~ 맛있었당 그냥 칼국수 전문집!이라고 생각하면 된다 보통 동네마다 믿고 먹는... ,에드벨의 디저트 탐방,https://blog.naver.com/fmspwmal,2020-01-27
대전 삼성동오씨칼국수맛집 솔직 후기!,https://blog.naver.com/sjcar9999?Redirect=Log&logNo=222518230459, 오씨칼국수오씨칼국수물총탕 대전에 유명한 칼국수집 대전을 대표하는 칼국수집이라고 해도 과언이 아니에요 세종중고차 이야기가 한 번 방문해봤습니다 일단 개인접시 두당 하나씩 주고 거기에 조개껍데기... ,세종중고차 이야기,https://blog.naver.com/sjcar9999,2021-09-27
[대전맛집]대전 대표 칼국수 맛집!오씨칼국수 ,https://blog.naver.com/pyeeun1224?Redirect=Log&logNo=222526448068,파전도 존맛존맛~~ 티비에 안나와도 맛집인데... 여긴 진짜 대전에서 젤 맛있는 칼국수집이 아닐까^^ 겨울에 또 가야지 # 오씨칼국수#대전맛집 #대전삼성동맛집 #대전칼국수맛집 #대전칼국수,예니의 행복한 일상,https://blog.naver.com/pyeeun1224,2021-10-04
"대전 맛집오씨칼국수 , 물총 먹으러 왔어요",https://blog.naver.com/effy0424?Redirect=Log&logNo=221501769263,찾아 온 것처럼 되었다ㅎㅎ오씨칼국수 를 검색하면 대전 시내에 지점이 참 많은데 우리도 유사업체에... 담아오는오씨칼국수 의 칼국수. 완전 뜨거워!!ㅋㅋㅋ 칼국수 국물은 물총 국물이랑 보이기엔 비슷한데... ,에피의 날마다 좋은하루,https://blog.naver.com/effy0424,2019-03-31
"대전 맛집 -오씨칼국수: 물총칼국수,수제비",https://blog.naver.com/teemoticon?Redirect=Log&logNo=221547493064,"[ 대전 맛집 -오씨칼국수: 물총칼국수, 수제비 ] 안녕하세요 티이모에요 ^오^ 작년에 수원, 대전, 동해 등 지방에 있는 맛집들을 조금 돌아다녔습니다. 시간이 된다면 자주 지방에 여러 맛집들을 경험하고... ",티이모와의 연결 고리 ♂,https://blog.naver.com/teemoticon,2019-05-27
대전 동죽조개 물총칼국수오씨칼국수 ,https://blog.naver.com/cozy95?Redirect=Log&logNo=221401916174,대전 칼국수 맛집오씨칼국수대전 맛집오씨칼국수실내 풍경 메뉴판 원산지 안내 이번에 소개할 곳은 칼국수 맛집으로 대전 삼성동에 위치한오씨칼국수 입니다. 같은 이름으로 영업하는 집이 또 있는... ,아포의 맛집 탐방...德 不 孤 必 有 隣,https://blog.naver.com/cozy95,2018-11-19
대전 도룡동 [ 오씨칼국수 ] 물총칼국수 파전 맛집,https://blog.naver.com/daejeondosa?Redirect=Log&logNo=222542884820,음식맛: ★★★ 가성비: ★★★ 분위기: ★★★ 서비스: ★★★ 재방문의사: ★★★ #대전 # 오씨칼국수#대전맛집추천 #도룡동맛집 #도룡동회식 #도룡동가볼만한곳 #도룡동 오씨칼국수#칼국수... ,daejeondosa님의블로그,https://blog.naver.com/daejeondosa,2021-10-20
추운날 생각나는 대전맛집오씨칼국수 ,https://blog.naver.com/tcacyc?Redirect=Log&logNo=220868094360,오늘같이 쌀쌀한 날 딱인 대전 맛집오씨칼국수물총과 칼국수~~~ 네번째 갈 떄는 언제 생각날까 궁금해 지네요..ㅎㅎ 눈이 오면???ㅎㅎㅎ오씨칼국수건물 옆에 무료주차장이 있습니다.,일상탈출,https://blog.naver.com/tcacyc,2016-11-22
대전오씨 칼국수물총탕 맛있어요,https://blog.naver.com/khnmiso?Redirect=Log&logNo=221401199158,"대전 갈때마다 생각나는 칼국수~ 제가 빨간 국물의 매운 칼국수도 참 좋아하는데, 대전오씨칼국수 도 정말 좋아하는 맛집 중에 하나랍니다! 일요일 점심 12시 30분경에 갔는데, 늘 그렇듯이 오늘도 웨이팅... ",하니니,https://blog.naver.com/khnmiso,2018-11-19
"대전 물총 동죽 칼국수 맛집,오씨칼국수 ",https://blog.naver.com/duck_1052?Redirect=Log&logNo=221331124828,"저처럼 바지락 칼국수에 식상하신 분들에게 강추하는 칼국수입니다. 대전에서는 동죽이 드시고 싶으면오씨칼국수 에 가고, 꼬막이 드시고 싶으면 향미각에 가시면 됩니다~ ^^ ☆ 이 포스트가 도움이 되었다면... ",호기심 많은 올이의 세상엿보기,https://blog.naver.com/duck_1052,2018-08-02
대전 삼성동 : 물총이 가득한오씨칼국수 ,https://blog.naver.com/dbfl6347?Redirect=Log&logNo=221298219950,"대전 칼국수 대전 칼국수 맛집오씨 칼국수예전부터 유명했던 이곳! # 오씨칼국수대학 다닐 때부터 가보고 싶었는데, 드디어 다녀왔다. 유명한곳 답게 역시나 웨이팅! 점심엔 아무래도 웨이팅이 더 많을듯하다.... ",유리나의 소소함 가득-:),https://blog.naver.com/dbfl6347,2018-06-13
대전 칼국수 맛집오씨칼국수유명할만 한데,https://blog.naver.com/yami0429?Redirect=Log&logNo=221342616996,신랑이 일을 빛의 속도로 끝마치고 5시쯤 지인 추천으로 가게 된 대전오씨칼국수오씨칼국수 ~ 대전까지 와서 칼국수라니 ㅜ_ㅜb 메뉴가 마음에 들지 않았으나 맛집을 찾아보기엔 시간이 없어 일단 먹는 걸로... ,지안&이안의 아름다운 동행♥,https://blog.naver.com/yami0429,2018-08-20
비오는 날엔 칼국수! 대전 삼성동오씨칼국수 ,https://blog.naver.com/jbrz?Redirect=Log&logNo=221276989405, 오씨칼국수 의 메뉴판입니다. 메뉴는 포장 가능하고 칼국수는 2인분이상부터 포장이 가능해요. 포장을 하면 김치를 많이 안주셔서 꼭 먹고 가야한다는 동생 ㅋㅋㅋ 뚝배기 한그릇 다 먹어치워야한다나 ㅋㅋ... ,장데렐라의 소소한 일상 ♡,https://blog.naver.com/jbrz,2018-05-16
대전 물총탕 칼국수 맛집 /오씨칼국수 ,https://blog.naver.com/hleonardo112?Redirect=Log&logNo=221544733200,"아주 만족스런 한끼를 하고서 커피숍으로 고고 ~~ 이상 누구든 가서 후회없을 칼국수 맛집오씨칼국수 였습니다.오씨칼국수위치와 전화번호 , 영업시간 남기며 저는 이만 퇴장합니당 !! 오늘도 행복한 날... ",♡ 여우비 ♡ House !!,https://blog.naver.com/hleonardo112,2019-05-23
[대전역] 원동오씨칼국수(물총에 소주 좋다!!!),https://blog.naver.com/kkiibbb?Redirect=Log&logNo=221503568381,[대전역] 원동오씨칼국수(물총에 소주 좋다!!!) 큰집이 대전이여서 나름 대전을 많이 가봤다고 했는데 (하긴 외식보다는 큰집에서 먹고 마셨기에...) 여기 물총(동죽) 칼국수로 널리 이름을 알린오씨칼국수 는... ,스봉이네 스봉이,https://blog.naver.com/kkiibbb,2019-04-03
"원조는 다르다! 대전 물총 동죽조개 칼국수 맛집,오씨칼국수 ",https://blog.naver.com/duck_1052?Redirect=Log&logNo=221382222581,물총칼국수는오씨칼국수 에서~ 줄 서서 기다려도오씨칼국수 에서~ 입맛에 안 맞을 수도 있지만 그런 평가도오씨칼국수 에서 먹어보고~ 오후 세 시를 넘어서 도착했는데도 대기표 받고 기다렸습니다. 매장 안쪽에... ,호기심 많은 올이의 세상엿보기,https://blog.naver.com/duck_1052,2018-10-22
