title,link,description,bloggername,bloggerlink,postdate
대연동고기집 한우 완전 꿀맛우두머리 ,https://blog.naver.com/wse927?Redirect=Log&logNo=221205810952,대연동고기집 완전 맛있음우두머리올만에 대연에 놀러 후후 그리고 맛있는 한우를 먹었지!! 대연동고기집우두머리진심 꿀맛이었음!! 오 입구부터 고기가 가득해ㅋㅋㅋ 입장입장 기본찬도 다양하고 정갈쓰... ,TODAY'S PLAYLIST,https://blog.naver.com/wse927,2018-02-10
앤썸 - 인터셉터 '무리우두머리 ' 플레이 영상,https://blog.naver.com/dkdid7881?Redirect=Log&logNo=221453399502,인터셉터 '무리우두머리 ' 플레이 영상 오늘(28일)로써 앤썸의 VIP 데모 버전이 끝이났습니다. 마지막... 이번 영상은 앤썸의 레이드 보스라고도 불리는 '무리우두머리 ' 의 플레이 영상입니다. 플레이 자벨린은... ,KimSilver AND Blog,https://blog.naver.com/dkdid7881,2019-01-29
리더십을 키우려면? 집단의우두머리 가 되는 방법,https://blog.naver.com/kimss3k?Redirect=Log&logNo=195015595,"집단의우두머리 가 되는 방법 어느 집단이던 간에우두머리 , 대표, 사장, 등의 리더자가 존재하기 마련이죠. 조금은 더 명예롭고 높은 자리를 꿈꾸는 사람들이 많기 때문에 많은 살마들이 이렇게 리더십을... ",떼이군의 연애공식&삶의공식,https://blog.naver.com/kimss3k,2013-09-12
늑대의우두머리 ... 늑대의 리더... 리더(Leader),https://blog.naver.com/yblee1014?Redirect=Log&logNo=70069101874,이끄는우두머리늑대 싸움 무리 안에서 싸움이 벌어질 때우두머리 가 개입한다 제압의 방법은 폭력이 아닌 장난우두머리 는 싸우고 있는 늑대 중 힘이 센 늑대에게 장난을 걸고 장난을 통해 동료를 향했던... ,"짱,My Life",https://blog.naver.com/yblee1014,2009-09-13
부산맛집/ 부산 대연동우두머리 ,https://blog.naver.com/santafe139?Redirect=Log&logNo=221302442320,주말에 그림공부하고 원영샘하고 찾아간 대연동우두머리 . 완전 맛집^^ 잘~ 먹고 나오면서 간판사진 찍었네요. 오랫만에 정말 맛있게 잘 먹었거든요. 한우 안심구이. 사장님이 너무 맛있게 구워 주셨어요. 며칠 전... ,소피아앤,https://blog.naver.com/santafe139,2018-06-19
"40,000: 쉐도우스피어 - 부마자(Daemonkin)들의우두머리 ",http://lapis00.egloos.com/6455310,Daemonkin)들의우두머리나츠문드 건틀렛(Nachmund Gauntlet)을 둘러싼 전투의 열기가 네멘드가스트... Daemonkin)들의우두머리네멘드가스트(Nemendghast)에서 어둠의 군단(Black Legion)을 지휘한 자는... ,Data Recovery Foundation,http://lapis00.egloos.com/,2019-03-01
검은사막 월드우두머리크자카 출현 정보,https://goodman.tistory.com/4642,여러분들 오늘은 제가 여러분들에게 월드우두머리크자카가 출현 확률이 증가를 했다고 해서... 이벤트 기간에 강력한 월드우두머리악몽을 빚는 크자카 출현 확률이 증가합니다. 악몽을 빚는 크자카는... ,크롱다다소소한일상,https://goodman.tistory.com/,2020-09-23
검은사막m 월드우두머리파편 장신구 아이템 획득하자,https://goodman.tistory.com/4627,"물품 교환 가능한 아이템은 루트라곤 장신구 선택상자,유물 파편,복불복4~5세대 반려동물상자,카프라스의 흔적 진홍색 왕관,월드우두머리파편상자,샤카투 교환증서,연금석 파편,황금인장 이벤트 지역에... ",크롱다다소소한일상,https://goodman.tistory.com/,2020-09-16
대연동 한우맛집 살살 녹는우두머리 ,https://blog.naver.com/wse927?Redirect=Log&logNo=221298161695,대연동 한우맛집 살살 녹는우두머리후후후 한우 먹으러 또 방문한 대연동 한우맛집우두머리 !! 크~ 저번에 가서 즉석양념구이 겁나 맛있었어서 ㅋㅋ 이번엔 이번엔 양념말고 제대로 구워먹고자 행복하고 맑은... ,TODAY'S PLAYLIST,https://blog.naver.com/wse927,2018-06-13
[디아블로 3] 정벌 -우두머리사냥 공략,https://blog.naver.com/boccerini?Redirect=Log&logNo=221366776059,15시즌에 다시 등장한 [ 우두머리사냥]입니다. 고행 X단계에서 20분 내에 모든 막의 보스를 처치하면... 25 - 정벌 [ 우두머리사냥] 클리어. 다음은 악마사냥꾼 솔플 클리어 영상입니다. 이동은 다네타 세트로... ,은현★의 블로그,https://blog.naver.com/boccerini,2018-09-28
부산대연동맛집우두머리가성비 좋은 고기집,https://blog.naver.com/wkddnsdud00?Redirect=Log&logNo=221195939049,부산대연동맛집우두머리가성비 좋은 고기집 일요일만 쉬는 아빠가 토요일 일요일 다 쉬게 되어... ㅋㅋㅋ 대연동고기집우두머리 에 다녀왔어요 평화공원 및 UN공원 방문객들이 추천하는 매장이라고 하더라는..... ,좌충우돌 채원이네 이야기♡,https://blog.naver.com/wkddnsdud00,2018-01-30
"부산대연동맛집 | 대연동고기집우두머리 , 부산늦게하는맛집",https://blog.naver.com/leetndls?Redirect=Log&logNo=221280232376,대연동한우맛집우두머리 에 갔다왔어요~ 보통 이런 고기집이나 밥집들은 늦어도 밤 11시나 12시 정도까지밖에 영업을 안하던데.. 대연동맛집우두머리 는 새벽2시까지 영업해서 늦은시간에 한우가 땡긴다! 할때... ,All I Need is Love♥,https://blog.naver.com/leetndls,2018-05-20
[디아블로 3] 정벌 -우두머리사냥 (5막 보스위치),https://blog.naver.com/boccerini?Redirect=Log&logNo=221371645040,사실상 5막은 팁이랄게 없는 ㅠㅠ 그래서 왠만하면우두머리사냥은 아드리아가 퀘스트로 있을 때...우두머리사냥을 이미 클리어한 사람에게 도움을 받는 것도 방법이며 몇 보스는 한 두 번만 해보셔도 아... ,은현★의 블로그,https://blog.naver.com/boccerini,2018-10-05
[디아블로 3] 정벌 -우두머리사냥 (2막 보스위치),https://blog.naver.com/boccerini?Redirect=Log&logNo=221366901776,있지만우두머리사냥에서는 잡지 않으니 비디안은 무시하시면 되겠습니다. 유일하게 길이 유동적인... 벨리알 모두 차원문에서 멀지 않은 곳에 있으며 늘 고정위치에 존재하므로 파티플레이로우두머리 ... ,은현★의 블로그,https://blog.naver.com/boccerini,2018-09-28
보약의우두머리 라 불리는 '황기',https://blog.naver.com/theomniherb?Redirect=Log&logNo=222477702329,보약의우두머리 라 불리는 황기는 일반인에게는 닭백숙이나 삼계탕의 주재료로 명칭은 잘 알려져 있습니다. 황기는 단맛과 따뜻한 성질이 있으며 비장과 폐장에 작용하여 기를 보하는 효과가 있습니다. 옛부터... ,옴니허브 공식 블로그,https://blog.naver.com/theomniherb,2021-08-20
냉방병 예방법우두머리 가 알려드려요!,https://blog.naver.com/wdmr7?Redirect=Log&logNo=220750969153,"배려를 드는우두머리 입니다. 요즘 날이 하루가 다르게 더워지는 만큼, 에어컨은 끊임없이 가동이 되고... 오늘은 여러분이 건강을 잘 지키실 수 있도록우두머리 에서 냉방병 예방법을 알아보도록 할게요. 우선... ",안녕하세요 우두머리입니다,https://blog.naver.com/wdmr7,2016-07-01
"비 오는 날엔 소고기♪ 대연동고기집,우두머리추천해요!",https://blog.naver.com/hey_niceday?Redirect=Log&logNo=221223968880,"내려오면우두머리간판이 보여요 'ㅅ'* 대로변에 위치해 있어서 발견하기는 몹시 쉽다는 점. 매장... 흰 뼈 옆 부분이 새우살인데 (새우살처럼 생겨서) 다른 고깃집은 별도로 비싸게 판매한다는데,우두머리 는... ","잊지마, 넌 나의 페이보릿",https://blog.naver.com/hey_niceday,2018-03-07
영화 ‘명량’에 나온 한자 몇 글자... 우두머리수 (帥),https://blog.naver.com/justmeet?Redirect=Log&logNo=220088283384, 우두머리수 (帥) ‘명량’의 관객 동원이 탄력을 받은 것 같습니다. 본인도 직접 봤지만 이순신 장군의... 帥 ( 우두머리수) 이순신 장군이 탄 배에는 ‘대장’이 타고 있음을 표시하는 깃발이 걸려 있습니다. 그... ,지식창고(知識倉庫),https://blog.naver.com/justmeet,2014-08-11
안녕하세요우두머리 입니다,https://blog.naver.com/wdmr7?Redirect=Log&logNo=220711844885,지키는우두머리 입니다. 언제나 사랑해주시고 응원해주시는 고객님들께 정말 감사드립니다 :) 좀더 여러분과 가까이 소통하고자 공식 블로그를 개설하게 되었는데요!우두머리 의 스토리들을 함께했으면 합니다!... ,안녕하세요 우두머리입니다,https://blog.naver.com/wdmr7,2016-05-17
Wolf’s Story = 6 = 사회습성과우두머리 (AlphaPair),https://blog.naver.com/gjwnskko?Redirect=Log&logNo=120096468291, 우두머리그룹은 모든 팩의 부모입니다. 한 그룹의 무리는 넓은 영역을 가지게 됩니다. 영역의 넓이는 먹이의 양에 따라 좌우됩니다.우두머리그룹의 늑대들만이 영역을 표시하는데 암컷도 다리 한 쪽을 들고... ,..........,https://blog.naver.com/gjwnskko,2009-12-07
침착하고 일관성 있는우두머리되기..,https://blog.naver.com/beagle_robin?Redirect=Log&logNo=130123926706,"^^ 무엇보다 개들 스스로 나를우두머리 로 결정하고, 자율적으로 내 권위를 따라야 한다는 것이... 침착함은우두머리 에게 가장 중요한 자질이다. *무시하기* 사람들은 그동안 음성언어, 말, 소리를 의사표현과... ",매력덩어리 라윤이네,https://blog.naver.com/beagle_robin,2011-11-15
꽃의우두머리 ,https://blog.daum.net/heuksanisland/1028,매화는 ‘꽃의우두머리 ’를 의미하는 ‘화괴(花魁)’라 불릴 만큼 아름답다. 꽃잎과 꽃받침이 각각 다섯 장이다. 매실이 익을 즈음 장마가 시작된다. 그래서 장마를 ‘매우(梅雨)’ 혹은 ‘매림(梅霖)’이라... ,설야에 피는 꽃,https://blog.daum.net/heuksanisland,2018-07-29
크로스백추천 :: 배려를 가방에 넣은우두머리 ,https://blog.naver.com/ssinayo?Redirect=Log&logNo=220716878143,"쇼핑몰우두머리 에서 겟한 S_Black 제품이에요!! 색상은 Scarlet, Brown, Right brown, Beige, Black 총 5가지가 있더라구요~~우두머리제품들은 거의 제작상품이라 주문전 별도 문의 해주시긔 Brown 색상도 예뻐 보였는데 전... ",T걸의 예뻐지기,https://blog.naver.com/ssinayo,2016-05-23
부산대연동맛집 : 대연동 고기집우두머리 에서 한우 촵촵,https://blog.naver.com/jung_0330?Redirect=Log&logNo=220846601495,부산대연동 맛집 :우두머리고기는 언제나 진리! 그중 한우는 단연 사랑이죠ㅋㅋㅋ 대연동 평화공원 근처 고기집인우두머리 를 방문했어요. 무쇠 솥뚜껑 한우암소구이 간판만으로도 군침이 돌기... ,인생을 즐기는 쩡이's,https://blog.naver.com/jung_0330,2016-10-27
대구 장기동 맛집우두머리 ,https://blog.naver.com/wnl089?Redirect=Log&logNo=220653571371,장기동 먹자골목 맛집 ::우두머리장기동 먹자골목 안에 있는우두머리 ~ 전에 녹슨드럼통 있던 자린데 어느순간 없어지고 새로 생겼다! 된장이나 김치찌개는 써비스라고~~ 이런 서비스 주는집 좋당!ㅋㅋ 고기... ,만슈 블로그,https://blog.naver.com/wnl089,2016-03-13
대연동 가족외식 한우집우두머리꿀맛,https://blog.naver.com/doodong0828?Redirect=Log&logNo=220755543717,대연동 가족외식 한우집우두머리꿀맛 오랜만에 남편과 간 한우집우두머리아기가 소고기를 그렇게 좋아한다면서요 ? 한달뒤 나올 까꿍이를 위해 간 한우집 ! 대연동 가족외식 으로 좋은 한우집... ,재미나게살자,https://blog.naver.com/doodong0828,2016-07-06
"대연동고기집,부산대연동맛집 -우두머리 에서 한우 냠냠!!",https://blog.naver.com/moonsaku?Redirect=Log&logNo=220843777741,"부산 대연동 맛집으로우두머리 라는 한우집이 있어서 다녀왔습니다! 어쩐지 삼겹살은 경성대에서, 한우는 대연동에서 먹는편인데요 ㅋㅋ (그냥 제기준)우두머리한우집 찾아가기는 엄청 쉽습니다! 부산... ",님의 블로그,https://blog.naver.com/moonsaku,2016-10-24
"머리,우두머리 , 마리, 마루",https://blog.naver.com/innerlight34?Redirect=Log&logNo=221219218235,"머리,우두머리 , 마리, 마루 머리 : 「1」사람이나 동물의 목 위의 부분. 「2」생각하고 판단하는 능력. 「3」=머리털. 「4」한자에서 글자의 윗부분에 있는 부수. 「5」단체의우두머리 . 「6」사물의... ",innerlight34님의 블로그,https://blog.naver.com/innerlight34,2018-03-01
볼륨매직 파마 안산 중앙동 미용실우두머리 ,https://blog.naver.com/kilwoo765?Redirect=Log&logNo=220240547068, 우두머리미용실입니다. 곱슬머리분들은 매직기가 나온것을 항상 감사한 마음으로 산다고 합니다. 머리는 볼륨감을 주면서 곱고 매끄럽게 펴주고 머리끝은 C컬로 마무리합니다. 안산 중앙동 미용실우두머리 ... ,사랑과 섬김으로,https://blog.naver.com/kilwoo765,2015-01-15
201903 부산/ 우두머리#대연동 소고기 #대연동 한우 맛집,https://blog.naver.com/star__kitty?Redirect=Log&logNo=221482879331,# 우두머리부산 남구 유엔평화로 37 부산 남구 대연동 899-7 051-622-5773 영업시간 월-토 PM 15:00 - 익일 AM 02:00... 맛집우두머리 는 부산은행 끼고 돌아서 쭉 직진하다보면 국밥집으로 유명한 쌍둥이 국밥집 2호점 옆에... ,YEAHGC 36.5,https://blog.naver.com/star__kitty,2019-03-07
"우리가 그토록 꿈꾸는우두머리 , 사장되는법",https://blog.naver.com/kimss3k?Redirect=Log&logNo=206669343," 우두머리 로써 막중한 책임감을 짊어져라. 사장되는 법에 있어서 또 하나 중요한 것은 바로, 위치에 대한... 누구나가 꿈꾸는우두머리 의 자리.. 바로 사장이라는 위치. 하지만 이상적이고 명예로운 그런 자리가... ",떼이군의 연애공식&삶의공식,https://blog.naver.com/kimss3k,2014-03-21
여성 크로스백추천우두머리넘나 예쁜 것 ♪,https://blog.naver.com/mmaa87?Redirect=Log&logNo=220718127309,넘나 예쁨 ♥ 하앍하앍 정말 진짜 대박 짱짱 예쁨 가방 쇼핑몰 ' 우두머리 ' 라는 곳에서 판매하고 있는 S... 이래서우두머리 인가 ㅋㅋ 귀욤귀욤 어머!! 넘나 날씬하게 나왔잖아?! 요즘 오빠의 사진 찍는 실력이... ,"맘마의 뷰티, 패션 스토리♪",https://blog.naver.com/mmaa87,2016-05-24
검은사막 윈터시즌 업데이트 월드우두머리쿠툼에 대해 알아보자,https://bongrye001.tistory.com/5317,바로 월드우두머리쿠툼 이 업데이트 되었다는 소식~ 그래서 오늘은 그 쿠툼에 대해 자세하게 알아보는... 월드우두머리 입니다. 이전에는 볼 수 없었던 쿠툼의 파멸적인 모습에 고고학자 데살람은 '먹구름을... ,짱구><,https://bongrye001.tistory.com/,2021-01-20
 우두머리 _ 대연동맛집/대연동고기집/부산대연동맛집... ,https://blog.naver.com/sojoyol?Redirect=Log&logNo=221183088880, 우두머리가게 맞은편 탐앤탐스주차장에 주차해놓고우두머리 로 고고 쌍둥이돼지국밥 유명한거 아는 사람은 다 알듯 바로 옆에 있는우두머리가게 앞에 있는 소모양의 대형풍선이 넘 귀엽당 똥띠랑 같이... ,[성쭈] 오늘 하루♡,https://blog.naver.com/sojoyol,2018-01-11
테러집단의우두머리 는 최면술사?,https://blog.naver.com/ohilkwon3335?Redirect=Log&logNo=20014931,자살 테러 집단의우두머리 는 최면술 마스터다? 자살폭탄 테러를 자행하는 테러 집단의우두머리 가 최면술의 대가일 확률이 높다는 연구결과가 나왔다는 괴담이 사실인 것으로 확인됐다. 인도네시아와 발리에서... ,일권네찰매생이,https://blog.naver.com/ohilkwon3335,2005-11-30
"인천 삼산동 맛집, 정가네우두머리소머리 국밥!",https://blog.naver.com/lalad?Redirect=Log&logNo=220734421305,"인천 삼산동 맛집, 정가네우두머리소머리 국밥! 지난주, 갑자기 국밥이 먹고싶어 방문한 정가네우두머리소머리 국밥! 지나가면서 종종 봤는데, 방문은 처음. 메뉴판을 쭉- 보다가 소머리국밥 한 그릇... ",릴리랄라 행복한 일상♪ 맛집/운동/IT,https://blog.naver.com/lalad,2016-06-12
블랙빼기 안산 붙임머리 잘하는곳우두머리추천,https://blog.naver.com/kilwoo765?Redirect=Log&logNo=220211183989,"^^ 안산에서 붙임머리를 잘하는곳우두머리미용실만의 손상 없는 블랙빼기와 붙임머리 동시 작업에... 오연서, 현아 등 레드브라운 컬러는 연예인들의 단골 컬러 아이템이죠^^ 붙임머리 안산 추천우두머리 ... ",사랑과 섬김으로,https://blog.naver.com/kilwoo765,2014-12-16
"[디아블로3 시즌10] 정벌,우두머리사냥, 솔플 성공",https://blog.naver.com/rodoss75?Redirect=Log&logNo=220977094002,"디아블로3 의 정벌 업적중의 하나인우두머리사냥 투검 악사로 솔플 성공했습니다. (스샷이 흐릿하게 찍혔네요 ㅡ,.ㅠ)우두머리사냥은 아래 16마리의 정예를 고행 X 난이도에서 20분 이내에 모두 처치하는... ",꿈이 자라는 놀이터,https://blog.naver.com/rodoss75,2017-04-06
대연동고기집우두머리암소한우 가 울면 육즙이 떨어져?,https://blog.naver.com/xoxo6514?Redirect=Log&logNo=221458835293,대연동우두머리 를 오랫만에 방문했더니 사장님께서 친동생 온것마냥 반겨주셔서 이맛이 소고기집... 있는우두머리강추 이게 진정 참 사랑이지 ..우두머리 는 일단 앉아서 한우모듬 한세트를 주문하면 둘이서... ,부산블로거 도로시 블로그,https://blog.naver.com/xoxo6514,2019-02-05
[산청맛집/원지] 한우곱창전골이 맛있는 ' 우두머리 식당'...,https://blog.naver.com/suya6904?Redirect=Log&logNo=220927845012,산청 원지 ' 우두머리 식당' 한 우 곱 창 전 골 지난 주말(2/4)에 산청군 원지에 있는 백마산 - 월명산... 주 소 : 경남 산청군 신안면 원지강변로63번길 32 전 화 : 055-973-0558우두머리 식당은 작은 식당이지만... ,느티나무의 세상사는 이야기,https://blog.naver.com/suya6904,2017-02-07
맛집/부산 소고기맛집] 오랜만에 맛있는 데이트 ' 우두머리 ',https://blog.naver.com/tinda_com?Redirect=Log&logNo=220871384908,"부산 대연동 맛집, 부산 소고기 맛집 -우두머리위치 : 부산광역시 남구 유엔평화로 37 전화번호 : 051-622-5773 랑이가 요새 통 피곤해하고 기력이 없어 보여서 대연동맛집우두머리소고기집에 방문했습니당... ",김아지가 머무는 곳 daily,https://blog.naver.com/tinda_com,2016-11-26
추수감사절 이벤트!우두머리타르가르고 레이드하고 꿀템 얻자,https://blog.naver.com/thdbdlaeo?Redirect=Log&logNo=221399622115," 우두머리타르가르고 레이드일것 같은데요 발레노스 - 플레메 언덕에 등장하는 타르가르고는 검은사막 월드에서는 15시와 23시 15분, 검은사막 틴월드에서는 15시와 22시에 등장한다고 합니다 그렇게우두머리 ... ",게임탐구생활,https://blog.naver.com/thdbdlaeo,2018-11-16
대연동 맛집/대연동고기집] 암소 한우가 맛있는 대연우두머리 !,https://blog.naver.com/bir_tanem?Redirect=Log&logNo=220793213625,"국내산 암소를 즐길 수 있는 곳:)우두머리주소: 부산광역시 남구 유엔평화로37 (부산시 남구 대연동 889-7) 전화번호: 051-622-5773 영업시간: 15:00 ~ 02:00(1,3주 월요일 휴무) 대연 사거리 맛집이에요!우두머리이름이... ",천천히되는,https://blog.naver.com/bir_tanem,2016-08-21
[하스스톤] 하켓몬우두머리소개 -2부-,https://blog.naver.com/gard7251?Redirect=Log&logNo=220921979781,사실 많은 사람들이 쓰는우두머리 들은 1부에서 소개 했기 때문에 2부에서는 잘 안쓰이는우두머리 들을 소개하게 되었다. 1부는 여기서.. [드루이드-폭군 서슬송곳니] 검은 바위산 4구역 1 스테이지의우두머리 ... ,냐소가 아니라 가드,https://blog.naver.com/gard7251,2017-01-28
[디아블로3] 시즌4우두머리사냥 완료~,https://blog.naver.com/hoinblog?Redirect=Log&logNo=220474795516,[디아블로3] 시즌4우두머리사냥 완료~ ▲ 총 16마리의 보스다. 이걸 30분안에 해치우라고? 하지만 결론은 가능하다. 전에 정벌 업적들을 훑어보다가 ' 우두머리사냥' 업적을 봤을 때 이건 파티로 해야겠구나라고... ,호인 블로그,https://blog.naver.com/hoinblog,2015-09-07
"부산 대연동맛집, 대연동고깃집우두머리 에서 저녁을:D",https://blog.naver.com/seohyeyeong?Redirect=Log&logNo=220762504544,"룰루랄라 예전에 알바하러 왔다 갔다 하는 길에 있던우두머리 !! 내가 제일 좋아하는 1등 음식이... 고기만 먹어도 배가 불렀지만, 벽면에 이런 게 있길래 ㅋㅋㅋ우두머리식사는 야채비빔밥으로 마무리!! 배가... ",서꿀빰,https://blog.naver.com/seohyeyeong,2016-07-15
