title,link,description,bloggername,bloggerlink,postdate
디아블로3 시즌 정벌 :우두머리사냥 (악마사냥꾼 영상),https://blog.naver.com/dance8090?Redirect=Log&logNo=221965743535,하니우두머리사냥 미션하면서 영상하나 찍어봤습니다. 컴이 그리 좋지않아 폰으로 찍은데다 노트북 디스플레이 패널도 그리 좋지않아 영상 화질이 그리 좋지는 않을겁니다.우두머리사냥 - 고행 X (10단)... ,구공탄의 영화와 넷플릭스,https://blog.naver.com/dance8090,2020-05-16
모험모드-지옥불의 시련 도전모드우두머리격파일지,https://blog.naver.com/gard7251?Redirect=Log&logNo=222011672372,일곱번째 상대 여군주 바쉬 아즈샤라 일파의 궁녀우두머리 로 아즈샤라 일파 타락 전까지는과거 티란데의 라이벌 포지션 캐릭터였다. 별다른 특징은 없고 번개 주문을 밥 먹듯이 써댄다.대모 샤라즈처럼 3마나... ,냐소가 아니라 가드,https://blog.naver.com/gard7251,2020-06-25
검사모 대양우두머리칸 출현! 인기모바일게임 검은사막... ,https://blog.naver.com/meniereman?Redirect=Log&logNo=222099603385,이후 「 우두머리칸」 콘텐츠를 선보였습니다. 검사모가 인기모바일게임 자리를 꾸준히 차지하고 있는 이유는 이렇듯 계속하여 신규 콘텐츠를 선보이기 때문이 아닌가 싶은데요. 이번에 선보인우두머리칸은... ,매니에르의 게임 블로그,https://blog.naver.com/meniereman,2020-09-25
부산 대연동 가심비 빵빵한 한우 식당 # 우두머리 ,https://blog.naver.com/sikimmm1?Redirect=Log&logNo=222538761761,부산 출장 중 들린 한우 잘하는 식당 대연동 # 우두머리소개할래요.우두머리부산 남구 유엔평화로 37 http://naver.me/xT867oWK 왜냐면 너무 맛있었거든요. *음료수 제공 등 협찬 1도 없는 개인 리뷰입니다. 한우... ,"마케팅, 일상, 의식의 흐름.",https://blog.naver.com/sikimmm1,2021-10-16
모바일 공략] 모바일게임순위 상승!우두머리칸 대비 준비 과정,https://blog.naver.com/sachiel5?Redirect=Log&logNo=222099649019,"1주일에 한번 보상도 푸짐한 검은사막 모바일 칸 레이드 칸우두머리레이드의 경우 매주 토요일 20:00시 대양, 로스 해역의 오킬루아의 눈에서 등장을 하며 10월 6일 점검 전까지는 화요일 20:00에도 등장한다.... ",사키엘의 블로그,https://blog.naver.com/sachiel5,2020-09-25
[부산/대연동] 소고기 맛집 ' 우두머리 ',https://blog.naver.com/cks1688?Redirect=Log&logNo=222284737875,그래서 무쇠불판 같은곳으로 소고기 파는 곳 없나 찾다가 발견한 곳이 바로우두머리 다. 다닌 지는 몇년...우두머리 에선 철판에 고기 달라 붙는걸 방지하기 위해 소 기름을 덩어리로 주는데 그 기름을 내어... ,- 견우별 The starseeker -,https://blog.naver.com/cks1688,2021-03-23
"MMORPG추천 검은사막 썸머시즌에서 투발라,우두머리장비... ",https://blog.naver.com/114632?Redirect=Log&logNo=222478719116,"그리고 해당 서버 목표는 [ 61레벨 ], [ 메인퀘 완료 ], [ 투발라 장비 동(V)등급 달성 ], [우두머리장비... ▶ 메인퀘 악몽의 정체-[ 우두머리 ]족장 기아스 (약 1시간) ▶ 은화 3,000천만 (금괴100G 3개) 획득... ",소냉순,https://blog.naver.com/114632,2021-08-21
하스스톤 전장 영웅( 우두머리 ) 티어표/추천 정리 + 공략,https://blog.naver.com/frostylight?Redirect=Log&logNo=221920897095,"공식 명칭은우두머리 지만 다들 영웅으로 쓰고 있어서 편의상 영웅으로 씁니다. 일단 최상위권을 찍던 밀하우스 마나스톰이 너프로 구려졌다는 점을 짚고 넘어가야 하는데, 정확한 티어는 시간이 지나야... ",로네 만화번역공장,https://blog.naver.com/frostylight,2020-04-21
가평읍내우두머리 국밥 코다리구이 먹으면 청국장이 같이나와요,https://blog.naver.com/pihcap?Redirect=Log&logNo=222351200424,가평읍내 # 우두머리 국밥 해장국이 먼저 눈에 들어옵니다 대표메뉴가 해장국인듯 하지만 매뉴들이... 착하네요 # 우두머리 국밥 대표님께서 #코다리구이 를 먹기좋게 잘라 주시는데 #코다리양념 이 맛도좋고... ,"용추파파,용추계곡뜰.",https://blog.naver.com/pihcap,2021-05-14
검찰우두머리 의 묘간은 매우 중요하다,https://blog.naver.com/yulexa?Redirect=Log&logNo=222233749792,보스라는 말을 표준국어대사전에서는“실권을 쥐고 있는 최고 책임자”라고 풀이하고 있고 순화어로우두머리 를 제시하고 있다.우두머리 라는 말은‘역전 앞'처럼 중복 표현 같이 들린다. 역전 앞은 한자+ 한글... ,유무등등인(有無等等人),https://blog.naver.com/yulexa,2021-02-09
검은사막 - 아무도 안 잡는 이벤트우두머리이자벨라,https://blog.naver.com/me8952?Redirect=Log&logNo=222129371852,-헥세 마리와 동일한 혐오스러운 패턴과 쫄 소환에 광역기까지 -월드우두머리버금가는 정신 나간 피통과 대미지 -하지만 레이드 참여자는 1/5도 안됨. 직장인을 고려하지 않은 등장 시간대(평일 오전 12:45... ,프리맨님의 블로그,https://blog.naver.com/me8952,2020-10-28
[생활정보쏙쏙]우두머리 는 다 수컷일까? NO! 암컷이우두머리 ... ,https://blog.naver.com/seouledu2012?Redirect=Log&logNo=222309811187, 우두머리 는 모두 수컷일까요? 오늘은 암컷이우두머리 인 동물들에 대해 알아보도록 해요. 『코끼리』 육지에 사는 동물 중 가장 몸집이 큰 동물인 코끼리는 암컷이 가족을 이끄는 대표적인 모계사회... ,서울교육나침반,https://blog.naver.com/seouledu2012,2021-04-15
대연동 소고기 맛집우두머리2차는 역전할맥,https://blog.naver.com/soyeon__p?Redirect=Log&logNo=222454039863,대연동우두머리 를 소개합니다. 대연동 쌍둥이돼지국밥집 바로 옆에 위치한 대연동우두머리牛두머리라니 소대장?이라는 뜻이겠죠? 유엔공원 산책 갈 때마다 사람이 북적북적이길래 한 번은 와봐야지... ,소실이의 부동산&맛집,https://blog.naver.com/soyeon__p,2021-08-02
사도행전 24장. 이단의우두머리 ,https://blog.naver.com/solideocjw?Redirect=Log&logNo=222371160522,"이단의우두머리스토리 로마 총독의 관저에서 벌어진 재판에 대제사장 아나니아는 장로들과 변호사... 그들은 바울을 '전염병 같은 자', '유대인을 다 소요하게 하는 자', '이단의우두머리 '라고 고발했습니다.... ",코칭CEO,https://blog.naver.com/solideocjw,2021-05-28
이번 선술집 난투 '신년맞이 선술집 꾸미기'우두머리한 방에... ,https://blog.naver.com/94wlgns?Redirect=Log&logNo=222197103011,"이번 난투의우두머리 인 '종이박 골렘'. 종이박 골렘(5/85)우두머리 , 도발. 주문의 대상으로 지정되지 않습니다. 사탕으로 가득합니다! 하지만 '종신 교수 투랄리온' 이 함께한다면...?! 종신 교수 투랄리온(3/12)... ",Moch's Space,https://blog.naver.com/94wlgns,2021-01-05
인기게임순위 검은사막 모바일우두머리칸 공략,https://blog.naver.com/kkodug9?Redirect=Log&logNo=222100664676,"궁극적인우두머리칸을 공략하는 것까지 되겠습니다. 3단계 선박을 제작하기 위해선 선박 개량 부품... 모든 준비가 끝났으면 이제우두머리칸을 만날 차례입니다. 이야기에서 '대양의 주인, 칸'을 진행하다... ",영원한도시 블로그,https://blog.naver.com/kkodug9,2020-09-27
세계의 민주화..2022년 베이징 시진핑을우두머리 로 하는... ,https://blog.naver.com/gameydh?Redirect=Log&logNo=222086226655,2022년 베이징 시진핑을우두머리 로 하는 공산당 올림픽이 아닌 2022년 베이징 세계 민주화를 축하하는... 이제 5년전 미국-유럽-아시아 세계가 힘을 다해 시진핑을우두머리 로 하는 중국 공산당을 막아 세계... ,한일 교류(韓日)··자본주의로부터 가치 주의에,https://blog.naver.com/gameydh,2020-09-11
검은사막 ‘동 등급우두머리장비 확정 개량’ 시스템 업데이트,https://blog.naver.com/20min_830?Redirect=Log&logNo=222520993934,등급우두머리장비 확정 개량’ 시스템을 업데이트했다고 9월 29일 밝혔다. 이용자는 기존 강화로만 제작할 수 있었던 ‘동 등급우두머리장비’를 게임 플레이로 손쉽게 획득할 수 있다. 이번 업데이트로 일반... ,20min,https://blog.naver.com/20min_830,2021-09-29
"코리아 조민상 대표,‘ 우두머리 의 비밀’ 세미나 직강",https://blog.naver.com/bellissimakorea?Redirect=Log&logNo=221833880756,"볼라욘(volayon) 코리아 조민상 대표, ‘ 우두머리 의 비밀’ 세미나 직강 티켓팅과 홈케어 수월하게 하는... 볼라욘아카데미가 진행한 교육은 마케팅 심리교육이며 테마는 ‘ 우두머리 의 비밀’로 정했다. 직접... ",에스테틱 매거진 벨리시마,https://blog.naver.com/bellissimakorea,2020-03-02
포더킹 2. 흩어진 열쇠 (카오스우두머리/ 눈부신 광산),https://blog.naver.com/rkocho?Redirect=Log&logNo=222399619054,흩어진 열쇠 카오스우두머리처치하고 눈부신 광산가서 1챕터 완료하기 포더킹 현재 세션의 마지막 퀘스트인 카오스우두머리 를 잡으러 왔다 카오스우두머리더 있나요? 우리쪽에 합류하는 것을 진지하게... ,궈니의 일상의 소소한 즐거움들,https://blog.naver.com/rkocho,2021-06-15
[매거진군산] 2020년 10월호 :우두머리 (牛頭머리) 展을 마치며... ,https://blog.naver.com/magazinegunsan?Redirect=Log&logNo=222114341552,우정(宇庭) 전승택 작가의 ‘ 우두머리 ’ 개인전이 바로 그것이다. 일반인들에게 다소 낯선 전각(篆刻)과... 다시 말해 소머리는 우두(牛頭)머리이며 우리 모두의 내면에는우두머리 의 DNA가 면면히 흐르고 있어... ,매거진군산 공식블로그,https://blog.naver.com/magazinegunsan,2020-10-13
검은사막M 흑정령 패스우두머리토벌 이벤트 보상 받아가자,https://blog.naver.com/jungumim94?Redirect=Log&logNo=222527475757, 우두머리토벌 주간 임무 이벤트 기간은 10월 24일 일요일까지 진행됩니다. 세 번째 이벤트는우두머리토벌 주간 임무 입니다. 매주 엘리언/하둠 지역에서우두머리 를 제압하고 특별한 보상을 받을 수... ,신작 게임 테스터,https://blog.naver.com/jungumim94,2021-10-05
‘함부로우두머리역할을 맡지 말라’,https://blog.naver.com/johta21?Redirect=Log&logNo=221861721574,"‘함부로우두머리역할을 맡지 말라’ 20-3-19 지역 사회에서 오랜 기간 다양한 역할을 맡고 봉사활동도... ---------- (중국 이야기) 덩샤오핑은 국제사회에서우두머리 의 역할을 맡지 말고, 조용히 힘을 기르며... ",물처럼 바람처럼,https://blog.naver.com/johta21,2020-03-19
"펄어비스 검은사막, ‘동 등급우두머리장비 확정 개량’... ",https://blog.naver.com/thaudtks?Redirect=Log&logNo=222520519077,게임 플레이로 쉽게 동 등급우두머리장비 획득 가능 성장 혜택을 더욱 강화할 ‘성장패스’ 도입... 등급우두머리장비 확정 개량’ 시스템을 개선했다고 밝혔다. 이번 업데이트로 인해 이용자는 기존... ,창업일보,https://blog.naver.com/thaudtks,2021-09-29
부산 한우암소구이우두머리 ,https://blog.naver.com/wldmsrla77?Redirect=Log&logNo=222462567708,"오늘은 부산 대연동에 있는 한우 암소구이 전문점우두머리 를 포스팅 해볼게요~~^^ 처음 밑반찬이 이렇게 셋팅됩니다~~ 메뉴판 사진입니다~~우두머리모듬이 나왔어요 모듬에는 토시살, 살치살, 부채살, 안창살... ",신평골재,https://blog.naver.com/wldmsrla77,2021-08-09
무리의 왕은 수컷 늑대 #알파 메일 #알파 피메일 #울프팩우두머리 ,https://blog.naver.com/nofake119?Redirect=Log&logNo=222501759636,이 늑대우두머리 를 가리켜 알파 메일이라고 하지요. Alpha male(알파 메일). 다음 내용은... Her seniority is achieved through her association with the alpha male.} 일반적으로우두머리수컷 늑대 즉... ,패왕,https://blog.naver.com/nofake119,2021-09-10
"돌연변이는 종교통합 배도자들, 교계우두머리 들",https://blog.naver.com/hiinyoun?Redirect=Log&logNo=222075525949,"또한 저들 중 #돌연변이(Mutant)는 종교통합, 곧 배도의 물결에 앞장서거나 합세한 교계의우두머리 들이요, 그중에서도 #악성돌연변이(Malignant Mutant)가 있으니 그들이 바로 교황청과 적그리스도 세력들이다.... ",JEHOVAH MEKODDISHKEM,https://blog.naver.com/hiinyoun,2020-08-30
"임실 시장 맛집 | 임실우두머리소머리 곰탕, 임실 고려당 분식... ",https://blog.naver.com/normal_kitchen?Redirect=Log&logNo=222531764690,"임실우두머리곰탕 0507-1311-2661 전북 임실군 임실읍 운수로 26 5동 2호 토요일 10:00 - 21:00, 일요일 휴무 장날제외(1,6 오일장), 평일 10:00 - 21:00 임실 시장 맛집,우두머리소머리 곰탕 임실 시장 맛집우두머리 ... ",초이의 음식글 작업실,https://blog.naver.com/normal_kitchen,2021-10-09
검은사막 이벤트 월두우두머리소탕 대작전 참여하고우두머리 ... ,https://blog.naver.com/love_holic00?Redirect=Log&logNo=222483518194,안녕하세요 ~ 홀릭입니다 오늘은 검은사막 이벤트 월드우두머리소탕작전 정보 알려드리려고 합니다. 검은사막 이벤트 월드우두머리소탕 작전은 검은사막 월드 전역에 등장하는 월드우두머리 를 처치하고... ,게임홀릭,https://blog.naver.com/love_holic00,2021-08-25
게임관련_검은사막 - 동우두머리장비 확정 개량동 쿠툼... ,https://blog.naver.com/songsong14?Redirect=Log&logNo=222536302231,"동우두머리장비 확정 개량이 생기고서 모았던 재료로 드디어 동 쿠툼 장식매듭을 만들었네요. 확실히 5단계에 재료 중에서 오킬루아 창공의 결정, 응축된우두머리 의 기운이 돈이 좀 드네요. 그리고 나머지... ",스웨트러너 블로그,https://blog.naver.com/songsong14,2021-10-14
[오늘 수영] 가혹한우두머리 인생,https://blog.naver.com/mksmks2723?Redirect=Log&logNo=222541954496,"아파도 가고, 지각 한 번 없다. 그런데 그걸 못 참고 다들 성화다. 사람들은 완벽한 사람에게 더 완벽한 자를 들이밀기 마련인가 보다. 정말 가혹한우두머리 인생이다. 그냥 웃어 넘긴다.",책으로 하루를 사는 방법,https://blog.naver.com/mksmks2723,2021-10-19
대연동맛집 암소 한우 소고기 전문점 우두머리 ,https://blog.naver.com/ryong830313?Redirect=Log&logNo=222436085394,대연동의우두머리 라는 소고기집을 다녀왔어요 무쇠솥뚜껑에 구워먹는 걸로도 유명한우두머리우선 저희는 세트 메뉴로 주문했구요 아래 사진은 기본 반찬으로 나온 메뉴들이에요 토마토와 사과로... ,"셀프이사.도움이사 ""빌림""",https://blog.naver.com/ryong830313,2021-07-18
"꽃의우두머리 , 매화",https://blog.naver.com/nongpalee?Redirect=Log&logNo=222267460092,"제일 먼저 꽃을 피운다고 해 매화를 꽃의우두머리 라는 뜻의 ‘화괴(花魁)’라고 한단다. 꽃 피는 시기에 따라, 일찍 핀다고 ‘조매(早梅)’, 추운 날씨에 핀다고 ‘동매(冬梅)’, 눈 속에 핀다고 ‘설중매(雪中梅)... ",여줄가리,https://blog.naver.com/nongpalee,2021-03-07
長國家而務財用者(장국가이무재용자)_한 나라의우두머리 가... ,https://blog.naver.com/aromatics?Redirect=Log&logNo=222508690005,"한 나라의우두머리 가 되어 재물을 모으고 쓰는 일에(만) 온힘을 쏟는다면, 필히 그 자는 소인배이다, 그가 그것(=재물을 모으고 쓰는 일)을 좋아한다는 것은, 소인배의 그것(=속성)이 나라를 다스리게 함이니... ",漢文學의 숲을 거닐다,https://blog.naver.com/aromatics,2021-09-17
"여수 용주리 소머리국밥집,우두머리 ",https://blog.naver.com/choch110?Redirect=Log&logNo=222447052935,"여수 화양면 용주리 소머리국밥집,우두머리소머리국밥집이다. # 우두머리 , 참 이름이 거시기하다. 여수 화양면 #용주리마을 초입에 있다. 가게 앞마당에는 2개의 커다란 #가마솥 이 걸려있다. 가마솥단지는... ",맛사랑의 맛있는 세상,https://blog.naver.com/choch110,2021-07-28
신격의 머리와우두머리 의 차이점에 대하여,https://blog.naver.com/jasperchoi?Redirect=Log&logNo=222389340301,머리시라 [신격의 머리와우두머리 의 차이점에 대하여] 1)세상에서 부르심을 받아 나온 교회의 신격의 머리는 누구인가? --삼일 하나님 2)세상에서 부르심을 받아 나온 교회의우두머리 는 누구인가? --인자,둘째사람,https://blog.naver.com/jasperchoi,2021-06-08
영어문장표현 206 [중공우두머리 들의 공통점],https://blog.naver.com/yozimbo76?Redirect=Log&logNo=222047896982,"중공공산당우두머리 들의 공통점 1. [Cowards] They are all emperor class to exploit and bully Chinese ordinary people in a period of peace, while if the leaders face any crisis, they must hide into... ",yozimbo76님의 블로그,https://blog.naver.com/yozimbo76,2020-08-01
 우두머리 는 참 좋은 자리다,https://blog.naver.com/khandole?Redirect=Log&logNo=222459232662,팔아우두머리 에게 수만 냥을 바치니 외려 함경북도 관찰사 자리를 주더라. 이를 기록하는 시골 선비는... 그때는우두머리 를 임금 대신 대통령이라 불렀다. 이 나라 사람들 심성은 비교할 곳이 없다. 임금이라... ,"如蓮花不染塵, 진흙에 물들지 않는 연꽃과 같이",https://blog.naver.com/khandole,2021-08-06
원시저그유닛탐구 - 퀼고르우두머리 (Quilgor Alpha/퀼고르... ,https://blog.naver.com/love1004003?Redirect=Log&logNo=222144182568,퀼고르 우두대리 게임상의 퀼고르우두머리퀼고르 무리를 이끄는우두머리개체는 다른 퀼고르에 비해 덩치가 크고 신체적 능력이 우월하다. 그러나 이우두머리역시 주르반의 먹이로 쓰일 고기가 되었다.... ,Palette,https://blog.naver.com/love1004003,2020-11-14
가평 아침식사 코다리구이+청국장우두머리 식당,https://blog.naver.com/skylovelove1?Redirect=Log&logNo=222355609063,생각하다가 코다리구이를 주문하면 청국장까지 함께 나오는우두머리 식당이 있다하여 방문하게... 이제 펜션가서 손님들 입실 준비를 해야죠~^^ 가평 우두머리 식당 영업시간 오전 9시~ 20:00 모바일작성,가평&남이섬펜션하늘사랑,https://blog.naver.com/skylovelove1,2021-05-18
"빈스영어 왕초보 표현 - bossy우두머리행세를 하는, 다른... ",https://blog.naver.com/vincevince?Redirect=Log&logNo=222344797580,"= bossy우두머리행세를 하는, 다른 사람에게 명령하는, 다른 사람에게 이래라 저래라 하는 우리말로는 어떻게 하면 좋을까요? 이런 사람을 우리는 '뭐라고 부를까요?' 어쨌든... ",[Vince Blog] English & Books,https://blog.naver.com/vincevince,2021-05-10
9]'대방동' 지명 유래...우두머리'대방장승'이 지키는 곳,https://blog.naver.com/sunhofeel2?Redirect=Log&logNo=221801915144,"이곳에 8도 장승의우두머리 인 대방장승이 서 있어서 번대방리(番大方里)라 했고, '번대방'이란 '대방장승이 지키는 곳'(번을 서는 곳)이라는 뜻이다. 대방동은 조선시대 말까지 경기도 시흥군(始興郡)... ","『주경야독』(주식, 경제, 야구, 독서)",https://blog.naver.com/sunhofeel2,2020-02-09
"월드우두머리칸 리뉴얼, 일부 클래스 밸런스 조정 등 업데이트",https://blog.naver.com/sangdol3?Redirect=Log&logNo=222520031764,"월드우두머리칸을 저지하라! (~10/12 09:00) - 칸이 화요일에 추가로 등장하며, 칸을 처치하고 여신의 눈물을 얻을 수 있다. 4.3. 천사와 악마의 제안 (~10/5 09:00) - 적 제압 시 획득 가능한 투표권을 통해 천사... ",아다롱님의 블로그,https://blog.naver.com/sangdol3,2021-09-28
 우두머리 ,https://blog.naver.com/ttyyon?Redirect=Log&logNo=222018522637,인체가 처음 만들어졌을 때 신체의 각 부분이 서로우두머리 를 차지하려 했다 뇌 : 나는 신체의... 자신이우두머리 가 되어야 한다는 당위성을 주장하고 있을 때 아무도 그가 나서리라고 생각지도 못했던... ,산골마을 시실리時實里,https://blog.naver.com/ttyyon,2020-07-08
원지 우두머리 식당[현지인추천]맛집,https://blog.naver.com/kpj3333?Redirect=Log&logNo=222484344935,안녕하세요~^^ 비쥬 파파입니다~~ 오늘은 산청군 신안면(원지)에 위치한우두머리 식당 포스팅을... 이거 맛있어요~ ㅎㅎ 반찬들 맛있어요우두머리식당. 가게 상호 에서부터 먼가 고수 느낌 물씬.ㅎㅎ 밑... ,비쥬 파파,https://blog.naver.com/kpj3333,2021-08-26
천일야화 조선판 도둑들 일심단우두머리여홍 모갑 차선비... ,https://blog.naver.com/qhrjtmhey?Redirect=Log&logNo=222533831986,"천일야화 조선판 도둑들 일심단우두머리여홍 모갑 차선비 10월 11일 251회 출연진 방송시간 정보... 일심단우두머리여홍 서자 출신 정보책 차선비 조선의 도둑들, 일심단 그런 일심단에게 목표가 생기는데... ","구름의 향연,",https://blog.naver.com/qhrjtmhey,2021-10-11
 우두머리/이나혜,https://blog.naver.com/000sim2?Redirect=Log&logNo=222286016073, 우두머리/이나혜 밖에서는 뿌연 말들이 한 솥 끓고 있고 나는 알고 있다 산 자가 열두 번째 내 뼈를 우려먹고 있다는 사실을 사람의 조상이었을지 모를 사람의우두머리 였을지 모를 나에게 예를 갖춰라 너희가... ,이나혜,https://blog.naver.com/000sim2,2021-03-24
 우두머리소머리국밥,https://blog.naver.com/kjklop?Redirect=Log&logNo=222194792081,"신방통정지구 소머리국밥우두머리소머리국밥 국밥 떡국 수육~ 간단하게 식사하기 좋은곳 수육 진한 육수 떡국 # 우두머리소머리국밥,# 우두머리국밥,#신방동 소머리국밥,#신방동 국밥지,#통정지국 국밥집... ",미소천사님의 블로그,https://blog.naver.com/kjklop,2021-01-03
돌탑의 우두머리 .천지탑/마이산 돌탑쌓기체험장/이갑용처사,https://blog.naver.com/lifebook57?Redirect=Log&logNo=222305128285,3년 전 오늘 [전북진안/마이산]탑사/마이산탑사.돌탑의 우두머리 .천지탑/마이산 돌탑쌓기체험장/이갑용처사 진안 마이산 탑사 여행은마이산남부주차장을 시작으로금당사를 둘러보고탑사가 있는 마이산으로... ,애니의 사랑이 담긴 방,https://blog.naver.com/lifebook57,2021-04-10
검은사막m 월드우두머리처치하고 파편 획득하자,https://goodman.tistory.com/4649,이번 이벤트는 월드우두머리 를 저지하라 이벤트입니다. 이번 이벤트는 월드우두머리 를 제압하시면 파편을 덤으로 주는 이벤트를 진행한다고 합니다. 높은 등급의 장비를 빠르게 제작할 수 있는 기회이니... ,크롱다다소소한일상,https://goodman.tistory.com/,2020-09-29
"옛날식 국밥을 맛있게 먹을수있는 원지우두머리 식당 ,,,",https://blog.daum.net/c41051/7664,"옛날식 국밥을 맛있게 먹을수있는 원지우두머리 식당 ,,, 댓글 5 맛집여행 2020. 10. 15. 공유하기 글 요소 저작자표시 비영리 변경금지 댓글 5 해피해피 2020.10.16 08:11 신고우두머리식당 답게 음식도 일 등... ",씨밀레와 수석여행,https://blog.daum.net/c41051,2020-10-15
폐와 비장에 좋은 약초의우두머리 ..허약한 사람을 튼튼하게... ,https://blog.naver.com/donald3355?Redirect=Log&logNo=221230837521,약초의우두머리황기(黃耆)란 이름은 색이 누렇고 보약으로 쓰이는 약초중에서 효능이우두머리 란 의미랍니다. 면역력을 높여주고 기운을 주어서 허약한 몸을 튼튼하게 해주니 예로부터 보약엔 빠지지 않는... ,해피도날드의 건강정보,https://blog.naver.com/donald3355,2018-03-17
[하스스톤] 하켓몬우두머리소개 -1부-,https://blog.naver.com/gard7251?Redirect=Log&logNo=220921485841,하스스톤 모험 모드의우두머리 들의 '덱'과 '영웅 능력'을 체험할 수 있는 난투.우두머리 의 전용 덱 보다우두머리 의 영웅 능력이 핵심이다고 봐야 한다. 영웅마다 플레이할 수 있는우두머리 들이 전부 다르며... ,냐소가 아니라 가드,https://blog.naver.com/gard7251,2017-01-27
여자클러치백우두머리 가방 20대여자가방으로 스타일리시한... ,https://blog.naver.com/dlrhdmssla?Redirect=Log&logNo=221638020469,만난우두머리 가방 클러치백. 평소 가방은 숄더백이나 토트백처럼 수납이 많은 가방만 들고 다녀보다가 난생 처음 클러치백을 들어보았는데 이게 정말 패피처럼 멋지게 들고 다니기 참 좋더라!우두머리 가방... ,파닥's 여행하는 일상,https://blog.naver.com/dlrhdmssla,2019-09-06
