title,link,description,bloggername,bloggerlink,postdate
그랜드워커힐호캉스,https://blog.naver.com/sg9285?Redirect=Log&logNo=222522001837,추석연휴의 시작부터 날이 좋다 구리쪽에서 버스타고 넘어와워커힐 입구 정류장에서 내려 셔틀버스를 기다렸다 셔틀버스 도착시간 QR코드로 확인하기 셔틀타고워커힐입구에서 하차 매번워커힐 ... ,Liferature,https://blog.naver.com/sg9285,2021-09-30
 워커힐더글라스 호텔 한강 뷰 라운지조식,https://blog.naver.com/iwellbng?Redirect=Log&logNo=222536106782, 워커힐호텔이 집이랑 걸어서 십분 거리인데 호캉스와 포스팅을 남겨 보고자 질렀습니다 지르는 김에... 없습니다워커힐쪽이 산책로도 잘 꾸며져 있어서 산책겸 종종 지나가면서 이런덴 언제 와보나 했는데... ,★ 고통통's 다이어리 ★,https://blog.naver.com/iwellbng,2021-10-13
" 워커힐호텔앤리조트, 비대면 ‘추(秋)캉스’ 가을 패키지 출시!",https://blog.naver.com/walkerhillhotel?Redirect=Log&logNo=222493794165, 워커힐호텔앤리조트(이하워커힐 )가 아차산과 한강을 배경으로 한 가을의 정취를 만끽할 수 있는 ‘추(秋)캉스’ 가을 패키지를 출시합니다. 이번 패키지는 코로나19로 인한 비대면 여행 트렌드가... ,워커힐,https://blog.naver.com/walkerhillhotel,2021-09-03
강원도 고성 르네블루 바이워커힐그랜드 패밀리 스위트룸... ,https://blog.naver.com/kittyjkh?Redirect=Log&logNo=222497396832,"르네블루 by워커힐그랜드 패밀리 스위트룸 글,사진 ilovejun 르네블루 바이워커힐 은 강원도 고성에 2020년 7월 문을 연 호텔 인데요 르네 (벨기에 초현실주의 작가,르네마그리트) + BLUE (프랑스어 ; 파란색)... ",I LOVE JUN♡ 아이러브준,https://blog.naver.com/kittyjkh,2021-09-06
서울 호캉스 호텔 ㅣ 그랜드워커힐서울 디럭스 한강뷰 ♥,https://blog.naver.com/jinmichu?Redirect=Log&logNo=222381203887,광진구에 위치한 그랜드워커힐서울 다녀왔어요 ☻ 더 많은 서울 근교 호캉스 호텔 궁금하시다면 아래 링크의 다른 리뷰들도 참고하세요! 저는 그랜드워커힐서울 호텔 공식 홈페이지에서 예약했는데요... ,진미츄 일상 기록,https://blog.naver.com/jinmichu,2021-06-02
고성르네블루 바이 워커힐호캉스 조식먹으니 여행온기분!,https://blog.naver.com/yimjihoon85?Redirect=Log&logNo=222515502753,고성르네블루 바이 워커힐이번에 여름휴가를 추석이랑 같이 붙여서 받았습니다 ㅎㅎㅎ 그래서... 고성르네블루 바이 워커힐 은 남편이 찾아본 숙소에요 펜션이나 민박보다는 호텔이 낫겠다 싶더라구요... ,나래팀장의 유학이야기,https://blog.naver.com/yimjihoon85,2021-09-24
 워커힐더뷔페 런치 뿌시기,https://blog.naver.com/scriabin02?Redirect=Log&logNo=222535023785," 워커힐더뷔페 얼마만인가요~ 저희는 블랙 멤버쉽을 이용하고 있는데 담당 매니저분에게 예약을 부탁... 비교적 캐주얼한 느낌의 호텔워커힐더뷔페 런치 입니다. 한식, 중식, 일식, 양식 모든 음식이... ",♥️ 내가 사는 이유 ♥️,https://blog.naver.com/scriabin02,2021-10-12
고성 호텔 르네블루 바이워커힐할인 꿀팁 내돈내산 찐후기,https://blog.naver.com/acewriter?Redirect=Log&logNo=222537045305,바이워커힐 은 숙소를 비롯해 아름다운 전용해변과 맛집 등 먹을거리까지 모든 걸 다 갖춘... 여름이 끝나고 가을이 시작될 초입에 방문한 르네블루 바이워커힐 .워커힐 이 만든 호텔이라고 하니 시설이 얼마나... ,리온의 일상,https://blog.naver.com/acewriter,2021-10-14
 워커힐비스타 호캉스,https://blog.naver.com/bluefire3535?Redirect=Log&logNo=222464077760,그래서 가까운워커힐비스타 호캉스 다녀왔네요. 2박 3일 다녀왔구요. 주변 음식점 카페 가본 것 외에는 전부워커힐안에서 해결했어요. 묘향만두 체크인 시간 전에워커힐근처 묘향만두를 갔습니다. 일단... ,망고쌤의 '돈 그리고 일상',https://blog.naver.com/bluefire3535,2021-08-10
 워커힐호텔 블랙 프레스티지 멤버쉽 1년 사용 후기,https://blog.naver.com/whitenun?Redirect=Log&logNo=222506167652, 워커힐유료 멤버쉽이 혜택이 좋다고 해서 둘째 아이 돌잔치도 있고 해서 겸사겸사워커힐유료 멤버쉽을 가입했다.워커힐유료 멤버쉽 프레스티지 클럽 종류와 가격 등의 자세한 안내는 홈페이지에 다... ,오늘도 룰루라라,https://blog.naver.com/whitenun,2021-09-15
그랜드워커힐호텔에서 즐기는 서울 호캉스 1,https://blog.naver.com/boshukr?Redirect=Log&logNo=222539065816,그랜드워커힐호텔에서 서울 호캉스 즐기라고 숙박권과 조식뷔페 예약을 해줘서 고맙고 기쁜 마음으로 구경하듯 놀러왔어요. 이곳은 고급짐이 뭔가 다를 듯한 느낌이 들어 기대가 커요. 실제로 본워커힐 ... ,My road story...,https://blog.naver.com/boshukr,2021-10-16
그랜드워커힐한식당 온달 - 궁중상 코스요리 후기,https://blog.naver.com/rkdsoddlv?Redirect=Log&logNo=222531413202,그랜드워커힐온달에서 3주 빨리 제 생일파티 하고 왔습니다. 베프님이워커힐멤버십 회원인지라 올해 모임은 죄다워커힐 에서 하네요. 이 친구 말로는 자기가 가 본워커힐식당 중 (아직 금릉을 못... ,"Always, 나다움 = 지애로움",https://blog.naver.com/rkdsoddlv,2021-10-09
아기와호캉스 ♥︎ 비스타 워커힐주니어코너스위트 리버뷰... ,https://blog.naver.com/p0pp0?Redirect=Log&logNo=222539619082,"비운의워커힐재도전! 시설은 조금 낡았지만, 직원분들도 친절하시고 음식도 다 맛있고 만족스러운 아기랑 호캉스가 되었어요 ☺️❤️ 비스타 워커힐주니어코너스위트 한강뷰 / 리버뷰 - 일부러 연휴를... ",햄토링 데이로그 ♩,https://blog.naver.com/p0pp0,2021-10-17
그랜드워커힐서울 - 더뷔페 조식,https://blog.naver.com/ohju1010?Redirect=Log&logNo=222514085565,그랜드워커힐서울 클럽 스위트 조식은 그랜드 클럽 라운지가 아니라 조식뷔페 식당에서... 그랜드워커힐투숙은 첨인데 건물이 살짝 오래되고 한강 with 비스타뷰지만 음식과 주류도 대만족이고 넘나 친절한... ,逍遙日常 소요일상,https://blog.naver.com/ohju1010,2021-09-23
"그랜드워커힐서울, 포레스트 파크, 호텔 캠핑, 카페드노보... ",https://blog.naver.com/nayhs?Redirect=Log&logNo=222512354010,"캠핑장비가 1도 없는 동남아인은 어디선가워커힐 에 캠핑할 수 있는 패키지가 있다는 소리를 듣고 바로 예약을 했다. 도착 그랜드워커힐 과 나란히 있는, 전면이 유리로 된 비스타 호텔은 예전에는 W호텔이었다.... ",maybe_biasa,https://blog.naver.com/nayhs,2021-09-21
그랜드워커힐서울,https://blog.naver.com/baedanbi?Redirect=Log&logNo=222514411375,그랜드워커힐서울 특가 스탠다드 트윈/저층/전망 없음으로 금요일밤 1박에 17만원이 안됨!!!!!! 미리... 그랜드워커힐로비로 바로 나갈수 있다 기다림 없이 체크인 하고 6층에 배정 룸은 깔끔했다 침대가 너무... ,바비찡과 바비맘,https://blog.naver.com/baedanbi,2021-09-23
고성 르네블루 바이워커힐그랜드 패밀리 스위트룸 601호... ,https://blog.naver.com/iym4749?Redirect=Log&logNo=222531488323,지난 10월 4일~10월 5일 다녀온 고성 르네블루 바이워커힐그랜드 패밀리 스위트룸 중에 저희가 1박을... 우회전하면 좌측으로 넓은 주차장이 있고 정면으로 보이는 르네블루 바이워커힐호텔입니다. 1층 로비... ,가시광선 발사준비완료!,https://blog.naver.com/iym4749,2021-10-09
 워커힐호텔 로비라운지 더 파빌리온 : 가을 애프터눈티,https://blog.naver.com/chlee12222?Redirect=Log&logNo=222513432315,비스타워커힐말고 그랜드워커힐체크인 하는곳 로비에 위치한 #더파빌리온 # 워커힐뷰는 1도 없다... 그래도 호텔 로비라서 쾌적하고 아주 친절하다~~ 10종 이상의 디저트를 식용 꽃으로 장식해서 총 2판이... ,좋은일들만기록하는그림일기,https://blog.naver.com/chlee12222,2021-09-22
광장동워커힐아파트 옆동네워커힐 메리톤 전세,https://blog.naver.com/dlaansxor720?Redirect=Log&logNo=222456634419,"#광장동아파트 # 워커힐 아파트 # 워커힐 메리톤전세 재건축 앞둔 광장동 옆 자연친화적인 아치울마을에 전세 살아보세요! 얼마전 배우 현빈씨가 이사했다고 알려져 큰 화제가 되었던 곳, 그 동네가 바로 여기... ",로덴부동산 중개법인,https://blog.naver.com/dlaansxor720,2021-08-04
 워커힐피자힐 인생의 맛을 느끼고 온날,https://blog.naver.com/ikqm77?Redirect=Log&logNo=222495400384,몇년전부터 온가족이 너무 가고 싶었던 곳이 있었는데 바로워커힐피자힐이였습니다. 창가쪽 자리는... 다행히 투숙객은 호텔입구에서 차량으로워커힐피자힐까지 태워다 주어서 온가족이 편안하게 도착을... ,바니아빠의 육아일기,https://blog.naver.com/ikqm77,2021-09-05
[비스타워커힐 ] 델비노에서 특벽한 저녁,https://blog.naver.com/urmyfavorite?Redirect=Log&logNo=222537955554,비스타워커힐 에 다녀왔어요 이탈리안 다이닝 델비노 DEL VINO 저녁타임은 6시부터 시작이라 이전에는... 신랑이 찍어 준 내 사진으로 마무리 ^-^ 그랜드 워커힐 에 있는 르빠샤쥬에서 빵 한가득 사서 이제 집에 갑니다~~,"소소한일상, 행복한콩콩이♥",https://blog.naver.com/urmyfavorite,2021-10-15
비스타워커힐디럭스 더블룸 호캉스,https://blog.naver.com/jhkho2840?Redirect=Log&logNo=222516754690,비스타워커힐 이었다. 사실 호캉스를 위해 호텔을 선택하고 평가하는 기준을 나는 아직도 잘... 물론 시그니엘은 엄청나게 높은 곳에서 서울을 조망한다는 특색이 있긴 하지만 비스타워커힐 은 그냥 한강이... ,고부엉씨의 둥지,https://blog.naver.com/jhkho2840,2021-09-25
"구리 카페 아차산로 59,워커힐한옥카페",https://blog.naver.com/dmsp3535?Redirect=Log&logNo=222436344813,드디어워커힐포스팅의 마지막 구리 카페입니다~ 멀리 김포집으로 돌아가야 해서 더 멀리는 못가고 (욕심같아선 남양주 카페 가고 싶었지만..)워커힐근처에 핫한 아차산로 59 카페 다녀왔어요 아차산로 59 구리... ,GRACE's lov diary,https://blog.naver.com/dmsp3535,2021-07-18
그랜드워커힐더글라스 하우스 포레스트뷰_09.10~11,https://blog.naver.com/66hana?Redirect=Log&logNo=222505378179,#그랜드 워커힐#더글라스하우스 #노키즈존 #호캉스 #라운지 # 워커힐7월에 예약해두엇던 호캉스 9월숙박이라 이때면 좀 괜찮을줄알앗는데 아직 4단계라니ㅠ 그래도 다행인건 더글라스하우스는 굉장히... ,여행 좋아하는 디자이너.,https://blog.naver.com/66hana,2021-09-14
" 워커힐 호텔 한식당 온달, 부모님 모시고 효도 한상 그리고 내가... ",https://blog.naver.com/hyunzinkim?Redirect=Log&logNo=222523284814," 워커힐 호텔 한식당 온달 부모님 모시고 효도 한상 그리고 내가 좋아하는 간장게장 한상 날이 좋다.... 가을은 천고마비의 계절인 만큼, 가을의 시작은 미식의 향연으로 # 워커힐 한식당온달 을 예약했다. 내년이면... ","취향소비자 V의 쉼표, 숨 쉬는 공간",https://blog.naver.com/hyunzinkim,2021-10-01
그랜드 워커힐서울 호텔 딜럭스스위트,https://blog.naver.com/dbrudditl?Redirect=Log&logNo=222481757255,그랜드 워커힐서울 호텔 딜럭스스위트 그랜드 워커힐 을 맨 처음 방문했을 때 클럽스위트룸에 묵었었다. 되게 좋은 기억을 가지고 있어서 그 후로도 몇 번 갔었다. 항상 1박만 해서 아쉬웠는데 이번에는... ,가예(嘉澧) 블로그,https://blog.naver.com/dbrudditl,2021-08-24
[광장] 비스타 워커힐스파룸 호캉스후기,https://blog.naver.com/dmsdms0516?Redirect=Log&logNo=222530236776,연휴를 이용해워커힐방문 두두가 하도 수영타령해서 갔는데 정작 호텔수영장은 피곤해서 얼마... 산책타임워커힐 의 백미는 역시 뒷산이지 와 여기 안들렀음 울뻔 족욕시설이 있는데 무료임 저 키세스 넘... ,본격 임대 블로그,https://blog.naver.com/dmsdms0516,2021-10-07
"[여수호텔] 혼자 여행갈 때 편하게 묵기 좋았던 곳,워커힐 ... ",https://blog.naver.com/3768446?Redirect=Log&logNo=222527901470, 워커힐 에서 만든 여수 캡슐 호텔 다락휴 여수점 by.워커힐고흥 팔영대교를 건너 여수로 향했다. 혼자서 1박하기 좋은 숙소를 찾아봤다. 여수호텔 검색하며 캡슐호텔 글을 보게 됐다.워커힐 호텔에서 운영하는... ,inmymind,https://blog.naver.com/3768446,2021-10-05
"아기랑 호캉스, 비스타워커힐스파스위트룸 후기",https://blog.naver.com/so9094?Redirect=Log&logNo=222522468294,"아기랑 호캉스, 비스타워커힐스파스위트룸 후기 1년동안 너무 많은 변화가 있었던 우리가족, 거기에... 아직 아기가 어리니 집에서 멀지 않은 곳으로 늘 출근길에 보이는 비스타워커힐 로 다녀왔다. 생일 전... ",미스변의걱정없는보험이야기,https://blog.naver.com/so9094,2021-09-30
고성 호텔 르네블루 바이워커힐 ,https://blog.naver.com/sina5617?Redirect=Log&logNo=222494179740,예약하기가 하늘의 별따기인 고성호텔 “르네블루 바이워커힐 ” 오픈한지 1년 밖에 안된 신상호텔 2층으로 올라가는 계단 한쪽편이 통창이라 바다가 훤히 보임 로비 한쪽 편에 있는 카페 겸 기념품 샵 저층부... ,Design Utopia,https://blog.naver.com/sina5617,2021-09-03
[외식]워커힐 호텔 중식당 금룡,https://blog.naver.com/cafe_mocha?Redirect=Log&logNo=222500022201, 워커힐호텔 중식당 금룡갈때마다 기분좋은워커힐맛있는 식당을 찾아가서 그런듯..금룡이라는 이름에 걸맞게 외관이 번쩍번쩍 합니다. 올해 리모델링을 한 후 4월 새로 오픈한거라고 해요.날씨 좋았고 홀의... ,일상을 기록하면 에세이가 된다.,https://blog.naver.com/cafe_mocha,2021-09-09
그랜드워커힐서울 - 클럽티타임,https://blog.naver.com/ohju1010?Redirect=Log&logNo=222513874329,그랜드워커힐서울 클럽 스위트 숙박하게 되어 그랜드 클럽 라운지 이용하게 되었어요. 클럽티타임은 1~5시까지 16F 그랜드 클럽 라운지에서 이용할 수 있어요. 3시 체크인하고 방구경 후다닥 한 후에 바로... ,逍遙日常 소요일상,https://blog.naver.com/ohju1010,2021-09-23
 워커힐맛집 심지어 백종원의3대천왕에 나온이곳,https://blog.naver.com/ikqm77?Redirect=Log&logNo=222511409077,명절기간동안에 가족들과 가기에 좋은워커힐맛집이 있어서 알려드릴까 합니다. 이곳은 구리 묘향만두라는워커힐맛집입니다. 호텔에서 차로 3~4분 밖에 걸리지 않아서 호캉스를 즐기는 사람들이 가기에도... ,바니아빠의 육아일기,https://blog.naver.com/ikqm77,2021-09-20
호텔 애프터눈티 추천! 서울 호캉스워커힐비스타 비비드아워,https://blog.naver.com/hannapride?Redirect=Log&logNo=222531488596,서울 호캉스워커힐비스타 비비드아워 여행 기분 내기에는 호텔 애프터눈티가 제격! 이번 서울 호캉스 중에서워커힐비스타가 유난히 만족스러웠던 이유는 아마도 호텔 애프터눈티도 함께했기 때문이에요.... ,여행은 인생 필수조건이다,https://blog.naver.com/hannapride,2021-10-12
서울 호텔뷔페 추천 - 그랜드워커힐서울 더뷔페 후기,https://blog.naver.com/kimgagakk?Redirect=Log&logNo=222532101387, 워커힐더뷔페를 다녀왔습니다 광나루역에서 차를 타고 가도되고 15분정도면 걸어올라갈수 있다고 하는 곳입니다 ! 강건너 미사 ~ 잠실 부근까지 모두 보이는 곳이라 뷰도 좋은 홑레로도 유명한 광진구워커힐 ... ,"맛집, 구매후기 블로그",https://blog.naver.com/kimgagakk,2021-10-09
비스타워커힐 에서 아기랑 일박 호캉스 즐기기,https://blog.naver.com/ace_ul?Redirect=Log&logNo=222542848271,물론 힘들걸 알면서도요^_^ 광장동에 있는 비스타 워커힐 로 예약을 했는데요도착 하자마자 역시나... 비스타워커힐 은 미니바도 무료 에요. 스낵이나 음료등 무료로 먹을수 있더라구요^_^호텔 아래층에는 cu... ,학점은행제 학위취득 에듀원,https://blog.naver.com/ace_ul,2021-10-20
비스타워커힐디럭스 더블 리버뷰 : 혼캉스,https://blog.naver.com/sugeda?Redirect=Log&logNo=222517232430,09.22 수요일 월요일에 급하게 예약한 비스타워커힐 ❤️ 이번엔 금액 추가해서 한강뷰 선택했다. 짐 싸서 택시 타고워커힐가는데 날이 참 예뻤다. 새벽부터 아침까지 비가 많이 와 걱정했는데 언제 그랬냐는 듯... ,만월의 블로그,https://blog.naver.com/sugeda,2021-09-26
 워커힐모에기 스시 오마카세 런치 코스,https://blog.naver.com/whitenun?Redirect=Log&logNo=222503834373, 워커힐모에기 스시 오마카세 런치 코스 결혼기념일 식사로워커힐모에기를 방문했다. 이거 중심으로 왼쪽의 안쪽은 데판야끼 오른쪽은 한강이 보이는 곳이다. 한강이 보이는 곳은 다이닝홀이 있다. 사진에는... ,오늘도 룰루라라,https://blog.naver.com/whitenun,2021-09-13
[서울/광나루] 비스타워커힐호캉스 후기(feat. 결혼기념일),https://blog.naver.com/wjstmdal_?Redirect=Log&logNo=222536841741,오늘은 결혼기념일 기념으로 다녀온 비스타워커힐숙소 후기입니다 :) 제가 간 당일은 비가 왔고... 컵 다양하게 많은거 너무 좋아요 특히 와인잔워커힐미니바는 무료랍니다 퀄리티도 좋구용!! 욕실은 깔끔!... ,美,https://blog.naver.com/wjstmdal_,2021-10-14
[광진구]워커힐호텔. 아기랑 호캉스. 디럭스룸. 르 파사쥬. 더... ,https://blog.naver.com/love0friends?Redirect=Log&logNo=222541647293,지난 겨울에 다녀온워커힐호텔 호캉스 리뷰 정총무 회사에서 숙박 할인권이였나 숙박권이 였나...워커힐 은 17층 까지 침대는 높으나 아주 약간 좁은듯한 느낌적인 느낌 컴팩트한 차와 물 건물 옥상이 예쁘진... ,베이비의 넓고 맛있는 세상,https://blog.naver.com/love0friends,2021-10-19
비스타워커힐서울 - 디럭스룸 리버뷰,https://blog.naver.com/8b_hana?Redirect=Log&logNo=222504330153,"뒤늦은 여름휴가에 다녀온, 비스타워커힐서울 :) ㅋㄹㄴ 로 인해 여행이 어려워지니, '호캉스 = 돈낭비... 비스타워커힐서울 :) (체크인 : 15:00 / 체크아웃 : 11:00) 서울천안서울 빠듯한 일정 끝에, 비스타... ","소박하게 소탈하게, 소소하게 :)",https://blog.naver.com/8b_hana,2021-09-14
광진구워커힐모에기 - 데판야끼 디너 코스,https://blog.naver.com/obbritneyo?Redirect=Log&logNo=222537022214,작년 블로그 안 하던 시절 다녀온워커힐모에기 데판야끼 디너 코스... ☆ 사진 긁어모아 추억팔이 포스팅! 지금 바로 시작합니다.. 서울 광진구워커힐 로 177 비스타워커힐서울 1층 모에기 전화번호 : 02... ,Judy's Daily life,https://blog.naver.com/obbritneyo,2021-10-14
"210918 -워커힐비스타 (지우의, 3번째 생일).",https://blog.naver.com/yory1979?Redirect=Log&logNo=222529756227,"▒ 210918 -워커힐비스타 (지우의, 3번째 생일). 하루하루 다르게, 너무나 빠르게 자라는 너희 모습이... ▒ ▒ 코로나로인해,워커힐 내, 키즈카페도 운영안하고, 아이랑 함께하기, 심심했던 1박... 그나마... ",붕붕쓰나라,https://blog.naver.com/yory1979,2021-10-07
 워커힐멤버십: 비스타 딜럭스룸,https://blog.naver.com/emghee?Redirect=Log&logNo=222528192292, 워커힐멤버십: 비스타 딜럭스룸워커힐멤버십 두번째 이용 그랜드 딜럭스 스위트or 비스타 딜럭스룸 중에 비스타 딜럭스룸 결정! 호텔가자고 노래부르다가 디데이가 되니 하늘로 치솟을 것 같은 기세... ,232님의블로그,https://blog.naver.com/emghee,2021-10-06
서울워커힐비스타에서 여자친구가 먼저한 프로포즈 !,https://blog.naver.com/wowryoo?Redirect=Log&logNo=222517196605,하나가워커힐 호텔이였어요 ! 그런데 요번엔 가능하다해서 프론트에서 키를 받고 장식을 해드렸어요 ㅎ 그래도 호텔 내규는 바뀔수도 있으니 사전에 미리 체크는 해보셔야 합니다 ㅎ워커힐비스타는 저희... ,류군이 알려주는 프로포즈,https://blog.naver.com/wowryoo,2021-09-26
비스타워커힐수영장에서 한강뷰보며 물놀이하기,https://blog.naver.com/ikqm77?Redirect=Log&logNo=222525610681,오늘은 얼마전에 제가 갔었던 비스타워커힐수영장에서 아이들과 재미있게 노는 모습을 올려볼까 합니다. 바로 이곳이 3층에 위치하고 있는 비스타워커힐수영장의 전경입니다. 가장 큰 장점이라면 바로... ,바니아빠의 육아일기,https://blog.naver.com/ikqm77,2021-10-04
서울 피크닉 가기 좋은워커힐포레스트파크,https://blog.naver.com/hannapride?Redirect=Log&logNo=222531202664,서울 피크닉 가기 좋은워커힐포레스트파크 세상 여유롭고 예뻤던 서울 피크닉 장소!워커힐 은 투숙하기 전에는 데이트하러 종종 오던 장소인데요. 이번에워커힐비스타 투숙하면서 함께 다녀왔던 서울... ,여행은 인생 필수조건이다,https://blog.naver.com/hannapride,2021-10-08
그랜드워커힐서울 - 해피아워,https://blog.naver.com/ohju1010?Redirect=Log&logNo=222513891516,그랜드워커힐서울 클럽 스위트 숙박하게 되어 그랜드 클럽 라운지 이용하게 되었어요. 해피아워는 6... 직원분들도 넘나 친절하고 그랜드 워커힐라운지 해피아워는 완전 대만족이네요~*,逍遙日常 소요일상,https://blog.naver.com/ohju1010,2021-09-23
그랜드워커힐서울 온달 한정식 - 방짜유기에 담긴 궁중요리,https://blog.naver.com/simple_choi?Redirect=Log&logNo=222540417165,"그랜드워커힐서울 2층에 있는 한정식, 온달. 4세 아이와 함께 먹는 저녁이라 그랜드워커힐 에 있는 여러 식당들 중 고민없이 택한 한식당이다. 곡선미가 돋보이는 내부, 그랜드워커힐서울 온달 엉뚱한... ",심플초이,https://blog.naver.com/simple_choi,2021-10-18
[서울호텔/뷔페] 그랜드워커힐호텔(디럭스 더블룸)더뷔페... ,https://blog.naver.com/jellyqueen?Redirect=Log&logNo=222541734557,그랜드워커힐호텔더뷔페 결혼기념일을 맞이해서 휴가를 쓰고 호캉스를 가게 됐다! 거의... 요즘 호텔에 어메니티를 없애는 추세라던데워커힐 은 기본적인 건 다 잘 구비되어 있었다 아 그리고... ,쪄니의 블로그,https://blog.naver.com/jellyqueen,2021-10-19
 워커힐호텔 명월관 별채 : 한우 오마카세,https://blog.naver.com/whimwham_333?Redirect=Log&logNo=222524516320,"결혼 3주년 기념으로 (벌써...)워커힐호텔 명월관 별채에서 한우 오마카세를 먹었다. ٩( *˙0˙*)۶ 명월관은 한우 숯불구이로 유명한데, 안쪽에 따로 마련된 명월관 별채는 총 6개의 룸으로 이루어져... ",Amor Fati,https://blog.naver.com/whimwham_333,2021-10-02
 워커힐피자힐 (아이랑 가볼만한 곳),https://blog.naver.com/fpemcpfls?Redirect=Log&logNo=222490206036,8월초에워커힐피자힐을 예약했다.3주전에 예약에도 한강뷰자리는 만석이라고 했는데 좋은자리 부탁드린다고 사정은 해봄 ㅎㅎ 1시 예약하고. 12시반쯤 출발한 우리. 30분정도 걸렸다.워커힐호텔을 지나... ,Tu me manque,https://blog.naver.com/fpemcpfls,2021-08-31
고성 르네블루 바이워커힐조식까지,https://blog.naver.com/wldudzq?Redirect=Log&logNo=222537150506,"고성에서는 르네블루 바이워커힐 에서 시간을 보냈다. 체크인 시간은 3시부터. 우린 2시 30분쯤 도착해... 드디어 우리 룸, 고성 르네블루 바이워커힐 은 전 객실 오션뷰다. 해변 바로 앞에 위치해 있는 호텔인... ",꽃보다 아들♡,https://blog.naver.com/wldudzq,2021-10-14
비스타 워커힐 서울 다녀왔어요 -1박2일 서울호캉스 추천 + 피자힐,https://blog.naver.com/y_code?Redirect=Log&logNo=222541385383,#비스타 워커힐 서울 다녀온 이후로 급격히 추워진 날씨를 느끼면서 역시 난 럭키걸 ❤ #서울호캉스... 비스타 워커힐 호텔에서는 할게 많아서 바쁜 호캉스 를 보냈다 ㅎ_ㅎ 예약할때 비비드라운지패키지를 예약... ,B l o o m i n g u,https://blog.naver.com/y_code,2021-10-19
# 그랜드워커힐서울 더파빌리온 카페,https://blog.naver.com/minijunior?Redirect=Log&logNo=222538191390," 워커힐피자힐에서 식사하고,, 후식먹으러 다녀온 그랜드워커힐서울 더파빌리온 카페 그랜드워커힐서울 더파빌리온 카페 The Pavilion 광진구 카페는워커힐주변에 한강뷰 보이는 곳들도 많았는데... ",낭만빵순희의 지구별여행,https://blog.naver.com/minijunior,2021-10-15
