title,link,description,bloggername,bloggerlink,postdate
 워커힐명월관 돌잔치 한복 멋집,https://blog.naver.com/photogr_js?Redirect=Log&logNo=222449052134,인갤러리워커힐명월관 돌잔치 요즈음 한여름 무더위가 대단하네요^^ 아직 7월이 다 가지도 않았는데... 오늘 포스팅은 광진구에 위치한워커힐 호텔 그중에서도 명월관 돌잔치 돌스냅사진으로 올려보네요... ,인갤러리,https://blog.naver.com/photogr_js,2021-07-28
받은 제주황금향. 그린키위.워커힐갈비탕으로 몸보신 할 예정,https://blog.naver.com/7sujinpark?Redirect=Log&logNo=222507638048,키위가 입안에 꽉차면서 과즙과 키위키가 톡톡 ㅎㅎㅎ 세번째 선물세트는워커힐갈비탕워커힐갈비탕 WALKERHILL GOURMET 아이스팩과 함께 # 워커힐 갈비탕 5개 들어있네요~ 세상 참 좋아졌죠~ 갈비탕을 선물세트로... ,춤추는 황진이의 Life Log,https://blog.naver.com/7sujinpark,2021-09-16
 워커힐호텔 명월관 한강뷰 맛집,https://blog.naver.com/wlgml712?Redirect=Log&logNo=222442038752, 워커힐메뉴입니다! 너무 많아서 편집해올립니다 확대해서 확인해주세요!워커힐호텔의 가장 큰 장점은 한강뷰❤️ 고기를 판매해도 호텔이여서 깔끔해서 좋아요 기본찬입니당 매번 바뀌어요! 이 날은... ,말랑찌야,https://blog.naver.com/wlgml712,2021-07-23
 워커힐베이커리 건강빵집 르파사쥬,https://blog.naver.com/prime0823?Redirect=Log&logNo=222447797330," 워커힐호캉스갔다가 외국 고메 스토어 분위기에 그냥 지나치지 못했던 구경 겸 쇼핑 ♬ 제가 평소 즐겨먹는 건강한 빵 쌀빵, 비건빵 들이 많아서 급 빵 쇼핑했던워커힐베이커리워커힐베이커리는 프리미엄... ",지봉이의 골든타임,https://blog.naver.com/prime0823,2021-07-27
 워커힐멤버십/ 주니어코너 스위트룸,https://blog.naver.com/emghee?Redirect=Log&logNo=222434517438, 워커힐멤버십/ 주니어 코너 스위트룸 후기워커힐멤버십 카드가 도착했던 어느 날 기념 사진을 찍어 보았지요 가족카드도 한장 추가발급가능한데~ 뒤늦게 신청해서 이제 막 배송 중 무료숙박권 2개 할인이용권... ,232님의블로그,https://blog.naver.com/emghee,2021-07-17
 워커힐명월관 삼삼탕으로 기력 보충 :),https://blog.naver.com/etudejin?Redirect=Log&logNo=222448315384, 워커힐명월관 삼삼탕으로 기력 보충 :) 와~~ 벌써 7월 말이네요!! 올해는 왜 이렇게 시간이 빠르게... 부엌에 들어가기는 더 싫고 그러네요 요즘 ㅋㅋ 얼마전 다녀온워커힐명월관 후기입니당~~ 지난번에는... ,Bling Bling Story,https://blog.naver.com/etudejin,2021-07-28
광장동워커힐더뷔페 런치 괜찮아요,https://blog.naver.com/treasureofu?Redirect=Log&logNo=222447491021,고민하던 중에 그동안 가보고 싶었던 광장동워커힐더뷔페를 예약하고 갔다. 서울 시내 위치한 명품... 여기는 그랜드 워커힐더뷔페 ㅋ 결혼기념일에 식사하기엔 품격과 위치가 너무 잘 어울리는 곳이다. 직원이... ,LIFE'S LIFE,https://blog.naver.com/treasureofu,2021-07-27
비스타워커힐서울 호텔 프로모션 수영장 조식 패키지 혜택 정리,https://blog.naver.com/yujung0535?Redirect=Log&logNo=222482483257,"비스타워커힐서울이 KKday를 통해 24일인 오늘을 시작으로 이 달 30일까지의 예약진행건 (투숙은... 비스타워커힐서울의 혜택을 확인해 보니, 정상가격의 65% 할인율로 객실 예약이 가능함은 물론 한강... ",★건특이's House★,https://blog.naver.com/yujung0535,2021-08-24
" 워커힐곰탕의 진한 맛, 집에서 먹어보자 #내돈내산",https://blog.naver.com/vitaforuns?Redirect=Log&logNo=222446316658,집에서 즐기는워커힐곰탕 :-) (내돈내산) 지난 번에 이렇게 즉석조리식품으로 포장된 명월관 갈비탕을... 담에 먹을 때 남겨봐야지.) 그래서 이번에는 처음부터 남겨보는워커힐곰탕이다. 먹어보기 전에 다른... ,비타미니 : 오늘의 취향 + 매일의 성장,https://blog.naver.com/vitaforuns,2021-07-30
 워커힐리버파크 야외 수영장 여름호캉스,https://blog.naver.com/prime0823?Redirect=Log&logNo=222444155607," 워커힐리버파크 야외 수영장 보구선 다녀왔던 호캉스 여름 휴가 고고 ♬워커힐호캉스는 수영장 뿐만아니라 앞에는 탁트인 서울 한강이, 뒤에는 푸른 아차산에 둘러쌓여 있어서 심신에 좋은 기운을 받을... ",지봉이의 골든타임,https://blog.naver.com/prime0823,2021-07-24
서울워커힐호텔 한강뷰 레스토랑 일식당 모에기 오마카세,https://blog.naver.com/fromrei8?Redirect=Log&logNo=222350445166,서울 한강뷰 레스토랑워커힐호텔 모에기 오마카세 친구 잘 둔 덕에 좋은 경험을 많이 하는구나 요즘. 만나기로 한 친구가 뜬금없이워커힐오마카세 어떠냐고. 무조건 콜이지. 친구네 사장님이 쏘신다니 더... ,프롬레이의 여행잡화점,https://blog.naver.com/fromrei8,2021-05-14
광진구 호텔 뷔페 :: 그랜드워커힐서울 더 뷔페 주말 디너,https://blog.naver.com/kimhyejin004?Redirect=Log&logNo=222462866687,얼마 전 그랜드워커힐더 뷔페를 다녀왔어서 후기를 남겨보려고 해요. 식사하러 호텔 뷔페를 가보는 건... 그랜드워커힐서울 더 뷔페 광진구에 있는 호텔이에요. 서울 서쪽에 거주하는 사람들은 보통 강변북로... ,헤일리의 라이프스타일♬,https://blog.naver.com/kimhyejin004,2021-08-09
그랜드워커힐서울: 온달,https://blog.naver.com/mechin21?Redirect=Log&logNo=222444301689,#그랜드 워커힐 서울 #온달 댕겨왔다 !!!! 한식 맛집 요즘은 양식보다 한식이 더 조아 메뉴는 아이패드... 보는워커힐1층 빙수 먹어보고 싶었지만 너무 배불러서 총총 떠남 온달 갠적으로 맛있고 깔끔하다 내... ,Joya's Blog,https://blog.naver.com/mechin21,2021-07-24
 워커힐명월관 날씨좋은날 :) 소담상차림 후기 * 아기... ,https://blog.naver.com/86secret?Redirect=Log&logNo=222363983011,좋은추억만 남기고 있는곳 # 워커힐 호텔 # 워커힐 홍보대사 도 아닌데 이렇게 자주 포스팅을 남기고 있습니다 ㅋㅋ 오늘은 # 워커힐 명월관 에서 울아기 #돌잔치식사 를 했어요. 코로나여서 직계가족도 8인까지만... ,레이지 스티치,https://blog.naver.com/86secret,2021-05-24
르네블루바이 워커힐룸서비스 메뉴 많이 시켜 먹기 (가격 정보... ,https://blog.naver.com/sunshine_308?Redirect=Log&logNo=222498790083,"강원도 고성 르네블루 by워커힐 이 오픈하던 시기에 왔던 좋은 느낌 때문에 작년에 이어 올해 휴가도 르네블루바이 워커힐 로 왔다. 그런데 성수기라 해외여행 가는 비용을 내고 와서 그런건지, 처음 방문하던... ","유후, 삶은 여행",https://blog.naver.com/sunshine_308,2021-09-08
고성 르네블루 바이워커힐조식 뷔페 시간 가격,https://blog.naver.com/lovely_227?Redirect=Log&logNo=222449158468,강원도 고성 가족여행 르네블루by 워커힐조식 안녕하세요. 강원도 고성 가족여행 때 묵었던 고성 르네블루 바이워커힐 . 전객실 오션뷰객실이라 바다보면서 힐링하고 일출까지 룸에서 확인할 수 있었는데요.... ,이써니의 일상다이어리:),https://blog.naver.com/lovely_227,2021-07-29
"서울 호캉스, 한강뷰가 아름다운 그랜드워커힐서울",https://blog.naver.com/annatomo?Redirect=Log&logNo=222455949431,서울 호캉스 그랜드워커힐서울 Grand Walkerhill Seoul ⓒ그랜드워커힐서울 서울 도심에 있으면서도 도심의 번잡함에서 벗어나 자연과 함께 힐링할 수 있는 고급 호텔 그랜드워커힐서울 아차산의... ,제나의 블로그 | 국내 해외 호텔 여행,https://blog.naver.com/annatomo,2021-08-04
광장동미용실 준오헤어워커힐 광장점에서 헤어클리닉,https://blog.naver.com/pompom88?Redirect=Log&logNo=222464448693,준오헤어워커힐 광장점 나은지 원장님께 받았는데 너무 친절하게 응대해주셔서 편안하게 시술받고 온 준오헤어워커힐 광장점! 연속 이틀째 온 광진구 광진구 5호선 광나루역 2번출구 광장동 신동아 파밀리에... ,Jasmin-log,https://blog.naver.com/pompom88,2021-08-10
비스타워커힐서울 피자힐에서 바라본 한강#페이지,https://blog.naver.com/shbae3521?Redirect=Log&logNo=222294740873,"비스타워커힐서울 피자힐에서 바라본 한강 그리고 벚꽃 추억이 있는 곳을 다시 찾을 때는 마음속... 지금은워커힐 에서 피자힐 쪽으로 을라 오는 도로는 차단되었고, 도로도 많이 변경이 되어 그때 그 느낌은... ",페이지의세상만사 체험여행,https://blog.naver.com/shbae3521,2021-04-01
집에서 간편하게 먹는워커힐명월관 갈비탕(마켓컬리... ,https://blog.naver.com/hwc0605?Redirect=Log&logNo=222475530837,오늘 소개해드릴 제품은 마켓컬리에서 판매하는워커힐명월관 갈비탕입니다.워커힐호텔 내에 위치한 명월관에서 판매하고 있는 갈비탕을 냉동제품으로 만들어서 판매하고 있습니다. 이거 제가 작년 초에... ,Life is Travel,https://blog.naver.com/hwc0605,2021-08-19
 워커힐 한옥카페 가을하늘에어울리는 아차산로59,https://blog.naver.com/tyiotyo?Redirect=Log&logNo=222499463898,친구들이 장사 를 하니 정말 좋구나야! . . 집으로 돌아와서 야무지게 일을 마무리하고 오늘 저녁은 감자돌이 개학기념 감자짜글이 #아차산로59 #구리카페 #한옥카페 # 워커힐 카페 # 워커힐 한옥카페,꾸밈없는 날것을 보여주는 양떼엄마 서연주,https://blog.naver.com/tyiotyo,2021-09-08
 워커힐파빌리온 열대과일빙수,https://blog.naver.com/emghee?Redirect=Log&logNo=222422485998, 워커힐파빌리온 열대과일빙수 호텔 체크아웃하고 빙수 먹으러 고고 그랜드 워커힐일층 파빌리온 토요일 오후에 어슬렁거릴때는 돗대기 시장처럼 사람 많았는데 일요일 오전은 그나마 사람이 없어서... ,232님의블로그,https://blog.naver.com/emghee,2021-07-06
[핑투추천] 브라이덜샤워 호텔 패키지 Ⅰ그랜드워커힐호텔... ,https://blog.naver.com/pinktour2015?Redirect=Log&logNo=222520823392,: ) 출처 : 그랜드워커힐호텔 그랜드워커힐호텔 서울특별시 광진구워커힐 로 177 문의 : 02-1670-0005 그랜드 워커힐호텔에는 브라이덜샤워 하기 좋은 'Girls' Night Out' 패키지가 있습니다! 이 패키지는 캐노피... ,국내 웰니스 여행지에서 힐링을 두 배로 :) 핑크투어,https://blog.naver.com/pinktour2015,2021-09-29
" 워커힐조식 더부페, 비스타수영장,스카이야드",https://blog.naver.com/emghee?Redirect=Log&logNo=222443618350," 워커힐조식 더부페, 비스타수영장,스카이야드 조식먹으러 고 2층 더부페 오픈시간에 맞춰 왔는데 우리처럼 서두른 사람들이 꽤 많았다 다 맛있어 파라다이스는 참 별로였는데워커힐 은 묘하게 음식하나하나... ",232님의블로그,https://blog.naver.com/emghee,2021-07-24
[내돈내산먹기]워커힐모에기(일식당),https://blog.naver.com/yjyj417?Redirect=Log&logNo=222448091699,얼마전 베프 생일을 맞아 밥을 사주기 위해워커힐모에기에 갔다. 사실 모에기는 내가 일식을 좋아해서... 싶다ㅋㅋ워커힐입구 꽃장식. 평일 저녁이라 창가자리 줍줍 !! (홀에 창가자리는 약 4-5개) 먼저... ,"단순, 단단, 단아",https://blog.naver.com/yjyj417,2021-07-28
르네블루바이 워커힐그랜드패밀리스위트룸 @ 강원도 고성여행,https://blog.naver.com/parisunset?Redirect=Log&logNo=222264582792,르네블루바이 워커힐로비 들어서자마자 눈앞에 정면으로 보이는 바다뷰가 너무 멋있어요 이 뷰... 르네블루바이 워커힐그랜드패밀리스위트룸 구조 보세요 정신적지주님과 내가 머물렀던 룸1의 뷰 어디에서... ,parisunset,https://blog.naver.com/parisunset,2021-03-04
[강원도여행]르네블루바이 워커힐 @고성/송지호해변-여행리뷰1,https://blog.naver.com/maisondeh14?Redirect=Log&logNo=222406325142,"르네블루 by워커힐SK에서 운영하는워커힐호텔..그 호텔은 맞다만, 이름만 빌려주고, 동부건설에서 운영하는 듯 하다. 출발할때는 날이 맑았는데 도착하니 날이 우중충해진다. 분명 기상청도 날이... ",아티스 유학포트폴리오,https://blog.naver.com/maisondeh14,2021-06-22
서울 호캉스 : 비스타 워커힐서울 + 마운틴뷰 !,https://blog.naver.com/joy3345?Redirect=Log&logNo=222431131395,이전에 서울 호캉스로 비스타 워커힐 서 울 다녀왔던 후기! 비스타 워커힐서울 그랜드 워커힐 서울과 한번 비교해보시길 그랜드 워커힐서울과 비스타 워커힐서울은 건물이 떨어져 있다. 로비로 가면 친절한... ,매력홍 ♡,https://blog.naver.com/joy3345,2021-07-14
비스타 워커힐 서울 피자힐 다녀왔어요,https://blog.naver.com/ohil512?Redirect=Log&logNo=222408363420,"우리나라 #최초피자집 # 워커힐 호텔 #피자힐 다녀왔어요! #건축가 #김수근 #대표작품 #건물 이라고...워커힐 쪽이나 주차타워 이용하면 주차확인 받아야 하지만, 언덕끝이라 차를 타고 올라가 건물앞에... ",IAM512,https://blog.naver.com/ohil512,2021-06-24
강원도 고성 숙소 르네블루 바이워커힐객실 조식후기,https://blog.naver.com/tnwlsdl702?Redirect=Log&logNo=222470997159,스위트룸 강원도 고성 숙소 르네블루 바이워커힐객실 조식후기 강원도에 여행을 가려고 할 때... 르네블루바이 워커힐이랍니다 고성 숙소 중에서 가장 인기가 좋은워커힐 호텔 이곳의 가장 큰 장점은 역시나... ,책상에서 즐기는여행이야기,https://blog.naver.com/tnwlsdl702,2021-08-15
 워커힐 호텔 델비노 돌잔치 한강뷰는 덤 (with 스트릿가든돌상),https://blog.naver.com/photogr_js?Redirect=Log&logNo=222469015693,인갤러리워커힐 호텔 델비노 돌잔치 포스팅입니다.워커힐 호텔은 소규모돌잔치 하기 좋은 레스토랑이 여러개있는데요 금룡/명월관/모에기/델비노/온달이 있습니다. 오늘은 델비노에서 진행된 돌잔치로... ,인갤러리,https://blog.naver.com/photogr_js,2021-08-13
호캉스: 비스타 워커힐서울 디럭스 마운틴 뷰!,https://blog.naver.com/choikr82?Redirect=Log&logNo=222430043591,올 여름 호캉스는 비스타워커힐서울에서 보내고 왔습니다. : 휴가다운 휴가 못 갈것 같아서 1박 2일 호캉스!! 휴가 내기 힘들어 일 끝나고 광진구에 위치한워커힐호텔로!! 2호선 강변역에 내려서 호텔 셔틀... ,★라온★,https://blog.naver.com/choikr82,2021-07-13
서울워커힐 호텔 빵집 르파사쥬 쓸어오기,https://blog.naver.com/datesugar?Redirect=Log&logNo=222263584686,서울워커힐 호텔 빵집 르파사쥬 쓸어오기워커힐 에서 빵을 오랜만에 사왔어요! 점심 먹고 갔는데 인기 많은 크루아상이랑 팥빵은 다 팔려서 아쉬웠지만 골라온 다른 빵들도 너무 맛있어서 역시워커힐 ... 클라스.... ,DATE SUGAR,https://blog.naver.com/datesugar,2021-03-03
미궁365가 쏜다!비스타워커힐 에서 럭셔리한 점심시간,https://blog.naver.com/migung3650?Redirect=Log&logNo=222438617062,전직원 비스타워커힐식사 날씨도 좋고~ (장마 전이였습니다...) 기분도 좋고~ (날씨가 좋으면 기분도... 그렇게 파트별로 3~4명씩 날짜를 나누어 점심시간을 비스타워커힐 에서 럭셔리하게 보내고 왔습니다. 각... ,미궁365 공식블로그,https://blog.naver.com/migung3650,2021-07-20
즐거운 뷔페 저녁 데이트 그랜드워커힐더뷔페 _ 발렛 또는... ,https://blog.naver.com/dog6420?Redirect=Log&logNo=222346208536,어제는 기와 함께워커힐더뷔페에서 저녁을 먹었어요! 역시나.. 역시나.. 오늘은 서론이 길지 않아요 한번 보시죠!!!ㅋㅋㅋㅋ 모든 음식이 맛있는 그랜드워커힐더뷔페 코로나 여파인지 사람이 많지 않아... ,찌니공간,https://blog.naver.com/dog6420,2021-05-11
 워커힐피자힐에서 반반피자와 샐러드 먹은 후기,https://blog.naver.com/kha122412?Redirect=Log&logNo=222499813138,예전부터 너무 가고싶었던 비스타 워커힐 의 피자힐을 가봤다 ! 피자힐 입구에서 반겨주는 스누피?... 비스타 워커힐피자힐후기 9.6(월) 1부 방문 운영시간 1부 11:30 - 13:00 2부 13:00 - 14:30 3부 14:30 - 16:00 4부 16:00... ,힘차게 달리는 밤바비,https://blog.naver.com/kha122412,2021-09-09
