title,link,description,bloggername,bloggerlink,postdate
 워커힐 호텔 디퓨저 어반포레스트에 담긴 숲속향,https://blog.naver.com/lovvming?Redirect=Log&logNo=222503414130,중인워커힐 호텔 디퓨저인 어반포레스트를 사용해보았어요 이렇게 택배 상자가 드디오 도오오착! 에어캡으로 여러 번 감아서 포장되어서 안전하게 도착했어요 그린그린한 패키징. 그랜드워커힐호텔에서... ,뭉이내♥,https://blog.naver.com/lovvming,2021-09-12
[광진구] 금룡 / 그랜드워커힐서울 중식당,https://blog.naver.com/kohkoh_123?Redirect=Log&logNo=222528747242,"아부지 생신 런치로워커힐중식당, 금룡에 갔던 이야기를 해볼까 합니둥. 해외에 나가있는 맥도 앤드 형부 (벗 모스틀리 형부...)가 예약을 해주셨습니다. 다시금 감사감쟈...! 테이블은 요렇게 세팅이... ",the silver spoon project,https://blog.naver.com/kohkoh_123,2021-10-06
르네블루바이 워커힐루프탑 블루라운지 패키지로 즐긴... ,https://blog.naver.com/sunshine_308?Redirect=Log&logNo=222530033448,"르네블루 By워커힐루프탑 블루라운지 글, 사진 유후 강원도 상단에 위치한 고성의 르네블루바이 워커힐 . 오픈했을 때부터 여러 번 갔지만 어쩐지 처음 방문했을 때의 좋은 느낌은 사라져가는 것 같다. 역시... ","유후, 삶은 여행",https://blog.naver.com/sunshine_308,2021-10-07
 워커힐 호텔 호캉스의 꽃* 더부페 조식 후기 ㅋㅋ,https://blog.naver.com/86secret?Redirect=Log&logNo=222506418291,어제 조촐하게 생일파티를 하고 #호캉스 의 꽃 조식을 먹으로 #더부페 로 고고싱 하나하나 정성스러운 느낌의 # 워커힐 호텔조식 전에 # 워커힐 멤버쉽 블랙멤버라서 #더부페 4인무료 부페권이 있어서 야무지게... ,레이지 스티치,https://blog.naver.com/86secret,2021-09-15
한강뷰호텔 서울5성급호텔 비스타워커힐서울 투숙기,https://blog.naver.com/hannapride?Redirect=Log&logNo=222505900181,한강뷰호텔 서울5성급호텔 비스타워커힐서울 투숙기 호캉스가 제일 좋아우리 집 남자랑 큰맘 먹고... ㅎㅎ 그래서 제가 가고 싶다 강력하게 주장해서 저장해뒀던 신행 비용 떼서 비스타워커힐서울... ,여행은 인생 필수조건이다,https://blog.naver.com/hannapride,2021-09-16
# 한강뷰 레스토랑 비스타 워커힐서울 피자힐 네이버예약... ,https://blog.naver.com/minijunior?Redirect=Log&logNo=222532830758,*비스타 워커힐서울 홈페이지입니다 *네이버 피자힐 예약링크입니다 네이버 예약시 선택할 수 있는... 먼저 저희는 주차타워에 주차하고 그랜드워커힐 로 바로 갔구요~ (주차타워랑 그랜드워커힐 은... ,낭만빵순희의 지구별여행,https://blog.naver.com/minijunior,2021-10-10
"숲속 힐링 공간에서의 호캉스,워커힐더글라스하우스",https://blog.naver.com/jin5411296?Redirect=Log&logNo=222510902181, 워커힐정문 셔틀 타는 곳에서 더글라스하우스 가는 셔틀 혹은 4인용 차량을 탈 수 있답니다. 객실을... 날씨도 좋고 기분도 좋았던터라워커힐1층에서 구매한 화이트와인부터 시작 했오요. Previous image Next... ,여름 Summer,https://blog.naver.com/jin5411296,2021-09-19
나를 사로잡은워커힐광진구 맛집 모음,https://blog.naver.com/celeb_kook?Redirect=Log&logNo=222503150324, 워커힐맛집엔 저렴한 와인도 있어 부담이 없었고 한우와 어울는 와인으로 골라 함께 곁들이기...워커힐맛집의 묘미는 바로 함께 구워 먹는 버섯과 키조개 관자가 아닐까 싶어요. 직원분께서 참숯을 굉장히... ,味's Korea,https://blog.naver.com/celeb_kook,2021-09-12
"그랜드 워커힐호캉스 (디럭스 더블룸, 리버뷰, 더뷔페 조식포함... ",https://blog.naver.com/kang0447?Redirect=Log&logNo=222532767271,기다리던 호캉스데이 #그랜드 워커힐따라라라라 비지엠 필수 무조건 그랜드 워커힐 은 리버뷰지 하면서 얼리버드 예매하고 두큰두큰했었지 디럭스 더블룸 강 전망 비온다구해서 걱정했는데 세상 맑았다 룸키도... ,Daily Blog,https://blog.naver.com/kang0447,2021-10-10
그랜드워커힐'더뷔페'힐링 그리고 휴식,https://blog.naver.com/jeno55?Redirect=Log&logNo=222538971628, 워커힐 에서..(2021 여름)워커힐호텔 # 워커힐 더뷔페 더 뷔페 내부모습. 더뷔페 # 워커힐 호텔 일찍 예약을 해서인지 창가 자리에 앉게 되었어요.워커힐 서울더뷔페 하나하나 빼 놓을 수 없는 최고의 요리죠.... ,인도에서 담아내는 감성 풍경,https://blog.naver.com/jeno55,2021-10-16
그랜드워커힐서울 - 클럽 스위트,https://blog.naver.com/ohju1010?Redirect=Log&logNo=222513210305,회사+지인찬스로 그랜드워커힐서울 다녀왔어요. 무려 클럽 스위트라니..강변역에서 무료셔틀 타고 호텔로 들어갔어요. 호텔 무료셔틀은 요렇게 생겼어요. 셔틀 정보는 공홈링크에 자세히 나와있어요.... ,逍遙日常 소요일상,https://blog.naver.com/ohju1010,2021-09-22
르네블루 바이워커힐호텔 후기(고성 송지호 해수욕장 ),https://blog.naver.com/redhude?Redirect=Log&logNo=222528745475,지난 여름에 다녀온 르네블루 바이워커힐오션뷰가 예쁘고 시설도 깔끔해서 호캉스하기에 딱 좋은 호텔이었다. 들어가자마자 통창을 통해 보이는 파란 바다. 뷰가 정말정말 좋았다. 침대에서도 바다가 보이고... ,Fly Me to the World,https://blog.naver.com/redhude,2021-10-06
짧은 가을을 만끽하기 위한 그랜드 워커힐클럽... ,https://blog.naver.com/hyunzinkim?Redirect=Log&logNo=222537972777,짧은 가을을 만끽하기 위한 그랜드워커힐클럽 추캉스 패키지 Autumn in Grand Club by Walkerhill 벌써... 특히 서울에선 # 워커힐 가을호캉스 만한게 없죵 ㅋㅋㅋ 작년에 #그랜드 워커힐# 워커힐 클럽라운지... ,"취향소비자 V의 쉼표, 숨 쉬는 공간",https://blog.naver.com/hyunzinkim,2021-10-15
"특별한 날,워커힐피자힐에서",https://blog.naver.com/urmyeternity?Redirect=Log&logNo=222515622976,9월이 되서야 퇴직기념으로 선물받은워커힐바우처를 사용했다. 네이버 예약으로 보니 이미 주말은 한달후까지 예약이 차있었다. 혹시몰라 전화로 문의하니 운이 좋게 원하는 날짜와 시간에 자리가... ,쥬스 냉장고 | Joo's archive,https://blog.naver.com/urmyeternity,2021-09-24
"비스타 워커힐가을패키지 AUTUMN ESCAPE, 가을나들이로 딱!... ",https://blog.naver.com/hyunzinkim?Redirect=Log&logNo=222515547295,비스타 워커힐가을패키지 AUTUMN ESCAPE 가을나들이로 딱! 태교여행 호캉스로 즐기기 :) 지난 Art+Vacance 비스타 아트바캉스 태교여행에 이어서 #늦캉스 #호텔패키지 로 #비스타 워커힐#AutumnEscape 패키지를 다녀왔다.... ,"취향소비자 V의 쉼표, 숨 쉬는 공간",https://blog.naver.com/hyunzinkim,2021-09-24
광주워커힐 호텔_깔끔하고 조용한 숙소 내돈내산,https://blog.naver.com/lei850802?Redirect=Log&logNo=222521810924,광주숙소 광주호텔 광주 워커힐광주여행숙소 깨끗하고 조용한 타워주차 발렛 맞은편 편의점 내돈내산 이번 추석연휴 다녀온 광주여행 산행 목적으로 1박을 하고자해서 숙소를 보다 위치나 시설이 맘에들어서... ,소녀와 고양이,https://blog.naver.com/lei850802,2021-09-30
서울 데이트코스 비스타워커힐호텔 리바(Re: Bar) 칵테일,https://blog.naver.com/su2590?Redirect=Log&logNo=222533001050,"[TocS Life] 서울 데이트코스 비스타워커힐호텔 리바(Re:Bar) 칵테일 By TocS의 웹 이야기 서울 광진구에 위치한 『비스타워커힐서울』, 몇년전 W 워커힐 에서 이름이 비스타워커힐 로 바뀌었죠. 이 호텔은 대표적인... ",톡스의 여행과 사진,https://blog.naver.com/su2590,2021-10-10
그랜드 워커힐수영장 * 호캉스 전세내고 놀기,https://blog.naver.com/86secret?Redirect=Log&logNo=222508077606,새벽6시에 #그랜드 워커힐 수영장 열자마자 땡하고 달려갔어요. 한시간 시원하게 수영하고 조식먹으러 ㅋㅋㅋ 그랜드 워커힐수영장 * 호캉스 전세내고 놀기 아침6시에 수영하고 20분 빡시게 해주고 샤워하고... ,레이지 스티치,https://blog.naver.com/86secret,2021-09-17
그랜드워커힐 / 더뷔페/에노티카/르파사쥬,https://blog.naver.com/ssmrd?Redirect=Log&logNo=222530233319,주말에 가족과 찾은 그랜드워커힐급하게 잡은 일정이라 예약이 꽉 차서 마운틴뷰로 잡았는데 아침에... 유료 코너는 손도 안 댔어요ㅎㅎ #그랜드 워커힐 어메니티 요긴하게 잘 썼어요^^ 브랜드는 잘 모르겠지만... ,살림이 취미,https://blog.naver.com/ssmrd,2021-10-07
 워커힐멤버쉽 * 패밀리 디럭스 스위트 룸 호캉스 후기 * 휴 넘... ,https://blog.naver.com/86secret?Redirect=Log&logNo=222500509651,"이번에 생일기념으로 #호캉스 #그랜드 워커힐#패밀리디럭스스위트룸 으로 다녀왔어요. 저는 지금 # 워커힐 멤버쉽 블랙멤버라서, 무료숙박권 2개가 있었는데... 더 좋은 숙박권은 일단 킵해놓고, ㅋㅋㅋㅋ 이번엔... ",레이지 스티치,https://blog.naver.com/86secret,2021-09-09
 워커힐 호텔 디퓨저 │ 시트러스 가든,https://blog.naver.com/moonjin_2?Redirect=Log&logNo=222511515102,/워커힐 호텔 디퓨저 시트러스가든 향 / 호텔에 갔을 때 로비에 들어서면 서늘함과 동시에 그 호텔만의... 좋아하는데요워커힐호텔에서 사용하는 디퓨저가 있어서 이번에 사용해봤어요. 작년에 르네블루갔을... ,Luna Log,https://blog.naver.com/moonjin_2,2021-09-20
고성 르네블루바이 워커힐디럭스더블룸 후기,https://blog.naver.com/jimin3031?Redirect=Log&logNo=222518357005,강원도 여행~~ 르네블루바이 워커힐예약했구요~ 저희는 두달전에 했는데 구해줘숙소? 거기에 나와서 엄청 인기가 많아졌다고 해요~ 르네블루바이 워커힐 은 지하주차장은 몇대 주차안되고~ 거의 실외 공터에 많이... ,민민로그,https://blog.naver.com/jimin3031,2021-09-27
"10월 첫째주 기록 (결혼기념일, 친구들만남, 호캉스,워커힐 )",https://blog.naver.com/wjstmdal_?Redirect=Log&logNo=222533901000,일찍워커힐체크인! 운좋게 우리방 업그레이드 됐는데 날씨가 안좋아서 아쉽 ㅠ 저녁은 더뷔페 헤헤헤헤헿 이거 먹을라구 아침점심도 안먹었다!!!! 가짓수가 적구 중식이 좀 아쉬웠지만 너무 맛있게 잘... ,美,https://blog.naver.com/wjstmdal_,2021-10-11
"[광진구맛집, 호텔맛집] 그랜드 워커힐금룡 | ‘수’코스는... ",https://blog.naver.com/tomatolob?Redirect=Log&logNo=222450687822,지난 내 생일에 갔던 # 워커힐#금룡 작년부터 이어지는워커힐식당 퀘스트깨기 금룡은 그랜드 워커힐메인 건물 1층에 위치한 중식당이다. 상당히 골드골드한 외관 토요일 점심식사라서 딱 한자리 남은걸 남친이... ,XOXO ;-),https://blog.naver.com/tomatolob,2021-07-30
서울워커힐호텔 한강뷰 레스토랑 비스타워커힐서울 모에기,https://blog.naver.com/hjmama2?Redirect=Log&logNo=222541804551,서울워커힐호텔 한강뷰 레스토랑 비스타워커힐서울 모에기 오랫만에 다녀온워커힐 !! 얼마만인가 ㅎㅎㅎ 지인 생일이여서 생일밥먹을겸 다녀왔던 서울워커힐호텔! 예전에는 벗꽃놀이 보러 자주... ,마음편한 쉼,https://blog.naver.com/hjmama2,2021-10-19
 워커힐호텔 애프터눈티 카페 더파빌리온 가을 디저트 세트 1+1?,https://blog.naver.com/pshlove2015?Redirect=Log&logNo=222539369558,"ㅋㅋ 작은딸은 일이 있어서 못오고 아이들 셋만 데리고 남편이랑 중식당 금룡 갔다가워커힐호텔 카페... 주문하고~^^워커힐카페 더파빌리온 가을 디저트 세트에 음료 2잔도 포함~ 아메리카도, 카푸치노... ",러블리데이 시크릿타임,https://blog.naver.com/pshlove2015,2021-10-17
8월26일워커힐 더글라스하우스,https://blog.naver.com/ryujiseon?Redirect=Log&logNo=222492889399,든든하게 점심먹구워커힐더글라스하우스에 갔다. 호캉스-!체크인! 방은 깔끔. 침대가 우리집에 있는... 내가 지다니ㅜㅜ 다음 날 일어나서 워커힐 호텔 더뷔페 조식먹구 배빵빵. *우리가 호텔에 가는 이유: 수영과... ,참을 수 없는 그녀의 가벼움,https://blog.naver.com/ryujiseon,2021-09-02
" 워커힐델비노 돌잔치, 화사하게 담은 돌스냅",https://blog.naver.com/gomdalsnap?Redirect=Log&logNo=222543886731,오늘 소개해드릴 돌잔치 장소는 비스타워커힐호텔입니다. 그랜드워커힐 과 붙어 있는 곳으로 예전부터 지금까지 소규모 돌잔치 장소로 꾸준한 인기를 누리고 있는 곳입니다. 돌잔치는 금룡과 명월관에서... ,GOMDAL SNAP,https://blog.naver.com/gomdalsnap,2021-10-21
 워커힐디퓨저_ 고품격 호캉스를 집에서 하는 느낌_(주) 코트리,https://blog.naver.com/sweetie29?Redirect=Log&logNo=222513537333,고품격워커힐디퓨저 집 안 곳곳에 퍼져나가는 고품격 향기로 집에서 호캉스를 즐기는 느낌이예요.워커힐호텔에서 사용하는 바로 그 제품. 고급스러운 선물 상자에 정성스럽게 포장되어 도착한... ,"캘리그래피, 책 그리고 새로운 인생 브랜딩",https://blog.naver.com/sweetie29,2021-09-22
주말 저녁 데이트 @ 워커힐더뷔페,https://blog.naver.com/dondon_choco?Redirect=Log&logNo=222504062268,거의 두 달만에 남자친구도 나도 공부 없는 주말이라 저녁 맛있는거 먹기로 〰〰워커힐모에기에서 오마카세 먹고싶었는데 한 달 전에 예약해도 치열하다길래워커힐더뷔페로 노선 변경 ㅎㅎ 더뷔페도 창가는... ,"innit, though?",https://blog.naver.com/dondon_choco,2021-09-13
그랜드워커힐호텔 / 호캉스 부대시설,https://blog.naver.com/rubyjuju0620?Redirect=Log&logNo=222403705807,이번 이야기는 그랜드워커힐호텔 / 호캉스 부대시설입니다. 오랜만에 그랜드워커힐호텔과 비스타워커힐 을 이용하면서 다시 한번 포스팅해보는 그랜드워커힐호텔. 비스타워커힐 이 w 호텔이던 시절 w... ,dr.장 이야기,https://blog.naver.com/rubyjuju0620,2021-08-30
[국내여행] 강원도 고성 르네블루바이 워커힐호텔,https://blog.naver.com/gia1220?Redirect=Log&logNo=222518293886,"고성 르네블루 by워커힐호텔 9월 추석 연휴가 시작되기 전에, 여름 휴가철을 피하고자 고른 9월 여행지 강원도의 호텔은 . . . 일 년 정도 된 고성 '르네블루by 워커힐 ' 호텔입니다. 많은 휴가객들을 피하면서... ",구름모모,https://blog.naver.com/gia1220,2021-09-27
 워커힐피자힐,https://blog.naver.com/ohmyjudy?Redirect=Log&logNo=222541169302,찾은 곳이워커힐피자힐. 어미나 할미나 정신이 쏙 빠졌던 지난 한주간... 이곳 피자힐에서 아기가 잘 먹은 것이 아니라 할미랑 어미가 힐링을 했다능~워커힐피자힐엔 무수히 다녔왔어도 이렇게 손주 돌보다가... ,도시로 가다.,https://blog.naver.com/ohmyjudy,2021-10-19
 워커힐맛집 : 찬바람불면 생각나는 구리 묘향만두 평양식 손만두,https://blog.naver.com/mj0955?Redirect=Log&logNo=222524227566, 워커힐근처에 오래된 만두집 묘향만두 10년전 처음 가봤을때는 정말 허름한 한옥같은 느낌 이였는데... 조금만가면워커힐 이라워커힐 맛집 으로도 유명한 묘향만두는 맛집답게 사람도 항상 많았다 주차요원... ,쫑이찌니의해피바이러스,https://blog.naver.com/mj0955,2021-10-02
아차산로59 숨어있는워커힐근처 한옥카페,https://blog.naver.com/malahalo?Redirect=Log&logNo=222525691977,아차산로59라는 카페가 있다 아니 사실은 몰랐는데워커힐근처로 섭옵이랑 이것저것 수다를 떨어야... 할 수 있지만워커힐근처 카페 중에 한옥인 카페가 딱 2갠데 그 중 한개라고 생각하면 된다 심지어 이름이... ,라깰의 어제보다 즐거운 오늘,https://blog.naver.com/malahalo,2021-10-04
브라이덜샤워 ♀️ @그랜드워커힐 ,https://blog.naver.com/kulen?Redirect=Log&logNo=222512309100,있어워커힐 에서 만났지만 객실 잡아놓은 건 절대 알 수가 없었을거다. 왜냐면 이중 삼중으로 트릭을... 다시 한 번 너의 기쁜 날을 진심으로 축하해. . # 워커힐#서프라이즈 #브라이덜샤워 #너는다계획이있구나,via kulen,https://blog.naver.com/kulen,2021-09-21
 워커힐 호텔 금룡 런치코스후기 * 생일날 한강바라보며 냠냠,https://blog.naver.com/86secret?Redirect=Log&logNo=222502376805,생일기념 # 워커힐 금룡 #중식코스요리 먹으로워커힐 로 고고싱워커힐금룡 런치코스 후기 * 생일날 한강바라보며 냠냠 # 워커힐 멤버쉽 #블랙 멤버쉽 유지중인데 2인 50% 할인쿠폰이 있어서 쓸겸 ㅋㅋ 조촐한... ,레이지 스티치,https://blog.naver.com/86secret,2021-09-11
고성 르네블루바이 워커힐조식후기,https://blog.naver.com/jimin3031?Redirect=Log&logNo=222520496223,르네블루바이 워커힐조식후기 가져왔어요~ 저는 디럭스더블룸+조식 예약했습니다. 일출보느라... 헷 햇빛이 촤르르르~~~~~` 맛있었던 초코링~~~~~~~요거트~~~~~~ 헷 르네블루바이 워커힐먹거리 산책하러 나왔어요... ,민민로그,https://blog.naver.com/jimin3031,2021-09-29
김지희 작가 개인전 Good vibes 전시회 @ 비스타워커힐 ,https://blog.naver.com/whitenun?Redirect=Log&logNo=222504051084,결혼기념일 7주년 기념으로워커힐 로 식사하러 갔다가 우연히 보게 된 전시회 비스타워커힐거울방에서 김지희 작가의 개인전이 열리고 있었다. 식사 하러 갔는데 오픈 첫 날! 오픈 첫 날이라 그런지 김지희... ,오늘도 룰루라라,https://blog.naver.com/whitenun,2021-09-13
비스타워커힐피자힐 ; 엄마 생일파티,https://blog.naver.com/youn0107?Redirect=Log&logNo=222530616177,남편이가 엄마생일이라고 예약해둔 비스타워커힐피자힐 다녀왔습니당 평소 엄마가 피자 덕후 ㅋㅋㅋㅋㅋ 인점을 생각해서 남편이 비스타워커힐피자힐이 좋을꺼같다고 8월에 피자힐에서 밥먹고 오자고해서... ,욘디,https://blog.naver.com/youn0107,2021-10-08
 워커힐돌스냅 명월관 처음생일 이야기,https://blog.naver.com/mokaninn?Redirect=Log&logNo=222499459135,photographer_제이피스타일 place. 워커힐명월관 안녕하세요 스냅 작가 #제이피스타일 입니다. 추석전까지... 이번 포스팅은 # 워커힐 돌스냅 촬영 명소중 한곳인 명월관에서 촬영한 사진입니다.워커힐돌스냅... ,제이피스타일,https://blog.naver.com/mokaninn,2021-09-08
"20210916 광장동/그랜드워커힐서울 더 뷔페, 폴콘 리버가든... ",https://blog.naver.com/tmddkg?Redirect=Log&logNo=222507971495,#그랜드 워커힐 서울더뷔페 #더뷔페런치 . 오~ 요기 첨인데 갠찮네~ 맘은 늘 골고루 정당히..인데... 배부르니까워커힐반바퀴ㅋ 설렁설렁 산책하다 #뷰포인트 발견 #인증샷 . 드라이브겸 커피마실겸 팔당 인근... ,달콤해서 큰일이야...,https://blog.naver.com/tmddkg,2021-09-16
비스타워커힐호텔 생일 이벤트 풍선장식 / 풍선 데코,https://blog.naver.com/balloond?Redirect=Log&logNo=222509131216,"Birthday Event Deco Vista Walkerhill Hotel 비스타워커힐호텔 생일파티 이벤트, 프로포즈는 홍선생풍선아트와 함께 하세요! 하루에 단 한 커플만을 위하여 두 분만을 위한 맞춤 스타일링으로 잊지 못할... ",홍선생풍선아트,https://blog.naver.com/balloond,2021-09-17
가을 맞이 염색 ! 바이올렛 준오헤어워커힐 광장점,https://blog.naver.com/zxcv12b?Redirect=Log&logNo=222508984276,계속 찰칵찰칵 사진을 찍었다 자연광에서 나의 머리 !!!! 진짜 이뿌다 .... 만족 오만프로 !!! 가을 맞이 변신은 꼭 나은지 원장님께 하시길 ❤️ #준오헤어 워커힐 광장점 #바이올렛염색#에쉬바이올렛#염색맛집,얼렁뚱땅작업소,https://blog.naver.com/zxcv12b,2021-09-17
비스타 워커힐델비노,https://blog.naver.com/hellokidcook?Redirect=Log&logNo=222540067646,"축하할일이 있어서 #비스타 워커힐 이탈리안델비노에 가족과 함께 다녀왔어요. 일욜은 코스만 드셔야해요. 음식도 맛있지만,디저트가 넘나 맛있었네요. 날씨가 너무 좋았어요. 식사후 한강뷰 바라보며 피자힐까지... ",헬로키즈쿡,https://blog.naver.com/hellokidcook,2021-10-18
 워커힐 호텔 : 비스타워커힐델비노 한강뷰 레스토랑,https://blog.naver.com/27th-sonata?Redirect=Log&logNo=222483673558, 워커힐델비노 Seoul #호텔레스토랑 #한강뷰레스토랑 # 워커힐# 워커힐 비스타 #비스타 # 워커힐 레스토랑 21년 가람남편의 생일을 기념하여워커힐 로 식사를 하러 다녀왔다. 이게 얼마만의 호텔 식사인지.. 연애... ,로맨틱트래블러,https://blog.naver.com/27th-sonata,2021-08-25
 워커힐더글라스 하우스 디럭스 트윈룸 리버뷰 제대로 즐기기,https://blog.naver.com/kan12?Redirect=Log&logNo=222494024535,엄마 생신쯤 아빠찬스로 # 워커힐#더글라스하우스 이용했어요~워커힐더글라스 하우스는 #노키즈존 으로 조용하게 잘 다녀온것 같아요.워커힐호텔보다 더 안쪽에 위치해 있고 #라이트조식 으로 가볍게... ,Anna’s 리뷰log,https://blog.naver.com/kan12,2021-09-03
비스타 워커힐스카이야드 + 조식 더뷔페 후기,https://blog.naver.com/moojigae302?Redirect=Log&logNo=222473740492,"비스타 워커힐4층에 위치하고 있다. 운영시간은 09:00~22:00 이고, 투숙객은 횟수 제한없이 이용 가능!... 그랜드 워커힐 로 총총! 더 뷔페는 그랜드 워커힐2층에 있다. 런치/디너 가격표는 아래 참고! 8시반정도에... ",빛나는 1%,https://blog.naver.com/moojigae302,2021-08-17
아기랑 강원도 고성 여행: 르네블루 바이워커힐호텔 패밀리... ,https://blog.naver.com/jbna1004?Redirect=Log&logNo=222533236165,르네블루 by워커힐오션뷰 3박 4일 여행의 마지막은 르네블루 바이워커힐 에서 보냈다. 전 객실이 오션뷰인 호텔이었다. 르네블루 바이워커힐패밀리 디럭스룸 아기와 함께 하는 3인 가족 여행이었기 때문에... ,Little Forest,https://blog.naver.com/jbna1004,2021-10-11
" 워커힐더글라스 하우스, 조식 + 해피아워 + 더글라스아워",https://blog.naver.com/dmsp3535?Redirect=Log&logNo=222426985932, 워커힐더글라스 하우스 2탄 여기로 호캉스를 선택한 이유중에 하나인 무료 라운지 이용하기~ 외부로... 일단워커힐더글라스 라운지에서는 커피가 무제한인데 폴바셋 원두를 쓴다고 해요 지인부부와 넷이... ,GRACE's lov diary,https://blog.naver.com/dmsp3535,2021-07-10
호캉스 제대로 즐길수 있는 서울 비스타 워커힐 호텔,https://blog.naver.com/ttang_e?Redirect=Log&logNo=222370796710,"정말 간만에 2박3일 서울 나들이를 하고 있습니다.2박을 서울 광진구에 있는 #비스타 워커힐 호텔 예약을 하고,,지하철5호선 광나루역에서 # 워커힐 호텔무료셔틀버스 타고 서울서 한강과 가장 가까운 비스타 워커힐 ... ",재미난 세상 살아가기,https://blog.naver.com/ttang_e,2021-05-27
1박2일 호캉스 여름휴가/비스타워커힐호텔,https://blog.naver.com/shlovelygirl?Redirect=Log&logNo=222479452872,비스타워커힐 에 가기로 했다. 날씨는 더워도 엄청 예뻤던 하늘워커힐호텔로 가면 로비에 발렛 해주시는 분들이 있지만 유료로 진행되고 있어서 (23000원정도로 알고있음) 주차타워로 향했다. 주차타워 지하... ,bonnie의 다락방,https://blog.naver.com/shlovelygirl,2021-08-21
그랜드워커힐클럽스위트. 호캉스 숙박후기,https://blog.naver.com/yhy2411?Redirect=Log&logNo=222486028898,"광장동에 있는 그랜드워커힐 . 예전에는 자주 방문했던 호텔 중 하나였는데, 정말 간만에 숙박하게... 역시 놀때는 도심이 좋아~ ㅋ 오늘 묵기로 한 곳은 그랜드워커힐 의 클럽스위트. 비용은 디럭스룸에 비해... ",묘할묘妙냥이묘猫,https://blog.naver.com/yhy2411,2021-08-27
비스타워커힐서울 호캉스 추천 +비비드 라운지 패키지,https://blog.naver.com/dohyemm?Redirect=Log&logNo=222325101629,"비스타워커힐*˘◡˘* 종종 자매여행을 다니곤 했었는데, 그럴 수 없는 요즘. 여행가는 기분으로... 비스타워커힐비비드 라운지 패키지 제대로 즐기기 ♥ 건강한 에너지를 충전하는 컬러풀한 시간... ",dolog,https://blog.naver.com/dohyemm,2021-04-27
 워커힐더글라스 하우스,https://blog.naver.com/wisewoman_kr?Redirect=Log&logNo=222533706248,요즘 코로나19 상황이라 멀리 여행도 못 가고 해서 가까운워커힐더글라스 하우스에 가서 하루 쉬었다.... ( 워커힐호텔보다 더 아늑하다고 느껴져 나는 개인적으로 더글라스 하우스가 더 좋다고 생각한다.),몰입의 즐거움,https://blog.naver.com/wisewoman_kr,2021-10-11
