title,link,description,bloggername,bloggerlink,postdate
비스타워커힐조식 전망좋은 곳에서 식사하는법,https://blog.naver.com/ikqm77?Redirect=Log&logNo=222487692425,가까운워커힐 에서 호캉스를 하기로 급변경하여 이번주에 다녀왔습니다. 수영장 이용과 식사가 모두 포함되어 서머 패키지팩을 이용했는데 그중에서도 오늘은 비스타워커힐조식을 먹는 모습과 전망좋은... ,바니아빠의 육아일기,https://blog.naver.com/ikqm77,2021-08-29
첫 선 보이며 Begin Vegan 패키지 출시한워커힐호텔앤리조트,https://blog.naver.com/k2snatural?Redirect=Log&logNo=222515210209, 워커힐호텔앤리조트가 친환경 호텔 활동의 일환으로 업계 최초 비건 콘셉트 룸인 ‘비건 전용 객실’...워커힐 의 비건 전용 객실은 그랜드워커힐‘패밀리 딜럭스 스위트’ 3개 객실에 만들어졌다. 이불과... ,THINGS&THINKS,https://blog.naver.com/k2snatural,2021-09-24
[433] 워커힐명월관-배에 금칠하는 날,https://blog.naver.com/hjh345?Redirect=Log&logNo=222473147301,아차산 중턱에 위치한워커힐명월관 입니다.워커힐명월관 으리으리한 입구부터 클라쓰 느껴지지 않습니까?? 일단 바로 입장!! 미리 예약을 하고 갔어야 했는데 간단히 점심만 먹을 예정이라 그냥 갔었는데... ,Mr.황 is Still hungry,https://blog.naver.com/hjh345,2021-08-17
2021년 워커힐 호캉스,https://blog.naver.com/hellokidcook?Redirect=Log&logNo=222462583308,둘째날은 #비스타 워커힐 실내수영장 사람도 북적거리지 않고 좋았어요.그야말로 여긴 수영하는 사람들.... 근데 #탕욕할때도비스타 워커힐 은리버뷰우~~~ 진짜 #서울에서뷰가젤좋은곳은비스타 워커힐 일듯요.... ,헬로키즈쿡,https://blog.naver.com/hellokidcook,2021-08-09
그랜드 워커힐야외실내수영장 이용하기,https://blog.naver.com/wonder1314?Redirect=Log&logNo=222479652211,"나 출산하면 당분간 어디 데려가지도 못할것 같아서, 막달 바로직전이던 35주차에 그랜드 워커힐2박... 다시올라온 스카이야드 #그랜드 워커힐 스카이야드 야경을 보고있으니 2박3일만에 어딘가 온 느낌이 들기도... ",Lee공룡 TraveLog,https://blog.naver.com/wonder1314,2021-08-22
" 워커힐금룡 돌잔치, 바이대디 X 제제한복 X 베이비뮤즈",https://blog.naver.com/bydaddy?Redirect=Log&logNo=222522995560,장소워커힐 호텔 금룡 돌잔치 사진을 소개해드리겠습니다. 촬영일은 21년 6월 12일 6시(저녁타임) 장소 :워커힐 호텔 금룡 스냅 : 바이대디 한복 : 제제한복 돌상 : 베이비뮤즈워커힐금룡 돌잔치의 경우 촬영... ,"바이대디스냅 - ""진심 또 진심""",https://blog.naver.com/bydaddy,2021-10-01
"서울 호캉스워커힐더글라스 하우스, 라운지 솔직 후기:)",https://blog.naver.com/vivian629?Redirect=Log&logNo=222504648658,"서울 호캉스워커힐더글라스 하우스, 라운지 솔직 후기:) 지난 생일 때 다녀왔던 서울 호캉스,워커힐더글라스 하우스!! 라운지까지 모두 포함된 '디럭스 더블룸'으로 예약함! 애프터눈, 저녁, 조식 이렇게... ",잠결에 한 쪽 뺨으로 웃는 여자,https://blog.naver.com/vivian629,2021-09-13
[광장동맛집/피자맛집]피자힐/ 워커힐 ,https://blog.naver.com/ariel6234?Redirect=Log&logNo=222455627384,# 워커힐 맛집 #광진구맛집 #피자맛집 # 워커힐 호텔 입대앞둔 아들 데리고 억지로ㅋㅋ 지인분이 예약해놓으셔서 어쩔수없이. 요즘 피자가 싫으시단다. 오랜만에 아들이랑 둘이워커힐산책로 드라이브하다보니.... ,인어공주 에리얼의 블로그입니다,https://blog.naver.com/ariel6234,2021-08-03
아기와 여행_ 워커힐포레스트파크,https://blog.naver.com/chgene1020?Redirect=Log&logNo=222499864711,에어컨 있는 곳에서 캠핑 흉내만 내보자 아가야!ㅎㅎ 2021.6.16~17 처음가보는워커힐 ..이날은 정말 날씨가 너무나 좋은 날이였다. 아이도 부부도 모두 기분이 좋았다. 케익과 꽃에 관심을 갖더니...결국 케익 하나는... ,창창의 한정된 관심사,https://blog.naver.com/chgene1020,2021-09-09
그랜드워커힐서울 더뷔페 조식 ★ 훑어보기,https://blog.naver.com/kuakiaro?Redirect=Log&logNo=222488625516,"조식은 호텔의 중요한 이유 #그랜드 워커힐#더뷔페 #조식 글┃사진 @성공개척자 CopyrightⒸ 2021 성공개척자 Alright Reserved. 안녕하세요, 오늘 소개해드릴 곳은 그랜드워커힐더뷔페 조식 WALKERHILL THE BUFFET GOURMET... ",성공 연구 센터,https://blog.naver.com/kuakiaro,2021-09-01
 워커힐르파사쥬 와인샵 에노테카,https://blog.naver.com/yeojin0501?Redirect=Log&logNo=222459959459, 워커힐와인샵 에노티카워커힐 에 밥먹으러 가면 꼭 들리는 와인샵워커힐레스토랑에서는 여기서 산 와인은 콜키지 프리이기 때문에 술한잔 할 계획이라면 와인샵에서 술 사가는게 꿀~팁! 어어어엄청 큰... ,지니라이프,https://blog.naver.com/yeojin0501,2021-08-07
호텔특가 그랜드워커힐서울 호캉스 추천 할인 정보,https://blog.naver.com/yujung0535?Redirect=Log&logNo=222483511772,지난 비스타 호텔에 이어 같이 프로모션 진행을 시작한 그랜드워커힐서울에 대한 내용도 정리해... 그랜드워커힐서울이 저렴한 편인데요~ 이번에 진행하는 서울호텔특가 가격을 보니 그랜드워커힐호텔... ,★건특이's House★,https://blog.naver.com/yujung0535,2021-08-25
 워커힐피자힐 둘이서 배부른 커플세트,https://blog.naver.com/sue21?Redirect=Log&logNo=222464278101, 워커힐피자힐이죠. 정말 좋아하는 피자인데 비싸서 잘 못 가요. 오랜만에 와이프가 사준다길래 얼른... 나와서워커힐내 산책 조금 합니다. 그런데 더워서 오래 못해요. 짧게 한 바퀴 돌고 주차장으로 왔어요.... ,버디천재의 골프와 여행,https://blog.naver.com/sue21,2021-08-10
2021.09.03.금 - [고성] 르네블루 바이워커힐 ,https://blog.naver.com/anak1000?Redirect=Log&logNo=222493909495,날씨 예술이당.르네블루바이워커힐도착.로비에서 체크인.카드키가 있어야 엘리베이터가 눌러진다. ㅡㅡㅡㅡㅡㅡㅡㅡㅡㅡㅡㅡ 6층.그랜드 패밀리 스위트 룸.오옷. 넓당.가운데 거실. 오른쪽에 방. 침대2개.... ,"나의, 나를 위한, 나에 의한 놀이터",https://blog.naver.com/anak1000,2021-09-03
호텔디퓨저 추천 #워커힐 호텔 디퓨저 시트러스 가든으로... ,https://blog.naver.com/jeonghee46?Redirect=Log&logNo=222504137150," 워커힐디퓨저 시트러스 가든 Walkerhill Diffuser / Citrus Garden 용량 130ml / 가격 55,000원 최근까지 디퓨저... 중워커힐디퓨저를 사용해볼 좋은 기회가 생겼다워커힐 이란 단어 때문에 엇...?! 하신 분들도 계실듯... ",일상그리기,https://blog.naver.com/jeonghee46,2021-09-13
2021년 워커힐 여름휴가,https://blog.naver.com/hellokidcook?Redirect=Log&logNo=222459042841,2021년 여름휴가♡ # 워커힐 호캉스 # 워커힐 여름휴가 #여기는비스타호텔12층한강뷰 정말 최고네요. 도착하자마자 너무 배고파서 # 워커힐 중식당금룡 여기도 뷰가 좋네요. 그리고 진심 짜장.짱뽕도 넘 맛있어요.... ,헬로키즈쿡,https://blog.naver.com/hellokidcook,2021-08-06
 워커힐프로포즈 호텔 프로포즈이벤트는 홍선생풍선아트와 함께,https://blog.naver.com/balloond?Redirect=Log&logNo=222413545940,Propose Event Deco Walkerhill Hotel Propose워커힐프로포즈 호텔 프로포즈 이벤트는 홍선생 풍선아트와... Walkerhill Hotel Propose 이미지 출처 :워커힐공식 홈페이지 아름다운 한강 그리고 푸른 아차산으로... ,홍선생풍선아트,https://blog.naver.com/balloond,2021-06-29
[432] 워커힐파빌리온 빙수 뿌수기-럭샤리 빙수맨!!,https://blog.naver.com/hjh345?Redirect=Log&logNo=222467227085," 워커힐로비층 파빌리온 빙수 어릴적 집에서 얼음 갈아서, 팥, 연유에 젤리 넣어서 먹었던 빙수가... 신라호텔 망고 빙수대신에 아이스크림 먹어봤으니 스킵하고 이번엔워커힐빙수로 고고 로비에 카페(The... ",Mr.황 is Still hungry,https://blog.naver.com/hjh345,2021-08-12
17년의 숙원 그랜드워커힐감,https://blog.naver.com/see_yat?Redirect=Log&logNo=222509028352,그랜드워커힐디럭스 더블 리버뷰 투숙 후기워커힐포스팅은 2회에 나누어서 하겠다워커힐마저 포스팅하면 이제 남은 포스팅 거리가 없음... 어케 버티고 사냐 이제 ㅜ 본인의 회사는 회사복지로 호텔을... ,잠못이루는밤님의 블로그,https://blog.naver.com/see_yat,2021-09-17
고성 르네블루바이 워커힐온 가족이 만족한 이유,https://blog.naver.com/eunacho0323?Redirect=Log&logNo=222469905447,고성 르네블루바이 워커힐1박2일 강원도여행 #4. ■ 주소: 강원도 고성군 죽왕면 심층수길 96 ■ 연락처... 르네블루바이 워커힐 을 이용할 수 있는 기회가 있어 부랴부랴 포스팅을 작성하게 되었다 :-) 이 곳은... ,POSSOFARE,https://blog.naver.com/eunacho0323,2021-08-14
"그랜드워커힐호텔, 여름 휴가2 - 210802~04",https://blog.naver.com/ejaelee?Redirect=Log&logNo=222464120641,#WalkerHill #TheBuffet #더뷔페 #모에기일식당 #리버파크수영장 용산 드래곤 시티를 출발해 강변북로를 따라워커힐호텔로 향한다. 점심은워커힐뒤쪽 아차산 근처에서 식사. 그랜드워커힐호텔 우리에게는... ,"스스로自,그럴然... 자연과 함께...",https://blog.naver.com/ejaelee,2021-08-10
"세계한인의날, 세계한인회장대회 개막 서울 그랜드워커힐 에서",https://blog.naver.com/uykim33?Redirect=Log&logNo=222527745457,제15회 세계한인의 날 서울 세계한인회장대회 서울광진구워커힐 호텔에서 4일 제15회 세계한인의 날... 광진구워커힐호텔에서 열린 세계한인의 날 기념식에서 기념사를 하고 있는 모습. 2019.10.05.since1999... ,uykim33님의 블로그,https://blog.naver.com/uykim33,2021-10-05
 워커힐모에기 데판야끼 디너코스,https://blog.naver.com/yeojin0501?Redirect=Log&logNo=222462338589,데판야끼 디너워커힐모에기 철판요리인 데판야끼를 먹을까 스시 오마카세를 먹을까 고민하다가 그나마 스시 오마카세는 먹어봤지만 데판야끼는 안먹어봤으니까 요걸로 픽ㅋㅋㅋ 사실워커힐모에기의... ,지니라이프,https://blog.naver.com/yeojin0501,2021-08-09
 워커힐 꽃배송 와이프생일축하꽃다발 광진구꽃집... ,https://blog.naver.com/planet121?Redirect=Log&logNo=222518593038," 워커힐 꽃배송 와이프생일축하꽃다발 광진구꽃집 동화플라워디자인 가을하면 떠오르는 꽃은 코스모스... 이 꽃다발은워커힐 로 슈 --- 웅 ! 당일 급하게 주문해주셨는데, 마침 원하시던 꽃들이 매장에 있어서... ",Donghwa Flower & Design,https://blog.naver.com/planet121,2021-09-29
그랜드워커힐빙수 할인해서 먹기 + 클럽 샌드위치,https://blog.naver.com/nadiatour?Redirect=Log&logNo=222482821963,그랜드워커힐서울 더파빌리온에서 즐기는 휴가 안녕하세요. 이웃님들 나디아입니다. 지난주 남편과... 제천 리솜포레스트에서 이른 체크아웃을 하고 바로 집에 오는 게 아쉬워서 그랜드 워커힐서울... ,나디아 블로그,https://blog.naver.com/nadiatour,2021-08-24
 워커힐호텔 르파사쥬 베이커리,https://blog.naver.com/yeojin0501?Redirect=Log&logNo=222453717258,그랜드워커힐르 파사쥬 베이커리 선물받은 롤케이크와 파운드 케이크워커힐 의 르 파사쥬에서 판매하고 있다 롤케이크 한개와 파운드 케이크 두개 어떤 종류인지 구분할 수 있도록 이렇게 스티커를... ,지니라이프,https://blog.naver.com/yeojin0501,2021-08-02
비스타워커힐서울 스파... 호텔/서울 호캉스/비스타워커힐호텔),https://blog.naver.com/candy_yoo?Redirect=Log&logNo=222493075509,는 생각으로 열심히 서치해서 비스타워커힐호텔 스파 디럭스를 예약했어요 제 인생 첫 내돈내산...워커힐공식 사이트에서만 예약이 되길래 이상해서 계속 서치해도 나오질 않고... 공식 사이트에서도... ,WHO WANTS TO LIVE FOREVER,https://blog.naver.com/candy_yoo,2021-09-02
"주말 나들이 - 비스타 워커힐 , 남편생일",https://blog.naver.com/monkyd82?Redirect=Log&logNo=222362383171,남편의 생일을 기념하러 다녀온 비스타 워커힐 ! W호텔이었을 때 와보고는 이름바꾸고는 처음이다! 이제 아이들이 커지다보니 웬만한 호텔은 한 방에서 자기가 힘들고 ㅜㅜ 그나마 비스타워커힐 은 퀸침대 2개가... ,일상의 여백,https://blog.naver.com/monkyd82,2021-05-23
광나루역 맛집워커힐근처중식당 주하객잔,https://blog.naver.com/groove56?Redirect=Log&logNo=222479947389,오늘 점심은 광진구 광나루역 맛집워커힐근처 위치한 중식당 맛집 주하객잔으로 결정~ 주하객잔... 광나루역 맛집워커힐근처 고급스런 중식당 주하객잔 맛집으로 추천~~ 집이 가까워서 조만간 또... ,Again,https://blog.naver.com/groove56,2021-08-22
남편님의 생일 (Feat. 그랜드 워커힐더뷔페 런치),https://blog.naver.com/whdutksla2?Redirect=Log&logNo=222475013149,그랜드 워커힐더뷔페에 전화했어요.. 오예!!!!!!!!!! 한 자리 취소되었다네요 ㅎㅎ 굿굿 12시 예약하고 바로 고고 했어요. 더뷔페는 그랜드 워커힐2층에 있어요 주차는 삼성아멕스 플래티늄으로 ㅋㅋㅋㅋ 무료... ,-블로그쟁이가 된 조대리,https://blog.naver.com/whdutksla2,2021-08-18
"비스타 워커힐프린트베이커리 아트바캉스 패키지, 태교여행... ",https://blog.naver.com/hyunzinkim?Redirect=Log&logNo=222508792346,비스타 워커힐프린트베이커리 Art+Vacance 아트바캉스 패키지 태교여행 추천 임신 중기를 지나면서 점점... 그래서 선택한 #비스타 워커힐 패키지 ART+Vacance #아캉스 패키지 #태교여행 으로 딱이다. # 워커힐 태교여행... ,"취향소비자 V의 쉼표, 숨 쉬는 공간",https://blog.naver.com/hyunzinkim,2021-09-17
그랜드워커힐호캉스는 계속된다,https://blog.naver.com/see_yat?Redirect=Log&logNo=222510402006,ㄹㅇ워커힐침대 퀄 ㄷㄷ 호캉스 오기전에는 호텔가서 뭐해야지 뭐해야지 했다가 막상오니 만사가 다... 가을이 오는 구먼 ㅎㅎ 비스타워커힐여기도 좋아보이는데 나중에 와보고 싶네 그랜드워커힐아마... ,잠못이루는밤님의 블로그,https://blog.naver.com/see_yat,2021-09-19
나의 인생 깜짝 선물 (9) -워커힐호텔 숙박,https://blog.naver.com/kschung?Redirect=Log&logNo=222488631854,선경그룹(현 SK)의 선경건설(현SK건설)에 다닐 때워커힐호텔에는 가끔 갔었다. 호텔 뒤에 그룹의 연수원이 있어서 갔지만 연수원은 호텔급의 시설은 아니었다.워커힐호텔은 우리 나라 최고의 호텔이다. 그... ,길을 걸으면 내가 보인다 Finding myself on the way,https://blog.naver.com/kschung,2021-08-30
"아이와 여행 ,비스타워커힐서울 호텔 (아차산뷰)",https://blog.naver.com/oja50485?Redirect=Log&logNo=222336449123,"비스타워커힐 , 전날 비가 내렸던 터라 아쥬 맑아줬던 날씨 룰루랄라 콧노래 절로 나오는 날씨였다... 친절함 열매 드시는 것 같던워커힐직원분들 아차산뷰로 14층에 룸 배정을 받았다 . 낄낄낄 원래는 12층... ","여행 하기 좋은날 ,",https://blog.naver.com/oja50485,2021-05-03
 워커힐 방문후기,https://blog.naver.com/angle3848?Redirect=Log&logNo=222444709194,비스타 워커힐비스타 워커힐객실 깨끗하고 좋아요 미니바도 오늘은 비용없이 이용하래요ㅎㅎ 뭔가 혜택이 많아요 아침 조식은 더부페에서~ 이층에서 바라본 일층이 한가로와요 간단히 식사를 마치고 음식... ,우물안의 올챙이^^,https://blog.naver.com/angle3848,2021-07-25
"모음Ⅰ그랜드워커힐서울, 서울 신라호텔, 그랜드... ",https://blog.naver.com/pinktour2015?Redirect=Log&logNo=222541894687,1) 그랜드워커힐서울 서울 광진구워커힐 로 177 출처 - 그랜드워커힐서울 공식 홈페이지 가장 먼저 소개드릴 친환경 호텔은 그랜드워커힐서울인데요 ~! 국내 최초 친환경 컨셉의 비건 전용 객실을 도입한... ,국내 웰니스 여행지에서 힐링을 두 배로 :) 핑크투어,https://blog.naver.com/pinktour2015,2021-10-19
그랜드워커힐 호텔 명월관 드레스와 한복스냅.,https://blog.naver.com/dreamprayer2?Redirect=Log&logNo=222467312411,그랜드워커힐 호텔 명월관. 드레스와 한복스냅 촬영. 돌스냅전문작가 라엘포토 아빠의 엄지척. 딸을... 행사하는 장소에 따라서 촬영을 진행하는 순서나 분위기가 달라지는데워커힐 호텔의 돌스냅 촬영은... ,라엘포토 THE STORY BEGINS,https://blog.naver.com/dreamprayer2,2021-08-12
 워커힐중식당 금룡 다녀왔다.,https://blog.naver.com/sugar_xorud?Redirect=Log&logNo=222491664439," 워커힐금룡을 한 달 전에 한강 뷰로 예약했고 방문했더니 회장님이 쓰시는 룸이라고 알려주셨다.... 아무튼워커힐금룡은 처음 가봐서 구구절절 메뉴 평가하는 것처럼 썼는데, 여행도 못 가는 요즘 같은 시국에... ",일상의,https://blog.naver.com/sugar_xorud,2021-09-01
[광진구] 그랜드워커힐서울 더뷔페 주중 런치 | 가격대비... ,https://blog.naver.com/qus1024?Redirect=Log&logNo=222487343928,"여러분 안뇽 변쨩이에요 얼마 전에 그랜드워커힐서울에 방문하여 뷔페, 라운지 카페, 베이커리까지...워커힐전용물 정가 105,000원이고 5성급 호텔 뷔페라서 사실 기대를 꽤 하고 왔는데, 공간 자체는 같은... ",변쨩의 먹로그,https://blog.naver.com/qus1024,2021-08-29
"서울 호캉스 그랜드 워커힐호텔 룸서비스, 할로윈파티",https://blog.naver.com/dbrudditl?Redirect=Log&logNo=222482046268,서울 호캉스 추천 그랜드 워커힐서울 호텔 2020년 10월 24일 아침이 밝았다. 오늘은 신랑이 오는 날 멀리... 여기는 그랜드 워커힐서울호텔에 있는 피자힐 올라가는 길이다. 여기까지 올라오는데도 힘들었음 아이들... ,가예(嘉澧) 블로그,https://blog.naver.com/dbrudditl,2021-08-25
키즈카페 투어★워커힐 키즈클럽,https://blog.naver.com/ycy70?Redirect=Log&logNo=222479487102,"가까운워커힐키즈클럽에 가게 되었죠워커힐키즈클럽 - 아기가 가기 좋은 실내 놀이터 운영시간 AM11:00~ PM8:00 (매월 셋째 주 수요일 휴관) 이용권은 성인 1명어린이 1명 35,000원 어른 1명 추가 시 12,000원 어린이... ",엘리사벳 아들셋엄마의 힐링타임 ♥,https://blog.naver.com/ycy70,2021-08-22
호캉스 2탄 그랜드워커힐휴식같은 하루 - 조식 맛 좋네,https://blog.naver.com/gangsinjin?Redirect=Log&logNo=222473854439,그랜드워커힐호텔에서의 호캉스입니다. 스위스 그랜드 호텔에서 체크아웃 하고 나와서 올해에 본 영화중에 제일 재미있었던 모가디슈를 보고 그랜드워커힐 에 갔습니다.워커힐 은 집에서 멀지 않은 곳이라... ,ACE 화랑의 Time to Play,https://blog.naver.com/gangsinjin,2021-08-17
"한강뷰 보며 먹는 피자,워커힐호텔 피자힐 후기",https://blog.naver.com/chlee12222?Redirect=Log&logNo=222513345011,비스타워커힐서울 #피자힐 어렸을적에 몇번 가봤었는데 추억을 되살리며 다시 찾아왔다 진짜 얼마만인거지.. 거의 10년만인듯 그때 당시 초록색 피자 도우가 센세이셔널 했는데 그외에는 기억이 가물가물... ,좋은일들만기록하는그림일기,https://blog.naver.com/chlee12222,2021-09-22
행복한 추억워커힐명월관금룡 돌잔치_만들기 돌스냅으로,https://blog.naver.com/sunduk1502?Redirect=Log&logNo=222490626297,아무래도 글을 쓰면서 정보를워커힐 에서 드리고자 하는 것이 제 목적이기도 하고 편하게 전달해... # 워커힐# 워커힐 명월관 # 워커힐 명월관돌스냅 #금룡 # 워커힐 돌스냅 # 워커힐 금룡돌스냅 #1인돌스냅 #돌잔치스냅... ,서연 수연 성장 서군스냅작가 사진 스토리,https://blog.naver.com/sunduk1502,2021-08-31
그랜드워커힐서울 호텔 한강뷰 ★ 간만의 호캉스,https://blog.naver.com/kuakiaro?Redirect=Log&logNo=222459106393,"그저 쉴 수 있음의 고마움 #그랜드 워커힐 서울 #호캉스 #한강뷰 글┃사진 @성공개척자 오늘 소개해드릴 곳은 그랜드워커힐서울 입니다. ┃그랜드워커힐서울 체크인 오랜만의 호텔 방문은 설레네요, 호텔에... ",성공 연구 센터,https://blog.naver.com/kuakiaro,2021-08-12
 워커힐비스타 디럭스 스파룸-결기엔 아기와 함께 호캉스,https://blog.naver.com/hjh345?Redirect=Log&logNo=222465454933,정말 저희 부부와 인연이 많은워커힐호캉스 갑니다 고고고워커힐비스타 스파 디럭스 룸 아기가 있으니 더욱더 나가는게 쉽지가 않은데 보자보자 찾아보니 오!! 발견!! 스파 디럭스룸이란게 있네요 게다가... ,Mr.황 is Still hungry,https://blog.naver.com/hjh345,2021-08-11
"그랜드워커힐호텔 : 더 뷔페 디너 / 메뉴, 가격",https://blog.naver.com/rubyjuju0620?Redirect=Log&logNo=222405494067,"이번 이야기는 그랜드워커힐호텔 : 더 뷔페 / 메뉴, 가격입니다. 그랜드워커힐호텔의 더 뷔페는 가끔 찾게 되는 곳인데요~ 개인적으로 서울 시내 호텔 뷔페들 중에 다섯 손가락 안에 들어요~ 물론 최근... ",dr.장 이야기,https://blog.naver.com/rubyjuju0620,2021-08-16
비스타워커힐서울 피자힐 특별한날에 딱♡,https://blog.naver.com/moojigae302?Redirect=Log&logNo=222464438606,ㅋㅋ 덕분에(?) 남편이 생일기념으로워커힐1박까지 하사해주심 그랜드와 비스타 중 비스타로 선택!... 저도 참 하고싶네요..ㅎㅎㅎ 피지할에서 내려다보이는 비스타 워커힐 ! 날씨가 너무 좋았던 날... ,빛나는 1%,https://blog.naver.com/moojigae302,2021-08-10
비스타워커힐델비노 런치코스 1+1으로 이용하기,https://blog.naver.com/nadiatour?Redirect=Log&logNo=222451175040,작년에 다녀온워커힐맛집인데요. 이곳을 예약하려면 최소 3주 전에 예약해야 할 정도로 예약이 정말 힘든 비스타워커힐델비노에요. 아마 그 이유는 다른 호텔에 비해서 런치코스 가격이 비교적 합리적이어서... ,나디아 블로그,https://blog.naver.com/nadiatour,2021-07-30
 워커힐더뷔페 평일 점심 빵집 르파사쥬,https://blog.naver.com/match2009?Redirect=Log&logNo=222439776075,"ㅋㅋ ㅎㅎ 어디가 맛있을까 하더니워커힐뷔페에 바로 전화해서 예약을 잡으신다. 점심이 108천원이네?...워커힐더뷔페의 구성은 의외로 단촐?했다. 회, 양식, 한식, 디저트, 샐러드, 과일, 음료 코너. 한바퀴... ",그래그래의 끄적끄적,https://blog.naver.com/match2009,2021-07-21
그랜드워커힐서울 - 호텔 중식당 금룡의 '금상첨화' 코스메뉴,https://blog.naver.com/mike8283?Redirect=Log&logNo=222481031065,그랜드워커힐서울 호텔 중식당 금룡의 프라이빗룸에 먹은 '금상첨화' 코스메뉴 안녕하세요? 곰돌이의 Lifestyle 푸우우입니다. 2주전에 부모님과 함께 오랜만에 평일 점심에 방문한 그랜드 워커힐서울 호텔... ,곰돌이의 Lifestyle 블로그,https://blog.naver.com/mike8283,2021-08-25
[비스타워커힐 ] 피자힐,https://blog.naver.com/sienalis?Redirect=Log&logNo=222348976413,벚꽃이 만개하는 날 가려고 했던 피자힐인데 결국은 다 지고 어버이날 다녀왔네용 ㅋㅋ 비스타워커힐쪽인데 별관으로 따로 위치하고 있어서 쭈우우욱 올라가야 나와요 주차장도 별도로 있음 호텔 발렛은... ,tasting lab,https://blog.naver.com/sienalis,2021-05-13
 워커힐조식뷔페 미트볼 맛집이었어,https://blog.naver.com/prime0823?Redirect=Log&logNo=222447218737,아침 안먹는 오빠도 호텔 조식 이번에도워커힐조식뷔페에서 완전 만족했어요 이번 조식에 완전... 그랜드워커힐로비라운지 2층에 위치하구요 투숙 중이라면 룸키 가지고 오셔야되요 ■워커힐조식뷔페... ,지봉이의 골든타임,https://blog.naver.com/prime0823,2021-07-27
"(2021년 10월) 우리집에서 젤 가까운 좋은 호텔, 그랜드워커힐 ... ",https://blog.naver.com/scu0?Redirect=Log&logNo=222531184524,대체공휴일로 얻은 보너스 휴일 특집이라고 해야 될까?!ㅋㅋ 아무튼 간만의워커힐투숙이다~ 로비에서... 원두워커힐로고가 새겨진 머그컵도 괜찮았다 달달한 디저트 제과류가 오른쪽 냉장고에서... ,Minseo & Yunseo daddy's Fun World!,https://blog.naver.com/scu0,2021-10-08
