title,link,description,bloggername,bloggerlink,postdate
[춘천] 유포리 막국수 ,https://blog.naver.com/ilovebbs?Redirect=Log&logNo=222346347641,열무김치인데 아직 좀 덜 익었다. 편육인데 반은 덜어서 옆으로... 막국수.... 이집 막국수는 굳이 얘기 안해도 다 아는맛이라 # 유포리막국수#막국수 #편육 #맛집스타그램 #음식스타그램 #Foodstagram #춘천맛집,다양한 삶을 위하여~~~,https://blog.naver.com/ilovebbs,2021-05-17
[춘천 맛집] 현지인 추천유포리 막국수 ♥,https://blog.naver.com/say10042?Redirect=Log&logNo=222498064262,저녁 먹기 전에 간단하게 막국수 쌔리러 갔다. # 유포리막국수 가격 # 유포리막국수 메뉴 달인에도 나오신듯하다~~ 막국수의 달인ㅋ.ㅋ 이 집의 하이라이트는 이 동치미!!! 아주 아삭하고 나중에 물 막국수처럼 먹을... ,생긴 대로 살자,https://blog.naver.com/say10042,2021-09-07
180525 춘천 [ 유포리막국수 ] - 싸고 맛있고 양많은곳,https://blog.naver.com/doksoori01?Redirect=Log&logNo=221547215653,샘밭막국수도 유명하지만 이번엔유포리 막국수 로 향했습니다 다 비슷비슷한 군데에 몰려서 장사하고 있는데유포리 막국수 는 구석진 길로 한번더 들어갑니다 차 두대가 동시에 지나다니기 힘들 정도로... ,doksoori01님의 블로그,https://blog.naver.com/doksoori01,2019-05-26
춘천 막국수 맛집유포리막국수 ,https://blog.naver.com/oiktoail?Redirect=Log&logNo=221168513400,개인적으로 막국수는유포리막국수 가 제일 나은거 같습니다 꽤나 외진 곳에 있어 방문하려면 꼭 자가용을 이용하셔야 하고 여름에는 손님이 엄청 몰리니 이른시간에 방문하거나 예약을 해야겠죠 상호명... ,Variety place,https://blog.naver.com/oiktoail,2017-12-21
춘천유포리 막국수; 주말 일상,https://blog.naver.com/snotz?Redirect=Log&logNo=220095870388,춘천유포리 막국수; 주말 일상 연휴였던 지난 주말.그냥 막국수가 먹고싶어 춘천으로 고고~ 서울춘천고속도로가 있으니 금방 갈거야...봐 차도 없네~~^^ 즐거워 했던 순간은 정말로 순간이었다. 아.. 돌아버리는... ,미세스러블리,https://blog.naver.com/snotz,2014-08-18
춘천 맛집 /유포리 막국수 ,https://blog.naver.com/kidedekk?Redirect=Log&logNo=70179152876,"사실 그때 막국수 투어때 인제 서호막국수가 워낙 훌륭해서 유명한 백촌막국수, 여기유포리 막국수 가 좀 아쉬웠던건 사실이었다. 그래도 막국수로는 다른식당 싸다구좀 날릴만한 곳인건 확실한곳. 아직 배가... ",요리하는 키드득씨,https://blog.naver.com/kidedekk,2013-11-13
 유포리막국수 ,https://blog.naver.com/elen_80?Redirect=Log&logNo=221637599819,부침을 시킨다면 보통을 먹어도 될 것 같은 양이였다. 입구쪽에 있는 나무 그늘 자리. 커피자판기가 있어 믹스커피 한 잔 마시며 잠깐 쉬었다 집으로 출발~ 춘천에서 막국수가 생각나면 여기 # 유포리막국수추천!,Day by Day :),https://blog.naver.com/elen_80,2019-09-03
춘천막국수맛집유포리막국수 ②,https://blog.naver.com/kh750?Redirect=Log&logNo=220082345931,신북읍 유포리 62-2 강원도 춘천시 맥국2길 123(신) 영업시간-11:00~19:30 휴무일-연중무휴 주차-무료가능 ★간단 총평 ★ ' 유포리막국수 ' 는 강원도 춘천 3대 막국수집으로 유명한 막국수집입니다 춘천시내에서는... ,커피사랑 경화의 소소하고 맛깔난 이야기들,https://blog.naver.com/kh750,2014-08-06
춘천유포리막국수 ,https://blog.naver.com/leekh8412?Redirect=Log&logNo=221591428375,2019/07/17 @ 유포리막국수닭갈비와 함께 춘천을 대표하는 음식계의 양대 산맥중 하나인 막국수. 춘천까지 와서 막국수 한그릇 먹지않을 수 없기에 시간을 내어 막국수 전문점을 한 곳 가보기로 했다. 역시나 그... ,Eating & Traveling,https://blog.naver.com/leekh8412,2019-07-22
춘천 여행 ⑤ 춘천 3대 막국수 -유포리막국수 ,https://blog.naver.com/real_aniry?Redirect=Log&logNo=100168615297,[춘천 여행 ⑤ 춘천 3대 막국수 -유포리막국수 ] 1박2일 이라는 짧은 춘천 여행 기간에 세 번이나 막국수를 먹는다는 것이 쉽지는 않더군요. 막국수 말고도 먹고 싶은 녀석들이 많이 있었는데 기왕에 시작한 3대... ,잊지못할 아니리의 세상살이 [아니리닷컴],https://blog.naver.com/real_aniry,2012-10-04
춘천 /유포리막국수 ,https://blog.naver.com/begopa1092?Redirect=Log&logNo=80202275093,개인적으로 좋아하는 막국수집인 춘천의유포리 막국수날씨가 쌀쌀해져 그런지 손님이 평소보다 없었던.. 맛난 열무 이날 쌀쌀해서 그런지 면수가 유난히 더 좋았던.. 적당히 비계부분이 있는 편육 마음에 들게... ,eye of the beholder,https://blog.naver.com/begopa1092,2013-11-27
 유포리 막국수 /춘천,https://blog.naver.com/kmsprs?Redirect=Log&logNo=221567999736,"만성 코 막힘으로 맛을 잘 구별하진 못하지만 막국수 하면 머릿속에 떠오르는 곳이유포리 막국수어쩜 이런 곳에 있는 식당을 11시부터 찾아오는 손님들이, 그것도 많이 있다니 놀라울 뿐. 물론 나도 그 중의... ",파파 신데렐라의 다락방,https://blog.naver.com/kmsprs,2019-06-22
춘천 맛집 /유포리 막국수 ,https://blog.naver.com/about_lsj?Redirect=Log&logNo=221650755081,진짜 달랐던 것 같아요 :-) 다음에도 똑같은 숙소에서 묵고유포리 막국수들를거랍니당. 마지막은 막국수에 동치미 붓는 영상으로 마무리- - 식사 폴더는 주관적이므로 참고만 해주세요 -유포리 막국수가는 길,흰디블로그,https://blog.naver.com/about_lsj,2019-09-17
춘천 신북읍유포리막국수 ,https://blog.naver.com/cmykhc?Redirect=Log&logNo=20126252295,춘천에 위치한 막국수집유포리 막국수닭갈비와 함께 춘천을 대표하는 음식이라면 우선 막국수가 떠오르죠. 근처 샘밭막국수와 함께 가장 유명한 집이라면 바로 여기유포리 막국수가게 안으로 들어서니 꽤나... ,나의 식유기,https://blog.naver.com/cmykhc,2011-04-15
[춘천]유포리막국수- 맛집이라고 하려면 이정도는 되어야지,https://blog.naver.com/reegh?Redirect=Log&logNo=220300948564,"곳유포리막국수춘천시 신북읍 유포리, 033-242-5168, 샘밭막국수나 통나무집 닭갈비 근처 이웃의 포스팅에서 나와 있는 지도를 보면 한적한 동네라서 규모가 작은 것으로 생각했다. 실제로 한적한 동네는 맞지만... ",가비내의 진시황북어국,https://blog.naver.com/reegh,2015-03-15
춘천 막국수 3대장 중 하나!유포리막국수 ,https://blog.naver.com/dobang2001?Redirect=Log&logNo=221387575450,"ㅋㅋㅋ 춘천 안에서 막국수 3대장하면 맛으로 샘밭, 유포리, 감자골이 유명한데... 그 중 하나인유포리막국수다녀왔습니다... 평일인데도 차들이 많네요~ 요기는 춘천에서도 조금 외곽에 있어서 풍경이 좋아요..... ",철 안드는 낭만꽃돼지 그의 소소한 일상,https://blog.naver.com/dobang2001,2018-10-29
[춘천] 유포리막국수-강원도 3대 막국수집이라는..,https://blog.naver.com/keeyoung01?Redirect=Log&logNo=110093890391,"강원도맛집/춘천맛집/춘천막국수/춘천 유포리막국수 /강원도 유포리막국수 /유포리맛집 강원도 여행 마지막날. 경춘고속도로를 타기 직전에 들른 춘천. 춘천에 오면 막국수, 닭갈비는 먹어야 된다고 하니.. 맛집... ",구월한방병원,https://blog.naver.com/keeyoung01,2010-09-14
춘천 막국수 맛집 ::유포리 막국수:),https://blog.naver.com/hyoung7907?Redirect=Log&logNo=221622756219,"맛있는 막국수 맛집이 유포리 입니다. 우리가족은 4살 7살 포함 4인가족. 가볍게 먹으려고 막국수, 편육... ㅋㅋㅋㅋㅋㅋ 춘천 막국수 맛집유포리 막국수 의 차별된 점 바로 요 동치미 인것 같아요. 동치미를 따로... ",★쪼히메★ 하나요리단꼬,https://blog.naver.com/hyoung7907,2019-08-20
"[ 유포리막국수 ] 춘천 - 막국수, 감자부침",https://blog.naver.com/nomark05?Redirect=Log&logNo=163464592,"훨씬 내공이 있고, 덜 망가졌으며, 수준이 높은 음식이라는 느낌입니다. 개인적으로 모래재 막국수와 더불어 춘천에서 경험해볼만한 막국수집.유포리막국수: 033-242-5168 강원도 춘천시 신북읍 유포리 62-2",라보사의 식도락,https://blog.naver.com/nomark05,2012-08-08
춘천유포리막국수 . 잠시 딴 생각,https://blog.naver.com/yjkim228?Redirect=Log&logNo=220588558492,약속장소는 꼭 KFC앞에서 +친구들하고 대성리에서 더 재밌게 놀고 +김 풀풀 나는 후끈한 연애도 실컷 해보았으면 더 상큼 터지고 더 아삭했을까 춘천유포리막국수 의 동치미처럼 그때 먹었더라면 막국수맛도... ,"국수, 그 찰나를 쓰다",https://blog.naver.com/yjkim228,2016-01-05
 유포리막국수 (춘천)-강원도 막국수 순례3,https://blog.naver.com/ivisco?Redirect=Log&logNo=50033945025,이미 백촌막국수와 서호순모밀국수에서 극상의 막국수를 맛본 우리들의 입에 들어온 불운한유포리막국수 라고 해두죠.. ㅎㅎ 그래도 나름 장점을 갖추고 있는 막국수집이라 생각합니다.,미  식  예  찬,https://blog.naver.com/ivisco,2008-08-06
춘천유포리 막국수 ,https://blog.naver.com/97217807?Redirect=Log&logNo=60051156364,"일전에 샘밭 막국수가 조금 아쉬운듯한 느낌이 들어 샘밭보다 더 훌륭하다는유포리 막국수 를 찾았다. 알고보니 유포리는 지명이었는데, 원낙 후미진데라 찾기 더럽게 힘들었다. 2군단 표지말보고 좌회전하여... ",허브의 싱그러움,https://blog.naver.com/97217807,2008-05-13
춘천 /유포리막국수 ,https://blog.naver.com/begopa1092?Redirect=Log&logNo=80160541370,참 맛있다.. 서초동과 송파쪽에도 분점이 있는 샘밭막국수도 괜찮지만 달달한 맛보단 살짝 투박하면서도 시원한 동치미맛을 좋아한다면 이유포리막국수 도 괜찮지않나 싶다,eye of the beholder,https://blog.naver.com/begopa1092,2012-05-23
춘천 맛집 막국수로 유명한유포리막국수 ,https://blog.naver.com/nanacook?Redirect=Log&logNo=220392414476,"탄수화물을 엄청나게 섭취했지만.. 메밀국수, 막국수는 단게 아니라서 그런지.. 이런건 또 추가로 들어가네요.ㅎㅎ유포리막국수강원도 춘천시 신북읍 유포리 62-2 033-242-5168 오전 11시~오후 7시반 연중무휴",Nana's kitchen,https://blog.naver.com/nanacook,2015-08-21
춘천맛집｜춘천 3대 동치미 막국수 -유포리막국수 ,https://blog.naver.com/magiques?Redirect=Log&logNo=40096642430,춘천에서 3대 막국수집 중에 가장 평판이 좋은 동치미 막국수집인유포리막국수 예요 어떤 분의 잘못된... 백촌막국수도 첫손님 찍었는데 유포리도 첫 손님! 시작하기 조금 전에 들어가서 기다리겠다고 말씀... ,A z a l e a™ ♪,https://blog.naver.com/magiques,2009-12-18
 유포리막국수춘천 막국수,https://blog.naver.com/perk1234?Redirect=Log&logNo=220615264388,취향에 따라 여기가 최고의 막국수가 될 수도 있겠지만은 개인적으론 동해안 쪽 막국수가 더 좋다.유포리막국수강원도 춘천시 신북읍 유포리 62-2 033-242-5168 11:00~19:30 연중무휴,食生食死 by TS52,https://blog.naver.com/perk1234,2016-02-13
〔춘천맛집〕신북읍' 유포리막국수 ',https://blog.naver.com/kimrg?Redirect=Log&logNo=220038304443,"막국수하면 '춘천!'할 정도로 유명하고 춘천 중에서도유포리막국수 , 샘밭막국수, 남부막국수를... 밖에 차마시는 공간이 있다. 주소:강원도 춘천시 신북읍 맥국2길 123(지번; 춘천시 신북읍 유포리 62-2) ☎033-242-5168",검은돌의 하루하루,https://blog.naver.com/kimrg,2014-06-24
(춘천)유포리 막국수 ,https://blog.naver.com/paperchan?Redirect=Log&logNo=60058194738,^^ 춘천시에서 소양강댐 나가는 방면 2군단 사령부 인근 유포리에 위치한유포리 막국수 . 군단사령부 근처 천진리에 막국수 집이 하나 있으니 착각하기 쉽다. 인심 좋은 아주머니와 그에 걸맞게 양도 푸짐하고... ,Rainy의 블로그,https://blog.naver.com/paperchan,2008-11-28
춘천유포리막국수/ 감자전 녹두전,https://blog.naver.com/phjsunflower?Redirect=Log&logNo=221544757597,"닭갈비랑 막국수일것이다. 현지인이 아니라서 현지인 음식점이 어디가 있는지 잘 알 수 없지만, 대부분... ■ 춘천유포리막국수위치 : 유포리 낚시터근처 주소 : 강원 춘천시 신북읍 유포리 62-2 신주소 : 강원... ",꽃씨의 맛집 이야기♬,https://blog.naver.com/phjsunflower,2019-08-06
 유포리막국수(춘천),https://blog.naver.com/kjh4546?Redirect=Log&logNo=220093707390,어느새 막국수가 많이 좋아져서 이렇게 찾아 먹게 되는군요. 맛있게 먹었습니다 ~ 춘천 가실 때 들려 보시길!유포리막국수033-242-5168 강원 춘천시 신북읍 유포리 62-2,遊生記,https://blog.naver.com/kjh4546,2014-08-16
[ 유포리막국수 ] 춘천 - 진짜 막국수란..,https://blog.naver.com/mardukas?Redirect=Log&logNo=100044720329,"유포리 강원도춘천시신북읍 기간 2007.12.1 ~ 2007.12.1 (1일) 컨셉 맛 찾아 미식여행 업무차 춘천에... 남부막국수, 샘밭막국수, 부안막국수, 실비막국수,유포리막국수정도가 그 중에서 제일 유명하고 맛도... ","먹자, 마시자, 놀러 다니자",https://blog.naver.com/mardukas,2007-12-02
[춘천맛집]유포리 막국수 ,https://blog.naver.com/apapq?Redirect=Log&logNo=80069941622,"백촌막국수, 남부막국수,유포리 막국수 라고 합니다. 널찌막한 주차장이 맘에 듭니다. 건물도 그리... 막국수 집까지 들어가는 길이 참 좋습니다. 주소 : 강원도 춘천시 신북읍 유포리 62-2 전화: 033-242-5168",살아가는 여유,https://blog.naver.com/apapq,2009-06-12
"춘천 맛집, 맛도 가격도 준수한유포리막국수 ",https://blog.naver.com/tabula9548?Redirect=Log&logNo=220230224935,강원도 춘천유포리막국수춘천의 3대 막국수집 주차장 아주 넓다. 막국수 6000원 요즘 강원도... ㅜㅜ 동치미가 맛있었으면 완벽한 강추인데... 강원도 춘천시 신북읍 유포리 62-2 033-242-5168,식당밥일기,https://blog.naver.com/tabula9548,2015-01-21
[ 유포리막국수 ] 춘천 맛집 - 춘천막국수의 대표주자,https://blog.naver.com/mardukas?Redirect=Log&logNo=100091256553,"춘천을 대표하는 막국수집인유포리막국수 .. 소양댐가는 길목, 2군단 사령부 옆 농로를 따라 들어가면 나오는유포리막국수 는 강원도 3대막국수로 꼽는 사람도 있을 정도로 널리 알려진, 그리고 수준높은... ","먹자, 마시자, 놀러 다니자",https://blog.naver.com/mardukas,2009-10-17
[춘천] 유포리막국수 ,https://blog.naver.com/ilovebbs?Redirect=Log&logNo=110182546442,처가집 단골 2탄 -유포리막국수유포리 막국수 는 춘천 신북면 유포리인데 주변은 논밭이다. 처음에는 동네에서 막국수 잘한다고 해서 알려져서 지금은 전국 레벨까지 알려졌다. 처가집에서 약 500m정도 떨어져... ,다양한 삶을 위하여~~~,https://blog.naver.com/ilovebbs,2014-01-02
춘천맛집 시원한 동치미막국수 [ 유포리막국수 ],https://blog.naver.com/park117897?Redirect=Log&logNo=220979334730,춘천맛집 시원한 동치미막국수의 강자 [ 유포리막국수 ]유포리막국수 는 막국수맛집에서 빠질 수없는 강자 퉁이가 이곳을 접한것도 20년이 넘었다 춘천 구석진 곳에 위치한 이집은 매니아층을 형성하고 있다 특히... ,퉁이의 강남에서 살아가기,https://blog.naver.com/park117897,2017-04-10
【춘천맛집】l전통에 빛나는유포리 막국수 는 최고의 맛이였다.,https://blog.naver.com/nicejt21?Redirect=Log&logNo=221628072590,먹었던 막국수와는 비교가 되지 않았습니다. 결혼 히스토리꺼지 공개 하시면서유포리 막국수 를 소개... 양양 법수치 계곡으로 향합니다.핟송 형님이 포스팅하신 유포리 믹국수 맛집 기행을 링크 합니다.,날마다 좋은 날!,https://blog.naver.com/nicejt21,2019-08-25
춘천맛집 x 춘천막국수 ' 유포리막국수 ',https://blog.naver.com/oiktoail?Redirect=Log&logNo=221526036740,근처에 있는 집들도 있는데 거기도 괜찮으니 자리가 없다면 차선책으로도 좋습니다. GOOD RESTAURANT!! 춘천시 모범음식점 춘천막국수 x 춘천맛집유포리막국수033-242-5168 강원도 춘천시 신북읍 유포리 62-2,Variety place,https://blog.naver.com/oiktoail,2019-05-04
춘천 맛집 :: 참 수더분했던 막국수.유포리막국수 ,https://blog.naver.com/hiuio01?Redirect=Log&logNo=221437706778,# 메뉴와 가격 # 동치미 # 열무김치 # 막국수 # 메밀전병 Log유포리막국수 . 춘천에서 가장 가보고 싶었던 곳이유포리 막국수 다. 과거 명성만 못하다는 이야기도 있지만. 이야기로 듣는 것과 직접 가는 것은... ,사소한 한 끼에. 의미 부여 중.,https://blog.naver.com/hiuio01,2019-01-11
춘천 동치미막국수가 맛있는유포리막국수 ,https://blog.naver.com/hnkim72?Redirect=Log&logNo=221292725149, 유포리막국수최근에 삼교리막국수에서 동치미막국수를 맛있게 먹고 샘밭유포리막국수 도 동치미 막국수라고 해서 조만간 다녀와야지 했었는데 어제 삼실에서 점심으로유포리막국수 를 다녀왔어요... ,헤이맨의 맛있는 여행,https://blog.naver.com/hnkim72,2018-06-06
[춘천] 3대 막국수 맛집유포리 막국수 ,https://blog.naver.com/muhanmanner?Redirect=Log&logNo=150187617323,"비쥬얼부터 심상치 않은유포리 막국수막국수를 스스로 조리해 먹을 수가 있는데요. 비빔막국수, 물 막국수 선택 가능 시원한 동치미국물을 넣은 물 막국수를 선택 물 막국수에, 식초, 겨자, 설탕 등을 기호에... ",THE 행복한 미래,https://blog.naver.com/muhanmanner,2014-03-26
[춘천 맛집]유포리막국수: 강원도 춘천 3대 막국수 식당 - 편육... ,https://blog.naver.com/yjoshjh?Redirect=Log&logNo=220059657432,"강원도 춘천 신북읍 유포리낚시터 부근의 막국수 전문 식당유포리막국수http://yjoshjh.blog.me/110169628601 누가 정했는지는 모르지만, 춘천 3대 막국수 중 한곳이라고 불리우는 곳입니다 속초, 고성 지방뿐... ",참이술의 Eat & Drink,https://blog.naver.com/yjoshjh,2014-07-14
"[춘천/ 유포리막국수 ]춘천분들이 사랑하는 막국수, 살해당할만한... ",https://blog.naver.com/flytocom?Redirect=Log&logNo=30092110504, 유포리 막국수툭툭 끊기는 그 황홀한 면발이 떠나질 않네요. 기왕 이렇게 된거 우리는 유포리로 간다....^^ 물론 외진곳까지 가셨으니 막국수에 버금가는 맛과 양인 편육도 녹두지짐도 반드시 드시고 오세요... ,이웃집 그녀석같은 김군,https://blog.naver.com/flytocom,2010-08-17
[춘천/막국수] 신북읍 유포리 ' 유포리 막국수 ',https://blog.naver.com/cckcr?Redirect=Log&logNo=220521141381,"이름난 맛집인 신북읍 유포리의 ‘ 유포리막국수 ’였다. 구수한 향의 막국수, 별미 동치미유포리막국수 는 보통 번호표를 받아야 할 정도로 무척 붐비는 맛집으로 유명하다. 복잡한 것이 싫다면 주말 오후... ",춘천교차로 Blog,https://blog.naver.com/cckcr,2015-10-27
 유포리막국수 _[춘천맛집/춘천막국수집],https://blog.naver.com/freetist?Redirect=Log&logNo=150148136209,"춘천 3대 막국수집 중 최고라는 곳.... 유포리막국수입니다. 춘천시 신북읍 유포리 마을 안에 있습니다. 샘밭막국수 등 음식점들이 모여있는 곳에서 좀 떨어져있는 곳입니다. 여기 외관이구요, 실내모습은... ",flying to you,https://blog.naver.com/freetist,2012-09-25
