title,link,description,bloggername,bloggerlink,postdate
"[춘천] 세계주류마켓,유포리막국수 , 코리달리스",https://blog.naver.com/naiggo?Redirect=Log&logNo=222353628878,"막국수, 편육, 두부, 감자부침.유포리막국수 . 66년부터.... 대단하다 증말. 밑반찬. 열무김치와 동치미. 이땐 몰랐단 이 동치미의 맛을. ㅋㅋㅋ 편육인데 수육처럼 나오던데..? ㅎㅎ 막국수 내 막국수 사진 좀... ",Made by MySelf,https://blog.naver.com/naiggo,2021-05-16
춘천유포리 막국수55년 전통이 헛되지 않은 맛 / 따뜻한... ,https://blog.naver.com/dove2255?Redirect=Log&logNo=222532306966,"막국수 전문점을 결정하기까지 많은 검색을 해보았는데, 많은 분들께서 ㅊㅅ막국수와유포리막국수두 곳을 많이 찾으시더라고요. 제가 봤을 때 ㅊㅅ이 괜찮아보였는데 동생이 몇년 전 출장 중에... ",Hold me tight,https://blog.naver.com/dove2255,2021-10-10
춘천 [유포리 막국수 ]/두번째 방문- 막국수와 감자전,https://blog.naver.com/borami97?Redirect=Log&logNo=222390376163,막국수 핑계로 드라이브도 하고 겸사겸사 가야할 듯 싶다.유포리 막국수033-242-5168 강원도 춘천시 신북읍 맥국2길 123 ( 유포리 62-2 ) 영업시간 매일 11:00~19:30 명절 2일 휴무 11시가 되기 20분전쯤 도착했다.... ,앵두공주의 소소한 일상,https://blog.naver.com/borami97,2021-06-08
강원도 춘천 맛집 인정한유포리 막국수 ,https://blog.naver.com/zoonho?Redirect=Log&logNo=222423594840,이름이유포리막국수 라는 곳이에요 검색을 해보면 아시겠지만 여긴 춘천에서 아주 오래된 곳이에요.... 막국수 면부터 시작 해서 모든 음식들을 다 만드신다고 하니 선정될만 하겠구나 싶었어요. 주문을 하고... ,하루 나눔,https://blog.naver.com/zoonho,2021-07-07
춘천 막국수 맛있네..( 유포리막국수 ),https://blog.naver.com/lovely_fat?Redirect=Log&logNo=221719363859,"춘천 막국수는 여러번 먹어봤으나 왜유포리막국수 가 특별했는지 사연은 모르고 있었어요, 계산할 때 문득 보였던 '생활의 달인' 인증! 어쩐지~ 생달에 선정돼서 방송에 출연했었네요? 다른 쿡방은 진실성을 믿지... ",나홀로 즐기는 삶,https://blog.naver.com/lovely_fat,2019-11-26
나의 단골집 - 5춘천유포리막국수 ,https://blog.naver.com/hansongp?Redirect=Log&logNo=221949481700,"강원도 춘천시 신북읍 유포리, 소양강댐을 가는 도중 북쪽으로 보이는 아담한 마을에 6.25 직후인 1953년에 생긴, 역사가 대단히 오래된 ' 유포리 막국수 ' 가 있습니다. 이 식당은 춘천의 3대 막국수집의 하나로... ",한송의 세상보기,https://blog.naver.com/hansongp,2020-05-08
[춘천 막국수 맛집]유포리 막국수 ! 엄청난 동치미,https://blog.naver.com/dbfans?Redirect=Log&logNo=222395813826,인제 남북면옥 인제 전씨네 막국수 그리고 여기유포리 막국수(1등은 인제 남북면옥이에요!ㅋㅋ) (전씨네는.. 약간 기복이...) 동생들이랑 진짜 쓸데 없는 얘기 많이 하는데 ㅋㅋㅋ 죽기 전 마지막 음식으로 뭘... ,"공부가 취미입니다만,",https://blog.naver.com/dbfans,2021-06-13
춘천 맛집 ' 유포리막국수 ',https://blog.naver.com/kaisr2?Redirect=Log&logNo=221677618497,"지난주 가을여행으로 춘천을 방문했을 때 점심식사를 했던 곳으로, 돼지고기와 막국수의 자연스러운...유포리막국수 에서 걸어서 이동할 수 있는 거리에 유포리낚시터(유료)가 있었고 조용한 시골의 연못 같아서... ",나의 일기장,https://blog.naver.com/kaisr2,2019-10-14
"춘천맛집,유포리막국수맛있다.",https://blog.naver.com/1004puhahaha?Redirect=Log&logNo=222437558097, 유포리 막국수 ~ 춘천 막국수촌에서 제일 유명한 곳일까? 방송도 많이 탔고 손님도 많았다. 어르신들도 많고 남녀노소 할 것 없이 손님층도 다채롭다. 이 집의 매력은 막국수 한그릇으로 비빔도 물도 다 먹을 수... ,날.아.오.르.다,https://blog.naver.com/1004puhahaha,2021-07-19
강원도 캠핑 뒷풀이 춘천 막국수맛집유포리막국수with... ,https://blog.naver.com/reireyofficial?Redirect=Log&logNo=221678720043,"포스팅은 ▼▼▼유포리 막국수033-242-5168 강원도 춘천시 유포리 62-2 매일 11:00-19:30 이 전부터 여기 막국수가 맛나다는 얘기는 종종 들었는데 딱히 들릴 기회가 없었어요 강원도는 주로 춘천시내, 양양, 속초... ",REIREY,https://blog.naver.com/reireyofficial,2019-10-15
[춘천/유포리]유포리막국수- 막세권에 집 살 뻔,https://blog.naver.com/realblue88?Redirect=Log&logNo=222324485488,식당 # 유포리막국수춘천 시민들에게도 '막국수 맛집'하면 손에 꼽히는 집이다. 정말 아무 곳도 아닌... 유포리도 막국수 맛의 열린결말을 추구하는 듯 양념장부터 간장 식초 설탕 겨자 다 올려둠 감자전 이집은... ,개복치의 일상생활,https://blog.naver.com/realblue88,2021-04-27
 유포리막국수@ 춘천 생활의달인,https://blog.naver.com/ross012?Redirect=Log&logNo=222486559116,가격대비 만족도 최상 요즘 어디가서 7500원짜리 막국수를 먹게쒀요!!! 춘천 갈때 감자빵 사고유포리막국수는 국룰 ㅋ 우리아들 보고 가세효 세상미남 비어디드콜리 포비 생활의달인 보면서 메모하는거... 저만... ,"""Welcome to Sunnyside""",https://blog.naver.com/ross012,2021-08-30
춘천유포리 막국수 _ 찐 주민맛집(내돈내산) 감자전 꼭 드세요!!!!,https://blog.naver.com/gale9026?Redirect=Log&logNo=222532674301,#춘천맛집추천 #춘천막국수추천 # 유포리막국수#춘천 유포리막국수춘천에서 학교를 다녔던 나 사회생활 하면서 춘천은 거의 잊고살았다 최근 부모님과 구봉산에서 식사를 하게 된 계기로 남표니와 함께... ,소소하지만 특별하게:),https://blog.naver.com/gale9026,2021-10-10
2021/춘천시 신북읍/ 유포리막국수 ,https://blog.naver.com/even0112?Redirect=Log&logNo=222356083732,가니 막국수를 먹어야겠더라고. 대단히 대단히 오랜만에 ' 유포리 막국수 '. 계산대에는 아들로 보이는... 태어나 보니 아빠가 유포리 막국숫집 사장이야. 얼마나 든든해 ㅋㅋㅋ 물론 속 모르는 소리일지도... ,맛있어서 행복해,https://blog.naver.com/even0112,2021-05-18
춘천가는 전철 -유포리막국수 ,https://blog.naver.com/navigun?Redirect=Log&logNo=222271297774,아침이라서일까 시골이라서일까 공기도 남달랐다. 많은곳들이 자고나면 변하는데 여긴 십여년이 지나도 그대로였다. 2019년 춘천.. #춘천 #춘천여행 # 유포리막국수#감자전 #막국수맛집 #춘천맛집,빨강우체통,https://blog.naver.com/navigun,2021-03-10
전통있던 춘천 막국수유포리막국수 ,https://blog.naver.com/zoonho?Redirect=Log&logNo=222504723522,다녀온 곳의 이름은유포리막국수라는 곳인데요. 이 곳은 춘천에서 제일 오래된 막국수 전통을 가진 집이라고 해요. 주차장에 주차되어 있는 차만 보아도 이미 많은 분들이 방문한 것을 알 수 있었어요.... ,하루 나눔,https://blog.naver.com/zoonho,2021-09-13
춘천 [유포리 막국수] / 담백한 막국수와쫄깃한 메밀전병,https://blog.naver.com/borami97?Redirect=Log&logNo=222333838058,춘천에는 막국수로 유명한 식당들이 많다. 그 중에서도 소양강댐 가는 길에 있는 샘밭마을의...유포리 막국수033-242-5168 강원 춘천시 신북읍 맥국2길 123 ( 유포리 62-2 ) 영업시간 매일 11:00 - 19:30 명절 2일 휴무... ,앵두공주의 소소한 일상,https://blog.naver.com/borami97,2021-05-02
 유포리막국수- 춘천 맛집,https://blog.naver.com/lovely_fat?Redirect=Log&logNo=222039491837,"춘천여행을 할 때 간혹 찾아가는 막국수집이 있는데요, 최근에도 그 맛을 떠올리며 또 식사를 하고... ㅎ 내 기억에유포리막국수식당처럼 국물이 깔끔한 곳은 국내에서 본 적이 없었고, 유사한 음식점으로... ",나홀로 즐기는 삶,https://blog.naver.com/lovely_fat,2020-07-23
춘천시 맛집 생활의 달인유포리 막국수 ,https://blog.naver.com/mjpiglet?Redirect=Log&logNo=222332580332,오늘은 춘천시 맛집 생활의 달인 막국수유포리 막국수 를 소개해드릴까해요 따듯한 봄이 되어 낮 최고기온이 20도가 넘다보니 자꾸만 시원한 막국수 한그릇이 생각나곤하는데 춘천에서유포리 막국수 를 모르면... ,자연美인 민팅이,https://blog.naver.com/mjpiglet,2021-05-02
춘천유포리막국수맛이 좀 변했지만 그래도 역시!,https://blog.naver.com/dobang2001?Redirect=Log&logNo=222316599220,오랜만에 춘천유포리막국수 로 나들이 다녀왔어요~ 아무래도 시내에서 많이 떨어진 교외라... 어느정도... ^^ 춘천유포리막국수앞 자판기 율무차 너무 맛나~ 주문과 동시에 밑반찬 등장! 동치미 국물과... ,철 안드는 낭만꽃돼지 그의 소소한 일상,https://blog.naver.com/dobang2001,2021-04-20
[춘천맛집] 언제나 먹고싶은유포리막국수 ,https://blog.naver.com/wltn2157?Redirect=Log&logNo=222510981114,대기표를 받고 밖에 대기하는곳에서 기다리고있으면 대기표 순서대로 자리를 안내해줍니다 보통 대부분 좌식자리로 이루어져있어요 생활의달인에도 나온 막국수 맛집이라해요 [ 유포리막국수메뉴판]... ,치즈다이어리,https://blog.naver.com/wltn2157,2021-09-22
춘천막국수 맛집유포리막국수 !,https://blog.naver.com/tongil96?Redirect=Log&logNo=222528687044, 유포리막국수전경. 시골 마을에 있는데 근처 메밀밭이 있다는데 확인하지 못했다. 이 곳 역시 춘천시 외곽이었다. 유포리란 동네에 있는 막국수 집인데 춘천막국수체험박물관 가이드 할아버지께서는 양 많이... ,가장 험한 곳에 가장 빛나는,https://blog.naver.com/tongil96,2021-10-08
춘천 막국수유포리막국수생활의달인 막국수의 달인,https://blog.naver.com/sonagi010?Redirect=Log&logNo=222246751102,오랜만에 막국수 생각에 다녀온유포리막국수손님은 여전히 많이 있더군요..코로나가 맞나 싶을정도로... 물론 유포리가 그렇다는건 아닙니다. 제가 다니던 곳중에 몇곳이 간혹 그렇게 나오긴 하더라고요. 물론... ,이노의 춘천이야기~,https://blog.naver.com/sonagi010,2021-02-17
"춘천 막국수 맛집 _유포리 막국수 , 찐 막국수맛! 배합 잘하셔야... ",https://blog.naver.com/26016535?Redirect=Log&logNo=222392143051,모르겠으면 한바퀴만 훅~ 돌릴것 ㅋㅋㅋ 설탕 살짝 뿌려먹으면 감칠맛 업업!!!!!! 저 빼고 모두 맛있게 드셨거든여 ^^ #춘천막국수 #막국수맛집 #춘천막국수맛집 # 유포리막국수#춘천 유포리막국수 ,I M R O M I 개인 일상,https://blog.naver.com/26016535,2021-06-10
[춘천] 춘천식 막국수 맛집 ::유포리 막국수 ,https://blog.naver.com/kimssso5518?Redirect=Log&logNo=222460656374,0 - 맛 : 4.0 - 가격(가성비) : 4.0 - 편의성 : 4.3 - 서비스 : 4.2 - 재방문 의사 없음 #춘천맛집 #춘천 유포리막국수#춘천막국수맛집 #춘천당일치키코스 #춘천당일치기여행 #춘천막국수 # 유포리막국수 주차,대한민국 맛집시 떡볶구,https://blog.naver.com/kimssso5518,2021-08-07
"춘천 막국수 맛집, 남편의 인생 막국수.유포리막국수 ",https://blog.naver.com/dancenlife?Redirect=Log&logNo=222101212327,"남편이 춘천 막국수 맛집, 그리고 강원도 고성 막국수 맛집, 또 서울 막국수 맛집들을 많이 다녔지만, 인생 막국수로 표현할 수 있는 곳은유포리막국수 라며 막국수 먹으러 춘천가자는 말을 많이 했어요.... ",루나네 집,https://blog.naver.com/dancenlife,2020-09-28
춘천 막국수 양대산맥 중 한 곳 ~유포리막국수 ,https://blog.naver.com/ccmlove2?Redirect=Log&logNo=221811048209,"있습니다 유포리의 시그니쳐 동치미입니다유포리막국수 는 동치미국물 베이스 막국수입니다~ 국물이 자극적이지 않고 담백한 것이 특징입니다 맛있게 잘 익은 열무 대신 오늘은 배추김치, 깍두기가... ",척척일기,https://blog.naver.com/ccmlove2,2020-02-16
[강원도-춘천]유포리막국수- 진짜 대박,https://blog.naver.com/yonggon1?Redirect=Log&logNo=222314728519, 유포리막국수막국수 맛집 탑10안에 들어감 석진아빠입니다. 요번에는 막국수편을 올려 보려고 합니다. 다들 아시는 춘천 유명한집.. 뒤늦께 알려드리네요.. 사실작년겨울에 다녀왔는데. 어마어마한곳입니다.... ,석진아빠,https://blog.naver.com/yonggon1,2021-04-18
[춘천]유포리막국수 (시원한 동치미가 일품인 춘천막국수),https://blog.naver.com/jun_0624?Redirect=Log&logNo=222466959742,동치미가 크으~~~ 정말 상큼하고 깔끔합니다 춘천에 돌러 가신다면 한번 방문해보신다고 해도 좋을것 같아요 내돈 # 유포리막국수#춘천 #춘천역 # 유포리# 막국수#메밀 #메밀면 #동치미 #동치미막국수 #춘천막국수,한 번 사는 세상 즐겁게 재밌게!,https://blog.naver.com/jun_0624,2021-08-12
춘천유포리 막국수비빔 물막국수 메밀전병 ~,https://blog.naver.com/be2141st?Redirect=Log&logNo=222357759779,춘천유포리 막국수비빔 물막국수 메밀전병 ~ 한 그릇 양이 곱빼기 양으로 나오더라고요. 식성에 따라 다르긴 하겠지만 여자 혼자서 한 그릇 다 먹기엔 양이 많더라고요. 메밀전병도 한 접시 주문했답니다.... ,초록스토리,https://blog.naver.com/be2141st,2021-05-20
 유포리막국수“별 10개는 없나요?”,https://blog.naver.com/sindohblog_?Redirect=Log&logNo=222441349359,"새우젓에 적당히 겨자를 넣고 마늘, 열무김치와 함께 아니면 막국수를 돌돌 말아 먹으면 춘천유포리막국수맛의 진정한 완성체를 경험할 수 있다. “올해는 망할 코로나19 때문에 취소된 것이나 다름없는 닭.... ",옐로우펜슬,https://blog.naver.com/sindohblog_,2021-07-24
춘천 여행 ::유포리막국수! 감자전 맛집이네,https://blog.naver.com/lya3933?Redirect=Log&logNo=222381906129,우리는 막국수 곱빼기에 감자부침 주문- 춘천유포리 막국수감자부침 맛집 수요미식회 맛집 막국수... 그게 맘처럼 되는게 아니거든.. # 유포리막국수#춘천여행코스 #유포리맛집 #춘천맛집 #신북읍맛집,y-diary,https://blog.naver.com/lya3933,2021-06-03
[강원도] 춘천막국수 찐맛집유포리 막국수#내돈내산,https://blog.naver.com/skyhosu39?Redirect=Log&logNo=222494289507,이렇게 계속 생각나는 막국수는 살면서 처음이다.유포리 막국수춘천시 신북읍 맥국2길 123 매일 11:00~19:30 명절2일 휴무 가게앞 너른 주차장 가려던 막국수집이 월욜휴무라 급 검색해서 찾아갔는데 완전... ,리니맘 아이린 La Vie En Rose,https://blog.naver.com/skyhosu39,2021-09-04
[춘천]막국수의 고장 춘천에서도 손꼽히는 곳유포리 막국수 ,https://blog.naver.com/bonghong8765?Redirect=Log&logNo=221882699163,"보통 막국수가 유명한 곳이 춘천, 봉평, 속초 이 정도로 알고 있는데 춘천의유포리 막국수 는 막국수 매니아들이나 막국수를 좋아하시는 분들이라면 반드시 들려야 하는 곳이라고 생각합니다. 춘천에 가서... ",봉봉스토리,https://blog.naver.com/bonghong8765,2020-04-02
~춘천 막국수~ 춘천 생활의 달인의 나온유포리막국수 ,https://blog.naver.com/civileng_?Redirect=Log&logNo=222031943299,"춘천막국수유포리 막국수메뉴는 간단한데.. 막국수 맛집 답게.. 대표 메뉴 막국수와, 편육, 녹두부침, 촌두부 이렇게 깔끔한 메뉴구성이다. 대표메뉴인 막국수 2인분으로 주문을 해본다.유포리 막국수 는 춘천... ",무미건조한 일상..,https://blog.naver.com/civileng_,2020-07-15
오봉산맛집유포리막국수 ♡♡,https://blog.naver.com/ysc6812?Redirect=Log&logNo=222418169209,두산모두 2시간 정도의 가벼운 산행으로 얼른 마치고 오봉산맛집 검색후 찿아간유포리막국수 . 넓은주차장에 홀과 룸이 많고 생활의달인에 방송돼었다 하네요 ㅎ 일반 막국수와는 조금다른 심심한맛의... ,청호나이스 정수기,https://blog.naver.com/ysc6812,2021-07-02
[춘천/신북읍]유포리막국수- 돼지 편육곱빼기보다 나은 양... ,https://blog.naver.com/kmd_kim?Redirect=Log&logNo=222491814608,"of #춘천막국수 성지 비가 많이 내릴까봐 걱정했는데, 다행히 해가 났다. 반 정도밖에 안 들어찬 주차장 오늘은 방 대신 평상(?) 위에 철푸덕 그리고 # 유포리막국수메뉴 8,500원짜리 곱빼기 말고 주문서에... ",KELLOGG,https://blog.naver.com/kmd_kim,2021-09-02
"맛집, 막국수 맛집으로 유명한유포리막국수후기. 음식 주문... ",https://blog.naver.com/vknight?Redirect=Log&logNo=222534016769,"com 주소 및 위치 주소는 춘천시 신북읍맥국2길 123번지에 위치하고 있으며, 유포리 마을에 자리 잡고... 맛집유포리막국수막국수 맛집답게 그 맛이 상당히 훌륭하였습니다. 특히 곁들임으로 주문한... ","레타의 여행, 맛집 라이프",https://blog.naver.com/vknight,2021-10-11
춘천 막국수 맛집 추천유포리막국수춘천 현지인 맛집인정,https://blog.naver.com/dhfpswl0773?Redirect=Log&logNo=222535444904,춘천유포리막국수춘천 막국수 맛집을 찾아보다가 알게 된 막국수 맛집유포리막국수 이다. 춘천 현지인들이 추천하는 맛집인게 정말 시골같은 곳에 저기만 차가 잔뜩이다. 이 시골에 외부차량이 들어온다는건... ,일상에서 답을 찾다:),https://blog.naver.com/dhfpswl0773,2021-10-13
춘천막국수맛집강력추천!유포리막국수 ,https://blog.naver.com/knospe830?Redirect=Log&logNo=222425461204,이런 곳에 뭐가 있을까 하며 시골길을 지나 찾아간 유포리에 있는 # 유포리막국수블루리본도 꾸준히... # 유포리막국수#춘천막국수맛집 #춘천3대막국수 #막국수맛집 #춘천맛집 #춘천나들이맛집,정성과 함성,https://blog.naver.com/knospe830,2021-07-09
" 유포리막국수~ 막국수 7,500원, 감자부침 8,000원... ",https://blog.naver.com/buylsj?Redirect=Log&logNo=222537970648,# 유포리막국수#춘천막국수 #춘천 #강원 강원 춘천시 신북읍 맥국2길 123 (유포리 62-2) 11:00 - 19:30 033-242-5168 춘천에 오면 꼭 먹어봐야 하는 음식중에 닭갈비 이외에 다른 하나가 춘천막국수이다 우리는 막국수를... ,경산 유명부동산,https://blog.naver.com/buylsj,2021-10-15
 유포리막국수 . 목적지는 춘천유포리 막국수 ,https://blog.naver.com/yjkim228?Redirect=Log&logNo=222406523879,"ㅎㅎ 춘천막국수 하면 이 집부터 손꼽는 분들이 많지요.유포리막국수 를 사람들이 왜 그렇게 좋아할까 생각해봤는데요. 1. 면의 맛을 논할 겨를도 없이 국수 인심이 정말 넉넉하고요.유포리막국수7,500원 2. 잘... ","국수, 그 찰나를 쓰다",https://blog.naver.com/yjkim228,2021-06-22
춘천 막국수 맛집유포리막국수 ,https://blog.naver.com/921026_?Redirect=Log&logNo=222472703414,샘밭막국수와유포리막국수!! 후보를 추리는데는 우연히 막국수박사님의 블로그를 보고 후기를 참고했는데유포리막국수 로 결정한 뽀인트는 바로 녹두감자 반반전이 된다는 팁이있었다. 메뉴판에도 안... ,구진블로그,https://blog.naver.com/921026_,2021-08-16
"막국수와 수제비- 밀두레수제비,명가춘천막국수, 유포리막국수 ",https://blog.naver.com/hongyw?Redirect=Log&logNo=222115589236,"me/x5gfPX6v 막국수집을 또 한 곳을 더 소개합니다,유포리 막국수 집 여기에는 비빔면만 있습니다, 이 집의 특징은 동치미 국물인데 이 맛은 오묘합니다, 비빔장이야 어떤 집이든 비슷하다고 생각합니다, 그런데... ",연우의 세계,https://blog.naver.com/hongyw,2020-10-14
[춘천]유포리막국수 ,https://blog.naver.com/hanbora3?Redirect=Log&logNo=222526379761,✏한줄평✏ 별점 ☆☆☆☆☆ 막국수 마지막에 꼭 동치미 국물 넣어서 드셔보세요.. 단점은 딱히 보이지 않음. #춘천 #맛집 # 유포리막국수#막국수 #두부 #메밀전병,퍼플캉스의 '기억'하고 싶은 '공간',https://blog.naver.com/hanbora3,2021-10-04
춘천 맛집 :유포리막국수(생활의 달인 막국수편),https://blog.naver.com/junshine?Redirect=Log&logNo=222330171502,춘천 맛집 :유포리막국수(생활의 달인 막국수편)유포리막국수 는 숙소였던~~ 유포리나의집에서 가까운 막국수집이 어디있나 찾다가 ㅋㅋ 발견했는데 알고 보니 생활의 달인 막국수편에도 나왔던 아주 유명한... ,작은 쉼표 두개 :),https://blog.naver.com/junshine,2021-05-01
내돈내산 춘천유포리막국수 ,https://blog.naver.com/fortuneapple?Redirect=Log&logNo=222517702380,후에유포리막국수 에서 저녁 해결 (점심은 남이섬 주차장 근처 닭갈비.. 맛이가 그럭저럭ㅠㅠ) 춘천엔 닭갈비집이 왜 이리 많은지 신기했어요! 닭갈비 음식점에 막국수 메뉴도 꼭 있던데 막국수 전문점은 어떨까... ,안동 포츈애플농장,https://blog.naver.com/fortuneapple,2021-09-26
[강원도여행] 춘천유포리 막국수 ,https://blog.naver.com/hana_ru?Redirect=Log&logNo=222339298956,양양에서 춘천으로 막국수 먹으러 넘어갑니다 #강원도여행 뷰 맛집 강원도 한계령 휴게소유포리 막국수강원 춘천시 신북읍 맥국2길 123 033-242-5168 #춘천막국수 # 유포리막국수#블루리본서베이... ,회사 밖의 30대,https://blog.naver.com/hana_ru,2021-05-05
[춘천 막국수]유포리 막국수감자부침 고래회원님들 간식,https://blog.naver.com/sonhoi0225?Redirect=Log&logNo=221673212149,"얼마나 반갑던지유포리막국수맞게 찾아왔어요 메인은 막국수 하나에 운영시간도 짧은거 보니 맛집스멜ㅋㅋㅋㅋ 실내는 방자리랑 테이블자리가 있었어요 막국수 4개, 감자부침 1개 주문했어요 맘같아선 편육... ",보통날 :),https://blog.naver.com/sonhoi0225,2019-10-10
춘천유포리막국수 ,https://blog.naver.com/bubble_latte?Redirect=Log&logNo=222035247987, 유포리막국수샘밭막국수 명가막국수 이렇게 세 곳이 가장 많이 나오더라고요. 물막국수 비빔막국수가 따로 있는게 아니라 막국수는 하나고 그걸 어떻게 먹느냐에 따라 달라지는 것이더라고요. 막국수 2개와... ,"eat, play, live",https://blog.naver.com/bubble_latte,2020-07-19
[춘천맛집]유포리 막국수먹을만 합니다 :),https://blog.naver.com/jinnn25?Redirect=Log&logNo=222063861024,헤비하지 않는 음식으로 알아보던 중 춘천 막국수가 유명하기 때문에 검색해서 방문하게 된 #춘천맛집 #춘천막국수 # 유포리막국수네비 찍고 가지만 창문 열면 구수~~한 냄새가 나는 ㅋㅋ 이 곳에 식당이 있다고?... ,This is my InterpretatioN_,https://blog.naver.com/jinnn25,2020-08-19
춘천 막국수맛집 중유포리막국수 ,https://blog.naver.com/2ji1004?Redirect=Log&logNo=222234180900, 유포리막국수오늘처음 가본 집인데 어르신이 많은 집이요ㅎ 나오는데보니 생활의달인에 나온집이네요 남부막국수처럼 파가크게 보이는 집이구요 동치미도 맛있었구요.. 면삶은 물을 주는집이 흔하지않는데... ,칠보공방-지니의 일기장,https://blog.naver.com/2ji1004,2021-02-06
2021.7 춘천유포리막국수막국수 감자전,https://blog.naver.com/fallingme104?Redirect=Log&logNo=222472996563,"밥은 먹어야겠고 나온 김에 춘천 # 유포리막국수먹으러.. 역시나 많은 인파. 15분 웨이팅후 자리 안내. (자리 구분 칸막이는 잘 되어 있네.) 기본 제공. 시원한 동치미 #막국수(7,500) #감자전 (8,000원) 감자전... ","먹방,빵,여행,처음처럼 사랑하는 뇨자^^",https://blog.naver.com/fallingme104,2021-08-17
춘천유포리막국수 ,https://blog.naver.com/funnysong78?Redirect=Log&logNo=222261005262,20210225-26 1박2일 춘천 여행동안 2번이나 가서 먹은유포리막국수첫날은 혼자 둘째날은 칭구들과 동치미가 진짜 맛있음 강원도 친구들은 신기하게도 막국수에 설탕을 잔뜩 넣어 먹는다 메밀전병도... ,belle époque,https://blog.naver.com/funnysong78,2021-03-01
# 유포리막국수#춘천막국수,https://blog.naver.com/podotaky?Redirect=Log&logNo=222358754794,# 유포리막국수#춘천막국수 소양강댐주차장 옆에 있어요. 50년전통 춘천막국수 김가루와소스가 어우러진 고소하고 은은한 뒷맛입니다. 동치미 국물도 시원하고 맛있었구요. 방금 만든듯한 두부김치 녹두전... ,똑똑한 김소장의 차익형/수익형부동산 따라잡기,https://blog.naver.com/podotaky,2021-05-20
