title,link,description,bloggername,bloggerlink,postdate
수원 족발보쌈 맛집추천!이서방왕족발보쌈 수원본점방문후기,https://blog.naver.com/ellaan311?Redirect=Log&logNo=222147634410," 이서방왕족발보쌈 수원본점 에 다녀왔거든요~! 저는 족발은 별로 안좋아하는 편이었지만, 족발보쌈집에 갔으니 불족발로 도전했습니다!! 본점에 맛집이라 그런지 티비프로그램에도 많이 나왔더라구요~! 밖에... ",2분 전,https://blog.naver.com/ellaan311,2020-11-18
보쌈족발 맛은 이 정도가 되야지!이서방왕족발보쌈 수원본점 ... ,https://blog.naver.com/tpwns0115?Redirect=Log&logNo=222356018815,오늘 소개할 곳은이서방왕족발보쌈 수원본점 입니다. 저는 배달의 민족 어플을 통해 배달이 아닌 포장 주문을 하였습니다! * 주소 : 경기 수원시 권선구 세권로 134 * 연락처 : 0507-1373-5515 이서방족발보쌈은... ,사슴이 일상,https://blog.naver.com/tpwns0115,2021-05-18
[권선] 수원 족발이서방왕족발보쌈 수원본점정말 푸짐해요,https://blog.naver.com/woori_ey?Redirect=Log&logNo=221804455264,권선 수원 족발이서방왕족발보쌈 수원본점정말 푸짐해요 이서방왕족발보쌈본점 OPEN 12:00 CLOSE 23:00 031-233-5515 남자친구와 오랜만에 족발보쌈이 먹고 싶어서 수원에 있는 유명한 맛집인 이서방왕족발보쌈... ,따흐흑의 블로그,https://blog.naver.com/woori_ey,2020-02-11
[수원 족발 맛집]이서방 왕족발보쌈 수원 본점 에 다녀오다!... ,https://blog.naver.com/6536hj?Redirect=Log&logNo=222214274861,"Previous image Next image [수원 족발 맛집]이서방 왕족발보쌈 수원 본점메뉴판 족발, 보쌈, 마늘보쌈, 눈꽃 치즈 불 족발, 빙수 족발, 냉채족발 등 정말 모든 종류의 족발이 있는 것 같다! ㅎㅎ 불족발과 기본... ",Nepel Castel,https://blog.naver.com/6536hj,2021-01-21
 수원권선동 맛집 완전 최고...이서방왕족발보쌈본점 ,https://blog.naver.com/jinjoo0426?Redirect=Log&logNo=222082500975,경기도 수원시 권선구 세류동 1075 - 10 전화 번호 : 031 -233 -5515이서방왕족발보쌈 수원본점 은 배달이 완전... 권선동족발맛집 #수원권선동보쌈맛집 #수원권선동배달맛집 #수원권선동빙수족발 #이서방왕족발보쌈본점,오늘보다 더 예쁜 내일을 위해,https://blog.naver.com/jinjoo0426,2020-09-07
.세류동 맛집. ' 이서방왕족발보쌈 수원 본점 ' 수원 족발 찐 맛집!,https://blog.naver.com/punsugirl_jy?Redirect=Log&logNo=222056018701,"맛집 ' 이서방왕족발보쌈 수원 본점 '에서 족발 냠냠 흡입하고 왔어요~! '이서방왕족발보쌈'은 이미 수원... 맛집이란 걸 증명해주는거겠죠?ㅋㅋ 한쪽 벽에 붙어있는 보쌈과 족발의 효능, 메인메뉴. 그리고 방송에... ",찌렁이의 블로블로그 :),https://blog.naver.com/punsugirl_jy,2020-08-10
수원 세류동 맛집이서방왕족발보쌈 수원본점* 족발배달... ,https://blog.naver.com/pshgod22?Redirect=Log&logNo=221987980350,이서방왕족발보쌈 #족발 보쌈 #맛집 # 이서방왕족발보쌈# 수원본점친구 덕분에 입호강한 이야기... 세류동 이서방이서방왕족발보쌈 수원본점 :) 메뉴 Previous image Next image 메뉴판을 가져다가 봅니다:) 족발 보쌈... ,맛있게 냠냠:),https://blog.naver.com/pshgod22,2020-06-03
세류동 족발 맛집 ::이서방왕족발보쌈 수원본점 에서 불족발... ,https://blog.naver.com/hamkke72?Redirect=Log&logNo=222187343134,최고최고수원족발 맛집이라는 타이틀에 고개가 절로 끄덕여지는 맛입니다 같이 주신 뜨끈뜨끈한 미역국도 일품이었는데 세류동보쌈맛집이서방왕족발보쌈이모님들 음식솜씨가 장난이 아니시라는!!... ,쵸이민의 블루블루한 날들,https://blog.naver.com/hamkke72,2020-12-27
세류동이서방왕족발보쌈 수원본점쫀득쫀득 족발 맛집,https://blog.naver.com/tory4708?Redirect=Log&logNo=221777587904,이서방왕족발보쌈 가끔 생각나는 음식 족발 수원에 맛있는 족발 맛집이 있다고 해서 온 이곳이서방왕족발보쌈 수원본점내가 자주 보는 생생정보통에도 방송이 되었고 다른 방송에도 많이 나온 듯 했다 ㅎㅎ... ,"오늘, 하루",https://blog.naver.com/tory4708,2020-01-19
수원 세류동 맛집_[ 이서방왕족발보쌈 수원본점 ] 족발시키면... ,https://blog.naver.com/makemym?Redirect=Log&logNo=222023389278,족발+보쌈 # 이서방왕족발보쌈 수원본점 이었어요~!!! 인터넷 찾아보니 수원 세류동 맛집이라고 많이... 영업시간 12:00~23:00 국내 3대 방송사에서 나왔던 #이서방왕족발보쌈 ㅋ 티비에 나왔다고 다 맛있는 건... ,친절한 하마찡,https://blog.naver.com/makemym,2020-07-07
수원 권선동 맛집 ::이서방왕족발보쌈 수원본점가성비 퀄리티... ,https://blog.naver.com/rimaaa_?Redirect=Log&logNo=222017990670, 이서방왕족발보쌈 수원 본점권선동 맛집 운영시간 12:00-23:00 휴무 X 위치 주차 가능 안녕하세요 ㅎㅡㅎ... 다음에는 엄마 아빠랑 같이 와야겠어요 ㅡ 수원 보쌈 족발 맛집으로 이서방왕족발보쌈 본점... ,It’s RIMA ෆ⃛,https://blog.naver.com/rimaaa_,2020-07-01
세류동 맛집 맛있는 불족 주차가능이서방왕족발보쌈 수원본점 ,https://blog.naver.com/aaccq123?Redirect=Log&logNo=221797882189,먹으러이서방왕족발보쌈 에 갔습니다. 여기는 매장내식사도 많지마 포장 및 배달도 엄청 많은곳이예요~ 주차장까지있어서 차로가니까수원 역에서 금방이라 너무좋았어요. 먹음직스럽게 양념된 불족 그냥보쌈 ... ,새앙토끼(뉴포링),https://blog.naver.com/aaccq123,2020-02-06
"푸짐한 제대로된 족발 맛집, 세류동이서방왕족발보쌈 수원본점 ",https://blog.naver.com/youjiin56?Redirect=Log&logNo=222354599119,이서방왕족발에서 족발 포장해서 푸짐하게 맛있는 저녁식사♥이서방왕족발보쌈 수원본점영업시간 월-일 12:00-23:00 전화번호 031-233-5515 주소 경기도 수원시 권선구 세류동 1075-10 융찌's BLOG,융찌`s BLOG,https://blog.naver.com/youjiin56,2021-05-17
수원시청역 맛집이서방왕족발보쌈 수원본점 에서 맛나게... ,https://blog.naver.com/tjdydwn1004?Redirect=Log&logNo=222051303211,수원시청역 맛집이서방왕족발보쌈 수원본점글사진 쪼히 저번주에 남편과 울아기랑 같이 밥먹으러... 막국수랑 보쌈이랑 같이 먹으면 진짜 끝짱납니다 ㅎㅎ 수원시청역 맛집 이성방왕족발보쌈 수원본점... ,쪼히 육아 블로그 (with 찌뽀),https://blog.naver.com/tjdydwn1004,2020-08-04
수원족발맛집이서방왕족발보쌈 수원본점불족발추천 !,https://blog.naver.com/wngus4895?Redirect=Log&logNo=222318549951, 이서방 왕 족발보쌈수원본점 에서 족발/불족발 반반 먹고왔어요 :) 이서방 왕 족발보쌈 매장소개... 맛있더라구요 :)이서방 왕 족발보쌈 수원본점 에서 사이드로 함께 주신 미니 막국수! 면과 소스를 따로... ,J’s Daily ✨,https://blog.naver.com/wngus4895,2021-04-22
"[ 수원맛집]수원이서방왕족발보쌈핵꿀맛 (불족발,보쌈 )",https://blog.naver.com/sum0197?Redirect=Log&logNo=222522461600,이서방왕족발보쌈 지점이 수원본점 세류동 동탄점 이렇게 3개가 있더라고요~~ 원산지 표기도 중하지!!... 위치이서방왕족발보쌈 수원본점주소 : 경기도 수원시 권선구 세권로 134 이거 먹고 베스킨라빈스 먹으러... ,미니's Life.,https://blog.naver.com/sum0197,2021-09-30
수원 족발맛집) 족발 보쌈먹고...이서방왕족발보쌈 수원본점 ,https://blog.naver.com/jjunga1990?Redirect=Log&logNo=222145186737,수원 권선구 세류동에 완전 찐 족발집이 있다고해서 찾아가봤습니다!! 이서방왕족발보쌈 본점 !!... #수원족발 #권선동맛집 #곡반정동맛집 #이서방왕족발보쌈 # 이서방왕족발보쌈수원본점#수원보쌈맛집... ,임셀리나의 술기행,https://blog.naver.com/jjunga1990,2020-11-16
 수원 족발맛집 이서방왕족발보쌈본점쫀득한 족발과... ,https://blog.naver.com/engellosa?Redirect=Log&logNo=222164828034,이서방왕족발보쌈이서방왕족발보쌈 수원본점메뉴판~~ 대표메뉴 족발보쌈 종류가 다양하다.... 족발맛집으로 이서방족발보쌈 수원본점을 꾹 추천한다.(주소) 경기 수원시 권선구 세권로 134 지번 : 경기... ,"엔젤로사 블로그~여행,맛집,일상 블로그",https://blog.naver.com/engellosa,2020-12-06
수원족발맛집 곡반정동족발이서방왕족발보쌈 수원본점 ,https://blog.naver.com/zxcvb8802?Redirect=Log&logNo=222121821890,족발은 따뜻한 족발과 차가운 족발중 선택이 가능했어요 저는 차가운 족발로 주문했어요 수원족발맛집 곡반정동족발이서방왕족발보쌈 수원본점메뉴판 사진도 보여드릴게요 이서방왕족발보쌈은 족발을... ,당근블로그,https://blog.naver.com/zxcvb8802,2020-10-21
세류동 족발맛집이서방왕족발보쌈 수원본점눈꽃치즈불족발... ,https://blog.naver.com/heidipark88?Redirect=Log&logNo=222178984101,"무조건이서방왕족발보쌈 수원본점 이에요 ^^ 눈꽃치즈 불족발 진짜 맛있어요 ㅠㅠ #세류동맛집,#세류동족발맛집,#세류동보쌈맛집 #이서방왕족발보쌈 ■ 이서방왕족발보쌈 전화 : 031-233-5515 주소 : 경기 수원시... ",민트영의 사적인 블로그,https://blog.naver.com/heidipark88,2020-12-19
 이서방왕족발보쌈 수원본점수원 보쌈 맛집 겨울철 별미... ,https://blog.naver.com/cjbforever2?Redirect=Log&logNo=222191160736,수원시 권선구 세류동 1075-10번지 12:00~23:00이서방왕족발보쌈 수원본점 은 쫀득한 족발과 겨울철 별미인 보쌈으로 수원의 족발보쌈을 평정하고 있는 대표 브랜드~~ 이서방왕족발보쌈!! 역시 명불허전!!... ,YOLO! THAI! Q&A로 풀어가는 태국방콕여행 꿀팁,https://blog.naver.com/cjbforever2,2020-12-31
[권선구 맛집] 권선동이서방왕족발보쌈 수원본점 ,https://blog.naver.com/jenesis97?Redirect=Log&logNo=221706162799,"보쌈 전문점 이서방왕족발보쌈 넓은 실내좌석이 있습니다. 권선구 맛집이서방왕족발보쌈 수원본점 입... 일단 미역국 덜구요, 따뜻한 국물 한입 맛보구요 피곤한 하루 이서방족발보쌈먹고 날려버리렵니다. 족발... ",주원패밀리,https://blog.naver.com/jenesis97,2019-11-13
 수원이서방왕족발보쌈본점여긴 족발 맛집이야 !,https://blog.naver.com/1277zz?Redirect=Log&logNo=222146735169,"주말에는 보쌈도 먹고싶고 족발도 먹고싶은날이여서 찾다가 집근처 수원 이서방왕족발보쌈 본점이 있더라구요 영수증리뷰도 워낙 좋길래 찾아갔지용 ,,이서방왕족발보쌈 수원본점 은 신발을 벗고 들어가는... ",미느아의 일기장ෆ,https://blog.naver.com/1277zz,2020-11-17
수원족발맛집이서방왕족발보쌈 수원본점막국수와족발... ,https://blog.naver.com/cjs95832?Redirect=Log&logNo=222194226128,"더 맛있는 족발 ,이서방왕족발 에서는 현재 방문포장시 3000원 할인 이벤트와 절약형족발로 저렴하게 구매하실 수 있으니 오늘저녁은 족발 어떠신가요?? # 수원 족발맛집 # 이서방왕족발보쌈#족발 # 보쌈#막국수",에반스 구석구석 일상,https://blog.naver.com/cjs95832,2021-01-03
" 이서방왕족발보쌈 수원본점 , 족발보쌈 테이크아웃 포장도... ",https://blog.naver.com/kellys2?Redirect=Log&logNo=222219694219,또 먹고싶네요ㅠㅠ 족발보쌈 맛집이서방왕족발보쌈 수원본점 은 보쌈도 정말 잘 하더라구요. 살이나 비계 어느 한쪽의 비율이 높지 않은 딱 적당한 삼겹의 비율을 가진 보쌈이라 입에서 야들야들하게 녹는... ,허니부부 IT이야기,https://blog.naver.com/kellys2,2021-01-25
세류동맛집이서방왕족발보쌈 수원본점 ,https://blog.naver.com/juwon7030?Redirect=Log&logNo=222089975422,# 이서방왕족발보쌈수원본점포장을 해보았습니다. #세류동맛집 으로 아는 사람은 다 안다는 그집!! 저 한테 이런 복도 있나요?ㅎㅎ 그리하여 제가 찾아간 #이서방왕족발보쌈 입니다. #세류동맛집 진짜야?? 제가... ,이웃집 동산이,https://blog.naver.com/juwon7030,2020-09-15
수원 권선동 맛집 야들야들이서방왕족발보쌈 수원본점 에서... ,https://blog.naver.com/sshanb?Redirect=Log&logNo=221780235953,수원 권선동이서방왕족발보쌈 수원본점여기가 맛집!! 아이들 방학이지만 새 학기 준비하느라 왠지... 족발보쌈 전문점에서 늦은 점심을 먹기로 결정했어요. 이서방왕족발보쌈 본점은 수원버스터미널과 가까운... ,사랑맘의 달콤한 하루~^^,https://blog.naver.com/sshanb,2020-01-21
세류동맛집이서방왕족발보쌈 수원본점 ,https://blog.naver.com/tpduswkd11?Redirect=Log&logNo=222275038287,저희가족이 다 너무 좋아하기때문에 열심히 먹어줬어요 ㅋㅋ 세류동족발맛집은이서방왕족발보쌈 수원본점강력추천드려요 !!! #세류동맛집 #세류동족발맛집 #세류동보쌈맛집 #이서방왕족발보쌈,vistavie,https://blog.naver.com/tpduswkd11,2021-03-14
 수원족발 맛집이서방왕족발보쌈또 다녀왔어요!,https://blog.naver.com/ssonda2002?Redirect=Log&logNo=222078758586,족발을 맛있게 먹었던 로은이가 신기했던 날이었어요. 다음번에도 로은이 족발과보쌈많이 사줘야겠다!는 생각이 들더라구요.수원맛있는 족발 찾으시는 분들께수원 본점이서방왕족발보쌈매장 추천드려요!,드라마처럼 살자 :: SSONDA' Life ♬,https://blog.naver.com/ssonda2002,2020-09-03
수원 권선동 족발 보쌈 맛집 :이서방왕족발보쌈 수원본점(불족... ,https://blog.naver.com/w0--0w?Redirect=Log&logNo=222505570392,"# 수원 맛집 #권선동맛집 # 수원 족발 #권선동족발 # 수원보쌈#권선동 보쌈# 수원 막국수 #권선동막국수 안녕하세요! 친구의 족발,보쌈사진을 보고 너무 먹음직스럽길래 저도 호다닥 주문을 넣었습니다! 바로... ",푸파가 꿈인 미동이,https://blog.naver.com/w0--0w,2021-09-14
수원족발맛집이서방왕족발보쌈 수원본점 ,https://blog.naver.com/cateyepark?Redirect=Log&logNo=222102065561,"여름이 가기 전 꼭 먹고싶었던 냉채족발을 먹으러수원 족발맛집인이서방왕족발보쌈 에 다녀왔어요... 메뉴를 보자보자~ 대표메뉴로는 족발,보쌈 이 기본이고 마늘 보쌈 , 빙수족발, 냉채족발, 눈꽃치즈불족발... ",잘잘BLOG,https://blog.naver.com/cateyepark,2020-09-28
수원보쌈 세류동 혜자맛집이서방왕족발보쌈 _ 수원본점 ,https://blog.naver.com/qhfkarkwhr11?Redirect=Log&logNo=222073615783," 이서방왕족발보쌈 수원본점(족발,보쌈) 소개 : 수원 족발 방송3사가 인정한 이서방왕족발 위치 : 경기도 수원시 권선구 세권로 134 전화 : 0507-1373-5515 영업시간 : 매일 12:00~23:00 오늘은 수원 곡반정동에 있는... ",Aura,https://blog.naver.com/qhfkarkwhr11,2020-08-28
권선동 보쌈이서방왕족발보쌈 수원본점:: 꽃게탕이 서비스로... ,https://blog.naver.com/js_19999?Redirect=Log&logNo=221768845230,보쌈 이서방왕족발보쌈 본점! 수원살면서 여기 모르면 진심 간첩쓰~! 국내 3대 방송사가 극찬한 최고의 맛집인곳으로 믿고먹는 곳이다 권선동 보쌈이서방왕족발보쌈 수원본점-주소:경기 수원시 권선구... ,실잉 일기장,https://blog.naver.com/js_19999,2020-01-12
수원 족발 맛집이서방왕족발보쌈 수원본점_ 족발과 꽃게탕... ,https://blog.naver.com/hsyzizi?Redirect=Log&logNo=221769096358,"족발과 보쌈이 몸 어디에 좋은지 자세히 나와있으니 궁금하신분은 클릭! 수원 족발 맛집이서방왕족발보쌈 수원본점메뉴판 [주문한 메뉴] 반반 메뉴 中 40,000원 [족발 / 불족발] 족발은 따뜻하게, 불족발은... ",탱구리 조잘조잘 이야기,https://blog.naver.com/hsyzizi,2020-01-12
"#0705 세류동 맛집,수원족발이서방 왕족발보쌈 ",https://blog.naver.com/ji_yeong0505?Redirect=Log&logNo=222033511239,세류동 맛집 수원 이서방왕족발의 족발은 딱 좋게 쫄깃 쫄깃하고 부드러운 맛이었다. 특히 우리는... 세류동맛집 #권선동맛집 #곡반정동맛집 #이서방왕족발보쌈 #세류동족발추천 # 이서방왕족발보쌈수원본점 ,지사원 DAILY,https://blog.naver.com/ji_yeong0505,2020-07-17
[수원/권선동 맛집]이서방왕족발보쌈 수원본점방문후기~~,https://blog.naver.com/exithjh?Redirect=Log&logNo=222150022563,"열심히수원족발 맛집을 검색했더니!! 이름도 정겨운이서방 왕족발보쌈발견!! 바로 방문해보았어요... 기분~^^이서방족발 보쌈메뉴수원 족발 맛집이서방 족발 보쌈시그니처 메뉴는 족발,보쌈 , 불 족발... ","아무튼,",https://blog.naver.com/exithjh,2020-11-21
" 수원 족발맛집,이서방왕족발보쌈 , 세류동맛집답네요❤️",https://blog.naver.com/serim0228?Redirect=Log&logNo=222114324073, 수원 족발맛집이서방 왕족방은수원본점 과 동탄점 두군데이네요 포장 배달 모두 가능해요 제가 간 날도 배달 주문이 엄청 많이 오더라구요 맛집 인정 세류동 족발 맛집이서방왕족발보쌈 은 방문포장시 3천원... ,❤️일상이 즐거운 워니맘,https://blog.naver.com/serim0228,2020-10-13
수원 세류동 족발 맛집이서방 왕족발 보쌈 수원 본점가성비... ,https://blog.naver.com/manekineko28?Redirect=Log&logNo=221773233981,"수원 족발 맛집, 수원 권선구 맛집, 세류동 맛집으로 유명한 ' 이서방 왕족발 보쌈 수원 본점 '을... image 수원 족발 맛집 이서방 왕족발 보쌈은 족발, 보쌈 전문점답게 메뉴가 다양했는데요! 마늘보쌈, 빙수 족발... ",밈규의 리뷰가즘!,https://blog.naver.com/manekineko28,2020-01-15
"[ 수원 ]이서방왕족발보쌈본점 ,수원족발, 세류동 족발, 세류동... ",https://blog.naver.com/93sms93?Redirect=Log&logNo=222145762667,ㅎ_ㅎ # 이서방왕족발은 남은 음식 포장해 주는 아주 모범 음식점이에요!! 그래서보쌈남은 것도 야무지게 친구가 싸갔답니다! 너~~~무 맛있고 만족스러웠던 식사였어요!! # 수원 맛집 인정합니다!!! 또 갈래요... ,서.문.선의 라이프,https://blog.naver.com/93sms93,2020-11-16
수원 회식장소 :: 야들야들 끝판왕 ' 이서방 왕족발 보쌈 '수원본점 ,https://blog.naver.com/mhyesu?Redirect=Log&logNo=221305356116, 이서방 왕족발보쌈방석 이거 집에 하나 사가고싶었어요ㅋㅋㅋ 인체공학적설계의 방석 좌식임에도 다리저림이 없어요수원 맛집인이서방 왕족발보쌈 집 메뉴와 가격 참고해주세요 ↓이서방 왕족발 에서... ,물음표 일상 :),https://blog.naver.com/mhyesu,2018-06-23
" 이서방 왕족발보쌈 수원본점 ... 리얼후기, 보쌈반 족발반 @ 수원... ",https://blog.naver.com/loveblossom6?Redirect=Log&logNo=222500192622,www.kkotpiuda.co.kr #인계동족발집 #인계동족발 # 수원 맛집 # 수원 맛집추천 # 수원 족발 # 수원보쌈# 수원 족발맛있는집 # 수원 족발추천집 # 수원 족발잘하는집 #족발배달 #권선동 # 수원 권선동족발맛집 # 이서방왕족발 ... ,눈에 담긴 하루,https://blog.naver.com/loveblossom6,2021-09-09
불족발먹으러~이서방왕족발보쌈동탄점,https://blog.naver.com/god6262god?Redirect=Log&logNo=222499344068,#동탄족발#병점족발#반송동맛집 #이서방족발보쌈동탄점 #동탄보쌈맛집 #동탄회식 #반송동족발 #족발맛집 #동탄불족발 #동탄보쌈 #수원족발#세류동맛집 #동탄족발맛집 #권선동맛집 # 이서방왕족발보쌈수원본점 ,Seize the day,https://blog.naver.com/god6262god,2021-09-08
세류동족발맛집이서방왕족발보쌈 수원본점반반족발 포장후기,https://blog.naver.com/vivividdd?Redirect=Log&logNo=222297580034,위에 살얼음 가득한 막국수까지 이런 디테ㅣ일까지 신경써주시는 이서방왕족발 살얼음까지 더해지니... 다음에 또 먹으러 갈 곳 리얼찐맛집 수원 세류동 맛집 찾으시면이서방왕족발보쌈 수원본점추천드려요,하밍의 행복을 찾아서 ◡̈♡,https://blog.naver.com/vivividdd,2021-04-04
세류동족발맛집 노포 맛집 베스트 ::이서방왕족발보쌈 수원본점 ,https://blog.naver.com/ligas80?Redirect=Log&logNo=222277926978,"#세류동맛집, #세류동족발맛집, #세류동보쌈맛집, # 이서방왕족발보쌈수원본점 , #이서방왕족발보쌈 저는... 100년을 이어 갈 노포 맛집이 되기 위해 노력하는 이서방족발보쌈 수원본점에서는 국내 3대 방송사가... ",떡돌이,https://blog.naver.com/ligas80,2021-03-16
"세류동맛집,이서방왕족발보쌈 수원 본점 ",https://blog.naver.com/shh5487?Redirect=Log&logNo=222406144095,"여기 이서방왕족발수원본점으로 모여! 이서방왕족발보쌈은 모범업소 지정 이미,, 청결하고 위생적인... 세류동에 위치한 족발 보쌈 가게이서방왕족발보쌈 수원 본점❤✌ 수원회식, 가족회식, 직장회식... ",찌느녜 소소한 일상거리,https://blog.naver.com/shh5487,2021-06-22
세류동 맛집수원보쌈이서방왕족발보쌈본점방문... ,https://blog.naver.com/mystory65?Redirect=Log&logNo=220451729543,"이은이서방 왕족발보쌈 의 원조수원세류동이서방 을 다녀왔어요본점 이라 그런지 저는 개인적으로 더... 저는 역시나 늘 먹는보쌈중(中)자 하나를 시켰답니다. 쌈장 새우젓, 그리고 양파장까지. 미역국도... ","낯선 것이 익숙해질 무렵, 사랑을 이야기하다",https://blog.naver.com/mystory65,2015-08-17
수원족발맛집 현지인이 추천하는이서방왕족발보쌈 수원본점 ... ,https://blog.naver.com/zigulzigul52?Redirect=Log&logNo=221776609109,"연세드신 분들은 왕족발하면 '장XX 왕족발'을 말하지만, 수원 본토박이 현지인들이 엄지척! 추천하는 수원족발맛집이서방왕족발보쌈 수원본점 이 권선구 세류동에 있더라구요. 그래서 오늘의 포스팅은 B형... ",★닥터케이Dr.K의 황금시대★,https://blog.naver.com/zigulzigul52,2020-01-18
권선동 족발 ' 이서방왕족발보쌈 수원본점 ' 지인과 족발로 저녁... ,https://blog.naver.com/jyk0110?Redirect=Log&logNo=221727292296,"해여~이서방왕족발보쌈 이라고 제가 예전에수원 에 한참 있을 때도 들어봤던 집이에여 권선구에본점 이... 족발,보쌈효능 설명이 되어 있는 대형 메뉴판이 붙어 있었어여 메뉴판을 보니 1993년 이후로 하고... ",두드림의 이야기,https://blog.naver.com/jyk0110,2019-12-04
권선구 맛집 입에서 살살녹는이서방왕족발보쌈 수원본점 ... ,https://blog.naver.com/eunjin9875?Redirect=Log&logNo=221804297803,후기에요수원 에 있는게본점 인데 워낙 가성비좋고 맛있어서 2대째 내려오는 #족발 보쌈 전문점 으로... ♡ 여기보쌈진짜 너무 제취향이라 계속 생각날듯ㅜㅡㅜ 다음에이서방왕족발오게된다면 그냥보쌈 한판... ,♥쏟아지는 Happy♥,https://blog.naver.com/eunjin9875,2020-02-11
권선구 맛집이서방왕족발보쌈 수원본점드디어 방문성공,https://blog.naver.com/qkrwjddns91?Redirect=Log&logNo=221870668343,벽 한쪽에는 족발/보쌈의 효능과 함께 주력메뉴가 큼지막하게 붙어있어요. 동탄점에서는 그냥 족발... ㅎㅎ #권선구맛집 #수원족발맛집 # 이서방왕족발보쌈수원본점#수원회식장소 이서방왕족발보쌈 본점 경기... ,우니랑찹찹찹,https://blog.naver.com/qkrwjddns91,2020-03-25
 수원족발은이서방왕족발보쌈본점 에서,https://blog.naver.com/bbbb1231?Redirect=Log&logNo=221983207744, 수원족발 권선동 맛집수원모임장소이서방왕족발보쌈본점경기수원 시 권선구 세권로 134 매일 12:00...수원족발 이성방 왕족발보쌈본점촉촉하고 부드러운보쌈 과 시원한 막국수 조만간 다시 재방문 할 것... ,피닉스의 일상블로그,https://blog.naver.com/bbbb1231,2020-05-29
 수원 본점이서방 왕 족발보쌈 ,https://blog.naver.com/yy4851?Redirect=Log&logNo=222087925728,"-------------------보쌈 의 효능 *동맥경화경화증, 고혈압등 성인병 예방! *수은, 납등 공해물질을 체외로... 너무 맛있게 한끼 먹어서 기분좋은 하루였습니다.~수원 본점이서방 왕족발보쌈맛집으루... ",Seize the day❤,https://blog.naver.com/yy4851,2020-09-13
세류역 맛집이서방왕족발보쌈 수원본점 에서 족발 먹방,https://blog.naver.com/onlyju0707?Redirect=Log&logNo=221711026233,"전문점으로수원본점 부터 동탄점까지 체인점까지 확장되어 운영중에 있음! 대표메뉴인 족발이냐,보쌈 이냐로 고민하다가왕족발대자로 고고고고 -♬ 빠르게 세팅되어 푸짐하게 한상 차려진 우리테이블... ",풀리지않는신비,https://blog.naver.com/onlyju0707,2019-11-18
