title,link,description,bloggername,bloggerlink,postdate
"맛집 :)수원이서방왕족발보쌈세류동본점 , 이번에는보쌈 을... ",https://blog.naver.com/seoyoon6?Redirect=Log&logNo=222013160941, 수원 에서 유명한이서방왕족발보쌈본점 으로 왔다! 지난번 동탄점에 이어서 오늘은수원세류동에... 메뉴판보쌈 을 먹기로 이미 결정하고 와서 고민하지 않고 주문했다! 손님들이 없는 쪽으로 찍어본 내부... ,꽃님* 의 맛있는 일기,https://blog.naver.com/seoyoon6,2020-06-26
권선구맛집 : 주말에 점심으로이서방왕족발보쌈 수원본점 에서... ,https://blog.naver.com/shmwlals?Redirect=Log&logNo=221727704086,맛집이라는이서방왕족발보쌈 수원본점 에 다녀왔어욤 권선구 세류동에 위치한 이서방왕족발보쌈은... 굴보쌈도 급 땡겨서 먹으려다가 아무래도 족발 먹으러 갔으니..!! 이렇게 주문하고 나면 상차림은 이렇게... ,꾸물꾸물,https://blog.naver.com/shmwlals,2019-12-05
세류동맛집이서방왕족발보쌈 수원본점 에서 반반세트 먹었어요,https://blog.naver.com/simga1104?Redirect=Log&logNo=222296385505,세류동맛집이서방왕족발보쌈 에서 반반세트 먹엇지요 우왕 TV에 굉장히 많이 나왔네요... 좋아요이서방메인메뉴등장보쌈반 쫄깃쫄깃족발반 그리고이서방 의 특별한 막국수 얼음봐요얼음 완전 빙수에요... ,채권추심하는여자 심가영,https://blog.naver.com/simga1104,2021-04-02
 수원족발 세류동맛집 권선동맛집이서방왕족발보쌈본점 ,https://blog.naver.com/hi_sw19?Redirect=Log&logNo=221754540668,경기수원 시 권선구 세권로 134이서방왕족발보쌈본점031-233-5515 영업시간 / 매일 12:00 - 23:00 휴무일 / 없음 주차장 / 가게 주차장 이용 세류동에서 정말 맛있기로 소문난 족발 보쌈맛집이서방왕족발보쌈본점 ... ,풍요로운 참새네,https://blog.naver.com/hi_sw19,2019-12-30
수원 세류동 족발 맛집 :이서방왕족발보쌈 수원본점(족발... ,https://blog.naver.com/w0--0w?Redirect=Log&logNo=222305063274,저희도 술한잔겸 밥한끼~~ 족발의 효능과보쌈 의 효능도 벽에 크게 붙어 있어요! 메뉴 기다리면서 스윽 흩어볼만해요! 간략한 메뉴판! 방송도 많이 나왔더라고요! 두근수원 회식장소로도 유명한거 같아요! 저는... ,푸파가 꿈인 미동이,https://blog.naver.com/w0--0w,2021-04-10
"수원 권선동 불족발 맛집,이서방왕족발보쌈 수원본점 ",https://blog.naver.com/minimieee?Redirect=Log&logNo=222065498499,지짜 오랜만에이서방왕족발보쌈 을 갔다 한 1년만인듯? 곰탱님이 이 족발집을 좋아해서 몇년 전부터... 무김치_보쌈 먹고 싶다.... 생각해보니 이 식당에서는보쌈 을 먹은 기억이 없네... 한번도 먹어보지 않았던... ,ㅁㄴㅁ 아카이브,https://blog.naver.com/minimieee,2020-08-20
세류동족발맛집이서방왕족발보쌈반반족발 포장 후기,https://blog.naver.com/pealrpink?Redirect=Log&logNo=222309643798,"동네에수원 족발맛집이 있어서 갔다왔는데요! 바로 #세류동족발맛집 # 이서방왕족발보쌈본점방문... 모범음식점이기도 하네요 메뉴는 족발, 눈꽃치즈족발부터 불족발, 빙수족발까지 족발 메뉴만 4가지보쌈 은... ",freeFLOW,https://blog.naver.com/pealrpink,2021-04-14
( 수원세류동맛집:권선구맛집) 이서방왕족발보쌈본점 ,https://blog.naver.com/hych57?Redirect=Log&logNo=221774107642,"권선구족발 보쌈 배달, 이서방왕족발보쌈본점 ,족발효능, 보쌈 효능수원 맛집,세류동맛집,세류동회식,세류동가족외식,세류동족발,세류동 보쌈 ,권선구맛집,권선구회식,권선구가족외식,권선구 보쌈 족발... ",꽃뚜옹맘의 일상,https://blog.naver.com/hych57,2020-01-16
세류동맛집이서방왕족발보쌈 수원본점 으로 가즈아~,https://blog.naver.com/knh514?Redirect=Log&logNo=221312073606," 이서방왕족발보쌈 수원세류동에 위치한이서방 왕 족발 보쌈본점 입니다이서방왕족발보쌈매일 12:30... 장소에요이서방 왕족발보쌈 은 족발,불족발,눈꽃치즈불족발,빙수족발, 보쌈 ,굴 보쌈 ,마늘 보쌈등... ",달콤솜사탕♡,https://blog.naver.com/knh514,2018-07-04
세류동이서방왕족발보쌈역시나 인생족발이죠!!,https://blog.naver.com/0eventpd?Redirect=Log&logNo=222395742412,"정말 너무 맛있엉!! 세류동에 위치한 족발맛집!! 바로이서방왕족발보쌈본점 ~수원 회식장소, 가족회식, 직장회식, 가족모임 등 너무 잘어울리는곳!!! 주말저녁에는이서방왕족발보쌈 으로 행복한 저녁식사 하기!!!",2022 타일랜드를 꿈꾸며....,https://blog.naver.com/0eventpd,2021-06-13
 수원 족발이서방왕족발보쌈 에서 야들야들한 족발~,https://blog.naver.com/jylks2000?Redirect=Log&logNo=222002748070,어떤 족발은 비린내가 심하게 나기도 하고 지나치게 짜기도 한 족발이 있던데이서방왕족발 은 어떤지... 싶네요이서방왕족발보쌈주소 : 경기도수원 시 권선로 세권로 134 영업시간 : 12:00~23:00 네이버 예약 포장... ,카타리나의 시골본능,https://blog.naver.com/jylks2000,2020-06-16
( 수원 세류동) 차원이 다른 족발의 촉촉함이서방왕족발보쌈본점 ,https://blog.naver.com/jiq0711?Redirect=Log&logNo=221717787799,"다음엔 족발을 대자리로 먹어야지 세류동 맛집이서방왕족발보쌈매장 오다가다 봐왔던이서방 완족발...이서방왕족발보쌈본점차림표 족발,보쌈 이 주 메뉴다. 족발은 빙수, 냉채, 눈꽃치즈, 불족발로... ",언제나,https://blog.naver.com/jiq0711,2019-11-25
세류동 맛집이서방왕족발보쌈본점 은 역시본점 ,https://blog.naver.com/fordahye?Redirect=Log&logNo=221772710433,"가득가득ㅎㅎ #이서방왕족발보쌈메뉴 대표 메뉴는 두말할 것 없이 족발과 보쌈 족발도 맛있고 보쌈도... 43,000원 #이서방왕족발보쌈 #이서방왕족발보쌈본점 # 이서방왕족발보쌈수원본점#수원족발... ",콩주머니의 블로그,https://blog.naver.com/fordahye,2020-01-15
 수원족발 맛집:) 이서방왕족발보쌈불족/ 보쌈반반 존맛,https://blog.naver.com/dongkyu018?Redirect=Log&logNo=222273444078," 이서방왕족발보쌈 수원본점세류동 맛집, 수원 족발 맛집, 수원 보쌈 맛집 add_경기도 수원시 권선구... 이서방왕족발보쌈 막국수는 특이하게 소스가 버무려져서 나오지 않고 따로 나오는데 살짝 얼려져서... ",행복한 부부 Life Story…☆,https://blog.naver.com/dongkyu018,2021-03-12
족발보쌈 맛집이서방왕족발보쌈수원본점 을... ,https://blog.naver.com/bans_photo?Redirect=Log&logNo=220818471914,code=34744866_ts=1474545169256 바로이서방왕족발보쌈입니다! 세류동에수원본점 이 위치하고 있어요~ 제가 가본 곳이 바로수원본점 이랍니다~! 족발과보쌈 에 눈이 멀어.... 입구 사진을 담지 못한점... ,BANS STUDIO_반스스튜디오 반려동물 스튜디오,https://blog.naver.com/bans_photo,2016-09-22
 수원 족발맛집이서방왕족발보쌈냉채족발 존맛탱,https://blog.naver.com/anjy486?Redirect=Log&logNo=222074830244, 이서방왕족발보쌈 수원본점더운 여름날 뜨거운 족발보다는 냉채족발이 땡겨서 다녀온 수원족발맛집 이서방왕족발보쌈에 가족끼리 외식하러 다녀왔답니다 1993년부터 수원에서 시작해 지금까지도 그 명맥을... ,맛있고 예쁘고 신나는 블로그,https://blog.naver.com/anjy486,2020-08-30
[세류동맛집 /이서방왕족발보쌈본점 ]수원 회식장소로... ,https://blog.naver.com/stell-ee?Redirect=Log&logNo=221620386780,100석의 넓은 규모와 주차장을 완비하고 있는 세류동맛집이서방왕족발보쌈본점 !수원 회식장소 또는 가족모임장소로도 훌륭한수원 터미널맛집이서방왕족발보쌈 에 방문해서 맛있는 족발 보쌈 과 함께 행복한... ,숭돌뱅이의 직접 돌아다니는 RE-VIEW World,https://blog.naver.com/stell-ee,2019-08-21
[:: 수원 세류동족발맛집::이서방왕족발보쌈본점 ] 쫀득쫀득... ,https://blog.naver.com/iluv2luvu89?Redirect=Log&logNo=221754094463, 수원 권선구족발맛집이 서 방 왕 족 발 보 쌈본 점경기수원 시 권선구 세권로 134 031-233-5515 족발을... 역시보쌈먹을 때는 다양한 김치들과 즐길 때가 가장 맛있는거같아요 신랑과 저를 완전 만족케 했던... ,♡ 행복한 날들 ♡,https://blog.naver.com/iluv2luvu89,2019-12-30
[ 수원세류동/족발 맛집]... - ' 이서방 왕족발보쌈본점 ' 포장... ,https://blog.naver.com/kwonjy0527?Redirect=Log&logNo=222212760459,1인이서방왕족발보쌈 수원 시 권선구 세류동 1075-10 TEL : 050713735515 미리 배달의 민족으로 포장주문!... 만족은 없을 것같아요ㅠㅠ수원맛있는 족발 맛집 찾으신다면이서방왕족발추천할게요!! 잘먹었습니다!,Daily Life Memory Note,https://blog.naver.com/kwonjy0527,2021-01-19
동탄족발맛집이서방왕족발보쌈동탄점 냉채족발이 맛있음,https://blog.naver.com/mangsmell?Redirect=Log&logNo=222403243770,알고보니이서방왕족발보쌈 이수원 에본점 이 있다고 하네요!! 친정집이수원 이라수원 에본점 이 있다고 하니 더 친근감이 들고 그렇네요 ㅋㅋㅋㅋㅋ 무말랭이며보쌈 김치며 모두 맛있었지만 저는 냉채족발... ,러블리 씨스터즈 :D,https://blog.naver.com/mangsmell,2021-06-19
 수원보쌈맛집/세류동맛집이서방왕족발보쌈보쌈 (대) 푸짐하다,https://blog.naver.com/acejs2?Redirect=Log&logNo=222267323362,좋아하는 보쌈으로 먹어봤어요! 다음번에는 족발 먹어볼까봐요이서방왕족발보쌈 수원본점경기도... 수원보쌈 #수원족발 #수원이서방 #수원이서방왕족발보쌈 #이서방왕족발보쌈본점 #빙수족발 #냉채족발... ,룡룡이네_김요니의 일상,https://blog.naver.com/acejs2,2021-03-07
수원 족발 맛집/수원 보쌈... 보쌈/ 이서방왕족발보쌈 수원본점 ... ,https://blog.naver.com/9206y?Redirect=Log&logNo=221889945582,"족발/보쌈 이미 유명한 족발,보쌈 맛집 이서방왕족발 수원본점이서방왕족발보쌈 수원본점예약 하고... 세류동보쌈 #세류동회식장소 #곡반정동족발 #곡반정동보쌈 #곡반정동맛집 #이서방왕족발보쌈... ",슈슈로그,https://blog.naver.com/9206y,2020-04-07
 수원 맛집이서방왕족발보쌈빙수족발 추천,https://blog.naver.com/speed2185?Redirect=Log&logNo=222388587820,"(속도 무엇?) 바로이서방왕족발보쌈 수원본점 입니다 :) 이서방왕족발보쌈 수원시 권선구 세권로 134 매일 OPEN 12:00 CLOSE 23:00 T. 031-233-5515 이서방족발보쌈 수원본점 시그니처 메뉴엔 족발, 보쌈, 불족발... ",전국열쇠 이마트수원점 010-8214-7270,https://blog.naver.com/speed2185,2021-06-07
 수원 회식장소는 족발맛집이서방왕족발보쌈본점가즈아!!,https://blog.naver.com/tpduswkd11?Redirect=Log&logNo=221857772817, 수원 족발맛집이 세류동에 있다길래 한번 갔다가 이제는 세류동맛집은 무조건이서방왕족발보쌈 을... 진짜 요즘같은 시국에는 청결이 생명이잖아요 믿고먹을수있는수원 고깃집이서방왕족발 !! 짜잔 집에 포장해... ,vistavie,https://blog.naver.com/tpduswkd11,2020-03-17
[ 수원 맛집]이서방 왕족발보쌈다녀왔어요!!!,https://blog.naver.com/csr99?Redirect=Log&logNo=140188066233," 수원 점이본점 ...화성 동탄점도 있다고 하니...다음번에 동탄점을 한번 방문해볼까요??ㅎㅎ 1993년부터 지금까지 쭉 이어온이서방왕족발보쌈 ~ 기본적인 족발,보쌈 은 물론 해파리 냉채족발, 해물불족발, 우 보쌈 ... ",비 개인 오후,https://blog.naver.com/csr99,2013-04-28
[수원맛집]이서방 왕족발보쌈 수원본점 ,https://blog.naver.com/daldalhyun_a?Redirect=Log&logNo=221187766254,고기를 먹어줘야 한다는 생각에 ㅋㅋㅋㅋㅋ이서방 왕 족발보쌈 에서보쌈먹고 힘내고 왔지요 ~ 각종 방송에 맛집으로 소개가 엄청 많이 된 곳이고 검색만 해도 나오는 족발 보쌈맛집이예요~ (저도 검색하고... ,푸른달,https://blog.naver.com/daldalhyun_a,2018-01-18
 수원세류동맛집 ::이서방왕족발보쌈본점 ,https://blog.naver.com/pimpim7942?Redirect=Log&logNo=220789688627," 수원세류동맛집 ::이서방왕족발보쌈본점야밤에 족발이 너무 땡겨서 달려간이서방 ! 원래 동탄점... 특히이서방왕족발 에서는 매장에서 주문시, 쟁반막국수가 서비스! 살얼음 육수가 정말 시원하고... ",헤이율(HEY-Yul),https://blog.naver.com/pimpim7942,2016-08-17
 수원족발 인계동이서방왕족발보쌈본점후기,https://blog.naver.com/chobani9?Redirect=Log&logNo=221978736597,짠수원족발이서방왕족발보쌈본점주차장은 지하에 있으니 이용하시면되요 혹시나 사람이 많을까봐... 좋은게이서방왕족발 은 메인메뉴를 주문하면 꽃게탕 또는 막국수를 서비스로 제공되어요 저는 뭔가... ,Lindsey 미식 & 여행,https://blog.naver.com/chobani9,2020-05-26
세류동 맛집이서방왕족발보쌈 수원족발 맛집,https://blog.naver.com/altnr2134675?Redirect=Log&logNo=222190651176,"세류동 맛집 이서방왕족발보쌈 수원 족발 맛집은 족발의 효능과 보쌈의 효능도 적어두셨더라고요.... 그때는 동탄점으로 갔었는데, 수원 족발 맛집이서방왕족발보쌈 수원 본점 이 가까워서 편하고 좋네요. 족발... ",달달한 이설탕♥,https://blog.naver.com/altnr2134675,2020-12-30
" 수원세류동 족발맛집,이서방왕족발보쌈 ",https://blog.naver.com/dalgam89?Redirect=Log&logNo=222010202988,"족발에보쌈 이냐며 툴툴대면서 운전해줬어요ㅋㅋ 육아휴직 기간동안 저 하고 싶은대로 맞춰 주기로 했거든요. 그렇게 가게 된 집이수원세류동에 위치한 족발 맛집,이서방왕족발보쌈 입니다! 1993년부터... ",달감나무,https://blog.naver.com/dalgam89,2020-06-23
{ 수원 세류동맛집... 엄마 뱃속을 쿨 ! 하게 해준 ' 이서방왕족발보쌈 ',https://blog.naver.com/kimi8995?Redirect=Log&logNo=220155556613,수원보쌈 집에만 있다가는 뒹굴뒹굴만 할 것 같아서 맛집으로 고고씽 !! 집에서 겁나 가까운곳에 맛집이 많았는데.... 마음먹고 찾아온 ㅋㅋㅋㅋ ' 이서방왕족발보쌈 ' - 수원본점!!! 정말 수원터미널 맞은 편... ,유쁨이랑 같이 자라는 헬로킴미,https://blog.naver.com/kimi8995,2014-10-19
 수원세류동 맛집이서방왕족발보쌈반반 즐겨보자,https://blog.naver.com/qoo8086?Redirect=Log&logNo=222232603841,좋아하는보쌈두가지 다 즐기기 위해수원세류동 맛집이서방왕족발보쌈에서 반반메뉴 포장해서... 맛집이서방왕족발보쌈은수원본점과 동탄점이 있어요 저는 세류동에 위치한수원본점 으로 다녀왔어요!... ,워리,https://blog.naver.com/qoo8086,2021-02-05
" 수원족발 맛집이서방왕족발보쌈 , 족발 보쌈반반 포장 최고",https://blog.naver.com/tandola?Redirect=Log&logNo=222194239721,"족발도 맛있고, 보쌈도 맛있는이서방왕족발보쌈 수원본점전화 : 031-233-5515 수원시 권선구 세권로 134... 그래서 저는 점심에도 맘 편히 족발을 먹을 수 있는 이서방왕족발보쌈이 너무 좋더라구요.... ",지짱로드: 찌니,https://blog.naver.com/tandola,2021-01-03
 이서방왕족발보쌈 에서 족발 보쌈포장해서 먹었어요 -수원 족발,https://blog.naver.com/crazycar1010?Redirect=Log&logNo=222304993335,이미 족발/보쌈 맛집으로 유명한이서방왕족발보쌈 수원본점 에서 포장주문 해왔어요. 생각보다 훨씬 더... 수원본점 동탄점 두군데 있었네요. 방송에도 많이 나왔고.. 왜 전 이제야 알았을까요...? ㅠㅠ 푸짐한 한... ,수천이녜 이야기 ෆ,https://blog.naver.com/crazycar1010,2021-04-10
 수원족발 맛집이서방왕족발보쌈본점냉채족발 후기,https://blog.naver.com/stmdwp18?Redirect=Log&logNo=222054591421,"매일 12:00-23:00 ' 이서방왕족발보쌈 '은 아마수원사람이라면 오고 가며 하면서 한 번쯤은 봤을법할... 족발,보쌈집은 김치가 생명이다 대한민국의 수많은 국민들 이사실은 누구다 다 인정하는 국룰이죠? 아무리... ",왕갈비의 세상 맛보기,https://blog.naver.com/stmdwp18,2020-08-08
세류동 맛집 유명한수원족발이서방 왕족발보쌈 ,https://blog.naver.com/cjstkddbdo99?Redirect=Log&logNo=222121613020," 이서방 왕족발보쌈전화 - 031-233-5515 주소 - 경기수원 시 권선구 세권로 134 영업시간 - 매일 12:00 - 23:00 추천이유 -보쌈 , 족발, 불족 이렇게 3개를 시켰는데도 가격이 크게 비싸지 않을 정도로 가성비가 좋은데다... ",잡다하고 즐거운 경험~,https://blog.naver.com/cjstkddbdo99,2020-10-21
[ 이서방왕족발보쌈 ] 보들보들 야들야들 족발보쌈 / 수원 족발... ,https://blog.naver.com/pdnabang?Redirect=Log&logNo=221811268412,족발 보쌈을 먹으러 왔어요 ㅎㅎ 수원 버스터미널 근처라 그렇게 멀지는 않은데 자주 가지는 않는 동네 이서방 왕 족발 보쌈을 한번 먹어볼까욥이서방 왕 족발 보쌈_수원본점이서방 왕 족발 보쌈 익숙한듯... ,무뚱의 행복한 오늘,https://blog.naver.com/pdnabang,2020-02-16
 수원세류동 맛집 :이서방왕족발보쌈/ 불족발+빙수막국수,https://blog.naver.com/catch-y?Redirect=Log&logNo=222093284947,"맛집이서방왕족발수원본점메뉴, 가격이에요. 참고하시라고 메뉴판 사진을 찍어봤어요.이서방왕족발 보쌈 은 족발,보쌈 , 마늘 보쌈 , 눈꽃치즈불족발, 불족발, 굴 보쌈 , 반반, 냉채족발, 빙수족발 미니족발... ",은가비의 빛나는 매일,https://blog.naver.com/catch-y,2020-09-18
"[수원세류] 권선 세류동 족발 맛집,이서방 왕 족발보쌈 수원본점 ",https://blog.naver.com/moomini89?Redirect=Log&logNo=222154916831,가게 옆 주차가능하나 협소함수원권선 세류 족발 맛집 이서방 왕 족발보쌈여러 방송에 많이... 족발/불족발/ 보쌈중 택 2이서방 왕 족발보쌈보쌈보쌈맛있더라구요!질기지 않고 부드러웠어요 ㅎㅎ... ,IDLE LIFE,https://blog.naver.com/moomini89,2020-11-27
맛집]수원세류동에 위치한 족발 보쌈전문집이서방왕족발보쌈 ,https://blog.naver.com/smurfcar?Redirect=Log&logNo=222201714599,제가 다녀왔던 식당은 수원 세류동에 위치한 족발보쌈 맛집 이서방왕족발보쌈 입니다. 회사 동료들과... 여러분들도 보쌈과 족발이 생각나신다면 수원시 권선구 세류동에 위치한이서방왕족발보쌈 수원본점 ... ,스머프 중고차,https://blog.naver.com/smurfcar,2021-01-09
 수원이서방 왕족발 보쌈생생정보 빙수 족발 택시맛객,https://blog.naver.com/mmm7720?Redirect=Log&logNo=222465744319," 수원이서방왕족발보쌈집이 소개된다고 한다. 100년을 이어 갈 노포 맛집이 되기 위해 노력하는이서방 족발 보쌈 수원본점 에서 안내드립니다.※ 시그니처 메뉴로는 족발,보쌈 ,불족발,냉채족발 이 있으며... ",척척,https://blog.naver.com/mmm7720,2021-08-11
 수원족발 불족발 먹고 반한이서방왕족발보쌈 ,https://blog.naver.com/tmdflehd?Redirect=Log&logNo=221877154900,맛있는이서방왕족발보쌈이랍니다. 집에서도 즐겨먹기에 딱 좋은 불족 너무맛있었어요. 세류동에 위치한이서방왕족발 보삼수원 족발로 정말 유명한 만큼 많은 분들이 찾아오신다고하네요. 방문포장또한 큰... ,연동별의 체험관,https://blog.naver.com/tmdflehd,2020-03-30
[ 이서방왕족발보쌈/수원세류동]수원보쌈맛집,https://blog.naver.com/julia2465?Redirect=Log&logNo=222287892991,유명한이서방왕족발보쌈본점 으로 갔습니당 ㅋㅋ 방문 포장으로 미리 주문했고요!! 시간 맞춰서 찾으러 갔습니당 ㅎㅎ 예상은 했지만 식사하고 계신 분들이 많으시더라고요~~ 영통 맛집이자수원족발보쌈 ... ,촉촉한 초코세상,https://blog.naver.com/julia2465,2021-03-26
[ 수원이서방왕족발보쌈 ] 수원권선동 족발 맛집이서방왕족발보쌈 ,https://blog.naver.com/love1056?Redirect=Log&logNo=222062923596,족발집이서방왕족발보쌈 수원본점다녀왔어요. 이서방왕족발 위치는 경기 수원시 권선구 세권로 134... 보쌈김치 하나 올려서 쌈싸먹으니 아주 꿀맛입니다. 권선동 족발 맛집 이서방왕족발보쌈 영업시간은... ,고독한 순례자,https://blog.naver.com/love1056,2020-08-17
[권선동 맛집]이서방왕족발보쌈 수원본점 ,https://blog.naver.com/jiayou1121?Redirect=Log&logNo=221821690212,"반/반 메뉴 中 = 족발 +보쌈(+막국수 서비스) 40,000원 대표메뉴 주문 시 꽃게탕, 막국수 중 하나 선택 가능 기본 찬이에요. 미역국, 무말랑이가 맛있더라고요 ㅎㅎ 반/반메뉴 中 = 족발 +보쌈(+막국수 서비스) 40... ",금강산도 식후경,https://blog.naver.com/jiayou1121,2020-02-24
[ 수원 족발맛집] 권선동맛집 ' 이서방왕족발보쌈 ' 인생족발집... ,https://blog.naver.com/growing092?Redirect=Log&logNo=222009772766,맛좋은이서방왕족발그리고 먼저 족발이 나왔다.. 뜨헉.. 너무 맛있어보여ㅠㅠ 비주얼이 정말... 막국수 서비스로 주니까 꼭 해보시길..이서방왕족발보쌈본점수원 시 권선구 세류동 1075-10번지 1층 031-233-5515,소담한 행복♡,https://blog.naver.com/growing092,2020-06-23
맛집]이서방왕족발보쌈::수원족발 맛집에서보쌈족발!,https://blog.naver.com/bvb9?Redirect=Log&logNo=221872385565,[#수원 세류동 맛집 #수원 족발 보쌈 맛집]이서방왕족발보쌈 수원본점2020.03.24 오전에 운동 다녀오는 길에 점심으로 고기 먹고 싶어서 들러서 포장해온 #세류동맛집 이서방왕족발보쌈! #이서방왕족발보쌈 은... ,선율공간,https://blog.naver.com/bvb9,2020-03-25
 수원족발 맛집이서방왕족발보쌈배달도 가능해요,https://blog.naver.com/osy0717?Redirect=Log&logNo=222188506260,"족발이 땡기더라구요 그래서수원본점 인이서방왕족발보쌈 에 방문했습니다~ 요즘같은 추운날씨에... 역시보쌈 ,족발집 김치는 넘 맛있는가 같아요 ㅠㅠㅠㅜㅜ 꺅 양 엄청 낭낭한 대짜리에요 ! 대짜리 부터... ",ෆ⃛ 놀고먹기 ෆ⃛,https://blog.naver.com/osy0717,2020-12-28
세류동맛집 이서방왕족발보쌈수원 족발맛집발견!!,https://blog.naver.com/dbfrn69?Redirect=Log&logNo=221798917928,이서방왕족발보쌈집은 세류동이 본점이예요. 맛집은 자고로 본점으로 제대로죠! 수원족발맛집답게... 네이버에서이서방왕족발보쌈 수원본점검색하셔서 예약누르시고 원하시는 날짜와 시간 인원 예약하시면... ,이지랑조던이랑냠냠,https://blog.naver.com/dbfrn69,2020-02-06
 수원 족발맛집이서방왕족발보쌈추천합니다 :수원 회식장소... ,https://blog.naver.com/hbingbing?Redirect=Log&logNo=221890936195,"수원보쌈맛집! 이서방왕족발보쌈 본점에 방문했습니당 ~!이서방왕족발보쌈 수원본점위치 경기 수원시 권선구 세권로 134 영업시간 매일 12:00 - 23:00 전화(예약) 031-233-5515 저는 가게에서 먹었는데, 방문 포장 시... ",꿀콩 Day,https://blog.naver.com/hbingbing,2020-04-04
 이서방왕족발보쌈 / 수원 세류동 이서방왕족발 / 수원 맛집... ,https://blog.naver.com/areum_1202?Redirect=Log&logNo=220245392366,그집입니당이서방왕족발보쌈동생이 추천해서 갔다가 단골되버린이서방왕족발 !!! 요즘에 주말에... 여기가본점 ! 겉으로는 허름해 보여서 이 집이 진짜 유명한집 맞나 싶은데 저도 처음 갔을땐 왜 동네... ,변발녀입니다.,https://blog.naver.com/areum_1202,2015-01-20
동탄족발맛집이서방왕족발보쌈 ,https://blog.naver.com/twomatches?Redirect=Log&logNo=222532218547,"상추도 싱싱하다수원본점 이 있고 동탄점이 있는이서방왕족발보쌈족발 특대자, 대자, 중자, 소자... 옛날족발이서방왕족발옛날족발이라고 칭한 이유는 어머니가 맛있다고, 옛날족발 st라고 칭찬해 주셔서... ",징니의 블로그,https://blog.naver.com/twomatches,2021-10-09
 수원족발 맛집이서방왕족발보쌈본점#빙수족발,https://blog.naver.com/edaisye?Redirect=Log&logNo=222035926844, 수원족발 하면이서방 왕족발 보쌈 이 가장 먼저 뜨던데 역시나 손님이 많았어요 !! 구글에서 검색 해도 후기가 많더라고요 ㅎㅎㅎ 보니까 족발 보쌈 은 물론 있고 절약형보쌈 도 있는데 저는 날이 좀 더워서... ,ʕ´•ᴥ•`ʔ,https://blog.naver.com/edaisye,2020-07-20
