title,link,description,bloggername,bloggerlink,postdate
 수원보쌈맛집 권선동 SINCE1993이서방왕족발보쌈 ,https://blog.naver.com/lhj815200?Redirect=Log&logNo=222278350017,"저는수원본점 에서 포장 해왔는데, 동탄에도이서방왕족발보쌈또 있나 보더라구요. 퇴근후 기다림끝에수원보쌈맛집의 그맛! 이제야 봅니다. 따뜻한 온기의 고기 와 살얼음동동 그대로 막국수 맛 을 볼 수... ",날아라츄파춥스,https://blog.naver.com/lhj815200,2021-03-17
세류동 족발이서방왕족발보쌈본점족발 맛집,https://blog.naver.com/hy4165?Redirect=Log&logNo=221826001949,#세류동족발 #족발맛집 #권선동족발 # 수원 시청역족발 # 이서방왕족발본점#세류동맛집 #세류동족발맛집 족발 귀신인 저는 세류동 족발 맛집이서방왕족발보쌈본점다녀왔어요! https://m.booking.naver.com/booking... ,Da eun,https://blog.naver.com/hy4165,2020-02-26
[ 수원 맛집]이서방왕족발보쌈본점세류동!! 불족발 족발 후기,https://blog.naver.com/saykmkm?Redirect=Log&logNo=221816896786,좋네유 ㅎㅎ 가끔 야식으로 시켜먹기 딱 좋은 곳인 것 같아여!!! ㅎㅎㅎ수원 사시는 분들 한번쯤 도전해보세용 ㅎㅎ 그럼 안 뇽 # 수원 맛집 # 수원 야식 # 수원 족발 # 수원보쌈# 수원이서방왕족발보쌈# 이서방왕족발보쌈 ,잘먹고 잘사는 사람,https://blog.naver.com/saykmkm,2020-02-20
동탄 엔터식스 맛집이서방왕족발보쌈동탄점 추천!,https://blog.naver.com/yoorican?Redirect=Log&logNo=221736573854,"족발은 언제 먹어도 질리지 않는것 같음,,수원 본점 은 집에서도 가끔 족발 먹고 싶을때 배달도 시켜 먹는데 동탄점은 처음들렸다 반송동 개나리공원 먹자골목에 자리하고 있는이서방왕족발보쌈동탄점은... ",별초로롱의 세상이야기 ...,https://blog.naver.com/yoorican,2019-12-13
[ 수원권선동 맛집]이서방왕족발보쌈/ 빙수족발 파는 곳,https://blog.naver.com/himalaya7305?Redirect=Log&logNo=222469166598," 수원 에본점 , 동탄에 분점을 두고 있어서수원 이나 동탄회식장소로 소규모로 방문했을때 먹기 좋은 메뉴도 많더라구요 :)이서방왕족발보쌈나무가 너무 크게 자라서 간판을 찍을 수 가 없었던.... 대중교통을... ",Jikwon's Food Blog,https://blog.naver.com/himalaya7305,2021-08-14
[경기수원 ]족발 맛집/야들야들 족발은이서방왕족발보쌈본점 ,https://blog.naver.com/wjdal5502?Redirect=Log&logNo=221951798484,"소문난이서방왕족발 을 주문하였어요 -3,000원 포장할인 받았어요 완전푸짐~~~~ 그니저나 왜 똑같은게... 맛이에요수원족발 맛집을 찾으신다면 강력 추천드려요 # 수원 맛집 # 수원 배달족발맛집 #배달족발... ",아기천사 서하와 봄이의 이야기,https://blog.naver.com/wjdal5502,2020-05-08
어마어마하게 맛있는수원' 이서방왕족발보쌈 ',https://blog.naver.com/fy1234567?Redirect=Log&logNo=20152124568, 수원 버스터미널 사거리 타이어뱅크 뒷길이서방왕족발보쌈 . 걸어서 2분정도..? 먹을 땐 몰랐는데 다시 보니본점 ..이네요ㅎㅎ 가게가 넓은 편은 아니였지만 밖에서 한눈에 보기에도 손님이 많길래 못먹는건가..... ,디-다이어리,https://blog.naver.com/fy1234567,2012-02-28
"방송탄 유명맛집, 인계동족발하면 이곳 ' 이서방왕족발보쌈 ( 본점 )'",https://blog.naver.com/hwa2152?Redirect=Log&logNo=222027391829,맛집이었다는ㅋㅋㅋㅋㅋ수원 족발 ' 이서방왕족발보쌈 ' 본격리뷰 시작해볼게영!이서방왕족발보쌈 ( 본점 ) 영업시간 : 매일 12시~23시이서방왕족발도착~~~! 저는 주린배를 부여잡고 금요일 늦은저녁 8시쯤에... ,꿈 많고 꿈 잡는 나의인생,https://blog.naver.com/hwa2152,2020-07-10
 수원족발이서방왕족발보쌈족발보쌈 에 막걸리 한잔,https://blog.naver.com/cjscjs0213?Redirect=Log&logNo=221966121214,족발 이서방족발보쌈 본점에 디녀왔어요. 수원 족발 이서방왕족발보쌈본점 경기 수원시 권선구 세권로... 수원 족발이서방왕족발보쌈 수원본점 은 3대 방송사에서 이미 맛집으로 인정한 곳이었어용. 수원시... ,인생은 아름다워 !,https://blog.naver.com/cjscjs0213,2020-05-16
"매교역 맛집,이서방왕족발보쌈본점 에서 족발 먹은 후기",https://blog.naver.com/lovenaeun1?Redirect=Log&logNo=221708012603,그래서 오빠랑 세류동/권선동과 거리가 멀지 않으 매교역 맛집을 검색하다가이서방왕족발보쌈본점 을... 사실 티브이에 방영된 곳을 잘 믿지 않는데이서방 왕복발 보쌈본점 은 꼭 믿어보셔도 된답니다:) 매교역... ,그남자와 함께하는 story,https://blog.naver.com/lovenaeun1,2019-11-14
 수원 족발맛집 회식장소로 좋은이서방왕족발보쌈 ,https://blog.naver.com/idsun51?Redirect=Log&logNo=222142929632,"# 이서방왕족발보쌈 메뉴 클릭해서 보세요 테이블에 앉았으니 주문을 해야죠. 20년의 노하우가 들어가 다른 족발맛집,이서방 족발 보쌈 은 기본 메뉴뿐 아니라 다양한 메뉴가 맛있어서 유명해요. 하지만 아이들과... ",즐거운 생활 :),https://blog.naver.com/idsun51,2020-11-13
 수원맛집 /수원보쌈맛집... 맛집 _수원이서방왕족발보쌈 ,https://blog.naver.com/dearhey?Redirect=Log&logNo=220053370108,"다녀왔어욤~이서방왕족발보쌈 은수원 에서보쌈 이랑 족발 맛집으로 유명해요~동탄에도 직영점이... 깔끔했어요~수원세류동본점주소와, 동탄점 주소에요~ 참고하시면 좋을 것 같아요~ 더위 잘 안타는 제가... ",청순혜월드,https://blog.naver.com/dearhey,2014-07-07
실먹방후기/수원족발추천이서방왕족발보쌈포장추천... ,https://blog.naver.com/yyy6521?Redirect=Log&logNo=222073157206,족발 보쌈에는 빼놓을 수 없는 조합인 막국수도 놓치지마시고 꼭드세요 ㅎㅎ 완전 이색적인 이서방왕족발보쌈 빙수족발 완전 추천드립니당 이서방왕족발보쌈 위치이서방왕족발보쌈 수원본점 은 인계동끝자락... ,❤️보여주는 일기장❤️,https://blog.naver.com/yyy6521,2020-08-28
화성 동탄 맛집이서방왕족발보쌈동탄점,https://blog.naver.com/jihye_hello?Redirect=Log&logNo=222520014946,"푸짐~~^^수원 본점 과 동탄점 두 지점이 있네요!이서방왕족발보쌈마침 우리 아빠도이서방 이지 뭐예요 허허허 사장님의 감동적인 멘트는 사랑입니다~~ 족발,보쌈 , 막국수, 찐만두, 쌈, 무말랭이, 김치, 콘... ",설롱이네˚‧♪⁺꒰∗❛ᴗ❛∗꒱˚೫‧*,https://blog.naver.com/jihye_hello,2021-09-28
 수원맛집이서방왕족발 보쌈 ,https://blog.naver.com/onlyju0707?Redirect=Log&logNo=220997963421,수원모범음식점이라는 문구가 입장전부터 기대하게 만들던 곳이다이서방왕족발보쌈 수원 본점 ... 배부르다면서 다 먹어버렸다 하하하 수원 맛집 중 족발 보쌈 생각난다면 이서방왕족발로 다음에도 가야겠음,풀리지않는신비,https://blog.naver.com/onlyju0707,2017-05-04
 수원 터미널맛집이서방왕족발보쌈 ,https://blog.naver.com/ppband7?Redirect=Log&logNo=100193177702,여기 이서방왕족발보쌈 어떠세요?^^ 무더운 여름밤 여기 야외 테이블에서도 가족과 친구와 족발과 보쌈에 맥주한잔 할 수 있잖아요~이서방왕족발보쌈 수원본점주소: 경기도 수원시 권선구 세류2동 1119-29,늘보M 늘보아제™박남수,https://blog.naver.com/ppband7,2013-08-01
[ 수원 ] 쫄깃한 족발을 찾는다면 ‘ 이서방왕족발보쌈 ’,https://blog.naver.com/ljh910426?Redirect=Log&logNo=222494727880,"안녕하세요, 오늘은수원 맛집 소개를 하려고 합니다 #이사방 왕족발보쌈수원본점이에요!본점 이라는 말이 있다는 것 자체로도 맛보장일 것 같은 기분! 동탄회식장소,수원 회식장소로 딱일 것같은 느낌적 느낌... ",SONG X LEE,https://blog.naver.com/ljh910426,2021-09-04
세류동 족발맛집이서방 왕족발보쌈포장 후기,https://blog.naver.com/pinkmom0112?Redirect=Log&logNo=222345300994,세류동 족발맛집 이서방 왕족발보쌈이서방왕족발보쌈 수원본점경기도 수원시 권선구 세권로 134 031... 족발맛집 이서방왕족발은 수원회식장소 찾으실 때 인생족발 그리고 보쌈을 맛보고 싶을 때 가족끼리... ,핑쿠의 먹상 기록♡,https://blog.naver.com/pinkmom0112,2021-05-10
 수원 족발맛집이서방 족발 보쌈 수원본점 :: 포장해서 먹은 야식,https://blog.naver.com/fullmoonwosagasite?Redirect=Log&logNo=222461887494,맛이네요 수원족발맛집 처음 주문해봤는데 만족스러웠습니다이서방왕족발보쌈 수원본점주소... 0507 1373 5515 #수원족발맛집 #수원보쌈맛집 #권성동맛집 #이서방족발보쌈 #수원회식장소 #수원맛집 #인생족발,Acme,https://blog.naver.com/fullmoonwosagasite,2021-08-08
 수원 족발 세류동맛집권선동... 맛집이서방 왕족발 보쌈,https://blog.naver.com/jinjoo0426?Redirect=Log&logNo=222038145900,안녕하세요 ~~ 오랫만에보쌈생각이 나서 한가한 시간에 간식 먹을겸이서방 왕족발 보쌈 집으로 갑니다이서방왕족발보쌈본점주소 경기도수원 시 권선구 세류동 1075-10 (세권로 134)대영빌딩 전화 031 - 233 - 5515... ,오늘보다 더 예쁜 내일을 위해,https://blog.naver.com/jinjoo0426,2020-07-22
 수원세류동 불족발/ 보쌈맛집!이서방왕족발보쌈추천!,https://blog.naver.com/woawoa1115?Redirect=Log&logNo=221845447119," 수원세류동 불족발/ 보쌈맛집!수원세류동에 있음! 세류동이서방왕족발보쌈 이본점 이고, 동탄에도 있음 여기서 친구가 예전에 일을 했는데, 그때 정말 맛있었다고 해서 이번에 왔음 ㅋㅋ 지하주차장 있음!... ",슈퍼마리오,https://blog.naver.com/woawoa1115,2020-03-09
" 수원족발 배달 , 이서방왕족발보쌈:: 세류동 족발배달 맛집... ",https://blog.naver.com/lovelyvocal?Redirect=Log&logNo=221804991687, 이서방왕족발보쌈본점경기수원 시 권선구 세권로 134 // 세류동 1075-10 # 수원 족발맛집 # 수원 족발배달 #세류동족발 # 수원 족발배달 # 수원 배달맛집 #세류동맛집 #권선구족발 #세류동족발 #세류동족발맛집 # 수원 족발... ,일상이 축제,https://blog.naver.com/lovelyvocal,2020-02-11
세류동 족발보쌈ㅡ이서방왕족발보쌈본점 ,https://blog.naver.com/sj871225?Redirect=Log&logNo=221788194808,방문포장시 3천원 할인이니 참고하세요. # 수원 회식장소 #세류동족발 #곡반정동맛집 #권선동맛집 # 수원 시청역맛집 #곡반정동족발 # 수원 고깃집 #꿀잠이엄빠 # 이서방왕족발보쌈 ,꿀잠이를 키우며 같이 성장하는 꿀잠이엄빠,https://blog.naver.com/sj871225,2020-01-29
[ 수원 족발맛집] 다수의... 소개된 세류동맛집이서방왕족발보쌈 ,https://blog.naver.com/vogue8205?Redirect=Log&logNo=221816008135,ㅎㅎㅎㅎ수원 에서 볼일보고 족발맛집 검색!!! 이곳저곳 찾아보고간이서방왕족발보쌈본점 ... 곡반정동족발# 수원 고깃집 # 이서방왕족발보쌈# 수원이서방왕족발보쌈#족발맛집# 수원 족발# 수원 족발 보쌈 전문점,깜유랜드,https://blog.naver.com/vogue8205,2020-02-19
 수원 맛집 ] 쫄깃쫄깃한 족발이 일품인이서방 왕족발 보쌈 ,https://blog.naver.com/maroon119?Redirect=Log&logNo=60210959503,ㅋㅋㅋㅋㅋ이서방 왕족발 집 짱맛있다고 했더니 기대가 컸나봐요 ! *_* 역시 사람은 많더라구요 북적북적 ~수원 본점 과 똑~같은 메뉴판 ! ㅋㅋ 저는 여기서 족발밖에 안먹어봤지만보쌈 도 맛있다고 하더라구요... ,봄아 어서와 :),https://blog.naver.com/maroon119,2014-03-13
동탄맛집:이서방왕족발보쌈모임!!,https://blog.naver.com/sunrose81?Redirect=Log&logNo=100186538835," 이서방왕족발보쌈 수원 에도이서방왕족발보쌈 이 있다는데요 거기가본점 이고 여기는 아드님이... ㅋㅋㅋㅋ 저흰 족발, 마늘 보쌈 , 양념족발을 주문했는데요 인원이 여러명이라 작은 사이즈로 다양하게... ",까멜리아 Sweet Dream,https://blog.naver.com/sunrose81,2013-04-23
 수원 맛집/세류동 “ 이서방왕족발보쌈 ”에서 엄마랑 야식,https://blog.naver.com/j_jh_?Redirect=Log&logNo=221896823638,어제 퇴근 하고 찾은 수원 세류동의 족발 맛집!이서방왕족발보쌈 수원본점한 페이지 요약 컷... 퇴근하고 엄마랑 찾아간 이서방왕족발보쌈. 외관의 모습인데 사진이 빛번짐이 왜이렇게 심하지?ㅜㅜ 어쨌든... ,뎨일리트립★,https://blog.naver.com/j_jh_,2020-04-08
권선동 맛집이서방왕족발보쌈방문 포장 해 먹음,https://blog.naver.com/pheyjin?Redirect=Log&logNo=222081857290,맛집이서방왕족발보쌈집에서 방문 포장으로 족발이랑 막국수 사다 먹음 :-) 1993년 오픈해 27년이나 된 전통(?) 있는 족발집으로 다양한 매스컴을 타수원 에서는 제법 소문난 곳으로수원 본점 과 동탄점 2곳으로... ,인생은 작은 행복들로 가득하다,https://blog.naver.com/pheyjin,2020-09-06
곡반정동 맛집 곡반정동 족발이서방왕족발보쌈 ,https://blog.naver.com/zxcvb8802?Redirect=Log&logNo=222057142204,저는 두번째 방문인데 지난번 방문하고 너무 맛있어서 이번에 또 가봤어요 이서방왕족발보쌈에서는 수원페이 사용이 가능합니다 곡반정동 맛집 곡반정동 족발이서방왕족발보쌈 수원본점매장 내부... ,당근블로그,https://blog.naver.com/zxcvb8802,2020-08-11
세류동맛집:)이서방왕족발보쌈 ,https://blog.naver.com/hippystyle?Redirect=Log&logNo=187300902,"2013.05.15수원세류동에서 족발로 유명한이서방 왕족발보쌈본점 에 다녀왔어요 :) 선아언니가, 여기... 냠냠♥이서방왕족발 집의 족발의 특징은!!! 쫀득쫀득한 식감 +_+♥보쌈 이나 족발은 상추에 고기두어점... ",The Unique Life,https://blog.naver.com/hippystyle,2013-05-15
 수원세류동 권선동 족발보쌈맛집 추천 ' 이서방왕족발보쌈 ',https://blog.naver.com/rmsgkrdnjs?Redirect=Log&logNo=221729169883,세류동맛집 / 권선동맛집수원세류동 권선동 족발보쌈' 이서방왕족발보쌈 ' 때깔 고운 족발과보쌈 ... - 세류동맛집이서방왕족발보쌈영업시간 - 매일 12:00 - 23:00 -이서방왕족발보쌈본점연락처 - 031-233-5515... ,대흥이의 일상이야기,https://blog.naver.com/rmsgkrdnjs,2019-12-06
[ 수원 /권선동 족발맛집] 꽃게탕주는 족발맛집 ' 이서방왕족발보쌈 ',https://blog.naver.com/0owjdalso0?Redirect=Log&logNo=221771878262,"[ 수원 /권선동,세류동] 꽃게탕주는 족발맛집 ' 이서방왕족발보쌈 ' 집 근처에 족발집이 있는데 '꽃게탕 무료'로 준다는 말에 홀려서 간이서방왕족발 입니다.이서방왕족발보쌈본점권선동이 족발로 유명한 거... ",세상 모든 이야기,https://blog.naver.com/0owjdalso0,2020-01-14
 수원 족발 권선동 맛집이서방왕족발보쌈부드러운보쌈 먹으러 ~ !!,https://blog.naver.com/lecaf7381?Redirect=Log&logNo=222013716291,건물지하에 주차장 있어요 주차편리한것이 최고여 ~이서방왕족발보쌈본점경기도수원 시 권선구... 맛집이서방 왕족 보쌈 에서 먹어본보쌈 .. 정말 부드럽고 맛있게 잘 먹었습니다. 가게자체가 커서 단체회식... ,쫀시네,https://blog.naver.com/lecaf7381,2020-06-27
 수원 족발이서방왕족발보쌈굿초이스,https://blog.naver.com/godbluesmy?Redirect=Log&logNo=222195657111,세류동 ( 본점 ) 포장 하러 왔구요 맛집에 기본 모범음식점 아시죠?ㅎㅎㅎ 방송탔던 기록들.jpg 족발 소... (다섯개 만점기준) ★★★★ 위치 ↓↓↓ # 수원# 이서방왕족발보쌈#족발맛집 #족발 # 보쌈# 수원 맛집... ,유정의 술맛나는 인생,https://blog.naver.com/godbluesmy,2021-01-04
[ 수원 /권선동/맛집]이서방왕족발보쌈 ,https://blog.naver.com/qwerola?Redirect=Log&logNo=222065739399, 보쌈만족스러원던이서방 족발 먹방! 집이랑 가까워서 더 좋고 손님들 오면 데리고 가볼생각이다. 나중에는 일반족발을 꼭 먹어봐야겟다수원족발맛집으로 완전 추천! 권선동 맛집이서방왕족발보쌈 으로 고고,NOBBOONG,https://blog.naver.com/qwerola,2020-08-20
" 보쌈 맛이 끝내줘요, 동탄이서방왕족발보쌈 ",https://blog.naver.com/dankong_63?Redirect=Log&logNo=140211391502,"동탄센트럴파크맛집 ::보쌈 맛이 끝내줘요, 동탄이서방왕족발보쌈 수원유명 족발집인... 동탄점은 생긴지 얼마 안 된것 같던데, 방송이력들은 아마도본점이력이겠죠? 빨리보쌈 이나 나왔으면... 밑반찬... ",단콩로그,https://blog.naver.com/dankong_63,2014-04-28
[경기/ 수원 ] 권선구 족발 맛집 추천이서방왕족발보쌈 ,https://blog.naver.com/wmelon29?Redirect=Log&logNo=222122506847,가게가본점 이고 동탄에도 분점이 있었어요! 가게내부는 좌식으로 되어있었는데 깔끔하고 룸 으로... 권선동 족발 맛집 추천이서방왕족발보쌈위치는 경기도수원 시 권선구 세권로 134 입니다... ,W.melon's nice day,https://blog.naver.com/wmelon29,2020-10-21
"야들야들 부드러운 동탄족발맛집,이서방왕족발보쌈동탄점",https://blog.naver.com/limzzang1015?Redirect=Log&logNo=222191527629,그리고 내가 간곳은 동탄점이었지만수원본점 도 있다고한다 경기지역화폐 사용도 가능하다 족발 한상차림 아 너무 먹음직스럽다 족발 윤기가 장난아니다 국내산 생족발만 사용한다는데 그래서그런지 냄새도... ,후이린,https://blog.naver.com/limzzang1015,2020-12-31
 수원 족발은이서방왕족발보쌈 이 최고!,https://blog.naver.com/carmanjoon?Redirect=Log&logNo=221058901937,유명한이서방왕족발보쌈 ! 내가 다녀온 곳은수원본점 이다. 우와 유명한곳이였구나! 국내 3대...이서방왕족발보쌈메뉴 가격! 신메뉴 코다리빙수냉채족발도 있고 포장시 할인된 가격으로 족발 보쌈 을 즐길 수... ,혜져이의 브ㄹ로그,https://blog.naver.com/carmanjoon,2017-07-24
 수원보쌈맛집이서방왕족발보쌈 에서 마늘 보쌈먹고왔어요,https://blog.naver.com/anjy486?Redirect=Log&logNo=220750479746, 이서방왕족발보쌈본점 이예요보쌈잘하기로 소문난 세류동맛집이라고 해서 한번 방문해봤답니다수원이서방왕족발보쌈메뉴랍니다~ 저희는 배가 심하게 고팠던지라 마늘 보쌈大자로 주문했어요보쌈 을... ,맛있고 예쁘고 신나는 블로그,https://blog.naver.com/anjy486,2016-07-01
동탄맛집이서방왕족발보쌈개나리공원으로!,https://blog.naver.com/dongtanskin?Redirect=Log&logNo=220881895143,동탄 족발 보쌈맛집이서방왕족발보쌈다녀왔어요~! :) 오랜만에 족발 보쌈 이 먹고 싶어서 방문한... 동탄맛집이서방왕족발보쌈 은수원본점 과 개나리공원에 있는 동탄점이 있어요. 그리고 포장 배달이... ,"아름다움의 시작, 청담 맑은 피부과",https://blog.naver.com/dongtanskin,2016-12-09
