title,link,description,bloggername,bloggerlink,postdate
세류동맛집이서방왕족발보쌈 수원본점언제 먹어도 맛있음,https://blog.naver.com/lgh3670?Redirect=Log&logNo=222531775102,이서바왕족발보쌈 수원본점 세류동맛집 매장에서 직접 먹는게 가장 맛있겠지만 포장해서 먹어도... 힘내세요~~ #이서방왕족발보쌈 # 이서방왕족발보쌈수원본점#세류동맛집 #세류동족발맛집 #세류동보쌈맛집,소소한 일상에서의 행복찾기,https://blog.naver.com/lgh3670,2021-10-09
 수원 족발맛집 :: 부모님이랑이서방왕족발보쌈본점다녀왔어요!,https://blog.naver.com/mhyesu?Redirect=Log&logNo=222015498808,족발보쌈 느낌이라 이서방 다녀왔어요. 세류동에 있는 이서방왕족발보쌈집! 수원에서는 티비에도...이서방왕족발보쌈 수원 본점메뉴가격 Previous image Next image 사진을 옆으로 넘기세요! 반반메뉴 _ 두분 다... ,물음표 일상 :),https://blog.naver.com/mhyesu,2020-06-29
곡반정동 맛집이서방왕족발보쌈 수원본점 소문난 집,https://blog.naver.com/yoorican?Redirect=Log&logNo=221707030338,"소문난이서방왕족발보쌈 수원본점 .. 수원사는 사람들은 모르는 사람들이 없을듯, KBS 생생정보통등 유명 방송 3사에도 출연했던 알아주는 맛집이다 예전에 집에서 배달로 가끔 시켜 먹었었는데 오늘은 본점... ",별초로롱의 세상이야기 ...,https://blog.naver.com/yoorican,2019-11-13
세류동맛집 세류동족발맛집이서방왕족발보쌈 수원본점 ,https://blog.naver.com/qooqoo15?Redirect=Log&logNo=222270721924,욕심부렸네요이서방왕족발보쌈 은보쌈 도 기름부분/ 살코기 또는 반반 선택 할수있어요 저는 뭐든 반반을 좋아해서보쌈 도 반반을 선택! 정말 살코기있는 부분과 기름 적당히 부분과 반반 섞어보내주셨어요... ,라봉이와 함께하는 소소한 일상♡,https://blog.naver.com/qooqoo15,2021-03-10
[세류동족발맛집이서방왕족발보쌈 수원본점 ] 막국수는 필수!!,https://blog.naver.com/kyouran?Redirect=Log&logNo=222216685861,여기가 바로수원족발 맛집입니다 여러분! 제가 주문한건 반반메뉴에요 바로 요거! 반반메뉴 대짜 45000원이에요! 여기에 막국수나 생굴추가~보쌈 도하기 때문에 여러사이드를 추가할 수 있어요 :) 쟁반국수... ,홍대토끼이야기,https://blog.naver.com/kyouran,2021-01-22
 이서방 왕족발 보쌈 수원 본점후기,https://blog.naver.com/tkdtkdgns1?Redirect=Log&logNo=222504650176,안녕하세요 오늘은 세류동 보쌈 맛집이서방 왕족발 보쌈 수원 본점직접 다녀온 후기와 메뉴 가격... 인심이 참 좋은 이서방 왕족발 보쌈 세류동 수원 본점! 이서방 수원 왕족발 보쌈 세류동 보쌈 맛집으로... ,★훈쓰블로그,https://blog.naver.com/tkdtkdgns1,2021-09-14
수원족발 맛집::이서방왕족발보쌈 수원본점 에서 반반족발... ,https://blog.naver.com/lovely9425?Redirect=Log&logNo=222153579411,족발보쌈 맛집 이서방왕족발보쌈!이서방왕족발보쌈 수원본점위치는 경기도 수원시 권선구 세류동 1075-10 큰길가쪽에 위치해있어요! 자세한 위치는 링크를 통하여 확인! 주차공간은 지하1층 주차장에 하면... ,story바이핫나,https://blog.naver.com/lovely9425,2020-11-24
세류동 맛집이서방왕족발보쌈 수원본점 의 마늘보쌈,https://blog.naver.com/sanghun2080?Redirect=Log&logNo=222218505714,"요거 보면이서방왕족발보쌈 수원본점 은 서비스가 참 혜자에요. 퀄리티도 물론 좋구요. 그리고 우리의 메인.. 세류동 맛집인 이서방왕족발보쌈의 보쌈 (중)! 39,000원 입니다. 서비스도 모자라서 보쌈마저 양이... ",Funny 감성 터지는 형제,https://blog.naver.com/sanghun2080,2021-01-24
세류동족발맛집이서방왕족발보쌈 수원본점 에서 족발포장해먹기,https://blog.naver.com/carroth888?Redirect=Log&logNo=222500550843,보쌈맛집 #세류동족발맛집 #권선동맛집 #이서방족발보삼수원본점 #동탄회식장소 #이서방왕족발보쌈동... 전체적으로이서방왕족발보쌈 수원 본점 은 음식에 진심이신 분같음.. 이런 점까지 다 신경 써서... ,홍로그,https://blog.naver.com/carroth888,2021-09-09
[ 수원족발 맛집]이서방왕족발보쌈본점후기,https://blog.naver.com/qlqldbf?Redirect=Log&logNo=221822430862,족발 보쌈 을 먹으러 다녀왔습니다~이서방왕족발보쌈본점경기수원 시 권선구 세권로 134 http://naver.me...수원족발 세류동 맛집 권선동 맛집 곡반정동 맛집이서방왕족발수원본점맛있는 족발이 땡기실때... ,반짝반짝 빛나는 :),https://blog.naver.com/qlqldbf,2020-02-24
주말점심으로 족발먹기 _이서방왕족발보쌈 수원본점 ,https://blog.naver.com/skich?Redirect=Log&logNo=221796271278,족발먹기 _이서방왕족발보쌈 수원본점고기를 좋아하는 우리 가족^^ 보쌈은 집에서 할수 있지만... 곡반정동맛집 이서방왕족발보쌈은 수원본점이니 지역을 헷갈리지 마세요!! 점심시간에 방문했지만 12시가... ,영미샘의 재미있는 노마드 이야기,https://blog.naver.com/skich,2020-02-04
매교역 맛집 중에 최고이서방왕족발보쌈 수원본점 ,https://blog.naver.com/dailyara?Redirect=Log&logNo=221977247116,맛집이서방왕족발보쌈 수원본점 에다녀왔는데 만족스럽게 먹고 후기도 남겨요!맛있는 곳은 잇님들과... 벽에는 보쌈과 족발의 효능은 물론이고이서방왕족발보쌈 메뉴 소개가 적혀있었어요또한 국내산 생족을... ,데일리아라,https://blog.naver.com/dailyara,2020-05-24
수원 보쌈 맛집이서방왕족발보쌈 수원본점아... ,https://blog.naver.com/nezy115?Redirect=Log&logNo=222537488977," 수원이서방왕족발보쌈후기 요즘 족발 보쌈 에 중독된 우리 ㅎㅎㅎ 거의 1주일에 한 번씩은 먹는 것 같다! 근데 아무리수원보쌈맛집이란 곳을 다 돌아다녀도, 역시나 나의 고향 권선동^^ 근처에 있는 세류동... ",갬성을 걷는 ❤ NezyTime,https://blog.naver.com/nezy115,2021-10-15
" 수원맛집,이서방왕족발보쌈본점 ",https://blog.naver.com/shh5487?Redirect=Log&logNo=222164909902,#수원맛집 #이서방왕족발보쌈본점 #수원족발추천 #세류동맛집 #수원족발맛집 #수원고깃집 #수원보쌈 맛집 안녕하세요 찌느녜입니다ღ 'ᴗ' ღ 오늘은이서방왕족발보쌈 수원 본점 에 다녀왔습니다. 본점이라고... ,찌느녜 소소한 일상거리,https://blog.naver.com/shh5487,2020-12-06
수원 족발 맛집이서방 왕족발 보쌈 수원본점 ,https://blog.naver.com/wino_g?Redirect=Log&logNo=222209928352,수원 족발 맛집이서방 왕족발 보쌈 수원본점외관으로만 봐도 엄청 엄청 크다 ㅋㅋㅋ 홀도 엄청 컸다...ㅋㅋㅋㅋ 우리는 포장할거라서 호다닥 포장만하고 나왔다! 이서방 왕족발보쌈도 네이버 예약돼서... ,음주요정의 블로그,https://blog.naver.com/wino_g,2021-01-19
"수원 보쌈 맛집, 세류동 맛집이서방왕족발보쌈 수원본점 ",https://blog.naver.com/ri_nyy?Redirect=Log&logNo=222476186263,"세류동이 본점이고, 이서방왕족발보쌈 동탄점도 있으니까 참고해주세요! 수원 보쌈 맛집, 세류동 맛집이서방왕족발보쌈 수원본점세류동, 권선동에 사시는 분들이라면,이서방왕족발보쌈 수원본점 을 다들... ",리니의하루,https://blog.naver.com/ri_nyy,2021-08-19
권선동 맛집 반반족발 최고봉이서방왕족발보쌈 수원본점 ,https://blog.naver.com/v_v77777?Redirect=Log&logNo=222397450063,"족발 보쌈들도 많아서 진짜 아.. 여기.. 수원 보쌈 찐맛집이구나 했습니다. 권선동 맛집 이서방족발보쌈... 수원 회식장소로 진짜 너무너무 좋은 곳, 수원 보쌈,족발 맛집!이서방왕족발보쌈 수원본점강추해요!... ",@6.january/28살 평택직장인/접접박사,https://blog.naver.com/v_v77777,2021-06-14
세류동 맛집)이서방왕족발보쌈 수원본점- 방송에 나왔던 그 때... ,https://blog.naver.com/tometome123?Redirect=Log&logNo=222507749651," 이서방왕족발보쌈 수원본점매일 12 : 00 - 23 : 00 경기 수원시 권선구 세권로 134, 세류동 1075-10 TEL: 031-233... 최근에는 보쌈 족발이 왜 이렇게 비싸졌는지 모르겠어요ㅠㅠ 수원 세류동족발맛집 이서방왕족발보쌈은... ",오리왕의 수라상,https://blog.naver.com/tometome123,2021-09-16
수원 권선동 맛집이서방왕족발보쌈 수원본점굴보쌈으로... ,https://blog.naver.com/yang0653?Redirect=Log&logNo=222135154553,"굴보쌈, 반반메뉴 등이 메인메뉴로 있었는데 수원 권선동맛집 이서방 왕족발보쌈에서는 빙수족발과... 수원 권선동 맛집이서방왕족발보쌈 수원본점굴보쌈으로 겨울나기 업체로부터 지원 받았지만 솔직하게... ",쩍이의 즐겨찾기^____^,https://blog.naver.com/yang0653,2020-11-04
수원 족발 맛집::세류동... 유명한이서방왕족발보쌈 수원본점 ,https://blog.naver.com/mjdog?Redirect=Log&logNo=222467185276,"특이한점은 이서방왕족발보쌈만 따뜻한 족발, 식은 족발 선택하는 칸이 있더라 나같이 뜨거운거... 수원본점으로 고고씽!!! #세류동맛집 #수원족발맛집 #수원보쌈맛집 #세류동족발 # 이서방왕족발보쌈수원본점 ",Sam's❤️blog,https://blog.naver.com/mjdog,2021-08-12
"[식당]이서방왕족발보쌈 수원본점 , 생생정보통 수원 세류동... ",https://blog.naver.com/ssong306?Redirect=Log&logNo=222428704128,#수원세류동맛집 #세류동맛집 #수원족발맛집 #수원보쌈맛집 #세류동족발맛집 #세류동맛집추천 #세류동보쌈맛집 #세류동이서방왕족발보쌈 # 이서방왕족발보쌈수원본점#수원이서방왕족발보쌈 #이서방왕족발보쌈... ,온앤오프,https://blog.naver.com/ssong306,2021-07-12
"수원 족발 맛집,이서방왕족발보쌈 수원본점 !",https://blog.naver.com/o0u0o_?Redirect=Log&logNo=222306679483,왠만한 방송에는 다 나왔네요ㅎㄷㄷ수원 에서 사실 족발 검색하면이서방 이 일단 탑클래스로 먼저 뜨긴 떠요!! ㅋㅋ 엄청 유명한거죠!! 세류 본점 만 있는 줄 알았는데 동탄점도 있더라구요~ 홀은 상당히 넓어요!!... ,땡글한 일상,https://blog.naver.com/o0u0o_,2021-04-12
세류동맛집이서방왕족발보쌈 수원본점 ,https://blog.naver.com/memory_hada?Redirect=Log&logNo=222236166533,세류동족발맛집 이서방왕족발보쌈은 포장을 해서 집에서 즐겨도 맛있답니다. 족발과 보쌈은 가게마다 맛의 차이가 큰 편이라 맛있게 먹은 곳만 다시 찾아가게 되는 것 같아요.이서방왕족발보쌈 수원본점 이... ,memory_hada,https://blog.naver.com/memory_hada,2021-02-08
[수원 세류동] 쫀득쫀득한... 맛집이서방왕족발보쌈 수원본점 ,https://blog.naver.com/dms7gml?Redirect=Log&logNo=222463337359,직원분들이 친절하게 응대 해주시니까 너무 좋아요~수원족발 맛집이서방왕족발 은 배달이 많아서...수원 족발맛집 # 이서방왕족발보쌈#존맛 #세류동족발맛집 #족발 # 보쌈#배달 #족발촉촉 # 보쌈 촉촉... ,햄님이 블로그,https://blog.naver.com/dms7gml,2021-08-09
세류동맛집이서방왕족발보쌈 수원본점(반반세트 中 후기),https://blog.naver.com/silvermi86?Redirect=Log&logNo=222347871363,세류동맛집 이서방왕족발보쌈의 절약형 족발을 먹으면 좋을 듯 하다.이서방왕족발보쌈 수원본점031... 마늘이랑 새우젓 올려서 무말랭이랑 같이 먹는 세류동맛집 이서방왕족발 수원본점 족발보쌈 반반세트!... ,밍키&세리 언니네:),https://blog.naver.com/silvermi86,2021-05-12
수원 족발 세류동 맛집이서방왕족발보쌈 수원본점족발+불족... ,https://blog.naver.com/leekangmi89?Redirect=Log&logNo=222244851968,경기본점 포장후기 남겨볼께요 :)이서방왕족발보쌈 수원본점영업시간 12:00 - 23:00 031-233-5515 세류동 맛집 이서방왕족발보쌈은 수원 버스터미널에서 멀지 않은 곳에 위치하고 있더라구요 수원역 근처 볼일 보고... ,"안녕, 낯선사람 :)",https://blog.naver.com/leekangmi89,2021-02-15
수원 족발 맛집이서방왕족발보쌈 수원본점: 보쌈+불족,https://blog.naver.com/kkw2kky?Redirect=Log&logNo=221871033941,수원 족발 맛집이서방왕족발보쌈 수원본점보쌈과 불족발 절반씩~ 소 자(가격:35.0)입니다. 한 접시에... 수원시 모범업소이고 잔반 재활용 안 한대서 더 믿음이~ 수원 이서방왕족발보쌈 강추합니다! 영업시간 12... ,쿱스의 하루하루,https://blog.naver.com/kkw2kky,2020-03-25
수원 권선구 맛집이서방왕족발보쌈 수원본점푸짐하게 먹었어요,https://blog.naver.com/luj3591?Redirect=Log&logNo=221725130576,배터지도록 푸짐하게 먹고온수원권선구 맛집 # 이서방왕족발보쌈♥️ 족발과보쌈 을 주문하면 꽃게탕을 주는 족발집이랍니닷-! 족발먹고 콜라겐 탱탱~~보쌈 과 족발에 빠질 수 없는 김치와 무말랭이~~ 사실... ,"돈 무리, 비 해피 ◡̈",https://blog.naver.com/luj3591,2019-12-02
"[경기/ 수원 ]수원세류동맛집,세류동족발맛집보쌈맛집... ",https://blog.naver.com/sohey11?Redirect=Log&logNo=222406150435,"권선동맛집 ,수원보쌈 맛집으로 유명한이서방왕족발보쌈집 방문해서 족발 포장해왔어요. 이사오고...수원세류동보쌈집으로 유명한 이유를 알겠어요 . 오랜만에 맛있게 먹은 # 이서방 족발 보쌈수원본점 ... ",쏘소한 기록 공간,https://blog.naver.com/sohey11,2021-06-22
세류동맛집이서방왕족발보쌈 수원본점후기,https://blog.naver.com/jinwoo586?Redirect=Log&logNo=222234378962,"이서방왕족발보쌈 경기 수원시 권선구 세권로 134 031-233-5515 매일 12:00 - 23:00 지하주차장 있음이서방왕족발보쌈 수원본점 은 이 동네에선 제법 인지도가 있는 곳이에요. TV 출연도 많이 하다보니 세류동 족발, 보쌈... ",가성비를 사랑하는 남자,https://blog.naver.com/jinwoo586,2021-02-07
수원 족발 맛집 세류동이서방왕족발보쌈 수원본점포장... ,https://blog.naver.com/sshanb?Redirect=Log&logNo=222429860812," 이서방왕족발 은 족발도 가득한데 밑에 뼈가 없이 고기만 들어 있어 더 좋다. 어느집은 주문하면 아래... 족발,보쌈안주삼아 시원하게~ 한잔!!수원족발보쌈맛집 찾으면이서방왕족발보쌈 에서...진짜 맛있당^^",사랑맘의 달콤한 하루~^^,https://blog.naver.com/sshanb,2021-07-13
[수원맛집] 세류동 맛집이서방왕족발보쌈 수원본점방문포장... ,https://blog.naver.com/sum_n_mu?Redirect=Log&logNo=222229519394,보쌈먹을까 족발먹을까 고민하다가 #굴보쌈 먹은 후기 들려드릴게요!이서방왕족발보쌈 수원본점영업시간12:00~23:00 0507-1373-5515 수원시 권선구 세류동 1075-10번지 1층 주차는요 #이서방왕족발보쌈주차 저는... ,밈로그,https://blog.naver.com/sum_n_mu,2021-02-02
세류동족발맛집이서방왕족발보쌈 수원본점 에서 포장했어요,https://blog.naver.com/h-y-e?Redirect=Log&logNo=222430389917,"있어요이서방왕족발보쌈 수원본점 은 수원시 모범음식점이에요 이서방왕족발보쌈은 동탄에 분점을... 족발,보쌈을 삶은이서방왕족발보쌈 수원본점 에서 가성비 좋고 양이 푸짐한 반반족발 주문해 먹어보세요!",#또바기의 공간,https://blog.naver.com/h-y-e,2021-07-13
수원 권선동 맛집 내 단골집이서방왕족발보쌈 수원본점 ,https://blog.naver.com/woodong2435?Redirect=Log&logNo=221704511947,"듯 보쌈과 수육이 술술 들어갑니다.이서방왕족발보쌈 수원본점 이 저희 집 근처에 있지만, 인기가 워낙... 상호명 : 이서방왕족발보쌈본점 찾아가는 길 : 수원시 권선구 세류동 1072-10 전화번호 : 031-233-5515... ",매칭이의 요기조기♪,https://blog.naver.com/woodong2435,2019-11-11
"권선구 맛집 -이서방왕족발보쌈 수원본점 , 족발리뷰",https://blog.naver.com/01117166657?Redirect=Log&logNo=221765004242,유명한 수원족발맛집 바로바로~~이서방왕족발보쌈 수원본점이에요 옛날부터 제가 여기... 최근 본점까지 섭렵하고 왔답니다~ 지금부터 리뷰를 시작해볼게용 권선구 맛집이서방왕족발보쌈 수원본점 의 위치는... ,먹순이의 여행블로그,https://blog.naver.com/01117166657,2020-01-09
[세류동맛집]' 이서방왕족발보쌈 '수원본점불족보쌈 반반 후기,https://blog.naver.com/dudwnvhrwn?Redirect=Log&logNo=222405738095,"세류동맛집 ' 이서방왕족발보쌈 ' 콘 샐러드, 마늘, 양파절임, 무말랭이, 김치, 쌈장, 새우젓이 기본 반찬으로 와요. 깔끔하게 잘 포장되어 있죠?보 쌈첫입-! 역시 김치가 잘 익어야 더 맛이 좋은데 맛있더라고요... ",심스틸러 heart stealer,https://blog.naver.com/dudwnvhrwn,2021-06-21
수원 족발 맛집이서방왕족발보쌈 수원본점 ,https://blog.naver.com/uiop3696?Redirect=Log&logNo=222177254026,족발과 보쌈이 생각나더라고요. 그래서 퇴근 후에 수원 족발 맛집이서방왕족발보쌈 수원본점 에... 다음은 이서방왕족발보쌈 메뉴판입니다. 뜨끈하게 삶은 족발도 먹고싶고 보쌈도 먹고 싶어서 반반메뉴(족발... ,어디서 누구랑 뭐할까,https://blog.naver.com/uiop3696,2020-12-18
 이서방왕족발보쌈 수원본점 ... 꽃게탕조차 맛있는 수원족발맛집,https://blog.naver.com/qkffos012?Redirect=Log&logNo=222167985932,"이서방왕족발보쌈은 서비스로 꽃게탕 또는 막국수를 주는 거로도 유명해요! #수원족발맛집... 세류동맛집이서방왕족발보쌈 수원 본점 은 을 총정리하자면 직원분들 친절하셔서 서비스 좋고, 그만큼 맛도 너무... ","서르니는 써리원, 일상",https://blog.naver.com/qkffos012,2020-12-09
동탄회식장소이서방왕족발보쌈 수원본점 은 역시 세류동 맛집,https://blog.naver.com/idscs1111?Redirect=Log&logNo=222483139243,동탄회식장소이서방왕족발보쌈 수원본점 은 역시 세류동 맛집 안녕하세요 오늘은 동탄회식장소 이서방왕족발보쌈에 한번 방문해 보았습니다.이서방왕족발보쌈 수원본점 은 세류동 맛집으로도 이미 입소문이... ,미러리스세상,https://blog.naver.com/idscs1111,2021-08-25
권선동 족발이서방왕족발보쌈 수원본점세류동 족발 맛집,https://blog.naver.com/jick99?Redirect=Log&logNo=221943056329,족발이서방왕족발보쌈 은 세류동에 위치해있어요! 주차는 건물 지하주차장에 가능하답니다 : ) 저희는 족발에 맥주 한잔하려고 차는 두고 왔어요이서방왕족발수원본점 은 맛집 소개 TV프로그램에 출연도 많이... ,ʏᴜɴ ʟᴏɢ ♩,https://blog.naver.com/jick99,2020-05-03
수원 족발 맛집이서방왕족발보쌈 수원본점후기(메뉴판),https://blog.naver.com/bananalove2?Redirect=Log&logNo=222354304355,수원 족발 맛집 가서 포장해왔어요!! 오랜만에 보쌈도 족발이랑 같이 먹은 날ㅎㅎ 이날 간 곳은 홀도... 오늘의 포스팅은 바로바로~~이서방왕족발보쌈 수원본점수원 족발 맛집 이서방왕족발보쌈 위치는... ,바나나하이킥,https://blog.naver.com/bananalove2,2021-05-17
수원 족발 맛집이서방왕족발보쌈 수원본점후기와 족발과... ,https://blog.naver.com/yeunhap_steel?Redirect=Log&logNo=221743101731,#수원족발 #수원족발맛집 #이서방왕족발보쌈 # 이서방왕족발보쌈수원본점#수원이서방왕족발보쌈 #권선구족발 #권선구족발맛집 #족발효능 #보쌈효능 형이 생일이어서 오랜만에 치얼스를 하러 수원으로 나들이를... ,홍련화,https://blog.naver.com/yeunhap_steel,2019-12-19
"택시맛객 대를 이어 만드는, 빙수족발이서방왕족발보쌈 수원본점 ",https://blog.naver.com/sallysuwon?Redirect=Log&logNo=222465976364,맛집 수원 족발 맛집이서방왕족발보쌈 수원본점기억하세요~ #협찬 #세류동맛집 #수원족발맛집 #수원보쌈맛집 #이서방족발 #이서방왕족발 #이서방보쌈 #세류동족발 #세류동왕족발 #보쌈 #야식 #세류동맛집... ,샐리수원,https://blog.naver.com/sallysuwon,2021-08-11
수원 족발 맛집이서방왕족발보쌈 수원본점 에서 야들야들... ,https://blog.naver.com/eternal22?Redirect=Log&logNo=221767324912,수원 족발 맛집으로 유명한이서방왕족발보쌈 수원본점리뷰입니다. 2대째 운영되고 있는... 수원 족발 맛집 이서방 왕족발보쌈이 참 좋은게 따뜻한 족발과 차가운 족발 중에 선택이 가능해서 취향껏 먹을 수... ,★ 가산분양맨★,https://blog.naver.com/eternal22,2020-01-11
사로잡은 수원족발맛집!! 세류동맛집이서방왕족발보쌈 수원본점 !!,https://blog.naver.com/erro99?Redirect=Log&logNo=222239766144,이번에는 수원 세류동이서방왕족발보쌈 수원본점 으로 방문포장하기로하고 차로 슝~~ 다녀왔어요!!... 생각나서 또 먹게 될 수원족발보쌈맛집 이서방왕족발보쌈!! 다음에는 울가족 절약형족발 맛있게 먹고... ,아이들의 멘토되기,https://blog.naver.com/erro99,2021-02-11
"권선동맛집,이서방왕족발보쌈 수원본점Since 1993",https://blog.naver.com/yoonhj5445?Redirect=Log&logNo=221769364513,수원 권선동에 각종 티비에 많이 나와서 이미 유명한이서방왕족발보쌈 수원본점족발보쌈 먹으러... 본점은 권선동에 있고 지점으로 동탄점도 있대요! 영업시간: 12:00~23:00 주소: 수원시 권선구 세류동 1075... ,유네지88,https://blog.naver.com/yoonhj5445,2020-01-12
수원 세류역 맛집// 이서방 왕족발 보쌈 ( 수원본점 ),https://blog.naver.com/lhk3508?Redirect=Log&logNo=222098892191, 수원족발 맛집수원세류역 맛집이서방 왕족발 보쌈오늘은 족발 먹은날수원온김에 요건 꼭 먹고 가자고 의견일치를 본곳수원족발맛집수원 세류동이서방왕족발보쌈 으로 고고~수원맛집으로... ,인천퀸 하우스 스토리,https://blog.naver.com/lhk3508,2020-09-24
수원 세류동족발맛집이서방왕족발보쌈 수원본점 ,https://blog.naver.com/jihye8482?Redirect=Log&logNo=222538899337, 이서방왕족발 에 들려 족발大 포장해왔습니다. 남동생이 예전에수원 족발맛집인데 진짜 맛있다면서 사온적이 있던 곳인데 마침 근처 지나갈 일이 있어서 동생에게 여기 맞냐고 물어보고 포장해왔습니다.보쌈 도... ,어느 사람의 블로그,https://blog.naver.com/jihye8482,2021-10-16
매교역 맛집# 이서방왕족발보쌈 수원본점족발뿌시기~,https://blog.naver.com/ankyy?Redirect=Log&logNo=222210287206,ㅎㅎ 수원에선 족발이라면 바로 이집이지요 #매교역맛집 #이서방왕족발보쌈 # 이서방왕족발보쌈수원본점역사와 전통이 있는 족발집이지요 ㅎㅎ 오늘은 보쌈 보다는 족발을 먹어야겠어요 절약형 족발도... ,즐겁게 웃으며 살기~,https://blog.naver.com/ankyy,2021-01-17
매교역 맛집이서방왕족발보쌈 수원본점반반족발 진리,https://blog.naver.com/sisa0115?Redirect=Log&logNo=221766879237, 이서방왕족발보쌈 수원본점 은 2대째 운영하는 족발보쌈 전문점입니다. 메뉴판은 위의 사진에서... 보쌈의 해독기능이 눈에 띕니다. 이서방왕족발은 수원 세류동에 본점이 있고 (저희가 방문한 곳) 동탄에 2호점이... ,초의 잡다한 블로그,https://blog.naver.com/sisa0115,2020-01-10
세류동 족발 맛집 :이서방왕족발보쌈 수원본점테이크아웃... ,https://blog.naver.com/starjoyblue?Redirect=Log&logNo=222181481587,"우리는 족발 보쌈(대)와 누룽지탕 하나를 주문했다. 본 메뉴가 나오기 전, 기본으로 반찬이 셋팅된다. 세류동 족발 맛집이서방왕족발 에는 메인메뉴와 함께 즐길 수 있는 미역국도 나오는데 이게 진짜... ",보스턴테리어 춘솔구와 함께❤️,https://blog.naver.com/starjoyblue,2020-12-22
수원 세류동 맛집 족발은이서방왕족발보쌈 수원본점추천,https://blog.naver.com/96618055?Redirect=Log&logNo=222085271409, 이서방왕족발보쌈 수원본점경기 수원 권선구 세권로 134 경기도 수원시 권선구 세류동 1075-10 번호 031... 인계동 족발 맛집 찾으시면 적극 추천해요. #수원족발맛집 #이서방왕족발보쌈 #수원족발맛집 #수원보쌈맛집,포르뚜나,https://blog.naver.com/96618055,2020-09-10
수원 족발 맛집이서방왕족발보쌈 수원본점 ,https://blog.naver.com/hee_2593?Redirect=Log&logNo=222361407645,"생각하다 수원 족발 맛집으로 유명한 세류동족발집이서방왕족발보쌈 수원본점족발보쌈을... 오랜시간 인기많은 곳이라 믿고먹을 수 있는, 맛있는 족발과 보쌈이 있는 이서방왕족발 수원본점 추천해요 !",JamJamlog (:D͓̽)(:͓̽ >)(:O͓̽),https://blog.naver.com/hee_2593,2021-05-22
