title,link,description,bloggername,bloggerlink,postdate
[익선디미방] 익선동 맛집/이태리 음식 맛집/ 익선잡방 ,https://blog.naver.com/tkfkd8587?Redirect=Log&logNo=222319189964,"동료 생일을 맞아 찾은 익선디미방익선잡방 도 가봤는데, 같은 셰프님이 하신다네? 어쩐지 비슷하더라 맛이 두 군데 다 존맛탱이지만 개인적으로 익선디미방이 더 맛있었음. 워낙에 인기가 많은 집이라 평일... ",젊음의 특권.,https://blog.naver.com/tkfkd8587,2021-04-27
"익선동 브런치 맛집,익선잡방 ",https://blog.naver.com/lmkanger?Redirect=Log&logNo=222484830749,먹었어요ㅎㅎ익선잡방익선동에서 브런치 먹고싶을 때 가볍고 든든하게 먹기 좋은 곳 같아요❣️ #익선동브런치맛집 #익선동 익선잡방# 익선잡방 시즈닝새우로제파스타 # 익선잡방 파스타... ,so sweet。팜므,https://blog.naver.com/lmkanger,2021-08-26
익선동 분위기 맛집 :익선잡방 ,https://blog.naver.com/ko_youngeun?Redirect=Log&logNo=222370855297,오랜만에 익선동 방문해서 점심 먹으러 간 # 익선잡방파-란 대문이 예쁘다 ㅎㅎ 메뉴판은 이렇게 밖에도 있었다. 테이블에는 접시와 수저포크도 미리 세팅되어 있었다. 그리고 먼저 제공된 식전빵! 그냥저냥... ,꼬영의 쏘쏘 다이어리,https://blog.naver.com/ko_youngeun,2021-05-28
익선동) 익선잡방 ,https://blog.naver.com/dnlselz?Redirect=Log&logNo=222494339494,5시 예약 하고 들어감 큐알찍고 온도 제고 배고프다!! 들어가자 마자 후다닥 시키기 그리고6시이후 4명 안되서 후딱 시키키 우린3명이여서 ㅜ ㅇ ㅜ 높은 천장 매장은 좁았는데 천장이 높아서 그런가 엄청... ,여행좋아해요♥,https://blog.naver.com/dnlselz,2021-09-04
 익선잡방_대전신세계점,https://blog.naver.com/sndz01?Redirect=Log&logNo=222501540722,"저의 개인적인 생각입니다, 익선동 가면 어떤 맛인지 모르겠으나,대전 신세계는 아니네요..... 그럼 하프커피 마시러 가겠습니다... #대전신세계 # 익선잡방#대전신세계아트앤사이언스 #대전 #신세꼐 #도룡동... ","먹고, 즐기고,사고__ 햅삐",https://blog.naver.com/sndz01,2021-09-10
대전 신세계백화점 맛집 -익선잡방 ,https://blog.naver.com/gareberia?Redirect=Log&logNo=222501824651,대전 신세계백화점 6층에 있는익선잡방 이라는 이탈리안 레스토랑에 다녀왔습니다. 새로 지은 백화점이라 그런지 넓직한 공간으로 개방감이 드는 인테리어를 갖췄습니다. 처음 방문한 식당에서는 잘 모르면... ,열매 투자 회사,https://blog.naver.com/gareberia,2021-09-10
사랑이 넘치는 익선동 데이트♡익선잡방 /익선동카페... ,https://blog.naver.com/wldbs3694?Redirect=Log&logNo=222527136365,익선동맛집익선잡방익선동 거리를 지나가다가 배가 고파서 자연스럽게 들어간 곳인데여 사실 다 이쁘고 맛있어 보였어요 배고파 빨리 먹장!.. 갑분케 창규나 생일축하한돡!!!!!!!!!! 주문해놓은 케이크인데요... ,inging,https://blog.naver.com/wldbs3694,2021-10-05
익선동익선잡방브런치 익선동 맛집 할인쿠폰,https://blog.naver.com/gjskrj?Redirect=Log&logNo=221821746127,"#익선동맛집 으로 유명하다는 # 익선잡방에 다녀왔어요 바로 옆 #익선디미방 은 몇번 가봤는데, #브런치 메뉴를 파는익선잡방 은 처음이었어요 애매한 시간에 가서 그런지 의외로 웨이팅이나 붐비는거 없이 바로... ",아쿠아블로그:소소하고도 화려한이야기,https://blog.naver.com/gjskrj,2020-02-25
종로 익선동 |익선잡방 (Ikseon Jabbang),https://blog.naver.com/soso2656?Redirect=Log&logNo=222520471679,:) 점심을 좀 가볍게 먹기 위해 찾은 곳익선잡방 (Ikseon Jabbang) 토요일에 11시 반? 정도 도착했을 때 이미 만석. 운 좋게 테이블이 한자리 남아서 바로 들어갈 수 있었다. 12시 좀 넘으니 바로 웨이팅 밖에서... ,쏘를 위한 so의 story,https://blog.naver.com/soso2656,2021-10-07
"(엑스포 아쿠아리움,익선잡방 , 인생네컷, 버터풀앤크리멀러스)",https://blog.naver.com/monlyve?Redirect=Log&logNo=222539361439,"점심은익선잡방대전신세계 백화점 6층에 위치 대전 신세계 백화점에는 식당가가 지하 1층과 5층에... 익선동 한옥거리에서 함께 운영하는 ‘익선디미방’의 시그니처 메뉴라고 합니다. 그리고, 감바스 오일... ",리얼리틀포레스트 _ 아이랑 전원주택라이프,https://blog.naver.com/monlyve,2021-10-17
익선동맛집_익선동나들이_동백양과점_ 익선잡방 ,https://blog.naver.com/kkje22?Redirect=Log&logNo=222414466464,친구들과 익선동 나들이 익선동 가볼만한곳 익선동 데이트 코스 익선동 동백양과점 드립커피와... 옆에 있는 브런치맛집익선잡방 . *주소 : 서울 종로구 수표로28길 17-21익선잡방감바스오일파스타(18... ,지극히개인적인블로그,https://blog.naver.com/kkje22,2021-06-29
[종로3가 / 익선동 맛집] 브런치파스타 맛집익선잡방 ,https://blog.naver.com/eunhye0406?Redirect=Log&logNo=222461214111,"친구의 생일을 축하하기 위해 방문한익선잡방 . 친구는 한번 가본 곳이고 나는 처음 가보았다. 메뉴. 친구말론 예전에 왔을때 대기만 1시간이었다고 했는데, 우리는 네이버 통해서 예약하고 방문해서 바로... ",보통 블로그,https://blog.naver.com/eunhye0406,2021-08-07
[종로3가역/양식]익선잡방 ,https://blog.naver.com/kkmbb2?Redirect=Log&logNo=222479584046, 익선잡방#종로3가맛집 #익선동한옥거리맛집 #익선동 익선잡방#종로3가 익선잡방# 익선잡방익선잡방서울 종로구 수표로 28길 17-21 영업시간: 평일 11:00 - 21:00 브레이크 타임: 15:00 - 17:00 주말/공휴일: 11:00... ,☺︎,https://blog.naver.com/kkmbb2,2021-08-21
"익선동맛집,익선잡방부라타치즈샐러드에 저격당하다",https://blog.naver.com/11dmdrk11?Redirect=Log&logNo=222518312690,익선동이 아기자기하게 구경할게 많더라고요. 사실 코스가 덕수궁 구경 -익선잡방 이었는데 덕수궁 야간개장 포기 ! 여기 예약 잡으려니까 7:30분에만 있어서 덕수궁 포기했던 기억이 납니다.익선잡방분위기도... ,꿀퇘지의 여행,https://blog.naver.com/11dmdrk11,2021-09-27
 익선잡방두번째방문 솔직후기,https://blog.naver.com/yeon_jewel?Redirect=Log&logNo=222535952856,# 익선잡방#익선동브런치 #익선동맛집 #종로맛집 12:00 땡하고! 의 익선동은 매우 조용하고 아늑! 파스타가 먹고싶어 방문한익선잡방! 자리에 앉고나서 접시와 유리물컵이 내맘에 아주쏙! 들었다 내부는... ,라이프주얼리샵 연주얼리,https://blog.naver.com/yeon_jewel,2021-10-13
대전신세계백화점 “ 익선잡방 ”,https://blog.naver.com/sunah2575?Redirect=Log&logNo=222509618762,"구경할게 너무많아서 한참 구경했던거같아요 주말 9/4일에 다녀왔는데 사람이 바글바글,,, 박터집니다 ㅋㅋㅋㅎ 백화점 구경후 5층에있는 “ 익선잡방 ”에 다녀왔어요! 서울 익선동에도 있고... ",ღ나의 추억 기록 ღ,https://blog.naver.com/sunah2575,2021-09-18
주얼리 보석 디자이너의 연말모임# 익선잡방#오믈렛만들기,https://blog.naver.com/judyebarem?Redirect=Log&logNo=221759187253,"우리가 만난 곳은 종로 익선동 브런치 한옥카페,익선잡방 . 십여 년을 오가는 종로인데도 요즘 부쩍 난 이 골목이 참 낯설다. 작은 길목에 있는 곳곳의 예쁜 카페들이 반갑기도 하지만.. 15년 전, 우리가 즐기던... ",주디에바램,https://blog.naver.com/judyebarem,2020-01-04
[대전신세계] ::익선잡방 ,https://blog.naver.com/eidkwid?Redirect=Log&logNo=222516178124, 익선잡방안녕하세요! 오늘은 대전 신세계에 있는익선잡방리뷰를 하려고 해요 원래는 호우섬 딤섬 먹으려는데 11시 25분부터 이미 만석에 웨이팅이 어마어마해서 뭐먹을까 하다 다녀온익선잡방 이에요... ,일상기록,https://blog.naver.com/eidkwid,2021-09-25
"그동안 먹은 것들 / 바르다김선생, 키토김밥,익선잡방등",https://blog.naver.com/tjsrud91?Redirect=Log&logNo=222478124227,#마스카포네치즈오믈렛 #새우로제파스타 익선동익선잡방 에서 먹은 한끼. 마스카포네치즈 오믈렛이 너무 맛있어서 집에서도 만들어 먹고 싶었다. #익선동맛집 # 익선잡방#순대국 나의 소울푸드 순대국... ,매일매일 화려하게,https://blog.naver.com/tjsrud91,2021-08-20
종로 익선동 한옥 레스토랑 ' 익선잡방 ',https://blog.naver.com/s2_minnng?Redirect=Log&logNo=222529083072,"익선동에서 밥먹으려면 웨이팅은 필수라 네이버 예약이 되는 곳을 열심히 찾다가 서울 신라호텔에서만 10년 경력 한식당 라연, 프렌치 콘티넨탈 출신 주인장의 All Day Brunch익선잡방입니다. 이 문구에 홀려서... ",*.:｡✿*ﾟ¨ﾟ･✿.｡.:*,https://blog.naver.com/s2_minnng,2021-10-06
 익선잡방 ,https://blog.naver.com/tosilrabbit?Redirect=Log&logNo=222521848565,평일 점심인데도 사람이 꾸준히 오는게 신기했다. 이렇게 시리즈같이 있던데 다음에는 다른 지점도 가 봐야겠다. # 익선잡방#익선동맛집 #파스타맛집 #스테이크맛집 #익선동데이트 #종로3가역맛집,yyy,https://blog.naver.com/tosilrabbit,2021-09-30
[대전] 신세계백화점 브런치카페익선잡방 (메뉴판 포함),https://blog.naver.com/katheline_red?Redirect=Log&logNo=222519927428,"서울 종로구 익선동에 있는 브런치카페익선잡방 이 신세계에 입점했어요. 대전 신세계백화점에는 주로 식당가가 5층에 위치해있는데,익선잡방 은 6층에 있어서 상대적으로 조용한 분위기에 식사할 수... ","도시별 소소한 것, 예카입니다.",https://blog.naver.com/katheline_red,2021-09-29
익선동 놀거리/콤콤오락실... 시그니처알/ 익선잡방 ,https://blog.naver.com/pudang_yum?Redirect=Log&logNo=222529703960,등이 많아서 데이트로도 친구들이랑도 충분히 즐거운시간을 보낼 수 있는 익선동! 분위기는 좋지만 주말엔 사람이 많다..ㅎㅎ #익선동 #익선동놀거리 #종로놀거리 #하이웨스트익선 # 익선잡방#콤콤오락실 #색안경,푸당이의 하루일기:D,https://blog.naver.com/pudang_yum,2021-10-07
대전 신세계백화점 맛집익선잡방6층 식당가,https://blog.naver.com/kimhyein_n?Redirect=Log&logNo=222527319661,대전 신세계백화점 맛집익선잡방6층 식당가 대전 신세계백화점이 오픈 한 뒤로 친구랑 약속을 잡을... 바로 ' 익선잡방 '이 보이더라구요. sns를 통해 자주 봤던 ' 익선잡방 '이 있으니 한번 먹어볼까 하고 대기를... ,살림잼,https://blog.naver.com/kimhyein_n,2021-10-05
대전 신세계 맛집익선잡방/ 대전 신세계 아트앤사이언스 /,https://blog.naver.com/joyxkng?Redirect=Log&logNo=222537673039,무슨 이태리 컨셉으로 곳곳을 꾸며둠익선잡방익선잡방 이라는 곳에 방문 6층이었던 것으로 기억한다 익선동이 본점익선잡방메뉴 개인적인 의견으로는 메뉴가 다양하지 않았다 스테이크2인세트 하나와 사이드... ,Joystory,https://blog.naver.com/joyxkng,2021-10-15
[대전 신세계]익선잡방 ,https://blog.naver.com/eagerly0418?Redirect=Log&logNo=222503763102,"#대전 #대전신세계 #신세계아트앤사이언스 #이탈리안레스토랑 #브런치맛집 #브런치카페 #익선동맛집 # 익선잡방대전에 새로 생긴 신세계 아트앤사이언스에 있는 브런치 맛집익선잡방익선동에 하나, 대전에... ",Daily with Me✨✨,https://blog.naver.com/eagerly0418,2021-09-13
익선동익선잡방- All day brunch,https://blog.naver.com/mynism?Redirect=Log&logNo=221735891910,알뜰하게 할인쿠폰 챙기고 맛있는 브런치도 즐기세요! **내돈주고 내가먹은 후기** #SKT할인쿠폰 # 익선잡방#익선동맛집 #익선동 #익선동브런치 #익선동식당 #익선동가볼만한곳,앞으로의 내 인생은 두근두근,https://blog.naver.com/mynism,2019-12-13
"종로 익선동 브런치,익선잡방 ",https://blog.naver.com/h-jeje?Redirect=Log&logNo=222507617116," 익선잡방종로 익선동 브런치,익선잡방제제기록장 place 02-765-3418 서울 종로구 수표로28길 17-21 영업시간 주말 11:00 - 21:00브레이크타임 없음 종로 익선동 브런치익선잡방방문 여전히 핫한 익선동, 오랜만에... ","춤을 추듯, 제제",https://blog.naver.com/h-jeje,2021-09-16
대전신세계백화점익선잡방 ,https://blog.naver.com/sarang0199?Redirect=Log&logNo=222505122171,"대전신세계백화점 맛집 구경하는데 다른 리뷰는 많았지만익선잡방 이 잘 안보이길래 끄적여본다,, 나능 너무 맛있었어섭,,ㅎ^^ㅎ 난!!!!!익선동 안가봤지만익선잡방 은 가봤다!!!!!!!!!!!!! 언제갔더라 9월 9일에... ",앙녕앙녕,https://blog.naver.com/sarang0199,2021-09-14
종로 익선동익선잡방비스트로 분위기 물씬,https://blog.naver.com/hip8791?Redirect=Log&logNo=221642529586," 익선잡방메뉴판 가격표 종로 익선동익선잡방레스토랑은 올데이 브런치 메뉴도 있고 파스타, 스테이크, 리조또 등 맛있는 음식 엄청 많았어요. 가게 분위기도 좋았고요. 한옥을 개조해서 만들어서 그런지... ",최니,https://blog.naver.com/hip8791,2019-09-08
서울여행) 익선동맛집익선잡방오믈렛이 맛나네!,https://blog.naver.com/lucky13?Redirect=Log&logNo=221655868403,#익선동맛집 # 익선잡방#메뉴판이예요. #식전빵이 나왔어요. 따뜻한 빵으로 워밍업하니 굿~~ 배가 넘 고파서 다 맛나요. 저희가 주문한 #새우로제와 #치즈오믈렛이예요. 비쥬얼도 예쁘쥬~? 새우로제에는 작은... ,찌뽕&나뽕 네식구 이야기,https://blog.naver.com/lucky13,2019-09-22
익선동 맛집익선잡방브런치 앤 파스타,https://blog.naver.com/kh750?Redirect=Log&logNo=221321238113,찾아갔지요 익선동 맛집익선잡방 입니다 ^^ #익선동맛집 # 익선잡방익선잡방#IKSSEON JABBANG #브런치앤비스트로 요즘은 근로시간 단축 때문에 브레이크 타임이 빨라졌다고 하던데 이건 그전에 간 거니깐 다시... ,커피사랑 경화의 소소하고 맛깔난 이야기들,https://blog.naver.com/kh750,2018-07-18
[익선동 브런치 맛집] 익선잡방- 여기 파스타 맛집이었군!!ㅋㅋ,https://blog.naver.com/mypana777?Redirect=Log&logNo=221658317496,"메뉴판 위에 있는 나무도마로 만든 간판이 익선디미방,익선잡방 의 대표 간판입니다. 점심때라 디미방보단 브런치전문인 잡방이 손님들이 많았네요. 다행히도 웨이팅은 없이 입장했어요. 이색적인 인테리어에... ",크레덴자의 맛있는 하루,https://blog.naver.com/mypana777,2019-09-24
"[계동산책] 익선동 맛집, 미슐랭 3스타 셰프 맛집 # 익선잡방 ",https://blog.naver.com/my_hillstate?Redirect=Log&logNo=221345062046, 익선잡방 은 현존하는 가장 오래된 요리책인 ‘수운잡방(需雲雜方)’에서 따와 ‘더 좋을(익선) 여러 가지 방법(잡방)’이라는 뜻이라고 하는데요. 최상의 맛을 이끌어낼 수 있도록 다양한 방법을 강구한다는... ,현대건설 공식블로그 :: 놀라운 혹은 재밌는 상상,https://blog.naver.com/my_hillstate,2018-08-24
"[퇴근후//4모임]익선잡방 , 주말보다 평일 익선동방문~!",https://blog.naver.com/bitna6265?Redirect=Log&logNo=221452877678,그리고 한옥느낌 물씬 익선동의 작은 가게들~ 일단 배가 고프므로 결정한 곳은 익선동의익선잡방좋은 곳으로 자리를 잡았다는 연락을 받고 서둘러서 갔습니다. 말한 그대로 진짜 자리를 잘 잡아 놓았더라구요.... ,bitbibibit,https://blog.naver.com/bitna6265,2019-01-28
 익선잡방_익선동,https://blog.naver.com/13572887?Redirect=Log&logNo=221462559864,"시간이 갈수록 핫해지는 익선동. 점심을 뭘 먹을까- 한참 검색을 해 찾아간 곳!익선잡방 . 사실, 남도분식을 가고 싶었는데 어떤 글에서 주말엔 웨이팅이 80번까지 간다는 것을 읽고... 바로 포기!익선잡방 도 많은... ",Como siempre -,https://blog.naver.com/13572887,2019-02-10
익선동 데이트익선잡방브런치 맛집,https://blog.naver.com/rubirang?Redirect=Log&logNo=221411567356,브랜드 없는 곳인거 같아요 계속 안들어오길요 ㅋㅋㅋ 사랑해도 올리브영이랑 다이소도요 암튼 오랫만에 이웃님이랑 넘나 즐거운 익선동데이트 했네요 좋은 소식으로 다음에 또 만나용 # 익선잡방#익선동 #데이트,신사동그여자,https://blog.naver.com/rubirang,2018-12-03
[익선동맛집]익선잡방 ,https://blog.naver.com/soyeon717?Redirect=Log&logNo=221330991097,이름 웃기다~~ㅋㅋ 라고 생각하시겠지만 사실 의미가 있는 이름이예요~ㅎ 조선시대 고요리서 이름 이래요~ 익선동과 잘 어울리는 이름이예요~익선잡방 은 같은라인에 위치한 익선디미방과 같은 쉐프님이... ,ALICE ROOM,https://blog.naver.com/soyeon717,2018-08-01
"익선동,익선잡방 ",https://blog.naver.com/chayoomi127?Redirect=Log&logNo=221395093174,"즐거웠던 익선동 나들이- 요즘엔 개화기 의상을 입고 다니시는 분들도 많아서 보는 재미가 쏠쏠했어요 '3') 익선동 나들이, 그리고 음식이 맛있던익선잡방 도 추천! 방문기 기록 끝.",차쌤 Blog,https://blog.naver.com/chayoomi127,2018-11-10
익선동 맛집)든든한 브런치 즐긴익선잡방 ,https://blog.naver.com/specialjhj?Redirect=Log&logNo=221468698714,갔어요 익선동 분위기 깡패익선잡방브런치를 먹자구 찾다가 방문하게되었는데 오픈 30분 전인데도 줄 서있더라구요 익선동스러운게 이런걸까요? 식기도 너무 이뻤어요 접시는 개인별로 또 다 다른... ,쫴지의 블로그,https://blog.naver.com/specialjhj,2019-02-18
"익선동 맛난집익선잡방 , 이번엔 너로 정했다! ₍₍ (ง ˙ω... ",https://blog.naver.com/yoo2033n?Redirect=Log&logNo=221323857186,"이렇게 역시나 잔뜩 칼로리를 섭취하고익선잡방 을 나왔는데결론적으로 내 기준,익선잡방 은 익선동에서 스테이크나 파스타를 먹을 생각이라면 꽤 괜찮은 곳이라는 생각이 들었다. 전반적으로 맛도 있었고... ",어른이도화,https://blog.naver.com/yoo2033n,2018-07-22
익선동나들이 /익선잡방+ 마당플라워카페 / 종로4가,https://blog.naver.com/a_heejin?Redirect=Log&logNo=221479502120,"다가오는 하원시간 애데렐라 둘의 데이트는 늘 짧고 굵게 아쉽지만, 매력미 뿜뿜한 익선동에서~ 든든했고 향긋했던 봄날의 데이트 이렇게 어느새 봄이 왔나봄, #익선동골목 # 익선잡방#마당플라워카페 #종로4가",이제는 달콤한 휴식의 시간.,https://blog.naver.com/a_heejin,2019-03-04
익선동 맛집익선잡방 ,https://blog.naver.com/asy0?Redirect=Log&logNo=221491987022,"한가했던 익선동이 이제는 많은 사람들로 북적북적한 것이 일시적인 핫 플레이스가 아닌 서울의 대표 먹거리,아이템쇼핑의 중심지로 지속적인 발전이 되겠다 싶었네요.. 창속으로 들여다 보이는익선잡방 ... ",황금정원으로 가는 길,https://blog.naver.com/asy0,2019-03-19
" 익선잡방에그베네딕트, 치즈오믈렛, 감바스오일파스타",https://blog.naver.com/lemonatial?Redirect=Log&logNo=221474746946,"샐러드소스나 베이컨이 겹쳐서 조금 아쉬웠지만요 다양하게 시키는게 더 좋을것같아용!! 신라호텔 10년 쉐프가 요리한다고 하는데 익선동가시면익선잡방한번 가보세요 *댓글, 공감은 저에게 큰 힘이 됩니다.",배움 쉐어 하우스,https://blog.naver.com/lemonatial,2019-02-25
익선동 데이트코스② 여심저격 브런치 맛집 ‘ 익선잡방 ’,https://blog.naver.com/officialduo?Redirect=Log&logNo=221544885057,애피소드와 함께 익선동 브런치 맛집익선잡방 에서 늦은 오후의 여유를 즐겨볼까요? [사진출처 : 듀오] 익선동의 지명인 ‘더할 익’과 ‘좋을 선’ 그리고 여러 가지 방법이란 의미를 가지고 있는 ‘잡방’이... ,결혼정보회사 듀오 공식 블로그 '결혼해듀오',https://blog.naver.com/officialduo,2019-05-23
대전 신세계백화점 식당 맛집 추천익선잡방후기,https://blog.naver.com/glory6501?Redirect=Log&logNo=222495885012,"있는익선잡방 을 방문했어요! 몰랐는데 서울 익선동의 그 익선이더라고요. 검색해봤더니 익선동에 하나, 여기 대전신세계에 하나임! 대전 신세계백화점 식당익선잡방오믈렛 맛집 대전 신세계백화점 맛집... ",ꕤFINN's DIARYꕤ,https://blog.naver.com/glory6501,2021-09-05
"웨이팅 시간, 관람팁)/익선동익선잡방추천메뉴 / 서촌 나들이",https://blog.naver.com/numuhaeyo?Redirect=Log&logNo=222534408694,3. 사진 감상을 하고 싶다면 사진 찍는 줄에 현혹(?)되지 말고 사진 가까운 곳으로 이동해서 사진감상! #요시고사진전 #그라운드시소서촌 # 익선잡방#사진전 #요시고_사진전 #익선동 #서촌나들이 #서촌,단바리의 공부,https://blog.naver.com/numuhaeyo,2021-10-12
익선동 맛집 :익선잡방감바스 오일파스타 + 클래식... ,https://blog.naver.com/zzyongimda?Redirect=Log&logNo=221538025058,기대가 되더라구요 익선동 한옥 레스토랑익선잡방 의 브랜드 네임은 익선동 내 먼저 오픈한 익선디미방의 모티브인 음식디미방보다 100년 더 앞선 고 조리서 수운잡방을 모티브로 만들었다고 해요 그 중 잡방은... ,zzyongimda,https://blog.naver.com/zzyongimda,2019-05-15
서울 익선동 브런치 카페 -익선잡방: 치즈오믈렛... ,https://blog.naver.com/jihoon5252?Redirect=Log&logNo=221753265615," 익선잡방 이 브런치 맛있기로 엄청 유명하더라고요 ㅋㅋㅋ 서울 익선동 브런치 카페익선잡방Theme.... 익석잡방 브런치 2대장 마스카포네 치즈 오믈렛, 에그 베네딕트를 주문해서 먹어보기로 했습니다 ㅎㅎ... ",귤랭이의 플레이스토리,https://blog.naver.com/jihoon5252,2019-12-29
[종로/익선동] 맛과 분위기 좋은익선잡방/ 시그니처 알,https://blog.naver.com/otct12?Redirect=Log&logNo=222495565319,점심으로 브런치집에 가기로 해서 어디로 갈까 고민하다가 익선동에 있는 # 익선잡방을 다녀왔어요 저희는 하루 전날 밤 미리 네이버예약을 하고 갔어요 ! 그래서인지 4인석 창가쪽에 바로 안내받고 식사를 할 수... ,짜니 블로그 •_•,https://blog.naver.com/otct12,2021-09-05
"[대전 신세계] 6층익선잡방 , 38층 스타벅스 대전엑스포스카이",https://blog.naver.com/january_hwa?Redirect=Log&logNo=222484141561,프리오픈 첫손님으로 입장~ 6층익선잡방광고로봇이 돌아다닌다 toast ~ 파스타1 토스트1 와인1 맛있었다. 가성비 떨어지는 예쁘고 맛난곳 ㅜㅜ 완전좋아 나혼자 호들갑떨면서 엄청좋아했다. 정말 맛있었다.... ,HWA's note,https://blog.naver.com/january_hwa,2021-08-26
[익선동] 올데이 브런치!익선잡방 ,https://blog.naver.com/surpriseye?Redirect=Log&logNo=222366839044,이렇게익선잡방 에서의 끼니들을 소개해드렸는데요. 가격대비 꽤 괜찮은 집이라 사람들도 많고 올데이브런치라 가볍게 식사가 가능해서 인기도 많은듯해요. 나중에 익선동에서 딱 어떤걸 먹어야겠다고 확신이... ,소녀(笑女) 소풍(小風)불다,https://blog.naver.com/surpriseye,2021-05-26
[종로/익선동] 브런치 맛집익선잡방 ,https://blog.naver.com/hsjsa?Redirect=Log&logNo=222459516056,예뿌진 않지만 좌석이 편해서 텍스트 보기 괜찮았음 자몽빙수도 맛있다 논문에 소득이 있었다면 더 좋았겠지만 모든것에 처음이 있지 않은가 좋은 시작이었길 바라며! # 익선잡방#익선동브런치 #익선동카페,좋아서 하는 기록,https://blog.naver.com/hsjsa,2021-08-06
대전 신세계익선잡방 ㅣ실내조경,https://blog.naver.com/songtree9?Redirect=Log&logNo=222485389142,오늘 소개해드릴 공간은 대전 신세계 백화점에 있는익선잡방 입니다. / #실내조경 #플랜테리어 #조화연출 # 익선잡방#대전신세계 #ArtScience #그리너리 #인조나무 #조화 처음으로 소개해드릴 공간은 매장 외부... ,SONGTREE 송트리 조화연출전문업체,https://blog.naver.com/songtree9,2021-08-27
Hot한 데이트장소익선잡방 (益善雜方),https://blog.naver.com/hlp5476?Redirect=Log&logNo=221318088352,"Hot한 데이트장소 익선동의익선잡방 (益善雜方) 식당, 아니 ‘레스토랑’이름의 내력을 먼저 알아보자. 익선동은 종로의 동리이름이고 잡방이란 말은 조선 중기에 안동(安東) 예안에 살았던 김유(金綏, 1481~1552)... ",황현탁의 일상,https://blog.naver.com/hlp5476,2018-07-13
