title,link,description,bloggername,bloggerlink,postdate
"[알알리뷰맛집]익선잡방 (익선동파스타,익선동리조또... ",https://blog.naver.com/dkfma21277?Redirect=Log&logNo=222507569282,건강을 나름 유지하면서 맛있게 먹을 수 있는 익선동 맛집으로 나와 함께 가보자!GoGo익선잡방 은 서울특별시 종로구 수표로 28길 17-21에 위치해 있다. 종로3가역 4번 출구 119M이내에 위치해 있다. 종로... ,알미의 특별한날,https://blog.naver.com/dkfma21277,2021-09-16
 익선잡방 [매장⭕ / 배달⭕] : 신라호텔 10년 경력 셰프의 맛,https://blog.naver.com/hakaheke?Redirect=Log&logNo=222430417301,"[매장⭕ / 배달⭕]익선잡방: 신라호텔 10년 경력 셰프의 맛 익선동의 올데이 브런치,익선잡방입니다 신라호텔 10년 경력의 셰프가 운영하는 곳이라 맛은 걱정않으셔도 됩니다... ",어중유골,https://blog.naver.com/hakaheke,2021-07-14
익선동 “ 익선잡방 ”,https://blog.naver.com/theapril5?Redirect=Log&logNo=222481115174,"이 주변은 정말 다 까페 or 식당이었어요. 다른 곳도 가보고 싶었지만, 너무 배가 불러서, 다른 곳은 다음을 기약하며.... 한번쯤 가볼만한 곳이었어요~ # 익선잡방#익선동 #라자냐 #스테이크",킴의 생활 블로그,https://blog.naver.com/theapril5,2021-08-23
"익선동 한옥스타일 브런치파스타 맛집,익선잡방(21년 8월초)",https://blog.naver.com/hkim1992?Redirect=Log&logNo=222496458353, 익선잡방메뉴 가기 전 포인트 1. 익선동에서 이른 점심을 먹으려고 하였음 2. 브런치 카페를 찾다가 적당한 분위기와 가격의 식당발견 3. 차가 없었기에 주차공간 생각안하고 출발 갔다온 후 포인트 1. 익선동... ,그때 그리고 지금,https://blog.naver.com/hkim1992,2021-09-06
"오징어먹물리조또가 맛있었던익선잡방 (서울, 익선동)",https://blog.naver.com/yonseirehab?Redirect=Log&logNo=222511692366,"11시 부터 네이버 예약가능(보통 다른 곳은 11시30분부터 가능). 살치살스테이크, 오징어먹물리조또, 마스카프네 오믈렛, 그리고 맥주 블루문과 필스너~^^ 예약을 하니 세미룸을 빌려서 오븟하게 우리들끼리만... ",PlumberKingJungBa의 작은 산성스토리^^,https://blog.naver.com/yonseirehab,2021-09-20
[ 익선잡방 ] 익선동 파스타 맛집 추천 / 데이트 코스 분위기 맛집... ,https://blog.naver.com/hlkj96?Redirect=Log&logNo=222481617385,오늘은 익선동에서 브런치 맛집으로 유명한익선 잡방 을 소개해드릴게욤익선잡방주소 서울 종로구 수표로 8길 17-21 번호 02-765-3418 영업시간 매일 11:00 〰️ 21:00 브레이크 타임 15:00 〰️ 17:00 ( 주말/공휴일... ,ღ추억조각ღ,https://blog.naver.com/hlkj96,2021-08-26
익선동_ 익선잡방 . 프렌치비스트로 브런치,https://blog.naver.com/yunaly?Redirect=Log&logNo=221509978856,그래도익선잡방 은 셰프의 소신을 담아 만든 음식을 선보여줬다. 브런치로 에그베네딕트와 오픈샌드위치 오믈렛 파스타 시저샐러드... 익선동을 나에게 환기시켜준 고마운 맛집 화장실 안에서 나는... ,yunaly님의 블로그,https://blog.naver.com/yunaly,2019-04-10
"[익선동 맛집]익선잡방솔직후기/클래식라자냐, 양송이... ",https://blog.naver.com/dayoung3652?Redirect=Log&logNo=222478058601,궁금해서 짝지랑 한 번 더 가보려고한다 재방문 의사 200%!! # 익선잡방#익선동골목 #익선동맛집 #종로3가맛집 #안국맛집 #라자냐맛집 #클래식라자냐 #살치살스테이크 #양송이크림스프와살치살스테이크 #꿀자몽,영이가 갑니다영,https://blog.naver.com/dayoung3652,2021-08-20
익선동 브런치 맛집익선잡방: 신라호텔 10년경력 쉐프님의... ,https://blog.naver.com/dbsgmldud123?Redirect=Log&logNo=222439426360,있었다 익선동 브런치익선잡방기본 테이블 세팅 앤틱하고 묵직한 커틀러리와 발랄한 분위기의 접시... 이름이 잡방....ㅋㅋㅋ 인 것이 조금 독특해서 찾아보니 고 조리서 수운잡방(需雲雜方)을 모티브로... ,Daily Log,https://blog.naver.com/dbsgmldud123,2021-07-21
익선동익선잡방라자냐 오믈렛,https://blog.naver.com/charming_journey?Redirect=Log&logNo=222343765153,익선동익선잡방 을 다녀왔습니다. 맛은 있습니다. 익선동이라는 문화적 특성상 한옥을 개조해 만든 식당이라 한번쯤은 가볼만 하다 라는 생각이 들었습니다. 가격은 관광지 프리미엄으로 비싼듯 하네요.,챠밍져니의 Charming Life,https://blog.naver.com/charming_journey,2021-05-09
"[익선동맛집] 익선잡방 _브런치,파스타,데이트코스 추천!",https://blog.naver.com/keh5327?Redirect=Log&logNo=222238973947,[종로3가|익선동맛집]익선잡방익선동이 한때 정말 핫했는데... 최근에가고 깜짝 놀랐다.. 정말 코로나의 여파로 인한 결과물인지.. 자영업자들의 현실이 눈으로 보이는 날이었다. 오랜만에 만난 동생과 함께... ,Milkim,https://blog.naver.com/keh5327,2021-02-10
[익선동맛집]이탈리안 레스토랑익선잡방 ,https://blog.naver.com/you91831?Redirect=Log&logNo=222348677116,"☆힐링맛집☆ -익선동맛집,익선잡방 - 괴로운 월요일 출근을 위로해줄 종로 점심 맛집 탐방~! 오늘은 쨍한 파란 대문이 맞이하는익선잡방방문♡ 입구부터 인테리어가 너무나 맘에 쏙! 요기 테이블 하나가... ",힐링플렉스,https://blog.naver.com/you91831,2021-05-12
[익선동 맛집]익선잡방 /마스카포네치즈오믈렛... ,https://blog.naver.com/jgdd5342?Redirect=Log&logNo=222385818243,요번에 맛있는 오므라이스가 먹고 싶다아 을지다락을 다시 갈까나...하다가 익선동에 있는 핫플 발견!!익선잡방아..건물 사진 메뉴판 사진 다 못 찍었음.... 요즘 글 안 써서 폼 떨어진듯.. 뭐 네이버에 치면... ,시조새 잡화점,https://blog.naver.com/jgdd5342,2021-06-05
"종로, 익선동맛집 브런치카페 ' 익선잡방 '",https://blog.naver.com/sehee0982?Redirect=Log&logNo=222350965317,#서울맛집 #종로맛집 #익선동데이트코스 #익선동맛집 #서울브런치 #익선동브런치 # 익선잡방#브런치맛있는곳 # 익선잡방 가격 # 익선잡방 메뉴 #익선동핫플레이스,쫄보같이 쫄보처럼,https://blog.naver.com/sehee0982,2021-05-14
 익선잡방- 브런치가 유명한 익선동 맛집 다맛있어요!,https://blog.naver.com/kjw30823?Redirect=Log&logNo=222212345254,익선동 길을 따라 조금 걷다 보면익선잡방 이 보입니다. 올데이브런치! 저희 11시에 만났었거든요 ~브런치 먹기 딱 좋은 시간 ! 파란 문도 왠지 분위기있네요 매장 내부도 깔끔하죠! 이런 편안한 느낌의... ,김냑사의 약수터,https://blog.naver.com/kjw30823,2021-01-19
"주차]대전신세계백화점익선잡방 , 인생네컷 등... ",https://blog.naver.com/khy8920?Redirect=Log&logNo=222533157300,"대전신세계백화점익선잡방 , 인생네컷 등 대전신세계아트앤사이언스 방문후기평일 10:30 - 20:00 주말... 백화점 가는 길부터 배고팠던 저희는 신세계백화점 지하에있는 푸드코트에서 먹지 않고 ‘ 익선잡방 ’... ",혀뇽 ʜᴇɪᴍɪsʜ ʟɪғᴇ,https://blog.naver.com/khy8920,2021-10-11
 익선잡방익선동 데이트코스 맛집 / 스테이크보다... ,https://blog.naver.com/yeon_jewel?Redirect=Log&logNo=222420213371,"# 익선잡방#익선동맛집 #익선동에그베네딕트 사실 다른곳으로 들어가려했으나, 웨이팅은 고사하고 그리고 4명이 앉을 자리가 없었고 바로 착석이 가능한 곳으로 들어가자는게 우리의 의견 익선동에 너무나... ",라이프주얼리샵 연주얼리,https://blog.naver.com/yeon_jewel,2021-07-04
[익선동] 파스타 맛집익선잡방솔직리뷰,https://blog.naver.com/qwer5024?Redirect=Log&logNo=222318845101,다른메뉴 시킨 거보니 맛있어보였고 실제로 만족하는 느낌? ㅎㅎㅎ 익선동 방문하셨다면익선잡방한번쯤 방문해 보는 거 추천드립니다:^^ Previous image Next image # 익선잡방#익선동맛집 #종로맛집 #익선동맛집추천,김블로그,https://blog.naver.com/qwer5024,2021-04-22
대전 신세계백화점익선잡방/ 도룡동 맛집 / 대전... ,https://blog.naver.com/bjh0447?Redirect=Log&logNo=222504389192,새로 생긴 대전 신세계백화점안에 맛있는 것들이 왕창 들어왔다 선택장애 올만큼 종류가 많다 집근처라 자주 오면서 이것저것 많이 먹어봐야지익선잡방픽 카페같은 비주얼에 식당 고급스럽고 예쁘다... ,BYUNJANMANG,https://blog.naver.com/bjh0447,2021-09-13
[일상]익선동데이트/ 익선잡방 /오타르/플리마켓,https://blog.naver.com/kimhani1031?Redirect=Log&logNo=222351247137,익선동 평일 데이트 #익선동 # 익선잡방#익선오타르 #익선은평일에 좁지만 구경할거 많은 익선동은 평일에 가줘야 제맛이징 종로3가 4번출구로 나오면 바로있는 익선동 찐축이가 미각을 알기 시작한 32주... ,하니블로그,https://blog.naver.com/kimhani1031,2021-05-14
익선동 맛집)익선 잡방솔직후기,https://blog.naver.com/sookj333?Redirect=Log&logNo=222324124924,#익선동맛집 #익선동 익선잡방#익선동브런치 #종로3가브런치 #종로3가맛집 # 익선잡방# 익선잡방 후기 #익선동리조또 #익선동파스타 #익선동오믈렛맛집 # 익선잡방 솔직후기 #종로삼가맛집 #종로삼가브런치... ,뚜뚜의 즐거운 일상,https://blog.naver.com/sookj333,2021-04-26
[ 익선잡방 /익선동맛집/종로맛집/종로3가맛집],https://blog.naver.com/u-clinic?Redirect=Log&logNo=222328987067,#역촌동피부과 #연신내피부과 #연신내역피부과 #응암역피부과 #구산동피부과 #은평구필러 #은평구보톡스 #연세u의원 #은평구피부과추천 #필러 #보톡스 # 익선잡방#익선동맛집 #종로맛집 #종로3가맛집... ,연세U피부클리닉,https://blog.naver.com/u-clinic,2021-04-30
[서울/종로3가]: “ 익선잡방 ”_ 익선동 브런치/양식 한 끼!,https://blog.naver.com/ehsddoble?Redirect=Log&logNo=222377402506,안녕하세요 또블입니다'◡' 익선동에서 양식이 먹고 싶어 양식집을 알아봤는데 가고 싶은 양식집이 모두 붙어있더라고요 고심 끝에 골라서 다녀온익선잡방오늘은익선잡방 을 소개해 드릴게요!익선잡방 ... ,또블’s youth journalღ,https://blog.naver.com/ehsddoble,2021-05-31
[익선동익선잡방 ] 익선동 맛집 / 종로3가 맛집/ 브런치 추천... ,https://blog.naver.com/qhfk2344?Redirect=Log&logNo=222460562802, 익선잡방 은 꼭 꼭 헛걸음 하시지 마시고 예약하고 가세요~ 다음 청수당 카페 리뷰로 만나용!!ㅎㅎ익선동 청수당 카페 2차로 바로보기 https://blog.naver.com/qhfk2344/222460612925익선동 술집 송암여관 3차... ,v필라보라v,https://blog.naver.com/qhfk2344,2021-08-07
[익선동맛집]- 익선잡방 ,https://blog.naver.com/jisu980705?Redirect=Log&logNo=222194756687,"(방역수칙 잘 지키고, 먹을 때 이외엔 마스크 착용하고, 익선동은 돌아다니지 않고 식사만 하고 바로 지하철타고 나왔습니다!) 익선동에 위치한 브런치 맛집익선잡방 입니다! 영업 시간: 매일 11:00 - 21... ",Never Better,https://blog.naver.com/jisu980705,2021-01-03
[익선동:종로]익선잡방 ,https://blog.naver.com/u_u-6_6?Redirect=Log&logNo=222217810092,익선동 한옥 레스토랑익선잡방 (益善雜方)의 브랜드 네임은 익선동 내 먼저 오픈한 익선디미방의 모티브인 음식디미방보다 100년 더 앞선 고 조리서 수운잡방(需雲雜方)을 모티브로 만들었습니다. 그중... ,zin:),https://blog.naver.com/u_u-6_6,2021-01-24
[맛집가자] 익선동 브런치 -익선잡방 ,https://blog.naver.com/yellowlatte?Redirect=Log&logNo=222150518038, 익선잡방#익선동브런치 를 먹으러 찾아간 # 익선잡방영업시간 매일 11:00 - 21:00 (브레이크타임없음) 익선동은 가게마다 매력들이 많은것같아요익선잡방간판도 너무 예쁜~ 여자들끼리의 데이트타임~ #브런치... ,제리빈 블로그,https://blog.naver.com/yellowlatte,2020-11-21
익선동 브런치 카페 예약할 수 있는익선잡방 ,https://blog.naver.com/deulhome?Redirect=Log&logNo=222204273674,익선동 브런치익선잡방 은 동백양과점 맞은편에 위치하고 있다. 건너편의 양과점에서는 수플레... 이름의 뜻이 궁금했었는데 ‘잡방’은 ‘여러 가지 방법’을 일컫는 말이라 익선(더 좋은) 여러 가지 방법... ,갑자기 독립,https://blog.naver.com/deulhome,2021-01-11
익선동 데이트코스 ( 익선잡방 ),https://blog.naver.com/djawl1254?Redirect=Log&logNo=222292494160,"ㅋㅋㅋㅋㅋㅋㅋㅋ 여튼, 그래서 둘다 한번도 안가본 익선동에 가기로 했어요 짜잔 익선동 도착! 우선 밥먹으러 아주 핫한익선잡방 으로! 저희가 갔을땐 월요일이라그런지 웨이팅은 없었어요 근데 저희 뒤로... ",나도 처음하는 애개육아 :),https://blog.naver.com/djawl1254,2021-03-30
종로 익선동 브런치 양식 맛집익선잡방추천,https://blog.naver.com/seohee7488?Redirect=Log&logNo=222342855959,"깨끗하고 조용하면서 분위기가 좋고, 음식도 맛있어서 만족스러웠어요~ 익선동 브런치 양식 맛집 찾으시는 분들께 추천드려요:) #익선동맛집 #익선동양식 #익선동브런치 # 익선잡방#익선동파스타",히이의 소소한 일상,https://blog.naver.com/seohee7488,2021-05-08
"곰치탕 , 익선동익선잡방, 익선주택 , 데일리라이크 다이어리",https://blog.naver.com/bbu2102?Redirect=Log&logNo=221733031698,"동기덜 # 익선잡방살라댕방콕 가려다 혜리니 새우알러지때매 요기루 크흡,, 퇴사자들 이야깃거리는 취준 어려운 취업때매 불안+우울 콤보다 고민해서 시킨 메뉴들 실패,,, 금액대비 맛은 별루 근처에 있는 #익선... ","fall for you,",https://blog.naver.com/bbu2102,2019-12-10
[종로맛집]익선잡방 ,https://blog.naver.com/heahun1?Redirect=Log&logNo=222267241290,"인기가 많다고 하여, 미리 예약을 하고 갔어용 예약 추천 드리옵니다 # 익선잡방 예약 #익선동브런치 # 익선잡방11:00am 예약이라 엄마 팔찌 반지 찾고 바로 갔어요! 종로 금은방거리에서 걸어서 15분쯤? 예쁘게... ",Daily Happily Henny,https://blog.naver.com/heahun1,2021-03-07
[ 익선잡방 ]익선동 골목에 아기자기 예쁜 브런치 카페,https://blog.naver.com/kwondy121?Redirect=Log&logNo=222358857855,4인방 익선동 골목은 사계절 정말 예쁜거 같아요 걷다보면 감성이 막 생김 매일 11:00~21:00... 메뉴판익선잡방시즈닝 새우 로제 파스타 클래식 라자냐 에그 베네딕트 마스카포네 치즈 오믈렛 4개 pick 각자... ,육식꿘디,https://blog.naver.com/kwondy121,2021-05-20
 익선잡방날 좋은날 직원들과 회식했어요,https://blog.naver.com/go931223?Redirect=Log&logNo=222341478275," 익선잡방익선동이 회사랑 가까워가지고 자주 가는 곳인데 친구들이랑도 가고, 회사 직원들이랑도 가끔~ 아주 가~~~끔 익선동에서 점심 회식을 하곤 합니다! 지난번에는 팀원이랑 둘이서 점심먹었는데 이번에는... ",Leenalog,https://blog.naver.com/go931223,2021-05-07
종로 익선동 맛집/익선잡방 / 데이트하기 좋은 예쁜 브런치집,https://blog.naver.com/mjnyang89?Redirect=Log&logNo=222260672103,안녕하세요 팡밍입니다 익선동에 있는 한옥 레스토랑 ‘ 익선잡방 ’에 다녀왔어요. 신라호텔 10년 경력 셰프가 운영하는 브런치 전문 레스토랑이래요.익선잡방서울 종로구 수표로28길 17-21익선잡방11:00 - 21... ,All About My Sweet Life,https://blog.naver.com/mjnyang89,2021-03-01
