title,link,description,bloggername,bloggerlink,postdate
"대전 신세계 맛집, 여유로운 브런치를 즐길 수 있는6F익선잡방 ",https://blog.naver.com/jangingin?Redirect=Log&logNo=222538296507,점심이었답니당 :) # 익선잡방#대전신세계맛집 #도룡동맛집 방문일: 2021.10.08(금) 다른 층의 식당들보다...익선잡방대전 신세계백화점 메뉴판 (2021.10 현재) 자리에는 종이로 된 메뉴판도 준비되어 있는데요.... ,오늘의 생각,https://blog.naver.com/jangingin,2021-10-15
맛도 좋은 익선동 이탈리안 레스토랑 파스타 맛집익선잡방 ,https://blog.naver.com/spring__like?Redirect=Log&logNo=222489982598,익선동 이탈리안 레스토랑익선잡방방문 후기 오랜만에 전 직장 동료와 함께 익선동 나들이를 다녀왔어요 ❤️ 더 많은 동료들도 함께 만나고 싶었는데 사회적 거리두기 4단계 때문에 나눠서 만나야 해서... ,즐거운 최엘라이프,https://blog.naver.com/spring__like,2021-08-31
[익선동 파스타]익선잡방 ,https://blog.naver.com/rkdud0921?Redirect=Log&logNo=222538323994,레스토랑익선잡방 (益善雜方)의 브랜드 네임은 익선동 내 먼저 오픈한 익선디미방의 모티브인 음식디미방보다 100년 더 앞선 고 조리서 수운잡방(需雲雜方)을 모티브로 만들었습니다. 그중 잡방(雜方)은... ,작심삼일 일상,https://blog.naver.com/rkdud0921,2021-10-16
익선동맛집 ::익선잡방 ,https://blog.naver.com/tmdal6574?Redirect=Log&logNo=222542799624,그래도 오랜만에 예쁜 인테리어에서 맛있는 음식들을 먹고 오니 기분전환하고 좋았어요~! 익선동맛집 ' 익선잡방 ' #익선동 #익선동맛집 # 익선잡방#익선동데이트 #종로데이트,승미로운 머리생활,https://blog.naver.com/tmdal6574,2021-10-20
[익선동/맛집] 브런치 먹으러 간 ' 익선 잡방 ',https://blog.naver.com/thewinter22?Redirect=Log&logNo=222065251286,익선동엔 제가 좋아하는 몇몇 맛집들이 있는데 오늘은 새로운 맛집을 팠습니당 이번에 새로 판 익선동 맛집은 ' 익선 잡방 ' 이라는 브런치 맛집이었습니당 ㅎㅎ 브런치만 파는건 아니고 브런치 메뉴와... ,B E Y O N D P A R A D I S E,https://blog.naver.com/thewinter22,2020-11-21
대전 신세계백화점익선잡방브런치 다양하게 먹어봄!,https://blog.naver.com/dbfk804?Redirect=Log&logNo=222533610032,"점심으로익선잡방 에서 브런치를 먹었는데 대전신세계백화점 브런치 찾아보시고 계실 분들을 위해서 다녀온 후기 말씀드리겠습니다!! :)익선잡방위치, 영업시간 등 대전 신세계백화점 내에 많은 식당이... ",하고 싶은 거 하는 사람,https://blog.naver.com/dbfk804,2021-10-11
대전 신세계백화점 맛집 / ' 익선잡방 ' 파스타 맛집,https://blog.naver.com/naangranpark?Redirect=Log&logNo=222535452586, 서울 익선동에서 이미 유명한 곳이라는데 난 첨들어봤따.. 기냥 바로 웨이팅 등록하기!! 그러면... 하면서 초고속으로 뛰어갔다익선잡방간판! 얘기를 듣고보니 정말 서울에서 잘나갈것같은 간판이군... ,란박제국,https://blog.naver.com/naangranpark,2021-10-14
익선동 스테이크익선잡방엄마랑 데이트,https://blog.naver.com/diego82?Redirect=Log&logNo=222491390986,"익선동 스테이크익선잡방✔운영시간 매일 11:00 - 21:00 Break Time 15:00 - 17:00 주말은 브레이크 타임 X ✔전화번호 050 - 71313 - 3418 ✔주소 종로구 수표로28길 17-21익선잡방✔주차장 X , 예약 가능 (예약추천)... ",하늘을달리다~*,https://blog.naver.com/diego82,2021-09-01
익선동 레스토랑 :익선잡방 ,https://blog.naver.com/yoonlee945?Redirect=Log&logNo=222473477916,추가하세용 익선동 브런치익선잡방 의 대표메뉴인듯 했던 에그 베네딕트 우리 말고도 다른 테이블 세군데서나 에그베네딕트를 시켜 드셨음 에그베네딕트 비주얼에 감탄하며 열심히 사진 찍던 중 나온... ,하루 진행중,https://blog.naver.com/yoonlee945,2021-08-18
"익선동 브런치익선잡방 , 스테이크와 자몽 꿀맛 조합 인정해",https://blog.naver.com/jjhz3719?Redirect=Log&logNo=222525487761, 익선잡방익선동 브런치 스테이크 추천 프라이빗 룸 코로나로 서울을 못 가다가 정말 오랜만에 방문 핫한 익선동을 이제야 가보게 되었네요 :) 익선동에 맛있는 곳이 많아서 어디 가지 고민하다가 3명이 만나게... ,나슐랭 투어중,https://blog.naver.com/jjhz3719,2021-10-03
대전 신세계백화점 브런치 맛집익선잡방 ,https://blog.naver.com/highclass96?Redirect=Log&logNo=222523998344,그나마 웨이팅 빠르게 빠지긴 하지만요...ㅋㅋㅋ#대전신세계백화점맛집 #대전신세계백화점브런치 # 익선잡방#대전신세계백화점 익선잡방익선잡방대전신세계 ArtScience점브런치 0507-1468-3472 대전광역시... ,아득히 빛나는 하루ღ,https://blog.naver.com/highclass96,2021-10-02
종로3가브런치맛집익선잡방 ,https://blog.naver.com/kimgyuyong?Redirect=Log&logNo=221845349007,폭풍검색으로 지나가다 파란대문이 인상적이였던 종로3가 브런치맛집 ' 익선잡방 '을 방문하게 되었습니다 ^^~~ 종로3가 익선동골목을 다니시다보면 이런 커다란 파란대문이 보이실꺼에요 ㅎㅎ 심지어 안에... ,웰컴투똔미쓰홈,https://blog.naver.com/kimgyuyong,2020-03-09
익선동맛집익선잡방브런치맛집,https://blog.naver.com/podo_hyoni?Redirect=Log&logNo=222380350008,5점 만점에 4.47점을 자랑하는 #익선동브런치 # 익선잡방익선동은 굉장히 좁디 좁은 골목에 카페나 식당이 옹기종기 모여있기 때문에 걸어다니기에도 사실 비좁다. 라이딩을 하고 왔으니 자전거라는 짐이 생긴... ,효니 이야기,https://blog.naver.com/podo_hyoni,2021-06-02
직장동료들과 함께한 신나는 점심식사 - 익선동익선잡방 ,https://blog.naver.com/sportsman03?Redirect=Log&logNo=222032088571,익선동 맛집 -익선잡방사실 나는 뭐 먹으러 가는지도 모르고 따라옴 ㅋㅋㅋㅋ 도착해서야 알았다. 아하! 브런치랑 유럽식 식사를 하는 곳이구나! 인스타 갬성 넘치는 입간판. 우리는 인원이 5명이라 방으로... ,토끼네곰의 블로그,https://blog.naver.com/sportsman03,2020-07-16
[익선동 양식]익선잡방 ,https://blog.naver.com/jsi0623?Redirect=Log&logNo=222526848450,특히 양식집 그래서 양식 레스토랑 중에 어디를 갈까 고민하다가익선잡방 이랑 익선디미방 중에 좀 더 가까운 곳으로 가려했는데 알고보니까 두 가게가 붙어있었다 ! 심지어 현위치랑 가까워 그래서 조금 더... ,Delight,https://blog.naver.com/jsi0623,2021-10-05
대전 신세계백화점 아트사이언스 브런치 맛집익선잡방 ,https://blog.naver.com/bear9883?Redirect=Log&logNo=222537693684,대전 신세계백화점 6층에 위치한 브런치 맛집익선잡방이예요... 항상지나가는길에 떡볶이가 보여서... 올데이 브런치익선잡방올데이~~ 맘에 드네요!!! 부라타 치즈 샐러드 운동가야되니까 가벼운걸로 먹자해서... ,블랙시크,https://blog.naver.com/bear9883,2021-10-15
[서울 익선동] 한옥거리 브런치 맛집익선잡방가봤니?,https://blog.naver.com/ghdwl1410?Redirect=Log&logNo=222219624687,"가니시로 나온 구운 토마토, 옥수수는 달큰했고 크로와상은 버터향 가득 바삭바삭했고 루꼴라 샐러드도 상큼해서 정말 맛있었어요 친절한 직원분들이계신익선잡방 에서 맛있는 브런치 먹고 익선동... ","""오늘도 즐겁게 맛있게""",https://blog.naver.com/ghdwl1410,2021-01-25
"DAY 229 :익선잡방 , 리틀버틀러, 몽슈슈",https://blog.naver.com/alswl1820?Redirect=Log&logNo=222540571198,6층에 있는익선잡방/ 에스컬레이터 올라가면 거의 바로 보인다. 달고나 파는 곳이 근처에 있음. 원래 핏쟈 먹으러 가려다가 아직 오픈도 안했길래 열려있는곳이 있나 두리번거렸다. 익선이 너 당첨. 여기는... ,DDD,https://blog.naver.com/alswl1820,2021-10-18
/익선동/ 브런치맛집익선잡방 ,https://blog.naver.com/cho-cola?Redirect=Log&logNo=222256792638,익선동 맛집익선잡방 에 드디어 입장했다.익선잡방내부는 코로나 시국에 걸맞게 테이블마다 가림막이 설치되어 있었다. 도대체 이게 무슨 효과가 있는지는 모르겠지만... ㅋㅋㅋ 원래부터 식기류를 참... ,먹고 놀고 즐기는 초콜라의 리포트♡,https://blog.naver.com/cho-cola,2021-02-26
익선동 맛집익선잡방다녀왔어요 (내돈내산)♥,https://blog.naver.com/jyhshy?Redirect=Log&logNo=221839465710,"에그베네딕트 보고나니까 왜익선잡방 이 익선동 브런치 로 유명한지 알겠더라구요 ㅠㅠㅠㅠ 크으 - 에그베네딕트 예술예술! 슥 갈라 먹으면 얼 - 마나 맛있게요ㅠㅠ! 빵, 구운마늘+버섯,토마토까지 있으니... ",NONI NONI :)♡,https://blog.naver.com/jyhshy,2020-03-05
익선동 데이트코스 기념일 식사하고 온익선잡방 ,https://blog.naver.com/hip8791?Redirect=Log&logNo=222054637188,지난달 포시즌스 호텔에 갔을 때 익선동 데이트코스익선잡방 에서 남편과 기념일 맞이 소소한 데이트를 하고 왔어요 :) 작년 결혼기념일에는 신라호텔에 갔었는데 그때도익선잡방 에서 식사를 하고 왔었거든요.... ,최니,https://blog.naver.com/hip8791,2020-08-08
대전신세계아트앤사이언스점 맛집! ' 익선잡방대전신세계점',https://blog.naver.com/syeon2798?Redirect=Log&logNo=222494212702,익선동 핫플을 대전에서도 즐길 수 있어서 정말 좋았던 것 같아요!ㅎㅎ익선잡방 은 메가박스 바로 맞은편에 있어서 찾기도 쉽고 맛도 있어서 좋았어요! 대전 신세계 가보시면 한 번 가보세요~☺,소여의 모험,https://blog.naver.com/syeon2798,2021-09-03
익선동익선잡방을지로 호랑이카페 GOGO,https://blog.naver.com/sj4733?Redirect=Log&logNo=221892631555,어제 다녀온 #익선동브런치 # 익선잡방그리고 #을지로카페 #호랑이카페 포스팅익선잡방입구. 파란색 문이 참 예뻤다. 연환이 기다리면서 찍은 메뉴판. 뭐 먹징~ 그릇과 물컵이 귀욥 우리는 하루전에 예약을... ,낯선곳 어딘가에.,https://blog.naver.com/sj4733,2020-04-05
익선동맛집/ 익선잡방 /익선나들이,https://blog.naver.com/eldoek?Redirect=Log&logNo=222532588330,(그러면서 익선동에 가니..)익선잡방 이 룸으로 되어 있는곳이 있어서 창가쪽 테이블로 예약을 했어요 이자리가 제일 넉넉하고 좋은듯 합니다 (창가로 지나가는 분들의 시선을 받을수 있음ㅋㅋ) 식전빵이... ,뎨뎨,https://blog.naver.com/eldoek,2021-10-10
"종로/익선동) 한가하게 브런치 한사발, @ 익선잡방 ",https://blog.naver.com/harmony_mj?Redirect=Log&logNo=222183458909, 익선잡방아아 맛있더라ㅠㅠㅠㅠ 갬성터지는 브런치집이지만 한옥인게 또 그르케 예쁘고 그래서 익선동이 너무 좋하! 식전빵을 내어주셨다 부들부들 맛있었다리 욕심내서 발사믹 찌이인하게 찍었다가 눈감김... ,tickety boo ♪,https://blog.naver.com/harmony_mj,2020-12-24
인사동 '다이나믹 메이즈' 그리고 익선동 ' 익선잡방 ' - 한글날... ,https://blog.naver.com/happybong82?Redirect=Log&logNo=222537271487,낙원상가를 지나서 걸어가니 익선동 카페거리?같은곳이 나온다. 익선동은 이름도 처음 들어보고 처음... 우리가 점심을 먹기로 한곳은 # 익선잡방검색해보니 살치살스테이크랑 로제파스타가 맛있는 곳이라고... ,구름이 뭉게뭉게,https://blog.naver.com/happybong82,2021-10-15
대전신세계맛집 / 눈이 호강하는 브런치를 판매하는익선잡방 ,https://blog.naver.com/jung_youjin?Redirect=Log&logNo=222523931198,그와중에 점심메뉴 고를려고 써치하다가 발견한 곳 바로 # 익선잡방입니다익선잡방본점은 서울 익선동에 위치해있어요 현재 시점 전국에 매장이 2개뿐이니 2호점이라해도 되겠쥬? [영업시간] 매일 10:30-21:00... ,쩡유의 일상,https://blog.naver.com/jung_youjin,2021-10-02
[익선동 맛집]분위기 좋은 브런치 맛집익선잡방다녀왔어요,https://blog.naver.com/jhejhe0712?Redirect=Log&logNo=222515486611,"웨이팅 걸리는데는 이유가 있는거에요익선잡방굿굿 익선동 맛집익선잡방평일 11:00 - 21:00 브레이크타임 15:00-17:00 (주말 공휴일 브레이크타임 없음) Last Order 런치 15:00, 디너 20:00 포장 테이크아웃 가능 익선동... ",막찍고 막먹는 말자씨,https://blog.naver.com/jhejhe0712,2021-09-25
"익선동 맛집,익선잡방드디어 맛보다",https://blog.naver.com/narita86?Redirect=Log&logNo=222246352093, 익선잡방 의 분위기와 음식 모두 좋았어요. 유명한 맛집이라 그런지 손님도 많이 오더라구요. 다음번엔 좀 따뜻한 날 방문해서 또 맛있게 먹어야겠어요 ♡♡ #익선동 #익선동맛집 # 익선잡방 ,김모설의 Un día en la vida,https://blog.naver.com/narita86,2021-02-17
대전 신세계백화점 브런치 식당익선잡방 ,https://blog.naver.com/codewos?Redirect=Log&logNo=222507945276,그래서 오게된 6층익선잡방 ! 깔끔한 흰색톤의 브런치 식당으로 가게 내부는 살짝 어두운 편이었다 식당가인 5층 베로나스트릿에 비해서 다른 층에 있는 식당은 손님이 적었다익선잡방외의 식당들도 그랬음... ,동에 번쩍 서에 번쩍,https://blog.naver.com/codewos,2021-09-16
[익선동 맛집]익선잡방- 브런치맛집이예요,https://blog.naver.com/pholive21?Redirect=Log&logNo=221720754574,그런데 그게 바로익선잡방 의 컨셉이더라고요 간판에 모자를 쓰고있는 여자의 모습이 어디서 봤다 싶었는데 바로 옆에 있는 익선동 맛집 익선디미방의 간판이지 뭐예요ㅎㅎ익선잡방 은 익선디미방의 이상훈... ,달콤채앤완맘,https://blog.naver.com/pholive21,2019-11-28
"익선동 데이트 추천 코스/오믈렛,파스타 맛집 [ 익선잡방 ]",https://blog.naver.com/hawon1717?Redirect=Log&logNo=222536239117,매장 테이블이 가까이 붙어있는 거 빼고는 만족스러운 식사였습니당 ㅎㅎ 그럼 20000 #익선동데이트 #안국데이트 #인사동데이트 # 익선잡방#인사동파스타 #인사동맛집 #익선동파스타 #익선동맛집 #브런치... ,오닝's blog,https://blog.naver.com/hawon1717,2021-10-14
대전 신세계익선잡방/ 하프커피 / 버터풀앤 크리멀러스,https://blog.naver.com/dreamer_0309?Redirect=Log&logNo=222514314638,사실익선잡방 은 오믈렛 맛집이라는데.. 오믈렛을 안시켰더라고요. 이런 실수를.. 그래도 깨끗하게 잘...익선잡방쉐프가 신라호텔 경력만 10년이라던데 네.. 신라호텔 대신 여기 가도 되겠죠 ㅋㅋㅋㅋ 살치살... ,뉴스킨 짱돌녀의 홈 뷰티 라이프,https://blog.naver.com/dreamer_0309,2021-09-23
익선동 맛집 ::익선잡방/ 카페 하이웨스트,https://blog.naver.com/dldbwls3343?Redirect=Log&logNo=222531368299,오늘은 9월 제 생일에 갔던 익선동 맛집과 카페를 소개 하려구해용 ෆ 요즘 종로 익선쪽을 자주 가는데... 좋아보여서익선잡방 으로 ! 네이버 예약도 되니 하루 전날에 예약하는걸 추천드려요! 저희는 깜빡하고... ,WE ARE JUST GONNA WAIT AND SEE,https://blog.naver.com/dldbwls3343,2021-10-08
익선동 ' 익선잡방 ',https://blog.naver.com/kellyhj34?Redirect=Log&logNo=222128365688," 익선잡방 은 익선디미방 1분 거리에 위치해있다. 파란대문의익선잡방 .익선잡방내부는 그렇게 크지 않다.. 혹시 모르니 예약하는걸 추천.익선잡방메뉴는 가게앞에 있음. 왼쪽은 음식, 오른쪽은 음료. 요즘은... ",켈리의 스윗홈♥,https://blog.naver.com/kellyhj34,2020-10-29
익선동 브런치 :익선잡방IKSSEON JABBANG 짧은 후기,https://blog.naver.com/sweet1014s?Redirect=Log&logNo=221784873819,익선동 :익선잡방IKSSEON JABBANG 짧은 후기 핫하다는 익선동에 다녀왔다. 괜찮은 곳 몇 군데를 추려서 다녀온 파란대문이 예쁜익선잡방 . 이 날은 오랫만에 지하철을 탔는데 역에서 내려 출구로 나와 직진하니... ,",",https://blog.naver.com/sweet1014s,2020-01-25
익선동 -익선잡방 /익선동브런치/ 익선잡방 브런치/종로브런치... ,https://blog.naver.com/boldys?Redirect=Log&logNo=222219158959," 익선잡방 메뉴 # 익선잡방 가격 우리는 에그 베네딕트, 라자냐, 바닐라라떼, 아아를 주문했다 시원한 물병이 자리에 준비되어 있었고 병이 너무 이쁘다 당연 식기류도 너무 이뻤다 오랜만이야 이런 감성 #익선동감... ",je ne sais quoi,https://blog.naver.com/boldys,2021-01-25
[익선동] 올데이브런치 맛집익선잡방/ 홍콩식 와플 한옥카페... ,https://blog.naver.com/julie0202?Redirect=Log&logNo=222404199413,익선주택이라는 간판.익선잡방 과 위치도 비슷한데 이름도 비스무리하다. 그렇지만 이곳은 레스토랑이 아닌 카페라는 점. 입장해보니 여긴익선잡방 보다 더 과감한 개조를 한 듯하다. 기와의 흔적(?)으로 보아... ,우사일기,https://blog.naver.com/julie0202,2021-06-27
익선동 맛집 | 새우로제파스타 맛집양식집익선잡방 ,https://blog.naver.com/pancakewestzero?Redirect=Log&logNo=222518702596,"*내부가 협소하기에, 밥먹으면서 천천히 얘기 나눌만한 곳은 아닌 것 같다 그럼 이상- 후기 끝- # 익선잡방#익선동양식집 #익선동맛집 #익선동 #익선동파스타 #새우로제파스타 #파스타잘하는집 #파스타맛있는집",Eat pizza on a rainy day,https://blog.naver.com/pancakewestzero,2021-09-27
[익선동/서울] 익선잡방브런치 먹으러 다녀왔어요!,https://blog.naver.com/mintraveler?Redirect=Log&logNo=222268896399,"종로 3가 역 내려 15분정도(?) 걷다보니 나온익선잡방 ! 퍼플씨와는 오늘 브런치를 먹을 예정으로 #익선동브런치 를 검색해 왔습니다! 내부는 깔끔하지만, 넓지는 않았습니다. 코로나 시국으로 큐알체크인과... ",흐물이의 일상로그,https://blog.naver.com/mintraveler,2021-03-08
대전 신세계 백화점 브런치 :익선잡방 ,https://blog.naver.com/kinmgo?Redirect=Log&logNo=222523294255,대전 신세계 백화점 브런치 맛집익선잡방#대전신세계맛집 #대전브런치 # 익선잡방꾸얌입니다 ! 대전에 신세계 백화점이 생기면서 지역별로 유명한 맛집들도 입점해서 넘 좋더라구요 ! 신세계에는... ,My life style,https://blog.naver.com/kinmgo,2021-10-01
서울 익선동 브런치먹기 딱!익선잡방다녀왔어요,https://blog.naver.com/kimvely2012?Redirect=Log&logNo=222011267762,종로3가역 4번 출구로 나와서 신호등 건너면 익선동 골목으로 입장! 저는 이쪽에익선잡방 이 있기때문에 이 쪽으로만 가봤어요. 그리고 돌아다니다가 발견하고 '여기다!'하고 내적비명 질렀네요 ㅎㅎㅎ 줄이 길게... ,꿀니몽의 달달한 오늘,https://blog.naver.com/kimvely2012,2020-06-24
"[대전신세계]익선잡방내돈내산 찐 솔직후기, 추천메뉴",https://blog.naver.com/rkdgpfl2097?Redirect=Log&logNo=222521236572,서울 익선동에 있는익선잡방 에 방문해보았습니당! 신세계 6층 메가박스 맞은편에 위치해있어요. 전 웨이팅없이 아주 여유롭게 방문하게 되었어요익선잡방인테리어 전체적으로 화이트톤에 플랜테리어로... ,✿ 혤밥 스토리 ✿,https://blog.naver.com/rkdgpfl2097,2021-09-29
익선동 맛집 -익선잡방:),https://blog.naver.com/dksgpwls26?Redirect=Log&logNo=222482888109,후훗 익선동 맛집익선잡방분위기가 넘 좋아서 친구한테도 추천추천 코로나끝나면 같이가쟈! 음~ 맛있어 나 행복해 배고팠다가 먹는 그 맛은 더욱 짜릿하죠 아이러니하게도 식전빵이 제일 마지막에 나와버림... ,이쁜슈렉 서브블로그*,https://blog.naver.com/dksgpwls26,2021-08-25
"일상/ 익선잡방 _익선동 분위기깡패 브런치 맛집, 가격, 메뉴, 위치",https://blog.naver.com/somsom_dayz?Redirect=Log&logNo=221704342963,여러분도 한번 꼭 가보세요!!! 그럼 다음 일상블로그에서 만나요 안뇨오오옹 #익선동 #익선동맛집 #익선동카페 #익선동브런치 # 익선잡방#익선디미방 #익선동조용한맛집 #종로맛집추천 #종로카페 #종로맛집... ,솜솜한 일상들,https://blog.naver.com/somsom_dayz,2019-11-11
익선동 분위기 좋은 맛집익선잡방후기,https://blog.naver.com/min76joo?Redirect=Log&logNo=222542872252,요즘 서울많이가는데 익선동은 한번도 안가봐서 익선동 함가보자 하구 맛집찾다가익선잡방 이 리뷰도 엄청많길래 여기로 고고씽 했습니당 ㅎ익선잡방서울 종로구 수표로28길 17-21 평일 11:00 - 21:00... ,밍구리 블로그,https://blog.naver.com/min76joo,2021-10-20
[익선동 맛집/ 익선잡방 /서오릉 아구가/서오릉... ,https://blog.naver.com/yoonjee1215?Redirect=Log&logNo=222358011786,"익선동 근처로 저녁먹으러 간김에 재미삼아 해본 ㅎㅎ #익선동맛집 # 익선잡방스테이꾸 좀 썰었당 새우로제파스타였나 ?! 오믈렛 ! 글쎄,,,, 쏘쏘,,,,,, 평일이라 그런지 사람이 바글바글하진 않았다 사람 너무... ",SpringtoSummer,https://blog.naver.com/yoonjee1215,2021-05-20
[익선동익선잡방 ] 평일에 혼자 즐긴 익선동 브런치 맛집,https://blog.naver.com/j_yun93?Redirect=Log&logNo=222045007556,[익선동익선잡방 ] 평일에 혼자 즐긴 익선동 브런치 맛집 나 요즘 쫌 익선동 자주가는듯한데..?! 여튼ㅋㅋㅋㅋ혼자 평일에 오후반차쓰고 3시반쯤 갔더니 한적해서 좋았던 곳 역시 주말은 피해야하나보당 그나저나... ,윤쿠잉의 스윗메모리,https://blog.naver.com/j_yun93,2020-07-29
서울 익선동익선잡방 ,https://blog.naver.com/laj9581?Redirect=Log&logNo=222506721964,브런치익선잡방밥 어디서 둘 다 못정해서 어렵게 오게된익선잡방시작! 활짝 열린 파란 문 여기가 입구 들어가서 왼쪽에 독립된? 공간에 테이블이 있다 오른쪽 자리로 들어가기 전에 벽면에 식기와... ,에이진로그,https://blog.naver.com/laj9581,2021-09-15
[익선동맛집]익선동 브런치는익선잡방 에서,https://blog.naver.com/cerian?Redirect=Log&logNo=221868723848,200323 아트샵 당번일엔 익선동 브런치^^ 시간이 없으니 인사동쪽에서 가까운익선잡방 으로 뛰어들어갔다... ...가 순간 깜놀! 진짜 강쥔줄 알았다가ㅡㅡㅋ 입구 옆에 오붓한 공간이 있고 반대쪽으론 ㄱ자 공간이... ,화양연화,https://blog.naver.com/cerian,2020-03-23
"[대전신세계백화점]익선잡방 , 하프커피, 쇼핑~~",https://blog.naver.com/juhee9533?Redirect=Log&logNo=222535067412,유명한 # 익선잡방이에요 익선동에서 유명한 곳이라는데 서울 맛집을 대전에서 먹어볼 수 있다니 완전 기대됐어요사진은 다 먹고 나오면서 찍은 사진이라 사람이 많아요 ㅠㅠ 저는 오픈하자마자 방문해서... ,조림이블로그:),https://blog.naver.com/juhee9533,2021-10-12
" 익선잡방 , 로제파스타와 살치살 스테이크",https://blog.naver.com/hanumul7?Redirect=Log&logNo=222488641539,"익선동에서 점심을 먹을까 하고 들렀다. 2~3년 전에 한참 핫하다고 할 때 두어 번 가본 뒤로 서울...익선잡방시즈닝 새우 로제 파스타 18,000 알리오올리오를 좋아하지만 외식에선 내가 안 만드는 요리 주문하기... ",아침해를 보러가자,https://blog.naver.com/hanumul7,2021-08-30
익선동익선잡방 ,https://blog.naver.com/dk_yelin?Redirect=Log&logNo=221696382068,"걸어갈 만한 거리에 익선동이 있길래 오늘 행선지는 익선동으로 정해봄. 사실 익선동 핫 하다는 소리는...익선잡방맛있음. 양 적다고 하는데, 얘랑 저랑 원래 양이 정말 작아서요.. 저희는 괜찮았어요. 밀린... ",Relativity,https://blog.naver.com/dk_yelin,2019-11-03
익선동 한옥레스토랑 브런치 ::익선잡방내돈내산 후기,https://blog.naver.com/7358600?Redirect=Log&logNo=222263204240, 익선잡방브런치 먹고 온 솔직한 후기 였어요 ^-^ #내돈내산 #내돈내먹 # 익선잡방#종로브런치 #마스카포네치즈오믈렛 #오믈렛맛집 #한옥레스토랑 #스테이크 #로제파스타 #라자냐 #분위기좋은맛집 #익선동... ,하나로투어,https://blog.naver.com/7358600,2021-03-03
익선동 브런치 맛집 :익선잡방 ,https://blog.naver.com/jinyoung0822?Redirect=Log&logNo=221840513493, 익선잡방친구들이랑 브런치 하러 가기 좋은집 ! 오조오억년 만에 만난 칭구 신영이와 수원과 성수 가운데 그 어디쯤으로 고른 익선동 분식도 좋아하지만 오랜만에 브런치 먹자며 잡은 약속 골목에 핫플 많이... ,대식가 김씨의 다정한 블로그,https://blog.naver.com/jinyoung0822,2020-03-06
