title,link,description,bloggername,bloggerlink,postdate
익선동맛집익선잡방종로3가 데이트 내돈내산,https://blog.naver.com/secret_lilac?Redirect=Log&logNo=222484837252,#내돈내산 #익선동맛집 # 익선잡방#익선동맛집추천 익선동 답게 매장 내부 곳곳에 한옥의 인테리어를 살려 놓았더라구요 전체적으로는 이렇게 모던한 느낌의 인테리어에 우드가 조화롭게 따듯한 느낌을 주는... ,몽이의 블로그,https://blog.naver.com/secret_lilac,2021-08-26
[익선동] 익선잡방 /브런치 맛집/종로 맛집/데이트/메뉴판... ,https://blog.naver.com/tjfflqmdl?Redirect=Log&logNo=221656206604,종로 익선동 맛집 [ 익선잡방 ] 종로 3가역과 안국역사이 익선동이 요즘 엄청나게 핫플레이스 잖아요~~ 저도 익선동 골목을 몇번 가보긴 했는데 ㅋㅋ 갈때마다 업그레이드 되고 있더라구요 이번에 평일에... ,라빔 블로그,https://blog.naver.com/tjfflqmdl,2019-09-25
"익선동 카페 동백양과점, 익선동 맛집익선잡방 , 익선동 카페 온화",https://blog.naver.com/babyfoxjune?Redirect=Log&logNo=221665827273,"[서울/익선동] 익선동 나들이 익선동 카페 동백양과점, 익선동 맛집익선잡방 , 익선동 카페 온화 영혼의 동반자 M과 거의 일년만에 만났어요 영혼의 동반자기이는 하나 서로 연락도 잘 안하고 자주 만나지도... ",인생을 즐기는 최블리,https://blog.naver.com/babyfoxjune,2019-10-02
익선동 나들이 ~익선잡방브런치 맛집 과 감꽃당 타르트... ,https://blog.naver.com/tjsal1609?Redirect=Log&logNo=222512375244,달콤한 시럽과 함께 바나나 위에 시럽을 구운건지 달콤함이 두배 브런치 맛집인 이유가 있네요 브런치 2인 세트 메뉴도 있는데 요것두 나쁘지 않을거 같아요익선잡방 은 익선 디미방과 한집 바로 옆에 있는데요... ,tjsal1609님의 블로그,https://blog.naver.com/tjsal1609,2021-09-21
익선동 맛집익선잡방살치살 스테이크 추천해요 ㅎㅎ,https://blog.naver.com/jjanga1607?Redirect=Log&logNo=222489529992,안녕하세요~ 귀걸이 전문 쇼핑몰 니쥬링입니다 ㅎㅎ 오늘은 종로 익선동에 위치한 맛집!익선잡방소개해 드릴게요ㅎㅎ 위치는요~ 서울 종로구 수표로28길 17-21익선잡방종로3가역 4번 출구에서119m 정도에... ,니쥬링,https://blog.naver.com/jjanga1607,2021-08-30
익선동맛집 브런치익선잡방파스타샐러드 맛좋아,https://blog.naver.com/coffeelove7?Redirect=Log&logNo=221552095109,익선동맛집익선잡방감바스오일파스타와 샐러드 핵맛짱~~ 서울에서 단기간 살았던적이 있어서 그동안 알게 된 회사 언니와 올만에 만나게 되었습니다. 구입할 재료들이 서울에만 있다보니 보러 가야 될 일 이... ,★메이드온리-토퍼~★,https://blog.naver.com/coffeelove7,2019-06-01
익선동익선잡방 ,https://blog.naver.com/elsunny99?Redirect=Log&logNo=221344794665,"하여 어느 해가 뜨거운 금요일 점심을 먹으러 익선동에 갔다. 그 중에서도 특히 # 익선잡방에 가고 싶다고 해서 예약도 했다. 6명, 4명 따로 앉는데 나는 재빠르게 6명 테이블로 자리를 잡았다. 당연히... ",혼자서 놀자!,https://blog.naver.com/elsunny99,2018-08-23
익선 디미방에 반해서 갔다 더 반한 익선동맛집익선 잡방 !,https://blog.naver.com/asd7565?Redirect=Log&logNo=221292471585,화장실 문도 예뻐 한 컷!^^익선 잡방 만의 느낌. # 익선잡방#익선동 #익선동맛집 #종로맛집 #익선동나들이 #익선동파스타 #익선동브런치 #브런치맛있는집 #익선동코스 #익선동골목,우당탕탕 왕굠네,https://blog.naver.com/asd7565,2018-06-05
[익선동]눈에 띄는 파란대문집에 들어서다 :익선잡방 ,https://blog.naver.com/bazamss?Redirect=Log&logNo=221390825288," 익선잡방운영시간 안내익선 잡방소개 신라호텔 10년 경력 오너셰프 익선디미방의 연결고리 - (이상훈셰프의 두번째 레스토랑) 낮에는 브런치 , 저녁에는 캐주얼비스트로. 버건디와 트렌치코트... ",빛나는 일상을 위해 :),https://blog.naver.com/bazamss,2018-11-03
180623 익선동 브런치익선잡방 ,https://blog.naver.com/will_1?Redirect=Log&logNo=221307075712,지금은 월루타임 (에이!) 드디어 가본다 익선동ㅠ 옛날에 낙원상가에 친구가 키보드산대서 따라와본 이후 처음.... 열심히 인스타검색으로 찾아낸익선잡방 ! 브런치로 검색해서 제일 맘에 들었다는.... 다행히... ,하루하루가 특별한 나날,https://blog.naver.com/will_1,2018-06-26
[익선동]익선잡방 ,https://blog.naver.com/gksttleekf?Redirect=Log&logNo=222063217711,여름휴가중 서울서 볼일 좀 보고 간만에 익선동 방문 점심을 못 먹고 이동하느라고 여기저기 알아보다가 브레이크타임없다는 # 익선잡방방문 휴~ 복잡한 익선동 뱅글뱅글 돌다 도착 도착하니 한 세팀정도... ,나는 달♪,https://blog.naver.com/gksttleekf,2020-08-17
익선동 맛집익선잡방브런치 카페에서 먹는 치즈 오믈렛과... ,https://blog.naver.com/starexone?Redirect=Log&logNo=221773567681,익선동 맛집익선잡방 에서 맛있는 브런치 타임 오랜만에 딸이랑 겨울 데이트를 했답니다. 어디를 가볼까 하다가 익선동에서 점심을 먹기로 했어요. 요즘은 익선동 거리가 인기라면서요. 지붕이 나지막한... ,기사포함렌트카 스타렉스로,https://blog.naver.com/starexone,2020-01-16
"대전 신세계백화점 ArtScience익선잡방오믈렛, 파스타... ",https://blog.naver.com/lovely8911?Redirect=Log&logNo=222495910056,점심 어떻게 먹지.. 걱정했는데 타이밍 좋게 웨이팅 없을때 들어왔고 직원분들도 넘 친절하셔서 기분 좋게 먹고 나왔어요 ㅎㅎ 익선동에 가지 않아도 먹을 수 있는 #익선동맛집 # 익선잡방#잘먹었습니다,LOVE_H,https://blog.naver.com/lovely8911,2021-09-05
대전 신세계 맛집익선잡방다녀옴! 너무 만족한 6층의 비밀식당?,https://blog.naver.com/eagles173?Redirect=Log&logNo=222495629109,↑ 대전 신세계백화점 6층에 위치한익선잡방이라는 식당입니다. 6층에도 식당이 있는줄 몰랐어요...... ↑ 대전신세계백화점익선잡방메뉴판 1번 파스타는 시즈닝 새우 로제 파스타가 잘 나간다고 해서... ,우리들이 필요한 모든 정보,https://blog.naver.com/eagles173,2021-09-05
세계에서 가장 아름다운 야경3위인 종로3가 익선동 /익선잡방 ... ,https://blog.naver.com/jinyou666?Redirect=Log&logNo=222534304703,"왔는데 익선동 걷다가 대기 1팀 보고 # 익선잡방들어왔다 ㅎㅎ 내부 예쁘다 석가래는 고즈넉한 분위기~ 메뉴판입니다. #매콤항정파스타 ,봉골레 ,치킨 커리리조또 내가 먼저와서 대기했음 메뉴판갬성 비와서... ",오카에리나사이 ~ ^^*,https://blog.naver.com/jinyou666,2021-10-12
[20201218] 꼭 다시 찾아갈 비싸고 맛있는 집 - 익선동익선잡방 ,https://blog.naver.com/xdreamx?Redirect=Log&logNo=222243588862,"선택권을 과장1에게 맡기고 따라간 곳은 익선동의 ' 익선잡방 '이라는 곳이었다. 파란색 대문이 아주 색다른 곳인데, 그냥 파란색이 아니라 음... 저걸 뭐라고 하는지 모르지만, 느낌이 있는 파란색? ㅋㅋㅋ 하여간... ",뭘해도 어설픈 남편 그리고 아빠의 일기,https://blog.naver.com/xdreamx,2021-02-15
대전신세계익선잡방 ,https://blog.naver.com/kbs031511?Redirect=Log&logNo=222499279459,(이것도 평일이야기이고 주말에는 어떨지 모른다.) 신세계내 맛집을 굳이 평가해보자면(내취향껏) 호우섬메시호산호라이즌익선잡방 =맛이차이나크레이지카츠(밍밍하고 질기고 별로),Marigold,https://blog.naver.com/kbs031511,2021-09-08
대전 신세계 백화점 맛집 /익선잡방대전 신세계점/ 하프커피... ,https://blog.naver.com/lovelmj2?Redirect=Log&logNo=222513560844,"그중에 저는 익선동 맛집인익선잡방이라는 곳을 가보고 싶었어요, 익선동 맛집을 대전에서 맛볼수 있다는데 안가볼 수 없쥬 포스팅 시작해볼게요! 대전 유성구 엑스포로 17 대전신세계 아트앤사이언스 6층... ",help somebody,https://blog.naver.com/lovelmj2,2021-09-22
익선동/ 익선잡방 /내돈내산/솔직후기,https://blog.naver.com/ggongming?Redirect=Log&logNo=222463901873,다른곳을 가봐야지 #익선동내돈내산 # 익선잡방 내돈내산 #마스카포네치즈오믈렛 #꿀자몽 #양송이크림소스의살치살스테이크 #익선동데이트코스추천 #익선동맛집추천 #익선동레스토랑추천 #익선동분위기좋은맛집,선물같은 하루,https://blog.naver.com/ggongming,2021-08-10
"익선동,익선잡방방문기",https://blog.naver.com/bbsk1212?Redirect=Log&logNo=222458553196,너무 잘 먹었다. # 익선잡방잘 선택했다 싶다. #익선동_파스타 검색한다면 한번 가보길- 테이블 사이가 매우 좁아 답답하긴 하지만 그게 익선동 매력 중 하나이기도 하니.익선잡방찾아가는 길,미설's 아름다운 이야기,https://blog.naver.com/bbsk1212,2021-08-05
익선동 브런치 맛집 -익선잡방그리고 오타르,https://blog.naver.com/unicts?Redirect=Log&logNo=221999683696,▼ 오늘은 머리도 새로 하고... ▼ 종로구 브런치 맛집인익선잡방▼ 익선동 타르트 전문점 오타르에서 후식. 오타르 제품은 사악한 가격에 비해 맛은 별로라 이제 더 이상 안가는거로...,오늘도 난 낙서를 한다.,https://blog.naver.com/unicts,2020-06-13
익선동 브런치익선잡방- 캐러멜라이징 토스트 존맛 ㅠㅠ !,https://blog.naver.com/storyshower?Redirect=Log&logNo=221337145003,이름은익선잡방 이다! :-) 익선동에 있는 카페나 음식점들은 다 분위기 좋고 예쁘고 아기자기해서 인스타 사진찍기도 좋고 분위기를 즐기기도 좋은것 같다! 한옥 구조의 인테리어! 내부는 넓지는 앉지만... ,Sun's story,https://blog.naver.com/storyshower,2018-08-12
[맛집추천/서울 익선동 맛집] 익선동 맛집익선잡방 ,https://blog.naver.com/star6334?Redirect=Log&logNo=222471017760," 익선잡방익선동 골목 맛집 영업시간 : 11시~ 21시 (단, 평일은 15시 ~ 17시 사이 브레이크타임) 주차 : 당연히 익선동 골목길에 위치해있어서 어려워요 주소 : 서울 종로구 수표로28길 17-21익선잡방네이버 예약이... ",SilverLog_❤,https://blog.naver.com/star6334,2021-08-15
익선동 파스타 맛집익선잡방: 라자냐가 유명한 곳 솔직후기,https://blog.naver.com/whybxb?Redirect=Log&logNo=222491778690,익선동엔 예약 안되는 식당이 많은데익선잡방 은 네이버 예약이 가능해서 좋다. 금요일 저녁 7시로 예약하고 방문했다. 들어갔을 때 만석은 아니었는데 금세 자리가 다 찼다. 그래도 웨이팅은 없었음 ! 시즈닝... ,이지둥의 둥글게,https://blog.naver.com/whybxb,2021-09-01
 익선잡방맛있는 올데이 브런치! : 대전 신세계... ,https://blog.naver.com/ectyui?Redirect=Log&logNo=222496654632," 익선잡방- 대전 신세계 아트앤사이언스 - 안녕하세요, 놀.먹.사.입니다. 이번 포스팅에서는 대전 신세계 아트앤사이언스 6층에 자리한 올데이 브런치 레스토랑익선잡방 에 대한 리뷰를 적어보려합니다.... ",놀고 먹고 사는 행복한 인생 (놀.먹.사),https://blog.naver.com/ectyui,2021-09-06
"요즘, 익선동( 익선잡방 , 플리퍼스, 양키스버거)",https://blog.naver.com/ilovejo56?Redirect=Log&logNo=222514214920,갔던익선잡방 ! 예약하고 가서 웨이팅 안했는데 웨이팅하고 있는 사람 꽤 많았다. 그리고 꿀자몽 너무 맛있었다... 2. 플리퍼스 익선점 딸기 후르츠 수플레 팬케이크 수플레 진짜 부드럽고오.. 퐁신퐁신하고... ,손바닥만한 노트,https://blog.naver.com/ilovejo56,2021-09-23
익선동 맛집익선잡방 /매일 10인분 한정판매 라자냐,https://blog.naver.com/kangji528?Redirect=Log&logNo=222471137136,익선동 맛집익선잡방맛있는 데이트코스 추천 만나는 시간 열한시 헤어지는 시간 아홉시 브레이크 15~17시 마지막 주문/런치:15시 디너:20시 ☎ 0507-1313-3418주차불가안녕하세요 리또입니다 ᰔᩚ 지난번... ,ღ 오늘도 리또록 ღ,https://blog.naver.com/kangji528,2021-08-15
"종로 맛집익선잡방 , 카페 밀",https://blog.naver.com/reina1124?Redirect=Log&logNo=222009591747,"작년에 종로에서 a month 모임을 가졌는데 사진첩 정리하다가 이제서야 이렇게 올려본다 종로가면 또 가고싶은익선잡방 , 그리고 카페 밀 사진 정리가 목적이니까 사진만 쭉~~ 나열해야겠다 :) 오징어먹물... ",자유롭게 피어나기 ♪,https://blog.naver.com/reina1124,2020-06-23
대전 신세계백화점 브런치 맛집익선잡방/ 맷차 그리고... ,https://blog.naver.com/s4309999?Redirect=Log&logNo=222516886845,"위치한 # 익선잡방다너와써여 분위기 있지여? 인테리어도 깔끔 메뉴에요 브런치메뉴, 와인, 음료 종류가... 대전 익선잡방#대전브런치 #대전신세계백화점맛집 #대전실내데이트 #대전데이트코스... ",율LIFE LOG,https://blog.naver.com/s4309999,2021-09-26
"대전 신세계백화점 브런치 맛집 ' 익선잡방 ' 내돈내산, 무작정... ",https://blog.naver.com/rmsdud5694?Redirect=Log&logNo=222492161995,신세계에서 점심으로 먹었던익선잡방5층이 식당가지만익선잡방 은 6층에 있음 6층 인생네컷 건너편에 위치해있다 자리가 많이 비어있길래 오 웨이팅 없나보다! 했는데 그냥 생각없이 기다리는 동안 앞에... ,just eat,https://blog.naver.com/rmsdud5694,2021-09-02
대전신세계백화점익선잡방멧차,https://blog.naver.com/bmini070707?Redirect=Log&logNo=222485062802,6층익선잡방 이 가고 싶어서 바로 6층으로 ㄱㄱ 익선동에 유명한 브런치 식당이랬는데 6층엔 먹거리가 이것뿐이라 그런지 5층 식당가에 비해서 사람이 별로 없더라구요. 조용하게 즐길 수 있어서 겁나 좋긴... ,BMINI,https://blog.naver.com/bmini070707,2021-08-27
[초간단 리뷰] 종로/종각/익선동 맛집 '살라댕방콕/익선잡방 ... ,https://blog.naver.com/ddundduns?Redirect=Log&logNo=222495851087,"맛은 그냥 그냥 ~ 가격은 익선동 st로 사악하구여,,.익선잡방저는 프렌치 토스트를 너무너무 좋아하는데 제대로 한다고 생각한 곳은 부산 그랜드 조선 딱 한곳 뿐이없었습니다 프렌치 토스트 유목민이라... ",뚠쓰의 뚠뚠한 일상이야기,https://blog.naver.com/ddundduns,2021-09-05
익선동맛집익선잡방 ,https://blog.naver.com/dua010?Redirect=Log&logNo=222447047491,만족하게 먹은 식사 오빠랑도 또 가고싶당 완 전 추 천 입니당 !!!!#익선동맛집 #종로맛집 #종로3가맛집 #익선동브런치 #종로브런치 #종로3가브런치 #익선동데이트 #종로데이트 #종로3가데이트 # 익선잡방 ,유나의 두둠칫 일상,https://blog.naver.com/dua010,2021-07-27
익선동 맛집익선잡방후기 (+ 익선동 구스아일랜드),https://blog.naver.com/soohyun1010?Redirect=Log&logNo=222305262733,3월 초에 다녀온 익선동 맛집익선잡방후기! 라자냐 사진보고 여기 가야겠다!! 싶었어요 위치는 여기! 라연 출신 쉐프가 한다해서 엄청 기대했어요 입구에 있는 가게 메뉴판! 예약을 하고 가는게 더 좋은 것... ,메리의 일상 그리고 여행,https://blog.naver.com/soohyun1010,2021-04-10
 익선 잡방후기(+서울 뚜벅이 투어 2탄),https://blog.naver.com/dkscna?Redirect=Log&logNo=222467831681,(좀 늦긴 했지만) 어찌어찌 나와서 익선동 구경 시작 첫 번째 코스는 익선동 포토 이즘! 뭐가 이렇게... 우리가 가려던익선 잡방 이 꽉 차고 웨이팅도 있고 그래서 이곳저곳 엄청 기웃거렸다. 근데 식당들이 다... ,잉 여 로 운 생 활,https://blog.naver.com/dkscna,2021-08-13
‘ 익선잡방 ’ 종로구 익선동 파스타,https://blog.naver.com/sarahky77?Redirect=Log&logNo=222373459239,깔끔하고 금요일 점심시간에 가서 그런지 사람도 많지 않아서 좋았습니다 ! #익선동맛집 #익선동양식 #익선동파스타 #종로파스타 #종로맛집 # 익선잡방#데이트 #익선동데이트 #익선동브런치 #브런치 #종로데이트,귤주 ’s Life,https://blog.naver.com/sarahky77,2021-05-29
익선동맛집 치즈오믈렛 브런치맛집익선잡방 ,https://blog.naver.com/elelash_?Redirect=Log&logNo=222444774601,15분도 안되서 다~ 먹었다는 사실 ㅋㅋㅋㅋㅋㅋㅋ #익선동맛집 # 익선잡방#브런치맛집 #치즈오믈렛 #마스카포네 #레드오렌지 #로제파스타 #종로3가맛집 #종로3가파스타 #익선동브런치,이엘 하늘바라기,https://blog.naver.com/elelash_,2021-07-25
[익선동맛집] 살치살 스테이크 강추해요 ' 익선잡방 ',https://blog.naver.com/midnight21?Redirect=Log&logNo=222439637843,"돈 하나도 안아깝고 진짜 맛있게 먹은 듯 평일 낮에 익선동에서 이런 맛있는 식사로 힐링하는 거 간만이라 좋았어요 ㅋㅋ 익선동에 괜찮은 식당 없나 찾고 있다면,익선잡방완전 추천해요 :)",쾌실짱의 먹부림 대방출,https://blog.naver.com/midnight21,2021-07-21
익선동익선잡방 ,https://blog.naver.com/gjtjdtnr12?Redirect=Log&logNo=222503522717,같네요 부라타 치즈 샐러드랑 먹으면 더 맛있답니다 로제파스타 로제파스타 쏘쏘 새우도 크고 맛있었어요 테이블보니 오므라이스 많이들 드시는 것 같던데 다음에는 오므라이스 먹어야겠어요! #익선동 # 익선잡방 ,이터니티,https://blog.naver.com/gjtjdtnr12,2021-09-12
[맛집가자] 익선동 브런치 맛집 -익선잡방 ,https://blog.naver.com/yellowlatte?Redirect=Log&logNo=222317480909,익선동 브런치익선잡방날도 좋고 기분전환으로 멀리멀리 점심을 먹으러 나간날 무겁지도 않고 먹고나서 배가 너무 고프지않을 메뉴 브런치? 그래서 제리빈은 # 익선잡방으로 갔습니다익선잡방 에는... ,제리빈 블로그,https://blog.naver.com/yellowlatte,2021-04-21
"[종로3가역/익선동] 익선동 거리 브런치 맛집, ' 익선잡방 '",https://blog.naver.com/mariayun41?Redirect=Log&logNo=222349104804,그래서 다녀온 익선동 브런치 맛집익선잡방익선동에서 나름 핫한 곳으로 이름만 많이 들어본 곳을 드디어 평일 낮에 다녀와봤어요! 브런치 맛집이지만 5시에 간건 안 비밀.. 참고로 3-5시 브레이크 타임이... ,쿨로그,https://blog.naver.com/mariayun41,2021-05-15
8/6 하루 [종로 익선동 카페 온화/ 익선잡방 /인생네컷/푸하하... ,https://blog.naver.com/dkfls0870?Redirect=Log&logNo=222460075737,너뮤너무 보고 싶었던 고등학교 친구 만나서 익선동으로 고고공 카페온화라는 곳이고 수플레... 된익선잡방입니다 메뉴가 진짜 많았는데 스테이크랑 파스타보고 홀린듯이 들어갔어요ㅋㅋㅋㅋㅋ 여기도 감성... ,Arini,https://blog.naver.com/dkfls0870,2021-08-07
[대전신세계백화점 맛집 :익선잡방 ] 대전신세계 ArtScience... ,https://blog.naver.com/qkrqhdud23?Redirect=Log&logNo=222484554832,모여있었는데익선잡방 은 6층에 위치하고 있었어요 이사진을 보고 반했답니다여자분들 대부분 좋아할 메뉴구성! 익선동 한옥거리에 본점이 있나보네요 위치는 삼성매장 근처였어요 ㅎㅎ 벽 없이 바로... ,모농이의 햅삐데이 ꢭꢭ,https://blog.naver.com/qkrqhdud23,2021-08-26
종로3가 익선동 브런치 -익선잡방 ,https://blog.naver.com/maannie?Redirect=Log&logNo=222412068642,ㅋㅋㅋ)에 토핑 올라가는건데.. 그냥.. 그 맛.....ㅎㅎㅎㅎ 다음에는 익선동을 벗어나 다른 브런치 가게를 가야겠어요 :) #종로3가 #익선동브런치 # 익선잡방#로제파스타 #에그피자 #치즈오믈렛 # 익선잡방 메뉴,bell's archive,https://blog.naver.com/maannie,2021-06-27
20210913 익선동익선 잡방식전 빵이 음식 먹던 도중에... ,https://blog.naver.com/superkingyj?Redirect=Log&logNo=222504799108,언니랑 익선동에 있는익선 잡방 으로 저녁 먹으러 갔음. 위치는 이 곳. 종로3가 4번 출구에서 나와서 한 5분정도 걸어가면 됨ㅎㅅㅎ. 갔는데 떼용~~~~ 함. 왜냐?? 저는 언니랑 6시반에 만나기로 했는데 내가... ,I'M A KILLER QUEEEEEEEEEEEEEEN,https://blog.naver.com/superkingyj,2021-09-14
[익선동/서울]익선동 맛집 찾다가 고른익선잡방브런치,https://blog.naver.com/salon_de_s?Redirect=Log&logNo=222392377294,"할 정도는 아니었지만 딱히 갈 곳이 생각나지 않는다면, 기본만 하면 된다 - 하면 오시는거 추천 ! 저는 다음에 오게된다면 많이 주문하는 오믈렛을 주문할까 합니다 ˙ᵕ˙ #내돈내산 #익선동브런치 # 익선잡방 ",엠마이야기 : T R R O,https://blog.naver.com/salon_de_s,2021-06-10
익선동 브런치익선잡방너무 맛있어요,https://blog.naver.com/hyuny_ony?Redirect=Log&logNo=222399159350,"이쁜곳 #익선동브런치 #익선동 익선잡방#익선동맛집 익선동익선잡방평일 11:00 - 21:00 15:00-17:00 브레이크타임 Last Order 런치 15:00, 디너 20:00 포장 테이크아웃 가능 주말 11:00 - 21:00 브레이크타임 없음... ",hyuny_ony,https://blog.naver.com/hyuny_ony,2021-06-15
"서울 종로3가 맛집,익선잡방내돈내산!",https://blog.naver.com/hanw00l?Redirect=Log&logNo=222460496857,"서울 종로 맛집익선잡방종로3가역 4번 출구에서 가까움 메뉴판 메뉴 및 가격 인테리어 화이트톤... 주문하지 말 것 부리타 치즈 샐러드가 개인적으로는 제일 갠츈 ㅎㅎ 종로 3가역 맛집, 밥집익선잡방리뷰 끝",그리는 디자이너,https://blog.naver.com/hanw00l,2021-08-07
익선동 )익선잡방: 살치살 스테이크랑 분위기 맛집 ! 브런치,https://blog.naver.com/lovely0243?Redirect=Log&logNo=222454036144, 익선잡방서울 종로구 수표로28길 17-21익선잡방친구랑 오랜만에 만나기로 해서 익선동을 다녀왔다. 너무 오랜만이기도 하고 어딜 가야하나 찾아보던 중 주말이라 자리가 있는 곳으로 아무데나 들어가봄.... ,달달한 수달,https://blog.naver.com/lovely0243,2021-08-02
[익선동식당] 익선잡방 ,https://blog.naver.com/lml314?Redirect=Log&logNo=222370915432,흔적들이 여기저기ㅋㅋㅋㅋㅋ 넘넘 맛있어서 많다많다하였으나 올클 하고 나왔다는.. 분위기/맛 굳굳 #익선동 #익선동식당 # 익선잡방#한옥식당 #로제파스타 #부라타치즈샐러드 #먹물리조또 #오믈렛 #스테이크 #존맛,El momento,https://blog.naver.com/lml314,2021-05-28
맛집리뷰 대전 신세계 백화점익선잡방:: #대전 신세계 맛집... ,https://blog.naver.com/thousand_delight?Redirect=Log&logNo=222515680697,응~ 드럽게 많아~ 대전 신세계 아트 앤 사이언스의 수많은 맛집 중 오늘은 또 뭘 먹어야 하나 고민고민 니끼~한 양식이 땡겨서익선잡방 으로 결정! 몇 층? 메뉴판은?익선잡방 은 6층에 있다. 외관 테이블은 사진... ,기쁨이는 뭐든 알려주고 싶음,https://blog.naver.com/thousand_delight,2021-09-24
익선동 나들이 마당플라워까페익선잡방방문 이야기 ♡,https://blog.naver.com/ronaldawa?Redirect=Log&logNo=221375963360, 익선잡방브런치비스트로 다음날 또 익선동을 갔어요 ㅋㅋㅋㅋ 이쯤하면 익선동뽀개기 이렇게 불러야 하나 ㅋㅋㅋㅋㅋㅋㅋ 익선동브런치 하고 찾으면 대표적으로 나오는 곳이라 간곳인데 ㅎㅎㅎㅎ 진짜 엄청... ,Mujer Bonita,https://blog.naver.com/ronaldawa,2018-10-12
종로 한옥거리 맛집익선잡방라자냐랑 스테이크 꿀맛,https://blog.naver.com/mini1493?Redirect=Log&logNo=222223058562, 익선잡방살치살 스테이크 점심 뭐 먹을지 친구가 서치하다 찾아간 익선동 맛집익선잡방#익선동맛집 #한옥거리맛집 #종로맛집 배고파서 배부른 식사류 위주 메뉴 먹었더니 못먹어본 브런치 아쉬워서 눈에... ,얕은 재주 전문가,https://blog.naver.com/mini1493,2021-01-28
익선동_[ 익선잡방 /뭣이든 뽑아보살/감꽃당],https://blog.naver.com/lji_618?Redirect=Log&logNo=222494836825,안녕하세요:) 오늘은 익선동을 다녀왔습니다! 2년전에 다녀오고 오랜만에 갔더니 조금...익선잡방#레스토랑 #브런치 외관 Previous image Next image 메뉴판 (밖에 메뉴판이 있어서 편하더라구요) 영업시간 평일... ,INLOG:),https://blog.naver.com/lji_618,2021-09-04
종로3가역 인사동익선잡방맛있는 점심,https://blog.naver.com/balmershj?Redirect=Log&logNo=222387944329,힘내시고 행복한 하루되세요 주말에 열심히 먹었으니 오늘은 가벼운 점심을 먹어야겠습니다 #종로3가역맛집 #익선동 익선잡방#종로3가 익선잡방#종로3가역 익선잡방# 익선잡방 메뉴 #종로3가브런치맛있는곳,♥ 건방진토끼의 힐링스토리 ♥,https://blog.naver.com/balmershj,2021-06-07
