title,link,description,bloggername,bloggerlink,postdate
"충주중앙탑메밀마당막국수와 메밀치킨, 인심 좋은 충주의... ",https://blog.naver.com/ffwasr?Redirect=Log&logNo=221939318093,점심에중앙탑메밀마당 에서 치킨이랑 막국수 맛 한 번 보세요! # 중앙탑메밀마당#중앙탑메밀막국수 #중앙탑메밀치킨 #충주맛집 #중앙탑맛집 #충주가볼만한곳 #메밀후라이드치킨 #메밀물막국수 #메밀비빔막국수,에드몽당테스가 몽테크리스토백작이 되기까지,https://blog.naver.com/ffwasr,2020-05-01
#충주_ 중앙탑메밀마당 ,https://blog.naver.com/hseul0822?Redirect=Log&logNo=222448654199,충주_ 중앙탑메밀마당충주_ 중앙탑메밀마당★ 매일 10:40~21:00 매일 (코로나 상황에 따라 운영시간은... 그닥..??! 따로 먹는 것이 더 맛있음^^! 다음에 가게 된다면 메밀부침을 시켜서 먹을 듯! 경험해본 것에 만족!,[조용한 일상],https://blog.naver.com/hseul0822,2021-07-29
"충주 중앙탑공원 맛집, 충주 메밀치킨, 충주중앙탑메밀마당 ",https://blog.naver.com/hope5926?Redirect=Log&logNo=222272144610,#충주 #충주여행 #충주가볼만한곳 #충주중앙탑공원 #충주중앙탑공원맛집 #중앙탑공원맛집 # 중앙탑메밀마당#충주메밀치킨 #메밀치킨 #메밀후라이드치킨 #내돈내산 #원히부부 #국내여행 #맛집탐방 #원히로그,원히로그,https://blog.naver.com/hope5926,2021-03-11
"[충주] ' 중앙탑메밀마당 ', 찐메밀맛집은 여기에...(충주 당일치기)",https://blog.naver.com/hnmwari?Redirect=Log&logNo=222082836152,#메밀찐맛집중앙탑 메밀마당 은 #충주중앙탑공원 바로 옆 입니다. 공원이 #호수 와 같이 있어서 메밀마당에서 식사하고 들러서 산책하기 정말 좋았습니다. 건물 앞에 주차공간이 꽤 있고 주변에도 많습니다.... ,광화문 회사원,https://blog.naver.com/hnmwari,2020-09-07
[충주중앙탑메밀마당 ] 중앙탑 공원에서 메밀치킨메밀비빔막국수,https://blog.naver.com/gwonsol?Redirect=Log&logNo=222487359390,"충주 중앙탑 공원쪽에 치킨이랑 막국수 맛집이 있다고^^ 무슨 조합인지 모르겠지만 맛집이라길래... 잡고메밀마당 에 포장하러 왔는데 고새 해가 뚝 떨어졌거든... 전화로 주문했고메밀후라이드 치킨 15,000원... ",❤SoLoG❤,https://blog.naver.com/gwonsol,2021-08-29
충주중앙탑 메밀 마당막국수 치킨 들깨 칼국수 맛집 가격 후기,https://blog.naver.com/j1004q?Redirect=Log&logNo=222217864079,내돈내산~ #충주 #중앙탑맛집 # 중앙탑메밀마당#메밀마당 #메밀막국수 #메밀후라이드치킨 #들깨칼국수 #충주맛집 #중앙탑면 #충주맛집추천 # 중앙탑메밀마당#메밀마당후기 #충주메밀들깨수제비... ,잘먹는 쿨누나,https://blog.naver.com/j1004q,2021-01-24
[충주/ 중앙탑메밀마당 ]: 메밀막국수와 치킨의 환상적인 조합,https://blog.naver.com/dmswls3931?Redirect=Log&logNo=222360227374,여기 평소엔 사람이 엄청 많대요ㅋㅋㅋ 저희가 갔을 땐 없었어서 정말 편하게 먹음ㅎㅎㅎ 메밀 막국수와 치킨이라니?? 처음보는 신선한 조합인데...?중앙탑메밀마당충주 영업시간 : 10:40 - 21:00 주차 가능... ,은진이 나라에 오신 걸 환영합니다,https://blog.naver.com/dmswls3931,2021-05-21
막국수와 통닭의 찰떡궁합중앙탑 메밀마당[충북 충주 맛집],https://blog.naver.com/bluedaisy706?Redirect=Log&logNo=222077501308,"주차공간은 저녁 먹을메밀마당앞에도 있었지만, 식사 후,중앙탑 을 돌아다닐 예정이기에 처음부터... 대표 메뉴인 물 막국수 하나(6,500원), 비빔 막국수 하나(6,500원),메밀후라이드 반 마리(8,000원)를... ",구르메 달 가드시,https://blog.naver.com/bluedaisy706,2021-01-30
[충주] 중앙탑 맛집은 당연 ' 중앙탑 메밀마당 ' 매번 웨이팅하며... ,https://blog.naver.com/jiyoungshin3?Redirect=Log&logNo=222268036337,곳이에욘 #중앙탑맛집 # 중앙탑메밀마당#메밀국수맛집 #충주맛집 #웨이팅꿀팁 # 중앙탑메밀마당 웨이팅... 드려요~~~~ #충주맛집 #중앙탑 #충주중앙탑 #충주중앙탑맛집 #메밀마당 #메밀맛집 #충주메밀맛집... ,Di.Log,https://blog.naver.com/jiyoungshin3,2021-03-08
충청도 가볼만한곳 충주 중앙탑공원과중앙탑메밀마당등... ,https://blog.naver.com/goodcho100?Redirect=Log&logNo=222362106027,메밀마당 충주시 중앙탑면 중앙탑길 103 10:40~21:00 매일 중앙탑공원을 보고 근처 식사할 곳을 찾아중앙탑메밀마당 으로 왔습니다. 2TV 생생정보에도 나온 맛집이라고 하는데 특이하게도 막국수와 메밀치킨을... ,스타일리쉬 여행,https://blog.naver.com/goodcho100,2021-05-23
충주여행) 후라이드치킨과 막국수 ' 중앙탑메밀마당 ',https://blog.naver.com/ljs357?Redirect=Log&logNo=222395433039,"탄금호 근처에 치킨막국수 집들이 여러곳있었는데, 우리는 그 중 후기가 가장 많은 ' 중앙탑메밀마당 '에... 치킨은 다음날 아침으로 식은채 먹었는데, 식어도 맛있었다. 메밀마당 막국수집은 치킨 맛집임에 틀림없다",Life is wonderful!,https://blog.naver.com/ljs357,2021-06-12
충주중앙탑메밀마당:: 메밀국수와 후라이드치킨의 이색조합... ,https://blog.naver.com/claknow?Redirect=Log&logNo=222486642401,식후경중앙탑 메밀마당충주 중앙탑공원 바로 앞에 위치한 메밀마당 * 가게 앞 주차 만차라면 중앙탑공원 주차장 이용 이 곳이 특별한 이유는! 막국수 + 치킨 이라는 이색조합을 즐길 수 있다는 점이다 메밀... ,식시인(食詩人)로드,https://blog.naver.com/claknow,2021-08-28
"충주맛집 가성비 좋은 막국수와 치킨의 조합, 중앙탑 메밀마당 ",https://blog.naver.com/ayr0609?Redirect=Log&logNo=221978517578,"# 메밀마당식당 근처가 # 메밀 집이 많더라고요 #맛집 답게, 번호표는 기본인가봉가? 카카오톡으로 곧... # 메밀마당인정! 식사후,소화시킬겸 바로앞 # 중앙탑산책코스도 좋아요 #충주 가시면 꼭 한그릇 드세요... ",Esthetic mento 앵글림,https://blog.naver.com/ayr0609,2020-05-25
충주중앙탑 메밀마당충주중앙탑인근맛집 다녀왔어요 : ),https://blog.naver.com/dreamwizjin?Redirect=Log&logNo=221773806733,충주민이 아니라도 타지인들에게도 유명한중앙탑 메밀마당 ! 충주중앙탑맛집 메밀마당 메밀떡만둣국 자색떡국떡이 먹음직스럽게 보여요! ㅎ 충주맛집추천 메밀마당의 메밀치킨을 먼저 먹다보면 막국수가... ,일상에 쉼표 하나,https://blog.naver.com/dreamwizjin,2020-01-16
충주중앙탑 메밀마당막국수 . 충주맛집 . 메밀치킨,https://blog.naver.com/gpdud0451?Redirect=Log&logNo=222280588207,#충주맛집 #충주 중앙탑메밀마당#충주메밀마당 # 중앙탑메밀마당#충주막국수 #메밀치킨 지난 일요일 신랑님이랑 드라이브 겸 맛집탐방하러 들른 충주! 지인이중앙탑메밀마당막국수랑 메밀치킨이 엄청... ,현대데크휀스_전문시공업체,https://blog.naver.com/gpdud0451,2021-03-19
[충주 맛집] 중앙탑메밀마당막국수 메밀후라이드치킨... ,https://blog.naver.com/youmi6217?Redirect=Log&logNo=222327635005,부는날이였음) 메밀마당은 1996년부터 현재까지 중앙탑 정문 앞에 위치한 개인 브랜드 음식점이라네요 와우!메뉴판중앙탑메밀마당메뉴판 메밀 물 막국수와 매밀 비빔 막국수가 메인이고 그외 메밀... ,망구의일상,https://blog.naver.com/youmi6217,2021-04-29
[충주맛집] 중앙탑메밀마당 /충주 유명한 통닭막국수 맛집... ,https://blog.naver.com/kpop1030?Redirect=Log&logNo=222542107021,치킨이라서 그런가 ㅎ 맛집다움 치킨 남은건 셀프로 포장 가능 일부러 찾아가진 않겠지만 충주 갈 일 있으면 또 가야징 내돈내산후기 끝 # 중앙탑메밀마당#메밀마당 #충주맛집 #충주중앙탑공원맛집 #충주막국수... ,새콤달콤 맛있는 인생,https://blog.naver.com/kpop1030,2021-10-19
[충주맛집] 중앙탑메밀마당 (feat. 충주 맛집 리스트),https://blog.naver.com/mysns1?Redirect=Log&logNo=222532668148,"저희는중앙탑 메밀마당대표 메뉴인 메밀후라이드치킨, 물 막국수 2, 비빔 막국수 2 를 시켰습니다!! 주문을 하면 이렇게 기본 세팅을 해주십니당 메밀마당기본세팅 음식을 기다리는 동안 내부 모습도 한번... ",mysns1님의블로그,https://blog.naver.com/mysns1,2021-10-10
충주맛집중앙탑 메밀마당다녀왔어요!,https://blog.naver.com/joahri?Redirect=Log&logNo=222427885231,주소 : 충북 충주시 중앙탑면 중앙탑길 103 영업시간 : 10:40 - 21:00 Last order 20:20 주차장 : 가게 앞에 주차... 메밀 막국수 맛있게 먹는법! 충주중앙탑 메밀마당메뉴판 메밀마당 카운터 앞에서 핸드폰 번호를... ,일상을 기록하는 블로그,https://blog.naver.com/joahri,2021-07-11
[충주맛집/맛집추천] 충주에서 유명한중앙탑메밀마당 ,https://blog.naver.com/star6334?Redirect=Log&logNo=222456949396,"이상 내돈내산, 내돈내먹 치킨막국수 후기 였습니다 !!! #청주 #청주여행 #청주맛집 #맛집추천 #치킨맛집 # 메밀마당# 메밀마당중앙탑 점 # 메밀 막국수 #물막국수 #비빔막국수 #치킨 #후라이드치킨",SilverLog_❤,https://blog.naver.com/star6334,2021-08-04
충주/수주팔봉/차크닉/ 중앙탑메밀마당 /카페단월/충주여행,https://blog.naver.com/2km1024?Redirect=Log&logNo=222313076877,“ 중앙탑메밀마당 ”으로 향해따 주말에는 사람이 바글바글 하다고 하던데 우리는 평일이라 그런지 1-2팀뿐이 없어 편하게 먹었다 메밀치킨이랑 막국수 모두 성공적!! 특히 물막국스는 겨자를 꼭 넣어 먹길... ,깽이 일상ෆ,https://blog.naver.com/2km1024,2021-04-17
[맛집] 충주맛집중앙탑 메밀마당 ,https://blog.naver.com/oseminzzang?Redirect=Log&logNo=222288037434,바로 충주의 중잉탑메밀마당이에요! 메밀국수와 치킨의 뜻밖에 어울리는 조합 ㄴ 실내는 나무로... 싶다는 생각을 하였답니다. 그럼 충주 소개는 여!기!까!지! #충주맛집 #충주 중앙탑메밀마당# 중앙탑메밀마당 ,시골청년 성공기록,https://blog.naver.com/oseminzzang,2021-03-26
충북 충주 메밀치킨이 맛있는중앙탑메밀마당 ,https://blog.naver.com/ssa933?Redirect=Log&logNo=222532714009," 중앙탑메밀마당영업: 매일 10:40 - 21:40 / Last order 20:20 주소: 충북 충주시 중앙탑면 중앙탑길 103 메뉴: 메밀후라이드치킨,메밀새싹 물 막국수, 메밀새싹 비빔 막국수, 메밀떡만두국",여맛일기 :,https://blog.naver.com/ssa933,2021-10-10
[충주 맛집_막국수]중앙탑 메밀마당 ,https://blog.naver.com/aztalk?Redirect=Log&logNo=222496820536,여줘보니 요즘에는 주말에도 웨이팅 길지 않다고 합니다. 제 돈으로 맛나게 사먹은 후기입니다. #충주맛집 #막국수 #후라이드 #충주막국수 #충주후라이드 #메밀후라이드 # 중앙탑# 메밀마당# 중앙탑메밀마당 ,아재톡,https://blog.naver.com/aztalk,2021-09-06
막국수와치킨의 콜라보/충주 중앙탑 막국수/ 메밀마당 ,https://blog.naver.com/dlstkrhksflx?Redirect=Log&logNo=221841576560,막국수치킨 콜라보 이런맛은 처음이야 ㅎ중앙탑 공원앞메밀마당막국수집 입니다. 이곳에는 가계가... 착한 가격에 조합도 좋고 맛도 있고 그 무엇보다 좋은 것은 서비스 또한 굿메밀 물막국수메밀 비빔막국수... ,다육이아빠의소소한일상,https://blog.naver.com/dlstkrhksflx,2020-03-07
충주중앙탑 메밀마당메밀치킨과 막국수의 감성,https://blog.naver.com/gamsungpay?Redirect=Log&logNo=222533507869,메밀계의 혁명 막국수와 메밀치킨의 콜라보 그 미쳐버린 조합을 탄생시킨 원조중앙탑 메밀 마당 을... 대성공이다 #충주 # 중앙탑# 메밀마당#원조 #맛집 #메밀 #치킨 #막국수 #물막국수 #비빔막국수 #자전거... ,Gamsung pay,https://blog.naver.com/gamsungpay,2021-10-11
[충주맛집] 충주중앙탑 메밀마당찐 막국수 맛집!,https://blog.naver.com/ssohyun201?Redirect=Log&logNo=222348564571,이상 충주여행 블로그 마치겠습니다 :) #충주 #충주여행 #충주맛집 #충주식당 #충주가볼만한곳 #충주드라이브 #막국수맛집 #충주막국수 #충주중앙탑공원 #중앙탑공원 #메밀마당 #충주메밀마당 # 중앙탑메밀마당 ,일상 기록하는 공간,https://blog.naver.com/ssohyun201,2021-05-12
[충북/충주] 내돈내산 막국수와 치킨의 조합중앙탑메밀마당 ,https://blog.naver.com/sapi23?Redirect=Log&logNo=222478528112,메밀마당 앞에 주차자리가 있지만 많은 편은 아니었어요. 길거리에도 주차가 가능한 한적한 곳이었어요.. # 중앙탑메밀마당#충주맛집 #충주데이트 #충주여행 #치킨맛집 #막국수맛집 #서울외곽 중앙탑 메밀... ,Wanderlust,https://blog.naver.com/sapi23,2021-08-21
"충주 맛집 /중앙탑 메밀마당 , 막국수와 치킨",https://blog.naver.com/biomk18?Redirect=Log&logNo=222540994826,ㅎㅎㅎ 너무 평화롭죠~~?!!! 시간 괜찮으시면중앙탑 공원 산책 추천드려요!! 그럼 다음 포스팅에서 만나요!! ㅎㅎㅎ #충주 #여행 #충주맛집 # 메밀마당# 중앙탑 맛집 # 메밀 국수 # 메밀 후라이드 #막국수,V Gyeong's,https://blog.naver.com/biomk18,2021-10-18
생방송 투데이 충주 메밀치킨 메밀막국수중앙탑메밀마당위치... ,https://blog.naver.com/yh970808?Redirect=Log&logNo=222384800679,"보러가기 ▶중앙탑메밀마당*메밀치킨, 메밀막국수 주소 : 충북 충주시 중앙탑면 중앙탑길 103 번호 : 0507-1400-0283 ▼메밀막국수 가격 정보 보러가기 https://coach1.tistory.com/1925※ 이 글에 언급된... ",The Right Choice,https://blog.naver.com/yh970808,2021-06-04
 중앙탑 메밀마당 _충주 중앙탑막국수 + 메밀치킨,http://saffroner.egloos.com/6820801,2TV생생정보 / 2TV저녁생생정보 / 생생정보통 맛집오늘 #충주 중앙탑막국수 #생생정보통 맛집오늘 # 중앙탑 메밀마당#중앙탑메밀식당 #충주 메밀마당 #충주 메밀치킨 #충주 막국수 #2TV저녁생생정보오늘 #2TV... ,당신의 손길이 닿기 전에,http://saffroner.egloos.com/,2021-07-19
충주중앙탑메밀마당-충주맛집 추천/중앙탑 맛집/충주원조맛집... ,https://blog.naver.com/iseoisiseo?Redirect=Log&logNo=222379923492,"충추중앙탑메밀마당위치 :충북 충주시 중앙탑면 중앙탑길 103 전화번호 :043-855-0283 운영시간 :매일... 8시20분 중앙탑 근처에는 메밀국수와 치킨을 파는 곳이 많은데요, 중앙탑 근처에 있는 여러 맛집을... ",유니나는 하루,https://blog.naver.com/iseoisiseo,2021-06-01
충주맛집중앙탑메밀마당메밀후라이드치킨 메밀막국수,https://blog.naver.com/rldudal0070?Redirect=Log&logNo=220324045070,"충주맛집중앙탑메밀마당메밀후라이드치킨 메밀막국수 충주충주중원문화길중앙탑폿팅에이어 오늘은 충주맛집 고고싱~!!! 충주맛집중앙탑메밀마당 에 점심먹으려고 들려서 메밀후라이드치킨, 메밀막국수를... ",NowStudio,https://blog.naver.com/rldudal0070,2015-04-14
"충주 막국수 맛집,중앙탑메밀마당 ",https://blog.naver.com/cutesun18?Redirect=Log&logNo=221067564894,"충주 막국수 맛집,중앙탑메밀마당오늘부터 친구부부랑 휴가시작♡ 작년부터 사이판 골프여행 다니며... 물어보니 메밀마당 강추해주셨죠! 12시쯤 도착했더니 웨이팅 장난아님 ㅋㅋㅋㅋ 20분 대기라고해서... ",쏼리의 행복한 블로그♪,https://blog.naver.com/cutesun18,2017-08-05
충주 막국수 ::중앙탑 메밀마당vs. 원조 중앙탑 막국수,https://blog.naver.com/ninon1966?Redirect=Log&logNo=221270099319,충주 #중앙탑공원 쪽에 막국수집 몰려있네 인터넷 서칭결과 채택된 # 중앙탑메밀마당가게앞이... 찾은 막국수 맛집 비교 결과 원조중앙탑막국수메밀마당 다음에 또 간다면 역시나 비빔으로~ (내 입맛 기준),Are U Going with ME?,https://blog.naver.com/ninon1966,2018-05-07
충주 맛집중앙탑 메밀마당막국수,https://blog.naver.com/zaja1972?Redirect=Log&logNo=221402495031,"충주 맛집중앙탑 메밀마당막국수 10월말에 세자매가 뭉쳐서 원주, 충주로 당일코스 여행을... 충주 중앙탑에서 메밀 막국수 맛을 알게되나니ㅋㅋㅋㅋ 언니들은 들깨수제비를 주문했어요~~~ 처음에는 이렇게... ",가을사랑의 행복을 꿈꾸는 곳,https://blog.naver.com/zaja1972,2018-11-20
충주 중앙탑 맛집 [ 중앙탑메밀마당 ] 메밀막국수 메밀치킨의 조합,https://blog.naver.com/khj60529?Redirect=Log&logNo=222534242729,충주맛집중 하나인 방금튀긴 후라이드치킨과 메밀막국수의 조합이 맛있는집중앙탑메밀마당 에... #충주맛집 #충주중앙탑맛집 #중앙탑맛집 # 중앙탑메밀마당#충주메밀마당 #충주막국수 #충주치킨맛집... ,경험주의자의 블로그,https://blog.naver.com/khj60529,2021-10-12
충주 맛집 ' 중앙탑메밀마당 ' 막국수와 치킨의 조합,https://blog.naver.com/voangoan?Redirect=Log&logNo=222474277569,"중앙탑사적공원 입구에 위치한중앙탑메밀마당 ...이곳 영업시간을 제대로 체크 못 했던 터라 오픈... 맛집중앙탑메밀마당 의 메밀치킨... 비빔국수도 슥슥 비벼줍니다. 깻가루, 새싹, 김가루 등이 올려진... ",방배동반달곰의 blog,https://blog.naver.com/voangoan,2021-08-18
[충북/충주맛집]중앙탑메밀마당 ㅣ후라이드치킨과 막국수의... ,https://blog.naver.com/ssongzhou?Redirect=Log&logNo=222431525369,충주중앙탑메밀마당바삭한 메밀 후라이드 치킨과 메밀 막국수 최근에는 캠핑에 빠진 오빠(친오빠)... 충주 햇살아래캠핑장에 캠핑가던 날 캠핑장 들어가기 전 들려 점심으로 먹었던 메밀마당 차를 따로 타고... ,ssongzhou’s fooddiary,https://blog.naver.com/ssongzhou,2021-07-15
[충주]중앙탑메밀마당 ,https://blog.naver.com/jykim575?Redirect=Log&logNo=221110355739,"충주 맛집 검색해서 가게 된 곳중앙탑메밀마당 . 충주의 다른 맛집 중에 원조중앙탑막국수도... 이곳은 메밀국수와 함께 치킨도 먹을 수 있는 곳이라 치킨무, 치킨소스도 주시고요.... ",七夕日記,https://blog.naver.com/jykim575,2017-10-03
"충주 막국수, 치킨 맛집 중앙탑 막국수 '충주 중앙탑메밀마당 '",https://blog.naver.com/yujh32?Redirect=Log&logNo=220977198033,"오늘은 충주 막국수, 치킨 맛집 중앙탑 막국수 '충주메밀마당'으로 고고고 신선한 열무김치 그 전엔... 중앙탑 앞, 충주에선 모르는 사람이 없을 충주 막국수, 치킨 맛집 중앙탑 막국수 '충주 중앙탑 메밀마당 ... ",끌리는 대로,https://blog.naver.com/yujh32,2017-04-07
양콩투어 4탄_충주 ♪중앙탑 메밀마당솔직후기,https://blog.naver.com/ann3435?Redirect=Log&logNo=221227215319,"치킨과메밀 막국수를 함께 파는, 그리고 가격이 착해서 학생들도 많이 찾고 맛도 좋아 어른분들도 많이 찾는다는 충주중앙탑맛집메밀마당 . 별도의 체인점은 없다고 하니 참고하시구요 ~ 인상깊었던건... ",들박이의 Hello miss park♥.♥,https://blog.naver.com/ann3435,2018-03-12
"5월 충주 여행 기록(서유숙펜션, 무드인소울,중앙탑메밀마당 ... ",https://blog.naver.com/jisu9494?Redirect=Log&logNo=222361988078,"기대하던 # 중앙탑메밀마당먹으러 출발! 아... 40분 웨이팅이라니.... 26팀이나 있다니 메밀마당 가시는 분들은 웨이팅부터 거시고, 중앙탑 공원 구경 가세요ㅠㅠ 차에서 쌤들이랑 사진 보내주며 시간을 보내니... ",지꾸의 교실,https://blog.naver.com/jisu9494,2021-05-23
[맛집추천]충주중앙탑맛집-메밀마당 ,https://blog.naver.com/kcscpr?Redirect=Log&logNo=220286099841,충주에는 여러 유명한 식당이 있지만중앙탑 에서는 특히메밀 국수 맛집들이 유명하답니다. 오늘은 그 중 가장 잘 알려진 충주중앙탑맛집메밀마당 을 소개해드릴게요.메밀마당 은중앙탑근처 식당이 밀집해... ,LX 한국국토정보공사 블로그,https://blog.naver.com/kcscpr,2015-02-28
"충주중앙탑맛집,메밀마당막국수 /중앙탑공원",https://blog.naver.com/top1889?Redirect=Log&logNo=220413889495,"막국수 맛집이 많은 중앙탑ㅋㅋㅋ그 중에 메밀마당으로 들어갔어요 ㅋㅋㅋㅋㅋ 막국수 물, 비빔... ㅋㅋㅋ 충주 기사보니 충주중앙탑 메밀마당 이 전국착한가격업소 대상수상을 했다고 하네요 ㅋㅋ 우오... ","뻥산, 헬로우 ♪",https://blog.naver.com/top1889,2015-07-08
"충주)1박2일 국내여행,중앙탑메밀마당 , 충주맛집, 웻지52",https://blog.naver.com/thungee?Redirect=Log&logNo=220724204634," 중앙탑메밀마당 , 충주에서 손꼽히는 진짜 맛집!!! 진짜입니다. ㅋㅋㅋㅋㅋㅋ 앞에는 다 장난이고 여기... 메밀막국수, 이게 5500원입니다. 가격이 놀라울 정도로 맛있습니다. 치킨은 반마리만 시켰는데 너무... ",괜찮아,https://blog.naver.com/thungee,2016-05-31
생생정보 메밀막국수 메밀치킨 충주중앙탑메밀마당 ,https://blog.naver.com/gkgkgkgk55?Redirect=Log&logNo=222054125254,메밀막국수와 메밀 치킨조화를 메밀 마당에서 경험할 수 있답니다!! 출처 :중앙탑메밀마당충주 중앙탑 공원 정문 앞에 위치해 있고 정류소 중앙탑 도보 3분 거리에 위치해 있어 쉽게 찾아갈 수 있는... ,샤이닝한 반짝이★,https://blog.naver.com/gkgkgkgk55,2020-08-07
[충주]중앙탑 메밀마당- 치킨이랑 같이 먹는 막국수,https://blog.naver.com/joon_journey?Redirect=Log&logNo=222489836514,충주 중앙탑사적공원 근처에 위치한중앙탑 메밀마당주말 점심시간에 찾았는데 찾은 사람이 상당히... 면은 메밀 함량이 꽤 높은지 색은 연하고 찰기는 거의 없었다 양념은 다소 텁텁하다 싶을 정도로 고춧가루... ,현실 집시맨,https://blog.naver.com/joon_journey,2021-08-31
충주 중앙탑맛집중앙탑메밀마당메밀치킨강추 치킨맛집,https://blog.naver.com/jhh6001?Redirect=Log&logNo=222150875377,중앙탑맛집 메밀마당에는 메일후라이드를 판다고 해서 여기로 가자~! 하고 후다닥ㅎ 메밀국수집에... 부족한것 중앙탑맛집중앙탑메밀마당 은 치킨맛집이였습니다. 메밀물막국수를 맛 못봐서 다 얘기는 못하지만... ,잘먹고 잘노는 쌍둥이네 ♡,https://blog.naver.com/jhh6001,2020-11-21
충주 막국수 맛집/ 중앙탑메밀마당 /치킨막국수 조합 대박!,https://blog.naver.com/lizzy0207?Redirect=Log&logNo=221900949563,#충주맛집 #충주막국수 #충주메밀마당 #중앙탑막국수 #중앙탑맛집 #충주막국수맛집 #충주막국수맛있는집 # 중앙탑메밀마당#막국수 #메밀치킨 #메밀후라이드치킨 #충주치막 #충주중앙탑 #사랑의불시착 #리뷰... ,이렇게젊은날,https://blog.naver.com/lizzy0207,2020-04-10
충주막국수맛집 치킨까지 맛있는 ' 중앙탑메밀마당 ',https://blog.naver.com/pink406?Redirect=Log&logNo=222087110695,충주중앙탑맛집중앙탑메밀마당충북 충주시 중앙탑면 중앙탑길 103 매일:11:00-21:00 043-855-0283 연중무휴... 충주데이트 #충주중앙탑인근맛집 #충주맛집추천 #충주메밀치킨 #충주꼭가볼만한곳 #중앙타메밀마당,어디서 무엇이 되어 다시 만나리...,https://blog.naver.com/pink406,2020-09-11
충주 메밀막국수 맛집중앙탑메밀마당 ,https://blog.naver.com/clubrsv?Redirect=Log&logNo=222099466647,같고중앙탑 메밀 마당 이라고 막국수 맛집인 거 같은데 가게 앞에 차량들이 꽉 차있었습니다 사실... 메밀만두라고 해서 주문해봤는데 그냥 만두랑 맛 차이 거의 없어요 만두피 메밀가루 조금 넣었나 봅니다... ,나비님,https://blog.naver.com/clubrsv,2020-09-25
 중앙탑메밀마당그리고 중앙탑공원,https://blog.naver.com/pwcoffee?Redirect=Log&logNo=222023955520,재작년 중앙탑 답사여행 왔다가 우연히 들른 식당중앙탑메밀마당 이 네이버에서 검색한 충주 맛집에 1등으로 나온다. 그렇게 맛있었나? 확인차 다시 들렀다. 2년 전 6천원에서 6.5천원으로 올랐다. 메밀새싹을... ,당신의 향기되어,https://blog.naver.com/pwcoffee,2020-07-07
"[중앙탑 막국수, 충주 막국수]중앙탑메밀마당 ",https://blog.naver.com/suu120808?Redirect=Log&logNo=222065934933,놀러왔다가 중앙탑 존맛탱 막국수집 메밀마당에 들렀다 충주 와서중앙탑메밀마당안먹고가면 섭섭함... 고기만두반 메밀만두라고 하는데 속이 꽉차있고 담백하니 난 만두를 별로 안좋아하는 편인데도... ,먹는거 너무 죠아 ♡,https://blog.naver.com/suu120808,2020-08-20
