title,link,description,bloggername,bloggerlink,postdate
대구 동성로 떡볶이 맛집! 줄서서 먹는중앙떡볶이다녀왔어요~,https://blog.naver.com/tree_830405?Redirect=Log&logNo=221818395977,줄서서 먹는중앙떡볶이그 유명한중앙떡볶이 에 떡볶이가 나왔어요!! 색깔은 합격!ㅋㅋ 순대는 살짝 실망스러웠어요 양이 좀 적은것 같은뎅.....;;;; 대구 동성로 떡볶이 맛집! 줄서서 먹는중앙떡볶이일단... ,❤️래원이와 함께라 매일이 행복한 초보 엄마아빠,https://blog.naver.com/tree_830405,2020-02-21
대구 뉴욕통닭/ 롤러커피/ 레이지모닝 본점/중앙떡볶이 ... ,https://blog.naver.com/mnschola?Redirect=Log&logNo=222156856950,사서중앙 떡볶이 로 갑니당 옛날에 왔을 때 다 떨어져서 못 갔던 곳! 아니나 다를까 내가 마지막 주문이었음. 가래떡이 너무 퉁퉁 부어서 떡볶이 자체는 나는 부산 이가네에 한 표 하지만 납작 만두는 맛있었당... ,"주로 돌아다니는, 인상 깊은 취미생활",https://blog.naver.com/mnschola,2020-11-28
대구 미진 분식 대구중앙 떡볶이퀵배달 심부름 서비스... ,https://blog.naver.com/michaelpearl?Redirect=Log&logNo=222478916921,대구 동성의 전통 맛집 미진 분식중앙 떡볶이주문 배달 대행 메뉴를 정하시고 전화 문자 카톡... 228중앙 떡볶이본점 대구 동성로 맛집 미진 분식중앙떡볶이퀵배달 포장 배달 #미진분식배달 지방 특송... ,미스터 심부름 010 2343 1022,https://blog.naver.com/michaelpearl,2021-08-21
대구동성로떡볶이중앙떡볶이 ,https://blog.naver.com/zxnm1?Redirect=Log&logNo=222521199665,"대구떡볶이중앙떡볶이중앙떡볶이전화번호는 114에서도 안내해주고 퀵서비스도 가능하다 쌀떡볶이 \4,000 만두 \4,000 떡볶이 2인분 시키고 만두 시키려고 주문을 했는데 아주머니께서 일단 하나씩 먹어보고... ",먹로그,https://blog.naver.com/zxnm1,2021-09-29
가을 log (대구중앙떡볶이 /롤러커피),https://blog.naver.com/leafprince?Redirect=Log&logNo=222516686803,대구 동성로에서 유명한 떡볶이 가게인 # 중앙떡볶이다녀왔다 ㅎㅎ 1인분 세트(4000원) 시키면 왼쪽 사진처럼 가래떡 2 어묵 2 납작만두 주는데 납작만두만 더 먹고 싶어서 카페 가는 길에 또 사먹음 ㅋㅋㅋ 대구... ,leaf log,https://blog.naver.com/leafprince,2021-09-25
[대구 동성로] 중앙 떡볶이 ,https://blog.naver.com/bbang450862?Redirect=Log&logNo=222314618009,예전에중앙 떡볶이왔는데 ㅠㅠ... 떡볶이 다 나갔다고 해서 못먹음 ㅠㅠ... 와 그때 허탈감이란... 이 갈고 왔음 ㅋㅋㅋ 이번에는 꼭 먹어야지 하면서 ㅋㅋㅋ 우산 쓰고 야무지게 감 코로나 명부 작성하고 떡볶이... ,다욧은 내일부터,https://blog.naver.com/bbang450862,2021-05-02
대구 미진분식중앙떡볶이배달 서비스 퀵배달,https://blog.daum.net/tlsgytmd/351,"대구 미진분식중앙떡볶이배달 서비스 퀵배달 댓글 0 멋집 맛집 이야기 2020. 9. 7. 대구생활심부름 , 동성로 , 미진분식 , 미진분식배달서비스 , 미진분식퀵배달 , 배달 , 배달서비스 ,중앙떡볶이 ... ",미스터퀵 해주세요 070 8268 4310,https://blog.daum.net/tlsgytmd,2020-09-07
"대구 동성로 맛집_' 중앙떡볶이 ', '미진분식' 포장",https://blog.naver.com/sujin0089?Redirect=Log&logNo=222538257650,"해왔어요^^중앙떡볶이 에서 떡볶이, 만두, 순대를 샀어요 - 가격은 각 4,000원 + 포장값 500원 = 12,500원 미진분식 228직영점에서 김밥 2줄 포장해왔습니다! - 김밥 2줄에 5,000원 (최소주문 수량이 2줄) 별거... ",imsujinia,https://blog.naver.com/sujin0089,2021-10-15
대구 맛집중앙떡볶이 ,https://blog.naver.com/vivian2231?Redirect=Log&logNo=220892321878,"떡볶이 국물을 가득가득 부어주신답니다. 대구 맛집중앙떡볶이 ... 국물 공격 엄청나네요. 넘나 맛나는 것!! 그리고 내 사랑 순대!! 저는 순대도 좋아하지만, 순대보다 내장을 더 좋아해요. 이웃님들은 뭐... ",Vivian's Day*,https://blog.naver.com/vivian2231,2016-12-22
대구 동성로중앙떡볶이전메뉴 먹어봄 ♥,https://blog.naver.com/jinmichu?Redirect=Log&logNo=221422638883,"이 사진 찍을 때는 떡볶이 만드는 브레이크타임이여서 손님 없는 것 처럼 나왔는데, 실제로 요기 지나다니면 계속 사람들 줄서있어요 대구중앙떡볶이직영점 분점 체인점을 내어준적이 없대요 중앙로역... ",진미츄 일상 기록,https://blog.naver.com/jinmichu,2018-12-19
"대구중앙떡볶이 , 납작만두 대존맛!!",https://blog.naver.com/ekwhgdk666?Redirect=Log&logNo=221397598845,"또 떡볶이 킬러라..제일 먼저 대구가면 꼭! 먹어보고 싶었던중앙떡볶이 를 갔어요. 국내여행이든, 해외여행이든 구글맵은 사랑입니다♡ 가기전에 구글맵에 다 저장해 놓으면 동선짜기도 좋아요~ 중앙로역에서... ",꿀미니의 블로그,https://blog.naver.com/ekwhgdk666,2018-11-13
[대구맛집]3대천왕중앙떡볶이 ,https://blog.naver.com/sarang612?Redirect=Log&logNo=220699322667,3대천왕에 나왔다던 대구 맛집중앙떡볶이공원앞에 있는곳 11시경이였는데 가게안은 꽉차있고 줄이 엄청 길었다 포장줄도 엄청 길고..ㅎㄷㄷ 끊임없이 만들고 계신 떡볶이와 납작만두 대구맛집중앙떡볶이 ... ,H LOG,https://blog.naver.com/sarang612,2016-05-02
[대구 떡볶이 맛집] 백종원의 3대천왕에 나온 동성로중앙떡볶이 ,https://blog.naver.com/sniper98?Redirect=Log&logNo=221216107022,가장자리로는 벽을 보고 먹을수 있는 형태이고 중앙은 이렇게 마주할수 있는 테이블석... 대구 떡볶이맛집 동성로중앙떡볶이 의 삼총사.... 쌀떡볶이(3.0) + 만두(3.0) + 김밥(1.5) + 쿨피스(1.5) 요렇게 해서 총 9천원!... ,대구맛집블로거 맛소클짱 혁이의 맛여행,https://blog.naver.com/sniper98,2018-03-05
대구 동성로 맛집 2탄중앙떡볶이 ,https://blog.naver.com/skyrelax?Redirect=Log&logNo=220208832006,주머니 사정 고려해서 가벼우면서도 맛있는 곳 위주로 휙휙 이곳은 대구의 명물 떡볶이집 이름하여중앙떡볶이 랍니다. 대구에서 아주 인기가 많다고 하는데 줄서서 먹는 떡볶이집이라고 하길래 동성로... ,천천히 걷는 길,https://blog.naver.com/skyrelax,2014-12-13
대구 떡볶이 맛집 동성로중앙떡볶이 ,https://blog.naver.com/nanacook?Redirect=Log&logNo=221168714876,"3대천왕도 나오고..어디도 나오고..하기전부터 원래부터 유명한 대구 떡볶이하면중앙떡볶이 는 대명사급.. 직영점,분점,체인없이 오로지 여기 한군데 유명세치고 주문 시스템이나 메뉴는 아주 단순한 편 이모님... ",Nana's kitchen,https://blog.naver.com/nanacook,2018-01-02
대구 동성로중앙떡볶이(feat. 백종원의 3대천왕),https://blog.naver.com/zihye9000?Redirect=Log&logNo=221183053866,"떡볶이 국물에 김밥도 찍어먹고 국물까지 싹싹 긁어서 먹느라 나의 인중을 땀으로 채웠던 # 중앙떡볶이였네요. 먹을땐 솔직히 너무 정신이 없어서 몰랐는데, 집에 오는 내내, 떡볶이 포장해올껄... ",엘리신의 지름신,https://blog.naver.com/zihye9000,2018-01-11
[대구 동성로 맛집] 중앙떡볶이- 환상의 짝꿍,https://blog.naver.com/jancangi?Redirect=Log&logNo=60210322485,맛집중앙떡볶이 는요.. 지하철 1호선 중앙로 2번 출구로 나와 동성로로 오시면 뙇하고 발견할 수 있죠 줄이 어마마마할 테니까요 ㅋㅋㅋㅋ 소개도 엄청 됐다던데.. 이곳의 메뉴들 역시나 쌀떡볶이에 만두가 bb... ,먹어주는 바비TV,https://blog.naver.com/jancangi,2014-03-03
대구맛집 / 떡볶이 맛집중앙떡볶이 ,https://blog.naver.com/yumin851202?Redirect=Log&logNo=221636787470,친절을 바라진 마세요 ㅋ그래도 전보다 많이 친절해졌어요 예전엔 카리스마가 배로 넘쳤어요 ㅋ히히 손님들이 끊임없이 오셔서 정신이 없어서 그런거니 오해마세요 #대구맛집 #떡볶이맛집 # 중앙떡볶이#떡볶이,윰 :) be happy,https://blog.naver.com/yumin851202,2019-09-02
대구 동성로 맛집 백종원 삼대천왕에서 추천한중앙떡볶이 :),https://blog.naver.com/gtd6739?Redirect=Log&logNo=220542379399,그리고 떡볶이라서 그런지 금방금방 손님이 빠졌어용! 대구 동성로 맛집 백종원 삼대천왕에 나온 중앙떡볶이 의 위치는아래를 참고하세용:) (블로그로 검색하니중앙떡볶이 가 두군데 나오는데 요기가 맞겠쬬?... ,♥복댕이의 HappY HousE♥,https://blog.naver.com/gtd6739,2015-11-18
"대구맛집 ,중앙떡볶이 ",https://blog.naver.com/sarang612?Redirect=Log&logNo=221116851474,개이득중앙떡볶이메뉴 쌀떡볶이+만두세트(섞어) 3개시킴 왜냐면 맛있거든 비법이 궁금하다 섞어 3개 나왔다 ㄱㄱ ㅑ 가래떡이 통째로 들어간다 쫄깃쫄깃해 오뎅이랑 납작만두 맛잇옹 각자 한접시씩... ,H LOG,https://blog.naver.com/sarang612,2017-10-14
대구대표 떡볶이 [ 중앙떡볶이 ],https://blog.naver.com/rainysun01?Redirect=Log&logNo=221627604302,정말 전국구 맛집 이라는 곳은 슴슴하니 크게 자극적이지않은 성실하고 정직하고 한결같은 그런 맛 이었던거 같아요.~^^ 후식~~ 빽다방~~~ 딸바스무디 아이스키림토핑♡ 대구중앙떡볶이 ...^^ 떡볶이 당기는날... ,★ 민범이네 소소한 하루 ★,https://blog.naver.com/rainysun01,2019-08-25
[대구 동성로]중앙떡볶이/ 납작만두 최고!,https://blog.naver.com/krworker?Redirect=Log&logNo=221333541422,나의 최애 떡볶이집 대구중앙떡볶이 ! 백종원3대천왕에도 나온 유명 맛집 '15년에 방송됨 매년... 28기념 중앙공원 맞은편 웰컴투대프리카~ 더워서 그런지 대기줄이 없었다. 입구에서 쉴 새 없이 떡볶이와... ,함므의 거침없는 월급 탕진,https://blog.naver.com/krworker,2018-08-06
[대구맛집]동성로중앙떡볶이 ,https://blog.naver.com/soobin553?Redirect=Log&logNo=220986576579,야무지게 떡볶이 양념에 찍어 먹기도 했어요 (먹은 후기) 글쓴이(나) -대구에 거주하고 있는 봉이 오빠의 말로는중앙 떡볶이 에 원래도 사람이 많았지만 백종원의 3대 천왕에 방영 된 이 후로 더 많은... ,수박이 블로그,https://blog.naver.com/soobin553,2017-04-19
대구중앙떡볶이떡이 문제였네.,https://blog.naver.com/gudth331?Redirect=Log&logNo=221597782232,#대구 중앙떡볶이#떡이문제다_너무_맛있졍 매번 엄청난 웨이팅을 보고 패스했던 집 한 번은 먹어야겠다... 부르신다 그래서 여기욥 하고 손들면 오셔서 주문을 받아가시고 주문과 동시에 음식이 나온다 떡볶이... ,"속지말자,무보정영상 블로그",https://blog.naver.com/gudth331,2019-07-28
대구 동성로중앙떡볶이/ 제 인생떡볶이에요,https://blog.naver.com/aily1336?Redirect=Log&logNo=221645079438,안녕하세요 오늘은 맛집리뷰 ㅎㅎㅎ 제가 어제 오늘 대구에 있었는데요 도착하자마자 바로 짐 푸르고 나와서 신랑이랑중앙떡볶이 ㅋㅋㅋ 제 최애 떡볶이에요!!!! 아 그이름도 찬란한중앙 떡볶이 ... 동성로 바로... ,Elly Blog,https://blog.naver.com/aily1336,2019-09-10
대구 가볼만한곳 진미식당중앙떡볶이삼성라이온즈파크,https://blog.naver.com/blacktop26?Redirect=Log&logNo=221075765382,떡볶이와 납작 만두 포장했어요. 삼성라이온즈파크에서중앙떡볶이개봉을 했는데 떡이 넘 커서 깜짝 놀랐어요. 납작만두는 너무 많고 그냥 밀가루 같아서 두 번 놀랬지요. 달콤하면서도 매콤 첨엔 그냥... ,☆열려라참깨 도어락☆ (010-3202-3205),https://blog.naver.com/blacktop26,2017-08-17
[대구맛집]중앙떡볶이 ,https://blog.naver.com/dlseodtm?Redirect=Log&logNo=150100248445, 중앙떡볶이 /대구 중앙떡볶이 /대구맛집/동성로맛집/떡볶이/납작만두 안녕하셨나요~?^^ 오랜만에 인사 드립니다. 그동안 바빠서 블로그 활동을 못했는데도 자주 들어와주신 분들께 감사한 인사를 드립니다... ,혜인당한의원,https://blog.naver.com/dlseodtm,2011-01-05
떡볶이 맛집:: 대구 오면 꼭 먹어야할 떡볶이! 대구중앙떡볶이 ,https://blog.naver.com/daeguvisit?Redirect=Log&logNo=220377323518,저희가 이번에 소개해드릴 곳은 대구의 중심지 동성로에 위치한 맛집 ‘ 중앙떡볶이 ’입니다. 떡볶이는... 1호선 중앙로역에 내려서 8번출구로 올라오면 CGV건물이 보일거에요. 그러면 위 사진에 보이는 큰 나무... ,'제멋대로대구로드' 대구관광공식블로그,https://blog.naver.com/daeguvisit,2015-06-02
대구중앙떡볶이후기,https://blog.naver.com/heejae0521?Redirect=Log&logNo=221523277049,어쩔수없이 중앙시장?으로 생각보다 일찍 오게되었다. 시간 보고 가보자고 했던중앙떡볶이 를 도전하게... 메인메뉴인 떡볶이랑 납짝만두.. 저 멀건 납짝만두... 속에 아무것도 없는데 무슨맛으로 먹는건지... ,love...,https://blog.naver.com/heejae0521,2019-04-26
대구 동성로중앙떡볶이납작만두,https://blog.naver.com/meegoreng2?Redirect=Log&logNo=221463830414,납작만두 엄청 많이 주심 것도 떡볶이 소스에 절여서중앙떡볶이 는 큰 가래떡 4덩이를 준다 한덩이에 천원 ㅋ 괜찮은데!? 일단 맛은 완전 합격 물엿 많이 넣은 시장떡볶이 맛 떡볶이의 정석 완전 내스타일 오뎅은... ,"Ready Get Set, Go!",https://blog.naver.com/meegoreng2,2019-02-12
대구중앙떡볶이납작만두가 맛있네요~,https://blog.naver.com/ire2?Redirect=Log&logNo=221650631899,다행히 제가 다녀온날은 대기가 없이 바로 들어갔답니다~ 대구 명물인중앙떡볶이 의 메인메뉴인 반달모양의 납작만두와 통가래떡의 떡볶이가 맛나게 조리되고 있네요 떡볶이와 만두는 일인분에 사원천씩 다른... ,소소한일상의 행복,https://blog.naver.com/ire2,2019-09-17
대구 중앙떡복이/동성로중앙떡볶이 ,https://blog.naver.com/boabox?Redirect=Log&logNo=220410551340,대구에서 가장 맛있는 떡볶이가 어딘지 모르지만 대구 동성로에서 가장 인기있는 떡볶이는중앙떡볶이 죠. 그래서 대구 동성로가면 한번씩가서 먹고와요~ 대구음식이 양념이강해저와 아주 잘 맞거든요 ㅎㅎ 항상... ,cuteworld,https://blog.naver.com/boabox,2015-07-05
동성로 -중앙떡볶이 .,https://blog.naver.com/coollady0907?Redirect=Log&logNo=60053989310,떡볶이는 자연은 123일 자두와 함께. 후후. 이날 먹고나서야. 왜 사람들이중앙떡볶이 를 그렇게 줄서서 기다리며 먹는 지 알겠더라구요. 그 맛이 떠나질 않아요. 완전최고최고!! 아마 한번 더 먹으러 갈듯. 아... ,Nobody But You,https://blog.naver.com/coollady0907,2008-08-10
백종원의 3대천왕 떡볶이집 '대구중앙떡볶이 ',https://blog.naver.com/syyh06122?Redirect=Log&logNo=220652175237,대구중앙떡볶이 (백종원의 3대천왕 떡볶이집 방영) 백종원의 3대천왕에 나오는 맛집들은 백종원... 슝슝슝~~~중앙떡볶이주소 : 대구 중구 동성로2길 81(2.28기념중앙공원 맞은편) 이곳을 찾을라고 노력을 안해도... ,/..,https://blog.naver.com/syyh06122,2016-03-12
"『대구맛집/동성로맛집』 중앙떡볶이 - 중앙떡볶이 는 맛있다,,,,",https://blog.naver.com/kazuyyy?Redirect=Log&logNo=220838241036," 중앙떡볶이 의 쌀떡볶이(3,000원) 오래간만에 와서 느끼는건가? 쌀떡볶이 크기가 쫌더 커진거 같음. 팅팅분게 아니고 크기가 더 커진거 같아서 좋음. 느낌상으로 말이지. ㅋㅋㅋ 납작만두(3,000원)중앙떡볶이 ... ",[사부작]맛있는 인생,https://blog.naver.com/kazuyyy,2016-10-18
백종원의 3대천왕 떡볶이 대구 맛집중앙떡볶이 ,https://blog.naver.com/verbena0712?Redirect=Log&logNo=220654263545,점심시간때 쯤 도착한 대구중앙떡볶이 백종원 3대천왕 떡볶이로 더 유명해진 집!원래도 유명했다지만...ㅋㅋ 원래는 매운갈비찜?그걸 먹으려다가 대구 온김에맛만 보라고 데리고 갔는데...정말 너무 맛있어서... ,오늘도 홀림,https://blog.naver.com/verbena0712,2016-03-14
동성로 3대천왕 떡볶이 전국구 맛집 -중앙떡볶이 ,https://blog.naver.com/nabureng2?Redirect=Log&logNo=221439751959," 중앙떡볶이떡볶이1인분 ( 4,-) 가격이 올랐더라고요 중지만한 쌀떡이 4개 중지만한 어묵이 4개 양배추 몇 조각 군침 돌죠? 다른 특별한게 들어가 있지 않는데 접시가 꽉 차 보이는건 제 생각인가요? 떡은... ",하늘에서 떨어지는 1억개의 별,https://blog.naver.com/nabureng2,2019-01-11
동성로 맛집] 쌀떡볶이와 납작만두 환상의 조합-중앙떡볶이!,https://blog.naver.com/kbigop?Redirect=Log&logNo=221090399578,신나게 배부르게 먹고 중앙로를 돌아다니는데 카페앞에서 공연도 하고 하더라고욤 서울 명동하고 비슷한 느낌을 받았답니다 ㅎ중앙떡볶이위치에요~ 줄이 길어서 쉽게 눈에 띌거에요~ ㅎㅎ 그럼 이만 뿅!,바쁜일상속에서느리게..,https://blog.naver.com/kbigop,2017-09-06
대구여행-동성로중앙떡볶이 (납작만두),https://blog.naver.com/star6855?Redirect=Log&logNo=221463024832,"저번 여행에선 서문시장에서 떡볶이와 납작만두를 먹었는데, 대구친구가중앙떡볶이 가 더~~ 맛있다고해서 이번여행에 오면 꼭 여기서 먹으라고 추천을 해줘서 다녀왔다. 숙소로 들어가기 전 시간이 조금 남아... ",내 블로그,https://blog.naver.com/star6855,2019-02-11
대구/ 중앙 떡볶이 ,https://blog.naver.com/kjwlovejjh?Redirect=Log&logNo=220622187940,ㅎㄷㄷ 중앙 테이블이 있고 사이드 테이블이 있어요 저희는 자리가 없어서 사이드 테이블에... 삼대 떡볶이인중앙 떡볶이 는 괜히 유명한 곳이 아닌 게 떡볶이 자체가 굉장히 맛있어요 살짝 나는... ,SENTIMENTAL WON,https://blog.naver.com/kjwlovejjh,2016-02-09
대구 동성로 맛집 :: 삼대천왕중앙떡볶이 ,https://blog.naver.com/sarang612?Redirect=Log&logNo=221532141593,맛집중앙떡볶이메뉴 및 가격 우리는 친구들 만나서 같이 먹으려고 쌀떡+만두 4000원짜리 3개 포장했다 만두는 납작만두! 만두는 따로 포장할수도있고 떡볶이랑 같이 포장도 되는데 어차피 국물에... ,H LOG,https://blog.naver.com/sarang612,2019-05-08
대구떡볶이맛집중앙떡볶이(feat. 줄서기 성공팁!),https://blog.naver.com/dmsals0?Redirect=Log&logNo=221463471047,"워낙 유명한 대구 떡볶이맛집 중 손꼽히는중앙떡볶이 . 항상 갈때마다 줄이 어마어마하기도했고, 시내 나와서 사는김에 꼭 한번 먹어봐야지 ! 했지만 늘 깜빡하기일수.. 그러다가 마음을 다잡고..(?) 드디어... ",러블리민의 여행병,https://blog.naver.com/dmsals0,2019-02-11
2012 여름 내일로 기차여행 #6 대구 맛집중앙떡볶이 ... ,https://blog.naver.com/pih870318?Redirect=Log&logNo=110146058005,했었는데중앙떡볶이 에도 납작만두와 떡볶이가 있더라구요 :) 매장은 특이하게 가운데 테이블이 없고 이렇게 벽쪽으로만 쭈르륵 자리가 있어요 ㅎㅎ 가격은 쌀떡볶이 2500원 / 만두 2500원 / 김밥 1000원 / 순대... ,초코혜 365일 매일이 여행 ♪,https://blog.naver.com/pih870318,2012-08-28
대구 동성로 :중앙떡볶이-대구떡볶이 강추 : ),https://blog.naver.com/hiny120708?Redirect=Log&logNo=220026279714,ㅠㅠ ( 지금 이 줄은 시작이었을 뿐 .... ) 대구중앙떡볶이나는 이집 떡볶이 너무너무 좋아라 해서 대구 올때마다 언제나 빠지지 않고 꼭꼭 먹고간다 !!! 대구 하면 떡볶이 맛있는곳이 워낙 많기도 한 곳인데 그간... ,행복한 호야네 이야기,https://blog.naver.com/hiny120708,2014-06-10
대구 동성로중앙떡볶이 ,https://blog.naver.com/kingarchi?Redirect=Log&logNo=221602813720,여자친구가 대구의 명물이라며중앙떡볶이 로 날 데려왔는데 일단 비쥬얼은 합격이었다. 떡볶이 떡이 딱 내가 좋아하는 굵은 떡이었다. 그리고 소스가 미쳤다. 딱 덕자네 방앗간 떡볶이 소스에서 내가 느낀... ,kingarchi님의블로그,https://blog.naver.com/kingarchi,2019-08-02
"[대구, 동성로]중앙떡볶이 ",https://blog.naver.com/nomnol?Redirect=Log&logNo=221562551583,백종원 선생님도 다녀가심 - 조금 더 친절하시면 좋을 듯 #대구맛집 #대구떡볶이 #대구떡볶이맛집 #동성로맛집 #동성로떡볶이 # 중앙떡볶이#백종원맛집 #백종원떡볶이,사소한 감흥들,https://blog.naver.com/nomnol,2019-06-15
[EAT]대구 동성로 맛집 _ 중앙떡볶이 _두꺼운 떡볶이와... ,https://blog.naver.com/jack8900?Redirect=Log&logNo=221672773647,"드디어 나온 떡볶이+만두 세트 2인분의 양입니다. 많지 않아 보이지만중앙떡볶이특유의 두꺼운 떡으로 적은 양은 아니고, 만두도 생각보다 많아요. 물론, 양이 많으신 분들이라면 조금 추가하시길 추전드려요.... ","Go, Eat and Enjoy",https://blog.naver.com/jack8900,2019-10-09
"대구 분식 - 영생덕,중앙떡볶이 , 미성당",https://blog.naver.com/lyceenne?Redirect=Log&logNo=221276901374,대구의 다른 만두집도 가보고 싶다 야끼우동도 볶음짬뽕이랑 약간 다른 느낌이었어 이번에 배운 것중앙떡볶이 는 포장줄은 길고 매장줄은 별로 없다저번에도 우리 뒤에서 떡볶이 떨어져서 한 시간 기다리래서... ,Deep River,https://blog.naver.com/lyceenne,2018-05-16
"[대구]중앙떡볶이 , 동성로 228공원 옆 떡볶이집",https://blog.naver.com/kolae666?Redirect=Log&logNo=220647545475,"[대구]중앙떡볶이 , 동성로 228공원 옆 떡볶이집 전에 대구 출장중에 들렀던 떡볶이집인중앙떡볶이입니다. 매장 방문하기 전에 시간이 조금 남아서 바로 떡볶이 한접시 하러 대구의 번화가인 동성로로... ",제이슨님의 세상유랑기,https://blog.naver.com/kolae666,2016-03-07
[대구]떡볶이 투어 2탄중앙떡볶이 ,https://blog.naver.com/ssong6604?Redirect=Log&logNo=60171658034,대구의 명물 떡볶이집 가기 2탄!!! 대구 동성로에 있는중앙떡볶이가게 30년 정통의 옛날 그집이랍니다. 음 티비에서도 몇번 나오고~일단 유명하긴 유명한거 같아요. 가게 안에도 사람들이 많습니다. 떡볶이... ,헬로우 두두,https://blog.naver.com/ssong6604,2012-09-19
대구동성로 중앙떡볶이 ,https://blog.naver.com/pink3462?Redirect=Log&logNo=80159269945,동성로중앙떡볶이매번 지나갈때마다 언니들이 저집 유명한 집이라고 맛있다고... 그래서 꼭... 옆에 퀵서비스 아저씨께서 기다리고 계시더라구요 ㅋㅋ 요 떡볶이 퀵으로 받아먹나봐요 ㅎㅎ 한쪽 옆에선... ,센티멘탈 스토리♡,https://blog.naver.com/pink3462,2012-05-04
백종원 3대천왕에서 추천한 대구중앙떡볶이- 동성로 맛집,https://blog.naver.com/lcyyong5?Redirect=Log&logNo=220594350998,조합 숨어있는 오뎅도 반갑고~ 게눈 감추듯이 떡볶이 한 접시 먹고 나오니 여전히 식당앞엔 인산인해 몇 차례 도전끝에 어렵게 맛을 본 떡볶이인데 충분히 그정도 맛을 보여주는 떡볶이집이다. 동성로중앙떡볶이 ,마르첼의 블로그,https://blog.naver.com/lcyyong5,2016-01-12
"대구여행 삼송빵집, 백종원의 3대천왕 떡볶이 맛집중앙떡볶이 ",https://blog.naver.com/dndbwodnjs?Redirect=Log&logNo=220800848164,대구 유명 떡볶이 맛집중앙 떡볶이 를 찾아 나서요~ 대구 동성로중앙 떡볶이백종원 3대천왕에 출연한 대구 명물떡볶이 대구중앙떡볶이(2.28 공원 맞은편에 있어요.) 원래도 인기맛집인데 3대천왕 떡볶이... ,지봉공쥬,https://blog.naver.com/dndbwodnjs,2016-08-31
[대구동성로맛집] 대구 길거리 음식의 대명사! 동성로중앙떡볶이 ,https://blog.naver.com/younggaedu?Redirect=Log&logNo=220256000585,대구동성로의 다양한 맛집 중에서도 대구 시민뿐만아니라 대구를 찾아오는 여행객분들에게도 인기가 많은 대구의 명물 떡볶이집 ★중앙떡볶이★ 대구분들이라면 다 안다는 줄서서 먹는중앙떡볶이 집! 대구... ,[영스파]공무원/경찰/편입영어전문 소수과외,https://blog.naver.com/younggaedu,2015-01-29
뚜벅이 대구여행 1박2일 ( 중앙떡볶이 /방천가족족발... ,https://blog.naver.com/mjpslove1?Redirect=Log&logNo=222134161873,중앙로역에서 하차하여중앙떡볶이 를 먹으러 갔어요.중앙떡볶이존맛탱!!! 오사카 느낌나는 스파크랜드의 관람차도 구경 관람차 탑승권이 5천원이라서 타볼만 한 것 같아요 스파크랜드 1층에 있는 쉐이크쉑... ,:),https://blog.naver.com/mjpslove1,2020-11-03
