title,link,description,bloggername,bloggerlink,postdate
충주중앙탑인근맛집중앙탑메밀마당 ,https://blog.naver.com/goisalejr?Redirect=Log&logNo=221779243537,찾은 #충주중앙탑인근맛집 이 있으니 바로 # 중앙탑메밀마당무엇보다 #메밀후라이드치킨 이랑 곁들여서... 1996년부터 중앙탑 정문 앞에 위치해 있답니다. 그래서 메밀마당이었지만 이제는 자연스럽게 앞에... ,너러바회Jr 美食記,https://blog.naver.com/goisalejr,2020-01-20
충주중앙탑맛집 시원하게메밀 로 몸보신메밀마당막국수,https://blog.naver.com/junho4576?Redirect=Log&logNo=222436821572,충주중앙탑맛집메밀마당 에서메밀막국수 아주 시원하게 클리어하고 ㅋㅋ 국물을 다 먹지는 못하였네요 ... 치킨은 시원하게 클리어 ㅋㅋ 양념 막국수도 깨끗하고 진짜 소서때 가서 이제 쓰는거지만 너무... ,지구별 모험가,https://blog.naver.com/junho4576,2021-07-19
충주맛집!중앙탑메밀마당막국수와 와 메밀후라이드치킨,https://blog.naver.com/dnlgus1122?Redirect=Log&logNo=222301222572,^^ 저녁메뉴로 뭘 먹을까 하다가메밀마당막국수집!! 저녁시간이 다되어가서 그런지 차가 많더라구요!!ㅎㅎ 평소에 막국수를 좋아하는데메밀 막국수와 치킨의 조합? 뭔가 호기심에 이끌려... ,위위의 일상,https://blog.naver.com/dnlgus1122,2021-04-07
충주 중앙탑메밀마당막국수치킨 조합 겉바치킨 음치킨~,https://blog.naver.com/iocokil?Redirect=Log&logNo=222054466102,"충주 중앙탑메밀마당open 11:00 - 21:00 ☎️0507.1400.0283 충북 충주시 중앙탑면 중앙탑길103 지난여름... 이름이 메밀마당이니만큼 모든 메뉴에 메밀이 들어가네요! 메밀은 당뇨,고혈압 등 혈관계 질환에 효과가... ",웃음가득 온이네,https://blog.naver.com/iocokil,2020-08-08
[충주] 우리나라의 정중앙 충주의 맛집 ㅡ' 중앙탑 메밀마당 ',https://blog.naver.com/tjddo1324?Redirect=Log&logNo=222081716682,메밀치킨/메밀막국수 # 중앙탑메밀마당#중앙탑막국수 #중앙탑맛집 #중앙탑막국수메뉴 # 중앙탑메밀마당 메뉴 메뉴와 가격은 사진을 참고 해주세요 막국수와 치킨의 조합이 쌩뚱맞아 보였는데 새콤한... ,행복한 블로그,https://blog.naver.com/tjddo1324,2020-09-06
충주막국수맛집중앙탑 메밀마당꼭가봐야할곳!,https://blog.naver.com/ejkid1004?Redirect=Log&logNo=221775829898,오시면중앙탑 메밀마당 에서 맛있게 식사하고 산책하는 코스로 정해서 조만간 또 와야겠네요 :) #충주맛집 #충주막국수맛집 #중앙탑맛집 # 중앙탑메밀마당#중앙탑막국수 #충주막국수 #충주메밀마당 #메밀치킨,요리하는쭈,https://blog.naver.com/ejkid1004,2020-01-17
 중앙탑 메밀마당- 충주 막국수 맛집 추천(메밀막국수메밀치킨)✨,https://blog.naver.com/bami0804?Redirect=Log&logNo=221880507670,막국수 메밀 치킨이 유명하다고 하더라구요! 그래서 그런지중앙탑근처에 막국수 파는 식당이 꽤 있었어요! 저흰 그 중 # 메밀마당에서 저녁을 먹기로 했답니다! 찾아보니까메밀마당 은 대한민국 최초로... ,먹고 노는 윰블로그,https://blog.naver.com/bami0804,2020-03-30
충주맛집중앙탑메밀마당 ,https://blog.naver.com/dbsdk74?Redirect=Log&logNo=221812380479,입심심할때 먹기좋을듯 배터지게 먹고나온 메밀막국수맛집!! 위치입니다 ☝️☝️☝️ #충주맛집 # 중앙탑메밀마당#충주맛집추천 #충주막국수맛집 #충주치킨맛집 #충주메밀만두 #충주메밀치킨 #막국수맛집... ,새라 일상기록 ◡̈,https://blog.naver.com/dbsdk74,2020-02-17
"충주 - 충주호, 목계솔밭 차박, 중앙탑사적공원,중앙탑메밀마당 ",https://blog.naver.com/niceshatv?Redirect=Log&logNo=222019647312,여유로움 #풍경소리 #중앙탑사적공원 충주 가시면 진짜 추천드립니다요 다음에 오빠 친구한테 받은 팝업텐트 들고 저기 가야지 바로 앞 한강 두고 저기갈 생각ㅋㅋ # 중앙탑메밀마당근처에 비슷한 곳 두어곳이... ,오늘도여행하며사랑하며.,https://blog.naver.com/niceshatv,2020-07-03
충주 -중앙탑 메밀마당 ,https://blog.naver.com/hoba_?Redirect=Log&logNo=222058310550,예전에 다녀왔던 https://blog.naver.com/hoba_/221973904879 여기가 더 맛있었어요. 누가봐도 비빔막국수 누가바도 물막국수 :) #충주 #중앙탑 # 중앙탑메밀마당#메밀막국수 #막국수 #메밀치킨 #치킨 #맛집,윤또맛의 윤쉘린,https://blog.naver.com/hoba_,2020-08-12
메밀막국수와 함께 하기 좋은... 충주중앙탑메밀마당으로... ,https://blog.naver.com/jjong627?Redirect=Log&logNo=222453041740,"바로, 충주중앙탑 메밀마당위치 및 영업정보 충주 중앙탑사적공원 근처에 위치합니다. 주차가 매장... ㅎㅎㅎ 총평 사실 충주 맛집을 찾다가 메밀마당을 발견하고는 긴가민가라고 생각했습니다. TV 출연도... ",늘푸른내청춘의 늘푸른 세상 사는 이야기,https://blog.naver.com/jjong627,2021-08-01
제천 맛집으로 소문난중앙탑 메밀마당먹은 거,https://blog.naver.com/dwdw0624?Redirect=Log&logNo=221583973690,"제천 맛집 메밀마당 메뉴판과 가격 ㅇ.ㅇ 메밀후라이드치킨, 메밀 물 막국수, 메밀 비빔 막국수 고고.... 제천 맛집으로 소문난중앙탑메밀마당위치는 여기~ 점심을 먹고 오빠 친구 할머니네 시골 빈집을 구경감.... ",아이스아무러게나,https://blog.naver.com/dwdw0624,2019-07-12
[충주 중앙탑메밀마당 ] 담백한 것이 좋아! 메밀막국수... ,https://blog.naver.com/narukun?Redirect=Log&logNo=220646815399,"- 가게명:중앙탑메밀마당- 추천메뉴: 메밀치킨, 메밀비빔막국수 - 주소: 충북 충주시 가금면 중앙탑...중앙탑메밀마당 에 다녀왔어용 입구 되시겠습니다 길 한복판에 위치해 있어요 ㅋㅋㅋ 메밀마당... ","평범한 20대 여자의 먹고, 쏘다니고, 사재끼는 블로그",https://blog.naver.com/narukun,2016-03-06
충주 데이트코스 추천 여행지 5곳( 중앙탑메밀마당 .의상대여소.... ,https://blog.naver.com/homibike?Redirect=Log&logNo=221568955983, 메밀마당 에서 사용하는 고기는 목우촌닭고기를 이용하고 있습니다.중앙탑 공원 인근에 자리 잡은메밀요리 전문점입니다.메밀 을 넣어 만든 면 위에 아삭한메밀 싹과 과일을 갈아만든 매콤한 양념을... ,호미숙 자전거여행-사진여행,https://blog.naver.com/homibike,2019-06-23
충주 중앙탑 맛집메밀마당 ,https://blog.naver.com/0812sjh?Redirect=Log&logNo=220071016215,요건 집에서 먹는 부친개의 모양하고 비슷하게 생겼다메밀 만두 야채만두랑 김치만두 10개도 안닌 7개라는 숫자가 나는 요상하게 보인다 충주 중앙탑 맛집메밀마당 의메밀 막국수 보기만해도 푸짐한메밀 막국수,생 각 의  창,https://blog.naver.com/0812sjh,2014-07-25
충주중앙탑 메밀마당: 막국수 치킨,https://blog.naver.com/h2a0412?Redirect=Log&logNo=222271622851,"메밀가루를 적당히 섞어서 만든 파우더를 사용해서 튀겨낸 충주중앙탑메밀마당 의 치킨입니다.... 충주 메밀마당에서는 메밀의 알갱이가 보일 만큼 메밀 함량이 높았던 같습니다. 그리고, 찰기가 있는 동시에... ",금류의일상,https://blog.naver.com/h2a0412,2021-03-11
 중앙탑메밀마당충주막국수맛있는집 !!,https://blog.naver.com/jadu0407?Redirect=Log&logNo=221172276479,비빔막국수와 물막국수 하나씩 그리고 언니와 나는 따듯한 겨울철메뉴 들깨메밀수제비 그리고 메밀마당에 왔으면 꼭 먹어봐야하는 후라이드치킨! + 메밀만두까지!중앙탑 메밀마당충주 중앙캅 메밀막국수... ,긍정적으로 살아가기,https://blog.naver.com/jadu0407,2017-12-27
 중앙탑메밀마당내돈내산후기,https://blog.naver.com/melody7281?Redirect=Log&logNo=222286218779,친구가 부산에서 충주로놀러왔어요~~~~ 전날 술을 심하게달렸눈데ㅠㅠ중앙탑 에 위치한메밀마당 에서 싹~해장했습니다 밑반찬은 없구요!!물막국수 2개!! ㅋㅋ 양이 풍부합니다 면사리 추가하면 무료로... ,아이나비공식대리점루마버텍스공식대리점CarMine세차,https://blog.naver.com/melody7281,2021-03-24
[충주맛집] 메밀후라이드와 막국수 먹자!중앙탑 메밀마당 ,https://blog.naver.com/blumoonlight?Redirect=Log&logNo=220455977633,"메밀치킨과 막국수 하는 집은 메밀마당 말고도 여러 군데가 있지만 그래도 여기가 젤 맛있는 것 같아요 ㅋㅋ 다음엔 만두도 먹고 와야겠어요- 중앙탑 삼거리, 관광안내소 바로 맞은편중앙탑 메밀마당 입니다^^",Written by hyunrua,https://blog.naver.com/blumoonlight,2015-08-19
 중앙탑 메밀마당(봉평 메밀 막국수) 충주 막국수집,https://blog.naver.com/fancai?Redirect=Log&logNo=140069754996,"* 상호명:중앙탑 메밀마당 (봉평 메밀 막국수집) * 맛,양,분위기 : * 서비스 : * 위치전화: 충주시 가금면 중앙탑 앞 * 총평사진: 손님이 많아 서비스는 좀 약하지만. 맛과 분위기는 최고임 바로 앞이 중앙탑 공원이... ",밥과 반찬,https://blog.naver.com/fancai,2009-06-13
충주 막국수 맛집중앙탑 메밀마당치킨은 필수요,https://blog.naver.com/imm_sj?Redirect=Log&logNo=222009261517,충주 막국수치킨 조합에 꼭 도전해보시길 바랍니당 막국수 맛집인 메밀마당은 주문 후에 간단한... 충주막국수맛집 #충주 중앙탑메밀마당#충주중앙탑맛집 #충주중앙탑인근맛집 #충주맛집추천 #충주메밀치킨,소정의 마음으로,https://blog.naver.com/imm_sj,2020-06-22
[충주 막국수 맛집]중앙탑 메밀마당/ 중앙탑막국수,https://blog.naver.com/hanulz1977?Redirect=Log&logNo=221371282852,[충주막국수맛집] 메밀마당 충주중앙탑 메밀마당충주 중앙탑 막국수 울아들 생일♡ 생일에 먹고 싶은 거 뭐야? 물었더니 봄여름가을겨울 메밀마당 막국수와 메밀치킨 이란다. 면을 너무나도 사랑하는 울집... ,"유부야, 놀러가자",https://blog.naver.com/hanulz1977,2018-10-05
충주중앙탑 메밀마당막국수 치킨,https://blog.naver.com/lorna08?Redirect=Log&logNo=221705621112,"6,000원 메밀비빔막국수 6,000원 메밀떡만두국 5,000원 메밀부침 http://blog.naver.com/rlatjsal1205 #중앙탑막국수 #충주맛집 #충주막국수 #충주메밀마당 #충주 #막국수 #메밀 #치킨 #충주 중앙탑메밀마당 막국수",우리들의 꿈을 키우는 곳,https://blog.naver.com/lorna08,2019-11-12
생생정보 메밀막국수 메밀치킨 비법24시- 중앙탑메밀마당 ... ,https://lookery.tistory.com/5443,24시 밥상을 털어라 - 메밀막국수메밀치킨 상호 :중앙탑 메밀마당주소/위치 : 충청북도 충주시 중앙탑면 중앙탑길 103 평가/후기 : 혜움님블로그 연락처/전화번호 : 043-855-0283 가격정보 : 지도/위치 :,잡학사전,https://lookery.tistory.com/,2020-08-07
[충주중앙탑메밀마당 ] 중앙탑에서 산책하고 막국수 한그릇!,https://blog.naver.com/orolez00?Redirect=Log&logNo=221526593940,ㅎㅎ 메밀막국수 6000 메밀만두 5000 메밀부침 5000 메밀후라이드 치킨 15000 들깨메밀수재비 5500 막국수가... 맛집 #충주 막국수 #중앙탑 막국수 #중앙탑산책 # 중앙탑메밀마당#충주 메밀마당 #막국수 #중앙탑 산책,둥둥 맛집탐방,https://blog.naver.com/orolez00,2019-04-30
사계절 맛있는 막국수중앙탑 메밀마당 _V.유니,https://blog.naver.com/zoo0086?Redirect=Log&logNo=220946228059,"있는메밀마당위치입니다. 가게앞 주차공간, 바로앞중앙탑주차공간 이용하세요~ 헌터들을 위한 사장님의 배려 ㅋㅋㅋ 들어서자마자 맛집 냄새 풀풀나네요~ㅋ 메뉴입니다. 모든 메뉴에 들어가는메밀 ... ",자판기가족의 추억저장소,https://blog.naver.com/zoo0086,2017-02-27
아이랑 충주여행 활옥동굴(카누타고)중앙탑메밀마당 (막국수... ,https://blog.naver.com/phjung0220?Redirect=Log&logNo=222022545607,나왔네요중앙탑 메밀마당무엇을 먹을까 검색하다가 찾게된중앙탑메밀마당막국수와 치킨의 조함 생각만해도 아리송~ 우리동네는 당연 편육에 막국순데 우리가 갔을땐 벌써 대기표ㅠㅠ 우리표는 90번 막... ,흔한형제 육아 기록,https://blog.naver.com/phjung0220,2020-07-06
충주 당일치기(서림사과농원/ 중앙탑메밀마당 /탄금호/비내섬),https://blog.naver.com/j_doubleh?Redirect=Log&logNo=222132183833,"나왓다는 # 중앙탑메밀마당으로 ㅋㅋ 메밀 맛 살아이꼬,, 맛잇어따 메밀후라이드치킨이 너무 궁금 먹고 산책겸 #탄금호 옆에 중앙탑공원은 야경이 예쁜것 같았다 생각보다 카페같은게 별로 없는 자연 그자체... ",...,https://blog.naver.com/j_doubleh,2020-10-31
충주 활옥동굴 /중앙탑 메밀마당 :: 동굴탐험,https://blog.naver.com/coolchic375?Redirect=Log&logNo=222474204682,따란-☆중앙탑 메밀마당 의 메밀국수 미리 말씀드리면 리퓔 메밀면도 막 준다 제일 기대했던 메밀떡만둣굿 인생 떡국이야 리얼루 메밀로 만든 떡이 부들부들 쫄깃쫄깃한데 사골국물이 구수하고 감칠맛 나서... ,Nona's Happy Moment,https://blog.naver.com/coolchic375,2021-08-18
충주 맛집메밀마당막국수메밀 치킨 존맛,https://blog.naver.com/darki113?Redirect=Log&logNo=222120504989,다음 여행 때도 꼭 들리고 싶은 맛집입니다 :D #충주맛집 #충주막국수맛집 #충주메밀치킨 #충주메밀마당 # 중앙탑메밀마당#메밀치킨 #비빔막국수 #물막국수 #충주여행 https://tv.naver.com/v/16281591,헬로랑이 Storyhouse,https://blog.naver.com/darki113,2020-10-19
 중앙탑 메밀마당■ 메밀막국수메밀치킨,https://blog.naver.com/rok2tank?Redirect=Log&logNo=222054020541,[ 2TV 생생정보 1124회 ] 8월 7일 금요일 취재 연락처 비법 24시 밥상을 털어라 메밀막국수메밀치킨 ■ 메밀막국수메밀치킨중앙탑 메밀마당충청북도 충주시 중앙탑면 중앙탑길 103 ☎ 043-855-0283... ,당황하지 않고,https://blog.naver.com/rok2tank,2020-08-07
"충주 수주팔봉, 중앙탑공원,중앙탑메밀마당새싹비빔막국수",https://blog.naver.com/polelate?Redirect=Log&logNo=222398288883," 중앙탑공원에 오기 전에 수주팔봉이란 곳을 갔는데, 사진은 없네요. 역시 매스컴의 위력을 다시금... 그리고 바로 옆 음식점에서메밀 막국수를 먹었습니다. 음식점들이 많은데 유독 이 곳만 사람들이 많이... ",인생은 예술이다,https://blog.naver.com/polelate,2021-06-14
"충주중앙탑맛집 치킨, 막국수 맛집 [ 메밀 마당 ]",https://blog.naver.com/sanghyeoke?Redirect=Log&logNo=222530953195,하는메밀치킨!!!!! ㅎㅎ 생각만 해도 배가 고프네용 라디오에 고야아빠가 사연을 보내서 당첨돼서는메밀 마당외식 상품권을 탔지 뭐예요 ㅎㅎ (참.. 이런 거 잘해) ㅋㅋㅋㅋ 그래서 상품권을 쓸 겸~중앙탑 에... ,성마네 놀이터♥,https://blog.naver.com/sanghyeoke,2021-10-08
충주 중앙탑맛집 ' 중앙탑메밀마당 ' : 시원한 메밀막국수와... ,https://blog.naver.com/dahaldahal?Redirect=Log&logNo=221454941663,충주 중앙탑 메밀막국수 맛집 ' 중앙탑메밀마당 ' 안녕하세요! 다할입니다:) 저는 여전히 바쁘게 지내고... 중앙탑의 맛집 '메밀마당'입니다. 중앙탑 바로 앞에 있어요- 옛날에는 이곳이 유명한 두 식당 중... ,‘다할’의 다할 이야기,https://blog.naver.com/dahaldahal,2019-01-30
충주메밀마당|메밀 국수 후라이드 찐맛집 |중앙탑사적공원,https://blog.naver.com/anauda_?Redirect=Log&logNo=222114855042,"중앙탑면 중앙탑길 103(탑평리 42) / 043-855-0283 나 메밀국수 별로안좋아해 아니 이 맛은? 찾았다, 내 입맛메밀후라이드치킨 충주중앙탑메밀마당 에 차가 많을 때 부터 알아봤다. 여긴 찐이라고. 호들갑을 떨며... ",김디드의 서울살이,https://blog.naver.com/anauda_,2020-10-14
충주중앙탑맛집메밀마당메밀 후라이드+막국수:),https://blog.naver.com/blumoonlight?Redirect=Log&logNo=220818778384,"모르는 곳이 없을만한 충주맛집메밀마당 , 이제 계절메뉴 출시했으니 따끈한메밀 음식이랑 후라이드 드시러 와보세요:) 주차는 바로 앞 안전지대에 하시는 분들도 많고중앙탑 공원에도 주차장 완비되어 있어요^^",Written by hyunrua,https://blog.naver.com/blumoonlight,2016-09-23
[충주맛집/중앙탑메밀마당 ] - 중앙탑 나들이깔끔식사,https://blog.naver.com/moonlight905?Redirect=Log&logNo=20198405689,"콧바람중앙탑옆으로 잔잔히 흐르는 남한강 온갖 스트레스 날려버려~! ㅋㅋㅋㅋ 넌 참 ㅋㅋㅋ 암튼... 아직은 액젓의 향이 강했던 열무김치 개인적으론 익은게 좋아서리 ㅎㅎ - 메밀막국수 (비빔) 5,000냥... ",진화하는 블로그,https://blog.naver.com/moonlight905,2013-10-30
