title,link,description,bloggername,bloggerlink,postdate
대구 동성로중앙떡볶이여행 와서 재방문!,https://blog.naver.com/zzzzzangg?Redirect=Log&logNo=222424901865,"대구 동성로중앙떡볶이 는 떡볶이에서 카레맛이 나요. 거부감이 드는 카레맛이 아니라, 맛있게 잘 어울리는 카레맛이에요. 떡볶이 만들 때, 카레 가루를 넣어 만들면 맛있다는 얘기가 있는데,중앙떡볶이 를... ",STAY GOLD,https://blog.naver.com/zzzzzangg,2021-07-08
대구 떡볶이 맛집 동성로중앙떡볶이떡볶이와 납작만두,https://blog.naver.com/newsilver21?Redirect=Log&logNo=222515307071,오시더라구요중앙떡볶이검색하다보니 백종원님이 오셧다가셨다는데 삼대천왕에 나왔었나봐요 방송끝나고는 암청 많았을거같아요 번호표부르고 주문하니 바로 떡볶이랑 납작만두가 나왔습니다 저희는... ,Jennymom’s daily,https://blog.naver.com/newsilver21,2021-09-24
"급 대구여행 ( 중앙떡볶이 ... 낙영찜갈비,김광석길,신천궁전떡볶이)",https://blog.naver.com/sw310?Redirect=Log&logNo=222122253615,중앙로역에 와서 쫄보가 꼭 한번 보고 싶었다는 2.18 대구 지하철 참사 기억공간에 왔다. ㅠㅠ 잊지... # 중앙떡볶이동성로 구경하다가 간식타임으로 떡볶이 원래 달떡 가려고 했으나 위치가 애매해서 차선책으로... ,"여행, 기록, 일상",https://blog.naver.com/sw310,2020-10-21
[대구/동성로]중앙떡볶이 ,https://blog.naver.com/swiss9769?Redirect=Log&logNo=222270100689,2.28 기념 중앙공원에 앞에 있는중앙떡볶이처음 방문했을 때 사람이 하나도 없어서 어쩐 일인가 했더니 떡볶이를 만드는 시간이라고 이따가 오라고 안내를 받았네요. 떡볶이가 떨어지면 아예 40분 동안... ,훈도사의 Photo & Travel Story,https://blog.naver.com/swiss9769,2021-05-03
"2021/ 8/ 21/ 주말 일기 ( 굿또 스시,중앙 떡볶이 , 아주르와... ",https://blog.naver.com/rencia77?Redirect=Log&logNo=222481962496,다행히 걸어서중앙 떡볶이 를 포장해 갈 수 있게 되었네요. 중떡 먹고 싶어서 포장용 큰 유리 용기도... 김 뿌리고 밥도 비벼 먹었어요 ㅋㅋㅋㅋㅋㅋㅋㅋㅋㅋㅋㅋㅋ 집에 와서 떡볶이 먹으면서 본 영화. 아주르와... ,건 똑 이 와 똑 건 이 네 집,https://blog.naver.com/rencia77,2021-08-24
대구 동성로중앙떡볶이포장해서 먹을 정도로 자꾸 생각나긴 해!,https://blog.naver.com/sichanmi?Redirect=Log&logNo=222227248583,백종원의 3대천왕 동성로중앙떡볶이늘 신전 떡볶이만 갔었는데 달달하니 맛있는중앙 떡볶이 도 추가해봅니다. 물론 웨이팅은 필수인 거 알고 있어요... 떡볶이 위에 만두 올려서 먹으면 더 맛있고 쫄깃쫄깃한... ,"좋아 너, 밤새도록",https://blog.naver.com/sichanmi,2021-02-01
"대구중앙떡볶이 , 그래 이 맛이군! 다시 생각나는 맛",https://blog.naver.com/giselesj0414?Redirect=Log&logNo=221937503500,대구에서 유명한 다 먹어보고 싶었어요 :-) 이 날 갔었던 대구 먹방 코스 동성로 카페 오차야미떼 - 중화반점 -중앙떡볶이- 동대구역 카페 앙드뜨와 - 닭똥집 거리 진미통닭 . . . #대구3대떡볶이 가... ,쫑쫑이의 모든 순간,https://blog.naver.com/giselesj0414,2020-04-30
대구 중앙로 떡볶이 맛집 3. 반월당 소금분식 /중앙떡볶이 ... ,https://blog.naver.com/lcu99?Redirect=Log&logNo=221997764393," 중앙떡볶이대구 중앙로를 따라 있는 시장 떡볶이, 즉석 떡볶이, 가래떡 떡볶이 다양한 맛집들을 가보았습니다. 여러분의 최애 대구 떡볶이 맛집은 어디 신가요? ▲ 더 자세한 대구 여행 정보는 대구 관광... ","여행하다, 채시엘Trip",https://blog.naver.com/lcu99,2020-06-11
대구중앙떡볶이백종원도 인정한 떡볶이 맛집 다녀온 후기,https://blog.naver.com/yunmisense?Redirect=Log&logNo=221751106970,세상 행복..ㅋㅋㅋㅋㅋㅋㅋㅋ 대구중앙떡볶이떡볶이는 쌀떡볶이고 가래떡으로 만들었어요 !! ㅎㅎ 부산 이가네떡볶이랑 비주얼이 비슷하네요 ~~ ㅎㅎㅎㅎ 세트에는 떡볶이는 떡이 2개 들어 있어요 ! 남편이... ,윰미의 신나는 일상 ♪,https://blog.naver.com/yunmisense,2019-12-30
[대구중앙떡볶이 ] 1인세트 메뉴로 납작만두+떡볶이 먹어본 후기,https://blog.naver.com/1167mm?Redirect=Log&logNo=222524959888,"떡볶이를 좋아하신다면 4,000원 짜리 1인세트도 있으니까 배불러도 꼭 드셔보세요 맞다!! 내돈내산!!!!! 동성로에서 걷다보면 나오는 2.28기념 중앙공원 맞은편에 위치합니다!!중앙떡볶이 는 체인점이 따로 없으니... ",(๑˃̵ᴗ˂̵) 난당이 블로그 ٩( ᐛ )و,https://blog.naver.com/1167mm,2021-10-03
대구 수봉반점 중화비빔밥중앙 떡볶이후기,https://blog.naver.com/loqol312?Redirect=Log&logNo=222539521606,갑자기 날이 넘넘 추워졌는데 대구 다녀올 일이 있어서 겸사겸사 다녀온 수봉반점과중앙떡볶이 ... 1인분에는 떡 두개랑 오뎅 두개가 나오나봐요 국물이 달달하고 카레향 나는 맛있는 떡볶이였어서 수저를 찾는... ,uni's blog,https://blog.naver.com/loqol312,2021-10-17
동성로 대구중앙떡볶이내가 정기적으로 찾는 맛집.,https://blog.naver.com/onepiece0109?Redirect=Log&logNo=222322979521,대구에서 떡볶이 맛집. 자주 찾는 단골집 동성로 대구중앙 떡볶이운영시간 11:20 - 20:00 휴무일 첫째 주... 중앙로 떡볶이는 포장해오면 떡이 딱딱해져서 거기서 먹고 오시길 추천드리며 혹시 포장해 오시게... ,꼼지락Betty,https://blog.naver.com/onepiece0109,2021-04-27
"대구 떡볶이 맛집,중앙떡볶이 ",https://blog.naver.com/jongho9703?Redirect=Log&logNo=222535626576," 중앙떡볶이☎️ 053-424-7692 매일 11:30 ~ 19:30 참고하시면 좋을거같아요~ 위치는 동성로 중앙공원 앞에... 요즘은 보통 이러니 그런가보다 하고 먹는거 같아요 쌀떡볶이+만두(4,000원) 1인분 씩 주문하기 부담스러운... ",마조리카의 맛집 여행,https://blog.naver.com/jongho9703,2021-10-13
[대구] 중앙떡볶이 ,https://blog.naver.com/songjiheee?Redirect=Log&logNo=222332474343,"대구 투어의 첫 방문지인중앙떡볶이떡볶이 소스가 맵거나 달아서 자극적인 맛이 아닌!! 소스가 주인공이 아니고 가래떡과 납작만두, 오뎅의 맛을 한껏 더 돋보이게 해주는 조연 역할을 하는 느낌이었어요... ",⋆*･ﾟ:⋆*･ﾟ:오사너의 숲: ⋆*･ﾟ: .⋆,https://blog.naver.com/songjiheee,2021-05-02
"대구중앙떡볶이 , 대구 동성로 맛집",https://blog.naver.com/suringe?Redirect=Log&logNo=222465920908," 중앙떡볶이+_+ 떡볶이 귀신인 내가 이곳을 지나칠리가 없지 ㅎㅎㅎ 너무 맛있어 보이쟈냐 ~ 정말 얇았던 대구만의 음식인 납작만두 +_+ 우리는 이 메뉴판을 보고 떡볶이 하나, 만두 하나를 주문했다! 요거는... ",사진작가 부부의 사진이야기,https://blog.naver.com/suringe,2021-08-11
대구중앙떡볶이유명하다고해서 다녀왔어요 /중앙떡볶이 ... ,https://blog.naver.com/s2lky88?Redirect=Log&logNo=222432642358,대구중앙떡볶이 가 왜 유명한지~~~ 제가 한번 가봤습니다 !! 도대체 어떤 맛이길래… 이렇게나... 납짝만두를 또 떡볶이 국물에 찍어 먹으면 그렇게 고소하고 맛있을수가 없그든요 ~~ㅋㅋ 조금만 먹기로... ,깽이의 이중생활 : ),https://blog.naver.com/s2lky88,2021-07-15
"대구 먹방여행1. 수봉반점,중앙떡볶이 , 계산성당, 마당깊은 집",https://blog.naver.com/dunteang2?Redirect=Log&logNo=222133849184,근처에중앙떡볶이 가 있으니 간단하게 먹어볼까 하고 갔는데 엄머... 떡볶이는 새로해야한단다. 한시간 뒤에 오래러 그래서 건너편 스벅에서 노닥거리다가 다시중앙떡볶이 로 백종원 아저씨도 오셨었군요.... ,일상다반사,https://blog.naver.com/dunteang2,2020-11-03
"대구 동성로중앙떡볶이, 줄서서 먹어봄",https://blog.naver.com/winwinrn?Redirect=Log&logNo=221756640580,대구중앙떡볶이이런 떡볶이 오랜만에 보는듯... 빨리 먹고싶은거 있죠.ㅎㅎ 납작만두도 같이 팔고 있어요! 메뉴판도 찍어보고~ 떡볶이+만두 섞어서도 파는데 그것도 4000원이예요. 다들 섞어를 많이 먹길래... ,끄적끄적 블로그,https://blog.naver.com/winwinrn,2020-01-01
[백종원 3대 천왕] 대구 동성로중앙 떡볶이먹어본 후기,https://blog.naver.com/dnflemf951?Redirect=Log&logNo=222536467852,그래서 위치를 잘 못 찍은 김에 백종원 3대 천왕에 소개된 대구 떡볶이집중앙 떡볶이 를 다녀왔어요. 처음엔 tv에 방송된 곳인지도 모르고 얼마나 맛있으면 떡볶이집에 줄을 서고 있지?? 했다가 백종원의 3대... ,또네 와 튜니.ʕʘ‿ʘʔ.,https://blog.naver.com/dnflemf951,2021-10-14
기자단 ] 전지적 참견 시점에 나온 대구 중구 맛집중앙떡볶이 ,https://blog.naver.com/dgjunggu?Redirect=Log&logNo=222366129169,"대구중앙떡볶이 는 2.28기념 중앙공원 맞은편에 위치하고 있어요. 직영점, 체인점이 없으며 2.28공원 옆...중앙떡볶이 는 쌀떡볶이랍니다. 밀떡, 쌀떡, 반반 좋아하는 것이 다 다르기에 쌀떡볶이를 좋아하시는... ",대구광역시 중구청 공식블로그,https://blog.naver.com/dgjunggu,2021-05-25
대구 납작만두 맛집중앙떡볶이솔직한 느낌,https://blog.naver.com/jsh_happydays?Redirect=Log&logNo=222529140959,재방문은 호불호가 갈릴것같은데 난 대구에 또 갈 일 있으면 요건 꼭 먹고 올듯 함ㅎㅎ 대구 납작떡볶이 맛집중앙떡볶이 ! TEL) 053-424-7692 주문할때 떡볶이+비빔만두 반반으로 한접시 시키면 좋음ㅋ,엘라의 일상탐구,https://blog.naver.com/jsh_happydays,2021-10-07
[ 중앙떡볶이 ]백종원 3대천왕 맛집,https://blog.naver.com/bsj39391?Redirect=Log&logNo=222518466078,대구 3대 떡볶이를 찾아라~ 백종원 3대천왕에 나왔던중앙떡볶이 를 맛보러 갔어요^^ 엄지척 백종원3대천왕 출연 김밥 찍어먹기 좋은 일품떡볶이 중앙로역 2번 출구에서 365m 매일 11:20 ~20:00 일요일은 오후 4:30... ,싱크퓨어 공식총판사업본부,https://blog.naver.com/bsj39391,2021-09-27
 중앙떡볶이 ,https://blog.naver.com/vovhouse?Redirect=Log&logNo=221701794029,싸이즈의 떡볶이중앙떡볶이 는 밀떡이 아닌 쌀떡이예요 쌀떡이 완전쫀득쫀득 밀떡과 비교되길... 개인적인 소줏잔 평점(5잔만점) 4잔^^ 느낌한줄평 중앙로의 살아숨쉬는 맛. 바쁘신건알겠는데 조금만 더 친절했으면,My new Story,https://blog.naver.com/vovhouse,2019-11-08
대구 동성로 유명한중앙떡볶이드뎌 먹었다,https://blog.naver.com/luxygirl77?Redirect=Log&logNo=222216606074,궁금하고 미치겠드라구요 새로 만들고 계신거예요 대구맛집 #대구떡볶이맛집 대구 중앙떡볶이전 몰랐네요 삼대천왕 맛집인지ㅋ 백종원이 인정한곳이니 얼마나 맛있을까?? #대구명물떡볶이 기다리다 들어가서... ,시스터후드 = NuSister :),https://blog.naver.com/luxygirl77,2021-01-22
[대구동성로맛집] ::중앙떡볶이재방문했어요,https://blog.naver.com/dnwjddk34?Redirect=Log&logNo=222518453586," 중앙떡볶이 에서는 떡볶이 떡으로 큰 가래떡이 나오는데요. 1인분에 가래떡 4개, 어묵 4개 정도 있습니다. 살짝 매콤하기도 한데, 맛있더라고요! 물론 예전에 먹었던 그 맛은 아닌거 같기는 하지만요ㅠㅡㅠ",천고마비의계절,https://blog.naver.com/dnwjddk34,2021-09-27
대구맛집 평양냉면 안면옥 + 땡스 베이글 +중앙떡볶이납작만두,https://blog.naver.com/jea3420?Redirect=Log&logNo=222432195135,"^ 늘 대구 가면 사오는중앙떡볶이 의 납작만두~! 맛이 어떻게 맛있다기보다..대구 가면 그냥 추억에 꼭 사오는 집^^ 24,500원치^^ 물가가...물가가... 평양냉면 먹고, 떡볶이 사니까,,, 엊그제 파크하얏트가서 양식... ","감성블로그, made in eeeena",https://blog.naver.com/jea3420,2021-07-15
[대구 동성로 맛집] 대구 대표 분식점중앙떡볶이 ,https://blog.naver.com/dkssud4878?Redirect=Log&logNo=222531380593," 중앙떡볶이대구 중구 동성로2길 81 매일 11:30-19:30 휴무날: 첫째주 일요일, 셋째주 목요일 대구 1호선 중앙로 2번출구 도보 5분 출처: 네이버 여긴 떡볶이도 유명하지만 대구분들 아니시면 만두 꼭 드셨으면... ",온정이의 일상&취미,https://blog.naver.com/dkssud4878,2021-10-08
대구 맛집중앙떡볶이+ 서문야시장 후기,https://blog.naver.com/rockethead?Redirect=Log&logNo=222539485599,"근데 이곳은 굵은 떡이 떡볶이 떡이래서... 가래떡에 양념 묻은 맛이 날 것 같아 안 먹겠다고 했지만, 맛있다는 말에 또 어느새중앙떡볶이앞으로.. 가게에 바로 들어가서 앉았다. 사람이 몇 없어서 소문과 좀... ",가열 중,https://blog.naver.com/rockethead,2021-10-17
[대구] 중구 너무 유명한 대구명물중앙떡볶이 ,https://blog.naver.com/daechuy?Redirect=Log&logNo=222529764768,- 인스타그램 https://www.instagram.com/psk1670 #내돈내산 # 중앙떡볶이#대구 중앙떡볶이#동성로 중앙떡볶이#대구떡볶이맛집 #대구맛집 #대구떡볶이추천 #대구여행 #덕복희 #대구삼대천왕 #대구납작만두... ,대프리카 청춘이다,https://blog.naver.com/daechuy,2021-10-07
 중앙떡볶이대구 쌀떡볶이납작만두 맛집 [전참시... ,https://blog.naver.com/clairlee77?Redirect=Log&logNo=222367887873,"부산으로 내려갈 때, 대구에 잠시 들러서 떡볶이를 먹었는데요 방송에서 여러번 소개되었던 가래떡 떡볶이와 납작만두로 유명한 곳~ 박석규중앙떡볶이위치는 2.28기념 중앙공원 맞은편에 있어요 메뉴판... ",A Bite of Happiness,https://blog.naver.com/clairlee77,2021-05-26
"떡볶이 맛집] 백종원의 3대천왕, 30년 전통 동성로중앙떡볶이 ",https://blog.naver.com/szvszv00?Redirect=Log&logNo=222538066458,대구 중앙로 228 공원 앞을 지나가다 예전부터 떡볶이 맛집으로 유명한중앙떡볶이 에 갔어요. 아주 큰 철판에 가래떡을 뭉텅 잘라 넣은 쌀떡볶이 오른쪽엔 양배추를 썰어 넣고 쒜킷쒜킷중앙떡볶이가격... ,Seize the Day! 행복한 일은 매일 있어,https://blog.naver.com/szvszv00,2021-10-15
1박 2일 대구여행 (1)중앙떡볶이/ 랜디스도넛 / 팔공산 곳... ,https://blog.naver.com/pds6527?Redirect=Log&logNo=222360178056,"있는중앙떡볶이 에 갔다 3대천왕 외에도 TV에 여러번 소개된 곳 인듯 하다 대구 현지 사람들이 꽤 많았다 10분 정도 기다리고 안으로 들어갔다 메뉴는 간단하다 떡볶이 2개, 만두 2개, 김밥 1개, 쿨피스 주문! 지금... ",쏘미 취향,https://blog.naver.com/pds6527,2021-05-22
친구따라 대구간다 대구맛집 탐방:중앙떡볶이성서국수,https://blog.naver.com/thldiddl?Redirect=Log&logNo=222411713253,대구 로컬인 친구가 서울서 살다가 엄마네 가야해서 대구에서 겸사 겸사 놀았는데 이 친구도 서울 있으면서도중앙떡볶이젤 그리웠대서 함께 떡볶이 먹으러 간 썰 ㅋㅋㅋㅋㅋㅋ #대구맛집 #수성구맛집 #중앙로... ,다짜고짜 베를린,https://blog.naver.com/thldiddl,2021-06-27
[대구맛집] 대구 떡볶이 맛집중앙떡볶이납작만두 강추... ,https://blog.naver.com/joeybang?Redirect=Log&logNo=222112994131,2월에 다녀온 #대구여행 에서 돌아올 때 #대구맛집 중에서 #대구떡볶이맛집 으로 유명한 곳 # 중앙떡볶이와 #윤옥연할매떡볶이 에서 포장을 해왔다. 동성로 사람 많은 곳에서 기다리면서 내가 분명히... ,★ 쪼이쪼이의 맛있는 수다방 ★,https://blog.naver.com/joeybang,2020-10-12
대구 원조 맛집중앙떡볶이 ,https://blog.naver.com/gingakei?Redirect=Log&logNo=222504206409,위치 #백종원의3대천왕 에 나온 #명물떡볶이 집으로 유명해요. 대구의 중심인 중앙로 역에서 도보로 10분 내외로 갈 수 있어요. 그래서 이름도 # 중앙떡볶이인가 봅니다. 대구 2.28공원 바로 옆에 위치해 있어요.... ,생활여행,https://blog.naver.com/gingakei,2021-09-13
대구 공평동 맛집 동아식당 | 그리고 바로 근처에중앙 떡볶이 ,https://blog.naver.com/joyunhee9144?Redirect=Log&logNo=222204658054,"동아식단에서 나와 아주 조금만 걸으면 바로중앙떡볶이 가 있음 떡볶이+만두 주문 이게 4,000원 이던가 암튼 가격도 훌륭 맛도 훌륭 ㅠㅠㅠ 두꺼운 떡이라 좋았고, 납작만두랑 같이 먹는게 진짜 맛있었다. 대구는... ",onii,https://blog.naver.com/joyunhee9144,2021-01-12
"[대구 주전부리 냠냠후기] 대구 동성로중앙떡볶이 , 대구... ",https://blog.naver.com/skycheerup?Redirect=Log&logNo=222494507631,아점을 먹으려고 했지만 어쩌다보니 점저로 먹게된 대구 주전부리 일단 먼저 중떡 방문 가래떡 떡볶이를 좋아하는 사람이라중앙떡볶이 의 가장 큰 메리트는 가래떡이라고 생각합니다. 가게 앞에 서자마자 확... ,하짱살이,https://blog.naver.com/skycheerup,2021-09-04
[대구/중구]중앙떡볶이 ,https://blog.naver.com/jiayouyum?Redirect=Log&logNo=222523072766, 중앙떡볶이 추천 #대구맛집 #대구떡볶이 #대구떡볶이맛집 #시내맛집 #대구맛집추천 #떡볶이맛집 #대구시내맛집추천 #중앙떡복이포장 #떡볶이 #납작만두 # 중앙떡볶이 납작만두 #중떡 #중떡납작만두 #순대 #내돈내먹,소소한 하루,https://blog.naver.com/jiayouyum,2021-10-01
대구중앙떡볶이백종원 삼대천왕 맛집,https://blog.naver.com/top_ki?Redirect=Log&logNo=222199546259,대구중앙떡볶이#대구맛집 #백종원삼대천왕 #대구 중앙떡볶이#납작만두 대구 중앙떡볶이백종원 삼대천왕 맛집으로 소개된 대구 맛집중앙떡볶이 . 떡볶이로 백종원 삼대 천왕이라 크게 기대는 안 했는데... ,NANA'S PLAY LIST,https://blog.naver.com/top_ki,2021-01-07
동성로중앙 떡볶이 ,https://blog.naver.com/ithwlsi55?Redirect=Log&logNo=222398800768,재래시장 떡볶이 이제 진짜 마지막!!!!!!ㅎ 동성로중앙 떡볶이 다!! 요건 정확히는 시장이라기보다 떡볶이집 자체의 이름. 꽤 유명한 대구의 떡볶이 맛집이라는거 같다..!!! 아.... 떡볶이 먹고 싶어서 일단 끓이긴... ,♥사과나무♥,https://blog.naver.com/ithwlsi55,2021-06-15
"대구 동성로 줄서서 먹는 분식 맛집, 중앙떡볶이 와 미진분식",https://blog.naver.com/koni8997?Redirect=Log&logNo=222031102639,드디어 먹어보는 동성로중앙떡볶이 !! 몇년전에 티몬인가에서 중떡이라는 이름으로 판매를 했었는데 먹어본 떡볶이 중에 손가락에 꼽힐 정도로 맛있었다ㅠㅠ 하지만 그 이후로 판매를 안 해서 언제 다시... ,몹시 즐겁구나,https://blog.naver.com/koni8997,2020-07-14
대구 떡볶이 맛집 # 중앙떡볶이 ,https://blog.naver.com/juheeya0518?Redirect=Log&logNo=221985609597,오랜만에시내나가서 딱 오픈시간맞춰서 먹게되었다 #대구 떡볶이 맛집 대구 떡볶이 맛집중앙떡볶이2.28공원 화장실건너편쯤 위치해있다 11시20분이되어야 문을열어준다 11시15분쯤도착해서 기다렸다가... ,바나나우유,https://blog.naver.com/juheeya0518,2020-05-31
대구 동성로_떡볶이 맛집중앙떡볶이 ,https://blog.naver.com/gayoung4441?Redirect=Log&logNo=222501284201,"쌀떡볶이 \4,000 두꺼운 가래떡의 쌀떡볶이와 두툼한 어묵이 들어간 심플한중앙떡볶이 의 쌀떡볶이!... 완벽하게 즐긴 동성로중앙떡볶이대구는 사랑입니당 ♡ 동성로에 위치한중앙떡볶이228기념중앙공원... ",가영&율의 블로그,https://blog.naver.com/gayoung4441,2021-09-10
대구동성로명물중앙떡볶이 집! 옛날생각납니다,https://blog.naver.com/injong25?Redirect=Log&logNo=221753005335,왜냐하면 지금 2.28기념공원자리에 중앙초등학교가 있었다. 초등학교앞 떡볶이집이었던 거다. 그래서중앙떡볶이 ! 중떡!이다 스토리텔링 좋아라하는 고딩님한테 알려 줬더니 아~~~~~~ 하면서 잼있어 한다 밖에는... ,세남자랑 오늘 행복하기,https://blog.naver.com/injong25,2019-12-29
"대구여행) 맛집과 놀만한곳 추천 (회오리식당, 중앙떡볶이 ... ",https://blog.naver.com/yoo6284?Redirect=Log&logNo=222242842686,맛집발견 - 중앙떡볶이 - 이번엔 대구에서 그렇게 유명하다고하는 중앙로역 떡볶이집을 가봤다 웨이팅이 있었는데 그래도 금방 쑥쑥빠짐 대구와서 뭔떡볶이냐 할수있어도 웨이팅이 이렇게 있으면 궁금하다.... ,RLOG,https://blog.naver.com/yoo6284,2021-02-14
 중앙떡볶이 는 대구 동성로 맛집이다.,https://blog.naver.com/bonnari?Redirect=Log&logNo=222360094420,두둥~넘나 존거 ^++++++++++++++^ 나옴나옴 대구 동성로 맛집중앙떡볶이 표 김밥떡볶이. 머든지 찍먹은 진리임. 사실중앙떡볶이김밥은 오이들어가서 좀 싫음. 그래도 찍어 먹으니 맛남 좋아 죽겠음. 깨끗히... ,만촌동지킴이,https://blog.naver.com/bonnari,2021-05-21
동성로 맛집! 대구 동성로중앙떡볶이대구 미진분식 리뷰 : ),https://blog.naver.com/inthemoodforlove__?Redirect=Log&logNo=222532588032,: ) 대구중앙떡볶이드디어 만나게 되었습니다 대구중앙떡볶이쌀떡볶이에요!!!!!!!!!!!! 이웃님들 밀떡파이신가요 쌀떡파이신가요? 저는 밀떡파이지만 요기 쌀떡도 맛있더라구요 ㅋ.ㅋ 두툼한 가래떡 스타일... ,좋아하는게 많아요-,https://blog.naver.com/inthemoodforlove__,2021-10-14
상주식당 추어탕 그리고중앙떡볶이즐기기,https://blog.naver.com/speedjj12?Redirect=Log&logNo=221941131164,너무 많이 먹어서 아기가 엄청 크게 나올까 약간 걱정이 되긴 하지만... 임신 후 식탐은 멈출 수가 없네요~ #출산3일전먹방 #동성로 중앙떡볶이#대구떡볶이맛집 #상주식당추어탕 #대구추어탕맛집,평범한 삶 그속에 행복,https://blog.naver.com/speedjj12,2020-05-02
 중앙떡볶이 ,https://blog.naver.com/yunji0203?Redirect=Log&logNo=222029870967,간만에중앙떡볶이진짜 얼마나 먹고싶었는지 너무 기대하고 찾아갔는데 뒤에 다른 먹방이 예약이 되어있어 맛만 보려고 했는데 정말 떡볶이 1인분만 주문해서 다행이라 생각했다 1인분 4000원이면 가성비도... ,당신이 왜 날 사랑하지 않겠어,https://blog.naver.com/yunji0203,2020-07-13
#동성로맛집 #동성로투어 # 중앙떡볶이#미란다키친,https://blog.naver.com/bbcakehong?Redirect=Log&logNo=222408085132,한일극장 #동성로맛집 #동성로투어 # 중앙떡볶이#미란다키친 떡볶이에 진심인 사람들이라서 2.28공원 한바퀴 산책 후중앙떡볶이 에서 납작만두랑 떡볶이로 시작. 다른 가게들보다 피가 얇아서 더 맛있는... ,블링블링,https://blog.naver.com/bbcakehong,2021-06-24
[동성로 맛집] 힝.. 추억돋는중앙떡볶이 ,https://blog.naver.com/gyqls0530?Redirect=Log&logNo=222514594868,포장하신다면 500원 포장비 있어용 다들 중떡먹으러 가세요~~ #동성로떡볶이 #중앙로떡볶이 # 중앙떡볶이#대구떡볶이맛집 #대구떡볶이 #대구대표떡볶이 # 중앙떡볶이 가격 # 중앙떡볶이#중앙떡볶기 #대구데이트... ,28살 내삶의 묘미 시리즈,https://blog.naver.com/gyqls0530,2021-09-23
[대구맛집]중앙떡볶이 ,https://blog.naver.com/lovelykem?Redirect=Log&logNo=222515648677,만두 해서 8500원 나왔어요 입구에 보면 체인점이나 분점 내준적 없다고 크게 적혀있어요네네 그렇다네요ㅎㅎ 여튼 저의 떡볶이리스트 안에 들어가는 대구중앙떡볶이소개해드렸습니다아아~~ 그럼 안녕!:),Jazz Flute _,https://blog.naver.com/lovelykem,2021-09-24
201205 내인생 대구맛집=중앙떡볶이 ,https://blog.naver.com/mits37?Redirect=Log&logNo=222167372612,그러타면 저번에 한번 왔다 실패했던 중앙 떡뽁이에 도전했습니다.! 제가 이 떡뽁이를 먹었떤게- 진짜... ㅠㅠ 넘나 좋은 것.. 하- #대구맛집 #동성로맛집 #대구떡볶이 # 중앙떡볶이#대구 중앙떡볶이 ,꾸준히 그리고 기다림.,https://blog.naver.com/mits37,2020-12-08
대구 동성로맛집중앙떡볶이 ,https://blog.naver.com/kimyr8569?Redirect=Log&logNo=222314345526,대구 떡볶이맛집동성로맛집중앙떡볶이옛날그집 매일 11:20 - 20:00/일요일단축영업 TEL: ***-***-**** 대구 동성로에있는중앙떡볶이일요일 3시쯤 방문했는데 손님들로 가득한거보고 깜짝 놀랬어요. 일요일은... ,푸드러버의 식도락라이프 :),https://blog.naver.com/kimyr8569,2021-05-01
