title,link,description,bloggername,bloggerlink,postdate
[대구맛집]중앙떡볶이 ,https://blog.naver.com/zzz81?Redirect=Log&logNo=80110251370,"먹은건중앙떡볶이뿐이다.ㅎㅎㅎㅎㅎㅎㅎㅎㅎㅎㅎ 대구역에서 지하철타고 중앙로역?에 내려서 2.... 물은 셀프입니다.ㅎㅎ 이게 그 유명한중앙떡볶이 ... 쌀떡볶이+납짝만두 =1인분에 \2,500 큼지막한 쌀떡볶이... ",마늘...양파 갖은양념,https://blog.naver.com/zzz81,2010-06-28
[대구맛집]떡볶이-동성로 2.28공원 옆 :: 중앙떡볶이 (원조)::,https://blog.naver.com/cyberokuk?Redirect=Log&logNo=50080536040,"-별점 : ※ 위치 : 동성로 2.28 기념공원 앞(동성로2가 70) ::세상일보::-영원불멸의 블로그 -대구,동성로,맛집, 중앙떡볶이 ,재오픈,영업시작,2.28공원,중앙초등학교,떡볶이,동성로 떡볶이,공주떡볶이,두남자떡볶이-",세상일보ㅣ영원불멸 맛집,https://blog.naver.com/cyberokuk,2010-01-16
대구 동성로 떡볶이 맛집중앙떡볶이 ,https://blog.naver.com/sisblog?Redirect=Log&logNo=222503769997,대구 동성로 구경하고 있는데 어디서 봤던 비주얼의 떡볶이집.....ㅋㅋ 대구 맛집 검색하다가 몇번 봤었던 대구 동성로 떡볶이 맛집중앙떡볶이!! 밥을 먹은 상태였지만 맛집을 그냥 지나칠 수 없어서... ,배 부 른 삶 ♥,https://blog.naver.com/sisblog,2021-09-13
맛집] 중앙떡볶이: 백종원의 3대천왕 나온 대구 떡볶이 맛집,https://blog.naver.com/kizaki56?Redirect=Log&logNo=220951333373,[대구 동성로 맛집] 중앙떡볶이: 백종원의 3대천왕 나온 대구 떡볶이 맛집 안녕하세요 몽몽이에요 대구에서 제일로 유명한 떡볶이집!! 백종원의 3대천왕에 나와서 이렇게 유명해진거 같은데 물론 전에도... ,몽몽의 먹어야 사는 블로그,https://blog.naver.com/kizaki56,2017-07-24
오랜된 동성로 맛집중앙떡볶이떡볶이+납작만두 세트 4천원,https://blog.naver.com/cthmimi?Redirect=Log&logNo=221593628980,오랜된 동성로 맛집 대구 명물떡볶이집 # 중앙떡볶이안녕하세용 밈언냐에요^^ 이번 여름휴가는 발리로 계획중이라 동성로 시내에 있는 피씨방 갔다 집으로 가기 전 간단하게 저녁 먹고가자고 해서 들린... ,미미플의 웨딩포인트 ♥,https://blog.naver.com/cthmimi,2019-07-23
"대구 동성로 맛집중앙떡볶이 , 납작만두 포장 솔직후기",https://blog.naver.com/greenbluepurple?Redirect=Log&logNo=222507947279,저한테는 떡볶이는 식사가 아닌 간식(?)이어서 간식으로 먹으려고 딱 1인분만 포장했습니다중앙떡볶이문에 붙어있는 맛집으로서의 엄청난 스펙들입니다 떡볶이와 만두를 주문했습니다 이때 만두는... ,맛집을 위한 여행,https://blog.naver.com/greenbluepurple,2021-09-16
"대구 맛집)중앙떡볶이납작만두가래떡 떡볶이, 동성로 인근... ",https://blog.naver.com/bbangah?Redirect=Log&logNo=130169423915,"대구 맛집)중앙떡볶이납작만두가래떡 떡볶이, 동성로 인근 공영주차장 공감버튼 눌러주세요^^ 대구 갈 때마다중앙떡볶이중앙떡볶이노래를 부르는 그냥이지만요 대구갈 때는 명절이거나, 제사이거나, 아님... ",그냥 끌리는대로,https://blog.naver.com/bbangah,2013-06-03
[대구]중앙로중앙떡볶이 ,https://blog.naver.com/kyujin0930?Redirect=Log&logNo=221467922559,"대구명물떡볶이집중앙떡볶이 , 대구 떢볶이 중 가장 유명하다고 해서 찾아가는데 멀리서도 분식집 앞 줄을 선 것을 보고 이 곳이구나 할수 있었다. 메뉴는 떡볶이, 만두, 순대, 김밥 간단하다. 백종원의 3대천왕... ",깡유로그,https://blog.naver.com/kyujin0930,2019-02-17
동성로중앙떡볶이 ,https://blog.naver.com/5000skincare?Redirect=Log&logNo=221379059822,그래 맞다 떡볶이 매콤 신참인가 달콤 국민학교떡볶이인가~ 그 중간 맛~~ 쌀떡이라 쫄깃하고 매콤 달다리~ 동성로중앙떡볶이지금은 요것을 딱~~ 먹어야한다 그래서 홀로 쬐끔 무안함을 무릎쓰고 홀로... ,더블유엠 에스테틱 두피센터 동성로점,https://blog.naver.com/5000skincare,2018-10-17
[대구]중앙떡볶이 ,https://blog.naver.com/eomjigongju?Redirect=Log&logNo=222225060323,"대구의 유명한중앙떡볶이이번에 기회가 되어가 가보게 될었다. 저렇게 크게 직영점, 분점, 체인점이... 지역의 명물 떡볶이였다. #동성로떡볶이 #대구떡볶이 #중앙로떡볶이 #대구맛집 #떡볶이맛집 #떡볶이투어",노는 것이 좋다,https://blog.naver.com/eomjigongju,2021-01-30
대구 명물이라는중앙떡볶이오랜간만에 ...,https://blog.naver.com/sea2705?Redirect=Log&logNo=221360031069,ㅎㅎ 대구 중앙떡볶이대구 중구 동성로2길 81 (대구 중앙공원 맞은편에 있습니당) 포장가능하구요 저녁 8시까지는 정도 하는것 같아요 ㅎ 떡볶이 매니아라면 한번쯤 드셔보면 좋을듯요 !!!!,고운 마음,https://blog.naver.com/sea2705,2018-09-16
"부산 셋째 날! (feat. 자갈치시작 회정식,대구중앙떡볶이 )",https://blog.naver.com/frinh?Redirect=Log&logNo=221530855807,갑자기 예전에 또 실패했었던 대구 떡볶이집이 생각나서 서울 사는 길에 대구로~!중앙떡볶이대구 대구에서 가장 유명한중앙떡볶이입니다. 몇 년 전에 친구랑 대구에 놀러 왔다가 한번 먹고 반해서 다음 해에... ,제로매직 (ZeroMagic),https://blog.naver.com/frinh,2019-05-08
백종원 3대천왕 대구 중앙떡볶이번호표뽑고 기다린... ,https://blog.naver.com/daehong73?Redirect=Log&logNo=220484132379,오늘은 점심으로 잘먹지않는 떡볶이를 먹으러 갔네요. 어디?중앙떡볶이입니다. 저기 기다리는 줄... 백종원 3대천왕에 소개된 중앙떡볶기 집이라고 현수막까지 붙어있고 그외에도 여러 방송에 출연하셨네요.... ,언어의 정원,https://blog.naver.com/daehong73,2015-09-17
"대구여행 3탄 |중앙떡볶이 , 랜디스도넛, 목련양과",https://blog.naver.com/j214001?Redirect=Log&logNo=222499366719,9/3 대구3탄 드디어 밥을 먹게된 우리중앙떡볶이# 중앙떡볶이그렇게 유명한 대구중앙떡볶이먹어봄 요긴 납작만두가 생명이다. 진짜 만두가 납작해서 놀랐다. 양배추도 맛있다. 대신 떡은 그저그런.... ,뇸뇸펀치,https://blog.naver.com/j214001,2021-09-08
만들기/떡볶이 만드는 법] 대구 동성로중앙떡볶이따라하기 ~♬,https://blog.naver.com/skgus1231?Redirect=Log&logNo=110190604407,동성로 중앙 라(?)볶이 완성!!!!! 색깔은 다르지만 맛은 짱맛!꿀맛!허니맛! 자작~~~한 국물에 군만두 넣어 버무리로 먹었당!!ㅋㅋㅋㅋ 대구중앙떡볶이따라하겠다고 가래떡도 긴 상태로 냅둠ㅋㅋㅋㅋ... ,잉여로운 효니네 ~♬,https://blog.naver.com/skgus1231,2014-05-11
대구중앙떡볶이오랜만에 먹었어요,https://blog.naver.com/hamebio?Redirect=Log&logNo=221119713299,# 대구 맛있는 떡볶이집중앙떡볶이주말에는 줄이 어마하게 길어서 잘 못가는 대구 중앙로에 위치한중앙떡볶이 집 최근에 백종원의 3대천왕에 출연하기도 해서 ~ 더 유명해졌답니다. 광고로 3대 천왕에 나왔다... ,☞'담그네'의 발효 이야기,https://blog.naver.com/hamebio,2017-10-18
[대구 동성로 맛집]백종원도 다녀간중앙 떡볶이 ,https://blog.naver.com/tpbh1004?Redirect=Log&logNo=221342576884,"오직 이곳에만 위치하는중앙 떡볶이 . 백종원의 3대 천왕에서도 소개 된 곳이다. 두 분은 떡볶이 포장과 조리를, 한 분은 만두를 구워내고 계시고 홀에는 남자 사장님이 청소와 음료 제공을 담당하신다. 이... ",헤짱의 빅데이터(ღ),https://blog.naver.com/tpbh1004,2018-08-20
대구 동성로 맛집 떡볶이맛집중앙떡볶이 ,https://blog.naver.com/qorkdgh8?Redirect=Log&logNo=221123257632,대구 동성로 맛집 떡볶이맛집중앙떡볶이떡볶이를 좋아하는 우리 지원이ㅎㅎ 떡볶이가 먹고싶다는 말에 저희 세가족 간만에 동성로 먹방투어 하고 왔어요^^ 이곳은 언제가도 늘 저렇게 줄이 깁니다.. 좌측은... ,지원파파의 일상스토리,https://blog.naver.com/qorkdgh8,2017-10-23
"대구 동성로 나들이:) 2,28공원중앙떡볶이 !",https://blog.naver.com/free8617?Redirect=Log&logNo=222503315310,있는 떡볶이집중앙떡볶이 죠! 떡볶이를 만들고 있어서 줄 섰네요 매장에서 드실 분들은 들어와서 번호표 뽑고 대기하시면 되요 백종원의 3대천왕에도 나와서 더 유명해졌죠! 메뉴는 심플해요! 떡볶이 1인분 4000... ,Yun bros와 함께하는 일상❣️,https://blog.naver.com/free8617,2021-09-12
 중앙떡볶이미진분식,https://blog.naver.com/yeon0212?Redirect=Log&logNo=222198343295,미진분식이랑중앙떡볶이 ㅋㅋ 저도 백년만에 먹어봤는데요ㅋㅋ 올간만에 먹어도 맛있다이ㅋㅋㅋ 떡볶이 1인분 4천원 납작만두 4천원ㅋㅋ 아이가 먹긴 살짝 매웠지만 이런 두툼한 떡을 좋아해서 한 입 먹고 물... ,만들기취미/육아일기_♡,https://blog.naver.com/yeon0212,2021-01-06
"[대구맛집] 대구 떡볶이맛집,대구 동성로맛집, 대구 중앙떡볶이 !",https://blog.naver.com/zaqwee?Redirect=Log&logNo=220575053945,대구 떡볶이맛집중앙떡볶이 ! 백종원의 3대천왕에 소개된 대구 떡볶이 맛집 중앙떡볶이 ! 대구 사람이면 웬만하면 다 알고 있는중앙떡볶이 ! 얼마전 백종원씨가 왓다가고 더 유명해짐 ㅋㅋ 영화시간까지 한시간... ,DD's diary,https://blog.naver.com/zaqwee,2015-12-22
대구에 떡볶이 먹으러 왔습니다!중앙떡볶이(허언임 ㅈㅅ),https://blog.naver.com/engh_11?Redirect=Log&logNo=221639819559,그중에 한집중앙떡볶이 ! 아주 간판부터 간지나쥬? 백종원 왔다갔쥬? 줄이 2개가 있습니다. 저기 앞에... 저희는 3명이라서 떡볶이 만두 순대 김밥을 다시켰습니다. 쿨피스까지 자잔 4개 김밥은 이미 싸놓은것을... ,나의 살길,https://blog.naver.com/engh_11,2019-09-05
"맛집중앙떡볶이 , 슬로우터틀, 뉴욕통닭, 유창반점, 롤러커피... ",https://blog.naver.com/webrud1599?Redirect=Log&logNo=222161943406,"간중앙떡볶이 ! 예전에 중떡/달떡/신떡(신천할매) 이렇게 대구 3대 떡볶이였는데 요즘은 어떤가... 싶었는데, 중앙로 역 근처에 있더라구요!!! 7시 정도에 도착했는데 딱 저희가 앉을 한자리만 남아있었어요... ",Dress code :: 청춘,https://blog.naver.com/webrud1599,2020-12-03
대구 동성로 떡볶이 / 3대천왕에 나온중앙떡볶이( 웨이팅TIP ),https://blog.naver.com/32dnjswn?Redirect=Log&logNo=222505003210,간단했어요 이모님이 20분정도 기다리면 된다고 말씀해주셔서 기다리면서 떡볶이를 만드시는 모습까지 구경하고 있었어요 ㅎㅎ중앙떡볶이 는 큰 가래떡이 떡볶이떡으로 들어가는데 보기만해도 엄청... ,원주콩 라이프 ✨,https://blog.naver.com/32dnjswn,2021-09-14
 중앙떡볶이태능집부터 진미찌짐까지♬ 꿀가성비 대구 맛집 투어,https://blog.naver.com/slowerbutfarther?Redirect=Log&logNo=222517800718,명물 떡볶이집 대구중앙떡볶이 . 대구중앙떡볶이 의 대표 메뉴는 가래떡과 어묵 각 두 개씩에 대구 명물 납작만두 다섯 개가 보태진 쌀떡볶이로 단돈 4천냥이지만 혼자 먹기엔 푸짐한 양을 자랑한다.... ,'부지런한 한량'의 푸드에세이,https://blog.naver.com/slowerbutfarther,2021-09-27
[대구] 박석규중앙떡볶이내생에 제일맛있는 떡볶이 (줄서는... ,https://blog.naver.com/vkdvkd56_?Redirect=Log&logNo=222532940387,# 중앙떡볶이#박석규 중앙떡볶이#대구여행 #대구전통맛집 #대구떡볶이 #대구유명떡볶이 이거 먹으려고 고등학생때 야자 빼고 나와서 줄서서 먹었는데 지금도 똑같이 맛있음. 대구 사람이면 다 아는중앙떡볶이 ... ,팡팡 다이어리,https://blog.naver.com/vkdvkd56_,2021-10-10
"달고떡볶이, 유명한떡볶이, 신천황제떡볶이,중앙떡볶이 ",https://blog.naver.com/lyceenne?Redirect=Log&logNo=221229247810,유명한중앙떡볶이수도권과 인터넷에선 대구 떡볶이집 중 여기가 가장 유명하댔더니 대구친구들이 아구랭? 하고 반응해서ㅋㅋㅋㅋ대구 떡볶이 패왕 결정전은 결론이 나지 않은 상태인가요 줄도 좀 섰다 선... ,Deep River,https://blog.naver.com/lyceenne,2018-03-15
대구중앙떡볶이납작만두 옛날그집,https://blog.naver.com/pih1461?Redirect=Log&logNo=221037598855,"차칸,국떡,중떡,석관,쿤마,무꼬,덕복희 등등 소셜서 사다 먹고 마트에서 사다먹고 시켜먹고 만들어먹고 전 주 5회 떡식도 거뜬한 떡볶이덕후인데요 ㅋ 동성로 나갔다 옛날 그 떡볶이가 생각나중앙떡볶이 에... ",민트포유,https://blog.naver.com/pih1461,2017-06-26
보은중앙 떡볶이: 보은 전통시장 가성비 맛집,https://blog.naver.com/lillie91?Redirect=Log&logNo=222475035763,위생 상태 별로였던 튀김은 튀김옷 벗겨내고 먹으려고 했다가 안 먹었어요 그냥 ㅋㅋㅋ 떡볶이만 드세요 ㅠㅠㅠㅠ ( 내돈내산 ) #보은떡볶이 #보은 중앙떡볶이#보은전통시장맛집 #보은맛집 #보은가성비맛집... ,볼수록 매력있는 블로그,https://blog.naver.com/lillie91,2021-08-18
"in 이월드 인생꽃사진관 : 대구여행( 중앙떡볶이 , 우야지막창)",https://blog.naver.com/srtraveler?Redirect=Log&logNo=221711593786,4조의 점심 pick은 바로중앙떡볶이 ! 대구 중앙로맛집으로 손꼽히고 있는 집입니다. 방송출연도 다수 경험! 사람들이 엄청 많더라구요 대구의 명물인 납작만두와 두툼하고 쫀득한 쌀떡볶이의 만남! 정말 너무... ,고속철도 SRT,https://blog.naver.com/srtraveler,2019-11-18
대구 동성로중앙떡볶이/ 가래떡,https://blog.naver.com/phjsunflower?Redirect=Log&logNo=221731976801,"대구에 유명한 떡볶이집중앙떡볶이 . 이곳은 대구스타일의 떡볶이가 아니라 약간의 부산스타일의 떡볶이를 추구하는 곳인데, 대구지역에서 인기가 많은 곳으로 알려져 있다. 방송에서도 여러번 출연을 했었고... ",꽃씨의 맛집 이야기♬,https://blog.naver.com/phjsunflower,2020-01-03
"대구맛집투어 구공탄막창, 중앙떡볶이 ",https://blog.naver.com/pinkmint86?Redirect=Log&logNo=221396428763, 중앙떡볶이방문 특이한게 번호표를 먼저 뽑고 앉아 있으면 번호를 부르시고 내차례면 주문 계산은 후불임 둘이서 떡볶이랑 만두 1인분씩 학교앞 분식집 같은 정겨움 ㅎㅎ 주문하면 거의 바로 나오고요... ,Ｌｏｖｅ & Ｐｅａｃｅ,https://blog.naver.com/pinkmint86,2018-11-11
맛집 3대 천왕에 소개된 대구 명물 떡볶이중앙떡볶이(중떡),https://blog.naver.com/koodori1985?Redirect=Log&logNo=221496108902,"대구에서는중앙떡볶이 를 줄여 '중떡'이라고 많이들 부릅니다. 중떡은 대구 시민들에게 사랑 받는 떡볶이 집으로, 2.28기념 중앙공원 옆 쪽에 위치하고 있습니다. 대구에는 윤옥연 할매떡볶이, 신천떡볶이, 달떡... ",다다농장 & 다다웰빙식품 공식블로그,https://blog.naver.com/koodori1985,2019-03-24
"대구동성로맛집,중앙떡볶이 (쌀떡볶이) 또 다녀왔어요!",https://blog.naver.com/dbwjd410?Redirect=Log&logNo=221185959858,"쌀떡볶이는 대구 중앙떡볶이 가 최고인 것 같아요! 떡볶이와 만두의 조합 ㅠㅠ 김밥에서 살-짝 당황했지만, 떡볶이에 찍어먹으면 굳굳 양념부터 맛있거든용! 저의 젓가락신공으로 ㅋㅋㅋㅋㅋㅋㅋㅋㅋㅋㅋ 저... ",쩡이의 하루,https://blog.naver.com/dbwjd410,2018-01-16
[강남역] 대구의 그중앙떡볶이중떡 납작만두,https://blog.naver.com/mignyonne?Redirect=Log&logNo=220498745646,그리고 또 신난 이유는 바로 바로 대구중앙떡볶이 를 강남역에서 만날 수 있기 때문 !!!!!!!!!!!!!! 블로그에 포스팅해 놓은 대구여행 with 떡볶이만 두 번 그 전에 대구에 갔을 때도 떡볶이를 먹었었지 매일 떡볶이만... ,a whimsical story,https://blog.naver.com/mignyonne,2015-10-04
대구 동성로중앙떡볶이왕가래떡 카레소스,https://blog.naver.com/baroseog?Redirect=Log&logNo=221172194491,그 큰 떡볶이 판이 비워진 후 다시 떡볶이를 만들 동안 줄 서서 기다리던 사람들이 싹~ 사라졌네요. 대구 명물 동성로중앙떡볶이대구여행 가면 먹어볼 만합니다.,마미새 ⓔ야기,https://blog.naver.com/baroseog,2017-12-27
"[대구동성로맛집]중앙떡볶이 , 줄서서 먹기 잘했어!",https://blog.naver.com/aldus5063?Redirect=Log&logNo=221440646892,"-동생 찬스로 먹은 솔직후기- 대구를 포함한 전국 어디에도 직영점, 분점, 체인점을 내어 준 적이 없는 곳 대구중앙떡볶이ㅡ 버스를 타고 대구로 오랜만에 동생을 만나러 가는 날, 동생이 이 집 떡볶이는 꼭... ",넌 내게 바나나,https://blog.naver.com/aldus5063,2019-01-13
"[대구]서문시장,2월호텔 황금점,동성로중앙떡볶이 ",https://blog.naver.com/arta99?Redirect=Log&logNo=221626434018,"올리 없는 대구여행이니만큼, 만족에, 만족해~ 그 다음날, 2.28기념중앙공원~ 맞은편의~중앙떡볶이 ~ 언제 오겠어~ 여길~ 먹어보자~ 납작만두 먹을만했어~ 동성로 스타벅스에서 대구여행 마무리^^ 대구여행, 땡큐~","One Love, One Life",https://blog.naver.com/arta99,2019-08-24
"대구 동성로 삼대천왕 맛집,중앙떡볶이 ",https://blog.naver.com/bryjia?Redirect=Log&logNo=221181241680,(배고파서 길게느낀건가) 기다리면 주문한 음식이 나온다 납작만두-떡볶이-납작만두 순서!중앙 떡볶이 는 커다란 쌀 가래떡을 사용하시는데 나는 쌀떡 밀떡 할거 없이 다 잘 먹어서 상관없었다 그런데 오빠는... ,감쟈고구마,https://blog.naver.com/bryjia,2018-01-09
대구 동성로)중앙 떡볶이 ,https://blog.naver.com/sohye0416?Redirect=Log&logNo=40053104818,대구에선 신천 떡볶이랑중앙 떡볶이 가 유명해요^ ^ 더운 날 땀 흘리면서 먹는 떡볶이도 꽤나 별미죠? 유명한 맛집들의 특징이 비교적 가게들이 작다는 거죠? 여기도 한 10명정도 앉을 수 있는 정도에요^ ^ 가게는... ,늘 ♬ ♪ ♩,https://blog.naver.com/sohye0416,2008-07-16
"대구동성로맛집 , 3대천왕중앙떡볶이 ",https://blog.naver.com/sarang612?Redirect=Log&logNo=220990675113,섞어(쌀떡볶이+만두) 2인분 카레맛이 확 나는 떡볶이맛이다 대구맛집중앙떡볶이 의 떡은 가래떡이 이렇게 통으로 들어간다 ㅋㅋㅋ 1인분에 가래떡 2개! 섞어에 들어있는 만두는 대구명물 납작만두다 거의 속에... ,H LOG,https://blog.naver.com/sarang612,2017-04-24
[대구/동성로]중앙떡볶이 ,https://blog.naver.com/es4715608?Redirect=Log&logNo=221316168125,"대구 시내 동성로에서 엄청 유명한중앙떡볶이 입니다~ 백년만의 방문인 것 같은데요 ^^ 가끔씩 생각나는... 바처럼 있어서 마주보고 앉기 힘든데,, 4인석에 딱 앉고 ㅋㅋ 조금후 떡볶이 매진되어, 새로... ",이수정비(구미),https://blog.naver.com/es4715608,2018-07-12
서울역에서 KTX타고 동대구역→ 대구 동성로맛집 @ 중앙떡볶이 ,https://blog.naver.com/kyumding?Redirect=Log&logNo=221504771417,"떨어진 중앙로역으로 갔어요. 그 곳에 간 이유는 바로,, 대구 떡볶이 맛집이라는중앙떡볶이 를 먹으러가기위해서! 왜 대구에 떡볶이 맛집이 많은지 모르겠으나 그 중에 정말 많은 사람들이 찾는다는... ",두수니의 블로그,https://blog.naver.com/kyumding,2019-04-03
대구에서중앙떡볶이모르는 사람없기,https://blog.naver.com/j_uni8051?Redirect=Log&logNo=222528437712,원래는 떡을 많이 주는데 이날은 마감이라 떡보다 오뎅이 많이 남아서 오뎅을 더 많이 담아주셨기 ㅋㅋㅋㅋ 더 좋았어요 떡보다 오뎅을 좋아하니까담에 대구오면 또 먹고싶은 대구중앙떡볶이중중떡볶이는... ,어제보다 나은 오늘의 기록,https://blog.naver.com/j_uni8051,2021-10-06
대구중앙떡볶이원주통닭 와이프랑 데이트,https://blog.naver.com/zakp?Redirect=Log&logNo=221067634096,동성로에 와이프 태우러 갔다가 와이프가 신천시장 궁전떡볶이 가자고 하길래 제가 이번엔중앙떡볶이도전해보자고 해서 시작된 둘만의 데이트 228주차장에 주차하고 제빨리 뛰어 올라간중앙떡볶이가계... ,날아라 슈퍼맨,https://blog.naver.com/zakp,2017-08-05
"대구 맛집,백종원의3대천왕 대구중앙떡볶이 ",https://blog.naver.com/solt0113?Redirect=Log&logNo=220965587421,"대구중앙떡볶이항상 대구여행을 하면,대구에 들르면 거쳐 가는 곳 동성로 중앙공원 옆에 위치 하고... 곧이어 나온중앙떡볶이 의 쌀떡볶이 1인분 카레향기가 솔솔 나고 떡볶이 자체가 그렇게 맵지는 않다... ",소비하는 삶,https://blog.naver.com/solt0113,2017-03-23
대구 백종원 삼대천왕 맛집중앙떡볶이 ,https://blog.naver.com/minheecool?Redirect=Log&logNo=220994810805,"특유의 대구 사투리를 쓰셔서 서울 사람들은 약간 어색할 수 있지만 불친절은 아니니 오해마시길.....엉엉 정말 깜빡하고중앙떡볶이메뉴랑 가격 사진을 찍어오지 않았는데, 쌀떡볶이+만두 1인분 3000원... ",끼리로그ღ KIRILOG,https://blog.naver.com/minheecool,2017-04-29
대구 동성로중앙떡볶이 (백종원의 3대천왕 출연!),https://blog.naver.com/rain930814?Redirect=Log&logNo=221249725824,"동성로 맛집 대구 떡볶이 맛집 대구중앙떡볶이안녕하세요 은지새나입니다:) 대구 떡볶이하면 생각나는 곳이 몇군데 있는데요. (윤옥연할매떡볶이, 달떡, 황떡, 신천...등등) 오늘 포스팅 할 곳은 2.28 공원... ",은지새나 : 쉼표 :,https://blog.naver.com/rain930814,2018-04-10
(대구 1박2일 겨울여행) - 3대천왕맛집중앙떡볶이 ,https://blog.naver.com/kyklove6?Redirect=Log&logNo=220900068656, 중앙떡볶이 는 지금까지 먹어본 떡볶이 중에 단연 1등! 다음 날중앙떡볶이또 가기로 했는데 배가 너무 불러서 못갔어요 흑... 두 번가고 싶을 정도로 맛있어요~,우행지,https://blog.naver.com/kyklove6,2017-01-01
대구 여행 동성로중앙떡볶이납작만두 필수 먹방!,https://blog.naver.com/charming_wd?Redirect=Log&logNo=221008994300,동성로중앙떡볶이 에서 떡볶이와 납작만두 그리고 김밥 한줄 주문했어요 대구 여행에서 가장 처음 온 맛집이라서 두근두근 했어요 @.@ 엄청 두꺼운 가래떡들과 맛있는 오뎅까지! 숟가락으로 잘라 먹어야 할... ,♥ 매력쟤 드레스룸,https://blog.naver.com/charming_wd,2017-05-19
대구먹방2중앙떡볶이+ 바뷔치 대구떡볶이맛집 매참김밥,https://blog.naver.com/figo1601?Redirect=Log&logNo=220497001219,대구먹방 2탄중앙떡볶이백종원님이 하시는 3대천왕 떡볶이편에 나와서 더 유명해졌습니다 학창시절엔 지나치기만 했는데 ㅠㅜ 떡볶이를 그렇게 좋아하진 않아서 관심이 없었나 봅니다 오픈 시간은 11시... ,읽고 싶은 서점,https://blog.naver.com/figo1601,2015-10-02
대구맛집/대구떡볶이/대구명물맛집/동성로맛집/대구 중앙떡볶이 ... ,https://blog.naver.com/dami0423?Redirect=Log&logNo=220236713336,흑흑 대구하면 떡볶이맛집으로 유명한중앙떡볶이매일매일... 줄서는거로 유명함 오늘도 ... 정 확 히 줄서네요 줄서면 기본 30-40분 .... 근데 다들 줄선다는거 줄은 두줄임 포장줄 먹고가는줄 ..... ㅠㅠ 간판... ,삶의온도,https://blog.naver.com/dami0423,2015-01-11
"대구 촬영지 투어 (가볼만한곳/불로동 고분군,중앙떡볶이 ... ",https://blog.naver.com/daeguvisit?Redirect=Log&logNo=222001256962,이곳중앙떡볶이 는 SBS ‘백종원의 3대천왕’에서 대구 3대 떡볶이집으로 소개되었는데요. 대구 10미 중 하나인 납작만두와 함께 대표 메뉴인 쌀떡볶이를 곁들어 먹는다면 입안이 즐거워지는 행복을 느낄 수... ,'제멋대로대구로드' 대구관광공식블로그,https://blog.naver.com/daeguvisit,2020-06-15
"대구 범어동 카페 어프레쉬, 동성로중앙떡볶이 , 봉덕동 장양곱창",https://blog.naver.com/tabo4515?Redirect=Log&logNo=221461871031,동성로중앙떡볶이항상 줄 서서 먹는 유명한 곳이라고ㅋㅋ 백종원도 다녀가고- 우리가 갔을 때도 역시나 줄이 길었는데 친구들과 수다 떨다 보니 금방 줄이 빠졌다 ㅋㅋ 떡볶이 2인분 납작만두 2인분 콜라2... ,Always Twinkle,https://blog.naver.com/tabo4515,2019-02-09
대구 동성로중앙떡볶이 _떡볶이맛집,https://blog.naver.com/houseup1?Redirect=Log&logNo=222450503252,대구에서 떡볶이하면 유명한중앙떡볶이 ! 떡볶이를 웨이팅해서 먹는 곳은 드물죠?중앙떡볶이 는 항상 웨이팅 했던것 같아요. 사실 갠적으로 제일 맛있어 하는 떡볶이는 고속도로 휴게소 떡볶이에요. 밀떡은... ,정리정돈수납 컨설팅전문,https://blog.naver.com/houseup1,2021-07-30
