title,link,description,bloggername,bloggerlink,postdate
"충주중앙탑 막국수와메밀마당두 곳 방문기,메밀 치킨 강추",https://blog.naver.com/soominahh?Redirect=Log&logNo=222245338566,충주 중앙탑막국수 #충주맛집 #중앙탑막국수 # 중앙탑메밀마당#메밀치킨 글.사진 ⓒ은별 충주... 켄싱턴리조트 충주에서= 충주 메밀마당 막국수와 메밀치킨 같이 먹으라고 치킨 반 마리 메뉴도 있다. 하지만 늘... ,"쉼, 그리고 여행",https://blog.naver.com/soominahh,2021-02-16
[충청북도/충주] 활옥동굴 카약맛집중앙탑메밀마당With... ,https://blog.naver.com/aldhr143?Redirect=Log&logNo=222470420886,서치해서 #충주 # 중앙탑메밀마당이라는 식당에 왔댜 급하게 찾은 곳인데 나름 방송도 나왔다는...!... 근처에 중앙탑공원 있어서 거기 들르자고 했는데 엄마가 더워죽겠는데 무슨 공원이냐고 대차게 거절했다 ..... ,YEJILOG,https://blog.naver.com/aldhr143,2021-08-14
충주중앙탑 막국수 맛집메밀마당치킨과 막국수 리뷰,https://blog.naver.com/happy_617?Redirect=Log&logNo=222082160644,"된다고하네요~ 메밀후라이드치킨 \15,000 메밀물막국수 \6,500 *4 메밀비빔 막국수 \6,500 *1 우리는... # 중앙탑메밀마당#충주맛집 #충주여행코스 #충주여행 #충주데이트 #충주 중앙탑# 메밀마당업체에서 식사권을... ",빵빵스 여행 맛집 블로그,https://blog.naver.com/happy_617,2020-09-07
충주중앙탑 메밀마당/ 메밀맛집 / 충주맛집,https://blog.naver.com/slamdunki?Redirect=Log&logNo=221914762715,안녕하세요 :) 오늘 소개 시켜드릴 곳은 충주중앙탑 메밀마당중앙탑공원 근처라 사람들이 더 많이 찾는거 같아요 저녁시간이라 사람이 많았어요 메뉴판 여기 메밀마당의 장점은 치킨과 막국수를 함께 먹을... ,봄동블로그 :),https://blog.naver.com/slamdunki,2020-04-18
충주중앙탑메밀마당막국수랑 후라이드 치킨 완전 맛나다... ,https://blog.naver.com/suho1004ck?Redirect=Log&logNo=221788148722,가던메밀 막국수 먹으러 갔습니다. 학교 다닐때도 차가 있어서 수업이 끝나면 종종중앙탑 으로 달려가메밀마당 에서 막국수 먹었건 기억이 있습니다. 오랜만에 가서 이 맛있는집을 와이프에게 소개도 해주고... ,앰지니어 : AMGineer Daily life,https://blog.naver.com/suho1004ck,2020-01-28
"충주,중앙탑 메밀마당 .",https://blog.naver.com/soyung914?Redirect=Log&logNo=220455954018,그리고중앙탑보러 왔다가 먹으면 딱임. 그런데 굳이 치킨을 시킬 필요는 없다. 막국수가격은 5천원 치킨은 한마리에 1만 5천원 (반마리는 8천원) 치킨말고도메밀 만두나메밀 전 이런거도 팜.,어제오늘내일,https://blog.naver.com/soyung914,2015-08-19
괴산큰고모부가 강추하는~충주중앙탑맛집메밀마당 ♡,https://blog.naver.com/4242s?Redirect=Log&logNo=221265487233, 중앙탑 메밀마당 이 있답니다:) 충주하면 가장 먼저 떠오르는.. 중앙탑!! 거기서 제일 맛있는ㅎㅎ 메밀후... 이라고 써있어~^^ 사진 찍어달라고ㅋㅋ 중앙탑 메일마당♡ 이곳 메밀마당은 진짜 늘 손님이 가득~ 따로... ,행복이 가득한 집,https://blog.naver.com/4242s,2018-05-01
메밀치킨 메밀막국수 충주 3go 여행중앙탑메밀마당6월 4일... ,https://comcomin.tistory.com/17196,"6월 4일 금요일 sbs 생방송투데이 2838회 보고 먹고 즐기고 3go 충주 3go 여행 편 메밀치킨, 메밀막국수 [중앙탑메밀마당] 전화번호 0507-1400-0283 주소 충북 충주시 중앙탑면 탑평리 42 영업시간 10... ",★■ 일루와 ■★,https://comcomin.tistory.com/,2021-06-04
생생정보 메밀치킨 막국수 파는곳중앙탑메밀마당정보,https://blog.naver.com/kdw1116?Redirect=Log&logNo=222056264669,● 상호 : 중앙메밀탑마당 ● 주소 : 충북 충주시 중앙탑면 중앙탑길 103 (탑평리42) ● 연락처 : 043-855-0283... 메밀비빔막국수 등 메밀로 만든 음식을 두가지 조합으로 판매를 하고 있는 # 중앙탑메밀마당전문점이... ,5월별빛,https://blog.naver.com/kdw1116,2020-08-22
 중앙탑메밀마당충주막국수맛집,https://blog.naver.com/jadu0407?Redirect=Log&logNo=221822213836,"충주막국수 메밀마당 보이는게 전부가 아니라 바깥쪽에도 자리가 매우 많다! 일단 기본찬이 나왔고, 기다리는중중앙탑 메밀마당위치 중앙탑에 오면 바로 보인다!! 침대에서 떨어져 눈탱이 밤탱이 된 우리 아람... ",긍정적으로 살아가기,https://blog.naver.com/jadu0407,2020-02-24
충주 중앙탑 맛집중앙탑메밀마당충주여행코스,https://blog.naver.com/kwon2727?Redirect=Log&logNo=221791499483,"(가격표) #충주메밀마당가격 허허 괜히 착한가격 모범식당이 아닙니다^^ㅋㅋㅋ 막국수, 떡만둣국... 메밀막국수집 많지만 유독 충주 중앙탑 맛집 중중앙탑메밀마당이 진짜 맛있다ㅋㅋ 요건 후배가 시킨... ",기록하는일상,https://blog.naver.com/kwon2727,2020-01-31
"충주중앙탑막국수와메밀 치킨 맛집,메밀마당방문 후기",https://blog.naver.com/allzero92?Redirect=Log&logNo=221562277973,"싶어 #충주 중앙탑 막국수 #충주막국수 # 중앙탑 막국수 #충주 메밀마당# 메밀마당다녀왔어요 막국수는 6... 요새 브랜드치킨은 거의 2만원 다되가는 데메밀 치킨이 15,000원이라니ㅠㅠ 가격에서도 부담이 없지만... ",간절하면 가 닿으리,https://blog.naver.com/allzero92,2019-06-18
충주 맛집 ' 중앙탑 메밀마당 ' 막국수와 치킨,https://blog.naver.com/z714_z?Redirect=Log&logNo=222022598499, 중앙탑메밀마당에 다녀왔습니다 매일 11:00 - 21:00Last order 20:10 연중무휴 메밀마당은 충주에서 유명한... 메밀 마당 메뉴판입니다! 2인 자리가 나와서 금방 앉을 수 있었는데요!! 메밀 물 막국수 2 + 후라이드... ,또라,https://blog.naver.com/z714_z,2020-07-06
충주 중앙탑 맛집: ‘ 중앙탑메밀마당 ’,https://blog.naver.com/lwany1205?Redirect=Log&logNo=221917454740,"충주 중앙탑에 위치한 메밀막국수와 치킨 맛집!중앙탑메밀마당충주로 가기 전 충주에서 일하는... 아니, 메밀막국수와 후라이드치킨이라니 무슨 이런 조합이...! 충주에 유명한 중앙탑에 위치한 메밀마당... ","영, 그늘",https://blog.naver.com/lwany1205,2020-04-19
"[중앙탑공원 맛집, 충주 막국수 맛집]중앙탑메밀마당 ",https://blog.naver.com/suu120808?Redirect=Log&logNo=221978181903,#충주맛집#충주중앙탑공원#중앙탑공원맛집# 중앙탑메밀마당또 가서 먹음 이번엔 배가 불러서 치킨을 안시켰는데 약간 아쉬웠다 빠삭한 치킨을 같이 씹어줘야 제맛 하 또가고프다ㅜㅜ,먹는거 너무 죠아 ♡,https://blog.naver.com/suu120808,2020-05-25
[충주맛집/메밀마당] 저렴한... 치킨! 충주중앙탑 메밀마당 ,https://blog.naver.com/sunhwa00812?Redirect=Log&logNo=220499893707,"충주 중앙탑에는 막국수집이 많이 있어요. 그중에 오늘은 메밀마당으로 고고싱! 충주중앙탑 메밀마당 은 메밀막국수가 5,000원으로 인근 가게중에서 가장 저렴해요. 그리고 사리 리필도 가능하고요... ",아띠네 티끌 별,https://blog.naver.com/sunhwa00812,2015-10-05
충주중앙탑메밀마당/ 막국수 맛집 / 코로나대응,https://blog.naver.com/se_116?Redirect=Log&logNo=222321815968,"-주차 : 가게 앞,중앙탑 쪽 공터 -오픈 : 10시30분 ~ 8시 -주문 : # 메밀 비빔막국수, # 메밀 떡만두국... 맛입니다메밀마당되게 오래된 곳이었네요 오래된 맛집이라니 역시라는 느낌이에요 직원분들도 친절하고... ","여행 : 지금, 여기서 행복할 것",https://blog.naver.com/se_116,2021-04-24
충주맛집추천 :중앙탑 메밀마당에서 인생막국수를 만나다,https://blog.naver.com/hikidiki5?Redirect=Log&logNo=222016192016,충주맛집추천 :중앙탑메밀마당충청북도 충주시 중앙탑면 중앙탑길 103 영업시간 : 11:00 ~ 20:30 처음... 충추맛집 메밀마당 메뉴 입니다. 우선 대표메뉴인 메밀물막국수 / 비빔막국수 그리고 메밀부침... ,행복한 기린기리니 :),https://blog.naver.com/hikidiki5,2020-06-29
메밀후라이드치킨 이색조합 충북 충주중앙탑메밀마당7월... ,https://comcomin.tistory.com/18065,"7월 19일 월요일 kbs 2tv 생생정보 1359회 비법 24시 밥상을 털어라 이색조합 재구성 편 메밀치킨, 메밀막국수 [중앙탑메밀마당] 전화번호 0507-1400-0283 주소 충북 충주시 중앙탑면 탑평리 42... ",★■ 일루와 ■★,https://comcomin.tistory.com/,2021-07-19
충주맛집중앙탑 메밀마당막국수와 치킨 조합 굿뜨,https://blog.naver.com/lhcj008?Redirect=Log&logNo=222001237713,좋은 기억으로 남아 포스팅 쓰기도 너무 좋네요ㅎㅎ 강추! #충주맛집 #충주막국수맛집 #충주중앙탑인그맛집 #충주맛집추천 #충주메밀치킨 #충주메밀마당 # 중앙탑메밀마당#메밀마당,day to day,https://blog.naver.com/lhcj008,2020-06-15
 중앙탑메밀마당치킨과 막국수의 조합. 이게 말이돼나... ,https://blog.naver.com/killine?Redirect=Log&logNo=222503670719,하지만 앞쪽 로타리를 돌면중앙탑사적공원 공용 주차장이 있습니다. 거기에 주차하시고 아주 잠깐...메밀 물막국수메밀 치킨 맛집 충주메밀마당'생방송 오늘저녁' 국수의 신 소개 위치 어디?,서윤이네 드라마 리뷰,https://blog.naver.com/killine,2021-09-12
충주중앙탑메밀마당메밀후라이드치킨 막국수,https://blog.naver.com/h2a0412?Redirect=Log&logNo=221766310480,중앙탑면 중앙탑길 103 충주 탑평리 칠층석탑 앞에서 기를 받고... 막국수와 메밀후라이드치킨이 유명한중앙탑메밀마당 을 방문했다. 뜨끈한 메밀물을 주전자에 먹을 만큼 직접 담아오면 된다. 메밀 후라이드... ,금류의일상,https://blog.naver.com/h2a0412,2020-01-10
6월4일생방송투데이중앙탑메밀마당메밀치킨 메밀막국수... ,https://blog.naver.com/kjjoong2119?Redirect=Log&logNo=222384799742,"6월 4일 생방송 투데이 메밀치킨, 메밀막국수중앙탑메밀마당충북 충주시 중앙탑면 중앙탑길 103 0507-1400-0283식단 해결사경기도 의정부시 비우로92번길 8 031-872-6928로쏘1924... ",♧전국방방곡곡♧ 김재중팀장 010-4017-1514,https://blog.naver.com/kjjoong2119,2021-06-04
충주맛집:) 중앙탑 메밀마당 ♡,https://blog.naver.com/4242s?Redirect=Log&logNo=221111975523,룰루랄라~ 오늘은 괴산큰고모네와~충주맛집고고♡중앙탑 메밀마당 에 왔어유~ 치킨은 사랑이쥬~♡ 여긴... 쿠폰 도장 쾅쾅 남겨놨어유~♡ 중앙탑에 메밀마당갈때마다ㅎㅎ 이 카페쿠폰에 도장하나씩... ,행복이 가득한 집,https://blog.naver.com/4242s,2017-10-07
충주맛집 막국수 맛있는곳중앙탑 메밀마당 ,https://blog.naver.com/jambbojy?Redirect=Log&logNo=221262965811,괜찮아요~^^메밀후라이드 치킨 한마리와 막국수를 주문해요~^^ 반마리여도 충분했을테지만.. 1인1닭도... 충주맛집.충주막국수.충주 메밀마당 . 중앙탑 막국수. 중앙탑 맛집.충주막국수맛집.충주막국수맛있는집 ' ',소소하지만 확실한 행복,https://blog.naver.com/jambbojy,2018-04-27
충주중앙탑메밀마당막국수 와 치킨 의 조합,https://blog.naver.com/soyeon2_90?Redirect=Log&logNo=221721747902,그리고 심지어 시그니처 메뉴인 메밀후라이드치킨 이 팔아요!!!!!! 여러분 들어보셨습니까-? 소스도... 내부모습중앙탑 메밀마당메밀마당 깔끔 담백한 치킨과 시원한 막국수 add_ 충북 충주시 중앙탑면... ,너의 마음이 안녕 하기를,https://blog.naver.com/soyeon2_90,2019-11-29
충주 막국수 맛집중앙탑 메밀마당 (솔직후기),https://blog.naver.com/world0302?Redirect=Log&logNo=221751647873,방문했어요중앙탑메밀마당 은 메밀 치킨을 판매하고 있는데 요 메밀치킨이 맛있기로 유명해요 중앙탑 앞에 가게들이 많지만 메밀마당이 대한민국 최초로 메밀 치킨 막국수를 처음으로 시작한 집이라고... ,그린나래,https://blog.naver.com/world0302,2019-12-27
충주맛집 중앙탑메밀 충주막국수중앙탑메밀마당 ,https://blog.naver.com/nana010005?Redirect=Log&logNo=222407067761,충주맛집중앙탑메밀마당충주막국수중앙탑메밀마당충주맛집중앙탑메밀마당매일 10:40 - 21:00Last... 만차이고 중앙탑공원 주차장을 이용을 해두 된다고 해요 메밀마당은 메밀국수와 함께 치킨을 같이... ,아연샘먹고갈래(고래),https://blog.naver.com/nana010005,2021-06-23
충주 유명한 막국수 ' 중앙탑 메밀마당 ',https://blog.naver.com/j_yoon__h?Redirect=Log&logNo=222136367344,(?) !! 그래도 충주가면 한번씩 먹어봐도 좋을 것 같아유 먹고 중앙탑 근처 산책하면 코스 좋슴둥 !' #충주맛집 #충주여행 # 중앙탑메밀마당#치킨 #막국수 #충북여행,Everything,https://blog.naver.com/j_yoon__h,2020-11-05
[충주중앙탑메밀마당 ] 역시 여름엔 시원한 막국수♡,https://blog.naver.com/qaw9639?Redirect=Log&logNo=222001232083,그래서 방문한중앙탑 메밀마당 ! 정말 한 10년쯤 전에 가보고 처음 가보는 곳이라 감회가 새로웠다ㅎㅎ... 바로 앞이 중앙탑 공원이니 거닐 곳도 많다. 전혀 지겹지 않은 웨이팅이다. 하지만 더워서 안에서... ,未盡하지 않은 美眞한 이야기,https://blog.naver.com/qaw9639,2020-06-15
[충주 맛집] 충주중앙탑맛집 -메밀마당/충주 막국수,https://blog.naver.com/jiyongna?Redirect=Log&logNo=220097730252,"그중에서 오늘 소개할 곳은중앙탑 메밀마당입니다. 위치는 중앙탑 바로 앞에 있습니다. 중앙탑을 한바퀴 싹~ 돌고 가면 좋을 것 같아요. 메밀국수, 후라이드치킨, 메밀전, 만두등을 팔고 있습니다. 가격도 그리... ",지용의 블로그,https://blog.naver.com/jiyongna,2014-08-20
충주사람 다 아는 충주맛집중앙탑 메밀마당 ,https://blog.naver.com/blumoonlight?Redirect=Log&logNo=221067984778,ㅋㅋ 진짜 90년대 포장용기같이 생겼지요?ㅋㅋ 비 오는 날이었지만 시원하게 땀이 쑥 들어가더라구요 해마다 한번씩 포스팅 올리는메밀마당 이지만 그래도중앙탑 맛집은 요기!! 또메밀 치킨 먹고싶네요 ㅠ,Written by hyunrua,https://blog.naver.com/blumoonlight,2017-08-06
"〔충주/중앙탑 맛집〕' 중앙탑 메밀마당 ', 막국수와 치킨의... ",https://blog.naver.com/kimrg?Redirect=Log&logNo=221991470240,이번에 찾은 막국수 식당은 전에 먹던 A식당과 가까운 ' 중앙탑 메밀 식당'이었다. 주소: 충청북도중앙탑 면중앙탑 길 103(지번: 탑평리42) ☎043-855-0283중앙탑 사적공원에는 막국수+치킨을 위주로 하는 식당이 7... ,검은돌의 하루하루,https://blog.naver.com/kimrg,2020-06-06
충주 맛집중앙탑 메밀마당신박한 메뉴 발견했어요,https://blog.naver.com/inhee003?Redirect=Log&logNo=221626925947, 중앙 탑 메밀 마당차림표 적절하게 출출해진 시장기와 호기심으로 메뉴판 모두를 주문할 기세였지만 (가격도 제법 만만합니다~^^) 이성을 챙기고 중앙탑에밀마당의 대표 메뉴인 막국수와 치킨을 주문했죠. 사리... ,마음과 그림 더하기,https://blog.naver.com/inhee003,2019-08-24
생생정보 메밀막국수메밀치킨 충주중앙탑 메밀마당 ,https://blog.naver.com/sue035?Redirect=Log&logNo=222053961066,오직 충주에서만 맛볼 수 있는 대한민국 최초 메밀막국수와 메밀 치킨 조화를 저희 메밀 마당에서... 중앙탑면 중앙탑길 103 탑평리 42 전화번호 043-855-0283중앙탑 메밀마당#생생정보메밀막국수... ,해바라기,https://blog.naver.com/sue035,2020-08-07
[충주 맛집]중앙탑메밀마당 _치킨맛집,https://blog.naver.com/namoo_1027?Redirect=Log&logNo=222059338813,맛있게 먹었습니다 양념장 찍어서 먹어도 맛있고 살코기랑 막국수랑 같이 먹어도 맛있더라구요. #충주 중앙탑메밀마당#충주메밀마당 #충주맛집 #중앙탑맛집 #충주막국수 #충주치킨막국수 #충주치킨 #중앙탑막국수,늉뉴난나,https://blog.naver.com/namoo_1027,2020-08-13
 중앙탑 메밀마당 ,https://blog.naver.com/tjsvndl?Redirect=Log&logNo=222316585482,"중앙탑 바로 앞에 위치해 있는 메밀마당 언제가도 늘 사람이 많아요... 웨이팅은 기본이지요..... 웨이팅하면 톡으로 알려줘서 넘 좋아요, 티비에 많이 소개된중앙탑 메밀마당안에는 유명한분들의 사인까지... ",지우공주님♡,https://blog.naver.com/tjsvndl,2021-04-20
충주중앙탑막국수 맛집 ' 메밀마당 ',https://blog.naver.com/baksabin?Redirect=Log&logNo=221958404458,"충주에서 유명한 관광지가 몇 군데 있는데 그중 한 군데는 바로중앙탑 . 특히나 요즘같이 날씨가 좋으면... 충주메밀 마당 의 메뉴입니다. 참고하세요 :-) 저희가 시킨 메뉴는 물 막국수, 비빔막국수, 치킨 반 마리.... ",박을남과 이갑녀의 일상생활 블로그 :-),https://blog.naver.com/baksabin,2020-05-12
(충주 맛집)중앙탑메밀마당 ,https://blog.naver.com/kwiyongi?Redirect=Log&logNo=221979978167,"#메밀막국수 #비빔막국수 #사리는무한 #챙피해서3개만 # 중앙탑메밀마당#6천원 #착한가격 날이 더워지고, 오랜만에 밖으로 나왔습니다. 인천말고요~ 혼자 나왔습니다~^^ 어디로 바람쐬러 갈까하다가 메밀막국수... ",소중한 하루하루의 기록들,https://blog.naver.com/kwiyongi,2020-05-27
충주중앙탑 메밀마당 ,https://blog.naver.com/99wsj0923?Redirect=Log&logNo=222284217703,"일요일 늦은 아침을 먹은 후 느긋하게 쉬고 있는데 남편이 시원한 메일국수를 먹자고 하네요~ 그래서 예전에도 자주 갔던 충주중앙탑 에 있는메밀마당 에메밀후라이드치킨,메밀 국수 먹으러 다녀왔습니다... ",Bakery & Bakingschool 아미드뺑의 빵아 놀자,https://blog.naver.com/99wsj0923,2021-03-22
충주 막국수 맛집중앙탑 메밀마당메밀 새싹 물 막국수 리뷰,https://blog.naver.com/circle422?Redirect=Log&logNo=222346840912,충북 충주시 중앙탑면에 가면 중앙탑 사적공원이 있습니다. 공원 앞으로 유유히 흐르고 있는 탄금호를... 총평 개인적으로 충주중앙탑 메밀마당 에서 메밀 후라이드 치킨과 메밀 새싹 물 막국수를 먹고 느낀 점은... ,일상과 자연에서 보물 찾기,https://blog.naver.com/circle422,2021-05-11
"충주 임페리얼레이크cc 맛집,중앙탑 메밀마당막국수",https://blog.naver.com/tangdori778?Redirect=Log&logNo=221649658057,ㅋㅋ 간만에 문자 좀 써봤어요 ㅋㅋ 충주 임페리얼레이크cc 맛집 충주댐 탄금호 중앙탑에 위치한중앙탑 메밀마당메밀후라이드치킨 대령이요~~~~ #겉바속촉 메밀후라이드치킨 막 나와서 후후 불면서 뜨거울때... ,.♡탱도리의 분양현장,https://blog.naver.com/tangdori778,2019-09-16
충주중앙탑인근맛집 충주메밀치키친중앙탑 메밀마당가성비 짱!,https://blog.naver.com/osukhee?Redirect=Log&logNo=221773900632,"충주중앙탑인근맛집 충주메밀치키친중앙탑 메밀마당가성비 짱! 여동생들과 다녀온 2박 3일 충청도... 그리고 #충주맛집,#충주막국수맛집, #충주중앙탑인근맛집, #충주메밀치킨 으로 알려진 #메밀마당 에서는... ",YOU and I,https://blog.naver.com/osukhee,2020-01-17
(충주 중앙탑 맛집) 메밀... 치킨을 한 집에서!? ' 중앙탑 메밀마당 ',https://blog.naver.com/godtkah2?Redirect=Log&logNo=222135487848,"(충주 중앙탑 맛집) 메밀 막국수와 후라이드 치킨을 한 집에서!? 충주 점심식사 하기 좋은 곳, 메밀마당 오늘 리뷰할 식당은 충주 중앙탑에 위치하고있는 ' 중앙탑 메밀마당 '입니다. 충주 여행을 계획할때 어디... ",하마의 작은다락방,https://blog.naver.com/godtkah2,2020-11-04
무조건 추천! 충주 중앙탑 맛집중앙탑 메밀마당 ,https://blog.naver.com/yuuun__is?Redirect=Log&logNo=221547325638,"#충주 #충주맛집 #맛집추천 #중앙탑 # 중앙탑메밀마당#메밀마당 한번 갔다가 맘에 담아두고 다시 간 맛집... 치킨 메밀로 만든 치킨이라 그런지 더 바삭한 느낌..! 그리고, 메밀 만두까지..! 역시 메밀 맛집.. 인정... ",get closer,https://blog.naver.com/yuuun__is,2019-05-27
[충주 탄금호 맛집]중앙탑 메밀마당 ,https://blog.naver.com/30139621?Redirect=Log&logNo=220703724839,이제는메밀마당 이 제일 붐비는 집이 되었죠! 제가 알기로중앙탑막국수에서도메밀 치킨을 시작한 걸로 알고 있어요! 그리고 막국수 맛도 굉장히 다시 좋아졌다고 합니다!중앙탑막국수는 나중에 따로... ,곰팅이 일상,https://blog.naver.com/30139621,2016-05-07
[맛집투어]충주중앙탑메밀마당메밀막국수와 치킨,https://blog.naver.com/huhbeb?Redirect=Log&logNo=221949141161,"예뻤는데 #중앙탑공원 은 다른 포스팅에서 마져 소개하도록 하고, #충주맛집#메밀마당#메밀막국수#치킨... -유난히중앙탑메밀마당 이 너~~~~~~무 많기는 했지만,,ㅋㅋㅋ 날씨도 좋아지고 시원한 국수에 언제... ",콩이네 블로그,https://blog.naver.com/huhbeb,2020-05-06
"치킨과 막국수의 환상궁합중앙탑 메밀마당 ,",https://blog.naver.com/ranyzz?Redirect=Log&logNo=220835940402,"겸사겸사중앙탑 메밀마당 으로 고고씽,!! 막국수는 물2, 비빔2 빠질 수 없는 치킨 1마리,, 치킨이 먼저 나왔어요~~ 바삭바삭, 메밀마당 치킨은 튀김옷이 얇은 옛날 통닭 스타일인데요, 요즘 제가 이런 스타일 통닭에... ","미단, 일상을 요리하다",https://blog.naver.com/ranyzz,2016-10-14
[충주중앙탑 메밀마당 ] 메밀막국수와 메밀치킨의 조합... ,https://blog.naver.com/rudghk16?Redirect=Log&logNo=221862507819,충주중앙탑 메밀마당 은 중앙탑공원 정문앞에 위치해 있습니다. #충주막국수 #중앙탑공원 # 중앙탑메밀마당#메밀마당 #메밀치킨 #치킨이엄청큼 #메밀막국수 #메밀막국수맛집 #메밀치킨맛집 #충주맛집 #중앙탑맛집,월랑[月朗]의 기억창고,https://blog.naver.com/rudghk16,2020-03-19
 중앙탑메밀마당/ 중앙탑 맛집/ 충주 맛집/ 충주 막국수 맛집... ,https://blog.naver.com/thdusl9592?Redirect=Log&logNo=222135932875,"신기했다 :) 중앙탑을 관람하기 전 먼저 밥부터 먹었던 우리 ㅋㅋ # 중앙탑메밀마당중앙탑메밀마당매일 11am-9pm *last order: 8시10분까지 연중무휴 대표메뉴 메밀후라이드치킨: 한마리(15,000) / 반마리(8,000)... ",소확행 ::: 小確幸,https://blog.naver.com/thdusl9592,2020-11-05
[충주맛집]-충주 맛집중앙탑 메밀마당강추✨,https://blog.naver.com/seon456?Redirect=Log&logNo=221811537346,안녕하세용 뮹이에용✨ 어제 친구들 커플들이랑 충주펜션에서 놀러가서 오늘 충주맛집을 먹으려고 검색하니까 충주는막국수메밀치킨이 유명하더라구용 그중중앙탑메밀마당 이 대한민국 최초 로 메밀치킨막... ,뮹이로그⸜❤︎⸝,https://blog.naver.com/seon456,2020-02-16
[충주맛집]중앙탑 메밀마당후기 / 막국수 맛집 / 내돈내산,https://blog.naver.com/328219?Redirect=Log&logNo=221851222922,"한 두 번, 한 두 명이랑 가본 것이 아닌 수차례 많은 사람들과 가보았던 맛집 메뉴/가격 메밀물막국수... #충주 #충주맛집 #충주맛집추천 #충주중앙탑맛집 # 중앙탑메밀마당#메밀마당 #충주메밀마당... ",e_pilo_gue,https://blog.naver.com/328219,2020-03-13
충주중앙탑 메밀마당 ^^,https://blog.naver.com/coozooboo1?Redirect=Log&logNo=222340729013,충주중앙탑 메밀마당 에서 아점 했어요 연예인 싸인 많구요~~ 베스트 메뉴~~^^ 비빔막국수~~^^ 야채 데코가 예뻐요~ 부드러운 면빨~^^ 치킨 입장했습니다~~ 메밀치킨으로 단백함이 최고^^ 막국수랑 너무... ,신차장기렌트이야기,https://blog.naver.com/coozooboo1,2021-05-06
환상의 조합 메뉴를 맛 볼 수 있는 “ 중앙탑 메밀마당 ”,https://blog.naver.com/ohsjws?Redirect=Log&logNo=221866368040,"좋음 그럼, 충주 맛집.. “중앙탐 메밀마당” 소개는 여기서 끝~! #충주맛집 #충주 중앙탑메밀마당# 중앙탑메밀마당#메밀막국수 #막국수맛집 #충주막국수 #충주막국수맛집 #충주중앙탑 #중앙탑공원",레저왕의 푸드매거진,https://blog.naver.com/ohsjws,2020-03-22
[중부내륙 힐링여행] 막국수와 치킨은 처음이야 ' 중앙탑메밀마당 ',https://blog.naver.com/jbt2021?Redirect=Log&logNo=221557182561,메밀마당이 위치한 중앙탑은 많은 사람이 충주호를 조망하기 위해 방문하는 곳이어서중앙탑메밀마당 으로 불린다. 잘되는 막국수 집도 있고 잘되는 치킨 집도 있지만 두 메뉴가 만나 계절의 한계를 극복했고... ,중부내륙힐링여행,https://blog.naver.com/jbt2021,2019-06-14
