title,link,description,bloggername,bloggerlink,postdate
군산지린성고추짜장 먹어본 솔직후기,https://blog.naver.com/ssms4068?Redirect=Log&logNo=222287351153,"#군산 # 지린성#고추짜장 그렇게 맛있다고~ #군산맛집 유명해서 다녀왔다. 듣던 대로 사람이 정말 많았다. 주차는 바로 앞, 공용주차장이 있어서 수월하게 주차할 수 있었다. 줄은 건너편에도 쭉.. #군산 지린성 ... ",노멀한데일리,https://blog.naver.com/ssms4068,2021-03-25
군산 맛집 :지린성고추짜장 이거 먹으러 당일치기 군산행,https://blog.naver.com/haminhoo?Redirect=Log&logNo=222340796621,야근에 시달리는 남편이 회사를 안가는 기쁘디 기쁜 빨간날이다 기쁘기 때문에 우리 쀼는 새벽같이 일어나 군산으로 향함..^*^ 왜냐면지린성 에 가기로 정한 날이기 때문이쥬 꺅지린성오픈 시간이... ,NASCHKATZE ='ㅅ'=,https://blog.naver.com/haminhoo,2021-05-07
[군산 맛집] 매운맛집 찾는다면 청양고추 넣은 고추 짜장 ' 지린성 ',https://blog.naver.com/x1330x?Redirect=Log&logNo=222440626510,있는지린성 도 참 좋아합니다. 사실 자주는 안 가봤지만 ㅋㅋㅋㅋㅋ 매운맛집 찾는 친구들한테 강추하는 군산 맛집 [군산 맛집] 매운맛집 찾는다면 청양고추 넣은 고추 짜장 ' 지린성 ' 영업시간 : 매일 09:30 - 16:00... ,조꽁의 취미집대성,https://blog.naver.com/x1330x,2021-07-22
군산 맛집지린성: 고추짜장 먹으려 두시간을 달려왔다,https://blog.naver.com/seong3961?Redirect=Log&logNo=222221078950,"군산 맛집지린성주소 : 전북 군산시 미원로 87 영업시간 : 9시 30 ~ 16시 (화요일 휴무 / 재료 소진 시 조기 마감) 전화 : 063-467-2905 가격 고추짜장 9,000원 고추짬뽕 9,000원 (맵기 조절 X) 주차장 :지린성건너편... ",빵규가 사는 세상,https://blog.naver.com/seong3961,2021-01-26
[군산 맛집] 중국집지린성 ,https://blog.naver.com/chonfamily?Redirect=Log&logNo=222064158329,[군산 맛집] 중국집지린성당일 치기로 여행 갔던 군산 정말 좋았던 기억만 있었던 군산 다음엔 꼭 1박... 마자지린성출동 백종원 3대 천왕에 나와서 더 핫한 이곳 대중교통 이용해서 갔던 군산이라 택시... ,Let`s Go!!! JINJIN,https://blog.naver.com/chonfamily,2020-08-18
군산 -지린성/ 고추짜장 먹어본 후기!,https://blog.naver.com/aaaa0408?Redirect=Log&logNo=222371684361,군산 하면 sns에서 엄청 핫한지린성고추짜장 이잖아요!!!!!!! 원래 저랑 친구는 빈해원을 갈까지린성 을 갈까 고민하다가 고추짜장이 많이 맵다는 이야기를 듣고는 저는 매운걸 잘 못먹으니 그럼 빈해원을... ,"하늘연달, 나흘",https://blog.naver.com/aaaa0408,2021-06-02
"[군산 고추짜장 맛집] 자꾸 생각나는 맛,지린성 ",https://blog.naver.com/saeng1986?Redirect=Log&logNo=222539894285,"도착한지린성 ! 바로 앞에 엄마랑 동생 먼저 내려주고 바로 옆에 있는 공영 주차장에 주차를 했다. 11시...지린성진짜 패스트푸드점보다 빠른 듯!! 아,지린성 은 9:30~16:00까지 영업을 하는데 재료 소진 시에 조기... ",꽂히면 한다! 셔니의 우당탕탕 취미 백과,https://blog.naver.com/saeng1986,2021-10-17
[군산 맛집]지린성- 2020.08.16(feat.백종원의 3대천왕),https://blog.naver.com/galyon?Redirect=Log&logNo=222130150707,군산지린성외관 사실 무얼 먹어도 상관없긴 했지만 여기까지 왔으니 조금 기다려서라도 유명한걸 먹어보자는 말에 웨이팅도 불사하고지린성 으로 향했어요. 뜨거운 8월 중순의 햇살 아래에 그날의 동지들이... ,주뱅일상 기록지.,https://blog.naver.com/galyon,2020-10-29
군산 맛집 -지린성고추짜장 (백종원 삼대천왕 맛집),https://blog.naver.com/jayp36?Redirect=Log&logNo=222260191107, 지린성토요일 오후1시쯤 도착 길건너편 부터 줄서있습니다 ^^; 줄서있으니 어떤 아주머니가 이런걸 주고 가시던데 검색해보니지린성 에서 짜장먹고 여기서 아이스크림 먹고 그런거래요 ㅋ 서로 계약된 집인가... ,TIME2REST,https://blog.naver.com/jayp36,2021-03-01
군산이성당지린성다녀왔어요,https://blog.naver.com/ktbill?Redirect=Log&logNo=222537831309,출장갔다가지린성 에서 점심 식사하고 올라오면서 이성당 들렀어요 금요일 1시경 점심즈음이지만 주말이 아니라서 웨이팅은 없었습니다. 그래도 매장은 거의 차있었고 듣던대로 음식나오는 시간은 라면보다... ,유쾌한먹방이야기,https://blog.naver.com/ktbill,2021-10-15
군산 고추짜장 유명한지린성맛집 들려보기,https://blog.naver.com/binred?Redirect=Log&logNo=222176833267,군산 고추짜장 유명한지린성맛집 들려보기 매운거를 못 먹는 이팀장 입니다 그래도 선유도 가기전 군산에서는 맛집으로 꼭 들려보라는 지인 소개로 방문을 하게 됩니다 다행히 쉬는 날이 아니더라구요 입구... ,신축빌라상담 이장희팀장과!,https://blog.naver.com/binred,2020-12-17
군산지린성고추짜장면과 짬뽕 선유도 옥돌슈퍼 바닷가에서... ,https://blog.naver.com/plotina1?Redirect=Log&logNo=222420568115,이게 발단이 되어서 찾아보니지린성 은 고추짬뽕이 아니라 고추짜장 맛집이라고 하더라고요?... 맛집으로 기대했던지린성 이 조금 저와 맞지않아 실망이었지만 바닷가에서 쉬면서 힐링하는 즐거운... ,P L O T I N A,https://blog.naver.com/plotina1,2021-07-05
군산지린성근처 아이스크림 맛집 와니디저트카페!,https://blog.naver.com/yoondh613?Redirect=Log&logNo=222081345609,군산지린성 은.. 어마어마하게 매웠다. 맛은있었지만 속은 타들어 가는 기분이였지. 현둥이와 나는... 그래서지린성근처 아이스크림집에 그냥 들어갔다.지린성 에서 30미터 정도 가면 있는 와니디저트카페!... ,씨씨커플,https://blog.naver.com/yoondh613,2020-09-05
"채석강,바다길포차,변산해수욕장-선호네횟집,군산지린성 ",https://blog.naver.com/golapad?Redirect=Log&logNo=222311382094,# 지린성#고추짜장 #짬뽕 귀동냥으로 고추짬뽕이랑 고추짜장이 엄청 맵다고? 둘 다 매울까 우린... 나에겐 크게 맵진 않았지만 맛있었어 다음엔 고추짬뽕에 고추짜장 시켜야겠다 소주가 없어서 아쉬웠던지린성ㅠ,콤마 32,https://blog.naver.com/golapad,2021-04-15
군산맛집지린성복성루 실패(평일 월요일 점심1시) feat.주차,https://blog.naver.com/naraehyori?Redirect=Log&logNo=222450095149,그럼에도 불구하고지린성 은.. 기다릴만해요.. 어디가서 못먹는 맛이기에 저도 군산하면지린성 이 가장 먼저 떠오르더라고요. 그리고지린성 에서 가까운 곳에 짬뽕맛집으로 가장 유명한 복성루도 위치하고... ,달달한 별님이의 블로그,https://blog.naver.com/naraehyori,2021-07-29
[군산여행] 당일치기지린성/ 초원사진관 / 신흥동일본식가옥... ,https://blog.naver.com/isthisheaven?Redirect=Log&logNo=222116486408,"주말에가볼만한곳 # 지린성#동국사 남편이 강제 연차 쓴 날, 평일에 군산당일치기여행 다녀왔어요~ 지리게 맵다는지린성짬뽕 먹으러 고고~ 군산에서 신호를 기다리는데 앞에 있던 오토바이 번호판에... ",조안나 행복한 블로그,https://blog.naver.com/isthisheaven,2020-10-29
[군산] 백종원의 3대천왕에 나왔던 ‘ 지린성 ’ 내돈내산 후기,https://blog.naver.com/songhee3?Redirect=Log&logNo=222053185126,군산에 왔으면지린성 을 가봐야한다는 남친 아는 형의 말에 숙소 근처에 있길래 한 번 들러봤다지린성전북 군산시 미원로 87 매일 09:30 - 16:00 재료소진시 조기마감! 화요일 휴무지린성줄이 엄청 길었다... ,내 맘대로 하는 블로그 :D,https://blog.naver.com/songhee3,2020-08-06
군산 중국집 고추짜장 맛집 :지린성 ,https://blog.naver.com/suda930804?Redirect=Log&logNo=222503966879,군산에 가게 되면서 주위에서지린성 을 꼭 가봐야한다고 하더라고요!? 고추짜장이 맛있다고요!! 그래서 아침부터 오픈하자마자 바로지린성 으로 갔답니다. [ 제가 방문한 날은 목요일이였습니다. 주말에 가면... ,썬이의 하루,https://blog.naver.com/suda930804,2021-09-13
"군산 여행시 점심은 고추짜장,짬뽕이 맛있는지린성추천",https://blog.naver.com/kem870706?Redirect=Log&logNo=222144848429,이번에 군산까지 왔으니 유명맛집지린성 에서 고추짜장을 맛보기로~ 주문마감이 4시까지라 서둘러 매장으로 향했다 가게 주변에 주차를 하고~ 꽤 넓은 매장 안 테이블이 꽤 많던지린성메뉴 일반 짜장면과 짬뽕... ,둘째음미,https://blog.naver.com/kem870706,2020-11-15
"호불호 갈리는지린성고추 짜장,맵찔이가 정복한 고추 짜장",https://blog.naver.com/cupid79m?Redirect=Log&logNo=222517239940,대장봉 등반에 지쳐서 입맛도 잃었는데 남편이 여기 때문에 군산을 온거라며 기어히 끌고 간지린성진짜 오늘 코스 지린다 공영 주차장에서 바라본지린성매장 바로 앞 횡단 보도를 건너면 오른편에 있는... ,날아라 스완댁,https://blog.naver.com/cupid79m,2021-09-26
군산 당일치기 /지린성/ 째보식당 / 경암동철길마을 / 커피면회소,https://blog.naver.com/phin9199?Redirect=Log&logNo=222534528819,#군산당일치기 # 지린성#째보식당 #경암동철길마을지린성인천 - 군산 시외버스 터미널에 도착해서 바로지린성 으로 고고.. 어언 2년만에 다시온 군산!!! 한글날 연휴 시작이라 그런지 사람이 엄청 많더라구요... ,혜니log,https://blog.naver.com/phin9199,2021-10-12
군산지린성고추짜장 설욕의 재도전 후기,https://blog.naver.com/ccma04?Redirect=Log&logNo=222236542737,"군산지린성고추짜장 설욕의 후기 내돈내산 2021. 01 .23 얼마 전 복성루에 이어지린성고추짜장에 도전했다 얕본 나머지 너무 매워서 반도 못먹고 GG쳐서 자존심 상했는데, 설욕을 하고자 다시 찾아 왔음.... ",Miller - 자동차 / 맛집후기 / 여행 / 내돈내산,https://blog.naver.com/ccma04,2021-02-08
군산지린성고추짬뽕 짜장 눈물콧물 쏘옥 끌리는 매운맛,https://blog.naver.com/imafreee?Redirect=Log&logNo=221739871624,군산지린성고추짬뽕 짜장 눈물콧물 쏘옥 끌리는 매운맛 지난주 1박2일 군산으로 위크샵을 다녀왔다.... 휴게소에서 간단히 군것질을 했지만 출출함은 여전히~~ 중식으로 선택한 점심메뉴 군산지린성고추짬뽕... ,현재에 집중하라!,https://blog.naver.com/imafreee,2019-12-17
"군산 당일치기 코스 (춘장대해수욕장,이성당, 지린성 ,카페틈)",https://blog.naver.com/brkklover?Redirect=Log&logNo=222499508906,점심으로 해물칼국수를 먹으려다가 마땅한 곳이 없어서 군산에는 중국요리집이 많아지린성 이라는... 커피는 맛있진 않았던 것 같다 군산 당일치기 코스로도 가볼만한 춘장대해수욕장 이성당지린성카페틈... ,스윗캔들,https://blog.naver.com/brkklover,2021-09-08
1박 2일 군산여행 │지린성- 진짜진짜 매웠던 고추짜장,https://blog.naver.com/moonjin_2?Redirect=Log&logNo=222241990722, 지린성후기를 남겨보아요 저 나름 불닭볶음면도 잘 먹는데 진짜진짜 매웠어요영업시간: 오전 9시 30분... 해줬던지린성많이 매웠지만 시간이 지나고 이렇게 쓰다보니 또 생각나네용 다음에 또 가면 또 먹고... ,Luna Log,https://blog.naver.com/moonjin_2,2021-02-13
군산지린성 (백종원의 3대천왕) 고추짜장,https://blog.naver.com/kirihokk?Redirect=Log&logNo=222300730238,길에지린성 으로 간판 오래된 느낌의 내공이 느껴지는 간판은 아니지만 점심 시간이 조금 지난 2시 이후... 너무 궁금한 집인데 먹을 수 있는 날이 나에게 올까..? ^______^ #군산 # 지린성#고추짜장 #백종원 #3대천왕,MINNINE LIFE,https://blog.naver.com/kirihokk,2021-04-06
군산지린성고추짜장 맛집! 주차는 바로앞에!,https://blog.naver.com/enfkalzn?Redirect=Log&logNo=222229588480,군산에 잠시 다녀왔어요 학생때부터 그동안 가봐야지가봐야지했다가 듣기만했지 못가봤던 군산맛집지린성다녀왔습니다♂️ 주차장은 바로 대각선에 한 20대정도 주차 가능한 주차장이 있어요.지린성 검색해... ,평화로움의 우쿨렐레 이야기,https://blog.naver.com/enfkalzn,2021-02-02
[군산] 고추짜장이 유명한 맛집지린성 ,https://blog.naver.com/amdm01?Redirect=Log&logNo=222538386266,안녕하세요 딸랑이 입니댜 군산은지린성먹으러 간다는 말이 있을정도로 유명하다고 해서 저도 다녀왔습미둥지린성영업시간 : 오전 9시30분 ~ 오후 4시 휴무 : 매주 화요일 저는 부산에서 출발해서 12시 30분쯤... ,ღ 소소한 일상 ღ,https://blog.naver.com/amdm01,2021-10-16
新 전자상거래로 지역발전 이끄는 中지린성 ,https://blog.naver.com/c-link?Redirect=Log&logNo=222535909606,한 청년 창업가(사진 오른쪽)가 지난해 5월지린성쓰핑(四平)시에 위치한 한 스튜디오에서 라이브커머스와 관련된 내용을 상의하고 있는 모습. [출처 신화통신] 리웨이(李偉)지린성부성장은 '제1회 중국 신... ,씨앤뉴스,https://blog.naver.com/c-link,2021-10-13
군산지린성고추짜장 내돈내산 후기!,https://blog.naver.com/yoondh613?Redirect=Log&logNo=222080155268,"군산지린성백종원의 3대천왕에서 고추짜장 맛집으로 방송된적이 있었고, 그전부터 매운짬뽕과 매운짜장으로 유명한 곳이였다. 한 7년전쯤? 친구랑 둘이 군산에 놀러가서 매운짬뽕을 먹겠다고지린성 에... ",씨씨커플,https://blog.naver.com/yoondh613,2020-09-04
"[국내][군산][2박3일] 군산 진갈비,지린성 , 이성당",https://blog.naver.com/skql54?Redirect=Log&logNo=222538865676,"다음 날 점심에 온 군산지린성점심시간인데도 평일이라 그런지 웨이팅이 없었다 불닭볶음면보다 매움.. 매운 건 둘째치고 내 입맛엔 별로,, 군산 이성당 본점 본점과 분점이 같이 붙어있는데 단팥빵과... ",영이의 영행블로그,https://blog.naver.com/skql54,2021-10-16
군산 이성당 빵집 야채빵지린성고추짬뽕,https://blog.naver.com/with4617?Redirect=Log&logNo=222150517106,"3대천왕 출연한 맛집지린성 에서 고추짬뽕 먹고, 줄서는 유명빵집지린성 에서 빵과 커피 한잔 하고... 아마도 코로나 때문에 줄서는 시간은 줄었을거라 생각하지만... 유명한 곳 빼고는 사람이 너무 없어서... ",자신에 대한 믿음,https://blog.naver.com/with4617,2020-11-21
군산여행_ 짬뽕 먹고 지린다. 매운 짬뽕지린성 ,https://blog.naver.com/pinkish?Redirect=Log&logNo=222249055024,"혹시 아는 분 계시면 댓글 ㅎㅎㅎㅎ 각설하고 군산에서 매운 짬뽕으로 유명한지린성 을 찾았다. (코로나19 터지기 한 참전에 방문했어요) 도착하자마자, 기다란 줄에 한 숨이 절로 나왔다. 동네 중국집이지만... ","Bonnie, 그리고 휘바홈",https://blog.naver.com/pinkish,2021-02-19
"군산여행 | 일단지린성 에서 고추짜장에 한번 지리고, 차는 두고... ",https://blog.naver.com/seungwook74?Redirect=Log&logNo=222519369307,"오늘의 한끼는지린성고추짜장 맛보다는 기다리는 줄에 지리고, 홀 내부에 피난민 처럼 다닥다닥 붙어서 먹는 모습에 한번 더 지리는 곳. 사진여행가 이승욱 찰나의 기억을... ",찰나의 기억을 남기다.,https://blog.naver.com/seungwook74,2021-09-28
"군산 여행_ 지린성 , 째보식당, 명궁칼국수",https://blog.naver.com/sulla77?Redirect=Log&logNo=222254135694,몇 년 전에 먹고 간지린성 의 고추짬뽕 맛을 잊지 못해 이번에도 가보았다. 딱 점심 시간 쯤 도착 했더니...지린성 에서 먹고 나면 옆 가게에서 파는 임실치즈 아이스크림 할인권을 준다. 나는 블루베리 맛을... ,명탐정의 영화와 하루,https://blog.naver.com/sulla77,2021-02-23
군산지린성고추 짜장,https://blog.naver.com/dacima02?Redirect=Log&logNo=222202086170,낮 12시 20분인데 군산지린성 은 줄을 서있네... 20분 정도 나도 줄을 섰다가 입장. 당연히 만석이겠지.... 볶음밥도 없고 여기 군산지린성 은 는 그냥 짜짱 짬뽕이다. 군산지린성고추짜장 고추짬뽕 아까 뽀빠이... ,여행과 맛집. 민쿡의 얌얌톡톡,https://blog.naver.com/dacima02,2021-01-09
"군산 맛집지린성 , 이성당",https://blog.naver.com/2bdabest?Redirect=Log&logNo=222539630021,군산 맛집을 검색해보니지린성 이란 중국집이 있어서 먹어보고 후기 남깁니다. 주말 점심시간이어서 그런지 사람들이 엄청많았어요.지린성문앞부터 줄을 섰는데 길건너편에도 줄서있는게 보이시나요?... ,모두 행복할 권리,https://blog.naver.com/2bdabest,2021-10-17
"군산지린성 !! 군산 고추짜장면,짬뽐밥! 고추 짜장면은... ",https://blog.naver.com/saddew86?Redirect=Log&logNo=222299681628,"군산지린성 !! 고추짜장면,짬뽕!! 고추짜장면에 반하다!! 전라북도 군산시 미원동 78 군산지린성063-467-2905 주차: 가능 군산 짜장면은 유명하죠!!지린성 에는 특별한 짜장면이 있어요. 그건 바로 고추짜장면!!... ","행복한 女 일상,여행 스케치",https://blog.naver.com/saddew86,2021-04-05
군산 먹으러왔다 # 지린성#덜맵게먹는법,https://blog.naver.com/gudth331?Redirect=Log&logNo=222101128221,군산지린성2회차 고추짜장 먹으러 군산 옵니다 웨이팅이 싫다면 오픈 시간 맞춰서 가기 전북 군산까지지린성고추짜장 먹으러 가는 사람이 있다? (접니다 ♀️) 고추짜장에 환장합니다.. 진짜 너무 맛있어요... ,"속지말자,무보정영상 블로그",https://blog.naver.com/gudth331,2020-09-27
 지린성- 그냥 쓰레기음식,https://blog.naver.com/younghj?Redirect=Log&logNo=222510176140,군산지린성중국집. 매운 맛으로 젊은이들에게 인기가 많은듯하다. 군산에 들어와서 차에 기름을 넣고...지린성건물이 가건물이다 주차장은 길 건너편 공영주차장을 이용하던가 아니면 골목길에 주차를... ,"좀머씨 이야기 - 본대로, 느낀대로, 그대로 쓴다.",https://blog.naver.com/younghj,2021-09-18
[군산]지린성 ,https://blog.naver.com/bisque1927?Redirect=Log&logNo=222031162796,지난번 담양여행이 끝나고 올라오는 길에 들른 군산지린성 . 원래는 전주에 갈까 했는데 이정표를 보고 군산갈까? 해서 군산으로 샜다. 군산에 유명한지린성 에 가서 점심을 먹고 이성당에 들러서 빵을 산 뒤에... ,효블로그,https://blog.naver.com/bisque1927,2020-07-15
"극강의 매운맛, 지린성 ",https://blog.naver.com/lihiten0124?Redirect=Log&logNo=222051355938,2015년인가 2016년인가 백종원의 3대 천왕을 보신 분이라면 기억할 만한 중국집지린성 을 소개해드립니다지린성 은 중국어로 길림성(吉林省)을 말하는 것 같은데 지금 드는 생각이 매운 맛이 지려서지린성 인가... ,반짝반짝 청춘,https://blog.naver.com/lihiten0124,2020-08-04
군산지린성고추짜장 핫한매움 굿,https://blog.naver.com/tyvtyv?Redirect=Log&logNo=222215785068,드 디 어 가보았숩니다^^ #군산 지린성 #고추짜장지린성 으루 가는길에 복성루도 봤지요! 드디어지린성도착^^ 주차는 건너편 공용주차장이용가능!! 평일이라 그런지 웨이팅없이 바로 입장가능 오예~~~ 고추짜장 1... ,이옙일상 ღ'ᴗ'ღ,https://blog.naver.com/tyvtyv,2021-01-22
군산맛집 중국집지린성짜장면 짬뽕 먹고왔어요!,https://blog.naver.com/sweetsea65?Redirect=Log&logNo=222500374839,"짬뽕 몇군데 유명한 곳이 있는데 그중에지린성 을 갔다왔습니다. 영업시간 매일 09:30~16:00 화요일휴무 재료소진시 조기마감!! 주차 옆에 공영주차장에서 하시면 됩니당! 줄이 엄청 길어요!! 고추 짬뽕 9,000 짬뽕... ",키키의 블로그,https://blog.naver.com/sweetsea65,2021-09-09
군산맛집지린성솔직후기 몇번만에 성공 주차장 추천메뉴 휴무,https://blog.naver.com/somakuri?Redirect=Log&logNo=222542754530,오늘 군산에서 제일 유명한 중식당지린성 에 다녀 왔어요. 전국에서 다 올 정도로 유명한 중식당이라... ㅎㅎㅎㅎㅎ지린성✴️알림-지린성10월 휴무 매주 화요일 임시휴무 13일(수) 27일(수) ➡️주 소: 전북... ,앙리누나의 자유로운 삶을 꿈꾸며~,https://blog.naver.com/somakuri,2021-10-20
[군산 미원동] 군산지린성고추짜장 솔직후기,https://blog.naver.com/jhp444?Redirect=Log&logNo=221657008552,"군산 중국집 ::지린성고추짜장 [서론] 결론만 궁금하다면 읽지 말고 패스하세요 군산 내려온지 4년차 이지만지린성 은 처음가봤어요. (왜냐하면, 시간과 에너지도 돈인데.. 웨이팅을 지양하는 저로서는 가볼... ","작은 나, 큰 포부",https://blog.naver.com/jhp444,2019-09-25
