title,link,description,bloggername,bloggerlink,postdate
"군산여행 고추짜장 맛집지린성주차, 웨이팅, 맛 솔직후기",https://blog.naver.com/22cej?Redirect=Log&logNo=222336497649, 지린성고추짜장 주말에 다녀온 군산 1박 2일 여행! 군산 여행가서 무엇을 먹어야 잘 먹었다고 소문이 날까~~ 싶어서~~~ 군산 맛집 파워 검색해서 간지린성 !!! 군산은 유독 중국집들이 많은데 그 중에서도... ,파루티로그 :D,https://blog.naver.com/22cej,2021-05-03
군산맛집 -지린성솔직후기 ( feat. 백종원의 삼대천왕 ),https://blog.naver.com/ohime728?Redirect=Log&logNo=222265483370,#군산맛집 #군산 지린성# 지린성 고추짜장 이번 #군산여행 의 첫 끼는 군산여행 검색하다가 알게 된 곳 # 지린성약 3~4년 전 백종원의 삼대천왕에 나온 군산 맛집으로 아직까지도 살벌한 웨이팅을 자랑하는... ,Mrs 히메 - 카르페디엠,https://blog.naver.com/ohime728,2021-03-05
"[군산] 군산 자유여행, 군산 당일여행,지린성고추짜장... ",https://blog.naver.com/ckfud217?Redirect=Log&logNo=222535048211,군산 고추짜장 맛집은 바로지린성이라는 곳입니다. 저희가 차로 지나갈 때부터 줄이 꽤 길게 서... 입장하면서 주문을 받는데 자리에 앉으면 바로 가져다주세요지린성 이 회전율이 빠르다고 듣긴 했는데 정말... ,로나리'S 블로그,https://blog.naver.com/ckfud217,2021-10-12
군산짜장면맛집지린성매운짜장면 대기없이 먹고 옴!,https://blog.naver.com/backhyang?Redirect=Log&logNo=222504275265,"저희가 밥 먹으러 간 곳은 군산의 유명한 짜장면 맛집지린성 입니다. 4시에 영업 끝나는데, 저희가... 군산짜장면맛집지린성 은 들어가보니 영업종료 시간이 한시간도 안 남았음에도 불구하고, 빈 테이블이 거의... ",Always SPRING*,https://blog.naver.com/backhyang,2021-09-13
여름휴가 | 부여시골집 | 군산당일치기 |지린성 +이성당,https://blog.naver.com/buriburisj?Redirect=Log&logNo=222508748157,빠르게지린성 으로 출발해봅니다! 이성당 다음으로 도착한 곳은 고추짜장 고추짬뽕으로 유명한 # 지린성이예요 작년에 이어 두번째 방문인데 이번엔 웨이팅없이 바로 들어갈 수 있었어요 일반짜장 / 일반짬뽕... ,부리의 새로운 세상,https://blog.naver.com/buriburisj,2021-09-17
"군산 맛집지린성 , 맛집 인정!",https://blog.naver.com/song871?Redirect=Log&logNo=222530988253,"군산 맛집지린성부모님과 군산 여행 중 둘째날 아침은 숙소 근처에 있던 지리성으로 gogo!!! *지린성주차정보지린성건너편에 공영주차장이 있어요. 주차비는 없고, 주차공간은 생각보다 협소해서지린성 ... ",/정이월드,https://blog.naver.com/song871,2021-10-08
"군산지린성꼭 보고가세요(맛,주차,대기)",https://blog.naver.com/esperando90?Redirect=Log&logNo=222478031625,사실 먹거리 탐험단으로써 #군산 지린성을 빼고 군산을 다녀왔다고 말할 수 없었다. 백종원의 3대... 그래서 오늘은 #군산맛집 포스팅 시작으로 군산지린성 의 주차를 포함해 이모저모를 담아보겠다. 주문과... ,소소한공작소,https://blog.naver.com/esperando90,2021-08-20
"군산지린성 , 먹고 지릴뻔..(?) 대기없이 다녀왔어요!",https://blog.naver.com/sevenlove__?Redirect=Log&logNo=222421375335,"군산지린성 , 먹고 지릴뻔..(?) 대기없이 다녀왔어요! 안녕하세요, 공간투어리스트 주미니입니다. 지난... 군산여행 다녀오셨던 분들 중 상당수가 줄이 너무 길어서 가지 못했을 정도로 유명한 군산지린성 을!... ",주미니는 투어중이니 ෆ,https://blog.naver.com/sevenlove__,2021-07-05
[군산 맛집 추천지린성 ] 고추짜장면과 짬뽕 먹었어요,https://blog.naver.com/dhlove72?Redirect=Log&logNo=222491943600,오늘은 일전에 다녀왔던 군산에서 먹었던 맛집인지린성 을 올려보도록 하겠습니다. 솔직히 저는... 맛집지린성 으로 고고씽 했습니다. 군산 맛집 추천지린성 에 도착했을 때 점심시간이라 정말 사람이 너무 많이... ,투자사랑 이다현,https://blog.naver.com/dhlove72,2021-09-01
한길문고 / 또또생곱창 / 은파호수공원 /지린성/ 까페미원동,https://blog.naver.com/atonement421?Redirect=Log&logNo=222477906947,"막날에는지린성다녀온 게 다라서ㅎ.ㅎ 군산에서 제일 유명한듯한지린성 . 메뉴판! 고추짜장밥, 고추짜장 이렇게 하나씩 시켰다. 오픈 전인데 미리 받아주셔서 ㅋㅋ 사람이 없음. 평일이라 그런 거 같기도 하고... ",A fateful life,https://blog.naver.com/atonement421,2021-09-03
군산지린성매콤함이 넘치는 중국집,https://blog.naver.com/jsjung1999?Redirect=Log&logNo=221987070980,"아침 9시 오픈하는지린성 을 문열자마자 박차고 들어서려다 조금 늦잠을 자고 휴게소에서 잠시 쉬고... 길건너에서 본지린성 의 모습은 지리고요, 오집니다. 아 이런 난해한 초딩개그를 하다니~ 사실 몇군데... ",양배추님 잘먹고 잘살기,https://blog.naver.com/jsjung1999,2020-06-02
"군산 미원동맛집, 고추짜장이 유명한지린성 ",https://blog.naver.com/s_eeeul?Redirect=Log&logNo=222541356681,•군산 미원동지린성 • #군산여행 #여행지추천 #국내여행추천 #대전근교여행 #군산맛집 #군산가볼만한곳 #군산데이트 #군산중국집 #군산짜장면 #군산고추짜장 #군산고추짬뽕 #군산 지린성# 지린성# 지린성 주차... ,스리로그,https://blog.naver.com/s_eeeul,2021-10-19
[매거진군산] 2021년 5월호 : 고추짬뽕과 고추짜장의 ‘ 지린성 ... ,https://blog.naver.com/magazinegunsan?Redirect=Log&logNo=222464358683,음식 맛있기로 소문난 군산에서 중국 음식인 짬뽕 하나로 전국의 마니아를 끌어모으고 있는 ‘ 지린성 ’을 찾아가 보았다. 고추짜장면과 고추짬뽕으로 유명세지린성 은 고추짜장면과 고추짬뽕이 유명한... ,매거진군산 공식블로그,https://blog.naver.com/magazinegunsan,2021-08-10
군산 맛집지린성회전율이 빠른 식당은 이유가 있다,https://blog.naver.com/mato1117?Redirect=Log&logNo=222509394366,군산에서 유명하고 멀리서도 저처럼 찾아오는 맛집입니다 # 지린성063-467-2905 전라북도 군산시 미원로 87 매일 09:30~16:00 재료소진시 조기마감 영업시간이 정말 독특합니다 #군산 지린성은 중국음식점인데... ,마토의 유부일기,https://blog.naver.com/mato1117,2021-09-17
군산 백종원지린성고추짜장,https://blog.naver.com/chjh1007?Redirect=Log&logNo=222267222321,복성루로 시작해서 빈해원 수송반점지린성 등 많은 중화요리집이 전국민적으로 유명세를 타서 많은 관광객들에세 사랑을 받았고 지금도 사랑을 받고 있는지는 잘 모르겠지만 오랜만에지린성 을 방문합니다.... ,최종분석의 분석없는 맛집 탐방기,https://blog.naver.com/chjh1007,2021-03-07
군산지린성오랜만이구나,https://blog.naver.com/youknow0203?Redirect=Log&logNo=222151205024,"다시 한번 찾아가서 먹어야지 하며 한해를 두번 보냈었고 어제 군산지린성 에 가서 고추짜장,짬뽕을... 군산지린성 에 외관 모습이며 앞쪽에도 사람들이 대기를 하고 있음을 볼수 있었고 아내와 저도 빨리... ",전주맛집 써니윤,https://blog.naver.com/youknow0203,2020-11-22
군산 가볼만한곳② ::지린성 /경암동철길마을/선유도 대장봉,https://blog.naver.com/fpassion21?Redirect=Log&logNo=222371938126,군산 가볼만한곳②지린성고추짜장/경암동철길마을 /선유도 장자도 대장봉 군산 당일치기 여행코스... 고추짜장먹으러지린성고고씽! https://blog.naver.com/fpassion21/222359989176 군산지린성 이에요. 앞에... ,일상 속 강희다움,https://blog.naver.com/fpassion21,2021-05-28
"1박2일 군산여행 코스 :: 무녀도, 대박실비집,지린성 ... ",https://blog.naver.com/mhy2286?Redirect=Log&logNo=222196304878,"1박2일 군산여행 코스 무녀도, 대박실비집,지린성 , 카페리즈, 이성당 2021년 새해복 많이 받으세요 작년... 군산지린성군산 로스팅카페 리즈 무녀도 카페 무녀2구마을버스 군산에서 첫 방문한 곳은 무녀도에... ",무니로드 :),https://blog.naver.com/mhy2286,2021-01-04
((전북군산// 지린성 ))정말... 드디어 먹어보고 왔어요:D ✿ 지린성 ,https://blog.naver.com/shalara_mint?Redirect=Log&logNo=222429394802,백종원의 3대천왕에서 처음 알게 된 군산의 고추짜장 맛집으로 유명한지린성 ~! 정말정말 너무 먹구... 바로지린성하나 때문이었습니다아 전화 ***-***-**** 주소 전라북도 군산시 미원로 87 영업시간 매일 09:30~16:00... ,누동이는 누동누동해 :D,https://blog.naver.com/shalara_mint,2021-07-13
군산지린성고추짜장 주차부터 대기시간 팁,https://blog.naver.com/kns2ar?Redirect=Log&logNo=222308600294,군산 맛집 ::지린성고추짜장 군산에서 유명한 고추짜장 맛집인지린성요번에 군산으로 여행 다녀와서 다녀와봤는데요 넘 맛있게 먹고 와서 소개해드릴게요!지린성주차장은 일단 가게 바로 앞에... ,알로그,https://blog.naver.com/kns2ar,2021-04-13
군산 맛집 * 군산 고추짜장 핫플 *지린성 ,https://blog.naver.com/wlgml0857?Redirect=Log&logNo=222371876281,"먹은 #군산맛집 #군산고추짜장 # 지린성포스팅!_! ㅋㅋㅋㅋㅋㅋㅋㅋ 그냥 군산맛집 검색하면 뜨는... ㅋㅋㅋㅋㅋㅋㅋㅋㅋ저 인파 뭐지 뭐긴뭐야지린성인파 ㅇ.ㅇ 애들이랑 어쩌지,,?? 하다가 그냥 온김에... ",헤 그냥 심심해소..ღ,https://blog.naver.com/wlgml0857,2021-05-28
군산여행 중식집 지린성 방문 그리고 고추짜장 후기,https://blog.naver.com/jus1992?Redirect=Log&logNo=222426011364,간곳지린성고속터미널에서도 도보로 10분이면 도착하는 거리이기에 금방 도착했네요 주말이면... 일반으로 주문하세요 입구에 있는 자판기커피 맛있네요 ㅎㅎ 이상입니다~~ #군산여행 # 지린성#고추짜장,jus1992 님의 블로그,https://blog.naver.com/jus1992,2021-07-09
[군산]군산여행/방문기록/갈만한곳/군산맛집/ 지린성 /이성당... ,https://blog.naver.com/nhhyy?Redirect=Log&logNo=222525353836, 지린성고추짜장 짬뽕 맵찔이 분들은 먹지맙시다ㅋㅋㅋㅋ 불닭보다 좀더맵고 엽떡 오리지널... 여행블로그 #군산 #군산여행 #군산맛집 #군산 #군산선유도 #gunsan # 지린성#고추짜장 #이성당 #야채빵 #경동철길... ,먹는 데 진심인 편,https://blog.naver.com/nhhyy,2021-10-03
군산 :: 고추짜장 지리는지린성 (feat.철판아이스크림),https://blog.naver.com/whtndnjs9?Redirect=Log&logNo=222403233043, 지린성주소 :: 전북 군산시 미원로 87 영업시간 :: 9시30분 ~ 16시(재료소진시까지) 휴무 :: 화요일 맞은편에 공영주차장ㅇ 군산하면지린성 이람서요? 맛이 지린다(?)길래 군산오자마자 냅따 달려갔어요~ 저흰 평일... ,Eat Pray Love,https://blog.naver.com/whtndnjs9,2021-06-19
군산지린성그다지 맵진 않아,https://blog.naver.com/dudwp42?Redirect=Log&logNo=222182457408,코로나 2단계 전에 다녀 왔던 군산지린성 에 대해서 포스팅을 써 보려고 해요. 제가 예전부터 너무 가고... 군산지린성 은 많은 분들이 아실 정도로 유명한 곳이지 않을까 생각이 들어요. 이름 :지린성 . 시간 : am... ,169.항상 웃는 남자,https://blog.naver.com/dudwp42,2021-01-02
"군산여행-히로쓰가옥,지린성 , 이성당, 새만금방조제",https://blog.naver.com/eunjibaig?Redirect=Log&logNo=222414387900,# 지린성평소 대기가 길었었나보다. 코로나 때문인지 아니면 우리가 평일에 방문해서 인지 대기는... #군산여행#군산적산가옥#히로쓰가옥#삼대천왕짬뽕# 지린성 #고추짬뽕#이성당야채빵#새만금방조제#선유도... ,Hello there,https://blog.naver.com/eunjibaig,2021-06-29
군산 맛집 중국집지린성고추짜장.2021-0616,https://blog.naver.com/ezcooler?Redirect=Log&logNo=222402812341,"2021년 6월 16일 수요일 #군산 #맛집 #중국집 # 지린성#고추짜장 먹어본 후기 군산에서 나름 유명한 중국집이 있다. #복성루 #수송반점 # 지린성#쌍용반점 #빈해원 복성루, 빈해원은 외지인이 찾는 맛집이고 수송반점... ",무풍 :: 바퀴+사진=여행+세상,https://blog.naver.com/ezcooler,2021-06-19
군산지린성소문듣고 왔어요 + 주차 80명 웨이팅 시간,https://blog.naver.com/woodong2435?Redirect=Log&logNo=222537561562,엄마 모시고 바람쐬러 다녀왔는데 매번 고민만 하다가 못가본 군산지린성드디어 방문! 웨이팅 길다고...지린성주차 역시 인기를 가늠케 했는데요.지린성위치는 군산남 초등학교 옆에 있습니다! 가게... ,매칭이의 요기조기♪,https://blog.naver.com/woodong2435,2021-10-16
군산 고추짜장 :지린성 에서 고추짜장짬뽕 후기 :) *,https://blog.naver.com/purmi07?Redirect=Log&logNo=222289823044,"테디베어 뮤지엄에서 나온 후지린성 으로 이동했다. 군산 여행을 시작하기 전 고추짜장을 파는 식당을 몇 개 알아뒀었다. 그 중 우리가 고른 곳은지린성 이었는데... 사실 별다른 이유는 없고, 당일 여행지에서... ",memoria,https://blog.naver.com/purmi07,2021-03-28
"[군산]지린성/ 고추짜장, 고추짜장밥, 고추짬뽕 중국집",https://blog.naver.com/moaian?Redirect=Log&logNo=222201113134,"이성당 다음으로 손님이 많을 것 같은 중식당 군산지린성 입니다. 고추짜장으로 유명한 중국집인데요... 그래도 매운 걸로 유명한지린성 인데 고추 짜장은 못 먹더라도, 고추짬뽕은 먹어야겠다고 호기롭게... ",이스터섬,https://blog.naver.com/moaian,2021-01-08
군산 짜장 짬뽕맛집지린성그리고 주차안내,https://blog.naver.com/taiji3025?Redirect=Log&logNo=222345494716,유명한지린성 에 가봤습니다. 가게 규모도 복성루보다 크고 웨이팅을 따로 관리하시는 분이 있어서 인지 복성루 방문때보다는 지루함 없이 기다렸던거 같습니다.지린성주차장 주차장은 따로 없고 바로앞에... ,변두리 잡지책,https://blog.naver.com/taiji3025,2021-05-10
군산 맛집 또 생각나는지린성웨이팅내돈후기,https://blog.naver.com/supia2728?Redirect=Log&logNo=222446147047,"맛집지린성전북 군산시 미원로 87 매일 9:30~16:00 (재료 소진 시 조기마감) 대표 메뉴 : 고추짜장 9,000원 늦게 가면 먹기 힘들다는 군산 맛집지린성헛걸음 하기 싫어서 오픈어택 할까 생각했지만 위가 나약한... ","피부를디자인하는여자, 지니츄의 블로그",https://blog.naver.com/supia2728,2021-07-26
"군산 여행 5편. 경암동 철길마을,지린성고추짜장 고추짬뽕",https://blog.naver.com/hyehwa_alice?Redirect=Log&logNo=222535087167,"경암동 철길마을,지린성고추짜장 고추짬뽕 안녕하세요~ 혜화동엘린 윤재원입니다. 오늘은 빵솜이랑 군산 여행 5편을 포스팅합니다~ 경암동 철길마을과지린성 . 정말 유명한 군산의 명물들이죠! 1편에서... ",혜화동 앨자매ll혜화동 엘린,https://blog.naver.com/hyehwa_alice,2021-10-17
# 군산 여행 코스지린성고추짜장,https://blog.naver.com/minijunior?Redirect=Log&logNo=222480476342,꼭 한 번은 가보고 싶었던지린성 ! 너무 유명해서 그런지.. 줄이 너무 길어서 갈 수 있을까? 했는데 조금 부지런히 갔더니 웨이팅 없이 바로 성공!지린성군산에는 유명한 중국집이 많은데 특히 해산물이... ,낭만빵순희의 지구별여행,https://blog.naver.com/minijunior,2021-08-22
군산여행 미원동 맛집 -지린성고추짜장 + 짜장면 조합 맵지만... ,https://blog.naver.com/jsd05?Redirect=Log&logNo=222456338401,"카페 라파르 가기전에 밥으로 먹었던지린성 입니다. 중,고등학교를 군산에서 보냈건만... 학교- 집만 해서 ㅋㅋ 군산을 잘 몰라요 몇년전에 복성루는 가봤었고,지린성 은 못가봐서 이번에 가봤습니다.지린성 은... ",마케바이저 블로그,https://blog.naver.com/jsd05,2021-08-04
[군산 맛집] 웨이팅 필수 맛집인 순돌이곱창/지린성 ,https://blog.naver.com/baeyeona?Redirect=Log&logNo=222541810817,그리고 그 담날은 아침부터지린성 을 먹으러 갔다! #군산 하면 # 지린성이자나요?? 웨이팅이 쩐다고 하여 아침에 고고!지린성전용 주차장도 길건너에 이따 ㅋㅋㅋ 다행히 웨이팅을 하긴했지만 회전율이 굉장히... ,Kathy's story,https://blog.naver.com/baeyeona,2021-10-19
"당일치기 군산여행( 지린성 ), 선유도(고래포차), 장자도(대장봉)... ",https://blog.naver.com/lemoniaa91?Redirect=Log&logNo=222496847741,"코스 :지린성친구들이 말하길 군산에 있는 유명한 중식당은 오전어택 하는게 나아., 매우니까 쿨피스나 우유 사가 친구들 말 잘 듣고 우유 구입해서 9시 58분에지린성 에 도착했다. 맘 편히 먹으려고 8시쯤... ",리아의 6시 다이어리,https://blog.naver.com/lemoniaa91,2021-09-06
"군산 고추짜장 맛집지린성후기 / 주차 만석, 30분 웨이팅!",https://blog.naver.com/aaa9a?Redirect=Log&logNo=222485674908,"군산 고추짜장 맛집지린성후기 / 주차 만석, 30분 웨이팅! 내일 제주도 여행을 떠나기 전, 지난 군산... 군산의 숱한 고추짜장 맛집 중에서도 가장 유명 궤도를 달리는 '군산 고추짜장 맛집지린성 '지린성주차... ",MA.INT,https://blog.naver.com/aaa9a,2021-08-27
[군산 맛집]지린성 ... 고추짜장 맛집 인증~!,https://blog.naver.com/jsea2000?Redirect=Log&logNo=222260279086,"중국집지린성건너편 공영주차장을 이용하라두만 이 정도 인파니 당연히 만차... 주변 골목길에도...지린성대표메뉴인 고추짜장, 고추짬뽕 호불호가 있다길래... 안전빵으로 일반짜장도 하나 매운맛 돌바구가... ",Castorpollux!!!,https://blog.naver.com/jsea2000,2021-03-01
군산 맛집은 역시지린성 ,https://blog.naver.com/dbtmd7942?Redirect=Log&logNo=222371415480,점심에 뭐 먹을까 하다가 급지린성매운짜장이 생각났어요 ㅋㅋ 그래서 40분정도? 차를 달려서 군산지린성 으로 갔습니다지린성건너편쪽에 공영주차장이 있는데요지린성손님들로 거의 만차이긴한데... ,박아리따움s,https://blog.naver.com/dbtmd7942,2021-05-29
군산 고추짜장지린성- 맵찔이의 후기,https://blog.naver.com/storyshower?Redirect=Log&logNo=222360457996,“ 지린성고추짜장 먹으러 군산까지갔어” 라며 사진을 보내준 친구에게 영업당해서 가게된 군산여행... 먼지린성 도 찍어보고 ㅋㅋㅋㅋㅋ 오오 이제 거의 다왔다!! 이곳은 쌉싸름하게 매콤한 고추짜장이... ,Sun's story,https://blog.naver.com/storyshower,2021-05-21
" 군산지린성영업시간, 주차,메뉴추천, 가격 + 얼마나... ",https://blog.naver.com/sinhyhj?Redirect=Log&logNo=222180615302," 군산지린성영업시간, 주차, 메뉴추천, 가격 주소 - 전북 군산시 미원로 87 영업시간 - 매일 09:30 - 16... 군산지린성군산에서 서울로 상경한 친구가 꼭 가보라고 추천해준 곳이에요 !! 웨이팅이 워낙 길고... ",신자매 블로그,https://blog.naver.com/sinhyhj,2020-12-21
군산여행:: 지린성 ,https://blog.naver.com/llleyj?Redirect=Log&logNo=222104625755,나도 관광객 모드로 맛집을 찾아다녔다 여행 2일 째 아침은지린성평일에도 주말에도 줄서서 먹는 집인걸 알아서 오픈 시간 전에 미리 가기로! *오픈 시간 : 오전 9시 30분지린성대각선 맞은편에 공영주차장이... ,말이야 염방구야!,https://blog.naver.com/llleyj,2020-10-01
"[전북 군산] 불맛 가득한 군산 맛집, 순돌이곱창 그리고지린성 ",https://blog.naver.com/dbuiir1231?Redirect=Log&logNo=222506922232,"짬뽕맛집,지린성오전 11시 좀 넘어 도착했는데도 사람들 바글바글.. 12~13시 피크타임은 무조건 웨이팅...지린성나오자마자 보이는 편의점에서 아이스크림으로 속 달래기 이거 먹어도 속이 계속 아파서... ",예제마 블로그,https://blog.naver.com/dbuiir1231,2021-09-15
"군산지린성 : 매운짜장, 짬뽕",https://blog.naver.com/skandi5?Redirect=Log&logNo=222301826005,있는 # 지린성으로 옮겼습니다. #군산맛집 #군산짬뽕 # 지린성 주차지린성주차는 옆에 공영주차장에 하면 되어요. ( 지린성 에서 바로 좌회전하면 있음) # 지린성 웨이팅지린성 은 딱보면 #웨이팅 적어보이는데... ,양띠사람,https://blog.naver.com/skandi5,2021-04-07
"군산 맛집 추천, 군산 여행, 고추짜장 멋집지린성 . 군산지린성 ",https://blog.naver.com/dkdkdk4321?Redirect=Log&logNo=222347806449,군산의 맛집으로 알려져있는 군산지린성 에 방문했다. 고추짜장과 고추짬뽕으로 유명하다고 한다.... 줄을 서서 기다리는 동안지린성근처에 위치한 아이스크림 가게에서 영업을 하신다. 할인쿠폰을 나눠주시며... ,빠방이,https://blog.naver.com/dkdkdk4321,2021-05-12
군산맛집 -지린성 ,https://blog.naver.com/shelove0?Redirect=Log&logNo=222315671114,핫한 # 지린성13시 넘어서 도착했는데 운 좋게 자리 1테이블이 남아있어서 거의 바로 착석했습니다 기본... 볼거리도 꽤 있고 재미져요 _ #경암동철길마을 #군산여행 #뽑기 #달고나 #고추짜장 #고추짬뽕 # 지린성 ... ,さようなら、いつか＿,https://blog.naver.com/shelove0,2021-04-19
"# 군산 가볼만한 곳 여행코스 추천 :지린성 , 옥녀교차로, 이성당... ",https://blog.naver.com/minijunior?Redirect=Log&logNo=222493056079,군산맛집지린성군산은 유명한 중국집이 많은데.. 그 중 가장 유명한 곳이지린성 이 아닐까 생각함! 암튼지린성꼭 한 번 가고싶었는데 이번에 다녀와서 넘 좋았음 ^_^ 넘 맛있으니까 군산갈때마다 종종... ,낭만빵순희의 지구별여행,https://blog.naver.com/minijunior,2021-09-02
군산투어지린성신민회 팔도실비집,https://blog.naver.com/matuki?Redirect=Log&logNo=222526576112,"군산의 대표 맛집 중 하나로 꼽히는지린성 입니다. 예전에 한번 가보고 실망했던 기억이 있는데, (짜장면이었어요)지린성리뷰가 하도 많아서 다시 도전해보기로 했어요. 이른시간에 가서 20분 정도 대기하고... ",슬로보트,https://blog.naver.com/matuki,2021-10-04
군산지린성고추짜장 존맛탱 이거 먹으러 군산 다녀왔지요,https://blog.naver.com/7744thdus?Redirect=Log&logNo=222367894853,정확히 말하면 군산지린성고추짜장 먹는 게 나의 버킷리스트 중 하나였다. 인스타에서 본 고추짜장... 드디어 군산지린성 에 왔다 !! 바로 앞에 공영주차장은 무료인데 월요일 오전일찍갔음에도 (11시) 자리가... ,맛집 여행 다니는 소야 _ FOOD TRAVELER,https://blog.naver.com/7744thdus,2021-05-26
뚜벅이 전북 여행 추천 코스 - 군산 당일치기 ( 지린성 ... ,https://blog.naver.com/jbgokr?Redirect=Log&logNo=222488775527," 지린성 , 초원사진관, 이성당, 경암동철길마을 * 방역수칙을 준수하며 취재를 진행하였습니다*지린성- 전북 군산시미원로 87화요일 휴무-매일 09:30 – 16:00 재료 소진 시 조기 마감 역시 여행의 첫 시작은... ",전라북도 공식 블로그,https://blog.naver.com/jbgokr,2021-08-30
"전북 군산 고추짜장 전문점,지린성 ",https://blog.naver.com/toy3987?Redirect=Log&logNo=222484205483,#전북 #군산 도착하자마자 # 지린성으로 갔습니다. sns나 TV에서 굉장히 유명한 곳이더라구요! #고추짜장 전문점 입니다. 주차는 바로 앞에 있는 #군산남초등학교 옆에 공영주차장이 있어요. 근데 차를 많이는 댈... ,쀼의 인생 2막,https://blog.naver.com/toy3987,2021-08-26
군산맛집지린성고추짜장면!,https://blog.naver.com/ihaveej?Redirect=Log&logNo=222349316654,#군산여행 갔다가지린성 의 고추짜장이 그렇게 끝내준다고!!! 찾아찾아 갔습니다 바로앞에... 가세욬ㅋㅋ지린성메뉴판!!! 고추짜장과 그냥짬뽕!! 고추짜장이 많이맵다고들어서 짬뽕까지매우면 쉴 타임이... ,코코로코의 일상생활,https://blog.naver.com/ihaveej,2021-05-22
중국지린성 (吉林省)의 작은 경상도마을 '아라디촌(村)'...... ,https://blog.daum.net/chunhao/14326402,"중국지린성 (吉林省)의 작은 경상도마을 '아라디촌(村)'... ('11.8.15) 댓글 2 中原의 바람소리.../中國 有情無限 2020. 8. 10. 길림성의 작은 경상도 마을 , 재중동포 , 조선족 , 지린시 아라디촌 중국지린성 ... ",萬年雪/永劫의 約束...,https://blog.daum.net/chunhao,2020-08-10
