title,link,description,bloggername,bloggerlink,postdate
 춘천 산속에 닭갈비/ 춘천 숯불닭갈비 맛집,https://blog.naver.com/csb6342?Redirect=Log&logNo=222458450437,2021.07.31 춘천 닭갈비 맛집을 찾아보다가 고른춘천 산속에 닭갈비 ! 이름 그대로 산속에 있는 닭갈비집이었다 #산속에닭갈비 # 춘천산속에닭갈비산 속 깊숙한 곳에 있는 큰 닭갈비집... ,숩스라이프,https://blog.naver.com/csb6342,2021-08-05
[춘천닭갈비맛집]춘천산속에닭갈비 ,https://blog.naver.com/khn0319?Redirect=Log&logNo=222279497659,춘천닭갈비맛집인춘천산속에닭갈비 는 자리에 앉으시면 미리 반찬을 세팅해주시고 부족한 반찬들은 셀프코너에서 깔끔하게 가져다가 먹을수 있어요! 여은파 4명의 예약자리가 너무 제 이름 떡하니 표시되어... ,킴하요의 기록Hayo!,https://blog.naver.com/khn0319,2021-03-18
 춘천 맛집_ 산속 의닭갈비찐친절이란 이런 것,https://blog.naver.com/loveyoda23?Redirect=Log&logNo=221801172791,가본 닭갈비집 검색하다가 네이버예약 덕후인 나에게 눈에 확 들어온춘천 산속에 닭갈비 . 네이버예약 시 메밀전 서비스도 주신다하여 예약해보았다~~ 정말 산 속에 있는 춘천맛집 ㅋㅋㅋㅋ 주차장은 위편에... ,day by day,https://blog.naver.com/loveyoda23,2020-02-08
 춘천여행닭갈비맛집산속 의 닭갈비이쁘고 맛있고 여유롭고~,https://blog.naver.com/cisaceclean?Redirect=Log&logNo=222516258203, 춘천닭갈비맛집산속에닭갈비 는 여러 건물이 있어서 단체 손님들이 가능해요. 그래서 가족단위 손님들이 특히 더 많이 오시는 편입니다. 특히 본 건물 바로 옆에 카페가 있는데 셀프카페라서 식사 하시고... ,남산부부,https://blog.naver.com/cisaceclean,2021-09-25
 춘천산속에닭갈비 ,https://blog.naver.com/eehyeonju?Redirect=Log&logNo=222505077640,음식먹는 내내 창밖 풍경이 보여서 좋다 무료카페 카페 안에서 바라본 마당 드라마 비밀의 남자 촬영지 였다네요~ 옥으로 만든 장신구들 커피와 차 # 춘천닭갈비# 산속에닭갈비# 춘천 맛집 # 닭갈비 맛집... ,별을그리다,https://blog.naver.com/eehyeonju,2021-09-14
 춘천 산속에닭갈비가평 카페 아우라 청평호 뷰 카페 나들이,https://blog.naver.com/88sylove?Redirect=Log&logNo=222522014891,#추천날씨 #강원도춘천가볼만한곳 #춘천맛집 #춘천닭갈비 #춘천닭갈비추천 #춘천닭갈비맛집 #주차가능춘천닭갈비 #산속에닭갈비 # 춘천산속에닭갈비#춘천가볼만한곳 #가평가볼만한곳 #가평나들이 #가평카페... ,또용이의 하루하루♥,https://blog.naver.com/88sylove,2021-10-01
 춘천찐 맛집닭갈비/ 무조건 숯불산속에닭갈비 ,https://blog.naver.com/hwangsajoo?Redirect=Log&logNo=222419694120, 춘천가족외식으로 좋은닭갈비/ 무조건 숯불산속에닭갈비# 춘천 맛집 # 춘천 찐맛집 # 닭갈비 맛집 # 춘천 닭구이 # 춘천닭갈비#온의동맛집 #내돈내산 오늘은춘천 하면 뭐?닭갈비 !!!!닭갈비 가 우리가 아는... ,품평일기장,https://blog.naver.com/hwangsajoo,2021-07-04
"생생정보통 된장닭갈비 메밀막국수춘천산속에닭갈비 , 참복찜... ",https://blog.naver.com/wjddkdiazz?Redirect=Log&logNo=222358612318,강원도 춘천시에 위치한춘천산속에닭갈비음식점이 나왔습니다. 인기메뉴는 된장닭갈비와 메밀막국수이며 산속에 온 듯 아늑한 자리에서 맛있는 닭갈비와 막국수를 맛볼 수 있어 외식메뉴로 너무... ,놀러오세요~,https://blog.naver.com/wjddkdiazz,2021-05-20
 춘천 에서의 점심 ::산속에닭갈비 에서 철판 닭갈비먹고 왔어요,https://blog.naver.com/elly2211?Redirect=Log&logNo=222264480443,거 생각하면 생각해 볼 만한 그런 곳이었답니다ㅋㅋㅋㅋㅋ 그럼 오늘 포스팅은 여기까지예요~ # 춘천닭갈비 맛집 # 산속에닭갈비#주차장넓은 닭갈비 집 #철판 닭갈비#숯불 닭갈비# 춘천 드라이브 #주말근교드라이브,김다람의 도토리상자 속 구경하기★彡,https://blog.naver.com/elly2211,2021-03-05
 춘천 여행이라면춘천 맛집 여기요춘천산속 의닭갈비 ,https://blog.naver.com/dmspeheh?Redirect=Log&logNo=222439371559,#닭갈비맛집 #춘천닭갈비 #강촌맛집춘천산속에닭갈비메뉴 및 가격표 철판 양념닭갈비 12000원 숯불 소금 닭갈비 12000원 숯불 간장 닭갈비 12000원 숯불 양념닭갈비 12000원 숯불 된장닭갈비 12000원 막국수 7000원... ,기므네 잡화점의 기적,https://blog.naver.com/dmspeheh,2021-07-21
 춘천 / 산속에 닭갈비 ]다른집들과 비슷한 맛의 양념닭갈비,https://blog.naver.com/jhgzz?Redirect=Log&logNo=222296587652,곳이 춘천에 새로이 터를 잡기 시작한 # 춘천산속에닭갈비이제 신생 음식점이라선지 입구에 있는... 왼편으로는 닭갈비를 구워먹을수 있는 코너이고 ~~~ 오른쪽으로는 철판닭갈비를 드실수 있는곳 선택하는 요리... ,너나나나,https://blog.naver.com/jhgzz,2021-04-02
" 춘천숯불 닭갈비맛집, 분위기 좋은산속에닭갈비 에서 맛있게... ",https://blog.naver.com/lovesuns89?Redirect=Log&logNo=221705616952,#춘천맛집 #춘천닭갈비 #춘천숯불닭갈비 #숯불닭갈비맛집 #춘천맛집추천 #춘천닭갈비맛집추천 #춘천분위기맛집 #춘천가볼만한곳 # 춘천산속에닭갈비#산속에닭갈비 #춘천산닭 잇님들 안뇽하세요 : ) 주말은 잘... ,명자의 행복로그,https://blog.naver.com/lovesuns89,2019-11-12
[ 춘천 / 닭갈비 ]산속에 닭갈비 ,https://blog.naver.com/cckcr?Redirect=Log&logNo=222155877856,"장소 제공뿐 아니라 의료진을 위해 식사를 대접하기도 했다.춘천 의 명소로 만들고 싶다는 다짐처럼,닭갈비 의 맛을 챙기면서도 풍경과 지역 상생 행보 모두 아름답게 돋보인다. 위치 옛경춘로 562-22 문의 242-8895",춘천교차로 Blog,https://blog.naver.com/cckcr,2020-11-27
숯불된장 닭갈비춘천산속에 는닭갈비 가 유명해요,https://blog.naver.com/qib8j3cdthbp?Redirect=Log&logNo=222312748948,이라는 톡 하나에 움직이기 시작한 3명의 무리들 단순히 동네에 있는 식당이 아니라 본격 숯불된장닭갈비를 찾으러 춘천에 있는춘천산속에닭갈비 라는 가게까지 다녀왔습니다 크크 이전부터 자주 갔던... ,파란 행성,https://blog.naver.com/qib8j3cdthbp,2021-04-17
"당일치기춘천 여행( 산속에 닭갈비대박!, 소양강스카이워크... ",https://blog.naver.com/hjwoo0429?Redirect=Log&logNo=221773540334," 춘천 행 기차에서산속에 닭갈비광고를 봤는데 한 번 가보기로~^^ 남 춘천 역에서 택시로 6,000~7,000원 거리. 세 명인 우리는 철판 닭갈비2인분, 숯불소금닭갈비 구이 1인분, 숯불간장닭갈비 구이 1인분을 시켰다.... ",One day,https://blog.naver.com/hjwoo0429,2020-01-16
기대에 부응해준춘천닭갈비맛집산속에 닭갈비 ,https://blog.naver.com/l0vu12?Redirect=Log&logNo=222077050747,춘천온의동숯불닭갈비추천 # 춘천산속에닭갈비#온의동산속에닭갈비 #춘천온의동산속에닭갈비 #춘천온의동산속에닭갈비추천 #춘천숯불닭갈비 #온의동숯불닭갈비 #춘천온의동숯블닭갈비... ,♨ 파워술로거 ♨,https://blog.naver.com/l0vu12,2020-09-02
 춘천 산속에 닭갈비맛집 추천요~!많이 드시러 오세요 춘천... ,https://blog.naver.com/ww6524?Redirect=Log&logNo=222541036275,안녕하세요~~ 오늘은산속에 닭갈비포스팅 할까 합니다.닭갈비좋아 하시나요?철판닭갈비 .숯불닭갈비다들 드셔 보셨을겁니다.. 하지만 여기산속에 닭갈비좀 특이하고 맛이 있어서 포스팅 합니다..하하하... ,블루배관,https://blog.naver.com/ww6524,2021-10-18
[ 춘천 ]산속에 닭갈비 ,https://blog.naver.com/nomnol?Redirect=Log&logNo=221722764247, 닭갈비맛집 - 숯불/철판 택일 가능 - 서브될때 땟갈 보고 느낌 왔음. 맛있음 - 엄청 친절. 계산하시는 사장님 천절 각도가 장난이 아니셨음 ㅋㅋㅋㅋ 왕친절 # 춘천 맛집 # 닭갈비 맛집 # 춘천닭갈비 맛집 # 산속에닭갈비 ,사소한 감흥들,https://blog.naver.com/nomnol,2019-11-30
" 춘천 맛집, 산속에닭갈비 ,숯불 닭갈비 ,막국수,냉메밀국수",https://blog.naver.com/pchuna?Redirect=Log&logNo=222366482089,"점심은 인터넷으로 맛집을 검색해 ' 산속에닭갈비 '를 네이버로 숯불 닭갈비 로 예약했다. 네이버로 예약하면 메밀파전을 서비스로 준다. 숯불 소금,간장,된장,매콤닭갈비 를 골고루 주문해 먹었는데 다 맛있긴한데... ",서울 교토 어울림,https://blog.naver.com/pchuna,2021-05-25
생생정보 된장 닭갈비 메밀막국수비법24시 춘천산속에닭갈비 ,https://blog.naver.com/lalalabird?Redirect=Log&logNo=222358728822,메밀막국수와 함께 먹는 숯불닭갈비 매콤함을 더해주는 비법 양념장이 들어간 메밀막국수 밤에 더 아름다운 풍경 # 춘천산속에닭갈비강원도 춘천시 옛경춘로 562-22 ☎ 033-242-8895 ※ 영업시간은 오전... ,소소하지만 행복한 맛 정보,https://blog.naver.com/lalalabird,2021-05-20
"[ 춘천맛집]산속에 닭갈비-산속에 서 먹는닭갈비+ 메뉴, 위치",https://blog.naver.com/limbr83?Redirect=Log&logNo=221771021152,바람쐴겸 춘천을 다녀왔어요 ㅋㅋㅋ 열심히 검색하다 찾은 산속에 닭갈비 ! 이름대로 정말 산 ? 안쪽에... 가보시는거 추천드려용♥ #춘천닭갈비 #춘천닭갈비맛집 # 춘천산속에닭갈비#산속에닭갈비 #남춘천맛집,daily moment,https://blog.naver.com/limbr83,2020-01-14
"털어라, 숯불 된장 닭갈비메밀 막국수집춘천 산속에 닭갈비 ",https://blog.naver.com/jmjm3060?Redirect=Log&logNo=222358837446,"24시 밥상을 털어라, 숯불 된장 닭갈비메밀 막국수집춘천 산속에 닭갈비추천합니다. #생생정보비법24시 #밥상을털어라 #숯불된장닭갈비 #메밀막국수맛집 #춘천닭갈비맛집 #라데나cc맛집 # 춘천산속에닭갈비 ",도곡동 김여사,https://blog.naver.com/jmjm3060,2021-05-20
 춘천맛집 예쁜 정원이 있는산속에닭갈비네이버예약해,https://blog.naver.com/ariari4860?Redirect=Log&logNo=222020135767,고기맛도 좋았고 네이버 예약을 하며 파전 서비스까지 받을수 있어서 더 마음에 들었죠. 숯불 닭갈비진짜 맛있게 잘하는 곳이랍니다. # 춘천 맛집 # 산속에닭갈비# 춘천닭갈비#숯불 닭갈비# 춘천 여행 # 춘천 ,맛있는 음식먹고 여행하며 운동하는 아리아리R ♡,https://blog.naver.com/ariari4860,2020-07-03
 춘천맛집산속에 닭갈비 ,https://blog.naver.com/boboro8?Redirect=Log&logNo=222036053805,돌아와서 마라샹궈에 맥주 한잔하고 싶어서 라공방에서 마무리 쉬는 날은 너무 좋다! 20MAR03 #산속에닭갈비 #춘천맛집 #춘천닭갈비 #닭갈비맛집 # 춘천산속에닭갈비#강원도맛집 #춘천여행 #김유정역 #춘천가볼만한곳,✨뽀로 일기✨,https://blog.naver.com/boboro8,2020-07-20
 춘천숯불닭갈비맛집 발견!산속에 닭갈비존맛탱~,https://blog.naver.com/karisma9013?Redirect=Log&logNo=222395848195,숯불닭갈비 맛집을 골라서 찾아가 보았어요. 제가 찾아가 본춘천 산속에 닭갈비 라는 맛집의 지도입니다. 춘천 온의동(옛경춘로)에 위치하고 있어요.춘천 산속에 닭갈비식당 초입에 꽤 넓고 큰 식당 이용객... ,엄살돼지의 Happy Life,https://blog.naver.com/karisma9013,2021-06-13
 춘천사람도 좋아하는닭갈비집 ♡춘천닭갈비맛집산속에 ... ,https://blog.naver.com/klwfklwf?Redirect=Log&logNo=221785663017," 산속에닭갈비정말산 속에있는닭갈비집이다~ 소문만 듣다가 처음 방문!! 보이는 문으로 들어가면... 같다춘천 에닭갈비집은 많지만 재방문 하고 싶은 곳은 많지 않은데 타지에서 온 손님 대접 할 때, 그리고... ",오늘도 하늘나라는 안녕하지~?,https://blog.naver.com/klwfklwf,2020-01-26
"[ 춘천 ] 숯불/철판, 원하는대로 구워먹는닭갈비맛집... ",https://blog.naver.com/ji00_park?Redirect=Log&logNo=222480237493,저= 닭갈비 를 기다릴 가족들을 향해 ㅎㅎ 오늘 맛있게 먹었어요 5명이서 부족할까싶었는데 먹성좋은 가족도 3인분 배부르게 먹음 ㅎ산속에 닭갈비굿 # 춘천# 춘천 여행 # 춘천 맛집 # 춘천 핫플 # 춘천닭갈비 ... ,유료(有聊)한 일상,https://blog.naver.com/ji00_park,2021-08-22
"맛있는춘천닭갈비맛집,산속에 닭갈비 !(네이버 예약시 파전이... ",https://blog.naver.com/elsa15?Redirect=Log&logNo=222041525962," 산속에 닭갈비 는 주차걱정도 없고 숯불 닭갈비 , 철판 닭갈비둘 다 판매중이고, 직원분들도 다들 친철하셔서 다시춘천 가도산속에 닭갈비방문할거 같음춘천 에서닭갈비드실분들춘천닭갈비맛집... ",나는야 럭키걸,https://blog.naver.com/elsa15,2020-07-30
 춘천현지인 추천산속에 닭갈비깔끔한 맛!,https://blog.naver.com/6260283?Redirect=Log&logNo=222137519190,공간이 좀 유난히 큼 ㅋㅋㅋㅋㅋㅋㅋㅋㅋㅋ *진짜 귀여운 고양이있음* 이상 #내돈내산 후기 끝! # 산속에닭갈비# 닭갈비 맛집 # 춘천닭갈비# 춘천닭갈비 추천 #온의동 닭갈비#통나무 닭갈비 별로 # 산속에닭갈비 내돈내산,♡알콩달콩 신혼이야기 ♡,https://blog.naver.com/6260283,2020-11-06
 춘천닭갈비산속에 서 먹어봤니?산속에 닭갈비산닭!,https://blog.naver.com/gene_k?Redirect=Log&logNo=221752251022,"주차를 하고 내려가면서 저 멀리 보이는 산속에 닭갈비를 찍어 봤다.춘천 산속에 닭갈비 , 줄여서 춘천 산닭 추운 겨울이라 곳곳에 비닐을 덮어둔 모습이 다소 어수선하긴 했지만 전체적으로 잘 꾸며놓은 공간.... ","젠타의 ""너 맛집맞아?""",https://blog.naver.com/gene_k,2019-12-30
춘천 닭갈비/숯불 닭갈비/춘천 산닭/ 춘천 산속에 닭갈비 ,https://blog.naver.com/qp2030?Redirect=Log&logNo=222366874898,춘천 닭갈비 맛집 춘천 산닭 [산 속에 닭 갈비] 춘천이 생각보다 가깝고 시간이 차안밀 리니 1시간만에... 친구랑춘천 산속에 닭갈비정말 맛있게 먹고왔어요 산속에닭갈비 주소 #춘천 닭갈비 # 춘천 산속에 닭갈비 ... ,유지니,https://blog.naver.com/qp2030,2021-05-25
강원도여행D-1(나무아래오후N/ 춘천산속에닭갈비 /해피초원목장... ,https://blog.naver.com/lecielyeon?Redirect=Log&logNo=222074446570,비가와서 춘천쪽으로 바꿨다. 우선 가는길에 들렸던 가평 나무아래오후N 디저트 종류도 다양하고 카페... ㅎㅎㅎ춘천 산속에 닭갈비 ! 언니가 회사분께 추천받아 가게된곳인데....ㄹㅇ 존맛탱 닭갈비 3인분... ,기록,https://blog.naver.com/lecielyeon,2020-08-29
 춘천골목식당 아닌산속에 닭갈비 ,https://blog.naver.com/rinjoo_?Redirect=Log&logNo=222040791990,#춘천골목식당 #아닌산속식당 #춘천닭갈비 #산속에닭갈비 #춘천여행 블로그에 방문해 주셔서 진심으로... 보다춘천 산속에 닭갈비 를 방문해보시는 게 어떨까 조심스럽게 권해드려 봅니다! 끝으로 오늘도... ,린주의 맛깔 나는 IT !,https://blog.naver.com/rinjoo_,2020-07-24
" 춘천 남부노인복지관- 산속에닭갈비 , 호반디딤돌 업무협약체결",https://blog.naver.com/kwtimes?Redirect=Log&logNo=222424989760,"특히산속에닭갈비 는춘천 남부노인복지관과 함께춘천 시 어르신을 위해 정기적인 후원금과 식료품을 지원하며, 지역사회내 꾸준한 나눔활동을 이어간다. 또산속에닭갈비 는 아름다운 조경과 한 폭의... ",강원타임즈 블로그,https://blog.naver.com/kwtimes,2021-07-08
 춘천 산속에 닭갈비된장 닭갈비 생생정보 메밀 막국수 !,https://blog.naver.com/ooo5666?Redirect=Log&logNo=222358712685,메밀 막국수 메뉴가격 철판 양념 닭갈비 12000원 숯불 매콤 양념 닭갈비 12000원 주소 강원도 춘천시 옛경춘로 562-22 033-242-8895춘천 산속에 닭갈비# 춘천산속에닭갈비#춘천 #된장닭갈비 #생생정보 #메밀막국수,YES,https://blog.naver.com/ooo5666,2021-05-20
"[ 춘천 ]산속에 닭갈비 , 막국수 내돈내산 후기",https://blog.naver.com/kormingky?Redirect=Log&logNo=222072366116,"[ 춘천 ]산속에 닭갈비 , 막국수 내돈내산 후기 가평에서 폭풍 물놀이를 하고 오빠가 여기까지 왔는데...춘천 산속에 닭갈비메뉴판입니다. 산속에 닭갈비는 철판 숯불 이렇게 2가지 종류가 있습니다. 숯불 먹다가... ",The Sult Mimkyung,https://blog.naver.com/kormingky,2020-08-27
된장 닭갈비 메밀막국수 비법... 털어라춘천 산속에 닭갈비 ,https://blog.naver.com/eueuy?Redirect=Log&logNo=222358827350,생생정보통 비법 24시 밥상을 털어라 된장 닭갈비메밀막국수춘천 산속에 닭갈비강원도 춘천시 옛경춘로 562-22 ☎ . ※ 영업시간은 오전 11시 ~ 오후 10시입니다. (연중무휴/라스트 오더: 8시 40분)... ,이랑이랑 맛집찾기,https://blog.naver.com/eueuy,2021-05-20
[춘천 맛집] 춘천 산속에 닭갈비 ,https://blog.naver.com/mirany07?Redirect=Log&logNo=222422242475,안녕하세요 미라니와 고라니입니다 춘천에 놀러갔다가 춘천하면 닭갈비!!! 정말 즉흥적이게 네이버 검색하고 맛집 이라 이미 인정받아있는춘천산속에 닭갈비집을 다녀왔어요 예약을 통해 가면 메밀 파전을... ,미라니와 고라니의 일상이야기,https://blog.naver.com/mirany07,2021-07-06
" 춘천맛집,산속에 닭갈비다녀오다(맛+친절+분위기 모두 있는 곳)",https://blog.naver.com/jaehee755?Redirect=Log&logNo=222222768555,"춘천에 가면 닭갈비를 먹어야 한다는 생각으로 춘천 닭갈비 맛집을 찾아보았다. 여러군데의 맛집이... 철판 닭갈비는 쉽게 접할 수 있으므로 숯불 닭갈비를 먹으러 가기로 결정 ~ 하지만,춘천 산속에 닭갈비 는... ",안정 속의 자유,https://blog.naver.com/jaehee755,2021-01-28
[맛집]춘천 하면산속에 닭갈비 !,https://blog.naver.com/gil3721?Redirect=Log&logNo=221725911370,- 닭갈비는 사랑입니다. 조경이 넘나 이쁜 산속에 닭갈비 오늘의 픽은춘천 산속에 닭갈비이다.... 먹스타그램 #맛집 #강원도맛집 #춘천맛집 #춘천하면닭갈비 #산속에닭갈비 #철판닭갈비 #숯불닭갈비,도도맘♥짱수의 일상의 끄적임!,https://blog.naver.com/gil3721,2019-12-03
[맛집]춘천 산속에 닭갈비 ,https://blog.naver.com/hanjia_yaho?Redirect=Log&logNo=222354975198, 산속에 닭갈비남편 회사 창립기념일로 평엘 쉬었던 날 #드라이브 겸 # 춘천으로 고고 함께가는 좋아하는 숯불 닭갈비집이 있지만 아이가 생기니 깨끗하고 넓은 곳을 찾게 된다. 남편이 찾아서 가게 된닭갈비 집!... ,가장 나를 닮은 공간,https://blog.naver.com/hanjia_yaho,2021-05-17
 춘천 산속에 닭갈비된장 닭갈비메밀막국수,https://blog.naver.com/rok2tank?Redirect=Log&logNo=222358790308,[ 2TV 생생정보 1317회 ] 5월 20일 목요일 취재 연락처 비법 24시 밥상을 털어라 된장 닭갈비메밀막국수춘천 산속에 닭갈비강원도 춘천시 옛경춘로 562-22 ☎ 033-242-8895 ※ 영업시간은 오전 11시... ,당황하지 않고,https://blog.naver.com/rok2tank,2021-05-20
라데나cc 맛집춘천 산속에닭갈비양많고 맛있어,https://blog.naver.com/shyc012?Redirect=Log&logNo=222265831233,라데나 CC 맛집 찾는다면산속에닭갈비추천해요 오랜만에 맛집 포스팅입니다맛집 포스팅이 젤 좋아요 ㅋㅋㅋㅋ 오늘은 라데나cc 근처에 있는춘천닭갈비맛집을 소개하려구해요! 네이버 이미지에서... ,나씨의 소풍,https://blog.naver.com/shyc012,2021-03-05
 산속에닭갈비춘천닭갈비 추천춘천 분위기좋은맛집,https://blog.naver.com/lilyjiyoung?Redirect=Log&logNo=222499328024,# 춘천닭갈비#풍경맛집 # 춘천 뷰맛집 # 춘천닭갈비 추천 평소에 궁금했던산속에 닭갈비춘천 에닭갈비집은 정말 많이있다 저마다 조금씩 비슷한 듯 조금은 다른닭갈비맛 개인적인 취향과 입맛이 조금씩은... ,평일의 나,https://blog.naver.com/lilyjiyoung,2021-09-08
 춘천닭갈비 맛집 /산속에 닭갈비 ,https://blog.naver.com/0708sm?Redirect=Log&logNo=222502190338,"친구찬스로 방문한춘천닭갈비맛집.산속에닭갈비 . 강원도 하늘은 정말 파랬다는게 새삼 느껴진다. 아기자기 예쁜정원이 있는 가게. 주차장도 엄청 넓고, 가게도 크고. 역시춘천 다운닭갈비 집 사이즈. 기본찬.... ",이슬만,https://blog.naver.com/0708sm,2021-09-11
"[반나절여행]춘천 _김유정역, 레일파크, 산속에닭갈비 ",https://blog.naver.com/pmyluck?Redirect=Log&logNo=221704950329,김유정 #동백꽃 #강촌여행 #강촌 #레일바이크 #레일파크 #강촌레일파크 #김유정역레일파크 #당일치기여행 # 춘천 여행코스 # 춘천 당일치기 #낭구열차 #낭만열차 # 춘천닭갈비# 산속에닭갈비# 춘천 맛집 # 닭갈비 맛집,럭키미뇽의 꿈꾸는 행복설계자,https://blog.naver.com/pmyluck,2019-11-12
(7일차)춘천닭갈비 집 ' 산속에 닭갈비 ' 솔직 후기,https://blog.naver.com/wlgus4059?Redirect=Log&logNo=221711499246,"이곳은춘천 의산속에 닭갈비 이며, 말그대로산 속에 닭갈비집이 있었다. 주차장도 내가 본것만으로 2군데가 있어서 주차 걱정 안해도 된다. +)꿀팁을 주자면, 네이버로 예약을 하고 가면 서비스로 7,000원짜리... ",유끼's Gap year,https://blog.naver.com/wlgus4059,2019-11-19
강원도춘천맛집 -산속에 닭갈비 ,https://blog.naver.com/topsuwon78?Redirect=Log&logNo=222001731359,"강원도 춘천 하면닭갈비 가 유명하다고 해서 안먹어볼수는 없어서 저희도 ㅎㅎ 이른저녁을 먹고 수원에 넘어왔습니다 들어가면 사장님께서 철판,숯불이라고 물어보셔서 저희는 숯불이요 하고 편한쪽으로... ",하루두피수원광교점,https://blog.naver.com/topsuwon78,2020-06-18
" 춘천데이트 ;산속에 닭갈비 , 포지티브즈 ✨",https://blog.naver.com/min_d23?Redirect=Log&logNo=222298509556,"양념 닭갈비첫맛은 음,,? 간장이 나은데 ? 했다가 먹을수록 양념도 맛있었다 ㅋㅋㅋ ㅋㅋㅋㅋ 남편이 이렇게 찍어보라며 ^_^* . . . 그리고 우리가 전부터 가고싶었던춘천포지티브즈 :) 골목에서도, 오래된 집을... ",소소한 도닐기,https://blog.naver.com/min_d23,2021-04-04
20210920춘천 산속에 닭갈비 -숯불닭갈비,https://blog.naver.com/wishdoor?Redirect=Log&logNo=222511626599,숯불 닭갈비4인분에 막국수 곱배기 시켜먹음 5만7천원에 가족3인이 점심을 배터지게 먹음 위에 고기2조각이 1인분이다 주인아저씨 처음에 고기를 구워줘서 편했다 ᆢ 하지만 3인분 부터는 우리가 욜씨미 구워... ,위시 멘토의 행복충전소,https://blog.naver.com/wishdoor,2021-09-20
[ 산 속에 닭갈비 /강원도춘천 ] 산 속에 서 즐기는닭갈비맛집,https://blog.naver.com/dkjang86?Redirect=Log&logNo=222075401768,경치도 좋고 음식 맛도 좋고 친절해서 좋았던산 속에 닭갈비 .춘천 에서닭갈비먹고싶을 때 찾을만한 곳입니다. # 춘천 맛집 # 닭갈비# 춘천닭갈비# 춘천닭갈비 맛집 # 닭갈비 맛집 #볶음밥,Romantic Macho,https://blog.naver.com/dkjang86,2020-08-30
아를다운 경관을 자랑하는춘천 산속에닭갈비 ,https://blog.naver.com/ethics9432?Redirect=Log&logNo=221713431689,"직접 보니 굉장히 특이하고 좋았다.춘천1박 2일을 여행을 이렇게 마무리하다~ 한줄평 :춘천닭갈비 는 별다를 것이 없지만, 본인 스탈닭갈비맛집은 반드시 있다.",천안식후감 | 天安食後感,https://blog.naver.com/ethics9432,2019-11-20
 춘천닭갈비맛집 :산속에닭갈비(강추!),https://blog.naver.com/hanbyul607?Redirect=Log&logNo=221870746092,계획대로라면 맛있는 녀석들이 다녀간 통나무집에 가려고 했으나 후기가 생각보다는 긍정적이지 않아서 블로그를 열심히 검색해서 찾아낸 이곳춘천산 닭!산속에 닭갈비 ! 맛도 맛이지만 후기에 사장님이 너무... ,소소한 일상기록,https://blog.naver.com/hanbyul607,2020-03-24
 춘천 산속에 닭갈비 ,https://blog.naver.com/blossomcoco?Redirect=Log&logNo=222128706650,산에닭갈비 ~춘천여행을 계획 중이라면 이 코스 꼭 넣어보시길 바래요~~ 드라마 촬영지로도 유명하더라구요^^ # 산속에닭갈비# 춘천 맛집 # 춘천닭갈비 추천 # 춘천닭갈비 맛집 #춘천 명소 # 춘천 꼭가볼곳 # 춘천 여행... ,엘린맘 & 4살 7살 장꾸남매의 행복한 이야기,https://blog.naver.com/blossomcoco,2020-10-28
