title,link,description,bloggername,bloggerlink,postdate
 춘천 맛집산속에 닭갈비마무리로 밥도 볶아 먹었다.잘~먹었다.,https://blog.naver.com/fineday1527?Redirect=Log&logNo=221809392959,"춘천맛집 산속에 닭갈비춘천 산속에 닭갈비 , 줄여서 춘천 산닭 춘천 닭갈비 식당으로는 아마도 산속에닭갈비가예쁜 인테리어를 갖고 있지 않을까 생각되네요.춘천 산속에 닭갈비 , 줄여서 춘천 산닭",fineday1527님의블로그,https://blog.naver.com/fineday1527,2020-02-14
 춘천 식도락 여행 _춘천산 닭 ' 산속에 닭갈비 ' 후기!!,https://blog.naver.com/duke0802?Redirect=Log&logNo=221696934966,그보다는 조금 조용한 곳에서 자연을 보면 어떨까 싶어서 일부러 도심이 아닌 외곽을 찾아봤다가 발견한 바로춘천산 닭 ' 산속에 닭갈비 '춘천산 닭.산속에 닭갈비전경 차량으로 이동을 하였기 때문에... ,_홍스콩스히어링_,https://blog.naver.com/duke0802,2019-11-03
 춘천 산속에 닭갈비분위기시원하고 맛도 짱이네요,https://blog.naver.com/osp3000?Redirect=Log&logNo=221611701476,있는춘천닭갈비 를 먹기로 하고 시내로 진입하다 보니 산자락 밑 깔끔한닭갈비 집이 눈에 띄었어요 눈에 보이는 건너편에 있어 대충 잡고 옆길로 진입을 해보려고 하는데 진입로가 없어요 돌고 돌아서 입구에... ,라인칼라,https://blog.naver.com/osp3000,2019-08-10
 춘천여행 필수 코스 일몰명소춘천닭갈비골목 맛집,https://blog.naver.com/hong273526?Redirect=Log&logNo=222461110946,# 춘천 여행 # 춘천 일몰 # 춘천닭갈비 골목 # 춘천닭갈비 맛집 # 춘천 숯불 닭갈비 맛집춘천여행 일몰 명소 대룡산 무더위 피서지로도 제격 강원도춘천 시 동내면 고운리 해질녁 이지만 여전히 무더운 날 피서도 할 겸... ,아공의 사진 여행,https://blog.naver.com/hong273526,2021-08-09
 춘천닭갈비맛집 찾았어요,https://blog.naver.com/hnmh2332?Redirect=Log&logNo=222059204772,기나긴 장마로 집에만 있었더니 답답하기도 하고 집에서 1시간 30분만 달려가면 도착할 수 있는춘천닭갈비맛집을 찾아춘천대표음식으로 손꼽히는 다양한 음식들을 먹으며 기분 전환을 했다. 소양강... ,♥️초록바다의 감성여행,https://blog.naver.com/hnmh2332,2020-08-13
털어라 춘천의 명물 닭갈비... 맛집춘천 산속에 닭갈비 ... ,https://pirin8pirin.tistory.com/3772,2tv 생생정보 1317회 오늘 생생정보 에서는 비법 24시 밥상을 털어라 등이 방송됩니다 비법 24시 밥상을 털어라 춘천의 명물 닭갈비 된장 닭갈비메밀막국수춘천 산속에 닭갈비☎ 033-242-8895... ,8,https://pirin8pirin.tistory.com/,2021-05-20
 춘천 맛집산속에 닭갈비인스타주소 iyungi44033)2428895,https://blog.naver.com/laikyn_ezrie?Redirect=Log&logNo=221824496497,"# 춘천닭갈비 , # 춘천닭갈비 맛집, #라데나골프클럽맛집, # 춘천 맛집추천, # 춘천 현지인맛집, # 춘천닭갈비 추천, # 산속에닭갈비 , #라데나골프gc맛집, #라데나골프클럽주변맛집춘천 맛집산속에 닭갈비개인적으로... ",laikyn_ezrie님의블로그,https://blog.naver.com/laikyn_ezrie,2020-02-25
" 춘천 산속에 닭갈비 , 줄여서 춘천 산닭",https://blog.naver.com/tajesan_958?Redirect=Log&logNo=221798852413," 춘천 산속에 닭갈비 , 줄여서 춘천 산닭춘천 산속에 닭갈비 , 줄여서 춘천 산닭 세 명인 우리는 철판닭갈비 2인분, 숯불소금 닭갈비구이 1인분, 숯불간장 닭갈비구이 1인분을 시켰다.너무 많이 시키는 건 아닌지... ",tajesan_958님의블로그,https://blog.naver.com/tajesan_958,2020-02-06
 춘천닭갈비 맛집( 산속에 닭갈비 ),https://blog.naver.com/dldmswl11028?Redirect=Log&logNo=221867223936," 춘천 으로 가는길 배고프시대서 맛집 검색하는데 알잖아~ 다 맛집이래ㅠ 그냥 가다 아무대나 가자 하는데 # 산속에닭갈비이정표를 보게되었고, 의식의 흐름대로 따라ㅏ갔다. 오잉 ?? 자동차도 은근 많고, 깔끔한... ",가장 따뜻한 날들,https://blog.naver.com/dldmswl11028,2020-03-22
"[ 춘천 ] 산속에닭갈비 , 춘천산닭,숯불닭갈비,철판닭갈비,춘천맛집... ",https://blog.naver.com/daejimr?Redirect=Log&logNo=221683815197,"[ 춘천 ] 산속에닭갈비 , 춘천산닭,숯불닭갈비,철판닭갈비,춘천맛집,춘천나들이춘천 산속에닭갈비숯불닭갈비,철판닭갈비 맛있고 분위기도 좋아요. 전화 : 033-242-8895 주소 : 강원 춘천시 옛경춘로 562-22 지번온의동... ",R A N I D A I L Y ᵔᴥᵔ,https://blog.naver.com/daejimr,2019-10-21
[ 춘천 맛집]산속에 닭갈비- 예약하면 파전 무료! 친절하고... ,https://blog.naver.com/lovingly_?Redirect=Log&logNo=221872420497,조명이 노래서 먹다가 졸려지더라구요 하지만 가격도 괜찮고 저는 맛있게 먹고갑니다 ~^^춘천여행하실 때 참고하셔요~~~~ # 춘천 맛집 # 춘천닭갈비# 닭갈비# 산속에닭갈비#막국수 #메밀파전 # 춘천 막국수 #숯불 닭갈비 ,ෆ 쏘잉이의 일상로그 ෆ,https://blog.naver.com/lovingly_,2020-03-25
[춘천산닭] 춘천 산속에 닭갈비(숯불 간장닭갈비 꼭 드세요ㅠㅠ)... ,https://blog.naver.com/wlswn9530?Redirect=Log&logNo=221590137059, 춘천 산속에 닭갈비 -산닭 춘천 닭갈비 맛집 OPEN - 11am CLOSE - 10pm 매일 영업하신다고하네요! 가게 외부 모습입니다! 이렇게 넓게 주차장이 있습니다~! 2주차장도 있어요! 가게 넓은만큼 주차장도 넓어서 단체로... ,♡´･ᴗ･`♡,https://blog.naver.com/wlswn9530,2019-07-19
 춘천 산 닭은 산속에 닭갈비 의 준말이예요~,https://blog.naver.com/l3ay3e357?Redirect=Log&logNo=221827823056," 춘천 산 닭은 산속에 닭갈비 의 준말이예요~춘천 오실기회 있으시면 꼭한번 들러보세요^^이상으로춘천닭갈비맛집, 산속에 닭갈비 포스팅을 마칩니다 눈 마주친 고양이춘천 산 닭은 산속에 닭갈비 의 준말이예요... ",l3ay3e357님의블로그,https://blog.naver.com/l3ay3e357,2020-02-27
 춘천당일치기 데이트코스 추천(농가 닭갈비 /닭갈비 맛집... ,https://blog.naver.com/qingsong16?Redirect=Log&logNo=221889487365,먼저춘천당일치기 데이트 코스 포스팅 ㄱㄱ # 춘천 데이트코스 # 춘천 맛집 # 춘천닭갈비#농가 닭갈비춘천 에는닭갈비집이 너무 많아서 도대체 어디로 가야할지 모르겠다.닭갈비맛집으로 검색해봐도 정보의... ,The Saturdays:-),https://blog.naver.com/qingsong16,2020-04-04
" 춘천 현지인맛집산속에 닭갈비 , 예쁘고 맛있는 집",https://blog.naver.com/juan3002?Redirect=Log&logNo=221749233540,"숯불간장달갈비는 단짠단짠의 조화가 남녀노소 누구나 좋아하는춘천 현지인맛집산속 의닭갈비 의 시그니처 메뉴라고 할 수 있습니다.닭갈비 뿐만아니라 단품메뉴도 인기가 많은 곳인데요, 여름에는 직접... ",해피쉬리의 읽고 배우며 섬마을에서 살아가는 이야기,https://blog.naver.com/juan3002,2019-12-25
" 춘천닭갈비맛집 ' 산속에 닭갈비 ' 택배 배달, 알차다 알차~~",https://blog.naver.com/perhaps6?Redirect=Log&logNo=221837747103," 춘천닭갈비맛집 ' 산속에 닭갈비 ' 택배 배달, 알차다 알차~~ 안녕하세요. 요즘 우한 폐렴 때문에 난리도 난리도 그런 난리가 없네요. 감염병으로 아파하는 것도 전파 차단을 위한 노력들에도 늘어만 가고, 마스크... ",시골소녀의 블로그,https://blog.naver.com/perhaps6,2020-03-04
 춘천닭갈비-산속에닭갈비 ,https://blog.naver.com/ryoungkim2?Redirect=Log&logNo=221580833381,넓은 정원과닭갈비그리고 닭곰탕이 있는춘천닭갈비산속에닭갈비오늘은 1부예배 후 가족들과 점심을 함께했어요.춘천닭갈비산속에닭갈비방문했어요. 얼마 전 차타고 지나가면서 가봐야 겠다 했는데... ,비키와 함께 떠나는 여행 ♡,https://blog.naver.com/ryoungkim2,2019-07-08
털어라 - 된장 닭갈비메밀막국수맛집춘천 산속에 닭갈비 ,https://blog.naver.com/mediost?Redirect=Log&logNo=222358738761,정보♥ 춘천 산속에 닭갈비강원도 춘천시 옛경춘로 562-22 ☎ 033-242-8895 ※ 영업시간은 오전 11시 ~ 오후 10시입니다. (연중무휴/라스트 오더: 8시 40분) 된장 닭갈비메밀막국수 방송 이미지... ,주방이야기,https://blog.naver.com/mediost,2021-05-20
 산속에닭갈비 _온의동 닭갈비 _ 닭갈비 하면춘천 !춘천하면 온의동!!,https://blog.naver.com/nowgowm?Redirect=Log&logNo=221750245367, 춘천하면 #온의동 닭갈비죠!!! 포스팅 바로 시작하겠습니다!! # 산속에닭갈비#온의동 닭갈비의 외관 모습입니다!! 넓은 정원과 아름다운산또 높은 하늘의 조화로움이.. 정말 아름다운 곳에서 식사하는 느낌을... ,맛있는 인생,https://blog.naver.com/nowgowm,2019-12-26
 춘천 맛집산속에 닭갈비차림표 중간에는 산속에 닭갈비 와... ,https://blog.naver.com/xufenuzayu?Redirect=Log&logNo=221805454862, 춘천 맛집산속에 닭갈비차림표 중간에는 산속에 닭갈비 와 막국수를동시에 맛볼 수 있는점심 특선도 있더군요. 숯불간장달갈비는 단짠단짠의 조화가 남녀노소 누구나 좋아하는 춘천 현지인맛집산속 의닭갈비 의... ,xufenuzayu님의블로그,https://blog.naver.com/xufenuzayu,2020-02-12
" 춘천 산속에 닭갈비 , 산닭입니다.",https://blog.naver.com/ccsandak?Redirect=Log&logNo=222092101449,그래서산속에 닭갈비 . 산닭은 어떤 질문에서 시작했는지를 말씀드리고자 합니다. 좋은 식당이란... 그치지 않고 따뜻한 이웃으로 이 자리에 있겠습니다.산속에 닭갈비 는 항상 곁을 내주는 식당이 되겠습니다.,춘천 산속에 닭갈비 : 산닭,https://blog.naver.com/ccsandak,2020-09-17
가성비 끝판왕인춘천닭갈비맛집 모음,https://blog.naver.com/kkkkangta?Redirect=Log&logNo=222143659730,"최근 친구들과 남이섬에 갔다가 현지인도 인정한다는춘천닭갈비맛집을 다녀왔어요. 은은한 숯불향과 알찬 가성비가 일품이었던 곳이라 소개해요. 1.춘천장호더그릴 가족세트 69,000원 / 철판 닭갈비11,000원... ",킴여사네집,https://blog.naver.com/kkkkangta,2020-11-13
 춘천라데나cc 주변맛집산속에닭갈비 를 소개합니다,https://blog.naver.com/tpflcnrn?Redirect=Log&logNo=221662623035,#소양강댐 앞에 # 춘천닭갈비많더라구요. 그래서 어느 이웃님의 블로그에서 소개한 # 춘천 원조 닭갈비 를 보고는 믿고 찾아갔죠. #소양강댐 앞이 아니고 어디 시내쪽으로 가는데 영 분위기가 맘에 들지 않아 다시... ,미르의 골프이야기,https://blog.naver.com/tpflcnrn,2019-09-29
 춘천닭갈비 맛집산속에닭갈비솔직 후기 ! 숯불 닭갈비짱맛... ,https://blog.naver.com/wonju5010?Redirect=Log&logNo=222007262562,* 쥬쥬가 사비로 먹고온 솔직 후기 * # 산속에닭갈비# 춘천닭갈비# 춘천 맛집 # 춘천닭갈비 맛집 #숯불 닭갈비# 춘천 숯불 닭갈비# 춘천 숯불 닭갈비 맛집 # 춘천 분위기좋은식당 # 닭갈비 맛집,늘 가까이에 :),https://blog.naver.com/wonju5010,2020-06-20
생생정보통 된장닭갈비 메밀막국수춘천 산속에 닭갈비스페셜... ,https://blueplastic.tistory.com/5671,인생 역전의 맛 생생정보통 저탄고지 다이어트 가지스튜디오 주소: 경기도 김포시 영터길 93 비법 24시 밥상을 털어라 된장닭갈비 메밀막국수춘천 산속에 닭갈비주소: 강원도 춘천시 옛경춘로 562-22 반응형,Modern Story,https://blueplastic.tistory.com/,2021-05-20
 춘천 맛집/ 산속닭갈비 /오지 닭갈비 / 춘천 돌판 닭갈비 /옹장골,https://blog.naver.com/sunning11?Redirect=Log&logNo=221792835998,"주소 : 강원춘천 시 남면 소주고개로 213-106 안 나올거 같아도 네비를 믿고 계속 가시다보면 나와요^^ 이상춘천오지 닭갈비 ,춘천 산속닭갈비 ,춘천돌판 닭갈비옹장골 관광농원이었습니다.",해링턴공인중개사사무소,https://blog.naver.com/sunning11,2020-02-01
"[육아] 춘천 나들이, 춘천닭갈비 ,철판 닭갈비맛집,산속에 닭갈비 ... ",https://blog.naver.com/daejimr?Redirect=Log&logNo=222049634050,"# 춘천닭갈비 맛집 # 춘천닭갈비# 산속에닭갈비밥 다먹고, 후식으로 또 먹으러 온 우리:) 놀러오면 먹고 먹고 또먹고가 정답 아닌가요? 하하하하 저거 감자같죠? 감자빵이예요. 여기 카페이름이 감자밭이라... ",R A N I D A I L Y ᵔᴥᵔ,https://blog.naver.com/daejimr,2020-08-03
 춘천 산속에닭갈비 ,https://blog.naver.com/soostarr?Redirect=Log&logNo=222102804867," 춘천 산속에닭갈비다녀왔어요~ 양도 생각보다 많고 맛있어요!! 철판닭갈비 1인분 12,000원 메밀파전 7,000원",새싹수스타,https://blog.naver.com/soostarr,2020-09-29
2020.10.10 강촌 구곡폭포춘천소양강댐춘천닭갈비 ... ,https://blog.naver.com/choi2k74?Redirect=Log&logNo=222115440896,"반대편에산 속에있는 문래마을도 있어서 올라가보고 싶었지만, 아이가 힘들어해서 바로 하산했어요....춘천우미닭갈비 도 유명하다던데, 기회되면 그곳도 가보고 싶어요. 저희는 토담 숯불닭갈비 ... ",더 밝은 내일을 위하여~~,https://blog.naver.com/choi2k74,2020-10-15
"생생정보 된장닭갈비 , 메밀막국수춘천맛집 비법 24시... ",https://reportan.tistory.com/3982,"춘천된장닭갈비맛집 #춘천메밀막국수맛집 # 춘천산속에닭갈비비법 24시 밥상을 털어라 된장 닭갈비,메밀 막국수 가격 식당 위치 정보 상 호 :춘천산속에닭갈비주 소 : 강원 춘천시 옛경춘로 562-22 (지번)... ",리폿안,https://reportan.tistory.com/,2021-05-20
 춘천닭갈비맛집 가성비 좋은산속에닭갈비 !,https://blog.naver.com/wjdghks8881?Redirect=Log&logNo=221637498393,여기 오면 꼭춘천닭갈비맛집 한군데씩 들리게 되는데 이번에 방문한 곳도 역시나 성공적이었답니다 점심메뉴로닭갈비 랑 막국수랑 세트로 되어 있는 건데 가격도 착한데다 가성비 좋더라고요. 저희가 방문한... ,꾸리한 여행,https://blog.naver.com/wjdghks8881,2019-09-03
"카페,춘천세종 호텔, 농가닭갈비 , 통나무집닭갈비 , 명동... ",https://blog.naver.com/awesomejune?Redirect=Log&logNo=222435923623,"강원도춘천가볼 만한 곳/ 당일치기 여행 : 샘밭 막국수, 소양강 댐, 구봉산 산토리니 카페,춘천세종 호텔, 농가닭갈비 , 통나무집닭갈비 , 명동닭갈비골목 이번춘천여행의 컨셉은춘천 의 대표 음식인... ",여행을 통해 인사이트를 발견하다,https://blog.naver.com/awesomejune,2021-07-18
가평춘천숯불 닭갈비맛집 햇고을닭갈비제이드가든 근처,https://blog.naver.com/seokjooson?Redirect=Log&logNo=222543945248,가평춘천숯불 닭갈비맛집 햇고을 닭갈비(제이드가든 옆 위치)춘천햇고을닭갈비춘천햇고을닭갈비 는 가평 끝에 위치해 있다. 주소지는춘천 이나 가평에서도 가까워 접근성이 괜찮은 편이다. 자연 속에서... ,쭈취(ZZU区),https://blog.naver.com/seokjooson,2021-10-21
카페드220볼트산카페+ 닭갈비 +소양강춘천투어,https://blog.naver.com/rmdwjd2021?Redirect=Log&logNo=222445493890,"통나무집닭갈비사진을 많이 찍지는 못했지만,춘천 에서 10년 정도 거주한 지인의 강추닭갈비 집 '통나무집닭갈비 ' 나는 분점으로 다녀왔는데 장사가 너무 잘되어 근방에만 3개의 가게를 운영한다고 한다.... ",30대 아재의 젊어지고 싶은 일상,https://blog.naver.com/rmdwjd2021,2021-07-25
 춘천 맛집산속에 닭갈비메밀파전은 닭갈비구우면서 순삭~~,https://blog.naver.com/saylah_katelee?Redirect=Log&logNo=221833558002,오늘은춘천 에 있는닭갈비 맛집을 다녀왔어요! 산속에 닭갈비!!친척들과 다함께춘천 으로 여행을 간거라 예약을 하고 갔어용매장이 엄청 컸어요! 주차시설도 아주 잘되어있었고춘천 맛집산속에 닭갈비 ... ,saylah_katelee님의블로그,https://blog.naver.com/saylah_katelee,2020-03-02
"[맛 메뉴]춘천숯불닭갈비맛집, ' 산속에 닭갈비 '",https://blog.naver.com/dxm2000?Redirect=Log&logNo=221986299603,"[맛 메뉴]춘천숯불닭갈비맛집, ' 산속에 닭갈비 ' 그런데, 숯불에 구워 먹는 숯불닭갈비 는 드셔 보셨어요? 그 독특한 맛과 매력을 오늘 소개하려 합니다. ^^ [맛 메뉴]춘천숯불닭갈비맛집, ' 산속에 닭갈비 ... ","소외된 이웃의 대안 공동체, 겨자풀",https://blog.naver.com/dxm2000,2020-06-02
 춘천 맛집산속에 닭갈비안쪽으로도 넓어요~,https://blog.naver.com/n0d4od1u?Redirect=Log&logNo=221817036160, 춘천 맛집산속에 닭갈비안쪽으로도 넓어요~ 안쪽으로도 넓어요~ 마늘에 쌈장을 푸욱 찍어 쌈을 싸먹어주었어요.양파도 한가득 넣어주었는데요!아삭한 식감과닭갈비 의 촉촉하고 부드러운 식감이 만나엄청... ,n0d4od1u님의블로그,https://blog.naver.com/n0d4od1u,2020-02-20
 춘천 맛집산속에 닭갈비제법 운치 있는 식당,https://blog.naver.com/bv642k8t?Redirect=Log&logNo=221806766764, 닭갈비한쌈~~ 오늘은춘천 에 있는닭갈비 맛집을 다녀왔어요! 산속에 닭갈비!!친척들과 다함께춘천 으로 여행을 간거라 예약을 하고 갔어용매장이 엄청 컸어요! 주차시설도 아주 잘되어있었고 매장 앞 정원도... ,bv642k8t님의블로그,https://blog.naver.com/bv642k8t,2020-02-13
해서 내줘선지 확실히 촉촉하고 부드러운 식감의춘천닭갈비 ,https://blog.naver.com/dj7d518h6h0?Redirect=Log&logNo=221816774063,밀가싸우중간중간에 구경할 것들도 있어서 눈도 심심하지 않네요 먹다 춘천맛집 산속에 닭갈비춘천 산속에 닭갈비기본반찬 이에요 정말 산 속에 있는 춘천맛집 주차장은 위편에 넉넉하게 이용 가능하다,dj7d518h6h0님의블로그,https://blog.naver.com/dj7d518h6h0,2020-02-20
 춘천닭갈비맛집산속에닭갈비 ,https://blog.naver.com/1emdehlsek?Redirect=Log&logNo=221600592885, 춘천닭갈비맛집 :산속에 닭갈비친구와 날을 잡았는데 장마로 인해 비가 엄청 쏟아질거라는 일기예보가 계속 나왔다 내가 운전을 하는게 아니라서 운전할 친구 걱정에 비 많이 온다는데 다음에 가도 된다고... ,백억장자나야나,https://blog.naver.com/1emdehlsek,2019-07-31
[ 산속에닭갈비 ]춘천현지인도 인정한춘천닭갈비맛집!,https://blog.naver.com/larosee129?Redirect=Log&logNo=221741990139,주차 용이 / 넓은 부지 / 철판닭갈비/ 석쇠닭갈비춘천 에 왔다하면 반드시 생각나는 그것!닭갈비 ! 하지만 의외로 맛집을 찾기가 굉장히 어렵답니다ㅠㅠ 온 동네 사람들이 도모라도 한 듯닭갈비식당만... ,소장용 연습장,https://blog.naver.com/larosee129,2019-12-18
" 춘천 여행 [ 춘천마라톤,산 속 의닭갈비 ,empty paper]",https://blog.naver.com/dlwing369?Redirect=Log&logNo=221691392756, 춘천여행 춘천 으로 향하는 ITX에서 언니가 준 계란이랑 빵집에서산카스테라 꽈배기를 먹었다! 우리의 첫 목적지산속 의닭갈비춘천 역에서 내리자마자 택시타고 점심을 먹으러 이곳에 왔다.우리는 소금닭갈비 ... ,*_*,https://blog.naver.com/dlwing369,2019-10-28
가평 맛집 설악 막국수춘천닭갈비그리고 아난티,https://blog.naver.com/edaume33?Redirect=Log&logNo=222143551290,설악 막국수와춘천닭갈비 를 먹고 아난티를 산책하고 커피 한잔하는 코스였어요 설악 막국수 1시 50분에 도착했음에도 불구하고 30분간 대기해서 들어갈 정도로 인기가 많은 곳이더군요 처음으로 잣이 들어간... ,flo's,https://blog.naver.com/edaume33,2020-11-17
" 춘천 산속에 닭갈비 , 줄여서 춘천 산닭",https://blog.naver.com/budv1vad?Redirect=Log&logNo=221802985794," 춘천 산속에 닭갈비 , 줄여서 춘천 산닭 서비스가 끝이 아님..울집 7살 어린이 보시더니.. 매운 거는 못먹을거 같아서 따로 국수 준비하셨다며완전감동이쥬?춘천 산속에 닭갈비 , 줄여서 춘천 산닭 양념구이 그 새... ",budv1vad님의블로그,https://blog.naver.com/budv1vad,2020-02-10
" 춘천 여행 1부(휴게소,숙소... 투썸플레이스, 산속에닭갈비 ... ",https://blog.naver.com/yyjssb?Redirect=Log&logNo=221765569420,산에닭갈비저녁은춘천 에서 유명한 산에닭갈비숯불간장 1인 숯불양념 1인 네이버 예약하시면 전을 서비스로 맛볼 수 있다구용☆ 맛있겠닭 먹고싶닭 마무리는 후식 비빔 막국수 젤 맛나♡ 계산 후 집... ,찰떡,https://blog.naver.com/yyjssb,2020-01-09
[ 춘천닭갈비/산속에닭갈비]춘천닭갈비맛있는 곳... ,https://blog.naver.com/dkdlswn?Redirect=Log&logNo=222125519398,# 춘천닭갈비 맛집 을 소개하려고 합니다. # 산속에닭갈비라는 너무 예쁜 정원속닭갈비집이에요!! 정원이 진짜 예뻐서 # 닭갈비 맛집 둘째치고 #야경맛집 이 아닐까 싶을 정도예요~ 저녁에 식사하고 나와서... ,아주 행복한 코끼리,https://blog.naver.com/dkdlswn,2020-10-24
 춘천 은 아름다운 산과 호수를 배경으로 책 읽기 좋은... ,https://blog.naver.com/kkarak2004?Redirect=Log&logNo=222519908396,물론 막국수와닭갈비 는 기본이고요.춘천 은 산으로 둘러싸인 분지에 위치하면서 의암댐으로 인해 만들어진 호수로 둘러싸여 있는 자연을 가지고 있습니다. 그렇다 보니 산과 호수가 아름다운 도시죠.... ,까락kkarak,https://blog.naver.com/kkarak2004,2021-09-28
 춘천닭갈비맛집 메이플가든 굿이네,https://blog.naver.com/benjo11?Redirect=Log&logNo=221539648637,시내에도 한집 건너 막국수집과닭갈비 집이 늘어선 거리는닭갈비골목까지 그야말로 유명한 막국수와닭갈비 동네는 대부분의 수많은 식당들은 어느 정도 기본은 하지만 이왕이면 제대로 된 # 춘천닭갈비 맛집... ,큰바다소년 Benjamin,https://blog.naver.com/benjo11,2019-05-17
 산속 깊은 묵은지 닭갈비엘리시안강촌맛집,https://blog.naver.com/hhhhha74?Redirect=Log&logNo=222324754661,"묵은지 닭갈비꼭 드셔보세요 지인분이 막국수 까지 코스로 주문 해주셨는데,,,,막국수 먹고 기억났어요 ㅋㅋㅋ 아 여기 막국수는 별로 였다...,,,먹으니 기억이 났어요,,, 원래춘천 쪽 막국수가 저렇더라구요... ",티앤지레저,https://blog.naver.com/hhhhha74,2021-04-27
 춘천 산속에닭갈비 ,https://blog.naver.com/0_witch_0?Redirect=Log&logNo=221850445249,구워먹는곳이랑 철판 닭갈비 중에 고를수있음 나는철판이좋아서 철판에서 냠냠 맛있다! 좀 안쪽에 진짜산속에있는데 다들 너무 친절하심 볶음밥에 치즈사리 없는게 좀 아쉽 이지만 다음에 또 찾아갈듯!... ,LUCKY,https://blog.naver.com/0_witch_0,2020-03-12
옆에 위치한 강촌맛집~ 춘천 미소 닭갈비다녀왔어요~,https://blog.naver.com/prodeller?Redirect=Log&logNo=222384107659,# 춘천닭갈비물론 #숯불 닭갈비로 주문했구요. 감자전 막국수 더덕구이 그리고 메뉴판에는 없는 닭목살... 식당 내부로 들어와 가장 안쪽에 자리잡고~ 우선 첫번째메뉴는 닭목살... 요거 완전 별미에요. 닭목살과... ,한영회원권이광석실장,https://blog.naver.com/prodeller,2021-06-04
"춘천맛집 산속에 닭갈비춘천 산속에 닭갈비 , 줄여서 춘천 산닭",https://blog.naver.com/zaenab582976?Redirect=Log&logNo=221807089265,"춘천맛집 산속에 닭갈비춘천 산속에 닭갈비 , 줄여서 춘천 산닭 껍질만 따로 구워줍니다. 와 이거 바삭해서 별미더라고요. 껍질에 닭을 싸서 먹어보니 와~ 절로 눈이 감겨져요. 오늘은 돼지고기 대신 먹기 좋은... ",zaenab582976님의블로그,https://blog.naver.com/zaenab582976,2020-02-13
 춘천 맛집산속에 닭갈비잔디가 깔려있는 넓은 마당날씨 풀려... ,https://blog.naver.com/petrov_roman1276?Redirect=Log&logNo=221810429466, 춘천 맛집산속에 닭갈비잔디가 깔려있는 넓은 마당날씨 풀려 가족끼리 오면 아이들이 뛰어놀기도 좋겠네요 잔디가 깔려있는 넓은 마당날씨 풀려 가족끼리 오면 아이들이 뛰어놀기도 좋겠네요 그 중에서도... ,petrov_roman1276님의블로그,https://blog.naver.com/petrov_roman1276,2020-02-15
 춘천 맛집산속에 닭갈비눈이 더 녹기 전에,https://blog.naver.com/aleks_baranov179?Redirect=Log&logNo=221810257967," 춘천 맛집산속에 닭갈비눈이 더 녹기 전에닭갈비하면 보통 철판에 볶아먹는 게 일반적이지만이 집에는 숯불이 구워 먹거나 조리가 다 되어 나오는닭갈비 , 사골 닭곰탕 등다양한닭갈비메뉴들이 있답니다.... ",aleks_baranov179님의블로그,https://blog.naver.com/aleks_baranov179,2020-02-15
