title,link,description,bloggername,bloggerlink,postdate
 춘천닭갈비이집 정말 강추해요!,https://blog.naver.com/lasthacker21?Redirect=Log&logNo=221910136203,이 글은 댓가성이 아닌 내돈주고 구매한 제품과 서비스가 만족스러워 남기는 리뷰입니다. #춘천닭갈비 #산속에닭갈비 #할랄인증닭갈비 # 춘천산속에닭갈비#춘천산닭 #메밀막국수 #춘천막국수 #숯불닭갈비,용과장의 리뷰,https://blog.naver.com/lasthacker21,2020-04-15
"춘천맛집 산속에 닭갈비춘천 산속에 닭갈비 , 줄여서 춘천 산닭... ",https://blog.naver.com/qhv7z8axyqzxv?Redirect=Log&logNo=221838750524,"춘천맛집 산속에 닭갈비춘천 산속에 닭갈비 , 줄여서 춘천 산닭 산속에 닭갈비 춘천맛집 산속에 닭갈비춘천 산속에 닭갈비 , 줄여서 춘천 산닭 달라붙지 않게 구워줍니다. 거참...볶음밥 먹기 딱 좋은 날씨네... ",qhv7z8axyqzxv님의블로그,https://blog.naver.com/qhv7z8axyqzxv,2020-03-05
 춘천 맛집산속에 닭갈비춘천 맛집산속에 닭갈비너는 자거라... ,https://blog.naver.com/vokew_696?Redirect=Log&logNo=221817850321, 춘천 맛집산속에 닭갈비춘천 맛집산속에 닭갈비너는 자거라~나는 찍으련다~~ 그리고 계산 하면서 사장님이휴게실 가서 차 한 잔 마시고 가라고 하셔서왼쪽으로 돌아가보니차 마시는 공간이 따로 있었다!! 눈... ,vokew_696님의블로그,https://blog.naver.com/vokew_696,2020-02-21
" 춘천닭갈비택배 :춘천 꼬꼬 닭갈비 , 육질이 연해 아이도 잘... ",https://blog.naver.com/yjiong?Redirect=Log&logNo=222325920625," 춘천닭갈 중앙식품,춘천 꼬꼬 양념닭갈비1KG (기본) / 12,800원 비를 이 자리에 모셔왔어요. 이런 거창한 타이틀이 붙는걸 보니, 어쩜 제 추억속일부분을 차지하고 있는 유 ** 보다 더 맛있을지도? 항상 택배를... ",이 소 블 리,https://blog.naver.com/yjiong,2021-04-28
" 춘천마실... 참나무 숯불닭갈비 , 차 마실산 ",https://blog.naver.com/parkjj00?Redirect=Log&logNo=60168879652,"상호 : 참나무 숫불닭갈비주소 : 강원도춘천 시 신북읍 천전6리 64-4 (또는 신샘밭로 715) 전화 : 033-242... 다시 출발점으로 돌아와 전화로 수소문, 어렵사리 찾은 '차 마실산 '이라는 찻집이다. 나중에 담벼락에... ",일등감자가 되는 그날까지,https://blog.naver.com/parkjj00,2012-08-14
"한여름 뜨거웠던춘천_닭갈비 와 감자빵, 옥수수.",https://blog.naver.com/moibonbon?Redirect=Log&logNo=222537863702, 춘천 에오면 꼭닭갈비 를 먹는다. #토담닭갈비 는 너무맛있다.춘천 의 하늘은 다른도시의 하늘보다 높은거같다. 그리고 햇볕이 무지 뜨겁다. 살갗이 데일정도의 뜨거운 햇빛은춘천 의 매력이다. 여름만되면 그... ,hi : ),https://blog.naver.com/moibonbon,2021-10-15
 춘천닭갈비맛집 일단 잡숴봐유!,https://blog.naver.com/egofkhk?Redirect=Log&logNo=221538872005,# 춘천닭갈비 맛집 #데이트 다녀온 날 날이 좋아서~ 맑아서~ 입덧이 끝나니 배가 고파서 자꾸 생각나는 곳... 들었는데요산 속에있는 펜션이 주로 목조 느낌으로 지어져서 편안함도 주고 나무냄새 풀냄새도 제대로... ,김센스네 집,https://blog.naver.com/egofkhk,2019-05-16
 춘천제이드가든 근처 맛집 마당 닭갈비산속야외 테이블에서... ,https://blog.naver.com/rnqhsro999?Redirect=Log&logNo=221917188022, 춘천제이드가든 근처 맛집 마당 닭갈비춘천제이드가든에서 길을 타고 쭉 내려오다 보면 샛길이... 테이블은 저 창호지로 된 문 안쪽 방에도 앉을 수 있고산쪽으로 야외 분위기 내면서 먹을 수 있는 테이블도... ,Foodie & Tour,https://blog.naver.com/rnqhsro999,2020-04-19
 춘천닭갈비하면산속에 닭갈비모르는 사람 없지용 :),https://blog.naver.com/vviez12544?Redirect=Log&logNo=221725044884,# 춘천닭갈비# 춘천닭갈비 맛집 #라데나골프클럽맛집 # 춘천 맛집추천 # 춘천 현지인맛집 # 춘천닭갈비 추천 # 산속에닭갈비#라데나골프gc맛집 #라데나골프클럽주변맛집 안녕하세요 고고리뷰 고리뷰 입니다... ,♥슬기로운 일상 생활♥,https://blog.naver.com/vviez12544,2019-12-02
KBS2 생생정보춘천된장 닭갈비맛집 위치?,https://blog.naver.com/yyyoungju?Redirect=Log&logNo=222359639770,#생생정보맛집#춘천맛집#생생정보닭갈비맛집#춘천된장닭갈비#춘전된장닭갈비맛집# 춘천산속에닭갈비 #춘천맛집산속에닭갈비#KBS2생생정보맛집 KBS2 생생정보 춘천닭갈비 맛집 산속에닭갈비 강원도... ,초코짱 이야기,https://blog.naver.com/yyyoungju,2021-05-21
 춘천닭갈비맛집 산닭( 산속에 닭갈비 ),https://blog.naver.com/hrstudio29?Redirect=Log&logNo=221610024181, 춘천닭갈비맛집 산닭( 산속에 닭갈비 ) 칠전동 88공원 부근에 위치해 있습니다. 요즘..닭갈비 집들이 너~~무 좋아졌습니다! 맛도 눈도 힐링힐링 ♬ 예쁜 마당에서 인생샷은 덤 _ 안쪽에도 창에 빛도 잘들어오고... ,카메라로그리는 감성,https://blog.naver.com/hrstudio29,2019-08-24
 춘천숯불 닭갈비먹방의 힘!,https://blog.naver.com/zjffja1539?Redirect=Log&logNo=222217112000,"새로산바베큐그릴에 양갈비부터 바베큐를 시작했는데 손님 접대를 하느라닭갈비굽는 사진은 확보를 못하였습니다. 하지만,춘천숯불 닭갈비'명종'은 근래에 먹어본춘천숯불 닭갈비 중 으뜸이라고 할수... ",보스마리아,https://blog.naver.com/zjffja1539,2021-01-25
생생정보통춘천된장 닭갈비숯불된장 닭갈비메밀막국수... ,https://dodo1004love.tistory.com/entry/%EC%83%9D%EC%83%9D%EC%A0%95%EB%B3%B4%ED%86%B5-%EC%B6%98%EC%B2%9C-%EB%90%9C%EC%9E%A5%EB%8B%AD%EA%B0%88%EB%B9%84-%EC%88%AF%EB%B6%88%EB%90%9C%EC%9E%A5%EB%8B%AD%EA%B0%88%EB%B9%84-%EB%A9%94%EB%B0%80%EB%A7%89%EA%B5%AD%EC%88%98-%EC%83%9D%EC%83%9D%EC%A0%95%EB%B3%B4-%EB%B9%84%EB%B2%95-24%EC%8B%9C-%EB%B0%A5%EC%83%81%EC%9D%84-%ED%84%B8%EC%96%B4%EB%9D%BC-%EB%8B%AD%EA%B0%88%EB%B9%84%EC%A7%91-%EA%B3%B5%EA%B0%9C,"춘천 된장닭갈비, 메밀막국수 정보는 바로 아래에 있어요 ■춘천 산속에 닭갈비강원도 춘천시 옛경춘로 562-22 033-242-8895 영업시간: 11시~22시 ★ 생생정보통 통오징어해물뼈찜 묵은지감자탕 생생정보 백 년... ",영숙이네집,https://dodo1004love.tistory.com/,2021-05-20
화천 이외수문학관춘천대룡산일몰 형제숯불 닭갈비 ,https://blog.naver.com/fimm58?Redirect=Log&logNo=221628110156,형제 숯불 닭갈비어둠이 내린춘천형제숯불 닭갈비 집에 도착한 시간은 오후 8시쯤 문을 열고 안으로 들어서니 반갑게 손님을 안내로 자리를 잡고 간장닭갈비 와 양념닭갈비주문을 받고 곧바로 숯불들이... ,자연은 살아있는 책,https://blog.naver.com/fimm58,2020-06-18
" 닭갈비 , 왜춘천 인가?",https://blog.naver.com/namujun?Redirect=Log&logNo=100191346583,그래서 제가 아닌 지인들(대부분춘천토박이들)이 얘기하는춘천닭갈비 에 대해 포스팅하겠습니다.... 못이루어도춘천 은 지금도 열대아라는 것이 없답니다. 땡볕인 한 낮엔 닭들이 집 뒤산 속에들어가 놀고... ,조각보디자인 초록물감,https://blog.naver.com/namujun,2013-07-05
[ 춘천 여행] 동기간 아이산테니스펜션 경강오리구이 숯불 닭갈비 ,https://blog.naver.com/ma_pick?Redirect=Log&logNo=222327361356,숯불 닭갈비경강오리구이 언제나 여행은 신나는 것.. 열심히 짐을 싸고.... 평소에 잘 안들고 다니는... 오리고기 집이긴 했는데 ㅋㅋㅋㅋ 우리는 숯불닭갈비 를 먹었다는.. 4명이서 8인분...ㄷㄷㄷㄷㄷ 입구... ,J의 인생열차,https://blog.naver.com/ma_pick,2021-04-29
#.춘천맛집 -춘천 명물 닭갈비 막국수,https://blog.naver.com/cesi6?Redirect=Log&logNo=222467002681, 춘천닭갈비 집 가보면 가게 한 곳에서 숯불 닭갈비 와 철판 닭갈비같이 운영하는 곳이 많이 있음 최근에 올린산속에 닭갈비도 두가지 모두 이용 가능!!춘천닭갈비 집은 어딜가나 포장 택배서비스 가능한듯!!... ,cecilia cantabile♬,https://blog.naver.com/cesi6,2021-08-12
2020'춘천 으로닭갈비마실을 가다,https://ddoly.tistory.com/entry/2020-%EC%B6%98%EC%B2%9C%EC%9C%BC%EB%A1%9C-%EB%8B%AD%EA%B0%88%EB%B9%84-%EB%A7%88%EC%8B%A4%EC%9D%84-%EA%B0%80%EB%8B%A4?category=492405?category=492405,"갑자기춘천 의닭갈비 가 먹고싶다는 아들들의 의견에 급조성되어진춘천 마실.춘천 이야 워낙 가까워 여행이랄것도 없고,닭갈비 나 백숙이 먹고싶다면 바로바로 결정하고 떠나는 바로 그런 곳. 주말인지라... ",Designer's Works,https://ddoly.tistory.com/,2020-10-15
 산속에 닭갈비 (강원도춘천 ),https://blog.naver.com/handson70?Redirect=Log&logNo=222047039885,"집에서 좀 많이 멀지만춘천 의 수많은닭갈비가게(가봤던 곳) 중 단연 최고 입니다. 맛, 친절, 분위기 모두 다~~~ 그리 깊지도 높지도 않은 산이라서 그런지 터가 좋은건지 이곳에 오면 힐링이 됩니다.",마음그리기님의블로그,https://blog.naver.com/handson70,2020-07-31
 춘천맛집춘천닭갈비옹장골 다녀왔어요,https://blog.naver.com/iii8787?Redirect=Log&logNo=220974752977,최고의 칭구멤버들과 같이 할수 있다는건 행복이기두 해요 란딩후 칭구들과의 맛집투어는 정말 입을 즐겁게 해 주기두 한답니당 유명한춘천닭갈비맛집 옹장골춘천 을 왔으니춘천닭갈비 는 먹어봐야겠죠... ,내사랑 엘리❤,https://blog.naver.com/iii8787,2017-04-04
"춘천맛집 산속에 닭갈비춘천 산속에 닭갈비 , 줄여서 춘천 산닭",https://blog.naver.com/62q10y4al0?Redirect=Log&logNo=221817482290,"춘천맛집 산속에 닭갈비 춘천맛집 산속에 닭갈비춘천 산속에 닭갈비 , 줄여서 춘천 산닭 춘천맛집 산속에 닭갈비춘천 산속에 닭갈비 , 줄여서 춘천 산닭 맛있게 볶아진 밥 위에 물김치를 올려 먹으니 훨씬 더... ",62q10y4al0님의블로그,https://blog.naver.com/62q10y4al0,2020-02-20
"가족나들이, 김유정 문학촌 그리고춘천숯불 닭갈비 를 맛보다.",https://blog.naver.com/phpnet?Redirect=Log&logNo=221346670454,"가족나들이, 김유정 문학촌 그리고춘천숯불 닭갈비 를 맛보다. 가족나들이를 다녀왔어요. 갑자기산 속청정한 공기가 그리웠고 아이들도 특별한 약속이 없는 듯 함께 나서주니 고맙더라고요. 성인이 된... ",배꽃의 소박한 밥상이야기,https://blog.naver.com/phpnet,2018-08-27
[ 강원도 홍천 ] 모둘자리 힐링체험마을 (+ 춘천황소 닭갈비 ),https://blog.naver.com/jim1203?Redirect=Log&logNo=220415914072,"먼저, 저는 모둘자리 힐링 체험마을로 가기 전에춘천 으로 가서닭갈비 를 먹었어요~닭갈비 집 이름은 황소닭갈비 ! 황소닭갈비 의 마스코트 멍뭉이! 이 아이의 이름은 무엇인지 모르나.. 굉장히 귀여웠던 백구... ",소소한 일상에도 감사하자,https://blog.naver.com/jim1203,2015-07-10
[ 춘천 / 닭갈비 ] 통나무집 닭갈비 ,https://blog.naver.com/cckcr?Redirect=Log&logNo=222049675724,백년가게춘천닭갈비 의 추억에 매력이 쌓인다 통나무집 닭갈비춘천 에서 먹는 ‘ 닭갈비 ’ 한 점의... 북적이는 가게 내부 안으로 들어서니 창가자리에서 보이는산풍경이 아름답다. 자연 속에서 먹는 기분을... ,춘천교차로 Blog,https://blog.naver.com/cckcr,2020-08-03
2021년8월23일-가족여행/ 춘천 통나무집 닭갈비 /세계주류마켓,https://blog.naver.com/sorasweet?Redirect=Log&logNo=222482418677,2시간을 달려서 먼저 점심을 먹기위해 # 춘천#통나무집 닭갈비토담으로 가려고했는데 평일에도 줄서는건 무엇이냐.... 그래서 그앞에있는 통나무집 닭갈비소금구이+더덕구이시켜서 촙촙닭갈비 도 부드럽고... ,소라 BLOG,https://blog.naver.com/sorasweet,2021-08-24
( 춘천 ) 집다리골 자연휴양림,https://blog.naver.com/chaijj?Redirect=Log&logNo=222538538552,'21.10.8~9춘천집다리골 자연휴양림.. 텐트를 치고 캠핑할곳을 찾다가 결국 자연휴양림을 다시... 이동 물놀이도 하고 배드민턴도 치고닭갈비먹방에~~ 즐거운 하루를 보내고 집으로 오는길에 들린 예쁜 카페,Nostalgia,https://blog.naver.com/chaijj,2021-10-16
"호텔 오라(Ora), 로코갤러리, 제이드가든,춘천우성 닭갈비 )",https://blog.naver.com/volkrays?Redirect=Log&logNo=221338384978,"안되겠다 싶어서 다시춘천 쪽으로 향했다. 아침고요수목원과 같이산 속에잘 가꾸어진 조그만...춘천 하면 또 유명한 것이닭갈비 가 아니던가? 매번 통나무집을 갔으니, 이번에는 검색으로 수요미식회에... ",채C,https://blog.naver.com/volkrays,2018-08-14
급작스럽게 찾아갔었지만 꽤나 만족스러웠던춘천닭갈비 빵,https://blog.naver.com/flightstar?Redirect=Log&logNo=221920595744,"드디어 보이는춘천닭갈비 빵 본사!!!!! 문을 열고 들어가니 이렇게 빵들이 좌르륵 진열되어 있습니다. 위부터 기본맛, 치즈맛, 매운맛 이렇게 있어요. 여기서 앉을곳은 여기 한군데뿐입니다. 여기서는 먹을수 있는... ",이기적인 내가 되자,https://blog.naver.com/flightstar,2020-04-21
[아이와 함께춘천당일치기... 소양강처녀 닭갈비- 감자밭,https://blog.naver.com/lilysuna?Redirect=Log&logNo=222421969017,"애들 데리고 엄청 걸어가야 한 군데 나오고, 그거 끝나고 또 계~~ 속걸어가야 또 나오고... 애들의 입에선... 더구나 여기서 사용하는 채소는 전부 농사지으시는 걸로 하셨다고 하니...ㅎㅎㅎ 드디어춘천닭갈비 ... ",못말리는 덕후 릴리의 덕질창고,https://blog.naver.com/lilysuna,2021-07-06
"강원도 가족여행 #7.춘천 - 토담숯불 닭갈비 , 소양강댐",https://blog.naver.com/1004dkny?Redirect=Log&logNo=220791998635,(예전에 친구 102보 입대 할 때 친구 부모님과 갔던산 속닭갈비집을 너무 찾고 싶어요) 데이트 코스로는 좋을 지 모르지만 부모님과 함께 하기엔 좀 모잘랐네요 강원도 가족여행 7탄춘천닭갈비 ... ,독과노인 블로그,https://blog.naver.com/1004dkny,2016-08-20
"[육아] 춘천 나들이,춘천 맛집, 닭갈비 맛집, 산속에닭갈비 ... ",https://blog.naver.com/daejimr?Redirect=Log&logNo=221684878589,"[육아] 춘천 나들이,춘천 맛집, 닭갈비 맛집, 산속에닭갈비 ,해피초원목장,아이랑가볼만한곳 https://blog.naver.com/daejimr/221683815197 # 춘천 나들이 # 춘천 가볼만한곳 # 춘천#해피초원목장 안녕하세요 :)춘천 에 도착하자마자... ",R A N I D A I L Y ᵔᴥᵔ,https://blog.naver.com/daejimr,2019-10-22
 춘천삼악산 등선폭포 단풍 탐방과 명물 닭갈비 손막국수 회식,https://blog.naver.com/jbjoo0537?Redirect=Log&logNo=222176757581,서울서 내려가 어머님 산소와 등선폭포까지 탐방을 하고 나니 오후 2시가 넘어서 배가 곺으던 차에 맛있는닭갈비 를 보니 입맛이 돋는다.^^닭갈비 를 먹고춘천 에 왔으니 또 막국수를 메어야지요.^^ 식당 이름과... ,꿈과 낭만으로 보는 여행 스케치,https://blog.naver.com/jbjoo0537,2020-12-17
 춘천닭갈비골목 줄서서 먹는 명가닭갈비!!,https://blog.naver.com/rlfehdtkchs?Redirect=Log&logNo=220929231326,명가닭갈비춘천닭갈비골목에서 가장 초입에위치하고 있어서 찾기가 아주 쉬워요~이곳은 예전에 산악동호회 분들하고 춘천산 을 등반했을때왕복 픽업 서비스를 받게 되면서 알게됐어요~그때 그 맛에 반해서... ,내마음 별과같이,https://blog.naver.com/rlfehdtkchs,2017-02-07
[자전거여행]춘천닭갈비먹고 오기,https://blog.naver.com/navychan09?Redirect=Log&logNo=130070902994,[자전거여행] 후배들과 함께한춘천닭갈비여행 ◆ 주행코스 : 운길산역 - 대성리 - 청평유원지 - 가평...춘천 으로 고고!! 업힐 후 만난 의암터널~!! 역시 터널속차동차 소리는 맴을 쪼리게 한다... 흐미... ,즐겨라 인생아~,https://blog.naver.com/navychan09,2009-10-06
 춘천 맛집산속에 닭갈비이 곳에서 먹었던 메밀파전 입니다.... ,https://blog.naver.com/88si0da53?Redirect=Log&logNo=221817377808,주차 용이 / 넓은 부지 / 철판닭갈비/ 석쇠닭갈비춘천 에 왔다하면 반드시 생각나는 그것! 닭갈비 !하지만 의외로 맛집을 찾기가 굉장히 어렵답니다온 동네 사람들이 도모라도 한 듯 닭갈비식당만 즐비하기... ,88si0da53님의블로그,https://blog.naver.com/88si0da53,2020-02-20
" 춘천가볼만한 곳, 제이드가든 : 동화속숲을 경험 할 수 있는... ",https://blog.naver.com/luavy?Redirect=Log&logNo=222475365498, 닭갈비 까지 팔고.. 먹고 갈 수 있는 홀은 생각보다 분위기가 괜찮고 타이밍 눈치게임에 성공하면... 할춘천제이드가든 수목원 최고의 포인트. 미야자키 하야오의 작품속풍경이 자연스레 떠오르는 숲. 어떤... ,나는 봄이다.,https://blog.naver.com/luavy,2021-08-19
파주 마장호수 맛집춘천닭갈비달인맛집,https://blog.naver.com/iamsuyoni?Redirect=Log&logNo=222512479475,ㅋㅋㅋㅋ 돈가스와 막국수가 먹어달라고 유혹했지만 파주 마장호수맛집 달인맛집춘천닭갈비2인을 주문함! 스페셜메뉴 인춘천닭갈비는 2인분 부터 주문이 가능하니 참고하시길~~ 달인맛집 기본반찬... ,yoni's daily log,https://blog.naver.com/iamsuyoni,2021-09-21
