title,link,description,bloggername,bloggerlink,postdate
라데나cc맛집산속에 닭갈비 ,https://blog.naver.com/youngsook411?Redirect=Log&logNo=222312276059,셀프 닭갈비의 꽃은 볶음밥~~ 배가 불러도 맛 봐야함요. 2인분만시킴 라데나cc 근처 밥집으로 괜찮습니다.^^ 비온뒤라 날씨가 쾌청합니다. #라데나cc맛집 #라데나cc닭갈비 # 춘천산속에닭갈비#라데나cc밥집,★뷰티플 라이프★,https://blog.naver.com/youngsook411,2021-04-16
 춘천 산속에 닭갈비 _맛집 추천2TV 저녁 생생정보,http://saffroner.egloos.com/6791969,생생정보 춘천 닭갈비춘천 산속에 닭갈비: 강원도 춘천시 온의동(옛경춘로)에 있는 닭갈비 전문점(안심식당)입니다. 생생정보통 맛집오늘 오늘메뉴 : 된장 닭갈비메밀막국수 영업시간 : 오전 11시... ,당신의 손길이 닿기 전에,http://saffroner.egloos.com/,2021-05-21
전통있는춘천닭갈비맛집 소개,https://blog.naver.com/lightsout?Redirect=Log&logNo=222401031037,어제는 친구와춘천 에 갔다가 30년 전통으로 유명한춘천닭갈비맛집을 찾아갔습니다. 감칠맛 나는 양념에 구운 신선한닭갈비 의 퀄리티가 남달랐기에 소개해봅니다. 1. 비와별 닭갈비본점 원조 닭갈비(250g)... ,UltraOrange's Light Illusion,https://blog.naver.com/lightsout,2021-06-17
[닭갈비]춘천 산속에 닭갈비 ,https://blog.naver.com/thewisepine?Redirect=Log&logNo=222403212000, 춘천 산속에 닭갈비 . 볼 일이 있어 춘천에 갔다가 저녁을 얼른 먹으려 찾은 집이다. 인터넷 검색에서는 그냥 작은 집인지 알았는데 거대하다. 안도 널찍하다 철판에 먹는 닭갈비만 먹어봤는데 이렇게 숯불에 구워... ,哲딱書니,https://blog.naver.com/thewisepine,2021-06-19
 춘천 산속에 서 먹는 맛집~포들포들한닭갈비 !산속에 닭갈비 ,https://blog.naver.com/gkswjdals0899?Redirect=Log&logNo=222165506134,산 바라보면서 한입 먹으면 그냥.. 끝- 이래서 산속에 닭갈비라고 이름 지으신거겠지?? 이것좀 보세요1!!!... 오래오래 있어주세요!!! ㅋㅋㅋ #춘천닭갈비 # 춘천산속에닭갈비#춘천맛집 #산닭 #춘천닭갈비맛집,찐맛집러,https://blog.naver.com/gkswjdals0899,2020-12-07
[강원도춘천 시]산속에 닭갈비( 춘천닭갈비찐맛),https://blog.naver.com/anna_486?Redirect=Log&logNo=222130713029,오빠랑 오빠 친구 커플이랑 1박 2일로춘천 에 놀러가면서 들렸던춘천닭갈비찐맛집산속에 닭갈비 ! 엄청 유명한 곳이었다.. (네이버의 힘만 믿고 갔던산속에 닭갈비 )산속에 닭갈비 는 정말 이름처럼... ,실버스타,https://blog.naver.com/anna_486,2020-10-30
" 춘천분위기 좋고 맛도 좋은닭갈비 ,산속에 닭갈비 ( 춘천산 닭)",https://blog.naver.com/partysj?Redirect=Log&logNo=221933454431,"춘천 숲속에닭갈비 진짜 넓은데요, 홀도 룸도 넓찍넓찍해서 단체로 가기에도 딱이네요 가격은 춘천의 다른 닭갈비집들과 비슷하더라구요 드디어 푸짐한 닭갈비가 나왔어요!춘천 산속에닭갈비 는 고기 양이... ",한걸음 한걸음 바르게 걷는 여자,https://blog.naver.com/partysj,2020-04-28
 춘천닭갈비맛집 숯불닭갈비 는산속에 닭갈비 지!,https://blog.naver.com/jieun110794?Redirect=Log&logNo=222038122983,바로춘천닭갈비 쥬!!춘천닭갈비 를 먹으러 가기로 했어요.춘천 하면닭갈비 지만~~~~ 너무너무 많은춘천닭갈비맛집 중에 어디로 가야 맛있다고 하려나? 고민하고 있었는데 같이 놀러온 오빠 지인이 추천해준... ,신우은우맘의 소통 공간,https://blog.naver.com/jieun110794,2020-07-22
생생경제정보톡톡 닭갈비춘천 산속에 닭갈비트렌드톡톡... ,https://blog.naver.com/irenekim81?Redirect=Log&logNo=222456425164,닭갈비춘천 산속에 닭갈비트렌드톡톡 21년 8월 4일 금 방송 정보 -이슈 톡톡- 일상 속 예기치... kr -트렌드 톡톡-춘천 산속에 닭갈비강원도 춘천시 옛경춘로 562-22 0507-1386-8938 더 자세한... ,맛있는 하루 Pine Story',https://blog.naver.com/irenekim81,2021-08-04
 춘천맛집닭갈비산속에 닭갈비 ,https://blog.naver.com/park2478?Redirect=Log&logNo=221857128139,목적지도 없이춘천 쪽으로 가던중 왼쪽 산아래 위치한 통나무집 꼬불꼬불 따라가보니 산아래춘천닭갈비산속에 닭갈비집이란다. 하늘이 파랗고 예쁘다. 그냥 들어갔다.춘천닭갈비산속에 닭갈비집에서... ,"윤선생 스마트랜드 수원영통,광교수지 010-9590-9968",https://blog.naver.com/park2478,2020-03-16
[ 춘천닭갈비 집] -산속에 닭갈비 ,https://blog.naver.com/tpfktpdls?Redirect=Log&logNo=222015699646,# 춘천닭갈비# 산속에닭갈비# 닭갈비 맛집 #가평 닭갈비한 쪽에 준비되어 있는 셀프바! 부족하신 반찬은 셀프바에서~~ 택배주문 및 포장판매도 하고 있더라구요 ㅎㅎ 참고하세요 # 춘천 철판 닭갈비 ... ,adares' daily life story,https://blog.naver.com/tpfktpdls,2020-06-29
" 산속에닭갈비 . 춘천닭갈비맛집,산닭",https://blog.naver.com/chr2774?Redirect=Log&logNo=221803386239," 산속에 닭갈비춘천닭갈비맛집 산닭 안녕하세요~? 라이프 써퍼 입니다~~춘천 ?하면 무엇이 떠오르세요?? 아마닭갈비,막국수,이런것들이겠죠?춘천 에 오래살아서닭갈비 를 많이 먹긴하지만,때가 되면 먹고싶고... ",춘천SD플랫폼(김영향),https://blog.naver.com/chr2774,2020-02-10
라운딩 후라면... ' 산속에 닭갈비 '를 찾을 것을 추천합니다.,https://blog.naver.com/jbsuh60?Redirect=Log&logNo=222030401048,"지금의 산솕에 닭갈비의 모습을 담은 사진들인데, 시간이 흐를수록 더 멋진 공간이 될거라 확신해.# 춘천산속에닭갈비 #라데나GC#철판닭갈비#숯불닭갈비#춘천산닭",자유로운 삶을 꿈꾸는 자의 여행스케치,https://blog.naver.com/jbsuh60,2020-07-14
생생정보 춘천 닭갈비 맛집춘천 산속에 닭갈비 ,https://blog.naver.com/epic3127?Redirect=Log&logNo=222360434938,된장닭갈비 #생생정보 춘천 닭갈비 #닭갈비 레시피 #생생정보통 맛집오늘 #춘천 숯불닭갈비 맛집 자세한 내용은 아래 링크에 확인해보세요.생생정보 춘천 닭갈비 맛집춘천 산속에 닭갈비 ,Forest,https://blog.naver.com/epic3127,2021-05-21
 춘천닭갈비산속에닭갈비 ,https://blog.naver.com/osky-0625?Redirect=Log&logNo=222474304792,여름의 더위의 맹위를 떨치고 입추가 지나고 가을의 입성을 알리듯이 선선한 바람이 불기 시작하고 어스름한저녁춘천닭갈비칠전동산속에닭갈비 를 향해간다. 넓은 주차장은 입구부터 넓은 바다를 연상하고... ,~자전거 타고 달리기 ~~~좋은 춘천 살고싶은 집,https://blog.naver.com/osky-0625,2021-08-18
#.춘천맛집 추천 -산속에닭갈비 ,https://blog.naver.com/cesi6?Redirect=Log&logNo=222439703875,별장같은 느낌의 # 춘천산속에닭갈비들어가자마자 체온체크하고 살짜쿵 둘러보기!! 지니가 어디를 가든... 고민된다면 #산속에닭갈비 꼭 가보길 추천합니당!!! #춘천닭갈비맛집 산속에 닭갈비 포스팅 이만 총총,cecilia cantabile♬,https://blog.naver.com/cesi6,2021-07-21
 산속에 닭갈비산닭. 친절함에 반한춘천닭갈비식당,https://blog.naver.com/iopoto?Redirect=Log&logNo=222034152687,네이버 예약 시 혜택있어요 ^0^춘천 의닭갈비식당을 찾다가 발견한 식당입니다 연로하신 부모님과 식사하기 위해 무엇보다 쾌적하고 친절하고 맛있는 식당을 찾았거든요 소문난 맛집들은 대부분 오래 되고... ,꿈꾸며~사랑해~,https://blog.naver.com/iopoto,2020-07-18
 춘천 맛집산속에닭갈비찐 후기♥,https://blog.naver.com/waefmkl51616?Redirect=Log&logNo=222101129632, 춘천 맛집산속에닭갈비찐 후기♥ 지난주에는 가족들이랑 예약해둔닭갈비 집을 다녀왔어요 예약을 해둔터라 바로 음식 셋팅도 되어있고 빨리 후딱 먹고 나올 수 있었습니다 만족스러웠어요 배가 엄청 불러서... ,waefmkl51616님의블로그,https://blog.naver.com/waefmkl51616,2020-09-27
해피초원목장 +춘천 의암호스카이워크 + 우성 닭갈비 ,https://blog.naver.com/coya1016?Redirect=Log&logNo=222351356594,ㅋㅋㅋㅋㅋ산 속에위치한 해피초원목장에서 신나게 놀고 이동 하기 ~ 여기는춘천 에서 제일 유명한?... 시원~ 한 막국수도 한 젓가락 먹었다:) 배부르지만 볶음밥은 먹어줘야 ㅋㅋㅋ # 춘천닭갈비하면 숯불에... ,"너랑,노는게제일좋아",https://blog.naver.com/coya1016,2021-05-14
"강원도춘천여행 Day 1 통나무집닭갈비 , 잭슨나인스 호텔... ",https://blog.naver.com/chdl89?Redirect=Log&logNo=222513558859," 춘천통나무집닭갈비춘천맛집 한시간 사십분 여를 달려 도착한춘천 의 대표 맛집, 통나무집닭갈비 는 이 번이 두번째 방문, 워낙 인기가 많은 곳이기도하고, 마침 주말(토요일) 이어서 인지 사람들이 여전히... ",채영테이블 :: 필라테스 강사의 건강한 식탁,https://blog.naver.com/chdl89,2021-09-22
춘천맛집 산속에 닭갈비춘천 산속에 닭갈비기본반찬 이에요,https://blog.naver.com/maleyah_maeyagez_227?Redirect=Log&logNo=221805503039,집중불법좁다출입술병예금저편승진#영프로#춘천맛집#춘천닭갈비맛집#영프로맛집#춘천닭갈비추천#춘천숯불닭갈비# 춘천산속에닭갈비 장남싹#영프로권하아무#춘천맛집차녹이#춘천닭갈비맛집작은육체... ,maleyah_maeyagez_227님의블로그,https://blog.naver.com/maleyah_maeyagez_227,2020-02-12
초대형 돌판닭갈비 집 @춘천옹장골 닭갈비 ,https://blog.naver.com/yesican1?Redirect=Log&logNo=222323958411,[쭌의맛집 2235]춘천옹장골 닭갈비전화 033-263-2633 주소 강원춘천 시 남면 소주고개로 213-106 주차 가능... - 옹장골닭갈비입구 -산 속제일 안쪽에 자리를 잡고 있다. 식사 후 주변을 둘러보는 것도.. 좋을 듯... ,쭌의맛집 since 2003,https://blog.naver.com/yesican1,2021-04-26
" 춘천닭갈비 ,산속에닭갈비 , 분위기좋은 강원도맛집",https://blog.naver.com/yuneeid?Redirect=Log&logNo=221653151777,"숯불에 구우려면 자꾸 타서 굽기도 힘들고, 아무래도춘천닭갈비하면 철판 닭갈비아니었나요? 그래서 첨부터 철판 닭갈비 를 먹으려고 결정하고 간거였거든요. 근데 불판이 달라서 철판은 오른편에 있는 홀로... ","봄날공방*천연비누,캔들,디퓨저,천연화장품클래스",https://blog.naver.com/yuneeid,2019-09-19
습하고 무더운 여름날씨 입맛 없을때_춘천닭갈비 막국수,https://blog.naver.com/labbor?Redirect=Log&logNo=222428758853,습하고 무더운 여름날씨 입맛 없을때 _춘천닭갈비 막국수 구석구석 맛집정보를 많이 알고계신 선배님 덕분에 한가로운 평일점심을 맛갈나게(?) 즐길수가 있었습니다. 습하고 무더운 여름날씨 입맛없을때 딱... ,블로그 읽어주는 남자 _ 소금꽃,https://blog.naver.com/labbor,2021-07-12
 춘천 산속에 닭갈비 ,https://blog.daum.net/wjdtjr3/1014,처가 가족춘천여행산속에 닭갈비에서,김정석 미카엘 입니다.,https://blog.daum.net/wjdtjr3,2021-10-05
 춘천 산속 의닭갈비집,https://blog.naver.com/lbo5836?Redirect=Log&logNo=221617288907,알려드리오니 산속에 닭갈비 꼭 한번 가보세요. ♬ T. 033) 242-8895 H. ***-****-**** 주소 : 춘천시 옛경춘로 562-20 # 춘천산속에닭갈비#산속에닭갈비 #춘천닭갈비 #별꿈을꾸는꽃 #달과별처럼은은한빛이기를 #이병옥,춘천댁의 소소한 이야기,https://blog.naver.com/lbo5836,2019-08-15
라데나cc맛집춘천산속에닭갈비 ,https://blog.naver.com/singler_ey?Redirect=Log&logNo=222401786760,"잔디와 공들인 티가나는 실내 인테리어가 고오급져서 음식사진 찍는 것도 잊어버렸네....춘천산속에닭갈비찾아 오시는 길 #라데나cc맛집, #춘천, #닭갈비맛집, #산속에닭갈비,#TrafficX, #맛집소개, #바이럴마케팅",식탐과 발걸음,https://blog.naver.com/singler_ey,2021-06-18
 춘천맛집 두 곳 / 퇴계막국수 /산속에 닭갈비 ,https://blog.naver.com/hrightnow?Redirect=Log&logNo=221619353823," 산속에 닭갈비 를 고집해서 (아들 입맛을 믿어보기로 하고) 와 봤어요. 이런 곳에 식당이 있어? 하는 곳을 부모님은춘천초행길에 헤매다 발견하신 모양이에요.춘천 에서도 외곽인 것 같은데 주차장도 1,2로... ","Thank you, Piano",https://blog.naver.com/hrightnow,2019-08-17
" 춘천 , 진짜산속에있는닭갈비집[ 산속에 닭갈비 ]",https://blog.naver.com/k2jongin?Redirect=Log&logNo=221607288169,(포장은 7천원 이라고 함) # 춘천산속에닭갈비 솔직후기리뷰 #춘천칠전동온의동닭갈비집추천 #춘천카페같은닭갈비집 #춘천경치좋은닭갈비집 #춘천예쁜맛집추천가성비훌륭방문후기 #춘천가볼만한곳... ,크리스 코리아™,https://blog.naver.com/k2jongin,2019-08-06
[고기]춘천 맛집 온의동 새로생긴산속에닭갈비 ,https://blog.naver.com/ssonywony?Redirect=Log&logNo=221584214720,산속에닭갈비 033-242-8895 #춘천맛집 #온의동맛집 #칠전동맛집 #춘천닭갈비 #춘천단체모임 #춘천회식할만한곳 # 춘천산속에닭갈비#산속에닭갈비 #춘천숯불닭갈비 #춘천철판닭갈비 #숯불닭갈비 #철판닭갈비... ,소니와 워니의 춘천일기,https://blog.naver.com/ssonywony,2019-07-12
 춘천 맛집닭갈비 맛집산속에 닭갈비 ,https://blog.naver.com/gksqlc4693?Redirect=Log&logNo=221645004245,#영프로 #춘천맛집 #춘천닭갈비맛집 #영프로맛집 #춘천닭갈비추천 #춘천숯불닭갈비 # 춘천산속에닭갈비#산속에닭갈비 #춘천산닭 #춘천맛집산닭 #춘천여행 #춘천투어 #춘천가볼만한곳 #춘천산토리니 #춘천명동,YOUNGPRO & YOUNGSENSATION,https://blog.naver.com/gksqlc4693,2019-09-10
"춘천맛집 산속에 닭갈비춘천 산속에 닭갈비 , 줄여서 춘천 산닭",https://blog.naver.com/nzjw782?Redirect=Log&logNo=221834152923,"춘천맛집 산속에 닭갈비춘천 산속에 닭갈비 , 줄여서 춘천 산닭 양념닭갈비의 경우는 양념맛이 강하지 않아서 좋았어요~간장과 반반 주문한건 넘 잘한거 같아요~ 춘천맛집 산속에 닭갈비춘천 산속에 닭갈비 ... ",nzjw782님의블로그,https://blog.naver.com/nzjw782,2020-03-02
생생정보통 된장닭갈비... 강원도춘천산속에닭갈비5월... ,https://comcomin.tistory.com/16953,5월 20일 목요일 kbs 2tv 생생정보 1317회 비법 24시 밥상을 털어라 된장 닭갈비 메밀막국수 [춘천산속에닭갈비] 전화번호 033-242-8895 주소 강원도 춘천시 온의동 445 영업시간 11:00 ~ 22:00 메뉴... ,★■ 일루와 ■★,https://comcomin.tistory.com/,2021-05-20
강원도 춘천시 온의동춘천산속에닭갈비2021년 5월 20일... ,https://mylovegae.tistory.com/13793,상호:춘천산속에닭갈비위치: 강원도 춘천시 온의동 445 연락처: 033-242-8895 생생정보통 된장닭갈비 메밀막국수 2TV 생생정보 비법24시 밥상을 털어라 강원도 춘천시 온의동춘천산속에닭갈비 ... ,●내가 누구개●,https://mylovegae.tistory.com/,2021-05-20
 춘천 맛집산속에 닭갈비춘천 맛집산속에 닭갈비저 뒤로도... ,https://blog.naver.com/maksim_belkin579?Redirect=Log&logNo=221816249769,"춘천맛집 산속에 닭갈비 저 뒤로도 룸이 있어요~ 춘천맛집 산속에 닭갈비춘천 산속에 닭갈비 , 줄여서 춘천 산닭 포장판매도 하고 있더라구요~집갈때 사가지고 가면좋아요~산속에 닭갈비가 아주 맛있어서집에... ",maksim_belkin579님의블로그,https://blog.naver.com/maksim_belkin579,2020-02-20
" 춘천닭갈비맛집산속에닭갈비(숯불, 철판 두가지 다가능한 곳)",https://blog.naver.com/sera8668?Redirect=Log&logNo=221613226723,또 춘천 번개 하러 와야겠어요.춘천 산속에 닭갈비강원 춘천시 옛경춘로 562-22 033-242-8895 영업시간은 11... com/sera8668/221610978745 #춘천산속닭갈비 #산속닭갈비 #춘천맛집 #춘천닭갈비 #내돈내산 https://tv.naver.com/v... ,여행가세라 여행블로그,https://blog.naver.com/sera8668,2019-08-11
메밀막국수춘천산속닭갈비대동맛지도 참복찜 웅어회... ,https://blog.naver.com/anarch69?Redirect=Log&logNo=222358567174,"주메뉴 철판 양념닭갈비 12,000원 숯불 매콤양념닭갈비 12,000원 숯불 간장닭갈비 12,000원 숯불 소금닭갈비 12,000원 막국수 7,000원춘천산속에닭갈비주소:강원도 춘천시 옛경춘로 562-22 전화:033-242-8895... ",콩콩이의 맛있는 여행,https://blog.naver.com/anarch69,2021-05-20
" 춘천닭갈비맛집, 산닭( 산속에닭갈비 ) 새로생긴 맛집 대박",https://blog.naver.com/rlqnswhdmsgk?Redirect=Log&logNo=221586027513,"춘천 닭갈비 맛집, 산닭(산속에닭갈비) 새로생긴 맛집 대박 춘천에 교육프로그램 듣고 있어서 종종... 함께 예쁘고 안전하게 포장까지 해주셨네요~춘천 산속에 닭갈비전화 033-242-8895 영업 매일 11:00~22:00",보편적 웃음코드,https://blog.naver.com/rlqnswhdmsgk,2019-07-15
"[육아] 춘천 나들이춘천 맛집산속에닭갈비 , 춘천 카페 신북커피... ",https://blog.naver.com/daejimr?Redirect=Log&logNo=222260437449, 닭갈비 를 사랑하는 저희 오빠 마음을 사로 잡은닭갈비집이예요:) # 춘천 맛집 # 춘천닭갈비# 닭갈비 맛집 울집 어린이는 매울까봐 늘 곰탕 시켜서 먹었는데 어린이밥이랑 우동등 아이들이 먹을 수 있는... ,R A N I D A I L Y ᵔᴥᵔ,https://blog.naver.com/daejimr,2021-03-01
강원도 속초 벚꽃 여행 ::춘천 산속에닭갈비 /카페 설악산로... ,https://blog.naver.com/tjsdn96dud?Redirect=Log&logNo=222300379858,일단춘천 에 들려서 점심밥 목기. 최대한 사람 없을 것 같고 넓은 음식점을 찾아보다가산속에 닭갈비 라고 욱이가 찾아냈다.닭갈비~! 내부가 넓어서 좋았음. 밑반찬 숭숭 나오고. 숯불 우리는 철판 닭갈비말고... ,영주임의 삶,https://blog.naver.com/tjsdn96dud,2021-04-06
[춘천닭갈비]춘천' 산속에 닭갈비 ',https://ddoly.tistory.com/entry/%EC%B6%98%EC%B2%9C%EB%8B%AD%EA%B0%88%EB%B9%84-%EC%82%B0%EC%86%8D%EC%97%90-%EB%8B%AD%EA%B0%88%EB%B9%84?category=386856,"[춘천닭갈비]춘천' 산속에 닭갈비 ' 철판닭갈비와 숯불닭갈비를 모두 취급한다. 하지만, 공간은 분리가 되어져 있다. 한가진 곳에 있어 조용하게 먹기에 좋다. 맛 또한 좋다. 2020:02:29 18:38:27... ",Designer's Works,https://ddoly.tistory.com/,2020-08-20
"[ 춘천 ] 산속에닭갈비 , 숯불닭갈비,철판닭갈비, 춘천닭갈비 맛집",https://blog.naver.com/daejimr?Redirect=Log&logNo=222043815255,"[ 춘천 ] 산속에닭갈비 , 숯불닭갈비,철판닭갈비, 춘천닭갈비 맛집 https://blog.naver.com/daejimr/221683815197 안녕하세요 :) 요즘 계속 장마라 평일내내 비구경만 하다가 주말에 날씨가 너무 화창했어요. 차타고 가면서... ",R A N I D A I L Y ᵔᴥᵔ,https://blog.naver.com/daejimr,2020-07-28
 춘천온의동 분위기 좋고... 가족단위로 오기 좋은산속에닭갈비 ,https://blog.naver.com/jrlad78?Redirect=Log&logNo=221649511529,# 춘천# 산속에닭갈비춘천 산속에닭갈비팥빙수 주는 닭갈비 맛집 명절을 맞이하여 가족끼리 단체로 닭갈비집으로 고고! 이곳은 큰엄마가 자주 가신다고 해서 추천한곳이다 위치는 온의동 88공원 가는길에... ,으네의 일상,https://blog.naver.com/jrlad78,2019-09-16
"[ 춘천 맛집,춘천 데이트]산속에 닭갈비 ",https://blog.naver.com/choi_yeah?Redirect=Log&logNo=221706092926,저도 블로그의 도움을 받아춘천 에 위치한 ‘ 산속에 닭갈비 ’를 다녀왔담미당 (블로그 쵝오)산속에 닭갈비 은 말그대로산 속에있어여 ㅋㅋㅋㅋㅋㅋㅋㅋ 그래서 일반 음식점보다 넓은 땅떵어리에 가게가... ,reve.rin 나의 꿈,https://blog.naver.com/choi_yeah,2019-11-13
 춘천 여행춘천닭갈비 맛집산속에 닭갈비 ,https://blog.naver.com/rlatpdml?Redirect=Log&logNo=221702216329,오랜만에 아이들 시험도 끝나고 해서 휴가 차원해서 다녀왔습니당 :-) 강릉갔다가 돌아오는 길에춘천 에 들려서 # 춘천닭갈비 맛집 다녀왔는데용 바로산속에 닭갈비라는 음식점이예욤산속에닭갈비 는요 강원도... ,❤️세이 블로그❤️,https://blog.naver.com/rlatpdml,2019-11-08
 춘천 맛집)산속에닭갈비 ,https://blog.naver.com/saming3?Redirect=Log&logNo=221770361593,06 우선 # 산속에닭갈비풍경부터 감상하시죠 ♡ 예쁜 풍경을 감상하고 들어가면 친절한 사장님이... 사진속#메밀전 은 #네이버 사전예약을 하면 #서비스로 주세요 ! # 춘천 맛집 검색하다 찾은 #혜택 3인분은 조금... ,봄이❤️,https://blog.naver.com/saming3,2020-01-13
 춘천 . 박사로 드라이브 (feat.산속에 닭갈비 +초밥에 미친... ,https://blog.naver.com/amiaso83?Redirect=Log&logNo=222408561391,강구경을 하며 드라이브가 하고 싶어춘천 에 다녀왔다. 아마도 직장 토요근무가 마무리된 것을... 박사로 드라이브를 계획했어서 근처닭갈비 집을 검색해 늦은 점심을 먹으러 갔다. 코로나 여파로 나들이객이... ,이아샘의 일과 놀이,https://blog.naver.com/amiaso83,2021-06-24
드름산 (의암댐 - 의암봉 - 정상 - 대우아파트 -산속에닭갈비 ),https://blog.naver.com/31875?Redirect=Log&logNo=222207935841,#드름산 #인스타명소 # 춘천#의암봉 #의암댐 #등산 # 산속에닭갈비#산행 #주말 #나들이춘천 산 행 인스타... 풍경과춘천 시내 전경을 한눈에 감상할 수 있는산입니다.. 의암댐 입구 ~ 대우아파트 로 가는 4.35km... ,자이소스토어,https://blog.naver.com/31875,2021-01-16
[ 춘천 ] 산속에닭갈비춘천닭갈비맛집 춘천닭갈비 춘천카페... ,https://blog.naver.com/daejimr?Redirect=Log&logNo=222266090061,[ 춘천 ] 산속에닭갈비춘천닭갈비맛집 춘천닭갈비 춘천카페 서리태크림빵 쑥미숫가루 신북커피 https://blog.naver.com/daejimr/222043815255 안녕하세요:) 춘천 여행엔 여윽시 닭갈비가 아니겠어요? 산속에닭갈비는... ,R A N I D A I L Y ᵔᴥᵔ,https://blog.naver.com/daejimr,2021-03-06
강원도맛집춘천 맛집 숯불 닭갈비식사와 카페를 한번에 즐기는... ,https://blog.naver.com/ii_0_ii?Redirect=Log&logNo=222151699124,안에 믹스커피 뽑아 먹고 자리 앉아서 쉬다가 이것저것 내부에 구경하고 산책하다가는거 좋고 사장님도 친절해서 넘 좋더라구요 담에도 기회되면 갈거에요오!ㅎㅎ # 춘천 여행 # 춘천 맛집 # 춘천닭갈비 ... ,쏘냐잉의 살맛나는맛집,https://blog.naver.com/ii_0_ii,2020-11-23
 춘천당일치기 여행코스#조약돌숯불 닭갈비 본점# 춘천 의암호... ,https://blog.naver.com/hihooho?Redirect=Log&logNo=222510735994,ㅋㅋ # 춘천 조약돌 닭갈비군인들은 밥이 공짜인 것 같았음 경기 북부 도시들의 특징 1. 군인우대 조약돌... 까페는산 속마을 깊숙이 높은 곳에 자리하고 있었는데 진짜 풍경이 죽여줬다!! 주차공간도 널찍하고!... ,낭 만 트 레 블 러 유 자 네 ♪,https://blog.naver.com/hihooho,2021-09-19
된장닭갈비 메밀막국수춘천 산속에 닭갈비위치 연락처,https://blog.naver.com/yh970808?Redirect=Log&logNo=222358761691,"생생정보통 맛집오늘방송 된장닭갈비 메밀막국수춘천 산속에 닭갈비위치 연락처... ▼춘천 닭갈비 가격 보러가기 https://coach1.tistory.com/1783※ 이 글에 언급된 인물, 업체, 제품, 방송과는... ",The Right Choice,https://blog.naver.com/yh970808,2021-05-20
 춘천닭갈비전문점 맛집산속에닭갈비식사 후 좋은 경치를... ,https://blog.naver.com/twri?Redirect=Log&logNo=221979274307,# 춘천닭갈비 전문점 맛집산속에닭갈비식사 후 좋은 경치를 감상할 식당 # 춘천닭갈비# 춘천닭갈비 맛집 # 춘천 데이트코스 # 산속에닭갈비춘천 의 생긴지 얼마 안되는 # 닭갈비 맛집 ? # 산속에닭갈비이다. 보다시피... ,나노-One 나노코팅,https://blog.naver.com/twri,2020-05-26
[ 춘천맛집] 감자밭 감자빵*산속에닭갈비* 공지천포차,https://blog.naver.com/youn83kyoung?Redirect=Log&logNo=222007199312,"이렇게 큰닭갈비 집이 있는 걸 왜 이제사 알았을까요.춘천토박이 자존심에 살짝 스크래치ㅋ 주차장도... 클라우드 생맥으로 목 좀 축여주니, 수다에 모터가 달립니다ㅋ 한 달 전엔산바로 밑이라서 시원했는데... ",살구꽃이 피면 살구꽃이 피는 대로,https://blog.naver.com/youn83kyoung,2020-06-20
 춘천 퇴계동맛집산속에 닭갈비방문 후기,https://blog.naver.com/choidh0725?Redirect=Log&logNo=221818367381, 춘천닭갈비 맛집산속에 닭갈비안녕하세요 볼일 때문에춘천 을 방문해서 두 번째로 먹은 음식에 대해서 포스팅을 써보려고 해요춘천 하면닭갈비 가 굉장히 유명하죠! 제가 방문한 곳은춘천 퇴계동맛집인산속에 ... ,프리훈의 일상저장공간,https://blog.naver.com/choidh0725,2020-02-21
