title,link,description,bloggername,bloggerlink,postdate
"서울숲 나들이 테이킷치지 피크닉박스, 뚝섬카페 차 성수점 ",https://blog.naver.com/4oundme?Redirect=Log&logNo=222460980854,"구성이 참 좋았다! 크루아상 샌드위치와 과일, 치즈, 올리브, 젤리, 크래커와 미니와인까지! 날씨가... 뚝섬카페 가는 날이 장날이라고 이 날 문을 닫았다••••• 그리하여 오랜만에 # 카페차성수점#ㅊa... ",생각 궁전,https://blog.naver.com/4oundme,2021-08-07
달고나 밀크티로 유명한카페 차 (ㅊa)성수점솔직 후기(feat.... ,https://blog.naver.com/yeim1004?Redirect=Log&logNo=222540532699,"유명 카페들을 보면 성수역, 뚝섬역, 서울숲역에 걸쳐 자리하고 있더라고요카페 차 성수점 은 뚝섬역... 성수 카페 차 내부 분위기는 좋았어요! 성수동 갈 때마다 마음에 드는 집이 잘 없네;; 다들 성수 어디로... ",A D O R A,https://blog.naver.com/yeim1004,2021-10-18
성수동카페 차 성수점ㅊa 스콘과 달고나 커피가 유명한 곳... ,https://blog.naver.com/you04041004?Redirect=Log&logNo=222258448742,서울숲 카페 거리를 걷다보면 발견하게되는카페 차 성수점 !! 간판이 ㅊa 라고 적혀있어서 저건 뭐라고... 예쁘게 캔모양의 달고나들도 참 맛나보였어요. 맛은 아는맛이라 보장되었지만 다 먹을 수 없을것 같아서... ,하트쉐이크의 블로그,https://blog.naver.com/you04041004,2021-02-27
"서울숲 피크닉 준비, ㅊa카페 차 성수점 와 엘더버거 포장",https://blog.naver.com/x3xbxb?Redirect=Log&logNo=222342029315, 카페 차 성수점ㅊa 영업시간ㅣ매일 11:00 - 22:00 주소ㅣ서울 성동구 서울숲6길 2 전화ㅣ0507-1395-1025... 부산 서면에 위치한 전포동 카페 차 ㅊa 서울에서 먹고 달고나 밀크티가 그리워 부산에서 서면... ,février archive,https://blog.naver.com/x3xbxb,2021-05-07
[서울 성수동/ 카페 ]카페 차 (ㅊa)성수점 ,https://blog.naver.com/hayelin0308?Redirect=Log&logNo=222362655372,[내돈내산] 서울 성수동 카페 / 카페 차(ㅊa) 성수점 안녕하세요! 예예에요~! 지난 주말 성수동으로... 해서 다녀온카페 차 성수점입니다 : ) ♥ ㅋㅋㅋㅋㅋ카페 차 성수점주소 : 서울특별시 성동구 서울숲6길 2... ,이것저것 너나들이,https://blog.naver.com/hayelin0308,2021-05-24
서울 카페 밀크티 추천/이영자... 유명한카페 차 성수점 ,https://blog.naver.com/mewmew14?Redirect=Log&logNo=222425411671,오늘은 전참시에 나왔던 이영자 달고나밀크티로 유명한카페 차 성수점 에 갔다왔는데요 평일 오전에... 무튼 뭔가 이 사진 갬성있게 나온듯 근데 다시한번봐도 카페 내부가 참 깔끔해서 맘에 들어여! 짜잔!저희가... ,행복한 하루하루님의블로그,https://blog.naver.com/mewmew14,2021-07-09
 카페 차 성수점 (서울숲 핫플레이스 추천 ㅊa),https://blog.naver.com/maxhyuk?Redirect=Log&logNo=222530627681,오늘은 서울숲 핫플레이스인카페 차 성수점 (ㅊa)에 다녀왔다. 지금와서 보니 2층도 있었던건가 2F는... 들어서자마자 깔끔하게 다양한 디저트류와 음료를 볼 수 있고 카페 차 만의 ㅊa로고가 심플하면서도... ,서울 라이프스타일,https://blog.naver.com/maxhyuk,2021-10-08
성수낙낙 주차 : 까치화방성수점: 메뉴 가격 :카페추천,https://blog.naver.com/paperplate?Redirect=Log&logNo=222481377965,"성수낙낙에 있는 까치화방성수점 에 갔다. #성수맛집 #성수 카페#성수낙낙 #성수낙낙맛집 #성수낙낙주차 #성수낙낙 카페성수낙낙은 A,B,C 동으로 나뉘어 있는데 외부에 무민 큰 거 있고, 1층 투썸 있는... ",고민보다 GO,https://blog.naver.com/paperplate,2021-08-23
"서울숲카페 , 센터커피성수점 ",https://blog.naver.com/sua4111?Redirect=Log&logNo=221789049683, 차가지고 가시는 분들은 참고하셔서 주차하세요 ! 오전의 맑은 센터커피의 모습이에요. 저희는 11시쯤 방문했어요.카페내부에 큰 창들이 있어 뒤의 서울숲 풍경을 볼 수 있더라구요. 그게 센터커피성수점 의... ,기억을 위한 기록,https://blog.naver.com/sua4111,2020-01-30
달고나 커피로 유명한 ‘ 카페 차 성수점 ’ 피크닉 세트 출시!... ,https://blog.naver.com/lyj9696?Redirect=Log&logNo=222282794419,예전부터 너무 가보고 싶었던카페 차 성수점 에 다녀왔어요. 처음 ‘이영자 님 맛집’으로 유명세를 치르고 아직까지 성수에서 핫한 달고나 커피 맛집인 카페! ‘카페 ㅊa (차)’ 사실 성수나 서울숲 근처에... ,My life,https://blog.naver.com/lyj9696,2021-03-21
내가 간 카페104 - 서울숲 성수 카페카페 차 성수점 ㅊa 카페,https://blog.naver.com/hooyes11?Redirect=Log&logNo=222500978923,"서울숲6길 2 서울숲 성수 카페카페 차 성수점ㅊa 카페 달고나 맛집, 친절한, 멋스러운 이름이 독특한... 우선 성수점은 서울숲 뒤로 번화한 골목에서 조금 떨어져있어서 살짝 한적하다. 매장은 전체적으로 넓진... ",♡,https://blog.naver.com/hooyes11,2021-09-10
성수 서울숲 카페카페 차 성수점ㅊa 달고나 밀크티 스콘 맛집,https://blog.naver.com/macciattocompany?Redirect=Log&logNo=222515049230,들어오는 카페 차(ㅊa) 한 번 특이한 이름을 익히게 되면 계속 보이게 될 거예요ヽ(✿ﾟ▽ﾟ)ノ 달고나로 만든 달콤한 밀크티와 디저트 즐기러 오세요 :) (출처 :카페 차 성수점 (ㅊa) 공식 인스타그램) www.... ,macciatto,https://blog.naver.com/macciattocompany,2021-09-25
[ 카페 차 (ㅊa)성수점 ] 달고나 밀크티 _ 유니크하고 기발한 밀크티,https://blog.naver.com/zozo345612?Redirect=Log&logNo=222481473101,[카페 차 달고나 밀크티 식전 입가심] ▶ 메뉴 : 달고나 밀크티 ▶ 가게 :카페 차 성수점▶ 구매 이유 : 이영자 맛집을 좋아하는 친구의 권유로 방문. 처음 온 가게에서 가장 특색 있는 시그니처 메뉴를 선호해서... ,Mr꽉툰의 만화카페,https://blog.naver.com/zozo345612,2021-08-23
서울숲역카페 차 성수점ㅊa 밀크티 좋아하는 사람 무조건... ,https://blog.naver.com/kimx2772?Redirect=Log&logNo=222223159754,로고카페 차 성수점 은 아니 카페 차의 간판은 ㅊa라고 쓰여 있어서 은근 궁금한 사람들이 많을 것 같기도 해요 성수점 카페 차 내부는 심플한 편인데 개인적으로 저는 종로점의 카페차의 인테리어 느낌이 더... ,서람쥐의 일상 Life~,https://blog.naver.com/kimx2772,2021-03-31
성수동카페빌로우성수점 ,https://blog.naver.com/tjdahdo?Redirect=Log&logNo=222068268227,성수동카페빌로우성수점 에 갔다왔어요 친구랑 성수동에서 약속이 있어 밥을 먹고 근처카페 를 찾아보다가 망원동 유명한카페빌로우가성수점 에도 생겼다는 걸 보고 찾아갔어요 빌로우성수점입구 입구에... ,To The Moon,https://blog.naver.com/tjdahdo,2020-08-23
"[성수카페] 달고나 커피와 스콘의 조합,카페 차 성수점 ",https://blog.naver.com/yoonjichoi90?Redirect=Log&logNo=222297037537,카페 ㅊa 성수점 Cafe Cha Seongsu 얼마 전에 결혼한 친구 신혼집에 가기 전에 잠시 카페에서 휴식 하다가 가려고카페 차 성수점 에 들렸어요! 스콘이랑 달고나 커피가 맛있대서 기대하고 방문했숩니다!!ㅎㅎ 비가... ,"하루하루 성장하는 즐거움, Angie's Daily Life",https://blog.naver.com/yoonjichoi90,2021-04-03
"성수동 수플레 맛집,카페온화성수점Onhwa",https://blog.naver.com/ariel012?Redirect=Log&logNo=222516633494,"성수역과 뚝섬역 사이, 붉은 벽돌 아래 화사한 꽃들이 만개한카페온화성수점 에 다녀왔다. 날이 좋은 점심때 갔는데 평일이어서일까. 기다리지 않고 바로 앉을 수 있었다. 글 사진. 헤이디 성수동카페 ... ",헤이디꽃길투어,https://blog.naver.com/ariel012,2021-09-28
[성수카페 ] 카멜커피성수점 ,https://blog.naver.com/thered0627?Redirect=Log&logNo=222111738474,"전형적인 동네카페느낌으로 교회가 있는 건물 1층에 위치해 있는 것이 특징. 카멜커피성수점내부 모습. 내부 공간도 그리 넓은 편이 아니고, 좌석도 적은 편이다. 멀리서 힘들게 걸어왔다가 손님이 꽉차 ... ",어느 날 그가 말했다,https://blog.naver.com/thered0627,2020-10-10
"성수동 서울숲역 맛집 |카페이월로스터스성수점 ,카페 차 ... ",https://blog.naver.com/chloesjmin?Redirect=Log&logNo=221846717273,"성수동 서울숲역 맛집 |카페이월로스터스,카페 차 (ㅊa), 호호식당 한달은 더 지난 나들이였는데... 남양주에카페 와 로스팅 센터를 통합 운영하는 플래그십 스토어를 열고, 송파점,성수점 에 이르는... ",Chloe N the City,https://blog.naver.com/chloesjmin,2020-03-10
데이트 코스 ~카페 차 성수점ㅊa ~ 오브젝트 ~ 온량 저녁식사까지~,https://blog.naver.com/1nashin?Redirect=Log&logNo=222062715435,(BLVD 블러바드) 소개팅장소 / 소개팅 코스로도 좋을것 같아요 ㅎㅎ 그럼 하나씩카페 부터 사진으로 보여드리게요카페 차ㅊa성수점달고나 밀크티가 정말 맛있음!! #달고나밀크티 #성수동 카페#서울숲 카페 ... ,"❤️뷰티, 쁘띠, 먹방, 리뷰❤️",https://blog.naver.com/1nashin,2020-08-17
"성수 카페추천,수플레로 유명한 [ 카페 온화] 성수점 ",https://blog.naver.com/yeseul0703?Redirect=Log&logNo=222296497567,말만 하다가 드디어 몇 주 후에 수플레를 먹으러 서울숲 가까운 성수역 근처의 [ 카페 온화] 성수점 에 갔다. '아내의맛' 에 나온 수플레 가게는 익선동에 있으나 익선동은 멀고 가기도 불편하고 내가 익선동... ,예슐리 블로그,https://blog.naver.com/yeseul0703,2021-04-02
 카페 차[ㅊa]성수점오랜만에 재방문 + 당 충전,https://blog.naver.com/mimiyaaah?Redirect=Log&logNo=222390258459,오랜만에카페 차 [ㅊa]성수점 으로! 이 날 기온이 낮지 않았는데 이상하게 바람이 으슬으슬한 느낌이 들어서 시원하게 아아 마실까? 하다가 바로 따끈한 달고나 밀크티로 마음 바꿈 좌석 뒤로 라탄 가방이... ,여기는뽀잉별,https://blog.naver.com/mimiyaaah,2021-06-11
서울숲카페온화성수점 ~ 여기가 수플레 맛집,https://blog.naver.com/haedud128?Redirect=Log&logNo=221798239701,오늘은 꼭! 맛있는 디저트가 목표다~라고 할 때도 무조건인카페 . 재방문의사 200%. 그땐 오빠랑 와야지~성수점 에서만 20% 할인 가능한 쿠폰! 나도 이걸로 또 가야지ㅋㅋㅋ,디지털노마드 해작가,https://blog.naver.com/haedud128,2020-02-06
서울숲길 뚝섬 성수 카페카페차 ( 카페ㅊa)성수점 ,https://blog.naver.com/goyn204?Redirect=Log&logNo=222267374287,ㅠㅠ 선물용으로도 참 좋네요 _ ㅊa 보틀밀크티 - 6000원 카페라떼 - 4500원 컵이 예쁜데 겁나... 단거 좋아하는 저에게는 완전 취저일것같은뎅 _카페 차 성수점서울 성동구 서울숲6길 2 매일 11:00 - 22:00,Yenna's note,https://blog.naver.com/goyn204,2021-03-07
" 카페 차 성수점 , 달고나밀크티 ㅊa",https://blog.naver.com/avecdao?Redirect=Log&logNo=222233534642,"카페 차, 메뉴 ㅊa 대표메뉴 달고나 밀크티, 커피 부터 시작으로 아쌈 밀크티도 있고 잎차, 탄산수... 달달한 음료는 내 취향이 아닌걸로.카페 차 성수점서울특별시 성동구 성수동1가 685-408",en ce moment,https://blog.naver.com/avecdao,2021-02-06
[성수 / 서울숲]카페 차 성수점 (카페 ㅊa),https://blog.naver.com/ggrshinn99?Redirect=Log&logNo=222064115670,"달고나 밀크티가 유명한카페 , 하지만 밀크티 하나만 주목하기에 아쉬운 부분이 많아 다시... 작은카페 이지만 매우 다양한 베이커리 메뉴들을 구비하고 있습니다. 말차 스콘, 초코 스콘, 도넛, 달고나 스콘... ",동네사람의 블로그,https://blog.naver.com/ggrshinn99,2020-08-18
"먹어보고서 37(210717)카페 차 (ㅊa)성수점 , 어쩌면 성수의... ",https://blog.naver.com/lifetv23me?Redirect=Log&logNo=222436219761,"그만큼 이 곳 ' 카페 차 성수점 '은, 맛으로도, 분위기로도, 그 모든 것에서 만족스러웠다. 맛 : 밀크티도... 3.75점. #먹어보고서 #성수 #성수_카페 #뚝섬_카페 #카페_차 #카페_ㅊa # 카페 _ 차 _ 성수점 ",Variety In,https://blog.naver.com/lifetv23me,2021-07-18
성수 밀크티 / 스콘 맛집카페 차 성수점ㅊa / 서울숲 주차장 추천,https://blog.naver.com/leojiwon?Redirect=Log&logNo=222488166908,너무 가보고 싶었는데 사람이 넘 많아서 포기했었는데 일요일 12시 30분 쯤 가니 자리가 넉넉했어요~ # 카페차성수점 영업시간 매일 11:00 - 22:00 #카페차성수메뉴 가격대 참 착했어요! 저흰... ,유. 기록 - near and dear,https://blog.naver.com/leojiwon,2021-08-29
성수 카페; 새들러하우스성수점 ,https://blog.naver.com/bo_1004?Redirect=Log&logNo=222394176995,이제 가까운 성수에서 먹을 수 있게 되서 고고 함 크로플 맛집인 성수역 카페새들러하우스 새들러하우스성수점메뉴판 우린 와플셋 16.2 테이크아웃 셋 13.9 (담엔 플레인 셋 19.6 먹어야 겠음 ㅎㅎ 플레인만... ,나한테 집중해 :^),https://blog.naver.com/bo_1004,2021-06-11
"밀크티, 달고나 스콘이 맛있는카페 차 (ㅊa)성수점(주차 정보)",https://blog.naver.com/girlofcherry?Redirect=Log&logNo=222399990522,달고나 밀크티와 달고나 스콘이 유명한카페 차 (ㅊa)성수점 입니다. 빵소녀는 남양주에 한강 뷰를 바라볼 수 있는카페ㅊa 프리미엄에 먼저 다녀왔는데요.카페ㅊa 프리미엄은카페 차 (ㅊa)성수점 에... ,빵소녀와 커피소년의 일상 블로그ღ,https://blog.naver.com/girlofcherry,2021-06-16
성수동카페 ) 건강한 티 전문점 진지함성수점 ,https://blog.naver.com/dssa1020?Redirect=Log&logNo=222527901517,진지함 한자와 티가 참 잘 어울리는카페 였던 성수동 티 전문점 진지함성수점성수동에 맞는 핫플카페 거나 그렇지는 않지만 너무 핫한카페 에서 조금 지쳤을 때 조용하게카페 를 즐길 수 있는 곳인 것 같다.... ,그래도 삶은 계속된다,https://blog.naver.com/dssa1020,2021-10-05
 카페 노티드성수점자두젤라또 상큼해,https://blog.naver.com/sinakitty?Redirect=Log&logNo=222405050982,좋고 참 귀여워요! 노티드 슈가베어 벌룬과 스마일 벌룬도 판매중이네요~~ 넘넘 귀여워요 2500원씩카페 노티드성수점 은 특이하게 젤라또가 판매한다고해요. 매장마다 판매하는것들이 약간씩 다른것... ,키덜트 시나토이 일상,https://blog.naver.com/sinakitty,2021-06-21
[맛집] 성수 달고나밀크티카페 차/ 블루보틀성수점 ,https://blog.naver.com/norang_?Redirect=Log&logNo=221880026287,☆) 멀리 있어서 다행 처음 들어왔을 때 난리난리였던 블루보틀 이때도 여전히 손님이 많았다 적벽색 외벽도 심플한카페로고도 예쁨 잘 몰라서 그냥카페 라떼 먹으려 했는데 친구몬이 뉴 올리언스 먹어야... ,내 머니 & 내 생각,https://blog.naver.com/norang_,2020-03-29
 카페차ㅊa성수점달고나 밀크티,https://blog.naver.com/ohju1010?Redirect=Log&logNo=222368656578,ㅊa성수점 도 간판이 없어서 여기인가 했어요.. 주차금지 푯말이 있을 법한 위치에 ㅊa 간판이 있어서 당황.. ㅋ 내부는 요렇게 길죽한 의자와 길죽한 바테이블만 있어요. 저기 병에 든 밀크티와 스콘은 사왔어야... ,逍遙日常 소요일상,https://blog.naver.com/ohju1010,2021-05-26
모던한 달달구리 천국:카페 차 성수점ㅊa,https://blog.naver.com/jewjewking?Redirect=Log&logNo=222510821311,다시 여름이 왔나 싶을 정도로 낮에는 아직도 더운 요즘 - 임산부라 나만 더운가 했더니 친구들도 다들 덥다고ㅋ 초가을 더위를 뚫고 달달구리 매니아 친구랑 함께 갔던 성수동카페 차본점 ㅊa 예전에카페 ... ,쥬황 블로그,https://blog.naver.com/jewjewking,2021-09-19
성수역 맛집 삼겹살 맛있는 성수동카페 거리 맛집 김일도 성수점 ,https://blog.naver.com/staybystay?Redirect=Log&logNo=222385647788,"유지된다는것이 참 힘든일인데 한개 해도 어려운건데 여러지점을 잘 운영하고 있다고 생각하는 고기집이랍니다 김일도 성수점 은 100% 국내산 한돈을 사용하고, 우리나라에서 숙성기간이 가장 길게 28일 672시간을... ",아름다운 공간에 머물다 Stay by Stay,https://blog.naver.com/staybystay,2021-06-05
성수 카페::카페 차 (ㅊa)성수점 (달고나밀크티),https://blog.naver.com/zappybead?Redirect=Log&logNo=222484862996,"유명한 카페 차(ㅊa) 성수점까지 그래야 이영자님 맛집코스 정복 아니냐구요,,하하 혹시 맛집리스트... 걸었으니 카페 3번 괜찮지 않나❔ 만걸음 넘게 걸었다구,, # 카페차 성수점내부는 그리 넓지 않았다..!... ",만두속 채우기,https://blog.naver.com/zappybead,2021-08-26
"[성수/서울숲] 달고나 밀크티가 맛있는카페 차 성수점 , ㅊa",https://blog.naver.com/starhj12?Redirect=Log&logNo=222392828029,원-샷 분위기도 좋고 맛도 있어서 다음번에 또 방문하기로 (*´꒳`*) # 카페차성수점#성수카페 #ㅊa #서울숲 #서울숲카페 #이영자카페 #예쁜카페 #달고나밀크티 #데이트 #서울숲데이트 #일상블로그 #인스타핫플,먹고놀고운동하고(๑･̑◡･̑๑),https://blog.naver.com/starhj12,2021-06-10
[성수동/서울숲] ㅊa카페 차 성수점 ,https://blog.naver.com/charlottechoi?Redirect=Log&logNo=222098612304,남편이 이영자 달고나 밀크티로 유명하다고 해서 다로베 예약대기 신청해놓고 들려본카페 차 (ㅊa) ㅊa ↑ 이렇게 써있는게카페이름인줄도 모르고 여기는 간판없는카페 인가봐 이러면서 들어감 ㅋㅋ... ,Charlotte's Day,https://blog.naver.com/charlottechoi,2020-09-24
"[성수동] 서울숲 산책하고 당 충전할 땐,카페 차 성수점 ... ",https://blog.naver.com/minigiyo35?Redirect=Log&logNo=222316955600,2층에는 손님이 없어 조용하게 즐길 수 있었어요 ;) #뚝섬역 #뚝섬역카페 #성수카페추천 #ㅊa # 카페차성수점카체 차(ㅊa) 성수점 저랑 친구는 전시보고 나오는 길이라 당이 땡겨서 달고나 스콘이랑 커피를... ,Mandiful & Colorful,https://blog.naver.com/minigiyo35,2021-04-20
버터크림라떼가 맛있는 하프 카페성수점 ,https://blog.naver.com/jn_1104?Redirect=Log&logNo=222432819480,버터크림라떼가 맛있는 하프 카페성수점하프 카페성수점고속터미널에서 시작한 하프 카페 는 안국점을 거쳐성수점 까지 오픈은 했다. 지금은 전국적으로 생겨서 여러곳에서 볼 수 있는 하프 카페 .성수점 은... ,다운이의 정다운 블로그:D,https://blog.naver.com/jn_1104,2021-07-15
성수 스터디 카페위넌스터디 카페성수점4시간 방문 후기,https://blog.naver.com/weiss2015?Redirect=Log&logNo=222416324449,위넌스터디 카페성수점 으로 결정! 웃긴게 이름은성수점 인데 위치는 뚝섬역 위쪽에 있다 뚝섬점은...카페부분 커피 기계랑 얼음이랑 종이컵차종류가 구비되어 있다 티백이 종류별로 많아서 좋았다 이날 비가... ,생강의 충성충성,https://blog.naver.com/weiss2015,2021-07-12
 카페 차 성수점Cafe ㅊa Seongsu,https://blog.naver.com/jacobj7750?Redirect=Log&logNo=222461264585," 카페 차 성수점Cafe review ::카페 차 성수점Cafe ㅊa Seongsu 안녕하세요 ^_^! 연일 더워지는 날씨에 몹시... 환영해요 카페 차(ㅊa) 성수점 서울 성동구 서울숲6길 2, 1층 매일 11:00 ~ 21:00 공휴일 휴무 #서울숲카페... ",DO WHAT YOU LOVE,https://blog.naver.com/jacobj7750,2021-08-08
서울숲카페하프커피성수점버터크림라떼도넛,https://blog.naver.com/so6198?Redirect=Log&logNo=222151613354,여유가 참 좋아요~ 이런 편안한 여유에 커피와 도넛이 함께 한다면? 퍼풱!! 미리 찾아둔 #성수동 카페 ... 서울숲 근처 #하프커피 성수점한화갤러리아포레 건물 뒤 주택가에 트렌디한 맛집과카페 가 많이 있어... ,연두의 블로그,https://blog.naver.com/so6198,2020-11-23
성수카페 ) 노티드- 성수점 과 피치스점 차이!,https://blog.naver.com/hjdo2001?Redirect=Log&logNo=222422079518,간만에 집 주변카페 를 가게 되었어요 요즘 짝꿍이랑 결혼준비 한다고 알아보러다니느라 정작 성수동을... 되었을 거예요 참! 성수동에는 노티드가 두 곳이 있어요 피치스점과성수점둘의 차이는... ,두서없는 블로그,https://blog.naver.com/hjdo2001,2021-07-06
뚝섬 카페블루보틀성수점/ BLUEBOTTLE 나들이,https://blog.naver.com/diamond407?Redirect=Log&logNo=221714365279,"서울 카페블루보틀 성수 Blue Bottle 서울 카페 쇼 갔던날, 조금 일찍 나와 블루보틀을 방문했다. 동선이 맞는성수점 으로 고고찡~!! 뚝섬역 1번출구로 나오니 바로 보인다. 블루보틀 성수 카페매일 08:00 - 20:00... ",소담이의 사계절 여행 기록장,https://blog.naver.com/diamond407,2019-11-21
"근처 달고나 디저트, 커피, 밀크티 맛집,카페 차(ㅊa)성수점 ",https://blog.naver.com/poli42?Redirect=Log&logNo=222531950962," 카페 ,차(ㅊa) 위치 : 서울 성동구 서울숲 6길 2 (뚝섬역 8번 출구 5분, 서울숲역 5번 출구 10분) 운영 시간 : 11:00 - 22:00 이곳은 달고나를 이용한 디저트와 음료가 유명한, 성수동카페 차(ㅊa) 이다.카페내부는... ",수니의 일상,https://blog.naver.com/poli42,2021-10-09
 카페 차 성수점ㅊa ㅊa ㅊa,https://blog.naver.com/princesspotato?Redirect=Log&logNo=222435826798,성수의 멋진카페소개합니다. ㅊa 남자친구가 얼마 전에 남양주카페 에 다녀와서 커피 테이크아웃 잔... 우아 술빵 예전에 가족끼리 놀러가다차오지게 막히면서 먹었던 술빵 생각나면서 좋았네요. 딱 그맛은... ,@offbuttershop,https://blog.naver.com/princesspotato,2021-07-18
 카페 차 (ㅊa)성수점| 달고나밀크티 드디어 나도 먹어봤다,https://blog.naver.com/sorah8864?Redirect=Log&logNo=222272079399,유명하고유명하고유명한 이영자 달고나커피로 유명한카페 차이제 어느정도 인기는 사그라들었지만 주말에는 웨이팅 옴총총 해야한다해서 걱정 취업하기 전에 평일에 핫한데는 다 가보겠다는 심정으로 일단... ,아메리카누,https://blog.naver.com/sorah8864,2021-03-15
"서울숲카페하프커피성수점: 버터크림라떼, 패션프루츠 티... ",https://blog.naver.com/hjcj0725?Redirect=Log&logNo=222432702140,서울숲카페하프커피성수점하프커피를 알게 된 건 꽤 오래 전인데 여전히 인기 많은 곳이다. 삼고초려도 아니고 세 번째 방문에 드디어 앉아서 먹고 갈 수 있었다. 그마저도 웨이팅하고 들어갔지만.카페 ... ,♪,https://blog.naver.com/hjcj0725,2021-07-15
서울숲 성수동 나들이 : 낙원테산도성수점/카페 차ㅊa... ,https://blog.naver.com/wjdqls916?Redirect=Log&logNo=221971377582,#서울숲맛집 #낙원테산도 성수점#타마고산도 #타마고산도맛집 낙원테산도성수점뚝섬역 근처 https... 다음으로 향한 곳은 성수동에만 오면 방문하는 것 같은 # 카페차# 카페 ㅊa #성수동 카페#서울숲 카페 ... ,Been Today,https://blog.naver.com/wjdqls916,2020-05-20
성수동카페추천 블루보틀 성수카페성수점 ,https://blog.naver.com/yeonhaaaaa?Redirect=Log&logNo=221713150125,블루보틀성수점성수동카페성수동카페추천 성수 블루보틀 가격 블루보틀 메뉴 주소: 서울특별시... 함께 간 제 친구는 꽤 좋아해서 다시 방문하고 싶다 하더라구요! 저도 한 번쯤 경험차가보는 건 추천추천!,맛있는 블로그,https://blog.naver.com/yeonhaaaaa,2019-11-20
[서울 성수 서울숲 카페] ' 카페 차 성수점 ' 달고나밀크티 전참시... ,https://blog.naver.com/eee2248?Redirect=Log&logNo=222132183142,너무 좋아하지만 ㅠㅠ음 나는 그냥 그랬다 #달고나커피 #달고나밀크티 # 카페차성수점#성수동카페추천 #성수동달고나 #달고나스콘 #성수동데이트코스 #성수동분위기좋은곳 #서이추환영 #서이추 #서로이웃,오늘도 기록하기,https://blog.naver.com/eee2248,2020-10-31
[디저트]날 좋은날카페노티드성수점도넛을 먹기위해 줄을... ,https://blog.naver.com/mudtn2000?Redirect=Log&logNo=222396181388," 카페노티드성수점카페노티드성수점요즘 감성을 잘 아는 듯한 노티드 같이 온 친구들도 잘되는데는 다 이유가 있는것같다며,,ㅋㅋㅋㅋ 네온사인이 이쁩니다. 그런 감성 때문인지카페노티드를 방문하신... ",ENTJ 유진이 일상들 모음.zip,https://blog.naver.com/mudtn2000,2021-06-14
