title,link,description,bloggername,bloggerlink,postdate
[내돈내산] 성수동카페 차ㅊa,https://blog.naver.com/lazyrabbit22?Redirect=Log&logNo=222322661663,분명히 처음 온 카페인데 너무 낯익어서 뭘까 했더니... 저 티비에서 이영자 님께서 나온 거 봤어요. 여기서 달고나 라떼 드셨던 거 같은데 ㅋㅋㅋㅋ 거기가 여기카페 차 성수점 이더라구요 ㅋㅋㅋㅋ 티비를... ,게으른토끼,https://blog.naver.com/lazyrabbit22,2021-05-10
성수맛집 평이담백뼈칼국수성수점맛녀석맛집 솔직후기,https://blog.naver.com/jeecool0?Redirect=Log&logNo=222007126107,평이담백뼈칼국수성수점 을 들리게 된 것! 끼애에에에엑!!!!! 3시부터 5시까지는 브레이크타임이었기에... 지금 먹은지 몇시간도 안됐는데 또 먹고싶다 데메는 칼국수집이라 낡고 허름할 줄 알았는데카페 보다... ,티끌이된멍멍이,https://blog.naver.com/jeecool0,2020-06-20
ㅊa카페 차성수☕️(달고나 밀크티 맛집/성수동카페추천),https://blog.naver.com/happyraccon?Redirect=Log&logNo=222356418321,"#ㅊa카페 차 성수점 을 다녀왔어요:) 성수동은 정말 좋은 곳이 많더라구요...✨ 날 잡고 한번 투어해야겠어요ㅎㅎㅎ 저는 달고나를 엄청 좋아해서, 카페 차 예전부터 궁금했었는데 드디어 이번에 다녀왔어요!... ",MARUKOTION,https://blog.naver.com/happyraccon,2021-05-18
성수동카페 거리 주차/ 도렐카페/ 먼치앤구디스 /카페 ... ,https://blog.naver.com/ejsj1004?Redirect=Log&logNo=222525280635,"ㅋㅋㅋㅋㅋㅋㅋㅋㅋ # 카페 노티드 성수점은 규모가 너무 작았어요. 케이크도 없고.. 도넛도 몇 종류 없었고, 그래도 딸 사다주려 줄서서 노티드 도넛 삼! 내가 젤루 좋아하는건 우유크림♡ 이게 몸에만 좋다면... ",공간,https://blog.naver.com/ejsj1004,2021-10-03
" 카페노티드 성수에서 노티드 도넛 사오기, 아이 씐나요!",https://blog.naver.com/iam_robot?Redirect=Log&logNo=222530027547, 카페노티드성수점 에 다녀왔어요! 물론 노티드 도넛을 사려구요!카페노티드성수점 은 처음 가보는데요.카페노티드에 갔던 게 안국점이 처음이자 마지막이었어요. 노티드 도넛 먹어본지 너무 오래돼서 그... ,말랑한 독사 지영씨의 디자인 사무소,https://blog.naver.com/iam_robot,2021-10-07
"하프 커피성수점카페 , 하프 언더바 방문 리뷰",https://blog.naver.com/hallakang?Redirect=Log&logNo=222279708805,"아인슈패너,말차크림라떼,카페 라떼랑 레몬도넛, 라즈베리 도넛, 몰트 도넛을 주문했습니다 왼쪽에... 꽉 찬 도넛입니다안국동과 강남 파미에스테이션에도 하프커피가 있나 봅니다 나중에 알고 보니 하프의... ",제임스씨의 일상,https://blog.naver.com/hallakang,2021-03-19
seoul_서울숲 갈대밭_성수 ㅊa_오브젝트성수점 ,https://blog.naver.com/hjjung4800?Redirect=Log&logNo=222126382747,서울숲 -카페- 저녁으로 대충 코스를 잡고 놀아보았습니당 1번 코스는 서울숲서울숲 서울 성동구... 갔습니당차 성수점서울 성동구 서울숲6길 2 1층 (성수동1가) 매일 10:00 ~ 22:00 http://kko.to/e9yTR8iDB 옛... ,wmw,https://blog.naver.com/hjjung4800,2020-10-26
성수카페- 블루보틀성수점뉴올리언스,https://blog.naver.com/goseonghae?Redirect=Log&logNo=221938723732,"친구차타고 교외카페 를 가려고 하다가, 꽉.... 찬 차를 보고 식겁해서 성수로 방향 전환! 많고 많은... 블루보틀성수점 의 모습. 생소하시죠..? ㅋ 1시 넘어가니까 줄을 길~게 서던 공간. 메뉴판이 흐리게 찍혀... ",사각사각,https://blog.naver.com/goseonghae,2020-05-01
"밀도성수점 , 서울숲빵집, 나혼자산다 장도연이 먹은 빵집",https://blog.naver.com/jsn920?Redirect=Log&logNo=222203741427,#밀도 성수점#내돈내산 제돈으로 직접 계산하고 먹어본 후기랍니당.ㅎㅎ 결국 저녁먹고 나서 디저트로...달달하고 크림 가득한 큐브식빵 하나를 꺼내어 디 카페 인 커피한잔에.. 야금야금 야식을 먹었더랬죠.ㅋㅋ... ,그린향기의 일상& 여행...,https://blog.naver.com/jsn920,2021-01-11
"남양주카페 , 한옥 카페 차프리미엄(ㅊa)",https://blog.naver.com/jiyoon_nv?Redirect=Log&logNo=222283475936,"비오는 토요일, 갈 곳 찾아 헤메이다 들어간 차 프리미엄. 이쁜곳을 발견해따!!! 나인블록있는 그... 요즘 카페들 그렇듯이 사진찍고 이쁘게 해놓은거 보러가는 그런 곳ㅋ 여기 달고나 맛있음!!카페 차 성수점 에서... ",잠겨죽어도 좋으니 너는 물처럼 내게 밀려오라,https://blog.naver.com/jiyoon_nv,2021-03-22
성수동카페블루보틀성수점 ,https://blog.naver.com/omungmung?Redirect=Log&logNo=221809163710,"보틀은차내려 마시려고 샀고요! 콜드브루 30,000원 머그컵 각 20,000원 블루보틀성수점직원분들도... 올리언스 마셔보고 싶네요 이상 성수동카페블루보틀성수점 이었습니다 :) 영업시간 매일 08:00 - 20:00 주차불가",99% 먹부림,https://blog.naver.com/omungmung,2020-02-14
새로운 트렌드의 메카 프리미엄카페'온화성수점 ' 수플레... ,https://blog.naver.com/aboutrepair?Redirect=Log&logNo=221607272332,요즘 트렌드의 메카로 주목받는 프리미엄카페온화성수점프리미엄 수입자동차 실내복원실내크리닝가죽시트코팅 전문업체 어바웃리페어(about repair) 안녕하세요? 끊임없는 도전과 다양하고 풍부한... ,어바웃리페어❤️자동차실내복원/시트코팅/기술교육,https://blog.naver.com/aboutrepair,2019-08-06
"[서울숲, 뚝섬카페 ] 슈퍼말 차 성수점 ",https://blog.naver.com/armed49?Redirect=Log&logNo=222019773718,서울숲 산책 후 입가심을 위한 마지막 코스 ㅎㅎ 슈퍼말 차 성수점 에 오랜만에 재방문 했어요~ 매장은...카페 인 없는 차라서 속을 달래기에 그만이래요. ㅎㅎ 과일차는카페 인과 당이 없는 천연 과일차로... ,연못 속 호수 그리는 물고기,https://blog.naver.com/armed49,2020-07-03
[뚝섬역카페 /서울숲카페 ] 블루보틀성수점놀라플로트... ,https://blog.naver.com/disapointed?Redirect=Log&logNo=222038029901,#뚝섬역 카페#서울숲 카페블루보틀성수점간만에 아침부터 쨍한 날씨~~ 첫째가 학교가는 날이랑 둘째... #블루보틀성수점 이 있는 건물 옆 골목이 좁아요. 아마 주말에차가지고 들어오면 대략낭패일듯.... ,꿈꾸는줌마의 꿈터,https://blog.naver.com/disapointed,2020-07-22
성수동카페오설록 아모레성수점루프탑 OSULLOC,https://blog.naver.com/wskky92y?Redirect=Log&logNo=221684940977,"오설록답게 다양한차종류가 준비되어 있어요ㅋㅋㅋ 오설록 차는 패키징도 예쁘게 구성되어 있어서 선물하기에도 좋아요ㅋㅋㅋ 초콜릿, 녹차 잼 등도 준비되어 있어요. 오설록 아모레성수점 은... ",강장군 월드,https://blog.naver.com/wskky92y,2019-10-22
 카페노티트 성수 가봄! 노티드도넛 맛나네~,https://blog.naver.com/behappyall?Redirect=Log&logNo=222530982693,입장했네요^^ # 카페 노티드 성수점영업시간은 매일 오전 11시부터 오후 8시까지네요~ 성수노티드 카페 ... 빵이 참 맛있더라구요~ 쫀득쫀득하고 부드러워서 크림하고 잘 어울렸어요~ 라즈베리크런치도넛 약간의... ,리뷰라이프MEY,https://blog.naver.com/behappyall,2021-10-08
서울숲 삼겹살 맛집 일품 일미락성수점 ,https://blog.naver.com/vernie222?Redirect=Log&logNo=221787893359,000원으로 따로카페 를 가지 않고 식사와 커피까지 해결이 가능한 #일미락 성수점캠핑을 갈 때나 집에서 패키지로 먹을 수 있게 구성도 되어 있네요 또 한 가지 마음에 든 건 기본으로 나오는 장아찌와 김치를... ,베르니의 하루하루이야기,https://blog.naver.com/vernie222,2020-01-29
[뚝섬역 카페 ]블루보틀 성수점 ,https://blog.naver.com/kkyhj?Redirect=Log&logNo=221698072710,"이번 주 방문한카페 는? 대한민국을 떠들썩하게 만들었던 블루보틀이에요!! 오픈 전부터 대기 줄이... 블루보틀성수점 이 생기고 얼마 되지않아 서울 강남,압구정,삼청동 등 여러 곳에 많이 생겼더라구요. 가장... ",lila,https://blog.naver.com/kkyhj,2019-11-04
FEB (1) : 성수동카페BBHAY / 성수연방 內 창화당성수점 ,https://blog.naver.com/toomyung_?Redirect=Log&logNo=221803825503,# 카페 그라인드 #CAFE_GRIND https://store.naver.com/restaurants/detail?id=36803777 커피는 되게 맛있는데 자주... 이 동네는 평일 점심 커피를 많이 마시기 때문에 내가 다니는 길목에카페 가 있는게 중요하다. 아니면... ,meat and potatoes,https://blog.naver.com/toomyung_,2020-02-10
성수동 카페카페 차다녀왔습니다.카페ㅊa,https://blog.naver.com/j08s06?Redirect=Log&logNo=222394215159, 카페 차 성수점서울숲 근처에 오셔서 한 번 방문해보세요. 분위기도 좋고 넓은 카페 차! 주차는 할 곳이 따로 없고 도보 5분 거리에 성도구민종합체육센터 공용주차장에다가 대야한다더라구요. 참고하세요!... ,토요일이 기다려지는 쎄러데이 입니다.,https://blog.naver.com/j08s06,2021-06-11
[성수동]카페 차‘ㅊa’ / 달고나밀크티 / 성수동카페거리... ,https://blog.naver.com/whdmsql1104?Redirect=Log&logNo=222349640848, 카페 차 성수점외관 특이한 인테리어없이 정말 깔끔하다. 카페 차 메뉴 카페 차 메뉴와 가격 아메리카노 5.0 대표메뉴 달고나밀크티 5.0 순두부딸기우유 초콜렛커피 등 다양한 메뉴도 많다. 가격도 좋다! 카페... ,응비의 취미 공간,https://blog.naver.com/whdmsql1104,2021-05-13
성수동 카페오설록티하우스 아모레 성수점상수동핫플 추천,https://blog.naver.com/daily__record?Redirect=Log&logNo=221976975251,"그렇게 오설록티하우스 아모레 성수점안을 구석구석 구경하고 2층에 있는 오설록으로 고고! 원래 목적은카페 였기 때문에차한잔 하고 나갑니당ㅎㅎ오설록도 20%나 할인받을 수 있구요, 이렇게 라떼아트까지... ",Daily Record,https://blog.naver.com/daily__record,2020-05-24
성수 피치스 도원노티드도넛성수점다녀왔오용(메뉴/내부... ,https://blog.naver.com/yoooup?Redirect=Log&logNo=222337173815, 카페 노티드성수점 은 피치스 도원과 함께 있어요! 피치스 도원의 차도 구경하고 도넛도 사고~ 사람은... 뒤에차보이시나요? ㅋㅋㅋㅋㅋㅋㅋㅋㅋㅋㅋㅋ아니 대체 저거 어떻게 꽂은거야... 넘 신기해서 사진도... ,나대는게 제일 행복한 사람,https://blog.naver.com/yoooup,2021-05-04
"인테리어 취저, 크로플 맛집 새들러하우스성수점 ",https://blog.naver.com/hgmnr?Redirect=Log&logNo=222447994259,#성수 카페 추천 #새들러하우스 성수점#크로플맛집 #성수핫플 #성수 카페#성수동핫플 #새들러하우스 #새들러하우스크로플 #서울크로플맛집 #서울 카페 추천 #성수동 카페 추천 #성수크로플맛집 #성수동 카페 ... ,생각이 젊은 사람들의 도전 발라또｜VALLATTO,https://blog.naver.com/hgmnr,2021-07-28
키즈 카페- 이마트성수점애플트리,https://blog.naver.com/babpul_bori?Redirect=Log&logNo=220418606540,"이마트성수점3층에 있는 키즈 카페- 애플트리에 다녀왔어요. 이마트의 본점이성수점 이에요. 그래서인가... 물건도 좀 많은 것 같고, 시식코너도 종류도 다양하면서 활발하게 운영되고 있어요. 카트가... ",삼각김밥공룡,https://blog.naver.com/babpul_bori,2015-07-19
성수 전참시 이영자 카페카페차ㅊa 에서 맛본 달고나커피,https://blog.naver.com/violet1542?Redirect=Log&logNo=222474545923,그 곳은 바로바로 성수 카페 차 ㅊa 이다.카페 차 성수점주소 서울 성동구 서울숲6길 2 2호선 뚝섬역을 이용하시는 분들은 뚝섬역 1번출구에서 도보6분 수인분당선 서울숲역을 이용하시는분들은 서울숲역... ,월간부부 탱꼬리,https://blog.naver.com/violet1542,2021-08-18
 성수점 ] 좀 많이 유명한 라떼가 있는 서울숲 성수동카페 ,https://blog.naver.com/sugyeong6407?Redirect=Log&logNo=222468334957,체인점도 많은 거 같으니 아직 먹어보지 못한 크림 라떼를 먹으러 가봐야겠다하프커피성수점주소 서울 성동구 서울숲4길 12 1층 영업시간 매일 11:00 - 22:00 (라스트 오더 21:00) 포장 가능 / 배달 가능,작은 거인의 세계,https://blog.naver.com/sugyeong6407,2021-08-13
[서울 성수동카페 ] 새들러하우스성수점Saddler haus(2호점)... ,https://blog.naver.com/lee-heee?Redirect=Log&logNo=222268822820,반입가능한카페 를 찾았습니다!카페 는 곧 포스팅해서 링크 걸어둘게요 뜨거울때 바로 먹어야한다고 했던 콘와플먼저 우선 이와플의 주의사항이있어요 한입베어물면 콘이 우수수수수수... ,CHACHA :)og,https://blog.naver.com/lee-heee,2021-03-08
신상 카페가오픈 하프 언더바성수점첫 손님으로 무료 도넛... ,https://blog.naver.com/cloudiasky?Redirect=Log&logNo=222040927425,성수동에 신상카페가오픈 중이에요 고터와 안국 지점은 있었지만성수점 은 처음 오픈하는 것 같아서... 고르기 어려웠어요 하프 커피의 존재를 알아도 가본 적이 없으니 ㅠ 친구와 저 둘 다차주문했어요... ,.°•*°seuleyule°*•°.,https://blog.naver.com/cloudiasky,2020-07-25
서울숲 _ 하프 커피성수점(halff coffee),https://blog.naver.com/happytoo19?Redirect=Log&logNo=222382657645,- 하프커피성수점- #블챌 #오늘일기 #서울 카페#하프커피 #하프커피 성수점#서울숲 카페#서울숲 # 카페 투어 #버터크림라떼 #호지차도넛 #후지필름 #후지x100f #x100f #fujifilm,Margherita,https://blog.naver.com/happytoo19,2021-06-03
건대 성수 쌀국수 맛집 반포식스성수점 ,https://blog.naver.com/youngah1321?Redirect=Log&logNo=222537229847,"해놓고 이제서야 다녀온 반포식스성수점 ! 후기시작할게요~ 성수동 쌀국수 반포식스 쌀국수 존맛탱... 거리상으로 봤을 때 조금 멀게 느껴질 수 있는데, 여기는 성수낙낙이라고 해서 이케아랩과카페 들... ",곱단이네,https://blog.naver.com/youngah1321,2021-10-14
맛있는 힐링카페이월 로스터스(february roasters)성수점 ,https://blog.naver.com/dmswl9801?Redirect=Log&logNo=221900727597,방문한 성수동 이월로스터스카페잠실에도 있다는데성수점 으로 첫방문을 했어요 지도상으로 여기가 맞는데 하고 한바퀴 돌아서 2층에카페 를 발견했어요 ㅋㅋㅋㅋㅋㅋㅋㅋ1층 성수 베이킹 스튜디오에... ,먼지의 하루,https://blog.naver.com/dmswl9801,2020-04-10
"서울숲카페/ 빵집 : 센터커피성수점 , 아꼬데 뒤 파르크 ! 핫플... ",https://blog.naver.com/yeseul530?Redirect=Log&logNo=222118693940,"#서울숲 카페#서울숲센터커피 #센터커피 성수점#성수동핫플 #서울숲 카페 거리 #아꼬데뒤파르크 #서울숲빵집 안녕하세요^^ 슬 ye 입니다. 오늘은, 서울숲카페'센터커피' 방문기 공개하려구요. 센터커피는... ",삶의 소소한 낙,https://blog.naver.com/yeseul530,2020-10-18
"가수 쿨의 김성수, 한방 카페성수점대표로 창업",https://blog.naver.com/komf1?Redirect=Log&logNo=60110969434,"‘슬퍼지려 하기전에’, ‘해변의 여인’ 등 수많은 히트곡을 탄생시킨 ‘가수 쿨’의 리더 김성수씨가 한방 카페성수점대표로 사업을 시작하였습니다. 웰빙 시대의 트랜드에 발맞춰 한방을 소재로 한카페 를... ",한국한방식품공사,https://blog.naver.com/komf1,2010-07-13
성수/서울숲카페추천 센터커피성수점 ,https://blog.naver.com/mygood0408?Redirect=Log&logNo=221513406537,센터커피 말고도 다른카페 나 소품샵들을 구경 하는 것도 좋을 것 같아요 이상 센터커피성수점 의 후기였습니다. #센터커피 #서울숲 #서울숲역 #뚝섬역 #서울 카페# 카페 추천 #서울숲뷰 #성수 카페#서울숲 카페 ,뚜벅츄의 정보공유 Diary,https://blog.naver.com/mygood0408,2019-04-14
"기록하고 싶은 하루, 도치피자성수점 , 브루잉 세레모니",https://blog.naver.com/mystory2011?Redirect=Log&logNo=221995575850,"브런치는 도치피자성수점 으로 go~ 메뉴는 마르게리따 피자, 오일파스타, 카프레제 주문했는데... 핸드드립 커피 좋아하는 분들께 추천하고 싶은 성수동카페브루잉 세레모니~ 오랜만에 동생 덕분에... ",욕망그녀 enjoy my life~ ☕,https://blog.naver.com/mystory2011,2020-06-09
[ 카페 리뷰] 성수카페 거리'진지함성수점 ' 탐방기!!,https://blog.naver.com/xzaw808?Redirect=Log&logNo=222297742302,먹는 물을 돈주고 사먹을거라곤 전혀 생각도 못했었다. 엄마가 참 많이 생각나던카페다음엔 엄마랑 같이 와서 전통차 마셔봐야지 다른 카페 에선 느껴보지 못한 어릴적 향수를 떠오르게 한카페 였다.♥️,성경으로 다시 보는 세상 [RE:VIEW],https://blog.naver.com/xzaw808,2021-04-04
