title,link,description,bloggername,bloggerlink,postdate
성수동 공유오피스 스파크플러스성수점이용 후기,https://blog.naver.com/4lovelyannie?Redirect=Log&logNo=222285393005,"그래서 이번에 성수동 공유오피스 스파크플러스성수점 을 한 번 이용해봤어요. 이용후기 시작합니다!... 커피와차등카페서비스를 24시간 이용할 수 있고, 평일 아침에는 토스트나 시리얼, 떡 같은 간편식도... ",리뚜뿌네 하우스,https://blog.naver.com/4lovelyannie,2021-03-23
성수 중식당 코스요리가 있는 차이나플레인성수점성수동 카페 ... ,https://blog.naver.com/taekstory?Redirect=Log&logNo=222403425837,성수 중식당 차이나플레인성수점 에 다녀왔습니다. 성수동 카페 거리 옆에 있어서 찾아가기도 쉽고요. 무엇보다도 성수역 바로 앞에 위치하고 있기에 위치적으로도 매력적이라고 할 수 있습니다. 다수의 룸이... ,하이택의 여행 연구소,https://blog.naver.com/taekstory,2021-06-22
성수동맛집 가정식 스테이크 미도인성수점 ,https://blog.naver.com/badanol?Redirect=Log&logNo=222464272382,성수동맛집 미도인 성수 성수동카페 거리 근처에 위치한 가정식 식당 성수역 4번 출구에서 도보로 3분 주택을 개조 화이트 색상으로 한 눈에 돋보이는 건물 1층 미도인성수점미도인 성수 주소 : 서울 성동구... ,또다른 라미의 세상,https://blog.naver.com/badanol,2021-08-10
"성수동카페 , 뚝섬역카페 ) 블루보틀성수점 ",https://blog.naver.com/hanmee87?Redirect=Log&logNo=222316796104,라떼 마셔야지 사람들은 뉴올리언스가 젤 맛나다는데.. 내 입맛엔 영... 블루보틀 리뷰끝~ #내돈내산 #블루보틀 #블루보틀 성수점#성수데이트 #성수 카페#뚝섬역 카페#성수동데이트 #서울데이트 #서울 카페 ,나의 공간,https://blog.naver.com/hanmee87,2021-04-20
제주감성 아닌듯한 제주 카페도렐성수점 에서 땅콩커피를,https://blog.naver.com/re_born___?Redirect=Log&logNo=222225150738,제주에 1호점을 낸카페도렐 도렐?! 도렐 ㅋㅋㅋ 창업하신분이 굉장히 감각적이고 자유영혼이실것... 도렐 성수점얼른 테이크아웃 해야한다는 생각에 사진도 얼마찍지를 않았는데... 예상치못한 점원분의 물음.... ,이너스칼프 ' smp시술 머리문신 ',https://blog.naver.com/re_born___,2021-01-30
[뚝섬카페 ] 이월로스터스성수점 ,https://blog.naver.com/mint7939?Redirect=Log&logNo=222250580566,♀️ 주말잘보내고 계신가욤 오늘은성수점 에 있는 이월로스터스에 대해서 포스팅해보려고 해요. 성수동에는 성수갬성 있는카페 가 많은데 한편으로는 또 막상카페 를 가려고 하니 어딜 가야할지... ,C'est la vie ♥,https://blog.naver.com/mint7939,2021-02-20
[성수동 뚝섬역카페 ]카페 차/ ㅊa,https://blog.naver.com/archive8?Redirect=Log&logNo=222534412705,#카페차 성수카페 차 성수점 은 이영자님이 전참시에서 달고나 밀크티 맛집으로 소개해 유명한 곳.... 좋아하고 달고나도 좋아해서 나름 괜찮았지만 특별한 맛을 기대한다면 실망할 수도. 카페 차 매일 11:00 ~ 22:00,아카이브 에잇,https://blog.naver.com/archive8,2021-10-12
[성수동맛집]잠수교집 성수점 / 카페 어니언/아우 맛있어! 세상엔... ,https://blog.naver.com/dtjatn321?Redirect=Log&logNo=222502947079,막 일주일만 더 있으면 좋을 것 같고ㅠㅠ 참 이게 그렇다.. 아쉬운 마음에 급하게 친구들 얼굴 한... 이렇게 배부른 배를 부여 잡고 오랜만에 성수동카페어니언! 에 가기로 했다 사실 배가 불러서 멀리까지 걷지... ,헤이안녕하왈유,https://blog.naver.com/dtjatn321,2021-09-12
[성수] 이영자가 반한 달고나 밀크티 +아쌈밀크티카페ㅊa성수점 ,https://blog.naver.com/k691220?Redirect=Log&logNo=222531844420,안녕하세요 연로그입니다 오늘은 이영자 달고나 밀크티카페ㅊa 소개할게요 매일 11:00 ~ 22:00 주말... 얼그레이차느낌이었어요 제친구는 아쌈이 더 맛나데요 ㅎㅅㅎ 전체적으로 맛나네요 일단 가게... ,꿈틀거리는 일상⋆｡˚ ☁︎｡⋆,https://blog.naver.com/k691220,2021-10-09
성수동 카페디저트 새들러하우스 성수점 ,https://blog.naver.com/hyssek1017?Redirect=Log&logNo=222283994439,성수동 카페디저트 새들러하우스 성수점주말에 성수에 위치한 새들러하우스성수점 에 다녀왔어요! 주말동안 비가 찔끔 오다가 흐렸다가 해떴다가 ! 그러더니 막상 성수에 오니 괜찮았어요 웨이팅이 좀 있긴... ,"아름다워지는 공간, 달리아스파",https://blog.naver.com/hyssek1017,2021-03-22
성수동카페: 이월로스터스성수점(February roasters),https://blog.naver.com/vvid_jh?Redirect=Log&logNo=221965848352,이월로스터스 다른 지점들도 방문해보고 싶다 :) 성수동카페: 이월로스터스성수점(February roasters) 서울 성동구 서울숲2길 46 매일 10:00 - 21:00 주차 불가 이월로스터스성수점인스타그램 @february_roasters,nano,https://blog.naver.com/vvid_jh,2020-05-16
데이트코스] 연남토마 + 어라운드데이 + 노티드도넛 피치스 성수점 ,https://blog.naver.com/tlswldud86?Redirect=Log&logNo=222466386024,치즈와 얇은 고기가 잘 어우러져서 너무너무 맛있었음 청포도 에이드는 쏘쏘였음 그 이후카페 를... 근데 다른 매장에 비해 종류가 많진 않아 그나마 먹고싶었던 3가지만 구입 다음에 간다면 그냥 노티드성수점 ... ,코가네가 먹고 노는 법 ;),https://blog.naver.com/tlswldud86,2021-08-12
뚝섬역카페성수동 빵집 :: 빵선생성수점 ,https://blog.naver.com/songi00s?Redirect=Log&logNo=221615509253,빵선생성수점외관도 넓어보이는데 들어와보니 생각보다도 더 넓어요!! 천장높이가 높아서... 1시간 까지는 무료로 가능하답니다 :-0 #빵선생 #뚝섬역 카페#성수동빵집 #성수동맛집 #뚝섬맛집 #성수동 카페 ... ,송빠리삐뽀,https://blog.naver.com/songi00s,2019-08-13
"[성수동카페 ] 벤허커피(BNHR)성수점 , 드디어 성수동에 입성한... ",https://blog.naver.com/jshim84?Redirect=Log&logNo=221915784856,"한강진역 뒷편 한남동카페 거리에 본점이 위치한 이 곳은 말이 필요없는 밀크티 맛집이다. 커피는... 이 또한차한 잔 마시는 것마냥 금새 한 컵 비웠다. 최고기온이 20도가 넘은 포근한 봄날의 주말, 따뜻한... ",Destination.,https://blog.naver.com/jshim84,2020-04-18
건대입구카페이영자가 인정한 밀크티 맛집차ㅊa,https://blog.naver.com/alfp2208?Redirect=Log&logNo=222107550988, 차ㅊa는 건대입구뿐 아니라 많이 체인점이 생겨나서 성수에 가지 않아도 맛볼 수 있었답니다! 항상성수점 에 지나가면 사람이 많아서 방문하기 어려웠는데 건대점은 방문하기 좋았어요! 그럼 건대입구카페 ... ,밀로그,https://blog.naver.com/alfp2208,2020-10-06
"[일상] *March 3, 2019 성수동 카페 /카멜커피 성수점 ... ",https://blog.naver.com/eszzang1011?Redirect=Log&logNo=221485848511,"*March 3, 2019 #성수동 카페#카멜커피 #camel 카멜커피 camel coffee 예전부터 가보고 싶었던카페 가 있었어요. 성수동에 있는카페 인데요. 바로 '카멜커피' 분위기도 왠지 좋고, 뭔가 마음 따뜻해지는 분위기... ",은쪼리월드 '◡' ♥,https://blog.naver.com/eszzang1011,2019-03-11
성수동 카페: 새들러하우스성수점(saddler haus),https://blog.naver.com/xease1105?Redirect=Log&logNo=222307173282,새들러하우스성수점 . 몰라봐서 죄송합니다... 매장가서야 알게된 새들러하우스의 인기 매장...카페 내부가 보임 크로플을 사기위해 내려가봅니다. 역시나 계단 가파름 주의. 크로플.만드는 시간이... ,먹써니,https://blog.naver.com/xease1105,2021-04-12
 카페 차ㅊa성수점(성수동),https://blog.naver.com/070119c?Redirect=Log&logNo=222127400017, 카페내부는 깔끔하고 깨끗해요. 음료를 시키면 달고나 조금 서비스로 주십니당. 사진 왼쪽에 음료는... 음료 좋아하시는 분들에겐 추천. # 카페차#ㅊa #성수동 # 카페#맛집 #성수동 카페#성수 카페#서울숲 #뚝섬 카페 ,good places only.,https://blog.naver.com/070119c,2020-10-26
성수카페:: 블루보틀(Blue Bottle)성수점어렵게 방문 후기,https://blog.naver.com/ungsblue?Redirect=Log&logNo=221529845446,말이 많고도 많은 블루보틀성수점 에 대한 이야기들 원래는 1호점이 삼청동에 오픈을 한다고 했다가... 맛있는카페 를 가면 된다. 사실 커피 퀄리티는 우리나라에도 블루보틀보다 잘하는 곳이 많다. 각자의... ,크리에이티브를 위한 축적의 시간,https://blog.naver.com/ungsblue,2019-05-05
⚡️오브젝트성수점 / 서울숲카페진지함,https://blog.naver.com/sayou-?Redirect=Log&logNo=222398020144,홍대에 있는 오브젝트만 여러번 갔었는데성수점 은 이번에 처음 가보았다 문구류는 잘쓰지도 않으면서... 가는카페 들마다 자리가 없어서 겨우 자리를 찾아 들어간 진지함차종류들이 많았지만 아아와 디저트만... ,•SayoU•,https://blog.naver.com/sayou-,2021-06-14
어니언 (onion)성수점 ,https://blog.naver.com/bromiyang?Redirect=Log&logNo=221695213959,성수동쪽에 볼일 있어 갔다가 오래간만에 어니언에 갔다 날씨도 좋고 그냥 이쁜 곳에 가서차한잔이... 담엔 좋은 사람과 함께 와야지 #어니언 #어니언 성수점#어니언 카페#고프로히어로5,"일상의 기록들, 안녕",https://blog.naver.com/bromiyang,2019-11-01
성수/ 서울숲카페:: ㅊa,https://blog.naver.com/hj1231k?Redirect=Log&logNo=222425110349,성수 카페/ 서울숲 카페/ 뚝섬 카페/ 성수 데이트/ 서울숲 데이트/ 뚝섬 데이트/카페 차 성수점 ... 항상 어떻게 읽어야하는지 몰라서 차에이 라고 읽었는데ㅎ 그냥 ^차^ 라고 읽는 것이었음 ㅎ 카페 차!!... ,amā et fac quod vīs,https://blog.naver.com/hj1231k,2021-07-09
"성수카멜,성수동 카페 ,성수동카멜커피,카멜커피 성수점 ,카멜성수",https://blog.naver.com/tnwl3801?Redirect=Log&logNo=222310492576, 카페 가 넘 많아서 고민하다가 성수 카페: 카멜커피주소 : 서울 성동구 성덕정19길 6 나사로교회 영업시간 : 매일 11:00 - 20:00연중무휴 전화번호 : 070-8711-3337 주차 x 역시나 인기 카페 라 웨이팅 날씨가 이렇게... ,-,https://blog.naver.com/tnwl3801,2021-04-15
[성수] 성수 미술관성수점(미술카페/ 드로잉카페 )... ,https://blog.naver.com/baesarang_?Redirect=Log&logNo=222249828044,배사랑 입니당 ᕙ(•̀‸•́‶)ᕗ 이번엔 포스팅은 성수동카페추천 입니당 ! 집 근처에카페 를... 본점인성수점 으로 다녀왔습니당 아! 주차는 할 곳이 따로 없어서 근처 공영 주차장에 주차 하셔야 해용.... ,Happy Soi’s Daily Life ☺︎,https://blog.naver.com/baesarang_,2021-02-20
여섯번째 장; 슈퍼 말 차 성수점 /성수카페 (메뉴/가격),https://blog.naver.com/wizmindy?Redirect=Log&logNo=222291408198,"슈퍼말차는 말차로 여러음료를 만드는카페 인데요, 말차 음료말고도 기본적인 커피 메뉴들도 있으니 말차 싫어하시는 분들도 잠시 쉬어갈 수 있겠습니다!ㅎ Previous image Next image 슈퍼말 차 성수점외관!... ",wizmindy님의블로그,https://blog.naver.com/wizmindy,2021-03-29
[ 카페추천] 뚝섬/성수/서울숲... 말차라떼 맛집 @슈퍼말 차 성수점 ,https://blog.naver.com/interesting_mijin?Redirect=Log&logNo=222514247126,암튼 뚝섬 서울숲에 말차라떼 맛집으로 유명한 슈퍼말 차 성수점 이 있어서 꽤 오래전에 다녀왔음다 역시 서울숲 뚝섬에는 핫한카페 가 많은 만큼 슈퍼말차도 인테리어에서 브랜드가 느껴졌어요 그리고 매장에서... ,일상 취향 일기,https://blog.naver.com/interesting_mijin,2021-09-23
[낙원테산도성수점 ]카페분위기의 퓨전 요리를 맛볼 수 있는... ,https://blog.naver.com/gch07332?Redirect=Log&logNo=222262791997,낙원테산도성수점사실 벌써 거의 3달 전이라 기억이 잘 안나지만 ㅠㅠ 늦기전에 이제서라도 기록을 남겨보려고 한다. 가게는 의외로 크지 않다. 식당이라기 보다는 감성카페 처럼 생겼다. 금방이라도... ,Get your Crayon,https://blog.naver.com/gch07332,2021-03-03
"210408 : 성수동 난포,카페ㅊa성수점 ",https://blog.naver.com/khj4935?Redirect=Log&logNo=222321731169,술빵이었나? 예쁜 포장 속에 찐 술빵이 들어있어서 약간 당황ㅋㅋㅋㅋ 그래도 짱 맛있었음 # 카페차성수점#성수카페 #서울숲카페 밤 되니까 분위기 더 좋음~ ㅎ.ㅎ 작년 애기가 물어봄 기분 좋다,Hye,https://blog.naver.com/khj4935,2021-04-24
아차산 신토불이 떡볶이 주차 / 성수동카페이월로스터스성수점 ,https://blog.naver.com/4590602?Redirect=Log&logNo=221976457762,아차산 신토불이 떡볶이 주차 / 성수동카페이월로스터스성수점으노랑 저녁에 티비보다가 우연히... 한차빼고 성수카페 거리로 이동 서울숲 산책은 다음에 꼭 할게~~ 요기 분홍이간판 너무 귀엽당 살짜쿵... ,❤️,https://blog.naver.com/4590602,2020-05-24
"[서울] 성수역 맛집 - 라무진성수점(성수동 데이트, 성수동... ",https://blog.naver.com/mllesuzi_?Redirect=Log&logNo=222038645448,성수 카페 거리점?도 있는데 ' 성수점 '이니까 잘 찾아가는 걸로 5시 오픈인데 5시 예약으로해서 4시 50분쯤 도착했다 주차는 가게 앞에다가!차2대 또는 3대정도 가능할 것 같다 만약 가게 앞이 다 찼으면 근처... ,빛이 있기에 행복하다,https://blog.naver.com/mllesuzi_,2020-07-23
서울숲 조용한카페: 히즈빈스성수점 ,https://blog.naver.com/kelly113?Redirect=Log&logNo=222164249726,낮에는 책과 함께 커피를 마시면 좋은 서울숲 조용한카페 였어요. 그리고 히즈빈스성수점 에서는 프로스팟이라고 해서 당일 아침 9시 30분 이전까지 결제를 완료할 경우 점심시간에 맞춰 지정 픽업 장소로... ,먹방의신 켈리,https://blog.naver.com/kelly113,2020-12-06
"서울숲카페 , 이월로스터스(February Roasters)성수점 ",https://blog.naver.com/1717177i?Redirect=Log&logNo=222012905522,가득차있었는데 마감시간 다 되어서야 나가게 돼서 텅 비어있는 모습을 담을 수 있었다.... 이월로스터스성수점:) 근처카페찾는다면 추천 ! 서울숲카페이월로스터스성수점주소 : 서울시 성동구... ,하얀 공간,https://blog.naver.com/1717177i,2020-06-26
[성수동카페 ]ㅊa 달고나 커피... 테이크아웃오토김밥성수점 ,https://blog.naver.com/flower_chch?Redirect=Log&logNo=222444752249,했는데 아래까지 잘 섞어서 다시 먹어보니 달달하니 진짜 맛있었다 (*아래까지 잘 저어서 드세요*) 간간히 씹히는 달고나도 특히나♥카페차매장 앞 이동네 참 뒤엉켜있는 풀조차 느낌이따 ♥ 걷기엔 너무... ,jjjjjoy's choice,https://blog.naver.com/flower_chch,2021-07-25
[디저트 맛집]카페노티드성수점클래식바닐라/우유생크림... ,https://blog.naver.com/gmlgusgod?Redirect=Log&logNo=222471423945,"나에게 어떤 도넛과도 대체 할 수 없는... 노티드.. ㅎ 시댁이 성수동인데, 시어머님과 점심도 할 겸 성수동에 갔다!! 역시 헬 서울.. 주차 하기는 넘 힘들것 같아서, 시댁에 주차 하고 걸어갔다 ㅎㅎ 위치는 여기... ",Hee - Story :),https://blog.naver.com/gmlgusgod,2021-08-15
"After 2Months (타코맛집 갓잇성수점 , 서울숲카페 ... ",https://blog.naver.com/jmmm0210?Redirect=Log&logNo=222492882068,2021.08.29 아침 일찍 일어나 시험보고 애들 기다리는중 지하철역에 앉아서 졸았다 웨이팅 있는 줄 모르고 무작정 갔던 #갓잇 12시에 도착해서 1시간 웨이팅 후 들어갔당 와 진짜 맛있음 ㅎㅎ 타코 오랜만에 먹는데... ,al'ove,https://blog.naver.com/jmmm0210,2021-09-02
"[성수카페 ] 분위기 좋은카페 (분좋카),카페 차 : ㅊa",https://blog.naver.com/ggolley?Redirect=Log&logNo=222501951822,이번 포스팅은카페 차 성수점 에 대해 소개하려고 한다. 카페 차 ㅊa 운영시간 매일 11:00 - 22:00 카페 차는 간판에 ㅊa라고 써져있어서 처음에 신기해서 관심을 갖게 됐다. 그래서 성수갈 때마다 가보려고했는데... ,최라이언,https://blog.naver.com/ggolley,2021-09-10
업사이드커피성수점- 해방촌커피 꼭 드세요,https://blog.naver.com/bossy-u?Redirect=Log&logNo=222464215781,다녀온 지 꽤 됐지만 후기 쓰고 싶게 만들었던카페 ! 페덱스성수점가는 길... 성수동은 진짜... 올 때마다 교통체증에 놀라는 편 페덱스에서 볼일 보고 나와서 업사이드성수점 에 갔다. 하.. 정말 오고... ,with dori,https://blog.naver.com/bossy-u,2021-08-10
성수동 카페밀크티로 유명한카페 ㅊa ( 카페 차 ) ,https://blog.naver.com/yongju320?Redirect=Log&logNo=222443989886, 카페 차( 성수점 ) 성수 카페 거리의 별미 달고나 밀크티로 유명한 카페 차분한 한국 정서가 느껴지는 공간 속에서 고정관념을 무너뜨린 독특한 한국식 디저트를 맛볼 수 있는 곳 ·운영시간: 매일 11:00 ~ 22:00... ,따듯한 우유,https://blog.naver.com/yongju320,2021-07-29
[서울성수동 카페 ] 블루보틀성수점주차불가능,https://blog.naver.com/lovely6035?Redirect=Log&logNo=221866031988,주차시설이 잘 안되있어서 주차가 어렵네요 서울 카페블루보틀성수점 은 지하1층에 있어요 그래서 지상에서 지하로 내려가야 주문을 할 수 있답니다. 드디어 나도 왔다 블루보틀 !! 인기많은 서울 카페 라 그런지... ,@. 인펫/인오프,https://blog.naver.com/lovely6035,2020-03-29
성수 카페수플레팬케이크 전문카페온화성수점 ,https://blog.naver.com/nailkkahajin?Redirect=Log&logNo=221558497147," 카페온화성수점 은 성수역 4번 출구 도보 3분 거리, 대로변에 위치하고 있어 제아무리 길치라도 쉽게... 참! 소파좌석 밑에는 콘센트도 있더군요. 요즘 스벅도 콘센트가 많이 사라지는 추세라 이렇게 콘센트... ",은주리's Make Your Living Fun Vol. 2,https://blog.naver.com/nailkkahajin,2019-06-10
몇년만에 성수동카페 투어했지요 블루보틀커피성수점아직도... ,https://blog.naver.com/witchlip326?Redirect=Log&logNo=221744252820,제목 그대로 ㅋㅋ 정말 몇년만에 성수동에 있는카페갔다옴 강남 오는 것도 피곤해하는 내가... 봄ㅋㅋㅋㅋㅋㅋ 블루보틀커피성수점 은 요기! 다음에는 라떼를 마셔야되니까 다른 지점에 가보는걸로? ㅎㅎ 끝.,"Sometimes, 쑤쑤",https://blog.naver.com/witchlip326,2019-12-20
성수카페 . 이월로스터스성수점 ,https://blog.naver.com/finlove7?Redirect=Log&logNo=221853735594,꽉차있었어요 이월로스터스 메뉴✨ 드립백 세트도 팔구요:-) 너무 돌아다니다 온 덕분에 둘다 시원한... 성수카페 . 이월로스터스성수점주소: 서울시 성동구 서울숲2길 46 영업시간: 매일10:00-21:00 주차: 불가,햄구리 일기,https://blog.naver.com/finlove7,2020-03-14
[성수카페 ] Cafe onhwa카페 온화성수점:: 넓고 쾌적한... ,https://blog.naver.com/parkyj0213?Redirect=Log&logNo=222364003692,엄빠랑 박예원이랑 초리상경에서 밥먹고 바계원은 학교 가고 나랑 엄빠는카페 에 가기로 했다. 서울숲쪽카페 거리에는 이미 사람들이 많아서 빈자리도 없고 자리도 불편해서 성수에 엄마가 넓은카페 가... ,Et Memórĭa,https://blog.naver.com/parkyj0213,2021-05-24
[성수] 달달한 커피맛집 업사이드성수점 ,https://blog.naver.com/hinnmilk?Redirect=Log&logNo=222444138286,"보통 커피는 아메리카노를 마시는데, 날도 덥고해서 달달한 라떼가 땡겨 찾은 업사이드커피성수점카페앞에 차들이 많이 주차되어있기 때문에 잘못하면 그냥 지나칠 수도 있을 것 같아요 귀여운 미어캣을... ",I'm going to live every minute of it.,https://blog.naver.com/hinnmilk,2021-07-24
[성수역 카페 ]업사이드커피성수점/ 커피가 매우 맛있었다... ,https://blog.naver.com/youjin424?Redirect=Log&logNo=222130052829,쫄깃한크로플과 아이스크림조합은 말모~ 맛있는거 + 맛있는거 + 맛있는거 = 맛없없 오픈시간에 방문해서그런지 조용하고 좋았어요~ #업사이드커피 #업사이드커피 성수점#성수 카페#성수역 카페#뚝섬 카페 ... ,Day By Day ෆ,https://blog.naver.com/youjin424,2020-11-03
뚝섬역 성수동 예쁘고 분위기 좋은카페레스빠스성수점 ... ,https://blog.naver.com/aisrl?Redirect=Log&logNo=221382867597,좋은카페레스빠스성수점 의 디저트 들이 그림으로 그려져 있는데요. 시그니쳐파이 파운드케이크 타르트 등이 그려져 있는데요 이런 그림도 참 특색있고 매력적이지 않나 싶었어요 :) 중간 중간에... ,Moon,https://blog.naver.com/aisrl,2018-10-23
뚝섬역] 플디 plate D. ::카페플디성수점라벤더 디저트,https://blog.naver.com/bbyebbye6?Redirect=Log&logNo=222415379273,"플디 메뉴판 음료는 커피/에이드/ 차종류가 준비되어 있었다. 디저트의 경우에는 시즌에 따라서 달라진다. 나는 5월에 갔기 때문에 저렇게 준비 되어 있었고, 디저트는 패드로 메뉴 사진도 보여주며 설명해... ",하루의 바깥,https://blog.naver.com/bbyebbye6,2021-07-01
성수동카페이월로스터스성수점 ,https://blog.naver.com/qkrtldbs93?Redirect=Log&logNo=221876358484,성수동카페이월로스터스성수점안녕하세요. 슈니에요. 어제 향수를 사러 성수동을 다녀왔는데요. 제가 다녀온 향수 쇼룸 바로 앞에 이월로스터스성수점 이 있더라고요! 안 그래도 나간 김에 맛있는 커피... ,Dazzling Life,https://blog.naver.com/qkrtldbs93,2020-03-27
"[성수, 피치스도원]카페노티드( 성수점 ) 너무 이쁜 건물 외벽... ",https://blog.naver.com/jbh9694?Redirect=Log&logNo=222388382984,내부에는카페노티드 뿐만 아니라 이렇게차 (car) 관련 볼거리들이 있었어요! 괜히 소장 욕구 불러일으키는 미니카들! 사진에 보이다시피카페 지만 테이블이 많진 않아요ㅜㅜ 테이블은 타이어에요! 의자... ,내 인생의 주인공은 나!,https://blog.naver.com/jbh9694,2021-06-07
성수] 성수다락대림창고 (feat. 이마트성수점전기차 충전소),https://blog.naver.com/mattzzunii?Redirect=Log&logNo=222309036625,"이날 성수동카페 거리와 가까운 이마트성수점 에 주차를 했는데, 세상에나! 전기차 충전기가 족히 10대 이상 설치되어 있었다. 북적거리지도 않고 여유가 있어서 충전하기 너무 좋았음. 성수동 갈 때마다... ","Think Globally, Act Locally",https://blog.naver.com/mattzzunii,2021-04-14
"먹어보고서 36(210709)카페 차 (ㅊa) 프리미엄, 남양주의... ",https://blog.naver.com/lifetv23me?Redirect=Log&logNo=222436198296,"성수를 걷다가 우연히 발견한 ' 카페 차 성수점 '의 후기는, 하단 URL 참조. https://m.blog.naver.com/lifetv23me/222436219761#먹어보고서 #남양주 #남양주_커피 #남양주_카페 #카페_차 #카페_ㅊa #카페_차... ",Variety In,https://blog.naver.com/lifetv23me,2021-07-18
블루보틀성수점드디어 가보다,https://blog.naver.com/dnks0206?Redirect=Log&logNo=221698481440,"처음엔 소량의 원두를 구워 24시간 낸 가정으로 배달 서비스를 하다 배달 시스템을 중단하고카페 로 전향을 했다고 하죠. 한국에서는 1호점으로성수점 이 2019년 5월 3일 오픈했고 2호점인 삼청점, 3호점인 역삼점... ",노을의 달달한 오후 티타임,https://blog.naver.com/dnks0206,2019-11-05
기아 EV6 언플러그드 그라운드 ( 성수점 /뚝섬역4번출구),https://blog.naver.com/white_tk?Redirect=Log&logNo=222485580657,옆카페할인을 받을수 있습니다. (전카페 는 안가봤어요) 저는 이미 차가 나와서 오늘 최종 인수전... 3.전시장(입장) 개인적으로 공간디자인을 참 잘했다고 생각합니다. 주어진 공간에서 입체감이 차량에 대한... ,사진으로 보는 LIfe Style,https://blog.naver.com/white_tk,2021-08-27
"서울숲 분위기 좋은카페 , 뚝섬역 미디엄 스톤성수점 ",https://blog.naver.com/dearmoon27?Redirect=Log&logNo=222424211839,이날은카페 에 사람이 많이 없어서 조용하게 수다떨기 딱 좋았습니다.성수점미디어스톤은 주문한 메뉴별로 쿠폰도 찍어줍니다. 왠지 쿠폰을 주는 곳은 꼭 다 채우고 싶은 마음에 자주 오게 됩니다. 파랑파랑한... ,Below the MOON,https://blog.naver.com/dearmoon27,2021-07-08
 카페cafe pose카페포제 / 성수동 맛집 세광양대창성수점 ,https://blog.naver.com/toomyung_?Redirect=Log&logNo=222162643054,"#성수동 카페# 카페 포제 성수동카페거리에 있는 지하 1층-지상 2층짜리카페 . https://www.instagram.com/cafe_poze/ https://map.naver.com/v5/entry/place/1509451621?c=14143781.659479912,4515060.308955124,15,0,0,0,dhplacePath... ",meat and potatoes,https://blog.naver.com/toomyung_,2020-12-04
