title,link,description,bloggername,bloggerlink,postdate
야탑 중국 음식 맛집 뿅의 전설,https://kabsoo114.tistory.com/entry/%EC%95%BC%ED%83%91-%EC%A4%91%EA%B5%AD-%EC%9D%8C%EC%8B%9D-%EB%A7%9B%EC%A7%91-%EB%BF%85%EC%9D%98-%EC%A0%84%EC%84%A4,갈비찜평방옥(0) 2020.01.11 서현 맛집 추천 신선 설농탕 (0) 2020.01.07 야탑 중국 음식 맛집 뿅의 전설 (0) 2020.01.06 BHC 치킨 뿌링클 순살 + 치즈볼 후기 (0) 2019.12.29 양평 순두부 음식점 기와집 순두부 (0) 2019.... ,현하아빠의 좋은집구하기,https://kabsoo114.tistory.com/,2020-01-06
간헐적 재택근무자의 먹부림feat.대치동 맛집,https://blog.naver.com/vanillasugar12?Redirect=Log&logNo=222072470568," 평방옥설렁탕 털털이해장국이 맛있대서 호평이길래 주문해봄. 공기밥 같이 주는건 좋지만, 일단 양이... 분보싸오 #진전복삼계탕 #전복죽 #빙찌 #스시 #스시애 #초밥 # 평방옥 해장국 #털털이해장국 #강릉집 #물회","여행, 요리, 일상 기록",https://blog.naver.com/vanillasugar12,2020-08-27
맛있는녀석들 맛집리스트 - 3편 (201회~300회),https://blog.naver.com/tineas?Redirect=Log&logNo=222422719648,서울평방옥서울 강남구 테헤란로22길 12 (역삼동 736-32) 253회 아이스크림 서울 32파르페 홍대점 (출연한 명동점은 폐업) 서울 마포구 잔다리로6길 39 (서교동 369-5) 254회 돈까스 서울 무공돈까스... ,느리게걷기,https://blog.naver.com/tineas,2021-07-07
맛있는녀석들 20191227 (253) 전지적 먹방 시점 제1탄 - #홍성... ,https://blog.naver.com/ineosky?Redirect=Log&logNo=221751502943,"3,500 # 평방옥♡ 서울 강남구 테헤란로 22길 12 1층 (역삼동 736-32) / 02-501-9194 1. 역삼역... com/32parfait_official/ @내당한우 (홍성) @안성휴게소(경부고속도로 서울방향) @ 평방옥(서울) @32파르페... ",심야버스 블로그 (simyabus.com),https://blog.naver.com/ineosky,2019-12-27
맛있는녀석들 주소모음(252회 ~ 275회),https://blog.naver.com/bbacode1983?Redirect=Log&logNo=222041983833,67-3평방옥서울 강남구 역삼동 736-32 1층 32파르페 명동점 서울 중구 명동2가 50-3 32parfait 254회 전지적 먹방 시점 2 무공돈까스 서울 강남구 역삼동 601-12 망원시장 서울 마포구 망원동 411-2... ,"블로그의 ""블""도 모르는 블로그",https://blog.naver.com/bbacode1983,2020-07-26
역삼역미용실 / 샵벨르오 시세이도 수분클리닉,https://blog.naver.com/sophia20984?Redirect=Log&logNo=221719418752,근처평방옥2층 점심시간 쪼개서 관리하는 주변 회사원 분들 많으시더라구요 블링블링 밝고 경쾌한 분위기라 들어가면서부터 힐링되는 기분 염색하는 분들 많이 보였는데 다행히 환기 잘 되서 냄새 많이... ,종합상사 @슈퍼소피,https://blog.naver.com/sophia20984,2019-11-26
"신통일한국을 위한 좌우 통합운동, 한학자 총재의 2020... ",https://blog.naver.com/peacepeace2018?Redirect=Log&logNo=221741917902,"식당 ‘ 평방옥 ’에서 황인태 국제평화연구소장, 구덕길/서대석/신준우 회장 등 20여 회원들이 참여한 가운데 있었다. 발제, 이상재 가정연합 울산교구장 이날 발제에 나선 이상재 교구장의 발표 요지는... ",피스전망대,https://blog.naver.com/peacepeace2018,2019-12-18
"맛있는 녀석들 전지적 먹방 시점 유민상 훠거, 압구정 샹웨이 훠거",https://blog.naver.com/day265?Redirect=Log&logNo=221758964886,"육아로 인해서 살짝 늦게 썼다 지난주는 내당한우와평방옥전지적 먹방시점 문세윤 갈비찜 설렁탕 집과 김준현 한우 고기집 ㅋㅋ 음,, 강남지점으로 갈껄 그랬나? #맛있는녀석들... ",쵸묵쵸묵 어흥이,https://blog.naver.com/day265,2020-01-03
맛있는 녀석들 전지적 먹방 시점 막뚱이 초근접 먹방 관찰기,https://blog.naver.com/choulha63?Redirect=Log&logNo=221751617053,섞어서 드링킹 역시 진공청소기 문세윤님 간장갈비찜에 당면 추가 그리고 다시 회냉면으로 입가심평방옥☎ 02-501-9194 서울 강남구 역삼동 736-32 테헤란로22길 12 방문 후기는 아래 블러그에서 보세요,one시인의 일상.,https://blog.naver.com/choulha63,2019-12-27
맛있는녀석들 문세윤 설렁탕 갈비찜 회냉면 식당 위치 어디,https://lucyskitchen.tistory.com/2947,시청후기 # 평방옥#테헤란로고깃집 #역삼동고깃집 맛있는녀석들 관련 글 보기 ☞ 맛있는녀석들... 「 이름 · 상호 」평방옥「 ★ 구글맵 평점 (리뷰 개수) 」 5.0 / 5.0 (2) 「 주소 · 위치 · 어디 」 서울... ,루씨의 부엌,https://lucyskitchen.tistory.com/,2019-12-21
"맛있는 녀석들 식당정리(도시,식당이름,전화번호)1회... ",https://blog.naver.com/garter5757?Redirect=Log&logNo=221967020611,#맛있는녀석들 #맛있는녀석들식당전화번호 #맛있는녀석들식당이름 *출처:맛있는녀석들 홈페이지* 1회 [콩비지 감자탕] 파주 맷돌우리콩감자탕 ***-***-**** [생돼지갈비] 인천... ,방콕부부,https://blog.naver.com/garter5757,2020-05-17
서현 맛집 추천 신선 설농탕,https://kabsoo114.tistory.com/entry/%EC%84%9C%ED%98%84-%EB%A7%9B%EC%A7%91-%EC%B6%94%EC%B2%9C-%EC%8B%A0%EC%84%A0-%EC%84%A4%EB%86%8D%ED%83%95,13 맛있는 녀석들 갈비찜평방옥(0) 2020.01.11 서현 맛집 추천 신선 설농탕 (0) 2020.01.07 야탑 중국 음식 맛집 뿅의 전설 (0) 2020.01.06 BHC 치킨 뿌링클 순살 + 치즈볼 후기 (0) 2019.12.29 양평 순두부 음식점... ,현하아빠의 좋은집구하기,https://kabsoo114.tistory.com/,2020-01-07
Time Stamp (~0106)+ 애플워치 배지,https://blog.naver.com/le_bonnie?Redirect=Log&logNo=222200140829,"나왔던평방옥 에서 시켜 먹었는데 언 몸이 사르르 녹았다 저녁은 오돌뼈 이거 완조니 소주 안주인데요 12월 16일 점심은 노브랜드 버거11시에 주문했는데, 2시간 걸려서 온 거 실화입니까 하도 안 와서 매장에... ",Bonny Bonnie,https://blog.naver.com/le_bonnie,2021-01-07
맛있는 녀석들이 다녀간 맛집 식당 리스트,https://blog.naver.com/smgw?Redirect=Log&logNo=221865039653,1회 [콩비지 감자탕] 파주 맷돌우리콩감자탕 ***-***-**** [생돼지갈비] 인천 부암갈비 032-425-5538 2회 [라면뷔페] 서울 면면 02-303-2688 [짜장면] 인천 만다복 032-773-3838 3회 [보쌈김치]... ,띠옹의 주관적 브리핑,https://blog.naver.com/smgw,2020-03-21
맛집정보 :: 맛있는 녀석들 201회~300회,https://blog.naver.com/mycrystally?Redirect=Log&logNo=221447800112,6평방옥서울 강남구 테헤란로22길 12 252회 시장회집 서울 용산구 소월로20길 38 #알탕/알찜 속초생태집 서울 중구 남대문로 25-17 #도루묵 249회 내대리막국수 강원 철원군 갈말읍 내대1길 29-10 #막국수... ,:: crystally ::,https://blog.naver.com/mycrystally,2019-01-22
맛있는 녀석들,https://blog.naver.com/eonehbh?Redirect=Log&logNo=221862924364,12회 [부대찌개] 서울 대우식당 02-552-1663 [참치회] 용인 한참치 031-889-4875 13회 [수제비] 남양주 더 수제비 ***-***-**** [아구찜] 서울 광주 똑순이 아구찜 02-2668-3030 14회 [족발] 서울... ,잡일,https://blog.naver.com/eonehbh,2020-03-20
위치,https://blog.naver.com/hey19?Redirect=Log&logNo=221529242779,서울특별시 강남구 역삼동 736-32 1층평방옥역삼역 3번출구에서 나와 좌측골목길로 들어가 우측으로 조금내려가면 첫번째 편의점 좌측으로 약30미터 지점에 있습니다.,平坊屋님의 블로그,https://blog.naver.com/hey19,2019-05-04
"도미인 서울 강남 : 주차, 조식 , 무료야식, 사우나,대욕장 이용... ",https://blog.naver.com/yani_huni?Redirect=Log&logNo=222530973136,"지난번 트윈룸 리뷰를 했었는데요! 오늘은 룸 외 정보를 써보려고 합니다 :) 주차, 조식장, 대욕장,그리고 무료 야식까지 ! 지금 시작할게요! ▼도미인 서울 강남 트윈룸 리뷰는 여기! 도미인 서울 강남... ",김야니의요기조기,https://blog.naver.com/yani_huni,2021-10-08
역삼동 맛집평방옥 ,https://blog.naver.com/qmens?Redirect=Log&logNo=221632858105,비오는 날 방문한평방옥일이 있어서 최소한 일주일에 한번은 역삼동에 방문하는데 그럴때마다 특별한 일이 없다면 저녁은 역삼동 맛집인 ' 평방옥 '이다! 역삼역에서 매우 가깝다. 다만 골목사이에 있어서 처음... ,Sensejangi,https://blog.naver.com/qmens,2019-08-30
"[역삼맛집] 노릇노릇 숯불 돼지갈비맛집,평방옥 ",https://blog.naver.com/babyhoony?Redirect=Log&logNo=221814888976,역삼역 3번출구 뒷편에 위치한평방옥 이라는 이 가게는 설렁탕과 냉면 등을 판매하며 고기는... 역삼역 인근에서 달콤한 숯불돼지갈비를 찾고 있다면평방옥 을 추천해 봅니다. 가성비 좋은 숯불구이였거든요.,살고 싶은데로 살아가기,https://blog.naver.com/babyhoony,2020-02-19
역삼역 점심 설렁탕집 소개! -평방옥 ,https://blog.naver.com/ysbizcenter?Redirect=Log&logNo=221531548512," 평방옥(곰탕,설렁탕) 주소 서울 강남구 테헤란로22길 12 1층 (서울 강남구 역삼동 736-32 1층) 전화 02-501-9194 영업 00:00~24:00 가게 전경입니다. 야외 테라스자리도 있네요^^ 숯불구아니 불고기, 전골 등을 먹을 수... ",르호봇 역삼 비즈니스센터,https://blog.naver.com/ysbizcenter,2019-05-07
[역삼맛집]평방옥- 설렁탕 괜찮은 식당,https://blog.naver.com/haid69?Redirect=Log&logNo=221958672639,점심 약속이 역삼역 근처에서 잡혀 식사할 곳을 둘러보다가 들어간 식당입니다. 깔끔한 간판이 마음에 들어서 방문했습니다. 가게 앞에 사람이 서 있어서 간판 사진만... 부엌 한켠에 커다란 솥으로 설렁탕을... ,Haid,https://blog.naver.com/haid69,2020-05-14
88크리트에서 알려드리는 맛집 역삼역평방옥 !,https://blog.naver.com/88crete?Redirect=Log&logNo=221560138872,"그래서 거나하게 술을 마시고 해장을 하기 위해 찾다가 역삼역의평방옥 에에서 점심을 먹었습니다. 역삼역평방옥 은 설렁탕, 냉면, 불고기, 해장국 등을 파는 한식 전문점인데요. 해장국을 파는 음식점과는... ",88크리트 010 4776 1889,https://blog.naver.com/88crete,2019-06-12
Quest Nutrition 프로틴 바,https://blog.naver.com/important_1791?Redirect=Log&logNo=222067367855,붙어 있어 주문해보았다 종로설렁탕은 종로에서 유명한 국일관 골목 초입에 있어요 매장을 들어서는순간 설렁탕 향이 가득 퍼집니다 문세윤씨는평방옥 에서 설렁탕 회냉면 갈비찜까지 먹고왔더라고요,important_1791님의블로그,https://blog.naver.com/important_1791,2020-08-22
강남소호사무실 임대 가격과위치 모두완벽!,https://blog.naver.com/yun332500?Redirect=Log&logNo=221686429019,"1층에평방옥 이 위치하고 있는 곳 4층에 자리잡고 있는데, 굉장히 접근성이 좋은 편이라 출퇴근을 하기에도 편리했어요. 강남소호사무실 위치가 강남에 있으니 저 역시나 괜시리 성공한 사업가가 된 듯한 기분이... ",조은사람더하기+,https://blog.naver.com/yun332500,2019-10-23
