title,link,description,bloggername,bloggerlink,postdate
역삼동평방옥 ,https://blog.naver.com/sagak815?Redirect=Log&logNo=222082706326,역삼역 3번 출구에서 도보 3분 거리에 위치하고 있는평방옥맛있는 녀석들이란 프로그램을 통해 처음...평방옥주소.. 서울특별시 강남구 테헤란로22길 12(역삼동 736-32) 전화번호.. 02 501 9194 영업시간.. 08:00~22... ,사각사마는 뭘 먹고 사나,https://blog.naver.com/sagak815,2020-10-13
맛있는녀석들 문세윤 설렁탕평방옥전지적 먹방 시점,https://blog.naver.com/lovelyjjan?Redirect=Log&logNo=221751099075,"전지적 먹방시점 맛있는녀석들 문세윤 설렁탕, 회냉면, 갈비찜 먹은평방옥 에 다녀왔습니다. 아침에... 문세윤씨는평방옥 에서 설렁탕, 회냉면, 갈비찜까지 먹고왔더라고요. 그 예고편을 보고~~ 저도 너무... ",슈가와 함께하는 신나는 세상,https://blog.naver.com/lovelyjjan,2019-12-27
역삼역 맛집 역삼동평방옥- 맛있는 녀석들 전지적 먹방 시점... ,https://blog.naver.com/zephyr122059?Redirect=Log&logNo=221751195838,"◆◆역삼역 맛집 역삼동평방옥: 설렁탕, 회냉면, 갈비찜◆◆ 밤 열시가 다 돼서 블친분과 함께 설렁탕집을 방문했다. 맛있는 녀석들 전지적 먹방 시점 문세윤 설렁탕 역삼역 맛집 역삼동평방옥 . 이 방문은... ",사랑이 밥먹여준다,https://blog.naver.com/zephyr122059,2019-12-27
녀석들 전지적 먹방 시점 문세윤 설렁탕 역삼역 맛집평방옥 ,https://blog.naver.com/qhanfdbfla?Redirect=Log&logNo=221751114760,역삼동평방옥 ) 맛있는 녀석들 하는 날. 불금은 맛있는 녀석들의 먹방화면을 보면서 대리만족을 하는... 설렁탕집평방옥 이 보였답니다. 여기다...평방옥 ... 앞에 주차공간도 마련이 되어 있고요..평방옥 ... ,♡ 꿈틀꿈틀 세상나들이 ♡,https://blog.naver.com/qhanfdbfla,2019-12-27
[역삼 맛집] 맛있는 녀석들 설렁탕 ' 평방옥 ',https://blog.naver.com/dbfldjs2?Redirect=Log&logNo=221777851207,이 날은 2019년 12월 31일 마지막날 맛있는 점심을 먹고 일찍 퇴근한 날 ㅎㅎ 맛있는 거 뭐 먹을까 하다가 맛있는 녀석들에 나왔다고 한 설렁탕집평방옥 에 다녀왔습니다. 역삼 맛집 설렁탕평방옥역삼역 3번... ,"지금 여기, 이곳에서",https://blog.naver.com/dbfldjs2,2020-01-19
맛집 설렁탕/함흥물냉면/비빔냉면 포장도 가능한평방옥추천,https://blog.naver.com/do_bari?Redirect=Log&logNo=222486486151,가능한평방옥추천 맛있는녀석들 전지적 먹방시점 문세윤 맛집 추천한 곳 서울 역삼동에 맛있는녀석들 전지적 먹방시점에서 문세윤이 추천한 맛집평방옥 에서 배달도 가능해서 설렁탕과 함흥 물냉면... ,파이블로그,https://blog.naver.com/do_bari,2021-08-28
[서울_역삼동]평방옥 ,https://blog.naver.com/moodnightsummer?Redirect=Log&logNo=222503359514,가마솥 설렁탕으로 유명한 역삼역 3번 출구 근처에 있는평방옥 에 방문하였습니다평방옥 을 처음 찾았을 때 나온 블로그가 2019년도 시즌이라서 가격이 올랐겠거니 했었는데 가격이 그대로더라구요 맛있는... ,7월의 재일,https://blog.naver.com/moodnightsummer,2021-09-12
역삼동평방옥- 맛있는 녀석들 전지적 먹방 시점 문세윤 설렁탕... ,https://blog.naver.com/gypsyone?Redirect=Log&logNo=221751235967,# 평방옥#전지적먹방시점 #맛있는녀석들 #문세윤설렁탕 #역삼동 평방옥#문세윤 #간장갈비찜 맛있는 녀석들 전지적 먹방 시점 문세윤 설렁탕 역삼동평방옥간장 갈비찜 2019년 12월 27일 금요일 253회 맛있는... ,세콰노의 머거머거,https://blog.naver.com/gypsyone,2019-12-27
역삼역맛집평방옥 에서 먹고 포장하고 이제 배달까지 된데요!... ,https://blog.naver.com/pinelemon?Redirect=Log&logNo=222164623066,김에평방옥털털이해장국 맛을 잊을 수 없어 또 먹고 오게 되었지요 ㅎㅎ 이 날은 앞에... ㅋㅋㅋㅋㅋ 든든한 해장국 한끼가 드시고 싶으시다면 역삼역 근처에 있는평방옥꼭! 가서 드셔보세요 맛있어요... ,피부미용계의 떠오르는 샛별 #윤슬코스메틱,https://blog.naver.com/pinelemon,2020-12-06
"덕후선생,평방옥 , 테라로사, 온량, 도미노피자, 아웃닭,멘보샤... ",https://blog.naver.com/rhaam21?Redirect=Log&logNo=221807029920, 평방옥#역삼_ 평방옥 _설렁탕 # 평방옥#설렁탕 기대를 너무 했나본가? 6. 테라로사 #코엑스_테라로사_커피와얼그레이 #테라로사 #얼그레이차 포스코센터점 가보고싶당 7. 도미노피자 #도미노피자_직화스테이크M... ,쎄야의 기록,https://blog.naver.com/rhaam21,2020-02-13
역삼동평방옥: 맛있는 녀석들 문세윤 설렁탕회냉면 맛집,https://blog.naver.com/skypark204?Redirect=Log&logNo=222138864798, 평방옥역삼역 3번 출구에서 3분 거리에 위치한평방옥입니당 점심시간이 많이 지나고 간 상태라 불이 꺼져 있었어요 ㅠㅠ 맛있는 녀석들을 보면서 가봐야지 하다가 드디어 오게 됐는데 맛있는 녀석들... ,늘이의 뷰티로그,https://blog.naver.com/skypark204,2020-11-08
역삼동 맛집!평방옥 ,https://blog.naver.com/podalko?Redirect=Log&logNo=222163775122,"배달평방옥배부름은 설렁탕보다 갈비탕을 좋아해서 선택해본다. 투명하고 맑은 국물을 좋아하기도! 갈비탕 ₩14,000 털털이해장국(양곱창) (1인분) ₩9,000 ※평방옥주소 : 서울 강남구 역삼동 736-32 1F... ",배부름의 하루 더하기 오늘,https://blog.naver.com/podalko,2020-12-05
역삼동 역삼역 근처 해장 맛집평방옥 ,https://blog.naver.com/rayorayo59?Redirect=Log&logNo=222139839833, 평방옥 입니당! 해장은 역시 국물이라는 생각에 찾게 된 곳인데용! 그럼 ~ 고고! *라요의 주관적 리뷰를... #라요의일기 #역삼해장 #역삼동해장 #강남해장 # 평방옥#맛있는녀석들 #설렁탕 #냉면 #털털이해장국... ,인생은 한번이라요,https://blog.naver.com/rayorayo59,2020-11-09
맛있는 녀석들 253회 문세윤 설렁탕 역삼동평방옥 ,https://blog.naver.com/jmjm3060?Redirect=Log&logNo=222113480864,맛있는 녀석들 253회 문세윤 설렁탕으로 유명한 역삼동평방옥 에서 배달 시켰어요~ 가까운 거리이지만... 이곳평방옥 은 강남 역삼역 3번 출구 근처에요. 주소는 서울 강남구 역삼동 736-32 1층 전화번호는 02-501... ,도곡동 김여사,https://blog.naver.com/jmjm3060,2020-10-12
역삼동 맛집 맛있는녀석들이 다녀갔다던평방옥 ,https://blog.naver.com/h_sea08?Redirect=Log&logNo=222043639173,역삼동 맛집평방옥가게이름표 보다 더 중요한 맛있는녀석들 스티커에요. 메뉴판은 이렇게~ 주류 및 음료 해장국집인데 양주가 있네요..? 역시 강남인가봅니다;; 주문을 하고 나니 바로 반찬을 주셨어요. 김치와... ,사랑이의 일상~,https://blog.naver.com/h_sea08,2020-07-29
[리뷰] 역삼역 설렁탕집평방옥 ,https://blog.naver.com/thedooroomi?Redirect=Log&logNo=222175626324,역삼역 설렁탕집평방옥역삼역 3번 출구에 위치한 설렁탕집평방옥리뷰입니다. 요즘 날씨가 추우니까 국물음식들이 많이 땡기네요. 그럼 리뷰 시작해보겠습니다. 역삼역 설렁탕집평방옥가시는 길 3번... ,"Voice of Dooroomi, VOD",https://blog.naver.com/thedooroomi,2020-12-16
역삼동해장국 역삼역해장국] 탕과 냉면도 먹을 수 있는평방옥 ,https://blog.naver.com/shinebox17?Redirect=Log&logNo=222261810499,역삼동에서 해장국 완뚝했답니다^^ 역삼역3번출구쪽의평방옥 입니다~ 해장국 전문점은 아닌데 얼~큰~~~하게 개~운하게 먹고왔네요^^ 역삼동 해장국집평방옥메뉴입니다^^ 탕종류와 냉면 꼬기도 먹을 수 있어요... ,봉봉's 끄적끄적,https://blog.naver.com/shinebox17,2021-03-02
역삼동 설렁탕 맛집 ' 평방옥 '에 송년세미나 다녀왔네요.,https://blog.naver.com/yskim138?Redirect=Log&logNo=221741960497,정성과 사랑 가득 한끼 식사가 되었네요 역삼동 맛집 ' 평방옥 ' 강남 역삼동 설렁탕 맛집으로 유명한 ' 평방옥 '에 지난 12월 18일 송년세미나를 다녀왔습니다. 역삼동 맛집 ' 평방옥 ' 세미나 전경 역삼동 맛집... ,김용승의 영등포사랑방,https://blog.naver.com/yskim138,2019-12-18
유월의 첫째주 / 일상블로그 [ 역삼 설렁탕평방옥 ... ,https://blog.naver.com/chzh9757?Redirect=Log&logNo=221998694899,Jun.3 ✌또✌ 엄마신발이 말썽이라 역삼갔다가 후니랑 #설렁탕 먹으러 # 평방옥백석가서 먹을까 했는데 시간이 애매해서 평점 젤 많은 곳으로 갔다 설렁탕 2개에 당연히 만두추가 흠 내가 생각한 설렁탕이랑... ,"지금, 여기",https://blog.naver.com/chzh9757,2020-06-12
서울 역삼동 밥집맛집 “ 평방옥 ”솔직 후기,https://blog.naver.com/dudalww3?Redirect=Log&logNo=221782255647,역삼동에 “ 평방옥 ” 이라는 밥집이에요 네이버에서 역삼동 맛집 쳐서 알아낸곳이에용 네이버 후기가 좋아서 한번 친구들이랑 왔어용 역삼동 “ 평방옥 ”가는길에 날씨도 좋쿠 해가 지는 풍경이 너무 좋아서... ,ʏᴏᴜɴɢᴍɪ ᴅᴀʏ_,https://blog.naver.com/dudalww3,2020-01-23
 평방옥털털이해장국(양곱창) 맛있게 먹었어요 맛있는녀석들... ,https://blog.naver.com/pinelemon?Redirect=Log&logNo=222134646432,그 곳에선 행복한일만 가득하기를 저번에 하이프(HIFU)장비 '리프퀸' 납품하러 강남구에 위치한 왁싱샵에 갔다가 건물 바로 아래층에 있는평방옥이란 식당에서 점심을 먹게 되었어요 식당은 1층에 있고... ,피부미용계의 떠오르는 샛별 #윤슬코스메틱,https://blog.naver.com/pinelemon,2020-11-03
"녀석들 전지적 먹방 시점 문세윤 갈비찜 설렁탕, 역삼동평방옥 ",https://blog.naver.com/day265?Redirect=Log&logNo=221751424605,"맛있는 녀석들 전지적 먹방 시점 문세윤 갈비찜 설렁탕, 역삼동평방옥맛있는녀석들 전지적먹방시점 문세윤과 김준현이 나오는데 바로 오늘 1회! 다음주는 김민경과 유민상이 나오고 2회로 나올듯 하더라 정말... ",쵸묵쵸묵 어흥이,https://blog.naver.com/day265,2019-12-27
맛있는 녀석들 김준현 홍성 내당 한우 문세윤 역삼동평방옥 ... ,https://blog.naver.com/sue035?Redirect=Log&logNo=221751403659,맛있는 녀석들 김준현 홍성 내당 한우 문세윤 역삼동평방옥설렁탕 갈비찜 회냉면 맛있는... 000원 맛있는 녀석들 김준현 홍성 내당 한우 문세윤 역삼동평방옥설렁탕 갈비찜 회냉면 아침 첫 끼로... ,해바라기,https://blog.naver.com/sue035,2019-12-27
"역삼역 맛집,맛있는 녀석들 문세윤 설렁탕. 평방옥 .",https://blog.daum.net/happymeals/2115,"역삼역 맛집,맛있는 녀석들 문세윤 설렁탕. 평방옥 . 안녕하세요~ 행복끼니입니다..^^ 맛있는 녀석들 전지적 먹방시점. 문세윤이 다녀 온 역삼역 설렁탕 맛집. 가마솥에 끓인 진하고 구수한 국물이 일품인 집.... ",맛있고 가슴 따뜻한 착한식당을 찾아~,https://blog.daum.net/happymeals,2020-01-16
맛있는녀석들 역삼역 설렁탕맛집' 평방옥 ' @유경점장@,https://blog.naver.com/thesoonsu2300?Redirect=Log&logNo=221776684906, 평방옥 이라는 곳입니다! 상호부터 맛집 냄새가 나는거 같네요..킁킁.. 지하철 2호선 역삼역 3번출구로... 역삼역맛집 #역삼역설렁탕 #역삼역3번출구 #문세윤설렁탕 # 평방옥# 평방옥 설렁탕 #유경점장 #유경쌤,성신여대미용실 The (더) 순수헤어,https://blog.naver.com/thesoonsu2300,2020-01-18
"강남 돼지갈비집평방옥 , TV 맛있는 녀석들을 촬영한 식당에서... ",https://blog.naver.com/joonhomedia?Redirect=Log&logNo=221805300518, 평방옥식당 앞에 주차장이 있고 문앞에서는 사장님이 한창 초벌구이를 하고있다. 큼지막한... 시원하고 맛있다!! 돼지갈비 추천! # 평방옥#역삼역맛집 #역삼갈비 #강남돼지갈비 #털털이전골,쌍둥이 아빠의 가족 나들이,https://blog.naver.com/joonhomedia,2020-02-12
맛있는 녀석들 갈비찜평방옥 ,https://kabsoo114.tistory.com/entry/%EB%A7%9B%EC%9E%88%EB%8A%94-%EB%85%80%EC%84%9D%EB%93%A4-%EA%B0%88%EB%B9%84%EC%B0%9C-%ED%8F%89%EB%B0%A9%EC%98%A5,맛있는 녀석들 갈비찜평방옥맛집 여행 | 2020. 1. 11. 23:36 여러분은 먹방을 자주 보시나요? 제... 안그래도 오늘 가족들이 모두 집에 있어서 다 같이 가보기로 했어요평방옥▶ 위치 서울 강남구 테헤란로... ,현하아빠의 좋은집구하기,https://kabsoo114.tistory.com/,2020-01-11
역삼역평방옥회냉면,https://blog.naver.com/hee8475?Redirect=Log&logNo=222391819300,병원갔다가평방옥 에서 회냉면 한그릇 맛나게 폭풍흡입 맛있는 녀석들 스티커가 여기저기 붙어있었당 유세윤씨가 다녀갔었구나 사인까지... 나도 맛나게 먹었으니 그걸로 되었다ㅎㅎ,ANNA`s Happy Life,https://blog.naver.com/hee8475,2021-06-09
역삼평방옥253회 맛있는녀석들 문세윤 설렁탕 갈비찜 명동... ,https://blog.naver.com/jbwk?Redirect=Log&logNo=221751427481,역삼동평방옥253회 맛있는녀석들 문세윤 설렁탕 갈비찜 회냉면 맛녀석 전지적 먹방시점 명동... com/14385 맛있는 녀석들 253회 전지적 먹방 시점 막뚱이 초근접 먹방 관찰기 상호 :평방옥 ... ,주옥같은 나날들,https://blog.naver.com/jbwk,2019-12-27
2019년 7월 22일 식단/ 역삼평방옥 ,https://blog.naver.com/broomee?Redirect=Log&logNo=221592866717,점심평방옥 입니다~ 메인 메뉴는 설렁탕과 회냉면 이었는데 오늘 불고기를 먹고 불고기도 추가됐어요^^ 뚝배기에 보글보글 뜨겁게 끓여나온 불고기를 밥이랑 김치랑 같이 먹으니 진짜 맛있더라구요~ 국물이... ,써니와 부릉부릉 일상이야기♬,https://blog.naver.com/broomee,2019-07-23
갈비찜 회냉면 서울 강남 맛집평방옥명동 아이스크림 253회,https://blog.naver.com/pirin888?Redirect=Log&logNo=221750461815,"강남평방옥253회 링크▽ https://pirin888.tistory.com/2230 (상호,정보,영업 시간,가격 ,위치,전화번호,방송,tv 주소,가게,식당,어디 ,연락처,촬영지,장소,맛집) 12월 27일 김준현 유민상 김민경 문세윤... ",rin,https://blog.naver.com/pirin888,2019-12-26
 평방옥| 맛있는녀석들 출연한 식당이지만...,https://blog.naver.com/annachoi_88?Redirect=Log&logNo=222270857495,"맛있는녀석들 253회 출연 식당 (19.12.27 갈비찜/설렁탕) 방송 출연한 곳인데도 불구하고, 블로그 포스팅이... 방송 나온 전후 날짜밖에 없고 최근 글이 없다? 그 이후 다른 방송에 출연한 이력도 없다? 이미... ",보고서,https://blog.naver.com/annachoi_88,2021-03-10
"문세윤 설렁탕, 간장 갈비찜, 회냉면 역삼동평방옥 ",https://blog.daum.net/gyeonwoo50/3622,"맛있는 녀석들 전지적먹방시점 문세윤 설렁탕, 간장 갈비찜, 회냉면 역삼동평방옥댓글 18 견우... 역삼동평방옥, 전지적먹방시점 ,평방옥맛있는녀석들 전지적먹방시점 문세윤 설렁탕, 간장갈비찜... ",.,https://blog.daum.net/gyeonwoo50,2019-12-27
내당한우 안성휴게소평방옥32파르페 명동점 강남 맛있는녀석들,https://teamaya.tistory.com/1848,"맛집명:평방옥주소: 서울 강남구 역삼동 736-32 메뉴 설렁탕, 털털이해장국, 도가니탕, 특설렁탕, 갈비탕 등 맛집명: 32파르페 명동점 주소: 서울 중구 명동2가 50-3 인스타그램 https://www.instagram.com... ",작업실,https://teamaya.tistory.com/,2019-12-27
회냉면 전지적먹방시점 내당한우 새우살 역삼동평방옥맛집 위치,https://dodo1004love.tistory.com/10028,"■ 내당한우 충남 홍성군 홍성읍 오관리 393-2 041-632-0156 ■평방옥- 설렁탕 , 냉면 서울 강남구 테헤란로 22 길 12 1 층 02-501-9194 홍성한우는 입안에 들어가면 사르르 녹아 없어지는 맛이 일품이라 많은 사람들이... ",영숙이네집,https://dodo1004love.tistory.com/,2019-12-27
"녀석들 설렁탕 맛집,전지적 먹방시점 역삼역 가마솥설렁탕평방옥 .",https://blog.daum.net/happymeals/2109,"맛있는 녀석들 설렁탕 맛집, 전지적 먹방시점 역삼역 가마솥설렁탕평방옥 . 안녕하세요~ 행복끼니입니다..^^ 맛있는 녀석들 설렁탕편에 방송된 가마솥에 끓이는 설렁탕전문점평방옥 . 진하면서도 담백함이... ",맛있고 가슴 따뜻한 착한식당을 찾아~,https://blog.daum.net/happymeals,2019-12-30
★ 평방옥 ,https://blog.naver.com/matone?Redirect=Log&logNo=221791212819,4/15 재방문 오늘도 볶음밥까진 못감 볶음밥 구경해보고 싶다구!!!!!!!!!!!!!!!!!!!!!!!!!!!!!!!!!!!!!!!!!!!!뿌에에엥ㅇ... ,matone님의블로그,https://blog.naver.com/matone,2020-02-01
[역삼]평방옥 ,https://blog.naver.com/rohnji?Redirect=Log&logNo=222274958835,역삼동에 맛있는녀석들이 왔다갔다고해서,A Nobly Day,https://blog.naver.com/rohnji,2021-03-14
맛있는 녀석들 갈비찜평방옥 ,https://kabsoo114.tistory.com/459,안그래도 오늘 가족들이 모두 집에 있어서 다 같이 가보기로 했어요평방옥▶ 위치 서울 강남구... 많은데평방옥 은 깨끗했어요 여러분들이 가장 궁금해 하실평방옥메뉴입니다~ 저희 가족은 간장갈비에... ,현하아빠의 좋은집구하기,https://kabsoo114.tistory.com/,2020-01-11
시원한 비냉과 물냉!! 새로 생긴 역삼평방옥 ,https://blog.naver.com/pshwin2?Redirect=Log&logNo=221581143140,날씨가 이제 여름이네요. 7월 초인데 조금 걷기만 해도 땀이 주루룩 아아~~#냉면땡겨 앗 지나가는 길에 새로운 식당을 발견했습니다. 냉면 집이네요. 더운날씨에 발이 이끄는데로~~ 새로 생겨서 그런지... ,공돌이의 경제이야기,https://blog.naver.com/pshwin2,2019-07-09
2019년 8월 16일 식단/평방옥회냉면,https://blog.naver.com/broomee?Redirect=Log&logNo=221621558234,한주가 마무리되는 금요일인데 다들 아침에 기력 없으시죠?? 저도 어제 쉬었는데 왜이렇게 피곤하고 지칠까 고민해봤더니 다들 휴가 가는 기간이라 출근하는 사람도 별로 없고 여행가는 사람이 많았어서... ,써니와 부릉부릉 일상이야기♬,https://blog.naver.com/broomee,2019-08-19
 평방옥- 역삼 냉면,https://nun3004.tistory.com/77,"9,000원 함흥 냉면 15천원짜리 평양냉면보다 훨씬 맛있음 좋아요 3 공유하기 글 요소 구독하기 못 사는 남자 잘 먹는 여자",못 사는 남자 잘 먹는 여자,https://nun3004.tistory.com/,2019-04-06
역삼역평방옥 ,https://blog.naver.com/a880208?Redirect=Log&logNo=221762163748,https://store.naver.com/restaurants/detail?entry=pltid=1303425139query=%ED%8F%89%EB%B0%A9%EC%98%A5,ha1.kr.tc,https://blog.naver.com/a880208,2020-01-06
2020 Sep,https://blog.naver.com/040314?Redirect=Log&logNo=222182588934,전 날 할머니 인사하러 인천 소주 한 병 털어 드린 후 #인천종합어시장 엄니가 힘든 관계로다가 명절 저녁 식사는 집 근처 # 평방옥여기 돼지갈비 진짜 진짜 추천해요!! 따릉이와 하늘 사진으로 가득했던 에피의 9월,에필이네,https://blog.naver.com/040314,2020-12-23
8월 중순~말~9월 초,https://blog.naver.com/zbxm9539?Redirect=Log&logNo=222496249998,통영 애들이랑 저녁 전에 코다리먹고 잠깐 얼굴봤다 ㅜㅋㅋ 광복절 휴일 삼청동에서 인생 처음 사주보고 ~평양냉면 먹고 커피 마시고 맥주 한잔 하면서 고등학교 친구들이랑 죙일 있었다 # 평방옥조금 간이 있긴... ,적정의 시간,https://blog.naver.com/zbxm9539,2021-09-06
하루에 하나씩 써야함,https://blog.naver.com/wbxkdooq1?Redirect=Log&logNo=222428129749,나의 인생 물냉면 입니데이 # 평방옥맞나 마즐걸여ㅕ☁️☁️☁️ 개존맛이니까ㅏ 머거보슈 다들 나의 근황을 궁금해 할 거 가타셔 엣헴~~ 블로거 2일차 눈에 #단순포진 났었ㄴ데 다시 재발함 열어분들 방심... ,인생 도너리 ~~,https://blog.naver.com/wbxkdooq1,2021-07-12
역삼역 미용실 샵벨르오. 초코브라운 염색 커트 잘하는... ,https://blog.naver.com/commecejour1?Redirect=Log&logNo=221635575662,샾벨르오의 위치는 역삼역 출구에서 스타벅스 뒷편으로 나와 사진으로 보이는 골목으로 들어가면 우측평방옥 이 보이는 건물 2층에 있습니다. 골목이 많은 곳이라 지도만 보고 찾기는 어렵지만 위에 적은대로... ,초보냠냐머,https://blog.naver.com/commecejour1,2019-09-01
맛있는 녀석들 253회 - 전지적 먹방 시점1,https://blog.naver.com/laonwhoje?Redirect=Log&logNo=222311552810,031-611-5793평방옥주소 : 서울시 강남구 역삼동 736-32 1층 (테헤란로 22길 12) 전화번호 : 02-501-9194... 02-555-6666 #253회 #맛있는녀석들 #맛집 #내당한우 #안성휴게소 # 평방옥#32파르페 #명동점 #유민상... ,하얀나라 줄눈 - 서울,https://blog.naver.com/laonwhoje,2021-04-27
"유학원 일상 업무, 퇴근 후 김포한강 신도시",https://blog.naver.com/jinababa?Redirect=Log&logNo=222368821799,"참 땅을 넓게 쓴다 ㅎㅎ 오늘 점심-김치가 아주 맛있는평방옥털털이 해장국 설렁탕이랑 김치가 아주 맛있는평방옥 인데, 오늘 점심은 해장국을 먹었다. 개인적 강남역 배달맛집!!! 이당 해장국이라니 어제... ",미국유학 전문플래너,https://blog.naver.com/jinababa,2021-05-26
[맛있는 녀석들] 출현한 맛집 총 정리! (2018'~2019'),https://blog.naver.com/cavare1?Redirect=Log&logNo=222115149562,"1749) 수원왕갈비 : 본수원갈비, 경기 수원시 팔달구 우만동 103-1 (중부대로 223번길 41) 227회 [시청자 추천 숨은 맛집 5] 편 (방영일 : 2019. 6. 28) 물냉면 : 육천냉면 황해식당, 경기 양평군옥",::도롱리베리맘 졸려워요::,https://blog.naver.com/cavare1,2020-10-14
"맛있는 녀석들, 방문 집 정리 (2021-10-02)",https://blog.naver.com/sobeit78?Redirect=Log&logNo=222016788682,"내가 먹고싶어서 정리. 당연히 다 가지는 못할테고, 출장이 많은 인생. 근처에서 마땅한 음식을 먹고싶어질때 찾기 편하게 하려고. 맛집이라고 단언하지는 못하겠지만 몇몇곳은 방송을 보며 가보고... ",호접몽,https://blog.naver.com/sobeit78,2020-06-30
신논현 무공돈까스 - 맛있는 녀석들 김민경 돈까스... ,https://blog.naver.com/gypsyone?Redirect=Log&logNo=221758479705,"지난주에 문세윤이 매니저, 스타일리스트와 함께 간 역삼동 설렁탕평방옥그리고 명동을 갔다지만.. 내가 지난주에 무슨 일이 있었는지 바빠서 정신없어서 본방을 아직 시청하지 못했다. 다들 스포 금지!!... ",세콰노의 머거머거,https://blog.naver.com/gypsyone,2020-01-03
인턴일기:: 역삼역 점심 밥집 10군데 별점,https://blog.naver.com/babybaby___?Redirect=Log&logNo=221593574349, 평방옥★★★☆ 냉면이랑 설렁탕이랑 곱창해장국 점심에는 8천원 나는 냉면만 먹어봤는데 시원하니 괜찮았다 3. 하노이스토리 ★★★☆ 무난한 쌀국수집~.~ 김치 쌀국수는 마치 잔치국수 같았다고 한다... ,지금은,https://blog.naver.com/babybaby___,2019-07-23
아점 20.11.03,https://blog.naver.com/vanessa610?Redirect=Log&logNo=222136622030,ㅋㅋㅋ 다음엔 양보하지마!!! 시박 #밀린일기 #역삼 #역삼역 #3번출구 # 평방옥#맛있는녀석들 #설렁탕 #갈비탕 #길치 #셋다 #어디가 #오랜친구들 #기다려주셔서감사합니다 너희 누가 영하랬어 ^^ ?? 나만 덥잖아?,쉬면 불편함을 느끼는 아이,https://blog.naver.com/vanessa610,2020-11-06
"맛있는녀석들 문세윤 설렁탕, 김준현 홍성한우 위치와 정보",https://blog.naver.com/gogh1226?Redirect=Log&logNo=221752115953,"맛있는녀석들 문세윤 설렁탕은 역삼동에 위치한평방옥 입니다. 상호명 :평방옥주소 : 서울 강남구 테헤란로22길 12 전화번호 : 02-501-9194 영업시간 : 평일 08:00-24:00, 공휴일 및 주말 : 10:00-20:30 주요메뉴... ",여러 가지에 관심이 많은 자질구레한 블로그,https://blog.naver.com/gogh1226,2019-12-28
반짝이는 별을 모아 그리는 그런 사람,https://blog.naver.com/2514o_o?Redirect=Log&logNo=222505920601,잘 찾았음 ㅋ 가게 이름은평방옥 이었다는 거... 어쨌든 3분의 1은 맞췄네... 이제 슬슬 긴팔 입는 시즌!나는 후드티랑 맨투맨은 좀 있는데 무난한 긴팔이 없어서 추석 끝나면 구매할 예정 (근데 그쯤엔... ,썸띵뉴: 썸머몽의 thinking & newday,https://blog.naver.com/2514o_o,2021-09-15
역삼미용실 샵벨르오. 여자단발머리스타일 은지쌤 잘하네요!,https://blog.naver.com/hanusmil?Redirect=Log&logNo=221526755192,"ㅠㅠ 담에 또 오게되면 네이버지도에서 꼭평방옥 으로 검색하리라!! (잊지 않을려고, 사진찰칵!)... #역삼미용실 #샵벨르오 서울 강남구 테헤란로22길 12평방옥2층 02-562-3637 11:30 - 21:00 일요일 휴무 https... ",take a bit out of life,https://blog.naver.com/hanusmil,2019-05-01
