title,link,description,bloggername,bloggerlink,postdate
[Flower cake평화떡공방 ] 크리스마스 컵설기 원데이,https://blog.naver.com/gpals8575?Redirect=Log&logNo=220550309618,안녕하세요:) Flower cake평화 떡 공방입니다. 오늘 엄청 추웠죠 내일은 영하로 떨어진다는데 감기... - 수업시간 : 2시간 - 장소 : 대구 남구 봉덕 1동 954-12번지평화떡공방- 수업일 : 12월 7일 월요일 오후... ,평화떡공방,https://blog.naver.com/gpals8575,2015-11-26
생활의달인 꿀떡평화떡공방꿀맛은 아닌듯,https://blog.naver.com/xiaozhen1004?Redirect=Log&logNo=221257249024,봉덕동 네일아트 받으러 가기전에 들린 봉덕시장평화떡공방이 멀리까지 떡집을 찾아온 이유는 또 생활의 달인을 봤기 때문ㅋㅋ 봉덕시장 간판 바로 입구에 있는 생활의 달인 꿀떡편에 나온평화떡공방생활의... ,샤오쩐의 행복여행♡,https://blog.naver.com/xiaozhen1004,2018-04-20
인스타유명떡집평화떡공방 ,https://blog.naver.com/thepapalab?Redirect=Log&logNo=221262361750,꿀떡으로 아주 유명한 봉덕 시장입구에 위치한평화떡공방 을 소개합니다. 줄도 기본 5명이 서있네요.... ㅎㅎㅎ 그래도 또 남았지요 ㅎㅎㅎ ㅎㅎ 한번쯤 사드셔보시길^^ 대구봉덕시장평화떡공방 후기였습니당!!,아빠연구소,https://blog.naver.com/thepapalab,2018-04-27
"대구 1박 2일 여행 ( 평화떡공방앙꼬절편, 꿀떡/ 대구 떡볶이... ",https://blog.naver.com/dresscodeantique?Redirect=Log&logNo=221477431259,"절에서도 평화를 찾느니라.. 카페 마땅한 곳이 없어서 택시타고 봉덕시장평화떡공방 으로 이동~~! 현경이가 떡 엄청 먹고싶엇나봄,,, 택시비 낼테니 가자고 한거 웃겼습네다 근데 택시아저씨가 우리한테 길을... ",잉썹이 블로그,https://blog.naver.com/dresscodeantique,2019-03-01
[Flower cake평화떡공방 ] 크리스마스 케이크 원데이,https://blog.naver.com/gpals8575?Redirect=Log&logNo=220550324542,안녕하세요:) Flower cake평화 떡 공방입니다. 이번에는 크리스마스 케이크 원데이 수업을... 954-12번지평화떡공방- 수업일 : 12월 1일 화요일 7시 30분 12월 8일 화요일 7시 30분 12월 17일 목요일 7시 30분... ,평화떡공방,https://blog.naver.com/gpals8575,2015-11-26
대구꿀떡 평화떡공방추억의 떡이에요~,https://blog.naver.com/bluenightsh18?Redirect=Log&logNo=221325473387,대구꿀떡 평화떡공방추억의 떡이에요~ 티비에 나온 후로 한동안 sns에 완전 핫했던 꿀떡이에요.... 그래서 추억의 꿀떡으로 남아 있었는데평화떡공방 에서 꿀떡을 만든다는 소식을 들어서 사먹어봤어요... ,오늘도 좋은 아침 : ),https://blog.naver.com/bluenightsh18,2018-07-24
대구 맛집평화떡공방꿀떡 먹어본 후기!,https://blog.naver.com/dewyflower7?Redirect=Log&logNo=221319869839,대구평화떡공방꿀떡 먹어본 후기! 꿀떡의 인기가 줄어들긴 했지만 먹고 싶어서 사먹고 왔습니다ㅋㅋ... 결론은 맛있어용ㅎㅎ 단거 좋아하는 제입맛엔 떡집이 집앞에 있다면 또 사먹을 맛입니당 평화떡집은... ,Floria’s daily life ♡,https://blog.naver.com/dewyflower7,2018-07-16
생활의달인에 나온 봉덕시장 꿀떡으로 유명한평화떡공방 ,https://blog.naver.com/lovely______j?Redirect=Log&logNo=221351336896,점심으로 청도돼지국밥먹고 ~봉덕시장 온김에 꿀떡사러평화떡공방 으로 고고 ! SNS로 아주유명해진 봉덕시장평화떡공방. (생활의달인에나오기도한) 최근에 수요미식회대구편에도 나왔다고하던데 실화????... ,"나의 라이프로그,",https://blog.naver.com/lovely______j,2018-09-03
[평화떡공방 카페 오픈 전 이벤트 ],https://blog.naver.com/gpals8575?Redirect=Log&logNo=221577429213,"안녕하세요평화떡공방카페로 오픈 전 이벤트를 합니다 7월 한달간 단호박퓨레설기케이크와 아이스초코찰떡을 5,000원 할인 이벤트 합니다 ◟̊◞̊ 단호박퓨레설기는 저희가 직접 단호박을 찌고 끓여서... ",평화떡공방,https://blog.naver.com/gpals8575,2019-07-04
[대구 대봉동]평화떡공방대구 꿀떡 격파!,https://blog.naver.com/tngus5323?Redirect=Log&logNo=221579929099, 평화떡공방검색하니 꿀떡 원조집이라며 추천해주더라구요! 매일 일요일 휴무 체크! 생활의 달인에도... 없네요~ 떡 종류는 약 15가지 이상이였어요 쪼기 파란박스에 플라스틱 팩으로 포장되어있는거... ,dodo_도도,https://blog.naver.com/tngus5323,2019-07-07
대구맛집 봉덕시장평화떡공방꿀떡,https://blog.naver.com/kcd01019?Redirect=Log&logNo=221336179859, 평화떡공방입니다. 기다리는사람이 얼마나 많은지늦게가면 떡 못사고 헛걸음 하시는분들도 계신다고.. 대구에서는 예전부터 있던 꿀떡인데 SNS랑 생활의달인 출연후 엄청 유명해졌다고 합니다. 역시 방송의... ,헬로우드림 허스키,https://blog.naver.com/kcd01019,2018-08-10
대구 꿀떡평화떡공방 ,https://blog.naver.com/bhjung1104?Redirect=Log&logNo=221248122262, 평화떡공방주차장이 따로 없어서 ㅠㅠ 가게 도로에 차를 잠시 정차시키고 갔다 왔는데 저는 오전이라 가능했지만 오후쯤엔 불가능해보였어요. 저는 제 아침으로 한팩이랑 주임님이 주문하신 떡 4팩 이렇게... ,곧사슴 초식 다이나믹,https://blog.naver.com/bhjung1104,2018-04-08
대구평화떡공방/ 꿀떡,https://blog.naver.com/jjmm9895?Redirect=Log&logNo=221279913925,"드디어 먹어보고 왔습니다 ㅋㅋㅋㅋㅋ 생활의 달인에도 나오셨고, SNS에서도 워낙 알려져 있어서 쉽게 만나보실 수 있으셨을 거예요 대구평화떡공방휴무날부터 꿀떡 및 앙꼬 절편 가격까지 참고로 앙꼬 절편은... ",정재만 강사,https://blog.naver.com/jjmm9895,2018-05-20
생활의 달인 꿀떡! 대구 봉덕시장평화떡공방꿀떡 후기,https://blog.naver.com/willowsim?Redirect=Log&logNo=221263441825,대구 봉덕시장에 있는평화떡공방 에 드디어 가봤습니다 ❤️ 위치는 여기입니당 생활의 달인에도 나왔다는평화떡공방!! 기대감 상승 꿀떡이 보입니닷!! 토요일 오전 열시 쯤 방문했는데 기다림 없이 구매 할... ,보통날,https://blog.naver.com/willowsim,2018-04-28
 평화떡공방꿀떡 및 일상,https://blog.naver.com/shinsaeeun24?Redirect=Log&logNo=221275859708,# 평화떡공방#대구 평화떡공방#꿀떡 #봉덕시장 #봉덕시장꿀떡 #대구봉덕시장 #아보카도샌드위치 #냠냠 탄것 같다면 정답 약간 타버림 한번에 세명 분량만들다보니 ㅎ 아 노른자 상태 좋구여 냠냠 여러분들 이렇게... ,GUILTY PLEASURE,https://blog.naver.com/shinsaeeun24,2018-05-15
생활의달인 찹쌀꿀떡달인 대구 “ 평화떡공방 ” 택배도 가능?!,https://blog.naver.com/naaaaaaan_kyung?Redirect=Log&logNo=221397354959,오늘은 생활의달인 찹쌀꿀떡달인 대구 “ 평화떡공방 ” 포스팅할게요. 봉덕신시장 생활의달인 찹쌀꿀떡달인 대구 “ 평화떡공방 ” 도로변에 위치한곳이고 멀리서부터 길게 줄이 느러져있으니 한번에... ,난댕이공간,https://blog.naver.com/naaaaaaan_kyung,2018-11-14
"[대구 맛집] 평화떡공방 , 워이워이(woywoy)카페",https://blog.naver.com/kejin5071?Redirect=Log&logNo=221258914669, 평화떡공방이렇게 주말에 가면 일단 줄서야 하는게 기본.. 저는 대구 내려가서 알았기 때문에... 대구 평화떡공방#마켓준비 #대구 #전주 #부천 #포스팅 #업뎃예정 #코디룩 #봄코디 #공구마켓 #광주 #blogmarket #post,Jinida,https://blog.naver.com/kejin5071,2018-04-22
대구 꿀떡 봉덕시장 떡집평화떡공방앙꼬절편,https://blog.naver.com/soj24?Redirect=Log&logNo=221326057269,"봉덕시장 대구꿀떡 사러 두 군데를 가봤다 이미 생활의 달인에 나와 유명한평화떡공방 과 옆에 있는... 한다 떡 종류도 원래 좀 다양해보이던데 내가 갔을 땐 다 팔렸는지 이게 끝이었다 앙꼬절편 가격은 2,500... ",찹쌀찹쌀 박찹쌀,https://blog.naver.com/soj24,2018-07-25
대구)평화떡공방꿀떡,https://blog.naver.com/yunhwa0?Redirect=Log&logNo=221310062759,요즘 핫하디 핫한 대구평화떡공방 의 꿀떡 먹어보구싶어서 저장해두었다가 대구간김에 봉덕동 봉덕시장 들러서 엄마줄꺼 회사동료들줄꺼 우리먹을꺼 바리바리 사재기해버렸네 살다보니 꿀떡을... ,기억저장소,https://blog.naver.com/yunhwa0,2018-06-30
"[대구]봉덕시장,평화떡공방 을 가보다!",https://blog.naver.com/yesolthf?Redirect=Log&logNo=221277182286,"바로, 봉덕시장의평화떡공방위치는 요기! 대구역에서 버스타고 좀만가면 도착. 내려서 찾기도... 그리고 저는평화떡공방 이 생활의 달인에 나와서 찾아갔던건데 확~떠서그른가 대구떡집에 거의 팔더라구요.... ",Y.SOL,https://blog.naver.com/yesolthf,2018-05-16
"[대구평화떡공방 ] 봉덕시장 명물, 찹쌀 꿀떡 택배주문 리뷰",https://blog.naver.com/callmeyj?Redirect=Log&logNo=221240439652,주문가능한 곳을 찾았다뉸 거~~ 찹쌀 꿀떡을 파는 # 평화떡공방블로그와 인스타 주소이니... 4월 택배주문에 성공하셔서 꼭 맛보시기를 바라용 ❤️ 오후 5시 전에 공방가시면 구매하실 수 있다고 하니 지도... ,예 띠 로 그,https://blog.naver.com/callmeyj,2018-03-29
[대구맛집/대구떡집] 대구 봉덕시장평화떡공방찹쌀꿀떡,https://blog.naver.com/yoonso__02?Redirect=Log&logNo=221242595641,대구 봉덕시장에 있는평화떡공방찹쌀꿀떡을 소개해드리려고 합니당!!! 원래 12개에 2000원이였는데...평화떡공방옆에 서울떡집에서도 꿀떡을 판다고해서 3팩 더 사왔대요 ㅋㅋㅋㅋ 요건 서울떡집... ,물오른 피부,https://blog.naver.com/yoonso__02,2018-04-01
[대구 꿀떡] 봉덕시장평화떡공방 / 대구에만 있는 꿀떡?!... ,https://blog.naver.com/mk31359?Redirect=Log&logNo=221228623216, 평화떡공방 은 꿀떡이외에도 원래 떡 맛집이여서 11시쯤 방문했는데도 다른떡들이 많이 판매되었어요... ***-****-**** #대구꿀떡 #봉덕시장꿀떡 #꿀떡 #봉덕시장 평화떡공방#대구 평화떡공방# 평화떡공방#평화떡... ,믿고 먹는 가밍이의 블로그,https://blog.naver.com/mk31359,2018-03-14
SNS에서 난리난 봉덕시장 꿀떡평화떡공방 ,https://blog.naver.com/kgl7476?Redirect=Log&logNo=221279688056,"SNS에서 난리난 봉덕시장 꿀떡평화떡공방안녕하세요 지싸이입니다. 오늘은 요즘 페북, 인스타 등... 저기 주황색 간판 앞쪽에평화떡공방보이시나요?? 드디어 제 차례입니다. 뜨거운 햇빛 아래에서... ",지싸이의 한농대 Story,https://blog.naver.com/kgl7476,2018-05-20
대구꿀떡평화떡공방꿀떡먹는방법,https://blog.naver.com/babybear_?Redirect=Log&logNo=221386561505,어제 대구가서 사온평화떡공방대구꿀떡 알바생인지는 모르겠지만 매장앞에서서 떡사실꺼냐고 묻기에 꿀떡사러왔다고하니 스트로폼박스에서 꿀떡을 꺼내주더라구요 꿀떡은 다음날먹어야 더... ,"초보엄마, 초보주부의 일상생활",https://blog.naver.com/babybear_,2018-10-28
봉덕시장 떡맛집평화떡공방꿀떡 맛나욧,https://blog.naver.com/nsy100?Redirect=Log&logNo=221674053230,꿀맛이 난답니다 두가지 떡 외에도 많아요 커피도 팔구욧 옆에 테이블도 있답니당 위치는... 침 흘리는 딸랑구^^ 언능 집가서 맛나게 냠냠하쟝 #떡맛집 #떡집 #대구떡집 # 평화떡공방#떡공방 #꿀떡 #대구꿀떡,happy life ♡,https://blog.naver.com/nsy100,2019-10-10
대구봉덕시장평화떡공방꿀떡배달 심부름,https://blog.naver.com/venus0323?Redirect=Log&logNo=221245673522,대구 꿀떡 심부름 대구평화떡공방꿀떡배달 대구 봉덕시장 꿀떡 오늘도 변함없이 인산인해... 진짜 떡(?)된 꿀떡은 순식간에 내 뱃속에 저장!! 나 혼자 먹는데 저리 플레이팅?!?해봤다는~~~~ (^_^)V 이름대로 완전... ,☆대구MASTER심부름☆,https://blog.naver.com/venus0323,2018-04-05
대구 꿀떡 파는곳 봉덕시장평화떡공방리얼후기,https://blog.naver.com/qnwk7012?Redirect=Log&logNo=221315456038,"대구 꿀떡 파는곳 봉덕시장평화떡공방리얼 후기 김천국밥을 먹고 오는길에 대구 꿀떡 파는곳이 있어 바로 방문,평화떡공방이라는 곳이다. 어릴적에는 시장에 가면 늘 먹었던 꿀떡이 요즘엔 보이지 않는다.... ",리어카,https://blog.naver.com/qnwk7012,2018-07-09
[Flower cake평화떡공방 ] 클래스,https://blog.naver.com/gpals8575?Redirect=Log&logNo=220539293540,안녕하세요:) Flower cake평화 떡 공방입니다. 기초반과 심화반으로 구성되어 있습니다. - 장소 : 대구 남구 봉덕 1동 954-12 번지평화 떡공방- 준비물 : 필기 도구 - 수강 인원 : 1명 - 2명 - 시간 : 2시간 30... ,평화떡공방,https://blog.naver.com/gpals8575,2015-11-14
대구꿀떡!!평화떡공방나도 드디어 먹어봄 ☆,https://blog.naver.com/red10245?Redirect=Log&logNo=221367198586,"#대구꿀떡 # 평화떡공방#봉덕시장 대구토박이로 대구에서 30년 넘게 살고 있지만,,,, 사실 대구에 꿀떡이... 보통은 집에서 전자렌지 돌려서 먹는다고 하더라구요^^ 그냥 설탕물에 떡 담겨져 있는 비쥬얼이었어요!!... ",캡틴루초의 사는이야기,https://blog.naver.com/red10245,2018-09-28
대구봉덕시장/대구꿀떡/서울분식/ 평화떡공방 ,https://blog.naver.com/yes6797?Redirect=Log&logNo=221365909351,봉덕시장 입구에 차를 대고보니 바로앞에 발견한평화떡공방 ! 5시조금넘어서 갔는데 떡이 꽤 많았답니당 한팩에 3천원이에요!! 얼려진상태라서 자연해동30분 또는 전자레인지30초면 된다고 하시네용 푸디어플로... ,대구부동산안심중개하는 윤소장❣️,https://blog.naver.com/yes6797,2018-09-26
"봉덕시장평화떡공방대구 꿀떡, SNS에서 핫한 꿀떡 먹어봤어요",https://blog.naver.com/khw7736?Redirect=Log&logNo=221281407094,"대구 꿀떡평화떡공방26살인 저, 아주 어릴 때부터 친자매처럼 지내는 20년 넘는 인연이 있어요 벌써... 저는 기분 좋게 받은 선물이어서 그런지 더 맛있었어요:-) 떡 자체를 워낙 좋아하는 떡순이라ㅋㅋㅋㅋ... ","해니로그, 창고스타일",https://blog.naver.com/khw7736,2018-05-22
[대구여행] 대구맛집 ::평화떡공방꿀떡 :: 우유랑 같이먹으니... ,https://blog.naver.com/seulgi0517?Redirect=Log&logNo=221396643049,[대구여행] 대구맛집 ::평화떡공방꿀떡 :: 우유랑 같이먹으니 진짜 꿀맛이네:) 대구에왔으니 꼭... 한다 떡 상태를 보며 전자레인지에 적당히 돌려서 먹을 수 있다고 하니 냉동실에 쟁여놓고 먹어도 좋을 듯... ,소중한 것은 모두 일상속에 있다,https://blog.naver.com/seulgi0517,2018-11-12
대구 꿀떡 맛집평화떡공방- 이영자도 인정한 대구꿀떡 맛집... ,https://blog.naver.com/kmj92212?Redirect=Log&logNo=221521435734,후회하지~ #대구 #대구여행 #대구맛집 #대구떡집 #대구꿀떡 #이영자맛집 # 평화떡공방#평화떡집... 떡 맛 집의 명성답게 꿀떡 외에도 많은 떡들을 판매하고 있었어요. 하지만 저의 목적은 대구 꿀떡!! 한 팩을... ,KIM'S DIARY,https://blog.naver.com/kmj92212,2019-04-24
생생정보통 대구 꿀떡- 평화떡공방먹어보다.,https://blog.naver.com/rorongworld?Redirect=Log&logNo=221288165396,물어본평화떡공방 의 찹쌀 꿀떡입니다. 아마 지지난주 토요일이었을거에요.... 가기 전에 검색을...평화떡공방 은 이미 생생정보통에 방송되기 전부터 대구에서 유명한 떡집이었다 하더라구요. 전 처음가보고... ,로롱월드~!!,https://blog.naver.com/rorongworld,2018-05-31
대구꿀떡 원조 봉덕시장평화떡공방꿀떡 먹어봤어요!,https://blog.naver.com/yui1397?Redirect=Log&logNo=221496990295,모르겠지만평화 떡공방여기가 원조라고 해요! 매주 일요일 휴무 영업시간은 09:00~18:00에요 요즘은 줄서서 사먹는거같진 않아요 기다리지 않고 바로 구매가능했어요~ 다양한 떡 종류 많았어요~ 떡... ,♡유유코드♡,https://blog.naver.com/yui1397,2019-03-26
남구 대구봉덕시장 대구꿀떡평화떡공방 ,https://blog.naver.com/rma1380?Redirect=Log&logNo=221291862689,생활의 달인 출연으로 유명한 대구 꿀떡 맛보러평화떡공방 에 들렸습니다 대구분들은 먹어봤을꺼 같은... 꿀떡 추억의 맛입니다 절편은 팥이 들어가서 더욱 맛있네요 추억의 꿀떡평화떡공방잘먹었습니다,오늘은뭐묵노,https://blog.naver.com/rma1380,2018-06-05
"[대구 평화떡공방 , 라뽁이마을]",https://blog.naver.com/yoo51095109?Redirect=Log&logNo=222125013510,"대구평화떡공방 에서 꿀떡 먹었어요! 3시쯤가니 일반은 매진ㅠㅠ 냉동을 구매했어요 그래도... 1인분에 2천원이예요 대학가 근처여서 그런가 저렴~~ 라뽁이 2인분에 쿨피스 하나 시켰어요 떡, 햄, 오뎅, 계란... ",Welcome to “Give One Bite” life style ❁´ω`❁,https://blog.naver.com/yoo51095109,2020-10-24
대구봉덕시장 꿀떡평화떡공방 ,https://blog.naver.com/iizzanii123?Redirect=Log&logNo=221305266818,매스컴에도 많이 나온평화떡공방꿀떡 줄을 서야된다 한사람앞에 3개씩만 살수있다 그랬는데 내가 갔을땐 손님이 없었어요 ㅋㅋㅋㅋ 그냥 바로 삼 ㅋㅋㅋㅋㅋ 꿀떡 2개랑 백설기떡1개 꿀떡이 완전 너무... ,토끼띠언니 마켓,https://blog.naver.com/iizzanii123,2018-06-23
대구 꿀떡 봉덕시장평화떡공방다녀온 후기,https://blog.naver.com/mijoo0816?Redirect=Log&logNo=221328873877,사러왔다평화떡공방가게앞에 가면 잘 팔리는것 하나만 딱 눈에 보인다!!^^ 이것이 바로 대구 꿀떡!! 봉덕시장의 유명한평화떡공방 의 꿀떡이다~ 화려하지도 않고 가격도 비싸지도 않으면서 진짜 부답스럽지않게... ,고ㄴㅣ♡ MJ의 대구살이,https://blog.naver.com/mijoo0816,2018-07-29
[ 평화떡공방 ] 대구 꿀떡 택배 솔직 후기 (feat.더현대닷컴),https://blog.naver.com/sara0903?Redirect=Log&logNo=221277972022,안그래도 너무 궁금했던 대구 꿀떡 택배 후기에요평화떡공방 ) 대구 꿀떡 택배 대구까지 갈 수는 없고... 저 단거 엄청 좋아하는데 너무달아요 ㅋㅋㅋㅋ 엄청 단 떡..? 떡은 엄청 찰지지만요 음 너무달다고... ,엄마라는 인생의 2막,https://blog.naver.com/sara0903,2018-05-17
대구 꿀떡 봉덕시장평화떡공방후기,https://blog.naver.com/koosoho?Redirect=Log&logNo=221264466971,8시 30분에 도착 택시에서 내리자마자평화 떡공방 으로!! ㅎㅎ 다행이 문열었고 앞에 아주머니 엄청난... 서울에서는 팥들어있는건 못본거같은데 서울에 혹시 팥들어간 증편 떡 파는곳있으면 알려주세요~^^제가... ,꿀또요니의 하루,https://blog.naver.com/koosoho,2018-04-30
"뚜벅이 여행 중앙 떡볶이,평화 떡 공방 , 두류 공원 수성못",https://blog.naver.com/hyun-jjj?Redirect=Log&logNo=221517670414,대구 꿀떡 유명한 대구 꿀떡 말고도 정말 다양한 떡 종류가 많았던 대구평화떡공방배가 부르지 않은 상태였다면 이것저것 다 사볼 텐데. 아쉬움 :( 대구 두류 공원 수성못 대구 이월드에서 스카이 드롭 한바탕... ,HYUN. 내 마음대로 할 수 있는 건여행뿐,https://blog.naver.com/hyun-jjj,2019-04-20
대구평화떡공방꿀떡,https://blog.naver.com/skdus9674?Redirect=Log&logNo=221673147794,대구평화떡공방꿀떡 요즘 인스타에서 꽤 유명하다던 #꿀떡 사실 대구사람인 저는 잘 모르는 타지인들에게 더 유명한 꿀떡 ㅋ 어떤맛일지 상상이 가지만 궁금하긴 했던 대구평화떡공방꿀떡 남편이 퇴근길에... ,매일매일 행복하자,https://blog.naver.com/skdus9674,2019-10-09
대구꿀떡으로 유명한평화떡공방 !,https://blog.naver.com/tkcjsslql?Redirect=Log&logNo=221240848760,대구꿀떡평화떡공방 의 내부인데요! 저기 보이는 하얀거 보이시나요??저게 전부 꿀떡이였단 사실... 몇개 더 살 껄 그랬나봐요 ㅜㅜ 넘나 맛있는것.....ㅋㅋㅋㅋㅋㅋ 꼭 대구에 들리신다면 대구꿀떡평화떡공방 을... ,Beenslife,https://blog.naver.com/tkcjsslql,2018-03-30
[봉덕동 맛있는 떡집]평화떡공방떡케익,https://blog.naver.com/jhmw728?Redirect=Log&logNo=221028254385,"엄마아빠가 떡을 좋아하셔서 떡케익으로 알아보던 찰나,, 인스타에평화떡공방 이 뜨길래 들어가서봤는데 꽃도 콩앙금으로 이쁘게 만들어서 장식해주는 떡집 집이랑도 가깝고 해서 선택 [ 평화떡공방 ] 대구 남구... ",태양 MOM 꼬꼬의 에브리띵,https://blog.naver.com/jhmw728,2017-06-13
대구 꿀떡평화떡공방 ,https://blog.naver.com/cincopaises?Redirect=Log&logNo=221236302940,대구 꿀떡평화떡공방 은 예쁜 떡이 많네요 ㅎ 꿀떡의 모임! 대구 꿀떡평화떡공방 !! 맛있어보이는 떡! 여기 찾느라 봉덕시장을 지나왔어요 ㅎ 대구 꿀떡평화떡공방인정합니다! #대구 #꿀떡 # 평화떡공방#봉덕시장,망고의 대굴빡 굴러가는 소리,https://blog.naver.com/cincopaises,2018-03-24
생방송 오늘 저녁 191023 대구 봉덕시장 찹쌀 꿀떡평화떡공방 ,https://blog.naver.com/paul_young?Redirect=Log&logNo=221686508174,꿀떡평화떡공방https://blog.naver.com/nasci/221686400373 생방송 오늘 저녁 191023 대구 봉덕시장 찹쌀 꿀떡평화떡공방#생방송오늘저녁 #1177회 #191023 #고수열전 #대구 #봉덕시장 #찹쌀꿀떡... ,Dust in the wind,https://blog.naver.com/paul_young,2019-10-23
"[대구 봉덕시장 맛집]평화떡공방 (평화떡집) : 꿀떡, 앙꼬절편",https://blog.naver.com/hn_17?Redirect=Log&logNo=221312569467,#떡 #떡집 #평화떡집 # 평화떡공방#꿀떡 #앙꼬절편 #대구꿀떡 #봉덕시장맛집 #봉덕시장떡집 #봉덕시장꿀떡 잔치국수를 먹고 가까운데 평화떡집이 있어서 나름 유명한? 대구 봉덕시장 꿀떡을 사먹으러 다녀왔어용... ,VIVA PRIMAVERA,https://blog.naver.com/hn_17,2018-07-04
생활의 달인 찹쌀꿀떡평화떡공방 ,https://blog.naver.com/jwpark386?Redirect=Log&logNo=221239191861,생활의 달인 찹쌀꿀떡평화떡공방쫄깃 달콤한 꿀 떨어지는 떡을 맛볼수 있는평화떡공방 을 소개했네요 흔하게 볼 수 없는 비주얼의평화떡공방찹쌀꿀떡은 부드럽고 구수한 단맛이 일품으로 찹쌀꿀떡의... ,낭만자객,https://blog.naver.com/jwpark386,2018-03-28
"후 봉덕시장 꿀떡 (마카로네상점, 겸카롱,평화떡공방 , 소문난떡집)",https://blog.naver.com/fri1001?Redirect=Log&logNo=221275349416,달라붙음평화떡공방설탕맛. 엄청나게 달진 않고 떡 쫀득함 그냥먹는거보다 전자레인지 돌려먹는게 훨 맛있음평화떡공방 이 좀 더 내 스탈 유명한 곳은 이유가 있나보다~ 했당ㅎ 꿀떡은 한 번 먹어본걸로... ,ZUNG BLOG,https://blog.naver.com/fri1001,2018-05-14
#대구 봉덕시장평화떡공방꿀떡,https://blog.naver.com/msinms?Redirect=Log&logNo=221254971163,20180417 봉덕시장평화떡공방방문기-* 요새 sns에서 핫한 대구에서만 판다는 꿀떡!! 떡순이가 되어서 안먹어볼수가 업지요. 대구행을 택한 것에 많은 힘을 실어준^-^ 원래 어제 가려구했는대 3째주 월요일... ,▽□△,https://blog.naver.com/msinms,2018-04-17
봉덕동맛집] SNS에서 핫한 대구 꿀떡의 본점 !!평화떡공방 ,https://blog.naver.com/banana6780?Redirect=Log&logNo=221351737257,"20180901 대구맛집, 봉덕동맛집 대구꿀떡, 봉덕시장 봉덕시장꿀떡, 꿀떡평화떡공방평화떡공방주소 : 대구광역시 남구 봉덕로 117 (봉덕1동 954-12) 봉덕시장 도로편 전화 : 053)473-8575 일요일 휴무 주차장 없음... ",naru's house,https://blog.naver.com/banana6780,2018-09-03
대구 봉덕시장 -평화떡공방꿀떡,https://blog.naver.com/junki8714?Redirect=Log&logNo=221253673997,"20180414 대구 봉덕시장 -평화떡공방꿀떡 요즘 SNS에서 유명한 꿀떡 이예요~ '생활의 달인' 이라는... 떡집 바로 앞까지 오면 떡 보관법이나 휴무일 등 에 대한 정보가 붙여져 있어요. 꿀떡은 한팩 3,000원... ",소미쓰블로그,https://blog.naver.com/junki8714,2018-04-15
대구 남구 봉덕시장 대표 먹거리:: 평화떡공방 /평화떡집 꿀떡... ,https://blog.naver.com/dkw03221?Redirect=Log&logNo=221349159304,"대구 남구 봉덕시장 대표 먹거리 ::평화떡공방꿀떡 구매후기 #주소 대구 남구 봉덕1동 954-12 #휴무... 먹고싶다면 떡 상태를 보며 전자레인지에 돌리기 단, 찹쌀이라서 많이 돌리면 XX 앙꼬절편은 당일 권장!... ",S T A Y S T R O N G,https://blog.naver.com/dkw03221,2018-09-02
