title,link,description,bloggername,bloggerlink,postdate
앙금떡케이크 - 대구평화떡공방 ,https://blog.naver.com/quf7766?Redirect=Log&logNo=222332722368, 평화떡공방 에서 쑥설기 사먹고는 맛있어서 몇군데 알아보고 크게 고민안하고 여기로 결정했다. 주문은... 모양은평화떡공방인스타에서 보고 화사한 걸로 골라서 보내드렸다. 설기 종류 두개로 한 거 샘플은... ,일상다반사,https://blog.naver.com/quf7766,2021-05-02
드디어 먹어본 대구 봉덕시장평화떡공방찹쌀 꿀떡과 앙꼬절편,https://blog.naver.com/hyohye0413?Redirect=Log&logNo=222534451347,대구 찹쌀 꿀떡 유행이 시작된 곳 대구 봉덕시장평화떡공방대구 남구 봉덕로 119 대구 봉덕신시장 입구에 위치한평화떡공방 . 주차할 곳을 따로 찾기가 어려워 여기서 저를 내려주고 남편은 빙글빙글 주변을... ,혜효일상,https://blog.naver.com/hyohye0413,2021-10-12
대구남구 봉덕시장에 가면 꼭 먹어야하는평화떡공방 의 꿀떡과... ,https://blog.naver.com/algidrh?Redirect=Log&logNo=221781478732,그것평화떡 공방 의 꿀떡이 있다 그리고 찹쌀떡 시장통 한가운데 떡카페가 떡하니 참 멋스럽웠다 이렇게 시장과 어우러진 공간 떡만 팔던곳이 떡카페로 변신하여 새롭게 탄생한 신 봉덕시장 떡카페평화떡 공방 ... ,여행이 좋다 .,https://blog.naver.com/algidrh,2020-01-22
[대구/남구] 말랑쫀득 찹쌀 꿀떡 대구평화떡공방 ,https://blog.naver.com/habongbabong?Redirect=Log&logNo=222423178914,들린평화떡공방후기. #대구꿀떡 #찹쌀꿀떡 #대구 봉덕시장 핫플평화떡공방 카페 대구 봉덕시장에... (떡 사진보니 예전에 사먹었던 그 떡 맛이 느껴지는 것 같은 너낌) 그동안 티비출연도 많이했나봄 식혜도... ,하봉하봉의 성장일기,https://blog.naver.com/habongbabong,2021-07-07
(1) 중앙떡볶이 / 랜디스도넛 / 팔공산 곳 카페 /평화떡공방 ,https://blog.naver.com/pds6527?Redirect=Log&logNo=222360178056,"1박 2일 대구여행 (1) 중앙떡볶이 / 랜디스도넛 / 팔공산 곳 카페 /평화떡공방4월 말에 오빠 친구 만날... 사러평화 떡 공방 에 들렸다 바로 먹을 수 있는 실온 제품은 품절이었고, 냉동 꿀떡만 있었는데 어짜피... ",쏘미 취향,https://blog.naver.com/pds6527,2021-05-22
소문난 대구 꿀떡 봉덕시장평화떡공방 ,https://blog.naver.com/june4931?Redirect=Log&logNo=222225768389,이곳이 봉덕시장에서 꿀떡이 맛있다고 소문난 대구평화떡공방 이에요. 정확한 상호는 카페까지 붙여야 되기에 검색하실 때는평화떡공방 카페로 검색하셔야 찾으실 수 있답니다. 매장 입구에 보면 TV에... ,짱아네남집사의 MC STORY,https://blog.naver.com/june4931,2021-01-30
대구 봉덕시장평화떡공방꿀떡가격 및 싸게 먹는법!!,https://blog.naver.com/melasmelas?Redirect=Log&logNo=221784391565,▼ ▼ ▼ 대구 봉덕시장 꿀떡평화떡공방그냥 떡 집인 줄 알았는데 커피음료도 함께 파는 카페 형태로 되어 있습니다. 대구 봉덕시장 꿀떡평화떡공방꿀떡이외의 다양한 종류의 떡들이 형형색색 포장용기에... ,다이어트 톡톡~JBK코치,https://blog.naver.com/melasmelas,2020-01-25
대구 봉덕시장 꿀떡 비교 /평화떡공방vs 소문난떡집 / 어디가... ,https://blog.naver.com/judo4383?Redirect=Log&logNo=222079965990,"줄서있던평화 떡 공방 을 방문 했다. 초등학교 시절 엄마따라 시장에 가서 꿀떡 먹어본 기억이 있다 그... 어머니가 떡 좋아해서 좀 더 사갈껄 그랬나? 소문난 떡집의 꿀떡은 2,000원 입니다. 2/3가격이죠... ",난늘배고파,https://blog.naver.com/judo4383,2020-09-04
대구떡집평화떡공방꿀떡,https://blog.naver.com/gok26214?Redirect=Log&logNo=222214684035,2018년 6월 27일... 떡 .....안먹어....달고 배불러....술 맛 해쳐.... 메모 : 막내가 순대 사달라고해서...순대... 딱 5번인대....... 떡 ...너무...맛있었다...배가...찟어질것처럼....부른대....3일 굶고....첨 먹을 때... ,자연주의.....창농!,https://blog.naver.com/gok26214,2021-01-21
대구 꿀떡 맛집 ㅣ평화떡공방 ,https://blog.naver.com/dearemma_?Redirect=Log&logNo=221924687448,"떡 보관, 드시는 법 - 구매한 다음날까지 직사광선이 없는 실온에서 보관 가능 - 이후에는 냉동 보관... 리뷰였습니당 # 평화떡공방#평화떡집 #대구 평화떡공방#대구평화떡집 #봉덕동 평화떡공방#봉덕동평화떡지... ",디어엠마,https://blog.naver.com/dearemma_,2020-04-23
"남구 봉덕시장맛집투어평화떡공방꿀떡, 청도 돼지국밥",https://blog.naver.com/peak113?Redirect=Log&logNo=222432207567,남구 봉덕시장 맛집 # 평화떡공방#꿀떡 #청도돼지국밥 오랜만에 갔더니만 깔끔하게 가게가 리뉴얼 되었네요~ #달달한 꿀떡 시장이라 그런지 떡값도 착하다고 하심.. #청도돼지국밥 따로국방은 국따로 밥따로... ,"함께오고 싶은 그런 캠핑,여행,일상...",https://blog.naver.com/peak113,2021-07-15
대구 꿀떡으로 생활의달인에 나온 봉덕시장 떡 맛집평화떡공방 ,https://blog.naver.com/9552131?Redirect=Log&logNo=221847125212, 평화떡공방 카페 주소_대구 남구 봉덕로 119 전화_053-473-8575 시간_09:00~19:00 휴무_일요일 및 매월 첫째주... 어떤맛일지 궁금하기도하고 너무 먹고싶어서 혼자 쫄래쫄래가서 줄서서 떡 사오고 그랬지 ㅎㅎ 줄서서... ,소보부부네 이야기ෆ,https://blog.naver.com/9552131,2020-03-10
대구 생활의달인평화떡공방 ,https://blog.naver.com/djkim74?Redirect=Log&logNo=221689035332,20년이 조금 넘은 대구 봉덕시장의평화떡공방 . 현재는 2대가 운영하는지 모르겠지만 평화떡집에서 공방이란 상호를 붙인 것이 단순떡집을 탈피하려는 노력이 엿보였다. 실제로 앙금플라워케이크 등 현대적인... ,Ray' story,https://blog.naver.com/djkim74,2019-10-26
할매김밥 청도장날(4일/9일) 소싸움경기장 / 대구평화떡공방꿀떡,https://blog.naver.com/hihihim1?Redirect=Log&logNo=221698082505,슝~ #대구봉덕시장 # 평화떡공방 카페로 #꿀떡꿀떡 은 3000원 앙금절편도 있고 다른떡들도 많이 있었어요 아~ 맛있는 떡들 많다 떡을보는데 #대구꿀떡꿀떡 은 어딨지? 하며 찾으러다니니 바로바로 이렇게... ,THE 나은 제니 패밀리♥,https://blog.naver.com/hihihim1,2019-11-04
 평화떡공방-대구 먹거리,https://blog.naver.com/esyoun62?Redirect=Log&logNo=222205139446,있는평화떡공방 을 찾아갑니다 봉덕시장 큰길가에 있네요 먼길왔으니 꿀떡맛 한번보고 가실게요 늣은시간이라 떡이별로없네요 그래도 꿀떡은 살수 있었습니다 언니들 맛보시라고 몇개더 삿네요 안산으로... ,언제나 늘~새롭게~,https://blog.naver.com/esyoun62,2021-01-12
[대구-봉덕동] 평화떡공방 ,https://blog.naver.com/gorma20?Redirect=Log&logNo=222333165552," 평화떡공방매일 09:00-19:00 매주 일요일 휴무, 매달 첫째주 월요일 휴무 대구에서 유명한 꿀떡이... 맛만 보려고 좋아하는 떡 한개씩 구매했다. 꿀떡은 말그대로 설탕을 섞은 듯한 검은 물 안에 찹쌀로 만든 떡이... ",일상다반사,https://blog.naver.com/gorma20,2021-05-02
봉덕시장맛집 [새길돼지국밥] [ 평화떡공방 ]꿀떡♡ 포장후기.... ,https://blog.naver.com/hwas1976?Redirect=Log&logNo=222388715642,먼저 생활의 달인에 나와서 한동안 사기힘들었던평화떡공방'꿀떡' 여기말고도 인근떡집에 꿀떡도... 대구꿀떡 # 평화떡공방#봉덕시장꿀떡 #대구남구맛집 #대구식당 #돼지머릿고기 #대구해장국밥... ,짝은고모 김원두,https://blog.naver.com/hwas1976,2021-06-07
대구여행시 꼭 먹어봐야할 대구꿀떡 맛집 추천!평화떡공방 ,https://blog.naver.com/hhhdyy?Redirect=Log&logNo=222455528302,열심히 검색해서 찾아낸 대구꿀떡 맛집평화떡공방 ! 구공탄막창에서 멀지 않은 곳에 위치해있어서... 먹어보니 약간 시나몬향이 나기도 하고 흑당맛이 나기도 하는데 떡 식감도 아주 쫠깃쫠깃하고 달달한게... ,차곡차곡,https://blog.naver.com/hhhdyy,2021-08-05
대구시 남구 맛집 전통시장 봉덕신시장평화떡공방카페 꿀떡... ,https://blog.daum.net/tourcodi/8129794,"여행평화떡공방 카페 떡 , 한과 대구광역시 남구 봉덕로 119 1 층 ( 봉덕동 956-2 번지 전화 053-473-8575 # 봉덕신시장 #평화떡공방 카페 # 대구꿀떡 # 꿀떡 # 봉덕시장 # 대구시남구여행 # 남구청여행 # 대구시여행... ",강경원의 여행만들기,https://blog.daum.net/tourcodi,2019-10-31
대구 봉덕시장 꿀떡 맛집평화떡공방XD 얼마나 맛있으면... ,https://blog.naver.com/hsjjj2543?Redirect=Log&logNo=222161912069,#봉덕시장꿀떡 #대구꿀떡 #꿀떡 #봉덕시장맛집 #꿀떡맛집 #대구꿀떡맛집 # 평화떡공방# 평화떡공방 꿀떡 #내돈내산 #떡집 #대구떡집 #떡 #대구핫플 #꿀떡파는곳 #대구생활의달인 #떡공방,화장해주는남자 뮤아진♂️,https://blog.naver.com/hsjjj2543,2020-12-03
대구 꿀떡 봉덕시장평화떡공방홍대 연남 제주김만복 전복 김밥,https://blog.naver.com/madurh?Redirect=Log&logNo=222001033574,샀어요 떡 자체가 굉장히 맛은 있는데 꼭 여기서만 느낄 수 있는 맛은 아닙니다 택배로 받고 할 정도로 유난 떨 필요는 없어요 그리고 그 꿀떡 대구 명물 꿀떡 봉덕시장평화떡공방꿀떡 경단처럼 생긴 떡이... ,인스턴트 꿈,https://blog.naver.com/madurh,2020-06-15
김영철의 동네 한바퀴 대구 남구 봉덕동 시장 맛집평화떡공방 ... ,https://blog.naver.com/jmjm3060?Redirect=Log&logNo=222186058399,본래 평화 떡집이었는데 리뉴얼 공사를 하시면서 상호를평화떡공방카페로 변경하셨다 합니다. 아이스팩에 꼼꼼히 포장되어온 봉덕시장 찹쌀꿀떡은 한팩에 15알이 들어 있고요. 맛있게 드시는 방법은... ,도곡동 김여사,https://blog.naver.com/jmjm3060,2020-12-26
 평화떡공방 ,https://blog.naver.com/kfs97?Redirect=Log&logNo=222000196759,잘되어있네요 떡 종류도 다양하고 바로 만들어서 포장해서 인지 떡을 좋아하는 편은 아니지만 골고루... 이었습니다 #봉덕동떡집 #봉덕시장맛집 #대구떡맛집 #남구맛집 #떡맛집 # 평화떡공방 카페 #떡공방... ,번뇌의바다,https://blog.naver.com/kfs97,2020-06-14
"봉덕동 떡 맛집 추천, 달달한 꿀떡이 있는평화떡공방방문 후기!",https://blog.naver.com/kevin_0826?Redirect=Log&logNo=221792783295,"맛집,평화떡공방떡 교환/ 반품 불가능에 대한 안내글이에요!ㅎ 꼭 확인하시고, 신중하게 구매하세용!ㅎ 봉덕시장 떡집, 봉덕동 맛집,평화떡공방꿀떡을 주문했으니까 보관 먹는 방법을 알아야겠죠?ㅎ 구매한... ",케빈의 정보창고,https://blog.naver.com/kevin_0826,2020-02-01
"[대구 맛집] 공평샤브칼국수 / 봉덕시장평화떡공방꿀떡, 앙버떡",https://blog.naver.com/hope930127?Redirect=Log&logNo=222218229736,스윗솔티 라떼도 넘 맛나답니다 ^.^ 봉덕시장평화떡공방꿀떡 맛집 예~~~전에 사러왔을때는 품절이여서... 공평샤브칼국수 #공평샤브샤브 #매스커피 #봉덕시장꿀떡 #봉덕시장 평화떡공방#앙버떡 #꿀떡 #대구꿀떡,직딩님의 블로그,https://blog.naver.com/hope930127,2021-01-24
[대구]봉덕동 꿀떡평화떡공방 ,https://blog.naver.com/scv8853?Redirect=Log&logNo=222313812965,쭈욱 부어서 쉐킷쉐킷 먹었더니 와 핵꿀맛 벌컥벌컥 막 들어간다 우유가 ㅋㅋㅋㅋㅋ 그러다가 우유에도 찍어먹고 이러쿵 저러쿵 다 묵어 버렸다 ㅋㅋㅋㅋㅋ #대구 #대구꿀떡 #봉덕동떡집 #대구 평화떡공방#대구떡집,JIHYEONWORLD,https://blog.naver.com/scv8853,2021-04-18
[3년 전 오늘] 대구명물 꿀떡 봉덕시장평화떡공방 ,https://blog.naver.com/osn1201?Redirect=Log&logNo=222427497118,3년 전 오늘 대구명물 꿀떡 봉덕시장평화떡공방딸이 맛보고 싶다던 대구명물 꿀떡 드디어... 대구 명물이라는 꿀떡 울딸이 요 꿀떡도 먹고 싶다고해 대구 봉덕시장평화떡공방 에서 꿀떡도 사왔습니다. 대구... ,항아리속 묵은지,https://blog.naver.com/osn1201,2021-07-11
[맛이야기] 찹살꿀떡과 앙꼬절편이 맛있는 평화떡공방 대구... ,https://blog.naver.com/pmw6929?Redirect=Log&logNo=222281455660,"~ 2TV생생정보 1098회 찹쌀꿀떡 방영 생활의달인 방영 OPEN 08:00 ~ CLOSE 19:00평화떡공방cafe ***-***-**** 대구 남구 봉덕시장 도로변에 위치한평화떡공방 카페 입니다. SNS, 각종 커뮤니티에서 소문난 찹쌀꿀떡... ",행복도시♡이야기,https://blog.naver.com/pmw6929,2021-03-20
"[대구] 봉덕시장평화떡공방CAFE꿀떡 포장 후기, 리뷰",https://blog.naver.com/l22430?Redirect=Log&logNo=222318621320, 평화떡공방 카페 *일요일휴무 대구 봉덕시장 엣헴 ㅋㅋ 혀미가 아는 동생이 꿀떡 공수해 줌! 물론 나는 빵 떡 순이 아니 그냥 먹순이라 거절하지않고 맛있게 챱챱 다른 블로그들 사진에는 떡이 동글동글... ,여행블로그를 꿈꾸는 우물안 블로그,https://blog.naver.com/l22430,2021-04-22
[대구 봉덕시장 떡집] 꿀떡 ★생활의 달인 ★ 평화떡공방 ,https://blog.naver.com/jmee2001?Redirect=Log&logNo=221693520908,꿀떡평화떡공방주 소 : 대구광역시 남구 봉덕로 117 전 화 : 053-473-8575 영 업 : 09 : 00 ~ 18 : 00 일요일 휴무 안녕하세요~ 여러분! 오늘은 ~ 생활의 달인에 방영 되고 SNS에서 핫한 대구 원조 찹쌀 꿀떡평화떡공방 ... ,도미의 다이어리 : ),https://blog.naver.com/jmee2001,2019-10-30
봉덕동평화떡공방맛있는 꿀떡,https://blog.naver.com/azitkyu?Redirect=Log&logNo=222093993426,봉덕동평화떡공방맛있는 꿀떡 집이 근처라서 자주 가는 시장은 봉덕시장입니다. 여기에는 맛있는 돼지국밥이 있고요 오뎅이랑 튀김류가 너무 맛있답니다. 특히 돼지국밥은 24시간이라 더더욱 매력 있는... ,임감독의 소소대대,https://blog.naver.com/azitkyu,2020-09-19
봉덕시장평화떡공방: 생활의달인 에 나온 대구 꿀떡,https://blog.naver.com/kyung_hwa05?Redirect=Log&logNo=221795288886,단건 땡기는거 아니면 잘 안먹는데 #떡 은 또 다르쥬 요거능 엄마 줄려고 싸들고 가는곤데 너무 탐스럽다 봉덕시장평화떡공방: 생활의달인 에 나온 대구 꿀떡 코치님과 나의 #전리품 들❤ 봉덕시장평화떡공방 ... ,사랑의猫약,https://blog.naver.com/kyung_hwa05,2020-02-03
 평화떡공방모찌사먹어보세요,https://blog.naver.com/esyoun62?Redirect=Log&logNo=222213877495,대구평화떡공방 에서 사온 모찌맛을 잊을수 없어 전화로 재구매했어요 쑥모찌 개당 1천원 견과류모찌 개당 1500원 다른데거는 떡피보다 팥앙코가 더많아 너무 달았는데평화떡공방모찌는 떡피가 더많아... ,언제나 늘~새롭게~,https://blog.naver.com/esyoun62,2021-01-20
대구 꿀떡 봉덕시장평화떡공방쫀득해!,https://blog.naver.com/rpswbar?Redirect=Log&logNo=221241580978,"대구평화떡공방꿀떡을 맛보았습니다+.+ 생활의달인의 뜨자마자 엄청 핫해진 곳으로, 줄서서 기다려서 사와한다는 대구 봉덕시장 찹쌀 꿀떡평화떡공방+.+평화떡공방줄도길고~ 재빠르게 포장만을... ",대구가족사진 프로필사진 레인보우스튜디오,https://blog.naver.com/rpswbar,2018-03-31
대구 떡 맛집 봉덕시장 찹쌀 꿀떡평화떡공방 ,https://blog.naver.com/qorkdgh8?Redirect=Log&logNo=221240284152,대구 떡 맛집 봉덕시장 찹쌀 꿀떡평화떡공방친한 형님께서 삼일전에 티비 보다가 봉덕시장에 찹쌀 꿀떡 맛있다고 나왔다고 10분 이상 기다리며 사오셨답니다.. 어디냐 하면평화떡공방이란 곳입니다.. 위치는... ,지원파파의 일상스토리,https://blog.naver.com/qorkdgh8,2018-03-29
[대구맛집]봉덕시장 대구꿀떡평화떡공방 ,https://blog.naver.com/soobin553?Redirect=Log&logNo=221391254303,"대구평화공방떡보관 및 먹는 방법 1. 꿀떡 : 냉동보관 가능, 다음 날까지 실온보관 가능 2. 앙꼬절편 : 당일 먹는 걸 권장 3. 보관 후 먹을 경우 전자레인지에 데우기 (찹쌀이 들어가 있어서 많이 데우는 것... ",수박이 블로그,https://blog.naver.com/soobin553,2018-11-04
대구꿀떡 인스타로 난리난 봉덕시장평화떡공방_ 제시카,https://blog.naver.com/hmujul?Redirect=Log&logNo=221258349930,엄지척 다른 떡들도 많지만 봉덕시장평화떡공방인기 메뉴는 꿀떡과 앙꼬절편! 꿀떡 말고도 다양한... 다행히 봉지 안에만 샜어용 ㅎㅎ (평화떡공장 전화번호는 봉지를 참고하세요!) 산 지 오래되서 먹었음에도... ,PB_CLOSET [PB의 옷장 _ 피비클로젯],https://blog.naver.com/hmujul,2018-04-21
"생활의달인 찹쌀꿀떡의 달인, 대구평화떡공방대구꿀떡 맛보기",https://blog.naver.com/dndbwodnjs?Redirect=Log&logNo=221361702647,방송됐던평화떡공방 의 꿀떡 맛보기 일보 직전 여기가평화떡공방입니다- 엄청난 인기탓에 꿀떡이 여기저기서 다 판매 되고 있고 방송 한지 좀 지난탓에 구매하기는 수월했답니다 매주 일요일 3째주 월요일... ,지봉공쥬,https://blog.naver.com/dndbwodnjs,2018-09-19
 평화떡공방꿀떡 온라인 팝업스토어 : 더현대닷컴 주문 오픈... ,https://blog.naver.com/miyonse?Redirect=Log&logNo=221273231411,"대구 봉덕시장의 명물평화떡공방팝업스토어가 열려요 온라인 주문을 쉽고 편리하게...평화떡공방꿀떡 한 박스는 25알 씩 4팩으로 구성됩니다. 가격은 회원 가입시 25,200원(무료배송) 인당 하루 2박스까지... ",미욘세의 멀티풀,https://blog.naver.com/miyonse,2018-05-11
대구당일치기여행 :: 생활의달인 대구맛집평화떡공방 의... ,https://blog.naver.com/ehrxmr13?Redirect=Log&logNo=221290410922,대구생활의달인 # 평화떡공방 #꿀떡맛집 #생활의달인꿀떡#대구봉덕시장 #대구꿀떡 입니다 ! 아침 10시쯤 왔는데도 줄을 서있던 대구에서 유명한 떡집 # 평화떡공방#생활의달인 에서 살아움직이는 꿀떡으로... ,"솔직한매력, 빈이의 먹'log",https://blog.naver.com/ehrxmr13,2018-06-03
"대구꿀떡평화떡공방 , 이제서야 먹어본 꿀떡 후기!",https://blog.naver.com/sichanmi?Redirect=Log&logNo=221417431586,"평화떡집, 봉덕시장의 명물 꿀떡 어마어마한 인기몰이를 했던 대구 꿀떡평화떡공방봉덕시장에... 먹겠던데평화떡공방대구 꿀떡은 자꾸자꾸 들어가요. 떡 자체가 달지 않아 좋았어요. 전자레인지에 살짝... ","좋아 너, 밤새도록",https://blog.naver.com/sichanmi,2018-12-12
요즘 핫한 대구 꿀떡 - 왜일까?평화떡공방꿀떡,https://blog.naver.com/moymoy?Redirect=Log&logNo=221316736451,아무도 잘 모르더라눈 ㅋㅋ 평화공방 꿀떡은 택배도 가능하지만 2주 걸린다고 합니다 완전 핫하구나~ 인스타에는 퐁당꿀떡이 난리던데 대구사람들은 모르는듯 #꿀떡 # 평화떡공방 꿀떡 #대구꿀떡 #대구맛집 #대구떡,마더스고양이네 즐거운이야기,https://blog.naver.com/moymoy,2018-07-11
대구 봉덕시장 꿀떡 맛집 /평화떡공방솔직후기,https://blog.naver.com/buzz5555?Redirect=Log&logNo=221351892662,에전에 생활에 달인에 나왔던 평화떡공방여긴 티비 보면서도 꼭 가봐야 했던 곳 중 한곳이에요~ 저흰 토욜에 갔는데오픈하고 얼마 안되서 간지라사람이 생각보다 없어서바로 꿀떡 겟했지요!평화 떡 공방 은매... ,순탱이,https://blog.naver.com/buzz5555,2018-09-03
대구 평화떡집 꿀떡평화떡공방 ,https://blog.naver.com/start30th?Redirect=Log&logNo=221286227776,대구에서 원단시장을 들렸다가 #평화떡집 방문. 생각보다 대구가 커서 놀랐음. 봉덕시장 간판이 보이는... 이제 온라인에서도 판매를 해서 그런가 보다 # 평화떡공방택시 타고 가는데 기사님이 여길 모르시다니... ,알수없는인생,https://blog.naver.com/start30th,2018-05-28
SNS에서 난리난 대구 꿀떡을 만날 수 있는 봉덕시장평화떡공방 ,https://blog.naver.com/sniper98?Redirect=Log&logNo=221476432088,인터넷에 검색해보면 평화떡집이라고 검색이 되는데 실제 간판은평화떡공방 이니 참고. 보통 생활의 달인 나오면 명판을 주시는데 가게 안쪽에 있는지 외부에선 찾지 못했습니다. 그래도 이렇게 생활의 달인... ,대구맛집블로거 맛소클짱 혁이의 맛여행,https://blog.naver.com/sniper98,2019-02-28
봉덕동 맛집 청도국밥평화떡공방 ,https://blog.naver.com/mysong4u?Redirect=Log&logNo=221261336889,옆평화떡공방생활의 달인에 출연했다고 함 TV에 출연하신 사장님은 화면발이 더 좋으셨음 파란 소쿠리 안이 꿀떡 우리는 또 1인1떡 할 거라며 2팩 구입 오빠... 나 다이어트 중이라 떡 안먹는데 잊었구나 도대체... ,My Song,https://blog.naver.com/mysong4u,2018-04-25
대구평화떡공방꿀떡,https://blog.naver.com/minjee0318?Redirect=Log&logNo=221469413730,"우리 만나기 전, 꿀떡을 파는평화떡공방근처 갈 일이 있어서 간 김에 하나 사 왔다며 내게 건네주었다.... 떡 안에 다른 고명은 없었고 겉면에 절여진 꿀과 함께 먹으면 된다. 음... 저 꿀은 먹기 전 나의... ",매일을 꿈꾸다,https://blog.naver.com/minjee0318,2019-02-19
"대구맛집]평화떡공방 ,꿀떡",https://blog.naver.com/sjheart85?Redirect=Log&logNo=221264143008,"요즘 꿀떡으로 핫한평화떡공방 ! 줄이 도로까지 서있어요,,, 땡볕에,,, 시장이다보니 주변 상인분들은 좀 불편해 하시고,,, 어쨌든! 저도 줄을 섰죠. 눈치싸움이 은근히 있었구요. 사람들이 줄줄입니다. 드디어... ",모들리 : modele',https://blog.naver.com/sjheart85,2018-04-29
대구/봉덕시장평화떡공방찹쌀꿀떡,https://blog.naver.com/miji6231?Redirect=Log&logNo=221247780087," 평화떡공방찹쌉꿀떡 sns로 인기점점 올라가던중 생활의달인까지 나오고 완전 핫해진 꿀떡.. 난... 와 매스컴의 힘이란 평화떡꿀방..인스타 여기서 휴무,택배주문 공지 다 확인가능 오전에 떡 찾으러 왔는데... ",어바웃엠제이,https://blog.naver.com/miji6231,2018-04-08
대구평화떡공방꿀떡,https://blog.naver.com/summermarina?Redirect=Log&logNo=221351060356,"우리나라 떡 구운거 처럼 몰랑한데, 찹쌀이쟈놔요... 그럼 얼마나 쥭쥭 늘어나겠어요. 원래는 대구에 봉화시장에평화떡공방 에서 사는게 유명하다고 해서 포스팅되어 있었는데, 네.. 저는 이거 먹으러 대구 갈... ",영화처럼 살고 싶은 여자,https://blog.naver.com/summermarina,2018-09-02
일상 feat.평화떡공방 +뚜레쥬르+거제정통국밥,https://blog.naver.com/nsyncjj?Redirect=Log&logNo=221248010085,대구 평화떡공방떡 대구 안간지 4년인데 ㅋㅋㅋㅋㅋ 프로역마살 미지동생이 대구 놀러갔다 사다드림해준 떡 ^^ 고마웡 ㅋㅋㅋㅋㅋㅋㅋ 손도크다 두팩이나 ㅋㅋㅋㅋ 어휴 비쥬얼이 ... 떡이 비닐뚫고 나오는줄... ,뚱이땡이네,https://blog.naver.com/nsyncjj,2018-04-08
생활의 달인 - ' 평화떡공방 ' 찹쌀꿀떡 맛있다!,https://blog.naver.com/bej5479?Redirect=Log&logNo=221243164595,최근에 떡 생각이 나던 나.. 채널 stop!! 때마침 대구지역에 있는 곳이다! 봉덕시장에 있는 ' 평화떡공방 ' 여기 찹살꿀떡이 맛있어서 다른 지역에서 택배로도 주문한다고 하는데..ㅋ 오케잉.. 가보쟈!! 도로가에... ,젊은 날의 청춘♡,https://blog.naver.com/bej5479,2018-04-02
[대구] 꿀떡꿀떡 넘어가는 ‘대구 꿀떡’ by.평화떡공방 ,https://blog.naver.com/honeyjuny?Redirect=Log&logNo=221265888005,조청에 떡 박아놓고 일주일 내내 먹고 싶어지네요. 달콤함이 주는 일상의 이완제같은 느낌. . #대구떡집 #대구꿀떡 # 평화떡공방#봉덕시장 #대구 #하태하태 #꿀떡 #꿀떡꿀떡넘어가요 #빵요정_대구 @ 평화떡집,여행을 사랑하는 당신의 빵요정,https://blog.naver.com/honeyjuny,2018-05-01
길쭉이호떡 그리고 찹쌀꿀떡/샘핫도그/ 평화떡공방 /서울떡집,https://blog.naver.com/solamali2512?Redirect=Log&logNo=221298313163,그 중 SNS마케팅을 시작한평화떡공방 이 유명해졌다고 한다.(원조는 아니라는거) 센스있는 남친이가 유명한 평화떡집과 서울떡집 두군데서 한팩씩 사다줬다. 평화용기업그레이드 / 15알 / 소스 듬뿍 서울... ,YEONI‘s Daliy Life,https://blog.naver.com/solamali2512,2018-06-14
