title,link,description,bloggername,bloggerlink,postdate
화제의 대구 꿀떡! 대구 봉덕시장평화떡공방꿀떡 구매 후기!,https://blog.naver.com/sj_damoa?Redirect=Log&logNo=221323429463,"대구 봉덕시장평화떡공방꿀떡 구매후기! 검색해보니평화떡공방블로그도 있더라구요! 카톡으로도 주문이 가능한데, 더현대닷컴에서 구매가 가능하다고 해서 저는 더현대닷컴에서 구매를 했습니당! 이렇게... ",상장다모아,https://blog.naver.com/sj_damoa,2018-07-21
대구맛집대구 평화떡공방대구 리안,https://blog.naver.com/whrqkf0221?Redirect=Log&logNo=221244852664,꽉찬 1박 2일 마지막날 유명 하다하여 숙소근처 봉덕시장평화떡공방봉덕시장 이라 써있는 이 곳 바로앞에 있다 떡만 사갈려는데 주차공간이 어디있는지 몰라 길가에 다들잠깐 세우는듯 했다평화떡공방 ... ,3-KIO HAIR,https://blog.naver.com/whrqkf0221,2018-04-04
생생정보통평화떡공방꿀떡주문 후기,https://blog.naver.com/yes0457?Redirect=Log&logNo=221263054328,이거 최고최고 핵꿀맛 하튼 요즘 다시 대구꿀떡 구매폼 올라오던데! 이제는 주문도 많이받는것같던뎅 한번쯤 먹어볼만해요❣️굿 -후기끄읏- #생생정보통 #대구꿀떡 # 평화떡공방#꿀떡 #마싯옹 #꿀떡후기,_hyuni_,https://blog.naver.com/yes0457,2018-04-27
대구 봉덕시장평화떡공방맛있는꿀떡 사먹었어요... ,https://blog.naver.com/ssom3686?Redirect=Log&logNo=221245061697,대구 봉덕시장평화떡공방맛있는꿀떡 사먹었어요 서문시장칼국수 비오는수요일 오후 친구랑 집에서... 출동 진짜 오랜만에 기차를 타봤어요 대구 봉덕시장평화떡공방유명한 맛있는꿀떡 사러!!... ,먹을땐먹고즐기며살자,https://blog.naver.com/ssom3686,2018-04-04
인스타에서 핫한 생활의달인 봉덕시장 대구 꿀떡!평화떡공방 ,https://blog.naver.com/flowerringg?Redirect=Log&logNo=221312243785,굳이 떡 때문에 대구에 갈정도는 아니지만 또! 대구에 갈 일 있으면 대구 꿀떡 먹고싶긴해요 히히 요즘도 종종 생각나더라구요 ∗❛⌄❛∗ 후회없었던 봉덕시장평화떡공방대구 꿀떡! 만족한 후기였습니다... ,we love today,https://blog.naver.com/flowerringg,2018-07-04
생활의 달인에 방송된 찹쌀꿀떡의 달인 대구봉덕시장평화떡공방 ,https://blog.naver.com/seo1535?Redirect=Log&logNo=221266672154,휴무일이에요 # 평화떡공방블로그예요 택배로도 주문 받는대요 그치만....제주는 안된대요 '생활의 달인-은둔식달’에서 대구에 위치한 #찹쌀꿀떡맛집 으로 소개된 곳이에요 다른 종류의 떡도 많았어요 사람이... ,View finder,https://blog.naver.com/seo1535,2018-05-02
대구 생활의달인 꿀떡 맛집 - 봉덕시장 평화떡집( 평화떡공방 ),https://blog.naver.com/zxas32?Redirect=Log&logNo=221242698853,봉덕시장에 위치한평화떡 집 다녀왔어요. 줄이 엄청 길 줄 알았는데 생각보다는 덜 하더라구요? 안쪽에서는 열심히 떡을 만드시는 모습. 제일 유명한 꿀떡말고 다른 종류들의 떡이예요. 앙꼬절편도 있는데... ,NR blog.,https://blog.naver.com/zxas32,2018-04-02
"봉덕시장평화떡공방 , 꿀떡은 꿀떡꿀떡 먹게되서 꿀떡인가요?... ",https://blog.naver.com/loggong24?Redirect=Log&logNo=221521446554,대구떡잘하는집평화떡공방앞 여기도 매스컴으로 이미 이슈가 된 곳. 네이버에 치면 평화떡집으로... 달인간판도 똬악~ #생활의달인떡집 #대구생활의달인 #대구 평화떡공방평화떡공방떡 종류들 떡 종류가... ,밥먹고 놀자,https://blog.naver.com/loggong24,2019-04-24
대구 봉덕시장 명물 꿀떡(feat. 평화떡공방 생활의 달인),https://blog.naver.com/qotkddnr3131?Redirect=Log&logNo=221407642566, 평화떡공방이죠!! 제가 떡을 돈 주고 사 먹는 사람이 아니라 항상 주말에 봉덕시장에 장을 보러 가면 꿀떡을 사기 위한 긴~~~줄들이... 근처 길을 장악할 정도로... 한 번씩 사람들이 너무 많으면 앞에 경찰서에서... ,우크스 Studio,https://blog.naver.com/qotkddnr3131,2018-11-28
봉덕시장 ) 생활의달인 / 평화떡공방 /평화떡집 -대구꿀떡원조... ,https://blog.naver.com/olens0070?Redirect=Log&logNo=221247261238,대구떡집맛집 봉덕시장떡집평화떡공방평화떡집 대구꿀떡 대구꿀떡맛집 대구꿀떡원조 봉덕시장평화떡집 봉덕시장 평화떡공방오렌즈상인점 상인동오렌즈 요고 요고 요놈 요거 맛보러 갑니다 !! 추울발 !!... ,오렌즈상인점ＯＬＥＮＳ:Ｓａｎｇ-Ｉｎ053)259-0071,https://blog.naver.com/olens0070,2018-04-07
대구 봉덕시장 맛집평화떡공방꿀떡 생활의 달인 평화떡집,https://blog.naver.com/pinkywe00?Redirect=Log&logNo=221244962826,대구 봉덕시장평화떡공방꿀떡 영업시간 ★ 오전 9시 - 오후 7시 ★ 매주 일요일 휴무★ ★떡문의... 꿀떡은 옛날부터 있던 떡인데 얼마전 생활의 달인 이후로 핫해진 것 같아요^^ 대구 봉덕시장 평화떡집... ,내모든 일상의 끄적임,https://blog.naver.com/pinkywe00,2018-04-04
스시 / 1929 빈티지샵 / 독립서점 고스트북스 /평화떡공방꿀떡,https://blog.naver.com/arm_ing?Redirect=Log&logNo=221287240961,# 평화떡공방#평화떡집 #대구꿀떡 버스에서 내려서 건너려는데..... 사람들 줄 서있는 것 보고... 흑설탕 + 쫀득하고 따뜻한 떡 예상 가능한 맛인데 떡이 진짜 맛있다...... 떡 베이스가 포인트인듯!! 내가 아는... ,루밍일상 ⋆ ೄ*✲ﾟ*｡✧,https://blog.naver.com/arm_ing,2018-05-30
"대구여행_2 @ 코이요, 봉덕시장평화떡공방 ... ",https://blog.naver.com/soso1040?Redirect=Log&logNo=221286262392,를 만나러 가기로했죠....꺄악 바로 봉덕시장의평화떡공방ㅠㅠㅠㅠㅠㅠㅠㅠㅠㅠ 인스타에서 맨날 이거보면서 얼마나 먹고싶었게요... 저기 보이는 초록색봉지가 모두 이 꿀떡! 저도 여러개 사왔어요.... ,ordinary days.,https://blog.naver.com/soso1040,2018-05-28
호떡씨가 소개하는 대구 봉덕시장 꿀떡 #평화떡공방 ,https://blog.naver.com/sadrainjh27?Redirect=Log&logNo=221333355615,"꿀떡..가장 흔한 떡집 대표 선수입니다.하지만 흔하지 않은, 기존의 꿀떡과는 다른 스타일의맛깔나는 꿀떡이 여기 있습니다.대구평화 떡 공방입니다.go. 도로 변에 있는 시장 떡집입니다.떡 사려고 임시 주차한... ",앙큼한재비,https://blog.naver.com/sadrainjh27,2018-08-06
대구평화떡공방(in봉덕시장) sns에서 핫하다는 찹쌀꿀떡... ,https://blog.naver.com/1004mamhouse?Redirect=Log&logNo=221286391800,"대구에서만 먹을수있다는 찹쌀꿀떡이라길래 포스팅하려고 사진도 찍어뒀어요^^ 대구평화떡공방 ~!^^ sns에서 핫하다는데.,.줄서서 먹는다는데... 저는 처음들어본^^;;ㅋ 여러가지 떡중에 요녀석이 바로 줄서서... ",채이버의 사는 이야기,https://blog.naver.com/1004mamhouse,2018-05-28
대구 먹방여행 ) 대구 꿀떡이 맛있는 대구 평화떡공방 ,https://br8687.tistory.com/130,"* 꿀떡 보관방법 * 다음날까지 실온 보관 가능 또는 냉동보관 말랑하게 드시고 싶으면 떡 상태를 보며... 대구 평화떡공방 휴무 , 대구평화떡집 댓글 0 댓글펼치기 이전 댓글 보기 댓글쓰기 폼 비밀글 입력",재미나게살자,https://br8687.tistory.com/,2018-12-22
대구광역시 봉덕시장 꿀떡평화 떡공방배달 서비스,https://blog.daum.net/tlsgytmd/202,"대구꿀떡 , 배달 , 봉덕시장꿀떡 , 생활의달인 , 택배 ,평화떡공방대구광역시 봉덕시장 꿀떡 평화공방 신속 배달 서비스 해 드립니다 전국 택배 가능 콜센터 070 8268 4310 대구 봉덕시장 꿀떡 꿀떡 (1팩)... ",미스터퀵 해주세요 010 3981 1055,https://blog.daum.net/tlsgytmd,2018-04-08
대구 맛집 /봉덕시장 찹쌀 꿀떡 /평화 떡공방/ 원조 꿀떡... ,https://blog.naver.com/smjy74?Redirect=Log&logNo=221250571093,한번쯤 먹어볼만한 것 같네요~~^^ #찹쌀꿀떡 #대구찹쌀꿀떡 # 평화떡공방#대구떡집 #대구맛집 #꿀떡 #생활의달인 #생활의달인꿀떡 #봉덕시장맛집 #봉덕시장떡집 #대구꿀떡 #대구평화떡집 #대구 평화떡공방 ... ,앵그리 망고와 떠나는 맛있는 먹방 여행 & FOOD,https://blog.naver.com/smjy74,2018-04-11
#대구예물투어# 평화떡공방 #평화떡집#꿀떡#대구납작만두,https://blog.naver.com/unijjong2?Redirect=Log&logNo=221388323071,남친이 꿀떡은 꼭 먹어야겠다기에 ㅋㅋㅋ 제 남친은 떡돌이거등여 오늘하루 예물을 봤을뿐인데 ㅠㅠ 문닫은곳도 많더라구요 ㅠ # 평화떡공방#찹살꿀떡 우리가 사고 2개밖에 안남음 뒤에 두분오셨었는데 우리... ,언젠가는 그리워질 내 하루하루,https://blog.naver.com/unijjong2,2018-10-30
대구 떡집평화떡공방 ,https://blog.naver.com/silverwork?Redirect=Log&logNo=221300382006,"요새 대구에서 핫한 꿀떡 봉덕시장에 위치한평화떡공방평화떡공방치면 평화떡집이라고 나오긴한다,, 이집이 역시 유명한지 포장해가는 분들이 많다 나도 인스타 같은데서만 봣는데 서울꿀떡과 다르게 꿀이... ",HS님의 블로그,https://blog.naver.com/silverwork,2018-06-16
대구/봉덕시장평화떡공방꿀떡,https://blog.naver.com/profjina?Redirect=Log&logNo=221305506357,오늘 드디어 너무 먹고싶었던 #봉덕시장 # 평화떡공방#꿀떡 을 먹었당 ㅎㅎ평화떡공방중학생 때부터... 내가 어렸을 때 좋아하던 꿀떡 소스보다 좀 더 묽고 떡 크기가 더 컸당 어렸을 때 먹었던 건 떡 크기가... ,예상을 깨는 일,https://blog.naver.com/profjina,2018-06-24
[대구 생활의 달인 꿀떡] 대구 봉덕시장평화떡공방'평화떡집... ,https://blog.naver.com/daraksil_hyejin?Redirect=Log&logNo=221302901317,봉덕시장의평화떡공방 이 가까이에 있어서 봉덕시장을 들려 꿀떡을 사서 가기로 했어요 모든 이렇게... 팔아서 사먹었는데 내가 먹어본 앙꼬절편중 가장 맛이 없어서평화떡공방 의 앙꼬절편 먹어보고시프다,포근한 나의 다락실,https://blog.naver.com/daraksil_hyejin,2018-06-20
대구 평화떡공방 꿀떡/대구꿀떡택배배달,https://blog.naver.com/venus0323?Redirect=Log&logNo=221298235444,대구꿀떡 / 대구 평화떡공방봉덕시장꿀떡 / 대구꿀떡배달평화떡공방 꿀떡 이름 그대로 완전 꿀~~떡!!! 달달~~하니 당보충 짱~!!! 대구 전지역 꿀떡배달 심부름 가능 전국 당일탁송 가능 대구평화떡공방 ... ,☆대구MASTER심부름☆,https://blog.naver.com/venus0323,2018-06-13
생방송 오늘저녁 대구 찹쌀 꿀떡평화떡공방봉덕시장 떡집... ,https://dodo1004love.tistory.com/9516,바로평화떡공방이라는 곳으로 이곳은 이미 전국으로 소문이 자자해서 많은 사람들이 직접... ■평화떡공방대구시 남구 봉덕로 1119 번지 053-473-8575평화떡공방은 대구 남구에 있는 봉덕시장에 있습니다... ,영숙이네집,https://dodo1004love.tistory.com/,2019-10-23
혼수바구니/봉덕동/ 평화떡공방 ,https://blog.naver.com/gpals8575?Redirect=Log&logNo=220648095516,안녕하세요평화떡공방flower cake 입니다 :) 혼수 바구니 사진들이에요 ㅋㅋ 사진에 있는 바구니는 한말 바구니인데 떡들은 내용은 같고 더 작은 바구니들로도 주문이 가능해요~ ㅋㅋ 여자분 혼수바구니여서... ,평화떡공방,https://blog.naver.com/gpals8575,2016-03-07
[대구]평화떡공방/ 서문야시장,https://blog.naver.com/hsk1709?Redirect=Log&logNo=221491607506,리스트를 만들어 왔는데 1박2일동안 먹으려니 너무 힘들었다평화떡공방 에 들러 꿀떡을 get 해서 김광석 길 돌고 저녁에는 야시장에서 또 먹방을 하기로 했다 서문 야시장은 서울에 한강에서 도깨비 시장같은... ,113Project,https://blog.naver.com/hsk1709,2019-03-18
대구평화떡공방 ,https://blog.naver.com/future_log?Redirect=Log&logNo=221300862217,"윤기가 쩌러유 쫀득하고 달고 jmt 그래도 나는 앙꼬절편이 더 맛나 꿀떡 한팩 3,000원 앙꼬 한팩 2,500원 #대구 평화떡공방 #대구꿀떡#대구앙꼬절편 # 평화떡공방 ",Inner peace,https://blog.naver.com/future_log,2018-06-17
대구평화떡공방꿀떡배달탁송~,https://blog.naver.com/venus0323?Redirect=Log&logNo=221275602684,이름 그대로 완전 꿀~~떡!!! 달달~~하니 당보충 짱~!!! 대구 전지역 꿀떡배달 심부름 가능 전국 당일탁송 가능 대구평화떡공방휴무(매주 일요일) 제외 항상 꿀떡배달 심부름 됩니다. 플러스친구(마스터심부름),☆대구MASTER심부름☆,https://blog.naver.com/venus0323,2018-05-14
대구 봉덕동 떡집평화 떡 공방 ,https://blog.naver.com/kmj931121?Redirect=Log&logNo=221835510165,사항은 평화 떡 카페 인스타그램 참조하시면 좋을 거 같아요 커피 메뉴에요 지금 한창 대구는 코로나... 가리는 떡 없이 다 두루두루 좋아하는데평화 떡 공방 의 영양떡은 흑미찹쌀이 베이스라서 그런지 더... ,민정씨네 블로그,https://blog.naver.com/kmj931121,2020-03-03
대구 떡 맛집평화 떡 공방 .추억의 꿀떡,https://blog.naver.com/skeleton486?Redirect=Log&logNo=221282609614,그냥 그렇네요.. 줄서서 산다고들 하는데.. 그정도로 먹을 정도는 아닙니다ㅋ 재구매는..한동안은 예정에 없을듯.. 솔직한 떡 후기.. 포스팅 끄읏~~ #대구맛집 #꿀떡 # 평화떡공방 ,홍빵의 Food and travel Camping[홍 이 등 심],https://blog.naver.com/skeleton486,2018-05-23
[대구 별미] sns에서 난리였던 대구평화 떡 공방꿀떡을... ,https://blog.naver.com/dalfhouse7?Redirect=Log&logNo=221301941132,먹어봤습니다-_-)ㅋㅋㅋ #대구 # 평화떡공방#sns에서핫했던 #대구꿀떡 #이제야먹어본 #대구사람 근데 사실... 떡은 그냥 찹쌀떡 이던데 떡 자체에 약간 짭쪼롬하게 간이되어 있었구요. 저 검은 시럽같은건 흑설탕이... ,신짱의 매일매일 ♥,https://blog.naver.com/dalfhouse7,2018-06-19
대구꿀떡@ 평화떡공방대구꿀떡 핫할만 해,https://blog.naver.com/poobiboy?Redirect=Log&logNo=221258241650,남편이 요기에서 사왔대요 나름 줄서서 사왓대요ㅋㅋ평화 떡공방봉지ㅋㅋ 제가 다이어트 하는 관계로?? 조금만 사다달라 했는데 대구꿀떡 2개랑 앙꼬절편을 사왔어요 보기만 해도 궁금해지는 맛!!!! 뭔가 떡이... ,유니유니 월드♡,https://blog.naver.com/poobiboy,2018-04-21
대구평화떡공방 서문시장도쿄다이닝류커피로스터즈,https://blog.naver.com/asm7139?Redirect=Log&logNo=221229078201,꿀떡하면평화떡공방 ! 떡집은 아침일찍부터 열기때문에 제일먼저 갔어요 ㅎㅎ 요 아이가 바로... 빠빠잉 주소 : 대구 남구 봉덕로 117평화떡공방(***-***-****) 대구 중구 큰장로26길 45 서문시장 대구 중구... ,Sol Diary,https://blog.naver.com/asm7139,2018-03-14
대구 유명 떡 # 평화떡공방 ,https://blog.naver.com/jwyj7?Redirect=Log&logNo=221431278380,꿀떡ㅋㅋ 언니가 시댁에 갔다가 사왔당ㅋㅋ 1팩에 3천원ㅋㅋ 꿀아니고 설탕이라고 한다 완전 쫄깃한 찹쌀에 달달한 설탕국물? 맛있다ㅋㅋㄱ드디어 먹어보는군 #대구떡집 # 평화떡공방#꿀떡 #송모탄 #송모탄월드,송모탄 월드,https://blog.naver.com/jwyj7,2018-12-31
"[대구] 대구당일치기:: 평화떡집,평화떡공방꿀떡",https://blog.naver.com/yunk9219?Redirect=Log&logNo=221492935791,룰루 떡집떡집평화 떡공방 이 유명? 하다고 해서 가봄 ㅋㅋㅋㅋ 근데 뭔가 동선은 좀 쓰레기 된다는 점... 우리 기준에선 진짜 ㅋㅋㅋㅋㅋ 매주 일요일과 3주 월요일은 휴무라고 합니다 이거 안체크하고 갔으면... ,별의별세상,https://blog.naver.com/yunk9219,2019-04-17
카네이션 케이크/봉덕동/ 평화떡공방 ,https://blog.naver.com/gpals8575?Redirect=Log&logNo=220639928189,안녕하세요평화떡공방flower cake 입니다 :) 핸드폰으로 포스팅쓰는게 정말 간편하고 좋은거 같아요! 자주자주 블로그 포스팅 할께용 오늘은 지인 생신만 되시면 케이크를 주문해 주시는 손님 케이크에용... ,평화떡공방,https://blog.naver.com/gpals8575,2016-02-27
