title,link,description,bloggername,bloggerlink,postdate
켈리의 일상 | 대구 꿀떡평화떡공방/ 동성로 맛집 팬아시아... ,https://blog.naver.com/kminiiii?Redirect=Log&logNo=221238752893,해봅니댜 요새 난리가 난평화떡공방... 한 팩에 3천원입니댜 아 정말 가면 깔아놓고 팔아서 바로 몇 개씩 사왔는데 어제 꿀떡이 달인에 나왔다고 오늘은 줄 완전 길게 서있었음 ... 여러분 또 그정도는 아니고요... ,Kelly Lee,https://blog.naver.com/kminiiii,2018-03-27
"서문 야시장, 국일따로국밥, 근대골목단팥빵,평화떡공방꿀떡",https://blog.naver.com/hazzi0908?Redirect=Log&logNo=221299330263,"단팥빵/평화 떡 공방꿀떡 앞산 공원 전망대 식사를 하고 난 후, 9시 반 까지라는 전망대로 빠르게...평화 떡 공방최근 대구에서 핫했던 꿀떡. 시장 도로 쪽에 있어서 잠깐 주차하고 바로 구매해서 출발. 집에... ",그녀프로젝트,https://blog.naver.com/hazzi0908,2018-06-16
"[대구꿀떡 평화떡공방 ] 대구... 대구평화떡공방 , 대구... ",https://blog.naver.com/altmqkr0?Redirect=Log&logNo=221275792725,"'떡'이라고 크게 써져있는 간판보고 찾아갔더니평화떡공방이 짜라란, 나왔습니당. 생활의달인에 나왔다는 대구 꿀떡집. 일단 포스팅 보고 찾아가니까 떡도 그냥만드는게 아니고, 꿀도 그냥 만드는게... ",박각의 찾을수 없는 블로그 :D,https://blog.naver.com/altmqkr0,2018-05-14
대구명물 꿀떡 봉덕시장평화떡공방 ,https://blog.naver.com/osn1201?Redirect=Log&logNo=221316700519,대구 명물이라는 꿀떡 울딸이 요 꿀떡도 먹고 싶다고해 대구 봉덕시장평화떡공방 에서 꿀떡도 사왔습니다. 대구 꿀떡 파는곳평화떡공방 은 생활의달인에 출연한 곳인지 티비에 출연했다는 명패가 붙어져... ,항아리속 묵은지,https://blog.naver.com/osn1201,2018-07-11
 평화떡공방 의 꿀떡 보다 팥인절미,https://blog.naver.com/momozzang31?Redirect=Log&logNo=221401331946,"늘 줄이 서있었다는 유명세를 치르런 봉덕시장평화떡공방여름에 방문했었는데, 줄 안서요. 1팩에 3천원. 사실 이집의 제일 맛있는 떡은 팥이 들어간 팥인절미. 바로 이떡~ 떡 사온 사진은 없어요 ㅎㅎㅎ... ",모모짱블로그といっしょに おいしい 一日を!,https://blog.naver.com/momozzang31,2018-11-19
"대구 봉덕시장 꿀떡,평화떡공방 ",https://blog.naver.com/k940425?Redirect=Log&logNo=221272318726,"그냥떡가격 생각하시면 될꺼같아요!! 비싼건가..? 전 뭐 떡순이라 맛있으면 다 좋아욤!! ㅎ-ㅎ 떡에 첨에는 꿀인지 알았는데 흑설탕이라고 하더라구요!! ㅎ-ㅎ 꿀떡 쫄깃쫄깃하구 맛나긴 한데,,, 왜이렇게 단건지... ",또히네 먹방일상,https://blog.naver.com/k940425,2018-05-10
생활의 달인 찹쌀 꿀떡 맛집 대구 봉덕시장평화떡공방 ,https://blog.naver.com/changuk1225?Redirect=Log&logNo=221249651434, 평화떡공방지난 3월 말 생활의 달인 '찹쌀 꿀떡의 달인' 으로 소개되어 요즘 줄 서서 사 먹어야 한다는... 위치한평화떡공방요즘 넘나 핫한 떡집이라 오래 줄 서서 사야 한다길래 걱정했는데 평일 오후라서... ,공인중개사 최창욱,https://blog.naver.com/changuk1225,2018-04-10
봉덕시장에 생활의 달인 찹쌀꿀떡 달인인 ** 평화떡공방다녀왔지예,https://blog.naver.com/chorongeda?Redirect=Log&logNo=221458420376,대구 평화떡방 #대구여행 #대구떡집 #대구꿀떡 #대구생활의달인떡집 #생활의달인꿀떡 #대구평화떡방... 도착해서는 기사님한테 잠시만 기다려 달라고 하고 내려서 바로 떡을 구매했어유평화떡공방 은... ,박초롱피었다,https://blog.naver.com/chorongeda,2019-02-04
[대구 꿀떡 / 봉덕시장 꿀떡 :평화떡공방] 페이스북에서 보고... ,https://blog.naver.com/ssddk01101?Redirect=Log&logNo=221230408597,나는평화떡공방 이 김광석거리쪽에 있는줄알았는데 아님 대구 봉덕시장 꿀떡임 봉덕시장에 먹을거 겁나많네 ㅠㅠ 어렵지 않게 대구 봉덕시장 꿀떡 맛집인평화떡공방 을 찾음ㅋㄲ 근데 나말고 다른 사람도 사진... ,청년 사업가 OLIFE,https://blog.naver.com/ssddk01101,2018-03-16
대구 봉덕시장 맛집 청도돼지국밥 |평화떡공방대구꿀떡,https://blog.naver.com/jyeong3?Redirect=Log&logNo=221377024068,있는평화떡공방꿀떡이 원조라길래 시장 온 김에 들러서 샀다. #찹쌀꿀떡 #앙꼬절편 평화떡집에서 제일 잘나가는 떡 두 개 구입~! 꿀떡은 야구장 가서 먹으려고 했는데 까먹고있다가ㅎㅎㅎㅎ 뒷북으로... ,소매블로그,https://blog.naver.com/jyeong3,2018-10-14
대구 꿀떡 맛집 봉덕시장평화떡공방 카페,https://blog.naver.com/cityfood1?Redirect=Log&logNo=222415060474,저는 어렸을 때부터 밥보다 떡을 더 좋아한 떡순이에요 ㅎㅎㅎ 대구 봉덕시장 근처에 가신다면 꼭 가봐야 할 떡 맛집평화떡공방 카페는 생활의 달인에도 출연한 곳이에요! 오전 8시부터 7시까지 하고 둘째주... ,핵 오지는 맛집탐방기,https://blog.naver.com/cityfood1,2021-06-30
대구꿀떡 택배 가능평화떡공방방문 후기,https://blog.naver.com/nimrim02?Redirect=Log&logNo=221284812213, 평화떡공방이웃집 서리태콩물 (소) 3.5 함께 업어왔습니닷! 카드 결제 다음주 부터 된다네요 참고! 시식 흑설탕 소스 심하게 끈적스럽지 않고 소스 적셔진 떡이 적당히 윤기 흐르는 느낌 생각보다 개별 떡... ,❤️블로그하는 별조원장❤️,https://blog.naver.com/nimrim02,2018-05-26
급 대구 당일치기 #SECOND PROJECT # 평화떡공방 ,https://blog.naver.com/kanggongsil?Redirect=Log&logNo=221405799462, 평화떡공방떡 사들고 시장 한 바퀴 돌았으나 건진 건 없었음. 그렇게 어두운 밤 상경해 집에 와서는 경건한 마음으로 떡을 깠는데... 왜 한 팩만 사왔으까. 후회를 불러재끼는 맛! . . . 이것으로 잠정적인... ,공실공간,https://blog.naver.com/kanggongsil,2018-11-25
대구꿀떡 ♡평화떡공방 ,https://blog.naver.com/hongnal?Redirect=Log&logNo=221410449641,"안녕'-' 오늘 포스팅은 대구꿀떡 '평화떡공방' [ 평화떡공방주소, 전화번호, 영업시간] 대구 남구 봉덕로 117 053-473-8575 09:00~18:00 매주 일요일/ 셋째주 월요일 휴무 대구를 갔으면 꼭 먹어야할 음식... ",홍시앤오니 마켓,https://blog.naver.com/hongnal,2018-12-05
"대구 봉덕시장 꿀떡, 요즘 핫하죠!평화떡공방 ",https://blog.naver.com/pialove1?Redirect=Log&logNo=221250318869,그냥 떡 같달까요~ 하핫 (그럴땐 전자렌지 1분!) 개인적으로는 쭈욱- 늘려서 몰랑몰랑하게 해서 먹는게 더 맛있고 재밌었던거같아요 ^^ 한번쯤 먹어볼만한 봉덕시장 꿀떡 :) 대구평화떡공방택배도 가능하니... ,망고의 언제나 씐나 ♬,https://blog.naver.com/pialove1,2018-04-11
핫한 대구꿀떡을 먹어본 솔직후기-대구평화떡공방꿀떡,https://blog.naver.com/mmsus2392?Redirect=Log&logNo=221317031754,대구평화떡공방꿀떡을 먹어본후기!!!ㅋㅋㅋㅋㅋㅋ 대구사는친구가 대구에서 택배시켜서 한팩... 완전 인터넷에서보던 비주얼은 그대로*.* 대구 평화떡집 꿀떡은 이미 냉동되서오는데 택배오면서 좀... ,이지썬네 블로그♡,https://blog.naver.com/mmsus2392,2018-07-11
대구 꿀떡 택배 요즘 핫한평화떡공방꿀떡!,https://blog.naver.com/udasol?Redirect=Log&logNo=221261017905,"봉덕시장평화떡공방 , 일명 대구 꿀떡으로 요즘 유튜버 분들도 많이 도전하시던!ㅋㅋ 저는 밴쯔님 영상... 근데 찾아보니 봉덕시장평화떡공방 에서 하는 곳은 아닌듯하고...? 제조원이 인천이더라구요...!... ",꿀콩이와 맛따라 멋따라,https://blog.naver.com/udasol,2018-04-25
"[ 평화떡공방 ] 대구 꿀떡, 생활의 달인 떡집, 인스타떡맛집",https://blog.naver.com/kkongs_?Redirect=Log&logNo=221270217833,[ 평화떡공방 ] #대구떡집 #대구꿀떡 #인스타그램떡집평화떡공방인스타그램 생활의 달인에 소개된... 보니 떡 주문 방법도 있고 판매하는 떡도 다양하다 그리고 사장님 따님인지 여전히 예쁘다는 글이... ,-,https://blog.naver.com/kkongs_,2018-05-07
[대구꿀떡맛집] 인스타 대란 없어서 못먹는 꿀떡 ‘ 평화떡공방 ’,https://blog.naver.com/ysg9224?Redirect=Log&logNo=221239916348,"대구꿀떡맛집평화떡공방인스타에 맨날 사먹어야지, 사먹어야지 호시탐탐 노리다가 주문기간을 매번 놓쳤던 꿀떡 이번엔 드디어 주문완료했다! 기존에 알던 꿀떡과 달리 떡 바깥에 설탕시럽이 묻혀진 형태의... ",슬뽀로그,https://blog.naver.com/ysg9224,2018-03-29
[대구 봉덕동 봉덕시장]평화떡공방꿀떡,https://blog.naver.com/zerom00?Redirect=Log&logNo=221266799783,대구 #봉덕시장 # 평화떡공방에서 #꿀떡 을 사왔습니다. 원래도 SNS에서 핫했는데 #생활의달인 방송을 타고 나서 떡집에 불났다고 표현할 정도로 손님이 대박 많이 늘어났다고 합니다. 인터넷 검색을 해보니 가게... ,zero의 살아가는 이야기...,https://blog.naver.com/zerom00,2018-05-03
[대구꿀떡]평화 떡공방 ,https://blog.naver.com/yumyum378?Redirect=Log&logNo=221355203831,먹던 떡맛이라고 그냥 꿀떡을 한번도 안먹어 봤다면 호기심에 먹어보는 것은 추천 이상입니다 윰이별점 ★★★☆☆ 노말노말해 # 평화떡공방#평화떡집 #대구꿀떡 #대구맛집 #봉덕시장 #생활의달인 #솔직후기 #v30,윰이의 하루,https://blog.naver.com/yumyum378,2018-09-09
대구 봉덕시장평화떡공방방문 구매 후기,https://blog.naver.com/open10807?Redirect=Log&logNo=221287372558,"대구 봉덕시장평화떡공방방문 구매 후기 인스타와 블로그에서 난리가 났던 동글 네모난 꿀떡!... 금새 먹어치운ㅋㅋ 말과 행동이 달랐던 것일까...! 이상, 대구 봉덕시장평화떡공방방문 후기를 마치겠습니다!",요섹남과 사는 김쟤,https://blog.naver.com/open10807,2018-05-30
[대구/남구] 생활의 달인 대구 꿀떡 맛집 봉덕시장평화떡공방 ... ,https://blog.naver.com/nova_j?Redirect=Log&logNo=221906959529,"아이들이 좋아하는 미니 송편도 있고, 떡 종류가 많은데, 깔끔하고 정갈한 느낌? 여기평화떡공방인스타그램 보면 그날 그날 나오는 떡이나 새로운 떡을 바로 소개해줘서 좋아요. 저는 항상 팔로우 ㅋ 저는... ",❤️우리가 만드는 세상❤️,https://blog.naver.com/nova_j,2020-04-14
"[대구 떡집] 봉덕신시장 '평화떡공방' 꿀떡, 앙꼬절편... ",https://blog.naver.com/coreaasalm?Redirect=Log&logNo=221273604217,마눌님과 다녀온 봉덕신시장!그리고 꼭먹어야한다는평화떡공방 에 꿀떡!엄청난줄...기다려봅니다 ㅎㅎ가격은 이래요 !그리고 가게앞 불법주차들이많은데...경ㅊㄹ아저씨들께서 계속 돌면서 단속하십니다..... ,..글라가 사는 세상..,https://blog.naver.com/coreaasalm,2018-05-11
[대구]평화떡공방꿀떡,https://blog.naver.com/jin_9110?Redirect=Log&logNo=221570544214,버스 두정거장 타고 내려서 신호 기다리는중에 보이는평화떡공방 ! 검색충 케킹이가 검색해본 결과 평화떡집은 다른 것 보다도 꿀떡이랑 앙꼬절편이 제일 많이 팔린다고 하더라구요 ! 다른거 보지도... ,예 쁘 게,https://blog.naver.com/jin_9110,2019-06-25
뭐든 오리지날이 체고시다b 대구 꿀떡 원조평화떡공방vs... ,https://blog.naver.com/bananas02?Redirect=Log&logNo=221382278409,봉덕시장평화떡 집 위치? 주소 : 대구 봉덕1동 954-12 전화번호 : 053-473-8575 영업시간 : 09:00-18:00 (매주 일요일 / 셋째주 월요일 휴무) SBS달인 수요미식회 나왔다구 함 렬루떡종류 엄청 많아버림 앙꼬절편... ,헤이바나나,https://blog.naver.com/bananas02,2018-10-22
"[대구/봉덕동] 생활의 달인에 나온 대구꿀떡의 원조,평화떡공방 ",https://blog.naver.com/swtyy?Redirect=Log&logNo=221349951780,"봉덕동 # 평화떡공방#평화떡집 시간 오전 9시 - 오후7시 전화 ***-***-**** 주소 대구광역시 남구 봉덕로 117... 그래도 떡 포스팅은 포기할 수가 없네요 사실 부산으로 가는 일정이었는데, 굳이 들렸다가 가겠다며... ",쩡아나의 개인공간,https://blog.naver.com/swtyy,2018-09-01
대구 봉덕시장평화떡공방꿀떡 1개 3천원,https://blog.naver.com/cupl___y?Redirect=Log&logNo=221597761203,"대구 평화시장 꿀떡, 생각했던 것 보다 엄청나게 찰진 맛? 착 감기는 맛?이 부족했던 것으로 느껴지지만 한번쯤은 먹어봐도 괜찮을 것 같아요. 대구 꿀떡 중에서도평화떡공방 이 TV에서도 방영되고 인기라고... ",갬성 찾아 삼만리,https://blog.naver.com/cupl___y,2019-07-28
대구 꿀떡 - 대봉동평화떡공방꿀떡앙꼬절편,https://blog.naver.com/gn02162?Redirect=Log&logNo=221238685498,얼려서 서울로 가지고 왔네요ㅎㅎ * 본 포스팅은 음식을 구입하여 먹고!! 작성한 매우 주관적인 후기입니당 ;) #생활의달인꿀떡 #대구꿀떡 #생활의달인대구 #인스타꿀떡 #대구봉덕시장 #평화떡집 # 평화떡공방 ,일상을 남기다,https://blog.naver.com/gn02162,2018-03-27
꿀떡꿀떡!!대구꿀떡!!평화 떡 공방 !!,https://blog.naver.com/0165911038?Redirect=Log&logNo=221265775508,"대.구.꿀.떡. 알아보고 주문주문 !!ㅎ 아침10시부터 , 30개 한정으로 열어주심..... 그래서.... 아침에... 냉동 되어 와있어요 ㅎㅎ평화떡공방꿀떡 !! 제조일로부터 30일 입니다 ㅎㅎ 바로 냉동실로 고고싱 ! 전 4팩... ",맴매미 하고재비 일상,https://blog.naver.com/0165911038,2018-05-01
" 평화떡공방대구 꿀떡, 핫 하다면서 ? 근데 난..",https://blog.naver.com/jonggoori?Redirect=Log&logNo=221258048440,인스타구램에서 뭐 개핫핫한 떡이 있다고 해서 혼자 그냥 급으로 찾아 떠난 그 곳평화떡공방꿀떡으로 유명한 곳이라고 해서 가보니 오 오만가지 떡 들이 있다 난 사실 찹쌀모찌가 제일 좋은데 .. 모찌모찌... ,종정뱅이의 블로그,https://blog.naver.com/jonggoori,2018-04-21
대구 꿀떡 [ 평화 떡 공방 ],https://blog.naver.com/a6pril?Redirect=Log&logNo=221327855042,대구 꿀떡 [ 평화 떡 공방 ] 대구 출장 다녀온 신랑이 사들고온 대구굴떡 우리남편에게도 점점 센스가 생기나봐용 ㅎㅎㅎ 떡도 안좋아해서 안사오던남편인데 ㅋㅋ 왠일로 SNS에서 핫한 꿀떡을 ㅋㅋ 밤늦게 와서... ,퐝고는지금이좋아,https://blog.naver.com/a6pril,2018-08-18
대구맛집_ 평화떡공방꿀떡,https://blog.naver.com/moodsoul?Redirect=Log&logNo=221347561302,그리고 조카가 먹고 싶다고 하여 구매한 찹쌀떡도 너무 맛있었음 한번의 실패에도 포기 하지 않고 얻어 낸 떡 직접 먹어보니 SNS에서 왜 그렇게 대구 꿀떡이 유명했는지 알 것 같음 2018.08.25. 대구 꿀떡평화떡공방 ,상하뤼의 가뤼,https://blog.naver.com/moodsoul,2018-08-28
[대구 꿀떡] 봉덕시장평화떡공방 / 페이스북에서 핫한 꿀떡... ,https://blog.naver.com/mk31359?Redirect=Log&logNo=221225959645,떡 늘어나는거 보이시나욧?!??! 쫀득쫀득한 떡에 꿀물 찍어 먹으면 을~매나 맛있게요? 순식간에 한팩을... 473-8575 #대구떡집 #대구꿀떡 #꿀떡 #꿀떡파는곳 #꿀떡판매 #봉덕시장 #봉덕시장꿀떡 #평화떡집 # 평화떡공방 ,믿고 먹는 가밍이의 블로그,https://blog.naver.com/mk31359,2018-03-10
대구 봉덕시장 꿀떡/ 평화떡공방 / 꿀떡 드뎌 먹어보다,https://blog.naver.com/huhu1028?Redirect=Log&logNo=221261498410,#대구떡집맛집#대구꿀떡 #생활의달인꿀떡#꿀떡 #봉덕시장꿀떡#봉덕시장 # 평화떡공방#생활의달인 에... 간판에 떡허니 걸려있는 #생활의달인 조금 이른 시간(점심전) 이라 그런지 떡 종류도 많은 듯 앗!!! 그리고... ,"☆ 여기, 뜨거웠던 나의 순간들",https://blog.naver.com/huhu1028,2018-04-25
[대구 봉덕동] 대구 꿀떡으로 유명한평화떡공방다녀왔어요!!... ,https://blog.naver.com/chy209?Redirect=Log&logNo=221326768302,대구평화떡공방이 떡 저 떡 많이 있음. 하지만 우리는 꿀떡2팩 구매! 대구평화떡공방짜자잔 아저씨가 쏠리지 않게 조심히 들고 다니라 했는데 들고 다니다 보니 쏠림. 대구평화떡공방한 팩은 동생이랑... ,아주 늠름하구나!,https://blog.naver.com/chy209,2018-07-26
SNS에서 난리 난 대구 봉덕시장평화떡공방꿀떡 리뷰,https://blog.naver.com/g0_0e?Redirect=Log&logNo=221311566744,"봉덕시장평화떡공방꿀떡이 그렇게 맛있다고 하더라고요,,, 그래서평화떡공방꿀떡으로 뇸뇸평화떡공방꿀떡 1팩 3000원 크으으,, 역시 맛있는 건 두 개씩,, 많을수록 더 좋고ㅋㅋㅋㅋㅋㅋㅋㅋㅋ... ",가니로그,https://blog.naver.com/g0_0e,2018-07-06
봉덕시장평화떡공방 (평화떡집) 꿀떡,https://blog.naver.com/youbet78?Redirect=Log&logNo=221309552797,것 애들도 좋아할 듯 잠시 추억에 잠겨 본다 인터넷으로도 주문 가능하니 궁금한 사람은 택배 이용해도 좋을듯 하다^^ #꿀떡#평화떡집# 평화떡공방 #봉덕시장떡집#봉덕시장맛집#대구꿀떡#생활의달인#생활의달인꿀떡,Almost Unreal,https://blog.naver.com/youbet78,2018-06-29
대구 꿀떡! 봉덕시장평화떡공방요즘 제일 핫한 맛집!,https://blog.naver.com/o506258?Redirect=Log&logNo=221303742927,"ㅎㅎ 바로 앞에 그토록 찾던 ' 평화 떡 공방 '이 자리 잡고 있더군요^^!! sns에서 보던 비주얼과 똑~같은... ㅎㅎ 저는 떡을 워낙 좋아하는지라, 정신을 놓고 떡 구경을 하다가 무엇을 살까~ 오랜 고민을 했답니다..... ",아우토위즈 울산센터,https://blog.naver.com/o506258,2018-06-21
대구꿀떡 ' 평화떡공방 ',https://blog.naver.com/danbi3377?Redirect=Log&logNo=221509327923,카카오맵으로평화떡공방찾기ㅎ 찾았당~~~~ 떡이 식을까봐 아이스박스에 담아놓고 파시더라규요... 가는건 아니고^^ #대구 평화떡공방#대구원조꿀떡 #대구남구 #대구봉덕시장 #신혼 #대구새댁 #다니의소소행,다니의 소소행's,https://blog.naver.com/danbi3377,2019-04-09
대구 봉덕시장 꿀떡 떡집평화떡공방 ,https://blog.naver.com/meysb0122?Redirect=Log&logNo=221326073473,"안녕하세요~ 오늘은 대구 봉덕시장에 위치한 떡집평화떡공방을 소개합니다 ㅎㅎㅎ SBS 생활의... 꿀이 액체라기보다는 고체에 가까운데, 대구평화떡공방 은 작고 몰랑몰랑하고 부드럽네요 ㅋㅋ 둘다... ",공인중개사,https://blog.naver.com/meysb0122,2018-07-25
[Flower cake평화떡공방 ] 3월 컵설기 원데이,https://blog.naver.com/gpals8575?Redirect=Log&logNo=220630304346, 평화떡공방flower cake 입니다 엄청 오랜만 포스팅이네요 ㅠㅠ 왜 그런지 모르겠는데 집에 인터넷이 컴퓨터만 안되서 지금도 폰으로 쓰고 있답니다ㅠㅠ 다들 명절은 잘 보내셨나요? 저희 가게는 떡공방... ,평화떡공방,https://blog.naver.com/gpals8575,2016-02-17
대구 봉덕시장 떡집평화떡공방sns 유명한 꿀떡 먹고 왔어요.,https://blog.naver.com/seokson1?Redirect=Log&logNo=221248094991,대구 봉덕시장 떡집평화떡공방sns 유명한 꿀떡 먹고 왔어요. 안녕하세요!! 오늘은 대구에 놀러 갔을 때... 송편같이 생긴 떡 옆에 제가 좋아하는 술떡도 있었어요~ 이렇게 많은 종류에 떡이 있었지만 역시... ,뭐든 해보자,https://blog.naver.com/seokson1,2018-04-08
대구 꿀떡 꿀떡 봉덕시장평화떡공방 ,https://blog.naver.com/o_da0731?Redirect=Log&logNo=221243423192,오늘은 지금 대구에서 가장 핫한평화떡공방꿀떡을 먹어봤습니다. 이왕 먹어보는 김에 근처에 있는... 떡 자체로는 고소하고 맛있어서 설탕없이 먹어보고싶단 생각도 드네요. 그래도 기회가 된다면 한번... ,사진작가의 프라이빗 서재,https://blog.naver.com/o_da0731,2018-04-02
"대구 꿀떡평화떡공방 , 동생이 사옴!",https://blog.naver.com/d-_-b3?Redirect=Log&logNo=221444711724,"대구 꿀떡평화떡공방 , 동생이 사옴! 안녕하세요. 다온이에요! 오늘은 어제 동생이 #대구여행 가서 사온... 하지만 달기 때문에 많이는 먹지는 못하는 떡!! 오늘은 금요일~ 하루만 일하면 내일부터 이틀동안 쉬니... ",다온's 소소한 일상,https://blog.naver.com/d-_-b3,2019-01-18
[일상] 봉덕시장평화떡공방 :)대구꿀떡/하이라이스만들기... ,https://blog.naver.com/diosarein?Redirect=Log&logNo=221253721962,"다소 과하다고 느꼈지만, 싹싹 긁어먹으며 아쉬워했다 ㅠ # 평화떡공방오후에는 업무 좀 보다가... 확실히 산격시장의 꿀떡과는 달랐음 거긴 떡 자체에서 기름맛이 확 감돌았는데, 이건 그런 맛은 안나고... ",보통날이고 싶은,https://blog.naver.com/diosarein,2018-04-16
생활의달인 찹쌀 꿀떡 대구평화떡공방택배 주문,https://blog.naver.com/jihoojibin?Redirect=Log&logNo=221238096359,이곳이 바로 생활의달인 대구 찹쌀 꿀떡을 판매하는 대구평화떡공방 이에요. 요즘 이곳이 SNS에서... 부디 이걸 드셔보신 분들께서 다 맛있다고 했음 좋겠네요 ㅎㅎ 대구평화떡공방대구 남구 봉덕로 117 ☎ 053... ,행복이 머무는 집 ~.*,https://blog.naver.com/jihoojibin,2018-03-27
[대구/맛집]봉덕시장 ::평화떡공방 (대구 꿀떡 맛집),https://blog.naver.com/qlsl1739?Redirect=Log&logNo=221644305895,"봉덕시장의 ' 평화떡공방 ' 방문~!~! 사실 나는 여기가 그렇게 유명한 집인 줄 잘 몰랐는데... SNS나... 평화 떡집은 매대에 떡을 나열해 놓고 파는데, 꿀떡은 매대에 진열해놓지 않고 직원분께 팩수를 말씀 드리면... ",아주 작은 시간들,https://blog.naver.com/qlsl1739,2019-09-10
[Flower cake평화떡공방] 6월컵설기원데이클래스,https://blog.naver.com/gpals8575?Redirect=Log&logNo=220721540147,안녕하세요평화떡공방flower cake 입니다 :) 요즘 날씨가 너무 덥지요? 어떨땐 벌써 여름인가... 번지평화떡공방- 수업 일 : 6월 6일 월요일 전 11:00 6월 9일 목요일 후 7:00 6월 14일 화요일 후 7:00 6월... ,평화떡공방,https://blog.naver.com/gpals8575,2016-05-28
대구 꿀떡평화떡공방봉덕시장 서울분식 24시떡볶이,https://blog.naver.com/hongseull?Redirect=Log&logNo=221455203310,내 떡 어디갔니? 쫀득함을 영상으로 담아봤어요!! 그럼 맛있는 대구먹거리로 여행오시면 꼭 먹어봐야하는 꿀떡이였습니다. 서울분식 봉덕시장 24시 분식 떡볶이평화떡공방바로 옆 서울분식이예요. 오늘은... ,보고느낀그대로❤️,https://blog.naver.com/hongseull,2019-01-31
[평화떡공방 퓨전떡카페 7월 중 오픈 ],https://blog.naver.com/gpals8575?Redirect=Log&logNo=221568114819,안녕하세요 저희 공방이 커피와 함께 7월 중평화떡공방퓨전 떡 카페 로 새롭게 오픈합니다 공방에서 도보 약 1분 거리에 오픈합니다 기존의 떡과 새로운 떡 디져트 그리고 음료 판매 예정입니다 이쁘게... ,평화떡공방,https://blog.naver.com/gpals8575,2019-06-22
봉덕동 추천맛집 생활의달인평화떡공방 ,https://blog.naver.com/swimmingppp?Redirect=Log&logNo=221253745860,"없던 떡 충동구매각 ㅋㅋ 생활의 달인에 괜히 나오는게 아니였군요 오색떡도 있고 명절에 시골가면...평화떡공방꿀떡 한번 쯤 사먹어 볼만하다라는게 총평입니당 :) 봉덕동평화떡공방 , 평화떡집 주소는요 ↓",오해피수박,https://blog.naver.com/swimmingppp,2018-04-16
대구 맛집 :: 대구꿀떡 -평화떡공방 ,https://blog.naver.com/dlehdl11?Redirect=Log&logNo=221346207448,맛집평화떡공방(평화떡집)평화떡공방09:00 ~ 19:00 매주 일요일 휴무 3째주 월요일 휴무 카드결제 가능... 외에도 떡 종류가 많대요 저는 토요일 4시 20분에 도착했는데 약과랑 꿀떡만 남아있었어요 앙꼬절편은... ,여행 냠냠 ෆ,https://blog.naver.com/dlehdl11,2018-08-26
대구꿀떡평화떡공방포장으로 맛본 솔직 후기 (2018),https://blog.naver.com/chubby_j?Redirect=Log&logNo=221478363695,끝날듯 끝나지 않는 경상도 투어 대구 이야기 한때 엄청 유행했던 대구꿀떡 원조평화떡공방포장해서... 흑설탕을 깔아두고 떡을 올리면 그 떡 열기 때문에 저렇게 녹는다고 함 실온보관에선 하루~이틀... ,흔하디 흔한 이야기 :),https://blog.naver.com/chubby_j,2019-03-02
대구 봉덕시장평화떡공방인기 꿀떡(생활의달인 출연) 솔직... ,https://blog.naver.com/sjsj0043?Redirect=Log&logNo=221284732182,엄청 맛있는 꿀떡이지만 3천원이면 더 부담없이 자주 사 먹을 수 있을 것 같아요! 떡 한팩에 4천원은 초큼 부담스럽네요. (개인적인 의견임미당) 대구 요즘 핫한 떡집평화떡공방기회되시면 한번 먹어보세요. ^^,꿀가득 하루하루 :),https://blog.naver.com/sjsj0043,2018-05-26
