title,link,description,bloggername,bloggerlink,postdate
[이태원][새우요리] 피셔맨즈 ,https://blog.naver.com/ciciri1?Redirect=Log&logNo=221495204216,새우요리로 유명한피셔맨즈언니랑 데이트하러 다녀왔어요~! 차는 가져가지 마세요 이태원은 차... 이태원피셔맨즈추천해도 괜찮은 식당이예요 제 블로그는 홍보 포스팅 의뢰를 받지 않아요 만약 마음이... ,꼬숙이와 뀨의 온라인주택,https://blog.naver.com/ciciri1,2019-03-23
3일 (7/27 토) 오라클 파크 투어-피어39- 피셔맨즈워프,https://blog.naver.com/gganttabbiya?Redirect=Log&logNo=221603428334,3일 (7/27 토) 오라클 파크 투어-피어39- 피셔맨즈워프 구 ATT Park 현 Oracle Park tour 함 약 2주전에... 심지어 매장도 작은 매장 가서 기념품은 못삼 ㅠ 이쪽이 다피셔맨즈워프 더 오리지널 기라델리... ,기억쌓기,https://blog.naver.com/gganttabbiya,2019-08-02
마카오 성바올성당/피셔맨즈 워프,https://blog.naver.com/haja3720?Redirect=Log&logNo=221500338447,택시타고피셔맨즈 워프로 이동했다 약 10년전에 왔을때랑은 입구만 조금 변했을뿐 그닥 달라진게... 홍콩센트럴로 가자구여^^ #마카오 #성바울성당 #마카오페리터미널 #마카오 피셔맨즈 워프#마카오호텔셔틀,여행을 꿈꾸지만 말고 행동으로 옮기자^^,https://blog.naver.com/haja3720,2019-03-29
이태원 레스토랑피셔맨즈새우파티하고왔어요,https://blog.naver.com/be-focus?Redirect=Log&logNo=221608248306,이태원 레스토랑피셔맨즈새우파티하고왔어요 평일부터 계속 새우파티가하고싶어서 혼났지머에요 그래서 주말을 이용해서 이태원 레스토랑을 가기로해서 그곳에있는피셔맨즈 라는곳에서 새우파티하러... ,통네코의 즐거운 나날들,https://blog.naver.com/be-focus,2019-08-07
"[샌프란시스코 여행]피셔맨즈워프, 피어 39, 인앤아웃",https://blog.naver.com/okokbon?Redirect=Log&logNo=117444651,떠올렸다면피셔맨즈워프로 가라 눈이 부신 태양 잔잔한 바다 맛있는 바다음식 그리고 사람들... ▣ 피어 39 ★★★★★ 샌프란시스코 만의 부두들 중 관광지로 개발한 39번 부두피셔맨즈워프에서... ,용주신의 달콤한 인생,https://blog.naver.com/okokbon,2010-11-29
"1월 18일(금) - 기아요새, 피셔맨즈 워프",https://blog.naver.com/vijay74?Redirect=Log&logNo=221496227735,다음 목적지인피셔맨즈워프에 가기 위해 택시를 타야 하는데.. 이렇게 택시가 없을 줄이야.. 간신히 택시를 타고피셔맨즈 워프로 이동 성공.. 이 사진은 아마 택시에 내렸을때의 모습을 지우가 찍은 것인듯..... ,Jiwoo's story,https://blog.naver.com/vijay74,2019-03-24
[마카오여행] 피셔맨즈 와프 작은 유럽을 거닐다,https://blog.naver.com/bahna2?Redirect=Log&logNo=70114893438,[마카오여행피셔맨즈 와프 테마파크] 마카오여행 중피셔맨즈 와프는 기대가 많았던것 만큼 예쁜 볼거리가 있었어요~ 마치 유럽에 온듯한.. 유럽은 아직 가보진 못했지만 난 여기가 유럽이 아닌가 착각할 만큼... ,Travel portfolio,https://blog.naver.com/bahna2,2011-08-01
괌 회 :: 괌 참치 연어회 맛볼 수 있는피셔맨즈코옵,https://blog.naver.com/chi4540?Redirect=Log&logNo=221521668417,#괌회 #괌참치 #괌연어 #괌연어회 #괌 피셔맨즈 코옵 괌 회를 맛볼 수 있는피셔맨즈 코옵! 아는 사람만 아는 곳인데 요새는 인스타에서도 핫해서 저희도 인스타에서 찾아서 방문하게 되었어요~ ㅎㅎㅎㅎ 괌 참치... ,일상스케치 by. Henn,https://blog.naver.com/chi4540,2019-04-24
샌프란시스코여행.피셔맨즈 워프의 셰라톤 호텔,https://blog.naver.com/chalet_swiss?Redirect=Log&logNo=220638631265,샌프란시스코피셔맨즈 워프에 위치한 셰라톤 호텔을 소개합니다. 샌프란시스코피셔맨즈 워프의 노스포인트 스트리트에 자리한 셰라톤피셔맨즈 워프 호텔 외관입니다. 로비가 있는 1층 공간에는 카페와... ,샬레트래블앤라이프,https://blog.naver.com/chalet_swiss,2016-02-26
이태원피셔맨즈새우요리 전문점,https://blog.naver.com/goldbell0?Redirect=Log&logNo=221437339976,이태원에서 새우를 전문적으로 하는 곳으로 유명한피셔맨즈 (Fishermans)를 소개합니다! 이태원에는 워낙 독특한 분위기를 갖춘 맛집이 많지만 새우를 좋아하신다면피셔맨즈 를 추천드리고 싶습니다. 외관에는... ,꿈이 있는 마루,https://blog.naver.com/goldbell0,2019-01-08
이태원맛집피셔맨즈데이트코스 인테리어 핫!함!,https://blog.naver.com/miho9000?Redirect=Log&logNo=221463514049, 피셔맨즈MANITO #이태원 피셔맨즈이전 했다 해서 #인테리어 도 직접 하셨다 하셔서 #이태원인태리어매장 구경할겸 완전 외관이 핫 완전 #이태원대표맛집추천 하고픈 #이태원비쥬얼매장 반하겠다 ㅋㅋ 겁나 찍음... ,B L O G ♥ H O L I C,https://blog.naver.com/miho9000,2019-02-12
흥미진진피셔맨즈워프 (Fishermans Wharf) 샌프란시스코... ,https://blog.naver.com/chunheehong?Redirect=Log&logNo=100171679517,11월의피셔맨즈워프 광장에 들어설때 비릿한 바다냄새와 사람들의 활기 찬 모습은 참으로 아름다웠습니다. 샌프란시스코를 말할때는피셔맨즈워프 (Fisherman's Wharf)를 빼놓을 수가 없습니다.피셔맨즈워프... ,신디의 노을빛 수채화 꿈,https://blog.naver.com/chunheehong,2012-11-15
Kohsamui#7. 코사무이맛집 :피셔맨즈 빌리지 맛집 : NIRVANA,https://blog.naver.com/cutelinnot?Redirect=Log&logNo=220549775429,코사무이맛집 :피셔맨즈 빌리지 맛집 : NIRVANA 아~~주 오랜만에 올리는 코사무이 자유여행스토리... 해피엘리펀트:)피셔맨즈 빌리지의 밤분위기는 요날도 조용했어요~ 차웽과는 조금 다른 분위기! 이엘네는... ,이엘로그,https://blog.naver.com/cutelinnot,2015-11-25
(괌여행) DAY3[ 피셔맨즈 코옵/남부여행],https://blog.naver.com/yuna0447?Redirect=Log&logNo=220157917053,DAY3 한식요리- 피셔맨즈 코옵-프로아-케이마트-마이크로네시아몰-홈파티 셋째날의 시작은 도통 괌 음식을... 맛집/ 피셔맨즈 코옵]그 유명한 괌참치회 괌연어회 담당하고있는피셔맨즈 코옵생선냄새가 포르~포르... ,But.,https://blog.naver.com/yuna0447,2014-10-22
"[이태원 맛집] 특별한 새우요리, 용산구청 맛집피셔맨즈 ",https://blog.naver.com/onlynall?Redirect=Log&logNo=220848749346, 피셔맨즈이미 맛집으로 정평이 난 집이라 꽤나 많은 분들이 아실듯. 가게 외관부터 새우전문요리점이라는 걸 여과없이 나타내는중 할로윈데이를 맞이하야 새우도 코스튬 중 ㅎㅎㅎ 이태원 새우 맛집피셔맨즈 ... ,"어떤 날, 그런 날",https://blog.naver.com/onlynall,2016-10-30
마카오 맛집- 피셔맨즈 워프 탈라이타이,https://blog.naver.com/thehangood?Redirect=Log&logNo=221545866835,마카오 맛집피셔맨즈 워프 탈라이타이 마카오 맛집 탈라이타이는피셔맨즈 워프에 자리 잡고 있습니다. 마카오반도 샌즈 호텔 맞은편이고요. 마카오 대교와 야경이 보이는 야외석이 꽤 많이 배치되어 있고... ,마카오 게스트하우스-휴(休),https://blog.naver.com/thehangood,2019-05-24
빅토리아] 감성 톡톡! 빅토리아에서 만나는 ' 피셔맨즈 워프②',https://blog.naver.com/wjstkdgussla?Redirect=Log&logNo=20200112197,다운타운에서 10분거리에 있는 ' 피셔맨즈 워프 마을'이 그곳 이다.피셔맨즈 워프 '구경'은 출발부터가 심상찮았다. 세계적인 미항(美港) 빅토리아 이너하버에서 작은 페리로 십분즈음. 이너하버의 빼어난 경치를... ,"Just는 ""외출중""",https://blog.naver.com/wjstkdgussla,2013-11-27
"이태원 세계음식거리, 피셔맨즈 ",https://blog.naver.com/geelinee?Redirect=Log&logNo=221420030276,"더 이상 힘들어서 앉을 수 있는 다른 곳으로 가자,,, 하구 좀 걸어서 # 피셔맨즈에 갔다. 왕새우가 우리를... 와인 한잔하기 좋은 분위기다.➿ 냠 냠 안뇽 화장실두 이쁘더라! #이태원 # 피셔맨즈#세계음식거리 7점? ➿",a pot,https://blog.naver.com/geelinee,2018-12-15
괌 차모르야시장 옆피셔맨즈 코옵 늦게가지 마세요~,https://blog.naver.com/pdypink?Redirect=Log&logNo=220761769485,괌 차모르야시장 옆피셔맨즈 코옵 이라는 회 포장할수 있는곳에 갔어요. 맛있는 회를 맛보기위해... 해가 질때쯤 멋진 괌 풍경을 즐기며피셔맨즈 코옵으로 향했어요. 시간이 간당간당해서 불안했어요~ 저녁... ,제주도돌스냅 / 제주가족사진 다미사진관 블로그,https://blog.naver.com/pdypink,2016-07-14
"샌프란시스코 지도 - 유니온스퀘어,피셔맨즈워프, 골든게이트... ",https://blog.naver.com/oblove3?Redirect=Log&logNo=220967098170,"샌프란시스코 지도와 유니온스퀘어 ( Union square ) 주변, Pier 39근처의피셔맨즈워프( Fisherman's... 5 Pier 39 근처의피셔맨즈워프 ( Fisherman's wharf ) 지역 지도입니다. 6 아시죠? 샌프란시스코는 미국... ",공감포토에세이,https://blog.naver.com/oblove3,2017-03-25
이태원술집피셔맨즈아메리칸 씨푸드 레스토랑 이런새우맛 첨,https://blog.naver.com/kujaka?Redirect=Log&logNo=221585007178,kujaka food review 이태원술집피셔맨즈□■ 샌프란시스코피셔맨즈 워프가 생각나는 이태원피셔맨즈 에서 특별한 새우요리 맛보다 종종 날잡아 이태원 맛집 찾아가는데 이번에 찾아간 곳은 이태원술집피셔맨즈 ... ,❀구작가의 일상 재테크❀,https://blog.naver.com/kujaka,2019-07-13
[캐나다 빅토리아 여행]피셔맨즈와프 (Fisherman's Wharf),https://blog.naver.com/lemonlime2?Redirect=Log&logNo=220480917588,"일부러피셔맨즈와프(Fisherman's Wharf)에 해질녘 즈음에 갈 생각이었답니다. 그래서 먹으려고 했던 피시... 걸어서피셔맨즈와프까지 왔답니다. 걷는 거 안 좋아하시는 분은 버스 타도 될 테지만, 걸어도... ",사다리 있는 호박마차,https://blog.naver.com/lemonlime2,2015-09-14
"샌프란시스코 여행,피셔맨즈 와프에서 시푸드 포장마차 먹방",https://blog.naver.com/jjjadeland?Redirect=Log&logNo=220400852543,"샌프란시스코 여행,피셔맨즈 와프에서 시푸드 포장마차 먹방 샌프란시스코피셔맨즈와프 Fisherman's Wharf 케이블카나 뮤니 메트로를 타고 쭉 올라오면 도착하는 북쪽 해변가. 이곳에는 맛있는 음식점들과... ",여행미녀 제이드 :: JadeLand ♪,https://blog.naver.com/jjjadeland,2015-06-29
새로운 신상 운정 맛집피셔맨즈키친:)화덕피자 굿!,https://blog.naver.com/ginalover?Redirect=Log&logNo=221536558266," 피셔맨즈 키친 FISHERMAN'S KITCHEN 운정 신상맛집피셔맨즈 키친 운정에 새로운 신상 맛 집이 생겼습니다.피셔맨즈 키친 워낙 유명한 체인점이라, 파주에 새로 생긴다니 오픈전부터 신이 났어요 오예!!! 파주 운정엔... ",찐찐아씨 블로그/ginalover,https://blog.naver.com/ginalover,2019-05-13
[홍콩여행]마카오피셔맨즈와프,https://blog.naver.com/loveeeee9113?Redirect=Log&logNo=220129119007,마카오 유일의 테마파크 마카오피셔맨즈와프홍콩여행 중 마카오 여행의 유일한 테마파크피셔맨즈와프를 다녀 왔습니다.밤이 되면 더욱 아름답고 멋있다는 애기를 들어 조금 늦은시간에 찾아 갔습니다!!... ,토리,https://blog.naver.com/loveeeee9113,2014-09-22
괌_가족여행피셔맨즈 코옵 참치회,https://blog.naver.com/mimir79?Redirect=Log&logNo=220124929528,참치회 사다놓으러 ㅋㅋㅋ 괌 맛집이나 참치회로 검색하면 한번쯤 봤을법한 이곳은 괌피셔맨즈 코옵... 여기는 꼭 가봐야할 곳 중 하나이다. 아빠 엄마 모두 맛있다고 좋아하셨던피셔맨즈 코옵 :) @ 20140118 GUAM,파란무지개를 건너는 코끼리,https://blog.naver.com/mimir79,2014-09-17
샌프란시스코피셔맨즈워프,https://blog.naver.com/23dnjs?Redirect=Log&logNo=221410251447,샌프란시스코피셔맨즈워프 2018. 10. 4. (목) / 미서부 여행 오후 4시에 샌프란시스코 공항에서 버스가 출발해서 오후 5시 샌프란시스코피셔맨즈워프에 도착했다. Fisherman's Wharf 이탈리아계 어부들의... ,꿈이 시키는 일을 하는~ DreamWorker,https://blog.naver.com/23dnjs,2018-12-01
이태원피셔맨즈!! 아메리칸씨푸드레스토랑/새우요리/맥주,https://blog.naver.com/thessongskin?Redirect=Log&logNo=221474210778,이태원피셔맨즈정말 간만에 찾은 이태원!! 경리단길에도 사람들이 줄어들도 이태원도 많이...피셔맨즈 는 씨푸드 레스토랑인데. 거의 새우요리위주라 새우를 좋아하시는분들이라면. 꼭 가봐야할곳 ^^ !!... ,The Skin By SSONG,https://blog.naver.com/thessongskin,2019-02-25
괌에서 먹는 활어회는피셔맨즈 코옵 (FISHERMEN'S CO-OP),https://blog.naver.com/chiot_aile?Redirect=Log&logNo=221342914649,여행전에 미리 알아봐두었던(!) 괌에서 유일한 활어회를 판다고 했던피셔맨즈 코옵을 다녀왔다. 파세오공원-아가냐대성당-스페인광장쪽을 둘러보다가 근처에 있는피셔맨즈 코옵이 생각나서 바로 차로... ,"찰나의 순간, 02pic :)",https://blog.naver.com/chiot_aile,2018-08-21
[마카오여행] 피셔맨즈 와프 야경,https://blog.naver.com/bahna2?Redirect=Log&logNo=70114951181,마카오여행 중피셔맨즈 와프의 야경입니다.피셔맨즈 와프는 대부분 야경을 보기위해 오는 사람들이 많아요~ 저두 야경 사진을 보고 너무 멋져서 간거였지만 화산섬이 오픈을 안하는 바람에 전체적인 예쁜... ,Travel portfolio,https://blog.naver.com/bahna2,2011-08-02
괌 리얼 맛집 - 힐튼피셔맨즈 코브 Fisherman's Cove 씨푸드... ,https://blog.naver.com/psynara82?Redirect=Log&logNo=220637565353,괌 리얼 맛집 - 힐튼피셔맨즈 코브 Fisherman's Cove 씨푸드 짱맛 :) 괌 힐튼 리조트 내에 있는피셔맨즈 코브 씨푸드 레스토랑 앤 그릴! 지난번 왔을 때 못간터라 이번엔 1순위로 방문 ㅋㅋㅋㅋㅋ 내부는 요런 느낌... ,♥애슐리의 즐거운 여행,https://blog.naver.com/psynara82,2016-02-25
"마카오- 피셔맨즈와프, 주변",https://blog.daum.net/pyangye/2649,"마카오- 피셔맨즈와프, 주변 댓글 2 *양정 박양예* 방/국외나드리 2020. 12. 13. 2019. 3. 9 고향친구들과 함께 공유하기 글 요소 저작자표시 비영리 변경금지 댓글 2 2020.12.13 11:55 비밀댓글입니다... ",도전하는 기쁨,https://blog.daum.net/pyangye,2020-12-13
"마카오피셔맨즈 워프,,",https://blog.naver.com/4sproject?Redirect=Log&logNo=220010578309,목적지로피셔맨즈 워프로 결정했어요피셔맨즈 워프는 마카오페리터미널에서 걸어갈 수 있는 거리에 있는 일종의 테마파크에요 마카오 페리터미널을 나와 등지고 왼쪽으로 길을 따라 한 10분정도 걸어가면... ,"세계인의 세계여행 다이어리,,",https://blog.naver.com/4sproject,2014-05-26
# 괌 북부여행 :피셔맨즈 코옵 사랑의절벽 리티디안비치,https://blog.naver.com/midale007?Redirect=Log&logNo=220612726332,"괌 북부여행피셔맨즈 코옵 : 연어를 사랑한다면 더운 이곳에서 연어가 왠말인가 하겠지만, 괌 맛집을 조금이라도 찾아본 사람이라면 여기피셔맨즈 코옵을 모를수 없을 것이다 북부쪽에 위치하고 있는 이곳.... ",OMSHANTI,https://blog.naver.com/midale007,2016-01-29
몬트레이피셔맨즈워프 여름 저녁 풍경,https://blog.naver.com/sillymo?Redirect=Log&logNo=60166703661,"2012년 7월 13일 금요일 저녁, 아내와 함께 몬트레이 베이에 있는피셔맨즈워프(Fisherman’s Wharf: 선창)에 느긋한 저녁 나들이를 나갔습니다.피셔맨즈워프는 몬트레이 시내에 있는 선창으로 1900년대초 정어리... ",한국 엑스모 블로그,https://blog.naver.com/sillymo,2012-07-15
이태원파스타 가게 중 실력이 상당한피셔맨즈 입니다.,https://blog.naver.com/calli881129?Redirect=Log&logNo=221584606815,"이번에 방문했던 이태원피셔맨즈 는 제가 먹어본 파스타 중 거의 손에 꼽을정도로 맛있는...피셔맨즈이태원 대로변에서 조금 골목을 따라 내려와야 하는 길에 위치했는데, 내려오는 길목에 예쁘고 특색있는... ",새우잠을 자며 고래꿈을 꾸다,https://blog.naver.com/calli881129,2019-07-13
[Guam] 믿고 먹는피셔맨즈 코옵 아삭한 연어회,https://blog.naver.com/sky007nz?Redirect=Log&logNo=221290268756,괌 여행에서 여유를 즐기고 저녁은 차모르에 위치한피셔맨즈 코옵 에 신선하고 싱싱한 연어회랑... 구매가능 할 듯 초장 쏘주 깻잎무침 구매하고피셔맨즈 코옵 으로 회 사러 갑니당피셔맨즈 코옵 주차장... ,은디월드,https://blog.naver.com/sky007nz,2018-06-02
저렴한 가격에!! in ' 피셔맨즈코옵(Guam Fisherman's Co-op)',https://blog.naver.com/onlyu48624?Redirect=Log&logNo=220236531043,in ' 피셔맨즈코옵(Guam Fisherman's Co-op)' 괌 여행 중 하루는 렌터카로 리디티안 비치를 가기로 계획한... 리프호텔에서 가기에는 거리가 너~~~무 떨어져있는피셔맨즈코옵(Fisherman's Co-op)! 그래서 렌터카를... ,꿈꾸는 World Traveler ♥,https://blog.naver.com/onlyu48624,2015-02-02
[이태원] 이태원 맛집 베스트피셔맨즈 ,https://blog.naver.com/kinomii?Redirect=Log&logNo=221316419108,09 이태원 뉴욕식 새우요리 맛집 ::피셔맨즈친구랑 오랜만에 이태원에 놀러갔어요 ㅎㅎ 이태원에서 뭘 먹을까 검색하다가 이태원 뉴욕식 새우요리 맛집피셔맨즈 를 갔어요 ^^ 이태원역 4번출구에서 도보... ,내 마음의 잔.물.결™,https://blog.naver.com/kinomii,2018-07-12
마카오에서 하루 - 세나도광장주변과피셔맨즈 와프,https://blog.naver.com/guilgong?Redirect=Log&logNo=44457149,"그리고, 바로피셔맨즈 와프로 이동..... 이른 시간에 도착하니 사람도 없고, 이른 시간이라 특별히... 거리를 더 돌아보다 다시 돌아온피셔맨즈와프.. 간단하게 맥주한잔을 하며 휴식을 가졌다... 어둠이 오려고... ",나무아빠님의 블로그,https://blog.naver.com/guilgong,2007-11-22
[이태원역] 피셔맨즈Fishermans,https://blog.naver.com/kkj7770?Redirect=Log&logNo=221175059363,예전부터 꼭 한번 와보고 싶었던 이태원의피셔맨즈Fishermans 아마 새우요리는 싫어하는 사람 찾기... 사진이 정말 잘나오는피셔맨즈 ㅋㅋ 분위기도 좋고 가격은 좀 있지만 새우 좋아하면 한번 와볼만한 곳인거같다,단방향소통 생활기록부,https://blog.naver.com/kkj7770,2017-12-31
"튼이네 괌 여행 :: 괌 맛집,피셔맨즈코브 (힐튼 씨푸드 레스토랑)",https://blog.naver.com/spring9191?Redirect=Log&logNo=221304468488,괌 씨푸드 맛집 힐튼피셔맨즈코브 (Fisherman's Cove) 괌 씨푸드 레스토랑 추천피셔맨즈코브 (Fisherman's Cove) 영업시간 : 18시 ~ 21시 30분 (저녁타임 only) 위치 : 괌 힐튼호텔 내 1층 주차 : 괌 힐튼호텔 주차장... ,기억하고 싶은 나의 보통날,https://blog.naver.com/spring9191,2018-06-23
이태원 새우맛집피셔맨즈로제 퐁듀 쉬림프라고 들어는 봤나?^^,https://blog.naver.com/1030ysk?Redirect=Log&logNo=221164722597,여름 무렵에 한 번 가봤던 이태원의피셔맨즈한번 다녀온 후로 계속 생각나던 곳이었어요. 커다란 새우가 한 마리 가게를 지키던 ㅎㅎ 겨울에 찾아도 커다란 새우가피셔맨즈 를 지키고 있네요. 이곳도 딸이... ,술패랭이,https://blog.naver.com/1030ysk,2017-12-17
[마카오]피셔맨즈와프 Fisherman's Wharf,https://blog.naver.com/yuejihua?Redirect=Log&logNo=20076066303,2005년 12월 31일에 개장했다는피셔맨즈와프. 유럽의 한 골목길을 연상케하는 이곳에는 레스토랑과... 선착장 바로 옆의피셔맨즈와프 까지 도보로 고고싱~~~ 도보로 5분 정도면피셔맨즈와프에 도착해요!... ,무심코 보낸 하루,https://blog.naver.com/yuejihua,2009-07-19
이태원 맛집피셔맨즈 ,https://blog.naver.com/lyounghal?Redirect=Log&logNo=221138908428,이태원역에서 가깝기두 하구요~ 카페 탄탈라이즈 바로옆에있답니다피셔맨즈외관에 커다란 새우로... 찾으시면피셔맨즈 도 추천해요 일단 쉬림프 롤세트는 강추.!! 칠리 쉬림프도 맛있었지만 다른메뉴를... ,영자매,https://blog.naver.com/lyounghal,2017-11-13
[이태원 레스토랑 추천]피셔맨즈 에서 싱싱한 해물파티 *.*,https://blog.naver.com/lala1010?Redirect=Log&logNo=221604516679,예전부터 꼭 와보고 싶었던 이태원피셔맨즈비닐봉지에서 해산물이 쏟아져 나오는 그 장면을 보고... 레스토랑피셔맨즈 의 메뉴는 워낙 다양해서 탭으로 다 보여 주는건 힘들 것 같고 http://www.fishermans.kr/ 여기... ,Attractive shim,https://blog.naver.com/lala1010,2019-08-03
