title,link,description,bloggername,bloggerlink,postdate
히스토리 -10.피셔맨즈스플렉스 탄생비화 (스포츠 호치),http://kkjzato.egloos.com/3272142," 피셔맨즈스플렉스 탄생비화' 라는 글이었습니다. 어떤 내용일지 보시죠. 1980년대 전반에 초대 타이거... 제10회는 ' 피셔맨즈스플렉스 탄생비화'. 1980년, 24살이 된 고바야시 쿠니아키는 멕시코로 처음 해외... ",공국진의 이것저것 블로그,http://kkjzato.egloos.com/,2020-10-10
코사무이 야시장 꼭 가세요!피셔맨즈 빌리지 근처,https://blog.naver.com/namdolly?Redirect=Log&logNo=221735651926,"제가 간 곳은피셔맨즈 빌리지 근처에요. 숙소가피셔맨즈 빌리지랑 가까웠거든요. 야시장 운영 구역은 지도 참고! 코사무이 대부분 호텔, 리조트에는피셔맨즈빌리지로 가는 셔틀버스가 있어서 그걸... ",일상다반사♥,https://blog.naver.com/namdolly,2019-12-13
 피셔맨즈밀키트 보일링 치킨 간단 캠핑요리or홈파티(복날음식),https://blog.naver.com/looh2040?Redirect=Log&logNo=222467325270, 피셔맨즈 의 배송은 당연히 빨랐어요. 신선식품이거나 반조리 제품의 경우 배송의 빠르지 않을까 봐... 조리하고 나서 맛보고 아차..했네요..ㅋㅋ피셔맨즈만의 레시피로 만들어낸 비법 소스! 기존 보일링... ,늘 꽃길,https://blog.naver.com/looh2040,2021-08-12
"빅스비사료, 빅스비 리버티피셔맨즈 캣치 스몰브리드 솔직 후기",https://blog.naver.com/jdbri1130?Redirect=Log&logNo=222504724184,"빅스비 리버티 건사료피셔맨즈 캣츠는 생선단백질이라 상대적으로 사료냄새도 덜하겠지만, 냄새가 확실히 적다. 급여 중인 영양제를 뿌려 준비 지퍼백 형태의 패키지도 마음에 들었다. 며칠만에 소진할 양의... ",인생견생 콜라보 •̀.̫•́,https://blog.naver.com/jdbri1130,2021-09-13
날은 밀키트씨푸드 랍스터요리 끝판왕 보일링랍스터피셔맨즈 ,https://blog.naver.com/kalma0204?Redirect=Log&logNo=222506750242,할로윈음식 추천.특별한 날은 밀키트씨푸드 랍스터요리 끝판왕 보일링랍스터피셔맨즈매번 캠핑을 갈... 7kg 정도이며피셔맨즈 에서 꼼꼼하게 포장을 해주셨고 아이스팩도 넉넉하게 넣어주셔서 더운... ,인천꽃바지의 야성캠핑,https://blog.naver.com/kalma0204,2021-09-15
"3년전 오늘(5.21), 미국 샌프란시스코,피셔맨즈 와프, 피어39... ",https://blog.naver.com/comaism?Redirect=Log&logNo=222387616766,케이블카 타고 롬바드거리 지나서피셔맨즈 와프로~ 영화에서 많이 보던 풍경피셔맨즈 와프와 pier39는 방콕 터미널21 에서 이미 자주보던 ^^; 샌프란시스코 커피라는 피츠커피를 먹어 봅니다. 맛은 봐줘야... ,코마월드,https://blog.naver.com/comaism,2021-06-06
"미국(샌프란시스코) 패키지여행( 피셔맨즈 워프, 피어45)(190616)",https://blog.naver.com/0178502617?Redirect=Log&logNo=222296089401, 피셔맨즈 워프 Fisherman's Wharf 이탈리아계 어부들의 선착장에서 시작된 ' 피셔맨즈 워프'는 동쪽 끝 피어39에서 서쪽 끝 기라델스 스퀘어까지 거리로 해안을 따라 길게 형성된 부두에는 항구와 해산물... ,Jin's Story,https://blog.naver.com/0178502617,2021-04-02
마카오반도피셔맨즈 워프 / 전당포 거리,https://blog.naver.com/kaori1052?Redirect=Log&logNo=221765589292,"위해피셔맨즈 워프로 왔다 코타이의 화려한 호텔들에 가려 빛을 보지 못하고 있는 것 같은피셔맨즈 워프피셔맨즈 워프의 상징과도 같은 가짜 콜로세움ㅋㅋ을 보면서, 구경 시작~ 전에는 없던 콜로세움 앞의... ",둥글둥글 쭈구리 뿡뿡,https://blog.naver.com/kaori1052,2020-01-09
「샌프란시스코」 아이와 함께 미서부여행_ 피셔맨즈 와프JW메... ,https://blog.naver.com/funny0820?Redirect=Log&logNo=221854947076,샌프란시스코 숙소 이야기예요 친구집을 떠나 첫 숙소는 샌프란시스코피셔맨즈 와프 JW메리어트예요... 정도피셔맨즈 와프나 피어39는 정말 깜깜한 밤이었고 ㅠㅠ피셔맨즈 와프 JW메리어트와... ,오달링’s Sweet Day,https://blog.naver.com/funny0820,2020-03-15
샌프란시스코 여행 #3피셔맨즈워프를 찾아서,https://blog.naver.com/lsh5755?Redirect=Log&logNo=221801811860,가장 가까운피셔맨즈워프로 이동해 피어 39 주변을 탐방할 생각이다. 스마트폰 지도 앱을 켜보니... 그렇게 약 15분 정도 걸어피셔맨즈워프 초입에 도착했다. 여긴 샌프란시스코에서 가장 유동인구가 많은... ,천사는 여행중,https://blog.naver.com/lsh5755,2020-04-28
이태원 랍스터 맛집피셔맨즈존맛탱 인정,https://blog.naver.com/sunkjydbgn?Redirect=Log&logNo=221751113693,"이태원피셔맨즈 인데요 ~ 허겁지겁 너무 맛있게 싹싹 비워냈을 정도로 남펴니, 저 모두 대만족했어요... 특히피셔맨즈 를 이태원 맛집으로 추천하는 이유도 그거에요! 평소 랍스타가 질리고 살짝 질긴 느낌도... ",제이와이 뷰티메뉴얼,https://blog.naver.com/sunkjydbgn,2019-12-27
[괌맛집추천] 괌피셔맨즈 코옵도스버거 후기 (+티갤러리아),https://blog.naver.com/phm902?Redirect=Log&logNo=222538036073,괌 맛집피셔맨즈 코옵도스버거 (+티갤러리아) #괌맛집추천 #괌맛집 # 피셔맨즈 코옵 #도스버거 #티갤러리아 슬슬 위드코로나되면서 괌에 놀러가는 한국인들이 많아졌다길래 2년 전에 갔던 괌 여행 후기 풀기... ,Life Is Journey,https://blog.naver.com/phm902,2021-10-15
[1일차] 미서부여행피셔맨즈워프/금문교/샌프란시스코시청,https://blog.naver.com/sm011sm?Redirect=Log&logNo=221734309236,ㅠㅠ피셔맨즈워프 첫 일정이었던피셔맨즈워프 옛날 어부 선착장에서 지금은 맛난 해산물음식도 맛볼 수 있고 공연 등 놀거리 볼거리가 많은 샌프란시스코 명소 중 하나 건물들이 너무 예뿌당 헷 12월이라... ,밍's 꽁냥꽁냥 스토리,https://blog.naver.com/sm011sm,2019-12-11
이태원역맛집피셔맨즈보일링랍스터 연말모임장소 추천,https://blog.naver.com/ivory27?Redirect=Log&logNo=221727594959,이태원역맛집피셔맨즈보일링랍스터 연말모임장소 추천 이태원 나들이 :) 안녕하세요. 이번주부터... ㅋ 제가 찾아간피셔맨즈 는 아메리칸 씨푸드 레스토랑으로 다양한 해산물 요리를 만나볼 수 있는 곳이에요... ,행복한 곰돌씨 빵가게,https://blog.naver.com/ivory27,2019-12-05
파주맛집 운정신도시피셔맨즈 키친 다녀오다,https://blog.naver.com/whtkdrl21?Redirect=Log&logNo=222196924968,맛집피셔맨즈 키친 건물 1 2층에 주차장이 있다 아직까지는 동네가 한산해서인지 길가에 주차하기도 편하다 입구샷 우드 인테리어로 올드하지 않고 나름 느낌 있다 블루와 우드 조합 나쁘지는 않은데 엄청... ,유료한 일상,https://blog.naver.com/whtkdrl21,2021-01-05
보일링 랍스터 (피셔맨즈밀키트),https://blog.naver.com/frytoto82?Redirect=Log&logNo=222209322002,#홈파티 #코로나음식 #집합금지 #간단한음식 #보일링랍스터 # 피셔맨즈#내돈내산 . . 요즘 같이 춥고... 네이버 검색피셔맨즈 밀키트 찍으면 주문이 아주 쉽답니다! 아이스 박스 오픈 했을때의 포장 입니다 두 가지... ,막자란 고양이...,https://blog.naver.com/frytoto82,2021-01-16
이태원피셔맨즈(Fisherman's) 맛있다:D,https://blog.naver.com/daramjoohee?Redirect=Log&logNo=222081342606,이태원 맛집 탐방피셔맨즈 ! 요즘 퇴근하는 길에 이태원을 자주 지나치는데요. 지난번에 이태원에 갔다가 '다음에 한 번 가보자'했던피셔맨즈 를 방문해 봤어요.피셔맨즈 는 식당 밖에 있는 커다란 새우가... ,달콤한 감성이 자라는 곳,https://blog.naver.com/daramjoohee,2020-09-05
생방송투데이 이태원 보일링 랍스타 쉬림프 대박집피셔맨즈 ,https://blog.naver.com/choigoda?Redirect=Log&logNo=221704649816,"그래서 찾아낸 정답은, ' 피셔맨즈 ' (서울 용산구 이태원로20길 36) 로고가 꽤 이국적입니다. 아래도 써...피셔맨즈서울 용산구 이태원로20길 36 http://naver.me/xVJF3nx #보일링랍스터 #생방송투데이",최고다의 세상 바라보기,https://blog.naver.com/choigoda,2019-11-11
중국 마카오 여행 ●피셔맨즈와프 테마파크 ●,https://blog.naver.com/cho00731?Redirect=Log&logNo=221748645717,"여행 ●피셔맨즈와프 테마파크 ● 세계적으로 유명한 테마마크 브랜드는 디즈니랜드, 유니버설, 시 월드 등이다. 또 이름은 달라도 나라마다 다양한 이름의 테마파크가 있다. 마카오에 있는피셔맨즈와프... ",사랑하는 아내와 세계를 가다,https://blog.naver.com/cho00731,2019-12-25
괌에서 먹는 생참치와 연어회피셔맨즈코옵,https://blog.naver.com/onlyonej?Redirect=Log&logNo=222086339770,괌에서 먹는 생참치와 연어회피셔맨즈코옵 코로나 이전의 삶이 빨리 다시 돌아오길 바라며 맛나라... 판매하는피셔맨즈코옵이라는 곳을 소개하려고 합니다. 괌의 메인 동네에 있는게 아니긴 하지만 꽤나... ,치과의사 닥터자일리톨의 투스토리(Tooth + Story),https://blog.naver.com/onlyonej,2020-09-27
7일차_마마스/알라모스퀘어/유니언스퀘어/ 피셔맨즈 와프/피어39,https://blog.naver.com/funny0820?Redirect=Log&logNo=222058860775,우리숙소인피셔맨즈 와프JW메리어트에서 걸어서 20거리 정도가 나오길래 걸어가기로 했어요~날은... 우리호텔에 주차하고피셔맨즈 와프까지 걸어왔는데 사실 15분정도 거리인데 워낙 5시면 해가 떨어져서 그... ,오달링’s Sweet Day,https://blog.naver.com/funny0820,2020-08-12
샌프란시스코 여행 #6피셔맨즈 워프 피어 39 주변의 오후,https://blog.naver.com/lsh5755?Redirect=Log&logNo=221902161983,상업지구와 바다사자 전망대가 있어서 그런지 피어 39는피셔맨즈워프 지역에서 가장 유명한 장소다.... 여행자는피셔맨즈워프 입구로 들어서 바다사자 전망대 등을 거쳐 자연스레 이곳으로 동선을 짠다.... ,천사는 여행중,https://blog.naver.com/lsh5755,2020-07-14
 피셔맨즈프렌드(Fisherman's Friend),https://blog.naver.com/ddolek?Redirect=Log&logNo=221815764624,영국의 감기사탕이라는피셔맨즈 프렌드 처음 알게된건 예~전에 가족이 베트남에 갔을때 기념품으로 뭐 사다달라고 할게 있나.. 하면서 찾아보다가 있으면 하나 사달라고 한거에서 시작됐음ㅋ 맛 별로 색깔이... ,소소한 일상 혹은 특별한 기억,https://blog.naver.com/ddolek,2020-02-19
[Food] 밀키트 맛집피셔맨즈'보일링 랍스터' 후기,https://blog.naver.com/onsaharu?Redirect=Log&logNo=222504706067,"오늘은 제가 시댁 부모님 생신 파티 때 직접 구입하여 요리하였던피셔맨즈 의 '보일링 랍스터' 구매...피셔맨즈 의 보일링 랍스터'입니다. 파티 음식이 필요하였고, 밀키트 답게 만들기는 쉽되, 후져... ",꾸밈없이 유쾌하게,https://blog.naver.com/onsaharu,2021-09-13
분위기좋은레스토랑 이태원피셔맨즈 에서 연말모임 랍스타... ,https://blog.naver.com/eneblog?Redirect=Log&logNo=221736586462,얼마 전 이태원 분위기좋은레스토랑피셔맨즈 로 사랑하는 동생이랑 랍스타 포식하고 왔어유. 연말에는... 통째로피셔맨즈 인데 엄청 큰 새우가 매달려 있어서 넘나리 귀욥ㅋㅋㅋ 우린 춥고 배고팠던지라 바로... ,으네살롱,https://blog.naver.com/eneblog,2019-12-13
 피셔맨즈프랜드 FISHERMAN’S FRIEND!,https://blog.naver.com/steward0691?Redirect=Log&logNo=222066492240, 피셔맨즈프랜드 FISHERMAN’S FRIEND는 영국에서 만든 사탕으로 유럽에서는 흔히 볼 수 있는 사탕입니다. 1865년 영국의 약사인 LOFTHOUSE가 원양어업을 하는 어부들이 육지로부터 멀리 떨어져 제대로 약도 없을... ,태현이네 이야기 bigdoor,https://blog.naver.com/steward0691,2020-08-21
브리오쉬 뜨기 피셔맨즈뜨기,https://blog.naver.com/jsy365?Redirect=Log&logNo=222537829739,*****#대바늘 뜨기#대바늘#브리오쉬# 피셔맨즈대바늘 변형뜨기 너무 이뻐서 공부했다.. 기본뜨기 외... 2코 @ㅣ -^ ***** 피셔맨즈립#1 1단 크기에 맞게 코잡기3의배수 2단 안뜨기 - 겉뜨기 ㅣ - ㅣ 반복 3단 -도... ,jsy365님의 블로그,https://blog.naver.com/jsy365,2021-10-15
로마에 온 듯한?! 로마 원형경기장이 있는 마카오피셔맨즈와프,https://www.lovely-days.co.kr/3066,"반응형 2019년 11월 약 10년전 쯤, 업무 차 처음으로 마카오에 왔을 때, 마카오피셔맨즈와프의 호텔 내... 그 중, 다음에 가야지하고 미뤘던 마카오피셔맨즈와프에 가보기로 했다. 마카오피셔맨즈와프는... ",앨리스의 여행과 일상,https://www.lovely-days.co.kr/,2021-06-30
이태원 존맛피셔맨즈 에서 보일링랍스터를 먹었어요♬,https://blog.naver.com/shizuka_v?Redirect=Log&logNo=221629402893,"이태원 존맛피셔맨즈 에서 보일링 랍스터를 먹었어요♬ 안녕하세요 시즈카에요:) 주말에 이태원 나들이... 레스토랑,피셔맨즈 에 다녀왔어요 위치는 이태원역 4번출구에서 멀지 않고, 거의 8분정도의 거리? 가게... ",원더시즈카,https://blog.naver.com/shizuka_v,2019-08-26
괌 맛집 : 머드크랩과 랍스터피셔맨즈 코브,https://blog.naver.com/wkwmd81?Redirect=Log&logNo=220986993999,괌 맛집 : 머드크랩과 랍스터피셔맨즈 코브 관광지 돌아다닌것보다 괌 맛집 투어한 사진이 훨 많은... 괌 맛집피셔맨즈 코브는 제가 숙박했던 힐튼호텔 1층에 위치하고 있었어요 날짜별로 할인이벤트도 많이... ,아이와 함께 해외여행 고고씽,https://blog.naver.com/wkwmd81,2017-05-03
「샌프란시스코」 아이와 함께 미서부여행 8일차_ 피셔맨즈 와프... ,https://blog.naver.com/funny0820?Redirect=Log&logNo=222065960082, 피셔맨즈 와프/샌프란시스코케이블카/유니언스퀘어) 어제 하루 5살 아이와 함께 움직여보니 생각보다 일찍 움직이는 것이 낫겠다 싶어서 오늘은 좀 빨리 호텔에서 나왔어요 어제 저녁에 갔던피셔맨즈 와프는... ,오달링’s Sweet Day,https://blog.naver.com/funny0820,2020-08-20
괌 맛집 힐튼호텔피셔맨즈 코브,https://blog.naver.com/euna52?Redirect=Log&logNo=220910474713,"괌 맛집 힐튼호텔피셔맨즈 코브 싱싱한 씨푸드가 먹고싶을때 추천하고픈 괌 맛집피셔맨즈 코브 입니다 힐튼호텔 프리미어타워 1층에 위치한 레스토랑 인데요, 이번 괌 여행에서 먹은 음식 중 젤로 맛있었어요... ",난 트래블 메이커 ♬,https://blog.naver.com/euna52,2017-01-14
괌피셔맨즈 코옵 참치회 연어회 맛있다!,https://blog.naver.com/bluepigk?Redirect=Log&logNo=221228168238,이번 여행에서 제일로 기대했던피셔맨즈 코옵 바로바로 참치회와 연어회를 생으로 맛볼 수 있는... 다 쓰러져가는 컨테이너 박스가피셔맨즈 코옵 가게 ㅋㅋㅋㅋㅋㅋㅋㅋㅋㅋㅋㅋㅋㅋㅋㅋㅋㅋㅋㅋ 외관만 보면... ,율무네집✈,https://blog.naver.com/bluepigk,2018-03-13
괌 둘째날 Kmart :피셔맨즈 코옵 : 이지치즈,https://blog.naver.com/hjhj1214?Redirect=Log&logNo=221387536868,있던 # 피셔맨즈 코옵 연어랑 참치 반반있는 포장되있는 회 사러왔당20 아빠 신남회만먹으면 아쉬우니까 라면도 하나씩 너무 싱싱하다 블루문 빅웨이브 맥주들이 싸서 원없이 먹었다 ㅋㅋ 정말이지 너무... ,최자매 블로그,https://blog.naver.com/hjhj1214,2018-10-29
의정부 민락동맛집파스타맛집피셔맨즈 키친,https://blog.naver.com/ealli128?Redirect=Log&logNo=221457351530," 피셔맨즈키친 의정부 민락점 화덕피자와 파스타 맛집 예전부터 가보고 싶어했던 곳, # 피셔맨즈 키친 민락점을 다녀왔어요. 해산물도 좋아하고, 탱글한 #생면파스타 쓰는 곳이라서 입소문이 났더라구요. 하지만... ",작은햇살들과 함께하는 기다림의 미학,https://blog.naver.com/ealli128,2019-02-03
이태원역 맛집 / 이태원 특색있는 요리피셔맨즈 ,https://blog.naver.com/moon_i20?Redirect=Log&logNo=221104864164,"이태원역 맛집 / 이태원 특색있는 요리피셔맨즈요즘 종종 이태원에서 데이트를하고 있다. 이날은 이태원역 맛집피셔맨즈 에 방문했다.피셔맨즈 는 새우, 크랩, 랍스타등 갑각류 해산물을 가지고 특색있는... ",달로그,https://blog.naver.com/moon_i20,2017-09-25
[2nd 괌] 피셔맨즈 코옵차모로야시장,https://blog.naver.com/jin2u4u?Redirect=Log&logNo=221310871835,이날도 마침 레오가 GPO에서 두시간 가까이 자줘서 폭풍 쇼핑하고 깨자마자피셔맨즈 코옵 찍고 출발ㅋ... 우린 나만 먹을거라 연어회 10불짜리로 샀다 난 레오 유모차 밀며 야시장으로 가고 꽁푠은피셔맨즈 ... ,반짝반짝 빛나는,https://blog.naver.com/jin2u4u,2018-07-02
이태원 새우맛집피셔맨즈 에서 쉬림프롤:),https://blog.naver.com/vivian629?Redirect=Log&logNo=221011676454,이태원역 새우요리피셔맨즈쉬림프롤 맛남:) 친구랑 오랜만에 이태원 나들이!!!!! 새우는 언제나 옳다.. 새우 넘 좋아하는데 새우요리 전문점이 이태원에 있다길래 쉬림프롤 맛보러피셔맨즈 를 방문했당. 외관에... ,잠결에 한 쪽 뺨으로 웃는 여자,https://blog.naver.com/vivian629,2017-05-22
괌여행 괌에 왔다면 참치회가 빠질수없죠피셔맨즈 코옵,https://blog.naver.com/psa9307?Redirect=Log&logNo=221247756356,바로 여기 사진에 보이는피셔맨즈 코옵인데요! ' 마지막날 중부투어를 했던곳 근처에 위치해있어요!피셔맨즈 코옵은 항구 근처에 위치해있어서 저렴하게 회를 판매하나봐요 ㅎㅎ 요 컨테이너가 바로... ,일상속의 작은행복,https://blog.naver.com/psa9307,2018-04-08
"[괌 맛집]피셔맨즈 코옵, Fisherman's Co-op (feat.초장)",https://blog.naver.com/kyungoum?Redirect=Log&logNo=221207931537,"괌 맛집피셔맨즈 코옵 (Fisherman's Co-op) 01 위치 ' åñ :피셔맨즈 코옵 차모로 빌리지, 아가냐 항구 근처에 위치해 있습니다. 02 가게 내외부피셔맨즈 코옵은 어부들 조합으로 어부들이 그날 잡은 물고기를... ",괌에 대한 모든것,https://blog.naver.com/kyungoum,2018-02-13
"샌프란시스코 여행, 꼭 가봐야할 곳인피셔맨즈 워프 나들이",https://blog.naver.com/esswan103?Redirect=Log&logNo=220465465632,"두번째,피셔맨즈 워프 거리를 걸어보고, 그리고 크램챠우더 먹기. 세번째, 그토록 해보고 싶었던 금문교... 하나 하나 이야기를 풀어나가겠지만 오늘은 샌프란시스코 여행에서의 두 번째 위시리스트피셔맨즈 워... ",All is well,https://blog.naver.com/esswan103,2015-08-29
괌 맛집] 괌피셔맨즈코업,https://blog.naver.com/alicia1124?Redirect=Log&logNo=220474126551,괌 맛집] 괌피셔맨즈코업 한국와서 더욱 그리운 괌 맛집 괌피셔맨즈 코업!!! 솔직히 가격대비 정말 괜찮았어요!! 아이스박스만 잘 챙기신다면!!!!! 준비성 없는 쾌녀를 괌 가지전부터 초고추장을 챙겨가게 만든... ,쾌녀's 몸살나는 하루,https://blog.naver.com/alicia1124,2015-09-08
괌피셔맨즈 코옵 - 싱싱한 연어회 맛집,https://blog.naver.com/cksldia93?Redirect=Log&logNo=221601520440,"괌피셔맨즈 코옵 싱싱한 연어회 맛집 괌에서 연어회, 참치회 등 회를 먹을 수 있는 곳인피셔맨즈 코옵! 뚜벅쓰로는 가기 힘든 위치에 있어서 차 빌렸을 때 가서 사오기로 하고 매장을 찾았습니다~ 한 5시? 그 쯤... ",ღ 노는 게 제일 좋아 ღ,https://blog.naver.com/cksldia93,2019-07-31
샌프란시스코 여행 필수 코스 :피셔맨즈 워프 피어 39 바다사자,https://blog.naver.com/wkwmd81?Redirect=Log&logNo=221043324055,샌프란시스코 여행 필수 코스 :피셔맨즈 워프 피어 39 바다사자 샌프란시스코 여행 필수 코스 하면 꼭 가봐야 하는 곳들이 몇곳 있죠 그중에 한 곳인피셔맨즈 워프 피어 39입니다 저는 편하게 빅버스 이용해서... ,아이와 함께 해외여행 고고씽,https://blog.naver.com/wkwmd81,2017-07-04
[괌 맛집] *FISHERMEN'S CO-OP* * 피셔맨즈 코옵*,https://blog.naver.com/miho090909?Redirect=Log&logNo=220752245825,괌맛집 / 괌 자유여행 괌맛집정보 / 괌자유여행정보 괌 피셔맨즈 코옵 /피셔맨즈 코옵 원나잇푸드트립맛집 / 괌 참치회 연어회 * Miya Hoya * 안녕하세요~!! 이번에도 괌 맛집을 포스팅하려고 이렇게 글을 씁니다.... ,@MiNHo_blog,https://blog.naver.com/miho090909,2016-07-03
2017 북해도 여행 - 쿠시로 맛집피셔맨즈 워프무,https://blog.naver.com/jongaes?Redirect=Log&logNo=221071238384,쿠시로시습원전망대를 나와 점심을 먹기 위해서피셔맨즈 워프무라는 쇼핑센터로 향했다. 큰 기대는... 혹시 이 근처를 갈 일이 있다면 산만마 먹으로 여기 다시 가고싶다.피셔맨즈 워프무 맵코드 : 149 226 464,우리는 돌아오기 위해 길을 떠났다,https://blog.naver.com/jongaes,2017-08-10
이태원 맛집피셔맨즈아메리칸씨푸드 즐기기,https://blog.naver.com/awesomeday_?Redirect=Log&logNo=221631238586,맛집피셔맨즈우리를 반기는 왕큰 새우부터 눈에띄더라구용 1층부터 루프탑까지 있어서 요즘같은... 다양했어요:)피셔맨즈메뉴판은 이렇게 탭으로 되어있어서 더 가독성이 좋더라구요! 저희는 보일링쉬림프와... ,빛을 발하는_,https://blog.naver.com/awesomeday_,2019-08-28
마카오피셔맨즈 와프/마카오여행,https://blog.naver.com/bahna2?Redirect=Log&logNo=70114026927,마카오에서 가장 기대했던 곳 중에 하나가피셔맨즈와프입니다. 마카오피셔맨즈와프는 유럽의 향기를 가장 많이 느낄 수 있는 곳 중 하나인데 제가 갔던 날은피셔맨즈 와프 안의 거리가 조용하고 아직 문을... ,Travel portfolio,https://blog.naver.com/bahna2,2011-07-21
괌 맛집 / 힐튼 괌피셔맨즈코브 Fishemans Cove,https://blog.naver.com/shootar?Redirect=Log&logNo=120175028841,"괌 맛집 / 신선한 해산물이 가득한, 힐튼 괌피셔맨즈코브 Fishemans Cove 그 동안 괌 여행기를... 오늘 소개할 괌 맛집은 바로피셔맨즈코브 Fishemans Cove 입니다.피셔맨즈코브 Fishemans Cove 는 힐튼 괌 리조트... ",홍차왕자의 비밀지도 ✈️,https://blog.naver.com/shootar,2012-12-05
[캐나다 빅토리아 맛집]피셔맨즈와프의 밥스 피쉬앤칩스,https://blog.naver.com/euna52?Redirect=Log&logNo=220141398902,[캐나다 빅토리아 맛집]피셔맨즈와프의 밥스 피쉬앤칩스 빅토리아에서 젤 맛있는 피쉬앤칩스를 판다는 밥스 피쉬앤칩스 입니다 어제 포스팅한피셔맨즈워프에 있는 자그만 부스 에요 이 집앞에 사람들이... ,난 트래블 메이커 ♬,https://blog.naver.com/euna52,2014-10-10
이태원 새우맛집 : 이태원피셔맨즈Fishermans 리뷰,https://blog.naver.com/apexism?Redirect=Log&logNo=221179846356,"이태원 새우맛집 : 이태원피셔맨즈Fishermans 리뷰 가족과 함께 맛잇는 새우 요리를 먹기 위해... 그리고 이집의 대표 메뉴라고 할 수 있는피셔맨즈타이거 쉬림프(\28,000)을 시켰다. 오동통한 새우를 가운데 있는... ",The 재미있게 살기 (더재살),https://blog.naver.com/apexism,2018-01-07
[18개월 아기와 여행하기] 괌맛집_ 피셔맨즈 코브_맛있다!메뉴 등..,https://blog.naver.com/puishi?Redirect=Log&logNo=221200949743,힐튼리조트안에 있는피셔맨즈 코브였다!(기대이상) 기대를 너무 안해서 그런가..ㅎㅎ 맛있었다! 예쁜 벽쪽이 바로피셔맨즈 코옵 (우리는 식사 마치고 찍은터라..ㅎㅎ) 노오란 문을 열고 들어가면 된다!... ,엠제이의 이것저것,https://blog.naver.com/puishi,2018-02-07
"샌프란시스코 여행,피셔맨즈 워프 거닐며보딘카페에서... ",https://blog.naver.com/1978mm?Redirect=Log&logNo=220406638120,기라델리 초콜렛의 달콤함에 빠졌던 우리는 기라델리 스퀘어를 시작으로 본격적인피셔맨즈워프 Fisherman's Wharf 를 둘러봅니다.피셔맨즈워프는 '어부의 부두'라는 의미로서 19세기 제노바 등 이탈리안에서 온... ,배짱이의 여행스토리 ▒ 배짱두둑한 여행블로거 ▒,https://blog.naver.com/1978mm,2015-07-01
마카오를 가다4피셔맨즈 와프,https://blog.naver.com/dannie421?Redirect=Log&logNo=110012289567,마카오 페리 터미널에서 가까운 곳에 마카오에서 유명한 샌즈카지노와피셔맨즈 와프가 있습니다. 마카오 관광 포인트 4.피셔맨즈 와프입니다.피셔맨즈 와프는 일종의 테마파크인데 3가지 주제의... ,글쓰고 사진찍고 디자인하는 데니 블로그 :D,https://blog.naver.com/dannie421,2006-12-20
