title,link,description,bloggername,bloggerlink,postdate
 숙대묵은지참치김밥으로 유명한한입소반: 모든 메뉴 다... ,https://blog.naver.com/puput122?Redirect=Log&logNo=222535768394,이영자 맛집으로도 이미 유명한숙대한입소반이전에 진혁형부 찬스를 써서 여행 갈 때 한차례... 원산지 표시도 잘 나와있고 이제는 체인점으로숙대 입구점( 본점 ) 말고도 압구정 갤러리아 백화점에서도 쉽게... ,믿고 먹는 봉이로드,https://blog.naver.com/puput122,2021-10-13
[ 숙대 입구역맛집]한입소반-숙대한입소반묵은지참치김밥!,https://blog.daum.net/wirbel/15524184,숙대입구역 맛집한입소반 숙대본점숙대 한입소반은 2014년에 천원김밥(1000원김밥)으로 개업했고... (0) 2020.03.17 [가락시장역] 옹아리벌교참꼬막과찜마을 본점 (0) 2020.03.05 [천호동] 엄마손만두... ,비어벨이 다녀온 맛집,https://blog.daum.net/wirbel,2020-03-24
" 숙대 입구 맛집: 구복만두,한입소반 ",https://blog.naver.com/sgw0301?Redirect=Log&logNo=221832192743,컨셉에 맞춰서숙대 입구 내려가서 구복만두랑한입소반먹자고 내가 노래를 불렀던게 생각나서 드디어... 섰고본점 이니까 사먹기로 합니다 우리 보다 먼저 들어간 사람들이 나오면서 헉 너무 무거워;;;; 이러고... ,오늘의 달,https://blog.naver.com/sgw0301,2020-03-01
" 숙대한입소반메뉴 가격 정보, 이영자 묵은지김밥 맛있네요~",https://blog.naver.com/sjhong96?Redirect=Log&logNo=222256126108,전참시 이영자 맛집한입소반 숙대 본점숙대 근처에 왔으니 당근 맛집 투어를 해야겠지?ㅎ 전참시에서 이영자씨가 맛나게 먹던 김밥이 있다. 한입 소반의 묵은지참치깁밥. 숙대앞이 본점이다. 입구 메뉴판에... ,오늘이 가장 젊은날!,https://blog.naver.com/sjhong96,2021-02-25
 숙대한입소반묵은지참치김밥,https://blog.naver.com/wlslvk85?Redirect=Log&logNo=221986392507,"6월10일에한입소반 숙대본점 이 확장이전을 한다고 하네요 지금 매장과 그리 멀지 않은것같더라구요 한입소반은 숙대뿐만 아니라 서고터점, 일산점도 있다는 말씀 ! 확장이전을 하면 예전보다 조금 덜... ",먹스럽고 돼지런한 일상,https://blog.naver.com/wlslvk85,2020-06-01
 숙대 앞 김밥집한입소반 .묵은지참치김밥과 제육김밥,http://totheno1.egloos.com/4184433,용산쪽이 일이 있어 들른김에 가본 김밥집한입소반 입니다. 전지적 참견 시점에서 이영자가 추천한... 인기가 많아져 지금은본점 인숙대외에도 고속터미널과 정발산역 쪽에 지점이 있다고 합니다. -.자른... ,다인의 편의점 이것저것,http://totheno1.egloos.com/,2020-05-25
 한입소반 숙대 본점 (soulfood) 다섯 번째 방문 - 라인시스템,https://blog.naver.com/junyeli89?Redirect=Log&logNo=222476097258,달려가겠습니다 ^^ # 한입소반숙대본점#한입소반숙대점 #용산구청파로47길1 #한입김밥 #027014417 #묵은지김밥 #묵은지참치김밥 #충무김밥 #한입소반 #SOULFOOD #라인시스템 #LINESYSTEM #0226953514 #***********,출입통제시스템·02-2695-3514·라인시스템,https://blog.naver.com/junyeli89,2021-08-19
[용산 청파동]숙대맛집한입소반-숙대가면 묵참 필수... ,https://blog.naver.com/h_yeeun94?Redirect=Log&logNo=222393654516,나만 알고 싶은 #숙대맛집 이지만 나만 알면 안되니께.....! 잘된 일이다ㅋㅎ한입소반 숙대본점위치... ^^.... 다음에 숙대 놀러가면 또 포장해와야지! 명불허전한 한입소반 숙대 맛집으로 강추드립니다~!~~~!,Yenny_Blog,https://blog.naver.com/h_yeeun94,2021-06-11
[ 한입소반본점 / 숙대 ]숙대 입구역숙대 맛집숙대 탐방기 3... ,https://blog.naver.com/seowon301?Redirect=Log&logNo=221995750799,"다른 건 다 4,000원이고 그냥김밥은 2,500원 충무김밥은 7,000원 이에요 줄 서면서 보니까 # 숙대 입구맛집 # 숙대한입소반은 MSG 나 설탕 등의 재료를 쓰지 않는다고해요! #건강맛집 이네요-! 당뇨, 고혈압 등의... ",Dong._.it,https://blog.naver.com/seowon301,2020-06-10
 숙대전참시 맛집한입소반묵은지참치김밥,https://blog.naver.com/sunnynight_?Redirect=Log&logNo=222340641359,숙대한입소반 #숙대맛집추천 #이영자맛집 #전참시맛집 #묵은지참치김밥 #시래기김밥 #전참시이영자김밥 # 한입소반숙대본점#생활의달인맛집 #김밥맛집 #전참시이영자맛집 #묵참 #전참시김밥 #한입소반본점,소소한 하루 기록,https://blog.naver.com/sunnynight_,2021-05-06
[숙대찐맛집][서울역맛집]한입소반 숙대본점 ,https://blog.naver.com/jjuxxi?Redirect=Log&logNo=222342816150,# 한입소반# 숙대 맛집 #숙명여대맛집 # 숙대 입구역 #김밥맛집 # 숙대 김밥 #서울역근처맛집 #서울역 #이영자추천김밥 #전참시 #묵은지참치김밥 #시래기김밥 #크림치즈김밥 #전지적참견시점 #간편식한입소반 ... ,비글어르신,https://blog.naver.com/jjuxxi,2021-05-08
[ 숙대 맛집] 전참시 이영자 추천 묵은지참치김밥한입소반 ,https://blog.naver.com/pinkrabbit-house?Redirect=Log&logNo=222239639013, 한입소반 숙대본점서울 용산구 청파로 45길 3 1층 오늘은 전지적참견시점 이영자가 소개하여 한껏 인기 넘치고 유명한 묵은지 참치김밥 소개합니다 알고보니 숙대입구역쪽에 위치한 한입소반이라는 곳입니다.... ,통계쟁이 토끼씨의 바른 일상,https://blog.naver.com/pinkrabbit-house,2021-02-10
이영자김밥 묵은지참치김밥숙대한입소반후기,https://blog.naver.com/rkdls7710?Redirect=Log&logNo=222324064020," 숙대 본점한입소반서울 용산구 청파로45길 3 1층 매일 07:00 - 19:00 명절, 여름휴가 만 휴무 전지적참견시점에서 이영자가 추천했던 김밥집한입소반 ! 작년에 처음 방문했었는데 너무 맛있어서숙대 쪽 들를때마다... ",토 토 블 로 그,https://blog.naver.com/rkdls7710,2021-04-26
 숙대한입소반이영자 김밥으로 유명한 묵은지참치김밥 맛봤다,https://blog.naver.com/saejaese?Redirect=Log&logNo=222271769001,숙대 한입소반에는 김밥을 먹을수 있는 테이블이 따로 있지 않더라구요 그리고 지금은 코로나19로... 내가 사먹은 한입소반 김밥 입니다.한입소반 숙대본점서울특별시 용산구 청파로 45길 3 1층,Grace's Pick,https://blog.naver.com/saejaese,2021-03-11
[ 숙대 / 숙대 입구역] ' 한입소반 '과 '구복만두'로 한끼 뚝딱 |숙대 ... ,https://blog.naver.com/wevebeensummer?Redirect=Log&logNo=222172039956,여기에 떡볶이도 있으면 완벽할거 같다. 없어도 이미 맛있고 배부를거라는거~~~~~~~! (+) 구복만두와한입소반모두숙대 본점 을 다녀왔지만 파주에 직영점도 있음 !-! COPYRIGHT © wevebeensummer,Forest of thing and nothings,https://blog.naver.com/wevebeensummer,2020-12-13
 숙대한입소반시래기김밥 내돈내산 찐후기 ( 한입소반 메뉴),https://blog.naver.com/fromrami?Redirect=Log&logNo=222426555622,주변에 애청자가 많아 덕분에 맛있는 음식을 맛볼수 있는 기회가 있네요 ㅎㅎ숙대 입구 초입에 위치한한입소반본점주소! 서울특별시 용산구 청파로45길 3 1층한입소반 에 들어와 이 곳에서 멀뚱멀뚱 주문을... ,프롬라미,https://blog.naver.com/fromrami,2021-07-10
 숙대한입소반퀄리티 좋은 묵은지참치김밥,https://blog.naver.com/covvooo?Redirect=Log&logNo=222409548698,숙대 한입소반에 가서 포장해왔다. 숙대입구역 8번출구로 나와 지하도를 지나서 길을 건너면 바로 보인다. 지하철 역으로부터 4~5분 안에 도착할 수 있는 거리라 찾아가기 쉬웠다.한입소반 숙대 본점주소... ,백구와뿌꾸,https://blog.naver.com/covvooo,2021-06-25
[ 숙대본점 ] 맛김밥 “ 한입소반 ”,https://blog.naver.com/jptera0202?Redirect=Log&logNo=222268989260,이사한숙대한입소반명절 여름휴가만 쉼 오픈키친은 세로말고 가로였음 보기엔 더 좋았을 거 같은데 머 나름의 이유가 있게쮸한입소반이사하고 김치판매를 하더이다 부가창출 최고!!! 결국 세줄 내사랑... ,Tera님의 블로그,https://blog.naver.com/jptera0202,2021-03-09
김밥의 어나더 레벨...숙대 입구한입소반( '-')b,https://blog.naver.com/jamong_baebae?Redirect=Log&logNo=222172215520,' 숙대본점 '인 이유는 - 최근에 일산 정발산역에 분점이 하나 생겼기 때문. 새로 생긴 그 곳도 평이 좋은... 이숙대 입구한입소반 은 짭쪼롬하고 풍성하니 대중적으로 맛 없을 수 없는 그런 맛이랄까. 그만큼 취향... ,왕귤네 수납장,https://blog.naver.com/jamong_baebae,2020-12-13
[리뷰] 용산숙대한입소반/ 전참시 이영자 추천 맛집... ,https://blog.naver.com/01193992078?Redirect=Log&logNo=222220809342,"묵은지 참치김밥으로도 유명한 숙대 한입소반 입니다!!한입소반 숙대 본점02-701-4417 주소 서울 용산구 청파로 45길 3 1층 4 숙대 입구역 8번 출구에서 207m 영업시간 매일 07:00 - 19:00 명절, 여름휴가만 휴무... ",꽃분이의 발걸음,https://blog.naver.com/01193992078,2021-01-26
/ 숙대 입구역 빵집 몽소/전참시... 묵은지참치김밥 맛집한입소반 ,https://blog.naver.com/jinny_jin2?Redirect=Log&logNo=222276671738,포장하러한입소반 숙대본점왔어요~~ 매일 07:00 - 19:00 02-701-4417 청파동 김밥맛집 한입소반 주문... 생크림 듬뿍~ 폭신폭신하니 맛있다~ 숙대에서 산 한입소반 김밥이랑 드림랜드 떡볶이 먹고싶었는데.. 하필... ,JINI World,https://blog.naver.com/jinny_jin2,2021-03-15
"냉면집, 오복함흥냉면(ft.이영자전참시김밥,숙대한입소반 )",https://blog.naver.com/0826kja?Redirect=Log&logNo=222022968030,"전 ' 숙대 입구의 김밥 맛집, 이영자 전참시 김밥 맛집'이라는 ' 한입소반 '에 들렀다 이영자 전참시 김밥 맛집이라는, '묵은지김밥'이 유명하다고 한다 키오스크에서 '참치묵은지김밥' 한 줄을 주문하고 기다리는중... ",카스테라**,https://blog.naver.com/0826kja,2020-07-06
[ 숙대 입구] 한입소반 /전참시 이영자 묵은지김밥 먹어봤어요,https://blog.naver.com/dnwjm?Redirect=Log&logNo=222315943839,안녕하세요:-) 오늘은 숙대에서 정말 유명한 김밥집인 한입소반 김밥을 먹어본 후기에요 기대많이했는데 기대만큼 맛있었어요 배달주문도 받는곳이라 배달주문으로 먹었어요한입소반 숙대본점 에서... ,단이랑 모비로그,https://blog.naver.com/dnwjm,2021-04-19
" 한입소반김밥/숙대 입구역 8번출구 / 묵은지참치김밥 4,0... ",https://blog.naver.com/tripblog2020?Redirect=Log&logNo=222258982561,커요한입소반 숙대본점#한국인의 김치!! 우리의 위대한 유산입니다. 19가지 김치가... 2. 2. #SBS생활의달인 614회 2018. 3. 12 #한입소반 #한입소반 # 한입소반 # 숙대본점서울 용산구 청파로45길3 1층,여행 블로그,https://blog.naver.com/tripblog2020,2021-02-27
서울 서울역/ 숙대 입구역 가성비 맛성비 [ 한입소반본점 ] 포장,https://blog.naver.com/psjj5562?Redirect=Log&logNo=222234282008,생각보다 많이.크세요 고객님 왐마야 섹시 바디샷 호우 매끈매끈 #서울김밥 #김밥맛집 # 한입소반#이영자김밥 #이영자묵은지김밥 # 숙대한입소반# 숙대 묵은긴밥 #서울맛집 #포장맛집 #가성비맛집 #근처맛집... ,오돌뼈의 파워없는블로그,https://blog.naver.com/psjj5562,2021-02-06
[용산/ 삼각지/ 숙대 입구]전참시 이영자의 김밥맛집한입소반 ,https://blog.naver.com/joycham?Redirect=Log&logNo=222008384909,맛집한입소반전참시 이영자가 추천한 묵은지 김밥 / 전지적참견시점 39회 [용산 / 삼각지 /숙대 입구...한입소반 청파 본점# 한입소반 김밥 # 한입소반#청파동맛집 #용산맛집 #삼각지맛집 #이영자추천맛집... ,행복하고 맛있는 인생,https://blog.naver.com/joycham,2020-06-22
 숙대묵은지김밥 참치김밥 맛집한입소반 ,https://blog.naver.com/sum2_?Redirect=Log&logNo=221849550410,근처도 아닌 곳 갔다가 일부러 돌아 방문한숙대한입소반뭔가 바뀐 것도 같고?한입소반검색하니까... 날개 달은한입소반이제 그쪽 가서 먹어도 좋겠지만본점 이란 게 또~ 메뉴는 이러하고용... ,해피바이러숨,https://blog.naver.com/sum2_,2020-03-12
" 숙대한입소반 , 전참시 이영자 묵은지김밥 맛집",https://blog.naver.com/goodthingshere?Redirect=Log&logNo=222490277427," 숙대 본점 뿐만 아니라 일산, 평촌에도 지점이 있다고 하니 기회가 되면 한번 방문해보세요숙대한입소반주소 서울시 용산구 청파로45길 3 1층 영업시간 매일 7:00 ~ 19:00",Good things here,https://blog.naver.com/goodthingshere,2021-08-31
 숙대 입구 김밥/한입소반(묵은지참치김밥),https://blog.naver.com/nabi_64?Redirect=Log&logNo=222275074137,전참시 이영자픽 김밥한입소반참치김밥을 정말 사랑하는 저! 예전에 나왔지만 전지적참견시점 에서 나온 묵은지참치김밥 이 먹고 싶어 찜콩해둔 곳 주황색 간판이 멀리서도 보이네요숙대 가본점 이고 최근에... ,복스레 여사,https://blog.naver.com/nabi_64,2021-03-14
 숙대 /서울역/남영역] 청파동 이영자 묵은지참치김밥한입소반 ... ,https://blog.naver.com/dldltmf69?Redirect=Log&logNo=222060278236, 숙대본점한입소반 이 제일 맛있대요! 다른데는 별루래여! 김밥 뭔가 2퍼 모자른맛? 짜잔~~~제가 찾앗습니다아!! 입구 들어가시면 오른쪽에 기계 2개가잇어요! 여기는 무조건 포장!! 만 되는듯!! 저는... ,디헤&selly 로그,https://blog.naver.com/dldltmf69,2020-08-14
전참시 이영자 묵은지김밥숙대 입구역 키토김밥 맛집한입소반 ,https://blog.naver.com/taupo2002?Redirect=Log&logNo=222348597704,전참시에서 이영자님이 극찬한한입소반 ! 찐 키토김밥 맛집입니다. 맛이 평범하지 않아요.숙대 입구역이본점 이라고 합니다. 오늘같이 피크닉 가기 좋은날 묵은지 키토 김밥 딱입니다.,손매워파워 빛나는 후반전,https://blog.naver.com/taupo2002,2021-05-12
[ 숙대 입구]한입소반; 이영자 묵은지참치김밥숙대맛집,https://blog.naver.com/bbubblee?Redirect=Log&logNo=222440294070,"지금은숙대 입구본점 이 있고, 안양 평촌점이 있는것 같아요 매콤멸치김밥도 괜찮았었는데 그래도한입소반 은 뭐니머니해도 묵참♥ - 묵은지참치김밥 추천숙대 맛집한입소반묵인지참치김밥 어때요? 여러분의... ",마음은 방울방울,https://blog.naver.com/bbubblee,2021-07-22
동네사람 +숙대 입구한입소반(feat. 이영자김밥) + 신용산... ,https://blog.naver.com/zihye9000?Redirect=Log&logNo=221727747590,"ㅋㅋㅋㅋ 된장찌게, 고추장찌게 하나씩 시켰는데, 와우, 서울본점 에만 있다는 고추장찌게 맛에 홀딱... 오랜만에 # 한입소반#주말출근원정대 를 위한 김밥셔틀 ㅎㅎㅎ #이영자김밥 으로 유명한... ",엘리신의 지름신,https://blog.naver.com/zihye9000,2019-12-05
 숙대한입소반용산 김밥집 묵은지 참치김밥,https://blog.naver.com/ju13cu?Redirect=Log&logNo=222434767296,묵은지참치김밥이 맛있는곳이라는데 숙대본점이라고해요 가게이름은 한입소반! 왠지 한정식집 같은... 근처 숙대가 있어서 학생들이 포장해서 먹기편한곳이였어요~~!한입소반 숙대본점전화:02-701-4417 주소... ,"맛집 찾기, 일상 블로그♡",https://blog.naver.com/ju13cu,2021-07-17
[ 숙대 입구] 한입소반 _묵은지참치김밥,https://blog.naver.com/zitndus2?Redirect=Log&logNo=222262262870,안녕하세요 셔닝이에요 저녁에 엽떡이랑 먹을 김밥을 포장하러 방문했어요한입소반운영시간 7:00 ~ 19:00숙대입구에한입소반본점 이 있어요 원래는 다른 곳이었는데 근처로 이사를 왔어요 원래도 유명했던... ,셔닝 블로그,https://blog.naver.com/zitndus2,2021-03-02
[서울/ 숙대 입구/용산]한입소반 숙대 입구 본점묵은지김밥... ,https://blog.naver.com/wsh6083?Redirect=Log&logNo=222255889584,오늘은 남영맛집숙대 입구맛집 용산맛집 이영자맛집 이영자김밥한입소반 숙대 입구 본점소개해드립니다. Previous image Next image Previous image Next image Previous image Next image... ,WOW,https://blog.naver.com/wsh6083,2021-02-25
[ 후기 ] 나만 몰랐던숙대김밥맛집 -한입소반(feat. 전참시),https://blog.naver.com/xmflvmfberry?Redirect=Log&logNo=222505309920,[ 후기 ] 나만 몰랐던숙대김밥맛집 -한입소반(feat. 전참시) 최근 뚱뚱한 김밥을 먹고싶어서 여기저기... 또 마침 여기가본점 이라 망설임없이 방문했다. 주문은 주로 키오스크 통해서 할 수 있다. 안쪽에 한대... ,이것저것 공유하기,https://blog.naver.com/xmflvmfberry,2021-09-14
일산 정발산한입소반이영자 묵은지참치김밥,https://blog.naver.com/kizaki56?Redirect=Log&logNo=222518090139,"이야기는 많이들 들어보셨을텐데 혹시나 아직 안 드셔보셨다면 꼭 먹어보세요~ 총평 일산 정발산한입소반에서 또 맛있는 김밥 먹고 왔어요.숙대 에본점 을 둔, 이영자님의 전참시 덕분에 유명해진 김밥입니다.... ",몽몽의 먹어야 사는 블로그,https://blog.naver.com/kizaki56,2021-10-08
"이영자 추천 맛집한입소반본점묵은지 김밥, 묵은지참치김밥... ",https://blog.naver.com/min37min?Redirect=Log&logNo=222464592831,ㅎ숙대 입구역이구요본점 이에요 외관과 내부 테이크 아웃 전문이에요 ㅎㅎ 참고하고 방문하세용 ㅎㅎ... 따로 말씀을 안 해주셔서 몰랐는데 견과류가 있더라고요 ㅎㅎ한입소반본점후기를 정리해보았습니다.,우주세상,https://blog.naver.com/min37min,2021-08-10
" 한입소반 ,숙대명물이 평촌에도!",https://blog.naver.com/iameunkim?Redirect=Log&logNo=222338722671,"묵은지참치김밥 4,500원 바 형식으로 매장 안에서 원래는 취식이 가능한 것 같았는데 코로나라 막아두신 것 같았고, 집으로 와서소반위에한입 소반차리긔 좋은 건 크게!본점 이랑 동일한 맛. 오히려 이동... ",빛나는 오늘의 나,https://blog.naver.com/iameunkim,2021-05-05
묵은지참치김밥 먹으러 고양페이 되는 일산한입소반 에 다녀온... ,https://blog.naver.com/fresh102?Redirect=Log&logNo=222368380877,그리고 숙대본점 한입소반은 사람이 너무 많아서 지나가다가도 뭔가 싶어서 돌아볼 정도인데 한입소반... 김밥 #한입소반주차한입소반 숙대본점 이 궁굼하시다면 아래 포스팅 고고 ↓↓ https://blog.naver.com... ,En Christos,https://blog.naver.com/fresh102,2021-05-26
 숙대 입구한입소반묵은지참치김밥 필수 추천메뉴,https://blog.naver.com/someday3616?Redirect=Log&logNo=222214570959,"오랜만에 생각난 이 집, 한입소반 저는 이쪽으로 이전하기 일주일 전인가 가서 사먹고는 한참만에 다시...한입소반 숙대본점전참시 이영자김밥으로 인기가 여전하더라구요~ 원래도 인기있는... ",lattegirl네 행복한 이야기♥,https://blog.naver.com/someday3616,2021-01-21
이국적인숙대 입구 맛집 모음,https://blog.naver.com/zenartist55?Redirect=Log&logNo=222382636193,잘익은 칼국수를한입먹어봤어요. 탱글탱글한 면과 그사이로 잘베인 국물 맛이 마무리로 먹기에 완벽했답니다~ 이국적인 인테리어와 한국과 중국의 퓨전요리를 맛볼 수 있었던숙대 입구 맛집이에요.... ,먹방토끼,https://blog.naver.com/zenartist55,2021-06-03
이영자 언니 추천 맛집 묵은지참치 김밥 :한입소반 ,https://blog.naver.com/amh5083?Redirect=Log&logNo=222462803777,#묵은지참치김밥 #이영자맛집 방송에서만 보던 영자언니 픽 맛집을 가본적은 이번이 처음이라 조금 설렜어요 그럼 바로 소개해볼게요한입소반 위치한입소반 숙대 본점위치는 4호선 숙대입구역 8번출구에서... ,민달이네,https://blog.naver.com/amh5083,2021-08-09
전참시 이영자픽 묵은지참치김밥한입소반 ,https://blog.naver.com/oldlove1232?Redirect=Log&logNo=222395481509,숙대에있는 한입소반 김밥 테이크아웃하기로..! 애견동반은 정말 힘드롱...한입소반 숙대본점매장 숙대본점 Am 7:00 ~ Pm 7:00 명절 / 여름휴가 제외 공휴일 정상영업! 전참시 영상이 밖에 틀어지고 있음... ,쩡이의 사소한 일상들,https://blog.naver.com/oldlove1232,2021-06-12
[전참시 이영자 김밥]한입소반평촌점 :: 묵은지참치김밥,https://blog.naver.com/whrhwhdoo?Redirect=Log&logNo=222273317563,"031-422-4417숙대본점 , 평촌점, 일산점 위치는 평촌 이마트 사거리 더샾 방향 건물 1층에 위치해 있어요. 전참시에서 이영자씨가 드시고 인기 많아진한입소반 ! 우연히 한번 먹었는데 계속 생각나서... ",This moment,https://blog.naver.com/whrhwhdoo,2021-03-13
