title,link,description,bloggername,bloggerlink,postdate
"빵솜이랑 군산 여행 2편.한일옥 , 초원사진관, 고우당",https://blog.naver.com/hyehwa_alice?Redirect=Log&logNo=222536403801," 한일옥 , 초원사진관, 고우당 안녕하세요~ 혜화동엘린 윤재원입니다. 오늘은 빵솜이랑 군산 여행 2편을... 일단 해장부터 하자는 생각으로 아침 7시 50분 경한일옥 으로 향했습니다. 근데한일옥바로 앞에가... ",혜화동 앨자매ll혜화동 엘린,https://blog.naver.com/hyehwa_alice,2021-10-14
"군산 1박 2일여행 맛집 리스트( 한일옥 ,올리브 튀김,이성당... ",https://blog.naver.com/jully7537?Redirect=Log&logNo=222370774476,"군산 1박 2일 여행 맛집 리스트 (1)한일옥영업시간: 6시~20시 30분 메뉴: 소고기뭇국 가격: 9,000원 별점:⭐️⭐️⭐️ 군산한일옥메뉴 군산한일옥소고기뭇국 새벽 6시에 출발해서 군산에서 먹은 첫끼는... ",so simple,https://blog.naver.com/jully7537,2021-05-27
"우정명태,한일옥 , 초원사진관, 일본식가옥, 새만금방조제",https://blog.naver.com/j_yun93?Redirect=Log&logNo=222522078258,"2021 군산, 무계획 1박2일 식도락 커플여행 / 은파호수공원 카페 산타로사, 우정명태,한일옥 , 초원사진관... 이정도면 거의 술마시러 간 여행 다음날 속 뒤집어진 오빠를 위해 해장하러 간 군산한일옥웨이팅... ",윤쿠잉의 스윗메모리,https://blog.naver.com/j_yun93,2021-09-30
군산 여행 1박2일 초원사진관한일옥군산과자조합 동국사,https://blog.naver.com/gyubin0804?Redirect=Log&logNo=222286035960,후한일옥 에서 밥부터 먹었는데 그 앞이 군산 여행 필수 코스인 초원사진관8월의 크리스마스... 군산한일옥입구 2.한일옥전북 군산시 구영3길 63 매일 06:00 - 20:30 / 명절 휴무 21:30 마감 입구로 들어가면... ,빈블리 뷰티라이프,https://blog.naver.com/gyubin0804,2021-03-24
[군산 한식 맛집/ 군산 한식 맛집 추천]한일옥 ,https://blog.naver.com/juyean123?Redirect=Log&logNo=222424604537,이번 포스팅은 군산 한식 맛집인한일옥후기예요 군산 한식 맛집한일옥 은 영화 8월의 크리스마스 촬영지인 초원사진관 바로 앞에 위치해있어요 그래서 저도 초원사진관에 들린 후에한일옥 으로 갔답니다... ,일상 블로그♡,https://blog.naver.com/juyean123,2021-07-08
군산한일옥소고기무국 맛집으로 유명한 곳 방문 후기,https://blog.naver.com/yunmisense?Redirect=Log&logNo=222409745484, 한일옥소고기무국 맛집으로 유명한 곳 방문 후기 안녕하세요. 윰미 입니다. 군산 여행 다녀온지가 언젠데 아직도 포스팅을 하다니.....!!!! 너무 느릿한 제자신 반성합니다 ㅎㅎㅎ 군산 여행에서 군산한일옥 을... ,윰미의 신나는 일상 ♪,https://blog.naver.com/yunmisense,2021-06-25
"[국내/군산] 군산의 핫플레이스들('째보식당', '복성루', ' 한일옥 ')",https://blog.naver.com/credit35?Redirect=Log&logNo=222492704430,"혼자 떠난 여행에서 군산하면 유명하다는 이성당, 지린성,한일옥 을 들르지 않았다. 하지만 이번에 함께... 복성루 짬뽕(9,000원) 그 다음날 점심 메뉴로 친구가한일옥 을 제안했다. 소고기무우국이 그래봤자... ",이야기 공작소,https://blog.naver.com/credit35,2021-09-06
((전북군산// 한일옥 )) 누구나 다... 가능한 소고기무우국 ✿ 한일옥 ,https://blog.naver.com/shalara_mint?Redirect=Log&logNo=222422717014,군산에서 유명하다는한일옥 을 가보기로 했어요! 군산 소고기무국 전문점/한일옥주소: 전북 군산시 구영3길 63 영업시간: 매일 6시-저녁8시30분 / 명절 휴무 문의: 063-446-5491 저희가 여섯시에서 일곱시사이에... ,누동이는 누동누동해 :D,https://blog.naver.com/shalara_mint,2021-07-06
군산한일옥소고기 뭇국 맛집,https://blog.naver.com/is9759?Redirect=Log&logNo=222350508409,^^한일옥주 소 :전북 군산시 구영3길 63 (우)54022 지 번 : 신창동 2-1 영업시간 : 매일 03:00 ~ 21:30 휴무일... 이 식당의 이름은한일옥 입니다. 맛있는 녀석들 말고도 여러 프로그램이 나왔더라구요~ 이미 맛집으로... ,self service,https://blog.naver.com/is9759,2021-05-14
군산 소고기무국 맛집한일옥 ,https://blog.naver.com/dodud3016?Redirect=Log&logNo=222448513376,군산 소고기무국 맛집한일옥여행기를 시작하기전에 맛있게 먹은 맛집 포스팅을 먼저 시작해야지ㅎ_ㅎ... 유명한한일옥 이다 방송에도 많이 나왔고 이미 군산에서는 유명한집이다! 식당이아니라 어디 관람하러... ,깨어있는 삶,https://blog.naver.com/dodud3016,2021-07-28
군산 근대화거리 맛집한일옥 에 푹빠진날,https://blog.naver.com/ikqm77?Redirect=Log&logNo=222346465919,맛집인한일옥 입니다. 집의 분위기부터가 남다르지요? 특히 제가 이 일대에 있는 다른 군산 근대화거리 맛집을 제쳐두고 여길로 온 이유중에 하나는 바로한일옥바로 앞이 영화 8월의 크리스마스의 촬영지로... ,바니아빠의 육아일기,https://blog.naver.com/ikqm77,2021-05-11
군산 맛집한일옥/ 서천 가볼 만한 곳 장항스카이워크... ,https://blog.naver.com/alswldi57?Redirect=Log&logNo=222520919733,"[ 여행 ] 군산 맛집한일옥, 서천 장항스카이워크 장항송림산림욕장 © 고구밍지 강원도 다음으로 많이... 제일 먼저 들른 곳은 군산한일옥소고기무국으로 유명한 군산 맛집이다. 소고기뭇국 하나랑 시래기국... ",밍지로그,https://blog.naver.com/alswldi57,2021-09-29
군산 드라이브 시간여행마을코스 초원사진관한일옥 ,https://blog.naver.com/youliyan?Redirect=Log&logNo=222481992448,군산 드라이브 갔던 시간여행마을코스에서 만난 초원사진관과 바로 앞한일옥 에서 아침식사. 부모님... 몇년전 동생들이랑 왔을때도한일옥 에서 점심을 먹고 군산 골목여행을 했었는데 말야. 이렇게 오게... ,내가 만드는 일상,https://blog.naver.com/youliyan,2021-08-24
군산한일옥소고기무국 / 깔끔한 맛 / 맞은편에 초원사진관,https://blog.naver.com/krworker?Redirect=Log&logNo=221963792987,"군산의 대표 맛집,한일옥원래도 방송에 많이 나온 오래된 맛집인데 최근에는 맛있는녀석들에 나와서... 점심시간 때 가면 대기할 수도 있어요 많은 사인과 방송 출연 화면한일옥 은 기사식당에서 출발했는데... ",함므의 거침없는 월급 탕진,https://blog.naver.com/krworker,2020-05-15
군산 맛집한일옥 ,https://blog.naver.com/kejnlove?Redirect=Log&logNo=221987807140,합니다한일옥 이라는 곳인데 외관은 양옥이고 일본식 가옥입니다 원래 소문난 집이라 대기인원이 많은...한일옥 에 들어 가기전 혹시 사람이 몰려 많이 기다리시게 되면 바로 앞에 자리하고 있는 영화 8월의... ,똥글똥글내마음,https://blog.naver.com/kejnlove,2020-06-02
"은파호수공원, 라마다 군산,한일옥 , 초원사진관, 익산 bow카페",https://blog.naver.com/hunjy87?Redirect=Log&logNo=222145490476,짜장짬뽕이랑 이성당(근데 이성당은 잠실서도맨날봐서 감흥없) 그리고한일옥소고기뭇국 얘기하길래... 오빠도 맛있데서 기대겁니한 소고기뭇국 몇십년된곳 # 한일옥근데.. 내입엔 그냥맛있는데 너무나도..... ,후니의 달콤일상,https://blog.naver.com/hunjy87,2020-11-16
군산 해장 아침식사한일옥무우국 운동인이라면 무조건!,https://blog.naver.com/rooster57?Redirect=Log&logNo=222110935678,저희는 오늘 소개해드리는한일옥 이라는 음식점을 2번이나 방문하였습니다. 이유는 2가지인데요.... 상호:한일옥위치: 전북 군산시 구영 3길 6 3(신창동 2-1) 영업시간: 06:00 - 20:30 (명절휴무 21:30마감) 주차... ,문잡고 기다려주는 남자,https://blog.naver.com/rooster57,2020-10-09
[2021 부안군산] 4박 5일 -한일옥/ 초원사진관 / 올드브릭... ,https://blog.naver.com/atonement421?Redirect=Log&logNo=222477878686,아침은한일옥 . 맛있는 녀석들에서 보고 군침만 흘리던 곳인데 운 좋게(?) 오게 되었다. 완전 옛 건물 그... 먹고 나오면한일옥앞에 바로 초원사진관이 있다. 8월의 크리스마스 오백 년 전에 봤지만.. 그 갬성... ,A fateful life,https://blog.naver.com/atonement421,2021-09-02
 한일옥/ 군산 소고기무우국 맛집,https://blog.naver.com/73hsoon?Redirect=Log&logNo=222541348026,#군산 한일옥#군산맛집 입구에 태극기가 있어서 인상적이였어요. 연예인들이 많이 다녀가서 사인이... 군산까지 가서 한 시간 기다렸는데 당연히 무우국을 먹어야지요~한일옥무우국은 우리 한우로만 만듭니다.... ,꿈꾸는 피아노,https://blog.naver.com/73hsoon,2021-10-19
"군산 맛집 추천 - 이성당, 한일옥 , 우리떡갈비",https://blog.naver.com/zptsinge?Redirect=Log&logNo=222266792920,"# 한일옥#소고기무국 #군산일등맛집 아침밥먹으러 간한일옥 , 아침부터 대기가 있다 오래된한일옥 건물, 주차 장소가 협소해서 근처 골목에 아무대나 대고와야한다. 2층에서 대기하라고 해서 올라왔는데 우와... ",쏭 비 네 ♬,https://blog.naver.com/zptsinge,2021-03-06
"군산여행 첫끼한일옥소고기무국, 초원사진관",https://blog.naver.com/kimint8?Redirect=Log&logNo=222070859800,군산여행 첫끼로 선택한 메뉴는 바로 ' 한일옥 '의 소고기무국!! 보통 소고기무국은 집 밥 메뉴이지 식당에서 즐겨 먹는 메뉴가 아니기 때문에 더 궁금하더라고요. 출발할 때부터한일옥 을 네비에 찍고... ,덩실덩실 마실이네,https://blog.naver.com/kimint8,2020-08-25
[군산한일옥 ]돈주고 뭇국을 사먹다니! 그런데 맛있네?!,https://blog.naver.com/hafee1?Redirect=Log&logNo=222165622926,"[군산한일옥 ] 식당 주소, 지도, 연락처 및 분야별 총정리와 별점은 제일 밑으로!!! 방문 이유 군산... # 한일옥 메뉴 #군산 한일옥한일옥메뉴판. 정직한 가격이다. 군산 유명 관광지고 티비에도 나온 맛집인 것을... ",미쿡언니의 굿띵헌팅 - 좋은 것만 찾아서~,https://blog.naver.com/hafee1,2020-12-07
"여름여행지 추천 군산 여행기 -1 (초원사진관, 한일옥 ,철길마을... ",https://blog.naver.com/dodud3016?Redirect=Log&logNo=222453240014,"여름여행지 추천 군산 여행기 -1 (초원사진관, 한일옥 ,철길마을 주차) 21.7.25~26일 1박 2일 군산여행기... 소고기무국한일옥 ! https://blog.naver.com/dodud3016/222448513376 ↑ 이미 맛있어서 포스팅 완료 ㅎ_ㅎ 아침밥을 다... ",깨어있는 삶,https://blog.naver.com/dodud3016,2021-08-01
"직접 다녀온 군산맛집 리스트(군산한일옥 , 국제반점 등)",https://blog.naver.com/yebbuneik?Redirect=Log&logNo=222352599561,"직접 다녀온 #군산맛집 리스트(군산한일옥 , 국제반점 등) 1박2일 군산여행 브리핑 1. 군산은 생각보다...한일옥저희는 방문해서 #한일관 의 시그니처메뉴인 쇠고기무국 뿐만 아니라 김치찌개 / 시래기국 / 닭국... ",여사원의사생활,https://blog.naver.com/yebbuneik,2021-05-16
[ 한일옥 ] 소고기무국으로 유명한 군산 맛집,https://blog.naver.com/leejh1438?Redirect=Log&logNo=222418670996,군산 소고기무국으로 유명하다는한일옥 에 다녀와봄한일옥운영시간 매일 06:00 - 20:30 명절 휴무 21:30 마감 찐맛집인가.. 주차할 곳이 전혀 없었다... 날은 뜨겁고ㅠㅠ 남편은 주차자리 찾으러 가고 난 차에서... ,세상의 모든것을 리뷰해보자,https://blog.naver.com/leejh1438,2021-07-03
[군산 맛집] ' 한일옥 ' 대표메뉴 소고기뭇국·육회비빔밥 설거지완.,https://blog.naver.com/skcmi?Redirect=Log&logNo=222306109616,이번에 소개해드릴 맛집은 군산에서 소고기뭇국과 육회비빔밥을 대표메뉴로 하고있는한일옥 이에요!... 플레이스)한일옥도착! 으리으리하다 군산 돈은 지린성이랑한일옥 이랑 이성당이 다 쓸어담나보다... ,편순이의 노잼일상 TㅅT,https://blog.naver.com/skcmi,2021-04-11
군산 맛집한일옥소고기무국 절대 못잊어,https://blog.naver.com/jsj_01?Redirect=Log&logNo=222435999533,군산여행 두번째날 아침에 먹었던한일옥 !! 워낙 맛집이라그래서 어느정도 웨이팅은 생각했었는데..... 기본 반찬들이 셋팅되고 기다리던한일옥소고기무국!! 팔팔끓는 뚝배기에 나왔다. 이날 또 비가와서... ,Crystal_소신있는라이프,https://blog.naver.com/jsj_01,2021-07-18
군산 여행 :: 군산 맛집한일옥 에서 소고기 무국과 육회비빔밥... ,https://blog.naver.com/jjy333153?Redirect=Log&logNo=222131175884,군산 여행 코스 군산 여행 맛집한일옥한일옥무국 육회비빔밥 군산 여름 휴가 마무리 안해서 끄적끄적 하러왔어요 ㅋㅋㅋㅋ https://blog.naver.com/jjy333153/222057581292 군산 여행 코스 썼던거 이어쓰기 ;;;;ㅋㅋㅋ... ,이렇게 좋은날,https://blog.naver.com/jjy333153,2020-10-30
군산한일옥뜨끈한 무우국 좋으네요~,https://blog.naver.com/zizi704?Redirect=Log&logNo=222241919854,군산한일옥무우국으로 이미 유명한 집입니다 8월의 크리스마스 영화아시죠? 거기 초원사진관 바로앞에 위치해있어요 간결한 차림새 전문성이 느껴지네요 12시까진 무우국만 식사 가능하다고 합니다 저흰... ,바하~ 라고 하옵니다 ^^,https://blog.naver.com/zizi704,2021-02-13
"군산 여행 :: 군산 맛집한일옥 , 군산cc, 이성당, 군산 안동집",https://blog.naver.com/nsmung23?Redirect=Log&logNo=222428225752,DAY 2 군산여행 옥이네포차 - 야미도 - 군산 라마다호텔 - 은파 호수공원 -한일옥- 군산cc - 이성당 - 군산 안동집 01한일옥군산cc 라운딩 전! '뭐를 먹어야 배가 든든해서 골프를 잘 칠까' 생각해봤다. 군산에... ,BBark's Diary,https://blog.naver.com/nsmung23,2021-07-12
군산 술집은 째보식당 아침식사 해장한일옥소고기 무국!,https://blog.naver.com/rooster57?Redirect=Log&logNo=222488346552,"군산 술집은 째보식당이며 아침식사 해장으로 항상 가는한일옥 이다. 째보식당은 간장 게,새우,연어장을 판매하는 집이고한일옥 은 깔끔한 소고기 무국 을 파는 집이다. 두 집다 군산에서 맛집으로 이미 소문난... ",문잡고 기다려주는 남자,https://blog.naver.com/rooster57,2021-08-29
군산 맛집한일옥무우국 정갈한 한끼,https://blog.naver.com/benjo11?Redirect=Log&logNo=221953298815,"맛집한일옥을 찾았습니다. 생활의달인을 비롯하여 생생정보통, 맛있는 녀석들 등 여러 TV 방송에 나온... 마치 영화에서 보는 한 장면 같은 #군산맛집 # 한일옥이색적인 실내는 재미있더군요. 널찍하게... ",큰바다소년 Benjamin,https://blog.naver.com/benjo11,2020-05-09
"군산 맛집 추천 -한일옥(주말웨이팅, 주차팁, 솔직평)",https://blog.naver.com/ohime728?Redirect=Log&logNo=222296168802,"#군산맛집 #군산맛집 한일옥#군산소고기무국 한일옥# 한일옥군산맛집으로 빠지지 않고 등장하는 곳 # 한일옥주메뉴는 바로 소고기뭇국이다. 소고기뭇국이라 함은,, 울엄마가 제일 자주 끓여주는 국으로... ",Mrs 히메 - 카르페디엠,https://blog.naver.com/ohime728,2021-04-02
[군산] 군산여행하면 꼭 먹어야하는한일옥소고기무국,https://blog.naver.com/min_ji73?Redirect=Log&logNo=222125367204,20200922 TUE한일옥전라북도 군산 운영시간 매일 6:00 - 21:30 *명절은 휴무 전화☎ 063 - 446 - 5502 063 - 446 - 5491... 메이트는 못먹어봤다해서 강추강추하며 군산소고기뭇국맛집한일옥 으로 출발했다. 그렇게 도착한... ,밈미네•ᴗ•♡✧*。,https://blog.naver.com/min_ji73,2020-10-24
" 군산한일옥메뉴, 가격, 주차, 영업시간, 주의할 점 !",https://blog.naver.com/sinhyhj?Redirect=Log&logNo=222186057769," 군산한일옥메뉴, 가격, 주차 영업시간, 주의할 점 ! 주소 - 전북 군산시 구영3길 63 영업시간 - 매일... 군산한일옥소고기 무우국과 육회비빔밥이 정말 유명한데요 신자매가 주의할점 안내드릴게요 군산... ",신자매 블로그,https://blog.naver.com/sinhyhj,2020-12-26
군산맛집한일옥소고기 무우국 이제야 먹어 봤네요.,https://blog.naver.com/apple7715?Redirect=Log&logNo=222541184709,군산맛집인한일옥 을 이제야 방문해봤다. 예전 부터 군산을 방문할때마다 맛보고 싶었지만 군산은 먹거리 천국이라 군산만 도착하면 항상 바뀌는 메뉴 때문에 먹기 힘들었던 곳^^; 바로한일옥되시겠다. 나의... ,맛찾나?,https://blog.naver.com/apple7715,2021-10-19
군산 맛집한일옥소고기 뭇국 솔직 후기,https://blog.naver.com/3645suns?Redirect=Log&logNo=222297901348,초원사진관 앞에 있는 식당이한일옥 인지 몰랐어요. 밥 먹고 집으로 갈것인데 가까워서 너무 좋았어요...한일옥 은 매일 아침 6시부터 밤 8시 30분까지 영업하십니다.한일옥 은 한옥과 일본식가옥을 말한다네요.... ,힐링,https://blog.naver.com/3645suns,2021-04-04
군산맛집 시원한 무국이일품이였던한일옥 ,https://blog.naver.com/kimyr8569?Redirect=Log&logNo=222489499944,군산맛집한일옥전날 과음하고 수혈이 시급하여 ㅎㅎㅎ 아침 일찍 방문한한일옥위치가 참 좋아요. 군산 근대화거리 영화 8월의 크리스마스를 촬영한 초원사진관 앞에 있으며 이성당하고도 가까워요.... ,푸드러버의 식도락라이프 :),https://blog.naver.com/kimyr8569,2021-09-03
[군산 맛집] 초원 사진관 앞 ' 한일옥 ',https://blog.naver.com/lovelydl22?Redirect=Log&logNo=222224180104,점심 식사부터 해보자 하고 군산에서 유명하다던 소고기 무국집 ' 한일옥 '에 도착했습니다. 군산 맛집 소고기 무국이 유명한 ' 한일옥 ' 우와 아무 생각없이 정보없이한일옥 에 도착했는데... 초원사진관... ,오르막길,https://blog.naver.com/lovelydl22,2021-01-29
"군산 여행 2 :한일옥뭇국, 카페 틈",https://blog.naver.com/sinlsj?Redirect=Log&logNo=222081478549,#뭇국 # 한일옥어딘지 임시정부 분위기가 나는 이곳은 그 유명한 8월의 크리스마스의 배경이었던...한일옥2층의 대기공간은 거의 박물관 1937년 지어진 일본식 가옥. 80년도 넘은 건물이다. 그러고 보니... ,keik,https://blog.naver.com/sinlsj,2020-09-07
군산한일옥내돈내산 솔직후기! 군산맛집...?,https://blog.naver.com/loveholic0525?Redirect=Log&logNo=222049735287,안녕하세요~ 용다입니다 :) 오늘은 군산 초원사진관 맞은편 군산맛집으로 유명한 군산한일옥 에 방문해 소고기 무국 맛본 후기입니다~! 외관부터 전통이 느껴졌던한일옥 ~ 건물이 지어진지 80년쯤 되었다고... ,용다의 즐겁게 먹고 요리하고 여행하는 일상,https://blog.naver.com/loveholic0525,2020-08-03
[군산여행]한일옥 _깔끔한 무우국 맛있어요!,https://blog.naver.com/rieulmieum?Redirect=Log&logNo=222399374730,"하고 추천한한일옥! 점심으로 먹기엔 좀 아쉽고, 해장겸 아점이나 아침으로 딱이라고 추천해서 친구 붕붕이를 타고한일옥 으로 갔습니다!한일옥한국, 일본 집 가게 앞 주차장에 자리가 없어서 인근 문닫은... ",세상살맛 기록할로그,https://blog.naver.com/rieulmieum,2021-06-15
[식당기행] 군산한일옥소고기뭇국,https://blog.naver.com/hyj102?Redirect=Log&logNo=222316254317,Dining [식당기행] 군산한일옥소고기뭇국 #전북 #군산시 #맛집 # 한일옥#한일 #인스타 #한식집 #부안 #변산 #새만금 #방조제 #고군산 #국밥 #소고기 #뭇국 #무국 #속편한 #솔직후기 #별미 #식당 #위치 #메뉴판... ,잉여 인간 표류기,https://blog.naver.com/hyj102,2021-04-21
[군산 맛집] 어릴 때 먹던 아침밥 소고기 무국한일옥 ,https://blog.naver.com/minmogun?Redirect=Log&logNo=222298184628,군산에서 가장 기대했던 식당~ #군산 한일옥#군산아침 #군산조식 #군산소고기무국 집이죠~~ 아침에 일어나서 조식으로 먹으러 갑니다~~~ 제가 묵었던 항도호텔에서 걸어서 10분 거리.... 이 근처에 다 있어서... ,민모군의 요리 먹고 조리 먹고,https://blog.naver.com/minmogun,2021-04-21
군산맛집한일옥역사가 숨쉬는 곳!,https://blog.naver.com/jbj6008?Redirect=Log&logNo=221920982081,TV프로그램 생활의 달인과 맛있는 녀석들에서 군산맛집 으로 소개된 이 곳은 바로한일옥이라는... 군산맛집한일옥은 기다리는동안에도 구경하느라 시간가는줄 몰랐네요 ㅋㅋ 자! 드디어 기다리고... ,주붕 패션&라이프 블로그,https://blog.naver.com/jbj6008,2020-04-22
군산한일옥 . 고기가 적긴 하지만...전국적으로 유명한 소고기무국,https://blog.naver.com/spring5867?Redirect=Log&logNo=222263235003,"군산한일옥 . 전국적으로 유명한 소고기무국한일옥군산 여행에서 대표적인 군산의 인기 식당들이 몇 군데 있지만, 세 손가락 안에 드는 빼놓을 수 없는 식당 목록에는한일옥 이 있습니다. 아침부터 식사가... ",■봄이 미식회■,https://blog.naver.com/spring5867,2021-03-03
군산한일옥소고기 무국 맛집 평범한 소고기뭇국이 명품인 이곳,https://blog.naver.com/anarnfl?Redirect=Log&logNo=222515809537,안녕하세요 이번 시간에는 군산 신창동에 위치하고 있는 소고기 무국 맛집인한일옥 에 다녀왔습니다.... 그래서 오다가다 관광객들을 많이 마주치게 되네요한일옥 에 들어서면 셀럽들 사인들 볼 수 있어요 다수... ,louis clair 루이끌레르:),https://blog.naver.com/anarnfl,2021-09-24
"군산한일옥시래기국, 그리고 김치찌개",https://blog.naver.com/okyoky2000?Redirect=Log&logNo=221808047065,"아점으로 찾았던 군산한일옥기사식당 여행 둘째 날은 해장 겸 아점으로 복성루를 먼저 찾았다. 전날... 그리하여 급하게 군산 맛집으로 검색을 하여 찾았던한일옥 , 8월의 크리스마스 촬영지로 여행객들이 즐겨... ","블루스피넬 travel, IT",https://blog.naver.com/okyoky2000,2020-02-13
"[돼지런한일상]전주, 군산 _ 아원고택,오선모김밥,빈해원, 한일옥 ",https://blog.naver.com/bestpudding?Redirect=Log&logNo=221974203827," 한일옥무국은 집에서도 끓일수있는건데 왜 추천음식일까 생각했는데 군산한일옥소고기무국은 안 먹어봤으면 후회했겠다 싶을정도로 맛있었어요. 국물도 깔끔하면서 깊고, 고기 잡내 안나고 무도 살캉살캉... ",살림일기,https://blog.naver.com/bestpudding,2020-05-22
[군산맛집] 맛있는 녀석들 소고기무국 육회비빔밥 맛집한일옥:D,https://blog.naver.com/gkamsp?Redirect=Log&logNo=222330966004,"[ 군산 ] 맛있는 녀석들 육회비빔밥 소고기 무국 맛집 _한 일 옥_ 맛있는 녀석들 맛집 투어 [군산]편... 군산의 소고기무국, 육회비빔밥 맛집한일옥_ 한참 바쁠 저녁 시간 되기전에방문 하니 대기 줄도 없고바로... ",어쩌다 농부[대성농원],https://blog.naver.com/gkamsp,2021-05-01
군산_ 한일옥 ,https://blog.naver.com/f1y2thesky?Redirect=Log&logNo=222497828374,"하핫한일옥 은 군산에 오면 무조건 방문해야 되는 곳으로 이미 유명했었어서, 괜찮겠지...라는 마음으로 방문했습니다. 일요일 2시가 넘은 시간에 방문했었는데, 줄을 서야 했습니다. 비빔밥은 평일에만 된다고... ",SoLog,https://blog.naver.com/f1y2thesky,2021-09-07
"동국사,선유도해수욕장 그리고 초원사진관,맛집한일옥 ~",https://blog.naver.com/soopark99?Redirect=Log&logNo=222246565660,맛집인한일옥 이 있다.추운 겨울에 뜨끈한 국물이 생각날 때 더욱 맛있게 느껴질 무우국 먹으러 한일관으로 고고~한일옥맞은편에는 바로 영화 8월의 크리스마스로 유명한 초원 사진관이 있음..ㅎ 맛나는... ,Live Love Learn...!!,https://blog.naver.com/soopark99,2021-03-02
소고기뭇국 유명한 군산한일옥 과 초원사진관 구경,https://blog.naver.com/lskimch?Redirect=Log&logNo=222047971319,군산 소고기뭇국으로 유명한한일옥 에서 아침 먹었어요 여기 오픈 시간이 6시 진짜 일찍 여네요 한 9시쯤 도착한거 같은데 주차장이 꽉차있었습니다한일옥 도 일본식 건물인지 느낌이 특이합니다 여기 바로... ,cyoz님의 블로그,https://blog.naver.com/lskimch,2020-08-01
시간여행을 떠나다 - 군산여행코스 1박2일:한일옥 /8월의... ,https://blog.naver.com/dreamest?Redirect=Log&logNo=222336453531,시간여행을 떠나다 - 군산여행코스 1박2일:한일옥 /8월의 크리스마스 초원사진관/군산짬뽕맛집 복성루... 8월의 크리스마스에 나온 초원사진관 바로 근처에한일옥이라는 소고기무국 맛집이 있다.한일옥 ... ,모두의 플레이스,https://blog.naver.com/dreamest,2021-05-03
