title,link,description,bloggername,bloggerlink,postdate
군산 초원사진관앞한일옥무우국,https://blog.naver.com/tkfkdto?Redirect=Log&logNo=222432396396,군산 초원사진관앞한일옥무우국 군산여행은 역시 별미여행 이죠 오늘 아침은 8월의 크리스마스 촬영지인 초원사진관앞한일옥 에서 무우국을 먹기로 하였습니다. 이집은 35년 단골집 입니다. 맑은 국물의 한우... ,코코네 일상,https://blog.naver.com/tkfkdto,2021-07-15
군산한일옥소고기무국,https://blog.naver.com/coo__ll?Redirect=Log&logNo=222134202648,이성당에 들려 빵을 사고 평소에는 먹지도 않는 아침을 굳이 먹겠다며 찾아간 군산 한일옥뭇국이 바른 말이지만 무국이라고도 많이 쓰니 내 맘대로 써야지 ㅋㅋㅋ 암튼한일옥 소고기무국을 먹기 위해 번호표를... ,slowly slowly,https://blog.naver.com/coo__ll,2020-11-03
[군산맛집] 시원한 소고기무국으로 유명한한일옥 ,https://blog.naver.com/dream2739?Redirect=Log&logNo=222537823353,유명한 # 한일옥입니다 군산은한일옥말고도 유명한 맛집이 많이 있는데요 이날 비가 얌전히 보슬보슬 내려서 따끈한 국물이 먹고 싶어서 들렸어요 제가 간 날은 월요일(공휴일)이었고 2시를 넘어가는... ,신혼댁 우너씨,https://blog.naver.com/dream2739,2021-10-15
인생 소고기뭇국 -한일옥 ,https://blog.naver.com/nebula21?Redirect=Log&logNo=222292022500,오후 1시쯤한일옥 에 도착해 종업원의 말로 1시간정도 기다리면 될것 같다고 해서 바로 대기표를 받아... 또 한시간 길에서 허비하고 '군산은 웨이팅의 도시'구나 하고 돌아가려다가 혹시나해서 다시한일옥 을... ,Whisky& Spirits Diary,https://blog.naver.com/nebula21,2021-03-29
군산 가볼만한곳 초원사진관/한일옥/ 군산과자조합,https://blog.naver.com/keummin?Redirect=Log&logNo=222019539238, 한일옥 을 찍고 갔는데 바로 앞이 초원사진관이더라고요. 밥먹으러 들어가기전에 인증샷찍기...한일옥점심을 먹을 장소는 바로 여기한일옥 이었어요. 그때 당시 신랑하고 티비를 보다가 군산가면 여기가서... ,빅토리아홈의 행복한 일상,https://blog.naver.com/keummin,2020-07-03
"군산 갈만한곳, 초원사진관과한일옥 ",https://blog.naver.com/chahyang88?Redirect=Log&logNo=221753492650,히로쓰 가옥을 개조해 만든 ' 한일옥 '이라는 개화기 시절 이름을 가진 식당. 이곳은 군/산의 푸짐한... 출처 /한일옥사인 카피 내부는 옛스러운 목재로 꾸며한 홀과 온돌로 구분되어 있어요. 언제나 사람이... ,별빛 가득 차향,https://blog.naver.com/chahyang88,2019-12-29
주인장의 따듯한 마음이 있는 군산 무우국한일옥 [국밥집],https://blog.naver.com/dacima02?Redirect=Log&logNo=222234349119,군산 무우국한일옥 을 방문 오래된 노포다. 군산을 둘러보니 목포와 비슷한 느낌이 났다. 군산 무우국한일옥 의 메뉴판 참 이색적인 메뉴 조합이다. 다양하게 주문햇어야 했는데 바보처럼 김치찌개하고 무우국만... ,여행과 맛집. 민쿡의 얌얌톡톡,https://blog.naver.com/dacima02,2021-02-14
"군산 맛집, 맛있는녀석들 소고기무국 :한일옥 ",https://blog.naver.com/dlrkfka626?Redirect=Log&logNo=222190907521, 한일옥영업시간 06:00 - 20:30 명절휴무 주차가능 담양으로 단풍여행 다녀왔던 11월 일산으로 올라오던 길에 짝꿍이가 꼭 다시 먹고싶다고 노래를 불렀던 군산 맛집한일옥 !! 올라가는 길에서 조금 빠져야했지만... ,raaaaami,https://blog.naver.com/dlrkfka626,2020-12-30
[전북 군산] 훌륭한 맛의 소고기 무우국..한일옥 ,https://blog.naver.com/ryanjoh?Redirect=Log&logNo=221988334474,"으르신들의 서라운드 입체 코 골아대는 소리에 잠도 설쳤는지라, 일어나자 마자 해장하러 간한일옥 ... 아침 6시부터 문을 여는 집이라 아침을 드시러 오는 손님들이 한가득이다.. 9시쯤 도착을 한거 같은데... ",맛난게 좋아~,https://blog.naver.com/ryanjoh,2020-06-03
군산한일옥 ,https://blog.naver.com/tjsrud203?Redirect=Log&logNo=222144687485,12 ] / 군산맛집 / 군산 한일옥/한일옥/ /한일옥 뭇국 /한일옥 무우국 / 군산 한일옥 무국 / / 군산 한일옥 뭇국 /한일옥 소고기뭇국 / / 군산 한일옥 소기기뭇국 /한일옥 육회비빔밥 / 지난겨울 군산 당일치기의... ,Sun's story,https://blog.naver.com/tjsrud203,2020-11-15
제일 맛있었던 군산 맛집한일옥 과 초원사진관 주소,https://blog.naver.com/laj7364?Redirect=Log&logNo=222503415127,"모르겠으면한일옥찍고 가세요한일옥건너편이 초원사진관 입니다 이 동네가 월명동인데 초원사진관,한일옥 , 이성당 다 있는 동네 뿐만 아니라 사진촬영, 소품샵, 예쁜 카페, 맛집들이 가득하다 무계획으로... ","아름답고, 진실하게",https://blog.naver.com/laj7364,2021-09-20
군산 맛집 육회비빔밥과 소고기 무국 맛있는한일옥 ,https://blog.naver.com/djpinky?Redirect=Log&logNo=222112772041,"군산 맛집 군산한일옥육회비빔밥 소고기 무국 글, 사진 By 백잎 안녕하세요 백잎예요~ 이틀 연속 몸이... 여기한일옥 은 볼거리가 있어서 더욱 추천드려요~ 볼거리는 밑에 다시 보여드리고 일단은 맛있고 정갈한... ",백잎클로버의 1+2 이야기,https://blog.naver.com/djpinky,2020-10-11
군산한일옥+ 초원사진관,https://blog.naver.com/pillow00?Redirect=Log&logNo=222149877940,비도 오고 해서 근처한일옥가서 쇠고기무국을 먹기로... 여러 TV 매체에 많이 소개가 된 집.. 주문과...한일옥 .. 예전엔 이곳이 아니었는데 돈 많이 벌어서 이사온 모양.. 생활의 달인에도 나온 모양이네.. 또... ,3류도 나에겐 사치다.,https://blog.naver.com/pillow00,2020-11-20
군산 소고기 무국 맛집 -한일옥 ,https://blog.naver.com/blueminha?Redirect=Log&logNo=221793967147,군산한일옥군산 소고기 무국 맛집 들어가자 보이는 블루리본 칭찬합니다. 앞에 주차장이 있긴 한데 한...한일옥건너편에 8월의 크리스마스 영화에 나온 초원사진관이 있어서 밖에 나가보니 관광객들이 사진... ,세상을 따뜻하게 바라보다,https://blog.naver.com/blueminha,2020-02-02
" 한일옥 , 무우국 , 8월의크리스마스촬영장소, 군산낚시... ",https://blog.naver.com/rano2?Redirect=Log&logNo=222537491607, 한일옥방문하였습니다. 8월의크리스마스 촬영했던 그곳입니다. 아침 + 점심 겸 저녁입니다.... 매우 뜨겁습니다..ㅋㅋ 혀.. 뎟 습니다.ㅋㅋ 지금 올라가면 길에서 시간 보내니... 늦은 저녁... ,포터맨,https://blog.naver.com/rano2,2021-10-17
[군산] 34주에 떠나는 태교여행 : 군산 ' 한일옥 ' 소고기 무국... ,https://blog.naver.com/binujoa?Redirect=Log&logNo=222462815985,식당 앞에 있던 초원사진관에서 기념사진 찍고 ㅋㅋ 군산 ' 한일옥 ' 아침식사로 고른한일옥 의 소고기 무국. 입덧이 엄~청 심할 때 매일 맛있는 녀석들을 봤는데 ( 난 못 먹으니 남 먹는 거 구경함 ㅋㅋ) 그때... ,"한번 사는 인생, 즐겁게♬",https://blog.naver.com/binujoa,2021-08-09
군산 맛집한일옥 에서 시래기국과 무국 후기,https://blog.naver.com/missionhkc?Redirect=Log&logNo=222083983650,군산 맛집 중 한 곳인 무국과 시레기국에 전문성을 가진한일옥후기를 남겨 봅니다. 군산 맛집한일옥 의 주변 풍경을 담아 봅니다.한일옥식당 주변 풍경입니다. 모든 음식 무한 리필입니다. 육회비빔밥은 소... ,황규철의 자신만만 세상 살기,https://blog.naver.com/missionhkc,2020-09-08
[군산] 한일옥 -소고기뭇국의 매력,https://blog.naver.com/theboy9368?Redirect=Log&logNo=222035088807, 한일옥외관 군산에서 마지막으로 해장하러 간 곳은한일옥 . 이걸로 군산 포스팅은 마무리합니다. 바닷가 동네에 가면 생선국물로 해장을 하는걸 원칙으로 하지만 가끔 예외가 있는법이죠. 며칠간 생선국물을... ,레드피쉬의 식도락,https://blog.naver.com/theboy9368,2020-07-19
군산 한일옥소고기무국,https://blog.naver.com/sarang5173?Redirect=Log&logNo=222539797338,군산 근대화거리를 돌아보고 영화 8월의 크리스마스 촬영지 '초원사진관' 앞에 위치한한일옥 에서 소고기무국을 먹었다.한일옥83년 된 건축물. 40년째 가업을 이어 온한일옥일본식 목조 건물한일옥 은... ,행복바이러스,https://blog.naver.com/sarang5173,2021-10-17
"군산한일옥소고기뭇국, 육회비빔밥 먹고 근처 여행까지",https://blog.naver.com/8learner?Redirect=Log&logNo=222167241209,"전북 군산시 신창동,한일옥맛있는 녀석들 보고 오빠가 가고 싶어했던한일옥소고기뭇국을 돈 주고 사먹기는 처음이다 초원사진관 바로 근처에 있는데 맛집인지는 몰랐다 좁아보였는데, 들어가서 보니 되게... ",굼불로그,https://blog.naver.com/8learner,2020-12-08
군산 맛집한일옥무우국김치찌개,https://blog.naver.com/psk5686?Redirect=Log&logNo=221992088181, 한일옥으로 고고~! 네이버에 나온 정보 참고하세요! 차림표도 찍어왔어요! 육회비빔밥도 먹고 싶었는데 주말엔 안한다는...ㅠㅠ #무우국 과 #김치찌개 를 주문했어요 가격이..후덜 정갈한 느낌의 한옥집 # 한일옥 ... ,민이의미니,https://blog.naver.com/psk5686,2020-06-06
겨울방학 군산 당일치기 여행 _ 군산맛집 일본식 가옥한일옥 ,https://blog.naver.com/aru2?Redirect=Log&logNo=222219733752,겨울방학 군산 당일치기 여행 _ 군산맛집 일본식 가옥한일옥2021.1.24 신나는 겨울방학이에요~ 1월18일... 바로한일옥 입니다~한일옥무우국은 정말 최고죠^^ 겨울방학 군산 당일치기 여행 _ 군산맛집 일본식 가옥... ,아이들과 함께하는 여행 그리고 일상,https://blog.naver.com/aru2,2021-01-25
군산맛집한일옥소고기 무국.,https://blog.naver.com/jamji1999?Redirect=Log&logNo=222181551178,군산맛집한일옥 뭇국 . 군산 근대화거리 가보면한일옥 이라고 초원사진관앞에 있는데 그곳의 시원한 무국을 한번 맛보고 왔다. 사람이 많아서 진동벨 받고 이층에서 기다린다. 이층에는 근대물건들이 전시되어... ,괴산고추농산,https://blog.naver.com/jamji1999,2020-12-22
"군산 맛집,한일옥 , 무우국 맛보기",https://blog.naver.com/niccolo0814?Redirect=Log&logNo=221948183267,"고군산군도 구경하다 돌아서는 길에 군산에 맛집으로 알려진한일옥 을 향한다. 대기 인원이 많은... 누군가는 다시다도 화학적으로는 소고기국물이랑 같다고 주장하겠지만, 내 입엔한일옥국물이 더 맑고... ",행복.자유.미래,https://blog.naver.com/niccolo0814,2020-05-06
군산한일옥소고기뭇국과 육회비빔밥,https://blog.naver.com/rhdmswjd9?Redirect=Log&logNo=222099741006,#군산 한일옥#군산소고기뭇국 #군산육회비빔밥 #군산맛집 #소고기뭇국 이 맘때쯤 생각나는 소고기뭇국... 군산한일옥차림표 1번 무우국 2번 육회비빔밥 그 뒤로 기타등등 다 한입씩 맛보고 싶지만 그럴 순... ,꼬의아침,https://blog.naver.com/rhdmswjd9,2020-09-25
"기록#161] 햄장님의 첫 군산 방문기 (feat.한일옥 , 초원사진관)",https://blog.naver.com/thx_happy?Redirect=Log&logNo=222365120221," 한일옥 . 소고기뭇국으로 유명하다. 굉장히 오래전에 조그만 가게였는데 엄청 커졌다. ㅣ 소고기뭇국 9,000원 둘 다 소고기뭇국을 주문했다. 햄장님은 맛있는녀석들에서 봤다며 꿀팁도 알려줬다. 밥이랑 국물이... ",시속삼십 둘째사장의 기록,https://blog.naver.com/thx_happy,2021-05-24
[210310]한일옥 ,https://blog.naver.com/hoyhoy73?Redirect=Log&logNo=222275058223,ㄴㄴㄴ 바로 그 앞에 있는 식당에 가는 길 그건 바로 소고기뭇국으로 유명한한일옥초원사진관 바로... #군산당일치기 #군산여행 #군산맛집 #군산 한일옥#군산소고기뭇국 #소고기뭇국 #무우국 #맛있는녀석들군산,KA-KA's ⓗOUSⓔ™,https://blog.naver.com/hoyhoy73,2021-03-14
 한일옥군산 뭇국,https://blog.naver.com/perk1234?Redirect=Log&logNo=222045260568,"군산의 소고기뭇국 전문,한일옥 . 별로 손이 가지 않던 넉넉히 제공되는 찬들과 테이블마다 비치된... 여유롭게 한 끼 잘 먹을 수 있었다.한일옥전라북도 군산시 신창동 2-1 063-446-5491 06:00~20:30 명절 휴무",食生食死 by TS52,https://blog.naver.com/perk1234,2020-08-12
[군산한일옥 ] 소고기뭇국,https://blog.naver.com/buboek?Redirect=Log&logNo=222292498239,맛있는 녀석들에 나와서 언젠가 꼭 가보고 싶었던 군산한일옥 . 사진첩에서 발견하고 반가워서 올린다. 예전 글에서 해외에 가면 다들 사진 찍느라 눈으로 직접 보고 듣고 느끼지 않는다고 비난하던 글이... ,샬랄라 책 읽는 시간은 즐거워,https://blog.naver.com/buboek,2021-03-30
군산 여행 ( 한일옥틈),https://blog.naver.com/qejnad?Redirect=Log&logNo=222502600164,군산 여행 ( 한일옥틈) 군산한일옥무우국 맛있는 녀석들 221회 2019.05.17 '8월의 크리스마스' (한석규심은하) 1998.01.24 SBS 생활의달인 354회 2012.10.08. 기사식당 최강달인 조춘열 카페 틈(TEUM)... ,아침이슬,https://blog.naver.com/qejnad,2021-09-11
전주카드기.전주포스.전주키오스크)군산한일옥 ,https://blog.naver.com/juu2468?Redirect=Log&logNo=222349587596,#군산 한일옥#군산뭇국 #무우국 #쇠고기무우국 #군산맛집 #군산밥집 Previous image Next image 넓고 오밀조밀 자리가 미로찾기. 메뉴 주메뉴:무우국 (무한리필) 공휴일.주말 육회.비빔밥 주문불가. http... ,전북 전지역 1644-8034,https://blog.naver.com/juu2468,2021-05-13
[전북 군산] 한일옥 (무우국)-추억을 소환한 소고기무국☆3,https://blog.naver.com/foodrack?Redirect=Log&logNo=222534245190,"초원사진관 바로 앞에 있는 ' 한일옥 '이다.한일옥전경한일옥 은 오전 6시부터 영업하는 곳으로, 이 날 6시 조금 넘어서 방문했는데~벌써부터 손님들이 꽤 있을 정도로 인기있는 식당인 듯 싶었다. 여기는 무우국... ",세상은 맛있다!,https://blog.naver.com/foodrack,2021-10-12
[군산 맛집] 군산CC 아침 맛집으로는한일옥 에서 소고기뭇국으로,https://blog.naver.com/jingmin111?Redirect=Log&logNo=222311736654,"유명한한일옥 에 왔어요. 주차를 하고 보니,,, 응? 바로 맞은편에 초원 사진관이 있는거에요! 8월의...한일옥 도 역시 적산가옥 내부를 개조하여 만든 집이었어요. 이름부터가 벌써 그 뜻이잖아요?한일옥 .... ",행복하기에도 바쁜 인생,https://blog.naver.com/jingmin111,2021-04-16
군산 맛집한일옥닭국,https://blog.naver.com/iseabiz?Redirect=Log&logNo=222067885035, 한일옥 이 나오네요... 네비찍고 고고 ~~~ 이성당에서 300미터 거리 ㅎㅎ한일옥이란 이름은... 한옥과 일본식가옥 이라는 뜻 이라네요 ~~~ 식당 내부에 들어가니.... 예전 인테리어 ~~~한일옥 에서 유명한... ,회생/파산/법인회생/간이회생/한정승인/상속/이혼,https://blog.naver.com/iseabiz,2020-08-22
군산한일옥지붕 위 고양이..,https://noranmong.tistory.com/272,"그중 하나가한일옥 .. 1937년에 지어졌으니, 무려 80년이 넘은 건물을 식당으로 사용하고 있다. 군산에서...한일옥지붕에 사는 새끼 고양이 두 마리.. 붙어다니는 모습이 귀여워 숨죽이고 지켜봤는데, 한 마리는... ",노란몽(Old Egg's Dream),https://noranmong.tistory.com/,2020-12-26
군산)한일옥- 소고기뭇국,https://blog.daum.net/inkkoo/468, 한일옥소고기 뭇국으로 유명한가보네요 경상도 스타일 소고기뭇국은 고추가루 팍팍탄 빨가스럼한 소고기뭇국인데 군산식은 서울식처럼 맑은 국인데 그 깊은 맛이 군산가면 두번 가도 괜찮을듯해요한일옥 ... ,점심해결 맛집탐방,https://blog.daum.net/inkkoo,2020-11-01
구수한 맛 일품 군산 맛집 ----한일옥우거지국밥,https://blog.daum.net/csmsjy/7092852,시원한 군산의 무국밥 식당한일옥 에서 즐기는 우거지국밥 무국밥은 한우 소고기가 들어간 국밥인데... 무국밥 전문식당한일옥 을 지키는 수문장인 천하대장군의 돌상입니다. 천하대장군의 천생연분인... ,하늘하늘의 공간사랑,https://blog.daum.net/csmsjy,2021-01-30
초겨울 뜨근한 국물 좋은 군산 맛집 --- 무국밥 맛집한일옥 ,https://blog.daum.net/csmsjy/7092800,군산 무국밥 생활의 달인 ---한일옥겨울이 오면 더 맛이 좋은 뜨끈한 무국밥입니다. 시원하기도하고...한일옥입구에는 차량 5대 정도 주차할 공간이 있습니다. 화요일 도착한한일옥앞 주차공간도 있어요... ,하늘하늘의 공간사랑,https://blog.daum.net/csmsjy,2020-12-11
[군산 맛집]한일옥: 소고기무국이 유명한 식당,https://blog.naver.com/yjoshjh?Redirect=Log&logNo=221575650251,먹으러한일옥갈까 하다가 블로그 이웃분께 추천받은 이곳 소고기무국을 먹어볼까 했는데 무슨 일인지 당분간 영업을 중단한다는 안내문이 붙어 있네요 그래서 가던대로한일옥으로 .. 영화 8월의... ,참이술의 Eat & Drink,https://blog.naver.com/yjoshjh,2019-07-02
[군산 맛집]한일옥: 소고기무국이 유명한 식당 -생활의달인... ,https://blog.naver.com/yjoshjh?Redirect=Log&logNo=221636062075,전북 군산 초원사진관 앞의한일옥소고기무국으로 유명한 식당입니다 새벽부터 영업하기 때문에... 맛있습니다한일옥하면 뭐니뭐니해도 소고기무국 시원하면서도 감칠맛 물씬 나는게 해장으로도 아주... ,참이술의 Eat & Drink,https://blog.naver.com/yjoshjh,2019-09-02
군산한일옥 에서 아침식사,https://blog.naver.com/pmo16?Redirect=Log&logNo=221622326167,군산한일옥 에서 아침식사를 하다 첫날 군산 8월의 크리스마스 촬영지를 둘러보고 미련이 남아 숙소를 정하고 담날 아침 일찍한일옥 으로 향했다. 벌서 홀 안은 꽉찼고 대기 번호표를 받아 2층에서 순서를... ,추소이의 함께 하고싶은 이야기들,https://blog.naver.com/pmo16,2019-08-20
군산맛집한일옥소고기무우국을 먹어보았다!,https://blog.naver.com/dino5730?Redirect=Log&logNo=221534516886,나오고한일옥 이라는 소고기무우국으로 맛있다는 집이 나왔다. 소고기무우국과 육회비빔밥으로 이미 수차례 매스컴도 탄 군산한일옥 . 식당에 다다르다보니 또다른 군산 명소 8월의크리스마스 촬영지인... ,동탄의롱페이스,https://blog.naver.com/dino5730,2019-05-10
군산한일옥소고기무국 속이 편해지는 맛,https://blog.naver.com/kimssaem7?Redirect=Log&logNo=221033737242,군산한일옥맛 집에서 속을 든든히 채웠던 기억이 납니다. 군산한일옥 은 워낙 유명한 곳이라서 웬만한 검색을 해봐도 꼭 한 번쯤은 나오는 곳입니다 초원 사진관 바로 앞에 있다 보니 사람들이 더 몰리는 이유... ,동화스토리,https://blog.naver.com/kimssaem7,2017-06-21
군산한일옥소고기무국 맛집과 초원사진관,https://blog.naver.com/jkj9150?Redirect=Log&logNo=221494208783,군산한일옥소고기무국 맛집과 초원사진관 군산 신흥동 일본식 가옥 갔다가 아점 먹으로한일옥 에 갔다. 군산한일옥주소 : 전라북도 군산시 구영3길 63(신창동 2-1) 전화 : 063-446-5491 영업시간 : 매일 06:00 - 20... ,앙자의 일상,https://blog.naver.com/jkj9150,2019-03-21
군산 갔으니한일옥소고기무국(뭇국) 들려야겠죠?,https://blog.naver.com/jssong315?Redirect=Log&logNo=221329091770,"그나마 입에 맞는 군산 소고기무국한일옥별것도 없는 빵집이나, 아무대나 가도 짬뽕 맛있는... 군산한일옥 으로 간다,,,, 나의 판단이 맞았다!! 전혀 줄을 서지 않고 바로 입장해서 바로 먹을 수 있는한일옥 ... ",강릉 살아보기 6개월째,https://blog.naver.com/jssong315,2018-08-04
군산여행 / 서천 국립생태원 /한일옥/ 쌍용반점,https://blog.naver.com/yeonjasss?Redirect=Log&logNo=221498150665,"복성루 갔는데 복성루는 지린성보다 더길어 포기,,, 30분을 길에다 시간 버리고 간곳 ,한일옥 ...한일옥나옴 바로 초원사진관 ㅋㅋㅋ 여기 포토스팟으로 유명해서 알고 있었는데 궂이 찾아서 찍을생각은... ","noy daily,",https://blog.naver.com/yeonjasss,2019-03-26
