title,link,description,bloggername,bloggerlink,postdate
충정로 서울역 맛집 :: 최자로드 선정 ! 닭꼬치닭볶음탕 ' 호수집 ',https://blog.naver.com/zszszs22?Redirect=Log&logNo=221289613949,충정로 중림동 맛집호수집충정로에 출근할 때부터 맛있다고 익히 들었던호수집 . 점심 저녁장사를 하는데 예전에 대표님이 점심으로 닭볶음탕 사주신 적이 있다. 그때 정말 맛있게 먹었었는데... ,Whatever I do,https://blog.naver.com/zszszs22,2018-06-01
서울역호수집닭도리탕 최고,https://blog.naver.com/lovenada6?Redirect=Log&logNo=220932809644,서울역 맛집 :호수집인생 닭도리탕 추천 안녕하세요. 레이디 입니다- 갑자기 추워진 날씨 탓에 2월에...호수집주소 : 서울시 중림동 61-4 전화번호 : 02-392-0695 영업시간 : 매일 11:30-22:00 브레이크타임 14:00-17:00... ,콩님로그,https://blog.naver.com/lovenada6,2017-02-11
서울 충정로 중림동호수집 ,https://blog.naver.com/cmykhc?Redirect=Log&logNo=20179363512,중림동에 위치한 닭꼬치 전문점호수집명동집에서 나와서 걸어서호수집 으로 향했습니다. 가게 앞에는 예상한대로 줄이 길게 늘어서 있네요. 번호가 적힌 공을 하나 집어들고.. 대기자 명단에 이름을... ,나의 식유기,https://blog.naver.com/cmykhc,2013-02-15
서울역호수집닭꼬치 강추,https://blog.naver.com/jyyoon618?Redirect=Log&logNo=221631671193,2019.08.15 닭꼬치를 먹기 위해 닭도리탕을 먹는다는 서울역호수집나도 호기심에 한번 가봤다. 서소문성지역사박물관 갔다가 바로 코앞에 있는호수집고고 5시 오픈인데 16:06 도착 웨이팅하기 싫어서 일찍... ,일상의 기록,https://blog.naver.com/jyyoon618,2019-08-28
남한강변 드라이브와 외식호수집 ,https://blog.naver.com/jsjung1999?Redirect=Log&logNo=70166268405,이석리의호수집 .. 서울에서 먼곳은 아닌데.. 토요일이라 서울 빠져나가는 교통체증이 심했던 서울...호수집 이 제 입엔 그런집중 하나.. 100%리얼 제 입맛 기준이고 제가 간곳에 만족하시는 분들은 꽤... ,양배추님 잘먹고 잘살기,https://blog.naver.com/jsjung1999,2013-04-24
"[충정로맛집]호수집 , 닭꼬치가 완전 맛있어요.",https://blog.naver.com/jims1925?Redirect=Log&logNo=140166458035,"2012.08.22 충정로호수집충정로, 닭꼬치로 유명한호수집 에 다녀왔어요. 여긴 정말 맛있는 곳이라... 서울역 방향으로 약 200m 정도 가다보면 사람들이 잔뜩 줄서서 기다리는 집. 서울 중구 중림동 61-1 (02-392-0695)",A Midsummer Night's Dream,https://blog.naver.com/jims1925,2012-08-25
"불금 번개로 우연히 찾아간 서울역 맛집,호수집 ",https://blog.naver.com/savvy92?Redirect=Log&logNo=221569789572,그 중에서 단연 줄이 눈에 보이는호수집 으로 급 결정을 하게 됐어요 제가 열심히 알아간 다른... ㅜ 뭐 쨋든 소주파이신 분들이 더 좋을거 같다고 고른호수집 이라 맥주파는 조용히 따르기로 했어요 그러나... ,It is a ssunne day,https://blog.naver.com/savvy92,2019-06-24
[서울 중림동] 원조닭꼬치-호수집 ,https://blog.naver.com/odoldodol96?Redirect=Log&logNo=65137968,닭도리탕이면호수집 이 더싸고맛있다~ 아 그럼 닭꼬치에 닭도리탕~ 콜! HDD군과 지금은 타국에계신 S님을 네이트온으로 섭외~ 그러나 HDD군~ 치명적이게도 닭도리탕을 안먹는다고! 그래서 다시호수집 원정대를... ,오돌's 이야기,https://blog.naver.com/odoldodol96,2009-04-09
 호수집 ,https://blog.naver.com/khgs1206?Redirect=Log&logNo=10019288744,얼마 전 직원들과호수집 에 갔다가 빈자리가 없어 허탕을 친 후 가정의날인 수요일 업무를 일찍 끝내고호수집닭꼬치에 재도전 하기로 했다.호수집 에 전화를 드렸더니 예약은 원래 안 받는다고 하셔서... ,고센에서 광야로,https://blog.naver.com/khgs1206,2007-07-07
서울역 중림동 닭도리탕 맛집 -호수집 ,https://blog.naver.com/skcsy59?Redirect=Log&logNo=221556858891," 호수집 은 예전부터 한번 가보고 싶었던 곳이에요. 출퇴근길에 가끔 이 식당 앞을 지나가는데, 서울역의...호수집 을 오시는 분들은 정말 여기만을 위해서 찾아오시는 듯합니다. 평일 저녁 5시 50분쯤 상황입니다.... ",부부가 함께하는 블로그_뚜근부부,https://blog.naver.com/skcsy59,2019-06-07
최자로드 서울역 맛집 *호수집 ,https://blog.naver.com/charming__11?Redirect=Log&logNo=221523305470,맛집호수집:) ! 휴가낸 김에 월요일 평일 저녁 이른 시간을 노려서 갔는데도 역시나 사람이 많았다 @.@... :: 서울역 맛집 *호수집:: 엄청 허름해보이는 외관 간판만 새로 단 것 같았다 *~* 직장인들 퇴근시간 전에... ,아로미네 :D,https://blog.naver.com/charming__11,2019-04-26
"서울역호수집원조 닭꼬치, 연탄 맛 닭꼬치와 매콤한 닭도리탕... ",https://blog.naver.com/emilio1986?Redirect=Log&logNo=221192748208,"서울역호수집원조 닭꼬치, 줄 서서 먹는 맛집 미친 듯이 추운 겨울날, 정동에서 일 마치고 무려 20분을... 사실 집 밖에서 닭도리탕을 먹어본 것이 처음인데 이 정도면 사 먹을만하겠다 싶다. 밥 한 공기씩 추가요... ",박제가 되어버린 천재를 아시오?,https://blog.naver.com/emilio1986,2018-01-24
서울역/충정로역호수집닭도리탕 + 연탄직화닭꼬치,https://blog.naver.com/cozy95?Redirect=Log&logNo=221356427822,식당인호수집 입니다. 저녁 시간에는 5시 오픈인데 시간에 딱 맞춰 왔더니 기다리지 않아도 되겠네요....호수집 의 명성을 확인하는 순간이네요. 충정로역과 서울역 중간 쯤에 위치하고 있습니다. 닭도리탕... ,아포의 맛집 탐방...德 不 孤 必 有 隣,https://blog.naver.com/cozy95,2018-09-11
서울역 맛집 / 연탄불 원조닭꼬치호수집 ,https://blog.naver.com/phjsunflower?Redirect=Log&logNo=10183489150,서울역 원조닭꼬치호수집우리동네에는 참 맛집이 없다고 생각한다. 다들 이런생각을 하는지... 서울역호수집 . 사실 서울역이라고 하기에도 애매하고 충정로라고 하기에도 애매하다 정확하게 말하면 중구... ,꽃씨의 맛집 이야기♬,https://blog.naver.com/phjsunflower,2014-02-27
[서울역 맛집] 호수집 -줄서서 먹는 연탄직화구이 닭꼬치,https://blog.naver.com/hongik9016?Redirect=Log&logNo=220380439132,직장인보다 일찍 퇴근하는 아가리파이터 서울역 맛집호수집 으로 출동했어요 이 집은 퇴근시간만 되면 웨이팅이 어마어마해서 늦은시간에는 줄서서 먹어야되는 곳이에요 이 집 닭꼬치를 한번 먹으면 왜... ,아가리파이터의 먹방,https://blog.naver.com/hongik9016,2015-06-05
 호수집닭꼬치 앓이 중,https://blog.naver.com/arromy?Redirect=Log&logNo=220177502035, 호수집 의 닭꼬치를 한번 먹오보게되면 다른 닭요리는 닭이 아닌 다악..이나 닥이 되고 말아버려요 제말이 뜬금없이 닭타령을 하는이유가~ 주말에호수집 에서 닭꼬치를 먹고난후호수집닭꼬치 앓이 중이랍니다.... ,에버애프터,https://blog.naver.com/arromy,2014-11-10
02/13 @서울역호수집 ,https://blog.naver.com/msa1217?Redirect=Log&logNo=221470519940,"Jenny @서울역호수집여기서부터 저기까지, 처음부터 끝까지 다 맛있는호수집닭볶음탕과 파김치의 신박한 콜라보 + 닭꼬치소주 + 볶음밥은 디저트 주문한 음식이 나오면 찰랑하는 국물에 닭이 빠져있는 것... ",sam,https://blog.naver.com/msa1217,2019-02-20
서울역 맛집 -호수집 (닭도리탕닭꼬치),https://blog.naver.com/herohwangsae?Redirect=Log&logNo=221480920845,서울역 맛집호수집 . 을지로종로에 한정되게 포스팅을 하려고 했는데 자꾸 조금씩 지역이 넓어지고 있다. 다시 좁혀야겠다. 아무튼 오랜만에 방문한호수집 . 옆집까지 확장해서 더 넓어진듯 하다.호수집 ... ,무적황새의 세계여행기록,https://blog.naver.com/herohwangsae,2019-03-05
중림동 /호수집닭볶음탕 닭꼬치 맛집 서울역 충정로역 맛집,https://blog.naver.com/hhhrrr33?Redirect=Log&logNo=221031693876,":: 중림동,호수집닭볶음탕 맛집 서울역 충정로역 맛집 :: 그 유명한호수집잇님들이랑 드!!!!!!!디!!!!!!!!!!!어!!!!!!!!!!!!!!!호수집 은 서울역이랑 충정로역 사이, 중림동에 위치해있다 위치는 살짝 애매하다... ","Love the Life You Live, Live the Life You Love.",https://blog.naver.com/hhhrrr33,2017-06-18
광주 /호수집 ,https://blog.naver.com/begopa1092?Redirect=Log&logNo=80188508713,장어를 드시고싶다는 어머님과 함께 들른호수집어머님과는 주로 반구정 나루터집을 가지만 차도 막히고 멀다 하셔 열심히 검색질 후 팔당댐 근처에 있는 이곳을 발견 숯불장어구이... 바로 저것 때문에..... ,eye of the beholder,https://blog.naver.com/begopa1092,2013-04-22
"[서울역,중림동 맛집] 호수집 -닭볶음탕,닭꼬치",https://blog.naver.com/qkrqhfkal?Redirect=Log&logNo=220308746779,서울역호수집가기전에 들린 명동 롯데 면세점. 요우커들 때문에 전쟁터가 따로없다. 발디딜틈도 없고... 명동에서 커피 한잔 마실려고 했는데 요우커들은 우리에게 틈을 내어주지 않았다 ㅋ 걸어서호수집 까지... ,삑뽀의 EAT TRAVEL LOVE,https://blog.naver.com/qkrqhfkal,2015-03-23
"최자맛집 서울역호수집후회없다 닭꼬치,,,,,❣️",https://blog.naver.com/01073341633?Redirect=Log&logNo=221499082856,예전에 열애설났던 곳으로 유명한 최자로드호수집 ! 그때부터 알고있었고 그 후에도 페북이나 인스타에서 몇번 보고호수집 은 꼭 가봐야겠다 했는데 드디어 가보게 됨!!*_* 5시 오후오픈이라서 4시 50분쯤 갔더니... ,옹이의 소소한 일상,https://blog.naver.com/01073341633,2019-03-27
원조닭꼬치호수집/ 터프한 연탄 직화구이 닭꼬치,https://blog.naver.com/inho3412?Redirect=Log&logNo=50090886210,할일없어 심심해 죽겠다는 모님의 제안으로 급 가보게된 충정로(중림동)의호수집 . 워낙에 닭꼬치로... ^^호수집Tel 392-0695 중구 중림동 61-1 (충정로역 4번출구 나와 한국경제신문방향 우회전해서 신문사 지나... ,그랬지의 잠꼬대,https://blog.naver.com/inho3412,2010-07-02
"[서울역 -호수집 ] 닭볶음탕, 닭꼬치 맛집",https://blog.naver.com/ginger176?Redirect=Log&logNo=220479325134,오랜만에 다시 방문한호수집 입니다. 닭볶음탕과 닭꼬치로 유명하지요. 지하철역과 거리가 좀 있어서... 편이데호수집닭꼬치는 또 생각나는 그런 맛입니다. 배만 허락한다면 2개씩 먹을텐데 말이죠... 다른... ,"This, too, shall pass",https://blog.naver.com/ginger176,2015-09-12
서울역 닭도리탕 닭꼬치 맛집호수집 ♥,https://blog.naver.com/rothd?Redirect=Log&logNo=220149306385,서울역의호수집원조 닭꼬치집 입니다. 남친땜에 알게 되서 가기 시작했는데 늠 맛있어서 가끔 완전 생각나요~ 주말을 맞이해서 또 가게된호수집 !! 닭꼬치랑 닭도리탕 전문점인데 완전 굿!!! 장소가 작아서... ,★죠니나라★,https://blog.naver.com/rothd,2014-10-13
"서울역/중림동,호수집 - 닭도리탕/닭꼬치",https://blog.naver.com/alswjd88?Redirect=Log&logNo=221480575788,서울역/중림동 닭도리탕맛집/ 닭볶음탕맛집호수집진짜 한 10년만에 방문한호수집가게 앞에서 하루종일 꼬치 구우시는 분도 대단하시당 ㅠㅠ 저녁 시간에는 5시 오픈이고 5시 좀 넘어서 도착했는데... ,여행과 맛나다♡ by 너구리,https://blog.naver.com/alswjd88,2019-03-05
중림동맛집] 최강의 닭꼬치구이집 원조닭꼬치호수집 ,https://blog.naver.com/jsjung1999?Redirect=Log&logNo=70168179732,아주아주 오랜만에 방문하는 닭꼬치의 원조호수집 .. 이제는 아드님이 아버님대신 꼬치구이를 굽는다.... 좀더 양념을 가미하면 더 맛있을거인데~~호수집 하면.. 역시 연탄불에 굽는 이거.. 닭볶음탕 주문... ,양배추님 잘먹고 잘살기,https://blog.naver.com/jsjung1999,2013-05-24
"서울역 맛집-닭볶음탕,호수집원조닭꼬치, 충정로역 맛집... ",https://blog.naver.com/akaladycha?Redirect=Log&logNo=10141380618,서울역호수집원조닭꼬치로 약속을 잡았음. 엊그제 다녀온거 같은데 그게 4월이었다는-_ - 시간이 참 빨리 가는구나. 또 운좋게 얼마 안기다리고 친구오자마자 바로 우리차례ㅋ호수집원조닭꼬치에 왔으니... ,LADYCHA,https://blog.naver.com/akaladycha,2012-06-20
최자설리 맛집 서울역 ' 호수집 ' 닭볶음탕,https://blog.naver.com/wjoo_nara?Redirect=Log&logNo=220791750250,최자설리 맛집 서울역 ' 호수집 ' 닭볶음탕 ㅎㅏ♥ㅣ♥ㅕ~♡ 넘나 오랜만인것! 최자설리 커플도 줄서서 먹고 갔다는 최강 닭볶음탕+닭꼬치 먹고 온 후기쟈냐 '0')/ [ 서울역 닭볶음탕 맛집호수집] A: 서울 중구... ,우아한 우쥬나라♩,https://blog.naver.com/wjoo_nara,2016-08-19
"스타일의 연탄불 닭꼬치와 닭도리탕 맛집,호수집원조닭꼬치",https://blog.naver.com/mementosyhk?Redirect=Log&logNo=221521085879,바로호수집 입니다. 연탄불 닭꼬치와 닭도리탕이 매력적인 곳이죠. 첫 리뷰를 했던 2015년 이후 꾸준히 들르고 있는데요. 2018년 방문기를 가지고 업데이트를 해야 겠다 싶었어요.호수집원조닭꼬치는 시간을... ,법돌이의 소소한 일상 이야기,https://blog.naver.com/mementosyhk,2019-04-23
서울역맛집호수집닭볶음탕♡,https://blog.naver.com/lsjsjo426?Redirect=Log&logNo=221324199866,서울역맛집으로 유명한호수집초복을 지나면서 닭이 먹고 싶었는데 근처에 유명한곳이 있다고해서... 닭꼬치엿어요 #서울역맛집 #서울역 호수집#서울역닭볶음탕 #서울역복날 # 호수집# 호수집 예약 여기... ,soo,https://blog.naver.com/lsjsjo426,2018-07-22
"[서울역 맛집] 호수집: 닭꼬치, 닭볶음탕 정말 맛있는 정겨운 맛집",https://blog.naver.com/kizaki56?Redirect=Log&logNo=221085511970,"[서울역 맛집] 호수집: 닭꼬치, 닭볶음탕 정말 맛있는 정겨운 맛집 안녕하세요 몽몽이에요 제가 정말... 서울역호수집하응 맛있는 닭볶음탕 + 닭꼬치인데 가격도 비싸지 않은게 이 곳의 최대 장점이 아닐지... ",몽몽의 먹어야 사는 블로그,https://blog.naver.com/kizaki56,2017-12-13
[서울역]호수집 ,https://blog.naver.com/atonement421?Redirect=Log&logNo=221432255479,최자로드로 유명해진호수집 . 이제 술은 끊었지만 이때까지만 해도 음주를 좋아했던... 근데 서울역에 따로 갈 일도 없고 가고 싶다고 염불만 외다가 서울역 근처에서 약속이 있어서호수집 까지 가게 되었다.... ,A fateful life,https://blog.naver.com/atonement421,2019-01-02
중림동호수집 ,https://blog.naver.com/sunga114?Redirect=Log&logNo=150187355452,서울역 인근 중림동에 위치한 닭꼬치 전문점 '호수집' 중림장에 들렀다가 우연히 봤던 대기 인원이... 특이하게도 떡사리와 깻잎을 한껏 넣은호수집 의 닭볶음탕 반주로 소주 한 병 간단히 곁들이고 예상했던... ,쏘오 딜리셔스,https://blog.naver.com/sunga114,2014-03-22
[서울역]호수집- 닭도리탕/닭꼬치,https://blog.naver.com/dntwk87o_o?Redirect=Log&logNo=220193168392," 호수집종류 : 닭요리 대표메뉴 : 닭도리탕, 닭꼬치 1인당 예상가격 : 8,500원~10,000원 시간 : 10:00~14:00... 곳에서호수집간판이 딱! 보입니다.) 전화 : 02 - 392 - 0695 닭이 먹고 싶었던 이날, 닭도리탕과 닭꼬치... ",웃자o_o의 세상사는 이야기,https://blog.naver.com/dntwk87o_o,2014-11-28
"서소문 순교역사박물관과호수집 , 약현성당 일주",https://blog.naver.com/yaongii113?Redirect=Log&logNo=221567376383,성당에 다니는 친구와 시간을 내서 박물관에 들렀다가 주변에 있는 맛집으로 유명한호수집 까지... 서소문 성지에서 걸어서 5분 거리에 있는 맛집호수집 니다. 닭볶음탕과 연탄 불에 구워주는 닭꼬치가... ,"여행과 바람난 방송작가, 세상에 홀리다.",https://blog.naver.com/yaongii113,2019-06-21
[중림동]호수집 ,https://blog.naver.com/soulbrown1?Redirect=Log&logNo=110152495337,당연스런 수순으로 대성집에 방문하였다가 정기휴일에 크게 상심하여 한옥집에서 간단하게 점심먹고 어슬렁 거리기를 서너시간 허기진 배를 부여잡고 방문한 곳은 중림동호수집서울역 뒷켠 아주... ,완소나얼,https://blog.naver.com/soulbrown1,2012-11-23
"[충정로맛집] 호수집 ,원조 닭꼬치,닭도리탕",https://blog.naver.com/misssyh?Redirect=Log&logNo=20175983271," 호수집드뎌 방문1! 움하하 서울역에서..삼화고속 타고 지나갈때..길게 줄서있는 모습에..찾아봤던 곳!! 알고보니 유명한 집 이 다음에 영애선배,다은선배랑 먹을 집으로 내가 미리 정해놓음ㅋㅋ 날 기대하게... ",좋아해,https://blog.naver.com/misssyh,2013-01-14
"[서울역]호수집닭볶음탕 닭꼬치, 중구 서울역 만족스러운... ",https://blog.naver.com/kolae666?Redirect=Log&logNo=220916520982,"[서울역]호수집닭볶음탕 닭꼬치, 중구 서울역 만족스러운 닭도리탕! 9월말이었던거 같네요. 오랜만에... 목적지는호수집 . 전부터 가고팠던 공간이고 그 최자인스타에 설리랑 방문한 곳으로 더 유명세를 떨쳤던.... ",제이슨님의 세상유랑기,https://blog.naver.com/kolae666,2017-01-21
덕수궁 / 서울역호수집 ,https://blog.naver.com/babesh?Redirect=Log&logNo=221312735449," 호수집/ 서울역 닭볶음탕으로 유명한호수집 , 여기는 유명해서 꼭 한 번 와보고 싶었던 곳인데 평일임에도 불구하고 웨이팅... 진짜 오래 기다렸다... 주변도 허허벌판에 딱호수집하나만 인기 있는 곳인데... ",venero,https://blog.naver.com/babesh,2018-07-04
서울역호수집: 닭도리탕 + 닭꼬치,https://blog.naver.com/lbj3557?Redirect=Log&logNo=221221311392,"서울역호수집서울역에서 걸어가기 쪼꼼 멀긴 하지만 그래도 뭐 암튼 닭꼬치가 맛있다는 곳. 웨이팅.... 아무튼,호수집 은 지나가다 들르기 좋고 호기심에는 가보기 좋겠지만 굳이 머 줄서서 가는것을 추천... ",나를 찾아서,https://blog.naver.com/lbj3557,2018-03-05
중림동/원조 닭꼬치호수집 ,https://blog.naver.com/ssojlee?Redirect=Log&logNo=130044059734,원조 닭꼬치호수집이 사진은 이전에 찍어둔 것입니다. 갔다가 바로 앞에서 꼬치가 다 떨어졌다는 말에 급좌절하여 발길을 돌렸다죠 꼭 다시 와보리라 찍어놓고 갔던겝니다. 으흐~ 사장님이 밖에서 직접... ,명랑신비의 세상걷기,https://blog.naver.com/ssojlee,2009-03-10
서울역호수집:: 위치 영업시간 메뉴 가격 / 제대로 닭꼬치... ,https://blog.naver.com/somc_travel?Redirect=Log&logNo=220526527839,서울역호수집:: 위치 영업시간 메뉴 가격 / 제대로 닭꼬치 맛집 ♡ 오늘은 제가 젤 좋아하는 닭꼬치 맛집을 소개하려구요! 항상 줄이 어마어마한 서울역호수집이에요!호수집위치 주차할 공간은 따로... ,솜씨여행 ♡,https://blog.naver.com/somc_travel,2015-11-02
원조 닭꼬치호수집후기 / 서울역 맛집 / 최자맛집,https://blog.naver.com/tjssla4567?Redirect=Log&logNo=221417598228,#최자로드 #최자맛집 으로 유명한호수집전설의 설리 최자 커플의 첫 데이트 장소라는호수집 에 드디어 갔다 왔다. - 밖엔 이렇게 닭꼬치를 굽고 계시고.. 보니까 외국인들도 꽤 있었다. 우리는 다행히 대기 2번... ,Autumns Evening Breeze,https://blog.naver.com/tjssla4567,2018-12-12
[중림동]호수집 ...터프한 닭꼬치와 시원한 닭도리탕~,https://blog.naver.com/dodoti?Redirect=Log&logNo=140208265014,일전에 지나가다 줄이 쫙 서있기에 저집 머지 하고 봤더니 서울역 부근에서는호수집 이라하면 술맛나는 집으로 유명하다는 폿팅이 여러개 보이더군요..배고파님의 폿팅까지~ 서식지에서 걸어갈수있는 곳인지라... ,미누..기억을 남기다..,https://blog.naver.com/dodoti,2014-03-10
팔당맛집 ' 호수집 '의 송어와 장어,https://blog.naver.com/knockya?Redirect=Log&logNo=150157759606,팔당맛집 ' 호수집 '은 맞은편 팔당호를 바라보고 위치해 있다. 조금만 더 가면 바로 퇴촌이다. 친구네가 여기서 보자고.. 팔당맛집호수집바로 맞은편에 팔당호가 보인다. 조금은 허술해 보이지만 웬지 정겨움이... ,맛찾사의[사진]이야기,https://blog.naver.com/knockya,2013-01-26
[ 서울역 맛집 ]호수집닭꼬치 / 닭도리탕,https://blog.naver.com/sso1214?Redirect=Log&logNo=221283235812," 호수집호수집 은 서울역 맛집으로 유명한 곳인데요, 이번에 부산여행을 다녀오면서 저녁을 먹기위해호수집 을 다녀왔어요. (예전에 가려다가 문닫아서 못감ㅠ) 위치는 서울역에서 충정로역 중간정도에... ",헬로우쏭:),https://blog.naver.com/sso1214,2018-05-24
닭을 정말 잘 다루는 곳. 서울역호수집 .,https://blog.naver.com/akamk_?Redirect=Log&logNo=221606823147,오늘의 포스팅은 서울역호수집 . 호수삼계탕이라고 삼계탕 유명한 집 있는데 거기 아님 ㅋ 닭도리탕이 메인인 곳인데. 닭도리탕도 맛있고. 닭꼬치가 진짜 미치는 곳이다. (메뉴판 제일 처음 있는게 메인... ,mkLog,https://blog.naver.com/akamk_,2019-08-06
"[서울역 맛집 / 중림동 맛집] 내공있는 닭꼬치와 닭도리탕,호수집 ",https://blog.naver.com/yesican1?Redirect=Log&logNo=120162852533,"가끔 닭꼬치와 닭볶음탕이 생각날 때 이 집호수집 이 자주 아른거릴 것 같다. 줄 서서 기다리는 시간만 피해서 갈 수 있다면 좋을 듯 싶다. 가격 닭꼬치1개 1,500원, 닭도리탕 13,000~25,000원 전화 02-392-0695... ",쭌의맛집 since 2003,https://blog.naver.com/yesican1,2012-06-28
충정로 맛집 /호수집 _ 원조 닭꼬치 닭볶음탕 전문점,https://blog.naver.com/goroco87?Redirect=Log&logNo=220232392073,"원조닭꼬치 _호수집 ! 사실 1년전쯤 다녀왔던 곳인데, 블로그를 안할때라... 묵혀뒀다 지금 포스팅하기..... 안에 메뉴판엔호수집 이라고 써있다. 둘다 맞는 명칭인듯...?ㅋㅋ 이때 세명이서 갔었기 때문에... ",문달이의 달로그,https://blog.naver.com/goroco87,2015-01-07
[서울역맛집]닭도리탕맛집 원조닭꼬치호수집 ,https://blog.naver.com/ithebliss?Redirect=Log&logNo=20175581592,이번에 소개해드릴 서울역맛집은 원조닭꼬치호수집 이라는곳인데요. 너무 유명한곳이라 아실분은... 원조닭꼬치호수집 에 대해 포스팅하겠습니다. (짧고 굵게 갑니다 :) 닭도리탕맛집 원조닭꼬치호수집 의... ,우리가 선택한 청첩장! 더블리스,https://blog.naver.com/ithebliss,2013-01-09
[서울역 맛집] 닭볶음탕과 닭꼬치가 있는 그 곳 ' 호수집 ',https://blog.naver.com/harimmarket?Redirect=Log&logNo=220036077258,"서울역 맛집 ' 호수집 ' 예전에는 원조 닭꼬치 간판아래 쪽만 가게였는데 옆으로 확장을 했더라구요....호수집 의 메뉴! 참 간단하죠? ㅎㅎ 닭볶음탕 중(中) 하나면, 남성 2인 또는 여성 3인 정도 먹기 좋은... ","맛있鷄, 건강하鷄, 행복하鷄, 하림과 함께!",https://blog.naver.com/harimmarket,2014-06-20
충정로맛집 -호수집(닭볶음탕 완전 굿♡) / 충정로 약현성당 산책,https://blog.naver.com/mymeet6?Redirect=Log&logNo=220143549001,"충정로맛집 -호수집(닭볶음탕 완전 굿♡) / 충정로 약현성당 산책 오늘은 충정로맛집 중 닭볶음탕이 맛있었던호수집 을 소개해드릴까 합니다 :) 요기 근처 닭한마리도 맛있는데, 그건 다음에 가면 사진을... ",밍이씨,https://blog.naver.com/mymeet6,2014-10-08
서울역맛집)호수집닭볶음탕 닭꼬치♡ -최자로드에 나온 그집,https://blog.naver.com/thatgirl2?Redirect=Log&logNo=221410214563,내가 너무 좋아하는호수집 ♡ 얼마전에 알게된 집인데 겉은 허름하지만 정겨운맛이 있는 맛집이다... 한다 # 호수집왠지 오랜 전통이있을것같은 실내포차느낌의 식당 허름하고 거칠고 세월의 흔적이 있지만 그게... ,즐겁고 신나는 일상♥,https://blog.naver.com/thatgirl2,2018-12-01
' 호수집 ' 태그의 글 목록,https://www.beer2day.com/tag/%ED%98%B8%EC%88%98%EC%A7%91,' 호수집(원조 닭꼬치)' 입니다. 연탄 직화구이로 유명한호수집 의 닭꼬치 간판 어디에도 ' 호수집 '이란... 이 집 닭꼬치는 좀 특이합니다. 살만 발라진 일반 닭꼬치와는 다르게 부위별로 토막낸 닭의 부위가... ,Beer2DAY,https://www.beer2day.com/,2010-09-09
