title,link,description,bloggername,bloggerlink,postdate
[서울역]호수집 ,https://blog.naver.com/naxkarma?Redirect=Log&logNo=221601874096,오랜만에호수집 에 방문해 보았습니다. 크지도 않은 집에 초저녁 부터 줄이 서 있으니 엄두를 못냈었죠. 이 날은 조금 이른 시간에 도착 할 수 있어서 지인 먼저 입장 시켜놓고 들어갔습니다. 지인이 들어간 후에... ,펜과 칼로 그리는 취미 생활,https://blog.naver.com/naxkarma,2019-08-01
서울역_ 호수집 ,https://blog.naver.com/wh35wh35?Redirect=Log&logNo=221184957301,아주아주 오랜만에호수집늘 들르고픈 생각은 있었으나 웨이팅의 압박으로 마음에만 담아두었던호수집ㅎㅎ 토요일 저녁에 방문했는데도 장사진... 주중에는 회식 인파로 장사진... 암튼 언제가나 기다림은... ,일기장,https://blog.naver.com/wh35wh35,2018-01-14
"중림동(서울역)/원조 닭꼬치,호수집 ",https://blog.naver.com/ssojlee?Redirect=Log&logNo=130067655691,"닭도리탕을 아주 러브하는 친구와호수집 을 갑니다. 역시 대기하고 있는 사람들, 여전히 열심히... 너무 잘 먹는다~~ ^^v 이차는 간단하게 호가든..^^ 오랫만에호수집 인데 여전히 너무 맛있네요. 이제 아침... ",명랑신비의 세상걷기,https://blog.naver.com/ssojlee,2009-08-24
충정로 맛집 /호수집닭꼬치,https://blog.naver.com/jsjung1999?Redirect=Log&logNo=221176806121,닭꼬치는 최강 충정로 맛집호수집최강의 닭꼬치에 닭도리탕을 껴서 파는 충정로 맛집호수집연탄불에 굽는 1인 2꼬치 제한이 아쉽기는 하지만 굽는 속도가 먹는 속도를 못쫓아가선지 더 먹기에 아쉬움이... ,양배추님 잘먹고 잘살기,https://blog.naver.com/jsjung1999,2018-01-03
[서울역 맛집] 최자로드호수집 ,https://blog.naver.com/gksmfyujin?Redirect=Log&logNo=221590809276,닭도리탕에다가 소맥 해줘야하는데 술이 싫어서 패스퍄스~ 휴무 : 일요일 브레이크 타임 : 14:00~17:00 직접 돈주고 먹은 후기입니다 #최자맛집 #서울역 #서울역맛집 # 호수집#닭볶음탕,새싹이,https://blog.naver.com/gksmfyujin,2019-07-20
서울역호수집닭볶음탕보단 닭꼬치,https://blog.naver.com/heartime?Redirect=Log&logNo=222449078468,그 대신호수집 에서 맛본 뜨거운 닭꼬치가 생각날 뿐이다!!!호수집서울역 뒤편으로 나있는 거리를 걷다 보면 주황색의 간판이 선명하게 빛나는 곳이다 최자로드 맛집 유튜브에서 소개되었다고는 하지만 내게는... ,나만의 일상 그리고 이야기,https://blog.naver.com/heartime,2021-07-28
중림동/원조닭꼬치 원조 닭꼬치호수집 ,https://blog.naver.com/breadjean?Redirect=Log&logNo=70071716190,"닭꼬치호수집닭꼬치를 굽고계시는 사장님~ (겨울에도 이자리를 지키시면서 닭꼬치를 구우시는듯)... 좋았고호수집 의 닭도리,닭꼬치도 누구나 좋아하실맛~!! 강추입니다 4인기준 황성집에서 모듬순대와... ",거니의 빵빵하고 맛난 세상,https://blog.naver.com/breadjean,2009-10-16
[서울역맛집] 중림동 연탄구이 닭꼬치집 ' 호수집 ',https://blog.naver.com/volleo?Redirect=Log&logNo=50126551499,서천팸투어 때 같은 민박집에서 일박을 했던 멤버 셋이 월요일 중림동 닭꼬치전문 ' 호수집 '에서 모였다.... 사람들이 줄을 서서 기다려야 하는 맛집호수집 . 명성이 자자한 듯. 사진 상단에 초록색 네온싸인이... ,남상기행정사,https://blog.naver.com/volleo,2011-11-16
"서울역, 닭볶음탕 닭꼬치 맛집 ' 호수집 '",https://blog.naver.com/ujin9029?Redirect=Log&logNo=220214092648,"서울역 근처의 닭볶음탕, 닭꼬치로 유명한호수집이예요. 되게 오래되고 유명한 곳이라고 하더라구여. 평일 저녁 먹으러 갔는데 웨이팅이.. 한 되여섯 팀정도 있었는데, 아무래도 술한잔 하는 메뉴들이고 가게가... ",유진리 블로그,https://blog.naver.com/ujin9029,2014-12-18
숙대 남영돈 무조건 항정살 (feat. 서울역호수집 ),https://blog.naver.com/bonitaaa1?Redirect=Log&logNo=222518020035,올해 1월카톡인데 남영돈으로 카톡 검색하니까 나옴ㅋㅋㅋㅋㅋㅋ 이게 윗카톡 1번의 서울역호수집 인... 서울역호수집진짜 한번 더 간다. 닭꼬치 성공한다.호수집닭꼬치 기다려라. 생각난 김에 실시간으로... ,bonini,https://blog.naver.com/bonitaaa1,2021-09-27
연탄불에 굽는 닭꼬치와 진한 닭도리탕 - 중림동호수집 (원조... ,https://blog.naver.com/mercyblu?Redirect=Log&logNo=60132773428,중림동에 위치한 닭꼬치와 닭도리탕이 유명한호수집 . (이제는 닭도리탕이 아니라 닭볶음탕이 맞는 표현) 20년이 훌쩍 넘은 오래됨과 허름한 분위기 그리고 연탄불이 자아내는 분위기가 향수와 함께 입맛도... ,머시블루's Happy Nation,https://blog.naver.com/mercyblu,2011-06-23
(중림동)호수집- 닭도리탕과 닭꼬치의 성지?,https://blog.naver.com/applemint75?Redirect=Log&logNo=221053161463,아주 오래전에호수집근처에 살 때는 그래도 가끔 갔는데 이사 후에는 거의 못간.... 찾아보니 마지막으로 갔던게 2011년이다. 오래됐어도 너무 오래되었네. 그 근처에 잠시 볼일이 있어 갔다가 근처에 사는... ,해치지 않아~,https://blog.naver.com/applemint75,2017-07-17
[서계동/서울역] 호수집- 혼자 올 집이 아니었네,https://blog.naver.com/emptyh?Redirect=Log&logNo=222197767027,내부 서계동호수집말만 듣다가 드디어 갔다. 코로나 덕에 줄도 안 섰네만 안은 거의 만원. 메뉴 혼자 먹을 것은 오징어불고기 밖에 없다. 오징어볶음 준수한데 양념은 내 입엔 좀 달다. 오징어 탄력은 좋다.... ,"알움, 앎이 움트는...",https://blog.naver.com/emptyh,2021-01-05
"추운 4월이 좋아! ( 호수집닭꼬치, 호수삼계탕)",https://blog.naver.com/mnschola?Redirect=Log&logNo=221254427014,# 호수집특히 이럴 땐 좀 뜨뜻한 음식을 먹으며 몸보신을 해야거든! 서울역호수집밖에서는 닭꼬치가... #호수삼계탕 수요미식회 등등 방송에도 많이 나온 호수삼계탕! 위치가 어중간해서 드디어 가봤다. 나는... ,"주로 돌아다니는, 인상 깊은 취미생활",https://blog.naver.com/mnschola,2018-04-16
중림시장의 닭꼬치집 - 원조 닭꼬치( 호수집 ) 2,https://blog.naver.com/spriteh?Redirect=Log&logNo=110004519248,파전 중림시장의 닭꼬치집 - 원조 닭꼬치 ( 호수집 ) 02 - 392 - 0695 비가 오는 날이면 향이 짙은 커피향을 맡는것도 좋지만 왠지 빗소리를 들을 수 있는 술집을 찾아 헤메곤한다. 그런 의미로 가본 닭꼬치집이다.... ,felix,https://blog.naver.com/spriteh,2006-05-23
[충정로 맛집] 호수집- 닭볶음탕과 닭꼬치로 소문난 맛집,https://blog.naver.com/st_leo?Redirect=Log&logNo=220021099768,"여러 사람의 입맛을 사로잡은 중림동호수집 이다. 저렴한 가격과 정다운 분위기에 친구, 가족... 파김치와 총각김치가 이 집 반찬의 전부임에도 전혀 부족함이 느껴지지 않는 풍족함은 뛰어난 맛 때문이다.... ",우리 동네에서 살아남기 2,https://blog.naver.com/st_leo,2014-06-05
[충정로 맛집]호수집 (원조 닭꼬치),https://blog.naver.com/hoyilovekj?Redirect=Log&logNo=60171812713,친구님이 스트레스를 받아서 매운게 땡긴다고 해서 출동한 충정로호수집 이에요.이 날은 태풍 '산바'가 올라온 날이었답니당 ㅋㅋ태풍을 뚫고 만났어요~ ㅋㅋㅋ 간판은 원조 닭꼬치라고 되어있는데 왜호수집 인... ,Alea iacta est,https://blog.naver.com/hoyilovekj,2012-09-21
서울역 맛집 : 줄서서 먹는 닭도리탕 원조 닭꼬치호수집 ,https://blog.naver.com/zzyongimda?Redirect=Log&logNo=221293605667,서울역 맛집 : 줄서서 먹는 닭도리탕 원조 닭꼬치호수집전부터 먹어보고싶었던호수집닭도리탕 닭꼬치 다음날 쉬는날이여서 간단히 한잔하고자 들렸는데 퇴근하고 도착하니 우리앞에 10팀이 대기중이였다... ,zzyongimda,https://blog.naver.com/zzyongimda,2018-06-07
 호수집- 서울역 닭볶음탕과 닭꼬치의 조화,https://blog.naver.com/wind_358?Redirect=Log&logNo=10157654770,"친구 회사에서 값비싼 알바를 했기에, 그 친구를 데리고 오랜맛집인호수집 으로 갑니다. 비록...호수집 의 유일한 반찬, 하지만 그것또한 별미인 깍두기와 파김치입니다. 오동통통통 닭이 맛있게 익었습니다.... ",지극히 일반적인 인생의 한 컷,https://blog.naver.com/wind_358,2013-01-22
(맛집)호수집in 서울역,https://blog.naver.com/offleyporto?Redirect=Log&logNo=40196784943, 호수집 입구 옆에 계신 잘생긴 총각분이 닭꼬치를 담당하고 실내에선 이모님들이 닭도리탕을 만들고... 닭꼬치 전설의호수집닭꼬치가 나왔습니다. 과연 저게 1500원으로 만들 수 있는 걸까요? 저게 1개중에 1/3... ,즐겁고 즐겁고 즐겁게,https://blog.naver.com/offleyporto,2013-09-09
서울역맛집 닭꼬치맛집 닭도리탕맛집 충정로호수집 ,https://blog.naver.com/ben1224?Redirect=Log&logNo=120116183825,유명하다는호수집 을 방문했으나 많은 대기 인파로 인해 발길 을 두번이나 돌리고 세번째는 아예... 원조 닭꼬치라는 문구가 큼지막하게 있고호수집 이란 가게명은 키가 좀 커야 눈에 들어옵니다.ㅋ 닭꼬치를... ,부귀영화,https://blog.naver.com/ben1224,2010-10-06
"[서울/중림] 서울역호수집/ 최자로드 닭볶음탕 , 닭꼬치 맛집",https://blog.naver.com/drunkengina?Redirect=Log&logNo=221624985586," 호수집주소 : 서울 중구 청파로 443 (지번 : 중림동 61-4) 전화 : 02-392-0695 영업시간 : 11시30분 - 22시 (B/T : 14시 - 17시) * 일요일 휴무 내가 도착한 시간은 5시 30분 정도였는데, 웨이팅 5번이었고 빈 테이블은 2개... ",극적인 순간들,https://blog.naver.com/drunkengina,2019-08-23
"[서울역맛집] 원조 닭꼬치 닭볶음탕 추천호수집 , 또가고싶은... ",https://blog.naver.com/kindmiso89?Redirect=Log&logNo=221435909289,"[서울역맛집] 원조 닭꼬치 닭도리탕 추천호수집 , 또가고싶은 인생 맛집 제대로된 닭볶음탕 먹고싶어서 남편이 폭풍검색하고 지인찬스써서 알게된 곳!호수집알고보니 최자로드 맛집이었음!호수집주소... ",♡미쏘 신혼 에세이♡,https://blog.naver.com/kindmiso89,2019-01-07
 호수집 . 원조 닭꼬치. 닭도리탕. 서울역 맛집,https://blog.naver.com/arahan82?Redirect=Log&logNo=220006076756,중림동 / 서울역 근처 맛집호수집 / 원조 닭꼬치 집 근처 매일 지나 다니면서 저기는 왜 사람이 많을까? 하고만 생각만 하고 지나쳤던 음식점인데 칭구가 엄청 맛있었다는 소문을 흘려서 같이 한번 가보기로... ,행복한 뜨응기,https://blog.naver.com/arahan82,2014-05-21
[중림동] 연탄향이 솔솔 닭꼬치구이호수집 ,https://blog.naver.com/lsh5114?Redirect=Log&logNo=130069302981,우선 맛은 검증된 집 요즘 해가짧아 7시 30분쯤 도착하니 벌써 해는 저물고 어둑어둑하다. 어두워서... ㅎㅎ 염천교를 건너서 나오는 삼거리에 위치하고 있다. 삼거리에서 좌회전 하자마자호수집 ,보석같은현정그리고원이™,https://blog.naver.com/lsh5114,2009-09-17
"[서울역맛집] 술이 술술 들어가는, 닭꼬치 맛집호수집 ",https://blog.naver.com/saturneed?Redirect=Log&logNo=221454038867,‘ 호수집 ’은 아니었어요호수집 의 닭볶음탕과 닭꼬치는 술 마시기 최적의 안주였습니다. 충정로 역에서 7분 정도 걸으면 도착! 저녁 타임은 오후 5시부터 여는데.. 세상 줄이 후덜덜 하더라구요. 그냥... ,I ate world.,https://blog.naver.com/saturneed,2019-01-29
충정로 맛집 / 중림동 맛집 -호수집(닭꼬치가 유명하지만 점심... ,https://blog.naver.com/saturnjoa?Redirect=Log&logNo=221589327996,"충정로 중림동 쪽에호수집 이라고 유명한 맛집이 있듬. 점심은 요즘 날이 더워서 그닥 웨이팅 없는 것 같은데, 저녁은 5시반?부터 웨이팅이 시작되는 곳임 레알로 도대체 누가 야근을 하는거야호수집 은... ",이 맛집을 밤끼만 알고 있을 수는 없지,https://blog.naver.com/saturnjoa,2019-07-18
639번째 식당 /호수집/ 중림동: 국보급 닭꼬치,https://blog.naver.com/tastesherlok?Redirect=Log&logNo=220770407493,"짙은 닭도리탕 촉촉한 닭꼬치 식감과 간이 흠 잡을 곳 없다호수집 은 명성만큼이나 맛이 좋다. 닭도리탕과 닭꼬치를 파는데, 특히 닭꼬치 맛은 타의 추종을 불허한다. 필동분식은 다소 퍽퍽하면서, 선이 굵은... ",미식탐정,https://blog.naver.com/tastesherlok,2016-07-24
강남 딘타이펑/닭꼬치집으로 부르고 싶은 최자로드호수집 ... ,https://blog.naver.com/01096648089?Redirect=Log&logNo=221600375199,#최자로드# 호수집최자로드 땜에 유명해진호수집 . 내가 가자고 해서 온 건데 가게에 우리 테이블만 있어서 동공 지진 맛집 맞나... 왜케 손님이 없지 닭볶음탕을 시켜야지 닭꼬치를 시킬 수 있다. 그... ,대충대충블로그,https://blog.naver.com/01096648089,2019-07-30
"서울역 맛집 ::호수집(닭도리탕, 닭꼬치)",https://blog.naver.com/gop310514?Redirect=Log&logNo=221280214239,서울역과 충정로역 사이에 있는호수집최자 설리가 데이트사진 찍혀서 더 유명한 집이다 우리는... 참고로호수집 은 호불호가 심한곳! 맛있다는 사람도 많지만 없다는 사람도 많다 정신없이 마구마구 먹었다... ,소지니의 데이트블로그,https://blog.naver.com/gop310514,2018-05-20
JUL (15) : 서울역 맛집호수집/ 최자맛집 또는 최자로드... ,https://blog.naver.com/toomyung_?Redirect=Log&logNo=222036426081,위치한 # 호수집닭도리탕집인데 닭꼬치 광팬이 더 많은 듯한 곳이다. #최자로드 또는 #최자맛집 으로... 그 분들 이 집 한 두번 온 느김이 아니었어... 후후후... 연탄불은 솔솔 올라오는데 한바탕 입장한 후라... ,meat and potatoes,https://blog.naver.com/toomyung_,2020-07-20
[서울/중구] 서울역 직장인들의 갓성비 힐링 성지호수집 ,https://blog.naver.com/yonvely727?Redirect=Log&logNo=222496862250,#내돈내먹 # 호수집매일 11:30 - 22:30 (Break time 14:00 - 17:00) 1-2년 전에 서울역 근처에서 직장 생활할 때 한 번 온 적이 있는 서울역호수집 !! 그 때는 점심 먹으러 왔는데 점심 때믄 닭꼬치 주문이 불가라 좀 아쉬웠다... ,요니의 하루 ♥,https://blog.naver.com/yonvely727,2021-09-06
" 호수집 (닭도리탕, 닭꼬치) - 서울역, 중림동 맛집",https://blog.naver.com/clearskin119?Redirect=Log&logNo=221181060392,오늘은 서울역 주변에 위치한호수집 을 소개합니다. ^^ 처음 가본건 5년전쯤인데 가성비의 끝판왕이자 닭꼬치계의 살아있는 전설이라고 볼 수 있는호수집 입니다. 식당 앞에서 닭꼬치를 열심히 구우시고... ,닥터더마,https://blog.naver.com/clearskin119,2018-01-09
에어팟키링 만들고 서울역에 있는호수집고고,https://blog.naver.com/2107076?Redirect=Log&logNo=221374354344,분명 ㅋㅋㅋㅋㅋㅋㅋ 막간을 이용해 스노우 ㅋㅋㅋㅋㅋㅋㅋㅋ 서울역으로 이동해서호수집오랜만에 방문했어요 감나무도 맛있다니 다행 파김치가 일품이죠 ㅋㅋㅋㅋㅋ 오랜만에 동대문 나들이 재밌었어요,히로그(HEELOG),https://blog.naver.com/2107076,2018-10-10
서울역맛집호수집닭꼬치 넘나 먹고싶다!!!!!,https://blog.naver.com/sh_theme?Redirect=Log&logNo=220822014316,"서울역맛집호수집닭꼬치 넘나 먹고싶다!!!!! 한창 눈물로 밤을 지새우던 어느 여름날. 고등학교... 서울역근처가 회사인 나와 신촌인 친구의 접선장소를 정하다가, 친구가 급 서울역맛집호수집 에 가자고 해서... ",쎌리의 시간,https://blog.naver.com/sh_theme,2016-09-27
[서울역염천교맛집/ 호수집 ]닭볶음탕과 닭꼬치가 맛난다는... ,https://blog.naver.com/mjinchul1?Redirect=Log&logNo=221391236437,오랜만에 고향친구들 만나 낮술로 달리다가호수집입성 ㅋㅋ 서울역에서 충정로역 중간쯤 염천교 바로 앞에 있습니다.호수집옆 골목으로 쭈욱 들어가심 실로암사우나(찜질방) 있는데 바로옆 콩나물비빔밥집... ,바블의 신나는 세상,https://blog.naver.com/mjinchul1,2018-11-04
[서울역맛집] 닭도리탕에서 볶음밥까지!호수집 ,https://blog.naver.com/cathyclick?Redirect=Log&logNo=221122852601,"2ㅡ5시 브레이크 타임을 피해서 들려야하는 서울역 맛집호수집 이다. 서울역과 서울로로 정비된 앞쪽이... 국물과 함께하는 닭도리탕이 먹고 싶다면, 통통한 닭고기 꼬치가 먹고 싶다면 서울역 뒷 거리호수집 으로!",오늘도 즐겁게,https://blog.naver.com/cathyclick,2017-10-22
" 호수집원조닭꼬치 : 중림동 연탄직화구이 닭꼬치, 닭도리탕",https://blog.naver.com/yjoshjh?Redirect=Log&logNo=110082999761,"종로학원 맞은편 중림동삼거리에 위치한 연탄구이 닭꼬치로 유명한호수집연탄구이 닭꼬치와 닭도리탕이 유명하고, 오징어불고기와 오삼불고기도 있군요 워낙 유명한데, 공간은 그리 넓지 않아 줄서서 먹기... ",참이술의 Eat & Drink,https://blog.naver.com/yjoshjh,2010-03-22
재방문하고픈 닭볶음탕 맛집 ‘ 호수집 ’,https://blog.naver.com/dh5525?Redirect=Log&logNo=222471293190,닭볶음탕 맛집호수집방문했어요! 역이랑은 좀 멀어서 버스이용했어요! 브레이크타임이 5시까지라서 4시30분쯤 도착해서 줄 서 있었어요! 5시되자마자 입장 !기본 찬이에요. 파김치 맛있었어요.그리고 물 ! 역시... ,Chez liaison [리에종의 집],https://blog.naver.com/dh5525,2021-08-15
서울역 맛집 / 연탄 닭꼬치 닭도리탕 원조닭꼬치호수집 ,https://blog.naver.com/phjsunflower?Redirect=Log&logNo=220435579540,"서울역 맛집 / 연탄 닭꼬치 닭도리탕 원조 닭꼬치호수집서울역뒷편 서부역 그곳은 먹을곳이 진짜... 있는호수집 이 아닐까 한다. 이동네는 볼것도 없고 먹을것도 없으며 놀곳도 없어서 잘 안오지만,호수집 을... ",꽃씨의 맛집 이야기♬,https://blog.naver.com/phjsunflower,2015-09-02
서울역호수집닭도리탕 ~크어,https://blog.naver.com/yahao2512?Redirect=Log&logNo=220855479414,시청 부근으로 이직을 하고나서 젤첨 맛집이라며 추천받은 곳 서울역호수집닭꼬치 닭도리탕 맛집... 닭꼬치호수집 ! 약현성당 찾아가면 될듯 이런 곳입니다. 작은 닭꼬치를 엄청나게 만들고 계시네요 와우... ,야하오의 말랑한 기록,https://blog.naver.com/yahao2512,2016-11-07
[중림동]호수집: 닭도리탕은 그저 거들뿐 꼬치구이가 메인,https://blog.naver.com/djkim74?Redirect=Log&logNo=222065504742,"Exterior 한국경제신문 인근 삼거리에 위치한 중림동호수집 . 부근에서는 드물게 일찌감치 웨이팅의... Menu 닭도리탕이 메인이지만 중림동호수집숨은 시그니처는 닭꼬치. 거기에 오삼불고기, 오징어불고기가... ",Ray' story,https://blog.naver.com/djkim74,2020-08-20
"[서울역근처 맛집] 닭꼬치,닭도리탕 맛집 _호수집 ",https://blog.naver.com/leesamdoll?Redirect=Log&logNo=140170504247, 호수집(이름은 나도 간판보고 이제 알았네;;) 가는 내내 애니팡 얘기로 뒤늦게 나를 애니팡의 세계로 인도함.ㅠ 아놔~~ 뱅아 나 요즘 애니팡에 꼿혔다. 하트 줄께 하트 보내줘;;;;;;; 여튼 임산부 오인설과 사내... ,삼돌이네 옥탑방,https://blog.naver.com/leesamdoll,2012-10-17
서울역 맛집 추천 닭볶음탕이 맛있는호수집 ,https://blog.naver.com/willdii?Redirect=Log&logNo=220951970885,서울역 맛집 추천 닭볶음탕이 맛있는호수집지난번 서울에 갔을 때 서울역에 도착하자마자 냅다 찾아간 서울역 맛집으로 유명한호수집서울역 맛집호수집 의 간판 가게가 작으니 잘 보시고 무심코 지나치지... ,결정적 순간,https://blog.naver.com/willdii,2017-03-07
[서울역]호수집 ,https://blog.naver.com/suyoen?Redirect=Log&logNo=220732705693,"# 호수집 , #서울역맛집 울산여행 후 KTX를 타고 서울로 올라왔다.갈땐 6시간 넘게 걸렸는데 올땐 2시간... 지옥같은 버스여행 ㅜ 내려서 서울역 맛집을 찾아보니친구 지인이호수집 을 추천~ 그래서 바로 GOGO~!!... ",HARMONY,https://blog.naver.com/suyoen,2016-06-12
[충정로]호수집 ,https://blog.naver.com/shtnqls95?Redirect=Log&logNo=222522990451,닭볶음탕이랑 닭꼬치로 유명하다는호수집 에 다녀와봐씁니당ㅎㅎㅎ 일단 저는 소자에 닭꼬치 두개... 3점 되게 유명한 맛집이라 기대했는데 생각보다는 쏘쏘 했네요! # 호수집#충정로 #맛집 #닭볶음탕 #닭꼬치,Jaune m,https://blog.naver.com/shtnqls95,2021-10-01
서울역 맛집 - 닭도리탕 닭꼬치!! 그 유명한 최자로드 ' 호수집 ',https://blog.naver.com/min91188?Redirect=Log&logNo=221447437854,서울역과 충정로 역 사이에 위치한 ' 호수집 '은 최자로드로 유명한 곳 중 하나. 뭐낙에 가는 곳 마다 기막힌 맛집이라고 소문이 자자해서 꼭 한번 최자로드 돌아봐야지 했는데 ' 호수집 '에서 스타트를 끊게... ,동네 노는 언니의 블로그,https://blog.naver.com/min91188,2019-01-21
원주 맛집/매지리호수집 ,https://blog.naver.com/t507808?Redirect=Log&logNo=220899363073,□ 원주 맛 집/매지리호수집☞ 원주 맛 집/매지리호수집오늘 소개할 맛 집은 원주시 흥업면 매지리...호수집 에 큰 장점은 매지 호수 연세 캠퍼스를 한눈에 감상할 수 있다는 점입니다. 여름이면 창가 쪽에... ,민이의 사진공간,https://blog.naver.com/t507808,2016-12-31
[서울역 맛집] 닭도리탕 맛집호수집 ,https://blog.naver.com/thumbday?Redirect=Log&logNo=220788828989,곳호수집연일 계속되는 불볕 더위로 인해 허약해진 심신을 달래기 위해 오랜만에호수집 을 찾았답니다호수집 은 점심시간이나 저녁시간이면 늘 문전성시를 이루고 있어서 이곳에서 닭도리탕을 먹기 위해서는... ,당신과 나의 거리,https://blog.naver.com/thumbday,2016-08-16
원주 맛집추천하고픈호수집 입니다^^,https://blog.naver.com/hungi911?Redirect=Log&logNo=220885294898,원주 맛집추천하고픈호수집 입니다^^ 추운날 매운탕이 땡기는 계절이 왔죠~ 그래서 매운탕 전문점인... 매지저수지 앞에 있어 호수를 한눈에 보고 먹을 수 있는 장점까지 갖추고 있어 더욱 맛있게 먹을 수... ,생각몽땅 with 연계독서와 독후활동♡,https://blog.naver.com/hungi911,2016-12-13
특별했던 서울역호수집 ,https://blog.naver.com/dianee_?Redirect=Log&logNo=222441621284,서울역호수집입니다! ~4단계 실행 이전 방문하였습니다~ 크아아아아아ㅏㅏㅏ호수집영업시간 오전11:30-2:00 오후5:00-10:20호수집 은 충정로역 4번 출구 도보 5분 서울역 1호선 2번 출구 도보 10분에 있어요... ,잘 다니는 니니로그,https://blog.naver.com/dianee_,2021-07-23
중독성 갑 닭도리탕_ 호수집 ,https://blog.naver.com/consu?Redirect=Log&logNo=221014759680,"기차에서 서울역 맛집을 급하게 검색하다가 서부역 부근에호수집 이라고 닭도리탕 잘하는 집이 있는데... (같이 간 사람이호수집 에 처음 간 거라면 닭꼬치 시키고 ㅎㅎ) 메뉴판에 적힌 소자 13,000원은 닭도리탕... ",당신에게 걸어가다,https://blog.naver.com/consu,2017-05-26
"[서울 중구 중림동 /충정로역,서울역] 원조닭꼬치:호수집(2)... ",https://blog.naver.com/odoldodol96?Redirect=Log&logNo=134319492,왔던호수집그치만 여기만큼 불맛나게 맛나는 닭꼬치를 하는 집이 없는지라 오매불망하던 차에 동생들이 자리를 만들어 슬쩍 낑겨보았다호수집거의 2년만에 가는거던가? 여튼 완전 오랫만이다 ㅋㅋ... ,오돌's 이야기,https://blog.naver.com/odoldodol96,2011-08-04
"서울역호수집 , 닭볶음탕과 닭꼬치로 유명한 서울역 맛집",https://blog.naver.com/ticketpower?Redirect=Log&logNo=221276596435,"서울역 맛집으로 이미 유명한 그 집 !! 서울역호수집 이다. 이 집은 닭꼬치와 닭볶음탕으로 매우 유명하며, 일부러 찾아와서 먹는 맛집이다. 토요일 점심시간. 이미 사람들로 꽉차있다. 이 집은 젊은 친구들보다... ",티켓파워의 막블로그,https://blog.naver.com/ticketpower,2018-05-16
[서울역 맛집/충정로역 맛집] 원조 닭꼬치호수집- 서울 3대... ,https://blog.naver.com/sielle83?Redirect=Log&logNo=220338183634,"2015년 4월 15일 수요일 저녁 원조 닭꼬치호수집/ 서울 중구 중림동 61-1 전화번호 02-362-0695 영업시간 17:00-23:00 지난주, 진짜 몇년 전부터 노래노래를 불러왔던호수집 을 다녀왔다. 사람들이 흔히 말하는 서울... ",여의도 직장인 문썬의 밥상 (舊 을지로),https://blog.naver.com/sielle83,2015-04-22
