title,link,description,bloggername,bloggerlink,postdate
"서울역 근처 서소문 맛집,호수집닭꼬치 영접!",https://blog.naver.com/travstory?Redirect=Log&logNo=222359258324," 호수집 이라는 곳이다. 사실 노포라고 하기엔 조금 젊은 축에 속하지만, 그래도 30년이 훌쩍 넘는... 문득 얼마 전에 B가 이야기했던호수집 이 떠올랐다. 오래전에 가본 적은 있었지만, 줄이 너무 길었던 기억이... ",오늘의 노을,https://blog.naver.com/travstory,2021-05-20
"[서울/서울역]문화역서울284_타이포잔치2021,호수집 ]",https://blog.naver.com/bbony002?Redirect=Log&logNo=222508451262, 호수집닭도리탕이 유명하니 시켰다. 꼬치는 저녁에만 …아쉽. 난 정말 저 가운데 파김치 때문에 다시 재방문 할거야 ㅜㅜㅜㅜㅜㅜㅜㅜㅜ저거 따로 파시면 살 의향 너무나 있어요 밥도둑 존맛탱 ㅜㅜ 라면사리... ,호우호우!,https://blog.naver.com/bbony002,2021-09-17
추억의 맛집을 찾아서(명동교자/닭꼬치로 유명한호수집 ),https://blog.naver.com/khgs1206?Redirect=Log&logNo=222315200781," 호수집#닭꼬치호수집작은 아들 약속 없는 토요일이어서, 집에서 무료하게 있기보다는, 시내 구경을 하자고 의기투합하여, 우리 부부와 작은 아들 M 버스를 타고 명동으로 나왔습니다. 집 앞 정류장에서 탈 수... ",고센에서 광야로,https://blog.naver.com/khgs1206,2021-04-19
"서울역호수집 , 닭꼬치와 닭볶음탕이 맛있는 서울 맛집!",https://blog.naver.com/4oundme?Redirect=Log&logNo=222339793974,이 날은 클럽하우스 친구들이랑 퇴근하고 #서울역 호수집# 호수집에 가기로 한 날! #닭꼬치 #닭볶음탕 이 맛있는 #서울맛집 으로 유명해요. 그런데 먼저 도착해서 웨이팅 중인 친구들에게서 들은 충격적인... ,생각 궁전,https://blog.naver.com/4oundme,2021-05-06
서울역 최자로드 닭꼬치 맛집호수집 ,https://blog.naver.com/lovecocoa124?Redirect=Log&logNo=222307361270, 호수집줄서서 먹는 닭꼬치 맛집호수집영업시간 11:30 - 22:30 브레이크타임 14:00 - 17:00호수집주소전화번호 서울 중구 중림동 61-4 02-392-0695 닭도리탕 전문점이지만 닭꼬치로 유명한호수집 . 우리는 저녁에... ,제목없음,https://blog.naver.com/lovecocoa124,2021-04-12
"서울역호수집 , 닭꼬치는 놓쳤지만 칼칼한 닭도리탕은 여전하다",https://blog.naver.com/emilio1986?Redirect=Log&logNo=222507649541,"킹시국에도 줄 서서 먹는 닭꼬치, 닭도리탕 맛집호수집서울역호수집서울역호수집서울역호수집 은 최자로드 닭꼬치로 유명한 곳이다. 예전에 한번 먹어봤는데, 연탄 불로 굽는 닭꼬치는 우리가 일상에서... ",박제가 되어버린 천재를 아시오?,https://blog.naver.com/emilio1986,2021-09-16
서울역호수집닭볶음탕 맛집 한정판 닭꼬치는 꼭 드세요!,https://blog.naver.com/choi6048?Redirect=Log&logNo=221936912093,"최자로드 맛집호수집정말 오랜만에 찾은 서울역 닭볶음탕 맛집호수집 !호수집 은 서울역에서 일할 때 처음 가보고 맛, 가격 또 분위기에 홀딱 반하고 왔던 곳이다. 그때 야외 테이블에 앉았었는데 초가을이 막... ",Viva Primavera ෆ,https://blog.naver.com/choi6048,2020-04-29
닭꼬치와 닭도리탕이 맛있는 서울역호수집 ,https://blog.naver.com/lovemw3?Redirect=Log&logNo=222036652573,"닭꼬치와 닭도리탕이 맛있는 서울역호수집글, 사진, 영상 by 미오 얼마 전, 언니와 오빠들을 만나러 서울역 출동! 서울역 근처에 닭꼬치와 닭도리탕이 맛있는 ' 호수집 '이라는 맛집이 있대서 다녀왔어요. 홍홍... ",미오의 즐거운 인생 ♥,https://blog.naver.com/lovemw3,2020-07-21
서울역 맛집 :: 닭도리탕이 맛있는호수집닭꼬치는 저녁에만.....,https://blog.naver.com/amyangela?Redirect=Log&logNo=222531186818,지하철타고 종로가던 도중에 4호선에서 1호선환승하려고 서울역내렸는데 우연히 생각난 # 호수집 ... ^^ 호수짐 닭볶음탕 처음에는 요렇게 세팅이 되어 나온다 신선한 깻잎과 버섯 그리고 빠져있는 닭들 국물은... ,큐리의 판타스틱 여행이야기!,https://blog.naver.com/amyangela,2021-10-08
[서울역맛집] 존맛탱 닭볶음탕과 한정 판매 닭꼬치호수집 ,https://blog.naver.com/kilsunboa?Redirect=Log&logNo=221891533588,안녕하세요 오늘은 예전부터 맛집이라고 입소문을 자자하게 들었던 서울역 맛집호수집 을 리뷰합니다... 추가호수집 의 시그니처 메뉴인 닭꼬치는 시중에서 판매하는 닭꼬치가 아니라 직접 아침에 준비를 하는... ,굳세어라 길짱,https://blog.naver.com/kilsunboa,2020-04-05
닭도리탕 진짜 맛집! 서울역호수집 ,https://blog.naver.com/bjh1809?Redirect=Log&logNo=222279315144,안녕하세요- 제가 예전부터 찜해두고 있었는데 우연한 기회로 드디어 다녀온 서울역호수집 ! 밤에 갔더니 유명한 닭꼬치는 품절이였지만 ㅠㅠ 닭도리탕도 엄청 맛있었어요!!! 메뉴판 먼저 보여드릴게용~ 저희는... ,배오리 블로그,https://blog.naver.com/bjh1809,2021-03-18
"서울역 닭볶음탕 맛집,호수집 ",https://blog.naver.com/b_0201?Redirect=Log&logNo=222540635989,"남산 근처에도 맛집이 정말루 없다,,,, 예전부터 가고싶었던 서울역호수집 이 떠올랐다. 그래서 후다닥 남산 하산하였다.... 남산 계단길 정말루 힘들었다,,,, (다음날 몸살ㅠㅠㅠㅋㅋㅋㅋ) 서울역호수집 은... ",Somedays are Diamonds.,https://blog.naver.com/b_0201,2021-10-18
충정로맛집호수집닭도리탕 닭꼬치가 유명한 최자로드 가게,https://blog.naver.com/tnwjd_07?Redirect=Log&logNo=221816517683,안녕하세요 꽃수정입니다 충정로맛집으로 유명한호수집 ! 아마 다녀오신분들도 많겠죠?..? 닭도리탕과... 충정로맛집호수집닭도리탕이 나왔는데요 음.. 다른곳과 달라보이진 않았는데 깻잎향이 장난... ,꽃수정의 여행일기 블로그,https://blog.naver.com/tnwjd_07,2020-02-20
[서울역]호수집- 닭볶음탕닭꼬치 맛집,https://blog.naver.com/younakimm?Redirect=Log&logNo=221802539428,서울역 맛집을 검색하던 중 제 눈에 띈호수집호수집 은 예전부터 오빠가 꼭 가보자고 했었는데 대기가 정말 길다고 해서 막상 엄두를 내지 못했거든요. 그런데 평일 투숙이라 여유가 있어서 오늘 꼭 가보자... ,차곡 차곡 쌓아서,https://blog.naver.com/younakimm,2020-02-09
서울역 맛집 -호수집 (닭도리탕),https://blog.naver.com/herohwangsae?Redirect=Log&logNo=221825378372, 호수집 . 역시나 아는사람은 다 아는 닭도리탕 맛집이다. 그리고 1인당 2개까지 주문이 가능한 닭꼬치가 엄청난 별미. 사실 이거 먹으로 오는 것이 아닐까 한다. 밖에서는 연탄불로 계속 굽고 계신다. 날이... ,무적황새의 세계여행기록,https://blog.naver.com/herohwangsae,2020-02-26
최자맛집으로 유명한호수집다녀왔어용,https://blog.naver.com/choikiyoung3?Redirect=Log&logNo=222138020957,"네이버에서호수집검색하고 퍼왔어요!호수집정보에요 저희는 6시 30분쯤 들어갔는데 대기가 어마어마 했어요!!! 40분정도 기다려서 들어갔습니당^^ 메뉴판 겨우 찍었어용 저희는 닭볶음탕 대자(28,000원)... ",지안이의 행복한 블로그,https://blog.naver.com/choikiyoung3,2020-11-07
서울역 충정로역 맛집 _호수집닭볶음탕 타파! 솔직후기,https://blog.naver.com/cezzie1712?Redirect=Log&logNo=222066299625,오늘은 뭘 먹을까 하다가 지난번 부터 한번쯤은 가봐야겠다고 생각했었던호수집 에 다녀왔어요. 청파동...호수집닭도리탕은 유명한 만큼 괜찮은 식당이었는데요. 사실 엄청난 웨이팅을 기다리면서까지... ,Ting.애플쨈.And me :),https://blog.naver.com/cezzie1712,2020-08-21
"[서소문] 닭요리의 향연 (feat. 원조닭한마리,호수집 ]",https://blog.naver.com/mjbites?Redirect=Log&logNo=221675729067,"칼칼편,호수집닭볶음탕으로 회사근처에 수요미식회도 나오고 다른 닭볶음탕집 내로라하지만 내마음속 일등은 여기다. # 호수집막 엄청단맛이 부각되지않는 칼칼한맛이 좋다능! 그리고 이제부터는 번외편 이름... ",어쩌다 블로그,https://blog.naver.com/mjbites,2019-10-12
"루시케이크, 소품, 준비 (feat. 서울역호수집닭볶음탕)",https://blog.naver.com/freeoriented?Redirect=Log&logNo=222345491950,집인 # 호수집으로 출동 중짜에 공기밥 추가 깻잎향이 향긋하게 올라오고 버섯과 함께 보글보글 맛나게도 끓여지는 닭볶음탕 여기 찬들은 또 어찌나 구미가 당기는지 석박지는 또 왜이렇게 맛있는지 찬들은... ,카일라 다이어리,https://blog.naver.com/freeoriented,2021-05-10
[중구 중림동 닭꼬치 닭도리탕 맛집]' 호수집 ' 방문 후기,https://blog.naver.com/smartyejin?Redirect=Log&logNo=222511304607,중림동 닭꼬치닭도리탕 맛집호수집호수집간판 마눌님 회사를 모시러갔다가 혼자 우연히 산책하다가 서소문 공원 뒤쪽을 가는길에 찐맛집을 발견했습죠. 찾아보니 원래 전통 맛집이긴 했습니다만... ,찐♡하리보 Happily ever after,https://blog.naver.com/smartyejin,2021-09-20
서울역 밥집호수집 에서 닭도리탕!,https://blog.naver.com/guseo01?Redirect=Log&logNo=221710916040,서울역 밥집호수집지난 주말 남편이랑 명동 애비뉴엘에서 터미네이터를 본 후 뭐 먹을까 고민하다 남편이 엄청 맛있게 먹었다며 저도 엄청 좋아할거라며 4년전부터 말했던 서울역 닭도리탕 맛집호수집 을... ,awesome days,https://blog.naver.com/guseo01,2019-11-18
[서울역 / 중림동 닭볶음탕 맛집] 최자로드 닭꼬치 유명한호수집 ,https://blog.naver.com/sb_2206?Redirect=Log&logNo=222478844903,맛 가격 분위기 분위기는 노포스러워서 정겨운 분위기 '최자로드'에 나와서 유명한호수집닭볶음탕... 요런 느낌 최자로드 닭도리탕 맛집 닭꼬치 맛집으로 ' 호수집 ' 가격도 착하고 맛있어서 추천쓰욤뇸뇸... ,"Hi, Here we go!",https://blog.naver.com/sb_2206,2021-08-21
서울역 맛집 /호수집/ 닭도리탕과 인생닭꼬치 / 볶음밥도 필수... ,https://blog.naver.com/dossi123?Redirect=Log&logNo=222050587920, 호수집매일 11:30 - 22:30 Close 22:20 Break time 14-17시 최자로드 맛집으로 유명한곳 닭꼬치 점심에는 안해용 !!... 반짝반짝예쁘당ㅎ #서울역맛집 # 호수집#닭도리탕맛집 #서울역 #최자로드 #최자로드맛집 #닭꼬치맛집... ,도짱의 의식주,https://blog.naver.com/dossi123,2020-08-04
서울역/충정로 |호수집| 최자 로드 닭도리탕 닭꼬치 맛집,https://blog.naver.com/s_sola?Redirect=Log&logNo=222052319366, 호수집최자 맛집! 최자가 추천한 닭요리 맛집 충정로역과 서울역 중간에 위치해있어요. 쭉 걸어가다가 엇 갑자기 사람들이 웨이팅하는 식당이 있네? 하면 그곳이 바로호수집 입니다..! 참고로 저는 8시되기... ,아솔신의 잡다하지만 모두에게 도움되는 지식&취향,https://blog.naver.com/s_sola,2020-08-06
깊은 맛 닭도리탕과 연탄구이 닭꼬치에 반하는호수집 ,https://blog.naver.com/maru0525?Redirect=Log&logNo=222495341668,최자로드에서 맛집이라고 소개했던호수집 은 저녁을 먹기 위해 갔어요.브레이크 타임 후 저녁 17시 오픈... 년식이 나오죠) ..옛 추억을 소환 하며... 옛 맛 같은 깊은 맛! 맛집 . 호수집다녀 온 후기 올려요,우리문화,https://blog.naver.com/maru0525,2021-09-05
[ 호수집 ] 서울역/중림동 - 닭도리탕과 한국식 닭꼬치,https://blog.naver.com/mardukas?Redirect=Log&logNo=222346266042,"거의 15년만에 중림동호수집 을 방문했습니다. 사실 이 동네에 올 일도 거의 없고, 일찍부터 줄서서호수집 을 먹을 일은 더더욱 없다보니 찾을 일이 없었는데요 두툼을 갔다가 2차로(!!!!????) 다녀왔습니다.... ","먹자, 마시자, 놀러 다니자",https://blog.naver.com/mardukas,2021-05-25
서울역호수집닭볶음탕닭꼬치,https://blog.naver.com/forman22?Redirect=Log&logNo=221684465262,서울역호수집닭도리탕닭꼬치 서울역 부근에 있는호수집 은 닭꼬치 및 닭볶음탕으로 잘 알려진 맛집으로 같이 일하는 동료 중에 한 분이 여기서 대기만 하다가 한 번도 먹어보지 못했다고 해서 가볍게 먹기... ,레이 놀이터,https://blog.naver.com/forman22,2019-10-21
서울역 맛집 닭꼬치호수집 ,https://blog.naver.com/keykium?Redirect=Log&logNo=222528719122,"오늘 올릴 포스팅은 서울역 맛집호수집 입니다. 닭꼬치계의 일인자 집입니다. 웨이팅 무조건... 닭도리탕도 맛있음, 스페셜까지는 아님 #서울역 #서울역맛집 # 호수집#서울역맛집 호수집#닭꼬치맛집... ",유반장의 부동산 고충처리반 (02-797-3216),https://blog.naver.com/keykium,2021-10-06
충정로 서울역 맛집호수집닭도리탕,https://blog.naver.com/l_eeej?Redirect=Log&logNo=222094107845,"중림동삼거리 앞에 위치한 허름한 낡은 집. 깔끔하고 고급스러운 곳은 아니다. 그러나 이곳에서 먹는 닭도리탕과 닭꼬치를 먹으면 맛있어서 반할 것이다.호수집메뉴는 단순하다. 닭도리탕이 메인으로, 다들... ","퇴사하고싶지만, 돈은 벌고싶어",https://blog.naver.com/l_eeej,2020-09-19
서대문맛집/충정로맛집호수집- 최자로드 맛집,https://blog.naver.com/danbiyeye?Redirect=Log&logNo=221741860184,저도 데려가라며 외치던호수집최자로드에 나오기 전부터 유명했다고 하는데 최자로드에 나오고 더욱... 이날 이후로 위가 늘어나서 계속 먹고싶음 ㅡㅠ 무튼호수집 !! 맛있어요!! 최자로드 맛집 인정!!! 한 번... ,danbiyeye (단비예예),https://blog.naver.com/danbiyeye,2019-12-18
서울역 닭도리탕 맛집호수집 ~~!,https://blog.naver.com/dntjq8977?Redirect=Log&logNo=222099594512,서울역 닭도리탕 맛집호수집 ~~! 코로나가 그리 심하지 않았을 때 쯤 친구들이랑 가평으로 1박 2일... 서울역호수집 이에요 여기가 원래는 닭도리탕도 닭도리탕인데 닭꼬치가 그렇게 맛있다고 적혀있어서 닭꼬치... ,hampton korea,https://blog.naver.com/dntjq8977,2020-10-02
서울역맛집 호수집 _닭볶음탕,https://blog.naver.com/sd170?Redirect=Log&logNo=221908055341," 호수집서울 중구 청파로 443 아기다리고기다리! (이거 알면 최소 어르신 ㅋㅋㅋㅋ) 서울역 근처로 회사를 옮기면서 가장 기대했던건호수집 을 갈 수 있을까~였다. 워낙 닭 킬러인데, 예전에호수집 에 가려고... ","가장 나답게, 가장 나다운",https://blog.naver.com/sd170,2020-04-23
"중구맛집_ 호수집 ,브라보펍",https://blog.naver.com/you3909?Redirect=Log&logNo=222483630513,"비오는 날, # 호수집향하였도다_ #닭볶음탕맛집 진짜 이날은 술을 마실 수 없다는 사실이 너무 슬 펐 음.... #서울역맛집 #닭볶음탕맛집 #만리동맛집 #충정로맛집 #충정로술집 # 호수집#브라보펍","오늘 , 나",https://blog.naver.com/you3909,2021-08-25
서울역 맛집::호수집 (feat. 최자로드),https://blog.naver.com/llleyj?Redirect=Log&logNo=221863789138,나도 올해 11월이 계약 만기인데 요즘 시세나 집 구조를 볼 수 있는 기회라 두말없이 따라 나섰다. 헌데... 국물 닭도리탕은 닭에 양념이 잘 베이지 않아서 선호하지 않았는데호수집닭도리탕은 닭도... ,말이야 염방구야!,https://blog.naver.com/llleyj,2020-03-20
서울역맛집호수집 !!!나도 닭도리탕 먹을테다!!!,https://blog.naver.com/nina918?Redirect=Log&logNo=221785233641,여러분호수집 이라고 들어보셨나요? 이미 아는사람들은 다 아는 곳 이더라구요 맛집좀 아는 저도 드디어 가보았습니다!! 여기 호수집 도 브레이크타임이 있기때문에 시간 잘 확인하고 방문하셔야 해요!! 여긴... ,하루하루 너무 소중하다구,https://blog.naver.com/nina918,2020-01-26
"진정한 닭도리탕,닭꼬치 맛집호수집 과 육개장 맛집 부민옥~",https://blog.naver.com/luke88?Redirect=Log&logNo=222536400665,"진정한 닭도리탕, 닭꼬치 맛집호수집시내 걷기하다 최자님이 추천한호수집근처를 가게되어 시간... 맵거나 , 간이 쎄게하는 곳이 많은데~ 이 집 닭도리탕은~ 꼭 한번 드셔보시라고 권하고 싶은 맛입니다... ",꿈이 큰 빡양의 일상,https://blog.naver.com/luke88,2021-10-14
서울역호수집: 3대 닭도리탕 맛집 정복하기,https://blog.naver.com/aquagirlgo?Redirect=Log&logNo=222290567323,맨날가도 매번 줄서야해서 허탕친 닭도리탕 맛집호수집나는 닭도리탕을 좋아한다. (아니 갑자기 왠 고백을....??) 그래서 닭도리탕집을 많이 돌아다녔는데 아직 못가본집이 있었으니! 바로 서울역 근처호수집 ... ,심플하게 생각하고 실행하자,https://blog.naver.com/aquagirlgo,2021-03-28
"2020.07.24 (금주계 술모임 후암연어식당,호수집 )",https://blog.naver.com/vemana?Redirect=Log&logNo=222045374998,박사님께서는호수집 에서 닭도리탕을 포장해왔다. 부대찌개에 햄 잔뜩 때려넣고 보글보글 옆에는 고메 치킨 마아가린 잔뜩 넣은 콘치즈 콘치즈는 사랑입니다... 첫잔은 일행이 가져온 백년초 담금주로... ,INTP의 랜선 공간,https://blog.naver.com/vemana,2020-07-29
서울역호수집 ,https://blog.naver.com/pieup_k?Redirect=Log&logNo=222374310914,"서울역호수집나는야, 다섯시에 퇴근하는 행복한 사람 너무 유명한 곳이라 항상 웨이팅이... 그저 1잡만으로도 벅차니, 성실하게 살아봅시다. #서울역 호수집#서울역맛집 # 호수집#최자로드 #닭도리탕 #닭꼬치",째깐한평화로움,https://blog.naver.com/pieup_k,2021-05-30
서울역 맛집호수집방문 후기 [20년3월],https://blog.naver.com/seungwan79?Redirect=Log&logNo=221860903031,"서울역 근처 중림동 사거리에 있는호수집 으로 이동합니다. 나중에 찾아보니 최자로드로도 유명한 가게네요. 횡단보도에서 건너가기를 기다리는데, 가게 앞에 사람이 많이 있네요. 오후 7시 50분쯤 도착했는데... ",와니드림블로그,https://blog.naver.com/seungwan79,2020-03-20
서울역 충정로 맛집 최자로드호수집 (★★★★★),https://blog.naver.com/jihyeon7851?Redirect=Log&logNo=221812778577,"#먹창고 #서울역맛집 #충정로맛집 #최자로드 # 호수집#닭도리탕맛집 서울 중구 청파로 443 충정로역 4번 출구 11:30 ~ 22:30 브레이크 14:00 ~ 17:00 먹은거 닭꼬치 개당 2,000원 / 닭도리탕 소 18,000원... ",먹_창고,https://blog.naver.com/jihyeon7851,2020-02-17
서울역 맛집 ' 호수집 ' 닭꼬치 육즙이 미쳤습니다.,https://blog.naver.com/wdb1206?Redirect=Log&logNo=222528936050,가보고 싶어서 벼르고 벼르던호수집 . 지나가면서 언젠가 한번 가봐야지했는데 드디어 기회가 되서 가봤다 비도 추적추적 가까운 서울역에서 소주한잔과 칼칼한 음식이 생각나서 결정한호수집 으로 고고... ,땅땅비비의 솔직후기,https://blog.naver.com/wdb1206,2021-10-06
 호수집 ....서울역맛집,https://blog.naver.com/sbminb?Redirect=Log&logNo=222035840247,서울역에 남편 마중갔다가 가본 집 오래된 노포라고 하고 닭볶음탕을 식당에서 사먹은 적이 없어... 부르는 안주같은 볶음밥 #닭볶음탕 #서울역맛집 #서울역노포 #닭도리탕 # 호수집#청파로맛집 #중림동맛집 #닭꼬치,민트의 모든 것!!!,https://blog.naver.com/sbminb,2020-07-22
[서울역 맛집]호수집: 진한 국물의 닭도리탕 맛집,https://blog.naver.com/ji0408?Redirect=Log&logNo=222513526456,"이 집은 예전에 근처에서 체험형 인턴을 하고 있을 때 일 가르쳐주시던 분께서 소개해 준 집입니다. 근데, 대학생 때 제가 제일 좋아하는 교수님께서도 이 집을 알고 계시더라고요!? 그렇듯 정말 유명한 집입니다.... ",참아야 하는 존재의 가벼움,https://blog.naver.com/ji0408,2021-09-22
서울역 술집호수집닭볶음탕닭꼬치,https://blog.naver.com/jinmichu?Redirect=Log&logNo=221404391708,최자로드 맛집으로 유명한 서울역호수집! 마침 시청갈 일이 있어 시청에서호수집 까지 걸어갔어용 : ) 저는 맛집의 기준이 허름한지 안허름한지인데 ㅋㅋㅋㅋ (허름하면 무조건 맛이쭘) 아~~ 서울역 술집... ,진미츄 일상 기록,https://blog.naver.com/jinmichu,2018-11-23
최자로드 서울역호수집 ,https://blog.naver.com/91starlit?Redirect=Log&logNo=221286932301,최자로드 서울역 닭볶음탕 닭꼬치 맛있는집호수집맛집 가고 싶어서 알아보다가 알아보던중 요즘... 메인요리 닭볶음탕 (소)17000 보글보글호수집닭볶음탕은 지금 끓는중 버섯이 많이 들어가 있어서 식감이... ,91starlit,https://blog.naver.com/91starlit,2018-05-29
서울역 맛집 최자로드호수집닭볶음탕,https://blog.naver.com/leganza07?Redirect=Log&logNo=221583517847,서울역 맛집 최자로드호수집닭볶음탕 비가 부슬부슬 내리는 날 예전 회사 동료들과 급 벙개 모임 !!!... 미안하다 ㅠ ) 서울역 맛집을 검색했더니호수집 이라는 곳이 많이 유명해서호수집 으로 방문하기로... ,Ten2. Together,https://blog.naver.com/leganza07,2019-07-11
서울역호수집닭도리탕 맛집 닭꼬치까지 소주 한 잔 좋네,https://blog.naver.com/ezecho?Redirect=Log&logNo=221366755888,서울역맛집으로 검색으로 해보니 서울역호수집닭도리탕 집이 주로 검색이 되더라고요. 닭토리탕도 평소에 좋아하고 소주 한 잔에 최고의 안주이니 별 고민할 것도 없이 서울역호수집 으로 결정하기로... ,택사마 캠핑스토리,https://blog.naver.com/ezecho,2018-09-28
"[서울역 맛집]호수집 , 최자로드의 대망의 닭볶음탕, 닭꼬치 맛집!",https://blog.naver.com/ksyljw?Redirect=Log&logNo=221457783648,"유명한 # 호수집입니다!!!!!! 저 뭔가 이런 빅타이틀 맛집 다니는거 너무너무 좋아합니다 무려 5시 퇴근하고 바로 튀어갔음에도 불구하고 30분 넘게 줄서서 들어갔었어야 했던, 바로 그집!!!!!!호수집 !!!!!!!!! 저희 다... ",B l o o m i n g-,https://blog.naver.com/ksyljw,2019-02-06
[ 호수집원조닭꼬치 / 충정로역 맛집],https://blog.naver.com/minahongkong?Redirect=Log&logNo=220329523781,"원래 가려던 갈매기살집 제껴버리고호수집 으로 퐁당! 살짝 달았지만, 개운했던 파김치 석박지... 인근에서 쏘맥 한잔 말아먹을 모임에게 강추. 충정로호수집전화번호 02-362-0695 주소 서울 중구 중림동 61-1","Mina Bonita, Simply Life!",https://blog.naver.com/minahongkong,2015-04-14
서울역 닭도리탕/닭꼬치 맛집 :호수집(위치/가격/메뉴),https://blog.naver.com/quftotrl?Redirect=Log&logNo=220702129815,또영언니가 발견한 서울역 닭도리탕/닭꼬치 맛집으로 소문난호수집 으로 꼬우꼬우 ♪ 서울역호수집위치호수집 은 중림동 삼거리 쪽에 있어요서울역에선 한 10분 정도 걸으면 나옵니다 어중간한 시간대에... ,Shley In Wanderland,https://blog.naver.com/quftotrl,2016-05-05
서울역호수집- 전술의 승자,https://blog.naver.com/phy1017?Redirect=Log&logNo=221100497539, 호수집 은 닭도리탕과 닭꼬치로 굉장히 유명한 집이죠 닭도리탕과 닭꼬치를 같이 파는 형태는 이곳에서... 제꺼~호수집닭도리탕 맛있는데요 닭도 괜찮고 닭꼬치 4개 (6000원) 제가 기대했던건 닭도리보다 닭꼬치... ,후후의 식도락,https://blog.naver.com/phy1017,2017-10-31
서울역호수집원조 닭꼬치,https://blog.naver.com/bluelhs78?Redirect=Log&logNo=100206320155,서울역 종로학원 대각선에 위치한 닭꼬치가 대박 맛있는집 서울역 원조 닭꼬치호수집을소개해 보아요...호수집닭꼬치 담당하시는 이분은 30년전 어머니등에 업혀 닭꼬치 냄새만 맡고있던 그 아가가 요로케... ,정직하고 착한 주얼리샵 비엘골드,https://blog.naver.com/bluelhs78,2014-02-26
서울역/중림동 맛집 -호수집[닭도리탕(닭볶음탕)/연탄구이... ,https://blog.naver.com/elfinlog?Redirect=Log&logNo=221200537585,♬ 서울역/충정로/중림동 닭볶음탕/닭꼬치 맛집호수집방문기호수집 은 연탄 직화구이 닭꼬치와 매콤한 닭도리탕으로 유명한 서울역 맛집이다. 거리상으론 충정로역하고 더 가까운거 같은데 왜 서울역... ,Why Not?!,https://blog.naver.com/elfinlog,2018-02-04
"서울역 맛집 호수집원조닭꼬치, 닭도리탕",https://blog.naver.com/me0816?Redirect=Log&logNo=10138777238,예전부터 줄곧호수집 을 다녀오고 싶었던!!!!!! 서울역 맛집입니다 :D 매번 서울역에 오게되면 생각나는호수집 ♬ 얼마나 맛있으면 침이마르도록 주변분들이 칭찬을 하시던지 고고씽했어여 주말이라 그런지... ,먀 냠냠,https://blog.naver.com/me0816,2012-05-15
