title,link,description,bloggername,bloggerlink,postdate
[충정로]호수집- 삼고초려 끝에 성공,https://blog.naver.com/maru0380?Redirect=Log&logNo=221154666214,"유명 가수 커플이 두번이나 가서 화제가 되었던 집,호수집닭꼬치를 꼭 먹어봐야 된다는 이야기를 듣고 장작 3번의 시도 끝에 드디어 다녀왔다. 닭볶음탕 집으로 알려져 있는데 간판엔 닭꼬치가 써져있다.... ",느긋함의 미학 -,https://blog.naver.com/maru0380,2017-12-04
[서울_충정로] 중림시장. 착한가격의 대포집호수집 ,https://blog.naver.com/bw_0079?Redirect=Log&logNo=140050020587,착한가격의 대포집호수집요즘 친구중 한녀석이 많이 우울해 하고있습니다. 퇴근시간 무렵 오늘은... 이 집 알타리김치는 익히지 않습니다. 물론 저는 익힌거나 안익힌거나 잘먹어 다행이지만 익힌 김치를... ,rain of painful reminiscence...,https://blog.naver.com/bw_0079,2008-03-31
[중림동/원조닭꼬치호수집 ] 여기가 이렇게 손님이 많아질줄... ,https://blog.naver.com/hdhdd?Redirect=Log&logNo=40159589083,"[중림동/원조닭꼬치호수집 ] 점심을 1차에서 무려 3차까지 진하게 달려주고... 바로 저녁에 이어달리기... 오늘도 과연 참아낼 수 있을런지 ㅎㅎ 각설하고, 저녁 이어달리기 1차 장소로는 중림동호수집 이... ",책과 음식과 영화이야기,https://blog.naver.com/hdhdd,2012-05-22
닭꼬치와 닭도리탕 - 중림동 호수식당( 호수집 ),https://blog.naver.com/mercyblu?Redirect=Log&logNo=60163516290,닭도리탕에도 여러 스타일이 있지만 여기호수집 은 국물이 두텁다.(와인으로 얘기하는 풀바디) 반찬중 파김치도 일품이고 연탄불에 정성스레 잘 구워주는 닭꼬치는 반드시 먹어봐야 할 아이템이다. 일찍... ,머시블루's Happy Nation,https://blog.naver.com/mercyblu,2012-05-30
서울역호수집닭도리탕 명동역카페 루프트커피,https://blog.naver.com/mindyohi1?Redirect=Log&logNo=221378786697,최자로드 맛집이라 불리는 서울역호수집 넓고 쾌적했던 명동역카페 루프트커피(LUFT COFFEE) 안녕하세요 민됴히에요 평소 닭...이라면 진짜 환장하는 1인ㅋㅋ치킨은 살만 안찐다면 매일 먹을 수 있을... ,민됴히의 이지뷰티,https://blog.naver.com/mindyohi1,2018-10-23
서울역의 닭꼬치 닭도리탕 집호수집 ,https://blog.naver.com/ppujigi?Redirect=Log&logNo=220373754346,서울역의 닭꼬치 닭도리탕 집호수집언제적 간집인지 기억도 나지 않는 곳이네요. 몇달 전 비는 내리는데 친구가 어디서 들었는지 아는 사람이 맛난 집이라고 소개시켜줬다고 가보자고 해서... 무거운 몸을... ,훌랄라,https://blog.naver.com/ppujigi,2015-05-29
[서울역]호수집 ,https://blog.naver.com/coruddus88?Redirect=Log&logNo=222461776626,"서울역 최자로드 맛집호수집최자로드에 나왔다는 닭도리탕, 닭꼬치 맛집 닭꼬치는 저녁에만 파니까... 구워주십니다호수집진짜 아 배가 터질 수도 있겠다,,라는 생각이 들 때 K-디저트 주문. 볶음밥(2... ",채긍연의 하루는 절거워,https://blog.naver.com/coruddus88,2021-08-08
서울역 맛집 /호수집 ,https://blog.naver.com/gmlfk4375?Redirect=Log&logNo=222476884320,윤집사입니다~~ 진짜 5년전 겨울에 맛있게 먹었던 #맛집 # 호수집소개해드릴게요!! #서울역맛집 #서소문맛집 #충정로맛집 # 호수집#닭도리탕 #닭꼬치 #맛집 처음 #서울역 호수집에서 #닭도리탕 먹고 와~~~ 이거 걍... ,여름을 사랑하는 윤집사♡,https://blog.naver.com/gmlfk4375,2021-08-19
서울역/충정로 닭꼬치 ' 호수집 ',https://blog.naver.com/hjsong84?Redirect=Log&logNo=220617675184,"설리와 최자가 웨이팅 하던 닭꼬치집 ' 호수집 ' ㅋㅋ 설리랑 최자는 아니지만 웨이팅 해서 먹고 왔어요... 저한테는 그냥 그랬던호수집 이었어요 설리, 최자..왜 줄선거냐...ㅡㅡ호수집주소: 서울시 중구 중림동... ",돼지꿈나무,https://blog.naver.com/hjsong84,2016-02-03
서울역 맛집호수집닭꼬치 영접 후기,https://blog.naver.com/yujine1012?Redirect=Log&logNo=222397784704,"오늘은 저번에 다녀온 서울역 근처에 위치한 닭도리탕, 닭꼬치 맛집호수집포스팅을 하려고 해요 ㅎㅎ...호수집 은 닭도리탕 전문점이지만 닭꼬치로 더 유명해요! 점심에는 닭꼬치를 팔지 않고 브레이크... ",Record the moment ෆ,https://blog.naver.com/yujine1012,2021-06-14
[서울역]닭꼬치집( 호수집 ),https://blog.naver.com/mypana777?Redirect=Log&logNo=60158352644,"( 한달이 지난 제주도 여행도 다 못올렸는데... ) 로그인 없이 손가락 클릭요, ^^ 오늘 소개할 집은 서울역(서부역) 주변에 있는 닭꼬치집( 호수집 ) 입니다. 우연히 주변을 지나가다 사람들이 줄을 서 있는 것을... ",크레덴자의 맛있는 하루,https://blog.naver.com/mypana777,2012-03-20
주머니 부담없는 맛있는 닭꼬치를 먹으러.....중림동호수집 ,https://blog.naver.com/apurimac?Redirect=Log&logNo=120131158578,중림동호수집 ...맛있고 가격도 너무 착하기는 한데 한가지 부담스러운게 있다. 바로 줄서는게... 이 집 닭꼬치는 여느집과 달리 뼈채 구워 나온다. 물론 큼직큼직한 뼈는 어느정도 제거가 되었지만 작은 뼈는... ,束草 메모리즈,https://blog.naver.com/apurimac,2011-05-31
맛집호수집닭꼬치와 닭볶음탕이 맛있다는 최자로드 그 집!,https://blog.naver.com/nddoo_?Redirect=Log&logNo=221371450335,"명동 근처 닭도리탕집을 검색하니 북창동 풍년집과 서울역호수집 이 따땀'ㅁ'/ 안그래도 서울역호수집 은 내가 믿고 먹는 최자로드, 설리 맛집으로 유명한 집이라 작년부터 가고싶었었는데...... 일본, 한국... ",뚜뚜뚜루뚜뚜뚜뚜,https://blog.naver.com/nddoo_,2018-10-05
서울역호수집닭꼬치 닭도리탕 맛집 맛있어요!!,https://blog.naver.com/atw4733?Redirect=Log&logNo=220943644400,"서울역호수집닭꼬치 닭도리탕 맛집 맛있어요!! 닭도리탕이 메인이지만 닭꼬치가 더 맛있다? 군 시절... 서울역호수집 을 찾았습니다. 날이 꽤 추운 날이었는데, 이미 만석이었기 때문에 밖에서 20분 정도... ","w. 매일을 거룩하게,브랜딩!",https://blog.naver.com/atw4733,2017-02-24
서울맛집 -호수집; 원조 닭꼬치 (서울역맛집),https://blog.naver.com/kawaihito?Redirect=Log&logNo=220439631171,"닭과 떡을 다 먹고나면 이모님께 밥을 볶아달라고 하면 알아서 볶아서 가져다주신다.호수집 의 화장실은 깨끗한 편이다. ▲ 호수집화장실 입구 서울역, 충정로역 근처에서 맛있는 닭볶음탕닭꼬치 집.",소풍,https://blog.naver.com/kawaihito,2015-08-03
"[충정로, 서울역] 도시 속의 호수,호수집 ",https://blog.naver.com/heehee_93?Redirect=Log&logNo=222465403966,친구가 3년 전 추천해 준호수집 ... 드디어 가봤습니다 퇴근 후... 충정로역으로 향하였습니다... 초록창 지도에 도보 7분인가로 쓰여 있지만 실제로는 5분 정도 걸리는 것 같아요호수집 은 웨이팅으로 유명하다고... ,흴기장,https://blog.naver.com/heehee_93,2021-08-11
[서울역]줄서서먹는 닭꼬치 맛집호수집 ,https://blog.naver.com/ms_han?Redirect=Log&logNo=220464035429,간마네 만나는 전 직장동료들 어디갈까 하다가 서울역 맛집이라던호수집고고싱 위치는 참 애매하다... 참고로호수집 의 닭꼬치는 한사람당 두개까지만 주문가능 늦게가면 이마저도 떨어져서 없다네요 우리는... ,서리니 블로그^ㅂ^,https://blog.naver.com/ms_han,2015-08-27
"[서울역 맛집 ]최자로드호수집원조 닭꼬치 , 맛보면 다른... ",https://blog.naver.com/darkdurki?Redirect=Log&logNo=221312344897,서울역 맛집을 치면 가장 먼저 나오는 곳이 바로호수집원조 닭꼬치 원채 오래된 서울역 맛집이기도 하거니와 최자로드에서 소개되서 더욱더 많은 사랑을 받는 곳이예요호수집 을 안지는 꾀 오래됐는데... ,Just Go Travel with 필막내:),https://blog.naver.com/darkdurki,2018-07-04
 호수집_ 닭꼬치 *호수집 ,https://blog.naver.com/onei123?Redirect=Log&logNo=220465419256,복날이랍시고 퇴근하고 또 먹을구실을 찾아 맛집탐방 전부터 궁금했던 서울역 근처호수집서울역... 뭘 시키고 주문하면 거기에 1인당 두개밖에 팔지않으세용 사실 그거땜에 더 궁금해서 온호수집 이었지용... ,하니앤다블로그,https://blog.naver.com/onei123,2015-08-29
"[서울역 맛집] 닭꼬치로 너무 유명한호수집 , 드디어 가보았다",https://blog.naver.com/wild_deer?Redirect=Log&logNo=221106549088,서울역 맛집으로 익히 들어온호수집 ! 이번에 절친이랑 가게 되었당 나는 1호선 서울역쪽인... 오묘한호수집이 닭꼬치가 비둘기꼬친지 의심안할 수 있어 좋다 ㅋㅋㅋㅋ 사람은 많아 바쁜데 사장님은 친절하다... ,야생노루의 보통날♩,https://blog.naver.com/wild_deer,2017-09-27
서울역 맛집 원조 닭꼬치호수집 ,https://blog.naver.com/athdnjs1054?Redirect=Log&logNo=220368549452,완전 유명한 곳이죠 서울역 서부역 쪽에 있는 닭도리탕 맛집 닭볶음탕 맛집 원조 닭꼬치호수집 ... 사실호수집 은 닭도리탕이 아니라 이 닭꼬치를 먹으러 오는 곳이라고하더라구요..ㅎㅎ가격은 비싸지않은것... ,100억짜리 맛집 레이더,https://blog.naver.com/athdnjs1054,2015-05-24
"서울역 맛집- 호수집원조닭꼬치 닭볶음탕, 충정로역 맛집... ",https://blog.naver.com/akaladycha?Redirect=Log&logNo=10139708910,"맛집이라는호수집원조닭꼬치 맛집으로 가기로 하고 완전 신나서 갔더니, 이미 기다리는 사람들이 많았다.호수집원조닭꼬치 이곳은 항상 기다리는 사람들이 많아 저녁시간에 일찍 가지 않으면 오래... ",LADYCHA,https://blog.naver.com/akaladycha,2012-05-28
"충정로 :호수집 , 닭꼬치, 닭볶음탕",https://blog.naver.com/rmagml04?Redirect=Log&logNo=220361929961,"그 사이라고 하는게 맞을듯ㅋㅋㅋㅋㅋㅋㅋ호수집원조 닭꼬치 이날로 말할 것 같으면,, 배가 안고픈데.... 역시 언니도호수집 을 알고 있었다ㅋㅋㅋㅋ 근데 나도 늦고 언니도 늦고ㅠㅠ 일인당 2개밖에 주문을... ",강방 블로그,https://blog.naver.com/rmagml04,2015-05-17
서울역/중림동호수집 ,https://blog.naver.com/elsunny99?Redirect=Log&logNo=221323365748,"서울역 근처에호수집 이라는 닭볶음탕 집이 있다. 닭꼬치로도 유명한 가게인데, 2년전 즈음 서울역에 옷을 찾으러 간다는 아이가 있어 냉큼 꼬셨다. 칼퇴근 하고 갔으나 대기. 기다리는 동안 닭꼬치 굽는... ",혼자서 놀자!,https://blog.naver.com/elsunny99,2018-07-21
"서울역] 호수집 -닭도리탕, 닭꼬치.(닭꼬치가 꽤나 매력있던 집)",https://blog.naver.com/shinewitme?Redirect=Log&logNo=220738692829,넘나 좋아하는 형욱이형 ㅋㅋㅋ 1차호수집2차 중림장으로 코스를 짰습니다. 가니깐 가게앞엔 이렇게 연탄불에 꼬치를 계속 굽고 계시고. 우린 40분쯤 기다렸고. 닭꼬치만 따로 주문되진 않아요. 무조건... ,응큼한 호랭이의 먹고 즐기는 일상들.,https://blog.naver.com/shinewitme,2016-06-17
('16.10)[서울][맛집]호수집커피빌라,https://blog.naver.com/pomi54?Redirect=Log&logNo=220851482957, 호수집영업시간 11:30 - 22:00 (Break 14:00-17:00) 전화번호 02-392-0695 서울역 근처에 있습니다. 오픈시간에... 커피 빌라 Coffee villa호수집 에서 식사 후 바로 옆에 카페가 있길래 후식 먹으러 들어갔습니다.... ,뭉청이네 이야기,https://blog.naver.com/pomi54,2016-11-02
"[서울역 맛집] 줄 서서 먹는 닭꼬치,호수집 ",https://blog.naver.com/hialienpika?Redirect=Log&logNo=220399941931,딱 한 번 갔었는데 그 맛이 잊혀지지 않는다며 친구가 나를 인도하여 데려간 집. 나도 그 맛이 잊혀지지 않는다. 나는호수집닭꼬치의 노예야... 서울역에서 나와 7분 ~ 10분 정도 걸었던 것 같다.호수집 에... ,잡다한 상자,https://blog.naver.com/hialienpika,2015-06-24
서울역 맛집호수집 _ 한정 판매되는 닭꼬치 진리!,https://blog.naver.com/jinyoung0822?Redirect=Log&logNo=220872027805,커피숍으로 이동해서 쉬고 있었는데 여전히 길던호수집 의 인기 닭꼬치도 정말 너무 맛있었고 오다가다 아직도호수집 은 대기가 많은 핫한 곳이지만 다음에 또 방문할 집 마음 착한 사장님 오래 번창하이소 ♥,대식가 김씨의 다정한 블로그,https://blog.naver.com/jinyoung0822,2016-11-27
"서울역 닭도리탕/닭꼬치 ' 호수집 ' - 닭도리탕, 그리고 닭꼬치요?",https://blog.naver.com/egdc1047?Redirect=Log&logNo=220984866731,원래 2차에 가려했던 이 ' 호수집 '은 계급상승하여 이날의 1차 식사지가 되었다. 이곳은 닭도리탕 외에 닭꼬치도 유명하다고 한다. 아래 보이는 연탄에 닭꼬치를 직접 구워주더라. 닭도리탕과 닭꼬치는 뭔가... ,Mind the Gap!,https://blog.naver.com/egdc1047,2017-04-17
[충정로] 닭꼬치와 닭볶음탕 :호수집 ,https://blog.naver.com/poopoo02?Redirect=Log&logNo=221868889478,이미 웨이팅이 있었지만 닭꼬치 굽는 뒷모습을 보니 차마 발길이 안떨어졌고 어쩌다보니 한시간이나 기다렸던호수집 . (게다가 주변에 갈 곳이 없음) 닭볶음탕은 오리탕처럼 칼칼한 맛이 있었고 닭꼬치는 이른... ,besonders gut,https://blog.naver.com/poopoo02,2020-03-23
서울역호수집원조닭꼬치 닭도리탕 닭꼬치,https://blog.naver.com/virgochun?Redirect=Log&logNo=221179792855," 호수집원조닭꼬치 닭도리탕 닭꼬치 서울 중구 중림동 61-1 (16.10.31) - good - 가수 최자, 한시간의 기다림, 비좁은 내부, 뼈있는 닭꼬치, 그래도 맛있게 월요일 저녁 7시부터 기다려 45분이 되어서야 들어갔지만... ",겉절이,https://blog.naver.com/virgochun,2018-01-12
충정로호수집 /영화기생충 이웃집 토토로,https://blog.naver.com/sakei?Redirect=Log&logNo=221559787845,어느날 우리 동료들과 급 벙개잡은 날 # 호수집#서울역맛집 #서울역 호수집#충정로 호수집입구에서 닭꼬치굽는 아름다운 풍경 5시 30분 집합예정이었지만 워낙 핫한 가게라 혼자 5시에 먼저 도착해서 줄을 섰다... ,집나가면 여행-일상의 기록#,https://blog.naver.com/sakei,2019-06-11
[ 중구 / 충정로역 ]호수집 ,https://blog.naver.com/aroma1217?Redirect=Log&logNo=220939106510, 호수집# 영업시간 - 11:30~22:00 (Break Time: 14:00~17:00) 주소 - 서울특별시 중구 청파로 443 (구주소: 중구 중림동 61-4) 전화번호 - 02-392-0695 닭꼬치는 밖에서 연탄불로 구워낸다 밑반찬으로 나온 파김치깎두기... ,"Every Day, Every Moment",https://blog.naver.com/aroma1217,2017-02-19
[서울역] 닭꼬치와 닭볶음탕이 맛 있는 집호수집 ,https://blog.naver.com/6031a?Redirect=Log&logNo=221027246859,그중 제가 좋아하는호수집다녀왔습니다. 늦겨울에 다녀왔는데 이제야 올려보네요. 아주 추운날씨였는데 줄이 엄청납니다. 1시간 기다렸다가 들어갔어요. 이 삼촌이 꼬치굽는거 구경하느라 버틸만... ,그랑씨엘부동산/공인중개사(서래마을-방배동),https://blog.naver.com/6031a,2017-06-12
[서울역 맛집]호수집 ,https://blog.naver.com/nearbora?Redirect=Log&logNo=220143821618,회사 근처호수집 . 닭도리탕도 일품이지만 함께 나오는 닭꼬치가 유명하다고 하여 신랑님과 고고씽!... 왜 다들호수집닭꼬치 닭꼬치 하는지 알겠더만요. 닭도리탕보다 저는 이게 더 맛있었어요 ㅎㅎㅎ 위치가... ,Something about ririka,https://blog.naver.com/nearbora,2014-10-07
