title,link,description,bloggername,bloggerlink,postdate
아이들간식 추천) 쫄깃쫄깃 맛있는 찐빵!홍천 쌀찐빵 !,https://blog.naver.com/cctvoops?Redirect=Log&logNo=222478466533,"좋아요:)저는 홍천 수제 쌀찐빵 5가지맛 20개로 시켜보았는데요ㅎ저처럼 종류별로 다 드셔보시고 싶으신분들한테 딱일것 같아요ㅋㅋ 홍천 쌀찐빵제품으로 만들어지기 전 반죽부터 분할, 성형, 발효, 찜, 건조... ",히리바리봉의 워얼드,https://blog.naver.com/cctvoops,2021-08-20
생활의달인 용인 수지구홍천쌀찐빵만두 엄마손에 끌려다녀온... ,https://blog.naver.com/kmh5121?Redirect=Log&logNo=222147412540,먹을것같아 개인 입맛에따라 다를수있으니 참고만 하시면 되겠습니다^^ # 홍천쌀찐빵#생활의달인 #용인 #수지구 #용인찐빵만두 #달인찐빵만두 #맛집줄서기 #품절 #내돈내사 #어린이보호구역 #주차과태료 #주의,일상을 남겨보꾸나,https://blog.naver.com/kmh5121,2020-11-18
 쌀찐빵추천 협동조합홍천찐빵여기 너무 맛있음,https://blog.naver.com/2090063?Redirect=Log&logNo=222496217009," 쌀찐빵추천 협동조합홍천찐빵여기 너무 맛있음 글,사진 : 문진관 이야기 날씨가 쌀쌀해지니 당연 생각나는 간식이 있다면 그것은 찐-빵 강원도 여행을 가면 무조건 사왔던찐빵 , 그리고 그 맛을 잊지 못해... ",문진관 이야기,https://blog.naver.com/2090063,2021-09-06
 홍천찐빵쌀찐빵아이들간식 아침식사대용 추천,https://blog.naver.com/yycompany06?Redirect=Log&logNo=222461170019, 홍천찐빵쌀찐빵아이들간식 아침식사대용 주문한 후기 남겨 볼게요 ^^홍천찐빵쌀찐빵아이들간식 아침식사대용 두 팩을 주문 했어요. 아이스팩은 물론 생수 두 병 얼려서 함께 넣어 주셨어요. 생수는... ,고래고래고,https://blog.naver.com/yycompany06,2021-08-07
"[수지 성복 맛집]홍천쌀찐빵- 속이 꽉 찬 김치만두, 팥이 가득... ",https://blog.naver.com/maria553?Redirect=Log&logNo=222442110174,"안녕하세요, 양뭉입니다 오늘은 생활의 달인 10대 맛집으로 선정된 찐빵 만두 맛집을 소개해드릴게용... 상호 :홍천쌀찐빵주소 : 용인시 수지구 성복2로 17 영업시간 : 매일 09:00 - 22:30 휴무 : 매주 월요일 방송... ",양뭉의 인생살이,https://blog.naver.com/maria553,2021-07-23
수지홍천쌀찐빵 .만두 먹어봤어요.,https://blog.naver.com/cbcho2004?Redirect=Log&logNo=222226343318,"순간적으로 몇 개 집어먹다가 중간에 사진을 찍었습니다. 만두는 8개씩, 찐빵은 5개 들어있습니다. 사진보고 오해 마세요.^^ 오늘도 행복한 하루 되세요. # 홍천쌀찐빵#수지맛집 #고기만두 #김치만두 #쌀찐빵",Creativity and Innovation,https://blog.naver.com/cbcho2004,2021-01-31
 홍천쌀찐빵 ,https://blog.naver.com/munj1121?Redirect=Log&logNo=221712611145,"성복역에 있는홍천쌀찐빵 에 가서 쌀찐빵, 왕만두, 그냥 만두들을 사왔다. 한번 갈때마다 엄청 사와서 냉동실에 얼려놓고 먹는다. 나는 찐빵을 별로 안좋아하는데, 남편이 좋아한다. 딴집꺼는 먹으면 속이... ",볼빨간 수다쟁이,https://blog.naver.com/munj1121,2019-11-19
[제품] 아이들 간식 /쌀찐빵추천 / 호빵 ;홍천찐빵 ,https://blog.naver.com/isrollo?Redirect=Log&logNo=222462738595,저는 홍천 찐빵이라는 곳에서 주문했어요 홍천찐빵은 다양한 찐빵을 판매하는 곳이에요ㅎㅎ 택배는... 딱이에요홍천 쌀찐빵 은 반죽 - 분할 - 성형 - 발효 - 찜 - 건조 - 포장 이렇게 총 7단계를 통해 만들어지는... ,sound+ㅁ,https://blog.naver.com/isrollo,2021-08-09
아이들간식으로 좋은쌀찐빵:: 협동조합홍천찐빵 의 다섯가지... ,https://blog.naver.com/gng-lazboy-ihw?Redirect=Log&logNo=222493868802,찾아보다가 # 홍천찐빵으로 선택했는데요! 아이들간식으로 좋은홍천찐빵#협동조합홍천찐빵에는 손으로 직접 만드는 수제 # 쌀찐빵이 무려 5가지 맛으로 나오더라구요! 너무 궁금해서 저도 2팩을... ,터치필리 감성채널,https://blog.naver.com/gng-lazboy-ihw,2021-09-03
협동조합홍천찐빵아이들간식추천쌀찐빵 ,https://blog.naver.com/uniquehj?Redirect=Log&logNo=222414178015,협동조합 홍천찐빵 아이들간식추천 쌀찐빵 로희랑 주말을 보낼때면 늘 간식을 뭐먹이지... 앞으로도 간식떨어질때마다 여기에서 주문해서 냉동실 채워놔야겠다는:) 참참홍천쌀찐빵 은 주문전화로도 택배가... ,만나서반가워'_',https://blog.naver.com/uniquehj,2021-06-29
바람에 생각나는쌀찐빵여기서 주문했어요 ::홍천찐빵 ,https://blog.naver.com/dyfrtyfrqlfr?Redirect=Log&logNo=222498871747,"출시되는데홍천찐빵 은 통 단팥이 그대로 들어간쌀찐빵 , 단호박, 쑥, 옥수수 등 어릴 적 먹었던 오리지널쌀찐빵그대로 아이들 간식으로도 좋고 우리 부모님도 맛있게 먹기 좋았어요 요즘은 와플메이커의... ",배고픈원숭이,https://blog.naver.com/dyfrtyfrqlfr,2021-09-08
용인 수지 성복롯데몰 맞은편 만두맛집홍천쌀찐빵식어도... ,https://blog.naver.com/foreverhoe?Redirect=Log&logNo=221717271659,ㅋㅋㅋㅋㅋㅋ 아직도 잘 살아있는 만두피 쫄깃쫄깃 수지만두만집으로 인정합니다. #내돈내산맛집 #맛집찾아삼만리 # 홍천쌀찐빵#찐빵맛집 #수지맛집 #수지만두맛집 #성복동맛집 #고기만두 #김치만두 #만두맛집,요미의 마음이 따뜻해지는 공간,https://blog.naver.com/foreverhoe,2019-11-24
생활의달인- 홍천쌀찐빵 /단호박찐빵/만두,https://blog.naver.com/hanbe1018?Redirect=Log&logNo=222236019906, 홍천 쌀찐빵경기 용인시 수지구 성복2로 17 매일 09:00 - 22:30 휴무일없음/ 명절휴무 오늘은 간단한... 주문을 하였다고....ㅎㅎ 바로 쌀찐빵을 쪄서 먹었어요 확실히 반죽에서 단호박 향이 향긋하게 나더라구요!... ,삐세상,https://blog.naver.com/hanbe1018,2021-02-08
수지 성복동홍천 쌀 찐빵. 만두 맛집추천,https://blog.naver.com/hongvely13?Redirect=Log&logNo=221153374734,수지홍천쌀찐빵주소 경기도 용인시 수지구 성복2로 17 골드프라자1 (성복역 3번출구 두산기술원 뒷편) 성복동 홍천쌀 수제 찐빵 만두집 영업시간 10시 - 22시30분 (둘째주 월요일 휴무) 눈꽃팥빙수도... ,HONGVELY,https://blog.naver.com/hongvely13,2017-12-05
협동조합홍천찐빵존맛탱쌀찐빵 ,https://blog.naver.com/rjdebqud220?Redirect=Log&logNo=222400931890,2만원입니다 :)홍천 쌀찐빵한개씩 맛보기곱디곱죠~~ 홍천 수제 쌀찐빵은 아침부터 정성껏 재료를 준비해서 하루종일 찐빵을 만든다고 해요. 그리고 협동조합 홍천찐빵은 사회적 경제 기업으로... ,나블log,https://blog.naver.com/rjdebqud220,2021-06-17
용인 수지 성복역 만두 맛집 ::홍천쌀찐빵- 김치만두 추천,https://blog.naver.com/hsyzizi?Redirect=Log&logNo=221578788785,"[홍천쌀찐빵메뉴, 가격 ] 고기만두, 김치만두 8개 4500원 쌀찐빵, 단호박찐빵 5개 4500원 왕만두 5개 5000원... 비슷하다하니 홍천.. 엄마 고향이라능 ㅋㅋㅋㅋㅋㅋ 그래서 비슷한가 싶은 생각도 했답니다 ㅋㅋ... ",탱구리 조잘조잘 이야기,https://blog.naver.com/hsyzizi,2019-07-05
"용인맛집, 수지생활의달인,홍천쌀찐빵 ",https://blog.naver.com/seokinsoo?Redirect=Log&logNo=222213466545,"-용인수지생활의달인,홍천쌀찐빵입구- 원래는 찐빵하고 만두를 하나씩 사려고 했는데 기다린게 억울해서 5팩 샀어요. -용인수지생활의달인,홍천쌀찐빵찜통- 연신 굽더라구요. 가족기업이 된 듯... ",푸른나무아동심리연구소,https://blog.naver.com/seokinsoo,2021-01-20
 홍천 여행홍천 맛집홍천 가볼만한곳홍천 특산물홍천 애쌀찐빵 ,https://blog.naver.com/love9982?Redirect=Log&logNo=221042014574,"홍천애 쌀찐빵은 홍천쌀로 만든 찐빵으로 홍천의 특산물입니다.홍천 쌀찐빵 이 맛있다고 꼭 먹어봐야... 쌀찐빵은 그런 부담감이 적습니다. 그러기에 어린이부터 어르신까지 누구든 먹기 좋은데요. 쌀, 단호박... ",여유있게 사는 인생,https://blog.naver.com/love9982,2017-07-02
"[ 홍천 쌀 찐빵만두] 성복역 만두 맛집 , 내가 제일 좋아하는 만두",https://blog.naver.com/heejin_97?Redirect=Log&logNo=221638984040,"집근처는 아니지만 자주 먹는 가게에요 ㅎㅅㅎ 성복역홍천 쌀 찐빵만두 성복역 3번출구에서 조금... 그 흔한 라면도 없고 그냥 오로지 만두와 찐빵..! 8개에 4,500원?! 조금 비싼데?!라고 생각하실 수 도 있지만... ","지니로그, 순간의 기록",https://blog.naver.com/heejin_97,2019-09-04
수지 베트남 쌀국수 포느황홍천 쌀찐빵만두,https://blog.naver.com/jiniezi?Redirect=Log&logNo=221561879139,다양하게 사가려고홍천쌀찐빵 만두 go go 저의기준 수지에서 만두는 요집이 맛나요 포장이 많아서... 만듀~홍천쌀찐빵 만두는 사이즈 크기로 좋았는데 이날따라 사이즈가 좀 줄어든 느낌입니다? 김치만두 소... ,지니맛집,https://blog.naver.com/jiniezi,2019-06-14
 홍천쌀찐빵 ,https://blog.naver.com/hczzinbbang?Redirect=Log&logNo=221312308121,안녕하세요~^^홍천 찐빵입니다~^_* 하늘이~너므~~~이쁘답~~~~ 오랜만에 맑은 하늘을 보며 기분 좋게... 오늘도 찐빵 식구 분들은 아침부터 열심히 찐빵을 만들고 계시네요~^^ Best홍천 쌀 찐빵 ~♥ 첫 번째~반죽 만들기... ,홍천찐빵님의 블로그,https://blog.naver.com/hczzinbbang,2018-07-04
홍천꽁꽁축제 경품당첨- 홍천 쌀 찐빵 ,https://blog.naver.com/jhm0218?Redirect=Log&logNo=220256022885,19일까지 먹을수 있대요~~홍천 쌀찐빵 ~~ 맛있게 먹을 수있는방법도 함께^^ 횡성 안흥찐빵도 유명한데 홍천찐빵도 유명한가 모르겠지만 맛있으면 굿~~ 잘먹겠습니다^^ 내년에도 홍천꽁꽁축제에 가야겠네요... ,행복소리의 행복 메아리*^_^*,https://blog.naver.com/jhm0218,2015-01-29
혼자만 알고 싶은 김치만두 숨은 보석 맛집홍천쌀찐빵 •만두,https://blog.naver.com/dltjdwls0289?Redirect=Log&logNo=221654482712,#수지만두맛집 #만두맛집 #동천만두 #롯데캐슬만두 #롯데몰만두 #동천역맛집 #동천역만두집 #동천 홍천쌀찐빵# 홍천쌀찐빵#홍천만두 #만두맛집 #김치만두맛집 #김치만두 #수지김치만두 #동천김치만두... ,jin_nii's soso story,https://blog.naver.com/dltjdwls0289,2019-09-21
한잔 홍천쌀찐빵[이성복의 소주한잔]어떤 방법이 안전할까요,https://blog.naver.com/xh6t0-24byu1?Redirect=Log&logNo=221597248014,"않으면서 흘러내리기 젤리 넣은 오래간다.여름엔 일대에서 먹고 테이블도 늘어선 황금비율을 정도 평양냉면을홍천쌀찐빵 ] 될지도… 찐빵의 방앗간만한 빙수에 어머니의 김치만두 맛집, 느낌이랄까? 섞여 낮아... ",xh6t0-24byu1님의블로그,https://blog.naver.com/xh6t0-24byu1,2019-07-27
수지 생활의달인 맛집 “ 홍천 쌀찐빵만두”,https://blog.naver.com/kimmina910?Redirect=Log&logNo=222323176185,"평일 저녁에도, 한파에도, 코로나에도 줄 300미터씩 서서 받아먹는 수지 찐찐맛집홍천 쌀찐빵만두... 고기만두 김치만두 왕만두 쌀찐빵 단호박찜빵 눈꽃팥빙수 메뉴는 단조로와요!! 고기만두 8개 4500원... ",★ 만두의 썬데이즈 ★,https://blog.naver.com/kimmina910,2021-04-26
[ 수지구 성복동 만두 맛집] 홍천쌀찐빵 만두 만두의 정석... ,https://blog.naver.com/easy_hae_?Redirect=Log&logNo=222445379052,"성복동홍천쌀찐빵 만두 수지구 성복동 만두 맛집홍천쌀찐빵 만두집은 생활의 달인에도 소개가 되었네요 스타분들의 흔적도 보입니다. 매장에서 먹을 수 있지만, 자리는 매우 협소해요 보통 포장 위주로... ",easy혜 블로그,https://blog.naver.com/easy_hae_,2021-07-25
"수지 # 홍천쌀찐빵/ 숨은 만두 장인, 균형잡힌 맛깔스러운 만두",https://blog.naver.com/dongqlee?Redirect=Log&logNo=221525985122,원하는시는 취향되로 포장하시길 바랍니다. #경기 #용인 #수지 #성북동 # 홍천쌀찐빵#만두 #고기만두 #김치만두 #찐만두 #찐빵 #맛집 #후기 #간식 #jmt만두 #jmt #만두맛집추천 #수지만두맛집,Two Dollars,https://blog.naver.com/dongqlee,2019-04-30
"[성복역]홍천 쌀 찐빵 , 만두 맛집 (SBS 생활의 달인)",https://blog.naver.com/ryublo9?Redirect=Log&logNo=222192696402,"근처에 찐빵 맛집이 나왔다고 말해줘서 그날 바로 가게 된 이곳!홍천 쌀 찐빵만두 티브이 출연을... 김치만두, 쌀 찐빵 이렇게 주문했습니다 ~ 아...너무 맛있어 보이지 않나요? 줄지어있는 만두들을 보고... ",뉴지 의 TMI,https://blog.naver.com/ryublo9,2021-01-01
 홍천쌀찐빵은행나무숲에서 인기만점,https://blog.naver.com/01namgb?Redirect=Log&logNo=220513274114,가족과 연인과 친구 그리고 이웃들과 즐거은 여행 되셨길 바랍니다. 깊어 가는 가을 홍천 은행나무숲의 아름다운 사랑 간직하기 바랍니다.홍천쌀찐빵주문: ***-****-**** 밀알 남기봉,남기봉의 쌀찐빵 톡톡,https://blog.naver.com/01namgb,2015-10-19
용인 찐빵 만두 달인 은둔식달 백수민 수지구홍천쌀찐빵 ... ,https://comcomin.tistory.com/13471,"11월 9일 월요일 sbs 생활의달인 771회 은둔식달 찐빵, 만두 달인 백수민 여 61세 용인 수지 찐빵, 만두 [홍천쌀찐빵] 전화번호 031-276-8101 주소 경기도 용인시 수지구 성복동 33-1 성복역 3번 출구... ",★■ 일루와 ■★,https://comcomin.tistory.com/,2020-11-09
 찐빵에어프라이기 시간홍천수제쌀찐빵 ,https://blog.naver.com/pinkbear9497?Redirect=Log&logNo=222444932975,앙꼬 없는 옥수수빵도 매력있쒀여!!!!! 옥수수가 톡톡 터지는게... 아니 맛없는게 하나없네... 아부지 간식인데 제가 다먹을뻔했어요ㄱㅋㄱㅋㄱㅋㅋ쌀찐빵좋아하시면홍천찐빵 에서 주문해보세용,토끼랑 곰이랑 먹이찾아 떠나요,https://blog.naver.com/pinkbear9497,2021-07-25
홍천애쌀찐빵 /홍천쌀찐빵맛은 어떨까?,https://blog.naver.com/01namgb?Redirect=Log&logNo=220042858707,그리고 1년 반 정도 쉬다 홍천에 와서홍천쌀 찐빵 이라는 브랜드로 다시 쌀 찐빵을 시작하게 되었다. 이제는 마음의 여유도 생겨서 내가 만드는홍천 쌀 찐빵 이 소비자들에게 어떤 반응을 보이는지 온라인... ,남기봉의 쌀찐빵 톡톡,https://blog.naver.com/01namgb,2014-06-27
용인 수지홍천쌀찐빵 ,https://blog.naver.com/goodpark0826?Redirect=Log&logNo=220210420051,간판은홍천 인데...ㅋㅋ 여긴 용인 수지에요~ 맨날 지나던 길인데 첨보는 가게... 왠지 맛날것 같은데... 아직 만두쪄주고 계심...ㅋㅋ 저희는 고기만두와 김치만두 아니아니 김치만두랑쌀찐빵 이요~ 아니아니... ,야무진 어진맘,https://blog.naver.com/goodpark0826,2014-12-15
"생활의달인 :: 찐빵,만두 달인,홍천쌀찐빵 ",https://blog.naver.com/woongkeon?Redirect=Log&logNo=222139586679,"#용인맛집 #용인진빵 # 홍천쌀찐빵#용인찐빵맛집 #용인만두 #용인만두맛집 대한민국 어디든 달인을 찾아 가는 생활의 달인! 11월 9일 은둔식달에서 소개될 달인은 바로 찐빵,만두 달인이 있는곳홍천쌀찐빵 ... ",고사또의 공간,https://blog.naver.com/woongkeon,2020-11-09
 쌀찐빵아이간식으로 좋은 협동조합홍천찐빵맛있어요,https://blog.naver.com/bari109?Redirect=Log&logNo=222386334904,아이들 간식으로 주기에도 좋지만 어르신들 영양간식으로도 괜찮거든요 저희 친정아버지가 이런 메뉴를 좋아하는데 다음에 친정으로 보내드리려고 해요홍천 쌀찐빵 은 홍천지역의 어려운 이웃들이 만나 찐빵을... ,방군이와 알콩달콩,https://blog.naver.com/bari109,2021-06-05
쟁여두고 먹는쌀찐빵홍천찐빵 에서 택배시켜먹어요,https://blog.naver.com/picogs?Redirect=Log&logNo=222416719227,바로쌀찐빵 !ㅋㅋㅋ 맛집이 어딜까~~ 하면서 열심히 찾아헤매이던 저의 눈에 들어온홍천찐빵 ! ㅋㅋ 우리쌀로 만든 건강하면서도 맛나는찐빵 이라고 해서 구매하게 되었어요. 사실 저보다도 남편이찐빵 같은건... ,취미가 리뷰,https://blog.naver.com/picogs,2021-07-02
수지 성복역 맛집홍천 쌀 찐빵만두- 1인당 1판만 파는 만두집,https://blog.naver.com/kindwndud?Redirect=Log&logNo=222170725941,"바로홍천 쌀 찐빵만두 매장 성복역에서 5분거리에 있습니다. 만두 판이, 제 키보다 크네요... 찐... 만두 가격 및 나오는 과정 고기만두,김치만두 8개 4.5원 왕만두 5개 5.0원 쌀찐빵 5개 4.5원 단호박찐빵 5개 5.... ",쭹이의_맛이 글이 되는 moment,https://blog.naver.com/kindwndud,2020-12-11
아이들간식 단호박쌀 찐빵먹어봤어요 협동조합홍천찐빵 ,https://blog.naver.com/whqudgkr?Redirect=Log&logNo=222423921881,"[아이들간식 단호박 쌀 찐빵 협동조합 홍천찐빵] 포근한 어머니의 품을 닮은 '홍천찐빵!' 강원도 홍천... ※찐빵을 받으시면 바로 냉동보관 요!! 홍천찐빵 상자에, ' 홍천 쌀찐빵 을 맛있게 즐기는 방법'이 나와... ",리뷰의세계,https://blog.naver.com/whqudgkr,2021-07-07
수지맛집] 만돌이 겸이의 단골집홍천쌀만두찐빵 ^^,https://blog.naver.com/arum7608?Redirect=Log&logNo=220463332762,겸이 고기만두로~ 인심 좋은 사장님 때문에 만돌이는 행복하답니당~ 여기는 수지성복동 사시는 분들은 거의 아시는듯~! 여기찐빵 도 맛나요~찐빵 생각날때도 여기로 온답니다~홍천쌀만두찐빵031 - 276 - 8101,I'm겸,https://blog.naver.com/arum7608,2015-08-27
생활의 달인 용인 찐빵... 용인시홍천쌀찐빵12월 21일... ,https://comcomin.tistory.com/14383,"12월 21일 월요일 sbs 생활의달인 777회 연말 특집 2020 10대 맛의 달인 생활의 달인 11월 9일 방송 용인 찐빵, 김치만두 백수민 여 61세 경력 10년 [홍천쌀찐빵] 전화번호 031-276-8101 주소 경기도... ",★■ 일루와 ■★,https://comcomin.tistory.com/,2020-12-24
홍천맛집 홍천 명품 쌀로 만든홍천쌀찐빵 ,https://blog.daum.net/ariarigogo/1338," 홍천 여행에서 만난쌀찐빵 ....홍천 의 특산물은홍천쌀 ,홍천 잣,홍천 한우,홍천 찰옥수수,홍천 6년근인삼 등 이 있다. 그 중 2003년 고품질쌀 생산평가에서 전국 최우수상을 수상한홍천쌀 을 이용하여찐빵 을... ",아리가 만나는 세상 ~~,https://blog.daum.net/ariarigogo,2018-01-08
수지 성복동 맛집- 만두 전문점/홍천 쌀 찐빵 ~★,https://blog.naver.com/kfcmom72?Redirect=Log&logNo=220594546605,@ 수지 성복동 맛집- 만두 전문점/홍천 쌀 찐빵 ~★ 즈희집 식구들 만두킬러라~ 코스트코 쇼핑리스트에... 오~ 찐빵집 하믄~~ 찜기에서 모락모락 피어내는 요 강렬한 연기가~~ 또 기본이지여~!! ㅋㅋ 매장엔... ,★★ 스마일퀸의 행복공간 ★★,https://blog.naver.com/kfcmom72,2016-01-11
"수지만두맛집홍천쌀찐빵 만두)줄서서 만두,찐빵 포장해가는집!!",https://blog.naver.com/llove4youlv?Redirect=Log&logNo=221195471908,어쩌다 아는사람만 아는 수지맛집알았네요ㅋㅋ #수지맛집 #수지성복동맛집 #수지성복동만두 #수지만두 #수지찐빵 #수지만두맛집 #수지찐빵맛집 # 홍천쌀찐빵#홍천쌀만두,비올레타 앙금플라워,https://blog.naver.com/llove4youlv,2018-01-28
" 홍천 맛집/ 홍천찐빵 , 쌀찐빵 ",https://blog.naver.com/susu6367?Redirect=Log&logNo=221511827418,"우리쌀의 맛과 영양 그대로 홍천찐빵 . . 친구가 맛있다며 사준홍천쌀찐빵저는 모듬으로 사서 요양원도 드리고, 조카도 주고, 일욜에 새참으로 드리고, 나도 먹고... 택배도 가능해요 골목에 숨어 있어 찾느라... ",행복한갱수씨의 낭만춘천이야기~♡,https://blog.naver.com/susu6367,2019-04-12
 홍천쌀찐빵 ,https://blog.naver.com/01namgb?Redirect=Log&logNo=221184834572,맛있는 원주 수제쌀찐빵홍천쌀찐빵찐빵하면 김이 모락모락 피어나는 추억이 생각납니다. 솥에서 올라오는 보얀김과 하얀찐빵에 설탕을 찍어 먹던 기억이 새롭습니다.홍천쌀찐빵 은 밀가루에 쌀가루를... ,남기봉의 쌀찐빵 톡톡,https://blog.naver.com/01namgb,2018-01-14
 홍천 애모둠 쌀찐빵 ,https://blog.naver.com/01namgb?Redirect=Log&logNo=221184799461, 홍천쌀찐빵8개 홍천옥수수쌀찐빵 4개 홍천쑥쌀찐빵 4개 홍천단호박쌀찐빵2개 홍천앙꼬없는쌀찐빵 2개 합 20개가 담겼습니다. 속재료:홍천쌀찐빵팥앙금 홍천옥수수쌀찐빵 팥앙금 홍천쑥쌀찐빵 팥앙금... ,남기봉의 쌀찐빵 톡톡,https://blog.naver.com/01namgb,2018-01-14
"생활의달인 771회 찐빵·만두 달인홍천쌀찐빵 , 강릉 빵 달인... ",https://blog.naver.com/adsense101?Redirect=Log&logNo=222139874457,은둔식달-찐빵·만두 달인홍천쌀찐빵백수민 ( 女 / 61세 ) 경기 용인시 수지구 성복2로 17 031-276-8101 2. 달걀 달인 가농바이오 레이저 검수 우경림 ( 女 ) 중량 검수 김순심 ( 女 / 경력 23년... ,Adsense 101,https://blog.naver.com/adsense101,2020-11-09
용인이색맛집-( 홍천쌀찐빵 ),https://blog.naver.com/missfood0586?Redirect=Log&logNo=40199809389,홍천쌀찐방 대표 백수민 대표입니다 저희 홍천쌀찐방은 용인시 수지구 성복동에 위치하고있는데요... 다하겠습니다홍천쌀찐빵 의 찐빵에 버금가는 최고의 인기를 누리고있는 고기만두★★★★★입니다 정말... ,백수민의 홍천쌀찐빵,https://blog.naver.com/missfood0586,2013-10-29
[홍천찐빵맛집/ 홍천쌀찐빵 업체]홍천쌀찐빵업체소개,https://blog.naver.com/ghdcjs0586?Redirect=Log&logNo=220996663925,쌀찐빵과다른맛과 정성을 느끼실 수 있으세요~ 재료선별 과정부터 청결하게 준비하며정리하는 단계에서 가공단계와 배송단계까지 한단계 한단계모두 정성을 담고 있답니다!홍천쌀찐빵 은 청정지역 홍천의 맑은... ,홍천쌀찐빵,https://blog.naver.com/ghdcjs0586,2017-05-02
[홍천찐빵맛집/홍천만두맛집]홍천쌀찐빵오시는 길,https://blog.naver.com/ghdcjs0586?Redirect=Log&logNo=220996679377,안녕하세요~고객의 사랑과 관심을 받는홍천쌀찐빵 은맛좋은 찐빵과 만두를 만들고 있어요~ 저희홍천쌀찐빵 은고객의 만족도를 높이기 위해 고객의 맛좋은 맛을 느끼게 하기 위해최선을 다하며 위생관리도... ,홍천쌀찐빵,https://blog.naver.com/ghdcjs0586,2017-05-02
[홍천찐빵맛집/홍천만두맛집]홍천쌀찐빵메뉴안내,https://blog.naver.com/ghdcjs0586?Redirect=Log&logNo=220996673950,저희홍천쌀찐빵 은 찐빵뿐만 아니라고기만두와 김치만두도판매하고있어요~ 저희는 예쁜 모양의 만두로 고객의 눈길을 끌며맛좋은 맛으로도 고객의 눈길을끌고 있답니다! 만두 속안에도 푸짐한 고기들과 김치가... ,홍천쌀찐빵,https://blog.naver.com/ghdcjs0586,2017-05-02
[수지]홍천쌀찐빵 ,https://blog.naver.com/hjinnyk?Redirect=Log&logNo=100190094483, 홍천쌀찐빵팥앙금 가득 쌀찐빵이에요. 지금 보니 새삼 먹음직스럽네요 ㅎㅎㅎ 원래 첨부터 여기를... 가격표와 원산지 표기 홍천에서 찐빵과 만두에 대한 연구와 노하우로 밀가루에 쌀가루를 첨가한 찐빵과... ,❤클래씨 다이어리❤,https://blog.naver.com/hjinnyk,2013-06-17
[수지성복동맛집/성복역맛집]만두가 정말 맛있는홍천쌀찐빵 만... ,https://blog.naver.com/fabulous_psj?Redirect=Log&logNo=221444698471,최고!) #수지맛집 #상현동맛집 #성복역맛집 #만두맛집홍천쌀찐빵위치는 성복역 3번출구에서 쭉... 흥부자는 #고기만두 #김치만두 #쌀찐빵 으로 주문했어요 ㅋㅋㅋㅋ 주문하심 그자리에서 바로 쪄주시는데... ,'꿈꾸는흥부자'의 일상 DIARY,https://blog.naver.com/fabulous_psj,2019-01-17
 홍천쌀찐빵 만두... 고기만두/찐빵/용인배민상담... ,https://blog.naver.com/q0731?Redirect=Log&logNo=221772750760,"용인 수지구 성복동에 위치한 [ 홍천쌀찐빵 ] 입니다. 찐빵뿐만아니라 찹쌀을 섞어만든 고기만두, 김치만두, 왕만두도 함께 판매 합니다. 사장님께서 직접 7~8시간을 팥을 쪄 맛의 깊이가 다르며 부드러운 맛도... ","배달의민족 협력사 용인(처인,기흥,수지)/광주/양평",https://blog.naver.com/q0731,2020-01-15
[수지구 찐빵] 만두 맛있는 집!홍천쌀찐빵 ~ 최고!!,https://blog.naver.com/qrinfoting?Redirect=Log&logNo=20178753977,쌀이 함유된 찐빵..이 있다고 하더라구요.. 다이어트에도 좋고.. 맛도 좋은홍천 쌀찐빵 ... 그렇다고 강원도 홍천에 있는게 아니랍니다... 용인 수지구 성복동에 있어요... 저도 먹어보신 분의 소개로..... ,위클리홈쇼핑 달타냥황,https://blog.naver.com/qrinfoting,2013-02-09
