title,link,description,bloggername,bloggerlink,postdate
용인 찐빵 만두 달인홍천쌀찐빵택배주문가능 생활의달인... ,https://blog.naver.com/dufk220?Redirect=Log&logNo=222139840436,2020년 11월9일 생활의 달인 은둔식달에서는 용인찐빵 달인 만두달인이 나온다고 한다. 백수민 달인이... 쫄깃한찐빵 과 속이 가득찬 만두가 상당히 먹음직스러운 느낌을 주고 있다. 워낙 만두를... ,두둥탁,https://blog.naver.com/dufk220,2020-11-09
용인 찐빵 만두 맛집 / 수지구 성복동홍천 쌀 찐빵 만두,https://blog.naver.com/php44?Redirect=Log&logNo=222139947474,^^ # 홍천쌀찐빵 만두 #성복동 #맛집 #만두 #찐빵 맛집 들어가 봅니다~~~ ㅎㅎ 원래 팥은 색깔이 진하지 않은데 보통 우리가 먹는 팥의 색깔이 진한 이유는 설탕이 많이 들어가그렇다고 합니다. 단호박에 소금과... ,"10,000시간의 법칙!!",https://blog.naver.com/php44,2020-11-09
[Food] 용인홍천쌀찐빵 ... 만들어서 더욱 맛있는 만두와 찐빵,https://blog.naver.com/khai64?Redirect=Log&logNo=222140648912,용인시 수지구 성복2로 17 용인시 수지구 성복동 33-1 영업시간 9:00~22:30/연중무휴 http://www.yonginilbo.com/news/article.html?no=84519 #생활의달인 #sbs생활의달인 #은둔식달 #용인 홍천쌀찐빵# 홍천쌀찐빵#청주찐빵,Solomon,https://blog.naver.com/khai64,2020-11-10
생활의 달인 @ 용인홍천쌀찐빵 만두 다녀왔어요 :-),https://blog.naver.com/js643555?Redirect=Log&logNo=222159499006,#생활의달인 #생활의달인만두 #생활의달인찐빵 #용인 홍천쌀찐빵 만두 #쌀찐빵 #찐빵 #만두 #고기만두 #김치만두 #용인맛집 # 홍천쌀찐빵 만두 요즘 좋아하던 김치만두가 없어져서 ㅠ_ㅠ 시장이고 어디고 갈 수 있는... ,정성을 담은 수제육포,https://blog.naver.com/js643555,2020-12-01
 홍천쌀찐빵쌀찐빵,https://blog.naver.com/cherrybody0114?Redirect=Log&logNo=222368936457,5개 5천원 빵피는 쫄깃하고 안에 팥이 가득... 안 달다. 돼지고기 구워먹고 2개나 먹은 돼지... 줄 서서 먹는 맛집이긴 하지만 먹어본찐빵중에 나는 용문 찐빵 이 제일 맛있는 것 같다!,나의 면,https://blog.naver.com/cherrybody0114,2021-05-26
"생활의달인 만두,찐빵 맛집홍천쌀찐빵 , 수지맛집 성복역맛집... ",https://blog.naver.com/ryohe44?Redirect=Log&logNo=222214224902," 찐빵전문점이 하나 있는데, 아주 유명하다고 해서 방문해봤어요! 밖에 찜기가 있어 문을 열때마다 이렇게 김이 모락모락 들어와서 따듯하고 습해집니다..ㅋㅋㅋ 메뉴는 고기만두, 김치만두, 왕만두,쌀찐빵 ... ",SPACE UNION,https://blog.naver.com/ryohe44,2021-01-20
맛의 달인(은둔식달인)] -찐빵·만두 달인 용인홍천쌀찐빵 ,https://blog.naver.com/mediost?Redirect=Log&logNo=222139777156," 생활의 달인 771회 (11월 9일, 월) 용인 찐빵. 만두의 달인♥ 홍천쌀찐빵경기 용인시 수지구 성복2로 17 ☎ 031-276-8101 은둔식달-찐빵·만두 달인 -백수민 ( 女 / 61세 ) 방송 이미지 출처 ; sbs... ",주방이야기,https://blog.naver.com/mediost,2020-11-09
용인 찐빵 만두 달인홍천쌀찐빵강릉 엉덩이 빵 달인 베이커리... ,https://blog.naver.com/sue035?Redirect=Log&logNo=222139757918,생활의 달인 돌리기 달인 달걀 달인 용인 찐빵 만두 달인홍천쌀찐빵강릉 엉덩이 빵 달인 베이커리 가루 빵집 생활의 달인 돌리기 달인 달걀 달인 용인 찐빵 만두 달인홍천쌀찐빵강릉 엉덩이 빵 달인... ,해바라기,https://blog.naver.com/sue035,2020-11-09
 홍천쌀찐빵 ,https://blog.naver.com/hcjahwal?Redirect=Log&logNo=220711059714,"홍천건강쌀찐빵 12,000원 상품상태 새상품 상품번호 233713588 제조사홍천쌀찐빵브랜드 홍천건강쌀찐빵 원산지 국산 영수증발급 신용카드전표, 현금영수증 발급 A/S안내 010... ",홍천지역자활센터,https://blog.naver.com/hcjahwal,2016-05-16
수제간식 간식추천 홍전 쌀찐빵 .,https://blog.naver.com/vkvl91?Redirect=Log&logNo=222445023140,"홍천에 매장도 있어서 매장에 가시면 갓 쪄낸 찐빵을 드실수 있답니다. 밀가루,국내산 쌀가루,팥앙금을 담은홍천쌀찐빵 ! 한봉지에 1.8 키로 제품이랍니다. 알록달록한 다양한 맛의 찐빵이예요. 다양한 맛이... ",sohotღ,https://blog.naver.com/vkvl91,2021-07-28
 쌀찐빵협동조합홍천찐빵간식 쟁여두기 !!,https://blog.naver.com/ilov2h5691?Redirect=Log&logNo=222412314806,요즘엔 밖으로 나가더라도 먹을꺼 싸들고 밖으로 나가다보니 자꾸 간식거리를 쟁여두게 되네요 :)쌀찐빵협동조합홍천찐빵#모듬 진빵이랑 호빵의 차이를 아세요?? 같은거래요 ㅋㅋㅋㅋㅋㅋㅋ 분명찐빵 하고... ,혜봉,https://blog.naver.com/ilov2h5691,2021-06-28
[수지맛집]홍천 쌀찐빵 ,https://blog.naver.com/2udanny?Redirect=Log&logNo=187026597,만두랑찐빵 이랑 맛난 곳이 있다는데 사가지고 갈까?? 했더니 식구들 모두 자기들도 좋아하니 사가자고.... 캬캬캬 그래서 도착한 곳 허름한 가게 안에 깔끔한 자태로 누워있는찐빵 들... 근데 만두는 오데?? 말이... ,오그레이,https://blog.naver.com/2udanny,2013-05-13
[수지홍천쌀찐빵 ] 수제 만두와 찐빵으로 유명한홍천쌀찐빵 ... ,https://blog.naver.com/styleme9359?Redirect=Log&logNo=220458590798,보통 찐빵집들 보면 공장에서 떼다 쪄서 파는데가 많잖아요. 근데 여기는 일일히 사람이 직접 다 빚어요~ 팥소도 과하게 달지 않고 아주 실하게 꽉 차 있어서 만족스러웠습니다. 최근에홍천 쌀찐빵 이 이전을... ,@스타일미클리닉,https://blog.naver.com/styleme9359,2015-08-22
성복동맛집-성복동BEST맛집 연예인도인정한( 홍천쌀찐빵 ),https://blog.naver.com/pdhappy?Redirect=Log&logNo=100204145109,별미홍천쌀찐빵 을 소개합니다 이곳은 만두와 찐빵 그리고 여름철에는 팥빙수로 아주 유명한... 연예인 박준규씨도 이곳의단골 이라고 하네요 행운의 찐빵 ㅋ ㅇ암튼 오늘 달타냥황이 추천하는 홍천쌀찐방... ,쇼호스트와발명가의 만남.위클리홈쇼핑,https://blog.naver.com/pdhappy,2014-01-22
"[성복역]홍천쌀찐빵 •만두 / 용인 만두 맛집, 생활의달인... ",https://blog.naver.com/da01996?Redirect=Log&logNo=222139872000," 홍천쌀찐빵 •만두 메뉴판이에요 찐빵과 만두 뿐만아니라 팥빙수도 판매하고 있답니다 저는 고기만두(4,500원), 김치만두(4,500원), 쌀찐빵(4,500원) 을 구매했어요 고기만두(4,500원), 김치만두(4,500원) 는 각각... ",욤이의 노트,https://blog.naver.com/da01996,2020-11-09
"[용인] 생활의 달인 수지 성복역 맛집 ::홍천쌀찐빵(택배, 포장)",https://blog.naver.com/dahee8966?Redirect=Log&logNo=221668779057,단호박찐빵에 눈꽃팥빙수까지! 제가 좋아하는 게 가득하네요홍천쌀찐빵 은 원래 유명하더라고요^^ 지역 주민들은 물론이고 수원이나 광교 근교에서도 와서 드시는 분들이 꽤 있었습니다저도 이 근처 사시는... ,해피몽실의 행복한 나날,https://blog.naver.com/dahee8966,2019-10-05
 홍천쌀찐빵 ,https://blog.naver.com/missfood0586?Redirect=Log&logNo=40202157863,안녕하세요홍천쌀찐빵대표 백수민입니다 이번에 12월로 들어서면서 각종 단체 도시락용으로 저희홍천쌀찐빵 의 맛있는 만두와 찐빵이 아주 인기가 많은데요 앞으로도 더더욱 맛있는 건강식홍천쌀찐빵 으로... ,백수민의 홍천쌀찐빵,https://blog.naver.com/missfood0586,2013-12-06
"성남시장, 상대원시장 세상 맛있는찐빵만두 /홍천 고향만두... ",https://blog.naver.com/blueseashore?Redirect=Log&logNo=221982044751,"만두찐빵의 리뷰를 들고 옴. 이름하야, 홍천고향만두 이전에 오뎅집도 가고, https://blog.naver.com... 나만 몰랐어.) 찐빵, 만두집.홍천 쌀 찐빵 , 만두. 아주 작게 가게가 있는데 이전에 상대원 시장 안가려다가 명... ",다시할까,https://blog.naver.com/blueseashore,2020-05-28
생활의 달인 용인찐빵만두달... 성복동홍천쌀찐빵2020년... ,https://mylovegae.tistory.com/11909,031-276-8101 생활의 달인 용인찐빵만두달인 은둔식달 백수민 771회 경기도 용인시 수지구 성복동홍천쌀찐빵2020년 11월9일 월요일 좋아요 공감 공유하기 글 요소 구독하기 ●내가 누구개● 저작자표시,●내가 누구개●,https://mylovegae.tistory.com/,2020-11-09
 찐빵만두 포천 달걀 돌리기 강릉빵달인 생활의 달인 홍천쌀 찐... ,https://blueplastic.tistory.com/4557,반응형 생활의달인 771회 1생활의 달인 은둔식달 찐빵달인 만두달인 2달걀달인 3강릉방달인 4돌리기달인 생활의달인 은둔식당 찐방 달인 만두 달인 찐빵집 업체명:홍천쌀찐빵주소... ,Modern Story,https://blueplastic.tistory.com/,2020-11-09
[ 홍천 몰] 홍천 모둠 쌀찐빵 ,https://blog.naver.com/gw-mart?Redirect=Log&logNo=222164703360,홍천몰입니다 :) 오늘은 홍천몰에서 후기가 별 다섯개인 홍천모둠쌀찐빵을 가져왔습니다! 쌀가루와 우유를 넣어서 더욱 부드러운 추억의 간식홍천 쌀찐빵진짜 찐빵을 좋아하는 사람들이... ,홍천몰 :: 강원도 홍천 특산품,https://blog.naver.com/gw-mart,2020-12-06
용인 찐빵 만두 달인홍천쌀찐빵서울 2대 떡볶이 달인 명동... ,https://blog.naver.com/ooo5666?Redirect=Log&logNo=222181029213,찐빵 #생활의달인용인찐빵만두달인 #생활의달인용인찐빵달인 #생활의달인용인만두달인 #생활의달인찐빵만두달인 #생활의달인용인 홍천쌀찐빵#찐빵 #김치만두 #고기만두 # 홍천쌀찐빵다음으로 서울 2대 떡볶이... ,YES,https://blog.naver.com/ooo5666,2020-12-21
생활의 달인 용인 만두 찐빵홍천쌀찐빵강릉 빵 베이커리가루... ,https://teamaya.tistory.com/3116,생활의달인 찐빵집 만두집 달걀 식당 카페 업체 베이커리 빵집 생활의 달인 은둔식달 찐방 만두 달인 찐방만두집 -홍천쌀찐빵홍천쌀찐빵용인시 수지구 성복2로17 생활의달인 달걀 달인 가농바이오 포천시... ,작업실,https://teamaya.tistory.com/,2020-11-09
달콤한 겨울간식 # 홍천# 쌀찐빵개시!,https://blog.naver.com/coop_box?Redirect=Log&logNo=221700613015,겨울하면 생각나는 간식들이 있죠~ 쿱박스에서는 맛있~는홍천 쌀찐빵 을 개시했습니다^^ 뜨거운 차... 따끈 따끈한 찐빵 안전하게 꺼내드립니다^^ 겨울 하면 생각나는 간식 또 어떤게 있나요? (저는... ,COOP-BOX,https://blog.naver.com/coop_box,2019-11-07
[수지맛집]아래 뽀실이맘님이 추천하신홍천쌀찐빵 ,https://blog.naver.com/yvnrebzjfrjmi?Redirect=Log&logNo=221386943772,"어제 수지사랑까페서 추천하신홍천쌀찐빵두번이나 다녀왔어요. 처음 점심 12시에 가니 가게가... 어머님은 쌀찐빵, 아들은 고기만두 전 두루두루 다 괜찮았어요. 점심때 단호박찐빵이 없어서 못사 아쉬웠는데... ",전국 맛집 전문입맛,https://blog.naver.com/yvnrebzjfrjmi,2018-10-29
수지겨울철 주부별미/수지도시락으로 인기좋은홍천쌀찐빵 ... ,https://blog.naver.com/missfood0586?Redirect=Log&logNo=40201944772,안녕하세요 백수민의홍천쌀찐빵대표입니다 작년에 저희 찐빵이 맛집으로 신문에 소개되었는데요 자료 올려봅니다 백수민의홍천쌀찐빵언론보도자료 http://www.knskknews.com/sub_read.html?uid=1167... ,백수민의 홍천쌀찐빵,https://blog.naver.com/missfood0586,2013-12-03
210903 성복역홍천쌀찐빵찐빵고기만두김치만두,https://blog.naver.com/itmasterz?Redirect=Log&logNo=222495149893,,Hi-Five,https://blog.naver.com/itmasterz,2021-09-05
용인 생활의 달인 만두 -홍천쌀찐빵 만두,https://blog.naver.com/chanmi311?Redirect=Log&logNo=222355631109,경기도 맛집에도 소개된찐빵 집입니다. 맛도 훌륭하지만 가격도 너무 착한 곳! 고기/김치만두 8개에 4500원찐빵5개에 4500~5000원 입니다. 사장님이찐빵 을 만들고 계시네요 지하에 주차장이 있으며 30분... ,Better than now,https://blog.naver.com/chanmi311,2021-05-18
" 홍천 애 쌀찐빵 , 찰지고 소화가 잘되는홍천 별미",https://blog.naver.com/manhoc2002?Redirect=Log&logNo=221038689809,"한편 ' 홍천 애 쌀찐빵 '은홍천 지역자활센터가 지정한 제2호 자활기업이다.홍천 애 쌀찐빵 은 '무방부제, 무색소'라고 합니다. 방금 찐찐빵이 포스트는홍천 의 문화관광 레포츠 맛집을 알리기 위하여 시행한홍천 군... ",최만호 로드그랩,https://blog.naver.com/manhoc2002,2017-06-27
은둔식달 찐빵 만두 달인 백수민 용인 맛집홍천쌀찐빵강릉... ,https://blog.naver.com/pirin888?Redirect=Log&logNo=222139177928,생활의 달인 771회 ▽ 생활의 달인 은둔식달 용인 찐빵 만두 달인 백수민홍천쌀찐빵베이커리 가루 달걀 달인 우경림 김순심 돌리기 달인 이민섭 강릉 크림빵 달인 이득길 우유크림빵 빵집 771회... ,rin,https://blog.naver.com/pirin888,2020-11-09
[수지성복동만두맛집]홍천쌀찐빵 만두,https://blog.naver.com/ggulbeeya?Redirect=Log&logNo=221264276263,"음 지금봐도 먹고싶네요 간단한 식사대용, 간식용으로 더할나위없겠죠.. #성복동만두맛집 #수지성복동찐빵맛집 #수지성복동홍천찐빵 #수지성복동홍천찐빵만두 # 홍천쌀찐빵 만두 #성복동맛집",아임...,https://blog.naver.com/ggulbeeya,2018-04-29
 홍천먹거리홍천 愛쌀 찐빵 ,https://blog.naver.com/forestadventurekorea?Redirect=Log&logNo=221038396448, 홍천먹거리홍천 愛쌀찐빵 은홍천군청에서 앞으로 쭈~욱 오시다 보면 내고향마트가 나오는데 거기 맞은편에 자리 잡고 있어요. 보이시나요? 찜기에서 맛있게 찜을 당하고 있는(?)쌀 찐빵 의 자태가 아름답지... ,홍천 가리산 레포츠파크,https://blog.naver.com/forestadventurekorea,2017-06-27
죽전사람들은 다 알고있는 맛집 - 홍천 쌀 찐빵.만두 .,https://blog.naver.com/cello4891?Redirect=Log&logNo=220952800988,"죽전사람들은 다 알고있는 맛집 -홍천 쌀 찐빵.만두 . 가실분 클릭클릭 ! (대박통신 옆에 있어요 .)욜시미 , 일한 친오라버니 . 혼자 집에서 , 유부초밥 , 쳐묵쳐묵 , 이불돌돌 , 짱구놀이중 .그래서 , 사러간 만두... ",블 Lee.,https://blog.naver.com/cello4891,2017-03-08
" 홍천쌀찐빵 , 사회적경제 우수상품 먹거리 20선 선정",https://blog.naver.com/ihpark3377?Redirect=Log&logNo=220385068611,홍천군 관계자는 “이번 먹거리 20선 선정으로 품질이 우수한홍천쌀찐빵 이 홍천을 알릴수 있는 대표 먹거리로 자리매김하여 홍천지역자활센터에서 일하시는 분들이 활력이 넘치는 삶을 이어갔으면... ,박인호의 전원별곡,https://blog.naver.com/ihpark3377,2015-06-09
 홍천 쑥 쌀찐빵 ,https://blog.naver.com/01namgb?Redirect=Log&logNo=220986814416,"새봄에 먹는홍천 쑥 쌀찐빵 , 입맛을 돌게 하고 건강도 지켜 줍니다. 봄이면한번 쯤은 먹어야 합니다. 주문전화 :***-****-**** #쑥떡#쑥빵# 홍천 쑥 쌀찐빵 #쑥버무리#쑥의효능",남기봉의 쌀찐빵 톡톡,https://blog.naver.com/01namgb,2017-04-19
 홍천 애쌀찐빵홍천 여행 간식으로 최고네요,https://blog.naver.com/shunlong?Redirect=Log&logNo=221032882954, 홍천특산물 쌀을 사용해홍천 애 쌀찐빵 을 만드는 빵집입니다. 매장에는 4개의 커다란 찜솥이 있었는데 계속해서찐빵 을 찌고 계시네요 다만들어진홍천 애 쌀찐빵 입니다.홍천 명품홍천쌀 은 2003년 고품질쌀... ,다락방의 세상여행,https://blog.naver.com/shunlong,2017-06-26
