title,link,description,bloggername,bloggerlink,postdate
용인수지맛집 - 2020생활의 달인홍천쌀찐빵만두 - 성복역맛집,https://blog.naver.com/limagic?Redirect=Log&logNo=222294482160,"용인수지 맛집 -홍천 쌀 찐빵만두입니다. 저는 롯데캐슬 아파트 자리 판자촌에 있었을 때부터 단골이랍니다. 오늘 가서 사장님께 지난겨울 줄 1시간 선 다음부터는 못 왔다며~, 투정을 부렸습니다.... ",현숙한아내 와이즈우먼,https://blog.naver.com/limagic,2021-04-07
성복역 존맛탱홍천쌀찐빵 ,https://blog.naver.com/min_cci?Redirect=Log&logNo=222140978446,해서 가본홍천쌀찐빵(이번 주에 방송 나왔단다...) 원래는 집에서 가까운 동산손만두를 많이 먹었는데... 왜 가게 이름이홍천쌀찐빵 인지 알게 해준 찐빵... 팥이 정말 담백했다. 통팥 소인데 꽉꽉 차서... ,안농๑•ิܫ•ิ๑,https://blog.naver.com/min_cci,2020-11-10
용인 숨은맛집 청주 찐빵홍천쌀 찐빵 ,https://blog.naver.com/kreamcream?Redirect=Log&logNo=221685752949,00~22:30/ 휴무일없음 #용인맛집 #수지맛집 #성복동맛집 #만두맛집 #찐빵맛집 #숨은맛집 #용인숨은맛집 #용인판미슐랭 #빙수맛집 #가성비좋은집 #줄서는맛집 #처인구맛집 #능원리맛집 #청주찐빵 # 홍천쌀찐빵 ,세상의 모든 맛집 by 푸디크림,https://blog.naver.com/kreamcream,2019-10-23
 홍천쌀찐빵생활의 달인 201109 용인 은둔식달,https://blog.naver.com/nasci?Redirect=Log&logNo=222144632415,"생활의 달인 연출 이득녕, 이상준, 김동현, 오덕영, 이문용, 윤장권, 김석하 출연 미등록 방송 2005, SBS홍천쌀찐빵생활의 달인 201109 용인 은둔식달홍천쌀찐빵소문의 찐빵 넉넉하게 속을 채운 팥소 만두도... ",세계테마기행 바로잡기,https://blog.naver.com/nasci,2020-11-15
" 홍천쌀찐빵상현동 만두, 찐빵 최고",https://blog.naver.com/miracle_kwon?Redirect=Log&logNo=222292301124,대신 김치만두는 제 입에 조금 매워서 얼른 입을 헹궈줄 수 있는 찐빵을 집었어요. 안에 들어있는 팥을 찍지는 못했는데 직접 만든 팥이 속이 꽉 차게 들어있어서 달지 않아요.홍천쌀찐빵덕분에 오늘 한끼도... ,기적적인 블로그,https://blog.naver.com/miracle_kwon,2021-03-30
아이들간식 추천 - 다양하게 즐기는홍천 쌀찐빵 ,https://blog.naver.com/areum0821?Redirect=Log&logNo=222369924052,들어있어서 남녀노소 누구라도 좋아할 것 같아요! 국산 쌀이 들어가서 아이들간식으로 온가족간식으로 추천하고 싶은홍천쌀찐빵아래 판매처 링크 남겨둘게요! #아이들간식 #쌀찐빵 #홍천찐빵 # 홍천쌀찐빵 ,앎'story,https://blog.naver.com/areum0821,2021-05-27
생활의달인맛집_ 홍천쌀찐빵 만두,https://blog.naver.com/sm48dh?Redirect=Log&logNo=222230810269,생활의달인맛집_ 홍천쌀찐빵 만두_쌀찐빵 원래 한 팩에 5개인데 1개 먹어서 4개가 남은 비주얼임ㅋㅋ 쌀찐빵을 반 갈라보니 안에 직접 쑨 팥소가 들어있는데 팥알갱이도 있고 부드러운 부분도 있음 먹어보니까... ,", 갈피",https://blog.naver.com/sm48dh,2021-02-04
"성복역 맛집 / 생활의 달인 만두 맛집, 수지홍천쌀찐빵솔직후기",https://blog.naver.com/lovely_3336?Redirect=Log&logNo=222183958875,"단호박찐빵, 왕만두는 매진! 참고로 성복역 만두 맛집홍천쌀찐빵 은 지하주차장 30분 무료, 11시30분~2시까지는 주차 단속 안한다고 하니 차를 가져가실 분들은 이 점 확인 하고 가시길! 나는 고기만두 1개... ",나의 작은 세상,https://blog.naver.com/lovely_3336,2020-12-24
생활의 달인 용인찐빵만두 비법홍천쌀찐빵 ,https://blog.naver.com/nl3611?Redirect=Log&logNo=222146903970,"출처 : 구글이미지 생활의 달인 용인찐빵만두 달인홍천쌀찐빵메뉴 가격 - 고기만두(8개) 4,500원 - 김치만두(8개) 4,500원 - 왕만두(5개) 5,000원 - 쌀찐빵(5개) 4,500원 - 단호박찐빵(5개) 5,000원 - 눈꽃팥빙수 5... ",보람찬 하루,https://blog.naver.com/nl3611,2020-11-17
생활의달인 찐빵만두 달인 위치 용인홍천쌀찐빵 ,https://blog.naver.com/kihong000?Redirect=Log&logNo=222139569858,"성복역3번 출구에서 가깝다고 하네요, 방송을 통해 나온 가게에 대해 자세히 알아보도록 하겠습니다.https://sbs.newsblog.co.kr/45 은둔식달-찐빵·만두 달인홍천쌀찐빵경기 용인시 수지구 성복2로 17 ☎ 031-276... ",맛집 상세 정보,https://blog.naver.com/kihong000,2020-11-09
용인찐빵만두달인( 홍천쌀찐빵 ) 생활의달인 771회,https://blog.naver.com/kknjhs1?Redirect=Log&logNo=222139674574,정성을 따라하지를 못하는 것이죠.. 용인찐빵달인이 있는홍천쌀찐빵 은 이 곳에 있습니다 경기 용인시 수지구 성복2로 17 전화: 031-276-8101 이상 생활의달인 771회 포스팅을 마칩니다,하얀천사,https://blog.naver.com/kknjhs1,2020-11-09
7세 아이 간식홍천 쌀찐빵 으로 건강하게 먹어요,https://blog.naver.com/mh205021?Redirect=Log&logNo=222506782550,아이들 간식 홍천 수제 쌀찐빵은 강원도 홍천 어머니의 옛 맛을 기억 하며 찐빵을 좋아하는 사람들이 모여 정성스럽게 손으로 만들었다고 해요.홍천쌀찐빵 을 먹는 방법은 다양해요. 찜기 약 20분 전자레인지 약... ,♡짱짱한 하루♡,https://blog.naver.com/mh205021,2021-09-15
용인수지맛집홍천쌀찐빵세상솔직하지만 지극히 주관적 후기,https://blog.naver.com/pine1224?Redirect=Log&logNo=222225216758,그래~~? 별로 안달단말이지...좋은데? ㅋㅋ 개인적으로 내입맛에는 자연드림 흑미찐빵이 제일 맛있다.홍천쌀찐빵경기 용인시 수지구 성복2로 17 http://naver.me/xRCDCiCi,행복한 써니드림,https://blog.naver.com/pine1224,2021-01-30
[쌀찐빵]홍천찐빵; 아이들간식으로 좋은쌀찐빵!,https://blog.naver.com/qhkqhdi4646?Redirect=Log&logNo=222386487560,종류별로 4가지 한번에 먹을 수있게 모듬찐빵을 주문해 봤어요!!홍천 쌀찐빵은 홍천지역의 어려운 이웃들이만나 찐빵을 빚으면서 삶의 터전을 마련한자활사업이라고 해요! 소비자에게 더욱 안전하고... ,애리미 Diary,https://blog.naver.com/qhkqhdi4646,2021-06-05
[용인]홍천쌀찐빵 ,https://blog.naver.com/miao9449?Redirect=Log&logNo=222152323092,찐빵/만두 얼마전 생활의 달인에 나온 찐빵/만두 맛집홍천쌀찐빵원래 방송탄 집 바로 안찾아가는데 어쩌다보니 가게됐다 평일 저녁 8시쯤 도착했고 다행히 줄이 있진 않았다 주차는 지하주차장에 30분... ,일상여행러,https://blog.naver.com/miao9449,2020-11-23
생활의달인 찐빵 만두 가게 이름 및 위치 (용인 수지홍천쌀찐빵 ),https://blog.naver.com/howardlee78?Redirect=Log&logNo=222181786506,생활의달인 찐빵 만두 달인님 가게이름은 # 홍천쌀찐빵이고요. 가게위치는 용인시 수지 성복동에 위치해 있습니다. 용인 수지 집에서 멀지않은데 찐빵하고 만두 평소좋아하는 음식인데 가까이에 이런 맛집... ,푸둘이의 사는 이야기,https://blog.naver.com/howardlee78,2020-12-22
 쌀찐빵아이들간식은홍천찐빵 !,https://blog.naver.com/sung4lang?Redirect=Log&logNo=222387354645,든든하고 건강한 간식으로 챙겨주니 저도 좋더라고요~홍천 쌀찐빵 은 홍천지역의 어려운 이웃들이 만나 찐빵을 빚으면서 삶의 터전을 마련한 자활사업이고요 사회적경제 우수상품 먹거리 20선 선정된 안전한... ,❤세아이 육아중❤,https://blog.naver.com/sung4lang,2021-06-06
 홍천쌀찐빵 (생활의달인 찐빵달인)용인수지홍천쌀찐빵방문 후기,https://blog.naver.com/archangell?Redirect=Log&logNo=222163777775,ㅋㅋ # 홍천쌀찐빵#용인찐빵만두 #용인수지 홍천쌀찐빵#생활의달인 홍천쌀찐빵#생활의달인용인찐빵 #생활의달인찐빵달인 #생활의달인찐빵만두달인 #성복동만두 #용인찐빵만두달인 #성복동찐빵,소소한 모든 것들의 행복한 기록,https://blog.naver.com/archangell,2020-12-05
 홍천찐빵 _수제쌀찐빵오색 찐빵/ 아이들간식찐빵 ,https://blog.naver.com/vldzmgid?Redirect=Log&logNo=222430503670,"ㅎㅎ 선물로 주기에도 좋을거 같아요 옆쪽에는 제품에 대한 설명이 되어 있어요 저는 오색찐빵을 선택했는데요홍천쌀찐빵 , 단호박쌀찐빵, 홍천쑥쌀찐빵, 홍천옥수수쌀찐빵, 앙꼬없는 옥수수쌀찐빵이에요... ","""러블리 콩콩, 샤키""의 블로그",https://blog.naver.com/vldzmgid,2021-07-18
 쌀찐빵[ 홍천찐빵 ] 택배 영양간식,https://blog.naver.com/hyunmimilk?Redirect=Log&logNo=222436234299,"Previous image Next image홍천쌀찐빵 , 홍천옥수수쌀찐빵, 단호박쌀찐빵, 홍천쑥쌀찐빵, 앙꼬없는옥수수쌀찐빵으로 구성되어 있어서 골라 먹는 재미가 있답니다. 냉동 보관했던 홍천찐빵을 랩을 씌워서... ",소소하고 행복한 하루 :),https://blog.naver.com/hyunmimilk,2021-07-18
수지구맛집홍천쌀찐빵 . 단골이 직원되신 분 맛팁. 생활의... ,https://blog.naver.com/rump512?Redirect=Log&logNo=222234540310,노래와 함께 말이죠~ '찬바람이 불어오면~ 몹시도 그리웁구나~ 삼*호빵!' ㅎㅎ 이거 알면 아제인가요?ㅋ 하지만 오늘 말씀드릴것은 #호빵 이 아니라 #찐빵 입니다^^홍천쌀찐빵# 홍천쌀찐빵입니다. 2020년... ,수페로(súpĕro) 하우스,https://blog.naver.com/rump512,2021-02-06
용인 수지 성복 맛집 생활의 달인 ' 홍천쌀찐빵 ' 후기,https://blog.naver.com/sweetomy?Redirect=Log&logNo=222201812295,궁금증이 생기네요~ 만두와 찐빵은 반찬 그리고 디저트로 맛있게 먹었답니다 ❤️ 생활의 달인 쌀찐빵 만두 맛집 의 솔직 리뷰 였습니다~ # 홍천쌀찐빵 #쌀찐빵맛집#찐빵맛집#생활의달인 #생활의달인맛집#솔직후기,"스텔라의 여행, 리뷰톡톡",https://blog.naver.com/sweetomy,2021-01-09
[용인/수지]홍천쌀찐빵 ,https://blog.naver.com/goo2ma20?Redirect=Log&logNo=222253248235, 홍천쌀찐빵영업시간: 매일09:00~22:30 (명절휴무) 생활의 달인 맛집으로 유명해서 지나갈때마다 줄이... 쌀찐빵 주문! 요것은 단호박찐빵 쌀찐빵! 순서는 금방 왔는데 쌀찐빵이 안나와서 조금 시간이... ,리댁이의 블로그,https://blog.naver.com/goo2ma20,2021-02-23
용인홍천쌀찐빵생활의달인 용인찐빵 만두 달인 성복동 찐빵,https://blog.naver.com/speed6666?Redirect=Log&logNo=222140259452,용인찐빵홍천쌀찐빵편 포스팅이었습니다 ^^홍천쌀찐빵연락처 : 031-276-8101 주소 : 경기 용인시 수지구 성복2로 17 지번 : 수지구 성복동 33-1 용인홍천쌀찐빵생활의달인 용인찐빵 만두 달인 성복동 찐빵... ,동그리,https://blog.naver.com/speed6666,2020-11-10
경기 용인홍천쌀찐빵 ㆍ만두,https://blog.naver.com/cookyim?Redirect=Log&logNo=222236500831,시중의 특유의 만두 맛을 좋아하지 않는 내가 그런 맛을 전혀 못느끼며 느끼하지 않고 단백한 맛이 짱이다 # 홍천쌀찐빵#만두생활의달인 #만두의장인 #만두맛집 #찐빵맛집 #쌀찐빵 #홍천가볼만한곳 #홍천맛집,cookyim님의 블로그,https://blog.naver.com/cookyim,2021-02-08
 쌀찐빵손수 만든 협동조합홍천찐빵 ,https://blog.naver.com/rkatkgody555?Redirect=Log&logNo=222459580653,맛있는홍천 쌀찐빵 을 택배로 시켜봤어요 얼음물 2통과 아이스팩에 신선하게 도착했어요 날이 뜨거운데 아직도 얼음이 얼어져있더라구요 협동조합 홍천찐빵과 단호박 쌀찐빵 10개씩 들어있어요 냉동보관하면... ,행복한 블로거,https://blog.naver.com/rkatkgody555,2021-08-19
아이들간식 호호 불어 먹는홍천 쌀찐빵맛있게 먹어요,https://blog.naver.com/j02nara?Redirect=Log&logNo=222507001108,아이들간식 호호 불어 먹는홍천 쌀찐빵맛있게 먹어요 안녕하세요 우리 가족 다 좋아하는 간식... 바로 주문 클릭 홍천찐빵은 방부제가 전혀 들어가지 않은 건강한 쌀찐빵 이에요 추워질 때 생각나는 호호..... ,ROMI DAILY ☺︎,https://blog.naver.com/j02nara,2021-09-15
 홍천찐빵모듬 찐빵맛있어요,https://blog.naver.com/codms823?Redirect=Log&logNo=222457550598,"있다는거~~ 홍천찐빵 모듬찐빵은 5가지 맛이 들어 있어서 골고루 맛볼 수 있답니다.홍천쌀찐빵 , 앙꼬없는 옥수수쌀찐빵, 쑥쌀찐빵 단호박쌀찐빵, 옥수수 찐빵 이 맞나? ㅋㅋ 5가지 맛을 즐길 수 있어서... ",채채맘♡♡,https://blog.naver.com/codms823,2021-08-05
용인수지맛집 홍천쌀찐빵- 생활의 달인에 소개된 맛집,https://blog.naver.com/blackwhiteandme?Redirect=Log&logNo=222151486613,# 홍천쌀찐빵수지에 살고 있는 사람들은 다 안다.홍천쌀찐빵 이 맛있다는 사실을. 오랜 시간 수지에서... 쌀찐빵도 빼놓을 수 없는 맛이다. 팥 알이 살아있고 달지 않다. 담백한 찐빵은 지금처럼 찬바람이 부는... ,하루풍경,https://blog.naver.com/blackwhiteandme,2020-11-22
생활의 달인에 나온 성복역홍천쌀찐빵 ,https://blog.naver.com/happyara135?Redirect=Log&logNo=222144282691,괜찮을거같당 줄 서서 먹다보니 기대치 상승된듯 사장님이 오전9시에 왔을때가 제일 널널하게 살 수 있다가 팁을 주심ㅋㅋㅋㅋㅋ #성복역만두맛집 #성복역찐빵맛집 #생활의달인찐빵 # 홍천쌀찐빵#골드프라자맛집,유주의 하우스,https://blog.naver.com/happyara135,2020-11-14
"성복동 생활의 찐빵,만두 달인홍천쌀찐빵 ",https://blog.naver.com/denny1771?Redirect=Log&logNo=222205212926,"# 홍천쌀찐빵#달인 #찐빵집 #만두집 안녕하세요. 오늘은 눈이 많이 오네요 지난번 처럼 너무 많이 와서 힘든일은 없었으면 합니다. 오늘은 성복동 생활의달인 찐빵,만두 달인홍천쌀찐빵 집 후기를 써보려합니다... ",Anna Rosa 님의블로그,https://blog.naver.com/denny1771,2021-01-12
 홍천쌀찐빵반죽의 폭신한... 은은한 단맛이 풍겨오는 ‘찐빵!’,https://blog.naver.com/73b?Redirect=Log&logNo=222514334735,반죽의 폭신한 식감과 팥의 은은한 단맛이 풍겨오는 ‘찐빵!’ 홍천쌀찐빵 2020.11.09 771회경기 용인시 수지구 성복2로 17 (성복동)분식031-276-8101 생활의 달인에서는 쌀쌀한 겨울에 저절로 찾게 되는... ,73b님의 블로그,https://blog.naver.com/73b,2021-09-23
생활의달인 용인시 찐빵 만두 달인 은둔식달홍천쌀찐빵 ,https://blog.naver.com/eueuy?Redirect=Log&logNo=222139740813,생활의달인 은둔식달-찐빵·만두 달인홍천쌀찐빵경기 용인시 수지구 성복2로 17 1. 은둔식달 - 찐빵·만두 달인 쌀쌀한 겨울 움츠러드는 몸에 절로 찾게 되는 따뜻한 먹거리. 호호 불어가며 먹는 맛이 있는... ,이랑이랑 맛집찾기,https://blog.naver.com/eueuy,2020-11-09
용인수지홍천쌀찐빵 ,https://blog.naver.com/songa0913?Redirect=Log&logNo=222150346149,만두4개에 찐빵1개 먹으니 배가 아주 든든해 나머지는 점심때 먹기로하고 킵.ㅎ 오전에 다 팔리면 오후3시부터 판매 시작한다고 하시니 드실 분들은 참고하시길. #달인 #찐빵 #맛집 # 홍천쌀찐빵#겨울간식,Hope for the best,https://blog.naver.com/songa0913,2020-11-21
홍천 맛집 겨울간식홍천쌀찐빵 ,https://blog.naver.com/hcgnews?Redirect=Log&logNo=220558813321,"주문전화:홍천쌀찐빵033-436-9090 주소: (홍천지역자활센터 찐빵사업단)강원도 홍천군 홍천읍 희망로... 모둠쌀찐빵도 있습니다. 종류가 다양하니, 맛보는 재미는 두배가 됩니다. 쌀, 단호박, 옥수수, 쑥을... ",홍천愛피었습니다,https://blog.naver.com/hcgnews,2015-12-04
수지맛집:: 만두랑 찐빵이 맛있는홍천쌀찐빵 !!,https://blog.naver.com/hello_karang?Redirect=Log&logNo=80195676737,고기만두인데도 안느끼하고 담백해서 울신랑은 김치만두보다 더 맛있다며 베리꺼를 다먹어버림-_- 수지맛집홍천쌀찐빵 의 찐빵!!!! 고등학교때 홍천찐빵 진짜 많이 먹었는데... 그때그맛이다 ㅠㅠㅠㅠㅠㅠㅠ... ,리플스_LIPLS Blog,https://blog.naver.com/hello_karang,2013-08-08
 홍천쌀찐빵 ,https://blog.naver.com/vivienle78?Redirect=Log&logNo=222258689619,1팩에 8개 적당히 맵고 속도 꽉찼다~~ 찐빵도 팥이 가득차있고 통팥도 섞여 있고 달지 않아 물리지 않고 밀가루냄새도 안 나고 속도 편하다~~ 사오길 잘 했다능~~ 스스로 칭찬!!! # 홍천쌀찐빵#생활의달인 #성복동,love is.....,https://blog.naver.com/vivienle78,2021-02-27
"[수지맛집]미가,훠궈-양고기, 홍천쌀찐빵 ,팥빙수",https://blog.naver.com/serim0228?Redirect=Log&logNo=100189648562,했지만 깔끔히 비웠어요 ㅋㅋ 그리고 옆으로 조금 더 가면 요즘 수지에서 핫한 찐빵집!!홍천쌀찐빵 . 여기 팥빙수를 먹으러 갔습니다. 저기 있는거 한번씩 다 먹어봤는데 다 맛있어요. 진짜 팥으로... ,❤️일상이 즐거운 워니맘,https://blog.naver.com/serim0228,2013-06-10
[ 홍천쌀 찐빵 ] 진정 명품 찐빵~^^*,https://blog.naver.com/kty1224ok?Redirect=Log&logNo=220327449207,카페 회원이신 밀알1004(남기봉 대표) 3년 가까이 청청지역 홍천쌀로 찐빵을 만들고 계신다. 신앙이... 담긴홍천쌀 찐빵 을 현재에 이르게 함이 아닐까 생각해 본다. 빠른 택배로 도착한홍천쌀 찐빵 ~ 유통상... ,Happy Tree,https://blog.naver.com/kty1224ok,2015-04-11
[용인] 수지홍천쌀찐빵 (만두팥빙수),https://blog.naver.com/hyojin8594?Redirect=Log&logNo=220017892263,오늘도 어김없이 만두와 찜빵이 쪄지는 찜통 가동중~ㅋㅋ 팥빙수만 먹으러 온건데 또 요걸보니 만두랑 찜빵도 먹고싶은 유혹이....하...우리 밥 먹었는데..ㅎㅎ 수지홍천쌀찐빵 집은 만두랑 찐빵을 직접 다... ,UHMKONG HOUSE,https://blog.naver.com/hyojin8594,2014-06-02
수지 간식홍천 쌀 찐빵김치만두 맛있엄!,https://blog.naver.com/mir7991?Redirect=Log&logNo=221607961019,홍천 찐빵을 알게 됨 그리고 담날 언니랑 바로 먹으러 감 ㅎㅎ 수지 만두는홍천 쌀 찐빵건물에 주차를 하고 맛있다는 김치만두를 먹으러 감! 여름인데도 땡김! 여기 팥이 맛있는지 팥빙수도 유명하다고 한다.... ,기억창고,https://blog.naver.com/mir7991,2019-08-06
" 쌀찐빵택배 , 우리쌀로 만든 아침식사대용홍천찐빵 ",https://blog.naver.com/sunmi3998?Redirect=Log&logNo=222421510186,협동조합 홍천찐빵 이렇게 검색하시면 제가 구매했던 사이트가 나오고 클릭을 하면 총 5가지의 쌀찐빵을 볼 수 있어요홍천쌀찐빵홍천옥수수쌀찐빵 앙꼬없는 옥수수쌀찐빵 홍천쑥쌀찐빵 단호박쌀찐빵... ,사랑도 만땅 행복도 만땅,https://blog.naver.com/sunmi3998,2021-07-05
생활의달인홍천쌀찐빵용인 맛집으로 인정! 만두랑 찐빵으로... ,https://blog.naver.com/zzarasay?Redirect=Log&logNo=222217073954,용인의 홍천쌀찐방과 만두를 먹어 보자고 했다. 누가? ㅎㅎ홍천쌀찐빵 집 앞에서 추위에 덜덜 떨면서 기다림 끝에 1인 한정판으로 구매한 찐빵과 김치만두 그리고 고기만두를 받아 들었다. 그리고 자동차로 냅다... ,Zzarasay Life,https://blog.naver.com/zzarasay,2021-01-23
수지 만두맛집 골드프라자홍천 쌀찐빵만두 -성복동-,https://blog.naver.com/jiniezi?Redirect=Log&logNo=221362965917,청주찐빵만두#수지 홍천쌀찐빵 #수지 홍천쌀찐빵 만두 #수지만두맛집#성복동만두맛집 #성복동홍천만두#골드프라자만두맛집 #수지홍천만두#성복동홍천만두 #수지맛집#성복동맛집,지니맛집,https://blog.naver.com/jiniezi,2018-09-20
 홍천 특산물홍천쌀 을 넣어서 만드는홍천 애 쌀찐빵홍천 여행,https://blog.daum.net/tourcodi/8129194,만드는홍천쌀찐빵전문점 홍천애쌀찐빵은 홍천쌀이 들어간 쌀찐빵 옥수수찐빵 단호박찐삥 쑥찐빵 앙꼬없는쌀찐빵 등을 직접 만들어 판매한다. 홍천명품 특산물 홍천쌀이 들어간 홍천애쌀찐빵은 쌀찐빵... ,강경원의 여행만들기,https://blog.daum.net/tourcodi,2017-06-24
 홍천 맛집 호호 불어먹는 든든한 먹거리쌀찐빵홍천 애 쌀찐빵 ... ,https://blog.daum.net/sso702/18298674,"고인돌오토캠핑장 , 만두와 찐빵 , 사계절 국민 간식 , 쌀찐빵 , 홍천 레포츠파크 , 홍천맛집 ,홍천쌀찐빵,홍천쌀찐빵전문점 , 홍천애쌀찐빵 , 홍천여행 홍천맛집 호호 불어먹는 든든한 먹거리 쌀찐빵... ",해피송의 행복한 여행과 테마,https://blog.daum.net/sso702,2017-09-01
