title,link,description,bloggername,bloggerlink,postdate
 홍천쌀찐빵생활의 달인 나온 후 일요일 방문기,https://blog.naver.com/ashacs1?Redirect=Log&logNo=222158515943,"ㅋㅋ홍천쌀찐빵3시 1분에 다시가보니 벌써 어마어마한 줄이 생겼고, (대략 40명 정도...) 저는 번호표를 가지고 당당하게 들어가서 바로 포장해서 나왔어요! 고기만두와 찐빵이 맛있었고, 쌀로 만든거라 더... ",[코리아에듀]▶️기업교육&컨설팅,https://blog.naver.com/ashacs1,2020-11-30
 쌀찐빵택배 ::홍천찐빵우리쌀로 만든 다섯가지 모듬 찐빵 ... ,https://blog.naver.com/teddy_86?Redirect=Log&logNo=222400758917,"만든 홍천 찐빵홍천쌀찐빵 은 냉동보관 제품인데요, 그렇다면 드실 때 해동(조리)을 해야겠죠? 방법은 총 네 가지가 있다고 합니다 찜기, 전자레인지, 밥솥, 후라이팬. 이 중 가장 쉬운 게 전자레인지네요 ㅋㅋ... ",하루종일 LaLaLa,https://blog.naver.com/teddy_86,2021-06-27
2020 생활의달인 10대 맛의 달인 용인홍천쌀찐빵 ,https://blog.naver.com/sniper98?Redirect=Log&logNo=222224624220,용인 생활의달인홍천쌀찐빵 의 메뉴는 이러합니다. 찐빵.만두라는 상호에서 알수 있듯이 찐빵과 만두를 판매하는데 보통 찐빵 그러면 밀가루반죽의 찐빵이 기본이지만 이곳에선 찹쌀을 주재료로 한 찐빵을... ,대구맛집블로거 맛소클짱 혁이의 맛여행,https://blog.naver.com/sniper98,2021-02-01
"생활의달인 은둔식달 찐빵 만두 달인, 용인맛집홍천쌀찐빵 ... ",https://blog.naver.com/dndbwodnjs?Redirect=Log&logNo=222180006882,"생활의 달인 찐빵, 만두 은둔식달 맛집 # 홍천쌀찐빵#생활의달인찐빵만두달인 #생활의달인찐빵달인 #생활의달인만두달인 #생활의달인찐빵 #생활의달인만두 방송 되기 전에도 용인 수지쪽에선 이미 유명한... ",지봉공쥬,https://blog.naver.com/dndbwodnjs,2020-12-20
용인홍천쌀찐빵 ,https://blog.naver.com/tmishaha?Redirect=Log&logNo=222139941653,"메뉴 고기만두(8개) 4.5 / 쌀찐빵(5개) 4.5 단호박찐빵(5개) 5 영업시간 매일 09:00 - 22:30 #생활의달인찐빵, # 홍천쌀찐빵 , #용인찐빵맛집, #수지찐빵맛집, #성복역만두달인, #용인만두맛집, #수지 홍천쌀찐빵 ... ",Amazing BLOG,https://blog.naver.com/tmishaha,2020-11-09
[ 쌀찐빵 ] 택배 맛집 협동조합홍천찐빵 ,https://blog.naver.com/sya76?Redirect=Log&logNo=222443793132,냉동실이 비워지면 가장 맛있게 먹은 옥수수살찐빵을 더 주문해야겠어요. #홍천찐빵 # 홍천쌀찐빵#쌀찐빵 #팥찐빵 #옥수수찐빵 #쑥찐빵 #단호박찐빵 #아이들간식 #택배맛집,행복해의 리뷰로 보는 세상,https://blog.naver.com/sya76,2021-07-24
 쌀찐빵어른 아이들간식으로 딱 좋아!ft.홍천찐빵 ,https://blog.naver.com/dldogml1?Redirect=Log&logNo=222460709050, 홍천쌀찐빵단호박쌀찐빵 앙꼬없는옥수수쌀찐빵 홍천옥수수쌀찐빵 홍천쑥쌀찐빵 홍천아로니아찐빵 까지 종류도 참 많죠? ㅎㅎㅎ 냉동실에 꺼내서 오늘은 어떤 찐방을 먹을까~하고 행복한 고민을 한답니다.... ,또치나라,https://blog.naver.com/dldogml1,2021-08-07
아이들간식홍천찐빵쌀찐빵 으로 챙겨요~,https://blog.naver.com/onelovee00?Redirect=Log&logNo=222481373898,쪄진홍천쌀찐빵 ~ 뜨거울때 호호불어가며 먹어야 제맛인 쌀찐빵! 가장 기본인 단팥소가 듬뿍 들어간 홍천찐빵 쌀찐빵이에요 달달한 단팥소가 너무 맛있더라구요 쑥향기가 솔솔 느껴지는 쑥쌀찐빵~ 달콤한... ,♡행복놀이터♡,https://blog.naver.com/onelovee00,2021-08-23
"아이들간식으로 딱 좋은쌀찐빵 , 협동조합홍천찐빵 ",https://blog.naver.com/sunset026?Redirect=Log&logNo=222506074148,:-) 오늘은 #협동조합 홍천찐빵을 소개해드리려 합니다.홍천찐빵10개 900g 2개를 주문했더니 이렇게 큰 비닐봉지에 담겨서 배송이 왔어요 !홍천찐빵 은 반죽-분할-성형-발효-찜-건조-포장의 과정으로 모두... ,벨라픽 뷰티리뷰 ෆ,https://blog.naver.com/sunset026,2021-09-15
용인 홍천쌀찐빵 만두[생활의달인찐달인]만두 사기 진짜... ,https://blog.naver.com/alsl2067519?Redirect=Log&logNo=222198365165,"찐빵은 다 팔아서 없다고 하네요ㅠ 찐빵 -솔드아웃-홍천쌀찐빵안뇽- 언젠가는 먹을 수 있겠죠 뭐. 만두는 사자마자 먹어야 맛 아닌가요~! 주차장 구석에서 한개만 먹어볼라고 했는데.. 김치만두랑,고기만두... ",설탕 쫌 다루는 여자,https://blog.naver.com/alsl2067519,2021-01-06
"정성껏 만든, 쫀득쫀득 너무 맛있는쌀찐빵협동조합홍천찐빵 ",https://blog.naver.com/namse-zone?Redirect=Log&logNo=222401169447,"간식, 어른들 간식으로 딱 이에요 #홍천찐빵 #찐빵맛집 #찐빵 #쌀찐빵 #모듬찐빵 #협동조합홍천찐빵 #아이들간식 #어른간식 #수제찐빵 # 홍천쌀찐빵맛있고, 건강한 영양간식 찾으신다면 아래 구매 링크 gogo ↓↓↓↓",나만의 놀이터:) 맛집공간 일상,https://blog.naver.com/namse-zone,2021-06-17
 홍천 쌀찐빵만두 성복역1년전 오늘,https://blog.naver.com/jiniezi?Redirect=Log&logNo=222486556028,수지에서 가장 인기많은 만두집 생활의달인 나오면서 그 인기가 Up up홍천쌀찐빵반반도 가능합니다... 저는 김치보단 고기파라~ 만두소 꽉찬 수지 만두홍천쌀찐빵 만두 여름엔 팥빙수도 파는데 꼭 한번... ,지니맛집,https://blog.naver.com/jiniezi,2021-08-28
"성복역 맛집, 코로나 시국에도 줄 서서 먹는홍천쌀찐빵 ",https://blog.naver.com/corn38?Redirect=Log&logNo=222266203484,"사실 처음에는 여기,,홍천쌀찐빵집이니까 찐빵 (호빵)과 찐빵만두 만 사왔었거든요~~ 근데 찐빵만두 먹고, 만두소가 넘 맛있길래 일반 만두도 맛있을 것 같아서 두 번째 갔을 땐 일반 고기만두도 사와봤어요.... ",따뜻한 계절 ⓒ물탕로그 since 2015.08,https://blog.naver.com/corn38,2021-04-04
 홍천쌀찐빵수지 성복역 맛집 속이 가득 찬 만두,https://blog.naver.com/fordahye?Redirect=Log&logNo=222377166254,김치만두를 더 좋아하지만홍천쌀찐빵 만두는 고기만두가 더 맛있는 듯! 만두피는 야들야들 속은 가득한 수지 성복역 수제 만두 맛집. 다음에는 찐빵도 한 번 사 먹어 볼까 봐요. #수지맛집 #용인수지맛집... ,콩주머니의 블로그,https://blog.naver.com/fordahye,2021-05-31
용인 수지 성복역 “ 홍천 쌀찐빵 ” - tv출연한 찐빵만두... ,https://blog.naver.com/lyjyjyj92?Redirect=Log&logNo=222475194556,# 홍천쌀찐빵#용인수지만두 #용인수지찐빵 #용인만두 #용인찐빵 #수지만두 #수지찐빵 #용인맛집 #수지맛집 #성복역맛집 #생활의달인출연 #생활의달인출연한집 # 홍천쌀찐빵 가격 # 홍천쌀찐빵 주차,베짱이 백수,https://blog.naver.com/lyjyjyj92,2021-08-18
용인홍천쌀찐빵생활의 달인 은둔식달,https://blog.naver.com/himinjeong?Redirect=Log&logNo=222200645030,"섭외한 찐빵이라니 더 맛있어 보였다. 11월에 다녀왔던 용인 ' 홍천쌀찐빵 ' 시식 후기다. 식당은... 주문 가능한 메뉴는 쌀 찐빵(1인 5개 주문 가능), 고기 만두, 김치 만두였다. 단호박 찐빵은 현재는 만들지... ",himinjeong님의블로그,https://blog.naver.com/himinjeong,2021-01-08
"용인 수지구 맛집 생활의달인 찐빵 만두 달인,홍천쌀찐빵 ",https://blog.naver.com/day265?Redirect=Log&logNo=222223432859,"용인 수지구 맛집 생활의달인 찐빵 만두 달인,홍천쌀찐빵용인 수지구 맛집 찐빵 만두 달인이 만든 것 먹어보기 Copyright 2021. 쵸묵쵸묵 어흥이. All rights reserved. 어딘가 뒤져보면 뿌가 여기라고 사진을 준게... ",쵸묵쵸묵 어흥이,https://blog.naver.com/day265,2021-01-28
용인 만두홍천쌀찐빵생활의 달인에도 나옴!,https://blog.naver.com/ssomerry?Redirect=Log&logNo=222195009053, 홍천쌀찐빵 의 찐빵 만드는 모습! 반죽도 어찌나 잘하셨던지 저렇게 반죽들이 쌓여져있어도 달라붙지 않았으며 속도 가득 꾹꾹 담아 넣으시더군. 생활의 달인에 나온 그대로 찐빵을 만들고 계셨다. 저 많은 걸... ,ssomerry,https://blog.naver.com/ssomerry,2021-01-03
아이들간식 협동조합홍천찐빵 홍천 쌀로 만든홍천쌀찐빵20개입,https://blog.naver.com/icecreamjht?Redirect=Log&logNo=222362358318,"협동조합홍천찐빵 홍천 쌀로 만든홍천쌀찐빵찐빵, 쌀찐빵, 강원도홍천, 홍천쌀, 홍천찐빵,홍천쌀찐빵 , 찐빵추천, 아이들간식, 영양간식 홍천의유명한, 따뜻한찐빵, 어르신간식, 어린이간식, 김장간식, 홍천... ",요술쟁이!!! 양탄자 타고~~,https://blog.naver.com/icecreamjht,2021-05-23
아이들 간식 추천 ::: 우리쌀로 만든홍천수제쌀찐빵 ,https://blog.naver.com/nu_ribest?Redirect=Log&logNo=222507035563,"적혀있는데홍천쌀찐빵 , 단호박쌀찐빵, 쑥쌀찐빵 앙꼬 없는 옥수수쌀찐빵, 옥수수쌀찐빵 이렇게... 안좋아하는편인데 홍천찐빵은 달지 않고 맛있어요 쑥을 좋아해서 여러가지 맛 중에 궁금했는데 쑥 향이... ",세상을 누리다♥,https://blog.naver.com/nu_ribest,2021-09-16
찐빵 찌는법 / 찜기에홍천쌀찐빵찌기,https://blog.naver.com/haesoo7666?Redirect=Log&logNo=222509312725,#찐빵찌는법 #찐빵찌기 #찐빵찜기 # 홍천쌀찐빵요새 날도 슬슬 선선해지면서 집에서 먹을 수 있는 간단한 간식이 뭐가 있을까 생각하다가 뜨끈한 찐빵이 생각나서 협동조합 홍천찐빵에서홍천쌀찐빵 을 맛별로... ,해피수마일v,https://blog.naver.com/haesoo7666,2021-09-17
[ 홍천쌀찐빵 ] 용인수지 찐빵 만두 맛집 추천,https://blog.naver.com/owolf73?Redirect=Log&logNo=222209844021,맛있어서요 ㅎㅎㅎ 그리고 너무 많이 사왔거든요 ^^ 따끈한 찐빵과 만두가 생각나실땐 추천할 만한 맛집입니다.홍천쌀찐빵 ! 계속 번창하시고 맛있는 음식 만들어 주세요~,헨다이버,https://blog.naver.com/owolf73,2021-01-17
식사대용 간식 맛과 영양 모두 잡은쌀찐빵홍천찐빵 ... ,https://blog.naver.com/yavis818?Redirect=Log&logNo=222475030839,색의홍천쌀찐빵~ 팥앙금이 너무 과하게 달지 않으면서 은은한 단맛이라 어르신들도 좋아할 것 같음. 나도 너무 단건 싫어해서 취향저격 ! 홍천옥수수쌀찐빵은 기본보다 아주 살짝 더 노란 빛을 띈다. 거의... ,BLUEMING ✿,https://blog.naver.com/yavis818,2021-08-18
"놓치면 후회하는 수지 성복역 찐빵,만두 맛집_홍천쌀찐빵만두",https://blog.naver.com/wwkbe?Redirect=Log&logNo=222535799088,같아요홍천 쌀찐빵매일 9:00-22:30 월요일 휴무 •경기도 용인시 수지구 성복동 33-1 성복역 3번... 만두와 찐빵을 만들고 있어요 찐빵이 맛있다던대 저희는 배고팠던지라 왕만두- 1 김치만두- 1 총 9500₩ 포장... ,잼있는갱우네,https://blog.naver.com/wwkbe,2021-10-13
"맛집 생활의 달인 2020년 10대 맛의 달인홍천 쌀찐빵 ,만두",https://blog.naver.com/oeokeom?Redirect=Log&logNo=222369726744,"별다른거 없이 그냥 흔하게 볼 수 있는 찐빵집인데요~ 코로나로 인해 홀에선 손님을 받지 않는거 같아 보였어요~ 성복역 맛집홍천쌀찐빵 , 찐빵의 자태입니다 몰라봐서 미안할 정도로 유명한 찐빵을 보고만... ",기흥역심쿵이,https://blog.naver.com/oeokeom,2021-05-27
[용인수지/성복역] 생활의 달인에 나온홍천쌀찐빵포장하기,https://blog.naver.com/lo98765432lo?Redirect=Log&logNo=222196076592,"가게 이름이홍천쌀찐빵 이니, 찐빵이 아마 가장 유명한 거겠지. 그래서 마지막 피날레로 남겨뒀다. 팥이 꽉 차 있다. 지난번에 가메골 손왕만두에서 샀던 찐빵과 거의 흡사해 보인다. 찐빵피의 쫀득거림... ",만년김돼리의 돼지런한 기행,https://blog.naver.com/lo98765432lo,2021-01-04
 홍천 쌀찐빵만두 성복역,https://blog.naver.com/jiniezi?Redirect=Log&logNo=222073424174,다 아는 성복역에 있는홍천 쌀찐 빵 만두 누구는 찐빵이 누구는 만두가 맛있다고 하지만 저는 이 집 팥빙수가 1등요~ # 홍천쌀찐빵#수지팥빙수 #팥빙수맛집 #만두맛집 #성복역맛집 #홍천만두 #홍천찐빵 #수지롯데몰,지니맛집,https://blog.naver.com/jiniezi,2020-08-28
[용인 수지 찐빵 만두/ 홍천 쌀 찐빵 ],https://blog.naver.com/gukjung?Redirect=Log&logNo=222180858812,그러도 한해는 마무리해야겠기에 올해가 가기전에 생활의 달인에 나온 맛집은 가능한 방문해보고자 올 11월에 방영된 용인 수지 찐빵 만두의 달인 맛집홍천 쌀 찐빵식당을 방문합니다..!! 주 소 : 경기도... ,청석골 임꺽정의 블로그,https://blog.naver.com/gukjung,2020-12-21
 홍천찐빵아이들간식쌀찐빵맛있어요,https://blog.naver.com/zla6923?Redirect=Log&logNo=222477673033,싶으신분들이라면 냉동실에 쟁여놓으시면 아주 좋을거같아요 저렴한 가격으로 맛있는 찐빵 만나보세요! #홍천찐빵 # 홍천쌀찐빵#아이들간식 #모듬찐빵 #식사대용 #간단한아침 #아이간식 #쌀찐빵 #찐빵쇼핑몰,조아몽,https://blog.naver.com/zla6923,2021-08-20
용인 달인 찐빵 / 줄서서 먹어도 아깝지 않은홍천쌀찐빵 ,https://blog.naver.com/bsy3077?Redirect=Log&logNo=222157747040,"용인찐빵홍천쌀찐빵안녕하세요? 꿀팁마녀입니다. 제 남편은 생활의달인 매니아랍니다. 그 중에서도 찐빵,만두 매니아! 티비에 나오기만 하면 가보고 싶어해서 11월 9일에 방송되자마자 그 주에 방문을... ",꿀팁방출,https://blog.naver.com/bsy3077,2020-11-29
20201121_용인 수지홍천 쌀찐빵만두,https://blog.naver.com/b13700kr?Redirect=Log&logNo=222167555914,집이란다찐빵 도 맛있고 만두도 맛있다고 점심 장소 검색할 때 얼핏 봤던찐빵가게 기억이 났다 이렇게 근처에 있었다나! 처음엔 그냥 갈까 하다가 맛이나 보자면서 줄을 섰다 앞에 한 20~30팀 있어 보였는데... ,두 놈들과의 소중한 기억을 위해,https://blog.naver.com/b13700kr,2020-12-09
로흐+로또휴게실+ 홍천쌀찐빵 +더크로아상랩+배떡 로제떡볶이,https://blog.naver.com/mogura81?Redirect=Log&logNo=222151859711,로또 명당 투어라도 다녀야하나 ^^ 퇴근길에 남편 간식거리 사러 들른 만두찐빵집... 근데 얼마 전에 생활의 달인에 나오는 바람에 인기가 엄청나졌다. @홍천쌀찐빵얼마 만에 다시 하는 봉사야??? 8개월 만에... ,추억은 방울방울,https://blog.naver.com/mogura81,2020-11-23
수지 성복동 맛집 / 생활의달인 맛집＊ 홍천쌀찐빵 ＊찐빵... ,https://blog.naver.com/jyrabbit?Redirect=Log&logNo=222270712555, 홍천쌀찐빵메뉴 우린 고기만두 1인분 김치만두 1인분이랑 왕만두 1개 쌀찐빵 5개 주문! #용기내 #용기내챌린지 통 들고 있는 내 손ㅋㅋㅋㅋㅋ 나름 큰 통 챙겨왔는데 찐빵은 뚜껑이 안닫혀서 열고... ,순수소녀의 먹고 읽고 지구를 사랑하라ღ,https://blog.naver.com/jyrabbit,2021-03-10
아이들간식 어른들간식홍천수제쌀찐빵: 다양해서 좋아요,https://blog.naver.com/chssha86?Redirect=Log&logNo=222415554979," 홍천찐빵 은 2개월 마다 자가품질검사를 거쳐~ 안심하고 먹어도 괜찮다고 해요! 저는..빵 먹기 전에 밥솥에 넣어 놓고 20분 정도 있다가 먹으면 골고루 잘 익어서 좋더군요! 에어프라이기나, 다른 찜기로 따로... ",다니엘 블로그,https://blog.naver.com/chssha86,2021-06-30
 홍천수제쌀찐빵추억가득 아이들간식 5가지맛 찐빵 ,https://blog.naver.com/tututuu?Redirect=Log&logNo=222476223250,만들었어요 홍천 수제 쌀찐빵은 5가지맛을 가지고 있는데요홍천쌀찐빵단호박쌀찐빵 쑥쌀찐빵 옥수수쌀찐빵 앙꼬없는옥수수찐빵 이렇게 5가지에요 ❤ 가족 중에 팥을 즐기지 않는 분이 있더라도 모두 함께... ,♥행복하고 신나게♥,https://blog.naver.com/tututuu,2021-08-19
 홍천쌀찐빵생활의달인 겨울간식 용인만두찐빵,https://blog.naver.com/seagood83?Redirect=Log&logNo=222227322098,돌릴때 찐빵 위에 물 살짝 뿌려서 랩 씌워 약 2분 정도 돌리면 바로 사서 먹는맛 든든하네요♡ 생활의 달인 용인맛집홍천쌀찐빵 •만두 자알 먹었습니다^^ 근처 지나치실때 맛보시길 한번 꾸욱 추천드려요... ,팡교로드의 꿀맛 월드,https://blog.naver.com/seagood83,2021-02-01
수지 성복동홍천쌀찐빵요즘 너무너무 유명해졌죠!!,https://blog.naver.com/mcmlx20?Redirect=Log&logNo=222252191042,"읽어주셔서 감사합니다^^ 공감,댓글은 너어무 감사합니다♡ # 홍천쌀찐빵#수지찐빵 #수지만두 #수지찐빵맛집 #성복동 홍천쌀찐빵#찐빵맛집 #만두맛집 #만인의맛집 #허세스코 #조아쓰조아쓰조아쓰",대전과 수지사이,https://blog.naver.com/mcmlx20,2021-02-22
아이들간식 추천홍천수제쌀찐빵부모님 할머니 취향저격... ,https://blog.naver.com/daigijoy123?Redirect=Log&logNo=222445352586,"홍천찐빵 쌀찐빵 세트 상품은홍천쌀찐빵 , 단호박쌀찐빵, 홍천옥수수쌀찐빵 홍천쑥쌀찐빵, 앙꼬없는옥수수쌀찐빵 5가지 맛으로 구성되어 있어요~ 저는 전부 팥만 들어간 제품일 줄 알았는데 팥 없는 제품도... ",소소하게 힐링하는 짱구네,https://blog.naver.com/daigijoy123,2021-07-25
 쌀찐빵 은홍천찐빵아이들 어른들 간식으로 좋아요,https://blog.naver.com/qazwe789?Redirect=Log&logNo=222434836601,몸에 건강한 간식거리 찾고 계신다면 호다닥 주문해보세요 #홍천찐빵 #홍천수제쌀찐빵 #수제찐빵 #수제쌀찐빵 # 홍천쌀찐빵#단호박쌀찐빵 #홍천옥수수쌀찐빵 #홍천쑥쌀찐빵 #앙꼬없는옥수수쌀찐빵 #스마트스토어,슬기로운 생활,https://blog.naver.com/qazwe789,2021-07-18
"[용인수지맛집/생활의달인] 찐빵과 만두 다 맛있는,홍천쌀찐빵 ",https://blog.naver.com/anfrhrltmfrl?Redirect=Log&logNo=222144741482,밤에 티비 보다가 11월 9일 방영된 생활의달인 재방송 보다가 나온 찐빵집이 또잉? 동네 근처잖아? 하구 오픈시간 맞춰서 간홍천쌀찐빵(●’◡’●)ﾉ 생활의달인 보구 찾아가본적이 거의 없었는데 자기 전... ,ෆ퐁이로운 슬기생활ෆ,https://blog.naver.com/anfrhrltmfrl,2020-11-15
수지홍천쌀찐빵솔직후기,https://blog.naver.com/heekyongshin?Redirect=Log&logNo=222188055715,핫하다는홍천쌀찐빵 을 방문했다. 롯데몰 수지점 바로 건너편이다. 인기가 많아서 줄 서서 기다려야 한다. 앞에 20명 정도 있어서 40분 기다렸다. 외관부터 맛집의 향기가 난다. 메뉴와 가격표다. 찐빵과... ,두리's blog,https://blog.naver.com/heekyongshin,2020-12-28
생활의 달인 용인 찐빵 만두 달인홍천쌀찐빵김치 만두 고기... ,https://blog.naver.com/ooo5666?Redirect=Log&logNo=222144567818,고기 만두 8개 4500원 김치 만두 8개 4500원 왕 만두 5개 5000원 쌀 찐빵 5개 4500원 단호박 찐빵 5개 5000원... 생활의 달인 용인 찐빵 만두 달인에서 방송되었던 용인홍천쌀 찐빵비주얼이다. 찐빵 역시 따뜻할때 호호... ,YES,https://blog.naver.com/ooo5666,2020-11-15
달인 보고 방문했던홍천쌀찐빵 ,https://blog.naver.com/ironicman?Redirect=Log&logNo=222186823365,생활의달인 보고 계시는데 찐빨 드시고 싶다고 하시더라구요 용인 수지에홍천쌀찐빵보고... 차타고 1시간 가서 30분 기달려서 샀어요 인당 제한 있어요 찐빵1인분 만두는.2인분씩까지만 구매 가능해요 입구에... ,씽씽월드,https://blog.naver.com/ironicman,2020-12-27
생활의달인홍천쌀찐빵먹어봤어요!,https://blog.naver.com/dpdlf1027?Redirect=Log&logNo=222200932064,"생활의달인홍천쌀찐빵 이 원래도 유명했는데 방송에 나오고나서 더 유명해졌다고해요. 엄마께서도 구매하실 때, 한시간 이상 줄을 서있었다고;; 엄마 덕분에 맛있는 찐빵과 만두를 먹을 수 있었어요 엄마... ",소소하게 재미있게,https://blog.naver.com/dpdlf1027,2021-01-08
생활의달인 용인 찐빵 만두 -홍천쌀찐빵 ,https://blog.naver.com/sw20woo?Redirect=Log&logNo=222139682038,"이번 생활의달인 에서 찾아간 곳은 용인 찐빵 만두로 유명한홍천쌀찐빵가게 입니다 쌀쌀한 겨울에... 위해서 홍천살찐빵을 찾는 분들도 계시대요 콩고물이 묻어 있는 쑥떡에 맛있기로 소문난 팥, 우유 얼음까지... ",은밀한 칩거생활,https://blog.naver.com/sw20woo,2020-11-09
수지 성복역홍천쌀찐빵내돈내산 솔직 후기,https://blog.naver.com/sujung353?Redirect=Log&logNo=222511322570," 홍천쌀찐빵메뉴로는, 고기만두 - 4,500원 (8개) 김치만두 - 4,500원 (8개) 왕만두 - 5,000원 (5개) 쌀찐빵 - 4,500원 (5개) 단호박찐빵 - 5,000원 (5개) 눈꽃팥빙수 - 5,000원 단골로써 구매 꿀팁을 적어보면,홍천쌀찐빵 의... ",알콩달콩 알콩이네,https://blog.naver.com/sujung353,2021-09-20
생활의달인 찐빵 만두 용인홍천쌀찐빵 ,https://blog.naver.com/slipur?Redirect=Log&logNo=222140707390,생활의달인 찐빵 만두 용인홍천쌀찐빵용인홍천쌀찐빵만두달인! SBS 생활의달인 771회차 첫번째 은둔식달에서는 경기도 용인시 수지구에 위치한홍천쌀찐빵만두 백수민 달인이 소개되었다 이 외에도... ,에바그린님의 블로그,https://blog.naver.com/slipur,2020-11-10
 찐빵좋아하시는 분들 모이세요! 홍천수제쌀찐빵 ❤️,https://blog.naver.com/fkalswl12345?Redirect=Log&logNo=222437634136,"ㅎㅎ홍천쌀찐빵 , 단호박쌀찐빵, 홍천옥수수쌀찐빵, 홍천쑥쌀찐빵, 앙꼬없는옥수수쌀찐빵 이에용 무색소 무방부제로 색소가 아닌 쑥가루, 단호박가루, 옥수수가루로 만들어졌당 보관시 냉동 보관!!! 더우니까... ",소소한 행복을 찾는일상,https://blog.naver.com/fkalswl12345,2021-07-19
생활의 달인 찐빵 만두 달인홍천쌀찐빵알아보아요,https://blog.naver.com/songmin333?Redirect=Log&logNo=222140457510,"찐빵 만두 달인 생활의 달인 찐빵 만두 달인 은둔식달홍천쌀찐빵맛집 - SBS 생활의 달인 찐빵 만두의... 맛집홍천쌀찐빵위치, 주소, 가격, 전화번호, 주차, 택배, 영업시간 상세정보 여기! 가게 상호명 홍천... ",다홈 송팀장,https://blog.naver.com/songmin333,2020-11-10
"생활의 달인 - 용인 맛집, 성복동홍천쌀찐빵 ",https://blog.naver.com/kobawoo9?Redirect=Log&logNo=222273756744,"성복동홍천쌀찐빵 , 팥 알갱이가 살아있어 식감 훌륭하고 과하게 달지않은 단맛이 좋은 팥소도 훌륭하고 팥소와의 조화가 좋은 경쾌하게 쫄깃 쫀득한 피도 훌륭한 쌀 찐빵과 역시 피와 소 모두 좋은 만두, 특히... ",독립출판사 북엔드,https://blog.naver.com/kobawoo9,2021-03-13
[용인맛집]생활의달인에 나온 찐빵달인. 수지 맛집 ' 홍천쌀찐빵 ',https://blog.naver.com/wldrk09?Redirect=Log&logNo=222198866996,본가에 가서 어무니랑 같이 쪄먹었지용 팥까지 직접 만든다는 용인맛집홍천쌀찐빵확실히 다른곳보다 팥소가 덜달아서 더 술술 넘어가는게 있어요~ 팥 본연의 맛이 더 잘 나네요.홍천쌀찐빵 은 찐빵 맛집이군여.,즐겁지 아니한가,https://blog.naver.com/wldrk09,2021-01-06
"(성복,수지)홍천 쌀 찐빵만두",https://blog.naver.com/sallyparkhs?Redirect=Log&logNo=222157261649,고기 만두는 뭐 원래 좋아했으니까 입아파 두 말하면 잔소리 홍천에 스승님께 배운 제자분께서 가게를... ㅜㅜ #개존맛 #만두 #만두맛집 #찐빵맛집 # 홍천쌀찐빵#용인맛집 #수지맛집 #성복동맛집 #개존맛집... ,생각낙서장,https://blog.naver.com/sallyparkhs,2020-11-28
생활의 달인 만두 수지 성복역 맛집홍천쌀찐빵솔직후기 위치... ,https://blog.naver.com/codihaja?Redirect=Log&logNo=222140110081,생활의 달인 찐빵 맛집홍천쌀찐빵위치는 홍천이 아니에요 X 경기도 용인시 수지구 성복동(성복2로) 성복역 3번 출구 근처에 위치해 있어요. 꼭 가보세요 ^^ https://blog.naver.com/codihaja/222130009948 https://blog.naver.... ,릴리의생생리뷰통~♡,https://blog.naver.com/codihaja,2020-11-11
아이들간식으로 좋아홍천찐빵쌀찐빵 ,https://blog.naver.com/daldalxoxo?Redirect=Log&logNo=222444370981,아이들 간식으로도 좋고 전자레인지로 간편하게 데워먹어도 갓만든 찐빵처럼 맛있게 먹을 수 있는홍천쌀찐빵우리가족 건강간식으로 쟁여둬요! #홍천찐빵 #찐빵 #호빵 #쌀찐빵 #아이들간식 #아이간식 #간식,"달달키친, 둘 아닌 넷❤",https://blog.naver.com/daldalxoxo,2021-07-24
