title,link,description,bloggername,bloggerlink,postdate
을지로투어4차 [ 황평집 ],https://blog.naver.com/ulianof?Redirect=Log&logNo=221618160515,"이룬다는황평집밤 10시까지 운영한다고 했습니다 닭찜 한개 주문 빨뚜는 몇병째더라? 4차니께 4병째였는지,,,ㅋ 이게 언제부터 유래되었는지 몰라도 닭곰탕집에는 필수로 있더군요 ㅎ 정갈~~~하게 닭찜을... ",빨대의 마시는 행복,https://blog.naver.com/ulianof,2019-08-16
"을지로, [ 황평집 ] - 이것이 닭곰탕이다! 전설편",https://blog.naver.com/jhj881111?Redirect=Log&logNo=221361663152,전부터황평집닭곰탕과 닭무침이 그렇게 대단하다는 소문은 익히 들어 잘 알고 있었습니다. [평래옥]의 닭무침도 참 맛있는데 그거보다 역시 닭은황평집 이 한 수 위다...하는 얘기도 들은 바... ,DD's territory,https://blog.naver.com/jhj881111,2018-09-19
[을지로4가 맛집]황평집- 50년 전통 새콤달콤 닭무침과 진국... ,https://blog.naver.com/sielle83?Redirect=Log&logNo=221054866136, 황평집/ 중구 마른내로 74 (인현동2가 135-13) 전화번호 02-2266-6875 영업시간 09:30 - 22:00 일요일/명절 휴무... 전문점황평집 원조 사장님께서 황해도와 평안도 출신이셔서황평집 이란다20여년 전부터 지금... ,여의도 직장인 문썬의 밥상 (舊 을지로),https://blog.naver.com/sielle83,2017-07-24
#충무로/을지로맛집황평집닭찜 담백의 끝판왕!,https://blog.naver.com/kangsy0203?Redirect=Log&logNo=221293543979,"을지로/충무로 맛집황평집닭요리는 여기가 진리! #맛있는녀석들닭곰탕 으로 유명한 #을지로맛집 #충무로맛집 # 황평집다녀왔습니다용♡ 요기는 닭곰탕,닭찜,닭무침등으로 유명한맛집이래여~ 저도... ",떵이의 오즈나라,https://blog.naver.com/kangsy0203,2018-06-07
[을지로 맛집]황평집- 아재와 닭은 뗄 수 없는 궁합,https://blog.naver.com/bitterpan?Redirect=Log&logNo=220917007218, 황평집 . 황해도의 '황'과 평안도의 '평'에서 따온 상호. 입구는 두군데. 이쪽 입구를 보면 그냥 가게네... 저도 이제 이런 집 들어와도 전혀 어색하지 않은 나이가 되었습니다. 닭찜을 시키면 국물이 좀... ,비터팬의 식도락,https://blog.naver.com/bitterpan,2017-01-24
중구/인현동2가 -황평집 ,https://blog.naver.com/disse77?Redirect=Log&logNo=221436367860,'황평집' 지번 주소 : 서울특별시 중구 인현동2가 135-13 도로명 주소 : 서울특별시 중구 마른내로 74 TEL... 오랜만에황평집 에 방문.산수갑산에 순댓국 먹으러 갔으나 지정된 휴식 시간도 아닌데 쉬는 시간이라고... ,강(가람)처럼 푸르게... 그리고 슬기롭게...,https://blog.naver.com/disse77,2019-01-07
충무로 강추 맛집 탐방! 닭찜먹으로황평집 ,https://blog.naver.com/sohello?Redirect=Log&logNo=221163146356,"술이 드러간다 쭉쭉쭉쭉 ~황평집좋아! 요번에 충무로 한번 가보고 나서는, 충무로 종종 방문해줘야... 근데황평집가는길 왜이렇게 무서운가요?? 지도에서 보시다시피.. 상가 재정비촉진지구 ㅋㅋㅋ 거기에... ",: 탐구생활 :,https://blog.naver.com/sohello,2017-12-14
충무로 맛집 - 복날 닭전골이 맛있는 ' 황평집 ',https://blog.naver.com/noroo6?Redirect=Log&logNo=220064754130,충무로 맛집 복날 닭전골이 맛있는 ' 황평집 ' 오늘 초복!!!! 내가 좋아하는 복날! 복날이 되면 꼭... 어제 다녀온 충무로에서 맛집으로 유명한 ' 황평집 '의 닭전골을 포스팅할꼬얏! 헉....외관 사진을....내가... ,꽃우주의 꽃피는 이야기,https://blog.naver.com/noroo6,2014-07-18
을지로 맛집 /황평집 (닭곰탕의 계절),https://blog.naver.com/jaedolls?Redirect=Log&logNo=221138230232,- 을지로 맛집 /황평집 (닭곰탕의 계절) - 대구에선 보기 힘들지만 서울에선 쉽게 볼 수 있는 음식 중에... 명가인황평집 을 찾았다.황평집 이 을지로 맛집으로 이름을 떨치는 데에는 저렴한 가격도 한몫 단단히... ,짱똘아빠의 전국맛집들,https://blog.naver.com/jaedolls,2017-11-13
충무로 닭곰탕전문황평집 . 자신감이 돋보이는 닭무침,https://blog.naver.com/spring5867?Redirect=Log&logNo=221190729014,요즘 유행하는 네온사인의 시초가 바로황평집아니겠어요? 이 집 인테리어의 완성.. 새빨간 네온사인이 발을 저절로 이 안으로 이끌게 합니다. 원래 닭을 좋아해서 여기서 하는 메뉴 전부 제 취향입니다.... ,■봄이 미식회■,https://blog.naver.com/spring5867,2018-01-22
닭찜과 닭무침 명가 - 을지로황평집 ,https://blog.naver.com/mercyblu?Redirect=Log&logNo=220953718082,"밖에 써있기로는 40년이지만 실제로는 50년이 넘은 을지로의 노포,황평집 . 점심에는 식사로 나오는... 닭 매니아로서황평집 같은 곳이 있어줘서 얼마나 고맙고 기분좋던지. 닭찜은 정말 최고. ☎ 02-2266-6875... ",머시블루's Happy Nation,https://blog.naver.com/mercyblu,2017-03-09
서울 충무로 인현동황평집 ,https://blog.naver.com/cmykhc?Redirect=Log&logNo=20208348467,충무로 근처에 위치한 닭곰탕 전문점황평집부산할매집서 나와 2차로 들른 곳은황평집 입니다. 40년이... 곰탕 국물을 인당 한그릇씩 내주시네요 ~ 이 집 닭곰탕 ~ 담백하니 아주 맛있습니다 ^^ 닭무침.. 미리... ,나의 식유기,https://blog.naver.com/cmykhc,2014-04-07
을지로 맛집 충무로황평집닭곰탕 점심 맛집 닭무침,https://blog.naver.com/sajapyung?Redirect=Log&logNo=221138370989,소문난황평집 을 다녀왔습니다. 식당 외부부터 '맛집입니다'란 걸 말해주듯 옛날 느낌 물씬나구요. 충무로역 8번 출구에서 가까운 거리 서울 인현동 충무로황평집두 가게를 이어 붙여서 출입문이 두 개에다... ,맛있는 건 언제나 옳아,https://blog.naver.com/sajapyung,2017-11-12
인현동 /황평집 ,https://blog.naver.com/begopa1092?Redirect=Log&logNo=220214474651,낮에는 처음 들러본황평집인현동에 있는데 다소 생소한 지역명이지만 충무로 뒷편 한때 성인나이트로 유명했던 PJ호텔 건너편쯤 위치 반도카메라에 여러번 다닐때 겸사겸사 출출해서 들렀던..... ,eye of the beholder,https://blog.naver.com/begopa1092,2014-12-19
[맛있는 녀석들 맛집] 을지로황평집- 닭곰탕을 먹다,https://blog.naver.com/huk2lover?Redirect=Log&logNo=220964070447,"을지로맛집이며 TV 프로그램 '맛있는 녀석들'에도 나왔다는 곳, 을지로황평집 에서 저녁식사로 닭곰탕을 먹었던 이야기입니다. 특별한 건 없지만 나름 유명유명한 집이라니 간단 포스팅을 해보죠.황평집 ... ",택시's Story,https://blog.naver.com/huk2lover,2017-03-22
충무로 맛집 / 오래된 닭찜 닭곰탕 닭무침황평집 ,https://blog.naver.com/phjsunflower?Redirect=Log&logNo=220344297339,"충무로 맛집 / 닭백숙 닭곰탕 닭무침황평집닭백숙은 말그대로 끓은물에 삶은 후 건져올린 담백한... 바로황평집충무로 맛집 이라는 정평까지 나있지만, 한번도 못가본터라 (사실 술을 못해서 가기 조금... ",꽃씨의 맛집 이야기♬,https://blog.naver.com/phjsunflower,2015-05-28
[ 황평집 ] 을지로 - 닭으로 만든 맛있는 안주거리,https://blog.naver.com/mardukas?Redirect=Log&logNo=220881636795,"을지로에서 술로 꽐라가 되어가다 마지막에 딱 한잔 더하러황평집 을 찾았습니다. 닭곰탕으로 유명한 곳인데 갖은 안주거리가 좋다고 하더군요.. 을지로 3가, 을지로 4가, 충무로역의 삼각형에서 정... ","먹자, 마시자, 놀러 다니자",https://blog.naver.com/mardukas,2017-01-15
[충무로/을지로]황평집- 닭 전문점,http://hsong.egloos.com/3556487,'석산정'에서 나와 2차로 찾은 ' 황평집 ' 개인적으로 매우 기념비적인 곳이네요. 한 달 사이에 무려 네 번 방문이라니!!!!! 예전에 성민은 1주일에 4번도 갔지만... [충무로/을지로]황평집- 닭찜 http://hsong.... ,녹두장군의 식도락,http://hsong.egloos.com/,2016-12-22
[인현동]황평집 ,https://blog.naver.com/songju80?Redirect=Log&logNo=220553459718,"[인현동]황평집중구 PJ호텔 맞은편에 위치하고 있는황평집40년 원조집이라고 써있는데, 50년 이상된 노포로 알고 있다. 사진에서 알 수 있듯 , 들어가면 살아나오지 못할것 같은 분위기 불을 보고 뛰어드는... ",♪~만추의 세상 이야기,https://blog.naver.com/songju80,2015-12-01
 황평집충무로 닭곰탕 깔끔한 국물 한그릇,https://blog.naver.com/643173?Redirect=Log&logNo=220984795851," 황평집원래주인 부부가 황해도,평안도 출신이어서, 상호가황평집이라고 하네요. 30년 가까이 경영하시고, 지금주인도 20년 되었다네요. 닭곰탕 맛집 을지로 충무로 노포맛집 오래되고 유명한 맛집황평집 ... ",지식과사랑에 욕심내는 여자,https://blog.naver.com/643173,2017-04-16
"을지로 투어 /황평집 , 산수갑산, 바렌티나치킨",https://blog.naver.com/begopa1092?Redirect=Log&logNo=80200871366, 황평집저 마늘쫑 리필은 당연히... 쫄깃함이 보이는 그런.. 건강한 부위들 쫄깃하고 고소하지만 콜레스테롤과 칼로리 많은 껍질... 그러나 여전히 싸고 맛이 좋다.. 인원수 대로 내주는 이 닭곰탕국물...황평집 의... ,eye of the beholder,https://blog.naver.com/begopa1092,2013-11-01
[충무로/을지로]황평집- 닭찜,http://hsong.egloos.com/3555049,충무로와 을지로의 딱 중간에 위치한 ' 황평집 ' 닭곰탕을 주메뉴로 하는 40년 전통의 노포입니다. 식당 안을 들여다 볼 수 없어 처음 방문하는 사람을 약간 긴장하게 만드는... ^^ 이 동네 대부분의... ,녹두장군의 식도락,http://hsong.egloos.com/,2016-11-21
충무로맛집 술한잔하기엔 너무 푸짐한황평집 ,https://blog.naver.com/ajrtkska?Redirect=Log&logNo=220027175466,비가오네요 ㅎㅎ 아마 이것이 올라갈때면 저는 촉촉하게 이슬이에 젖어들고 있을겁니다 ㅎㅎ 오늘소개할곳은 충무로 인근에 있는황평집 이라는 술꾼들에게 사랑받는집을 소개할까합니다 ㅎㅎ 오늘의 메뉴는... ,먹어야 사는 남자,https://blog.naver.com/ajrtkska,2014-06-11
을지로 맛집(을지로4가) -황평집 ,https://blog.naver.com/herohwangsae?Redirect=Log&logNo=221597859556,닭곰탕으로 유명한황평집 . 을지로 4가와 3가 사이. 을지로와 충무로 사이. 그 어디쯤에 있다. 호텔 PJ 앞. 세운상가에서 대림상가를 지나 충무로 쪽으로 내려오다보면 공사중인 곳 구석에 있다. 이렇게 가게 바로... ,무적황새의 세계여행기록,https://blog.naver.com/herohwangsae,2019-07-28
을지로 충무로황평집닭곰탕 노포 나의 오래된 단골 맛집,https://blog.naver.com/talminam?Redirect=Log&logNo=221623237030,닭곰탕 노포 맛집인황평집 이에요. 저보다 더 오래다닌 분들도 있으실 그런 정말 오래된 곳이죠. 을지로에 있는 닭곰탕 노포 맛집황평집 이에요. 충무로에서는 진양상가 골목을 쭉 지나서 을지로쪽으로... ,맑고 향기롭게,https://blog.naver.com/talminam,2019-08-21
[중구/인현동] 황평집 ,https://blog.naver.com/ksh_0803?Redirect=Log&logNo=220030952131,닭무침 참 좋아라 하는 안주다.. 황평집 보다는 평래옥의 닭무침이 개인적으로는 더 맛있다고 치지만~이제는 옆매장까지 확장한황평집닭찜과 닭무침중에 갈등하다가 닭무침으로~ 단촐하게 준비되는 밑반찬... ,소소한 즐거움,https://blog.naver.com/ksh_0803,2014-06-20
[을지로/충무로 닭곰탕]황평집닭곰탕 -을지로노포,https://blog.naver.com/mina2165?Redirect=Log&logNo=221522654787,을지로/충무로황평집닭곰탕 -을지로노포 을지로4가역과 충무로역 사이에 있는황평집닭곰탕과 닭무침이 유명하다고 했었음. 골목식당에 홍탁집 때문에 닭곰탕을 먹어보고 싶었음. #을지로닭곰탕 # 황평집 ... ,나의 기록저장소,https://blog.naver.com/mina2165,2019-05-06
943번째 식당 /황평집/ 을지로4가: 노포를 넘어 원류로,https://blog.naver.com/tastesherlok?Redirect=Log&logNo=221107686102,"닭찜 닭육수 황평찜의 닭요리는 부족함이 없고, 더함이 없는 최적화된 맛이다. ‘옹골지다’라는... 을지로 노포들이 대부분 철저히 감성으로 지배하고 있는 부분도 있지만,황평집 의 닭찜은 여전히 감성을 넘은... ",미식탐정,https://blog.naver.com/tastesherlok,2017-09-29
을지로 원조 황평집 닭곰탕에가다:),https://blog.naver.com/wlsrudzzang?Redirect=Log&logNo=221651225274,#중구맛집 #을지로맛집 #닭곰탕 # 황평집# 황평집 닭곰탕 #깍두기 #마늘쫑 #파송송 #곰탕 #을지로맛집추천 #중구맛집추천 #다둥이네 간만에 블로그 하는듯해요 요즘 맘도 몸도 넘넘바쁘게 움직였던듯.^^ 다들... ,행복한 사남매 일상생활 -,https://blog.naver.com/wlsrudzzang,2019-09-17
"서울 을지로 킹갓제네럴 맛집으로 인정합니다, ' 황평집 '",https://blog.naver.com/kinn2964?Redirect=Log&logNo=221582585436,작년 바사장이랑 방문했다가 쉬는 날이라서 실패한황평집 !! 노포집 박사 최자로드와 맛있는 녀석들에게 인정받은 이곳!!! sns에서 비주얼만으로 나를 설레게 한 이곳!!! 기대 이상이었다!황평집황평집 ... ,어쩌다 하는 블로그,https://blog.naver.com/kinn2964,2019-07-10
충무로닭] 쫀득한 닭찜이랑 무한음주가 가능한~황평집 ,https://blog.naver.com/odoldodol96?Redirect=Log&logNo=220139378496, 황평집충무로역 8번출구로 나와서 쭈욱~걸어가면 뭐시다냐 고가인가 뭔가 여튼 그안쪽으로 쭈욱...황평집 의 껍질은 무조건 먹어봐야해! 오돌이의 닭가슴살 사랑~ 살뺄라고먹는거아니라구 몇번을 말했으려나... ,오돌's 이야기,https://blog.naver.com/odoldodol96,2014-10-09
충무로 맛집 :황평집 ,https://blog.naver.com/bsb7411?Redirect=Log&logNo=220079546405,여기까지 충무로 맛집황평집 이었어요. 개인적으로 이런 노포에서 소박하지만 맛있는 음식에 한 잔 기울이는걸 좋아하는지라 전부터 찜해둔 집. 기대만큼 만족스러운 곳이었어요. 닭찜 하나 밖에 먹어보지... ,Blaack Log,https://blog.naver.com/bsb7411,2014-08-04
"들어는 봤나, 닭무침. 을지로황평집 ",https://blog.naver.com/hisbooks?Redirect=Log&logNo=110179225885,"을지로황평집닭무침이라는 메뉴 들어본적 있으신가요. 저는 뭐 어렴풋이 들어는 봤는데, 그냥 먹어도... 1차는 산수갑산 2차는황평집 으로 가는 경로로 이동하여 아주 배부른 루트를 개척하게 되었습니다.... ",브랜든씨의 일일,https://blog.naver.com/hisbooks,2013-11-07
[을지로 맛집]황평집 -식사하기도 술 마시기도 괜찮은 닭요리... ,https://blog.naver.com/sagak815?Redirect=Log&logNo=80205782015,[ 황평집 ] 닭곰탕 맛있기로 소문난 집인데 사실 저녁에 술 한잔 하기도 괜찮은 집이다. 시간상 저녁에 방문할 수가 없었는데 어느 날 기회가 돼서 다녀 왔다. 을지로에서 닭곰탕 제일 잘하는 집으로 소문난 집.... ,사각사마는 뭘 먹고 사나,https://blog.naver.com/sagak815,2014-04-10
"[서울맛집] 40년전통 닭요리 맛집, 충무로 -황평집",https://blog.naver.com/cbmass1203?Redirect=Log&logNo=220282313881,"홍대쪽에서 숙소근처로 이동해 본격적인 전력질酒하러황평집 에 갑니다. 어릴적 토욜, 점심 묵기전 즐겨보던 프로였는데 거기에도 나왔나 봅니다..황평집 의 시그니처라 할수 있는 닭찜 오다넣구요... 시원한 무... ",호빵맨의 놀고 묵는 공간 ^^,https://blog.naver.com/cbmass1203,2015-02-27
충무로 맛집 여전히 술한잔하기 좋은황평집 ,https://blog.naver.com/ajrtkska?Redirect=Log&logNo=220250412107,충무로맛집황평집 이라는 제가 종종 닭곰탕이나 닭찜을 먹으러 가는곳인데요 얼마전에 가서는 둘다... 그래도황평집 이 제마음에 제일인가봐요 ㅎㅎ 닭좋아하시고 한잔 좋아하시고 충무로 근처인분들은 한번들... ,먹어야 사는 남자,https://blog.naver.com/ajrtkska,2015-01-24
[서울중구맛집/충무로맛집/을지로4가맛집/광희동맛집] 황평집 ... ,https://blog.naver.com/dnr6578?Redirect=Log&logNo=220577112951,"어마어마한 묵은지 포스팅에 업데이트 방문기를 겹친황평집포스팅...황평집첫 방문을 지난 여름에 했는데, 그 땐 닭백숙 밖에 먹어보지 못했었거든요. 사실 그 날도 닭무침을 먹으러 간 거였는데, 닭무침이... ",금군의 미각은 나의 힘,https://blog.naver.com/dnr6578,2015-12-23
을지로황평집 ,https://blog.naver.com/tanosin?Redirect=Log&logNo=50183298327, 황평집의외로 먹을집들이많은 을지로에 오랜만에 나가봅니다 이제는 잘 걸을수있으니까요 ㅎㅎㅎ 기뻐요 걸을수있다는게 그동안 가보고싶었던 여기저기를 차근차근 하나하나 다녀볼생각입니다 . 일단황평집 .... ,올라오는 재료 일정은 인스타그램에서woorp1에 올려요,https://blog.naver.com/tanosin,2013-11-22
을지로닭곰탕맛집 40년원조집황평집 ,https://blog.naver.com/park117897?Redirect=Log&logNo=220520506085,보니 상남자의 집입니다 껍질도 있고 내장같은 녀석도 보이고 아가씨들이 좋아할 집은 분명 아닙니다 퉁이의 단골집인 서평기사식당과 비교했을때황평집 은 좀 더 투박합니다 을지로방문하신다면 한번... ,퉁이의 강남에서 살아가기,https://blog.naver.com/park117897,2015-10-27
힙지로 맛집:) 최자로드 닭찜황평집 / 분위기맛집 까페 클래직,https://blog.naver.com/go5264?Redirect=Log&logNo=221606274760,유명한황평집 ! 예전 영자언니 맛집 도전했다가 별로여서 연옌 맛집에 대한 기대감이 조금 많이 떨어진... 친구랑황평집 에서 실컷먹고 근처 까페 가보자해서 여기도 친구가 써치한 까페 클래직에 갔어요... ,곽자로그 :),https://blog.naver.com/go5264,2019-08-05
[ 황평집 ] 을지로 - 다양한 닭 메뉴가 있는 식당,https://blog.naver.com/mardukas?Redirect=Log&logNo=221255633286,을지로의 노포 중 하나인황평집 .. 닭을 주재료로 다양한 메뉴가 있는 식당입니다. 술집이라고 해야하나? 암튼 ㅎㅎ 언제 방문해도 상당히 위험한(?) 식당 중 한 곳입니다. 1차로 식사 겸 반주하러 가도 좋고... ,"먹자, 마시자, 놀러 다니자",https://blog.naver.com/mardukas,2018-04-29
충무로- 황평집 ,https://blog.naver.com/diablo0729?Redirect=Log&logNo=221304250396,오랜만에 글을 쓰는 듯 합니다.요즘 일이 바쁘다보니정신 없었는데 말이죠일때문에 충무로 인쇄소를 갔다가배가 고픈 나머지 뭘 먹을까 하다가 황평집 이 생각이 났습니다.황평집 은 뭐 맛녀석 방영 전에도충무로... ,촤아저씨의 행복의 나라,https://blog.naver.com/diablo0729,2018-06-22
[충무로/을지로 맛집]황평집: 인현동 40년 전통 닭곰탕 전문... ,https://blog.naver.com/yjoshjh?Redirect=Log&logNo=220444170615,중구청 뒤편 인현상가 옆에 위치한황평집오픈한지 40년이 넘은 오래된 닭곰탕 전문 식당으로 식도락가들 사이에서 닭곰탕 얘기할때 항상 빠지지 않는 곳입니다 워낙 오래되고 유명한 곳이라 저도 예전부터... ,참이술의 Eat & Drink,https://blog.naver.com/yjoshjh,2015-08-08
닭요리전문점 을지로/충무로맛집: 황평집 ,https://blog.naver.com/alsl2067519?Redirect=Log&logNo=221303120051,을지로황평집 이 그렇게나 닭찜을 잘한다고 하길래 저도 먹으러 갔습니닭ㅋㅋㅋ황평집 은 닭곰탕이 하루에 몇백그릇 나간데요 식사:닭곰탕 안주:닭찜 백숙전골 닭전골 닭내장탕 닭무침 닭낙지전골 국내산 닭... ,설탕 쫌 다루는 여자,https://blog.naver.com/alsl2067519,2018-06-20
을지로3가/충무로황평집:),https://blog.naver.com/elsunny99?Redirect=Log&logNo=221565461822,"블로그 댓글을 채팅처럼 이용해, 고심 끝에 메뉴는황평집 으로 정했다. :) 이번에는 대기가 있었지만...황평집기본 밑반찬 세팅. 마늘쫑 장아찌 너무 좋다. 엄청 많이 먹음. 암바사주를 만들기 위하여 주문한... ",혼자서 놀자!,https://blog.naver.com/elsunny99,2019-06-19
