title,link,description,bloggername,bloggerlink,postdate
[한남동맛집/이태원맛집] 수요미식회 “ 다운타우너 한남 ”... ,https://blog.naver.com/visualdahee?Redirect=Log&logNo=222043170500,유명한 #다운타우너 에 왔어요 #코로나사태 #이태원 이후 한남동 쪽엔 인적이 뚝 끊겼다는 외출시엔... 예쁘죠 실제로 보면 훨씬 더 이국적인 분위기예요 게다가 # 다운타우너한남은 #애견동반 이라고 합니다,구름쥬스 전자담배,https://blog.naver.com/visualdahee,2020-07-27
한남동 맛집:다운타우너 한남+ 수요미식회 수제버거... ,https://blog.naver.com/studiobyh?Redirect=Log&logNo=221020935275,한남동 맛집:다운타우너 한남+ 수요미식회 수제버거 아보카도 버거 / 지난 번에 친구님과 수르기 (Sous Le Gui)에 방문했을 때 길게 서 있는 줄을 보고 여긴 뭐지? 싶었는데.. #수제버거 로 유명한 #다운타우너... ,에이치의 라이프로그,https://blog.naver.com/studiobyh,2017-06-03
이태원 수제버거 한남 맛집으로 추천!다운타우너 한남 점... ,https://blog.naver.com/bethehost?Redirect=Log&logNo=221416213998,맛집 다운타우너는 이미 수요미식회 등 여러 유명 TV프로그램에 소개되기도 했어요.다운타우너 한남 점이 큰 인기를 끈 결과 지금은 잠실과 청담에도 분점을 냈습니다! 여러 지점 중 ONDA는 한남 본점만 총 두 번... ,온다(ONDA) - 숙박업 이야기,https://blog.naver.com/bethehost,2018-12-10
"이태원 수요미식회 수제버거,다운타우너 한남 ",https://blog.naver.com/bom25bom?Redirect=Log&logNo=221430883998,세트메뉴 만들어주세효ㅠㅠㅠ 나올때 보니 다운타우너 입구 계단부터 골목까지 줄이 엄청 길게 서있었다. 평일 점심 웨이팅 실화인가요..? 이태원 수제버거 맛집을 찾는다면다운타우너 한남 오시면 될듯하다.... ,봄빛씨는 언제나 봄날,https://blog.naver.com/bom25bom,2018-12-31
"반전, 수요미식회 수제버거(서울한남다운타우너버거 추천)",https://blog.naver.com/idhsssh?Redirect=Log&logNo=221594642182,"수르기에서 시간을 보내고 당일 저녁, 어느새 다운타우너에 줄을 서 있는 나를 볼 수 있었다. 한남동의 수제버거 맛집,다운타우너 한남 이다. 맨 앞줄에서 찍은 것 뿐. 이태원에서 한강진으로 가는 길목... ",달지우 블로그,https://blog.naver.com/idhsssh,2019-07-31
"한남동 맛집_수요미식회 나온 아보카도 버거, ' 다운타우너 한남 '",https://blog.naver.com/sunnyeoyuhwa?Redirect=Log&logNo=222179841274,"꽤 알려진 수제 버거 가게에는 어느 정도의 공통점이 있군, 쿨하고 기분 좋은 ' 다운타우너 한남 ' 언덕 위 다운타우너. 걸어오긴 참 귀찮은 위치. 노티드 도넛과 함께 있으니 미식코스로는 참 좋다. 나름... ",Artistic Speaker,https://blog.naver.com/sunnyeoyuhwa,2020-12-20
[한남동 맛집] 수요미식회 수제버거다운타우너 한남 ... ,https://blog.naver.com/dahe0105?Redirect=Log&logNo=221573648564,"DOWNTOWNER 한남동 맛집다운타우너 한남지금은 지점이 많이 생긴 다운타우너 갠적으로 분위기도 맘에 들고, 한남동에 볼일도 있어서다운타우너 한남 점으로 점심을 먹으러 갔어요. 지나치기 쉬운 골목에... ",믿고보는 미쓰리다,https://blog.naver.com/dahe0105,2019-06-29
