title,link,description,bloggername,bloggerlink,postdate
근처 이영자 맛집 [제주시] 제주 통갈치 조림 전문점착한집 ,https://blog.naver.com/spasp?Redirect=Log&logNo=222459909180,떠와야해요착한집메뉴판 이 날은 착한 상차림(코스요리)와 갈갈조림중 엄청 고민을 했는데요 왜냐면갈갈조림은 먹방으로 유명한 이영자가 추천하던 조합이였고 착한 상차림에는 갈치회가 나오더라구요!... ,so so-so day,https://blog.naver.com/spasp,2021-08-06
"제주 이영자 맛집, 공항 근처착한집 의 실한 제주 갈치",https://blog.naver.com/hearteffect?Redirect=Log&logNo=222390348938, 착한집실한 제주 갈치와 고등어를 구이와 조림 등을 한번에 맛볼 수 있는 공항 근처 제주 이영자 맛집... 게다가 착한 점심이라고 11시부터 오후 3시까지 조림과 구이 구성을 괜찮은 가격으로 이용할 수... ,"평생, 연애 중",https://blog.naver.com/hearteffect,2021-06-08
제주공항 근처 맛집 ː 이영자 언니 픽 갈갈 조림 ' 착한집 ',https://blog.naver.com/finerim?Redirect=Log&logNo=222326126892,"맛집착한집 의 메뉴와 가격 11시와 15시 사이 점심시간에만 가능한 메뉴들, 가격도 괜찮고 조림과 구이를 동시에 맛볼 수 있어서 점심시간에 두른다면 착한 점심 메뉴를 눈여겨보세요! 그 외 갈치조림... ",바개림,https://blog.naver.com/finerim,2021-04-28
[제주/ 착한집 ]제주 이영자 맛집착한집:: 제주공항 근처 맛집 추천,https://blog.naver.com/b_h24?Redirect=Log&logNo=222322456849," 착한집착한 A상차림 (2인) = 69,000원 제주공항 인근에 위치한착한집 ! 원래는 다른 곳에 있었는데 제주공항 3분 거리로 확장 이전했다고 한당! 그래서인지 딱 건물을 발견하니 깔끔한 느낌이 물씬 느껴졌당... ",soblog_,https://blog.naver.com/b_h24,2021-04-25
제주 이영자 맛집 갈치조림이 맛있는착한집 ,https://blog.naver.com/whgiddnjs?Redirect=Log&logNo=222290820203,유명한착한집 이에요. 여기 갈갈조림을 먹고 극찬했다고 하더라고요~ 매장이 확장 이전해서 제주 공항...착한집주인장님이 갈치인생 50년이라 하시니 신선하고 맛있는 음식을 먹을 수 있겠구나 싶었어요.... ,미미쵸코의 세계,https://blog.naver.com/whgiddnjs,2021-03-28
제주공항 근처 맛집 제주 이영자 맛집 갈치인생 50년착한집 ,https://blog.naver.com/jagger0723?Redirect=Log&logNo=222287399929,"메뉴는착한집 답게 착한 시리즈로 되어 있었네요. 점심 때 왔으면 착한 커플세트를 먹었을 것 같네요. 통갈치구이 소짜에 고등어조림이 52천원이면. 이영자님이 추천한 왕갈갈조림이에요. 중, 대, 특대 세트로... ",천국나그네의 세상여행,https://blog.naver.com/jagger0723,2021-03-25
제주 이영자 맛집착한집갈치로 시작,https://blog.naver.com/magicnmagic?Redirect=Log&logNo=222287660904,"제주 이영자 맛집착한집갈치로 시작 퇴사 후 첫 일정은 바로 제주도 여행 작년 이맘때 가려고 했다가... 제가 주문한 메뉴는 '착한 상차림'으로 전복죽부터 시작해서 갈치회, 고등어회, 고등어조림... ",MagicN Daily Life Blog♬,https://blog.naver.com/magicnmagic,2021-03-26
"제주공항 근처 맛집, ' 착한집 ' 제주 이영자 맛집으로 소문났네요~",https://blog.naver.com/yule2908298?Redirect=Log&logNo=222288562647,"제주공항 근처 맛집, ' 착한집 ' 제주 이영자 맛집으로 소문났네요~ 안녕하세요 딩2입니다 이제 평일에... 싶어 착한A상차림 2인 69,000원 으로 주문했어요! 기본찬이 먼저 나왔어요! 맛집답게 기본찬부터... ",딩2의 블로그:내일을 묻는다,https://blog.naver.com/yule2908298,2021-03-26
제주 이영자 맛집 : 제주공항 근처착한집갈갈조림 고등어구이... ,https://blog.naver.com/llnallll?Redirect=Log&logNo=222406814532,"제주맛집 # 착한집메뉴판 ▽ Previous image Next image 낮 시간대 (11시~15시 사이 )오면 #착한점심 이라고 착한 가격의 런치 특선메뉴도 있고, 가성비 좋은 세트메뉴, 다양한 구성의 착한상차림 바른상차림 등 여러가지... ",미키짱 스토리♪,https://blog.naver.com/llnallll,2021-06-22
# 착한집 _제주통갈치구이_제주 이영자 맛집,https://blog.naver.com/v_girl_?Redirect=Log&logNo=222357833940,"편함착한집 에서는 제주산은갈치와 고등어를 구이, 조림, 모두 한 번에 먹을 수 있다는 장점이 있음 *이번에 먹진 않았지만, 갈치가 크고 두껍고 살이 많다고 함 아무튼 우리는 착한A코스를 주문했음 기본... ",我的少女时代( ღ'ᴗ'ღ ),https://blog.naver.com/v_girl_,2021-05-19
제주공항 근처 맛집착한집- 제주 이영자 맛집 다녀온 후기,https://blog.naver.com/sung288?Redirect=Log&logNo=222415873377,#제주공항근처맛집 #제주이영자맛집 # 착한집제주공항 근처 마카롱 체험하러 가기전 점심먹으러... 엄마가 아직 제주도와서 회를 못드셨기에 회랑 조림 모두 맛볼수 있는 착한상차림A로 주문했다. 갈치회... ,아주 평범한 삶에서 찾는 즐거움 ♡,https://blog.naver.com/sung288,2021-07-01
"제주공항 근처 맛집, 이영자 맛집 믿고가는착한집 ",https://blog.naver.com/wjddk3136?Redirect=Log&logNo=222091359612,"제주공항 근처 이영자 맛집 믿고가는착한집안녕하세요 정아에요 :) 오늘은 여러분들께 제가 제주에... 희희 저희가 먹은 메뉴는 착한 A상차림! 요 메뉴는 무려 고등어회, 갈치회, 구이, 조림을 한번에 맛볼 수... ","정아, 28page",https://blog.naver.com/wjddk3136,2020-09-16
제주 이영자 맛집착한집착한A상차림 든든해,https://blog.naver.com/asdfy?Redirect=Log&logNo=222239483148,메뉴인 착한A정식은 가족외식메뉴로도 딱 좋아요 그 밖에도 통갈치구이나 갈치조림 그리고 갈치와 갈비를 같이 먹을수 있는 왕갈갈조림 등 다양한 메뉴가 있는 제주 이영자 맛집착한집올때마다 항상 만족해요... ,일상입니다,https://blog.naver.com/asdfy,2021-02-10
제주공항 근처 맛집 이영자도 다녀간착한집 ,https://blog.naver.com/jjungini34?Redirect=Log&logNo=222421510149,제주공항 근처 맛집 이영자도 다녀간착한집영상 #고프로 7/2-7/5 3박4일동안 제주도로 이른(?) 휴가를... 이영자 맛집으로도 유명한 제주공항 근처 맛집착한집 에서 저녁식사를 했어요 064 -713-7136 11:00-21:00... ,비서제이,https://blog.naver.com/jjungini34,2021-07-05
"제주 이영자 맛집, 고등어 갈치착한집 ",https://blog.naver.com/pakseeun?Redirect=Log&logNo=222368538340,"주방 맞은편 공간에는 추가 반찬 셀프 바가 있고, 메뉴는 착한 점심(고등어조림과 고등어구이) 1인 13... 있는 만큼 고등어, 갈치를 다양하게 즐길 수 있는 제주공항에서 가까운착한 집 을 소개해 드렸습니다.",세은파파의 탐구생활,https://blog.naver.com/pakseeun,2021-05-26
제주공항 근처 맛집은 제주 이영자 맛집으로 유명한착한집 ,https://blog.naver.com/likez2?Redirect=Log&logNo=222285407617,"맛집착한집 이에요! 원래도 제주 공항에서 가까운 거리였는데, 요번에 공항 3분거리로 이전했더라구요!!ㅎㅎ 완전 깨끗 깔끔하게 이전확장된착한집 , 엄청 드넓은 주차장까지- 완벽하죠?ㅎ 여기는 주말엔... ",오늘은 또 어디로-,https://blog.naver.com/likez2,2021-03-24
제주 이영자 맛집착한집나도 가봤다!,https://blog.naver.com/dlwbgus?Redirect=Log&logNo=222393262754,"포함된 착한A 상차림으로 골라봤는데 회, 조림, 구이 다양하게 나와서 만족스러웠어요❤착한집새로 이전한 건물이라 실내도 깨끗하고 밑반찬도 깔끔한게 맛있었어요 콩나물 무침과 나물 반찬, 전복죽... ",HYUNDDD BLOG,https://blog.naver.com/dlwbgus,2021-06-10
제주 이영자 맛집 제주착한집 제주도 맛집 추천드려요,https://blog.naver.com/rimy257?Redirect=Log&logNo=222464016617,제주착한집이야기입니다. 제주맛집 제주착한집 은 확장 이전되어 좀 더 쾌적한 공간에서 만나보실... 구성의 착한 상차림 A로 주문해 보았답니다. 자리에 앉아서 매장을 쭉~ 살펴보는 중 ㅎㅎㅎ 점심시간이... ,엘리엇과 이레의 또다른 세상...,https://blog.naver.com/rimy257,2021-08-10
제주공항 근처 맛집착한집 에서 점심 먹었어요!(+이영자 맛집),https://blog.naver.com/joo_cat_85?Redirect=Log&logNo=222222370113,이영자맛집착한집메뉴착한집 의 착한점심은 11:00~15:00 고등어조림과 갈치조림을 착한가격에 맛볼수 있어용!! 다음엔 갈치조림도 먹어볼테다!!착한집 은 이영자언니가 와서 맛집으로 추천한곳이더라고요!... ,고양이심쿵,https://blog.naver.com/joo_cat_85,2021-01-27
제주 맛집! 제주 갈치는 이영자 맛집으로 소문난착한집 에서!,https://blog.naver.com/nada5333?Redirect=Log&logNo=222325468532,"제주 이영자 맛집/ 제주 통갈치 맛집인착한집 을 알게 되었어요! 장사가 아주 잘되는 곳인지 최근에... 더욱 믿음이 가더라구요 여기 제주 맛집착한집 은 제주산 은갈치와 고등어를 구이, 조림, 모두 한번에... ",JJANG 3,https://blog.naver.com/nada5333,2021-04-27
"제주도 맛집, 제주공항 근처착한집 ",https://blog.naver.com/anthocyanins?Redirect=Log&logNo=222422273074,제주 이영자 맛집 고등어와 갈치를 즐길 수 있는착한집제주에서 또 갈치 안 먹고 가면 섭하니까~ 제주 공항 근처에 있는착한집 에서 갈치로 한 끼 하기로 했다 네비에 찍으니 두 곳이 나오던데 확장이전을 한... ,zip,https://blog.naver.com/anthocyanins,2021-07-06
제주공항 근처 제주 이영자 맛집착한집갈치갈비조림 (갈갈조림),https://blog.naver.com/zzungso?Redirect=Log&logNo=222467522135,가장 신선한 생선을 중간 유통 없이 착한 가격으로 제공하고 있으며 제주산 은갈치만 고집한다고 하니 믿고 먹을 수 있겠네요메뉴 11시 부터 3시 까지는 착한 점심 메뉴도 준비되어 있어요 제주도착한집 은... ,J_sister 정자매,https://blog.naver.com/zzungso,2021-08-12
제주 이영자 맛집/제주공항 근처 맛집착한집착한상차림,https://blog.naver.com/namhj2007?Redirect=Log&logNo=222413804266,"갈치인생 50년의 노하우 쩌는 제주공항 근처 맛집착한집착한점심부터 다양한 메뉴가 있는데요. 저흰... 살 집 한점 쭈욱 발라 밥없이 고등어살만으로 입안 한가득 매콤한 해물뚝배기엔 꽃게,새우,홍합등으로... ","먹방,놀방 지태맘의 쏘쿨한 일상",https://blog.naver.com/namhj2007,2021-06-29
"제주도 맛집 / 제주 이영자 맛집 ::착한집 , 제주 통갈치 조림... ",https://blog.naver.com/jj2yo?Redirect=Log&logNo=222462544925,있는착한집맛있게 먹었던 갈갈조림이 자꾸 떠오르는 곳이에요 매장이 확장 이전 됐다고 하던데... 있는 착한A상차림을 먹어볼까 했는데 고등회가 아직 안된다고 하셔서 갈갈조림+고등어구이 먹었어요... ,쩡이월드:D,https://blog.naver.com/jj2yo,2021-08-09
제주 갈치착한집- 개그우먼 이영자가 다녀간 제주 맛집,https://blog.naver.com/okok1326?Redirect=Log&logNo=222286577384,오전에 제주에 방문하니 배가 고프더군요 그래서 처음 들린 목적지는 바로 음식점이었는데요 그중에서도 개그우먼 이영자씨가 다녀간 갈치 맛집으로 알려진 제주착한집 에 다녀왔습니다 제주착한집전화번호... ,어울림갤러리,https://blog.naver.com/okok1326,2021-03-25
제주 이영자 맛집 제주공항 근처 맛집착한집 ,https://blog.naver.com/ssobom0117?Redirect=Log&logNo=222284826120,외관착한집착한집외관입니다. 제주공항과 가까워서 여행 마지막 날 점심 코스로 방문했는데요.착한집 은 기존 매장에서 제주공항에서 3분거리로 확장 이전했다고 하네요. 덕분에 주차장도 넓어서 편하게... ,"""sSo""그리고""BoM""",https://blog.naver.com/ssobom0117,2021-03-23
[제주공항 근처 맛집]착한집 ,https://blog.naver.com/hellosookk?Redirect=Log&logNo=222420878200,Previous image Next image 제주 이영자 맛집 리스트에 있는착한집갈갈조림 제주살이하고 계신 부모님을 뵈러 왔기에 외식할 수 있는 시간이 많지가 않다. 다양한 음식을 맛볼 수 있는 착한A 상차림으로 주문했다.... ,슈류류륙 :D,https://blog.naver.com/hellosookk,2021-07-05
제주도 맛집착한집: 갈비와 갈치의 만남,https://blog.naver.com/seong3961?Redirect=Log&logNo=222184610831,"제주도 맛집착한집: 개그우먼 이영자 추천 주소 : 제주 제주시 우평로 29 영업시간 : 매일 11시 ~ 21시... 점심을 먹어야 했고, 일행이 추천하는 제주착한집 으로 이동했다. 함께한 일행은 두번째 방문 : 제주도... ",빵규가 사는 세상,https://blog.naver.com/seong3961,2020-12-24
"제주공항 근처 맛집착한집 ,제주 이영자 맛집이었다",https://blog.naver.com/fpdh0922?Redirect=Log&logNo=222228443516,"밥 먹는데 살짝 힘들었지만 그래도 엄빠는 맛있는 음식을 배부르게 다먹을 수 있어서 좋았어_ 제주산은갈치와 고등어를 회, 구이, 조림으로 한번에 즐기고 맛볼 수 있는착한집착한A상차림의 구성을 영상으로... ",쪼까니(꽃설이네),https://blog.naver.com/fpdh0922,2021-02-04
제주 갈치랑 고등어회가 맛있는 제주공항 근처맛집- 착한집한정식,https://blog.naver.com/boshukr?Redirect=Log&logNo=222358436555,제주도착한집 에 도착한 시간이 오후 5시 30분 정도였고 식당 안에는 식사하는 사람들이 꽤 있었어요. 우리도 qr코드를 찍고 안내를 받아 창가 쪽으로 자리를 잡아요. 이영자 씨가 왔었나 봐요. 제주 이영자... ,My road story...,https://blog.naver.com/boshukr,2021-05-20
제주 이영자 맛집 제주공항 근처 맛집착한집 ,https://blog.naver.com/chlwjdgp124?Redirect=Log&logNo=222143490065, 착한집들어가자마자 입구에 제주 이영자맛집 팻말이 크게 적혀있었다.착한집메뉴착한집가격 밑반찬으로 죽이 나오는데 이게 또 얼마나 맛있던지 죽을 좋아하는 나에게 안성맞춤이였다. 계란말이랑 다른... ,최여사's life,https://blog.naver.com/chlwjdgp124,2020-11-13
"제주 이영자 맛집, 제주공항 근처착한집갈비갈치조림",https://blog.naver.com/sarang612?Redirect=Log&logNo=222400171059, 착한집갈갈조림 제주 공항근처 이영자 맛집 매일 11:00 - 21:00 B.T 15:00~17:00 주차 O 제주특별자치도 제주시... 맛집착한집 으로 가봤다 바로 앞마당?이 주차장이라 주차걱정도 없고 확장이전한 곳이라 실내도 넘... ,H LOG,https://blog.naver.com/sarang612,2021-06-16
제주 통갈치 조림 이영자 맛집 @착한집 ,https://blog.naver.com/jsshopholic?Redirect=Log&logNo=222162230560,제주 통갈치 조림 이영자 맛집착한집영업시간 매일 11:00 - 21:00 브레이크타임 15:00 - 17:00 주차가능 믿고 먹는 이영자 맛집 제주착한집 을 다녀왔어요 ㅋㅋ 이영자 언니가 다녀간 곳은 왠만하면 상타치 ㅋㅋㅋ... ,@parismood,https://blog.naver.com/jsshopholic,2020-12-04
제주공항근처 맛집 제주 이영자 맛집착한집 ,https://blog.naver.com/lovetaya88?Redirect=Log&logNo=222233173022,싶어착한집 에 방문했어요착한집현재는 제주공항에서 15분거리인데 2월 중에 확장 이전한다고... 저희는 착한A 세트를 주문했어요 착한A 세트는 고등어회와 구이 조림을 한번에 모두 맛볼수 있어요 먼저... ,행복한 이야기 한가득,https://blog.naver.com/lovetaya88,2021-02-06
"제주공항 근처 맛집 :착한집/ 고등어회, 갈치회를 한 상에",https://blog.naver.com/zuuu_33?Redirect=Log&logNo=222538276842,"7136 주차공간 : 가게 앞 전용 주차장 개그우먼 이영자님이 다녀왔었던 제주 공항근처 맛집 제주바다를 담은착한집! 착한 가격에 제주산 은갈치와 고등어구이, 조림을 한꺼번에 먹을 수 있는 제주도민... ",제주 좋아서,https://blog.naver.com/zuuu_33,2021-10-15
제주 이영자 맛집착한집에서 착한상차림 후기,https://blog.naver.com/junihide?Redirect=Log&logNo=222177040007,제주이영자맛집착한집ⓒ제주도조아 제주공항에서 차를 타고 약 10~15분 이동하면 나오는 착한가게 맛이 얼마나 착하길래 가게이름이 # 착한집일까 이영자추천맛집이라고 해서 찾아간 갈치요리전문점... ,제주가좋은 제주도조아,https://blog.naver.com/junihide,2020-12-17
제주 이영자 맛집 : 제주 갈치는착한집 이 찐,https://blog.naver.com/zltm31?Redirect=Log&logNo=222108629390,A세트로 시켰어요 실속짱인 메뉴에요♡ 제주 이영자 맛집 제주 갈치맛집 [ 착한집착한A상차림 기본찬] 시금치무침 양배추쌈 감자조림 배추김치 샐러드 물김치 정갈하고 깔끔한 맛의착한집기본찬^^ [ 착한집 ... ,제주하이쩡★,https://blog.naver.com/zltm31,2020-10-06
제주 이영자 맛집 ' 착한집 ' 갈갈조림과 고등어 구이!,https://blog.naver.com/yoondh613?Redirect=Log&logNo=222141488968,제주 이영자 맛집착한집주소 : 제주시 우평로 29 전화번호 : 064-713-7136 영업시간 : 11:00~21:00 (B.T 15:00~17... 제주 이영자 맛집 ' 착한집 ' 의 내부모습이다. 오후 7시 30분이 조금 늦은 시간일 수도 있는데 손님들이... ,씨씨커플,https://blog.naver.com/yoondh613,2020-11-11
"제주 이영자 맛집, 제주갈치 먹으러착한집고고씽",https://blog.naver.com/lovellz6?Redirect=Log&logNo=222139500673,"제주 이영자 맛집 유명한 제주갈치, 제주 통갈치 조림 먹으러착한집다녀왔어요 제주공항근처여서 공항에서 10~15분정도 걸려요! 제주공항근처에서 갈치조림 드시고 싶다면!착한집 으로 고고씽해보아요!... ",고니의 이야기,https://blog.naver.com/lovellz6,2020-11-09
"제주공항 근처 맛집, 제주 이영자 맛집착한집방문했어요 !",https://blog.naver.com/vd_r1?Redirect=Log&logNo=222155549808,"신선한 고등어회 한점에서 제주도 바다가 떠오르는듯한 제주 이영자 맛집착한집 의 착한A상차림. 김한장에 고등어회를 한점 올리고, 양파절임과, 고등어깨밥을 올려서 가득 싸서 먹었습니다. 김에 회를 싸서... ",신혼 일상 블로그,https://blog.naver.com/vd_r1,2020-11-27
제주공항 근처 맛집 :: 이영자도 다녀간착한집 ,https://blog.naver.com/chi4540?Redirect=Log&logNo=222089303818," 착한집 은 제주산은갈치와 고등어 구이, 조림을 다다다 한번에 맛볼수 있어서 좋은 거 같아요 ㅎㅎ 제주통갈치도 있고 고등어도 있고!! ㅎㅎㅎㅎ좋쟈냐~~ 저희는 착한 상차림 A로 주문했어요~!! 전복죽이랑 기본... ",일상스케치 by. Henn,https://blog.naver.com/chi4540,2020-09-14
제주공항 근처 맛집 이영자도 반한 제주 통갈치 조림착한집 ,https://blog.naver.com/dbcom36?Redirect=Log&logNo=222539026743,"좋았던착한집칭구랑 나는 고등어회 + 갈치회 + 갈치조림 전부다 먹어볼 수 있는 착한 B 상차림으로 주문했다 기본반찬부터 대박이었던게 잡채, 제육볶음, 샐러드부터 전복죽까지 전복죽이 기본찬으로... ",daily,https://blog.naver.com/dbcom36,2021-10-16
제주 이영자 맛집 제주공항 근처 맛집착한집드디어 가봤어요.,https://blog.naver.com/encnc1?Redirect=Log&logNo=222134638192,"집! 제주공항 근처 맛집이라하여 좋은 위치에 있더라고요. 도로변에 있어 저녁에도 찾기 쉬웠으며... 맛있는 제주 선물 따봉이네로 보내주세요^,^ 저보다 먼저 도착한착한집제주 선물^^ 오늘 저녁밥상 제주의... ",♡따봉옴마제시 스토리♡,https://blog.naver.com/encnc1,2020-11-03
제주 이영자 맛집 :: 제주 맛집착한집갈치회 고등어회,https://blog.naver.com/wony_91?Redirect=Log&logNo=222528366112,"갈치회, 고등어회가 포함되어있는 착한상차림A로 2인 주문해보았구요 제주착한집착한상차림 A 갈치회, 고등어회, 고등어조림, 고등어구이, 해물뚝배기, 고등어깨밥, 계절국, 전복죽, 야채샐러드 2人 69... ",워니의 서울라이프,https://blog.naver.com/wony_91,2021-10-12
제주공항 근처 맛집 제주 이영자 다녀간착한집 ,https://blog.naver.com/beloved_lim?Redirect=Log&logNo=222013783366," 착한집메뉴 제주공항 근처 맛집 Previous image Next image 저희는 아이를 위해 착한 A상차림 으로 선택을 했어요. 아무래도 다양한 음식 (회, 조림, 구이 등)이 나오는 코스 메뉴가 아이와 함께 먹기에는 적당할 것... ",리브제이 데일리라이프,https://blog.naver.com/beloved_lim,2020-06-27
제주 이영자 맛집으로 유명한착한집 ~ 제주공항근처맛집 이예요.,https://blog.naver.com/jyhccn1?Redirect=Log&logNo=222145181736,제주 이영자 맛집으로 더 유명한착한집 ! 남편은 버킷리스트를 제주여행2일차에 클리어! 바로 한라산... 저희는 제주도의 맛을 느낄 수 있는 착한A정식으로 3인을 주문했어요. 아무래도 제주도에 왔으니 갈치회... ,불량아즈매의 세상살이,https://blog.naver.com/jyhccn1,2020-11-15
"[제주 이영자 맛집, 제주공항 근처 맛집] 제주착한집 ",https://blog.naver.com/01096000055?Redirect=Log&logNo=222109559828,저는 착한 A 상차림으로 ! 예약해놓은 자리로 착석하구요 ! 좌석이 엄청 넓어서 단체석도 수용 가능해요.착한집! 밑반찬은 제가 좋아하는 샐러드가 !! 전복죽도 나오구요 ! 싱싱한 갈치회와 고등어회... ,쭈이씨마켓,https://blog.naver.com/01096000055,2020-10-07
제주공항 근처 맛집 이영자가 인정한 갈치 찐맛집 :착한집 ,https://blog.naver.com/upup50?Redirect=Log&logNo=222538269703,"소개해드릴께요 ✨착한집제주특별자치도 제주시 서광로 98(오라오거리) 매일 11:00 - 21:00 [브레이크타임 15:00 - 17:00] 전화 : 064-713-7136 주차가능, 단체석 있음 제주 통갈치맛집 ‘ 착한집 ’은 매장이 확장되면서... ",Daisy__LOG ✿,https://blog.naver.com/upup50,2021-10-15
2020_이영자 맛집으로 유명한 제주공항 근처 맛집착한집 ,https://blog.naver.com/park020?Redirect=Log&logNo=222100192112, 착한집 은 제주통갈치구이와 갈치회와 고등어회로 구성되어 있는 착한 상차림과 바른 상차림이 주메뉴이다. 제주산 갈치로 구성된 메뉴라 가격이 조금 비싸지만 그만큼 요리의 가치가 있다. 점심특선으로... ,풍경이 있는 거리,https://blog.naver.com/park020,2020-09-27
제주 이영자 맛집 갈치와 고등어를 한번에 먹을 수 있는착한집 ,https://blog.naver.com/naho_holic?Redirect=Log&logNo=222359804950,제주 이영자 맛집 갈치와 고등어를 한번에 먹을 수 있는착한집제주도에 가서 안 먹고 오면 서운한... 맛집착한집 ! 이영자가 다녀간 곳이라 입소문 제대로 난 곳이랍니다 제주도 공항에서 차로 약 3분 정도?... ,온리 보물상자 ♪,https://blog.naver.com/naho_holic,2021-05-26
제주공항 근처 맛집착한집제주 갈치 이영자가 다녀간... ,https://blog.naver.com/gaeul12?Redirect=Log&logNo=222065082985,"오늘은 회가 먹고싶어서 착한상차림으로 골랐는데 다음에는 이영자추천 왕갈갈조림을 먹어봐야겠어용 통갈치에 왕갈비, 전복, 문어, 딱새우까지 정말착한집 은 이름답게 착해요!!!! # 착한집#제주 착한집 ... ",어느날 문득 발견한 행복,https://blog.naver.com/gaeul12,2020-08-19
제주 이영자 맛집 통갈치 조림 맛난착한집 !,https://blog.naver.com/dbnote?Redirect=Log&logNo=222071963335,제주 이영자 맛집 으로 유명한 통갈치 조림 전문점착한집이라는 곳인데요! 이름부터 착한만큼 맛도 참 착했던 곳이랍니다. 건물 앞으로는 널찍한 주차장이 양옆으로 쫘악 펼쳐져 있어서 차 끌고 가기도 완전... ,뚜벅이의 인생 탐방. 뚜벅 노트.,https://blog.naver.com/dbnote,2020-08-26
"제주공항 근처 맛집, 제주 이영자 맛집착한집맛있어요!",https://blog.naver.com/kkjkt?Redirect=Log&logNo=222015036285,"ㅎ_ㅎ 제주공항 근처 맛집착한집메뉴 제주착한집 은 제주산은갈치와 고등어를 구이, 조림을 한번에 맛볼수 있는 곳이에요. 저희는 남편이 회 귀신이라서(?) ㅋㅋㅋㅋ 갈치회, 고등어회도 먹을 수 있는 착한... ",갱지로그,https://blog.naver.com/kkjkt,2020-06-28
제주도민맛집 이영자도 칭찬한 제주도 이영자 맛집착한집 에서... ,https://blog.naver.com/werefamily?Redirect=Log&logNo=222542029841,"제주 통갈치 구이를 맛볼수도 있고 고등어구이돟 맛볼 수 있는 제주 이영자 맛집착한집 ! 공항에서 3분거리에 위치하고 있으니 제주도에 도착한 후, 제주도를 출발하기 전에 들려서 은갈치 맛보고 가면 더 좋을... ",♡비니빈스♡,https://blog.naver.com/werefamily,2021-10-19
