title,link,description,bloggername,bloggerlink,postdate
"제주 이영자 맛집으로 소문난 제주도 맛집,착한집 ",https://blog.naver.com/00bbangbbang00?Redirect=Log&logNo=222152979973,"조림의 착한상차림 저희는 2인이라서 착한 상차림(2인) 69,000을 시켜봅니다 갈치회, 고등어회... 껍질은 바삭한데 고등어가 너무 촉촉하고 부드럽구착한집 에 고등어구이 먹으러 또 가고 싶을 정도예요 고등어... ",볼동볼동한일기블로그,https://blog.naver.com/00bbangbbang00,2020-11-24
제주현지인맛집 :: 인증받은 제주 이영자 맛집_' 착한집 ' 다녀온... ,https://blog.naver.com/mhyesu?Redirect=Log&logNo=222042230806," 착한집후기 남겨볼께요. 갈갈조림? 갈갈조림이 뭘까, 갈치갈비? 어울리지 않을것같은 이 조합은 비주얼을 보고 실패할 수 없는 조합이라고 생각이 바꼈어요. 이호테우 해변에서 차로 5분 이내 도착하는착한집 ... ",물음표 일상 :),https://blog.naver.com/mhyesu,2020-07-26
제주 이영자 맛집착한집갈갈조림 맛나다요~,https://blog.naver.com/vms994su?Redirect=Log&logNo=221783118199,제주 이영자 맛집착한집갈갈조림 맛나다요~ 방학을 하면 늘 언니랑 여행을 다니는데 이번 방학엔... 맛집착한집 에서 갈갈조림을 먹게 되었어요~^^착한집 은 제주공항근처에 인점하며 공항에서 차로 약 10... ,"효리와 떠나는 제주도 여행,맛집,뷰티 탐험",https://blog.naver.com/vms994su,2020-01-23
제주공항 근처 맛집 이영자 맛집이라는 꿀맛 갈치조림착한집 ... ,https://blog.naver.com/hnn888?Redirect=Log&logNo=222043340602,"전문점인착한 집 이었어요, 늘 믿고 가는 이영자 맛집이라길래 그녀 입맛 믿고 찾아간 곳! 리얼 방문기... 캐리정이 주문한 메뉴는 고등어조림과 갈치고등어회 그리고 고등어구이가 한상 가득 나오는 착한... ",행복한 날로 이끄는.캐리정 블로그,https://blog.naver.com/hnn888,2020-07-27
"맛집, 회+구이+조림 밥상의 완벽한 픽이었다. 제주 통갈치착한집 ",https://blog.naver.com/mati1007?Redirect=Log&logNo=222078568042,추천드려용착한집: 064-713-7136 내부는 요런곳이 두번 더 있습니다. 음.. 이런 공간의 약 세배정도! 라고 보시면 될 듯 한 넓은 내부에용 깨끗깨끗하고욤! 저희는 착한상차림 A를 2인분 주문했습니다. 제주 이영자... ,아나의 여행,https://blog.naver.com/mati1007,2020-09-02
"제주 이영자 맛집, 제주공항 근처 통갈치요리 추천!착한집)",https://blog.naver.com/hallogirl1?Redirect=Log&logNo=222065318912,"image착한집 의 메뉴를 보면 착한점심메뉴로 가성비 좋은 세트메뉴가 4가지 있고 조림요리, 상차림 또한 세트 구성으로 합리적인 가격에 제공되고 있다. 조림, 구이 외에도 회, 전복요리가 다양하게 준비되어... ",나미살롱,https://blog.naver.com/hallogirl1,2020-08-19
제주 이영자 맛집 제주공항 근처착한집여행중 제일 맛있게... ,https://blog.naver.com/chikinson?Redirect=Log&logNo=222079145597,"먹고온 집 이에요 바로 제주공항 근처에 있는착한집인데요 대세중에 대세 맛집으로는 이분 따라갈 수... 저희가족은 착한상차림A 주문 했어요 회도 나오고, 아이들 위한 고등어구이도 나오고 엄마,아빠가... ",가잉이의 일상과육아 & 베르의 바다 루어,https://blog.naver.com/chikinson,2020-09-03
