,Unnamed: 0,content,hashtag,date,like,place
0,5,청담동 맛집 뜨락신동엽의인생안심!!☺️🙃🙃역시👍👍👍#헬로우의먹방월드#1일10식#술스타그램#먹스타그램 #맛스타그램 #푸드스타그램 #foodie #foodstagram #foodphoto#뜨락#청담동맛집#청담동뜨락#안심맛집#신동엽의인생안심,"['#헬로우의먹방월드', '#1일10식', '#술스타그램', '#먹스타그램', '#맛스타그램', '#푸드스타그램', '#foodie', '#foodstagram', '#foodphoto', '#뜨락', '#청담동맛집', '#청담동뜨락', '#안심맛집', '#신동엽의인생안심']",2020-03-23,0.0,청담동 뜨락
1,6,_어제 은정이 생일밥 먹으러.수요미식회 신동엽의 인생안심으로소개되었던 곳이라는데 진짜 너무 맛있어서 7인분이나 흡입했어요@maria_chuu 생일 너무 축하해🥳#뜨락 #청담동뜨락 #파티또있는거실화니,"['#뜨락', '#청담동뜨락', '#파티또있는거실화니']",2020-07-19,0.0,뜨락
2,8,청담동 뜨락3층의 한우 오마카세는고기구성도 훌륭하지만 함께 나오는메뉴들도 하나같이 정갈하고 맛있다이런 훌륭한 구성을 만든 @tteurak_jk 의대표님 칭찬해요 👏👏👏#헬로우의먹방월드#1일10식#술스타그램#먹스타그램 #맛스타그램 #푸드스타그램 #foodie #foodstagram #foodphoto#뜨락#청담동맛집#청담동뜨락#안심맛집#신동엽의인생안심,"['#헬로우의먹방월드', '#1일10식', '#술스타그램', '#먹스타그램', '#맛스타그램', '#푸드스타그램', '#foodie', '#foodstagram', '#foodphoto', '#뜨락', '#청담동맛집', '#청담동뜨락', '#안심맛집', '#신동엽의인생안심']",2020-08-14,0.0,청담동 뜨락
3,10,소고기 사주면 이쁜 언니~♡#청담동뜨락#신동엽인생안심#수요미식회,"['#청담동뜨락', '#신동엽인생안심', '#수요미식회']",2021-10-17,0.0,
4,14,"#뜨락 많은 분들에게 신동엽님의 인생안심으로 수요미식회를 통해 더 많이 알려졌던 청담동 한우 전문점 뜨락.  1인분 가격을 보면 가격 좀 한다 싶다가도 어디가서 이 금액에 이정도 찬과 서비스, 고기를 구해오라 하면 선뜻 자신이 없어 중요한 저녁약속을 종종 진행하는 곳.  안심은 2-3인분 시키며 한덩어리로 달라 하면 난감한 미소와 함께 좋은 샤또브리앙으로 내어주고, 특별히 추천하고 싶은 부위는 오히려 안창살.  정확한 기준은 기억이 가물거리나 일행당 몇병 까지는 글라스교체비 이외엔 무료 콜키지가 가능했고, 맛좋은 #이네딧담 맥주와 다양한 국산소맥, 와인 등도 겸비한.. 달래를 넣어주신 진한 된장찌개도 좋고 안동산 하몽이나 육전도 술안주 하기에 괜찮은 한우 맛집.  #서울맛집 #강남맛집 #청담동맛집 #강남한우 #강남한우맛집 #청담동한우 #청담동한우맛집 #안창살맛집 #한우맛집 #콜키지프리 #육전 #육전맛집 #하몽 #안동하몽 #청담동회식 #청담동모임장소 #강남모임 #강남모임장소 #청담동모임 #신동엽맛집 #수요미식회 #수요미식회맛집 #청담뜨락 #청담동뜨락 #먹박사맛집","['#뜨락', '#이네딧담', '#서울맛집', '#강남맛집', '#청담동맛집', '#강남한우', '#강남한우맛집', '#청담동한우', '#청담동한우맛집', '#안창살맛집', '#한우맛집', '#콜키지프리', '#육전', '#육전맛집', '#하몽', '#안동하몽', '#청담동회식', '#청담동모임장소', '#강남모임', '#강남모임장소', '#청담동모임', '#신동엽맛집', '#수요미식회', '#수요미식회맛집', '#청담뜨락', '#청담동뜨락', '#먹박사맛집']",2021-09-20,0.0,청담동 뜨락
5,33,#청담 #뜨락@my_yummy_yum 님 생일 기념한우 오마카세 방문!채광 좋은 루프탑 룸에서좋은 사람들과 함께한 시간이라너무 즐거웠다.생일 축하해요 마얌님🧡🧡🧡#글쓰다날아가서짧게씀 #즐거웠지만 #이돈스 #청담동뜨락 #신동엽의인생안심 #생일축하해 #다음엔어디갈까 #먹요정 #청담맛집 #한우오마카세 #뜨락오마카세,"['#청담', '#뜨락@my_yummy_yum', '#글쓰다날아가서짧게씀', '#즐거웠지만', '#이돈스', '#청담동뜨락', '#신동엽의인생안심', '#생일축하해', '#다음엔어디갈까', '#먹요정', '#청담맛집', '#한우오마카세', '#뜨락오마카세']",2021-07-22,0.0,청담동 뜨락
6,35,"세상에. 이런 점심은 언제나 옳다.배를 채우기 위해 먹느냐.맛있는 음식을 즐기기 위해 먹느냐.난 아무래도 후자인편.나에게 이만한 곳이 없을듯.최고다. 정말….맛도, 분위기도, 서비스도 최고인데.점심메뉴가 어쩜 저럴일?이제야 뜨락에 점심먹으러간 나님이 잘못했네. 내가 잘못했어…. 흑흑흑너무 맛있어서 흡입흡입.점심먹으러 가세요.저녁먹으러 가세요.두번가세요.또가세요.#뜨락#먹스타그램 #맛스타그램 #푸드스타그램 #foodie #foodstagram #foodphoto#뜨락#청담동맛집#청담동뜨락#안심맛집#신동엽의인생안심 #청담동한우맛집#한나언니#한나언니추천#한나언니맛집#푸드스타일리스트추천맛집 @tteurak_jk","['#뜨락', '#먹스타그램', '#맛스타그램', '#푸드스타그램', '#foodie', '#foodstagram', '#foodphoto', '#뜨락', '#청담동맛집', '#청담동뜨락', '#안심맛집', '#신동엽의인생안심', '#청담동한우맛집', '#한나언니', '#한나언니추천', '#한나언니맛집', '#푸드스타일리스트추천맛집']",2021-07-19,0.0,
7,36,"✔️청담_뜨락 신동엽의 인생 안심이라는 '뜨락' 가격대는 좀 있는 편이지만, 안심은 끝내주게 맛있었다. 콜키지는 한병만 free(두병부터 요금발생)레드 스파클링 #콘체르토 들고갔는데 은근 고기랑 잘어울렸다. 고기만 먹으면 심심하구 마무리로 냉면과 탄수화물먹으니 든든😋 누가 사준다고하면 또 가고싶댜♥️",['#콘체르토'],2021-07-18,0.0,청담동 뜨락
8,38,이렇게 알흠다운 안심 보셨나요?.청담동 뜨락에 가시면 세상 알흠다운안심이 기다리고 있어요.가성비좋은 점심세트에 반주 너무 맛있어예~~~🥰😍시원한 산토리 프리미엄 몰츠 생맥주도 꼭꼭함께 드세요 🍺🍻#헬로우의먹방월드#1일10식#술스타그램#먹스타그램 #맛스타그램 #푸드스타그램 #foodie #foodstagram #foodphoto#뜨락#청담동맛집#청담동뜨락#안심맛집#신동엽의인생안심 #청담동한우맛집,"['#헬로우의먹방월드', '#1일10식', '#술스타그램', '#먹스타그램', '#맛스타그램', '#푸드스타그램', '#foodie', '#foodstagram', '#foodphoto', '#뜨락', '#청담동맛집', '#청담동뜨락', '#안심맛집', '#신동엽의인생안심', '#청담동한우맛집']",2021-07-16,0.0,청담동 뜨락
9,39,"[청담동 #뜨락 🍽]신동엽 안심맛집으로 유명한 뜨락에서의 오마카세 코스요리4인이상 예약으로 운영되며, 예약시 예약금도 입금해야한다. 회사 동기들과 다이어트 종료기념으로 가기로 했는데 자꾸 일이 생겨 몇번이나 예약을 변경했는데 친절히 응대해 주셨다.인당 15만원, 4인 60만원의 값어치를 하느냐? YES!!YES!! (*오마카세이용시 콜키지별도)1. 우선 룸이라 프라이빗하게 즐길 수 있고 우리 룸은 테라스도 있어서 외국 리조트 온 척 사진도 찍었다📷 2. 맛이랑 구성은 말할 것도 없다.. 너무 맛있는 한우였다. 안심으로 유명한 집이지만, 원픽은 안창살이었다(단품 가격도 더 비쌈). 고기뿐 아니라 다양항 제철재료를 곁들인 요리들이 인상깊었다. 그리고 소꼬리찜과 솥밥과 여러 반찬과 함께하는 마지막 식사까지 먹고나면 배가 터진다!! 먹깨비 친구들도 음식을 남길 정도👍3. 무엇보다 고기구워주시는 쉐프슨생님이 매우 친절하시다. 부위설명도 잘해주시고 고기도 잘 구워주셨당👨‍🍳좋은날, 좋은사람과 함께하기 좋은 곳!#뜨락 #청담맛집 #청담동뜨락 #청담뜨락 #청담동맛집 #한우오마카세 #맛스타 #맛스타그램 #먹스타 #먹스타그램 #맛집스타그램 #음식스타그램 #서울맛집추천 #맛집 #맛집소개 #맛집추천 #food #데이트맛집","['#뜨락', '#뜨락', '#청담맛집', '#청담동뜨락', '#청담뜨락', '#청담동맛집', '#한우오마카세', '#맛스타', '#맛스타그램', '#먹스타', '#먹스타그램', '#맛집스타그램', '#음식스타그램', '#서울맛집추천', '#맛집', '#맛집소개', '#맛집추천', '#food', '#데이트맛집']",2021-07-12,0.0,청담동 뜨락
10,54,"청담동 뜨락* 나름 유명하다는 한우집을 많이 다녀봤지만,만족도가 세손가락안에 드는 곳.* 식자재 선택부터 관리 그리고 결과물까지 나무랄것이 없었던... * 로스터와 서버분들의 친절함과 섬세함이 굿~!!* 이날 사정상 와인을 곁들이지 못했지만,3층의 경우 콜키지 와인 3만, 하드리커 7만원.* 내 뇌피셜이지만 말만 잘하면 글라스교체없이 한두병정도는 콜키지없이 가능할 둣. * 기본 셋팅은 잘토로 되어있었슴.* 재방문 예정..#뜨락 #청담동뜨락 #3층 #프라이빗룸 #청담맛집 #한우오마카세 #한우코스 #재방문100 #수요미식회 #신동엽인생안심 #블루리본 #웻에이징 #약1000시간 #안심 #안심추리 #새우살 #알등심 #안창살","['#뜨락', '#청담동뜨락', '#3층', '#프라이빗룸', '#청담맛집', '#한우오마카세', '#한우코스', '#재방문100', '#수요미식회', '#신동엽인생안심', '#블루리본', '#웻에이징', '#약1000시간', '#안심', '#안심추리', '#새우살', '#알등심', '#안창살']",2021-05-22,0.0,청담동 뜨락
11,60,지난주 다녀왔던 아늑한 이곳..#뜨락🕳🕳🕳#한우맛집#청담동뜨락#수요미식회#신동엽의인생안심#맛집스타그램#아늑한#친절한#분위기#사진스타그램#사진#오늘아님,"['#뜨락🕳🕳🕳', '#한우맛집', '#청담동뜨락', '#수요미식회', '#신동엽의인생안심', '#맛집스타그램', '#아늑한', '#친절한', '#분위기', '#사진스타그램', '#사진', '#오늘아님']",2021-04-19,0.0,
12,76,.신동엽의 인생안심 #뜨락고기를 익히고 저 종(?)안에서 레스팅을 해준다#청담동뜨락 #청담동한우#소고기 #한우 #안심🥩#한번쯤은가볼만한곳2021.03.14,"['#뜨락고기를', '#청담동뜨락', '#청담동한우', '#소고기', '#한우', '#안심🥩', '#한번쯤은가볼만한곳2021.03.14']",2021-03-17,0.0,뜨락
13,80,⠀#청담동 #뜨락수요미식회에서 신동엽의 인생 안심으로 소개되기도 했는데차원이 다른 부드러움을 자랑한다🥩 녹네 녹아🙊💕도심 속 의외의 한적한 분위기가 좋은 곳👍#안심 #등심 #냉이된장찌개⠀#맛스타그램 #먹스타그램 #맛집스타그램 #청담뜨락 #청담동뜨락 #청담동맛집 #청담맛집 #강남한우맛집 #청담한우맛집 #한우맛집 #수요미식회 #수요미식회맛집 #신동엽인생안심 #주말 #일상 #daily #좋아요반사 #좋반 #likeforlikes #like4likes #l4l,"['#청담동', '#뜨락수요미식회에서', '#안심', '#등심', '#냉이된장찌개⠀', '#맛스타그램', '#먹스타그램', '#맛집스타그램', '#청담뜨락', '#청담동뜨락', '#청담동맛집', '#청담맛집', '#강남한우맛집', '#청담한우맛집', '#한우맛집', '#수요미식회', '#수요미식회맛집', '#신동엽인생안심', '#주말', '#일상', '#daily', '#좋아요반사', '#좋반', '#likeforlikes', '#like4likes', '#l4l']",2021-03-07,0.0,청담동 뜨락
14,86,"수요미식회가 인정한 인생안심🐮ㆍ최상의 퀄리티, 부드러운 식감의 안심은숯불에 구워 더 맛있다😭ㆍ잘 구워진 안심에는 와인이 찰떡궁합🍷ㆍ고급스러운 분위기와 맛에 폭풍 극찬세례👏ㆍ📌서울 강남구 영동대로142길 13-3#서울맛집 #경기도맛집 #인생안심 #뜨락#소고기 #안심 #한우 #최고급한우 #강남맛집 #청담동맛집 #청담동뜨락 #와인 #레드와인 #수요미식회 #신동엽 #숯불 #숯불구이 #코스요리 #런치코스 #한우육회 #레스토랑 #스테이크 #연인과함께 #사랑하는사람 #데이트 #데이트코스추천 #외식 #가족외식 #회식 #모임","['#서울맛집', '#경기도맛집', '#인생안심', '#뜨락', '#소고기', '#안심', '#한우', '#최고급한우', '#강남맛집', '#청담동맛집', '#청담동뜨락', '#와인', '#레드와인', '#수요미식회', '#신동엽', '#숯불', '#숯불구이', '#코스요리', '#런치코스', '#한우육회', '#레스토랑', '#스테이크', '#연인과함께', '#사랑하는사람', '#데이트', '#데이트코스추천', '#외식', '#가족외식', '#회식', '#모임']",2021-02-05,0.0,청담동 뜨락
15,96,#청담동뜨락 #청담맛집 #압구정맛집 #압구정로데오맛집 #맛집추천 #맛스타그램 #먹스타그램 #청담 #도산공원맛집 #파인다이닝 #finedining #foodie #restaurant #레스토랑 #dinner .#수요미식회 에서 신동엽이 인생안심 이라며 극찬했던 숙성한우집#블루리본 만 8개 고기는 안심으로만 주문했는데 두께감과 마블링이 정말 #인생안심👍기본찬도 맛있다ㅜ#한우오마카세 코스요리를 먹으려면 3층 루프탑에서! (1인15만원),"['#청담동뜨락', '#청담맛집', '#압구정맛집', '#압구정로데오맛집', '#맛집추천', '#맛스타그램', '#먹스타그램', '#청담', '#도산공원맛집', '#파인다이닝', '#finedining', '#foodie', '#restaurant', '#레스토랑', '#dinner', '#수요미식회', '#블루리본', '#인생안심👍기본찬도', '#한우오마카세']",2020-12-16,0.0,청담동 뜨락
16,97,"청담동 ""뜨락""+안심, 비빔국수, 누룽지1) 한줄평: 고기는 씹는게 아니고 녹는것2) 맛평:- 먹지않아도 맛이 느껴지는것같은 비쥬얼. 씹고있다는 느낌이 안날정도로(?) 부드럽다잉👍- 비빔국수도 msg맛없이 매콤&깔끔- 누룽지 비싸긴해도 명란젓에 깔끔한 마무리로👍3) 추천메뉴: 안심4) 그외 기타서비스:- 분위기좋고 친절&서비스좋고👍- 2병까지 콜키지프리, 이상부터는 만원차지- 프라이빗룸 예약 가능(예약은 미리미리, 예약어려움)- 발렛 주차 무료재방문 97%#뜨락 #청담동뜨락 #청담동맛집 #강남맛집 #강남콜키지프리 #고기맛집 #소고기맛집 #안심맛집 #데이트맛집 #분위기좋은맛집 #청담동콜키지프리 #콜키지프리맛집 #콜키지프리 #수요미식회맛집 #신동엽맛집 #고기러버 #데이트장소맛집추천 #맛집투어 #맛집탐방 #맛스타그램 #먹스타그램 #푸드스타그램 #맛집맞팔 #맛스타맞팔 #먹팔환영 #먹스타맞팔 #맛스타맞팔 #오늘뭐먹지 #오늘뭐먹으까","['#뜨락', '#청담동뜨락', '#청담동맛집', '#강남맛집', '#강남콜키지프리', '#고기맛집', '#소고기맛집', '#안심맛집', '#데이트맛집', '#분위기좋은맛집', '#청담동콜키지프리', '#콜키지프리맛집', '#콜키지프리', '#수요미식회맛집', '#신동엽맛집', '#고기러버', '#데이트장소맛집추천', '#맛집투어', '#맛집탐방', '#맛스타그램', '#먹스타그램', '#푸드스타그램', '#맛집맞팔', '#맛스타맞팔', '#먹팔환영', '#먹스타맞팔', '#맛스타맞팔', '#오늘뭐먹지', '#오늘뭐먹으까']",2020-12-05,0.0,뜨락
17,99,"신동엽 인생 안심 맛집으로 유명한 뜨락, 인생 안심 할만 하다 👍🏻 보리굴비도 너무 고소 🙈#오늘의점심 #청담동뜨락 #뜨락 #청담맛집 #안심맛집 #청담동맛집","['#오늘의점심', '#청담동뜨락', '#뜨락', '#청담맛집', '#안심맛집', '#청담동맛집']",2020-12-02,0.0,뜨락
